[I 2026-07-17 12:11:54,779] Trial 90 finished with value: -3.257176855883602 and parameters: {'scalers': 'none', 'ratios': 'norm_ratio', 'imputers': 'mean', 'n_estimators': 2200, 'learning_rate': 0.3695440692967691, 'max_depth': 11, 'min_child_weight': 1, 'subsample': 0.6, 'colsample_bytree': 0.5, 'colsample_bylevel': 0.6, 'reg_alpha': 0.16151706982370367, 'reg_lambda': 1.6286654760156475e-06, 'gamma': 0.0007720121387584098}. Best is trial 90 with value: -3.257176855883602.
[I 2026-07-17 12:12:12,522] Trial 91 finished with value: -2.200380587174777 and parameters: {'scalers': 'none', 'ratios': 'norm_ratio', 'imputers': 'mean', 'n_estimators': 1300, 'learning_rate': 0.18803265670710742, 'max_depth': 11, 'min_child_weight': 1, 'subsample': 0.6, 'colsample_bytree': 0.5, 'colsample_bylevel': 0.6, 'reg_alpha': 0.015710701944105423, 'reg_lambda': 2.1209455658968693e-06, 'gamma': 0.0009460779018456277}. Best is trial 90 with value: -3.257176855883602.
[I 2026-07-17 12:12:31,035] Trial 92 finished with value: -2.326806674052687 and parameters: {'scalers': 'none', 'ratios': 'norm_ratio', 'imputers': 'mean', 'n_estimators': 1300, 'learning_rate': 0.3675869132932341, 'max_depth': 11, 'min_child_weight': 3, 'subsample': 0.6, 'colsample_bytree': 0.5, 'colsample_bylevel': 0.6, 'reg_alpha': 0.18451838148848798, 'reg_lambda': 1.8128486113342857e-06, 'gamma': 0.0006953100370391173}. Best is trial 90 with value: -3.257176855883602.
[I 2026-07-17 12:12:58,125] Trial 93 finished with value: -2.001150320146212 and parameters: {'scalers': 'none', 'ratios': 'norm_ratio', 'imputers': 'mean', 'n_estimators': 2200, 'learning_rate': 0.1789665912656637, 'max_depth': 11, 'min_child_weight': 3, 'subsample': 0.6, 'colsample_bytree': 0.5, 'colsample_bylevel': 0.6, 'reg_alpha': 0.012560776632513348, 'reg_lambda': 2.0712207256281464e-06, 'gamma': 0.0008302601867015182}. Best is trial 90 with value: -3.257176855883602.
[I 2026-07-17 12:13:20,518] Trial 94 finished with value: -1.9720787789587362 and parameters: {'scalers': 'none', 'ratios': 'norm_ratio', 'imputers': 'mean', 'n_estimators': 1800, 'learning_rate': 0.1846561944749873, 'max_depth': 11, 'min_child_weight': 3, 'subsample': 0.6, 'colsample_bytree': 0.5, 'colsample_bylevel': 0.6, 'reg_alpha': 0.01821674434645982, 'reg_lambda': 1.3877483713596926e-06, 'gamma': 0.001095854804195475}. Best is trial 90 with value: -3.257176855883602.
[I 2026-07-17 12:13:42,749] Trial 95 finished with value: -1.9595008347634892 and parameters: {'scalers': 'none', 'ratios': 'norm_ratio', 'imputers': 'mean', 'n_estimators': 1800, 'learning_rate': 0.18027836809908088, 'max_depth': 11, 'min_child_weight': 3, 'subsample': 0.6, 'colsample_bytree': 0.5, 'colsample_bylevel': 0.6, 'reg_alpha': 0.013715988081586005, 'reg_lambda': 2.0237248188627567e-06, 'gamma': 0.0008086010703934875}. Best is trial 90 with value: -3.257176855883602.
[I 2026-07-17 12:14:11,923] Trial 96 finished with value: -2.0185433694203154 and parameters: {'scalers': 'none', 'ratios': 'norm_ratio', 'imputers': 'mean', 'n_estimators': 1800, 'learning_rate': 0.17549246404726587, 'max_depth': 11, 'min_child_weight': 3, 'subsample': 0.6, 'colsample_bytree': 0.6, 'colsample_bylevel': 0.6, 'reg_alpha': 0.7489559979237098, 'reg_lambda': 2.0674522541301614e-06, 'gamma': 0.0009276684068958823}. Best is trial 90 with value: -3.257176855883602.
[I 2026-07-17 12:14:41,176] Trial 97 finished with value: -2.2088988375182534 and parameters: {'scalers': 'none', 'ratios': 'norm_ratio', 'imputers': 'mean', 'n_estimators': 1800, 'learning_rate': 0.28314158333424516, 'max_depth': 11, 'min_child_weight': 3, 'subsample': 0.6, 'colsample_bytree': 0.6, 'colsample_bylevel': 0.7, 'reg_alpha': 0.1781675477293432, 'reg_lambda': 1.021551004061166e-06, 'gamma': 0.0008403253354331712}. Best is trial 90 with value: -3.257176855883602.
[I 2026-07-17 12:15:19,597] Trial 98 finished with value: -3.0505689910056186 and parameters: {'scalers': 'none', 'ratios': 'norm_ratio', 'imputers': 'mean', 'n_estimators': 2450, 'learning_rate': 0.2868174010595657, 'max_depth': 11, 'min_child_weight': 1, 'subsample': 0.6, 'colsample_bytree': 0.5, 'colsample_bylevel': 0.6, 'reg_alpha': 0.20904115039576654, 'reg_lambda': 6.4965708739484705e-06, 'gamma': 0.0010035148313755355}. Best is trial 90 with value: -3.257176855883602.
[I 2026-07-17 12:16:13,830] Trial 99 finished with value: -3.417930028787442 and parameters: {'scalers': 'none', 'ratios': 'norm_ratio', 'imputers': 'mean', 'n_estimators': 2450, 'learning_rate': 0.30050037726175466, 'max_depth': 11, 'min_child_weight': 1, 'subsample': 0.6, 'colsample_bytree': 0.6, 'colsample_bylevel': 0.6, 'reg_alpha': 0.7497649769699192, 'reg_lambda': 6.921846178497624e-06, 'gamma': 0.0007467904490757246}. Best is trial 99 with value: -3.417930028787442.
[I 2026-07-17 12:17:08,905] Trial 100 finished with value: -3.327522691654941 and parameters: {'scalers': 'none', 'ratios': 'norm_ratio', 'imputers': 'mean', 'n_estimators': 2450, 'learning_rate': 0.2813819637675985, 'max_depth': 11, 'min_child_weight': 1, 'subsample': 0.6, 'colsample_bytree': 0.6, 'colsample_bylevel': 0.7, 'reg_alpha': 0.6335394691597626, 'reg_lambda': 1.1472990400289543e-06, 'gamma': 0.0009017433964704873}. Best is trial 99 with value: -3.417930028787442.
[I 2026-07-17 12:18:17,183] Trial 101 finished with value: -3.446560196027357 and parameters: {'scalers': 'none', 'ratios': 'norm_ratio', 'imputers': 'mean', 'n_estimators': 2550, 'learning_rate': 0.28716500418043056, 'max_depth': 12, 'min_child_weight': 1, 'subsample': 0.6, 'colsample_bytree': 0.6, 'colsample_bylevel': 0.7, 'reg_alpha': 0.7543082257947341, 'reg_lambda': 6.592971512580053e-06, 'gamma': 0.00029773546868752307}. Best is trial 101 with value: -3.446560196027357.
[I 2026-07-17 12:19:18,074] Trial 103 finished with value: -1.548339911352927 and parameters: {'scalers': 'none', 'ratios': 'norm_ratio', 'imputers': 'mean', 'n_estimators': 1200, 'learning_rate': 0.2992932367476966, 'max_depth': 12, 'min_child_weight': 1, 'subsample': 0.6, 'colsample_bytree': 0.6, 'colsample_bylevel': 0.7, 'reg_alpha': 0.7770221809724743, 'reg_lambda': 8.350100729671714e-06, 'gamma': 90.8283714946021}. Best is trial 101 with value: -3.446560196027357.
[I 2026-07-17 12:19:23,032] Trial 102 finished with value: -3.4322581573052178 and parameters: {'scalers': 'none', 'ratios': 'norm_ratio', 'imputers': 'mean', 'n_estimators': 2500, 'learning_rate': 0.3060128689389842, 'max_depth': 12, 'min_child_weight': 1, 'subsample': 0.6, 'colsample_bytree': 0.6, 'colsample_bylevel': 0.7, 'reg_alpha': 0.6267738956811375, 'reg_lambda': 1.0078227191185148e-06, 'gamma': 0.002080342836158823}. Best is trial 101 with value: -3.446560196027357.
[I 2026-07-17 12:20:17,078] Trial 104 finished with value: -2.98129446018929 and parameters: {'scalers': 'none', 'ratios': 'norm_ratio', 'imputers': 'mean', 'n_estimators': 2550, 'learning_rate': 0.28223476328245034, 'max_depth': 12, 'min_child_weight': 1, 'subsample': 0.6, 'colsample_bytree': 0.6, 'colsample_bylevel': 0.7, 'reg_alpha': 0.16655644436623085, 'reg_lambda': 6.6237549280754384e-06, 'gamma': 0.00031218675513904157}. Best is trial 101 with value: -3.446560196027357.
[I 2026-07-17 12:21:18,547] Trial 105 finished with value: -3.427844621838446 and parameters: {'scalers': 'none', 'ratios': 'norm_ratio', 'imputers': 'mean', 'n_estimators': 2450, 'learning_rate': 0.2725158220139145, 'max_depth': 12, 'min_child_weight': 1, 'subsample': 0.5, 'colsample_bytree': 0.6, 'colsample_bylevel': 0.7, 'reg_alpha': 0.701515931088253, 'reg_lambda': 3.2640449424056e-06, 'gamma': 0.0003094646797156173}. Best is trial 101 with value: -3.446560196027357.
[I 2026-07-17 12:22:19,336] Trial 106 finished with value: -4.163737519722972 and parameters: {'scalers': 'none', 'ratios': 'norm_ratio', 'imputers': 'mean', 'n_estimators': 2450, 'learning_rate': 0.409363820396919, 'max_depth': 12, 'min_child_weight': 1, 'subsample': 0.5, 'colsample_bytree': 0.6, 'colsample_bylevel': 0.6, 'reg_alpha': 0.7062546524872686, 'reg_lambda': 6.742426112911318e-06, 'gamma': 0.00033750673214812365}. Best is trial 106 with value: -4.163737519722972.
[I 2026-07-17 12:23:14,849] Trial 107 finished with value: -2.4381351259529334 and parameters: {'scalers': 'none', 'ratios': 'norm_ratio', 'imputers': 'mean', 'n_estimators': 2450, 'learning_rate': 0.0718169817297713, 'max_depth': 12, 'min_child_weight': 1, 'subsample': 0.5, 'colsample_bytree': 0.6, 'colsample_bylevel': 0.6, 'reg_alpha': 0.6525829291125157, 'reg_lambda': 7.662839661009381e-06, 'gamma': 0.00030657813319086644}. Best is trial 106 with value: -4.163737519722972.
[I 2026-07-17 12:24:19,357] Trial 108 finished with value: -3.3978373056414592 and parameters: {'scalers': 'none', 'ratios': 'norm_ratio', 'imputers': 'mean', 'n_estimators': 2550, 'learning_rate': 0.27868491794784467, 'max_depth': 12, 'min_child_weight': 1, 'subsample': 0.6, 'colsample_bytree': 0.6, 'colsample_bylevel': 0.6, 'reg_alpha': 0.6999963794798086, 'reg_lambda': 2.7960944349455418e-06, 'gamma': 0.0003448447983971722}. Best is trial 106 with value: -4.163737519722972.
[I 2026-07-17 12:25:25,342] Trial 109 finished with value: -3.3486618399559793 and parameters: {'scalers': 'none', 'ratios': 'norm_ratio', 'imputers': 'mean', 'n_estimators': 2500, 'learning_rate': 0.28676159001532486, 'max_depth': 12, 'min_child_weight': 1, 'subsample': 0.6, 'colsample_bytree': 0.6, 'colsample_bylevel': 0.7, 'reg_alpha': 0.6372129705017439, 'reg_lambda': 6.970435274642807e-06, 'gamma': 0.00024033020763152517}. Best is trial 106 with value: -4.163737519722972.
[I 2026-07-17 12:26:17,723] Trial 110 finished with value: -2.9627776797523975 and parameters: {'scalers': 'none', 'ratios': 'norm_ratio', 'imputers': 'mean', 'n_estimators': 2500, 'learning_rate': 0.276341533818861, 'max_depth': 12, 'min_child_weight': 1, 'subsample': 0.6, 'colsample_bytree': 0.6, 'colsample_bylevel': 0.7, 'reg_alpha': 0.15662219101315789, 'reg_lambda': 6.816915134243242e-06, 'gamma': 0.0003234644174111436}. Best is trial 106 with value: -4.163737519722972.
[I 2026-07-17 12:27:10,086] Trial 111 finished with value: -3.023738217318953 and parameters: {'scalers': 'none', 'ratios': 'norm_ratio', 'imputers': 'mean', 'n_estimators': 2450, 'learning_rate': 0.29334472228501257, 'max_depth': 12, 'min_child_weight': 1, 'subsample': 0.6, 'colsample_bytree': 0.6, 'colsample_bylevel': 0.7, 'reg_alpha': 0.18037001668045977, 'reg_lambda': 2.7932217705891828e-06, 'gamma': 0.00029097564634137713}. Best is trial 106 with value: -4.163737519722972.
[I 2026-07-17 12:28:13,119] Trial 112 finished with value: -3.2817629647517097 and parameters: {'scalers': 'none', 'ratios': 'norm_ratio', 'imputers': 'mean', 'n_estimators': 2450, 'learning_rate': 0.28816149502473853, 'max_depth': 12, 'min_child_weight': 1, 'subsample': 0.6, 'colsample_bytree': 0.6, 'colsample_bylevel': 0.7, 'reg_alpha': 0.570867766297566, 'reg_lambda': 3.340708884076726e-06, 'gamma': 0.00033101900375364724}. Best is trial 106 with value: -4.163737519722972.
[I 2026-07-17 12:28:19,520] Trial 113 finished with value: -1.2898027904270792 and parameters: {'scalers': 'none', 'ratios': 'norm_ratio', 'imputers': 'mean', 'n_estimators': 2450, 'learning_rate': 0.07739215049339067, 'max_depth': 12, 'min_child_weight': 1, 'subsample': 0.6, 'colsample_bytree': 0.6, 'colsample_bylevel': 0.7, 'reg_alpha': 12.375334024669115, 'reg_lambda': 3.087999105556375e-06, 'gamma': 0.00029027552056002173}. Best is trial 106 with value: -4.163737519722972.
[I 2026-07-17 12:29:22,612] Trial 114 finished with value: -3.373249238217922 and parameters: {'scalers': 'none', 'ratios': 'norm_ratio', 'imputers': 'none', 'n_estimators': 2450, 'learning_rate': 0.3050977794003083, 'max_depth': 12, 'min_child_weight': 1, 'subsample': 0.6, 'colsample_bytree': 0.6, 'colsample_bylevel': 0.7, 'reg_alpha': 0.606540341653299, 'reg_lambda': 2.8428282475105823e-06, 'gamma': 0.0002662730914610263}. Best is trial 106 with value: -4.163737519722972.
[I 2026-07-17 12:30:34,769] Trial 115 finished with value: -3.8377400424905845 and parameters: {'scalers': 'none', 'ratios': 'norm_ratio', 'imputers': 'none', 'n_estimators': 2750, 'learning_rate': 0.41940594880738585, 'max_depth': 12, 'min_child_weight': 1, 'subsample': 0.6, 'colsample_bytree': 0.6, 'colsample_bylevel': 0.7, 'reg_alpha': 0.5682758581983612, 'reg_lambda': 3.011083683520094e-06, 'gamma': 8.715398290138386e-05}. Best is trial 106 with value: -4.163737519722972.
[I 2026-07-17 12:31:30,645] Trial 116 finished with value: -2.9073935208421022 and parameters: {'scalers': 'none', 'ratios': 'norm_ratio', 'imputers': 'none', 'n_estimators': 2750, 'learning_rate': 0.2769146253958953, 'max_depth': 12, 'min_child_weight': 1, 'subsample': 0.6, 'colsample_bytree': 0.6, 'colsample_bylevel': 0.7, 'reg_alpha': 0.13882348093234156, 'reg_lambda': 3.028295734999475e-06, 'gamma': 5.086904673125681e-05}. Best is trial 106 with value: -4.163737519722972.
[I 2026-07-17 12:32:10,833] Trial 117 finished with value: -1.2675513400006282 and parameters: {'scalers': 'none', 'ratios': 'norm_ratio', 'imputers': 'none', 'n_estimators': 2700, 'learning_rate': 0.0016453783364691725, 'max_depth': 12, 'min_child_weight': 6, 'subsample': 0.6, 'colsample_bytree': 0.6, 'colsample_bylevel': 0.7, 'reg_alpha': 0.02934115642024454, 'reg_lambda': 2.746381778769483e-06, 'gamma': 6.755648985818433e-05}. Best is trial 106 with value: -4.163737519722972.
[I 2026-07-17 12:33:27,631] Trial 118 finished with value: -1.5633594912677957 and parameters: {'scalers': 'none', 'ratios': 'norm_ratio', 'imputers': 'mean', 'n_estimators': 2750, 'learning_rate': 0.003625527118361186, 'max_depth': 12, 'min_child_weight': 1, 'subsample': 0.6, 'colsample_bytree': 0.6, 'colsample_bylevel': 0.7, 'reg_alpha': 0.5827833225115816, 'reg_lambda': 2.794447745853757e-06, 'gamma': 0.00011815006855631468}. Best is trial 106 with value: -4.163737519722972.
[I 2026-07-17 12:34:18,552] Trial 119 finished with value: -3.165476170036497 and parameters: {'scalers': 'none', 'ratios': 'norm_ratio', 'imputers': 'none', 'n_estimators': 2700, 'learning_rate': 0.4219608364805174, 'max_depth': 12, 'min_child_weight': 1, 'subsample': 0.6, 'colsample_bytree': 0.6, 'colsample_bylevel': 0.7, 'reg_alpha': 0.02644317891640244, 'reg_lambda': 1.0598044749121329e-06, 'gamma': 0.0001344290463179405}. Best is trial 106 with value: -4.163737519722972.
[I 2026-07-17 12:35:29,097] Trial 120 finished with value: -3.9206546446131822 and parameters: {'scalers': 'none', 'ratios': 'norm_ratio', 'imputers': 'none', 'n_estimators': 2700, 'learning_rate': 0.41611160309277073, 'max_depth': 12, 'min_child_weight': 1, 'subsample': 0.6, 'colsample_bytree': 0.6, 'colsample_bylevel': 0.7, 'reg_alpha': 0.526641128747243, 'reg_lambda': 1.1695926345605268e-06, 'gamma': 8.954679021385312e-05}. Best is trial 106 with value: -4.163737519722972.
[I 2026-07-17 12:36:49,528] Trial 121 finished with value: -1.6755368372775985 and parameters: {'scalers': 'none', 'ratios': 'norm_ratio', 'imputers': 'none', 'n_estimators': 2750, 'learning_rate': 0.0055465971206493814, 'max_depth': 12, 'min_child_weight': 1, 'subsample': 0.6, 'colsample_bytree': 0.6, 'colsample_bylevel': 0.7, 'reg_alpha': 0.5680177896938986, 'reg_lambda': 1.1360409103639933e-06, 'gamma': 0.00013845738792708177}. Best is trial 106 with value: -4.163737519722972.
[I 2026-07-17 12:37:58,651] Trial 122 finished with value: -3.0772633949495725 and parameters: {'scalers': 'none', 'ratios': 'norm_ratio', 'imputers': 'none', 'n_estimators': 2750, 'learning_rate': 0.20451738125298108, 'max_depth': 12, 'min_child_weight': 1, 'subsample': 0.6, 'colsample_bytree': 0.6, 'colsample_bylevel': 0.7, 'reg_alpha': 0.5821711060487789, 'reg_lambda': 1.459040626531266e-06, 'gamma': 8.580622362281471e-05}. Best is trial 106 with value: -4.163737519722972.
[I 2026-07-17 12:38:44,208] Trial 123 finished with value: -1.4186023212917271 and parameters: {'scalers': 'none', 'ratios': 'norm_ratio', 'imputers': 'none', 'n_estimators': 2750, 'learning_rate': 0.005344285704323227, 'max_depth': 12, 'min_child_weight': 6, 'subsample': 0.6, 'colsample_bytree': 0.6, 'colsample_bylevel': 0.7, 'reg_alpha': 0.6005790365619023, 'reg_lambda': 1.165752137218767e-06, 'gamma': 8.04496205203859e-05}. Best is trial 106 with value: -4.163737519722972.
[I 2026-07-17 12:39:53,669] Trial 124 finished with value: -3.771231826752796 and parameters: {'scalers': 'none', 'ratios': 'norm_ratio', 'imputers': 'none', 'n_estimators': 2650, 'learning_rate': 0.41923650681003, 'max_depth': 12, 'min_child_weight': 1, 'subsample': 0.6, 'colsample_bytree': 0.6, 'colsample_bylevel': 0.7, 'reg_alpha': 0.4891014212600415, 'reg_lambda': 1.3848588472980493e-06, 'gamma': 0.00010742825063362176}. Best is trial 106 with value: -4.163737519722972.
[I 2026-07-17 12:40:58,793] Trial 125 finished with value: -3.105211914144521 and parameters: {'scalers': 'none', 'ratios': 'norm_ratio', 'imputers': 'none', 'n_estimators': 2600, 'learning_rate': 0.21205058473597746, 'max_depth': 12, 'min_child_weight': 1, 'subsample': 0.6, 'colsample_bytree': 0.6, 'colsample_bylevel': 0.7, 'reg_alpha': 0.5897428168353789, 'reg_lambda': 4.8579223032828665e-06, 'gamma': 0.00014603840082352295}. Best is trial 106 with value: -4.163737519722972.
[I 2026-07-17 12:42:12,299] Trial 126 finished with value: -2.9069392416731246 and parameters: {'scalers': 'none', 'ratios': 'norm_ratio', 'imputers': 'none', 'n_estimators': 3000, 'learning_rate': 0.15631188035205137, 'max_depth': 12, 'min_child_weight': 1, 'subsample': 0.6, 'colsample_bytree': 0.6, 'colsample_bylevel': 0.7, 'reg_alpha': 0.5358629703433031, 'reg_lambda': 1.0855284114803863e-06, 'gamma': 0.00017121683030023245}. Best is trial 106 with value: -4.163737519722972.
[I 2026-07-17 12:43:05,937] Trial 127 finished with value: -4.436303922861889 and parameters: {'scalers': 'none', 'ratios': 'norm_ratio', 'imputers': 'none', 'n_estimators': 3000, 'learning_rate': 0.4161638675122749, 'max_depth': 12, 'min_child_weight': 1, 'subsample': 0.6, 'colsample_bytree': 0.6, 'colsample_bylevel': 0.7, 'reg_alpha': 2.98765380662353, 'reg_lambda': 1.3233331376857409e-06, 'gamma': 0.00019531245975436536}. Best is trial 127 with value: -4.436303922861889.
[I 2026-07-17 12:44:26,122] Trial 128 finished with value: -3.9774515088082643 and parameters: {'scalers': 'none', 'ratios': 'norm_ratio', 'imputers': 'none', 'n_estimators': 2950, 'learning_rate': 0.42644713852643845, 'max_depth': 12, 'min_child_weight': 1, 'subsample': 0.6, 'colsample_bytree': 0.6, 'colsample_bylevel': 0.7, 'reg_alpha': 0.6139349902968045, 'reg_lambda': 1.2530853137293476e-06, 'gamma': 0.00018666111493699752}. Best is trial 127 with value: -4.436303922861889.
[I 2026-07-17 12:45:10,131] Trial 129 finished with value: -2.563918108152154 and parameters: {'scalers': 'none', 'ratios': 'norm_ratio', 'imputers': 'none', 'n_estimators': 2950, 'learning_rate': 0.19980891402904538, 'max_depth': 12, 'min_child_weight': 1, 'subsample': 0.6, 'colsample_bytree': 0.6, 'colsample_bylevel': 0.7, 'reg_alpha': 3.047311100836768, 'reg_lambda': 69.85381985969771, 'gamma': 0.0005213371670065569}. Best is trial 127 with value: -4.436303922861889.
[I 2026-07-17 12:45:51,516] Trial 130 finished with value: -3.0946147058677806 and parameters: {'scalers': 'none', 'ratios': 'norm_ratio', 'imputers': 'none', 'n_estimators': 2350, 'learning_rate': 0.3063466098571376, 'max_depth': 12, 'min_child_weight': 1, 'subsample': 0.6, 'colsample_bytree': 0.6, 'colsample_bylevel': 0.7, 'reg_alpha': 2.9315242423030554, 'reg_lambda': 4.925141833383289e-06, 'gamma': 0.00048418656066832606}. Best is trial 127 with value: -4.436303922861889.
[I 2026-07-17 12:47:04,097] Trial 131 finished with value: -3.9881368924453984 and parameters: {'scalers': 'none', 'ratios': 'norm_ratio', 'imputers': 'none', 'n_estimators': 2350, 'learning_rate': 0.42888960759825934, 'max_depth': 12, 'min_child_weight': 1, 'subsample': 0.6, 'colsample_bytree': 0.6, 'colsample_bylevel': 0.8, 'reg_alpha': 0.8839719005945451, 'reg_lambda': 4.039711549137438e-06, 'gamma': 0.0005278204814606068}. Best is trial 127 with value: -4.436303922861889.
[I 2026-07-17 12:47:48,019] Trial 132 finished with value: -1.4442652999838317 and parameters: {'scalers': 'none', 'ratios': 'norm_ratio', 'imputers': 'none', 'n_estimators': 2900, 'learning_rate': 0.0001845038288390846, 'max_depth': 12, 'min_child_weight': 1, 'subsample': 0.6, 'colsample_bytree': 0.6, 'colsample_bylevel': 0.7, 'reg_alpha': 0.9460747348747407, 'reg_lambda': 75.32330248456732, 'gamma': 0.00019603997125686146}. Best is trial 127 with value: -4.436303922861889.
[I 2026-07-17 12:48:44,379] Trial 133 finished with value: -4.352468319520386 and parameters: {'scalers': 'none', 'ratios': 'norm_ratio', 'imputers': 'none', 'n_estimators': 2950, 'learning_rate': 0.4166790619248804, 'max_depth': 12, 'min_child_weight': 1, 'subsample': 0.6, 'colsample_bytree': 0.6, 'colsample_bylevel': 0.8, 'reg_alpha': 3.3839535267319008, 'reg_lambda': 5.336975528394024e-06, 'gamma': 0.00045222413881591464}. Best is trial 127 with value: -4.436303922861889.
[I 2026-07-17 12:49:31,736] Trial 134 finished with value: -4.23826070069572 and parameters: {'scalers': 'none', 'ratios': 'norm_ratio', 'imputers': 'none', 'n_estimators': 2350, 'learning_rate': 0.41768966328930013, 'max_depth': 12, 'min_child_weight': 1, 'subsample': 0.6, 'colsample_bytree': 0.6, 'colsample_bylevel': 0.8, 'reg_alpha': 2.9353592998957985, 'reg_lambda': 4.648635305703982e-06, 'gamma': 0.0005239812620575812}. Best is trial 127 with value: -4.436303922861889.
