[I 2026-07-17 14:06:46,786] A new study created in RDB with name: residual_study_v2
[I 2026-07-17 14:06:58,231] Trial 2 finished with value: -0.06355102067376614 and parameters: {'scalers': 'robust', 'ratios': 'norm_ratio', 'imputers': 'none', 'n_estimators': 2950, 'learning_rate': 0.0075993019026176205, 'max_depth': 7, 'min_child_weight': 4, 'subsample': 0.5, 'colsample_bytree': 0.5, 'colsample_bylevel': 0.8, 'reg_alpha': 1.5832795021592758, 'reg_lambda': 4.282314831961323, 'gamma': 0.029522964636426684}. Best is trial 2 with value: -0.06355102067376614.
[I 2026-07-17 14:07:16,717] Trial 1 finished with value: -0.05643937950377878 and parameters: {'scalers': 'none', 'ratios': 'norm_ratio', 'imputers': 'none', 'n_estimators': 1800, 'learning_rate': 0.0007002218387335004, 'max_depth': 10, 'min_child_weight': 2, 'subsample': 0.7, 'colsample_bytree': 0.8, 'colsample_bylevel': 0.8, 'reg_alpha': 1.1390268739535365, 'reg_lambda': 0.00034127431904129406, 'gamma': 0.00023748096586025875}. Best is trial 2 with value: -0.06355102067376614.
[I 2026-07-17 14:07:21,505] Trial 0 finished with value: -0.0732793408669586 and parameters: {'scalers': 'robust', 'ratios': 'norm_ratio', 'imputers': 'median', 'n_estimators': 1500, 'learning_rate': 0.020735567008748613, 'max_depth': 7, 'min_child_weight': 5, 'subsample': 0.5, 'colsample_bytree': 0.6, 'colsample_bylevel': 0.5, 'reg_alpha': 0.022082178084701403, 'reg_lambda': 0.0014276458610031476, 'gamma': 0.027262767789605426}. Best is trial 0 with value: -0.0732793408669586.
[I 2026-07-17 14:07:24,456] Trial 5 finished with value: -0.0554055246981554 and parameters: {'scalers': 'standard', 'ratios': 'norm_ratio', 'imputers': 'median', 'n_estimators': 2750, 'learning_rate': 0.00037729520130329005, 'max_depth': 4, 'min_child_weight': 7, 'subsample': 0.6, 'colsample_bytree': 0.8, 'colsample_bylevel': 0.9, 'reg_alpha': 0.0014226647091608348, 'reg_lambda': 0.05208731612684696, 'gamma': 6.931927678319796}. Best is trial 0 with value: -0.0732793408669586.
[I 2026-07-17 14:07:27,916] Trial 3 finished with value: -0.05542305820635789 and parameters: {'scalers': 'none', 'ratios': 'norm_ratio', 'imputers': 'mean', 'n_estimators': 2850, 'learning_rate': 0.00020431894520779223, 'max_depth': 7, 'min_child_weight': 6, 'subsample': 1.0, 'colsample_bytree': 0.5, 'colsample_bylevel': 0.8, 'reg_alpha': 54.40880001314286, 'reg_lambda': 0.00044439593930412785, 'gamma': 7.2465744428348006e-06}. Best is trial 0 with value: -0.0732793408669586.
[I 2026-07-17 14:07:28,515] Trial 4 finished with value: -0.05539477631766922 and parameters: {'scalers': 'robust', 'ratios': 'log_ratio', 'imputers': 'median', 'n_estimators': 550, 'learning_rate': 0.04509261360414505, 'max_depth': 7, 'min_child_weight': 7, 'subsample': 0.9, 'colsample_bytree': 0.9, 'colsample_bylevel': 0.9, 'reg_alpha': 5.023042051279777e-06, 'reg_lambda': 1.3186105454916194e-06, 'gamma': 0.24288441431179494}. Best is trial 0 with value: -0.0732793408669586.
[I 2026-07-17 14:07:30,560] Trial 6 finished with value: -0.05539140818095594 and parameters: {'scalers': 'robust', 'ratios': 'norm_ratio', 'imputers': 'median', 'n_estimators': 2000, 'learning_rate': 0.004550701660693902, 'max_depth': 4, 'min_child_weight': 1, 'subsample': 0.5, 'colsample_bytree': 0.8, 'colsample_bylevel': 0.9, 'reg_alpha': 90.07620453539181, 'reg_lambda': 7.908174744284932e-05, 'gamma': 0.1917482173368818}. Best is trial 0 with value: -0.0732793408669586.
[I 2026-07-17 14:07:32,649] Trial 7 finished with value: -0.05547800527290309 and parameters: {'scalers': 'robust', 'ratios': 'log_ratio', 'imputers': 'mean', 'n_estimators': 1750, 'learning_rate': 0.258715677978671, 'max_depth': 11, 'min_child_weight': 5, 'subsample': 0.8, 'colsample_bytree': 0.6, 'colsample_bylevel': 0.8, 'reg_alpha': 0.07937296132345115, 'reg_lambda': 3.527168930336508, 'gamma': 0.7140638393447182}. Best is trial 0 with value: -0.0732793408669586.
[I 2026-07-17 14:07:35,185] Trial 8 finished with value: -0.05520723379374115 and parameters: {'scalers': 'standard', 'ratios': 'log_ratio', 'imputers': 'mean', 'n_estimators': 1600, 'learning_rate': 0.000651005763745503, 'max_depth': 3, 'min_child_weight': 5, 'subsample': 0.5, 'colsample_bytree': 0.5, 'colsample_bylevel': 0.5, 'reg_alpha': 1.019667224701338, 'reg_lambda': 4.633930317665246, 'gamma': 0.00034997813872892383}. Best is trial 0 with value: -0.0732793408669586.
[I 2026-07-17 14:07:35,490] Trial 9 finished with value: -0.055417204583569704 and parameters: {'scalers': 'none', 'ratios': 'log_ratio', 'imputers': 'none', 'n_estimators': 400, 'learning_rate': 0.0006340650511972943, 'max_depth': 5, 'min_child_weight': 1, 'subsample': 0.6, 'colsample_bytree': 0.7, 'colsample_bylevel': 0.7, 'reg_alpha': 1.6175961057864567e-05, 'reg_lambda': 1.4050928364404478, 'gamma': 5.431667514346798}. Best is trial 0 with value: -0.0732793408669586.
[I 2026-07-17 14:07:44,444] Trial 10 finished with value: -0.055618017834871 and parameters: {'scalers': 'robust', 'ratios': 'norm_ratio', 'imputers': 'mean', 'n_estimators': 2800, 'learning_rate': 0.0007635133714515899, 'max_depth': 7, 'min_child_weight': 10, 'subsample': 1.0, 'colsample_bytree': 0.6, 'colsample_bylevel': 0.6, 'reg_alpha': 3.2229585484561644e-06, 'reg_lambda': 2.2298225284544593, 'gamma': 0.06339861320625222}. Best is trial 0 with value: -0.0732793408669586.
[I 2026-07-17 14:07:57,173] Trial 11 finished with value: -0.1055239427764113 and parameters: {'scalers': 'none', 'ratios': 'log_ratio', 'imputers': 'mean', 'n_estimators': 2150, 'learning_rate': 0.15291212891501887, 'max_depth': 8, 'min_child_weight': 10, 'subsample': 0.7, 'colsample_bytree': 0.8, 'colsample_bylevel': 0.8, 'reg_alpha': 9.02046217559165e-06, 'reg_lambda': 0.00021545079295812213, 'gamma': 7.075671444535208e-05}. Best is trial 11 with value: -0.1055239427764113.
[I 2026-07-17 14:07:59,988] Trial 12 finished with value: -0.055414909786972735 and parameters: {'scalers': 'standard', 'ratios': 'norm_ratio', 'imputers': 'none', 'n_estimators': 2850, 'learning_rate': 0.00012207408484381295, 'max_depth': 12, 'min_child_weight': 9, 'subsample': 0.6, 'colsample_bytree': 0.6, 'colsample_bylevel': 0.7, 'reg_alpha': 26.041478736824846, 'reg_lambda': 0.013334083625848241, 'gamma': 0.00017659665160917637}. Best is trial 11 with value: -0.1055239427764113.
[I 2026-07-17 14:08:03,126] Trial 13 finished with value: -0.05542305820635789 and parameters: {'scalers': 'none', 'ratios': 'log_ratio', 'imputers': 'none', 'n_estimators': 2500, 'learning_rate': 0.02955498459615472, 'max_depth': 3, 'min_child_weight': 5, 'subsample': 1.0, 'colsample_bytree': 0.6, 'colsample_bylevel': 0.7, 'reg_alpha': 8.876806964997463e-05, 'reg_lambda': 0.17506708699394846, 'gamma': 6.618108545675283}. Best is trial 11 with value: -0.1055239427764113.
[I 2026-07-17 14:08:09,422] Trial 14 finished with value: -0.05765209729397502 and parameters: {'scalers': 'none', 'ratios': 'norm_ratio', 'imputers': 'mean', 'n_estimators': 2500, 'learning_rate': 0.00843763392667168, 'max_depth': 3, 'min_child_weight': 1, 'subsample': 1.0, 'colsample_bytree': 0.9, 'colsample_bylevel': 0.8, 'reg_alpha': 0.002614443434468171, 'reg_lambda': 13.19313677092318, 'gamma': 3.756089070332656e-05}. Best is trial 11 with value: -0.1055239427764113.
[I 2026-07-17 14:08:30,437] Trial 15 finished with value: -0.15885259407044372 and parameters: {'scalers': 'standard', 'ratios': 'norm_ratio', 'imputers': 'none', 'n_estimators': 2100, 'learning_rate': 0.47476003582002857, 'max_depth': 10, 'min_child_weight': 6, 'subsample': 0.9, 'colsample_bytree': 1.0, 'colsample_bylevel': 0.9, 'reg_alpha': 0.004095325580248035, 'reg_lambda': 0.013975384604958344, 'gamma': 0.0006411855085301739}. Best is trial 15 with value: -0.15885259407044372.
[I 2026-07-17 14:08:32,629] Trial 16 finished with value: -0.055395776818850814 and parameters: {'scalers': 'robust', 'ratios': 'norm_ratio', 'imputers': 'median', 'n_estimators': 2050, 'learning_rate': 0.013023014305025839, 'max_depth': 11, 'min_child_weight': 10, 'subsample': 0.6, 'colsample_bytree': 0.7, 'colsample_bylevel': 1.0, 'reg_alpha': 7.492434040972481e-05, 'reg_lambda': 0.0008995321358899455, 'gamma': 12.999039003161895}. Best is trial 15 with value: -0.15885259407044372.
[I 2026-07-17 14:08:39,455] Trial 17 finished with value: -0.10069861772906033 and parameters: {'scalers': 'robust', 'ratios': 'norm_ratio', 'imputers': 'median', 'n_estimators': 1100, 'learning_rate': 0.24509360567235056, 'max_depth': 9, 'min_child_weight': 9, 'subsample': 1.0, 'colsample_bytree': 1.0, 'colsample_bylevel': 0.5, 'reg_alpha': 0.0008555241267001306, 'reg_lambda': 0.02480645716206586, 'gamma': 1.6464069580890383e-06}. Best is trial 15 with value: -0.15885259407044372.
[I 2026-07-17 14:08:45,463] Trial 18 finished with value: -0.0715909157371445 and parameters: {'scalers': 'robust', 'ratios': 'norm_ratio', 'imputers': 'none', 'n_estimators': 1200, 'learning_rate': 0.009733636912102972, 'max_depth': 9, 'min_child_weight': 3, 'subsample': 0.5, 'colsample_bytree': 0.6, 'colsample_bylevel': 0.5, 'reg_alpha': 0.0043398766716769566, 'reg_lambda': 0.035261896595185124, 'gamma': 0.00764284202879895}. Best is trial 15 with value: -0.15885259407044372.
[I 2026-07-17 14:08:52,460] Trial 19 finished with value: -0.13414766714687887 and parameters: {'scalers': 'none', 'ratios': 'log_ratio', 'imputers': 'median', 'n_estimators': 1150, 'learning_rate': 0.4816261521592466, 'max_depth': 9, 'min_child_weight': 10, 'subsample': 0.7, 'colsample_bytree': 1.0, 'colsample_bylevel': 0.5, 'reg_alpha': 0.0003154389123815073, 'reg_lambda': 0.012240528365168984, 'gamma': 0.0028894588680060656}. Best is trial 15 with value: -0.15885259407044372.
[I 2026-07-17 14:08:59,125] Trial 20 finished with value: -0.12544036259947347 and parameters: {'scalers': 'none', 'ratios': 'log_ratio', 'imputers': 'median', 'n_estimators': 1050, 'learning_rate': 0.4339136862238024, 'max_depth': 9, 'min_child_weight': 9, 'subsample': 0.8, 'colsample_bytree': 1.0, 'colsample_bylevel': 0.5, 'reg_alpha': 0.0004681992303752124, 'reg_lambda': 1.1247335645929559e-05, 'gamma': 0.002658609955572876}. Best is trial 15 with value: -0.15885259407044372.
[I 2026-07-17 14:09:11,558] Trial 21 finished with value: -0.09932602643616098 and parameters: {'scalers': 'none', 'ratios': 'log_ratio', 'imputers': 'median', 'n_estimators': 1450, 'learning_rate': 0.14261603781655272, 'max_depth': 9, 'min_child_weight': 9, 'subsample': 0.7, 'colsample_bytree': 1.0, 'colsample_bylevel': 1.0, 'reg_alpha': 0.0010467637379186702, 'reg_lambda': 1.8350520231914532e-05, 'gamma': 1.1278350952348458e-06}. Best is trial 15 with value: -0.15885259407044372.
[I 2026-07-17 14:09:19,978] Trial 22 finished with value: -0.11815192603577655 and parameters: {'scalers': 'robust', 'ratios': 'log_ratio', 'imputers': 'median', 'n_estimators': 1150, 'learning_rate': 0.29573884665169314, 'max_depth': 9, 'min_child_weight': 9, 'subsample': 0.7, 'colsample_bytree': 0.7, 'colsample_bylevel': 1.0, 'reg_alpha': 0.00130955328811036, 'reg_lambda': 1.1895874106591612e-05, 'gamma': 0.005222751388250226}. Best is trial 15 with value: -0.15885259407044372.
[I 2026-07-17 14:09:31,665] Trial 23 finished with value: -0.13410658887385318 and parameters: {'scalers': 'standard', 'ratios': 'log_ratio', 'imputers': 'none', 'n_estimators': 1200, 'learning_rate': 0.49083277060922736, 'max_depth': 9, 'min_child_weight': 9, 'subsample': 0.8, 'colsample_bytree': 1.0, 'colsample_bylevel': 1.0, 'reg_alpha': 8.55019693966758e-05, 'reg_lambda': 1.457473393716896e-05, 'gamma': 0.002875544142318896}. Best is trial 15 with value: -0.15885259407044372.
[I 2026-07-17 14:09:41,518] Trial 24 finished with value: -0.13315398932467454 and parameters: {'scalers': 'standard', 'ratios': 'log_ratio', 'imputers': 'none', 'n_estimators': 1100, 'learning_rate': 0.44948973688581734, 'max_depth': 9, 'min_child_weight': 8, 'subsample': 0.8, 'colsample_bytree': 1.0, 'colsample_bylevel': 0.9, 'reg_alpha': 0.00042984582995584785, 'reg_lambda': 8.517165157079297e-06, 'gamma': 0.0025530432494956295}. Best is trial 15 with value: -0.15885259407044372.
[I 2026-07-17 14:09:51,729] Trial 25 finished with value: -0.08647346332944433 and parameters: {'scalers': 'standard', 'ratios': 'log_ratio', 'imputers': 'none', 'n_estimators': 1200, 'learning_rate': 0.09422319763824509, 'max_depth': 9, 'min_child_weight': 8, 'subsample': 0.8, 'colsample_bytree': 1.0, 'colsample_bylevel': 1.0, 'reg_alpha': 1.2798947824556668e-06, 'reg_lambda': 2.0235557985416246e-05, 'gamma': 0.0022713630963881693}. Best is trial 15 with value: -0.15885259407044372.
[I 2026-07-17 14:10:13,489] Trial 26 finished with value: -0.14998261291358275 and parameters: {'scalers': 'standard', 'ratios': 'log_ratio', 'imputers': 'mean', 'n_estimators': 2250, 'learning_rate': 0.49859492558043705, 'max_depth': 9, 'min_child_weight': 8, 'subsample': 0.8, 'colsample_bytree': 1.0, 'colsample_bylevel': 1.0, 'reg_alpha': 6.540892824234405e-05, 'reg_lambda': 1.6963731479654043e-05, 'gamma': 0.002477187320867863}. Best is trial 15 with value: -0.15885259407044372.
[I 2026-07-17 14:10:21,448] Trial 27 finished with value: -0.12427789087603601 and parameters: {'scalers': 'standard', 'ratios': 'log_ratio', 'imputers': 'none', 'n_estimators': 800, 'learning_rate': 0.4611905910923077, 'max_depth': 9, 'min_child_weight': 8, 'subsample': 0.8, 'colsample_bytree': 1.0, 'colsample_bylevel': 1.0, 'reg_alpha': 0.00023582247565599366, 'reg_lambda': 0.0036112988522551447, 'gamma': 0.0015447608421763515}. Best is trial 15 with value: -0.15885259407044372.
[I 2026-07-17 14:10:26,877] Trial 28 finished with value: -0.12426979454373557 and parameters: {'scalers': 'standard', 'ratios': 'log_ratio', 'imputers': 'median', 'n_estimators': 750, 'learning_rate': 0.4789276352931324, 'max_depth': 9, 'min_child_weight': 8, 'subsample': 0.8, 'colsample_bytree': 1.0, 'colsample_bylevel': 0.6, 'reg_alpha': 0.00016776327745977412, 'reg_lambda': 9.508018351574645e-06, 'gamma': 0.0025670194727592127}. Best is trial 15 with value: -0.15885259407044372.
[I 2026-07-17 14:10:32,674] Trial 29 finished with value: -0.1312007246949975 and parameters: {'scalers': 'standard', 'ratios': 'log_ratio', 'imputers': 'median', 'n_estimators': 700, 'learning_rate': 0.46259330891772493, 'max_depth': 10, 'min_child_weight': 8, 'subsample': 0.8, 'colsample_bytree': 1.0, 'colsample_bylevel': 0.6, 'reg_alpha': 0.00016468901365311104, 'reg_lambda': 0.003359759927555248, 'gamma': 0.0031817375984257196}. Best is trial 15 with value: -0.15885259407044372.
[I 2026-07-17 14:10:37,034] Trial 30 finished with value: -0.07705212957549565 and parameters: {'scalers': 'standard', 'ratios': 'log_ratio', 'imputers': 'median', 'n_estimators': 750, 'learning_rate': 0.0671194020865735, 'max_depth': 10, 'min_child_weight': 8, 'subsample': 0.8, 'colsample_bytree': 1.0, 'colsample_bylevel': 0.6, 'reg_alpha': 0.0001528844859519082, 'reg_lambda': 87.19032146626475, 'gamma': 0.00179464314731029}. Best is trial 15 with value: -0.15885259407044372.
[I 2026-07-17 14:10:42,858] Trial 31 finished with value: -0.07878222366330048 and parameters: {'scalers': 'standard', 'ratios': 'log_ratio', 'imputers': 'none', 'n_estimators': 850, 'learning_rate': 0.06426666407310593, 'max_depth': 10, 'min_child_weight': 7, 'subsample': 0.9, 'colsample_bytree': 0.9, 'colsample_bylevel': 0.6, 'reg_alpha': 0.00012353244990589662, 'reg_lambda': 0.004319937041647904, 'gamma': 0.0011921382461587329}. Best is trial 15 with value: -0.15885259407044372.
[I 2026-07-17 14:10:47,016] Trial 33 finished with value: -0.05541463947376197 and parameters: {'scalers': 'standard', 'ratios': 'log_ratio', 'imputers': 'none', 'n_estimators': 100, 'learning_rate': 0.10665689943947103, 'max_depth': 11, 'min_child_weight': 7, 'subsample': 0.9, 'colsample_bytree': 0.9, 'colsample_bylevel': 0.6, 'reg_alpha': 5.446528100143569e-05, 'reg_lambda': 0.00508105969779465, 'gamma': 89.5514333520944}. Best is trial 15 with value: -0.15885259407044372.
[I 2026-07-17 14:10:47,850] Trial 32 finished with value: -0.08021736278635579 and parameters: {'scalers': 'standard', 'ratios': 'log_ratio', 'imputers': 'none', 'n_estimators': 650, 'learning_rate': 0.07637828441689737, 'max_depth': 11, 'min_child_weight': 7, 'subsample': 0.9, 'colsample_bytree': 0.9, 'colsample_bylevel': 0.6, 'reg_alpha': 8.089996158580467e-05, 'reg_lambda': 0.003973849896465764, 'gamma': 0.0008395627742154414}. Best is trial 15 with value: -0.15885259407044372.
[I 2026-07-17 14:10:48,852] Trial 34 finished with value: -0.06481455952617696 and parameters: {'scalers': 'standard', 'ratios': 'log_ratio', 'imputers': 'mean', 'n_estimators': 100, 'learning_rate': 0.06982083973711917, 'max_depth': 11, 'min_child_weight': 7, 'subsample': 0.9, 'colsample_bytree': 0.9, 'colsample_bylevel': 0.6, 'reg_alpha': 0.013091787887398143, 'reg_lambda': 0.2818167537285966, 'gamma': 0.0006331430199877084}. Best is trial 15 with value: -0.15885259407044372.
[I 2026-07-17 14:11:06,026] Trial 35 finished with value: -0.09924482295285336 and parameters: {'scalers': 'standard', 'ratios': 'log_ratio', 'imputers': 'mean', 'n_estimators': 2400, 'learning_rate': 0.06958136857892849, 'max_depth': 11, 'min_child_weight': 7, 'subsample': 0.9, 'colsample_bytree': 0.9, 'colsample_bylevel': 0.6, 'reg_alpha': 0.02052453758355588, 'reg_lambda': 0.18527030950362489, 'gamma': 0.0006429735124914866}. Best is trial 15 with value: -0.15885259407044372.
[I 2026-07-17 14:11:23,638] Trial 36 finished with value: -0.10643643835912617 and parameters: {'scalers': 'standard', 'ratios': 'log_ratio', 'imputers': 'mean', 'n_estimators': 2350, 'learning_rate': 0.07346377177585767, 'max_depth': 11, 'min_child_weight': 6, 'subsample': 0.9, 'colsample_bytree': 0.9, 'colsample_bylevel': 0.6, 'reg_alpha': 0.020326869283760665, 'reg_lambda': 0.4215098913223959, 'gamma': 0.000502234135026665}. Best is trial 15 with value: -0.15885259407044372.
[I 2026-07-17 14:11:24,780] Trial 37 finished with value: -0.06260566653372678 and parameters: {'scalers': 'standard', 'ratios': 'log_ratio', 'imputers': 'mean', 'n_estimators': 100, 'learning_rate': 0.05278686299577871, 'max_depth': 11, 'min_child_weight': 6, 'subsample': 0.9, 'colsample_bytree': 0.9, 'colsample_bylevel': 0.9, 'reg_alpha': 0.016730775799501003, 'reg_lambda': 0.398892599311514, 'gamma': 0.0005440818805839959}. Best is trial 15 with value: -0.15885259407044372.
[I 2026-07-17 14:11:25,357] Trial 38 finished with value: -0.06546811209363237 and parameters: {'scalers': 'standard', 'ratios': 'log_ratio', 'imputers': 'none', 'n_estimators': 100, 'learning_rate': 0.160910228634205, 'max_depth': 8, 'min_child_weight': 6, 'subsample': 0.9, 'colsample_bytree': 0.9, 'colsample_bylevel': 0.9, 'reg_alpha': 0.012542153681021628, 'reg_lambda': 1.1377973626287573e-06, 'gamma': 0.0006619873549292715}. Best is trial 15 with value: -0.15885259407044372.
[I 2026-07-17 14:11:40,663] Trial 39 finished with value: -0.10765879070008709 and parameters: {'scalers': 'standard', 'ratios': 'log_ratio', 'imputers': 'mean', 'n_estimators': 2300, 'learning_rate': 0.14512018148795885, 'max_depth': 8, 'min_child_weight': 6, 'subsample': 0.9, 'colsample_bytree': 0.9, 'colsample_bylevel': 0.9, 'reg_alpha': 0.009802721970777238, 'reg_lambda': 0.22626488380091178, 'gamma': 0.016370210893542986}. Best is trial 15 with value: -0.15885259407044372.
[I 2026-07-17 14:11:55,704] Trial 40 finished with value: -0.11110929329485603 and parameters: {'scalers': 'standard', 'ratios': 'log_ratio', 'imputers': 'mean', 'n_estimators': 2250, 'learning_rate': 0.16546846399681103, 'max_depth': 8, 'min_child_weight': 6, 'subsample': 0.9, 'colsample_bytree': 0.9, 'colsample_bylevel': 0.9, 'reg_alpha': 0.012251660694138649, 'reg_lambda': 0.38059642086226625, 'gamma': 0.014196215875818803}. Best is trial 15 with value: -0.15885259407044372.
[I 2026-07-17 14:12:10,641] Trial 41 finished with value: -0.11832402650936383 and parameters: {'scalers': 'standard', 'ratios': 'log_ratio', 'imputers': 'mean', 'n_estimators': 2350, 'learning_rate': 0.1504068251928087, 'max_depth': 8, 'min_child_weight': 6, 'subsample': 0.7, 'colsample_bytree': 0.9, 'colsample_bylevel': 0.9, 'reg_alpha': 0.012214925121829196, 'reg_lambda': 1.3904165965599825e-06, 'gamma': 0.016593399927661363}. Best is trial 15 with value: -0.15885259407044372.
[I 2026-07-17 14:12:25,434] Trial 42 finished with value: -0.12508083339199538 and parameters: {'scalers': 'standard', 'ratios': 'norm_ratio', 'imputers': 'mean', 'n_estimators': 2250, 'learning_rate': 0.18234413883600623, 'max_depth': 8, 'min_child_weight': 6, 'subsample': 0.7, 'colsample_bytree': 0.9, 'colsample_bylevel': 0.9, 'reg_alpha': 0.03033083670603153, 'reg_lambda': 1.3959091114330572e-06, 'gamma': 0.018150862725764595}. Best is trial 15 with value: -0.15885259407044372.
[I 2026-07-17 14:12:41,912] Trial 43 finished with value: -0.12408324826703504 and parameters: {'scalers': 'none', 'ratios': 'norm_ratio', 'imputers': 'none', 'n_estimators': 2300, 'learning_rate': 0.18367170331892682, 'max_depth': 8, 'min_child_weight': 6, 'subsample': 0.7, 'colsample_bytree': 1.0, 'colsample_bylevel': 0.9, 'reg_alpha': 2.356486110363319e-05, 'reg_lambda': 1.0783965491077614e-06, 'gamma': 0.01443774352611774}. Best is trial 15 with value: -0.15885259407044372.
[I 2026-07-17 14:12:52,283] Trial 44 finished with value: -0.11389531651693846 and parameters: {'scalers': 'none', 'ratios': 'norm_ratio', 'imputers': 'none', 'n_estimators': 1400, 'learning_rate': 0.1848621262630953, 'max_depth': 8, 'min_child_weight': 6, 'subsample': 0.7, 'colsample_bytree': 1.0, 'colsample_bylevel': 0.9, 'reg_alpha': 0.12158752582856125, 'reg_lambda': 1.966985188846051e-06, 'gamma': 0.017435771035297518}. Best is trial 15 with value: -0.15885259407044372.
