[I 2026-07-17 15:29:35,240] Trial 315 finished with value: -0.2999132564145135 and parameters: {'scalers': 'none', 'ratios': 'norm_ratio', 'imputers': 'mean', 'n_estimators': 2000, 'learning_rate': 0.2325917146450165, 'max_depth': 12, 'min_child_weight': 2, 'subsample': 0.5, 'colsample_bytree': 0.8, 'colsample_bylevel': 0.6, 'reg_alpha': 0.027544047769573633, 'reg_lambda': 22.00173645534858, 'gamma': 7.550493801975924e-05}. Best is trial 279 with value: -5.114822455886268.
[I 2026-07-17 15:29:52,583] Trial 316 finished with value: -0.31232403121504004 and parameters: {'scalers': 'none', 'ratios': 'norm_ratio', 'imputers': 'mean', 'n_estimators': 1950, 'learning_rate': 0.25449635008409194, 'max_depth': 12, 'min_child_weight': 2, 'subsample': 0.5, 'colsample_bytree': 0.8, 'colsample_bylevel': 0.6, 'reg_alpha': 2.9483082500473486e-06, 'reg_lambda': 22.753036148095866, 'gamma': 7.451108140049619e-05}. Best is trial 279 with value: -5.114822455886268.
[I 2026-07-17 15:30:10,024] Trial 317 finished with value: -0.2925775709020883 and parameters: {'scalers': 'none', 'ratios': 'norm_ratio', 'imputers': 'mean', 'n_estimators': 2000, 'learning_rate': 0.2288639611666097, 'max_depth': 12, 'min_child_weight': 2, 'subsample': 0.5, 'colsample_bytree': 0.8, 'colsample_bylevel': 0.6, 'reg_alpha': 1.1146745223755989e-05, 'reg_lambda': 23.504326564164042, 'gamma': 7.021497739263102e-05}. Best is trial 279 with value: -5.114822455886268.
[I 2026-07-17 15:30:27,647] Trial 318 finished with value: -0.3002466538898013 and parameters: {'scalers': 'none', 'ratios': 'norm_ratio', 'imputers': 'mean', 'n_estimators': 2000, 'learning_rate': 0.2360340001176368, 'max_depth': 12, 'min_child_weight': 2, 'subsample': 0.5, 'colsample_bytree': 0.8, 'colsample_bylevel': 0.6, 'reg_alpha': 2.2558522869162586e-06, 'reg_lambda': 20.347105643062694, 'gamma': 8.036035036298341e-05}. Best is trial 279 with value: -5.114822455886268.
[I 2026-07-17 15:30:47,173] Trial 319 finished with value: -0.362497815682015 and parameters: {'scalers': 'none', 'ratios': 'norm_ratio', 'imputers': 'mean', 'n_estimators': 2000, 'learning_rate': 0.3610857327047213, 'max_depth': 12, 'min_child_weight': 2, 'subsample': 0.5, 'colsample_bytree': 0.8, 'colsample_bylevel': 0.6, 'reg_alpha': 4.331832257683791e-05, 'reg_lambda': 17.60798177613999, 'gamma': 0.00011487264018424732}. Best is trial 279 with value: -5.114822455886268.
