[I 2026-07-17 15:13:28,411] Trial 90 finished with value: -0.18494778703556916 and parameters: {'scalers': 'standard', 'ratios': 'norm_ratio', 'imputers': 'mean', 'n_estimators': 2950, 'learning_rate': 0.20398201314198255, 'max_depth': 9, 'min_child_weight': 4, 'subsample': 0.7, 'colsample_bytree': 0.5, 'colsample_bylevel': 0.6, 'reg_alpha': 0.00092504118749641, 'reg_lambda': 5.815175244124227, 'gamma': 0.0019593170546913013}. Best is trial 84 with value: -0.2366303824542712.
[I 2026-07-17 15:13:41,040] Trial 91 finished with value: -0.12269378403843587 and parameters: {'scalers': 'standard', 'ratios': 'norm_ratio', 'imputers': 'mean', 'n_estimators': 2950, 'learning_rate': 0.07108895154684881, 'max_depth': 9, 'min_child_weight': 4, 'subsample': 0.7, 'colsample_bytree': 0.5, 'colsample_bylevel': 0.6, 'reg_alpha': 0.0009048274420615425, 'reg_lambda': 5.965273518751728, 'gamma': 0.0018378763555986165}. Best is trial 84 with value: -0.2366303824542712.
[I 2026-07-17 15:13:56,557] Trial 92 finished with value: -0.20322001041524132 and parameters: {'scalers': 'standard', 'ratios': 'norm_ratio', 'imputers': 'mean', 'n_estimators': 2950, 'learning_rate': 0.21562259474534504, 'max_depth': 9, 'min_child_weight': 3, 'subsample': 0.8, 'colsample_bytree': 0.5, 'colsample_bylevel': 0.6, 'reg_alpha': 9.854768408174198e-06, 'reg_lambda': 5.114700058551915, 'gamma': 0.0025729438578525623}. Best is trial 84 with value: -0.2366303824542712.
[I 2026-07-17 15:14:10,713] Trial 93 finished with value: -0.18897132886219356 and parameters: {'scalers': 'standard', 'ratios': 'norm_ratio', 'imputers': 'mean', 'n_estimators': 2950, 'learning_rate': 0.20633121858710893, 'max_depth': 9, 'min_child_weight': 3, 'subsample': 0.7, 'colsample_bytree': 0.5, 'colsample_bylevel': 0.6, 'reg_alpha': 0.0008773545232512709, 'reg_lambda': 1.5952842080733913, 'gamma': 0.0016483198669145808}. Best is trial 84 with value: -0.2366303824542712.
[I 2026-07-17 15:14:23,136] Trial 94 finished with value: -0.12477776084478044 and parameters: {'scalers': 'standard', 'ratios': 'norm_ratio', 'imputers': 'mean', 'n_estimators': 2950, 'learning_rate': 0.07056654436752502, 'max_depth': 9, 'min_child_weight': 3, 'subsample': 0.7, 'colsample_bytree': 0.5, 'colsample_bylevel': 0.6, 'reg_alpha': 0.006977211475702627, 'reg_lambda': 1.539023117364918, 'gamma': 0.0025461411001410227}. Best is trial 84 with value: -0.2366303824542712.
[I 2026-07-17 15:14:38,043] Trial 95 finished with value: -0.200922998579936 and parameters: {'scalers': 'standard', 'ratios': 'norm_ratio', 'imputers': 'mean', 'n_estimators': 2950, 'learning_rate': 0.18562311657939953, 'max_depth': 9, 'min_child_weight': 3, 'subsample': 0.7, 'colsample_bytree': 0.5, 'colsample_bylevel': 0.6, 'reg_alpha': 1.7787630848981595e-05, 'reg_lambda': 5.073846625867736, 'gamma': 0.001287384831263145}. Best is trial 84 with value: -0.2366303824542712.
[I 2026-07-17 15:14:43,362] Trial 96 finished with value: -0.05586181975876186 and parameters: {'scalers': 'standard', 'ratios': 'norm_ratio', 'imputers': 'mean', 'n_estimators': 950, 'learning_rate': 0.002584754060584516, 'max_depth': 9, 'min_child_weight': 3, 'subsample': 0.8, 'colsample_bytree': 0.5, 'colsample_bylevel': 0.6, 'reg_alpha': 0.0008426375190252097, 'reg_lambda': 6.071730379913015, 'gamma': 0.0221744813628386}. Best is trial 84 with value: -0.2366303824542712.
[I 2026-07-17 15:15:02,882] Trial 97 finished with value: -0.07173770420888412 and parameters: {'scalers': 'standard', 'ratios': 'norm_ratio', 'imputers': 'mean', 'n_estimators': 3000, 'learning_rate': 0.0035241633918389405, 'max_depth': 9, 'min_child_weight': 3, 'subsample': 0.8, 'colsample_bytree': 0.5, 'colsample_bylevel': 0.6, 'reg_alpha': 8.164891595775137e-06, 'reg_lambda': 1.5459304741034072, 'gamma': 0.0030839494190334203}. Best is trial 84 with value: -0.2366303824542712.
[I 2026-07-17 15:15:23,878] Trial 98 finished with value: -0.07286872981123994 and parameters: {'scalers': 'standard', 'ratios': 'norm_ratio', 'imputers': 'mean', 'n_estimators': 2950, 'learning_rate': 0.003710761919264822, 'max_depth': 9, 'min_child_weight': 3, 'subsample': 1.0, 'colsample_bytree': 0.5, 'colsample_bylevel': 0.6, 'reg_alpha': 0.0008975091598620914, 'reg_lambda': 5.2991927835632735, 'gamma': 0.0032658882721040487}. Best is trial 84 with value: -0.2366303824542712.
[I 2026-07-17 15:15:40,693] Trial 99 finished with value: -0.05669738754694154 and parameters: {'scalers': 'standard', 'ratios': 'norm_ratio', 'imputers': 'mean', 'n_estimators': 2900, 'learning_rate': 0.0010294505905053043, 'max_depth': 9, 'min_child_weight': 2, 'subsample': 0.8, 'colsample_bytree': 0.5, 'colsample_bylevel': 0.6, 'reg_alpha': 0.0071152387766532125, 'reg_lambda': 1.5880641295790456, 'gamma': 0.023091190455985396}. Best is trial 84 with value: -0.2366303824542712.
[I 2026-07-17 15:15:55,177] Trial 100 finished with value: -0.2266505142752569 and parameters: {'scalers': 'standard', 'ratios': 'norm_ratio', 'imputers': 'mean', 'n_estimators': 2950, 'learning_rate': 0.389586543271328, 'max_depth': 9, 'min_child_weight': 3, 'subsample': 0.8, 'colsample_bytree': 0.5, 'colsample_bylevel': 0.6, 'reg_alpha': 1.563124288538457e-06, 'reg_lambda': 1.4158429653757352, 'gamma': 0.0031697120390150953}. Best is trial 84 with value: -0.2366303824542712.
[I 2026-07-17 15:16:12,836] Trial 101 finished with value: -0.058190147086787644 and parameters: {'scalers': 'standard', 'ratios': 'norm_ratio', 'imputers': 'mean', 'n_estimators': 3000, 'learning_rate': 0.0013102548768111665, 'max_depth': 9, 'min_child_weight': 2, 'subsample': 0.8, 'colsample_bytree': 0.5, 'colsample_bylevel': 0.6, 'reg_alpha': 7.584221734830773e-06, 'reg_lambda': 1.120522346074934, 'gamma': 0.022838771231027875}. Best is trial 84 with value: -0.2366303824542712.
[I 2026-07-17 15:16:26,272] Trial 102 finished with value: -0.19123397052101118 and parameters: {'scalers': 'standard', 'ratios': 'norm_ratio', 'imputers': 'mean', 'n_estimators': 3000, 'learning_rate': 0.16918022233047686, 'max_depth': 9, 'min_child_weight': 2, 'subsample': 0.8, 'colsample_bytree': 0.5, 'colsample_bylevel': 0.6, 'reg_alpha': 3.811814948717925e-06, 'reg_lambda': 1.0742269572498226, 'gamma': 0.0032115131546639297}. Best is trial 84 with value: -0.2366303824542712.
[I 2026-07-17 15:16:39,450] Trial 103 finished with value: -0.18819802743055322 and parameters: {'scalers': 'standard', 'ratios': 'norm_ratio', 'imputers': 'mean', 'n_estimators': 2950, 'learning_rate': 0.17538914973922953, 'max_depth': 9, 'min_child_weight': 2, 'subsample': 0.8, 'colsample_bytree': 0.5, 'colsample_bylevel': 0.6, 'reg_alpha': 9.272767071309813e-06, 'reg_lambda': 1.0084367200781774, 'gamma': 0.0210745746688851}. Best is trial 84 with value: -0.2366303824542712.
[I 2026-07-17 15:16:52,125] Trial 104 finished with value: -0.17379585275299503 and parameters: {'scalers': 'standard', 'ratios': 'norm_ratio', 'imputers': 'mean', 'n_estimators': 3000, 'learning_rate': 0.1823326682493497, 'max_depth': 9, 'min_child_weight': 2, 'subsample': 0.8, 'colsample_bytree': 0.5, 'colsample_bylevel': 0.6, 'reg_alpha': 6.102022589483017e-06, 'reg_lambda': 0.06935424851287082, 'gamma': 0.00139300704024667}. Best is trial 84 with value: -0.2366303824542712.
[I 2026-07-17 15:17:04,378] Trial 105 finished with value: -0.15211650179877104 and parameters: {'scalers': 'standard', 'ratios': 'norm_ratio', 'imputers': 'mean', 'n_estimators': 2900, 'learning_rate': 0.21255217278049104, 'max_depth': 9, 'min_child_weight': 2, 'subsample': 1.0, 'colsample_bytree': 0.5, 'colsample_bylevel': 0.6, 'reg_alpha': 2.373540635299458e-05, 'reg_lambda': 1.0203665793598287, 'gamma': 0.0013463532846176112}. Best is trial 84 with value: -0.2366303824542712.
[I 2026-07-17 15:17:17,418] Trial 106 finished with value: -0.18755784246103768 and parameters: {'scalers': 'standard', 'ratios': 'norm_ratio', 'imputers': 'mean', 'n_estimators': 2900, 'learning_rate': 0.18536904672858776, 'max_depth': 9, 'min_child_weight': 2, 'subsample': 0.8, 'colsample_bytree': 0.5, 'colsample_bylevel': 0.6, 'reg_alpha': 1.7787749243064045e-06, 'reg_lambda': 0.8686526491401972, 'gamma': 0.0005180231078450141}. Best is trial 84 with value: -0.2366303824542712.
[I 2026-07-17 15:17:30,383] Trial 107 finished with value: -0.1787644226506796 and parameters: {'scalers': 'standard', 'ratios': 'norm_ratio', 'imputers': 'mean', 'n_estimators': 3000, 'learning_rate': 0.1710414681431226, 'max_depth': 9, 'min_child_weight': 2, 'subsample': 0.8, 'colsample_bytree': 0.5, 'colsample_bylevel': 0.6, 'reg_alpha': 1.7039527200632485e-05, 'reg_lambda': 0.44853102345086904, 'gamma': 0.0013227859407978725}. Best is trial 84 with value: -0.2366303824542712.
[I 2026-07-17 15:17:43,829] Trial 108 finished with value: -0.1847585649934381 and parameters: {'scalers': 'standard', 'ratios': 'norm_ratio', 'imputers': 'mean', 'n_estimators': 3000, 'learning_rate': 0.17228508123168698, 'max_depth': 9, 'min_child_weight': 2, 'subsample': 0.8, 'colsample_bytree': 0.5, 'colsample_bylevel': 0.6, 'reg_alpha': 2.058953578947339e-06, 'reg_lambda': 0.8652424498829264, 'gamma': 0.0005644921141065826}. Best is trial 84 with value: -0.2366303824542712.
[I 2026-07-17 15:17:59,536] Trial 109 finished with value: -0.17944920911109816 and parameters: {'scalers': 'standard', 'ratios': 'norm_ratio', 'imputers': 'mean', 'n_estimators': 2900, 'learning_rate': 0.18337421719615013, 'max_depth': 10, 'min_child_weight': 3, 'subsample': 0.8, 'colsample_bytree': 0.5, 'colsample_bylevel': 0.6, 'reg_alpha': 1.6406002315819193e-05, 'reg_lambda': 0.11449525329259212, 'gamma': 0.0005157347459699275}. Best is trial 84 with value: -0.2366303824542712.
[I 2026-07-17 15:18:12,668] Trial 110 finished with value: -0.18651355847404216 and parameters: {'scalers': 'standard', 'ratios': 'norm_ratio', 'imputers': 'mean', 'n_estimators': 2900, 'learning_rate': 0.1650217714749572, 'max_depth': 9, 'min_child_weight': 2, 'subsample': 0.8, 'colsample_bytree': 0.5, 'colsample_bylevel': 0.6, 'reg_alpha': 1.468556388787389e-06, 'reg_lambda': 1.0083147095220155, 'gamma': 0.0005947218413910501}. Best is trial 84 with value: -0.2366303824542712.
[I 2026-07-17 15:18:25,117] Trial 111 finished with value: -0.19317264680522644 and parameters: {'scalers': 'standard', 'ratios': 'norm_ratio', 'imputers': 'mean', 'n_estimators': 2900, 'learning_rate': 0.17136966284527144, 'max_depth': 9, 'min_child_weight': 1, 'subsample': 0.8, 'colsample_bytree': 0.5, 'colsample_bylevel': 0.6, 'reg_alpha': 1.287189411264617e-06, 'reg_lambda': 0.1657312644790895, 'gamma': 0.0013919097992941675}. Best is trial 84 with value: -0.2366303824542712.
[I 2026-07-17 15:18:37,132] Trial 112 finished with value: -0.17601240046262234 and parameters: {'scalers': 'standard', 'ratios': 'norm_ratio', 'imputers': 'mean', 'n_estimators': 2900, 'learning_rate': 0.1706616852539338, 'max_depth': 9, 'min_child_weight': 2, 'subsample': 0.8, 'colsample_bytree': 0.5, 'colsample_bylevel': 0.5, 'reg_alpha': 1.3904084150578282e-06, 'reg_lambda': 0.3314727242621755, 'gamma': 0.0005491788169882012}. Best is trial 84 with value: -0.2366303824542712.
[I 2026-07-17 15:18:48,490] Trial 113 finished with value: -0.27122537505465755 and parameters: {'scalers': 'standard', 'ratios': 'norm_ratio', 'imputers': 'mean', 'n_estimators': 2800, 'learning_rate': 0.39904173371088214, 'max_depth': 9, 'min_child_weight': 1, 'subsample': 0.8, 'colsample_bytree': 0.5, 'colsample_bylevel': 0.5, 'reg_alpha': 1.2289702487222788e-06, 'reg_lambda': 0.1458852146157211, 'gamma': 0.0004586828481838796}. Best is trial 113 with value: -0.27122537505465755.
[I 2026-07-17 15:19:00,011] Trial 114 finished with value: -0.2673388741653231 and parameters: {'scalers': 'standard', 'ratios': 'norm_ratio', 'imputers': 'mean', 'n_estimators': 2800, 'learning_rate': 0.40215175209776605, 'max_depth': 9, 'min_child_weight': 1, 'subsample': 0.9, 'colsample_bytree': 0.5, 'colsample_bylevel': 0.5, 'reg_alpha': 1.4544002528379585e-06, 'reg_lambda': 0.21329253992837155, 'gamma': 0.00017586256037367462}. Best is trial 113 with value: -0.27122537505465755.
[I 2026-07-17 15:19:13,838] Trial 115 finished with value: -0.19979235238336931 and parameters: {'scalers': 'standard', 'ratios': 'norm_ratio', 'imputers': 'mean', 'n_estimators': 2800, 'learning_rate': 0.11976401314939272, 'max_depth': 10, 'min_child_weight': 1, 'subsample': 0.8, 'colsample_bytree': 0.5, 'colsample_bylevel': 0.5, 'reg_alpha': 1.7545654908417056e-06, 'reg_lambda': 0.31525810273205723, 'gamma': 0.0005428736895890171}. Best is trial 113 with value: -0.27122537505465755.
[I 2026-07-17 15:19:28,257] Trial 116 finished with value: -0.20608984248743367 and parameters: {'scalers': 'standard', 'ratios': 'norm_ratio', 'imputers': 'mean', 'n_estimators': 2850, 'learning_rate': 0.12137081353874087, 'max_depth': 10, 'min_child_weight': 1, 'subsample': 0.9, 'colsample_bytree': 0.5, 'colsample_bylevel': 0.5, 'reg_alpha': 2.875181064648342e-06, 'reg_lambda': 0.4632986576924674, 'gamma': 0.0001665781071621622}. Best is trial 113 with value: -0.27122537505465755.
[I 2026-07-17 15:19:39,064] Trial 117 finished with value: -0.15698849952196386 and parameters: {'scalers': 'standard', 'ratios': 'norm_ratio', 'imputers': 'mean', 'n_estimators': 2800, 'learning_rate': 0.12323233560251963, 'max_depth': 8, 'min_child_weight': 1, 'subsample': 0.9, 'colsample_bytree': 0.5, 'colsample_bylevel': 0.5, 'reg_alpha': 1.1087604536025228e-06, 'reg_lambda': 0.2972750227499762, 'gamma': 0.00015519579107199194}. Best is trial 113 with value: -0.27122537505465755.
[I 2026-07-17 15:19:48,965] Trial 118 finished with value: -0.25253391479399045 and parameters: {'scalers': 'standard', 'ratios': 'norm_ratio', 'imputers': 'mean', 'n_estimators': 2800, 'learning_rate': 0.3978709240945101, 'max_depth': 8, 'min_child_weight': 1, 'subsample': 0.8, 'colsample_bytree': 0.5, 'colsample_bylevel': 0.5, 'reg_alpha': 1.2165536419372079e-06, 'reg_lambda': 0.41882876135411745, 'gamma': 0.00018145760768327313}. Best is trial 113 with value: -0.27122537505465755.
[I 2026-07-17 15:19:59,253] Trial 119 finished with value: -0.24451268445247926 and parameters: {'scalers': 'standard', 'ratios': 'norm_ratio', 'imputers': 'mean', 'n_estimators': 2850, 'learning_rate': 0.39661402883650254, 'max_depth': 8, 'min_child_weight': 1, 'subsample': 0.9, 'colsample_bytree': 0.5, 'colsample_bylevel': 0.5, 'reg_alpha': 2.7467649747311566e-06, 'reg_lambda': 0.3227970359098242, 'gamma': 0.00020315072091871798}. Best is trial 113 with value: -0.27122537505465755.
[I 2026-07-17 15:20:10,085] Trial 120 finished with value: -0.15320776277556847 and parameters: {'scalers': 'standard', 'ratios': 'norm_ratio', 'imputers': 'mean', 'n_estimators': 2800, 'learning_rate': 0.11716191331514582, 'max_depth': 8, 'min_child_weight': 1, 'subsample': 0.9, 'colsample_bytree': 0.5, 'colsample_bylevel': 0.5, 'reg_alpha': 3.2611683912423336e-06, 'reg_lambda': 0.2109245100565469, 'gamma': 0.00018493451360463117}. Best is trial 113 with value: -0.27122537505465755.
[I 2026-07-17 15:20:20,098] Trial 121 finished with value: -0.23302709976660146 and parameters: {'scalers': 'standard', 'ratios': 'norm_ratio', 'imputers': 'mean', 'n_estimators': 2800, 'learning_rate': 0.39333771304254506, 'max_depth': 8, 'min_child_weight': 1, 'subsample': 0.9, 'colsample_bytree': 0.5, 'colsample_bylevel': 0.5, 'reg_alpha': 2.85115887326188e-06, 'reg_lambda': 0.2065818817046483, 'gamma': 0.004425739778601307}. Best is trial 113 with value: -0.27122537505465755.
[I 2026-07-17 15:20:30,125] Trial 122 finished with value: -0.19247849745823803 and parameters: {'scalers': 'standard', 'ratios': 'norm_ratio', 'imputers': 'mean', 'n_estimators': 2800, 'learning_rate': 0.2810724121301305, 'max_depth': 8, 'min_child_weight': 1, 'subsample': 0.9, 'colsample_bytree': 0.5, 'colsample_bylevel': 0.5, 'reg_alpha': 3.4945091293791973e-06, 'reg_lambda': 0.14170910074201876, 'gamma': 0.0001805150405766473}. Best is trial 113 with value: -0.27122537505465755.
[I 2026-07-17 15:20:43,426] Trial 123 finished with value: -0.3087064502731913 and parameters: {'scalers': 'standard', 'ratios': 'norm_ratio', 'imputers': 'mean', 'n_estimators': 2750, 'learning_rate': 0.41692529621255253, 'max_depth': 10, 'min_child_weight': 1, 'subsample': 0.9, 'colsample_bytree': 0.5, 'colsample_bylevel': 0.5, 'reg_alpha': 3.0766559989405686e-06, 'reg_lambda': 0.23033208988281043, 'gamma': 0.00014654273032330145}. Best is trial 123 with value: -0.3087064502731913.
[I 2026-07-17 15:20:56,937] Trial 124 finished with value: -0.24501986504050247 and parameters: {'scalers': 'standard', 'ratios': 'norm_ratio', 'imputers': 'mean', 'n_estimators': 2800, 'learning_rate': 0.27160001962344194, 'max_depth': 10, 'min_child_weight': 1, 'subsample': 0.9, 'colsample_bytree': 0.5, 'colsample_bylevel': 0.5, 'reg_alpha': 3.873813644135699e-06, 'reg_lambda': 0.1500732260990995, 'gamma': 0.00021521501538037692}. Best is trial 123 with value: -0.3087064502731913.
[I 2026-07-17 15:21:10,057] Trial 125 finished with value: -0.282408080462153 and parameters: {'scalers': 'standard', 'ratios': 'norm_ratio', 'imputers': 'mean', 'n_estimators': 2800, 'learning_rate': 0.41283171230112364, 'max_depth': 10, 'min_child_weight': 1, 'subsample': 0.9, 'colsample_bytree': 0.5, 'colsample_bylevel': 0.5, 'reg_alpha': 3.318580083003385e-06, 'reg_lambda': 0.16738334782291514, 'gamma': 0.0001834917154220113}. Best is trial 123 with value: -0.3087064502731913.
[I 2026-07-17 15:21:23,211] Trial 126 finished with value: -0.27877125050325846 and parameters: {'scalers': 'standard', 'ratios': 'norm_ratio', 'imputers': 'mean', 'n_estimators': 2800, 'learning_rate': 0.3972805466720607, 'max_depth': 10, 'min_child_weight': 1, 'subsample': 0.9, 'colsample_bytree': 0.5, 'colsample_bylevel': 0.5, 'reg_alpha': 2.9624358103589276e-06, 'reg_lambda': 0.04213270519539211, 'gamma': 0.00016353733749323911}. Best is trial 123 with value: -0.3087064502731913.
[I 2026-07-17 15:21:36,311] Trial 127 finished with value: -0.27838766815601584 and parameters: {'scalers': 'standard', 'ratios': 'norm_ratio', 'imputers': 'mean', 'n_estimators': 2800, 'learning_rate': 0.3952868709242324, 'max_depth': 10, 'min_child_weight': 1, 'subsample': 0.9, 'colsample_bytree': 0.5, 'colsample_bylevel': 0.5, 'reg_alpha': 2.8171819351987733e-06, 'reg_lambda': 0.12590527685225625, 'gamma': 0.0002078332835253352}. Best is trial 123 with value: -0.3087064502731913.
[I 2026-07-17 15:21:49,622] Trial 128 finished with value: -0.2834074161282701 and parameters: {'scalers': 'standard', 'ratios': 'norm_ratio', 'imputers': 'mean', 'n_estimators': 2800, 'learning_rate': 0.3997287114263934, 'max_depth': 10, 'min_child_weight': 1, 'subsample': 0.9, 'colsample_bytree': 0.5, 'colsample_bylevel': 0.5, 'reg_alpha': 2.598875209272245e-06, 'reg_lambda': 0.13126215358905596, 'gamma': 7.327976218954242e-05}. Best is trial 123 with value: -0.3087064502731913.
[I 2026-07-17 15:22:03,076] Trial 129 finished with value: -0.2758282415038081 and parameters: {'scalers': 'standard', 'ratios': 'norm_ratio', 'imputers': 'mean', 'n_estimators': 2800, 'learning_rate': 0.3982038546815383, 'max_depth': 10, 'min_child_weight': 1, 'subsample': 0.9, 'colsample_bytree': 0.5, 'colsample_bylevel': 0.5, 'reg_alpha': 3.0212722230957837e-06, 'reg_lambda': 0.08588490849406545, 'gamma': 0.00019578139276411988}. Best is trial 123 with value: -0.3087064502731913.
[I 2026-07-17 15:22:16,417] Trial 130 finished with value: -0.27106346816832383 and parameters: {'scalers': 'standard', 'ratios': 'norm_ratio', 'imputers': 'mean', 'n_estimators': 2800, 'learning_rate': 0.38273243727663225, 'max_depth': 10, 'min_child_weight': 1, 'subsample': 0.9, 'colsample_bytree': 0.5, 'colsample_bylevel': 0.5, 'reg_alpha': 2.494857666865552e-06, 'reg_lambda': 0.06342069700271466, 'gamma': 4.420808863665275e-05}. Best is trial 123 with value: -0.3087064502731913.
[I 2026-07-17 15:22:29,231] Trial 131 finished with value: -0.27717996126664096 and parameters: {'scalers': 'standard', 'ratios': 'norm_ratio', 'imputers': 'mean', 'n_estimators': 2750, 'learning_rate': 0.39535661258598964, 'max_depth': 10, 'min_child_weight': 1, 'subsample': 0.9, 'colsample_bytree': 0.5, 'colsample_bylevel': 0.5, 'reg_alpha': 2.61920998067926e-06, 'reg_lambda': 0.04312643430992621, 'gamma': 7.513248394763746e-05}. Best is trial 123 with value: -0.3087064502731913.
[I 2026-07-17 15:22:41,992] Trial 132 finished with value: -0.28244805091196445 and parameters: {'scalers': 'standard', 'ratios': 'norm_ratio', 'imputers': 'mean', 'n_estimators': 2750, 'learning_rate': 0.4151674665033898, 'max_depth': 10, 'min_child_weight': 1, 'subsample': 0.9, 'colsample_bytree': 0.5, 'colsample_bylevel': 0.5, 'reg_alpha': 2.4371999468797413e-06, 'reg_lambda': 0.039098860880162095, 'gamma': 0.00023607259732381653}. Best is trial 123 with value: -0.3087064502731913.
[I 2026-07-17 15:22:54,671] Trial 133 finished with value: -0.2634497417188879 and parameters: {'scalers': 'standard', 'ratios': 'norm_ratio', 'imputers': 'mean', 'n_estimators': 2650, 'learning_rate': 0.40717333363468927, 'max_depth': 10, 'min_child_weight': 1, 'subsample': 0.9, 'colsample_bytree': 0.5, 'colsample_bylevel': 0.5, 'reg_alpha': 2.354262785169394e-06, 'reg_lambda': 0.04739957044199155, 'gamma': 6.231711832717742e-05}. Best is trial 123 with value: -0.3087064502731913.
[I 2026-07-17 15:23:07,428] Trial 134 finished with value: -0.28903723910440365 and parameters: {'scalers': 'standard', 'ratios': 'norm_ratio', 'imputers': 'mean', 'n_estimators': 2650, 'learning_rate': 0.4217376372550427, 'max_depth': 10, 'min_child_weight': 1, 'subsample': 0.9, 'colsample_bytree': 0.5, 'colsample_bylevel': 0.5, 'reg_alpha': 2.4389468359454686e-06, 'reg_lambda': 0.027872208327045234, 'gamma': 7.381494651734684e-05}. Best is trial 123 with value: -0.3087064502731913.
