[I 2026-07-17 15:00:36,259] A new study created in RDB with name: residual_study_v2
[I 2026-07-17 15:00:45,702] Trial 1 finished with value: -0.15574750752360875 and parameters: {'scalers': 'robust', 'ratios': 'log_ratio', 'imputers': 'none', 'n_estimators': 2050, 'learning_rate': 0.26691041929956366, 'max_depth': 5, 'min_child_weight': 1, 'subsample': 0.6, 'colsample_bytree': 0.8, 'colsample_bylevel': 0.6, 'reg_alpha': 0.029941128592128677, 'reg_lambda': 2.440537808598825, 'gamma': 2.3474282265568946e-05}. Best is trial 1 with value: -0.15574750752360875.
[I 2026-07-17 15:00:49,066] Trial 0 finished with value: -0.0576244327303611 and parameters: {'scalers': 'standard', 'ratios': 'norm_ratio', 'imputers': 'mean', 'n_estimators': 2650, 'learning_rate': 0.32933248954409405, 'max_depth': 5, 'min_child_weight': 8, 'subsample': 1.0, 'colsample_bytree': 0.8, 'colsample_bylevel': 0.8, 'reg_alpha': 8.083196806234204, 'reg_lambda': 0.00047602024649516625, 'gamma': 2.455305625871359e-05}. Best is trial 1 with value: -0.15574750752360875.
[I 2026-07-17 15:00:57,253] Trial 2 finished with value: -0.07474216378029087 and parameters: {'scalers': 'robust', 'ratios': 'norm_ratio', 'imputers': 'mean', 'n_estimators': 1300, 'learning_rate': 0.0561926353204373, 'max_depth': 8, 'min_child_weight': 6, 'subsample': 0.9, 'colsample_bytree': 0.7, 'colsample_bylevel': 1.0, 'reg_alpha': 4.994706403979618e-06, 'reg_lambda': 0.0007093581731034572, 'gamma': 0.0024847095147261297}. Best is trial 1 with value: -0.15574750752360875.
[I 2026-07-17 15:01:06,395] Trial 3 finished with value: -0.054371559973818984 and parameters: {'scalers': 'standard', 'ratios': 'log_ratio', 'imputers': 'mean', 'n_estimators': 1250, 'learning_rate': 0.00010619644477403508, 'max_depth': 11, 'min_child_weight': 5, 'subsample': 0.9, 'colsample_bytree': 0.9, 'colsample_bylevel': 0.9, 'reg_alpha': 0.00020344061189807246, 'reg_lambda': 5.934683368003486e-05, 'gamma': 0.11984825038566504}. Best is trial 1 with value: -0.15574750752360875.
[I 2026-07-17 15:01:07,410] Trial 4 finished with value: -0.05440779914954899 and parameters: {'scalers': 'standard', 'ratios': 'norm_ratio', 'imputers': 'mean', 'n_estimators': 1000, 'learning_rate': 0.008319451323275823, 'max_depth': 3, 'min_child_weight': 6, 'subsample': 0.5, 'colsample_bytree': 0.7, 'colsample_bylevel': 0.8, 'reg_alpha': 0.004413799544360422, 'reg_lambda': 0.15711042040503956, 'gamma': 12.2902975237272}. Best is trial 1 with value: -0.15574750752360875.
[I 2026-07-17 15:01:09,041] Trial 5 finished with value: -0.05442316444257156 and parameters: {'scalers': 'none', 'ratios': 'log_ratio', 'imputers': 'median', 'n_estimators': 1250, 'learning_rate': 0.0024485750731480537, 'max_depth': 10, 'min_child_weight': 1, 'subsample': 1.0, 'colsample_bytree': 0.7, 'colsample_bylevel': 0.8, 'reg_alpha': 1.4981456772796635, 'reg_lambda': 0.0004084802089656652, 'gamma': 14.084512839498696}. Best is trial 1 with value: -0.15574750752360875.
[I 2026-07-17 15:01:25,280] Trial 6 finished with value: -0.05438014097872865 and parameters: {'scalers': 'robust', 'ratios': 'log_ratio', 'imputers': 'median', 'n_estimators': 1400, 'learning_rate': 0.00011834028642312352, 'max_depth': 11, 'min_child_weight': 5, 'subsample': 0.9, 'colsample_bytree': 0.9, 'colsample_bylevel': 0.8, 'reg_alpha': 0.5654680769318245, 'reg_lambda': 0.0017559647578959602, 'gamma': 6.101695119448687e-05}. Best is trial 1 with value: -0.15574750752360875.
[I 2026-07-17 15:01:26,659] Trial 7 finished with value: -0.05440365929366647 and parameters: {'scalers': 'standard', 'ratios': 'log_ratio', 'imputers': 'median', 'n_estimators': 1300, 'learning_rate': 0.08489680247529197, 'max_depth': 6, 'min_child_weight': 1, 'subsample': 0.6, 'colsample_bytree': 0.9, 'colsample_bylevel': 0.6, 'reg_alpha': 0.026824125629383085, 'reg_lambda': 10.601747601586112, 'gamma': 6.798926679944345}. Best is trial 1 with value: -0.15574750752360875.
[I 2026-07-17 15:01:49,031] Trial 8 finished with value: -0.055137190246915255 and parameters: {'scalers': 'robust', 'ratios': 'log_ratio', 'imputers': 'mean', 'n_estimators': 2500, 'learning_rate': 0.0006279783664563908, 'max_depth': 11, 'min_child_weight': 4, 'subsample': 0.7, 'colsample_bytree': 0.7, 'colsample_bylevel': 1.0, 'reg_alpha': 1.7455621037595407e-06, 'reg_lambda': 57.91225540884704, 'gamma': 0.0019326050882339525}. Best is trial 1 with value: -0.15574750752360875.
[I 2026-07-17 15:01:49,366] Trial 9 finished with value: -0.0544221880114422 and parameters: {'scalers': 'robust', 'ratios': 'log_ratio', 'imputers': 'mean', 'n_estimators': 650, 'learning_rate': 0.0002334434814639989, 'max_depth': 7, 'min_child_weight': 8, 'subsample': 0.7, 'colsample_bytree': 0.6, 'colsample_bylevel': 1.0, 'reg_alpha': 97.97247193170251, 'reg_lambda': 0.0015760473107453011, 'gamma': 54.59210803820314}. Best is trial 1 with value: -0.15574750752360875.
[I 2026-07-17 15:01:51,711] Trial 10 finished with value: -0.05441961692210373 and parameters: {'scalers': 'standard', 'ratios': 'norm_ratio', 'imputers': 'median', 'n_estimators': 2100, 'learning_rate': 0.00033248248013518226, 'max_depth': 7, 'min_child_weight': 7, 'subsample': 0.7, 'colsample_bytree': 0.9, 'colsample_bylevel': 0.7, 'reg_alpha': 1.3362071465833856e-05, 'reg_lambda': 0.013336392602048268, 'gamma': 50.38946768470746}. Best is trial 1 with value: -0.15574750752360875.
[I 2026-07-17 15:01:52,950] Trial 11 finished with value: -0.054147267865384804 and parameters: {'scalers': 'robust', 'ratios': 'norm_ratio', 'imputers': 'none', 'n_estimators': 1050, 'learning_rate': 0.0057960483944058845, 'max_depth': 3, 'min_child_weight': 1, 'subsample': 0.5, 'colsample_bytree': 1.0, 'colsample_bylevel': 0.6, 'reg_alpha': 3.5967839535899695, 'reg_lambda': 1.0326917360066607e-05, 'gamma': 0.08775684114722186}. Best is trial 1 with value: -0.15574750752360875.
[I 2026-07-17 15:01:56,297] Trial 12 finished with value: -0.05443289656318967 and parameters: {'scalers': 'none', 'ratios': 'log_ratio', 'imputers': 'median', 'n_estimators': 2700, 'learning_rate': 0.23556937135510256, 'max_depth': 12, 'min_child_weight': 2, 'subsample': 0.8, 'colsample_bytree': 0.8, 'colsample_bylevel': 1.0, 'reg_alpha': 42.04209515236116, 'reg_lambda': 6.293348713795887e-06, 'gamma': 9.773901593385659e-05}. Best is trial 1 with value: -0.15574750752360875.
[I 2026-07-17 15:01:57,173] Trial 13 finished with value: -0.05442316444257156 and parameters: {'scalers': 'standard', 'ratios': 'norm_ratio', 'imputers': 'median', 'n_estimators': 700, 'learning_rate': 0.0018745134832643016, 'max_depth': 8, 'min_child_weight': 3, 'subsample': 1.0, 'colsample_bytree': 0.5, 'colsample_bylevel': 0.8, 'reg_alpha': 18.629798418748646, 'reg_lambda': 1.6587503495026297e-05, 'gamma': 0.0075508218160987}. Best is trial 1 with value: -0.15574750752360875.
[I 2026-07-17 15:01:57,456] Trial 14 finished with value: -0.05440403451183323 and parameters: {'scalers': 'standard', 'ratios': 'norm_ratio', 'imputers': 'mean', 'n_estimators': 300, 'learning_rate': 0.011250699221808198, 'max_depth': 9, 'min_child_weight': 5, 'subsample': 0.5, 'colsample_bytree': 0.6, 'colsample_bylevel': 0.5, 'reg_alpha': 6.823599175847646, 'reg_lambda': 0.019863183117292245, 'gamma': 23.607712582831734}. Best is trial 1 with value: -0.15574750752360875.
[I 2026-07-17 15:02:21,787] Trial 15 finished with value: -0.0544366799440226 and parameters: {'scalers': 'standard', 'ratios': 'log_ratio', 'imputers': 'none', 'n_estimators': 2600, 'learning_rate': 0.0001485858447906433, 'max_depth': 9, 'min_child_weight': 8, 'subsample': 1.0, 'colsample_bytree': 1.0, 'colsample_bylevel': 0.8, 'reg_alpha': 2.300028533285199, 'reg_lambda': 0.03765360354722214, 'gamma': 8.601870824807046e-05}. Best is trial 1 with value: -0.15574750752360875.
[I 2026-07-17 15:02:23,879] Trial 17 finished with value: -0.054130792543456964 and parameters: {'scalers': 'none', 'ratios': 'norm_ratio', 'imputers': 'none', 'n_estimators': 100, 'learning_rate': 0.008298317933982167, 'max_depth': 3, 'min_child_weight': 3, 'subsample': 0.5, 'colsample_bytree': 0.5, 'colsample_bylevel': 0.5, 'reg_alpha': 0.00026292053543702575, 'reg_lambda': 1.2712598100718412e-06, 'gamma': 2.5905601921278226e-06}. Best is trial 1 with value: -0.15574750752360875.
[I 2026-07-17 15:02:24,388] Trial 16 finished with value: -0.054403502151692214 and parameters: {'scalers': 'robust', 'ratios': 'log_ratio', 'imputers': 'mean', 'n_estimators': 2400, 'learning_rate': 0.18742589495703504, 'max_depth': 5, 'min_child_weight': 1, 'subsample': 0.7, 'colsample_bytree': 1.0, 'colsample_bylevel': 0.5, 'reg_alpha': 40.44962596441635, 'reg_lambda': 0.016726970716541868, 'gamma': 31.509704544815435}. Best is trial 1 with value: -0.15574750752360875.
[I 2026-07-17 15:02:32,133] Trial 18 finished with value: -0.07881621032586376 and parameters: {'scalers': 'robust', 'ratios': 'norm_ratio', 'imputers': 'none', 'n_estimators': 1950, 'learning_rate': 0.050727098836744706, 'max_depth': 9, 'min_child_weight': 10, 'subsample': 0.8, 'colsample_bytree': 0.5, 'colsample_bylevel': 0.5, 'reg_alpha': 0.0006528301086043085, 'reg_lambda': 2.438475169199804e-06, 'gamma': 1.180064380616534e-06}. Best is trial 1 with value: -0.15574750752360875.
[I 2026-07-17 15:02:39,591] Trial 19 finished with value: -0.07988424673604094 and parameters: {'scalers': 'robust', 'ratios': 'norm_ratio', 'imputers': 'none', 'n_estimators': 1900, 'learning_rate': 0.05584486212238917, 'max_depth': 9, 'min_child_weight': 10, 'subsample': 0.8, 'colsample_bytree': 0.5, 'colsample_bylevel': 0.5, 'reg_alpha': 0.00035806248350443113, 'reg_lambda': 0.6567607260126799, 'gamma': 1.6808508897186186e-06}. Best is trial 1 with value: -0.15574750752360875.
[I 2026-07-17 15:02:47,198] Trial 20 finished with value: -0.07655956739439795 and parameters: {'scalers': 'robust', 'ratios': 'norm_ratio', 'imputers': 'none', 'n_estimators': 1900, 'learning_rate': 0.043310734898526486, 'max_depth': 9, 'min_child_weight': 10, 'subsample': 0.8, 'colsample_bytree': 0.5, 'colsample_bylevel': 0.5, 'reg_alpha': 0.0005623697585510926, 'reg_lambda': 0.6267867379165329, 'gamma': 2.339845243770364e-06}. Best is trial 1 with value: -0.15574750752360875.
[I 2026-07-17 15:02:55,246] Trial 21 finished with value: -0.07663444943724106 and parameters: {'scalers': 'robust', 'ratios': 'norm_ratio', 'imputers': 'none', 'n_estimators': 1950, 'learning_rate': 0.04352929425542056, 'max_depth': 9, 'min_child_weight': 10, 'subsample': 0.8, 'colsample_bytree': 0.6, 'colsample_bylevel': 0.5, 'reg_alpha': 0.0004616567417400298, 'reg_lambda': 0.6656935080941032, 'gamma': 4.860114119150513e-06}. Best is trial 1 with value: -0.15574750752360875.
[I 2026-07-17 15:03:00,709] Trial 22 finished with value: -0.06480133096525688 and parameters: {'scalers': 'robust', 'ratios': 'norm_ratio', 'imputers': 'none', 'n_estimators': 1900, 'learning_rate': 0.04191202640488252, 'max_depth': 5, 'min_child_weight': 10, 'subsample': 0.8, 'colsample_bytree': 0.8, 'colsample_bylevel': 0.5, 'reg_alpha': 0.0005993758029381455, 'reg_lambda': 0.465882634058449, 'gamma': 1.1293393982092613e-06}. Best is trial 1 with value: -0.15574750752360875.
[I 2026-07-17 15:03:06,388] Trial 23 finished with value: -0.06914541265139953 and parameters: {'scalers': 'robust', 'ratios': 'norm_ratio', 'imputers': 'none', 'n_estimators': 1950, 'learning_rate': 0.06979262687607035, 'max_depth': 5, 'min_child_weight': 10, 'subsample': 0.8, 'colsample_bytree': 0.8, 'colsample_bylevel': 0.5, 'reg_alpha': 0.0005170257719952819, 'reg_lambda': 1.4508041552330344, 'gamma': 2.2179276479305047e-06}. Best is trial 1 with value: -0.15574750752360875.
[I 2026-07-17 15:03:12,282] Trial 24 finished with value: -0.06707946235730315 and parameters: {'scalers': 'robust', 'ratios': 'norm_ratio', 'imputers': 'none', 'n_estimators': 1850, 'learning_rate': 0.052419684207082824, 'max_depth': 5, 'min_child_weight': 10, 'subsample': 0.8, 'colsample_bytree': 0.8, 'colsample_bylevel': 0.6, 'reg_alpha': 0.05850816047483356, 'reg_lambda': 0.7653065386324251, 'gamma': 0.0017437031150373346}. Best is trial 1 with value: -0.15574750752360875.
[I 2026-07-17 15:03:19,201] Trial 25 finished with value: -0.06612049019746313 and parameters: {'scalers': 'robust', 'ratios': 'norm_ratio', 'imputers': 'none', 'n_estimators': 1800, 'learning_rate': 0.04091574913254643, 'max_depth': 5, 'min_child_weight': 10, 'subsample': 0.8, 'colsample_bytree': 0.8, 'colsample_bylevel': 0.9, 'reg_alpha': 0.07505783888905534, 'reg_lambda': 1.145918491891668, 'gamma': 0.001014635150337831}. Best is trial 1 with value: -0.15574750752360875.
[I 2026-07-17 15:03:24,101] Trial 26 finished with value: -0.06747668202490108 and parameters: {'scalers': 'robust', 'ratios': 'norm_ratio', 'imputers': 'none', 'n_estimators': 1900, 'learning_rate': 0.03656645442764384, 'max_depth': 5, 'min_child_weight': 9, 'subsample': 0.6, 'colsample_bytree': 0.6, 'colsample_bylevel': 0.6, 'reg_alpha': 0.03442486600725239, 'reg_lambda': 0.5293914556182328, 'gamma': 1.4835665067832864e-06}. Best is trial 1 with value: -0.15574750752360875.
[I 2026-07-17 15:03:28,643] Trial 27 finished with value: -0.064961862786528 and parameters: {'scalers': 'robust', 'ratios': 'norm_ratio', 'imputers': 'none', 'n_estimators': 1700, 'learning_rate': 0.023420879135154806, 'max_depth': 5, 'min_child_weight': 10, 'subsample': 0.6, 'colsample_bytree': 0.6, 'colsample_bylevel': 0.6, 'reg_alpha': 0.08323557715035085, 'reg_lambda': 1.563376803989124, 'gamma': 7.627720610514502e-06}. Best is trial 1 with value: -0.15574750752360875.
[I 2026-07-17 15:03:33,710] Trial 28 finished with value: -0.06391289605401601 and parameters: {'scalers': 'robust', 'ratios': 'norm_ratio', 'imputers': 'none', 'n_estimators': 1750, 'learning_rate': 0.02507094718532893, 'max_depth': 5, 'min_child_weight': 10, 'subsample': 0.8, 'colsample_bytree': 0.6, 'colsample_bylevel': 0.6, 'reg_alpha': 0.07897803244042666, 'reg_lambda': 6.228398610320201, 'gamma': 1.0660597819742354e-06}. Best is trial 1 with value: -0.15574750752360875.
[I 2026-07-17 15:03:37,932] Trial 29 finished with value: -0.06498357408813116 and parameters: {'scalers': 'robust', 'ratios': 'norm_ratio', 'imputers': 'none', 'n_estimators': 1700, 'learning_rate': 0.024035733432346374, 'max_depth': 5, 'min_child_weight': 9, 'subsample': 0.6, 'colsample_bytree': 0.5, 'colsample_bylevel': 0.6, 'reg_alpha': 0.05018858575118086, 'reg_lambda': 3.097193863931081, 'gamma': 1.2044869640815335e-05}. Best is trial 1 with value: -0.15574750752360875.
[I 2026-07-17 15:03:43,626] Trial 30 finished with value: -0.09214417022349519 and parameters: {'scalers': 'robust', 'ratios': 'norm_ratio', 'imputers': 'none', 'n_estimators': 1650, 'learning_rate': 0.12020552658892372, 'max_depth': 7, 'min_child_weight': 9, 'subsample': 0.6, 'colsample_bytree': 0.5, 'colsample_bylevel': 0.6, 'reg_alpha': 0.06304790232667268, 'reg_lambda': 7.942947824560238, 'gamma': 1.3916483740209346e-05}. Best is trial 1 with value: -0.15574750752360875.
[I 2026-07-17 15:03:52,828] Trial 31 finished with value: -0.08860112857774288 and parameters: {'scalers': 'robust', 'ratios': 'norm_ratio', 'imputers': 'none', 'n_estimators': 1600, 'learning_rate': 0.020178361479444334, 'max_depth': 10, 'min_child_weight': 9, 'subsample': 0.6, 'colsample_bytree': 0.5, 'colsample_bylevel': 0.6, 'reg_alpha': 0.07468199823991548, 'reg_lambda': 9.258114503153108, 'gamma': 1.5292352573455178e-05}. Best is trial 1 with value: -0.15574750752360875.
[I 2026-07-17 15:04:03,380] Trial 32 finished with value: -0.07965157719282775 and parameters: {'scalers': 'robust', 'ratios': 'norm_ratio', 'imputers': 'none', 'n_estimators': 3000, 'learning_rate': 0.019381627895704412, 'max_depth': 7, 'min_child_weight': 9, 'subsample': 0.6, 'colsample_bytree': 0.5, 'colsample_bylevel': 0.6, 'reg_alpha': 6.445264642322164e-05, 'reg_lambda': 7.268477971184732, 'gamma': 1.4311628041770991e-05}. Best is trial 1 with value: -0.15574750752360875.
[I 2026-07-17 15:04:12,087] Trial 33 finished with value: -0.0792527262102216 and parameters: {'scalers': 'robust', 'ratios': 'log_ratio', 'imputers': 'none', 'n_estimators': 2250, 'learning_rate': 0.019740018842942905, 'max_depth': 7, 'min_child_weight': 9, 'subsample': 0.6, 'colsample_bytree': 0.6, 'colsample_bylevel': 0.6, 'reg_alpha': 0.005437930733567855, 'reg_lambda': 8.0629240798252, 'gamma': 1.3226939620679925e-05}. Best is trial 1 with value: -0.15574750752360875.
[I 2026-07-17 15:04:20,463] Trial 34 finished with value: -0.07731637548039318 and parameters: {'scalers': 'none', 'ratios': 'log_ratio', 'imputers': 'none', 'n_estimators': 2250, 'learning_rate': 0.01905829604619664, 'max_depth': 7, 'min_child_weight': 9, 'subsample': 0.6, 'colsample_bytree': 0.5, 'colsample_bylevel': 0.7, 'reg_alpha': 0.0038044202747492036, 'reg_lambda': 7.146375324115235, 'gamma': 1.2391566353209436e-05}. Best is trial 1 with value: -0.15574750752360875.
[I 2026-07-17 15:04:33,155] Trial 35 finished with value: -0.10866410742793255 and parameters: {'scalers': 'none', 'ratios': 'log_ratio', 'imputers': 'none', 'n_estimators': 2200, 'learning_rate': 0.13015769165529834, 'max_depth': 10, 'min_child_weight': 9, 'subsample': 0.9, 'colsample_bytree': 0.5, 'colsample_bylevel': 0.7, 'reg_alpha': 0.004584928539903301, 'reg_lambda': 8.920832152436947, 'gamma': 1.581681830344042e-05}. Best is trial 1 with value: -0.15574750752360875.
[I 2026-07-17 15:04:43,472] Trial 36 finished with value: -0.1391719120841199 and parameters: {'scalers': 'none', 'ratios': 'log_ratio', 'imputers': 'none', 'n_estimators': 2250, 'learning_rate': 0.3941752997869981, 'max_depth': 7, 'min_child_weight': 8, 'subsample': 0.9, 'colsample_bytree': 0.5, 'colsample_bylevel': 0.7, 'reg_alpha': 0.003084529221529651, 'reg_lambda': 54.91383084189236, 'gamma': 1.5323858129982758e-05}. Best is trial 1 with value: -0.15574750752360875.
[I 2026-07-17 15:04:57,530] Trial 37 finished with value: -0.16703067700079588 and parameters: {'scalers': 'none', 'ratios': 'log_ratio', 'imputers': 'none', 'n_estimators': 2350, 'learning_rate': 0.4849427405239578, 'max_depth': 10, 'min_child_weight': 8, 'subsample': 0.9, 'colsample_bytree': 0.5, 'colsample_bylevel': 0.7, 'reg_alpha': 0.0034598018799820635, 'reg_lambda': 95.75807947467236, 'gamma': 2.9680465644566624e-05}. Best is trial 37 with value: -0.16703067700079588.
[I 2026-07-17 15:05:09,929] Trial 38 finished with value: -0.1619057149927277 and parameters: {'scalers': 'none', 'ratios': 'norm_ratio', 'imputers': 'none', 'n_estimators': 2950, 'learning_rate': 0.44446491777575897, 'max_depth': 7, 'min_child_weight': 9, 'subsample': 0.7, 'colsample_bytree': 0.5, 'colsample_bylevel': 0.7, 'reg_alpha': 0.003888170344553762, 'reg_lambda': 93.6458414349068, 'gamma': 2.694571686152188e-05}. Best is trial 37 with value: -0.16703067700079588.
[I 2026-07-17 15:05:19,520] Trial 39 finished with value: -0.16910005009006684 and parameters: {'scalers': 'none', 'ratios': 'log_ratio', 'imputers': 'none', 'n_estimators': 2350, 'learning_rate': 0.41684639015653296, 'max_depth': 7, 'min_child_weight': 8, 'subsample': 0.6, 'colsample_bytree': 0.5, 'colsample_bylevel': 0.7, 'reg_alpha': 0.008303601084298834, 'reg_lambda': 20.31435565031476, 'gamma': 2.4985468368162947e-05}. Best is trial 39 with value: -0.16910005009006684.
[I 2026-07-17 15:05:31,164] Trial 40 finished with value: -0.19936911789848752 and parameters: {'scalers': 'none', 'ratios': 'log_ratio', 'imputers': 'none', 'n_estimators': 2250, 'learning_rate': 0.4928716504055585, 'max_depth': 10, 'min_child_weight': 8, 'subsample': 0.6, 'colsample_bytree': 0.5, 'colsample_bylevel': 0.7, 'reg_alpha': 0.005616692620639311, 'reg_lambda': 43.78890363547471, 'gamma': 0.00026224742464048734}. Best is trial 40 with value: -0.19936911789848752.
[I 2026-07-17 15:05:39,105] Trial 41 finished with value: -0.16951812665793736 and parameters: {'scalers': 'none', 'ratios': 'norm_ratio', 'imputers': 'none', 'n_estimators': 1500, 'learning_rate': 0.4609669894072037, 'max_depth': 10, 'min_child_weight': 8, 'subsample': 0.7, 'colsample_bytree': 0.5, 'colsample_bylevel': 0.7, 'reg_alpha': 0.35989847336929986, 'reg_lambda': 59.19268851430054, 'gamma': 0.0003078415256123447}. Best is trial 40 with value: -0.19936911789848752.
[I 2026-07-17 15:05:48,284] Trial 42 finished with value: -0.17853894448074303 and parameters: {'scalers': 'robust', 'ratios': 'norm_ratio', 'imputers': 'none', 'n_estimators': 1500, 'learning_rate': 0.4625390523514618, 'max_depth': 10, 'min_child_weight': 7, 'subsample': 0.7, 'colsample_bytree': 0.7, 'colsample_bylevel': 0.7, 'reg_alpha': 0.7620542532354031, 'reg_lambda': 61.83192885669817, 'gamma': 0.0004093558166976455}. Best is trial 40 with value: -0.19936911789848752.
[I 2026-07-17 15:05:59,457] Trial 43 finished with value: -0.1674620994329592 and parameters: {'scalers': 'none', 'ratios': 'log_ratio', 'imputers': 'none', 'n_estimators': 1550, 'learning_rate': 0.4782435742503636, 'max_depth': 10, 'min_child_weight': 7, 'subsample': 0.9, 'colsample_bytree': 0.7, 'colsample_bylevel': 0.7, 'reg_alpha': 0.5786479529842565, 'reg_lambda': 89.52494672124531, 'gamma': 0.00023684277219971042}. Best is trial 40 with value: -0.19936911789848752.
[I 2026-07-17 15:06:03,904] Trial 44 finished with value: -0.0973598157178737 and parameters: {'scalers': 'none', 'ratios': 'log_ratio', 'imputers': 'none', 'n_estimators': 1550, 'learning_rate': 0.49398689341455126, 'max_depth': 4, 'min_child_weight': 7, 'subsample': 0.9, 'colsample_bytree': 0.7, 'colsample_bylevel': 0.7, 'reg_alpha': 0.31027898128968906, 'reg_lambda': 41.19958191581079, 'gamma': 0.0002968251858343779}. Best is trial 40 with value: -0.19936911789848752.
