[I 2026-07-17 13:25:55,845] Trial 180 finished with value: -4.333737585050084 and parameters: {'scalers': 'none', 'ratios': 'norm_ratio', 'imputers': 'none', 'n_estimators': 2900, 'learning_rate': 0.4130152118008717, 'max_depth': 12, 'min_child_weight': 1, 'subsample': 0.6, 'colsample_bytree': 0.6, 'colsample_bylevel': 0.8, 'reg_alpha': 2.326319178551982, 'reg_lambda': 9.105484914594845e-06, 'gamma': 0.00044706287282752333}. Best is trial 139 with value: -4.662331475947537.
[I 2026-07-17 13:26:53,607] Trial 181 finished with value: -4.510846810842152 and parameters: {'scalers': 'none', 'ratios': 'norm_ratio', 'imputers': 'none', 'n_estimators': 2900, 'learning_rate': 0.42066644045606816, 'max_depth': 12, 'min_child_weight': 1, 'subsample': 0.6, 'colsample_bytree': 0.6, 'colsample_bylevel': 0.8, 'reg_alpha': 3.2600535273967104, 'reg_lambda': 1.8679046611817676e-06, 'gamma': 1.3350342108364338e-05}. Best is trial 139 with value: -4.662331475947537.
[I 2026-07-17 13:27:53,828] Trial 182 finished with value: -4.598164019373786 and parameters: {'scalers': 'none', 'ratios': 'norm_ratio', 'imputers': 'none', 'n_estimators': 2800, 'learning_rate': 0.42458636528586974, 'max_depth': 12, 'min_child_weight': 1, 'subsample': 0.6, 'colsample_bytree': 0.6, 'colsample_bylevel': 0.8, 'reg_alpha': 2.847280762947405, 'reg_lambda': 1.7876068357496277e-06, 'gamma': 1.4249176463551798e-05}. Best is trial 139 with value: -4.662331475947537.
[I 2026-07-17 13:29:16,417] Trial 183 finished with value: -3.9815165531155308 and parameters: {'scalers': 'none', 'ratios': 'norm_ratio', 'imputers': 'none', 'n_estimators': 2900, 'learning_rate': 0.4239311885108666, 'max_depth': 12, 'min_child_weight': 1, 'subsample': 0.6, 'colsample_bytree': 0.6, 'colsample_bylevel': 0.8, 'reg_alpha': 0.9936902094628903, 'reg_lambda': 2.5133914022531725e-06, 'gamma': 0.0001959117336042962}. Best is trial 139 with value: -4.662331475947537.
[I 2026-07-17 13:30:40,881] Trial 184 finished with value: -3.9148865514299738 and parameters: {'scalers': 'none', 'ratios': 'norm_ratio', 'imputers': 'none', 'n_estimators': 2800, 'learning_rate': 0.41651620767604414, 'max_depth': 12, 'min_child_weight': 1, 'subsample': 0.6, 'colsample_bytree': 0.6, 'colsample_bylevel': 0.8, 'reg_alpha': 0.9265023156132086, 'reg_lambda': 2.122825550279207e-06, 'gamma': 1.5160330121824422e-05}. Best is trial 139 with value: -4.662331475947537.
[I 2026-07-17 13:31:32,830] Trial 185 finished with value: -4.27248864774903 and parameters: {'scalers': 'none', 'ratios': 'norm_ratio', 'imputers': 'none', 'n_estimators': 2900, 'learning_rate': 0.42572468678648795, 'max_depth': 12, 'min_child_weight': 1, 'subsample': 0.6, 'colsample_bytree': 0.6, 'colsample_bylevel': 0.8, 'reg_alpha': 3.949237744311133, 'reg_lambda': 1.7815333971124308e-06, 'gamma': 1.119670450448175e-05}. Best is trial 139 with value: -4.662331475947537.
[I 2026-07-17 13:32:21,553] Trial 186 finished with value: -3.8644638384199963 and parameters: {'scalers': 'none', 'ratios': 'norm_ratio', 'imputers': 'none', 'n_estimators': 2950, 'learning_rate': 0.4229131986179623, 'max_depth': 12, 'min_child_weight': 1, 'subsample': 0.6, 'colsample_bytree': 0.6, 'colsample_bylevel': 0.8, 'reg_alpha': 4.373567026446564, 'reg_lambda': 2.1620278330891022e-06, 'gamma': 0.00021088049723610032}. Best is trial 139 with value: -4.662331475947537.
[I 2026-07-17 13:33:15,578] Trial 187 finished with value: -4.320328272838537 and parameters: {'scalers': 'none', 'ratios': 'norm_ratio', 'imputers': 'none', 'n_estimators': 2950, 'learning_rate': 0.42467569996432214, 'max_depth': 12, 'min_child_weight': 1, 'subsample': 0.6, 'colsample_bytree': 0.6, 'colsample_bylevel': 0.8, 'reg_alpha': 3.5183344029768393, 'reg_lambda': 7.196963759314439e-06, 'gamma': 0.00020187135835948472}. Best is trial 139 with value: -4.662331475947537.
[I 2026-07-17 13:34:14,476] Trial 188 finished with value: -4.5351025155479086 and parameters: {'scalers': 'none', 'ratios': 'norm_ratio', 'imputers': 'none', 'n_estimators': 2950, 'learning_rate': 0.42389726265310007, 'max_depth': 12, 'min_child_weight': 1, 'subsample': 0.6, 'colsample_bytree': 0.6, 'colsample_bylevel': 0.8, 'reg_alpha': 3.0433311555752285, 'reg_lambda': 7.326250165260233e-06, 'gamma': 0.00021855843771222914}. Best is trial 139 with value: -4.662331475947537.
[I 2026-07-17 13:35:04,458] Trial 189 finished with value: -5.2019321715370355 and parameters: {'scalers': 'none', 'ratios': 'norm_ratio', 'imputers': 'none', 'n_estimators': 2950, 'learning_rate': 0.4930568290555794, 'max_depth': 12, 'min_child_weight': 1, 'subsample': 0.6, 'colsample_bytree': 0.6, 'colsample_bylevel': 0.8, 'reg_alpha': 3.972052314667935, 'reg_lambda': 2.149859431278007e-06, 'gamma': 0.001398710609465782}. Best is trial 189 with value: -5.2019321715370355.
[I 2026-07-17 13:35:54,265] Trial 190 finished with value: -5.941244341654811 and parameters: {'scalers': 'none', 'ratios': 'norm_ratio', 'imputers': 'median', 'n_estimators': 2900, 'learning_rate': 0.498585338276422, 'max_depth': 12, 'min_child_weight': 1, 'subsample': 0.6, 'colsample_bytree': 0.6, 'colsample_bylevel': 0.8, 'reg_alpha': 4.046978312056209, 'reg_lambda': 1.9067584331359484e-06, 'gamma': 1.1632799595385527e-05}. Best is trial 190 with value: -5.941244341654811.
[I 2026-07-17 13:36:44,105] Trial 191 finished with value: -5.269827947638369 and parameters: {'scalers': 'none', 'ratios': 'norm_ratio', 'imputers': 'median', 'n_estimators': 2950, 'learning_rate': 0.4844431081483995, 'max_depth': 12, 'min_child_weight': 1, 'subsample': 0.6, 'colsample_bytree': 0.6, 'colsample_bylevel': 0.8, 'reg_alpha': 4.220264971479893, 'reg_lambda': 7.027754532088484e-06, 'gamma': 1.4937806050402818e-05}. Best is trial 190 with value: -5.941244341654811.
[I 2026-07-17 13:37:33,989] Trial 192 finished with value: -4.820107156667493 and parameters: {'scalers': 'none', 'ratios': 'norm_ratio', 'imputers': 'median', 'n_estimators': 2950, 'learning_rate': 0.4596260079589194, 'max_depth': 12, 'min_child_weight': 1, 'subsample': 0.6, 'colsample_bytree': 0.6, 'colsample_bylevel': 0.8, 'reg_alpha': 3.9183880090140586, 'reg_lambda': 2.0491101863389867e-06, 'gamma': 0.0012221599469705489}. Best is trial 190 with value: -5.941244341654811.
[I 2026-07-17 13:38:18,937] Trial 193 finished with value: -2.673834054341018 and parameters: {'scalers': 'none', 'ratios': 'norm_ratio', 'imputers': 'none', 'n_estimators': 2950, 'learning_rate': 0.2637754467923164, 'max_depth': 12, 'min_child_weight': 1, 'subsample': 0.6, 'colsample_bytree': 0.6, 'colsample_bylevel': 0.8, 'reg_alpha': 4.304389213440021, 'reg_lambda': 6.717765797622879e-06, 'gamma': 9.973743999318052e-06}. Best is trial 190 with value: -5.941244341654811.
[I 2026-07-17 13:39:17,087] Trial 194 finished with value: -6.217476537070693 and parameters: {'scalers': 'none', 'ratios': 'norm_ratio', 'imputers': 'median', 'n_estimators': 2900, 'learning_rate': 0.49092035767578224, 'max_depth': 12, 'min_child_weight': 1, 'subsample': 0.6, 'colsample_bytree': 0.6, 'colsample_bylevel': 0.8, 'reg_alpha': 3.2453524395267443, 'reg_lambda': 0.006671229623601282, 'gamma': 1.093593742356662e-05}. Best is trial 194 with value: -6.217476537070693.
[I 2026-07-17 13:40:17,528] Trial 195 finished with value: -3.565290736683337 and parameters: {'scalers': 'none', 'ratios': 'norm_ratio', 'imputers': 'median', 'n_estimators': 2900, 'learning_rate': 0.4926265642980823, 'max_depth': 12, 'min_child_weight': 1, 'subsample': 0.6, 'colsample_bytree': 0.6, 'colsample_bylevel': 0.8, 'reg_alpha': 1.2379957734170588e-06, 'reg_lambda': 6.844130615436311e-06, 'gamma': 9.020339438401095e-06}. Best is trial 194 with value: -6.217476537070693.
[I 2026-07-17 13:41:09,012] Trial 196 finished with value: -2.75593652291383 and parameters: {'scalers': 'none', 'ratios': 'norm_ratio', 'imputers': 'median', 'n_estimators': 2950, 'learning_rate': 0.261442745352754, 'max_depth': 12, 'min_child_weight': 1, 'subsample': 0.6, 'colsample_bytree': 0.6, 'colsample_bylevel': 0.8, 'reg_alpha': 3.756252276323809, 'reg_lambda': 1.4347851679773193e-05, 'gamma': 1.145324635607861e-05}. Best is trial 194 with value: -6.217476537070693.
[I 2026-07-17 13:41:57,303] Trial 197 finished with value: -5.225822392065704 and parameters: {'scalers': 'none', 'ratios': 'norm_ratio', 'imputers': 'median', 'n_estimators': 2900, 'learning_rate': 0.4955471669042958, 'max_depth': 12, 'min_child_weight': 1, 'subsample': 0.6, 'colsample_bytree': 0.6, 'colsample_bylevel': 0.8, 'reg_alpha': 4.198936830420147, 'reg_lambda': 7.3687446455824736e-06, 'gamma': 0.0006459865325238645}. Best is trial 194 with value: -6.217476537070693.
[I 2026-07-17 13:42:49,687] Trial 198 finished with value: -5.551370106680847 and parameters: {'scalers': 'none', 'ratios': 'norm_ratio', 'imputers': 'median', 'n_estimators': 2900, 'learning_rate': 0.4854396441893469, 'max_depth': 12, 'min_child_weight': 1, 'subsample': 0.6, 'colsample_bytree': 0.6, 'colsample_bylevel': 0.8, 'reg_alpha': 3.9068674986300604, 'reg_lambda': 1.8286954200548806e-06, 'gamma': 9.954335389240153e-06}. Best is trial 194 with value: -6.217476537070693.
[I 2026-07-17 13:43:43,383] Trial 199 finished with value: -6.064634288324186 and parameters: {'scalers': 'none', 'ratios': 'norm_ratio', 'imputers': 'median', 'n_estimators': 2900, 'learning_rate': 0.49361886156677964, 'max_depth': 12, 'min_child_weight': 1, 'subsample': 0.6, 'colsample_bytree': 0.6, 'colsample_bylevel': 0.8, 'reg_alpha': 3.589110912378429, 'reg_lambda': 1.5483490682396825e-05, 'gamma': 1.3256199923231105e-05}. Best is trial 194 with value: -6.217476537070693.
[I 2026-07-17 13:44:36,454] Trial 200 finished with value: -6.1708512900595185 and parameters: {'scalers': 'none', 'ratios': 'norm_ratio', 'imputers': 'median', 'n_estimators': 2900, 'learning_rate': 0.496102379704731, 'max_depth': 12, 'min_child_weight': 1, 'subsample': 0.6, 'colsample_bytree': 0.6, 'colsample_bylevel': 0.8, 'reg_alpha': 3.8037782897463113, 'reg_lambda': 1.7005343248232415e-06, 'gamma': 9.84535242570734e-06}. Best is trial 194 with value: -6.217476537070693.
[I 2026-07-17 13:45:21,312] Trial 201 finished with value: -5.393088401480996 and parameters: {'scalers': 'none', 'ratios': 'norm_ratio', 'imputers': 'median', 'n_estimators': 2900, 'learning_rate': 0.49870383855130507, 'max_depth': 12, 'min_child_weight': 1, 'subsample': 0.6, 'colsample_bytree': 0.6, 'colsample_bylevel': 0.8, 'reg_alpha': 3.906227116398584, 'reg_lambda': 1.7548977688446935e-06, 'gamma': 0.0015836773555131525}. Best is trial 194 with value: -6.217476537070693.
[I 2026-07-17 13:45:59,367] Trial 203 finished with value: -1.4886702704465902 and parameters: {'scalers': 'none', 'ratios': 'norm_ratio', 'imputers': 'median', 'n_estimators': 2800, 'learning_rate': 0.4874939549715943, 'max_depth': 12, 'min_child_weight': 1, 'subsample': 0.6, 'colsample_bytree': 0.6, 'colsample_bylevel': 0.8, 'reg_alpha': 19.120329693260622, 'reg_lambda': 0.007323081126701364, 'gamma': 0.001469279819980787}. Best is trial 194 with value: -6.217476537070693.
[I 2026-07-17 13:46:12,871] Trial 204 finished with value: -1.4662290987274813 and parameters: {'scalers': 'none', 'ratios': 'norm_ratio', 'imputers': 'median', 'n_estimators': 2800, 'learning_rate': 0.49606021028184694, 'max_depth': 12, 'min_child_weight': 1, 'subsample': 0.6, 'colsample_bytree': 0.6, 'colsample_bylevel': 0.8, 'reg_alpha': 19.586784084480666, 'reg_lambda': 1.7426433954242786e-06, 'gamma': 0.0019661063824786087}. Best is trial 194 with value: -6.217476537070693.
[I 2026-07-17 13:46:12,988] Trial 202 finished with value: -4.931963597258763 and parameters: {'scalers': 'none', 'ratios': 'norm_ratio', 'imputers': 'median', 'n_estimators': 2900, 'learning_rate': 0.46537744931558533, 'max_depth': 12, 'min_child_weight': 1, 'subsample': 0.6, 'colsample_bytree': 0.6, 'colsample_bylevel': 0.8, 'reg_alpha': 3.4717361322306535, 'reg_lambda': 1.7531768406247996e-05, 'gamma': 0.001279978124203259}. Best is trial 194 with value: -6.217476537070693.
[I 2026-07-17 13:46:58,444] Trial 205 finished with value: -4.772363772544951 and parameters: {'scalers': 'none', 'ratios': 'norm_ratio', 'imputers': 'median', 'n_estimators': 2800, 'learning_rate': 0.48109662590365093, 'max_depth': 12, 'min_child_weight': 1, 'subsample': 0.6, 'colsample_bytree': 0.6, 'colsample_bylevel': 0.8, 'reg_alpha': 4.199103804551372, 'reg_lambda': 0.005685682358260425, 'gamma': 0.0012096362591325761}. Best is trial 194 with value: -6.217476537070693.
[I 2026-07-17 13:47:46,421] Trial 206 finished with value: -5.174816177121156 and parameters: {'scalers': 'none', 'ratios': 'norm_ratio', 'imputers': 'median', 'n_estimators': 2900, 'learning_rate': 0.4861371340557135, 'max_depth': 12, 'min_child_weight': 1, 'subsample': 0.6, 'colsample_bytree': 0.6, 'colsample_bylevel': 0.8, 'reg_alpha': 4.218562265113745, 'reg_lambda': 0.005381580503875334, 'gamma': 6.5353784220733395e-06}. Best is trial 194 with value: -6.217476537070693.
[I 2026-07-17 13:47:57,587] Trial 207 finished with value: -1.5250071900892768 and parameters: {'scalers': 'none', 'ratios': 'norm_ratio', 'imputers': 'median', 'n_estimators': 2800, 'learning_rate': 0.4914059013132403, 'max_depth': 12, 'min_child_weight': 1, 'subsample': 0.6, 'colsample_bytree': 0.6, 'colsample_bylevel': 0.8, 'reg_alpha': 16.520426789082613, 'reg_lambda': 1.908851094112336e-06, 'gamma': 3.522839065744524e-06}. Best is trial 194 with value: -6.217476537070693.
[I 2026-07-17 13:48:40,073] Trial 208 finished with value: -4.766555874842127 and parameters: {'scalers': 'none', 'ratios': 'norm_ratio', 'imputers': 'median', 'n_estimators': 2800, 'learning_rate': 0.49980776833392815, 'max_depth': 12, 'min_child_weight': 1, 'subsample': 0.6, 'colsample_bytree': 0.6, 'colsample_bylevel': 0.8, 'reg_alpha': 4.86677488539423, 'reg_lambda': 1.858138320965524e-05, 'gamma': 3.166209490918968e-06}. Best is trial 194 with value: -6.217476537070693.
[I 2026-07-17 13:49:20,869] Trial 209 finished with value: -4.154533198178802 and parameters: {'scalers': 'none', 'ratios': 'norm_ratio', 'imputers': 'median', 'n_estimators': 2800, 'learning_rate': 0.4846230354193891, 'max_depth': 12, 'min_child_weight': 1, 'subsample': 0.6, 'colsample_bytree': 0.6, 'colsample_bylevel': 0.8, 'reg_alpha': 4.846927593679031, 'reg_lambda': 0.007569902075082878, 'gamma': 0.0015786455216562354}. Best is trial 194 with value: -6.217476537070693.
[I 2026-07-17 13:50:00,915] Trial 210 finished with value: -4.101477550419251 and parameters: {'scalers': 'none', 'ratios': 'norm_ratio', 'imputers': 'median', 'n_estimators': 2800, 'learning_rate': 0.49957418331278886, 'max_depth': 12, 'min_child_weight': 1, 'subsample': 0.6, 'colsample_bytree': 0.6, 'colsample_bylevel': 0.8, 'reg_alpha': 5.049046929021837, 'reg_lambda': 1.6040686953561192e-06, 'gamma': 0.0018759761515797244}. Best is trial 194 with value: -6.217476537070693.
[I 2026-07-17 13:50:41,719] Trial 211 finished with value: -4.216290638603983 and parameters: {'scalers': 'none', 'ratios': 'norm_ratio', 'imputers': 'median', 'n_estimators': 2800, 'learning_rate': 0.4918091659301201, 'max_depth': 12, 'min_child_weight': 1, 'subsample': 0.6, 'colsample_bytree': 0.6, 'colsample_bylevel': 0.8, 'reg_alpha': 4.875373837922711, 'reg_lambda': 1.8702402012322647e-05, 'gamma': 0.0012791972055468104}. Best is trial 194 with value: -6.217476537070693.
[I 2026-07-17 13:51:22,668] Trial 212 finished with value: -4.164358239441529 and parameters: {'scalers': 'none', 'ratios': 'norm_ratio', 'imputers': 'median', 'n_estimators': 2800, 'learning_rate': 0.4761339890709781, 'max_depth': 12, 'min_child_weight': 1, 'subsample': 0.6, 'colsample_bytree': 0.6, 'colsample_bylevel': 0.8, 'reg_alpha': 4.900680465969804, 'reg_lambda': 1.6897134031799211e-06, 'gamma': 0.0012481095162855972}. Best is trial 194 with value: -6.217476537070693.
[I 2026-07-17 13:52:04,458] Trial 213 finished with value: -4.233178686956189 and parameters: {'scalers': 'none', 'ratios': 'norm_ratio', 'imputers': 'median', 'n_estimators': 2800, 'learning_rate': 0.4810370863586554, 'max_depth': 12, 'min_child_weight': 1, 'subsample': 0.6, 'colsample_bytree': 0.6, 'colsample_bylevel': 0.8, 'reg_alpha': 4.78982793351945, 'reg_lambda': 1.7126368656020815e-06, 'gamma': 0.0012586925774870146}. Best is trial 194 with value: -6.217476537070693.
[I 2026-07-17 13:52:44,890] Trial 214 finished with value: -4.3170685276430865 and parameters: {'scalers': 'none', 'ratios': 'norm_ratio', 'imputers': 'median', 'n_estimators': 2800, 'learning_rate': 0.4997460470890693, 'max_depth': 12, 'min_child_weight': 1, 'subsample': 0.6, 'colsample_bytree': 0.6, 'colsample_bylevel': 0.8, 'reg_alpha': 5.416368005380816, 'reg_lambda': 0.004960719214388923, 'gamma': 7.36128649222437e-06}. Best is trial 194 with value: -6.217476537070693.
[I 2026-07-17 13:53:25,352] Trial 215 finished with value: -4.268991718923663 and parameters: {'scalers': 'none', 'ratios': 'norm_ratio', 'imputers': 'median', 'n_estimators': 2800, 'learning_rate': 0.4918577167688513, 'max_depth': 12, 'min_child_weight': 1, 'subsample': 0.6, 'colsample_bytree': 0.6, 'colsample_bylevel': 0.8, 'reg_alpha': 4.9546219000188065, 'reg_lambda': 0.006258359626139896, 'gamma': 0.001404416585612401}. Best is trial 194 with value: -6.217476537070693.
[I 2026-07-17 13:54:06,480] Trial 216 finished with value: -4.451262280505958 and parameters: {'scalers': 'none', 'ratios': 'norm_ratio', 'imputers': 'median', 'n_estimators': 2800, 'learning_rate': 0.4887721827022735, 'max_depth': 12, 'min_child_weight': 1, 'subsample': 0.6, 'colsample_bytree': 0.6, 'colsample_bylevel': 0.8, 'reg_alpha': 5.125192897078778, 'reg_lambda': 0.005248247785153529, 'gamma': 1.7047363964001617e-06}. Best is trial 194 with value: -6.217476537070693.
[I 2026-07-17 13:54:51,570] Trial 217 finished with value: -4.841294604428145 and parameters: {'scalers': 'none', 'ratios': 'norm_ratio', 'imputers': 'median', 'n_estimators': 2900, 'learning_rate': 0.4970703155667108, 'max_depth': 12, 'min_child_weight': 1, 'subsample': 0.6, 'colsample_bytree': 0.6, 'colsample_bylevel': 0.8, 'reg_alpha': 4.809628876571622, 'reg_lambda': 0.016041125247981246, 'gamma': 6.934496681694304e-06}. Best is trial 194 with value: -6.217476537070693.
[I 2026-07-17 13:55:19,379] Trial 218 finished with value: -2.6405931261944553 and parameters: {'scalers': 'none', 'ratios': 'norm_ratio', 'imputers': 'median', 'n_estimators': 2900, 'learning_rate': 0.4954856480829597, 'max_depth': 12, 'min_child_weight': 1, 'subsample': 0.6, 'colsample_bytree': 0.6, 'colsample_bylevel': 0.8, 'reg_alpha': 8.215916332098676, 'reg_lambda': 0.016370040833794265, 'gamma': 7.568487992230788e-06}. Best is trial 194 with value: -6.217476537070693.
[I 2026-07-17 13:55:55,976] Trial 219 finished with value: -3.5460235614098465 and parameters: {'scalers': 'none', 'ratios': 'norm_ratio', 'imputers': 'median', 'n_estimators': 2900, 'learning_rate': 0.4992822034715428, 'max_depth': 12, 'min_child_weight': 1, 'subsample': 0.6, 'colsample_bytree': 0.6, 'colsample_bylevel': 0.8, 'reg_alpha': 6.443827539220691, 'reg_lambda': 0.0035389999593814603, 'gamma': 6.650098952008549e-06}. Best is trial 194 with value: -6.217476537070693.
[I 2026-07-17 13:56:20,415] Trial 220 finished with value: -1.9978797111520117 and parameters: {'scalers': 'none', 'ratios': 'norm_ratio', 'imputers': 'median', 'n_estimators': 2900, 'learning_rate': 0.3493328885431289, 'max_depth': 12, 'min_child_weight': 1, 'subsample': 0.6, 'colsample_bytree': 0.6, 'colsample_bylevel': 0.8, 'reg_alpha': 8.846566748026193, 'reg_lambda': 0.7103263208910825, 'gamma': 8.451368804062918e-06}. Best is trial 194 with value: -6.217476537070693.
[I 2026-07-17 13:56:45,227] Trial 221 finished with value: -1.9784320945028926 and parameters: {'scalers': 'none', 'ratios': 'norm_ratio', 'imputers': 'median', 'n_estimators': 2900, 'learning_rate': 0.34490016386753064, 'max_depth': 12, 'min_child_weight': 1, 'subsample': 0.6, 'colsample_bytree': 0.6, 'colsample_bylevel': 0.8, 'reg_alpha': 8.657753713441931, 'reg_lambda': 0.005054586596106363, 'gamma': 2.2805046138442527e-06}. Best is trial 194 with value: -6.217476537070693.
[I 2026-07-17 13:57:04,612] Trial 222 finished with value: -1.7978113924155366 and parameters: {'scalers': 'none', 'ratios': 'norm_ratio', 'imputers': 'median', 'n_estimators': 2900, 'learning_rate': 0.3617804111275726, 'max_depth': 12, 'min_child_weight': 1, 'subsample': 0.6, 'colsample_bytree': 0.6, 'colsample_bylevel': 0.8, 'reg_alpha': 10.335876610481169, 'reg_lambda': 1.9261583191377687, 'gamma': 2.171121206829545e-06}. Best is trial 194 with value: -6.217476537070693.
[I 2026-07-17 13:57:28,883] Trial 223 finished with value: -1.983358752786079 and parameters: {'scalers': 'none', 'ratios': 'norm_ratio', 'imputers': 'median', 'n_estimators': 2900, 'learning_rate': 0.35530572052235876, 'max_depth': 12, 'min_child_weight': 1, 'subsample': 0.6, 'colsample_bytree': 0.6, 'colsample_bylevel': 0.8, 'reg_alpha': 8.93475697999401, 'reg_lambda': 1.579695154313177e-05, 'gamma': 1.4832000783021435e-06}. Best is trial 194 with value: -6.217476537070693.
[I 2026-07-17 13:57:55,466] Trial 224 finished with value: -2.1163344794101353 and parameters: {'scalers': 'none', 'ratios': 'norm_ratio', 'imputers': 'median', 'n_estimators': 2900, 'learning_rate': 0.3572211189448209, 'max_depth': 12, 'min_child_weight': 1, 'subsample': 0.6, 'colsample_bytree': 0.6, 'colsample_bylevel': 0.8, 'reg_alpha': 8.413098094556446, 'reg_lambda': 0.0025589647806161485, 'gamma': 2.512432696684862e-06}. Best is trial 194 with value: -6.217476537070693.
