[I 2026-07-17 11:42:40,889] Trial 90 finished with value: -0.13117360232105635 and parameters: {'scalers': 'standard', 'ratios': 'log_ratio', 'imputers': 'median', 'n_estimators': 400, 'learning_rate': 0.00018977099453801902, 'max_depth': 11, 'min_child_weight': 10, 'subsample': 0.7, 'colsample_bytree': 0.9, 'colsample_bylevel': 0.9, 'reg_alpha': 8.562475299336077e-05, 'reg_lambda': 0.3216977265724202, 'gamma': 5.04054064561754e-05}. Best is trial 70 with value: -0.13653889546023953.
[I 2026-07-17 11:42:44,682] Trial 91 finished with value: -0.13566842623708794 and parameters: {'scalers': 'standard', 'ratios': 'log_ratio', 'imputers': 'median', 'n_estimators': 400, 'learning_rate': 0.00010023620454869646, 'max_depth': 11, 'min_child_weight': 10, 'subsample': 0.7, 'colsample_bytree': 0.5, 'colsample_bylevel': 0.9, 'reg_alpha': 8.307749510492635e-06, 'reg_lambda': 11.762087402694481, 'gamma': 4.8914403464234054e-05}. Best is trial 70 with value: -0.13653889546023953.
[I 2026-07-17 11:42:48,490] Trial 92 finished with value: -0.13554604750692403 and parameters: {'scalers': 'standard', 'ratios': 'log_ratio', 'imputers': 'median', 'n_estimators': 400, 'learning_rate': 0.00010664269974027514, 'max_depth': 11, 'min_child_weight': 10, 'subsample': 0.7, 'colsample_bytree': 0.5, 'colsample_bylevel': 0.9, 'reg_alpha': 1.195039733219703e-05, 'reg_lambda': 11.760215265515848, 'gamma': 4.745473150635219e-05}. Best is trial 70 with value: -0.13653889546023953.
[I 2026-07-17 11:42:52,469] Trial 93 finished with value: -0.13564283167751745 and parameters: {'scalers': 'standard', 'ratios': 'log_ratio', 'imputers': 'median', 'n_estimators': 400, 'learning_rate': 0.00010300236554172521, 'max_depth': 11, 'min_child_weight': 8, 'subsample': 0.7, 'colsample_bytree': 0.5, 'colsample_bylevel': 0.9, 'reg_alpha': 1.0630260587117458e-05, 'reg_lambda': 27.84366976630762, 'gamma': 4.46340202096365e-05}. Best is trial 70 with value: -0.13653889546023953.
[I 2026-07-17 11:42:57,151] Trial 94 finished with value: -0.1354855640515478 and parameters: {'scalers': 'standard', 'ratios': 'log_ratio', 'imputers': 'median', 'n_estimators': 400, 'learning_rate': 0.00010930405598689758, 'max_depth': 11, 'min_child_weight': 8, 'subsample': 0.7, 'colsample_bytree': 0.5, 'colsample_bylevel': 0.9, 'reg_alpha': 9.83147911925236e-05, 'reg_lambda': 0.19996393101079252, 'gamma': 5.474725065494528e-05}. Best is trial 70 with value: -0.13653889546023953.
[I 2026-07-17 11:43:01,118] Trial 95 finished with value: -0.1349758373982471 and parameters: {'scalers': 'standard', 'ratios': 'log_ratio', 'imputers': 'median', 'n_estimators': 400, 'learning_rate': 0.00013608095995166624, 'max_depth': 10, 'min_child_weight': 8, 'subsample': 0.7, 'colsample_bytree': 0.5, 'colsample_bylevel': 0.9, 'reg_alpha': 0.05169245703025545, 'reg_lambda': 11.808671446344004, 'gamma': 0.000166989503953693}. Best is trial 70 with value: -0.13653889546023953.
[I 2026-07-17 11:43:04,169] Trial 96 finished with value: -0.13561278387868694 and parameters: {'scalers': 'standard', 'ratios': 'log_ratio', 'imputers': 'median', 'n_estimators': 350, 'learning_rate': 0.00011947975701912348, 'max_depth': 10, 'min_child_weight': 8, 'subsample': 0.6, 'colsample_bytree': 0.5, 'colsample_bylevel': 0.9, 'reg_alpha': 9.18896119312389e-05, 'reg_lambda': 10.657422479288373, 'gamma': 0.00017863083344051234}. Best is trial 70 with value: -0.13653889546023953.
[I 2026-07-17 11:43:07,545] Trial 97 finished with value: -0.13562443155740372 and parameters: {'scalers': 'standard', 'ratios': 'log_ratio', 'imputers': 'median', 'n_estimators': 400, 'learning_rate': 0.00010407308789000126, 'max_depth': 10, 'min_child_weight': 8, 'subsample': 0.6, 'colsample_bytree': 0.5, 'colsample_bylevel': 0.9, 'reg_alpha': 9.056266003256515e-05, 'reg_lambda': 27.433743335358365, 'gamma': 0.00011809997724255567}. Best is trial 70 with value: -0.13653889546023953.
[I 2026-07-17 11:43:09,534] Trial 98 finished with value: -0.13636349621156402 and parameters: {'scalers': 'standard', 'ratios': 'log_ratio', 'imputers': 'median', 'n_estimators': 200, 'learning_rate': 0.0001237269127635877, 'max_depth': 10, 'min_child_weight': 8, 'subsample': 0.7, 'colsample_bytree': 0.5, 'colsample_bylevel': 0.9, 'reg_alpha': 0.002309554704067856, 'reg_lambda': 10.959260056128294, 'gamma': 2.281742175208988e-05}. Best is trial 70 with value: -0.13653889546023953.
[I 2026-07-17 11:43:27,033] Trial 99 finished with value: -0.12487805255320192 and parameters: {'scalers': 'standard', 'ratios': 'log_ratio', 'imputers': 'median', 'n_estimators': 2150, 'learning_rate': 0.00013645218725591746, 'max_depth': 10, 'min_child_weight': 8, 'subsample': 0.6, 'colsample_bytree': 0.5, 'colsample_bylevel': 0.9, 'reg_alpha': 0.0020672973476710947, 'reg_lambda': 29.688234234389036, 'gamma': 0.00012111551772476292}. Best is trial 70 with value: -0.13653889546023953.
[I 2026-07-17 11:43:29,978] Trial 100 finished with value: -0.1352469045886605 and parameters: {'scalers': 'standard', 'ratios': 'log_ratio', 'imputers': 'median', 'n_estimators': 350, 'learning_rate': 0.00013794484066428217, 'max_depth': 10, 'min_child_weight': 8, 'subsample': 0.6, 'colsample_bytree': 0.5, 'colsample_bylevel': 0.9, 'reg_alpha': 0.04116303205317285, 'reg_lambda': 28.548179295022372, 'gamma': 0.00017859452207998188}. Best is trial 70 with value: -0.13653889546023953.
[I 2026-07-17 11:43:32,817] Trial 101 finished with value: -0.13527236720385027 and parameters: {'scalers': 'standard', 'ratios': 'log_ratio', 'imputers': 'median', 'n_estimators': 350, 'learning_rate': 0.00013930677366427393, 'max_depth': 10, 'min_child_weight': 9, 'subsample': 0.6, 'colsample_bytree': 0.5, 'colsample_bylevel': 0.9, 'reg_alpha': 0.04751704129926857, 'reg_lambda': 28.285889327632805, 'gamma': 0.00014539491336112994}. Best is trial 70 with value: -0.13653889546023953.
[I 2026-07-17 11:43:37,198] Trial 102 finished with value: -0.13415764014647852 and parameters: {'scalers': 'standard', 'ratios': 'log_ratio', 'imputers': 'median', 'n_estimators': 550, 'learning_rate': 0.00013162574614491147, 'max_depth': 10, 'min_child_weight': 9, 'subsample': 0.6, 'colsample_bytree': 0.5, 'colsample_bylevel': 0.9, 'reg_alpha': 0.04304856008040266, 'reg_lambda': 29.375072763233533, 'gamma': 0.00011881670588889022}. Best is trial 70 with value: -0.13653889546023953.
[I 2026-07-17 11:43:41,382] Trial 104 finished with value: -0.13409830960545288 and parameters: {'scalers': 'standard', 'ratios': 'log_ratio', 'imputers': 'median', 'n_estimators': 200, 'learning_rate': 0.00034968577912843524, 'max_depth': 4, 'min_child_weight': 9, 'subsample': 0.6, 'colsample_bytree': 0.5, 'colsample_bylevel': 1.0, 'reg_alpha': 0.0019033434295376407, 'reg_lambda': 27.66089555682194, 'gamma': 1.965263804272385e-05}. Best is trial 70 with value: -0.13653889546023953.
[I 2026-07-17 11:43:41,549] Trial 103 finished with value: -0.12926132115200356 and parameters: {'scalers': 'standard', 'ratios': 'log_ratio', 'imputers': 'median', 'n_estimators': 550, 'learning_rate': 0.0003368038695181884, 'max_depth': 10, 'min_child_weight': 9, 'subsample': 0.6, 'colsample_bytree': 0.5, 'colsample_bylevel': 0.9, 'reg_alpha': 0.002015795654017903, 'reg_lambda': 29.280873793179722, 'gamma': 0.0001280209183895413}. Best is trial 70 with value: -0.13653889546023953.
[I 2026-07-17 11:43:43,389] Trial 105 finished with value: -0.13368701437292702 and parameters: {'scalers': 'standard', 'ratios': 'log_ratio', 'imputers': 'median', 'n_estimators': 200, 'learning_rate': 0.0003902835865664925, 'max_depth': 9, 'min_child_weight': 9, 'subsample': 0.7, 'colsample_bytree': 0.5, 'colsample_bylevel': 1.0, 'reg_alpha': 0.002582745561579856, 'reg_lambda': 31.63746439253014, 'gamma': 2.3244524659700017e-05}. Best is trial 70 with value: -0.13653889546023953.
[I 2026-07-17 11:43:48,638] Trial 106 finished with value: -0.12725061334301216 and parameters: {'scalers': 'standard', 'ratios': 'log_ratio', 'imputers': 'median', 'n_estimators': 550, 'learning_rate': 0.00040245966219346947, 'max_depth': 9, 'min_child_weight': 7, 'subsample': 0.6, 'colsample_bytree': 0.5, 'colsample_bylevel': 1.0, 'reg_alpha': 0.002214278449559393, 'reg_lambda': 1.318935790792445, 'gamma': 2.165110190109513e-05}. Best is trial 70 with value: -0.13653889546023953.
[I 2026-07-17 11:43:49,742] Trial 107 finished with value: -0.1311960219143524 and parameters: {'scalers': 'standard', 'ratios': 'log_ratio', 'imputers': 'median', 'n_estimators': 550, 'learning_rate': 0.000414908270590882, 'max_depth': 9, 'min_child_weight': 7, 'subsample': 0.7, 'colsample_bytree': 0.5, 'colsample_bylevel': 1.0, 'reg_alpha': 0.00044004743298199715, 'reg_lambda': 0.7904618072752502, 'gamma': 54.29608171311826}. Best is trial 70 with value: -0.13653889546023953.
[I 2026-07-17 11:43:50,623] Trial 108 finished with value: -0.13152341354306976 and parameters: {'scalers': 'standard', 'ratios': 'log_ratio', 'imputers': 'median', 'n_estimators': 550, 'learning_rate': 0.0003916998830845472, 'max_depth': 9, 'min_child_weight': 7, 'subsample': 0.7, 'colsample_bytree': 0.5, 'colsample_bylevel': 1.0, 'reg_alpha': 0.002591461350367738, 'reg_lambda': 0.8844898226438834, 'gamma': 95.10089261894842}. Best is trial 70 with value: -0.13653889546023953.
[I 2026-07-17 11:43:50,778] Trial 109 finished with value: -0.13533037392241304 and parameters: {'scalers': 'standard', 'ratios': 'log_ratio', 'imputers': 'median', 'n_estimators': 200, 'learning_rate': 0.0003716655991882056, 'max_depth': 9, 'min_child_weight': 7, 'subsample': 0.7, 'colsample_bytree': 0.5, 'colsample_bylevel': 1.0, 'reg_alpha': 0.0004357872693860665, 'reg_lambda': 1.4751876229683798, 'gamma': 71.71355703655361}. Best is trial 70 with value: -0.13653889546023953.
[I 2026-07-17 11:43:53,428] Trial 110 finished with value: -0.13283001438790623 and parameters: {'scalers': 'standard', 'ratios': 'log_ratio', 'imputers': 'median', 'n_estimators': 250, 'learning_rate': 0.00038244896082013723, 'max_depth': 9, 'min_child_weight': 7, 'subsample': 0.7, 'colsample_bytree': 0.5, 'colsample_bylevel': 1.0, 'reg_alpha': 0.0002757798500608656, 'reg_lambda': 0.7896722903962716, 'gamma': 2.1738105940342637e-05}. Best is trial 70 with value: -0.13653889546023953.
[I 2026-07-17 11:43:56,119] Trial 111 finished with value: -0.13245766585350083 and parameters: {'scalers': 'standard', 'ratios': 'log_ratio', 'imputers': 'median', 'n_estimators': 250, 'learning_rate': 0.0004138749932974786, 'max_depth': 9, 'min_child_weight': 7, 'subsample': 0.7, 'colsample_bytree': 0.5, 'colsample_bylevel': 1.0, 'reg_alpha': 0.0002632882777145396, 'reg_lambda': 0.6923526352486047, 'gamma': 1.7025796243666284e-05}. Best is trial 70 with value: -0.13653889546023953.
[I 2026-07-17 11:43:57,244] Trial 112 finished with value: -0.13409672338386178 and parameters: {'scalers': 'standard', 'ratios': 'log_ratio', 'imputers': 'median', 'n_estimators': 250, 'learning_rate': 0.00022051048695557527, 'max_depth': 4, 'min_child_weight': 9, 'subsample': 0.7, 'colsample_bytree': 0.6, 'colsample_bylevel': 1.0, 'reg_alpha': 0.0012979266843306057, 'reg_lambda': 1.1521223540935124, 'gamma': 7.472564007628843e-06}. Best is trial 70 with value: -0.13653889546023953.
[I 2026-07-17 11:43:59,873] Trial 113 finished with value: -0.13377395904008788 and parameters: {'scalers': 'standard', 'ratios': 'log_ratio', 'imputers': 'median', 'n_estimators': 250, 'learning_rate': 0.00024102860353277314, 'max_depth': 8, 'min_child_weight': 7, 'subsample': 0.7, 'colsample_bytree': 0.6, 'colsample_bylevel': 1.0, 'reg_alpha': 0.001088317705156656, 'reg_lambda': 3.5016136391120716, 'gamma': 7.904415582263478e-06}. Best is trial 70 with value: -0.13653889546023953.
[I 2026-07-17 11:44:00,582] Trial 114 finished with value: -0.13566397562075008 and parameters: {'scalers': 'standard', 'ratios': 'log_ratio', 'imputers': 'median', 'n_estimators': 150, 'learning_rate': 0.00021433258504812713, 'max_depth': 4, 'min_child_weight': 7, 'subsample': 0.7, 'colsample_bytree': 0.6, 'colsample_bylevel': 0.8, 'reg_alpha': 0.00022245605139299362, 'reg_lambda': 0.06461705329949799, 'gamma': 8.629888159655835e-06}. Best is trial 70 with value: -0.13653889546023953.
[I 2026-07-17 11:44:01,521] Trial 115 finished with value: -0.13403535048802184 and parameters: {'scalers': 'standard', 'ratios': 'log_ratio', 'imputers': 'median', 'n_estimators': 250, 'learning_rate': 0.00024085620800126683, 'max_depth': 4, 'min_child_weight': 10, 'subsample': 0.7, 'colsample_bytree': 0.6, 'colsample_bylevel': 0.8, 'reg_alpha': 0.00028287457769303443, 'reg_lambda': 2.8965926755960854, 'gamma': 1.8164356793198953e-05}. Best is trial 70 with value: -0.13653889546023953.
[I 2026-07-17 11:44:02,152] Trial 116 finished with value: -0.1354136815413141 and parameters: {'scalers': 'standard', 'ratios': 'log_ratio', 'imputers': 'median', 'n_estimators': 150, 'learning_rate': 0.00023961707145128588, 'max_depth': 4, 'min_child_weight': 10, 'subsample': 0.7, 'colsample_bytree': 0.6, 'colsample_bylevel': 0.8, 'reg_alpha': 0.00027597594269206896, 'reg_lambda': 3.5752795375556126, 'gamma': 7.041710634398081e-06}. Best is trial 70 with value: -0.13653889546023953.
[I 2026-07-17 11:44:03,172] Trial 117 finished with value: -0.13413028737592161 and parameters: {'scalers': 'standard', 'ratios': 'log_ratio', 'imputers': 'median', 'n_estimators': 250, 'learning_rate': 0.0002347609095002611, 'max_depth': 4, 'min_child_weight': 10, 'subsample': 0.7, 'colsample_bytree': 0.6, 'colsample_bylevel': 0.9, 'reg_alpha': 0.001142273577991161, 'reg_lambda': 0.06352674759762926, 'gamma': 8.07991602941714e-06}. Best is trial 70 with value: -0.13653889546023953.
[I 2026-07-17 11:44:04,726] Trial 118 finished with value: -0.13590106866339774 and parameters: {'scalers': 'standard', 'ratios': 'log_ratio', 'imputers': 'median', 'n_estimators': 150, 'learning_rate': 0.00022902187362831817, 'max_depth': 11, 'min_child_weight': 10, 'subsample': 0.7, 'colsample_bytree': 0.5, 'colsample_bylevel': 0.9, 'reg_alpha': 5.937183016128006e-06, 'reg_lambda': 2.8269966334999252, 'gamma': 8.58209604478143e-06}. Best is trial 70 with value: -0.13653889546023953.
[I 2026-07-17 11:44:06,028] Trial 119 finished with value: -0.13558387772021874 and parameters: {'scalers': 'standard', 'ratios': 'log_ratio', 'imputers': 'median', 'n_estimators': 150, 'learning_rate': 0.00023282977585823667, 'max_depth': 11, 'min_child_weight': 10, 'subsample': 0.7, 'colsample_bytree': 0.6, 'colsample_bylevel': 0.8, 'reg_alpha': 0.0008459093206068378, 'reg_lambda': 99.73699708594023, 'gamma': 8.723121912264092e-06}. Best is trial 70 with value: -0.13653889546023953.
[I 2026-07-17 11:44:07,574] Trial 120 finished with value: -0.13574768311737664 and parameters: {'scalers': 'standard', 'ratios': 'log_ratio', 'imputers': 'median', 'n_estimators': 150, 'learning_rate': 0.0002447298792330545, 'max_depth': 12, 'min_child_weight': 10, 'subsample': 0.7, 'colsample_bytree': 0.5, 'colsample_bylevel': 0.8, 'reg_alpha': 7.710613445278518e-06, 'reg_lambda': 2.406115281584306, 'gamma': 3.1851928793691104e-05}. Best is trial 70 with value: -0.13653889546023953.
[I 2026-07-17 11:44:09,099] Trial 121 finished with value: -0.13632829144143438 and parameters: {'scalers': 'standard', 'ratios': 'log_ratio', 'imputers': 'median', 'n_estimators': 150, 'learning_rate': 0.00016866062051765004, 'max_depth': 11, 'min_child_weight': 10, 'subsample': 0.7, 'colsample_bytree': 0.5, 'colsample_bylevel': 0.9, 'reg_alpha': 2.0408390501697242e-06, 'reg_lambda': 2.253763799551382, 'gamma': 0.0006094370271038427}. Best is trial 70 with value: -0.13653889546023953.
[I 2026-07-17 11:44:10,337] Trial 122 finished with value: -0.13638503597072318 and parameters: {'scalers': 'standard', 'ratios': 'log_ratio', 'imputers': 'median', 'n_estimators': 150, 'learning_rate': 0.00016110037896146004, 'max_depth': 11, 'min_child_weight': 10, 'subsample': 0.7, 'colsample_bytree': 0.5, 'colsample_bylevel': 0.9, 'reg_alpha': 6.8191912835703205e-06, 'reg_lambda': 83.11784929007287, 'gamma': 2.712613368518388e-05}. Best is trial 70 with value: -0.13653889546023953.
[I 2026-07-17 11:44:11,578] Trial 123 finished with value: -0.13630920055084464 and parameters: {'scalers': 'standard', 'ratios': 'log_ratio', 'imputers': 'median', 'n_estimators': 150, 'learning_rate': 0.00017554628485473401, 'max_depth': 11, 'min_child_weight': 10, 'subsample': 0.7, 'colsample_bytree': 0.5, 'colsample_bylevel': 0.9, 'reg_alpha': 7.348012206748412e-06, 'reg_lambda': 75.71459987082636, 'gamma': 0.0009455534219695668}. Best is trial 70 with value: -0.13653889546023953.
[I 2026-07-17 11:44:23,456] Trial 124 finished with value: -0.12610019429096744 and parameters: {'scalers': 'standard', 'ratios': 'log_ratio', 'imputers': 'median', 'n_estimators': 1550, 'learning_rate': 0.00016846972624592104, 'max_depth': 12, 'min_child_weight': 10, 'subsample': 0.7, 'colsample_bytree': 0.5, 'colsample_bylevel': 0.9, 'reg_alpha': 2.1211151698154765e-06, 'reg_lambda': 83.39306518724639, 'gamma': 0.0006522323288330264}. Best is trial 70 with value: -0.13653889546023953.
[I 2026-07-17 11:44:26,193] Trial 125 finished with value: -0.1350544445730972 and parameters: {'scalers': 'standard', 'ratios': 'log_ratio', 'imputers': 'median', 'n_estimators': 350, 'learning_rate': 0.0001540735699967316, 'max_depth': 11, 'min_child_weight': 10, 'subsample': 0.7, 'colsample_bytree': 0.5, 'colsample_bylevel': 0.9, 'reg_alpha': 6.639808341176146e-06, 'reg_lambda': 99.5019450643667, 'gamma': 0.0009439566476873111}. Best is trial 70 with value: -0.13653889546023953.
[I 2026-07-17 11:44:27,545] Trial 126 finished with value: -0.13641365835744435 and parameters: {'scalers': 'standard', 'ratios': 'log_ratio', 'imputers': 'median', 'n_estimators': 150, 'learning_rate': 0.00015913772701901425, 'max_depth': 12, 'min_child_weight': 10, 'subsample': 0.8, 'colsample_bytree': 0.5, 'colsample_bylevel': 0.9, 'reg_alpha': 2.11163108558259e-06, 'reg_lambda': 99.1828069505003, 'gamma': 0.000925768486798613}. Best is trial 70 with value: -0.13653889546023953.
[I 2026-07-17 11:44:28,640] Trial 127 finished with value: -0.13621532565747382 and parameters: {'scalers': 'standard', 'ratios': 'log_ratio', 'imputers': 'median', 'n_estimators': 100, 'learning_rate': 0.00028589311304129996, 'max_depth': 12, 'min_child_weight': 9, 'subsample': 0.8, 'colsample_bytree': 0.5, 'colsample_bylevel': 0.9, 'reg_alpha': 1.7426358006177298e-05, 'reg_lambda': 42.46518416976101, 'gamma': 3.1327491534750597e-06}. Best is trial 70 with value: -0.13653889546023953.
[I 2026-07-17 11:44:29,693] Trial 128 finished with value: -0.13682012279416167 and parameters: {'scalers': 'standard', 'ratios': 'log_ratio', 'imputers': 'median', 'n_estimators': 100, 'learning_rate': 0.0001596576423643517, 'max_depth': 12, 'min_child_weight': 10, 'subsample': 0.7, 'colsample_bytree': 0.5, 'colsample_bylevel': 0.7, 'reg_alpha': 5.907235128323156e-06, 'reg_lambda': 2.516392063155384, 'gamma': 3.445597358771037e-05}. Best is trial 128 with value: -0.13682012279416167.
[I 2026-07-17 11:44:30,717] Trial 129 finished with value: -0.1367899229631278 and parameters: {'scalers': 'standard', 'ratios': 'log_ratio', 'imputers': 'median', 'n_estimators': 100, 'learning_rate': 0.0001562806425993545, 'max_depth': 12, 'min_child_weight': 10, 'subsample': 0.7, 'colsample_bytree': 0.5, 'colsample_bylevel': 0.9, 'reg_alpha': 2.2273603977344757e-06, 'reg_lambda': 2.2052321158527564, 'gamma': 4.014756180206575e-06}. Best is trial 128 with value: -0.13682012279416167.
[I 2026-07-17 11:44:31,596] Trial 130 finished with value: -0.1367629395675852 and parameters: {'scalers': 'standard', 'ratios': 'log_ratio', 'imputers': 'median', 'n_estimators': 100, 'learning_rate': 0.00016923170466033352, 'max_depth': 12, 'min_child_weight': 9, 'subsample': 0.7, 'colsample_bytree': 0.5, 'colsample_bylevel': 0.9, 'reg_alpha': 5.121093919865886e-06, 'reg_lambda': 76.71738446902454, 'gamma': 0.0025250898690685458}. Best is trial 128 with value: -0.13682012279416167.
[I 2026-07-17 11:44:32,460] Trial 131 finished with value: -0.13678449611998725 and parameters: {'scalers': 'standard', 'ratios': 'log_ratio', 'imputers': 'median', 'n_estimators': 100, 'learning_rate': 0.0001608946981473031, 'max_depth': 12, 'min_child_weight': 9, 'subsample': 0.7, 'colsample_bytree': 0.5, 'colsample_bylevel': 0.9, 'reg_alpha': 4.915667810223451e-06, 'reg_lambda': 82.56203046401657, 'gamma': 0.0024866752506474384}. Best is trial 128 with value: -0.13682012279416167.
[I 2026-07-17 11:44:35,408] Trial 132 finished with value: -0.13519835884935782 and parameters: {'scalers': 'standard', 'ratios': 'log_ratio', 'imputers': 'median', 'n_estimators': 300, 'learning_rate': 0.0001620427703496833, 'max_depth': 11, 'min_child_weight': 9, 'subsample': 0.8, 'colsample_bytree': 0.5, 'colsample_bylevel': 0.9, 'reg_alpha': 5.303081239528583e-06, 'reg_lambda': 42.33065747947682, 'gamma': 0.0034076599358051365}. Best is trial 128 with value: -0.13682012279416167.
[I 2026-07-17 11:44:36,457] Trial 133 finished with value: -0.1361431236191937 and parameters: {'scalers': 'standard', 'ratios': 'log_ratio', 'imputers': 'median', 'n_estimators': 100, 'learning_rate': 0.0002893259580035476, 'max_depth': 12, 'min_child_weight': 9, 'subsample': 0.8, 'colsample_bytree': 0.5, 'colsample_bylevel': 0.9, 'reg_alpha': 1.6775093942610623e-05, 'reg_lambda': 43.98075669184808, 'gamma': 0.00626937790693545}. Best is trial 128 with value: -0.13682012279416167.
[I 2026-07-17 11:44:37,546] Trial 134 finished with value: -0.1360581275453886 and parameters: {'scalers': 'standard', 'ratios': 'log_ratio', 'imputers': 'median', 'n_estimators': 100, 'learning_rate': 0.0002950064683695033, 'max_depth': 12, 'min_child_weight': 9, 'subsample': 0.8, 'colsample_bytree': 0.5, 'colsample_bylevel': 0.9, 'reg_alpha': 5.15295584311292e-06, 'reg_lambda': 18.08428790077643, 'gamma': 0.002249777703572483}. Best is trial 128 with value: -0.13682012279416167.
