[I 2026-07-17 11:46:45,729] A new study created in RDB with name: mult_quant_study_v2
[I 2026-07-17 11:46:49,993] Trial 1 finished with value: -0.7514599596066118 and parameters: {'scalers': 'standard', 'ratios': 'log_ratio', 'imputers': 'median', 'n_estimators': 200, 'learning_rate': 0.001298142952992779, 'max_depth': 4, 'min_child_weight': 5, 'subsample': 0.7, 'colsample_bytree': 0.5, 'colsample_bylevel': 0.8, 'reg_alpha': 6.136621834896204, 'reg_lambda': 0.0390962248708459, 'gamma': 1.0902380802661817}. Best is trial 1 with value: -0.7514599596066118.
[I 2026-07-17 11:46:56,625] Trial 0 finished with value: -0.6480217853551653 and parameters: {'scalers': 'standard', 'ratios': 'log_ratio', 'imputers': 'median', 'n_estimators': 950, 'learning_rate': 0.0024949072453878452, 'max_depth': 8, 'min_child_weight': 3, 'subsample': 0.7, 'colsample_bytree': 1.0, 'colsample_bylevel': 0.8, 'reg_alpha': 0.014445386057382261, 'reg_lambda': 0.0007621479981206541, 'gamma': 1.1567412564292667}. Best is trial 1 with value: -0.7514599596066118.
[I 2026-07-17 11:47:01,701] Trial 4 finished with value: -0.7292473834163903 and parameters: {'scalers': 'robust', 'ratios': 'norm_ratio', 'imputers': 'none', 'n_estimators': 1700, 'learning_rate': 0.4573733026663899, 'max_depth': 6, 'min_child_weight': 6, 'subsample': 0.5, 'colsample_bytree': 0.9, 'colsample_bylevel': 0.5, 'reg_alpha': 0.08666685653256548, 'reg_lambda': 0.48673845327897747, 'gamma': 0.6998155179131956}. Best is trial 1 with value: -0.7514599596066118.
[I 2026-07-17 11:47:02,795] Trial 2 finished with value: -0.7128995000264701 and parameters: {'scalers': 'standard', 'ratios': 'norm_ratio', 'imputers': 'median', 'n_estimators': 200, 'learning_rate': 0.0024886544431919535, 'max_depth': 4, 'min_child_weight': 9, 'subsample': 0.6, 'colsample_bytree': 0.9, 'colsample_bylevel': 1.0, 'reg_alpha': 4.273614885078878, 'reg_lambda': 0.0010597517925877216, 'gamma': 0.017240134439332873}. Best is trial 1 with value: -0.7514599596066118.
[I 2026-07-17 11:47:07,729] Trial 3 finished with value: -0.6787606087061144 and parameters: {'scalers': 'standard', 'ratios': 'norm_ratio', 'imputers': 'mean', 'n_estimators': 700, 'learning_rate': 0.0414711126930385, 'max_depth': 7, 'min_child_weight': 5, 'subsample': 0.5, 'colsample_bytree': 0.6, 'colsample_bylevel': 0.9, 'reg_alpha': 0.000188834188579422, 'reg_lambda': 0.01090757238315977, 'gamma': 5.7297480174785774e-05}. Best is trial 1 with value: -0.7514599596066118.
[I 2026-07-17 11:47:25,420] Trial 5 finished with value: -0.8978101165223421 and parameters: {'scalers': 'none', 'ratios': 'norm_ratio', 'imputers': 'none', 'n_estimators': 2550, 'learning_rate': 0.17855923813292468, 'max_depth': 7, 'min_child_weight': 1, 'subsample': 0.7, 'colsample_bytree': 0.7, 'colsample_bylevel': 0.7, 'reg_alpha': 6.802451781548751e-06, 'reg_lambda': 8.812258112637808e-05, 'gamma': 0.002042532514530903}. Best is trial 5 with value: -0.8978101165223421.
[I 2026-07-17 11:47:38,829] Trial 6 finished with value: -0.6553761493732857 and parameters: {'scalers': 'standard', 'ratios': 'log_ratio', 'imputers': 'median', 'n_estimators': 750, 'learning_rate': 0.026539468398888197, 'max_depth': 12, 'min_child_weight': 2, 'subsample': 0.6, 'colsample_bytree': 1.0, 'colsample_bylevel': 0.7, 'reg_alpha': 0.0016402262827874556, 'reg_lambda': 1.511772750772615, 'gamma': 0.250328190215153}. Best is trial 5 with value: -0.8978101165223421.
[I 2026-07-17 11:47:51,973] Trial 7 finished with value: -0.636265845123607 and parameters: {'scalers': 'standard', 'ratios': 'log_ratio', 'imputers': 'none', 'n_estimators': 1950, 'learning_rate': 0.0016357504562294278, 'max_depth': 8, 'min_child_weight': 9, 'subsample': 0.7, 'colsample_bytree': 0.8, 'colsample_bylevel': 0.5, 'reg_alpha': 1.6727422539383114, 'reg_lambda': 3.0060621133571518e-05, 'gamma': 0.02308595937817198}. Best is trial 5 with value: -0.8978101165223421.
[I 2026-07-17 11:47:54,262] Trial 8 finished with value: -0.7624569045102116 and parameters: {'scalers': 'none', 'ratios': 'norm_ratio', 'imputers': 'none', 'n_estimators': 1100, 'learning_rate': 0.00036545943305356637, 'max_depth': 9, 'min_child_weight': 10, 'subsample': 0.9, 'colsample_bytree': 1.0, 'colsample_bylevel': 0.7, 'reg_alpha': 0.0005923897376482484, 'reg_lambda': 2.2396451592441458, 'gamma': 75.78319773070605}. Best is trial 5 with value: -0.8978101165223421.
[I 2026-07-17 11:47:57,484] Trial 9 finished with value: -0.6833725205561578 and parameters: {'scalers': 'standard', 'ratios': 'norm_ratio', 'imputers': 'none', 'n_estimators': 1100, 'learning_rate': 0.0008414904827465393, 'max_depth': 4, 'min_child_weight': 4, 'subsample': 0.9, 'colsample_bytree': 0.8, 'colsample_bylevel': 0.5, 'reg_alpha': 0.1278703952747057, 'reg_lambda': 9.745718291793075, 'gamma': 0.9205775374848507}. Best is trial 5 with value: -0.8978101165223421.
[I 2026-07-17 11:48:00,510] Trial 10 finished with value: -0.7045606623403893 and parameters: {'scalers': 'standard', 'ratios': 'norm_ratio', 'imputers': 'mean', 'n_estimators': 1750, 'learning_rate': 0.04764975814428712, 'max_depth': 4, 'min_child_weight': 6, 'subsample': 0.9, 'colsample_bytree': 0.5, 'colsample_bylevel': 0.8, 'reg_alpha': 0.7826947162833019, 'reg_lambda': 1.240551556591816, 'gamma': 29.254689338418235}. Best is trial 5 with value: -0.8978101165223421.
[I 2026-07-17 11:48:26,498] Trial 11 finished with value: -0.7117753361453499 and parameters: {'scalers': 'robust', 'ratios': 'log_ratio', 'imputers': 'none', 'n_estimators': 2100, 'learning_rate': 0.021666718133032125, 'max_depth': 11, 'min_child_weight': 8, 'subsample': 1.0, 'colsample_bytree': 0.6, 'colsample_bylevel': 0.6, 'reg_alpha': 1.1917322305105937e-05, 'reg_lambda': 13.302419811939199, 'gamma': 0.006861718948703793}. Best is trial 5 with value: -0.8978101165223421.
[I 2026-07-17 11:48:59,413] Trial 12 finished with value: -0.6686634219456206 and parameters: {'scalers': 'none', 'ratios': 'log_ratio', 'imputers': 'mean', 'n_estimators': 1950, 'learning_rate': 0.0037090282697401595, 'max_depth': 12, 'min_child_weight': 7, 'subsample': 0.5, 'colsample_bytree': 0.7, 'colsample_bylevel': 1.0, 'reg_alpha': 0.0024800604915152175, 'reg_lambda': 0.00013371850610936753, 'gamma': 0.00015324525442706165}. Best is trial 5 with value: -0.8978101165223421.
[I 2026-07-17 11:49:43,586] Trial 13 finished with value: -0.735064177180675 and parameters: {'scalers': 'standard', 'ratios': 'log_ratio', 'imputers': 'mean', 'n_estimators': 2600, 'learning_rate': 0.00012009884854389944, 'max_depth': 10, 'min_child_weight': 3, 'subsample': 0.6, 'colsample_bytree': 1.0, 'colsample_bylevel': 0.5, 'reg_alpha': 0.014904383465262289, 'reg_lambda': 4.14448765957252e-06, 'gamma': 8.633045014241483e-05}. Best is trial 5 with value: -0.8978101165223421.
[I 2026-07-17 11:49:48,136] Trial 14 finished with value: -0.6408341975323382 and parameters: {'scalers': 'robust', 'ratios': 'log_ratio', 'imputers': 'mean', 'n_estimators': 800, 'learning_rate': 0.0028761119336949263, 'max_depth': 5, 'min_child_weight': 6, 'subsample': 1.0, 'colsample_bytree': 0.9, 'colsample_bylevel': 0.6, 'reg_alpha': 0.0003700364270922716, 'reg_lambda': 5.165655017550999, 'gamma': 0.0001567633423650467}. Best is trial 5 with value: -0.8978101165223421.
[I 2026-07-17 11:49:52,473] Trial 15 finished with value: -0.7726866708475127 and parameters: {'scalers': 'standard', 'ratios': 'log_ratio', 'imputers': 'median', 'n_estimators': 1100, 'learning_rate': 0.21044387014650234, 'max_depth': 4, 'min_child_weight': 6, 'subsample': 0.5, 'colsample_bytree': 0.6, 'colsample_bylevel': 0.8, 'reg_alpha': 1.9881197940081174e-05, 'reg_lambda': 30.293650575932933, 'gamma': 0.000468948050208242}. Best is trial 5 with value: -0.8978101165223421.
[I 2026-07-17 11:49:56,641] Trial 16 finished with value: -0.7632363050068978 and parameters: {'scalers': 'standard', 'ratios': 'norm_ratio', 'imputers': 'mean', 'n_estimators': 2300, 'learning_rate': 0.00010656217600107565, 'max_depth': 9, 'min_child_weight': 4, 'subsample': 0.7, 'colsample_bytree': 0.6, 'colsample_bylevel': 0.5, 'reg_alpha': 0.003431835298141154, 'reg_lambda': 11.320492554553171, 'gamma': 12.960242745367289}. Best is trial 5 with value: -0.8978101165223421.
[I 2026-07-17 11:52:05,200] Trial 17 finished with value: -0.7274629805094311 and parameters: {'scalers': 'none', 'ratios': 'norm_ratio', 'imputers': 'mean', 'n_estimators': 3000, 'learning_rate': 0.00012370821622556769, 'max_depth': 12, 'min_child_weight': 1, 'subsample': 1.0, 'colsample_bytree': 0.6, 'colsample_bylevel': 1.0, 'reg_alpha': 1.2200752500084131e-06, 'reg_lambda': 2.088940654270364e-06, 'gamma': 1.009930269449902e-06}. Best is trial 5 with value: -0.8978101165223421.
[I 2026-07-17 11:53:18,547] Trial 18 finished with value: -0.7237497642293844 and parameters: {'scalers': 'none', 'ratios': 'norm_ratio', 'imputers': 'none', 'n_estimators': 2800, 'learning_rate': 0.00014152013569266857, 'max_depth': 10, 'min_child_weight': 1, 'subsample': 1.0, 'colsample_bytree': 0.7, 'colsample_bylevel': 0.7, 'reg_alpha': 3.145671640663088e-06, 'reg_lambda': 8.787367644816851e-06, 'gamma': 5.316846373308984e-06}. Best is trial 5 with value: -0.8978101165223421.
[I 2026-07-17 11:54:28,549] Trial 19 finished with value: -0.7303036217043066 and parameters: {'scalers': 'none', 'ratios': 'norm_ratio', 'imputers': 'none', 'n_estimators': 2950, 'learning_rate': 0.00011891485553576732, 'max_depth': 10, 'min_child_weight': 1, 'subsample': 0.8, 'colsample_bytree': 0.7, 'colsample_bylevel': 0.7, 'reg_alpha': 6.059675882303105e-06, 'reg_lambda': 2.6907157099152657e-06, 'gamma': 1.083794235201056e-06}. Best is trial 5 with value: -0.8978101165223421.
[I 2026-07-17 11:55:08,582] Trial 20 finished with value: -1.3073706060799506 and parameters: {'scalers': 'none', 'ratios': 'norm_ratio', 'imputers': 'none', 'n_estimators': 2850, 'learning_rate': 0.4512287315513329, 'max_depth': 10, 'min_child_weight': 1, 'subsample': 0.8, 'colsample_bytree': 0.7, 'colsample_bylevel': 0.7, 'reg_alpha': 1.5896070562748107e-06, 'reg_lambda': 9.482513412629657e-06, 'gamma': 3.222330078117038e-06}. Best is trial 20 with value: -1.3073706060799506.
[I 2026-07-17 11:56:06,753] Trial 21 finished with value: -1.7714145376289947 and parameters: {'scalers': 'none', 'ratios': 'norm_ratio', 'imputers': 'none', 'n_estimators': 2950, 'learning_rate': 0.33595653778775475, 'max_depth': 9, 'min_child_weight': 1, 'subsample': 0.8, 'colsample_bytree': 0.7, 'colsample_bylevel': 0.7, 'reg_alpha': 2.130295234397725e-06, 'reg_lambda': 78.06460645244917, 'gamma': 1.9196674088526623e-06}. Best is trial 21 with value: -1.7714145376289947.
[I 2026-07-17 11:57:02,360] Trial 22 finished with value: -1.8887426569419334 and parameters: {'scalers': 'none', 'ratios': 'norm_ratio', 'imputers': 'none', 'n_estimators': 2950, 'learning_rate': 0.3891889966554621, 'max_depth': 9, 'min_child_weight': 1, 'subsample': 0.8, 'colsample_bytree': 0.7, 'colsample_bylevel': 0.7, 'reg_alpha': 1.4232374761717344e-06, 'reg_lambda': 85.19025093907132, 'gamma': 4.262224163714241e-06}. Best is trial 22 with value: -1.8887426569419334.
[I 2026-07-17 11:57:26,241] Trial 23 finished with value: -1.2924101665514052 and parameters: {'scalers': 'none', 'ratios': 'norm_ratio', 'imputers': 'median', 'n_estimators': 2850, 'learning_rate': 0.33390216365083836, 'max_depth': 6, 'min_child_weight': 1, 'subsample': 0.8, 'colsample_bytree': 0.7, 'colsample_bylevel': 0.7, 'reg_alpha': 1.6256985234053497e-06, 'reg_lambda': 99.74862165125583, 'gamma': 3.173775105386514e-06}. Best is trial 22 with value: -1.8887426569419334.
[I 2026-07-17 11:57:40,098] Trial 24 finished with value: -1.059269430461742 and parameters: {'scalers': 'none', 'ratios': 'norm_ratio', 'imputers': 'median', 'n_estimators': 2650, 'learning_rate': 0.49362143071116715, 'max_depth': 6, 'min_child_weight': 1, 'subsample': 0.8, 'colsample_bytree': 0.7, 'colsample_bylevel': 0.7, 'reg_alpha': 1.3378593876124585e-06, 'reg_lambda': 0.10823830408534069, 'gamma': 1.8379045977660732e-06}. Best is trial 22 with value: -1.8887426569419334.
[I 2026-07-17 11:57:40,455] Trial 25 finished with value: -0.7471234764567887 and parameters: {'scalers': 'none', 'ratios': 'norm_ratio', 'imputers': 'median', 'n_estimators': 1400, 'learning_rate': 0.482763234686208, 'max_depth': 3, 'min_child_weight': 1, 'subsample': 0.8, 'colsample_bytree': 0.7, 'colsample_bylevel': 0.7, 'reg_alpha': 3.422669166442488e-05, 'reg_lambda': 81.19941377643246, 'gamma': 0.0014335295884587533}. Best is trial 22 with value: -1.8887426569419334.
[I 2026-07-17 11:57:45,410] Trial 26 finished with value: -0.7430668213125432 and parameters: {'scalers': 'none', 'ratios': 'log_ratio', 'imputers': 'median', 'n_estimators': 1400, 'learning_rate': 0.458998851899447, 'max_depth': 3, 'min_child_weight': 2, 'subsample': 0.8, 'colsample_bytree': 0.7, 'colsample_bylevel': 0.9, 'reg_alpha': 3.476379466494034e-05, 'reg_lambda': 88.86626845920499, 'gamma': 0.002228700505417855}. Best is trial 22 with value: -1.8887426569419334.
[I 2026-07-17 11:57:50,430] Trial 27 finished with value: -0.7134393156828005 and parameters: {'scalers': 'none', 'ratios': 'log_ratio', 'imputers': 'median', 'n_estimators': 1500, 'learning_rate': 0.3198390942502482, 'max_depth': 3, 'min_child_weight': 3, 'subsample': 0.8, 'colsample_bytree': 0.8, 'colsample_bylevel': 0.9, 'reg_alpha': 4.970850276157918e-05, 'reg_lambda': 0.0685389645558017, 'gamma': 0.0038144844659532373}. Best is trial 22 with value: -1.8887426569419334.
[I 2026-07-17 11:58:09,562] Trial 28 finished with value: -0.9713930587516123 and parameters: {'scalers': 'none', 'ratios': 'norm_ratio', 'imputers': 'median', 'n_estimators': 2450, 'learning_rate': 0.40682786878156607, 'max_depth': 7, 'min_child_weight': 2, 'subsample': 0.8, 'colsample_bytree': 0.7, 'colsample_bylevel': 0.9, 'reg_alpha': 3.971856325611243e-05, 'reg_lambda': 6.331716048629921e-05, 'gamma': 0.0016837146531707592}. Best is trial 22 with value: -1.8887426569419334.
[I 2026-07-17 11:58:36,458] Trial 29 finished with value: -0.9824439755196117 and parameters: {'scalers': 'none', 'ratios': 'norm_ratio', 'imputers': 'none', 'n_estimators': 2500, 'learning_rate': 0.1475387328982365, 'max_depth': 7, 'min_child_weight': 2, 'subsample': 0.8, 'colsample_bytree': 0.8, 'colsample_bylevel': 0.6, 'reg_alpha': 5.022863214318658e-05, 'reg_lambda': 97.65727830447588, 'gamma': 1.042290844543684e-05}. Best is trial 22 with value: -1.8887426569419334.
[I 2026-07-17 11:59:06,364] Trial 30 finished with value: -1.1025657149566328 and parameters: {'scalers': 'none', 'ratios': 'norm_ratio', 'imputers': 'none', 'n_estimators': 2650, 'learning_rate': 0.44621521540026765, 'max_depth': 9, 'min_child_weight': 2, 'subsample': 0.8, 'colsample_bytree': 0.8, 'colsample_bylevel': 0.6, 'reg_alpha': 5.053384390965916e-05, 'reg_lambda': 0.16172896359408112, 'gamma': 1.0091390001312219e-05}. Best is trial 22 with value: -1.8887426569419334.
[I 2026-07-17 11:59:35,139] Trial 31 finished with value: -0.839508773394119 and parameters: {'scalers': 'none', 'ratios': 'norm_ratio', 'imputers': 'none', 'n_estimators': 2550, 'learning_rate': 0.10181222537902851, 'max_depth': 9, 'min_child_weight': 2, 'subsample': 0.8, 'colsample_bytree': 0.8, 'colsample_bylevel': 0.6, 'reg_alpha': 6.443896698833048e-05, 'reg_lambda': 0.051218759569147974, 'gamma': 1.9144733143990604e-05}. Best is trial 22 with value: -1.8887426569419334.
[I 2026-07-17 12:00:13,388] Trial 32 finished with value: -0.9887637284211722 and parameters: {'scalers': 'none', 'ratios': 'norm_ratio', 'imputers': 'none', 'n_estimators': 2300, 'learning_rate': 0.11370531101366571, 'max_depth': 9, 'min_child_weight': 2, 'subsample': 0.8, 'colsample_bytree': 0.8, 'colsample_bylevel': 0.6, 'reg_alpha': 5.11299635714904e-05, 'reg_lambda': 98.14471001792447, 'gamma': 1.4747378491617789e-05}. Best is trial 22 with value: -1.8887426569419334.
[I 2026-07-17 12:00:16,028] Trial 33 finished with value: -0.6840233752650605 and parameters: {'scalers': 'none', 'ratios': 'norm_ratio', 'imputers': 'none', 'n_estimators': 2350, 'learning_rate': 0.12256605323981308, 'max_depth': 9, 'min_child_weight': 2, 'subsample': 0.9, 'colsample_bytree': 0.8, 'colsample_bylevel': 0.6, 'reg_alpha': 85.96626079293569, 'reg_lambda': 0.21366725566449712, 'gamma': 1.3367998360076353e-05}. Best is trial 22 with value: -1.8887426569419334.
[I 2026-07-17 12:00:42,909] Trial 34 finished with value: -0.8454392015672793 and parameters: {'scalers': 'none', 'ratios': 'norm_ratio', 'imputers': 'none', 'n_estimators': 2350, 'learning_rate': 0.12051458829750067, 'max_depth': 9, 'min_child_weight': 2, 'subsample': 0.9, 'colsample_bytree': 0.8, 'colsample_bylevel': 0.6, 'reg_alpha': 3.6332610628059066e-05, 'reg_lambda': 0.00437112187407854, 'gamma': 1.427092353860537e-05}. Best is trial 22 with value: -1.8887426569419334.
[I 2026-07-17 12:01:10,431] Trial 35 finished with value: -0.8149527005989943 and parameters: {'scalers': 'none', 'ratios': 'norm_ratio', 'imputers': 'none', 'n_estimators': 2400, 'learning_rate': 0.0961742594225256, 'max_depth': 9, 'min_child_weight': 2, 'subsample': 0.9, 'colsample_bytree': 0.8, 'colsample_bylevel': 0.6, 'reg_alpha': 0.00012879444108096922, 'reg_lambda': 0.002696978006265858, 'gamma': 1.4825667966230502e-05}. Best is trial 22 with value: -1.8887426569419334.
[I 2026-07-17 12:01:36,679] Trial 36 finished with value: -0.8464324924462957 and parameters: {'scalers': 'none', 'ratios': 'norm_ratio', 'imputers': 'none', 'n_estimators': 2300, 'learning_rate': 0.11905237859466926, 'max_depth': 9, 'min_child_weight': 2, 'subsample': 0.9, 'colsample_bytree': 0.8, 'colsample_bylevel': 0.6, 'reg_alpha': 0.00010500771005099984, 'reg_lambda': 0.001099595802566931, 'gamma': 1.4251204694368741e-05}. Best is trial 22 with value: -1.8887426569419334.
[I 2026-07-17 12:02:02,247] Trial 37 finished with value: -0.8082196042682216 and parameters: {'scalers': 'robust', 'ratios': 'norm_ratio', 'imputers': 'none', 'n_estimators': 2300, 'learning_rate': 0.09439596912408388, 'max_depth': 9, 'min_child_weight': 3, 'subsample': 0.9, 'colsample_bytree': 0.8, 'colsample_bylevel': 0.6, 'reg_alpha': 0.00012842431235303133, 'reg_lambda': 0.00836151945163516, 'gamma': 1.533652743011467e-05}. Best is trial 22 with value: -1.8887426569419334.
[I 2026-07-17 12:02:26,880] Trial 38 finished with value: -0.8132778519216094 and parameters: {'scalers': 'none', 'ratios': 'norm_ratio', 'imputers': 'none', 'n_estimators': 2800, 'learning_rate': 0.1040581491909261, 'max_depth': 8, 'min_child_weight': 3, 'subsample': 0.9, 'colsample_bytree': 0.6, 'colsample_bylevel': 0.8, 'reg_alpha': 1.2382238455850965e-06, 'reg_lambda': 0.0005162343162717327, 'gamma': 2.892615788965899e-05}. Best is trial 22 with value: -1.8887426569419334.
[I 2026-07-17 12:02:52,419] Trial 39 finished with value: -0.7899485905982786 and parameters: {'scalers': 'none', 'ratios': 'norm_ratio', 'imputers': 'none', 'n_estimators': 2850, 'learning_rate': 0.08595601587315818, 'max_depth': 8, 'min_child_weight': 3, 'subsample': 0.9, 'colsample_bytree': 0.6, 'colsample_bylevel': 0.8, 'reg_alpha': 1.0819044447443291e-06, 'reg_lambda': 0.002202126977868451, 'gamma': 3.831150371396042e-06}. Best is trial 22 with value: -1.8887426569419334.
[I 2026-07-17 12:03:34,635] Trial 40 finished with value: -0.867309614755053 and parameters: {'scalers': 'none', 'ratios': 'norm_ratio', 'imputers': 'none', 'n_estimators': 2850, 'learning_rate': 0.07404696381914863, 'max_depth': 11, 'min_child_weight': 3, 'subsample': 0.9, 'colsample_bytree': 0.5, 'colsample_bylevel': 0.8, 'reg_alpha': 3.1446458432048485e-06, 'reg_lambda': 0.004885333906747022, 'gamma': 3.2947069658162e-06}. Best is trial 22 with value: -1.8887426569419334.
[I 2026-07-17 12:04:21,796] Trial 41 finished with value: -0.8319617979063971 and parameters: {'scalers': 'robust', 'ratios': 'norm_ratio', 'imputers': 'none', 'n_estimators': 2850, 'learning_rate': 0.05316958838581883, 'max_depth': 11, 'min_child_weight': 3, 'subsample': 0.9, 'colsample_bytree': 0.5, 'colsample_bylevel': 0.8, 'reg_alpha': 2.6116906273710694e-06, 'reg_lambda': 19.61850163410354, 'gamma': 3.2710763823690184e-06}. Best is trial 22 with value: -1.8887426569419334.
[I 2026-07-17 12:05:00,152] Trial 42 finished with value: -0.8507871844763533 and parameters: {'scalers': 'robust', 'ratios': 'norm_ratio', 'imputers': 'none', 'n_estimators': 2850, 'learning_rate': 0.0680380415630747, 'max_depth': 11, 'min_child_weight': 3, 'subsample': 0.7, 'colsample_bytree': 0.5, 'colsample_bylevel': 0.8, 'reg_alpha': 2.679586312846104e-06, 'reg_lambda': 0.000369745472257283, 'gamma': 3.926531854901553e-06}. Best is trial 22 with value: -1.8887426569419334.
[I 2026-07-17 12:05:40,114] Trial 43 finished with value: -1.0916968044570907 and parameters: {'scalers': 'robust', 'ratios': 'norm_ratio', 'imputers': 'none', 'n_estimators': 2850, 'learning_rate': 0.2352393835819476, 'max_depth': 11, 'min_child_weight': 3, 'subsample': 0.7, 'colsample_bytree': 0.5, 'colsample_bylevel': 0.8, 'reg_alpha': 3.5927944535304898e-06, 'reg_lambda': 0.00043100478182165995, 'gamma': 3.5019948659854356e-06}. Best is trial 22 with value: -1.8887426569419334.
[I 2026-07-17 12:06:29,377] Trial 44 finished with value: -1.1893655156845586 and parameters: {'scalers': 'robust', 'ratios': 'norm_ratio', 'imputers': 'median', 'n_estimators': 2900, 'learning_rate': 0.25449125512090576, 'max_depth': 11, 'min_child_weight': 3, 'subsample': 0.7, 'colsample_bytree': 0.5, 'colsample_bylevel': 0.8, 'reg_alpha': 2.8614937472977858e-06, 'reg_lambda': 28.94144313502476, 'gamma': 2.211086493753874e-06}. Best is trial 22 with value: -1.8887426569419334.
