[I 2026-07-17 14:47:38,072] Trial 180 finished with value: -0.27583239460928194 and parameters: {'scalers': 'robust', 'ratios': 'norm_ratio', 'imputers': 'mean', 'n_estimators': 2700, 'learning_rate': 0.3041805788719201, 'max_depth': 11, 'min_child_weight': 1, 'subsample': 0.5, 'colsample_bytree': 0.8, 'colsample_bylevel': 0.6, 'reg_alpha': 0.06269170294953354, 'reg_lambda': 0.00035224860836886163, 'gamma': 8.32262189147771e-06}. Best is trial 163 with value: -0.33885235166809097.
[I 2026-07-17 14:47:53,165] Trial 181 finished with value: -0.26035597014038964 and parameters: {'scalers': 'robust', 'ratios': 'norm_ratio', 'imputers': 'mean', 'n_estimators': 2700, 'learning_rate': 0.3010012702562579, 'max_depth': 11, 'min_child_weight': 1, 'subsample': 0.5, 'colsample_bytree': 0.8, 'colsample_bylevel': 0.6, 'reg_alpha': 0.02592246346314275, 'reg_lambda': 0.003297192531393451, 'gamma': 7.867259671397609e-06}. Best is trial 163 with value: -0.33885235166809097.
[I 2026-07-17 14:48:07,943] Trial 182 finished with value: -0.2709020129686631 and parameters: {'scalers': 'robust', 'ratios': 'norm_ratio', 'imputers': 'mean', 'n_estimators': 2500, 'learning_rate': 0.3090290233741262, 'max_depth': 11, 'min_child_weight': 1, 'subsample': 0.5, 'colsample_bytree': 0.8, 'colsample_bylevel': 0.6, 'reg_alpha': 0.05602082867477432, 'reg_lambda': 0.0031115617610390747, 'gamma': 1.7276906855881928e-05}. Best is trial 163 with value: -0.33885235166809097.
[I 2026-07-17 14:48:22,152] Trial 183 finished with value: -0.26317929515013927 and parameters: {'scalers': 'none', 'ratios': 'norm_ratio', 'imputers': 'mean', 'n_estimators': 2500, 'learning_rate': 0.2994683123845271, 'max_depth': 11, 'min_child_weight': 1, 'subsample': 0.5, 'colsample_bytree': 0.8, 'colsample_bylevel': 0.6, 'reg_alpha': 0.05398703491272833, 'reg_lambda': 0.001492109025607355, 'gamma': 8.293613304625373e-06}. Best is trial 163 with value: -0.33885235166809097.
[I 2026-07-17 14:48:37,568] Trial 184 finished with value: -0.26020637027536464 and parameters: {'scalers': 'none', 'ratios': 'norm_ratio', 'imputers': 'mean', 'n_estimators': 2700, 'learning_rate': 0.3048260093250807, 'max_depth': 11, 'min_child_weight': 1, 'subsample': 0.5, 'colsample_bytree': 0.8, 'colsample_bylevel': 0.6, 'reg_alpha': 0.04128703069538898, 'reg_lambda': 0.0031530317696904374, 'gamma': 9.320504444960116e-06}. Best is trial 163 with value: -0.33885235166809097.
[I 2026-07-17 14:48:56,184] Trial 185 finished with value: -0.3405263003470576 and parameters: {'scalers': 'none', 'ratios': 'norm_ratio', 'imputers': 'mean', 'n_estimators': 2450, 'learning_rate': 0.30708888637782417, 'max_depth': 12, 'min_child_weight': 1, 'subsample': 0.5, 'colsample_bytree': 0.8, 'colsample_bylevel': 0.6, 'reg_alpha': 0.1590952747769567, 'reg_lambda': 0.0015148269961061753, 'gamma': 1.8433831365051838e-05}. Best is trial 185 with value: -0.3405263003470576.
[I 2026-07-17 14:49:15,082] Trial 186 finished with value: -0.3559180775904849 and parameters: {'scalers': 'none', 'ratios': 'norm_ratio', 'imputers': 'mean', 'n_estimators': 2450, 'learning_rate': 0.3120248458499451, 'max_depth': 12, 'min_child_weight': 1, 'subsample': 0.5, 'colsample_bytree': 0.8, 'colsample_bylevel': 0.6, 'reg_alpha': 0.15590491170051732, 'reg_lambda': 0.0031513474952523154, 'gamma': 1.5412997206280097e-05}. Best is trial 186 with value: -0.3559180775904849.
[I 2026-07-17 14:49:31,281] Trial 187 finished with value: -0.39753996453274204 and parameters: {'scalers': 'none', 'ratios': 'norm_ratio', 'imputers': 'mean', 'n_estimators': 2450, 'learning_rate': 0.49535473915468714, 'max_depth': 12, 'min_child_weight': 1, 'subsample': 0.5, 'colsample_bytree': 0.8, 'colsample_bylevel': 0.6, 'reg_alpha': 0.01560469696965715, 'reg_lambda': 0.0007940243661463468, 'gamma': 1.4567863013510383e-05}. Best is trial 187 with value: -0.39753996453274204.
[I 2026-07-17 14:49:44,971] Trial 188 finished with value: -0.2565373826017455 and parameters: {'scalers': 'robust', 'ratios': 'norm_ratio', 'imputers': 'mean', 'n_estimators': 2450, 'learning_rate': 0.31220508783725537, 'max_depth': 11, 'min_child_weight': 1, 'subsample': 0.5, 'colsample_bytree': 0.8, 'colsample_bylevel': 0.6, 'reg_alpha': 0.02455493781655318, 'reg_lambda': 0.0007249837164181928, 'gamma': 1.3542864128889414e-05}. Best is trial 187 with value: -0.39753996453274204.
[I 2026-07-17 14:50:00,416] Trial 189 finished with value: -0.26295942849908704 and parameters: {'scalers': 'robust', 'ratios': 'norm_ratio', 'imputers': 'mean', 'n_estimators': 2700, 'learning_rate': 0.3206058427466917, 'max_depth': 11, 'min_child_weight': 1, 'subsample': 0.5, 'colsample_bytree': 0.8, 'colsample_bylevel': 0.6, 'reg_alpha': 0.02984622617437512, 'reg_lambda': 0.0035966198160431576, 'gamma': 1.5139257198089876e-05}. Best is trial 187 with value: -0.39753996453274204.
[I 2026-07-17 14:50:14,349] Trial 190 finished with value: -0.3290139988133005 and parameters: {'scalers': 'robust', 'ratios': 'norm_ratio', 'imputers': 'mean', 'n_estimators': 2450, 'learning_rate': 0.4567491187247592, 'max_depth': 11, 'min_child_weight': 1, 'subsample': 0.5, 'colsample_bytree': 0.8, 'colsample_bylevel': 0.6, 'reg_alpha': 0.02171189802539708, 'reg_lambda': 0.003855971048886219, 'gamma': 1.572120534756404e-05}. Best is trial 187 with value: -0.39753996453274204.
[I 2026-07-17 14:50:32,390] Trial 191 finished with value: -0.27683384683601786 and parameters: {'scalers': 'none', 'ratios': 'norm_ratio', 'imputers': 'mean', 'n_estimators': 2350, 'learning_rate': 0.46210171472493716, 'max_depth': 11, 'min_child_weight': 3, 'subsample': 0.5, 'colsample_bytree': 0.8, 'colsample_bylevel': 0.6, 'reg_alpha': 0.021771897751037793, 'reg_lambda': 0.001581646413517268, 'gamma': 1.4604709645104196e-05}. Best is trial 187 with value: -0.39753996453274204.
[I 2026-07-17 14:50:56,512] Trial 192 finished with value: -0.3029031142107105 and parameters: {'scalers': 'none', 'ratios': 'norm_ratio', 'imputers': 'mean', 'n_estimators': 2500, 'learning_rate': 0.4611474083663678, 'max_depth': 12, 'min_child_weight': 3, 'subsample': 0.5, 'colsample_bytree': 0.8, 'colsample_bylevel': 0.6, 'reg_alpha': 0.17127028802327393, 'reg_lambda': 0.0037568554044736975, 'gamma': 1.7492878349966153e-05}. Best is trial 187 with value: -0.39753996453274204.
[I 2026-07-17 14:51:20,269] Trial 193 finished with value: -0.31009343352473245 and parameters: {'scalers': 'none', 'ratios': 'norm_ratio', 'imputers': 'mean', 'n_estimators': 2450, 'learning_rate': 0.45746322042801124, 'max_depth': 12, 'min_child_weight': 3, 'subsample': 0.5, 'colsample_bytree': 0.8, 'colsample_bylevel': 0.6, 'reg_alpha': 0.17770388938958495, 'reg_lambda': 0.0034858489706301784, 'gamma': 1.4833148129898108e-05}. Best is trial 187 with value: -0.39753996453274204.
[I 2026-07-17 14:51:42,024] Trial 194 finished with value: -0.30754886877105136 and parameters: {'scalers': 'none', 'ratios': 'norm_ratio', 'imputers': 'mean', 'n_estimators': 2450, 'learning_rate': 0.4913696173699886, 'max_depth': 12, 'min_child_weight': 3, 'subsample': 0.5, 'colsample_bytree': 0.8, 'colsample_bylevel': 0.6, 'reg_alpha': 0.022021804940412216, 'reg_lambda': 0.0035934845931414176, 'gamma': 1.2405513702900632e-05}. Best is trial 187 with value: -0.39753996453274204.
[I 2026-07-17 14:52:04,908] Trial 195 finished with value: -0.30973029422478515 and parameters: {'scalers': 'none', 'ratios': 'norm_ratio', 'imputers': 'mean', 'n_estimators': 2350, 'learning_rate': 0.48249004721692285, 'max_depth': 12, 'min_child_weight': 3, 'subsample': 0.5, 'colsample_bytree': 0.8, 'colsample_bylevel': 0.6, 'reg_alpha': 0.16107786073519426, 'reg_lambda': 0.001612735402154583, 'gamma': 1.669662965445712e-05}. Best is trial 187 with value: -0.39753996453274204.
[I 2026-07-17 14:52:26,406] Trial 196 finished with value: -0.3021097763472801 and parameters: {'scalers': 'none', 'ratios': 'norm_ratio', 'imputers': 'mean', 'n_estimators': 2450, 'learning_rate': 0.49848331211080193, 'max_depth': 12, 'min_child_weight': 3, 'subsample': 0.5, 'colsample_bytree': 0.8, 'colsample_bylevel': 0.6, 'reg_alpha': 0.01708406202184961, 'reg_lambda': 0.0015970110047600489, 'gamma': 1.7996946421190887e-05}. Best is trial 187 with value: -0.39753996453274204.
[I 2026-07-17 14:52:42,576] Trial 197 finished with value: -0.35930929384460747 and parameters: {'scalers': 'none', 'ratios': 'norm_ratio', 'imputers': 'mean', 'n_estimators': 2450, 'learning_rate': 0.43708296942029656, 'max_depth': 12, 'min_child_weight': 1, 'subsample': 0.5, 'colsample_bytree': 0.8, 'colsample_bylevel': 0.6, 'reg_alpha': 0.016537568623689696, 'reg_lambda': 0.003613628550039911, 'gamma': 4.2451007542002685e-05}. Best is trial 187 with value: -0.39753996453274204.
[I 2026-07-17 14:53:02,893] Trial 198 finished with value: -0.2967699612197104 and parameters: {'scalers': 'none', 'ratios': 'norm_ratio', 'imputers': 'mean', 'n_estimators': 2300, 'learning_rate': 0.4495129347832308, 'max_depth': 12, 'min_child_weight': 3, 'subsample': 0.5, 'colsample_bytree': 0.8, 'colsample_bylevel': 0.6, 'reg_alpha': 0.019766896921595098, 'reg_lambda': 0.003822003926049065, 'gamma': 1.4767864090995423e-05}. Best is trial 187 with value: -0.39753996453274204.
[I 2026-07-17 14:53:23,631] Trial 199 finished with value: -0.28995978039070613 and parameters: {'scalers': 'none', 'ratios': 'norm_ratio', 'imputers': 'mean', 'n_estimators': 2350, 'learning_rate': 0.44193930931833686, 'max_depth': 12, 'min_child_weight': 3, 'subsample': 0.5, 'colsample_bytree': 0.8, 'colsample_bylevel': 0.6, 'reg_alpha': 0.012164869416642637, 'reg_lambda': 0.003976289503351388, 'gamma': 1.9162032148006354e-05}. Best is trial 187 with value: -0.39753996453274204.
[I 2026-07-17 14:53:43,231] Trial 200 finished with value: -0.2869077822873149 and parameters: {'scalers': 'none', 'ratios': 'norm_ratio', 'imputers': 'mean', 'n_estimators': 2250, 'learning_rate': 0.4699046300523235, 'max_depth': 12, 'min_child_weight': 3, 'subsample': 0.5, 'colsample_bytree': 0.8, 'colsample_bylevel': 0.6, 'reg_alpha': 0.009311881076643606, 'reg_lambda': 0.003678597704216005, 'gamma': 5.503567942482652e-05}. Best is trial 187 with value: -0.39753996453274204.
[I 2026-07-17 14:54:03,628] Trial 201 finished with value: -0.30831340739806273 and parameters: {'scalers': 'none', 'ratios': 'norm_ratio', 'imputers': 'mean', 'n_estimators': 2300, 'learning_rate': 0.49928766208981257, 'max_depth': 12, 'min_child_weight': 3, 'subsample': 0.5, 'colsample_bytree': 0.8, 'colsample_bylevel': 0.6, 'reg_alpha': 0.014485635463646219, 'reg_lambda': 0.004105703754403496, 'gamma': 1.856055186790187e-05}. Best is trial 187 with value: -0.39753996453274204.
[I 2026-07-17 14:54:24,059] Trial 202 finished with value: -0.2929527468522271 and parameters: {'scalers': 'none', 'ratios': 'norm_ratio', 'imputers': 'mean', 'n_estimators': 2350, 'learning_rate': 0.45014719270104897, 'max_depth': 12, 'min_child_weight': 3, 'subsample': 0.5, 'colsample_bytree': 0.8, 'colsample_bylevel': 0.6, 'reg_alpha': 0.01735761003697856, 'reg_lambda': 0.0037916099216183784, 'gamma': 4.881741380891618e-05}. Best is trial 187 with value: -0.39753996453274204.
[I 2026-07-17 14:54:44,299] Trial 203 finished with value: -0.27933614000941365 and parameters: {'scalers': 'none', 'ratios': 'norm_ratio', 'imputers': 'mean', 'n_estimators': 2300, 'learning_rate': 0.436561468019863, 'max_depth': 12, 'min_child_weight': 3, 'subsample': 0.5, 'colsample_bytree': 0.8, 'colsample_bylevel': 0.6, 'reg_alpha': 0.015697701447356792, 'reg_lambda': 0.004181519343313285, 'gamma': 3.8468976206032675e-05}. Best is trial 187 with value: -0.39753996453274204.
[I 2026-07-17 14:55:04,210] Trial 204 finished with value: -0.2858884342591039 and parameters: {'scalers': 'none', 'ratios': 'norm_ratio', 'imputers': 'mean', 'n_estimators': 2300, 'learning_rate': 0.4506703866330667, 'max_depth': 12, 'min_child_weight': 3, 'subsample': 0.5, 'colsample_bytree': 0.8, 'colsample_bylevel': 0.6, 'reg_alpha': 0.01704181529367838, 'reg_lambda': 0.0038086210464394472, 'gamma': 8.16255148364952e-05}. Best is trial 187 with value: -0.39753996453274204.
[I 2026-07-17 14:55:26,643] Trial 205 finished with value: -0.29087301006589317 and parameters: {'scalers': 'none', 'ratios': 'norm_ratio', 'imputers': 'mean', 'n_estimators': 2300, 'learning_rate': 0.45638959387200073, 'max_depth': 12, 'min_child_weight': 3, 'subsample': 0.5, 'colsample_bytree': 0.8, 'colsample_bylevel': 0.6, 'reg_alpha': 0.18945067621076536, 'reg_lambda': 0.003970572608478278, 'gamma': 6.175014445566978e-05}. Best is trial 187 with value: -0.39753996453274204.
[I 2026-07-17 14:55:46,975] Trial 206 finished with value: -0.29513085904039604 and parameters: {'scalers': 'none', 'ratios': 'norm_ratio', 'imputers': 'mean', 'n_estimators': 2300, 'learning_rate': 0.4629310578702294, 'max_depth': 12, 'min_child_weight': 3, 'subsample': 0.5, 'colsample_bytree': 0.8, 'colsample_bylevel': 0.6, 'reg_alpha': 0.01519078502851939, 'reg_lambda': 0.0032667061948994003, 'gamma': 6.966245872805225e-05}. Best is trial 187 with value: -0.39753996453274204.
[I 2026-07-17 14:56:07,231] Trial 207 finished with value: -0.28965335448649654 and parameters: {'scalers': 'none', 'ratios': 'norm_ratio', 'imputers': 'mean', 'n_estimators': 2300, 'learning_rate': 0.453339585137094, 'max_depth': 12, 'min_child_weight': 3, 'subsample': 0.5, 'colsample_bytree': 0.8, 'colsample_bylevel': 0.6, 'reg_alpha': 0.016679879424498764, 'reg_lambda': 0.0037055893711713077, 'gamma': 4.665340105013263e-05}. Best is trial 187 with value: -0.39753996453274204.
[I 2026-07-17 14:56:27,288] Trial 208 finished with value: -0.30656387051087985 and parameters: {'scalers': 'none', 'ratios': 'norm_ratio', 'imputers': 'mean', 'n_estimators': 2300, 'learning_rate': 0.49834746405465613, 'max_depth': 12, 'min_child_weight': 3, 'subsample': 0.5, 'colsample_bytree': 0.8, 'colsample_bylevel': 0.6, 'reg_alpha': 0.009779951720991241, 'reg_lambda': 0.003567266904073153, 'gamma': 5.1148756183907557e-05}. Best is trial 187 with value: -0.39753996453274204.
[I 2026-07-17 14:56:47,395] Trial 209 finished with value: -0.3041275590993589 and parameters: {'scalers': 'none', 'ratios': 'norm_ratio', 'imputers': 'mean', 'n_estimators': 2250, 'learning_rate': 0.4958877847105659, 'max_depth': 12, 'min_child_weight': 3, 'subsample': 0.5, 'colsample_bytree': 0.8, 'colsample_bylevel': 0.6, 'reg_alpha': 0.009573188254845651, 'reg_lambda': 0.004457578686813473, 'gamma': 5.553086259510898e-05}. Best is trial 187 with value: -0.39753996453274204.
[I 2026-07-17 14:57:08,191] Trial 210 finished with value: -0.30187540563723947 and parameters: {'scalers': 'none', 'ratios': 'norm_ratio', 'imputers': 'mean', 'n_estimators': 2300, 'learning_rate': 0.49959856499009525, 'max_depth': 12, 'min_child_weight': 3, 'subsample': 0.5, 'colsample_bytree': 0.8, 'colsample_bylevel': 0.6, 'reg_alpha': 0.009254642861231871, 'reg_lambda': 0.00427641764870965, 'gamma': 5.706512940684848e-05}. Best is trial 187 with value: -0.39753996453274204.
[I 2026-07-17 14:57:28,763] Trial 211 finished with value: -0.29971358272525095 and parameters: {'scalers': 'none', 'ratios': 'norm_ratio', 'imputers': 'mean', 'n_estimators': 2300, 'learning_rate': 0.4925465847342845, 'max_depth': 12, 'min_child_weight': 3, 'subsample': 0.5, 'colsample_bytree': 0.8, 'colsample_bylevel': 0.6, 'reg_alpha': 0.009554475529185048, 'reg_lambda': 0.004020694291884295, 'gamma': 5.78814591609491e-05}. Best is trial 187 with value: -0.39753996453274204.
[I 2026-07-17 14:57:48,710] Trial 212 finished with value: -0.2903617480622589 and parameters: {'scalers': 'none', 'ratios': 'norm_ratio', 'imputers': 'mean', 'n_estimators': 2250, 'learning_rate': 0.460021551644373, 'max_depth': 12, 'min_child_weight': 3, 'subsample': 0.5, 'colsample_bytree': 0.8, 'colsample_bylevel': 0.6, 'reg_alpha': 0.010683761950657818, 'reg_lambda': 0.003929898460032787, 'gamma': 6.990863723785173e-05}. Best is trial 187 with value: -0.39753996453274204.
[I 2026-07-17 14:58:09,089] Trial 213 finished with value: -0.3018172248608269 and parameters: {'scalers': 'none', 'ratios': 'norm_ratio', 'imputers': 'mean', 'n_estimators': 2300, 'learning_rate': 0.4974508709113464, 'max_depth': 12, 'min_child_weight': 3, 'subsample': 0.5, 'colsample_bytree': 0.8, 'colsample_bylevel': 0.6, 'reg_alpha': 0.00965675928758538, 'reg_lambda': 0.004316626698568303, 'gamma': 8.170287434928087e-05}. Best is trial 187 with value: -0.39753996453274204.
[I 2026-07-17 14:58:28,766] Trial 214 finished with value: -0.29085726796205214 and parameters: {'scalers': 'none', 'ratios': 'norm_ratio', 'imputers': 'mean', 'n_estimators': 2200, 'learning_rate': 0.49067993746162697, 'max_depth': 12, 'min_child_weight': 3, 'subsample': 0.5, 'colsample_bytree': 0.8, 'colsample_bylevel': 0.6, 'reg_alpha': 0.014629043232970308, 'reg_lambda': 0.003991653466644383, 'gamma': 5.728565238482012e-05}. Best is trial 187 with value: -0.39753996453274204.
[I 2026-07-17 14:58:48,840] Trial 215 finished with value: -0.29559985377301723 and parameters: {'scalers': 'none', 'ratios': 'norm_ratio', 'imputers': 'mean', 'n_estimators': 2250, 'learning_rate': 0.4719105394663778, 'max_depth': 12, 'min_child_weight': 3, 'subsample': 0.5, 'colsample_bytree': 0.8, 'colsample_bylevel': 0.6, 'reg_alpha': 0.011133539538014542, 'reg_lambda': 0.0043623229317418565, 'gamma': 5.717890451718552e-05}. Best is trial 187 with value: -0.39753996453274204.
[I 2026-07-17 14:59:08,270] Trial 216 finished with value: -0.3099264997281437 and parameters: {'scalers': 'none', 'ratios': 'norm_ratio', 'imputers': 'mean', 'n_estimators': 2200, 'learning_rate': 0.4981192917416199, 'max_depth': 12, 'min_child_weight': 3, 'subsample': 0.5, 'colsample_bytree': 0.8, 'colsample_bylevel': 0.6, 'reg_alpha': 0.008178649030411248, 'reg_lambda': 0.00244099120435589, 'gamma': 0.00010287127281563446}. Best is trial 187 with value: -0.39753996453274204.
[I 2026-07-17 14:59:28,860] Trial 217 finished with value: -0.2968434912028508 and parameters: {'scalers': 'none', 'ratios': 'norm_ratio', 'imputers': 'mean', 'n_estimators': 2350, 'learning_rate': 0.48011017821511287, 'max_depth': 12, 'min_child_weight': 3, 'subsample': 0.5, 'colsample_bytree': 0.8, 'colsample_bylevel': 0.6, 'reg_alpha': 0.0075024798591826454, 'reg_lambda': 0.0025100279706203247, 'gamma': 2.4442335660845497e-05}. Best is trial 187 with value: -0.39753996453274204.
[I 2026-07-17 14:59:48,545] Trial 218 finished with value: -0.30182367623152384 and parameters: {'scalers': 'none', 'ratios': 'norm_ratio', 'imputers': 'mean', 'n_estimators': 2200, 'learning_rate': 0.49462519159367013, 'max_depth': 12, 'min_child_weight': 3, 'subsample': 0.5, 'colsample_bytree': 0.8, 'colsample_bylevel': 0.6, 'reg_alpha': 0.01072143113053722, 'reg_lambda': 0.00230705873724367, 'gamma': 7.122333018068991e-05}. Best is trial 187 with value: -0.39753996453274204.
[I 2026-07-17 15:00:08,456] Trial 219 finished with value: -0.29260902754931584 and parameters: {'scalers': 'none', 'ratios': 'norm_ratio', 'imputers': 'mean', 'n_estimators': 2250, 'learning_rate': 0.46018168255664044, 'max_depth': 12, 'min_child_weight': 3, 'subsample': 0.5, 'colsample_bytree': 0.8, 'colsample_bylevel': 0.6, 'reg_alpha': 0.008689934332877751, 'reg_lambda': 0.002268492814310762, 'gamma': 9.00006041189009e-05}. Best is trial 187 with value: -0.39753996453274204.
[I 2026-07-17 15:00:29,874] Trial 220 finished with value: -0.2983355498860424 and parameters: {'scalers': 'none', 'ratios': 'norm_ratio', 'imputers': 'mean', 'n_estimators': 2400, 'learning_rate': 0.4783419533036045, 'max_depth': 12, 'min_child_weight': 3, 'subsample': 0.5, 'colsample_bytree': 0.8, 'colsample_bylevel': 0.6, 'reg_alpha': 0.00953426861569708, 'reg_lambda': 0.0022911066257449665, 'gamma': 0.0002519657956775551}. Best is trial 187 with value: -0.39753996453274204.
[I 2026-07-17 15:00:51,048] Trial 221 finished with value: -0.29701172326340863 and parameters: {'scalers': 'none', 'ratios': 'norm_ratio', 'imputers': 'mean', 'n_estimators': 2400, 'learning_rate': 0.45149012882729367, 'max_depth': 12, 'min_child_weight': 3, 'subsample': 0.5, 'colsample_bytree': 0.8, 'colsample_bylevel': 0.6, 'reg_alpha': 0.007963809949728874, 'reg_lambda': 0.002347520588188196, 'gamma': 9.472183651031721e-05}. Best is trial 187 with value: -0.39753996453274204.
[I 2026-07-17 15:01:12,348] Trial 222 finished with value: -0.30183243747633814 and parameters: {'scalers': 'none', 'ratios': 'norm_ratio', 'imputers': 'mean', 'n_estimators': 2400, 'learning_rate': 0.4791230028885072, 'max_depth': 12, 'min_child_weight': 3, 'subsample': 0.5, 'colsample_bytree': 0.8, 'colsample_bylevel': 0.6, 'reg_alpha': 0.007760393189595865, 'reg_lambda': 0.002095992924289595, 'gamma': 8.840983048769688e-05}. Best is trial 187 with value: -0.39753996453274204.
[I 2026-07-17 15:01:34,251] Trial 223 finished with value: -0.2950313682889725 and parameters: {'scalers': 'none', 'ratios': 'norm_ratio', 'imputers': 'mean', 'n_estimators': 2400, 'learning_rate': 0.4966005017163495, 'max_depth': 12, 'min_child_weight': 3, 'subsample': 0.5, 'colsample_bytree': 0.8, 'colsample_bylevel': 0.6, 'reg_alpha': 0.0203231559598841, 'reg_lambda': 0.0024633153894394557, 'gamma': 0.00011837828928583156}. Best is trial 187 with value: -0.39753996453274204.
[I 2026-07-17 15:01:53,715] Trial 224 finished with value: -0.29338275638955097 and parameters: {'scalers': 'none', 'ratios': 'norm_ratio', 'imputers': 'mean', 'n_estimators': 2200, 'learning_rate': 0.480886591955641, 'max_depth': 12, 'min_child_weight': 3, 'subsample': 0.5, 'colsample_bytree': 0.8, 'colsample_bylevel': 0.6, 'reg_alpha': 0.0077327595643156555, 'reg_lambda': 0.002346600554870533, 'gamma': 0.00026674289056409435}. Best is trial 187 with value: -0.39753996453274204.
