[I 2026-07-17 14:23:00,466] Trial 90 finished with value: -0.21992245542945565 and parameters: {'scalers': 'robust', 'ratios': 'log_ratio', 'imputers': 'median', 'n_estimators': 2700, 'learning_rate': 0.4953926131108612, 'max_depth': 11, 'min_child_weight': 7, 'subsample': 0.5, 'colsample_bytree': 0.9, 'colsample_bylevel': 0.5, 'reg_alpha': 0.029320577578928073, 'reg_lambda': 0.0024255851006223187, 'gamma': 3.7829660862458264e-06}. Best is trial 89 with value: -0.2223843919399458.
[I 2026-07-17 14:23:20,277] Trial 91 finished with value: -0.2022256900360086 and parameters: {'scalers': 'robust', 'ratios': 'log_ratio', 'imputers': 'median', 'n_estimators': 3000, 'learning_rate': 0.3852979417210863, 'max_depth': 11, 'min_child_weight': 7, 'subsample': 0.5, 'colsample_bytree': 0.9, 'colsample_bylevel': 0.5, 'reg_alpha': 0.0018937152829795385, 'reg_lambda': 0.0029538367250244984, 'gamma': 2.60891955789999e-06}. Best is trial 89 with value: -0.2223843919399458.
[I 2026-07-17 14:23:38,721] Trial 92 finished with value: -0.2607036932259955 and parameters: {'scalers': 'robust', 'ratios': 'log_ratio', 'imputers': 'median', 'n_estimators': 2600, 'learning_rate': 0.4976158405076718, 'max_depth': 11, 'min_child_weight': 5, 'subsample': 0.5, 'colsample_bytree': 0.8, 'colsample_bylevel': 0.5, 'reg_alpha': 0.001750234931912318, 'reg_lambda': 0.0002113251441009386, 'gamma': 2.1988520150315002e-06}. Best is trial 92 with value: -0.2607036932259955.
[I 2026-07-17 14:23:57,287] Trial 93 finished with value: -0.2629369047366021 and parameters: {'scalers': 'robust', 'ratios': 'log_ratio', 'imputers': 'median', 'n_estimators': 2650, 'learning_rate': 0.4971021473721831, 'max_depth': 11, 'min_child_weight': 5, 'subsample': 0.5, 'colsample_bytree': 0.8, 'colsample_bylevel': 0.5, 'reg_alpha': 0.0016463330152290605, 'reg_lambda': 0.005633943124628021, 'gamma': 1.0599732048082475e-06}. Best is trial 93 with value: -0.2629369047366021.
[I 2026-07-17 14:24:14,107] Trial 94 finished with value: -0.20138484030553275 and parameters: {'scalers': 'robust', 'ratios': 'log_ratio', 'imputers': 'median', 'n_estimators': 2650, 'learning_rate': 0.3935954853621433, 'max_depth': 11, 'min_child_weight': 7, 'subsample': 0.5, 'colsample_bytree': 0.8, 'colsample_bylevel': 0.5, 'reg_alpha': 0.0015836125188676195, 'reg_lambda': 0.00020689196802217203, 'gamma': 1.0207298851343868e-06}. Best is trial 93 with value: -0.2629369047366021.
[I 2026-07-17 14:24:35,041] Trial 95 finished with value: -0.2405105576827157 and parameters: {'scalers': 'robust', 'ratios': 'log_ratio', 'imputers': 'median', 'n_estimators': 3000, 'learning_rate': 0.39272687545440743, 'max_depth': 11, 'min_child_weight': 5, 'subsample': 0.5, 'colsample_bytree': 0.8, 'colsample_bylevel': 0.5, 'reg_alpha': 0.0006692363476944192, 'reg_lambda': 0.00022067011015156415, 'gamma': 1.3018993108078397e-06}. Best is trial 93 with value: -0.2629369047366021.
[I 2026-07-17 14:24:55,789] Trial 96 finished with value: -0.23630711672990562 and parameters: {'scalers': 'robust', 'ratios': 'log_ratio', 'imputers': 'median', 'n_estimators': 2900, 'learning_rate': 0.38475081573504943, 'max_depth': 11, 'min_child_weight': 5, 'subsample': 0.5, 'colsample_bytree': 0.8, 'colsample_bylevel': 0.5, 'reg_alpha': 0.7146882619308811, 'reg_lambda': 0.006439477388772441, 'gamma': 1.2438379483922674e-06}. Best is trial 93 with value: -0.2629369047366021.
[I 2026-07-17 14:25:17,080] Trial 97 finished with value: -0.23722168968920304 and parameters: {'scalers': 'robust', 'ratios': 'log_ratio', 'imputers': 'median', 'n_estimators': 3000, 'learning_rate': 0.3676857271690383, 'max_depth': 11, 'min_child_weight': 5, 'subsample': 0.5, 'colsample_bytree': 0.8, 'colsample_bylevel': 0.5, 'reg_alpha': 0.34675488976114816, 'reg_lambda': 0.00021955426725980685, 'gamma': 1.0728543465348387e-06}. Best is trial 93 with value: -0.2629369047366021.
[I 2026-07-17 14:25:35,414] Trial 98 finished with value: -0.21121835310109446 and parameters: {'scalers': 'robust', 'ratios': 'log_ratio', 'imputers': 'median', 'n_estimators': 2900, 'learning_rate': 0.3851408037028202, 'max_depth': 11, 'min_child_weight': 7, 'subsample': 0.5, 'colsample_bytree': 0.8, 'colsample_bylevel': 0.5, 'reg_alpha': 0.23842332612355496, 'reg_lambda': 0.000694206257984392, 'gamma': 1.0126693402032424e-06}. Best is trial 93 with value: -0.2629369047366021.
[I 2026-07-17 14:25:54,500] Trial 99 finished with value: -0.2104127076568708 and parameters: {'scalers': 'robust', 'ratios': 'log_ratio', 'imputers': 'median', 'n_estimators': 3000, 'learning_rate': 0.3849318938492272, 'max_depth': 11, 'min_child_weight': 7, 'subsample': 0.5, 'colsample_bytree': 0.8, 'colsample_bylevel': 0.5, 'reg_alpha': 0.46085716281739336, 'reg_lambda': 0.006171908298522995, 'gamma': 1.1917706576631081e-06}. Best is trial 93 with value: -0.2629369047366021.
[I 2026-07-17 14:26:16,073] Trial 100 finished with value: -0.24145446277975294 and parameters: {'scalers': 'robust', 'ratios': 'log_ratio', 'imputers': 'median', 'n_estimators': 3000, 'learning_rate': 0.3808321472214706, 'max_depth': 11, 'min_child_weight': 5, 'subsample': 0.5, 'colsample_bytree': 0.8, 'colsample_bylevel': 0.5, 'reg_alpha': 0.5316940322922353, 'reg_lambda': 0.0002503231353902967, 'gamma': 1.4296060131437846e-06}. Best is trial 93 with value: -0.2629369047366021.
[I 2026-07-17 14:26:36,400] Trial 101 finished with value: -0.23329411610320483 and parameters: {'scalers': 'robust', 'ratios': 'log_ratio', 'imputers': 'median', 'n_estimators': 2900, 'learning_rate': 0.34845922936782153, 'max_depth': 11, 'min_child_weight': 5, 'subsample': 0.5, 'colsample_bytree': 0.8, 'colsample_bylevel': 0.5, 'reg_alpha': 0.2938076934002085, 'reg_lambda': 0.0001995497860777244, 'gamma': 1.4454930438400301e-06}. Best is trial 93 with value: -0.2629369047366021.
[I 2026-07-17 14:26:53,978] Trial 102 finished with value: -0.23761242691046466 and parameters: {'scalers': 'robust', 'ratios': 'log_ratio', 'imputers': 'median', 'n_estimators': 3000, 'learning_rate': 0.3857650675294381, 'max_depth': 11, 'min_child_weight': 5, 'subsample': 0.5, 'colsample_bytree': 0.8, 'colsample_bylevel': 0.5, 'reg_alpha': 1.4989675494256045, 'reg_lambda': 0.0002200400541246946, 'gamma': 1.3316279607849373e-06}. Best is trial 93 with value: -0.2629369047366021.
[I 2026-07-17 14:27:14,020] Trial 103 finished with value: -0.2371058427108033 and parameters: {'scalers': 'robust', 'ratios': 'log_ratio', 'imputers': 'median', 'n_estimators': 3000, 'learning_rate': 0.39020374848949424, 'max_depth': 11, 'min_child_weight': 5, 'subsample': 0.5, 'colsample_bytree': 0.8, 'colsample_bylevel': 0.5, 'reg_alpha': 0.001621858544926032, 'reg_lambda': 0.00019147361489338822, 'gamma': 1.072082645144445e-06}. Best is trial 93 with value: -0.2629369047366021.
[I 2026-07-17 14:27:25,223] Trial 104 finished with value: -0.213101014051739 and parameters: {'scalers': 'robust', 'ratios': 'log_ratio', 'imputers': 'median', 'n_estimators': 3000, 'learning_rate': 0.3755497239535218, 'max_depth': 11, 'min_child_weight': 5, 'subsample': 0.5, 'colsample_bytree': 0.8, 'colsample_bylevel': 0.5, 'reg_alpha': 3.911211348923552, 'reg_lambda': 0.0007779645399440889, 'gamma': 1.198650359267567e-06}. Best is trial 93 with value: -0.2629369047366021.
[I 2026-07-17 14:27:46,489] Trial 105 finished with value: -0.23278088485091206 and parameters: {'scalers': 'robust', 'ratios': 'log_ratio', 'imputers': 'median', 'n_estimators': 3000, 'learning_rate': 0.34727089402589617, 'max_depth': 11, 'min_child_weight': 5, 'subsample': 0.5, 'colsample_bytree': 0.8, 'colsample_bylevel': 0.5, 'reg_alpha': 0.6758604459809755, 'reg_lambda': 0.006912167787796027, 'gamma': 1.5492828257864167e-06}. Best is trial 93 with value: -0.2629369047366021.
[I 2026-07-17 14:28:06,656] Trial 106 finished with value: -0.23550570888167036 and parameters: {'scalers': 'robust', 'ratios': 'log_ratio', 'imputers': 'median', 'n_estimators': 2850, 'learning_rate': 0.3378018181409838, 'max_depth': 11, 'min_child_weight': 5, 'subsample': 0.5, 'colsample_bytree': 0.8, 'colsample_bylevel': 0.5, 'reg_alpha': 0.6395117198199771, 'reg_lambda': 0.00022723481740003087, 'gamma': 1.9003888130146835e-06}. Best is trial 93 with value: -0.2629369047366021.
[I 2026-07-17 14:28:26,375] Trial 107 finished with value: -0.22579247307088612 and parameters: {'scalers': 'robust', 'ratios': 'log_ratio', 'imputers': 'median', 'n_estimators': 2850, 'learning_rate': 0.3192362907016253, 'max_depth': 11, 'min_child_weight': 5, 'subsample': 0.5, 'colsample_bytree': 0.8, 'colsample_bylevel': 0.5, 'reg_alpha': 0.5471161908294592, 'reg_lambda': 0.00616780595588062, 'gamma': 1.6311207206729257e-06}. Best is trial 93 with value: -0.2629369047366021.
[I 2026-07-17 14:28:46,009] Trial 108 finished with value: -0.2259997826719327 and parameters: {'scalers': 'robust', 'ratios': 'log_ratio', 'imputers': 'median', 'n_estimators': 2850, 'learning_rate': 0.32137678588713076, 'max_depth': 11, 'min_child_weight': 5, 'subsample': 0.5, 'colsample_bytree': 0.8, 'colsample_bylevel': 0.5, 'reg_alpha': 0.5213624369146688, 'reg_lambda': 0.005993231230544765, 'gamma': 2.131446320373437e-06}. Best is trial 93 with value: -0.2629369047366021.
[I 2026-07-17 14:28:56,080] Trial 109 finished with value: -0.19895980774182737 and parameters: {'scalers': 'robust', 'ratios': 'log_ratio', 'imputers': 'median', 'n_estimators': 2850, 'learning_rate': 0.32301389447093376, 'max_depth': 11, 'min_child_weight': 5, 'subsample': 0.5, 'colsample_bytree': 0.7, 'colsample_bylevel': 0.5, 'reg_alpha': 3.0805887090048105, 'reg_lambda': 0.0002863326240158433, 'gamma': 1.648189043209468e-06}. Best is trial 93 with value: -0.2629369047366021.
[I 2026-07-17 14:29:07,874] Trial 110 finished with value: -0.2144447934555286 and parameters: {'scalers': 'robust', 'ratios': 'log_ratio', 'imputers': 'median', 'n_estimators': 2800, 'learning_rate': 0.31024373028976143, 'max_depth': 11, 'min_child_weight': 5, 'subsample': 0.5, 'colsample_bytree': 0.7, 'colsample_bylevel': 0.5, 'reg_alpha': 2.047047320362116, 'reg_lambda': 2.9851625885614098e-05, 'gamma': 1.8150167274443298e-06}. Best is trial 93 with value: -0.2629369047366021.
[I 2026-07-17 14:29:18,220] Trial 111 finished with value: -0.20530341331439775 and parameters: {'scalers': 'robust', 'ratios': 'log_ratio', 'imputers': 'median', 'n_estimators': 2800, 'learning_rate': 0.32169589811307503, 'max_depth': 11, 'min_child_weight': 5, 'subsample': 0.5, 'colsample_bytree': 0.7, 'colsample_bylevel': 0.5, 'reg_alpha': 2.7462405323092676, 'reg_lambda': 0.0002473518794145323, 'gamma': 1.7000773351062957e-06}. Best is trial 93 with value: -0.2629369047366021.
[I 2026-07-17 14:29:28,804] Trial 112 finished with value: -0.20477909291715338 and parameters: {'scalers': 'robust', 'ratios': 'log_ratio', 'imputers': 'median', 'n_estimators': 2800, 'learning_rate': 0.30465669464594936, 'max_depth': 11, 'min_child_weight': 5, 'subsample': 0.5, 'colsample_bytree': 0.7, 'colsample_bylevel': 0.5, 'reg_alpha': 2.608548671824499, 'reg_lambda': 3.242406496977001e-05, 'gamma': 1.777738331316203e-06}. Best is trial 93 with value: -0.2629369047366021.
[I 2026-07-17 14:29:39,908] Trial 113 finished with value: -0.2015652012203014 and parameters: {'scalers': 'robust', 'ratios': 'log_ratio', 'imputers': 'median', 'n_estimators': 2800, 'learning_rate': 0.2963645796316546, 'max_depth': 11, 'min_child_weight': 5, 'subsample': 0.5, 'colsample_bytree': 0.7, 'colsample_bylevel': 0.5, 'reg_alpha': 2.349120247174333, 'reg_lambda': 0.00023147050304949532, 'gamma': 1.8288808311209101e-06}. Best is trial 93 with value: -0.2629369047366021.
[I 2026-07-17 14:29:51,212] Trial 114 finished with value: -0.2063937428925046 and parameters: {'scalers': 'robust', 'ratios': 'log_ratio', 'imputers': 'median', 'n_estimators': 2800, 'learning_rate': 0.29465092068115983, 'max_depth': 11, 'min_child_weight': 5, 'subsample': 0.5, 'colsample_bytree': 0.7, 'colsample_bylevel': 0.5, 'reg_alpha': 2.230181228384585, 'reg_lambda': 0.0002744555483741114, 'gamma': 1.6367872979741926e-06}. Best is trial 93 with value: -0.2629369047366021.
[I 2026-07-17 14:29:59,218] Trial 115 finished with value: -0.18563090813173821 and parameters: {'scalers': 'robust', 'ratios': 'log_ratio', 'imputers': 'median', 'n_estimators': 2800, 'learning_rate': 0.2889584579596811, 'max_depth': 11, 'min_child_weight': 5, 'subsample': 0.5, 'colsample_bytree': 0.7, 'colsample_bylevel': 0.5, 'reg_alpha': 3.7312673908173495, 'reg_lambda': 0.00027023091553003036, 'gamma': 1.6937053210497663e-06}. Best is trial 93 with value: -0.2629369047366021.
[I 2026-07-17 14:30:03,798] Trial 116 finished with value: -0.09070414044930247 and parameters: {'scalers': 'robust', 'ratios': 'log_ratio', 'imputers': 'median', 'n_estimators': 2800, 'learning_rate': 0.13668632708026485, 'max_depth': 4, 'min_child_weight': 5, 'subsample': 0.5, 'colsample_bytree': 0.7, 'colsample_bylevel': 0.5, 'reg_alpha': 2.0920799077224825, 'reg_lambda': 2.4160685820345693e-05, 'gamma': 1.5638398353459415e-06}. Best is trial 93 with value: -0.2629369047366021.
[I 2026-07-17 14:30:17,829] Trial 117 finished with value: -0.05582497980107019 and parameters: {'scalers': 'robust', 'ratios': 'log_ratio', 'imputers': 'median', 'n_estimators': 2950, 'learning_rate': 0.0002701747647984678, 'max_depth': 11, 'min_child_weight': 5, 'subsample': 0.5, 'colsample_bytree': 0.7, 'colsample_bylevel': 0.5, 'reg_alpha': 1.3630284689722802, 'reg_lambda': 4.45093028733254e-05, 'gamma': 1.6134113001145536e-06}. Best is trial 93 with value: -0.2629369047366021.
[I 2026-07-17 14:30:35,745] Trial 118 finished with value: -0.21118644168700376 and parameters: {'scalers': 'robust', 'ratios': 'log_ratio', 'imputers': 'median', 'n_estimators': 2900, 'learning_rate': 0.27459043567627955, 'max_depth': 11, 'min_child_weight': 5, 'subsample': 0.5, 'colsample_bytree': 0.8, 'colsample_bylevel': 0.5, 'reg_alpha': 0.9230699315190913, 'reg_lambda': 0.0002561778939294677, 'gamma': 1.826531311258462e-06}. Best is trial 93 with value: -0.2629369047366021.
[I 2026-07-17 14:30:53,192] Trial 119 finished with value: -0.2049210119041943 and parameters: {'scalers': 'robust', 'ratios': 'log_ratio', 'imputers': 'median', 'n_estimators': 2900, 'learning_rate': 0.26651587272895655, 'max_depth': 11, 'min_child_weight': 5, 'subsample': 0.5, 'colsample_bytree': 0.8, 'colsample_bylevel': 0.5, 'reg_alpha': 1.0239931942197442, 'reg_lambda': 0.00014201009868208223, 'gamma': 1.9609468599947673e-06}. Best is trial 93 with value: -0.2629369047366021.
[I 2026-07-17 14:31:00,994] Trial 120 finished with value: -0.10714503994505777 and parameters: {'scalers': 'robust', 'ratios': 'log_ratio', 'imputers': 'median', 'n_estimators': 2900, 'learning_rate': 0.13966010567504447, 'max_depth': 11, 'min_child_weight': 5, 'subsample': 0.5, 'colsample_bytree': 0.8, 'colsample_bylevel': 0.5, 'reg_alpha': 6.185922420146719, 'reg_lambda': 0.029276260981831365, 'gamma': 5.004237516298716e-06}. Best is trial 93 with value: -0.2629369047366021.
[I 2026-07-17 14:31:08,713] Trial 121 finished with value: -0.10789172877059923 and parameters: {'scalers': 'robust', 'ratios': 'log_ratio', 'imputers': 'median', 'n_estimators': 2900, 'learning_rate': 0.14484427550863474, 'max_depth': 12, 'min_child_weight': 5, 'subsample': 0.5, 'colsample_bytree': 0.8, 'colsample_bylevel': 0.5, 'reg_alpha': 6.458107617776655, 'reg_lambda': 0.021616008865053413, 'gamma': 1.3264760137989378e-06}. Best is trial 93 with value: -0.2629369047366021.
[I 2026-07-17 14:31:13,093] Trial 122 finished with value: -0.07017878324239782 and parameters: {'scalers': 'robust', 'ratios': 'log_ratio', 'imputers': 'median', 'n_estimators': 2950, 'learning_rate': 0.1406676736426075, 'max_depth': 4, 'min_child_weight': 5, 'subsample': 0.5, 'colsample_bytree': 0.8, 'colsample_bylevel': 0.5, 'reg_alpha': 7.479208012518358, 'reg_lambda': 0.00015646282044742604, 'gamma': 4.8276726802442466e-06}. Best is trial 93 with value: -0.2629369047366021.
[I 2026-07-17 14:31:28,514] Trial 123 finished with value: -0.18126052692601355 and parameters: {'scalers': 'robust', 'ratios': 'log_ratio', 'imputers': 'median', 'n_estimators': 2900, 'learning_rate': 0.13817424332072925, 'max_depth': 12, 'min_child_weight': 4, 'subsample': 0.5, 'colsample_bytree': 0.8, 'colsample_bylevel': 0.5, 'reg_alpha': 1.2047294610953385, 'reg_lambda': 0.00015803563718389056, 'gamma': 5.116091194840335e-06}. Best is trial 93 with value: -0.2629369047366021.
[I 2026-07-17 14:31:45,074] Trial 124 finished with value: -0.05549928303418182 and parameters: {'scalers': 'robust', 'ratios': 'log_ratio', 'imputers': 'median', 'n_estimators': 2900, 'learning_rate': 0.00011525934226548698, 'max_depth': 12, 'min_child_weight': 4, 'subsample': 0.5, 'colsample_bytree': 0.8, 'colsample_bylevel': 0.5, 'reg_alpha': 1.156281916826778, 'reg_lambda': 0.0001277322836881381, 'gamma': 4.610830793672512e-06}. Best is trial 93 with value: -0.2629369047366021.
[I 2026-07-17 14:32:01,650] Trial 125 finished with value: -0.19665581139116947 and parameters: {'scalers': 'robust', 'ratios': 'log_ratio', 'imputers': 'median', 'n_estimators': 2550, 'learning_rate': 0.16667986079708105, 'max_depth': 12, 'min_child_weight': 4, 'subsample': 0.5, 'colsample_bytree': 0.8, 'colsample_bylevel': 0.5, 'reg_alpha': 0.849647163355135, 'reg_lambda': 0.03270298551115822, 'gamma': 1.4036686194035283e-05}. Best is trial 93 with value: -0.2629369047366021.
[I 2026-07-17 14:32:07,782] Trial 126 finished with value: -0.10688005146609136 and parameters: {'scalers': 'robust', 'ratios': 'log_ratio', 'imputers': 'median', 'n_estimators': 2500, 'learning_rate': 0.17262465238211075, 'max_depth': 12, 'min_child_weight': 4, 'subsample': 0.5, 'colsample_bytree': 0.8, 'colsample_bylevel': 0.5, 'reg_alpha': 7.353160896712885, 'reg_lambda': 0.00013893707816314395, 'gamma': 5.166276137921607e-06}. Best is trial 93 with value: -0.2629369047366021.
[I 2026-07-17 14:32:29,276] Trial 127 finished with value: -0.2126955675618614 and parameters: {'scalers': 'robust', 'ratios': 'log_ratio', 'imputers': 'median', 'n_estimators': 2950, 'learning_rate': 0.18762867046657328, 'max_depth': 12, 'min_child_weight': 4, 'subsample': 0.5, 'colsample_bytree': 0.8, 'colsample_bylevel': 0.5, 'reg_alpha': 0.45027138936196015, 'reg_lambda': 9.289148944051183e-05, 'gamma': 4.949361810510294e-06}. Best is trial 93 with value: -0.2629369047366021.
[I 2026-07-17 14:32:47,048] Trial 128 finished with value: -0.2067039534765414 and parameters: {'scalers': 'robust', 'ratios': 'log_ratio', 'imputers': 'median', 'n_estimators': 2500, 'learning_rate': 0.1839020505258745, 'max_depth': 12, 'min_child_weight': 4, 'subsample': 0.5, 'colsample_bytree': 0.8, 'colsample_bylevel': 0.5, 'reg_alpha': 0.6080042732811561, 'reg_lambda': 0.017820151424530487, 'gamma': 1.0635777358320041e-06}. Best is trial 93 with value: -0.2629369047366021.
[I 2026-07-17 14:33:02,668] Trial 129 finished with value: -0.1971287477084132 and parameters: {'scalers': 'robust', 'ratios': 'log_ratio', 'imputers': 'median', 'n_estimators': 2450, 'learning_rate': 0.18518000353608013, 'max_depth': 10, 'min_child_weight': 4, 'subsample': 0.5, 'colsample_bytree': 0.8, 'colsample_bylevel': 0.5, 'reg_alpha': 0.5771289063617816, 'reg_lambda': 0.005774005076764117, 'gamma': 1.1127366740447144e-05}. Best is trial 93 with value: -0.2629369047366021.
[I 2026-07-17 14:33:18,516] Trial 130 finished with value: -0.19459844333097057 and parameters: {'scalers': 'robust', 'ratios': 'log_ratio', 'imputers': 'median', 'n_estimators': 2500, 'learning_rate': 0.17451373347458948, 'max_depth': 10, 'min_child_weight': 4, 'subsample': 0.5, 'colsample_bytree': 0.8, 'colsample_bylevel': 0.5, 'reg_alpha': 0.6182137223740994, 'reg_lambda': 0.00010171774625840165, 'gamma': 1.1555737508602515e-05}. Best is trial 93 with value: -0.2629369047366021.
[I 2026-07-17 14:33:34,988] Trial 131 finished with value: -0.19527470433918465 and parameters: {'scalers': 'robust', 'ratios': 'log_ratio', 'imputers': 'median', 'n_estimators': 2550, 'learning_rate': 0.19217970400840514, 'max_depth': 10, 'min_child_weight': 4, 'subsample': 0.5, 'colsample_bytree': 0.8, 'colsample_bylevel': 0.5, 'reg_alpha': 0.5407066384464486, 'reg_lambda': 0.0057222903899012845, 'gamma': 1.1286798892542538e-05}. Best is trial 93 with value: -0.2629369047366021.
[I 2026-07-17 14:33:48,869] Trial 132 finished with value: -0.16567332787312603 and parameters: {'scalers': 'robust', 'ratios': 'log_ratio', 'imputers': 'median', 'n_estimators': 2450, 'learning_rate': 0.18653569131973996, 'max_depth': 10, 'min_child_weight': 6, 'subsample': 0.5, 'colsample_bytree': 0.8, 'colsample_bylevel': 0.5, 'reg_alpha': 0.5388141500112341, 'reg_lambda': 0.006338658622579122, 'gamma': 1.0557358737165906e-05}. Best is trial 93 with value: -0.2629369047366021.
[I 2026-07-17 14:34:07,646] Trial 133 finished with value: -0.22425172038430768 and parameters: {'scalers': 'robust', 'ratios': 'log_ratio', 'imputers': 'median', 'n_estimators': 3000, 'learning_rate': 0.3983475531832884, 'max_depth': 10, 'min_child_weight': 6, 'subsample': 0.5, 'colsample_bytree': 0.8, 'colsample_bylevel': 0.5, 'reg_alpha': 0.44624311116287596, 'reg_lambda': 0.005759098342162017, 'gamma': 1.0770390011554178e-06}. Best is trial 93 with value: -0.2629369047366021.
[I 2026-07-17 14:34:26,481] Trial 134 finished with value: -0.22794518865779564 and parameters: {'scalers': 'robust', 'ratios': 'log_ratio', 'imputers': 'median', 'n_estimators': 3000, 'learning_rate': 0.4020607840214769, 'max_depth': 10, 'min_child_weight': 6, 'subsample': 0.5, 'colsample_bytree': 0.8, 'colsample_bylevel': 0.5, 'reg_alpha': 0.35234232431406987, 'reg_lambda': 0.010162736602634606, 'gamma': 2.283060662135114e-06}. Best is trial 93 with value: -0.2629369047366021.
