[I 2026-07-17 15:06:12,042] Trial 45 finished with value: -0.10371147114636786 and parameters: {'scalers': 'none', 'ratios': 'log_ratio', 'imputers': 'none', 'n_estimators': 2850, 'learning_rate': 0.4266426796365966, 'max_depth': 4, 'min_child_weight': 7, 'subsample': 0.9, 'colsample_bytree': 0.7, 'colsample_bylevel': 0.7, 'reg_alpha': 0.011805512764190495, 'reg_lambda': 84.06412746915238, 'gamma': 0.00033982003496115816}. Best is trial 40 with value: -0.19936911789848752.
[I 2026-07-17 15:06:20,298] Trial 46 finished with value: -0.10738308302973827 and parameters: {'scalers': 'none', 'ratios': 'log_ratio', 'imputers': 'none', 'n_estimators': 2850, 'learning_rate': 0.48479262068220974, 'max_depth': 4, 'min_child_weight': 7, 'subsample': 0.9, 'colsample_bytree': 0.7, 'colsample_bylevel': 0.7, 'reg_alpha': 0.32379050813834703, 'reg_lambda': 82.70208516404195, 'gamma': 0.0002821517337195667}. Best is trial 40 with value: -0.19936911789848752.
[I 2026-07-17 15:06:28,239] Trial 47 finished with value: -0.11272535239783193 and parameters: {'scalers': 'none', 'ratios': 'log_ratio', 'imputers': 'mean', 'n_estimators': 2850, 'learning_rate': 0.43061422072866024, 'max_depth': 4, 'min_child_weight': 7, 'subsample': 0.7, 'colsample_bytree': 0.7, 'colsample_bylevel': 0.7, 'reg_alpha': 0.48416592251482204, 'reg_lambda': 93.02649469337594, 'gamma': 0.00027563139834860023}. Best is trial 40 with value: -0.19936911789848752.
[I 2026-07-17 15:06:36,375] Trial 48 finished with value: -0.11769853715328762 and parameters: {'scalers': 'none', 'ratios': 'log_ratio', 'imputers': 'none', 'n_estimators': 2850, 'learning_rate': 0.47337986892165573, 'max_depth': 4, 'min_child_weight': 7, 'subsample': 0.7, 'colsample_bytree': 0.7, 'colsample_bylevel': 0.7, 'reg_alpha': 0.34267137693450417, 'reg_lambda': 94.98883580218511, 'gamma': 0.0004489278705852489}. Best is trial 40 with value: -0.19936911789848752.
[I 2026-07-17 15:06:56,349] Trial 49 finished with value: -0.2107348261132232 and parameters: {'scalers': 'none', 'ratios': 'log_ratio', 'imputers': 'none', 'n_estimators': 2900, 'learning_rate': 0.49518755297064776, 'max_depth': 12, 'min_child_weight': 7, 'subsample': 0.7, 'colsample_bytree': 0.6, 'colsample_bylevel': 0.7, 'reg_alpha': 0.015244368805769536, 'reg_lambda': 30.275695129985323, 'gamma': 0.00030870810960592415}. Best is trial 49 with value: -0.2107348261132232.
[I 2026-07-17 15:07:14,514] Trial 50 finished with value: -0.17297222094123332 and parameters: {'scalers': 'none', 'ratios': 'log_ratio', 'imputers': 'none', 'n_estimators': 2800, 'learning_rate': 0.308834098541641, 'max_depth': 11, 'min_child_weight': 7, 'subsample': 0.7, 'colsample_bytree': 0.7, 'colsample_bylevel': 0.7, 'reg_alpha': 0.29741530528471005, 'reg_lambda': 28.763039985713196, 'gamma': 0.00037264657855446694}. Best is trial 49 with value: -0.2107348261132232.
[I 2026-07-17 15:07:23,269] Trial 51 finished with value: -0.15295833217034696 and parameters: {'scalers': 'none', 'ratios': 'log_ratio', 'imputers': 'mean', 'n_estimators': 1500, 'learning_rate': 0.2876220277388444, 'max_depth': 12, 'min_child_weight': 7, 'subsample': 0.7, 'colsample_bytree': 0.7, 'colsample_bylevel': 0.7, 'reg_alpha': 1.0621574302796652, 'reg_lambda': 29.78128971219832, 'gamma': 0.00033650563389437483}. Best is trial 49 with value: -0.2107348261132232.
[I 2026-07-17 15:07:33,052] Trial 52 finished with value: -0.1435849313191811 and parameters: {'scalers': 'none', 'ratios': 'log_ratio', 'imputers': 'median', 'n_estimators': 1450, 'learning_rate': 0.2441244224580509, 'max_depth': 12, 'min_child_weight': 7, 'subsample': 0.7, 'colsample_bytree': 0.7, 'colsample_bylevel': 0.8, 'reg_alpha': 0.6380881163480061, 'reg_lambda': 25.627473402192763, 'gamma': 0.0003208801284497281}. Best is trial 49 with value: -0.2107348261132232.
[I 2026-07-17 15:07:42,373] Trial 53 finished with value: -0.14231558420374646 and parameters: {'scalers': 'none', 'ratios': 'log_ratio', 'imputers': 'median', 'n_estimators': 1400, 'learning_rate': 0.21407286558301578, 'max_depth': 12, 'min_child_weight': 6, 'subsample': 0.7, 'colsample_bytree': 0.7, 'colsample_bylevel': 0.8, 'reg_alpha': 0.555600253030318, 'reg_lambda': 32.55012447800118, 'gamma': 0.00024224906144667491}. Best is trial 49 with value: -0.2107348261132232.
[I 2026-07-17 15:07:49,962] Trial 54 finished with value: -0.1412751795381129 and parameters: {'scalers': 'none', 'ratios': 'log_ratio', 'imputers': 'median', 'n_estimators': 1450, 'learning_rate': 0.24878197688777018, 'max_depth': 12, 'min_child_weight': 6, 'subsample': 0.7, 'colsample_bytree': 0.6, 'colsample_bylevel': 0.8, 'reg_alpha': 1.0463752710996048, 'reg_lambda': 24.184792351685342, 'gamma': 0.014508067915643134}. Best is trial 49 with value: -0.2107348261132232.
[I 2026-07-17 15:07:57,484] Trial 55 finished with value: -0.16398962761575023 and parameters: {'scalers': 'none', 'ratios': 'log_ratio', 'imputers': 'median', 'n_estimators': 1450, 'learning_rate': 0.27191455181559243, 'max_depth': 12, 'min_child_weight': 6, 'subsample': 0.5, 'colsample_bytree': 0.6, 'colsample_bylevel': 0.8, 'reg_alpha': 0.9069361591004313, 'reg_lambda': 21.69953776958476, 'gamma': 0.00698810574415048}. Best is trial 49 with value: -0.2107348261132232.
[I 2026-07-17 15:08:04,810] Trial 56 finished with value: -0.15839478426748577 and parameters: {'scalers': 'none', 'ratios': 'log_ratio', 'imputers': 'median', 'n_estimators': 1450, 'learning_rate': 0.2666127666857024, 'max_depth': 12, 'min_child_weight': 6, 'subsample': 0.5, 'colsample_bytree': 0.6, 'colsample_bylevel': 0.8, 'reg_alpha': 1.1482431052286206, 'reg_lambda': 27.001174590738007, 'gamma': 0.0038187702872391222}. Best is trial 49 with value: -0.2107348261132232.
[I 2026-07-17 15:08:11,936] Trial 57 finished with value: -0.1439097697160506 and parameters: {'scalers': 'none', 'ratios': 'log_ratio', 'imputers': 'median', 'n_estimators': 1050, 'learning_rate': 0.2584414982156783, 'max_depth': 12, 'min_child_weight': 6, 'subsample': 0.7, 'colsample_bytree': 0.6, 'colsample_bylevel': 0.8, 'reg_alpha': 0.012959873195814098, 'reg_lambda': 30.151929966624913, 'gamma': 0.01121240277251681}. Best is trial 49 with value: -0.2107348261132232.
[I 2026-07-17 15:08:31,057] Trial 58 finished with value: -0.17453564098094684 and parameters: {'scalers': 'none', 'ratios': 'log_ratio', 'imputers': 'median', 'n_estimators': 2650, 'learning_rate': 0.25012386571697043, 'max_depth': 12, 'min_child_weight': 6, 'subsample': 0.7, 'colsample_bytree': 0.6, 'colsample_bylevel': 0.8, 'reg_alpha': 0.013755227875847539, 'reg_lambda': 20.100414137001785, 'gamma': 0.00548906335351863}. Best is trial 49 with value: -0.2107348261132232.
[I 2026-07-17 15:08:47,845] Trial 59 finished with value: -0.15421154516552316 and parameters: {'scalers': 'none', 'ratios': 'log_ratio', 'imputers': 'median', 'n_estimators': 2550, 'learning_rate': 0.19299161181003546, 'max_depth': 11, 'min_child_weight': 6, 'subsample': 0.7, 'colsample_bytree': 0.6, 'colsample_bylevel': 0.8, 'reg_alpha': 0.012887163150924634, 'reg_lambda': 23.67429601171194, 'gamma': 0.005223640274606449}. Best is trial 49 with value: -0.2107348261132232.
[I 2026-07-17 15:09:04,146] Trial 60 finished with value: -0.14884574832842135 and parameters: {'scalers': 'none', 'ratios': 'log_ratio', 'imputers': 'median', 'n_estimators': 2650, 'learning_rate': 0.17383761381278698, 'max_depth': 11, 'min_child_weight': 6, 'subsample': 0.7, 'colsample_bytree': 0.6, 'colsample_bylevel': 0.8, 'reg_alpha': 0.1588604388240996, 'reg_lambda': 21.714740029328294, 'gamma': 0.01163001478470365}. Best is trial 49 with value: -0.2107348261132232.
[I 2026-07-17 15:09:10,426] Trial 61 finished with value: -0.12587170831794572 and parameters: {'scalers': 'none', 'ratios': 'log_ratio', 'imputers': 'none', 'n_estimators': 1100, 'learning_rate': 0.1529707926452327, 'max_depth': 11, 'min_child_weight': 6, 'subsample': 0.5, 'colsample_bytree': 0.6, 'colsample_bylevel': 0.8, 'reg_alpha': 0.012091179887703212, 'reg_lambda': 16.75403321946604, 'gamma': 0.008655380434351127}. Best is trial 49 with value: -0.2107348261132232.
[I 2026-07-17 15:09:23,783] Trial 62 finished with value: -0.12237166516465109 and parameters: {'scalers': 'none', 'ratios': 'log_ratio', 'imputers': 'none', 'n_estimators': 2600, 'learning_rate': 0.12722483981479676, 'max_depth': 11, 'min_child_weight': 8, 'subsample': 0.5, 'colsample_bytree': 0.6, 'colsample_bylevel': 0.8, 'reg_alpha': 0.014672669497851138, 'reg_lambda': 15.672000868510132, 'gamma': 0.004643529103035493}. Best is trial 49 with value: -0.2107348261132232.
[I 2026-07-17 15:09:39,698] Trial 63 finished with value: -0.12576505488882497 and parameters: {'scalers': 'none', 'ratios': 'log_ratio', 'imputers': 'none', 'n_estimators': 2600, 'learning_rate': 0.14764998791293124, 'max_depth': 11, 'min_child_weight': 8, 'subsample': 0.7, 'colsample_bytree': 0.6, 'colsample_bylevel': 0.7, 'reg_alpha': 0.014507624527275689, 'reg_lambda': 3.4800489839490174, 'gamma': 5.835713951545819e-05}. Best is trial 49 with value: -0.2107348261132232.
[I 2026-07-17 15:09:54,053] Trial 64 finished with value: -0.12688345671217335 and parameters: {'scalers': 'standard', 'ratios': 'log_ratio', 'imputers': 'none', 'n_estimators': 2550, 'learning_rate': 0.15157514652263349, 'max_depth': 11, 'min_child_weight': 8, 'subsample': 0.7, 'colsample_bytree': 0.6, 'colsample_bylevel': 0.7, 'reg_alpha': 0.0167814989645825, 'reg_lambda': 16.53120705551315, 'gamma': 5.018500397173764e-05}. Best is trial 49 with value: -0.2107348261132232.
[I 2026-07-17 15:10:03,250] Trial 65 finished with value: -0.1037225294891709 and parameters: {'scalers': 'none', 'ratios': 'log_ratio', 'imputers': 'none', 'n_estimators': 2600, 'learning_rate': 0.1545236123304061, 'max_depth': 11, 'min_child_weight': 8, 'subsample': 0.7, 'colsample_bytree': 0.6, 'colsample_bylevel': 0.7, 'reg_alpha': 3.549220744086946, 'reg_lambda': 3.483443373804071, 'gamma': 4.9327561677392047e-05}. Best is trial 49 with value: -0.2107348261132232.
[I 2026-07-17 15:10:22,590] Trial 66 finished with value: -0.14707057479854602 and parameters: {'scalers': 'standard', 'ratios': 'log_ratio', 'imputers': 'median', 'n_estimators': 2550, 'learning_rate': 0.14073254285097667, 'max_depth': 11, 'min_child_weight': 5, 'subsample': 0.7, 'colsample_bytree': 0.6, 'colsample_bylevel': 0.9, 'reg_alpha': 0.16172652766774998, 'reg_lambda': 3.444691534013938, 'gamma': 0.0007436448999564652}. Best is trial 49 with value: -0.2107348261132232.
[I 2026-07-17 15:10:41,424] Trial 67 finished with value: -0.1276314477753951 and parameters: {'scalers': 'standard', 'ratios': 'log_ratio', 'imputers': 'mean', 'n_estimators': 2700, 'learning_rate': 0.1025670941910998, 'max_depth': 11, 'min_child_weight': 5, 'subsample': 0.7, 'colsample_bytree': 0.6, 'colsample_bylevel': 0.9, 'reg_alpha': 0.0016903215994018886, 'reg_lambda': 2.623841322766936, 'gamma': 0.0009718666775445138}. Best is trial 49 with value: -0.2107348261132232.
[I 2026-07-17 15:10:55,100] Trial 68 finished with value: -0.11111895647973827 and parameters: {'scalers': 'standard', 'ratios': 'log_ratio', 'imputers': 'none', 'n_estimators': 2450, 'learning_rate': 0.10733162572473778, 'max_depth': 11, 'min_child_weight': 8, 'subsample': 0.7, 'colsample_bytree': 0.5, 'colsample_bylevel': 0.9, 'reg_alpha': 0.0018390500515178376, 'reg_lambda': 3.4863860372156776, 'gamma': 0.0008610814059861793}. Best is trial 49 with value: -0.2107348261132232.
[I 2026-07-17 15:11:01,343] Trial 69 finished with value: -0.07246008244315467 and parameters: {'scalers': 'none', 'ratios': 'log_ratio', 'imputers': 'none', 'n_estimators': 2700, 'learning_rate': 0.0961268029444675, 'max_depth': 11, 'min_child_weight': 8, 'subsample': 0.7, 'colsample_bytree': 0.5, 'colsample_bylevel': 0.9, 'reg_alpha': 7.482514181103872, 'reg_lambda': 3.5882726611880282, 'gamma': 0.0008221879095034927}. Best is trial 49 with value: -0.2107348261132232.
[I 2026-07-17 15:11:13,704] Trial 70 finished with value: -0.17761996829570828 and parameters: {'scalers': 'standard', 'ratios': 'log_ratio', 'imputers': 'mean', 'n_estimators': 2700, 'learning_rate': 0.32620389972569463, 'max_depth': 8, 'min_child_weight': 5, 'subsample': 0.7, 'colsample_bytree': 0.5, 'colsample_bylevel': 0.7, 'reg_alpha': 0.0011503412966918645, 'reg_lambda': 3.2760764169913204, 'gamma': 0.0008274397978819783}. Best is trial 49 with value: -0.2107348261132232.
[I 2026-07-17 15:11:16,293] Trial 71 finished with value: -0.10406080475937109 and parameters: {'scalers': 'standard', 'ratios': 'log_ratio', 'imputers': 'mean', 'n_estimators': 2450, 'learning_rate': 0.3322700221448597, 'max_depth': 8, 'min_child_weight': 5, 'subsample': 0.6, 'colsample_bytree': 0.5, 'colsample_bylevel': 0.9, 'reg_alpha': 4.64556806107192, 'reg_lambda': 2.585543658334973, 'gamma': 0.02929356512614228}. Best is trial 49 with value: -0.2107348261132232.
[I 2026-07-17 15:11:32,731] Trial 72 finished with value: -0.11576775982054795 and parameters: {'scalers': 'standard', 'ratios': 'log_ratio', 'imputers': 'mean', 'n_estimators': 2750, 'learning_rate': 0.10127109142739539, 'max_depth': 8, 'min_child_weight': 5, 'subsample': 0.6, 'colsample_bytree': 0.8, 'colsample_bylevel': 0.9, 'reg_alpha': 0.0014846927838557298, 'reg_lambda': 3.7070035402667543, 'gamma': 0.0008803118835878404}. Best is trial 49 with value: -0.2107348261132232.
[I 2026-07-17 15:11:39,812] Trial 73 finished with value: -0.0682650311755937 and parameters: {'scalers': 'standard', 'ratios': 'log_ratio', 'imputers': 'mean', 'n_estimators': 2750, 'learning_rate': 0.09440555025460683, 'max_depth': 8, 'min_child_weight': 5, 'subsample': 0.6, 'colsample_bytree': 0.9, 'colsample_bylevel': 0.9, 'reg_alpha': 8.297577234972124, 'reg_lambda': 46.01839091840599, 'gamma': 0.0007681256025568524}. Best is trial 49 with value: -0.2107348261132232.
[I 2026-07-17 15:11:42,347] Trial 74 finished with value: -0.05441451427660492 and parameters: {'scalers': 'none', 'ratios': 'norm_ratio', 'imputers': 'mean', 'n_estimators': 2750, 'learning_rate': 0.094427719062817, 'max_depth': 8, 'min_child_weight': 5, 'subsample': 0.6, 'colsample_bytree': 0.8, 'colsample_bylevel': 0.9, 'reg_alpha': 0.0014881890606416733, 'reg_lambda': 0.30384653027694064, 'gamma': 0.42957650081691257}. Best is trial 49 with value: -0.2107348261132232.
[I 2026-07-17 15:11:44,154] Trial 75 finished with value: -0.054454131232089364 and parameters: {'scalers': 'none', 'ratios': 'norm_ratio', 'imputers': 'none', 'n_estimators': 2100, 'learning_rate': 0.3339209262629905, 'max_depth': 8, 'min_child_weight': 7, 'subsample': 0.6, 'colsample_bytree': 0.5, 'colsample_bylevel': 0.7, 'reg_alpha': 0.1531308492199213, 'reg_lambda': 8.500128901502754e-05, 'gamma': 1.4829106547433366}. Best is trial 49 with value: -0.2107348261132232.
[I 2026-07-17 15:11:44,821] Trial 76 finished with value: -0.066816631892166 and parameters: {'scalers': 'none', 'ratios': 'norm_ratio', 'imputers': 'none', 'n_estimators': 750, 'learning_rate': 0.3308305456926969, 'max_depth': 8, 'min_child_weight': 7, 'subsample': 0.6, 'colsample_bytree': 0.8, 'colsample_bylevel': 0.7, 'reg_alpha': 10.483783407091781, 'reg_lambda': 44.845248070835986, 'gamma': 0.00011856616469594792}. Best is trial 49 with value: -0.2107348261132232.
[I 2026-07-17 15:11:46,990] Trial 77 finished with value: -0.08682282513580139 and parameters: {'scalers': 'none', 'ratios': 'norm_ratio', 'imputers': 'none', 'n_estimators': 850, 'learning_rate': 0.33679820813818606, 'max_depth': 8, 'min_child_weight': 4, 'subsample': 0.6, 'colsample_bytree': 0.9, 'colsample_bylevel': 0.7, 'reg_alpha': 0.15800952650267305, 'reg_lambda': 53.20881060547154, 'gamma': 0.10103697140198101}. Best is trial 49 with value: -0.2107348261132232.
[I 2026-07-17 15:11:52,805] Trial 78 finished with value: -0.19730171341528077 and parameters: {'scalers': 'standard', 'ratios': 'norm_ratio', 'imputers': 'mean', 'n_estimators': 1200, 'learning_rate': 0.34379009471396854, 'max_depth': 8, 'min_child_weight': 4, 'subsample': 0.6, 'colsample_bytree': 0.5, 'colsample_bylevel': 0.7, 'reg_alpha': 0.029319444199926683, 'reg_lambda': 43.97707291703249, 'gamma': 0.00013326280705366854}. Best is trial 49 with value: -0.2107348261132232.
[I 2026-07-17 15:12:00,364] Trial 79 finished with value: -0.18121909994005123 and parameters: {'scalers': 'standard', 'ratios': 'norm_ratio', 'imputers': 'mean', 'n_estimators': 2100, 'learning_rate': 0.3218551883213881, 'max_depth': 6, 'min_child_weight': 4, 'subsample': 0.6, 'colsample_bytree': 0.5, 'colsample_bylevel': 0.7, 'reg_alpha': 0.001181815457403905, 'reg_lambda': 48.229111684073814, 'gamma': 0.0025555848628666367}. Best is trial 49 with value: -0.2107348261132232.
[I 2026-07-17 15:12:04,819] Trial 80 finished with value: -0.1640546728764976 and parameters: {'scalers': 'none', 'ratios': 'norm_ratio', 'imputers': 'mean', 'n_estimators': 1200, 'learning_rate': 0.3447045733728419, 'max_depth': 6, 'min_child_weight': 4, 'subsample': 0.6, 'colsample_bytree': 0.5, 'colsample_bylevel': 0.7, 'reg_alpha': 0.00011195951333694365, 'reg_lambda': 41.23862176139489, 'gamma': 0.00011814126501949522}. Best is trial 49 with value: -0.2107348261132232.
[I 2026-07-17 15:12:08,587] Trial 81 finished with value: -0.156218535647467 and parameters: {'scalers': 'none', 'ratios': 'norm_ratio', 'imputers': 'mean', 'n_estimators': 650, 'learning_rate': 0.3294455621286159, 'max_depth': 10, 'min_child_weight': 4, 'subsample': 0.6, 'colsample_bytree': 0.5, 'colsample_bylevel': 0.7, 'reg_alpha': 0.02608277179743231, 'reg_lambda': 5.840595423314008e-05, 'gamma': 0.00011451506365195679}. Best is trial 49 with value: -0.2107348261132232.
[I 2026-07-17 15:12:10,489] Trial 82 finished with value: -0.11438922090361871 and parameters: {'scalers': 'none', 'ratios': 'norm_ratio', 'imputers': 'none', 'n_estimators': 500, 'learning_rate': 0.354967211988032, 'max_depth': 6, 'min_child_weight': 4, 'subsample': 0.8, 'colsample_bytree': 0.5, 'colsample_bylevel': 0.7, 'reg_alpha': 7.696371338003284e-05, 'reg_lambda': 12.378680705289801, 'gamma': 0.00010002375583155468}. Best is trial 49 with value: -0.2107348261132232.
[I 2026-07-17 15:12:18,332] Trial 83 finished with value: -0.14859525846082428 and parameters: {'scalers': 'none', 'ratios': 'norm_ratio', 'imputers': 'none', 'n_estimators': 1250, 'learning_rate': 0.3496387765222288, 'max_depth': 10, 'min_child_weight': 7, 'subsample': 0.8, 'colsample_bytree': 0.5, 'colsample_bylevel': 0.7, 'reg_alpha': 4.346738190441564e-05, 'reg_lambda': 12.213485988404386, 'gamma': 0.00011411834244176371}. Best is trial 49 with value: -0.2107348261132232.
[I 2026-07-17 15:12:38,487] Trial 84 finished with value: -0.2366303824542712 and parameters: {'scalers': 'none', 'ratios': 'norm_ratio', 'imputers': 'mean', 'n_estimators': 2950, 'learning_rate': 0.37019536511555834, 'max_depth': 10, 'min_child_weight': 4, 'subsample': 0.8, 'colsample_bytree': 0.5, 'colsample_bylevel': 0.7, 'reg_alpha': 0.00012984937087408215, 'reg_lambda': 12.677337995512541, 'gamma': 0.0020470474936391627}. Best is trial 84 with value: -0.2366303824542712.
[I 2026-07-17 15:12:46,016] Trial 85 finished with value: -0.15592088858443764 and parameters: {'scalers': 'none', 'ratios': 'log_ratio', 'imputers': 'mean', 'n_estimators': 1200, 'learning_rate': 0.20111714895448088, 'max_depth': 10, 'min_child_weight': 4, 'subsample': 0.8, 'colsample_bytree': 0.5, 'colsample_bylevel': 0.7, 'reg_alpha': 0.02843816110468324, 'reg_lambda': 12.952812399747641, 'gamma': 0.0001235161275711097}. Best is trial 84 with value: -0.2366303824542712.
[I 2026-07-17 15:12:53,879] Trial 86 finished with value: -0.15909657514887032 and parameters: {'scalers': 'standard', 'ratios': 'norm_ratio', 'imputers': 'mean', 'n_estimators': 1250, 'learning_rate': 0.21512766016685744, 'max_depth': 10, 'min_child_weight': 4, 'subsample': 0.8, 'colsample_bytree': 0.5, 'colsample_bylevel': 0.7, 'reg_alpha': 0.029305477815398124, 'reg_lambda': 11.816774897510442, 'gamma': 0.0019157375545582904}. Best is trial 84 with value: -0.2366303824542712.
[I 2026-07-17 15:12:58,093] Trial 87 finished with value: -0.08933536444381288 and parameters: {'scalers': 'standard', 'ratios': 'norm_ratio', 'imputers': 'mean', 'n_estimators': 1300, 'learning_rate': 0.07020712733571793, 'max_depth': 6, 'min_child_weight': 2, 'subsample': 0.8, 'colsample_bytree': 0.5, 'colsample_bylevel': 0.6, 'reg_alpha': 0.0001789855003688526, 'reg_lambda': 14.46140291208281, 'gamma': 0.0024110132087045992}. Best is trial 84 with value: -0.2366303824542712.
[I 2026-07-17 15:13:06,452] Trial 88 finished with value: -0.18096110088793427 and parameters: {'scalers': 'standard', 'ratios': 'norm_ratio', 'imputers': 'mean', 'n_estimators': 1300, 'learning_rate': 0.20339290024764445, 'max_depth': 10, 'min_child_weight': 3, 'subsample': 0.8, 'colsample_bytree': 0.5, 'colsample_bylevel': 0.7, 'reg_alpha': 0.0008727388712235515, 'reg_lambda': 12.831235778366205, 'gamma': 0.0018508297988179291}. Best is trial 84 with value: -0.2366303824542712.
[I 2026-07-17 15:13:13,353] Trial 89 finished with value: -0.16178418324253535 and parameters: {'scalers': 'standard', 'ratios': 'norm_ratio', 'imputers': 'mean', 'n_estimators': 1200, 'learning_rate': 0.20101749020030582, 'max_depth': 9, 'min_child_weight': 3, 'subsample': 0.8, 'colsample_bytree': 0.5, 'colsample_bylevel': 0.7, 'reg_alpha': 0.0008824889292313346, 'reg_lambda': 12.245393290647401, 'gamma': 0.0014523700171547693}. Best is trial 84 with value: -0.2366303824542712.
