[I 2026-07-17 11:47:01,803] Trial 315 finished with value: -0.13694825729079133 and parameters: {'scalers': 'robust', 'ratios': 'norm_ratio', 'imputers': 'none', 'n_estimators': 250, 'learning_rate': 0.00012007211542538065, 'max_depth': 10, 'min_child_weight': 9, 'subsample': 0.8, 'colsample_bytree': 0.5, 'colsample_bylevel': 0.6, 'reg_alpha': 0.08548970026690483, 'reg_lambda': 1.410462800931426, 'gamma': 25.244050514669848}. Best is trial 270 with value: -0.13743029136065493.
[I 2026-07-17 11:47:02,258] Trial 316 finished with value: -0.13706020008887382 and parameters: {'scalers': 'robust', 'ratios': 'norm_ratio', 'imputers': 'none', 'n_estimators': 250, 'learning_rate': 0.00010001108071094252, 'max_depth': 10, 'min_child_weight': 9, 'subsample': 0.8, 'colsample_bytree': 0.5, 'colsample_bylevel': 0.6, 'reg_alpha': 0.013105043326631798, 'reg_lambda': 1.309838928202341, 'gamma': 25.085018961344936}. Best is trial 270 with value: -0.13743029136065493.
[I 2026-07-17 11:47:02,746] Trial 317 finished with value: -0.13702347306642862 and parameters: {'scalers': 'robust', 'ratios': 'norm_ratio', 'imputers': 'none', 'n_estimators': 250, 'learning_rate': 0.00014576093758215678, 'max_depth': 11, 'min_child_weight': 9, 'subsample': 0.8, 'colsample_bytree': 0.5, 'colsample_bylevel': 0.6, 'reg_alpha': 0.09051756765340205, 'reg_lambda': 1.450226357332668, 'gamma': 67.29235141870842}. Best is trial 270 with value: -0.13743029136065493.
[I 2026-07-17 11:47:03,281] Trial 318 finished with value: -0.1358462789032614 and parameters: {'scalers': 'robust', 'ratios': 'norm_ratio', 'imputers': 'none', 'n_estimators': 250, 'learning_rate': 0.0001473073027320284, 'max_depth': 11, 'min_child_weight': 9, 'subsample': 0.8, 'colsample_bytree': 1.0, 'colsample_bylevel': 0.6, 'reg_alpha': 0.011905964047561557, 'reg_lambda': 1.3364320264194358, 'gamma': 24.560041839718135}. Best is trial 270 with value: -0.13743029136065493.
[I 2026-07-17 11:47:03,669] Trial 319 finished with value: -0.137203698622316 and parameters: {'scalers': 'robust', 'ratios': 'norm_ratio', 'imputers': 'none', 'n_estimators': 200, 'learning_rate': 0.00011758098914607891, 'max_depth': 11, 'min_child_weight': 9, 'subsample': 0.8, 'colsample_bytree': 0.5, 'colsample_bylevel': 0.6, 'reg_alpha': 0.012265135685247609, 'reg_lambda': 3.2004425648777377, 'gamma': 66.47345246727585}. Best is trial 270 with value: -0.13743029136065493.
