[I 2026-07-17 12:15:19,723] Trial 180 finished with value: -0.3188412376847904 and parameters: {'scalers': 'standard', 'ratios': 'log_ratio', 'imputers': 'none', 'n_estimators': 2450, 'learning_rate': 0.26879129093334186, 'max_depth': 12, 'min_child_weight': 3, 'subsample': 0.5, 'colsample_bytree': 1.0, 'colsample_bylevel': 1.0, 'reg_alpha': 0.3351300757919421, 'reg_lambda': 15.806392824661193, 'gamma': 1.032142959656294e-06}. Best is trial 150 with value: -0.3503640640126008.
[I 2026-07-17 12:16:31,290] Trial 181 finished with value: -0.2849196474226277 and parameters: {'scalers': 'standard', 'ratios': 'log_ratio', 'imputers': 'none', 'n_estimators': 2450, 'learning_rate': 0.17237941341324048, 'max_depth': 12, 'min_child_weight': 3, 'subsample': 0.5, 'colsample_bytree': 1.0, 'colsample_bylevel': 1.0, 'reg_alpha': 0.3531585646003875, 'reg_lambda': 17.588753469340002, 'gamma': 1.1789646554442218e-06}. Best is trial 150 with value: -0.3503640640126008.
[I 2026-07-17 12:17:27,355] Trial 182 finished with value: -0.28636470269257425 and parameters: {'scalers': 'standard', 'ratios': 'log_ratio', 'imputers': 'none', 'n_estimators': 2450, 'learning_rate': 0.18056840056618043, 'max_depth': 12, 'min_child_weight': 3, 'subsample': 0.5, 'colsample_bytree': 1.0, 'colsample_bylevel': 1.0, 'reg_alpha': 1.5734202975122704, 'reg_lambda': 16.498362385567006, 'gamma': 1.0600685308981285e-06}. Best is trial 150 with value: -0.3503640640126008.
[I 2026-07-17 12:18:28,295] Trial 183 finished with value: -0.2840909350137892 and parameters: {'scalers': 'standard', 'ratios': 'log_ratio', 'imputers': 'none', 'n_estimators': 2450, 'learning_rate': 0.1742528712610644, 'max_depth': 12, 'min_child_weight': 3, 'subsample': 0.5, 'colsample_bytree': 1.0, 'colsample_bylevel': 1.0, 'reg_alpha': 1.498610427855834, 'reg_lambda': 18.617048802617383, 'gamma': 1.02470898263265e-06}. Best is trial 150 with value: -0.3503640640126008.
[I 2026-07-17 12:19:29,292] Trial 184 finished with value: -0.3000438565163484 and parameters: {'scalers': 'standard', 'ratios': 'log_ratio', 'imputers': 'none', 'n_estimators': 2450, 'learning_rate': 0.22092891391366187, 'max_depth': 12, 'min_child_weight': 3, 'subsample': 0.5, 'colsample_bytree': 1.0, 'colsample_bylevel': 1.0, 'reg_alpha': 1.8334074387645203, 'reg_lambda': 17.09238998334398, 'gamma': 1.0703320904883667e-06}. Best is trial 150 with value: -0.3503640640126008.
[I 2026-07-17 12:20:26,216] Trial 185 finished with value: -0.2799278652881636 and parameters: {'scalers': 'standard', 'ratios': 'log_ratio', 'imputers': 'none', 'n_estimators': 2400, 'learning_rate': 0.17485816222085665, 'max_depth': 12, 'min_child_weight': 3, 'subsample': 0.5, 'colsample_bytree': 1.0, 'colsample_bylevel': 1.0, 'reg_alpha': 1.7558963433094157, 'reg_lambda': 18.274989079024174, 'gamma': 1.3404744502729595e-06}. Best is trial 150 with value: -0.3503640640126008.
[I 2026-07-17 12:21:05,556] Trial 186 finished with value: -0.2550274717453177 and parameters: {'scalers': 'standard', 'ratios': 'log_ratio', 'imputers': 'none', 'n_estimators': 2400, 'learning_rate': 0.19154712478447683, 'max_depth': 12, 'min_child_weight': 3, 'subsample': 0.5, 'colsample_bytree': 1.0, 'colsample_bylevel': 1.0, 'reg_alpha': 4.477746792450438, 'reg_lambda': 11.637057195824438, 'gamma': 1.4252753268415493e-06}. Best is trial 150 with value: -0.3503640640126008.
[I 2026-07-17 12:21:52,328] Trial 187 finished with value: -0.2708615109183733 and parameters: {'scalers': 'standard', 'ratios': 'log_ratio', 'imputers': 'none', 'n_estimators': 2400, 'learning_rate': 0.19864227277361024, 'max_depth': 12, 'min_child_weight': 2, 'subsample': 0.5, 'colsample_bytree': 1.0, 'colsample_bylevel': 1.0, 'reg_alpha': 5.125231789527731, 'reg_lambda': 16.046353443795443, 'gamma': 1.4317632988179406e-06}. Best is trial 150 with value: -0.3503640640126008.
[I 2026-07-17 12:22:42,610] Trial 188 finished with value: -0.2725852585396361 and parameters: {'scalers': 'standard', 'ratios': 'log_ratio', 'imputers': 'none', 'n_estimators': 2400, 'learning_rate': 0.17635951919780327, 'max_depth': 12, 'min_child_weight': 2, 'subsample': 0.5, 'colsample_bytree': 1.0, 'colsample_bylevel': 1.0, 'reg_alpha': 4.529396338590637, 'reg_lambda': 15.880721815762053, 'gamma': 1.3756329883353685e-06}. Best is trial 150 with value: -0.3503640640126008.
[I 2026-07-17 12:23:33,730] Trial 189 finished with value: -0.2877209267226995 and parameters: {'scalers': 'standard', 'ratios': 'log_ratio', 'imputers': 'none', 'n_estimators': 2400, 'learning_rate': 0.21719489242107176, 'max_depth': 12, 'min_child_weight': 2, 'subsample': 0.5, 'colsample_bytree': 1.0, 'colsample_bylevel': 1.0, 'reg_alpha': 4.620935230512353, 'reg_lambda': 14.85936649608818, 'gamma': 1.51096779911439e-06}. Best is trial 150 with value: -0.3503640640126008.
[I 2026-07-17 12:24:19,618] Trial 190 finished with value: -0.2696282764032656 and parameters: {'scalers': 'standard', 'ratios': 'log_ratio', 'imputers': 'none', 'n_estimators': 2350, 'learning_rate': 0.20865475576765813, 'max_depth': 12, 'min_child_weight': 2, 'subsample': 0.5, 'colsample_bytree': 1.0, 'colsample_bylevel': 1.0, 'reg_alpha': 5.360459911975137, 'reg_lambda': 32.132474068884065, 'gamma': 1.537732832136578e-06}. Best is trial 150 with value: -0.3503640640126008.
[I 2026-07-17 12:25:26,728] Trial 191 finished with value: -0.32871368025342845 and parameters: {'scalers': 'standard', 'ratios': 'log_ratio', 'imputers': 'none', 'n_estimators': 2800, 'learning_rate': 0.21719295146030512, 'max_depth': 12, 'min_child_weight': 2, 'subsample': 0.5, 'colsample_bytree': 1.0, 'colsample_bylevel': 1.0, 'reg_alpha': 3.0718399478146163, 'reg_lambda': 58.18799382484526, 'gamma': 1.5198682882232258e-06}. Best is trial 150 with value: -0.3503640640126008.
[I 2026-07-17 12:26:23,427] Trial 192 finished with value: -0.29434062940293537 and parameters: {'scalers': 'standard', 'ratios': 'log_ratio', 'imputers': 'none', 'n_estimators': 2800, 'learning_rate': 0.2153412362293647, 'max_depth': 12, 'min_child_weight': 2, 'subsample': 0.5, 'colsample_bytree': 1.0, 'colsample_bylevel': 1.0, 'reg_alpha': 4.715391495712757, 'reg_lambda': 41.468522225885955, 'gamma': 1.5751602102499919e-06}. Best is trial 150 with value: -0.3503640640126008.
[I 2026-07-17 12:27:11,625] Trial 193 finished with value: -0.26664421204249894 and parameters: {'scalers': 'standard', 'ratios': 'log_ratio', 'imputers': 'none', 'n_estimators': 2800, 'learning_rate': 0.20833658603830318, 'max_depth': 12, 'min_child_weight': 2, 'subsample': 0.5, 'colsample_bytree': 1.0, 'colsample_bylevel': 1.0, 'reg_alpha': 6.19482482731933, 'reg_lambda': 58.404498757916976, 'gamma': 2.469161655996425e-06}. Best is trial 150 with value: -0.3503640640126008.
[I 2026-07-17 12:28:19,379] Trial 194 finished with value: -0.32160975512112394 and parameters: {'scalers': 'standard', 'ratios': 'log_ratio', 'imputers': 'none', 'n_estimators': 2800, 'learning_rate': 0.21881877232087843, 'max_depth': 12, 'min_child_weight': 2, 'subsample': 0.5, 'colsample_bytree': 1.0, 'colsample_bylevel': 1.0, 'reg_alpha': 3.3199903320461592, 'reg_lambda': 37.1721855039567, 'gamma': 2.678835903405364e-06}. Best is trial 150 with value: -0.3503640640126008.
[I 2026-07-17 12:29:12,923] Trial 195 finished with value: -0.2922992523410368 and parameters: {'scalers': 'standard', 'ratios': 'log_ratio', 'imputers': 'none', 'n_estimators': 2800, 'learning_rate': 0.2778172896825311, 'max_depth': 12, 'min_child_weight': 4, 'subsample': 0.5, 'colsample_bytree': 1.0, 'colsample_bylevel': 1.0, 'reg_alpha': 3.2045136710269655, 'reg_lambda': 39.479193344255485, 'gamma': 2.6638286592916996e-06}. Best is trial 150 with value: -0.3503640640126008.
[I 2026-07-17 12:30:03,047] Trial 196 finished with value: -0.26721848792771313 and parameters: {'scalers': 'standard', 'ratios': 'log_ratio', 'imputers': 'none', 'n_estimators': 2800, 'learning_rate': 0.2278339759606317, 'max_depth': 12, 'min_child_weight': 4, 'subsample': 0.5, 'colsample_bytree': 1.0, 'colsample_bylevel': 1.0, 'reg_alpha': 3.5206007899470166, 'reg_lambda': 57.04773231966237, 'gamma': 2.6624621684156542e-06}. Best is trial 150 with value: -0.3503640640126008.
[I 2026-07-17 12:31:08,952] Trial 197 finished with value: -0.3018434106072636 and parameters: {'scalers': 'none', 'ratios': 'log_ratio', 'imputers': 'none', 'n_estimators': 2800, 'learning_rate': 0.26816448234474555, 'max_depth': 12, 'min_child_weight': 4, 'subsample': 0.5, 'colsample_bytree': 1.0, 'colsample_bylevel': 1.0, 'reg_alpha': 0.6142998354638373, 'reg_lambda': 60.52330925128026, 'gamma': 2.613890959825809e-06}. Best is trial 150 with value: -0.3503640640126008.
[I 2026-07-17 12:32:19,320] Trial 198 finished with value: -0.2982070763495408 and parameters: {'scalers': 'standard', 'ratios': 'log_ratio', 'imputers': 'none', 'n_estimators': 2800, 'learning_rate': 0.2793830084944716, 'max_depth': 12, 'min_child_weight': 4, 'subsample': 0.5, 'colsample_bytree': 1.0, 'colsample_bylevel': 1.0, 'reg_alpha': 1.306501125865162, 'reg_lambda': 7.7716653499872645, 'gamma': 2.6718505869344856e-06}. Best is trial 150 with value: -0.3503640640126008.
[I 2026-07-17 12:33:13,131] Trial 199 finished with value: -0.29226596737342714 and parameters: {'scalers': 'standard', 'ratios': 'log_ratio', 'imputers': 'none', 'n_estimators': 2800, 'learning_rate': 0.28778967966091407, 'max_depth': 12, 'min_child_weight': 4, 'subsample': 0.5, 'colsample_bytree': 1.0, 'colsample_bylevel': 1.0, 'reg_alpha': 3.366072101843347, 'reg_lambda': 52.38679454247482, 'gamma': 2.693193502058111e-06}. Best is trial 150 with value: -0.3503640640126008.
[I 2026-07-17 12:34:06,246] Trial 200 finished with value: -0.285691383419571 and parameters: {'scalers': 'none', 'ratios': 'log_ratio', 'imputers': 'none', 'n_estimators': 2550, 'learning_rate': 0.2767423917801614, 'max_depth': 12, 'min_child_weight': 4, 'subsample': 0.5, 'colsample_bytree': 1.0, 'colsample_bylevel': 1.0, 'reg_alpha': 3.2800029203036813, 'reg_lambda': 0.11429850569502994, 'gamma': 2.515408162506989e-06}. Best is trial 150 with value: -0.3503640640126008.
[I 2026-07-17 12:35:24,610] Trial 201 finished with value: -0.30131987456706455 and parameters: {'scalers': 'standard', 'ratios': 'log_ratio', 'imputers': 'none', 'n_estimators': 3000, 'learning_rate': 0.28258485551925644, 'max_depth': 12, 'min_child_weight': 4, 'subsample': 0.5, 'colsample_bytree': 1.0, 'colsample_bylevel': 1.0, 'reg_alpha': 1.122547055671218, 'reg_lambda': 0.38677322682439386, 'gamma': 2.772107270180173e-06}. Best is trial 150 with value: -0.3503640640126008.
[I 2026-07-17 12:36:20,901] Trial 202 finished with value: -0.25224863092391014 and parameters: {'scalers': 'standard', 'ratios': 'log_ratio', 'imputers': 'none', 'n_estimators': 2550, 'learning_rate': 0.14221473594723305, 'max_depth': 12, 'min_child_weight': 4, 'subsample': 0.5, 'colsample_bytree': 1.0, 'colsample_bylevel': 1.0, 'reg_alpha': 1.1224066282767182, 'reg_lambda': 27.023969664491293, 'gamma': 2.9197552224477475e-06}. Best is trial 150 with value: -0.3503640640126008.
[I 2026-07-17 12:37:49,412] Trial 203 finished with value: -0.3200224172550378 and parameters: {'scalers': 'none', 'ratios': 'log_ratio', 'imputers': 'none', 'n_estimators': 2950, 'learning_rate': 0.29673818133563107, 'max_depth': 12, 'min_child_weight': 3, 'subsample': 0.5, 'colsample_bytree': 1.0, 'colsample_bylevel': 1.0, 'reg_alpha': 0.19392117550967544, 'reg_lambda': 0.31799442637350694, 'gamma': 3.0230546501600837e-06}. Best is trial 150 with value: -0.3503640640126008.
[I 2026-07-17 12:39:16,465] Trial 204 finished with value: -0.3188287504543586 and parameters: {'scalers': 'none', 'ratios': 'log_ratio', 'imputers': 'none', 'n_estimators': 2900, 'learning_rate': 0.28386267403530024, 'max_depth': 12, 'min_child_weight': 3, 'subsample': 0.5, 'colsample_bytree': 1.0, 'colsample_bylevel': 1.0, 'reg_alpha': 1.0986908400925863, 'reg_lambda': 0.21728808822422804, 'gamma': 2.9909418658079315e-06}. Best is trial 150 with value: -0.3503640640126008.
[I 2026-07-17 12:40:39,276] Trial 205 finished with value: -0.26334113092649586 and parameters: {'scalers': 'standard', 'ratios': 'log_ratio', 'imputers': 'none', 'n_estimators': 3000, 'learning_rate': 0.13343759181486167, 'max_depth': 12, 'min_child_weight': 3, 'subsample': 0.5, 'colsample_bytree': 1.0, 'colsample_bylevel': 1.0, 'reg_alpha': 1.1031571687934094, 'reg_lambda': 0.2876733098421769, 'gamma': 3.724361981174739e-06}. Best is trial 150 with value: -0.3503640640126008.
[I 2026-07-17 12:41:59,799] Trial 206 finished with value: -0.26919405493393683 and parameters: {'scalers': 'standard', 'ratios': 'log_ratio', 'imputers': 'none', 'n_estimators': 2900, 'learning_rate': 0.13716352357530162, 'max_depth': 12, 'min_child_weight': 3, 'subsample': 0.5, 'colsample_bytree': 1.0, 'colsample_bylevel': 1.0, 'reg_alpha': 1.0852229606255173, 'reg_lambda': 0.4709483602153309, 'gamma': 3.847522717167923e-06}. Best is trial 150 with value: -0.3503640640126008.
[I 2026-07-17 12:43:26,461] Trial 207 finished with value: -0.2790691642842235 and parameters: {'scalers': 'standard', 'ratios': 'log_ratio', 'imputers': 'none', 'n_estimators': 2950, 'learning_rate': 0.15485221600698473, 'max_depth': 12, 'min_child_weight': 3, 'subsample': 0.5, 'colsample_bytree': 1.0, 'colsample_bylevel': 1.0, 'reg_alpha': 1.1123174730025915, 'reg_lambda': 0.19974250143434058, 'gamma': 3.940637525658487e-06}. Best is trial 150 with value: -0.3503640640126008.
[I 2026-07-17 12:44:31,458] Trial 208 finished with value: -0.29898745857508735 and parameters: {'scalers': 'standard', 'ratios': 'log_ratio', 'imputers': 'none', 'n_estimators': 2550, 'learning_rate': 0.23766773712802863, 'max_depth': 12, 'min_child_weight': 3, 'subsample': 0.5, 'colsample_bytree': 1.0, 'colsample_bylevel': 1.0, 'reg_alpha': 1.9512291341445842, 'reg_lambda': 0.2683500284328415, 'gamma': 1.7662102186752845e-06}. Best is trial 150 with value: -0.3503640640126008.
[I 2026-07-17 12:45:47,010] Trial 209 finished with value: -0.30455466531314107 and parameters: {'scalers': 'standard', 'ratios': 'log_ratio', 'imputers': 'none', 'n_estimators': 2550, 'learning_rate': 0.2431293019025633, 'max_depth': 12, 'min_child_weight': 3, 'subsample': 0.5, 'colsample_bytree': 1.0, 'colsample_bylevel': 1.0, 'reg_alpha': 1.0704854843418479, 'reg_lambda': 0.18785033185369016, 'gamma': 1.7177728128317046e-06}. Best is trial 150 with value: -0.3503640640126008.
[I 2026-07-17 12:46:54,789] Trial 210 finished with value: -0.29829922109444507 and parameters: {'scalers': 'standard', 'ratios': 'log_ratio', 'imputers': 'none', 'n_estimators': 2600, 'learning_rate': 0.24312228221726884, 'max_depth': 12, 'min_child_weight': 3, 'subsample': 0.5, 'colsample_bytree': 1.0, 'colsample_bylevel': 1.0, 'reg_alpha': 2.0788301111478122, 'reg_lambda': 0.18519671083592104, 'gamma': 1.6468883258327966e-06}. Best is trial 150 with value: -0.3503640640126008.
[I 2026-07-17 12:48:26,244] Trial 211 finished with value: -0.30993222318706654 and parameters: {'scalers': 'none', 'ratios': 'log_ratio', 'imputers': 'none', 'n_estimators': 2950, 'learning_rate': 0.23836269896150453, 'max_depth': 12, 'min_child_weight': 3, 'subsample': 0.5, 'colsample_bytree': 1.0, 'colsample_bylevel': 1.0, 'reg_alpha': 0.34201990755167966, 'reg_lambda': 0.7608035406248235, 'gamma': 4.0545659398948136e-06}. Best is trial 150 with value: -0.3503640640126008.
[I 2026-07-17 12:49:54,986] Trial 212 finished with value: -0.30782267756213205 and parameters: {'scalers': 'none', 'ratios': 'log_ratio', 'imputers': 'none', 'n_estimators': 2900, 'learning_rate': 0.23488587629828628, 'max_depth': 12, 'min_child_weight': 3, 'subsample': 0.5, 'colsample_bytree': 1.0, 'colsample_bylevel': 1.0, 'reg_alpha': 0.22766344522907705, 'reg_lambda': 1.5098374777429129, 'gamma': 4.337400487242805e-06}. Best is trial 150 with value: -0.3503640640126008.
[I 2026-07-17 12:51:33,787] Trial 213 finished with value: -0.20309531799815594 and parameters: {'scalers': 'none', 'ratios': 'log_ratio', 'imputers': 'none', 'n_estimators': 2900, 'learning_rate': 0.004824588167873636, 'max_depth': 12, 'min_child_weight': 3, 'subsample': 0.5, 'colsample_bytree': 1.0, 'colsample_bylevel': 1.0, 'reg_alpha': 0.21243461500151306, 'reg_lambda': 2.8001863895649657, 'gamma': 4.283077735241726e-06}. Best is trial 150 with value: -0.3503640640126008.
[I 2026-07-17 12:53:02,006] Trial 214 finished with value: -0.3048494520023267 and parameters: {'scalers': 'none', 'ratios': 'log_ratio', 'imputers': 'none', 'n_estimators': 2900, 'learning_rate': 0.23424788819200826, 'max_depth': 12, 'min_child_weight': 3, 'subsample': 0.5, 'colsample_bytree': 1.0, 'colsample_bylevel': 1.0, 'reg_alpha': 0.34039466680349356, 'reg_lambda': 0.16588106431464383, 'gamma': 1.5585040758793725e-06}. Best is trial 150 with value: -0.3503640640126008.
[I 2026-07-17 12:54:24,920] Trial 215 finished with value: -0.3027630574843078 and parameters: {'scalers': 'none', 'ratios': 'log_ratio', 'imputers': 'none', 'n_estimators': 2700, 'learning_rate': 0.2412205523828867, 'max_depth': 12, 'min_child_weight': 3, 'subsample': 0.5, 'colsample_bytree': 1.0, 'colsample_bylevel': 1.0, 'reg_alpha': 0.22221218394409625, 'reg_lambda': 0.8900161035563364, 'gamma': 1.7575243452220707e-06}. Best is trial 150 with value: -0.3503640640126008.
[I 2026-07-17 12:55:36,704] Trial 216 finished with value: -0.31318240898944216 and parameters: {'scalers': 'none', 'ratios': 'log_ratio', 'imputers': 'none', 'n_estimators': 2300, 'learning_rate': 0.3074040461593157, 'max_depth': 12, 'min_child_weight': 3, 'subsample': 0.5, 'colsample_bytree': 1.0, 'colsample_bylevel': 1.0, 'reg_alpha': 0.21572316426041613, 'reg_lambda': 0.8480815733780387, 'gamma': 1.004274073077219e-06}. Best is trial 150 with value: -0.3503640640126008.
[I 2026-07-17 12:57:01,643] Trial 217 finished with value: -0.32393425561655814 and parameters: {'scalers': 'none', 'ratios': 'log_ratio', 'imputers': 'none', 'n_estimators': 2700, 'learning_rate': 0.29258774209279603, 'max_depth': 12, 'min_child_weight': 3, 'subsample': 0.5, 'colsample_bytree': 1.0, 'colsample_bylevel': 1.0, 'reg_alpha': 0.3121483116781368, 'reg_lambda': 2.360231142147837, 'gamma': 1.0434915321698136e-06}. Best is trial 150 with value: -0.3503640640126008.
[I 2026-07-17 12:58:27,656] Trial 218 finished with value: -0.3265475603801016 and parameters: {'scalers': 'none', 'ratios': 'log_ratio', 'imputers': 'none', 'n_estimators': 2700, 'learning_rate': 0.3070611608613631, 'max_depth': 12, 'min_child_weight': 3, 'subsample': 0.5, 'colsample_bytree': 1.0, 'colsample_bylevel': 1.0, 'reg_alpha': 0.5935594012568697, 'reg_lambda': 0.6218259348510449, 'gamma': 1.0473804778092482e-06}. Best is trial 150 with value: -0.3503640640126008.
[I 2026-07-17 12:59:35,076] Trial 219 finished with value: -0.326457859983442 and parameters: {'scalers': 'none', 'ratios': 'log_ratio', 'imputers': 'none', 'n_estimators': 2300, 'learning_rate': 0.3177848472959512, 'max_depth': 12, 'min_child_weight': 3, 'subsample': 0.5, 'colsample_bytree': 1.0, 'colsample_bylevel': 1.0, 'reg_alpha': 0.2118367287707609, 'reg_lambda': 6.2922775167674745, 'gamma': 1.0513773323229806e-06}. Best is trial 150 with value: -0.3503640640126008.
[I 2026-07-17 13:00:55,881] Trial 220 finished with value: -0.3396564689950166 and parameters: {'scalers': 'standard', 'ratios': 'log_ratio', 'imputers': 'none', 'n_estimators': 2700, 'learning_rate': 0.3252372946510819, 'max_depth': 12, 'min_child_weight': 3, 'subsample': 0.5, 'colsample_bytree': 1.0, 'colsample_bylevel': 1.0, 'reg_alpha': 0.30384797137014347, 'reg_lambda': 9.078001420299131, 'gamma': 1.0675619793193816e-06}. Best is trial 150 with value: -0.3503640640126008.
[I 2026-07-17 13:02:16,993] Trial 221 finished with value: -0.3386807365196546 and parameters: {'scalers': 'none', 'ratios': 'log_ratio', 'imputers': 'none', 'n_estimators': 2750, 'learning_rate': 0.3308356889938615, 'max_depth': 12, 'min_child_weight': 3, 'subsample': 0.5, 'colsample_bytree': 1.0, 'colsample_bylevel': 1.0, 'reg_alpha': 0.5672352512988759, 'reg_lambda': 10.165974643037552, 'gamma': 1.1084051490041278e-06}. Best is trial 150 with value: -0.3503640640126008.
[I 2026-07-17 13:04:17,453] Trial 222 finished with value: -0.5321740672462661 and parameters: {'scalers': 'none', 'ratios': 'log_ratio', 'imputers': 'none', 'n_estimators': 2700, 'learning_rate': 0.3122414379432379, 'max_depth': 12, 'min_child_weight': 1, 'subsample': 0.5, 'colsample_bytree': 1.0, 'colsample_bylevel': 1.0, 'reg_alpha': 0.5476339663259209, 'reg_lambda': 9.869966421581566, 'gamma': 1.03078445386337e-06}. Best is trial 222 with value: -0.5321740672462661.
[I 2026-07-17 13:06:18,087] Trial 223 finished with value: -0.5473123729832667 and parameters: {'scalers': 'none', 'ratios': 'log_ratio', 'imputers': 'none', 'n_estimators': 2700, 'learning_rate': 0.31604340754287674, 'max_depth': 12, 'min_child_weight': 1, 'subsample': 0.5, 'colsample_bytree': 1.0, 'colsample_bylevel': 1.0, 'reg_alpha': 0.619972017493551, 'reg_lambda': 8.690266661116455, 'gamma': 1.0620397710767769e-06}. Best is trial 223 with value: -0.5473123729832667.
[I 2026-07-17 13:07:36,854] Trial 224 finished with value: -0.3291772218604692 and parameters: {'scalers': 'none', 'ratios': 'log_ratio', 'imputers': 'none', 'n_estimators': 2700, 'learning_rate': 0.3155212865989028, 'max_depth': 12, 'min_child_weight': 3, 'subsample': 0.5, 'colsample_bytree': 1.0, 'colsample_bylevel': 1.0, 'reg_alpha': 0.6168729568646832, 'reg_lambda': 10.541158096865868, 'gamma': 1.014161591429211e-06}. Best is trial 223 with value: -0.5473123729832667.
