[I 2026-07-17 11:36:52,867] A new study created in RDB with name: mult_quant_study_v2
[I 2026-07-17 11:37:07,871] Trial 1 finished with value: -0.06330221374528056 and parameters: {'scalers': 'none', 'ratios': 'log_ratio', 'imputers': 'none', 'n_estimators': 2800, 'learning_rate': 0.04250632444272636, 'max_depth': 8, 'min_child_weight': 3, 'subsample': 0.5, 'colsample_bytree': 0.6, 'colsample_bylevel': 0.6, 'reg_alpha': 1.655821543205675e-06, 'reg_lambda': 4.487302320414905e-06, 'gamma': 0.47820063652838607}. Best is trial 1 with value: -0.06330221374528056.
[I 2026-07-17 11:37:11,679] Trial 0 finished with value: -0.06527533423525696 and parameters: {'scalers': 'standard', 'ratios': 'log_ratio', 'imputers': 'none', 'n_estimators': 600, 'learning_rate': 0.20760904078743642, 'max_depth': 9, 'min_child_weight': 5, 'subsample': 0.7, 'colsample_bytree': 0.7, 'colsample_bylevel': 0.8, 'reg_alpha': 8.76052628960204e-05, 'reg_lambda': 0.014049157370464914, 'gamma': 0.5365571722889194}. Best is trial 0 with value: -0.06527533423525696.
[I 2026-07-17 11:37:14,474] Trial 2 finished with value: -0.10611324780661124 and parameters: {'scalers': 'robust', 'ratios': 'norm_ratio', 'imputers': 'mean', 'n_estimators': 2000, 'learning_rate': 0.023473672466706695, 'max_depth': 6, 'min_child_weight': 1, 'subsample': 0.6, 'colsample_bytree': 0.7, 'colsample_bylevel': 0.9, 'reg_alpha': 2.2945132520844056, 'reg_lambda': 9.686625237991966e-05, 'gamma': 94.26051155537007}. Best is trial 2 with value: -0.10611324780661124.
[I 2026-07-17 11:37:21,148] Trial 3 finished with value: -0.1038274107004681 and parameters: {'scalers': 'standard', 'ratios': 'log_ratio', 'imputers': 'none', 'n_estimators': 3000, 'learning_rate': 0.0002853411254603237, 'max_depth': 3, 'min_child_weight': 7, 'subsample': 0.5, 'colsample_bytree': 0.6, 'colsample_bylevel': 0.8, 'reg_alpha': 0.007102943760562786, 'reg_lambda': 0.0010517995509346238, 'gamma': 0.6586318935516416}. Best is trial 2 with value: -0.10611324780661124.
[I 2026-07-17 11:37:22,900] Trial 4 finished with value: -0.13167983212143286 and parameters: {'scalers': 'standard', 'ratios': 'log_ratio', 'imputers': 'median', 'n_estimators': 800, 'learning_rate': 0.00012737453943239616, 'max_depth': 6, 'min_child_weight': 9, 'subsample': 0.5, 'colsample_bytree': 1.0, 'colsample_bylevel': 0.9, 'reg_alpha': 55.526520125717916, 'reg_lambda': 1.122317528633647e-06, 'gamma': 2.74400944455776}. Best is trial 4 with value: -0.13167983212143286.
[I 2026-07-17 11:37:26,537] Trial 5 finished with value: -0.06429560079223239 and parameters: {'scalers': 'standard', 'ratios': 'norm_ratio', 'imputers': 'mean', 'n_estimators': 750, 'learning_rate': 0.06004167878427376, 'max_depth': 7, 'min_child_weight': 8, 'subsample': 0.5, 'colsample_bytree': 0.7, 'colsample_bylevel': 0.7, 'reg_alpha': 0.1262002754434861, 'reg_lambda': 0.002335627070255654, 'gamma': 0.1059419684728484}. Best is trial 4 with value: -0.13167983212143286.
[I 2026-07-17 11:37:35,789] Trial 6 finished with value: -0.06201186598297368 and parameters: {'scalers': 'robust', 'ratios': 'norm_ratio', 'imputers': 'mean', 'n_estimators': 2450, 'learning_rate': 0.004658774106297058, 'max_depth': 6, 'min_child_weight': 7, 'subsample': 0.9, 'colsample_bytree': 0.7, 'colsample_bylevel': 0.6, 'reg_alpha': 0.011692920995848321, 'reg_lambda': 0.014792379136228644, 'gamma': 0.3225247020889699}. Best is trial 4 with value: -0.13167983212143286.
[I 2026-07-17 11:37:49,787] Trial 7 finished with value: -0.07325846021080887 and parameters: {'scalers': 'robust', 'ratios': 'norm_ratio', 'imputers': 'mean', 'n_estimators': 1000, 'learning_rate': 0.1245594254594747, 'max_depth': 12, 'min_child_weight': 8, 'subsample': 0.7, 'colsample_bytree': 0.8, 'colsample_bylevel': 0.7, 'reg_alpha': 3.809163170688609e-05, 'reg_lambda': 2.577803147164055e-05, 'gamma': 0.035668029734527956}. Best is trial 4 with value: -0.13167983212143286.
[I 2026-07-17 11:38:05,627] Trial 8 finished with value: -0.12625615388910583 and parameters: {'scalers': 'standard', 'ratios': 'log_ratio', 'imputers': 'none', 'n_estimators': 1250, 'learning_rate': 0.00011678278471673317, 'max_depth': 9, 'min_child_weight': 5, 'subsample': 0.9, 'colsample_bytree': 0.9, 'colsample_bylevel': 0.5, 'reg_alpha': 0.2564152432130099, 'reg_lambda': 1.9210155808313938e-05, 'gamma': 3.7701394964052077e-06}. Best is trial 4 with value: -0.13167983212143286.
[I 2026-07-17 11:38:32,837] Trial 9 finished with value: -0.06389837392979893 and parameters: {'scalers': 'standard', 'ratios': 'norm_ratio', 'imputers': 'none', 'n_estimators': 1750, 'learning_rate': 0.0023104699529516693, 'max_depth': 12, 'min_child_weight': 6, 'subsample': 0.7, 'colsample_bytree': 1.0, 'colsample_bylevel': 0.5, 'reg_alpha': 0.08390545027969086, 'reg_lambda': 0.15399613488008596, 'gamma': 0.008946816513109416}. Best is trial 4 with value: -0.13167983212143286.
[I 2026-07-17 11:38:33,426] Trial 10 finished with value: -0.08326071840854489 and parameters: {'scalers': 'none', 'ratios': 'norm_ratio', 'imputers': 'mean', 'n_estimators': 400, 'learning_rate': 0.0046841093870964605, 'max_depth': 3, 'min_child_weight': 1, 'subsample': 1.0, 'colsample_bytree': 0.6, 'colsample_bylevel': 0.8, 'reg_alpha': 0.03451579240344549, 'reg_lambda': 75.39566993944507, 'gamma': 0.014963759273732752}. Best is trial 4 with value: -0.13167983212143286.
[I 2026-07-17 11:38:36,619] Trial 11 finished with value: -0.06489933421076956 and parameters: {'scalers': 'standard', 'ratios': 'norm_ratio', 'imputers': 'mean', 'n_estimators': 2000, 'learning_rate': 0.15095900329353248, 'max_depth': 3, 'min_child_weight': 2, 'subsample': 0.7, 'colsample_bytree': 0.5, 'colsample_bylevel': 0.6, 'reg_alpha': 1.7108183751192718e-05, 'reg_lambda': 0.5763468468557416, 'gamma': 2.1219284968908094}. Best is trial 4 with value: -0.13167983212143286.
[I 2026-07-17 11:38:39,375] Trial 12 finished with value: -0.13473690343427222 and parameters: {'scalers': 'none', 'ratios': 'log_ratio', 'imputers': 'none', 'n_estimators': 250, 'learning_rate': 0.00017981009504005284, 'max_depth': 12, 'min_child_weight': 6, 'subsample': 0.5, 'colsample_bytree': 0.7, 'colsample_bylevel': 0.6, 'reg_alpha': 3.26871297986286e-06, 'reg_lambda': 5.542778972245352e-05, 'gamma': 1.9303238596949425e-06}. Best is trial 12 with value: -0.13473690343427222.
[I 2026-07-17 11:38:45,722] Trial 13 finished with value: -0.10019170934992891 and parameters: {'scalers': 'robust', 'ratios': 'norm_ratio', 'imputers': 'none', 'n_estimators': 650, 'learning_rate': 0.4016495910831927, 'max_depth': 10, 'min_child_weight': 7, 'subsample': 0.5, 'colsample_bytree': 0.6, 'colsample_bylevel': 0.7, 'reg_alpha': 0.06525599542249871, 'reg_lambda': 1.2518424853239902e-05, 'gamma': 0.05025000659692506}. Best is trial 12 with value: -0.13473690343427222.
[I 2026-07-17 11:38:49,342] Trial 14 finished with value: -0.07849160091600249 and parameters: {'scalers': 'none', 'ratios': 'log_ratio', 'imputers': 'median', 'n_estimators': 1950, 'learning_rate': 0.005737359204855494, 'max_depth': 11, 'min_child_weight': 10, 'subsample': 1.0, 'colsample_bytree': 0.6, 'colsample_bylevel': 0.6, 'reg_alpha': 3.1276498357306686, 'reg_lambda': 0.8592174373298784, 'gamma': 9.035114428995932}. Best is trial 12 with value: -0.13473690343427222.
[I 2026-07-17 11:38:56,945] Trial 15 finished with value: -0.06270932908640993 and parameters: {'scalers': 'robust', 'ratios': 'norm_ratio', 'imputers': 'mean', 'n_estimators': 1450, 'learning_rate': 0.11495564229975806, 'max_depth': 8, 'min_child_weight': 7, 'subsample': 0.8, 'colsample_bytree': 0.9, 'colsample_bylevel': 0.6, 'reg_alpha': 4.645455981151608, 'reg_lambda': 0.6730809888773168, 'gamma': 0.14628178980569356}. Best is trial 12 with value: -0.13473690343427222.
[I 2026-07-17 11:39:17,172] Trial 17 finished with value: -0.1329643081913171 and parameters: {'scalers': 'none', 'ratios': 'log_ratio', 'imputers': 'median', 'n_estimators': 100, 'learning_rate': 0.0011548940142515603, 'max_depth': 3, 'min_child_weight': 10, 'subsample': 1.0, 'colsample_bytree': 0.5, 'colsample_bylevel': 1.0, 'reg_alpha': 67.0886285212498, 'reg_lambda': 65.88293079104093, 'gamma': 1.0530168828785643e-06}. Best is trial 12 with value: -0.13473690343427222.
[I 2026-07-17 11:39:17,551] Trial 16 finished with value: -0.0824333474807471 and parameters: {'scalers': 'standard', 'ratios': 'norm_ratio', 'imputers': 'median', 'n_estimators': 1850, 'learning_rate': 0.0006643265845671157, 'max_depth': 9, 'min_child_weight': 9, 'subsample': 0.7, 'colsample_bytree': 0.9, 'colsample_bylevel': 0.6, 'reg_alpha': 0.0002596318148216139, 'reg_lambda': 0.08601966028277101, 'gamma': 0.005074572980472314}. Best is trial 12 with value: -0.13473690343427222.
[I 2026-07-17 11:39:26,331] Trial 18 finished with value: -0.12381702589485598 and parameters: {'scalers': 'standard', 'ratios': 'log_ratio', 'imputers': 'median', 'n_estimators': 1300, 'learning_rate': 0.00012471680168187036, 'max_depth': 10, 'min_child_weight': 10, 'subsample': 0.9, 'colsample_bytree': 1.0, 'colsample_bylevel': 1.0, 'reg_alpha': 30.952337080229604, 'reg_lambda': 1.6525600567517716e-06, 'gamma': 1.1873860835246006e-06}. Best is trial 12 with value: -0.13473690343427222.
[I 2026-07-17 11:39:30,114] Trial 20 finished with value: -0.13100654011610316 and parameters: {'scalers': 'none', 'ratios': 'log_ratio', 'imputers': 'median', 'n_estimators': 200, 'learning_rate': 0.0004961391027069781, 'max_depth': 10, 'min_child_weight': 10, 'subsample': 0.6, 'colsample_bytree': 1.0, 'colsample_bylevel': 1.0, 'reg_alpha': 64.95219553790703, 'reg_lambda': 2.2398043685543135e-06, 'gamma': 1.5141535286014267e-06}. Best is trial 12 with value: -0.13473690343427222.
[I 2026-07-17 11:39:30,175] Trial 19 finished with value: -0.1292301478530778 and parameters: {'scalers': 'standard', 'ratios': 'log_ratio', 'imputers': 'median', 'n_estimators': 1200, 'learning_rate': 0.0001055463851897945, 'max_depth': 10, 'min_child_weight': 10, 'subsample': 0.9, 'colsample_bytree': 1.0, 'colsample_bylevel': 1.0, 'reg_alpha': 75.35229412717737, 'reg_lambda': 1.6805776566366495e-06, 'gamma': 1.0357587551475518e-06}. Best is trial 12 with value: -0.13473690343427222.
[I 2026-07-17 11:39:30,826] Trial 21 finished with value: -0.13395582555796842 and parameters: {'scalers': 'none', 'ratios': 'log_ratio', 'imputers': 'median', 'n_estimators': 100, 'learning_rate': 0.0005211911738207954, 'max_depth': 5, 'min_child_weight': 10, 'subsample': 0.6, 'colsample_bytree': 1.0, 'colsample_bylevel': 1.0, 'reg_alpha': 43.61489638196313, 'reg_lambda': 2.0036717061467917e-06, 'gamma': 1.7412082919305966e-06}. Best is trial 12 with value: -0.13473690343427222.
[I 2026-07-17 11:39:31,172] Trial 22 finished with value: -0.12743815312222395 and parameters: {'scalers': 'none', 'ratios': 'log_ratio', 'imputers': 'median', 'n_estimators': 250, 'learning_rate': 0.000640140886341278, 'max_depth': 5, 'min_child_weight': 10, 'subsample': 0.6, 'colsample_bytree': 1.0, 'colsample_bylevel': 1.0, 'reg_alpha': 71.80784181627342, 'reg_lambda': 1.0193316745306268e-06, 'gamma': 1.21972284570198e-06}. Best is trial 12 with value: -0.13473690343427222.
[I 2026-07-17 11:39:31,765] Trial 23 finished with value: -0.12869489672254983 and parameters: {'scalers': 'none', 'ratios': 'log_ratio', 'imputers': 'median', 'n_estimators': 200, 'learning_rate': 0.0006976316717690978, 'max_depth': 5, 'min_child_weight': 10, 'subsample': 0.6, 'colsample_bytree': 1.0, 'colsample_bylevel': 1.0, 'reg_alpha': 89.16683070291694, 'reg_lambda': 2.679116911924375e-06, 'gamma': 1.6430219607797315e-06}. Best is trial 12 with value: -0.13473690343427222.
[I 2026-07-17 11:39:32,574] Trial 24 finished with value: -0.13290956840312326 and parameters: {'scalers': 'none', 'ratios': 'log_ratio', 'imputers': 'median', 'n_estimators': 150, 'learning_rate': 0.0006179124754600727, 'max_depth': 5, 'min_child_weight': 10, 'subsample': 0.9, 'colsample_bytree': 0.5, 'colsample_bylevel': 1.0, 'reg_alpha': 0.0029775282947310778, 'reg_lambda': 42.64966417088033, 'gamma': 1.330925901366254e-06}. Best is trial 12 with value: -0.13473690343427222.
[I 2026-07-17 11:39:33,190] Trial 25 finished with value: -0.13316924613130254 and parameters: {'scalers': 'none', 'ratios': 'log_ratio', 'imputers': 'median', 'n_estimators': 100, 'learning_rate': 0.0007946502447012748, 'max_depth': 5, 'min_child_weight': 4, 'subsample': 0.9, 'colsample_bytree': 0.5, 'colsample_bylevel': 1.0, 'reg_alpha': 0.0016119019215287123, 'reg_lambda': 4.817613501762955, 'gamma': 2.30661799180562e-06}. Best is trial 12 with value: -0.13473690343427222.
[I 2026-07-17 11:39:33,830] Trial 26 finished with value: -0.13319128021823698 and parameters: {'scalers': 'none', 'ratios': 'log_ratio', 'imputers': 'median', 'n_estimators': 100, 'learning_rate': 0.0008093442424539855, 'max_depth': 5, 'min_child_weight': 4, 'subsample': 0.8, 'colsample_bytree': 0.5, 'colsample_bylevel': 1.0, 'reg_alpha': 0.0009587896059823531, 'reg_lambda': 82.61618567909728, 'gamma': 3.4079693661117604e-05}. Best is trial 12 with value: -0.13473690343427222.
[I 2026-07-17 11:39:34,292] Trial 27 finished with value: -0.13182564573677688 and parameters: {'scalers': 'none', 'ratios': 'log_ratio', 'imputers': 'median', 'n_estimators': 100, 'learning_rate': 0.0011508398576240422, 'max_depth': 5, 'min_child_weight': 9, 'subsample': 0.6, 'colsample_bytree': 0.5, 'colsample_bylevel': 0.9, 'reg_alpha': 0.0007668993680295453, 'reg_lambda': 67.43218673189713, 'gamma': 2.7528484051492463e-05}. Best is trial 12 with value: -0.13473690343427222.
[I 2026-07-17 11:39:35,479] Trial 28 finished with value: -0.12348320159524373 and parameters: {'scalers': 'none', 'ratios': 'log_ratio', 'imputers': 'median', 'n_estimators': 250, 'learning_rate': 0.001276229214406542, 'max_depth': 5, 'min_child_weight': 9, 'subsample': 0.6, 'colsample_bytree': 0.5, 'colsample_bylevel': 0.9, 'reg_alpha': 0.0015727770648912094, 'reg_lambda': 26.10688508510179, 'gamma': 2.9018001892157836e-05}. Best is trial 12 with value: -0.13473690343427222.
[I 2026-07-17 11:39:36,094] Trial 29 finished with value: -0.12530436067042927 and parameters: {'scalers': 'none', 'ratios': 'log_ratio', 'imputers': 'median', 'n_estimators': 150, 'learning_rate': 0.001887608600758525, 'max_depth': 4, 'min_child_weight': 3, 'subsample': 0.6, 'colsample_bytree': 0.5, 'colsample_bylevel': 0.9, 'reg_alpha': 0.0015264675958280576, 'reg_lambda': 39.888969103004904, 'gamma': 2.1378167378859468e-05}. Best is trial 12 with value: -0.13473690343427222.
[I 2026-07-17 11:39:36,541] Trial 30 finished with value: -0.13020753198160828 and parameters: {'scalers': 'none', 'ratios': 'log_ratio', 'imputers': 'median', 'n_estimators': 100, 'learning_rate': 0.0015757582593521084, 'max_depth': 4, 'min_child_weight': 4, 'subsample': 0.8, 'colsample_bytree': 0.5, 'colsample_bylevel': 0.9, 'reg_alpha': 0.001985189173303635, 'reg_lambda': 9.162209696428132, 'gamma': 2.5961222253256053e-05}. Best is trial 12 with value: -0.13473690343427222.
[I 2026-07-17 11:39:37,075] Trial 31 finished with value: -0.12840773911013242 and parameters: {'scalers': 'none', 'ratios': 'log_ratio', 'imputers': 'median', 'n_estimators': 100, 'learning_rate': 0.001999088355642038, 'max_depth': 4, 'min_child_weight': 4, 'subsample': 0.8, 'colsample_bytree': 0.5, 'colsample_bylevel': 0.9, 'reg_alpha': 0.0009857203247850457, 'reg_lambda': 36.39855548734304, 'gamma': 2.8809966941674545e-05}. Best is trial 12 with value: -0.13473690343427222.
[I 2026-07-17 11:39:39,349] Trial 32 finished with value: -0.10028819825659645 and parameters: {'scalers': 'none', 'ratios': 'log_ratio', 'imputers': 'median', 'n_estimators': 450, 'learning_rate': 0.0015057120652671933, 'max_depth': 4, 'min_child_weight': 4, 'subsample': 0.8, 'colsample_bytree': 0.8, 'colsample_bylevel': 0.9, 'reg_alpha': 0.0007544660411173189, 'reg_lambda': 0.00016746447691352843, 'gamma': 1.7610591398937616e-05}. Best is trial 12 with value: -0.13473690343427222.
[I 2026-07-17 11:39:41,784] Trial 33 finished with value: -0.1295123753566657 and parameters: {'scalers': 'none', 'ratios': 'log_ratio', 'imputers': 'none', 'n_estimators': 450, 'learning_rate': 0.0002454626479584077, 'max_depth': 4, 'min_child_weight': 4, 'subsample': 0.8, 'colsample_bytree': 0.8, 'colsample_bylevel': 0.9, 'reg_alpha': 3.5926522853319212e-06, 'reg_lambda': 0.00016159577700416302, 'gamma': 2.7874732555775275e-05}. Best is trial 12 with value: -0.13473690343427222.
[I 2026-07-17 11:39:44,211] Trial 34 finished with value: -0.12973894349293985 and parameters: {'scalers': 'none', 'ratios': 'log_ratio', 'imputers': 'none', 'n_estimators': 450, 'learning_rate': 0.0002386295149474732, 'max_depth': 4, 'min_child_weight': 3, 'subsample': 0.8, 'colsample_bytree': 0.8, 'colsample_bylevel': 0.9, 'reg_alpha': 1.7087442989734581e-06, 'reg_lambda': 0.0002326681615691901, 'gamma': 2.16169407308253e-05}. Best is trial 12 with value: -0.13473690343427222.
[I 2026-07-17 11:39:46,914] Trial 35 finished with value: -0.12776790110167577 and parameters: {'scalers': 'none', 'ratios': 'log_ratio', 'imputers': 'none', 'n_estimators': 500, 'learning_rate': 0.0002728010543812747, 'max_depth': 4, 'min_child_weight': 4, 'subsample': 0.8, 'colsample_bytree': 0.8, 'colsample_bylevel': 0.9, 'reg_alpha': 2.8363694776222196e-06, 'reg_lambda': 0.00029612938797868456, 'gamma': 9.271390935786256e-05}. Best is trial 12 with value: -0.13473690343427222.
[I 2026-07-17 11:39:49,403] Trial 36 finished with value: -0.12572870660999744 and parameters: {'scalers': 'none', 'ratios': 'log_ratio', 'imputers': 'none', 'n_estimators': 500, 'learning_rate': 0.00033914096397712933, 'max_depth': 4, 'min_child_weight': 4, 'subsample': 0.8, 'colsample_bytree': 0.8, 'colsample_bylevel': 0.8, 'reg_alpha': 1.193673914539115e-06, 'reg_lambda': 0.0007530612734758908, 'gamma': 0.00024183291849108032}. Best is trial 12 with value: -0.13473690343427222.
[I 2026-07-17 11:39:53,954] Trial 37 finished with value: -0.12883992774203856 and parameters: {'scalers': 'none', 'ratios': 'log_ratio', 'imputers': 'none', 'n_estimators': 400, 'learning_rate': 0.00028508696839670873, 'max_depth': 7, 'min_child_weight': 5, 'subsample': 0.8, 'colsample_bytree': 0.8, 'colsample_bylevel': 0.8, 'reg_alpha': 5.389313887510812e-06, 'reg_lambda': 0.00031502521799055613, 'gamma': 0.00038139859467719244}. Best is trial 12 with value: -0.13473690343427222.
[I 2026-07-17 11:39:58,454] Trial 38 finished with value: -0.1293246329495857 and parameters: {'scalers': 'none', 'ratios': 'log_ratio', 'imputers': 'none', 'n_estimators': 500, 'learning_rate': 0.0002640312427351395, 'max_depth': 7, 'min_child_weight': 5, 'subsample': 0.8, 'colsample_bytree': 0.7, 'colsample_bylevel': 0.8, 'reg_alpha': 3.413893095213552e-06, 'reg_lambda': 5.276353518242182, 'gamma': 0.0002947456514996262}. Best is trial 12 with value: -0.13473690343427222.
[I 2026-07-17 11:40:03,177] Trial 39 finished with value: -0.12936208060328036 and parameters: {'scalers': 'none', 'ratios': 'log_ratio', 'imputers': 'none', 'n_estimators': 400, 'learning_rate': 0.0002733249246159408, 'max_depth': 8, 'min_child_weight': 5, 'subsample': 0.8, 'colsample_bytree': 0.8, 'colsample_bylevel': 0.8, 'reg_alpha': 3.911968716569554e-06, 'reg_lambda': 7.833217509293509, 'gamma': 0.0005416924862083944}. Best is trial 12 with value: -0.13473690343427222.
[I 2026-07-17 11:40:06,967] Trial 40 finished with value: -0.12783635819156972 and parameters: {'scalers': 'none', 'ratios': 'log_ratio', 'imputers': 'none', 'n_estimators': 450, 'learning_rate': 0.000300402558591777, 'max_depth': 7, 'min_child_weight': 5, 'subsample': 0.5, 'colsample_bytree': 0.8, 'colsample_bylevel': 0.8, 'reg_alpha': 1.1134457852865142e-06, 'reg_lambda': 4.252607209787153, 'gamma': 0.0003819465298158276}. Best is trial 12 with value: -0.13473690343427222.
[I 2026-07-17 11:40:10,757] Trial 41 finished with value: -0.12782408718160007 and parameters: {'scalers': 'none', 'ratios': 'log_ratio', 'imputers': 'none', 'n_estimators': 500, 'learning_rate': 0.00031611183441874465, 'max_depth': 7, 'min_child_weight': 5, 'subsample': 0.5, 'colsample_bytree': 0.7, 'colsample_bylevel': 0.8, 'reg_alpha': 1.3114413064606504e-06, 'reg_lambda': 6.298090802587578, 'gamma': 0.00031970723371779736}. Best is trial 12 with value: -0.13473690343427222.
[I 2026-07-17 11:40:15,253] Trial 42 finished with value: -0.1246955123986302 and parameters: {'scalers': 'none', 'ratios': 'log_ratio', 'imputers': 'none', 'n_estimators': 600, 'learning_rate': 0.00035740293718974133, 'max_depth': 7, 'min_child_weight': 5, 'subsample': 0.5, 'colsample_bytree': 0.7, 'colsample_bylevel': 0.8, 'reg_alpha': 0.00020784112086559016, 'reg_lambda': 5.736780171117593, 'gamma': 0.00017040330838502817}. Best is trial 12 with value: -0.13473690343427222.
[I 2026-07-17 11:40:22,124] Trial 43 finished with value: -0.11576137569531728 and parameters: {'scalers': 'none', 'ratios': 'log_ratio', 'imputers': 'none', 'n_estimators': 900, 'learning_rate': 0.0004348412074839685, 'max_depth': 7, 'min_child_weight': 5, 'subsample': 0.5, 'colsample_bytree': 0.7, 'colsample_bylevel': 0.8, 'reg_alpha': 0.0001458436757738861, 'reg_lambda': 2.998555786268565, 'gamma': 0.0010238868672027188}. Best is trial 12 with value: -0.13473690343427222.
[I 2026-07-17 11:40:28,232] Trial 44 finished with value: -0.06542160903339357 and parameters: {'scalers': 'none', 'ratios': 'log_ratio', 'imputers': 'none', 'n_estimators': 750, 'learning_rate': 0.007401285413387398, 'max_depth': 7, 'min_child_weight': 5, 'subsample': 0.5, 'colsample_bytree': 0.7, 'colsample_bylevel': 0.8, 'reg_alpha': 0.5589246524148551, 'reg_lambda': 7.456620764799747, 'gamma': 6.407393037197515e-06}. Best is trial 12 with value: -0.13473690343427222.
