[I 2026-07-17 13:13:04,391] Trial 136 finished with value: -2.012516977011369 and parameters: {'scalers': 'none', 'ratios': 'norm_ratio', 'imputers': 'none', 'n_estimators': 3000, 'learning_rate': 0.366452690717073, 'max_depth': 9, 'min_child_weight': 1, 'subsample': 0.5, 'colsample_bytree': 0.7, 'colsample_bylevel': 0.5, 'reg_alpha': 0.000547312935197925, 'reg_lambda': 4.325399777265554, 'gamma': 1.2973256835847644e-06}. Best is trial 92 with value: -37.63732322038261.
[I 2026-07-17 13:13:46,930] Trial 137 finished with value: -2.3058390782610494 and parameters: {'scalers': 'none', 'ratios': 'norm_ratio', 'imputers': 'none', 'n_estimators': 3000, 'learning_rate': 0.37049479722026185, 'max_depth': 9, 'min_child_weight': 1, 'subsample': 0.5, 'colsample_bytree': 0.7, 'colsample_bylevel': 0.5, 'reg_alpha': 0.0006586103131998552, 'reg_lambda': 11.265620496492712, 'gamma': 6.664179215740697e-06}. Best is trial 92 with value: -37.63732322038261.
[I 2026-07-17 13:14:17,390] Trial 138 finished with value: -1.2445714645076773 and parameters: {'scalers': 'none', 'ratios': 'norm_ratio', 'imputers': 'none', 'n_estimators': 3000, 'learning_rate': 0.38880940416533755, 'max_depth': 9, 'min_child_weight': 5, 'subsample': 0.5, 'colsample_bytree': 0.7, 'colsample_bylevel': 0.5, 'reg_alpha': 0.000525555458440918, 'reg_lambda': 11.234398677139296, 'gamma': 1.3962235314720618e-06}. Best is trial 92 with value: -37.63732322038261.
[I 2026-07-17 13:14:59,931] Trial 139 finished with value: -2.3871016691504825 and parameters: {'scalers': 'none', 'ratios': 'norm_ratio', 'imputers': 'none', 'n_estimators': 3000, 'learning_rate': 0.3755540547485734, 'max_depth': 9, 'min_child_weight': 1, 'subsample': 0.5, 'colsample_bytree': 0.7, 'colsample_bylevel': 0.5, 'reg_alpha': 0.000650419650348572, 'reg_lambda': 11.494335205407705, 'gamma': 1.426090216123762e-06}. Best is trial 92 with value: -37.63732322038261.
[I 2026-07-17 13:15:37,262] Trial 140 finished with value: -2.1201938186886387 and parameters: {'scalers': 'none', 'ratios': 'norm_ratio', 'imputers': 'none', 'n_estimators': 2900, 'learning_rate': 0.3914702442686863, 'max_depth': 9, 'min_child_weight': 1, 'subsample': 0.5, 'colsample_bytree': 0.7, 'colsample_bylevel': 0.5, 'reg_alpha': 0.0002934816839052363, 'reg_lambda': 4.679351683812665, 'gamma': 1.4164599555435762e-06}. Best is trial 92 with value: -37.63732322038261.
[I 2026-07-17 13:16:22,415] Trial 141 finished with value: -3.230060922874321 and parameters: {'scalers': 'none', 'ratios': 'norm_ratio', 'imputers': 'none', 'n_estimators': 3000, 'learning_rate': 0.38447953493227993, 'max_depth': 9, 'min_child_weight': 1, 'subsample': 0.5, 'colsample_bytree': 0.7, 'colsample_bylevel': 0.5, 'reg_alpha': 0.0006172806404894683, 'reg_lambda': 30.30596742002511, 'gamma': 1.3354472228015913e-06}. Best is trial 92 with value: -37.63732322038261.
[I 2026-07-17 13:17:07,286] Trial 142 finished with value: -3.118621586974784 and parameters: {'scalers': 'none', 'ratios': 'norm_ratio', 'imputers': 'none', 'n_estimators': 3000, 'learning_rate': 0.37101024407943256, 'max_depth': 9, 'min_child_weight': 1, 'subsample': 0.5, 'colsample_bytree': 0.7, 'colsample_bylevel': 0.5, 'reg_alpha': 0.0002608394627968729, 'reg_lambda': 34.385923188933745, 'gamma': 1.5199199092572813e-06}. Best is trial 92 with value: -37.63732322038261.
[I 2026-07-17 13:17:51,973] Trial 143 finished with value: -3.07172293500647 and parameters: {'scalers': 'none', 'ratios': 'norm_ratio', 'imputers': 'none', 'n_estimators': 3000, 'learning_rate': 0.3745519475786706, 'max_depth': 9, 'min_child_weight': 1, 'subsample': 0.5, 'colsample_bytree': 0.7, 'colsample_bylevel': 0.5, 'reg_alpha': 0.00018586523983805977, 'reg_lambda': 30.961156228959446, 'gamma': 1.3111218177333688e-06}. Best is trial 92 with value: -37.63732322038261.
[I 2026-07-17 13:18:32,840] Trial 144 finished with value: -2.004769328565581 and parameters: {'scalers': 'none', 'ratios': 'norm_ratio', 'imputers': 'none', 'n_estimators': 3000, 'learning_rate': 0.314509431161829, 'max_depth': 9, 'min_child_weight': 1, 'subsample': 0.5, 'colsample_bytree': 0.7, 'colsample_bylevel': 0.5, 'reg_alpha': 0.00026122058914670917, 'reg_lambda': 9.878591718810227, 'gamma': 1.530094026454008e-06}. Best is trial 92 with value: -37.63732322038261.
[I 2026-07-17 13:18:43,533] Trial 145 finished with value: -1.3246629309949052 and parameters: {'scalers': 'none', 'ratios': 'norm_ratio', 'imputers': 'none', 'n_estimators': 3000, 'learning_rate': 0.31075861505974983, 'max_depth': 5, 'min_child_weight': 1, 'subsample': 0.5, 'colsample_bytree': 0.7, 'colsample_bylevel': 0.5, 'reg_alpha': 0.00023820465484881417, 'reg_lambda': 32.383397404805265, 'gamma': 1.3492760934583807e-06}. Best is trial 92 with value: -37.63732322038261.
[I 2026-07-17 13:19:27,278] Trial 146 finished with value: -2.2577230496817116 and parameters: {'scalers': 'none', 'ratios': 'norm_ratio', 'imputers': 'none', 'n_estimators': 2950, 'learning_rate': 0.30398788443794267, 'max_depth': 9, 'min_child_weight': 1, 'subsample': 0.5, 'colsample_bytree': 0.7, 'colsample_bylevel': 0.5, 'reg_alpha': 0.0002801177897438727, 'reg_lambda': 31.28673613347823, 'gamma': 7.064208206809501e-06}. Best is trial 92 with value: -37.63732322038261.
[I 2026-07-17 13:20:11,799] Trial 147 finished with value: -2.294003285442372 and parameters: {'scalers': 'none', 'ratios': 'norm_ratio', 'imputers': 'none', 'n_estimators': 3000, 'learning_rate': 0.29815246904571363, 'max_depth': 9, 'min_child_weight': 1, 'subsample': 0.5, 'colsample_bytree': 0.7, 'colsample_bylevel': 0.5, 'reg_alpha': 0.0002079483377133094, 'reg_lambda': 32.03448992618027, 'gamma': 7.37184604917099e-06}. Best is trial 92 with value: -37.63732322038261.
[I 2026-07-17 13:20:56,283] Trial 148 finished with value: -2.389914420455741 and parameters: {'scalers': 'none', 'ratios': 'norm_ratio', 'imputers': 'none', 'n_estimators': 3000, 'learning_rate': 0.30538574007076164, 'max_depth': 9, 'min_child_weight': 1, 'subsample': 0.5, 'colsample_bytree': 0.7, 'colsample_bylevel': 0.5, 'reg_alpha': 0.0024421901596543187, 'reg_lambda': 36.033416058037524, 'gamma': 1.375489233538452e-06}. Best is trial 92 with value: -37.63732322038261.
[I 2026-07-17 13:21:40,879] Trial 149 finished with value: -2.330248832183609 and parameters: {'scalers': 'none', 'ratios': 'norm_ratio', 'imputers': 'none', 'n_estimators': 3000, 'learning_rate': 0.31241250999759623, 'max_depth': 9, 'min_child_weight': 1, 'subsample': 0.5, 'colsample_bytree': 0.7, 'colsample_bylevel': 0.5, 'reg_alpha': 0.0023255075082398444, 'reg_lambda': 29.444343381538484, 'gamma': 1.3770290694766549e-06}. Best is trial 92 with value: -37.63732322038261.
[I 2026-07-17 13:22:25,846] Trial 150 finished with value: -2.3166152008904426 and parameters: {'scalers': 'none', 'ratios': 'norm_ratio', 'imputers': 'none', 'n_estimators': 3000, 'learning_rate': 0.30047654337264784, 'max_depth': 9, 'min_child_weight': 1, 'subsample': 0.5, 'colsample_bytree': 0.7, 'colsample_bylevel': 0.5, 'reg_alpha': 0.0001893284957257994, 'reg_lambda': 33.74755441658852, 'gamma': 1.3837306008743267e-06}. Best is trial 92 with value: -37.63732322038261.
[I 2026-07-17 13:23:09,949] Trial 151 finished with value: -2.1320508101493814 and parameters: {'scalers': 'none', 'ratios': 'norm_ratio', 'imputers': 'none', 'n_estimators': 3000, 'learning_rate': 0.2789393159654276, 'max_depth': 9, 'min_child_weight': 1, 'subsample': 0.5, 'colsample_bytree': 0.7, 'colsample_bylevel': 0.5, 'reg_alpha': 0.0001828136051719895, 'reg_lambda': 34.512426141027916, 'gamma': 1.300589364775422e-06}. Best is trial 92 with value: -37.63732322038261.
[I 2026-07-17 13:23:53,792] Trial 152 finished with value: -2.1118930969385796 and parameters: {'scalers': 'none', 'ratios': 'norm_ratio', 'imputers': 'none', 'n_estimators': 3000, 'learning_rate': 0.2771199420180483, 'max_depth': 9, 'min_child_weight': 1, 'subsample': 0.5, 'colsample_bytree': 0.7, 'colsample_bylevel': 0.5, 'reg_alpha': 0.00015848295289398227, 'reg_lambda': 32.22063413426436, 'gamma': 1.2893323929454813e-06}. Best is trial 92 with value: -37.63732322038261.
[I 2026-07-17 13:24:36,864] Trial 153 finished with value: -2.0278088665655014 and parameters: {'scalers': 'none', 'ratios': 'norm_ratio', 'imputers': 'none', 'n_estimators': 2950, 'learning_rate': 0.2648816726384555, 'max_depth': 9, 'min_child_weight': 1, 'subsample': 0.5, 'colsample_bytree': 0.7, 'colsample_bylevel': 0.5, 'reg_alpha': 0.000808933585041962, 'reg_lambda': 28.761378465257277, 'gamma': 1.0108552979796987e-06}. Best is trial 92 with value: -37.63732322038261.
[I 2026-07-17 13:25:19,664] Trial 154 finished with value: -2.3723473949703777 and parameters: {'scalers': 'none', 'ratios': 'norm_ratio', 'imputers': 'none', 'n_estimators': 3000, 'learning_rate': 0.26297394685142644, 'max_depth': 9, 'min_child_weight': 1, 'subsample': 0.5, 'colsample_bytree': 0.7, 'colsample_bylevel': 0.5, 'reg_alpha': 0.00016137018425224653, 'reg_lambda': 97.61008551860897, 'gamma': 1.0004217514659317e-06}. Best is trial 92 with value: -37.63732322038261.
[I 2026-07-17 13:25:57,141] Trial 156 finished with value: -1.1621345042501883 and parameters: {'scalers': 'none', 'ratios': 'norm_ratio', 'imputers': 'none', 'n_estimators': 300, 'learning_rate': 0.25967941520452903, 'max_depth': 9, 'min_child_weight': 1, 'subsample': 0.5, 'colsample_bytree': 0.7, 'colsample_bylevel': 0.5, 'reg_alpha': 8.995438461824613e-05, 'reg_lambda': 24.36854895717919, 'gamma': 1.0482050821443903e-06}. Best is trial 92 with value: -37.63732322038261.
[I 2026-07-17 13:26:02,453] Trial 155 finished with value: -1.9270630225599565 and parameters: {'scalers': 'none', 'ratios': 'norm_ratio', 'imputers': 'none', 'n_estimators': 2950, 'learning_rate': 0.25717624332469274, 'max_depth': 9, 'min_child_weight': 1, 'subsample': 0.5, 'colsample_bytree': 0.7, 'colsample_bylevel': 0.5, 'reg_alpha': 8.746271921322383e-05, 'reg_lambda': 21.549082372350735, 'gamma': 1.047310005916338e-06}. Best is trial 92 with value: -37.63732322038261.
[I 2026-07-17 13:26:43,656] Trial 157 finished with value: -2.296267467429645 and parameters: {'scalers': 'none', 'ratios': 'norm_ratio', 'imputers': 'none', 'n_estimators': 2900, 'learning_rate': 0.26016468981831065, 'max_depth': 9, 'min_child_weight': 1, 'subsample': 0.5, 'colsample_bytree': 0.7, 'colsample_bylevel': 0.5, 'reg_alpha': 0.003343430492635516, 'reg_lambda': 94.17927072128857, 'gamma': 1.0224301857418292e-06}. Best is trial 92 with value: -37.63732322038261.
[I 2026-07-17 13:27:09,780] Trial 158 finished with value: -1.166414292254692 and parameters: {'scalers': 'none', 'ratios': 'norm_ratio', 'imputers': 'none', 'n_estimators': 2900, 'learning_rate': 0.24852013291158406, 'max_depth': 9, 'min_child_weight': 1, 'subsample': 0.5, 'colsample_bytree': 0.7, 'colsample_bylevel': 0.5, 'reg_alpha': 0.0021917584830614028, 'reg_lambda': 1.0977019540526403e-06, 'gamma': 1.1434719753025845e-06}. Best is trial 92 with value: -37.63732322038261.
[I 2026-07-17 13:27:52,181] Trial 159 finished with value: -1.9247906602621703 and parameters: {'scalers': 'none', 'ratios': 'norm_ratio', 'imputers': 'none', 'n_estimators': 2900, 'learning_rate': 0.26148679359830757, 'max_depth': 9, 'min_child_weight': 1, 'subsample': 0.5, 'colsample_bytree': 0.7, 'colsample_bylevel': 0.5, 'reg_alpha': 0.0023378614686232102, 'reg_lambda': 24.847790821739448, 'gamma': 1.0581021593009815e-06}. Best is trial 92 with value: -37.63732322038261.
[I 2026-07-17 13:28:32,232] Trial 160 finished with value: -1.5212490461804993 and parameters: {'scalers': 'none', 'ratios': 'norm_ratio', 'imputers': 'none', 'n_estimators': 2900, 'learning_rate': 0.1411115092969857, 'max_depth': 9, 'min_child_weight': 1, 'subsample': 0.5, 'colsample_bytree': 0.7, 'colsample_bylevel': 0.5, 'reg_alpha': 0.0029900445602574605, 'reg_lambda': 54.28148294970692, 'gamma': 3.1143504011906482e-06}. Best is trial 92 with value: -37.63732322038261.
[I 2026-07-17 13:29:12,684] Trial 161 finished with value: -1.5000716904189464 and parameters: {'scalers': 'none', 'ratios': 'norm_ratio', 'imputers': 'none', 'n_estimators': 2900, 'learning_rate': 0.1394527549045203, 'max_depth': 9, 'min_child_weight': 1, 'subsample': 0.5, 'colsample_bytree': 0.7, 'colsample_bylevel': 0.5, 'reg_alpha': 0.0022614924509681508, 'reg_lambda': 60.79901382130502, 'gamma': 3.043530205911954e-06}. Best is trial 92 with value: -37.63732322038261.
[I 2026-07-17 13:29:56,270] Trial 162 finished with value: -5.337467678767115 and parameters: {'scalers': 'none', 'ratios': 'norm_ratio', 'imputers': 'none', 'n_estimators': 2900, 'learning_rate': 0.4103920669440164, 'max_depth': 9, 'min_child_weight': 1, 'subsample': 0.5, 'colsample_bytree': 0.7, 'colsample_bylevel': 0.5, 'reg_alpha': 8.639430665276277e-05, 'reg_lambda': 54.506560210606, 'gamma': 2.8498386603731306e-06}. Best is trial 92 with value: -37.63732322038261.
[I 2026-07-17 13:30:09,549] Trial 163 finished with value: -2.1763607569552867 and parameters: {'scalers': 'none', 'ratios': 'norm_ratio', 'imputers': 'none', 'n_estimators': 900, 'learning_rate': 0.3746505086364521, 'max_depth': 9, 'min_child_weight': 1, 'subsample': 0.5, 'colsample_bytree': 0.7, 'colsample_bylevel': 0.5, 'reg_alpha': 0.0019428829199126957, 'reg_lambda': 99.28135512579149, 'gamma': 2.6368789699784327e-06}. Best is trial 92 with value: -37.63732322038261.
[I 2026-07-17 13:30:49,766] Trial 164 finished with value: -1.525704627390133 and parameters: {'scalers': 'none', 'ratios': 'norm_ratio', 'imputers': 'none', 'n_estimators': 2900, 'learning_rate': 0.1383493177058461, 'max_depth': 9, 'min_child_weight': 1, 'subsample': 0.5, 'colsample_bytree': 0.7, 'colsample_bylevel': 0.5, 'reg_alpha': 0.0018935896902668454, 'reg_lambda': 58.16098255319561, 'gamma': 2.956356764772807e-06}. Best is trial 92 with value: -37.63732322038261.
[I 2026-07-17 13:31:32,284] Trial 165 finished with value: -3.805845380449521 and parameters: {'scalers': 'none', 'ratios': 'norm_ratio', 'imputers': 'none', 'n_estimators': 2850, 'learning_rate': 0.37125542099998543, 'max_depth': 9, 'min_child_weight': 1, 'subsample': 0.5, 'colsample_bytree': 0.7, 'colsample_bylevel': 0.5, 'reg_alpha': 0.0017609866844530233, 'reg_lambda': 57.42503305043204, 'gamma': 2.3365186987766698e-06}. Best is trial 92 with value: -37.63732322038261.
[I 2026-07-17 13:32:12,195] Trial 166 finished with value: -1.5323480652433283 and parameters: {'scalers': 'none', 'ratios': 'norm_ratio', 'imputers': 'none', 'n_estimators': 2850, 'learning_rate': 0.14639329259355585, 'max_depth': 9, 'min_child_weight': 1, 'subsample': 0.5, 'colsample_bytree': 0.7, 'colsample_bylevel': 0.5, 'reg_alpha': 0.00038345533102301325, 'reg_lambda': 52.07531328092499, 'gamma': 2.8187939449258427e-06}. Best is trial 92 with value: -37.63732322038261.
[I 2026-07-17 13:32:50,393] Trial 167 finished with value: -1.939130480401175 and parameters: {'scalers': 'none', 'ratios': 'norm_ratio', 'imputers': 'none', 'n_estimators': 2850, 'learning_rate': 0.3994711977813331, 'max_depth': 9, 'min_child_weight': 2, 'subsample': 0.5, 'colsample_bytree': 0.7, 'colsample_bylevel': 0.5, 'reg_alpha': 0.000356777538173544, 'reg_lambda': 51.96534552967893, 'gamma': 3.0513265028196243e-06}. Best is trial 92 with value: -37.63732322038261.
[I 2026-07-17 13:33:32,681] Trial 168 finished with value: -3.3696201260148477 and parameters: {'scalers': 'none', 'ratios': 'norm_ratio', 'imputers': 'none', 'n_estimators': 2850, 'learning_rate': 0.3542390292246634, 'max_depth': 9, 'min_child_weight': 1, 'subsample': 0.5, 'colsample_bytree': 0.7, 'colsample_bylevel': 0.5, 'reg_alpha': 0.0016786573447672554, 'reg_lambda': 56.747319685219715, 'gamma': 2.6910662055684206e-06}. Best is trial 92 with value: -37.63732322038261.
[I 2026-07-17 13:34:13,962] Trial 169 finished with value: -2.3031347070223744 and parameters: {'scalers': 'none', 'ratios': 'norm_ratio', 'imputers': 'none', 'n_estimators': 2850, 'learning_rate': 0.35329552860371866, 'max_depth': 9, 'min_child_weight': 1, 'subsample': 0.5, 'colsample_bytree': 0.7, 'colsample_bylevel': 0.5, 'reg_alpha': 0.000391700668427822, 'reg_lambda': 15.995579247750584, 'gamma': 2.456693347829221e-06}. Best is trial 92 with value: -37.63732322038261.
[I 2026-07-17 13:34:35,977] Trial 170 finished with value: -1.0498944493805815 and parameters: {'scalers': 'none', 'ratios': 'norm_ratio', 'imputers': 'none', 'n_estimators': 2850, 'learning_rate': 0.399841446660889, 'max_depth': 9, 'min_child_weight': 9, 'subsample': 0.5, 'colsample_bytree': 0.7, 'colsample_bylevel': 0.5, 'reg_alpha': 0.00039573836989338125, 'reg_lambda': 87.9154952319888, 'gamma': 2.3464251328397512e-06}. Best is trial 92 with value: -37.63732322038261.
[I 2026-07-17 13:35:18,224] Trial 171 finished with value: -2.8817165553912467 and parameters: {'scalers': 'none', 'ratios': 'norm_ratio', 'imputers': 'none', 'n_estimators': 2850, 'learning_rate': 0.4184829903876948, 'max_depth': 9, 'min_child_weight': 1, 'subsample': 0.5, 'colsample_bytree': 0.7, 'colsample_bylevel': 0.5, 'reg_alpha': 0.0003734974665830914, 'reg_lambda': 15.817080007661223, 'gamma': 2.301125751179873e-06}. Best is trial 92 with value: -37.63732322038261.
[I 2026-07-17 13:36:00,353] Trial 172 finished with value: -2.9320207545235615 and parameters: {'scalers': 'none', 'ratios': 'norm_ratio', 'imputers': 'none', 'n_estimators': 2850, 'learning_rate': 0.4219922883475872, 'max_depth': 9, 'min_child_weight': 1, 'subsample': 0.5, 'colsample_bytree': 0.7, 'colsample_bylevel': 0.5, 'reg_alpha': 0.0004497477625322635, 'reg_lambda': 15.489903381416882, 'gamma': 1.883750208550925e-06}. Best is trial 92 with value: -37.63732322038261.
[I 2026-07-17 13:36:42,380] Trial 173 finished with value: -2.867179031358861 and parameters: {'scalers': 'none', 'ratios': 'norm_ratio', 'imputers': 'none', 'n_estimators': 2850, 'learning_rate': 0.4260369397452231, 'max_depth': 9, 'min_child_weight': 1, 'subsample': 0.5, 'colsample_bytree': 0.7, 'colsample_bylevel': 0.5, 'reg_alpha': 0.00042054358253438846, 'reg_lambda': 14.0471446776084, 'gamma': 2.528301018629448e-06}. Best is trial 92 with value: -37.63732322038261.
[I 2026-07-17 13:37:20,097] Trial 174 finished with value: -1.7506772588050086 and parameters: {'scalers': 'none', 'ratios': 'norm_ratio', 'imputers': 'none', 'n_estimators': 2850, 'learning_rate': 0.4265266760286445, 'max_depth': 9, 'min_child_weight': 2, 'subsample': 0.5, 'colsample_bytree': 0.7, 'colsample_bylevel': 0.5, 'reg_alpha': 0.0007405949437810423, 'reg_lambda': 15.519737678910596, 'gamma': 2.0102545388539868e-06}. Best is trial 92 with value: -37.63732322038261.
[I 2026-07-17 13:37:45,297] Trial 176 finished with value: -2.2268899773229034 and parameters: {'scalers': 'none', 'ratios': 'norm_ratio', 'imputers': 'none', 'n_estimators': 600, 'learning_rate': 0.4983478311238902, 'max_depth': 9, 'min_child_weight': 1, 'subsample': 0.5, 'colsample_bytree': 0.7, 'colsample_bylevel': 0.5, 'reg_alpha': 0.001378027506685688, 'reg_lambda': 16.105157160295377, 'gamma': 1.986271922070392e-06}. Best is trial 92 with value: -37.63732322038261.
[I 2026-07-17 13:37:47,545] Trial 175 finished with value: -1.1659012649189684 and parameters: {'scalers': 'none', 'ratios': 'norm_ratio', 'imputers': 'none', 'n_estimators': 2950, 'learning_rate': 0.42290367822013025, 'max_depth': 9, 'min_child_weight': 7, 'subsample': 0.5, 'colsample_bytree': 0.7, 'colsample_bylevel': 0.5, 'reg_alpha': 0.0008226457996925935, 'reg_lambda': 14.818893024732319, 'gamma': 2.0293246430349205e-06}. Best is trial 92 with value: -37.63732322038261.
[I 2026-07-17 13:38:09,344] Trial 177 finished with value: -1.8063385743205727 and parameters: {'scalers': 'none', 'ratios': 'norm_ratio', 'imputers': 'none', 'n_estimators': 1600, 'learning_rate': 0.42560621782344976, 'max_depth': 9, 'min_child_weight': 2, 'subsample': 0.5, 'colsample_bytree': 0.7, 'colsample_bylevel': 0.5, 'reg_alpha': 0.0013194241361266033, 'reg_lambda': 42.60524452784264, 'gamma': 4.632317047454847e-06}. Best is trial 92 with value: -37.63732322038261.
[I 2026-07-17 13:38:52,987] Trial 178 finished with value: -3.0471253860623784 and parameters: {'scalers': 'none', 'ratios': 'norm_ratio', 'imputers': 'none', 'n_estimators': 2950, 'learning_rate': 0.4295269858439139, 'max_depth': 9, 'min_child_weight': 1, 'subsample': 0.5, 'colsample_bytree': 0.7, 'colsample_bylevel': 0.5, 'reg_alpha': 0.0008578094197135134, 'reg_lambda': 15.219181006509373, 'gamma': 1.58601309687987e-06}. Best is trial 92 with value: -37.63732322038261.
[I 2026-07-17 13:39:37,357] Trial 179 finished with value: -4.704199052683355 and parameters: {'scalers': 'none', 'ratios': 'norm_ratio', 'imputers': 'none', 'n_estimators': 2950, 'learning_rate': 0.4954104302365145, 'max_depth': 9, 'min_child_weight': 1, 'subsample': 0.5, 'colsample_bytree': 0.7, 'colsample_bylevel': 0.5, 'reg_alpha': 0.001245937782228637, 'reg_lambda': 16.584238478787213, 'gamma': 4.202535166558002e-06}. Best is trial 92 with value: -37.63732322038261.
[I 2026-07-17 13:40:19,439] Trial 180 finished with value: -4.430393449256044 and parameters: {'scalers': 'none', 'ratios': 'norm_ratio', 'imputers': 'none', 'n_estimators': 2800, 'learning_rate': 0.49810559836961016, 'max_depth': 9, 'min_child_weight': 1, 'subsample': 0.5, 'colsample_bytree': 0.7, 'colsample_bylevel': 0.5, 'reg_alpha': 0.0010238502541794806, 'reg_lambda': 15.971183012731213, 'gamma': 4.509362902199795e-06}. Best is trial 92 with value: -37.63732322038261.
[I 2026-07-17 13:41:00,947] Trial 181 finished with value: -4.356211114820988 and parameters: {'scalers': 'none', 'ratios': 'norm_ratio', 'imputers': 'none', 'n_estimators': 2750, 'learning_rate': 0.4936035404281706, 'max_depth': 9, 'min_child_weight': 1, 'subsample': 0.5, 'colsample_bytree': 0.7, 'colsample_bylevel': 0.5, 'reg_alpha': 0.0008497327164813619, 'reg_lambda': 16.44275097128436, 'gamma': 4.5087915320061225e-06}. Best is trial 92 with value: -37.63732322038261.
