[I 2026-07-17 12:50:27,599] Trial 135 finished with value: -4.625009444479036 and parameters: {'scalers': 'none', 'ratios': 'norm_ratio', 'imputers': 'none', 'n_estimators': 2900, 'learning_rate': 0.4223663427517428, 'max_depth': 12, 'min_child_weight': 1, 'subsample': 0.6, 'colsample_bytree': 0.6, 'colsample_bylevel': 0.8, 'reg_alpha': 3.2290374298956843, 'reg_lambda': 7.579046864608788, 'gamma': 0.0005331597861758886}. Best is trial 135 with value: -4.625009444479036.
[I 2026-07-17 12:51:48,533] Trial 136 finished with value: -3.9499022678159115 and parameters: {'scalers': 'none', 'ratios': 'norm_ratio', 'imputers': 'none', 'n_estimators': 2850, 'learning_rate': 0.42657697151068824, 'max_depth': 12, 'min_child_weight': 1, 'subsample': 0.6, 'colsample_bytree': 0.6, 'colsample_bylevel': 0.8, 'reg_alpha': 1.0327375041270133, 'reg_lambda': 4.725525669644949e-06, 'gamma': 3.1777663224953314e-05}. Best is trial 135 with value: -4.625009444479036.
[I 2026-07-17 12:52:42,101] Trial 137 finished with value: -4.383765301743555 and parameters: {'scalers': 'none', 'ratios': 'norm_ratio', 'imputers': 'none', 'n_estimators': 2350, 'learning_rate': 0.49635662607153613, 'max_depth': 12, 'min_child_weight': 1, 'subsample': 0.7, 'colsample_bytree': 0.6, 'colsample_bylevel': 0.8, 'reg_alpha': 2.923416248785124, 'reg_lambda': 5.090210406154486e-06, 'gamma': 0.0004911659115211499}. Best is trial 135 with value: -4.625009444479036.
[I 2026-07-17 12:54:09,141] Trial 138 finished with value: -3.896232487323647 and parameters: {'scalers': 'none', 'ratios': 'norm_ratio', 'imputers': 'none', 'n_estimators': 2850, 'learning_rate': 0.41686969304631555, 'max_depth': 12, 'min_child_weight': 1, 'subsample': 0.6, 'colsample_bytree': 0.6, 'colsample_bylevel': 0.8, 'reg_alpha': 0.8969115342782652, 'reg_lambda': 4.036285688311464e-06, 'gamma': 3.1263266605016366e-05}. Best is trial 135 with value: -4.625009444479036.
[I 2026-07-17 12:55:31,651] Trial 139 finished with value: -4.662331475947537 and parameters: {'scalers': 'none', 'ratios': 'norm_ratio', 'imputers': 'none', 'n_estimators': 2850, 'learning_rate': 0.4982172959928607, 'max_depth': 12, 'min_child_weight': 1, 'subsample': 0.6, 'colsample_bytree': 0.6, 'colsample_bylevel': 0.8, 'reg_alpha': 1.1109004910717912, 'reg_lambda': 1.4189885081047802e-05, 'gamma': 2.950538552643484e-05}. Best is trial 139 with value: -4.662331475947537.
[I 2026-07-17 12:56:40,420] Trial 140 finished with value: -4.1742524777688725 and parameters: {'scalers': 'none', 'ratios': 'norm_ratio', 'imputers': 'none', 'n_estimators': 2600, 'learning_rate': 0.4192938140768246, 'max_depth': 12, 'min_child_weight': 1, 'subsample': 0.6, 'colsample_bytree': 0.6, 'colsample_bylevel': 0.8, 'reg_alpha': 1.649177905407141, 'reg_lambda': 4.209621916847969e-06, 'gamma': 0.00022668398459409328}. Best is trial 139 with value: -4.662331475947537.
[I 2026-07-17 12:57:47,380] Trial 141 finished with value: -4.263614397155919 and parameters: {'scalers': 'none', 'ratios': 'norm_ratio', 'imputers': 'none', 'n_estimators': 2600, 'learning_rate': 0.4315480451156987, 'max_depth': 12, 'min_child_weight': 1, 'subsample': 0.6, 'colsample_bytree': 0.6, 'colsample_bylevel': 0.8, 'reg_alpha': 1.8720112682824013, 'reg_lambda': 4.088045550842955e-06, 'gamma': 2.7491104296555995e-05}. Best is trial 139 with value: -4.662331475947537.
[I 2026-07-17 12:57:50,946] Trial 142 finished with value: -1.6992771419356265 and parameters: {'scalers': 'none', 'ratios': 'norm_ratio', 'imputers': 'none', 'n_estimators': 2850, 'learning_rate': 0.43437135926362347, 'max_depth': 12, 'min_child_weight': 1, 'subsample': 0.6, 'colsample_bytree': 0.6, 'colsample_bylevel': 0.8, 'reg_alpha': 11.976203153999714, 'reg_lambda': 1.399991945275609e-05, 'gamma': 5.4388189260815856e-05}. Best is trial 139 with value: -4.662331475947537.
[I 2026-07-17 12:58:14,302] Trial 143 finished with value: -1.8876377437316048 and parameters: {'scalers': 'none', 'ratios': 'norm_ratio', 'imputers': 'none', 'n_estimators': 2850, 'learning_rate': 0.49836460620790674, 'max_depth': 12, 'min_child_weight': 1, 'subsample': 0.6, 'colsample_bytree': 0.6, 'colsample_bylevel': 0.8, 'reg_alpha': 11.573945430098865, 'reg_lambda': 1.4922864447717795e-05, 'gamma': 3.2736629572843036e-05}. Best is trial 139 with value: -4.662331475947537.
[I 2026-07-17 12:58:23,727] Trial 144 finished with value: -1.6354858893204511 and parameters: {'scalers': 'none', 'ratios': 'norm_ratio', 'imputers': 'none', 'n_estimators': 2850, 'learning_rate': 0.4943100279731213, 'max_depth': 12, 'min_child_weight': 9, 'subsample': 0.7, 'colsample_bytree': 0.6, 'colsample_bylevel': 0.8, 'reg_alpha': 9.681883830735252, 'reg_lambda': 5.103317038674172, 'gamma': 3.3138625423352776e-05}. Best is trial 139 with value: -4.662331475947537.
[I 2026-07-17 12:59:19,658] Trial 145 finished with value: -3.1517940008186915 and parameters: {'scalers': 'none', 'ratios': 'norm_ratio', 'imputers': 'none', 'n_estimators': 2850, 'learning_rate': 0.4916132212655615, 'max_depth': 12, 'min_child_weight': 2, 'subsample': 0.7, 'colsample_bytree': 0.6, 'colsample_bylevel': 0.8, 'reg_alpha': 3.4038335568056626, 'reg_lambda': 1.3601584137182888e-05, 'gamma': 1.3518575897395842e-05}. Best is trial 139 with value: -4.662331475947537.
[I 2026-07-17 12:59:23,706] Trial 146 finished with value: -1.3638596212139762 and parameters: {'scalers': 'none', 'ratios': 'norm_ratio', 'imputers': 'none', 'n_estimators': 2850, 'learning_rate': 0.45732358698119774, 'max_depth': 12, 'min_child_weight': 2, 'subsample': 0.7, 'colsample_bytree': 0.6, 'colsample_bylevel': 0.8, 'reg_alpha': 28.108011766727156, 'reg_lambda': 3.4173313260215514, 'gamma': 3.73115184810287e-05}. Best is trial 139 with value: -4.662331475947537.
[I 2026-07-17 12:59:37,170] Trial 147 finished with value: -1.5326953782794979 and parameters: {'scalers': 'none', 'ratios': 'norm_ratio', 'imputers': 'none', 'n_estimators': 2850, 'learning_rate': 0.4922530808165423, 'max_depth': 12, 'min_child_weight': 2, 'subsample': 0.7, 'colsample_bytree': 0.6, 'colsample_bylevel': 0.8, 'reg_alpha': 14.070752877548172, 'reg_lambda': 16.743531378763493, 'gamma': 3.8512971197278706e-05}. Best is trial 139 with value: -4.662331475947537.
[I 2026-07-17 12:59:52,789] Trial 148 finished with value: -1.6331301672903282 and parameters: {'scalers': 'none', 'ratios': 'norm_ratio', 'imputers': 'none', 'n_estimators': 2850, 'learning_rate': 0.4940523389649895, 'max_depth': 12, 'min_child_weight': 1, 'subsample': 0.7, 'colsample_bytree': 0.6, 'colsample_bylevel': 0.8, 'reg_alpha': 12.599885148595508, 'reg_lambda': 0.27861360603845, 'gamma': 3.8301692335373606e-05}. Best is trial 139 with value: -4.662331475947537.
[I 2026-07-17 13:00:15,636] Trial 149 finished with value: -2.029000381626434 and parameters: {'scalers': 'none', 'ratios': 'norm_ratio', 'imputers': 'none', 'n_estimators': 2850, 'learning_rate': 0.4934808625276953, 'max_depth': 12, 'min_child_weight': 2, 'subsample': 0.7, 'colsample_bytree': 0.6, 'colsample_bylevel': 0.8, 'reg_alpha': 9.58813341631848, 'reg_lambda': 9.567416215196712, 'gamma': 3.0737610735782714e-05}. Best is trial 139 with value: -4.662331475947537.
[I 2026-07-17 13:01:12,180] Trial 150 finished with value: -3.0094601576869153 and parameters: {'scalers': 'none', 'ratios': 'norm_ratio', 'imputers': 'none', 'n_estimators': 2850, 'learning_rate': 0.4723056357706722, 'max_depth': 12, 'min_child_weight': 2, 'subsample': 0.7, 'colsample_bytree': 0.6, 'colsample_bylevel': 0.8, 'reg_alpha': 3.3368581394334393, 'reg_lambda': 0.03707445120516169, 'gamma': 2.7629554824916092e-05}. Best is trial 139 with value: -4.662331475947537.
[I 2026-07-17 13:01:16,911] Trial 151 finished with value: -1.3172513796547234 and parameters: {'scalers': 'none', 'ratios': 'norm_ratio', 'imputers': 'none', 'n_estimators': 3000, 'learning_rate': 0.4285078717601205, 'max_depth': 12, 'min_child_weight': 2, 'subsample': 0.8, 'colsample_bytree': 0.6, 'colsample_bylevel': 0.8, 'reg_alpha': 31.419183897690218, 'reg_lambda': 0.13490883993215624, 'gamma': 1.2285718765545834e-05}. Best is trial 139 with value: -4.662331475947537.
[I 2026-07-17 13:02:37,075] Trial 152 finished with value: -2.8070889231840437 and parameters: {'scalers': 'robust', 'ratios': 'norm_ratio', 'imputers': 'none', 'n_estimators': 3000, 'learning_rate': 0.41732192131933954, 'max_depth': 12, 'min_child_weight': 2, 'subsample': 0.7, 'colsample_bytree': 1.0, 'colsample_bylevel': 0.8, 'reg_alpha': 3.558586391787057, 'reg_lambda': 0.942043285227761, 'gamma': 1.9689084800031625e-05}. Best is trial 139 with value: -4.662331475947537.
[I 2026-07-17 13:03:44,864] Trial 153 finished with value: -2.9502584407022283 and parameters: {'scalers': 'robust', 'ratios': 'norm_ratio', 'imputers': 'none', 'n_estimators': 3000, 'learning_rate': 0.3918886766243144, 'max_depth': 12, 'min_child_weight': 2, 'subsample': 0.7, 'colsample_bytree': 0.6, 'colsample_bylevel': 0.8, 'reg_alpha': 1.9560376044300611, 'reg_lambda': 23.668236665556282, 'gamma': 2.2143173718883338e-05}. Best is trial 139 with value: -4.662331475947537.
[I 2026-07-17 13:05:00,940] Trial 154 finished with value: -3.8481853096069987 and parameters: {'scalers': 'robust', 'ratios': 'norm_ratio', 'imputers': 'none', 'n_estimators': 3000, 'learning_rate': 0.3958218393174088, 'max_depth': 12, 'min_child_weight': 1, 'subsample': 0.8, 'colsample_bytree': 0.6, 'colsample_bylevel': 0.8, 'reg_alpha': 1.7172206265139938, 'reg_lambda': 23.400963864863932, 'gamma': 2.185174347821924e-05}. Best is trial 139 with value: -4.662331475947537.
[I 2026-07-17 13:05:11,234] Trial 155 finished with value: -1.753248111208087 and parameters: {'scalers': 'none', 'ratios': 'norm_ratio', 'imputers': 'none', 'n_estimators': 3000, 'learning_rate': 0.4044020024876785, 'max_depth': 4, 'min_child_weight': 1, 'subsample': 0.6, 'colsample_bytree': 0.6, 'colsample_bylevel': 0.8, 'reg_alpha': 1.9044634252065513, 'reg_lambda': 0.11165404161224146, 'gamma': 2.2771613946789877e-05}. Best is trial 139 with value: -4.662331475947537.
[I 2026-07-17 13:05:23,846] Trial 156 finished with value: -1.7554997475485956 and parameters: {'scalers': 'none', 'ratios': 'norm_ratio', 'imputers': 'none', 'n_estimators': 2950, 'learning_rate': 0.3993492402668549, 'max_depth': 4, 'min_child_weight': 1, 'subsample': 0.6, 'colsample_bytree': 0.6, 'colsample_bylevel': 0.8, 'reg_alpha': 1.9246787379086807, 'reg_lambda': 4.0153590306274875e-06, 'gamma': 1.992307485024148e-05}. Best is trial 139 with value: -4.662331475947537.
[I 2026-07-17 13:06:40,148] Trial 157 finished with value: -4.04914050435627 and parameters: {'scalers': 'robust', 'ratios': 'norm_ratio', 'imputers': 'none', 'n_estimators': 3000, 'learning_rate': 0.3958869117379336, 'max_depth': 12, 'min_child_weight': 1, 'subsample': 0.6, 'colsample_bytree': 0.6, 'colsample_bylevel': 0.8, 'reg_alpha': 1.7668587717897686, 'reg_lambda': 4.442305128480402e-06, 'gamma': 2.146046887876457e-05}. Best is trial 139 with value: -4.662331475947537.
[I 2026-07-17 13:07:56,374] Trial 158 finished with value: -4.203277613570265 and parameters: {'scalers': 'robust', 'ratios': 'norm_ratio', 'imputers': 'none', 'n_estimators': 3000, 'learning_rate': 0.4004791430148141, 'max_depth': 12, 'min_child_weight': 1, 'subsample': 0.6, 'colsample_bytree': 0.6, 'colsample_bylevel': 0.8, 'reg_alpha': 1.8612012390900246, 'reg_lambda': 4.060857941295756e-06, 'gamma': 1.9336015148006106e-05}. Best is trial 139 with value: -4.662331475947537.
[I 2026-07-17 13:09:04,952] Trial 159 finished with value: -3.963399421396378 and parameters: {'scalers': 'robust', 'ratios': 'norm_ratio', 'imputers': 'none', 'n_estimators': 2650, 'learning_rate': 0.40553879930527786, 'max_depth': 12, 'min_child_weight': 1, 'subsample': 0.6, 'colsample_bytree': 0.6, 'colsample_bylevel': 0.8, 'reg_alpha': 1.8011638793627087, 'reg_lambda': 4.496179538246221e-06, 'gamma': 9.59110460892013e-05}. Best is trial 139 with value: -4.662331475947537.
[I 2026-07-17 13:09:15,658] Trial 160 finished with value: -1.8759081097044803 and parameters: {'scalers': 'none', 'ratios': 'norm_ratio', 'imputers': 'none', 'n_estimators': 2950, 'learning_rate': 0.4045694135391604, 'max_depth': 4, 'min_child_weight': 1, 'subsample': 0.6, 'colsample_bytree': 0.6, 'colsample_bylevel': 0.8, 'reg_alpha': 1.709527171997408, 'reg_lambda': 4.4843084701445496e-06, 'gamma': 9.011396340892282e-05}. Best is trial 139 with value: -4.662331475947537.
[I 2026-07-17 13:10:23,688] Trial 161 finished with value: -4.015503498038041 and parameters: {'scalers': 'none', 'ratios': 'norm_ratio', 'imputers': 'none', 'n_estimators': 2650, 'learning_rate': 0.40208564142883113, 'max_depth': 12, 'min_child_weight': 1, 'subsample': 0.6, 'colsample_bytree': 0.6, 'colsample_bylevel': 0.8, 'reg_alpha': 1.7910486339838891, 'reg_lambda': 4.372510709797184e-06, 'gamma': 0.00010006848512838014}. Best is trial 139 with value: -4.662331475947537.
[I 2026-07-17 13:11:31,665] Trial 162 finished with value: -3.3523365468879653 and parameters: {'scalers': 'robust', 'ratios': 'norm_ratio', 'imputers': 'none', 'n_estimators': 2300, 'learning_rate': 0.34737035191623644, 'max_depth': 12, 'min_child_weight': 1, 'subsample': 0.8, 'colsample_bytree': 0.6, 'colsample_bylevel': 0.9, 'reg_alpha': 1.4401464509205728, 'reg_lambda': 4.784212445198567e-06, 'gamma': 2.852792710804304e-06}. Best is trial 139 with value: -4.662331475947537.
[I 2026-07-17 13:12:43,342] Trial 163 finished with value: -3.3882086718185658 and parameters: {'scalers': 'robust', 'ratios': 'norm_ratio', 'imputers': 'none', 'n_estimators': 2350, 'learning_rate': 0.3525096770453995, 'max_depth': 12, 'min_child_weight': 1, 'subsample': 0.8, 'colsample_bytree': 0.6, 'colsample_bylevel': 0.9, 'reg_alpha': 1.4002893729358992, 'reg_lambda': 4.849455120927361e-06, 'gamma': 9.604798950315874e-05}. Best is trial 139 with value: -4.662331475947537.
[I 2026-07-17 13:13:35,640] Trial 164 finished with value: -2.720474680476416 and parameters: {'scalers': 'robust', 'ratios': 'norm_ratio', 'imputers': 'none', 'n_estimators': 2350, 'learning_rate': 0.3439074185985069, 'max_depth': 12, 'min_child_weight': 1, 'subsample': 1.0, 'colsample_bytree': 0.6, 'colsample_bylevel': 0.9, 'reg_alpha': 1.244458434949172, 'reg_lambda': 4.81324514569043e-06, 'gamma': 5.426266134405617e-05}. Best is trial 139 with value: -4.662331475947537.
[I 2026-07-17 13:14:42,033] Trial 165 finished with value: -3.3549892970947672 and parameters: {'scalers': 'robust', 'ratios': 'norm_ratio', 'imputers': 'none', 'n_estimators': 2300, 'learning_rate': 0.3348514018852501, 'max_depth': 12, 'min_child_weight': 1, 'subsample': 0.8, 'colsample_bytree': 0.6, 'colsample_bylevel': 0.8, 'reg_alpha': 1.2037720878901508, 'reg_lambda': 3.172164943123145e-05, 'gamma': 8.3074215921107e-06}. Best is trial 139 with value: -4.662331475947537.
[I 2026-07-17 13:15:50,206] Trial 166 finished with value: -3.396217925067314 and parameters: {'scalers': 'robust', 'ratios': 'norm_ratio', 'imputers': 'none', 'n_estimators': 2350, 'learning_rate': 0.3195250383202985, 'max_depth': 12, 'min_child_weight': 1, 'subsample': 0.6, 'colsample_bytree': 0.6, 'colsample_bylevel': 0.9, 'reg_alpha': 1.181093861575054, 'reg_lambda': 4.954259979071662e-06, 'gamma': 4.5174792339600135e-06}. Best is trial 139 with value: -4.662331475947537.
[I 2026-07-17 13:16:18,630] Trial 167 finished with value: -2.3847083498407766 and parameters: {'scalers': 'robust', 'ratios': 'norm_ratio', 'imputers': 'none', 'n_estimators': 2300, 'learning_rate': 0.34215738667405504, 'max_depth': 12, 'min_child_weight': 1, 'subsample': 0.6, 'colsample_bytree': 0.6, 'colsample_bylevel': 0.9, 'reg_alpha': 6.6810031554992015, 'reg_lambda': 2.6924430135267328e-05, 'gamma': 5.244068060533668e-06}. Best is trial 139 with value: -4.662331475947537.
[I 2026-07-17 13:16:53,667] Trial 168 finished with value: -2.466517529597041 and parameters: {'scalers': 'robust', 'ratios': 'norm_ratio', 'imputers': 'none', 'n_estimators': 2650, 'learning_rate': 0.33399770101193504, 'max_depth': 12, 'min_child_weight': 1, 'subsample': 0.6, 'colsample_bytree': 0.6, 'colsample_bylevel': 0.9, 'reg_alpha': 6.142705834019791, 'reg_lambda': 5.008701442977569e-06, 'gamma': 5.025873750882572e-06}. Best is trial 139 with value: -4.662331475947537.
[I 2026-07-17 13:17:22,014] Trial 169 finished with value: -2.3149885053043144 and parameters: {'scalers': 'robust', 'ratios': 'norm_ratio', 'imputers': 'none', 'n_estimators': 2300, 'learning_rate': 0.3416162758370983, 'max_depth': 12, 'min_child_weight': 1, 'subsample': 0.6, 'colsample_bytree': 0.6, 'colsample_bylevel': 0.9, 'reg_alpha': 6.382136936276897, 'reg_lambda': 3.32446768354293e-05, 'gamma': 0.0005145766116690444}. Best is trial 139 with value: -4.662331475947537.
[I 2026-07-17 13:17:50,536] Trial 170 finished with value: -2.2328406320169933 and parameters: {'scalers': 'robust', 'ratios': 'norm_ratio', 'imputers': 'none', 'n_estimators': 2600, 'learning_rate': 0.3368342313931059, 'max_depth': 12, 'min_child_weight': 1, 'subsample': 0.6, 'colsample_bytree': 0.6, 'colsample_bylevel': 0.8, 'reg_alpha': 6.961340677629923, 'reg_lambda': 3.0443951615317135e-05, 'gamma': 5.524723409834006e-05}. Best is trial 139 with value: -4.662331475947537.
[I 2026-07-17 13:18:19,241] Trial 171 finished with value: -2.295917782766801 and parameters: {'scalers': 'robust', 'ratios': 'norm_ratio', 'imputers': 'none', 'n_estimators': 2650, 'learning_rate': 0.32831800952102463, 'max_depth': 12, 'min_child_weight': 1, 'subsample': 0.6, 'colsample_bytree': 0.6, 'colsample_bylevel': 0.8, 'reg_alpha': 7.041084608265377, 'reg_lambda': 2.7272786603986705e-05, 'gamma': 5.390717239467456e-05}. Best is trial 139 with value: -4.662331475947537.
[I 2026-07-17 13:18:47,667] Trial 172 finished with value: -2.204373746512271 and parameters: {'scalers': 'robust', 'ratios': 'norm_ratio', 'imputers': 'none', 'n_estimators': 2650, 'learning_rate': 0.3326163971199307, 'max_depth': 12, 'min_child_weight': 1, 'subsample': 0.6, 'colsample_bytree': 0.6, 'colsample_bylevel': 0.8, 'reg_alpha': 7.079053837166007, 'reg_lambda': 3.3726976232318544e-05, 'gamma': 0.0002086914179521194}. Best is trial 139 with value: -4.662331475947537.
[I 2026-07-17 13:19:24,921] Trial 173 finished with value: -2.695335684321344 and parameters: {'scalers': 'robust', 'ratios': 'norm_ratio', 'imputers': 'none', 'n_estimators': 2600, 'learning_rate': 0.33382914821567405, 'max_depth': 12, 'min_child_weight': 1, 'subsample': 0.6, 'colsample_bytree': 0.6, 'colsample_bylevel': 0.8, 'reg_alpha': 4.9187459043377775, 'reg_lambda': 9.952561762371174e-06, 'gamma': 0.0004897605360957401}. Best is trial 139 with value: -4.662331475947537.
[I 2026-07-17 13:20:24,256] Trial 174 finished with value: -2.88748773357226 and parameters: {'scalers': 'robust', 'ratios': 'norm_ratio', 'imputers': 'none', 'n_estimators': 2900, 'learning_rate': 0.24503725859290781, 'max_depth': 12, 'min_child_weight': 1, 'subsample': 0.6, 'colsample_bytree': 0.6, 'colsample_bylevel': 0.8, 'reg_alpha': 2.619213036603476, 'reg_lambda': 1.0215295745093247e-05, 'gamma': 0.0004994058086238257}. Best is trial 139 with value: -4.662331475947537.
[I 2026-07-17 13:20:53,113] Trial 175 finished with value: -1.8033282224808644 and parameters: {'scalers': 'robust', 'ratios': 'norm_ratio', 'imputers': 'none', 'n_estimators': 2650, 'learning_rate': 0.40669347218154944, 'max_depth': 12, 'min_child_weight': 10, 'subsample': 0.6, 'colsample_bytree': 0.6, 'colsample_bylevel': 0.8, 'reg_alpha': 2.6300016996927638, 'reg_lambda': 1.0566390655849316e-05, 'gamma': 0.0004957963928534582}. Best is trial 139 with value: -4.662331475947537.
[I 2026-07-17 13:21:47,964] Trial 176 finished with value: -2.9086071556006 and parameters: {'scalers': 'robust', 'ratios': 'norm_ratio', 'imputers': 'none', 'n_estimators': 2650, 'learning_rate': 0.24334851223388396, 'max_depth': 12, 'min_child_weight': 1, 'subsample': 0.6, 'colsample_bytree': 0.6, 'colsample_bylevel': 0.8, 'reg_alpha': 2.5092928728781247, 'reg_lambda': 9.242103972982622e-06, 'gamma': 0.00044501780725393413}. Best is trial 139 with value: -4.662331475947537.
[I 2026-07-17 13:22:41,938] Trial 177 finished with value: -2.867691751086823 and parameters: {'scalers': 'robust', 'ratios': 'norm_ratio', 'imputers': 'none', 'n_estimators': 2600, 'learning_rate': 0.23980755621509553, 'max_depth': 12, 'min_child_weight': 1, 'subsample': 0.6, 'colsample_bytree': 0.6, 'colsample_bylevel': 0.8, 'reg_alpha': 2.47445416405108, 'reg_lambda': 9.280208101289054e-06, 'gamma': 0.00018111410069962053}. Best is trial 139 with value: -4.662331475947537.
[I 2026-07-17 13:23:44,575] Trial 178 finished with value: -4.4700116412497035 and parameters: {'scalers': 'robust', 'ratios': 'norm_ratio', 'imputers': 'none', 'n_estimators': 2900, 'learning_rate': 0.42048321819820306, 'max_depth': 12, 'min_child_weight': 1, 'subsample': 0.6, 'colsample_bytree': 0.6, 'colsample_bylevel': 0.8, 'reg_alpha': 2.593412968873518, 'reg_lambda': 9.578421524022063e-06, 'gamma': 0.0005123849452214685}. Best is trial 139 with value: -4.662331475947537.
[I 2026-07-17 13:24:48,048] Trial 179 finished with value: -4.515087491250698 and parameters: {'scalers': 'none', 'ratios': 'norm_ratio', 'imputers': 'none', 'n_estimators': 2900, 'learning_rate': 0.42037979078635285, 'max_depth': 12, 'min_child_weight': 1, 'subsample': 0.6, 'colsample_bytree': 0.6, 'colsample_bylevel': 0.8, 'reg_alpha': 2.524070376537927, 'reg_lambda': 9.298341504127457e-06, 'gamma': 0.0002114922217375279}. Best is trial 139 with value: -4.662331475947537.
