[I 2026-07-17 11:25:51,154] Trial 90 finished with value: -0.21445275029176555 and parameters: {'scalers': 'standard', 'ratios': 'norm_ratio', 'imputers': 'median', 'n_estimators': 1250, 'learning_rate': 0.3775153920282414, 'max_depth': 7, 'min_child_weight': 8, 'subsample': 0.8, 'colsample_bytree': 0.8, 'colsample_bylevel': 1.0, 'reg_alpha': 5.114130747951893e-05, 'reg_lambda': 6.376218488285495e-06, 'gamma': 0.0001912277901943295}. Best is trial 46 with value: -0.23138436235222742.
[I 2026-07-17 11:25:59,684] Trial 91 finished with value: -0.23169927255786493 and parameters: {'scalers': 'standard', 'ratios': 'norm_ratio', 'imputers': 'median', 'n_estimators': 1300, 'learning_rate': 0.40230975925962653, 'max_depth': 7, 'min_child_weight': 8, 'subsample': 0.7, 'colsample_bytree': 0.6, 'colsample_bylevel': 0.6, 'reg_alpha': 0.1511159035907795, 'reg_lambda': 5.581478054454189e-06, 'gamma': 0.00016843561989371322}. Best is trial 91 with value: -0.23169927255786493.
[I 2026-07-17 11:26:12,600] Trial 92 finished with value: -0.23138337681624108 and parameters: {'scalers': 'standard', 'ratios': 'log_ratio', 'imputers': 'median', 'n_estimators': 1250, 'learning_rate': 0.47861676443756784, 'max_depth': 7, 'min_child_weight': 8, 'subsample': 0.7, 'colsample_bytree': 0.9, 'colsample_bylevel': 1.0, 'reg_alpha': 6.844378811733865e-05, 'reg_lambda': 5.7552235539449355e-05, 'gamma': 4.6131604207442294e-05}. Best is trial 91 with value: -0.23169927255786493.
[I 2026-07-17 11:26:24,404] Trial 93 finished with value: -0.24476547597290488 and parameters: {'scalers': 'standard', 'ratios': 'log_ratio', 'imputers': 'median', 'n_estimators': 1250, 'learning_rate': 0.49998926701550445, 'max_depth': 7, 'min_child_weight': 8, 'subsample': 0.7, 'colsample_bytree': 0.6, 'colsample_bylevel': 1.0, 'reg_alpha': 0.7729616041304527, 'reg_lambda': 6.195314823147543e-05, 'gamma': 3.8870107553436825e-05}. Best is trial 93 with value: -0.24476547597290488.
[I 2026-07-17 11:26:34,266] Trial 94 finished with value: -0.23472339190575162 and parameters: {'scalers': 'standard', 'ratios': 'log_ratio', 'imputers': 'median', 'n_estimators': 1300, 'learning_rate': 0.4905524327568233, 'max_depth': 7, 'min_child_weight': 8, 'subsample': 0.7, 'colsample_bytree': 0.9, 'colsample_bylevel': 0.6, 'reg_alpha': 0.002010209417049114, 'reg_lambda': 5.316378461564111e-06, 'gamma': 4.3322699552026586e-05}. Best is trial 93 with value: -0.24476547597290488.
[I 2026-07-17 11:26:46,483] Trial 95 finished with value: -0.1979752880816065 and parameters: {'scalers': 'standard', 'ratios': 'log_ratio', 'imputers': 'median', 'n_estimators': 1550, 'learning_rate': 0.15213765597409193, 'max_depth': 7, 'min_child_weight': 8, 'subsample': 0.7, 'colsample_bytree': 0.6, 'colsample_bylevel': 1.0, 'reg_alpha': 3.271336699194587e-05, 'reg_lambda': 5.281797320251251e-06, 'gamma': 3.921486242549776e-05}. Best is trial 93 with value: -0.24476547597290488.
[I 2026-07-17 11:26:59,526] Trial 96 finished with value: -0.1963544432840315 and parameters: {'scalers': 'standard', 'ratios': 'log_ratio', 'imputers': 'median', 'n_estimators': 1300, 'learning_rate': 0.1657115782626411, 'max_depth': 7, 'min_child_weight': 8, 'subsample': 0.7, 'colsample_bytree': 0.9, 'colsample_bylevel': 1.0, 'reg_alpha': 2.9965753494663262e-05, 'reg_lambda': 4.8376911376381925e-06, 'gamma': 0.0035942457922181767}. Best is trial 93 with value: -0.24476547597290488.
[I 2026-07-17 11:27:10,996] Trial 97 finished with value: -0.19210748569656036 and parameters: {'scalers': 'standard', 'ratios': 'norm_ratio', 'imputers': 'median', 'n_estimators': 1150, 'learning_rate': 0.14750054323280665, 'max_depth': 7, 'min_child_weight': 8, 'subsample': 0.7, 'colsample_bytree': 0.9, 'colsample_bylevel': 1.0, 'reg_alpha': 4.908507692632538e-05, 'reg_lambda': 1.7133813656372687e-06, 'gamma': 0.004617460903929637}. Best is trial 93 with value: -0.24476547597290488.
[I 2026-07-17 11:27:27,474] Trial 98 finished with value: -0.24036222391597223 and parameters: {'scalers': 'standard', 'ratios': 'log_ratio', 'imputers': 'median', 'n_estimators': 1350, 'learning_rate': 0.4874165506003221, 'max_depth': 7, 'min_child_weight': 8, 'subsample': 0.7, 'colsample_bytree': 0.9, 'colsample_bylevel': 1.0, 'reg_alpha': 0.6865398388776425, 'reg_lambda': 2.1960044458695883e-06, 'gamma': 0.0036522974655587397}. Best is trial 93 with value: -0.24476547597290488.
[I 2026-07-17 11:27:42,645] Trial 99 finished with value: -0.20544131962259918 and parameters: {'scalers': 'standard', 'ratios': 'log_ratio', 'imputers': 'median', 'n_estimators': 1550, 'learning_rate': 0.15641056897910458, 'max_depth': 8, 'min_child_weight': 8, 'subsample': 0.7, 'colsample_bytree': 0.6, 'colsample_bylevel': 1.0, 'reg_alpha': 0.16892872311639687, 'reg_lambda': 2.1347808715943046e-06, 'gamma': 4.693109334358467e-05}. Best is trial 93 with value: -0.24476547597290488.
[I 2026-07-17 11:28:00,436] Trial 100 finished with value: -0.24476579850112778 and parameters: {'scalers': 'standard', 'ratios': 'log_ratio', 'imputers': 'median', 'n_estimators': 1350, 'learning_rate': 0.49226922897564107, 'max_depth': 8, 'min_child_weight': 8, 'subsample': 0.7, 'colsample_bytree': 0.9, 'colsample_bylevel': 1.0, 'reg_alpha': 0.10494760113504999, 'reg_lambda': 1.8125833810298765e-06, 'gamma': 3.75100138519133e-05}. Best is trial 100 with value: -0.24476579850112778.
[I 2026-07-17 11:28:13,692] Trial 101 finished with value: -0.2016293843879907 and parameters: {'scalers': 'standard', 'ratios': 'log_ratio', 'imputers': 'median', 'n_estimators': 1350, 'learning_rate': 0.1651293872039766, 'max_depth': 8, 'min_child_weight': 8, 'subsample': 0.7, 'colsample_bytree': 0.6, 'colsample_bylevel': 1.0, 'reg_alpha': 0.15012319427562132, 'reg_lambda': 1.737264861607842e-06, 'gamma': 3.903796007448347e-05}. Best is trial 100 with value: -0.24476579850112778.
[I 2026-07-17 11:28:30,419] Trial 102 finished with value: -0.21740282165012806 and parameters: {'scalers': 'standard', 'ratios': 'log_ratio', 'imputers': 'median', 'n_estimators': 1350, 'learning_rate': 0.2535328175261462, 'max_depth': 8, 'min_child_weight': 9, 'subsample': 0.6, 'colsample_bytree': 0.9, 'colsample_bylevel': 1.0, 'reg_alpha': 0.14518284211243518, 'reg_lambda': 2.8319110393318314e-06, 'gamma': 4.222769284996815e-05}. Best is trial 100 with value: -0.24476579850112778.
[I 2026-07-17 11:28:48,053] Trial 103 finished with value: -0.2408859147953321 and parameters: {'scalers': 'standard', 'ratios': 'log_ratio', 'imputers': 'median', 'n_estimators': 1350, 'learning_rate': 0.49900294415800156, 'max_depth': 8, 'min_child_weight': 9, 'subsample': 0.7, 'colsample_bytree': 0.9, 'colsample_bylevel': 1.0, 'reg_alpha': 0.17284040498410097, 'reg_lambda': 5.8376755370973756e-05, 'gamma': 0.0030098838177305028}. Best is trial 100 with value: -0.24476579850112778.
[I 2026-07-17 11:29:01,351] Trial 104 finished with value: -0.24278527426913493 and parameters: {'scalers': 'standard', 'ratios': 'log_ratio', 'imputers': 'median', 'n_estimators': 1100, 'learning_rate': 0.4937559060186486, 'max_depth': 8, 'min_child_weight': 9, 'subsample': 0.6, 'colsample_bytree': 0.9, 'colsample_bylevel': 1.0, 'reg_alpha': 4.064526977641832, 'reg_lambda': 5.9651714859275055e-05, 'gamma': 0.00015229971231456776}. Best is trial 100 with value: -0.24476579850112778.
[I 2026-07-17 11:29:18,003] Trial 105 finished with value: -0.21922455099706936 and parameters: {'scalers': 'standard', 'ratios': 'log_ratio', 'imputers': 'median', 'n_estimators': 1350, 'learning_rate': 0.25408868381801497, 'max_depth': 8, 'min_child_weight': 9, 'subsample': 0.6, 'colsample_bytree': 0.9, 'colsample_bylevel': 1.0, 'reg_alpha': 0.18869267759562494, 'reg_lambda': 5.667753622480517e-05, 'gamma': 1.7482079788896454e-05}. Best is trial 100 with value: -0.24476579850112778.
[I 2026-07-17 11:29:41,274] Trial 106 finished with value: -0.22196709575129772 and parameters: {'scalers': 'standard', 'ratios': 'log_ratio', 'imputers': 'median', 'n_estimators': 1750, 'learning_rate': 0.24266549527189027, 'max_depth': 8, 'min_child_weight': 9, 'subsample': 0.6, 'colsample_bytree': 0.9, 'colsample_bylevel': 1.0, 'reg_alpha': 0.9383341941548139, 'reg_lambda': 2.354134879575275e-06, 'gamma': 1.5123479515569556e-05}. Best is trial 100 with value: -0.24476579850112778.
[I 2026-07-17 11:29:52,300] Trial 107 finished with value: -0.2517675687589974 and parameters: {'scalers': 'standard', 'ratios': 'log_ratio', 'imputers': 'median', 'n_estimators': 1100, 'learning_rate': 0.4975118590556376, 'max_depth': 8, 'min_child_weight': 9, 'subsample': 0.6, 'colsample_bytree': 0.9, 'colsample_bylevel': 0.6, 'reg_alpha': 0.8219011627388942, 'reg_lambda': 1.1140310470000081e-05, 'gamma': 0.00015967478360701654}. Best is trial 107 with value: -0.2517675687589974.
[I 2026-07-17 11:30:10,654] Trial 108 finished with value: -0.24948779513393585 and parameters: {'scalers': 'standard', 'ratios': 'log_ratio', 'imputers': 'median', 'n_estimators': 1350, 'learning_rate': 0.4796634942927817, 'max_depth': 8, 'min_child_weight': 9, 'subsample': 0.6, 'colsample_bytree': 0.9, 'colsample_bylevel': 1.0, 'reg_alpha': 0.7856668402644688, 'reg_lambda': 5.8140828725733656e-05, 'gamma': 0.0001506653007518319}. Best is trial 107 with value: -0.2517675687589974.
[I 2026-07-17 11:30:34,436] Trial 109 finished with value: -0.25772743304709433 and parameters: {'scalers': 'standard', 'ratios': 'log_ratio', 'imputers': 'median', 'n_estimators': 1750, 'learning_rate': 0.4963540663073931, 'max_depth': 8, 'min_child_weight': 9, 'subsample': 0.6, 'colsample_bytree': 0.9, 'colsample_bylevel': 1.0, 'reg_alpha': 0.8338341372154643, 'reg_lambda': 5.5300355513846676e-05, 'gamma': 0.00015113874968509047}. Best is trial 109 with value: -0.25772743304709433.
[I 2026-07-17 11:30:53,268] Trial 110 finished with value: -0.2425091066345987 and parameters: {'scalers': 'standard', 'ratios': 'log_ratio', 'imputers': 'median', 'n_estimators': 1150, 'learning_rate': 0.4865566182325053, 'max_depth': 9, 'min_child_weight': 9, 'subsample': 0.7, 'colsample_bytree': 0.9, 'colsample_bylevel': 1.0, 'reg_alpha': 0.9220447540463758, 'reg_lambda': 1.1196285438053286e-06, 'gamma': 1.6576942653145414e-05}. Best is trial 109 with value: -0.25772743304709433.
[I 2026-07-17 11:31:11,133] Trial 111 finished with value: -0.2506076085707317 and parameters: {'scalers': 'standard', 'ratios': 'log_ratio', 'imputers': 'median', 'n_estimators': 1100, 'learning_rate': 0.49745116442800585, 'max_depth': 9, 'min_child_weight': 9, 'subsample': 0.7, 'colsample_bytree': 0.9, 'colsample_bylevel': 1.0, 'reg_alpha': 0.7250696125778464, 'reg_lambda': 1.1900002923251111e-05, 'gamma': 1.448189598062857e-05}. Best is trial 109 with value: -0.25772743304709433.
[I 2026-07-17 11:31:24,537] Trial 112 finished with value: -0.24959875356604241 and parameters: {'scalers': 'standard', 'ratios': 'log_ratio', 'imputers': 'median', 'n_estimators': 950, 'learning_rate': 0.49040789783705224, 'max_depth': 9, 'min_child_weight': 9, 'subsample': 0.6, 'colsample_bytree': 0.9, 'colsample_bylevel': 1.0, 'reg_alpha': 0.08203905416349425, 'reg_lambda': 1.0477431955914706e-06, 'gamma': 1.5456858535870135e-05}. Best is trial 109 with value: -0.25772743304709433.
[I 2026-07-17 11:31:38,486] Trial 113 finished with value: -0.24454115097154147 and parameters: {'scalers': 'standard', 'ratios': 'log_ratio', 'imputers': 'median', 'n_estimators': 950, 'learning_rate': 0.48981153581171566, 'max_depth': 9, 'min_child_weight': 10, 'subsample': 0.6, 'colsample_bytree': 0.9, 'colsample_bylevel': 1.0, 'reg_alpha': 0.7942158945057386, 'reg_lambda': 1.2096809594766884e-06, 'gamma': 1.4766680459804237e-05}. Best is trial 109 with value: -0.25772743304709433.
[I 2026-07-17 11:31:53,364] Trial 114 finished with value: -0.23185715312448132 and parameters: {'scalers': 'standard', 'ratios': 'log_ratio', 'imputers': 'median', 'n_estimators': 1100, 'learning_rate': 0.49173010685606555, 'max_depth': 9, 'min_child_weight': 10, 'subsample': 0.7, 'colsample_bytree': 0.9, 'colsample_bylevel': 1.0, 'reg_alpha': 4.367132796948652, 'reg_lambda': 0.00016167602180016844, 'gamma': 0.00016136303330831355}. Best is trial 109 with value: -0.25772743304709433.
[I 2026-07-17 11:32:03,825] Trial 115 finished with value: -0.21713168808577138 and parameters: {'scalers': 'standard', 'ratios': 'log_ratio', 'imputers': 'median', 'n_estimators': 1150, 'learning_rate': 0.33260518518648424, 'max_depth': 8, 'min_child_weight': 10, 'subsample': 0.6, 'colsample_bytree': 1.0, 'colsample_bylevel': 0.6, 'reg_alpha': 3.7775523419865804, 'reg_lambda': 1.2262378847757104e-06, 'gamma': 6.61831474951485e-05}. Best is trial 109 with value: -0.25772743304709433.
[I 2026-07-17 11:32:15,057] Trial 116 finished with value: -0.240342592451569 and parameters: {'scalers': 'standard', 'ratios': 'log_ratio', 'imputers': 'median', 'n_estimators': 1100, 'learning_rate': 0.48390939122925947, 'max_depth': 9, 'min_child_weight': 10, 'subsample': 0.6, 'colsample_bytree': 0.9, 'colsample_bylevel': 0.6, 'reg_alpha': 0.0938104170774067, 'reg_lambda': 6.775470075021682e-05, 'gamma': 0.00013431101113623017}. Best is trial 109 with value: -0.25772743304709433.
[I 2026-07-17 11:32:26,167] Trial 117 finished with value: -0.22711236588032235 and parameters: {'scalers': 'standard', 'ratios': 'log_ratio', 'imputers': 'median', 'n_estimators': 1100, 'learning_rate': 0.3405617943356781, 'max_depth': 9, 'min_child_weight': 10, 'subsample': 0.6, 'colsample_bytree': 0.9, 'colsample_bylevel': 0.6, 'reg_alpha': 0.09817222072085362, 'reg_lambda': 1.167594354212107e-06, 'gamma': 0.0001332055134799751}. Best is trial 109 with value: -0.25772743304709433.
[I 2026-07-17 11:32:42,056] Trial 118 finished with value: -0.2255196984080219 and parameters: {'scalers': 'standard', 'ratios': 'log_ratio', 'imputers': 'median', 'n_estimators': 1150, 'learning_rate': 0.33347205778155603, 'max_depth': 9, 'min_child_weight': 10, 'subsample': 0.6, 'colsample_bytree': 0.9, 'colsample_bylevel': 1.0, 'reg_alpha': 0.08735293088535738, 'reg_lambda': 1.3735542687020923e-06, 'gamma': 0.00016045621876733805}. Best is trial 109 with value: -0.25772743304709433.
[I 2026-07-17 11:32:54,326] Trial 119 finished with value: -0.22772748511420138 and parameters: {'scalers': 'standard', 'ratios': 'log_ratio', 'imputers': 'median', 'n_estimators': 1150, 'learning_rate': 0.3303035219016768, 'max_depth': 9, 'min_child_weight': 10, 'subsample': 0.6, 'colsample_bytree': 0.9, 'colsample_bylevel': 0.6, 'reg_alpha': 0.7571629040203286, 'reg_lambda': 1.2949828868189486e-06, 'gamma': 3.782931655883123e-06}. Best is trial 109 with value: -0.25772743304709433.
[I 2026-07-17 11:33:07,418] Trial 121 finished with value: -0.17573991334684966 and parameters: {'scalers': 'standard', 'ratios': 'log_ratio', 'imputers': 'median', 'n_estimators': 950, 'learning_rate': 0.3209329540564472, 'max_depth': 9, 'min_child_weight': 10, 'subsample': 0.6, 'colsample_bytree': 0.9, 'colsample_bylevel': 1.0, 'reg_alpha': 0.6686110077676733, 'reg_lambda': 1.0678933990150694e-06, 'gamma': 11.340923020102759}. Best is trial 109 with value: -0.25772743304709433.
[I 2026-07-17 11:33:10,151] Trial 120 finished with value: -0.2250876343486373 and parameters: {'scalers': 'standard', 'ratios': 'log_ratio', 'imputers': 'median', 'n_estimators': 1150, 'learning_rate': 0.3314674579275307, 'max_depth': 9, 'min_child_weight': 10, 'subsample': 0.6, 'colsample_bytree': 0.9, 'colsample_bylevel': 1.0, 'reg_alpha': 0.08476412850188567, 'reg_lambda': 1.2219030829246953e-06, 'gamma': 1.4262263664410063e-05}. Best is trial 109 with value: -0.25772743304709433.
[I 2026-07-17 11:33:23,243] Trial 122 finished with value: -0.22367163072037702 and parameters: {'scalers': 'standard', 'ratios': 'log_ratio', 'imputers': 'median', 'n_estimators': 950, 'learning_rate': 0.3321933505646088, 'max_depth': 9, 'min_child_weight': 10, 'subsample': 0.6, 'colsample_bytree': 0.9, 'colsample_bylevel': 1.0, 'reg_alpha': 0.08747661805376493, 'reg_lambda': 1.0262344536375712e-06, 'gamma': 3.5056145533007663e-06}. Best is trial 109 with value: -0.25772743304709433.
[I 2026-07-17 11:33:37,800] Trial 123 finished with value: -0.2270568657812537 and parameters: {'scalers': 'standard', 'ratios': 'log_ratio', 'imputers': 'median', 'n_estimators': 950, 'learning_rate': 0.3354009280364026, 'max_depth': 9, 'min_child_weight': 9, 'subsample': 0.6, 'colsample_bytree': 0.9, 'colsample_bylevel': 1.0, 'reg_alpha': 0.9750519781673014, 'reg_lambda': 1.5967052802922221e-06, 'gamma': 3.022332016686733e-06}. Best is trial 109 with value: -0.25772743304709433.
[I 2026-07-17 11:33:51,695] Trial 124 finished with value: -0.2280310362088062 and parameters: {'scalers': 'standard', 'ratios': 'log_ratio', 'imputers': 'median', 'n_estimators': 900, 'learning_rate': 0.31977066202898946, 'max_depth': 9, 'min_child_weight': 9, 'subsample': 0.6, 'colsample_bytree': 0.9, 'colsample_bylevel': 1.0, 'reg_alpha': 0.7677193564784052, 'reg_lambda': 1.0975141148225694e-06, 'gamma': 3.7028564794250627e-06}. Best is trial 109 with value: -0.25772743304709433.
[I 2026-07-17 11:34:06,679] Trial 125 finished with value: -0.22809192000234538 and parameters: {'scalers': 'standard', 'ratios': 'log_ratio', 'imputers': 'median', 'n_estimators': 900, 'learning_rate': 0.3229117546695241, 'max_depth': 10, 'min_child_weight': 9, 'subsample': 0.6, 'colsample_bytree': 0.9, 'colsample_bylevel': 1.0, 'reg_alpha': 0.797530177526239, 'reg_lambda': 1.1083625827521365e-06, 'gamma': 2.8450061156947713e-06}. Best is trial 109 with value: -0.25772743304709433.
[I 2026-07-17 11:34:22,535] Trial 126 finished with value: -0.2296951140877882 and parameters: {'scalers': 'standard', 'ratios': 'log_ratio', 'imputers': 'median', 'n_estimators': 950, 'learning_rate': 0.323969930598411, 'max_depth': 10, 'min_child_weight': 9, 'subsample': 0.6, 'colsample_bytree': 0.9, 'colsample_bylevel': 1.0, 'reg_alpha': 0.769765935176106, 'reg_lambda': 3.438090753140674e-06, 'gamma': 5.077795514582733e-06}. Best is trial 109 with value: -0.25772743304709433.
[I 2026-07-17 11:34:37,603] Trial 127 finished with value: -0.22663001622841003 and parameters: {'scalers': 'standard', 'ratios': 'log_ratio', 'imputers': 'median', 'n_estimators': 900, 'learning_rate': 0.3218871743309887, 'max_depth': 10, 'min_child_weight': 9, 'subsample': 0.6, 'colsample_bytree': 0.9, 'colsample_bylevel': 1.0, 'reg_alpha': 0.8886629211148643, 'reg_lambda': 3.093694081574809e-06, 'gamma': 3.877717994640468e-06}. Best is trial 109 with value: -0.25772743304709433.
[I 2026-07-17 11:34:53,107] Trial 128 finished with value: -0.24797595860640018 and parameters: {'scalers': 'standard', 'ratios': 'log_ratio', 'imputers': 'median', 'n_estimators': 900, 'learning_rate': 0.49684122038976153, 'max_depth': 10, 'min_child_weight': 9, 'subsample': 0.6, 'colsample_bytree': 0.9, 'colsample_bylevel': 1.0, 'reg_alpha': 1.0840070901013243, 'reg_lambda': 3.4083147340868403e-06, 'gamma': 4.199467161757806e-06}. Best is trial 109 with value: -0.25772743304709433.
[I 2026-07-17 11:35:08,139] Trial 129 finished with value: -0.24783307373046617 and parameters: {'scalers': 'standard', 'ratios': 'log_ratio', 'imputers': 'median', 'n_estimators': 950, 'learning_rate': 0.4797965306254283, 'max_depth': 9, 'min_child_weight': 9, 'subsample': 0.6, 'colsample_bytree': 0.9, 'colsample_bylevel': 1.0, 'reg_alpha': 1.1790739647773856, 'reg_lambda': 9.275314391088728e-06, 'gamma': 2.5289061985558462e-05}. Best is trial 109 with value: -0.25772743304709433.
[I 2026-07-17 11:35:21,206] Trial 130 finished with value: -0.21317420326826073 and parameters: {'scalers': 'standard', 'ratios': 'log_ratio', 'imputers': 'median', 'n_estimators': 800, 'learning_rate': 0.24258458863592938, 'max_depth': 10, 'min_child_weight': 9, 'subsample': 0.6, 'colsample_bytree': 0.9, 'colsample_bylevel': 1.0, 'reg_alpha': 0.9809791446390334, 'reg_lambda': 3.49813491795682e-06, 'gamma': 5.569267959042692e-06}. Best is trial 109 with value: -0.25772743304709433.
[I 2026-07-17 11:35:30,478] Trial 131 finished with value: -0.22555147159727354 and parameters: {'scalers': 'standard', 'ratios': 'log_ratio', 'imputers': 'median', 'n_estimators': 800, 'learning_rate': 0.4997854868019706, 'max_depth': 10, 'min_child_weight': 9, 'subsample': 0.6, 'colsample_bytree': 0.9, 'colsample_bylevel': 1.0, 'reg_alpha': 6.634265746147281, 'reg_lambda': 3.60835965074925e-06, 'gamma': 2.6824503574525408e-05}. Best is trial 109 with value: -0.25772743304709433.
[I 2026-07-17 11:35:47,929] Trial 132 finished with value: -0.2561087995687102 and parameters: {'scalers': 'standard', 'ratios': 'log_ratio', 'imputers': 'median', 'n_estimators': 1050, 'learning_rate': 0.49970212708185674, 'max_depth': 10, 'min_child_weight': 9, 'subsample': 0.6, 'colsample_bytree': 0.9, 'colsample_bylevel': 1.0, 'reg_alpha': 0.26020649119241285, 'reg_lambda': 3.407888871471527e-06, 'gamma': 5.996059360970319e-06}. Best is trial 109 with value: -0.25772743304709433.
[I 2026-07-17 11:36:06,194] Trial 133 finished with value: -0.21546884234154257 and parameters: {'scalers': 'standard', 'ratios': 'log_ratio', 'imputers': 'median', 'n_estimators': 1050, 'learning_rate': 0.2376864392878466, 'max_depth': 10, 'min_child_weight': 9, 'subsample': 0.6, 'colsample_bytree': 1.0, 'colsample_bylevel': 1.0, 'reg_alpha': 0.24592011071353384, 'reg_lambda': 3.5207906622717e-06, 'gamma': 5.934985429793704e-06}. Best is trial 109 with value: -0.25772743304709433.
[I 2026-07-17 11:36:20,916] Trial 134 finished with value: -0.24977399479923273 and parameters: {'scalers': 'standard', 'ratios': 'log_ratio', 'imputers': 'median', 'n_estimators': 1050, 'learning_rate': 0.4884705901471193, 'max_depth': 8, 'min_child_weight': 9, 'subsample': 0.6, 'colsample_bytree': 1.0, 'colsample_bylevel': 1.0, 'reg_alpha': 0.2478865664120807, 'reg_lambda': 9.703101248284188e-06, 'gamma': 2.701586650680072e-05}. Best is trial 109 with value: -0.25772743304709433.
