[I 2026-07-17 16:06:31,667] Trial 312 finished with value: -0.384657978876051 and parameters: {'scalers': 'robust', 'ratios': 'norm_ratio', 'imputers': 'median', 'n_estimators': 2700, 'learning_rate': 0.49839489833774564, 'max_depth': 12, 'min_child_weight': 1, 'subsample': 0.9, 'colsample_bytree': 0.5, 'colsample_bylevel': 0.5, 'reg_alpha': 1.0889463455990784e-06, 'reg_lambda': 5.696676333829126e-05, 'gamma': 4.8306550823307005e-05}. Best is trial 312 with value: -0.384657978876051.
[I 2026-07-17 16:06:49,750] Trial 313 finished with value: -0.378615711547019 and parameters: {'scalers': 'standard', 'ratios': 'norm_ratio', 'imputers': 'median', 'n_estimators': 2700, 'learning_rate': 0.4984735203279887, 'max_depth': 12, 'min_child_weight': 1, 'subsample': 0.9, 'colsample_bytree': 0.5, 'colsample_bylevel': 0.5, 'reg_alpha': 1.4889832447878654e-06, 'reg_lambda': 2.5314732479382168e-06, 'gamma': 4.736564247912838e-05}. Best is trial 312 with value: -0.384657978876051.
[I 2026-07-17 16:07:07,520] Trial 314 finished with value: -0.36979448679559185 and parameters: {'scalers': 'robust', 'ratios': 'norm_ratio', 'imputers': 'median', 'n_estimators': 2700, 'learning_rate': 0.47107831359851793, 'max_depth': 12, 'min_child_weight': 1, 'subsample': 0.9, 'colsample_bytree': 0.5, 'colsample_bylevel': 0.5, 'reg_alpha': 1.1595317497557407e-06, 'reg_lambda': 3.0094734746397456e-06, 'gamma': 5.182600915035318e-05}. Best is trial 312 with value: -0.384657978876051.
[I 2026-07-17 16:07:25,176] Trial 315 finished with value: -0.3613332400293679 and parameters: {'scalers': 'robust', 'ratios': 'norm_ratio', 'imputers': 'median', 'n_estimators': 2650, 'learning_rate': 0.4971757029909804, 'max_depth': 12, 'min_child_weight': 1, 'subsample': 0.9, 'colsample_bytree': 0.5, 'colsample_bylevel': 0.5, 'reg_alpha': 1.2062022788946745e-06, 'reg_lambda': 3.275772492527448e-06, 'gamma': 5.722556001170386e-05}. Best is trial 312 with value: -0.384657978876051.
[I 2026-07-17 16:07:43,183] Trial 316 finished with value: -0.37968935015308597 and parameters: {'scalers': 'robust', 'ratios': 'norm_ratio', 'imputers': 'median', 'n_estimators': 2700, 'learning_rate': 0.49651790828967624, 'max_depth': 12, 'min_child_weight': 1, 'subsample': 0.9, 'colsample_bytree': 0.5, 'colsample_bylevel': 0.5, 'reg_alpha': 1.118468193691896e-06, 'reg_lambda': 1.9186418620414523e-06, 'gamma': 5.27894700771541e-05}. Best is trial 312 with value: -0.384657978876051.
[I 2026-07-17 16:08:00,322] Trial 317 finished with value: -0.3150255399735349 and parameters: {'scalers': 'robust', 'ratios': 'norm_ratio', 'imputers': 'median', 'n_estimators': 2650, 'learning_rate': 0.359498318631634, 'max_depth': 12, 'min_child_weight': 1, 'subsample': 0.9, 'colsample_bytree': 0.5, 'colsample_bylevel': 0.5, 'reg_alpha': 1.1426341983060614e-06, 'reg_lambda': 2.6730834535654227e-06, 'gamma': 5.2264166643474424e-05}. Best is trial 312 with value: -0.384657978876051.
[I 2026-07-17 16:08:18,819] Trial 318 finished with value: -0.3727692650650358 and parameters: {'scalers': 'robust', 'ratios': 'norm_ratio', 'imputers': 'median', 'n_estimators': 2700, 'learning_rate': 0.4866518998944371, 'max_depth': 12, 'min_child_weight': 1, 'subsample': 0.9, 'colsample_bytree': 0.5, 'colsample_bylevel': 0.5, 'reg_alpha': 1.5573754586644396e-06, 'reg_lambda': 4.129912033502207e-06, 'gamma': 4.766797198288138e-05}. Best is trial 312 with value: -0.384657978876051.
[I 2026-07-17 16:08:35,842] Trial 319 finished with value: -0.36798641833812407 and parameters: {'scalers': 'standard', 'ratios': 'norm_ratio', 'imputers': 'median', 'n_estimators': 2700, 'learning_rate': 0.4853136649339704, 'max_depth': 12, 'min_child_weight': 1, 'subsample': 0.9, 'colsample_bytree': 0.5, 'colsample_bylevel': 0.5, 'reg_alpha': 1.4721894545450633e-06, 'reg_lambda': 3.753675966085711e-06, 'gamma': 5.071889032976473e-05}. Best is trial 312 with value: -0.384657978876051.
