[I 2026-07-17 15:57:49,310] Trial 315 finished with value: -2.5929843436613083 and parameters: {'scalers': 'none', 'ratios': 'log_ratio', 'imputers': 'mean', 'n_estimators': 3000, 'learning_rate': 0.49146017670205977, 'max_depth': 10, 'min_child_weight': 1, 'subsample': 0.5, 'colsample_bytree': 1.0, 'colsample_bylevel': 1.0, 'reg_alpha': 0.00345285797390161, 'reg_lambda': 27.337655781113696, 'gamma': 7.768474827232504e-06}. Best is trial 309 with value: -3.5367054474640005.
[I 2026-07-17 15:59:41,692] Trial 316 finished with value: -2.613838191587358 and parameters: {'scalers': 'none', 'ratios': 'log_ratio', 'imputers': 'mean', 'n_estimators': 3000, 'learning_rate': 0.4874700420122602, 'max_depth': 10, 'min_child_weight': 1, 'subsample': 0.5, 'colsample_bytree': 1.0, 'colsample_bylevel': 1.0, 'reg_alpha': 0.0034936614964516783, 'reg_lambda': 28.255547799884713, 'gamma': 7.499955705774183e-06}. Best is trial 309 with value: -3.5367054474640005.
[I 2026-07-17 16:01:33,728] Trial 317 finished with value: -0.9308344741890572 and parameters: {'scalers': 'none', 'ratios': 'log_ratio', 'imputers': 'mean', 'n_estimators': 3000, 'learning_rate': 0.4887623637946183, 'max_depth': 10, 'min_child_weight': 1, 'subsample': 0.5, 'colsample_bytree': 1.0, 'colsample_bylevel': 1.0, 'reg_alpha': 0.0032140261766553527, 'reg_lambda': 13.641875741520995, 'gamma': 7.159236689328937e-06}. Best is trial 309 with value: -3.5367054474640005.
[I 2026-07-17 16:03:26,466] Trial 318 finished with value: -2.718627023756246 and parameters: {'scalers': 'none', 'ratios': 'log_ratio', 'imputers': 'mean', 'n_estimators': 3000, 'learning_rate': 0.4843162341518787, 'max_depth': 10, 'min_child_weight': 1, 'subsample': 0.5, 'colsample_bytree': 1.0, 'colsample_bylevel': 1.0, 'reg_alpha': 0.003977232275205452, 'reg_lambda': 29.71145140252775, 'gamma': 7.783269370459615e-06}. Best is trial 309 with value: -3.5367054474640005.
[I 2026-07-17 16:05:10,446] Trial 319 finished with value: -2.3114955815248117 and parameters: {'scalers': 'none', 'ratios': 'log_ratio', 'imputers': 'mean', 'n_estimators': 3000, 'learning_rate': 0.4923744006756446, 'max_depth': 10, 'min_child_weight': 1, 'subsample': 0.5, 'colsample_bytree': 1.0, 'colsample_bylevel': 1.0, 'reg_alpha': 0.00292026110346168, 'reg_lambda': 25.97483819874199, 'gamma': 8.047189252053305e-06}. Best is trial 309 with value: -3.5367054474640005.
