[I 2026-07-17 14:34:45,435] Trial 135 finished with value: -0.23072626520742473 and parameters: {'scalers': 'robust', 'ratios': 'log_ratio', 'imputers': 'median', 'n_estimators': 3000, 'learning_rate': 0.40810337542777936, 'max_depth': 10, 'min_child_weight': 6, 'subsample': 0.5, 'colsample_bytree': 0.8, 'colsample_bylevel': 0.5, 'reg_alpha': 0.5702496864655968, 'reg_lambda': 0.005762150207584433, 'gamma': 1.002660904367619e-06}. Best is trial 93 with value: -0.2629369047366021.
[I 2026-07-17 14:35:05,640] Trial 136 finished with value: -0.21920403641756803 and parameters: {'scalers': 'robust', 'ratios': 'log_ratio', 'imputers': 'median', 'n_estimators': 3000, 'learning_rate': 0.40926832335799973, 'max_depth': 10, 'min_child_weight': 6, 'subsample': 0.5, 'colsample_bytree': 0.8, 'colsample_bylevel': 0.6, 'reg_alpha': 0.23306616497339983, 'reg_lambda': 7.905167401449551e-05, 'gamma': 2.6507483416914633e-06}. Best is trial 93 with value: -0.2629369047366021.
[I 2026-07-17 14:35:26,133] Trial 137 finished with value: -0.21755513715730207 and parameters: {'scalers': 'robust', 'ratios': 'log_ratio', 'imputers': 'median', 'n_estimators': 3000, 'learning_rate': 0.40287333074793824, 'max_depth': 10, 'min_child_weight': 6, 'subsample': 0.5, 'colsample_bytree': 0.8, 'colsample_bylevel': 0.6, 'reg_alpha': 0.2582671463960653, 'reg_lambda': 0.00879121590472029, 'gamma': 2.468316218502843e-06}. Best is trial 93 with value: -0.2629369047366021.
[I 2026-07-17 14:35:49,839] Trial 138 finished with value: -0.29453966331555204 and parameters: {'scalers': 'robust', 'ratios': 'log_ratio', 'imputers': 'median', 'n_estimators': 2750, 'learning_rate': 0.4178610732454113, 'max_depth': 11, 'min_child_weight': 3, 'subsample': 0.5, 'colsample_bytree': 0.8, 'colsample_bylevel': 0.6, 'reg_alpha': 0.2748761520187152, 'reg_lambda': 0.0006660542973306196, 'gamma': 2.462603562671372e-06}. Best is trial 138 with value: -0.29453966331555204.
[I 2026-07-17 14:36:11,859] Trial 139 finished with value: -0.2766807969907415 and parameters: {'scalers': 'robust', 'ratios': 'log_ratio', 'imputers': 'median', 'n_estimators': 2750, 'learning_rate': 0.4051768770023969, 'max_depth': 11, 'min_child_weight': 3, 'subsample': 0.5, 'colsample_bytree': 0.8, 'colsample_bylevel': 0.6, 'reg_alpha': 0.13723486050241698, 'reg_lambda': 0.000620530298959905, 'gamma': 2.484260248567709e-06}. Best is trial 138 with value: -0.29453966331555204.
[I 2026-07-17 14:36:34,586] Trial 140 finished with value: -0.32589248701683177 and parameters: {'scalers': 'robust', 'ratios': 'log_ratio', 'imputers': 'median', 'n_estimators': 2700, 'learning_rate': 0.38847609260599913, 'max_depth': 11, 'min_child_weight': 2, 'subsample': 0.5, 'colsample_bytree': 0.8, 'colsample_bylevel': 0.6, 'reg_alpha': 0.3059321306698098, 'reg_lambda': 0.0006707917160272655, 'gamma': 2.511779870531993e-06}. Best is trial 140 with value: -0.32589248701683177.
[I 2026-07-17 14:36:56,422] Trial 141 finished with value: -0.2237388700762887 and parameters: {'scalers': 'robust', 'ratios': 'log_ratio', 'imputers': 'median', 'n_estimators': 3000, 'learning_rate': 0.3951226210314866, 'max_depth': 11, 'min_child_weight': 6, 'subsample': 0.5, 'colsample_bytree': 0.8, 'colsample_bylevel': 0.6, 'reg_alpha': 0.2642034657751772, 'reg_lambda': 0.010460067386690525, 'gamma': 2.643378635943778e-06}. Best is trial 140 with value: -0.32589248701683177.
[I 2026-07-17 14:37:17,593] Trial 142 finished with value: -0.23959550478272534 and parameters: {'scalers': 'robust', 'ratios': 'log_ratio', 'imputers': 'mean', 'n_estimators': 2750, 'learning_rate': 0.40632108196050326, 'max_depth': 11, 'min_child_weight': 5, 'subsample': 0.5, 'colsample_bytree': 0.8, 'colsample_bylevel': 0.6, 'reg_alpha': 0.22580818805021374, 'reg_lambda': 0.011318164531597955, 'gamma': 2.573057214646873e-06}. Best is trial 140 with value: -0.32589248701683177.
[I 2026-07-17 14:37:37,805] Trial 143 finished with value: -0.22104863417194737 and parameters: {'scalers': 'robust', 'ratios': 'log_ratio', 'imputers': 'mean', 'n_estimators': 2750, 'learning_rate': 0.4173522552367088, 'max_depth': 11, 'min_child_weight': 6, 'subsample': 0.5, 'colsample_bytree': 0.8, 'colsample_bylevel': 0.6, 'reg_alpha': 0.18870620806652078, 'reg_lambda': 0.010182889538682504, 'gamma': 2.4710295170372355e-06}. Best is trial 140 with value: -0.32589248701683177.
[I 2026-07-17 14:37:55,706] Trial 144 finished with value: -0.2151900001761584 and parameters: {'scalers': 'robust', 'ratios': 'log_ratio', 'imputers': 'mean', 'n_estimators': 2700, 'learning_rate': 0.34473433075389837, 'max_depth': 11, 'min_child_weight': 6, 'subsample': 0.5, 'colsample_bytree': 0.8, 'colsample_bylevel': 0.5, 'reg_alpha': 0.3263695230931843, 'reg_lambda': 0.009809134659618648, 'gamma': 2.4551554520600453e-06}. Best is trial 140 with value: -0.32589248701683177.
[I 2026-07-17 14:38:14,591] Trial 145 finished with value: -0.22907628833723656 and parameters: {'scalers': 'robust', 'ratios': 'log_ratio', 'imputers': 'mean', 'n_estimators': 2750, 'learning_rate': 0.35037029186106444, 'max_depth': 11, 'min_child_weight': 5, 'subsample': 0.5, 'colsample_bytree': 0.8, 'colsample_bylevel': 0.5, 'reg_alpha': 0.13906685206961766, 'reg_lambda': 0.0006710845528410996, 'gamma': 2.5784570216328562e-06}. Best is trial 140 with value: -0.32589248701683177.
[I 2026-07-17 14:38:34,071] Trial 146 finished with value: -0.21178756311073269 and parameters: {'scalers': 'robust', 'ratios': 'log_ratio', 'imputers': 'mean', 'n_estimators': 2750, 'learning_rate': 0.35566413699895966, 'max_depth': 11, 'min_child_weight': 6, 'subsample': 0.5, 'colsample_bytree': 0.8, 'colsample_bylevel': 0.6, 'reg_alpha': 0.1440930390139236, 'reg_lambda': 0.05011989780231303, 'gamma': 1.0005697117959458e-06}. Best is trial 140 with value: -0.32589248701683177.
[I 2026-07-17 14:38:35,978] Trial 147 finished with value: -0.05561021977612045 and parameters: {'scalers': 'robust', 'ratios': 'log_ratio', 'imputers': 'mean', 'n_estimators': 2750, 'learning_rate': 0.3574243174790362, 'max_depth': 11, 'min_child_weight': 2, 'subsample': 0.5, 'colsample_bytree': 0.8, 'colsample_bylevel': 0.6, 'reg_alpha': 0.30871846917149637, 'reg_lambda': 0.0006663346402014416, 'gamma': 0.7634369718930315}. Best is trial 140 with value: -0.32589248701683177.
[I 2026-07-17 14:38:54,776] Trial 148 finished with value: -0.2714109856428568 and parameters: {'scalers': 'robust', 'ratios': 'log_ratio', 'imputers': 'mean', 'n_estimators': 2750, 'learning_rate': 0.34420969521467876, 'max_depth': 11, 'min_child_weight': 2, 'subsample': 0.5, 'colsample_bytree': 0.8, 'colsample_bylevel': 0.6, 'reg_alpha': 0.11312057609808115, 'reg_lambda': 0.0006763566154060722, 'gamma': 1.010320813947089e-06}. Best is trial 140 with value: -0.32589248701683177.
[I 2026-07-17 14:39:15,959] Trial 149 finished with value: -0.23597025559357956 and parameters: {'scalers': 'robust', 'ratios': 'log_ratio', 'imputers': 'median', 'n_estimators': 2750, 'learning_rate': 0.25964800742970034, 'max_depth': 11, 'min_child_weight': 3, 'subsample': 0.5, 'colsample_bytree': 0.8, 'colsample_bylevel': 0.6, 'reg_alpha': 0.1510073501151604, 'reg_lambda': 0.0006239269929313323, 'gamma': 1.0598185963484375e-06}. Best is trial 140 with value: -0.32589248701683177.
[I 2026-07-17 14:39:34,499] Trial 150 finished with value: -0.24741782066625775 and parameters: {'scalers': 'robust', 'ratios': 'log_ratio', 'imputers': 'mean', 'n_estimators': 2700, 'learning_rate': 0.25794855564586244, 'max_depth': 11, 'min_child_weight': 2, 'subsample': 0.5, 'colsample_bytree': 0.8, 'colsample_bylevel': 0.6, 'reg_alpha': 0.13220621283903605, 'reg_lambda': 0.0007000297599891823, 'gamma': 3.3702907780477455e-06}. Best is trial 140 with value: -0.32589248701683177.
[I 2026-07-17 14:39:53,469] Trial 151 finished with value: -0.2692063826799815 and parameters: {'scalers': 'robust', 'ratios': 'log_ratio', 'imputers': 'mean', 'n_estimators': 2700, 'learning_rate': 0.34375160690829526, 'max_depth': 11, 'min_child_weight': 2, 'subsample': 0.5, 'colsample_bytree': 0.8, 'colsample_bylevel': 0.6, 'reg_alpha': 0.11360774256336205, 'reg_lambda': 0.0004977363487784286, 'gamma': 3.218127811638165e-06}. Best is trial 140 with value: -0.32589248701683177.
[I 2026-07-17 14:40:11,621] Trial 152 finished with value: -0.24322964655891702 and parameters: {'scalers': 'robust', 'ratios': 'log_ratio', 'imputers': 'mean', 'n_estimators': 2750, 'learning_rate': 0.25253678406603614, 'max_depth': 11, 'min_child_weight': 2, 'subsample': 0.5, 'colsample_bytree': 0.8, 'colsample_bylevel': 0.6, 'reg_alpha': 0.08491526635782927, 'reg_lambda': 0.0006161706719230953, 'gamma': 3.930319561661321e-06}. Best is trial 140 with value: -0.32589248701683177.
[I 2026-07-17 14:40:30,490] Trial 153 finished with value: -0.24300634276284513 and parameters: {'scalers': 'robust', 'ratios': 'log_ratio', 'imputers': 'mean', 'n_estimators': 2750, 'learning_rate': 0.25105598878123975, 'max_depth': 11, 'min_child_weight': 2, 'subsample': 0.5, 'colsample_bytree': 0.8, 'colsample_bylevel': 0.6, 'reg_alpha': 0.12811609995437595, 'reg_lambda': 0.001011395675037993, 'gamma': 1.0086826934528983e-06}. Best is trial 140 with value: -0.32589248701683177.
[I 2026-07-17 14:40:47,414] Trial 154 finished with value: -0.22465534689206235 and parameters: {'scalers': 'robust', 'ratios': 'norm_ratio', 'imputers': 'mean', 'n_estimators': 2850, 'learning_rate': 0.2539688589651205, 'max_depth': 11, 'min_child_weight': 2, 'subsample': 0.5, 'colsample_bytree': 0.8, 'colsample_bylevel': 0.6, 'reg_alpha': 0.00022838793798525656, 'reg_lambda': 0.0005637150094577481, 'gamma': 4.058087702886599e-06}. Best is trial 140 with value: -0.32589248701683177.
[I 2026-07-17 14:41:03,205] Trial 155 finished with value: -0.22195897464149836 and parameters: {'scalers': 'robust', 'ratios': 'norm_ratio', 'imputers': 'median', 'n_estimators': 2600, 'learning_rate': 0.2577769150530697, 'max_depth': 11, 'min_child_weight': 2, 'subsample': 0.5, 'colsample_bytree': 0.8, 'colsample_bylevel': 0.6, 'reg_alpha': 0.0007109942012600178, 'reg_lambda': 0.0010537963018619736, 'gamma': 3.3381820318714214e-06}. Best is trial 140 with value: -0.32589248701683177.
[I 2026-07-17 14:41:20,769] Trial 156 finished with value: -0.2401010362815334 and parameters: {'scalers': 'robust', 'ratios': 'log_ratio', 'imputers': 'mean', 'n_estimators': 2600, 'learning_rate': 0.26270450742260015, 'max_depth': 11, 'min_child_weight': 2, 'subsample': 0.5, 'colsample_bytree': 0.8, 'colsample_bylevel': 0.6, 'reg_alpha': 0.08966259235055808, 'reg_lambda': 0.0010366902131623476, 'gamma': 3.580054092959257e-06}. Best is trial 140 with value: -0.32589248701683177.
[I 2026-07-17 14:41:38,046] Trial 157 finished with value: -0.2455961473927139 and parameters: {'scalers': 'robust', 'ratios': 'norm_ratio', 'imputers': 'mean', 'n_estimators': 2600, 'learning_rate': 0.26833705871720614, 'max_depth': 11, 'min_child_weight': 2, 'subsample': 0.5, 'colsample_bytree': 0.8, 'colsample_bylevel': 0.6, 'reg_alpha': 0.09623246550751696, 'reg_lambda': 0.0009716518796336415, 'gamma': 3.3837365855442487e-06}. Best is trial 140 with value: -0.32589248701683177.
[I 2026-07-17 14:41:55,487] Trial 158 finished with value: -0.23584519301981616 and parameters: {'scalers': 'robust', 'ratios': 'log_ratio', 'imputers': 'mean', 'n_estimators': 2600, 'learning_rate': 0.2505360587323886, 'max_depth': 11, 'min_child_weight': 2, 'subsample': 0.5, 'colsample_bytree': 0.8, 'colsample_bylevel': 0.6, 'reg_alpha': 0.09166641583822338, 'reg_lambda': 0.001231021319177219, 'gamma': 3.724286266402688e-06}. Best is trial 140 with value: -0.32589248701683177.
[I 2026-07-17 14:42:12,702] Trial 159 finished with value: -0.23741760645878526 and parameters: {'scalers': 'robust', 'ratios': 'norm_ratio', 'imputers': 'mean', 'n_estimators': 2600, 'learning_rate': 0.254002555161114, 'max_depth': 11, 'min_child_weight': 2, 'subsample': 0.5, 'colsample_bytree': 0.8, 'colsample_bylevel': 0.6, 'reg_alpha': 0.0841484157372725, 'reg_lambda': 0.001230839019588606, 'gamma': 3.4545303767166155e-06}. Best is trial 140 with value: -0.32589248701683177.
[I 2026-07-17 14:42:30,537] Trial 160 finished with value: -0.24871505865616228 and parameters: {'scalers': 'robust', 'ratios': 'norm_ratio', 'imputers': 'mean', 'n_estimators': 2650, 'learning_rate': 0.27724098749248405, 'max_depth': 11, 'min_child_weight': 2, 'subsample': 0.5, 'colsample_bytree': 0.8, 'colsample_bylevel': 0.6, 'reg_alpha': 0.1011199512381098, 'reg_lambda': 0.0011999529289858795, 'gamma': 3.484981578729455e-06}. Best is trial 140 with value: -0.32589248701683177.
[I 2026-07-17 14:42:47,604] Trial 161 finished with value: -0.24332604513674003 and parameters: {'scalers': 'robust', 'ratios': 'norm_ratio', 'imputers': 'mean', 'n_estimators': 2600, 'learning_rate': 0.2696656088897958, 'max_depth': 11, 'min_child_weight': 2, 'subsample': 0.5, 'colsample_bytree': 0.8, 'colsample_bylevel': 0.6, 'reg_alpha': 0.08844677441909156, 'reg_lambda': 0.0011070112842924834, 'gamma': 3.6358102596980835e-06}. Best is trial 140 with value: -0.32589248701683177.
[I 2026-07-17 14:43:02,759] Trial 162 finished with value: -0.2589181726370711 and parameters: {'scalers': 'robust', 'ratios': 'log_ratio', 'imputers': 'mean', 'n_estimators': 2600, 'learning_rate': 0.2652105631791622, 'max_depth': 11, 'min_child_weight': 1, 'subsample': 0.5, 'colsample_bytree': 0.8, 'colsample_bylevel': 0.6, 'reg_alpha': 0.06761597059703785, 'reg_lambda': 0.001169122723030117, 'gamma': 7.469693987390561e-06}. Best is trial 140 with value: -0.32589248701683177.
[I 2026-07-17 14:43:18,208] Trial 163 finished with value: -0.33885235166809097 and parameters: {'scalers': 'robust', 'ratios': 'log_ratio', 'imputers': 'mean', 'n_estimators': 2600, 'learning_rate': 0.44224717631912225, 'max_depth': 11, 'min_child_weight': 1, 'subsample': 0.5, 'colsample_bytree': 0.8, 'colsample_bylevel': 0.6, 'reg_alpha': 0.07020824134392763, 'reg_lambda': 0.00038082932846538495, 'gamma': 7.134061193225924e-06}. Best is trial 163 with value: -0.33885235166809097.
[I 2026-07-17 14:43:34,026] Trial 164 finished with value: -0.27080931596353036 and parameters: {'scalers': 'robust', 'ratios': 'log_ratio', 'imputers': 'mean', 'n_estimators': 2600, 'learning_rate': 0.26903117050167374, 'max_depth': 11, 'min_child_weight': 1, 'subsample': 0.5, 'colsample_bytree': 0.8, 'colsample_bylevel': 0.6, 'reg_alpha': 0.1104614517891442, 'reg_lambda': 0.0012398828092907309, 'gamma': 8.376871285214938e-06}. Best is trial 163 with value: -0.33885235166809097.
[I 2026-07-17 14:43:49,029] Trial 165 finished with value: -0.25250738335720263 and parameters: {'scalers': 'robust', 'ratios': 'norm_ratio', 'imputers': 'mean', 'n_estimators': 2600, 'learning_rate': 0.2650853919756592, 'max_depth': 11, 'min_child_weight': 1, 'subsample': 0.5, 'colsample_bytree': 0.8, 'colsample_bylevel': 0.6, 'reg_alpha': 0.07716668174813837, 'reg_lambda': 0.0011088271698090984, 'gamma': 7.3456097248653404e-06}. Best is trial 163 with value: -0.33885235166809097.
[I 2026-07-17 14:44:05,316] Trial 166 finished with value: -0.2785351065440933 and parameters: {'scalers': 'robust', 'ratios': 'norm_ratio', 'imputers': 'mean', 'n_estimators': 2700, 'learning_rate': 0.2819681875803028, 'max_depth': 11, 'min_child_weight': 1, 'subsample': 0.5, 'colsample_bytree': 0.8, 'colsample_bylevel': 0.6, 'reg_alpha': 0.08540517896127171, 'reg_lambda': 0.0009415333907063567, 'gamma': 8.187123714444098e-06}. Best is trial 163 with value: -0.33885235166809097.
[I 2026-07-17 14:44:21,078] Trial 167 finished with value: -0.2560181786584831 and parameters: {'scalers': 'robust', 'ratios': 'norm_ratio', 'imputers': 'mean', 'n_estimators': 2700, 'learning_rate': 0.2768680885623541, 'max_depth': 11, 'min_child_weight': 1, 'subsample': 0.5, 'colsample_bytree': 0.8, 'colsample_bylevel': 0.6, 'reg_alpha': 0.07338073738449825, 'reg_lambda': 0.00035847918388450304, 'gamma': 6.918068158087263e-06}. Best is trial 163 with value: -0.33885235166809097.
[I 2026-07-17 14:44:36,727] Trial 168 finished with value: -0.26146073391805025 and parameters: {'scalers': 'robust', 'ratios': 'norm_ratio', 'imputers': 'mean', 'n_estimators': 2700, 'learning_rate': 0.28132697210838026, 'max_depth': 11, 'min_child_weight': 1, 'subsample': 0.5, 'colsample_bytree': 0.8, 'colsample_bylevel': 0.6, 'reg_alpha': 0.061221097676832065, 'reg_lambda': 0.0004313970172595868, 'gamma': 6.0363161249195065e-06}. Best is trial 163 with value: -0.33885235166809097.
[I 2026-07-17 14:44:52,644] Trial 169 finished with value: -0.2572933028707766 and parameters: {'scalers': 'robust', 'ratios': 'norm_ratio', 'imputers': 'mean', 'n_estimators': 2700, 'learning_rate': 0.2764521215264947, 'max_depth': 11, 'min_child_weight': 1, 'subsample': 0.5, 'colsample_bytree': 0.8, 'colsample_bylevel': 0.6, 'reg_alpha': 0.07171762754683599, 'reg_lambda': 0.00038465698530977413, 'gamma': 6.871171567129173e-06}. Best is trial 163 with value: -0.33885235166809097.
[I 2026-07-17 14:45:07,395] Trial 170 finished with value: -0.2616326710557573 and parameters: {'scalers': 'robust', 'ratios': 'norm_ratio', 'imputers': 'mean', 'n_estimators': 2550, 'learning_rate': 0.2802181402770078, 'max_depth': 11, 'min_child_weight': 1, 'subsample': 0.5, 'colsample_bytree': 0.8, 'colsample_bylevel': 0.6, 'reg_alpha': 0.06876837068985518, 'reg_lambda': 0.00038207431247284083, 'gamma': 7.494643735422509e-06}. Best is trial 163 with value: -0.33885235166809097.
[I 2026-07-17 14:45:21,506] Trial 171 finished with value: -0.22650309792543508 and parameters: {'scalers': 'robust', 'ratios': 'norm_ratio', 'imputers': 'mean', 'n_estimators': 2400, 'learning_rate': 0.20961881560266207, 'max_depth': 11, 'min_child_weight': 1, 'subsample': 0.5, 'colsample_bytree': 0.8, 'colsample_bylevel': 0.6, 'reg_alpha': 0.07050104539156186, 'reg_lambda': 0.0004242657211588748, 'gamma': 5.652179431660748e-06}. Best is trial 163 with value: -0.33885235166809097.
[I 2026-07-17 14:45:37,166] Trial 172 finished with value: -0.2322250899960158 and parameters: {'scalers': 'robust', 'ratios': 'norm_ratio', 'imputers': 'mean', 'n_estimators': 2650, 'learning_rate': 0.216898774339294, 'max_depth': 11, 'min_child_weight': 1, 'subsample': 0.5, 'colsample_bytree': 0.8, 'colsample_bylevel': 0.6, 'reg_alpha': 0.06899895536810105, 'reg_lambda': 0.00040563950763894597, 'gamma': 7.069199839882551e-06}. Best is trial 163 with value: -0.33885235166809097.
[I 2026-07-17 14:45:52,234] Trial 173 finished with value: -0.225725232242037 and parameters: {'scalers': 'robust', 'ratios': 'norm_ratio', 'imputers': 'mean', 'n_estimators': 2550, 'learning_rate': 0.21923476544044698, 'max_depth': 11, 'min_child_weight': 1, 'subsample': 0.5, 'colsample_bytree': 0.8, 'colsample_bylevel': 0.6, 'reg_alpha': 0.07025275208146092, 'reg_lambda': 0.0004072303198169729, 'gamma': 6.718283617521554e-06}. Best is trial 163 with value: -0.33885235166809097.
[I 2026-07-17 14:46:07,238] Trial 174 finished with value: -0.25950694393213436 and parameters: {'scalers': 'robust', 'ratios': 'norm_ratio', 'imputers': 'mean', 'n_estimators': 2550, 'learning_rate': 0.28979583248999913, 'max_depth': 11, 'min_child_weight': 1, 'subsample': 0.5, 'colsample_bytree': 0.8, 'colsample_bylevel': 0.6, 'reg_alpha': 0.06374426601644438, 'reg_lambda': 0.00039090276987657763, 'gamma': 6.529120845903827e-06}. Best is trial 163 with value: -0.33885235166809097.
[I 2026-07-17 14:46:21,152] Trial 175 finished with value: -0.21911422137424452 and parameters: {'scalers': 'robust', 'ratios': 'norm_ratio', 'imputers': 'mean', 'n_estimators': 2400, 'learning_rate': 0.21135730299624028, 'max_depth': 11, 'min_child_weight': 1, 'subsample': 0.5, 'colsample_bytree': 0.8, 'colsample_bylevel': 0.6, 'reg_alpha': 0.059092772008943896, 'reg_lambda': 0.0003642833734159411, 'gamma': 7.680054397107603e-06}. Best is trial 163 with value: -0.33885235166809097.
[I 2026-07-17 14:46:35,971] Trial 176 finished with value: -0.21331584527186975 and parameters: {'scalers': 'robust', 'ratios': 'norm_ratio', 'imputers': 'mean', 'n_estimators': 2550, 'learning_rate': 0.20110708363549448, 'max_depth': 11, 'min_child_weight': 1, 'subsample': 0.5, 'colsample_bytree': 0.8, 'colsample_bylevel': 0.6, 'reg_alpha': 0.05895127000385407, 'reg_lambda': 0.0004671809780772258, 'gamma': 7.942475324013869e-06}. Best is trial 163 with value: -0.33885235166809097.
[I 2026-07-17 14:46:51,615] Trial 177 finished with value: -0.22553904615398274 and parameters: {'scalers': 'robust', 'ratios': 'norm_ratio', 'imputers': 'mean', 'n_estimators': 2700, 'learning_rate': 0.19749350888049058, 'max_depth': 11, 'min_child_weight': 1, 'subsample': 0.5, 'colsample_bytree': 0.8, 'colsample_bylevel': 0.6, 'reg_alpha': 0.06262643742097133, 'reg_lambda': 0.00033763274459296393, 'gamma': 7.325389918644019e-06}. Best is trial 163 with value: -0.33885235166809097.
[I 2026-07-17 14:47:06,440] Trial 178 finished with value: -0.22674256567973572 and parameters: {'scalers': 'robust', 'ratios': 'norm_ratio', 'imputers': 'mean', 'n_estimators': 2550, 'learning_rate': 0.2104104980576753, 'max_depth': 11, 'min_child_weight': 1, 'subsample': 0.5, 'colsample_bytree': 0.8, 'colsample_bylevel': 0.6, 'reg_alpha': 0.057903744569628, 'reg_lambda': 0.00039955159308700024, 'gamma': 7.931897542690367e-06}. Best is trial 163 with value: -0.33885235166809097.
[I 2026-07-17 14:47:22,399] Trial 179 finished with value: -0.2672413576228428 and parameters: {'scalers': 'robust', 'ratios': 'norm_ratio', 'imputers': 'mean', 'n_estimators': 2700, 'learning_rate': 0.3088707278852653, 'max_depth': 11, 'min_child_weight': 1, 'subsample': 0.5, 'colsample_bytree': 0.8, 'colsample_bylevel': 0.6, 'reg_alpha': 0.05704207323023887, 'reg_lambda': 0.0004541475913755923, 'gamma': 7.87300419592343e-06}. Best is trial 163 with value: -0.33885235166809097.
