[I 2026-07-17 11:36:32,268] Trial 135 finished with value: -0.23919162755228196 and parameters: {'scalers': 'standard', 'ratios': 'log_ratio', 'imputers': 'median', 'n_estimators': 800, 'learning_rate': 0.4661930397678866, 'max_depth': 8, 'min_child_weight': 9, 'subsample': 0.6, 'colsample_bytree': 1.0, 'colsample_bylevel': 1.0, 'reg_alpha': 0.30277973036159267, 'reg_lambda': 6.332348306668725e-05, 'gamma': 2.6114691439693256e-05}. Best is trial 109 with value: -0.25772743304709433.
[I 2026-07-17 11:36:47,533] Trial 136 finished with value: -0.20836683782330992 and parameters: {'scalers': 'standard', 'ratios': 'log_ratio', 'imputers': 'median', 'n_estimators': 750, 'learning_rate': 0.24002999406229752, 'max_depth': 11, 'min_child_weight': 9, 'subsample': 0.7, 'colsample_bytree': 1.0, 'colsample_bylevel': 1.0, 'reg_alpha': 0.273530304341864, 'reg_lambda': 1.0749360232617485e-05, 'gamma': 2.172423665175329e-05}. Best is trial 109 with value: -0.25772743304709433.
[I 2026-07-17 11:37:01,346] Trial 137 finished with value: -0.19653011192676154 and parameters: {'scalers': 'standard', 'ratios': 'log_ratio', 'imputers': 'median', 'n_estimators': 1050, 'learning_rate': 0.2381227260455997, 'max_depth': 11, 'min_child_weight': 9, 'subsample': 0.6, 'colsample_bytree': 1.0, 'colsample_bylevel': 1.0, 'reg_alpha': 6.194917439782229, 'reg_lambda': 8.418025059362034e-06, 'gamma': 6.284768848101141e-06}. Best is trial 109 with value: -0.25772743304709433.
[I 2026-07-17 11:37:14,792] Trial 138 finished with value: -0.24126831212170954 and parameters: {'scalers': 'standard', 'ratios': 'log_ratio', 'imputers': 'median', 'n_estimators': 750, 'learning_rate': 0.4997401036734311, 'max_depth': 11, 'min_child_weight': 9, 'subsample': 0.6, 'colsample_bytree': 1.0, 'colsample_bylevel': 1.0, 'reg_alpha': 2.924150090661331, 'reg_lambda': 1.2042519788888017e-05, 'gamma': 9.656573600154649e-06}. Best is trial 109 with value: -0.25772743304709433.
[I 2026-07-17 11:37:58,168] Trial 139 finished with value: -0.24935912319796433 and parameters: {'scalers': 'standard', 'ratios': 'log_ratio', 'imputers': 'median', 'n_estimators': 2050, 'learning_rate': 0.43808526829133915, 'max_depth': 11, 'min_child_weight': 9, 'subsample': 0.7, 'colsample_bytree': 1.0, 'colsample_bylevel': 1.0, 'reg_alpha': 0.2760129400714063, 'reg_lambda': 8.066797672770113e-06, 'gamma': 7.953094457592704e-06}. Best is trial 109 with value: -0.25772743304709433.
[I 2026-07-17 11:38:17,155] Trial 140 finished with value: -0.2373589192015971 and parameters: {'scalers': 'standard', 'ratios': 'log_ratio', 'imputers': 'median', 'n_estimators': 1050, 'learning_rate': 0.41229886769538143, 'max_depth': 11, 'min_child_weight': 9, 'subsample': 0.6, 'colsample_bytree': 1.0, 'colsample_bylevel': 1.0, 'reg_alpha': 2.5804130612266882, 'reg_lambda': 8.565447300673614e-06, 'gamma': 7.422335947165479e-06}. Best is trial 109 with value: -0.25772743304709433.
[I 2026-07-17 11:38:29,935] Trial 141 finished with value: -0.23706207197373091 and parameters: {'scalers': 'standard', 'ratios': 'log_ratio', 'imputers': 'median', 'n_estimators': 750, 'learning_rate': 0.43389358349163876, 'max_depth': 11, 'min_child_weight': 9, 'subsample': 0.6, 'colsample_bytree': 0.9, 'colsample_bylevel': 1.0, 'reg_alpha': 2.358299021381232, 'reg_lambda': 8.077654268155067e-06, 'gamma': 8.604256047827032e-06}. Best is trial 109 with value: -0.25772743304709433.
[I 2026-07-17 11:38:46,290] Trial 142 finished with value: -0.24408163528229992 and parameters: {'scalers': 'standard', 'ratios': 'log_ratio', 'imputers': 'median', 'n_estimators': 1000, 'learning_rate': 0.424239510449643, 'max_depth': 11, 'min_child_weight': 9, 'subsample': 0.5, 'colsample_bytree': 1.0, 'colsample_bylevel': 1.0, 'reg_alpha': 2.489221403982722, 'reg_lambda': 8.346216020108573e-06, 'gamma': 8.868219292555701e-06}. Best is trial 109 with value: -0.25772743304709433.
[I 2026-07-17 11:39:28,222] Trial 143 finished with value: -0.2639568442850089 and parameters: {'scalers': 'standard', 'ratios': 'log_ratio', 'imputers': 'median', 'n_estimators': 2650, 'learning_rate': 0.4333732983169118, 'max_depth': 11, 'min_child_weight': 9, 'subsample': 0.5, 'colsample_bytree': 1.0, 'colsample_bylevel': 1.0, 'reg_alpha': 2.6379149816787826, 'reg_lambda': 9.509671601888059e-06, 'gamma': 8.752408039621268e-06}. Best is trial 143 with value: -0.2639568442850089.
[I 2026-07-17 11:39:39,599] Trial 144 finished with value: -0.24142087498554735 and parameters: {'scalers': 'standard', 'ratios': 'log_ratio', 'imputers': 'median', 'n_estimators': 1000, 'learning_rate': 0.4154709048558137, 'max_depth': 8, 'min_child_weight': 9, 'subsample': 0.5, 'colsample_bytree': 0.9, 'colsample_bylevel': 1.0, 'reg_alpha': 2.4992896209644235, 'reg_lambda': 8.204940349509473e-06, 'gamma': 8.937716975819016e-06}. Best is trial 143 with value: -0.2639568442850089.
[I 2026-07-17 11:39:51,637] Trial 145 finished with value: -0.24577655600953896 and parameters: {'scalers': 'standard', 'ratios': 'log_ratio', 'imputers': 'median', 'n_estimators': 1000, 'learning_rate': 0.41181150609183015, 'max_depth': 8, 'min_child_weight': 9, 'subsample': 0.5, 'colsample_bytree': 0.9, 'colsample_bylevel': 1.0, 'reg_alpha': 2.2322963344087072, 'reg_lambda': 1.3265236381703098, 'gamma': 1.3051631106884527e-05}. Best is trial 143 with value: -0.2639568442850089.
[I 2026-07-17 11:40:03,869] Trial 146 finished with value: -0.24844059266441368 and parameters: {'scalers': 'standard', 'ratios': 'log_ratio', 'imputers': 'median', 'n_estimators': 1000, 'learning_rate': 0.43928784321350195, 'max_depth': 8, 'min_child_weight': 9, 'subsample': 0.5, 'colsample_bytree': 0.9, 'colsample_bylevel': 1.0, 'reg_alpha': 2.095757738882722, 'reg_lambda': 7.708348135762949e-06, 'gamma': 1.1489142612183088e-05}. Best is trial 143 with value: -0.2639568442850089.
[I 2026-07-17 11:40:50,035] Trial 147 finished with value: -0.2659086079533609 and parameters: {'scalers': 'standard', 'ratios': 'log_ratio', 'imputers': 'median', 'n_estimators': 2500, 'learning_rate': 0.4004232996772636, 'max_depth': 12, 'min_child_weight': 9, 'subsample': 0.5, 'colsample_bytree': 1.0, 'colsample_bylevel': 1.0, 'reg_alpha': 0.4369376117952534, 'reg_lambda': 2.7987651798285875e-05, 'gamma': 1.1548474603089178e-05}. Best is trial 147 with value: -0.2659086079533609.
[I 2026-07-17 11:41:17,538] Trial 148 finished with value: -0.2604229527030481 and parameters: {'scalers': 'standard', 'ratios': 'log_ratio', 'imputers': 'median', 'n_estimators': 2150, 'learning_rate': 0.39586858598832286, 'max_depth': 8, 'min_child_weight': 9, 'subsample': 0.5, 'colsample_bytree': 0.9, 'colsample_bylevel': 1.0, 'reg_alpha': 1.4386703580640892, 'reg_lambda': 2.8317872372018292e-05, 'gamma': 1.8885539480475349e-06}. Best is trial 147 with value: -0.2659086079533609.
[I 2026-07-17 11:41:54,021] Trial 149 finished with value: -0.2683121720544776 and parameters: {'scalers': 'standard', 'ratios': 'log_ratio', 'imputers': 'median', 'n_estimators': 2100, 'learning_rate': 0.4049447302773549, 'max_depth': 12, 'min_child_weight': 9, 'subsample': 0.5, 'colsample_bytree': 0.9, 'colsample_bylevel': 1.0, 'reg_alpha': 0.5074520385159007, 'reg_lambda': 2.9064096870434622e-05, 'gamma': 1.513616544901818e-05}. Best is trial 149 with value: -0.2683121720544776.
[I 2026-07-17 11:43:16,317] Trial 150 finished with value: -0.3503640640126008 and parameters: {'scalers': 'standard', 'ratios': 'log_ratio', 'imputers': 'median', 'n_estimators': 2700, 'learning_rate': 0.3908844073680668, 'max_depth': 12, 'min_child_weight': 3, 'subsample': 0.5, 'colsample_bytree': 1.0, 'colsample_bylevel': 1.0, 'reg_alpha': 1.392844556243641, 'reg_lambda': 2.087363931240336e-06, 'gamma': 1.7902174660352074e-06}. Best is trial 150 with value: -0.3503640640126008.
[I 2026-07-17 11:43:35,358] Trial 151 finished with value: -0.24859713426206773 and parameters: {'scalers': 'standard', 'ratios': 'log_ratio', 'imputers': 'median', 'n_estimators': 1000, 'learning_rate': 0.39578852521148356, 'max_depth': 12, 'min_child_weight': 9, 'subsample': 0.5, 'colsample_bytree': 1.0, 'colsample_bylevel': 1.0, 'reg_alpha': 0.49840920293013524, 'reg_lambda': 1.1337587129880636e-05, 'gamma': 1.254123903841403e-05}. Best is trial 150 with value: -0.3503640640126008.
[I 2026-07-17 11:44:19,913] Trial 152 finished with value: -0.2608567663023587 and parameters: {'scalers': 'standard', 'ratios': 'log_ratio', 'imputers': 'median', 'n_estimators': 2550, 'learning_rate': 0.38740406449219095, 'max_depth': 11, 'min_child_weight': 9, 'subsample': 0.5, 'colsample_bytree': 1.0, 'colsample_bylevel': 1.0, 'reg_alpha': 1.396200221018811, 'reg_lambda': 3.0272902689817894e-05, 'gamma': 1.7976641925396636e-06}. Best is trial 150 with value: -0.3503640640126008.
[I 2026-07-17 11:45:09,197] Trial 153 finished with value: -0.26461047692306117 and parameters: {'scalers': 'standard', 'ratios': 'log_ratio', 'imputers': 'median', 'n_estimators': 2600, 'learning_rate': 0.37533668992509034, 'max_depth': 12, 'min_child_weight': 9, 'subsample': 0.5, 'colsample_bytree': 1.0, 'colsample_bylevel': 1.0, 'reg_alpha': 0.4648639567098833, 'reg_lambda': 4.203872366578347, 'gamma': 1.195075920083462e-05}. Best is trial 150 with value: -0.3503640640126008.
[I 2026-07-17 11:46:28,049] Trial 154 finished with value: -0.3161793765558552 and parameters: {'scalers': 'standard', 'ratios': 'log_ratio', 'imputers': 'none', 'n_estimators': 2500, 'learning_rate': 0.2738471678026153, 'max_depth': 12, 'min_child_weight': 3, 'subsample': 0.5, 'colsample_bytree': 1.0, 'colsample_bylevel': 1.0, 'reg_alpha': 0.48615193017338326, 'reg_lambda': 0.5297281996713497, 'gamma': 2.333116356509438e-06}. Best is trial 150 with value: -0.3503640640126008.
[I 2026-07-17 11:47:04,315] Trial 155 finished with value: -0.2565837948635611 and parameters: {'scalers': 'standard', 'ratios': 'log_ratio', 'imputers': 'median', 'n_estimators': 2700, 'learning_rate': 0.37749468725302976, 'max_depth': 8, 'min_child_weight': 9, 'subsample': 0.5, 'colsample_bytree': 1.0, 'colsample_bylevel': 1.0, 'reg_alpha': 0.4625849805663479, 'reg_lambda': 2.7355754442199687e-05, 'gamma': 1.3056795941674217e-05}. Best is trial 150 with value: -0.3503640640126008.
[I 2026-07-17 11:47:51,522] Trial 156 finished with value: -0.2618310684146853 and parameters: {'scalers': 'standard', 'ratios': 'log_ratio', 'imputers': 'median', 'n_estimators': 2650, 'learning_rate': 0.3744143731462568, 'max_depth': 12, 'min_child_weight': 9, 'subsample': 0.5, 'colsample_bytree': 1.0, 'colsample_bylevel': 1.0, 'reg_alpha': 1.468105544236326, 'reg_lambda': 0.3427354757755815, 'gamma': 2.13958346005954e-06}. Best is trial 150 with value: -0.3503640640126008.
[I 2026-07-17 11:48:40,923] Trial 157 finished with value: -0.2312742478548881 and parameters: {'scalers': 'standard', 'ratios': 'log_ratio', 'imputers': 'none', 'n_estimators': 2750, 'learning_rate': 0.1973100808127338, 'max_depth': 12, 'min_child_weight': 9, 'subsample': 0.5, 'colsample_bytree': 1.0, 'colsample_bylevel': 1.0, 'reg_alpha': 0.4644198272584803, 'reg_lambda': 3.179785877849154e-05, 'gamma': 2.142018877655749e-06}. Best is trial 150 with value: -0.3503640640126008.
[I 2026-07-17 11:50:02,881] Trial 158 finished with value: -0.31593038770477877 and parameters: {'scalers': 'standard', 'ratios': 'log_ratio', 'imputers': 'median', 'n_estimators': 2650, 'learning_rate': 0.2837097684336998, 'max_depth': 12, 'min_child_weight': 3, 'subsample': 0.5, 'colsample_bytree': 1.0, 'colsample_bylevel': 1.0, 'reg_alpha': 0.4559570878308844, 'reg_lambda': 3.1383380020262384e-05, 'gamma': 1.889490605562858e-06}. Best is trial 150 with value: -0.3503640640126008.
[I 2026-07-17 11:51:24,022] Trial 159 finished with value: -0.3148289528420187 and parameters: {'scalers': 'standard', 'ratios': 'log_ratio', 'imputers': 'none', 'n_estimators': 2600, 'learning_rate': 0.2778395930298999, 'max_depth': 12, 'min_child_weight': 3, 'subsample': 0.5, 'colsample_bytree': 1.0, 'colsample_bylevel': 1.0, 'reg_alpha': 0.4981858715871012, 'reg_lambda': 2.4351479047762634e-05, 'gamma': 1.5805018403601652e-06}. Best is trial 150 with value: -0.3503640640126008.
[I 2026-07-17 11:52:35,460] Trial 160 finished with value: -0.2952445020606695 and parameters: {'scalers': 'standard', 'ratios': 'log_ratio', 'imputers': 'median', 'n_estimators': 2650, 'learning_rate': 0.2713965349292647, 'max_depth': 12, 'min_child_weight': 4, 'subsample': 0.5, 'colsample_bytree': 1.0, 'colsample_bylevel': 1.0, 'reg_alpha': 0.47944534484402107, 'reg_lambda': 3.2588979765412736e-05, 'gamma': 1.9271440089909215e-06}. Best is trial 150 with value: -0.3503640640126008.
[I 2026-07-17 11:53:23,314] Trial 161 finished with value: -0.23087821077491225 and parameters: {'scalers': 'standard', 'ratios': 'log_ratio', 'imputers': 'none', 'n_estimators': 2650, 'learning_rate': 0.19837892258817094, 'max_depth': 12, 'min_child_weight': 9, 'subsample': 0.5, 'colsample_bytree': 1.0, 'colsample_bylevel': 1.0, 'reg_alpha': 0.4157340175961004, 'reg_lambda': 0.014556939017928318, 'gamma': 2.0594502746850758e-06}. Best is trial 150 with value: -0.3503640640126008.
[I 2026-07-17 11:54:10,926] Trial 162 finished with value: -0.23058412143791945 and parameters: {'scalers': 'standard', 'ratios': 'log_ratio', 'imputers': 'none', 'n_estimators': 2650, 'learning_rate': 0.1933631750098485, 'max_depth': 12, 'min_child_weight': 9, 'subsample': 0.5, 'colsample_bytree': 1.0, 'colsample_bylevel': 1.0, 'reg_alpha': 0.4856869313980794, 'reg_lambda': 0.03447864666665234, 'gamma': 1.9381056960866494e-06}. Best is trial 150 with value: -0.3503640640126008.
[I 2026-07-17 11:55:31,467] Trial 163 finished with value: -0.3216985685279987 and parameters: {'scalers': 'standard', 'ratios': 'log_ratio', 'imputers': 'none', 'n_estimators': 2650, 'learning_rate': 0.27699777419847227, 'max_depth': 12, 'min_child_weight': 3, 'subsample': 0.5, 'colsample_bytree': 1.0, 'colsample_bylevel': 1.0, 'reg_alpha': 0.5076894682828722, 'reg_lambda': 5.1214738090803325, 'gamma': 2.0812168489861105e-06}. Best is trial 150 with value: -0.3503640640126008.
[I 2026-07-17 11:56:49,026] Trial 164 finished with value: -0.3232309957248667 and parameters: {'scalers': 'standard', 'ratios': 'log_ratio', 'imputers': 'none', 'n_estimators': 2700, 'learning_rate': 0.2679285570506725, 'max_depth': 12, 'min_child_weight': 3, 'subsample': 0.5, 'colsample_bytree': 1.0, 'colsample_bylevel': 1.0, 'reg_alpha': 0.4252483497192839, 'reg_lambda': 14.55208695123189, 'gamma': 1.8553807624373955e-06}. Best is trial 150 with value: -0.3503640640126008.
[I 2026-07-17 11:58:03,846] Trial 165 finished with value: -0.3211669513067819 and parameters: {'scalers': 'standard', 'ratios': 'log_ratio', 'imputers': 'median', 'n_estimators': 2550, 'learning_rate': 0.2909845353379819, 'max_depth': 12, 'min_child_weight': 3, 'subsample': 0.5, 'colsample_bytree': 1.0, 'colsample_bylevel': 1.0, 'reg_alpha': 1.483849979030021, 'reg_lambda': 0.2618042399583597, 'gamma': 1.5053582119463723e-06}. Best is trial 150 with value: -0.3503640640126008.
[I 2026-07-17 11:59:24,085] Trial 166 finished with value: -0.3179055223399828 and parameters: {'scalers': 'standard', 'ratios': 'log_ratio', 'imputers': 'none', 'n_estimators': 2600, 'learning_rate': 0.27706189229817035, 'max_depth': 12, 'min_child_weight': 3, 'subsample': 0.5, 'colsample_bytree': 1.0, 'colsample_bylevel': 1.0, 'reg_alpha': 0.37097139051418654, 'reg_lambda': 0.21568304619760553, 'gamma': 1.657695471578588e-06}. Best is trial 150 with value: -0.3503640640126008.
[I 2026-07-17 12:00:38,079] Trial 167 finished with value: -0.31313671715704616 and parameters: {'scalers': 'standard', 'ratios': 'log_ratio', 'imputers': 'none', 'n_estimators': 2600, 'learning_rate': 0.2714272796203142, 'max_depth': 12, 'min_child_weight': 3, 'subsample': 0.5, 'colsample_bytree': 1.0, 'colsample_bylevel': 1.0, 'reg_alpha': 1.6062079861787062, 'reg_lambda': 0.06305367362482374, 'gamma': 1.7870238044505107e-06}. Best is trial 150 with value: -0.3503640640126008.
[I 2026-07-17 12:01:48,816] Trial 168 finished with value: -0.3256730216038794 and parameters: {'scalers': 'standard', 'ratios': 'log_ratio', 'imputers': 'none', 'n_estimators': 2600, 'learning_rate': 0.28403678108994346, 'max_depth': 12, 'min_child_weight': 3, 'subsample': 0.5, 'colsample_bytree': 1.0, 'colsample_bylevel': 1.0, 'reg_alpha': 1.489423001536935, 'reg_lambda': 10.987958915453431, 'gamma': 1.6258225505845948e-06}. Best is trial 150 with value: -0.3503640640126008.
[I 2026-07-17 12:02:56,220] Trial 169 finished with value: -0.3250364070673776 and parameters: {'scalers': 'standard', 'ratios': 'log_ratio', 'imputers': 'none', 'n_estimators': 2550, 'learning_rate': 0.2744675242684621, 'max_depth': 12, 'min_child_weight': 3, 'subsample': 0.5, 'colsample_bytree': 1.0, 'colsample_bylevel': 1.0, 'reg_alpha': 1.4635178472116728, 'reg_lambda': 21.29495330125575, 'gamma': 1.0409575507138347e-06}. Best is trial 150 with value: -0.3503640640126008.
[I 2026-07-17 12:04:09,507] Trial 170 finished with value: -0.31398997890615193 and parameters: {'scalers': 'standard', 'ratios': 'log_ratio', 'imputers': 'none', 'n_estimators': 2500, 'learning_rate': 0.2700343879847653, 'max_depth': 12, 'min_child_weight': 3, 'subsample': 0.5, 'colsample_bytree': 1.0, 'colsample_bylevel': 1.0, 'reg_alpha': 1.3890181002809938, 'reg_lambda': 0.28949977883792044, 'gamma': 1.2032575525402676e-06}. Best is trial 150 with value: -0.3503640640126008.
[I 2026-07-17 12:05:18,409] Trial 171 finished with value: -0.3124197557418933 and parameters: {'scalers': 'standard', 'ratios': 'log_ratio', 'imputers': 'none', 'n_estimators': 2500, 'learning_rate': 0.27009147277113266, 'max_depth': 12, 'min_child_weight': 3, 'subsample': 0.5, 'colsample_bytree': 1.0, 'colsample_bylevel': 1.0, 'reg_alpha': 1.3387954882171578, 'reg_lambda': 9.188250623346375, 'gamma': 1.2300450547564591e-06}. Best is trial 150 with value: -0.3503640640126008.
[I 2026-07-17 12:06:27,715] Trial 172 finished with value: -0.3085057648555882 and parameters: {'scalers': 'standard', 'ratios': 'log_ratio', 'imputers': 'none', 'n_estimators': 2500, 'learning_rate': 0.2575091954228334, 'max_depth': 12, 'min_child_weight': 3, 'subsample': 0.5, 'colsample_bytree': 1.0, 'colsample_bylevel': 1.0, 'reg_alpha': 1.458653846019616, 'reg_lambda': 4.924520048660353, 'gamma': 1.0301516530012176e-06}. Best is trial 150 with value: -0.3503640640126008.
[I 2026-07-17 12:07:32,861] Trial 173 finished with value: -0.3264746492447535 and parameters: {'scalers': 'standard', 'ratios': 'log_ratio', 'imputers': 'none', 'n_estimators': 2450, 'learning_rate': 0.27282097393260074, 'max_depth': 12, 'min_child_weight': 3, 'subsample': 0.5, 'colsample_bytree': 1.0, 'colsample_bylevel': 1.0, 'reg_alpha': 1.484029988632655, 'reg_lambda': 16.0183377161608, 'gamma': 1.0037826628301681e-06}. Best is trial 150 with value: -0.3503640640126008.
[I 2026-07-17 12:08:38,223] Trial 174 finished with value: -0.3146547708620096 and parameters: {'scalers': 'standard', 'ratios': 'log_ratio', 'imputers': 'none', 'n_estimators': 2500, 'learning_rate': 0.2703168341550375, 'max_depth': 12, 'min_child_weight': 3, 'subsample': 0.5, 'colsample_bytree': 1.0, 'colsample_bylevel': 1.0, 'reg_alpha': 1.6087386339171539, 'reg_lambda': 14.057769462162069, 'gamma': 1.258320312772153e-06}. Best is trial 150 with value: -0.3503640640126008.
[I 2026-07-17 12:09:41,916] Trial 175 finished with value: -0.32556083477942915 and parameters: {'scalers': 'standard', 'ratios': 'log_ratio', 'imputers': 'none', 'n_estimators': 2450, 'learning_rate': 0.288474855875696, 'max_depth': 12, 'min_child_weight': 3, 'subsample': 0.5, 'colsample_bytree': 1.0, 'colsample_bylevel': 1.0, 'reg_alpha': 1.7190838829874056, 'reg_lambda': 17.318460193419494, 'gamma': 1.0930753663242124e-06}. Best is trial 150 with value: -0.3503640640126008.
[I 2026-07-17 12:10:49,686] Trial 176 finished with value: -0.32183305791820604 and parameters: {'scalers': 'standard', 'ratios': 'log_ratio', 'imputers': 'none', 'n_estimators': 2500, 'learning_rate': 0.2730698940070584, 'max_depth': 12, 'min_child_weight': 3, 'subsample': 0.5, 'colsample_bytree': 1.0, 'colsample_bylevel': 1.0, 'reg_alpha': 1.472544787323673, 'reg_lambda': 11.018823300620163, 'gamma': 1.082841342939946e-06}. Best is trial 150 with value: -0.3503640640126008.
[I 2026-07-17 12:11:55,499] Trial 177 finished with value: -0.31989131595239745 and parameters: {'scalers': 'standard', 'ratios': 'log_ratio', 'imputers': 'none', 'n_estimators': 2500, 'learning_rate': 0.2695105398556042, 'max_depth': 12, 'min_child_weight': 3, 'subsample': 0.5, 'colsample_bytree': 1.0, 'colsample_bylevel': 1.0, 'reg_alpha': 1.5159263775747225, 'reg_lambda': 14.531618678445524, 'gamma': 1.086984221914936e-06}. Best is trial 150 with value: -0.3503640640126008.
[I 2026-07-17 12:12:59,146] Trial 178 finished with value: -0.31192089633483455 and parameters: {'scalers': 'standard', 'ratios': 'log_ratio', 'imputers': 'none', 'n_estimators': 2500, 'learning_rate': 0.2583902627107463, 'max_depth': 12, 'min_child_weight': 3, 'subsample': 0.5, 'colsample_bytree': 1.0, 'colsample_bylevel': 1.0, 'reg_alpha': 1.6985595775162672, 'reg_lambda': 21.68073346943349, 'gamma': 1.0177903373908716e-06}. Best is trial 150 with value: -0.3503640640126008.
[I 2026-07-17 12:14:09,405] Trial 179 finished with value: -0.3192794408030201 and parameters: {'scalers': 'standard', 'ratios': 'log_ratio', 'imputers': 'none', 'n_estimators': 2500, 'learning_rate': 0.2673930485726463, 'max_depth': 12, 'min_child_weight': 3, 'subsample': 0.5, 'colsample_bytree': 1.0, 'colsample_bylevel': 1.0, 'reg_alpha': 0.37007192984115794, 'reg_lambda': 23.402808344946255, 'gamma': 1.0548997559716458e-06}. Best is trial 150 with value: -0.3503640640126008.
