[I 2026-07-17 12:45:53,475] Trial 90 finished with value: -2.167818593628913 and parameters: {'scalers': 'none', 'ratios': 'norm_ratio', 'imputers': 'none', 'n_estimators': 2900, 'learning_rate': 0.48382485224155614, 'max_depth': 9, 'min_child_weight': 1, 'subsample': 0.5, 'colsample_bytree': 0.7, 'colsample_bylevel': 0.6, 'reg_alpha': 1.1138126205962115e-06, 'reg_lambda': 1.8468432960909718, 'gamma': 2.163514605158284e-06}. Best is trial 89 with value: -6.682313979942854.
[I 2026-07-17 12:46:42,271] Trial 91 finished with value: -28.6658384324788 and parameters: {'scalers': 'none', 'ratios': 'norm_ratio', 'imputers': 'none', 'n_estimators': 2900, 'learning_rate': 0.4910985744528958, 'max_depth': 9, 'min_child_weight': 1, 'subsample': 0.5, 'colsample_bytree': 0.7, 'colsample_bylevel': 0.6, 'reg_alpha': 0.0009214369858270396, 'reg_lambda': 72.50998171109673, 'gamma': 1.9820085891488724e-06}. Best is trial 91 with value: -28.6658384324788.
[I 2026-07-17 12:47:31,830] Trial 92 finished with value: -37.63732322038261 and parameters: {'scalers': 'none', 'ratios': 'norm_ratio', 'imputers': 'none', 'n_estimators': 2950, 'learning_rate': 0.49813718900538073, 'max_depth': 9, 'min_child_weight': 1, 'subsample': 0.5, 'colsample_bytree': 0.7, 'colsample_bylevel': 0.6, 'reg_alpha': 0.006189913660950389, 'reg_lambda': 72.64880054572244, 'gamma': 1.9292993010419275e-06}. Best is trial 92 with value: -37.63732322038261.
[I 2026-07-17 12:48:05,480] Trial 93 finished with value: -2.232761850884741 and parameters: {'scalers': 'none', 'ratios': 'norm_ratio', 'imputers': 'none', 'n_estimators': 2900, 'learning_rate': 0.4733706878312741, 'max_depth': 9, 'min_child_weight': 1, 'subsample': 0.5, 'colsample_bytree': 0.7, 'colsample_bylevel': 0.5, 'reg_alpha': 0.0010483767539566705, 'reg_lambda': 2.228390383384195, 'gamma': 2.138743464537157e-06}. Best is trial 92 with value: -37.63732322038261.
[I 2026-07-17 12:48:31,892] Trial 94 finished with value: -1.707696890438976 and parameters: {'scalers': 'none', 'ratios': 'norm_ratio', 'imputers': 'none', 'n_estimators': 2650, 'learning_rate': 0.4712098999981469, 'max_depth': 9, 'min_child_weight': 1, 'subsample': 0.5, 'colsample_bytree': 0.7, 'colsample_bylevel': 0.5, 'reg_alpha': 0.001434285692161905, 'reg_lambda': 0.4613656895724427, 'gamma': 2.0246126657261352e-06}. Best is trial 92 with value: -37.63732322038261.
[I 2026-07-17 12:49:16,047] Trial 95 finished with value: -12.105347343020314 and parameters: {'scalers': 'none', 'ratios': 'norm_ratio', 'imputers': 'none', 'n_estimators': 2950, 'learning_rate': 0.45470219892088964, 'max_depth': 9, 'min_child_weight': 1, 'subsample': 0.5, 'colsample_bytree': 0.7, 'colsample_bylevel': 0.5, 'reg_alpha': 1.0127236142504087e-06, 'reg_lambda': 70.67274400277508, 'gamma': 1.9577891578716745e-06}. Best is trial 92 with value: -37.63732322038261.
[I 2026-07-17 12:49:44,836] Trial 96 finished with value: -1.71545572842499 and parameters: {'scalers': 'none', 'ratios': 'norm_ratio', 'imputers': 'none', 'n_estimators': 2950, 'learning_rate': 0.47965615662461786, 'max_depth': 9, 'min_child_weight': 1, 'subsample': 0.5, 'colsample_bytree': 0.7, 'colsample_bylevel': 0.5, 'reg_alpha': 0.0012424131695194381, 'reg_lambda': 0.34156078336292506, 'gamma': 1.9102230678510884e-06}. Best is trial 92 with value: -37.63732322038261.
[I 2026-07-17 12:50:13,639] Trial 97 finished with value: -1.7089105073136206 and parameters: {'scalers': 'none', 'ratios': 'norm_ratio', 'imputers': 'none', 'n_estimators': 2900, 'learning_rate': 0.43554610985993847, 'max_depth': 9, 'min_child_weight': 1, 'subsample': 0.5, 'colsample_bytree': 0.7, 'colsample_bylevel': 0.5, 'reg_alpha': 0.0010832823567969965, 'reg_lambda': 0.5699197459459432, 'gamma': 1.941762552549993e-06}. Best is trial 92 with value: -37.63732322038261.
[I 2026-07-17 12:50:45,943] Trial 98 finished with value: -2.268642852101854 and parameters: {'scalers': 'none', 'ratios': 'norm_ratio', 'imputers': 'none', 'n_estimators': 2900, 'learning_rate': 0.49806762537082194, 'max_depth': 9, 'min_child_weight': 1, 'subsample': 0.5, 'colsample_bytree': 0.7, 'colsample_bylevel': 0.5, 'reg_alpha': 0.0014691643203336006, 'reg_lambda': 1.710402136387897, 'gamma': 1.747330506047339e-06}. Best is trial 92 with value: -37.63732322038261.
[I 2026-07-17 12:51:17,458] Trial 99 finished with value: -1.8320355118372393 and parameters: {'scalers': 'none', 'ratios': 'norm_ratio', 'imputers': 'none', 'n_estimators': 2900, 'learning_rate': 0.48630669342813815, 'max_depth': 9, 'min_child_weight': 1, 'subsample': 0.5, 'colsample_bytree': 0.7, 'colsample_bylevel': 0.6, 'reg_alpha': 0.0009934403401840625, 'reg_lambda': 0.5074174007960087, 'gamma': 2.2414274981290208e-06}. Best is trial 92 with value: -37.63732322038261.
[I 2026-07-17 12:51:46,692] Trial 100 finished with value: -1.8179193243624878 and parameters: {'scalers': 'none', 'ratios': 'norm_ratio', 'imputers': 'none', 'n_estimators': 2900, 'learning_rate': 0.46862423146309495, 'max_depth': 9, 'min_child_weight': 1, 'subsample': 0.5, 'colsample_bytree': 0.7, 'colsample_bylevel': 0.5, 'reg_alpha': 0.001741377761347584, 'reg_lambda': 0.6452826737867521, 'gamma': 1.7537623471780967e-06}. Best is trial 92 with value: -37.63732322038261.
[I 2026-07-17 12:52:14,829] Trial 101 finished with value: -1.7886931689524088 and parameters: {'scalers': 'none', 'ratios': 'norm_ratio', 'imputers': 'none', 'n_estimators': 2950, 'learning_rate': 0.4947896131751621, 'max_depth': 9, 'min_child_weight': 1, 'subsample': 0.5, 'colsample_bytree': 0.7, 'colsample_bylevel': 0.5, 'reg_alpha': 0.0008910779828866631, 'reg_lambda': 0.29424906688018804, 'gamma': 1.7604632630731628e-06}. Best is trial 92 with value: -37.63732322038261.
[I 2026-07-17 12:52:43,122] Trial 102 finished with value: -1.6310657125212062 and parameters: {'scalers': 'none', 'ratios': 'norm_ratio', 'imputers': 'none', 'n_estimators': 2950, 'learning_rate': 0.41504595969159563, 'max_depth': 9, 'min_child_weight': 1, 'subsample': 0.5, 'colsample_bytree': 0.7, 'colsample_bylevel': 0.5, 'reg_alpha': 0.004270827567417986, 'reg_lambda': 0.44101838898019197, 'gamma': 1.7470352691791397e-06}. Best is trial 92 with value: -37.63732322038261.
[I 2026-07-17 12:53:11,746] Trial 103 finished with value: -1.6438369163679545 and parameters: {'scalers': 'none', 'ratios': 'norm_ratio', 'imputers': 'none', 'n_estimators': 2950, 'learning_rate': 0.42608360473357776, 'max_depth': 9, 'min_child_weight': 1, 'subsample': 0.5, 'colsample_bytree': 0.7, 'colsample_bylevel': 0.5, 'reg_alpha': 0.006212813295347016, 'reg_lambda': 0.35827675567020884, 'gamma': 2.006108273340843e-06}. Best is trial 92 with value: -37.63732322038261.
[I 2026-07-17 12:53:51,215] Trial 104 finished with value: -2.417986776361503 and parameters: {'scalers': 'none', 'ratios': 'norm_ratio', 'imputers': 'none', 'n_estimators': 2900, 'learning_rate': 0.4131273377572248, 'max_depth': 9, 'min_child_weight': 1, 'subsample': 0.5, 'colsample_bytree': 0.7, 'colsample_bylevel': 0.5, 'reg_alpha': 0.009636901584960961, 'reg_lambda': 7.117222860610999, 'gamma': 9.730897042618522e-06}. Best is trial 92 with value: -37.63732322038261.
[I 2026-07-17 12:54:27,385] Trial 105 finished with value: -1.5895077643081756 and parameters: {'scalers': 'none', 'ratios': 'norm_ratio', 'imputers': 'none', 'n_estimators': 2950, 'learning_rate': 0.4090292945545224, 'max_depth': 9, 'min_child_weight': 2, 'subsample': 0.5, 'colsample_bytree': 0.7, 'colsample_bylevel': 0.5, 'reg_alpha': 0.0048654398452787845, 'reg_lambda': 6.628331470117726, 'gamma': 8.889598739875724e-06}. Best is trial 92 with value: -37.63732322038261.
[I 2026-07-17 12:55:03,442] Trial 106 finished with value: -1.6259550163983558 and parameters: {'scalers': 'none', 'ratios': 'norm_ratio', 'imputers': 'none', 'n_estimators': 2950, 'learning_rate': 0.41488772644159805, 'max_depth': 9, 'min_child_weight': 2, 'subsample': 0.5, 'colsample_bytree': 0.7, 'colsample_bylevel': 0.5, 'reg_alpha': 0.005068261326763635, 'reg_lambda': 6.355135174849958, 'gamma': 6.006860655863709e-06}. Best is trial 92 with value: -37.63732322038261.
[I 2026-07-17 12:55:39,860] Trial 107 finished with value: -1.6288464660652338 and parameters: {'scalers': 'none', 'ratios': 'norm_ratio', 'imputers': 'none', 'n_estimators': 2950, 'learning_rate': 0.42906380853942766, 'max_depth': 9, 'min_child_weight': 2, 'subsample': 0.5, 'colsample_bytree': 0.7, 'colsample_bylevel': 0.5, 'reg_alpha': 0.003120741954270067, 'reg_lambda': 6.770602439972464, 'gamma': 5.0676591365755155e-06}. Best is trial 92 with value: -37.63732322038261.
[I 2026-07-17 12:56:17,442] Trial 108 finished with value: -2.2354393179618244 and parameters: {'scalers': 'none', 'ratios': 'norm_ratio', 'imputers': 'none', 'n_estimators': 2800, 'learning_rate': 0.401549740458572, 'max_depth': 9, 'min_child_weight': 1, 'subsample': 0.5, 'colsample_bytree': 0.7, 'colsample_bylevel': 0.5, 'reg_alpha': 0.004950549797486851, 'reg_lambda': 6.104654209518124, 'gamma': 5.298010791065288e-06}. Best is trial 92 with value: -37.63732322038261.
[I 2026-07-17 12:56:55,526] Trial 109 finished with value: -2.295817796875125 and parameters: {'scalers': 'none', 'ratios': 'norm_ratio', 'imputers': 'none', 'n_estimators': 2800, 'learning_rate': 0.41011773504015564, 'max_depth': 9, 'min_child_weight': 1, 'subsample': 0.5, 'colsample_bytree': 0.7, 'colsample_bylevel': 0.5, 'reg_alpha': 0.006797188641641929, 'reg_lambda': 6.2316666591969065, 'gamma': 5.1497524286822774e-06}. Best is trial 92 with value: -37.63732322038261.
[I 2026-07-17 12:57:38,745] Trial 110 finished with value: -1.3996186456070687 and parameters: {'scalers': 'none', 'ratios': 'norm_ratio', 'imputers': 'none', 'n_estimators': 2650, 'learning_rate': 0.27911524200101656, 'max_depth': 10, 'min_child_weight': 2, 'subsample': 0.5, 'colsample_bytree': 0.7, 'colsample_bylevel': 0.6, 'reg_alpha': 0.0060991552504253465, 'reg_lambda': 7.232524520919829, 'gamma': 5.192160118599784e-06}. Best is trial 92 with value: -37.63732322038261.
[I 2026-07-17 12:58:24,229] Trial 111 finished with value: -1.4082814575161484 and parameters: {'scalers': 'none', 'ratios': 'norm_ratio', 'imputers': 'none', 'n_estimators': 2800, 'learning_rate': 0.2839725573843364, 'max_depth': 10, 'min_child_weight': 2, 'subsample': 0.5, 'colsample_bytree': 0.7, 'colsample_bylevel': 0.6, 'reg_alpha': 0.025935588372097154, 'reg_lambda': 7.044289139676071, 'gamma': 9.350136677529346e-06}. Best is trial 92 with value: -37.63732322038261.
[I 2026-07-17 12:58:55,296] Trial 112 finished with value: -1.3390909787938396 and parameters: {'scalers': 'none', 'ratios': 'norm_ratio', 'imputers': 'none', 'n_estimators': 2800, 'learning_rate': 0.2857981311319198, 'max_depth': 9, 'min_child_weight': 2, 'subsample': 0.5, 'colsample_bytree': 0.7, 'colsample_bylevel': 0.5, 'reg_alpha': 0.05032923187537034, 'reg_lambda': 3.034801049343659, 'gamma': 2.1563873869240604e-05}. Best is trial 92 with value: -37.63732322038261.
[I 2026-07-17 12:59:29,822] Trial 114 finished with value: -0.6418743843191397 and parameters: {'scalers': 'none', 'ratios': 'norm_ratio', 'imputers': 'none', 'n_estimators': 2800, 'learning_rate': 0.0072104029917626575, 'max_depth': 10, 'min_child_weight': 2, 'subsample': 0.5, 'colsample_bytree': 0.8, 'colsample_bylevel': 0.6, 'reg_alpha': 0.02265042075843615, 'reg_lambda': 2.8065592412719904, 'gamma': 1.7114623833152431}. Best is trial 92 with value: -37.63732322038261.
[I 2026-07-17 12:59:32,786] Trial 113 finished with value: -0.6790893287370645 and parameters: {'scalers': 'none', 'ratios': 'norm_ratio', 'imputers': 'none', 'n_estimators': 2800, 'learning_rate': 0.00033358500190109686, 'max_depth': 9, 'min_child_weight': 2, 'subsample': 0.5, 'colsample_bytree': 0.7, 'colsample_bylevel': 0.6, 'reg_alpha': 0.10317348453888049, 'reg_lambda': 2.637272578585161, 'gamma': 1.9798948683442227e-05}. Best is trial 92 with value: -37.63732322038261.
[I 2026-07-17 13:00:28,770] Trial 115 finished with value: -0.6797192073591241 and parameters: {'scalers': 'none', 'ratios': 'norm_ratio', 'imputers': 'none', 'n_estimators': 2800, 'learning_rate': 0.0003384395534445933, 'max_depth': 10, 'min_child_weight': 1, 'subsample': 0.5, 'colsample_bytree': 0.8, 'colsample_bylevel': 0.6, 'reg_alpha': 0.0779101296605458, 'reg_lambda': 2.733956730738604, 'gamma': 9.415388758407648e-06}. Best is trial 92 with value: -37.63732322038261.
[I 2026-07-17 13:01:19,781] Trial 116 finished with value: -1.6803389911272857 and parameters: {'scalers': 'none', 'ratios': 'norm_ratio', 'imputers': 'none', 'n_estimators': 2800, 'learning_rate': 0.28987244686860947, 'max_depth': 10, 'min_child_weight': 1, 'subsample': 0.5, 'colsample_bytree': 0.8, 'colsample_bylevel': 0.6, 'reg_alpha': 0.04798737194545638, 'reg_lambda': 2.744483705685063, 'gamma': 1.0726397334164623e-05}. Best is trial 92 with value: -37.63732322038261.
[I 2026-07-17 13:02:08,498] Trial 117 finished with value: -0.7610707788124862 and parameters: {'scalers': 'none', 'ratios': 'norm_ratio', 'imputers': 'none', 'n_estimators': 2650, 'learning_rate': 0.006273027245362315, 'max_depth': 10, 'min_child_weight': 2, 'subsample': 0.5, 'colsample_bytree': 0.8, 'colsample_bylevel': 0.6, 'reg_alpha': 0.19856334497365488, 'reg_lambda': 2.943472992064927, 'gamma': 1.1972567644820822e-05}. Best is trial 92 with value: -37.63732322038261.
[I 2026-07-17 13:02:43,940] Trial 118 finished with value: -1.5946161437169626 and parameters: {'scalers': 'none', 'ratios': 'norm_ratio', 'imputers': 'none', 'n_estimators': 2850, 'learning_rate': 0.29405436728991446, 'max_depth': 9, 'min_child_weight': 1, 'subsample': 0.5, 'colsample_bytree': 0.7, 'colsample_bylevel': 0.6, 'reg_alpha': 0.11417225376991293, 'reg_lambda': 1.4808722234956333, 'gamma': 2.3345345508139393e-05}. Best is trial 92 with value: -37.63732322038261.
[I 2026-07-17 13:03:19,073] Trial 119 finished with value: -0.7164211855363207 and parameters: {'scalers': 'none', 'ratios': 'norm_ratio', 'imputers': 'none', 'n_estimators': 2800, 'learning_rate': 0.005939889414373911, 'max_depth': 9, 'min_child_weight': 1, 'subsample': 0.5, 'colsample_bytree': 0.7, 'colsample_bylevel': 0.6, 'reg_alpha': 0.028869219876953137, 'reg_lambda': 1.3878429650234942, 'gamma': 4.388436983928105e-06}. Best is trial 92 with value: -37.63732322038261.
[I 2026-07-17 13:03:49,981] Trial 120 finished with value: -0.7081114013096445 and parameters: {'scalers': 'none', 'ratios': 'norm_ratio', 'imputers': 'none', 'n_estimators': 2850, 'learning_rate': 0.0073934129332177256, 'max_depth': 8, 'min_child_weight': 1, 'subsample': 0.5, 'colsample_bytree': 0.8, 'colsample_bylevel': 0.6, 'reg_alpha': 0.012554284876601726, 'reg_lambda': 1.4820233731001489, 'gamma': 2.153452215184199e-05}. Best is trial 92 with value: -37.63732322038261.
[I 2026-07-17 13:04:22,858] Trial 121 finished with value: -0.6544938362395276 and parameters: {'scalers': 'none', 'ratios': 'norm_ratio', 'imputers': 'none', 'n_estimators': 2850, 'learning_rate': 0.0006496877430503414, 'max_depth': 8, 'min_child_weight': 1, 'subsample': 0.5, 'colsample_bytree': 0.7, 'colsample_bylevel': 0.6, 'reg_alpha': 0.012276982306957484, 'reg_lambda': 73.97593585549174, 'gamma': 2.457340507225679e-05}. Best is trial 92 with value: -37.63732322038261.
[I 2026-07-17 13:04:54,405] Trial 122 finished with value: -1.5419127429557067 and parameters: {'scalers': 'none', 'ratios': 'norm_ratio', 'imputers': 'none', 'n_estimators': 2650, 'learning_rate': 0.22422887869066424, 'max_depth': 8, 'min_child_weight': 1, 'subsample': 0.5, 'colsample_bytree': 0.7, 'colsample_bylevel': 0.6, 'reg_alpha': 0.009444543693665545, 'reg_lambda': 11.349903285360147, 'gamma': 4.218678732002005e-06}. Best is trial 92 with value: -37.63732322038261.
[I 2026-07-17 13:05:23,895] Trial 123 finished with value: -1.767915735425873 and parameters: {'scalers': 'none', 'ratios': 'norm_ratio', 'imputers': 'none', 'n_estimators': 2600, 'learning_rate': 0.23316489374736246, 'max_depth': 8, 'min_child_weight': 1, 'subsample': 0.5, 'colsample_bytree': 0.7, 'colsample_bylevel': 0.5, 'reg_alpha': 0.008609120749916896, 'reg_lambda': 71.83991643543001, 'gamma': 4.362448360568998e-06}. Best is trial 92 with value: -37.63732322038261.
[I 2026-07-17 13:05:49,497] Trial 124 finished with value: -1.2318349229240153 and parameters: {'scalers': 'none', 'ratios': 'norm_ratio', 'imputers': 'none', 'n_estimators': 2650, 'learning_rate': 0.21387410047468877, 'max_depth': 8, 'min_child_weight': 1, 'subsample': 0.5, 'colsample_bytree': 0.7, 'colsample_bylevel': 0.5, 'reg_alpha': 0.01020983641592459, 'reg_lambda': 1.4608000170521915, 'gamma': 2.97622231862522e-06}. Best is trial 92 with value: -37.63732322038261.
[I 2026-07-17 13:06:09,450] Trial 125 finished with value: -1.2543014267932309 and parameters: {'scalers': 'none', 'ratios': 'norm_ratio', 'imputers': 'none', 'n_estimators': 2850, 'learning_rate': 0.21751503757228394, 'max_depth': 8, 'min_child_weight': 1, 'subsample': 0.5, 'colsample_bytree': 0.7, 'colsample_bylevel': 0.5, 'reg_alpha': 0.012147091053527074, 'reg_lambda': 1.3226422155473962, 'gamma': 4.4461217471171894e-06}. Best is trial 92 with value: -37.63732322038261.
[I 2026-07-17 13:06:39,558] Trial 126 finished with value: -1.7495257951572099 and parameters: {'scalers': 'none', 'ratios': 'norm_ratio', 'imputers': 'none', 'n_estimators': 2650, 'learning_rate': 0.22463447312089363, 'max_depth': 8, 'min_child_weight': 1, 'subsample': 0.5, 'colsample_bytree': 0.7, 'colsample_bylevel': 0.5, 'reg_alpha': 0.010029676081079051, 'reg_lambda': 64.88347228566559, 'gamma': 4.0960580440929105e-06}. Best is trial 92 with value: -37.63732322038261.
[I 2026-07-17 13:07:07,947] Trial 127 finished with value: -1.5687532580594472 and parameters: {'scalers': 'none', 'ratios': 'norm_ratio', 'imputers': 'none', 'n_estimators': 2600, 'learning_rate': 0.21839797024519736, 'max_depth': 8, 'min_child_weight': 1, 'subsample': 0.5, 'colsample_bytree': 0.7, 'colsample_bylevel': 0.5, 'reg_alpha': 0.009837134609587305, 'reg_lambda': 13.608277386476088, 'gamma': 3.3686154918706218e-06}. Best is trial 92 with value: -37.63732322038261.
[I 2026-07-17 13:07:50,668] Trial 128 finished with value: -2.460898253029412 and parameters: {'scalers': 'none', 'ratios': 'norm_ratio', 'imputers': 'none', 'n_estimators': 3000, 'learning_rate': 0.3954690863847455, 'max_depth': 9, 'min_child_weight': 1, 'subsample': 0.5, 'colsample_bytree': 0.7, 'colsample_bylevel': 0.5, 'reg_alpha': 0.0005862875202778557, 'reg_lambda': 11.226429405934871, 'gamma': 3.0784626480102303e-06}. Best is trial 92 with value: -37.63732322038261.
[I 2026-07-17 13:08:33,341] Trial 129 finished with value: -1.9378542247925206 and parameters: {'scalers': 'none', 'ratios': 'norm_ratio', 'imputers': 'none', 'n_estimators': 3000, 'learning_rate': 0.2149889115726921, 'max_depth': 9, 'min_child_weight': 1, 'subsample': 0.5, 'colsample_bytree': 0.7, 'colsample_bylevel': 0.5, 'reg_alpha': 0.002276164694510256, 'reg_lambda': 69.90834330744858, 'gamma': 2.847416266044322e-06}. Best is trial 92 with value: -37.63732322038261.
[I 2026-07-17 13:09:16,695] Trial 130 finished with value: -2.463761874474751 and parameters: {'scalers': 'none', 'ratios': 'norm_ratio', 'imputers': 'none', 'n_estimators': 3000, 'learning_rate': 0.38426116537404115, 'max_depth': 9, 'min_child_weight': 1, 'subsample': 0.5, 'colsample_bytree': 0.7, 'colsample_bylevel': 0.5, 'reg_alpha': 0.0021157711451207845, 'reg_lambda': 12.001088726149232, 'gamma': 3.063872669953419e-06}. Best is trial 92 with value: -37.63732322038261.
[I 2026-07-17 13:10:00,055] Trial 131 finished with value: -2.539341096852808 and parameters: {'scalers': 'none', 'ratios': 'norm_ratio', 'imputers': 'none', 'n_estimators': 3000, 'learning_rate': 0.3937177763957801, 'max_depth': 9, 'min_child_weight': 1, 'subsample': 0.5, 'colsample_bytree': 0.7, 'colsample_bylevel': 0.5, 'reg_alpha': 0.0006401900834684201, 'reg_lambda': 12.41678325202241, 'gamma': 2.6488135447148365e-06}. Best is trial 92 with value: -37.63732322038261.
[I 2026-07-17 13:10:30,598] Trial 132 finished with value: -1.2118521212039433 and parameters: {'scalers': 'none', 'ratios': 'norm_ratio', 'imputers': 'none', 'n_estimators': 3000, 'learning_rate': 0.37717669883235594, 'max_depth': 9, 'min_child_weight': 5, 'subsample': 0.5, 'colsample_bytree': 0.7, 'colsample_bylevel': 0.5, 'reg_alpha': 0.0005453981944527167, 'reg_lambda': 12.489303925884133, 'gamma': 2.815953644103808e-06}. Best is trial 92 with value: -37.63732322038261.
[I 2026-07-17 13:11:13,481] Trial 133 finished with value: -2.5214988807860177 and parameters: {'scalers': 'none', 'ratios': 'norm_ratio', 'imputers': 'none', 'n_estimators': 3000, 'learning_rate': 0.38871544020527776, 'max_depth': 9, 'min_child_weight': 1, 'subsample': 0.5, 'colsample_bytree': 0.7, 'colsample_bylevel': 0.5, 'reg_alpha': 0.0005583959162582323, 'reg_lambda': 12.580630629216808, 'gamma': 1.3614918235535313e-06}. Best is trial 92 with value: -37.63732322038261.
[I 2026-07-17 13:11:43,899] Trial 134 finished with value: -1.2471330765063084 and parameters: {'scalers': 'none', 'ratios': 'norm_ratio', 'imputers': 'none', 'n_estimators': 3000, 'learning_rate': 0.38485292831867846, 'max_depth': 9, 'min_child_weight': 5, 'subsample': 0.5, 'colsample_bytree': 0.7, 'colsample_bylevel': 0.5, 'reg_alpha': 0.0005722873451709858, 'reg_lambda': 11.921928052657593, 'gamma': 2.6752994122210714e-06}. Best is trial 92 with value: -37.63732322038261.
[I 2026-07-17 13:12:26,718] Trial 135 finished with value: -2.638145479974309 and parameters: {'scalers': 'none', 'ratios': 'norm_ratio', 'imputers': 'none', 'n_estimators': 3000, 'learning_rate': 0.42009006957596634, 'max_depth': 9, 'min_child_weight': 1, 'subsample': 0.5, 'colsample_bytree': 0.7, 'colsample_bylevel': 0.5, 'reg_alpha': 0.002122822830364805, 'reg_lambda': 10.098585365094246, 'gamma': 1.3817503507367386e-06}. Best is trial 92 with value: -37.63732322038261.
