[I 2026-07-17 11:46:01,631] Trial 180 finished with value: -0.13715013913330848 and parameters: {'scalers': 'robust', 'ratios': 'norm_ratio', 'imputers': 'mean', 'n_estimators': 100, 'learning_rate': 0.00010237667869373237, 'max_depth': 12, 'min_child_weight': 9, 'subsample': 0.8, 'colsample_bytree': 0.5, 'colsample_bylevel': 0.6, 'reg_alpha': 3.754371387194939e-06, 'reg_lambda': 12.826211085661305, 'gamma': 1.1044981664567752}. Best is trial 177 with value: -0.13732505496931563.
[I 2026-07-17 11:46:01,902] Trial 181 finished with value: -0.137162189446836 and parameters: {'scalers': 'robust', 'ratios': 'norm_ratio', 'imputers': 'none', 'n_estimators': 100, 'learning_rate': 0.00010328577002722778, 'max_depth': 12, 'min_child_weight': 9, 'subsample': 0.8, 'colsample_bytree': 0.5, 'colsample_bylevel': 0.7, 'reg_alpha': 4.1115436997515645e-06, 'reg_lambda': 13.07669808456012, 'gamma': 1.4466327141611763}. Best is trial 177 with value: -0.13732505496931563.
[I 2026-07-17 11:46:02,287] Trial 182 finished with value: -0.137122046617986 and parameters: {'scalers': 'robust', 'ratios': 'norm_ratio', 'imputers': 'none', 'n_estimators': 100, 'learning_rate': 0.00010236148322449395, 'max_depth': 12, 'min_child_weight': 9, 'subsample': 0.8, 'colsample_bytree': 0.5, 'colsample_bylevel': 0.7, 'reg_alpha': 3.960549074731691e-06, 'reg_lambda': 13.991443041053452, 'gamma': 1.1397048429014038}. Best is trial 177 with value: -0.13732505496931563.
[I 2026-07-17 11:46:02,561] Trial 183 finished with value: -0.13715698077965274 and parameters: {'scalers': 'robust', 'ratios': 'norm_ratio', 'imputers': 'none', 'n_estimators': 100, 'learning_rate': 0.00010288974648079655, 'max_depth': 12, 'min_child_weight': 9, 'subsample': 0.8, 'colsample_bytree': 0.5, 'colsample_bylevel': 0.6, 'reg_alpha': 3.953526303396689e-06, 'reg_lambda': 17.166224672198734, 'gamma': 1.0823297840426536}. Best is trial 177 with value: -0.13732505496931563.
[I 2026-07-17 11:46:02,846] Trial 184 finished with value: -0.13726785222677534 and parameters: {'scalers': 'robust', 'ratios': 'norm_ratio', 'imputers': 'none', 'n_estimators': 100, 'learning_rate': 0.00011107183125464678, 'max_depth': 12, 'min_child_weight': 9, 'subsample': 0.8, 'colsample_bytree': 0.5, 'colsample_bylevel': 0.6, 'reg_alpha': 3.899632866833098e-06, 'reg_lambda': 17.72851864240624, 'gamma': 4.511024500983087}. Best is trial 177 with value: -0.13732505496931563.
[I 2026-07-17 11:46:03,017] Trial 185 finished with value: -0.13736913884889673 and parameters: {'scalers': 'robust', 'ratios': 'norm_ratio', 'imputers': 'none', 'n_estimators': 100, 'learning_rate': 0.00010012897444582621, 'max_depth': 12, 'min_child_weight': 9, 'subsample': 0.8, 'colsample_bytree': 0.5, 'colsample_bylevel': 0.6, 'reg_alpha': 0.11905926500443624, 'reg_lambda': 12.479689484326682, 'gamma': 6.211214322428833}. Best is trial 185 with value: -0.13736913884889673.
[I 2026-07-17 11:46:03,518] Trial 186 finished with value: -0.1368290674230912 and parameters: {'scalers': 'robust', 'ratios': 'norm_ratio', 'imputers': 'none', 'n_estimators': 250, 'learning_rate': 0.00010028677398738412, 'max_depth': 12, 'min_child_weight': 9, 'subsample': 0.8, 'colsample_bytree': 0.5, 'colsample_bylevel': 0.6, 'reg_alpha': 3.7751909887444236e-06, 'reg_lambda': 15.11677135651715, 'gamma': 4.055438059288505}. Best is trial 185 with value: -0.13736913884889673.
[I 2026-07-17 11:46:03,978] Trial 187 finished with value: -0.13685905479253466 and parameters: {'scalers': 'robust', 'ratios': 'norm_ratio', 'imputers': 'none', 'n_estimators': 250, 'learning_rate': 0.00010170936935556527, 'max_depth': 12, 'min_child_weight': 9, 'subsample': 0.8, 'colsample_bytree': 0.5, 'colsample_bylevel': 0.6, 'reg_alpha': 3.7646443161742717e-06, 'reg_lambda': 14.58586585599134, 'gamma': 4.849931583603397}. Best is trial 185 with value: -0.13736913884889673.
[I 2026-07-17 11:46:04,438] Trial 188 finished with value: -0.1368777533154127 and parameters: {'scalers': 'robust', 'ratios': 'norm_ratio', 'imputers': 'mean', 'n_estimators': 250, 'learning_rate': 0.00010003167511128882, 'max_depth': 12, 'min_child_weight': 9, 'subsample': 0.8, 'colsample_bytree': 0.5, 'colsample_bylevel': 0.6, 'reg_alpha': 0.11849580857311394, 'reg_lambda': 14.859752721871043, 'gamma': 4.588132287269418}. Best is trial 185 with value: -0.13736913884889673.
[I 2026-07-17 11:46:06,478] Trial 189 finished with value: -0.13453437396737936 and parameters: {'scalers': 'robust', 'ratios': 'norm_ratio', 'imputers': 'mean', 'n_estimators': 1100, 'learning_rate': 0.00010016849521908046, 'max_depth': 12, 'min_child_weight': 9, 'subsample': 0.8, 'colsample_bytree': 0.5, 'colsample_bylevel': 0.6, 'reg_alpha': 3.9278095943221425e-06, 'reg_lambda': 12.06672814122484, 'gamma': 4.4419182863161435}. Best is trial 185 with value: -0.13736913884889673.
[I 2026-07-17 11:46:06,996] Trial 190 finished with value: -0.13695217244514354 and parameters: {'scalers': 'robust', 'ratios': 'norm_ratio', 'imputers': 'none', 'n_estimators': 250, 'learning_rate': 0.00010194866725636258, 'max_depth': 12, 'min_child_weight': 9, 'subsample': 0.8, 'colsample_bytree': 0.5, 'colsample_bylevel': 0.6, 'reg_alpha': 3.7489996385229054e-06, 'reg_lambda': 14.821263156700173, 'gamma': 5.7475095627113}. Best is trial 185 with value: -0.13736913884889673.
[I 2026-07-17 11:46:07,478] Trial 191 finished with value: -0.13691791355916066 and parameters: {'scalers': 'robust', 'ratios': 'norm_ratio', 'imputers': 'none', 'n_estimators': 250, 'learning_rate': 0.0001027923116056435, 'max_depth': 12, 'min_child_weight': 9, 'subsample': 0.8, 'colsample_bytree': 0.5, 'colsample_bylevel': 0.6, 'reg_alpha': 3.7019058786969387e-06, 'reg_lambda': 13.520413917652446, 'gamma': 5.534654143476833}. Best is trial 185 with value: -0.13736913884889673.
[I 2026-07-17 11:46:07,940] Trial 192 finished with value: -0.13694514893342263 and parameters: {'scalers': 'robust', 'ratios': 'norm_ratio', 'imputers': 'none', 'n_estimators': 250, 'learning_rate': 0.00010057744300886429, 'max_depth': 12, 'min_child_weight': 9, 'subsample': 0.8, 'colsample_bytree': 0.5, 'colsample_bylevel': 0.6, 'reg_alpha': 3.822652137753226e-06, 'reg_lambda': 9.59107694974599, 'gamma': 5.605648695014765}. Best is trial 185 with value: -0.13736913884889673.
[I 2026-07-17 11:46:08,456] Trial 193 finished with value: -0.13693788234857526 and parameters: {'scalers': 'robust', 'ratios': 'norm_ratio', 'imputers': 'none', 'n_estimators': 250, 'learning_rate': 0.00010211231422453966, 'max_depth': 12, 'min_child_weight': 9, 'subsample': 0.8, 'colsample_bytree': 0.5, 'colsample_bylevel': 0.6, 'reg_alpha': 0.11578758728977363, 'reg_lambda': 13.741898792539844, 'gamma': 5.539385284039165}. Best is trial 185 with value: -0.13736913884889673.
[I 2026-07-17 11:46:09,074] Trial 194 finished with value: -0.1366415794981595 and parameters: {'scalers': 'robust', 'ratios': 'norm_ratio', 'imputers': 'none', 'n_estimators': 250, 'learning_rate': 0.00010090097116267736, 'max_depth': 12, 'min_child_weight': 9, 'subsample': 0.8, 'colsample_bytree': 0.5, 'colsample_bylevel': 0.6, 'reg_alpha': 1.6148268258237592, 'reg_lambda': 13.206281376040707, 'gamma': 1.3719537211716872}. Best is trial 185 with value: -0.13736913884889673.
[I 2026-07-17 11:46:09,457] Trial 195 finished with value: -0.13721013665880932 and parameters: {'scalers': 'robust', 'ratios': 'norm_ratio', 'imputers': 'none', 'n_estimators': 100, 'learning_rate': 0.0001004319084442166, 'max_depth': 12, 'min_child_weight': 9, 'subsample': 0.8, 'colsample_bytree': 0.5, 'colsample_bylevel': 0.6, 'reg_alpha': 0.10619411632588173, 'reg_lambda': 11.419342216964454, 'gamma': 1.6234207324667482}. Best is trial 185 with value: -0.13736913884889673.
[I 2026-07-17 11:46:09,687] Trial 196 finished with value: -0.1371831092192341 and parameters: {'scalers': 'robust', 'ratios': 'norm_ratio', 'imputers': 'none', 'n_estimators': 100, 'learning_rate': 0.00010135310660925559, 'max_depth': 12, 'min_child_weight': 9, 'subsample': 0.8, 'colsample_bytree': 0.5, 'colsample_bylevel': 0.6, 'reg_alpha': 0.19978385032438342, 'reg_lambda': 9.437092099392403, 'gamma': 1.572395015542005}. Best is trial 185 with value: -0.13736913884889673.
[I 2026-07-17 11:46:09,967] Trial 197 finished with value: -0.13710059558996723 and parameters: {'scalers': 'robust', 'ratios': 'norm_ratio', 'imputers': 'none', 'n_estimators': 100, 'learning_rate': 0.0001157414716488012, 'max_depth': 12, 'min_child_weight': 9, 'subsample': 0.8, 'colsample_bytree': 0.5, 'colsample_bylevel': 0.6, 'reg_alpha': 0.16567412439115017, 'reg_lambda': 9.821411205565312, 'gamma': 1.304534441481774}. Best is trial 185 with value: -0.13736913884889673.
[I 2026-07-17 11:46:10,251] Trial 198 finished with value: -0.13713046491349304 and parameters: {'scalers': 'robust', 'ratios': 'norm_ratio', 'imputers': 'none', 'n_estimators': 100, 'learning_rate': 0.00011482718758256797, 'max_depth': 12, 'min_child_weight': 9, 'subsample': 0.8, 'colsample_bytree': 0.5, 'colsample_bylevel': 0.6, 'reg_alpha': 7.5362513150080865e-06, 'reg_lambda': 9.417954739876187, 'gamma': 1.529054361676732}. Best is trial 185 with value: -0.13736913884889673.
[I 2026-07-17 11:46:10,537] Trial 199 finished with value: -0.13713033365850077 and parameters: {'scalers': 'robust', 'ratios': 'norm_ratio', 'imputers': 'none', 'n_estimators': 100, 'learning_rate': 0.0001199416382865571, 'max_depth': 12, 'min_child_weight': 9, 'subsample': 0.8, 'colsample_bytree': 0.5, 'colsample_bylevel': 0.6, 'reg_alpha': 0.16011428058022723, 'reg_lambda': 9.502535690869124, 'gamma': 1.6634952633332274}. Best is trial 185 with value: -0.13736913884889673.
[I 2026-07-17 11:46:10,822] Trial 200 finished with value: -0.0700545573027285 and parameters: {'scalers': 'robust', 'ratios': 'norm_ratio', 'imputers': 'none', 'n_estimators': 100, 'learning_rate': 0.06844412543226829, 'max_depth': 12, 'min_child_weight': 9, 'subsample': 0.8, 'colsample_bytree': 0.5, 'colsample_bylevel': 0.6, 'reg_alpha': 8.128292144586533e-06, 'reg_lambda': 9.106362904663774, 'gamma': 1.4246255694379657}. Best is trial 185 with value: -0.13736913884889673.
[I 2026-07-17 11:46:11,053] Trial 201 finished with value: -0.13710133278128403 and parameters: {'scalers': 'robust', 'ratios': 'norm_ratio', 'imputers': 'none', 'n_estimators': 100, 'learning_rate': 0.00012831840362366743, 'max_depth': 12, 'min_child_weight': 9, 'subsample': 0.8, 'colsample_bytree': 0.5, 'colsample_bylevel': 0.6, 'reg_alpha': 0.20649615143182976, 'reg_lambda': 26.15977873012585, 'gamma': 1.5108668922055937}. Best is trial 185 with value: -0.13736913884889673.
[I 2026-07-17 11:46:11,374] Trial 202 finished with value: -0.1373190172513744 and parameters: {'scalers': 'robust', 'ratios': 'norm_ratio', 'imputers': 'none', 'n_estimators': 100, 'learning_rate': 0.00012669105385860295, 'max_depth': 12, 'min_child_weight': 9, 'subsample': 0.8, 'colsample_bytree': 0.5, 'colsample_bylevel': 0.6, 'reg_alpha': 9.239001943843982e-06, 'reg_lambda': 30.32153301458561, 'gamma': 17.35122684536793}. Best is trial 185 with value: -0.13736913884889673.
[I 2026-07-17 11:46:11,576] Trial 203 finished with value: -0.1371534985948478 and parameters: {'scalers': 'robust', 'ratios': 'norm_ratio', 'imputers': 'none', 'n_estimators': 100, 'learning_rate': 0.00013065816538338748, 'max_depth': 12, 'min_child_weight': 9, 'subsample': 0.8, 'colsample_bytree': 0.5, 'colsample_bylevel': 0.6, 'reg_alpha': 0.18336486422853132, 'reg_lambda': 30.891977453911338, 'gamma': 2.2766554749032566}. Best is trial 185 with value: -0.13736913884889673.
[I 2026-07-17 11:46:11,843] Trial 204 finished with value: -0.13715721514740153 and parameters: {'scalers': 'robust', 'ratios': 'norm_ratio', 'imputers': 'none', 'n_estimators': 100, 'learning_rate': 0.00012954596015361285, 'max_depth': 12, 'min_child_weight': 9, 'subsample': 0.8, 'colsample_bytree': 0.5, 'colsample_bylevel': 0.6, 'reg_alpha': 0.22806523339728335, 'reg_lambda': 8.727265132101005, 'gamma': 2.728989527718096}. Best is trial 185 with value: -0.13736913884889673.
[I 2026-07-17 11:46:12,139] Trial 205 finished with value: -0.1370749370098248 and parameters: {'scalers': 'robust', 'ratios': 'norm_ratio', 'imputers': 'none', 'n_estimators': 100, 'learning_rate': 0.0001319723368502195, 'max_depth': 12, 'min_child_weight': 9, 'subsample': 0.8, 'colsample_bytree': 0.5, 'colsample_bylevel': 0.6, 'reg_alpha': 0.26450370504454, 'reg_lambda': 8.749173797194928, 'gamma': 2.0774392014025453}. Best is trial 185 with value: -0.13736913884889673.
[I 2026-07-17 11:46:12,317] Trial 206 finished with value: -0.13730176572848993 and parameters: {'scalers': 'robust', 'ratios': 'norm_ratio', 'imputers': 'none', 'n_estimators': 100, 'learning_rate': 0.00013382271963618606, 'max_depth': 12, 'min_child_weight': 9, 'subsample': 0.8, 'colsample_bytree': 0.5, 'colsample_bylevel': 0.6, 'reg_alpha': 0.07442446573216732, 'reg_lambda': 7.8138961260485615, 'gamma': 13.324017607129417}. Best is trial 185 with value: -0.13736913884889673.
[I 2026-07-17 11:46:12,513] Trial 207 finished with value: -0.13730243518935023 and parameters: {'scalers': 'robust', 'ratios': 'norm_ratio', 'imputers': 'none', 'n_estimators': 100, 'learning_rate': 0.00013276876052463658, 'max_depth': 12, 'min_child_weight': 9, 'subsample': 0.8, 'colsample_bytree': 0.5, 'colsample_bylevel': 0.6, 'reg_alpha': 0.20093057728147248, 'reg_lambda': 8.514451468401436, 'gamma': 11.640789015373432}. Best is trial 185 with value: -0.13736913884889673.
[I 2026-07-17 11:46:12,796] Trial 208 finished with value: -0.13716268337554455 and parameters: {'scalers': 'robust', 'ratios': 'norm_ratio', 'imputers': 'none', 'n_estimators': 100, 'learning_rate': 0.00013038154390624337, 'max_depth': 12, 'min_child_weight': 9, 'subsample': 0.8, 'colsample_bytree': 0.5, 'colsample_bylevel': 0.6, 'reg_alpha': 0.2762602939058842, 'reg_lambda': 8.65847544837627, 'gamma': 2.936001822035236}. Best is trial 185 with value: -0.13736913884889673.
[I 2026-07-17 11:46:13,083] Trial 209 finished with value: -0.13729582101290108 and parameters: {'scalers': 'robust', 'ratios': 'norm_ratio', 'imputers': 'none', 'n_estimators': 100, 'learning_rate': 0.0001366048074631262, 'max_depth': 12, 'min_child_weight': 9, 'subsample': 0.8, 'colsample_bytree': 0.5, 'colsample_bylevel': 0.6, 'reg_alpha': 0.17847225867326239, 'reg_lambda': 8.03910805740503, 'gamma': 12.183115972127045}. Best is trial 185 with value: -0.13736913884889673.
[I 2026-07-17 11:46:13,307] Trial 210 finished with value: -0.1373071400114517 and parameters: {'scalers': 'robust', 'ratios': 'norm_ratio', 'imputers': 'none', 'n_estimators': 100, 'learning_rate': 0.00013255312575645906, 'max_depth': 12, 'min_child_weight': 9, 'subsample': 0.8, 'colsample_bytree': 0.5, 'colsample_bylevel': 0.6, 'reg_alpha': 0.3791419267874347, 'reg_lambda': 8.960795207285537, 'gamma': 9.505656629592277}. Best is trial 185 with value: -0.13736913884889673.
[I 2026-07-17 11:46:13,517] Trial 211 finished with value: -0.13730299541917876 and parameters: {'scalers': 'robust', 'ratios': 'norm_ratio', 'imputers': 'none', 'n_estimators': 100, 'learning_rate': 0.00013428940983452347, 'max_depth': 12, 'min_child_weight': 9, 'subsample': 0.8, 'colsample_bytree': 0.5, 'colsample_bylevel': 0.6, 'reg_alpha': 0.2207682035197574, 'reg_lambda': 8.408407289560357, 'gamma': 17.267168590709627}. Best is trial 185 with value: -0.13736913884889673.
[I 2026-07-17 11:46:13,708] Trial 212 finished with value: -0.13730676042294326 and parameters: {'scalers': 'robust', 'ratios': 'norm_ratio', 'imputers': 'none', 'n_estimators': 100, 'learning_rate': 0.00013294107607953842, 'max_depth': 12, 'min_child_weight': 9, 'subsample': 0.8, 'colsample_bytree': 0.5, 'colsample_bylevel': 0.6, 'reg_alpha': 0.2356551371288915, 'reg_lambda': 8.384969864927514, 'gamma': 9.923567714888632}. Best is trial 185 with value: -0.13736913884889673.
[I 2026-07-17 11:46:14,025] Trial 213 finished with value: -0.13715884476776496 and parameters: {'scalers': 'robust', 'ratios': 'norm_ratio', 'imputers': 'none', 'n_estimators': 150, 'learning_rate': 0.00013430202799328539, 'max_depth': 12, 'min_child_weight': 9, 'subsample': 0.8, 'colsample_bytree': 0.5, 'colsample_bylevel': 0.6, 'reg_alpha': 0.23333666128274502, 'reg_lambda': 7.91568022230947, 'gamma': 12.906285281428483}. Best is trial 185 with value: -0.13736913884889673.
[I 2026-07-17 11:46:14,564] Trial 214 finished with value: -0.13715988384085515 and parameters: {'scalers': 'robust', 'ratios': 'norm_ratio', 'imputers': 'none', 'n_estimators': 150, 'learning_rate': 0.0001345777311370219, 'max_depth': 12, 'min_child_weight': 9, 'subsample': 0.8, 'colsample_bytree': 0.5, 'colsample_bylevel': 0.6, 'reg_alpha': 0.3564003760033568, 'reg_lambda': 7.2539458582324565, 'gamma': 14.516628607885085}. Best is trial 185 with value: -0.13736913884889673.
[I 2026-07-17 11:46:14,717] Trial 215 finished with value: -0.13715503842827298 and parameters: {'scalers': 'robust', 'ratios': 'norm_ratio', 'imputers': 'none', 'n_estimators': 150, 'learning_rate': 0.00013653282252333894, 'max_depth': 12, 'min_child_weight': 8, 'subsample': 0.8, 'colsample_bytree': 0.5, 'colsample_bylevel': 0.6, 'reg_alpha': 0.0733296533217777, 'reg_lambda': 7.299969730872449, 'gamma': 16.178188572169407}. Best is trial 185 with value: -0.13736913884889673.
[I 2026-07-17 11:46:14,991] Trial 216 finished with value: -0.1371571863971918 and parameters: {'scalers': 'robust', 'ratios': 'norm_ratio', 'imputers': 'none', 'n_estimators': 150, 'learning_rate': 0.0001359014259089631, 'max_depth': 12, 'min_child_weight': 8, 'subsample': 0.8, 'colsample_bytree': 0.5, 'colsample_bylevel': 0.6, 'reg_alpha': 0.08059211239965594, 'reg_lambda': 4.016255742828591, 'gamma': 15.974561630136922}. Best is trial 185 with value: -0.13736913884889673.
[I 2026-07-17 11:46:15,334] Trial 217 finished with value: -0.13715957564520107 and parameters: {'scalers': 'robust', 'ratios': 'norm_ratio', 'imputers': 'none', 'n_estimators': 150, 'learning_rate': 0.00013430610544914193, 'max_depth': 12, 'min_child_weight': 9, 'subsample': 0.8, 'colsample_bytree': 0.5, 'colsample_bylevel': 0.6, 'reg_alpha': 0.35390727506737246, 'reg_lambda': 7.694204553726242, 'gamma': 13.457607663350421}. Best is trial 185 with value: -0.13736913884889673.
[I 2026-07-17 11:46:15,649] Trial 218 finished with value: -0.1371404233136152 and parameters: {'scalers': 'robust', 'ratios': 'norm_ratio', 'imputers': 'none', 'n_estimators': 150, 'learning_rate': 0.0001415865270019526, 'max_depth': 12, 'min_child_weight': 9, 'subsample': 0.8, 'colsample_bytree': 0.5, 'colsample_bylevel': 0.6, 'reg_alpha': 0.29863694378950245, 'reg_lambda': 4.480058403212203, 'gamma': 19.804004770959764}. Best is trial 185 with value: -0.13736913884889673.
[I 2026-07-17 11:46:15,973] Trial 219 finished with value: -0.137147157778119 and parameters: {'scalers': 'robust', 'ratios': 'norm_ratio', 'imputers': 'none', 'n_estimators': 150, 'learning_rate': 0.00013954029287030354, 'max_depth': 12, 'min_child_weight': 9, 'subsample': 0.8, 'colsample_bytree': 0.5, 'colsample_bylevel': 0.6, 'reg_alpha': 0.3304287751899429, 'reg_lambda': 4.318224704903423, 'gamma': 17.59841306151379}. Best is trial 185 with value: -0.13736913884889673.
[I 2026-07-17 11:46:16,252] Trial 220 finished with value: -0.13715990995831573 and parameters: {'scalers': 'robust', 'ratios': 'norm_ratio', 'imputers': 'none', 'n_estimators': 150, 'learning_rate': 0.0001351012943775603, 'max_depth': 12, 'min_child_weight': 9, 'subsample': 0.8, 'colsample_bytree': 0.5, 'colsample_bylevel': 0.6, 'reg_alpha': 0.32862577545123195, 'reg_lambda': 5.772622077770713, 'gamma': 18.040690434765885}. Best is trial 185 with value: -0.13736913884889673.
[I 2026-07-17 11:46:16,527] Trial 221 finished with value: -0.1371539183372724 and parameters: {'scalers': 'robust', 'ratios': 'norm_ratio', 'imputers': 'none', 'n_estimators': 150, 'learning_rate': 0.00013856993041658217, 'max_depth': 12, 'min_child_weight': 8, 'subsample': 0.8, 'colsample_bytree': 0.5, 'colsample_bylevel': 0.6, 'reg_alpha': 0.3101602421630996, 'reg_lambda': 7.007589115724445, 'gamma': 19.787103531167723}. Best is trial 185 with value: -0.13736913884889673.
[I 2026-07-17 11:46:17,066] Trial 222 finished with value: -0.13714642851858946 and parameters: {'scalers': 'robust', 'ratios': 'norm_ratio', 'imputers': 'none', 'n_estimators': 150, 'learning_rate': 0.00013978359204729824, 'max_depth': 12, 'min_child_weight': 8, 'subsample': 0.8, 'colsample_bytree': 0.5, 'colsample_bylevel': 0.6, 'reg_alpha': 0.08033205672629554, 'reg_lambda': 3.9892440866666807, 'gamma': 19.33030826902952}. Best is trial 185 with value: -0.13736913884889673.
[I 2026-07-17 11:46:17,360] Trial 223 finished with value: -0.13714797520810917 and parameters: {'scalers': 'robust', 'ratios': 'norm_ratio', 'imputers': 'none', 'n_estimators': 150, 'learning_rate': 0.00013910527460130452, 'max_depth': 12, 'min_child_weight': 8, 'subsample': 0.8, 'colsample_bytree': 0.5, 'colsample_bylevel': 0.6, 'reg_alpha': 0.07588283959913415, 'reg_lambda': 3.5145426362487964, 'gamma': 16.217293766124786}. Best is trial 185 with value: -0.13736913884889673.
[I 2026-07-17 11:46:17,660] Trial 224 finished with value: -0.1371541062039797 and parameters: {'scalers': 'robust', 'ratios': 'norm_ratio', 'imputers': 'none', 'n_estimators': 150, 'learning_rate': 0.00013682637443527878, 'max_depth': 12, 'min_child_weight': 1, 'subsample': 0.8, 'colsample_bytree': 0.5, 'colsample_bylevel': 0.6, 'reg_alpha': 0.37075248824135704, 'reg_lambda': 4.339373728469641, 'gamma': 15.198165612182706}. Best is trial 185 with value: -0.13736913884889673.
