[I 2026-07-17 11:44:38,634] Trial 135 finished with value: -0.13610616041525403 and parameters: {'scalers': 'standard', 'ratios': 'log_ratio', 'imputers': 'median', 'n_estimators': 100, 'learning_rate': 0.00029222636565188754, 'max_depth': 12, 'min_child_weight': 9, 'subsample': 0.8, 'colsample_bytree': 0.5, 'colsample_bylevel': 0.9, 'reg_alpha': 4.725385980137106e-06, 'reg_lambda': 42.71464225686949, 'gamma': 0.002270692110924141}. Best is trial 128 with value: -0.13682012279416167.
[I 2026-07-17 11:44:39,428] Trial 136 finished with value: -0.13604135958295765 and parameters: {'scalers': 'standard', 'ratios': 'log_ratio', 'imputers': 'median', 'n_estimators': 100, 'learning_rate': 0.00030658467586571945, 'max_depth': 12, 'min_child_weight': 9, 'subsample': 0.8, 'colsample_bytree': 0.5, 'colsample_bylevel': 0.6, 'reg_alpha': 1.5807360775986322e-05, 'reg_lambda': 43.22827044678304, 'gamma': 0.005011431844331084}. Best is trial 128 with value: -0.13682012279416167.
[I 2026-07-17 11:44:40,588] Trial 137 finished with value: -0.1360409869704388 and parameters: {'scalers': 'standard', 'ratios': 'log_ratio', 'imputers': 'median', 'n_estimators': 100, 'learning_rate': 0.0002698219414191863, 'max_depth': 12, 'min_child_weight': 9, 'subsample': 0.8, 'colsample_bytree': 0.5, 'colsample_bylevel': 1.0, 'reg_alpha': 2.0435270750767493e-06, 'reg_lambda': 20.18729899074446, 'gamma': 0.001855943554530333}. Best is trial 128 with value: -0.13682012279416167.
[I 2026-07-17 11:44:41,591] Trial 138 finished with value: -0.1361743679110648 and parameters: {'scalers': 'standard', 'ratios': 'log_ratio', 'imputers': 'median', 'n_estimators': 100, 'learning_rate': 0.00029626028851603806, 'max_depth': 12, 'min_child_weight': 9, 'subsample': 0.8, 'colsample_bytree': 0.5, 'colsample_bylevel': 0.7, 'reg_alpha': 4.583083359743403e-06, 'reg_lambda': 43.830380859518485, 'gamma': 0.004994899995446725}. Best is trial 128 with value: -0.13682012279416167.
[I 2026-07-17 11:44:42,496] Trial 139 finished with value: -0.13609366669443587 and parameters: {'scalers': 'standard', 'ratios': 'log_ratio', 'imputers': 'median', 'n_estimators': 100, 'learning_rate': 0.0003032642126953927, 'max_depth': 12, 'min_child_weight': 9, 'subsample': 0.8, 'colsample_bytree': 0.5, 'colsample_bylevel': 0.7, 'reg_alpha': 4.440306413152425e-06, 'reg_lambda': 46.69521645599092, 'gamma': 0.003429267572799628}. Best is trial 128 with value: -0.13682012279416167.
[I 2026-07-17 11:44:43,543] Trial 140 finished with value: -0.13613910294042367 and parameters: {'scalers': 'standard', 'ratios': 'log_ratio', 'imputers': 'median', 'n_estimators': 100, 'learning_rate': 0.00029240597815527014, 'max_depth': 12, 'min_child_weight': 9, 'subsample': 0.8, 'colsample_bytree': 0.5, 'colsample_bylevel': 0.7, 'reg_alpha': 1.8413030506331945e-06, 'reg_lambda': 17.225786539506892, 'gamma': 0.0025917127377004727}. Best is trial 128 with value: -0.13682012279416167.
[I 2026-07-17 11:44:44,564] Trial 141 finished with value: -0.136964029778239 and parameters: {'scalers': 'standard', 'ratios': 'log_ratio', 'imputers': 'median', 'n_estimators': 100, 'learning_rate': 0.00012058430243113312, 'max_depth': 12, 'min_child_weight': 9, 'subsample': 0.8, 'colsample_bytree': 0.5, 'colsample_bylevel': 0.9, 'reg_alpha': 2.067484092545631e-06, 'reg_lambda': 71.4768194437853, 'gamma': 0.0022519425586285413}. Best is trial 141 with value: -0.136964029778239.
[I 2026-07-17 11:44:46,078] Trial 142 finished with value: -0.13694144668476113 and parameters: {'scalers': 'standard', 'ratios': 'log_ratio', 'imputers': 'median', 'n_estimators': 100, 'learning_rate': 0.00012631533157418697, 'max_depth': 12, 'min_child_weight': 9, 'subsample': 0.8, 'colsample_bytree': 0.5, 'colsample_bylevel': 0.7, 'reg_alpha': 2.2321647415127394e-06, 'reg_lambda': 69.58070596480134, 'gamma': 0.0017697083947910872}. Best is trial 141 with value: -0.136964029778239.
[I 2026-07-17 11:44:46,129] Trial 143 finished with value: -0.13699984816465163 and parameters: {'scalers': 'standard', 'ratios': 'log_ratio', 'imputers': 'median', 'n_estimators': 100, 'learning_rate': 0.00012086255341506701, 'max_depth': 12, 'min_child_weight': 9, 'subsample': 0.8, 'colsample_bytree': 0.5, 'colsample_bylevel': 0.7, 'reg_alpha': 2.8028942976973388e-06, 'reg_lambda': 69.2555354919709, 'gamma': 0.031070663676699736}. Best is trial 143 with value: -0.13699984816465163.
[I 2026-07-17 11:44:48,498] Trial 144 finished with value: -0.13567897012697036 and parameters: {'scalers': 'standard', 'ratios': 'log_ratio', 'imputers': 'median', 'n_estimators': 300, 'learning_rate': 0.00013285110094300804, 'max_depth': 12, 'min_child_weight': 9, 'subsample': 0.8, 'colsample_bytree': 0.5, 'colsample_bylevel': 0.7, 'reg_alpha': 2.699863441015467e-06, 'reg_lambda': 72.31317481766531, 'gamma': 0.015412299311495068}. Best is trial 143 with value: -0.13699984816465163.
[I 2026-07-17 11:44:50,988] Trial 145 finished with value: -0.13566050058095772 and parameters: {'scalers': 'standard', 'ratios': 'log_ratio', 'imputers': 'median', 'n_estimators': 300, 'learning_rate': 0.0001318479385892037, 'max_depth': 12, 'min_child_weight': 9, 'subsample': 0.7, 'colsample_bytree': 0.5, 'colsample_bylevel': 0.9, 'reg_alpha': 3.3814026779338142e-06, 'reg_lambda': 63.25798698436014, 'gamma': 0.01583807680719614}. Best is trial 143 with value: -0.13699984816465163.
[I 2026-07-17 11:45:23,641] Trial 146 finished with value: -0.11202335420696366 and parameters: {'scalers': 'standard', 'ratios': 'log_ratio', 'imputers': 'median', 'n_estimators': 3000, 'learning_rate': 0.4831650941483772, 'max_depth': 12, 'min_child_weight': 9, 'subsample': 0.7, 'colsample_bytree': 0.5, 'colsample_bylevel': 0.7, 'reg_alpha': 1.022706069709546e-06, 'reg_lambda': 70.41842401926023, 'gamma': 0.001340181968729434}. Best is trial 143 with value: -0.13699984816465163.
[I 2026-07-17 11:45:26,427] Trial 147 finished with value: -0.13548976701207352 and parameters: {'scalers': 'standard', 'ratios': 'log_ratio', 'imputers': 'median', 'n_estimators': 350, 'learning_rate': 0.00012252634214452666, 'max_depth': 12, 'min_child_weight': 10, 'subsample': 0.7, 'colsample_bytree': 0.5, 'colsample_bylevel': 0.9, 'reg_alpha': 2.6562423134024776e-06, 'reg_lambda': 73.91576808362846, 'gamma': 0.01138152246031787}. Best is trial 143 with value: -0.13699984816465163.
[I 2026-07-17 11:45:28,878] Trial 148 finished with value: -0.13572495147616406 and parameters: {'scalers': 'standard', 'ratios': 'log_ratio', 'imputers': 'median', 'n_estimators': 300, 'learning_rate': 0.00012814522895775984, 'max_depth': 12, 'min_child_weight': 9, 'subsample': 0.8, 'colsample_bytree': 0.5, 'colsample_bylevel': 0.7, 'reg_alpha': 2.826288246145374e-06, 'reg_lambda': 64.19987486181697, 'gamma': 0.014526170861313038}. Best is trial 143 with value: -0.13699984816465163.
[I 2026-07-17 11:45:31,378] Trial 149 finished with value: -0.13579008803629003 and parameters: {'scalers': 'standard', 'ratios': 'log_ratio', 'imputers': 'median', 'n_estimators': 300, 'learning_rate': 0.00012058410822889164, 'max_depth': 12, 'min_child_weight': 10, 'subsample': 0.7, 'colsample_bytree': 0.5, 'colsample_bylevel': 0.9, 'reg_alpha': 2.8718005064750285e-06, 'reg_lambda': 70.60598886211531, 'gamma': 0.0011750110376003511}. Best is trial 143 with value: -0.13699984816465163.
[I 2026-07-17 11:45:33,886] Trial 151 finished with value: -0.13582919906472452 and parameters: {'scalers': 'standard', 'ratios': 'log_ratio', 'imputers': 'median', 'n_estimators': 300, 'learning_rate': 0.0001220490431582439, 'max_depth': 12, 'min_child_weight': 9, 'subsample': 0.8, 'colsample_bytree': 0.5, 'colsample_bylevel': 0.7, 'reg_alpha': 2.70924487085832e-06, 'reg_lambda': 66.59777492360594, 'gamma': 0.01518663038197593}. Best is trial 143 with value: -0.13699984816465163.
[I 2026-07-17 11:45:36,952] Trial 150 finished with value: -0.13588294880802881 and parameters: {'scalers': 'standard', 'ratios': 'log_ratio', 'imputers': 'median', 'n_estimators': 300, 'learning_rate': 0.00011871168259102717, 'max_depth': 12, 'min_child_weight': 9, 'subsample': 0.8, 'colsample_bytree': 0.5, 'colsample_bylevel': 0.7, 'reg_alpha': 2.6743708321856678e-06, 'reg_lambda': 5.132304524367514, 'gamma': 0.021447416861569167}. Best is trial 143 with value: -0.13699984816465163.
[I 2026-07-17 11:45:38,336] Trial 152 finished with value: -0.13597341880132494 and parameters: {'scalers': 'standard', 'ratios': 'log_ratio', 'imputers': 'median', 'n_estimators': 300, 'learning_rate': 0.00011405748994431144, 'max_depth': 12, 'min_child_weight': 9, 'subsample': 0.8, 'colsample_bytree': 0.5, 'colsample_bylevel': 0.7, 'reg_alpha': 1.242265770225585e-06, 'reg_lambda': 75.7528771924291, 'gamma': 0.0906225997560152}. Best is trial 143 with value: -0.13699984816465163.
[I 2026-07-17 11:45:39,158] Trial 153 finished with value: -0.13643643794996452 and parameters: {'scalers': 'standard', 'ratios': 'log_ratio', 'imputers': 'median', 'n_estimators': 200, 'learning_rate': 0.0001208349075114459, 'max_depth': 12, 'min_child_weight': 9, 'subsample': 0.8, 'colsample_bytree': 0.5, 'colsample_bylevel': 0.7, 'reg_alpha': 1.4691459849135377e-06, 'reg_lambda': 72.06929716136692, 'gamma': 0.09062513095319699}. Best is trial 143 with value: -0.13699984816465163.
[I 2026-07-17 11:45:39,930] Trial 154 finished with value: -0.1365414159127586 and parameters: {'scalers': 'standard', 'ratios': 'log_ratio', 'imputers': 'median', 'n_estimators': 200, 'learning_rate': 0.0001166858923764203, 'max_depth': 12, 'min_child_weight': 10, 'subsample': 0.8, 'colsample_bytree': 0.5, 'colsample_bylevel': 0.7, 'reg_alpha': 1.4637277561485206e-06, 'reg_lambda': 5.394551342471585, 'gamma': 0.7511169340249357}. Best is trial 143 with value: -0.13699984816465163.
[I 2026-07-17 11:45:42,093] Trial 155 finished with value: -0.1364429225718892 and parameters: {'scalers': 'standard', 'ratios': 'log_ratio', 'imputers': 'median', 'n_estimators': 200, 'learning_rate': 0.00011817350707738061, 'max_depth': 12, 'min_child_weight': 9, 'subsample': 0.8, 'colsample_bytree': 0.5, 'colsample_bylevel': 0.7, 'reg_alpha': 1.4270295224887717e-06, 'reg_lambda': 5.103204219519287, 'gamma': 0.0005811924462559368}. Best is trial 143 with value: -0.13699984816465163.
[I 2026-07-17 11:45:44,118] Trial 156 finished with value: -0.13605551834048282 and parameters: {'scalers': 'standard', 'ratios': 'log_ratio', 'imputers': 'none', 'n_estimators': 200, 'learning_rate': 0.000158678599200184, 'max_depth': 12, 'min_child_weight': 10, 'subsample': 0.8, 'colsample_bytree': 0.5, 'colsample_bylevel': 0.7, 'reg_alpha': 1.5335415141967912e-06, 'reg_lambda': 7.174933733391482, 'gamma': 0.0006062967830553964}. Best is trial 143 with value: -0.13699984816465163.
[I 2026-07-17 11:45:45,507] Trial 157 finished with value: -0.13616112379789672 and parameters: {'scalers': 'standard', 'ratios': 'log_ratio', 'imputers': 'none', 'n_estimators': 200, 'learning_rate': 0.00015263844615385266, 'max_depth': 12, 'min_child_weight': 8, 'subsample': 0.8, 'colsample_bytree': 0.5, 'colsample_bylevel': 0.7, 'reg_alpha': 1.3367616525674552e-06, 'reg_lambda': 5.451514393475698, 'gamma': 0.2608858680388147}. Best is trial 143 with value: -0.13699984816465163.
[I 2026-07-17 11:45:47,101] Trial 158 finished with value: -0.13599223085689627 and parameters: {'scalers': 'standard', 'ratios': 'log_ratio', 'imputers': 'median', 'n_estimators': 200, 'learning_rate': 0.0001673995023644109, 'max_depth': 12, 'min_child_weight': 10, 'subsample': 0.7, 'colsample_bytree': 0.5, 'colsample_bylevel': 0.7, 'reg_alpha': 1.3321217453662784e-06, 'reg_lambda': 5.86394711585145, 'gamma': 0.07343998840217465}. Best is trial 143 with value: -0.13699984816465163.
[I 2026-07-17 11:45:48,126] Trial 159 finished with value: -0.13603022623950986 and parameters: {'scalers': 'standard', 'ratios': 'log_ratio', 'imputers': 'median', 'n_estimators': 200, 'learning_rate': 0.00016575309825617147, 'max_depth': 12, 'min_child_weight': 10, 'subsample': 0.7, 'colsample_bytree': 0.5, 'colsample_bylevel': 0.7, 'reg_alpha': 1.310637670683167e-06, 'reg_lambda': 88.88401094678359, 'gamma': 0.07389457896759323}. Best is trial 143 with value: -0.13699984816465163.
[I 2026-07-17 11:45:49,546] Trial 160 finished with value: -0.1360757944938341 and parameters: {'scalers': 'standard', 'ratios': 'log_ratio', 'imputers': 'median', 'n_estimators': 200, 'learning_rate': 0.0001593869612765181, 'max_depth': 12, 'min_child_weight': 10, 'subsample': 0.7, 'colsample_bytree': 0.5, 'colsample_bylevel': 0.7, 'reg_alpha': 1.6439143219903941e-06, 'reg_lambda': 97.42062161311686, 'gamma': 0.0006055476324601152}. Best is trial 143 with value: -0.13699984816465163.
[I 2026-07-17 11:45:51,520] Trial 161 finished with value: -0.13608627580026686 and parameters: {'scalers': 'standard', 'ratios': 'log_ratio', 'imputers': 'median', 'n_estimators': 200, 'learning_rate': 0.00015575999125818293, 'max_depth': 12, 'min_child_weight': 8, 'subsample': 0.8, 'colsample_bytree': 0.5, 'colsample_bylevel': 0.7, 'reg_alpha': 1.5863116115379638e-06, 'reg_lambda': 8.660960007443638, 'gamma': 0.04199342317259914}. Best is trial 143 with value: -0.13699984816465163.
[I 2026-07-17 11:45:52,711] Trial 162 finished with value: -0.13623390496056906 and parameters: {'scalers': 'standard', 'ratios': 'log_ratio', 'imputers': 'none', 'n_estimators': 200, 'learning_rate': 0.0001501872470829272, 'max_depth': 12, 'min_child_weight': 8, 'subsample': 0.8, 'colsample_bytree': 0.5, 'colsample_bylevel': 0.7, 'reg_alpha': 1.4764489914597863e-06, 'reg_lambda': 6.91043681970998, 'gamma': 0.40354362345036465}. Best is trial 143 with value: -0.13699984816465163.
[I 2026-07-17 11:45:53,135] Trial 163 finished with value: -0.13641635467225427 and parameters: {'scalers': 'standard', 'ratios': 'norm_ratio', 'imputers': 'none', 'n_estimators': 200, 'learning_rate': 0.00014711226088440416, 'max_depth': 12, 'min_child_weight': 9, 'subsample': 0.8, 'colsample_bytree': 0.5, 'colsample_bylevel': 0.7, 'reg_alpha': 1.413323025987184e-06, 'reg_lambda': 96.15457594562923, 'gamma': 0.5942770751761668}. Best is trial 143 with value: -0.13699984816465163.
[I 2026-07-17 11:45:53,580] Trial 164 finished with value: -0.1363983237054145 and parameters: {'scalers': 'standard', 'ratios': 'norm_ratio', 'imputers': 'median', 'n_estimators': 200, 'learning_rate': 0.00014948807665551736, 'max_depth': 12, 'min_child_weight': 9, 'subsample': 0.8, 'colsample_bytree': 0.5, 'colsample_bylevel': 0.7, 'reg_alpha': 1.1317055827003068e-06, 'reg_lambda': 94.72074890008379, 'gamma': 1.5305440706032656}. Best is trial 143 with value: -0.13699984816465163.
[I 2026-07-17 11:45:54,872] Trial 165 finished with value: -0.1368050210301838 and parameters: {'scalers': 'standard', 'ratios': 'norm_ratio', 'imputers': 'median', 'n_estimators': 150, 'learning_rate': 0.00010211846833622786, 'max_depth': 12, 'min_child_weight': 9, 'subsample': 0.8, 'colsample_bytree': 0.5, 'colsample_bylevel': 0.7, 'reg_alpha': 1.56637005788483e-06, 'reg_lambda': 22.683318929204116, 'gamma': 0.04152634466044776}. Best is trial 143 with value: -0.13699984816465163.
[I 2026-07-17 11:45:55,236] Trial 166 finished with value: -0.13695740427486217 and parameters: {'scalers': 'standard', 'ratios': 'log_ratio', 'imputers': 'median', 'n_estimators': 150, 'learning_rate': 0.00010531329236589657, 'max_depth': 12, 'min_child_weight': 9, 'subsample': 0.8, 'colsample_bytree': 0.5, 'colsample_bylevel': 0.7, 'reg_alpha': 1.008200052024413e-06, 'reg_lambda': 99.98440445546349, 'gamma': 1.2346864193032943}. Best is trial 143 with value: -0.13699984816465163.
[I 2026-07-17 11:45:55,905] Trial 167 finished with value: -0.13635861764622068 and parameters: {'scalers': 'standard', 'ratios': 'norm_ratio', 'imputers': 'median', 'n_estimators': 150, 'learning_rate': 0.0002008989835717063, 'max_depth': 12, 'min_child_weight': 9, 'subsample': 0.8, 'colsample_bytree': 0.5, 'colsample_bylevel': 0.7, 'reg_alpha': 1.7381613250470033e-06, 'reg_lambda': 19.844428516293913, 'gamma': 0.469664101756132}. Best is trial 143 with value: -0.13699984816465163.
[I 2026-07-17 11:45:56,318] Trial 168 finished with value: -0.1369787405580146 and parameters: {'scalers': 'standard', 'ratios': 'log_ratio', 'imputers': 'median', 'n_estimators': 150, 'learning_rate': 0.00010320766815741194, 'max_depth': 12, 'min_child_weight': 9, 'subsample': 0.8, 'colsample_bytree': 0.5, 'colsample_bylevel': 0.7, 'reg_alpha': 3.788106275020117e-06, 'reg_lambda': 21.61034848101055, 'gamma': 1.9225683296069902}. Best is trial 143 with value: -0.13699984816465163.
[I 2026-07-17 11:45:56,739] Trial 169 finished with value: -0.13698046715582843 and parameters: {'scalers': 'standard', 'ratios': 'norm_ratio', 'imputers': 'median', 'n_estimators': 150, 'learning_rate': 0.00010687665211966636, 'max_depth': 12, 'min_child_weight': 9, 'subsample': 0.8, 'colsample_bytree': 0.5, 'colsample_bylevel': 0.7, 'reg_alpha': 3.940675058810621e-06, 'reg_lambda': 21.984052519037085, 'gamma': 2.5563518107238}. Best is trial 143 with value: -0.13699984816465163.
[I 2026-07-17 11:45:57,241] Trial 170 finished with value: -0.13692219172599057 and parameters: {'scalers': 'standard', 'ratios': 'norm_ratio', 'imputers': 'median', 'n_estimators': 150, 'learning_rate': 0.00010026517527998313, 'max_depth': 12, 'min_child_weight': 9, 'subsample': 0.8, 'colsample_bytree': 0.5, 'colsample_bylevel': 0.7, 'reg_alpha': 3.887860646518153e-06, 'reg_lambda': 20.88796294963821, 'gamma': 0.6569181895524122}. Best is trial 143 with value: -0.13699984816465163.
[I 2026-07-17 11:45:58,724] Trial 171 finished with value: -0.13619873179180256 and parameters: {'scalers': 'standard', 'ratios': 'norm_ratio', 'imputers': 'none', 'n_estimators': 150, 'learning_rate': 0.0001935460966012562, 'max_depth': 12, 'min_child_weight': 9, 'subsample': 0.8, 'colsample_bytree': 0.5, 'colsample_bylevel': 0.7, 'reg_alpha': 3.2666803333377905e-06, 'reg_lambda': 21.61717771159988, 'gamma': 0.0017178195211707866}. Best is trial 143 with value: -0.13699984816465163.
[I 2026-07-17 11:45:59,192] Trial 172 finished with value: -0.13709858863214694 and parameters: {'scalers': 'standard', 'ratios': 'norm_ratio', 'imputers': 'none', 'n_estimators': 100, 'learning_rate': 0.00010280628093263167, 'max_depth': 12, 'min_child_weight': 9, 'subsample': 0.8, 'colsample_bytree': 0.5, 'colsample_bylevel': 0.7, 'reg_alpha': 3.8276196875375105e-06, 'reg_lambda': 21.078722505717437, 'gamma': 1.033945268131772}. Best is trial 172 with value: -0.13709858863214694.
[I 2026-07-17 11:45:59,571] Trial 173 finished with value: -0.13710160932942156 and parameters: {'scalers': 'standard', 'ratios': 'norm_ratio', 'imputers': 'none', 'n_estimators': 100, 'learning_rate': 0.00010091881541771008, 'max_depth': 12, 'min_child_weight': 9, 'subsample': 0.8, 'colsample_bytree': 0.5, 'colsample_bylevel': 0.7, 'reg_alpha': 3.733698608734815e-06, 'reg_lambda': 21.90642452363643, 'gamma': 0.7695658486525244}. Best is trial 173 with value: -0.13710160932942156.
[I 2026-07-17 11:45:59,889] Trial 174 finished with value: -0.13711927398058119 and parameters: {'scalers': 'standard', 'ratios': 'norm_ratio', 'imputers': 'none', 'n_estimators': 100, 'learning_rate': 0.00010331355770856285, 'max_depth': 12, 'min_child_weight': 9, 'subsample': 0.8, 'colsample_bytree': 0.5, 'colsample_bylevel': 0.7, 'reg_alpha': 2.1121600089289386e-06, 'reg_lambda': 24.551434743331527, 'gamma': 0.7067702716395352}. Best is trial 174 with value: -0.13711927398058119.
[I 2026-07-17 11:46:00,310] Trial 175 finished with value: -0.1370875134536724 and parameters: {'scalers': 'standard', 'ratios': 'norm_ratio', 'imputers': 'mean', 'n_estimators': 100, 'learning_rate': 0.0001058216939654863, 'max_depth': 12, 'min_child_weight': 9, 'subsample': 0.8, 'colsample_bytree': 0.5, 'colsample_bylevel': 0.7, 'reg_alpha': 4.121476620867551e-06, 'reg_lambda': 33.19446741140211, 'gamma': 0.6929783241909385}. Best is trial 174 with value: -0.13711927398058119.
[I 2026-07-17 11:46:00,506] Trial 176 finished with value: -0.13721910637898713 and parameters: {'scalers': 'robust', 'ratios': 'norm_ratio', 'imputers': 'median', 'n_estimators': 100, 'learning_rate': 0.00010303047838782681, 'max_depth': 12, 'min_child_weight': 9, 'subsample': 0.8, 'colsample_bytree': 0.5, 'colsample_bylevel': 0.6, 'reg_alpha': 0.10252849971352024, 'reg_lambda': 22.96619012794855, 'gamma': 2.169548799683089}. Best is trial 176 with value: -0.13721910637898713.
[I 2026-07-17 11:46:00,668] Trial 177 finished with value: -0.13732505496931563 and parameters: {'scalers': 'robust', 'ratios': 'norm_ratio', 'imputers': 'median', 'n_estimators': 100, 'learning_rate': 0.00010062372984995244, 'max_depth': 12, 'min_child_weight': 9, 'subsample': 0.8, 'colsample_bytree': 0.5, 'colsample_bylevel': 0.6, 'reg_alpha': 3.904356313774141e-06, 'reg_lambda': 14.713539758901177, 'gamma': 5.2641928820829476}. Best is trial 177 with value: -0.13732505496931563.
[I 2026-07-17 11:46:01,057] Trial 178 finished with value: -0.13715172048135066 and parameters: {'scalers': 'standard', 'ratios': 'norm_ratio', 'imputers': 'median', 'n_estimators': 100, 'learning_rate': 0.000102628281935977, 'max_depth': 12, 'min_child_weight': 9, 'subsample': 0.8, 'colsample_bytree': 0.5, 'colsample_bylevel': 0.7, 'reg_alpha': 3.35796121984039e-06, 'reg_lambda': 14.707769773980733, 'gamma': 1.2264687151289286}. Best is trial 177 with value: -0.13732505496931563.
[I 2026-07-17 11:46:01,336] Trial 179 finished with value: -0.1372494123855582 and parameters: {'scalers': 'robust', 'ratios': 'norm_ratio', 'imputers': 'median', 'n_estimators': 100, 'learning_rate': 0.00010630857964006312, 'max_depth': 12, 'min_child_weight': 9, 'subsample': 0.8, 'colsample_bytree': 0.5, 'colsample_bylevel': 0.6, 'reg_alpha': 3.396940523179421e-06, 'reg_lambda': 33.18877109256661, 'gamma': 3.489002988793912}. Best is trial 177 with value: -0.13732505496931563.
