[I 2026-07-17 11:47:39,713] A new study created in RDB with name: mult_quant_study_v2
[I 2026-07-17 11:47:51,807] Trial 0 finished with value: -1.4964456642327404 and parameters: {'scalers': 'robust', 'ratios': 'log_ratio', 'imputers': 'median', 'n_estimators': 650, 'learning_rate': 0.2567376623218067, 'max_depth': 12, 'min_child_weight': 2, 'subsample': 0.8, 'colsample_bytree': 0.8, 'colsample_bylevel': 0.8, 'reg_alpha': 8.032915757539469, 'reg_lambda': 62.92087148830389, 'gamma': 2.7238390827074434e-06}. Best is trial 0 with value: -1.4964456642327404.
[I 2026-07-17 11:47:53,529] Trial 1 finished with value: -1.3819389136583557 and parameters: {'scalers': 'standard', 'ratios': 'log_ratio', 'imputers': 'mean', 'n_estimators': 850, 'learning_rate': 0.19102164169567148, 'max_depth': 7, 'min_child_weight': 7, 'subsample': 1.0, 'colsample_bytree': 0.9, 'colsample_bylevel': 0.9, 'reg_alpha': 1.1730190285656e-06, 'reg_lambda': 0.003393621352084653, 'gamma': 16.05868976051239}. Best is trial 0 with value: -1.4964456642327404.
[I 2026-07-17 11:47:57,417] Trial 3 finished with value: -1.3363484039222682 and parameters: {'scalers': 'none', 'ratios': 'norm_ratio', 'imputers': 'median', 'n_estimators': 1900, 'learning_rate': 0.1325369869915772, 'max_depth': 11, 'min_child_weight': 10, 'subsample': 1.0, 'colsample_bytree': 0.9, 'colsample_bylevel': 0.9, 'reg_alpha': 0.734212104248873, 'reg_lambda': 1.6612050200054282, 'gamma': 4.821998647935851}. Best is trial 0 with value: -1.4964456642327404.
[I 2026-07-17 11:48:21,090] Trial 2 finished with value: -1.3876213023215824 and parameters: {'scalers': 'standard', 'ratios': 'norm_ratio', 'imputers': 'none', 'n_estimators': 1800, 'learning_rate': 0.0004102308179319657, 'max_depth': 8, 'min_child_weight': 2, 'subsample': 0.8, 'colsample_bytree': 0.7, 'colsample_bylevel': 0.6, 'reg_alpha': 6.238643545281557e-06, 'reg_lambda': 0.0002334768707789707, 'gamma': 2.3748139696181882e-06}. Best is trial 0 with value: -1.4964456642327404.
[I 2026-07-17 11:49:11,798] Trial 4 finished with value: -1.2871090400028216 and parameters: {'scalers': 'none', 'ratios': 'log_ratio', 'imputers': 'mean', 'n_estimators': 2650, 'learning_rate': 0.0006015921557265252, 'max_depth': 9, 'min_child_weight': 3, 'subsample': 1.0, 'colsample_bytree': 1.0, 'colsample_bylevel': 0.5, 'reg_alpha': 0.009764294949388285, 'reg_lambda': 6.848391275003654, 'gamma': 0.0014604043135715361}. Best is trial 0 with value: -1.4964456642327404.
[I 2026-07-17 11:49:20,384] Trial 5 finished with value: -1.356308690265797 and parameters: {'scalers': 'robust', 'ratios': 'norm_ratio', 'imputers': 'median', 'n_estimators': 1350, 'learning_rate': 0.3283773676994636, 'max_depth': 11, 'min_child_weight': 7, 'subsample': 0.5, 'colsample_bytree': 0.7, 'colsample_bylevel': 0.8, 'reg_alpha': 3.166169883545341e-05, 'reg_lambda': 0.052741506328851454, 'gamma': 0.5042418867573587}. Best is trial 0 with value: -1.4964456642327404.
[I 2026-07-17 11:49:24,637] Trial 6 finished with value: -1.37896189128175 and parameters: {'scalers': 'robust', 'ratios': 'norm_ratio', 'imputers': 'mean', 'n_estimators': 2900, 'learning_rate': 0.46461455678147734, 'max_depth': 4, 'min_child_weight': 9, 'subsample': 0.5, 'colsample_bytree': 0.9, 'colsample_bylevel': 0.8, 'reg_alpha': 74.88558310450134, 'reg_lambda': 0.003203688891524858, 'gamma': 0.00036699799926208907}. Best is trial 0 with value: -1.4964456642327404.
[I 2026-07-17 11:49:37,262] Trial 7 finished with value: -1.2187626248105559 and parameters: {'scalers': 'none', 'ratios': 'norm_ratio', 'imputers': 'none', 'n_estimators': 2350, 'learning_rate': 0.0015263184293263093, 'max_depth': 10, 'min_child_weight': 10, 'subsample': 0.6, 'colsample_bytree': 0.8, 'colsample_bylevel': 0.7, 'reg_alpha': 0.0169662512897999, 'reg_lambda': 41.89625177144153, 'gamma': 0.30003941887135255}. Best is trial 0 with value: -1.4964456642327404.
[I 2026-07-17 11:49:43,776] Trial 8 finished with value: -1.38889035770802 and parameters: {'scalers': 'standard', 'ratios': 'norm_ratio', 'imputers': 'median', 'n_estimators': 1950, 'learning_rate': 0.0004609670201785476, 'max_depth': 8, 'min_child_weight': 2, 'subsample': 0.6, 'colsample_bytree': 1.0, 'colsample_bylevel': 0.6, 'reg_alpha': 1.6690462417265992, 'reg_lambda': 13.314488548468317, 'gamma': 1.3117929207142867}. Best is trial 0 with value: -1.4964456642327404.
[I 2026-07-17 11:49:58,081] Trial 9 finished with value: -1.8739445148417475 and parameters: {'scalers': 'standard', 'ratios': 'log_ratio', 'imputers': 'mean', 'n_estimators': 800, 'learning_rate': 0.2536582855025335, 'max_depth': 11, 'min_child_weight': 2, 'subsample': 0.8, 'colsample_bytree': 0.7, 'colsample_bylevel': 0.8, 'reg_alpha': 5.218236704573565e-05, 'reg_lambda': 0.008404993793283386, 'gamma': 0.0007617764022688643}. Best is trial 9 with value: -1.8739445148417475.
[I 2026-07-17 11:50:04,168] Trial 10 finished with value: -1.2625475319965704 and parameters: {'scalers': 'none', 'ratios': 'norm_ratio', 'imputers': 'mean', 'n_estimators': 2850, 'learning_rate': 0.010489214707083002, 'max_depth': 7, 'min_child_weight': 1, 'subsample': 1.0, 'colsample_bytree': 1.0, 'colsample_bylevel': 0.6, 'reg_alpha': 29.479125966662167, 'reg_lambda': 5.802321043943821e-06, 'gamma': 1.180605820981304e-05}. Best is trial 9 with value: -1.8739445148417475.
[I 2026-07-17 11:50:09,950] Trial 11 finished with value: -1.2191318710905832 and parameters: {'scalers': 'none', 'ratios': 'norm_ratio', 'imputers': 'mean', 'n_estimators': 1800, 'learning_rate': 0.01220286321102845, 'max_depth': 5, 'min_child_weight': 5, 'subsample': 0.6, 'colsample_bytree': 0.9, 'colsample_bylevel': 0.9, 'reg_alpha': 12.711074061666936, 'reg_lambda': 1.2034779056108131, 'gamma': 0.0374688176021307}. Best is trial 9 with value: -1.8739445148417475.
[I 2026-07-17 11:50:17,705] Trial 12 finished with value: -1.2697290518189175 and parameters: {'scalers': 'none', 'ratios': 'norm_ratio', 'imputers': 'none', 'n_estimators': 2700, 'learning_rate': 0.0012402397676811235, 'max_depth': 10, 'min_child_weight': 10, 'subsample': 1.0, 'colsample_bytree': 0.5, 'colsample_bylevel': 0.7, 'reg_alpha': 6.517347121797231, 'reg_lambda': 0.0002706225395814313, 'gamma': 0.6777941477604938}. Best is trial 9 with value: -1.8739445148417475.
[I 2026-07-17 11:50:39,634] Trial 13 finished with value: -1.8294224834008084 and parameters: {'scalers': 'robust', 'ratios': 'log_ratio', 'imputers': 'median', 'n_estimators': 2600, 'learning_rate': 0.35205994278444186, 'max_depth': 7, 'min_child_weight': 3, 'subsample': 0.8, 'colsample_bytree': 0.7, 'colsample_bylevel': 1.0, 'reg_alpha': 0.0003847565889108539, 'reg_lambda': 0.004318993420939519, 'gamma': 0.0003976007595837344}. Best is trial 9 with value: -1.8739445148417475.
[I 2026-07-17 11:50:44,600] Trial 14 finished with value: -1.244438672755602 and parameters: {'scalers': 'standard', 'ratios': 'norm_ratio', 'imputers': 'mean', 'n_estimators': 1200, 'learning_rate': 0.05050164021881997, 'max_depth': 8, 'min_child_weight': 9, 'subsample': 0.7, 'colsample_bytree': 0.6, 'colsample_bylevel': 0.8, 'reg_alpha': 0.041717961096529386, 'reg_lambda': 2.9979854097108803e-06, 'gamma': 0.7525885836672739}. Best is trial 9 with value: -1.8739445148417475.
[I 2026-07-17 11:50:45,031] Trial 15 finished with value: -1.2756125126279327 and parameters: {'scalers': 'none', 'ratios': 'norm_ratio', 'imputers': 'mean', 'n_estimators': 750, 'learning_rate': 0.06048298638179973, 'max_depth': 10, 'min_child_weight': 1, 'subsample': 0.8, 'colsample_bytree': 0.7, 'colsample_bylevel': 0.7, 'reg_alpha': 26.68057671958955, 'reg_lambda': 0.33943653562746257, 'gamma': 0.019427290531881237}. Best is trial 9 with value: -1.8739445148417475.
[I 2026-07-17 11:50:47,950] Trial 16 finished with value: -1.4285001897296197 and parameters: {'scalers': 'standard', 'ratios': 'log_ratio', 'imputers': 'median', 'n_estimators': 1400, 'learning_rate': 0.005436000755612199, 'max_depth': 11, 'min_child_weight': 1, 'subsample': 1.0, 'colsample_bytree': 0.9, 'colsample_bylevel': 1.0, 'reg_alpha': 2.66718393517533e-06, 'reg_lambda': 2.4449176470314544e-06, 'gamma': 28.338191105955794}. Best is trial 9 with value: -1.8739445148417475.
[I 2026-07-17 11:50:48,114] Trial 17 finished with value: -1.3314394237114742 and parameters: {'scalers': 'standard', 'ratios': 'log_ratio', 'imputers': 'mean', 'n_estimators': 100, 'learning_rate': 0.011162947496970489, 'max_depth': 3, 'min_child_weight': 5, 'subsample': 0.8, 'colsample_bytree': 0.5, 'colsample_bylevel': 1.0, 'reg_alpha': 0.0003989936408246212, 'reg_lambda': 1.064876394761969e-06, 'gamma': 0.0025951993919966962}. Best is trial 9 with value: -1.8739445148417475.
[I 2026-07-17 11:50:55,370] Trial 18 finished with value: -1.357856090349964 and parameters: {'scalers': 'robust', 'ratios': 'log_ratio', 'imputers': 'median', 'n_estimators': 300, 'learning_rate': 0.03291872637804028, 'max_depth': 12, 'min_child_weight': 4, 'subsample': 0.8, 'colsample_bytree': 0.5, 'colsample_bylevel': 1.0, 'reg_alpha': 0.00047310787723780405, 'reg_lambda': 0.2206113454586083, 'gamma': 0.000559367482168552}. Best is trial 9 with value: -1.8739445148417475.
[I 2026-07-17 11:51:01,791] Trial 19 finished with value: -1.3899435510359108 and parameters: {'scalers': 'robust', 'ratios': 'log_ratio', 'imputers': 'median', 'n_estimators': 300, 'learning_rate': 0.05242078452883201, 'max_depth': 12, 'min_child_weight': 4, 'subsample': 0.8, 'colsample_bytree': 0.5, 'colsample_bylevel': 1.0, 'reg_alpha': 0.0002874563495441698, 'reg_lambda': 1.6187986294954786e-06, 'gamma': 7.205617661096098e-05}. Best is trial 9 with value: -1.8739445148417475.
[I 2026-07-17 11:51:04,419] Trial 20 finished with value: -1.31934793152451 and parameters: {'scalers': 'robust', 'ratios': 'log_ratio', 'imputers': 'median', 'n_estimators': 100, 'learning_rate': 0.05804404319841793, 'max_depth': 12, 'min_child_weight': 4, 'subsample': 0.8, 'colsample_bytree': 0.6, 'colsample_bylevel': 1.0, 'reg_alpha': 0.0004683341953908515, 'reg_lambda': 0.17200850993693012, 'gamma': 0.00019249172859764913}. Best is trial 9 with value: -1.8739445148417475.
[I 2026-07-17 11:51:05,255] Trial 21 finished with value: -1.228248896012625 and parameters: {'scalers': 'robust', 'ratios': 'log_ratio', 'imputers': 'median', 'n_estimators': 100, 'learning_rate': 0.04804479674999127, 'max_depth': 6, 'min_child_weight': 4, 'subsample': 0.8, 'colsample_bytree': 0.6, 'colsample_bylevel': 1.0, 'reg_alpha': 0.00022335366295137143, 'reg_lambda': 0.06348824592347525, 'gamma': 0.00048345855461219133}. Best is trial 9 with value: -1.8739445148417475.
[I 2026-07-17 11:51:06,657] Trial 22 finished with value: -1.2209397037660557 and parameters: {'scalers': 'robust', 'ratios': 'log_ratio', 'imputers': 'median', 'n_estimators': 250, 'learning_rate': 0.04183312820299271, 'max_depth': 5, 'min_child_weight': 4, 'subsample': 0.8, 'colsample_bytree': 0.6, 'colsample_bylevel': 1.0, 'reg_alpha': 0.0003186899610060574, 'reg_lambda': 0.07189838427199315, 'gamma': 0.0005174368058710833}. Best is trial 9 with value: -1.8739445148417475.
[I 2026-07-17 11:51:10,700] Trial 23 finished with value: -1.2128620976962363 and parameters: {'scalers': 'robust', 'ratios': 'log_ratio', 'imputers': 'median', 'n_estimators': 1250, 'learning_rate': 0.030568130204947773, 'max_depth': 3, 'min_child_weight': 4, 'subsample': 0.9, 'colsample_bytree': 0.6, 'colsample_bylevel': 1.0, 'reg_alpha': 0.0003010388006453295, 'reg_lambda': 0.022950339428498286, 'gamma': 0.00012799387768567513}. Best is trial 9 with value: -1.8739445148417475.
[I 2026-07-17 11:51:11,752] Trial 24 finished with value: -1.2015958756068568 and parameters: {'scalers': 'robust', 'ratios': 'log_ratio', 'imputers': 'median', 'n_estimators': 300, 'learning_rate': 0.04969099469809425, 'max_depth': 3, 'min_child_weight': 4, 'subsample': 0.9, 'colsample_bytree': 0.6, 'colsample_bylevel': 1.0, 'reg_alpha': 0.00023007288399181462, 'reg_lambda': 0.0232988358841324, 'gamma': 0.00019794170073427313}. Best is trial 9 with value: -1.8739445148417475.
[I 2026-07-17 11:51:12,573] Trial 25 finished with value: -1.230107498433618 and parameters: {'scalers': 'robust', 'ratios': 'log_ratio', 'imputers': 'median', 'n_estimators': 100, 'learning_rate': 0.05927231201271734, 'max_depth': 6, 'min_child_weight': 4, 'subsample': 0.9, 'colsample_bytree': 0.6, 'colsample_bylevel': 1.0, 'reg_alpha': 0.00016577395541111096, 'reg_lambda': 0.020919125476549106, 'gamma': 0.00013119389977352065}. Best is trial 9 with value: -1.8739445148417475.
[I 2026-07-17 11:51:26,876] Trial 26 finished with value: -1.4367603941732103 and parameters: {'scalers': 'robust', 'ratios': 'log_ratio', 'imputers': 'median', 'n_estimators': 2350, 'learning_rate': 0.10985625026536909, 'max_depth': 6, 'min_child_weight': 4, 'subsample': 0.9, 'colsample_bytree': 0.6, 'colsample_bylevel': 0.9, 'reg_alpha': 0.0001604170589009971, 'reg_lambda': 0.014806770745259216, 'gamma': 3.5176833507027256e-05}. Best is trial 9 with value: -1.8739445148417475.
[I 2026-07-17 11:51:46,342] Trial 27 finished with value: -1.5046879414936274 and parameters: {'scalers': 'robust', 'ratios': 'log_ratio', 'imputers': 'none', 'n_estimators': 2400, 'learning_rate': 0.00013135848183829692, 'max_depth': 6, 'min_child_weight': 3, 'subsample': 0.9, 'colsample_bytree': 0.6, 'colsample_bylevel': 0.9, 'reg_alpha': 3.077225305647931e-05, 'reg_lambda': 0.012009340148466814, 'gamma': 3.868895979677217e-05}. Best is trial 9 with value: -1.8739445148417475.
[I 2026-07-17 11:51:51,298] Trial 28 finished with value: -1.395047157370518 and parameters: {'scalers': 'robust', 'ratios': 'log_ratio', 'imputers': 'median', 'n_estimators': 700, 'learning_rate': 0.1735438415357007, 'max_depth': 6, 'min_child_weight': 3, 'subsample': 0.9, 'colsample_bytree': 0.8, 'colsample_bylevel': 0.8, 'reg_alpha': 4.133878552389771e-05, 'reg_lambda': 0.00679447618697422, 'gamma': 1.8853521663650283e-05}. Best is trial 9 with value: -1.8739445148417475.
[I 2026-07-17 11:52:02,412] Trial 29 finished with value: -1.631393464455251 and parameters: {'scalers': 'robust', 'ratios': 'log_ratio', 'imputers': 'median', 'n_estimators': 800, 'learning_rate': 0.20910368040732544, 'max_depth': 9, 'min_child_weight': 2, 'subsample': 0.9, 'colsample_bytree': 0.8, 'colsample_bylevel': 0.8, 'reg_alpha': 2.9896343929655483e-05, 'reg_lambda': 0.0030993541477404656, 'gamma': 2.355614615752734e-05}. Best is trial 9 with value: -1.8739445148417475.
[I 2026-07-17 11:52:12,395] Trial 30 finished with value: -1.5536159513617227 and parameters: {'scalers': 'robust', 'ratios': 'log_ratio', 'imputers': 'median', 'n_estimators': 700, 'learning_rate': 0.17823957484237526, 'max_depth': 9, 'min_child_weight': 2, 'subsample': 0.9, 'colsample_bytree': 0.8, 'colsample_bylevel': 0.8, 'reg_alpha': 2.6406277364521325e-05, 'reg_lambda': 0.0015135483018128837, 'gamma': 2.077983511814386e-05}. Best is trial 9 with value: -1.8739445148417475.
[I 2026-07-17 11:52:22,469] Trial 31 finished with value: -1.5722192512197068 and parameters: {'scalers': 'robust', 'ratios': 'log_ratio', 'imputers': 'none', 'n_estimators': 700, 'learning_rate': 0.1701552337962065, 'max_depth': 9, 'min_child_weight': 2, 'subsample': 0.9, 'colsample_bytree': 0.8, 'colsample_bylevel': 0.8, 'reg_alpha': 2.0121518666265443e-05, 'reg_lambda': 3.58501163172999e-05, 'gamma': 7.465386768420742e-06}. Best is trial 9 with value: -1.8739445148417475.
[I 2026-07-17 11:52:31,856] Trial 32 finished with value: -1.5638871557794014 and parameters: {'scalers': 'robust', 'ratios': 'log_ratio', 'imputers': 'none', 'n_estimators': 700, 'learning_rate': 0.14739624028285625, 'max_depth': 9, 'min_child_weight': 2, 'subsample': 0.7, 'colsample_bytree': 0.8, 'colsample_bylevel': 0.8, 'reg_alpha': 2.4293064450641468e-05, 'reg_lambda': 3.1559818280732175e-05, 'gamma': 1.6733373806273075e-06}. Best is trial 9 with value: -1.8739445148417475.
[I 2026-07-17 11:52:45,054] Trial 33 finished with value: -1.6213468709333292 and parameters: {'scalers': 'standard', 'ratios': 'log_ratio', 'imputers': 'none', 'n_estimators': 650, 'learning_rate': 0.00010294861764409745, 'max_depth': 9, 'min_child_weight': 2, 'subsample': 0.7, 'colsample_bytree': 0.8, 'colsample_bylevel': 0.8, 'reg_alpha': 0.002947386760230954, 'reg_lambda': 3.988248244823403e-05, 'gamma': 1.665703249640731e-05}. Best is trial 9 with value: -1.8739445148417475.
[I 2026-07-17 11:52:59,141] Trial 34 finished with value: -1.6176750173526826 and parameters: {'scalers': 'standard', 'ratios': 'log_ratio', 'imputers': 'none', 'n_estimators': 700, 'learning_rate': 0.00010561409601706226, 'max_depth': 9, 'min_child_weight': 2, 'subsample': 0.7, 'colsample_bytree': 0.8, 'colsample_bylevel': 0.8, 'reg_alpha': 2.028125575166979e-05, 'reg_lambda': 5.423319287581092e-05, 'gamma': 1.0031135997480648e-06}. Best is trial 9 with value: -1.8739445148417475.
[I 2026-07-17 11:53:23,606] Trial 35 finished with value: -1.5256123138191315 and parameters: {'scalers': 'standard', 'ratios': 'log_ratio', 'imputers': 'none', 'n_estimators': 2250, 'learning_rate': 0.00011963341491789423, 'max_depth': 7, 'min_child_weight': 3, 'subsample': 0.7, 'colsample_bytree': 0.7, 'colsample_bylevel': 0.9, 'reg_alpha': 1.9816175759075704e-05, 'reg_lambda': 0.000252455593424485, 'gamma': 0.007431183780127225}. Best is trial 9 with value: -1.8739445148417475.
[I 2026-07-17 11:53:37,598] Trial 36 finished with value: -1.509837999803318 and parameters: {'scalers': 'standard', 'ratios': 'log_ratio', 'imputers': 'none', 'n_estimators': 2300, 'learning_rate': 0.00013418646977195382, 'max_depth': 5, 'min_child_weight': 3, 'subsample': 0.7, 'colsample_bytree': 0.7, 'colsample_bylevel': 0.9, 'reg_alpha': 0.0041588000095700624, 'reg_lambda': 0.0006044298545650848, 'gamma': 6.685905808884862e-06}. Best is trial 9 with value: -1.8739445148417475.
[I 2026-07-17 11:53:48,732] Trial 37 finished with value: -2.155031694906849 and parameters: {'scalers': 'standard', 'ratios': 'log_ratio', 'imputers': 'none', 'n_estimators': 1050, 'learning_rate': 0.4810090816372784, 'max_depth': 9, 'min_child_weight': 2, 'subsample': 0.7, 'colsample_bytree': 0.7, 'colsample_bylevel': 0.7, 'reg_alpha': 0.0018584106018642696, 'reg_lambda': 0.0002537457044733532, 'gamma': 7.812773161630304e-06}. Best is trial 37 with value: -2.155031694906849.
[I 2026-07-17 11:54:00,300] Trial 38 finished with value: -1.8152622821086726 and parameters: {'scalers': 'standard', 'ratios': 'log_ratio', 'imputers': 'median', 'n_estimators': 950, 'learning_rate': 0.2871842608298327, 'max_depth': 9, 'min_child_weight': 2, 'subsample': 0.7, 'colsample_bytree': 0.8, 'colsample_bylevel': 0.7, 'reg_alpha': 9.643095589956409e-06, 'reg_lambda': 0.0005944288009503267, 'gamma': 8.946364438807957e-06}. Best is trial 37 with value: -2.155031694906849.
[I 2026-07-17 11:54:10,983] Trial 39 finished with value: -2.1600724702341423 and parameters: {'scalers': 'standard', 'ratios': 'log_ratio', 'imputers': 'none', 'n_estimators': 1000, 'learning_rate': 0.484569259453805, 'max_depth': 9, 'min_child_weight': 2, 'subsample': 0.7, 'colsample_bytree': 0.7, 'colsample_bylevel': 0.7, 'reg_alpha': 0.00162244786195104, 'reg_lambda': 0.00034463521733994854, 'gamma': 6.18520420075218e-06}. Best is trial 39 with value: -2.1600724702341423.
[I 2026-07-17 11:54:17,891] Trial 40 finished with value: -1.7508093525214041 and parameters: {'scalers': 'standard', 'ratios': 'log_ratio', 'imputers': 'none', 'n_estimators': 1000, 'learning_rate': 0.3336739532114713, 'max_depth': 7, 'min_child_weight': 3, 'subsample': 0.7, 'colsample_bytree': 0.7, 'colsample_bylevel': 0.7, 'reg_alpha': 0.0016850656332022497, 'reg_lambda': 0.000468735433765256, 'gamma': 5.106049502978648e-06}. Best is trial 39 with value: -2.1600724702341423.
[I 2026-07-17 11:54:27,385] Trial 41 finished with value: -1.938020560059177 and parameters: {'scalers': 'standard', 'ratios': 'log_ratio', 'imputers': 'none', 'n_estimators': 1100, 'learning_rate': 0.4440927821755143, 'max_depth': 8, 'min_child_weight': 3, 'subsample': 0.7, 'colsample_bytree': 0.7, 'colsample_bylevel': 0.7, 'reg_alpha': 0.003403522655252323, 'reg_lambda': 0.001155736958000925, 'gamma': 0.005747295818035644}. Best is trial 39 with value: -2.1600724702341423.
[I 2026-07-17 11:54:30,562] Trial 42 finished with value: -1.8065133522054582 and parameters: {'scalers': 'standard', 'ratios': 'log_ratio', 'imputers': 'none', 'n_estimators': 500, 'learning_rate': 0.44324486715842415, 'max_depth': 8, 'min_child_weight': 3, 'subsample': 0.7, 'colsample_bytree': 0.7, 'colsample_bylevel': 0.7, 'reg_alpha': 0.0017170022125554522, 'reg_lambda': 0.0007448354998539238, 'gamma': 0.004545451594462795}. Best is trial 39 with value: -2.1600724702341423.
[I 2026-07-17 11:54:49,369] Trial 43 finished with value: -2.2485612656838083 and parameters: {'scalers': 'standard', 'ratios': 'log_ratio', 'imputers': 'mean', 'n_estimators': 1100, 'learning_rate': 0.3068905432053614, 'max_depth': 11, 'min_child_weight': 1, 'subsample': 0.7, 'colsample_bytree': 0.7, 'colsample_bylevel': 0.7, 'reg_alpha': 0.0019928533322630423, 'reg_lambda': 0.0013022027186968264, 'gamma': 0.002054447569089034}. Best is trial 43 with value: -2.2485612656838083.
[I 2026-07-17 11:55:08,491] Trial 44 finished with value: -2.2030251758378365 and parameters: {'scalers': 'standard', 'ratios': 'log_ratio', 'imputers': 'mean', 'n_estimators': 1100, 'learning_rate': 0.31055077865445735, 'max_depth': 11, 'min_child_weight': 1, 'subsample': 0.7, 'colsample_bytree': 0.7, 'colsample_bylevel': 0.7, 'reg_alpha': 0.0017175944619948055, 'reg_lambda': 0.0011698682221351966, 'gamma': 0.0012717606102038714}. Best is trial 43 with value: -2.2485612656838083.
