[I 2026-07-17 15:24:10,087] Trial 315 finished with value: -1.8325793999568791 and parameters: {'scalers': 'none', 'ratios': 'norm_ratio', 'imputers': 'median', 'n_estimators': 3000, 'learning_rate': 0.30314847805708894, 'max_depth': 11, 'min_child_weight': 5, 'subsample': 0.6, 'colsample_bytree': 0.6, 'colsample_bylevel': 0.8, 'reg_alpha': 6.47914450440008, 'reg_lambda': 0.00018293097824444783, 'gamma': 7.083985499323263e-06}. Best is trial 241 with value: -6.28916662317088.
[I 2026-07-17 15:24:42,453] Trial 316 finished with value: -2.786808959555018 and parameters: {'scalers': 'none', 'ratios': 'norm_ratio', 'imputers': 'median', 'n_estimators': 3000, 'learning_rate': 0.4879814502803767, 'max_depth': 11, 'min_child_weight': 1, 'subsample': 0.6, 'colsample_bytree': 0.6, 'colsample_bylevel': 0.8, 'reg_alpha': 6.767680162938192, 'reg_lambda': 0.0017074408341049572, 'gamma': 4.569609108539877e-06}. Best is trial 241 with value: -6.28916662317088.
[I 2026-07-17 15:25:08,793] Trial 317 finished with value: -2.1444767508873017 and parameters: {'scalers': 'standard', 'ratios': 'norm_ratio', 'imputers': 'median', 'n_estimators': 2900, 'learning_rate': 0.48978070337325336, 'max_depth': 11, 'min_child_weight': 5, 'subsample': 0.6, 'colsample_bytree': 0.6, 'colsample_bylevel': 0.8, 'reg_alpha': 6.183406928849889, 'reg_lambda': 0.0002999169708347923, 'gamma': 4.256023545297343e-06}. Best is trial 241 with value: -6.28916662317088.
[I 2026-07-17 15:25:51,608] Trial 318 finished with value: -4.50057999503832 and parameters: {'scalers': 'standard', 'ratios': 'norm_ratio', 'imputers': 'median', 'n_estimators': 2700, 'learning_rate': 0.4973768052731526, 'max_depth': 11, 'min_child_weight': 1, 'subsample': 0.6, 'colsample_bytree': 0.6, 'colsample_bylevel': 0.8, 'reg_alpha': 4.132050880208542, 'reg_lambda': 0.013737493848876021, 'gamma': 4.182176129587691e-06}. Best is trial 241 with value: -6.28916662317088.
[I 2026-07-17 15:26:12,763] Trial 319 finished with value: -1.9980123348993124 and parameters: {'scalers': 'standard', 'ratios': 'norm_ratio', 'imputers': 'median', 'n_estimators': 2700, 'learning_rate': 0.4397520005778553, 'max_depth': 11, 'min_child_weight': 5, 'subsample': 0.6, 'colsample_bytree': 0.6, 'colsample_bylevel': 0.8, 'reg_alpha': 7.444630882255923, 'reg_lambda': 0.00020669335014253623, 'gamma': 4.660960611438628e-06}. Best is trial 241 with value: -6.28916662317088.
