[I 2026-07-17 15:23:19,777] Trial 135 finished with value: -0.2810455968415279 and parameters: {'scalers': 'standard', 'ratios': 'norm_ratio', 'imputers': 'mean', 'n_estimators': 2650, 'learning_rate': 0.4128931264538387, 'max_depth': 10, 'min_child_weight': 1, 'subsample': 0.9, 'colsample_bytree': 0.5, 'colsample_bylevel': 0.5, 'reg_alpha': 4.9251940601408175e-06, 'reg_lambda': 0.031352664434506496, 'gamma': 6.93873054264982e-05}. Best is trial 123 with value: -0.3087064502731913.
[I 2026-07-17 15:23:32,189] Trial 136 finished with value: -0.27751981424037475 and parameters: {'scalers': 'standard', 'ratios': 'norm_ratio', 'imputers': 'mean', 'n_estimators': 2650, 'learning_rate': 0.4181071984123589, 'max_depth': 10, 'min_child_weight': 1, 'subsample': 0.9, 'colsample_bytree': 0.5, 'colsample_bylevel': 0.5, 'reg_alpha': 4.628507147780304e-06, 'reg_lambda': 0.02836541838799831, 'gamma': 3.8228832017961276e-05}. Best is trial 123 with value: -0.3087064502731913.
[I 2026-07-17 15:23:45,173] Trial 137 finished with value: -0.2805554270082469 and parameters: {'scalers': 'standard', 'ratios': 'norm_ratio', 'imputers': 'mean', 'n_estimators': 2700, 'learning_rate': 0.4076381442360738, 'max_depth': 10, 'min_child_weight': 1, 'subsample': 0.9, 'colsample_bytree': 0.5, 'colsample_bylevel': 0.5, 'reg_alpha': 5.312955583231532e-06, 'reg_lambda': 0.028246997101000346, 'gamma': 8.22746276058817e-05}. Best is trial 123 with value: -0.3087064502731913.
[I 2026-07-17 15:23:57,617] Trial 138 finished with value: -0.2723100326983927 and parameters: {'scalers': 'standard', 'ratios': 'norm_ratio', 'imputers': 'mean', 'n_estimators': 2650, 'learning_rate': 0.4111924335740747, 'max_depth': 10, 'min_child_weight': 1, 'subsample': 0.9, 'colsample_bytree': 0.5, 'colsample_bylevel': 0.5, 'reg_alpha': 4.975518573869455e-06, 'reg_lambda': 0.00966637123231928, 'gamma': 6.877735815511431e-05}. Best is trial 123 with value: -0.3087064502731913.
[I 2026-07-17 15:24:10,205] Trial 139 finished with value: -0.2705878946201382 and parameters: {'scalers': 'standard', 'ratios': 'norm_ratio', 'imputers': 'mean', 'n_estimators': 2650, 'learning_rate': 0.4097893789419881, 'max_depth': 10, 'min_child_weight': 1, 'subsample': 0.9, 'colsample_bytree': 0.5, 'colsample_bylevel': 0.5, 'reg_alpha': 4.280831146526791e-06, 'reg_lambda': 0.029065114639523264, 'gamma': 4.579483741180074e-05}. Best is trial 123 with value: -0.3087064502731913.
[I 2026-07-17 15:24:23,052] Trial 140 finished with value: -0.2342778637283791 and parameters: {'scalers': 'standard', 'ratios': 'norm_ratio', 'imputers': 'mean', 'n_estimators': 2700, 'learning_rate': 0.2775811690659175, 'max_depth': 10, 'min_child_weight': 1, 'subsample': 0.9, 'colsample_bytree': 0.5, 'colsample_bylevel': 0.5, 'reg_alpha': 4.433144314195884e-06, 'reg_lambda': 0.00873949443076912, 'gamma': 7.105570521406355e-05}. Best is trial 123 with value: -0.3087064502731913.
[I 2026-07-17 15:24:35,717] Trial 141 finished with value: -0.23162080645487548 and parameters: {'scalers': 'standard', 'ratios': 'norm_ratio', 'imputers': 'mean', 'n_estimators': 2650, 'learning_rate': 0.2521653681374328, 'max_depth': 10, 'min_child_weight': 1, 'subsample': 0.9, 'colsample_bytree': 0.5, 'colsample_bylevel': 0.5, 'reg_alpha': 4.998636878107586e-06, 'reg_lambda': 0.00889804924865502, 'gamma': 6.953724536154945e-05}. Best is trial 123 with value: -0.3087064502731913.
[I 2026-07-17 15:24:48,171] Trial 142 finished with value: -0.2759922264698325 and parameters: {'scalers': 'standard', 'ratios': 'norm_ratio', 'imputers': 'mean', 'n_estimators': 2650, 'learning_rate': 0.421184923856943, 'max_depth': 10, 'min_child_weight': 1, 'subsample': 0.9, 'colsample_bytree': 0.5, 'colsample_bylevel': 0.5, 'reg_alpha': 5.793958433599823e-06, 'reg_lambda': 0.011430328262258921, 'gamma': 3.472031640458234e-05}. Best is trial 123 with value: -0.3087064502731913.
[I 2026-07-17 15:25:01,072] Trial 143 finished with value: -0.27416287179287124 and parameters: {'scalers': 'standard', 'ratios': 'norm_ratio', 'imputers': 'mean', 'n_estimators': 2650, 'learning_rate': 0.4250379892946595, 'max_depth': 10, 'min_child_weight': 1, 'subsample': 0.9, 'colsample_bytree': 0.5, 'colsample_bylevel': 0.5, 'reg_alpha': 5.865517539064765e-06, 'reg_lambda': 0.007818458146818351, 'gamma': 3.674306150307816e-05}. Best is trial 123 with value: -0.3087064502731913.
[I 2026-07-17 15:25:13,928] Trial 144 finished with value: -0.2932987817225462 and parameters: {'scalers': 'standard', 'ratios': 'norm_ratio', 'imputers': 'mean', 'n_estimators': 2650, 'learning_rate': 0.4933312881879397, 'max_depth': 10, 'min_child_weight': 1, 'subsample': 0.9, 'colsample_bytree': 0.5, 'colsample_bylevel': 0.5, 'reg_alpha': 5.552890133691198e-06, 'reg_lambda': 0.012111648375807218, 'gamma': 3.0935711010494677e-05}. Best is trial 123 with value: -0.3087064502731913.
[I 2026-07-17 15:25:24,908] Trial 145 finished with value: -0.2941380840199538 and parameters: {'scalers': 'standard', 'ratios': 'norm_ratio', 'imputers': 'mean', 'n_estimators': 2500, 'learning_rate': 0.4930885500548959, 'max_depth': 10, 'min_child_weight': 1, 'subsample': 0.9, 'colsample_bytree': 0.5, 'colsample_bylevel': 0.5, 'reg_alpha': 5.2127071289487376e-06, 'reg_lambda': 0.008797319483499304, 'gamma': 3.6528745800843866e-05}. Best is trial 123 with value: -0.3087064502731913.
[I 2026-07-17 15:25:36,870] Trial 146 finished with value: -0.30085630529302304 and parameters: {'scalers': 'standard', 'ratios': 'norm_ratio', 'imputers': 'mean', 'n_estimators': 2500, 'learning_rate': 0.4879767779747096, 'max_depth': 10, 'min_child_weight': 1, 'subsample': 0.9, 'colsample_bytree': 0.5, 'colsample_bylevel': 0.5, 'reg_alpha': 5.098190860114197e-06, 'reg_lambda': 0.01011785486687083, 'gamma': 3.224224776974765e-05}. Best is trial 123 with value: -0.3087064502731913.
[I 2026-07-17 15:25:47,938] Trial 147 finished with value: -0.28664580945090856 and parameters: {'scalers': 'standard', 'ratios': 'norm_ratio', 'imputers': 'mean', 'n_estimators': 2450, 'learning_rate': 0.4949906144589847, 'max_depth': 10, 'min_child_weight': 1, 'subsample': 0.9, 'colsample_bytree': 0.5, 'colsample_bylevel': 0.5, 'reg_alpha': 5.803359878929123e-06, 'reg_lambda': 0.008554430025636732, 'gamma': 7.310543490116162e-05}. Best is trial 123 with value: -0.3087064502731913.
[I 2026-07-17 15:25:59,418] Trial 148 finished with value: -0.29610016542831114 and parameters: {'scalers': 'standard', 'ratios': 'norm_ratio', 'imputers': 'mean', 'n_estimators': 2500, 'learning_rate': 0.4923693056247077, 'max_depth': 10, 'min_child_weight': 1, 'subsample': 0.9, 'colsample_bytree': 0.5, 'colsample_bylevel': 0.5, 'reg_alpha': 5.987459154224531e-06, 'reg_lambda': 0.009084174719414877, 'gamma': 3.269929135831716e-05}. Best is trial 123 with value: -0.3087064502731913.
[I 2026-07-17 15:26:13,322] Trial 149 finished with value: -0.21907079923155637 and parameters: {'scalers': 'standard', 'ratios': 'norm_ratio', 'imputers': 'mean', 'n_estimators': 2450, 'learning_rate': 0.4977023823724208, 'max_depth': 10, 'min_child_weight': 1, 'subsample': 0.9, 'colsample_bytree': 1.0, 'colsample_bylevel': 0.5, 'reg_alpha': 6.739983021435016e-06, 'reg_lambda': 0.0769544451598354, 'gamma': 2.638061683552618e-05}. Best is trial 123 with value: -0.3087064502731913.
[I 2026-07-17 15:26:25,194] Trial 150 finished with value: -0.29689411985840825 and parameters: {'scalers': 'standard', 'ratios': 'norm_ratio', 'imputers': 'mean', 'n_estimators': 2500, 'learning_rate': 0.46676390715357935, 'max_depth': 10, 'min_child_weight': 1, 'subsample': 0.9, 'colsample_bytree': 0.5, 'colsample_bylevel': 0.5, 'reg_alpha': 6.032414150657425e-06, 'reg_lambda': 0.019720835066318276, 'gamma': 3.061340836106297e-05}. Best is trial 123 with value: -0.3087064502731913.
[I 2026-07-17 15:26:36,723] Trial 151 finished with value: -0.30334354663862556 and parameters: {'scalers': 'standard', 'ratios': 'norm_ratio', 'imputers': 'mean', 'n_estimators': 2500, 'learning_rate': 0.4933947604817983, 'max_depth': 10, 'min_child_weight': 1, 'subsample': 0.9, 'colsample_bytree': 0.5, 'colsample_bylevel': 0.5, 'reg_alpha': 6.001815914606563e-06, 'reg_lambda': 0.002929688009718669, 'gamma': 3.016190543320454e-05}. Best is trial 123 with value: -0.3087064502731913.
[I 2026-07-17 15:26:48,557] Trial 152 finished with value: -0.29737882008141825 and parameters: {'scalers': 'standard', 'ratios': 'norm_ratio', 'imputers': 'mean', 'n_estimators': 2500, 'learning_rate': 0.4935018121557559, 'max_depth': 10, 'min_child_weight': 1, 'subsample': 0.9, 'colsample_bytree': 0.5, 'colsample_bylevel': 0.5, 'reg_alpha': 1.134530700258228e-05, 'reg_lambda': 0.019078603123631573, 'gamma': 2.912592273530204e-05}. Best is trial 123 with value: -0.3087064502731913.
[I 2026-07-17 15:27:02,419] Trial 153 finished with value: -0.22249481461402396 and parameters: {'scalers': 'standard', 'ratios': 'norm_ratio', 'imputers': 'mean', 'n_estimators': 2450, 'learning_rate': 0.4956468097767706, 'max_depth': 10, 'min_child_weight': 1, 'subsample': 0.9, 'colsample_bytree': 1.0, 'colsample_bylevel': 0.5, 'reg_alpha': 1.1019560502108591e-05, 'reg_lambda': 0.004583014406593955, 'gamma': 8.780635057440629e-06}. Best is trial 123 with value: -0.3087064502731913.
[I 2026-07-17 15:27:14,275] Trial 154 finished with value: -0.24664416456935467 and parameters: {'scalers': 'standard', 'ratios': 'norm_ratio', 'imputers': 'mean', 'n_estimators': 2500, 'learning_rate': 0.2984584503830105, 'max_depth': 10, 'min_child_weight': 1, 'subsample': 0.9, 'colsample_bytree': 0.5, 'colsample_bylevel': 0.5, 'reg_alpha': 3.123655866815498e-05, 'reg_lambda': 0.003775585587843438, 'gamma': 2.2035473390420947e-05}. Best is trial 123 with value: -0.3087064502731913.
[I 2026-07-17 15:27:26,000] Trial 155 finished with value: -0.2923887843950991 and parameters: {'scalers': 'standard', 'ratios': 'norm_ratio', 'imputers': 'mean', 'n_estimators': 2500, 'learning_rate': 0.48785317982668003, 'max_depth': 10, 'min_child_weight': 1, 'subsample': 0.9, 'colsample_bytree': 0.5, 'colsample_bylevel': 0.5, 'reg_alpha': 1.14590544881606e-05, 'reg_lambda': 0.019843081673663117, 'gamma': 2.1376130643097916e-05}. Best is trial 123 with value: -0.3087064502731913.
[I 2026-07-17 15:27:37,696] Trial 156 finished with value: -0.3005017067897833 and parameters: {'scalers': 'standard', 'ratios': 'norm_ratio', 'imputers': 'mean', 'n_estimators': 2450, 'learning_rate': 0.49715047694205977, 'max_depth': 10, 'min_child_weight': 1, 'subsample': 0.9, 'colsample_bytree': 0.5, 'colsample_bylevel': 0.5, 'reg_alpha': 3.29260598877972e-05, 'reg_lambda': 0.0048537866104984215, 'gamma': 6.435826114201974e-06}. Best is trial 123 with value: -0.3087064502731913.
[I 2026-07-17 15:27:49,004] Trial 157 finished with value: -0.23420968013240634 and parameters: {'scalers': 'standard', 'ratios': 'norm_ratio', 'imputers': 'mean', 'n_estimators': 2350, 'learning_rate': 0.2926047067122518, 'max_depth': 10, 'min_child_weight': 1, 'subsample': 0.9, 'colsample_bytree': 0.5, 'colsample_bylevel': 0.5, 'reg_alpha': 1.0992066494865255e-05, 'reg_lambda': 0.004450740733656385, 'gamma': 7.93039891354054e-06}. Best is trial 123 with value: -0.3087064502731913.
[I 2026-07-17 15:28:01,087] Trial 158 finished with value: -0.23534865277015388 and parameters: {'scalers': 'standard', 'ratios': 'norm_ratio', 'imputers': 'mean', 'n_estimators': 2500, 'learning_rate': 0.29186838685320704, 'max_depth': 10, 'min_child_weight': 1, 'subsample': 0.9, 'colsample_bytree': 0.5, 'colsample_bylevel': 0.5, 'reg_alpha': 1.2649421943759758e-05, 'reg_lambda': 0.005446134432212632, 'gamma': 5.2117095458755955e-06}. Best is trial 123 with value: -0.3087064502731913.
[I 2026-07-17 15:28:12,069] Trial 159 finished with value: -0.23474451780403807 and parameters: {'scalers': 'standard', 'ratios': 'norm_ratio', 'imputers': 'mean', 'n_estimators': 2350, 'learning_rate': 0.30448093865572307, 'max_depth': 10, 'min_child_weight': 1, 'subsample': 0.9, 'colsample_bytree': 0.5, 'colsample_bylevel': 0.5, 'reg_alpha': 2.608197743942478e-05, 'reg_lambda': 0.004369097979632779, 'gamma': 8.971844124541992e-06}. Best is trial 123 with value: -0.3087064502731913.
[I 2026-07-17 15:28:23,049] Trial 160 finished with value: -0.23527834072019088 and parameters: {'scalers': 'standard', 'ratios': 'norm_ratio', 'imputers': 'mean', 'n_estimators': 2350, 'learning_rate': 0.3021346646344017, 'max_depth': 10, 'min_child_weight': 1, 'subsample': 0.9, 'colsample_bytree': 0.5, 'colsample_bylevel': 0.5, 'reg_alpha': 1.189809257625996e-05, 'reg_lambda': 0.005999583075738299, 'gamma': 7.705003348192888e-06}. Best is trial 123 with value: -0.3087064502731913.
[I 2026-07-17 15:28:36,113] Trial 161 finished with value: -0.25939089970379864 and parameters: {'scalers': 'standard', 'ratios': 'norm_ratio', 'imputers': 'mean', 'n_estimators': 2350, 'learning_rate': 0.30704057421480196, 'max_depth': 11, 'min_child_weight': 1, 'subsample': 0.9, 'colsample_bytree': 0.5, 'colsample_bylevel': 0.5, 'reg_alpha': 2.2931862544025466e-05, 'reg_lambda': 0.0054373331956874835, 'gamma': 2.0004149043258455e-05}. Best is trial 123 with value: -0.3087064502731913.
[I 2026-07-17 15:28:48,432] Trial 162 finished with value: -0.3223995621060998 and parameters: {'scalers': 'standard', 'ratios': 'norm_ratio', 'imputers': 'mean', 'n_estimators': 2300, 'learning_rate': 0.4969680187935099, 'max_depth': 11, 'min_child_weight': 1, 'subsample': 0.9, 'colsample_bytree': 0.5, 'colsample_bylevel': 0.5, 'reg_alpha': 1.2304775867224957e-05, 'reg_lambda': 0.017552272748735352, 'gamma': 2.0216712901586482e-05}. Best is trial 162 with value: -0.3223995621060998.
[I 2026-07-17 15:29:01,010] Trial 163 finished with value: -0.3247836986762768 and parameters: {'scalers': 'standard', 'ratios': 'norm_ratio', 'imputers': 'mean', 'n_estimators': 2300, 'learning_rate': 0.4938128187558487, 'max_depth': 11, 'min_child_weight': 1, 'subsample': 0.9, 'colsample_bytree': 0.5, 'colsample_bylevel': 0.5, 'reg_alpha': 1.0415050395126128e-05, 'reg_lambda': 0.01747519543823333, 'gamma': 2.02507255814057e-05}. Best is trial 163 with value: -0.3247836986762768.
[I 2026-07-17 15:29:13,969] Trial 164 finished with value: -0.31544725643400556 and parameters: {'scalers': 'standard', 'ratios': 'norm_ratio', 'imputers': 'mean', 'n_estimators': 2350, 'learning_rate': 0.49987170254114505, 'max_depth': 11, 'min_child_weight': 1, 'subsample': 0.9, 'colsample_bytree': 0.5, 'colsample_bylevel': 0.5, 'reg_alpha': 1.3099472510040253e-05, 'reg_lambda': 0.0013146013423060044, 'gamma': 3.7352241939079196e-06}. Best is trial 163 with value: -0.3247836986762768.
[I 2026-07-17 15:29:27,039] Trial 165 finished with value: -0.2701382681383352 and parameters: {'scalers': 'standard', 'ratios': 'norm_ratio', 'imputers': 'mean', 'n_estimators': 2350, 'learning_rate': 0.4949414561054701, 'max_depth': 11, 'min_child_weight': 1, 'subsample': 1.0, 'colsample_bytree': 0.5, 'colsample_bylevel': 0.5, 'reg_alpha': 2.657793513800956e-05, 'reg_lambda': 0.01599566946519209, 'gamma': 1.6503778401747252e-05}. Best is trial 163 with value: -0.3247836986762768.
[I 2026-07-17 15:29:39,556] Trial 166 finished with value: -0.2704422213491606 and parameters: {'scalers': 'standard', 'ratios': 'norm_ratio', 'imputers': 'mean', 'n_estimators': 2400, 'learning_rate': 0.4816138032547806, 'max_depth': 11, 'min_child_weight': 1, 'subsample': 1.0, 'colsample_bytree': 0.5, 'colsample_bylevel': 0.5, 'reg_alpha': 2.616773401731538e-05, 'reg_lambda': 0.018459980933999743, 'gamma': 1.6771711941011206e-05}. Best is trial 163 with value: -0.3247836986762768.
[I 2026-07-17 15:29:53,605] Trial 167 finished with value: -0.2734769472048856 and parameters: {'scalers': 'standard', 'ratios': 'norm_ratio', 'imputers': 'mean', 'n_estimators': 2550, 'learning_rate': 0.49474568310230166, 'max_depth': 11, 'min_child_weight': 1, 'subsample': 1.0, 'colsample_bytree': 0.5, 'colsample_bylevel': 0.5, 'reg_alpha': 8.118435704009761e-06, 'reg_lambda': 0.0022134691691760196, 'gamma': 1.8651582486138396e-05}. Best is trial 163 with value: -0.3247836986762768.
[I 2026-07-17 15:30:07,914] Trial 168 finished with value: -0.3284462129480996 and parameters: {'scalers': 'standard', 'ratios': 'norm_ratio', 'imputers': 'mean', 'n_estimators': 2550, 'learning_rate': 0.4908965403403393, 'max_depth': 11, 'min_child_weight': 1, 'subsample': 0.9, 'colsample_bytree': 0.5, 'colsample_bylevel': 0.5, 'reg_alpha': 7.794401219445578e-06, 'reg_lambda': 0.018155973355493384, 'gamma': 4.783792844178765e-06}. Best is trial 168 with value: -0.3284462129480996.
[I 2026-07-17 15:30:19,491] Trial 169 finished with value: -0.2478346036950106 and parameters: {'scalers': 'standard', 'ratios': 'norm_ratio', 'imputers': 'mean', 'n_estimators': 2500, 'learning_rate': 0.47413795194110764, 'max_depth': 10, 'min_child_weight': 1, 'subsample': 1.0, 'colsample_bytree': 0.5, 'colsample_bylevel': 0.5, 'reg_alpha': 4.9869808833624866e-05, 'reg_lambda': 0.019001157546711566, 'gamma': 2.1214834910570344e-05}. Best is trial 168 with value: -0.3284462129480996.
[I 2026-07-17 15:30:33,361] Trial 170 finished with value: -0.3330972072072374 and parameters: {'scalers': 'standard', 'ratios': 'norm_ratio', 'imputers': 'mean', 'n_estimators': 2550, 'learning_rate': 0.4952013006915243, 'max_depth': 11, 'min_child_weight': 1, 'subsample': 0.9, 'colsample_bytree': 0.5, 'colsample_bylevel': 0.5, 'reg_alpha': 4.807737147175835e-05, 'reg_lambda': 0.01676020317319403, 'gamma': 1.860366166908319e-05}. Best is trial 170 with value: -0.3330972072072374.
[I 2026-07-17 15:30:45,775] Trial 171 finished with value: -0.3139324054615123 and parameters: {'scalers': 'standard', 'ratios': 'norm_ratio', 'imputers': 'mean', 'n_estimators': 2200, 'learning_rate': 0.4973178386695319, 'max_depth': 11, 'min_child_weight': 1, 'subsample': 0.9, 'colsample_bytree': 0.5, 'colsample_bylevel': 0.5, 'reg_alpha': 4.0680402436789165e-05, 'reg_lambda': 0.017666540163254675, 'gamma': 1.7977774573880663e-05}. Best is trial 170 with value: -0.3330972072072374.
[I 2026-07-17 15:30:57,555] Trial 172 finished with value: -0.31259720255443313 and parameters: {'scalers': 'standard', 'ratios': 'norm_ratio', 'imputers': 'mean', 'n_estimators': 2250, 'learning_rate': 0.4956718149776058, 'max_depth': 11, 'min_child_weight': 1, 'subsample': 0.9, 'colsample_bytree': 0.5, 'colsample_bylevel': 0.5, 'reg_alpha': 8.486962499169077e-06, 'reg_lambda': 0.0021686994106681627, 'gamma': 3.106656519609317e-06}. Best is trial 170 with value: -0.3330972072072374.
[I 2026-07-17 15:31:11,440] Trial 173 finished with value: -0.3264190427677871 and parameters: {'scalers': 'standard', 'ratios': 'norm_ratio', 'imputers': 'mean', 'n_estimators': 2250, 'learning_rate': 0.4966120898857349, 'max_depth': 11, 'min_child_weight': 1, 'subsample': 0.9, 'colsample_bytree': 0.5, 'colsample_bylevel': 0.5, 'reg_alpha': 8.05334323237035e-06, 'reg_lambda': 0.001768944250512825, 'gamma': 1.1554549051410173e-05}. Best is trial 170 with value: -0.3330972072072374.
[I 2026-07-17 15:31:22,153] Trial 174 finished with value: -0.31685614570219234 and parameters: {'scalers': 'standard', 'ratios': 'norm_ratio', 'imputers': 'mean', 'n_estimators': 2200, 'learning_rate': 0.47953503772119244, 'max_depth': 11, 'min_child_weight': 1, 'subsample': 0.9, 'colsample_bytree': 0.5, 'colsample_bylevel': 0.5, 'reg_alpha': 4.740395424981794e-05, 'reg_lambda': 0.0026504887692742696, 'gamma': 3.969906328457143e-06}. Best is trial 170 with value: -0.3330972072072374.
[I 2026-07-17 15:31:37,858] Trial 175 finished with value: -0.2646328201230427 and parameters: {'scalers': 'standard', 'ratios': 'norm_ratio', 'imputers': 'mean', 'n_estimators': 2500, 'learning_rate': 0.49022301298088145, 'max_depth': 11, 'min_child_weight': 2, 'subsample': 0.9, 'colsample_bytree': 0.5, 'colsample_bylevel': 0.5, 'reg_alpha': 4.493341769764859e-05, 'reg_lambda': 0.0008558335767483743, 'gamma': 3.83822241587668e-06}. Best is trial 170 with value: -0.3330972072072374.
[I 2026-07-17 15:31:51,350] Trial 176 finished with value: -0.3254496878706543 and parameters: {'scalers': 'standard', 'ratios': 'norm_ratio', 'imputers': 'mean', 'n_estimators': 2500, 'learning_rate': 0.49646315222527965, 'max_depth': 11, 'min_child_weight': 1, 'subsample': 0.9, 'colsample_bytree': 0.5, 'colsample_bylevel': 0.5, 'reg_alpha': 1.4045431052201498e-05, 'reg_lambda': 0.0012413312881575638, 'gamma': 3.837425339514186e-06}. Best is trial 170 with value: -0.3330972072072374.
[I 2026-07-17 15:32:02,808] Trial 177 finished with value: -0.22341708220725404 and parameters: {'scalers': 'standard', 'ratios': 'norm_ratio', 'imputers': 'mean', 'n_estimators': 2200, 'learning_rate': 0.33429358719821123, 'max_depth': 11, 'min_child_weight': 2, 'subsample': 0.9, 'colsample_bytree': 0.5, 'colsample_bylevel': 0.5, 'reg_alpha': 1.4319423090463525e-05, 'reg_lambda': 0.0008082156047585105, 'gamma': 3.072670492509898e-06}. Best is trial 170 with value: -0.3330972072072374.
[I 2026-07-17 15:32:14,324] Trial 178 finished with value: -0.3099951913418318 and parameters: {'scalers': 'standard', 'ratios': 'norm_ratio', 'imputers': 'mean', 'n_estimators': 2200, 'learning_rate': 0.4991076488256541, 'max_depth': 11, 'min_child_weight': 1, 'subsample': 0.9, 'colsample_bytree': 0.5, 'colsample_bylevel': 0.5, 'reg_alpha': 1.5793212124121775e-05, 'reg_lambda': 0.0021366762674457957, 'gamma': 1.9193049762310806e-06}. Best is trial 170 with value: -0.3330972072072374.
[I 2026-07-17 15:32:26,228] Trial 179 finished with value: -0.31057961333838036 and parameters: {'scalers': 'standard', 'ratios': 'norm_ratio', 'imputers': 'mean', 'n_estimators': 2200, 'learning_rate': 0.497063261087398, 'max_depth': 11, 'min_child_weight': 1, 'subsample': 0.9, 'colsample_bytree': 0.5, 'colsample_bylevel': 0.5, 'reg_alpha': 1.704854287067097e-05, 'reg_lambda': 0.0005689562960991097, 'gamma': 2.7055122561105553e-06}. Best is trial 170 with value: -0.3330972072072374.
