[I 2026-07-14 18:51:11,486] Trial 90 finished with value: -2.655668631817272 and parameters: {'scalers': 'standard', 'ratios': 'log_ratio', 'imputers': 'mean', 'n_estimators': 2900, 'learning_rate': 0.20791840772975745, 'max_depth': 8, 'min_child_weight': 1, 'subsample': 0.9, 'colsample_bytree': 0.9, 'colsample_bylevel': 0.7, 'reg_alpha': 7.838063040574702e-06, 'reg_lambda': 42.07906574232132, 'gamma': 0.0006027002301041375}. Best is trial 80 with value: -2.913757112215665.
[I 2026-07-14 18:52:04,749] Trial 91 finished with value: -2.6448972612171935 and parameters: {'scalers': 'standard', 'ratios': 'log_ratio', 'imputers': 'mean', 'n_estimators': 2900, 'learning_rate': 0.20774157286945627, 'max_depth': 8, 'min_child_weight': 1, 'subsample': 0.9, 'colsample_bytree': 0.9, 'colsample_bylevel': 0.7, 'reg_alpha': 8.576369762316322e-06, 'reg_lambda': 46.48153973159473, 'gamma': 0.0007026986362737067}. Best is trial 80 with value: -2.913757112215665.
[I 2026-07-14 18:52:58,476] Trial 92 finished with value: -2.7453954843672763 and parameters: {'scalers': 'standard', 'ratios': 'log_ratio', 'imputers': 'mean', 'n_estimators': 2900, 'learning_rate': 0.2361614805856873, 'max_depth': 8, 'min_child_weight': 1, 'subsample': 0.9, 'colsample_bytree': 0.9, 'colsample_bylevel': 0.7, 'reg_alpha': 8.260747575859553e-06, 'reg_lambda': 49.77340016461062, 'gamma': 0.0006894643122428889}. Best is trial 80 with value: -2.913757112215665.
[I 2026-07-14 18:53:42,929] Trial 93 finished with value: -2.0106340363474158 and parameters: {'scalers': 'standard', 'ratios': 'log_ratio', 'imputers': 'mean', 'n_estimators': 2900, 'learning_rate': 0.21096409431404728, 'max_depth': 8, 'min_child_weight': 1, 'subsample': 1.0, 'colsample_bytree': 0.9, 'colsample_bylevel': 0.7, 'reg_alpha': 1.4618964611747466e-06, 'reg_lambda': 39.108605086050616, 'gamma': 0.0009431199392179323}. Best is trial 80 with value: -2.913757112215665.
[I 2026-07-14 18:54:25,903] Trial 94 finished with value: -1.9721068950019869 and parameters: {'scalers': 'standard', 'ratios': 'log_ratio', 'imputers': 'mean', 'n_estimators': 2900, 'learning_rate': 0.1886430360760942, 'max_depth': 8, 'min_child_weight': 1, 'subsample': 1.0, 'colsample_bytree': 0.9, 'colsample_bylevel': 0.7, 'reg_alpha': 1.6752804721795426e-06, 'reg_lambda': 50.880853718158804, 'gamma': 0.0007103669197170953}. Best is trial 80 with value: -2.913757112215665.
[I 2026-07-14 18:54:31,372] Trial 95 finished with value: -1.5063469607938713 and parameters: {'scalers': 'standard', 'ratios': 'log_ratio', 'imputers': 'mean', 'n_estimators': 2900, 'learning_rate': 0.00010576220132663335, 'max_depth': 4, 'min_child_weight': 1, 'subsample': 1.0, 'colsample_bytree': 0.9, 'colsample_bylevel': 0.7, 'reg_alpha': 2.7139246016698508e-05, 'reg_lambda': 53.09570473518534, 'gamma': 0.015616245447663435}. Best is trial 80 with value: -2.913757112215665.
[I 2026-07-14 18:55:17,993] Trial 96 finished with value: -1.9222161167693415 and parameters: {'scalers': 'standard', 'ratios': 'log_ratio', 'imputers': 'mean', 'n_estimators': 2900, 'learning_rate': 0.17442144546967092, 'max_depth': 8, 'min_child_weight': 1, 'subsample': 1.0, 'colsample_bytree': 0.9, 'colsample_bylevel': 0.7, 'reg_alpha': 2.4720348268321395e-05, 'reg_lambda': 55.4321103762059, 'gamma': 0.00010226055876893156}. Best is trial 80 with value: -2.913757112215665.
[I 2026-07-14 18:56:01,220] Trial 97 finished with value: -1.9548634255633088 and parameters: {'scalers': 'standard', 'ratios': 'log_ratio', 'imputers': 'mean', 'n_estimators': 2900, 'learning_rate': 0.17625538867161247, 'max_depth': 8, 'min_child_weight': 1, 'subsample': 1.0, 'colsample_bytree': 0.9, 'colsample_bylevel': 0.7, 'reg_alpha': 1.8555273256536022e-06, 'reg_lambda': 32.513200663126284, 'gamma': 0.0023378342960209578}. Best is trial 80 with value: -2.913757112215665.
[I 2026-07-14 18:56:53,451] Trial 98 finished with value: -2.896963078967305 and parameters: {'scalers': 'standard', 'ratios': 'log_ratio', 'imputers': 'mean', 'n_estimators': 2900, 'learning_rate': 0.2829014277937481, 'max_depth': 8, 'min_child_weight': 1, 'subsample': 0.9, 'colsample_bytree': 0.9, 'colsample_bylevel': 0.7, 'reg_alpha': 1.0167656973931278e-06, 'reg_lambda': 31.20583137258189, 'gamma': 4.033628927070295e-05}. Best is trial 80 with value: -2.913757112215665.
[I 2026-07-14 18:57:45,107] Trial 99 finished with value: -2.432569742958654 and parameters: {'scalers': 'standard', 'ratios': 'log_ratio', 'imputers': 'mean', 'n_estimators': 2900, 'learning_rate': 0.1721819055872127, 'max_depth': 8, 'min_child_weight': 1, 'subsample': 0.9, 'colsample_bytree': 0.9, 'colsample_bylevel': 0.7, 'reg_alpha': 2.5339950207255967e-05, 'reg_lambda': 32.34899450397823, 'gamma': 0.003781643901110745}. Best is trial 80 with value: -2.913757112215665.
[I 2026-07-14 18:58:18,841] Trial 100 finished with value: -1.9002406880805736 and parameters: {'scalers': 'standard', 'ratios': 'log_ratio', 'imputers': 'mean', 'n_estimators': 2750, 'learning_rate': 0.17524678903517682, 'max_depth': 7, 'min_child_weight': 1, 'subsample': 1.0, 'colsample_bytree': 0.9, 'colsample_bylevel': 0.7, 'reg_alpha': 2.4735023898970137e-05, 'reg_lambda': 31.36267322940051, 'gamma': 0.0017014981684326611}. Best is trial 80 with value: -2.913757112215665.
[I 2026-07-14 18:58:47,368] Trial 101 finished with value: -1.5129042262441645 and parameters: {'scalers': 'standard', 'ratios': 'log_ratio', 'imputers': 'mean', 'n_estimators': 2750, 'learning_rate': 0.1718423361422088, 'max_depth': 7, 'min_child_weight': 1, 'subsample': 0.9, 'colsample_bytree': 0.9, 'colsample_bylevel': 0.7, 'reg_alpha': 2.3265049385389802e-05, 'reg_lambda': 61.48534102313763, 'gamma': 0.05375036227979418}. Best is trial 80 with value: -2.913757112215665.
[I 2026-07-14 18:59:20,785] Trial 102 finished with value: -2.517074906165761 and parameters: {'scalers': 'standard', 'ratios': 'log_ratio', 'imputers': 'mean', 'n_estimators': 2750, 'learning_rate': 0.2792291703385058, 'max_depth': 7, 'min_child_weight': 1, 'subsample': 0.9, 'colsample_bytree': 0.9, 'colsample_bylevel': 0.7, 'reg_alpha': 2.4793392331401478e-05, 'reg_lambda': 14.311761209082109, 'gamma': 0.002517625558739579}. Best is trial 80 with value: -2.913757112215665.
[I 2026-07-14 18:59:57,222] Trial 103 finished with value: -2.24007864096292 and parameters: {'scalers': 'standard', 'ratios': 'log_ratio', 'imputers': 'mean', 'n_estimators': 2750, 'learning_rate': 0.1718148540590056, 'max_depth': 7, 'min_child_weight': 1, 'subsample': 0.9, 'colsample_bytree': 0.9, 'colsample_bylevel': 0.8, 'reg_alpha': 2.554336091281882e-05, 'reg_lambda': 15.866393431651364, 'gamma': 0.002385155516242459}. Best is trial 80 with value: -2.913757112215665.
[I 2026-07-14 19:00:37,955] Trial 104 finished with value: -2.4825068177674745 and parameters: {'scalers': 'standard', 'ratios': 'log_ratio', 'imputers': 'mean', 'n_estimators': 2750, 'learning_rate': 0.2683147544696843, 'max_depth': 7, 'min_child_weight': 1, 'subsample': 0.9, 'colsample_bytree': 1.0, 'colsample_bylevel': 0.8, 'reg_alpha': 8.842131819285882e-06, 'reg_lambda': 15.322849424381975, 'gamma': 0.0028704429124665814}. Best is trial 80 with value: -2.913757112215665.
[I 2026-07-14 19:01:21,823] Trial 105 finished with value: -2.544373542122705 and parameters: {'scalers': 'standard', 'ratios': 'log_ratio', 'imputers': 'mean', 'n_estimators': 3000, 'learning_rate': 0.26714126474995914, 'max_depth': 7, 'min_child_weight': 1, 'subsample': 0.9, 'colsample_bytree': 1.0, 'colsample_bylevel': 0.8, 'reg_alpha': 1.0263398475076137e-05, 'reg_lambda': 14.33727822561715, 'gamma': 0.0016803850505704493}. Best is trial 80 with value: -2.913757112215665.
[I 2026-07-14 19:02:01,144] Trial 106 finished with value: -2.4881699740440415 and parameters: {'scalers': 'standard', 'ratios': 'log_ratio', 'imputers': 'mean', 'n_estimators': 2750, 'learning_rate': 0.28020719800711336, 'max_depth': 7, 'min_child_weight': 1, 'subsample': 0.9, 'colsample_bytree': 1.0, 'colsample_bylevel': 0.8, 'reg_alpha': 1.0576548550752505e-05, 'reg_lambda': 13.361104129339079, 'gamma': 0.00018598739518049519}. Best is trial 80 with value: -2.913757112215665.
[I 2026-07-14 19:02:44,453] Trial 107 finished with value: -1.983993183004824 and parameters: {'scalers': 'none', 'ratios': 'log_ratio', 'imputers': 'mean', 'n_estimators': 3000, 'learning_rate': 0.1115896777747474, 'max_depth': 7, 'min_child_weight': 1, 'subsample': 0.9, 'colsample_bytree': 1.0, 'colsample_bylevel': 0.8, 'reg_alpha': 2.7163476532887542e-05, 'reg_lambda': 13.547483644259442, 'gamma': 0.0074074096030465756}. Best is trial 80 with value: -2.913757112215665.
[I 2026-07-14 19:03:25,418] Trial 108 finished with value: -2.5225701959644455 and parameters: {'scalers': 'standard', 'ratios': 'log_ratio', 'imputers': 'mean', 'n_estimators': 2750, 'learning_rate': 0.2871748475952754, 'max_depth': 7, 'min_child_weight': 1, 'subsample': 0.9, 'colsample_bytree': 1.0, 'colsample_bylevel': 0.8, 'reg_alpha': 1.0029365990481192e-06, 'reg_lambda': 15.042944224596505, 'gamma': 0.006636776723957022}. Best is trial 80 with value: -2.913757112215665.
[I 2026-07-14 19:03:57,495] Trial 109 finished with value: -2.229746310018406 and parameters: {'scalers': 'standard', 'ratios': 'log_ratio', 'imputers': 'mean', 'n_estimators': 3000, 'learning_rate': 0.2763168719599083, 'max_depth': 6, 'min_child_weight': 1, 'subsample': 0.9, 'colsample_bytree': 1.0, 'colsample_bylevel': 0.8, 'reg_alpha': 1.063653802831381e-05, 'reg_lambda': 14.046194672241718, 'gamma': 0.0042970597015188}. Best is trial 80 with value: -2.913757112215665.
[I 2026-07-14 19:04:41,612] Trial 110 finished with value: -2.5058269479791426 and parameters: {'scalers': 'standard', 'ratios': 'log_ratio', 'imputers': 'mean', 'n_estimators': 3000, 'learning_rate': 0.28947246023995293, 'max_depth': 7, 'min_child_weight': 1, 'subsample': 0.9, 'colsample_bytree': 1.0, 'colsample_bylevel': 0.8, 'reg_alpha': 9.254691461571147e-06, 'reg_lambda': 14.22526782408153, 'gamma': 0.008493046262423075}. Best is trial 80 with value: -2.913757112215665.
[I 2026-07-14 19:05:25,015] Trial 111 finished with value: -2.517699486903548 and parameters: {'scalers': 'standard', 'ratios': 'log_ratio', 'imputers': 'mean', 'n_estimators': 3000, 'learning_rate': 0.25827549460938687, 'max_depth': 7, 'min_child_weight': 1, 'subsample': 0.9, 'colsample_bytree': 1.0, 'colsample_bylevel': 0.8, 'reg_alpha': 1.0752633492535823e-05, 'reg_lambda': 13.383195705138686, 'gamma': 0.00488108727739356}. Best is trial 80 with value: -2.913757112215665.
[I 2026-07-14 19:05:48,561] Trial 112 finished with value: -1.7270975297000841 and parameters: {'scalers': 'none', 'ratios': 'log_ratio', 'imputers': 'mean', 'n_estimators': 3000, 'learning_rate': 0.28560652418584326, 'max_depth': 6, 'min_child_weight': 1, 'subsample': 0.9, 'colsample_bytree': 1.0, 'colsample_bylevel': 0.8, 'reg_alpha': 9.54551252878019e-06, 'reg_lambda': 1.8328765745641542e-05, 'gamma': 0.0001651764957071014}. Best is trial 80 with value: -2.913757112215665.
[I 2026-07-14 19:06:19,552] Trial 113 finished with value: -1.778656857378468 and parameters: {'scalers': 'none', 'ratios': 'log_ratio', 'imputers': 'mean', 'n_estimators': 3000, 'learning_rate': 0.10172595959819328, 'max_depth': 6, 'min_child_weight': 1, 'subsample': 0.9, 'colsample_bytree': 1.0, 'colsample_bylevel': 0.8, 'reg_alpha': 1.0739548861623172e-05, 'reg_lambda': 11.08389151936015, 'gamma': 0.0002163088573229872}. Best is trial 80 with value: -2.913757112215665.
[I 2026-07-14 19:06:53,293] Trial 114 finished with value: -1.8708538978179388 and parameters: {'scalers': 'none', 'ratios': 'log_ratio', 'imputers': 'mean', 'n_estimators': 3000, 'learning_rate': 0.12276347470206554, 'max_depth': 6, 'min_child_weight': 1, 'subsample': 0.9, 'colsample_bytree': 1.0, 'colsample_bylevel': 0.8, 'reg_alpha': 1.2520802812806207e-05, 'reg_lambda': 24.40543421187708, 'gamma': 0.006900775155439446}. Best is trial 80 with value: -2.913757112215665.
[I 2026-07-14 19:06:58,152] Trial 115 finished with value: -1.746323507251109 and parameters: {'scalers': 'standard', 'ratios': 'log_ratio', 'imputers': 'mean', 'n_estimators': 1050, 'learning_rate': 0.25688333980499545, 'max_depth': 8, 'min_child_weight': 1, 'subsample': 0.9, 'colsample_bytree': 0.9, 'colsample_bylevel': 0.8, 'reg_alpha': 1.1307123297779697e-06, 'reg_lambda': 1.6039584214838083e-06, 'gamma': 0.00041315240091697775}. Best is trial 80 with value: -2.913757112215665.
[I 2026-07-14 19:07:20,465] Trial 116 finished with value: -1.6950978259048903 and parameters: {'scalers': 'standard', 'ratios': 'log_ratio', 'imputers': 'mean', 'n_estimators': 2850, 'learning_rate': 0.2841192715966241, 'max_depth': 6, 'min_child_weight': 1, 'subsample': 0.9, 'colsample_bytree': 1.0, 'colsample_bylevel': 0.8, 'reg_alpha': 0.0001208402268211822, 'reg_lambda': 2.2873355683452542e-05, 'gamma': 0.005440669532973932}. Best is trial 80 with value: -2.913757112215665.
[I 2026-07-14 19:07:31,135] Trial 117 finished with value: -1.4063071587731164 and parameters: {'scalers': 'standard', 'ratios': 'log_ratio', 'imputers': 'mean', 'n_estimators': 1050, 'learning_rate': 0.06350802105101029, 'max_depth': 6, 'min_child_weight': 1, 'subsample': 0.9, 'colsample_bytree': 1.0, 'colsample_bylevel': 0.8, 'reg_alpha': 1.0372110289101765e-06, 'reg_lambda': 7.523338809346158, 'gamma': 0.00035223856814512193}. Best is trial 80 with value: -2.913757112215665.
[I 2026-07-14 19:07:44,197] Trial 118 finished with value: -2.044221175839195 and parameters: {'scalers': 'standard', 'ratios': 'log_ratio', 'imputers': 'mean', 'n_estimators': 1150, 'learning_rate': 0.31471953840692807, 'max_depth': 6, 'min_child_weight': 1, 'subsample': 0.9, 'colsample_bytree': 1.0, 'colsample_bylevel': 0.8, 'reg_alpha': 5.830550391685119e-06, 'reg_lambda': 20.525437896069448, 'gamma': 0.00038058733454246084}. Best is trial 80 with value: -2.913757112215665.
[I 2026-07-14 19:08:12,628] Trial 119 finished with value: -1.824750361192987 and parameters: {'scalers': 'standard', 'ratios': 'log_ratio', 'imputers': 'mean', 'n_estimators': 2850, 'learning_rate': 0.13164049761078836, 'max_depth': 6, 'min_child_weight': 1, 'subsample': 0.9, 'colsample_bytree': 1.0, 'colsample_bylevel': 0.8, 'reg_alpha': 1.013632533223002e-06, 'reg_lambda': 8.31716376012688, 'gamma': 0.0013970377453103135}. Best is trial 80 with value: -2.913757112215665.
[I 2026-07-14 19:08:38,143] Trial 120 finished with value: -1.9013419254925954 and parameters: {'scalers': 'standard', 'ratios': 'log_ratio', 'imputers': 'mean', 'n_estimators': 2850, 'learning_rate': 0.13950917006761068, 'max_depth': 6, 'min_child_weight': 1, 'subsample': 0.9, 'colsample_bytree': 0.9, 'colsample_bylevel': 0.8, 'reg_alpha': 5.533963606789088e-06, 'reg_lambda': 8.236656211246281, 'gamma': 0.0003594838299944161}. Best is trial 80 with value: -2.913757112215665.
[I 2026-07-14 19:08:53,845] Trial 121 finished with value: -1.8175352354178829 and parameters: {'scalers': 'standard', 'ratios': 'log_ratio', 'imputers': 'mean', 'n_estimators': 1150, 'learning_rate': 0.13499330042062319, 'max_depth': 7, 'min_child_weight': 1, 'subsample': 0.9, 'colsample_bytree': 0.9, 'colsample_bylevel': 0.8, 'reg_alpha': 1.1447644587234454e-06, 'reg_lambda': 23.68841625049818, 'gamma': 0.0003990279356478455}. Best is trial 80 with value: -2.913757112215665.
[I 2026-07-14 19:09:25,496] Trial 122 finished with value: -2.0685009654742266 and parameters: {'scalers': 'standard', 'ratios': 'log_ratio', 'imputers': 'mean', 'n_estimators': 2850, 'learning_rate': 0.13783362630794813, 'max_depth': 7, 'min_child_weight': 1, 'subsample': 0.9, 'colsample_bytree': 0.9, 'colsample_bylevel': 0.7, 'reg_alpha': 5.77874356317477e-06, 'reg_lambda': 8.018640357216766, 'gamma': 0.0013034305350031064}. Best is trial 80 with value: -2.913757112215665.
[I 2026-07-14 19:09:56,504] Trial 123 finished with value: -1.992347853020045 and parameters: {'scalers': 'standard', 'ratios': 'log_ratio', 'imputers': 'mean', 'n_estimators': 2850, 'learning_rate': 0.12757723393277787, 'max_depth': 7, 'min_child_weight': 1, 'subsample': 0.9, 'colsample_bytree': 0.9, 'colsample_bylevel': 0.7, 'reg_alpha': 1.0251269833797324e-06, 'reg_lambda': 6.586987091458333, 'gamma': 0.0012985597909417521}. Best is trial 80 with value: -2.913757112215665.
[I 2026-07-14 19:10:33,157] Trial 124 finished with value: -1.550052906875822 and parameters: {'scalers': 'standard', 'ratios': 'log_ratio', 'imputers': 'mean', 'n_estimators': 2850, 'learning_rate': 0.06529054054076783, 'max_depth': 7, 'min_child_weight': 2, 'subsample': 0.9, 'colsample_bytree': 0.9, 'colsample_bylevel': 1.0, 'reg_alpha': 4.0648423981306594e-05, 'reg_lambda': 8.083255989110327, 'gamma': 0.016504583449524858}. Best is trial 80 with value: -2.913757112215665.
[I 2026-07-14 19:11:00,641] Trial 125 finished with value: -1.6034609897630914 and parameters: {'scalers': 'standard', 'ratios': 'log_ratio', 'imputers': 'mean', 'n_estimators': 2850, 'learning_rate': 0.3155808868223189, 'max_depth': 7, 'min_child_weight': 10, 'subsample': 0.9, 'colsample_bytree': 0.9, 'colsample_bylevel': 0.7, 'reg_alpha': 3.9082502096385854e-05, 'reg_lambda': 22.298479042463107, 'gamma': 0.001594888536742357}. Best is trial 80 with value: -2.913757112215665.
[I 2026-07-14 19:11:30,545] Trial 126 finished with value: -1.8339195246968445 and parameters: {'scalers': 'standard', 'ratios': 'log_ratio', 'imputers': 'mean', 'n_estimators': 2850, 'learning_rate': 0.14161682110209892, 'max_depth': 7, 'min_child_weight': 2, 'subsample': 0.9, 'colsample_bytree': 0.9, 'colsample_bylevel': 0.7, 'reg_alpha': 4.027322510608762e-05, 'reg_lambda': 8.31865471451116, 'gamma': 0.0014711059701358223}. Best is trial 80 with value: -2.913757112215665.
[I 2026-07-14 19:12:02,665] Trial 127 finished with value: -1.2777238178237018 and parameters: {'scalers': 'standard', 'ratios': 'log_ratio', 'imputers': 'mean', 'n_estimators': 2700, 'learning_rate': 0.0029675387465832887, 'max_depth': 7, 'min_child_weight': 2, 'subsample': 0.9, 'colsample_bytree': 0.9, 'colsample_bylevel': 0.7, 'reg_alpha': 4.6745113227134524e-05, 'reg_lambda': 26.051175241287115, 'gamma': 0.0330672478320514}. Best is trial 80 with value: -2.913757112215665.
[I 2026-07-14 19:12:35,357] Trial 128 finished with value: -2.4098092322190188 and parameters: {'scalers': 'standard', 'ratios': 'log_ratio', 'imputers': 'mean', 'n_estimators': 2700, 'learning_rate': 0.426444198946831, 'max_depth': 7, 'min_child_weight': 2, 'subsample': 0.9, 'colsample_bytree': 0.9, 'colsample_bylevel': 0.7, 'reg_alpha': 4.113095543831761e-05, 'reg_lambda': 25.25013507156403, 'gamma': 0.012746745018628968}. Best is trial 80 with value: -2.913757112215665.
[I 2026-07-14 19:13:10,564] Trial 129 finished with value: -2.2867629169568 and parameters: {'scalers': 'standard', 'ratios': 'log_ratio', 'imputers': 'mean', 'n_estimators': 2700, 'learning_rate': 0.4253933611888294, 'max_depth': 7, 'min_child_weight': 2, 'subsample': 0.9, 'colsample_bytree': 0.9, 'colsample_bylevel': 0.7, 'reg_alpha': 4.2333487918089845e-05, 'reg_lambda': 71.61116432601978, 'gamma': 0.008825343458918522}. Best is trial 80 with value: -2.913757112215665.
[I 2026-07-14 19:13:38,284] Trial 130 finished with value: -1.6928300308763133 and parameters: {'scalers': 'standard', 'ratios': 'log_ratio', 'imputers': 'mean', 'n_estimators': 2700, 'learning_rate': 0.4221068675255122, 'max_depth': 7, 'min_child_weight': 10, 'subsample': 0.9, 'colsample_bytree': 0.9, 'colsample_bylevel': 0.7, 'reg_alpha': 3.547932267608832e-06, 'reg_lambda': 68.96655774820074, 'gamma': 0.0018711593191591245}. Best is trial 80 with value: -2.913757112215665.
[I 2026-07-14 19:14:07,712] Trial 131 finished with value: -1.5879852539731534 and parameters: {'scalers': 'standard', 'ratios': 'log_ratio', 'imputers': 'mean', 'n_estimators': 2700, 'learning_rate': 0.23993041582947444, 'max_depth': 7, 'min_child_weight': 9, 'subsample': 0.9, 'colsample_bytree': 1.0, 'colsample_bylevel': 0.7, 'reg_alpha': 3.1552461848061955e-06, 'reg_lambda': 67.9964600958712, 'gamma': 0.023978611933418662}. Best is trial 80 with value: -2.913757112215665.
[I 2026-07-14 19:14:42,119] Trial 132 finished with value: -1.7938033959605848 and parameters: {'scalers': 'standard', 'ratios': 'log_ratio', 'imputers': 'mean', 'n_estimators': 2600, 'learning_rate': 0.441570625046103, 'max_depth': 8, 'min_child_weight': 9, 'subsample': 0.9, 'colsample_bytree': 1.0, 'colsample_bylevel': 0.7, 'reg_alpha': 3.5449523749530702e-06, 'reg_lambda': 26.532537667155875, 'gamma': 0.010274001214078269}. Best is trial 80 with value: -2.913757112215665.
[I 2026-07-14 19:15:16,704] Trial 133 finished with value: -1.7656850993177535 and parameters: {'scalers': 'standard', 'ratios': 'log_ratio', 'imputers': 'mean', 'n_estimators': 2700, 'learning_rate': 0.4352120160482576, 'max_depth': 8, 'min_child_weight': 9, 'subsample': 0.9, 'colsample_bytree': 1.0, 'colsample_bylevel': 0.7, 'reg_alpha': 2.6002449580191403e-06, 'reg_lambda': 17.77636593737415, 'gamma': 0.012648230352214214}. Best is trial 80 with value: -2.913757112215665.
[I 2026-07-14 19:15:55,944] Trial 134 finished with value: -1.3114437727263804 and parameters: {'scalers': 'standard', 'ratios': 'log_ratio', 'imputers': 'mean', 'n_estimators': 2700, 'learning_rate': 0.00432125092703806, 'max_depth': 8, 'min_child_weight': 2, 'subsample': 0.9, 'colsample_bytree': 1.0, 'colsample_bylevel': 0.7, 'reg_alpha': 3.120329676917224e-06, 'reg_lambda': 68.84895104979104, 'gamma': 0.021776434742432852}. Best is trial 80 with value: -2.913757112215665.
