[I 2026-07-14 17:21:11,290] Trial 135 finished with value: -0.4383607912764529 and parameters: {'scalers': 'none', 'ratios': 'norm_ratio', 'imputers': 'median', 'n_estimators': 1550, 'learning_rate': 0.40775110022038585, 'max_depth': 6, 'min_child_weight': 1, 'subsample': 0.5, 'colsample_bytree': 0.5, 'colsample_bylevel': 0.5, 'reg_alpha': 1.0651554284803841, 'reg_lambda': 6.8594987349084284e-06, 'gamma': 3.084006402310044e-05}. Best is trial 76 with value: -0.6637225783962517.
[I 2026-07-14 17:21:21,796] Trial 136 finished with value: -0.22112576832903116 and parameters: {'scalers': 'none', 'ratios': 'norm_ratio', 'imputers': 'median', 'n_estimators': 1350, 'learning_rate': 0.0002543205693931016, 'max_depth': 6, 'min_child_weight': 1, 'subsample': 0.5, 'colsample_bytree': 1.0, 'colsample_bylevel': 0.5, 'reg_alpha': 1.0324484768136815, 'reg_lambda': 1.0064788667351352e-06, 'gamma': 2.4025417208282208e-06}. Best is trial 76 with value: -0.6637225783962517.
[I 2026-07-14 17:21:28,518] Trial 137 finished with value: -0.296683518873949 and parameters: {'scalers': 'none', 'ratios': 'log_ratio', 'imputers': 'median', 'n_estimators': 1300, 'learning_rate': 0.31547830080860995, 'max_depth': 7, 'min_child_weight': 1, 'subsample': 0.5, 'colsample_bytree': 0.5, 'colsample_bylevel': 0.5, 'reg_alpha': 1.0563766875537819e-05, 'reg_lambda': 6.961033783186279e-06, 'gamma': 2.4938418110891357e-06}. Best is trial 76 with value: -0.6637225783962517.
[I 2026-07-14 17:21:49,018] Trial 138 finished with value: -0.4271195134335551 and parameters: {'scalers': 'none', 'ratios': 'norm_ratio', 'imputers': 'mean', 'n_estimators': 1400, 'learning_rate': 0.3243557898785625, 'max_depth': 12, 'min_child_weight': 1, 'subsample': 0.5, 'colsample_bytree': 0.5, 'colsample_bylevel': 0.5, 'reg_alpha': 0.00015717722850879925, 'reg_lambda': 5.2965510035925915e-06, 'gamma': 1.0515734152647235e-06}. Best is trial 76 with value: -0.6637225783962517.
[I 2026-07-14 17:21:54,876] Trial 139 finished with value: -0.2867894905354441 and parameters: {'scalers': 'none', 'ratios': 'norm_ratio', 'imputers': 'mean', 'n_estimators': 1550, 'learning_rate': 0.3167779097862669, 'max_depth': 6, 'min_child_weight': 1, 'subsample': 0.5, 'colsample_bytree': 0.5, 'colsample_bylevel': 0.5, 'reg_alpha': 1.7600386874154593e-05, 'reg_lambda': 6.064142109303486e-06, 'gamma': 1.043634369856069e-06}. Best is trial 76 with value: -0.6637225783962517.
[I 2026-07-14 17:22:13,251] Trial 140 finished with value: -0.7488042482213869 and parameters: {'scalers': 'none', 'ratios': 'norm_ratio', 'imputers': 'mean', 'n_estimators': 1300, 'learning_rate': 0.4993421203573616, 'max_depth': 10, 'min_child_weight': 1, 'subsample': 0.5, 'colsample_bytree': 0.5, 'colsample_bylevel': 0.5, 'reg_alpha': 1.072764744223894, 'reg_lambda': 5.30785084832937e-06, 'gamma': 3.334207134313276e-05}. Best is trial 140 with value: -0.7488042482213869.
[I 2026-07-14 17:22:19,488] Trial 141 finished with value: -0.35857588930017764 and parameters: {'scalers': 'none', 'ratios': 'norm_ratio', 'imputers': 'mean', 'n_estimators': 1250, 'learning_rate': 0.3216773387254569, 'max_depth': 6, 'min_child_weight': 1, 'subsample': 0.5, 'colsample_bytree': 0.5, 'colsample_bylevel': 0.5, 'reg_alpha': 0.5993760594545803, 'reg_lambda': 5.336812234599272e-06, 'gamma': 3.530846432571447e-05}. Best is trial 140 with value: -0.7488042482213869.
[I 2026-07-14 17:22:44,509] Trial 142 finished with value: -0.5278446421093023 and parameters: {'scalers': 'none', 'ratios': 'norm_ratio', 'imputers': 'mean', 'n_estimators': 1300, 'learning_rate': 0.31415255542972387, 'max_depth': 12, 'min_child_weight': 1, 'subsample': 0.5, 'colsample_bytree': 0.5, 'colsample_bylevel': 0.5, 'reg_alpha': 0.4881931639173062, 'reg_lambda': 5.501421232492328e-06, 'gamma': 2.5593905538744408e-06}. Best is trial 140 with value: -0.7488042482213869.
[I 2026-07-14 17:22:49,138] Trial 143 finished with value: -0.3106043717827936 and parameters: {'scalers': 'none', 'ratios': 'log_ratio', 'imputers': 'median', 'n_estimators': 1250, 'learning_rate': 0.31605455643013286, 'max_depth': 5, 'min_child_weight': 1, 'subsample': 0.5, 'colsample_bytree': 0.5, 'colsample_bylevel': 0.5, 'reg_alpha': 0.5779413236732361, 'reg_lambda': 5.023649334462161e-06, 'gamma': 6.88895565783169e-05}. Best is trial 140 with value: -0.7488042482213869.
[I 2026-07-14 17:23:13,105] Trial 144 finished with value: -0.5239510232069107 and parameters: {'scalers': 'none', 'ratios': 'log_ratio', 'imputers': 'median', 'n_estimators': 1250, 'learning_rate': 0.3194768959552964, 'max_depth': 12, 'min_child_weight': 1, 'subsample': 0.5, 'colsample_bytree': 0.5, 'colsample_bylevel': 0.5, 'reg_alpha': 0.5492441874639022, 'reg_lambda': 4.702638544853918e-06, 'gamma': 6.492191385245035e-06}. Best is trial 140 with value: -0.7488042482213869.
[I 2026-07-14 17:23:17,997] Trial 145 finished with value: -0.2540640148253796 and parameters: {'scalers': 'none', 'ratios': 'norm_ratio', 'imputers': 'median', 'n_estimators': 1250, 'learning_rate': 0.32381117331501946, 'max_depth': 5, 'min_child_weight': 1, 'subsample': 0.5, 'colsample_bytree': 0.5, 'colsample_bylevel': 0.5, 'reg_alpha': 3.1947447379255327, 'reg_lambda': 6.042672565885158e-06, 'gamma': 3.324741227859972e-05}. Best is trial 140 with value: -0.7488042482213869.
[I 2026-07-14 17:23:46,278] Trial 146 finished with value: -0.5932300950000708 and parameters: {'scalers': 'none', 'ratios': 'norm_ratio', 'imputers': 'median', 'n_estimators': 1400, 'learning_rate': 0.3953073596130072, 'max_depth': 12, 'min_child_weight': 1, 'subsample': 0.5, 'colsample_bytree': 0.5, 'colsample_bylevel': 0.5, 'reg_alpha': 0.6023588817055539, 'reg_lambda': 2.8614971523290146e-06, 'gamma': 7.243661700015216e-05}. Best is trial 140 with value: -0.7488042482213869.
[I 2026-07-14 17:23:52,934] Trial 147 finished with value: -0.2597256299181604 and parameters: {'scalers': 'none', 'ratios': 'norm_ratio', 'imputers': 'median', 'n_estimators': 1650, 'learning_rate': 0.23490195939820158, 'max_depth': 6, 'min_child_weight': 2, 'subsample': 0.5, 'colsample_bytree': 0.5, 'colsample_bylevel': 0.5, 'reg_alpha': 5.7961367797171045e-05, 'reg_lambda': 2.4163086925954483e-06, 'gamma': 7.45179248085324e-05}. Best is trial 140 with value: -0.7488042482213869.
[I 2026-07-14 17:24:08,445] Trial 148 finished with value: -0.5287799823111183 and parameters: {'scalers': 'none', 'ratios': 'norm_ratio', 'imputers': 'mean', 'n_estimators': 1250, 'learning_rate': 0.3832740184445209, 'max_depth': 12, 'min_child_weight': 1, 'subsample': 0.5, 'colsample_bytree': 0.5, 'colsample_bylevel': 0.5, 'reg_alpha': 2.8431049122547307, 'reg_lambda': 2.270480320647244e-06, 'gamma': 3.522920338298481e-05}. Best is trial 140 with value: -0.7488042482213869.
[I 2026-07-14 17:24:41,433] Trial 149 finished with value: -0.5909497671601596 and parameters: {'scalers': 'none', 'ratios': 'norm_ratio', 'imputers': 'mean', 'n_estimators': 1650, 'learning_rate': 0.39417246678734613, 'max_depth': 12, 'min_child_weight': 1, 'subsample': 0.5, 'colsample_bytree': 0.5, 'colsample_bylevel': 0.5, 'reg_alpha': 0.5460972054847186, 'reg_lambda': 2.3218660286278684e-06, 'gamma': 7.47448698516372e-05}. Best is trial 140 with value: -0.7488042482213869.
[I 2026-07-14 17:25:05,895] Trial 150 finished with value: -0.6758205729179254 and parameters: {'scalers': 'none', 'ratios': 'norm_ratio', 'imputers': 'mean', 'n_estimators': 1200, 'learning_rate': 0.49385163979392105, 'max_depth': 12, 'min_child_weight': 1, 'subsample': 0.5, 'colsample_bytree': 0.5, 'colsample_bylevel': 0.5, 'reg_alpha': 0.557627657408034, 'reg_lambda': 2.5505298529465918e-06, 'gamma': 7.73500775004658e-06}. Best is trial 140 with value: -0.7488042482213869.
[I 2026-07-14 17:25:22,974] Trial 151 finished with value: -0.3659333360831738 and parameters: {'scalers': 'none', 'ratios': 'norm_ratio', 'imputers': 'mean', 'n_estimators': 1650, 'learning_rate': 0.23212584054085653, 'max_depth': 11, 'min_child_weight': 1, 'subsample': 0.5, 'colsample_bytree': 0.5, 'colsample_bylevel': 0.5, 'reg_alpha': 2.626433294252567, 'reg_lambda': 2.946586459645886e-06, 'gamma': 0.008785658531465339}. Best is trial 140 with value: -0.7488042482213869.
[I 2026-07-14 17:25:46,824] Trial 152 finished with value: -0.6571203471986473 and parameters: {'scalers': 'none', 'ratios': 'log_ratio', 'imputers': 'mean', 'n_estimators': 1200, 'learning_rate': 0.4953492643380996, 'max_depth': 12, 'min_child_weight': 1, 'subsample': 0.5, 'colsample_bytree': 0.5, 'colsample_bylevel': 0.5, 'reg_alpha': 0.41881102462492004, 'reg_lambda': 2.850216067995973e-06, 'gamma': 7.004587506625552e-06}. Best is trial 140 with value: -0.7488042482213869.
[I 2026-07-14 17:26:19,002] Trial 153 finished with value: -0.6944178769887239 and parameters: {'scalers': 'none', 'ratios': 'log_ratio', 'imputers': 'mean', 'n_estimators': 1650, 'learning_rate': 0.4912758705227609, 'max_depth': 12, 'min_child_weight': 1, 'subsample': 0.5, 'colsample_bytree': 0.5, 'colsample_bylevel': 0.5, 'reg_alpha': 0.39709218779409555, 'reg_lambda': 2.627624172462822e-06, 'gamma': 6.871382030420535e-06}. Best is trial 140 with value: -0.7488042482213869.
[I 2026-07-14 17:26:39,197] Trial 154 finished with value: -0.48537157554519644 and parameters: {'scalers': 'none', 'ratios': 'log_ratio', 'imputers': 'median', 'n_estimators': 1150, 'learning_rate': 0.4992941582343814, 'max_depth': 12, 'min_child_weight': 2, 'subsample': 0.5, 'colsample_bytree': 0.5, 'colsample_bylevel': 0.5, 'reg_alpha': 0.429534811458208, 'reg_lambda': 2.61345677857619e-06, 'gamma': 9.405842142951403e-05}. Best is trial 140 with value: -0.7488042482213869.
[I 2026-07-14 17:27:02,578] Trial 155 finished with value: -0.6647190650641297 and parameters: {'scalers': 'none', 'ratios': 'log_ratio', 'imputers': 'median', 'n_estimators': 1200, 'learning_rate': 0.49622245628864736, 'max_depth': 12, 'min_child_weight': 1, 'subsample': 0.5, 'colsample_bytree': 0.5, 'colsample_bylevel': 0.5, 'reg_alpha': 0.42261073870872057, 'reg_lambda': 3.548810419562513e-06, 'gamma': 0.005684088940834595}. Best is trial 140 with value: -0.7488042482213869.
[I 2026-07-14 17:27:25,272] Trial 156 finished with value: -0.6507976551894026 and parameters: {'scalers': 'none', 'ratios': 'log_ratio', 'imputers': 'median', 'n_estimators': 1150, 'learning_rate': 0.4940992560316168, 'max_depth': 12, 'min_child_weight': 1, 'subsample': 0.5, 'colsample_bytree': 0.5, 'colsample_bylevel': 0.5, 'reg_alpha': 0.4243514944043977, 'reg_lambda': 3.016555128672679e-06, 'gamma': 0.00010626150075228867}. Best is trial 140 with value: -0.7488042482213869.
[I 2026-07-14 17:27:45,434] Trial 157 finished with value: -0.3758972632384891 and parameters: {'scalers': 'none', 'ratios': 'log_ratio', 'imputers': 'median', 'n_estimators': 1200, 'learning_rate': 0.22601705202709096, 'max_depth': 12, 'min_child_weight': 2, 'subsample': 0.5, 'colsample_bytree': 0.5, 'colsample_bylevel': 0.5, 'reg_alpha': 0.5571552794389415, 'reg_lambda': 3.8064175673104808e-06, 'gamma': 0.00013979408997918453}. Best is trial 140 with value: -0.7488042482213869.
[I 2026-07-14 17:28:09,102] Trial 158 finished with value: -0.6724586084319222 and parameters: {'scalers': 'none', 'ratios': 'log_ratio', 'imputers': 'median', 'n_estimators': 1200, 'learning_rate': 0.494311626278958, 'max_depth': 12, 'min_child_weight': 1, 'subsample': 0.5, 'colsample_bytree': 0.5, 'colsample_bylevel': 0.5, 'reg_alpha': 0.42640885447543897, 'reg_lambda': 3.7733228029123835e-06, 'gamma': 0.000283373785273641}. Best is trial 140 with value: -0.7488042482213869.
[I 2026-07-14 17:28:32,186] Trial 159 finished with value: -0.6754531383346436 and parameters: {'scalers': 'none', 'ratios': 'log_ratio', 'imputers': 'median', 'n_estimators': 1150, 'learning_rate': 0.49365981082925336, 'max_depth': 12, 'min_child_weight': 1, 'subsample': 0.5, 'colsample_bytree': 0.5, 'colsample_bylevel': 0.5, 'reg_alpha': 0.458566017976102, 'reg_lambda': 3.84196219811158e-06, 'gamma': 0.0001551768486112016}. Best is trial 140 with value: -0.7488042482213869.
[I 2026-07-14 17:28:52,270] Trial 160 finished with value: -0.47908921284805417 and parameters: {'scalers': 'none', 'ratios': 'log_ratio', 'imputers': 'median', 'n_estimators': 1150, 'learning_rate': 0.48665054295004834, 'max_depth': 12, 'min_child_weight': 2, 'subsample': 0.5, 'colsample_bytree': 0.5, 'colsample_bylevel': 0.5, 'reg_alpha': 0.3804496349148164, 'reg_lambda': 2.0885766879680338e-06, 'gamma': 0.00018299386504663735}. Best is trial 140 with value: -0.7488042482213869.
[I 2026-07-14 17:29:15,325] Trial 161 finished with value: -0.5660062503271617 and parameters: {'scalers': 'none', 'ratios': 'log_ratio', 'imputers': 'mean', 'n_estimators': 1200, 'learning_rate': 0.3839910228055635, 'max_depth': 12, 'min_child_weight': 1, 'subsample': 0.5, 'colsample_bytree': 0.5, 'colsample_bylevel': 0.5, 'reg_alpha': 0.4047636965940576, 'reg_lambda': 2.148641072961901e-06, 'gamma': 0.00020158015791967701}. Best is trial 140 with value: -0.7488042482213869.
[I 2026-07-14 17:29:38,340] Trial 162 finished with value: -0.6786497524236464 and parameters: {'scalers': 'none', 'ratios': 'log_ratio', 'imputers': 'mean', 'n_estimators': 1150, 'learning_rate': 0.49402864753748, 'max_depth': 12, 'min_child_weight': 1, 'subsample': 0.5, 'colsample_bytree': 0.5, 'colsample_bylevel': 0.5, 'reg_alpha': 0.5109012945755684, 'reg_lambda': 3.6711817854511717e-06, 'gamma': 0.0001446949126554015}. Best is trial 140 with value: -0.7488042482213869.
[I 2026-07-14 17:29:59,939] Trial 163 finished with value: -0.5428402514100145 and parameters: {'scalers': 'none', 'ratios': 'log_ratio', 'imputers': 'median', 'n_estimators': 1150, 'learning_rate': 0.38311439853279605, 'max_depth': 12, 'min_child_weight': 1, 'subsample': 0.5, 'colsample_bytree': 0.5, 'colsample_bylevel': 0.5, 'reg_alpha': 0.37751120163859153, 'reg_lambda': 4.633941140004056e-06, 'gamma': 0.00015640187396016465}. Best is trial 140 with value: -0.7488042482213869.
[I 2026-07-14 17:30:21,170] Trial 164 finished with value: -0.5284612949202147 and parameters: {'scalers': 'none', 'ratios': 'log_ratio', 'imputers': 'mean', 'n_estimators': 1150, 'learning_rate': 0.36940887974046427, 'max_depth': 12, 'min_child_weight': 1, 'subsample': 0.5, 'colsample_bytree': 0.5, 'colsample_bylevel': 0.5, 'reg_alpha': 0.34959143742333165, 'reg_lambda': 1.967819415067598e-06, 'gamma': 0.011866490146370446}. Best is trial 140 with value: -0.7488042482213869.
[I 2026-07-14 17:30:41,128] Trial 165 finished with value: -0.5164898509742063 and parameters: {'scalers': 'none', 'ratios': 'log_ratio', 'imputers': 'mean', 'n_estimators': 1150, 'learning_rate': 0.388173075768084, 'max_depth': 12, 'min_child_weight': 1, 'subsample': 0.5, 'colsample_bytree': 0.5, 'colsample_bylevel': 0.5, 'reg_alpha': 0.23695655284019934, 'reg_lambda': 2.063106778259244e-06, 'gamma': 0.000720954020391948}. Best is trial 140 with value: -0.7488042482213869.
[I 2026-07-14 17:30:58,702] Trial 166 finished with value: -0.5055617670967064 and parameters: {'scalers': 'none', 'ratios': 'log_ratio', 'imputers': 'median', 'n_estimators': 1000, 'learning_rate': 0.38277184444262974, 'max_depth': 12, 'min_child_weight': 1, 'subsample': 0.5, 'colsample_bytree': 0.5, 'colsample_bylevel': 0.5, 'reg_alpha': 0.2360384092877029, 'reg_lambda': 1.9785374224459025e-06, 'gamma': 0.000780220976247555}. Best is trial 140 with value: -0.7488042482213869.
[I 2026-07-14 17:31:17,791] Trial 167 finished with value: -0.5095070357414996 and parameters: {'scalers': 'none', 'ratios': 'log_ratio', 'imputers': 'median', 'n_estimators': 1100, 'learning_rate': 0.38612868143734846, 'max_depth': 12, 'min_child_weight': 1, 'subsample': 0.5, 'colsample_bytree': 0.5, 'colsample_bylevel': 0.5, 'reg_alpha': 0.22001269715003305, 'reg_lambda': 1.948995488432098e-06, 'gamma': 0.0004652470172733781}. Best is trial 140 with value: -0.7488042482213869.
[I 2026-07-14 17:31:35,311] Trial 168 finished with value: -0.4983749337333346 and parameters: {'scalers': 'none', 'ratios': 'log_ratio', 'imputers': 'median', 'n_estimators': 1000, 'learning_rate': 0.3823072177612958, 'max_depth': 12, 'min_child_weight': 1, 'subsample': 0.5, 'colsample_bytree': 0.5, 'colsample_bylevel': 0.5, 'reg_alpha': 0.25984816983492476, 'reg_lambda': 1.6665609135648721e-06, 'gamma': 0.0005858595172121452}. Best is trial 140 with value: -0.7488042482213869.
[I 2026-07-14 17:31:51,943] Trial 169 finished with value: -0.49839393948164046 and parameters: {'scalers': 'none', 'ratios': 'log_ratio', 'imputers': 'median', 'n_estimators': 950, 'learning_rate': 0.3749701121196317, 'max_depth': 12, 'min_child_weight': 1, 'subsample': 0.5, 'colsample_bytree': 0.5, 'colsample_bylevel': 0.5, 'reg_alpha': 0.22550344437175587, 'reg_lambda': 1.5964895860659174e-06, 'gamma': 0.000868157886238445}. Best is trial 140 with value: -0.7488042482213869.
[I 2026-07-14 17:32:10,052] Trial 170 finished with value: -0.5026878608717045 and parameters: {'scalers': 'none', 'ratios': 'log_ratio', 'imputers': 'median', 'n_estimators': 1050, 'learning_rate': 0.39039571763782543, 'max_depth': 12, 'min_child_weight': 1, 'subsample': 0.5, 'colsample_bytree': 0.5, 'colsample_bylevel': 0.5, 'reg_alpha': 0.22097109972890416, 'reg_lambda': 3.620517538322562e-06, 'gamma': 0.0007693037417266537}. Best is trial 140 with value: -0.7488042482213869.
[I 2026-07-14 17:32:28,698] Trial 171 finished with value: -0.4989519430308481 and parameters: {'scalers': 'none', 'ratios': 'log_ratio', 'imputers': 'median', 'n_estimators': 1050, 'learning_rate': 0.3747079367974861, 'max_depth': 12, 'min_child_weight': 1, 'subsample': 0.5, 'colsample_bytree': 0.5, 'colsample_bylevel': 0.5, 'reg_alpha': 0.2395886649157112, 'reg_lambda': 1.641353412603292e-06, 'gamma': 0.0003358191937187952}. Best is trial 140 with value: -0.7488042482213869.
[I 2026-07-14 17:32:50,371] Trial 172 finished with value: -0.5692612899009188 and parameters: {'scalers': 'none', 'ratios': 'log_ratio', 'imputers': 'median', 'n_estimators': 1050, 'learning_rate': 0.3869569712408606, 'max_depth': 12, 'min_child_weight': 1, 'subsample': 0.5, 'colsample_bytree': 0.5, 'colsample_bylevel': 0.5, 'reg_alpha': 0.6866775502502186, 'reg_lambda': 3.5783800975415116e-06, 'gamma': 0.0006508517685758338}. Best is trial 140 with value: -0.7488042482213869.
[I 2026-07-14 17:33:08,649] Trial 173 finished with value: -0.5021909594354448 and parameters: {'scalers': 'none', 'ratios': 'log_ratio', 'imputers': 'median', 'n_estimators': 1050, 'learning_rate': 0.37230051179399626, 'max_depth': 12, 'min_child_weight': 1, 'subsample': 0.5, 'colsample_bytree': 0.5, 'colsample_bylevel': 0.5, 'reg_alpha': 0.22512387701942194, 'reg_lambda': 3.3993857057527647e-06, 'gamma': 0.00029740297991656304}. Best is trial 140 with value: -0.7488042482213869.
[I 2026-07-14 17:33:27,688] Trial 174 finished with value: -0.6771862824498361 and parameters: {'scalers': 'none', 'ratios': 'log_ratio', 'imputers': 'median', 'n_estimators': 1050, 'learning_rate': 0.49486667939965967, 'max_depth': 11, 'min_child_weight': 1, 'subsample': 0.5, 'colsample_bytree': 0.5, 'colsample_bylevel': 0.5, 'reg_alpha': 0.6830250345984953, 'reg_lambda': 9.044432084859859e-06, 'gamma': 0.0003276060777390324}. Best is trial 140 with value: -0.7488042482213869.
[I 2026-07-14 17:33:45,441] Trial 175 finished with value: -0.6592769421821545 and parameters: {'scalers': 'none', 'ratios': 'log_ratio', 'imputers': 'median', 'n_estimators': 1000, 'learning_rate': 0.490751733464488, 'max_depth': 11, 'min_child_weight': 1, 'subsample': 0.5, 'colsample_bytree': 0.5, 'colsample_bylevel': 0.5, 'reg_alpha': 0.634380243348751, 'reg_lambda': 3.808794688174563e-06, 'gamma': 0.00023324162210519754}. Best is trial 140 with value: -0.7488042482213869.
[I 2026-07-14 17:34:03,745] Trial 176 finished with value: -0.663682288137025 and parameters: {'scalers': 'none', 'ratios': 'log_ratio', 'imputers': 'median', 'n_estimators': 1050, 'learning_rate': 0.4949850778939151, 'max_depth': 11, 'min_child_weight': 1, 'subsample': 0.5, 'colsample_bytree': 0.5, 'colsample_bylevel': 0.5, 'reg_alpha': 0.572380517396755, 'reg_lambda': 3.6071089259345177e-06, 'gamma': 0.0001920114242418423}. Best is trial 140 with value: -0.7488042482213869.
[I 2026-07-14 17:34:22,558] Trial 177 finished with value: -0.6880366028943494 and parameters: {'scalers': 'none', 'ratios': 'log_ratio', 'imputers': 'median', 'n_estimators': 1050, 'learning_rate': 0.49775846181093614, 'max_depth': 11, 'min_child_weight': 1, 'subsample': 0.5, 'colsample_bytree': 0.5, 'colsample_bylevel': 0.5, 'reg_alpha': 0.6923325720153808, 'reg_lambda': 3.3939593400750695e-06, 'gamma': 0.00010166547491520973}. Best is trial 140 with value: -0.7488042482213869.
[I 2026-07-14 17:34:44,035] Trial 178 finished with value: -0.6852940728315614 and parameters: {'scalers': 'robust', 'ratios': 'log_ratio', 'imputers': 'median', 'n_estimators': 1200, 'learning_rate': 0.4878816623665164, 'max_depth': 11, 'min_child_weight': 1, 'subsample': 0.5, 'colsample_bytree': 0.5, 'colsample_bylevel': 0.5, 'reg_alpha': 0.6767100231954407, 'reg_lambda': 3.941520762209906e-06, 'gamma': 0.0003046231298993267}. Best is trial 140 with value: -0.7488042482213869.
[I 2026-07-14 17:35:05,356] Trial 179 finished with value: -0.6502235020612401 and parameters: {'scalers': 'robust', 'ratios': 'log_ratio', 'imputers': 'median', 'n_estimators': 1200, 'learning_rate': 0.4641039451346238, 'max_depth': 11, 'min_child_weight': 1, 'subsample': 0.5, 'colsample_bytree': 0.5, 'colsample_bylevel': 0.5, 'reg_alpha': 0.6714036652065574, 'reg_lambda': 3.987652276009044e-06, 'gamma': 0.00025031028953544614}. Best is trial 140 with value: -0.7488042482213869.
