[I 2026-07-14 23:13:01,712] Trial 317 finished with value: -3.635748261400723 and parameters: {'scalers': 'standard', 'ratios': 'log_ratio', 'imputers': 'none', 'n_estimators': 2900, 'learning_rate': 0.4936483633210218, 'max_depth': 9, 'min_child_weight': 1, 'subsample': 0.9, 'colsample_bytree': 0.6, 'colsample_bylevel': 0.7, 'reg_alpha': 0.35715604774034454, 'reg_lambda': 4.937769274855476, 'gamma': 0.0034541981019964828}. Best is trial 314 with value: -4.0560792595724395.
[I 2026-07-14 23:13:30,020] Trial 318 finished with value: -3.5406564342589615 and parameters: {'scalers': 'standard', 'ratios': 'log_ratio', 'imputers': 'none', 'n_estimators': 3000, 'learning_rate': 0.4934940786751085, 'max_depth': 9, 'min_child_weight': 1, 'subsample': 0.9, 'colsample_bytree': 0.6, 'colsample_bylevel': 1.0, 'reg_alpha': 0.39065966303019123, 'reg_lambda': 4.693785512475605, 'gamma': 0.00022885781811417974}. Best is trial 314 with value: -4.0560792595724395.
[I 2026-07-14 23:13:56,466] Trial 319 finished with value: -3.6688187218792425 and parameters: {'scalers': 'standard', 'ratios': 'log_ratio', 'imputers': 'none', 'n_estimators': 2900, 'learning_rate': 0.49384653218515046, 'max_depth': 9, 'min_child_weight': 1, 'subsample': 0.8, 'colsample_bytree': 0.6, 'colsample_bylevel': 1.0, 'reg_alpha': 0.372921279724924, 'reg_lambda': 2.895780627907615, 'gamma': 0.00024010883571425688}. Best is trial 314 with value: -4.0560792595724395.
