[I 2026-07-14 18:19:23,649] Trial 137 finished with value: -3.4172346944521963 and parameters: {'scalers': 'none', 'ratios': 'norm_ratio', 'imputers': 'none', 'n_estimators': 2150, 'learning_rate': 0.47998604508953646, 'max_depth': 9, 'min_child_weight': 1, 'subsample': 0.5, 'colsample_bytree': 1.0, 'colsample_bylevel': 0.6, 'reg_alpha': 0.011485198165670887, 'reg_lambda': 1.6417125828583756, 'gamma': 0.09496934137483273}. Best is trial 62 with value: -4.109958479178393.
[I 2026-07-14 18:20:00,923] Trial 138 finished with value: -4.231116011606298 and parameters: {'scalers': 'none', 'ratios': 'norm_ratio', 'imputers': 'none', 'n_estimators': 2150, 'learning_rate': 0.4981706582282269, 'max_depth': 9, 'min_child_weight': 1, 'subsample': 0.5, 'colsample_bytree': 1.0, 'colsample_bylevel': 0.6, 'reg_alpha': 0.004211792546259795, 'reg_lambda': 3.9149566671425213, 'gamma': 0.06642987786000779}. Best is trial 138 with value: -4.231116011606298.
[I 2026-07-14 18:20:35,052] Trial 140 finished with value: -1.5341933056185577 and parameters: {'scalers': 'none', 'ratios': 'norm_ratio', 'imputers': 'none', 'n_estimators': 2150, 'learning_rate': 0.4778979809280212, 'max_depth': 9, 'min_child_weight': 1, 'subsample': 0.5, 'colsample_bytree': 1.0, 'colsample_bylevel': 0.6, 'reg_alpha': 8.284156882042412, 'reg_lambda': 4.10187372089172, 'gamma': 0.10084176916320162}. Best is trial 138 with value: -4.231116011606298.
[I 2026-07-14 18:20:37,455] Trial 139 finished with value: -4.019604627835774 and parameters: {'scalers': 'none', 'ratios': 'norm_ratio', 'imputers': 'none', 'n_estimators': 2150, 'learning_rate': 0.49310894364511726, 'max_depth': 9, 'min_child_weight': 1, 'subsample': 0.5, 'colsample_bytree': 1.0, 'colsample_bylevel': 0.6, 'reg_alpha': 0.010732041130182004, 'reg_lambda': 4.508946499556756, 'gamma': 0.10536024188844664}. Best is trial 138 with value: -4.231116011606298.
[I 2026-07-14 18:21:10,914] Trial 142 finished with value: -1.3882953815239232 and parameters: {'scalers': 'none', 'ratios': 'norm_ratio', 'imputers': 'none', 'n_estimators': 2150, 'learning_rate': 0.4972333989980582, 'max_depth': 9, 'min_child_weight': 1, 'subsample': 0.5, 'colsample_bytree': 1.0, 'colsample_bylevel': 0.6, 'reg_alpha': 0.014218766722494704, 'reg_lambda': 4.051912975496338, 'gamma': 7.805619864440424}. Best is trial 138 with value: -4.231116011606298.
[I 2026-07-14 18:21:13,802] Trial 141 finished with value: -4.048467158384234 and parameters: {'scalers': 'none', 'ratios': 'norm_ratio', 'imputers': 'none', 'n_estimators': 2150, 'learning_rate': 0.48938706577938745, 'max_depth': 9, 'min_child_weight': 1, 'subsample': 0.5, 'colsample_bytree': 1.0, 'colsample_bylevel': 0.6, 'reg_alpha': 0.004695855594083804, 'reg_lambda': 4.265482948760929, 'gamma': 0.10425318583400951}. Best is trial 138 with value: -4.231116011606298.
[I 2026-07-14 18:21:49,955] Trial 143 finished with value: -3.994622935815886 and parameters: {'scalers': 'standard', 'ratios': 'norm_ratio', 'imputers': 'none', 'n_estimators': 2150, 'learning_rate': 0.496925496036532, 'max_depth': 9, 'min_child_weight': 1, 'subsample': 0.5, 'colsample_bytree': 1.0, 'colsample_bylevel': 0.6, 'reg_alpha': 0.010863329019151725, 'reg_lambda': 4.576398684581185, 'gamma': 0.11345792434373855}. Best is trial 138 with value: -4.231116011606298.
[I 2026-07-14 18:22:19,057] Trial 144 finished with value: -2.6488807301568102 and parameters: {'scalers': 'standard', 'ratios': 'norm_ratio', 'imputers': 'none', 'n_estimators': 2150, 'learning_rate': 0.4777407937044009, 'max_depth': 9, 'min_child_weight': 1, 'subsample': 0.5, 'colsample_bytree': 1.0, 'colsample_bylevel': 0.6, 'reg_alpha': 0.012957868088290154, 'reg_lambda': 12.009067429797875, 'gamma': 0.1416552710565085}. Best is trial 138 with value: -4.231116011606298.
[I 2026-07-14 18:22:21,027] Trial 145 finished with value: -1.3401966690069096 and parameters: {'scalers': 'none', 'ratios': 'norm_ratio', 'imputers': 'none', 'n_estimators': 2150, 'learning_rate': 0.48450112585026106, 'max_depth': 9, 'min_child_weight': 1, 'subsample': 0.5, 'colsample_bytree': 1.0, 'colsample_bylevel': 0.6, 'reg_alpha': 0.0321655797209308, 'reg_lambda': 4.749604502879612, 'gamma': 3.930573065332314}. Best is trial 138 with value: -4.231116011606298.
[I 2026-07-14 18:22:56,782] Trial 146 finished with value: -3.1060457587630013 and parameters: {'scalers': 'standard', 'ratios': 'norm_ratio', 'imputers': 'none', 'n_estimators': 2100, 'learning_rate': 0.31748798234476283, 'max_depth': 9, 'min_child_weight': 1, 'subsample': 0.5, 'colsample_bytree': 1.0, 'colsample_bylevel': 0.6, 'reg_alpha': 1.0931822784704792e-06, 'reg_lambda': 4.2839330364629165, 'gamma': 0.03658446770413212}. Best is trial 138 with value: -4.231116011606298.
[I 2026-07-14 18:23:30,221] Trial 147 finished with value: -3.0616233761286433 and parameters: {'scalers': 'standard', 'ratios': 'norm_ratio', 'imputers': 'none', 'n_estimators': 2050, 'learning_rate': 0.3211068488536742, 'max_depth': 9, 'min_child_weight': 1, 'subsample': 0.5, 'colsample_bytree': 1.0, 'colsample_bylevel': 0.6, 'reg_alpha': 1.4307569491256096e-06, 'reg_lambda': 4.929955273747886, 'gamma': 0.10287064346212492}. Best is trial 138 with value: -4.231116011606298.
[I 2026-07-14 18:24:02,323] Trial 148 finished with value: -2.9928912944604544 and parameters: {'scalers': 'standard', 'ratios': 'norm_ratio', 'imputers': 'none', 'n_estimators': 2100, 'learning_rate': 0.3221902527418984, 'max_depth': 9, 'min_child_weight': 1, 'subsample': 0.5, 'colsample_bytree': 1.0, 'colsample_bylevel': 0.6, 'reg_alpha': 0.005096704995220216, 'reg_lambda': 4.102206282418532, 'gamma': 0.1252153583738301}. Best is trial 138 with value: -4.231116011606298.
[I 2026-07-14 18:24:31,496] Trial 149 finished with value: -2.399276266134852 and parameters: {'scalers': 'standard', 'ratios': 'norm_ratio', 'imputers': 'none', 'n_estimators': 2050, 'learning_rate': 0.31357747668156816, 'max_depth': 9, 'min_child_weight': 1, 'subsample': 0.5, 'colsample_bytree': 1.0, 'colsample_bylevel': 0.6, 'reg_alpha': 0.0048843846487451, 'reg_lambda': 10.344297683304791, 'gamma': 0.12212456275795308}. Best is trial 138 with value: -4.231116011606298.
[I 2026-07-14 18:24:58,598] Trial 150 finished with value: -2.1395489147251454 and parameters: {'scalers': 'standard', 'ratios': 'norm_ratio', 'imputers': 'none', 'n_estimators': 2050, 'learning_rate': 0.33936657120643665, 'max_depth': 9, 'min_child_weight': 1, 'subsample': 0.5, 'colsample_bytree': 1.0, 'colsample_bylevel': 0.6, 'reg_alpha': 0.023737665473509282, 'reg_lambda': 16.442182739672546, 'gamma': 0.12549507745614702}. Best is trial 138 with value: -4.231116011606298.
[I 2026-07-14 18:25:23,155] Trial 151 finished with value: -2.0579802628099224 and parameters: {'scalers': 'standard', 'ratios': 'norm_ratio', 'imputers': 'none', 'n_estimators': 2050, 'learning_rate': 0.32543563991914487, 'max_depth': 9, 'min_child_weight': 1, 'subsample': 0.5, 'colsample_bytree': 1.0, 'colsample_bylevel': 0.6, 'reg_alpha': 0.00987957840318846, 'reg_lambda': 9.877544361232221, 'gamma': 0.16329592260778972}. Best is trial 138 with value: -4.231116011606298.
[I 2026-07-14 18:25:56,049] Trial 152 finished with value: -2.705036124125625 and parameters: {'scalers': 'standard', 'ratios': 'norm_ratio', 'imputers': 'none', 'n_estimators': 2050, 'learning_rate': 0.33151641947554117, 'max_depth': 9, 'min_child_weight': 1, 'subsample': 0.5, 'colsample_bytree': 1.0, 'colsample_bylevel': 0.6, 'reg_alpha': 0.026526155124174566, 'reg_lambda': 10.087659309440074, 'gamma': 0.10128853730915945}. Best is trial 138 with value: -4.231116011606298.
[I 2026-07-14 18:26:15,640] Trial 153 finished with value: -1.436955104207634 and parameters: {'scalers': 'standard', 'ratios': 'norm_ratio', 'imputers': 'none', 'n_estimators': 2350, 'learning_rate': 0.32434256555512775, 'max_depth': 9, 'min_child_weight': 1, 'subsample': 0.5, 'colsample_bytree': 1.0, 'colsample_bylevel': 0.7, 'reg_alpha': 0.009857464880454424, 'reg_lambda': 8.687319309995708, 'gamma': 0.5392262335658506}. Best is trial 138 with value: -4.231116011606298.
[I 2026-07-14 18:26:50,293] Trial 154 finished with value: -2.6780206737154364 and parameters: {'scalers': 'standard', 'ratios': 'norm_ratio', 'imputers': 'none', 'n_estimators': 2050, 'learning_rate': 0.3451408689965607, 'max_depth': 9, 'min_child_weight': 1, 'subsample': 0.5, 'colsample_bytree': 1.0, 'colsample_bylevel': 0.7, 'reg_alpha': 0.005504287024244599, 'reg_lambda': 9.635730158217793, 'gamma': 0.11329310128205622}. Best is trial 138 with value: -4.231116011606298.
[I 2026-07-14 18:27:08,525] Trial 155 finished with value: -1.4359600775283339 and parameters: {'scalers': 'standard', 'ratios': 'norm_ratio', 'imputers': 'none', 'n_estimators': 2350, 'learning_rate': 0.34848882826602134, 'max_depth': 10, 'min_child_weight': 1, 'subsample': 0.5, 'colsample_bytree': 1.0, 'colsample_bylevel': 0.7, 'reg_alpha': 0.0094954497900186, 'reg_lambda': 9.167895559240762, 'gamma': 0.6825756209031464}. Best is trial 138 with value: -4.231116011606298.
[I 2026-07-14 18:27:22,137] Trial 156 finished with value: -1.4243049232601093 and parameters: {'scalers': 'standard', 'ratios': 'norm_ratio', 'imputers': 'none', 'n_estimators': 1950, 'learning_rate': 0.36198610867571424, 'max_depth': 10, 'min_child_weight': 1, 'subsample': 0.5, 'colsample_bytree': 1.0, 'colsample_bylevel': 0.6, 'reg_alpha': 0.0011398981190255044, 'reg_lambda': 16.371417561286567, 'gamma': 0.5657138275859366}. Best is trial 138 with value: -4.231116011606298.
[I 2026-07-14 18:28:00,936] Trial 157 finished with value: -3.0920171670929317 and parameters: {'scalers': 'standard', 'ratios': 'norm_ratio', 'imputers': 'none', 'n_estimators': 1950, 'learning_rate': 0.3530055903482483, 'max_depth': 10, 'min_child_weight': 1, 'subsample': 0.5, 'colsample_bytree': 1.0, 'colsample_bylevel': 0.7, 'reg_alpha': 0.009044636949736548, 'reg_lambda': 2.0436345278789876, 'gamma': 0.06534581966334767}. Best is trial 138 with value: -4.231116011606298.
[I 2026-07-14 18:28:29,477] Trial 158 finished with value: -1.9213296873044607 and parameters: {'scalers': 'none', 'ratios': 'norm_ratio', 'imputers': 'none', 'n_estimators': 2350, 'learning_rate': 0.3566180090022165, 'max_depth': 10, 'min_child_weight': 1, 'subsample': 0.5, 'colsample_bytree': 1.0, 'colsample_bylevel': 0.6, 'reg_alpha': 0.0013053881761496177, 'reg_lambda': 2.0176558976866334, 'gamma': 0.25070197220284074}. Best is trial 138 with value: -4.231116011606298.
[I 2026-07-14 18:29:16,793] Trial 159 finished with value: -3.997212152045984 and parameters: {'scalers': 'none', 'ratios': 'norm_ratio', 'imputers': 'none', 'n_estimators': 2300, 'learning_rate': 0.49819872324447, 'max_depth': 10, 'min_child_weight': 1, 'subsample': 0.5, 'colsample_bytree': 1.0, 'colsample_bylevel': 0.7, 'reg_alpha': 0.0012724301002469283, 'reg_lambda': 2.017426590114263, 'gamma': 0.05789882769775531}. Best is trial 138 with value: -4.231116011606298.
[I 2026-07-14 18:29:40,436] Trial 160 finished with value: -1.468390263759139 and parameters: {'scalers': 'none', 'ratios': 'norm_ratio', 'imputers': 'none', 'n_estimators': 2350, 'learning_rate': 0.36851773175852987, 'max_depth': 10, 'min_child_weight': 1, 'subsample': 0.5, 'colsample_bytree': 1.0, 'colsample_bylevel': 0.7, 'reg_alpha': 0.00856684299524132, 'reg_lambda': 2.106097922825841, 'gamma': 0.6163196676891433}. Best is trial 138 with value: -4.231116011606298.
[I 2026-07-14 18:30:17,393] Trial 161 finished with value: -3.2498952125456952 and parameters: {'scalers': 'none', 'ratios': 'norm_ratio', 'imputers': 'none', 'n_estimators': 1950, 'learning_rate': 0.37225998963232715, 'max_depth': 10, 'min_child_weight': 1, 'subsample': 0.5, 'colsample_bytree': 1.0, 'colsample_bylevel': 0.6, 'reg_alpha': 0.007722616417983221, 'reg_lambda': 2.237602500913635, 'gamma': 0.05855205958894557}. Best is trial 138 with value: -4.231116011606298.
[I 2026-07-14 18:31:00,443] Trial 162 finished with value: -3.3808062049219987 and parameters: {'scalers': 'none', 'ratios': 'norm_ratio', 'imputers': 'none', 'n_estimators': 2300, 'learning_rate': 0.36963972476889523, 'max_depth': 10, 'min_child_weight': 1, 'subsample': 0.5, 'colsample_bytree': 1.0, 'colsample_bylevel': 0.6, 'reg_alpha': 0.001153376674050085, 'reg_lambda': 2.141297727249858, 'gamma': 0.05653588267163737}. Best is trial 138 with value: -4.231116011606298.
[I 2026-07-14 18:31:35,987] Trial 163 finished with value: -2.829511897648036 and parameters: {'scalers': 'none', 'ratios': 'norm_ratio', 'imputers': 'none', 'n_estimators': 1950, 'learning_rate': 0.23012177665001823, 'max_depth': 10, 'min_child_weight': 1, 'subsample': 0.5, 'colsample_bytree': 1.0, 'colsample_bylevel': 0.6, 'reg_alpha': 1.0938515840066676, 'reg_lambda': 1.999454751028273, 'gamma': 0.05675149313529108}. Best is trial 138 with value: -4.231116011606298.
[I 2026-07-14 18:32:04,443] Trial 164 finished with value: -1.703388391647268 and parameters: {'scalers': 'none', 'ratios': 'norm_ratio', 'imputers': 'none', 'n_estimators': 2300, 'learning_rate': 0.21826859634223833, 'max_depth': 10, 'min_child_weight': 1, 'subsample': 0.5, 'colsample_bytree': 1.0, 'colsample_bylevel': 0.6, 'reg_alpha': 0.00123846460445436, 'reg_lambda': 2.4519480620957146, 'gamma': 0.23747255191736963}. Best is trial 138 with value: -4.231116011606298.
[I 2026-07-14 18:32:33,410] Trial 165 finished with value: -2.661696815397097 and parameters: {'scalers': 'none', 'ratios': 'norm_ratio', 'imputers': 'mean', 'n_estimators': 2300, 'learning_rate': 0.49525125957760935, 'max_depth': 10, 'min_child_weight': 1, 'subsample': 0.5, 'colsample_bytree': 1.0, 'colsample_bylevel': 0.6, 'reg_alpha': 0.003492903015007049, 'reg_lambda': 0.5852395222472566, 'gamma': 0.242670413248818}. Best is trial 138 with value: -4.231116011606298.
[I 2026-07-14 18:33:21,317] Trial 166 finished with value: -4.40177517545213 and parameters: {'scalers': 'none', 'ratios': 'norm_ratio', 'imputers': 'mean', 'n_estimators': 2300, 'learning_rate': 0.4990966458919615, 'max_depth': 10, 'min_child_weight': 1, 'subsample': 0.5, 'colsample_bytree': 1.0, 'colsample_bylevel': 0.6, 'reg_alpha': 0.015115588570219917, 'reg_lambda': 3.08547873233783, 'gamma': 0.033619366390760755}. Best is trial 166 with value: -4.40177517545213.
[I 2026-07-14 18:33:59,665] Trial 167 finished with value: -2.51774157495994 and parameters: {'scalers': 'none', 'ratios': 'norm_ratio', 'imputers': 'mean', 'n_estimators': 2300, 'learning_rate': 0.2151340669193848, 'max_depth': 10, 'min_child_weight': 1, 'subsample': 0.5, 'colsample_bytree': 1.0, 'colsample_bylevel': 0.6, 'reg_alpha': 2.0261253312223455, 'reg_lambda': 0.5746496007051848, 'gamma': 0.03513813713156023}. Best is trial 166 with value: -4.40177517545213.
[I 2026-07-14 18:34:37,231] Trial 168 finished with value: -3.3393211628896746 and parameters: {'scalers': 'none', 'ratios': 'norm_ratio', 'imputers': 'none', 'n_estimators': 2300, 'learning_rate': 0.4919306777684712, 'max_depth': 10, 'min_child_weight': 1, 'subsample': 0.5, 'colsample_bytree': 1.0, 'colsample_bylevel': 0.6, 'reg_alpha': 0.0036809835563871443, 'reg_lambda': 0.6232154869653105, 'gamma': 0.03425655592280526}. Best is trial 166 with value: -4.40177517545213.
[I 2026-07-14 18:35:22,501] Trial 169 finished with value: -2.877685689210853 and parameters: {'scalers': 'none', 'ratios': 'norm_ratio', 'imputers': 'none', 'n_estimators': 2300, 'learning_rate': 0.22147476004664268, 'max_depth': 10, 'min_child_weight': 1, 'subsample': 0.5, 'colsample_bytree': 1.0, 'colsample_bylevel': 0.6, 'reg_alpha': 2.2898021866586733e-06, 'reg_lambda': 3.3382772969580334, 'gamma': 0.03653213597313435}. Best is trial 166 with value: -4.40177517545213.
[I 2026-07-14 18:35:52,505] Trial 170 finished with value: -2.8008810272167515 and parameters: {'scalers': 'none', 'ratios': 'norm_ratio', 'imputers': 'mean', 'n_estimators': 2200, 'learning_rate': 0.4977791384354259, 'max_depth': 10, 'min_child_weight': 1, 'subsample': 0.5, 'colsample_bytree': 1.0, 'colsample_bylevel': 0.6, 'reg_alpha': 0.0033662380193827286, 'reg_lambda': 0.5555822013890528, 'gamma': 0.22910593216555525}. Best is trial 166 with value: -4.40177517545213.
[I 2026-07-14 18:36:28,373] Trial 171 finished with value: -3.1654766912989194 and parameters: {'scalers': 'none', 'ratios': 'norm_ratio', 'imputers': 'mean', 'n_estimators': 2200, 'learning_rate': 0.48310439643730996, 'max_depth': 10, 'min_child_weight': 1, 'subsample': 0.5, 'colsample_bytree': 1.0, 'colsample_bylevel': 0.6, 'reg_alpha': 0.0033268299656234253, 'reg_lambda': 0.5452725099969127, 'gamma': 0.03471276572804876}. Best is trial 166 with value: -4.40177517545213.
[I 2026-07-14 18:37:18,698] Trial 172 finished with value: -3.6862387687912292 and parameters: {'scalers': 'none', 'ratios': 'norm_ratio', 'imputers': 'mean', 'n_estimators': 2200, 'learning_rate': 0.48659228205969435, 'max_depth': 10, 'min_child_weight': 1, 'subsample': 0.5, 'colsample_bytree': 1.0, 'colsample_bylevel': 0.6, 'reg_alpha': 2.494330249528364e-06, 'reg_lambda': 29.562049072143573, 'gamma': 0.04101657138365712}. Best is trial 166 with value: -4.40177517545213.
[I 2026-07-14 18:38:03,197] Trial 173 finished with value: -3.1197673750260004 and parameters: {'scalers': 'none', 'ratios': 'norm_ratio', 'imputers': 'none', 'n_estimators': 2200, 'learning_rate': 0.28343265358035374, 'max_depth': 10, 'min_child_weight': 1, 'subsample': 0.5, 'colsample_bytree': 1.0, 'colsample_bylevel': 0.6, 'reg_alpha': 0.003312113479575584, 'reg_lambda': 3.513266045805509, 'gamma': 0.03797374203206198}. Best is trial 166 with value: -4.40177517545213.
[I 2026-07-14 18:38:51,293] Trial 174 finished with value: -2.598118638940894 and parameters: {'scalers': 'none', 'ratios': 'norm_ratio', 'imputers': 'none', 'n_estimators': 2200, 'learning_rate': 0.2842073955172851, 'max_depth': 10, 'min_child_weight': 1, 'subsample': 0.5, 'colsample_bytree': 1.0, 'colsample_bylevel': 0.6, 'reg_alpha': 0.0179033303434373, 'reg_lambda': 29.456068391384186, 'gamma': 0.03768799506956253}. Best is trial 166 with value: -4.40177517545213.
[I 2026-07-14 18:39:38,192] Trial 175 finished with value: -1.446039568508159 and parameters: {'scalers': 'none', 'ratios': 'norm_ratio', 'imputers': 'mean', 'n_estimators': 2200, 'learning_rate': 0.00028379513963721237, 'max_depth': 10, 'min_child_weight': 1, 'subsample': 0.5, 'colsample_bytree': 1.0, 'colsample_bylevel': 0.6, 'reg_alpha': 0.01795004587436743, 'reg_lambda': 3.2995783627922, 'gamma': 0.03888216982657557}. Best is trial 166 with value: -4.40177517545213.
[I 2026-07-14 18:40:23,132] Trial 176 finished with value: -1.6623380038173696 and parameters: {'scalers': 'none', 'ratios': 'norm_ratio', 'imputers': 'mean', 'n_estimators': 2200, 'learning_rate': 0.01605288104612885, 'max_depth': 10, 'min_child_weight': 1, 'subsample': 0.5, 'colsample_bytree': 1.0, 'colsample_bylevel': 0.6, 'reg_alpha': 0.020346648662301976, 'reg_lambda': 3.286763371114142, 'gamma': 0.08147864389175076}. Best is trial 166 with value: -4.40177517545213.
[I 2026-07-14 18:41:06,168] Trial 177 finished with value: -3.0300687830247246 and parameters: {'scalers': 'none', 'ratios': 'norm_ratio', 'imputers': 'mean', 'n_estimators': 2200, 'learning_rate': 0.2832718247697531, 'max_depth': 10, 'min_child_weight': 1, 'subsample': 0.5, 'colsample_bytree': 1.0, 'colsample_bylevel': 0.6, 'reg_alpha': 0.01384408555708809, 'reg_lambda': 3.280383300669324, 'gamma': 0.08168248056157577}. Best is trial 166 with value: -4.40177517545213.
[I 2026-07-14 18:41:46,749] Trial 178 finished with value: -2.8293055822747335 and parameters: {'scalers': 'none', 'ratios': 'norm_ratio', 'imputers': 'mean', 'n_estimators': 2200, 'learning_rate': 0.4961446611988864, 'max_depth': 10, 'min_child_weight': 1, 'subsample': 0.5, 'colsample_bytree': 1.0, 'colsample_bylevel': 0.6, 'reg_alpha': 0.014901541869333483, 'reg_lambda': 30.270038499059265, 'gamma': 0.07429560009710967}. Best is trial 166 with value: -4.40177517545213.
[I 2026-07-14 18:42:24,096] Trial 179 finished with value: -3.0523466065678497 and parameters: {'scalers': 'none', 'ratios': 'norm_ratio', 'imputers': 'none', 'n_estimators': 2200, 'learning_rate': 0.4041684866590342, 'max_depth': 10, 'min_child_weight': 1, 'subsample': 0.5, 'colsample_bytree': 1.0, 'colsample_bylevel': 0.6, 'reg_alpha': 0.01571167037486802, 'reg_lambda': 1.0219334676115561, 'gamma': 0.08043996080672502}. Best is trial 166 with value: -4.40177517545213.
[I 2026-07-14 18:42:54,331] Trial 180 finished with value: -1.9869351674299864 and parameters: {'scalers': 'none', 'ratios': 'norm_ratio', 'imputers': 'mean', 'n_estimators': 1800, 'learning_rate': 0.280142358319364, 'max_depth': 10, 'min_child_weight': 1, 'subsample': 0.5, 'colsample_bytree': 1.0, 'colsample_bylevel': 0.6, 'reg_alpha': 0.0060009382271939415, 'reg_lambda': 34.25867176219208, 'gamma': 0.07563589599782938}. Best is trial 166 with value: -4.40177517545213.
[I 2026-07-14 18:43:34,728] Trial 181 finished with value: -3.1208133209756395 and parameters: {'scalers': 'none', 'ratios': 'norm_ratio', 'imputers': 'mean', 'n_estimators': 2400, 'learning_rate': 0.40422336191494285, 'max_depth': 10, 'min_child_weight': 1, 'subsample': 0.5, 'colsample_bytree': 1.0, 'colsample_bylevel': 0.6, 'reg_alpha': 0.016946881026796576, 'reg_lambda': 0.991674018245953, 'gamma': 0.07962387407407738}. Best is trial 166 with value: -4.40177517545213.
[I 2026-07-14 18:44:04,258] Trial 182 finished with value: -2.2449555220915727 and parameters: {'scalers': 'none', 'ratios': 'norm_ratio', 'imputers': 'mean', 'n_estimators': 2400, 'learning_rate': 0.3983962550387298, 'max_depth': 8, 'min_child_weight': 1, 'subsample': 0.5, 'colsample_bytree': 1.0, 'colsample_bylevel': 0.6, 'reg_alpha': 0.0062233168931208485, 'reg_lambda': 34.745619201835815, 'gamma': 0.0795232880771104}. Best is trial 166 with value: -4.40177517545213.
