[I 2026-07-14 17:11:34,208] Trial 182 finished with value: -0.7913252231910639 and parameters: {'scalers': 'none', 'ratios': 'norm_ratio', 'imputers': 'none', 'n_estimators': 2500, 'learning_rate': 0.013728057134076406, 'max_depth': 5, 'min_child_weight': 1, 'subsample': 0.9, 'colsample_bytree': 0.7, 'colsample_bylevel': 1.0, 'reg_alpha': 40.361178998735845, 'reg_lambda': 0.00040669453619100423, 'gamma': 98.71956808891795}. Best is trial 21 with value: -0.7913973345232271.
[I 2026-07-14 17:11:35,571] Trial 183 finished with value: -0.7913151043112581 and parameters: {'scalers': 'none', 'ratios': 'norm_ratio', 'imputers': 'none', 'n_estimators': 1200, 'learning_rate': 0.013605125278451672, 'max_depth': 5, 'min_child_weight': 1, 'subsample': 0.9, 'colsample_bytree': 0.7, 'colsample_bylevel': 1.0, 'reg_alpha': 51.10671940163446, 'reg_lambda': 0.4951571231350417, 'gamma': 93.56677128135131}. Best is trial 21 with value: -0.7913973345232271.
[I 2026-07-14 17:11:37,791] Trial 184 finished with value: -0.7913151199760364 and parameters: {'scalers': 'none', 'ratios': 'norm_ratio', 'imputers': 'none', 'n_estimators': 1200, 'learning_rate': 0.013743448633873463, 'max_depth': 9, 'min_child_weight': 1, 'subsample': 0.9, 'colsample_bytree': 0.7, 'colsample_bylevel': 1.0, 'reg_alpha': 99.62404635914743, 'reg_lambda': 0.0003619174713168986, 'gamma': 76.84338438405153}. Best is trial 21 with value: -0.7913973345232271.
[I 2026-07-14 17:11:40,082] Trial 185 finished with value: -0.7913151766349179 and parameters: {'scalers': 'none', 'ratios': 'norm_ratio', 'imputers': 'none', 'n_estimators': 1200, 'learning_rate': 0.013930104718501419, 'max_depth': 4, 'min_child_weight': 1, 'subsample': 0.9, 'colsample_bytree': 0.7, 'colsample_bylevel': 1.0, 'reg_alpha': 66.80290849455436, 'reg_lambda': 0.6295978809684981, 'gamma': 74.02028296880113}. Best is trial 21 with value: -0.7913973345232271.
[I 2026-07-14 17:11:44,445] Trial 186 finished with value: -0.7807425265372044 and parameters: {'scalers': 'none', 'ratios': 'norm_ratio', 'imputers': 'none', 'n_estimators': 2350, 'learning_rate': 0.0017803341675303387, 'max_depth': 5, 'min_child_weight': 1, 'subsample': 0.9, 'colsample_bytree': 0.7, 'colsample_bylevel': 1.0, 'reg_alpha': 1.6001735969001723e-05, 'reg_lambda': 0.0003050216637898465, 'gamma': 98.13152330620065}. Best is trial 21 with value: -0.7913973345232271.
[I 2026-07-14 17:11:48,653] Trial 187 finished with value: -0.7913030680117037 and parameters: {'scalers': 'none', 'ratios': 'norm_ratio', 'imputers': 'none', 'n_estimators': 2300, 'learning_rate': 0.013721123455275205, 'max_depth': 5, 'min_child_weight': 1, 'subsample': 0.9, 'colsample_bytree': 0.7, 'colsample_bylevel': 1.0, 'reg_alpha': 69.22786766231484, 'reg_lambda': 0.00032878442431095593, 'gamma': 96.23411405850223}. Best is trial 21 with value: -0.7913973345232271.
[I 2026-07-14 17:11:49,272] Trial 188 finished with value: -0.7912527685523348 and parameters: {'scalers': 'none', 'ratios': 'norm_ratio', 'imputers': 'none', 'n_estimators': 650, 'learning_rate': 0.003077736685258662, 'max_depth': 4, 'min_child_weight': 1, 'subsample': 0.9, 'colsample_bytree': 0.7, 'colsample_bylevel': 1.0, 'reg_alpha': 69.6828073058719, 'reg_lambda': 0.374711317752958, 'gamma': 98.03766504986267}. Best is trial 21 with value: -0.7913973345232271.
[I 2026-07-14 17:11:53,932] Trial 189 finished with value: -0.7806491011204465 and parameters: {'scalers': 'none', 'ratios': 'norm_ratio', 'imputers': 'none', 'n_estimators': 2550, 'learning_rate': 0.0018070350140219438, 'max_depth': 5, 'min_child_weight': 1, 'subsample': 0.9, 'colsample_bytree': 0.7, 'colsample_bylevel': 1.0, 'reg_alpha': 0.00024198990561406986, 'reg_lambda': 0.00027228814592082325, 'gamma': 98.06049209793291}. Best is trial 21 with value: -0.7913973345232271.
[I 2026-07-14 17:11:58,471] Trial 190 finished with value: -0.7913231438192186 and parameters: {'scalers': 'none', 'ratios': 'norm_ratio', 'imputers': 'none', 'n_estimators': 2550, 'learning_rate': 0.013900666653689428, 'max_depth': 5, 'min_child_weight': 1, 'subsample': 0.9, 'colsample_bytree': 0.7, 'colsample_bylevel': 1.0, 'reg_alpha': 62.19783275927503, 'reg_lambda': 0.0002911975637020054, 'gamma': 93.1781082299178}. Best is trial 21 with value: -0.7913973345232271.
[I 2026-07-14 17:12:03,020] Trial 191 finished with value: -0.7913231208614918 and parameters: {'scalers': 'none', 'ratios': 'norm_ratio', 'imputers': 'none', 'n_estimators': 2550, 'learning_rate': 0.01354880923874823, 'max_depth': 5, 'min_child_weight': 1, 'subsample': 0.9, 'colsample_bytree': 0.7, 'colsample_bylevel': 1.0, 'reg_alpha': 66.16056822829674, 'reg_lambda': 0.16771485702674016, 'gamma': 96.31986509294217}. Best is trial 21 with value: -0.7913973345232271.
[I 2026-07-14 17:12:05,112] Trial 192 finished with value: -0.7913227453591363 and parameters: {'scalers': 'none', 'ratios': 'norm_ratio', 'imputers': 'none', 'n_estimators': 1150, 'learning_rate': 0.008881127035271318, 'max_depth': 5, 'min_child_weight': 1, 'subsample': 0.9, 'colsample_bytree': 0.7, 'colsample_bylevel': 1.0, 'reg_alpha': 67.29428615446803, 'reg_lambda': 0.17633985597408522, 'gamma': 94.11638016595481}. Best is trial 21 with value: -0.7913973345232271.
[I 2026-07-14 17:12:07,275] Trial 193 finished with value: -0.7912694415274368 and parameters: {'scalers': 'none', 'ratios': 'norm_ratio', 'imputers': 'none', 'n_estimators': 1200, 'learning_rate': 0.0016606173955861648, 'max_depth': 4, 'min_child_weight': 1, 'subsample': 0.9, 'colsample_bytree': 0.7, 'colsample_bylevel': 1.0, 'reg_alpha': 26.652292227203297, 'reg_lambda': 0.0002890676522627873, 'gamma': 95.81369527361197}. Best is trial 21 with value: -0.7913973345232271.
[I 2026-07-14 17:12:09,201] Trial 194 finished with value: -0.7911110796961011 and parameters: {'scalers': 'none', 'ratios': 'norm_ratio', 'imputers': 'none', 'n_estimators': 1050, 'learning_rate': 0.014766263449468393, 'max_depth': 4, 'min_child_weight': 1, 'subsample': 0.9, 'colsample_bytree': 0.7, 'colsample_bylevel': 1.0, 'reg_alpha': 25.86067223455109, 'reg_lambda': 1.48891569235293, 'gamma': 94.93474150099907}. Best is trial 21 with value: -0.7913973345232271.
[I 2026-07-14 17:12:11,391] Trial 195 finished with value: -0.791315223174389 and parameters: {'scalers': 'none', 'ratios': 'norm_ratio', 'imputers': 'none', 'n_estimators': 1200, 'learning_rate': 0.014035179986568048, 'max_depth': 4, 'min_child_weight': 1, 'subsample': 0.9, 'colsample_bytree': 0.7, 'colsample_bylevel': 1.0, 'reg_alpha': 60.84505285837672, 'reg_lambda': 0.8634914878845248, 'gamma': 87.32563168534807}. Best is trial 21 with value: -0.7913973345232271.
[I 2026-07-14 17:12:16,070] Trial 196 finished with value: -0.7913231775212032 and parameters: {'scalers': 'none', 'ratios': 'norm_ratio', 'imputers': 'none', 'n_estimators': 2550, 'learning_rate': 0.014380604464260989, 'max_depth': 4, 'min_child_weight': 1, 'subsample': 0.9, 'colsample_bytree': 0.7, 'colsample_bylevel': 1.0, 'reg_alpha': 25.81202618132301, 'reg_lambda': 0.25002895751382337, 'gamma': 98.69592959462699}. Best is trial 21 with value: -0.7913973345232271.
[I 2026-07-14 17:12:18,316] Trial 197 finished with value: -0.7728996836445026 and parameters: {'scalers': 'none', 'ratios': 'norm_ratio', 'imputers': 'none', 'n_estimators': 1200, 'learning_rate': 0.013525915549263048, 'max_depth': 4, 'min_child_weight': 1, 'subsample': 0.9, 'colsample_bytree': 0.7, 'colsample_bylevel': 1.0, 'reg_alpha': 24.49766871876311, 'reg_lambda': 1.2762999067896865, 'gamma': 75.61569566703383}. Best is trial 21 with value: -0.7913973345232271.
[I 2026-07-14 17:12:23,243] Trial 198 finished with value: -0.7672308817732758 and parameters: {'scalers': 'none', 'ratios': 'norm_ratio', 'imputers': 'none', 'n_estimators': 2650, 'learning_rate': 0.014464802535457084, 'max_depth': 5, 'min_child_weight': 1, 'subsample': 0.9, 'colsample_bytree': 0.7, 'colsample_bylevel': 1.0, 'reg_alpha': 27.84380057250869, 'reg_lambda': 0.7011531374601389, 'gamma': 68.80469142393599}. Best is trial 21 with value: -0.7913973345232271.
[I 2026-07-14 17:12:27,923] Trial 199 finished with value: -0.7884465983638766 and parameters: {'scalers': 'none', 'ratios': 'norm_ratio', 'imputers': 'none', 'n_estimators': 2550, 'learning_rate': 0.015402862365417927, 'max_depth': 5, 'min_child_weight': 1, 'subsample': 0.9, 'colsample_bytree': 0.7, 'colsample_bylevel': 1.0, 'reg_alpha': 52.47861513382394, 'reg_lambda': 0.5552447030299883, 'gamma': 68.72194437508516}. Best is trial 21 with value: -0.7913973345232271.
[I 2026-07-14 17:12:29,796] Trial 200 finished with value: -0.7913292157395689 and parameters: {'scalers': 'none', 'ratios': 'norm_ratio', 'imputers': 'none', 'n_estimators': 1000, 'learning_rate': 0.015497497606113663, 'max_depth': 5, 'min_child_weight': 1, 'subsample': 0.9, 'colsample_bytree': 0.7, 'colsample_bylevel': 1.0, 'reg_alpha': 26.035368918326032, 'reg_lambda': 0.6318245035171782, 'gamma': 99.4033776882795}. Best is trial 21 with value: -0.7913973345232271.
[I 2026-07-14 17:12:34,668] Trial 201 finished with value: -0.7859578056284028 and parameters: {'scalers': 'none', 'ratios': 'norm_ratio', 'imputers': 'none', 'n_estimators': 2650, 'learning_rate': 0.015065361372154397, 'max_depth': 5, 'min_child_weight': 1, 'subsample': 0.9, 'colsample_bytree': 0.7, 'colsample_bylevel': 1.0, 'reg_alpha': 53.022178090838246, 'reg_lambda': 0.7044143301262228, 'gamma': 66.30004807908918}. Best is trial 21 with value: -0.7913973345232271.
[I 2026-07-14 17:12:36,958] Trial 202 finished with value: -0.7832360014191566 and parameters: {'scalers': 'none', 'ratios': 'norm_ratio', 'imputers': 'none', 'n_estimators': 1200, 'learning_rate': 0.021420140381353574, 'max_depth': 5, 'min_child_weight': 1, 'subsample': 0.9, 'colsample_bytree': 0.7, 'colsample_bylevel': 1.0, 'reg_alpha': 49.6621956326173, 'reg_lambda': 0.17108958306013838, 'gamma': 66.31647056132235}. Best is trial 21 with value: -0.7913973345232271.
[I 2026-07-14 17:12:39,175] Trial 203 finished with value: -0.7777353321512733 and parameters: {'scalers': 'none', 'ratios': 'norm_ratio', 'imputers': 'none', 'n_estimators': 1200, 'learning_rate': 0.022286581119944835, 'max_depth': 5, 'min_child_weight': 1, 'subsample': 0.9, 'colsample_bytree': 0.7, 'colsample_bylevel': 1.0, 'reg_alpha': 48.08657891925719, 'reg_lambda': 0.7730154718450493, 'gamma': 64.26520163574625}. Best is trial 21 with value: -0.7913973345232271.
[I 2026-07-14 17:12:41,354] Trial 204 finished with value: -0.7862154177647843 and parameters: {'scalers': 'none', 'ratios': 'norm_ratio', 'imputers': 'none', 'n_estimators': 1150, 'learning_rate': 0.021570868172359824, 'max_depth': 5, 'min_child_weight': 1, 'subsample': 0.9, 'colsample_bytree': 0.7, 'colsample_bylevel': 1.0, 'reg_alpha': 46.80039571238353, 'reg_lambda': 0.17231437975228756, 'gamma': 70.17006242994364}. Best is trial 21 with value: -0.7913973345232271.
[I 2026-07-14 17:12:43,745] Trial 205 finished with value: -0.7853789761628718 and parameters: {'scalers': 'none', 'ratios': 'norm_ratio', 'imputers': 'none', 'n_estimators': 1300, 'learning_rate': 0.021676537915657875, 'max_depth': 5, 'min_child_weight': 1, 'subsample': 0.9, 'colsample_bytree': 0.7, 'colsample_bylevel': 1.0, 'reg_alpha': 55.28657552594531, 'reg_lambda': 0.6182951380030534, 'gamma': 64.06702411238554}. Best is trial 21 with value: -0.7913973345232271.
[I 2026-07-14 17:12:46,090] Trial 206 finished with value: -0.7467036668718858 and parameters: {'scalers': 'none', 'ratios': 'norm_ratio', 'imputers': 'none', 'n_estimators': 1250, 'learning_rate': 0.0227192966017771, 'max_depth': 5, 'min_child_weight': 1, 'subsample': 0.9, 'colsample_bytree': 0.7, 'colsample_bylevel': 1.0, 'reg_alpha': 46.58162397456964, 'reg_lambda': 0.18610185827297301, 'gamma': 37.4838469418002}. Best is trial 21 with value: -0.7913973345232271.
[I 2026-07-14 17:12:53,606] Trial 207 finished with value: -0.7428049143183375 and parameters: {'scalers': 'none', 'ratios': 'norm_ratio', 'imputers': 'none', 'n_estimators': 1300, 'learning_rate': 0.02221398341512843, 'max_depth': 5, 'min_child_weight': 1, 'subsample': 0.9, 'colsample_bytree': 0.7, 'colsample_bylevel': 1.0, 'reg_alpha': 44.742883800951816, 'reg_lambda': 0.26918713940010186, 'gamma': 35.933232646266546}. Best is trial 21 with value: -0.7913973345232271.
[I 2026-07-14 17:12:53,607] Trial 209 finished with value: -0.7434284139959711 and parameters: {'scalers': 'none', 'ratios': 'norm_ratio', 'imputers': 'none', 'n_estimators': 1200, 'learning_rate': 0.021461496855091813, 'max_depth': 5, 'min_child_weight': 1, 'subsample': 0.9, 'colsample_bytree': 0.7, 'colsample_bylevel': 1.0, 'reg_alpha': 41.861361901085424, 'reg_lambda': 0.17337313589414968, 'gamma': 38.12038277156309}. Best is trial 21 with value: -0.7913973345232271.
[I 2026-07-14 17:12:53,692] Trial 208 finished with value: -0.7497855465668846 and parameters: {'scalers': 'none', 'ratios': 'norm_ratio', 'imputers': 'none', 'n_estimators': 1150, 'learning_rate': 0.02153114017106362, 'max_depth': 5, 'min_child_weight': 1, 'subsample': 0.9, 'colsample_bytree': 0.7, 'colsample_bylevel': 1.0, 'reg_alpha': 51.441128172895695, 'reg_lambda': 0.1547213793275512, 'gamma': 37.84306144371688}. Best is trial 21 with value: -0.7913973345232271.
[I 2026-07-14 17:12:55,408] Trial 210 finished with value: -0.7439625106344451 and parameters: {'scalers': 'none', 'ratios': 'norm_ratio', 'imputers': 'none', 'n_estimators': 1300, 'learning_rate': 0.010326688471831769, 'max_depth': 5, 'min_child_weight': 1, 'subsample': 0.9, 'colsample_bytree': 0.7, 'colsample_bylevel': 1.0, 'reg_alpha': 40.86776573674158, 'reg_lambda': 0.21759663870912335, 'gamma': 38.00422132667922}. Best is trial 21 with value: -0.7913973345232271.
[I 2026-07-14 17:12:57,101] Trial 211 finished with value: -0.7399671316677293 and parameters: {'scalers': 'none', 'ratios': 'norm_ratio', 'imputers': 'none', 'n_estimators': 950, 'learning_rate': 0.009839160319436747, 'max_depth': 5, 'min_child_weight': 1, 'subsample': 0.9, 'colsample_bytree': 0.7, 'colsample_bylevel': 1.0, 'reg_alpha': 34.25362140824793, 'reg_lambda': 0.14213510754784756, 'gamma': 38.494440199090796}. Best is trial 21 with value: -0.7913973345232271.
[I 2026-07-14 17:12:58,915] Trial 212 finished with value: -0.7433082549721843 and parameters: {'scalers': 'none', 'ratios': 'norm_ratio', 'imputers': 'none', 'n_estimators': 950, 'learning_rate': 0.01074809266639389, 'max_depth': 5, 'min_child_weight': 1, 'subsample': 0.9, 'colsample_bytree': 0.7, 'colsample_bylevel': 1.0, 'reg_alpha': 38.296867923841795, 'reg_lambda': 0.29612394280646887, 'gamma': 38.77512792900783}. Best is trial 21 with value: -0.7913973345232271.
[I 2026-07-14 17:13:00,737] Trial 213 finished with value: -0.746936959232237 and parameters: {'scalers': 'none', 'ratios': 'norm_ratio', 'imputers': 'none', 'n_estimators': 950, 'learning_rate': 0.009599243705040826, 'max_depth': 4, 'min_child_weight': 1, 'subsample': 0.9, 'colsample_bytree': 0.7, 'colsample_bylevel': 1.0, 'reg_alpha': 35.25053131761832, 'reg_lambda': 0.26435866354967263, 'gamma': 43.19347047247996}. Best is trial 21 with value: -0.7913973345232271.
[I 2026-07-14 17:13:02,719] Trial 214 finished with value: -0.726738483209709 and parameters: {'scalers': 'none', 'ratios': 'norm_ratio', 'imputers': 'none', 'n_estimators': 1000, 'learning_rate': 0.01155389208676936, 'max_depth': 4, 'min_child_weight': 1, 'subsample': 0.9, 'colsample_bytree': 0.7, 'colsample_bylevel': 1.0, 'reg_alpha': 17.68385964574042, 'reg_lambda': 0.24971814282163793, 'gamma': 35.792227213780265}. Best is trial 21 with value: -0.7913973345232271.
[I 2026-07-14 17:13:04,664] Trial 215 finished with value: -0.7900041035967749 and parameters: {'scalers': 'none', 'ratios': 'norm_ratio', 'imputers': 'none', 'n_estimators': 1050, 'learning_rate': 0.010391879748842463, 'max_depth': 4, 'min_child_weight': 1, 'subsample': 0.9, 'colsample_bytree': 0.7, 'colsample_bylevel': 1.0, 'reg_alpha': 17.707337782208878, 'reg_lambda': 0.4098804496098875, 'gamma': 95.46360362622545}. Best is trial 21 with value: -0.7913973345232271.
[I 2026-07-14 17:13:06,558] Trial 216 finished with value: -0.7910540495142439 and parameters: {'scalers': 'none', 'ratios': 'norm_ratio', 'imputers': 'none', 'n_estimators': 1000, 'learning_rate': 0.01044526516560042, 'max_depth': 4, 'min_child_weight': 1, 'subsample': 0.9, 'colsample_bytree': 0.7, 'colsample_bylevel': 1.0, 'reg_alpha': 17.31604374568358, 'reg_lambda': 0.2680781960862727, 'gamma': 99.64568706082915}. Best is trial 21 with value: -0.7913973345232271.
[I 2026-07-14 17:13:08,452] Trial 217 finished with value: -0.7911857622485001 and parameters: {'scalers': 'none', 'ratios': 'norm_ratio', 'imputers': 'none', 'n_estimators': 1000, 'learning_rate': 0.010233839570830837, 'max_depth': 4, 'min_child_weight': 1, 'subsample': 0.9, 'colsample_bytree': 0.7, 'colsample_bylevel': 1.0, 'reg_alpha': 17.649673087826606, 'reg_lambda': 0.4930464817690778, 'gamma': 99.60215513888805}. Best is trial 21 with value: -0.7913973345232271.
[I 2026-07-14 17:13:10,319] Trial 218 finished with value: -0.7913303654784296 and parameters: {'scalers': 'none', 'ratios': 'norm_ratio', 'imputers': 'none', 'n_estimators': 1000, 'learning_rate': 0.01719104980092882, 'max_depth': 4, 'min_child_weight': 1, 'subsample': 0.9, 'colsample_bytree': 0.7, 'colsample_bylevel': 1.0, 'reg_alpha': 69.97584454911645, 'reg_lambda': 0.9542126135273109, 'gamma': 96.2661154775398}. Best is trial 21 with value: -0.7913973345232271.
[I 2026-07-14 17:13:14,810] Trial 219 finished with value: -0.7913427985973395 and parameters: {'scalers': 'none', 'ratios': 'norm_ratio', 'imputers': 'none', 'n_estimators': 2450, 'learning_rate': 0.01222769212791283, 'max_depth': 4, 'min_child_weight': 1, 'subsample': 0.9, 'colsample_bytree': 0.7, 'colsample_bylevel': 1.0, 'reg_alpha': 70.1928052052047, 'reg_lambda': 0.35506941274414333, 'gamma': 99.05653116324902}. Best is trial 21 with value: -0.7913973345232271.
[I 2026-07-14 17:13:19,313] Trial 220 finished with value: -0.7877446210828638 and parameters: {'scalers': 'none', 'ratios': 'norm_ratio', 'imputers': 'none', 'n_estimators': 2450, 'learning_rate': 0.012467820761276595, 'max_depth': 4, 'min_child_weight': 1, 'subsample': 0.9, 'colsample_bytree': 0.7, 'colsample_bylevel': 1.0, 'reg_alpha': 70.27315853406986, 'reg_lambda': 0.4164514744989617, 'gamma': 56.13797976809458}. Best is trial 21 with value: -0.7913973345232271.
[I 2026-07-14 17:13:23,803] Trial 221 finished with value: -0.7913428075465259 and parameters: {'scalers': 'none', 'ratios': 'norm_ratio', 'imputers': 'none', 'n_estimators': 2450, 'learning_rate': 0.012260986849825607, 'max_depth': 4, 'min_child_weight': 1, 'subsample': 0.9, 'colsample_bytree': 0.7, 'colsample_bylevel': 1.0, 'reg_alpha': 72.67583124875124, 'reg_lambda': 0.44621747974023945, 'gamma': 99.86929619805422}. Best is trial 21 with value: -0.7913973345232271.
[I 2026-07-14 17:13:28,263] Trial 222 finished with value: -0.791343330843557 and parameters: {'scalers': 'none', 'ratios': 'norm_ratio', 'imputers': 'none', 'n_estimators': 2450, 'learning_rate': 0.01271228922316803, 'max_depth': 4, 'min_child_weight': 1, 'subsample': 0.9, 'colsample_bytree': 0.7, 'colsample_bylevel': 1.0, 'reg_alpha': 68.93771533272286, 'reg_lambda': 0.44274839764198104, 'gamma': 91.57087611062907}. Best is trial 21 with value: -0.7913973345232271.
[I 2026-07-14 17:13:32,726] Trial 223 finished with value: -0.791345274890173 and parameters: {'scalers': 'none', 'ratios': 'norm_ratio', 'imputers': 'none', 'n_estimators': 2450, 'learning_rate': 0.01732793994321473, 'max_depth': 4, 'min_child_weight': 1, 'subsample': 0.9, 'colsample_bytree': 0.7, 'colsample_bylevel': 1.0, 'reg_alpha': 72.84749762528052, 'reg_lambda': 0.8826491747483197, 'gamma': 95.38367877565517}. Best is trial 21 with value: -0.7913973345232271.
[I 2026-07-14 17:13:37,227] Trial 224 finished with value: -0.7860901884551339 and parameters: {'scalers': 'none', 'ratios': 'norm_ratio', 'imputers': 'none', 'n_estimators': 2450, 'learning_rate': 0.017026432423590192, 'max_depth': 4, 'min_child_weight': 1, 'subsample': 0.9, 'colsample_bytree': 0.7, 'colsample_bylevel': 1.0, 'reg_alpha': 69.76931495369313, 'reg_lambda': 0.00015577249179936028, 'gamma': 55.633491163377194}. Best is trial 21 with value: -0.7913973345232271.
[I 2026-07-14 17:13:41,715] Trial 225 finished with value: -0.7906613093318017 and parameters: {'scalers': 'none', 'ratios': 'norm_ratio', 'imputers': 'none', 'n_estimators': 2450, 'learning_rate': 0.017579563253312492, 'max_depth': 4, 'min_child_weight': 1, 'subsample': 0.9, 'colsample_bytree': 0.7, 'colsample_bylevel': 1.0, 'reg_alpha': 76.62054654441653, 'reg_lambda': 0.9364213689425555, 'gamma': 56.8977297529054}. Best is trial 21 with value: -0.7913973345232271.
[I 2026-07-14 17:13:46,242] Trial 226 finished with value: -0.7894906446243678 and parameters: {'scalers': 'none', 'ratios': 'norm_ratio', 'imputers': 'none', 'n_estimators': 2500, 'learning_rate': 0.016803348206938976, 'max_depth': 10, 'min_child_weight': 1, 'subsample': 0.9, 'colsample_bytree': 0.7, 'colsample_bylevel': 1.0, 'reg_alpha': 68.16462774329447, 'reg_lambda': 1.3366572207245935, 'gamma': 61.10979494648461}. Best is trial 21 with value: -0.7913973345232271.
[I 2026-07-14 17:13:50,722] Trial 227 finished with value: -0.7913452767989926 and parameters: {'scalers': 'none', 'ratios': 'norm_ratio', 'imputers': 'none', 'n_estimators': 2450, 'learning_rate': 0.017276928785410112, 'max_depth': 10, 'min_child_weight': 1, 'subsample': 0.9, 'colsample_bytree': 0.7, 'colsample_bylevel': 1.0, 'reg_alpha': 65.71929054166247, 'reg_lambda': 0.10494974995137449, 'gamma': 99.42985429383022}. Best is trial 21 with value: -0.7913973345232271.
