[I 2026-07-14 18:10:10,066] A new study created in RDB with name: my-study
[I 2026-07-14 18:10:25,677] Trial 1 finished with value: -1.3022713785220033 and parameters: {'scalers': 'none', 'ratios': 'log_ratio', 'imputers': 'median', 'n_estimators': 1550, 'learning_rate': 0.28747816726083714, 'max_depth': 11, 'min_child_weight': 7, 'subsample': 1.0, 'colsample_bytree': 0.8, 'colsample_bylevel': 0.6, 'reg_alpha': 0.025623668037087315, 'reg_lambda': 0.0009614721704429718, 'gamma': 0.1536819126065556}. Best is trial 1 with value: -1.3022713785220033.
[I 2026-07-14 18:10:55,507] Trial 2 finished with value: -1.7117128173015226 and parameters: {'scalers': 'robust', 'ratios': 'log_ratio', 'imputers': 'none', 'n_estimators': 2600, 'learning_rate': 0.11348884594538998, 'max_depth': 9, 'min_child_weight': 4, 'subsample': 0.6, 'colsample_bytree': 0.8, 'colsample_bylevel': 0.6, 'reg_alpha': 0.0003928289179485496, 'reg_lambda': 2.4569454037083447, 'gamma': 0.0012481439291829313}. Best is trial 2 with value: -1.7117128173015226.
[I 2026-07-14 18:10:58,024] Trial 0 finished with value: -1.5577986609180485 and parameters: {'scalers': 'robust', 'ratios': 'norm_ratio', 'imputers': 'median', 'n_estimators': 1150, 'learning_rate': 0.00031633823538960797, 'max_depth': 12, 'min_child_weight': 5, 'subsample': 0.8, 'colsample_bytree': 0.8, 'colsample_bylevel': 0.8, 'reg_alpha': 3.7009860618003145, 'reg_lambda': 0.00012717693265881992, 'gamma': 22.40857734401733}. Best is trial 2 with value: -1.7117128173015226.
[I 2026-07-14 18:11:17,130] Trial 7 finished with value: -1.656841052122045 and parameters: {'scalers': 'robust', 'ratios': 'norm_ratio', 'imputers': 'median', 'n_estimators': 1300, 'learning_rate': 0.113900970291013, 'max_depth': 11, 'min_child_weight': 3, 'subsample': 0.7, 'colsample_bytree': 0.8, 'colsample_bylevel': 0.5, 'reg_alpha': 7.076852295609364e-05, 'reg_lambda': 6.028875607498119e-06, 'gamma': 0.0009565335952248105}. Best is trial 2 with value: -1.7117128173015226.
[I 2026-07-14 18:11:46,783] Trial 3 finished with value: -1.5480988808492628 and parameters: {'scalers': 'standard', 'ratios': 'norm_ratio', 'imputers': 'none', 'n_estimators': 2100, 'learning_rate': 0.09189713181322129, 'max_depth': 12, 'min_child_weight': 2, 'subsample': 0.6, 'colsample_bytree': 0.6, 'colsample_bylevel': 0.9, 'reg_alpha': 0.0005945503880607329, 'reg_lambda': 2.643914968813834e-06, 'gamma': 0.1868293503935779}. Best is trial 2 with value: -1.7117128173015226.
[I 2026-07-14 18:12:00,498] Trial 6 finished with value: -1.244300034076143 and parameters: {'scalers': 'standard', 'ratios': 'log_ratio', 'imputers': 'median', 'n_estimators': 2550, 'learning_rate': 0.08521000852817522, 'max_depth': 7, 'min_child_weight': 2, 'subsample': 0.7, 'colsample_bytree': 0.9, 'colsample_bylevel': 1.0, 'reg_alpha': 10.64386134906548, 'reg_lambda': 0.024366740898784045, 'gamma': 0.006912087320184805}. Best is trial 2 with value: -1.7117128173015226.
[I 2026-07-14 18:12:02,958] Trial 4 finished with value: -1.2113047372197487 and parameters: {'scalers': 'standard', 'ratios': 'norm_ratio', 'imputers': 'median', 'n_estimators': 1150, 'learning_rate': 0.12497901083704463, 'max_depth': 3, 'min_child_weight': 7, 'subsample': 0.8, 'colsample_bytree': 0.9, 'colsample_bylevel': 0.5, 'reg_alpha': 0.0003050060825492688, 'reg_lambda': 8.113433225951912e-05, 'gamma': 0.37053020290560923}. Best is trial 2 with value: -1.7117128173015226.
[I 2026-07-14 18:12:07,620] Trial 5 finished with value: -1.5709445053924433 and parameters: {'scalers': 'robust', 'ratios': 'log_ratio', 'imputers': 'none', 'n_estimators': 500, 'learning_rate': 0.00032717182661467923, 'max_depth': 11, 'min_child_weight': 8, 'subsample': 0.8, 'colsample_bytree': 0.8, 'colsample_bylevel': 0.5, 'reg_alpha': 0.00022605758146277031, 'reg_lambda': 0.00012419538233174668, 'gamma': 0.42400068560315474}. Best is trial 2 with value: -1.7117128173015226.
[I 2026-07-14 18:12:13,542] Trial 8 finished with value: -1.2271979346282145 and parameters: {'scalers': 'robust', 'ratios': 'norm_ratio', 'imputers': 'median', 'n_estimators': 1350, 'learning_rate': 0.0022594384595631904, 'max_depth': 8, 'min_child_weight': 7, 'subsample': 0.6, 'colsample_bytree': 0.5, 'colsample_bylevel': 0.6, 'reg_alpha': 6.862244778657994, 'reg_lambda': 5.3810678742607576e-06, 'gamma': 0.003997945089758201}. Best is trial 2 with value: -1.7117128173015226.
[I 2026-07-14 18:12:18,156] Trial 9 finished with value: -1.5552987480456628 and parameters: {'scalers': 'robust', 'ratios': 'norm_ratio', 'imputers': 'median', 'n_estimators': 900, 'learning_rate': 0.00021875645314195253, 'max_depth': 5, 'min_child_weight': 1, 'subsample': 0.9, 'colsample_bytree': 0.7, 'colsample_bylevel': 0.5, 'reg_alpha': 6.796830700551629e-05, 'reg_lambda': 0.0539244827990108, 'gamma': 0.035919613822583185}. Best is trial 2 with value: -1.7117128173015226.
[I 2026-07-14 18:12:56,730] Trial 10 finished with value: -1.2589297533252242 and parameters: {'scalers': 'none', 'ratios': 'log_ratio', 'imputers': 'median', 'n_estimators': 2250, 'learning_rate': 0.009422023638915837, 'max_depth': 11, 'min_child_weight': 3, 'subsample': 1.0, 'colsample_bytree': 0.8, 'colsample_bylevel': 0.8, 'reg_alpha': 6.240669250923904e-05, 'reg_lambda': 0.0007595362644730677, 'gamma': 0.2048306759658577}. Best is trial 2 with value: -1.7117128173015226.
[I 2026-07-14 18:13:08,450] Trial 11 finished with value: -1.583933975302475 and parameters: {'scalers': 'none', 'ratios': 'log_ratio', 'imputers': 'mean', 'n_estimators': 850, 'learning_rate': 0.00016722669153834222, 'max_depth': 10, 'min_child_weight': 3, 'subsample': 0.5, 'colsample_bytree': 0.9, 'colsample_bylevel': 0.5, 'reg_alpha': 0.00014166102966323217, 'reg_lambda': 2.2317491338278344, 'gamma': 0.0018586420883441952}. Best is trial 2 with value: -1.7117128173015226.
[I 2026-07-14 18:13:18,021] Trial 12 finished with value: -1.5048914360024694 and parameters: {'scalers': 'standard', 'ratios': 'log_ratio', 'imputers': 'mean', 'n_estimators': 1500, 'learning_rate': 0.00021066828383495, 'max_depth': 8, 'min_child_weight': 9, 'subsample': 0.6, 'colsample_bytree': 0.6, 'colsample_bylevel': 0.6, 'reg_alpha': 0.05026013910443776, 'reg_lambda': 39.74389818775194, 'gamma': 0.003483448988365682}. Best is trial 2 with value: -1.7117128173015226.
[I 2026-07-14 18:13:32,393] Trial 13 finished with value: -1.2971969286040208 and parameters: {'scalers': 'robust', 'ratios': 'log_ratio', 'imputers': 'none', 'n_estimators': 2150, 'learning_rate': 0.0337208810038335, 'max_depth': 6, 'min_child_weight': 5, 'subsample': 1.0, 'colsample_bytree': 1.0, 'colsample_bylevel': 0.6, 'reg_alpha': 0.001650772721635339, 'reg_lambda': 0.0010157083443664895, 'gamma': 0.00046942363380346805}. Best is trial 2 with value: -1.7117128173015226.
[I 2026-07-14 18:13:36,793] Trial 14 finished with value: -1.5422021491881326 and parameters: {'scalers': 'none', 'ratios': 'log_ratio', 'imputers': 'none', 'n_estimators': 2700, 'learning_rate': 0.00020458648106284387, 'max_depth': 3, 'min_child_weight': 8, 'subsample': 0.5, 'colsample_bytree': 0.8, 'colsample_bylevel': 0.8, 'reg_alpha': 12.873389225893561, 'reg_lambda': 13.224305129899728, 'gamma': 34.836642295585285}. Best is trial 2 with value: -1.7117128173015226.
[I 2026-07-14 18:13:37,338] Trial 15 finished with value: -1.3455624661994252 and parameters: {'scalers': 'robust', 'ratios': 'log_ratio', 'imputers': 'mean', 'n_estimators': 700, 'learning_rate': 0.4473942438467537, 'max_depth': 12, 'min_child_weight': 9, 'subsample': 0.8, 'colsample_bytree': 1.0, 'colsample_bylevel': 1.0, 'reg_alpha': 49.25794437161389, 'reg_lambda': 0.01048659532223383, 'gamma': 9.96320423531284e-06}. Best is trial 2 with value: -1.7117128173015226.
[I 2026-07-14 18:13:49,207] Trial 16 finished with value: -1.6843799764318494 and parameters: {'scalers': 'robust', 'ratios': 'norm_ratio', 'imputers': 'none', 'n_estimators': 1400, 'learning_rate': 0.20519859857275846, 'max_depth': 8, 'min_child_weight': 4, 'subsample': 0.7, 'colsample_bytree': 0.6, 'colsample_bylevel': 0.7, 'reg_alpha': 0.07243322175817707, 'reg_lambda': 0.018278842787902323, 'gamma': 0.008284162742582096}. Best is trial 2 with value: -1.7117128173015226.
[I 2026-07-14 18:14:09,477] Trial 17 finished with value: -1.330827551642736 and parameters: {'scalers': 'none', 'ratios': 'log_ratio', 'imputers': 'mean', 'n_estimators': 3000, 'learning_rate': 0.009287149169073253, 'max_depth': 8, 'min_child_weight': 10, 'subsample': 0.5, 'colsample_bytree': 0.5, 'colsample_bylevel': 0.8, 'reg_alpha': 2.317100235619141e-06, 'reg_lambda': 69.03741611455723, 'gamma': 2.1480373916901364e-06}. Best is trial 2 with value: -1.7117128173015226.
[I 2026-07-14 18:14:54,862] Trial 18 finished with value: -1.5395634657046593 and parameters: {'scalers': 'robust', 'ratios': 'log_ratio', 'imputers': 'mean', 'n_estimators': 3000, 'learning_rate': 0.021855239113329532, 'max_depth': 9, 'min_child_weight': 4, 'subsample': 0.5, 'colsample_bytree': 1.0, 'colsample_bylevel': 0.7, 'reg_alpha': 1.2818861277633539e-06, 'reg_lambda': 65.87478590636879, 'gamma': 3.1105284539394624e-05}. Best is trial 2 with value: -1.7117128173015226.
[I 2026-07-14 18:15:37,243] Trial 19 finished with value: -1.4743152537144508 and parameters: {'scalers': 'robust', 'ratios': 'log_ratio', 'imputers': 'none', 'n_estimators': 3000, 'learning_rate': 0.020034584977032803, 'max_depth': 9, 'min_child_weight': 5, 'subsample': 0.6, 'colsample_bytree': 1.0, 'colsample_bylevel': 0.7, 'reg_alpha': 5.229876097270185e-06, 'reg_lambda': 59.421017822485844, 'gamma': 3.63861517544648e-05}. Best is trial 2 with value: -1.7117128173015226.
[I 2026-07-14 18:16:12,468] Trial 20 finished with value: -1.4517105458353865 and parameters: {'scalers': 'robust', 'ratios': 'norm_ratio', 'imputers': 'none', 'n_estimators': 3000, 'learning_rate': 0.022642232492817053, 'max_depth': 9, 'min_child_weight': 5, 'subsample': 0.5, 'colsample_bytree': 1.0, 'colsample_bylevel': 0.7, 'reg_alpha': 2.6035384095315517e-06, 'reg_lambda': 0.1294684362788275, 'gamma': 1.1848134889408443e-05}. Best is trial 2 with value: -1.7117128173015226.
[I 2026-07-14 18:16:45,631] Trial 21 finished with value: -2.5298515169010733 and parameters: {'scalers': 'robust', 'ratios': 'norm_ratio', 'imputers': 'none', 'n_estimators': 3000, 'learning_rate': 0.4346984080425144, 'max_depth': 9, 'min_child_weight': 5, 'subsample': 0.5, 'colsample_bytree': 0.7, 'colsample_bylevel': 0.7, 'reg_alpha': 2.5171648240293612e-06, 'reg_lambda': 79.2580830704956, 'gamma': 7.3496223048694255e-06}. Best is trial 21 with value: -2.5298515169010733.
[I 2026-07-14 18:17:18,429] Trial 22 finished with value: -2.2005625540454274 and parameters: {'scalers': 'robust', 'ratios': 'norm_ratio', 'imputers': 'none', 'n_estimators': 3000, 'learning_rate': 0.49013432760656983, 'max_depth': 9, 'min_child_weight': 5, 'subsample': 0.7, 'colsample_bytree': 0.7, 'colsample_bylevel': 0.7, 'reg_alpha': 2.159145077738945e-06, 'reg_lambda': 0.28125916431823955, 'gamma': 5.595830212525338e-06}. Best is trial 21 with value: -2.5298515169010733.
[I 2026-07-14 18:17:20,364] Trial 23 finished with value: -1.2521602812173012 and parameters: {'scalers': 'robust', 'ratios': 'norm_ratio', 'imputers': 'none', 'n_estimators': 200, 'learning_rate': 0.015596580144053013, 'max_depth': 9, 'min_child_weight': 5, 'subsample': 0.7, 'colsample_bytree': 0.7, 'colsample_bylevel': 0.7, 'reg_alpha': 4.859106497044253e-06, 'reg_lambda': 0.5586840746835592, 'gamma': 3.244294304307957e-05}. Best is trial 21 with value: -2.5298515169010733.
[I 2026-07-14 18:17:49,368] Trial 24 finished with value: -1.4630166391851154 and parameters: {'scalers': 'robust', 'ratios': 'norm_ratio', 'imputers': 'none', 'n_estimators': 3000, 'learning_rate': 0.022043098302167934, 'max_depth': 9, 'min_child_weight': 5, 'subsample': 0.7, 'colsample_bytree': 0.5, 'colsample_bylevel': 0.7, 'reg_alpha': 0.21013343242948887, 'reg_lambda': 0.38924431748132926, 'gamma': 8.536157123410265e-05}. Best is trial 21 with value: -2.5298515169010733.
[I 2026-07-14 18:18:09,585] Trial 25 finished with value: -1.4403728295055498 and parameters: {'scalers': 'robust', 'ratios': 'norm_ratio', 'imputers': 'none', 'n_estimators': 1850, 'learning_rate': 0.030804754052881717, 'max_depth': 9, 'min_child_weight': 5, 'subsample': 0.7, 'colsample_bytree': 0.6, 'colsample_bylevel': 0.7, 'reg_alpha': 0.33577833132010565, 'reg_lambda': 0.4664270692876334, 'gamma': 0.00010447965878111118}. Best is trial 21 with value: -2.5298515169010733.
[I 2026-07-14 18:18:17,026] Trial 26 finished with value: -1.2797207959630277 and parameters: {'scalers': 'robust', 'ratios': 'norm_ratio', 'imputers': 'none', 'n_estimators': 1750, 'learning_rate': 0.03398948731024233, 'max_depth': 5, 'min_child_weight': 5, 'subsample': 0.7, 'colsample_bytree': 0.6, 'colsample_bylevel': 0.7, 'reg_alpha': 0.10381011839818798, 'reg_lambda': 0.36452862313347295, 'gamma': 0.0002823103341354874}. Best is trial 21 with value: -2.5298515169010733.
[I 2026-07-14 18:18:18,079] Trial 27 finished with value: -1.4305766042723074 and parameters: {'scalers': 'robust', 'ratios': 'norm_ratio', 'imputers': 'none', 'n_estimators': 250, 'learning_rate': 0.2994826535572841, 'max_depth': 6, 'min_child_weight': 6, 'subsample': 0.7, 'colsample_bytree': 0.6, 'colsample_bylevel': 0.7, 'reg_alpha': 0.24002290101384657, 'reg_lambda': 0.49093728414501375, 'gamma': 0.00013670261831154554}. Best is trial 21 with value: -2.5298515169010733.
[I 2026-07-14 18:18:20,118] Trial 28 finished with value: -1.4592965821793613 and parameters: {'scalers': 'robust', 'ratios': 'norm_ratio', 'imputers': 'none', 'n_estimators': 150, 'learning_rate': 0.18898642666842363, 'max_depth': 10, 'min_child_weight': 4, 'subsample': 0.7, 'colsample_bytree': 0.7, 'colsample_bylevel': 0.6, 'reg_alpha': 0.02117107967486236, 'reg_lambda': 0.4726635785936151, 'gamma': 0.00030374634453815303}. Best is trial 21 with value: -2.5298515169010733.
[I 2026-07-14 18:18:39,005] Trial 29 finished with value: -1.7672325467284675 and parameters: {'scalers': 'robust', 'ratios': 'norm_ratio', 'imputers': 'none', 'n_estimators': 2550, 'learning_rate': 0.21238397659377437, 'max_depth': 7, 'min_child_weight': 4, 'subsample': 0.7, 'colsample_bytree': 0.7, 'colsample_bylevel': 0.7, 'reg_alpha': 0.023967869764928, 'reg_lambda': 1.7610335267080028, 'gamma': 0.0001717512313340852}. Best is trial 21 with value: -2.5298515169010733.
[I 2026-07-14 18:19:11,293] Trial 30 finished with value: -2.0734567633305914 and parameters: {'scalers': 'robust', 'ratios': 'norm_ratio', 'imputers': 'none', 'n_estimators': 2500, 'learning_rate': 0.48298638371279606, 'max_depth': 10, 'min_child_weight': 6, 'subsample': 0.7, 'colsample_bytree': 0.7, 'colsample_bylevel': 0.7, 'reg_alpha': 1.5589269744099435e-05, 'reg_lambda': 1.0317164192023016, 'gamma': 1.0185265500900814e-06}. Best is trial 21 with value: -2.5298515169010733.
[I 2026-07-14 18:19:39,871] Trial 31 finished with value: -1.5177718097324393 and parameters: {'scalers': 'robust', 'ratios': 'norm_ratio', 'imputers': 'none', 'n_estimators': 2550, 'learning_rate': 0.05431451196947793, 'max_depth': 10, 'min_child_weight': 6, 'subsample': 0.6, 'colsample_bytree': 0.7, 'colsample_bylevel': 0.6, 'reg_alpha': 1.371518503262792e-05, 'reg_lambda': 3.6977454863174644, 'gamma': 0.0002879527853871797}. Best is trial 21 with value: -2.5298515169010733.
[I 2026-07-14 18:20:13,546] Trial 32 finished with value: -2.1953926707986957 and parameters: {'scalers': 'robust', 'ratios': 'norm_ratio', 'imputers': 'none', 'n_estimators': 2650, 'learning_rate': 0.4586923337135159, 'max_depth': 10, 'min_child_weight': 6, 'subsample': 0.6, 'colsample_bytree': 0.7, 'colsample_bylevel': 0.6, 'reg_alpha': 2.006355719116503e-05, 'reg_lambda': 4.385014414978144, 'gamma': 1.079335979083576e-06}. Best is trial 21 with value: -2.5298515169010733.
[I 2026-07-14 18:20:33,035] Trial 33 finished with value: -2.112593747707829 and parameters: {'scalers': 'robust', 'ratios': 'norm_ratio', 'imputers': 'none', 'n_estimators': 2600, 'learning_rate': 0.4912175697795538, 'max_depth': 7, 'min_child_weight': 6, 'subsample': 0.6, 'colsample_bytree': 0.7, 'colsample_bylevel': 0.6, 'reg_alpha': 1.2183562960033748e-05, 'reg_lambda': 6.526882321045195, 'gamma': 1.7703512741068668e-06}. Best is trial 21 with value: -2.5298515169010733.
[I 2026-07-14 18:21:06,279] Trial 34 finished with value: -2.2491589540135086 and parameters: {'scalers': 'robust', 'ratios': 'norm_ratio', 'imputers': 'none', 'n_estimators': 2600, 'learning_rate': 0.49106958338822965, 'max_depth': 10, 'min_child_weight': 6, 'subsample': 0.6, 'colsample_bytree': 0.7, 'colsample_bylevel': 0.6, 'reg_alpha': 0.004986819178603694, 'reg_lambda': 4.261906053645931, 'gamma': 1.4102224801669837e-06}. Best is trial 21 with value: -2.5298515169010733.
[I 2026-07-14 18:21:39,848] Trial 35 finished with value: -2.1567723820787115 and parameters: {'scalers': 'standard', 'ratios': 'norm_ratio', 'imputers': 'none', 'n_estimators': 2650, 'learning_rate': 0.43539952846524443, 'max_depth': 10, 'min_child_weight': 6, 'subsample': 0.6, 'colsample_bytree': 0.7, 'colsample_bylevel': 0.6, 'reg_alpha': 0.006299849689367089, 'reg_lambda': 4.218084871578924, 'gamma': 1.4707673004612231e-06}. Best is trial 21 with value: -2.5298515169010733.
[I 2026-07-14 18:22:18,412] Trial 36 finished with value: -2.1196845868422503 and parameters: {'scalers': 'standard', 'ratios': 'norm_ratio', 'imputers': 'none', 'n_estimators': 2650, 'learning_rate': 0.4257284382839082, 'max_depth': 10, 'min_child_weight': 6, 'subsample': 0.6, 'colsample_bytree': 0.7, 'colsample_bylevel': 0.8, 'reg_alpha': 1.5903295080021754e-05, 'reg_lambda': 6.2597245915514685, 'gamma': 1.5446652995403075e-06}. Best is trial 21 with value: -2.5298515169010733.
[I 2026-07-14 18:22:38,524] Trial 37 finished with value: -1.401756766583692 and parameters: {'scalers': 'standard', 'ratios': 'norm_ratio', 'imputers': 'none', 'n_estimators': 2400, 'learning_rate': 0.05480068579893254, 'max_depth': 7, 'min_child_weight': 6, 'subsample': 0.9, 'colsample_bytree': 0.7, 'colsample_bylevel': 0.8, 'reg_alpha': 1.3446424548971556e-05, 'reg_lambda': 7.0555229721820245, 'gamma': 1.3439145852536028e-06}. Best is trial 21 with value: -2.5298515169010733.
[I 2026-07-14 18:23:12,996] Trial 38 finished with value: -1.999689019711778 and parameters: {'scalers': 'robust', 'ratios': 'norm_ratio', 'imputers': 'none', 'n_estimators': 2350, 'learning_rate': 0.43150256838713885, 'max_depth': 10, 'min_child_weight': 6, 'subsample': 0.8, 'colsample_bytree': 0.7, 'colsample_bylevel': 0.8, 'reg_alpha': 1.702024901040705e-05, 'reg_lambda': 2.2838142119075746, 'gamma': 2.19611631582726e-06}. Best is trial 21 with value: -2.5298515169010733.
[I 2026-07-14 18:23:34,804] Trial 39 finished with value: -1.9729620901430556 and parameters: {'scalers': 'robust', 'ratios': 'norm_ratio', 'imputers': 'none', 'n_estimators': 2350, 'learning_rate': 0.49900001005755246, 'max_depth': 7, 'min_child_weight': 6, 'subsample': 0.8, 'colsample_bytree': 0.7, 'colsample_bylevel': 0.8, 'reg_alpha': 1.5672336213598552e-05, 'reg_lambda': 13.595956148765124, 'gamma': 1.393298259689998e-06}. Best is trial 21 with value: -2.5298515169010733.
[I 2026-07-14 18:24:16,345] Trial 40 finished with value: -2.232425919714025 and parameters: {'scalers': 'robust', 'ratios': 'norm_ratio', 'imputers': 'none', 'n_estimators': 2800, 'learning_rate': 0.4872338299928862, 'max_depth': 10, 'min_child_weight': 6, 'subsample': 0.6, 'colsample_bytree': 0.7, 'colsample_bylevel': 0.8, 'reg_alpha': 1.4932915157623374e-05, 'reg_lambda': 9.504381540292304, 'gamma': 1.8688735830289154e-06}. Best is trial 21 with value: -2.5298515169010733.
[I 2026-07-14 18:24:36,181] Trial 41 finished with value: -1.8326482345173187 and parameters: {'scalers': 'standard', 'ratios': 'norm_ratio', 'imputers': 'none', 'n_estimators': 2750, 'learning_rate': 0.3335767700545013, 'max_depth': 7, 'min_child_weight': 7, 'subsample': 0.6, 'colsample_bytree': 0.7, 'colsample_bylevel': 0.6, 'reg_alpha': 1.3369609767668428e-05, 'reg_lambda': 7.401117202453356, 'gamma': 4.396820751644904e-06}. Best is trial 21 with value: -2.5298515169010733.
[I 2026-07-14 18:25:17,482] Trial 42 finished with value: -1.881054810198218 and parameters: {'scalers': 'standard', 'ratios': 'norm_ratio', 'imputers': 'none', 'n_estimators': 2800, 'learning_rate': 0.2886377907010859, 'max_depth': 11, 'min_child_weight': 7, 'subsample': 0.6, 'colsample_bytree': 0.7, 'colsample_bylevel': 0.8, 'reg_alpha': 0.008171460273521584, 'reg_lambda': 11.556386423765074, 'gamma': 4.060656900730158e-06}. Best is trial 21 with value: -2.5298515169010733.
[I 2026-07-14 18:26:01,872] Trial 43 finished with value: -1.9114236212039402 and parameters: {'scalers': 'robust', 'ratios': 'norm_ratio', 'imputers': 'none', 'n_estimators': 2800, 'learning_rate': 0.2660858180301906, 'max_depth': 11, 'min_child_weight': 7, 'subsample': 0.5, 'colsample_bytree': 0.8, 'colsample_bylevel': 0.9, 'reg_alpha': 1.0463519951967525e-06, 'reg_lambda': 15.415297426798038, 'gamma': 5.692781616736709e-06}. Best is trial 21 with value: -2.5298515169010733.
[I 2026-07-14 18:26:37,908] Trial 44 finished with value: -1.8963625441010015 and parameters: {'scalers': 'robust', 'ratios': 'norm_ratio', 'imputers': 'none', 'n_estimators': 2800, 'learning_rate': 0.2460052157204985, 'max_depth': 12, 'min_child_weight': 7, 'subsample': 0.5, 'colsample_bytree': 0.8, 'colsample_bylevel': 0.6, 'reg_alpha': 0.0026467501053066543, 'reg_lambda': 18.53703455185577, 'gamma': 5.940742574869472e-06}. Best is trial 21 with value: -2.5298515169010733.
