[I 2026-07-14 19:50:26,991] Trial 180 finished with value: -2.5960134878624403 and parameters: {'scalers': 'robust', 'ratios': 'log_ratio', 'imputers': 'median', 'n_estimators': 2950, 'learning_rate': 0.3513663843577762, 'max_depth': 8, 'min_child_weight': 2, 'subsample': 0.8, 'colsample_bytree': 0.8, 'colsample_bylevel': 0.8, 'reg_alpha': 2.7903999219009723e-05, 'reg_lambda': 29.109820744233758, 'gamma': 0.00021159425301687187}. Best is trial 178 with value: -3.151981085678069.
[I 2026-07-14 19:51:21,489] Trial 181 finished with value: -3.2950734103579915 and parameters: {'scalers': 'robust', 'ratios': 'log_ratio', 'imputers': 'mean', 'n_estimators': 2900, 'learning_rate': 0.37416461126102013, 'max_depth': 8, 'min_child_weight': 1, 'subsample': 0.8, 'colsample_bytree': 0.8, 'colsample_bylevel': 0.8, 'reg_alpha': 2.810940994489805e-05, 'reg_lambda': 28.2840966458609, 'gamma': 6.561381140868419e-05}. Best is trial 181 with value: -3.2950734103579915.
[I 2026-07-14 19:52:17,060] Trial 182 finished with value: -3.787070724020268 and parameters: {'scalers': 'robust', 'ratios': 'log_ratio', 'imputers': 'median', 'n_estimators': 2900, 'learning_rate': 0.49257307774319836, 'max_depth': 8, 'min_child_weight': 1, 'subsample': 0.8, 'colsample_bytree': 0.8, 'colsample_bylevel': 0.8, 'reg_alpha': 1.9909826843470796e-05, 'reg_lambda': 29.905731938398894, 'gamma': 0.00023948478484802775}. Best is trial 182 with value: -3.787070724020268.
[I 2026-07-14 19:53:15,244] Trial 183 finished with value: -3.044276313992022 and parameters: {'scalers': 'robust', 'ratios': 'log_ratio', 'imputers': 'mean', 'n_estimators': 2750, 'learning_rate': 0.3285106697686891, 'max_depth': 8, 'min_child_weight': 1, 'subsample': 0.8, 'colsample_bytree': 0.8, 'colsample_bylevel': 0.9, 'reg_alpha': 2.0514821113184005e-05, 'reg_lambda': 62.801289789063944, 'gamma': 6.411479316187457e-05}. Best is trial 182 with value: -3.787070724020268.
[I 2026-07-14 19:53:50,894] Trial 185 finished with value: -1.307331001610251 and parameters: {'scalers': 'robust', 'ratios': 'log_ratio', 'imputers': 'mean', 'n_estimators': 2750, 'learning_rate': 0.41846380327621513, 'max_depth': 9, 'min_child_weight': 1, 'subsample': 0.8, 'colsample_bytree': 0.8, 'colsample_bylevel': 0.8, 'reg_alpha': 30.02908736371452, 'reg_lambda': 68.42943529647934, 'gamma': 6.835704767330322e-05}. Best is trial 182 with value: -3.787070724020268.
[I 2026-07-14 19:54:10,220] Trial 184 finished with value: -3.2743751011665516 and parameters: {'scalers': 'robust', 'ratios': 'log_ratio', 'imputers': 'mean', 'n_estimators': 2750, 'learning_rate': 0.38113596306586917, 'max_depth': 8, 'min_child_weight': 1, 'subsample': 0.8, 'colsample_bytree': 0.8, 'colsample_bylevel': 0.8, 'reg_alpha': 1.9682363125089743e-05, 'reg_lambda': 65.71481882681468, 'gamma': 6.97135649539174e-05}. Best is trial 182 with value: -3.787070724020268.
[I 2026-07-14 19:55:10,697] Trial 186 finished with value: -4.162639356986258 and parameters: {'scalers': 'robust', 'ratios': 'log_ratio', 'imputers': 'mean', 'n_estimators': 2750, 'learning_rate': 0.48772486269445764, 'max_depth': 9, 'min_child_weight': 1, 'subsample': 0.8, 'colsample_bytree': 0.8, 'colsample_bylevel': 0.9, 'reg_alpha': 3.0682951436936007e-05, 'reg_lambda': 62.663375512364944, 'gamma': 5.88636737359243e-05}. Best is trial 186 with value: -4.162639356986258.
[I 2026-07-14 19:56:14,550] Trial 187 finished with value: -3.7276916747476867 and parameters: {'scalers': 'robust', 'ratios': 'log_ratio', 'imputers': 'mean', 'n_estimators': 2750, 'learning_rate': 0.40317760823778914, 'max_depth': 9, 'min_child_weight': 1, 'subsample': 0.8, 'colsample_bytree': 0.8, 'colsample_bylevel': 0.9, 'reg_alpha': 9.735255045425742e-06, 'reg_lambda': 62.8050447874793, 'gamma': 7.208226984645934e-05}. Best is trial 186 with value: -4.162639356986258.
[I 2026-07-14 19:57:08,747] Trial 188 finished with value: -3.358654110442333 and parameters: {'scalers': 'robust', 'ratios': 'log_ratio', 'imputers': 'mean', 'n_estimators': 2750, 'learning_rate': 0.40023845931737645, 'max_depth': 8, 'min_child_weight': 1, 'subsample': 0.8, 'colsample_bytree': 0.8, 'colsample_bylevel': 0.8, 'reg_alpha': 1.0005450559614312e-05, 'reg_lambda': 65.96897863054082, 'gamma': 5.508329650604284e-05}. Best is trial 186 with value: -4.162639356986258.
[I 2026-07-14 19:58:02,930] Trial 189 finished with value: -3.427957116379461 and parameters: {'scalers': 'robust', 'ratios': 'log_ratio', 'imputers': 'mean', 'n_estimators': 2750, 'learning_rate': 0.41295157183477815, 'max_depth': 8, 'min_child_weight': 1, 'subsample': 0.8, 'colsample_bytree': 0.8, 'colsample_bylevel': 0.8, 'reg_alpha': 1.1020219029031255e-05, 'reg_lambda': 55.16397338998531, 'gamma': 6.46289286087328e-05}. Best is trial 186 with value: -4.162639356986258.
[I 2026-07-14 19:59:03,879] Trial 190 finished with value: -4.354116954649767 and parameters: {'scalers': 'robust', 'ratios': 'log_ratio', 'imputers': 'median', 'n_estimators': 2750, 'learning_rate': 0.4992814445394953, 'max_depth': 9, 'min_child_weight': 1, 'subsample': 0.8, 'colsample_bytree': 0.8, 'colsample_bylevel': 0.8, 'reg_alpha': 3.252530390504067e-05, 'reg_lambda': 64.87839665390834, 'gamma': 6.794405809208358e-05}. Best is trial 190 with value: -4.354116954649767.
[I 2026-07-14 20:00:07,882] Trial 191 finished with value: -4.234079693118426 and parameters: {'scalers': 'robust', 'ratios': 'log_ratio', 'imputers': 'median', 'n_estimators': 2750, 'learning_rate': 0.49339316384524046, 'max_depth': 9, 'min_child_weight': 1, 'subsample': 0.8, 'colsample_bytree': 0.8, 'colsample_bylevel': 0.9, 'reg_alpha': 1.1826764094019647e-05, 'reg_lambda': 68.6852842789084, 'gamma': 7.858989906212748e-05}. Best is trial 190 with value: -4.354116954649767.
[I 2026-07-14 20:01:03,500] Trial 192 finished with value: -3.6362829214938324 and parameters: {'scalers': 'robust', 'ratios': 'log_ratio', 'imputers': 'median', 'n_estimators': 2800, 'learning_rate': 0.47653165594257657, 'max_depth': 8, 'min_child_weight': 1, 'subsample': 0.8, 'colsample_bytree': 0.8, 'colsample_bylevel': 0.9, 'reg_alpha': 2.815892472482567e-05, 'reg_lambda': 18.8855887914092, 'gamma': 6.883396479310657e-05}. Best is trial 190 with value: -4.354116954649767.
[I 2026-07-14 20:02:07,135] Trial 193 finished with value: -3.6884419152464507 and parameters: {'scalers': 'robust', 'ratios': 'log_ratio', 'imputers': 'median', 'n_estimators': 2750, 'learning_rate': 0.46767959112960916, 'max_depth': 8, 'min_child_weight': 1, 'subsample': 0.8, 'colsample_bytree': 0.8, 'colsample_bylevel': 1.0, 'reg_alpha': 3.207741529316117e-05, 'reg_lambda': 63.06026680884013, 'gamma': 6.764756056581909e-05}. Best is trial 190 with value: -4.354116954649767.
[I 2026-07-14 20:03:13,083] Trial 194 finished with value: -4.067343344583602 and parameters: {'scalers': 'robust', 'ratios': 'log_ratio', 'imputers': 'median', 'n_estimators': 2750, 'learning_rate': 0.4639414990735563, 'max_depth': 9, 'min_child_weight': 1, 'subsample': 0.8, 'colsample_bytree': 0.8, 'colsample_bylevel': 0.9, 'reg_alpha': 5.3294334663096174e-05, 'reg_lambda': 68.44281714240319, 'gamma': 6.808143097276709e-05}. Best is trial 190 with value: -4.354116954649767.
[I 2026-07-14 20:04:10,232] Trial 195 finished with value: -4.116450774562112 and parameters: {'scalers': 'robust', 'ratios': 'log_ratio', 'imputers': 'median', 'n_estimators': 2650, 'learning_rate': 0.47194675008040454, 'max_depth': 9, 'min_child_weight': 1, 'subsample': 0.8, 'colsample_bytree': 0.8, 'colsample_bylevel': 0.9, 'reg_alpha': 3.1762610582641933e-05, 'reg_lambda': 99.04126142901846, 'gamma': 5.928894939131769e-05}. Best is trial 190 with value: -4.354116954649767.
[I 2026-07-14 20:05:13,064] Trial 196 finished with value: -4.21021757623627 and parameters: {'scalers': 'robust', 'ratios': 'log_ratio', 'imputers': 'median', 'n_estimators': 2650, 'learning_rate': 0.4926563354799899, 'max_depth': 9, 'min_child_weight': 1, 'subsample': 0.8, 'colsample_bytree': 0.8, 'colsample_bylevel': 0.9, 'reg_alpha': 3.356834826201967e-05, 'reg_lambda': 61.20065061479672, 'gamma': 6.890646495299332e-05}. Best is trial 190 with value: -4.354116954649767.
[I 2026-07-14 20:06:15,247] Trial 197 finished with value: -4.388239924266747 and parameters: {'scalers': 'robust', 'ratios': 'log_ratio', 'imputers': 'median', 'n_estimators': 2650, 'learning_rate': 0.49944365807871144, 'max_depth': 9, 'min_child_weight': 1, 'subsample': 0.8, 'colsample_bytree': 0.8, 'colsample_bylevel': 0.9, 'reg_alpha': 2.9679356540828706e-05, 'reg_lambda': 99.77484671674813, 'gamma': 7.304588973537461e-05}. Best is trial 197 with value: -4.388239924266747.
[I 2026-07-14 20:07:14,405] Trial 198 finished with value: -4.400702416688771 and parameters: {'scalers': 'robust', 'ratios': 'log_ratio', 'imputers': 'median', 'n_estimators': 2650, 'learning_rate': 0.4975613389174497, 'max_depth': 9, 'min_child_weight': 1, 'subsample': 0.8, 'colsample_bytree': 0.8, 'colsample_bylevel': 0.9, 'reg_alpha': 3.14082205708068e-05, 'reg_lambda': 99.23209164427269, 'gamma': 6.549891805831085e-05}. Best is trial 198 with value: -4.400702416688771.
[I 2026-07-14 20:08:20,749] Trial 199 finished with value: -3.99681783338364 and parameters: {'scalers': 'robust', 'ratios': 'log_ratio', 'imputers': 'median', 'n_estimators': 2700, 'learning_rate': 0.4560110396404745, 'max_depth': 9, 'min_child_weight': 1, 'subsample': 0.8, 'colsample_bytree': 0.8, 'colsample_bylevel': 0.9, 'reg_alpha': 3.14648700009065e-05, 'reg_lambda': 68.55950364123717, 'gamma': 7.07557351352041e-05}. Best is trial 198 with value: -4.400702416688771.
[I 2026-07-14 20:09:22,803] Trial 200 finished with value: -4.101416437679251 and parameters: {'scalers': 'robust', 'ratios': 'log_ratio', 'imputers': 'median', 'n_estimators': 2650, 'learning_rate': 0.4642594238182003, 'max_depth': 9, 'min_child_weight': 1, 'subsample': 0.8, 'colsample_bytree': 0.8, 'colsample_bylevel': 0.9, 'reg_alpha': 3.322647453605248e-05, 'reg_lambda': 95.60174416744438, 'gamma': 6.660763723012481e-05}. Best is trial 198 with value: -4.400702416688771.
[I 2026-07-14 20:10:27,077] Trial 201 finished with value: -3.977918047887723 and parameters: {'scalers': 'robust', 'ratios': 'log_ratio', 'imputers': 'median', 'n_estimators': 2700, 'learning_rate': 0.46691584758354465, 'max_depth': 9, 'min_child_weight': 1, 'subsample': 0.8, 'colsample_bytree': 0.8, 'colsample_bylevel': 0.9, 'reg_alpha': 3.345201334611137e-05, 'reg_lambda': 66.74032274340473, 'gamma': 7.033772958248559e-05}. Best is trial 198 with value: -4.400702416688771.
[I 2026-07-14 20:11:27,220] Trial 202 finished with value: -4.280838338993124 and parameters: {'scalers': 'robust', 'ratios': 'log_ratio', 'imputers': 'median', 'n_estimators': 2650, 'learning_rate': 0.4960967540801256, 'max_depth': 9, 'min_child_weight': 1, 'subsample': 0.8, 'colsample_bytree': 0.8, 'colsample_bylevel': 0.9, 'reg_alpha': 3.1236594903431506e-05, 'reg_lambda': 97.78550561953487, 'gamma': 7.7390151178752e-05}. Best is trial 198 with value: -4.400702416688771.
[I 2026-07-14 20:12:27,638] Trial 203 finished with value: -4.194181867186134 and parameters: {'scalers': 'robust', 'ratios': 'log_ratio', 'imputers': 'median', 'n_estimators': 2650, 'learning_rate': 0.48299813445635736, 'max_depth': 9, 'min_child_weight': 1, 'subsample': 0.8, 'colsample_bytree': 0.8, 'colsample_bylevel': 0.9, 'reg_alpha': 3.2813879392306505e-05, 'reg_lambda': 99.76765461468344, 'gamma': 6.862495766210454e-05}. Best is trial 198 with value: -4.400702416688771.
[I 2026-07-14 20:13:24,131] Trial 204 finished with value: -4.348655677185072 and parameters: {'scalers': 'robust', 'ratios': 'log_ratio', 'imputers': 'median', 'n_estimators': 2650, 'learning_rate': 0.49814569350598964, 'max_depth': 9, 'min_child_weight': 1, 'subsample': 0.8, 'colsample_bytree': 0.8, 'colsample_bylevel': 0.9, 'reg_alpha': 5.1820033966926516e-05, 'reg_lambda': 93.43653140959104, 'gamma': 7.324391625109579e-05}. Best is trial 198 with value: -4.400702416688771.
[I 2026-07-14 20:14:25,202] Trial 205 finished with value: -4.109067309217814 and parameters: {'scalers': 'robust', 'ratios': 'log_ratio', 'imputers': 'median', 'n_estimators': 2650, 'learning_rate': 0.47650564299119064, 'max_depth': 9, 'min_child_weight': 1, 'subsample': 0.8, 'colsample_bytree': 0.8, 'colsample_bylevel': 0.9, 'reg_alpha': 5.32404495728351e-05, 'reg_lambda': 91.87186862206238, 'gamma': 5.7702894464059675e-05}. Best is trial 198 with value: -4.400702416688771.
[I 2026-07-14 20:15:25,379] Trial 206 finished with value: -4.324244212276325 and parameters: {'scalers': 'robust', 'ratios': 'log_ratio', 'imputers': 'median', 'n_estimators': 2650, 'learning_rate': 0.4943971479246372, 'max_depth': 9, 'min_child_weight': 1, 'subsample': 0.8, 'colsample_bytree': 0.8, 'colsample_bylevel': 0.9, 'reg_alpha': 5.009595150876254e-05, 'reg_lambda': 89.7906712932889, 'gamma': 5.0355790562694554e-05}. Best is trial 198 with value: -4.400702416688771.
[I 2026-07-14 20:16:23,035] Trial 207 finished with value: -4.221191202875673 and parameters: {'scalers': 'robust', 'ratios': 'log_ratio', 'imputers': 'median', 'n_estimators': 2650, 'learning_rate': 0.49828200614126894, 'max_depth': 9, 'min_child_weight': 1, 'subsample': 0.8, 'colsample_bytree': 0.8, 'colsample_bylevel': 0.9, 'reg_alpha': 5.608566879805303e-05, 'reg_lambda': 72.91532809675333, 'gamma': 2.4756396216719978e-05}. Best is trial 198 with value: -4.400702416688771.
[I 2026-07-14 20:17:25,518] Trial 208 finished with value: -4.412562400107615 and parameters: {'scalers': 'robust', 'ratios': 'log_ratio', 'imputers': 'median', 'n_estimators': 2650, 'learning_rate': 0.4970516352642396, 'max_depth': 9, 'min_child_weight': 1, 'subsample': 0.8, 'colsample_bytree': 0.8, 'colsample_bylevel': 0.9, 'reg_alpha': 5.2691792183454035e-05, 'reg_lambda': 99.2377872144411, 'gamma': 5.297189005761287e-05}. Best is trial 208 with value: -4.412562400107615.
[I 2026-07-14 20:18:21,558] Trial 209 finished with value: -4.2756809671019855 and parameters: {'scalers': 'robust', 'ratios': 'log_ratio', 'imputers': 'median', 'n_estimators': 2650, 'learning_rate': 0.4909271098880128, 'max_depth': 9, 'min_child_weight': 1, 'subsample': 0.8, 'colsample_bytree': 0.8, 'colsample_bylevel': 0.9, 'reg_alpha': 3.4575440243102424e-05, 'reg_lambda': 70.42247762929112, 'gamma': 4.890758416784374e-05}. Best is trial 208 with value: -4.412562400107615.
[I 2026-07-14 20:19:23,072] Trial 210 finished with value: -4.014591449787141 and parameters: {'scalers': 'robust', 'ratios': 'log_ratio', 'imputers': 'median', 'n_estimators': 2650, 'learning_rate': 0.47638767683861283, 'max_depth': 9, 'min_child_weight': 1, 'subsample': 0.8, 'colsample_bytree': 0.8, 'colsample_bylevel': 0.9, 'reg_alpha': 5.284954133633155e-05, 'reg_lambda': 65.45603414185192, 'gamma': 5.171542732635005e-05}. Best is trial 208 with value: -4.412562400107615.
[I 2026-07-14 20:20:21,910] Trial 211 finished with value: -4.273730695516341 and parameters: {'scalers': 'robust', 'ratios': 'log_ratio', 'imputers': 'median', 'n_estimators': 2650, 'learning_rate': 0.4970548956395892, 'max_depth': 9, 'min_child_weight': 1, 'subsample': 0.8, 'colsample_bytree': 0.8, 'colsample_bylevel': 0.9, 'reg_alpha': 5.2795629496079786e-05, 'reg_lambda': 68.0638063041683, 'gamma': 2.5943455774531013e-05}. Best is trial 208 with value: -4.412562400107615.
[I 2026-07-14 20:21:23,990] Trial 212 finished with value: -4.337342696619252 and parameters: {'scalers': 'robust', 'ratios': 'log_ratio', 'imputers': 'median', 'n_estimators': 2650, 'learning_rate': 0.49930158595504, 'max_depth': 9, 'min_child_weight': 1, 'subsample': 0.8, 'colsample_bytree': 0.8, 'colsample_bylevel': 0.9, 'reg_alpha': 5.417175818225882e-05, 'reg_lambda': 73.12219322070692, 'gamma': 2.519931533179917e-05}. Best is trial 208 with value: -4.412562400107615.
[I 2026-07-14 20:22:24,636] Trial 213 finished with value: -4.3561858984992625 and parameters: {'scalers': 'robust', 'ratios': 'log_ratio', 'imputers': 'median', 'n_estimators': 2650, 'learning_rate': 0.4978934642598266, 'max_depth': 9, 'min_child_weight': 1, 'subsample': 0.8, 'colsample_bytree': 0.8, 'colsample_bylevel': 0.9, 'reg_alpha': 4.9774796550101386e-05, 'reg_lambda': 68.57958383907057, 'gamma': 2.45207674446247e-05}. Best is trial 208 with value: -4.412562400107615.
[I 2026-07-14 20:23:27,225] Trial 214 finished with value: -4.410966385402067 and parameters: {'scalers': 'robust', 'ratios': 'log_ratio', 'imputers': 'median', 'n_estimators': 2650, 'learning_rate': 0.4993729348568751, 'max_depth': 9, 'min_child_weight': 1, 'subsample': 0.8, 'colsample_bytree': 0.8, 'colsample_bylevel': 0.9, 'reg_alpha': 0.00013176197349508618, 'reg_lambda': 76.27069348613881, 'gamma': 2.5477427088444238e-05}. Best is trial 208 with value: -4.412562400107615.
[I 2026-07-14 20:24:28,334] Trial 215 finished with value: -4.398774623119196 and parameters: {'scalers': 'robust', 'ratios': 'log_ratio', 'imputers': 'median', 'n_estimators': 2650, 'learning_rate': 0.49852937678544185, 'max_depth': 9, 'min_child_weight': 1, 'subsample': 0.8, 'colsample_bytree': 0.8, 'colsample_bylevel': 0.9, 'reg_alpha': 0.00014228250327974842, 'reg_lambda': 99.69333428961234, 'gamma': 2.4860427654843432e-05}. Best is trial 208 with value: -4.412562400107615.
[I 2026-07-14 20:25:26,501] Trial 216 finished with value: -4.36698749092081 and parameters: {'scalers': 'robust', 'ratios': 'log_ratio', 'imputers': 'median', 'n_estimators': 2650, 'learning_rate': 0.49406895254482913, 'max_depth': 9, 'min_child_weight': 1, 'subsample': 0.8, 'colsample_bytree': 0.8, 'colsample_bylevel': 0.9, 'reg_alpha': 5.101767761866785e-05, 'reg_lambda': 76.05902131503412, 'gamma': 3.246475728647347e-05}. Best is trial 208 with value: -4.412562400107615.
[I 2026-07-14 20:26:26,169] Trial 217 finished with value: -4.0441115152865965 and parameters: {'scalers': 'robust', 'ratios': 'log_ratio', 'imputers': 'median', 'n_estimators': 2650, 'learning_rate': 0.4671663159473906, 'max_depth': 9, 'min_child_weight': 1, 'subsample': 0.8, 'colsample_bytree': 0.8, 'colsample_bylevel': 0.9, 'reg_alpha': 6.22966492760895e-05, 'reg_lambda': 77.27909626960475, 'gamma': 2.4882408130973855e-05}. Best is trial 208 with value: -4.412562400107615.
[I 2026-07-14 20:27:31,124] Trial 218 finished with value: -4.234185257653312 and parameters: {'scalers': 'robust', 'ratios': 'log_ratio', 'imputers': 'median', 'n_estimators': 2650, 'learning_rate': 0.48571052811796084, 'max_depth': 9, 'min_child_weight': 1, 'subsample': 0.8, 'colsample_bytree': 0.8, 'colsample_bylevel': 0.9, 'reg_alpha': 5.088870014884519e-05, 'reg_lambda': 79.19350361466893, 'gamma': 2.4551350574432913e-05}. Best is trial 208 with value: -4.412562400107615.
[I 2026-07-14 20:28:28,990] Trial 219 finished with value: -4.222865302174004 and parameters: {'scalers': 'robust', 'ratios': 'log_ratio', 'imputers': 'median', 'n_estimators': 2650, 'learning_rate': 0.4922919121674478, 'max_depth': 9, 'min_child_weight': 1, 'subsample': 0.8, 'colsample_bytree': 0.8, 'colsample_bylevel': 0.9, 'reg_alpha': 5.301882789018698e-05, 'reg_lambda': 81.01534053323834, 'gamma': 2.4648832464813078e-05}. Best is trial 208 with value: -4.412562400107615.
[I 2026-07-14 20:29:28,324] Trial 220 finished with value: -4.406096806848287 and parameters: {'scalers': 'robust', 'ratios': 'log_ratio', 'imputers': 'median', 'n_estimators': 2650, 'learning_rate': 0.49790098284943085, 'max_depth': 9, 'min_child_weight': 1, 'subsample': 0.8, 'colsample_bytree': 0.8, 'colsample_bylevel': 0.9, 'reg_alpha': 0.00014665381144516798, 'reg_lambda': 96.6622139936802, 'gamma': 2.442847818294632e-05}. Best is trial 208 with value: -4.412562400107615.
[I 2026-07-14 20:30:25,745] Trial 221 finished with value: -4.358053481138546 and parameters: {'scalers': 'robust', 'ratios': 'log_ratio', 'imputers': 'median', 'n_estimators': 2650, 'learning_rate': 0.4984061957090194, 'max_depth': 9, 'min_child_weight': 1, 'subsample': 0.8, 'colsample_bytree': 0.8, 'colsample_bylevel': 0.9, 'reg_alpha': 0.00014977276754068273, 'reg_lambda': 95.27149620581423, 'gamma': 2.143268498815186e-05}. Best is trial 208 with value: -4.412562400107615.
[I 2026-07-14 20:31:28,861] Trial 222 finished with value: -4.232358975568367 and parameters: {'scalers': 'robust', 'ratios': 'log_ratio', 'imputers': 'median', 'n_estimators': 2650, 'learning_rate': 0.48881328043746725, 'max_depth': 9, 'min_child_weight': 1, 'subsample': 0.8, 'colsample_bytree': 0.8, 'colsample_bylevel': 0.9, 'reg_alpha': 4.96354773253613e-05, 'reg_lambda': 95.68174692921153, 'gamma': 2.4096197414574103e-05}. Best is trial 208 with value: -4.412562400107615.
[I 2026-07-14 20:32:26,601] Trial 223 finished with value: -4.256025344107117 and parameters: {'scalers': 'robust', 'ratios': 'log_ratio', 'imputers': 'median', 'n_estimators': 2650, 'learning_rate': 0.4959903689923617, 'max_depth': 9, 'min_child_weight': 1, 'subsample': 0.8, 'colsample_bytree': 0.8, 'colsample_bylevel': 0.9, 'reg_alpha': 0.00038540761468063944, 'reg_lambda': 97.02493329904627, 'gamma': 2.1706774357640572e-05}. Best is trial 208 with value: -4.412562400107615.
[I 2026-07-14 20:33:23,100] Trial 224 finished with value: -4.3085410122576455 and parameters: {'scalers': 'robust', 'ratios': 'log_ratio', 'imputers': 'median', 'n_estimators': 2650, 'learning_rate': 0.49560025406166275, 'max_depth': 9, 'min_child_weight': 1, 'subsample': 0.8, 'colsample_bytree': 0.8, 'colsample_bylevel': 0.9, 'reg_alpha': 0.00017115388013696657, 'reg_lambda': 98.93395851133377, 'gamma': 2.116981823618439e-05}. Best is trial 208 with value: -4.412562400107615.
