[I 2026-07-14 20:14:07,122] Trial 90 finished with value: -0.17709937065768933 and parameters: {'scalers': 'standard', 'ratios': 'norm_ratio', 'imputers': 'mean', 'n_estimators': 2850, 'learning_rate': 0.1302260375463377, 'max_depth': 10, 'min_child_weight': 4, 'subsample': 0.5, 'colsample_bytree': 1.0, 'colsample_bylevel': 0.6, 'reg_alpha': 0.22885172443691865, 'reg_lambda': 6.42772360548257, 'gamma': 0.008347847048720158}. Best is trial 38 with value: -0.2106275776719057.
[I 2026-07-14 20:14:28,487] Trial 91 finished with value: -0.18495063636490489 and parameters: {'scalers': 'standard', 'ratios': 'norm_ratio', 'imputers': 'mean', 'n_estimators': 2850, 'learning_rate': 0.1390383212034255, 'max_depth': 11, 'min_child_weight': 4, 'subsample': 0.5, 'colsample_bytree': 1.0, 'colsample_bylevel': 0.6, 'reg_alpha': 0.24442312574108285, 'reg_lambda': 5.822562792108904, 'gamma': 0.006591689094189062}. Best is trial 38 with value: -0.2106275776719057.
[I 2026-07-14 20:14:47,142] Trial 92 finished with value: -0.05574806442055136 and parameters: {'scalers': 'standard', 'ratios': 'norm_ratio', 'imputers': 'mean', 'n_estimators': 2400, 'learning_rate': 0.00019419444933715314, 'max_depth': 11, 'min_child_weight': 4, 'subsample': 0.5, 'colsample_bytree': 1.0, 'colsample_bylevel': 0.6, 'reg_alpha': 0.2218562595949117, 'reg_lambda': 6.79697385517272, 'gamma': 0.0042130625290374354}. Best is trial 38 with value: -0.2106275776719057.
[I 2026-07-14 20:14:51,500] Trial 93 finished with value: -0.12589306906942846 and parameters: {'scalers': 'standard', 'ratios': 'norm_ratio', 'imputers': 'mean', 'n_estimators': 1300, 'learning_rate': 0.12184815218725226, 'max_depth': 11, 'min_child_weight': 4, 'subsample': 0.5, 'colsample_bytree': 0.5, 'colsample_bylevel': 0.6, 'reg_alpha': 0.3935298226581896, 'reg_lambda': 1.8677749425666473e-06, 'gamma': 0.05834651490886929}. Best is trial 38 with value: -0.2106275776719057.
[I 2026-07-14 20:14:58,459] Trial 94 finished with value: -0.1514658793202408 and parameters: {'scalers': 'standard', 'ratios': 'norm_ratio', 'imputers': 'mean', 'n_estimators': 2400, 'learning_rate': 0.12877925226454576, 'max_depth': 11, 'min_child_weight': 4, 'subsample': 0.5, 'colsample_bytree': 0.5, 'colsample_bylevel': 0.5, 'reg_alpha': 0.5667465004705705, 'reg_lambda': 7.753293230172111, 'gamma': 0.03721899346169535}. Best is trial 38 with value: -0.2106275776719057.
[I 2026-07-14 20:15:04,297] Trial 95 finished with value: -0.1329327788259097 and parameters: {'scalers': 'standard', 'ratios': 'norm_ratio', 'imputers': 'mean', 'n_estimators': 2900, 'learning_rate': 0.12269656502965273, 'max_depth': 11, 'min_child_weight': 3, 'subsample': 0.5, 'colsample_bytree': 0.5, 'colsample_bylevel': 0.5, 'reg_alpha': 1.54027319705946, 'reg_lambda': 5.114151444526209, 'gamma': 0.03817471558302804}. Best is trial 38 with value: -0.2106275776719057.
[I 2026-07-14 20:15:15,665] Trial 96 finished with value: -0.05560996777962538 and parameters: {'scalers': 'standard', 'ratios': 'norm_ratio', 'imputers': 'mean', 'n_estimators': 2850, 'learning_rate': 0.00023663221122205392, 'max_depth': 11, 'min_child_weight': 3, 'subsample': 0.5, 'colsample_bytree': 0.5, 'colsample_bylevel': 0.5, 'reg_alpha': 0.29541991095464104, 'reg_lambda': 9.53804355806639, 'gamma': 0.034599970341154286}. Best is trial 38 with value: -0.2106275776719057.
[I 2026-07-14 20:15:23,043] Trial 97 finished with value: -0.1726113271214048 and parameters: {'scalers': 'standard', 'ratios': 'norm_ratio', 'imputers': 'median', 'n_estimators': 2450, 'learning_rate': 0.14898148684758064, 'max_depth': 11, 'min_child_weight': 3, 'subsample': 0.5, 'colsample_bytree': 0.5, 'colsample_bylevel': 0.5, 'reg_alpha': 0.8577110648456833, 'reg_lambda': 9.594240454186693e-06, 'gamma': 0.03986739670430763}. Best is trial 38 with value: -0.2106275776719057.
[I 2026-07-14 20:15:32,023] Trial 98 finished with value: -0.25371464537845323 and parameters: {'scalers': 'standard', 'ratios': 'norm_ratio', 'imputers': 'mean', 'n_estimators': 2400, 'learning_rate': 0.3200346394419315, 'max_depth': 11, 'min_child_weight': 3, 'subsample': 0.5, 'colsample_bytree': 0.5, 'colsample_bylevel': 0.5, 'reg_alpha': 1.0331561682614527, 'reg_lambda': 8.22894956935213e-06, 'gamma': 0.028665896770837883}. Best is trial 98 with value: -0.25371464537845323.
[I 2026-07-14 20:15:39,570] Trial 99 finished with value: -0.2421059979410058 and parameters: {'scalers': 'standard', 'ratios': 'norm_ratio', 'imputers': 'mean', 'n_estimators': 2400, 'learning_rate': 0.31328125906331655, 'max_depth': 11, 'min_child_weight': 3, 'subsample': 0.5, 'colsample_bytree': 0.5, 'colsample_bylevel': 0.5, 'reg_alpha': 1.0514796867621337, 'reg_lambda': 1.5540826529899705e-05, 'gamma': 0.04141068906690242}. Best is trial 98 with value: -0.25371464537845323.
[I 2026-07-14 20:15:55,362] Trial 100 finished with value: -0.2838958236892225 and parameters: {'scalers': 'standard', 'ratios': 'norm_ratio', 'imputers': 'mean', 'n_estimators': 2600, 'learning_rate': 0.30557379636643456, 'max_depth': 11, 'min_child_weight': 3, 'subsample': 0.5, 'colsample_bytree': 0.5, 'colsample_bylevel': 0.5, 'reg_alpha': 0.6179309126206144, 'reg_lambda': 1.1037986055841182e-05, 'gamma': 0.012179275761670352}. Best is trial 100 with value: -0.2838958236892225.
[I 2026-07-14 20:16:03,468] Trial 101 finished with value: -0.24387198978317726 and parameters: {'scalers': 'standard', 'ratios': 'norm_ratio', 'imputers': 'median', 'n_estimators': 2550, 'learning_rate': 0.3170190995694614, 'max_depth': 11, 'min_child_weight': 3, 'subsample': 0.5, 'colsample_bytree': 0.5, 'colsample_bylevel': 0.5, 'reg_alpha': 1.4166736291146464, 'reg_lambda': 4.68303466142473e-06, 'gamma': 0.027187478268560984}. Best is trial 100 with value: -0.2838958236892225.
[I 2026-07-14 20:16:18,251] Trial 102 finished with value: -0.25766400426754693 and parameters: {'scalers': 'standard', 'ratios': 'norm_ratio', 'imputers': 'median', 'n_estimators': 2600, 'learning_rate': 0.3120122463879275, 'max_depth': 11, 'min_child_weight': 3, 'subsample': 0.5, 'colsample_bytree': 0.5, 'colsample_bylevel': 0.5, 'reg_alpha': 0.06717190756782072, 'reg_lambda': 1.1155249188472398e-05, 'gamma': 0.011502693567762198}. Best is trial 100 with value: -0.2838958236892225.
[I 2026-07-14 20:16:37,843] Trial 103 finished with value: -0.22078133831784236 and parameters: {'scalers': 'standard', 'ratios': 'norm_ratio', 'imputers': 'median', 'n_estimators': 2550, 'learning_rate': 0.3158071284226771, 'max_depth': 11, 'min_child_weight': 3, 'subsample': 0.6, 'colsample_bytree': 0.9, 'colsample_bylevel': 0.6, 'reg_alpha': 0.051874430311727664, 'reg_lambda': 1.3833834815852497e-05, 'gamma': 0.011899215666805645}. Best is trial 100 with value: -0.2838958236892225.
[I 2026-07-14 20:17:00,839] Trial 104 finished with value: -0.19968582118040537 and parameters: {'scalers': 'standard', 'ratios': 'norm_ratio', 'imputers': 'median', 'n_estimators': 2650, 'learning_rate': 0.2935215939442984, 'max_depth': 12, 'min_child_weight': 5, 'subsample': 0.6, 'colsample_bytree': 0.9, 'colsample_bylevel': 0.6, 'reg_alpha': 4.465511417598666e-05, 'reg_lambda': 8.480761855593215e-06, 'gamma': 0.0005092042344156032}. Best is trial 100 with value: -0.2838958236892225.
[I 2026-07-14 20:17:06,369] Trial 105 finished with value: -0.15259970047643714 and parameters: {'scalers': 'standard', 'ratios': 'norm_ratio', 'imputers': 'mean', 'n_estimators': 650, 'learning_rate': 0.3029707273935308, 'max_depth': 12, 'min_child_weight': 5, 'subsample': 0.6, 'colsample_bytree': 0.9, 'colsample_bylevel': 0.6, 'reg_alpha': 0.04833023549291238, 'reg_lambda': 1.1406805838956803e-06, 'gamma': 0.01226691235237563}. Best is trial 100 with value: -0.2838958236892225.
[I 2026-07-14 20:17:07,890] Trial 106 finished with value: -0.05535731684138883 and parameters: {'scalers': 'standard', 'ratios': 'norm_ratio', 'imputers': 'mean', 'n_estimators': 2600, 'learning_rate': 0.31536217282621515, 'max_depth': 12, 'min_child_weight': 2, 'subsample': 0.6, 'colsample_bytree': 0.5, 'colsample_bylevel': 0.5, 'reg_alpha': 9.443606894898844, 'reg_lambda': 4.535980222830456e-06, 'gamma': 0.29977522124674844}. Best is trial 100 with value: -0.2838958236892225.
[I 2026-07-14 20:17:10,336] Trial 107 finished with value: -0.055263966132967066 and parameters: {'scalers': 'standard', 'ratios': 'norm_ratio', 'imputers': 'mean', 'n_estimators': 2550, 'learning_rate': 0.31031059012562556, 'max_depth': 12, 'min_child_weight': 1, 'subsample': 0.6, 'colsample_bytree': 0.5, 'colsample_bylevel': 0.5, 'reg_alpha': 4.887248741272203, 'reg_lambda': 1.6341775512148925e-05, 'gamma': 0.25107099753263057}. Best is trial 100 with value: -0.2838958236892225.
[I 2026-07-14 20:17:13,718] Trial 108 finished with value: -0.09601526937006807 and parameters: {'scalers': 'standard', 'ratios': 'norm_ratio', 'imputers': 'mean', 'n_estimators': 2600, 'learning_rate': 0.30439166503040116, 'max_depth': 12, 'min_child_weight': 2, 'subsample': 0.6, 'colsample_bytree': 0.5, 'colsample_bylevel': 0.5, 'reg_alpha': 8.570607559704182, 'reg_lambda': 6.015226987779874e-06, 'gamma': 0.002633620598239216}. Best is trial 100 with value: -0.2838958236892225.
[I 2026-07-14 20:17:15,821] Trial 109 finished with value: -0.05775035938490016 and parameters: {'scalers': 'standard', 'ratios': 'norm_ratio', 'imputers': 'median', 'n_estimators': 2550, 'learning_rate': 0.3111836780201539, 'max_depth': 12, 'min_child_weight': 2, 'subsample': 0.5, 'colsample_bytree': 0.5, 'colsample_bylevel': 0.5, 'reg_alpha': 9.671845079835922, 'reg_lambda': 3.858978271543775e-06, 'gamma': 0.02050158583753918}. Best is trial 100 with value: -0.2838958236892225.
[I 2026-07-14 20:17:18,086] Trial 110 finished with value: -0.055363402909906614 and parameters: {'scalers': 'standard', 'ratios': 'norm_ratio', 'imputers': 'median', 'n_estimators': 2550, 'learning_rate': 0.3220300175089583, 'max_depth': 12, 'min_child_weight': 2, 'subsample': 0.5, 'colsample_bytree': 0.5, 'colsample_bylevel': 0.5, 'reg_alpha': 5.4746981114225814, 'reg_lambda': 6.260860260129498e-06, 'gamma': 0.26413701860112376}. Best is trial 100 with value: -0.2838958236892225.
[I 2026-07-14 20:17:20,424] Trial 111 finished with value: -0.058785334581144655 and parameters: {'scalers': 'standard', 'ratios': 'norm_ratio', 'imputers': 'median', 'n_estimators': 2600, 'learning_rate': 0.2924395427760128, 'max_depth': 12, 'min_child_weight': 2, 'subsample': 0.5, 'colsample_bytree': 0.5, 'colsample_bylevel': 0.5, 'reg_alpha': 9.246005946213028, 'reg_lambda': 4.638322488071634e-06, 'gamma': 0.019478089948471194}. Best is trial 100 with value: -0.2838958236892225.
[I 2026-07-14 20:17:22,706] Trial 112 finished with value: -0.05579131097229661 and parameters: {'scalers': 'standard', 'ratios': 'norm_ratio', 'imputers': 'median', 'n_estimators': 2550, 'learning_rate': 0.3002818202297231, 'max_depth': 12, 'min_child_weight': 2, 'subsample': 0.5, 'colsample_bytree': 0.5, 'colsample_bylevel': 0.5, 'reg_alpha': 3.088985934360715, 'reg_lambda': 4.482309974702435e-06, 'gamma': 0.1968911004696454}. Best is trial 100 with value: -0.2838958236892225.
[I 2026-07-14 20:17:24,968] Trial 113 finished with value: -0.05534536482945355 and parameters: {'scalers': 'standard', 'ratios': 'norm_ratio', 'imputers': 'median', 'n_estimators': 2550, 'learning_rate': 0.30671100374453336, 'max_depth': 12, 'min_child_weight': 2, 'subsample': 0.5, 'colsample_bytree': 0.5, 'colsample_bylevel': 0.5, 'reg_alpha': 13.69781132120437, 'reg_lambda': 4.966148674008167e-06, 'gamma': 0.2268570705688018}. Best is trial 100 with value: -0.2838958236892225.
[I 2026-07-14 20:17:27,246] Trial 114 finished with value: -0.0555610060915349 and parameters: {'scalers': 'standard', 'ratios': 'norm_ratio', 'imputers': 'median', 'n_estimators': 2550, 'learning_rate': 0.175500162034257, 'max_depth': 12, 'min_child_weight': 2, 'subsample': 0.5, 'colsample_bytree': 0.5, 'colsample_bylevel': 0.5, 'reg_alpha': 3.1486377703025523, 'reg_lambda': 1.5887059797110086e-05, 'gamma': 0.14487389414769258}. Best is trial 100 with value: -0.2838958236892225.
[I 2026-07-14 20:17:29,918] Trial 115 finished with value: -0.05513377571868355 and parameters: {'scalers': 'standard', 'ratios': 'norm_ratio', 'imputers': 'median', 'n_estimators': 2550, 'learning_rate': 0.004622443944868409, 'max_depth': 11, 'min_child_weight': 2, 'subsample': 0.5, 'colsample_bytree': 0.5, 'colsample_bylevel': 0.5, 'reg_alpha': 1.598833248933807, 'reg_lambda': 1.639787940930161e-05, 'gamma': 0.10996118858023361}. Best is trial 100 with value: -0.2838958236892225.
[I 2026-07-14 20:17:37,592] Trial 116 finished with value: -0.1799566619650204 and parameters: {'scalers': 'standard', 'ratios': 'norm_ratio', 'imputers': 'median', 'n_estimators': 2950, 'learning_rate': 0.17674260884470516, 'max_depth': 11, 'min_child_weight': 3, 'subsample': 0.5, 'colsample_bytree': 0.5, 'colsample_bylevel': 0.5, 'reg_alpha': 1.9055751570439248, 'reg_lambda': 1.417162747386935e-05, 'gamma': 0.018776736933891394}. Best is trial 100 with value: -0.2838958236892225.
[I 2026-07-14 20:17:40,252] Trial 117 finished with value: -0.06315725752402443 and parameters: {'scalers': 'none', 'ratios': 'norm_ratio', 'imputers': 'median', 'n_estimators': 2750, 'learning_rate': 0.17926574404286322, 'max_depth': 11, 'min_child_weight': 3, 'subsample': 0.5, 'colsample_bytree': 0.5, 'colsample_bylevel': 0.5, 'reg_alpha': 1.909568456706517, 'reg_lambda': 1.4642242654561817e-05, 'gamma': 0.11823913464337385}. Best is trial 100 with value: -0.2838958236892225.
[I 2026-07-14 20:17:42,984] Trial 118 finished with value: -0.0933096237703108 and parameters: {'scalers': 'standard', 'ratios': 'norm_ratio', 'imputers': 'median', 'n_estimators': 2750, 'learning_rate': 0.4296795616638427, 'max_depth': 11, 'min_child_weight': 3, 'subsample': 0.5, 'colsample_bytree': 0.5, 'colsample_bylevel': 0.5, 'reg_alpha': 1.9839061260843531, 'reg_lambda': 1.2388557989268932e-05, 'gamma': 0.11128998400291007}. Best is trial 100 with value: -0.2838958236892225.
[I 2026-07-14 20:17:46,172] Trial 119 finished with value: -0.075981814643688 and parameters: {'scalers': 'standard', 'ratios': 'norm_ratio', 'imputers': 'median', 'n_estimators': 3000, 'learning_rate': 0.1654929933721528, 'max_depth': 11, 'min_child_weight': 3, 'subsample': 0.5, 'colsample_bytree': 0.5, 'colsample_bylevel': 0.5, 'reg_alpha': 1.7057373700936271, 'reg_lambda': 1.8710260233108373e-05, 'gamma': 0.09416793668134198}. Best is trial 100 with value: -0.2838958236892225.
[I 2026-07-14 20:17:49,719] Trial 120 finished with value: -0.09619892197185916 and parameters: {'scalers': 'standard', 'ratios': 'norm_ratio', 'imputers': 'median', 'n_estimators': 2750, 'learning_rate': 0.16612848547346884, 'max_depth': 11, 'min_child_weight': 3, 'subsample': 0.5, 'colsample_bytree': 0.5, 'colsample_bylevel': 0.5, 'reg_alpha': 1.0993470714318931, 'reg_lambda': 1.5082895944119078e-05, 'gamma': 0.09437395842529687}. Best is trial 100 with value: -0.2838958236892225.
[I 2026-07-14 20:18:00,391] Trial 121 finished with value: -0.2089158126591801 and parameters: {'scalers': 'none', 'ratios': 'norm_ratio', 'imputers': 'median', 'n_estimators': 2650, 'learning_rate': 0.16468966995315384, 'max_depth': 11, 'min_child_weight': 3, 'subsample': 0.5, 'colsample_bytree': 0.5, 'colsample_bylevel': 0.5, 'reg_alpha': 1.494356681492456, 'reg_lambda': 1.3082057208146578e-05, 'gamma': 0.0005689897223959548}. Best is trial 100 with value: -0.2838958236892225.
[I 2026-07-14 20:18:04,513] Trial 122 finished with value: -0.1360012749816197 and parameters: {'scalers': 'standard', 'ratios': 'norm_ratio', 'imputers': 'median', 'n_estimators': 2750, 'learning_rate': 0.2396468261235341, 'max_depth': 11, 'min_child_weight': 3, 'subsample': 0.5, 'colsample_bytree': 0.5, 'colsample_bylevel': 0.5, 'reg_alpha': 1.1914306841742377, 'reg_lambda': 9.283519703300654e-06, 'gamma': 0.08278170489664632}. Best is trial 100 with value: -0.2838958236892225.
[I 2026-07-14 20:18:14,297] Trial 123 finished with value: -0.3039598555297411 and parameters: {'scalers': 'standard', 'ratios': 'norm_ratio', 'imputers': 'median', 'n_estimators': 2050, 'learning_rate': 0.4074558126685076, 'max_depth': 11, 'min_child_weight': 3, 'subsample': 0.5, 'colsample_bytree': 0.5, 'colsample_bylevel': 0.5, 'reg_alpha': 1.0654693071639387, 'reg_lambda': 8.45911057048962e-06, 'gamma': 0.013386046932007326}. Best is trial 123 with value: -0.3039598555297411.
[I 2026-07-14 20:18:30,905] Trial 124 finished with value: -0.25883123976760153 and parameters: {'scalers': 'none', 'ratios': 'norm_ratio', 'imputers': 'median', 'n_estimators': 2650, 'learning_rate': 0.22954674705077258, 'max_depth': 11, 'min_child_weight': 3, 'subsample': 0.5, 'colsample_bytree': 0.5, 'colsample_bylevel': 0.5, 'reg_alpha': 0.7845988563676466, 'reg_lambda': 8.56406739505695e-06, 'gamma': 0.0005263009130251278}. Best is trial 123 with value: -0.3039598555297411.
[I 2026-07-14 20:18:41,972] Trial 125 finished with value: -0.2224518369306801 and parameters: {'scalers': 'standard', 'ratios': 'norm_ratio', 'imputers': 'median', 'n_estimators': 2100, 'learning_rate': 0.23985467192707846, 'max_depth': 11, 'min_child_weight': 3, 'subsample': 0.5, 'colsample_bytree': 0.5, 'colsample_bylevel': 0.5, 'reg_alpha': 0.041218822005042184, 'reg_lambda': 8.297318478059018e-06, 'gamma': 0.026290086562600175}. Best is trial 123 with value: -0.3039598555297411.
[I 2026-07-14 20:18:54,477] Trial 126 finished with value: -0.2532623352646568 and parameters: {'scalers': 'standard', 'ratios': 'norm_ratio', 'imputers': 'median', 'n_estimators': 2100, 'learning_rate': 0.2533970605143287, 'max_depth': 11, 'min_child_weight': 3, 'subsample': 0.5, 'colsample_bytree': 0.5, 'colsample_bylevel': 0.5, 'reg_alpha': 0.8662986476984895, 'reg_lambda': 2.4044407699458987e-05, 'gamma': 0.00048534206450092033}. Best is trial 123 with value: -0.3039598555297411.
[I 2026-07-14 20:19:09,278] Trial 127 finished with value: -0.25782429122085593 and parameters: {'scalers': 'standard', 'ratios': 'norm_ratio', 'imputers': 'median', 'n_estimators': 2650, 'learning_rate': 0.24208253209288788, 'max_depth': 11, 'min_child_weight': 3, 'subsample': 0.5, 'colsample_bytree': 0.5, 'colsample_bylevel': 0.6, 'reg_alpha': 0.9733014196070536, 'reg_lambda': 8.779412976717471e-06, 'gamma': 0.0004916205765671687}. Best is trial 123 with value: -0.3039598555297411.
[I 2026-07-14 20:19:19,082] Trial 128 finished with value: -0.1691038159166147 and parameters: {'scalers': 'standard', 'ratios': 'norm_ratio', 'imputers': 'median', 'n_estimators': 2050, 'learning_rate': 0.23823850597183444, 'max_depth': 11, 'min_child_weight': 6, 'subsample': 0.5, 'colsample_bytree': 0.5, 'colsample_bylevel': 0.6, 'reg_alpha': 0.6550544210930324, 'reg_lambda': 2.5107772828564573e-05, 'gamma': 0.00868785724015384}. Best is trial 123 with value: -0.3039598555297411.
[I 2026-07-14 20:19:36,086] Trial 129 finished with value: -0.26244224583860015 and parameters: {'scalers': 'none', 'ratios': 'norm_ratio', 'imputers': 'median', 'n_estimators': 2650, 'learning_rate': 0.2445847442249609, 'max_depth': 11, 'min_child_weight': 3, 'subsample': 0.5, 'colsample_bytree': 0.5, 'colsample_bylevel': 0.5, 'reg_alpha': 0.5552453444494264, 'reg_lambda': 8.939865392617825e-06, 'gamma': 0.00041117272656580325}. Best is trial 123 with value: -0.3039598555297411.
[I 2026-07-14 20:19:54,512] Trial 130 finished with value: -0.3248176519434903 and parameters: {'scalers': 'none', 'ratios': 'norm_ratio', 'imputers': 'median', 'n_estimators': 2650, 'learning_rate': 0.423513426763127, 'max_depth': 11, 'min_child_weight': 3, 'subsample': 0.5, 'colsample_bytree': 0.5, 'colsample_bylevel': 0.5, 'reg_alpha': 0.668946632645496, 'reg_lambda': 2.699217976189745e-05, 'gamma': 0.00043051771141806936}. Best is trial 130 with value: -0.3248176519434903.
[I 2026-07-14 20:20:07,447] Trial 131 finished with value: -0.3123709936027095 and parameters: {'scalers': 'none', 'ratios': 'norm_ratio', 'imputers': 'median', 'n_estimators': 2050, 'learning_rate': 0.4251784714785844, 'max_depth': 11, 'min_child_weight': 3, 'subsample': 0.5, 'colsample_bytree': 0.5, 'colsample_bylevel': 0.5, 'reg_alpha': 0.6753960255849752, 'reg_lambda': 2.5843308753350154e-05, 'gamma': 0.013701372036200674}. Best is trial 130 with value: -0.3248176519434903.
[I 2026-07-14 20:20:23,942] Trial 132 finished with value: -0.3105144471402459 and parameters: {'scalers': 'none', 'ratios': 'norm_ratio', 'imputers': 'median', 'n_estimators': 2450, 'learning_rate': 0.38465734593621104, 'max_depth': 11, 'min_child_weight': 3, 'subsample': 0.5, 'colsample_bytree': 0.5, 'colsample_bylevel': 0.5, 'reg_alpha': 0.6949783878915636, 'reg_lambda': 3.582049844642126e-05, 'gamma': 0.0017217276459252325}. Best is trial 130 with value: -0.3248176519434903.
[I 2026-07-14 20:20:34,846] Trial 133 finished with value: -0.24042356961626452 and parameters: {'scalers': 'none', 'ratios': 'norm_ratio', 'imputers': 'median', 'n_estimators': 2350, 'learning_rate': 0.24649359438827612, 'max_depth': 11, 'min_child_weight': 3, 'subsample': 0.5, 'colsample_bytree': 0.5, 'colsample_bylevel': 0.5, 'reg_alpha': 0.6748572790058887, 'reg_lambda': 2.6368994280789367e-05, 'gamma': 0.025013339226685496}. Best is trial 130 with value: -0.3248176519434903.
[I 2026-07-14 20:20:40,846] Trial 134 finished with value: -0.1971787078353384 and parameters: {'scalers': 'none', 'ratios': 'norm_ratio', 'imputers': 'median', 'n_estimators': 2000, 'learning_rate': 0.2425950508735458, 'max_depth': 11, 'min_child_weight': 3, 'subsample': 0.5, 'colsample_bytree': 0.5, 'colsample_bylevel': 0.5, 'reg_alpha': 0.6732634452212827, 'reg_lambda': 3.475614612837949e-05, 'gamma': 0.0578371539652946}. Best is trial 130 with value: -0.3248176519434903.
