[I 2026-07-14 19:16:48,953] Trial 135 finished with value: -2.3271239222525213 and parameters: {'scalers': 'standard', 'ratios': 'log_ratio', 'imputers': 'mean', 'n_estimators': 2600, 'learning_rate': 0.4502389939108585, 'max_depth': 8, 'min_child_weight': 1, 'subsample': 0.9, 'colsample_bytree': 1.0, 'colsample_bylevel': 0.7, 'reg_alpha': 3.6697552087067e-06, 'reg_lambda': 70.33575688859695, 'gamma': 0.016914760427866563}. Best is trial 80 with value: -2.913757112215665.
[I 2026-07-14 19:17:00,370] Trial 136 finished with value: -2.012493170940113 and parameters: {'scalers': 'standard', 'ratios': 'log_ratio', 'imputers': 'mean', 'n_estimators': 550, 'learning_rate': 0.24656574744302995, 'max_depth': 8, 'min_child_weight': 1, 'subsample': 0.9, 'colsample_bytree': 1.0, 'colsample_bylevel': 0.7, 'reg_alpha': 2.9373544966220247e-06, 'reg_lambda': 69.103994723827, 'gamma': 3.7702618752750614e-05}. Best is trial 80 with value: -2.913757112215665.
[I 2026-07-14 19:17:05,590] Trial 137 finished with value: -1.8280943846707265 and parameters: {'scalers': 'standard', 'ratios': 'log_ratio', 'imputers': 'mean', 'n_estimators': 350, 'learning_rate': 0.2391711002699341, 'max_depth': 8, 'min_child_weight': 1, 'subsample': 0.9, 'colsample_bytree': 1.0, 'colsample_bylevel': 0.7, 'reg_alpha': 3.2841367267567495e-06, 'reg_lambda': 64.638485260102, 'gamma': 3.240797416825958e-05}. Best is trial 80 with value: -2.913757112215665.
[I 2026-07-14 19:17:57,235] Trial 138 finished with value: -1.7427333740277178 and parameters: {'scalers': 'standard', 'ratios': 'log_ratio', 'imputers': 'mean', 'n_estimators': 2600, 'learning_rate': 0.2367449557808028, 'max_depth': 8, 'min_child_weight': 1, 'subsample': 0.9, 'colsample_bytree': 1.0, 'colsample_bylevel': 0.8, 'reg_alpha': 3.4208664594366672e-06, 'reg_lambda': 71.38631957440175, 'gamma': 0.03498200745293487}. Best is trial 80 with value: -2.913757112215665.
[I 2026-07-14 19:18:50,586] Trial 139 finished with value: -2.6017497689544546 and parameters: {'scalers': 'standard', 'ratios': 'log_ratio', 'imputers': 'mean', 'n_estimators': 2600, 'learning_rate': 0.24426190364642197, 'max_depth': 8, 'min_child_weight': 1, 'subsample': 0.9, 'colsample_bytree': 1.0, 'colsample_bylevel': 0.8, 'reg_alpha': 1.597554751177516e-05, 'reg_lambda': 16.709839883599876, 'gamma': 0.010128898943557983}. Best is trial 80 with value: -2.913757112215665.
[I 2026-07-14 19:19:01,247] Trial 140 finished with value: -1.9609945684754895 and parameters: {'scalers': 'standard', 'ratios': 'log_ratio', 'imputers': 'mean', 'n_estimators': 500, 'learning_rate': 0.2499456706100638, 'max_depth': 8, 'min_child_weight': 1, 'subsample': 0.9, 'colsample_bytree': 1.0, 'colsample_bylevel': 0.8, 'reg_alpha': 1.577515329994494e-05, 'reg_lambda': 16.848393743382974, 'gamma': 0.0053659403307895264}. Best is trial 80 with value: -2.913757112215665.
[I 2026-07-14 19:20:06,567] Trial 141 finished with value: -2.897792296881196 and parameters: {'scalers': 'standard', 'ratios': 'log_ratio', 'imputers': 'mean', 'n_estimators': 2800, 'learning_rate': 0.30762215406470267, 'max_depth': 8, 'min_child_weight': 1, 'subsample': 0.9, 'colsample_bytree': 1.0, 'colsample_bylevel': 0.8, 'reg_alpha': 1.7180558984152665e-05, 'reg_lambda': 68.00608097489567, 'gamma': 3.190146964574912e-05}. Best is trial 80 with value: -2.913757112215665.
[I 2026-07-14 19:20:54,288] Trial 142 finished with value: -2.6372768919332623 and parameters: {'scalers': 'standard', 'ratios': 'log_ratio', 'imputers': 'mean', 'n_estimators': 2500, 'learning_rate': 0.25384806121361875, 'max_depth': 8, 'min_child_weight': 1, 'subsample': 0.9, 'colsample_bytree': 0.8, 'colsample_bylevel': 0.8, 'reg_alpha': 1.7742862320531987e-05, 'reg_lambda': 36.727144026044385, 'gamma': 0.0048374240049108095}. Best is trial 80 with value: -2.913757112215665.
[I 2026-07-14 19:21:28,405] Trial 143 finished with value: -1.6858163742250378 and parameters: {'scalers': 'robust', 'ratios': 'log_ratio', 'imputers': 'mean', 'n_estimators': 2500, 'learning_rate': 0.24625076933038656, 'max_depth': 8, 'min_child_weight': 1, 'subsample': 0.9, 'colsample_bytree': 0.8, 'colsample_bylevel': 0.8, 'reg_alpha': 1.7322595059514475e-05, 'reg_lambda': 34.54448888714796, 'gamma': 0.0790580174392103}. Best is trial 80 with value: -2.913757112215665.
[I 2026-07-14 19:22:10,345] Trial 144 finished with value: -1.9247126607322678 and parameters: {'scalers': 'robust', 'ratios': 'log_ratio', 'imputers': 'mean', 'n_estimators': 2800, 'learning_rate': 0.3055113745469452, 'max_depth': 8, 'min_child_weight': 1, 'subsample': 0.8, 'colsample_bytree': 0.8, 'colsample_bylevel': 0.8, 'reg_alpha': 1.4913118184099566e-05, 'reg_lambda': 32.51856270345266, 'gamma': 0.0652472887881589}. Best is trial 80 with value: -2.913757112215665.
[I 2026-07-14 19:23:06,322] Trial 145 finished with value: -2.9542344661361777 and parameters: {'scalers': 'robust', 'ratios': 'log_ratio', 'imputers': 'mean', 'n_estimators': 3000, 'learning_rate': 0.31037944696752257, 'max_depth': 8, 'min_child_weight': 1, 'subsample': 0.8, 'colsample_bytree': 0.8, 'colsample_bylevel': 0.8, 'reg_alpha': 1.6415470137814043e-05, 'reg_lambda': 33.544007524604226, 'gamma': 0.0033537121395718363}. Best is trial 145 with value: -2.9542344661361777.
[I 2026-07-14 19:23:58,647] Trial 146 finished with value: -2.9326704646326305 and parameters: {'scalers': 'robust', 'ratios': 'log_ratio', 'imputers': 'mean', 'n_estimators': 2800, 'learning_rate': 0.30817774032462775, 'max_depth': 8, 'min_child_weight': 1, 'subsample': 0.8, 'colsample_bytree': 0.8, 'colsample_bylevel': 0.8, 'reg_alpha': 6.362671485592472e-06, 'reg_lambda': 33.00387797522138, 'gamma': 0.005342701943414478}. Best is trial 145 with value: -2.9542344661361777.
[I 2026-07-14 19:24:38,797] Trial 147 finished with value: -2.207981581357825 and parameters: {'scalers': 'robust', 'ratios': 'log_ratio', 'imputers': 'mean', 'n_estimators': 2500, 'learning_rate': 0.28797392069027783, 'max_depth': 8, 'min_child_weight': 1, 'subsample': 1.0, 'colsample_bytree': 0.9, 'colsample_bylevel': 0.8, 'reg_alpha': 1.7909947262853397e-05, 'reg_lambda': 12.187898804258964, 'gamma': 0.0038903584464188875}. Best is trial 145 with value: -2.9542344661361777.
[I 2026-07-14 19:25:19,386] Trial 148 finished with value: -1.9109418462428338 and parameters: {'scalers': 'robust', 'ratios': 'log_ratio', 'imputers': 'mean', 'n_estimators': 2500, 'learning_rate': 0.31455207006788494, 'max_depth': 8, 'min_child_weight': 1, 'subsample': 0.9, 'colsample_bytree': 0.9, 'colsample_bylevel': 0.8, 'reg_alpha': 1.761308965351235e-05, 'reg_lambda': 31.47181247239453, 'gamma': 0.06504028094016738}. Best is trial 145 with value: -2.9542344661361777.
[I 2026-07-14 19:26:22,235] Trial 149 finished with value: -2.8337242587980698 and parameters: {'scalers': 'robust', 'ratios': 'log_ratio', 'imputers': 'mean', 'n_estimators': 2800, 'learning_rate': 0.2976126426648168, 'max_depth': 8, 'min_child_weight': 1, 'subsample': 0.9, 'colsample_bytree': 1.0, 'colsample_bylevel': 0.8, 'reg_alpha': 1.9465589044843813e-05, 'reg_lambda': 35.66606949363942, 'gamma': 0.0034272646552649237}. Best is trial 145 with value: -2.9542344661361777.
[I 2026-07-14 19:27:09,613] Trial 150 finished with value: -2.8646873177941985 and parameters: {'scalers': 'robust', 'ratios': 'log_ratio', 'imputers': 'mean', 'n_estimators': 2500, 'learning_rate': 0.30915623203646264, 'max_depth': 8, 'min_child_weight': 1, 'subsample': 0.9, 'colsample_bytree': 0.8, 'colsample_bylevel': 0.8, 'reg_alpha': 1.7557720993079636e-05, 'reg_lambda': 33.17192829260845, 'gamma': 0.0033530579316845372}. Best is trial 145 with value: -2.9542344661361777.
[I 2026-07-14 19:28:03,648] Trial 151 finished with value: -2.868942156277363 and parameters: {'scalers': 'robust', 'ratios': 'log_ratio', 'imputers': 'mean', 'n_estimators': 2800, 'learning_rate': 0.31771143221197823, 'max_depth': 8, 'min_child_weight': 1, 'subsample': 0.9, 'colsample_bytree': 0.8, 'colsample_bylevel': 0.8, 'reg_alpha': 1.8135362055786442e-05, 'reg_lambda': 39.33622391166646, 'gamma': 0.00339915971628035}. Best is trial 145 with value: -2.9542344661361777.
[I 2026-07-14 19:28:52,385] Trial 152 finished with value: -2.4379978798519124 and parameters: {'scalers': 'standard', 'ratios': 'log_ratio', 'imputers': 'mean', 'n_estimators': 2500, 'learning_rate': 0.18982496065410134, 'max_depth': 8, 'min_child_weight': 1, 'subsample': 0.9, 'colsample_bytree': 0.9, 'colsample_bylevel': 0.8, 'reg_alpha': 6.960235530819808e-06, 'reg_lambda': 37.82385507336064, 'gamma': 0.0034017960856108113}. Best is trial 145 with value: -2.9542344661361777.
[I 2026-07-14 19:29:31,177] Trial 153 finished with value: -1.9542475222790883 and parameters: {'scalers': 'robust', 'ratios': 'log_ratio', 'imputers': 'mean', 'n_estimators': 2500, 'learning_rate': 0.1910225944169744, 'max_depth': 8, 'min_child_weight': 1, 'subsample': 1.0, 'colsample_bytree': 0.8, 'colsample_bylevel': 0.8, 'reg_alpha': 6.73649029403777e-06, 'reg_lambda': 37.138190493425135, 'gamma': 0.0035199215952169205}. Best is trial 145 with value: -2.9542344661361777.
[I 2026-07-14 19:30:22,251] Trial 154 finished with value: -2.6055816507907035 and parameters: {'scalers': 'robust', 'ratios': 'log_ratio', 'imputers': 'mean', 'n_estimators': 2800, 'learning_rate': 0.19251640761586586, 'max_depth': 8, 'min_child_weight': 1, 'subsample': 0.8, 'colsample_bytree': 0.8, 'colsample_bylevel': 0.8, 'reg_alpha': 5.967605240948201e-06, 'reg_lambda': 37.26058535210947, 'gamma': 0.00011047115531200567}. Best is trial 145 with value: -2.9542344661361777.
[I 2026-07-14 19:31:06,369] Trial 155 finished with value: -2.5259222587778636 and parameters: {'scalers': 'robust', 'ratios': 'log_ratio', 'imputers': 'mean', 'n_estimators': 2400, 'learning_rate': 0.19829703590175782, 'max_depth': 8, 'min_child_weight': 1, 'subsample': 0.8, 'colsample_bytree': 0.8, 'colsample_bylevel': 0.8, 'reg_alpha': 6.602983633746561e-06, 'reg_lambda': 43.88923318912547, 'gamma': 3.963317115293612e-05}. Best is trial 145 with value: -2.9542344661361777.
[I 2026-07-14 19:31:57,784] Trial 156 finished with value: -2.5609884199898336 and parameters: {'scalers': 'robust', 'ratios': 'log_ratio', 'imputers': 'mean', 'n_estimators': 2800, 'learning_rate': 0.1948352320410622, 'max_depth': 8, 'min_child_weight': 1, 'subsample': 0.8, 'colsample_bytree': 0.8, 'colsample_bylevel': 0.8, 'reg_alpha': 6.861216584881383e-06, 'reg_lambda': 46.624293539066564, 'gamma': 0.0035019660604689346}. Best is trial 145 with value: -2.9542344661361777.
[I 2026-07-14 19:32:41,697] Trial 157 finished with value: -2.525913078843185 and parameters: {'scalers': 'robust', 'ratios': 'log_ratio', 'imputers': 'mean', 'n_estimators': 2400, 'learning_rate': 0.1906809690210927, 'max_depth': 8, 'min_child_weight': 1, 'subsample': 0.8, 'colsample_bytree': 0.8, 'colsample_bylevel': 0.8, 'reg_alpha': 7.666937983590186e-05, 'reg_lambda': 47.28512180479444, 'gamma': 4.3870915903168485e-05}. Best is trial 145 with value: -2.9542344661361777.
[I 2026-07-14 19:33:26,004] Trial 158 finished with value: -2.5075032568123916 and parameters: {'scalers': 'robust', 'ratios': 'log_ratio', 'imputers': 'mean', 'n_estimators': 2400, 'learning_rate': 0.19554666338489923, 'max_depth': 8, 'min_child_weight': 1, 'subsample': 0.8, 'colsample_bytree': 0.8, 'colsample_bylevel': 0.8, 'reg_alpha': 6.840149363703916e-06, 'reg_lambda': 50.35205518417732, 'gamma': 0.0023039711477982035}. Best is trial 145 with value: -2.9542344661361777.
[I 2026-07-14 19:34:17,305] Trial 159 finished with value: -2.540288454971454 and parameters: {'scalers': 'robust', 'ratios': 'log_ratio', 'imputers': 'mean', 'n_estimators': 2800, 'learning_rate': 0.20010672645957422, 'max_depth': 8, 'min_child_weight': 1, 'subsample': 0.8, 'colsample_bytree': 0.8, 'colsample_bylevel': 0.8, 'reg_alpha': 8.459851097338175e-05, 'reg_lambda': 40.82851662977669, 'gamma': 0.0037831437381311422}. Best is trial 145 with value: -2.9542344661361777.
[I 2026-07-14 19:35:01,388] Trial 160 finished with value: -2.5407106229164826 and parameters: {'scalers': 'robust', 'ratios': 'log_ratio', 'imputers': 'mean', 'n_estimators': 2400, 'learning_rate': 0.1922430090822304, 'max_depth': 8, 'min_child_weight': 1, 'subsample': 0.8, 'colsample_bytree': 0.8, 'colsample_bylevel': 0.8, 'reg_alpha': 7.393631755593309e-05, 'reg_lambda': 47.14029625801143, 'gamma': 0.0009629811220165868}. Best is trial 145 with value: -2.9542344661361777.
[I 2026-07-14 19:35:43,730] Trial 161 finished with value: -2.4388631444035354 and parameters: {'scalers': 'robust', 'ratios': 'log_ratio', 'imputers': 'mean', 'n_estimators': 2350, 'learning_rate': 0.16065855926832356, 'max_depth': 8, 'min_child_weight': 1, 'subsample': 0.8, 'colsample_bytree': 0.8, 'colsample_bylevel': 0.8, 'reg_alpha': 6.098822281815356e-05, 'reg_lambda': 53.236249954331484, 'gamma': 0.0010303197378348852}. Best is trial 145 with value: -2.9542344661361777.
[I 2026-07-14 19:36:27,411] Trial 162 finished with value: -2.4261548368741765 and parameters: {'scalers': 'robust', 'ratios': 'log_ratio', 'imputers': 'mean', 'n_estimators': 2400, 'learning_rate': 0.16110203420309316, 'max_depth': 8, 'min_child_weight': 1, 'subsample': 0.8, 'colsample_bytree': 0.8, 'colsample_bylevel': 0.8, 'reg_alpha': 6.295346910914879e-05, 'reg_lambda': 52.281547064667066, 'gamma': 9.018422175267524e-05}. Best is trial 145 with value: -2.9542344661361777.
[I 2026-07-14 19:37:11,144] Trial 163 finished with value: -2.395256676239774 and parameters: {'scalers': 'robust', 'ratios': 'log_ratio', 'imputers': 'mean', 'n_estimators': 2400, 'learning_rate': 0.1607565090804999, 'max_depth': 8, 'min_child_weight': 1, 'subsample': 0.8, 'colsample_bytree': 0.8, 'colsample_bylevel': 0.8, 'reg_alpha': 0.00010368640159714274, 'reg_lambda': 97.04586734118719, 'gamma': 0.00011418063614964928}. Best is trial 145 with value: -2.9542344661361777.
[I 2026-07-14 19:37:54,881] Trial 164 finished with value: -2.3716593984935517 and parameters: {'scalers': 'robust', 'ratios': 'log_ratio', 'imputers': 'mean', 'n_estimators': 2400, 'learning_rate': 0.15890830816124518, 'max_depth': 8, 'min_child_weight': 1, 'subsample': 0.8, 'colsample_bytree': 0.8, 'colsample_bylevel': 0.8, 'reg_alpha': 8.341052917679927e-05, 'reg_lambda': 97.63870226172597, 'gamma': 0.0001288711625159761}. Best is trial 145 with value: -2.9542344661361777.
[I 2026-07-14 19:38:46,295] Trial 165 finished with value: -2.484787994953967 and parameters: {'scalers': 'robust', 'ratios': 'log_ratio', 'imputers': 'mean', 'n_estimators': 2800, 'learning_rate': 0.16367025075177843, 'max_depth': 8, 'min_child_weight': 1, 'subsample': 0.8, 'colsample_bytree': 0.8, 'colsample_bylevel': 0.8, 'reg_alpha': 1.2363958799243197e-05, 'reg_lambda': 98.93979388922568, 'gamma': 8.532092869862494e-05}. Best is trial 145 with value: -2.9542344661361777.
[I 2026-07-14 19:39:31,823] Trial 166 finished with value: -2.4731940838661775 and parameters: {'scalers': 'robust', 'ratios': 'log_ratio', 'imputers': 'mean', 'n_estimators': 2600, 'learning_rate': 0.1644743811957385, 'max_depth': 8, 'min_child_weight': 1, 'subsample': 0.8, 'colsample_bytree': 0.8, 'colsample_bylevel': 0.8, 'reg_alpha': 1.268614111957466e-05, 'reg_lambda': 22.891039110026295, 'gamma': 0.00010521551972671258}. Best is trial 145 with value: -2.9542344661361777.
[I 2026-07-14 19:40:22,841] Trial 167 finished with value: -3.137203893418154 and parameters: {'scalers': 'robust', 'ratios': 'log_ratio', 'imputers': 'mean', 'n_estimators': 2600, 'learning_rate': 0.344118057101515, 'max_depth': 8, 'min_child_weight': 1, 'subsample': 0.8, 'colsample_bytree': 0.8, 'colsample_bylevel': 0.8, 'reg_alpha': 1.3985052322207318e-05, 'reg_lambda': 99.92499103246435, 'gamma': 0.00013003303769056523}. Best is trial 167 with value: -3.137203893418154.
[I 2026-07-14 19:41:10,575] Trial 168 finished with value: -2.444802983992121 and parameters: {'scalers': 'robust', 'ratios': 'log_ratio', 'imputers': 'mean', 'n_estimators': 2600, 'learning_rate': 0.16296697532332113, 'max_depth': 8, 'min_child_weight': 1, 'subsample': 0.8, 'colsample_bytree': 0.8, 'colsample_bylevel': 0.8, 'reg_alpha': 1.2971064540164264e-05, 'reg_lambda': 92.65713766959256, 'gamma': 0.00011472827436255225}. Best is trial 167 with value: -3.137203893418154.
[I 2026-07-14 19:42:01,388] Trial 169 finished with value: -3.10732548216144 and parameters: {'scalers': 'robust', 'ratios': 'log_ratio', 'imputers': 'mean', 'n_estimators': 2600, 'learning_rate': 0.33770498134706795, 'max_depth': 8, 'min_child_weight': 1, 'subsample': 0.8, 'colsample_bytree': 0.8, 'colsample_bylevel': 0.8, 'reg_alpha': 1.8522766808737953e-05, 'reg_lambda': 97.5075040787157, 'gamma': 0.00011211145952575165}. Best is trial 167 with value: -3.137203893418154.
[I 2026-07-14 19:42:56,003] Trial 170 finished with value: -3.1077561631529953 and parameters: {'scalers': 'robust', 'ratios': 'log_ratio', 'imputers': 'mean', 'n_estimators': 2800, 'learning_rate': 0.3305751630120408, 'max_depth': 8, 'min_child_weight': 1, 'subsample': 0.8, 'colsample_bytree': 0.8, 'colsample_bylevel': 0.8, 'reg_alpha': 1.3527084612178574e-05, 'reg_lambda': 99.2795793752512, 'gamma': 6.909472794526869e-05}. Best is trial 167 with value: -3.137203893418154.
[I 2026-07-14 19:43:43,898] Trial 171 finished with value: -3.0002946608263663 and parameters: {'scalers': 'robust', 'ratios': 'log_ratio', 'imputers': 'mean', 'n_estimators': 2600, 'learning_rate': 0.32764570287977557, 'max_depth': 8, 'min_child_weight': 1, 'subsample': 0.8, 'colsample_bytree': 0.8, 'colsample_bylevel': 0.8, 'reg_alpha': 1.296877136931283e-05, 'reg_lambda': 22.454422679812346, 'gamma': 6.76402494581038e-05}. Best is trial 167 with value: -3.137203893418154.
[I 2026-07-14 19:44:34,700] Trial 172 finished with value: -3.013989099188625 and parameters: {'scalers': 'robust', 'ratios': 'log_ratio', 'imputers': 'mean', 'n_estimators': 2800, 'learning_rate': 0.3190958293123833, 'max_depth': 8, 'min_child_weight': 1, 'subsample': 0.8, 'colsample_bytree': 0.8, 'colsample_bylevel': 0.8, 'reg_alpha': 1.2657043614881839e-05, 'reg_lambda': 21.591714302200607, 'gamma': 7.626943158398824e-05}. Best is trial 167 with value: -3.137203893418154.
[I 2026-07-14 19:45:03,296] Trial 174 finished with value: -1.3478197541419705 and parameters: {'scalers': 'robust', 'ratios': 'log_ratio', 'imputers': 'mean', 'n_estimators': 2900, 'learning_rate': 0.34348922815257565, 'max_depth': 8, 'min_child_weight': 2, 'subsample': 0.8, 'colsample_bytree': 0.8, 'colsample_bylevel': 0.8, 'reg_alpha': 58.89702972210119, 'reg_lambda': 26.788762727426164, 'gamma': 0.006082219174574082}. Best is trial 167 with value: -3.137203893418154.
[I 2026-07-14 19:45:22,856] Trial 173 finished with value: -2.4544503407373233 and parameters: {'scalers': 'robust', 'ratios': 'log_ratio', 'imputers': 'mean', 'n_estimators': 2900, 'learning_rate': 0.3326039199118087, 'max_depth': 8, 'min_child_weight': 2, 'subsample': 0.8, 'colsample_bytree': 0.8, 'colsample_bylevel': 0.8, 'reg_alpha': 3.077704900963346e-05, 'reg_lambda': 22.767602029319928, 'gamma': 0.005878342316094167}. Best is trial 167 with value: -3.137203893418154.
[I 2026-07-14 19:46:12,845] Trial 175 finished with value: -2.6274911011638955 and parameters: {'scalers': 'robust', 'ratios': 'log_ratio', 'imputers': 'median', 'n_estimators': 2900, 'learning_rate': 0.38015937630919844, 'max_depth': 8, 'min_child_weight': 2, 'subsample': 0.8, 'colsample_bytree': 0.8, 'colsample_bylevel': 0.8, 'reg_alpha': 3.0236866992960087e-05, 'reg_lambda': 26.70777407513579, 'gamma': 0.00021331822136209802}. Best is trial 167 with value: -3.137203893418154.
[I 2026-07-14 19:47:03,124] Trial 176 finished with value: -2.488005742596079 and parameters: {'scalers': 'robust', 'ratios': 'log_ratio', 'imputers': 'mean', 'n_estimators': 2900, 'learning_rate': 0.3305348878319877, 'max_depth': 8, 'min_child_weight': 2, 'subsample': 0.9, 'colsample_bytree': 0.8, 'colsample_bylevel': 0.8, 'reg_alpha': 1.941229387902079e-05, 'reg_lambda': 28.07191989351044, 'gamma': 0.000205314320999974}. Best is trial 167 with value: -3.137203893418154.
[I 2026-07-14 19:47:52,583] Trial 177 finished with value: -2.5257629603878455 and parameters: {'scalers': 'robust', 'ratios': 'log_ratio', 'imputers': 'mean', 'n_estimators': 2900, 'learning_rate': 0.3423630745397528, 'max_depth': 8, 'min_child_weight': 2, 'subsample': 0.8, 'colsample_bytree': 0.8, 'colsample_bylevel': 0.8, 'reg_alpha': 2.1005764074412444e-05, 'reg_lambda': 29.087791828419018, 'gamma': 0.0001936654667534646}. Best is trial 167 with value: -3.137203893418154.
[I 2026-07-14 19:48:47,164] Trial 178 finished with value: -3.151981085678069 and parameters: {'scalers': 'robust', 'ratios': 'log_ratio', 'imputers': 'mean', 'n_estimators': 2900, 'learning_rate': 0.3495656557822958, 'max_depth': 8, 'min_child_weight': 1, 'subsample': 0.8, 'colsample_bytree': 0.8, 'colsample_bylevel': 0.8, 'reg_alpha': 3.0519273874373304e-05, 'reg_lambda': 30.18162089600468, 'gamma': 0.00021693910698596818}. Best is trial 178 with value: -3.151981085678069.
[I 2026-07-14 19:49:36,560] Trial 179 finished with value: -2.5395130186820873 and parameters: {'scalers': 'robust', 'ratios': 'log_ratio', 'imputers': 'mean', 'n_estimators': 2900, 'learning_rate': 0.33848702502042394, 'max_depth': 8, 'min_child_weight': 2, 'subsample': 0.8, 'colsample_bytree': 0.8, 'colsample_bylevel': 0.8, 'reg_alpha': 1.948461883294163e-05, 'reg_lambda': 29.937676015761625, 'gamma': 0.00023856510970304338}. Best is trial 178 with value: -3.151981085678069.
