[I 2026-07-14 17:32:34,180] Trial 135 finished with value: -0.38145062004339814 and parameters: {'scalers': 'robust', 'ratios': 'norm_ratio', 'imputers': 'mean', 'n_estimators': 2750, 'learning_rate': 0.3173629367445585, 'max_depth': 7, 'min_child_weight': 1, 'subsample': 0.5, 'colsample_bytree': 0.6, 'colsample_bylevel': 1.0, 'reg_alpha': 1.736090695768561, 'reg_lambda': 27.801404623381693, 'gamma': 0.0005674195624086048}. Best is trial 89 with value: -0.5220422998748535.
[I 2026-07-14 17:32:58,386] Trial 136 finished with value: -0.16587364818596717 and parameters: {'scalers': 'none', 'ratios': 'norm_ratio', 'imputers': 'mean', 'n_estimators': 2900, 'learning_rate': 0.0028866441449248896, 'max_depth': 7, 'min_child_weight': 1, 'subsample': 0.5, 'colsample_bytree': 0.6, 'colsample_bylevel': 1.0, 'reg_alpha': 1.0832533586746874e-06, 'reg_lambda': 6.398191397623948e-05, 'gamma': 0.006409557438673965}. Best is trial 89 with value: -0.5220422998748535.
[I 2026-07-14 17:33:40,014] Trial 137 finished with value: -0.25801092979431395 and parameters: {'scalers': 'none', 'ratios': 'norm_ratio', 'imputers': 'mean', 'n_estimators': 2700, 'learning_rate': 0.13548472621178057, 'max_depth': 10, 'min_child_weight': 1, 'subsample': 0.5, 'colsample_bytree': 0.6, 'colsample_bylevel': 1.0, 'reg_alpha': 1.3084592311254948e-05, 'reg_lambda': 6.24421784300902e-05, 'gamma': 0.011640089276030543}. Best is trial 89 with value: -0.5220422998748535.
[I 2026-07-14 17:34:39,903] Trial 138 finished with value: -0.38845600002747743 and parameters: {'scalers': 'robust', 'ratios': 'norm_ratio', 'imputers': 'mean', 'n_estimators': 2500, 'learning_rate': 0.2984782583872339, 'max_depth': 12, 'min_child_weight': 1, 'subsample': 0.5, 'colsample_bytree': 0.6, 'colsample_bylevel': 1.0, 'reg_alpha': 2.4336097415333355e-06, 'reg_lambda': 85.5761417933749, 'gamma': 0.01010760120487106}. Best is trial 89 with value: -0.5220422998748535.
[I 2026-07-14 17:34:52,578] Trial 140 finished with value: -0.22082582095989084 and parameters: {'scalers': 'robust', 'ratios': 'norm_ratio', 'imputers': 'mean', 'n_estimators': 2500, 'learning_rate': 0.3106719797327889, 'max_depth': 7, 'min_child_weight': 1, 'subsample': 0.5, 'colsample_bytree': 0.6, 'colsample_bylevel': 1.0, 'reg_alpha': 1.0595335750394312e-06, 'reg_lambda': 36.14949444436861, 'gamma': 97.63963971027547}. Best is trial 89 with value: -0.5220422998748535.
[I 2026-07-14 17:35:09,441] Trial 139 finished with value: -0.37439161118349357 and parameters: {'scalers': 'robust', 'ratios': 'norm_ratio', 'imputers': 'mean', 'n_estimators': 2500, 'learning_rate': 0.3064432873765229, 'max_depth': 7, 'min_child_weight': 1, 'subsample': 0.5, 'colsample_bytree': 0.6, 'colsample_bylevel': 1.0, 'reg_alpha': 1.480134960126117, 'reg_lambda': 68.75711739618198, 'gamma': 0.000589908713936325}. Best is trial 89 with value: -0.5220422998748535.
[I 2026-07-14 17:35:40,603] Trial 141 finished with value: -0.33833272926370606 and parameters: {'scalers': 'none', 'ratios': 'norm_ratio', 'imputers': 'mean', 'n_estimators': 2500, 'learning_rate': 0.2906906027959565, 'max_depth': 7, 'min_child_weight': 1, 'subsample': 0.5, 'colsample_bytree': 0.6, 'colsample_bylevel': 1.0, 'reg_alpha': 1.520517260394218e-05, 'reg_lambda': 56.02783228608258, 'gamma': 0.010652853643485576}. Best is trial 89 with value: -0.5220422998748535.
[I 2026-07-14 17:36:45,017] Trial 142 finished with value: -0.290446766056566 and parameters: {'scalers': 'none', 'ratios': 'norm_ratio', 'imputers': 'mean', 'n_estimators': 2700, 'learning_rate': 0.13708577401076583, 'max_depth': 12, 'min_child_weight': 1, 'subsample': 0.5, 'colsample_bytree': 0.6, 'colsample_bylevel': 1.0, 'reg_alpha': 1.5152387704380875e-05, 'reg_lambda': 50.305766067243226, 'gamma': 0.01590796792343111}. Best is trial 89 with value: -0.5220422998748535.
[I 2026-07-14 17:37:16,124] Trial 143 finished with value: -0.27886412797101984 and parameters: {'scalers': 'robust', 'ratios': 'norm_ratio', 'imputers': 'mean', 'n_estimators': 2700, 'learning_rate': 0.14111776567565182, 'max_depth': 7, 'min_child_weight': 1, 'subsample': 0.5, 'colsample_bytree': 0.6, 'colsample_bylevel': 1.0, 'reg_alpha': 1.166700373995447e-05, 'reg_lambda': 47.683473027466036, 'gamma': 0.010291678458808056}. Best is trial 89 with value: -0.5220422998748535.
[I 2026-07-14 17:37:48,118] Trial 144 finished with value: -0.3071506476247756 and parameters: {'scalers': 'robust', 'ratios': 'norm_ratio', 'imputers': 'mean', 'n_estimators': 2700, 'learning_rate': 0.3019611261751107, 'max_depth': 7, 'min_child_weight': 1, 'subsample': 0.5, 'colsample_bytree': 0.6, 'colsample_bylevel': 1.0, 'reg_alpha': 1.7066966834811988e-05, 'reg_lambda': 60.71670513466331, 'gamma': 0.01693637652356658}. Best is trial 89 with value: -0.5220422998748535.
[I 2026-07-14 17:38:02,274] Trial 145 finished with value: -0.21328520845617627 and parameters: {'scalers': 'robust', 'ratios': 'norm_ratio', 'imputers': 'mean', 'n_estimators': 2500, 'learning_rate': 0.3039287927265166, 'max_depth': 7, 'min_child_weight': 1, 'subsample': 0.5, 'colsample_bytree': 0.6, 'colsample_bylevel': 1.0, 'reg_alpha': 4.799855897462077e-05, 'reg_lambda': 46.8438051864312, 'gamma': 0.10960386601577514}. Best is trial 89 with value: -0.5220422998748535.
[I 2026-07-14 17:38:15,972] Trial 146 finished with value: -0.19010834655591352 and parameters: {'scalers': 'robust', 'ratios': 'norm_ratio', 'imputers': 'mean', 'n_estimators': 2500, 'learning_rate': 0.2962974930378748, 'max_depth': 7, 'min_child_weight': 1, 'subsample': 0.5, 'colsample_bytree': 0.6, 'colsample_bylevel': 1.0, 'reg_alpha': 1.3032284957720599e-05, 'reg_lambda': 60.83120655766053, 'gamma': 0.15177850276570734}. Best is trial 89 with value: -0.5220422998748535.
[I 2026-07-14 17:38:47,981] Trial 147 finished with value: -0.32593484455374155 and parameters: {'scalers': 'robust', 'ratios': 'norm_ratio', 'imputers': 'mean', 'n_estimators': 2700, 'learning_rate': 0.29900198148806506, 'max_depth': 7, 'min_child_weight': 1, 'subsample': 0.5, 'colsample_bytree': 0.6, 'colsample_bylevel': 1.0, 'reg_alpha': 2.1565688313028972e-06, 'reg_lambda': 68.16585271268697, 'gamma': 0.010138688583759943}. Best is trial 89 with value: -0.5220422998748535.
[I 2026-07-14 17:39:11,058] Trial 148 finished with value: -0.2545822114168856 and parameters: {'scalers': 'robust', 'ratios': 'norm_ratio', 'imputers': 'mean', 'n_estimators': 2400, 'learning_rate': 0.23590541083523014, 'max_depth': 7, 'min_child_weight': 1, 'subsample': 0.5, 'colsample_bytree': 0.6, 'colsample_bylevel': 1.0, 'reg_alpha': 1.5429801633105267, 'reg_lambda': 70.94977489163048, 'gamma': 0.014514443601153806}. Best is trial 89 with value: -0.5220422998748535.
[I 2026-07-14 17:39:41,479] Trial 149 finished with value: -0.34468796757478726 and parameters: {'scalers': 'robust', 'ratios': 'norm_ratio', 'imputers': 'mean', 'n_estimators': 2700, 'learning_rate': 0.24200031337776862, 'max_depth': 7, 'min_child_weight': 1, 'subsample': 0.5, 'colsample_bytree': 0.6, 'colsample_bylevel': 1.0, 'reg_alpha': 1.3669731661404017, 'reg_lambda': 94.47378717005577, 'gamma': 0.0006335826047717005}. Best is trial 89 with value: -0.5220422998748535.
[I 2026-07-14 17:40:10,115] Trial 150 finished with value: -0.3233851290547194 and parameters: {'scalers': 'robust', 'ratios': 'norm_ratio', 'imputers': 'mean', 'n_estimators': 2600, 'learning_rate': 0.23534162329459396, 'max_depth': 7, 'min_child_weight': 1, 'subsample': 0.5, 'colsample_bytree': 0.6, 'colsample_bylevel': 1.0, 'reg_alpha': 1.5884991590814075, 'reg_lambda': 89.90495679095955, 'gamma': 0.000608201150525672}. Best is trial 89 with value: -0.5220422998748535.
[I 2026-07-14 17:40:30,927] Trial 151 finished with value: -0.22125443706072662 and parameters: {'scalers': 'robust', 'ratios': 'norm_ratio', 'imputers': 'mean', 'n_estimators': 2400, 'learning_rate': 0.22955838481995883, 'max_depth': 7, 'min_child_weight': 1, 'subsample': 0.5, 'colsample_bytree': 0.6, 'colsample_bylevel': 1.0, 'reg_alpha': 1.5234763409476622, 'reg_lambda': 97.30239835110852, 'gamma': 0.023399911564245666}. Best is trial 89 with value: -0.5220422998748535.
[I 2026-07-14 17:40:42,265] Trial 152 finished with value: -0.17596055873561262 and parameters: {'scalers': 'robust', 'ratios': 'norm_ratio', 'imputers': 'mean', 'n_estimators': 2400, 'learning_rate': 0.23627025079404215, 'max_depth': 7, 'min_child_weight': 1, 'subsample': 0.5, 'colsample_bytree': 0.6, 'colsample_bylevel': 1.0, 'reg_alpha': 1.4805520379410266, 'reg_lambda': 89.32088096478174, 'gamma': 0.16582273631242211}. Best is trial 89 with value: -0.5220422998748535.
[I 2026-07-14 17:41:07,425] Trial 153 finished with value: -0.26391698807785535 and parameters: {'scalers': 'robust', 'ratios': 'norm_ratio', 'imputers': 'mean', 'n_estimators': 2400, 'learning_rate': 0.22710568797795286, 'max_depth': 7, 'min_child_weight': 1, 'subsample': 0.5, 'colsample_bytree': 0.6, 'colsample_bylevel': 1.0, 'reg_alpha': 1.3714257271048549, 'reg_lambda': 88.44602913588112, 'gamma': 0.007293242884096229}. Best is trial 89 with value: -0.5220422998748535.
[I 2026-07-14 17:41:36,159] Trial 154 finished with value: -0.3162487115198265 and parameters: {'scalers': 'robust', 'ratios': 'norm_ratio', 'imputers': 'mean', 'n_estimators': 2600, 'learning_rate': 0.2498462774394907, 'max_depth': 7, 'min_child_weight': 1, 'subsample': 0.5, 'colsample_bytree': 0.6, 'colsample_bylevel': 1.0, 'reg_alpha': 1.7534596482326281, 'reg_lambda': 86.46819754255715, 'gamma': 0.0006387034871339342}. Best is trial 89 with value: -0.5220422998748535.
[I 2026-07-14 17:41:55,569] Trial 155 finished with value: -0.24967934903908964 and parameters: {'scalers': 'robust', 'ratios': 'norm_ratio', 'imputers': 'mean', 'n_estimators': 2400, 'learning_rate': 0.2333269759152019, 'max_depth': 6, 'min_child_weight': 1, 'subsample': 0.5, 'colsample_bytree': 0.6, 'colsample_bylevel': 1.0, 'reg_alpha': 2.3594496590578844, 'reg_lambda': 95.10046816764728, 'gamma': 0.0006911203695872995}. Best is trial 89 with value: -0.5220422998748535.
[I 2026-07-14 17:42:18,457] Trial 156 finished with value: -0.3089781079991096 and parameters: {'scalers': 'robust', 'ratios': 'norm_ratio', 'imputers': 'mean', 'n_estimators': 2600, 'learning_rate': 0.2349411752041334, 'max_depth': 6, 'min_child_weight': 1, 'subsample': 0.5, 'colsample_bytree': 0.6, 'colsample_bylevel': 1.0, 'reg_alpha': 1.5931209608280332, 'reg_lambda': 20.722121477952417, 'gamma': 0.000648488047515021}. Best is trial 89 with value: -0.5220422998748535.
[I 2026-07-14 17:42:38,868] Trial 157 finished with value: -0.2799331460666113 and parameters: {'scalers': 'robust', 'ratios': 'norm_ratio', 'imputers': 'mean', 'n_estimators': 2600, 'learning_rate': 0.37055666950405064, 'max_depth': 6, 'min_child_weight': 1, 'subsample': 0.5, 'colsample_bytree': 0.6, 'colsample_bylevel': 1.0, 'reg_alpha': 2.836856173731911, 'reg_lambda': 20.96406787735034, 'gamma': 0.004483443699988536}. Best is trial 89 with value: -0.5220422998748535.
[I 2026-07-14 17:43:32,778] Trial 158 finished with value: -0.5859427184883186 and parameters: {'scalers': 'robust', 'ratios': 'norm_ratio', 'imputers': 'mean', 'n_estimators': 2600, 'learning_rate': 0.34221932348959094, 'max_depth': 12, 'min_child_weight': 1, 'subsample': 0.5, 'colsample_bytree': 0.6, 'colsample_bylevel': 1.0, 'reg_alpha': 2.795857141649575, 'reg_lambda': 17.96824121936426, 'gamma': 0.00046081497222385593}. Best is trial 158 with value: -0.5859427184883186.
[I 2026-07-14 17:44:17,231] Trial 159 finished with value: -0.554732504936571 and parameters: {'scalers': 'robust', 'ratios': 'norm_ratio', 'imputers': 'median', 'n_estimators': 2300, 'learning_rate': 0.34780482824954184, 'max_depth': 12, 'min_child_weight': 1, 'subsample': 0.5, 'colsample_bytree': 0.6, 'colsample_bylevel': 1.0, 'reg_alpha': 2.705534113073251, 'reg_lambda': 19.799567384455948, 'gamma': 0.004084538445728432}. Best is trial 158 with value: -0.5859427184883186.
[I 2026-07-14 17:44:40,726] Trial 160 finished with value: -0.3977589821432256 and parameters: {'scalers': 'robust', 'ratios': 'norm_ratio', 'imputers': 'mean', 'n_estimators': 2600, 'learning_rate': 0.3618471961350622, 'max_depth': 6, 'min_child_weight': 1, 'subsample': 0.5, 'colsample_bytree': 0.6, 'colsample_bylevel': 1.0, 'reg_alpha': 0.0001670793026687317, 'reg_lambda': 29.513194100270233, 'gamma': 0.004439998917752163}. Best is trial 158 with value: -0.5859427184883186.
[I 2026-07-14 17:45:24,177] Trial 161 finished with value: -0.5695863822385347 and parameters: {'scalers': 'robust', 'ratios': 'norm_ratio', 'imputers': 'median', 'n_estimators': 2300, 'learning_rate': 0.36316707420460337, 'max_depth': 12, 'min_child_weight': 1, 'subsample': 0.5, 'colsample_bytree': 0.6, 'colsample_bylevel': 1.0, 'reg_alpha': 2.800199769206266, 'reg_lambda': 26.46395928923517, 'gamma': 0.004566082912158775}. Best is trial 158 with value: -0.5859427184883186.
[I 2026-07-14 17:46:07,821] Trial 162 finished with value: -0.6869772638068004 and parameters: {'scalers': 'robust', 'ratios': 'norm_ratio', 'imputers': 'median', 'n_estimators': 2300, 'learning_rate': 0.38815171124960457, 'max_depth': 12, 'min_child_weight': 1, 'subsample': 0.5, 'colsample_bytree': 0.6, 'colsample_bylevel': 1.0, 'reg_alpha': 2.739146910104985, 'reg_lambda': 32.55977291337174, 'gamma': 0.004091814005599764}. Best is trial 162 with value: -0.6869772638068004.
[I 2026-07-14 17:47:11,829] Trial 163 finished with value: -0.3950112475026966 and parameters: {'scalers': 'robust', 'ratios': 'norm_ratio', 'imputers': 'median', 'n_estimators': 2300, 'learning_rate': 0.36066496445440627, 'max_depth': 12, 'min_child_weight': 2, 'subsample': 0.6, 'colsample_bytree': 0.6, 'colsample_bylevel': 1.0, 'reg_alpha': 3.782187650678342e-05, 'reg_lambda': 32.18659390746995, 'gamma': 0.00024823132677166904}. Best is trial 162 with value: -0.6869772638068004.
[I 2026-07-14 17:48:26,785] Trial 164 finished with value: -0.4112412959266667 and parameters: {'scalers': 'robust', 'ratios': 'norm_ratio', 'imputers': 'median', 'n_estimators': 2750, 'learning_rate': 0.3760332379608918, 'max_depth': 12, 'min_child_weight': 2, 'subsample': 0.6, 'colsample_bytree': 0.6, 'colsample_bylevel': 1.0, 'reg_alpha': 0.00012996620162041152, 'reg_lambda': 32.39383809901277, 'gamma': 0.0054871226061902695}. Best is trial 162 with value: -0.6869772638068004.
[I 2026-07-14 17:49:25,533] Trial 165 finished with value: -0.3930051611838301 and parameters: {'scalers': 'standard', 'ratios': 'norm_ratio', 'imputers': 'median', 'n_estimators': 2300, 'learning_rate': 0.3687061024190883, 'max_depth': 11, 'min_child_weight': 2, 'subsample': 0.6, 'colsample_bytree': 0.6, 'colsample_bylevel': 1.0, 'reg_alpha': 3.308881160166307e-05, 'reg_lambda': 33.83901771807554, 'gamma': 0.0004818184919133345}. Best is trial 162 with value: -0.6869772638068004.
[I 2026-07-14 17:49:43,192] Trial 166 finished with value: -0.19659962103180925 and parameters: {'scalers': 'robust', 'ratios': 'norm_ratio', 'imputers': 'mean', 'n_estimators': 2750, 'learning_rate': 0.3666208265727494, 'max_depth': 11, 'min_child_weight': 2, 'subsample': 0.5, 'colsample_bytree': 0.6, 'colsample_bylevel': 1.0, 'reg_alpha': 6.19485912111207, 'reg_lambda': 31.197421365395165, 'gamma': 0.034442902125545904}. Best is trial 162 with value: -0.6869772638068004.
[I 2026-07-14 17:50:08,605] Trial 167 finished with value: -0.31557131620592804 and parameters: {'scalers': 'robust', 'ratios': 'norm_ratio', 'imputers': 'mean', 'n_estimators': 2300, 'learning_rate': 0.3478178437313277, 'max_depth': 12, 'min_child_weight': 2, 'subsample': 0.5, 'colsample_bytree': 0.6, 'colsample_bylevel': 1.0, 'reg_alpha': 5.53671110660546, 'reg_lambda': 35.10336893734692, 'gamma': 0.005486092010976985}. Best is trial 162 with value: -0.6869772638068004.
[I 2026-07-14 17:50:31,794] Trial 168 finished with value: -0.30406848256214325 and parameters: {'scalers': 'robust', 'ratios': 'norm_ratio', 'imputers': 'median', 'n_estimators': 2300, 'learning_rate': 0.37964914672772404, 'max_depth': 12, 'min_child_weight': 2, 'subsample': 0.5, 'colsample_bytree': 0.6, 'colsample_bylevel': 1.0, 'reg_alpha': 6.465744267177493, 'reg_lambda': 32.76091463020121, 'gamma': 0.0038986422813489623}. Best is trial 162 with value: -0.6869772638068004.
[I 2026-07-14 17:51:56,868] Trial 169 finished with value: -0.9703998505529046 and parameters: {'scalers': 'robust', 'ratios': 'norm_ratio', 'imputers': 'median', 'n_estimators': 2750, 'learning_rate': 0.36941494077381914, 'max_depth': 12, 'min_child_weight': 1, 'subsample': 0.5, 'colsample_bytree': 0.6, 'colsample_bylevel': 1.0, 'reg_alpha': 0.00015407740252270307, 'reg_lambda': 31.317365358105896, 'gamma': 0.0015925237331681035}. Best is trial 169 with value: -0.9703998505529046.
[I 2026-07-14 17:52:20,299] Trial 170 finished with value: -0.3000256190895476 and parameters: {'scalers': 'robust', 'ratios': 'norm_ratio', 'imputers': 'median', 'n_estimators': 2300, 'learning_rate': 0.3670439028350837, 'max_depth': 12, 'min_child_weight': 2, 'subsample': 0.5, 'colsample_bytree': 0.6, 'colsample_bylevel': 1.0, 'reg_alpha': 6.182630921980122, 'reg_lambda': 28.89706319839275, 'gamma': 0.0057731221215993915}. Best is trial 169 with value: -0.9703998505529046.
[I 2026-07-14 17:53:08,181] Trial 171 finished with value: -0.33320031186071436 and parameters: {'scalers': 'robust', 'ratios': 'norm_ratio', 'imputers': 'median', 'n_estimators': 2250, 'learning_rate': 0.3861058206859892, 'max_depth': 12, 'min_child_weight': 2, 'subsample': 0.8, 'colsample_bytree': 0.6, 'colsample_bylevel': 1.0, 'reg_alpha': 3.188066653919201, 'reg_lambda': 32.13321726932579, 'gamma': 0.0034274818918077145}. Best is trial 169 with value: -0.9703998505529046.
[I 2026-07-14 17:53:33,884] Trial 172 finished with value: -0.28137791894197606 and parameters: {'scalers': 'robust', 'ratios': 'norm_ratio', 'imputers': 'median', 'n_estimators': 2300, 'learning_rate': 0.367443939996521, 'max_depth': 12, 'min_child_weight': 2, 'subsample': 0.6, 'colsample_bytree': 0.6, 'colsample_bylevel': 1.0, 'reg_alpha': 6.453721834296622, 'reg_lambda': 34.183673862972746, 'gamma': 0.004340823241022096}. Best is trial 169 with value: -0.9703998505529046.
[I 2026-07-14 17:54:36,729] Trial 173 finished with value: -0.4025243791996279 and parameters: {'scalers': 'standard', 'ratios': 'norm_ratio', 'imputers': 'median', 'n_estimators': 2300, 'learning_rate': 0.3837075914479416, 'max_depth': 12, 'min_child_weight': 2, 'subsample': 0.6, 'colsample_bytree': 0.6, 'colsample_bylevel': 1.0, 'reg_alpha': 0.00015916357900849692, 'reg_lambda': 35.62236407145506, 'gamma': 0.004158488301248689}. Best is trial 169 with value: -0.9703998505529046.
[I 2026-07-14 17:55:39,090] Trial 174 finished with value: -0.3998378143709927 and parameters: {'scalers': 'standard', 'ratios': 'norm_ratio', 'imputers': 'median', 'n_estimators': 2300, 'learning_rate': 0.374940941071026, 'max_depth': 12, 'min_child_weight': 2, 'subsample': 0.6, 'colsample_bytree': 0.6, 'colsample_bylevel': 1.0, 'reg_alpha': 0.00014169191105235757, 'reg_lambda': 36.29949356185963, 'gamma': 0.003677506415307548}. Best is trial 169 with value: -0.9703998505529046.
[I 2026-07-14 17:56:41,752] Trial 175 finished with value: -0.37422470082292875 and parameters: {'scalers': 'standard', 'ratios': 'norm_ratio', 'imputers': 'median', 'n_estimators': 2200, 'learning_rate': 0.38136385527881533, 'max_depth': 12, 'min_child_weight': 2, 'subsample': 0.6, 'colsample_bytree': 0.6, 'colsample_bylevel': 1.0, 'reg_alpha': 0.00017826201569709393, 'reg_lambda': 8.156692081638425, 'gamma': 0.004833095450483862}. Best is trial 169 with value: -0.9703998505529046.
[I 2026-07-14 17:57:45,736] Trial 176 finished with value: -0.3748285985094848 and parameters: {'scalers': 'standard', 'ratios': 'norm_ratio', 'imputers': 'median', 'n_estimators': 2250, 'learning_rate': 0.36316097173021733, 'max_depth': 12, 'min_child_weight': 2, 'subsample': 0.6, 'colsample_bytree': 0.6, 'colsample_bylevel': 1.0, 'reg_alpha': 0.00015496380035722335, 'reg_lambda': 8.127365347326828, 'gamma': 0.00330470486170251}. Best is trial 169 with value: -0.9703998505529046.
[I 2026-07-14 17:58:47,830] Trial 177 finished with value: -0.3950666626017702 and parameters: {'scalers': 'standard', 'ratios': 'norm_ratio', 'imputers': 'median', 'n_estimators': 2150, 'learning_rate': 0.37632845805941256, 'max_depth': 12, 'min_child_weight': 2, 'subsample': 0.6, 'colsample_bytree': 0.6, 'colsample_bylevel': 1.0, 'reg_alpha': 0.0001431199482797895, 'reg_lambda': 17.84004944959976, 'gamma': 0.0027072545739421504}. Best is trial 169 with value: -0.9703998505529046.
[I 2026-07-14 17:59:45,496] Trial 178 finished with value: -0.38673224406049356 and parameters: {'scalers': 'standard', 'ratios': 'norm_ratio', 'imputers': 'median', 'n_estimators': 2000, 'learning_rate': 0.38704122046435646, 'max_depth': 12, 'min_child_weight': 2, 'subsample': 0.6, 'colsample_bytree': 0.6, 'colsample_bylevel': 1.0, 'reg_alpha': 0.00016130621487970157, 'reg_lambda': 17.652387710086725, 'gamma': 0.002495460305401911}. Best is trial 169 with value: -0.9703998505529046.
[I 2026-07-14 18:00:49,309] Trial 179 finished with value: -0.37980325343815363 and parameters: {'scalers': 'standard', 'ratios': 'norm_ratio', 'imputers': 'median', 'n_estimators': 2200, 'learning_rate': 0.3798192156894425, 'max_depth': 12, 'min_child_weight': 2, 'subsample': 0.6, 'colsample_bytree': 0.6, 'colsample_bylevel': 1.0, 'reg_alpha': 0.00013847815722450703, 'reg_lambda': 9.015417214178054, 'gamma': 0.002386521993080267}. Best is trial 169 with value: -0.9703998505529046.
