[I 2026-07-14 21:24:44,779] Trial 315 finished with value: -0.16435260071153204 and parameters: {'scalers': 'none', 'ratios': 'norm_ratio', 'imputers': 'mean', 'n_estimators': 2050, 'learning_rate': 0.37064085018570014, 'max_depth': 9, 'min_child_weight': 1, 'subsample': 0.8, 'colsample_bytree': 0.5, 'colsample_bylevel': 0.6, 'reg_alpha': 0.06469316034335035, 'reg_lambda': 62.87923040553183, 'gamma': 0.0008088880707629958}. Best is trial 300 with value: -0.2393754468564618.
[I 2026-07-14 21:24:58,759] Trial 316 finished with value: -0.16717214508328554 and parameters: {'scalers': 'none', 'ratios': 'norm_ratio', 'imputers': 'mean', 'n_estimators': 2050, 'learning_rate': 0.3543402523852064, 'max_depth': 9, 'min_child_weight': 1, 'subsample': 0.8, 'colsample_bytree': 0.5, 'colsample_bylevel': 0.6, 'reg_alpha': 0.06867827297592993, 'reg_lambda': 65.58185746670176, 'gamma': 0.0003084837517565759}. Best is trial 300 with value: -0.2393754468564618.
[I 2026-07-14 21:25:12,588] Trial 317 finished with value: -0.028977765011356058 and parameters: {'scalers': 'none', 'ratios': 'norm_ratio', 'imputers': 'mean', 'n_estimators': 2050, 'learning_rate': 0.003508107304786686, 'max_depth': 9, 'min_child_weight': 1, 'subsample': 0.8, 'colsample_bytree': 0.5, 'colsample_bylevel': 0.6, 'reg_alpha': 0.09640681647402656, 'reg_lambda': 54.30869020025606, 'gamma': 0.0003310971918853933}. Best is trial 300 with value: -0.2393754468564618.
[I 2026-07-14 21:25:26,318] Trial 318 finished with value: -0.16873244319278471 and parameters: {'scalers': 'none', 'ratios': 'norm_ratio', 'imputers': 'mean', 'n_estimators': 2000, 'learning_rate': 0.3646600550436966, 'max_depth': 9, 'min_child_weight': 1, 'subsample': 0.8, 'colsample_bytree': 0.5, 'colsample_bylevel': 0.6, 'reg_alpha': 0.09354587326091388, 'reg_lambda': 63.24603268321313, 'gamma': 0.0006807506302096373}. Best is trial 300 with value: -0.2393754468564618.
[I 2026-07-14 21:25:39,377] Trial 319 finished with value: -0.1653047134767335 and parameters: {'scalers': 'none', 'ratios': 'norm_ratio', 'imputers': 'mean', 'n_estimators': 2000, 'learning_rate': 0.3620804392312984, 'max_depth': 9, 'min_child_weight': 1, 'subsample': 0.8, 'colsample_bytree': 0.5, 'colsample_bylevel': 0.6, 'reg_alpha': 0.09416364271317977, 'reg_lambda': 49.15105746553854, 'gamma': 0.0003304860951364847}. Best is trial 300 with value: -0.2393754468564618.
