[I 2026-07-14 16:42:11,840] Trial 315 finished with value: -0.38922945497047334 and parameters: {'scalers': 'standard', 'ratios': 'norm_ratio', 'imputers': 'none', 'n_estimators': 250, 'learning_rate': 0.00012962462965837856, 'max_depth': 3, 'min_child_weight': 10, 'subsample': 0.9, 'colsample_bytree': 0.7, 'colsample_bylevel': 0.7, 'reg_alpha': 97.19442862157705, 'reg_lambda': 18.527711304010197, 'gamma': 54.37479669387119}. Best is trial 295 with value: -0.3895147374925387.
[I 2026-07-14 16:42:12,401] Trial 316 finished with value: -0.385675043928747 and parameters: {'scalers': 'standard', 'ratios': 'norm_ratio', 'imputers': 'none', 'n_estimators': 250, 'learning_rate': 0.00016429365487232933, 'max_depth': 3, 'min_child_weight': 10, 'subsample': 0.9, 'colsample_bytree': 0.7, 'colsample_bylevel': 0.7, 'reg_alpha': 93.15373775072341, 'reg_lambda': 95.50403096163217, 'gamma': 20.1067237881369}. Best is trial 295 with value: -0.3895147374925387.
[I 2026-07-14 16:42:13,020] Trial 317 finished with value: -0.38465856984954233 and parameters: {'scalers': 'none', 'ratios': 'norm_ratio', 'imputers': 'none', 'n_estimators': 250, 'learning_rate': 0.00016153761321773937, 'max_depth': 3, 'min_child_weight': 10, 'subsample': 0.9, 'colsample_bytree': 0.7, 'colsample_bylevel': 0.7, 'reg_alpha': 34.15556478876663, 'reg_lambda': 95.06081152375116, 'gamma': 0.9788688438376638}. Best is trial 295 with value: -0.3895147374925387.
[I 2026-07-14 16:42:16,154] Trial 318 finished with value: -0.36187705676407667 and parameters: {'scalers': 'none', 'ratios': 'norm_ratio', 'imputers': 'none', 'n_estimators': 1400, 'learning_rate': 0.00014917256857738536, 'max_depth': 3, 'min_child_weight': 10, 'subsample': 0.9, 'colsample_bytree': 0.7, 'colsample_bylevel': 0.7, 'reg_alpha': 98.78060212354917, 'reg_lambda': 96.81581102731352, 'gamma': 0.8753899985123146}. Best is trial 295 with value: -0.3895147374925387.
[I 2026-07-14 16:42:16,901] Trial 319 finished with value: -0.3834805590511981 and parameters: {'scalers': 'none', 'ratios': 'norm_ratio', 'imputers': 'none', 'n_estimators': 300, 'learning_rate': 0.00015389470888027646, 'max_depth': 3, 'min_child_weight': 10, 'subsample': 0.9, 'colsample_bytree': 0.7, 'colsample_bylevel': 0.7, 'reg_alpha': 33.12449109714208, 'reg_lambda': 52.21784330720198, 'gamma': 0.8319058766290505}. Best is trial 295 with value: -0.3895147374925387.
