[I 2026-07-14 16:42:25,616] A new study created in RDB with name: my-study
[I 2026-07-14 16:42:45,480] Trial 0 finished with value: -0.17931404096909181 and parameters: {'scalers': 'robust', 'ratios': 'log_ratio', 'imputers': 'mean', 'n_estimators': 2700, 'learning_rate': 0.03922788276137101, 'max_depth': 7, 'min_child_weight': 2, 'subsample': 0.8, 'colsample_bytree': 0.7, 'colsample_bylevel': 0.8, 'reg_alpha': 0.0001606251808555416, 'reg_lambda': 4.9400838021815056e-05, 'gamma': 0.13842537275431108}. Best is trial 0 with value: -0.17931404096909181.
[I 2026-07-14 16:42:48,216] Trial 1 finished with value: -0.1942775837155931 and parameters: {'scalers': 'standard', 'ratios': 'norm_ratio', 'imputers': 'median', 'n_estimators': 1050, 'learning_rate': 0.0007524312784013523, 'max_depth': 5, 'min_child_weight': 4, 'subsample': 1.0, 'colsample_bytree': 0.6, 'colsample_bylevel': 0.7, 'reg_alpha': 11.00014404527039, 'reg_lambda': 1.7236739218415777e-05, 'gamma': 1.7652872897364587}. Best is trial 1 with value: -0.1942775837155931.
[I 2026-07-14 16:42:52,864] Trial 4 finished with value: -0.1744317018109248 and parameters: {'scalers': 'standard', 'ratios': 'norm_ratio', 'imputers': 'none', 'n_estimators': 2650, 'learning_rate': 0.39417254811385993, 'max_depth': 5, 'min_child_weight': 6, 'subsample': 1.0, 'colsample_bytree': 0.5, 'colsample_bylevel': 0.6, 'reg_alpha': 17.219678086872463, 'reg_lambda': 9.97518278464491e-06, 'gamma': 0.011650101842101699}. Best is trial 1 with value: -0.1942775837155931.
[I 2026-07-14 16:42:55,981] Trial 2 finished with value: -0.21456107087880624 and parameters: {'scalers': 'robust', 'ratios': 'log_ratio', 'imputers': 'median', 'n_estimators': 400, 'learning_rate': 0.00023366428743777534, 'max_depth': 12, 'min_child_weight': 3, 'subsample': 0.7, 'colsample_bytree': 0.8, 'colsample_bylevel': 0.5, 'reg_alpha': 5.7491996403316154e-06, 'reg_lambda': 10.359104832110232, 'gamma': 0.4418209828180335}. Best is trial 2 with value: -0.21456107087880624.
[I 2026-07-14 16:43:14,208] Trial 3 finished with value: -0.21539813737266872 and parameters: {'scalers': 'standard', 'ratios': 'log_ratio', 'imputers': 'median', 'n_estimators': 2800, 'learning_rate': 0.22839836694529664, 'max_depth': 6, 'min_child_weight': 1, 'subsample': 1.0, 'colsample_bytree': 0.7, 'colsample_bylevel': 0.8, 'reg_alpha': 5.843176928157126e-05, 'reg_lambda': 1.600854329466716, 'gamma': 0.03285556659355186}. Best is trial 3 with value: -0.21539813737266872.
[I 2026-07-14 16:43:16,850] Trial 5 finished with value: -0.20444531700909183 and parameters: {'scalers': 'none', 'ratios': 'log_ratio', 'imputers': 'mean', 'n_estimators': 1450, 'learning_rate': 0.499796224927802, 'max_depth': 8, 'min_child_weight': 1, 'subsample': 1.0, 'colsample_bytree': 0.7, 'colsample_bylevel': 0.8, 'reg_alpha': 0.0003306541117931447, 'reg_lambda': 0.10758644120459658, 'gamma': 59.16192286347595}. Best is trial 3 with value: -0.21539813737266872.
[I 2026-07-14 16:43:19,128] Trial 6 finished with value: -0.21371661132836436 and parameters: {'scalers': 'robust', 'ratios': 'log_ratio', 'imputers': 'none', 'n_estimators': 850, 'learning_rate': 0.00015664967029525306, 'max_depth': 3, 'min_child_weight': 8, 'subsample': 0.8, 'colsample_bytree': 0.5, 'colsample_bylevel': 0.7, 'reg_alpha': 0.013371129393780986, 'reg_lambda': 0.0004450708945855029, 'gamma': 0.00010876871436746216}. Best is trial 3 with value: -0.21539813737266872.
[I 2026-07-14 16:43:29,987] Trial 7 finished with value: -0.18300989381404062 and parameters: {'scalers': 'standard', 'ratios': 'norm_ratio', 'imputers': 'none', 'n_estimators': 1550, 'learning_rate': 0.01193824797449241, 'max_depth': 8, 'min_child_weight': 1, 'subsample': 0.5, 'colsample_bytree': 0.5, 'colsample_bylevel': 0.5, 'reg_alpha': 7.4744287633010755e-06, 'reg_lambda': 1.2082623162817694, 'gamma': 0.04701426627810454}. Best is trial 3 with value: -0.21539813737266872.
[I 2026-07-14 16:43:40,063] Trial 8 finished with value: -0.23910411933643497 and parameters: {'scalers': 'standard', 'ratios': 'log_ratio', 'imputers': 'mean', 'n_estimators': 950, 'learning_rate': 0.4375636848985405, 'max_depth': 12, 'min_child_weight': 9, 'subsample': 0.7, 'colsample_bytree': 0.5, 'colsample_bylevel': 0.6, 'reg_alpha': 0.20853646671563547, 'reg_lambda': 9.748406555732114e-06, 'gamma': 0.034495525132676785}. Best is trial 8 with value: -0.23910411933643497.
[I 2026-07-14 16:43:43,211] Trial 9 finished with value: -0.17568725855979112 and parameters: {'scalers': 'standard', 'ratios': 'norm_ratio', 'imputers': 'median', 'n_estimators': 1800, 'learning_rate': 0.16714373395812818, 'max_depth': 5, 'min_child_weight': 3, 'subsample': 0.5, 'colsample_bytree': 0.9, 'colsample_bylevel': 0.9, 'reg_alpha': 20.32844841484227, 'reg_lambda': 0.01689666720571287, 'gamma': 0.12615714855590188}. Best is trial 8 with value: -0.23910411933643497.
[I 2026-07-14 16:43:51,563] Trial 10 finished with value: -0.20603292311204655 and parameters: {'scalers': 'standard', 'ratios': 'norm_ratio', 'imputers': 'median', 'n_estimators': 2250, 'learning_rate': 0.00012201107290363253, 'max_depth': 4, 'min_child_weight': 8, 'subsample': 0.5, 'colsample_bytree': 0.9, 'colsample_bylevel': 0.6, 'reg_alpha': 1.1060071796040849e-05, 'reg_lambda': 16.149493826592234, 'gamma': 0.005116563005963751}. Best is trial 8 with value: -0.23910411933643497.
[I 2026-07-14 16:43:56,161] Trial 11 finished with value: -0.19426512709475718 and parameters: {'scalers': 'standard', 'ratios': 'log_ratio', 'imputers': 'none', 'n_estimators': 2750, 'learning_rate': 0.006025586418748574, 'max_depth': 4, 'min_child_weight': 1, 'subsample': 0.7, 'colsample_bytree': 0.9, 'colsample_bylevel': 0.7, 'reg_alpha': 2.3658108746614184e-05, 'reg_lambda': 0.04300340164878873, 'gamma': 22.171196024254986}. Best is trial 8 with value: -0.23910411933643497.
[I 2026-07-14 16:43:59,689] Trial 12 finished with value: -0.21055016749602345 and parameters: {'scalers': 'robust', 'ratios': 'log_ratio', 'imputers': 'median', 'n_estimators': 2400, 'learning_rate': 0.0012642505949286482, 'max_depth': 4, 'min_child_weight': 4, 'subsample': 0.6, 'colsample_bytree': 0.7, 'colsample_bylevel': 0.5, 'reg_alpha': 9.131723510482562e-06, 'reg_lambda': 0.04733060600117181, 'gamma': 41.49719116378686}. Best is trial 8 with value: -0.23910411933643497.
[I 2026-07-14 16:43:59,864] Trial 13 finished with value: -0.17937303353000078 and parameters: {'scalers': 'standard', 'ratios': 'log_ratio', 'imputers': 'median', 'n_estimators': 100, 'learning_rate': 0.06446390780364489, 'max_depth': 9, 'min_child_weight': 4, 'subsample': 1.0, 'colsample_bytree': 0.8, 'colsample_bylevel': 0.6, 'reg_alpha': 3.2056830112320645e-06, 'reg_lambda': 0.06269289452493663, 'gamma': 2.59969318503229}. Best is trial 8 with value: -0.23910411933643497.
[I 2026-07-14 16:44:15,193] Trial 14 finished with value: -0.2078331426528644 and parameters: {'scalers': 'none', 'ratios': 'log_ratio', 'imputers': 'median', 'n_estimators': 900, 'learning_rate': 0.000232597569846654, 'max_depth': 9, 'min_child_weight': 2, 'subsample': 0.8, 'colsample_bytree': 0.6, 'colsample_bylevel': 0.9, 'reg_alpha': 0.10397960063921863, 'reg_lambda': 0.00965382335229869, 'gamma': 1.1849396859248881e-05}. Best is trial 8 with value: -0.23910411933643497.
[I 2026-07-14 16:44:38,572] Trial 15 finished with value: -0.178701517244538 and parameters: {'scalers': 'robust', 'ratios': 'norm_ratio', 'imputers': 'mean', 'n_estimators': 1300, 'learning_rate': 0.007569086187433553, 'max_depth': 12, 'min_child_weight': 9, 'subsample': 1.0, 'colsample_bytree': 0.6, 'colsample_bylevel': 0.8, 'reg_alpha': 0.0033346742519463793, 'reg_lambda': 0.11157334866401213, 'gamma': 6.336160142679027e-06}. Best is trial 8 with value: -0.23910411933643497.
[I 2026-07-14 16:44:40,332] Trial 16 finished with value: -0.18293768977363714 and parameters: {'scalers': 'robust', 'ratios': 'log_ratio', 'imputers': 'median', 'n_estimators': 950, 'learning_rate': 0.13902313767644164, 'max_depth': 6, 'min_child_weight': 6, 'subsample': 0.8, 'colsample_bytree': 0.8, 'colsample_bylevel': 0.9, 'reg_alpha': 17.368056292593856, 'reg_lambda': 0.0014567403735264925, 'gamma': 1.9115228106597701}. Best is trial 8 with value: -0.23910411933643497.
[I 2026-07-14 16:44:43,261] Trial 17 finished with value: -0.19877967387249312 and parameters: {'scalers': 'none', 'ratios': 'log_ratio', 'imputers': 'mean', 'n_estimators': 150, 'learning_rate': 0.0025706987936838436, 'max_depth': 12, 'min_child_weight': 10, 'subsample': 0.7, 'colsample_bytree': 1.0, 'colsample_bylevel': 1.0, 'reg_alpha': 0.07889093935760386, 'reg_lambda': 1.1750473403182938e-06, 'gamma': 1.1773491158589449e-06}. Best is trial 8 with value: -0.23910411933643497.
[I 2026-07-14 16:45:25,998] Trial 18 finished with value: -0.19367812122165398 and parameters: {'scalers': 'none', 'ratios': 'log_ratio', 'imputers': 'mean', 'n_estimators': 3000, 'learning_rate': 0.05796245532352861, 'max_depth': 12, 'min_child_weight': 10, 'subsample': 0.7, 'colsample_bytree': 0.7, 'colsample_bylevel': 1.0, 'reg_alpha': 0.09358515888894095, 'reg_lambda': 1.0572412001726776e-06, 'gamma': 0.00021349158473658422}. Best is trial 8 with value: -0.23910411933643497.
[I 2026-07-14 16:45:27,620] Trial 19 finished with value: -0.17507153241024245 and parameters: {'scalers': 'none', 'ratios': 'log_ratio', 'imputers': 'mean', 'n_estimators': 100, 'learning_rate': 0.07415315468305451, 'max_depth': 11, 'min_child_weight': 10, 'subsample': 0.9, 'colsample_bytree': 0.7, 'colsample_bylevel': 0.9, 'reg_alpha': 0.2020712034012696, 'reg_lambda': 1.077874364909533e-06, 'gamma': 0.00024217072748852073}. Best is trial 8 with value: -0.23910411933643497.
[I 2026-07-14 16:45:30,320] Trial 20 finished with value: -0.17810725945330447 and parameters: {'scalers': 'none', 'ratios': 'log_ratio', 'imputers': 'mean', 'n_estimators': 150, 'learning_rate': 0.09960765012375766, 'max_depth': 12, 'min_child_weight': 10, 'subsample': 0.9, 'colsample_bytree': 0.6, 'colsample_bylevel': 1.0, 'reg_alpha': 0.08272340562001126, 'reg_lambda': 1.0491336529680406e-06, 'gamma': 0.0004758960842092342}. Best is trial 8 with value: -0.23910411933643497.
[I 2026-07-14 16:45:58,887] Trial 21 finished with value: -0.19826470081864753 and parameters: {'scalers': 'none', 'ratios': 'log_ratio', 'imputers': 'mean', 'n_estimators': 2000, 'learning_rate': 0.09919234680549721, 'max_depth': 11, 'min_child_weight': 10, 'subsample': 0.9, 'colsample_bytree': 0.6, 'colsample_bylevel': 1.0, 'reg_alpha': 0.1680735651171971, 'reg_lambda': 0.001058411186150223, 'gamma': 0.00044092667376558706}. Best is trial 8 with value: -0.23910411933643497.
[I 2026-07-14 16:46:44,391] Trial 22 finished with value: -0.1999384945512137 and parameters: {'scalers': 'standard', 'ratios': 'log_ratio', 'imputers': 'mean', 'n_estimators': 2050, 'learning_rate': 0.10693425417962475, 'max_depth': 12, 'min_child_weight': 10, 'subsample': 0.9, 'colsample_bytree': 1.0, 'colsample_bylevel': 1.0, 'reg_alpha': 0.28896756932638396, 'reg_lambda': 0.0009360922904922231, 'gamma': 0.0009297880184461538}. Best is trial 8 with value: -0.23910411933643497.
[I 2026-07-14 16:47:24,622] Trial 23 finished with value: -0.19441367242846935 and parameters: {'scalers': 'standard', 'ratios': 'log_ratio', 'imputers': 'mean', 'n_estimators': 2000, 'learning_rate': 0.08575292266233073, 'max_depth': 11, 'min_child_weight': 10, 'subsample': 0.9, 'colsample_bytree': 1.0, 'colsample_bylevel': 1.0, 'reg_alpha': 0.2718412680288348, 'reg_lambda': 1.1475132205638632e-06, 'gamma': 0.0014253420273842592}. Best is trial 8 with value: -0.23910411933643497.
[I 2026-07-14 16:48:04,191] Trial 24 finished with value: -0.18456171085383047 and parameters: {'scalers': 'standard', 'ratios': 'log_ratio', 'imputers': 'mean', 'n_estimators': 2000, 'learning_rate': 0.03235221180108671, 'max_depth': 11, 'min_child_weight': 10, 'subsample': 0.9, 'colsample_bytree': 1.0, 'colsample_bylevel': 1.0, 'reg_alpha': 0.4440597200251368, 'reg_lambda': 0.9355676430536389, 'gamma': 0.0020014027339221767}. Best is trial 8 with value: -0.23910411933643497.
[I 2026-07-14 16:48:35,653] Trial 25 finished with value: -0.18688066043415427 and parameters: {'scalers': 'standard', 'ratios': 'log_ratio', 'imputers': 'mean', 'n_estimators': 2000, 'learning_rate': 0.029253241078259107, 'max_depth': 10, 'min_child_weight': 6, 'subsample': 0.9, 'colsample_bytree': 0.6, 'colsample_bylevel': 1.0, 'reg_alpha': 1.0671704130222839, 'reg_lambda': 2.7353389420751286, 'gamma': 0.0007278284272724837}. Best is trial 8 with value: -0.23910411933643497.
[I 2026-07-14 16:49:01,065] Trial 26 finished with value: -0.18615267169594124 and parameters: {'scalers': 'standard', 'ratios': 'log_ratio', 'imputers': 'mean', 'n_estimators': 2000, 'learning_rate': 0.02480777231979376, 'max_depth': 10, 'min_child_weight': 6, 'subsample': 0.9, 'colsample_bytree': 0.6, 'colsample_bylevel': 0.7, 'reg_alpha': 1.2726114543518143, 'reg_lambda': 1.2708903023463067, 'gamma': 0.0009039475040705615}. Best is trial 8 with value: -0.23910411933643497.
[I 2026-07-14 16:49:17,918] Trial 27 finished with value: -0.17780656049079566 and parameters: {'scalers': 'standard', 'ratios': 'log_ratio', 'imputers': 'mean', 'n_estimators': 1950, 'learning_rate': 0.020268742836209493, 'max_depth': 10, 'min_child_weight': 7, 'subsample': 0.9, 'colsample_bytree': 0.6, 'colsample_bylevel': 0.7, 'reg_alpha': 1.6462239212759124, 'reg_lambda': 92.42326041428252, 'gamma': 0.003251548816798771}. Best is trial 8 with value: -0.23910411933643497.
[I 2026-07-14 16:49:23,453] Trial 28 finished with value: -0.2279692649814242 and parameters: {'scalers': 'standard', 'ratios': 'log_ratio', 'imputers': 'median', 'n_estimators': 500, 'learning_rate': 0.2852058376982817, 'max_depth': 10, 'min_child_weight': 7, 'subsample': 0.6, 'colsample_bytree': 0.8, 'colsample_bylevel': 0.5, 'reg_alpha': 0.00012057440953534745, 'reg_lambda': 96.05793162720319, 'gamma': 0.0026540461768191866}. Best is trial 8 with value: -0.23910411933643497.
[I 2026-07-14 16:49:30,102] Trial 29 finished with value: -0.1778280452378621 and parameters: {'scalers': 'standard', 'ratios': 'log_ratio', 'imputers': 'median', 'n_estimators': 550, 'learning_rate': 0.0171775640810277, 'max_depth': 10, 'min_child_weight': 6, 'subsample': 0.6, 'colsample_bytree': 0.8, 'colsample_bylevel': 0.5, 'reg_alpha': 0.00014054176187885476, 'reg_lambda': 35.27450663648669, 'gamma': 0.008715468994568853}. Best is trial 8 with value: -0.23910411933643497.
[I 2026-07-14 16:49:31,146] Trial 30 finished with value: -0.17712409321008185 and parameters: {'scalers': 'robust', 'ratios': 'log_ratio', 'imputers': 'median', 'n_estimators': 450, 'learning_rate': 0.24914255283365655, 'max_depth': 10, 'min_child_weight': 5, 'subsample': 0.7, 'colsample_bytree': 0.8, 'colsample_bylevel': 0.5, 'reg_alpha': 0.00013162401325086452, 'reg_lambda': 32.32053906122452, 'gamma': 0.36741692720516567}. Best is trial 8 with value: -0.23910411933643497.
[I 2026-07-14 16:49:33,341] Trial 31 finished with value: -0.1708691888481438 and parameters: {'scalers': 'robust', 'ratios': 'log_ratio', 'imputers': 'median', 'n_estimators': 650, 'learning_rate': 0.025950188551229818, 'max_depth': 10, 'min_child_weight': 6, 'subsample': 0.6, 'colsample_bytree': 0.8, 'colsample_bylevel': 0.5, 'reg_alpha': 9.116574660642473e-05, 'reg_lambda': 64.59828350897757, 'gamma': 0.43242155613749095}. Best is trial 8 with value: -0.23910411933643497.
[I 2026-07-14 16:49:35,483] Trial 32 finished with value: -0.17655153663137566 and parameters: {'scalers': 'robust', 'ratios': 'log_ratio', 'imputers': 'median', 'n_estimators': 550, 'learning_rate': 0.23805661457712118, 'max_depth': 10, 'min_child_weight': 6, 'subsample': 0.6, 'colsample_bytree': 0.8, 'colsample_bylevel': 0.5, 'reg_alpha': 0.00011254724447988613, 'reg_lambda': 73.84628274884759, 'gamma': 0.347896552604721}. Best is trial 8 with value: -0.23910411933643497.
[I 2026-07-14 16:49:40,530] Trial 33 finished with value: -0.21719304095877814 and parameters: {'scalers': 'robust', 'ratios': 'log_ratio', 'imputers': 'median', 'n_estimators': 500, 'learning_rate': 0.2796902990469729, 'max_depth': 10, 'min_child_weight': 5, 'subsample': 0.6, 'colsample_bytree': 0.8, 'colsample_bylevel': 0.5, 'reg_alpha': 9.504380967086882e-05, 'reg_lambda': 74.25896077667785, 'gamma': 0.03615493084797853}. Best is trial 8 with value: -0.23910411933643497.
[I 2026-07-14 16:49:43,316] Trial 34 finished with value: -0.18056199012847182 and parameters: {'scalers': 'robust', 'ratios': 'log_ratio', 'imputers': 'median', 'n_estimators': 550, 'learning_rate': 0.26592513994724726, 'max_depth': 10, 'min_child_weight': 2, 'subsample': 0.6, 'colsample_bytree': 0.8, 'colsample_bylevel': 0.5, 'reg_alpha': 0.0005409131451254781, 'reg_lambda': 39.018137029857144, 'gamma': 0.38661117470614814}. Best is trial 8 with value: -0.23910411933643497.
[I 2026-07-14 16:49:44,896] Trial 35 finished with value: -0.1785342996920933 and parameters: {'scalers': 'robust', 'ratios': 'log_ratio', 'imputers': 'median', 'n_estimators': 500, 'learning_rate': 0.2621936362146373, 'max_depth': 7, 'min_child_weight': 3, 'subsample': 0.6, 'colsample_bytree': 0.8, 'colsample_bylevel': 0.5, 'reg_alpha': 0.0001259672575539692, 'reg_lambda': 98.14085238604017, 'gamma': 0.3166507602205636}. Best is trial 8 with value: -0.23910411933643497.
[I 2026-07-14 16:49:49,326] Trial 36 finished with value: -0.2048442899831772 and parameters: {'scalers': 'standard', 'ratios': 'log_ratio', 'imputers': 'median', 'n_estimators': 600, 'learning_rate': 0.2516152970738162, 'max_depth': 7, 'min_child_weight': 8, 'subsample': 0.6, 'colsample_bytree': 0.8, 'colsample_bylevel': 0.6, 'reg_alpha': 0.0002574221753231616, 'reg_lambda': 91.31981090211372, 'gamma': 0.02912967082616614}. Best is trial 8 with value: -0.23910411933643497.
[I 2026-07-14 16:49:53,492] Trial 37 finished with value: -0.20665831365810491 and parameters: {'scalers': 'standard', 'ratios': 'log_ratio', 'imputers': 'median', 'n_estimators': 600, 'learning_rate': 0.2696338317918598, 'max_depth': 7, 'min_child_weight': 8, 'subsample': 0.6, 'colsample_bytree': 0.8, 'colsample_bylevel': 0.6, 'reg_alpha': 0.0010739399224049357, 'reg_lambda': 0.3524983492013473, 'gamma': 0.026326111741633886}. Best is trial 8 with value: -0.23910411933643497.
[I 2026-07-14 16:49:58,274] Trial 38 finished with value: -0.24314844940656896 and parameters: {'scalers': 'robust', 'ratios': 'log_ratio', 'imputers': 'median', 'n_estimators': 550, 'learning_rate': 0.28800084122121655, 'max_depth': 7, 'min_child_weight': 2, 'subsample': 0.6, 'colsample_bytree': 0.8, 'colsample_bylevel': 0.6, 'reg_alpha': 0.0008868783050811273, 'reg_lambda': 5.235100058773609, 'gamma': 0.043837851308638265}. Best is trial 38 with value: -0.24314844940656896.
[I 2026-07-14 16:50:02,504] Trial 39 finished with value: -0.2390924296500859 and parameters: {'scalers': 'robust', 'ratios': 'log_ratio', 'imputers': 'median', 'n_estimators': 450, 'learning_rate': 0.2870859761135268, 'max_depth': 7, 'min_child_weight': 2, 'subsample': 0.6, 'colsample_bytree': 0.9, 'colsample_bylevel': 0.6, 'reg_alpha': 0.0011725094571332904, 'reg_lambda': 6.837814580922582, 'gamma': 0.035137826842618784}. Best is trial 38 with value: -0.24314844940656896.
[I 2026-07-14 16:50:10,009] Trial 40 finished with value: -0.2111174357572887 and parameters: {'scalers': 'standard', 'ratios': 'log_ratio', 'imputers': 'median', 'n_estimators': 350, 'learning_rate': 0.0004370223548434708, 'max_depth': 6, 'min_child_weight': 2, 'subsample': 0.7, 'colsample_bytree': 0.9, 'colsample_bylevel': 0.6, 'reg_alpha': 3.380962392107237e-05, 'reg_lambda': 8.166504701448053, 'gamma': 0.027524271408144216}. Best is trial 38 with value: -0.24314844940656896.
[I 2026-07-14 16:50:10,965] Trial 41 finished with value: -0.2155767982457828 and parameters: {'scalers': 'standard', 'ratios': 'norm_ratio', 'imputers': 'median', 'n_estimators': 750, 'learning_rate': 0.2980602358512888, 'max_depth': 7, 'min_child_weight': 8, 'subsample': 0.6, 'colsample_bytree': 0.9, 'colsample_bylevel': 0.6, 'reg_alpha': 1.1067784491599484e-06, 'reg_lambda': 6.028026737285254, 'gamma': 0.04077099157432572}. Best is trial 38 with value: -0.24314844940656896.
[I 2026-07-14 16:50:16,796] Trial 42 finished with value: -0.26007786149878986 and parameters: {'scalers': 'standard', 'ratios': 'norm_ratio', 'imputers': 'median', 'n_estimators': 750, 'learning_rate': 0.49780790626384713, 'max_depth': 7, 'min_child_weight': 8, 'subsample': 0.5, 'colsample_bytree': 0.9, 'colsample_bylevel': 0.6, 'reg_alpha': 0.001307538415603351, 'reg_lambda': 7.67999600426946, 'gamma': 0.03534022957843165}. Best is trial 42 with value: -0.26007786149878986.
[I 2026-07-14 16:50:27,749] Trial 43 finished with value: -0.2703652722719945 and parameters: {'scalers': 'standard', 'ratios': 'norm_ratio', 'imputers': 'median', 'n_estimators': 1200, 'learning_rate': 0.46698080796572444, 'max_depth': 8, 'min_child_weight': 8, 'subsample': 0.5, 'colsample_bytree': 0.9, 'colsample_bylevel': 0.6, 'reg_alpha': 1.446074794574089e-06, 'reg_lambda': 5.3105818386970105, 'gamma': 0.032410876246035294}. Best is trial 43 with value: -0.2703652722719945.
[I 2026-07-14 16:50:33,092] Trial 44 finished with value: -0.26256793162221875 and parameters: {'scalers': 'standard', 'ratios': 'norm_ratio', 'imputers': 'none', 'n_estimators': 800, 'learning_rate': 0.4437096922497512, 'max_depth': 8, 'min_child_weight': 7, 'subsample': 0.5, 'colsample_bytree': 0.5, 'colsample_bylevel': 0.6, 'reg_alpha': 0.001778384341736205, 'reg_lambda': 4.158383851956004, 'gamma': 0.026060188810986526}. Best is trial 43 with value: -0.2703652722719945.
