[I 2026-07-14 21:24:26,688] A new study created in RDB with name: my-study
[I 2026-07-14 21:24:30,855] Trial 1 finished with value: -0.24603451717373256 and parameters: {'scalers': 'standard', 'ratios': 'norm_ratio', 'imputers': 'median', 'n_estimators': 450, 'learning_rate': 0.03665787632197248, 'max_depth': 5, 'min_child_weight': 1, 'subsample': 1.0, 'colsample_bytree': 0.5, 'colsample_bylevel': 0.7, 'reg_alpha': 0.0008823771420339637, 'reg_lambda': 0.0002031311408044922, 'gamma': 7.953187396476781}. Best is trial 1 with value: -0.24603451717373256.
[I 2026-07-14 21:24:40,476] Trial 2 finished with value: -0.24158276308007887 and parameters: {'scalers': 'none', 'ratios': 'norm_ratio', 'imputers': 'mean', 'n_estimators': 1450, 'learning_rate': 0.0004019984553404419, 'max_depth': 7, 'min_child_weight': 7, 'subsample': 0.9, 'colsample_bytree': 1.0, 'colsample_bylevel': 0.9, 'reg_alpha': 0.0002553376069751203, 'reg_lambda': 0.000509701786460074, 'gamma': 0.0006458849766150432}. Best is trial 1 with value: -0.24603451717373256.
[I 2026-07-14 21:24:49,629] Trial 0 finished with value: -0.243657954254718 and parameters: {'scalers': 'none', 'ratios': 'log_ratio', 'imputers': 'median', 'n_estimators': 1800, 'learning_rate': 0.00015010708222209767, 'max_depth': 8, 'min_child_weight': 8, 'subsample': 0.6, 'colsample_bytree': 0.7, 'colsample_bylevel': 0.8, 'reg_alpha': 4.2029474319141276e-05, 'reg_lambda': 6.104688674821647e-05, 'gamma': 4.5179911877322765e-05}. Best is trial 1 with value: -0.24603451717373256.
[I 2026-07-14 21:24:53,122] Trial 3 finished with value: -0.37372204489376226 and parameters: {'scalers': 'none', 'ratios': 'log_ratio', 'imputers': 'none', 'n_estimators': 1200, 'learning_rate': 0.1965413731681465, 'max_depth': 5, 'min_child_weight': 3, 'subsample': 0.7, 'colsample_bytree': 0.6, 'colsample_bylevel': 0.8, 'reg_alpha': 3.59697424166892e-05, 'reg_lambda': 0.6665803329171237, 'gamma': 0.000158251261433338}. Best is trial 3 with value: -0.37372204489376226.
[I 2026-07-14 21:24:54,342] Trial 7 finished with value: -0.2752113652918538 and parameters: {'scalers': 'robust', 'ratios': 'log_ratio', 'imputers': 'none', 'n_estimators': 400, 'learning_rate': 0.10296281874762479, 'max_depth': 5, 'min_child_weight': 4, 'subsample': 0.9, 'colsample_bytree': 0.6, 'colsample_bylevel': 0.8, 'reg_alpha': 3.5232463528936265e-06, 'reg_lambda': 1.04778683018688, 'gamma': 0.03344450190722128}. Best is trial 3 with value: -0.37372204489376226.
[I 2026-07-14 21:24:54,600] Trial 4 finished with value: -0.24379119620732492 and parameters: {'scalers': 'none', 'ratios': 'norm_ratio', 'imputers': 'mean', 'n_estimators': 300, 'learning_rate': 0.006755440454771354, 'max_depth': 10, 'min_child_weight': 9, 'subsample': 0.7, 'colsample_bytree': 0.6, 'colsample_bylevel': 0.9, 'reg_alpha': 4.811455054812106e-05, 'reg_lambda': 1.2539281199983601e-05, 'gamma': 0.6496886674053927}. Best is trial 3 with value: -0.37372204489376226.
[I 2026-07-14 21:24:55,425] Trial 5 finished with value: -0.24602462540879927 and parameters: {'scalers': 'robust', 'ratios': 'norm_ratio', 'imputers': 'mean', 'n_estimators': 850, 'learning_rate': 0.0001414485315925739, 'max_depth': 8, 'min_child_weight': 6, 'subsample': 0.6, 'colsample_bytree': 0.5, 'colsample_bylevel': 0.7, 'reg_alpha': 7.311558516772123e-06, 'reg_lambda': 0.0008758343436877171, 'gamma': 63.422399332880794}. Best is trial 3 with value: -0.37372204489376226.
[I 2026-07-14 21:24:59,307] Trial 6 finished with value: -0.24257115817051636 and parameters: {'scalers': 'robust', 'ratios': 'norm_ratio', 'imputers': 'median', 'n_estimators': 1150, 'learning_rate': 0.0031456944657081132, 'max_depth': 10, 'min_child_weight': 10, 'subsample': 1.0, 'colsample_bytree': 1.0, 'colsample_bylevel': 1.0, 'reg_alpha': 8.022460183778545, 'reg_lambda': 0.00014083427763973312, 'gamma': 0.0037113119177590624}. Best is trial 3 with value: -0.37372204489376226.
[I 2026-07-14 21:25:00,012] Trial 8 finished with value: -0.2431655824040319 and parameters: {'scalers': 'none', 'ratios': 'log_ratio', 'imputers': 'median', 'n_estimators': 650, 'learning_rate': 0.06647487021720028, 'max_depth': 9, 'min_child_weight': 2, 'subsample': 0.6, 'colsample_bytree': 0.5, 'colsample_bylevel': 0.5, 'reg_alpha': 14.285101140175069, 'reg_lambda': 34.895851514839094, 'gamma': 0.018707241708560488}. Best is trial 3 with value: -0.37372204489376226.
[I 2026-07-14 21:25:01,158] Trial 9 finished with value: -0.2459855122266305 and parameters: {'scalers': 'none', 'ratios': 'norm_ratio', 'imputers': 'mean', 'n_estimators': 1100, 'learning_rate': 0.0014109982233651466, 'max_depth': 5, 'min_child_weight': 9, 'subsample': 0.6, 'colsample_bytree': 0.7, 'colsample_bylevel': 0.5, 'reg_alpha': 0.006975719611011745, 'reg_lambda': 0.09159192081738496, 'gamma': 4.096061404737333}. Best is trial 3 with value: -0.37372204489376226.
[I 2026-07-14 21:25:04,195] Trial 10 finished with value: -0.24593583250615675 and parameters: {'scalers': 'none', 'ratios': 'log_ratio', 'imputers': 'none', 'n_estimators': 2700, 'learning_rate': 0.0016072323058529154, 'max_depth': 9, 'min_child_weight': 7, 'subsample': 0.7, 'colsample_bytree': 0.8, 'colsample_bylevel': 0.5, 'reg_alpha': 0.09789380482348455, 'reg_lambda': 1.9589379393298534e-05, 'gamma': 27.053332924688423}. Best is trial 3 with value: -0.37372204489376226.
[I 2026-07-14 21:25:15,355] Trial 11 finished with value: -0.3137427206367483 and parameters: {'scalers': 'robust', 'ratios': 'log_ratio', 'imputers': 'median', 'n_estimators': 3000, 'learning_rate': 0.020841422324260245, 'max_depth': 7, 'min_child_weight': 2, 'subsample': 0.6, 'colsample_bytree': 0.7, 'colsample_bylevel': 0.9, 'reg_alpha': 1.821112881636884, 'reg_lambda': 0.017259464746052222, 'gamma': 0.032188328349060984}. Best is trial 3 with value: -0.37372204489376226.
[I 2026-07-14 21:25:22,918] Trial 12 finished with value: -0.33234241406780074 and parameters: {'scalers': 'robust', 'ratios': 'log_ratio', 'imputers': 'none', 'n_estimators': 1050, 'learning_rate': 0.025976718508638863, 'max_depth': 12, 'min_child_weight': 9, 'subsample': 1.0, 'colsample_bytree': 0.7, 'colsample_bylevel': 0.5, 'reg_alpha': 2.7282318414211204e-06, 'reg_lambda': 0.007827254364499915, 'gamma': 5.412403897718051e-05}. Best is trial 3 with value: -0.37372204489376226.
[I 2026-07-14 21:25:26,263] Trial 13 finished with value: -0.2460769905154725 and parameters: {'scalers': 'standard', 'ratios': 'log_ratio', 'imputers': 'mean', 'n_estimators': 2850, 'learning_rate': 0.46911751449641914, 'max_depth': 10, 'min_child_weight': 4, 'subsample': 0.8, 'colsample_bytree': 0.9, 'colsample_bylevel': 0.6, 'reg_alpha': 2.07247410236572, 'reg_lambda': 0.00021775746676459056, 'gamma': 1.8957910219520306}. Best is trial 3 with value: -0.37372204489376226.
[I 2026-07-14 21:25:28,298] Trial 14 finished with value: -0.24595902675824183 and parameters: {'scalers': 'none', 'ratios': 'log_ratio', 'imputers': 'median', 'n_estimators': 1650, 'learning_rate': 0.0018680435926423755, 'max_depth': 11, 'min_child_weight': 4, 'subsample': 0.7, 'colsample_bytree': 0.9, 'colsample_bylevel': 0.9, 'reg_alpha': 0.8588718614202786, 'reg_lambda': 6.196870257133172e-06, 'gamma': 3.31099811485769}. Best is trial 3 with value: -0.37372204489376226.
[I 2026-07-14 21:25:29,134] Trial 15 finished with value: -0.24599363760827014 and parameters: {'scalers': 'none', 'ratios': 'norm_ratio', 'imputers': 'none', 'n_estimators': 1000, 'learning_rate': 0.05395893992856032, 'max_depth': 3, 'min_child_weight': 2, 'subsample': 0.7, 'colsample_bytree': 1.0, 'colsample_bylevel': 0.5, 'reg_alpha': 3.23119371558518e-05, 'reg_lambda': 3.138063631708751, 'gamma': 3.4525604313059852}. Best is trial 3 with value: -0.37372204489376226.
[I 2026-07-14 21:25:34,610] Trial 16 finished with value: -0.3655792903093429 and parameters: {'scalers': 'standard', 'ratios': 'log_ratio', 'imputers': 'median', 'n_estimators': 2450, 'learning_rate': 0.09484198916138008, 'max_depth': 4, 'min_child_weight': 4, 'subsample': 0.6, 'colsample_bytree': 0.7, 'colsample_bylevel': 0.5, 'reg_alpha': 0.08443378655692968, 'reg_lambda': 57.63289093424801, 'gamma': 0.0003309084509178053}. Best is trial 3 with value: -0.37372204489376226.
[I 2026-07-14 21:26:02,458] Trial 17 finished with value: -0.7749708248615474 and parameters: {'scalers': 'standard', 'ratios': 'log_ratio', 'imputers': 'none', 'n_estimators': 2850, 'learning_rate': 0.26696992679529163, 'max_depth': 12, 'min_child_weight': 4, 'subsample': 0.8, 'colsample_bytree': 0.9, 'colsample_bylevel': 0.6, 'reg_alpha': 0.09643187615400563, 'reg_lambda': 0.044750483879525155, 'gamma': 7.896934955220375e-06}. Best is trial 17 with value: -0.7749708248615474.
[I 2026-07-14 21:26:06,196] Trial 18 finished with value: -0.36310826507807514 and parameters: {'scalers': 'robust', 'ratios': 'log_ratio', 'imputers': 'none', 'n_estimators': 1950, 'learning_rate': 0.4178416757890723, 'max_depth': 3, 'min_child_weight': 4, 'subsample': 0.8, 'colsample_bytree': 0.7, 'colsample_bylevel': 0.7, 'reg_alpha': 1.3982300183523514e-06, 'reg_lambda': 1.0453281952211926, 'gamma': 1.657736745324788e-06}. Best is trial 17 with value: -0.7749708248615474.
[I 2026-07-14 21:26:12,681] Trial 19 finished with value: -0.43608997524538984 and parameters: {'scalers': 'standard', 'ratios': 'log_ratio', 'imputers': 'none', 'n_estimators': 2900, 'learning_rate': 0.3200130738403033, 'max_depth': 3, 'min_child_weight': 3, 'subsample': 0.5, 'colsample_bytree': 0.8, 'colsample_bylevel': 1.0, 'reg_alpha': 0.31821127952298295, 'reg_lambda': 0.039474207258182625, 'gamma': 7.897565226060456e-05}. Best is trial 17 with value: -0.7749708248615474.
[I 2026-07-14 21:26:16,635] Trial 20 finished with value: -0.3780339223556492 and parameters: {'scalers': 'standard', 'ratios': 'log_ratio', 'imputers': 'none', 'n_estimators': 2000, 'learning_rate': 0.4527142973871253, 'max_depth': 3, 'min_child_weight': 5, 'subsample': 0.8, 'colsample_bytree': 0.8, 'colsample_bylevel': 0.6, 'reg_alpha': 1.118716426317965e-06, 'reg_lambda': 2.747761111408982, 'gamma': 1.0962065731085092e-06}. Best is trial 17 with value: -0.7749708248615474.
[I 2026-07-14 21:26:21,312] Trial 21 finished with value: -0.5822960634283821 and parameters: {'scalers': 'robust', 'ratios': 'log_ratio', 'imputers': 'none', 'n_estimators': 1950, 'learning_rate': 0.4874633976867103, 'max_depth': 4, 'min_child_weight': 5, 'subsample': 0.5, 'colsample_bytree': 0.8, 'colsample_bylevel': 0.6, 'reg_alpha': 1.0396633091738389e-06, 'reg_lambda': 3.147228049002481, 'gamma': 1.247016153936231e-06}. Best is trial 17 with value: -0.7749708248615474.
[I 2026-07-14 21:26:24,815] Trial 22 finished with value: -0.38273204240273173 and parameters: {'scalers': 'robust', 'ratios': 'log_ratio', 'imputers': 'none', 'n_estimators': 2100, 'learning_rate': 0.30760606582035915, 'max_depth': 3, 'min_child_weight': 5, 'subsample': 0.5, 'colsample_bytree': 0.6, 'colsample_bylevel': 0.6, 'reg_alpha': 1.0592113490243807e-06, 'reg_lambda': 1.0034916114584986, 'gamma': 1.6600301119114835e-06}. Best is trial 17 with value: -0.7749708248615474.
[I 2026-07-14 21:26:40,499] Trial 23 finished with value: -0.88175068162932 and parameters: {'scalers': 'robust', 'ratios': 'log_ratio', 'imputers': 'none', 'n_estimators': 2200, 'learning_rate': 0.3615605919643115, 'max_depth': 12, 'min_child_weight': 5, 'subsample': 0.5, 'colsample_bytree': 0.6, 'colsample_bylevel': 0.6, 'reg_alpha': 1.201896655348184e-06, 'reg_lambda': 0.013373031197444853, 'gamma': 4.9832846364651845e-06}. Best is trial 23 with value: -0.88175068162932.
[I 2026-07-14 21:26:44,667] Trial 24 finished with value: -0.38852226859178357 and parameters: {'scalers': 'standard', 'ratios': 'log_ratio', 'imputers': 'none', 'n_estimators': 2350, 'learning_rate': 0.34755293387185615, 'max_depth': 3, 'min_child_weight': 5, 'subsample': 0.5, 'colsample_bytree': 0.6, 'colsample_bylevel': 0.6, 'reg_alpha': 0.020115589845635808, 'reg_lambda': 93.89367789309219, 'gamma': 1.0160200586308568e-06}. Best is trial 23 with value: -0.88175068162932.
[I 2026-07-14 21:26:47,247] Trial 25 finished with value: -0.24607881891777628 and parameters: {'scalers': 'standard', 'ratios': 'log_ratio', 'imputers': 'none', 'n_estimators': 2200, 'learning_rate': 0.4693072755392112, 'max_depth': 12, 'min_child_weight': 5, 'subsample': 0.8, 'colsample_bytree': 0.9, 'colsample_bylevel': 0.7, 'reg_alpha': 83.65311236014192, 'reg_lambda': 0.3280016459880836, 'gamma': 1.475957242247006e-06}. Best is trial 23 with value: -0.88175068162932.
[I 2026-07-14 21:26:49,564] Trial 26 finished with value: -0.2458514343966753 and parameters: {'scalers': 'standard', 'ratios': 'log_ratio', 'imputers': 'none', 'n_estimators': 2400, 'learning_rate': 0.21080314458437868, 'max_depth': 6, 'min_child_weight': 5, 'subsample': 0.5, 'colsample_bytree': 0.9, 'colsample_bylevel': 0.6, 'reg_alpha': 73.50880446887324, 'reg_lambda': 0.10170875296285084, 'gamma': 1.4922117655932059e-06}. Best is trial 23 with value: -0.88175068162932.
[I 2026-07-14 21:27:00,371] Trial 27 finished with value: -0.5076370012164704 and parameters: {'scalers': 'standard', 'ratios': 'log_ratio', 'imputers': 'none', 'n_estimators': 2250, 'learning_rate': 0.21485883938567452, 'max_depth': 6, 'min_child_weight': 6, 'subsample': 0.5, 'colsample_bytree': 0.9, 'colsample_bylevel': 1.0, 'reg_alpha': 0.03085469835272646, 'reg_lambda': 0.0038833711104936204, 'gamma': 1.8166521851916675e-06}. Best is trial 23 with value: -0.88175068162932.
[I 2026-07-14 21:27:04,814] Trial 28 finished with value: -0.3146093788348755 and parameters: {'scalers': 'standard', 'ratios': 'log_ratio', 'imputers': 'none', 'n_estimators': 2250, 'learning_rate': 0.20788449162233646, 'max_depth': 3, 'min_child_weight': 6, 'subsample': 0.8, 'colsample_bytree': 0.9, 'colsample_bylevel': 0.6, 'reg_alpha': 0.022876225077209305, 'reg_lambda': 0.08429460111683258, 'gamma': 1.313001637694005e-06}. Best is trial 23 with value: -0.88175068162932.
[I 2026-07-14 21:27:07,078] Trial 29 finished with value: -0.2459656499594227 and parameters: {'scalers': 'standard', 'ratios': 'log_ratio', 'imputers': 'none', 'n_estimators': 2350, 'learning_rate': 0.19548871406556523, 'max_depth': 4, 'min_child_weight': 6, 'subsample': 0.5, 'colsample_bytree': 0.9, 'colsample_bylevel': 0.6, 'reg_alpha': 52.50596942463298, 'reg_lambda': 0.06368650585195486, 'gamma': 9.122114806741718e-06}. Best is trial 23 with value: -0.88175068162932.
[I 2026-07-14 21:27:18,885] Trial 30 finished with value: -0.5056448877534714 and parameters: {'scalers': 'standard', 'ratios': 'log_ratio', 'imputers': 'none', 'n_estimators': 2450, 'learning_rate': 0.2148457131709135, 'max_depth': 6, 'min_child_weight': 6, 'subsample': 0.5, 'colsample_bytree': 0.9, 'colsample_bylevel': 1.0, 'reg_alpha': 0.03135798488281846, 'reg_lambda': 0.08313326331011121, 'gamma': 1.252410120443743e-05}. Best is trial 23 with value: -0.88175068162932.
[I 2026-07-14 21:27:35,675] Trial 31 finished with value: -0.587500912511572 and parameters: {'scalers': 'robust', 'ratios': 'log_ratio', 'imputers': 'none', 'n_estimators': 2350, 'learning_rate': 0.1501824879150856, 'max_depth': 12, 'min_child_weight': 6, 'subsample': 0.5, 'colsample_bytree': 0.9, 'colsample_bylevel': 0.6, 'reg_alpha': 0.005444718987990904, 'reg_lambda': 0.0025765106372267355, 'gamma': 4.913125277063488e-06}. Best is trial 23 with value: -0.88175068162932.
[I 2026-07-14 21:27:52,626] Trial 32 finished with value: -0.5981327644792064 and parameters: {'scalers': 'robust', 'ratios': 'log_ratio', 'imputers': 'none', 'n_estimators': 2350, 'learning_rate': 0.15607898623661792, 'max_depth': 12, 'min_child_weight': 6, 'subsample': 0.5, 'colsample_bytree': 0.9, 'colsample_bylevel': 0.6, 'reg_alpha': 0.001127814876223659, 'reg_lambda': 1.0251156686604865e-06, 'gamma': 1.163965308581437e-05}. Best is trial 23 with value: -0.88175068162932.
[I 2026-07-14 21:28:09,792] Trial 33 finished with value: -0.5889195715719334 and parameters: {'scalers': 'robust', 'ratios': 'log_ratio', 'imputers': 'none', 'n_estimators': 2500, 'learning_rate': 0.16104686240270846, 'max_depth': 11, 'min_child_weight': 6, 'subsample': 0.5, 'colsample_bytree': 0.9, 'colsample_bylevel': 0.6, 'reg_alpha': 0.0011231967607774913, 'reg_lambda': 1.0025846283780512e-06, 'gamma': 1.0516416364244408e-05}. Best is trial 23 with value: -0.88175068162932.
[I 2026-07-14 21:28:26,569] Trial 34 finished with value: -0.578550147270086 and parameters: {'scalers': 'robust', 'ratios': 'log_ratio', 'imputers': 'none', 'n_estimators': 2600, 'learning_rate': 0.14602151616510506, 'max_depth': 11, 'min_child_weight': 6, 'subsample': 0.5, 'colsample_bytree': 0.8, 'colsample_bylevel': 0.6, 'reg_alpha': 0.0016669638121681366, 'reg_lambda': 0.0037106595936391333, 'gamma': 1.0487282087648126e-05}. Best is trial 23 with value: -0.88175068162932.
[I 2026-07-14 21:28:47,745] Trial 35 finished with value: -0.5828225712453018 and parameters: {'scalers': 'robust', 'ratios': 'log_ratio', 'imputers': 'none', 'n_estimators': 2700, 'learning_rate': 0.14618285402913858, 'max_depth': 11, 'min_child_weight': 6, 'subsample': 0.9, 'colsample_bytree': 0.8, 'colsample_bylevel': 0.6, 'reg_alpha': 0.0015166105473107606, 'reg_lambda': 17.490043262830323, 'gamma': 1.5763972801864943e-05}. Best is trial 23 with value: -0.88175068162932.
[I 2026-07-14 21:29:09,521] Trial 36 finished with value: -0.5220820032560346 and parameters: {'scalers': 'robust', 'ratios': 'log_ratio', 'imputers': 'none', 'n_estimators': 2600, 'learning_rate': 0.13501913656574782, 'max_depth': 11, 'min_child_weight': 7, 'subsample': 0.9, 'colsample_bytree': 0.8, 'colsample_bylevel': 0.7, 'reg_alpha': 0.0013092582948004987, 'reg_lambda': 13.214066859006518, 'gamma': 1.2463315342196905e-05}. Best is trial 23 with value: -0.88175068162932.
[I 2026-07-14 21:29:25,077] Trial 37 finished with value: -0.4393413075518803 and parameters: {'scalers': 'robust', 'ratios': 'log_ratio', 'imputers': 'none', 'n_estimators': 1750, 'learning_rate': 0.10903932651709497, 'max_depth': 12, 'min_child_weight': 7, 'subsample': 0.9, 'colsample_bytree': 0.8, 'colsample_bylevel': 0.7, 'reg_alpha': 0.0017541494879359533, 'reg_lambda': 0.0021594294997356405, 'gamma': 1.0829772146164469e-05}. Best is trial 23 with value: -0.88175068162932.
[I 2026-07-14 21:29:36,453] Trial 38 finished with value: -0.4541809859744997 and parameters: {'scalers': 'robust', 'ratios': 'log_ratio', 'imputers': 'none', 'n_estimators': 1750, 'learning_rate': 0.10853075258353946, 'max_depth': 11, 'min_child_weight': 7, 'subsample': 0.5, 'colsample_bytree': 0.8, 'colsample_bylevel': 0.7, 'reg_alpha': 0.0021242771953485376, 'reg_lambda': 0.0029453892801679844, 'gamma': 1.0784328359012436e-05}. Best is trial 23 with value: -0.88175068162932.
[I 2026-07-14 21:29:58,553] Trial 39 finished with value: -0.47598764491244216 and parameters: {'scalers': 'robust', 'ratios': 'log_ratio', 'imputers': 'none', 'n_estimators': 2650, 'learning_rate': 0.11286317352083503, 'max_depth': 11, 'min_child_weight': 7, 'subsample': 0.9, 'colsample_bytree': 0.8, 'colsample_bylevel': 0.7, 'reg_alpha': 0.0005809173737177319, 'reg_lambda': 1.1638092406471578e-06, 'gamma': 1.1638372338746904e-05}. Best is trial 23 with value: -0.88175068162932.
[I 2026-07-14 21:30:18,502] Trial 40 finished with value: -0.47162775176251753 and parameters: {'scalers': 'robust', 'ratios': 'log_ratio', 'imputers': 'none', 'n_estimators': 2650, 'learning_rate': 0.1067006761139649, 'max_depth': 11, 'min_child_weight': 7, 'subsample': 0.6, 'colsample_bytree': 1.0, 'colsample_bylevel': 0.7, 'reg_alpha': 0.0019107621930040902, 'reg_lambda': 1.2120049601703445e-06, 'gamma': 1.0390496429462246e-05}. Best is trial 23 with value: -0.88175068162932.
[I 2026-07-14 21:30:42,819] Trial 41 finished with value: -0.45423715675518167 and parameters: {'scalers': 'robust', 'ratios': 'log_ratio', 'imputers': 'none', 'n_estimators': 2650, 'learning_rate': 0.10567608931480055, 'max_depth': 11, 'min_child_weight': 7, 'subsample': 0.9, 'colsample_bytree': 1.0, 'colsample_bylevel': 0.7, 'reg_alpha': 0.001501183247973445, 'reg_lambda': 1.072163438083363e-06, 'gamma': 2.2107240756867144e-05}. Best is trial 23 with value: -0.88175068162932.
[I 2026-07-14 21:31:03,131] Trial 42 finished with value: -0.3626322342820689 and parameters: {'scalers': 'robust', 'ratios': 'log_ratio', 'imputers': 'none', 'n_estimators': 2650, 'learning_rate': 0.04660086331534428, 'max_depth': 11, 'min_child_weight': 7, 'subsample': 0.9, 'colsample_bytree': 1.0, 'colsample_bylevel': 0.7, 'reg_alpha': 0.000218878717716884, 'reg_lambda': 1.6032936607609298e-06, 'gamma': 2.669280562460257e-05}. Best is trial 23 with value: -0.88175068162932.
[I 2026-07-14 21:31:15,320] Trial 43 finished with value: -0.3710455028606971 and parameters: {'scalers': 'robust', 'ratios': 'norm_ratio', 'imputers': 'mean', 'n_estimators': 1700, 'learning_rate': 0.03847385025243609, 'max_depth': 11, 'min_child_weight': 7, 'subsample': 0.6, 'colsample_bytree': 1.0, 'colsample_bylevel': 0.7, 'reg_alpha': 0.000196769481935039, 'reg_lambda': 1.051514924083313e-06, 'gamma': 3.23035895494654e-05}. Best is trial 23 with value: -0.88175068162932.
[I 2026-07-14 21:31:32,940] Trial 44 finished with value: -0.3627875865341248 and parameters: {'scalers': 'robust', 'ratios': 'norm_ratio', 'imputers': 'mean', 'n_estimators': 1750, 'learning_rate': 0.013718453611188258, 'max_depth': 12, 'min_child_weight': 8, 'subsample': 0.6, 'colsample_bytree': 1.0, 'colsample_bylevel': 0.7, 'reg_alpha': 0.00022554090249950345, 'reg_lambda': 1.106474471072894e-06, 'gamma': 0.0012026469323880103}. Best is trial 23 with value: -0.88175068162932.
