[I 2026-07-14 21:22:27,772] Trial 180 finished with value: -0.11894621412388104 and parameters: {'scalers': 'none', 'ratios': 'log_ratio', 'imputers': 'mean', 'n_estimators': 2800, 'learning_rate': 0.41194825568661414, 'max_depth': 11, 'min_child_weight': 1, 'subsample': 0.5, 'colsample_bytree': 0.7, 'colsample_bylevel': 0.6, 'reg_alpha': 2.2957165848252802e-05, 'reg_lambda': 1.5771896765327002e-06, 'gamma': 1.091523269277079e-05}. Best is trial 148 with value: -0.15198817628036207.
[I 2026-07-14 21:22:39,242] Trial 181 finished with value: -0.10460704068784644 and parameters: {'scalers': 'none', 'ratios': 'log_ratio', 'imputers': 'mean', 'n_estimators': 2400, 'learning_rate': 0.433028423378511, 'max_depth': 10, 'min_child_weight': 1, 'subsample': 0.5, 'colsample_bytree': 0.7, 'colsample_bylevel': 0.6, 'reg_alpha': 0.00022372792420941745, 'reg_lambda': 1.5699266809073707e-06, 'gamma': 1.1310761402976793e-06}. Best is trial 148 with value: -0.15198817628036207.
[I 2026-07-14 21:22:54,037] Trial 182 finished with value: -0.06423047216075677 and parameters: {'scalers': 'none', 'ratios': 'log_ratio', 'imputers': 'mean', 'n_estimators': 2650, 'learning_rate': 0.42844537631709956, 'max_depth': 10, 'min_child_weight': 8, 'subsample': 0.5, 'colsample_bytree': 0.7, 'colsample_bylevel': 0.6, 'reg_alpha': 0.00019321588338897175, 'reg_lambda': 1.7076420856067293e-06, 'gamma': 1.3250711325709723e-06}. Best is trial 148 with value: -0.15198817628036207.
[I 2026-07-14 21:23:07,037] Trial 183 finished with value: -0.10333418733265057 and parameters: {'scalers': 'none', 'ratios': 'norm_ratio', 'imputers': 'mean', 'n_estimators': 2650, 'learning_rate': 0.42063643339384443, 'max_depth': 10, 'min_child_weight': 1, 'subsample': 0.5, 'colsample_bytree': 0.7, 'colsample_bylevel': 0.6, 'reg_alpha': 0.0001284084644816973, 'reg_lambda': 1.86135664901521e-06, 'gamma': 9.825462242939153e-06}. Best is trial 148 with value: -0.15198817628036207.
[I 2026-07-14 21:23:28,338] Trial 184 finished with value: -0.019115238534624896 and parameters: {'scalers': 'none', 'ratios': 'norm_ratio', 'imputers': 'mean', 'n_estimators': 2650, 'learning_rate': 0.00014382427814625714, 'max_depth': 11, 'min_child_weight': 1, 'subsample': 0.5, 'colsample_bytree': 0.7, 'colsample_bylevel': 0.6, 'reg_alpha': 0.00012841658578723197, 'reg_lambda': 4.038683839632044e-06, 'gamma': 1.2754588548879988e-06}. Best is trial 148 with value: -0.15198817628036207.
[I 2026-07-14 21:23:43,393] Trial 185 finished with value: -0.13883648371173085 and parameters: {'scalers': 'none', 'ratios': 'norm_ratio', 'imputers': 'mean', 'n_estimators': 2650, 'learning_rate': 0.4971615534110052, 'max_depth': 11, 'min_child_weight': 1, 'subsample': 0.5, 'colsample_bytree': 0.7, 'colsample_bylevel': 0.6, 'reg_alpha': 2.3795215955640996e-05, 'reg_lambda': 4.2482497462810075e-06, 'gamma': 1.2416351980985587e-06}. Best is trial 148 with value: -0.15198817628036207.
[I 2026-07-14 21:23:58,481] Trial 186 finished with value: -0.13602767445690364 and parameters: {'scalers': 'none', 'ratios': 'norm_ratio', 'imputers': 'mean', 'n_estimators': 2650, 'learning_rate': 0.49438183214851816, 'max_depth': 11, 'min_child_weight': 1, 'subsample': 0.5, 'colsample_bytree': 0.7, 'colsample_bylevel': 0.6, 'reg_alpha': 0.0002137932954995571, 'reg_lambda': 2.709460164544916e-06, 'gamma': 0.00011187474366921531}. Best is trial 148 with value: -0.15198817628036207.
[I 2026-07-14 21:24:10,972] Trial 187 finished with value: -0.11216657585711418 and parameters: {'scalers': 'none', 'ratios': 'norm_ratio', 'imputers': 'mean', 'n_estimators': 2500, 'learning_rate': 0.48530163760887707, 'max_depth': 10, 'min_child_weight': 1, 'subsample': 0.5, 'colsample_bytree': 0.7, 'colsample_bylevel': 0.6, 'reg_alpha': 0.00011403349898197026, 'reg_lambda': 4.330860073784712e-06, 'gamma': 0.00010694155982096582}. Best is trial 148 with value: -0.15198817628036207.
[I 2026-07-14 21:24:31,159] Trial 188 finished with value: -0.01912857418631202 and parameters: {'scalers': 'none', 'ratios': 'norm_ratio', 'imputers': 'mean', 'n_estimators': 2500, 'learning_rate': 0.0001727326399055371, 'max_depth': 11, 'min_child_weight': 1, 'subsample': 0.5, 'colsample_bytree': 0.7, 'colsample_bylevel': 0.6, 'reg_alpha': 0.001111187907587298, 'reg_lambda': 2.968084700104612e-06, 'gamma': 0.0001096646263231154}. Best is trial 148 with value: -0.15198817628036207.
[I 2026-07-14 21:24:50,020] Trial 189 finished with value: -0.12365146855276238 and parameters: {'scalers': 'none', 'ratios': 'norm_ratio', 'imputers': 'mean', 'n_estimators': 2500, 'learning_rate': 0.49859106302751044, 'max_depth': 11, 'min_child_weight': 1, 'subsample': 0.5, 'colsample_bytree': 0.7, 'colsample_bylevel': 1.0, 'reg_alpha': 0.00011763263985578796, 'reg_lambda': 3.144509882075398e-06, 'gamma': 0.00010897592727066191}. Best is trial 148 with value: -0.15198817628036207.
[I 2026-07-14 21:25:04,459] Trial 190 finished with value: -0.13163182317347422 and parameters: {'scalers': 'none', 'ratios': 'norm_ratio', 'imputers': 'mean', 'n_estimators': 2500, 'learning_rate': 0.4815889576888227, 'max_depth': 11, 'min_child_weight': 1, 'subsample': 0.5, 'colsample_bytree': 0.7, 'colsample_bylevel': 0.6, 'reg_alpha': 0.00011254581256894064, 'reg_lambda': 3.392993973143655e-06, 'gamma': 0.00010495944315405177}. Best is trial 148 with value: -0.15198817628036207.
[I 2026-07-14 21:25:18,861] Trial 191 finished with value: -0.13831185339513247 and parameters: {'scalers': 'none', 'ratios': 'norm_ratio', 'imputers': 'mean', 'n_estimators': 2500, 'learning_rate': 0.4968610250213924, 'max_depth': 11, 'min_child_weight': 1, 'subsample': 0.5, 'colsample_bytree': 0.7, 'colsample_bylevel': 0.6, 'reg_alpha': 0.001089799155392858, 'reg_lambda': 3.0370165222877213e-06, 'gamma': 9.223778131244252e-05}. Best is trial 148 with value: -0.15198817628036207.
[I 2026-07-14 21:25:33,032] Trial 192 finished with value: -0.13388145063134663 and parameters: {'scalers': 'none', 'ratios': 'norm_ratio', 'imputers': 'mean', 'n_estimators': 2500, 'learning_rate': 0.49336245456446864, 'max_depth': 11, 'min_child_weight': 1, 'subsample': 0.5, 'colsample_bytree': 0.7, 'colsample_bylevel': 0.6, 'reg_alpha': 0.0011048733920105574, 'reg_lambda': 2.9594697036264276e-06, 'gamma': 0.00011393182935284376}. Best is trial 148 with value: -0.15198817628036207.
[I 2026-07-14 21:25:47,284] Trial 193 finished with value: -0.13518918522923162 and parameters: {'scalers': 'none', 'ratios': 'norm_ratio', 'imputers': 'mean', 'n_estimators': 2500, 'learning_rate': 0.4999490128095823, 'max_depth': 11, 'min_child_weight': 1, 'subsample': 0.5, 'colsample_bytree': 0.7, 'colsample_bylevel': 0.6, 'reg_alpha': 2.028703859779726e-05, 'reg_lambda': 2.9481774682500365e-06, 'gamma': 0.00011143623975860842}. Best is trial 148 with value: -0.15198817628036207.
[I 2026-07-14 21:26:01,586] Trial 194 finished with value: -0.13390603735460355 and parameters: {'scalers': 'none', 'ratios': 'norm_ratio', 'imputers': 'mean', 'n_estimators': 2500, 'learning_rate': 0.4986357234071618, 'max_depth': 11, 'min_child_weight': 1, 'subsample': 0.5, 'colsample_bytree': 0.7, 'colsample_bylevel': 0.6, 'reg_alpha': 2.1128668792383092e-05, 'reg_lambda': 2.801996647406141e-06, 'gamma': 0.00010678029088218428}. Best is trial 148 with value: -0.15198817628036207.
[I 2026-07-14 21:26:10,473] Trial 196 finished with value: -0.019060471082822033 and parameters: {'scalers': 'none', 'ratios': 'norm_ratio', 'imputers': 'mean', 'n_estimators': 2500, 'learning_rate': 0.36283595178590317, 'max_depth': 11, 'min_child_weight': 1, 'subsample': 0.5, 'colsample_bytree': 0.7, 'colsample_bylevel': 0.6, 'reg_alpha': 2.0934440667748294e-05, 'reg_lambda': 2.6011817553598935e-06, 'gamma': 5.560692167761791}. Best is trial 148 with value: -0.15198817628036207.
[I 2026-07-14 21:26:15,470] Trial 195 finished with value: -0.10437281398549637 and parameters: {'scalers': 'none', 'ratios': 'norm_ratio', 'imputers': 'mean', 'n_estimators': 2500, 'learning_rate': 0.3642482759381755, 'max_depth': 11, 'min_child_weight': 1, 'subsample': 0.5, 'colsample_bytree': 0.7, 'colsample_bylevel': 0.6, 'reg_alpha': 1.9773741694820997e-05, 'reg_lambda': 2.651109052572591e-06, 'gamma': 3.238301061588367e-05}. Best is trial 148 with value: -0.15198817628036207.
[I 2026-07-14 21:26:30,951] Trial 197 finished with value: -0.09921981618504111 and parameters: {'scalers': 'none', 'ratios': 'norm_ratio', 'imputers': 'mean', 'n_estimators': 2750, 'learning_rate': 0.34961054454715695, 'max_depth': 11, 'min_child_weight': 1, 'subsample': 0.5, 'colsample_bytree': 0.7, 'colsample_bylevel': 0.6, 'reg_alpha': 2.2591532653105367e-05, 'reg_lambda': 2.226905602592395e-06, 'gamma': 4.124834780916469e-06}. Best is trial 148 with value: -0.15198817628036207.
[I 2026-07-14 21:26:45,445] Trial 199 finished with value: -0.019073354335424657 and parameters: {'scalers': 'none', 'ratios': 'norm_ratio', 'imputers': 'mean', 'n_estimators': 2500, 'learning_rate': 0.36367390448816067, 'max_depth': 11, 'min_child_weight': 1, 'subsample': 0.8, 'colsample_bytree': 0.7, 'colsample_bylevel': 0.6, 'reg_alpha': 2.153351610335058e-05, 'reg_lambda': 2.5534845870874196e-06, 'gamma': 1.4446838345187112}. Best is trial 148 with value: -0.15198817628036207.
[I 2026-07-14 21:26:46,293] Trial 198 finished with value: -0.10820177742991781 and parameters: {'scalers': 'none', 'ratios': 'norm_ratio', 'imputers': 'mean', 'n_estimators': 2750, 'learning_rate': 0.3619700589312272, 'max_depth': 11, 'min_child_weight': 1, 'subsample': 0.5, 'colsample_bytree': 0.7, 'colsample_bylevel': 0.6, 'reg_alpha': 2.121259824148374e-05, 'reg_lambda': 2.2653149880365663e-06, 'gamma': 3.5549241790127235e-05}. Best is trial 148 with value: -0.15198817628036207.
[I 2026-07-14 21:27:00,073] Trial 200 finished with value: -0.10576275838276701 and parameters: {'scalers': 'none', 'ratios': 'norm_ratio', 'imputers': 'mean', 'n_estimators': 2500, 'learning_rate': 0.36805127399181753, 'max_depth': 11, 'min_child_weight': 1, 'subsample': 0.5, 'colsample_bytree': 0.7, 'colsample_bylevel': 0.6, 'reg_alpha': 1.9843875040677307e-05, 'reg_lambda': 2.7258784850285046e-06, 'gamma': 0.00016684914114698332}. Best is trial 148 with value: -0.15198817628036207.
[I 2026-07-14 21:27:15,496] Trial 201 finished with value: -0.11064673976783965 and parameters: {'scalers': 'none', 'ratios': 'norm_ratio', 'imputers': 'mean', 'n_estimators': 2750, 'learning_rate': 0.38575820355326856, 'max_depth': 11, 'min_child_weight': 1, 'subsample': 0.5, 'colsample_bytree': 0.7, 'colsample_bylevel': 0.6, 'reg_alpha': 2.0994772096928942e-05, 'reg_lambda': 2.61421102938098e-06, 'gamma': 6.426007882947346e-05}. Best is trial 148 with value: -0.15198817628036207.
[I 2026-07-14 21:27:30,731] Trial 202 finished with value: -0.10389263724287112 and parameters: {'scalers': 'none', 'ratios': 'norm_ratio', 'imputers': 'mean', 'n_estimators': 2750, 'learning_rate': 0.3562282984692745, 'max_depth': 11, 'min_child_weight': 1, 'subsample': 0.5, 'colsample_bytree': 0.7, 'colsample_bylevel': 0.6, 'reg_alpha': 1.9462991917807604e-05, 'reg_lambda': 2.7107057324670453e-06, 'gamma': 0.0001606368982099702}. Best is trial 148 with value: -0.15198817628036207.
[I 2026-07-14 21:27:46,167] Trial 203 finished with value: -0.11018393711191389 and parameters: {'scalers': 'none', 'ratios': 'norm_ratio', 'imputers': 'mean', 'n_estimators': 2750, 'learning_rate': 0.370662138299893, 'max_depth': 11, 'min_child_weight': 1, 'subsample': 0.5, 'colsample_bytree': 0.7, 'colsample_bylevel': 0.6, 'reg_alpha': 2.009693020314733e-05, 'reg_lambda': 4.768361454389602e-06, 'gamma': 0.00015657128240774486}. Best is trial 148 with value: -0.15198817628036207.
[I 2026-07-14 21:28:01,448] Trial 204 finished with value: -0.11799878491985741 and parameters: {'scalers': 'none', 'ratios': 'norm_ratio', 'imputers': 'mean', 'n_estimators': 2750, 'learning_rate': 0.3884586907762731, 'max_depth': 11, 'min_child_weight': 1, 'subsample': 0.5, 'colsample_bytree': 0.6, 'colsample_bylevel': 0.6, 'reg_alpha': 6.50795779801864e-05, 'reg_lambda': 1.015881741889201e-06, 'gamma': 0.00015861640286222789}. Best is trial 148 with value: -0.15198817628036207.
[I 2026-07-14 21:28:16,764] Trial 205 finished with value: -0.12365587968180489 and parameters: {'scalers': 'none', 'ratios': 'norm_ratio', 'imputers': 'mean', 'n_estimators': 2400, 'learning_rate': 0.3799788554442326, 'max_depth': 12, 'min_child_weight': 1, 'subsample': 0.5, 'colsample_bytree': 0.6, 'colsample_bylevel': 0.6, 'reg_alpha': 6.947009637683715e-05, 'reg_lambda': 1.038252651867957e-06, 'gamma': 0.00015910721281143887}. Best is trial 148 with value: -0.15198817628036207.
[I 2026-07-14 21:28:32,390] Trial 206 finished with value: -0.124439547575127 and parameters: {'scalers': 'none', 'ratios': 'norm_ratio', 'imputers': 'mean', 'n_estimators': 2400, 'learning_rate': 0.4082704882730666, 'max_depth': 12, 'min_child_weight': 1, 'subsample': 0.5, 'colsample_bytree': 0.6, 'colsample_bylevel': 0.6, 'reg_alpha': 5.895412847359525e-05, 'reg_lambda': 1.0091015177662977e-06, 'gamma': 0.00017956615354833633}. Best is trial 148 with value: -0.15198817628036207.
[I 2026-07-14 21:28:50,254] Trial 207 finished with value: -0.11428504989608532 and parameters: {'scalers': 'none', 'ratios': 'norm_ratio', 'imputers': 'mean', 'n_estimators': 2400, 'learning_rate': 0.49967234066733784, 'max_depth': 12, 'min_child_weight': 2, 'subsample': 0.5, 'colsample_bytree': 0.6, 'colsample_bylevel': 0.6, 'reg_alpha': 3.568918372692089e-05, 'reg_lambda': 4.75814588249656e-06, 'gamma': 0.00015134708119729504}. Best is trial 148 with value: -0.15198817628036207.
[I 2026-07-14 21:29:03,774] Trial 208 finished with value: -0.13553870613124733 and parameters: {'scalers': 'none', 'ratios': 'norm_ratio', 'imputers': 'mean', 'n_estimators': 2400, 'learning_rate': 0.4996432890963219, 'max_depth': 11, 'min_child_weight': 1, 'subsample': 0.5, 'colsample_bytree': 0.6, 'colsample_bylevel': 0.6, 'reg_alpha': 5.545738269590369e-05, 'reg_lambda': 4.692399302355119e-06, 'gamma': 7.431629876205078e-05}. Best is trial 148 with value: -0.15198817628036207.
[I 2026-07-14 21:29:17,458] Trial 209 finished with value: -0.1440579634675302 and parameters: {'scalers': 'none', 'ratios': 'norm_ratio', 'imputers': 'mean', 'n_estimators': 2400, 'learning_rate': 0.4976643616333127, 'max_depth': 11, 'min_child_weight': 1, 'subsample': 0.5, 'colsample_bytree': 0.6, 'colsample_bylevel': 0.6, 'reg_alpha': 7.05290943255048e-05, 'reg_lambda': 4.23644672231614e-06, 'gamma': 6.313015807679113e-05}. Best is trial 148 with value: -0.15198817628036207.
[I 2026-07-14 21:29:31,203] Trial 210 finished with value: -0.13876884142200452 and parameters: {'scalers': 'none', 'ratios': 'norm_ratio', 'imputers': 'mean', 'n_estimators': 2400, 'learning_rate': 0.48778269325695, 'max_depth': 11, 'min_child_weight': 1, 'subsample': 0.5, 'colsample_bytree': 0.6, 'colsample_bylevel': 0.6, 'reg_alpha': 3.2386932045145095e-05, 'reg_lambda': 4.429491375555796e-06, 'gamma': 6.609918154967302e-05}. Best is trial 148 with value: -0.15198817628036207.
[I 2026-07-14 21:29:46,850] Trial 211 finished with value: -0.13499599489262698 and parameters: {'scalers': 'none', 'ratios': 'norm_ratio', 'imputers': 'mean', 'n_estimators': 2400, 'learning_rate': 0.43624357485373777, 'max_depth': 12, 'min_child_weight': 1, 'subsample': 0.5, 'colsample_bytree': 0.6, 'colsample_bylevel': 0.6, 'reg_alpha': 6.422681981019456e-05, 'reg_lambda': 4.421954161453352e-06, 'gamma': 6.0604580092921165e-05}. Best is trial 148 with value: -0.15198817628036207.
[I 2026-07-14 21:30:02,948] Trial 212 finished with value: -0.1508339147289703 and parameters: {'scalers': 'none', 'ratios': 'norm_ratio', 'imputers': 'mean', 'n_estimators': 2400, 'learning_rate': 0.49091770113050975, 'max_depth': 12, 'min_child_weight': 1, 'subsample': 0.5, 'colsample_bytree': 0.6, 'colsample_bylevel': 0.6, 'reg_alpha': 6.0423227460558866e-05, 'reg_lambda': 4.027845470654833e-06, 'gamma': 6.520350596032728e-05}. Best is trial 148 with value: -0.15198817628036207.
[I 2026-07-14 21:30:16,585] Trial 213 finished with value: -0.1400051138447131 and parameters: {'scalers': 'none', 'ratios': 'norm_ratio', 'imputers': 'mean', 'n_estimators': 2450, 'learning_rate': 0.48844705347093353, 'max_depth': 11, 'min_child_weight': 1, 'subsample': 0.5, 'colsample_bytree': 0.6, 'colsample_bylevel': 0.6, 'reg_alpha': 0.006272632719491641, 'reg_lambda': 4.458479470279764e-06, 'gamma': 6.124701639640007e-05}. Best is trial 148 with value: -0.15198817628036207.
[I 2026-07-14 21:30:30,484] Trial 214 finished with value: -0.13878053829285417 and parameters: {'scalers': 'none', 'ratios': 'norm_ratio', 'imputers': 'mean', 'n_estimators': 2450, 'learning_rate': 0.4886254331820964, 'max_depth': 11, 'min_child_weight': 1, 'subsample': 0.5, 'colsample_bytree': 0.6, 'colsample_bylevel': 0.6, 'reg_alpha': 3.352055273683726e-05, 'reg_lambda': 4.574076168677504e-06, 'gamma': 5.9253239622026584e-05}. Best is trial 148 with value: -0.15198817628036207.
[I 2026-07-14 21:30:44,530] Trial 215 finished with value: -0.13710391708871644 and parameters: {'scalers': 'none', 'ratios': 'norm_ratio', 'imputers': 'mean', 'n_estimators': 2450, 'learning_rate': 0.49434081034703, 'max_depth': 11, 'min_child_weight': 1, 'subsample': 0.5, 'colsample_bytree': 0.7, 'colsample_bylevel': 0.6, 'reg_alpha': 3.2106776056865804e-05, 'reg_lambda': 7.779398239090665e-06, 'gamma': 6.361034687880705e-05}. Best is trial 148 with value: -0.15198817628036207.
[I 2026-07-14 21:30:57,302] Trial 216 finished with value: -0.12353828026006565 and parameters: {'scalers': 'none', 'ratios': 'norm_ratio', 'imputers': 'mean', 'n_estimators': 2300, 'learning_rate': 0.43574615161162344, 'max_depth': 11, 'min_child_weight': 1, 'subsample': 0.5, 'colsample_bytree': 0.6, 'colsample_bylevel': 0.6, 'reg_alpha': 3.0685444500230936e-05, 'reg_lambda': 8.01406180332973e-06, 'gamma': 6.665541531354033e-05}. Best is trial 148 with value: -0.15198817628036207.
[I 2026-07-14 21:31:12,015] Trial 217 finished with value: -0.14123511559220078 and parameters: {'scalers': 'none', 'ratios': 'norm_ratio', 'imputers': 'mean', 'n_estimators': 2600, 'learning_rate': 0.4983389933747144, 'max_depth': 11, 'min_child_weight': 1, 'subsample': 0.5, 'colsample_bytree': 0.6, 'colsample_bylevel': 0.6, 'reg_alpha': 3.290554973988898e-05, 'reg_lambda': 8.176251003285828e-06, 'gamma': 6.347496695798168e-05}. Best is trial 148 with value: -0.15198817628036207.
[I 2026-07-14 21:31:24,689] Trial 218 finished with value: -0.1396044577738928 and parameters: {'scalers': 'none', 'ratios': 'norm_ratio', 'imputers': 'mean', 'n_estimators': 2300, 'learning_rate': 0.4950075475234938, 'max_depth': 11, 'min_child_weight': 1, 'subsample': 0.5, 'colsample_bytree': 0.6, 'colsample_bylevel': 0.6, 'reg_alpha': 3.1584703914791433e-05, 'reg_lambda': 8.203930127974674e-06, 'gamma': 6.356579066550069e-05}. Best is trial 148 with value: -0.15198817628036207.
[I 2026-07-14 21:31:40,059] Trial 219 finished with value: -0.13374991899014982 and parameters: {'scalers': 'none', 'ratios': 'norm_ratio', 'imputers': 'mean', 'n_estimators': 2300, 'learning_rate': 0.4311010108373481, 'max_depth': 12, 'min_child_weight': 1, 'subsample': 0.5, 'colsample_bytree': 0.6, 'colsample_bylevel': 0.6, 'reg_alpha': 3.037460986715942e-05, 'reg_lambda': 8.075735238973294e-06, 'gamma': 6.0461566821885004e-05}. Best is trial 148 with value: -0.15198817628036207.
[I 2026-07-14 21:31:55,266] Trial 220 finished with value: -0.13405067921248803 and parameters: {'scalers': 'none', 'ratios': 'norm_ratio', 'imputers': 'mean', 'n_estimators': 2300, 'learning_rate': 0.4321681967922143, 'max_depth': 12, 'min_child_weight': 1, 'subsample': 0.5, 'colsample_bytree': 0.6, 'colsample_bylevel': 0.6, 'reg_alpha': 3.217453562656915e-05, 'reg_lambda': 7.84837753062274e-06, 'gamma': 6.508082988116816e-05}. Best is trial 148 with value: -0.15198817628036207.
[I 2026-07-14 21:32:10,598] Trial 221 finished with value: -0.1359326982619522 and parameters: {'scalers': 'none', 'ratios': 'norm_ratio', 'imputers': 'mean', 'n_estimators': 2300, 'learning_rate': 0.4376646764989898, 'max_depth': 12, 'min_child_weight': 1, 'subsample': 0.5, 'colsample_bytree': 0.6, 'colsample_bylevel': 0.6, 'reg_alpha': 0.014675551215721727, 'reg_lambda': 9.190004657400374e-06, 'gamma': 6.203950435622603e-05}. Best is trial 148 with value: -0.15198817628036207.
[I 2026-07-14 21:32:23,199] Trial 222 finished with value: -0.12494533594380411 and parameters: {'scalers': 'none', 'ratios': 'norm_ratio', 'imputers': 'mean', 'n_estimators': 2300, 'learning_rate': 0.42880208583087526, 'max_depth': 11, 'min_child_weight': 1, 'subsample': 0.5, 'colsample_bytree': 0.6, 'colsample_bylevel': 0.6, 'reg_alpha': 3.361546479536679e-05, 'reg_lambda': 7.790123585832369e-06, 'gamma': 7.93753354489244e-05}. Best is trial 148 with value: -0.15198817628036207.
[I 2026-07-14 21:32:38,910] Trial 223 finished with value: -0.13394214606379556 and parameters: {'scalers': 'none', 'ratios': 'norm_ratio', 'imputers': 'mean', 'n_estimators': 2300, 'learning_rate': 0.4278457801177243, 'max_depth': 12, 'min_child_weight': 1, 'subsample': 0.5, 'colsample_bytree': 0.6, 'colsample_bylevel': 0.6, 'reg_alpha': 0.02611153595648772, 'reg_lambda': 7.421671670773808e-06, 'gamma': 7.154423612016738e-05}. Best is trial 148 with value: -0.15198817628036207.
[I 2026-07-14 21:32:54,011] Trial 224 finished with value: -0.13080938081355775 and parameters: {'scalers': 'none', 'ratios': 'norm_ratio', 'imputers': 'mean', 'n_estimators': 2300, 'learning_rate': 0.4275852637544181, 'max_depth': 12, 'min_child_weight': 1, 'subsample': 0.5, 'colsample_bytree': 0.6, 'colsample_bylevel': 0.6, 'reg_alpha': 0.004827168449183984, 'reg_lambda': 7.650758429543569e-06, 'gamma': 4.46532582886416e-05}. Best is trial 148 with value: -0.15198817628036207.
