[I 2026-07-14 22:09:13,479] Trial 182 finished with value: -2.6750613436671236 and parameters: {'scalers': 'robust', 'ratios': 'norm_ratio', 'imputers': 'mean', 'n_estimators': 2600, 'learning_rate': 0.26887225924620295, 'max_depth': 9, 'min_child_weight': 1, 'subsample': 0.9, 'colsample_bytree': 0.6, 'colsample_bylevel': 1.0, 'reg_alpha': 1.6800415492556737, 'reg_lambda': 44.73045174354412, 'gamma': 0.00011656426462989687}. Best is trial 118 with value: -3.8937345256538665.
[I 2026-07-14 22:09:31,013] Trial 183 finished with value: -1.8761611239057514 and parameters: {'scalers': 'robust', 'ratios': 'norm_ratio', 'imputers': 'none', 'n_estimators': 2600, 'learning_rate': 0.2655080532262989, 'max_depth': 9, 'min_child_weight': 2, 'subsample': 0.9, 'colsample_bytree': 0.5, 'colsample_bylevel': 1.0, 'reg_alpha': 2.3057645286670416, 'reg_lambda': 2.2429558043309906e-06, 'gamma': 0.00011130757919788275}. Best is trial 118 with value: -3.8937345256538665.
[I 2026-07-14 22:09:52,839] Trial 184 finished with value: -1.969872822235301 and parameters: {'scalers': 'robust', 'ratios': 'norm_ratio', 'imputers': 'none', 'n_estimators': 2650, 'learning_rate': 0.2739044459996042, 'max_depth': 9, 'min_child_weight': 2, 'subsample': 0.9, 'colsample_bytree': 0.6, 'colsample_bylevel': 1.0, 'reg_alpha': 1.9149569449840442, 'reg_lambda': 24.030500233626135, 'gamma': 0.0001083418903617968}. Best is trial 118 with value: -3.8937345256538665.
[I 2026-07-14 22:10:10,922] Trial 185 finished with value: -1.634886549329875 and parameters: {'scalers': 'robust', 'ratios': 'norm_ratio', 'imputers': 'none', 'n_estimators': 2650, 'learning_rate': 0.28116520908105763, 'max_depth': 7, 'min_child_weight': 1, 'subsample': 0.9, 'colsample_bytree': 0.6, 'colsample_bylevel': 1.0, 'reg_alpha': 2.2901274986207216, 'reg_lambda': 50.32977239492894, 'gamma': 0.00015528553280902023}. Best is trial 118 with value: -3.8937345256538665.
[I 2026-07-14 22:10:28,618] Trial 186 finished with value: -1.6445584782326592 and parameters: {'scalers': 'robust', 'ratios': 'norm_ratio', 'imputers': 'none', 'n_estimators': 2650, 'learning_rate': 0.2691650048707472, 'max_depth': 9, 'min_child_weight': 2, 'subsample': 0.9, 'colsample_bytree': 0.6, 'colsample_bylevel': 1.0, 'reg_alpha': 3.2362179863932057, 'reg_lambda': 25.936216387965207, 'gamma': 7.470189341795732e-05}. Best is trial 118 with value: -3.8937345256538665.
[I 2026-07-14 22:10:49,326] Trial 187 finished with value: -1.8556051272368577 and parameters: {'scalers': 'robust', 'ratios': 'norm_ratio', 'imputers': 'none', 'n_estimators': 2700, 'learning_rate': 0.2613440550501745, 'max_depth': 9, 'min_child_weight': 2, 'subsample': 0.9, 'colsample_bytree': 0.6, 'colsample_bylevel': 1.0, 'reg_alpha': 2.580999109336447, 'reg_lambda': 2.9293639353111864e-06, 'gamma': 7.282706698504662e-05}. Best is trial 118 with value: -3.8937345256538665.
[I 2026-07-14 22:11:19,421] Trial 188 finished with value: -3.8580555080920007 and parameters: {'scalers': 'robust', 'ratios': 'norm_ratio', 'imputers': 'none', 'n_estimators': 2700, 'learning_rate': 0.48825981301228566, 'max_depth': 9, 'min_child_weight': 1, 'subsample': 0.9, 'colsample_bytree': 0.6, 'colsample_bylevel': 1.0, 'reg_alpha': 0.5255310620472886, 'reg_lambda': 23.760964904589976, 'gamma': 0.00016353414245527488}. Best is trial 118 with value: -3.8937345256538665.
[I 2026-07-14 22:11:47,860] Trial 189 finished with value: -3.071870305889228 and parameters: {'scalers': 'robust', 'ratios': 'norm_ratio', 'imputers': 'none', 'n_estimators': 2700, 'learning_rate': 0.3381788559260149, 'max_depth': 9, 'min_child_weight': 1, 'subsample': 0.9, 'colsample_bytree': 0.6, 'colsample_bylevel': 1.0, 'reg_alpha': 0.5655323981242101, 'reg_lambda': 8.207480738271709, 'gamma': 0.00019142033222177806}. Best is trial 118 with value: -3.8937345256538665.
[I 2026-07-14 22:12:18,137] Trial 190 finished with value: -3.848614917552112 and parameters: {'scalers': 'robust', 'ratios': 'norm_ratio', 'imputers': 'none', 'n_estimators': 2700, 'learning_rate': 0.48793365219156754, 'max_depth': 9, 'min_child_weight': 1, 'subsample': 0.9, 'colsample_bytree': 0.6, 'colsample_bylevel': 1.0, 'reg_alpha': 0.510175697484576, 'reg_lambda': 21.225903581472547, 'gamma': 6.908304209489983e-05}. Best is trial 118 with value: -3.8937345256538665.
[I 2026-07-14 22:12:38,948] Trial 191 finished with value: -0.5645127123688947 and parameters: {'scalers': 'robust', 'ratios': 'norm_ratio', 'imputers': 'none', 'n_estimators': 2650, 'learning_rate': 0.0017939945663757284, 'max_depth': 7, 'min_child_weight': 1, 'subsample': 0.9, 'colsample_bytree': 0.6, 'colsample_bylevel': 1.0, 'reg_alpha': 0.5121392942599086, 'reg_lambda': 23.946807468154045, 'gamma': 7.043577255099419e-05}. Best is trial 118 with value: -3.8937345256538665.
[I 2026-07-14 22:12:57,573] Trial 192 finished with value: -2.553493450582483 and parameters: {'scalers': 'robust', 'ratios': 'norm_ratio', 'imputers': 'none', 'n_estimators': 2700, 'learning_rate': 0.32941234011054804, 'max_depth': 7, 'min_child_weight': 1, 'subsample': 0.9, 'colsample_bytree': 0.6, 'colsample_bylevel': 1.0, 'reg_alpha': 0.5231668156448563, 'reg_lambda': 8.710069264505824, 'gamma': 0.00021162442523295927}. Best is trial 118 with value: -3.8937345256538665.
[I 2026-07-14 22:13:27,480] Trial 193 finished with value: -3.6739086722166543 and parameters: {'scalers': 'robust', 'ratios': 'log_ratio', 'imputers': 'none', 'n_estimators': 2750, 'learning_rate': 0.4973428253854744, 'max_depth': 9, 'min_child_weight': 1, 'subsample': 0.9, 'colsample_bytree': 0.6, 'colsample_bylevel': 1.0, 'reg_alpha': 0.5576147186325572, 'reg_lambda': 7.949273843472529, 'gamma': 7.428265846803232e-05}. Best is trial 118 with value: -3.8937345256538665.
[I 2026-07-14 22:13:56,706] Trial 194 finished with value: -3.651669502298219 and parameters: {'scalers': 'standard', 'ratios': 'norm_ratio', 'imputers': 'none', 'n_estimators': 2750, 'learning_rate': 0.4873938911988978, 'max_depth': 9, 'min_child_weight': 1, 'subsample': 0.9, 'colsample_bytree': 0.6, 'colsample_bylevel': 1.0, 'reg_alpha': 0.5617513434580369, 'reg_lambda': 8.922966393637491, 'gamma': 0.00021331976914010814}. Best is trial 118 with value: -3.8937345256538665.
[I 2026-07-14 22:14:25,560] Trial 195 finished with value: -3.629601430177039 and parameters: {'scalers': 'standard', 'ratios': 'log_ratio', 'imputers': 'none', 'n_estimators': 2700, 'learning_rate': 0.48210568806016074, 'max_depth': 9, 'min_child_weight': 1, 'subsample': 0.9, 'colsample_bytree': 0.6, 'colsample_bylevel': 1.0, 'reg_alpha': 0.498289280720315, 'reg_lambda': 9.08313757844153, 'gamma': 0.00021619867092348622}. Best is trial 118 with value: -3.8937345256538665.
[I 2026-07-14 22:14:46,200] Trial 196 finished with value: -2.932356528104151 and parameters: {'scalers': 'standard', 'ratios': 'norm_ratio', 'imputers': 'none', 'n_estimators': 2550, 'learning_rate': 0.48791211170953536, 'max_depth': 9, 'min_child_weight': 1, 'subsample': 0.9, 'colsample_bytree': 0.6, 'colsample_bylevel': 1.0, 'reg_alpha': 0.5001088909604015, 'reg_lambda': 0.0006963511534303546, 'gamma': 0.0001788736449044173}. Best is trial 118 with value: -3.8937345256538665.
[I 2026-07-14 22:15:17,165] Trial 197 finished with value: -3.1573875731905856 and parameters: {'scalers': 'standard', 'ratios': 'log_ratio', 'imputers': 'none', 'n_estimators': 2800, 'learning_rate': 0.336882221909052, 'max_depth': 9, 'min_child_weight': 1, 'subsample': 0.9, 'colsample_bytree': 0.6, 'colsample_bylevel': 1.0, 'reg_alpha': 0.9181020300019065, 'reg_lambda': 8.19258445026861, 'gamma': 0.0001914008582491269}. Best is trial 118 with value: -3.8937345256538665.
[I 2026-07-14 22:15:48,060] Trial 198 finished with value: -3.924939921982219 and parameters: {'scalers': 'robust', 'ratios': 'log_ratio', 'imputers': 'none', 'n_estimators': 2800, 'learning_rate': 0.487225589308873, 'max_depth': 9, 'min_child_weight': 1, 'subsample': 0.9, 'colsample_bytree': 0.6, 'colsample_bylevel': 1.0, 'reg_alpha': 0.5365897172022531, 'reg_lambda': 18.612939644558985, 'gamma': 0.00020631685741998238}. Best is trial 198 with value: -3.924939921982219.
[I 2026-07-14 22:16:19,982] Trial 199 finished with value: -3.8582769112602655 and parameters: {'scalers': 'standard', 'ratios': 'log_ratio', 'imputers': 'none', 'n_estimators': 2800, 'learning_rate': 0.4870086215525029, 'max_depth': 9, 'min_child_weight': 1, 'subsample': 0.9, 'colsample_bytree': 0.6, 'colsample_bylevel': 1.0, 'reg_alpha': 0.925711064491771, 'reg_lambda': 16.83380013245618, 'gamma': 0.00020223949927255456}. Best is trial 198 with value: -3.924939921982219.
[I 2026-07-14 22:16:51,900] Trial 200 finished with value: -3.808841051286259 and parameters: {'scalers': 'standard', 'ratios': 'norm_ratio', 'imputers': 'none', 'n_estimators': 2800, 'learning_rate': 0.4831664157485885, 'max_depth': 9, 'min_child_weight': 1, 'subsample': 0.9, 'colsample_bytree': 0.6, 'colsample_bylevel': 1.0, 'reg_alpha': 0.9458843918635098, 'reg_lambda': 16.291049318171186, 'gamma': 0.00028716935319220675}. Best is trial 198 with value: -3.924939921982219.
[I 2026-07-14 22:17:13,616] Trial 201 finished with value: -1.202506818659417 and parameters: {'scalers': 'robust', 'ratios': 'log_ratio', 'imputers': 'none', 'n_estimators': 2800, 'learning_rate': 0.49227501335669277, 'max_depth': 9, 'min_child_weight': 10, 'subsample': 0.9, 'colsample_bytree': 0.6, 'colsample_bylevel': 1.0, 'reg_alpha': 0.9548968199665208, 'reg_lambda': 16.348483310927737, 'gamma': 3.213447027146183e-05}. Best is trial 198 with value: -3.924939921982219.
[I 2026-07-14 22:17:45,374] Trial 202 finished with value: -3.602101507353947 and parameters: {'scalers': 'standard', 'ratios': 'norm_ratio', 'imputers': 'none', 'n_estimators': 2850, 'learning_rate': 0.4167241815143659, 'max_depth': 9, 'min_child_weight': 1, 'subsample': 0.9, 'colsample_bytree': 0.6, 'colsample_bylevel': 1.0, 'reg_alpha': 0.55948124501553, 'reg_lambda': 18.049213305018203, 'gamma': 0.0002839040751884407}. Best is trial 198 with value: -3.924939921982219.
[I 2026-07-14 22:18:16,080] Trial 203 finished with value: -3.861076496199831 and parameters: {'scalers': 'standard', 'ratios': 'log_ratio', 'imputers': 'none', 'n_estimators': 2800, 'learning_rate': 0.49332581521261104, 'max_depth': 9, 'min_child_weight': 1, 'subsample': 0.9, 'colsample_bytree': 0.6, 'colsample_bylevel': 1.0, 'reg_alpha': 0.5276593257835641, 'reg_lambda': 16.009494089837496, 'gamma': 0.00023731621788942664}. Best is trial 198 with value: -3.924939921982219.
[I 2026-07-14 22:18:48,738] Trial 204 finished with value: -3.922951666648607 and parameters: {'scalers': 'standard', 'ratios': 'log_ratio', 'imputers': 'none', 'n_estimators': 2850, 'learning_rate': 0.4892048128788402, 'max_depth': 9, 'min_child_weight': 1, 'subsample': 0.9, 'colsample_bytree': 0.6, 'colsample_bylevel': 1.0, 'reg_alpha': 0.8858884461148072, 'reg_lambda': 8.304972453020376, 'gamma': 0.00029722773625853223}. Best is trial 198 with value: -3.924939921982219.
[I 2026-07-14 22:19:12,994] Trial 205 finished with value: -0.8627630621508227 and parameters: {'scalers': 'standard', 'ratios': 'log_ratio', 'imputers': 'none', 'n_estimators': 2800, 'learning_rate': 0.01073614978034585, 'max_depth': 9, 'min_child_weight': 1, 'subsample': 0.9, 'colsample_bytree': 0.6, 'colsample_bylevel': 1.0, 'reg_alpha': 0.3240761001885206, 'reg_lambda': 15.347992843170333, 'gamma': 3.435306932006294e-05}. Best is trial 198 with value: -3.924939921982219.
[I 2026-07-14 22:19:41,785] Trial 206 finished with value: -3.1146447574163494 and parameters: {'scalers': 'standard', 'ratios': 'log_ratio', 'imputers': 'none', 'n_estimators': 2800, 'learning_rate': 0.3250131431319525, 'max_depth': 9, 'min_child_weight': 1, 'subsample': 0.9, 'colsample_bytree': 0.6, 'colsample_bylevel': 1.0, 'reg_alpha': 0.36813239410632, 'reg_lambda': 13.604947267716085, 'gamma': 0.00022233736559134143}. Best is trial 198 with value: -3.924939921982219.
[I 2026-07-14 22:20:12,002] Trial 207 finished with value: -3.8114945566503113 and parameters: {'scalers': 'standard', 'ratios': 'log_ratio', 'imputers': 'none', 'n_estimators': 2850, 'learning_rate': 0.49986749720676854, 'max_depth': 9, 'min_child_weight': 1, 'subsample': 0.9, 'colsample_bytree': 0.6, 'colsample_bylevel': 1.0, 'reg_alpha': 0.33560293575841593, 'reg_lambda': 17.62541446914074, 'gamma': 0.00031257343573703247}. Best is trial 198 with value: -3.924939921982219.
[I 2026-07-14 22:20:45,258] Trial 208 finished with value: -3.877438064541279 and parameters: {'scalers': 'standard', 'ratios': 'log_ratio', 'imputers': 'none', 'n_estimators': 2850, 'learning_rate': 0.497687965858952, 'max_depth': 9, 'min_child_weight': 1, 'subsample': 0.9, 'colsample_bytree': 0.6, 'colsample_bylevel': 1.0, 'reg_alpha': 0.8797038758265503, 'reg_lambda': 15.405580315333417, 'gamma': 0.00027449645318792853}. Best is trial 198 with value: -3.924939921982219.
[I 2026-07-14 22:21:15,062] Trial 209 finished with value: -3.4654356891369393 and parameters: {'scalers': 'standard', 'ratios': 'log_ratio', 'imputers': 'none', 'n_estimators': 2900, 'learning_rate': 0.41829577363803927, 'max_depth': 9, 'min_child_weight': 1, 'subsample': 0.9, 'colsample_bytree': 0.6, 'colsample_bylevel': 1.0, 'reg_alpha': 0.3425691539987172, 'reg_lambda': 13.340530059787222, 'gamma': 0.0002762260237492262}. Best is trial 198 with value: -3.924939921982219.
[I 2026-07-14 22:21:45,745] Trial 210 finished with value: -3.32217729676876 and parameters: {'scalers': 'standard', 'ratios': 'log_ratio', 'imputers': 'none', 'n_estimators': 2900, 'learning_rate': 0.4092431561415588, 'max_depth': 9, 'min_child_weight': 1, 'subsample': 0.9, 'colsample_bytree': 0.6, 'colsample_bylevel': 1.0, 'reg_alpha': 0.3231544878431048, 'reg_lambda': 15.138848659167163, 'gamma': 0.00031128749824648865}. Best is trial 198 with value: -3.924939921982219.
[I 2026-07-14 22:22:16,523] Trial 211 finished with value: -3.4545492646902565 and parameters: {'scalers': 'standard', 'ratios': 'log_ratio', 'imputers': 'none', 'n_estimators': 2900, 'learning_rate': 0.4054587357761253, 'max_depth': 9, 'min_child_weight': 1, 'subsample': 0.9, 'colsample_bytree': 0.6, 'colsample_bylevel': 1.0, 'reg_alpha': 0.3523381011818116, 'reg_lambda': 18.31710107773307, 'gamma': 0.0003038619614813984}. Best is trial 198 with value: -3.924939921982219.
[I 2026-07-14 22:22:46,711] Trial 212 finished with value: -3.401257338784687 and parameters: {'scalers': 'standard', 'ratios': 'log_ratio', 'imputers': 'none', 'n_estimators': 2900, 'learning_rate': 0.40862785922572054, 'max_depth': 9, 'min_child_weight': 1, 'subsample': 0.9, 'colsample_bytree': 0.6, 'colsample_bylevel': 1.0, 'reg_alpha': 0.34463512089212767, 'reg_lambda': 14.209813032196182, 'gamma': 0.00024561164503772643}. Best is trial 198 with value: -3.924939921982219.
[I 2026-07-14 22:23:16,308] Trial 213 finished with value: -3.5109962947804876 and parameters: {'scalers': 'standard', 'ratios': 'log_ratio', 'imputers': 'none', 'n_estimators': 2850, 'learning_rate': 0.4130207435430226, 'max_depth': 9, 'min_child_weight': 1, 'subsample': 0.9, 'colsample_bytree': 0.6, 'colsample_bylevel': 1.0, 'reg_alpha': 0.37173464609131585, 'reg_lambda': 14.721196755259447, 'gamma': 0.00031436694885767907}. Best is trial 198 with value: -3.924939921982219.
[I 2026-07-14 22:23:48,434] Trial 214 finished with value: -3.6583592184882248 and parameters: {'scalers': 'standard', 'ratios': 'log_ratio', 'imputers': 'none', 'n_estimators': 2900, 'learning_rate': 0.4241549997521811, 'max_depth': 9, 'min_child_weight': 1, 'subsample': 0.9, 'colsample_bytree': 0.6, 'colsample_bylevel': 1.0, 'reg_alpha': 0.5743630622356447, 'reg_lambda': 18.86835243726483, 'gamma': 0.00031787646187078167}. Best is trial 198 with value: -3.924939921982219.
[I 2026-07-14 22:24:20,602] Trial 215 finished with value: -3.584762214230442 and parameters: {'scalers': 'standard', 'ratios': 'log_ratio', 'imputers': 'none', 'n_estimators': 2900, 'learning_rate': 0.42874809302960204, 'max_depth': 9, 'min_child_weight': 1, 'subsample': 0.9, 'colsample_bytree': 0.6, 'colsample_bylevel': 1.0, 'reg_alpha': 0.5503182891916083, 'reg_lambda': 21.6569813298757, 'gamma': 0.0003146806751886126}. Best is trial 198 with value: -3.924939921982219.
[I 2026-07-14 22:24:51,102] Trial 216 finished with value: -3.416293920304939 and parameters: {'scalers': 'standard', 'ratios': 'log_ratio', 'imputers': 'none', 'n_estimators': 2900, 'learning_rate': 0.41538799897960715, 'max_depth': 9, 'min_child_weight': 1, 'subsample': 0.9, 'colsample_bytree': 0.6, 'colsample_bylevel': 1.0, 'reg_alpha': 0.3295536846311681, 'reg_lambda': 18.46959291466272, 'gamma': 0.00032091738997160394}. Best is trial 198 with value: -3.924939921982219.
[I 2026-07-14 22:25:22,011] Trial 217 finished with value: -3.5082708015848474 and parameters: {'scalers': 'standard', 'ratios': 'log_ratio', 'imputers': 'none', 'n_estimators': 2900, 'learning_rate': 0.41874582162525564, 'max_depth': 9, 'min_child_weight': 1, 'subsample': 0.9, 'colsample_bytree': 0.6, 'colsample_bylevel': 1.0, 'reg_alpha': 0.32479437187801713, 'reg_lambda': 18.23142250384094, 'gamma': 0.00029330629937903297}. Best is trial 198 with value: -3.924939921982219.
[I 2026-07-14 22:25:54,105] Trial 218 finished with value: -3.7858476009130113 and parameters: {'scalers': 'standard', 'ratios': 'log_ratio', 'imputers': 'none', 'n_estimators': 2950, 'learning_rate': 0.49839019350478075, 'max_depth': 9, 'min_child_weight': 1, 'subsample': 0.9, 'colsample_bytree': 0.6, 'colsample_bylevel': 1.0, 'reg_alpha': 0.5391095285698471, 'reg_lambda': 12.394501710940048, 'gamma': 0.0002641693958225177}. Best is trial 198 with value: -3.924939921982219.
[I 2026-07-14 22:26:25,932] Trial 219 finished with value: -3.9061158951306885 and parameters: {'scalers': 'standard', 'ratios': 'log_ratio', 'imputers': 'none', 'n_estimators': 2950, 'learning_rate': 0.4934575034182095, 'max_depth': 9, 'min_child_weight': 1, 'subsample': 0.9, 'colsample_bytree': 0.6, 'colsample_bylevel': 1.0, 'reg_alpha': 0.3308641991234943, 'reg_lambda': 19.01210643480354, 'gamma': 0.0003183551181581436}. Best is trial 198 with value: -3.924939921982219.
[I 2026-07-14 22:26:59,081] Trial 220 finished with value: -3.669906374602811 and parameters: {'scalers': 'standard', 'ratios': 'log_ratio', 'imputers': 'none', 'n_estimators': 3000, 'learning_rate': 0.4290361272050651, 'max_depth': 9, 'min_child_weight': 1, 'subsample': 0.9, 'colsample_bytree': 0.6, 'colsample_bylevel': 1.0, 'reg_alpha': 0.5349838346885216, 'reg_lambda': 19.789285273083753, 'gamma': 0.0006594093371449328}. Best is trial 198 with value: -3.924939921982219.
[I 2026-07-14 22:27:29,863] Trial 221 finished with value: -3.618243517166745 and parameters: {'scalers': 'standard', 'ratios': 'log_ratio', 'imputers': 'none', 'n_estimators': 3000, 'learning_rate': 0.42317433418847245, 'max_depth': 9, 'min_child_weight': 1, 'subsample': 0.9, 'colsample_bytree': 0.6, 'colsample_bylevel': 1.0, 'reg_alpha': 0.17534070469047142, 'reg_lambda': 18.633663491411422, 'gamma': 0.000640471195047388}. Best is trial 198 with value: -3.924939921982219.
[I 2026-07-14 22:28:01,693] Trial 222 finished with value: -3.9883666064666987 and parameters: {'scalers': 'standard', 'ratios': 'log_ratio', 'imputers': 'none', 'n_estimators': 2850, 'learning_rate': 0.4999542682683493, 'max_depth': 9, 'min_child_weight': 1, 'subsample': 0.9, 'colsample_bytree': 0.6, 'colsample_bylevel': 1.0, 'reg_alpha': 0.5032688177562641, 'reg_lambda': 19.79558894978522, 'gamma': 0.0006507787503094069}. Best is trial 222 with value: -3.9883666064666987.
[I 2026-07-14 22:28:34,351] Trial 223 finished with value: -3.622998121882725 and parameters: {'scalers': 'standard', 'ratios': 'log_ratio', 'imputers': 'none', 'n_estimators': 2950, 'learning_rate': 0.4343939985616778, 'max_depth': 9, 'min_child_weight': 1, 'subsample': 0.9, 'colsample_bytree': 0.6, 'colsample_bylevel': 1.0, 'reg_alpha': 0.5294592433973577, 'reg_lambda': 20.55980122198588, 'gamma': 0.0002697577896087731}. Best is trial 222 with value: -3.9883666064666987.
[I 2026-07-14 22:29:07,376] Trial 224 finished with value: -3.845487023511857 and parameters: {'scalers': 'standard', 'ratios': 'log_ratio', 'imputers': 'none', 'n_estimators': 2950, 'learning_rate': 0.4869651077008327, 'max_depth': 9, 'min_child_weight': 1, 'subsample': 0.9, 'colsample_bytree': 0.6, 'colsample_bylevel': 1.0, 'reg_alpha': 0.5844015468496639, 'reg_lambda': 11.40631414985647, 'gamma': 0.0006613260121064009}. Best is trial 222 with value: -3.9883666064666987.
[I 2026-07-14 22:29:39,563] Trial 225 finished with value: -3.7357236070413244 and parameters: {'scalers': 'standard', 'ratios': 'log_ratio', 'imputers': 'none', 'n_estimators': 2950, 'learning_rate': 0.49385589505732624, 'max_depth': 9, 'min_child_weight': 1, 'subsample': 0.9, 'colsample_bytree': 0.6, 'colsample_bylevel': 1.0, 'reg_alpha': 0.6011284057060122, 'reg_lambda': 11.96901345222812, 'gamma': 0.0003016773945360005}. Best is trial 222 with value: -3.9883666064666987.
[I 2026-07-14 22:30:12,208] Trial 226 finished with value: -3.8343461815305466 and parameters: {'scalers': 'standard', 'ratios': 'log_ratio', 'imputers': 'none', 'n_estimators': 3000, 'learning_rate': 0.4975620231887701, 'max_depth': 9, 'min_child_weight': 1, 'subsample': 0.9, 'colsample_bytree': 0.6, 'colsample_bylevel': 1.0, 'reg_alpha': 0.5360520742405162, 'reg_lambda': 11.211917432466906, 'gamma': 0.0006540790181958077}. Best is trial 222 with value: -3.9883666064666987.
