[I 2026-07-14 17:05:28,152] Trial 90 finished with value: -0.22849658356579208 and parameters: {'scalers': 'robust', 'ratios': 'log_ratio', 'imputers': 'none', 'n_estimators': 2450, 'learning_rate': 0.030200781225106187, 'max_depth': 12, 'min_child_weight': 2, 'subsample': 0.7, 'colsample_bytree': 0.5, 'colsample_bylevel': 1.0, 'reg_alpha': 8.951714264544404e-05, 'reg_lambda': 74.00057481499132, 'gamma': 2.8088990117563807e-05}. Best is trial 69 with value: -0.4521014866703406.
[I 2026-07-14 17:06:21,407] Trial 91 finished with value: -0.36614545777254304 and parameters: {'scalers': 'robust', 'ratios': 'log_ratio', 'imputers': 'none', 'n_estimators': 2550, 'learning_rate': 0.35777123307669906, 'max_depth': 12, 'min_child_weight': 2, 'subsample': 0.7, 'colsample_bytree': 0.5, 'colsample_bylevel': 1.0, 'reg_alpha': 9.919301469419467e-05, 'reg_lambda': 93.74649316356405, 'gamma': 0.008243459778004612}. Best is trial 69 with value: -0.4521014866703406.
[I 2026-07-14 17:07:34,702] Trial 92 finished with value: -0.22364412995751579 and parameters: {'scalers': 'robust', 'ratios': 'log_ratio', 'imputers': 'none', 'n_estimators': 2500, 'learning_rate': 0.023641834911933987, 'max_depth': 12, 'min_child_weight': 2, 'subsample': 0.7, 'colsample_bytree': 0.7, 'colsample_bylevel': 1.0, 'reg_alpha': 5.708525977521992e-05, 'reg_lambda': 41.927014648683915, 'gamma': 2.210459444854737e-05}. Best is trial 69 with value: -0.4521014866703406.
[I 2026-07-14 17:07:40,050] Trial 93 finished with value: -0.17999515461236226 and parameters: {'scalers': 'robust', 'ratios': 'log_ratio', 'imputers': 'none', 'n_estimators': 2500, 'learning_rate': 0.3538989726924788, 'max_depth': 12, 'min_child_weight': 2, 'subsample': 0.7, 'colsample_bytree': 0.7, 'colsample_bylevel': 1.0, 'reg_alpha': 23.174871236548228, 'reg_lambda': 92.49214920801933, 'gamma': 2.5384468755993554e-05}. Best is trial 69 with value: -0.4521014866703406.
[I 2026-07-14 17:07:43,867] Trial 94 finished with value: -0.17120599054790317 and parameters: {'scalers': 'robust', 'ratios': 'log_ratio', 'imputers': 'none', 'n_estimators': 2500, 'learning_rate': 0.027350038197981427, 'max_depth': 12, 'min_child_weight': 1, 'subsample': 0.7, 'colsample_bytree': 0.7, 'colsample_bylevel': 0.9, 'reg_alpha': 39.87263249515917, 'reg_lambda': 1.7919229697270593, 'gamma': 0.0014823446668603593}. Best is trial 69 with value: -0.4521014866703406.
[I 2026-07-14 17:09:05,582] Trial 95 finished with value: -0.25011444459879145 and parameters: {'scalers': 'robust', 'ratios': 'log_ratio', 'imputers': 'none', 'n_estimators': 2550, 'learning_rate': 0.03423580002895402, 'max_depth': 12, 'min_child_weight': 1, 'subsample': 0.7, 'colsample_bytree': 0.7, 'colsample_bylevel': 1.0, 'reg_alpha': 4.250805187698661e-05, 'reg_lambda': 7.958240764661571, 'gamma': 0.00025915249225937217}. Best is trial 69 with value: -0.4521014866703406.
[I 2026-07-14 17:09:08,998] Trial 96 finished with value: -0.1683485676401995 and parameters: {'scalers': 'robust', 'ratios': 'log_ratio', 'imputers': 'none', 'n_estimators': 1700, 'learning_rate': 0.0344569637301339, 'max_depth': 12, 'min_child_weight': 1, 'subsample': 0.7, 'colsample_bytree': 0.7, 'colsample_bylevel': 1.0, 'reg_alpha': 29.297389454887366, 'reg_lambda': 10.240765262862325, 'gamma': 0.0016469576579543406}. Best is trial 69 with value: -0.4521014866703406.
[I 2026-07-14 17:09:54,981] Trial 97 finished with value: -0.3729698483295074 and parameters: {'scalers': 'robust', 'ratios': 'log_ratio', 'imputers': 'none', 'n_estimators': 1850, 'learning_rate': 0.38672298952380907, 'max_depth': 12, 'min_child_weight': 1, 'subsample': 0.8, 'colsample_bytree': 0.7, 'colsample_bylevel': 1.0, 'reg_alpha': 4.1326041651878604, 'reg_lambda': 3.1439383824166325, 'gamma': 0.00024421849666896375}. Best is trial 69 with value: -0.4521014866703406.
[I 2026-07-14 17:10:00,791] Trial 98 finished with value: -0.17483989103213154 and parameters: {'scalers': 'robust', 'ratios': 'log_ratio', 'imputers': 'none', 'n_estimators': 2800, 'learning_rate': 0.3543243990693826, 'max_depth': 12, 'min_child_weight': 1, 'subsample': 0.7, 'colsample_bytree': 0.7, 'colsample_bylevel': 1.0, 'reg_alpha': 33.24165392306177, 'reg_lambda': 24.098947178934164, 'gamma': 1.8907714504519153e-05}. Best is trial 69 with value: -0.4521014866703406.
[I 2026-07-14 17:11:26,888] Trial 99 finished with value: -0.44647050567021174 and parameters: {'scalers': 'robust', 'ratios': 'log_ratio', 'imputers': 'none', 'n_estimators': 2700, 'learning_rate': 0.347056256227188, 'max_depth': 12, 'min_child_weight': 1, 'subsample': 0.7, 'colsample_bytree': 0.7, 'colsample_bylevel': 1.0, 'reg_alpha': 4.3304836628756525e-05, 'reg_lambda': 2.676723916664137, 'gamma': 0.047964844370111705}. Best is trial 69 with value: -0.4521014866703406.
[I 2026-07-14 17:12:27,804] Trial 100 finished with value: -0.3902333508734142 and parameters: {'scalers': 'robust', 'ratios': 'log_ratio', 'imputers': 'none', 'n_estimators': 2700, 'learning_rate': 0.3473188105935838, 'max_depth': 12, 'min_child_weight': 1, 'subsample': 0.7, 'colsample_bytree': 0.7, 'colsample_bylevel': 1.0, 'reg_alpha': 3.993311681893942, 'reg_lambda': 13.005610494469988, 'gamma': 0.0013614485285216285}. Best is trial 69 with value: -0.4521014866703406.
[I 2026-07-14 17:13:33,099] Trial 101 finished with value: -0.36584612381746456 and parameters: {'scalers': 'robust', 'ratios': 'log_ratio', 'imputers': 'none', 'n_estimators': 2650, 'learning_rate': 0.34628929131512887, 'max_depth': 12, 'min_child_weight': 1, 'subsample': 0.8, 'colsample_bytree': 0.7, 'colsample_bylevel': 1.0, 'reg_alpha': 4.133571567188929, 'reg_lambda': 3.17553067503253, 'gamma': 0.0016462385469698515}. Best is trial 69 with value: -0.4521014866703406.
[I 2026-07-14 17:14:06,296] Trial 102 finished with value: -0.18172205945784647 and parameters: {'scalers': 'robust', 'ratios': 'log_ratio', 'imputers': 'none', 'n_estimators': 2700, 'learning_rate': 0.15069123564481846, 'max_depth': 12, 'min_child_weight': 1, 'subsample': 0.8, 'colsample_bytree': 0.6, 'colsample_bylevel': 1.0, 'reg_alpha': 4.597942927329304, 'reg_lambda': 19.398849576796938, 'gamma': 0.04448638602836435}. Best is trial 69 with value: -0.4521014866703406.
[I 2026-07-14 17:15:25,271] Trial 103 finished with value: -0.4536422208797908 and parameters: {'scalers': 'robust', 'ratios': 'log_ratio', 'imputers': 'none', 'n_estimators': 2750, 'learning_rate': 0.3463746567123182, 'max_depth': 12, 'min_child_weight': 1, 'subsample': 0.8, 'colsample_bytree': 0.6, 'colsample_bylevel': 1.0, 'reg_alpha': 1.1688132328758856, 'reg_lambda': 23.50381901212227, 'gamma': 0.011325930922900962}. Best is trial 103 with value: -0.4536422208797908.
[I 2026-07-14 17:15:58,502] Trial 104 finished with value: -0.2488986945860569 and parameters: {'scalers': 'robust', 'ratios': 'log_ratio', 'imputers': 'none', 'n_estimators': 1900, 'learning_rate': 0.22642649221169878, 'max_depth': 12, 'min_child_weight': 1, 'subsample': 0.8, 'colsample_bytree': 0.6, 'colsample_bylevel': 1.0, 'reg_alpha': 4.566665426852229, 'reg_lambda': 17.451167088171147, 'gamma': 0.00957699181523074}. Best is trial 103 with value: -0.4536422208797908.
[I 2026-07-14 17:16:12,849] Trial 105 finished with value: -0.1866828831340742 and parameters: {'scalers': 'robust', 'ratios': 'log_ratio', 'imputers': 'none', 'n_estimators': 2800, 'learning_rate': 0.354851684898199, 'max_depth': 5, 'min_child_weight': 1, 'subsample': 0.8, 'colsample_bytree': 0.7, 'colsample_bylevel': 0.9, 'reg_alpha': 3.8140293851821974, 'reg_lambda': 28.329117285470765, 'gamma': 0.05073487455700036}. Best is trial 103 with value: -0.4536422208797908.
[I 2026-07-14 17:16:19,982] Trial 106 finished with value: -0.19752925621657114 and parameters: {'scalers': 'robust', 'ratios': 'log_ratio', 'imputers': 'none', 'n_estimators': 1850, 'learning_rate': 0.33836207542239816, 'max_depth': 5, 'min_child_weight': 1, 'subsample': 0.8, 'colsample_bytree': 0.6, 'colsample_bylevel': 0.9, 'reg_alpha': 5.012040690460219, 'reg_lambda': 0.006201213920660519, 'gamma': 0.00015609541709243782}. Best is trial 103 with value: -0.4536422208797908.
[I 2026-07-14 17:17:51,022] Trial 107 finished with value: -0.37993235355418525 and parameters: {'scalers': 'robust', 'ratios': 'log_ratio', 'imputers': 'none', 'n_estimators': 2700, 'learning_rate': 0.22189165176482167, 'max_depth': 12, 'min_child_weight': 1, 'subsample': 0.8, 'colsample_bytree': 0.7, 'colsample_bylevel': 1.0, 'reg_alpha': 0.09715378717002848, 'reg_lambda': 1.7883077943776637, 'gamma': 0.010757334156263988}. Best is trial 103 with value: -0.4536422208797908.
[I 2026-07-14 17:18:34,948] Trial 108 finished with value: -0.23612322015296175 and parameters: {'scalers': 'robust', 'ratios': 'log_ratio', 'imputers': 'none', 'n_estimators': 2700, 'learning_rate': 0.2260514258034082, 'max_depth': 12, 'min_child_weight': 1, 'subsample': 0.8, 'colsample_bytree': 0.7, 'colsample_bylevel': 1.0, 'reg_alpha': 5.85732143290616, 'reg_lambda': 3.6551079474691055, 'gamma': 0.01164340397888184}. Best is trial 103 with value: -0.4536422208797908.
[I 2026-07-14 17:19:16,570] Trial 109 finished with value: -0.21427115695000773 and parameters: {'scalers': 'robust', 'ratios': 'log_ratio', 'imputers': 'none', 'n_estimators': 2750, 'learning_rate': 0.342096252843155, 'max_depth': 12, 'min_child_weight': 1, 'subsample': 0.8, 'colsample_bytree': 0.7, 'colsample_bylevel': 1.0, 'reg_alpha': 4.672118978752327, 'reg_lambda': 3.22174871658739, 'gamma': 0.04632685623518437}. Best is trial 103 with value: -0.4536422208797908.
[I 2026-07-14 17:20:17,346] Trial 110 finished with value: -0.28676116473896146 and parameters: {'scalers': 'robust', 'ratios': 'log_ratio', 'imputers': 'none', 'n_estimators': 2700, 'learning_rate': 0.22691315954048866, 'max_depth': 12, 'min_child_weight': 1, 'subsample': 0.8, 'colsample_bytree': 0.7, 'colsample_bylevel': 1.0, 'reg_alpha': 4.862349141671387, 'reg_lambda': 1.307018568387535, 'gamma': 0.00013383803584381495}. Best is trial 103 with value: -0.4536422208797908.
[I 2026-07-14 17:21:16,636] Trial 111 finished with value: -0.2710512263111347 and parameters: {'scalers': 'robust', 'ratios': 'log_ratio', 'imputers': 'none', 'n_estimators': 2800, 'learning_rate': 0.22065162188840426, 'max_depth': 12, 'min_child_weight': 1, 'subsample': 0.8, 'colsample_bytree': 0.7, 'colsample_bylevel': 1.0, 'reg_alpha': 4.392692169321117, 'reg_lambda': 1.6107495742782452, 'gamma': 0.010667778728132094}. Best is trial 103 with value: -0.4536422208797908.
[I 2026-07-14 17:21:33,781] Trial 112 finished with value: -0.18645514088091944 and parameters: {'scalers': 'robust', 'ratios': 'log_ratio', 'imputers': 'none', 'n_estimators': 2700, 'learning_rate': 0.33916692562332995, 'max_depth': 12, 'min_child_weight': 1, 'subsample': 0.8, 'colsample_bytree': 0.7, 'colsample_bylevel': 1.0, 'reg_alpha': 11.025402791010526, 'reg_lambda': 2.9362605675443616, 'gamma': 0.04627666016354564}. Best is trial 103 with value: -0.4536422208797908.
[I 2026-07-14 17:21:56,818] Trial 113 finished with value: -0.20043046888858282 and parameters: {'scalers': 'robust', 'ratios': 'log_ratio', 'imputers': 'none', 'n_estimators': 2700, 'learning_rate': 0.4183669119363943, 'max_depth': 12, 'min_child_weight': 1, 'subsample': 0.8, 'colsample_bytree': 0.7, 'colsample_bylevel': 1.0, 'reg_alpha': 9.70916557822899, 'reg_lambda': 3.7101924516797093, 'gamma': 0.012401643254820696}. Best is trial 103 with value: -0.4536422208797908.
[I 2026-07-14 17:22:22,478] Trial 114 finished with value: -0.21826352461838128 and parameters: {'scalers': 'robust', 'ratios': 'log_ratio', 'imputers': 'none', 'n_estimators': 2650, 'learning_rate': 0.4142175462444017, 'max_depth': 12, 'min_child_weight': 1, 'subsample': 0.8, 'colsample_bytree': 0.7, 'colsample_bylevel': 1.0, 'reg_alpha': 9.320315086224639, 'reg_lambda': 2.510335165263988, 'gamma': 0.005326623346056465}. Best is trial 103 with value: -0.4536422208797908.
[I 2026-07-14 17:23:13,220] Trial 115 finished with value: -0.2251467502912167 and parameters: {'scalers': 'robust', 'ratios': 'log_ratio', 'imputers': 'none', 'n_estimators': 2800, 'learning_rate': 0.21137328069010708, 'max_depth': 12, 'min_child_weight': 9, 'subsample': 0.8, 'colsample_bytree': 0.7, 'colsample_bylevel': 1.0, 'reg_alpha': 0.7989571206267776, 'reg_lambda': 1.2997037727311214, 'gamma': 0.0051428965240458546}. Best is trial 103 with value: -0.4536422208797908.
[I 2026-07-14 17:23:54,392] Trial 116 finished with value: -0.32987601062423527 and parameters: {'scalers': 'robust', 'ratios': 'log_ratio', 'imputers': 'none', 'n_estimators': 1500, 'learning_rate': 0.460513825696899, 'max_depth': 12, 'min_child_weight': 2, 'subsample': 0.8, 'colsample_bytree': 0.7, 'colsample_bylevel': 1.0, 'reg_alpha': 0.0019213583375130496, 'reg_lambda': 1.3011917754081213, 'gamma': 0.020634621454268077}. Best is trial 103 with value: -0.4536422208797908.
[I 2026-07-14 17:25:34,550] Trial 117 finished with value: -0.3835466454252411 and parameters: {'scalers': 'robust', 'ratios': 'log_ratio', 'imputers': 'none', 'n_estimators': 2850, 'learning_rate': 0.42918289715039587, 'max_depth': 12, 'min_child_weight': 2, 'subsample': 0.8, 'colsample_bytree': 0.7, 'colsample_bylevel': 1.0, 'reg_alpha': 0.7935914276037692, 'reg_lambda': 1.8232122494617518, 'gamma': 0.004875231262878608}. Best is trial 103 with value: -0.4536422208797908.
[I 2026-07-14 17:27:12,155] Trial 118 finished with value: -0.5151180536547829 and parameters: {'scalers': 'robust', 'ratios': 'log_ratio', 'imputers': 'none', 'n_estimators': 2900, 'learning_rate': 0.4210172909117455, 'max_depth': 12, 'min_child_weight': 1, 'subsample': 0.8, 'colsample_bytree': 0.7, 'colsample_bylevel': 1.0, 'reg_alpha': 0.8369759110098709, 'reg_lambda': 12.154187881058856, 'gamma': 0.004524666778097409}. Best is trial 118 with value: -0.5151180536547829.
[I 2026-07-14 17:28:05,573] Trial 119 finished with value: -0.25700312071091314 and parameters: {'scalers': 'robust', 'ratios': 'log_ratio', 'imputers': 'none', 'n_estimators': 2900, 'learning_rate': 0.4258350657885595, 'max_depth': 12, 'min_child_weight': 9, 'subsample': 0.8, 'colsample_bytree': 0.7, 'colsample_bylevel': 1.0, 'reg_alpha': 0.9711290547357943, 'reg_lambda': 10.924392421816608, 'gamma': 0.004542999960676832}. Best is trial 118 with value: -0.5151180536547829.
[I 2026-07-14 17:29:28,134] Trial 120 finished with value: -0.38815854124552696 and parameters: {'scalers': 'robust', 'ratios': 'log_ratio', 'imputers': 'none', 'n_estimators': 2600, 'learning_rate': 0.40665981771411674, 'max_depth': 12, 'min_child_weight': 2, 'subsample': 0.8, 'colsample_bytree': 0.7, 'colsample_bylevel': 1.0, 'reg_alpha': 1.4832749497693984, 'reg_lambda': 12.549309961242889, 'gamma': 0.004418737313261283}. Best is trial 118 with value: -0.5151180536547829.
[I 2026-07-14 17:30:55,912] Trial 121 finished with value: -0.30260858006384894 and parameters: {'scalers': 'robust', 'ratios': 'log_ratio', 'imputers': 'none', 'n_estimators': 2900, 'learning_rate': 0.16107963408918524, 'max_depth': 12, 'min_child_weight': 2, 'subsample': 0.8, 'colsample_bytree': 0.7, 'colsample_bylevel': 1.0, 'reg_alpha': 0.8233398409088145, 'reg_lambda': 11.247199716077654, 'gamma': 0.004990668946822995}. Best is trial 118 with value: -0.5151180536547829.
[I 2026-07-14 17:32:22,253] Trial 122 finished with value: -0.2936718415948801 and parameters: {'scalers': 'robust', 'ratios': 'log_ratio', 'imputers': 'none', 'n_estimators': 2900, 'learning_rate': 0.15889500715153937, 'max_depth': 12, 'min_child_weight': 2, 'subsample': 0.8, 'colsample_bytree': 0.7, 'colsample_bylevel': 1.0, 'reg_alpha': 0.7853490128454955, 'reg_lambda': 0.12513352580615636, 'gamma': 0.021325916943061483}. Best is trial 118 with value: -0.5151180536547829.
[I 2026-07-14 17:34:05,525] Trial 123 finished with value: -0.41564270150704613 and parameters: {'scalers': 'robust', 'ratios': 'log_ratio', 'imputers': 'none', 'n_estimators': 2900, 'learning_rate': 0.49258575931908516, 'max_depth': 12, 'min_child_weight': 2, 'subsample': 0.9, 'colsample_bytree': 0.7, 'colsample_bylevel': 1.0, 'reg_alpha': 1.317427054944625, 'reg_lambda': 0.12118049189253516, 'gamma': 0.0011482544974075247}. Best is trial 118 with value: -0.5151180536547829.
[I 2026-07-14 17:35:45,421] Trial 124 finished with value: -0.40413327564055945 and parameters: {'scalers': 'robust', 'ratios': 'log_ratio', 'imputers': 'none', 'n_estimators': 2900, 'learning_rate': 0.4955153524866881, 'max_depth': 12, 'min_child_weight': 2, 'subsample': 0.9, 'colsample_bytree': 0.7, 'colsample_bylevel': 1.0, 'reg_alpha': 1.6678755332356594, 'reg_lambda': 0.009553960504022642, 'gamma': 0.001877619332511328}. Best is trial 118 with value: -0.5151180536547829.
[I 2026-07-14 17:37:13,929] Trial 126 finished with value: -0.17405233160836053 and parameters: {'scalers': 'robust', 'ratios': 'log_ratio', 'imputers': 'none', 'n_estimators': 2900, 'learning_rate': 0.1564748971829797, 'max_depth': 3, 'min_child_weight': 10, 'subsample': 0.9, 'colsample_bytree': 0.7, 'colsample_bylevel': 1.0, 'reg_alpha': 0.9590912817427527, 'reg_lambda': 5.7613818529229315, 'gamma': 0.004316819763939943}. Best is trial 118 with value: -0.5151180536547829.
[I 2026-07-14 17:37:20,939] Trial 125 finished with value: -0.39670020482774493 and parameters: {'scalers': 'robust', 'ratios': 'log_ratio', 'imputers': 'none', 'n_estimators': 2900, 'learning_rate': 0.48180738195992623, 'max_depth': 12, 'min_child_weight': 2, 'subsample': 0.9, 'colsample_bytree': 0.7, 'colsample_bylevel': 1.0, 'reg_alpha': 0.0860178914656436, 'reg_lambda': 5.482078257717137, 'gamma': 0.0021151806165227286}. Best is trial 118 with value: -0.5151180536547829.
[I 2026-07-14 17:38:56,839] Trial 127 finished with value: -0.3023337843328532 and parameters: {'scalers': 'robust', 'ratios': 'log_ratio', 'imputers': 'none', 'n_estimators': 2950, 'learning_rate': 0.1556955588068868, 'max_depth': 12, 'min_child_weight': 2, 'subsample': 0.9, 'colsample_bytree': 0.7, 'colsample_bylevel': 1.0, 'reg_alpha': 1.2692992274152097, 'reg_lambda': 7.515079657547169, 'gamma': 0.0010503434018045796}. Best is trial 118 with value: -0.5151180536547829.
[I 2026-07-14 17:40:31,610] Trial 128 finished with value: -0.2945925646084 and parameters: {'scalers': 'robust', 'ratios': 'log_ratio', 'imputers': 'none', 'n_estimators': 2950, 'learning_rate': 0.1635916159069312, 'max_depth': 12, 'min_child_weight': 2, 'subsample': 0.9, 'colsample_bytree': 0.7, 'colsample_bylevel': 1.0, 'reg_alpha': 1.4863050821757307, 'reg_lambda': 5.406783141474609, 'gamma': 0.0011481570095614167}. Best is trial 118 with value: -0.5151180536547829.
[I 2026-07-14 17:41:47,920] Trial 129 finished with value: -0.5354202802189214 and parameters: {'scalers': 'robust', 'ratios': 'log_ratio', 'imputers': 'none', 'n_estimators': 2900, 'learning_rate': 0.48520253551364206, 'max_depth': 12, 'min_child_weight': 1, 'subsample': 0.9, 'colsample_bytree': 0.7, 'colsample_bylevel': 1.0, 'reg_alpha': 1.5071574429836776, 'reg_lambda': 5.884432678230293, 'gamma': 0.0011625161389913453}. Best is trial 129 with value: -0.5354202802189214.
[I 2026-07-14 17:41:49,606] Trial 130 finished with value: -0.1898971726679705 and parameters: {'scalers': 'robust', 'ratios': 'log_ratio', 'imputers': 'none', 'n_estimators': 1750, 'learning_rate': 0.4999587937940458, 'max_depth': 3, 'min_child_weight': 1, 'subsample': 0.9, 'colsample_bytree': 0.7, 'colsample_bylevel': 1.0, 'reg_alpha': 1.5421330081976694, 'reg_lambda': 7.064222650871069, 'gamma': 0.0011616904518135002}. Best is trial 129 with value: -0.5354202802189214.
[I 2026-07-14 17:43:20,881] Trial 131 finished with value: -0.31985003333025164 and parameters: {'scalers': 'robust', 'ratios': 'log_ratio', 'imputers': 'none', 'n_estimators': 3000, 'learning_rate': 0.3034946615453689, 'max_depth': 12, 'min_child_weight': 2, 'subsample': 1.0, 'colsample_bytree': 0.7, 'colsample_bylevel': 1.0, 'reg_alpha': 1.5139928231687427, 'reg_lambda': 6.184120123021424, 'gamma': 0.0006978309035957493}. Best is trial 129 with value: -0.5354202802189214.
[I 2026-07-14 17:43:24,626] Trial 132 finished with value: -0.1945577171754523 and parameters: {'scalers': 'robust', 'ratios': 'log_ratio', 'imputers': 'none', 'n_estimators': 2950, 'learning_rate': 0.475424297111724, 'max_depth': 3, 'min_child_weight': 2, 'subsample': 0.9, 'colsample_bytree': 0.7, 'colsample_bylevel': 0.5, 'reg_alpha': 1.536563687874367, 'reg_lambda': 5.374927395801688, 'gamma': 0.0011353072955113533}. Best is trial 129 with value: -0.5354202802189214.
[I 2026-07-14 17:44:05,976] Trial 133 finished with value: -0.3526555996660001 and parameters: {'scalers': 'robust', 'ratios': 'log_ratio', 'imputers': 'none', 'n_estimators': 3000, 'learning_rate': 0.48013015153676114, 'max_depth': 7, 'min_child_weight': 2, 'subsample': 0.9, 'colsample_bytree': 0.7, 'colsample_bylevel': 1.0, 'reg_alpha': 1.3967232984302171, 'reg_lambda': 0.002889860462372429, 'gamma': 0.0011225261342298841}. Best is trial 129 with value: -0.5354202802189214.
[I 2026-07-14 17:45:09,309] Trial 134 finished with value: -0.31591702522748943 and parameters: {'scalers': 'robust', 'ratios': 'log_ratio', 'imputers': 'none', 'n_estimators': 3000, 'learning_rate': 0.3079417443704613, 'max_depth': 12, 'min_child_weight': 2, 'subsample': 1.0, 'colsample_bytree': 0.7, 'colsample_bylevel': 0.5, 'reg_alpha': 1.339074172224782, 'reg_lambda': 0.00994309385568066, 'gamma': 0.0006872315422213005}. Best is trial 129 with value: -0.5354202802189214.
