[I 2026-07-14 20:46:25,547] Trial 315 finished with value: -0.4854238179835194 and parameters: {'scalers': 'none', 'ratios': 'norm_ratio', 'imputers': 'mean', 'n_estimators': 2550, 'learning_rate': 0.32972372149496043, 'max_depth': 12, 'min_child_weight': 2, 'subsample': 0.5, 'colsample_bytree': 0.7, 'colsample_bylevel': 0.8, 'reg_alpha': 0.8184883868397749, 'reg_lambda': 85.95930269619855, 'gamma': 0.0006444500895856609}. Best is trial 306 with value: -6.618744131677142.
[I 2026-07-14 20:47:15,007] Trial 316 finished with value: -0.502163889397736 and parameters: {'scalers': 'none', 'ratios': 'norm_ratio', 'imputers': 'mean', 'n_estimators': 2450, 'learning_rate': 0.3412523115313378, 'max_depth': 12, 'min_child_weight': 2, 'subsample': 0.5, 'colsample_bytree': 0.7, 'colsample_bylevel': 0.8, 'reg_alpha': 0.8500079996424597, 'reg_lambda': 88.82042190133244, 'gamma': 0.0004585270949531715}. Best is trial 306 with value: -6.618744131677142.
[I 2026-07-14 20:48:10,808] Trial 317 finished with value: -0.4586484624079324 and parameters: {'scalers': 'none', 'ratios': 'norm_ratio', 'imputers': 'mean', 'n_estimators': 2600, 'learning_rate': 0.31884247362777, 'max_depth': 12, 'min_child_weight': 2, 'subsample': 0.5, 'colsample_bytree': 0.7, 'colsample_bylevel': 0.9, 'reg_alpha': 0.9513059655914243, 'reg_lambda': 71.6981354826952, 'gamma': 0.0012033636382991814}. Best is trial 306 with value: -6.618744131677142.
[I 2026-07-14 20:49:05,793] Trial 318 finished with value: -0.20835738648721241 and parameters: {'scalers': 'none', 'ratios': 'norm_ratio', 'imputers': 'mean', 'n_estimators': 2550, 'learning_rate': 0.007008810846955816, 'max_depth': 12, 'min_child_weight': 1, 'subsample': 0.5, 'colsample_bytree': 0.7, 'colsample_bylevel': 0.8, 'reg_alpha': 0.02137002947783349, 'reg_lambda': 98.31079650318878, 'gamma': 0.0010139649677150964}. Best is trial 306 with value: -6.618744131677142.
[I 2026-07-14 20:49:58,217] Trial 319 finished with value: -0.4847420481863399 and parameters: {'scalers': 'none', 'ratios': 'norm_ratio', 'imputers': 'mean', 'n_estimators': 2600, 'learning_rate': 0.31448760637102463, 'max_depth': 12, 'min_child_weight': 2, 'subsample': 0.5, 'colsample_bytree': 0.7, 'colsample_bylevel': 0.8, 'reg_alpha': 0.03975212421788844, 'reg_lambda': 97.85046963825394, 'gamma': 0.0004958636029802733}. Best is trial 306 with value: -6.618744131677142.
