[I 2026-07-14 20:13:48,700] Trial 318 finished with value: -6.907684127149549 and parameters: {'scalers': 'none', 'ratios': 'log_ratio', 'imputers': 'median', 'n_estimators': 2500, 'learning_rate': 0.49138364229690595, 'max_depth': 8, 'min_child_weight': 1, 'subsample': 0.5, 'colsample_bytree': 1.0, 'colsample_bylevel': 0.8, 'reg_alpha': 1.0382941748691648e-06, 'reg_lambda': 23.56149170384477, 'gamma': 1.9831071159869397e-06}. Best is trial 267 with value: -11.549133006942904.
[I 2026-07-14 20:14:35,180] Trial 319 finished with value: -1.3221681666644172 and parameters: {'scalers': 'none', 'ratios': 'log_ratio', 'imputers': 'median', 'n_estimators': 2500, 'learning_rate': 0.000924728074913148, 'max_depth': 8, 'min_child_weight': 1, 'subsample': 0.5, 'colsample_bytree': 1.0, 'colsample_bylevel': 0.8, 'reg_alpha': 2.430966893494842e-06, 'reg_lambda': 11.910931476393468, 'gamma': 1.7936730327635173e-06}. Best is trial 267 with value: -11.549133006942904.
