[I 2026-07-14 21:31:45,332] Trial 45 finished with value: -0.35879417884564996 and parameters: {'scalers': 'robust', 'ratios': 'norm_ratio', 'imputers': 'mean', 'n_estimators': 1600, 'learning_rate': 0.04295380565863852, 'max_depth': 11, 'min_child_weight': 8, 'subsample': 0.6, 'colsample_bytree': 1.0, 'colsample_bylevel': 0.8, 'reg_alpha': 0.00022298593295633334, 'reg_lambda': 1.0968056101306564e-06, 'gamma': 0.0008001526047737527}. Best is trial 23 with value: -0.88175068162932.
[I 2026-07-14 21:32:02,199] Trial 46 finished with value: -0.3554462055722897 and parameters: {'scalers': 'robust', 'ratios': 'norm_ratio', 'imputers': 'mean', 'n_estimators': 1450, 'learning_rate': 0.014279264565557323, 'max_depth': 12, 'min_child_weight': 8, 'subsample': 0.6, 'colsample_bytree': 1.0, 'colsample_bylevel': 0.8, 'reg_alpha': 0.0002535514322046789, 'reg_lambda': 1.0486642896979202e-06, 'gamma': 0.0005013267095939765}. Best is trial 23 with value: -0.88175068162932.
[I 2026-07-14 21:32:14,147] Trial 47 finished with value: -0.36471164045998766 and parameters: {'scalers': 'robust', 'ratios': 'norm_ratio', 'imputers': 'mean', 'n_estimators': 1400, 'learning_rate': 0.042260069548383974, 'max_depth': 12, 'min_child_weight': 8, 'subsample': 0.6, 'colsample_bytree': 1.0, 'colsample_bylevel': 0.8, 'reg_alpha': 0.00013814346071270596, 'reg_lambda': 1.0421844228565002e-06, 'gamma': 0.0001962537789636342}. Best is trial 23 with value: -0.88175068162932.
[I 2026-07-14 21:32:32,605] Trial 48 finished with value: -0.40038439614918203 and parameters: {'scalers': 'robust', 'ratios': 'norm_ratio', 'imputers': 'mean', 'n_estimators': 2800, 'learning_rate': 0.05367537870726396, 'max_depth': 12, 'min_child_weight': 8, 'subsample': 0.6, 'colsample_bytree': 1.0, 'colsample_bylevel': 0.6, 'reg_alpha': 0.00016993003337146805, 'reg_lambda': 4.12825180178937e-06, 'gamma': 0.0001129235558677424}. Best is trial 23 with value: -0.88175068162932.
[I 2026-07-14 21:32:42,442] Trial 49 finished with value: -0.3677427982664754 and parameters: {'scalers': 'robust', 'ratios': 'norm_ratio', 'imputers': 'mean', 'n_estimators': 1400, 'learning_rate': 0.05301364128760109, 'max_depth': 12, 'min_child_weight': 8, 'subsample': 0.6, 'colsample_bytree': 1.0, 'colsample_bylevel': 0.6, 'reg_alpha': 0.0002860340921574362, 'reg_lambda': 4.242918891911671e-06, 'gamma': 0.0009320928750643317}. Best is trial 23 with value: -0.88175068162932.
[I 2026-07-14 21:32:52,733] Trial 50 finished with value: -0.3530702358831819 and parameters: {'scalers': 'robust', 'ratios': 'norm_ratio', 'imputers': 'mean', 'n_estimators': 1350, 'learning_rate': 0.014470819966110432, 'max_depth': 12, 'min_child_weight': 8, 'subsample': 0.6, 'colsample_bytree': 0.5, 'colsample_bylevel': 0.8, 'reg_alpha': 0.006544970165155598, 'reg_lambda': 4.895332605791565e-05, 'gamma': 0.00017608662245683387}. Best is trial 23 with value: -0.88175068162932.
[I 2026-07-14 21:32:59,387] Trial 51 finished with value: -0.39081008712653054 and parameters: {'scalers': 'robust', 'ratios': 'norm_ratio', 'imputers': 'mean', 'n_estimators': 1350, 'learning_rate': 0.06526065631145943, 'max_depth': 12, 'min_child_weight': 8, 'subsample': 0.6, 'colsample_bytree': 0.5, 'colsample_bylevel': 0.5, 'reg_alpha': 8.86187347162067e-05, 'reg_lambda': 4.959230919478675e-06, 'gamma': 3.7721594498663066e-06}. Best is trial 23 with value: -0.88175068162932.
[I 2026-07-14 21:33:12,378] Trial 52 finished with value: -0.43865649231636844 and parameters: {'scalers': 'robust', 'ratios': 'norm_ratio', 'imputers': 'median', 'n_estimators': 2850, 'learning_rate': 0.0684581081211833, 'max_depth': 12, 'min_child_weight': 8, 'subsample': 0.6, 'colsample_bytree': 0.5, 'colsample_bylevel': 0.5, 'reg_alpha': 0.006128799595752428, 'reg_lambda': 5.7709861092522874e-05, 'gamma': 3.642821367568064e-06}. Best is trial 23 with value: -0.88175068162932.
[I 2026-07-14 21:33:31,902] Trial 53 finished with value: -0.24624849782857033 and parameters: {'scalers': 'robust', 'ratios': 'log_ratio', 'imputers': 'median', 'n_estimators': 2800, 'learning_rate': 0.0003330121652048232, 'max_depth': 12, 'min_child_weight': 3, 'subsample': 0.5, 'colsample_bytree': 0.9, 'colsample_bylevel': 0.5, 'reg_alpha': 2.1053969324662305e-05, 'reg_lambda': 3.724152617040553e-05, 'gamma': 4.173028279892559e-06}. Best is trial 23 with value: -0.88175068162932.
[I 2026-07-14 21:33:49,639] Trial 54 finished with value: -0.242702810068828 and parameters: {'scalers': 'robust', 'ratios': 'log_ratio', 'imputers': 'median', 'n_estimators': 2800, 'learning_rate': 0.00032500531048751364, 'max_depth': 10, 'min_child_weight': 3, 'subsample': 1.0, 'colsample_bytree': 0.5, 'colsample_bylevel': 0.5, 'reg_alpha': 1.2005373383278248e-05, 'reg_lambda': 4.178619349210735e-06, 'gamma': 3.516644237474409e-06}. Best is trial 23 with value: -0.88175068162932.
[I 2026-07-14 21:34:01,624] Trial 55 finished with value: -0.5292090552248301 and parameters: {'scalers': 'none', 'ratios': 'log_ratio', 'imputers': 'median', 'n_estimators': 2850, 'learning_rate': 0.06153083451313387, 'max_depth': 10, 'min_child_weight': 3, 'subsample': 0.5, 'colsample_bytree': 0.5, 'colsample_bylevel': 0.5, 'reg_alpha': 0.005924205893551524, 'reg_lambda': 3.468519366681577e-05, 'gamma': 4.891047471853045e-06}. Best is trial 23 with value: -0.88175068162932.
[I 2026-07-14 21:34:15,539] Trial 56 finished with value: -0.24356916415315477 and parameters: {'scalers': 'none', 'ratios': 'log_ratio', 'imputers': 'median', 'n_estimators': 2500, 'learning_rate': 0.0002107332333364202, 'max_depth': 10, 'min_child_weight': 3, 'subsample': 0.7, 'colsample_bytree': 0.5, 'colsample_bylevel': 0.5, 'reg_alpha': 0.008252533572909738, 'reg_lambda': 2.872315375251262e-05, 'gamma': 4.62657087039303e-06}. Best is trial 23 with value: -0.88175068162932.
[I 2026-07-14 21:34:34,642] Trial 57 finished with value: -0.2432899232399841 and parameters: {'scalers': 'none', 'ratios': 'log_ratio', 'imputers': 'median', 'n_estimators': 2500, 'learning_rate': 0.0006542559260240343, 'max_depth': 10, 'min_child_weight': 3, 'subsample': 1.0, 'colsample_bytree': 0.9, 'colsample_bylevel': 0.5, 'reg_alpha': 0.007986394239475718, 'reg_lambda': 2.870192655437172e-05, 'gamma': 4.067017723546568e-06}. Best is trial 23 with value: -0.88175068162932.
[I 2026-07-14 21:34:51,436] Trial 58 finished with value: -0.42117601832030505 and parameters: {'scalers': 'none', 'ratios': 'log_ratio', 'imputers': 'median', 'n_estimators': 3000, 'learning_rate': 0.07526799071567906, 'max_depth': 10, 'min_child_weight': 3, 'subsample': 1.0, 'colsample_bytree': 0.9, 'colsample_bylevel': 0.5, 'reg_alpha': 0.005389156385661826, 'reg_lambda': 0.0005152417453885871, 'gamma': 4.28968240410197e-06}. Best is trial 23 with value: -0.88175068162932.
[I 2026-07-14 21:35:07,455] Trial 59 finished with value: -0.4042964168508728 and parameters: {'scalers': 'none', 'ratios': 'log_ratio', 'imputers': 'median', 'n_estimators': 2500, 'learning_rate': 0.07447248894385305, 'max_depth': 10, 'min_child_weight': 6, 'subsample': 1.0, 'colsample_bytree': 0.9, 'colsample_bylevel': 0.5, 'reg_alpha': 1.466893423688773e-05, 'reg_lambda': 0.0007228279698049436, 'gamma': 4.324274463465966e-06}. Best is trial 23 with value: -0.88175068162932.
[I 2026-07-14 21:35:32,626] Trial 60 finished with value: -0.2420777755049081 and parameters: {'scalers': 'none', 'ratios': 'log_ratio', 'imputers': 'none', 'n_estimators': 3000, 'learning_rate': 0.00030226968056693893, 'max_depth': 10, 'min_child_weight': 3, 'subsample': 1.0, 'colsample_bytree': 0.9, 'colsample_bylevel': 0.6, 'reg_alpha': 1.631464109502076e-05, 'reg_lambda': 0.000508555583543673, 'gamma': 3.984885603307843e-06}. Best is trial 23 with value: -0.88175068162932.
[I 2026-07-14 21:35:46,615] Trial 61 finished with value: -0.48615399505253154 and parameters: {'scalers': 'none', 'ratios': 'log_ratio', 'imputers': 'none', 'n_estimators': 2500, 'learning_rate': 0.29186964947878946, 'max_depth': 10, 'min_child_weight': 6, 'subsample': 1.0, 'colsample_bytree': 0.9, 'colsample_bylevel': 0.6, 'reg_alpha': 1.087190912117194e-05, 'reg_lambda': 0.02435998512045875, 'gamma': 4.445622128839103e-05}. Best is trial 23 with value: -0.88175068162932.
[I 2026-07-14 21:36:10,249] Trial 62 finished with value: -0.7753064590046831 and parameters: {'scalers': 'none', 'ratios': 'log_ratio', 'imputers': 'none', 'n_estimators': 3000, 'learning_rate': 0.27876295785512534, 'max_depth': 10, 'min_child_weight': 4, 'subsample': 0.7, 'colsample_bytree': 0.9, 'colsample_bylevel': 0.6, 'reg_alpha': 0.21116123160994607, 'reg_lambda': 0.0005328566189395021, 'gamma': 5.9799105581959856e-05}. Best is trial 23 with value: -0.88175068162932.
[I 2026-07-14 21:36:25,716] Trial 63 finished with value: -0.5157214571681968 and parameters: {'scalers': 'none', 'ratios': 'log_ratio', 'imputers': 'none', 'n_estimators': 3000, 'learning_rate': 0.266140604273934, 'max_depth': 10, 'min_child_weight': 4, 'subsample': 1.0, 'colsample_bytree': 0.9, 'colsample_bylevel': 0.6, 'reg_alpha': 0.21953445781868988, 'reg_lambda': 0.0010407551786242044, 'gamma': 6.297604941660628e-05}. Best is trial 23 with value: -0.88175068162932.
[I 2026-07-14 21:36:34,181] Trial 65 finished with value: -0.37420057359718856 and parameters: {'scalers': 'robust', 'ratios': 'log_ratio', 'imputers': 'none', 'n_estimators': 100, 'learning_rate': 0.2792691450954455, 'max_depth': 9, 'min_child_weight': 4, 'subsample': 0.5, 'colsample_bytree': 0.9, 'colsample_bylevel': 0.6, 'reg_alpha': 0.14019962469285746, 'reg_lambda': 0.0003422814027766863, 'gamma': 4.5356456916575075e-05}. Best is trial 23 with value: -0.88175068162932.
[I 2026-07-14 21:36:39,890] Trial 64 finished with value: -0.5192820539231222 and parameters: {'scalers': 'robust', 'ratios': 'log_ratio', 'imputers': 'none', 'n_estimators': 3000, 'learning_rate': 0.3103283919963623, 'max_depth': 9, 'min_child_weight': 4, 'subsample': 1.0, 'colsample_bytree': 0.9, 'colsample_bylevel': 0.6, 'reg_alpha': 0.29757055929489074, 'reg_lambda': 0.0004925562352762149, 'gamma': 5.448737188379165e-05}. Best is trial 23 with value: -0.88175068162932.
[I 2026-07-14 21:36:52,566] Trial 66 finished with value: -0.6230496738529053 and parameters: {'scalers': 'robust', 'ratios': 'log_ratio', 'imputers': 'none', 'n_estimators': 2100, 'learning_rate': 0.16050128684122358, 'max_depth': 9, 'min_child_weight': 4, 'subsample': 0.5, 'colsample_bytree': 0.9, 'colsample_bylevel': 0.6, 'reg_alpha': 0.21421181156935545, 'reg_lambda': 0.0239782841898475, 'gamma': 5.0314213107997496e-05}. Best is trial 23 with value: -0.88175068162932.
[I 2026-07-14 21:37:04,164] Trial 67 finished with value: -0.796163066123492 and parameters: {'scalers': 'robust', 'ratios': 'log_ratio', 'imputers': 'none', 'n_estimators': 2150, 'learning_rate': 0.2860031662490577, 'max_depth': 9, 'min_child_weight': 4, 'subsample': 0.5, 'colsample_bytree': 0.6, 'colsample_bylevel': 0.6, 'reg_alpha': 0.22337344589782426, 'reg_lambda': 0.0001307471845477576, 'gamma': 5.396639144727826e-05}. Best is trial 23 with value: -0.88175068162932.
[I 2026-07-14 21:37:15,763] Trial 68 finished with value: -0.8169443711937442 and parameters: {'scalers': 'robust', 'ratios': 'log_ratio', 'imputers': 'none', 'n_estimators': 2050, 'learning_rate': 0.3027897506673391, 'max_depth': 9, 'min_child_weight': 5, 'subsample': 0.5, 'colsample_bytree': 0.7, 'colsample_bylevel': 0.6, 'reg_alpha': 4.4124740721722235e-06, 'reg_lambda': 14.25625776216088, 'gamma': 5.0456673465016494e-05}. Best is trial 23 with value: -0.88175068162932.
[I 2026-07-14 21:37:24,748] Trial 69 finished with value: -0.6059396915086448 and parameters: {'scalers': 'robust', 'ratios': 'log_ratio', 'imputers': 'none', 'n_estimators': 1900, 'learning_rate': 0.15968310729519566, 'max_depth': 8, 'min_child_weight': 5, 'subsample': 0.5, 'colsample_bytree': 0.7, 'colsample_bylevel': 0.6, 'reg_alpha': 0.2150470478196512, 'reg_lambda': 17.7152867269374, 'gamma': 2.298565710815667e-05}. Best is trial 23 with value: -0.88175068162932.
[I 2026-07-14 21:37:36,748] Trial 70 finished with value: -0.688579322119808 and parameters: {'scalers': 'robust', 'ratios': 'log_ratio', 'imputers': 'none', 'n_estimators': 2150, 'learning_rate': 0.2860636110670293, 'max_depth': 9, 'min_child_weight': 4, 'subsample': 0.8, 'colsample_bytree': 0.6, 'colsample_bylevel': 0.6, 'reg_alpha': 0.14526425092977752, 'reg_lambda': 0.010398900221904513, 'gamma': 6.932188002488987e-05}. Best is trial 23 with value: -0.88175068162932.
[I 2026-07-14 21:37:48,062] Trial 71 finished with value: -0.5296456269353612 and parameters: {'scalers': 'robust', 'ratios': 'log_ratio', 'imputers': 'none', 'n_estimators': 2100, 'learning_rate': 0.15823559345155064, 'max_depth': 9, 'min_child_weight': 5, 'subsample': 0.8, 'colsample_bytree': 0.6, 'colsample_bylevel': 0.6, 'reg_alpha': 0.0861616279241971, 'reg_lambda': 0.009479008783894157, 'gamma': 2.9259232659573145e-05}. Best is trial 23 with value: -0.88175068162932.
[I 2026-07-14 21:37:59,430] Trial 72 finished with value: -0.5509955428025536 and parameters: {'scalers': 'standard', 'ratios': 'log_ratio', 'imputers': 'none', 'n_estimators': 2150, 'learning_rate': 0.1355111202139509, 'max_depth': 9, 'min_child_weight': 5, 'subsample': 0.7, 'colsample_bytree': 0.6, 'colsample_bylevel': 0.6, 'reg_alpha': 0.9379783788294427, 'reg_lambda': 0.00011685853525538518, 'gamma': 1.9510474658596175e-05}. Best is trial 23 with value: -0.88175068162932.
[I 2026-07-14 21:38:11,060] Trial 74 finished with value: -0.24369157380896905 and parameters: {'scalers': 'standard', 'ratios': 'log_ratio', 'imputers': 'none', 'n_estimators': 2100, 'learning_rate': 0.1634433405185153, 'max_depth': 9, 'min_child_weight': 5, 'subsample': 0.7, 'colsample_bytree': 0.6, 'colsample_bylevel': 0.6, 'reg_alpha': 2.0479029403183704, 'reg_lambda': 0.008360625898281094, 'gamma': 0.1530763775121134}. Best is trial 23 with value: -0.88175068162932.
[I 2026-07-14 21:38:13,101] Trial 73 finished with value: -0.6201621305909546 and parameters: {'scalers': 'standard', 'ratios': 'log_ratio', 'imputers': 'none', 'n_estimators': 2150, 'learning_rate': 0.15387277349048167, 'max_depth': 11, 'min_child_weight': 5, 'subsample': 0.7, 'colsample_bytree': 0.6, 'colsample_bylevel': 0.6, 'reg_alpha': 0.7241477339524418, 'reg_lambda': 0.00012697316540146415, 'gamma': 2.2762964110631238e-05}. Best is trial 23 with value: -0.88175068162932.
[I 2026-07-14 21:38:19,871] Trial 75 finished with value: -0.44303684849333974 and parameters: {'scalers': 'standard', 'ratios': 'log_ratio', 'imputers': 'none', 'n_estimators': 2100, 'learning_rate': 0.17674393735097324, 'max_depth': 8, 'min_child_weight': 5, 'subsample': 0.7, 'colsample_bytree': 0.6, 'colsample_bylevel': 0.6, 'reg_alpha': 4.117442688901149, 'reg_lambda': 0.2860243533612455, 'gamma': 9.359186558267499e-05}. Best is trial 23 with value: -0.88175068162932.
[I 2026-07-14 21:38:31,348] Trial 76 finished with value: -0.7667228887632233 and parameters: {'scalers': 'standard', 'ratios': 'log_ratio', 'imputers': 'none', 'n_estimators': 2050, 'learning_rate': 0.4014876113190409, 'max_depth': 8, 'min_child_weight': 5, 'subsample': 0.7, 'colsample_bytree': 0.6, 'colsample_bylevel': 0.6, 'reg_alpha': 0.7519251532542824, 'reg_lambda': 0.00012880372726985519, 'gamma': 0.00010518524322569042}. Best is trial 23 with value: -0.88175068162932.
[I 2026-07-14 21:38:42,754] Trial 77 finished with value: -0.7550966878860232 and parameters: {'scalers': 'standard', 'ratios': 'log_ratio', 'imputers': 'none', 'n_estimators': 2050, 'learning_rate': 0.38537961888975536, 'max_depth': 8, 'min_child_weight': 5, 'subsample': 0.7, 'colsample_bytree': 0.6, 'colsample_bylevel': 0.6, 'reg_alpha': 0.7360900570586486, 'reg_lambda': 0.00012752344982904133, 'gamma': 0.00010449302225788975}. Best is trial 23 with value: -0.88175068162932.
[I 2026-07-14 21:38:55,083] Trial 78 finished with value: -0.7355991888904061 and parameters: {'scalers': 'standard', 'ratios': 'log_ratio', 'imputers': 'none', 'n_estimators': 2100, 'learning_rate': 0.3744177682148593, 'max_depth': 8, 'min_child_weight': 5, 'subsample': 0.8, 'colsample_bytree': 0.6, 'colsample_bylevel': 0.6, 'reg_alpha': 0.9477775609294969, 'reg_lambda': 0.00014012999153621063, 'gamma': 0.00011649031759381708}. Best is trial 23 with value: -0.88175068162932.
[I 2026-07-14 21:39:06,206] Trial 79 finished with value: -0.7851014906386302 and parameters: {'scalers': 'standard', 'ratios': 'log_ratio', 'imputers': 'none', 'n_estimators': 1850, 'learning_rate': 0.3704323254662004, 'max_depth': 8, 'min_child_weight': 4, 'subsample': 0.8, 'colsample_bytree': 0.6, 'colsample_bylevel': 0.6, 'reg_alpha': 0.9638957241079393, 'reg_lambda': 0.00012315741811630743, 'gamma': 0.00010125171059317834}. Best is trial 23 with value: -0.88175068162932.
[I 2026-07-14 21:39:16,561] Trial 80 finished with value: -0.7689421229748906 and parameters: {'scalers': 'standard', 'ratios': 'log_ratio', 'imputers': 'none', 'n_estimators': 1900, 'learning_rate': 0.39588007559836175, 'max_depth': 8, 'min_child_weight': 4, 'subsample': 0.8, 'colsample_bytree': 0.6, 'colsample_bylevel': 0.6, 'reg_alpha': 0.5198969268769141, 'reg_lambda': 0.18162293705050414, 'gamma': 0.00010897403227235886}. Best is trial 23 with value: -0.88175068162932.
[I 2026-07-14 21:39:23,365] Trial 81 finished with value: -0.4620444945928085 and parameters: {'scalers': 'standard', 'ratios': 'log_ratio', 'imputers': 'none', 'n_estimators': 1850, 'learning_rate': 0.23259959541605346, 'max_depth': 8, 'min_child_weight': 4, 'subsample': 0.8, 'colsample_bytree': 0.7, 'colsample_bylevel': 0.6, 'reg_alpha': 4.604306744213791, 'reg_lambda': 4.53129023309591, 'gamma': 0.0002943830607186313}. Best is trial 23 with value: -0.88175068162932.
[I 2026-07-14 21:39:29,353] Trial 82 finished with value: -0.47116015559486774 and parameters: {'scalers': 'standard', 'ratios': 'log_ratio', 'imputers': 'none', 'n_estimators': 1850, 'learning_rate': 0.37237616286789055, 'max_depth': 7, 'min_child_weight': 4, 'subsample': 0.8, 'colsample_bytree': 0.6, 'colsample_bylevel': 0.6, 'reg_alpha': 5.1929829440890725, 'reg_lambda': 0.19265183022351406, 'gamma': 0.00034723858206868024}. Best is trial 23 with value: -0.88175068162932.
[I 2026-07-14 21:39:40,096] Trial 83 finished with value: -0.7802091493364409 and parameters: {'scalers': 'standard', 'ratios': 'log_ratio', 'imputers': 'none', 'n_estimators': 1850, 'learning_rate': 0.39992008611471974, 'max_depth': 8, 'min_child_weight': 4, 'subsample': 0.8, 'colsample_bytree': 0.6, 'colsample_bylevel': 0.6, 'reg_alpha': 0.7356481797133564, 'reg_lambda': 0.00012833907336941324, 'gamma': 0.0003003430388097605}. Best is trial 23 with value: -0.88175068162932.
[I 2026-07-14 21:39:47,283] Trial 84 finished with value: -0.5717261379686359 and parameters: {'scalers': 'standard', 'ratios': 'log_ratio', 'imputers': 'none', 'n_estimators': 1850, 'learning_rate': 0.3659780183896969, 'max_depth': 7, 'min_child_weight': 4, 'subsample': 0.8, 'colsample_bytree': 0.7, 'colsample_bylevel': 0.6, 'reg_alpha': 2.665915029547297e-06, 'reg_lambda': 0.016771986900012723, 'gamma': 0.0002700703591029106}. Best is trial 23 with value: -0.88175068162932.
[I 2026-07-14 21:39:54,069] Trial 85 finished with value: -0.5750613169765552 and parameters: {'scalers': 'standard', 'ratios': 'log_ratio', 'imputers': 'none', 'n_estimators': 1850, 'learning_rate': 0.3660710846836974, 'max_depth': 7, 'min_child_weight': 4, 'subsample': 0.8, 'colsample_bytree': 0.6, 'colsample_bylevel': 0.6, 'reg_alpha': 4.0765895785255265e-06, 'reg_lambda': 1.4538825150171032e-05, 'gamma': 0.001902567788242625}. Best is trial 23 with value: -0.88175068162932.
[I 2026-07-14 21:39:54,892] Trial 86 finished with value: -0.26370418883601665 and parameters: {'scalers': 'standard', 'ratios': 'log_ratio', 'imputers': 'none', 'n_estimators': 1850, 'learning_rate': 0.3698993635538108, 'max_depth': 7, 'min_child_weight': 4, 'subsample': 0.8, 'colsample_bytree': 0.7, 'colsample_bylevel': 0.6, 'reg_alpha': 12.484338635101963, 'reg_lambda': 1.3918651184990475e-05, 'gamma': 0.0003554634544311529}. Best is trial 23 with value: -0.88175068162932.
[I 2026-07-14 21:40:01,970] Trial 87 finished with value: -0.5618846140146925 and parameters: {'scalers': 'standard', 'ratios': 'log_ratio', 'imputers': 'none', 'n_estimators': 1850, 'learning_rate': 0.38957117299230604, 'max_depth': 7, 'min_child_weight': 4, 'subsample': 0.8, 'colsample_bytree': 0.7, 'colsample_bylevel': 0.6, 'reg_alpha': 3.641139417840106e-06, 'reg_lambda': 0.0002574680489613678, 'gamma': 0.002453370125217253}. Best is trial 23 with value: -0.88175068162932.
[I 2026-07-14 21:40:09,120] Trial 88 finished with value: -0.5824419158902248 and parameters: {'scalers': 'standard', 'ratios': 'log_ratio', 'imputers': 'none', 'n_estimators': 1850, 'learning_rate': 0.38903032701706847, 'max_depth': 7, 'min_child_weight': 4, 'subsample': 0.8, 'colsample_bytree': 0.7, 'colsample_bylevel': 0.6, 'reg_alpha': 2.9575668293698964e-06, 'reg_lambda': 0.14880068953706804, 'gamma': 0.0017295990464864675}. Best is trial 23 with value: -0.88175068162932.
[I 2026-07-14 21:40:16,172] Trial 89 finished with value: -0.585191262948046 and parameters: {'scalers': 'standard', 'ratios': 'log_ratio', 'imputers': 'none', 'n_estimators': 1950, 'learning_rate': 0.4016552601588999, 'max_depth': 7, 'min_child_weight': 4, 'subsample': 0.8, 'colsample_bytree': 0.6, 'colsample_bylevel': 0.6, 'reg_alpha': 2.2784543730334894e-06, 'reg_lambda': 1.0321411125507734e-05, 'gamma': 0.0003315760053505093}. Best is trial 23 with value: -0.88175068162932.
