[I 2026-07-14 18:51:40,821] Trial 90 finished with value: -0.20146697122292506 and parameters: {'scalers': 'none', 'ratios': 'norm_ratio', 'imputers': 'median', 'n_estimators': 1850, 'learning_rate': 0.1356324671935878, 'max_depth': 10, 'min_child_weight': 2, 'subsample': 0.5, 'colsample_bytree': 0.5, 'colsample_bylevel': 0.9, 'reg_alpha': 2.0485895060076424e-05, 'reg_lambda': 29.909705238236068, 'gamma': 6.392289352026544e-06}. Best is trial 54 with value: -0.4280467639304385.
[I 2026-07-14 18:51:56,885] Trial 91 finished with value: -1.037287058544702 and parameters: {'scalers': 'none', 'ratios': 'norm_ratio', 'imputers': 'median', 'n_estimators': 1800, 'learning_rate': 0.410122575674182, 'max_depth': 10, 'min_child_weight': 1, 'subsample': 0.5, 'colsample_bytree': 0.5, 'colsample_bylevel': 0.9, 'reg_alpha': 8.826812605412934e-06, 'reg_lambda': 33.03380793137338, 'gamma': 6.5563397099902495e-06}. Best is trial 91 with value: -1.037287058544702.
[I 2026-07-14 18:52:13,116] Trial 92 finished with value: -0.9308088230296085 and parameters: {'scalers': 'none', 'ratios': 'norm_ratio', 'imputers': 'median', 'n_estimators': 1800, 'learning_rate': 0.4109653319763184, 'max_depth': 10, 'min_child_weight': 1, 'subsample': 0.5, 'colsample_bytree': 0.5, 'colsample_bylevel': 0.9, 'reg_alpha': 5.7216658728169846e-05, 'reg_lambda': 26.455723382218817, 'gamma': 6.991178081902391e-06}. Best is trial 91 with value: -1.037287058544702.
[I 2026-07-14 18:52:37,160] Trial 93 finished with value: -0.7041262292520146 and parameters: {'scalers': 'none', 'ratios': 'norm_ratio', 'imputers': 'median', 'n_estimators': 1800, 'learning_rate': 0.41040066633309075, 'max_depth': 10, 'min_child_weight': 1, 'subsample': 0.5, 'colsample_bytree': 0.8, 'colsample_bylevel': 0.9, 'reg_alpha': 3.4244611654950616e-06, 'reg_lambda': 21.741391880522443, 'gamma': 6.516270085456356e-06}. Best is trial 91 with value: -1.037287058544702.
[I 2026-07-14 18:53:03,165] Trial 94 finished with value: -0.631766608269425 and parameters: {'scalers': 'none', 'ratios': 'norm_ratio', 'imputers': 'median', 'n_estimators': 1750, 'learning_rate': 0.397601500276265, 'max_depth': 11, 'min_child_weight': 1, 'subsample': 0.5, 'colsample_bytree': 0.8, 'colsample_bylevel': 0.9, 'reg_alpha': 9.66665639047257e-06, 'reg_lambda': 17.547855057333198, 'gamma': 6.526081624351652e-06}. Best is trial 91 with value: -1.037287058544702.
[I 2026-07-14 18:53:21,807] Trial 95 finished with value: -0.2679417280529138 and parameters: {'scalers': 'none', 'ratios': 'norm_ratio', 'imputers': 'median', 'n_estimators': 2400, 'learning_rate': 0.427721171510534, 'max_depth': 11, 'min_child_weight': 1, 'subsample': 0.6, 'colsample_bytree': 0.8, 'colsample_bylevel': 0.9, 'reg_alpha': 5.730932591651742e-05, 'reg_lambda': 0.04210477672062197, 'gamma': 6.314014341531377e-06}. Best is trial 91 with value: -1.037287058544702.
[I 2026-07-14 18:53:38,323] Trial 96 finished with value: -0.3076920712811513 and parameters: {'scalers': 'none', 'ratios': 'norm_ratio', 'imputers': 'median', 'n_estimators': 1800, 'learning_rate': 0.42094318771037875, 'max_depth': 11, 'min_child_weight': 1, 'subsample': 0.6, 'colsample_bytree': 0.8, 'colsample_bylevel': 0.9, 'reg_alpha': 5.136767159881459e-05, 'reg_lambda': 0.8811305943441864, 'gamma': 5.337311267981266e-06}. Best is trial 91 with value: -1.037287058544702.
[I 2026-07-14 18:53:51,395] Trial 97 finished with value: -0.2627184886374741 and parameters: {'scalers': 'none', 'ratios': 'norm_ratio', 'imputers': 'median', 'n_estimators': 2350, 'learning_rate': 0.4024197465519439, 'max_depth': 11, 'min_child_weight': 1, 'subsample': 0.6, 'colsample_bytree': 0.8, 'colsample_bylevel': 0.5, 'reg_alpha': 3.297607448047888e-06, 'reg_lambda': 0.04337211087471264, 'gamma': 7.302345154575884e-05}. Best is trial 91 with value: -1.037287058544702.
[I 2026-07-14 18:54:05,268] Trial 98 finished with value: -0.23899567616822123 and parameters: {'scalers': 'robust', 'ratios': 'norm_ratio', 'imputers': 'mean', 'n_estimators': 1750, 'learning_rate': 0.41186472562531456, 'max_depth': 11, 'min_child_weight': 1, 'subsample': 0.6, 'colsample_bytree': 0.8, 'colsample_bylevel': 0.9, 'reg_alpha': 5.33898037450495e-05, 'reg_lambda': 0.048329363875121024, 'gamma': 2.42495352206003e-06}. Best is trial 91 with value: -1.037287058544702.
[I 2026-07-14 18:54:19,028] Trial 99 finished with value: -0.24741804535154466 and parameters: {'scalers': 'none', 'ratios': 'norm_ratio', 'imputers': 'median', 'n_estimators': 1750, 'learning_rate': 0.4273552214290181, 'max_depth': 11, 'min_child_weight': 1, 'subsample': 0.6, 'colsample_bytree': 0.8, 'colsample_bylevel': 0.9, 'reg_alpha': 5.15950671364769e-05, 'reg_lambda': 0.046170802648214514, 'gamma': 2.5444762585153395e-06}. Best is trial 91 with value: -1.037287058544702.
[I 2026-07-14 18:54:34,873] Trial 100 finished with value: -0.7884119462441842 and parameters: {'scalers': 'none', 'ratios': 'norm_ratio', 'imputers': 'median', 'n_estimators': 1700, 'learning_rate': 0.42316390022851874, 'max_depth': 10, 'min_child_weight': 1, 'subsample': 0.5, 'colsample_bytree': 0.5, 'colsample_bylevel': 0.9, 'reg_alpha': 9.986070868012868e-06, 'reg_lambda': 19.088930648910946, 'gamma': 6.633903658954143e-05}. Best is trial 91 with value: -1.037287058544702.
[I 2026-07-14 18:54:50,881] Trial 101 finished with value: -0.7082864330128881 and parameters: {'scalers': 'none', 'ratios': 'norm_ratio', 'imputers': 'median', 'n_estimators': 1750, 'learning_rate': 0.40050127682881825, 'max_depth': 10, 'min_child_weight': 1, 'subsample': 0.5, 'colsample_bytree': 0.5, 'colsample_bylevel': 0.9, 'reg_alpha': 3.702674527732898e-06, 'reg_lambda': 17.81968978655873, 'gamma': 6.144631938431482e-05}. Best is trial 91 with value: -1.037287058544702.
[I 2026-07-14 18:55:14,533] Trial 102 finished with value: -0.645303435693114 and parameters: {'scalers': 'none', 'ratios': 'norm_ratio', 'imputers': 'median', 'n_estimators': 1750, 'learning_rate': 0.41831937112406803, 'max_depth': 10, 'min_child_weight': 1, 'subsample': 0.5, 'colsample_bytree': 0.8, 'colsample_bylevel': 0.9, 'reg_alpha': 5.5747757213979954e-05, 'reg_lambda': 16.646449446925157, 'gamma': 2.5129195678324013e-06}. Best is trial 91 with value: -1.037287058544702.
[I 2026-07-14 18:55:28,180] Trial 103 finished with value: -0.27254898997911037 and parameters: {'scalers': 'none', 'ratios': 'norm_ratio', 'imputers': 'median', 'n_estimators': 1750, 'learning_rate': 0.33884976208777084, 'max_depth': 10, 'min_child_weight': 1, 'subsample': 0.5, 'colsample_bytree': 0.8, 'colsample_bylevel': 0.9, 'reg_alpha': 5.3314690623330325e-05, 'reg_lambda': 0.990019005810051, 'gamma': 6.436604203677295e-05}. Best is trial 91 with value: -1.037287058544702.
[I 2026-07-14 18:55:52,148] Trial 104 finished with value: -0.4757276458194538 and parameters: {'scalers': 'none', 'ratios': 'norm_ratio', 'imputers': 'median', 'n_estimators': 1750, 'learning_rate': 0.32530407939139605, 'max_depth': 10, 'min_child_weight': 1, 'subsample': 0.5, 'colsample_bytree': 0.8, 'colsample_bylevel': 1.0, 'reg_alpha': 5.70830213641631e-05, 'reg_lambda': 18.30929046643161, 'gamma': 2.1065639302729003e-05}. Best is trial 91 with value: -1.037287058544702.
[I 2026-07-14 18:56:14,723] Trial 105 finished with value: -0.4882794900988981 and parameters: {'scalers': 'none', 'ratios': 'log_ratio', 'imputers': 'median', 'n_estimators': 1750, 'learning_rate': 0.3395722288965611, 'max_depth': 10, 'min_child_weight': 1, 'subsample': 0.5, 'colsample_bytree': 0.8, 'colsample_bylevel': 0.9, 'reg_alpha': 5.437478666089302e-05, 'reg_lambda': 18.099225116867643, 'gamma': 2.407608946529893e-06}. Best is trial 91 with value: -1.037287058544702.
[I 2026-07-14 18:56:43,756] Trial 106 finished with value: -0.5215071301768184 and parameters: {'scalers': 'none', 'ratios': 'log_ratio', 'imputers': 'median', 'n_estimators': 2100, 'learning_rate': 0.3393293337597755, 'max_depth': 10, 'min_child_weight': 1, 'subsample': 0.5, 'colsample_bytree': 0.8, 'colsample_bylevel': 1.0, 'reg_alpha': 8.514791692698888e-06, 'reg_lambda': 18.86603435890923, 'gamma': 2.124647532536989e-05}. Best is trial 91 with value: -1.037287058544702.
[I 2026-07-14 18:57:12,339] Trial 107 finished with value: -0.4905469813802661 and parameters: {'scalers': 'none', 'ratios': 'log_ratio', 'imputers': 'median', 'n_estimators': 2100, 'learning_rate': 0.3300791363412944, 'max_depth': 10, 'min_child_weight': 1, 'subsample': 0.5, 'colsample_bytree': 0.8, 'colsample_bylevel': 1.0, 'reg_alpha': 6.4802383026531e-05, 'reg_lambda': 15.34714538624868, 'gamma': 2.0613068536395828e-05}. Best is trial 91 with value: -1.037287058544702.
[I 2026-07-14 18:57:29,381] Trial 108 finished with value: -0.6024098405108921 and parameters: {'scalers': 'none', 'ratios': 'norm_ratio', 'imputers': 'median', 'n_estimators': 1900, 'learning_rate': 0.3681837228056256, 'max_depth': 10, 'min_child_weight': 1, 'subsample': 0.5, 'colsample_bytree': 0.5, 'colsample_bylevel': 0.9, 'reg_alpha': 7.505727411441178e-06, 'reg_lambda': 16.925129715794746, 'gamma': 7.334574017160372e-05}. Best is trial 91 with value: -1.037287058544702.
[I 2026-07-14 18:57:47,840] Trial 109 finished with value: -0.5443686902977899 and parameters: {'scalers': 'none', 'ratios': 'norm_ratio', 'imputers': 'median', 'n_estimators': 2100, 'learning_rate': 0.33348273022371183, 'max_depth': 10, 'min_child_weight': 1, 'subsample': 0.5, 'colsample_bytree': 0.5, 'colsample_bylevel': 0.9, 'reg_alpha': 9.010500217502062e-06, 'reg_lambda': 16.610012721145615, 'gamma': 9.071088040687145e-05}. Best is trial 91 with value: -1.037287058544702.
[I 2026-07-14 18:58:06,225] Trial 110 finished with value: -0.5899113336423358 and parameters: {'scalers': 'none', 'ratios': 'norm_ratio', 'imputers': 'median', 'n_estimators': 2100, 'learning_rate': 0.33322966914065244, 'max_depth': 10, 'min_child_weight': 1, 'subsample': 0.5, 'colsample_bytree': 0.5, 'colsample_bylevel': 0.9, 'reg_alpha': 1.236433159949278e-05, 'reg_lambda': 22.768443542377796, 'gamma': 5.644125534171351e-05}. Best is trial 91 with value: -1.037287058544702.
[I 2026-07-14 18:58:19,390] Trial 111 finished with value: -0.4773878382177904 and parameters: {'scalers': 'none', 'ratios': 'norm_ratio', 'imputers': 'median', 'n_estimators': 1500, 'learning_rate': 0.32768301853700665, 'max_depth': 10, 'min_child_weight': 1, 'subsample': 0.5, 'colsample_bytree': 0.5, 'colsample_bylevel': 0.9, 'reg_alpha': 7.902380617509056e-06, 'reg_lambda': 17.09820735230455, 'gamma': 4.83947395562782e-05}. Best is trial 91 with value: -1.037287058544702.
[I 2026-07-14 18:58:37,013] Trial 112 finished with value: -0.4898631704235815 and parameters: {'scalers': 'none', 'ratios': 'norm_ratio', 'imputers': 'median', 'n_estimators': 2100, 'learning_rate': 0.32621852200677637, 'max_depth': 9, 'min_child_weight': 1, 'subsample': 0.5, 'colsample_bytree': 0.5, 'colsample_bylevel': 1.0, 'reg_alpha': 0.0002589123919183365, 'reg_lambda': 18.134670154981507, 'gamma': 9.961800364229023e-05}. Best is trial 91 with value: -1.037287058544702.
[I 2026-07-14 18:58:53,563] Trial 113 finished with value: -0.3898273380497721 and parameters: {'scalers': 'none', 'ratios': 'norm_ratio', 'imputers': 'median', 'n_estimators': 2100, 'learning_rate': 0.24605175169071197, 'max_depth': 9, 'min_child_weight': 1, 'subsample': 0.5, 'colsample_bytree': 0.5, 'colsample_bylevel': 1.0, 'reg_alpha': 0.00023866618236196847, 'reg_lambda': 17.681701877463553, 'gamma': 2.202910079724994e-05}. Best is trial 91 with value: -1.037287058544702.
[I 2026-07-14 18:59:10,278] Trial 114 finished with value: -0.3897123164081212 and parameters: {'scalers': 'none', 'ratios': 'norm_ratio', 'imputers': 'median', 'n_estimators': 2100, 'learning_rate': 0.23995391213854467, 'max_depth': 9, 'min_child_weight': 1, 'subsample': 0.5, 'colsample_bytree': 0.5, 'colsample_bylevel': 1.0, 'reg_alpha': 9.308194182898613e-06, 'reg_lambda': 18.71391451645431, 'gamma': 0.0001040065357722647}. Best is trial 91 with value: -1.037287058544702.
[I 2026-07-14 18:59:27,316] Trial 115 finished with value: -0.5000658600280024 and parameters: {'scalers': 'none', 'ratios': 'norm_ratio', 'imputers': 'median', 'n_estimators': 2100, 'learning_rate': 0.32526969779928755, 'max_depth': 9, 'min_child_weight': 1, 'subsample': 0.5, 'colsample_bytree': 0.5, 'colsample_bylevel': 1.0, 'reg_alpha': 0.0002913848536588586, 'reg_lambda': 19.555147389867095, 'gamma': 2.2463292427124844e-05}. Best is trial 91 with value: -1.037287058544702.
[I 2026-07-14 18:59:43,636] Trial 116 finished with value: -0.4245530478775595 and parameters: {'scalers': 'none', 'ratios': 'norm_ratio', 'imputers': 'median', 'n_estimators': 2150, 'learning_rate': 0.23508752355096443, 'max_depth': 9, 'min_child_weight': 1, 'subsample': 0.5, 'colsample_bytree': 0.5, 'colsample_bylevel': 1.0, 'reg_alpha': 9.040009087237305e-06, 'reg_lambda': 45.6242064639897, 'gamma': 4.628584008160137e-05}. Best is trial 91 with value: -1.037287058544702.
[I 2026-07-14 18:59:59,912] Trial 117 finished with value: -0.43558764168673764 and parameters: {'scalers': 'none', 'ratios': 'norm_ratio', 'imputers': 'median', 'n_estimators': 2100, 'learning_rate': 0.24961122687496992, 'max_depth': 9, 'min_child_weight': 1, 'subsample': 0.5, 'colsample_bytree': 0.5, 'colsample_bylevel': 1.0, 'reg_alpha': 8.47653984743456e-06, 'reg_lambda': 41.52757911874337, 'gamma': 0.00010100393380546154}. Best is trial 91 with value: -1.037287058544702.
[I 2026-07-14 19:00:15,954] Trial 118 finished with value: -0.4270174104054401 and parameters: {'scalers': 'none', 'ratios': 'norm_ratio', 'imputers': 'median', 'n_estimators': 2100, 'learning_rate': 0.24340908959402338, 'max_depth': 9, 'min_child_weight': 1, 'subsample': 0.5, 'colsample_bytree': 0.5, 'colsample_bylevel': 1.0, 'reg_alpha': 9.985230426524117e-06, 'reg_lambda': 45.234585696917875, 'gamma': 8.25958134994601e-05}. Best is trial 91 with value: -1.037287058544702.
[I 2026-07-14 19:00:31,931] Trial 119 finished with value: -0.425841569579967 and parameters: {'scalers': 'none', 'ratios': 'norm_ratio', 'imputers': 'median', 'n_estimators': 2100, 'learning_rate': 0.24048508695803797, 'max_depth': 9, 'min_child_weight': 1, 'subsample': 0.5, 'colsample_bytree': 0.5, 'colsample_bylevel': 1.0, 'reg_alpha': 1.0016837610914094e-05, 'reg_lambda': 45.09024420585147, 'gamma': 0.00044914209761049464}. Best is trial 91 with value: -1.037287058544702.
[I 2026-07-14 19:00:48,329] Trial 120 finished with value: -0.43438728193260817 and parameters: {'scalers': 'none', 'ratios': 'norm_ratio', 'imputers': 'median', 'n_estimators': 2150, 'learning_rate': 0.24294597859637193, 'max_depth': 9, 'min_child_weight': 1, 'subsample': 0.5, 'colsample_bytree': 0.5, 'colsample_bylevel': 1.0, 'reg_alpha': 1.0778389483412e-05, 'reg_lambda': 43.796719218047045, 'gamma': 0.00035052654531999146}. Best is trial 91 with value: -1.037287058544702.
[I 2026-07-14 19:01:06,298] Trial 121 finished with value: -0.47684471283957874 and parameters: {'scalers': 'none', 'ratios': 'norm_ratio', 'imputers': 'median', 'n_estimators': 2100, 'learning_rate': 0.23963184181173364, 'max_depth': 10, 'min_child_weight': 1, 'subsample': 0.5, 'colsample_bytree': 0.5, 'colsample_bylevel': 1.0, 'reg_alpha': 1.2957235111298167e-05, 'reg_lambda': 43.7314275757493, 'gamma': 0.00042476250348467466}. Best is trial 91 with value: -1.037287058544702.
[I 2026-07-14 19:01:24,836] Trial 122 finished with value: -0.09890538859266206 and parameters: {'scalers': 'none', 'ratios': 'norm_ratio', 'imputers': 'median', 'n_estimators': 1950, 'learning_rate': 0.006923847567435267, 'max_depth': 10, 'min_child_weight': 1, 'subsample': 0.5, 'colsample_bytree': 0.5, 'colsample_bylevel': 1.0, 'reg_alpha': 1.2428980398199385e-05, 'reg_lambda': 44.67684517176593, 'gamma': 0.00027173813928826695}. Best is trial 91 with value: -1.037287058544702.
[I 2026-07-14 19:01:40,125] Trial 123 finished with value: -0.3571588767820693 and parameters: {'scalers': 'none', 'ratios': 'norm_ratio', 'imputers': 'median', 'n_estimators': 1900, 'learning_rate': 0.18033586365055546, 'max_depth': 10, 'min_child_weight': 1, 'subsample': 0.5, 'colsample_bytree': 0.5, 'colsample_bylevel': 1.0, 'reg_alpha': 0.001965007790490464, 'reg_lambda': 47.39952418428238, 'gamma': 0.00029854674154527447}. Best is trial 91 with value: -1.037287058544702.
[I 2026-07-14 19:01:55,544] Trial 124 finished with value: -0.33816393033199865 and parameters: {'scalers': 'none', 'ratios': 'norm_ratio', 'imputers': 'median', 'n_estimators': 1900, 'learning_rate': 0.24686181259417853, 'max_depth': 10, 'min_child_weight': 1, 'subsample': 0.5, 'colsample_bytree': 0.5, 'colsample_bylevel': 1.0, 'reg_alpha': 1.404177871965681e-05, 'reg_lambda': 4.3266601551459205, 'gamma': 0.000143440606710948}. Best is trial 91 with value: -1.037287058544702.
[I 2026-07-14 19:02:10,727] Trial 125 finished with value: -0.2856767977276806 and parameters: {'scalers': 'none', 'ratios': 'norm_ratio', 'imputers': 'median', 'n_estimators': 1900, 'learning_rate': 0.17302478536498925, 'max_depth': 10, 'min_child_weight': 1, 'subsample': 0.5, 'colsample_bytree': 0.5, 'colsample_bylevel': 1.0, 'reg_alpha': 0.008276939156015921, 'reg_lambda': 4.822986038809934, 'gamma': 0.0005179662735951275}. Best is trial 91 with value: -1.037287058544702.
[I 2026-07-14 19:02:20,704] Trial 126 finished with value: -0.25012020155545844 and parameters: {'scalers': 'none', 'ratios': 'norm_ratio', 'imputers': 'median', 'n_estimators': 1950, 'learning_rate': 0.17557059801033503, 'max_depth': 8, 'min_child_weight': 1, 'subsample': 0.5, 'colsample_bytree': 0.5, 'colsample_bylevel': 0.9, 'reg_alpha': 0.0019046557043543378, 'reg_lambda': 5.260995210885256, 'gamma': 0.00035807446445592094}. Best is trial 91 with value: -1.037287058544702.
[I 2026-07-14 19:02:34,914] Trial 127 finished with value: -0.29792721420462964 and parameters: {'scalers': 'none', 'ratios': 'norm_ratio', 'imputers': 'median', 'n_estimators': 1950, 'learning_rate': 0.17243633747614712, 'max_depth': 10, 'min_child_weight': 1, 'subsample': 0.5, 'colsample_bytree': 0.5, 'colsample_bylevel': 0.9, 'reg_alpha': 0.0018270642287284327, 'reg_lambda': 5.055733837139411, 'gamma': 0.00030380000003520097}. Best is trial 91 with value: -1.037287058544702.
[I 2026-07-14 19:02:49,795] Trial 128 finished with value: -0.28421782161574805 and parameters: {'scalers': 'none', 'ratios': 'norm_ratio', 'imputers': 'median', 'n_estimators': 1900, 'learning_rate': 0.16681788844005038, 'max_depth': 10, 'min_child_weight': 1, 'subsample': 0.5, 'colsample_bytree': 0.5, 'colsample_bylevel': 1.0, 'reg_alpha': 0.003684773461922026, 'reg_lambda': 4.442112356734932, 'gamma': 5.560423100167428e-05}. Best is trial 91 with value: -1.037287058544702.
[I 2026-07-14 19:03:05,365] Trial 129 finished with value: -0.4352916597175325 and parameters: {'scalers': 'none', 'ratios': 'norm_ratio', 'imputers': 'median', 'n_estimators': 1950, 'learning_rate': 0.34062569930551434, 'max_depth': 10, 'min_child_weight': 1, 'subsample': 0.5, 'colsample_bytree': 0.5, 'colsample_bylevel': 0.9, 'reg_alpha': 0.00011908186479553403, 'reg_lambda': 4.710104794494366, 'gamma': 6.011465842180232e-05}. Best is trial 91 with value: -1.037287058544702.
[I 2026-07-14 19:03:22,357] Trial 130 finished with value: -0.3142477094118068 and parameters: {'scalers': 'none', 'ratios': 'norm_ratio', 'imputers': 'median', 'n_estimators': 2300, 'learning_rate': 0.1822789032432063, 'max_depth': 10, 'min_child_weight': 1, 'subsample': 0.5, 'colsample_bytree': 0.5, 'colsample_bylevel': 0.9, 'reg_alpha': 2.3738692379012185e-05, 'reg_lambda': 5.060431270783111, 'gamma': 0.0001577057770774851}. Best is trial 91 with value: -1.037287058544702.
[I 2026-07-14 19:03:43,067] Trial 131 finished with value: -0.44137060761160307 and parameters: {'scalers': 'none', 'ratios': 'norm_ratio', 'imputers': 'median', 'n_estimators': 2550, 'learning_rate': 0.30936070367631546, 'max_depth': 10, 'min_child_weight': 1, 'subsample': 0.5, 'colsample_bytree': 0.5, 'colsample_bylevel': 0.9, 'reg_alpha': 0.00013108278057296125, 'reg_lambda': 5.854433108579936, 'gamma': 0.00013693220853200163}. Best is trial 91 with value: -1.037287058544702.
[I 2026-07-14 19:04:00,903] Trial 132 finished with value: -0.33265708829140633 and parameters: {'scalers': 'none', 'ratios': 'norm_ratio', 'imputers': 'median', 'n_estimators': 2300, 'learning_rate': 0.1738055610159, 'max_depth': 10, 'min_child_weight': 1, 'subsample': 0.5, 'colsample_bytree': 0.5, 'colsample_bylevel': 0.9, 'reg_alpha': 0.00011112499125963061, 'reg_lambda': 7.724242868095993, 'gamma': 5.4202872492343206e-05}. Best is trial 91 with value: -1.037287058544702.
[I 2026-07-14 19:04:20,328] Trial 133 finished with value: -0.44985878521009964 and parameters: {'scalers': 'none', 'ratios': 'norm_ratio', 'imputers': 'median', 'n_estimators': 2300, 'learning_rate': 0.30166425282067705, 'max_depth': 10, 'min_child_weight': 1, 'subsample': 0.5, 'colsample_bytree': 0.5, 'colsample_bylevel': 0.9, 'reg_alpha': 2.2410283641840217e-05, 'reg_lambda': 8.743988747414935, 'gamma': 5.400772607622247e-05}. Best is trial 91 with value: -1.037287058544702.
[I 2026-07-14 19:04:34,478] Trial 135 finished with value: -0.05622889992578464 and parameters: {'scalers': 'none', 'ratios': 'norm_ratio', 'imputers': 'median', 'n_estimators': 450, 'learning_rate': 0.3030407395970633, 'max_depth': 10, 'min_child_weight': 10, 'subsample': 0.5, 'colsample_bytree': 0.5, 'colsample_bylevel': 0.9, 'reg_alpha': 0.0001323650016204044, 'reg_lambda': 9.754584725125454, 'gamma': 0.4228255442955032}. Best is trial 91 with value: -1.037287058544702.
