[I 2026-07-14 19:04:39,797] Trial 136 finished with value: -0.05627323600121429 and parameters: {'scalers': 'none', 'ratios': 'norm_ratio', 'imputers': 'median', 'n_estimators': 2550, 'learning_rate': 0.30842065591990125, 'max_depth': 10, 'min_child_weight': 2, 'subsample': 0.5, 'colsample_bytree': 0.5, 'colsample_bylevel': 0.9, 'reg_alpha': 0.00012079018740495524, 'reg_lambda': 9.32402845359334, 'gamma': 0.4736523314941994}. Best is trial 91 with value: -1.037287058544702.
[I 2026-07-14 19:04:39,905] Trial 134 finished with value: -0.47714231953515673 and parameters: {'scalers': 'none', 'ratios': 'norm_ratio', 'imputers': 'median', 'n_estimators': 2300, 'learning_rate': 0.32175474916730745, 'max_depth': 10, 'min_child_weight': 1, 'subsample': 0.5, 'colsample_bytree': 0.5, 'colsample_bylevel': 0.9, 'reg_alpha': 0.00013577284914830472, 'reg_lambda': 8.854144147678847, 'gamma': 2.362328244571603e-05}. Best is trial 91 with value: -1.037287058544702.
[I 2026-07-14 19:04:51,512] Trial 137 finished with value: -0.13940050092509074 and parameters: {'scalers': 'none', 'ratios': 'norm_ratio', 'imputers': 'median', 'n_estimators': 2300, 'learning_rate': 0.2979773621008981, 'max_depth': 10, 'min_child_weight': 10, 'subsample': 0.5, 'colsample_bytree': 0.5, 'colsample_bylevel': 0.9, 'reg_alpha': 2.457762905233421e-05, 'reg_lambda': 8.283674504181558, 'gamma': 1.9852114669753397e-05}. Best is trial 91 with value: -1.037287058544702.
[I 2026-07-14 19:04:53,276] Trial 138 finished with value: -0.20507606724630953 and parameters: {'scalers': 'none', 'ratios': 'norm_ratio', 'imputers': 'median', 'n_estimators': 200, 'learning_rate': 0.31031152718097926, 'max_depth': 10, 'min_child_weight': 1, 'subsample': 0.5, 'colsample_bytree': 0.5, 'colsample_bylevel': 0.9, 'reg_alpha': 0.0002960193826072411, 'reg_lambda': 7.956451999752741, 'gamma': 2.6100611085538515e-05}. Best is trial 91 with value: -1.037287058544702.
[I 2026-07-14 19:05:10,672] Trial 139 finished with value: -0.43534130060618004 and parameters: {'scalers': 'none', 'ratios': 'norm_ratio', 'imputers': 'median', 'n_estimators': 2200, 'learning_rate': 0.3117456608115197, 'max_depth': 9, 'min_child_weight': 1, 'subsample': 0.5, 'colsample_bytree': 0.5, 'colsample_bylevel': 1.0, 'reg_alpha': 0.00020200294192617156, 'reg_lambda': 9.126037085148342, 'gamma': 2.0730446029642314e-05}. Best is trial 91 with value: -1.037287058544702.
[I 2026-07-14 19:05:28,854] Trial 140 finished with value: -0.4392152489755059 and parameters: {'scalers': 'none', 'ratios': 'norm_ratio', 'imputers': 'median', 'n_estimators': 2250, 'learning_rate': 0.31590005992388026, 'max_depth': 9, 'min_child_weight': 1, 'subsample': 0.5, 'colsample_bytree': 0.5, 'colsample_bylevel': 1.0, 'reg_alpha': 8.344692852510466e-05, 'reg_lambda': 11.484204268555915, 'gamma': 2.4228248590638606e-05}. Best is trial 91 with value: -1.037287058544702.
[I 2026-07-14 19:05:45,135] Trial 141 finished with value: -0.3125124806001126 and parameters: {'scalers': 'none', 'ratios': 'norm_ratio', 'imputers': 'median', 'n_estimators': 2200, 'learning_rate': 0.3693288435051409, 'max_depth': 9, 'min_child_weight': 2, 'subsample': 0.5, 'colsample_bytree': 0.5, 'colsample_bylevel': 1.0, 'reg_alpha': 0.00024993941419009495, 'reg_lambda': 12.461668254173382, 'gamma': 2.4927151092656863e-05}. Best is trial 91 with value: -1.037287058544702.
[I 2026-07-14 19:06:02,074] Trial 142 finished with value: -0.28014002457367315 and parameters: {'scalers': 'none', 'ratios': 'norm_ratio', 'imputers': 'median', 'n_estimators': 1650, 'learning_rate': 0.3677382346231033, 'max_depth': 9, 'min_child_weight': 2, 'subsample': 0.5, 'colsample_bytree': 0.8, 'colsample_bylevel': 1.0, 'reg_alpha': 5.11054749289707e-06, 'reg_lambda': 12.588735661668325, 'gamma': 2.201510547412812e-05}. Best is trial 91 with value: -1.037287058544702.
[I 2026-07-14 19:06:21,644] Trial 143 finished with value: -0.4663592246738544 and parameters: {'scalers': 'none', 'ratios': 'norm_ratio', 'imputers': 'median', 'n_estimators': 1650, 'learning_rate': 0.38740218356809036, 'max_depth': 9, 'min_child_weight': 1, 'subsample': 0.5, 'colsample_bytree': 0.8, 'colsample_bylevel': 1.0, 'reg_alpha': 0.00041261723841572835, 'reg_lambda': 13.345024209914717, 'gamma': 2.5626506576745807e-05}. Best is trial 91 with value: -1.037287058544702.
[I 2026-07-14 19:06:22,727] Trial 144 finished with value: -0.05833523820571778 and parameters: {'scalers': 'none', 'ratios': 'norm_ratio', 'imputers': 'median', 'n_estimators': 1650, 'learning_rate': 0.3795761538819859, 'max_depth': 9, 'min_child_weight': 2, 'subsample': 0.5, 'colsample_bytree': 0.8, 'colsample_bylevel': 1.0, 'reg_alpha': 0.00039882071903783874, 'reg_lambda': 90.51045199850255, 'gamma': 27.136414419155457}. Best is trial 91 with value: -1.037287058544702.
[I 2026-07-14 19:06:45,542] Trial 145 finished with value: -0.3086451159508747 and parameters: {'scalers': 'none', 'ratios': 'norm_ratio', 'imputers': 'median', 'n_estimators': 2200, 'learning_rate': 0.38949803419861134, 'max_depth': 9, 'min_child_weight': 2, 'subsample': 0.5, 'colsample_bytree': 0.8, 'colsample_bylevel': 1.0, 'reg_alpha': 0.00025824501866560936, 'reg_lambda': 14.253284024321122, 'gamma': 8.505594698113661e-06}. Best is trial 91 with value: -1.037287058544702.
[I 2026-07-14 19:07:05,721] Trial 146 finished with value: -0.3109195784920638 and parameters: {'scalers': 'none', 'ratios': 'norm_ratio', 'imputers': 'median', 'n_estimators': 2200, 'learning_rate': 0.37501217642448226, 'max_depth': 8, 'min_child_weight': 2, 'subsample': 0.5, 'colsample_bytree': 0.8, 'colsample_bylevel': 1.0, 'reg_alpha': 5.131998489699077e-06, 'reg_lambda': 25.18082212907636, 'gamma': 8.127167856162475e-06}. Best is trial 91 with value: -1.037287058544702.
[I 2026-07-14 19:07:22,983] Trial 147 finished with value: -0.28959793652299626 and parameters: {'scalers': 'none', 'ratios': 'norm_ratio', 'imputers': 'median', 'n_estimators': 1650, 'learning_rate': 0.3685772677447744, 'max_depth': 9, 'min_child_weight': 2, 'subsample': 0.5, 'colsample_bytree': 0.8, 'colsample_bylevel': 1.0, 'reg_alpha': 5.014395237924654e-06, 'reg_lambda': 15.062709649270156, 'gamma': 7.596623424890485e-06}. Best is trial 91 with value: -1.037287058544702.
[I 2026-07-14 19:07:41,773] Trial 148 finished with value: -0.5600237187403272 and parameters: {'scalers': 'none', 'ratios': 'log_ratio', 'imputers': 'median', 'n_estimators': 1650, 'learning_rate': 0.38470306868888104, 'max_depth': 9, 'min_child_weight': 1, 'subsample': 0.5, 'colsample_bytree': 0.8, 'colsample_bylevel': 0.9, 'reg_alpha': 0.0010364458740057285, 'reg_lambda': 24.110650859646103, 'gamma': 9.655380042158435e-06}. Best is trial 91 with value: -1.037287058544702.
[I 2026-07-14 19:07:58,997] Trial 149 finished with value: -0.5000568022450438 and parameters: {'scalers': 'none', 'ratios': 'log_ratio', 'imputers': 'median', 'n_estimators': 1800, 'learning_rate': 0.39298684089836117, 'max_depth': 8, 'min_child_weight': 1, 'subsample': 0.5, 'colsample_bytree': 0.8, 'colsample_bylevel': 0.9, 'reg_alpha': 0.0011173195093948749, 'reg_lambda': 21.42140892439866, 'gamma': 8.751292786454164e-06}. Best is trial 91 with value: -1.037287058544702.
[I 2026-07-14 19:08:17,985] Trial 150 finished with value: -0.8720856486723647 and parameters: {'scalers': 'none', 'ratios': 'log_ratio', 'imputers': 'median', 'n_estimators': 2050, 'learning_rate': 0.408886776109358, 'max_depth': 8, 'min_child_weight': 1, 'subsample': 0.5, 'colsample_bytree': 0.8, 'colsample_bylevel': 0.9, 'reg_alpha': 0.0004158787974803174, 'reg_lambda': 92.57321486784663, 'gamma': 8.141851090913678e-06}. Best is trial 91 with value: -1.037287058544702.
[I 2026-07-14 19:08:34,604] Trial 151 finished with value: -0.057606587462667266 and parameters: {'scalers': 'none', 'ratios': 'log_ratio', 'imputers': 'median', 'n_estimators': 1800, 'learning_rate': 0.00030153942579181275, 'max_depth': 8, 'min_child_weight': 1, 'subsample': 0.5, 'colsample_bytree': 0.8, 'colsample_bylevel': 0.9, 'reg_alpha': 3.1149238230750507e-06, 'reg_lambda': 23.805087003918807, 'gamma': 1.1143960228779326e-05}. Best is trial 91 with value: -1.037287058544702.
[I 2026-07-14 19:08:51,958] Trial 152 finished with value: -0.5627477468745071 and parameters: {'scalers': 'none', 'ratios': 'log_ratio', 'imputers': 'median', 'n_estimators': 1800, 'learning_rate': 0.4191991062875376, 'max_depth': 8, 'min_child_weight': 1, 'subsample': 0.5, 'colsample_bytree': 0.8, 'colsample_bylevel': 0.9, 'reg_alpha': 3.163987137826925e-06, 'reg_lambda': 23.25913961329279, 'gamma': 7.641579819316543e-06}. Best is trial 91 with value: -1.037287058544702.
[I 2026-07-14 19:09:09,386] Trial 153 finished with value: -0.5705414335384856 and parameters: {'scalers': 'none', 'ratios': 'log_ratio', 'imputers': 'median', 'n_estimators': 1800, 'learning_rate': 0.42657941887803125, 'max_depth': 8, 'min_child_weight': 1, 'subsample': 0.5, 'colsample_bytree': 0.8, 'colsample_bylevel': 0.9, 'reg_alpha': 2.949500979204413e-06, 'reg_lambda': 22.640825009347356, 'gamma': 7.685146668717848e-06}. Best is trial 91 with value: -1.037287058544702.
[I 2026-07-14 19:09:33,772] Trial 154 finished with value: -0.8360875389320513 and parameters: {'scalers': 'none', 'ratios': 'log_ratio', 'imputers': 'median', 'n_estimators': 1800, 'learning_rate': 0.4309397949533948, 'max_depth': 10, 'min_child_weight': 1, 'subsample': 0.5, 'colsample_bytree': 0.8, 'colsample_bylevel': 0.9, 'reg_alpha': 3.3242728615547547e-06, 'reg_lambda': 23.47792407273018, 'gamma': 7.78433001039744e-05}. Best is trial 91 with value: -1.037287058544702.
[I 2026-07-14 19:10:00,980] Trial 155 finished with value: -1.2401445751324898 and parameters: {'scalers': 'none', 'ratios': 'log_ratio', 'imputers': 'median', 'n_estimators': 2000, 'learning_rate': 0.45548875600653826, 'max_depth': 10, 'min_child_weight': 1, 'subsample': 0.5, 'colsample_bytree': 0.8, 'colsample_bylevel': 0.9, 'reg_alpha': 0.0008755965453402467, 'reg_lambda': 27.303796034192246, 'gamma': 8.385591450784463e-05}. Best is trial 155 with value: -1.2401445751324898.
[I 2026-07-14 19:10:20,871] Trial 156 finished with value: -0.6368423211442781 and parameters: {'scalers': 'none', 'ratios': 'log_ratio', 'imputers': 'median', 'n_estimators': 2050, 'learning_rate': 0.43102332039885705, 'max_depth': 8, 'min_child_weight': 1, 'subsample': 0.5, 'colsample_bytree': 0.8, 'colsample_bylevel': 0.9, 'reg_alpha': 0.0009377206271842647, 'reg_lambda': 24.438418218600013, 'gamma': 8.781756588977641e-05}. Best is trial 155 with value: -1.2401445751324898.
[I 2026-07-14 19:10:35,581] Trial 157 finished with value: -0.474532955423899 and parameters: {'scalers': 'none', 'ratios': 'log_ratio', 'imputers': 'median', 'n_estimators': 1850, 'learning_rate': 0.4328753896554152, 'max_depth': 7, 'min_child_weight': 1, 'subsample': 0.5, 'colsample_bytree': 0.8, 'colsample_bylevel': 0.9, 'reg_alpha': 0.0009734592739037726, 'reg_lambda': 26.15030091296404, 'gamma': 1.1337393494889662e-05}. Best is trial 155 with value: -1.2401445751324898.
[I 2026-07-14 19:10:49,821] Trial 158 finished with value: -0.4657777505949791 and parameters: {'scalers': 'none', 'ratios': 'log_ratio', 'imputers': 'median', 'n_estimators': 1800, 'learning_rate': 0.43330953317683835, 'max_depth': 7, 'min_child_weight': 1, 'subsample': 0.5, 'colsample_bytree': 0.8, 'colsample_bylevel': 0.9, 'reg_alpha': 0.0036826837164444953, 'reg_lambda': 25.28427409265842, 'gamma': 1.0032006111822314e-05}. Best is trial 155 with value: -1.2401445751324898.
[I 2026-07-14 19:11:05,906] Trial 159 finished with value: -0.6474822932523447 and parameters: {'scalers': 'none', 'ratios': 'log_ratio', 'imputers': 'median', 'n_estimators': 2000, 'learning_rate': 0.4745553430941116, 'max_depth': 7, 'min_child_weight': 1, 'subsample': 0.5, 'colsample_bytree': 0.8, 'colsample_bylevel': 0.9, 'reg_alpha': 0.000937947921488732, 'reg_lambda': 29.981812762865466, 'gamma': 4.740254078589503e-06}. Best is trial 155 with value: -1.2401445751324898.
[I 2026-07-14 19:11:20,273] Trial 160 finished with value: -0.5211814626762479 and parameters: {'scalers': 'none', 'ratios': 'log_ratio', 'imputers': 'median', 'n_estimators': 1800, 'learning_rate': 0.4368560224048157, 'max_depth': 7, 'min_child_weight': 1, 'subsample': 0.5, 'colsample_bytree': 0.8, 'colsample_bylevel': 0.9, 'reg_alpha': 0.000819594232679554, 'reg_lambda': 32.020751542540765, 'gamma': 6.933054249890206e-06}. Best is trial 155 with value: -1.2401445751324898.
[I 2026-07-14 19:11:35,005] Trial 161 finished with value: -0.4975669089974843 and parameters: {'scalers': 'none', 'ratios': 'log_ratio', 'imputers': 'median', 'n_estimators': 1850, 'learning_rate': 0.43633170988248615, 'max_depth': 7, 'min_child_weight': 1, 'subsample': 0.5, 'colsample_bytree': 0.8, 'colsample_bylevel': 0.9, 'reg_alpha': 2.9495521138701874e-06, 'reg_lambda': 29.18644325058625, 'gamma': 6.105942282615435e-06}. Best is trial 155 with value: -1.2401445751324898.
[I 2026-07-14 19:11:49,351] Trial 162 finished with value: -0.5087281210433925 and parameters: {'scalers': 'none', 'ratios': 'log_ratio', 'imputers': 'median', 'n_estimators': 1800, 'learning_rate': 0.4400616335643688, 'max_depth': 7, 'min_child_weight': 1, 'subsample': 0.5, 'colsample_bytree': 0.8, 'colsample_bylevel': 0.9, 'reg_alpha': 1.5543231804888834e-06, 'reg_lambda': 31.23963234392784, 'gamma': 4.128148220516285e-06}. Best is trial 155 with value: -1.2401445751324898.
[I 2026-07-14 19:12:06,779] Trial 163 finished with value: -1.4933499765590403 and parameters: {'scalers': 'none', 'ratios': 'log_ratio', 'imputers': 'median', 'n_estimators': 1800, 'learning_rate': 0.4942557848800065, 'max_depth': 8, 'min_child_weight': 1, 'subsample': 0.5, 'colsample_bytree': 0.8, 'colsample_bylevel': 0.9, 'reg_alpha': 3.2767261701082955e-06, 'reg_lambda': 74.69596057509014, 'gamma': 4.694436819441376e-06}. Best is trial 163 with value: -1.4933499765590403.
[I 2026-07-14 19:12:21,219] Trial 164 finished with value: -0.5322885157690769 and parameters: {'scalers': 'none', 'ratios': 'log_ratio', 'imputers': 'median', 'n_estimators': 1800, 'learning_rate': 0.45180247867944, 'max_depth': 7, 'min_child_weight': 1, 'subsample': 0.5, 'colsample_bytree': 0.8, 'colsample_bylevel': 0.9, 'reg_alpha': 0.002760134028756738, 'reg_lambda': 30.241501159598972, 'gamma': 5.205685126656073e-06}. Best is trial 163 with value: -1.4933499765590403.
[I 2026-07-14 19:12:37,904] Trial 165 finished with value: -1.1580556372641377 and parameters: {'scalers': 'none', 'ratios': 'log_ratio', 'imputers': 'median', 'n_estimators': 1700, 'learning_rate': 0.48541779294759424, 'max_depth': 8, 'min_child_weight': 1, 'subsample': 0.5, 'colsample_bytree': 0.8, 'colsample_bylevel': 0.9, 'reg_alpha': 0.00057804572690248, 'reg_lambda': 60.4619024505097, 'gamma': 7.797452845339532e-05}. Best is trial 163 with value: -1.4933499765590403.
[I 2026-07-14 19:12:54,487] Trial 166 finished with value: -1.234618753404662 and parameters: {'scalers': 'none', 'ratios': 'log_ratio', 'imputers': 'median', 'n_estimators': 1700, 'learning_rate': 0.48458869274617866, 'max_depth': 8, 'min_child_weight': 1, 'subsample': 0.5, 'colsample_bytree': 0.8, 'colsample_bylevel': 0.9, 'reg_alpha': 0.0006797540908256538, 'reg_lambda': 65.77741119197482, 'gamma': 3.908053064975329e-06}. Best is trial 163 with value: -1.4933499765590403.
[I 2026-07-14 19:13:09,186] Trial 167 finished with value: -0.7820222819732197 and parameters: {'scalers': 'none', 'ratios': 'log_ratio', 'imputers': 'median', 'n_estimators': 1800, 'learning_rate': 0.49960017551556496, 'max_depth': 7, 'min_child_weight': 1, 'subsample': 0.5, 'colsample_bytree': 0.8, 'colsample_bylevel': 0.9, 'reg_alpha': 0.0006313922470877932, 'reg_lambda': 68.0402631656949, 'gamma': 4.2956280360102614e-06}. Best is trial 163 with value: -1.4933499765590403.
[I 2026-07-14 19:13:25,824] Trial 168 finished with value: -1.192698519834709 and parameters: {'scalers': 'none', 'ratios': 'log_ratio', 'imputers': 'median', 'n_estimators': 1700, 'learning_rate': 0.4792960785443014, 'max_depth': 8, 'min_child_weight': 1, 'subsample': 0.5, 'colsample_bytree': 0.8, 'colsample_bylevel': 0.9, 'reg_alpha': 2.986385764914698e-06, 'reg_lambda': 71.71218243804722, 'gamma': 4.0120413970073534e-05}. Best is trial 163 with value: -1.4933499765590403.
[I 2026-07-14 19:13:36,866] Trial 169 finished with value: -0.4368088272705053 and parameters: {'scalers': 'none', 'ratios': 'log_ratio', 'imputers': 'median', 'n_estimators': 1700, 'learning_rate': 0.4936055882451612, 'max_depth': 6, 'min_child_weight': 1, 'subsample': 0.5, 'colsample_bytree': 0.8, 'colsample_bylevel': 0.9, 'reg_alpha': 0.0006689788698484151, 'reg_lambda': 99.92960503518107, 'gamma': 3.684359800884667e-05}. Best is trial 163 with value: -1.4933499765590403.
[I 2026-07-14 19:13:47,869] Trial 170 finished with value: -0.42966050139071105 and parameters: {'scalers': 'none', 'ratios': 'log_ratio', 'imputers': 'median', 'n_estimators': 1700, 'learning_rate': 0.4857967097948283, 'max_depth': 6, 'min_child_weight': 1, 'subsample': 0.5, 'colsample_bytree': 0.8, 'colsample_bylevel': 0.9, 'reg_alpha': 0.0035924340503524035, 'reg_lambda': 70.31591583812923, 'gamma': 4.064786086728325e-06}. Best is trial 163 with value: -1.4933499765590403.
[I 2026-07-14 19:14:00,857] Trial 171 finished with value: -0.44696131243906934 and parameters: {'scalers': 'none', 'ratios': 'log_ratio', 'imputers': 'median', 'n_estimators': 2000, 'learning_rate': 0.4804123985226762, 'max_depth': 6, 'min_child_weight': 1, 'subsample': 0.5, 'colsample_bytree': 0.8, 'colsample_bylevel': 0.9, 'reg_alpha': 3.2734001554925354e-06, 'reg_lambda': 70.41068235497414, 'gamma': 5.0760843814137015e-06}. Best is trial 163 with value: -1.4933499765590403.
[I 2026-07-14 19:14:08,399] Trial 172 finished with value: -0.16130714228941848 and parameters: {'scalers': 'none', 'ratios': 'log_ratio', 'imputers': 'median', 'n_estimators': 1700, 'learning_rate': 0.498247513743798, 'max_depth': 5, 'min_child_weight': 6, 'subsample': 0.5, 'colsample_bytree': 0.8, 'colsample_bylevel': 0.9, 'reg_alpha': 2.7645738368443454e-06, 'reg_lambda': 89.66231226401693, 'gamma': 4.208585145937074e-06}. Best is trial 163 with value: -1.4933499765590403.
[I 2026-07-14 19:14:24,660] Trial 173 finished with value: -0.9095601209497114 and parameters: {'scalers': 'none', 'ratios': 'log_ratio', 'imputers': 'median', 'n_estimators': 2000, 'learning_rate': 0.4991529560434626, 'max_depth': 7, 'min_child_weight': 1, 'subsample': 0.5, 'colsample_bytree': 0.8, 'colsample_bylevel': 0.9, 'reg_alpha': 0.030830535547508225, 'reg_lambda': 66.33675666780489, 'gamma': 0.0001688290769085951}. Best is trial 163 with value: -1.4933499765590403.
[I 2026-07-14 19:14:38,654] Trial 174 finished with value: -0.20803866863914947 and parameters: {'scalers': 'none', 'ratios': 'log_ratio', 'imputers': 'median', 'n_estimators': 2000, 'learning_rate': 0.4987567184304422, 'max_depth': 8, 'min_child_weight': 6, 'subsample': 0.5, 'colsample_bytree': 0.8, 'colsample_bylevel': 0.9, 'reg_alpha': 0.00057257743302703, 'reg_lambda': 60.684017149264825, 'gamma': 8.304770645333822e-05}. Best is trial 163 with value: -1.4933499765590403.
[I 2026-07-14 19:14:47,847] Trial 175 finished with value: -0.18129353064324139 and parameters: {'scalers': 'none', 'ratios': 'log_ratio', 'imputers': 'median', 'n_estimators': 1700, 'learning_rate': 0.4875934109746247, 'max_depth': 6, 'min_child_weight': 6, 'subsample': 0.5, 'colsample_bytree': 0.8, 'colsample_bylevel': 0.9, 'reg_alpha': 0.0005622842924157697, 'reg_lambda': 60.98389855788224, 'gamma': 0.00018714192024438885}. Best is trial 163 with value: -1.4933499765590403.
[I 2026-07-14 19:14:59,676] Trial 176 finished with value: -0.20566472652400491 and parameters: {'scalers': 'none', 'ratios': 'log_ratio', 'imputers': 'median', 'n_estimators': 1700, 'learning_rate': 0.49023476311561565, 'max_depth': 8, 'min_child_weight': 6, 'subsample': 0.5, 'colsample_bytree': 0.8, 'colsample_bylevel': 0.9, 'reg_alpha': 0.0005589155418629872, 'reg_lambda': 68.40860686481113, 'gamma': 4.547302842197698e-06}. Best is trial 163 with value: -1.4933499765590403.
[I 2026-07-14 19:15:14,143] Trial 177 finished with value: -0.15712539879430518 and parameters: {'scalers': 'none', 'ratios': 'log_ratio', 'imputers': 'median', 'n_estimators': 1700, 'learning_rate': 0.45793716902116766, 'max_depth': 8, 'min_child_weight': 6, 'subsample': 0.9, 'colsample_bytree': 0.8, 'colsample_bylevel': 0.9, 'reg_alpha': 0.0017101889571082922, 'reg_lambda': 66.63110131925251, 'gamma': 4.2860071557728396e-06}. Best is trial 163 with value: -1.4933499765590403.
[I 2026-07-14 19:15:33,520] Trial 178 finished with value: -1.7724962978971393 and parameters: {'scalers': 'none', 'ratios': 'log_ratio', 'imputers': 'median', 'n_estimators': 2000, 'learning_rate': 0.4991250161071393, 'max_depth': 8, 'min_child_weight': 1, 'subsample': 0.5, 'colsample_bytree': 0.8, 'colsample_bylevel': 0.9, 'reg_alpha': 0.0006805023117960191, 'reg_lambda': 65.72788363778965, 'gamma': 0.0001837228866349279}. Best is trial 178 with value: -1.7724962978971393.
[I 2026-07-14 19:15:51,878] Trial 179 finished with value: -1.686171761365188 and parameters: {'scalers': 'none', 'ratios': 'log_ratio', 'imputers': 'median', 'n_estimators': 1900, 'learning_rate': 0.49703656579140804, 'max_depth': 8, 'min_child_weight': 1, 'subsample': 0.5, 'colsample_bytree': 0.8, 'colsample_bylevel': 0.9, 'reg_alpha': 0.0014658161115767758, 'reg_lambda': 66.71313783810541, 'gamma': 9.01498421632086e-05}. Best is trial 178 with value: -1.7724962978971393.
