[I 2026-07-14 19:49:47,545] Trial 315 finished with value: -0.8654384683033539 and parameters: {'scalers': 'none', 'ratios': 'log_ratio', 'imputers': 'median', 'n_estimators': 2000, 'learning_rate': 0.4225196195814105, 'max_depth': 9, 'min_child_weight': 1, 'subsample': 0.5, 'colsample_bytree': 0.8, 'colsample_bylevel': 0.9, 'reg_alpha': 0.002143633256168527, 'reg_lambda': 48.70739440575079, 'gamma': 0.00412017674801296}. Best is trial 310 with value: -5.12636818561515.
[I 2026-07-14 19:50:07,444] Trial 316 finished with value: -0.0577081128651292 and parameters: {'scalers': 'none', 'ratios': 'log_ratio', 'imputers': 'median', 'n_estimators': 2050, 'learning_rate': 0.00042503504073479345, 'max_depth': 9, 'min_child_weight': 1, 'subsample': 0.5, 'colsample_bytree': 0.8, 'colsample_bylevel': 0.9, 'reg_alpha': 0.0026639188779824037, 'reg_lambda': 45.01692691596527, 'gamma': 0.0003747858222350466}. Best is trial 310 with value: -5.12636818561515.
[I 2026-07-14 19:50:29,282] Trial 317 finished with value: -0.5063267622851457 and parameters: {'scalers': 'none', 'ratios': 'log_ratio', 'imputers': 'median', 'n_estimators': 2000, 'learning_rate': 0.3062341328531522, 'max_depth': 9, 'min_child_weight': 1, 'subsample': 0.5, 'colsample_bytree': 0.8, 'colsample_bylevel': 0.9, 'reg_alpha': 0.14374912253547834, 'reg_lambda': 44.40694672230572, 'gamma': 0.00037183445221069085}. Best is trial 310 with value: -5.12636818561515.
[I 2026-07-14 19:50:49,387] Trial 318 finished with value: -0.5624811204847219 and parameters: {'scalers': 'none', 'ratios': 'log_ratio', 'imputers': 'median', 'n_estimators': 2000, 'learning_rate': 0.2931637451078735, 'max_depth': 9, 'min_child_weight': 1, 'subsample': 0.5, 'colsample_bytree': 0.8, 'colsample_bylevel': 0.9, 'reg_alpha': 0.21139072843996237, 'reg_lambda': 97.88299319266214, 'gamma': 0.00035381997786982245}. Best is trial 310 with value: -5.12636818561515.
[I 2026-07-14 19:51:12,475] Trial 319 finished with value: -0.5650589971004517 and parameters: {'scalers': 'none', 'ratios': 'log_ratio', 'imputers': 'median', 'n_estimators': 2000, 'learning_rate': 0.3039051686949538, 'max_depth': 9, 'min_child_weight': 1, 'subsample': 0.5, 'colsample_bytree': 1.0, 'colsample_bylevel': 0.9, 'reg_alpha': 0.1680777984866818, 'reg_lambda': 98.84584550335708, 'gamma': 0.00037250839546708304}. Best is trial 310 with value: -5.12636818561515.
