[I 2026-07-14 16:40:22,916] Trial 135 finished with value: -0.33261721712140885 and parameters: {'scalers': 'none', 'ratios': 'norm_ratio', 'imputers': 'mean', 'n_estimators': 350, 'learning_rate': 0.00012497349788345176, 'max_depth': 7, 'min_child_weight': 8, 'subsample': 0.7, 'colsample_bytree': 0.5, 'colsample_bylevel': 0.9, 'reg_alpha': 0.009855316580553735, 'reg_lambda': 62.3859728893795, 'gamma': 27.457904703219842}. Best is trial 75 with value: -0.3333648405007181.
[I 2026-07-14 16:40:27,096] Trial 136 finished with value: -0.32618356978782603 and parameters: {'scalers': 'none', 'ratios': 'norm_ratio', 'imputers': 'mean', 'n_estimators': 2350, 'learning_rate': 0.00012560638994743781, 'max_depth': 7, 'min_child_weight': 8, 'subsample': 0.9, 'colsample_bytree': 0.5, 'colsample_bylevel': 0.6, 'reg_alpha': 0.01115076457940581, 'reg_lambda': 20.510089130193414, 'gamma': 66.67187805695133}. Best is trial 75 with value: -0.3333648405007181.
[I 2026-07-14 16:40:31,429] Trial 137 finished with value: -0.32595384522720805 and parameters: {'scalers': 'none', 'ratios': 'norm_ratio', 'imputers': 'mean', 'n_estimators': 2400, 'learning_rate': 0.0001271198607347948, 'max_depth': 7, 'min_child_weight': 8, 'subsample': 0.9, 'colsample_bytree': 0.5, 'colsample_bylevel': 0.6, 'reg_alpha': 0.006684896287478546, 'reg_lambda': 22.421806188317728, 'gamma': 87.14607360986709}. Best is trial 75 with value: -0.3333648405007181.
[I 2026-07-14 16:40:58,017] Trial 138 finished with value: -0.299895000914031 and parameters: {'scalers': 'none', 'ratios': 'norm_ratio', 'imputers': 'mean', 'n_estimators': 2500, 'learning_rate': 0.00013442182418482859, 'max_depth': 10, 'min_child_weight': 8, 'subsample': 0.9, 'colsample_bytree': 0.5, 'colsample_bylevel': 0.9, 'reg_alpha': 0.010120363526942684, 'reg_lambda': 19.89951814448292, 'gamma': 0.010256489419432621}. Best is trial 75 with value: -0.3333648405007181.
[I 2026-07-14 16:40:58,695] Trial 139 finished with value: -0.33269386607846096 and parameters: {'scalers': 'none', 'ratios': 'norm_ratio', 'imputers': 'mean', 'n_estimators': 350, 'learning_rate': 0.0001209083751320042, 'max_depth': 10, 'min_child_weight': 3, 'subsample': 0.9, 'colsample_bytree': 0.5, 'colsample_bylevel': 0.9, 'reg_alpha': 61.66536961462563, 'reg_lambda': 20.22644958313216, 'gamma': 17.030378453364325}. Best is trial 75 with value: -0.3333648405007181.
[I 2026-07-14 16:40:59,423] Trial 140 finished with value: -0.33250638476603694 and parameters: {'scalers': 'none', 'ratios': 'norm_ratio', 'imputers': 'mean', 'n_estimators': 350, 'learning_rate': 0.00013362075750855625, 'max_depth': 10, 'min_child_weight': 3, 'subsample': 0.9, 'colsample_bytree': 0.5, 'colsample_bylevel': 0.9, 'reg_alpha': 0.011089236210752314, 'reg_lambda': 7.507772896599152, 'gamma': 96.05585120273501}. Best is trial 75 with value: -0.3333648405007181.
[I 2026-07-14 16:41:00,066] Trial 141 finished with value: -0.3327689583822494 and parameters: {'scalers': 'none', 'ratios': 'norm_ratio', 'imputers': 'mean', 'n_estimators': 350, 'learning_rate': 0.00012407994313367405, 'max_depth': 7, 'min_child_weight': 8, 'subsample': 0.9, 'colsample_bytree': 0.5, 'colsample_bylevel': 0.8, 'reg_alpha': 0.039597982910180685, 'reg_lambda': 8.158190814438052, 'gamma': 84.89343569497278}. Best is trial 75 with value: -0.3333648405007181.
[I 2026-07-14 16:41:01,006] Trial 142 finished with value: -0.33220677866758236 and parameters: {'scalers': 'none', 'ratios': 'norm_ratio', 'imputers': 'mean', 'n_estimators': 500, 'learning_rate': 0.00012024491887648671, 'max_depth': 10, 'min_child_weight': 8, 'subsample': 0.9, 'colsample_bytree': 0.5, 'colsample_bylevel': 0.8, 'reg_alpha': 0.0072985026941913755, 'reg_lambda': 7.166549967187116, 'gamma': 92.73448464363497}. Best is trial 75 with value: -0.3333648405007181.
[I 2026-07-14 16:41:01,903] Trial 143 finished with value: -0.3321846825473781 and parameters: {'scalers': 'none', 'ratios': 'norm_ratio', 'imputers': 'mean', 'n_estimators': 500, 'learning_rate': 0.00012159288392517674, 'max_depth': 10, 'min_child_weight': 3, 'subsample': 0.7, 'colsample_bytree': 0.5, 'colsample_bylevel': 0.8, 'reg_alpha': 0.011945982619490928, 'reg_lambda': 7.949084206354027, 'gamma': 80.13169484737563}. Best is trial 75 with value: -0.3333648405007181.
[I 2026-07-14 16:41:02,672] Trial 144 finished with value: -0.3324037345085165 and parameters: {'scalers': 'none', 'ratios': 'norm_ratio', 'imputers': 'mean', 'n_estimators': 450, 'learning_rate': 0.00012196514157338943, 'max_depth': 10, 'min_child_weight': 3, 'subsample': 0.7, 'colsample_bytree': 0.5, 'colsample_bylevel': 0.8, 'reg_alpha': 0.006328285032223306, 'reg_lambda': 3.7438470762767575, 'gamma': 99.75587143711746}. Best is trial 75 with value: -0.3333648405007181.
[I 2026-07-14 16:41:03,618] Trial 145 finished with value: -0.3313915196486825 and parameters: {'scalers': 'none', 'ratios': 'norm_ratio', 'imputers': 'mean', 'n_estimators': 500, 'learning_rate': 0.00011810417649752853, 'max_depth': 10, 'min_child_weight': 3, 'subsample': 0.7, 'colsample_bytree': 0.5, 'colsample_bylevel': 0.8, 'reg_alpha': 1.1565752847136524e-06, 'reg_lambda': 51.49036172273212, 'gamma': 19.312635652967995}. Best is trial 75 with value: -0.3333648405007181.
[I 2026-07-14 16:41:04,507] Trial 146 finished with value: -0.3323210954085775 and parameters: {'scalers': 'none', 'ratios': 'norm_ratio', 'imputers': 'mean', 'n_estimators': 500, 'learning_rate': 0.00011390167214288487, 'max_depth': 10, 'min_child_weight': 3, 'subsample': 0.7, 'colsample_bytree': 0.5, 'colsample_bylevel': 0.8, 'reg_alpha': 0.04108750001375329, 'reg_lambda': 7.0541783563827405, 'gamma': 94.57416906487826}. Best is trial 75 with value: -0.3333648405007181.
[I 2026-07-14 16:41:05,446] Trial 147 finished with value: -0.330677329572916 and parameters: {'scalers': 'none', 'ratios': 'norm_ratio', 'imputers': 'mean', 'n_estimators': 500, 'learning_rate': 0.00011870498155004873, 'max_depth': 10, 'min_child_weight': 3, 'subsample': 0.7, 'colsample_bytree': 0.5, 'colsample_bylevel': 0.8, 'reg_alpha': 1.6564622646295207e-06, 'reg_lambda': 8.787961669500456, 'gamma': 18.16450812045898}. Best is trial 75 with value: -0.3333648405007181.
[I 2026-07-14 16:41:06,342] Trial 148 finished with value: -0.3313075789949404 and parameters: {'scalers': 'none', 'ratios': 'norm_ratio', 'imputers': 'mean', 'n_estimators': 500, 'learning_rate': 0.00012184158381122307, 'max_depth': 10, 'min_child_weight': 3, 'subsample': 0.7, 'colsample_bytree': 0.5, 'colsample_bylevel': 0.8, 'reg_alpha': 0.04928300582450228, 'reg_lambda': 42.24983422047773, 'gamma': 19.24089436783702}. Best is trial 75 with value: -0.3333648405007181.
[I 2026-07-14 16:41:07,339] Trial 149 finished with value: -0.33128603566632364 and parameters: {'scalers': 'none', 'ratios': 'norm_ratio', 'imputers': 'mean', 'n_estimators': 450, 'learning_rate': 0.00011642880141939023, 'max_depth': 10, 'min_child_weight': 3, 'subsample': 0.9, 'colsample_bytree': 0.5, 'colsample_bylevel': 0.8, 'reg_alpha': 0.007359650255830396, 'reg_lambda': 59.07352738341781, 'gamma': 16.806890378894465}. Best is trial 75 with value: -0.3333648405007181.
[I 2026-07-14 16:41:08,146] Trial 150 finished with value: -0.33182096873306166 and parameters: {'scalers': 'none', 'ratios': 'norm_ratio', 'imputers': 'mean', 'n_estimators': 400, 'learning_rate': 0.00011591937302270199, 'max_depth': 7, 'min_child_weight': 3, 'subsample': 0.8, 'colsample_bytree': 0.5, 'colsample_bylevel': 0.8, 'reg_alpha': 2.5205232238686506, 'reg_lambda': 53.07826123152766, 'gamma': 17.59151850768736}. Best is trial 75 with value: -0.3333648405007181.
[I 2026-07-14 16:41:08,925] Trial 151 finished with value: -0.33018980645647744 and parameters: {'scalers': 'none', 'ratios': 'norm_ratio', 'imputers': 'mean', 'n_estimators': 400, 'learning_rate': 0.0001469796372058005, 'max_depth': 7, 'min_child_weight': 3, 'subsample': 0.8, 'colsample_bytree': 0.5, 'colsample_bylevel': 0.8, 'reg_alpha': 0.05067620539872815, 'reg_lambda': 3.3008437338498404, 'gamma': 17.120290366112286}. Best is trial 75 with value: -0.3333648405007181.
[I 2026-07-14 16:41:09,603] Trial 152 finished with value: -0.330570162865193 and parameters: {'scalers': 'none', 'ratios': 'norm_ratio', 'imputers': 'mean', 'n_estimators': 350, 'learning_rate': 0.00019079597532148257, 'max_depth': 7, 'min_child_weight': 3, 'subsample': 0.8, 'colsample_bytree': 0.5, 'colsample_bylevel': 0.8, 'reg_alpha': 0.039163166957909744, 'reg_lambda': 44.54634008265131, 'gamma': 17.272702866952574}. Best is trial 75 with value: -0.3333648405007181.
[I 2026-07-14 16:41:10,431] Trial 153 finished with value: -0.3310143084673456 and parameters: {'scalers': 'none', 'ratios': 'norm_ratio', 'imputers': 'mean', 'n_estimators': 400, 'learning_rate': 0.00019653362367642537, 'max_depth': 7, 'min_child_weight': 3, 'subsample': 0.9, 'colsample_bytree': 0.5, 'colsample_bylevel': 0.9, 'reg_alpha': 0.04062106622255414, 'reg_lambda': 43.594352762834816, 'gamma': 30.32873351478789}. Best is trial 75 with value: -0.3333648405007181.
[I 2026-07-14 16:41:11,168] Trial 154 finished with value: -0.3300249639008241 and parameters: {'scalers': 'none', 'ratios': 'norm_ratio', 'imputers': 'mean', 'n_estimators': 350, 'learning_rate': 0.00018982563435845112, 'max_depth': 7, 'min_child_weight': 3, 'subsample': 0.9, 'colsample_bytree': 0.5, 'colsample_bylevel': 0.9, 'reg_alpha': 0.0036049442827937087, 'reg_lambda': 45.875509798116035, 'gamma': 16.371117779486685}. Best is trial 75 with value: -0.3333648405007181.
[I 2026-07-14 16:41:11,930] Trial 155 finished with value: -0.32995011654821416 and parameters: {'scalers': 'none', 'ratios': 'norm_ratio', 'imputers': 'mean', 'n_estimators': 350, 'learning_rate': 0.00018635828867843754, 'max_depth': 7, 'min_child_weight': 2, 'subsample': 0.9, 'colsample_bytree': 0.5, 'colsample_bylevel': 0.9, 'reg_alpha': 0.003628935221488406, 'reg_lambda': 2.8507680494499663, 'gamma': 24.526236152572856}. Best is trial 75 with value: -0.3333648405007181.
[I 2026-07-14 16:41:12,537] Trial 156 finished with value: -0.33215872496420806 and parameters: {'scalers': 'none', 'ratios': 'norm_ratio', 'imputers': 'median', 'n_estimators': 350, 'learning_rate': 0.00015431399841896458, 'max_depth': 7, 'min_child_weight': 2, 'subsample': 0.8, 'colsample_bytree': 0.5, 'colsample_bylevel': 0.9, 'reg_alpha': 0.0017326670415469068, 'reg_lambda': 3.564273156894073, 'gamma': 31.216935450827606}. Best is trial 75 with value: -0.3333648405007181.
[I 2026-07-14 16:41:13,276] Trial 157 finished with value: -0.3322361264895308 and parameters: {'scalers': 'none', 'ratios': 'norm_ratio', 'imputers': 'mean', 'n_estimators': 350, 'learning_rate': 0.00014418604542369904, 'max_depth': 7, 'min_child_weight': 2, 'subsample': 0.8, 'colsample_bytree': 0.5, 'colsample_bylevel': 0.9, 'reg_alpha': 2.5406766783776953, 'reg_lambda': 3.776169904963322, 'gamma': 29.28902412124323}. Best is trial 75 with value: -0.3333648405007181.
[I 2026-07-14 16:41:13,646] Trial 158 finished with value: -0.33279476896762 and parameters: {'scalers': 'none', 'ratios': 'norm_ratio', 'imputers': 'mean', 'n_estimators': 200, 'learning_rate': 0.00015115563155697803, 'max_depth': 7, 'min_child_weight': 4, 'subsample': 0.9, 'colsample_bytree': 0.5, 'colsample_bylevel': 0.9, 'reg_alpha': 0.5954001973813452, 'reg_lambda': 0.2603132482903265, 'gamma': 30.345522820080518}. Best is trial 75 with value: -0.3333648405007181.
[I 2026-07-14 16:41:14,014] Trial 159 finished with value: -0.3323091358949255 and parameters: {'scalers': 'none', 'ratios': 'norm_ratio', 'imputers': 'median', 'n_estimators': 200, 'learning_rate': 0.0001847962991630535, 'max_depth': 7, 'min_child_weight': 2, 'subsample': 0.9, 'colsample_bytree': 0.5, 'colsample_bylevel': 0.9, 'reg_alpha': 0.00412512649352404, 'reg_lambda': 1.192598342313628, 'gamma': 29.45021201582763}. Best is trial 75 with value: -0.3333648405007181.
[I 2026-07-14 16:41:14,440] Trial 160 finished with value: -0.3323255883496302 and parameters: {'scalers': 'none', 'ratios': 'norm_ratio', 'imputers': 'median', 'n_estimators': 200, 'learning_rate': 0.00015198629428629415, 'max_depth': 6, 'min_child_weight': 2, 'subsample': 0.9, 'colsample_bytree': 0.5, 'colsample_bylevel': 0.9, 'reg_alpha': 0.003565775920921082, 'reg_lambda': 0.34056372562640325, 'gamma': 26.84843093392383}. Best is trial 75 with value: -0.3333648405007181.
[I 2026-07-14 16:41:14,875] Trial 161 finished with value: -0.33314559548750844 and parameters: {'scalers': 'none', 'ratios': 'norm_ratio', 'imputers': 'median', 'n_estimators': 200, 'learning_rate': 0.00014942808394703138, 'max_depth': 6, 'min_child_weight': 2, 'subsample': 0.9, 'colsample_bytree': 0.5, 'colsample_bylevel': 0.9, 'reg_alpha': 68.74414599174023, 'reg_lambda': 1.1119401751700735, 'gamma': 30.350129895207775}. Best is trial 75 with value: -0.3333648405007181.
[I 2026-07-14 16:41:15,361] Trial 162 finished with value: -0.33335321860451067 and parameters: {'scalers': 'none', 'ratios': 'norm_ratio', 'imputers': 'median', 'n_estimators': 200, 'learning_rate': 0.00010038346990697156, 'max_depth': 6, 'min_child_weight': 2, 'subsample': 0.8, 'colsample_bytree': 0.5, 'colsample_bylevel': 0.9, 'reg_alpha': 0.0016700031471796656, 'reg_lambda': 1.3230260166958332, 'gamma': 27.932474750788835}. Best is trial 75 with value: -0.3333648405007181.
[I 2026-07-14 16:41:15,738] Trial 163 finished with value: -0.33316964387786974 and parameters: {'scalers': 'none', 'ratios': 'norm_ratio', 'imputers': 'median', 'n_estimators': 200, 'learning_rate': 0.00014649037481579764, 'max_depth': 6, 'min_child_weight': 4, 'subsample': 0.8, 'colsample_bytree': 0.5, 'colsample_bylevel': 0.9, 'reg_alpha': 0.7494442941126981, 'reg_lambda': 0.9890237751034537, 'gamma': 59.48182143597489}. Best is trial 75 with value: -0.3333648405007181.
[I 2026-07-14 16:41:16,068] Trial 164 finished with value: -0.33317380991300105 and parameters: {'scalers': 'none', 'ratios': 'norm_ratio', 'imputers': 'mean', 'n_estimators': 200, 'learning_rate': 0.0001459775589404985, 'max_depth': 6, 'min_child_weight': 4, 'subsample': 0.8, 'colsample_bytree': 0.5, 'colsample_bylevel': 0.9, 'reg_alpha': 0.015075282672471435, 'reg_lambda': 20.044265303686867, 'gamma': 47.488115917020124}. Best is trial 75 with value: -0.3333648405007181.
[I 2026-07-14 16:41:16,485] Trial 165 finished with value: -0.3331817122638906 and parameters: {'scalers': 'none', 'ratios': 'norm_ratio', 'imputers': 'mean', 'n_estimators': 200, 'learning_rate': 0.00014500963063721623, 'max_depth': 6, 'min_child_weight': 4, 'subsample': 0.8, 'colsample_bytree': 0.5, 'colsample_bylevel': 0.9, 'reg_alpha': 0.16713999955795586, 'reg_lambda': 0.3585010557985348, 'gamma': 56.75126182609682}. Best is trial 75 with value: -0.3333648405007181.
[I 2026-07-14 16:41:16,896] Trial 166 finished with value: -0.33320161549861904 and parameters: {'scalers': 'none', 'ratios': 'norm_ratio', 'imputers': 'mean', 'n_estimators': 200, 'learning_rate': 0.00014258389519822317, 'max_depth': 6, 'min_child_weight': 4, 'subsample': 0.9, 'colsample_bytree': 0.5, 'colsample_bylevel': 0.9, 'reg_alpha': 64.11394471557315, 'reg_lambda': 17.345708002187262, 'gamma': 59.28602376278812}. Best is trial 75 with value: -0.3333648405007181.
[I 2026-07-14 16:41:17,355] Trial 167 finished with value: -0.3331252260522117 and parameters: {'scalers': 'none', 'ratios': 'norm_ratio', 'imputers': 'mean', 'n_estimators': 200, 'learning_rate': 0.0001519183731007563, 'max_depth': 6, 'min_child_weight': 4, 'subsample': 0.9, 'colsample_bytree': 0.5, 'colsample_bylevel': 0.9, 'reg_alpha': 52.95476209173557, 'reg_lambda': 17.652858521408106, 'gamma': 59.90703397012742}. Best is trial 75 with value: -0.3333648405007181.
[I 2026-07-14 16:41:17,799] Trial 168 finished with value: -0.3335303444363349 and parameters: {'scalers': 'none', 'ratios': 'norm_ratio', 'imputers': 'mean', 'n_estimators': 200, 'learning_rate': 0.00010239723279662139, 'max_depth': 6, 'min_child_weight': 4, 'subsample': 0.9, 'colsample_bytree': 0.5, 'colsample_bylevel': 0.9, 'reg_alpha': 0.6561571773007001, 'reg_lambda': 0.009781200123365082, 'gamma': 62.90728538827367}. Best is trial 168 with value: -0.3335303444363349.
[I 2026-07-14 16:41:18,154] Trial 169 finished with value: -0.333523458982715 and parameters: {'scalers': 'none', 'ratios': 'norm_ratio', 'imputers': 'mean', 'n_estimators': 200, 'learning_rate': 0.00010323839087878782, 'max_depth': 6, 'min_child_weight': 4, 'subsample': 0.9, 'colsample_bytree': 0.5, 'colsample_bylevel': 0.9, 'reg_alpha': 0.5282864446009004, 'reg_lambda': 20.222014496946066, 'gamma': 70.31436055650305}. Best is trial 168 with value: -0.3335303444363349.
[I 2026-07-14 16:41:18,565] Trial 170 finished with value: -0.33354450598294566 and parameters: {'scalers': 'none', 'ratios': 'norm_ratio', 'imputers': 'median', 'n_estimators': 200, 'learning_rate': 0.00010070856907715207, 'max_depth': 6, 'min_child_weight': 1, 'subsample': 0.9, 'colsample_bytree': 0.5, 'colsample_bylevel': 0.9, 'reg_alpha': 50.118807788848024, 'reg_lambda': 11.805825374363383, 'gamma': 58.84658657642007}. Best is trial 170 with value: -0.33354450598294566.
[I 2026-07-14 16:41:18,990] Trial 171 finished with value: -0.3335198953035669 and parameters: {'scalers': 'none', 'ratios': 'norm_ratio', 'imputers': 'median', 'n_estimators': 200, 'learning_rate': 0.00010377600694294292, 'max_depth': 6, 'min_child_weight': 1, 'subsample': 0.8, 'colsample_bytree': 0.5, 'colsample_bylevel': 0.9, 'reg_alpha': 52.20192709902314, 'reg_lambda': 0.8245631641105811, 'gamma': 59.66059769728274}. Best is trial 170 with value: -0.33354450598294566.
[I 2026-07-14 16:41:19,374] Trial 172 finished with value: -0.33353098509268114 and parameters: {'scalers': 'none', 'ratios': 'norm_ratio', 'imputers': 'median', 'n_estimators': 200, 'learning_rate': 0.00010243774575493619, 'max_depth': 5, 'min_child_weight': 4, 'subsample': 0.8, 'colsample_bytree': 0.5, 'colsample_bylevel': 0.9, 'reg_alpha': 64.50918250178917, 'reg_lambda': 0.6855605446466636, 'gamma': 55.80187122660851}. Best is trial 170 with value: -0.33354450598294566.
[I 2026-07-14 16:41:19,779] Trial 173 finished with value: -0.33353277886255944 and parameters: {'scalers': 'none', 'ratios': 'norm_ratio', 'imputers': 'median', 'n_estimators': 200, 'learning_rate': 0.00010216295962450436, 'max_depth': 5, 'min_child_weight': 4, 'subsample': 0.8, 'colsample_bytree': 0.5, 'colsample_bylevel': 0.9, 'reg_alpha': 0.5450565238839709, 'reg_lambda': 0.8800052926213764, 'gamma': 61.05373010899958}. Best is trial 170 with value: -0.33354450598294566.
[I 2026-07-14 16:41:20,184] Trial 174 finished with value: -0.33317575255558585 and parameters: {'scalers': 'none', 'ratios': 'norm_ratio', 'imputers': 'median', 'n_estimators': 200, 'learning_rate': 0.00014573499741304756, 'max_depth': 5, 'min_child_weight': 4, 'subsample': 0.8, 'colsample_bytree': 0.5, 'colsample_bylevel': 0.9, 'reg_alpha': 0.6365532609311677, 'reg_lambda': 0.1969067086744463, 'gamma': 60.538335331821244}. Best is trial 170 with value: -0.33354450598294566.
[I 2026-07-14 16:41:20,692] Trial 175 finished with value: -0.33318134097084745 and parameters: {'scalers': 'none', 'ratios': 'norm_ratio', 'imputers': 'median', 'n_estimators': 200, 'learning_rate': 0.0001451416588335546, 'max_depth': 6, 'min_child_weight': 4, 'subsample': 0.8, 'colsample_bytree': 0.5, 'colsample_bylevel': 0.9, 'reg_alpha': 68.7301590985855, 'reg_lambda': 0.8407649998045396, 'gamma': 64.0740606403993}. Best is trial 170 with value: -0.33354450598294566.
[I 2026-07-14 16:41:20,869] Trial 176 finished with value: -0.3335252834407703 and parameters: {'scalers': 'none', 'ratios': 'norm_ratio', 'imputers': 'median', 'n_estimators': 200, 'learning_rate': 0.00010315595470754587, 'max_depth': 5, 'min_child_weight': 4, 'subsample': 0.8, 'colsample_bytree': 0.5, 'colsample_bylevel': 0.9, 'reg_alpha': 88.87449523039867, 'reg_lambda': 0.8991706809023648, 'gamma': 66.27499428352257}. Best is trial 170 with value: -0.33354450598294566.
[I 2026-07-14 16:41:21,531] Trial 177 finished with value: -0.33354166319559925 and parameters: {'scalers': 'none', 'ratios': 'log_ratio', 'imputers': 'median', 'n_estimators': 200, 'learning_rate': 0.00010107996197780579, 'max_depth': 5, 'min_child_weight': 4, 'subsample': 0.9, 'colsample_bytree': 0.5, 'colsample_bylevel': 0.9, 'reg_alpha': 99.56748929831801, 'reg_lambda': 0.8151996599075713, 'gamma': 61.09792250434393}. Best is trial 170 with value: -0.33354450598294566.
[I 2026-07-14 16:41:21,752] Trial 178 finished with value: -0.3335131425722526 and parameters: {'scalers': 'none', 'ratios': 'norm_ratio', 'imputers': 'median', 'n_estimators': 200, 'learning_rate': 0.00010452162114880113, 'max_depth': 6, 'min_child_weight': 4, 'subsample': 0.9, 'colsample_bytree': 0.5, 'colsample_bylevel': 0.9, 'reg_alpha': 49.49035525175533, 'reg_lambda': 0.7222221244926732, 'gamma': 54.95923763866039}. Best is trial 170 with value: -0.33354450598294566.
[I 2026-07-14 16:41:22,224] Trial 179 finished with value: -0.3335379787008081 and parameters: {'scalers': 'none', 'ratios': 'norm_ratio', 'imputers': 'median', 'n_estimators': 200, 'learning_rate': 0.00010160261641690594, 'max_depth': 5, 'min_child_weight': 1, 'subsample': 0.8, 'colsample_bytree': 0.5, 'colsample_bylevel': 0.9, 'reg_alpha': 87.12011191085021, 'reg_lambda': 0.5005288105670204, 'gamma': 60.37214344121329}. Best is trial 170 with value: -0.33354450598294566.
[I 2026-07-14 16:41:22,504] Trial 180 finished with value: -0.33352584539752844 and parameters: {'scalers': 'none', 'ratios': 'norm_ratio', 'imputers': 'median', 'n_estimators': 200, 'learning_rate': 0.00010300980531673897, 'max_depth': 5, 'min_child_weight': 4, 'subsample': 0.8, 'colsample_bytree': 0.5, 'colsample_bylevel': 0.9, 'reg_alpha': 0.793124881569727, 'reg_lambda': 0.6274067785407811, 'gamma': 63.11678328908766}. Best is trial 170 with value: -0.33354450598294566.
