[I 2026-07-14 19:33:01,254] Trial 315 finished with value: -0.274106391359748 and parameters: {'scalers': 'none', 'ratios': 'norm_ratio', 'imputers': 'mean', 'n_estimators': 2500, 'learning_rate': 0.2813255526913713, 'max_depth': 11, 'min_child_weight': 2, 'subsample': 0.8, 'colsample_bytree': 0.5, 'colsample_bylevel': 1.0, 'reg_alpha': 8.233875222424995e-06, 'reg_lambda': 29.263321446485172, 'gamma': 7.605140301589007e-06}. Best is trial 301 with value: -0.40505342190972354.
[I 2026-07-14 19:33:24,345] Trial 316 finished with value: -0.2705134734566236 and parameters: {'scalers': 'none', 'ratios': 'norm_ratio', 'imputers': 'mean', 'n_estimators': 2500, 'learning_rate': 0.2711058929306589, 'max_depth': 11, 'min_child_weight': 2, 'subsample': 0.8, 'colsample_bytree': 0.5, 'colsample_bylevel': 1.0, 'reg_alpha': 6.7460023347711164e-06, 'reg_lambda': 39.55589082957454, 'gamma': 1.02088497400092e-05}. Best is trial 301 with value: -0.40505342190972354.
[I 2026-07-14 19:33:47,199] Trial 317 finished with value: -0.2753062569000827 and parameters: {'scalers': 'none', 'ratios': 'log_ratio', 'imputers': 'mean', 'n_estimators': 2450, 'learning_rate': 0.2795474038853848, 'max_depth': 11, 'min_child_weight': 2, 'subsample': 0.8, 'colsample_bytree': 0.5, 'colsample_bylevel': 1.0, 'reg_alpha': 6.0204758936873925e-06, 'reg_lambda': 38.31124560212108, 'gamma': 6.407213091986134e-06}. Best is trial 301 with value: -0.40505342190972354.
[I 2026-07-14 19:34:10,372] Trial 318 finished with value: -0.2738211446196898 and parameters: {'scalers': 'none', 'ratios': 'log_ratio', 'imputers': 'mean', 'n_estimators': 2500, 'learning_rate': 0.27443440145881876, 'max_depth': 11, 'min_child_weight': 2, 'subsample': 0.8, 'colsample_bytree': 0.5, 'colsample_bylevel': 1.0, 'reg_alpha': 8.66010517006768e-06, 'reg_lambda': 38.32394074569677, 'gamma': 6.537324160299551e-06}. Best is trial 301 with value: -0.40505342190972354.
[I 2026-07-14 19:34:32,431] Trial 319 finished with value: -0.2774210862349808 and parameters: {'scalers': 'none', 'ratios': 'norm_ratio', 'imputers': 'mean', 'n_estimators': 2450, 'learning_rate': 0.27275108247689256, 'max_depth': 11, 'min_child_weight': 2, 'subsample': 0.8, 'colsample_bytree': 0.5, 'colsample_bylevel': 1.0, 'reg_alpha': 9.205720111193833e-05, 'reg_lambda': 33.30721845681056, 'gamma': 6.0255082545263275e-06}. Best is trial 301 with value: -0.40505342190972354.
