[I 2026-07-14 18:29:21,549] Trial 90 finished with value: -0.11578911733727382 and parameters: {'scalers': 'standard', 'ratios': 'log_ratio', 'imputers': 'none', 'n_estimators': 1500, 'learning_rate': 0.2503818488822763, 'max_depth': 8, 'min_child_weight': 10, 'subsample': 0.7, 'colsample_bytree': 0.7, 'colsample_bylevel': 0.7, 'reg_alpha': 0.5631107162776772, 'reg_lambda': 0.09109402511621857, 'gamma': 3.8596706294897386e-05}. Best is trial 84 with value: -0.1520422837565353.
[I 2026-07-14 18:29:30,129] Trial 91 finished with value: -0.10901217273686402 and parameters: {'scalers': 'standard', 'ratios': 'log_ratio', 'imputers': 'none', 'n_estimators': 2200, 'learning_rate': 0.1534240829333324, 'max_depth': 8, 'min_child_weight': 10, 'subsample': 0.7, 'colsample_bytree': 0.5, 'colsample_bylevel': 0.7, 'reg_alpha': 0.0006665022914040475, 'reg_lambda': 76.82883077200084, 'gamma': 0.004314578689980526}. Best is trial 84 with value: -0.1520422837565353.
[I 2026-07-14 18:29:41,836] Trial 92 finished with value: -0.10924596937733155 and parameters: {'scalers': 'standard', 'ratios': 'log_ratio', 'imputers': 'none', 'n_estimators': 2800, 'learning_rate': 0.1534300534742649, 'max_depth': 8, 'min_child_weight': 10, 'subsample': 0.7, 'colsample_bytree': 0.5, 'colsample_bylevel': 0.7, 'reg_alpha': 0.008075588663876416, 'reg_lambda': 0.01423765055798388, 'gamma': 0.004585012109322252}. Best is trial 84 with value: -0.1520422837565353.
[I 2026-07-14 18:29:53,431] Trial 93 finished with value: -0.12288635184676425 and parameters: {'scalers': 'standard', 'ratios': 'log_ratio', 'imputers': 'none', 'n_estimators': 2700, 'learning_rate': 0.24696223700161377, 'max_depth': 8, 'min_child_weight': 10, 'subsample': 0.7, 'colsample_bytree': 0.5, 'colsample_bylevel': 0.7, 'reg_alpha': 0.00221857137929017, 'reg_lambda': 0.016957222842660463, 'gamma': 0.004255208932190113}. Best is trial 84 with value: -0.1520422837565353.
[I 2026-07-14 18:29:59,964] Trial 94 finished with value: -0.10928734137453563 and parameters: {'scalers': 'standard', 'ratios': 'log_ratio', 'imputers': 'none', 'n_estimators': 1500, 'learning_rate': 0.24562752800251844, 'max_depth': 8, 'min_child_weight': 10, 'subsample': 0.7, 'colsample_bytree': 0.5, 'colsample_bylevel': 0.7, 'reg_alpha': 0.008559890946613408, 'reg_lambda': 0.0021236136715062697, 'gamma': 0.004367042197979893}. Best is trial 84 with value: -0.1520422837565353.
[I 2026-07-14 18:30:12,093] Trial 95 finished with value: -0.12355740768401753 and parameters: {'scalers': 'standard', 'ratios': 'log_ratio', 'imputers': 'none', 'n_estimators': 2800, 'learning_rate': 0.25500567280980047, 'max_depth': 8, 'min_child_weight': 10, 'subsample': 0.7, 'colsample_bytree': 0.5, 'colsample_bylevel': 0.7, 'reg_alpha': 0.0024319513099838263, 'reg_lambda': 0.00011612567826620379, 'gamma': 0.001441207551488818}. Best is trial 84 with value: -0.1520422837565353.
[I 2026-07-14 18:30:24,454] Trial 96 finished with value: -0.12690844712940938 and parameters: {'scalers': 'standard', 'ratios': 'log_ratio', 'imputers': 'none', 'n_estimators': 2700, 'learning_rate': 0.2449228445902968, 'max_depth': 8, 'min_child_weight': 10, 'subsample': 0.7, 'colsample_bytree': 0.5, 'colsample_bylevel': 0.7, 'reg_alpha': 0.5510804269921774, 'reg_lambda': 0.00034291419890243916, 'gamma': 0.0015154857756200803}. Best is trial 84 with value: -0.1520422837565353.
[I 2026-07-14 18:30:27,304] Trial 97 finished with value: -0.05937356951551437 and parameters: {'scalers': 'standard', 'ratios': 'log_ratio', 'imputers': 'none', 'n_estimators': 2650, 'learning_rate': 0.25676972082285865, 'max_depth': 8, 'min_child_weight': 10, 'subsample': 0.7, 'colsample_bytree': 0.5, 'colsample_bylevel': 0.7, 'reg_alpha': 0.10598947000410393, 'reg_lambda': 0.0003286916362555383, 'gamma': 2.380119095506644}. Best is trial 84 with value: -0.1520422837565353.
[I 2026-07-14 18:30:39,382] Trial 98 finished with value: -0.12078842380799432 and parameters: {'scalers': 'standard', 'ratios': 'log_ratio', 'imputers': 'none', 'n_estimators': 2800, 'learning_rate': 0.25372820496762677, 'max_depth': 8, 'min_child_weight': 10, 'subsample': 0.7, 'colsample_bytree': 0.5, 'colsample_bylevel': 0.7, 'reg_alpha': 0.0019313876678992232, 'reg_lambda': 0.00036045071764995737, 'gamma': 0.00423293533175078}. Best is trial 84 with value: -0.1520422837565353.
[I 2026-07-14 18:30:50,897] Trial 99 finished with value: -0.1210891658758047 and parameters: {'scalers': 'standard', 'ratios': 'log_ratio', 'imputers': 'none', 'n_estimators': 2700, 'learning_rate': 0.25799488284021066, 'max_depth': 8, 'min_child_weight': 10, 'subsample': 0.7, 'colsample_bytree': 0.5, 'colsample_bylevel': 0.7, 'reg_alpha': 0.0023429560044978975, 'reg_lambda': 0.00033259317855680775, 'gamma': 0.01658676337110593}. Best is trial 84 with value: -0.1520422837565353.
[I 2026-07-14 18:31:01,663] Trial 100 finished with value: -0.12256391923915039 and parameters: {'scalers': 'standard', 'ratios': 'log_ratio', 'imputers': 'none', 'n_estimators': 2500, 'learning_rate': 0.2541849142450892, 'max_depth': 8, 'min_child_weight': 10, 'subsample': 0.7, 'colsample_bytree': 0.5, 'colsample_bylevel': 0.7, 'reg_alpha': 0.0024693427508591776, 'reg_lambda': 0.002257775276337793, 'gamma': 0.0013050407102186844}. Best is trial 84 with value: -0.1520422837565353.
[I 2026-07-14 18:31:13,547] Trial 101 finished with value: -0.06840656846762061 and parameters: {'scalers': 'standard', 'ratios': 'log_ratio', 'imputers': 'none', 'n_estimators': 2650, 'learning_rate': 0.0038358976745470562, 'max_depth': 8, 'min_child_weight': 10, 'subsample': 0.7, 'colsample_bytree': 0.5, 'colsample_bylevel': 0.7, 'reg_alpha': 0.002165847628010407, 'reg_lambda': 0.002221647671901192, 'gamma': 0.0013824057990517887}. Best is trial 84 with value: -0.1520422837565353.
[I 2026-07-14 18:31:25,907] Trial 102 finished with value: -0.128361927401208 and parameters: {'scalers': 'standard', 'ratios': 'log_ratio', 'imputers': 'none', 'n_estimators': 2550, 'learning_rate': 0.2514127160521509, 'max_depth': 9, 'min_child_weight': 9, 'subsample': 0.7, 'colsample_bytree': 0.5, 'colsample_bylevel': 0.7, 'reg_alpha': 0.002043219719288525, 'reg_lambda': 0.00038456984366450395, 'gamma': 0.018022934486312255}. Best is trial 84 with value: -0.1520422837565353.
[I 2026-07-14 18:31:39,350] Trial 103 finished with value: -0.13881742888427193 and parameters: {'scalers': 'standard', 'ratios': 'log_ratio', 'imputers': 'none', 'n_estimators': 2650, 'learning_rate': 0.4144188032366324, 'max_depth': 9, 'min_child_weight': 9, 'subsample': 0.8, 'colsample_bytree': 0.5, 'colsample_bylevel': 0.7, 'reg_alpha': 0.0020470075897487377, 'reg_lambda': 0.0003143708344884264, 'gamma': 0.0014015372184240302}. Best is trial 84 with value: -0.1520422837565353.
[I 2026-07-14 18:31:51,209] Trial 104 finished with value: -0.14241803580874202 and parameters: {'scalers': 'standard', 'ratios': 'log_ratio', 'imputers': 'none', 'n_estimators': 2400, 'learning_rate': 0.4201012118405286, 'max_depth': 9, 'min_child_weight': 9, 'subsample': 0.8, 'colsample_bytree': 0.5, 'colsample_bylevel': 0.6, 'reg_alpha': 0.03739138118799621, 'reg_lambda': 0.0004214732454597935, 'gamma': 0.0011029132048540878}. Best is trial 84 with value: -0.1520422837565353.
[I 2026-07-14 18:32:03,471] Trial 105 finished with value: -0.14253824215548966 and parameters: {'scalers': 'standard', 'ratios': 'log_ratio', 'imputers': 'none', 'n_estimators': 2500, 'learning_rate': 0.4215945807126207, 'max_depth': 9, 'min_child_weight': 9, 'subsample': 0.8, 'colsample_bytree': 0.5, 'colsample_bylevel': 0.6, 'reg_alpha': 0.0002287911396386077, 'reg_lambda': 8.077060293977885e-05, 'gamma': 0.0014575506029465247}. Best is trial 84 with value: -0.1520422837565353.
[I 2026-07-14 18:32:18,881] Trial 106 finished with value: -0.14439062033613007 and parameters: {'scalers': 'standard', 'ratios': 'log_ratio', 'imputers': 'none', 'n_estimators': 3000, 'learning_rate': 0.3897345247300273, 'max_depth': 9, 'min_child_weight': 9, 'subsample': 0.8, 'colsample_bytree': 0.5, 'colsample_bylevel': 0.6, 'reg_alpha': 0.2581743745339001, 'reg_lambda': 9.55954040270604e-05, 'gamma': 0.0014568234069892558}. Best is trial 84 with value: -0.1520422837565353.
[I 2026-07-14 18:32:33,387] Trial 107 finished with value: -0.08380407527559383 and parameters: {'scalers': 'standard', 'ratios': 'log_ratio', 'imputers': 'none', 'n_estimators': 2950, 'learning_rate': 0.012806838297873801, 'max_depth': 9, 'min_child_weight': 9, 'subsample': 0.8, 'colsample_bytree': 0.5, 'colsample_bylevel': 0.6, 'reg_alpha': 0.00020041676253546926, 'reg_lambda': 0.00010349174074012874, 'gamma': 0.0012548232553779809}. Best is trial 84 with value: -0.1520422837565353.
[I 2026-07-14 18:32:47,734] Trial 108 finished with value: -0.1432215872265605 and parameters: {'scalers': 'standard', 'ratios': 'log_ratio', 'imputers': 'none', 'n_estimators': 2900, 'learning_rate': 0.40024534112929616, 'max_depth': 9, 'min_child_weight': 9, 'subsample': 0.8, 'colsample_bytree': 0.5, 'colsample_bylevel': 0.6, 'reg_alpha': 0.04026901671844469, 'reg_lambda': 0.00010539165444468302, 'gamma': 0.001324568160021816}. Best is trial 84 with value: -0.1520422837565353.
[I 2026-07-14 18:32:56,195] Trial 109 finished with value: -0.12704555637097364 and parameters: {'scalers': 'standard', 'ratios': 'log_ratio', 'imputers': 'none', 'n_estimators': 2350, 'learning_rate': 0.4060242030792719, 'max_depth': 7, 'min_child_weight': 9, 'subsample': 0.8, 'colsample_bytree': 0.5, 'colsample_bylevel': 0.6, 'reg_alpha': 0.0002274722455828403, 'reg_lambda': 9.569173715970035e-05, 'gamma': 0.023215141383065897}. Best is trial 84 with value: -0.1520422837565353.
[I 2026-07-14 18:33:07,469] Trial 110 finished with value: -0.1376431702222745 and parameters: {'scalers': 'standard', 'ratios': 'log_ratio', 'imputers': 'none', 'n_estimators': 2350, 'learning_rate': 0.4200564079860238, 'max_depth': 9, 'min_child_weight': 9, 'subsample': 0.8, 'colsample_bytree': 0.5, 'colsample_bylevel': 0.6, 'reg_alpha': 0.03751204147035027, 'reg_lambda': 0.00011185300144555873, 'gamma': 0.01987232440800302}. Best is trial 84 with value: -0.1520422837565353.
[I 2026-07-14 18:33:21,698] Trial 111 finished with value: -0.14011009742306263 and parameters: {'scalers': 'standard', 'ratios': 'log_ratio', 'imputers': 'none', 'n_estimators': 3000, 'learning_rate': 0.40021670567205, 'max_depth': 9, 'min_child_weight': 9, 'subsample': 0.8, 'colsample_bytree': 0.5, 'colsample_bylevel': 0.6, 'reg_alpha': 0.03270044223426721, 'reg_lambda': 0.0001385016464785893, 'gamma': 0.021611722667346314}. Best is trial 84 with value: -0.1520422837565353.
[I 2026-07-14 18:33:37,379] Trial 112 finished with value: -0.1490180493484391 and parameters: {'scalers': 'standard', 'ratios': 'log_ratio', 'imputers': 'none', 'n_estimators': 3000, 'learning_rate': 0.4102599317185202, 'max_depth': 10, 'min_child_weight': 9, 'subsample': 0.8, 'colsample_bytree': 0.5, 'colsample_bylevel': 0.6, 'reg_alpha': 0.0009547697684716881, 'reg_lambda': 0.00010991058490027392, 'gamma': 0.022205269951071836}. Best is trial 84 with value: -0.1520422837565353.
[I 2026-07-14 18:33:51,452] Trial 113 finished with value: -0.14722598111981308 and parameters: {'scalers': 'standard', 'ratios': 'log_ratio', 'imputers': 'none', 'n_estimators': 3000, 'learning_rate': 0.4181461533581987, 'max_depth': 9, 'min_child_weight': 9, 'subsample': 0.8, 'colsample_bytree': 0.5, 'colsample_bylevel': 0.6, 'reg_alpha': 0.031217771781621495, 'reg_lambda': 2.1170366372351113e-05, 'gamma': 0.023296222253333235}. Best is trial 84 with value: -0.1520422837565353.
[I 2026-07-14 18:34:02,988] Trial 114 finished with value: -0.139962321770345 and parameters: {'scalers': 'standard', 'ratios': 'log_ratio', 'imputers': 'none', 'n_estimators': 2350, 'learning_rate': 0.4083734915187718, 'max_depth': 9, 'min_child_weight': 9, 'subsample': 0.8, 'colsample_bytree': 0.5, 'colsample_bylevel': 0.6, 'reg_alpha': 0.0011983638499261614, 'reg_lambda': 6.506904355256004e-06, 'gamma': 0.00047753846589888545}. Best is trial 84 with value: -0.1520422837565353.
[I 2026-07-14 18:34:16,264] Trial 115 finished with value: -0.14789742376038573 and parameters: {'scalers': 'standard', 'ratios': 'log_ratio', 'imputers': 'none', 'n_estimators': 2400, 'learning_rate': 0.45256182909183085, 'max_depth': 10, 'min_child_weight': 9, 'subsample': 0.8, 'colsample_bytree': 0.5, 'colsample_bylevel': 0.6, 'reg_alpha': 0.03963334055596032, 'reg_lambda': 2.2754991194250012e-05, 'gamma': 0.00048234594318214547}. Best is trial 84 with value: -0.1520422837565353.
[I 2026-07-14 18:34:29,391] Trial 116 finished with value: -0.1451266706266167 and parameters: {'scalers': 'standard', 'ratios': 'log_ratio', 'imputers': 'none', 'n_estimators': 2350, 'learning_rate': 0.4188359299153814, 'max_depth': 10, 'min_child_weight': 9, 'subsample': 0.8, 'colsample_bytree': 0.5, 'colsample_bylevel': 0.6, 'reg_alpha': 0.029818178984231225, 'reg_lambda': 7.798973046285064e-06, 'gamma': 0.000561212932922486}. Best is trial 84 with value: -0.1520422837565353.
[I 2026-07-14 18:34:45,950] Trial 117 finished with value: -0.14970690166210948 and parameters: {'scalers': 'standard', 'ratios': 'log_ratio', 'imputers': 'none', 'n_estimators': 3000, 'learning_rate': 0.42342137545183584, 'max_depth': 10, 'min_child_weight': 9, 'subsample': 0.8, 'colsample_bytree': 0.5, 'colsample_bylevel': 0.6, 'reg_alpha': 0.041961990356318674, 'reg_lambda': 1.2953355577903989e-05, 'gamma': 0.0005342947357462975}. Best is trial 84 with value: -0.1520422837565353.
[I 2026-07-14 18:34:56,587] Trial 118 finished with value: -0.14414926879371165 and parameters: {'scalers': 'standard', 'ratios': 'log_ratio', 'imputers': 'none', 'n_estimators': 1950, 'learning_rate': 0.4315165226987321, 'max_depth': 10, 'min_child_weight': 9, 'subsample': 0.8, 'colsample_bytree': 0.5, 'colsample_bylevel': 0.6, 'reg_alpha': 0.03668450116723491, 'reg_lambda': 1.2076994414526476e-05, 'gamma': 0.007238501195787499}. Best is trial 84 with value: -0.1520422837565353.
[I 2026-07-14 18:35:02,966] Trial 119 finished with value: -0.12070368326818734 and parameters: {'scalers': 'standard', 'ratios': 'log_ratio', 'imputers': 'none', 'n_estimators': 2450, 'learning_rate': 0.43284801678001095, 'max_depth': 10, 'min_child_weight': 9, 'subsample': 0.8, 'colsample_bytree': 0.5, 'colsample_bylevel': 0.6, 'reg_alpha': 0.02883589720637749, 'reg_lambda': 1.2267765131765942e-05, 'gamma': 0.09394550103305248}. Best is trial 84 with value: -0.1520422837565353.
[I 2026-07-14 18:35:14,729] Trial 120 finished with value: -0.13689467755240586 and parameters: {'scalers': 'standard', 'ratios': 'log_ratio', 'imputers': 'none', 'n_estimators': 3000, 'learning_rate': 0.4068121754173581, 'max_depth': 10, 'min_child_weight': 9, 'subsample': 0.8, 'colsample_bytree': 0.5, 'colsample_bylevel': 0.6, 'reg_alpha': 0.02921926479810772, 'reg_lambda': 1.2174803846016456e-05, 'gamma': 0.06846183908438112}. Best is trial 84 with value: -0.1520422837565353.
[I 2026-07-14 18:35:26,260] Trial 121 finished with value: -0.13619510257308637 and parameters: {'scalers': 'standard', 'ratios': 'log_ratio', 'imputers': 'none', 'n_estimators': 3000, 'learning_rate': 0.40271790424854614, 'max_depth': 10, 'min_child_weight': 9, 'subsample': 0.8, 'colsample_bytree': 0.5, 'colsample_bylevel': 0.6, 'reg_alpha': 0.03648924081393608, 'reg_lambda': 1.4340017918383492e-05, 'gamma': 0.06953904224279789}. Best is trial 84 with value: -0.1520422837565353.
[I 2026-07-14 18:35:42,263] Trial 122 finished with value: -0.14458955956184452 and parameters: {'scalers': 'standard', 'ratios': 'log_ratio', 'imputers': 'none', 'n_estimators': 3000, 'learning_rate': 0.3404143883001003, 'max_depth': 10, 'min_child_weight': 9, 'subsample': 0.8, 'colsample_bytree': 0.5, 'colsample_bylevel': 0.6, 'reg_alpha': 0.029107619983556907, 'reg_lambda': 1.4576727906275749e-05, 'gamma': 0.0004707491279162685}. Best is trial 84 with value: -0.1520422837565353.
[I 2026-07-14 18:35:51,257] Trial 123 finished with value: -0.12516808784360692 and parameters: {'scalers': 'standard', 'ratios': 'log_ratio', 'imputers': 'none', 'n_estimators': 3000, 'learning_rate': 0.3257761238211295, 'max_depth': 10, 'min_child_weight': 9, 'subsample': 0.8, 'colsample_bytree': 0.5, 'colsample_bylevel': 0.6, 'reg_alpha': 0.032873188665112955, 'reg_lambda': 2.2408652015448888e-05, 'gamma': 0.08425380528472622}. Best is trial 84 with value: -0.1520422837565353.
[I 2026-07-14 18:36:07,294] Trial 124 finished with value: -0.1471024571925411 and parameters: {'scalers': 'standard', 'ratios': 'log_ratio', 'imputers': 'none', 'n_estimators': 2900, 'learning_rate': 0.33016372600999244, 'max_depth': 10, 'min_child_weight': 8, 'subsample': 0.8, 'colsample_bytree': 0.5, 'colsample_bylevel': 0.6, 'reg_alpha': 0.11801417455974998, 'reg_lambda': 1.685818906647113e-05, 'gamma': 0.0001954743528208401}. Best is trial 84 with value: -0.1520422837565353.
[I 2026-07-14 18:36:22,989] Trial 125 finished with value: -0.12796136121201418 and parameters: {'scalers': 'standard', 'ratios': 'log_ratio', 'imputers': 'none', 'n_estimators': 2900, 'learning_rate': 0.18016624811625978, 'max_depth': 10, 'min_child_weight': 8, 'subsample': 0.8, 'colsample_bytree': 0.5, 'colsample_bylevel': 0.6, 'reg_alpha': 0.11341099772006785, 'reg_lambda': 1.75327223003555e-05, 'gamma': 0.0005025313082703893}. Best is trial 84 with value: -0.1520422837565353.
[I 2026-07-14 18:36:32,569] Trial 126 finished with value: -0.11502999524237922 and parameters: {'scalers': 'standard', 'ratios': 'log_ratio', 'imputers': 'none', 'n_estimators': 2900, 'learning_rate': 0.184348816517942, 'max_depth': 10, 'min_child_weight': 8, 'subsample': 0.8, 'colsample_bytree': 0.5, 'colsample_bylevel': 0.6, 'reg_alpha': 0.024479373177231707, 'reg_lambda': 1.8528995258751433e-05, 'gamma': 0.0768974653605462}. Best is trial 84 with value: -0.1520422837565353.
[I 2026-07-14 18:36:50,269] Trial 127 finished with value: -0.15106453114141022 and parameters: {'scalers': 'standard', 'ratios': 'log_ratio', 'imputers': 'none', 'n_estimators': 2900, 'learning_rate': 0.3287397812294655, 'max_depth': 11, 'min_child_weight': 8, 'subsample': 0.8, 'colsample_bytree': 0.5, 'colsample_bylevel': 0.6, 'reg_alpha': 0.07318623332946991, 'reg_lambda': 2.29994020846516e-05, 'gamma': 0.0001666480504413764}. Best is trial 84 with value: -0.1520422837565353.
[I 2026-07-14 18:37:07,833] Trial 128 finished with value: -0.15226904858222332 and parameters: {'scalers': 'standard', 'ratios': 'log_ratio', 'imputers': 'none', 'n_estimators': 2900, 'learning_rate': 0.33020688336430626, 'max_depth': 11, 'min_child_weight': 8, 'subsample': 0.8, 'colsample_bytree': 0.5, 'colsample_bylevel': 0.6, 'reg_alpha': 0.04680153405455438, 'reg_lambda': 1.4492140067200722e-05, 'gamma': 0.00017839801294920228}. Best is trial 128 with value: -0.15226904858222332.
[I 2026-07-14 18:37:25,573] Trial 129 finished with value: -0.1518599881043448 and parameters: {'scalers': 'standard', 'ratios': 'log_ratio', 'imputers': 'none', 'n_estimators': 2900, 'learning_rate': 0.33013216145700275, 'max_depth': 11, 'min_child_weight': 8, 'subsample': 0.8, 'colsample_bytree': 0.5, 'colsample_bylevel': 0.6, 'reg_alpha': 0.08785359689678596, 'reg_lambda': 3.168049927970542e-05, 'gamma': 0.0006006751544936582}. Best is trial 128 with value: -0.15226904858222332.
[I 2026-07-14 18:37:42,595] Trial 130 finished with value: -0.13528332903818466 and parameters: {'scalers': 'standard', 'ratios': 'log_ratio', 'imputers': 'none', 'n_estimators': 2900, 'learning_rate': 0.17998012674765415, 'max_depth': 11, 'min_child_weight': 8, 'subsample': 0.8, 'colsample_bytree': 0.5, 'colsample_bylevel': 0.6, 'reg_alpha': 0.09419963324212334, 'reg_lambda': 2.5963363960257886e-05, 'gamma': 0.00017874410478786648}. Best is trial 128 with value: -0.15226904858222332.
[I 2026-07-14 18:38:00,077] Trial 131 finished with value: -0.1478478800891162 and parameters: {'scalers': 'standard', 'ratios': 'log_ratio', 'imputers': 'none', 'n_estimators': 2850, 'learning_rate': 0.31867329124810817, 'max_depth': 11, 'min_child_weight': 8, 'subsample': 0.8, 'colsample_bytree': 0.5, 'colsample_bylevel': 0.6, 'reg_alpha': 0.11611160697545658, 'reg_lambda': 4.550980156037557e-06, 'gamma': 0.00018283492029356202}. Best is trial 128 with value: -0.15226904858222332.
[I 2026-07-14 18:38:17,221] Trial 132 finished with value: -0.1358588402747697 and parameters: {'scalers': 'standard', 'ratios': 'log_ratio', 'imputers': 'none', 'n_estimators': 2900, 'learning_rate': 0.18222330804586476, 'max_depth': 11, 'min_child_weight': 8, 'subsample': 0.8, 'colsample_bytree': 0.5, 'colsample_bylevel': 0.6, 'reg_alpha': 0.11528558581156574, 'reg_lambda': 3.851237315660561e-06, 'gamma': 0.0005296019821290864}. Best is trial 128 with value: -0.15226904858222332.
[I 2026-07-14 18:38:34,990] Trial 133 finished with value: -0.15011549020653397 and parameters: {'scalers': 'standard', 'ratios': 'log_ratio', 'imputers': 'none', 'n_estimators': 2900, 'learning_rate': 0.32495842313669115, 'max_depth': 11, 'min_child_weight': 8, 'subsample': 0.8, 'colsample_bytree': 0.5, 'colsample_bylevel': 0.6, 'reg_alpha': 0.08105261416014826, 'reg_lambda': 3.1494864310710395e-06, 'gamma': 0.00019341236544301912}. Best is trial 128 with value: -0.15226904858222332.
[I 2026-07-14 18:38:52,500] Trial 134 finished with value: -0.15313984895317048 and parameters: {'scalers': 'standard', 'ratios': 'log_ratio', 'imputers': 'none', 'n_estimators': 2850, 'learning_rate': 0.33052434999176683, 'max_depth': 11, 'min_child_weight': 8, 'subsample': 0.8, 'colsample_bytree': 0.5, 'colsample_bylevel': 0.6, 'reg_alpha': 0.07438193842948744, 'reg_lambda': 4.055780239245761e-06, 'gamma': 0.00017977272734174537}. Best is trial 134 with value: -0.15313984895317048.
