[I 2026-07-14 17:25:53,029] Trial 90 finished with value: -1.0185091478870296 and parameters: {'scalers': 'none', 'ratios': 'log_ratio', 'imputers': 'median', 'n_estimators': 1800, 'learning_rate': 0.3562494210865063, 'max_depth': 9, 'min_child_weight': 2, 'subsample': 0.7, 'colsample_bytree': 0.8, 'colsample_bylevel': 0.7, 'reg_alpha': 0.002487928125000222, 'reg_lambda': 0.045353804133772005, 'gamma': 2.8624950360948875e-06}. Best is trial 87 with value: -1.0906819839622814.
[I 2026-07-14 17:26:13,611] Trial 91 finished with value: -1.0042325908551395 and parameters: {'scalers': 'none', 'ratios': 'log_ratio', 'imputers': 'median', 'n_estimators': 1750, 'learning_rate': 0.3850142164500746, 'max_depth': 9, 'min_child_weight': 2, 'subsample': 0.8, 'colsample_bytree': 0.8, 'colsample_bylevel': 0.7, 'reg_alpha': 0.0022477583725505875, 'reg_lambda': 0.046303541179846086, 'gamma': 2.978465319346532e-06}. Best is trial 87 with value: -1.0906819839622814.
[I 2026-07-14 17:26:29,870] Trial 92 finished with value: -0.9637886020128872 and parameters: {'scalers': 'none', 'ratios': 'log_ratio', 'imputers': 'median', 'n_estimators': 1450, 'learning_rate': 0.37193344100563247, 'max_depth': 9, 'min_child_weight': 2, 'subsample': 0.8, 'colsample_bytree': 0.8, 'colsample_bylevel': 0.7, 'reg_alpha': 0.002373048872081103, 'reg_lambda': 0.17719588474728526, 'gamma': 4.1879947970737285e-05}. Best is trial 87 with value: -1.0906819839622814.
[I 2026-07-14 17:26:50,738] Trial 93 finished with value: -1.016596638644044 and parameters: {'scalers': 'none', 'ratios': 'log_ratio', 'imputers': 'median', 'n_estimators': 1800, 'learning_rate': 0.4030862753234413, 'max_depth': 9, 'min_child_weight': 2, 'subsample': 0.8, 'colsample_bytree': 0.8, 'colsample_bylevel': 0.7, 'reg_alpha': 0.0029626108681181317, 'reg_lambda': 0.16765638834234406, 'gamma': 3.094235083108113e-06}. Best is trial 87 with value: -1.0906819839622814.
[I 2026-07-14 17:27:07,652] Trial 94 finished with value: -1.00315864298553 and parameters: {'scalers': 'standard', 'ratios': 'log_ratio', 'imputers': 'median', 'n_estimators': 1450, 'learning_rate': 0.42638065624132926, 'max_depth': 9, 'min_child_weight': 2, 'subsample': 0.8, 'colsample_bytree': 0.8, 'colsample_bylevel': 0.7, 'reg_alpha': 0.005900966170520334, 'reg_lambda': 0.19581635218377702, 'gamma': 3.827055573754879e-05}. Best is trial 87 with value: -1.0906819839622814.
[I 2026-07-14 17:27:24,436] Trial 95 finished with value: -1.046711948190558 and parameters: {'scalers': 'standard', 'ratios': 'log_ratio', 'imputers': 'median', 'n_estimators': 1450, 'learning_rate': 0.49197812604348706, 'max_depth': 9, 'min_child_weight': 2, 'subsample': 0.8, 'colsample_bytree': 0.8, 'colsample_bylevel': 0.7, 'reg_alpha': 0.0032687359308826835, 'reg_lambda': 0.17723593578699146, 'gamma': 3.486402315594934e-05}. Best is trial 87 with value: -1.0906819839622814.
[I 2026-07-14 17:27:41,544] Trial 96 finished with value: -1.0347439123662496 and parameters: {'scalers': 'standard', 'ratios': 'log_ratio', 'imputers': 'median', 'n_estimators': 1450, 'learning_rate': 0.46418210811728505, 'max_depth': 9, 'min_child_weight': 2, 'subsample': 0.8, 'colsample_bytree': 0.8, 'colsample_bylevel': 0.7, 'reg_alpha': 0.009762589452249285, 'reg_lambda': 0.17452110756502084, 'gamma': 4.510682211499272e-05}. Best is trial 87 with value: -1.0906819839622814.
[I 2026-07-14 17:27:58,116] Trial 97 finished with value: -1.0587428208330083 and parameters: {'scalers': 'none', 'ratios': 'log_ratio', 'imputers': 'median', 'n_estimators': 1400, 'learning_rate': 0.4928436581180273, 'max_depth': 9, 'min_child_weight': 2, 'subsample': 0.8, 'colsample_bytree': 0.8, 'colsample_bylevel': 0.7, 'reg_alpha': 0.015930255142768343, 'reg_lambda': 0.18158315934884017, 'gamma': 4.105913856557584e-05}. Best is trial 87 with value: -1.0906819839622814.
[I 2026-07-14 17:28:16,047] Trial 98 finished with value: -1.054852643876838 and parameters: {'scalers': 'standard', 'ratios': 'log_ratio', 'imputers': 'median', 'n_estimators': 1500, 'learning_rate': 0.49626278897300996, 'max_depth': 9, 'min_child_weight': 2, 'subsample': 0.8, 'colsample_bytree': 0.8, 'colsample_bylevel': 0.7, 'reg_alpha': 0.011140324518764198, 'reg_lambda': 0.2203819648609045, 'gamma': 4.234130620860297e-05}. Best is trial 87 with value: -1.0906819839622814.
[I 2026-07-14 17:28:36,894] Trial 99 finished with value: -1.1390679612016015 and parameters: {'scalers': 'standard', 'ratios': 'log_ratio', 'imputers': 'median', 'n_estimators': 1500, 'learning_rate': 0.4976836914868234, 'max_depth': 9, 'min_child_weight': 2, 'subsample': 0.8, 'colsample_bytree': 0.8, 'colsample_bylevel': 0.8, 'reg_alpha': 0.013871301313348182, 'reg_lambda': 0.9725707548940143, 'gamma': 1.1560555488497868e-05}. Best is trial 99 with value: -1.1390679612016015.
[I 2026-07-14 17:28:55,142] Trial 100 finished with value: -1.1439949160522511 and parameters: {'scalers': 'standard', 'ratios': 'log_ratio', 'imputers': 'median', 'n_estimators': 1450, 'learning_rate': 0.46566428086136313, 'max_depth': 9, 'min_child_weight': 2, 'subsample': 0.6, 'colsample_bytree': 0.8, 'colsample_bylevel': 0.8, 'reg_alpha': 0.014757010456241636, 'reg_lambda': 0.17685006285367463, 'gamma': 1.2270941045156653e-05}. Best is trial 100 with value: -1.1439949160522511.
[I 2026-07-14 17:29:15,529] Trial 101 finished with value: -1.2722311004623286 and parameters: {'scalers': 'standard', 'ratios': 'log_ratio', 'imputers': 'median', 'n_estimators': 1450, 'learning_rate': 0.4985435045610116, 'max_depth': 9, 'min_child_weight': 2, 'subsample': 0.6, 'colsample_bytree': 0.8, 'colsample_bylevel': 0.8, 'reg_alpha': 0.011049403020917415, 'reg_lambda': 1.0765466034692337, 'gamma': 1.2145918059359394e-05}. Best is trial 101 with value: -1.2722311004623286.
[I 2026-07-14 17:29:41,766] Trial 102 finished with value: -1.306910926946295 and parameters: {'scalers': 'standard', 'ratios': 'log_ratio', 'imputers': 'median', 'n_estimators': 1900, 'learning_rate': 0.49673903225596916, 'max_depth': 9, 'min_child_weight': 2, 'subsample': 0.6, 'colsample_bytree': 0.8, 'colsample_bylevel': 0.8, 'reg_alpha': 0.007513615138948203, 'reg_lambda': 1.0735233408715095, 'gamma': 1.3192656735518027e-05}. Best is trial 102 with value: -1.306910926946295.
[I 2026-07-14 17:30:05,941] Trial 103 finished with value: -1.6514373108106886 and parameters: {'scalers': 'standard', 'ratios': 'log_ratio', 'imputers': 'median', 'n_estimators': 1300, 'learning_rate': 0.49421840979974485, 'max_depth': 9, 'min_child_weight': 1, 'subsample': 0.6, 'colsample_bytree': 0.9, 'colsample_bylevel': 0.8, 'reg_alpha': 0.00032840206789465896, 'reg_lambda': 3.561371214614449, 'gamma': 1.1179592755436577e-05}. Best is trial 103 with value: -1.6514373108106886.
[I 2026-07-14 17:30:25,029] Trial 104 finished with value: -1.4412127716246557 and parameters: {'scalers': 'standard', 'ratios': 'log_ratio', 'imputers': 'median', 'n_estimators': 950, 'learning_rate': 0.47007416751510434, 'max_depth': 10, 'min_child_weight': 1, 'subsample': 0.6, 'colsample_bytree': 0.9, 'colsample_bylevel': 0.8, 'reg_alpha': 0.0007567731000348502, 'reg_lambda': 1.5757392470683467, 'gamma': 1.4543046341861166e-05}. Best is trial 103 with value: -1.6514373108106886.
[I 2026-07-14 17:30:48,093] Trial 105 finished with value: -1.3586865461472903 and parameters: {'scalers': 'standard', 'ratios': 'log_ratio', 'imputers': 'median', 'n_estimators': 1350, 'learning_rate': 0.48165547199979464, 'max_depth': 10, 'min_child_weight': 1, 'subsample': 0.8, 'colsample_bytree': 0.7, 'colsample_bylevel': 0.8, 'reg_alpha': 0.02017241842530463, 'reg_lambda': 1.1870059865356, 'gamma': 1.3038621938609191e-05}. Best is trial 103 with value: -1.6514373108106886.
[I 2026-07-14 17:31:02,035] Trial 106 finished with value: -1.2135830246695092 and parameters: {'scalers': 'standard', 'ratios': 'log_ratio', 'imputers': 'median', 'n_estimators': 1300, 'learning_rate': 0.4879512287138319, 'max_depth': 8, 'min_child_weight': 1, 'subsample': 0.8, 'colsample_bytree': 0.7, 'colsample_bylevel': 0.8, 'reg_alpha': 0.015247594138413749, 'reg_lambda': 1.1303946476429236, 'gamma': 1.6564229770563947e-05}. Best is trial 103 with value: -1.6514373108106886.
[I 2026-07-14 17:31:16,032] Trial 107 finished with value: -1.1921844488311248 and parameters: {'scalers': 'standard', 'ratios': 'log_ratio', 'imputers': 'median', 'n_estimators': 1350, 'learning_rate': 0.49832509790934226, 'max_depth': 8, 'min_child_weight': 1, 'subsample': 0.8, 'colsample_bytree': 0.7, 'colsample_bylevel': 0.8, 'reg_alpha': 0.014135908586218058, 'reg_lambda': 0.9569903134359793, 'gamma': 1.3850926518235368e-05}. Best is trial 103 with value: -1.6514373108106886.
[I 2026-07-14 17:31:28,665] Trial 108 finished with value: -1.3006418938875437 and parameters: {'scalers': 'standard', 'ratios': 'log_ratio', 'imputers': 'median', 'n_estimators': 1200, 'learning_rate': 0.49831672798130383, 'max_depth': 8, 'min_child_weight': 1, 'subsample': 0.6, 'colsample_bytree': 0.7, 'colsample_bylevel': 0.8, 'reg_alpha': 0.015411822925470643, 'reg_lambda': 1.0076403128865044, 'gamma': 1.1354543432049296e-05}. Best is trial 103 with value: -1.6514373108106886.
[I 2026-07-14 17:31:41,361] Trial 109 finished with value: -0.8869135152175025 and parameters: {'scalers': 'standard', 'ratios': 'log_ratio', 'imputers': 'median', 'n_estimators': 1250, 'learning_rate': 0.1345208543913796, 'max_depth': 8, 'min_child_weight': 1, 'subsample': 0.6, 'colsample_bytree': 0.7, 'colsample_bylevel': 0.8, 'reg_alpha': 0.010176167760161864, 'reg_lambda': 1.1311139025070938, 'gamma': 1.5009036486492406e-05}. Best is trial 103 with value: -1.6514373108106886.
[I 2026-07-14 17:31:51,500] Trial 110 finished with value: -0.8770767421289374 and parameters: {'scalers': 'standard', 'ratios': 'log_ratio', 'imputers': 'median', 'n_estimators': 1000, 'learning_rate': 0.13572370121322636, 'max_depth': 8, 'min_child_weight': 1, 'subsample': 0.6, 'colsample_bytree': 0.7, 'colsample_bylevel': 0.8, 'reg_alpha': 0.08845344617597295, 'reg_lambda': 1.138843219004395, 'gamma': 1.1974705873099283e-05}. Best is trial 103 with value: -1.6514373108106886.
[I 2026-07-14 17:32:04,678] Trial 111 finished with value: -0.9122857795996872 and parameters: {'scalers': 'standard', 'ratios': 'log_ratio', 'imputers': 'median', 'n_estimators': 1250, 'learning_rate': 0.14769924583598099, 'max_depth': 8, 'min_child_weight': 1, 'subsample': 0.6, 'colsample_bytree': 0.7, 'colsample_bylevel': 0.8, 'reg_alpha': 0.08529412174510054, 'reg_lambda': 1.061512198233602, 'gamma': 1.4025551287224155e-05}. Best is trial 103 with value: -1.6514373108106886.
[I 2026-07-14 17:32:20,467] Trial 112 finished with value: -1.005893323293923 and parameters: {'scalers': 'standard', 'ratios': 'log_ratio', 'imputers': 'median', 'n_estimators': 1300, 'learning_rate': 0.13615644395411602, 'max_depth': 8, 'min_child_weight': 1, 'subsample': 0.6, 'colsample_bytree': 0.7, 'colsample_bylevel': 0.8, 'reg_alpha': 0.05683283264151898, 'reg_lambda': 4.351806179404976, 'gamma': 1.2647164264128522e-05}. Best is trial 103 with value: -1.6514373108106886.
[I 2026-07-14 17:32:29,363] Trial 113 finished with value: -0.9862809686092409 and parameters: {'scalers': 'standard', 'ratios': 'log_ratio', 'imputers': 'median', 'n_estimators': 850, 'learning_rate': 0.21238903761945713, 'max_depth': 8, 'min_child_weight': 1, 'subsample': 0.6, 'colsample_bytree': 0.7, 'colsample_bylevel': 0.8, 'reg_alpha': 0.09506672591590604, 'reg_lambda': 1.5711424193218113, 'gamma': 1.0120905061694677e-05}. Best is trial 103 with value: -1.6514373108106886.
[I 2026-07-14 17:32:39,490] Trial 114 finished with value: -0.9659096971164093 and parameters: {'scalers': 'standard', 'ratios': 'log_ratio', 'imputers': 'median', 'n_estimators': 950, 'learning_rate': 0.20662132922347834, 'max_depth': 8, 'min_child_weight': 1, 'subsample': 0.6, 'colsample_bytree': 0.7, 'colsample_bylevel': 0.8, 'reg_alpha': 0.05154200679234123, 'reg_lambda': 1.2762068580580994, 'gamma': 1.214105741730139e-05}. Best is trial 103 with value: -1.6514373108106886.
[I 2026-07-14 17:32:52,905] Trial 115 finished with value: -0.9883672493697295 and parameters: {'scalers': 'standard', 'ratios': 'log_ratio', 'imputers': 'median', 'n_estimators': 1300, 'learning_rate': 0.19772299202249083, 'max_depth': 8, 'min_child_weight': 1, 'subsample': 0.6, 'colsample_bytree': 0.7, 'colsample_bylevel': 0.8, 'reg_alpha': 0.03182589868227794, 'reg_lambda': 1.179442401951589, 'gamma': 1.1641255380970393e-05}. Best is trial 103 with value: -1.6514373108106886.
[I 2026-07-14 17:33:06,741] Trial 116 finished with value: -1.0335432538689227 and parameters: {'scalers': 'standard', 'ratios': 'log_ratio', 'imputers': 'median', 'n_estimators': 1300, 'learning_rate': 0.21043640679348646, 'max_depth': 8, 'min_child_weight': 1, 'subsample': 0.6, 'colsample_bytree': 0.7, 'colsample_bylevel': 0.8, 'reg_alpha': 0.09125477573033586, 'reg_lambda': 1.2245131871838024, 'gamma': 1.2116393510798967e-05}. Best is trial 103 with value: -1.6514373108106886.
[I 2026-07-14 17:33:18,493] Trial 117 finished with value: -1.0939491423923384 and parameters: {'scalers': 'standard', 'ratios': 'log_ratio', 'imputers': 'median', 'n_estimators': 950, 'learning_rate': 0.19851669420256463, 'max_depth': 8, 'min_child_weight': 1, 'subsample': 0.6, 'colsample_bytree': 0.7, 'colsample_bylevel': 0.8, 'reg_alpha': 0.09652587309009439, 'reg_lambda': 4.303457609480484, 'gamma': 9.048959366125455e-06}. Best is trial 103 with value: -1.6514373108106886.
[I 2026-07-14 17:33:30,819] Trial 118 finished with value: -1.0718464754646897 and parameters: {'scalers': 'standard', 'ratios': 'log_ratio', 'imputers': 'median', 'n_estimators': 1000, 'learning_rate': 0.1997845594847331, 'max_depth': 8, 'min_child_weight': 1, 'subsample': 0.6, 'colsample_bytree': 0.7, 'colsample_bylevel': 0.8, 'reg_alpha': 0.026070073509939447, 'reg_lambda': 4.587247491189692, 'gamma': 4.912119872630692e-06}. Best is trial 103 with value: -1.6514373108106886.
[I 2026-07-14 17:33:44,111] Trial 119 finished with value: -1.581683291641843 and parameters: {'scalers': 'standard', 'ratios': 'log_ratio', 'imputers': 'median', 'n_estimators': 1000, 'learning_rate': 0.45733432442871086, 'max_depth': 8, 'min_child_weight': 1, 'subsample': 0.6, 'colsample_bytree': 0.7, 'colsample_bylevel': 0.8, 'reg_alpha': 0.02675403112508799, 'reg_lambda': 5.734897896338781, 'gamma': 5.725131633546499e-06}. Best is trial 103 with value: -1.6514373108106886.
[I 2026-07-14 17:33:56,927] Trial 120 finished with value: -1.5063102382619251 and parameters: {'scalers': 'standard', 'ratios': 'log_ratio', 'imputers': 'median', 'n_estimators': 950, 'learning_rate': 0.4374429807815638, 'max_depth': 8, 'min_child_weight': 1, 'subsample': 0.6, 'colsample_bytree': 0.7, 'colsample_bylevel': 0.8, 'reg_alpha': 0.01873209514615749, 'reg_lambda': 6.666637562360547, 'gamma': 2.1390872198214013e-05}. Best is trial 103 with value: -1.6514373108106886.
[I 2026-07-14 17:34:11,035] Trial 121 finished with value: -1.5650741418751257 and parameters: {'scalers': 'standard', 'ratios': 'log_ratio', 'imputers': 'median', 'n_estimators': 1050, 'learning_rate': 0.44800928295966586, 'max_depth': 8, 'min_child_weight': 1, 'subsample': 0.6, 'colsample_bytree': 0.7, 'colsample_bylevel': 0.8, 'reg_alpha': 0.021842801589183204, 'reg_lambda': 6.34608797943892, 'gamma': 4.40164326434941e-06}. Best is trial 103 with value: -1.6514373108106886.
[I 2026-07-14 17:34:27,939] Trial 122 finished with value: -1.6548949956096883 and parameters: {'scalers': 'standard', 'ratios': 'log_ratio', 'imputers': 'median', 'n_estimators': 1350, 'learning_rate': 0.4452814560063124, 'max_depth': 8, 'min_child_weight': 1, 'subsample': 0.6, 'colsample_bytree': 0.6, 'colsample_bylevel': 0.8, 'reg_alpha': 0.025336627609661714, 'reg_lambda': 5.916062631076102, 'gamma': 4.874196838880158e-06}. Best is trial 122 with value: -1.6548949956096883.
[I 2026-07-14 17:34:41,018] Trial 123 finished with value: -1.4528287471217156 and parameters: {'scalers': 'standard', 'ratios': 'log_ratio', 'imputers': 'median', 'n_estimators': 1350, 'learning_rate': 0.4470552672916116, 'max_depth': 7, 'min_child_weight': 1, 'subsample': 0.6, 'colsample_bytree': 0.7, 'colsample_bylevel': 0.8, 'reg_alpha': 0.018382046854639376, 'reg_lambda': 5.0483200360918925, 'gamma': 6.2626072106364145e-06}. Best is trial 122 with value: -1.6548949956096883.
[I 2026-07-14 17:34:56,763] Trial 124 finished with value: -1.812333989930264 and parameters: {'scalers': 'standard', 'ratios': 'log_ratio', 'imputers': 'median', 'n_estimators': 1050, 'learning_rate': 0.451379791500936, 'max_depth': 9, 'min_child_weight': 1, 'subsample': 0.5, 'colsample_bytree': 0.6, 'colsample_bylevel': 0.8, 'reg_alpha': 0.02192779943993673, 'reg_lambda': 4.111911584350965, 'gamma': 5.4099257649922215e-06}. Best is trial 124 with value: -1.812333989930264.
[I 2026-07-14 17:35:05,663] Trial 125 finished with value: -1.3998117328918758 and parameters: {'scalers': 'standard', 'ratios': 'log_ratio', 'imputers': 'median', 'n_estimators': 1050, 'learning_rate': 0.43981208668663085, 'max_depth': 7, 'min_child_weight': 1, 'subsample': 0.6, 'colsample_bytree': 0.6, 'colsample_bylevel': 0.8, 'reg_alpha': 0.015686343642528734, 'reg_lambda': 5.203282407625192, 'gamma': 4.901933278225193e-06}. Best is trial 124 with value: -1.812333989930264.
[I 2026-07-14 17:35:17,129] Trial 126 finished with value: -1.7394598346506673 and parameters: {'scalers': 'standard', 'ratios': 'log_ratio', 'imputers': 'median', 'n_estimators': 1150, 'learning_rate': 0.44033018383379524, 'max_depth': 7, 'min_child_weight': 1, 'subsample': 0.5, 'colsample_bytree': 0.6, 'colsample_bylevel': 0.8, 'reg_alpha': 0.005653682531662313, 'reg_lambda': 12.781897154184575, 'gamma': 2.2931275901129706e-05}. Best is trial 124 with value: -1.812333989930264.
[I 2026-07-14 17:35:27,576] Trial 127 finished with value: -0.6641298978722648 and parameters: {'scalers': 'standard', 'ratios': 'log_ratio', 'imputers': 'median', 'n_estimators': 1100, 'learning_rate': 0.006317418066447097, 'max_depth': 7, 'min_child_weight': 1, 'subsample': 0.5, 'colsample_bytree': 0.6, 'colsample_bylevel': 0.8, 'reg_alpha': 0.20988810302341968, 'reg_lambda': 9.372707251740334, 'gamma': 5.1307929289873e-06}. Best is trial 124 with value: -1.812333989930264.
[I 2026-07-14 17:35:39,327] Trial 128 finished with value: -0.654204627898578 and parameters: {'scalers': 'standard', 'ratios': 'log_ratio', 'imputers': 'median', 'n_estimators': 1100, 'learning_rate': 0.004266545868244553, 'max_depth': 7, 'min_child_weight': 1, 'subsample': 0.6, 'colsample_bytree': 0.7, 'colsample_bylevel': 0.8, 'reg_alpha': 0.25479530495608277, 'reg_lambda': 13.587052548590995, 'gamma': 2.271374696254911e-05}. Best is trial 124 with value: -1.812333989930264.
[I 2026-07-14 17:35:56,504] Trial 129 finished with value: -1.7306060201828326 and parameters: {'scalers': 'standard', 'ratios': 'log_ratio', 'imputers': 'median', 'n_estimators': 1150, 'learning_rate': 0.43355429204232493, 'max_depth': 8, 'min_child_weight': 1, 'subsample': 0.6, 'colsample_bytree': 0.7, 'colsample_bylevel': 0.8, 'reg_alpha': 0.020472145788076768, 'reg_lambda': 17.59438427101015, 'gamma': 4.980282978864425e-06}. Best is trial 124 with value: -1.812333989930264.
[I 2026-07-14 17:36:07,857] Trial 130 finished with value: -1.2822001912714596 and parameters: {'scalers': 'standard', 'ratios': 'log_ratio', 'imputers': 'median', 'n_estimators': 1150, 'learning_rate': 0.30704679975667304, 'max_depth': 7, 'min_child_weight': 1, 'subsample': 0.6, 'colsample_bytree': 0.6, 'colsample_bylevel': 0.8, 'reg_alpha': 0.018398975854694386, 'reg_lambda': 11.505584872327773, 'gamma': 4.572898424128032e-06}. Best is trial 124 with value: -1.812333989930264.
[I 2026-07-14 17:36:19,014] Trial 131 finished with value: -1.4235569931971985 and parameters: {'scalers': 'standard', 'ratios': 'log_ratio', 'imputers': 'median', 'n_estimators': 1100, 'learning_rate': 0.3120248959189777, 'max_depth': 7, 'min_child_weight': 1, 'subsample': 0.5, 'colsample_bytree': 0.6, 'colsample_bylevel': 0.8, 'reg_alpha': 0.16750682362811292, 'reg_lambda': 12.888189913133887, 'gamma': 5.2064954471447166e-06}. Best is trial 124 with value: -1.812333989930264.
[I 2026-07-14 17:36:29,619] Trial 132 finished with value: -1.3895317585765434 and parameters: {'scalers': 'standard', 'ratios': 'log_ratio', 'imputers': 'median', 'n_estimators': 1100, 'learning_rate': 0.3117960331340297, 'max_depth': 7, 'min_child_weight': 1, 'subsample': 0.5, 'colsample_bytree': 0.6, 'colsample_bylevel': 0.8, 'reg_alpha': 0.021222096043381117, 'reg_lambda': 11.851854342626906, 'gamma': 4.813150398923325e-06}. Best is trial 124 with value: -1.812333989930264.
[I 2026-07-14 17:36:40,860] Trial 133 finished with value: -1.3804613102430199 and parameters: {'scalers': 'standard', 'ratios': 'log_ratio', 'imputers': 'median', 'n_estimators': 1100, 'learning_rate': 0.30281434364582904, 'max_depth': 7, 'min_child_weight': 1, 'subsample': 0.5, 'colsample_bytree': 0.6, 'colsample_bylevel': 0.9, 'reg_alpha': 0.0062009466109681395, 'reg_lambda': 13.333103702925943, 'gamma': 5.39217383040088e-06}. Best is trial 124 with value: -1.812333989930264.
[I 2026-07-14 17:36:52,947] Trial 134 finished with value: -1.4271908484810847 and parameters: {'scalers': 'standard', 'ratios': 'log_ratio', 'imputers': 'median', 'n_estimators': 1100, 'learning_rate': 0.31037973922039613, 'max_depth': 7, 'min_child_weight': 1, 'subsample': 0.5, 'colsample_bytree': 0.6, 'colsample_bylevel': 0.9, 'reg_alpha': 0.22570539198363157, 'reg_lambda': 19.452234806701956, 'gamma': 5.148062579197807e-06}. Best is trial 124 with value: -1.812333989930264.
