[I 2026-07-14 21:58:22,566] Trial 315 finished with value: -0.5980536403905319 and parameters: {'scalers': 'robust', 'ratios': 'norm_ratio', 'imputers': 'median', 'n_estimators': 2800, 'learning_rate': 0.3532172901812034, 'max_depth': 10, 'min_child_weight': 1, 'subsample': 0.6, 'colsample_bytree': 0.7, 'colsample_bylevel': 0.6, 'reg_alpha': 0.3156957425293138, 'reg_lambda': 28.778357541239952, 'gamma': 1.1318727001781747e-05}. Best is trial 218 with value: -3.5899620385375233.
[I 2026-07-14 21:58:47,918] Trial 316 finished with value: -0.5956390384539202 and parameters: {'scalers': 'robust', 'ratios': 'norm_ratio', 'imputers': 'median', 'n_estimators': 2800, 'learning_rate': 0.3451509859545599, 'max_depth': 10, 'min_child_weight': 1, 'subsample': 0.6, 'colsample_bytree': 0.7, 'colsample_bylevel': 0.6, 'reg_alpha': 0.3348003802412998, 'reg_lambda': 30.839257607697608, 'gamma': 2.9955783392595545e-05}. Best is trial 218 with value: -3.5899620385375233.
[I 2026-07-14 21:59:13,241] Trial 317 finished with value: -0.5839464220602166 and parameters: {'scalers': 'robust', 'ratios': 'norm_ratio', 'imputers': 'median', 'n_estimators': 2800, 'learning_rate': 0.3366986905294608, 'max_depth': 10, 'min_child_weight': 1, 'subsample': 0.6, 'colsample_bytree': 0.7, 'colsample_bylevel': 0.6, 'reg_alpha': 0.3114584039745929, 'reg_lambda': 29.683146946527945, 'gamma': 1.6898107642784165e-06}. Best is trial 218 with value: -3.5899620385375233.
[I 2026-07-14 21:59:29,973] Trial 318 finished with value: -0.22105308350074404 and parameters: {'scalers': 'robust', 'ratios': 'norm_ratio', 'imputers': 'median', 'n_estimators': 2800, 'learning_rate': 0.4155803097753432, 'max_depth': 10, 'min_child_weight': 6, 'subsample': 0.6, 'colsample_bytree': 0.7, 'colsample_bylevel': 0.6, 'reg_alpha': 0.30854920828391486, 'reg_lambda': 30.504917933469297, 'gamma': 2.054114026655026e-05}. Best is trial 218 with value: -3.5899620385375233.
[I 2026-07-14 21:59:39,647] Trial 319 finished with value: -0.27667638098166386 and parameters: {'scalers': 'robust', 'ratios': 'norm_ratio', 'imputers': 'median', 'n_estimators': 2800, 'learning_rate': 0.4143584617591697, 'max_depth': 5, 'min_child_weight': 1, 'subsample': 0.6, 'colsample_bytree': 0.7, 'colsample_bylevel': 0.6, 'reg_alpha': 0.30852404643083575, 'reg_lambda': 32.572026215929725, 'gamma': 0.00022768945741657442}. Best is trial 218 with value: -3.5899620385375233.
