[I 2026-07-14 17:09:12,117] Trial 90 finished with value: -0.339345729599993 and parameters: {'scalers': 'robust', 'ratios': 'log_ratio', 'imputers': 'mean', 'n_estimators': 2500, 'learning_rate': 0.49258275876103225, 'max_depth': 7, 'min_child_weight': 3, 'subsample': 0.5, 'colsample_bytree': 0.7, 'colsample_bylevel': 1.0, 'reg_alpha': 0.738574373881315, 'reg_lambda': 0.00023825222113858994, 'gamma': 0.00015816507917108146}. Best is trial 89 with value: -0.5220422998748535.
[I 2026-07-14 17:09:45,142] Trial 91 finished with value: -0.4397411551375398 and parameters: {'scalers': 'robust', 'ratios': 'norm_ratio', 'imputers': 'mean', 'n_estimators': 2850, 'learning_rate': 0.4349859302194605, 'max_depth': 7, 'min_child_weight': 1, 'subsample': 0.5, 'colsample_bytree': 0.7, 'colsample_bylevel': 1.0, 'reg_alpha': 0.6343887403513597, 'reg_lambda': 0.0011405977188297886, 'gamma': 0.00018643957234877433}. Best is trial 89 with value: -0.5220422998748535.
[I 2026-07-14 17:10:10,032] Trial 92 finished with value: -0.3803228323345626 and parameters: {'scalers': 'robust', 'ratios': 'norm_ratio', 'imputers': 'mean', 'n_estimators': 2600, 'learning_rate': 0.2674931009334628, 'max_depth': 7, 'min_child_weight': 1, 'subsample': 0.5, 'colsample_bytree': 0.6, 'colsample_bylevel': 0.8, 'reg_alpha': 0.5896013943305373, 'reg_lambda': 1.6306257399592992, 'gamma': 0.00017526564997348231}. Best is trial 89 with value: -0.5220422998748535.
[I 2026-07-14 17:10:54,151] Trial 93 finished with value: -0.4093934939011114 and parameters: {'scalers': 'robust', 'ratios': 'norm_ratio', 'imputers': 'mean', 'n_estimators': 2850, 'learning_rate': 0.2897609458215319, 'max_depth': 9, 'min_child_weight': 1, 'subsample': 0.9, 'colsample_bytree': 0.5, 'colsample_bylevel': 0.8, 'reg_alpha': 0.7357757135128467, 'reg_lambda': 1.0032895594042763, 'gamma': 4.770056287263239e-05}. Best is trial 89 with value: -0.5220422998748535.
[I 2026-07-14 17:11:02,398] Trial 94 finished with value: -0.17578016465805285 and parameters: {'scalers': 'robust', 'ratios': 'norm_ratio', 'imputers': 'mean', 'n_estimators': 2850, 'learning_rate': 0.277438142600863, 'max_depth': 3, 'min_child_weight': 1, 'subsample': 0.9, 'colsample_bytree': 0.5, 'colsample_bylevel': 0.8, 'reg_alpha': 3.6565578955870723, 'reg_lambda': 5.55159301473387e-06, 'gamma': 0.00018628651612530357}. Best is trial 89 with value: -0.5220422998748535.
[I 2026-07-14 17:11:09,794] Trial 95 finished with value: -0.19308183901621656 and parameters: {'scalers': 'robust', 'ratios': 'norm_ratio', 'imputers': 'mean', 'n_estimators': 2850, 'learning_rate': 0.27510668222139373, 'max_depth': 3, 'min_child_weight': 1, 'subsample': 0.6, 'colsample_bytree': 0.5, 'colsample_bylevel': 0.8, 'reg_alpha': 1.294704158455058, 'reg_lambda': 1.5920155336381416e-05, 'gamma': 5.1954490940851846e-05}. Best is trial 89 with value: -0.5220422998748535.
[I 2026-07-14 17:11:37,016] Trial 96 finished with value: -0.32224087292475867 and parameters: {'scalers': 'none', 'ratios': 'norm_ratio', 'imputers': 'mean', 'n_estimators': 2600, 'learning_rate': 0.30571297056702723, 'max_depth': 9, 'min_child_weight': 1, 'subsample': 0.6, 'colsample_bytree': 0.5, 'colsample_bylevel': 0.8, 'reg_alpha': 3.854931415078841, 'reg_lambda': 0.0009805342561617783, 'gamma': 0.0001747473709178366}. Best is trial 89 with value: -0.5220422998748535.
[I 2026-07-14 17:11:55,808] Trial 97 finished with value: -0.2435325075868055 and parameters: {'scalers': 'robust', 'ratios': 'log_ratio', 'imputers': 'mean', 'n_estimators': 2850, 'learning_rate': 0.2817810048788722, 'max_depth': 7, 'min_child_weight': 1, 'subsample': 0.6, 'colsample_bytree': 0.5, 'colsample_bylevel': 0.8, 'reg_alpha': 4.2315373662931846, 'reg_lambda': 0.0010288337816054874, 'gamma': 0.0012287529838203677}. Best is trial 89 with value: -0.5220422998748535.
[I 2026-07-14 17:12:23,064] Trial 98 finished with value: -0.2991522095214475 and parameters: {'scalers': 'robust', 'ratios': 'log_ratio', 'imputers': 'mean', 'n_estimators': 2850, 'learning_rate': 0.2794036785537924, 'max_depth': 7, 'min_child_weight': 3, 'subsample': 0.5, 'colsample_bytree': 0.7, 'colsample_bylevel': 0.8, 'reg_alpha': 1.0763557839880538, 'reg_lambda': 0.0010735550487544511, 'gamma': 0.00021788774884153527}. Best is trial 89 with value: -0.5220422998748535.
[I 2026-07-14 17:12:55,442] Trial 99 finished with value: -0.33638596092105444 and parameters: {'scalers': 'robust', 'ratios': 'log_ratio', 'imputers': 'mean', 'n_estimators': 2850, 'learning_rate': 0.43479926073446634, 'max_depth': 7, 'min_child_weight': 3, 'subsample': 0.5, 'colsample_bytree': 0.7, 'colsample_bylevel': 1.0, 'reg_alpha': 0.9200139795495689, 'reg_lambda': 0.001136981505636068, 'gamma': 0.00014089865325852898}. Best is trial 89 with value: -0.5220422998748535.
[I 2026-07-14 17:13:21,689] Trial 100 finished with value: -0.2218101725166771 and parameters: {'scalers': 'robust', 'ratios': 'norm_ratio', 'imputers': 'mean', 'n_estimators': 2850, 'learning_rate': 0.27024724668877864, 'max_depth': 7, 'min_child_weight': 1, 'subsample': 0.9, 'colsample_bytree': 0.5, 'colsample_bylevel': 1.0, 'reg_alpha': 4.21376275602461, 'reg_lambda': 1.1123640286612917, 'gamma': 0.0010234308721614285}. Best is trial 89 with value: -0.5220422998748535.
[I 2026-07-14 17:13:43,460] Trial 101 finished with value: -0.21924610490423424 and parameters: {'scalers': 'robust', 'ratios': 'norm_ratio', 'imputers': 'mean', 'n_estimators': 2850, 'learning_rate': 0.27131250706194476, 'max_depth': 7, 'min_child_weight': 3, 'subsample': 1.0, 'colsample_bytree': 0.5, 'colsample_bylevel': 0.8, 'reg_alpha': 3.9793528826285853, 'reg_lambda': 1.1119387542896986, 'gamma': 0.00017523256677871906}. Best is trial 89 with value: -0.5220422998748535.
[I 2026-07-14 17:14:02,381] Trial 102 finished with value: -0.24602920858622906 and parameters: {'scalers': 'robust', 'ratios': 'norm_ratio', 'imputers': 'mean', 'n_estimators': 2900, 'learning_rate': 0.4189064184857212, 'max_depth': 7, 'min_child_weight': 3, 'subsample': 1.0, 'colsample_bytree': 0.5, 'colsample_bylevel': 0.8, 'reg_alpha': 0.4973819022222201, 'reg_lambda': 1.5431739040725565, 'gamma': 0.00013702381490197249}. Best is trial 89 with value: -0.5220422998748535.
[I 2026-07-14 17:14:26,419] Trial 103 finished with value: -0.2935144010125334 and parameters: {'scalers': 'robust', 'ratios': 'norm_ratio', 'imputers': 'mean', 'n_estimators': 2600, 'learning_rate': 0.422058945451065, 'max_depth': 7, 'min_child_weight': 3, 'subsample': 0.9, 'colsample_bytree': 0.5, 'colsample_bylevel': 0.8, 'reg_alpha': 0.5412685047027812, 'reg_lambda': 81.28636602443677, 'gamma': 0.0010302086611058562}. Best is trial 89 with value: -0.5220422998748535.
[I 2026-07-14 17:14:50,118] Trial 104 finished with value: -0.2802011229955321 and parameters: {'scalers': 'robust', 'ratios': 'norm_ratio', 'imputers': 'mean', 'n_estimators': 2950, 'learning_rate': 0.4012519001739221, 'max_depth': 7, 'min_child_weight': 3, 'subsample': 0.9, 'colsample_bytree': 0.5, 'colsample_bylevel': 0.9, 'reg_alpha': 0.565220272597217, 'reg_lambda': 0.89311979002248, 'gamma': 0.00024010452745098967}. Best is trial 89 with value: -0.5220422998748535.
[I 2026-07-14 17:15:12,846] Trial 105 finished with value: -0.33187535354300207 and parameters: {'scalers': 'robust', 'ratios': 'norm_ratio', 'imputers': 'mean', 'n_estimators': 2900, 'learning_rate': 0.4068094130170818, 'max_depth': 7, 'min_child_weight': 3, 'subsample': 0.5, 'colsample_bytree': 0.5, 'colsample_bylevel': 0.9, 'reg_alpha': 0.4720578568106812, 'reg_lambda': 2.807355237660879, 'gamma': 0.0013985246906264475}. Best is trial 89 with value: -0.5220422998748535.
[I 2026-07-14 17:15:45,387] Trial 106 finished with value: -0.3256478081846433 and parameters: {'scalers': 'robust', 'ratios': 'norm_ratio', 'imputers': 'mean', 'n_estimators': 2950, 'learning_rate': 0.4116935900395462, 'max_depth': 7, 'min_child_weight': 3, 'subsample': 0.5, 'colsample_bytree': 0.8, 'colsample_bylevel': 0.9, 'reg_alpha': 0.4399689019467292, 'reg_lambda': 2.0879533452169023, 'gamma': 0.0008066915265500064}. Best is trial 89 with value: -0.5220422998748535.
[I 2026-07-14 17:16:13,716] Trial 107 finished with value: -0.25307357575744227 and parameters: {'scalers': 'robust', 'ratios': 'norm_ratio', 'imputers': 'mean', 'n_estimators': 2950, 'learning_rate': 0.4267331595710279, 'max_depth': 7, 'min_child_weight': 3, 'subsample': 1.0, 'colsample_bytree': 0.7, 'colsample_bylevel': 0.9, 'reg_alpha': 0.5307272469649288, 'reg_lambda': 6.313089009530827, 'gamma': 0.0009370064901088802}. Best is trial 89 with value: -0.5220422998748535.
[I 2026-07-14 17:16:44,687] Trial 108 finished with value: -0.28213166251689253 and parameters: {'scalers': 'robust', 'ratios': 'norm_ratio', 'imputers': 'mean', 'n_estimators': 2950, 'learning_rate': 0.41288436898457453, 'max_depth': 7, 'min_child_weight': 3, 'subsample': 0.9, 'colsample_bytree': 0.7, 'colsample_bylevel': 0.9, 'reg_alpha': 0.48813273707000676, 'reg_lambda': 4.097875627798426, 'gamma': 0.0008417094881111782}. Best is trial 89 with value: -0.5220422998748535.
[I 2026-07-14 17:17:18,684] Trial 109 finished with value: -0.2712254803110855 and parameters: {'scalers': 'robust', 'ratios': 'norm_ratio', 'imputers': 'mean', 'n_estimators': 2950, 'learning_rate': 0.4246855207847816, 'max_depth': 7, 'min_child_weight': 4, 'subsample': 0.9, 'colsample_bytree': 0.7, 'colsample_bylevel': 1.0, 'reg_alpha': 0.530977997432684, 'reg_lambda': 5.549603966785908, 'gamma': 0.0003132517933308818}. Best is trial 89 with value: -0.5220422998748535.
[I 2026-07-14 17:18:03,703] Trial 110 finished with value: -0.3156312146585907 and parameters: {'scalers': 'robust', 'ratios': 'norm_ratio', 'imputers': 'mean', 'n_estimators': 2950, 'learning_rate': 0.390601975203886, 'max_depth': 9, 'min_child_weight': 4, 'subsample': 0.5, 'colsample_bytree': 0.7, 'colsample_bylevel': 1.0, 'reg_alpha': 0.5511844335343199, 'reg_lambda': 0.00020225334309003664, 'gamma': 5.991580339365987e-05}. Best is trial 89 with value: -0.5220422998748535.
[I 2026-07-14 17:18:42,071] Trial 111 finished with value: -0.2659007588132621 and parameters: {'scalers': 'robust', 'ratios': 'norm_ratio', 'imputers': 'mean', 'n_estimators': 2950, 'learning_rate': 0.1996888496625013, 'max_depth': 8, 'min_child_weight': 4, 'subsample': 0.5, 'colsample_bytree': 0.7, 'colsample_bylevel': 1.0, 'reg_alpha': 0.9059237463178259, 'reg_lambda': 5.505915844541454, 'gamma': 0.0003116030184345494}. Best is trial 89 with value: -0.5220422998748535.
[I 2026-07-14 17:19:19,420] Trial 112 finished with value: -0.3371628820985464 and parameters: {'scalers': 'robust', 'ratios': 'norm_ratio', 'imputers': 'mean', 'n_estimators': 2950, 'learning_rate': 0.4977569418461902, 'max_depth': 8, 'min_child_weight': 4, 'subsample': 0.5, 'colsample_bytree': 0.7, 'colsample_bylevel': 1.0, 'reg_alpha': 1.0185131266167224e-06, 'reg_lambda': 4.850157834025202, 'gamma': 0.0003408638860326883}. Best is trial 89 with value: -0.5220422998748535.
[I 2026-07-14 17:19:47,944] Trial 113 finished with value: -0.2248878417965498 and parameters: {'scalers': 'robust', 'ratios': 'norm_ratio', 'imputers': 'mean', 'n_estimators': 3000, 'learning_rate': 0.1975399894943529, 'max_depth': 8, 'min_child_weight': 9, 'subsample': 0.5, 'colsample_bytree': 0.7, 'colsample_bylevel': 0.9, 'reg_alpha': 0.889833714079329, 'reg_lambda': 24.08020908817454, 'gamma': 5.5851824164331776e-05}. Best is trial 89 with value: -0.5220422998748535.
[I 2026-07-14 17:20:17,133] Trial 114 finished with value: -0.25780867447952427 and parameters: {'scalers': 'robust', 'ratios': 'log_ratio', 'imputers': 'mean', 'n_estimators': 2650, 'learning_rate': 0.19909054517036778, 'max_depth': 8, 'min_child_weight': 4, 'subsample': 0.5, 'colsample_bytree': 0.7, 'colsample_bylevel': 0.9, 'reg_alpha': 0.00021711885189513034, 'reg_lambda': 4.2445611767771485, 'gamma': 0.0003233868355185443}. Best is trial 89 with value: -0.5220422998748535.
[I 2026-07-14 17:20:47,272] Trial 115 finished with value: -0.258107932559889 and parameters: {'scalers': 'robust', 'ratios': 'log_ratio', 'imputers': 'mean', 'n_estimators': 2800, 'learning_rate': 0.2058922328644251, 'max_depth': 8, 'min_child_weight': 4, 'subsample': 0.5, 'colsample_bytree': 0.7, 'colsample_bylevel': 0.9, 'reg_alpha': 0.00026315595965377035, 'reg_lambda': 3.4801091021358173, 'gamma': 5.625874662422722e-05}. Best is trial 89 with value: -0.5220422998748535.
[I 2026-07-14 17:21:08,329] Trial 116 finished with value: -0.24812363958844472 and parameters: {'scalers': 'robust', 'ratios': 'log_ratio', 'imputers': 'mean', 'n_estimators': 2650, 'learning_rate': 0.21248173930761607, 'max_depth': 8, 'min_child_weight': 4, 'subsample': 0.5, 'colsample_bytree': 0.7, 'colsample_bylevel': 0.7, 'reg_alpha': 0.0004120669168632719, 'reg_lambda': 0.00028237693935948005, 'gamma': 5.968161176749967e-05}. Best is trial 89 with value: -0.5220422998748535.
[I 2026-07-14 17:21:29,306] Trial 117 finished with value: -0.2412222826909107 and parameters: {'scalers': 'robust', 'ratios': 'log_ratio', 'imputers': 'mean', 'n_estimators': 2650, 'learning_rate': 0.19656897890481825, 'max_depth': 8, 'min_child_weight': 4, 'subsample': 0.5, 'colsample_bytree': 0.7, 'colsample_bylevel': 0.7, 'reg_alpha': 0.0003004607996898645, 'reg_lambda': 0.0003254516999095434, 'gamma': 5.538378611207366e-05}. Best is trial 89 with value: -0.5220422998748535.
[I 2026-07-14 17:22:02,774] Trial 118 finished with value: -0.38002814205458785 and parameters: {'scalers': 'robust', 'ratios': 'norm_ratio', 'imputers': 'mean', 'n_estimators': 2550, 'learning_rate': 0.20185098917261093, 'max_depth': 8, 'min_child_weight': 1, 'subsample': 0.5, 'colsample_bytree': 0.5, 'colsample_bylevel': 1.0, 'reg_alpha': 0.00029672870476707603, 'reg_lambda': 14.466652963886276, 'gamma': 1.8417063346216405e-05}. Best is trial 89 with value: -0.5220422998748535.
[I 2026-07-14 17:22:28,958] Trial 119 finished with value: -0.17188012611549597 and parameters: {'scalers': 'robust', 'ratios': 'norm_ratio', 'imputers': 'mean', 'n_estimators': 2550, 'learning_rate': 0.0006754268712323324, 'max_depth': 8, 'min_child_weight': 1, 'subsample': 0.5, 'colsample_bytree': 0.5, 'colsample_bylevel': 0.7, 'reg_alpha': 0.00030475499855503035, 'reg_lambda': 10.704532544589592, 'gamma': 0.00012822873460702802}. Best is trial 89 with value: -0.5220422998748535.
[I 2026-07-14 17:22:51,991] Trial 120 finished with value: -0.3075129216379677 and parameters: {'scalers': 'robust', 'ratios': 'log_ratio', 'imputers': 'mean', 'n_estimators': 2650, 'learning_rate': 0.4956558414573093, 'max_depth': 8, 'min_child_weight': 5, 'subsample': 0.5, 'colsample_bytree': 0.7, 'colsample_bylevel': 0.7, 'reg_alpha': 0.00026777930116617544, 'reg_lambda': 0.5292501283955013, 'gamma': 0.0001221317070056957}. Best is trial 89 with value: -0.5220422998748535.
[I 2026-07-14 17:23:23,877] Trial 121 finished with value: -0.3302746779237865 and parameters: {'scalers': 'robust', 'ratios': 'log_ratio', 'imputers': 'mean', 'n_estimators': 2650, 'learning_rate': 0.49775506505278966, 'max_depth': 8, 'min_child_weight': 5, 'subsample': 0.5, 'colsample_bytree': 0.7, 'colsample_bylevel': 0.9, 'reg_alpha': 2.3039211059310383e-05, 'reg_lambda': 12.441175409755687, 'gamma': 1.8937701869000394e-05}. Best is trial 89 with value: -0.5220422998748535.
[I 2026-07-14 17:23:57,188] Trial 122 finished with value: -0.29959455102286153 and parameters: {'scalers': 'robust', 'ratios': 'norm_ratio', 'imputers': 'mean', 'n_estimators': 2800, 'learning_rate': 0.49658666174374916, 'max_depth': 8, 'min_child_weight': 5, 'subsample': 0.5, 'colsample_bytree': 0.8, 'colsample_bylevel': 1.0, 'reg_alpha': 2.808509458823316e-06, 'reg_lambda': 0.0003287044149345737, 'gamma': 2.0462121130118897e-05}. Best is trial 89 with value: -0.5220422998748535.
[I 2026-07-14 17:24:39,772] Trial 123 finished with value: -0.3098335059205865 and parameters: {'scalers': 'robust', 'ratios': 'norm_ratio', 'imputers': 'mean', 'n_estimators': 2800, 'learning_rate': 0.4846475836543713, 'max_depth': 9, 'min_child_weight': 5, 'subsample': 0.5, 'colsample_bytree': 0.8, 'colsample_bylevel': 1.0, 'reg_alpha': 0.09124131391043135, 'reg_lambda': 0.5807026479546412, 'gamma': 0.0028612757584601076}. Best is trial 89 with value: -0.5220422998748535.
[I 2026-07-14 17:25:23,802] Trial 124 finished with value: -0.3272563820030796 and parameters: {'scalers': 'robust', 'ratios': 'norm_ratio', 'imputers': 'mean', 'n_estimators': 2550, 'learning_rate': 0.49086890531982985, 'max_depth': 9, 'min_child_weight': 5, 'subsample': 0.5, 'colsample_bytree': 0.8, 'colsample_bylevel': 1.0, 'reg_alpha': 6.5902604757629456e-06, 'reg_lambda': 13.157789220477609, 'gamma': 0.0016745747044506114}. Best is trial 89 with value: -0.5220422998748535.
[I 2026-07-14 17:25:56,816] Trial 125 finished with value: -0.21794981447716613 and parameters: {'scalers': 'robust', 'ratios': 'norm_ratio', 'imputers': 'mean', 'n_estimators': 2550, 'learning_rate': 0.10901771298253128, 'max_depth': 9, 'min_child_weight': 5, 'subsample': 0.5, 'colsample_bytree': 0.8, 'colsample_bylevel': 1.0, 'reg_alpha': 1.6430952206807843e-06, 'reg_lambda': 0.4198571978192279, 'gamma': 0.0018603671338084857}. Best is trial 89 with value: -0.5220422998748535.
[I 2026-07-14 17:26:31,526] Trial 126 finished with value: -0.24427083437689287 and parameters: {'scalers': 'robust', 'ratios': 'norm_ratio', 'imputers': 'mean', 'n_estimators': 2550, 'learning_rate': 0.23640706945299872, 'max_depth': 9, 'min_child_weight': 6, 'subsample': 0.5, 'colsample_bytree': 0.8, 'colsample_bylevel': 1.0, 'reg_alpha': 2.7177327313393373e-05, 'reg_lambda': 0.46815802922061933, 'gamma': 0.0001167589406490861}. Best is trial 89 with value: -0.5220422998748535.
[I 2026-07-14 17:27:19,351] Trial 127 finished with value: -0.3294996648502468 and parameters: {'scalers': 'robust', 'ratios': 'norm_ratio', 'imputers': 'mean', 'n_estimators': 2800, 'learning_rate': 0.49516432896309887, 'max_depth': 9, 'min_child_weight': 5, 'subsample': 0.5, 'colsample_bytree': 0.8, 'colsample_bylevel': 1.0, 'reg_alpha': 4.301179948658368e-06, 'reg_lambda': 10.584457290320419, 'gamma': 2.4214997368719953e-05}. Best is trial 89 with value: -0.5220422998748535.
[I 2026-07-14 17:28:01,594] Trial 128 finished with value: -0.2263011873374406 and parameters: {'scalers': 'robust', 'ratios': 'norm_ratio', 'imputers': 'mean', 'n_estimators': 2800, 'learning_rate': 0.10629076065656799, 'max_depth': 9, 'min_child_weight': 5, 'subsample': 0.5, 'colsample_bytree': 0.8, 'colsample_bylevel': 1.0, 'reg_alpha': 3.835558582321259e-05, 'reg_lambda': 22.39406424081273, 'gamma': 1.63075590161679e-05}. Best is trial 89 with value: -0.5220422998748535.
[I 2026-07-14 17:29:05,765] Trial 129 finished with value: -0.333015039110398 and parameters: {'scalers': 'robust', 'ratios': 'norm_ratio', 'imputers': 'mean', 'n_estimators': 2800, 'learning_rate': 0.1052894166923978, 'max_depth': 9, 'min_child_weight': 1, 'subsample': 0.5, 'colsample_bytree': 0.8, 'colsample_bylevel': 1.0, 'reg_alpha': 4.691828813621347e-06, 'reg_lambda': 15.170753468829153, 'gamma': 0.002362035267176266}. Best is trial 89 with value: -0.5220422998748535.
[I 2026-07-14 17:29:55,465] Trial 130 finished with value: -0.45549543234609646 and parameters: {'scalers': 'robust', 'ratios': 'norm_ratio', 'imputers': 'mean', 'n_estimators': 2500, 'learning_rate': 0.3064610546763786, 'max_depth': 9, 'min_child_weight': 1, 'subsample': 0.5, 'colsample_bytree': 0.6, 'colsample_bylevel': 1.0, 'reg_alpha': 1.4247877743079573e-06, 'reg_lambda': 47.54865767113662, 'gamma': 0.009934622880650995}. Best is trial 89 with value: -0.5220422998748535.
[I 2026-07-14 17:30:22,346] Trial 131 finished with value: -0.39161525528195984 and parameters: {'scalers': 'robust', 'ratios': 'norm_ratio', 'imputers': 'mean', 'n_estimators': 2500, 'learning_rate': 0.30429487407889605, 'max_depth': 7, 'min_child_weight': 1, 'subsample': 0.5, 'colsample_bytree': 0.6, 'colsample_bylevel': 1.0, 'reg_alpha': 1.3859674730381637, 'reg_lambda': 24.278226098051867, 'gamma': 0.0016558557774763961}. Best is trial 89 with value: -0.5220422998748535.
[I 2026-07-14 17:30:56,450] Trial 132 finished with value: -0.44215830920231225 and parameters: {'scalers': 'robust', 'ratios': 'norm_ratio', 'imputers': 'mean', 'n_estimators': 2750, 'learning_rate': 0.30139973424915484, 'max_depth': 7, 'min_child_weight': 1, 'subsample': 0.5, 'colsample_bytree': 0.6, 'colsample_bylevel': 1.0, 'reg_alpha': 2.0974700069612275e-05, 'reg_lambda': 43.46646050692114, 'gamma': 0.0005007462135648841}. Best is trial 89 with value: -0.5220422998748535.
[I 2026-07-14 17:31:29,330] Trial 133 finished with value: -0.42328611541883165 and parameters: {'scalers': 'robust', 'ratios': 'norm_ratio', 'imputers': 'mean', 'n_estimators': 2750, 'learning_rate': 0.30934967201180663, 'max_depth': 7, 'min_child_weight': 1, 'subsample': 0.5, 'colsample_bytree': 0.6, 'colsample_bylevel': 1.0, 'reg_alpha': 3.5170300517700416e-05, 'reg_lambda': 18.737914008522527, 'gamma': 0.008870238646579136}. Best is trial 89 with value: -0.5220422998748535.
[I 2026-07-14 17:32:02,231] Trial 134 finished with value: -0.4038195586650766 and parameters: {'scalers': 'robust', 'ratios': 'norm_ratio', 'imputers': 'mean', 'n_estimators': 2750, 'learning_rate': 0.3033584549448268, 'max_depth': 7, 'min_child_weight': 1, 'subsample': 0.5, 'colsample_bytree': 0.6, 'colsample_bylevel': 1.0, 'reg_alpha': 1.4715260156129428, 'reg_lambda': 31.560899666488208, 'gamma': 0.0005782405307564845}. Best is trial 89 with value: -0.5220422998748535.
