[I 2026-07-14 18:22:29,462] Trial 317 finished with value: -7.838501220041307 and parameters: {'scalers': 'robust', 'ratios': 'norm_ratio', 'imputers': 'none', 'n_estimators': 1950, 'learning_rate': 0.4907698198330378, 'max_depth': 9, 'min_child_weight': 1, 'subsample': 0.5, 'colsample_bytree': 0.5, 'colsample_bylevel': 0.8, 'reg_alpha': 0.6692587634557359, 'reg_lambda': 33.114016060708494, 'gamma': 0.0008479292655895051}. Best is trial 305 with value: -8.101923142153769.
[I 2026-07-14 18:22:46,338] Trial 318 finished with value: -1.172875915148125 and parameters: {'scalers': 'robust', 'ratios': 'norm_ratio', 'imputers': 'none', 'n_estimators': 1950, 'learning_rate': 0.4976877880889007, 'max_depth': 9, 'min_child_weight': 8, 'subsample': 0.5, 'colsample_bytree': 0.5, 'colsample_bylevel': 0.8, 'reg_alpha': 0.6945751820859717, 'reg_lambda': 29.442165396951104, 'gamma': 0.0009844725866090694}. Best is trial 305 with value: -8.101923142153769.
[I 2026-07-14 18:23:14,860] Trial 319 finished with value: -6.469036211689288 and parameters: {'scalers': 'robust', 'ratios': 'norm_ratio', 'imputers': 'none', 'n_estimators': 1950, 'learning_rate': 0.48324286746375433, 'max_depth': 9, 'min_child_weight': 1, 'subsample': 0.5, 'colsample_bytree': 0.5, 'colsample_bylevel': 0.8, 'reg_alpha': 0.764524769671548, 'reg_lambda': 30.18296414632724, 'gamma': 0.0009079084606012607}. Best is trial 305 with value: -8.101923142153769.
