[I 2026-07-14 21:01:34,098] Trial 90 finished with value: -0.15745714195844293 and parameters: {'scalers': 'none', 'ratios': 'norm_ratio', 'imputers': 'median', 'n_estimators': 2200, 'learning_rate': 0.48547817795739245, 'max_depth': 7, 'min_child_weight': 2, 'subsample': 0.6, 'colsample_bytree': 0.8, 'colsample_bylevel': 0.5, 'reg_alpha': 2.4221233313999225e-05, 'reg_lambda': 0.03374810237407735, 'gamma': 0.0808522002533558}. Best is trial 75 with value: -0.2260307919956698.
[I 2026-07-14 21:01:40,868] Trial 91 finished with value: -0.11314154046286201 and parameters: {'scalers': 'none', 'ratios': 'norm_ratio', 'imputers': 'median', 'n_estimators': 2200, 'learning_rate': 0.23504335537917354, 'max_depth': 7, 'min_child_weight': 2, 'subsample': 0.6, 'colsample_bytree': 0.8, 'colsample_bylevel': 0.5, 'reg_alpha': 2.368681749793859e-05, 'reg_lambda': 0.03131027586299547, 'gamma': 0.0857538097749312}. Best is trial 75 with value: -0.2260307919956698.
[I 2026-07-14 21:01:43,470] Trial 92 finished with value: -0.05703010990925962 and parameters: {'scalers': 'none', 'ratios': 'norm_ratio', 'imputers': 'median', 'n_estimators': 2250, 'learning_rate': 0.3736887365968048, 'max_depth': 7, 'min_child_weight': 2, 'subsample': 0.6, 'colsample_bytree': 0.8, 'colsample_bylevel': 0.5, 'reg_alpha': 2.8997183297064857e-05, 'reg_lambda': 0.0549424774024916, 'gamma': 0.26053441364805735}. Best is trial 75 with value: -0.2260307919956698.
[I 2026-07-14 21:01:46,401] Trial 93 finished with value: -0.07045834774803228 and parameters: {'scalers': 'none', 'ratios': 'norm_ratio', 'imputers': 'median', 'n_estimators': 2250, 'learning_rate': 0.3481254166216, 'max_depth': 6, 'min_child_weight': 2, 'subsample': 0.6, 'colsample_bytree': 0.8, 'colsample_bylevel': 0.6, 'reg_alpha': 2.6342176919968214e-05, 'reg_lambda': 0.23684021087627644, 'gamma': 0.22004563642627822}. Best is trial 75 with value: -0.2260307919956698.
[I 2026-07-14 21:01:54,328] Trial 94 finished with value: -0.12962955770639972 and parameters: {'scalers': 'none', 'ratios': 'norm_ratio', 'imputers': 'median', 'n_estimators': 1950, 'learning_rate': 0.23599401099399028, 'max_depth': 8, 'min_child_weight': 2, 'subsample': 0.6, 'colsample_bytree': 0.8, 'colsample_bylevel': 0.6, 'reg_alpha': 2.82399983423234e-05, 'reg_lambda': 0.1739449030365325, 'gamma': 0.02076763239950768}. Best is trial 75 with value: -0.2260307919956698.
[I 2026-07-14 21:01:59,724] Trial 95 finished with value: -0.12164140017528226 and parameters: {'scalers': 'none', 'ratios': 'norm_ratio', 'imputers': 'median', 'n_estimators': 2000, 'learning_rate': 0.49139263172744635, 'max_depth': 7, 'min_child_weight': 2, 'subsample': 0.6, 'colsample_bytree': 0.8, 'colsample_bylevel': 0.9, 'reg_alpha': 2.4407204935589856e-05, 'reg_lambda': 0.14833996839924196, 'gamma': 0.19482128545509977}. Best is trial 75 with value: -0.2260307919956698.
[I 2026-07-14 21:02:04,487] Trial 96 finished with value: -0.11962784292715054 and parameters: {'scalers': 'none', 'ratios': 'norm_ratio', 'imputers': 'median', 'n_estimators': 2000, 'learning_rate': 0.31792967759307544, 'max_depth': 7, 'min_child_weight': 2, 'subsample': 0.6, 'colsample_bytree': 0.7, 'colsample_bylevel': 0.6, 'reg_alpha': 2.1503360768143848e-05, 'reg_lambda': 0.4264429960172949, 'gamma': 0.1526105086866199}. Best is trial 75 with value: -0.2260307919956698.
[I 2026-07-14 21:02:06,441] Trial 97 finished with value: -0.06295126356275582 and parameters: {'scalers': 'none', 'ratios': 'norm_ratio', 'imputers': 'median', 'n_estimators': 2000, 'learning_rate': 0.4724622994327367, 'max_depth': 8, 'min_child_weight': 2, 'subsample': 0.6, 'colsample_bytree': 0.7, 'colsample_bylevel': 0.6, 'reg_alpha': 2.471809311296978e-05, 'reg_lambda': 0.40043686408644913, 'gamma': 0.25830543194338357}. Best is trial 75 with value: -0.2260307919956698.
[I 2026-07-14 21:02:08,815] Trial 98 finished with value: -0.06975306418267009 and parameters: {'scalers': 'none', 'ratios': 'norm_ratio', 'imputers': 'median', 'n_estimators': 2000, 'learning_rate': 0.2996019619758618, 'max_depth': 8, 'min_child_weight': 2, 'subsample': 0.6, 'colsample_bytree': 0.7, 'colsample_bylevel': 0.6, 'reg_alpha': 2.5648405541487042e-05, 'reg_lambda': 0.39697650385576577, 'gamma': 0.2115314705022025}. Best is trial 75 with value: -0.2260307919956698.
[I 2026-07-14 21:02:13,027] Trial 99 finished with value: -0.13042805203211924 and parameters: {'scalers': 'none', 'ratios': 'norm_ratio', 'imputers': 'median', 'n_estimators': 2050, 'learning_rate': 0.4841163087986785, 'max_depth': 8, 'min_child_weight': 2, 'subsample': 0.6, 'colsample_bytree': 0.7, 'colsample_bylevel': 0.8, 'reg_alpha': 2.7422566966358813e-05, 'reg_lambda': 0.31421353874169683, 'gamma': 0.19741296001814032}. Best is trial 75 with value: -0.2260307919956698.
[I 2026-07-14 21:02:20,498] Trial 100 finished with value: -0.18757645736965545 and parameters: {'scalers': 'none', 'ratios': 'norm_ratio', 'imputers': 'median', 'n_estimators': 2000, 'learning_rate': 0.4686379527862671, 'max_depth': 8, 'min_child_weight': 2, 'subsample': 0.6, 'colsample_bytree': 0.7, 'colsample_bylevel': 0.6, 'reg_alpha': 1.8699174778575634e-05, 'reg_lambda': 0.22194567885175243, 'gamma': 0.016506505080423003}. Best is trial 75 with value: -0.2260307919956698.
[I 2026-07-14 21:02:28,669] Trial 101 finished with value: -0.17459531875515766 and parameters: {'scalers': 'none', 'ratios': 'norm_ratio', 'imputers': 'median', 'n_estimators': 2000, 'learning_rate': 0.49617082128407763, 'max_depth': 8, 'min_child_weight': 2, 'subsample': 0.6, 'colsample_bytree': 0.7, 'colsample_bylevel': 0.8, 'reg_alpha': 4.678506507044615e-05, 'reg_lambda': 2.2404882114265074e-05, 'gamma': 0.02189598428600262}. Best is trial 75 with value: -0.2260307919956698.
[I 2026-07-14 21:02:35,592] Trial 102 finished with value: -0.15328190911024436 and parameters: {'scalers': 'none', 'ratios': 'norm_ratio', 'imputers': 'median', 'n_estimators': 2000, 'learning_rate': 0.4740193135996396, 'max_depth': 8, 'min_child_weight': 2, 'subsample': 0.6, 'colsample_bytree': 0.7, 'colsample_bylevel': 0.8, 'reg_alpha': 4.614114790871242e-05, 'reg_lambda': 2.293028917327574e-05, 'gamma': 0.14343768312932623}. Best is trial 75 with value: -0.2260307919956698.
[I 2026-07-14 21:02:42,362] Trial 103 finished with value: -0.13346097984916486 and parameters: {'scalers': 'none', 'ratios': 'norm_ratio', 'imputers': 'median', 'n_estimators': 1700, 'learning_rate': 0.3076517877738433, 'max_depth': 8, 'min_child_weight': 2, 'subsample': 0.6, 'colsample_bytree': 0.7, 'colsample_bylevel': 0.8, 'reg_alpha': 9.022086686468779e-05, 'reg_lambda': 2.4726690267989777e-05, 'gamma': 0.01589948329996206}. Best is trial 75 with value: -0.2260307919956698.
[I 2026-07-14 21:02:44,932] Trial 104 finished with value: -0.05195358079347928 and parameters: {'scalers': 'none', 'ratios': 'norm_ratio', 'imputers': 'median', 'n_estimators': 2400, 'learning_rate': 0.49086976670619586, 'max_depth': 8, 'min_child_weight': 2, 'subsample': 0.6, 'colsample_bytree': 0.7, 'colsample_bylevel': 0.8, 'reg_alpha': 0.00012120806105300855, 'reg_lambda': 0.10095246369683508, 'gamma': 1.1184174445416823}. Best is trial 75 with value: -0.2260307919956698.
[I 2026-07-14 21:03:02,206] Trial 105 finished with value: -0.05706760157159532 and parameters: {'scalers': 'none', 'ratios': 'norm_ratio', 'imputers': 'median', 'n_estimators': 2400, 'learning_rate': 0.001734291922829565, 'max_depth': 12, 'min_child_weight': 6, 'subsample': 0.6, 'colsample_bytree': 0.7, 'colsample_bylevel': 0.8, 'reg_alpha': 8.301415438444102e-05, 'reg_lambda': 0.003951050539513057, 'gamma': 0.05081403896295994}. Best is trial 75 with value: -0.2260307919956698.
[I 2026-07-14 21:03:16,442] Trial 106 finished with value: -0.11665131554673798 and parameters: {'scalers': 'none', 'ratios': 'norm_ratio', 'imputers': 'median', 'n_estimators': 2400, 'learning_rate': 0.16826342755446042, 'max_depth': 12, 'min_child_weight': 8, 'subsample': 0.6, 'colsample_bytree': 0.7, 'colsample_bylevel': 0.8, 'reg_alpha': 9.037932417748655e-05, 'reg_lambda': 0.003336249751160252, 'gamma': 0.052430984873933925}. Best is trial 75 with value: -0.2260307919956698.
[I 2026-07-14 21:03:30,911] Trial 107 finished with value: -0.11262290695499705 and parameters: {'scalers': 'none', 'ratios': 'norm_ratio', 'imputers': 'median', 'n_estimators': 2500, 'learning_rate': 0.16891980681323396, 'max_depth': 12, 'min_child_weight': 9, 'subsample': 0.6, 'colsample_bytree': 0.7, 'colsample_bylevel': 0.8, 'reg_alpha': 0.017785055837985907, 'reg_lambda': 0.08543971720292592, 'gamma': 0.04632048022918793}. Best is trial 75 with value: -0.2260307919956698.
[I 2026-07-14 21:03:45,594] Trial 108 finished with value: -0.12289980050644433 and parameters: {'scalers': 'none', 'ratios': 'norm_ratio', 'imputers': 'median', 'n_estimators': 2400, 'learning_rate': 0.1662577378723185, 'max_depth': 12, 'min_child_weight': 7, 'subsample': 0.6, 'colsample_bytree': 0.7, 'colsample_bylevel': 0.8, 'reg_alpha': 2.6608293178747012e-06, 'reg_lambda': 1.0872255133563948, 'gamma': 0.0508720988177863}. Best is trial 75 with value: -0.2260307919956698.
[I 2026-07-14 21:03:59,523] Trial 109 finished with value: -0.115940709772256 and parameters: {'scalers': 'none', 'ratios': 'norm_ratio', 'imputers': 'median', 'n_estimators': 2350, 'learning_rate': 0.16574643225438962, 'max_depth': 12, 'min_child_weight': 8, 'subsample': 0.6, 'colsample_bytree': 0.7, 'colsample_bylevel': 0.8, 'reg_alpha': 5.322414339218494e-05, 'reg_lambda': 2.1940770401016808e-05, 'gamma': 0.04924255442058469}. Best is trial 75 with value: -0.2260307919956698.
[I 2026-07-14 21:04:12,761] Trial 110 finished with value: -0.1540196720515642 and parameters: {'scalers': 'none', 'ratios': 'norm_ratio', 'imputers': 'median', 'n_estimators': 1700, 'learning_rate': 0.2702430335526175, 'max_depth': 12, 'min_child_weight': 6, 'subsample': 0.6, 'colsample_bytree': 0.7, 'colsample_bylevel': 0.8, 'reg_alpha': 7.068983043694885e-05, 'reg_lambda': 6.436033840288347, 'gamma': 0.018097519976763742}. Best is trial 75 with value: -0.2260307919956698.
[I 2026-07-14 21:04:24,608] Trial 111 finished with value: -0.11705365492041424 and parameters: {'scalers': 'none', 'ratios': 'norm_ratio', 'imputers': 'median', 'n_estimators': 1900, 'learning_rate': 0.16229824353437247, 'max_depth': 12, 'min_child_weight': 7, 'subsample': 0.6, 'colsample_bytree': 0.7, 'colsample_bylevel': 0.8, 'reg_alpha': 0.00010941557800487847, 'reg_lambda': 0.09641766269160632, 'gamma': 0.04904636642939909}. Best is trial 75 with value: -0.2260307919956698.
[I 2026-07-14 21:04:37,210] Trial 112 finished with value: -0.1258791068828927 and parameters: {'scalers': 'none', 'ratios': 'norm_ratio', 'imputers': 'median', 'n_estimators': 1900, 'learning_rate': 0.1659011484397472, 'max_depth': 12, 'min_child_weight': 6, 'subsample': 0.6, 'colsample_bytree': 0.7, 'colsample_bylevel': 0.8, 'reg_alpha': 4.200539127800746e-05, 'reg_lambda': 2.3445454460164847e-05, 'gamma': 0.04882200017550923}. Best is trial 75 with value: -0.2260307919956698.
[I 2026-07-14 21:04:49,045] Trial 113 finished with value: -0.11066182343488194 and parameters: {'scalers': 'none', 'ratios': 'norm_ratio', 'imputers': 'median', 'n_estimators': 1900, 'learning_rate': 0.17206765148977976, 'max_depth': 12, 'min_child_weight': 9, 'subsample': 0.6, 'colsample_bytree': 0.7, 'colsample_bylevel': 0.8, 'reg_alpha': 5.0576590648654645e-05, 'reg_lambda': 3.604536346648854, 'gamma': 0.024286687778223157}. Best is trial 75 with value: -0.2260307919956698.
[I 2026-07-14 21:04:56,390] Trial 114 finished with value: -0.052190323065238575 and parameters: {'scalers': 'none', 'ratios': 'norm_ratio', 'imputers': 'median', 'n_estimators': 1900, 'learning_rate': 0.00011763403040086605, 'max_depth': 5, 'min_child_weight': 1, 'subsample': 0.6, 'colsample_bytree': 0.7, 'colsample_bylevel': 0.8, 'reg_alpha': 4.095590676276354e-05, 'reg_lambda': 2.9507237379106503, 'gamma': 0.004530471188262167}. Best is trial 75 with value: -0.2260307919956698.
[I 2026-07-14 21:05:08,645] Trial 115 finished with value: -0.20512599592540504 and parameters: {'scalers': 'none', 'ratios': 'norm_ratio', 'imputers': 'median', 'n_estimators': 1900, 'learning_rate': 0.2718325652325161, 'max_depth': 11, 'min_child_weight': 1, 'subsample': 0.5, 'colsample_bytree': 0.7, 'colsample_bylevel': 0.9, 'reg_alpha': 4.874625016879087e-05, 'reg_lambda': 2.7984133782984e-05, 'gamma': 0.015506890625306144}. Best is trial 75 with value: -0.2260307919956698.
[I 2026-07-14 21:05:26,257] Trial 116 finished with value: -0.05260448671135887 and parameters: {'scalers': 'none', 'ratios': 'norm_ratio', 'imputers': 'median', 'n_estimators': 1900, 'learning_rate': 0.0001364276983410628, 'max_depth': 11, 'min_child_weight': 1, 'subsample': 0.5, 'colsample_bytree': 0.7, 'colsample_bylevel': 0.8, 'reg_alpha': 4.81616826479587e-05, 'reg_lambda': 2.1041229852465455, 'gamma': 0.023038947893310943}. Best is trial 75 with value: -0.2260307919956698.
[I 2026-07-14 21:05:33,550] Trial 117 finished with value: -0.18617250103994318 and parameters: {'scalers': 'none', 'ratios': 'norm_ratio', 'imputers': 'median', 'n_estimators': 2100, 'learning_rate': 0.26228491183739905, 'max_depth': 5, 'min_child_weight': 1, 'subsample': 0.5, 'colsample_bytree': 0.7, 'colsample_bylevel': 0.9, 'reg_alpha': 4.3255134541853703e-05, 'reg_lambda': 6.907884533713507, 'gamma': 0.0045379719603793655}. Best is trial 75 with value: -0.2260307919956698.
[I 2026-07-14 21:05:48,682] Trial 118 finished with value: -0.17108959746170446 and parameters: {'scalers': 'none', 'ratios': 'norm_ratio', 'imputers': 'median', 'n_estimators': 1900, 'learning_rate': 0.27406775429759583, 'max_depth': 11, 'min_child_weight': 5, 'subsample': 0.6, 'colsample_bytree': 0.7, 'colsample_bylevel': 0.8, 'reg_alpha': 4.796388825786237e-05, 'reg_lambda': 0.7927163056063773, 'gamma': 0.015210925534680345}. Best is trial 75 with value: -0.2260307919956698.
[I 2026-07-14 21:06:03,443] Trial 119 finished with value: -0.17037405296394983 and parameters: {'scalers': 'none', 'ratios': 'norm_ratio', 'imputers': 'median', 'n_estimators': 2100, 'learning_rate': 0.2773300885925545, 'max_depth': 11, 'min_child_weight': 6, 'subsample': 0.5, 'colsample_bytree': 0.7, 'colsample_bylevel': 0.8, 'reg_alpha': 5.066747887161112e-05, 'reg_lambda': 3.692754258095252, 'gamma': 0.026796036153877892}. Best is trial 75 with value: -0.2260307919956698.
[I 2026-07-14 21:06:18,028] Trial 120 finished with value: -0.27778500405711504 and parameters: {'scalers': 'none', 'ratios': 'norm_ratio', 'imputers': 'median', 'n_estimators': 2100, 'learning_rate': 0.2729068161012181, 'max_depth': 11, 'min_child_weight': 1, 'subsample': 0.5, 'colsample_bytree': 0.7, 'colsample_bylevel': 0.8, 'reg_alpha': 6.869862031102747e-06, 'reg_lambda': 0.8661138552758708, 'gamma': 0.025547837742688397}. Best is trial 120 with value: -0.27778500405711504.
[I 2026-07-14 21:06:37,632] Trial 121 finished with value: -0.4718193564368632 and parameters: {'scalers': 'none', 'ratios': 'norm_ratio', 'imputers': 'median', 'n_estimators': 1700, 'learning_rate': 0.2751456045884054, 'max_depth': 11, 'min_child_weight': 1, 'subsample': 0.5, 'colsample_bytree': 0.7, 'colsample_bylevel': 0.9, 'reg_alpha': 1.3862227186536756e-05, 'reg_lambda': 32.79974852000322, 'gamma': 0.005093246687235048}. Best is trial 121 with value: -0.4718193564368632.
[I 2026-07-14 21:06:48,429] Trial 122 finished with value: -0.17922324860079278 and parameters: {'scalers': 'none', 'ratios': 'norm_ratio', 'imputers': 'median', 'n_estimators': 1650, 'learning_rate': 0.27427660993444336, 'max_depth': 11, 'min_child_weight': 5, 'subsample': 0.5, 'colsample_bytree': 0.7, 'colsample_bylevel': 0.8, 'reg_alpha': 1.4788105489119907e-05, 'reg_lambda': 26.150746520450603, 'gamma': 0.015099750390039668}. Best is trial 121 with value: -0.4718193564368632.
[I 2026-07-14 21:07:12,685] Trial 123 finished with value: -0.4094396041896434 and parameters: {'scalers': 'robust', 'ratios': 'norm_ratio', 'imputers': 'median', 'n_estimators': 2100, 'learning_rate': 0.2575423128003513, 'max_depth': 11, 'min_child_weight': 1, 'subsample': 0.5, 'colsample_bytree': 0.7, 'colsample_bylevel': 0.9, 'reg_alpha': 0.0006361929936868821, 'reg_lambda': 12.951427156090482, 'gamma': 0.016191817269461742}. Best is trial 121 with value: -0.4718193564368632.
[I 2026-07-14 21:07:24,402] Trial 124 finished with value: -0.17037151365387007 and parameters: {'scalers': 'robust', 'ratios': 'norm_ratio', 'imputers': 'median', 'n_estimators': 1650, 'learning_rate': 0.26166857352676665, 'max_depth': 11, 'min_child_weight': 5, 'subsample': 0.5, 'colsample_bytree': 0.7, 'colsample_bylevel': 0.9, 'reg_alpha': 5.898076820596701e-06, 'reg_lambda': 21.87876302524929, 'gamma': 0.013410043337674909}. Best is trial 121 with value: -0.4718193564368632.
[I 2026-07-14 21:07:29,185] Trial 125 finished with value: -0.0825923264540647 and parameters: {'scalers': 'robust', 'ratios': 'norm_ratio', 'imputers': 'median', 'n_estimators': 2100, 'learning_rate': 0.2090054308847833, 'max_depth': 4, 'min_child_weight': 1, 'subsample': 0.5, 'colsample_bytree': 0.9, 'colsample_bylevel': 0.9, 'reg_alpha': 6.7431394362052575e-06, 'reg_lambda': 0.00013366905475145489, 'gamma': 0.01238014917483322}. Best is trial 121 with value: -0.4718193564368632.
[I 2026-07-14 21:07:48,066] Trial 126 finished with value: -0.15731986984410495 and parameters: {'scalers': 'robust', 'ratios': 'norm_ratio', 'imputers': 'median', 'n_estimators': 2100, 'learning_rate': 0.21258488034439088, 'max_depth': 11, 'min_child_weight': 5, 'subsample': 0.5, 'colsample_bytree': 0.9, 'colsample_bylevel': 0.9, 'reg_alpha': 1.4968474090533027e-05, 'reg_lambda': 0.00010753093819279737, 'gamma': 0.0013224463819272196}. Best is trial 121 with value: -0.4718193564368632.
[I 2026-07-14 21:08:00,381] Trial 127 finished with value: -0.15815902237147023 and parameters: {'scalers': 'robust', 'ratios': 'norm_ratio', 'imputers': 'median', 'n_estimators': 2100, 'learning_rate': 0.21366139939390158, 'max_depth': 11, 'min_child_weight': 5, 'subsample': 0.5, 'colsample_bytree': 0.7, 'colsample_bylevel': 0.9, 'reg_alpha': 1.5045916509138873e-05, 'reg_lambda': 33.092376057001, 'gamma': 0.029726571407833084}. Best is trial 121 with value: -0.4718193564368632.
[I 2026-07-14 21:08:15,457] Trial 128 finished with value: -0.16998978891356317 and parameters: {'scalers': 'robust', 'ratios': 'norm_ratio', 'imputers': 'median', 'n_estimators': 2100, 'learning_rate': 0.21596316888768832, 'max_depth': 11, 'min_child_weight': 5, 'subsample': 0.5, 'colsample_bytree': 0.7, 'colsample_bylevel': 0.9, 'reg_alpha': 1.747181045813008e-05, 'reg_lambda': 15.006020409735719, 'gamma': 0.01438482147058112}. Best is trial 121 with value: -0.4718193564368632.
[I 2026-07-14 21:08:27,003] Trial 129 finished with value: -0.17119972782411344 and parameters: {'scalers': 'robust', 'ratios': 'norm_ratio', 'imputers': 'median', 'n_estimators': 1650, 'learning_rate': 0.2717052005377935, 'max_depth': 11, 'min_child_weight': 5, 'subsample': 0.5, 'colsample_bytree': 0.7, 'colsample_bylevel': 0.9, 'reg_alpha': 1.484334383059421e-05, 'reg_lambda': 28.50808203471802, 'gamma': 0.013851069409159448}. Best is trial 121 with value: -0.4718193564368632.
[I 2026-07-14 21:08:38,274] Trial 130 finished with value: -0.15826774053047404 and parameters: {'scalers': 'robust', 'ratios': 'norm_ratio', 'imputers': 'median', 'n_estimators': 1650, 'learning_rate': 0.2191902746995266, 'max_depth': 11, 'min_child_weight': 5, 'subsample': 0.5, 'colsample_bytree': 0.7, 'colsample_bylevel': 0.9, 'reg_alpha': 1.6107358116820937e-05, 'reg_lambda': 25.797656070101606, 'gamma': 0.014066072663468033}. Best is trial 121 with value: -0.4718193564368632.
[I 2026-07-14 21:08:57,862] Trial 131 finished with value: -0.35283400407395094 and parameters: {'scalers': 'robust', 'ratios': 'norm_ratio', 'imputers': 'median', 'n_estimators': 1750, 'learning_rate': 0.1995156987780403, 'max_depth': 11, 'min_child_weight': 1, 'subsample': 0.5, 'colsample_bytree': 0.7, 'colsample_bylevel': 0.9, 'reg_alpha': 6.977952625753204e-06, 'reg_lambda': 18.73860220038548, 'gamma': 0.005159899253321302}. Best is trial 121 with value: -0.4718193564368632.
[I 2026-07-14 21:09:16,823] Trial 132 finished with value: -0.38435565039023895 and parameters: {'scalers': 'robust', 'ratios': 'norm_ratio', 'imputers': 'median', 'n_estimators': 1700, 'learning_rate': 0.21292046054753214, 'max_depth': 11, 'min_child_weight': 1, 'subsample': 0.5, 'colsample_bytree': 0.7, 'colsample_bylevel': 0.9, 'reg_alpha': 0.0010158343020411375, 'reg_lambda': 27.95957860671584, 'gamma': 0.0012564040191444896}. Best is trial 121 with value: -0.4718193564368632.
[I 2026-07-14 21:09:34,449] Trial 133 finished with value: -0.3675803099234411 and parameters: {'scalers': 'robust', 'ratios': 'norm_ratio', 'imputers': 'median', 'n_estimators': 1650, 'learning_rate': 0.2040212131342407, 'max_depth': 11, 'min_child_weight': 1, 'subsample': 0.5, 'colsample_bytree': 0.7, 'colsample_bylevel': 0.9, 'reg_alpha': 0.0008951609982027652, 'reg_lambda': 33.69545609723392, 'gamma': 0.0049885996819242695}. Best is trial 121 with value: -0.4718193564368632.
[I 2026-07-14 21:09:53,603] Trial 135 finished with value: -0.05265545175276509 and parameters: {'scalers': 'robust', 'ratios': 'norm_ratio', 'imputers': 'median', 'n_estimators': 1600, 'learning_rate': 0.31926548326080917, 'max_depth': 11, 'min_child_weight': 1, 'subsample': 0.5, 'colsample_bytree': 0.7, 'colsample_bylevel': 0.9, 'reg_alpha': 25.651396883673335, 'reg_lambda': 65.97562824303292, 'gamma': 0.004740021034747744}. Best is trial 121 with value: -0.4718193564368632.
