[I 2026-07-14 17:04:04,772] Trial 135 finished with value: -0.25679646476697865 and parameters: {'scalers': 'standard', 'ratios': 'norm_ratio', 'imputers': 'none', 'n_estimators': 2750, 'learning_rate': 0.18752121551215079, 'max_depth': 5, 'min_child_weight': 2, 'subsample': 0.5, 'colsample_bytree': 0.9, 'colsample_bylevel': 0.9, 'reg_alpha': 5.74680466959477e-06, 'reg_lambda': 17.63850117676266, 'gamma': 0.0013872271409933181}. Best is trial 94 with value: -0.4043228525685773.
[I 2026-07-14 17:04:25,036] Trial 136 finished with value: -0.2503722649901561 and parameters: {'scalers': 'standard', 'ratios': 'norm_ratio', 'imputers': 'none', 'n_estimators': 2700, 'learning_rate': 0.19917995312882622, 'max_depth': 5, 'min_child_weight': 2, 'subsample': 0.5, 'colsample_bytree': 0.9, 'colsample_bylevel': 0.9, 'reg_alpha': 6.727922464766075e-06, 'reg_lambda': 91.99985678434761, 'gamma': 0.0007608462691581545}. Best is trial 94 with value: -0.4043228525685773.
[I 2026-07-14 17:04:45,442] Trial 137 finished with value: -0.1707593578408598 and parameters: {'scalers': 'standard', 'ratios': 'norm_ratio', 'imputers': 'none', 'n_estimators': 2750, 'learning_rate': 0.0026155914252069235, 'max_depth': 5, 'min_child_weight': 2, 'subsample': 0.5, 'colsample_bytree': 0.9, 'colsample_bylevel': 0.9, 'reg_alpha': 7.722891874575881e-06, 'reg_lambda': 99.17542065871994, 'gamma': 0.0005494478899146663}. Best is trial 94 with value: -0.4043228525685773.
[I 2026-07-14 17:05:04,179] Trial 138 finished with value: -0.2524886224446348 and parameters: {'scalers': 'standard', 'ratios': 'norm_ratio', 'imputers': 'none', 'n_estimators': 2750, 'learning_rate': 0.18499425684222706, 'max_depth': 5, 'min_child_weight': 2, 'subsample': 0.5, 'colsample_bytree': 0.9, 'colsample_bylevel': 0.9, 'reg_alpha': 6.577331266230668e-06, 'reg_lambda': 16.14132825446599, 'gamma': 0.0004883738193190067}. Best is trial 94 with value: -0.4043228525685773.
[I 2026-07-14 17:05:21,530] Trial 139 finished with value: -0.2515883297564914 and parameters: {'scalers': 'standard', 'ratios': 'norm_ratio', 'imputers': 'none', 'n_estimators': 2500, 'learning_rate': 0.19680897364511707, 'max_depth': 5, 'min_child_weight': 2, 'subsample': 0.5, 'colsample_bytree': 0.9, 'colsample_bylevel': 0.9, 'reg_alpha': 9.937033318039632e-05, 'reg_lambda': 17.51746641760474, 'gamma': 0.0009076083363117921}. Best is trial 94 with value: -0.4043228525685773.
[I 2026-07-14 17:05:39,604] Trial 140 finished with value: -0.3121289234111791 and parameters: {'scalers': 'standard', 'ratios': 'norm_ratio', 'imputers': 'none', 'n_estimators': 2500, 'learning_rate': 0.378147008077002, 'max_depth': 5, 'min_child_weight': 2, 'subsample': 0.5, 'colsample_bytree': 0.9, 'colsample_bylevel': 0.9, 'reg_alpha': 9.201768793295067e-05, 'reg_lambda': 20.470481920132976, 'gamma': 0.0008690711334291972}. Best is trial 94 with value: -0.4043228525685773.
[I 2026-07-14 17:06:06,788] Trial 141 finished with value: -0.40008313362367254 and parameters: {'scalers': 'standard', 'ratios': 'norm_ratio', 'imputers': 'none', 'n_estimators': 2650, 'learning_rate': 0.36011047276940156, 'max_depth': 6, 'min_child_weight': 1, 'subsample': 0.5, 'colsample_bytree': 0.9, 'colsample_bylevel': 0.9, 'reg_alpha': 0.00010117853843596404, 'reg_lambda': 17.077763428197525, 'gamma': 0.0004667910837037833}. Best is trial 94 with value: -0.4043228525685773.
[I 2026-07-14 17:06:25,630] Trial 142 finished with value: -0.34045788139078775 and parameters: {'scalers': 'standard', 'ratios': 'norm_ratio', 'imputers': 'none', 'n_estimators': 2550, 'learning_rate': 0.36473380734662764, 'max_depth': 5, 'min_child_weight': 1, 'subsample': 0.5, 'colsample_bytree': 0.9, 'colsample_bylevel': 0.9, 'reg_alpha': 4.3167779226195776e-06, 'reg_lambda': 17.962791784830348, 'gamma': 0.0004889346735912173}. Best is trial 94 with value: -0.4043228525685773.
[I 2026-07-14 17:06:46,857] Trial 143 finished with value: -0.3242530230374112 and parameters: {'scalers': 'robust', 'ratios': 'norm_ratio', 'imputers': 'none', 'n_estimators': 2650, 'learning_rate': 0.35891022801784617, 'max_depth': 5, 'min_child_weight': 1, 'subsample': 0.5, 'colsample_bytree': 0.9, 'colsample_bylevel': 0.9, 'reg_alpha': 3.3349482910934116e-06, 'reg_lambda': 96.50053055254061, 'gamma': 0.00011481845492148411}. Best is trial 94 with value: -0.4043228525685773.
[I 2026-07-14 17:07:13,244] Trial 144 finished with value: -0.40026173088116174 and parameters: {'scalers': 'robust', 'ratios': 'norm_ratio', 'imputers': 'none', 'n_estimators': 2550, 'learning_rate': 0.35766270254891863, 'max_depth': 6, 'min_child_weight': 1, 'subsample': 0.5, 'colsample_bytree': 0.9, 'colsample_bylevel': 0.9, 'reg_alpha': 3.4949790130932003e-06, 'reg_lambda': 18.015169017788907, 'gamma': 0.004116241069565417}. Best is trial 94 with value: -0.4043228525685773.
[I 2026-07-14 17:07:35,465] Trial 145 finished with value: -0.40134382483402276 and parameters: {'scalers': 'robust', 'ratios': 'norm_ratio', 'imputers': 'none', 'n_estimators': 2500, 'learning_rate': 0.3598876883539733, 'max_depth': 6, 'min_child_weight': 1, 'subsample': 0.5, 'colsample_bytree': 0.9, 'colsample_bylevel': 0.7, 'reg_alpha': 3.200804815428537e-06, 'reg_lambda': 19.830515211000137, 'gamma': 0.00037272982784829987}. Best is trial 94 with value: -0.4043228525685773.
[I 2026-07-14 17:08:06,608] Trial 146 finished with value: -0.40983830841550917 and parameters: {'scalers': 'robust', 'ratios': 'norm_ratio', 'imputers': 'none', 'n_estimators': 2550, 'learning_rate': 0.378318073388321, 'max_depth': 6, 'min_child_weight': 1, 'subsample': 0.5, 'colsample_bytree': 1.0, 'colsample_bylevel': 0.9, 'reg_alpha': 3.751964120203212e-06, 'reg_lambda': 36.59958373291483, 'gamma': 0.0001599419239294017}. Best is trial 146 with value: -0.40983830841550917.
[I 2026-07-14 17:08:30,835] Trial 147 finished with value: -0.38784089323293336 and parameters: {'scalers': 'robust', 'ratios': 'norm_ratio', 'imputers': 'none', 'n_estimators': 2400, 'learning_rate': 0.3532933181924313, 'max_depth': 6, 'min_child_weight': 1, 'subsample': 0.5, 'colsample_bytree': 1.0, 'colsample_bylevel': 0.7, 'reg_alpha': 2.6338874804020025e-06, 'reg_lambda': 37.030025346541336, 'gamma': 0.00010429491411748504}. Best is trial 146 with value: -0.40983830841550917.
[I 2026-07-14 17:08:56,380] Trial 148 finished with value: -0.40346286702858464 and parameters: {'scalers': 'robust', 'ratios': 'norm_ratio', 'imputers': 'none', 'n_estimators': 2350, 'learning_rate': 0.3647571169895886, 'max_depth': 6, 'min_child_weight': 1, 'subsample': 0.5, 'colsample_bytree': 0.9, 'colsample_bylevel': 0.9, 'reg_alpha': 3.4202750481456988e-06, 'reg_lambda': 36.39610780715797, 'gamma': 0.00021847383652518902}. Best is trial 146 with value: -0.40983830841550917.
[I 2026-07-14 17:09:21,822] Trial 149 finished with value: -0.4023082928071977 and parameters: {'scalers': 'robust', 'ratios': 'norm_ratio', 'imputers': 'none', 'n_estimators': 2350, 'learning_rate': 0.3599476473319258, 'max_depth': 6, 'min_child_weight': 1, 'subsample': 0.5, 'colsample_bytree': 0.9, 'colsample_bylevel': 0.9, 'reg_alpha': 4.112518101467895e-06, 'reg_lambda': 37.48312955958601, 'gamma': 0.00026958828203924636}. Best is trial 146 with value: -0.40983830841550917.
[I 2026-07-14 17:09:50,195] Trial 150 finished with value: -0.4093483379260792 and parameters: {'scalers': 'robust', 'ratios': 'norm_ratio', 'imputers': 'none', 'n_estimators': 2600, 'learning_rate': 0.35574041426167136, 'max_depth': 6, 'min_child_weight': 1, 'subsample': 0.5, 'colsample_bytree': 0.9, 'colsample_bylevel': 0.9, 'reg_alpha': 3.775871219223203e-06, 'reg_lambda': 40.87451348417533, 'gamma': 0.00011716397973613361}. Best is trial 146 with value: -0.40983830841550917.
[I 2026-07-14 17:10:16,141] Trial 151 finished with value: -0.3929947847851804 and parameters: {'scalers': 'robust', 'ratios': 'norm_ratio', 'imputers': 'none', 'n_estimators': 2350, 'learning_rate': 0.353359840412123, 'max_depth': 6, 'min_child_weight': 1, 'subsample': 0.5, 'colsample_bytree': 0.9, 'colsample_bylevel': 0.9, 'reg_alpha': 3.1297421442374914e-06, 'reg_lambda': 38.61248638850959, 'gamma': 0.00011422481179250846}. Best is trial 146 with value: -0.40983830841550917.
[I 2026-07-14 17:10:42,151] Trial 152 finished with value: -0.4779243553976021 and parameters: {'scalers': 'robust', 'ratios': 'norm_ratio', 'imputers': 'none', 'n_estimators': 2600, 'learning_rate': 0.48683736103380715, 'max_depth': 6, 'min_child_weight': 1, 'subsample': 0.5, 'colsample_bytree': 0.9, 'colsample_bylevel': 0.9, 'reg_alpha': 0.00013492271401804428, 'reg_lambda': 12.723809895289197, 'gamma': 8.33141357178049e-05}. Best is trial 152 with value: -0.4779243553976021.
[I 2026-07-14 17:11:05,891] Trial 153 finished with value: -0.38229064018582115 and parameters: {'scalers': 'robust', 'ratios': 'norm_ratio', 'imputers': 'none', 'n_estimators': 2350, 'learning_rate': 0.34591555725711864, 'max_depth': 6, 'min_child_weight': 1, 'subsample': 0.5, 'colsample_bytree': 0.9, 'colsample_bylevel': 0.9, 'reg_alpha': 3.7583035699567997e-06, 'reg_lambda': 15.19497270636056, 'gamma': 0.00021112737082428455}. Best is trial 152 with value: -0.4779243553976021.
[I 2026-07-14 17:11:31,397] Trial 154 finished with value: -0.49260619238654996 and parameters: {'scalers': 'robust', 'ratios': 'norm_ratio', 'imputers': 'none', 'n_estimators': 2350, 'learning_rate': 0.4985698505008457, 'max_depth': 6, 'min_child_weight': 1, 'subsample': 0.5, 'colsample_bytree': 0.9, 'colsample_bylevel': 0.9, 'reg_alpha': 0.6552583081761286, 'reg_lambda': 11.556762695666867, 'gamma': 0.000585644035446522}. Best is trial 154 with value: -0.49260619238654996.
[I 2026-07-14 17:11:59,753] Trial 155 finished with value: -0.3875454986946312 and parameters: {'scalers': 'robust', 'ratios': 'norm_ratio', 'imputers': 'none', 'n_estimators': 2600, 'learning_rate': 0.347182222462302, 'max_depth': 6, 'min_child_weight': 1, 'subsample': 0.5, 'colsample_bytree': 1.0, 'colsample_bylevel': 0.9, 'reg_alpha': 3.962985701836725e-06, 'reg_lambda': 11.484412574873812, 'gamma': 7.330934800422334e-05}. Best is trial 154 with value: -0.49260619238654996.
[I 2026-07-14 17:12:26,595] Trial 156 finished with value: -0.45935076118634594 and parameters: {'scalers': 'robust', 'ratios': 'norm_ratio', 'imputers': 'none', 'n_estimators': 2400, 'learning_rate': 0.48582873757504724, 'max_depth': 6, 'min_child_weight': 1, 'subsample': 0.5, 'colsample_bytree': 1.0, 'colsample_bylevel': 0.9, 'reg_alpha': 3.239918285183526e-06, 'reg_lambda': 11.98508056863863, 'gamma': 6.868093117861311e-05}. Best is trial 154 with value: -0.49260619238654996.
[I 2026-07-14 17:12:53,554] Trial 157 finished with value: -0.26002965542892176 and parameters: {'scalers': 'robust', 'ratios': 'norm_ratio', 'imputers': 'none', 'n_estimators': 2600, 'learning_rate': 0.4994559268037719, 'max_depth': 6, 'min_child_weight': 1, 'subsample': 1.0, 'colsample_bytree': 1.0, 'colsample_bylevel': 0.9, 'reg_alpha': 3.727767121931772e-06, 'reg_lambda': 13.107076840233873, 'gamma': 6.132278834201144e-05}. Best is trial 154 with value: -0.49260619238654996.
[I 2026-07-14 17:13:19,140] Trial 158 finished with value: -0.37328039054724904 and parameters: {'scalers': 'robust', 'ratios': 'norm_ratio', 'imputers': 'none', 'n_estimators': 2350, 'learning_rate': 0.34631707939502965, 'max_depth': 6, 'min_child_weight': 1, 'subsample': 0.5, 'colsample_bytree': 1.0, 'colsample_bylevel': 0.9, 'reg_alpha': 3.6985671590351057e-06, 'reg_lambda': 12.691207670040516, 'gamma': 8.282714078678888e-05}. Best is trial 154 with value: -0.49260619238654996.
[I 2026-07-14 17:13:45,360] Trial 159 finished with value: -0.375266597266256 and parameters: {'scalers': 'robust', 'ratios': 'norm_ratio', 'imputers': 'none', 'n_estimators': 2350, 'learning_rate': 0.3389182321024232, 'max_depth': 6, 'min_child_weight': 1, 'subsample': 0.5, 'colsample_bytree': 1.0, 'colsample_bylevel': 0.9, 'reg_alpha': 3.842951953654998e-06, 'reg_lambda': 13.654602194053696, 'gamma': 7.721178717191392e-05}. Best is trial 154 with value: -0.49260619238654996.
[I 2026-07-14 17:14:13,580] Trial 160 finished with value: -0.3743811956539017 and parameters: {'scalers': 'robust', 'ratios': 'norm_ratio', 'imputers': 'none', 'n_estimators': 2350, 'learning_rate': 0.3177380535426872, 'max_depth': 6, 'min_child_weight': 1, 'subsample': 0.5, 'colsample_bytree': 1.0, 'colsample_bylevel': 0.9, 'reg_alpha': 4.246476145345036e-06, 'reg_lambda': 33.29192632351209, 'gamma': 2.5598305147890962e-05}. Best is trial 154 with value: -0.49260619238654996.
[I 2026-07-14 17:14:39,573] Trial 161 finished with value: -0.3734556744831617 and parameters: {'scalers': 'robust', 'ratios': 'norm_ratio', 'imputers': 'none', 'n_estimators': 2350, 'learning_rate': 0.32964088391489693, 'max_depth': 6, 'min_child_weight': 1, 'subsample': 0.5, 'colsample_bytree': 1.0, 'colsample_bylevel': 0.9, 'reg_alpha': 4.064171481510291e-06, 'reg_lambda': 13.181935843652749, 'gamma': 2.525160950776726e-05}. Best is trial 154 with value: -0.49260619238654996.
[I 2026-07-14 17:14:53,554] Trial 162 finished with value: -0.17597941741842452 and parameters: {'scalers': 'robust', 'ratios': 'norm_ratio', 'imputers': 'none', 'n_estimators': 2350, 'learning_rate': 0.32812706568069494, 'max_depth': 6, 'min_child_weight': 1, 'subsample': 1.0, 'colsample_bytree': 1.0, 'colsample_bylevel': 0.9, 'reg_alpha': 8.592653452227857, 'reg_lambda': 12.996129353535427, 'gamma': 3.891154332060588e-05}. Best is trial 154 with value: -0.49260619238654996.
[I 2026-07-14 17:15:19,448] Trial 163 finished with value: -0.3639358459273609 and parameters: {'scalers': 'robust', 'ratios': 'norm_ratio', 'imputers': 'none', 'n_estimators': 2350, 'learning_rate': 0.33203239729308076, 'max_depth': 6, 'min_child_weight': 1, 'subsample': 0.5, 'colsample_bytree': 1.0, 'colsample_bylevel': 0.9, 'reg_alpha': 2.8676229672300794e-06, 'reg_lambda': 12.279606873513016, 'gamma': 3.337593716670448e-05}. Best is trial 154 with value: -0.49260619238654996.
[I 2026-07-14 17:15:38,731] Trial 164 finished with value: -0.21779938548407168 and parameters: {'scalers': 'robust', 'ratios': 'norm_ratio', 'imputers': 'none', 'n_estimators': 2350, 'learning_rate': 0.3434109454050569, 'max_depth': 6, 'min_child_weight': 1, 'subsample': 0.5, 'colsample_bytree': 1.0, 'colsample_bylevel': 0.9, 'reg_alpha': 6.838230424755522, 'reg_lambda': 13.001347417356826, 'gamma': 3.0550103831623865e-05}. Best is trial 154 with value: -0.49260619238654996.
[I 2026-07-14 17:16:02,768] Trial 165 finished with value: -0.3423057247786277 and parameters: {'scalers': 'robust', 'ratios': 'norm_ratio', 'imputers': 'none', 'n_estimators': 2350, 'learning_rate': 0.32391368931009973, 'max_depth': 6, 'min_child_weight': 1, 'subsample': 0.5, 'colsample_bytree': 1.0, 'colsample_bylevel': 0.9, 'reg_alpha': 2.444575704671226e-06, 'reg_lambda': 6.811002873972435, 'gamma': 0.00024693096988741216}. Best is trial 154 with value: -0.49260619238654996.
[I 2026-07-14 17:16:27,125] Trial 166 finished with value: -0.34726881682364114 and parameters: {'scalers': 'robust', 'ratios': 'norm_ratio', 'imputers': 'none', 'n_estimators': 2350, 'learning_rate': 0.3372719005568685, 'max_depth': 6, 'min_child_weight': 1, 'subsample': 0.5, 'colsample_bytree': 1.0, 'colsample_bylevel': 0.9, 'reg_alpha': 2.8587730794808033e-06, 'reg_lambda': 7.328967772593146, 'gamma': 3.440558731047877e-05}. Best is trial 154 with value: -0.49260619238654996.
[I 2026-07-14 17:16:50,911] Trial 167 finished with value: -0.342723816476214 and parameters: {'scalers': 'robust', 'ratios': 'norm_ratio', 'imputers': 'none', 'n_estimators': 2350, 'learning_rate': 0.3341452406572261, 'max_depth': 6, 'min_child_weight': 1, 'subsample': 0.5, 'colsample_bytree': 1.0, 'colsample_bylevel': 0.9, 'reg_alpha': 2.5878257077742586e-06, 'reg_lambda': 6.528691196300885, 'gamma': 3.055136265009974e-05}. Best is trial 154 with value: -0.49260619238654996.
[I 2026-07-14 17:17:15,044] Trial 168 finished with value: -0.3369406213973204 and parameters: {'scalers': 'robust', 'ratios': 'norm_ratio', 'imputers': 'none', 'n_estimators': 2350, 'learning_rate': 0.31740150013476, 'max_depth': 6, 'min_child_weight': 1, 'subsample': 0.5, 'colsample_bytree': 1.0, 'colsample_bylevel': 0.9, 'reg_alpha': 2.8390673561853103e-06, 'reg_lambda': 7.292150452074724, 'gamma': 3.1434478746970043e-05}. Best is trial 154 with value: -0.49260619238654996.
[I 2026-07-14 17:17:39,853] Trial 169 finished with value: -0.20711275446998706 and parameters: {'scalers': 'robust', 'ratios': 'norm_ratio', 'imputers': 'none', 'n_estimators': 2300, 'learning_rate': 0.00010175377716480285, 'max_depth': 6, 'min_child_weight': 1, 'subsample': 0.5, 'colsample_bytree': 1.0, 'colsample_bylevel': 0.9, 'reg_alpha': 2.5936426890710137e-06, 'reg_lambda': 7.305368153199347, 'gamma': 0.0002458900303131301}. Best is trial 154 with value: -0.49260619238654996.
[I 2026-07-14 17:18:03,211] Trial 170 finished with value: -0.3120554899694136 and parameters: {'scalers': 'robust', 'ratios': 'norm_ratio', 'imputers': 'none', 'n_estimators': 2250, 'learning_rate': 0.24861389461358896, 'max_depth': 6, 'min_child_weight': 1, 'subsample': 0.5, 'colsample_bytree': 1.0, 'colsample_bylevel': 0.9, 'reg_alpha': 1.0984001707527745e-05, 'reg_lambda': 7.939490643703778, 'gamma': 0.0002578691176147542}. Best is trial 154 with value: -0.49260619238654996.
[I 2026-07-14 17:18:27,294] Trial 171 finished with value: -0.431314544135254 and parameters: {'scalers': 'robust', 'ratios': 'norm_ratio', 'imputers': 'none', 'n_estimators': 2250, 'learning_rate': 0.49885171894777086, 'max_depth': 6, 'min_child_weight': 1, 'subsample': 0.5, 'colsample_bytree': 1.0, 'colsample_bylevel': 0.9, 'reg_alpha': 1.2467661769301068e-05, 'reg_lambda': 7.963044859648323, 'gamma': 0.0002136241763985848}. Best is trial 154 with value: -0.49260619238654996.
[I 2026-07-14 17:18:52,408] Trial 172 finished with value: -0.31766469320700597 and parameters: {'scalers': 'robust', 'ratios': 'norm_ratio', 'imputers': 'none', 'n_estimators': 2450, 'learning_rate': 0.2533756626511817, 'max_depth': 6, 'min_child_weight': 1, 'subsample': 0.5, 'colsample_bytree': 1.0, 'colsample_bylevel': 0.9, 'reg_alpha': 2.757983640118155e-06, 'reg_lambda': 7.791894586206824, 'gamma': 0.0002626992171634373}. Best is trial 154 with value: -0.49260619238654996.
[I 2026-07-14 17:19:15,574] Trial 173 finished with value: -0.31301556947392645 and parameters: {'scalers': 'robust', 'ratios': 'norm_ratio', 'imputers': 'none', 'n_estimators': 2250, 'learning_rate': 0.24838393694335298, 'max_depth': 6, 'min_child_weight': 1, 'subsample': 0.5, 'colsample_bytree': 1.0, 'colsample_bylevel': 0.9, 'reg_alpha': 1.1927942365929742e-05, 'reg_lambda': 7.869478123688072, 'gamma': 0.0001668616191873683}. Best is trial 154 with value: -0.49260619238654996.
[I 2026-07-14 17:19:41,948] Trial 174 finished with value: -0.4237050228434138 and parameters: {'scalers': 'robust', 'ratios': 'norm_ratio', 'imputers': 'none', 'n_estimators': 2250, 'learning_rate': 0.4960399500162852, 'max_depth': 6, 'min_child_weight': 1, 'subsample': 0.5, 'colsample_bytree': 1.0, 'colsample_bylevel': 1.0, 'reg_alpha': 1.0971306456263266e-05, 'reg_lambda': 8.403614948505027, 'gamma': 0.00017214468079101804}. Best is trial 154 with value: -0.49260619238654996.
[I 2026-07-14 17:20:10,982] Trial 175 finished with value: -0.32425384991070294 and parameters: {'scalers': 'robust', 'ratios': 'norm_ratio', 'imputers': 'none', 'n_estimators': 2250, 'learning_rate': 0.24451196395808406, 'max_depth': 6, 'min_child_weight': 1, 'subsample': 0.5, 'colsample_bytree': 1.0, 'colsample_bylevel': 1.0, 'reg_alpha': 1.1081108637986801e-05, 'reg_lambda': 32.35733630945218, 'gamma': 0.00018221765213238697}. Best is trial 154 with value: -0.49260619238654996.
[I 2026-07-14 17:20:37,660] Trial 176 finished with value: -0.33461367186838 and parameters: {'scalers': 'robust', 'ratios': 'norm_ratio', 'imputers': 'none', 'n_estimators': 2250, 'learning_rate': 0.24426740559694057, 'max_depth': 6, 'min_child_weight': 1, 'subsample': 0.5, 'colsample_bytree': 1.0, 'colsample_bylevel': 0.9, 'reg_alpha': 9.731595228148499e-06, 'reg_lambda': 35.68663546743678, 'gamma': 0.00016720646931431819}. Best is trial 154 with value: -0.49260619238654996.
[I 2026-07-14 17:21:09,325] Trial 177 finished with value: -0.33521776744778714 and parameters: {'scalers': 'robust', 'ratios': 'norm_ratio', 'imputers': 'none', 'n_estimators': 2450, 'learning_rate': 0.24383434325327627, 'max_depth': 6, 'min_child_weight': 1, 'subsample': 0.5, 'colsample_bytree': 1.0, 'colsample_bylevel': 1.0, 'reg_alpha': 9.782317359412672e-06, 'reg_lambda': 32.89426817887019, 'gamma': 0.00015641294595682812}. Best is trial 154 with value: -0.49260619238654996.
[I 2026-07-14 17:21:37,543] Trial 178 finished with value: -0.3469603840615368 and parameters: {'scalers': 'robust', 'ratios': 'norm_ratio', 'imputers': 'none', 'n_estimators': 2450, 'learning_rate': 0.2520567892021422, 'max_depth': 6, 'min_child_weight': 1, 'subsample': 0.5, 'colsample_bytree': 1.0, 'colsample_bylevel': 0.9, 'reg_alpha': 4.5698722218323945e-06, 'reg_lambda': 21.526356094751044, 'gamma': 0.00014932629038821334}. Best is trial 154 with value: -0.49260619238654996.
[I 2026-07-14 17:22:10,812] Trial 179 finished with value: -0.5206198287115775 and parameters: {'scalers': 'robust', 'ratios': 'norm_ratio', 'imputers': 'none', 'n_estimators': 2450, 'learning_rate': 0.4975079108741484, 'max_depth': 6, 'min_child_weight': 1, 'subsample': 0.5, 'colsample_bytree': 1.0, 'colsample_bylevel': 1.0, 'reg_alpha': 4.788657956969116e-06, 'reg_lambda': 33.812313725321765, 'gamma': 0.00015883783601308252}. Best is trial 179 with value: -0.5206198287115775.
