[I 2026-07-14 21:45:25,791] Trial 135 finished with value: -0.24273774663444198 and parameters: {'scalers': 'standard', 'ratios': 'log_ratio', 'imputers': 'none', 'n_estimators': 1200, 'learning_rate': 0.004045768341340058, 'max_depth': 10, 'min_child_weight': 2, 'subsample': 0.9, 'colsample_bytree': 0.6, 'colsample_bylevel': 0.7, 'reg_alpha': 1.8363793373794202, 'reg_lambda': 0.01571337244680789, 'gamma': 0.03922426297040498}. Best is trial 110 with value: -1.5018578568346757.
[I 2026-07-14 21:45:37,323] Trial 136 finished with value: -0.8040468703920636 and parameters: {'scalers': 'none', 'ratios': 'norm_ratio', 'imputers': 'none', 'n_estimators': 1250, 'learning_rate': 0.32719011280998506, 'max_depth': 10, 'min_child_weight': 2, 'subsample': 0.9, 'colsample_bytree': 0.6, 'colsample_bylevel': 1.0, 'reg_alpha': 0.3430709301712359, 'reg_lambda': 0.011255056278484152, 'gamma': 2.2925295210580733e-06}. Best is trial 110 with value: -1.5018578568346757.
[I 2026-07-14 21:45:43,375] Trial 137 finished with value: -0.6950797728195512 and parameters: {'scalers': 'none', 'ratios': 'norm_ratio', 'imputers': 'none', 'n_estimators': 1200, 'learning_rate': 0.32059835051625324, 'max_depth': 10, 'min_child_weight': 2, 'subsample': 0.9, 'colsample_bytree': 0.6, 'colsample_bylevel': 0.7, 'reg_alpha': 0.37386155364448753, 'reg_lambda': 0.08052017332445184, 'gamma': 0.08262054982359553}. Best is trial 110 with value: -1.5018578568346757.
[I 2026-07-14 21:45:50,476] Trial 138 finished with value: -0.6362391153762574 and parameters: {'scalers': 'standard', 'ratios': 'log_ratio', 'imputers': 'none', 'n_estimators': 1300, 'learning_rate': 0.3062711365983766, 'max_depth': 10, 'min_child_weight': 2, 'subsample': 0.9, 'colsample_bytree': 0.6, 'colsample_bylevel': 0.7, 'reg_alpha': 1.7023099479752032e-06, 'reg_lambda': 0.0020371892946183657, 'gamma': 2.2706222655731704e-06}. Best is trial 110 with value: -1.5018578568346757.
[I 2026-07-14 21:45:53,099] Trial 139 finished with value: -0.4571612332497369 and parameters: {'scalers': 'none', 'ratios': 'log_ratio', 'imputers': 'none', 'n_estimators': 1150, 'learning_rate': 0.2596301466847029, 'max_depth': 10, 'min_child_weight': 2, 'subsample': 0.9, 'colsample_bytree': 0.6, 'colsample_bylevel': 0.7, 'reg_alpha': 1.4418242384740907, 'reg_lambda': 0.014227274201064226, 'gamma': 0.06692285820237474}. Best is trial 110 with value: -1.5018578568346757.
[I 2026-07-14 21:46:05,185] Trial 140 finished with value: -0.6636085673680125 and parameters: {'scalers': 'none', 'ratios': 'log_ratio', 'imputers': 'none', 'n_estimators': 2200, 'learning_rate': 0.25571477267036125, 'max_depth': 10, 'min_child_weight': 2, 'subsample': 0.9, 'colsample_bytree': 0.6, 'colsample_bylevel': 0.7, 'reg_alpha': 1.7409486137974555e-06, 'reg_lambda': 0.002420197717003499, 'gamma': 0.005841285503537618}. Best is trial 110 with value: -1.5018578568346757.
[I 2026-07-14 21:46:22,092] Trial 141 finished with value: -1.3790936779484944 and parameters: {'scalers': 'none', 'ratios': 'norm_ratio', 'imputers': 'none', 'n_estimators': 2250, 'learning_rate': 0.25550661580797734, 'max_depth': 10, 'min_child_weight': 1, 'subsample': 0.9, 'colsample_bytree': 0.6, 'colsample_bylevel': 0.7, 'reg_alpha': 1.7546429576799092, 'reg_lambda': 0.003364160476586824, 'gamma': 0.005515256637689985}. Best is trial 110 with value: -1.5018578568346757.
[I 2026-07-14 21:46:34,375] Trial 142 finished with value: -1.1382957733142023 and parameters: {'scalers': 'none', 'ratios': 'norm_ratio', 'imputers': 'none', 'n_estimators': 1100, 'learning_rate': 0.20858509128883554, 'max_depth': 10, 'min_child_weight': 1, 'subsample': 0.9, 'colsample_bytree': 0.6, 'colsample_bylevel': 0.7, 'reg_alpha': 1.3429910501548636, 'reg_lambda': 0.0018933559722154989, 'gamma': 2.2947687451006894e-06}. Best is trial 110 with value: -1.5018578568346757.
[I 2026-07-14 21:46:42,095] Trial 143 finished with value: -0.6136985397361665 and parameters: {'scalers': 'none', 'ratios': 'norm_ratio', 'imputers': 'none', 'n_estimators': 2300, 'learning_rate': 0.258353170694079, 'max_depth': 8, 'min_child_weight': 1, 'subsample': 0.9, 'colsample_bytree': 0.6, 'colsample_bylevel': 0.7, 'reg_alpha': 1.6704138759307913e-06, 'reg_lambda': 0.0017650752325995874, 'gamma': 2.4228488839274273e-06}. Best is trial 110 with value: -1.5018578568346757.
[I 2026-07-14 21:46:45,214] Trial 144 finished with value: -0.3027378430640314 and parameters: {'scalers': 'none', 'ratios': 'log_ratio', 'imputers': 'mean', 'n_estimators': 2300, 'learning_rate': 0.2613306298879939, 'max_depth': 8, 'min_child_weight': 1, 'subsample': 0.9, 'colsample_bytree': 0.6, 'colsample_bylevel': 0.7, 'reg_alpha': 0.9572314709831785, 'reg_lambda': 0.0021917222518567587, 'gamma': 0.10505862787998922}. Best is trial 110 with value: -1.5018578568346757.
[I 2026-07-14 21:46:59,344] Trial 145 finished with value: -1.1577865239625476 and parameters: {'scalers': 'standard', 'ratios': 'log_ratio', 'imputers': 'none', 'n_estimators': 2300, 'learning_rate': 0.21040746787232997, 'max_depth': 8, 'min_child_weight': 1, 'subsample': 0.9, 'colsample_bytree': 0.6, 'colsample_bylevel': 0.7, 'reg_alpha': 0.9784344731228753, 'reg_lambda': 0.0021092590070804084, 'gamma': 0.028771481936828464}. Best is trial 110 with value: -1.5018578568346757.
[I 2026-07-14 21:47:18,075] Trial 146 finished with value: -1.2435935127699311 and parameters: {'scalers': 'standard', 'ratios': 'log_ratio', 'imputers': 'none', 'n_estimators': 2550, 'learning_rate': 0.20738760041024681, 'max_depth': 8, 'min_child_weight': 1, 'subsample': 0.9, 'colsample_bytree': 0.6, 'colsample_bylevel': 0.7, 'reg_alpha': 0.9824214002785929, 'reg_lambda': 0.002910842077170286, 'gamma': 0.004868219397212208}. Best is trial 110 with value: -1.5018578568346757.
[I 2026-07-14 21:47:34,299] Trial 147 finished with value: -1.1823014630863709 and parameters: {'scalers': 'standard', 'ratios': 'log_ratio', 'imputers': 'mean', 'n_estimators': 2200, 'learning_rate': 0.20991198111449993, 'max_depth': 8, 'min_child_weight': 1, 'subsample': 0.9, 'colsample_bytree': 0.6, 'colsample_bylevel': 0.7, 'reg_alpha': 1.0145176188186067, 'reg_lambda': 0.0028207055818029216, 'gamma': 0.005382717675213503}. Best is trial 110 with value: -1.5018578568346757.
[I 2026-07-14 21:47:47,555] Trial 148 finished with value: -0.47317243993328556 and parameters: {'scalers': 'none', 'ratios': 'norm_ratio', 'imputers': 'mean', 'n_estimators': 2300, 'learning_rate': 0.20082996809648757, 'max_depth': 8, 'min_child_weight': 10, 'subsample': 0.9, 'colsample_bytree': 0.6, 'colsample_bylevel': 0.7, 'reg_alpha': 1.1196030342700773, 'reg_lambda': 0.0007272111240674283, 'gamma': 6.723138048596827e-06}. Best is trial 110 with value: -1.5018578568346757.
[I 2026-07-14 21:48:01,012] Trial 149 finished with value: -1.123391844869794 and parameters: {'scalers': 'none', 'ratios': 'norm_ratio', 'imputers': 'none', 'n_estimators': 2300, 'learning_rate': 0.2076133646062804, 'max_depth': 8, 'min_child_weight': 1, 'subsample': 0.9, 'colsample_bytree': 0.6, 'colsample_bylevel': 0.7, 'reg_alpha': 1.162242875152824, 'reg_lambda': 0.0007786869356091437, 'gamma': 0.02869647267232918}. Best is trial 110 with value: -1.5018578568346757.
[I 2026-07-14 21:48:18,274] Trial 150 finished with value: -1.2329662854444203 and parameters: {'scalers': 'none', 'ratios': 'norm_ratio', 'imputers': 'mean', 'n_estimators': 2300, 'learning_rate': 0.21105700229862182, 'max_depth': 8, 'min_child_weight': 1, 'subsample': 0.9, 'colsample_bytree': 0.6, 'colsample_bylevel': 0.7, 'reg_alpha': 1.0962813633195099, 'reg_lambda': 0.0031142400509051225, 'gamma': 0.004019883047865448}. Best is trial 110 with value: -1.5018578568346757.
[I 2026-07-14 21:48:24,582] Trial 151 finished with value: -0.4034579843770246 and parameters: {'scalers': 'none', 'ratios': 'norm_ratio', 'imputers': 'mean', 'n_estimators': 1100, 'learning_rate': 0.1975920873903761, 'max_depth': 8, 'min_child_weight': 10, 'subsample': 0.9, 'colsample_bytree': 0.6, 'colsample_bylevel': 0.7, 'reg_alpha': 1.074840309315715, 'reg_lambda': 0.003749515345045546, 'gamma': 1.0051470492183094e-06}. Best is trial 110 with value: -1.5018578568346757.
[I 2026-07-14 21:48:32,048] Trial 152 finished with value: -0.900118765141391 and parameters: {'scalers': 'none', 'ratios': 'norm_ratio', 'imputers': 'none', 'n_estimators': 1050, 'learning_rate': 0.21191969527911064, 'max_depth': 8, 'min_child_weight': 1, 'subsample': 0.9, 'colsample_bytree': 0.6, 'colsample_bylevel': 0.7, 'reg_alpha': 0.8896080746757278, 'reg_lambda': 0.0008997674952759167, 'gamma': 6.51715927746152e-06}. Best is trial 110 with value: -1.5018578568346757.
[I 2026-07-14 21:48:35,682] Trial 153 finished with value: -0.24585206027105788 and parameters: {'scalers': 'standard', 'ratios': 'norm_ratio', 'imputers': 'none', 'n_estimators': 2550, 'learning_rate': 0.2021212845537956, 'max_depth': 8, 'min_child_weight': 1, 'subsample': 0.9, 'colsample_bytree': 0.6, 'colsample_bylevel': 0.7, 'reg_alpha': 1.0417782171075298, 'reg_lambda': 0.003356332132578724, 'gamma': 12.11189983085381}. Best is trial 110 with value: -1.5018578568346757.
[I 2026-07-14 21:48:48,835] Trial 154 finished with value: -0.4640669373767363 and parameters: {'scalers': 'standard', 'ratios': 'norm_ratio', 'imputers': 'median', 'n_estimators': 2550, 'learning_rate': 0.20208810335145375, 'max_depth': 8, 'min_child_weight': 10, 'subsample': 0.9, 'colsample_bytree': 0.6, 'colsample_bylevel': 0.7, 'reg_alpha': 0.9649755680114173, 'reg_lambda': 0.0008221621645619092, 'gamma': 0.004307653667739663}. Best is trial 110 with value: -1.5018578568346757.
[I 2026-07-14 21:49:07,697] Trial 155 finished with value: -1.212525593584289 and parameters: {'scalers': 'standard', 'ratios': 'norm_ratio', 'imputers': 'mean', 'n_estimators': 2600, 'learning_rate': 0.19469892529900237, 'max_depth': 8, 'min_child_weight': 1, 'subsample': 0.9, 'colsample_bytree': 0.6, 'colsample_bylevel': 0.7, 'reg_alpha': 0.9330491887426718, 'reg_lambda': 0.0008572886776569195, 'gamma': 0.00569458297827286}. Best is trial 110 with value: -1.5018578568346757.
[I 2026-07-14 21:49:10,574] Trial 156 finished with value: -0.24585453955623582 and parameters: {'scalers': 'standard', 'ratios': 'norm_ratio', 'imputers': 'mean', 'n_estimators': 2550, 'learning_rate': 0.1969316244822737, 'max_depth': 8, 'min_child_weight': 1, 'subsample': 0.9, 'colsample_bytree': 0.6, 'colsample_bylevel': 0.7, 'reg_alpha': 36.926139351297564, 'reg_lambda': 0.003220882165943265, 'gamma': 0.003918488634812173}. Best is trial 110 with value: -1.5018578568346757.
[I 2026-07-14 21:49:26,886] Trial 157 finished with value: -1.015609404224405 and parameters: {'scalers': 'none', 'ratios': 'norm_ratio', 'imputers': 'mean', 'n_estimators': 2550, 'learning_rate': 0.1568906984480473, 'max_depth': 8, 'min_child_weight': 1, 'subsample': 0.9, 'colsample_bytree': 0.6, 'colsample_bylevel': 0.7, 'reg_alpha': 0.740177287808509, 'reg_lambda': 0.0010420849064146412, 'gamma': 0.005055472385619892}. Best is trial 110 with value: -1.5018578568346757.
[I 2026-07-14 21:49:44,509] Trial 158 finished with value: -1.1293400534311069 and parameters: {'scalers': 'none', 'ratios': 'norm_ratio', 'imputers': 'mean', 'n_estimators': 2450, 'learning_rate': 0.16198319494377586, 'max_depth': 8, 'min_child_weight': 1, 'subsample': 0.9, 'colsample_bytree': 0.6, 'colsample_bylevel': 0.7, 'reg_alpha': 0.9544956662698265, 'reg_lambda': 0.0033328477647797186, 'gamma': 0.00536728013389475}. Best is trial 110 with value: -1.5018578568346757.
[I 2026-07-14 21:50:00,795] Trial 159 finished with value: -1.0351040957959117 and parameters: {'scalers': 'none', 'ratios': 'norm_ratio', 'imputers': 'mean', 'n_estimators': 2550, 'learning_rate': 0.1630018212135013, 'max_depth': 8, 'min_child_weight': 1, 'subsample': 0.9, 'colsample_bytree': 0.6, 'colsample_bylevel': 0.7, 'reg_alpha': 0.7144804013394903, 'reg_lambda': 0.0010197842795373214, 'gamma': 0.0061106706787649855}. Best is trial 110 with value: -1.5018578568346757.
[I 2026-07-14 21:50:15,131] Trial 160 finished with value: -0.9306197232715676 and parameters: {'scalers': 'none', 'ratios': 'norm_ratio', 'imputers': 'mean', 'n_estimators': 2550, 'learning_rate': 0.16227493384582875, 'max_depth': 8, 'min_child_weight': 1, 'subsample': 0.9, 'colsample_bytree': 0.6, 'colsample_bylevel': 0.7, 'reg_alpha': 1.8604488735354552, 'reg_lambda': 0.003145949189788532, 'gamma': 0.005417649965029653}. Best is trial 110 with value: -1.5018578568346757.
[I 2026-07-14 21:50:29,640] Trial 161 finished with value: -0.9113998600334462 and parameters: {'scalers': 'none', 'ratios': 'norm_ratio', 'imputers': 'mean', 'n_estimators': 2600, 'learning_rate': 0.16148613691332725, 'max_depth': 8, 'min_child_weight': 1, 'subsample': 0.9, 'colsample_bytree': 0.6, 'colsample_bylevel': 0.7, 'reg_alpha': 1.8976234872107016, 'reg_lambda': 0.0012591825010300213, 'gamma': 0.004538450869891284}. Best is trial 110 with value: -1.5018578568346757.
[I 2026-07-14 21:50:42,330] Trial 162 finished with value: -0.8070039610094519 and parameters: {'scalers': 'none', 'ratios': 'norm_ratio', 'imputers': 'mean', 'n_estimators': 2450, 'learning_rate': 0.1566423907697483, 'max_depth': 8, 'min_child_weight': 1, 'subsample': 0.9, 'colsample_bytree': 0.6, 'colsample_bylevel': 0.7, 'reg_alpha': 2.043668558153797, 'reg_lambda': 0.0014568807634828959, 'gamma': 0.006619041405277943}. Best is trial 110 with value: -1.5018578568346757.
[I 2026-07-14 21:50:54,562] Trial 163 finished with value: -0.7124257761282241 and parameters: {'scalers': 'none', 'ratios': 'norm_ratio', 'imputers': 'mean', 'n_estimators': 2400, 'learning_rate': 0.15937080969123754, 'max_depth': 8, 'min_child_weight': 1, 'subsample': 1.0, 'colsample_bytree': 0.6, 'colsample_bylevel': 0.7, 'reg_alpha': 2.044030055110641, 'reg_lambda': 0.0011128494573491691, 'gamma': 0.005981786991763005}. Best is trial 110 with value: -1.5018578568346757.
[I 2026-07-14 21:51:06,128] Trial 164 finished with value: -0.69850301750248 and parameters: {'scalers': 'none', 'ratios': 'norm_ratio', 'imputers': 'mean', 'n_estimators': 2450, 'learning_rate': 0.15798439707809844, 'max_depth': 8, 'min_child_weight': 1, 'subsample': 1.0, 'colsample_bytree': 0.6, 'colsample_bylevel': 0.7, 'reg_alpha': 2.0547218166739167, 'reg_lambda': 0.008023647242537409, 'gamma': 0.006271743666413487}. Best is trial 110 with value: -1.5018578568346757.
[I 2026-07-14 21:51:18,761] Trial 165 finished with value: -0.7454022841967088 and parameters: {'scalers': 'none', 'ratios': 'norm_ratio', 'imputers': 'mean', 'n_estimators': 2450, 'learning_rate': 0.16126562691553395, 'max_depth': 8, 'min_child_weight': 1, 'subsample': 1.0, 'colsample_bytree': 0.6, 'colsample_bylevel': 0.7, 'reg_alpha': 2.0375808600271013, 'reg_lambda': 0.0012360521211200574, 'gamma': 0.0011337374330308806}. Best is trial 110 with value: -1.5018578568346757.
[I 2026-07-14 21:51:31,792] Trial 166 finished with value: -0.6866397150821322 and parameters: {'scalers': 'none', 'ratios': 'norm_ratio', 'imputers': 'mean', 'n_estimators': 2450, 'learning_rate': 0.16219208727822684, 'max_depth': 8, 'min_child_weight': 1, 'subsample': 1.0, 'colsample_bytree': 0.6, 'colsample_bylevel': 0.7, 'reg_alpha': 2.0507642807319053, 'reg_lambda': 0.007380560175848567, 'gamma': 0.0025780678768780184}. Best is trial 110 with value: -1.5018578568346757.
[I 2026-07-14 21:51:34,357] Trial 167 finished with value: -0.2685969284045857 and parameters: {'scalers': 'none', 'ratios': 'norm_ratio', 'imputers': 'mean', 'n_estimators': 2450, 'learning_rate': 0.14933231020576754, 'max_depth': 8, 'min_child_weight': 1, 'subsample': 1.0, 'colsample_bytree': 0.6, 'colsample_bylevel': 0.7, 'reg_alpha': 5.303759455171783, 'reg_lambda': 0.008059949639703733, 'gamma': 0.0029194422118823836}. Best is trial 110 with value: -1.5018578568346757.
[I 2026-07-14 21:51:42,450] Trial 168 finished with value: -0.3665289017382167 and parameters: {'scalers': 'none', 'ratios': 'norm_ratio', 'imputers': 'mean', 'n_estimators': 2450, 'learning_rate': 0.15174356957893778, 'max_depth': 8, 'min_child_weight': 1, 'subsample': 0.9, 'colsample_bytree': 0.6, 'colsample_bylevel': 0.7, 'reg_alpha': 5.35841312610142, 'reg_lambda': 0.007913118611584896, 'gamma': 0.002483429792479325}. Best is trial 110 with value: -1.5018578568346757.
[I 2026-07-14 21:51:50,655] Trial 169 finished with value: -0.3674606356265586 and parameters: {'scalers': 'none', 'ratios': 'norm_ratio', 'imputers': 'mean', 'n_estimators': 2450, 'learning_rate': 0.1691823437163856, 'max_depth': 8, 'min_child_weight': 1, 'subsample': 0.9, 'colsample_bytree': 0.6, 'colsample_bylevel': 0.7, 'reg_alpha': 5.345720033784121, 'reg_lambda': 0.007714600781876965, 'gamma': 0.0028986521494177306}. Best is trial 110 with value: -1.5018578568346757.
[I 2026-07-14 21:52:07,419] Trial 170 finished with value: -0.852233830461453 and parameters: {'scalers': 'none', 'ratios': 'norm_ratio', 'imputers': 'mean', 'n_estimators': 2700, 'learning_rate': 0.10893354255835608, 'max_depth': 8, 'min_child_weight': 1, 'subsample': 0.9, 'colsample_bytree': 0.6, 'colsample_bylevel': 0.7, 'reg_alpha': 0.6547043955966216, 'reg_lambda': 0.006371860777224948, 'gamma': 0.00283195397783606}. Best is trial 110 with value: -1.5018578568346757.
[I 2026-07-14 21:52:27,737] Trial 171 finished with value: -1.074866801425866 and parameters: {'scalers': 'none', 'ratios': 'norm_ratio', 'imputers': 'mean', 'n_estimators': 2750, 'learning_rate': 0.13916345760466864, 'max_depth': 9, 'min_child_weight': 1, 'subsample': 0.9, 'colsample_bytree': 0.6, 'colsample_bylevel': 0.7, 'reg_alpha': 0.6675558065767012, 'reg_lambda': 0.0072971466486328905, 'gamma': 0.00277979005176605}. Best is trial 110 with value: -1.5018578568346757.
[I 2026-07-14 21:52:36,984] Trial 172 finished with value: -0.3618163589547114 and parameters: {'scalers': 'none', 'ratios': 'norm_ratio', 'imputers': 'mean', 'n_estimators': 2750, 'learning_rate': 0.11552573348848928, 'max_depth': 9, 'min_child_weight': 1, 'subsample': 0.9, 'colsample_bytree': 0.6, 'colsample_bylevel': 0.7, 'reg_alpha': 5.257303523042894, 'reg_lambda': 0.006657841192788408, 'gamma': 0.002608242775503085}. Best is trial 110 with value: -1.5018578568346757.
[I 2026-07-14 21:52:54,253] Trial 173 finished with value: -0.9281700446600233 and parameters: {'scalers': 'none', 'ratios': 'norm_ratio', 'imputers': 'mean', 'n_estimators': 2750, 'learning_rate': 0.11547359354238995, 'max_depth': 9, 'min_child_weight': 1, 'subsample': 0.9, 'colsample_bytree': 0.6, 'colsample_bylevel': 0.7, 'reg_alpha': 0.6529103645000476, 'reg_lambda': 0.006538166602169522, 'gamma': 0.03215370339390972}. Best is trial 110 with value: -1.5018578568346757.
[I 2026-07-14 21:52:58,196] Trial 174 finished with value: -0.48679663985415583 and parameters: {'scalers': 'none', 'ratios': 'norm_ratio', 'imputers': 'mean', 'n_estimators': 600, 'learning_rate': 0.11403595010560413, 'max_depth': 9, 'min_child_weight': 1, 'subsample': 0.9, 'colsample_bytree': 0.6, 'colsample_bylevel': 0.7, 'reg_alpha': 0.7123464694893517, 'reg_lambda': 0.0024729205123571484, 'gamma': 0.03143499102633568}. Best is trial 110 with value: -1.5018578568346757.
[I 2026-07-14 21:53:13,210] Trial 175 finished with value: -0.8653494767025219 and parameters: {'scalers': 'none', 'ratios': 'norm_ratio', 'imputers': 'mean', 'n_estimators': 2200, 'learning_rate': 0.11368861834747335, 'max_depth': 9, 'min_child_weight': 1, 'subsample': 0.9, 'colsample_bytree': 0.6, 'colsample_bylevel': 0.7, 'reg_alpha': 0.5845774164824457, 'reg_lambda': 0.0024044678580244345, 'gamma': 0.0163662562068233}. Best is trial 110 with value: -1.5018578568346757.
[I 2026-07-14 21:53:29,031] Trial 176 finished with value: -0.7056943982865626 and parameters: {'scalers': 'none', 'ratios': 'norm_ratio', 'imputers': 'mean', 'n_estimators': 2750, 'learning_rate': 0.114975445539389, 'max_depth': 9, 'min_child_weight': 1, 'subsample': 0.9, 'colsample_bytree': 0.6, 'colsample_bylevel': 0.7, 'reg_alpha': 0.2724695172316448, 'reg_lambda': 0.0024357777622920195, 'gamma': 0.03132375622930197}. Best is trial 110 with value: -1.5018578568346757.
[I 2026-07-14 21:53:33,388] Trial 177 finished with value: -0.7554938138148387 and parameters: {'scalers': 'none', 'ratios': 'norm_ratio', 'imputers': 'mean', 'n_estimators': 550, 'learning_rate': 0.22570759798127865, 'max_depth': 9, 'min_child_weight': 1, 'subsample': 0.9, 'colsample_bytree': 0.6, 'colsample_bylevel': 0.7, 'reg_alpha': 0.6309096712819208, 'reg_lambda': 0.0026314514980501553, 'gamma': 0.015805741840039387}. Best is trial 110 with value: -1.5018578568346757.
[I 2026-07-14 21:53:53,474] Trial 178 finished with value: -1.2096454071324845 and parameters: {'scalers': 'none', 'ratios': 'norm_ratio', 'imputers': 'mean', 'n_estimators': 2700, 'learning_rate': 0.21470339743213032, 'max_depth': 9, 'min_child_weight': 1, 'subsample': 0.9, 'colsample_bytree': 0.6, 'colsample_bylevel': 0.7, 'reg_alpha': 0.6332363702191522, 'reg_lambda': 0.0020174238186232117, 'gamma': 0.008029003618205265}. Best is trial 110 with value: -1.5018578568346757.
[I 2026-07-14 21:54:13,180] Trial 179 finished with value: -1.2614547483979914 and parameters: {'scalers': 'none', 'ratios': 'norm_ratio', 'imputers': 'mean', 'n_estimators': 2750, 'learning_rate': 0.20842448092670948, 'max_depth': 9, 'min_child_weight': 1, 'subsample': 0.9, 'colsample_bytree': 0.6, 'colsample_bylevel': 0.7, 'reg_alpha': 0.7035167560767313, 'reg_lambda': 0.002357123046809496, 'gamma': 0.028937930222493063}. Best is trial 110 with value: -1.5018578568346757.
