[I 2026-07-14 16:41:22,954] Trial 181 finished with value: -0.33348523887965564 and parameters: {'scalers': 'none', 'ratios': 'norm_ratio', 'imputers': 'median', 'n_estimators': 200, 'learning_rate': 0.0001080473887519756, 'max_depth': 5, 'min_child_weight': 4, 'subsample': 0.8, 'colsample_bytree': 0.5, 'colsample_bylevel': 0.9, 'reg_alpha': 98.48014494388666, 'reg_lambda': 0.5334713837164224, 'gamma': 60.37291659333687}. Best is trial 170 with value: -0.33354450598294566.
[I 2026-07-14 16:41:23,316] Trial 182 finished with value: -0.3334983178965531 and parameters: {'scalers': 'none', 'ratios': 'log_ratio', 'imputers': 'median', 'n_estimators': 200, 'learning_rate': 0.00010635943883434747, 'max_depth': 5, 'min_child_weight': 4, 'subsample': 0.8, 'colsample_bytree': 0.5, 'colsample_bylevel': 0.9, 'reg_alpha': 0.1460234084404946, 'reg_lambda': 0.48196881100666716, 'gamma': 61.36512634751218}. Best is trial 170 with value: -0.33354450598294566.
[I 2026-07-14 16:41:23,849] Trial 183 finished with value: -0.3332519279871734 and parameters: {'scalers': 'none', 'ratios': 'log_ratio', 'imputers': 'median', 'n_estimators': 250, 'learning_rate': 0.0001034512797961846, 'max_depth': 5, 'min_child_weight': 4, 'subsample': 0.8, 'colsample_bytree': 0.5, 'colsample_bylevel': 0.9, 'reg_alpha': 89.43394982869879, 'reg_lambda': 0.5560545034465098, 'gamma': 58.948095169549184}. Best is trial 170 with value: -0.33354450598294566.
[I 2026-07-14 16:41:24,294] Trial 184 finished with value: -0.3332522423654582 and parameters: {'scalers': 'none', 'ratios': 'log_ratio', 'imputers': 'median', 'n_estimators': 250, 'learning_rate': 0.00010333831951244546, 'max_depth': 5, 'min_child_weight': 4, 'subsample': 0.8, 'colsample_bytree': 0.5, 'colsample_bylevel': 0.9, 'reg_alpha': 0.21950552912751775, 'reg_lambda': 0.5691192677675132, 'gamma': 60.22466305747993}. Best is trial 170 with value: -0.33354450598294566.
[I 2026-07-14 16:41:24,701] Trial 185 finished with value: -0.333274295564851 and parameters: {'scalers': 'none', 'ratios': 'log_ratio', 'imputers': 'median', 'n_estimators': 250, 'learning_rate': 0.000101372190525993, 'max_depth': 5, 'min_child_weight': 4, 'subsample': 0.8, 'colsample_bytree': 0.5, 'colsample_bylevel': 0.9, 'reg_alpha': 86.31225575324898, 'reg_lambda': 0.6113036435219878, 'gamma': 59.19576078176592}. Best is trial 170 with value: -0.33354450598294566.
[I 2026-07-14 16:41:25,271] Trial 186 finished with value: -0.33327510586279013 and parameters: {'scalers': 'none', 'ratios': 'log_ratio', 'imputers': 'median', 'n_estimators': 250, 'learning_rate': 0.0001012671909112116, 'max_depth': 5, 'min_child_weight': 5, 'subsample': 0.8, 'colsample_bytree': 0.5, 'colsample_bylevel': 0.9, 'reg_alpha': 45.74372018493627, 'reg_lambda': 0.5200296307074789, 'gamma': 59.82739942800867}. Best is trial 170 with value: -0.33354450598294566.
[I 2026-07-14 16:41:25,685] Trial 187 finished with value: -0.33318041634247325 and parameters: {'scalers': 'none', 'ratios': 'log_ratio', 'imputers': 'median', 'n_estimators': 250, 'learning_rate': 0.00011004521567922278, 'max_depth': 5, 'min_child_weight': 1, 'subsample': 0.8, 'colsample_bytree': 0.5, 'colsample_bylevel': 0.9, 'reg_alpha': 44.60474175417427, 'reg_lambda': 0.5251341204091174, 'gamma': 64.0364408304158}. Best is trial 170 with value: -0.33354450598294566.
[I 2026-07-14 16:41:26,170] Trial 188 finished with value: -0.33328130859623095 and parameters: {'scalers': 'none', 'ratios': 'log_ratio', 'imputers': 'median', 'n_estimators': 250, 'learning_rate': 0.00010073570534695568, 'max_depth': 5, 'min_child_weight': 1, 'subsample': 0.8, 'colsample_bytree': 0.5, 'colsample_bylevel': 0.9, 'reg_alpha': 97.42145590957705, 'reg_lambda': 0.5557165570613388, 'gamma': 64.5374166623836}. Best is trial 170 with value: -0.33354450598294566.
[I 2026-07-14 16:41:26,642] Trial 189 finished with value: -0.33325879221829574 and parameters: {'scalers': 'none', 'ratios': 'log_ratio', 'imputers': 'median', 'n_estimators': 250, 'learning_rate': 0.00010281292346661995, 'max_depth': 5, 'min_child_weight': 1, 'subsample': 0.8, 'colsample_bytree': 0.5, 'colsample_bylevel': 0.9, 'reg_alpha': 96.14246583969921, 'reg_lambda': 0.6745223317015543, 'gamma': 64.3640572722548}. Best is trial 170 with value: -0.33354450598294566.
[I 2026-07-14 16:41:27,182] Trial 190 finished with value: -0.3331419111026672 and parameters: {'scalers': 'none', 'ratios': 'log_ratio', 'imputers': 'median', 'n_estimators': 300, 'learning_rate': 0.00010088598453454537, 'max_depth': 5, 'min_child_weight': 5, 'subsample': 0.8, 'colsample_bytree': 0.5, 'colsample_bylevel': 0.9, 'reg_alpha': 91.50740261715731, 'reg_lambda': 0.5777296590117347, 'gamma': 67.0791285972062}. Best is trial 170 with value: -0.33354450598294566.
[I 2026-07-14 16:41:27,767] Trial 191 finished with value: -0.33313633840633694 and parameters: {'scalers': 'none', 'ratios': 'log_ratio', 'imputers': 'median', 'n_estimators': 300, 'learning_rate': 0.00010134638640063552, 'max_depth': 5, 'min_child_weight': 5, 'subsample': 0.8, 'colsample_bytree': 0.5, 'colsample_bylevel': 0.9, 'reg_alpha': 97.93403235309981, 'reg_lambda': 0.6704092919438647, 'gamma': 69.88094770271745}. Best is trial 170 with value: -0.33354450598294566.
[I 2026-07-14 16:41:28,316] Trial 192 finished with value: -0.3331491671706968 and parameters: {'scalers': 'none', 'ratios': 'log_ratio', 'imputers': 'median', 'n_estimators': 300, 'learning_rate': 0.00010026353981803973, 'max_depth': 5, 'min_child_weight': 5, 'subsample': 0.8, 'colsample_bytree': 0.5, 'colsample_bylevel': 0.9, 'reg_alpha': 44.293873505827165, 'reg_lambda': 0.5344087442565076, 'gamma': 70.46053400187289}. Best is trial 170 with value: -0.33354450598294566.
[I 2026-07-14 16:41:28,894] Trial 193 finished with value: -0.3331459196672188 and parameters: {'scalers': 'none', 'ratios': 'log_ratio', 'imputers': 'median', 'n_estimators': 300, 'learning_rate': 0.00010052616123388453, 'max_depth': 5, 'min_child_weight': 5, 'subsample': 0.8, 'colsample_bytree': 0.5, 'colsample_bylevel': 0.9, 'reg_alpha': 46.92692107996357, 'reg_lambda': 0.7299881422237372, 'gamma': 72.91123188761128}. Best is trial 170 with value: -0.33354450598294566.
[I 2026-07-14 16:41:29,443] Trial 194 finished with value: -0.3331468395839373 and parameters: {'scalers': 'none', 'ratios': 'log_ratio', 'imputers': 'median', 'n_estimators': 300, 'learning_rate': 0.00010048081634308233, 'max_depth': 5, 'min_child_weight': 5, 'subsample': 0.8, 'colsample_bytree': 0.5, 'colsample_bylevel': 0.9, 'reg_alpha': 96.63179319237298, 'reg_lambda': 1.6734899624973472, 'gamma': 72.11338374830746}. Best is trial 170 with value: -0.33354450598294566.
[I 2026-07-14 16:41:30,020] Trial 195 finished with value: -0.3330606701843416 and parameters: {'scalers': 'none', 'ratios': 'log_ratio', 'imputers': 'median', 'n_estimators': 300, 'learning_rate': 0.0001075762869293976, 'max_depth': 4, 'min_child_weight': 4, 'subsample': 0.8, 'colsample_bytree': 0.5, 'colsample_bylevel': 0.9, 'reg_alpha': 93.47618251633071, 'reg_lambda': 1.9375865239746342, 'gamma': 40.65460556729404}. Best is trial 170 with value: -0.33354450598294566.
[I 2026-07-14 16:41:30,634] Trial 196 finished with value: -0.33314470638182664 and parameters: {'scalers': 'none', 'ratios': 'log_ratio', 'imputers': 'median', 'n_estimators': 300, 'learning_rate': 0.00010061221524945337, 'max_depth': 4, 'min_child_weight': 5, 'subsample': 0.8, 'colsample_bytree': 0.5, 'colsample_bylevel': 0.9, 'reg_alpha': 17.323273642103096, 'reg_lambda': 1.7159842539271948, 'gamma': 99.27033114304588}. Best is trial 170 with value: -0.33354450598294566.
[I 2026-07-14 16:41:31,184] Trial 197 finished with value: -0.3331295924787182 and parameters: {'scalers': 'none', 'ratios': 'log_ratio', 'imputers': 'median', 'n_estimators': 300, 'learning_rate': 0.00010186977018864853, 'max_depth': 4, 'min_child_weight': 5, 'subsample': 0.8, 'colsample_bytree': 0.5, 'colsample_bylevel': 0.9, 'reg_alpha': 43.81565390860715, 'reg_lambda': 1.532480862418678, 'gamma': 98.8052545854428}. Best is trial 170 with value: -0.33354450598294566.
[I 2026-07-14 16:41:31,711] Trial 198 finished with value: -0.33314069260525975 and parameters: {'scalers': 'none', 'ratios': 'log_ratio', 'imputers': 'median', 'n_estimators': 300, 'learning_rate': 0.00010095595697389939, 'max_depth': 4, 'min_child_weight': 4, 'subsample': 0.8, 'colsample_bytree': 0.5, 'colsample_bylevel': 0.9, 'reg_alpha': 42.152733912723335, 'reg_lambda': 1.2561850348600154, 'gamma': 43.44835364841364}. Best is trial 170 with value: -0.33354450598294566.
[I 2026-07-14 16:41:32,078] Trial 199 finished with value: -0.33399307416321355 and parameters: {'scalers': 'none', 'ratios': 'log_ratio', 'imputers': 'median', 'n_estimators': 100, 'learning_rate': 0.00010020547653487149, 'max_depth': 4, 'min_child_weight': 4, 'subsample': 0.8, 'colsample_bytree': 0.5, 'colsample_bylevel': 0.9, 'reg_alpha': 41.69990050641945, 'reg_lambda': 1.4246454433223692, 'gamma': 40.901304285644215}. Best is trial 199 with value: -0.33399307416321355.
[I 2026-07-14 16:41:32,194] Trial 200 finished with value: -0.33397197923437727 and parameters: {'scalers': 'none', 'ratios': 'log_ratio', 'imputers': 'median', 'n_estimators': 100, 'learning_rate': 0.00010573426046973865, 'max_depth': 4, 'min_child_weight': 4, 'subsample': 0.8, 'colsample_bytree': 0.5, 'colsample_bylevel': 0.9, 'reg_alpha': 19.338757687123938, 'reg_lambda': 1.5452974038302996, 'gamma': 41.31772721739885}. Best is trial 199 with value: -0.33399307416321355.
[I 2026-07-14 16:41:32,480] Trial 201 finished with value: -0.33399301704530315 and parameters: {'scalers': 'none', 'ratios': 'log_ratio', 'imputers': 'median', 'n_estimators': 100, 'learning_rate': 0.0001002264292251346, 'max_depth': 5, 'min_child_weight': 4, 'subsample': 0.8, 'colsample_bytree': 0.5, 'colsample_bylevel': 0.9, 'reg_alpha': 18.05709367382831, 'reg_lambda': 1.6239018560550706, 'gamma': 41.088721991199606}. Best is trial 199 with value: -0.33399307416321355.
[I 2026-07-14 16:41:32,642] Trial 202 finished with value: -0.33398934494518295 and parameters: {'scalers': 'none', 'ratios': 'log_ratio', 'imputers': 'median', 'n_estimators': 100, 'learning_rate': 0.00010118371596703125, 'max_depth': 4, 'min_child_weight': 4, 'subsample': 0.8, 'colsample_bytree': 0.5, 'colsample_bylevel': 0.9, 'reg_alpha': 17.2365228520561, 'reg_lambda': 0.24189371776993387, 'gamma': 41.25085042223925}. Best is trial 199 with value: -0.33399307416321355.
[I 2026-07-14 16:41:32,848] Trial 203 finished with value: -0.33391981481211686 and parameters: {'scalers': 'none', 'ratios': 'log_ratio', 'imputers': 'median', 'n_estimators': 100, 'learning_rate': 0.00011938629778902914, 'max_depth': 4, 'min_child_weight': 4, 'subsample': 0.8, 'colsample_bytree': 0.5, 'colsample_bylevel': 0.9, 'reg_alpha': 14.009505863605689, 'reg_lambda': 0.2141253843668986, 'gamma': 96.83732993196286}. Best is trial 199 with value: -0.33399307416321355.
[I 2026-07-14 16:41:33,155] Trial 204 finished with value: -0.3339166142098114 and parameters: {'scalers': 'none', 'ratios': 'log_ratio', 'imputers': 'median', 'n_estimators': 100, 'learning_rate': 0.00012021646547456477, 'max_depth': 5, 'min_child_weight': 4, 'subsample': 0.8, 'colsample_bytree': 0.5, 'colsample_bylevel': 0.9, 'reg_alpha': 8.287428524741136, 'reg_lambda': 0.37853999570836516, 'gamma': 41.55175695780564}. Best is trial 199 with value: -0.33399307416321355.
[I 2026-07-14 16:41:33,370] Trial 205 finished with value: -0.3339113989123381 and parameters: {'scalers': 'none', 'ratios': 'log_ratio', 'imputers': 'median', 'n_estimators': 100, 'learning_rate': 0.00012160144164479856, 'max_depth': 5, 'min_child_weight': 4, 'subsample': 0.8, 'colsample_bytree': 0.5, 'colsample_bylevel': 0.9, 'reg_alpha': 31.151202154018605, 'reg_lambda': 0.3307418645976274, 'gamma': 39.20140105192281}. Best is trial 199 with value: -0.33399307416321355.
[I 2026-07-14 16:41:33,567] Trial 206 finished with value: -0.33390839589942534 and parameters: {'scalers': 'none', 'ratios': 'log_ratio', 'imputers': 'median', 'n_estimators': 100, 'learning_rate': 0.00012237934567591862, 'max_depth': 5, 'min_child_weight': 1, 'subsample': 0.8, 'colsample_bytree': 0.5, 'colsample_bylevel': 0.9, 'reg_alpha': 9.195513824199116, 'reg_lambda': 0.26804526724292643, 'gamma': 40.27025256649343}. Best is trial 199 with value: -0.33399307416321355.
[I 2026-07-14 16:41:33,758] Trial 207 finished with value: -0.3339030794724684 and parameters: {'scalers': 'none', 'ratios': 'log_ratio', 'imputers': 'median', 'n_estimators': 100, 'learning_rate': 0.00012377441388041965, 'max_depth': 5, 'min_child_weight': 1, 'subsample': 0.8, 'colsample_bytree': 0.5, 'colsample_bylevel': 0.9, 'reg_alpha': 8.524509508040618, 'reg_lambda': 0.3819504086584759, 'gamma': 40.243540889801224}. Best is trial 199 with value: -0.33399307416321355.
[I 2026-07-14 16:41:34,044] Trial 208 finished with value: -0.3338991212860989 and parameters: {'scalers': 'none', 'ratios': 'log_ratio', 'imputers': 'median', 'n_estimators': 100, 'learning_rate': 0.00012482048774466197, 'max_depth': 5, 'min_child_weight': 4, 'subsample': 0.8, 'colsample_bytree': 0.5, 'colsample_bylevel': 0.9, 'reg_alpha': 27.497169179058677, 'reg_lambda': 0.3289965521732047, 'gamma': 41.770490893688134}. Best is trial 199 with value: -0.33399307416321355.
[I 2026-07-14 16:41:34,249] Trial 209 finished with value: -0.3338988346604729 and parameters: {'scalers': 'none', 'ratios': 'log_ratio', 'imputers': 'median', 'n_estimators': 100, 'learning_rate': 0.00012488751707210398, 'max_depth': 4, 'min_child_weight': 4, 'subsample': 0.8, 'colsample_bytree': 0.5, 'colsample_bylevel': 0.9, 'reg_alpha': 11.321639355672147, 'reg_lambda': 0.3692932854370547, 'gamma': 41.83762168726011}. Best is trial 199 with value: -0.33399307416321355.
[I 2026-07-14 16:41:34,584] Trial 210 finished with value: -0.33390561700024507 and parameters: {'scalers': 'none', 'ratios': 'log_ratio', 'imputers': 'median', 'n_estimators': 100, 'learning_rate': 0.00012311704225140567, 'max_depth': 3, 'min_child_weight': 4, 'subsample': 0.8, 'colsample_bytree': 0.5, 'colsample_bylevel': 0.9, 'reg_alpha': 11.319455248804783, 'reg_lambda': 0.25579569971453914, 'gamma': 42.482686997399355}. Best is trial 199 with value: -0.33399307416321355.
[I 2026-07-14 16:41:34,823] Trial 211 finished with value: -0.3339077746513078 and parameters: {'scalers': 'none', 'ratios': 'log_ratio', 'imputers': 'median', 'n_estimators': 100, 'learning_rate': 0.00012253717404732582, 'max_depth': 4, 'min_child_weight': 4, 'subsample': 0.8, 'colsample_bytree': 0.5, 'colsample_bylevel': 0.9, 'reg_alpha': 11.785228592515976, 'reg_lambda': 0.2428566067315756, 'gamma': 41.44158109329329}. Best is trial 199 with value: -0.33399307416321355.
[I 2026-07-14 16:41:34,970] Trial 212 finished with value: -0.33389653646792866 and parameters: {'scalers': 'none', 'ratios': 'log_ratio', 'imputers': 'median', 'n_estimators': 100, 'learning_rate': 0.00012550040862455562, 'max_depth': 4, 'min_child_weight': 4, 'subsample': 0.8, 'colsample_bytree': 0.5, 'colsample_bylevel': 0.9, 'reg_alpha': 28.09258497283655, 'reg_lambda': 0.2373011170950749, 'gamma': 38.37885587335799}. Best is trial 199 with value: -0.33399307416321355.
[I 2026-07-14 16:41:35,528] Trial 213 finished with value: -0.3338890229647777 and parameters: {'scalers': 'none', 'ratios': 'log_ratio', 'imputers': 'median', 'n_estimators': 100, 'learning_rate': 0.00012747687229778138, 'max_depth': 3, 'min_child_weight': 4, 'subsample': 0.8, 'colsample_bytree': 0.5, 'colsample_bylevel': 0.9, 'reg_alpha': 11.243425059418517, 'reg_lambda': 0.33862241377247637, 'gamma': 39.94534946275612}. Best is trial 199 with value: -0.33399307416321355.
[I 2026-07-14 16:41:36,049] Trial 214 finished with value: -0.33388140674919997 and parameters: {'scalers': 'none', 'ratios': 'log_ratio', 'imputers': 'median', 'n_estimators': 100, 'learning_rate': 0.0001294723184381554, 'max_depth': 4, 'min_child_weight': 4, 'subsample': 0.8, 'colsample_bytree': 0.5, 'colsample_bylevel': 0.9, 'reg_alpha': 8.206750544774156, 'reg_lambda': 0.2217506368971244, 'gamma': 39.433370006025896}. Best is trial 199 with value: -0.33399307416321355.
[I 2026-07-14 16:41:36,237] Trial 215 finished with value: -0.3338844156783898 and parameters: {'scalers': 'none', 'ratios': 'log_ratio', 'imputers': 'median', 'n_estimators': 100, 'learning_rate': 0.00012867797489925876, 'max_depth': 4, 'min_child_weight': 4, 'subsample': 0.8, 'colsample_bytree': 0.5, 'colsample_bylevel': 0.9, 'reg_alpha': 9.36007882377255, 'reg_lambda': 0.18684060727630958, 'gamma': 38.30604395288943}. Best is trial 199 with value: -0.33399307416321355.
[I 2026-07-14 16:41:36,811] Trial 216 finished with value: -0.3338801018766334 and parameters: {'scalers': 'none', 'ratios': 'log_ratio', 'imputers': 'median', 'n_estimators': 100, 'learning_rate': 0.00012980667976404247, 'max_depth': 3, 'min_child_weight': 4, 'subsample': 0.8, 'colsample_bytree': 0.5, 'colsample_bylevel': 0.9, 'reg_alpha': 9.068537934164391, 'reg_lambda': 0.22752382768595472, 'gamma': 38.59239364824374}. Best is trial 199 with value: -0.33399307416321355.
[I 2026-07-14 16:41:37,087] Trial 217 finished with value: -0.3338839417369827 and parameters: {'scalers': 'none', 'ratios': 'log_ratio', 'imputers': 'median', 'n_estimators': 100, 'learning_rate': 0.0001287955768344025, 'max_depth': 4, 'min_child_weight': 4, 'subsample': 0.8, 'colsample_bytree': 0.5, 'colsample_bylevel': 0.9, 'reg_alpha': 8.604663471058291, 'reg_lambda': 0.23692400407894534, 'gamma': 38.16666470463119}. Best is trial 199 with value: -0.33399307416321355.
[I 2026-07-14 16:41:37,296] Trial 218 finished with value: -0.3338859455715119 and parameters: {'scalers': 'none', 'ratios': 'log_ratio', 'imputers': 'median', 'n_estimators': 100, 'learning_rate': 0.000128282686928471, 'max_depth': 3, 'min_child_weight': 4, 'subsample': 0.8, 'colsample_bytree': 0.5, 'colsample_bylevel': 0.9, 'reg_alpha': 11.962458750281666, 'reg_lambda': 0.17314217156262912, 'gamma': 38.58299745145179}. Best is trial 199 with value: -0.33399307416321355.
[I 2026-07-14 16:41:37,545] Trial 219 finished with value: -0.3338877235114956 and parameters: {'scalers': 'none', 'ratios': 'log_ratio', 'imputers': 'median', 'n_estimators': 100, 'learning_rate': 0.00012780551463604657, 'max_depth': 3, 'min_child_weight': 4, 'subsample': 0.8, 'colsample_bytree': 0.5, 'colsample_bylevel': 0.9, 'reg_alpha': 8.695257648318375, 'reg_lambda': 0.23581327027732293, 'gamma': 36.414853866352914}. Best is trial 199 with value: -0.33399307416321355.
[I 2026-07-14 16:41:37,815] Trial 220 finished with value: -0.3338699221832717 and parameters: {'scalers': 'none', 'ratios': 'log_ratio', 'imputers': 'median', 'n_estimators': 100, 'learning_rate': 0.00013247952965501396, 'max_depth': 3, 'min_child_weight': 4, 'subsample': 0.8, 'colsample_bytree': 0.5, 'colsample_bylevel': 0.9, 'reg_alpha': 10.072880057724044, 'reg_lambda': 0.17729169441127451, 'gamma': 39.92000289719477}. Best is trial 199 with value: -0.33399307416321355.
[I 2026-07-14 16:41:38,181] Trial 221 finished with value: -0.33354527827786645 and parameters: {'scalers': 'none', 'ratios': 'log_ratio', 'imputers': 'median', 'n_estimators': 100, 'learning_rate': 0.00017166145085144874, 'max_depth': 3, 'min_child_weight': 4, 'subsample': 0.8, 'colsample_bytree': 0.5, 'colsample_bylevel': 0.9, 'reg_alpha': 8.486884957375315, 'reg_lambda': 0.22782823234104316, 'gamma': 23.311279841997848}. Best is trial 199 with value: -0.33399307416321355.
[I 2026-07-14 16:41:38,558] Trial 222 finished with value: -0.3335708632032787 and parameters: {'scalers': 'none', 'ratios': 'log_ratio', 'imputers': 'median', 'n_estimators': 100, 'learning_rate': 0.0001736180254828285, 'max_depth': 3, 'min_child_weight': 4, 'subsample': 0.8, 'colsample_bytree': 0.5, 'colsample_bylevel': 0.9, 'reg_alpha': 9.206159109216014, 'reg_lambda': 0.24564540498424545, 'gamma': 23.458722944138156}. Best is trial 199 with value: -0.33399307416321355.
[I 2026-07-14 16:41:38,754] Trial 223 finished with value: -0.333559341620002 and parameters: {'scalers': 'none', 'ratios': 'log_ratio', 'imputers': 'median', 'n_estimators': 100, 'learning_rate': 0.00017474998502198277, 'max_depth': 3, 'min_child_weight': 4, 'subsample': 0.8, 'colsample_bytree': 0.5, 'colsample_bylevel': 0.9, 'reg_alpha': 10.300976762576145, 'reg_lambda': 0.2109413795468746, 'gamma': 23.07667570045317}. Best is trial 199 with value: -0.33399307416321355.
[I 2026-07-14 16:41:39,133] Trial 224 finished with value: -0.3335784938712339 and parameters: {'scalers': 'none', 'ratios': 'log_ratio', 'imputers': 'median', 'n_estimators': 100, 'learning_rate': 0.00017105675133107266, 'max_depth': 3, 'min_child_weight': 4, 'subsample': 0.8, 'colsample_bytree': 0.5, 'colsample_bylevel': 0.9, 'reg_alpha': 9.331159358125786, 'reg_lambda': 0.1756278411083235, 'gamma': 23.45793051522326}. Best is trial 199 with value: -0.33399307416321355.
[I 2026-07-14 16:41:39,464] Trial 225 finished with value: -0.3334554557210199 and parameters: {'scalers': 'none', 'ratios': 'log_ratio', 'imputers': 'median', 'n_estimators': 100, 'learning_rate': 0.00017383737014646338, 'max_depth': 3, 'min_child_weight': 4, 'subsample': 0.8, 'colsample_bytree': 0.5, 'colsample_bylevel': 0.9, 'reg_alpha': 9.533555279454136, 'reg_lambda': 0.18097709738410758, 'gamma': 20.949906276235424}. Best is trial 199 with value: -0.33399307416321355.
[I 2026-07-14 16:41:39,651] Trial 226 finished with value: -0.3335563959880096 and parameters: {'scalers': 'none', 'ratios': 'log_ratio', 'imputers': 'median', 'n_estimators': 100, 'learning_rate': 0.00017823282508160537, 'max_depth': 3, 'min_child_weight': 4, 'subsample': 0.8, 'colsample_bytree': 0.5, 'colsample_bylevel': 0.9, 'reg_alpha': 9.119252319437933, 'reg_lambda': 0.19343324999073608, 'gamma': 24.027768061151015}. Best is trial 199 with value: -0.33399307416321355.
