[I 2026-07-14 18:31:07,096] A new study created in RDB with name: my-study
[I 2026-07-14 18:31:15,454] Trial 2 finished with value: -0.05636894931620743 and parameters: {'scalers': 'none', 'ratios': 'log_ratio', 'imputers': 'none', 'n_estimators': 750, 'learning_rate': 0.0026633372475374493, 'max_depth': 6, 'min_child_weight': 2, 'subsample': 1.0, 'colsample_bytree': 0.9, 'colsample_bylevel': 0.9, 'reg_alpha': 4.161963861793815e-05, 'reg_lambda': 0.0001681079396023746, 'gamma': 0.0032642387847938775}. Best is trial 2 with value: -0.05636894931620743.
[I 2026-07-14 18:31:34,871] Trial 0 finished with value: -0.09672587877572887 and parameters: {'scalers': 'standard', 'ratios': 'norm_ratio', 'imputers': 'none', 'n_estimators': 1900, 'learning_rate': 0.015341943686717664, 'max_depth': 11, 'min_child_weight': 3, 'subsample': 0.6, 'colsample_bytree': 0.7, 'colsample_bylevel': 1.0, 'reg_alpha': 1.3563203580025496e-06, 'reg_lambda': 0.3519945809255323, 'gamma': 8.645586024552326e-06}. Best is trial 0 with value: -0.09672587877572887.
[I 2026-07-14 18:31:36,890] Trial 1 finished with value: -0.05829929472791562 and parameters: {'scalers': 'none', 'ratios': 'norm_ratio', 'imputers': 'median', 'n_estimators': 1750, 'learning_rate': 0.00020371574956810974, 'max_depth': 9, 'min_child_weight': 2, 'subsample': 0.7, 'colsample_bytree': 0.8, 'colsample_bylevel': 0.6, 'reg_alpha': 1.2172344987729697, 'reg_lambda': 0.0190409789568366, 'gamma': 7.60230749296923}. Best is trial 0 with value: -0.09672587877572887.
[I 2026-07-14 18:31:51,999] Trial 3 finished with value: -0.05668026352247 and parameters: {'scalers': 'robust', 'ratios': 'log_ratio', 'imputers': 'mean', 'n_estimators': 2750, 'learning_rate': 0.0010906367100915512, 'max_depth': 6, 'min_child_weight': 7, 'subsample': 1.0, 'colsample_bytree': 0.8, 'colsample_bylevel': 1.0, 'reg_alpha': 0.0012995234629449692, 'reg_lambda': 0.001003225006063247, 'gamma': 0.00044587703574906545}. Best is trial 0 with value: -0.09672587877572887.
[I 2026-07-14 18:31:55,751] Trial 6 finished with value: -0.05711484021116009 and parameters: {'scalers': 'robust', 'ratios': 'log_ratio', 'imputers': 'median', 'n_estimators': 2450, 'learning_rate': 0.0007530670061738568, 'max_depth': 3, 'min_child_weight': 10, 'subsample': 0.9, 'colsample_bytree': 1.0, 'colsample_bylevel': 0.8, 'reg_alpha': 15.182730129177713, 'reg_lambda': 0.0001275860058500356, 'gamma': 6.396937363195123e-05}. Best is trial 0 with value: -0.09672587877572887.
[I 2026-07-14 18:31:56,323] Trial 4 finished with value: -0.05823273221617608 and parameters: {'scalers': 'standard', 'ratios': 'log_ratio', 'imputers': 'mean', 'n_estimators': 1000, 'learning_rate': 0.0002905282304223939, 'max_depth': 10, 'min_child_weight': 1, 'subsample': 0.6, 'colsample_bytree': 0.7, 'colsample_bylevel': 0.6, 'reg_alpha': 14.285374384833979, 'reg_lambda': 16.284675808629046, 'gamma': 0.000571096345760893}. Best is trial 0 with value: -0.09672587877572887.
[I 2026-07-14 18:31:59,178] Trial 5 finished with value: -0.05829066279083765 and parameters: {'scalers': 'robust', 'ratios': 'norm_ratio', 'imputers': 'mean', 'n_estimators': 2450, 'learning_rate': 0.06839346008787263, 'max_depth': 8, 'min_child_weight': 7, 'subsample': 0.9, 'colsample_bytree': 0.5, 'colsample_bylevel': 0.6, 'reg_alpha': 0.5424639988041642, 'reg_lambda': 78.79027255768563, 'gamma': 1.687208388839968}. Best is trial 0 with value: -0.09672587877572887.
[I 2026-07-14 18:32:00,916] Trial 7 finished with value: -0.05958038919830084 and parameters: {'scalers': 'robust', 'ratios': 'log_ratio', 'imputers': 'median', 'n_estimators': 500, 'learning_rate': 0.04029190241778515, 'max_depth': 7, 'min_child_weight': 7, 'subsample': 0.7, 'colsample_bytree': 1.0, 'colsample_bylevel': 0.8, 'reg_alpha': 8.295354059098035, 'reg_lambda': 0.009619462593340343, 'gamma': 4.213081053053645e-05}. Best is trial 0 with value: -0.09672587877572887.
[I 2026-07-14 18:32:04,064] Trial 8 finished with value: -0.061360926646660346 and parameters: {'scalers': 'standard', 'ratios': 'norm_ratio', 'imputers': 'mean', 'n_estimators': 650, 'learning_rate': 0.012906577058022587, 'max_depth': 7, 'min_child_weight': 10, 'subsample': 0.9, 'colsample_bytree': 0.5, 'colsample_bylevel': 1.0, 'reg_alpha': 0.0001493824576968216, 'reg_lambda': 5.322224820953703e-06, 'gamma': 1.3669896681732246e-06}. Best is trial 0 with value: -0.09672587877572887.
[I 2026-07-14 18:32:08,687] Trial 9 finished with value: -0.07793560423733703 and parameters: {'scalers': 'standard', 'ratios': 'norm_ratio', 'imputers': 'none', 'n_estimators': 1850, 'learning_rate': 0.18550389956989222, 'max_depth': 4, 'min_child_weight': 9, 'subsample': 0.7, 'colsample_bytree': 0.7, 'colsample_bylevel': 0.8, 'reg_alpha': 1.9580650596705906e-05, 'reg_lambda': 0.018474245708230596, 'gamma': 5.2387203525707936e-05}. Best is trial 0 with value: -0.09672587877572887.
[I 2026-07-14 18:32:10,453] Trial 10 finished with value: -0.05830766088034864 and parameters: {'scalers': 'none', 'ratios': 'log_ratio', 'imputers': 'none', 'n_estimators': 1550, 'learning_rate': 0.004536105068800538, 'max_depth': 4, 'min_child_weight': 7, 'subsample': 0.7, 'colsample_bytree': 0.6, 'colsample_bylevel': 0.7, 'reg_alpha': 1.483650562125427e-06, 'reg_lambda': 3.111172504912251e-05, 'gamma': 2.5240266186227522}. Best is trial 0 with value: -0.09672587877572887.
[I 2026-07-14 18:32:11,001] Trial 11 finished with value: -0.05597006766687522 and parameters: {'scalers': 'none', 'ratios': 'norm_ratio', 'imputers': 'median', 'n_estimators': 650, 'learning_rate': 0.012095931383279622, 'max_depth': 4, 'min_child_weight': 6, 'subsample': 0.7, 'colsample_bytree': 0.6, 'colsample_bylevel': 0.6, 'reg_alpha': 1.3454949657147253, 'reg_lambda': 4.8431003398129256e-05, 'gamma': 0.14199073137281518}. Best is trial 0 with value: -0.09672587877572887.
[I 2026-07-14 18:32:40,455] Trial 12 finished with value: -0.2779130718356684 and parameters: {'scalers': 'none', 'ratios': 'norm_ratio', 'imputers': 'none', 'n_estimators': 2350, 'learning_rate': 0.33848451276212765, 'max_depth': 11, 'min_child_weight': 2, 'subsample': 0.6, 'colsample_bytree': 0.9, 'colsample_bylevel': 0.9, 'reg_alpha': 1.3521165704995444e-06, 'reg_lambda': 9.006700779845675, 'gamma': 1.0428502559689312e-06}. Best is trial 12 with value: -0.2779130718356684.
[I 2026-07-14 18:32:48,621] Trial 13 finished with value: -0.057072648847714735 and parameters: {'scalers': 'none', 'ratios': 'norm_ratio', 'imputers': 'median', 'n_estimators': 1950, 'learning_rate': 0.0005688774261283937, 'max_depth': 6, 'min_child_weight': 5, 'subsample': 0.5, 'colsample_bytree': 0.8, 'colsample_bylevel': 0.7, 'reg_alpha': 0.0026644164282296928, 'reg_lambda': 0.18911307189943632, 'gamma': 0.010818213675398192}. Best is trial 12 with value: -0.2779130718356684.
[I 2026-07-14 18:32:50,402] Trial 14 finished with value: -0.057729010704839365 and parameters: {'scalers': 'none', 'ratios': 'log_ratio', 'imputers': 'none', 'n_estimators': 1050, 'learning_rate': 0.000672207271418831, 'max_depth': 9, 'min_child_weight': 9, 'subsample': 0.5, 'colsample_bytree': 0.7, 'colsample_bylevel': 1.0, 'reg_alpha': 8.618275480160488, 'reg_lambda': 5.954059080417263, 'gamma': 0.007959717398066902}. Best is trial 12 with value: -0.2779130718356684.
[I 2026-07-14 18:32:50,618] Trial 15 finished with value: -0.07639345798141142 and parameters: {'scalers': 'robust', 'ratios': 'log_ratio', 'imputers': 'mean', 'n_estimators': 100, 'learning_rate': 0.22473172733970806, 'max_depth': 7, 'min_child_weight': 1, 'subsample': 0.7, 'colsample_bytree': 0.5, 'colsample_bylevel': 0.5, 'reg_alpha': 0.0070065145090086245, 'reg_lambda': 1.0509081239072226e-06, 'gamma': 2.0336650445857965e-06}. Best is trial 12 with value: -0.2779130718356684.
[I 2026-07-14 18:32:53,222] Trial 16 finished with value: -0.05830317703537121 and parameters: {'scalers': 'standard', 'ratios': 'log_ratio', 'imputers': 'median', 'n_estimators': 2450, 'learning_rate': 0.0006891005001624814, 'max_depth': 5, 'min_child_weight': 4, 'subsample': 0.6, 'colsample_bytree': 1.0, 'colsample_bylevel': 0.9, 'reg_alpha': 17.879344317151883, 'reg_lambda': 0.15637744599242964, 'gamma': 39.10250466524175}. Best is trial 12 with value: -0.2779130718356684.
[I 2026-07-14 18:32:53,568] Trial 17 finished with value: -0.08967836813638333 and parameters: {'scalers': 'standard', 'ratios': 'norm_ratio', 'imputers': 'none', 'n_estimators': 100, 'learning_rate': 0.3950427905349434, 'max_depth': 12, 'min_child_weight': 4, 'subsample': 0.5, 'colsample_bytree': 0.6, 'colsample_bylevel': 0.5, 'reg_alpha': 0.010204455533399211, 'reg_lambda': 1.6217759708895407, 'gamma': 0.12124907365026603}. Best is trial 12 with value: -0.2779130718356684.
[I 2026-07-14 18:33:11,781] Trial 18 finished with value: -0.2220105662127715 and parameters: {'scalers': 'standard', 'ratios': 'norm_ratio', 'imputers': 'none', 'n_estimators': 1800, 'learning_rate': 0.462733793004613, 'max_depth': 12, 'min_child_weight': 4, 'subsample': 0.5, 'colsample_bytree': 0.7, 'colsample_bylevel': 0.9, 'reg_alpha': 1.3468992008057217e-06, 'reg_lambda': 0.4973116891030866, 'gamma': 2.3842068198044944e-06}. Best is trial 12 with value: -0.2779130718356684.
[I 2026-07-14 18:33:29,988] Trial 19 finished with value: -0.21965385698541914 and parameters: {'scalers': 'standard', 'ratios': 'norm_ratio', 'imputers': 'none', 'n_estimators': 1800, 'learning_rate': 0.4286418246542588, 'max_depth': 12, 'min_child_weight': 4, 'subsample': 0.5, 'colsample_bytree': 0.7, 'colsample_bylevel': 0.9, 'reg_alpha': 2.6159957379443428e-06, 'reg_lambda': 0.6069011745465661, 'gamma': 1.2076853689742352e-06}. Best is trial 12 with value: -0.2779130718356684.
[I 2026-07-14 18:33:51,098] Trial 20 finished with value: -0.1794609135214264 and parameters: {'scalers': 'standard', 'ratios': 'norm_ratio', 'imputers': 'none', 'n_estimators': 2000, 'learning_rate': 0.2291050157756405, 'max_depth': 12, 'min_child_weight': 4, 'subsample': 0.5, 'colsample_bytree': 0.9, 'colsample_bylevel': 0.9, 'reg_alpha': 1.2782824305251737e-06, 'reg_lambda': 1.3855930512550074, 'gamma': 1.1875242421171041e-06}. Best is trial 12 with value: -0.2779130718356684.
[I 2026-07-14 18:34:05,504] Trial 21 finished with value: -0.2011925758006754 and parameters: {'scalers': 'standard', 'ratios': 'norm_ratio', 'imputers': 'none', 'n_estimators': 1250, 'learning_rate': 0.3943660253707556, 'max_depth': 12, 'min_child_weight': 4, 'subsample': 0.5, 'colsample_bytree': 0.9, 'colsample_bylevel': 0.9, 'reg_alpha': 1.1012247071271743e-06, 'reg_lambda': 1.8223859304175265, 'gamma': 1.4054997347950957e-06}. Best is trial 12 with value: -0.2779130718356684.
[I 2026-07-14 18:34:40,525] Trial 22 finished with value: -0.20019024800679236 and parameters: {'scalers': 'standard', 'ratios': 'norm_ratio', 'imputers': 'none', 'n_estimators': 3000, 'learning_rate': 0.32069882961910207, 'max_depth': 12, 'min_child_weight': 4, 'subsample': 0.6, 'colsample_bytree': 0.9, 'colsample_bylevel': 0.9, 'reg_alpha': 1.3784624795927727e-06, 'reg_lambda': 0.5533548071789585, 'gamma': 2.479094918076044e-06}. Best is trial 12 with value: -0.2779130718356684.
[I 2026-07-14 18:35:16,282] Trial 23 finished with value: -0.2071589832182846 and parameters: {'scalers': 'standard', 'ratios': 'norm_ratio', 'imputers': 'none', 'n_estimators': 3000, 'learning_rate': 0.3785976184671364, 'max_depth': 12, 'min_child_weight': 4, 'subsample': 0.6, 'colsample_bytree': 0.9, 'colsample_bylevel': 0.9, 'reg_alpha': 1.252371622556695e-06, 'reg_lambda': 0.6193172971483055, 'gamma': 5.829824394254381e-06}. Best is trial 12 with value: -0.2779130718356684.
[I 2026-07-14 18:35:53,607] Trial 24 finished with value: -0.24393953849386446 and parameters: {'scalers': 'standard', 'ratios': 'norm_ratio', 'imputers': 'none', 'n_estimators': 2950, 'learning_rate': 0.4376825648424334, 'max_depth': 12, 'min_child_weight': 3, 'subsample': 0.6, 'colsample_bytree': 0.9, 'colsample_bylevel': 0.9, 'reg_alpha': 1.52944770416537e-06, 'reg_lambda': 1.253315303270388, 'gamma': 1.0592140882605095e-05}. Best is trial 12 with value: -0.2779130718356684.
[I 2026-07-14 18:36:19,453] Trial 25 finished with value: -0.12045707222594987 and parameters: {'scalers': 'standard', 'ratios': 'norm_ratio', 'imputers': 'none', 'n_estimators': 2950, 'learning_rate': 0.058418912199092815, 'max_depth': 12, 'min_child_weight': 3, 'subsample': 0.6, 'colsample_bytree': 0.9, 'colsample_bylevel': 0.9, 'reg_alpha': 1.6920978068070752e-06, 'reg_lambda': 0.5172016714203729, 'gamma': 6.1578319789038234e-06}. Best is trial 12 with value: -0.2779130718356684.
[I 2026-07-14 18:36:34,821] Trial 26 finished with value: -0.27811133071608823 and parameters: {'scalers': 'none', 'ratios': 'norm_ratio', 'imputers': 'none', 'n_estimators': 1350, 'learning_rate': 0.4912511387138839, 'max_depth': 12, 'min_child_weight': 3, 'subsample': 0.6, 'colsample_bytree': 0.9, 'colsample_bylevel': 0.9, 'reg_alpha': 9.10687703072543e-06, 'reg_lambda': 66.09040840161366, 'gamma': 8.773011177779944e-06}. Best is trial 26 with value: -0.27811133071608823.
[I 2026-07-14 18:36:46,122] Trial 27 finished with value: -0.13181263729510245 and parameters: {'scalers': 'none', 'ratios': 'norm_ratio', 'imputers': 'none', 'n_estimators': 1400, 'learning_rate': 0.09641036707429218, 'max_depth': 11, 'min_child_weight': 3, 'subsample': 0.6, 'colsample_bytree': 0.9, 'colsample_bylevel': 0.9, 'reg_alpha': 1.3293077736183924e-05, 'reg_lambda': 67.19387911898478, 'gamma': 9.390143319869502e-06}. Best is trial 26 with value: -0.27811133071608823.
[I 2026-07-14 18:36:58,248] Trial 28 finished with value: -0.12525164170844405 and parameters: {'scalers': 'standard', 'ratios': 'norm_ratio', 'imputers': 'none', 'n_estimators': 1500, 'learning_rate': 0.08207816436283286, 'max_depth': 11, 'min_child_weight': 3, 'subsample': 0.6, 'colsample_bytree': 0.9, 'colsample_bylevel': 0.9, 'reg_alpha': 1.1882476558327557e-05, 'reg_lambda': 68.58332400095814, 'gamma': 6.821886765099422e-06}. Best is trial 26 with value: -0.27811133071608823.
[I 2026-07-14 18:37:10,123] Trial 29 finished with value: -0.13522186408500236 and parameters: {'scalers': 'standard', 'ratios': 'norm_ratio', 'imputers': 'none', 'n_estimators': 1550, 'learning_rate': 0.09738649935553462, 'max_depth': 11, 'min_child_weight': 3, 'subsample': 0.6, 'colsample_bytree': 0.8, 'colsample_bylevel': 0.9, 'reg_alpha': 1.4079263598693919e-05, 'reg_lambda': 64.68589546975697, 'gamma': 9.485202172680635e-06}. Best is trial 26 with value: -0.27811133071608823.
[I 2026-07-14 18:37:27,278] Trial 30 finished with value: -0.17239751327222794 and parameters: {'scalers': 'standard', 'ratios': 'norm_ratio', 'imputers': 'none', 'n_estimators': 2200, 'learning_rate': 0.095315567323315, 'max_depth': 11, 'min_child_weight': 2, 'subsample': 0.6, 'colsample_bytree': 0.8, 'colsample_bylevel': 0.8, 'reg_alpha': 1.1460635566699603e-05, 'reg_lambda': 72.52834687907495, 'gamma': 9.570972200798334e-06}. Best is trial 26 with value: -0.27811133071608823.
[I 2026-07-14 18:37:43,929] Trial 31 finished with value: -0.18269605359723962 and parameters: {'scalers': 'none', 'ratios': 'norm_ratio', 'imputers': 'none', 'n_estimators': 2200, 'learning_rate': 0.09622583847725505, 'max_depth': 10, 'min_child_weight': 2, 'subsample': 0.5, 'colsample_bytree': 0.8, 'colsample_bylevel': 0.8, 'reg_alpha': 1.1969462233002423e-05, 'reg_lambda': 71.77408516728569, 'gamma': 1.6211984308474688e-05}. Best is trial 26 with value: -0.27811133071608823.
[I 2026-07-14 18:38:00,862] Trial 32 finished with value: -0.12812621346395225 and parameters: {'scalers': 'none', 'ratios': 'norm_ratio', 'imputers': 'none', 'n_estimators': 2250, 'learning_rate': 0.06335811645999964, 'max_depth': 10, 'min_child_weight': 2, 'subsample': 0.8, 'colsample_bytree': 0.8, 'colsample_bylevel': 0.8, 'reg_alpha': 1.3325251446072763e-05, 'reg_lambda': 25.89341297394316, 'gamma': 1.664083238587118e-05}. Best is trial 26 with value: -0.27811133071608823.
[I 2026-07-14 18:38:17,583] Trial 33 finished with value: -0.1605909728613996 and parameters: {'scalers': 'none', 'ratios': 'norm_ratio', 'imputers': 'none', 'n_estimators': 2200, 'learning_rate': 0.10705941848270308, 'max_depth': 10, 'min_child_weight': 2, 'subsample': 0.8, 'colsample_bytree': 0.8, 'colsample_bylevel': 0.8, 'reg_alpha': 1.2928573967179112e-05, 'reg_lambda': 88.87618377488575, 'gamma': 0.0002169369218805831}. Best is trial 26 with value: -0.27811133071608823.
[I 2026-07-14 18:38:34,674] Trial 34 finished with value: -0.15556037730599875 and parameters: {'scalers': 'none', 'ratios': 'norm_ratio', 'imputers': 'none', 'n_estimators': 2200, 'learning_rate': 0.09946900608458004, 'max_depth': 10, 'min_child_weight': 2, 'subsample': 0.8, 'colsample_bytree': 0.8, 'colsample_bylevel': 0.8, 'reg_alpha': 1.080768988663463e-05, 'reg_lambda': 47.81871067933811, 'gamma': 1.7611058445896944e-05}. Best is trial 26 with value: -0.27811133071608823.
[I 2026-07-14 18:38:54,049] Trial 35 finished with value: -0.1808107222496555 and parameters: {'scalers': 'none', 'ratios': 'norm_ratio', 'imputers': 'none', 'n_estimators': 2200, 'learning_rate': 0.14502855616163646, 'max_depth': 10, 'min_child_weight': 2, 'subsample': 0.8, 'colsample_bytree': 0.8, 'colsample_bylevel': 0.8, 'reg_alpha': 0.00010721121278713297, 'reg_lambda': 11.038906996404508, 'gamma': 0.00024102498958739415}. Best is trial 26 with value: -0.27811133071608823.
[I 2026-07-14 18:39:17,711] Trial 36 finished with value: -0.18185129668354905 and parameters: {'scalers': 'none', 'ratios': 'norm_ratio', 'imputers': 'none', 'n_estimators': 2700, 'learning_rate': 0.13571187865813525, 'max_depth': 10, 'min_child_weight': 2, 'subsample': 0.8, 'colsample_bytree': 0.8, 'colsample_bylevel': 0.8, 'reg_alpha': 0.00016794291332249215, 'reg_lambda': 11.566723748838628, 'gamma': 2.5041475198558264e-05}. Best is trial 26 with value: -0.27811133071608823.
[I 2026-07-14 18:39:36,799] Trial 37 finished with value: -0.10304798247531415 and parameters: {'scalers': 'none', 'ratios': 'norm_ratio', 'imputers': 'none', 'n_estimators': 2250, 'learning_rate': 0.028556500965927073, 'max_depth': 10, 'min_child_weight': 2, 'subsample': 0.8, 'colsample_bytree': 1.0, 'colsample_bylevel': 0.8, 'reg_alpha': 8.459024257982071e-05, 'reg_lambda': 10.901812638310838, 'gamma': 0.00019596383949853607}. Best is trial 26 with value: -0.27811133071608823.
[I 2026-07-14 18:40:09,354] Trial 38 finished with value: -0.19542803656536237 and parameters: {'scalers': 'none', 'ratios': 'norm_ratio', 'imputers': 'none', 'n_estimators': 2650, 'learning_rate': 0.16971535208569863, 'max_depth': 10, 'min_child_weight': 2, 'subsample': 0.8, 'colsample_bytree': 1.0, 'colsample_bylevel': 1.0, 'reg_alpha': 8.574920149590822e-05, 'reg_lambda': 10.71322506133279, 'gamma': 0.00012932276135908523}. Best is trial 26 with value: -0.27811133071608823.
[I 2026-07-14 18:40:40,228] Trial 39 finished with value: -0.140812684265757 and parameters: {'scalers': 'none', 'ratios': 'norm_ratio', 'imputers': 'none', 'n_estimators': 2700, 'learning_rate': 0.17626285396310207, 'max_depth': 10, 'min_child_weight': 5, 'subsample': 0.8, 'colsample_bytree': 1.0, 'colsample_bylevel': 1.0, 'reg_alpha': 0.00020940098335662163, 'reg_lambda': 11.710511050794171, 'gamma': 0.00020070849571212498}. Best is trial 26 with value: -0.27811133071608823.
[I 2026-07-14 18:41:11,165] Trial 40 finished with value: -0.13815494721137753 and parameters: {'scalers': 'none', 'ratios': 'norm_ratio', 'imputers': 'none', 'n_estimators': 2700, 'learning_rate': 0.17096938970041065, 'max_depth': 10, 'min_child_weight': 5, 'subsample': 0.8, 'colsample_bytree': 1.0, 'colsample_bylevel': 1.0, 'reg_alpha': 0.00019166732449906506, 'reg_lambda': 6.300445069552341, 'gamma': 0.00018942076637345183}. Best is trial 26 with value: -0.27811133071608823.
[I 2026-07-14 18:41:41,559] Trial 41 finished with value: -0.11461148142000929 and parameters: {'scalers': 'none', 'ratios': 'norm_ratio', 'imputers': 'none', 'n_estimators': 2750, 'learning_rate': 0.025882115654935332, 'max_depth': 11, 'min_child_weight': 5, 'subsample': 0.5, 'colsample_bytree': 1.0, 'colsample_bylevel': 1.0, 'reg_alpha': 0.00014080322960445765, 'reg_lambda': 5.080318911534545, 'gamma': 0.00010711480327017057}. Best is trial 26 with value: -0.27811133071608823.
[I 2026-07-14 18:42:05,648] Trial 42 finished with value: -0.1494941976229561 and parameters: {'scalers': 'none', 'ratios': 'norm_ratio', 'imputers': 'none', 'n_estimators': 2700, 'learning_rate': 0.1698221569594833, 'max_depth': 9, 'min_child_weight': 5, 'subsample': 0.5, 'colsample_bytree': 1.0, 'colsample_bylevel': 1.0, 'reg_alpha': 0.00010879174344593239, 'reg_lambda': 7.649048395173679, 'gamma': 0.0002252012098351897}. Best is trial 26 with value: -0.27811133071608823.
[I 2026-07-14 18:42:24,611] Trial 43 finished with value: -0.08839799139323412 and parameters: {'scalers': 'none', 'ratios': 'norm_ratio', 'imputers': 'none', 'n_estimators': 2700, 'learning_rate': 0.030572384368698823, 'max_depth': 9, 'min_child_weight': 5, 'subsample': 0.5, 'colsample_bytree': 1.0, 'colsample_bylevel': 1.0, 'reg_alpha': 8.107033813157415e-05, 'reg_lambda': 0.08171029873473262, 'gamma': 0.00011668728462564155}. Best is trial 26 with value: -0.27811133071608823.
[I 2026-07-14 18:42:43,653] Trial 44 finished with value: -0.09200226939414445 and parameters: {'scalers': 'none', 'ratios': 'norm_ratio', 'imputers': 'mean', 'n_estimators': 2700, 'learning_rate': 0.03706609381860929, 'max_depth': 9, 'min_child_weight': 5, 'subsample': 0.5, 'colsample_bytree': 1.0, 'colsample_bylevel': 1.0, 'reg_alpha': 4.459576107864827e-06, 'reg_lambda': 0.06592948193283471, 'gamma': 5.93418262265054e-05}. Best is trial 26 with value: -0.27811133071608823.
