[I 2026-07-14 16:55:21,472] Trial 90 finished with value: -0.18965066833929575 and parameters: {'scalers': 'robust', 'ratios': 'norm_ratio', 'imputers': 'median', 'n_estimators': 1250, 'learning_rate': 0.22837250593091485, 'max_depth': 7, 'min_child_weight': 1, 'subsample': 0.6, 'colsample_bytree': 0.7, 'colsample_bylevel': 0.5, 'reg_alpha': 0.04459061520978771, 'reg_lambda': 0.010715567430126322, 'gamma': 0.2749758906227841}. Best is trial 47 with value: -0.32292470051545075.
[I 2026-07-14 16:55:26,606] Trial 91 finished with value: -0.17874538704515508 and parameters: {'scalers': 'robust', 'ratios': 'norm_ratio', 'imputers': 'median', 'n_estimators': 1300, 'learning_rate': 0.22544770178707627, 'max_depth': 7, 'min_child_weight': 1, 'subsample': 0.6, 'colsample_bytree': 0.7, 'colsample_bylevel': 0.6, 'reg_alpha': 0.051734678285231955, 'reg_lambda': 10.659771411850908, 'gamma': 0.5929579476216575}. Best is trial 47 with value: -0.32292470051545075.
[I 2026-07-14 16:55:32,827] Trial 92 finished with value: -0.2010261659612549 and parameters: {'scalers': 'robust', 'ratios': 'norm_ratio', 'imputers': 'median', 'n_estimators': 1300, 'learning_rate': 0.49950481244841677, 'max_depth': 7, 'min_child_weight': 1, 'subsample': 0.6, 'colsample_bytree': 0.7, 'colsample_bylevel': 0.6, 'reg_alpha': 0.0002411881258735193, 'reg_lambda': 12.075001482018921, 'gamma': 0.2572005844366083}. Best is trial 47 with value: -0.32292470051545075.
[I 2026-07-14 16:55:40,098] Trial 93 finished with value: -0.18165543323850095 and parameters: {'scalers': 'robust', 'ratios': 'norm_ratio', 'imputers': 'median', 'n_estimators': 1300, 'learning_rate': 0.21954015868767437, 'max_depth': 7, 'min_child_weight': 1, 'subsample': 0.6, 'colsample_bytree': 0.9, 'colsample_bylevel': 0.6, 'reg_alpha': 0.010803991012159472, 'reg_lambda': 8.981899040718721, 'gamma': 0.2570197978055752}. Best is trial 47 with value: -0.32292470051545075.
[I 2026-07-14 16:55:53,355] Trial 94 finished with value: -0.4043228525685773 and parameters: {'scalers': 'robust', 'ratios': 'norm_ratio', 'imputers': 'median', 'n_estimators': 1250, 'learning_rate': 0.42301623268656496, 'max_depth': 7, 'min_child_weight': 1, 'subsample': 0.5, 'colsample_bytree': 0.9, 'colsample_bylevel': 0.6, 'reg_alpha': 0.00027984280822811706, 'reg_lambda': 10.144603585526625, 'gamma': 0.028500442081144026}. Best is trial 94 with value: -0.4043228525685773.
[I 2026-07-14 16:55:59,010] Trial 95 finished with value: -0.19720029546489734 and parameters: {'scalers': 'robust', 'ratios': 'norm_ratio', 'imputers': 'median', 'n_estimators': 1250, 'learning_rate': 0.49664422710070516, 'max_depth': 7, 'min_child_weight': 1, 'subsample': 0.5, 'colsample_bytree': 0.9, 'colsample_bylevel': 0.6, 'reg_alpha': 0.0003407578096164641, 'reg_lambda': 10.303158037192967, 'gamma': 0.6186617892681947}. Best is trial 94 with value: -0.4043228525685773.
[I 2026-07-14 16:56:00,500] Trial 96 finished with value: -0.19075244469461308 and parameters: {'scalers': 'standard', 'ratios': 'norm_ratio', 'imputers': 'median', 'n_estimators': 700, 'learning_rate': 0.4215817022054892, 'max_depth': 7, 'min_child_weight': 3, 'subsample': 0.5, 'colsample_bytree': 0.6, 'colsample_bylevel': 0.6, 'reg_alpha': 0.0004089230294414009, 'reg_lambda': 10.157039360559967, 'gamma': 0.5122587425307823}. Best is trial 94 with value: -0.4043228525685773.
[I 2026-07-14 16:56:04,345] Trial 97 finished with value: -0.19196487978288546 and parameters: {'scalers': 'standard', 'ratios': 'norm_ratio', 'imputers': 'median', 'n_estimators': 1250, 'learning_rate': 0.41573453377951397, 'max_depth': 7, 'min_child_weight': 7, 'subsample': 0.5, 'colsample_bytree': 0.6, 'colsample_bylevel': 0.6, 'reg_alpha': 0.0004465059111763797, 'reg_lambda': 0.00014384517832298732, 'gamma': 0.5797183216920216}. Best is trial 94 with value: -0.4043228525685773.
[I 2026-07-14 16:56:07,265] Trial 98 finished with value: -0.1860988450977119 and parameters: {'scalers': 'robust', 'ratios': 'norm_ratio', 'imputers': 'median', 'n_estimators': 700, 'learning_rate': 0.2990739671878012, 'max_depth': 7, 'min_child_weight': 3, 'subsample': 0.5, 'colsample_bytree': 0.8, 'colsample_bylevel': 0.6, 'reg_alpha': 0.0007158889320847683, 'reg_lambda': 5.230897949000316, 'gamma': 0.5413829626729628}. Best is trial 94 with value: -0.4043228525685773.
[I 2026-07-14 16:56:14,808] Trial 99 finished with value: -0.21926233835864473 and parameters: {'scalers': 'robust', 'ratios': 'norm_ratio', 'imputers': 'median', 'n_estimators': 1100, 'learning_rate': 0.31014686243928824, 'max_depth': 7, 'min_child_weight': 2, 'subsample': 0.8, 'colsample_bytree': 0.8, 'colsample_bylevel': 0.6, 'reg_alpha': 0.0007064637736044485, 'reg_lambda': 0.0002122681129586553, 'gamma': 0.02446209055305872}. Best is trial 94 with value: -0.4043228525685773.
[I 2026-07-14 16:56:21,246] Trial 100 finished with value: -0.26647598080996765 and parameters: {'scalers': 'robust', 'ratios': 'norm_ratio', 'imputers': 'median', 'n_estimators': 700, 'learning_rate': 0.3049413754473427, 'max_depth': 7, 'min_child_weight': 3, 'subsample': 0.5, 'colsample_bytree': 0.8, 'colsample_bylevel': 0.6, 'reg_alpha': 0.0006161626875671054, 'reg_lambda': 28.314004556583185, 'gamma': 0.025187935652935266}. Best is trial 94 with value: -0.4043228525685773.
[I 2026-07-14 16:56:24,518] Trial 101 finished with value: -0.24464040253518982 and parameters: {'scalers': 'standard', 'ratios': 'norm_ratio', 'imputers': 'median', 'n_estimators': 350, 'learning_rate': 0.3003610458304461, 'max_depth': 7, 'min_child_weight': 3, 'subsample': 0.5, 'colsample_bytree': 0.8, 'colsample_bylevel': 0.6, 'reg_alpha': 0.00044406723593479956, 'reg_lambda': 26.766334078344485, 'gamma': 0.02329897227274892}. Best is trial 94 with value: -0.4043228525685773.
[I 2026-07-14 16:56:35,171] Trial 102 finished with value: -0.2794061902465912 and parameters: {'scalers': 'standard', 'ratios': 'norm_ratio', 'imputers': 'median', 'n_estimators': 1100, 'learning_rate': 0.29645188695033137, 'max_depth': 7, 'min_child_weight': 3, 'subsample': 0.5, 'colsample_bytree': 0.9, 'colsample_bylevel': 0.6, 'reg_alpha': 0.0003889827998408515, 'reg_lambda': 28.266845604014105, 'gamma': 0.022822713086770825}. Best is trial 94 with value: -0.4043228525685773.
[I 2026-07-14 16:56:45,615] Trial 103 finished with value: -0.28393209505419775 and parameters: {'scalers': 'standard', 'ratios': 'norm_ratio', 'imputers': 'median', 'n_estimators': 1100, 'learning_rate': 0.30377434995633756, 'max_depth': 7, 'min_child_weight': 3, 'subsample': 0.5, 'colsample_bytree': 0.9, 'colsample_bylevel': 0.6, 'reg_alpha': 0.0005251213788605647, 'reg_lambda': 24.165602435982905, 'gamma': 0.02803251884624314}. Best is trial 94 with value: -0.4043228525685773.
[I 2026-07-14 16:56:54,947] Trial 104 finished with value: -0.2371541974576407 and parameters: {'scalers': 'standard', 'ratios': 'norm_ratio', 'imputers': 'mean', 'n_estimators': 1100, 'learning_rate': 0.3018848336701639, 'max_depth': 8, 'min_child_weight': 7, 'subsample': 0.5, 'colsample_bytree': 0.9, 'colsample_bylevel': 0.6, 'reg_alpha': 0.0007919486053294782, 'reg_lambda': 0.00031790272123326073, 'gamma': 0.02522669209274205}. Best is trial 94 with value: -0.4043228525685773.
[I 2026-07-14 16:57:05,612] Trial 105 finished with value: -0.2491127963537606 and parameters: {'scalers': 'robust', 'ratios': 'norm_ratio', 'imputers': 'mean', 'n_estimators': 1100, 'learning_rate': 0.30924394593564614, 'max_depth': 8, 'min_child_weight': 7, 'subsample': 0.5, 'colsample_bytree': 0.9, 'colsample_bylevel': 0.6, 'reg_alpha': 0.0006221559457145551, 'reg_lambda': 25.38687108750017, 'gamma': 0.02348956963272529}. Best is trial 94 with value: -0.4043228525685773.
[I 2026-07-14 16:57:16,149] Trial 106 finished with value: -0.2515571529018583 and parameters: {'scalers': 'standard', 'ratios': 'norm_ratio', 'imputers': 'mean', 'n_estimators': 1100, 'learning_rate': 0.3209007896559087, 'max_depth': 8, 'min_child_weight': 7, 'subsample': 0.5, 'colsample_bytree': 0.9, 'colsample_bylevel': 0.6, 'reg_alpha': 6.382026089406516e-05, 'reg_lambda': 30.582955436492988, 'gamma': 0.025555460082985402}. Best is trial 94 with value: -0.4043228525685773.
[I 2026-07-14 16:57:19,423] Trial 107 finished with value: -0.19265403701997363 and parameters: {'scalers': 'standard', 'ratios': 'norm_ratio', 'imputers': 'mean', 'n_estimators': 1100, 'learning_rate': 0.2899842945134986, 'max_depth': 3, 'min_child_weight': 7, 'subsample': 0.5, 'colsample_bytree': 0.9, 'colsample_bylevel': 0.6, 'reg_alpha': 0.0012822303055201943, 'reg_lambda': 26.311209782000116, 'gamma': 0.007792910329455562}. Best is trial 94 with value: -0.4043228525685773.
[I 2026-07-14 16:57:25,764] Trial 108 finished with value: -0.27004772543957123 and parameters: {'scalers': 'robust', 'ratios': 'norm_ratio', 'imputers': 'median', 'n_estimators': 1100, 'learning_rate': 0.4221473652688406, 'max_depth': 5, 'min_child_weight': 3, 'subsample': 0.5, 'colsample_bytree': 0.9, 'colsample_bylevel': 0.6, 'reg_alpha': 0.0014314965222888788, 'reg_lambda': 25.1208461560305, 'gamma': 0.008010669726043532}. Best is trial 94 with value: -0.4043228525685773.
[I 2026-07-14 16:57:27,944] Trial 109 finished with value: -0.2353947797764358 and parameters: {'scalers': 'standard', 'ratios': 'norm_ratio', 'imputers': 'median', 'n_estimators': 250, 'learning_rate': 0.2976498340423819, 'max_depth': 7, 'min_child_weight': 3, 'subsample': 0.5, 'colsample_bytree': 0.9, 'colsample_bylevel': 0.6, 'reg_alpha': 0.00018842347268635851, 'reg_lambda': 27.75157198243888, 'gamma': 0.024961071320120414}. Best is trial 94 with value: -0.4043228525685773.
[I 2026-07-14 16:57:35,621] Trial 110 finished with value: -0.21449358629440085 and parameters: {'scalers': 'standard', 'ratios': 'norm_ratio', 'imputers': 'mean', 'n_estimators': 2550, 'learning_rate': 0.4348947724685999, 'max_depth': 3, 'min_child_weight': 3, 'subsample': 0.5, 'colsample_bytree': 0.9, 'colsample_bylevel': 0.6, 'reg_alpha': 4.9261407853798885e-05, 'reg_lambda': 47.27375022049368, 'gamma': 0.041834769337884097}. Best is trial 94 with value: -0.4043228525685773.
[I 2026-07-14 16:57:46,827] Trial 111 finished with value: -0.3266975703889189 and parameters: {'scalers': 'standard', 'ratios': 'norm_ratio', 'imputers': 'mean', 'n_estimators': 1100, 'learning_rate': 0.4441478019207264, 'max_depth': 7, 'min_child_weight': 3, 'subsample': 0.5, 'colsample_bytree': 0.9, 'colsample_bylevel': 0.6, 'reg_alpha': 0.00020639773975361176, 'reg_lambda': 48.14902364315033, 'gamma': 0.008219748745464921}. Best is trial 94 with value: -0.4043228525685773.
[I 2026-07-14 16:57:58,871] Trial 112 finished with value: -0.28178258680770313 and parameters: {'scalers': 'standard', 'ratios': 'norm_ratio', 'imputers': 'none', 'n_estimators': 1100, 'learning_rate': 0.4232590060250455, 'max_depth': 7, 'min_child_weight': 3, 'subsample': 0.5, 'colsample_bytree': 0.9, 'colsample_bylevel': 0.8, 'reg_alpha': 5.0202461068665924e-05, 'reg_lambda': 51.764539435247784, 'gamma': 0.04106165545294036}. Best is trial 94 with value: -0.4043228525685773.
[I 2026-07-14 16:58:23,554] Trial 113 finished with value: -0.353909745719574 and parameters: {'scalers': 'standard', 'ratios': 'norm_ratio', 'imputers': 'none', 'n_estimators': 2450, 'learning_rate': 0.41968851031242754, 'max_depth': 7, 'min_child_weight': 3, 'subsample': 0.5, 'colsample_bytree': 0.9, 'colsample_bylevel': 0.6, 'reg_alpha': 0.0012132115009447647, 'reg_lambda': 47.50544058704426, 'gamma': 0.007418082523441528}. Best is trial 94 with value: -0.4043228525685773.
[I 2026-07-14 16:58:30,601] Trial 114 finished with value: -0.27690041846305 and parameters: {'scalers': 'standard', 'ratios': 'norm_ratio', 'imputers': 'none', 'n_estimators': 1200, 'learning_rate': 0.4283228748466466, 'max_depth': 5, 'min_child_weight': 3, 'subsample': 0.5, 'colsample_bytree': 0.9, 'colsample_bylevel': 0.6, 'reg_alpha': 0.00017608874820270755, 'reg_lambda': 47.44996661964242, 'gamma': 0.008120362617603773}. Best is trial 94 with value: -0.4043228525685773.
[I 2026-07-14 16:58:57,084] Trial 115 finished with value: -0.36086289575172054 and parameters: {'scalers': 'standard', 'ratios': 'norm_ratio', 'imputers': 'none', 'n_estimators': 2600, 'learning_rate': 0.41658861868264774, 'max_depth': 7, 'min_child_weight': 3, 'subsample': 0.5, 'colsample_bytree': 0.9, 'colsample_bylevel': 0.6, 'reg_alpha': 1.4824119866194029e-06, 'reg_lambda': 59.414116337758635, 'gamma': 0.002769827640215414}. Best is trial 94 with value: -0.4043228525685773.
[I 2026-07-14 16:59:04,196] Trial 116 finished with value: -0.2693068588078369 and parameters: {'scalers': 'robust', 'ratios': 'norm_ratio', 'imputers': 'none', 'n_estimators': 1200, 'learning_rate': 0.4129248632954587, 'max_depth': 5, 'min_child_weight': 3, 'subsample': 0.5, 'colsample_bytree': 0.9, 'colsample_bylevel': 0.6, 'reg_alpha': 0.0002483259591790689, 'reg_lambda': 48.90713126887265, 'gamma': 0.008063810498361738}. Best is trial 94 with value: -0.4043228525685773.
[I 2026-07-14 16:59:11,782] Trial 117 finished with value: -0.30773363240514784 and parameters: {'scalers': 'robust', 'ratios': 'norm_ratio', 'imputers': 'none', 'n_estimators': 1650, 'learning_rate': 0.4098668142355449, 'max_depth': 5, 'min_child_weight': 2, 'subsample': 0.5, 'colsample_bytree': 0.5, 'colsample_bylevel': 0.7, 'reg_alpha': 7.0912718229058685e-06, 'reg_lambda': 42.34909696110996, 'gamma': 0.0034972100044480914}. Best is trial 94 with value: -0.4043228525685773.
[I 2026-07-14 16:59:19,049] Trial 118 finished with value: -0.2890152608363684 and parameters: {'scalers': 'robust', 'ratios': 'norm_ratio', 'imputers': 'median', 'n_estimators': 1200, 'learning_rate': 0.4152992359360788, 'max_depth': 5, 'min_child_weight': 2, 'subsample': 0.5, 'colsample_bytree': 0.9, 'colsample_bylevel': 0.6, 'reg_alpha': 1.6493848030279282e-06, 'reg_lambda': 45.15642051169852, 'gamma': 0.003643212990406875}. Best is trial 94 with value: -0.4043228525685773.
[I 2026-07-14 16:59:24,304] Trial 119 finished with value: -0.2439675630058257 and parameters: {'scalers': 'robust', 'ratios': 'norm_ratio', 'imputers': 'none', 'n_estimators': 1200, 'learning_rate': 0.423245973669146, 'max_depth': 4, 'min_child_weight': 2, 'subsample': 0.5, 'colsample_bytree': 0.9, 'colsample_bylevel': 0.6, 'reg_alpha': 0.00018162545100996165, 'reg_lambda': 44.75447612483235, 'gamma': 0.003408368090700586}. Best is trial 94 with value: -0.4043228525685773.
[I 2026-07-14 16:59:38,537] Trial 120 finished with value: -0.36650618484524883 and parameters: {'scalers': 'robust', 'ratios': 'norm_ratio', 'imputers': 'none', 'n_estimators': 1200, 'learning_rate': 0.42430153849965463, 'max_depth': 7, 'min_child_weight': 2, 'subsample': 0.5, 'colsample_bytree': 0.9, 'colsample_bylevel': 0.7, 'reg_alpha': 1.6678605318162497e-06, 'reg_lambda': 54.02333596064942, 'gamma': 0.003078855264025517}. Best is trial 94 with value: -0.4043228525685773.
[I 2026-07-14 16:59:47,711] Trial 121 finished with value: -0.2838209220914533 and parameters: {'scalers': 'standard', 'ratios': 'norm_ratio', 'imputers': 'none', 'n_estimators': 1200, 'learning_rate': 0.41355436740413043, 'max_depth': 5, 'min_child_weight': 2, 'subsample': 0.5, 'colsample_bytree': 0.9, 'colsample_bylevel': 0.9, 'reg_alpha': 1.7751796288523387e-06, 'reg_lambda': 53.0277342634587, 'gamma': 0.0019476288308503795}. Best is trial 94 with value: -0.4043228525685773.
[I 2026-07-14 17:00:08,679] Trial 122 finished with value: -0.31572804232590757 and parameters: {'scalers': 'standard', 'ratios': 'norm_ratio', 'imputers': 'none', 'n_estimators': 2950, 'learning_rate': 0.39976420133204404, 'max_depth': 5, 'min_child_weight': 2, 'subsample': 0.5, 'colsample_bytree': 0.9, 'colsample_bylevel': 0.8, 'reg_alpha': 7.35294361148274e-05, 'reg_lambda': 52.510573755161694, 'gamma': 0.0033881355839864916}. Best is trial 94 with value: -0.4043228525685773.
[I 2026-07-14 17:00:28,525] Trial 123 finished with value: -0.31555395050516777 and parameters: {'scalers': 'standard', 'ratios': 'norm_ratio', 'imputers': 'none', 'n_estimators': 2800, 'learning_rate': 0.4024199079783197, 'max_depth': 5, 'min_child_weight': 2, 'subsample': 0.5, 'colsample_bytree': 0.9, 'colsample_bylevel': 0.8, 'reg_alpha': 0.00019457667272597387, 'reg_lambda': 46.674349270186475, 'gamma': 0.0026517213840638893}. Best is trial 94 with value: -0.4043228525685773.
[I 2026-07-14 17:00:43,599] Trial 124 finished with value: -0.23379359459465787 and parameters: {'scalers': 'standard', 'ratios': 'norm_ratio', 'imputers': 'none', 'n_estimators': 3000, 'learning_rate': 0.26095657397872324, 'max_depth': 4, 'min_child_weight': 2, 'subsample': 0.5, 'colsample_bytree': 0.9, 'colsample_bylevel': 0.8, 'reg_alpha': 7.305613000356515e-05, 'reg_lambda': 72.36222638651158, 'gamma': 0.003368249498966695}. Best is trial 94 with value: -0.4043228525685773.
[I 2026-07-14 17:00:58,311] Trial 125 finished with value: -0.26911394211377276 and parameters: {'scalers': 'standard', 'ratios': 'norm_ratio', 'imputers': 'none', 'n_estimators': 2950, 'learning_rate': 0.40011461573162804, 'max_depth': 4, 'min_child_weight': 2, 'subsample': 0.5, 'colsample_bytree': 0.9, 'colsample_bylevel': 0.8, 'reg_alpha': 1.5526900826070094e-06, 'reg_lambda': 49.26705510533068, 'gamma': 0.0033641846550839954}. Best is trial 94 with value: -0.4043228525685773.
[I 2026-07-14 17:01:12,715] Trial 126 finished with value: -0.23637057536416844 and parameters: {'scalers': 'robust', 'ratios': 'norm_ratio', 'imputers': 'none', 'n_estimators': 2900, 'learning_rate': 0.25580775261717226, 'max_depth': 4, 'min_child_weight': 2, 'subsample': 0.5, 'colsample_bytree': 0.9, 'colsample_bylevel': 0.8, 'reg_alpha': 2.125166686412631e-06, 'reg_lambda': 52.59710486007323, 'gamma': 0.002286207525534372}. Best is trial 94 with value: -0.4043228525685773.
[I 2026-07-14 17:01:23,513] Trial 127 finished with value: -0.2280151556910147 and parameters: {'scalers': 'robust', 'ratios': 'norm_ratio', 'imputers': 'none', 'n_estimators': 2150, 'learning_rate': 0.27077278807410604, 'max_depth': 4, 'min_child_weight': 2, 'subsample': 0.5, 'colsample_bytree': 0.9, 'colsample_bylevel': 0.8, 'reg_alpha': 1.5648469781091578e-06, 'reg_lambda': 68.57764515515763, 'gamma': 0.0014982670678260045}. Best is trial 94 with value: -0.4043228525685773.
[I 2026-07-14 17:01:50,992] Trial 128 finished with value: -0.30893437074807484 and parameters: {'scalers': 'robust', 'ratios': 'norm_ratio', 'imputers': 'none', 'n_estimators': 2900, 'learning_rate': 0.25600897499888625, 'max_depth': 6, 'min_child_weight': 2, 'subsample': 0.5, 'colsample_bytree': 0.9, 'colsample_bylevel': 0.8, 'reg_alpha': 1.8296905125277688e-06, 'reg_lambda': 71.27795418380599, 'gamma': 0.001391816193010994}. Best is trial 94 with value: -0.4043228525685773.
[I 2026-07-14 17:02:11,791] Trial 129 finished with value: -0.2719081390016535 and parameters: {'scalers': 'standard', 'ratios': 'norm_ratio', 'imputers': 'none', 'n_estimators': 2950, 'learning_rate': 0.26256742939372596, 'max_depth': 5, 'min_child_weight': 2, 'subsample': 0.5, 'colsample_bytree': 0.9, 'colsample_bylevel': 0.8, 'reg_alpha': 6.078060329200794e-06, 'reg_lambda': 73.09043211383732, 'gamma': 0.0025490838234315423}. Best is trial 94 with value: -0.4043228525685773.
[I 2026-07-14 17:02:26,332] Trial 130 finished with value: -0.1720471951270831 and parameters: {'scalers': 'standard', 'ratios': 'norm_ratio', 'imputers': 'none', 'n_estimators': 2200, 'learning_rate': 0.0013755910402529015, 'max_depth': 5, 'min_child_weight': 2, 'subsample': 0.5, 'colsample_bytree': 0.9, 'colsample_bylevel': 0.8, 'reg_alpha': 1.7696051702678173e-06, 'reg_lambda': 66.74898177151097, 'gamma': 0.002248808464904879}. Best is trial 94 with value: -0.4043228525685773.
[I 2026-07-14 17:02:51,003] Trial 131 finished with value: -0.2688505754020263 and parameters: {'scalers': 'standard', 'ratios': 'norm_ratio', 'imputers': 'none', 'n_estimators': 2750, 'learning_rate': 0.24768489431618418, 'max_depth': 5, 'min_child_weight': 2, 'subsample': 0.5, 'colsample_bytree': 0.9, 'colsample_bylevel': 0.8, 'reg_alpha': 6.444732220758715e-06, 'reg_lambda': 72.6754658190084, 'gamma': 0.001264071926751113}. Best is trial 94 with value: -0.4043228525685773.
[I 2026-07-14 17:03:05,675] Trial 132 finished with value: -0.25611804914146075 and parameters: {'scalers': 'standard', 'ratios': 'norm_ratio', 'imputers': 'none', 'n_estimators': 2900, 'learning_rate': 0.18179092589820808, 'max_depth': 5, 'min_child_weight': 2, 'subsample': 0.5, 'colsample_bytree': 0.9, 'colsample_bylevel': 0.8, 'reg_alpha': 8.652905949473815e-06, 'reg_lambda': 65.98209102028991, 'gamma': 0.0013799967865491226}. Best is trial 94 with value: -0.4043228525685773.
[I 2026-07-14 17:03:26,544] Trial 133 finished with value: -0.17064384616134137 and parameters: {'scalers': 'standard', 'ratios': 'norm_ratio', 'imputers': 'none', 'n_estimators': 2850, 'learning_rate': 0.002329817330213354, 'max_depth': 5, 'min_child_weight': 2, 'subsample': 0.5, 'colsample_bytree': 0.9, 'colsample_bylevel': 0.9, 'reg_alpha': 6.720718821628753e-06, 'reg_lambda': 66.30479862068125, 'gamma': 0.0016883935498778328}. Best is trial 94 with value: -0.4043228525685773.
[I 2026-07-14 17:03:45,839] Trial 134 finished with value: -0.29473871754227465 and parameters: {'scalers': 'standard', 'ratios': 'norm_ratio', 'imputers': 'none', 'n_estimators': 2500, 'learning_rate': 0.36269124456706714, 'max_depth': 5, 'min_child_weight': 2, 'subsample': 0.5, 'colsample_bytree': 0.9, 'colsample_bylevel': 0.9, 'reg_alpha': 7.77187075821755e-06, 'reg_lambda': 93.22386205517962, 'gamma': 0.0011238181594385426}. Best is trial 94 with value: -0.4043228525685773.
