[I 2026-07-14 17:10:21,209] Trial 90 finished with value: -0.32578131058216875 and parameters: {'scalers': 'standard', 'ratios': 'norm_ratio', 'imputers': 'mean', 'n_estimators': 1250, 'learning_rate': 0.11648860432593412, 'max_depth': 9, 'min_child_weight': 1, 'subsample': 0.5, 'colsample_bytree': 1.0, 'colsample_bylevel': 0.6, 'reg_alpha': 1.2700487080903202, 'reg_lambda': 0.33084947667771875, 'gamma': 4.787403094274917e-05}. Best is trial 76 with value: -0.6637225783962517.
[I 2026-07-14 17:10:42,786] Trial 92 finished with value: -0.19479854503803148 and parameters: {'scalers': 'standard', 'ratios': 'norm_ratio', 'imputers': 'mean', 'n_estimators': 1100, 'learning_rate': 0.11023591542722588, 'max_depth': 9, 'min_child_weight': 2, 'subsample': 0.5, 'colsample_bytree': 1.0, 'colsample_bylevel': 0.6, 'reg_alpha': 40.26132284705946, 'reg_lambda': 0.26422848983473474, 'gamma': 6.12682517407197e-06}. Best is trial 76 with value: -0.6637225783962517.
[I 2026-07-14 17:10:43,619] Trial 91 finished with value: -0.2935811470324502 and parameters: {'scalers': 'standard', 'ratios': 'norm_ratio', 'imputers': 'mean', 'n_estimators': 1350, 'learning_rate': 0.12636669090516564, 'max_depth': 9, 'min_child_weight': 2, 'subsample': 0.5, 'colsample_bytree': 1.0, 'colsample_bylevel': 0.6, 'reg_alpha': 1.293918170891031, 'reg_lambda': 0.24143651240619984, 'gamma': 6.211485486889447e-06}. Best is trial 76 with value: -0.6637225783962517.
[I 2026-07-14 17:10:48,174] Trial 93 finished with value: -0.20410802463026084 and parameters: {'scalers': 'standard', 'ratios': 'norm_ratio', 'imputers': 'mean', 'n_estimators': 1250, 'learning_rate': 0.36223620665701073, 'max_depth': 9, 'min_child_weight': 2, 'subsample': 0.5, 'colsample_bytree': 1.0, 'colsample_bylevel': 0.6, 'reg_alpha': 16.249667272793452, 'reg_lambda': 0.33908690759893845, 'gamma': 6.086088426026959e-06}. Best is trial 76 with value: -0.6637225783962517.
[I 2026-07-14 17:10:51,902] Trial 94 finished with value: -0.19010049536331 and parameters: {'scalers': 'standard', 'ratios': 'norm_ratio', 'imputers': 'mean', 'n_estimators': 1200, 'learning_rate': 0.11756418187454266, 'max_depth': 9, 'min_child_weight': 2, 'subsample': 0.5, 'colsample_bytree': 0.7, 'colsample_bylevel': 0.6, 'reg_alpha': 14.503501936301623, 'reg_lambda': 0.05975111011301371, 'gamma': 5.44328358141804e-05}. Best is trial 76 with value: -0.6637225783962517.
[I 2026-07-14 17:11:04,869] Trial 95 finished with value: -0.36740781967245745 and parameters: {'scalers': 'standard', 'ratios': 'norm_ratio', 'imputers': 'mean', 'n_estimators': 1050, 'learning_rate': 0.36149774605372004, 'max_depth': 9, 'min_child_weight': 2, 'subsample': 0.5, 'colsample_bytree': 0.7, 'colsample_bylevel': 0.6, 'reg_alpha': 0.44861277552276996, 'reg_lambda': 0.031124602995703823, 'gamma': 5.84723698173647e-06}. Best is trial 76 with value: -0.6637225783962517.
[I 2026-07-14 17:11:05,838] Trial 96 finished with value: -0.19817385775841329 and parameters: {'scalers': 'standard', 'ratios': 'norm_ratio', 'imputers': 'mean', 'n_estimators': 1150, 'learning_rate': 0.3714133916106101, 'max_depth': 3, 'min_child_weight': 2, 'subsample': 0.5, 'colsample_bytree': 0.7, 'colsample_bylevel': 0.6, 'reg_alpha': 35.44076448560225, 'reg_lambda': 0.030154142324900438, 'gamma': 5.2651240324063446e-05}. Best is trial 76 with value: -0.6637225783962517.
[I 2026-07-14 17:11:07,379] Trial 97 finished with value: -0.20582202233087404 and parameters: {'scalers': 'standard', 'ratios': 'norm_ratio', 'imputers': 'mean', 'n_estimators': 1100, 'learning_rate': 0.3520627538190346, 'max_depth': 8, 'min_child_weight': 2, 'subsample': 0.5, 'colsample_bytree': 0.7, 'colsample_bylevel': 0.6, 'reg_alpha': 84.68607984368167, 'reg_lambda': 0.06836669210986901, 'gamma': 4.661342349583063e-05}. Best is trial 76 with value: -0.6637225783962517.
[I 2026-07-14 17:11:08,622] Trial 98 finished with value: -0.19931694083000762 and parameters: {'scalers': 'standard', 'ratios': 'norm_ratio', 'imputers': 'mean', 'n_estimators': 700, 'learning_rate': 0.3685805008054592, 'max_depth': 8, 'min_child_weight': 2, 'subsample': 0.5, 'colsample_bytree': 1.0, 'colsample_bylevel': 0.6, 'reg_alpha': 35.071171958270035, 'reg_lambda': 0.03595267922974581, 'gamma': 1.5714394926443958e-06}. Best is trial 76 with value: -0.6637225783962517.
[I 2026-07-14 17:11:19,738] Trial 99 finished with value: -0.31058686885237413 and parameters: {'scalers': 'standard', 'ratios': 'norm_ratio', 'imputers': 'mean', 'n_estimators': 1350, 'learning_rate': 0.3426362919936103, 'max_depth': 8, 'min_child_weight': 2, 'subsample': 0.5, 'colsample_bytree': 0.7, 'colsample_bylevel': 0.6, 'reg_alpha': 4.239671450822412, 'reg_lambda': 0.024562423996940582, 'gamma': 1.535890840547851e-06}. Best is trial 76 with value: -0.6637225783962517.
[I 2026-07-14 17:11:31,364] Trial 100 finished with value: -0.34988525829930306 and parameters: {'scalers': 'standard', 'ratios': 'norm_ratio', 'imputers': 'mean', 'n_estimators': 1200, 'learning_rate': 0.3777499041150925, 'max_depth': 8, 'min_child_weight': 2, 'subsample': 0.5, 'colsample_bytree': 0.7, 'colsample_bylevel': 0.6, 'reg_alpha': 0.3862236507532469, 'reg_lambda': 0.03574904628437129, 'gamma': 1.5718343199393043e-06}. Best is trial 76 with value: -0.6637225783962517.
[I 2026-07-14 17:11:38,786] Trial 101 finished with value: -0.2757614043083306 and parameters: {'scalers': 'standard', 'ratios': 'norm_ratio', 'imputers': 'mean', 'n_estimators': 1000, 'learning_rate': 0.3590275454116722, 'max_depth': 8, 'min_child_weight': 2, 'subsample': 0.5, 'colsample_bytree': 0.7, 'colsample_bylevel': 0.6, 'reg_alpha': 5.36139425994383, 'reg_lambda': 0.029696365764402186, 'gamma': 1.5387711734516396e-06}. Best is trial 76 with value: -0.6637225783962517.
[I 2026-07-14 17:11:54,723] Trial 102 finished with value: -0.33019070253145577 and parameters: {'scalers': 'standard', 'ratios': 'norm_ratio', 'imputers': 'mean', 'n_estimators': 1950, 'learning_rate': 0.3610534580100066, 'max_depth': 8, 'min_child_weight': 2, 'subsample': 0.5, 'colsample_bytree': 0.7, 'colsample_bylevel': 0.6, 'reg_alpha': 4.2302484582974405, 'reg_lambda': 0.015377683713648213, 'gamma': 1.768161229653447e-06}. Best is trial 76 with value: -0.6637225783962517.
[I 2026-07-14 17:12:19,015] Trial 103 finished with value: -0.34346974089125903 and parameters: {'scalers': 'standard', 'ratios': 'norm_ratio', 'imputers': 'mean', 'n_estimators': 1950, 'learning_rate': 0.34622145085086475, 'max_depth': 8, 'min_child_weight': 2, 'subsample': 0.6, 'colsample_bytree': 1.0, 'colsample_bylevel': 0.6, 'reg_alpha': 0.4197509991001183, 'reg_lambda': 0.013137614298798188, 'gamma': 1.5853389096739783e-06}. Best is trial 76 with value: -0.6637225783962517.
[I 2026-07-14 17:12:30,411] Trial 104 finished with value: -0.27956396751209994 and parameters: {'scalers': 'standard', 'ratios': 'norm_ratio', 'imputers': 'mean', 'n_estimators': 850, 'learning_rate': 0.2798966829873061, 'max_depth': 8, 'min_child_weight': 1, 'subsample': 0.6, 'colsample_bytree': 1.0, 'colsample_bylevel': 0.6, 'reg_alpha': 3.4915271785651476, 'reg_lambda': 2.8307565010065104e-05, 'gamma': 1.5775936381704372e-06}. Best is trial 76 with value: -0.6637225783962517.
[I 2026-07-14 17:12:31,356] Trial 105 finished with value: -0.22997797835853576 and parameters: {'scalers': 'standard', 'ratios': 'norm_ratio', 'imputers': 'mean', 'n_estimators': 900, 'learning_rate': 0.28535872858396255, 'max_depth': 8, 'min_child_weight': 1, 'subsample': 0.6, 'colsample_bytree': 1.0, 'colsample_bylevel': 0.6, 'reg_alpha': 4.245443635927064, 'reg_lambda': 4.369854679913221, 'gamma': 99.33647200702676}. Best is trial 76 with value: -0.6637225783962517.
[I 2026-07-14 17:13:02,715] Trial 106 finished with value: -0.30452906133440266 and parameters: {'scalers': 'standard', 'ratios': 'norm_ratio', 'imputers': 'mean', 'n_estimators': 2600, 'learning_rate': 0.29027445916013755, 'max_depth': 8, 'min_child_weight': 1, 'subsample': 0.6, 'colsample_bytree': 1.0, 'colsample_bylevel': 0.6, 'reg_alpha': 4.257534364612933, 'reg_lambda': 9.590835592922991, 'gamma': 1.948385667829706e-06}. Best is trial 76 with value: -0.6637225783962517.
[I 2026-07-14 17:13:06,787] Trial 107 finished with value: -0.19602491588876586 and parameters: {'scalers': 'standard', 'ratios': 'norm_ratio', 'imputers': 'mean', 'n_estimators': 2600, 'learning_rate': 0.27637776819409454, 'max_depth': 8, 'min_child_weight': 1, 'subsample': 0.6, 'colsample_bytree': 1.0, 'colsample_bylevel': 0.6, 'reg_alpha': 0.13861160095498584, 'reg_lambda': 0.011089838100359885, 'gamma': 6.641237839884803}. Best is trial 76 with value: -0.6637225783962517.
[I 2026-07-14 17:13:36,080] Trial 108 finished with value: -0.30556217850532247 and parameters: {'scalers': 'standard', 'ratios': 'norm_ratio', 'imputers': 'mean', 'n_estimators': 1900, 'learning_rate': 0.27804973119107623, 'max_depth': 8, 'min_child_weight': 1, 'subsample': 0.6, 'colsample_bytree': 1.0, 'colsample_bylevel': 1.0, 'reg_alpha': 0.16156507524489103, 'reg_lambda': 2.3232701573962015e-05, 'gamma': 2.019837244641538e-06}. Best is trial 76 with value: -0.6637225783962517.
[I 2026-07-14 17:13:39,384] Trial 109 finished with value: -0.20015557729377748 and parameters: {'scalers': 'standard', 'ratios': 'norm_ratio', 'imputers': 'mean', 'n_estimators': 1900, 'learning_rate': 0.28023019208384764, 'max_depth': 8, 'min_child_weight': 1, 'subsample': 0.6, 'colsample_bytree': 1.0, 'colsample_bylevel': 1.0, 'reg_alpha': 0.13703696186242237, 'reg_lambda': 0.012221673448461748, 'gamma': 10.161422616237807}. Best is trial 76 with value: -0.6637225783962517.
[I 2026-07-14 17:14:08,798] Trial 110 finished with value: -0.3004986050806551 and parameters: {'scalers': 'standard', 'ratios': 'norm_ratio', 'imputers': 'mean', 'n_estimators': 1900, 'learning_rate': 0.26366041303690396, 'max_depth': 8, 'min_child_weight': 1, 'subsample': 0.6, 'colsample_bytree': 1.0, 'colsample_bylevel': 1.0, 'reg_alpha': 0.15506828439524392, 'reg_lambda': 1.4815717539720117e-05, 'gamma': 8.654512864546476e-06}. Best is trial 76 with value: -0.6637225783962517.
[I 2026-07-14 17:14:13,327] Trial 111 finished with value: -0.20196436448668503 and parameters: {'scalers': 'standard', 'ratios': 'norm_ratio', 'imputers': 'mean', 'n_estimators': 2600, 'learning_rate': 0.28596764321478546, 'max_depth': 7, 'min_child_weight': 1, 'subsample': 0.6, 'colsample_bytree': 1.0, 'colsample_bylevel': 1.0, 'reg_alpha': 0.8794424394665915, 'reg_lambda': 5.338032432813114, 'gamma': 12.366175371671845}. Best is trial 76 with value: -0.6637225783962517.
[I 2026-07-14 17:14:30,485] Trial 112 finished with value: -0.27850448760473273 and parameters: {'scalers': 'none', 'ratios': 'norm_ratio', 'imputers': 'mean', 'n_estimators': 1450, 'learning_rate': 0.2508445952233452, 'max_depth': 7, 'min_child_weight': 1, 'subsample': 0.5, 'colsample_bytree': 1.0, 'colsample_bylevel': 1.0, 'reg_alpha': 0.1627095626385309, 'reg_lambda': 1.61573126277812e-05, 'gamma': 9.047910306945083e-06}. Best is trial 76 with value: -0.6637225783962517.
[I 2026-07-14 17:14:49,850] Trial 113 finished with value: -0.27875790615497736 and parameters: {'scalers': 'none', 'ratios': 'norm_ratio', 'imputers': 'mean', 'n_estimators': 1700, 'learning_rate': 0.2541739767330705, 'max_depth': 7, 'min_child_weight': 1, 'subsample': 0.5, 'colsample_bytree': 1.0, 'colsample_bylevel': 1.0, 'reg_alpha': 0.12564225690767936, 'reg_lambda': 1.2410737158563698e-05, 'gamma': 9.269084277255285e-06}. Best is trial 76 with value: -0.6637225783962517.
[I 2026-07-14 17:15:07,303] Trial 114 finished with value: -0.35985853428033354 and parameters: {'scalers': 'none', 'ratios': 'norm_ratio', 'imputers': 'mean', 'n_estimators': 1450, 'learning_rate': 0.4989682601262794, 'max_depth': 7, 'min_child_weight': 1, 'subsample': 0.5, 'colsample_bytree': 1.0, 'colsample_bylevel': 1.0, 'reg_alpha': 0.16653136525013168, 'reg_lambda': 7.913967806584531e-06, 'gamma': 8.98616224666848e-06}. Best is trial 76 with value: -0.6637225783962517.
[I 2026-07-14 17:15:32,959] Trial 115 finished with value: -0.18915051287896187 and parameters: {'scalers': 'none', 'ratios': 'norm_ratio', 'imputers': 'mean', 'n_estimators': 1500, 'learning_rate': 0.00277890161928071, 'max_depth': 7, 'min_child_weight': 1, 'subsample': 0.5, 'colsample_bytree': 1.0, 'colsample_bylevel': 1.0, 'reg_alpha': 0.8113792951386469, 'reg_lambda': 1.4314309047280006e-05, 'gamma': 4.525053916623167e-06}. Best is trial 76 with value: -0.6637225783962517.
[I 2026-07-14 17:15:54,318] Trial 116 finished with value: -0.46370973802961213 and parameters: {'scalers': 'none', 'ratios': 'norm_ratio', 'imputers': 'mean', 'n_estimators': 1400, 'learning_rate': 0.44235663868232883, 'max_depth': 7, 'min_child_weight': 1, 'subsample': 0.5, 'colsample_bytree': 1.0, 'colsample_bylevel': 0.9, 'reg_alpha': 0.8430571819681986, 'reg_lambda': 6.962211288898403e-06, 'gamma': 4.39878031265905e-06}. Best is trial 76 with value: -0.6637225783962517.
[I 2026-07-14 17:16:17,159] Trial 117 finished with value: -0.19736436926487366 and parameters: {'scalers': 'none', 'ratios': 'norm_ratio', 'imputers': 'mean', 'n_estimators': 1700, 'learning_rate': 0.0071126309098912795, 'max_depth': 7, 'min_child_weight': 1, 'subsample': 0.5, 'colsample_bytree': 0.9, 'colsample_bylevel': 0.9, 'reg_alpha': 0.7822020623647031, 'reg_lambda': 1.4751270773374681e-05, 'gamma': 9.240188739269364e-06}. Best is trial 76 with value: -0.6637225783962517.
[I 2026-07-14 17:16:31,753] Trial 118 finished with value: -0.4693656711116629 and parameters: {'scalers': 'none', 'ratios': 'norm_ratio', 'imputers': 'mean', 'n_estimators': 1450, 'learning_rate': 0.4378597840186376, 'max_depth': 7, 'min_child_weight': 1, 'subsample': 0.5, 'colsample_bytree': 1.0, 'colsample_bylevel': 0.5, 'reg_alpha': 0.8642703020651035, 'reg_lambda': 1.2647502307290963e-06, 'gamma': 4.757309052706511e-06}. Best is trial 76 with value: -0.6637225783962517.
[I 2026-07-14 17:16:46,214] Trial 119 finished with value: -0.19505383889303152 and parameters: {'scalers': 'none', 'ratios': 'norm_ratio', 'imputers': 'mean', 'n_estimators': 1450, 'learning_rate': 0.008488525518541406, 'max_depth': 7, 'min_child_weight': 1, 'subsample': 0.5, 'colsample_bytree': 1.0, 'colsample_bylevel': 0.5, 'reg_alpha': 2.058445619452451, 'reg_lambda': 1.2875730964779555e-06, 'gamma': 4.388636294996208e-06}. Best is trial 76 with value: -0.6637225783962517.
[I 2026-07-14 17:17:03,292] Trial 120 finished with value: -0.5004771566387042 and parameters: {'scalers': 'none', 'ratios': 'norm_ratio', 'imputers': 'mean', 'n_estimators': 1650, 'learning_rate': 0.4989498479226185, 'max_depth': 7, 'min_child_weight': 1, 'subsample': 0.5, 'colsample_bytree': 1.0, 'colsample_bylevel': 0.5, 'reg_alpha': 2.24606548191303, 'reg_lambda': 1.0291887969074258e-06, 'gamma': 3.9458340532167195e-06}. Best is trial 76 with value: -0.6637225783962517.
[I 2026-07-14 17:17:24,773] Trial 121 finished with value: -0.39824877208372894 and parameters: {'scalers': 'standard', 'ratios': 'norm_ratio', 'imputers': 'mean', 'n_estimators': 1500, 'learning_rate': 0.4479085734904411, 'max_depth': 10, 'min_child_weight': 1, 'subsample': 0.5, 'colsample_bytree': 1.0, 'colsample_bylevel': 0.5, 'reg_alpha': 0.06258169042824108, 'reg_lambda': 1.1634859632531514e-06, 'gamma': 4.4363879197035035e-06}. Best is trial 76 with value: -0.6637225783962517.
[I 2026-07-14 17:17:45,246] Trial 122 finished with value: -0.1966119235241186 and parameters: {'scalers': 'standard', 'ratios': 'norm_ratio', 'imputers': 'mean', 'n_estimators': 1500, 'learning_rate': 0.006241976592133882, 'max_depth': 9, 'min_child_weight': 1, 'subsample': 0.5, 'colsample_bytree': 0.9, 'colsample_bylevel': 0.5, 'reg_alpha': 2.163000651455832, 'reg_lambda': 1.5565385936012214e-06, 'gamma': 4.486998654090816e-06}. Best is trial 76 with value: -0.6637225783962517.
[I 2026-07-14 17:18:08,459] Trial 123 finished with value: -0.5658061926234577 and parameters: {'scalers': 'standard', 'ratios': 'norm_ratio', 'imputers': 'mean', 'n_estimators': 1550, 'learning_rate': 0.4319021259010807, 'max_depth': 9, 'min_child_weight': 1, 'subsample': 0.5, 'colsample_bytree': 0.9, 'colsample_bylevel': 0.5, 'reg_alpha': 2.176379635864822, 'reg_lambda': 1.7492184861381573e-06, 'gamma': 1.9644522345213697e-05}. Best is trial 76 with value: -0.6637225783962517.
[I 2026-07-14 17:18:23,461] Trial 124 finished with value: -0.2929491688991444 and parameters: {'scalers': 'none', 'ratios': 'norm_ratio', 'imputers': 'mean', 'n_estimators': 1650, 'learning_rate': 0.44582702410742064, 'max_depth': 7, 'min_child_weight': 8, 'subsample': 0.5, 'colsample_bytree': 0.9, 'colsample_bylevel': 0.9, 'reg_alpha': 1.4136561413801314e-06, 'reg_lambda': 3.346062655467166e-06, 'gamma': 2.2595268063040606e-05}. Best is trial 76 with value: -0.6637225783962517.
[I 2026-07-14 17:18:28,973] Trial 125 finished with value: -0.29333046120125367 and parameters: {'scalers': 'none', 'ratios': 'norm_ratio', 'imputers': 'mean', 'n_estimators': 1350, 'learning_rate': 0.43962904846082, 'max_depth': 5, 'min_child_weight': 1, 'subsample': 0.5, 'colsample_bytree': 0.5, 'colsample_bylevel': 0.9, 'reg_alpha': 0.07414114640718954, 'reg_lambda': 2.898411272666495e-06, 'gamma': 4.379309683914806e-06}. Best is trial 76 with value: -0.6637225783962517.
[I 2026-07-14 17:18:38,857] Trial 126 finished with value: -0.49424422573050414 and parameters: {'scalers': 'none', 'ratios': 'norm_ratio', 'imputers': 'mean', 'n_estimators': 1400, 'learning_rate': 0.4245286298102793, 'max_depth': 7, 'min_child_weight': 1, 'subsample': 0.5, 'colsample_bytree': 0.5, 'colsample_bylevel': 0.5, 'reg_alpha': 1.0545930061887727, 'reg_lambda': 2.8814469026770687e-06, 'gamma': 2.1159334692920173e-05}. Best is trial 76 with value: -0.6637225783962517.
[I 2026-07-14 17:18:49,285] Trial 127 finished with value: -0.362801561188958 and parameters: {'scalers': 'none', 'ratios': 'norm_ratio', 'imputers': 'median', 'n_estimators': 1400, 'learning_rate': 0.4207099237370825, 'max_depth': 7, 'min_child_weight': 1, 'subsample': 0.5, 'colsample_bytree': 0.9, 'colsample_bylevel': 0.5, 'reg_alpha': 0.05847303815170808, 'reg_lambda': 0.8551308900415094, 'gamma': 2.3040217263480864e-05}. Best is trial 76 with value: -0.6637225783962517.
[I 2026-07-14 17:19:00,193] Trial 128 finished with value: -0.3061226628867588 and parameters: {'scalers': 'none', 'ratios': 'norm_ratio', 'imputers': 'mean', 'n_estimators': 1550, 'learning_rate': 0.42791249043586965, 'max_depth': 7, 'min_child_weight': 1, 'subsample': 0.5, 'colsample_bytree': 1.0, 'colsample_bylevel': 0.5, 'reg_alpha': 1.9701253491285702e-06, 'reg_lambda': 3.3932257512411434e-06, 'gamma': 5.0924088622736856e-06}. Best is trial 76 with value: -0.6637225783962517.
[I 2026-07-14 17:19:13,998] Trial 129 finished with value: -0.4331523692199666 and parameters: {'scalers': 'none', 'ratios': 'norm_ratio', 'imputers': 'mean', 'n_estimators': 1350, 'learning_rate': 0.4509298530153019, 'max_depth': 10, 'min_child_weight': 1, 'subsample': 0.5, 'colsample_bytree': 0.5, 'colsample_bylevel': 0.5, 'reg_alpha': 3.7226179572434707e-06, 'reg_lambda': 1.6263066038788258e-06, 'gamma': 2.6692069656770313e-06}. Best is trial 76 with value: -0.6637225783962517.
[I 2026-07-14 17:19:38,559] Trial 130 finished with value: -0.6289184682810524 and parameters: {'scalers': 'none', 'ratios': 'norm_ratio', 'imputers': 'mean', 'n_estimators': 1350, 'learning_rate': 0.40255554331459775, 'max_depth': 12, 'min_child_weight': 1, 'subsample': 0.5, 'colsample_bytree': 0.5, 'colsample_bylevel': 0.5, 'reg_alpha': 1.2049004551528475, 'reg_lambda': 3.3074089969936936e-06, 'gamma': 2.3503858575359963e-06}. Best is trial 76 with value: -0.6637225783962517.
[I 2026-07-14 17:19:57,071] Trial 131 finished with value: -0.36080886144725943 and parameters: {'scalers': 'none', 'ratios': 'norm_ratio', 'imputers': 'median', 'n_estimators': 1350, 'learning_rate': 0.42414846397991196, 'max_depth': 10, 'min_child_weight': 1, 'subsample': 0.5, 'colsample_bytree': 1.0, 'colsample_bylevel': 0.5, 'reg_alpha': 1.971162433688634e-06, 'reg_lambda': 3.458506642421892e-06, 'gamma': 2.237196579976508e-05}. Best is trial 76 with value: -0.6637225783962517.
[I 2026-07-14 17:20:26,953] Trial 132 finished with value: -0.5654418757793268 and parameters: {'scalers': 'none', 'ratios': 'norm_ratio', 'imputers': 'median', 'n_estimators': 1400, 'learning_rate': 0.41937402233044396, 'max_depth': 10, 'min_child_weight': 1, 'subsample': 0.5, 'colsample_bytree': 1.0, 'colsample_bylevel': 0.5, 'reg_alpha': 1.0788635257193724, 'reg_lambda': 3.271209177601678e-06, 'gamma': 3.297167109385927e-05}. Best is trial 76 with value: -0.6637225783962517.
[I 2026-07-14 17:20:54,851] Trial 133 finished with value: -0.20631111444849232 and parameters: {'scalers': 'none', 'ratios': 'norm_ratio', 'imputers': 'median', 'n_estimators': 1550, 'learning_rate': 0.00046083952472823596, 'max_depth': 10, 'min_child_weight': 1, 'subsample': 0.5, 'colsample_bytree': 1.0, 'colsample_bylevel': 0.5, 'reg_alpha': 1.059217844076346, 'reg_lambda': 1.7130166291639183e-06, 'gamma': 1.0354544246992095e-06}. Best is trial 76 with value: -0.6637225783962517.
[I 2026-07-14 17:21:02,939] Trial 134 finished with value: -0.20106645649386187 and parameters: {'scalers': 'none', 'ratios': 'norm_ratio', 'imputers': 'median', 'n_estimators': 1550, 'learning_rate': 0.0006232508193237019, 'max_depth': 6, 'min_child_weight': 1, 'subsample': 0.5, 'colsample_bytree': 0.5, 'colsample_bylevel': 0.5, 'reg_alpha': 1.0906661697142008, 'reg_lambda': 6.585693601897055e-06, 'gamma': 3.507999129928039e-05}. Best is trial 76 with value: -0.6637225783962517.
