[I 2026-07-14 21:11:43,931] Trial 135 finished with value: -0.10100073708569528 and parameters: {'scalers': 'none', 'ratios': 'norm_ratio', 'imputers': 'mean', 'n_estimators': 2550, 'learning_rate': 0.47410866896337056, 'max_depth': 11, 'min_child_weight': 2, 'subsample': 0.5, 'colsample_bytree': 0.7, 'colsample_bylevel': 0.6, 'reg_alpha': 2.1173636652194947e-06, 'reg_lambda': 2.1879501110198206e-06, 'gamma': 4.247263642547847e-05}. Best is trial 106 with value: -0.15037573443069963.
[I 2026-07-14 21:11:58,209] Trial 136 finished with value: -0.0864135545868835 and parameters: {'scalers': 'none', 'ratios': 'norm_ratio', 'imputers': 'median', 'n_estimators': 2350, 'learning_rate': 0.3539180092580331, 'max_depth': 11, 'min_child_weight': 2, 'subsample': 0.5, 'colsample_bytree': 0.7, 'colsample_bylevel': 0.6, 'reg_alpha': 1.9146546758940323e-06, 'reg_lambda': 2.2072910429838935e-06, 'gamma': 9.029459419181452e-06}. Best is trial 106 with value: -0.15037573443069963.
[I 2026-07-14 21:12:12,460] Trial 137 finished with value: -0.0853057805268785 and parameters: {'scalers': 'none', 'ratios': 'norm_ratio', 'imputers': 'median', 'n_estimators': 2350, 'learning_rate': 0.34816015355912, 'max_depth': 11, 'min_child_weight': 2, 'subsample': 0.5, 'colsample_bytree': 0.7, 'colsample_bylevel': 0.6, 'reg_alpha': 1.9241496192425572e-06, 'reg_lambda': 2.2738060929832988e-06, 'gamma': 4.745998558944328e-05}. Best is trial 106 with value: -0.15037573443069963.
[I 2026-07-14 21:12:25,983] Trial 138 finished with value: -0.13419951309915917 and parameters: {'scalers': 'none', 'ratios': 'norm_ratio', 'imputers': 'mean', 'n_estimators': 2350, 'learning_rate': 0.4987394680627396, 'max_depth': 11, 'min_child_weight': 1, 'subsample': 0.5, 'colsample_bytree': 0.7, 'colsample_bylevel': 0.6, 'reg_alpha': 1.9946423771990262e-05, 'reg_lambda': 2.331913063796902e-06, 'gamma': 5.400140200853612e-05}. Best is trial 106 with value: -0.15037573443069963.
[I 2026-07-14 21:12:39,395] Trial 139 finished with value: -0.09420996593364526 and parameters: {'scalers': 'none', 'ratios': 'norm_ratio', 'imputers': 'mean', 'n_estimators': 2350, 'learning_rate': 0.3420987758883778, 'max_depth': 11, 'min_child_weight': 1, 'subsample': 0.5, 'colsample_bytree': 0.7, 'colsample_bylevel': 0.6, 'reg_alpha': 2.0965760823898154e-06, 'reg_lambda': 2.266916612966564e-06, 'gamma': 4.424368252796408e-05}. Best is trial 106 with value: -0.15037573443069963.
[I 2026-07-14 21:12:55,507] Trial 140 finished with value: -0.08842271913698177 and parameters: {'scalers': 'none', 'ratios': 'norm_ratio', 'imputers': 'median', 'n_estimators': 2600, 'learning_rate': 0.348235018512516, 'max_depth': 11, 'min_child_weight': 2, 'subsample': 0.5, 'colsample_bytree': 0.7, 'colsample_bylevel': 0.6, 'reg_alpha': 2.071421440254472e-06, 'reg_lambda': 1.9454119711546927e-06, 'gamma': 5.734014613416781e-05}. Best is trial 106 with value: -0.15037573443069963.
[I 2026-07-14 21:13:12,637] Trial 141 finished with value: -0.09685659493687038 and parameters: {'scalers': 'none', 'ratios': 'norm_ratio', 'imputers': 'median', 'n_estimators': 2350, 'learning_rate': 0.37327342667389657, 'max_depth': 12, 'min_child_weight': 2, 'subsample': 0.5, 'colsample_bytree': 0.7, 'colsample_bylevel': 0.6, 'reg_alpha': 0.0003204183309846666, 'reg_lambda': 2.085771400624751e-06, 'gamma': 3.786404155714786e-05}. Best is trial 106 with value: -0.15037573443069963.
[I 2026-07-14 21:13:30,784] Trial 142 finished with value: -0.09388386290487022 and parameters: {'scalers': 'none', 'ratios': 'norm_ratio', 'imputers': 'median', 'n_estimators': 2600, 'learning_rate': 0.341343905898709, 'max_depth': 12, 'min_child_weight': 2, 'subsample': 0.5, 'colsample_bytree': 0.7, 'colsample_bylevel': 0.6, 'reg_alpha': 0.0001824106523686544, 'reg_lambda': 1.779410293678196e-06, 'gamma': 4.764425206763968e-05}. Best is trial 106 with value: -0.15037573443069963.
[I 2026-07-14 21:13:48,971] Trial 144 finished with value: -0.019031351897634195 and parameters: {'scalers': 'none', 'ratios': 'norm_ratio', 'imputers': 'mean', 'n_estimators': 2600, 'learning_rate': 0.33853679010889304, 'max_depth': 12, 'min_child_weight': 1, 'subsample': 0.5, 'colsample_bytree': 0.7, 'colsample_bylevel': 0.6, 'reg_alpha': 71.33978721933376, 'reg_lambda': 6.337668324788634e-06, 'gamma': 6.788088479826315e-05}. Best is trial 106 with value: -0.15037573443069963.
[I 2026-07-14 21:13:49,231] Trial 143 finished with value: -0.09392396197076702 and parameters: {'scalers': 'none', 'ratios': 'norm_ratio', 'imputers': 'mean', 'n_estimators': 2600, 'learning_rate': 0.35202677316431946, 'max_depth': 12, 'min_child_weight': 2, 'subsample': 0.5, 'colsample_bytree': 0.7, 'colsample_bylevel': 0.6, 'reg_alpha': 0.00037806694198432885, 'reg_lambda': 6.384422380869918e-06, 'gamma': 8.67251633361405e-06}. Best is trial 106 with value: -0.15037573443069963.
[I 2026-07-14 21:14:04,237] Trial 145 finished with value: -0.11035383816779608 and parameters: {'scalers': 'none', 'ratios': 'norm_ratio', 'imputers': 'mean', 'n_estimators': 2300, 'learning_rate': 0.35146035257725017, 'max_depth': 12, 'min_child_weight': 1, 'subsample': 0.5, 'colsample_bytree': 0.7, 'colsample_bylevel': 0.6, 'reg_alpha': 0.0003913314489936304, 'reg_lambda': 6.268804547703611e-06, 'gamma': 7.010500655135544e-05}. Best is trial 106 with value: -0.15037573443069963.
[I 2026-07-14 21:14:21,268] Trial 146 finished with value: -0.10532116597341147 and parameters: {'scalers': 'none', 'ratios': 'norm_ratio', 'imputers': 'mean', 'n_estimators': 2600, 'learning_rate': 0.33929354471472123, 'max_depth': 12, 'min_child_weight': 1, 'subsample': 0.5, 'colsample_bytree': 0.7, 'colsample_bylevel': 0.6, 'reg_alpha': 0.000448913869185013, 'reg_lambda': 5.823464278221525e-06, 'gamma': 8.163578197722303e-05}. Best is trial 106 with value: -0.15037573443069963.
[I 2026-07-14 21:14:38,260] Trial 147 finished with value: -0.11121033032066248 and parameters: {'scalers': 'none', 'ratios': 'norm_ratio', 'imputers': 'mean', 'n_estimators': 2600, 'learning_rate': 0.3691662790822924, 'max_depth': 12, 'min_child_weight': 1, 'subsample': 0.5, 'colsample_bytree': 0.7, 'colsample_bylevel': 0.6, 'reg_alpha': 0.00032939506185207117, 'reg_lambda': 6.376023118797727e-06, 'gamma': 8.227935114165375e-05}. Best is trial 106 with value: -0.15037573443069963.
[I 2026-07-14 21:14:56,265] Trial 148 finished with value: -0.15198817628036207 and parameters: {'scalers': 'none', 'ratios': 'norm_ratio', 'imputers': 'mean', 'n_estimators': 2600, 'learning_rate': 0.49896823051462663, 'max_depth': 12, 'min_child_weight': 1, 'subsample': 0.5, 'colsample_bytree': 0.7, 'colsample_bylevel': 0.6, 'reg_alpha': 0.0004180297640715333, 'reg_lambda': 6.208728276056747e-06, 'gamma': 7.46688433825112e-05}. Best is trial 148 with value: -0.15198817628036207.
[I 2026-07-14 21:15:13,976] Trial 149 finished with value: -0.12384076887499618 and parameters: {'scalers': 'none', 'ratios': 'norm_ratio', 'imputers': 'mean', 'n_estimators': 2600, 'learning_rate': 0.38811105342792246, 'max_depth': 12, 'min_child_weight': 1, 'subsample': 0.5, 'colsample_bytree': 0.7, 'colsample_bylevel': 0.6, 'reg_alpha': 0.0009214185018891729, 'reg_lambda': 6.172384922278375e-06, 'gamma': 7.992557536197888e-05}. Best is trial 148 with value: -0.15198817628036207.
[I 2026-07-14 21:15:27,001] Trial 150 finished with value: -0.13093852902092942 and parameters: {'scalers': 'none', 'ratios': 'norm_ratio', 'imputers': 'mean', 'n_estimators': 2250, 'learning_rate': 0.49953727119859015, 'max_depth': 11, 'min_child_weight': 1, 'subsample': 0.5, 'colsample_bytree': 0.7, 'colsample_bylevel': 0.6, 'reg_alpha': 0.0009014685896481132, 'reg_lambda': 5.886337467412047e-06, 'gamma': 9.036097601705262e-05}. Best is trial 148 with value: -0.15198817628036207.
[I 2026-07-14 21:15:39,606] Trial 151 finished with value: -0.10914702992474405 and parameters: {'scalers': 'none', 'ratios': 'norm_ratio', 'imputers': 'mean', 'n_estimators': 2250, 'learning_rate': 0.4114627509666347, 'max_depth': 11, 'min_child_weight': 1, 'subsample': 0.5, 'colsample_bytree': 0.7, 'colsample_bylevel': 0.6, 'reg_alpha': 0.0006837729644065558, 'reg_lambda': 6.5139475696277654e-06, 'gamma': 2.320132414773151e-05}. Best is trial 148 with value: -0.15198817628036207.
[I 2026-07-14 21:15:52,305] Trial 152 finished with value: -0.13009074424151118 and parameters: {'scalers': 'none', 'ratios': 'norm_ratio', 'imputers': 'mean', 'n_estimators': 2250, 'learning_rate': 0.4947677703546154, 'max_depth': 11, 'min_child_weight': 1, 'subsample': 0.5, 'colsample_bytree': 0.7, 'colsample_bylevel': 0.6, 'reg_alpha': 0.0006295643933431016, 'reg_lambda': 6.669920890841602e-06, 'gamma': 2.6312449273756423e-05}. Best is trial 148 with value: -0.15198817628036207.
[I 2026-07-14 21:16:06,386] Trial 153 finished with value: -0.13793015845672219 and parameters: {'scalers': 'none', 'ratios': 'norm_ratio', 'imputers': 'mean', 'n_estimators': 2550, 'learning_rate': 0.48737219446097085, 'max_depth': 11, 'min_child_weight': 1, 'subsample': 0.5, 'colsample_bytree': 0.7, 'colsample_bylevel': 0.6, 'reg_alpha': 2.119129782696648e-05, 'reg_lambda': 1.6207062990770744e-06, 'gamma': 2.1509955914759556e-05}. Best is trial 148 with value: -0.15198817628036207.
[I 2026-07-14 21:16:10,850] Trial 154 finished with value: -0.04428905523415513 and parameters: {'scalers': 'none', 'ratios': 'norm_ratio', 'imputers': 'mean', 'n_estimators': 2250, 'learning_rate': 0.4031902151965292, 'max_depth': 4, 'min_child_weight': 1, 'subsample': 0.5, 'colsample_bytree': 0.7, 'colsample_bylevel': 0.6, 'reg_alpha': 0.0007013937106587696, 'reg_lambda': 1.601360615332602e-06, 'gamma': 2.2793489844180457e-05}. Best is trial 148 with value: -0.15198817628036207.
[I 2026-07-14 21:16:26,451] Trial 155 finished with value: -0.1256441224418482 and parameters: {'scalers': 'none', 'ratios': 'norm_ratio', 'imputers': 'mean', 'n_estimators': 2850, 'learning_rate': 0.41188558790313223, 'max_depth': 11, 'min_child_weight': 1, 'subsample': 0.5, 'colsample_bytree': 0.6, 'colsample_bylevel': 0.6, 'reg_alpha': 0.00014727295454810982, 'reg_lambda': 1.643659825850669e-06, 'gamma': 2.3787060700047878e-05}. Best is trial 148 with value: -0.15198817628036207.
[I 2026-07-14 21:16:38,771] Trial 156 finished with value: -0.12592290425809097 and parameters: {'scalers': 'none', 'ratios': 'norm_ratio', 'imputers': 'mean', 'n_estimators': 2150, 'learning_rate': 0.49443377387265597, 'max_depth': 11, 'min_child_weight': 1, 'subsample': 0.5, 'colsample_bytree': 0.7, 'colsample_bylevel': 0.6, 'reg_alpha': 0.0007721920287839608, 'reg_lambda': 2.9643644625045474e-06, 'gamma': 2.367158116309569e-05}. Best is trial 148 with value: -0.15198817628036207.
[I 2026-07-14 21:16:51,682] Trial 157 finished with value: -0.13086748418840605 and parameters: {'scalers': 'none', 'ratios': 'norm_ratio', 'imputers': 'mean', 'n_estimators': 2250, 'learning_rate': 0.4980270910949641, 'max_depth': 11, 'min_child_weight': 1, 'subsample': 0.5, 'colsample_bytree': 0.7, 'colsample_bylevel': 0.6, 'reg_alpha': 0.0007701902122824637, 'reg_lambda': 3.011690373685563e-06, 'gamma': 2.283898746844709e-05}. Best is trial 148 with value: -0.15198817628036207.
[I 2026-07-14 21:17:04,741] Trial 158 finished with value: -0.12767569590920486 and parameters: {'scalers': 'none', 'ratios': 'norm_ratio', 'imputers': 'mean', 'n_estimators': 2250, 'learning_rate': 0.4981888541535303, 'max_depth': 11, 'min_child_weight': 1, 'subsample': 0.5, 'colsample_bytree': 0.7, 'colsample_bylevel': 0.6, 'reg_alpha': 0.000783372308516253, 'reg_lambda': 2.872958535899601e-06, 'gamma': 2.4853511636931624e-05}. Best is trial 148 with value: -0.15198817628036207.
[I 2026-07-14 21:17:17,007] Trial 159 finished with value: -0.1284290055634974 and parameters: {'scalers': 'none', 'ratios': 'norm_ratio', 'imputers': 'mean', 'n_estimators': 2150, 'learning_rate': 0.49681760554998455, 'max_depth': 11, 'min_child_weight': 1, 'subsample': 0.5, 'colsample_bytree': 0.7, 'colsample_bylevel': 0.6, 'reg_alpha': 0.003347061508160199, 'reg_lambda': 2.7432625140740415e-06, 'gamma': 0.00012870192698493383}. Best is trial 148 with value: -0.15198817628036207.
[I 2026-07-14 21:17:33,172] Trial 160 finished with value: -0.14366318657767616 and parameters: {'scalers': 'none', 'ratios': 'norm_ratio', 'imputers': 'mean', 'n_estimators': 2850, 'learning_rate': 0.49522441453008986, 'max_depth': 11, 'min_child_weight': 1, 'subsample': 0.5, 'colsample_bytree': 0.7, 'colsample_bylevel': 0.6, 'reg_alpha': 0.0010664460904450752, 'reg_lambda': 3.0702991717338165e-06, 'gamma': 0.00011232028493617201}. Best is trial 148 with value: -0.15198817628036207.
[I 2026-07-14 21:17:49,532] Trial 161 finished with value: -0.11703036886285037 and parameters: {'scalers': 'standard', 'ratios': 'norm_ratio', 'imputers': 'mean', 'n_estimators': 2900, 'learning_rate': 0.40016403369551024, 'max_depth': 11, 'min_child_weight': 1, 'subsample': 0.5, 'colsample_bytree': 0.7, 'colsample_bylevel': 0.6, 'reg_alpha': 1.8720400060958384e-05, 'reg_lambda': 1.0019490764461018e-06, 'gamma': 6.030514613475966e-06}. Best is trial 148 with value: -0.15198817628036207.
[I 2026-07-14 21:18:05,712] Trial 162 finished with value: -0.11821705044496576 and parameters: {'scalers': 'standard', 'ratios': 'norm_ratio', 'imputers': 'mean', 'n_estimators': 2900, 'learning_rate': 0.41005649664275046, 'max_depth': 11, 'min_child_weight': 1, 'subsample': 0.5, 'colsample_bytree': 0.7, 'colsample_bylevel': 0.6, 'reg_alpha': 0.0034815420526520093, 'reg_lambda': 3.027443667073751e-06, 'gamma': 5.728051918216902e-06}. Best is trial 148 with value: -0.15198817628036207.
[I 2026-07-14 21:18:20,462] Trial 163 finished with value: -0.1378297877897537 and parameters: {'scalers': 'standard', 'ratios': 'norm_ratio', 'imputers': 'mean', 'n_estimators': 2550, 'learning_rate': 0.49511993537045346, 'max_depth': 11, 'min_child_weight': 1, 'subsample': 0.5, 'colsample_bytree': 0.7, 'colsample_bylevel': 0.6, 'reg_alpha': 1.996042003456431e-05, 'reg_lambda': 3.1248009301249745e-06, 'gamma': 6.339535387890881e-06}. Best is trial 148 with value: -0.15198817628036207.
[I 2026-07-14 21:18:35,167] Trial 164 finished with value: -0.11018516677269118 and parameters: {'scalers': 'none', 'ratios': 'norm_ratio', 'imputers': 'mean', 'n_estimators': 2550, 'learning_rate': 0.40694907594531027, 'max_depth': 11, 'min_child_weight': 1, 'subsample': 0.5, 'colsample_bytree': 0.7, 'colsample_bylevel': 0.6, 'reg_alpha': 2.1406839154322545e-05, 'reg_lambda': 4.563620591095026e-06, 'gamma': 0.00011150768523406353}. Best is trial 148 with value: -0.15198817628036207.
[I 2026-07-14 21:18:49,255] Trial 165 finished with value: -0.09766310243723579 and parameters: {'scalers': 'standard', 'ratios': 'norm_ratio', 'imputers': 'mean', 'n_estimators': 2550, 'learning_rate': 0.30721352543249614, 'max_depth': 11, 'min_child_weight': 1, 'subsample': 0.5, 'colsample_bytree': 0.6, 'colsample_bylevel': 0.6, 'reg_alpha': 0.0026603682313270046, 'reg_lambda': 9.522875920433968e-06, 'gamma': 6.3530827011635596e-06}. Best is trial 148 with value: -0.15198817628036207.
[I 2026-07-14 21:19:03,072] Trial 166 finished with value: -0.09732007998127641 and parameters: {'scalers': 'standard', 'ratios': 'norm_ratio', 'imputers': 'mean', 'n_estimators': 2550, 'learning_rate': 0.2991233956794315, 'max_depth': 11, 'min_child_weight': 1, 'subsample': 0.5, 'colsample_bytree': 0.6, 'colsample_bylevel': 0.6, 'reg_alpha': 0.0021935216201921155, 'reg_lambda': 1.007212508987194e-06, 'gamma': 0.0002696112281925667}. Best is trial 148 with value: -0.15198817628036207.
[I 2026-07-14 21:19:16,958] Trial 167 finished with value: -0.09880791272247869 and parameters: {'scalers': 'standard', 'ratios': 'norm_ratio', 'imputers': 'mean', 'n_estimators': 2550, 'learning_rate': 0.3091644732210835, 'max_depth': 11, 'min_child_weight': 1, 'subsample': 0.5, 'colsample_bytree': 0.6, 'colsample_bylevel': 0.6, 'reg_alpha': 4.559954307661919e-05, 'reg_lambda': 1.0334128665626703e-05, 'gamma': 5.502282814855824e-06}. Best is trial 148 with value: -0.15198817628036207.
[I 2026-07-14 21:19:33,022] Trial 168 finished with value: -0.09632835249727029 and parameters: {'scalers': 'none', 'ratios': 'norm_ratio', 'imputers': 'mean', 'n_estimators': 2900, 'learning_rate': 0.3034033749153608, 'max_depth': 11, 'min_child_weight': 1, 'subsample': 0.5, 'colsample_bytree': 0.7, 'colsample_bylevel': 0.6, 'reg_alpha': 0.0022520252653164563, 'reg_lambda': 1.054669685984505e-05, 'gamma': 5.9041211047022024e-06}. Best is trial 148 with value: -0.15198817628036207.
[I 2026-07-14 21:19:49,266] Trial 169 finished with value: -0.10044880936775641 and parameters: {'scalers': 'none', 'ratios': 'norm_ratio', 'imputers': 'mean', 'n_estimators': 3000, 'learning_rate': 0.30920422864165525, 'max_depth': 11, 'min_child_weight': 1, 'subsample': 0.5, 'colsample_bytree': 0.6, 'colsample_bylevel': 0.6, 'reg_alpha': 0.001734228988108513, 'reg_lambda': 4.667072501425527e-06, 'gamma': 0.00022361957033333407}. Best is trial 148 with value: -0.15198817628036207.
[I 2026-07-14 21:20:02,451] Trial 170 finished with value: -0.09816216621554079 and parameters: {'scalers': 'none', 'ratios': 'norm_ratio', 'imputers': 'mean', 'n_estimators': 2400, 'learning_rate': 0.31549632817672596, 'max_depth': 11, 'min_child_weight': 1, 'subsample': 0.5, 'colsample_bytree': 0.6, 'colsample_bylevel': 0.6, 'reg_alpha': 0.0013296122034574902, 'reg_lambda': 4.767672719706279e-06, 'gamma': 0.00024357833706113854}. Best is trial 148 with value: -0.15198817628036207.
[I 2026-07-14 21:20:16,082] Trial 171 finished with value: -0.09942127699426909 and parameters: {'scalers': 'standard', 'ratios': 'norm_ratio', 'imputers': 'mean', 'n_estimators': 2550, 'learning_rate': 0.30915597425177116, 'max_depth': 11, 'min_child_weight': 1, 'subsample': 0.5, 'colsample_bytree': 0.6, 'colsample_bylevel': 0.6, 'reg_alpha': 4.2413454909623936e-05, 'reg_lambda': 9.297225643116863e-06, 'gamma': 2.4518281447624635e-06}. Best is trial 148 with value: -0.15198817628036207.
[I 2026-07-14 21:20:30,297] Trial 172 finished with value: -0.09929237740712556 and parameters: {'scalers': 'standard', 'ratios': 'norm_ratio', 'imputers': 'mean', 'n_estimators': 2650, 'learning_rate': 0.3005530380101134, 'max_depth': 11, 'min_child_weight': 1, 'subsample': 0.5, 'colsample_bytree': 0.6, 'colsample_bylevel': 0.6, 'reg_alpha': 8.929959251079165e-06, 'reg_lambda': 1.4145873774344204e-06, 'gamma': 0.0002825143557346675}. Best is trial 148 with value: -0.15198817628036207.
[I 2026-07-14 21:20:48,497] Trial 173 finished with value: -0.028268835209200406 and parameters: {'scalers': 'standard', 'ratios': 'norm_ratio', 'imputers': 'mean', 'n_estimators': 2800, 'learning_rate': 0.005719712291022168, 'max_depth': 11, 'min_child_weight': 1, 'subsample': 0.5, 'colsample_bytree': 0.6, 'colsample_bylevel': 0.6, 'reg_alpha': 4.075116797534112e-05, 'reg_lambda': 1.0512487071851252e-06, 'gamma': 0.0002526140207913901}. Best is trial 148 with value: -0.15198817628036207.
[I 2026-07-14 21:21:01,512] Trial 174 finished with value: -0.09924539602341842 and parameters: {'scalers': 'none', 'ratios': 'norm_ratio', 'imputers': 'mean', 'n_estimators': 2400, 'learning_rate': 0.31180110031721303, 'max_depth': 11, 'min_child_weight': 1, 'subsample': 0.5, 'colsample_bytree': 0.6, 'colsample_bylevel': 0.6, 'reg_alpha': 4.8918200450238576e-05, 'reg_lambda': 1.4554821137211055e-06, 'gamma': 1.9465423786983563e-06}. Best is trial 148 with value: -0.15198817628036207.
[I 2026-07-14 21:21:16,850] Trial 175 finished with value: -0.11947712326360435 and parameters: {'scalers': 'none', 'ratios': 'log_ratio', 'imputers': 'mean', 'n_estimators': 2800, 'learning_rate': 0.40210245826608737, 'max_depth': 11, 'min_child_weight': 1, 'subsample': 0.5, 'colsample_bytree': 0.6, 'colsample_bylevel': 0.6, 'reg_alpha': 4.247956297252461e-05, 'reg_lambda': 1.4901052079363999e-06, 'gamma': 2.6576683388646056e-06}. Best is trial 148 with value: -0.15198817628036207.
[I 2026-07-14 21:21:28,333] Trial 176 finished with value: -0.10487786082371421 and parameters: {'scalers': 'none', 'ratios': 'log_ratio', 'imputers': 'mean', 'n_estimators': 2400, 'learning_rate': 0.4106048629708399, 'max_depth': 10, 'min_child_weight': 1, 'subsample': 0.5, 'colsample_bytree': 0.6, 'colsample_bylevel': 0.6, 'reg_alpha': 9.886641158191467e-06, 'reg_lambda': 1.4794268054735654e-06, 'gamma': 1.0144021291474451e-05}. Best is trial 148 with value: -0.15198817628036207.
[I 2026-07-14 21:21:41,422] Trial 177 finished with value: -0.10904842805682112 and parameters: {'scalers': 'none', 'ratios': 'log_ratio', 'imputers': 'mean', 'n_estimators': 2800, 'learning_rate': 0.4108049999855919, 'max_depth': 10, 'min_child_weight': 1, 'subsample': 0.5, 'colsample_bytree': 0.6, 'colsample_bylevel': 0.6, 'reg_alpha': 4.165291887186869e-05, 'reg_lambda': 1.387136613808872e-06, 'gamma': 2.289762877906407e-06}. Best is trial 148 with value: -0.15198817628036207.
[I 2026-07-14 21:21:56,523] Trial 178 finished with value: -0.11530705249858615 and parameters: {'scalers': 'none', 'ratios': 'norm_ratio', 'imputers': 'mean', 'n_estimators': 2650, 'learning_rate': 0.4097648148547528, 'max_depth': 11, 'min_child_weight': 1, 'subsample': 0.5, 'colsample_bytree': 0.7, 'colsample_bylevel': 0.6, 'reg_alpha': 8.238057512043631e-06, 'reg_lambda': 1.5663930537584245e-06, 'gamma': 1.089899918928792e-05}. Best is trial 148 with value: -0.15198817628036207.
[I 2026-07-14 21:22:11,773] Trial 179 finished with value: -0.11673505069762773 and parameters: {'scalers': 'none', 'ratios': 'log_ratio', 'imputers': 'mean', 'n_estimators': 2650, 'learning_rate': 0.4100272976944064, 'max_depth': 11, 'min_child_weight': 1, 'subsample': 0.5, 'colsample_bytree': 0.7, 'colsample_bylevel': 0.6, 'reg_alpha': 8.582072876872904e-06, 'reg_lambda': 1.5834262090302948e-06, 'gamma': 9.617187911381684e-06}. Best is trial 148 with value: -0.15198817628036207.
