[I 2026-07-14 17:48:55,898] Trial 91 finished with value: -1.2949672986946779 and parameters: {'scalers': 'none', 'ratios': 'norm_ratio', 'imputers': 'none', 'n_estimators': 2850, 'learning_rate': 0.0007626225968769319, 'max_depth': 12, 'min_child_weight': 2, 'subsample': 0.5, 'colsample_bytree': 0.9, 'colsample_bylevel': 0.6, 'reg_alpha': 0.0001154595889019039, 'reg_lambda': 1.135591611259214, 'gamma': 0.3471945245062514}. Best is trial 62 with value: -4.109958479178393.
[I 2026-07-14 17:49:45,008] Trial 92 finished with value: -2.611347008843288 and parameters: {'scalers': 'none', 'ratios': 'norm_ratio', 'imputers': 'none', 'n_estimators': 2900, 'learning_rate': 0.3460210018683249, 'max_depth': 12, 'min_child_weight': 2, 'subsample': 0.5, 'colsample_bytree': 0.9, 'colsample_bylevel': 0.5, 'reg_alpha': 0.00010862155090540032, 'reg_lambda': 0.14737992722697343, 'gamma': 0.03236197454048036}. Best is trial 62 with value: -4.109958479178393.
[I 2026-07-14 17:50:07,212] Trial 93 finished with value: -1.4918282687634794 and parameters: {'scalers': 'none', 'ratios': 'norm_ratio', 'imputers': 'none', 'n_estimators': 2800, 'learning_rate': 0.35075294221108955, 'max_depth': 12, 'min_child_weight': 2, 'subsample': 0.5, 'colsample_bytree': 0.9, 'colsample_bylevel': 0.5, 'reg_alpha': 0.0001278741489036539, 'reg_lambda': 2.5882792080256056, 'gamma': 0.6024513559583531}. Best is trial 62 with value: -4.109958479178393.
[I 2026-07-14 17:50:47,253] Trial 94 finished with value: -2.430702180337267 and parameters: {'scalers': 'none', 'ratios': 'norm_ratio', 'imputers': 'none', 'n_estimators': 2850, 'learning_rate': 0.3485629924427194, 'max_depth': 12, 'min_child_weight': 2, 'subsample': 0.5, 'colsample_bytree': 0.9, 'colsample_bylevel': 0.5, 'reg_alpha': 8.777438295010613e-05, 'reg_lambda': 0.09125190465700246, 'gamma': 0.16577538068881129}. Best is trial 62 with value: -4.109958479178393.
[I 2026-07-14 17:51:15,768] Trial 95 finished with value: -1.4417853771476226 and parameters: {'scalers': 'none', 'ratios': 'norm_ratio', 'imputers': 'none', 'n_estimators': 2850, 'learning_rate': 0.26492288614428505, 'max_depth': 12, 'min_child_weight': 2, 'subsample': 0.5, 'colsample_bytree': 0.9, 'colsample_bylevel': 0.5, 'reg_alpha': 0.00016807881984151664, 'reg_lambda': 2.4701230847520583, 'gamma': 0.3570424777972749}. Best is trial 62 with value: -4.109958479178393.
[I 2026-07-14 17:51:30,372] Trial 96 finished with value: -1.3757355496276102 and parameters: {'scalers': 'none', 'ratios': 'norm_ratio', 'imputers': 'none', 'n_estimators': 2800, 'learning_rate': 0.26877961002445355, 'max_depth': 12, 'min_child_weight': 9, 'subsample': 0.5, 'colsample_bytree': 0.9, 'colsample_bylevel': 0.5, 'reg_alpha': 0.00012161715069146165, 'reg_lambda': 2.716907866126076, 'gamma': 0.3059485531456467}. Best is trial 62 with value: -4.109958479178393.
[I 2026-07-14 17:52:00,478] Trial 97 finished with value: -1.5163783705304992 and parameters: {'scalers': 'none', 'ratios': 'norm_ratio', 'imputers': 'none', 'n_estimators': 2950, 'learning_rate': 0.2667158484200883, 'max_depth': 12, 'min_child_weight': 2, 'subsample': 0.5, 'colsample_bytree': 0.8, 'colsample_bylevel': 0.5, 'reg_alpha': 0.00015349911733475934, 'reg_lambda': 2.371906725118276, 'gamma': 0.2734205218882097}. Best is trial 62 with value: -4.109958479178393.
[I 2026-07-14 17:52:36,856] Trial 98 finished with value: -2.0170742308092784 and parameters: {'scalers': 'none', 'ratios': 'norm_ratio', 'imputers': 'none', 'n_estimators': 2900, 'learning_rate': 0.2553243991917378, 'max_depth': 12, 'min_child_weight': 2, 'subsample': 0.5, 'colsample_bytree': 0.9, 'colsample_bylevel': 0.5, 'reg_alpha': 0.00019161834681972006, 'reg_lambda': 2.4984527491486848, 'gamma': 0.1874495666986375}. Best is trial 62 with value: -4.109958479178393.
[I 2026-07-14 17:53:05,168] Trial 99 finished with value: -1.7540937663903926 and parameters: {'scalers': 'none', 'ratios': 'norm_ratio', 'imputers': 'none', 'n_estimators': 2900, 'learning_rate': 0.2502594170053658, 'max_depth': 12, 'min_child_weight': 3, 'subsample': 0.5, 'colsample_bytree': 0.8, 'colsample_bylevel': 0.5, 'reg_alpha': 0.00023811080380064598, 'reg_lambda': 0.05255384165298549, 'gamma': 0.19306517502505655}. Best is trial 62 with value: -4.109958479178393.
[I 2026-07-14 17:53:48,394] Trial 100 finished with value: -2.409999935454889 and parameters: {'scalers': 'none', 'ratios': 'norm_ratio', 'imputers': 'none', 'n_estimators': 2450, 'learning_rate': 0.262640091364183, 'max_depth': 12, 'min_child_weight': 3, 'subsample': 0.5, 'colsample_bytree': 0.8, 'colsample_bylevel': 0.5, 'reg_alpha': 0.00017570866617947392, 'reg_lambda': 2.660302745130186, 'gamma': 0.012017800989813577}. Best is trial 62 with value: -4.109958479178393.
[I 2026-07-14 17:54:13,512] Trial 101 finished with value: -1.766708077520762 and parameters: {'scalers': 'none', 'ratios': 'norm_ratio', 'imputers': 'none', 'n_estimators': 2200, 'learning_rate': 0.25717583112053044, 'max_depth': 12, 'min_child_weight': 3, 'subsample': 0.6, 'colsample_bytree': 0.8, 'colsample_bylevel': 0.5, 'reg_alpha': 7.6436113411569e-06, 'reg_lambda': 3.2362023172906587, 'gamma': 0.15888968674951465}. Best is trial 62 with value: -4.109958479178393.
[I 2026-07-14 17:55:01,748] Trial 102 finished with value: -2.282752188512017 and parameters: {'scalers': 'none', 'ratios': 'norm_ratio', 'imputers': 'none', 'n_estimators': 3000, 'learning_rate': 0.2593713603882, 'max_depth': 12, 'min_child_weight': 3, 'subsample': 0.6, 'colsample_bytree': 0.8, 'colsample_bylevel': 0.5, 'reg_alpha': 1.2531460127946813e-05, 'reg_lambda': 0.07780079520359373, 'gamma': 0.014506705193205165}. Best is trial 62 with value: -4.109958479178393.
[I 2026-07-14 17:55:41,947] Trial 103 finished with value: -2.2461574557762933 and parameters: {'scalers': 'none', 'ratios': 'norm_ratio', 'imputers': 'none', 'n_estimators': 2450, 'learning_rate': 0.2523086784038263, 'max_depth': 12, 'min_child_weight': 3, 'subsample': 0.6, 'colsample_bytree': 0.8, 'colsample_bylevel': 0.5, 'reg_alpha': 1.1378077203720034e-05, 'reg_lambda': 0.04311187523286224, 'gamma': 0.01188639599654831}. Best is trial 62 with value: -4.109958479178393.
[I 2026-07-14 17:56:28,875] Trial 104 finished with value: -1.9473992997509673 and parameters: {'scalers': 'none', 'ratios': 'norm_ratio', 'imputers': 'none', 'n_estimators': 3000, 'learning_rate': 0.11986435590846874, 'max_depth': 12, 'min_child_weight': 3, 'subsample': 0.6, 'colsample_bytree': 0.8, 'colsample_bylevel': 0.5, 'reg_alpha': 3.2550629594395186e-06, 'reg_lambda': 0.052585172430561294, 'gamma': 0.012701876065721181}. Best is trial 62 with value: -4.109958479178393.
[I 2026-07-14 17:57:07,265] Trial 105 finished with value: -1.8976909032100786 and parameters: {'scalers': 'none', 'ratios': 'norm_ratio', 'imputers': 'none', 'n_estimators': 2450, 'learning_rate': 0.12150995724118982, 'max_depth': 12, 'min_child_weight': 3, 'subsample': 0.6, 'colsample_bytree': 0.8, 'colsample_bylevel': 0.5, 'reg_alpha': 3.85523272600334e-06, 'reg_lambda': 0.07228827161579056, 'gamma': 0.014700187084954863}. Best is trial 62 with value: -4.109958479178393.
[I 2026-07-14 17:57:40,436] Trial 106 finished with value: -1.8427186237953006 and parameters: {'scalers': 'none', 'ratios': 'norm_ratio', 'imputers': 'none', 'n_estimators': 2500, 'learning_rate': 0.11768657446533623, 'max_depth': 11, 'min_child_weight': 3, 'subsample': 0.6, 'colsample_bytree': 0.8, 'colsample_bylevel': 0.5, 'reg_alpha': 4.355483389108522e-06, 'reg_lambda': 0.030243261370117822, 'gamma': 0.01208082010613236}. Best is trial 62 with value: -4.109958479178393.
[I 2026-07-14 17:58:21,620] Trial 107 finished with value: -2.1637502892261833 and parameters: {'scalers': 'none', 'ratios': 'norm_ratio', 'imputers': 'none', 'n_estimators': 2450, 'learning_rate': 0.12065137700143058, 'max_depth': 11, 'min_child_weight': 1, 'subsample': 0.6, 'colsample_bytree': 0.8, 'colsample_bylevel': 0.5, 'reg_alpha': 7.353520198457639e-06, 'reg_lambda': 0.8266750065879332, 'gamma': 0.013742195707547394}. Best is trial 62 with value: -4.109958479178393.
[I 2026-07-14 17:59:06,246] Trial 108 finished with value: -3.0457074713486096 and parameters: {'scalers': 'none', 'ratios': 'norm_ratio', 'imputers': 'none', 'n_estimators': 2450, 'learning_rate': 0.40847830907425126, 'max_depth': 11, 'min_child_weight': 1, 'subsample': 0.6, 'colsample_bytree': 1.0, 'colsample_bylevel': 0.5, 'reg_alpha': 4.253252448962197e-06, 'reg_lambda': 0.8887400974478933, 'gamma': 0.022845005474264494}. Best is trial 62 with value: -4.109958479178393.
[I 2026-07-14 17:59:51,868] Trial 109 finished with value: -3.089494908377315 and parameters: {'scalers': 'none', 'ratios': 'norm_ratio', 'imputers': 'none', 'n_estimators': 2500, 'learning_rate': 0.4139271656080853, 'max_depth': 11, 'min_child_weight': 1, 'subsample': 0.6, 'colsample_bytree': 1.0, 'colsample_bylevel': 0.5, 'reg_alpha': 0.002299814107705961, 'reg_lambda': 0.8479786783281121, 'gamma': 0.02355294585016086}. Best is trial 62 with value: -4.109958479178393.
[I 2026-07-14 18:00:41,486] Trial 110 finished with value: -3.3905129505194016 and parameters: {'scalers': 'none', 'ratios': 'norm_ratio', 'imputers': 'none', 'n_estimators': 2450, 'learning_rate': 0.4318765906675861, 'max_depth': 11, 'min_child_weight': 1, 'subsample': 0.5, 'colsample_bytree': 1.0, 'colsample_bylevel': 0.6, 'reg_alpha': 0.002469078841262587, 'reg_lambda': 0.8330710988806975, 'gamma': 0.021384251617283127}. Best is trial 62 with value: -4.109958479178393.
[I 2026-07-14 18:01:31,222] Trial 111 finished with value: -3.3062552052201197 and parameters: {'scalers': 'none', 'ratios': 'norm_ratio', 'imputers': 'none', 'n_estimators': 2500, 'learning_rate': 0.41167030214039974, 'max_depth': 11, 'min_child_weight': 1, 'subsample': 0.5, 'colsample_bytree': 1.0, 'colsample_bylevel': 0.6, 'reg_alpha': 0.002941299639982704, 'reg_lambda': 0.7448191300106755, 'gamma': 0.019556002564141903}. Best is trial 62 with value: -4.109958479178393.
[I 2026-07-14 18:02:24,720] Trial 112 finished with value: -3.55068675151248 and parameters: {'scalers': 'none', 'ratios': 'norm_ratio', 'imputers': 'none', 'n_estimators': 2500, 'learning_rate': 0.41919591483209423, 'max_depth': 11, 'min_child_weight': 1, 'subsample': 0.5, 'colsample_bytree': 1.0, 'colsample_bylevel': 0.6, 'reg_alpha': 0.002146901971871371, 'reg_lambda': 1.3489834290498537, 'gamma': 0.026439231118808557}. Best is trial 62 with value: -4.109958479178393.
[I 2026-07-14 18:03:15,944] Trial 113 finished with value: -3.3899543873978497 and parameters: {'scalers': 'none', 'ratios': 'norm_ratio', 'imputers': 'none', 'n_estimators': 2550, 'learning_rate': 0.424893898663931, 'max_depth': 11, 'min_child_weight': 1, 'subsample': 0.5, 'colsample_bytree': 1.0, 'colsample_bylevel': 0.6, 'reg_alpha': 0.0007895135665668452, 'reg_lambda': 0.8352362723003465, 'gamma': 0.006158009019721614}. Best is trial 62 with value: -4.109958479178393.
[I 2026-07-14 18:04:06,105] Trial 114 finished with value: -3.240415198207449 and parameters: {'scalers': 'none', 'ratios': 'norm_ratio', 'imputers': 'none', 'n_estimators': 2550, 'learning_rate': 0.408419448695029, 'max_depth': 11, 'min_child_weight': 1, 'subsample': 0.5, 'colsample_bytree': 1.0, 'colsample_bylevel': 0.6, 'reg_alpha': 0.0008695472580105917, 'reg_lambda': 0.7541258179798821, 'gamma': 0.02342189580900832}. Best is trial 62 with value: -4.109958479178393.
[I 2026-07-14 18:04:51,826] Trial 115 finished with value: -3.392461751511467 and parameters: {'scalers': 'none', 'ratios': 'norm_ratio', 'imputers': 'none', 'n_estimators': 2550, 'learning_rate': 0.4333799700041396, 'max_depth': 10, 'min_child_weight': 1, 'subsample': 0.5, 'colsample_bytree': 1.0, 'colsample_bylevel': 0.6, 'reg_alpha': 0.0023495508956103634, 'reg_lambda': 1.31828580537972, 'gamma': 0.021477520810626784}. Best is trial 62 with value: -4.109958479178393.
[I 2026-07-14 18:05:31,525] Trial 116 finished with value: -3.416676942430166 and parameters: {'scalers': 'none', 'ratios': 'norm_ratio', 'imputers': 'none', 'n_estimators': 2550, 'learning_rate': 0.41495807002062135, 'max_depth': 10, 'min_child_weight': 1, 'subsample': 0.5, 'colsample_bytree': 1.0, 'colsample_bylevel': 0.5, 'reg_alpha': 0.0027846443118288776, 'reg_lambda': 1.3244287650518125, 'gamma': 0.023584194832882367}. Best is trial 62 with value: -4.109958479178393.
[I 2026-07-14 18:06:11,134] Trial 117 finished with value: -3.510020697340716 and parameters: {'scalers': 'none', 'ratios': 'norm_ratio', 'imputers': 'none', 'n_estimators': 2550, 'learning_rate': 0.43426812666448245, 'max_depth': 10, 'min_child_weight': 1, 'subsample': 0.5, 'colsample_bytree': 1.0, 'colsample_bylevel': 0.5, 'reg_alpha': 0.002262699597760599, 'reg_lambda': 1.3864142966689006, 'gamma': 0.0630649056916855}. Best is trial 62 with value: -4.109958479178393.
[I 2026-07-14 18:06:50,811] Trial 118 finished with value: -3.4860304846736767 and parameters: {'scalers': 'none', 'ratios': 'norm_ratio', 'imputers': 'none', 'n_estimators': 2550, 'learning_rate': 0.42441056593553955, 'max_depth': 10, 'min_child_weight': 1, 'subsample': 0.5, 'colsample_bytree': 1.0, 'colsample_bylevel': 0.5, 'reg_alpha': 0.0028082842912272444, 'reg_lambda': 1.1878371108710561, 'gamma': 0.020853125906444274}. Best is trial 62 with value: -4.109958479178393.
[I 2026-07-14 18:07:27,491] Trial 119 finished with value: -3.7782227093460357 and parameters: {'scalers': 'none', 'ratios': 'norm_ratio', 'imputers': 'none', 'n_estimators': 2300, 'learning_rate': 0.4944614782786378, 'max_depth': 10, 'min_child_weight': 1, 'subsample': 0.5, 'colsample_bytree': 1.0, 'colsample_bylevel': 0.5, 'reg_alpha': 0.0024174993371665287, 'reg_lambda': 1.3734548803245779, 'gamma': 0.023013755451353406}. Best is trial 62 with value: -4.109958479178393.
[I 2026-07-14 18:08:10,035] Trial 120 finished with value: -3.8137947690589296 and parameters: {'scalers': 'none', 'ratios': 'norm_ratio', 'imputers': 'none', 'n_estimators': 2300, 'learning_rate': 0.4808555540263172, 'max_depth': 10, 'min_child_weight': 1, 'subsample': 0.5, 'colsample_bytree': 1.0, 'colsample_bylevel': 0.6, 'reg_alpha': 0.0027262261873743296, 'reg_lambda': 1.6099224676027322, 'gamma': 0.024356362215453835}. Best is trial 62 with value: -4.109958479178393.
[I 2026-07-14 18:08:50,189] Trial 121 finished with value: -3.655486590751367 and parameters: {'scalers': 'none', 'ratios': 'norm_ratio', 'imputers': 'none', 'n_estimators': 2250, 'learning_rate': 0.4775720900915016, 'max_depth': 10, 'min_child_weight': 1, 'subsample': 0.5, 'colsample_bytree': 1.0, 'colsample_bylevel': 0.6, 'reg_alpha': 1.0819289546120384e-06, 'reg_lambda': 1.2819927522317192, 'gamma': 0.024614544512632536}. Best is trial 62 with value: -4.109958479178393.
[I 2026-07-14 18:09:31,396] Trial 122 finished with value: -3.768107150474566 and parameters: {'scalers': 'none', 'ratios': 'norm_ratio', 'imputers': 'none', 'n_estimators': 2250, 'learning_rate': 0.4955663948939605, 'max_depth': 10, 'min_child_weight': 1, 'subsample': 0.5, 'colsample_bytree': 1.0, 'colsample_bylevel': 0.6, 'reg_alpha': 0.002245559812258507, 'reg_lambda': 1.3637119880081572, 'gamma': 0.022251033149776438}. Best is trial 62 with value: -4.109958479178393.
[I 2026-07-14 18:10:11,848] Trial 123 finished with value: -3.5613760683176743 and parameters: {'scalers': 'none', 'ratios': 'norm_ratio', 'imputers': 'none', 'n_estimators': 2250, 'learning_rate': 0.4698673516721856, 'max_depth': 10, 'min_child_weight': 1, 'subsample': 0.5, 'colsample_bytree': 1.0, 'colsample_bylevel': 0.6, 'reg_alpha': 0.0021922148955380275, 'reg_lambda': 1.3693568143372368, 'gamma': 0.02192403485286276}. Best is trial 62 with value: -4.109958479178393.
[I 2026-07-14 18:10:52,893] Trial 124 finished with value: -3.7021694483400323 and parameters: {'scalers': 'none', 'ratios': 'norm_ratio', 'imputers': 'none', 'n_estimators': 2250, 'learning_rate': 0.48932053824877286, 'max_depth': 10, 'min_child_weight': 1, 'subsample': 0.5, 'colsample_bytree': 1.0, 'colsample_bylevel': 0.6, 'reg_alpha': 0.0025829253484071298, 'reg_lambda': 1.4443451712268258, 'gamma': 0.022329697598233368}. Best is trial 62 with value: -4.109958479178393.
[I 2026-07-14 18:11:34,283] Trial 125 finished with value: -3.7163522998891603 and parameters: {'scalers': 'none', 'ratios': 'norm_ratio', 'imputers': 'none', 'n_estimators': 2300, 'learning_rate': 0.48019490126668707, 'max_depth': 10, 'min_child_weight': 1, 'subsample': 0.5, 'colsample_bytree': 1.0, 'colsample_bylevel': 0.6, 'reg_alpha': 0.003411912383897589, 'reg_lambda': 1.2230144106187117, 'gamma': 0.020496238430036527}. Best is trial 62 with value: -4.109958479178393.
[I 2026-07-14 18:12:14,415] Trial 126 finished with value: -3.5973867042839633 and parameters: {'scalers': 'none', 'ratios': 'norm_ratio', 'imputers': 'none', 'n_estimators': 2250, 'learning_rate': 0.47943175430078944, 'max_depth': 10, 'min_child_weight': 1, 'subsample': 0.5, 'colsample_bytree': 1.0, 'colsample_bylevel': 0.6, 'reg_alpha': 0.004574228639744585, 'reg_lambda': 1.1882169772654163, 'gamma': 0.01992186612481661}. Best is trial 62 with value: -4.109958479178393.
[I 2026-07-14 18:13:02,693] Trial 127 finished with value: -3.382847922177943 and parameters: {'scalers': 'none', 'ratios': 'norm_ratio', 'imputers': 'none', 'n_estimators': 2300, 'learning_rate': 0.3165574745205692, 'max_depth': 10, 'min_child_weight': 1, 'subsample': 0.5, 'colsample_bytree': 1.0, 'colsample_bylevel': 0.6, 'reg_alpha': 0.003954650615404407, 'reg_lambda': 3.8804046549672044, 'gamma': 0.004589371937219557}. Best is trial 62 with value: -4.109958479178393.
[I 2026-07-14 18:13:43,097] Trial 128 finished with value: -3.546384209848396 and parameters: {'scalers': 'none', 'ratios': 'norm_ratio', 'imputers': 'none', 'n_estimators': 2250, 'learning_rate': 0.4820783598879442, 'max_depth': 10, 'min_child_weight': 1, 'subsample': 0.5, 'colsample_bytree': 1.0, 'colsample_bylevel': 0.6, 'reg_alpha': 0.004135979200470457, 'reg_lambda': 1.2128787466417892, 'gamma': 0.0051111292295848605}. Best is trial 62 with value: -4.109958479178393.
[I 2026-07-14 18:14:21,564] Trial 129 finished with value: -2.829986452448054 and parameters: {'scalers': 'none', 'ratios': 'norm_ratio', 'imputers': 'none', 'n_estimators': 2200, 'learning_rate': 0.3140595208727373, 'max_depth': 10, 'min_child_weight': 1, 'subsample': 0.5, 'colsample_bytree': 1.0, 'colsample_bylevel': 0.6, 'reg_alpha': 1.1473853344201533e-06, 'reg_lambda': 1.4460069725310276, 'gamma': 0.05956122413537429}. Best is trial 62 with value: -4.109958479178393.
[I 2026-07-14 18:15:02,626] Trial 130 finished with value: -3.7758769559841223 and parameters: {'scalers': 'none', 'ratios': 'norm_ratio', 'imputers': 'none', 'n_estimators': 2250, 'learning_rate': 0.49824441252573953, 'max_depth': 10, 'min_child_weight': 1, 'subsample': 0.5, 'colsample_bytree': 1.0, 'colsample_bylevel': 0.6, 'reg_alpha': 0.004563584946707933, 'reg_lambda': 1.5670357161796131, 'gamma': 0.062408275843389496}. Best is trial 62 with value: -4.109958479178393.
[I 2026-07-14 18:15:42,560] Trial 131 finished with value: -2.869384731343528 and parameters: {'scalers': 'none', 'ratios': 'norm_ratio', 'imputers': 'none', 'n_estimators': 2250, 'learning_rate': 0.3192936669341869, 'max_depth': 10, 'min_child_weight': 1, 'subsample': 0.5, 'colsample_bytree': 1.0, 'colsample_bylevel': 0.6, 'reg_alpha': 0.004334203747126622, 'reg_lambda': 1.5580751885647326, 'gamma': 0.05317668478266933}. Best is trial 62 with value: -4.109958479178393.
[I 2026-07-14 18:16:23,941] Trial 132 finished with value: -3.7067924905533314 and parameters: {'scalers': 'none', 'ratios': 'norm_ratio', 'imputers': 'none', 'n_estimators': 2250, 'learning_rate': 0.48402064534934924, 'max_depth': 10, 'min_child_weight': 1, 'subsample': 0.5, 'colsample_bytree': 1.0, 'colsample_bylevel': 0.6, 'reg_alpha': 0.012059794535749322, 'reg_lambda': 1.5726451417349387, 'gamma': 0.06630835016623453}. Best is trial 62 with value: -4.109958479178393.
[I 2026-07-14 18:17:05,129] Trial 133 finished with value: -3.7738078467059895 and parameters: {'scalers': 'none', 'ratios': 'norm_ratio', 'imputers': 'none', 'n_estimators': 2250, 'learning_rate': 0.4831712058776979, 'max_depth': 10, 'min_child_weight': 1, 'subsample': 0.5, 'colsample_bytree': 1.0, 'colsample_bylevel': 0.6, 'reg_alpha': 0.0037771638571966245, 'reg_lambda': 1.6511684158563906, 'gamma': 0.0626932298135823}. Best is trial 62 with value: -4.109958479178393.
[I 2026-07-14 18:17:47,099] Trial 134 finished with value: -3.7579829416592854 and parameters: {'scalers': 'none', 'ratios': 'norm_ratio', 'imputers': 'none', 'n_estimators': 2250, 'learning_rate': 0.4792361401838828, 'max_depth': 10, 'min_child_weight': 1, 'subsample': 0.5, 'colsample_bytree': 1.0, 'colsample_bylevel': 0.6, 'reg_alpha': 1.1961821693991608e-06, 'reg_lambda': 1.8388667627039963, 'gamma': 0.0710269373650737}. Best is trial 62 with value: -4.109958479178393.
[I 2026-07-14 18:18:24,451] Trial 135 finished with value: -3.7950763723608394 and parameters: {'scalers': 'none', 'ratios': 'norm_ratio', 'imputers': 'none', 'n_estimators': 2200, 'learning_rate': 0.49656201826749913, 'max_depth': 10, 'min_child_weight': 1, 'subsample': 0.5, 'colsample_bytree': 1.0, 'colsample_bylevel': 0.6, 'reg_alpha': 0.004920921024060542, 'reg_lambda': 1.6172831487938069, 'gamma': 0.07336496938013329}. Best is trial 62 with value: -4.109958479178393.
[I 2026-07-14 18:18:52,200] Trial 136 finished with value: -3.590100725471265 and parameters: {'scalers': 'none', 'ratios': 'norm_ratio', 'imputers': 'none', 'n_estimators': 2150, 'learning_rate': 0.4928409565601125, 'max_depth': 9, 'min_child_weight': 1, 'subsample': 0.5, 'colsample_bytree': 1.0, 'colsample_bylevel': 0.6, 'reg_alpha': 0.03520594287375853, 'reg_lambda': 1.7055091520956227, 'gamma': 0.07048349181439134}. Best is trial 62 with value: -4.109958479178393.
