[I 2026-07-14 20:31:23,881] Trial 90 finished with value: -0.32450138080241775 and parameters: {'scalers': 'standard', 'ratios': 'log_ratio', 'imputers': 'none', 'n_estimators': 1450, 'learning_rate': 0.38078742447021213, 'max_depth': 9, 'min_child_weight': 1, 'subsample': 0.6, 'colsample_bytree': 0.6, 'colsample_bylevel': 0.5, 'reg_alpha': 0.0003977849864133008, 'reg_lambda': 1.9305567558377716, 'gamma': 0.006857999347868155}. Best is trial 75 with value: -0.7019641657673503.
[I 2026-07-14 20:31:25,138] Trial 91 finished with value: -0.05441473391225185 and parameters: {'scalers': 'standard', 'ratios': 'log_ratio', 'imputers': 'mean', 'n_estimators': 1650, 'learning_rate': 0.0016307710637225956, 'max_depth': 9, 'min_child_weight': 1, 'subsample': 0.6, 'colsample_bytree': 0.7, 'colsample_bylevel': 0.5, 'reg_alpha': 25.178701019836385, 'reg_lambda': 14.240047454134908, 'gamma': 0.0016749454802183034}. Best is trial 75 with value: -0.7019641657673503.
[I 2026-07-14 20:31:26,757] Trial 92 finished with value: -0.054402891651914954 and parameters: {'scalers': 'standard', 'ratios': 'log_ratio', 'imputers': 'mean', 'n_estimators': 1650, 'learning_rate': 0.49987122402493556, 'max_depth': 9, 'min_child_weight': 1, 'subsample': 0.6, 'colsample_bytree': 0.7, 'colsample_bylevel': 0.5, 'reg_alpha': 30.82992153934709, 'reg_lambda': 0.041859934766290324, 'gamma': 0.008469562756821413}. Best is trial 75 with value: -0.7019641657673503.
[I 2026-07-14 20:31:34,419] Trial 93 finished with value: -0.06060630831442546 and parameters: {'scalers': 'standard', 'ratios': 'log_ratio', 'imputers': 'mean', 'n_estimators': 1650, 'learning_rate': 0.003058421713698115, 'max_depth': 9, 'min_child_weight': 9, 'subsample': 0.6, 'colsample_bytree': 0.6, 'colsample_bylevel': 0.5, 'reg_alpha': 0.0004143013386156072, 'reg_lambda': 5.89232680785159, 'gamma': 0.013425848022981295}. Best is trial 75 with value: -0.7019641657673503.
[I 2026-07-14 20:31:35,312] Trial 94 finished with value: -0.05440149320717408 and parameters: {'scalers': 'standard', 'ratios': 'log_ratio', 'imputers': 'mean', 'n_estimators': 1100, 'learning_rate': 0.0024888881490216595, 'max_depth': 10, 'min_child_weight': 10, 'subsample': 0.6, 'colsample_bytree': 0.7, 'colsample_bylevel': 0.5, 'reg_alpha': 12.636538074169929, 'reg_lambda': 0.0029754182321188568, 'gamma': 0.011692033232170829}. Best is trial 75 with value: -0.7019641657673503.
[I 2026-07-14 20:31:36,978] Trial 95 finished with value: -0.05439637122338492 and parameters: {'scalers': 'standard', 'ratios': 'log_ratio', 'imputers': 'none', 'n_estimators': 1650, 'learning_rate': 0.1558248523050007, 'max_depth': 10, 'min_child_weight': 9, 'subsample': 0.6, 'colsample_bytree': 0.7, 'colsample_bylevel': 0.6, 'reg_alpha': 26.347549793284056, 'reg_lambda': 4.871009780038039, 'gamma': 0.012427873315442811}. Best is trial 75 with value: -0.7019641657673503.
[I 2026-07-14 20:31:48,207] Trial 96 finished with value: -0.05877974254969379 and parameters: {'scalers': 'standard', 'ratios': 'log_ratio', 'imputers': 'none', 'n_estimators': 1150, 'learning_rate': 0.002051644547919797, 'max_depth': 10, 'min_child_weight': 1, 'subsample': 0.6, 'colsample_bytree': 0.8, 'colsample_bylevel': 0.5, 'reg_alpha': 0.06581311439505136, 'reg_lambda': 4.85396716955799, 'gamma': 0.001786759800815836}. Best is trial 75 with value: -0.7019641657673503.
[I 2026-07-14 20:31:58,412] Trial 97 finished with value: -0.054515923990090046 and parameters: {'scalers': 'standard', 'ratios': 'log_ratio', 'imputers': 'none', 'n_estimators': 1100, 'learning_rate': 0.00036201270648480283, 'max_depth': 10, 'min_child_weight': 1, 'subsample': 0.6, 'colsample_bytree': 0.8, 'colsample_bylevel': 0.5, 'reg_alpha': 0.052528049049384976, 'reg_lambda': 5.84710743614188, 'gamma': 0.00012741703454112205}. Best is trial 75 with value: -0.7019641657673503.
[I 2026-07-14 20:32:04,506] Trial 98 finished with value: -0.10505300215752374 and parameters: {'scalers': 'standard', 'ratios': 'log_ratio', 'imputers': 'none', 'n_estimators': 1150, 'learning_rate': 0.16432628573693875, 'max_depth': 10, 'min_child_weight': 9, 'subsample': 0.6, 'colsample_bytree': 0.8, 'colsample_bylevel': 0.5, 'reg_alpha': 0.038303810729692016, 'reg_lambda': 5.267792788464322, 'gamma': 0.00011601337303042697}. Best is trial 75 with value: -0.7019641657673503.
[I 2026-07-14 20:32:19,250] Trial 99 finished with value: -0.2823529668560409 and parameters: {'scalers': 'standard', 'ratios': 'log_ratio', 'imputers': 'none', 'n_estimators': 1800, 'learning_rate': 0.1596833010028558, 'max_depth': 10, 'min_child_weight': 1, 'subsample': 0.6, 'colsample_bytree': 0.8, 'colsample_bylevel': 0.6, 'reg_alpha': 0.04200248945803361, 'reg_lambda': 5.416858263527256, 'gamma': 0.00015687521065942098}. Best is trial 75 with value: -0.7019641657673503.
[I 2026-07-14 20:32:26,229] Trial 100 finished with value: -0.1874143547326868 and parameters: {'scalers': 'standard', 'ratios': 'log_ratio', 'imputers': 'none', 'n_estimators': 1150, 'learning_rate': 0.15853674626041897, 'max_depth': 10, 'min_child_weight': 1, 'subsample': 0.6, 'colsample_bytree': 0.6, 'colsample_bylevel': 0.7, 'reg_alpha': 0.03612323112791334, 'reg_lambda': 1.0843078223397742, 'gamma': 0.00010564948003274843}. Best is trial 75 with value: -0.7019641657673503.
[I 2026-07-14 20:32:36,870] Trial 101 finished with value: -0.2647423593125108 and parameters: {'scalers': 'standard', 'ratios': 'log_ratio', 'imputers': 'none', 'n_estimators': 1150, 'learning_rate': 0.19270441141875821, 'max_depth': 10, 'min_child_weight': 1, 'subsample': 0.6, 'colsample_bytree': 0.8, 'colsample_bylevel': 0.7, 'reg_alpha': 0.038873586401758364, 'reg_lambda': 5.580292990802671, 'gamma': 0.00013176245537438702}. Best is trial 75 with value: -0.7019641657673503.
[I 2026-07-14 20:32:56,837] Trial 102 finished with value: -0.0545471680607233 and parameters: {'scalers': 'standard', 'ratios': 'log_ratio', 'imputers': 'none', 'n_estimators': 1800, 'learning_rate': 0.00028781563635052395, 'max_depth': 10, 'min_child_weight': 1, 'subsample': 0.7, 'colsample_bytree': 0.8, 'colsample_bylevel': 0.6, 'reg_alpha': 0.03452899093703735, 'reg_lambda': 5.592667104299455, 'gamma': 0.0001075397604747212}. Best is trial 75 with value: -0.7019641657673503.
[I 2026-07-14 20:33:08,277] Trial 103 finished with value: -0.19398386595635175 and parameters: {'scalers': 'standard', 'ratios': 'log_ratio', 'imputers': 'none', 'n_estimators': 1800, 'learning_rate': 0.2017688273524151, 'max_depth': 10, 'min_child_weight': 1, 'subsample': 0.7, 'colsample_bytree': 0.6, 'colsample_bylevel': 0.7, 'reg_alpha': 0.03927365376575291, 'reg_lambda': 1.012135440215191e-06, 'gamma': 9.196189232827951e-05}. Best is trial 75 with value: -0.7019641657673503.
[I 2026-07-14 20:33:13,862] Trial 104 finished with value: -0.15725744394835678 and parameters: {'scalers': 'standard', 'ratios': 'log_ratio', 'imputers': 'none', 'n_estimators': 1800, 'learning_rate': 0.19602631304105034, 'max_depth': 7, 'min_child_weight': 1, 'subsample': 0.7, 'colsample_bytree': 0.6, 'colsample_bylevel': 0.7, 'reg_alpha': 0.008054283765394864, 'reg_lambda': 1.1188343968077192, 'gamma': 0.00014345889482098145}. Best is trial 75 with value: -0.7019641657673503.
[I 2026-07-14 20:33:17,449] Trial 105 finished with value: -0.12192943215546194 and parameters: {'scalers': 'standard', 'ratios': 'log_ratio', 'imputers': 'none', 'n_estimators': 950, 'learning_rate': 0.19957502387855758, 'max_depth': 7, 'min_child_weight': 1, 'subsample': 0.7, 'colsample_bytree': 0.6, 'colsample_bylevel': 0.7, 'reg_alpha': 0.00622769614917388, 'reg_lambda': 0.3370639820702657, 'gamma': 0.00016547512145058147}. Best is trial 75 with value: -0.7019641657673503.
[I 2026-07-14 20:33:24,752] Trial 106 finished with value: -0.17044458834260806 and parameters: {'scalers': 'standard', 'ratios': 'log_ratio', 'imputers': 'none', 'n_estimators': 1850, 'learning_rate': 0.20588856585518356, 'max_depth': 7, 'min_child_weight': 1, 'subsample': 0.7, 'colsample_bytree': 0.6, 'colsample_bylevel': 0.7, 'reg_alpha': 0.15422942617899213, 'reg_lambda': 0.3805350931850468, 'gamma': 0.00020272982830762932}. Best is trial 75 with value: -0.7019641657673503.
[I 2026-07-14 20:33:28,343] Trial 107 finished with value: -0.12037819742408334 and parameters: {'scalers': 'standard', 'ratios': 'log_ratio', 'imputers': 'none', 'n_estimators': 950, 'learning_rate': 0.20445684161859115, 'max_depth': 7, 'min_child_weight': 2, 'subsample': 0.7, 'colsample_bytree': 0.6, 'colsample_bylevel': 0.7, 'reg_alpha': 0.005682404461969635, 'reg_lambda': 1.150240694190192, 'gamma': 3.8233709672196115e-05}. Best is trial 75 with value: -0.7019641657673503.
[I 2026-07-14 20:33:33,581] Trial 108 finished with value: -0.15758421683512558 and parameters: {'scalers': 'standard', 'ratios': 'log_ratio', 'imputers': 'none', 'n_estimators': 1450, 'learning_rate': 0.3201596610360607, 'max_depth': 7, 'min_child_weight': 1, 'subsample': 0.7, 'colsample_bytree': 0.6, 'colsample_bylevel': 0.7, 'reg_alpha': 0.006030463303834733, 'reg_lambda': 0.3439084448725019, 'gamma': 0.00499298068353476}. Best is trial 75 with value: -0.7019641657673503.
[I 2026-07-14 20:33:39,243] Trial 109 finished with value: -0.2062447005852054 and parameters: {'scalers': 'standard', 'ratios': 'log_ratio', 'imputers': 'none', 'n_estimators': 1450, 'learning_rate': 0.42336764876406513, 'max_depth': 7, 'min_child_weight': 2, 'subsample': 0.7, 'colsample_bytree': 0.6, 'colsample_bylevel': 0.6, 'reg_alpha': 0.007473076648996574, 'reg_lambda': 2.617650422913127, 'gamma': 0.005925489204288645}. Best is trial 75 with value: -0.7019641657673503.
[I 2026-07-14 20:33:44,822] Trial 110 finished with value: -0.1852564592783144 and parameters: {'scalers': 'standard', 'ratios': 'log_ratio', 'imputers': 'none', 'n_estimators': 1500, 'learning_rate': 0.32702523898060204, 'max_depth': 7, 'min_child_weight': 2, 'subsample': 0.6, 'colsample_bytree': 0.6, 'colsample_bylevel': 0.6, 'reg_alpha': 0.0055489599465171425, 'reg_lambda': 2.6904303945380783, 'gamma': 0.021531240495034517}. Best is trial 75 with value: -0.7019641657673503.
[I 2026-07-14 20:33:50,608] Trial 111 finished with value: -0.19472130082616393 and parameters: {'scalers': 'standard', 'ratios': 'log_ratio', 'imputers': 'none', 'n_estimators': 1500, 'learning_rate': 0.3254175823208771, 'max_depth': 7, 'min_child_weight': 2, 'subsample': 0.6, 'colsample_bytree': 0.6, 'colsample_bylevel': 0.6, 'reg_alpha': 0.005687852407917109, 'reg_lambda': 3.056605067663177, 'gamma': 0.005459721678803041}. Best is trial 75 with value: -0.7019641657673503.
[I 2026-07-14 20:34:02,509] Trial 112 finished with value: -0.3409740309190308 and parameters: {'scalers': 'standard', 'ratios': 'log_ratio', 'imputers': 'none', 'n_estimators': 1450, 'learning_rate': 0.4367727022736078, 'max_depth': 11, 'min_child_weight': 2, 'subsample': 0.6, 'colsample_bytree': 0.6, 'colsample_bylevel': 0.6, 'reg_alpha': 1.098105886666116, 'reg_lambda': 2.3684267490005255, 'gamma': 0.00022305505820841926}. Best is trial 75 with value: -0.7019641657673503.
[I 2026-07-14 20:34:09,336] Trial 113 finished with value: -0.21912829967933456 and parameters: {'scalers': 'standard', 'ratios': 'log_ratio', 'imputers': 'none', 'n_estimators': 1450, 'learning_rate': 0.3233287911544345, 'max_depth': 8, 'min_child_weight': 2, 'subsample': 0.6, 'colsample_bytree': 0.6, 'colsample_bylevel': 0.6, 'reg_alpha': 0.0017280903834879927, 'reg_lambda': 3.304308967932504, 'gamma': 0.004817659753134363}. Best is trial 75 with value: -0.7019641657673503.
[I 2026-07-14 20:34:16,234] Trial 114 finished with value: -0.20797396161098752 and parameters: {'scalers': 'standard', 'ratios': 'log_ratio', 'imputers': 'none', 'n_estimators': 1500, 'learning_rate': 0.31796418721448794, 'max_depth': 8, 'min_child_weight': 2, 'subsample': 0.6, 'colsample_bytree': 0.6, 'colsample_bylevel': 0.6, 'reg_alpha': 0.0046908629759225525, 'reg_lambda': 2.776103418661532, 'gamma': 0.007023582387189132}. Best is trial 75 with value: -0.7019641657673503.
[I 2026-07-14 20:34:24,590] Trial 115 finished with value: -0.29660240372367136 and parameters: {'scalers': 'standard', 'ratios': 'log_ratio', 'imputers': 'none', 'n_estimators': 1500, 'learning_rate': 0.427310674958065, 'max_depth': 8, 'min_child_weight': 2, 'subsample': 0.6, 'colsample_bytree': 0.6, 'colsample_bylevel': 0.6, 'reg_alpha': 1.3815153643346925, 'reg_lambda': 2.356073005082732, 'gamma': 0.005685583988307148}. Best is trial 75 with value: -0.7019641657673503.
[I 2026-07-14 20:34:35,306] Trial 116 finished with value: -0.3458061502587192 and parameters: {'scalers': 'standard', 'ratios': 'log_ratio', 'imputers': 'none', 'n_estimators': 1550, 'learning_rate': 0.4397252184418064, 'max_depth': 11, 'min_child_weight': 2, 'subsample': 0.6, 'colsample_bytree': 0.6, 'colsample_bylevel': 0.6, 'reg_alpha': 1.3213919536306076, 'reg_lambda': 2.394546990261145, 'gamma': 0.0069287349565996595}. Best is trial 75 with value: -0.7019641657673503.
[I 2026-07-14 20:34:46,812] Trial 117 finished with value: -0.26587887759977674 and parameters: {'scalers': 'standard', 'ratios': 'log_ratio', 'imputers': 'none', 'n_estimators': 1500, 'learning_rate': 0.33139212713948885, 'max_depth': 11, 'min_child_weight': 2, 'subsample': 0.6, 'colsample_bytree': 0.6, 'colsample_bylevel': 0.6, 'reg_alpha': 0.0018089089562306846, 'reg_lambda': 2.3626070792519904, 'gamma': 0.002508209426606928}. Best is trial 75 with value: -0.7019641657673503.
[I 2026-07-14 20:34:58,023] Trial 118 finished with value: -0.3827395765535661 and parameters: {'scalers': 'standard', 'ratios': 'log_ratio', 'imputers': 'none', 'n_estimators': 1550, 'learning_rate': 0.44748071029320385, 'max_depth': 8, 'min_child_weight': 1, 'subsample': 0.8, 'colsample_bytree': 0.7, 'colsample_bylevel': 0.6, 'reg_alpha': 1.3470433769516001, 'reg_lambda': 16.65751037184448, 'gamma': 0.0007843348598114447}. Best is trial 75 with value: -0.7019641657673503.
[I 2026-07-14 20:35:06,699] Trial 119 finished with value: -0.4162483492602075 and parameters: {'scalers': 'standard', 'ratios': 'log_ratio', 'imputers': 'none', 'n_estimators': 1350, 'learning_rate': 0.4299526830754831, 'max_depth': 8, 'min_child_weight': 1, 'subsample': 0.6, 'colsample_bytree': 0.7, 'colsample_bylevel': 0.6, 'reg_alpha': 1.2819358755109496, 'reg_lambda': 53.6830458782909, 'gamma': 0.0006995068973840356}. Best is trial 75 with value: -0.7019641657673503.
[I 2026-07-14 20:35:22,869] Trial 120 finished with value: -0.4097899452347854 and parameters: {'scalers': 'standard', 'ratios': 'log_ratio', 'imputers': 'none', 'n_estimators': 2200, 'learning_rate': 0.4438655153453864, 'max_depth': 11, 'min_child_weight': 2, 'subsample': 0.6, 'colsample_bytree': 0.6, 'colsample_bylevel': 0.6, 'reg_alpha': 1.2071412917465398, 'reg_lambda': 16.51027774836215, 'gamma': 0.00024689999346131356}. Best is trial 75 with value: -0.7019641657673503.
[I 2026-07-14 20:35:34,424] Trial 121 finished with value: -0.3198644845404322 and parameters: {'scalers': 'standard', 'ratios': 'log_ratio', 'imputers': 'none', 'n_estimators': 1250, 'learning_rate': 0.4668239457818591, 'max_depth': 11, 'min_child_weight': 2, 'subsample': 0.8, 'colsample_bytree': 0.6, 'colsample_bylevel': 0.6, 'reg_alpha': 0.009984405135110173, 'reg_lambda': 9.253635346690523, 'gamma': 0.0006500817797943791}. Best is trial 75 with value: -0.7019641657673503.
[I 2026-07-14 20:35:53,934] Trial 122 finished with value: -0.7530613221681185 and parameters: {'scalers': 'standard', 'ratios': 'log_ratio', 'imputers': 'none', 'n_estimators': 2200, 'learning_rate': 0.43846263489781173, 'max_depth': 11, 'min_child_weight': 1, 'subsample': 0.6, 'colsample_bytree': 0.6, 'colsample_bylevel': 0.6, 'reg_alpha': 1.0747379081762367, 'reg_lambda': 18.07658562933181, 'gamma': 0.0007101431135464375}. Best is trial 122 with value: -0.7530613221681185.
[I 2026-07-14 20:36:06,780] Trial 123 finished with value: -0.7862010225542801 and parameters: {'scalers': 'standard', 'ratios': 'log_ratio', 'imputers': 'none', 'n_estimators': 1250, 'learning_rate': 0.49663432427797594, 'max_depth': 11, 'min_child_weight': 1, 'subsample': 0.6, 'colsample_bytree': 0.6, 'colsample_bylevel': 0.6, 'reg_alpha': 0.7880263676165822, 'reg_lambda': 18.909994015277945, 'gamma': 0.0006758304417577779}. Best is trial 123 with value: -0.7862010225542801.
[I 2026-07-14 20:36:12,215] Trial 124 finished with value: -0.3438314151735869 and parameters: {'scalers': 'standard', 'ratios': 'log_ratio', 'imputers': 'none', 'n_estimators': 700, 'learning_rate': 0.4970041444205299, 'max_depth': 11, 'min_child_weight': 2, 'subsample': 0.6, 'colsample_bytree': 0.6, 'colsample_bylevel': 0.6, 'reg_alpha': 0.9962543269647377, 'reg_lambda': 15.405744407540846, 'gamma': 0.002502983072161899}. Best is trial 123 with value: -0.7862010225542801.
[I 2026-07-14 20:36:35,582] Trial 125 finished with value: -0.5572844856108803 and parameters: {'scalers': 'standard', 'ratios': 'log_ratio', 'imputers': 'none', 'n_estimators': 2200, 'learning_rate': 0.4775907308196538, 'max_depth': 11, 'min_child_weight': 1, 'subsample': 0.8, 'colsample_bytree': 0.6, 'colsample_bylevel': 0.6, 'reg_alpha': 0.7335180448586132, 'reg_lambda': 18.555519600261213, 'gamma': 0.002235904999198613}. Best is trial 123 with value: -0.7862010225542801.
[I 2026-07-14 20:36:38,738] Trial 126 finished with value: -0.24813855028227777 and parameters: {'scalers': 'standard', 'ratios': 'log_ratio', 'imputers': 'none', 'n_estimators': 400, 'learning_rate': 0.2665771156508349, 'max_depth': 11, 'min_child_weight': 1, 'subsample': 0.8, 'colsample_bytree': 0.7, 'colsample_bylevel': 0.6, 'reg_alpha': 0.7359538784600766, 'reg_lambda': 19.24898680481831, 'gamma': 0.0005554892977349085}. Best is trial 123 with value: -0.7862010225542801.
[I 2026-07-14 20:36:45,094] Trial 127 finished with value: -0.2855508821976965 and parameters: {'scalers': 'standard', 'ratios': 'log_ratio', 'imputers': 'none', 'n_estimators': 750, 'learning_rate': 0.2644003646666521, 'max_depth': 11, 'min_child_weight': 1, 'subsample': 0.8, 'colsample_bytree': 0.7, 'colsample_bylevel': 0.6, 'reg_alpha': 0.933344795333961, 'reg_lambda': 55.411934439749665, 'gamma': 0.0006769057750277254}. Best is trial 123 with value: -0.7862010225542801.
[I 2026-07-14 20:36:55,290] Trial 128 finished with value: -0.3294281320644982 and parameters: {'scalers': 'standard', 'ratios': 'log_ratio', 'imputers': 'none', 'n_estimators': 1350, 'learning_rate': 0.2697996269008755, 'max_depth': 11, 'min_child_weight': 1, 'subsample': 0.8, 'colsample_bytree': 0.7, 'colsample_bylevel': 0.6, 'reg_alpha': 1.4857044619981727, 'reg_lambda': 53.39310750941734, 'gamma': 0.0006120463351373628}. Best is trial 123 with value: -0.7862010225542801.
[I 2026-07-14 20:37:28,729] Trial 129 finished with value: -0.6059253952347585 and parameters: {'scalers': 'standard', 'ratios': 'log_ratio', 'imputers': 'none', 'n_estimators': 2800, 'learning_rate': 0.49949722836037674, 'max_depth': 11, 'min_child_weight': 1, 'subsample': 0.8, 'colsample_bytree': 0.7, 'colsample_bylevel': 0.6, 'reg_alpha': 0.7226330008232196, 'reg_lambda': 17.630727134258336, 'gamma': 0.0005718795863526527}. Best is trial 123 with value: -0.7862010225542801.
[I 2026-07-14 20:37:50,673] Trial 130 finished with value: -0.4015634843167381 and parameters: {'scalers': 'standard', 'ratios': 'log_ratio', 'imputers': 'none', 'n_estimators': 2200, 'learning_rate': 0.2650439902952248, 'max_depth': 11, 'min_child_weight': 1, 'subsample': 0.8, 'colsample_bytree': 0.7, 'colsample_bylevel': 0.6, 'reg_alpha': 0.6513981571154802, 'reg_lambda': 22.391203692842577, 'gamma': 0.0006006780477265737}. Best is trial 123 with value: -0.7862010225542801.
[I 2026-07-14 20:38:09,471] Trial 131 finished with value: -0.48686963175484105 and parameters: {'scalers': 'standard', 'ratios': 'log_ratio', 'imputers': 'none', 'n_estimators': 2150, 'learning_rate': 0.2716678121846152, 'max_depth': 11, 'min_child_weight': 1, 'subsample': 0.6, 'colsample_bytree': 0.7, 'colsample_bylevel': 0.6, 'reg_alpha': 0.6789312034822593, 'reg_lambda': 50.69411230289302, 'gamma': 0.0006543999384910128}. Best is trial 123 with value: -0.7862010225542801.
[I 2026-07-14 20:38:31,325] Trial 132 finished with value: -0.4065461126624933 and parameters: {'scalers': 'standard', 'ratios': 'log_ratio', 'imputers': 'none', 'n_estimators': 2200, 'learning_rate': 0.27287721803389114, 'max_depth': 11, 'min_child_weight': 1, 'subsample': 0.8, 'colsample_bytree': 0.7, 'colsample_bylevel': 0.6, 'reg_alpha': 0.6601826759994425, 'reg_lambda': 24.461656864299776, 'gamma': 0.00045177569897665533}. Best is trial 123 with value: -0.7862010225542801.
[I 2026-07-14 20:38:51,633] Trial 133 finished with value: -0.39874675837430623 and parameters: {'scalers': 'standard', 'ratios': 'log_ratio', 'imputers': 'none', 'n_estimators': 2200, 'learning_rate': 0.2677325469835875, 'max_depth': 11, 'min_child_weight': 1, 'subsample': 0.8, 'colsample_bytree': 0.7, 'colsample_bylevel': 0.6, 'reg_alpha': 0.6853641035619662, 'reg_lambda': 52.5848632493142, 'gamma': 0.0006936883334047538}. Best is trial 123 with value: -0.7862010225542801.
[I 2026-07-14 20:39:09,384] Trial 134 finished with value: -0.4077838190134958 and parameters: {'scalers': 'standard', 'ratios': 'log_ratio', 'imputers': 'none', 'n_estimators': 2200, 'learning_rate': 0.266912824327226, 'max_depth': 11, 'min_child_weight': 1, 'subsample': 0.8, 'colsample_bytree': 0.5, 'colsample_bylevel': 0.6, 'reg_alpha': 0.5496463592757035, 'reg_lambda': 48.1656566790216, 'gamma': 0.000737784848489103}. Best is trial 123 with value: -0.7862010225542801.
