[I 2026-07-14 21:49:13,086] Trial 91 finished with value: -0.7990843214865397 and parameters: {'scalers': 'none', 'ratios': 'norm_ratio', 'imputers': 'mean', 'n_estimators': 2200, 'learning_rate': 0.13070457921600795, 'max_depth': 12, 'min_child_weight': 3, 'subsample': 1.0, 'colsample_bytree': 0.7, 'colsample_bylevel': 0.9, 'reg_alpha': 5.829764194366514, 'reg_lambda': 0.11877219144471755, 'gamma': 6.548269930545616e-05}. Best is trial 51 with value: -1.6968749106923018.
[I 2026-07-14 21:49:25,147] Trial 92 finished with value: -0.9442985909857962 and parameters: {'scalers': 'none', 'ratios': 'norm_ratio', 'imputers': 'none', 'n_estimators': 2150, 'learning_rate': 0.12549093933419964, 'max_depth': 12, 'min_child_weight': 2, 'subsample': 1.0, 'colsample_bytree': 0.7, 'colsample_bylevel': 0.9, 'reg_alpha': 4.644863355944446, 'reg_lambda': 0.023497258589084632, 'gamma': 6.32347546183857e-05}. Best is trial 51 with value: -1.6968749106923018.
[I 2026-07-14 21:49:35,139] Trial 93 finished with value: -0.7893746298477433 and parameters: {'scalers': 'none', 'ratios': 'norm_ratio', 'imputers': 'none', 'n_estimators': 2150, 'learning_rate': 0.1321207007720943, 'max_depth': 10, 'min_child_weight': 2, 'subsample': 0.9, 'colsample_bytree': 0.7, 'colsample_bylevel': 0.9, 'reg_alpha': 5.704043128351603, 'reg_lambda': 0.02966319950693732, 'gamma': 7.195965803595473e-05}. Best is trial 51 with value: -1.6968749106923018.
[I 2026-07-14 21:49:45,292] Trial 94 finished with value: -0.7802367383469206 and parameters: {'scalers': 'none', 'ratios': 'norm_ratio', 'imputers': 'mean', 'n_estimators': 2200, 'learning_rate': 0.13000363001459894, 'max_depth': 10, 'min_child_weight': 2, 'subsample': 0.9, 'colsample_bytree': 0.7, 'colsample_bylevel': 0.9, 'reg_alpha': 5.776933619409825, 'reg_lambda': 0.03159521281475649, 'gamma': 2.9797617937932693e-06}. Best is trial 51 with value: -1.6968749106923018.
[I 2026-07-14 21:49:56,676] Trial 95 finished with value: -0.9202617780938376 and parameters: {'scalers': 'none', 'ratios': 'norm_ratio', 'imputers': 'mean', 'n_estimators': 2200, 'learning_rate': 0.12518479390974793, 'max_depth': 10, 'min_child_weight': 2, 'subsample': 0.9, 'colsample_bytree': 0.7, 'colsample_bylevel': 0.9, 'reg_alpha': 4.285325768254046, 'reg_lambda': 2.040798447302749, 'gamma': 1.068900723603182e-06}. Best is trial 51 with value: -1.6968749106923018.
[I 2026-07-14 21:50:09,824] Trial 96 finished with value: -0.5079430070242084 and parameters: {'scalers': 'none', 'ratios': 'norm_ratio', 'imputers': 'mean', 'n_estimators': 2200, 'learning_rate': 0.0007257827791270897, 'max_depth': 10, 'min_child_weight': 2, 'subsample': 0.9, 'colsample_bytree': 0.7, 'colsample_bylevel': 0.9, 'reg_alpha': 4.502569626493279, 'reg_lambda': 0.49958251909788604, 'gamma': 0.0007265570728207342}. Best is trial 51 with value: -1.6968749106923018.
[I 2026-07-14 21:50:23,977] Trial 97 finished with value: -0.511381016479812 and parameters: {'scalers': 'none', 'ratios': 'norm_ratio', 'imputers': 'mean', 'n_estimators': 2200, 'learning_rate': 0.0005089435925449677, 'max_depth': 10, 'min_child_weight': 2, 'subsample': 0.9, 'colsample_bytree': 0.7, 'colsample_bylevel': 0.9, 'reg_alpha': 4.367896235093851, 'reg_lambda': 0.02511989920860987, 'gamma': 4.019733349853045e-06}. Best is trial 51 with value: -1.6968749106923018.
[I 2026-07-14 21:50:37,353] Trial 98 finished with value: -1.5555520099664606 and parameters: {'scalers': 'robust', 'ratios': 'norm_ratio', 'imputers': 'mean', 'n_estimators': 2200, 'learning_rate': 0.37559459370656073, 'max_depth': 10, 'min_child_weight': 2, 'subsample': 0.9, 'colsample_bytree': 0.7, 'colsample_bylevel': 0.9, 'reg_alpha': 4.389349330071487, 'reg_lambda': 1.917433524316672, 'gamma': 0.0008183895884633698}. Best is trial 51 with value: -1.6968749106923018.
[I 2026-07-14 21:51:04,462] Trial 99 finished with value: -2.4246488503291816 and parameters: {'scalers': 'robust', 'ratios': 'norm_ratio', 'imputers': 'mean', 'n_estimators': 2250, 'learning_rate': 0.4026709118290369, 'max_depth': 10, 'min_child_weight': 2, 'subsample': 0.9, 'colsample_bytree': 0.7, 'colsample_bylevel': 0.9, 'reg_alpha': 1.1161632913784552, 'reg_lambda': 0.46471856369840003, 'gamma': 0.0007798128487599299}. Best is trial 99 with value: -2.4246488503291816.
[I 2026-07-14 21:51:06,929] Trial 100 finished with value: -0.5306624182979568 and parameters: {'scalers': 'robust', 'ratios': 'norm_ratio', 'imputers': 'mean', 'n_estimators': 2450, 'learning_rate': 0.3893000038376228, 'max_depth': 10, 'min_child_weight': 2, 'subsample': 0.9, 'colsample_bytree': 0.8, 'colsample_bylevel': 0.9, 'reg_alpha': 32.92992369806156, 'reg_lambda': 0.5037960851385769, 'gamma': 0.0006294768117127596}. Best is trial 99 with value: -2.4246488503291816.
[I 2026-07-14 21:51:30,579] Trial 101 finished with value: -2.4603648394800857 and parameters: {'scalers': 'robust', 'ratios': 'norm_ratio', 'imputers': 'mean', 'n_estimators': 2450, 'learning_rate': 0.38132734133680046, 'max_depth': 10, 'min_child_weight': 2, 'subsample': 0.9, 'colsample_bytree': 0.5, 'colsample_bylevel': 1.0, 'reg_alpha': 1.1386195225862403, 'reg_lambda': 6.18898379165666, 'gamma': 0.0007659289108298409}. Best is trial 101 with value: -2.4603648394800857.
[I 2026-07-14 21:52:10,424] Trial 102 finished with value: -3.4593205071811006 and parameters: {'scalers': 'robust', 'ratios': 'norm_ratio', 'imputers': 'mean', 'n_estimators': 2250, 'learning_rate': 0.3820856285495012, 'max_depth': 11, 'min_child_weight': 1, 'subsample': 0.9, 'colsample_bytree': 0.8, 'colsample_bylevel': 1.0, 'reg_alpha': 1.2459824016903382, 'reg_lambda': 0.4645666563398974, 'gamma': 0.0007487211670265009}. Best is trial 102 with value: -3.4593205071811006.
[I 2026-07-14 21:52:11,298] Trial 103 finished with value: -0.5325488692344514 and parameters: {'scalers': 'robust', 'ratios': 'norm_ratio', 'imputers': 'mean', 'n_estimators': 1450, 'learning_rate': 0.3638271289682888, 'max_depth': 11, 'min_child_weight': 1, 'subsample': 0.7, 'colsample_bytree': 0.5, 'colsample_bylevel': 1.0, 'reg_alpha': 32.77819961834327, 'reg_lambda': 0.5100524270628077, 'gamma': 0.0008279487271967098}. Best is trial 102 with value: -3.4593205071811006.
[I 2026-07-14 21:52:13,954] Trial 104 finished with value: -0.5343902400071932 and parameters: {'scalers': 'robust', 'ratios': 'norm_ratio', 'imputers': 'mean', 'n_estimators': 2450, 'learning_rate': 0.3633372995830592, 'max_depth': 11, 'min_child_weight': 1, 'subsample': 0.7, 'colsample_bytree': 0.5, 'colsample_bylevel': 1.0, 'reg_alpha': 34.32839802419017, 'reg_lambda': 1.7665816089441806, 'gamma': 1.2556273203185818e-05}. Best is trial 102 with value: -3.4593205071811006.
[I 2026-07-14 21:52:45,888] Trial 106 finished with value: -0.5449521546933104 and parameters: {'scalers': 'robust', 'ratios': 'norm_ratio', 'imputers': 'mean', 'n_estimators': 2400, 'learning_rate': 0.383568310937087, 'max_depth': 11, 'min_child_weight': 1, 'subsample': 0.7, 'colsample_bytree': 0.8, 'colsample_bylevel': 1.0, 'reg_alpha': 67.43210195535012, 'reg_lambda': 7.435149895553077, 'gamma': 1.2845501471356051e-05}. Best is trial 102 with value: -3.4593205071811006.
[I 2026-07-14 21:52:46,264] Trial 105 finished with value: -2.2862165018308023 and parameters: {'scalers': 'robust', 'ratios': 'norm_ratio', 'imputers': 'mean', 'n_estimators': 2450, 'learning_rate': 0.3833258641307265, 'max_depth': 11, 'min_child_weight': 1, 'subsample': 1.0, 'colsample_bytree': 0.8, 'colsample_bylevel': 1.0, 'reg_alpha': 0.24983000222390953, 'reg_lambda': 6.806114766805383, 'gamma': 0.00013228155387645126}. Best is trial 102 with value: -3.4593205071811006.
[I 2026-07-14 21:52:47,134] Trial 107 finished with value: -0.5327987657205319 and parameters: {'scalers': 'robust', 'ratios': 'norm_ratio', 'imputers': 'mean', 'n_estimators': 1250, 'learning_rate': 0.38075333860127414, 'max_depth': 11, 'min_child_weight': 1, 'subsample': 0.9, 'colsample_bytree': 0.6, 'colsample_bylevel': 1.0, 'reg_alpha': 35.937163585484456, 'reg_lambda': 6.9022269007390085, 'gamma': 0.00014213596152473792}. Best is trial 102 with value: -3.4593205071811006.
[I 2026-07-14 21:53:27,250] Trial 108 finished with value: -3.1775862768669443 and parameters: {'scalers': 'robust', 'ratios': 'norm_ratio', 'imputers': 'mean', 'n_estimators': 2450, 'learning_rate': 0.2764409665583651, 'max_depth': 11, 'min_child_weight': 1, 'subsample': 0.9, 'colsample_bytree': 0.8, 'colsample_bylevel': 1.0, 'reg_alpha': 0.9476820763894828, 'reg_lambda': 7.213180347407269, 'gamma': 0.0001493850065091921}. Best is trial 102 with value: -3.4593205071811006.
[I 2026-07-14 21:53:41,299] Trial 109 finished with value: -2.888386863076685 and parameters: {'scalers': 'robust', 'ratios': 'norm_ratio', 'imputers': 'mean', 'n_estimators': 1450, 'learning_rate': 0.40728363465753925, 'max_depth': 9, 'min_child_weight': 1, 'subsample': 0.9, 'colsample_bytree': 0.6, 'colsample_bylevel': 1.0, 'reg_alpha': 0.290762598812979, 'reg_lambda': 6.3146641810368225, 'gamma': 0.00013766349633445268}. Best is trial 102 with value: -3.4593205071811006.
[I 2026-07-14 21:54:16,457] Trial 110 finished with value: -3.3265835140727305 and parameters: {'scalers': 'robust', 'ratios': 'norm_ratio', 'imputers': 'mean', 'n_estimators': 2450, 'learning_rate': 0.4104466945616743, 'max_depth': 9, 'min_child_weight': 1, 'subsample': 0.9, 'colsample_bytree': 0.8, 'colsample_bylevel': 1.0, 'reg_alpha': 1.2077942287139833, 'reg_lambda': 6.760726014312108, 'gamma': 0.00016948031157466777}. Best is trial 102 with value: -3.4593205071811006.
[I 2026-07-14 21:54:38,598] Trial 111 finished with value: -3.4568041113956838 and parameters: {'scalers': 'robust', 'ratios': 'norm_ratio', 'imputers': 'mean', 'n_estimators': 2250, 'learning_rate': 0.4185166493642591, 'max_depth': 9, 'min_child_weight': 1, 'subsample': 0.9, 'colsample_bytree': 0.5, 'colsample_bylevel': 1.0, 'reg_alpha': 1.1773656978731257, 'reg_lambda': 1.4902676795520826, 'gamma': 0.0024633626308513523}. Best is trial 102 with value: -3.4593205071811006.
[I 2026-07-14 21:55:05,805] Trial 112 finished with value: -0.7021046290465003 and parameters: {'scalers': 'robust', 'ratios': 'norm_ratio', 'imputers': 'mean', 'n_estimators': 2250, 'learning_rate': 0.00437761014171084, 'max_depth': 9, 'min_child_weight': 1, 'subsample': 0.9, 'colsample_bytree': 0.6, 'colsample_bylevel': 1.0, 'reg_alpha': 1.0061887434340022, 'reg_lambda': 7.413936494992745e-05, 'gamma': 0.0001289499272158659}. Best is trial 102 with value: -3.4593205071811006.
[I 2026-07-14 21:55:30,455] Trial 113 finished with value: -2.8887361591793574 and parameters: {'scalers': 'robust', 'ratios': 'norm_ratio', 'imputers': 'mean', 'n_estimators': 2250, 'learning_rate': 0.27712054107881956, 'max_depth': 9, 'min_child_weight': 1, 'subsample': 0.9, 'colsample_bytree': 0.6, 'colsample_bylevel': 1.0, 'reg_alpha': 1.19496065539581, 'reg_lambda': 6.1079654632670985, 'gamma': 0.00015512570698964227}. Best is trial 102 with value: -3.4593205071811006.
[I 2026-07-14 21:55:43,757] Trial 114 finished with value: -3.1293932380378866 and parameters: {'scalers': 'robust', 'ratios': 'norm_ratio', 'imputers': 'mean', 'n_estimators': 1150, 'learning_rate': 0.4954515588142146, 'max_depth': 9, 'min_child_weight': 1, 'subsample': 0.9, 'colsample_bytree': 0.6, 'colsample_bylevel': 1.0, 'reg_alpha': 0.9571087019784222, 'reg_lambda': 1.5780502994203152, 'gamma': 0.00017815564368400428}. Best is trial 102 with value: -3.4593205071811006.
[I 2026-07-14 21:56:11,566] Trial 115 finished with value: -0.6924761421085506 and parameters: {'scalers': 'robust', 'ratios': 'norm_ratio', 'imputers': 'mean', 'n_estimators': 2600, 'learning_rate': 0.003957205999023488, 'max_depth': 9, 'min_child_weight': 1, 'subsample': 0.9, 'colsample_bytree': 0.6, 'colsample_bylevel': 1.0, 'reg_alpha': 0.3159215563912861, 'reg_lambda': 1.4760001122120991, 'gamma': 0.000150824010070165}. Best is trial 102 with value: -3.4593205071811006.
[I 2026-07-14 21:56:39,164] Trial 116 finished with value: -0.7054766568086546 and parameters: {'scalers': 'robust', 'ratios': 'norm_ratio', 'imputers': 'mean', 'n_estimators': 2250, 'learning_rate': 0.004173218696256852, 'max_depth': 9, 'min_child_weight': 1, 'subsample': 0.9, 'colsample_bytree': 0.6, 'colsample_bylevel': 1.0, 'reg_alpha': 1.1577861995022656, 'reg_lambda': 1.4622955319732598, 'gamma': 0.00011915754240598147}. Best is trial 102 with value: -3.4593205071811006.
[I 2026-07-14 21:56:47,838] Trial 117 finished with value: -2.6886839632942015 and parameters: {'scalers': 'robust', 'ratios': 'norm_ratio', 'imputers': 'mean', 'n_estimators': 700, 'learning_rate': 0.489064956681599, 'max_depth': 9, 'min_child_weight': 1, 'subsample': 0.9, 'colsample_bytree': 0.6, 'colsample_bylevel': 1.0, 'reg_alpha': 1.1369820167314684, 'reg_lambda': 6.300628895530292, 'gamma': 0.00017999436987122861}. Best is trial 102 with value: -3.4593205071811006.
[I 2026-07-14 21:57:18,039] Trial 118 finished with value: -3.8937345256538665 and parameters: {'scalers': 'robust', 'ratios': 'norm_ratio', 'imputers': 'mean', 'n_estimators': 2600, 'learning_rate': 0.49021250010199435, 'max_depth': 9, 'min_child_weight': 1, 'subsample': 0.9, 'colsample_bytree': 0.6, 'colsample_bylevel': 1.0, 'reg_alpha': 1.0191678617488027, 'reg_lambda': 6.123159962050603, 'gamma': 0.00017741061631760836}. Best is trial 118 with value: -3.8937345256538665.
[I 2026-07-14 21:57:28,605] Trial 119 finished with value: -2.722305837787835 and parameters: {'scalers': 'robust', 'ratios': 'norm_ratio', 'imputers': 'mean', 'n_estimators': 900, 'learning_rate': 0.4344755476683093, 'max_depth': 9, 'min_child_weight': 1, 'subsample': 0.9, 'colsample_bytree': 0.6, 'colsample_bylevel': 1.0, 'reg_alpha': 1.0527940295543117, 'reg_lambda': 1.6399489927989475, 'gamma': 0.00014513040143556506}. Best is trial 118 with value: -3.8937345256538665.
[I 2026-07-14 21:57:37,085] Trial 120 finished with value: -2.7764851906233976 and parameters: {'scalers': 'robust', 'ratios': 'norm_ratio', 'imputers': 'mean', 'n_estimators': 850, 'learning_rate': 0.4440119039012923, 'max_depth': 9, 'min_child_weight': 1, 'subsample': 0.9, 'colsample_bytree': 0.5, 'colsample_bylevel': 1.0, 'reg_alpha': 1.1765762548792056, 'reg_lambda': 6.00019458367362, 'gamma': 0.00041521094837905503}. Best is trial 118 with value: -3.8937345256538665.
[I 2026-07-14 21:58:01,854] Trial 121 finished with value: -3.8266016698794068 and parameters: {'scalers': 'robust', 'ratios': 'norm_ratio', 'imputers': 'mean', 'n_estimators': 2550, 'learning_rate': 0.481257583517202, 'max_depth': 9, 'min_child_weight': 1, 'subsample': 0.9, 'colsample_bytree': 0.5, 'colsample_bylevel': 1.0, 'reg_alpha': 1.1435648764344188, 'reg_lambda': 8.346429914813013, 'gamma': 0.0025847888354145663}. Best is trial 118 with value: -3.8937345256538665.
[I 2026-07-14 21:58:08,474] Trial 122 finished with value: -2.7555352712904453 and parameters: {'scalers': 'robust', 'ratios': 'norm_ratio', 'imputers': 'mean', 'n_estimators': 650, 'learning_rate': 0.49519148471255414, 'max_depth': 9, 'min_child_weight': 1, 'subsample': 0.9, 'colsample_bytree': 0.5, 'colsample_bylevel': 1.0, 'reg_alpha': 1.1361097229918364, 'reg_lambda': 5.60576516004566, 'gamma': 0.00016432062376959655}. Best is trial 118 with value: -3.8937345256538665.
[I 2026-07-14 21:58:14,198] Trial 123 finished with value: -2.6420305669300954 and parameters: {'scalers': 'robust', 'ratios': 'norm_ratio', 'imputers': 'mean', 'n_estimators': 600, 'learning_rate': 0.4978728874394661, 'max_depth': 9, 'min_child_weight': 1, 'subsample': 0.9, 'colsample_bytree': 0.5, 'colsample_bylevel': 1.0, 'reg_alpha': 1.0996425187661885, 'reg_lambda': 5.797986504677861, 'gamma': 0.002110570107391093}. Best is trial 118 with value: -3.8937345256538665.
[I 2026-07-14 21:58:20,499] Trial 124 finished with value: -2.5353869441179597 and parameters: {'scalers': 'robust', 'ratios': 'norm_ratio', 'imputers': 'mean', 'n_estimators': 750, 'learning_rate': 0.4625646167593807, 'max_depth': 9, 'min_child_weight': 1, 'subsample': 0.9, 'colsample_bytree': 0.5, 'colsample_bylevel': 1.0, 'reg_alpha': 0.2073711663566142, 'reg_lambda': 6.001909583311157, 'gamma': 0.00041385009144956125}. Best is trial 118 with value: -3.8937345256538665.
[I 2026-07-14 21:58:25,764] Trial 125 finished with value: -2.624849342134195 and parameters: {'scalers': 'robust', 'ratios': 'norm_ratio', 'imputers': 'mean', 'n_estimators': 550, 'learning_rate': 0.48616254547449217, 'max_depth': 9, 'min_child_weight': 1, 'subsample': 0.9, 'colsample_bytree': 0.5, 'colsample_bylevel': 1.0, 'reg_alpha': 0.9841200383565986, 'reg_lambda': 5.491905784994012, 'gamma': 2.2699704272333557e-05}. Best is trial 118 with value: -3.8937345256538665.
[I 2026-07-14 21:58:29,586] Trial 126 finished with value: -2.4470647719176144 and parameters: {'scalers': 'robust', 'ratios': 'norm_ratio', 'imputers': 'mean', 'n_estimators': 450, 'learning_rate': 0.49981489422654807, 'max_depth': 9, 'min_child_weight': 1, 'subsample': 0.9, 'colsample_bytree': 0.5, 'colsample_bylevel': 1.0, 'reg_alpha': 1.0343860578545263, 'reg_lambda': 6.027152905063846, 'gamma': 0.001915327930014913}. Best is trial 118 with value: -3.8937345256538665.
[I 2026-07-14 21:58:39,071] Trial 127 finished with value: -2.936190848047113 and parameters: {'scalers': 'robust', 'ratios': 'norm_ratio', 'imputers': 'mean', 'n_estimators': 950, 'learning_rate': 0.4737870010373355, 'max_depth': 9, 'min_child_weight': 1, 'subsample': 0.9, 'colsample_bytree': 0.5, 'colsample_bylevel': 1.0, 'reg_alpha': 1.0553418740848848, 'reg_lambda': 5.338891369001133, 'gamma': 0.0004407539279749202}. Best is trial 118 with value: -3.8937345256538665.
[I 2026-07-14 21:58:46,115] Trial 128 finished with value: -2.6022187286915566 and parameters: {'scalers': 'robust', 'ratios': 'norm_ratio', 'imputers': 'mean', 'n_estimators': 700, 'learning_rate': 0.4492145661535908, 'max_depth': 9, 'min_child_weight': 1, 'subsample': 0.9, 'colsample_bytree': 0.5, 'colsample_bylevel': 1.0, 'reg_alpha': 1.0708364635896983, 'reg_lambda': 2.6816478947076643, 'gamma': 0.00231986853694952}. Best is trial 118 with value: -3.8937345256538665.
[I 2026-07-14 21:58:51,520] Trial 130 finished with value: -0.5452829812633241 and parameters: {'scalers': 'robust', 'ratios': 'norm_ratio', 'imputers': 'mean', 'n_estimators': 650, 'learning_rate': 0.47426685573814603, 'max_depth': 9, 'min_child_weight': 1, 'subsample': 0.9, 'colsample_bytree': 0.5, 'colsample_bylevel': 1.0, 'reg_alpha': 0.7792132025388965, 'reg_lambda': 2.573452561758151, 'gamma': 19.346347642467496}. Best is trial 118 with value: -3.8937345256538665.
[I 2026-07-14 21:58:53,326] Trial 129 finished with value: -2.83144385850382 and parameters: {'scalers': 'robust', 'ratios': 'norm_ratio', 'imputers': 'mean', 'n_estimators': 750, 'learning_rate': 0.49845723193571134, 'max_depth': 9, 'min_child_weight': 1, 'subsample': 0.9, 'colsample_bytree': 0.5, 'colsample_bylevel': 1.0, 'reg_alpha': 0.7791891559628076, 'reg_lambda': 5.426558489507946, 'gamma': 0.0023014735248856263}. Best is trial 118 with value: -3.8937345256538665.
[I 2026-07-14 21:59:01,668] Trial 131 finished with value: -2.8874637294457277 and parameters: {'scalers': 'robust', 'ratios': 'norm_ratio', 'imputers': 'mean', 'n_estimators': 900, 'learning_rate': 0.4839145297399841, 'max_depth': 9, 'min_child_weight': 1, 'subsample': 0.9, 'colsample_bytree': 0.5, 'colsample_bylevel': 1.0, 'reg_alpha': 0.432790956869052, 'reg_lambda': 10.821570120494606, 'gamma': 0.0004376296340889586}. Best is trial 118 with value: -3.8937345256538665.
[I 2026-07-14 21:59:11,567] Trial 132 finished with value: -2.238949799301384 and parameters: {'scalers': 'robust', 'ratios': 'norm_ratio', 'imputers': 'mean', 'n_estimators': 950, 'learning_rate': 0.29696030446148974, 'max_depth': 9, 'min_child_weight': 1, 'subsample': 0.9, 'colsample_bytree': 0.6, 'colsample_bylevel': 1.0, 'reg_alpha': 0.45021338502155844, 'reg_lambda': 12.892361031207598, 'gamma': 0.0001819746474354143}. Best is trial 118 with value: -3.8937345256538665.
[I 2026-07-14 21:59:19,535] Trial 133 finished with value: -1.9746782373483343 and parameters: {'scalers': 'robust', 'ratios': 'norm_ratio', 'imputers': 'mean', 'n_estimators': 850, 'learning_rate': 0.29251757040544674, 'max_depth': 9, 'min_child_weight': 1, 'subsample': 0.9, 'colsample_bytree': 0.6, 'colsample_bylevel': 1.0, 'reg_alpha': 0.40453776729609386, 'reg_lambda': 2.779495958102124, 'gamma': 0.00016895540191326462}. Best is trial 118 with value: -3.8937345256538665.
[I 2026-07-14 21:59:26,194] Trial 134 finished with value: -1.815164133139112 and parameters: {'scalers': 'robust', 'ratios': 'norm_ratio', 'imputers': 'mean', 'n_estimators': 850, 'learning_rate': 0.2929668614647971, 'max_depth': 8, 'min_child_weight': 1, 'subsample': 0.9, 'colsample_bytree': 0.6, 'colsample_bylevel': 1.0, 'reg_alpha': 0.4227900597969331, 'reg_lambda': 2.5034692087117136, 'gamma': 0.0001771666386469214}. Best is trial 118 with value: -3.8937345256538665.
[I 2026-07-14 21:59:33,582] Trial 135 finished with value: -1.8161549979091465 and parameters: {'scalers': 'robust', 'ratios': 'norm_ratio', 'imputers': 'mean', 'n_estimators': 950, 'learning_rate': 0.2921279887674123, 'max_depth': 8, 'min_child_weight': 1, 'subsample': 0.9, 'colsample_bytree': 0.6, 'colsample_bylevel': 1.0, 'reg_alpha': 0.407691410965606, 'reg_lambda': 2.7988931040823504, 'gamma': 0.010844785870313834}. Best is trial 118 with value: -3.8937345256538665.
[I 2026-07-14 21:59:42,415] Trial 136 finished with value: -2.138508209715848 and parameters: {'scalers': 'robust', 'ratios': 'norm_ratio', 'imputers': 'mean', 'n_estimators': 950, 'learning_rate': 0.31304733373699273, 'max_depth': 8, 'min_child_weight': 1, 'subsample': 0.9, 'colsample_bytree': 0.6, 'colsample_bylevel': 1.0, 'reg_alpha': 0.656166635619194, 'reg_lambda': 9.083842024724149, 'gamma': 0.0011852551930629253}. Best is trial 118 with value: -3.8937345256538665.
