[I 2026-07-14 22:44:46,577] Trial 315 finished with value: -1.837550851268849 and parameters: {'scalers': 'standard', 'ratios': 'norm_ratio', 'imputers': 'median', 'n_estimators': 2650, 'learning_rate': 0.34775976828089833, 'max_depth': 12, 'min_child_weight': 1, 'subsample': 0.9, 'colsample_bytree': 0.6, 'colsample_bylevel': 0.8, 'reg_alpha': 0.6798878447705493, 'reg_lambda': 10.858583558634743, 'gamma': 0.0012485230909169728}. Best is trial 222 with value: -1.9276464089988596.
[I 2026-07-14 22:45:23,630] Trial 316 finished with value: -1.7580176860685102 and parameters: {'scalers': 'standard', 'ratios': 'norm_ratio', 'imputers': 'median', 'n_estimators': 2650, 'learning_rate': 0.35774427797024055, 'max_depth': 12, 'min_child_weight': 1, 'subsample': 0.9, 'colsample_bytree': 0.6, 'colsample_bylevel': 0.8, 'reg_alpha': 0.6728078810717532, 'reg_lambda': 0.8809599542749109, 'gamma': 0.0011685573140430556}. Best is trial 222 with value: -1.9276464089988596.
[I 2026-07-14 22:45:55,705] Trial 317 finished with value: -1.6804872977596794 and parameters: {'scalers': 'standard', 'ratios': 'norm_ratio', 'imputers': 'median', 'n_estimators': 2650, 'learning_rate': 0.34748335163260313, 'max_depth': 11, 'min_child_weight': 1, 'subsample': 0.9, 'colsample_bytree': 0.6, 'colsample_bylevel': 0.8, 'reg_alpha': 0.629550108235742, 'reg_lambda': 0.8540806837575884, 'gamma': 0.0020139574180327705}. Best is trial 222 with value: -1.9276464089988596.
[I 2026-07-14 22:46:29,331] Trial 318 finished with value: -1.779407981270451 and parameters: {'scalers': 'standard', 'ratios': 'norm_ratio', 'imputers': 'median', 'n_estimators': 2650, 'learning_rate': 0.3711575327074935, 'max_depth': 11, 'min_child_weight': 1, 'subsample': 0.9, 'colsample_bytree': 0.6, 'colsample_bylevel': 0.8, 'reg_alpha': 0.7153916117486643, 'reg_lambda': 1.1293994283838087, 'gamma': 0.0011494780813434803}. Best is trial 222 with value: -1.9276464089988596.
[I 2026-07-14 22:47:01,739] Trial 319 finished with value: -1.7374542081282833 and parameters: {'scalers': 'standard', 'ratios': 'norm_ratio', 'imputers': 'median', 'n_estimators': 2650, 'learning_rate': 0.3710475874264494, 'max_depth': 11, 'min_child_weight': 1, 'subsample': 0.9, 'colsample_bytree': 0.6, 'colsample_bylevel': 0.8, 'reg_alpha': 0.708246651417176, 'reg_lambda': 0.9567248680070647, 'gamma': 0.002102517010418481}. Best is trial 222 with value: -1.9276464089988596.
