[I 2026-07-14 21:59:50,721] Trial 137 finished with value: -2.0494477420068913 and parameters: {'scalers': 'robust', 'ratios': 'norm_ratio', 'imputers': 'mean', 'n_estimators': 950, 'learning_rate': 0.3004377338709343, 'max_depth': 8, 'min_child_weight': 1, 'subsample': 0.9, 'colsample_bytree': 0.6, 'colsample_bylevel': 1.0, 'reg_alpha': 0.42657962279037726, 'reg_lambda': 9.655306471409942, 'gamma': 0.001162768089270859}. Best is trial 118 with value: -3.8937345256538665.
[I 2026-07-14 21:59:58,657] Trial 138 finished with value: -1.9166524668780478 and parameters: {'scalers': 'robust', 'ratios': 'norm_ratio', 'imputers': 'mean', 'n_estimators': 900, 'learning_rate': 0.2901540823214656, 'max_depth': 8, 'min_child_weight': 1, 'subsample': 0.9, 'colsample_bytree': 0.6, 'colsample_bylevel': 1.0, 'reg_alpha': 0.49341755950682686, 'reg_lambda': 10.054689330106877, 'gamma': 0.011063527200788813}. Best is trial 118 with value: -3.8937345256538665.
[I 2026-07-14 22:00:06,065] Trial 139 finished with value: -1.9078285179102519 and parameters: {'scalers': 'robust', 'ratios': 'norm_ratio', 'imputers': 'mean', 'n_estimators': 1000, 'learning_rate': 0.27675425965773703, 'max_depth': 8, 'min_child_weight': 1, 'subsample': 0.9, 'colsample_bytree': 0.5, 'colsample_bylevel': 1.0, 'reg_alpha': 0.4031122639724305, 'reg_lambda': 11.152599592869214, 'gamma': 0.009266106590195278}. Best is trial 118 with value: -3.8937345256538665.
[I 2026-07-14 22:00:13,241] Trial 140 finished with value: -1.9606839871231259 and parameters: {'scalers': 'robust', 'ratios': 'norm_ratio', 'imputers': 'mean', 'n_estimators': 950, 'learning_rate': 0.30304163306596216, 'max_depth': 8, 'min_child_weight': 1, 'subsample': 0.9, 'colsample_bytree': 0.5, 'colsample_bylevel': 1.0, 'reg_alpha': 0.41543645261618956, 'reg_lambda': 15.510415000637005, 'gamma': 0.009469841549729581}. Best is trial 118 with value: -3.8937345256538665.
[I 2026-07-14 22:00:19,438] Trial 141 finished with value: -1.3085191721004568 and parameters: {'scalers': 'robust', 'ratios': 'norm_ratio', 'imputers': 'mean', 'n_estimators': 1100, 'learning_rate': 0.31252648146498757, 'max_depth': 8, 'min_child_weight': 1, 'subsample': 0.9, 'colsample_bytree': 0.5, 'colsample_bylevel': 1.0, 'reg_alpha': 3.0157560593477637, 'reg_lambda': 11.256780693421925, 'gamma': 0.0012141020192599765}. Best is trial 118 with value: -3.8937345256538665.
[I 2026-07-14 22:00:27,618] Trial 142 finished with value: -2.198131835133555 and parameters: {'scalers': 'robust', 'ratios': 'norm_ratio', 'imputers': 'mean', 'n_estimators': 1050, 'learning_rate': 0.3264977552368796, 'max_depth': 8, 'min_child_weight': 1, 'subsample': 0.9, 'colsample_bytree': 0.5, 'colsample_bylevel': 1.0, 'reg_alpha': 0.6665695244537917, 'reg_lambda': 11.085491911008365, 'gamma': 0.0014122114236042485}. Best is trial 118 with value: -3.8937345256538665.
[I 2026-07-14 22:00:34,150] Trial 143 finished with value: -1.5021850839329562 and parameters: {'scalers': 'robust', 'ratios': 'norm_ratio', 'imputers': 'mean', 'n_estimators': 1100, 'learning_rate': 0.33631452548225915, 'max_depth': 8, 'min_child_weight': 1, 'subsample': 0.9, 'colsample_bytree': 0.5, 'colsample_bylevel': 1.0, 'reg_alpha': 2.844095586369621, 'reg_lambda': 10.271843964695922, 'gamma': 0.00046485371660583277}. Best is trial 118 with value: -3.8937345256538665.
[I 2026-07-14 22:00:43,947] Trial 144 finished with value: -2.4986543017916154 and parameters: {'scalers': 'robust', 'ratios': 'norm_ratio', 'imputers': 'mean', 'n_estimators': 1100, 'learning_rate': 0.34828473984283786, 'max_depth': 9, 'min_child_weight': 1, 'subsample': 0.9, 'colsample_bytree': 0.5, 'colsample_bylevel': 1.0, 'reg_alpha': 0.14055168767692214, 'reg_lambda': 15.871039828383232, 'gamma': 0.00048585004432462884}. Best is trial 118 with value: -3.8937345256538665.
[I 2026-07-14 22:00:49,001] Trial 145 finished with value: -1.5228807876950423 and parameters: {'scalers': 'robust', 'ratios': 'norm_ratio', 'imputers': 'median', 'n_estimators': 800, 'learning_rate': 0.33575609380703675, 'max_depth': 9, 'min_child_weight': 1, 'subsample': 0.9, 'colsample_bytree': 0.5, 'colsample_bylevel': 1.0, 'reg_alpha': 2.8770890465847963, 'reg_lambda': 15.937799015090281, 'gamma': 0.0005050770956267631}. Best is trial 118 with value: -3.8937345256538665.
[I 2026-07-14 22:00:58,511] Trial 146 finished with value: -2.510578171428666 and parameters: {'scalers': 'robust', 'ratios': 'norm_ratio', 'imputers': 'median', 'n_estimators': 1100, 'learning_rate': 0.35134345687013385, 'max_depth': 9, 'min_child_weight': 1, 'subsample': 0.9, 'colsample_bytree': 0.5, 'colsample_bylevel': 1.0, 'reg_alpha': 0.117300208546817, 'reg_lambda': 16.350790139244626, 'gamma': 0.0004671919071261824}. Best is trial 118 with value: -3.8937345256538665.
[I 2026-07-14 22:01:07,722] Trial 147 finished with value: -2.553115637980648 and parameters: {'scalers': 'robust', 'ratios': 'norm_ratio', 'imputers': 'median', 'n_estimators': 1050, 'learning_rate': 0.34137249623231164, 'max_depth': 9, 'min_child_weight': 1, 'subsample': 0.9, 'colsample_bytree': 0.5, 'colsample_bylevel': 1.0, 'reg_alpha': 0.13775854228412132, 'reg_lambda': 18.548289551795197, 'gamma': 0.0004018471881477189}. Best is trial 118 with value: -3.8937345256538665.
[I 2026-07-14 22:01:14,723] Trial 148 finished with value: -2.069748798966835 and parameters: {'scalers': 'robust', 'ratios': 'norm_ratio', 'imputers': 'mean', 'n_estimators': 1050, 'learning_rate': 0.42458685508829724, 'max_depth': 9, 'min_child_weight': 1, 'subsample': 0.9, 'colsample_bytree': 0.5, 'colsample_bylevel': 1.0, 'reg_alpha': 2.813826856826307, 'reg_lambda': 4.073779415239356, 'gamma': 0.00044962970956578525}. Best is trial 118 with value: -3.8937345256538665.
[I 2026-07-14 22:01:21,833] Trial 149 finished with value: -2.1064728697802355 and parameters: {'scalers': 'robust', 'ratios': 'norm_ratio', 'imputers': 'median', 'n_estimators': 1050, 'learning_rate': 0.4303515614487795, 'max_depth': 9, 'min_child_weight': 1, 'subsample': 0.9, 'colsample_bytree': 0.5, 'colsample_bylevel': 1.0, 'reg_alpha': 2.789229691316452, 'reg_lambda': 4.34480294323479, 'gamma': 0.0003996973570797469}. Best is trial 118 with value: -3.8937345256538665.
[I 2026-07-14 22:01:28,083] Trial 150 finished with value: -2.2340535639620165 and parameters: {'scalers': 'robust', 'ratios': 'norm_ratio', 'imputers': 'median', 'n_estimators': 800, 'learning_rate': 0.41827732833283826, 'max_depth': 9, 'min_child_weight': 1, 'subsample': 0.9, 'colsample_bytree': 0.5, 'colsample_bylevel': 1.0, 'reg_alpha': 0.11904678775877224, 'reg_lambda': 4.3383058615026675, 'gamma': 0.0004766755085345054}. Best is trial 118 with value: -3.8937345256538665.
[I 2026-07-14 22:01:38,233] Trial 151 finished with value: -2.5995283532902227 and parameters: {'scalers': 'robust', 'ratios': 'norm_ratio', 'imputers': 'median', 'n_estimators': 800, 'learning_rate': 0.4185188675212059, 'max_depth': 9, 'min_child_weight': 1, 'subsample': 0.9, 'colsample_bytree': 0.5, 'colsample_bylevel': 1.0, 'reg_alpha': 0.15645900864175982, 'reg_lambda': 38.727345527307776, 'gamma': 0.0003861550584303428}. Best is trial 118 with value: -3.8937345256538665.
[I 2026-07-14 22:01:59,078] Trial 152 finished with value: -3.579177917006468 and parameters: {'scalers': 'robust', 'ratios': 'norm_ratio', 'imputers': 'median', 'n_estimators': 2650, 'learning_rate': 0.41937338756119313, 'max_depth': 9, 'min_child_weight': 1, 'subsample': 0.9, 'colsample_bytree': 0.5, 'colsample_bylevel': 1.0, 'reg_alpha': 1.444593939986906, 'reg_lambda': 39.582627772264914, 'gamma': 0.00010367833902859383}. Best is trial 118 with value: -3.8937345256538665.
[I 2026-07-14 22:02:10,799] Trial 153 finished with value: -2.9696754901853204 and parameters: {'scalers': 'robust', 'ratios': 'norm_ratio', 'imputers': 'mean', 'n_estimators': 1250, 'learning_rate': 0.4105524921484447, 'max_depth': 9, 'min_child_weight': 1, 'subsample': 0.9, 'colsample_bytree': 0.5, 'colsample_bylevel': 1.0, 'reg_alpha': 0.6993168600946243, 'reg_lambda': 45.04246772628387, 'gamma': 0.00010714837130112552}. Best is trial 118 with value: -3.8937345256538665.
[I 2026-07-14 22:02:17,455] Trial 154 finished with value: -2.4898827655332556 and parameters: {'scalers': 'robust', 'ratios': 'norm_ratio', 'imputers': 'mean', 'n_estimators': 750, 'learning_rate': 0.42532841113763614, 'max_depth': 9, 'min_child_weight': 1, 'subsample': 0.9, 'colsample_bytree': 0.5, 'colsample_bylevel': 1.0, 'reg_alpha': 1.5079702136416029, 'reg_lambda': 34.51769444127531, 'gamma': 9.617388764790485e-05}. Best is trial 118 with value: -3.8937345256538665.
[I 2026-07-14 22:02:29,884] Trial 155 finished with value: -3.1008222730752992 and parameters: {'scalers': 'robust', 'ratios': 'norm_ratio', 'imputers': 'mean', 'n_estimators': 1300, 'learning_rate': 0.45877126593276196, 'max_depth': 9, 'min_child_weight': 1, 'subsample': 0.9, 'colsample_bytree': 0.5, 'colsample_bylevel': 1.0, 'reg_alpha': 1.5068308214288924, 'reg_lambda': 4.0886689224640635, 'gamma': 8.290655496105982e-05}. Best is trial 118 with value: -3.8937345256538665.
[I 2026-07-14 22:02:37,668] Trial 156 finished with value: -2.712957740740108 and parameters: {'scalers': 'robust', 'ratios': 'norm_ratio', 'imputers': 'mean', 'n_estimators': 800, 'learning_rate': 0.4341128985909428, 'max_depth': 9, 'min_child_weight': 1, 'subsample': 0.9, 'colsample_bytree': 0.5, 'colsample_bylevel': 1.0, 'reg_alpha': 0.6630042172060923, 'reg_lambda': 42.01932334767566, 'gamma': 9.609298448679707e-05}. Best is trial 118 with value: -3.8937345256538665.
[I 2026-07-14 22:02:51,004] Trial 157 finished with value: -2.8750942924553735 and parameters: {'scalers': 'robust', 'ratios': 'norm_ratio', 'imputers': 'mean', 'n_estimators': 1200, 'learning_rate': 0.4059554991306004, 'max_depth': 9, 'min_child_weight': 1, 'subsample': 0.9, 'colsample_bytree': 0.6, 'colsample_bylevel': 1.0, 'reg_alpha': 0.7945764258807616, 'reg_lambda': 38.1835195051053, 'gamma': 0.0001055840338181864}. Best is trial 118 with value: -3.8937345256538665.
[I 2026-07-14 22:02:58,485] Trial 158 finished with value: -2.3796753351948543 and parameters: {'scalers': 'robust', 'ratios': 'norm_ratio', 'imputers': 'mean', 'n_estimators': 700, 'learning_rate': 0.42956440809451973, 'max_depth': 9, 'min_child_weight': 1, 'subsample': 0.9, 'colsample_bytree': 0.6, 'colsample_bylevel': 1.0, 'reg_alpha': 1.3881078309828165, 'reg_lambda': 43.97079413715918, 'gamma': 8.752093368698419e-05}. Best is trial 118 with value: -3.8937345256538665.
[I 2026-07-14 22:03:03,818] Trial 159 finished with value: -2.3162368681522425 and parameters: {'scalers': 'robust', 'ratios': 'norm_ratio', 'imputers': 'mean', 'n_estimators': 450, 'learning_rate': 0.47663998912011035, 'max_depth': 9, 'min_child_weight': 1, 'subsample': 0.9, 'colsample_bytree': 0.6, 'colsample_bylevel': 1.0, 'reg_alpha': 1.366655555918063, 'reg_lambda': 1.0398583435177167, 'gamma': 9.255917574215486e-05}. Best is trial 118 with value: -3.8937345256538665.
[I 2026-07-14 22:03:28,484] Trial 160 finished with value: -2.9081254993593926 and parameters: {'scalers': 'robust', 'ratios': 'norm_ratio', 'imputers': 'mean', 'n_estimators': 2600, 'learning_rate': 0.49765206307374227, 'max_depth': 9, 'min_child_weight': 1, 'subsample': 0.9, 'colsample_bytree': 0.6, 'colsample_bylevel': 1.0, 'reg_alpha': 1.4355397350549564, 'reg_lambda': 61.79581155737678, 'gamma': 0.003326594210831597}. Best is trial 118 with value: -3.8937345256538665.
[I 2026-07-14 22:03:40,289] Trial 161 finished with value: -2.8364615452361654 and parameters: {'scalers': 'robust', 'ratios': 'norm_ratio', 'imputers': 'mean', 'n_estimators': 1400, 'learning_rate': 0.48860340704306665, 'max_depth': 10, 'min_child_weight': 1, 'subsample': 0.9, 'colsample_bytree': 0.5, 'colsample_bylevel': 1.0, 'reg_alpha': 1.491756505126688, 'reg_lambda': 68.67749478047988, 'gamma': 0.0030047035285867985}. Best is trial 118 with value: -3.8937345256538665.
[I 2026-07-14 22:03:52,665] Trial 162 finished with value: -3.3602821315490643 and parameters: {'scalers': 'robust', 'ratios': 'norm_ratio', 'imputers': 'mean', 'n_estimators': 1300, 'learning_rate': 0.497512262359231, 'max_depth': 9, 'min_child_weight': 1, 'subsample': 0.9, 'colsample_bytree': 0.5, 'colsample_bylevel': 1.0, 'reg_alpha': 0.24396188370980962, 'reg_lambda': 47.35152284051423, 'gamma': 9.416482007412634e-05}. Best is trial 118 with value: -3.8937345256538665.
[I 2026-07-14 22:04:04,686] Trial 163 finished with value: -2.382588793519019 and parameters: {'scalers': 'robust', 'ratios': 'norm_ratio', 'imputers': 'mean', 'n_estimators': 1300, 'learning_rate': 0.2226900046406191, 'max_depth': 10, 'min_child_weight': 1, 'subsample': 0.9, 'colsample_bytree': 0.5, 'colsample_bylevel': 1.0, 'reg_alpha': 0.7292592789572502, 'reg_lambda': 70.18707294340511, 'gamma': 4.923235472877056e-05}. Best is trial 118 with value: -3.8937345256538665.
[I 2026-07-14 22:04:16,753] Trial 164 finished with value: -2.286471373574782 and parameters: {'scalers': 'robust', 'ratios': 'norm_ratio', 'imputers': 'mean', 'n_estimators': 1300, 'learning_rate': 0.20610918778500317, 'max_depth': 10, 'min_child_weight': 1, 'subsample': 0.9, 'colsample_bytree': 0.5, 'colsample_bylevel': 1.0, 'reg_alpha': 0.24154741382276398, 'reg_lambda': 63.59807719363924, 'gamma': 4.416970235350637e-05}. Best is trial 118 with value: -3.8937345256538665.
[I 2026-07-14 22:04:29,906] Trial 165 finished with value: -2.121306025331091 and parameters: {'scalers': 'robust', 'ratios': 'norm_ratio', 'imputers': 'mean', 'n_estimators': 1250, 'learning_rate': 0.21996515370064892, 'max_depth': 10, 'min_child_weight': 1, 'subsample': 0.9, 'colsample_bytree': 0.6, 'colsample_bylevel': 1.0, 'reg_alpha': 0.23462381368497354, 'reg_lambda': 65.64933049007979, 'gamma': 0.0029626359787593235}. Best is trial 118 with value: -3.8937345256538665.
[I 2026-07-14 22:04:43,300] Trial 166 finished with value: -2.3294033426570637 and parameters: {'scalers': 'robust', 'ratios': 'norm_ratio', 'imputers': 'mean', 'n_estimators': 1250, 'learning_rate': 0.21319311304395583, 'max_depth': 10, 'min_child_weight': 1, 'subsample': 0.9, 'colsample_bytree': 0.6, 'colsample_bylevel': 1.0, 'reg_alpha': 0.24115162323434194, 'reg_lambda': 70.78851831133188, 'gamma': 5.286802913393012e-05}. Best is trial 118 with value: -3.8937345256538665.
[I 2026-07-14 22:04:54,973] Trial 167 finished with value: -2.2513125563735934 and parameters: {'scalers': 'robust', 'ratios': 'norm_ratio', 'imputers': 'mean', 'n_estimators': 1300, 'learning_rate': 0.22139665141956075, 'max_depth': 10, 'min_child_weight': 1, 'subsample': 0.9, 'colsample_bytree': 0.5, 'colsample_bylevel': 1.0, 'reg_alpha': 0.7567081811864406, 'reg_lambda': 89.16588077504541, 'gamma': 0.00022766174944387904}. Best is trial 118 with value: -3.8937345256538665.
[I 2026-07-14 22:05:08,432] Trial 168 finished with value: -2.5157841137362658 and parameters: {'scalers': 'robust', 'ratios': 'norm_ratio', 'imputers': 'mean', 'n_estimators': 1200, 'learning_rate': 0.3823101055539423, 'max_depth': 10, 'min_child_weight': 1, 'subsample': 0.9, 'colsample_bytree': 0.6, 'colsample_bylevel': 1.0, 'reg_alpha': 0.7479988784657737, 'reg_lambda': 69.61207853355613, 'gamma': 0.003065828911568022}. Best is trial 118 with value: -3.8937345256538665.
[I 2026-07-14 22:05:21,256] Trial 169 finished with value: -1.6181818184754126 and parameters: {'scalers': 'robust', 'ratios': 'norm_ratio', 'imputers': 'mean', 'n_estimators': 1400, 'learning_rate': 0.21780949319843532, 'max_depth': 10, 'min_child_weight': 1, 'subsample': 0.9, 'colsample_bytree': 0.6, 'colsample_bylevel': 1.0, 'reg_alpha': 0.7402720934022329, 'reg_lambda': 84.70658927538112, 'gamma': 0.005470126934280658}. Best is trial 118 with value: -3.8937345256538665.
[I 2026-07-14 22:05:33,920] Trial 170 finished with value: -2.6544620685660445 and parameters: {'scalers': 'robust', 'ratios': 'norm_ratio', 'imputers': 'mean', 'n_estimators': 1200, 'learning_rate': 0.37186340193374445, 'max_depth': 9, 'min_child_weight': 1, 'subsample': 0.9, 'colsample_bytree': 0.6, 'colsample_bylevel': 1.0, 'reg_alpha': 0.2257046992495465, 'reg_lambda': 24.731772485635663, 'gamma': 4.678300544626461e-05}. Best is trial 118 with value: -3.8937345256538665.
[I 2026-07-14 22:05:46,713] Trial 171 finished with value: -2.682033447194102 and parameters: {'scalers': 'robust', 'ratios': 'norm_ratio', 'imputers': 'mean', 'n_estimators': 1200, 'learning_rate': 0.38174482054606695, 'max_depth': 9, 'min_child_weight': 1, 'subsample': 0.9, 'colsample_bytree': 0.6, 'colsample_bylevel': 1.0, 'reg_alpha': 0.25910131355495863, 'reg_lambda': 27.389951480544898, 'gamma': 5.286533871772741e-05}. Best is trial 118 with value: -3.8937345256538665.
[I 2026-07-14 22:05:56,022] Trial 172 finished with value: -1.043337498491665 and parameters: {'scalers': 'robust', 'ratios': 'norm_ratio', 'imputers': 'none', 'n_estimators': 1250, 'learning_rate': 0.3644138916200798, 'max_depth': 9, 'min_child_weight': 9, 'subsample': 0.9, 'colsample_bytree': 0.6, 'colsample_bylevel': 1.0, 'reg_alpha': 0.2508210724811889, 'reg_lambda': 98.56725747820467, 'gamma': 0.00023879195317057242}. Best is trial 118 with value: -3.8937345256538665.
[I 2026-07-14 22:06:08,874] Trial 173 finished with value: -2.626373874308711 and parameters: {'scalers': 'robust', 'ratios': 'norm_ratio', 'imputers': 'mean', 'n_estimators': 1200, 'learning_rate': 0.37748311681882946, 'max_depth': 9, 'min_child_weight': 1, 'subsample': 0.9, 'colsample_bytree': 0.6, 'colsample_bylevel': 1.0, 'reg_alpha': 0.7346010839958577, 'reg_lambda': 99.56282926701245, 'gamma': 0.00024396307927291303}. Best is trial 118 with value: -3.8937345256538665.
[I 2026-07-14 22:06:37,850] Trial 174 finished with value: -3.4600607297255097 and parameters: {'scalers': 'robust', 'ratios': 'norm_ratio', 'imputers': 'mean', 'n_estimators': 2600, 'learning_rate': 0.38307701784784864, 'max_depth': 9, 'min_child_weight': 1, 'subsample': 0.9, 'colsample_bytree': 0.6, 'colsample_bylevel': 1.0, 'reg_alpha': 0.7615511520607504, 'reg_lambda': 25.42708029630164, 'gamma': 0.0002356041369142014}. Best is trial 118 with value: -3.8937345256538665.
[I 2026-07-14 22:07:06,952] Trial 175 finished with value: -3.2351413024164843 and parameters: {'scalers': 'robust', 'ratios': 'norm_ratio', 'imputers': 'none', 'n_estimators': 2650, 'learning_rate': 0.36239391531233206, 'max_depth': 9, 'min_child_weight': 1, 'subsample': 0.9, 'colsample_bytree': 0.6, 'colsample_bylevel': 1.0, 'reg_alpha': 0.587592726084142, 'reg_lambda': 26.754559725092268, 'gamma': 0.00011544139302576725}. Best is trial 118 with value: -3.8937345256538665.
[I 2026-07-14 22:07:30,745] Trial 176 finished with value: -2.9201089807160163 and parameters: {'scalers': 'robust', 'ratios': 'norm_ratio', 'imputers': 'none', 'n_estimators': 2600, 'learning_rate': 0.3785901799726598, 'max_depth': 9, 'min_child_weight': 1, 'subsample': 0.9, 'colsample_bytree': 0.6, 'colsample_bylevel': 1.0, 'reg_alpha': 2.0847974711376756, 'reg_lambda': 25.649750109152848, 'gamma': 0.0001015774066613942}. Best is trial 118 with value: -3.8937345256538665.
[I 2026-07-14 22:07:53,497] Trial 177 finished with value: -2.254831832871861 and parameters: {'scalers': 'robust', 'ratios': 'norm_ratio', 'imputers': 'none', 'n_estimators': 2600, 'learning_rate': 0.36987271686423423, 'max_depth': 9, 'min_child_weight': 2, 'subsample': 0.9, 'colsample_bytree': 0.6, 'colsample_bylevel': 1.0, 'reg_alpha': 1.938112099858606, 'reg_lambda': 21.819372107545487, 'gamma': 0.00010686117941275583}. Best is trial 118 with value: -3.8937345256538665.
[I 2026-07-14 22:08:05,515] Trial 178 finished with value: -2.6801204070225113 and parameters: {'scalers': 'robust', 'ratios': 'norm_ratio', 'imputers': 'none', 'n_estimators': 1450, 'learning_rate': 0.36527448894968817, 'max_depth': 9, 'min_child_weight': 1, 'subsample': 0.9, 'colsample_bytree': 0.5, 'colsample_bylevel': 1.0, 'reg_alpha': 1.6376477610116942, 'reg_lambda': 47.095525000057236, 'gamma': 0.00011376533973849242}. Best is trial 118 with value: -3.8937345256538665.
[I 2026-07-14 22:08:18,647] Trial 179 finished with value: -2.4979167039133703 and parameters: {'scalers': 'robust', 'ratios': 'norm_ratio', 'imputers': 'none', 'n_estimators': 1500, 'learning_rate': 0.26434085141340014, 'max_depth': 9, 'min_child_weight': 1, 'subsample': 0.9, 'colsample_bytree': 0.5, 'colsample_bylevel': 1.0, 'reg_alpha': 0.07382216499320049, 'reg_lambda': 44.67815290360574, 'gamma': 0.00011183623445147946}. Best is trial 118 with value: -3.8937345256538665.
[I 2026-07-14 22:08:39,323] Trial 180 finished with value: -2.775565616502153 and parameters: {'scalers': 'robust', 'ratios': 'norm_ratio', 'imputers': 'mean', 'n_estimators': 2600, 'learning_rate': 0.2622536277025245, 'max_depth': 9, 'min_child_weight': 1, 'subsample': 0.9, 'colsample_bytree': 0.5, 'colsample_bylevel': 1.0, 'reg_alpha': 1.5608098991476813, 'reg_lambda': 48.45519850410967, 'gamma': 0.00011452665103526589}. Best is trial 118 with value: -3.8937345256538665.
[I 2026-07-14 22:08:49,644] Trial 181 finished with value: -1.8974363245036432 and parameters: {'scalers': 'robust', 'ratios': 'norm_ratio', 'imputers': 'mean', 'n_estimators': 1450, 'learning_rate': 0.27412163457721267, 'max_depth': 9, 'min_child_weight': 1, 'subsample': 0.9, 'colsample_bytree': 0.5, 'colsample_bylevel': 1.0, 'reg_alpha': 1.5578198104045209, 'reg_lambda': 40.433698752505535, 'gamma': 0.0044267236426898445}. Best is trial 118 with value: -3.8937345256538665.
