[I 2026-07-14 20:22:40,806] Trial 135 finished with value: -0.10877128125407498 and parameters: {'scalers': 'robust', 'ratios': 'log_ratio', 'imputers': 'none', 'n_estimators': 2900, 'learning_rate': 0.11956387264147512, 'max_depth': 12, 'min_child_weight': 1, 'subsample': 0.8, 'colsample_bytree': 0.8, 'colsample_bylevel': 0.9, 'reg_alpha': 0.00012123438098134382, 'reg_lambda': 8.590856034930741, 'gamma': 0.0005595886101413424}. Best is trial 94 with value: -0.1588569907036204.
[I 2026-07-14 20:23:10,995] Trial 136 finished with value: -0.09967759295918313 and parameters: {'scalers': 'robust', 'ratios': 'log_ratio', 'imputers': 'median', 'n_estimators': 2900, 'learning_rate': 0.10971910247112804, 'max_depth': 12, 'min_child_weight': 1, 'subsample': 0.8, 'colsample_bytree': 0.7, 'colsample_bylevel': 0.9, 'reg_alpha': 0.0007802227029988097, 'reg_lambda': 3.806470468914654, 'gamma': 0.0005124164595270627}. Best is trial 94 with value: -0.1588569907036204.
[I 2026-07-14 20:23:47,638] Trial 137 finished with value: -0.1410672054800026 and parameters: {'scalers': 'robust', 'ratios': 'log_ratio', 'imputers': 'none', 'n_estimators': 2900, 'learning_rate': 0.21612584457391637, 'max_depth': 12, 'min_child_weight': 1, 'subsample': 0.8, 'colsample_bytree': 0.7, 'colsample_bylevel': 0.9, 'reg_alpha': 0.00010416264850044541, 'reg_lambda': 7.88262536344744, 'gamma': 0.000475192843147931}. Best is trial 94 with value: -0.1588569907036204.
[I 2026-07-14 20:24:23,166] Trial 138 finished with value: -0.10835818306736295 and parameters: {'scalers': 'robust', 'ratios': 'log_ratio', 'imputers': 'none', 'n_estimators': 2900, 'learning_rate': 0.1195730540770668, 'max_depth': 12, 'min_child_weight': 1, 'subsample': 0.8, 'colsample_bytree': 0.8, 'colsample_bylevel': 0.9, 'reg_alpha': 0.0007098642539764793, 'reg_lambda': 8.300389834465904, 'gamma': 0.0005549933067199648}. Best is trial 94 with value: -0.1588569907036204.
[I 2026-07-14 20:24:54,243] Trial 139 finished with value: -0.10834984888764379 and parameters: {'scalers': 'robust', 'ratios': 'log_ratio', 'imputers': 'none', 'n_estimators': 2900, 'learning_rate': 0.11802013224689986, 'max_depth': 12, 'min_child_weight': 1, 'subsample': 0.8, 'colsample_bytree': 0.7, 'colsample_bylevel': 0.9, 'reg_alpha': 0.0007783055029580006, 'reg_lambda': 8.2746390939956, 'gamma': 0.0023137220171738607}. Best is trial 94 with value: -0.1588569907036204.
[I 2026-07-14 20:25:25,609] Trial 140 finished with value: -0.10896244993428965 and parameters: {'scalers': 'robust', 'ratios': 'log_ratio', 'imputers': 'none', 'n_estimators': 2900, 'learning_rate': 0.11644071400618392, 'max_depth': 12, 'min_child_weight': 1, 'subsample': 0.8, 'colsample_bytree': 0.7, 'colsample_bylevel': 0.9, 'reg_alpha': 0.00010709888141902125, 'reg_lambda': 7.958931692125428, 'gamma': 0.00047881590303690096}. Best is trial 94 with value: -0.1588569907036204.
[I 2026-07-14 20:25:56,379] Trial 141 finished with value: -0.10664411058538456 and parameters: {'scalers': 'robust', 'ratios': 'log_ratio', 'imputers': 'none', 'n_estimators': 2900, 'learning_rate': 0.10918048358659597, 'max_depth': 12, 'min_child_weight': 1, 'subsample': 0.8, 'colsample_bytree': 0.7, 'colsample_bylevel': 0.9, 'reg_alpha': 0.001213790104158455, 'reg_lambda': 8.048106642956695, 'gamma': 0.0025511781954117526}. Best is trial 94 with value: -0.1588569907036204.
[I 2026-07-14 20:26:24,990] Trial 142 finished with value: -0.06495747984160827 and parameters: {'scalers': 'robust', 'ratios': 'log_ratio', 'imputers': 'median', 'n_estimators': 2900, 'learning_rate': 0.036796127212672586, 'max_depth': 12, 'min_child_weight': 1, 'subsample': 0.8, 'colsample_bytree': 0.7, 'colsample_bylevel': 0.9, 'reg_alpha': 0.00011930709414792227, 'reg_lambda': 8.742978811525798, 'gamma': 0.00042124343917424105}. Best is trial 94 with value: -0.1588569907036204.
[I 2026-07-14 20:26:51,583] Trial 143 finished with value: -0.06726999144454684 and parameters: {'scalers': 'robust', 'ratios': 'log_ratio', 'imputers': 'none', 'n_estimators': 2900, 'learning_rate': 0.03880031808694149, 'max_depth': 12, 'min_child_weight': 1, 'subsample': 0.8, 'colsample_bytree': 0.6, 'colsample_bylevel': 0.9, 'reg_alpha': 6.306781193489018e-05, 'reg_lambda': 8.492438428317518, 'gamma': 0.0004794722981155748}. Best is trial 94 with value: -0.1588569907036204.
[I 2026-07-14 20:27:16,996] Trial 144 finished with value: -0.07247431755418463 and parameters: {'scalers': 'standard', 'ratios': 'log_ratio', 'imputers': 'none', 'n_estimators': 2850, 'learning_rate': 0.053196713217522285, 'max_depth': 12, 'min_child_weight': 1, 'subsample': 0.8, 'colsample_bytree': 0.6, 'colsample_bylevel': 0.9, 'reg_alpha': 9.107598358678935e-05, 'reg_lambda': 7.087678037445121, 'gamma': 0.002514215462042145}. Best is trial 94 with value: -0.1588569907036204.
[I 2026-07-14 20:27:42,045] Trial 145 finished with value: -0.047967343590380365 and parameters: {'scalers': 'standard', 'ratios': 'log_ratio', 'imputers': 'none', 'n_estimators': 2850, 'learning_rate': 0.029069044740147085, 'max_depth': 12, 'min_child_weight': 2, 'subsample': 0.8, 'colsample_bytree': 0.7, 'colsample_bylevel': 0.9, 'reg_alpha': 7.799767151758808e-05, 'reg_lambda': 8.674165983851527, 'gamma': 0.0031893210835683985}. Best is trial 94 with value: -0.1588569907036204.
[I 2026-07-14 20:28:10,142] Trial 146 finished with value: -0.07521904083280907 and parameters: {'scalers': 'standard', 'ratios': 'log_ratio', 'imputers': 'none', 'n_estimators': 2900, 'learning_rate': 0.1159641034053085, 'max_depth': 12, 'min_child_weight': 2, 'subsample': 0.8, 'colsample_bytree': 0.7, 'colsample_bylevel': 0.9, 'reg_alpha': 0.00016197820984736115, 'reg_lambda': 7.232632828324635, 'gamma': 0.00016672721361772714}. Best is trial 94 with value: -0.1588569907036204.
[I 2026-07-14 20:28:36,165] Trial 147 finished with value: -0.05469231883188147 and parameters: {'scalers': 'standard', 'ratios': 'log_ratio', 'imputers': 'none', 'n_estimators': 2850, 'learning_rate': 0.05339936316138554, 'max_depth': 12, 'min_child_weight': 2, 'subsample': 0.8, 'colsample_bytree': 0.7, 'colsample_bylevel': 1.0, 'reg_alpha': 0.00010620837900024632, 'reg_lambda': 7.305769481333208, 'gamma': 0.000488703942686458}. Best is trial 94 with value: -0.1588569907036204.
[I 2026-07-14 20:29:00,018] Trial 148 finished with value: -0.056011841117483675 and parameters: {'scalers': 'standard', 'ratios': 'log_ratio', 'imputers': 'none', 'n_estimators': 2850, 'learning_rate': 0.056333491457534135, 'max_depth': 12, 'min_child_weight': 2, 'subsample': 0.8, 'colsample_bytree': 0.7, 'colsample_bylevel': 0.9, 'reg_alpha': 0.00011021712791869325, 'reg_lambda': 7.878354305609649, 'gamma': 0.00043850736232452106}. Best is trial 94 with value: -0.1588569907036204.
[I 2026-07-14 20:29:27,455] Trial 149 finished with value: -0.07765836813648429 and parameters: {'scalers': 'standard', 'ratios': 'log_ratio', 'imputers': 'none', 'n_estimators': 2800, 'learning_rate': 0.12327055590426059, 'max_depth': 12, 'min_child_weight': 2, 'subsample': 0.8, 'colsample_bytree': 0.7, 'colsample_bylevel': 0.9, 'reg_alpha': 0.00012460812527649925, 'reg_lambda': 5.212876456018227, 'gamma': 0.0006502845721629961}. Best is trial 94 with value: -0.1588569907036204.
[I 2026-07-14 20:29:45,758] Trial 150 finished with value: -0.05618679948084098 and parameters: {'scalers': 'standard', 'ratios': 'log_ratio', 'imputers': 'none', 'n_estimators': 2800, 'learning_rate': 0.05344447738219649, 'max_depth': 12, 'min_child_weight': 2, 'subsample': 0.8, 'colsample_bytree': 0.6, 'colsample_bylevel': 0.9, 'reg_alpha': 6.07891095120602e-05, 'reg_lambda': 27.67676451312455, 'gamma': 0.00016483927110751866}. Best is trial 94 with value: -0.1588569907036204.
[I 2026-07-14 20:30:11,400] Trial 151 finished with value: -0.05316534777932316 and parameters: {'scalers': 'standard', 'ratios': 'log_ratio', 'imputers': 'none', 'n_estimators': 2800, 'learning_rate': 0.05157663746517172, 'max_depth': 12, 'min_child_weight': 2, 'subsample': 0.8, 'colsample_bytree': 0.7, 'colsample_bylevel': 1.0, 'reg_alpha': 7.719134321910418e-05, 'reg_lambda': 5.643298942431787, 'gamma': 0.0007544046564504593}. Best is trial 94 with value: -0.1588569907036204.
[I 2026-07-14 20:30:33,240] Trial 152 finished with value: -0.05775339237128463 and parameters: {'scalers': 'robust', 'ratios': 'log_ratio', 'imputers': 'none', 'n_estimators': 2800, 'learning_rate': 0.059884865933244276, 'max_depth': 12, 'min_child_weight': 2, 'subsample': 0.8, 'colsample_bytree': 0.7, 'colsample_bylevel': 0.9, 'reg_alpha': 0.0001591714056686114, 'reg_lambda': 25.314990957165197, 'gamma': 0.0008939926906837457}. Best is trial 94 with value: -0.1588569907036204.
[I 2026-07-14 20:30:57,594] Trial 153 finished with value: -0.06977950334045134 and parameters: {'scalers': 'robust', 'ratios': 'log_ratio', 'imputers': 'none', 'n_estimators': 2800, 'learning_rate': 0.09791123113442154, 'max_depth': 12, 'min_child_weight': 2, 'subsample': 0.8, 'colsample_bytree': 0.7, 'colsample_bylevel': 1.0, 'reg_alpha': 0.00016725397765159617, 'reg_lambda': 35.76145888778224, 'gamma': 0.00012783158672106403}. Best is trial 94 with value: -0.1588569907036204.
[I 2026-07-14 20:31:21,976] Trial 154 finished with value: -0.06971654448260198 and parameters: {'scalers': 'robust', 'ratios': 'log_ratio', 'imputers': 'none', 'n_estimators': 2800, 'learning_rate': 0.0952465900945521, 'max_depth': 12, 'min_child_weight': 2, 'subsample': 0.8, 'colsample_bytree': 0.7, 'colsample_bylevel': 1.0, 'reg_alpha': 0.0015084646645193143, 'reg_lambda': 33.96196135743236, 'gamma': 0.0006844776667550737}. Best is trial 94 with value: -0.1588569907036204.
[I 2026-07-14 20:31:44,875] Trial 155 finished with value: -0.02498678118241795 and parameters: {'scalers': 'robust', 'ratios': 'log_ratio', 'imputers': 'none', 'n_estimators': 2800, 'learning_rate': 0.0009062552091766622, 'max_depth': 12, 'min_child_weight': 1, 'subsample': 0.8, 'colsample_bytree': 0.7, 'colsample_bylevel': 0.9, 'reg_alpha': 0.0016278135906526976, 'reg_lambda': 33.86582306459921, 'gamma': 0.010382958463153357}. Best is trial 94 with value: -0.1588569907036204.
[I 2026-07-14 20:32:09,074] Trial 156 finished with value: -0.09565758928361177 and parameters: {'scalers': 'robust', 'ratios': 'log_ratio', 'imputers': 'none', 'n_estimators': 2750, 'learning_rate': 0.09624947754740816, 'max_depth': 11, 'min_child_weight': 1, 'subsample': 0.8, 'colsample_bytree': 0.7, 'colsample_bylevel': 0.9, 'reg_alpha': 0.0016831094079609288, 'reg_lambda': 48.52990065613557, 'gamma': 0.0007920347932630929}. Best is trial 94 with value: -0.1588569907036204.
[I 2026-07-14 20:32:39,246] Trial 157 finished with value: -0.09986430833909139 and parameters: {'scalers': 'robust', 'ratios': 'log_ratio', 'imputers': 'none', 'n_estimators': 3000, 'learning_rate': 0.09797875338184135, 'max_depth': 11, 'min_child_weight': 1, 'subsample': 0.8, 'colsample_bytree': 0.7, 'colsample_bylevel': 1.0, 'reg_alpha': 0.00032881463138515404, 'reg_lambda': 26.518049714714675, 'gamma': 0.0007830837617437405}. Best is trial 94 with value: -0.1588569907036204.
[I 2026-07-14 20:33:09,856] Trial 158 finished with value: -0.10168339645235447 and parameters: {'scalers': 'robust', 'ratios': 'log_ratio', 'imputers': 'none', 'n_estimators': 3000, 'learning_rate': 0.09568298628550198, 'max_depth': 12, 'min_child_weight': 1, 'subsample': 0.8, 'colsample_bytree': 0.7, 'colsample_bylevel': 0.9, 'reg_alpha': 0.00029055001568420273, 'reg_lambda': 12.09871881424395, 'gamma': 0.000923471624133156}. Best is trial 94 with value: -0.1588569907036204.
[I 2026-07-14 20:33:43,979] Trial 159 finished with value: -0.12605304389514 and parameters: {'scalers': 'robust', 'ratios': 'log_ratio', 'imputers': 'none', 'n_estimators': 3000, 'learning_rate': 0.14280274505525883, 'max_depth': 12, 'min_child_weight': 1, 'subsample': 0.8, 'colsample_bytree': 0.7, 'colsample_bylevel': 0.9, 'reg_alpha': 0.00032027718736023084, 'reg_lambda': 13.41868342659629, 'gamma': 0.0023983532502519253}. Best is trial 94 with value: -0.1588569907036204.
[I 2026-07-14 20:34:12,577] Trial 160 finished with value: -0.09573313064689049 and parameters: {'scalers': 'robust', 'ratios': 'log_ratio', 'imputers': 'none', 'n_estimators': 3000, 'learning_rate': 0.0962628990913989, 'max_depth': 12, 'min_child_weight': 1, 'subsample': 0.8, 'colsample_bytree': 0.7, 'colsample_bylevel': 0.9, 'reg_alpha': 0.00028888290126544294, 'reg_lambda': 14.979945517940093, 'gamma': 0.01116096947886391}. Best is trial 94 with value: -0.1588569907036204.
[I 2026-07-14 20:34:36,432] Trial 161 finished with value: -0.11649116351298068 and parameters: {'scalers': 'robust', 'ratios': 'log_ratio', 'imputers': 'none', 'n_estimators': 3000, 'learning_rate': 0.14003452942982497, 'max_depth': 11, 'min_child_weight': 1, 'subsample': 0.8, 'colsample_bytree': 0.5, 'colsample_bylevel': 0.9, 'reg_alpha': 0.00028619107254653045, 'reg_lambda': 12.678864826044359, 'gamma': 0.012546823797294987}. Best is trial 94 with value: -0.1588569907036204.
[I 2026-07-14 20:35:07,069] Trial 162 finished with value: -0.11420937853039384 and parameters: {'scalers': 'robust', 'ratios': 'log_ratio', 'imputers': 'none', 'n_estimators': 3000, 'learning_rate': 0.13790611431703415, 'max_depth': 11, 'min_child_weight': 1, 'subsample': 0.8, 'colsample_bytree': 0.7, 'colsample_bylevel': 0.9, 'reg_alpha': 0.0006637702366311066, 'reg_lambda': 12.967868699198572, 'gamma': 0.011029184822931798}. Best is trial 94 with value: -0.1588569907036204.
[I 2026-07-14 20:35:32,231] Trial 163 finished with value: -0.12506158991029162 and parameters: {'scalers': 'robust', 'ratios': 'log_ratio', 'imputers': 'none', 'n_estimators': 3000, 'learning_rate': 0.14591419587818394, 'max_depth': 11, 'min_child_weight': 1, 'subsample': 0.8, 'colsample_bytree': 0.5, 'colsample_bylevel': 0.9, 'reg_alpha': 0.0003273848952201045, 'reg_lambda': 14.349878512079211, 'gamma': 0.002504999295515906}. Best is trial 94 with value: -0.1588569907036204.
[I 2026-07-14 20:36:07,849] Trial 164 finished with value: -0.12210231666292255 and parameters: {'scalers': 'robust', 'ratios': 'log_ratio', 'imputers': 'none', 'n_estimators': 3000, 'learning_rate': 0.14600107032748788, 'max_depth': 11, 'min_child_weight': 1, 'subsample': 0.8, 'colsample_bytree': 0.8, 'colsample_bylevel': 0.9, 'reg_alpha': 0.0003132537127594886, 'reg_lambda': 12.789752040371873, 'gamma': 0.0023254608345079277}. Best is trial 94 with value: -0.1588569907036204.
[I 2026-07-14 20:36:35,159] Trial 165 finished with value: -0.1284016611056976 and parameters: {'scalers': 'robust', 'ratios': 'log_ratio', 'imputers': 'mean', 'n_estimators': 3000, 'learning_rate': 0.14327083928818704, 'max_depth': 12, 'min_child_weight': 1, 'subsample': 0.8, 'colsample_bytree': 0.5, 'colsample_bylevel': 0.9, 'reg_alpha': 0.0006799478157801812, 'reg_lambda': 13.266042640670339, 'gamma': 0.0027215413046224254}. Best is trial 94 with value: -0.1588569907036204.
[I 2026-07-14 20:37:01,994] Trial 166 finished with value: -0.12308640582237818 and parameters: {'scalers': 'none', 'ratios': 'log_ratio', 'imputers': 'mean', 'n_estimators': 3000, 'learning_rate': 0.1313494538169734, 'max_depth': 12, 'min_child_weight': 1, 'subsample': 0.8, 'colsample_bytree': 0.5, 'colsample_bylevel': 0.9, 'reg_alpha': 0.0008274062021510339, 'reg_lambda': 16.4237555950382, 'gamma': 0.0022488846863820515}. Best is trial 94 with value: -0.1588569907036204.
[I 2026-07-14 20:37:29,001] Trial 167 finished with value: -0.11820057354512468 and parameters: {'scalers': 'none', 'ratios': 'log_ratio', 'imputers': 'mean', 'n_estimators': 2950, 'learning_rate': 0.14764167364059186, 'max_depth': 12, 'min_child_weight': 1, 'subsample': 0.8, 'colsample_bytree': 0.5, 'colsample_bylevel': 0.9, 'reg_alpha': 0.0005524937617096495, 'reg_lambda': 2.6794582260714876, 'gamma': 0.002737938631476236}. Best is trial 94 with value: -0.1588569907036204.
[I 2026-07-14 20:38:05,088] Trial 168 finished with value: -0.10961278473465166 and parameters: {'scalers': 'robust', 'ratios': 'log_ratio', 'imputers': 'none', 'n_estimators': 2950, 'learning_rate': 0.1472859700492828, 'max_depth': 12, 'min_child_weight': 1, 'subsample': 0.8, 'colsample_bytree': 0.8, 'colsample_bylevel': 0.9, 'reg_alpha': 0.0006730480376179205, 'reg_lambda': 3.1708457597361823, 'gamma': 0.0025245410648792707}. Best is trial 94 with value: -0.1588569907036204.
[I 2026-07-14 20:38:28,000] Trial 169 finished with value: -0.10836686020204701 and parameters: {'scalers': 'robust', 'ratios': 'log_ratio', 'imputers': 'none', 'n_estimators': 2950, 'learning_rate': 0.13997444797113412, 'max_depth': 11, 'min_child_weight': 1, 'subsample': 0.8, 'colsample_bytree': 0.5, 'colsample_bylevel': 0.9, 'reg_alpha': 0.0007405156936730869, 'reg_lambda': 2.6768852488194255, 'gamma': 0.002475759868019337}. Best is trial 94 with value: -0.1588569907036204.
[I 2026-07-14 20:38:51,373] Trial 170 finished with value: -0.11000220827236584 and parameters: {'scalers': 'none', 'ratios': 'log_ratio', 'imputers': 'mean', 'n_estimators': 2950, 'learning_rate': 0.14495870426961208, 'max_depth': 11, 'min_child_weight': 1, 'subsample': 0.8, 'colsample_bytree': 0.5, 'colsample_bylevel': 0.9, 'reg_alpha': 0.000671874540262501, 'reg_lambda': 2.575761260767081, 'gamma': 0.012927730481418908}. Best is trial 94 with value: -0.1588569907036204.
[I 2026-07-14 20:39:14,863] Trial 171 finished with value: -0.10665868329563967 and parameters: {'scalers': 'none', 'ratios': 'log_ratio', 'imputers': 'mean', 'n_estimators': 2950, 'learning_rate': 0.1345108493941883, 'max_depth': 11, 'min_child_weight': 1, 'subsample': 0.8, 'colsample_bytree': 0.5, 'colsample_bylevel': 0.9, 'reg_alpha': 0.0005801387822877477, 'reg_lambda': 3.0807834904551634, 'gamma': 0.013964757148322357}. Best is trial 94 with value: -0.1588569907036204.
[I 2026-07-14 20:39:27,297] Trial 173 finished with value: -0.04684881548223493 and parameters: {'scalers': 'none', 'ratios': 'log_ratio', 'imputers': 'mean', 'n_estimators': 200, 'learning_rate': 0.15113980213860867, 'max_depth': 11, 'min_child_weight': 1, 'subsample': 0.8, 'colsample_bytree': 0.5, 'colsample_bylevel': 0.9, 'reg_alpha': 0.0005118536659588872, 'reg_lambda': 3.2342281116366167, 'gamma': 0.003683256967053119}. Best is trial 94 with value: -0.1588569907036204.
[I 2026-07-14 20:39:38,414] Trial 172 finished with value: -0.11433109381724595 and parameters: {'scalers': 'robust', 'ratios': 'log_ratio', 'imputers': 'mean', 'n_estimators': 2950, 'learning_rate': 0.152987162193678, 'max_depth': 11, 'min_child_weight': 1, 'subsample': 0.8, 'colsample_bytree': 0.5, 'colsample_bylevel': 0.9, 'reg_alpha': 0.00045732704801507135, 'reg_lambda': 19.08857193069012, 'gamma': 0.01470549053335135}. Best is trial 94 with value: -0.1588569907036204.
[I 2026-07-14 20:39:54,806] Trial 175 finished with value: -0.04046628549736594 and parameters: {'scalers': 'none', 'ratios': 'log_ratio', 'imputers': 'mean', 'n_estimators': 150, 'learning_rate': 0.1475595103303142, 'max_depth': 11, 'min_child_weight': 1, 'subsample': 0.8, 'colsample_bytree': 0.5, 'colsample_bylevel': 0.9, 'reg_alpha': 0.0004307371361332799, 'reg_lambda': 2.829285404239943, 'gamma': 0.013645347174710257}. Best is trial 94 with value: -0.1588569907036204.
[I 2026-07-14 20:39:57,946] Trial 176 finished with value: -0.04070283681009556 and parameters: {'scalers': 'none', 'ratios': 'log_ratio', 'imputers': 'mean', 'n_estimators': 150, 'learning_rate': 0.1448189482908228, 'max_depth': 11, 'min_child_weight': 1, 'subsample': 0.8, 'colsample_bytree': 0.5, 'colsample_bylevel': 0.9, 'reg_alpha': 0.0005024476974487725, 'reg_lambda': 2.6384423358183677, 'gamma': 0.014065232200195177}. Best is trial 94 with value: -0.1588569907036204.
[I 2026-07-14 20:40:02,035] Trial 174 finished with value: -0.11003414181626321 and parameters: {'scalers': 'none', 'ratios': 'log_ratio', 'imputers': 'mean', 'n_estimators': 2950, 'learning_rate': 0.14750183351432405, 'max_depth': 11, 'min_child_weight': 1, 'subsample': 0.8, 'colsample_bytree': 0.5, 'colsample_bylevel': 0.9, 'reg_alpha': 0.0004334563913724216, 'reg_lambda': 2.319189201717871, 'gamma': 0.0034261985930685627}. Best is trial 94 with value: -0.1588569907036204.
[I 2026-07-14 20:40:26,346] Trial 177 finished with value: -0.11644304518024864 and parameters: {'scalers': 'none', 'ratios': 'log_ratio', 'imputers': 'mean', 'n_estimators': 2950, 'learning_rate': 0.15145730793633394, 'max_depth': 11, 'min_child_weight': 1, 'subsample': 0.8, 'colsample_bytree': 0.5, 'colsample_bylevel': 0.9, 'reg_alpha': 0.00047141219065369535, 'reg_lambda': 3.696838715004407, 'gamma': 0.014604795013086773}. Best is trial 94 with value: -0.1588569907036204.
[I 2026-07-14 20:40:50,350] Trial 178 finished with value: -0.11346588941193653 and parameters: {'scalers': 'none', 'ratios': 'log_ratio', 'imputers': 'mean', 'n_estimators': 2950, 'learning_rate': 0.15143878037930877, 'max_depth': 11, 'min_child_weight': 1, 'subsample': 0.8, 'colsample_bytree': 0.5, 'colsample_bylevel': 0.9, 'reg_alpha': 0.0011011524326459859, 'reg_lambda': 3.50461237508376, 'gamma': 0.01135161593854592}. Best is trial 94 with value: -0.1588569907036204.
[I 2026-07-14 20:41:15,680] Trial 179 finished with value: -0.12500176245907657 and parameters: {'scalers': 'none', 'ratios': 'log_ratio', 'imputers': 'mean', 'n_estimators': 2950, 'learning_rate': 0.15037088251367184, 'max_depth': 11, 'min_child_weight': 1, 'subsample': 0.8, 'colsample_bytree': 0.5, 'colsample_bylevel': 0.9, 'reg_alpha': 0.0004125161785766523, 'reg_lambda': 16.2932935592828, 'gamma': 0.0032120345739269944}. Best is trial 94 with value: -0.1588569907036204.
