[I 2026-07-14 16:42:14,449] Trial 317 finished with value: -0.33374638923056127 and parameters: {'scalers': 'none', 'ratios': 'log_ratio', 'imputers': 'median', 'n_estimators': 100, 'learning_rate': 0.00016494722458346218, 'max_depth': 3, 'min_child_weight': 3, 'subsample': 0.8, 'colsample_bytree': 0.5, 'colsample_bylevel': 0.9, 'reg_alpha': 25.78794129712678, 'reg_lambda': 0.5652168807395566, 'gamma': 76.97773317951909}. Best is trial 199 with value: -0.33399307416321355.
[I 2026-07-14 16:42:14,695] Trial 318 finished with value: -0.33376982930513716 and parameters: {'scalers': 'none', 'ratios': 'log_ratio', 'imputers': 'median', 'n_estimators': 100, 'learning_rate': 0.00015876474563157706, 'max_depth': 3, 'min_child_weight': 4, 'subsample': 0.8, 'colsample_bytree': 0.5, 'colsample_bylevel': 0.9, 'reg_alpha': 2.1316139988938705, 'reg_lambda': 0.5312826994591492, 'gamma': 74.28061019656755}. Best is trial 199 with value: -0.33399307416321355.
[I 2026-07-14 16:42:14,894] Trial 319 finished with value: -0.3337439349915595 and parameters: {'scalers': 'none', 'ratios': 'log_ratio', 'imputers': 'median', 'n_estimators': 100, 'learning_rate': 0.0001656037002312225, 'max_depth': 3, 'min_child_weight': 4, 'subsample': 0.8, 'colsample_bytree': 0.5, 'colsample_bylevel': 0.9, 'reg_alpha': 25.39145926943386, 'reg_lambda': 0.5058356327024592, 'gamma': 70.14279571673116}. Best is trial 199 with value: -0.33399307416321355.
