[I 2026-07-14 16:50:41,775] Trial 45 finished with value: -0.2723285321567422 and parameters: {'scalers': 'standard', 'ratios': 'norm_ratio', 'imputers': 'none', 'n_estimators': 1200, 'learning_rate': 0.4191187133445413, 'max_depth': 9, 'min_child_weight': 7, 'subsample': 0.5, 'colsample_bytree': 0.5, 'colsample_bylevel': 0.6, 'reg_alpha': 3.0290584630071774e-05, 'reg_lambda': 7.18006997677028, 'gamma': 0.05942699178198411}. Best is trial 45 with value: -0.2723285321567422.
[I 2026-07-14 16:50:51,864] Trial 46 finished with value: -0.27737704794096024 and parameters: {'scalers': 'robust', 'ratios': 'norm_ratio', 'imputers': 'none', 'n_estimators': 1100, 'learning_rate': 0.4745915477048297, 'max_depth': 8, 'min_child_weight': 7, 'subsample': 0.5, 'colsample_bytree': 0.9, 'colsample_bylevel': 0.6, 'reg_alpha': 1.2577119980211402e-06, 'reg_lambda': 6.408748426974611, 'gamma': 0.06002865727168915}. Best is trial 46 with value: -0.27737704794096024.
[I 2026-07-14 16:51:01,961] Trial 47 finished with value: -0.32292470051545075 and parameters: {'scalers': 'robust', 'ratios': 'norm_ratio', 'imputers': 'none', 'n_estimators': 1100, 'learning_rate': 0.4848105826167447, 'max_depth': 8, 'min_child_weight': 2, 'subsample': 0.5, 'colsample_bytree': 0.9, 'colsample_bylevel': 0.6, 'reg_alpha': 0.018653051809661366, 'reg_lambda': 9.814005012319203, 'gamma': 0.13653774294034987}. Best is trial 47 with value: -0.32292470051545075.
[I 2026-07-14 16:51:11,458] Trial 48 finished with value: -0.27858845806045474 and parameters: {'scalers': 'robust', 'ratios': 'norm_ratio', 'imputers': 'none', 'n_estimators': 1100, 'learning_rate': 0.4873777468616112, 'max_depth': 8, 'min_child_weight': 7, 'subsample': 0.5, 'colsample_bytree': 0.9, 'colsample_bylevel': 0.6, 'reg_alpha': 0.008607377314505817, 'reg_lambda': 5.323029216428275, 'gamma': 0.0732294218277478}. Best is trial 47 with value: -0.32292470051545075.
[I 2026-07-14 16:51:20,737] Trial 49 finished with value: -0.24361295327408874 and parameters: {'scalers': 'robust', 'ratios': 'norm_ratio', 'imputers': 'median', 'n_estimators': 1200, 'learning_rate': 0.3743559660477557, 'max_depth': 8, 'min_child_weight': 7, 'subsample': 0.5, 'colsample_bytree': 0.9, 'colsample_bylevel': 0.6, 'reg_alpha': 0.003867700172683295, 'reg_lambda': 2.3249029988794892e-05, 'gamma': 0.09501245765268787}. Best is trial 47 with value: -0.32292470051545075.
[I 2026-07-14 16:51:27,714] Trial 50 finished with value: -0.236109754101467 and parameters: {'scalers': 'robust', 'ratios': 'norm_ratio', 'imputers': 'none', 'n_estimators': 1150, 'learning_rate': 0.46324392172534673, 'max_depth': 8, 'min_child_weight': 9, 'subsample': 0.5, 'colsample_bytree': 0.9, 'colsample_bylevel': 0.6, 'reg_alpha': 0.009682195065597142, 'reg_lambda': 2.9066463032551977e-05, 'gamma': 0.12963037491284485}. Best is trial 47 with value: -0.32292470051545075.
[I 2026-07-14 16:51:29,313] Trial 51 finished with value: -0.19003849278965496 and parameters: {'scalers': 'robust', 'ratios': 'norm_ratio', 'imputers': 'none', 'n_estimators': 1250, 'learning_rate': 0.49025212336388563, 'max_depth': 8, 'min_child_weight': 9, 'subsample': 0.5, 'colsample_bytree': 0.9, 'colsample_bylevel': 0.6, 'reg_alpha': 79.02412146848864, 'reg_lambda': 9.967372910873196e-05, 'gamma': 0.11340505277733011}. Best is trial 47 with value: -0.32292470051545075.
[I 2026-07-14 16:51:34,268] Trial 52 finished with value: -0.2268167528883736 and parameters: {'scalers': 'standard', 'ratios': 'norm_ratio', 'imputers': 'none', 'n_estimators': 1150, 'learning_rate': 0.4672178845959043, 'max_depth': 8, 'min_child_weight': 9, 'subsample': 0.5, 'colsample_bytree': 0.5, 'colsample_bylevel': 0.7, 'reg_alpha': 0.01844308746876317, 'reg_lambda': 4.6896530231865304e-05, 'gamma': 0.13109180547693536}. Best is trial 47 with value: -0.32292470051545075.
[I 2026-07-14 16:51:39,398] Trial 53 finished with value: -0.23299324890512496 and parameters: {'scalers': 'standard', 'ratios': 'norm_ratio', 'imputers': 'none', 'n_estimators': 1150, 'learning_rate': 0.4419280073892811, 'max_depth': 8, 'min_child_weight': 7, 'subsample': 0.5, 'colsample_bytree': 0.5, 'colsample_bylevel': 0.7, 'reg_alpha': 0.007165953806630783, 'reg_lambda': 0.43269264837009486, 'gamma': 0.13835328509635259}. Best is trial 47 with value: -0.32292470051545075.
[I 2026-07-14 16:51:44,053] Trial 54 finished with value: -0.22575823238291354 and parameters: {'scalers': 'standard', 'ratios': 'norm_ratio', 'imputers': 'none', 'n_estimators': 1150, 'learning_rate': 0.4967533299196184, 'max_depth': 8, 'min_child_weight': 7, 'subsample': 0.5, 'colsample_bytree': 0.5, 'colsample_bylevel': 0.7, 'reg_alpha': 1.0772965914721167e-06, 'reg_lambda': 0.28117751480402486, 'gamma': 0.16800559484880737}. Best is trial 47 with value: -0.32292470051545075.
[I 2026-07-14 16:51:49,108] Trial 55 finished with value: -0.23364664779293776 and parameters: {'scalers': 'robust', 'ratios': 'norm_ratio', 'imputers': 'none', 'n_estimators': 1200, 'learning_rate': 0.4704693776384089, 'max_depth': 8, 'min_child_weight': 7, 'subsample': 0.5, 'colsample_bytree': 0.5, 'colsample_bylevel': 0.7, 'reg_alpha': 0.016962393930059466, 'reg_lambda': 0.41626342856550114, 'gamma': 0.14888393629098745}. Best is trial 47 with value: -0.32292470051545075.
[I 2026-07-14 16:51:55,570] Trial 56 finished with value: -0.19215715773736947 and parameters: {'scalers': 'robust', 'ratios': 'norm_ratio', 'imputers': 'none', 'n_estimators': 1150, 'learning_rate': 0.1809797566908317, 'max_depth': 8, 'min_child_weight': 9, 'subsample': 0.5, 'colsample_bytree': 0.9, 'colsample_bylevel': 0.7, 'reg_alpha': 0.027404280446498362, 'reg_lambda': 0.5967006435052961, 'gamma': 0.14704980468337006}. Best is trial 47 with value: -0.32292470051545075.
[I 2026-07-14 16:51:57,849] Trial 57 finished with value: -0.18032907908064258 and parameters: {'scalers': 'robust', 'ratios': 'norm_ratio', 'imputers': 'none', 'n_estimators': 1500, 'learning_rate': 0.14297933912554306, 'max_depth': 9, 'min_child_weight': 9, 'subsample': 0.5, 'colsample_bytree': 0.9, 'colsample_bylevel': 0.7, 'reg_alpha': 0.02796043428648304, 'reg_lambda': 0.3410638141198662, 'gamma': 4.640031409256577}. Best is trial 47 with value: -0.32292470051545075.
[I 2026-07-14 16:51:59,776] Trial 58 finished with value: -0.1815663143510736 and parameters: {'scalers': 'robust', 'ratios': 'norm_ratio', 'imputers': 'none', 'n_estimators': 1500, 'learning_rate': 0.14440652809779989, 'max_depth': 9, 'min_child_weight': 7, 'subsample': 0.5, 'colsample_bytree': 0.5, 'colsample_bylevel': 0.7, 'reg_alpha': 2.405317485222732e-06, 'reg_lambda': 0.4039512356858319, 'gamma': 5.033733485228956}. Best is trial 47 with value: -0.32292470051545075.
[I 2026-07-14 16:52:01,857] Trial 59 finished with value: -0.18185811262389212 and parameters: {'scalers': 'robust', 'ratios': 'norm_ratio', 'imputers': 'none', 'n_estimators': 1500, 'learning_rate': 0.15195758427829215, 'max_depth': 9, 'min_child_weight': 7, 'subsample': 0.5, 'colsample_bytree': 0.5, 'colsample_bylevel': 0.7, 'reg_alpha': 1.0870018053933517e-06, 'reg_lambda': 0.39797575342203756, 'gamma': 5.436316229613945}. Best is trial 47 with value: -0.32292470051545075.
[I 2026-07-14 16:52:13,253] Trial 60 finished with value: -0.2202155344406297 and parameters: {'scalers': 'robust', 'ratios': 'norm_ratio', 'imputers': 'none', 'n_estimators': 1500, 'learning_rate': 0.15461419282049227, 'max_depth': 9, 'min_child_weight': 7, 'subsample': 0.5, 'colsample_bytree': 0.5, 'colsample_bylevel': 0.7, 'reg_alpha': 5.257991053232633e-06, 'reg_lambda': 0.4455540174012692, 'gamma': 0.01002445750498357}. Best is trial 47 with value: -0.32292470051545075.
[I 2026-07-14 16:52:15,868] Trial 61 finished with value: -0.1760788087496893 and parameters: {'scalers': 'robust', 'ratios': 'norm_ratio', 'imputers': 'none', 'n_estimators': 1450, 'learning_rate': 0.16717175732422437, 'max_depth': 9, 'min_child_weight': 7, 'subsample': 0.5, 'colsample_bytree': 0.5, 'colsample_bylevel': 0.7, 'reg_alpha': 2.1125285549423065e-06, 'reg_lambda': 15.448062028929458, 'gamma': 0.9949394009485593}. Best is trial 47 with value: -0.32292470051545075.
[I 2026-07-14 16:52:19,769] Trial 62 finished with value: -0.17756066345343377 and parameters: {'scalers': 'robust', 'ratios': 'norm_ratio', 'imputers': 'none', 'n_estimators': 1550, 'learning_rate': 0.14671877375077524, 'max_depth': 9, 'min_child_weight': 5, 'subsample': 0.5, 'colsample_bytree': 1.0, 'colsample_bylevel': 0.6, 'reg_alpha': 3.7610633726210572e-06, 'reg_lambda': 2.912405637249425, 'gamma': 1.2393744206414703}. Best is trial 47 with value: -0.32292470051545075.
[I 2026-07-14 16:52:23,106] Trial 63 finished with value: -0.1772499270744185 and parameters: {'scalers': 'robust', 'ratios': 'norm_ratio', 'imputers': 'none', 'n_estimators': 1450, 'learning_rate': 0.15697323992399864, 'max_depth': 9, 'min_child_weight': 5, 'subsample': 0.5, 'colsample_bytree': 1.0, 'colsample_bylevel': 0.6, 'reg_alpha': 3.064729651894061e-06, 'reg_lambda': 15.789290729801458, 'gamma': 1.0982753349920418}. Best is trial 47 with value: -0.32292470051545075.
[I 2026-07-14 16:52:41,782] Trial 64 finished with value: -0.23821405298611065 and parameters: {'scalers': 'robust', 'ratios': 'norm_ratio', 'imputers': 'none', 'n_estimators': 1450, 'learning_rate': 0.15146287027603997, 'max_depth': 9, 'min_child_weight': 5, 'subsample': 0.5, 'colsample_bytree': 1.0, 'colsample_bylevel': 0.6, 'reg_alpha': 3.9992070943346994e-06, 'reg_lambda': 17.02829407671947, 'gamma': 0.012483689156480625}. Best is trial 47 with value: -0.32292470051545075.
[I 2026-07-14 16:52:48,658] Trial 65 finished with value: -0.18138894611847295 and parameters: {'scalers': 'robust', 'ratios': 'norm_ratio', 'imputers': 'none', 'n_estimators': 1400, 'learning_rate': 0.17440502159669327, 'max_depth': 9, 'min_child_weight': 5, 'subsample': 0.5, 'colsample_bytree': 1.0, 'colsample_bylevel': 0.6, 'reg_alpha': 3.4059127392786417e-06, 'reg_lambda': 2.7556969539708844, 'gamma': 0.8704517251459238}. Best is trial 47 with value: -0.32292470051545075.
[I 2026-07-14 16:52:51,898] Trial 66 finished with value: -0.17715710520286054 and parameters: {'scalers': 'none', 'ratios': 'norm_ratio', 'imputers': 'none', 'n_estimators': 1400, 'learning_rate': 0.1805003534603808, 'max_depth': 9, 'min_child_weight': 5, 'subsample': 0.5, 'colsample_bytree': 1.0, 'colsample_bylevel': 0.6, 'reg_alpha': 2.7943504897968502e-06, 'reg_lambda': 18.31852740888524, 'gamma': 1.0918588732473105}. Best is trial 47 with value: -0.32292470051545075.
[I 2026-07-14 16:53:08,290] Trial 67 finished with value: -0.24260694001292277 and parameters: {'scalers': 'standard', 'ratios': 'norm_ratio', 'imputers': 'none', 'n_estimators': 1350, 'learning_rate': 0.20289601304314972, 'max_depth': 9, 'min_child_weight': 5, 'subsample': 0.5, 'colsample_bytree': 1.0, 'colsample_bylevel': 0.6, 'reg_alpha': 1.7249841812276442e-05, 'reg_lambda': 2.4521090538571375, 'gamma': 0.014982214068195623}. Best is trial 47 with value: -0.32292470051545075.
[I 2026-07-14 16:53:14,934] Trial 68 finished with value: -0.2350167838402152 and parameters: {'scalers': 'standard', 'ratios': 'norm_ratio', 'imputers': 'none', 'n_estimators': 1000, 'learning_rate': 0.3614000240459772, 'max_depth': 6, 'min_child_weight': 8, 'subsample': 0.5, 'colsample_bytree': 1.0, 'colsample_bylevel': 0.6, 'reg_alpha': 2.6801164643625522e-05, 'reg_lambda': 2.7065344880401287, 'gamma': 0.01574195908865508}. Best is trial 47 with value: -0.32292470051545075.
[I 2026-07-14 16:53:18,007] Trial 69 finished with value: -0.18779586604264037 and parameters: {'scalers': 'standard', 'ratios': 'norm_ratio', 'imputers': 'none', 'n_estimators': 1000, 'learning_rate': 0.37141915708225576, 'max_depth': 6, 'min_child_weight': 8, 'subsample': 0.5, 'colsample_bytree': 1.0, 'colsample_bylevel': 0.6, 'reg_alpha': 1.415100854638096e-05, 'reg_lambda': 3.16479306570655, 'gamma': 0.9771372880464438}. Best is trial 47 with value: -0.32292470051545075.
[I 2026-07-14 16:53:24,125] Trial 70 finished with value: -0.23339677803350564 and parameters: {'scalers': 'standard', 'ratios': 'norm_ratio', 'imputers': 'none', 'n_estimators': 1000, 'learning_rate': 0.369720832680667, 'max_depth': 6, 'min_child_weight': 8, 'subsample': 0.5, 'colsample_bytree': 0.9, 'colsample_bylevel': 0.6, 'reg_alpha': 1.0253996007968076e-05, 'reg_lambda': 2.59949295628508, 'gamma': 0.01622739716146146}. Best is trial 47 with value: -0.32292470051545075.
[I 2026-07-14 16:53:30,310] Trial 71 finished with value: -0.23056370072702095 and parameters: {'scalers': 'standard', 'ratios': 'norm_ratio', 'imputers': 'none', 'n_estimators': 1000, 'learning_rate': 0.3557043788191552, 'max_depth': 6, 'min_child_weight': 8, 'subsample': 0.5, 'colsample_bytree': 0.9, 'colsample_bylevel': 0.6, 'reg_alpha': 1.9939507663138778e-05, 'reg_lambda': 3.4116274198286507, 'gamma': 0.01456724381848301}. Best is trial 47 with value: -0.32292470051545075.
[I 2026-07-14 16:53:36,441] Trial 72 finished with value: -0.2292107901485814 and parameters: {'scalers': 'standard', 'ratios': 'norm_ratio', 'imputers': 'none', 'n_estimators': 1000, 'learning_rate': 0.35223160181566554, 'max_depth': 6, 'min_child_weight': 8, 'subsample': 0.5, 'colsample_bytree': 0.9, 'colsample_bylevel': 0.6, 'reg_alpha': 1.3277283664515226e-05, 'reg_lambda': 2.206602779310479, 'gamma': 0.015948122727850664}. Best is trial 47 with value: -0.32292470051545075.
[I 2026-07-14 16:53:42,473] Trial 73 finished with value: -0.23244133489405638 and parameters: {'scalers': 'standard', 'ratios': 'norm_ratio', 'imputers': 'none', 'n_estimators': 1000, 'learning_rate': 0.36047782805287454, 'max_depth': 6, 'min_child_weight': 8, 'subsample': 0.5, 'colsample_bytree': 0.9, 'colsample_bylevel': 0.6, 'reg_alpha': 1.4494740165673818e-05, 'reg_lambda': 1.8593761533268358, 'gamma': 0.01633739070086264}. Best is trial 47 with value: -0.32292470051545075.
[I 2026-07-14 16:53:48,821] Trial 74 finished with value: -0.23058351410467 and parameters: {'scalers': 'standard', 'ratios': 'norm_ratio', 'imputers': 'none', 'n_estimators': 1050, 'learning_rate': 0.3540163570632645, 'max_depth': 6, 'min_child_weight': 8, 'subsample': 0.5, 'colsample_bytree': 0.9, 'colsample_bylevel': 0.6, 'reg_alpha': 1.7778281018100264e-05, 'reg_lambda': 1.8883656860509956, 'gamma': 0.005211483102827966}. Best is trial 47 with value: -0.32292470051545075.
[I 2026-07-14 16:53:53,841] Trial 75 finished with value: -0.22765026571842148 and parameters: {'scalers': 'standard', 'ratios': 'norm_ratio', 'imputers': 'none', 'n_estimators': 800, 'learning_rate': 0.3577371804130693, 'max_depth': 6, 'min_child_weight': 8, 'subsample': 0.5, 'colsample_bytree': 0.9, 'colsample_bylevel': 0.6, 'reg_alpha': 3.756668451168849e-05, 'reg_lambda': 4.201514236625461, 'gamma': 0.006332637786969766}. Best is trial 47 with value: -0.32292470051545075.
[I 2026-07-14 16:53:59,254] Trial 76 finished with value: -0.18216207425263364 and parameters: {'scalers': 'standard', 'ratios': 'norm_ratio', 'imputers': 'none', 'n_estimators': 800, 'learning_rate': 0.04642405059756854, 'max_depth': 7, 'min_child_weight': 8, 'subsample': 0.5, 'colsample_bytree': 0.9, 'colsample_bylevel': 0.6, 'reg_alpha': 0.0030311505009807016, 'reg_lambda': 0.9127683154300127, 'gamma': 0.0054047268132614125}. Best is trial 47 with value: -0.32292470051545075.
[I 2026-07-14 16:54:09,295] Trial 77 finished with value: -0.18534821990266356 and parameters: {'scalers': 'standard', 'ratios': 'norm_ratio', 'imputers': 'none', 'n_estimators': 1650, 'learning_rate': 0.05585187812217922, 'max_depth': 7, 'min_child_weight': 8, 'subsample': 0.5, 'colsample_bytree': 0.9, 'colsample_bylevel': 0.6, 'reg_alpha': 0.005008875603575643, 'reg_lambda': 1.2147375357690917, 'gamma': 0.07603636093835746}. Best is trial 47 with value: -0.32292470051545075.
[I 2026-07-14 16:54:15,780] Trial 78 finished with value: -0.23085713221513035 and parameters: {'scalers': 'standard', 'ratios': 'norm_ratio', 'imputers': 'none', 'n_estimators': 800, 'learning_rate': 0.3423392487117794, 'max_depth': 8, 'min_child_weight': 8, 'subsample': 0.5, 'colsample_bytree': 0.9, 'colsample_bylevel': 0.6, 'reg_alpha': 0.0029504203487332975, 'reg_lambda': 1.108914523361438, 'gamma': 0.07152492157993293}. Best is trial 47 with value: -0.32292470051545075.
[I 2026-07-14 16:54:22,407] Trial 79 finished with value: -0.2479166497758602 and parameters: {'scalers': 'standard', 'ratios': 'norm_ratio', 'imputers': 'median', 'n_estimators': 750, 'learning_rate': 0.3479848880194498, 'max_depth': 8, 'min_child_weight': 4, 'subsample': 0.5, 'colsample_bytree': 0.9, 'colsample_bylevel': 0.6, 'reg_alpha': 0.0030960239897159098, 'reg_lambda': 0.016829309729789122, 'gamma': 0.06600679905775376}. Best is trial 47 with value: -0.32292470051545075.
[I 2026-07-14 16:54:28,587] Trial 80 finished with value: -0.19477187975339416 and parameters: {'scalers': 'none', 'ratios': 'norm_ratio', 'imputers': 'median', 'n_estimators': 800, 'learning_rate': 0.11020726201936205, 'max_depth': 8, 'min_child_weight': 6, 'subsample': 0.5, 'colsample_bytree': 0.9, 'colsample_bylevel': 0.6, 'reg_alpha': 0.0024786437780703998, 'reg_lambda': 2.7834903245845025e-06, 'gamma': 0.06457014258852165}. Best is trial 47 with value: -0.32292470051545075.
[I 2026-07-14 16:54:34,590] Trial 81 finished with value: -0.19637533189934098 and parameters: {'scalers': 'none', 'ratios': 'norm_ratio', 'imputers': 'median', 'n_estimators': 750, 'learning_rate': 0.11555204011801613, 'max_depth': 8, 'min_child_weight': 6, 'subsample': 0.5, 'colsample_bytree': 0.9, 'colsample_bylevel': 0.6, 'reg_alpha': 0.0021520390057973285, 'reg_lambda': 0.9854354775794796, 'gamma': 0.05989868564942854}. Best is trial 47 with value: -0.32292470051545075.
[I 2026-07-14 16:54:41,049] Trial 82 finished with value: -0.19683092333475657 and parameters: {'scalers': 'none', 'ratios': 'norm_ratio', 'imputers': 'median', 'n_estimators': 900, 'learning_rate': 0.11276165738823199, 'max_depth': 8, 'min_child_weight': 6, 'subsample': 0.5, 'colsample_bytree': 0.9, 'colsample_bylevel': 0.5, 'reg_alpha': 0.0024562902301119554, 'reg_lambda': 0.0035297094564093728, 'gamma': 0.06313250420699282}. Best is trial 47 with value: -0.32292470051545075.
[I 2026-07-14 16:54:47,439] Trial 83 finished with value: -0.2181677446019902 and parameters: {'scalers': 'none', 'ratios': 'norm_ratio', 'imputers': 'median', 'n_estimators': 850, 'learning_rate': 0.2166597333551707, 'max_depth': 8, 'min_child_weight': 4, 'subsample': 0.5, 'colsample_bytree': 0.9, 'colsample_bylevel': 0.5, 'reg_alpha': 0.0038362951637934653, 'reg_lambda': 0.0034053116931611945, 'gamma': 0.09050409386606084}. Best is trial 47 with value: -0.32292470051545075.
[I 2026-07-14 16:54:53,202] Trial 84 finished with value: -0.22101573354626777 and parameters: {'scalers': 'none', 'ratios': 'norm_ratio', 'imputers': 'median', 'n_estimators': 900, 'learning_rate': 0.2106813246318983, 'max_depth': 8, 'min_child_weight': 4, 'subsample': 0.5, 'colsample_bytree': 0.7, 'colsample_bylevel': 0.5, 'reg_alpha': 0.002632909662204712, 'reg_lambda': 0.020897793275477087, 'gamma': 0.0767793851517572}. Best is trial 47 with value: -0.32292470051545075.
[I 2026-07-14 16:54:58,943] Trial 85 finished with value: -0.19348711332332788 and parameters: {'scalers': 'none', 'ratios': 'norm_ratio', 'imputers': 'median', 'n_estimators': 900, 'learning_rate': 0.1043908514262302, 'max_depth': 8, 'min_child_weight': 4, 'subsample': 0.6, 'colsample_bytree': 0.7, 'colsample_bylevel': 0.5, 'reg_alpha': 0.0015804825457042147, 'reg_lambda': 0.0034467555565103553, 'gamma': 0.06973185405173993}. Best is trial 47 with value: -0.32292470051545075.
[I 2026-07-14 16:55:02,235] Trial 86 finished with value: -0.17929426608561602 and parameters: {'scalers': 'none', 'ratios': 'norm_ratio', 'imputers': 'median', 'n_estimators': 900, 'learning_rate': 0.21065494425172746, 'max_depth': 8, 'min_child_weight': 4, 'subsample': 0.6, 'colsample_bytree': 0.7, 'colsample_bylevel': 0.5, 'reg_alpha': 0.03990777269340754, 'reg_lambda': 0.003167786924106919, 'gamma': 0.23891628193208822}. Best is trial 47 with value: -0.32292470051545075.
[I 2026-07-14 16:55:05,897] Trial 87 finished with value: -0.1731138099306185 and parameters: {'scalers': 'none', 'ratios': 'norm_ratio', 'imputers': 'median', 'n_estimators': 900, 'learning_rate': 0.10892349183937208, 'max_depth': 8, 'min_child_weight': 4, 'subsample': 0.6, 'colsample_bytree': 0.7, 'colsample_bylevel': 0.5, 'reg_alpha': 0.04848802641062115, 'reg_lambda': 0.02042574391688797, 'gamma': 0.25223145045520157}. Best is trial 47 with value: -0.32292470051545075.
[I 2026-07-14 16:55:13,039] Trial 88 finished with value: -0.23123932232522804 and parameters: {'scalers': 'robust', 'ratios': 'norm_ratio', 'imputers': 'median', 'n_estimators': 900, 'learning_rate': 0.22794450217358844, 'max_depth': 8, 'min_child_weight': 4, 'subsample': 0.5, 'colsample_bytree': 0.9, 'colsample_bylevel': 0.5, 'reg_alpha': 0.05210251994567999, 'reg_lambda': 0.01794421158545579, 'gamma': 0.06250839250076387}. Best is trial 47 with value: -0.32292470051545075.
[I 2026-07-14 16:55:16,571] Trial 89 finished with value: -0.18182759154362785 and parameters: {'scalers': 'robust', 'ratios': 'norm_ratio', 'imputers': 'median', 'n_estimators': 900, 'learning_rate': 0.23399928190095956, 'max_depth': 8, 'min_child_weight': 4, 'subsample': 0.6, 'colsample_bytree': 0.7, 'colsample_bylevel': 0.5, 'reg_alpha': 0.007090597656795451, 'reg_lambda': 0.004693266773208892, 'gamma': 0.30060397050390697}. Best is trial 47 with value: -0.32292470051545075.
