[I 2026-07-14 21:14:47,342] Trial 315 finished with value: -0.29107675958072565 and parameters: {'scalers': 'none', 'ratios': 'log_ratio', 'imputers': 'median', 'n_estimators': 2650, 'learning_rate': 0.42399029640215813, 'max_depth': 10, 'min_child_weight': 1, 'subsample': 0.7, 'colsample_bytree': 0.8, 'colsample_bylevel': 0.5, 'reg_alpha': 0.35773423524778863, 'reg_lambda': 50.435103753270816, 'gamma': 7.4439282097054244e-06}. Best is trial 289 with value: -0.5004445421110786.
[I 2026-07-14 21:15:14,179] Trial 316 finished with value: -0.39823315568227924 and parameters: {'scalers': 'none', 'ratios': 'log_ratio', 'imputers': 'median', 'n_estimators': 2650, 'learning_rate': 0.4946274284820998, 'max_depth': 10, 'min_child_weight': 1, 'subsample': 0.7, 'colsample_bytree': 0.8, 'colsample_bylevel': 0.5, 'reg_alpha': 0.3571467363343672, 'reg_lambda': 49.378182980695804, 'gamma': 4.266693930812928e-05}. Best is trial 289 with value: -0.5004445421110786.
[I 2026-07-14 21:15:40,909] Trial 318 finished with value: -0.09604533189725742 and parameters: {'scalers': 'none', 'ratios': 'log_ratio', 'imputers': 'median', 'n_estimators': 2650, 'learning_rate': 0.49895728743863477, 'max_depth': 5, 'min_child_weight': 1, 'subsample': 0.7, 'colsample_bytree': 0.8, 'colsample_bylevel': 0.5, 'reg_alpha': 0.3568049442774951, 'reg_lambda': 4.057958664989596e-06, 'gamma': 4.322230001238317e-05}. Best is trial 289 with value: -0.5004445421110786.
[I 2026-07-14 21:15:42,165] Trial 317 finished with value: -0.43566150068196174 and parameters: {'scalers': 'none', 'ratios': 'log_ratio', 'imputers': 'median', 'n_estimators': 2850, 'learning_rate': 0.49936685453962987, 'max_depth': 10, 'min_child_weight': 1, 'subsample': 0.7, 'colsample_bytree': 0.8, 'colsample_bylevel': 0.5, 'reg_alpha': 0.35677003844847177, 'reg_lambda': 50.75643118846743, 'gamma': 7.264357826948977e-06}. Best is trial 289 with value: -0.5004445421110786.
[I 2026-07-14 21:15:51,871] Trial 319 finished with value: -0.11720150943989201 and parameters: {'scalers': 'none', 'ratios': 'log_ratio', 'imputers': 'median', 'n_estimators': 2650, 'learning_rate': 0.49971736943753864, 'max_depth': 5, 'min_child_weight': 1, 'subsample': 0.7, 'colsample_bytree': 0.8, 'colsample_bylevel': 0.5, 'reg_alpha': 0.3310147297366785, 'reg_lambda': 46.73265895538423, 'gamma': 4.1690755372363504e-05}. Best is trial 289 with value: -0.5004445421110786.
