[I 2026-07-14 16:51:51,793] A new study created in RDB with name: my-study
[I 2026-07-14 16:51:58,627] Trial 2 finished with value: -0.6726503840544859 and parameters: {'scalers': 'robust', 'ratios': 'log_ratio', 'imputers': 'mean', 'n_estimators': 550, 'learning_rate': 0.0021237900057752214, 'max_depth': 6, 'min_child_weight': 7, 'subsample': 1.0, 'colsample_bytree': 0.7, 'colsample_bylevel': 0.7, 'reg_alpha': 4.035649694431585, 'reg_lambda': 2.2148229505187036, 'gamma': 0.00258386985168799}. Best is trial 2 with value: -0.6726503840544859.
[I 2026-07-14 16:52:00,432] Trial 0 finished with value: -0.7862620994864525 and parameters: {'scalers': 'standard', 'ratios': 'norm_ratio', 'imputers': 'none', 'n_estimators': 150, 'learning_rate': 0.0001555539107692574, 'max_depth': 11, 'min_child_weight': 8, 'subsample': 0.5, 'colsample_bytree': 0.9, 'colsample_bylevel': 0.5, 'reg_alpha': 6.805426121092523e-05, 'reg_lambda': 0.0001745481670689322, 'gamma': 0.00017752405410489665}. Best is trial 0 with value: -0.7862620994864525.
[I 2026-07-14 16:52:14,451] Trial 1 finished with value: -0.6450394139900992 and parameters: {'scalers': 'none', 'ratios': 'norm_ratio', 'imputers': 'none', 'n_estimators': 1350, 'learning_rate': 0.0029427719292352064, 'max_depth': 8, 'min_child_weight': 9, 'subsample': 0.5, 'colsample_bytree': 0.8, 'colsample_bylevel': 1.0, 'reg_alpha': 0.22153837968878826, 'reg_lambda': 0.020654918537530795, 'gamma': 8.029043668499977e-06}. Best is trial 0 with value: -0.7862620994864525.
[I 2026-07-14 16:52:27,538] Trial 3 finished with value: -0.7224295586135979 and parameters: {'scalers': 'robust', 'ratios': 'norm_ratio', 'imputers': 'median', 'n_estimators': 600, 'learning_rate': 0.0986107043579526, 'max_depth': 11, 'min_child_weight': 7, 'subsample': 0.9, 'colsample_bytree': 1.0, 'colsample_bylevel': 1.0, 'reg_alpha': 0.005621115163974532, 'reg_lambda': 5.90682668937613e-06, 'gamma': 0.014605978730648684}. Best is trial 0 with value: -0.7862620994864525.
[I 2026-07-14 16:53:07,894] Trial 6 finished with value: -0.7241177911977966 and parameters: {'scalers': 'robust', 'ratios': 'log_ratio', 'imputers': 'median', 'n_estimators': 2350, 'learning_rate': 0.0125900381111396, 'max_depth': 11, 'min_child_weight': 9, 'subsample': 0.7, 'colsample_bytree': 1.0, 'colsample_bylevel': 0.7, 'reg_alpha': 4.128772718466422e-05, 'reg_lambda': 0.004814021453038122, 'gamma': 5.108112379240661e-06}. Best is trial 0 with value: -0.7862620994864525.
[I 2026-07-14 16:53:27,333] Trial 4 finished with value: -0.9377036953468479 and parameters: {'scalers': 'none', 'ratios': 'norm_ratio', 'imputers': 'none', 'n_estimators': 2300, 'learning_rate': 0.3037817116408137, 'max_depth': 8, 'min_child_weight': 3, 'subsample': 0.8, 'colsample_bytree': 1.0, 'colsample_bylevel': 0.5, 'reg_alpha': 0.0002475722925411556, 'reg_lambda': 5.028153588760236e-05, 'gamma': 0.0011508573422475863}. Best is trial 4 with value: -0.9377036953468479.
[I 2026-07-14 16:53:30,904] Trial 5 finished with value: -0.647547955034219 and parameters: {'scalers': 'standard', 'ratios': 'norm_ratio', 'imputers': 'mean', 'n_estimators': 800, 'learning_rate': 0.013264918525450016, 'max_depth': 8, 'min_child_weight': 5, 'subsample': 0.7, 'colsample_bytree': 0.9, 'colsample_bylevel': 0.6, 'reg_alpha': 0.00013362687674546643, 'reg_lambda': 6.498924433040173e-05, 'gamma': 0.8686579437119243}. Best is trial 4 with value: -0.9377036953468479.
[I 2026-07-14 16:53:39,233] Trial 7 finished with value: -0.6495309212435405 and parameters: {'scalers': 'standard', 'ratios': 'log_ratio', 'imputers': 'mean', 'n_estimators': 450, 'learning_rate': 0.005315109041432634, 'max_depth': 10, 'min_child_weight': 6, 'subsample': 1.0, 'colsample_bytree': 0.9, 'colsample_bylevel': 0.8, 'reg_alpha': 0.029634030091447217, 'reg_lambda': 3.0155582143233923e-06, 'gamma': 0.0003304720199931678}. Best is trial 4 with value: -0.9377036953468479.
[I 2026-07-14 16:53:51,328] Trial 8 finished with value: -0.6418093579064122 and parameters: {'scalers': 'robust', 'ratios': 'log_ratio', 'imputers': 'none', 'n_estimators': 2500, 'learning_rate': 0.0017757714780827973, 'max_depth': 5, 'min_child_weight': 7, 'subsample': 0.6, 'colsample_bytree': 0.6, 'colsample_bylevel': 1.0, 'reg_alpha': 2.6830788614999865, 'reg_lambda': 2.4145976979369185e-06, 'gamma': 0.021383713241794812}. Best is trial 4 with value: -0.9377036953468479.
[I 2026-07-14 16:53:52,772] Trial 9 finished with value: -0.6989478850435666 and parameters: {'scalers': 'robust', 'ratios': 'norm_ratio', 'imputers': 'none', 'n_estimators': 1100, 'learning_rate': 0.011065211896684822, 'max_depth': 3, 'min_child_weight': 4, 'subsample': 0.6, 'colsample_bytree': 0.5, 'colsample_bylevel': 1.0, 'reg_alpha': 65.085381568149, 'reg_lambda': 2.2480024628221225, 'gamma': 0.11483566953244723}. Best is trial 4 with value: -0.9377036953468479.
[I 2026-07-14 16:53:57,547] Trial 10 finished with value: -0.7582369122537692 and parameters: {'scalers': 'standard', 'ratios': 'norm_ratio', 'imputers': 'none', 'n_estimators': 1400, 'learning_rate': 0.00014490010513282394, 'max_depth': 10, 'min_child_weight': 2, 'subsample': 0.7, 'colsample_bytree': 0.5, 'colsample_bylevel': 0.9, 'reg_alpha': 0.0293151189758018, 'reg_lambda': 0.1108768605385555, 'gamma': 1.7352033667963045}. Best is trial 4 with value: -0.9377036953468479.
[I 2026-07-14 16:54:02,239] Trial 11 finished with value: -0.7429815201592713 and parameters: {'scalers': 'none', 'ratios': 'norm_ratio', 'imputers': 'none', 'n_estimators': 2400, 'learning_rate': 0.00020415712119586867, 'max_depth': 11, 'min_child_weight': 1, 'subsample': 0.7, 'colsample_bytree': 0.6, 'colsample_bylevel': 0.7, 'reg_alpha': 0.051187249532299646, 'reg_lambda': 0.7106051486770044, 'gamma': 10.88637758504097}. Best is trial 4 with value: -0.9377036953468479.
[I 2026-07-14 16:54:02,268] Trial 12 finished with value: -0.7867387216270115 and parameters: {'scalers': 'none', 'ratios': 'norm_ratio', 'imputers': 'none', 'n_estimators': 250, 'learning_rate': 0.00010320239925396747, 'max_depth': 9, 'min_child_weight': 10, 'subsample': 0.8, 'colsample_bytree': 0.6, 'colsample_bylevel': 0.6, 'reg_alpha': 0.0052345505096248225, 'reg_lambda': 0.0013771924098891343, 'gamma': 2.898340729134088}. Best is trial 4 with value: -0.9377036953468479.
[I 2026-07-14 16:54:06,421] Trial 13 finished with value: -0.7658569308576354 and parameters: {'scalers': 'robust', 'ratios': 'log_ratio', 'imputers': 'median', 'n_estimators': 2200, 'learning_rate': 0.0001272763309941361, 'max_depth': 10, 'min_child_weight': 1, 'subsample': 0.8, 'colsample_bytree': 0.5, 'colsample_bylevel': 0.8, 'reg_alpha': 1.6046948814643954e-05, 'reg_lambda': 2.8819515456871487, 'gamma': 22.87350180213296}. Best is trial 4 with value: -0.9377036953468479.
[I 2026-07-14 16:54:13,038] Trial 14 finished with value: -0.7748000716048843 and parameters: {'scalers': 'standard', 'ratios': 'norm_ratio', 'imputers': 'none', 'n_estimators': 600, 'learning_rate': 0.0001348222002116113, 'max_depth': 8, 'min_child_weight': 6, 'subsample': 0.8, 'colsample_bytree': 0.9, 'colsample_bylevel': 0.5, 'reg_alpha': 0.09867473106267313, 'reg_lambda': 1.4785357692974676e-05, 'gamma': 6.704513565121715e-05}. Best is trial 4 with value: -0.9377036953468479.
[I 2026-07-14 16:54:27,794] Trial 15 finished with value: -0.7519953035839382 and parameters: {'scalers': 'standard', 'ratios': 'norm_ratio', 'imputers': 'median', 'n_estimators': 1400, 'learning_rate': 0.12007647892654894, 'max_depth': 9, 'min_child_weight': 4, 'subsample': 1.0, 'colsample_bytree': 1.0, 'colsample_bylevel': 0.5, 'reg_alpha': 0.041602286059721785, 'reg_lambda': 0.0005140706629310059, 'gamma': 0.0006082487169509793}. Best is trial 4 with value: -0.9377036953468479.
[I 2026-07-14 16:54:34,127] Trial 16 finished with value: -0.6865991562402942 and parameters: {'scalers': 'standard', 'ratios': 'norm_ratio', 'imputers': 'median', 'n_estimators': 750, 'learning_rate': 0.0010918027570626478, 'max_depth': 7, 'min_child_weight': 6, 'subsample': 1.0, 'colsample_bytree': 0.8, 'colsample_bylevel': 0.5, 'reg_alpha': 0.0030146321927049095, 'reg_lambda': 0.5903952383415098, 'gamma': 0.00021220846758009218}. Best is trial 4 with value: -0.9377036953468479.
[I 2026-07-14 16:54:37,123] Trial 17 finished with value: -0.7510085089921509 and parameters: {'scalers': 'none', 'ratios': 'norm_ratio', 'imputers': 'none', 'n_estimators': 1850, 'learning_rate': 0.38825383694812166, 'max_depth': 3, 'min_child_weight': 1, 'subsample': 0.8, 'colsample_bytree': 0.5, 'colsample_bylevel': 0.5, 'reg_alpha': 1.0849813629794277e-06, 'reg_lambda': 24.743311266668215, 'gamma': 83.82491345205416}. Best is trial 4 with value: -0.9377036953468479.
[I 2026-07-14 16:55:02,252] Trial 18 finished with value: -0.9837126696494745 and parameters: {'scalers': 'none', 'ratios': 'norm_ratio', 'imputers': 'none', 'n_estimators': 2950, 'learning_rate': 0.2780733954741861, 'max_depth': 8, 'min_child_weight': 1, 'subsample': 0.8, 'colsample_bytree': 0.9, 'colsample_bylevel': 0.5, 'reg_alpha': 2.949381037172848e-06, 'reg_lambda': 0.0004943136451912252, 'gamma': 0.00032846018834837225}. Best is trial 18 with value: -0.9837126696494745.
[I 2026-07-14 16:55:05,325] Trial 19 finished with value: -0.7355762850453634 and parameters: {'scalers': 'none', 'ratios': 'norm_ratio', 'imputers': 'none', 'n_estimators': 1850, 'learning_rate': 0.2601337337938318, 'max_depth': 8, 'min_child_weight': 3, 'subsample': 0.8, 'colsample_bytree': 0.7, 'colsample_bylevel': 0.5, 'reg_alpha': 0.0009372164367102357, 'reg_lambda': 0.0006648892418855129, 'gamma': 55.52579750967538}. Best is trial 18 with value: -0.9837126696494745.
[I 2026-07-14 16:55:08,492] Trial 20 finished with value: -0.7472951667027413 and parameters: {'scalers': 'none', 'ratios': 'norm_ratio', 'imputers': 'none', 'n_estimators': 1900, 'learning_rate': 0.4434747395557652, 'max_depth': 8, 'min_child_weight': 3, 'subsample': 0.8, 'colsample_bytree': 0.7, 'colsample_bylevel': 0.5, 'reg_alpha': 2.3356064734960803e-06, 'reg_lambda': 76.42299790201079, 'gamma': 56.528976814106024}. Best is trial 18 with value: -0.9837126696494745.
[I 2026-07-14 16:55:29,273] Trial 21 finished with value: -0.905001789013373 and parameters: {'scalers': 'none', 'ratios': 'norm_ratio', 'imputers': 'none', 'n_estimators': 2950, 'learning_rate': 0.4883885661006619, 'max_depth': 8, 'min_child_weight': 10, 'subsample': 0.9, 'colsample_bytree': 0.7, 'colsample_bylevel': 0.5, 'reg_alpha': 0.0011918461244777797, 'reg_lambda': 0.0008457804284463736, 'gamma': 1.0341625774034141e-06}. Best is trial 18 with value: -0.9837126696494745.
[I 2026-07-14 16:55:34,467] Trial 22 finished with value: -0.7565903151061991 and parameters: {'scalers': 'none', 'ratios': 'norm_ratio', 'imputers': 'none', 'n_estimators': 2950, 'learning_rate': 0.3292502129504049, 'max_depth': 7, 'min_child_weight': 10, 'subsample': 0.9, 'colsample_bytree': 0.7, 'colsample_bylevel': 0.6, 'reg_alpha': 1.3581588228682565e-06, 'reg_lambda': 0.0020261100565004903, 'gamma': 85.24098583103317}. Best is trial 18 with value: -0.9837126696494745.
[I 2026-07-14 16:55:37,840] Trial 23 finished with value: -0.7468554775216963 and parameters: {'scalers': 'none', 'ratios': 'norm_ratio', 'imputers': 'none', 'n_estimators': 1900, 'learning_rate': 0.408252331502056, 'max_depth': 6, 'min_child_weight': 10, 'subsample': 0.9, 'colsample_bytree': 0.7, 'colsample_bylevel': 0.6, 'reg_alpha': 0.0008025564733329509, 'reg_lambda': 0.001658263219130915, 'gamma': 64.09790588221786}. Best is trial 18 with value: -0.9837126696494745.
[I 2026-07-14 16:55:42,617] Trial 24 finished with value: -0.6824674151980714 and parameters: {'scalers': 'none', 'ratios': 'norm_ratio', 'imputers': 'none', 'n_estimators': 1850, 'learning_rate': 0.37221634063199194, 'max_depth': 5, 'min_child_weight': 10, 'subsample': 0.8, 'colsample_bytree': 0.7, 'colsample_bylevel': 0.6, 'reg_alpha': 2.740054405196905e-06, 'reg_lambda': 0.0017495373135742892, 'gamma': 0.6882060788876998}. Best is trial 18 with value: -0.9837126696494745.
[I 2026-07-14 16:55:54,017] Trial 25 finished with value: -0.6579057809308301 and parameters: {'scalers': 'none', 'ratios': 'norm_ratio', 'imputers': 'none', 'n_estimators': 3000, 'learning_rate': 0.0005795052651653415, 'max_depth': 5, 'min_child_weight': 10, 'subsample': 0.9, 'colsample_bytree': 0.7, 'colsample_bylevel': 0.6, 'reg_alpha': 0.00042794002977007836, 'reg_lambda': 0.0020771971813153263, 'gamma': 0.24381856550759332}. Best is trial 18 with value: -0.9837126696494745.
[I 2026-07-14 16:56:06,747] Trial 26 finished with value: -0.8580347835975417 and parameters: {'scalers': 'none', 'ratios': 'norm_ratio', 'imputers': 'none', 'n_estimators': 2850, 'learning_rate': 0.4781995277671248, 'max_depth': 5, 'min_child_weight': 3, 'subsample': 0.9, 'colsample_bytree': 0.8, 'colsample_bylevel': 0.6, 'reg_alpha': 1.5451800140979928e-06, 'reg_lambda': 5.731533366060335e-05, 'gamma': 1.2380838064422191e-06}. Best is trial 18 with value: -0.9837126696494745.
[I 2026-07-14 16:56:19,870] Trial 27 finished with value: -0.6759258938784423 and parameters: {'scalers': 'none', 'ratios': 'norm_ratio', 'imputers': 'mean', 'n_estimators': 2900, 'learning_rate': 0.046633138129868815, 'max_depth': 5, 'min_child_weight': 3, 'subsample': 0.9, 'colsample_bytree': 0.8, 'colsample_bylevel': 0.6, 'reg_alpha': 1.1666205195807107e-06, 'reg_lambda': 5.085442442009943e-05, 'gamma': 2.2582863344821074e-05}. Best is trial 18 with value: -0.9837126696494745.
[I 2026-07-14 16:56:36,280] Trial 28 finished with value: -0.6901468921375509 and parameters: {'scalers': 'none', 'ratios': 'norm_ratio', 'imputers': 'none', 'n_estimators': 2900, 'learning_rate': 0.050683925836201536, 'max_depth': 6, 'min_child_weight': 10, 'subsample': 0.9, 'colsample_bytree': 0.8, 'colsample_bylevel': 0.6, 'reg_alpha': 0.0005572599016272152, 'reg_lambda': 0.002705865059880076, 'gamma': 0.004044154742541877}. Best is trial 18 with value: -0.9837126696494745.
[I 2026-07-14 16:56:53,493] Trial 29 finished with value: -0.7102021375827409 and parameters: {'scalers': 'none', 'ratios': 'norm_ratio', 'imputers': 'none', 'n_estimators': 3000, 'learning_rate': 0.059280980391321514, 'max_depth': 6, 'min_child_weight': 2, 'subsample': 0.9, 'colsample_bytree': 0.8, 'colsample_bylevel': 0.6, 'reg_alpha': 0.0002728617025261046, 'reg_lambda': 5.5256066244770636e-05, 'gamma': 1.3306072352662096e-06}. Best is trial 18 with value: -0.9837126696494745.
[I 2026-07-14 16:57:07,043] Trial 30 finished with value: -0.6975035997387488 and parameters: {'scalers': 'none', 'ratios': 'norm_ratio', 'imputers': 'none', 'n_estimators': 3000, 'learning_rate': 0.06601457439506281, 'max_depth': 5, 'min_child_weight': 2, 'subsample': 0.9, 'colsample_bytree': 0.8, 'colsample_bylevel': 0.6, 'reg_alpha': 0.0005223698670309043, 'reg_lambda': 3.327542208677152e-05, 'gamma': 1.8124774579883946e-06}. Best is trial 18 with value: -0.9837126696494745.
[I 2026-07-14 16:57:20,673] Trial 31 finished with value: -0.6997006061064596 and parameters: {'scalers': 'none', 'ratios': 'norm_ratio', 'imputers': 'mean', 'n_estimators': 3000, 'learning_rate': 0.06276084009199917, 'max_depth': 5, 'min_child_weight': 2, 'subsample': 0.9, 'colsample_bytree': 0.8, 'colsample_bylevel': 0.6, 'reg_alpha': 1.070129770329466e-05, 'reg_lambda': 3.267984591417476e-05, 'gamma': 2.226852856604759e-05}. Best is trial 18 with value: -0.9837126696494745.
[I 2026-07-14 16:57:54,214] Trial 32 finished with value: -0.7994709233579829 and parameters: {'scalers': 'none', 'ratios': 'norm_ratio', 'imputers': 'mean', 'n_estimators': 3000, 'learning_rate': 0.07609904103450263, 'max_depth': 9, 'min_child_weight': 2, 'subsample': 0.9, 'colsample_bytree': 0.8, 'colsample_bylevel': 0.6, 'reg_alpha': 0.0003566529537875507, 'reg_lambda': 5.9635923857674384e-05, 'gamma': 1.516255754541502e-06}. Best is trial 18 with value: -0.9837126696494745.
[I 2026-07-14 16:58:22,384] Trial 33 finished with value: -0.7830007973797048 and parameters: {'scalers': 'none', 'ratios': 'log_ratio', 'imputers': 'mean', 'n_estimators': 2700, 'learning_rate': 0.05916075817443239, 'max_depth': 9, 'min_child_weight': 2, 'subsample': 0.9, 'colsample_bytree': 0.8, 'colsample_bylevel': 0.5, 'reg_alpha': 0.00021002605766375846, 'reg_lambda': 3.42260573272398e-05, 'gamma': 2.1497835194115896e-06}. Best is trial 18 with value: -0.9837126696494745.
[I 2026-07-14 16:58:51,845] Trial 34 finished with value: -0.7594261151821633 and parameters: {'scalers': 'none', 'ratios': 'log_ratio', 'imputers': 'mean', 'n_estimators': 2650, 'learning_rate': 0.05723500598263758, 'max_depth': 9, 'min_child_weight': 2, 'subsample': 0.9, 'colsample_bytree': 1.0, 'colsample_bylevel': 0.5, 'reg_alpha': 1.3878470005947758e-05, 'reg_lambda': 0.01959508833372287, 'gamma': 3.0724184254857905e-05}. Best is trial 18 with value: -0.9837126696494745.
[I 2026-07-14 16:59:19,155] Trial 35 finished with value: -0.9271404572234163 and parameters: {'scalers': 'none', 'ratios': 'log_ratio', 'imputers': 'mean', 'n_estimators': 2650, 'learning_rate': 0.16298145168257136, 'max_depth': 9, 'min_child_weight': 2, 'subsample': 0.6, 'colsample_bytree': 1.0, 'colsample_bylevel': 0.5, 'reg_alpha': 2.066850962245949e-05, 'reg_lambda': 0.02191110472212274, 'gamma': 0.005123708094555451}. Best is trial 18 with value: -0.9837126696494745.
[I 2026-07-14 17:00:08,655] Trial 36 finished with value: -0.9874850505248748 and parameters: {'scalers': 'none', 'ratios': 'log_ratio', 'imputers': 'mean', 'n_estimators': 2650, 'learning_rate': 0.14024201674054873, 'max_depth': 12, 'min_child_weight': 2, 'subsample': 0.7, 'colsample_bytree': 1.0, 'colsample_bylevel': 0.5, 'reg_alpha': 9.89767438611985e-06, 'reg_lambda': 0.00019118119066076128, 'gamma': 1.1260937226902304e-06}. Best is trial 36 with value: -0.9874850505248748.
[I 2026-07-14 17:00:53,125] Trial 37 finished with value: -1.0642848732789432 and parameters: {'scalers': 'none', 'ratios': 'log_ratio', 'imputers': 'mean', 'n_estimators': 2600, 'learning_rate': 0.17747663516342937, 'max_depth': 12, 'min_child_weight': 2, 'subsample': 0.6, 'colsample_bytree': 0.9, 'colsample_bylevel': 0.5, 'reg_alpha': 1.0499815401925257e-05, 'reg_lambda': 0.00020259446554740415, 'gamma': 3.345597157312167e-05}. Best is trial 37 with value: -1.0642848732789432.
[I 2026-07-14 17:01:10,785] Trial 38 finished with value: -0.8143535878003881 and parameters: {'scalers': 'none', 'ratios': 'norm_ratio', 'imputers': 'none', 'n_estimators': 2650, 'learning_rate': 0.1736205634663521, 'max_depth': 7, 'min_child_weight': 4, 'subsample': 0.8, 'colsample_bytree': 0.9, 'colsample_bylevel': 0.5, 'reg_alpha': 1.1313896108026802e-05, 'reg_lambda': 0.00016606785431147133, 'gamma': 4.8223233853091374e-05}. Best is trial 37 with value: -1.0642848732789432.
[I 2026-07-14 17:01:28,778] Trial 39 finished with value: -0.814771121516535 and parameters: {'scalers': 'none', 'ratios': 'norm_ratio', 'imputers': 'none', 'n_estimators': 2650, 'learning_rate': 0.151647947650475, 'max_depth': 7, 'min_child_weight': 4, 'subsample': 0.8, 'colsample_bytree': 0.9, 'colsample_bylevel': 0.5, 'reg_alpha': 9.228283830963543e-06, 'reg_lambda': 0.00024413803949992717, 'gamma': 6.461739195728509e-05}. Best is trial 37 with value: -1.0642848732789432.
[I 2026-07-14 17:01:47,004] Trial 40 finished with value: -0.8434636824126839 and parameters: {'scalers': 'none', 'ratios': 'log_ratio', 'imputers': 'none', 'n_estimators': 2700, 'learning_rate': 0.18864240130455745, 'max_depth': 7, 'min_child_weight': 4, 'subsample': 0.8, 'colsample_bytree': 0.9, 'colsample_bylevel': 0.5, 'reg_alpha': 3.833312516817886e-05, 'reg_lambda': 0.011153731184026022, 'gamma': 0.0008043300479189561}. Best is trial 37 with value: -1.0642848732789432.
[I 2026-07-14 17:02:05,011] Trial 41 finished with value: -0.8364593395058874 and parameters: {'scalers': 'none', 'ratios': 'norm_ratio', 'imputers': 'none', 'n_estimators': 2700, 'learning_rate': 0.17706225205937764, 'max_depth': 7, 'min_child_weight': 4, 'subsample': 0.8, 'colsample_bytree': 0.9, 'colsample_bylevel': 0.5, 'reg_alpha': 3.01805328216895e-05, 'reg_lambda': 0.00975741072342117, 'gamma': 0.001408518788746407}. Best is trial 37 with value: -1.0642848732789432.
[I 2026-07-14 17:03:02,406] Trial 42 finished with value: -0.8072007051888823 and parameters: {'scalers': 'none', 'ratios': 'norm_ratio', 'imputers': 'none', 'n_estimators': 2700, 'learning_rate': 0.17680333658466163, 'max_depth': 12, 'min_child_weight': 8, 'subsample': 1.0, 'colsample_bytree': 0.9, 'colsample_bylevel': 0.7, 'reg_alpha': 4.716509589129256e-05, 'reg_lambda': 0.00022377841900447733, 'gamma': 0.001208620566468368}. Best is trial 37 with value: -1.0642848732789432.
[I 2026-07-14 17:03:02,452] Trial 43 finished with value: -0.843473092708556 and parameters: {'scalers': 'none', 'ratios': 'log_ratio', 'imputers': 'mean', 'n_estimators': 2100, 'learning_rate': 0.18858582376375246, 'max_depth': 7, 'min_child_weight': 8, 'subsample': 0.5, 'colsample_bytree': 0.9, 'colsample_bylevel': 0.5, 'reg_alpha': 5.1578807620990876e-05, 'reg_lambda': 0.012542883767771941, 'gamma': 0.0016467968196216746}. Best is trial 37 with value: -1.0642848732789432.
[I 2026-07-14 17:03:32,480] Trial 44 finished with value: -0.9809586714569701 and parameters: {'scalers': 'none', 'ratios': 'log_ratio', 'imputers': 'mean', 'n_estimators': 2150, 'learning_rate': 0.1704781199796016, 'max_depth': 12, 'min_child_weight': 4, 'subsample': 0.6, 'colsample_bytree': 0.9, 'colsample_bylevel': 0.5, 'reg_alpha': 3.3559862807548635e-05, 'reg_lambda': 0.00018524228190708322, 'gamma': 0.0015221340458277065}. Best is trial 37 with value: -1.0642848732789432.
