[I 2026-07-14 17:04:11,634] Trial 91 finished with value: -0.713658557144424 and parameters: {'scalers': 'robust', 'ratios': 'norm_ratio', 'imputers': 'median', 'n_estimators': 750, 'learning_rate': 0.02388044412164251, 'max_depth': 7, 'min_child_weight': 9, 'subsample': 0.6, 'colsample_bytree': 1.0, 'colsample_bylevel': 1.0, 'reg_alpha': 48.19022825650076, 'reg_lambda': 0.30633380675800903, 'gamma': 7.3108638550794325}. Best is trial 21 with value: -0.7913973345232271.
[I 2026-07-14 17:04:45,063] Trial 92 finished with value: -0.7027202721745062 and parameters: {'scalers': 'robust', 'ratios': 'norm_ratio', 'imputers': 'median', 'n_estimators': 3000, 'learning_rate': 0.018522444721015715, 'max_depth': 7, 'min_child_weight': 5, 'subsample': 0.6, 'colsample_bytree': 1.0, 'colsample_bylevel': 1.0, 'reg_alpha': 0.00017430940059965535, 'reg_lambda': 2.418660572767961, 'gamma': 0.0003586919799677538}. Best is trial 21 with value: -0.7913973345232271.
[I 2026-07-14 17:05:18,866] Trial 93 finished with value: -0.7370137873102581 and parameters: {'scalers': 'robust', 'ratios': 'norm_ratio', 'imputers': 'median', 'n_estimators': 2700, 'learning_rate': 0.045139565735992856, 'max_depth': 7, 'min_child_weight': 5, 'subsample': 0.6, 'colsample_bytree': 1.0, 'colsample_bylevel': 1.0, 'reg_alpha': 2.1643757352623028, 'reg_lambda': 0.0005551127470628496, 'gamma': 3.688843320214109e-05}. Best is trial 21 with value: -0.7913973345232271.
[I 2026-07-14 17:05:24,092] Trial 94 finished with value: -0.656081291740132 and parameters: {'scalers': 'robust', 'ratios': 'norm_ratio', 'imputers': 'median', 'n_estimators': 3000, 'learning_rate': 0.04445136715741315, 'max_depth': 7, 'min_child_weight': 5, 'subsample': 0.6, 'colsample_bytree': 1.0, 'colsample_bylevel': 1.0, 'reg_alpha': 0.007541432774993862, 'reg_lambda': 0.00028987124916945257, 'gamma': 6.225736816837128}. Best is trial 21 with value: -0.7913973345232271.
[I 2026-07-14 17:06:05,301] Trial 96 finished with value: -0.7659187678390467 and parameters: {'scalers': 'robust', 'ratios': 'norm_ratio', 'imputers': 'median', 'n_estimators': 750, 'learning_rate': 0.04984229437596658, 'max_depth': 10, 'min_child_weight': 5, 'subsample': 0.6, 'colsample_bytree': 0.7, 'colsample_bylevel': 1.0, 'reg_alpha': 0.012823079006113536, 'reg_lambda': 0.00028249617528294454, 'gamma': 69.83672727672142}. Best is trial 21 with value: -0.7913973345232271.
[I 2026-07-14 17:06:05,767] Trial 95 finished with value: -0.7706863604695706 and parameters: {'scalers': 'robust', 'ratios': 'norm_ratio', 'imputers': 'median', 'n_estimators': 3000, 'learning_rate': 0.04901237680939815, 'max_depth': 10, 'min_child_weight': 5, 'subsample': 0.6, 'colsample_bytree': 0.7, 'colsample_bylevel': 1.0, 'reg_alpha': 0.0076844155226709, 'reg_lambda': 0.000273023899870621, 'gamma': 1.2725417477900412e-06}. Best is trial 21 with value: -0.7913973345232271.
[I 2026-07-14 17:06:48,177] Trial 97 finished with value: -0.7803031436375608 and parameters: {'scalers': 'none', 'ratios': 'norm_ratio', 'imputers': 'mean', 'n_estimators': 2700, 'learning_rate': 0.04449038073138752, 'max_depth': 10, 'min_child_weight': 2, 'subsample': 0.6, 'colsample_bytree': 0.7, 'colsample_bylevel': 1.0, 'reg_alpha': 0.008560681986370364, 'reg_lambda': 0.0003529590994566904, 'gamma': 1.6489575225506026e-06}. Best is trial 21 with value: -0.7913973345232271.
[I 2026-07-14 17:06:48,279] Trial 98 finished with value: -0.7912727111294449 and parameters: {'scalers': 'none', 'ratios': 'norm_ratio', 'imputers': 'mean', 'n_estimators': 700, 'learning_rate': 0.012509807711863536, 'max_depth': 5, 'min_child_weight': 2, 'subsample': 0.9, 'colsample_bytree': 0.7, 'colsample_bylevel': 1.0, 'reg_alpha': 95.58461589253234, 'reg_lambda': 0.0004675517534801055, 'gamma': 72.90575867567873}. Best is trial 21 with value: -0.7913973345232271.
[I 2026-07-14 17:07:03,870] Trial 99 finished with value: -0.6539406552486964 and parameters: {'scalers': 'none', 'ratios': 'norm_ratio', 'imputers': 'mean', 'n_estimators': 2750, 'learning_rate': 0.013202668880743913, 'max_depth': 5, 'min_child_weight': 2, 'subsample': 0.9, 'colsample_bytree': 0.7, 'colsample_bylevel': 1.0, 'reg_alpha': 0.011651761859205401, 'reg_lambda': 0.0004035907666499651, 'gamma': 1.0324685960919506e-06}. Best is trial 21 with value: -0.7913973345232271.
[I 2026-07-14 17:07:07,627] Trial 100 finished with value: -0.7912745606279712 and parameters: {'scalers': 'none', 'ratios': 'norm_ratio', 'imputers': 'mean', 'n_estimators': 2050, 'learning_rate': 0.01386216993119474, 'max_depth': 4, 'min_child_weight': 2, 'subsample': 0.9, 'colsample_bytree': 0.7, 'colsample_bylevel': 1.0, 'reg_alpha': 90.57617367595456, 'reg_lambda': 0.0004928335568003999, 'gamma': 66.33360045046422}. Best is trial 21 with value: -0.7913973345232271.
[I 2026-07-14 17:07:11,757] Trial 101 finished with value: -0.7912615140979367 and parameters: {'scalers': 'none', 'ratios': 'norm_ratio', 'imputers': 'mean', 'n_estimators': 2250, 'learning_rate': 0.01341582397417069, 'max_depth': 5, 'min_child_weight': 2, 'subsample': 0.9, 'colsample_bytree': 0.7, 'colsample_bylevel': 1.0, 'reg_alpha': 96.15263282911518, 'reg_lambda': 0.0011085634675675879, 'gamma': 68.39147943873338}. Best is trial 21 with value: -0.7913973345232271.
[I 2026-07-14 17:07:15,987] Trial 102 finished with value: -0.7912902959364257 and parameters: {'scalers': 'none', 'ratios': 'norm_ratio', 'imputers': 'mean', 'n_estimators': 2300, 'learning_rate': 0.007551263507132243, 'max_depth': 4, 'min_child_weight': 2, 'subsample': 0.9, 'colsample_bytree': 0.7, 'colsample_bylevel': 1.0, 'reg_alpha': 91.01303725050488, 'reg_lambda': 0.0011135700668800362, 'gamma': 67.78641290311896}. Best is trial 21 with value: -0.7913973345232271.
[I 2026-07-14 17:07:20,421] Trial 103 finished with value: -0.7836759298208116 and parameters: {'scalers': 'none', 'ratios': 'norm_ratio', 'imputers': 'mean', 'n_estimators': 2400, 'learning_rate': 0.01270800385308005, 'max_depth': 5, 'min_child_weight': 2, 'subsample': 0.9, 'colsample_bytree': 0.7, 'colsample_bylevel': 1.0, 'reg_alpha': 96.35065411310916, 'reg_lambda': 0.0010866084450853368, 'gamma': 38.71960913908184}. Best is trial 21 with value: -0.7913973345232271.
[I 2026-07-14 17:07:24,285] Trial 104 finished with value: -0.7866876429337767 and parameters: {'scalers': 'none', 'ratios': 'norm_ratio', 'imputers': 'mean', 'n_estimators': 2050, 'learning_rate': 0.014071300267063973, 'max_depth': 9, 'min_child_weight': 2, 'subsample': 0.9, 'colsample_bytree': 0.8, 'colsample_bylevel': 1.0, 'reg_alpha': 99.06393406027885, 'reg_lambda': 0.001156160161599773, 'gamma': 39.590031105634374}. Best is trial 21 with value: -0.7913973345232271.
[I 2026-07-14 17:07:28,902] Trial 105 finished with value: -0.7913443240446167 and parameters: {'scalers': 'none', 'ratios': 'norm_ratio', 'imputers': 'mean', 'n_estimators': 2450, 'learning_rate': 0.013940641942180752, 'max_depth': 5, 'min_child_weight': 1, 'subsample': 0.9, 'colsample_bytree': 0.8, 'colsample_bylevel': 1.0, 'reg_alpha': 92.54345696894927, 'reg_lambda': 0.0010636587794704846, 'gamma': 67.99317628429156}. Best is trial 21 with value: -0.7913973345232271.
[I 2026-07-14 17:07:29,279] Trial 106 finished with value: -0.7540232426900398 and parameters: {'scalers': 'none', 'ratios': 'norm_ratio', 'imputers': 'mean', 'n_estimators': 450, 'learning_rate': 0.012891560063311632, 'max_depth': 4, 'min_child_weight': 1, 'subsample': 0.9, 'colsample_bytree': 0.5, 'colsample_bylevel': 1.0, 'reg_alpha': 6.927738976374636e-06, 'reg_lambda': 0.003771956718297714, 'gamma': 72.72447184650572}. Best is trial 21 with value: -0.7913973345232271.
[I 2026-07-14 17:07:30,138] Trial 107 finished with value: -0.7241672995941795 and parameters: {'scalers': 'none', 'ratios': 'norm_ratio', 'imputers': 'mean', 'n_estimators': 450, 'learning_rate': 0.007589453486838626, 'max_depth': 12, 'min_child_weight': 1, 'subsample': 0.9, 'colsample_bytree': 0.5, 'colsample_bylevel': 1.0, 'reg_alpha': 10.875491556414836, 'reg_lambda': 0.004278751902461197, 'gamma': 36.95315834232952}. Best is trial 21 with value: -0.7913973345232271.
[I 2026-07-14 17:07:30,977] Trial 108 finished with value: -0.791263182389611 and parameters: {'scalers': 'none', 'ratios': 'norm_ratio', 'imputers': 'mean', 'n_estimators': 450, 'learning_rate': 0.007452709578607575, 'max_depth': 5, 'min_child_weight': 1, 'subsample': 0.9, 'colsample_bytree': 0.7, 'colsample_bylevel': 1.0, 'reg_alpha': 99.73831630689882, 'reg_lambda': 0.0012412245539109017, 'gamma': 69.3490216926244}. Best is trial 21 with value: -0.7913973345232271.
[I 2026-07-14 17:07:35,012] Trial 109 finished with value: -0.7912600664158971 and parameters: {'scalers': 'none', 'ratios': 'norm_ratio', 'imputers': 'mean', 'n_estimators': 2250, 'learning_rate': 0.015277916252761588, 'max_depth': 3, 'min_child_weight': 2, 'subsample': 0.9, 'colsample_bytree': 0.7, 'colsample_bylevel': 1.0, 'reg_alpha': 91.18092786702827, 'reg_lambda': 0.001377491370145241, 'gamma': 72.68753371163788}. Best is trial 21 with value: -0.7913973345232271.
[I 2026-07-14 17:07:35,310] Trial 110 finished with value: -0.7795678981597662 and parameters: {'scalers': 'none', 'ratios': 'norm_ratio', 'imputers': 'mean', 'n_estimators': 250, 'learning_rate': 0.015999878390570356, 'max_depth': 4, 'min_child_weight': 2, 'subsample': 0.9, 'colsample_bytree': 0.7, 'colsample_bylevel': 1.0, 'reg_alpha': 93.97973954317823, 'reg_lambda': 0.004483568018037053, 'gamma': 37.075512572313365}. Best is trial 21 with value: -0.7913973345232271.
[I 2026-07-14 17:07:39,503] Trial 111 finished with value: -0.7691461040635535 and parameters: {'scalers': 'none', 'ratios': 'norm_ratio', 'imputers': 'mean', 'n_estimators': 2250, 'learning_rate': 0.007918277781104028, 'max_depth': 4, 'min_child_weight': 2, 'subsample': 0.9, 'colsample_bytree': 0.7, 'colsample_bylevel': 1.0, 'reg_alpha': 36.29037698558966, 'reg_lambda': 0.0014476154109014136, 'gamma': 63.52269708177328}. Best is trial 21 with value: -0.7913973345232271.
[I 2026-07-14 17:07:43,755] Trial 112 finished with value: -0.7500224597802491 and parameters: {'scalers': 'none', 'ratios': 'norm_ratio', 'imputers': 'mean', 'n_estimators': 2250, 'learning_rate': 0.0075873559112304, 'max_depth': 4, 'min_child_weight': 2, 'subsample': 0.9, 'colsample_bytree': 0.7, 'colsample_bylevel': 1.0, 'reg_alpha': 9.2454142304363e-06, 'reg_lambda': 0.0042797313889242, 'gamma': 69.04085466304348}. Best is trial 21 with value: -0.7913973345232271.
[I 2026-07-14 17:07:47,641] Trial 113 finished with value: -0.7767384422119928 and parameters: {'scalers': 'none', 'ratios': 'norm_ratio', 'imputers': 'mean', 'n_estimators': 2250, 'learning_rate': 0.007485052374644729, 'max_depth': 4, 'min_child_weight': 1, 'subsample': 0.9, 'colsample_bytree': 0.7, 'colsample_bylevel': 0.5, 'reg_alpha': 37.76440220612388, 'reg_lambda': 0.0005701771406084231, 'gamma': 67.57307579704423}. Best is trial 21 with value: -0.7913973345232271.
[I 2026-07-14 17:07:51,826] Trial 114 finished with value: -0.7747296255915421 and parameters: {'scalers': 'none', 'ratios': 'norm_ratio', 'imputers': 'mean', 'n_estimators': 2250, 'learning_rate': 0.007939092238408642, 'max_depth': 3, 'min_child_weight': 2, 'subsample': 0.9, 'colsample_bytree': 0.7, 'colsample_bylevel': 1.0, 'reg_alpha': 38.70252391482486, 'reg_lambda': 0.003751015413107643, 'gamma': 66.543049368784}. Best is trial 21 with value: -0.7913973345232271.
[I 2026-07-14 17:07:55,693] Trial 116 finished with value: -0.7746157065757827 and parameters: {'scalers': 'none', 'ratios': 'log_ratio', 'imputers': 'mean', 'n_estimators': 150, 'learning_rate': 0.007704484734945713, 'max_depth': 4, 'min_child_weight': 2, 'subsample': 0.9, 'colsample_bytree': 0.7, 'colsample_bylevel': 1.0, 'reg_alpha': 32.480598931532974, 'reg_lambda': 0.016959460397938695, 'gamma': 68.20641969562382}. Best is trial 21 with value: -0.7913973345232271.
[I 2026-07-14 17:07:55,861] Trial 115 finished with value: -0.7662298796450315 and parameters: {'scalers': 'none', 'ratios': 'log_ratio', 'imputers': 'mean', 'n_estimators': 2300, 'learning_rate': 0.027098695628255766, 'max_depth': 4, 'min_child_weight': 2, 'subsample': 0.9, 'colsample_bytree': 0.7, 'colsample_bylevel': 0.5, 'reg_alpha': 35.286940051547134, 'reg_lambda': 0.0005574796729815952, 'gamma': 63.47398830192653}. Best is trial 21 with value: -0.7913973345232271.
[I 2026-07-14 17:08:00,165] Trial 117 finished with value: -0.7722237739161566 and parameters: {'scalers': 'none', 'ratios': 'log_ratio', 'imputers': 'mean', 'n_estimators': 2300, 'learning_rate': 0.007951883795265029, 'max_depth': 4, 'min_child_weight': 2, 'subsample': 0.9, 'colsample_bytree': 0.7, 'colsample_bylevel': 1.0, 'reg_alpha': 36.44540992566228, 'reg_lambda': 0.01910996742611088, 'gamma': 66.089850086374}. Best is trial 21 with value: -0.7913973345232271.
[I 2026-07-14 17:08:04,386] Trial 118 finished with value: -0.7684011636141826 and parameters: {'scalers': 'none', 'ratios': 'norm_ratio', 'imputers': 'mean', 'n_estimators': 2250, 'learning_rate': 0.007173883339826939, 'max_depth': 4, 'min_child_weight': 2, 'subsample': 0.9, 'colsample_bytree': 0.7, 'colsample_bylevel': 1.0, 'reg_alpha': 36.61474858829398, 'reg_lambda': 0.0015040688647892787, 'gamma': 62.59743140057095}. Best is trial 21 with value: -0.7913973345232271.
[I 2026-07-14 17:08:08,686] Trial 119 finished with value: -0.7603016121099628 and parameters: {'scalers': 'none', 'ratios': 'log_ratio', 'imputers': 'mean', 'n_estimators': 2300, 'learning_rate': 0.026597125313900745, 'max_depth': 3, 'min_child_weight': 2, 'subsample': 0.9, 'colsample_bytree': 0.7, 'colsample_bylevel': 1.0, 'reg_alpha': 31.244207755541733, 'reg_lambda': 0.0004872822046442132, 'gamma': 58.99898758643699}. Best is trial 21 with value: -0.7913973345232271.
[I 2026-07-14 17:08:13,190] Trial 120 finished with value: -0.7133778136515154 and parameters: {'scalers': 'none', 'ratios': 'log_ratio', 'imputers': 'mean', 'n_estimators': 2400, 'learning_rate': 0.02764923517336464, 'max_depth': 3, 'min_child_weight': 1, 'subsample': 0.9, 'colsample_bytree': 0.7, 'colsample_bylevel': 1.0, 'reg_alpha': 31.840438034914055, 'reg_lambda': 0.00046992632050735456, 'gamma': 19.174394508843214}. Best is trial 21 with value: -0.7913973345232271.
[I 2026-07-14 17:08:17,635] Trial 121 finished with value: -0.7110761017920556 and parameters: {'scalers': 'none', 'ratios': 'log_ratio', 'imputers': 'mean', 'n_estimators': 2350, 'learning_rate': 0.026297083394876714, 'max_depth': 3, 'min_child_weight': 2, 'subsample': 0.9, 'colsample_bytree': 0.7, 'colsample_bylevel': 1.0, 'reg_alpha': 25.22264018078455, 'reg_lambda': 1.023616313458773e-06, 'gamma': 19.68366778153606}. Best is trial 21 with value: -0.7913973345232271.
[I 2026-07-14 17:08:22,591] Trial 122 finished with value: -0.7469182588882454 and parameters: {'scalers': 'none', 'ratios': 'log_ratio', 'imputers': 'mean', 'n_estimators': 2350, 'learning_rate': 0.00021529768549082004, 'max_depth': 5, 'min_child_weight': 3, 'subsample': 0.9, 'colsample_bytree': 0.7, 'colsample_bylevel': 1.0, 'reg_alpha': 69.56691344473002, 'reg_lambda': 0.0017205690368127097, 'gamma': 18.896682561677974}. Best is trial 21 with value: -0.7913973345232271.
[I 2026-07-14 17:08:27,311] Trial 123 finished with value: -0.7432145521970608 and parameters: {'scalers': 'none', 'ratios': 'norm_ratio', 'imputers': 'mean', 'n_estimators': 2400, 'learning_rate': 0.0005723561250221618, 'max_depth': 5, 'min_child_weight': 3, 'subsample': 0.9, 'colsample_bytree': 0.7, 'colsample_bylevel': 1.0, 'reg_alpha': 76.68874360039447, 'reg_lambda': 0.001703540847612319, 'gamma': 19.500116503346252}. Best is trial 21 with value: -0.7913973345232271.
[I 2026-07-14 17:08:31,791] Trial 124 finished with value: -0.7335087798576964 and parameters: {'scalers': 'none', 'ratios': 'norm_ratio', 'imputers': 'mean', 'n_estimators': 2400, 'learning_rate': 0.006551687375689195, 'max_depth': 5, 'min_child_weight': 3, 'subsample': 0.9, 'colsample_bytree': 0.7, 'colsample_bylevel': 1.0, 'reg_alpha': 65.59910696467102, 'reg_lambda': 0.0016284679753241329, 'gamma': 18.996698546046066}. Best is trial 21 with value: -0.7913973345232271.
[I 2026-07-14 17:08:36,251] Trial 125 finished with value: -0.736289519720695 and parameters: {'scalers': 'none', 'ratios': 'norm_ratio', 'imputers': 'mean', 'n_estimators': 2400, 'learning_rate': 0.015408986533834932, 'max_depth': 5, 'min_child_weight': 3, 'subsample': 0.9, 'colsample_bytree': 0.7, 'colsample_bylevel': 1.0, 'reg_alpha': 73.30091907153219, 'reg_lambda': 0.0017103602572509878, 'gamma': 17.921980590433947}. Best is trial 21 with value: -0.7913973345232271.
[I 2026-07-14 17:08:40,793] Trial 126 finished with value: -0.7378316276802643 and parameters: {'scalers': 'none', 'ratios': 'norm_ratio', 'imputers': 'mean', 'n_estimators': 2450, 'learning_rate': 0.01596501900606064, 'max_depth': 5, 'min_child_weight': 3, 'subsample': 0.9, 'colsample_bytree': 0.7, 'colsample_bylevel': 1.0, 'reg_alpha': 72.73281465430993, 'reg_lambda': 1.4018888538827603, 'gamma': 19.36318407490067}. Best is trial 21 with value: -0.7913973345232271.
[I 2026-07-14 17:08:45,275] Trial 127 finished with value: -0.7435014005882247 and parameters: {'scalers': 'none', 'ratios': 'norm_ratio', 'imputers': 'mean', 'n_estimators': 2400, 'learning_rate': 0.015441083148281617, 'max_depth': 5, 'min_child_weight': 3, 'subsample': 0.9, 'colsample_bytree': 0.7, 'colsample_bylevel': 1.0, 'reg_alpha': 74.23271390579434, 'reg_lambda': 0.000958930729781643, 'gamma': 22.166923266693722}. Best is trial 21 with value: -0.7913973345232271.
[I 2026-07-14 17:08:49,912] Trial 128 finished with value: -0.791199981500144 and parameters: {'scalers': 'none', 'ratios': 'norm_ratio', 'imputers': 'mean', 'n_estimators': 2450, 'learning_rate': 0.0003232252576347568, 'max_depth': 5, 'min_child_weight': 1, 'subsample': 0.9, 'colsample_bytree': 0.8, 'colsample_bylevel': 1.0, 'reg_alpha': 70.6619539966686, 'reg_lambda': 0.0009690836626494665, 'gamma': 94.7738215496496}. Best is trial 21 with value: -0.7913973345232271.
[I 2026-07-14 17:08:54,841] Trial 129 finished with value: -0.7734656275201359 and parameters: {'scalers': 'none', 'ratios': 'norm_ratio', 'imputers': 'mean', 'n_estimators': 2600, 'learning_rate': 0.011516928082452324, 'max_depth': 5, 'min_child_weight': 1, 'subsample': 0.9, 'colsample_bytree': 0.8, 'colsample_bylevel': 1.0, 'reg_alpha': 85.05024624682794, 'reg_lambda': 0.0008507512563798944, 'gamma': 38.73238838969535}. Best is trial 21 with value: -0.7913973345232271.
[I 2026-07-14 17:08:55,292] Trial 130 finished with value: -0.76024927347857 and parameters: {'scalers': 'none', 'ratios': 'norm_ratio', 'imputers': 'mean', 'n_estimators': 650, 'learning_rate': 0.006331182452310106, 'max_depth': 5, 'min_child_weight': 1, 'subsample': 0.9, 'colsample_bytree': 0.8, 'colsample_bylevel': 1.0, 'reg_alpha': 70.87893474880899, 'reg_lambda': 0.001012590509872017, 'gamma': 34.255303822842514}. Best is trial 21 with value: -0.7913973345232271.
[I 2026-07-14 17:08:56,432] Trial 131 finished with value: -0.7912752193127232 and parameters: {'scalers': 'none', 'ratios': 'norm_ratio', 'imputers': 'mean', 'n_estimators': 600, 'learning_rate': 0.005927580099315337, 'max_depth': 5, 'min_child_weight': 1, 'subsample': 0.9, 'colsample_bytree': 0.8, 'colsample_bylevel': 1.0, 'reg_alpha': 71.64466703478516, 'reg_lambda': 0.0009719390441075441, 'gamma': 98.2037509318883}. Best is trial 21 with value: -0.7913973345232271.
[I 2026-07-14 17:09:01,224] Trial 132 finished with value: -0.7910881359716996 and parameters: {'scalers': 'none', 'ratios': 'norm_ratio', 'imputers': 'mean', 'n_estimators': 2600, 'learning_rate': 0.002698609538188597, 'max_depth': 5, 'min_child_weight': 1, 'subsample': 1.0, 'colsample_bytree': 0.8, 'colsample_bylevel': 1.0, 'reg_alpha': 67.59450639586453, 'reg_lambda': 0.0009727200297749814, 'gamma': 99.47746874277236}. Best is trial 21 with value: -0.7913973345232271.
[I 2026-07-14 17:09:02,794] Trial 133 finished with value: -0.7263334301222533 and parameters: {'scalers': 'none', 'ratios': 'norm_ratio', 'imputers': 'mean', 'n_estimators': 800, 'learning_rate': 0.011120516518885803, 'max_depth': 5, 'min_child_weight': 1, 'subsample': 1.0, 'colsample_bytree': 0.8, 'colsample_bylevel': 1.0, 'reg_alpha': 21.21959124501148, 'reg_lambda': 0.0008785813795288096, 'gamma': 33.413729139498486}. Best is trial 21 with value: -0.7913973345232271.
[I 2026-07-14 17:09:07,622] Trial 134 finished with value: -0.7866002143834157 and parameters: {'scalers': 'none', 'ratios': 'norm_ratio', 'imputers': 'mean', 'n_estimators': 2600, 'learning_rate': 0.011823404229483737, 'max_depth': 5, 'min_child_weight': 1, 'subsample': 0.9, 'colsample_bytree': 0.8, 'colsample_bylevel': 1.0, 'reg_alpha': 12.400754748813554, 'reg_lambda': 0.0008777798345097922, 'gamma': 96.65539519902603}. Best is trial 21 with value: -0.7913973345232271.
[I 2026-07-14 17:09:12,684] Trial 135 finished with value: -0.7224976871018443 and parameters: {'scalers': 'none', 'ratios': 'norm_ratio', 'imputers': 'mean', 'n_estimators': 2600, 'learning_rate': 0.010884082668290723, 'max_depth': 5, 'min_child_weight': 1, 'subsample': 1.0, 'colsample_bytree': 0.8, 'colsample_bylevel': 1.0, 'reg_alpha': 10.907870876298615, 'reg_lambda': 0.0028369853800340717, 'gamma': 34.68506131657743}. Best is trial 21 with value: -0.7913973345232271.
[I 2026-07-14 17:09:13,945] Trial 136 finished with value: -0.7222359301523356 and parameters: {'scalers': 'none', 'ratios': 'norm_ratio', 'imputers': 'mean', 'n_estimators': 600, 'learning_rate': 0.01121083565157617, 'max_depth': 6, 'min_child_weight': 1, 'subsample': 1.0, 'colsample_bytree': 0.8, 'colsample_bylevel': 1.0, 'reg_alpha': 13.102735135217563, 'reg_lambda': 0.002398416685506448, 'gamma': 33.412418715760374}. Best is trial 21 with value: -0.7913973345232271.
