[I 2026-07-14 20:03:54,083] Trial 90 finished with value: -0.0562551204107456 and parameters: {'scalers': 'robust', 'ratios': 'log_ratio', 'imputers': 'none', 'n_estimators': 1400, 'learning_rate': 0.4783048270739342, 'max_depth': 8, 'min_child_weight': 2, 'subsample': 0.9, 'colsample_bytree': 0.8, 'colsample_bylevel': 0.7, 'reg_alpha': 0.0002497249050500363, 'reg_lambda': 0.14811940318347197, 'gamma': 0.03134273315268852}. Best is trial 59 with value: -0.07090409015218899.
[I 2026-07-14 20:04:02,522] Trial 91 finished with value: -0.055106997600600005 and parameters: {'scalers': 'robust', 'ratios': 'log_ratio', 'imputers': 'none', 'n_estimators': 1450, 'learning_rate': 0.4876058525500008, 'max_depth': 8, 'min_child_weight': 5, 'subsample': 0.9, 'colsample_bytree': 0.9, 'colsample_bylevel': 0.7, 'reg_alpha': 1.020382447572343e-05, 'reg_lambda': 0.20664278126221008, 'gamma': 0.02530736105190982}. Best is trial 59 with value: -0.07090409015218899.
[I 2026-07-14 20:04:12,969] Trial 92 finished with value: -0.050897770971573095 and parameters: {'scalers': 'robust', 'ratios': 'log_ratio', 'imputers': 'none', 'n_estimators': 1450, 'learning_rate': 0.4280482606949121, 'max_depth': 8, 'min_child_weight': 5, 'subsample': 0.9, 'colsample_bytree': 0.9, 'colsample_bylevel': 1.0, 'reg_alpha': 4.100469245780681e-06, 'reg_lambda': 0.15272776947726482, 'gamma': 0.02481994009412772}. Best is trial 59 with value: -0.07090409015218899.
[I 2026-07-14 20:04:16,203] Trial 93 finished with value: -0.025986940037534913 and parameters: {'scalers': 'robust', 'ratios': 'log_ratio', 'imputers': 'none', 'n_estimators': 2300, 'learning_rate': 0.0001051043986645883, 'max_depth': 12, 'min_child_weight': 1, 'subsample': 0.8, 'colsample_bytree': 0.9, 'colsample_bylevel': 1.0, 'reg_alpha': 0.00022369754388623636, 'reg_lambda': 0.10861089123076115, 'gamma': 1.7283673006259856}. Best is trial 59 with value: -0.07090409015218899.
[I 2026-07-14 20:04:33,689] Trial 94 finished with value: -0.1588569907036204 and parameters: {'scalers': 'robust', 'ratios': 'log_ratio', 'imputers': 'none', 'n_estimators': 1450, 'learning_rate': 0.49906961859763715, 'max_depth': 12, 'min_child_weight': 1, 'subsample': 0.8, 'colsample_bytree': 0.9, 'colsample_bylevel': 0.7, 'reg_alpha': 3.7430704649256573e-06, 'reg_lambda': 3.199630655493929, 'gamma': 0.039436991746204304}. Best is trial 94 with value: -0.1588569907036204.
[I 2026-07-14 20:04:47,324] Trial 95 finished with value: -0.06549762679158637 and parameters: {'scalers': 'robust', 'ratios': 'log_ratio', 'imputers': 'none', 'n_estimators': 1400, 'learning_rate': 0.25130645206437446, 'max_depth': 12, 'min_child_weight': 3, 'subsample': 0.8, 'colsample_bytree': 0.9, 'colsample_bylevel': 0.7, 'reg_alpha': 4.033912182418851e-06, 'reg_lambda': 0.004213758049053377, 'gamma': 0.020255308501264113}. Best is trial 94 with value: -0.1588569907036204.
[I 2026-07-14 20:05:07,175] Trial 96 finished with value: -0.025976999303905388 and parameters: {'scalers': 'robust', 'ratios': 'log_ratio', 'imputers': 'none', 'n_estimators': 1450, 'learning_rate': 0.00011950338603697029, 'max_depth': 12, 'min_child_weight': 3, 'subsample': 0.8, 'colsample_bytree': 0.8, 'colsample_bylevel': 1.0, 'reg_alpha': 0.004993164494113282, 'reg_lambda': 0.004133516594816965, 'gamma': 0.0030856662395192967}. Best is trial 94 with value: -0.1588569907036204.
[I 2026-07-14 20:05:29,548] Trial 97 finished with value: -0.08682839429775509 and parameters: {'scalers': 'robust', 'ratios': 'log_ratio', 'imputers': 'none', 'n_estimators': 2250, 'learning_rate': 0.25622602678583856, 'max_depth': 12, 'min_child_weight': 1, 'subsample': 0.8, 'colsample_bytree': 0.8, 'colsample_bylevel': 0.9, 'reg_alpha': 0.004298944868593177, 'reg_lambda': 0.0036027334172565218, 'gamma': 0.018527239824389332}. Best is trial 94 with value: -0.1588569907036204.
[I 2026-07-14 20:05:44,358] Trial 98 finished with value: -0.07985206432665548 and parameters: {'scalers': 'robust', 'ratios': 'log_ratio', 'imputers': 'none', 'n_estimators': 1650, 'learning_rate': 0.24606015789262728, 'max_depth': 12, 'min_child_weight': 1, 'subsample': 0.8, 'colsample_bytree': 0.8, 'colsample_bylevel': 0.8, 'reg_alpha': 1.0670250767897434e-05, 'reg_lambda': 0.004069057994650335, 'gamma': 0.03446138199382329}. Best is trial 94 with value: -0.1588569907036204.
[I 2026-07-14 20:06:05,032] Trial 99 finished with value: -0.08912784395217038 and parameters: {'scalers': 'robust', 'ratios': 'log_ratio', 'imputers': 'none', 'n_estimators': 2300, 'learning_rate': 0.2576687006794234, 'max_depth': 12, 'min_child_weight': 1, 'subsample': 0.8, 'colsample_bytree': 0.8, 'colsample_bylevel': 0.8, 'reg_alpha': 1.8506718875672547e-06, 'reg_lambda': 0.031237890588355677, 'gamma': 0.006010177100447236}. Best is trial 94 with value: -0.1588569907036204.
[I 2026-07-14 20:06:20,749] Trial 100 finished with value: -0.07226286943514944 and parameters: {'scalers': 'robust', 'ratios': 'log_ratio', 'imputers': 'none', 'n_estimators': 1650, 'learning_rate': 0.18133899920305466, 'max_depth': 12, 'min_child_weight': 1, 'subsample': 0.8, 'colsample_bytree': 0.8, 'colsample_bylevel': 0.8, 'reg_alpha': 1.6494285161720635e-06, 'reg_lambda': 0.028489480869595633, 'gamma': 0.0033333614232531434}. Best is trial 94 with value: -0.1588569907036204.
[I 2026-07-14 20:06:21,824] Trial 101 finished with value: -0.02438978049912298 and parameters: {'scalers': 'robust', 'ratios': 'log_ratio', 'imputers': 'none', 'n_estimators': 1650, 'learning_rate': 0.2425658167722438, 'max_depth': 12, 'min_child_weight': 1, 'subsample': 0.6, 'colsample_bytree': 0.8, 'colsample_bylevel': 0.8, 'reg_alpha': 0.004957258411406929, 'reg_lambda': 0.004768510932514229, 'gamma': 0.7193129109618347}. Best is trial 94 with value: -0.1588569907036204.
[I 2026-07-14 20:06:39,959] Trial 102 finished with value: -0.10238336281944246 and parameters: {'scalers': 'robust', 'ratios': 'log_ratio', 'imputers': 'none', 'n_estimators': 1850, 'learning_rate': 0.22371748154339716, 'max_depth': 12, 'min_child_weight': 1, 'subsample': 0.8, 'colsample_bytree': 0.8, 'colsample_bylevel': 0.7, 'reg_alpha': 2.0451285811923874e-06, 'reg_lambda': 1.241527103657498, 'gamma': 0.004739194186616261}. Best is trial 94 with value: -0.1588569907036204.
[I 2026-07-14 20:06:56,964] Trial 103 finished with value: -0.10728240836677884 and parameters: {'scalers': 'robust', 'ratios': 'log_ratio', 'imputers': 'none', 'n_estimators': 1650, 'learning_rate': 0.24632159576404236, 'max_depth': 12, 'min_child_weight': 1, 'subsample': 0.8, 'colsample_bytree': 0.8, 'colsample_bylevel': 0.7, 'reg_alpha': 1.6662773747032268e-06, 'reg_lambda': 1.8454014626970492, 'gamma': 4.069231357071146e-05}. Best is trial 94 with value: -0.1588569907036204.
[I 2026-07-14 20:06:58,696] Trial 104 finished with value: -0.024095302782620818 and parameters: {'scalers': 'robust', 'ratios': 'log_ratio', 'imputers': 'none', 'n_estimators': 1850, 'learning_rate': 0.25187406935959405, 'max_depth': 12, 'min_child_weight': 1, 'subsample': 0.6, 'colsample_bytree': 0.8, 'colsample_bylevel': 0.7, 'reg_alpha': 1.834913278360072e-06, 'reg_lambda': 3.0417204183924222, 'gamma': 0.6667971087278103}. Best is trial 94 with value: -0.1588569907036204.
[I 2026-07-14 20:07:33,136] Trial 105 finished with value: -0.12944240941102625 and parameters: {'scalers': 'robust', 'ratios': 'log_ratio', 'imputers': 'none', 'n_estimators': 2700, 'learning_rate': 0.2487213448389632, 'max_depth': 12, 'min_child_weight': 1, 'subsample': 0.8, 'colsample_bytree': 0.8, 'colsample_bylevel': 0.9, 'reg_alpha': 1.8772377324219654e-06, 'reg_lambda': 2.777773424279518, 'gamma': 0.005129981791811919}. Best is trial 94 with value: -0.1588569907036204.
[I 2026-07-14 20:08:02,937] Trial 106 finished with value: -0.10773240439288453 and parameters: {'scalers': 'robust', 'ratios': 'log_ratio', 'imputers': 'none', 'n_estimators': 2650, 'learning_rate': 0.228996647489916, 'max_depth': 12, 'min_child_weight': 1, 'subsample': 0.8, 'colsample_bytree': 0.8, 'colsample_bylevel': 0.9, 'reg_alpha': 7.193654535535298e-05, 'reg_lambda': 1.2028984992497098, 'gamma': 0.005528858541961333}. Best is trial 94 with value: -0.1588569907036204.
[I 2026-07-14 20:08:25,474] Trial 107 finished with value: -0.0857277575855617 and parameters: {'scalers': 'robust', 'ratios': 'log_ratio', 'imputers': 'none', 'n_estimators': 2300, 'learning_rate': 0.23097155244086964, 'max_depth': 12, 'min_child_weight': 1, 'subsample': 0.8, 'colsample_bytree': 0.8, 'colsample_bylevel': 0.9, 'reg_alpha': 2.2072427996747818e-06, 'reg_lambda': 0.031073504102579294, 'gamma': 0.0043025066971353}. Best is trial 94 with value: -0.1588569907036204.
[I 2026-07-14 20:08:41,898] Trial 108 finished with value: -0.08057814243607037 and parameters: {'scalers': 'robust', 'ratios': 'log_ratio', 'imputers': 'none', 'n_estimators': 1650, 'learning_rate': 0.24934322478532067, 'max_depth': 12, 'min_child_weight': 1, 'subsample': 0.8, 'colsample_bytree': 0.8, 'colsample_bylevel': 0.9, 'reg_alpha': 2.1891364324507295e-06, 'reg_lambda': 0.02846934456590787, 'gamma': 0.007902133053713086}. Best is trial 94 with value: -0.1588569907036204.
[I 2026-07-14 20:09:08,622] Trial 109 finished with value: -0.08000183888731467 and parameters: {'scalers': 'robust', 'ratios': 'log_ratio', 'imputers': 'none', 'n_estimators': 2750, 'learning_rate': 0.1781177687246545, 'max_depth': 12, 'min_child_weight': 1, 'subsample': 0.8, 'colsample_bytree': 0.8, 'colsample_bylevel': 0.9, 'reg_alpha': 1.9762326502625233e-06, 'reg_lambda': 0.02605368350777821, 'gamma': 0.006355161251252127}. Best is trial 94 with value: -0.1588569907036204.
[I 2026-07-14 20:09:31,017] Trial 110 finished with value: -0.08062477160214658 and parameters: {'scalers': 'robust', 'ratios': 'log_ratio', 'imputers': 'none', 'n_estimators': 2300, 'learning_rate': 0.19284534875385462, 'max_depth': 12, 'min_child_weight': 1, 'subsample': 0.8, 'colsample_bytree': 0.8, 'colsample_bylevel': 0.9, 'reg_alpha': 1.7466028736943837e-06, 'reg_lambda': 0.030532650836888126, 'gamma': 0.004811129039225857}. Best is trial 94 with value: -0.1588569907036204.
[I 2026-07-14 20:10:02,026] Trial 111 finished with value: -0.11544678098479591 and parameters: {'scalers': 'robust', 'ratios': 'log_ratio', 'imputers': 'none', 'n_estimators': 2700, 'learning_rate': 0.16928700745687567, 'max_depth': 12, 'min_child_weight': 1, 'subsample': 0.8, 'colsample_bytree': 0.8, 'colsample_bylevel': 0.8, 'reg_alpha': 1.994572808819767e-06, 'reg_lambda': 3.189818760820087, 'gamma': 0.005497463246790945}. Best is trial 94 with value: -0.1588569907036204.
[I 2026-07-14 20:10:30,928] Trial 112 finished with value: -0.09647223275981973 and parameters: {'scalers': 'robust', 'ratios': 'log_ratio', 'imputers': 'none', 'n_estimators': 2600, 'learning_rate': 0.1653075977027623, 'max_depth': 12, 'min_child_weight': 1, 'subsample': 0.8, 'colsample_bytree': 0.8, 'colsample_bylevel': 0.9, 'reg_alpha': 0.0016428357703617124, 'reg_lambda': 1.1057133851652348, 'gamma': 0.006733777727949747}. Best is trial 94 with value: -0.1588569907036204.
[I 2026-07-14 20:11:05,642] Trial 113 finished with value: -0.12159906656025399 and parameters: {'scalers': 'robust', 'ratios': 'log_ratio', 'imputers': 'none', 'n_estimators': 2600, 'learning_rate': 0.1646497197761862, 'max_depth': 12, 'min_child_weight': 1, 'subsample': 0.8, 'colsample_bytree': 0.8, 'colsample_bylevel': 0.9, 'reg_alpha': 2.3734843741809145e-06, 'reg_lambda': 8.401234983322341, 'gamma': 0.0040714268544217655}. Best is trial 94 with value: -0.1588569907036204.
[I 2026-07-14 20:11:35,397] Trial 114 finished with value: -0.09653030817545458 and parameters: {'scalers': 'robust', 'ratios': 'log_ratio', 'imputers': 'none', 'n_estimators': 2650, 'learning_rate': 0.1707600400752796, 'max_depth': 12, 'min_child_weight': 1, 'subsample': 0.8, 'colsample_bytree': 0.8, 'colsample_bylevel': 0.9, 'reg_alpha': 2.461766861027524e-06, 'reg_lambda': 1.323190719837983, 'gamma': 0.004811685381648491}. Best is trial 94 with value: -0.1588569907036204.
[I 2026-07-14 20:12:04,910] Trial 115 finished with value: -0.09764313290010151 and parameters: {'scalers': 'robust', 'ratios': 'log_ratio', 'imputers': 'none', 'n_estimators': 2650, 'learning_rate': 0.17044172352962003, 'max_depth': 12, 'min_child_weight': 1, 'subsample': 0.8, 'colsample_bytree': 0.8, 'colsample_bylevel': 0.9, 'reg_alpha': 2.271700136827849e-06, 'reg_lambda': 1.1609580608071495, 'gamma': 0.004745497955499366}. Best is trial 94 with value: -0.1588569907036204.
[I 2026-07-14 20:12:34,113] Trial 116 finished with value: -0.09399726056899829 and parameters: {'scalers': 'robust', 'ratios': 'log_ratio', 'imputers': 'none', 'n_estimators': 2800, 'learning_rate': 0.1733907368150022, 'max_depth': 12, 'min_child_weight': 1, 'subsample': 0.8, 'colsample_bytree': 0.8, 'colsample_bylevel': 0.9, 'reg_alpha': 2.2708376767659963e-06, 'reg_lambda': 0.8170571299087679, 'gamma': 0.00518309278614693}. Best is trial 94 with value: -0.1588569907036204.
[I 2026-07-14 20:13:04,323] Trial 117 finished with value: -0.09749409102156067 and parameters: {'scalers': 'robust', 'ratios': 'log_ratio', 'imputers': 'none', 'n_estimators': 2700, 'learning_rate': 0.18086305621043947, 'max_depth': 12, 'min_child_weight': 1, 'subsample': 0.8, 'colsample_bytree': 0.8, 'colsample_bylevel': 0.9, 'reg_alpha': 2.440871229483011e-06, 'reg_lambda': 1.2230022924921504, 'gamma': 0.0047024177564727295}. Best is trial 94 with value: -0.1588569907036204.
[I 2026-07-14 20:13:34,371] Trial 118 finished with value: -0.09878027150768565 and parameters: {'scalers': 'robust', 'ratios': 'log_ratio', 'imputers': 'none', 'n_estimators': 2700, 'learning_rate': 0.17742611155544108, 'max_depth': 12, 'min_child_weight': 1, 'subsample': 0.8, 'colsample_bytree': 0.8, 'colsample_bylevel': 0.9, 'reg_alpha': 2.1655845547473187e-06, 'reg_lambda': 1.2197578360707326, 'gamma': 0.005095299653757371}. Best is trial 94 with value: -0.1588569907036204.
[I 2026-07-14 20:14:03,913] Trial 119 finished with value: -0.09786615455431598 and parameters: {'scalers': 'robust', 'ratios': 'log_ratio', 'imputers': 'none', 'n_estimators': 2650, 'learning_rate': 0.1825814294831737, 'max_depth': 12, 'min_child_weight': 1, 'subsample': 0.8, 'colsample_bytree': 0.8, 'colsample_bylevel': 0.9, 'reg_alpha': 2.5874760744991167e-06, 'reg_lambda': 1.1890569951098864, 'gamma': 0.0016809320618639833}. Best is trial 94 with value: -0.1588569907036204.
[I 2026-07-14 20:14:33,700] Trial 120 finished with value: -0.10728545340420603 and parameters: {'scalers': 'robust', 'ratios': 'log_ratio', 'imputers': 'none', 'n_estimators': 2650, 'learning_rate': 0.21151887430724078, 'max_depth': 12, 'min_child_weight': 1, 'subsample': 0.8, 'colsample_bytree': 0.8, 'colsample_bylevel': 0.9, 'reg_alpha': 0.00044434788002883474, 'reg_lambda': 1.4484453901536398, 'gamma': 0.0013641341951106552}. Best is trial 94 with value: -0.1588569907036204.
[I 2026-07-14 20:15:02,347] Trial 121 finished with value: -0.07163418534387166 and parameters: {'scalers': 'robust', 'ratios': 'log_ratio', 'imputers': 'none', 'n_estimators': 2600, 'learning_rate': 0.08478302516737647, 'max_depth': 12, 'min_child_weight': 1, 'subsample': 0.8, 'colsample_bytree': 0.8, 'colsample_bylevel': 0.9, 'reg_alpha': 0.0026380746628574723, 'reg_lambda': 1.086180528589458, 'gamma': 0.010396442733308317}. Best is trial 94 with value: -0.1588569907036204.
[I 2026-07-14 20:15:31,866] Trial 122 finished with value: -0.09825281559198731 and parameters: {'scalers': 'robust', 'ratios': 'log_ratio', 'imputers': 'none', 'n_estimators': 2600, 'learning_rate': 0.1756435102433311, 'max_depth': 12, 'min_child_weight': 1, 'subsample': 0.8, 'colsample_bytree': 0.8, 'colsample_bylevel': 0.9, 'reg_alpha': 0.0005174452854660387, 'reg_lambda': 1.1437076616209845, 'gamma': 0.0016674340535002502}. Best is trial 94 with value: -0.1588569907036204.
[I 2026-07-14 20:16:00,600] Trial 123 finished with value: -0.07226563576624871 and parameters: {'scalers': 'robust', 'ratios': 'log_ratio', 'imputers': 'none', 'n_estimators': 2650, 'learning_rate': 0.08606978113704927, 'max_depth': 12, 'min_child_weight': 1, 'subsample': 0.8, 'colsample_bytree': 0.8, 'colsample_bylevel': 0.9, 'reg_alpha': 0.002740804988316762, 'reg_lambda': 1.1239980038167903, 'gamma': 0.001231429063065088}. Best is trial 94 with value: -0.1588569907036204.
[I 2026-07-14 20:16:29,355] Trial 124 finished with value: -0.0732258374781474 and parameters: {'scalers': 'robust', 'ratios': 'log_ratio', 'imputers': 'none', 'n_estimators': 2600, 'learning_rate': 0.07704428661606305, 'max_depth': 12, 'min_child_weight': 1, 'subsample': 0.8, 'colsample_bytree': 0.8, 'colsample_bylevel': 0.9, 'reg_alpha': 0.0004916811617068338, 'reg_lambda': 1.7311277320574383, 'gamma': 0.0018081096643581978}. Best is trial 94 with value: -0.1588569907036204.
[I 2026-07-14 20:16:57,652] Trial 125 finished with value: -0.09536392650656908 and parameters: {'scalers': 'robust', 'ratios': 'log_ratio', 'imputers': 'none', 'n_estimators': 2600, 'learning_rate': 0.16758512722006655, 'max_depth': 12, 'min_child_weight': 1, 'subsample': 0.8, 'colsample_bytree': 0.8, 'colsample_bylevel': 0.9, 'reg_alpha': 5.037972564437134e-06, 'reg_lambda': 1.2090524830136167, 'gamma': 0.0013659160132237175}. Best is trial 94 with value: -0.1588569907036204.
[I 2026-07-14 20:17:25,770] Trial 126 finished with value: -0.07026944859615784 and parameters: {'scalers': 'robust', 'ratios': 'log_ratio', 'imputers': 'none', 'n_estimators': 2550, 'learning_rate': 0.08293040418520926, 'max_depth': 12, 'min_child_weight': 1, 'subsample': 0.8, 'colsample_bytree': 0.8, 'colsample_bylevel': 0.9, 'reg_alpha': 2.9186378328330636e-06, 'reg_lambda': 1.1152204650571542, 'gamma': 0.001412893532595621}. Best is trial 94 with value: -0.1588569907036204.
[I 2026-07-14 20:17:58,136] Trial 127 finished with value: -0.07239143198485304 and parameters: {'scalers': 'robust', 'ratios': 'log_ratio', 'imputers': 'none', 'n_estimators': 3000, 'learning_rate': 0.07614637139976584, 'max_depth': 12, 'min_child_weight': 1, 'subsample': 0.8, 'colsample_bytree': 0.8, 'colsample_bylevel': 0.9, 'reg_alpha': 2.921415886934466e-06, 'reg_lambda': 1.4840027838801688, 'gamma': 0.0016723786336409418}. Best is trial 94 with value: -0.1588569907036204.
[I 2026-07-14 20:18:31,814] Trial 128 finished with value: -0.10934179279282033 and parameters: {'scalers': 'robust', 'ratios': 'log_ratio', 'imputers': 'none', 'n_estimators': 3000, 'learning_rate': 0.20463480279244706, 'max_depth': 12, 'min_child_weight': 1, 'subsample': 0.8, 'colsample_bytree': 0.8, 'colsample_bylevel': 0.9, 'reg_alpha': 0.0006961676755304011, 'reg_lambda': 1.495369225320059, 'gamma': 0.0017953887394132288}. Best is trial 94 with value: -0.1588569907036204.
[I 2026-07-14 20:19:05,209] Trial 129 finished with value: -0.11246459729232852 and parameters: {'scalers': 'robust', 'ratios': 'log_ratio', 'imputers': 'none', 'n_estimators': 3000, 'learning_rate': 0.20654512014092152, 'max_depth': 12, 'min_child_weight': 1, 'subsample': 0.8, 'colsample_bytree': 0.8, 'colsample_bylevel': 0.9, 'reg_alpha': 0.0005023916433646937, 'reg_lambda': 1.625067801496021, 'gamma': 0.0024096012129984573}. Best is trial 94 with value: -0.1588569907036204.
[I 2026-07-14 20:19:39,642] Trial 130 finished with value: -0.09965661097362219 and parameters: {'scalers': 'robust', 'ratios': 'log_ratio', 'imputers': 'none', 'n_estimators': 2950, 'learning_rate': 0.11545145823693377, 'max_depth': 12, 'min_child_weight': 1, 'subsample': 0.8, 'colsample_bytree': 0.8, 'colsample_bylevel': 0.9, 'reg_alpha': 0.0009467367311542338, 'reg_lambda': 3.884147927833487, 'gamma': 0.001653918746596828}. Best is trial 94 with value: -0.1588569907036204.
[I 2026-07-14 20:20:16,024] Trial 131 finished with value: -0.10747026690161737 and parameters: {'scalers': 'robust', 'ratios': 'log_ratio', 'imputers': 'none', 'n_estimators': 3000, 'learning_rate': 0.11634034199865434, 'max_depth': 12, 'min_child_weight': 1, 'subsample': 0.8, 'colsample_bytree': 0.8, 'colsample_bylevel': 0.9, 'reg_alpha': 0.00034214859457285294, 'reg_lambda': 9.099120637280736, 'gamma': 0.0020445489900014504}. Best is trial 94 with value: -0.1588569907036204.
[I 2026-07-14 20:20:56,817] Trial 132 finished with value: -0.13688416160438846 and parameters: {'scalers': 'robust', 'ratios': 'log_ratio', 'imputers': 'none', 'n_estimators': 2900, 'learning_rate': 0.2036340245946519, 'max_depth': 12, 'min_child_weight': 1, 'subsample': 0.8, 'colsample_bytree': 0.8, 'colsample_bylevel': 0.9, 'reg_alpha': 0.0008775153752183117, 'reg_lambda': 8.395640649403369, 'gamma': 0.0022609736841836476}. Best is trial 94 with value: -0.1588569907036204.
[I 2026-07-14 20:21:33,470] Trial 133 finished with value: -0.10787568810513339 and parameters: {'scalers': 'robust', 'ratios': 'log_ratio', 'imputers': 'none', 'n_estimators': 3000, 'learning_rate': 0.1167371419410213, 'max_depth': 12, 'min_child_weight': 1, 'subsample': 0.8, 'colsample_bytree': 0.8, 'colsample_bylevel': 0.9, 'reg_alpha': 0.0007378293707259436, 'reg_lambda': 9.078302956821034, 'gamma': 0.0023175682050968686}. Best is trial 94 with value: -0.1588569907036204.
[I 2026-07-14 20:22:05,704] Trial 134 finished with value: -0.1091022620346254 and parameters: {'scalers': 'robust', 'ratios': 'log_ratio', 'imputers': 'none', 'n_estimators': 3000, 'learning_rate': 0.11523357996472489, 'max_depth': 12, 'min_child_weight': 1, 'subsample': 0.8, 'colsample_bytree': 0.7, 'colsample_bylevel': 0.9, 'reg_alpha': 7.617275801201312e-05, 'reg_lambda': 7.906501140556471, 'gamma': 0.0022444464058980064}. Best is trial 94 with value: -0.1588569907036204.
