[I 2026-07-14 20:50:07,995] A new study created in RDB with name: my-study
[I 2026-07-14 20:50:14,618] Trial 2 finished with value: -0.019067873262349322 and parameters: {'scalers': 'robust', 'ratios': 'norm_ratio', 'imputers': 'none', 'n_estimators': 2350, 'learning_rate': 0.12577011240519403, 'max_depth': 7, 'min_child_weight': 1, 'subsample': 0.8, 'colsample_bytree': 1.0, 'colsample_bylevel': 1.0, 'reg_alpha': 12.439565525821404, 'reg_lambda': 0.001988215133134174, 'gamma': 0.07466005449289079}. Best is trial 2 with value: -0.019067873262349322.
[I 2026-07-14 20:50:33,026] Trial 0 finished with value: -0.01906935532115355 and parameters: {'scalers': 'none', 'ratios': 'log_ratio', 'imputers': 'mean', 'n_estimators': 1800, 'learning_rate': 0.0001236802818875689, 'max_depth': 9, 'min_child_weight': 1, 'subsample': 0.5, 'colsample_bytree': 1.0, 'colsample_bylevel': 0.9, 'reg_alpha': 0.0002944269993395596, 'reg_lambda': 0.002461053297675982, 'gamma': 0.0030606691050329145}. Best is trial 0 with value: -0.01906935532115355.
[I 2026-07-14 20:50:35,970] Trial 1 finished with value: -0.019023789249005798 and parameters: {'scalers': 'standard', 'ratios': 'norm_ratio', 'imputers': 'mean', 'n_estimators': 350, 'learning_rate': 0.0005625668508788297, 'max_depth': 11, 'min_child_weight': 9, 'subsample': 0.9, 'colsample_bytree': 0.6, 'colsample_bylevel': 1.0, 'reg_alpha': 0.0725100572810806, 'reg_lambda': 0.0011819543622587142, 'gamma': 0.017055572134082046}. Best is trial 0 with value: -0.01906935532115355.
[I 2026-07-14 20:50:36,726] Trial 7 finished with value: -0.019121907038240068 and parameters: {'scalers': 'standard', 'ratios': 'log_ratio', 'imputers': 'mean', 'n_estimators': 800, 'learning_rate': 0.1808506524381475, 'max_depth': 5, 'min_child_weight': 6, 'subsample': 0.9, 'colsample_bytree': 0.7, 'colsample_bylevel': 0.5, 'reg_alpha': 0.14814804200814524, 'reg_lambda': 0.0015792357396407495, 'gamma': 0.20867731852106408}. Best is trial 7 with value: -0.019121907038240068.
[I 2026-07-14 20:50:37,715] Trial 5 finished with value: -0.019054711240224637 and parameters: {'scalers': 'robust', 'ratios': 'log_ratio', 'imputers': 'median', 'n_estimators': 150, 'learning_rate': 0.0010891089171650209, 'max_depth': 9, 'min_child_weight': 3, 'subsample': 0.8, 'colsample_bytree': 0.6, 'colsample_bylevel': 0.7, 'reg_alpha': 0.00023514383331468854, 'reg_lambda': 0.7157120595898547, 'gamma': 0.0002826658448486884}. Best is trial 7 with value: -0.019121907038240068.
[I 2026-07-14 20:50:38,701] Trial 3 finished with value: -0.0190392516117841 and parameters: {'scalers': 'none', 'ratios': 'log_ratio', 'imputers': 'mean', 'n_estimators': 1000, 'learning_rate': 0.005454384086864759, 'max_depth': 5, 'min_child_weight': 4, 'subsample': 0.5, 'colsample_bytree': 0.5, 'colsample_bylevel': 0.6, 'reg_alpha': 0.0035790987031782654, 'reg_lambda': 1.88831667390154e-06, 'gamma': 63.49164291822331}. Best is trial 7 with value: -0.019121907038240068.
[I 2026-07-14 20:50:47,317] Trial 6 finished with value: -0.024331417761522683 and parameters: {'scalers': 'robust', 'ratios': 'log_ratio', 'imputers': 'mean', 'n_estimators': 2450, 'learning_rate': 0.01159310559031179, 'max_depth': 6, 'min_child_weight': 2, 'subsample': 0.6, 'colsample_bytree': 0.6, 'colsample_bylevel': 0.8, 'reg_alpha': 0.36219567502959193, 'reg_lambda': 0.11941545056845221, 'gamma': 0.0054348492179339455}. Best is trial 6 with value: -0.024331417761522683.
[I 2026-07-14 20:50:58,494] Trial 4 finished with value: -0.0242908741844715 and parameters: {'scalers': 'standard', 'ratios': 'log_ratio', 'imputers': 'mean', 'n_estimators': 1750, 'learning_rate': 0.01600722469574112, 'max_depth': 6, 'min_child_weight': 6, 'subsample': 1.0, 'colsample_bytree': 0.9, 'colsample_bylevel': 0.9, 'reg_alpha': 4.410688613749695e-05, 'reg_lambda': 18.071416466368095, 'gamma': 1.8219798341110329e-06}. Best is trial 6 with value: -0.024331417761522683.
[I 2026-07-14 20:51:00,784] Trial 8 finished with value: -0.03252808720596867 and parameters: {'scalers': 'standard', 'ratios': 'log_ratio', 'imputers': 'mean', 'n_estimators': 750, 'learning_rate': 0.429373789471209, 'max_depth': 4, 'min_child_weight': 1, 'subsample': 0.9, 'colsample_bytree': 0.7, 'colsample_bylevel': 1.0, 'reg_alpha': 0.011029512866331657, 'reg_lambda': 1.0976673768354288, 'gamma': 0.0054369867568311685}. Best is trial 8 with value: -0.03252808720596867.
[I 2026-07-14 20:51:05,114] Trial 9 finished with value: -0.07157516160335382 and parameters: {'scalers': 'robust', 'ratios': 'norm_ratio', 'imputers': 'none', 'n_estimators': 900, 'learning_rate': 0.19647895658152661, 'max_depth': 7, 'min_child_weight': 1, 'subsample': 0.5, 'colsample_bytree': 0.6, 'colsample_bylevel': 0.6, 'reg_alpha': 8.025122728883978e-06, 'reg_lambda': 45.66395483780738, 'gamma': 0.0011948870706495807}. Best is trial 9 with value: -0.07157516160335382.
[I 2026-07-14 20:51:06,359] Trial 10 finished with value: -0.022618353394087597 and parameters: {'scalers': 'standard', 'ratios': 'log_ratio', 'imputers': 'none', 'n_estimators': 950, 'learning_rate': 0.32984911939700257, 'max_depth': 5, 'min_child_weight': 2, 'subsample': 0.8, 'colsample_bytree': 0.8, 'colsample_bylevel': 0.5, 'reg_alpha': 5.68595643410422, 'reg_lambda': 1.9346164759775193, 'gamma': 0.019388581850322394}. Best is trial 9 with value: -0.07157516160335382.
[I 2026-07-14 20:51:08,876] Trial 11 finished with value: -0.019597652462988786 and parameters: {'scalers': 'robust', 'ratios': 'norm_ratio', 'imputers': 'none', 'n_estimators': 1700, 'learning_rate': 0.008615391571624036, 'max_depth': 7, 'min_child_weight': 9, 'subsample': 0.6, 'colsample_bytree': 0.6, 'colsample_bylevel': 0.8, 'reg_alpha': 9.800029638909221, 'reg_lambda': 0.5452424314002775, 'gamma': 9.200319779860974e-06}. Best is trial 9 with value: -0.07157516160335382.
[I 2026-07-14 20:51:16,879] Trial 12 finished with value: -0.03573513338347889 and parameters: {'scalers': 'none', 'ratios': 'log_ratio', 'imputers': 'median', 'n_estimators': 1600, 'learning_rate': 0.25802883784255415, 'max_depth': 6, 'min_child_weight': 4, 'subsample': 0.8, 'colsample_bytree': 1.0, 'colsample_bylevel': 0.9, 'reg_alpha': 0.000951887004244709, 'reg_lambda': 0.050056431172353914, 'gamma': 8.906042923611906e-06}. Best is trial 9 with value: -0.07157516160335382.
[I 2026-07-14 20:51:18,967] Trial 13 finished with value: -0.019044917030996 and parameters: {'scalers': 'none', 'ratios': 'log_ratio', 'imputers': 'median', 'n_estimators': 1600, 'learning_rate': 0.14585495230572254, 'max_depth': 5, 'min_child_weight': 5, 'subsample': 0.9, 'colsample_bytree': 0.9, 'colsample_bylevel': 0.9, 'reg_alpha': 23.609066515594325, 'reg_lambda': 1.005320213242422e-05, 'gamma': 37.1213948903594}. Best is trial 9 with value: -0.07157516160335382.
[I 2026-07-14 20:51:20,532] Trial 14 finished with value: -0.019059333431219735 and parameters: {'scalers': 'robust', 'ratios': 'norm_ratio', 'imputers': 'mean', 'n_estimators': 1300, 'learning_rate': 0.00010320740049240071, 'max_depth': 5, 'min_child_weight': 6, 'subsample': 0.7, 'colsample_bytree': 0.8, 'colsample_bylevel': 0.9, 'reg_alpha': 0.00890516322123802, 'reg_lambda': 0.3705832722690434, 'gamma': 46.95680393425525}. Best is trial 9 with value: -0.07157516160335382.
[I 2026-07-14 20:51:27,092] Trial 15 finished with value: -0.020489748806854384 and parameters: {'scalers': 'none', 'ratios': 'norm_ratio', 'imputers': 'mean', 'n_estimators': 2500, 'learning_rate': 0.0055638096458321224, 'max_depth': 4, 'min_child_weight': 8, 'subsample': 0.8, 'colsample_bytree': 0.5, 'colsample_bylevel': 1.0, 'reg_alpha': 0.06569493086467094, 'reg_lambda': 35.48481597186166, 'gamma': 2.8320277113263556e-05}. Best is trial 9 with value: -0.07157516160335382.
[I 2026-07-14 20:51:27,496] Trial 16 finished with value: -0.019044725645637146 and parameters: {'scalers': 'none', 'ratios': 'norm_ratio', 'imputers': 'mean', 'n_estimators': 900, 'learning_rate': 0.013077108265854877, 'max_depth': 6, 'min_child_weight': 9, 'subsample': 0.5, 'colsample_bytree': 0.5, 'colsample_bylevel': 0.5, 'reg_alpha': 0.12509377768294688, 'reg_lambda': 87.58767721856299, 'gamma': 6.662201013657256}. Best is trial 9 with value: -0.07157516160335382.
[I 2026-07-14 20:51:36,324] Trial 17 finished with value: -0.027833013241033287 and parameters: {'scalers': 'robust', 'ratios': 'norm_ratio', 'imputers': 'none', 'n_estimators': 1600, 'learning_rate': 0.03994155524373104, 'max_depth': 12, 'min_child_weight': 10, 'subsample': 0.7, 'colsample_bytree': 0.8, 'colsample_bylevel': 0.5, 'reg_alpha': 1.118661034906432e-06, 'reg_lambda': 3.473886156930093e-06, 'gamma': 1.6112149853534698e-06}. Best is trial 9 with value: -0.07157516160335382.
[I 2026-07-14 20:51:39,081] Trial 18 finished with value: -0.022609012495890084 and parameters: {'scalers': 'robust', 'ratios': 'norm_ratio', 'imputers': 'none', 'n_estimators': 1400, 'learning_rate': 0.055791440726848544, 'max_depth': 3, 'min_child_weight': 4, 'subsample': 0.6, 'colsample_bytree': 0.7, 'colsample_bylevel': 0.7, 'reg_alpha': 1.4170970722265397e-06, 'reg_lambda': 73.71775817474332, 'gamma': 2.534106794464145e-05}. Best is trial 9 with value: -0.07157516160335382.
[I 2026-07-14 20:51:41,959] Trial 19 finished with value: -0.021911514905144484 and parameters: {'scalers': 'standard', 'ratios': 'norm_ratio', 'imputers': 'median', 'n_estimators': 1300, 'learning_rate': 0.04782361790190807, 'max_depth': 3, 'min_child_weight': 4, 'subsample': 0.7, 'colsample_bytree': 0.8, 'colsample_bylevel': 0.7, 'reg_alpha': 2.160288108272589e-06, 'reg_lambda': 79.64693819645012, 'gamma': 0.0002834135796633205}. Best is trial 9 with value: -0.07157516160335382.
[I 2026-07-14 20:51:49,780] Trial 20 finished with value: -0.03231730744154343 and parameters: {'scalers': 'none', 'ratios': 'norm_ratio', 'imputers': 'median', 'n_estimators': 1350, 'learning_rate': 0.06983637314414595, 'max_depth': 9, 'min_child_weight': 5, 'subsample': 0.7, 'colsample_bytree': 0.9, 'colsample_bylevel': 0.7, 'reg_alpha': 1.1149949846628375e-06, 'reg_lambda': 79.41827066127335, 'gamma': 7.8233701460901e-05}. Best is trial 9 with value: -0.07157516160335382.
[I 2026-07-14 20:51:52,657] Trial 21 finished with value: -0.02212869863453834 and parameters: {'scalers': 'none', 'ratios': 'norm_ratio', 'imputers': 'median', 'n_estimators': 1300, 'learning_rate': 0.05295410480361153, 'max_depth': 3, 'min_child_weight': 4, 'subsample': 0.7, 'colsample_bytree': 0.8, 'colsample_bylevel': 0.7, 'reg_alpha': 1.0036872783729368e-06, 'reg_lambda': 39.53773510826096, 'gamma': 7.045193508505925e-05}. Best is trial 9 with value: -0.07157516160335382.
[I 2026-07-14 20:51:57,419] Trial 22 finished with value: -0.023349132294599822 and parameters: {'scalers': 'none', 'ratios': 'norm_ratio', 'imputers': 'median', 'n_estimators': 2800, 'learning_rate': 0.03926849149464319, 'max_depth': 3, 'min_child_weight': 4, 'subsample': 0.6, 'colsample_bytree': 0.5, 'colsample_bylevel': 0.6, 'reg_alpha': 1.7077565911694692e-06, 'reg_lambda': 26.90579770975523, 'gamma': 7.996059282761126e-05}. Best is trial 9 with value: -0.07157516160335382.
[I 2026-07-14 20:52:11,438] Trial 23 finished with value: -0.032610535160630165 and parameters: {'scalers': 'none', 'ratios': 'norm_ratio', 'imputers': 'median', 'n_estimators': 2900, 'learning_rate': 0.045619343496601954, 'max_depth': 9, 'min_child_weight': 4, 'subsample': 0.6, 'colsample_bytree': 0.9, 'colsample_bylevel': 0.6, 'reg_alpha': 1.47069413609278e-06, 'reg_lambda': 0.03590962891963718, 'gamma': 0.000118773550570568}. Best is trial 9 with value: -0.07157516160335382.
[I 2026-07-14 20:52:26,405] Trial 24 finished with value: -0.03496251402705883 and parameters: {'scalers': 'robust', 'ratios': 'norm_ratio', 'imputers': 'median', 'n_estimators': 2950, 'learning_rate': 0.05950973427934002, 'max_depth': 9, 'min_child_weight': 3, 'subsample': 0.6, 'colsample_bytree': 0.9, 'colsample_bylevel': 0.7, 'reg_alpha': 1.8180841728337165e-06, 'reg_lambda': 0.03451659083075175, 'gamma': 0.00024142790856927757}. Best is trial 9 with value: -0.07157516160335382.
[I 2026-07-14 20:52:42,196] Trial 25 finished with value: -0.032814961115201234 and parameters: {'scalers': 'none', 'ratios': 'norm_ratio', 'imputers': 'median', 'n_estimators': 3000, 'learning_rate': 0.049069274513377524, 'max_depth': 9, 'min_child_weight': 4, 'subsample': 0.6, 'colsample_bytree': 0.9, 'colsample_bylevel': 0.7, 'reg_alpha': 1.7533357684795824e-06, 'reg_lambda': 0.026145604443346335, 'gamma': 0.00042058699933230693}. Best is trial 9 with value: -0.07157516160335382.
[I 2026-07-14 20:52:59,041] Trial 26 finished with value: -0.030816508683822935 and parameters: {'scalers': 'none', 'ratios': 'norm_ratio', 'imputers': 'median', 'n_estimators': 2950, 'learning_rate': 0.05260488799640914, 'max_depth': 9, 'min_child_weight': 3, 'subsample': 1.0, 'colsample_bytree': 0.9, 'colsample_bylevel': 0.6, 'reg_alpha': 2.26369226672438e-05, 'reg_lambda': 0.017163984932043536, 'gamma': 0.00029680559282968354}. Best is trial 9 with value: -0.07157516160335382.
[I 2026-07-14 20:53:10,269] Trial 27 finished with value: -0.03194489854171888 and parameters: {'scalers': 'none', 'ratios': 'norm_ratio', 'imputers': 'median', 'n_estimators': 2050, 'learning_rate': 0.0947463829219267, 'max_depth': 9, 'min_child_weight': 3, 'subsample': 1.0, 'colsample_bytree': 0.9, 'colsample_bylevel': 0.6, 'reg_alpha': 2.9119985708589184e-05, 'reg_lambda': 0.01620791031149556, 'gamma': 0.00027614960791215687}. Best is trial 9 with value: -0.07157516160335382.
[I 2026-07-14 20:53:13,082] Trial 28 finished with value: -0.03607185778296976 and parameters: {'scalers': 'standard', 'ratios': 'log_ratio', 'imputers': 'median', 'n_estimators': 550, 'learning_rate': 0.39272042594563616, 'max_depth': 8, 'min_child_weight': 2, 'subsample': 1.0, 'colsample_bytree': 0.7, 'colsample_bylevel': 0.8, 'reg_alpha': 3.570089661144152e-05, 'reg_lambda': 0.06528446664109538, 'gamma': 0.0008982632120671948}. Best is trial 9 with value: -0.07157516160335382.
[I 2026-07-14 20:53:15,443] Trial 29 finished with value: -0.04007581606916244 and parameters: {'scalers': 'standard', 'ratios': 'log_ratio', 'imputers': 'none', 'n_estimators': 550, 'learning_rate': 0.48424194498117823, 'max_depth': 8, 'min_child_weight': 2, 'subsample': 1.0, 'colsample_bytree': 0.7, 'colsample_bylevel': 0.6, 'reg_alpha': 5.364760195956331e-05, 'reg_lambda': 0.03879596134315722, 'gamma': 0.0017998442481765259}. Best is trial 9 with value: -0.07157516160335382.
[I 2026-07-14 20:53:18,656] Trial 30 finished with value: -0.037215340574108725 and parameters: {'scalers': 'standard', 'ratios': 'log_ratio', 'imputers': 'none', 'n_estimators': 650, 'learning_rate': 0.4465824540285462, 'max_depth': 8, 'min_child_weight': 2, 'subsample': 1.0, 'colsample_bytree': 0.7, 'colsample_bylevel': 0.8, 'reg_alpha': 2.4977797050188957e-05, 'reg_lambda': 0.03321163978446751, 'gamma': 0.0010589943687115942}. Best is trial 9 with value: -0.07157516160335382.
[I 2026-07-14 20:53:27,221] Trial 31 finished with value: -0.05012954876272156 and parameters: {'scalers': 'none', 'ratios': 'norm_ratio', 'imputers': 'median', 'n_estimators': 2000, 'learning_rate': 0.2385780085983857, 'max_depth': 8, 'min_child_weight': 2, 'subsample': 0.5, 'colsample_bytree': 1.0, 'colsample_bylevel': 0.6, 'reg_alpha': 2.3002914866860353e-05, 'reg_lambda': 0.03056030081603096, 'gamma': 0.0008056547423136215}. Best is trial 9 with value: -0.07157516160335382.
[I 2026-07-14 20:53:38,014] Trial 32 finished with value: -0.05095794712806057 and parameters: {'scalers': 'robust', 'ratios': 'norm_ratio', 'imputers': 'median', 'n_estimators': 2100, 'learning_rate': 0.2565971811778774, 'max_depth': 8, 'min_child_weight': 2, 'subsample': 0.5, 'colsample_bytree': 1.0, 'colsample_bylevel': 0.8, 'reg_alpha': 1.5031076535086563e-05, 'reg_lambda': 0.017826546437060886, 'gamma': 0.0003838665908359996}. Best is trial 9 with value: -0.07157516160335382.
[I 2026-07-14 20:53:48,717] Trial 33 finished with value: -0.04911669517365039 and parameters: {'scalers': 'robust', 'ratios': 'log_ratio', 'imputers': 'none', 'n_estimators': 2100, 'learning_rate': 0.22288344564939339, 'max_depth': 8, 'min_child_weight': 2, 'subsample': 0.5, 'colsample_bytree': 1.0, 'colsample_bylevel': 0.8, 'reg_alpha': 2.024974651768352e-05, 'reg_lambda': 0.00015997001984472293, 'gamma': 0.001020920920032438}. Best is trial 9 with value: -0.07157516160335382.
[I 2026-07-14 20:53:58,914] Trial 34 finished with value: -0.05148692657859181 and parameters: {'scalers': 'robust', 'ratios': 'log_ratio', 'imputers': 'none', 'n_estimators': 2050, 'learning_rate': 0.2420116141331404, 'max_depth': 8, 'min_child_weight': 2, 'subsample': 0.5, 'colsample_bytree': 1.0, 'colsample_bylevel': 0.8, 'reg_alpha': 2.3501087254671808e-05, 'reg_lambda': 0.0002259907984173391, 'gamma': 0.0009877533135953563}. Best is trial 9 with value: -0.07157516160335382.
[I 2026-07-14 20:54:02,678] Trial 35 finished with value: -0.05148562019654215 and parameters: {'scalers': 'robust', 'ratios': 'log_ratio', 'imputers': 'none', 'n_estimators': 500, 'learning_rate': 0.24577269256905895, 'max_depth': 8, 'min_child_weight': 2, 'subsample': 0.5, 'colsample_bytree': 1.0, 'colsample_bylevel': 0.8, 'reg_alpha': 0.0005075731515143506, 'reg_lambda': 5.712565666846587, 'gamma': 0.0010406990520234578}. Best is trial 9 with value: -0.07157516160335382.
[I 2026-07-14 20:54:06,009] Trial 36 finished with value: -0.03867018935937139 and parameters: {'scalers': 'standard', 'ratios': 'log_ratio', 'imputers': 'none', 'n_estimators': 650, 'learning_rate': 0.2515871742080152, 'max_depth': 8, 'min_child_weight': 2, 'subsample': 0.5, 'colsample_bytree': 1.0, 'colsample_bylevel': 0.8, 'reg_alpha': 0.0005739436147773419, 'reg_lambda': 0.0003120166286096474, 'gamma': 0.0012370589868729092}. Best is trial 9 with value: -0.07157516160335382.
[I 2026-07-14 20:54:08,916] Trial 37 finished with value: -0.031081492691703513 and parameters: {'scalers': 'standard', 'ratios': 'log_ratio', 'imputers': 'none', 'n_estimators': 550, 'learning_rate': 0.23291315137737406, 'max_depth': 8, 'min_child_weight': 2, 'subsample': 1.0, 'colsample_bytree': 0.7, 'colsample_bylevel': 0.8, 'reg_alpha': 9.021986058279615e-06, 'reg_lambda': 0.00010434880495696103, 'gamma': 0.0017419119100940648}. Best is trial 9 with value: -0.07157516160335382.
[I 2026-07-14 20:54:12,240] Trial 38 finished with value: -0.050510018631597244 and parameters: {'scalers': 'standard', 'ratios': 'log_ratio', 'imputers': 'none', 'n_estimators': 550, 'learning_rate': 0.47296884085176877, 'max_depth': 8, 'min_child_weight': 2, 'subsample': 1.0, 'colsample_bytree': 0.7, 'colsample_bylevel': 0.8, 'reg_alpha': 1.0517566127514999e-05, 'reg_lambda': 6.188461496632535, 'gamma': 0.0014888429009377259}. Best is trial 9 with value: -0.07157516160335382.
[I 2026-07-14 20:54:13,901] Trial 39 finished with value: -0.03794798052668132 and parameters: {'scalers': 'standard', 'ratios': 'log_ratio', 'imputers': 'none', 'n_estimators': 500, 'learning_rate': 0.19878989409956796, 'max_depth': 8, 'min_child_weight': 1, 'subsample': 0.5, 'colsample_bytree': 0.6, 'colsample_bylevel': 0.6, 'reg_alpha': 8.196986537618786e-06, 'reg_lambda': 0.0003645066606916284, 'gamma': 0.0018401923179221676}. Best is trial 9 with value: -0.07157516160335382.
[I 2026-07-14 20:54:25,169] Trial 40 finished with value: -0.062054559512596384 and parameters: {'scalers': 'robust', 'ratios': 'norm_ratio', 'imputers': 'none', 'n_estimators': 2050, 'learning_rate': 0.2562599423347314, 'max_depth': 10, 'min_child_weight': 1, 'subsample': 0.5, 'colsample_bytree': 1.0, 'colsample_bylevel': 0.6, 'reg_alpha': 8.37715910801521e-06, 'reg_lambda': 0.00033894742908843593, 'gamma': 0.0014682488096111126}. Best is trial 9 with value: -0.07157516160335382.
[I 2026-07-14 20:54:38,016] Trial 41 finished with value: -0.05672938929767096 and parameters: {'scalers': 'robust', 'ratios': 'norm_ratio', 'imputers': 'none', 'n_estimators': 2000, 'learning_rate': 0.20737332374124712, 'max_depth': 10, 'min_child_weight': 1, 'subsample': 0.5, 'colsample_bytree': 1.0, 'colsample_bylevel': 0.8, 'reg_alpha': 7.631606794704932e-06, 'reg_lambda': 0.00023341191273299744, 'gamma': 0.018214125465690633}. Best is trial 9 with value: -0.07157516160335382.
[I 2026-07-14 20:54:51,392] Trial 42 finished with value: -0.04361992703767976 and parameters: {'scalers': 'robust', 'ratios': 'norm_ratio', 'imputers': 'none', 'n_estimators': 2100, 'learning_rate': 0.114163565252964, 'max_depth': 10, 'min_child_weight': 1, 'subsample': 0.5, 'colsample_bytree': 1.0, 'colsample_bylevel': 0.8, 'reg_alpha': 7.024124706863012e-06, 'reg_lambda': 3.111507341513796e-05, 'gamma': 0.0375466302861491}. Best is trial 9 with value: -0.07157516160335382.
[I 2026-07-14 20:54:54,086] Trial 43 finished with value: -0.03919448428936586 and parameters: {'scalers': 'robust', 'ratios': 'log_ratio', 'imputers': 'none', 'n_estimators': 300, 'learning_rate': 0.1141566187947244, 'max_depth': 10, 'min_child_weight': 1, 'subsample': 0.5, 'colsample_bytree': 1.0, 'colsample_bylevel': 0.8, 'reg_alpha': 0.00019552543306651624, 'reg_lambda': 6.626206760441981, 'gamma': 0.07925648595405727}. Best is trial 9 with value: -0.07157516160335382.
[I 2026-07-14 20:54:56,785] Trial 44 finished with value: -0.03793988127612205 and parameters: {'scalers': 'robust', 'ratios': 'log_ratio', 'imputers': 'none', 'n_estimators': 250, 'learning_rate': 0.11160355831672443, 'max_depth': 10, 'min_child_weight': 1, 'subsample': 0.5, 'colsample_bytree': 1.0, 'colsample_bylevel': 0.8, 'reg_alpha': 0.00013777302393267263, 'reg_lambda': 4.740520751369496, 'gamma': 0.039833012149935954}. Best is trial 9 with value: -0.07157516160335382.
