[I 2026-07-14 17:46:47,355] Trial 135 finished with value: -0.3127454974259479 and parameters: {'scalers': 'robust', 'ratios': 'log_ratio', 'imputers': 'none', 'n_estimators': 3000, 'learning_rate': 0.3015428131675481, 'max_depth': 12, 'min_child_weight': 2, 'subsample': 0.9, 'colsample_bytree': 0.8, 'colsample_bylevel': 1.0, 'reg_alpha': 0.2834715512136837, 'reg_lambda': 0.027557622507472932, 'gamma': 0.000709605399918406}. Best is trial 129 with value: -0.5354202802189214.
[I 2026-07-14 17:48:15,510] Trial 136 finished with value: -0.2961702862463943 and parameters: {'scalers': 'robust', 'ratios': 'log_ratio', 'imputers': 'none', 'n_estimators': 3000, 'learning_rate': 0.3051529818892295, 'max_depth': 11, 'min_child_weight': 2, 'subsample': 1.0, 'colsample_bytree': 0.8, 'colsample_bylevel': 1.0, 'reg_alpha': 2.8433700449999213, 'reg_lambda': 0.01154610181959434, 'gamma': 0.0019362943479093197}. Best is trial 129 with value: -0.5354202802189214.
[I 2026-07-14 17:48:48,027] Trial 137 finished with value: -0.2569368266239344 and parameters: {'scalers': 'robust', 'ratios': 'log_ratio', 'imputers': 'none', 'n_estimators': 3000, 'learning_rate': 0.48211221287796013, 'max_depth': 7, 'min_child_weight': 1, 'subsample': 1.0, 'colsample_bytree': 0.8, 'colsample_bylevel': 1.0, 'reg_alpha': 0.3125929320144787, 'reg_lambda': 0.009161327914640563, 'gamma': 0.0006112471735309725}. Best is trial 129 with value: -0.5354202802189214.
[I 2026-07-14 17:50:15,585] Trial 138 finished with value: -0.3142457216356488 and parameters: {'scalers': 'robust', 'ratios': 'log_ratio', 'imputers': 'none', 'n_estimators': 3000, 'learning_rate': 0.3086259102421367, 'max_depth': 12, 'min_child_weight': 2, 'subsample': 0.9, 'colsample_bytree': 0.7, 'colsample_bylevel': 1.0, 'reg_alpha': 0.2654723263418, 'reg_lambda': 0.021899969590991074, 'gamma': 0.002151575323901249}. Best is trial 129 with value: -0.5354202802189214.
[I 2026-07-14 17:51:12,366] Trial 139 finished with value: -0.3049215914890225 and parameters: {'scalers': 'robust', 'ratios': 'log_ratio', 'imputers': 'none', 'n_estimators': 3000, 'learning_rate': 0.3074976696141021, 'max_depth': 12, 'min_child_weight': 3, 'subsample': 0.9, 'colsample_bytree': 0.7, 'colsample_bylevel': 0.5, 'reg_alpha': 0.27691737281815304, 'reg_lambda': 0.023473034658626987, 'gamma': 0.0019900222957071434}. Best is trial 129 with value: -0.5354202802189214.
[I 2026-07-14 17:51:38,681] Trial 140 finished with value: -0.2396113229193959 and parameters: {'scalers': 'robust', 'ratios': 'log_ratio', 'imputers': 'none', 'n_estimators': 2850, 'learning_rate': 0.3078589072542316, 'max_depth': 7, 'min_child_weight': 3, 'subsample': 0.9, 'colsample_bytree': 0.7, 'colsample_bylevel': 1.0, 'reg_alpha': 0.27079510614235214, 'reg_lambda': 0.022460744460871394, 'gamma': 0.0006931165434283337}. Best is trial 129 with value: -0.5354202802189214.
[I 2026-07-14 17:53:05,688] Trial 141 finished with value: -0.2916619599636658 and parameters: {'scalers': 'robust', 'ratios': 'log_ratio', 'imputers': 'none', 'n_estimators': 2850, 'learning_rate': 0.3132431773423423, 'max_depth': 12, 'min_child_weight': 3, 'subsample': 0.9, 'colsample_bytree': 0.8, 'colsample_bylevel': 1.0, 'reg_alpha': 0.2914428880762023, 'reg_lambda': 0.026329900590146907, 'gamma': 0.0021807668499149156}. Best is trial 129 with value: -0.5354202802189214.
[I 2026-07-14 17:54:32,296] Trial 142 finished with value: -0.28682614087258573 and parameters: {'scalers': 'standard', 'ratios': 'log_ratio', 'imputers': 'none', 'n_estimators': 2850, 'learning_rate': 0.30351787916056655, 'max_depth': 12, 'min_child_weight': 3, 'subsample': 0.9, 'colsample_bytree': 0.8, 'colsample_bylevel': 1.0, 'reg_alpha': 0.28152364068561797, 'reg_lambda': 0.028376340143080863, 'gamma': 0.0028812306794482496}. Best is trial 129 with value: -0.5354202802189214.
[I 2026-07-14 17:55:36,725] Trial 143 finished with value: -0.2820075133060415 and parameters: {'scalers': 'standard', 'ratios': 'log_ratio', 'imputers': 'none', 'n_estimators': 2850, 'learning_rate': 0.25582322185360384, 'max_depth': 11, 'min_child_weight': 3, 'subsample': 0.9, 'colsample_bytree': 0.7, 'colsample_bylevel': 1.0, 'reg_alpha': 3.0346578280595633, 'reg_lambda': 0.12612476004367063, 'gamma': 0.0021219377875297736}. Best is trial 129 with value: -0.5354202802189214.
[I 2026-07-14 17:56:43,312] Trial 144 finished with value: -0.2700011539509758 and parameters: {'scalers': 'standard', 'ratios': 'log_ratio', 'imputers': 'none', 'n_estimators': 2850, 'learning_rate': 0.2542559059230997, 'max_depth': 12, 'min_child_weight': 3, 'subsample': 0.9, 'colsample_bytree': 0.7, 'colsample_bylevel': 1.0, 'reg_alpha': 0.015349918470623154, 'reg_lambda': 0.10243569760095768, 'gamma': 0.0021942880375068904}. Best is trial 129 with value: -0.5354202802189214.
[I 2026-07-14 17:57:50,271] Trial 145 finished with value: -0.29330109821532546 and parameters: {'scalers': 'standard', 'ratios': 'log_ratio', 'imputers': 'none', 'n_estimators': 2850, 'learning_rate': 0.37983303195291923, 'max_depth': 12, 'min_child_weight': 3, 'subsample': 0.9, 'colsample_bytree': 0.7, 'colsample_bylevel': 1.0, 'reg_alpha': 0.019641879556460726, 'reg_lambda': 0.021325090325503657, 'gamma': 0.0021305425289202644}. Best is trial 129 with value: -0.5354202802189214.
[I 2026-07-14 17:58:41,661] Trial 146 finished with value: -0.1674261205460141 and parameters: {'scalers': 'standard', 'ratios': 'log_ratio', 'imputers': 'none', 'n_estimators': 2850, 'learning_rate': 0.003076849671124995, 'max_depth': 12, 'min_child_weight': 3, 'subsample': 0.9, 'colsample_bytree': 0.7, 'colsample_bylevel': 1.0, 'reg_alpha': 2.8030624817381518, 'reg_lambda': 0.09248448404162278, 'gamma': 0.0034265095500051654}. Best is trial 129 with value: -0.5354202802189214.
[I 2026-07-14 17:59:40,303] Trial 147 finished with value: -0.2972403969761176 and parameters: {'scalers': 'robust', 'ratios': 'log_ratio', 'imputers': 'none', 'n_estimators': 2600, 'learning_rate': 0.24931488172198657, 'max_depth': 11, 'min_child_weight': 1, 'subsample': 0.9, 'colsample_bytree': 0.7, 'colsample_bylevel': 1.0, 'reg_alpha': 0.010437530919689516, 'reg_lambda': 0.13406876130356274, 'gamma': 0.0032436387669717856}. Best is trial 129 with value: -0.5354202802189214.
[I 2026-07-14 18:00:48,865] Trial 148 finished with value: -0.4535571395276877 and parameters: {'scalers': 'standard', 'ratios': 'log_ratio', 'imputers': 'none', 'n_estimators': 2850, 'learning_rate': 0.40173254046259527, 'max_depth': 12, 'min_child_weight': 1, 'subsample': 0.9, 'colsample_bytree': 0.7, 'colsample_bylevel': 1.0, 'reg_alpha': 2.8781971377190514, 'reg_lambda': 13.47215921248722, 'gamma': 0.003327662335795814}. Best is trial 129 with value: -0.5354202802189214.
[I 2026-07-14 18:02:27,759] Trial 149 finished with value: -0.4875917623395954 and parameters: {'scalers': 'robust', 'ratios': 'log_ratio', 'imputers': 'none', 'n_estimators': 2850, 'learning_rate': 0.3857881995340524, 'max_depth': 12, 'min_child_weight': 1, 'subsample': 0.9, 'colsample_bytree': 0.7, 'colsample_bylevel': 1.0, 'reg_alpha': 0.7252488239696011, 'reg_lambda': 0.13867707622637265, 'gamma': 0.0033075820280371176}. Best is trial 129 with value: -0.5354202802189214.
[I 2026-07-14 18:04:04,997] Trial 150 finished with value: -0.4851345233862648 and parameters: {'scalers': 'robust', 'ratios': 'log_ratio', 'imputers': 'none', 'n_estimators': 2750, 'learning_rate': 0.40672975671141715, 'max_depth': 12, 'min_child_weight': 1, 'subsample': 0.9, 'colsample_bytree': 0.7, 'colsample_bylevel': 1.0, 'reg_alpha': 0.5820306073560916, 'reg_lambda': 0.1249750648386767, 'gamma': 0.0035642596797195642}. Best is trial 129 with value: -0.5354202802189214.
[I 2026-07-14 18:05:54,404] Trial 151 finished with value: -0.19061117820503815 and parameters: {'scalers': 'robust', 'ratios': 'log_ratio', 'imputers': 'none', 'n_estimators': 2600, 'learning_rate': 0.0027271602087063475, 'max_depth': 12, 'min_child_weight': 1, 'subsample': 0.9, 'colsample_bytree': 0.7, 'colsample_bylevel': 1.0, 'reg_alpha': 0.01825173746938609, 'reg_lambda': 14.128848653049142, 'gamma': 0.006792808341690034}. Best is trial 129 with value: -0.5354202802189214.
[I 2026-07-14 18:07:04,420] Trial 152 finished with value: -0.4927196450525693 and parameters: {'scalers': 'robust', 'ratios': 'log_ratio', 'imputers': 'none', 'n_estimators': 2600, 'learning_rate': 0.4088956427775685, 'max_depth': 12, 'min_child_weight': 1, 'subsample': 0.9, 'colsample_bytree': 0.7, 'colsample_bylevel': 0.9, 'reg_alpha': 0.6116251621883734, 'reg_lambda': 13.18400260377028, 'gamma': 0.004162201110757583}. Best is trial 129 with value: -0.5354202802189214.
[I 2026-07-14 18:07:40,999] Trial 153 finished with value: -0.19480903824124998 and parameters: {'scalers': 'robust', 'ratios': 'log_ratio', 'imputers': 'none', 'n_estimators': 2600, 'learning_rate': 0.42799586960469865, 'max_depth': 12, 'min_child_weight': 1, 'subsample': 0.7, 'colsample_bytree': 0.7, 'colsample_bylevel': 0.9, 'reg_alpha': 0.5475410018092518, 'reg_lambda': 0.0027453066277744595, 'gamma': 0.2934861983413581}. Best is trial 129 with value: -0.5354202802189214.
[I 2026-07-14 18:09:10,062] Trial 154 finished with value: -0.5560364536447133 and parameters: {'scalers': 'robust', 'ratios': 'log_ratio', 'imputers': 'median', 'n_estimators': 2600, 'learning_rate': 0.4222628005673137, 'max_depth': 12, 'min_child_weight': 1, 'subsample': 0.7, 'colsample_bytree': 0.7, 'colsample_bylevel': 0.9, 'reg_alpha': 0.6665387257305614, 'reg_lambda': 13.125607773168058, 'gamma': 0.007114405155786805}. Best is trial 154 with value: -0.5560364536447133.
[I 2026-07-14 18:10:33,675] Trial 155 finished with value: -0.5760744995970664 and parameters: {'scalers': 'robust', 'ratios': 'log_ratio', 'imputers': 'median', 'n_estimators': 2600, 'learning_rate': 0.40811753560082126, 'max_depth': 12, 'min_child_weight': 1, 'subsample': 0.7, 'colsample_bytree': 0.7, 'colsample_bylevel': 0.9, 'reg_alpha': 0.11960740045546167, 'reg_lambda': 36.02777387285268, 'gamma': 0.006457315791792292}. Best is trial 155 with value: -0.5760744995970664.
[I 2026-07-14 18:11:42,225] Trial 156 finished with value: -0.500785034831697 and parameters: {'scalers': 'robust', 'ratios': 'log_ratio', 'imputers': 'median', 'n_estimators': 2750, 'learning_rate': 0.39919566914225796, 'max_depth': 12, 'min_child_weight': 1, 'subsample': 0.9, 'colsample_bytree': 0.7, 'colsample_bylevel': 0.9, 'reg_alpha': 0.6577392698378756, 'reg_lambda': 13.700333646519118, 'gamma': 0.006869461468421453}. Best is trial 155 with value: -0.5760744995970664.
[I 2026-07-14 18:12:16,959] Trial 157 finished with value: -0.34167523915623255 and parameters: {'scalers': 'standard', 'ratios': 'log_ratio', 'imputers': 'median', 'n_estimators': 1100, 'learning_rate': 0.20016469928322408, 'max_depth': 12, 'min_child_weight': 1, 'subsample': 0.9, 'colsample_bytree': 0.6, 'colsample_bylevel': 0.9, 'reg_alpha': 0.6150008103455262, 'reg_lambda': 33.96968439815489, 'gamma': 0.0014893257485165418}. Best is trial 155 with value: -0.5760744995970664.
[I 2026-07-14 18:13:20,572] Trial 158 finished with value: -0.476733923764572 and parameters: {'scalers': 'robust', 'ratios': 'log_ratio', 'imputers': 'none', 'n_estimators': 2750, 'learning_rate': 0.3943195962211896, 'max_depth': 12, 'min_child_weight': 1, 'subsample': 0.9, 'colsample_bytree': 0.7, 'colsample_bylevel': 0.9, 'reg_alpha': 0.6724402173666455, 'reg_lambda': 37.91626274433372, 'gamma': 0.0067072782497409784}. Best is trial 155 with value: -0.5760744995970664.
[I 2026-07-14 18:14:49,007] Trial 159 finished with value: -0.47158811173825593 and parameters: {'scalers': 'robust', 'ratios': 'log_ratio', 'imputers': 'median', 'n_estimators': 2750, 'learning_rate': 0.3897397743503962, 'max_depth': 12, 'min_child_weight': 1, 'subsample': 0.9, 'colsample_bytree': 0.7, 'colsample_bylevel': 0.9, 'reg_alpha': 0.5882200462806726, 'reg_lambda': 0.04449317365003376, 'gamma': 0.0014313680711937529}. Best is trial 155 with value: -0.5760744995970664.
[I 2026-07-14 18:16:26,404] Trial 160 finished with value: -0.3906214797290282 and parameters: {'scalers': 'robust', 'ratios': 'log_ratio', 'imputers': 'median', 'n_estimators': 2750, 'learning_rate': 0.19347547475101795, 'max_depth': 12, 'min_child_weight': 1, 'subsample': 0.9, 'colsample_bytree': 0.7, 'colsample_bylevel': 0.9, 'reg_alpha': 0.5951149780171977, 'reg_lambda': 0.2349810384248709, 'gamma': 0.007512060463580137}. Best is trial 155 with value: -0.5760744995970664.
[I 2026-07-14 18:17:37,670] Trial 161 finished with value: -0.34001270586778853 and parameters: {'scalers': 'robust', 'ratios': 'log_ratio', 'imputers': 'median', 'n_estimators': 2750, 'learning_rate': 0.20803824825904563, 'max_depth': 12, 'min_child_weight': 1, 'subsample': 0.9, 'colsample_bytree': 0.6, 'colsample_bylevel': 0.9, 'reg_alpha': 0.10578651310228016, 'reg_lambda': 0.21959723079161067, 'gamma': 0.0014318967700826168}. Best is trial 155 with value: -0.5760744995970664.
[I 2026-07-14 18:19:08,476] Trial 162 finished with value: -0.4038672443749402 and parameters: {'scalers': 'robust', 'ratios': 'log_ratio', 'imputers': 'median', 'n_estimators': 2750, 'learning_rate': 0.19704489480576012, 'max_depth': 12, 'min_child_weight': 1, 'subsample': 0.9, 'colsample_bytree': 0.6, 'colsample_bylevel': 0.9, 'reg_alpha': 0.6988818551498095, 'reg_lambda': 0.1747142619477346, 'gamma': 0.008119432045986207}. Best is trial 155 with value: -0.5760744995970664.
[I 2026-07-14 18:20:34,101] Trial 163 finished with value: -0.41575047113575897 and parameters: {'scalers': 'standard', 'ratios': 'log_ratio', 'imputers': 'median', 'n_estimators': 2750, 'learning_rate': 0.20553028337570833, 'max_depth': 12, 'min_child_weight': 1, 'subsample': 0.9, 'colsample_bytree': 0.6, 'colsample_bylevel': 0.9, 'reg_alpha': 0.9179054281973976, 'reg_lambda': 0.2489963654837931, 'gamma': 0.007308360596076349}. Best is trial 155 with value: -0.5760744995970664.
[I 2026-07-14 18:21:46,630] Trial 164 finished with value: -0.33662550345290954 and parameters: {'scalers': 'standard', 'ratios': 'log_ratio', 'imputers': 'median', 'n_estimators': 2750, 'learning_rate': 0.1900851010891339, 'max_depth': 12, 'min_child_weight': 1, 'subsample': 0.9, 'colsample_bytree': 0.6, 'colsample_bylevel': 0.9, 'reg_alpha': 0.12640253382994887, 'reg_lambda': 0.21698443735029113, 'gamma': 0.016509241770946374}. Best is trial 155 with value: -0.5760744995970664.
[I 2026-07-14 18:22:45,548] Trial 165 finished with value: -0.426677648597144 and parameters: {'scalers': 'robust', 'ratios': 'log_ratio', 'imputers': 'median', 'n_estimators': 2750, 'learning_rate': 0.3744025762263251, 'max_depth': 11, 'min_child_weight': 1, 'subsample': 0.9, 'colsample_bytree': 0.6, 'colsample_bylevel': 0.9, 'reg_alpha': 0.03455162053435087, 'reg_lambda': 33.76518695689066, 'gamma': 0.016137779370071388}. Best is trial 155 with value: -0.5760744995970664.
[I 2026-07-14 18:23:52,802] Trial 166 finished with value: -0.4768907567379509 and parameters: {'scalers': 'robust', 'ratios': 'log_ratio', 'imputers': 'median', 'n_estimators': 2750, 'learning_rate': 0.3819245835452481, 'max_depth': 11, 'min_child_weight': 1, 'subsample': 0.9, 'colsample_bytree': 0.6, 'colsample_bylevel': 0.9, 'reg_alpha': 0.9868378737146073, 'reg_lambda': 21.79277469533252, 'gamma': 0.0071778687543978025}. Best is trial 155 with value: -0.5760744995970664.
[I 2026-07-14 18:24:59,822] Trial 167 finished with value: -0.45935830431447017 and parameters: {'scalers': 'robust', 'ratios': 'log_ratio', 'imputers': 'median', 'n_estimators': 2750, 'learning_rate': 0.3591885835628706, 'max_depth': 11, 'min_child_weight': 1, 'subsample': 0.9, 'colsample_bytree': 0.6, 'colsample_bylevel': 0.9, 'reg_alpha': 0.11785038262548007, 'reg_lambda': 21.891417615384423, 'gamma': 0.01513253654697209}. Best is trial 155 with value: -0.5760744995970664.
[I 2026-07-14 18:26:08,162] Trial 168 finished with value: -0.4792582650715344 and parameters: {'scalers': 'robust', 'ratios': 'log_ratio', 'imputers': 'median', 'n_estimators': 2750, 'learning_rate': 0.3986225959838752, 'max_depth': 12, 'min_child_weight': 1, 'subsample': 0.9, 'colsample_bytree': 0.7, 'colsample_bylevel': 0.9, 'reg_alpha': 0.14098895364339317, 'reg_lambda': 20.17812160289529, 'gamma': 0.016004335598014834}. Best is trial 155 with value: -0.5760744995970664.
[I 2026-07-14 18:27:18,625] Trial 169 finished with value: -0.4711961881925446 and parameters: {'scalers': 'robust', 'ratios': 'log_ratio', 'imputers': 'median', 'n_estimators': 2750, 'learning_rate': 0.3902103321312661, 'max_depth': 12, 'min_child_weight': 1, 'subsample': 0.9, 'colsample_bytree': 0.7, 'colsample_bylevel': 0.9, 'reg_alpha': 0.9433221839533542, 'reg_lambda': 19.29269321581496, 'gamma': 0.01443592018186794}. Best is trial 155 with value: -0.5760744995970664.
[I 2026-07-14 18:28:21,558] Trial 170 finished with value: -0.46134529488787773 and parameters: {'scalers': 'robust', 'ratios': 'log_ratio', 'imputers': 'median', 'n_estimators': 2650, 'learning_rate': 0.38476450485607444, 'max_depth': 12, 'min_child_weight': 1, 'subsample': 0.9, 'colsample_bytree': 0.7, 'colsample_bylevel': 0.9, 'reg_alpha': 1.0139135019523282, 'reg_lambda': 18.64497244903192, 'gamma': 0.015598732180668148}. Best is trial 155 with value: -0.5760744995970664.
[I 2026-07-14 18:29:14,958] Trial 171 finished with value: -0.4711307875265535 and parameters: {'scalers': 'standard', 'ratios': 'log_ratio', 'imputers': 'median', 'n_estimators': 2650, 'learning_rate': 0.38512342401759925, 'max_depth': 12, 'min_child_weight': 1, 'subsample': 0.9, 'colsample_bytree': 0.6, 'colsample_bylevel': 0.9, 'reg_alpha': 0.1466709429216888, 'reg_lambda': 20.202262485604223, 'gamma': 0.018447918245693144}. Best is trial 155 with value: -0.5760744995970664.
[I 2026-07-14 18:30:11,215] Trial 172 finished with value: -0.38428350456799953 and parameters: {'scalers': 'standard', 'ratios': 'log_ratio', 'imputers': 'median', 'n_estimators': 2800, 'learning_rate': 0.35104312824239453, 'max_depth': 11, 'min_child_weight': 1, 'subsample': 0.9, 'colsample_bytree': 0.6, 'colsample_bylevel': 0.9, 'reg_alpha': 1.0200917651622348, 'reg_lambda': 21.13563335410335, 'gamma': 0.026878092345688817}. Best is trial 155 with value: -0.5760744995970664.
[I 2026-07-14 18:31:05,190] Trial 173 finished with value: -0.3315151492199983 and parameters: {'scalers': 'robust', 'ratios': 'log_ratio', 'imputers': 'median', 'n_estimators': 2650, 'learning_rate': 0.38908145413190093, 'max_depth': 11, 'min_child_weight': 1, 'subsample': 0.9, 'colsample_bytree': 0.7, 'colsample_bylevel': 0.9, 'reg_alpha': 2.27552340516989, 'reg_lambda': 21.79714496975939, 'gamma': 0.027753484920394065}. Best is trial 155 with value: -0.5760744995970664.
[I 2026-07-14 18:32:03,237] Trial 174 finished with value: -0.40545784443622873 and parameters: {'scalers': 'robust', 'ratios': 'log_ratio', 'imputers': 'median', 'n_estimators': 2650, 'learning_rate': 0.38747524739912825, 'max_depth': 11, 'min_child_weight': 1, 'subsample': 0.9, 'colsample_bytree': 0.6, 'colsample_bylevel': 0.9, 'reg_alpha': 0.02816367485414528, 'reg_lambda': 21.720495761245346, 'gamma': 0.03420152493708349}. Best is trial 155 with value: -0.5760744995970664.
[I 2026-07-14 18:33:06,802] Trial 175 finished with value: -0.43909728981582746 and parameters: {'scalers': 'robust', 'ratios': 'log_ratio', 'imputers': 'median', 'n_estimators': 2650, 'learning_rate': 0.3806806752918445, 'max_depth': 11, 'min_child_weight': 1, 'subsample': 0.9, 'colsample_bytree': 0.6, 'colsample_bylevel': 0.9, 'reg_alpha': 7.355647887679273e-06, 'reg_lambda': 17.60995656272158, 'gamma': 0.027826355643285137}. Best is trial 155 with value: -0.5760744995970664.
[I 2026-07-14 18:34:10,702] Trial 176 finished with value: -0.4383245462348815 and parameters: {'scalers': 'robust', 'ratios': 'log_ratio', 'imputers': 'median', 'n_estimators': 2650, 'learning_rate': 0.390182900708991, 'max_depth': 11, 'min_child_weight': 1, 'subsample': 0.9, 'colsample_bytree': 0.7, 'colsample_bylevel': 0.8, 'reg_alpha': 0.052148976371759616, 'reg_lambda': 20.596374716081986, 'gamma': 0.026730884024574134}. Best is trial 155 with value: -0.5760744995970664.
[I 2026-07-14 18:35:16,373] Trial 177 finished with value: -0.44826941738216175 and parameters: {'scalers': 'robust', 'ratios': 'log_ratio', 'imputers': 'median', 'n_estimators': 2600, 'learning_rate': 0.4091220953623018, 'max_depth': 11, 'min_child_weight': 1, 'subsample': 0.9, 'colsample_bytree': 0.7, 'colsample_bylevel': 0.9, 'reg_alpha': 0.14937828016894217, 'reg_lambda': 18.106888169737864, 'gamma': 0.024872990325735412}. Best is trial 155 with value: -0.5760744995970664.
[I 2026-07-14 18:36:21,583] Trial 178 finished with value: -0.4312885393175398 and parameters: {'scalers': 'robust', 'ratios': 'log_ratio', 'imputers': 'median', 'n_estimators': 2650, 'learning_rate': 0.39454076813301814, 'max_depth': 11, 'min_child_weight': 1, 'subsample': 0.9, 'colsample_bytree': 0.7, 'colsample_bylevel': 0.9, 'reg_alpha': 0.051405812675532576, 'reg_lambda': 20.212559607053812, 'gamma': 0.03056788328574606}. Best is trial 155 with value: -0.5760744995970664.
[I 2026-07-14 18:37:24,757] Trial 179 finished with value: -0.4387168649666401 and parameters: {'scalers': 'standard', 'ratios': 'log_ratio', 'imputers': 'median', 'n_estimators': 2650, 'learning_rate': 0.406706903347074, 'max_depth': 11, 'min_child_weight': 1, 'subsample': 0.9, 'colsample_bytree': 0.7, 'colsample_bylevel': 0.9, 'reg_alpha': 0.043189562104390816, 'reg_lambda': 20.598824609213274, 'gamma': 0.030474178582505333}. Best is trial 155 with value: -0.5760744995970664.
