[I 2026-07-14 18:25:50,817] Trial 315 finished with value: -0.7173581183728716 and parameters: {'scalers': 'robust', 'ratios': 'log_ratio', 'imputers': 'none', 'n_estimators': 2700, 'learning_rate': 0.2941934656896451, 'max_depth': 12, 'min_child_weight': 1, 'subsample': 0.5, 'colsample_bytree': 1.0, 'colsample_bylevel': 1.0, 'reg_alpha': 1.383183322411183e-06, 'reg_lambda': 47.285639601620375, 'gamma': 0.00011894286903518588}. Best is trial 302 with value: -3.8359939946636867.
[I 2026-07-14 18:27:51,245] Trial 316 finished with value: -0.48228081152175806 and parameters: {'scalers': 'robust', 'ratios': 'log_ratio', 'imputers': 'none', 'n_estimators': 2650, 'learning_rate': 0.29067099903216825, 'max_depth': 12, 'min_child_weight': 1, 'subsample': 0.7, 'colsample_bytree': 1.0, 'colsample_bylevel': 1.0, 'reg_alpha': 1.1891066475212044e-05, 'reg_lambda': 56.62946622465177, 'gamma': 0.00011971747612983255}. Best is trial 302 with value: -3.8359939946636867.
[I 2026-07-14 18:29:36,498] Trial 317 finished with value: -0.7071697532695456 and parameters: {'scalers': 'robust', 'ratios': 'log_ratio', 'imputers': 'none', 'n_estimators': 2700, 'learning_rate': 0.2940244869492417, 'max_depth': 11, 'min_child_weight': 1, 'subsample': 0.5, 'colsample_bytree': 1.0, 'colsample_bylevel': 1.0, 'reg_alpha': 1.0646127316542943e-06, 'reg_lambda': 51.662686320171254, 'gamma': 8.251685442181011e-05}. Best is trial 302 with value: -3.8359939946636867.
[I 2026-07-14 18:30:27,946] Trial 318 finished with value: -0.37196603117715893 and parameters: {'scalers': 'robust', 'ratios': 'norm_ratio', 'imputers': 'mean', 'n_estimators': 2700, 'learning_rate': 0.3143006483960525, 'max_depth': 7, 'min_child_weight': 1, 'subsample': 0.7, 'colsample_bytree': 1.0, 'colsample_bylevel': 1.0, 'reg_alpha': 8.951749416624863e-06, 'reg_lambda': 45.3747880381902, 'gamma': 0.00012120794626687317}. Best is trial 302 with value: -3.8359939946636867.
[I 2026-07-14 18:30:57,654] Trial 319 finished with value: -0.271309061992551 and parameters: {'scalers': 'robust', 'ratios': 'norm_ratio', 'imputers': 'mean', 'n_estimators': 2650, 'learning_rate': 0.29292365021582034, 'max_depth': 7, 'min_child_weight': 1, 'subsample': 0.5, 'colsample_bytree': 1.0, 'colsample_bylevel': 1.0, 'reg_alpha': 3.911735224406437, 'reg_lambda': 44.47622077916406, 'gamma': 8.217307758259268e-05}. Best is trial 302 with value: -3.8359939946636867.
