[I 2026-07-14 20:00:18,939] A new study created in RDB with name: my-study
[I 2026-07-14 20:00:24,481] Trial 2 finished with value: -0.05539072488382238 and parameters: {'scalers': 'standard', 'ratios': 'norm_ratio', 'imputers': 'none', 'n_estimators': 400, 'learning_rate': 0.00025814012773761266, 'max_depth': 9, 'min_child_weight': 10, 'subsample': 0.6, 'colsample_bytree': 0.8, 'colsample_bylevel': 1.0, 'reg_alpha': 0.0003036182441178591, 'reg_lambda': 1.4046227258703554e-06, 'gamma': 0.16916762476193556}. Best is trial 2 with value: -0.05539072488382238.
[I 2026-07-14 20:00:26,122] Trial 0 finished with value: -0.05538108963834115 and parameters: {'scalers': 'none', 'ratios': 'log_ratio', 'imputers': 'none', 'n_estimators': 1350, 'learning_rate': 0.2588598547235578, 'max_depth': 5, 'min_child_weight': 9, 'subsample': 0.8, 'colsample_bytree': 1.0, 'colsample_bylevel': 0.6, 'reg_alpha': 24.269919841324953, 'reg_lambda': 8.79436882977977e-05, 'gamma': 58.068593723818765}. Best is trial 2 with value: -0.05539072488382238.
[I 2026-07-14 20:00:29,697] Trial 1 finished with value: -0.055433386206389025 and parameters: {'scalers': 'robust', 'ratios': 'norm_ratio', 'imputers': 'mean', 'n_estimators': 2550, 'learning_rate': 0.00031003733548345117, 'max_depth': 8, 'min_child_weight': 10, 'subsample': 1.0, 'colsample_bytree': 0.8, 'colsample_bylevel': 0.8, 'reg_alpha': 5.8358744471505934, 'reg_lambda': 3.508956091364902e-06, 'gamma': 0.1435414074466867}. Best is trial 1 with value: -0.055433386206389025.
[I 2026-07-14 20:00:32,028] Trial 6 finished with value: -0.05542305820635789 and parameters: {'scalers': 'robust', 'ratios': 'log_ratio', 'imputers': 'none', 'n_estimators': 1950, 'learning_rate': 0.402981459862604, 'max_depth': 3, 'min_child_weight': 9, 'subsample': 1.0, 'colsample_bytree': 0.5, 'colsample_bylevel': 0.9, 'reg_alpha': 59.96642185835875, 'reg_lambda': 0.004529223572118476, 'gamma': 7.142066453499667e-05}. Best is trial 1 with value: -0.055433386206389025.
[I 2026-07-14 20:00:40,755] Trial 5 finished with value: -0.11436360435469548 and parameters: {'scalers': 'standard', 'ratios': 'norm_ratio', 'imputers': 'mean', 'n_estimators': 1400, 'learning_rate': 0.12114908180225092, 'max_depth': 9, 'min_child_weight': 6, 'subsample': 0.6, 'colsample_bytree': 0.7, 'colsample_bylevel': 1.0, 'reg_alpha': 1.6113112834282773e-05, 'reg_lambda': 43.98323648601742, 'gamma': 1.234979814796702e-05}. Best is trial 5 with value: -0.11436360435469548.
[I 2026-07-14 20:00:48,882] Trial 4 finished with value: -0.0965986206765054 and parameters: {'scalers': 'standard', 'ratios': 'norm_ratio', 'imputers': 'median', 'n_estimators': 2450, 'learning_rate': 0.17555380941674845, 'max_depth': 8, 'min_child_weight': 7, 'subsample': 1.0, 'colsample_bytree': 0.6, 'colsample_bylevel': 0.5, 'reg_alpha': 1.6009129984101697e-05, 'reg_lambda': 0.005914361153124639, 'gamma': 0.06357867956968194}. Best is trial 5 with value: -0.11436360435469548.
[I 2026-07-14 20:00:59,368] Trial 3 finished with value: -0.055437275049111154 and parameters: {'scalers': 'robust', 'ratios': 'norm_ratio', 'imputers': 'none', 'n_estimators': 1250, 'learning_rate': 0.0001505038658822852, 'max_depth': 12, 'min_child_weight': 7, 'subsample': 0.7, 'colsample_bytree': 0.9, 'colsample_bylevel': 0.7, 'reg_alpha': 1.114616810041715e-06, 'reg_lambda': 23.09230563560968, 'gamma': 0.004575413001987485}. Best is trial 5 with value: -0.11436360435469548.
[I 2026-07-14 20:01:14,702] Trial 7 finished with value: -0.07175638084775308 and parameters: {'scalers': 'robust', 'ratios': 'log_ratio', 'imputers': 'median', 'n_estimators': 1250, 'learning_rate': 0.008888647172374711, 'max_depth': 10, 'min_child_weight': 10, 'subsample': 0.8, 'colsample_bytree': 1.0, 'colsample_bylevel': 1.0, 'reg_alpha': 0.05633996149311803, 'reg_lambda': 0.00023322236379855855, 'gamma': 2.3666348260062302e-05}. Best is trial 5 with value: -0.11436360435469548.
[I 2026-07-14 20:01:19,433] Trial 8 finished with value: -0.07596971155842873 and parameters: {'scalers': 'standard', 'ratios': 'log_ratio', 'imputers': 'mean', 'n_estimators': 1150, 'learning_rate': 0.07102978393342371, 'max_depth': 12, 'min_child_weight': 7, 'subsample': 0.7, 'colsample_bytree': 0.7, 'colsample_bylevel': 0.9, 'reg_alpha': 1.3803612651996233, 'reg_lambda': 0.013494924611113044, 'gamma': 0.02563946145377271}. Best is trial 5 with value: -0.11436360435469548.
[I 2026-07-14 20:01:20,912] Trial 9 finished with value: -0.05526231280515312 and parameters: {'scalers': 'none', 'ratios': 'norm_ratio', 'imputers': 'none', 'n_estimators': 450, 'learning_rate': 0.0006580841253619162, 'max_depth': 4, 'min_child_weight': 9, 'subsample': 0.5, 'colsample_bytree': 0.9, 'colsample_bylevel': 0.8, 'reg_alpha': 0.008251946616827266, 'reg_lambda': 87.85142969077306, 'gamma': 9.956893828112572e-05}. Best is trial 5 with value: -0.11436360435469548.
[I 2026-07-14 20:01:26,325] Trial 10 finished with value: -0.07026372011143904 and parameters: {'scalers': 'robust', 'ratios': 'norm_ratio', 'imputers': 'none', 'n_estimators': 1350, 'learning_rate': 0.06835466170119621, 'max_depth': 9, 'min_child_weight': 10, 'subsample': 0.9, 'colsample_bytree': 1.0, 'colsample_bylevel': 0.5, 'reg_alpha': 3.1078763085605523, 'reg_lambda': 0.0005324359575541693, 'gamma': 0.0005503020050860572}. Best is trial 5 with value: -0.11436360435469548.
[I 2026-07-14 20:01:31,955] Trial 11 finished with value: -0.057613914036595895 and parameters: {'scalers': 'none', 'ratios': 'log_ratio', 'imputers': 'median', 'n_estimators': 1150, 'learning_rate': 0.0023329956646731278, 'max_depth': 8, 'min_child_weight': 9, 'subsample': 0.6, 'colsample_bytree': 0.7, 'colsample_bylevel': 0.7, 'reg_alpha': 0.02752282422728151, 'reg_lambda': 0.0007295206161943643, 'gamma': 0.012765010598268171}. Best is trial 5 with value: -0.11436360435469548.
[I 2026-07-14 20:01:43,232] Trial 12 finished with value: -0.08092083752420325 and parameters: {'scalers': 'none', 'ratios': 'norm_ratio', 'imputers': 'mean', 'n_estimators': 2600, 'learning_rate': 0.038606810904016305, 'max_depth': 8, 'min_child_weight': 10, 'subsample': 0.6, 'colsample_bytree': 0.6, 'colsample_bylevel': 1.0, 'reg_alpha': 0.10382763776749906, 'reg_lambda': 0.0009537459743917199, 'gamma': 0.040231624319305506}. Best is trial 5 with value: -0.11436360435469548.
[I 2026-07-14 20:01:46,051] Trial 13 finished with value: -0.05539834627124461 and parameters: {'scalers': 'standard', 'ratios': 'log_ratio', 'imputers': 'none', 'n_estimators': 2850, 'learning_rate': 0.00855599528654628, 'max_depth': 6, 'min_child_weight': 3, 'subsample': 0.5, 'colsample_bytree': 0.7, 'colsample_bylevel': 0.8, 'reg_alpha': 0.014113417340833727, 'reg_lambda': 0.024997561509531783, 'gamma': 1.5314012168116549}. Best is trial 5 with value: -0.11436360435469548.
[I 2026-07-14 20:01:51,489] Trial 14 finished with value: -0.05651230913351815 and parameters: {'scalers': 'robust', 'ratios': 'log_ratio', 'imputers': 'none', 'n_estimators': 500, 'learning_rate': 0.002447893110802253, 'max_depth': 11, 'min_child_weight': 3, 'subsample': 0.8, 'colsample_bytree': 0.7, 'colsample_bylevel': 0.8, 'reg_alpha': 0.03043245730568557, 'reg_lambda': 3.473499516483841, 'gamma': 2.614261147574865e-05}. Best is trial 5 with value: -0.11436360435469548.
[I 2026-07-14 20:01:52,733] Trial 15 finished with value: -0.055421191012634714 and parameters: {'scalers': 'robust', 'ratios': 'log_ratio', 'imputers': 'median', 'n_estimators': 1250, 'learning_rate': 0.00014223214346469062, 'max_depth': 8, 'min_child_weight': 7, 'subsample': 0.9, 'colsample_bytree': 0.8, 'colsample_bylevel': 0.6, 'reg_alpha': 3.74514393092472e-06, 'reg_lambda': 1.1536083869835369e-05, 'gamma': 98.95429136847808}. Best is trial 5 with value: -0.11436360435469548.
[I 2026-07-14 20:01:56,313] Trial 16 finished with value: -0.05540368839134262 and parameters: {'scalers': 'none', 'ratios': 'norm_ratio', 'imputers': 'median', 'n_estimators': 2950, 'learning_rate': 0.00193513870992693, 'max_depth': 3, 'min_child_weight': 4, 'subsample': 0.8, 'colsample_bytree': 0.7, 'colsample_bylevel': 1.0, 'reg_alpha': 89.68990201567613, 'reg_lambda': 6.720729578903949e-06, 'gamma': 5.350874856620605e-05}. Best is trial 5 with value: -0.11436360435469548.
[I 2026-07-14 20:01:58,219] Trial 17 finished with value: -0.05540640369143134 and parameters: {'scalers': 'standard', 'ratios': 'norm_ratio', 'imputers': 'mean', 'n_estimators': 2100, 'learning_rate': 0.010469915759634733, 'max_depth': 6, 'min_child_weight': 1, 'subsample': 0.5, 'colsample_bytree': 0.5, 'colsample_bylevel': 0.5, 'reg_alpha': 0.0017484084895674626, 'reg_lambda': 4.08099074590293, 'gamma': 52.33703190828714}. Best is trial 5 with value: -0.11436360435469548.
[I 2026-07-14 20:02:06,294] Trial 18 finished with value: -0.08279245603001371 and parameters: {'scalers': 'standard', 'ratios': 'norm_ratio', 'imputers': 'median', 'n_estimators': 2750, 'learning_rate': 0.023018130189335156, 'max_depth': 7, 'min_child_weight': 4, 'subsample': 0.5, 'colsample_bytree': 0.6, 'colsample_bylevel': 0.5, 'reg_alpha': 8.975433967791843e-06, 'reg_lambda': 0.6709683049980065, 'gamma': 2.056738717021902e-06}. Best is trial 5 with value: -0.11436360435469548.
[I 2026-07-14 20:02:08,999] Trial 19 finished with value: -0.05539308619951908 and parameters: {'scalers': 'standard', 'ratios': 'norm_ratio', 'imputers': 'median', 'n_estimators': 3000, 'learning_rate': 0.036943731976450594, 'max_depth': 6, 'min_child_weight': 3, 'subsample': 0.5, 'colsample_bytree': 0.5, 'colsample_bylevel': 0.5, 'reg_alpha': 7.426640248493285e-06, 'reg_lambda': 0.9664878112568991, 'gamma': 11.147427943687061}. Best is trial 5 with value: -0.11436360435469548.
[I 2026-07-14 20:02:14,823] Trial 20 finished with value: -0.07044294499797531 and parameters: {'scalers': 'standard', 'ratios': 'norm_ratio', 'imputers': 'median', 'n_estimators': 2000, 'learning_rate': 0.02842385860469307, 'max_depth': 6, 'min_child_weight': 4, 'subsample': 0.9, 'colsample_bytree': 0.5, 'colsample_bylevel': 0.5, 'reg_alpha': 5.802630535311147e-06, 'reg_lambda': 1.1856816692086674, 'gamma': 1.3690880705025193e-06}. Best is trial 5 with value: -0.11436360435469548.
[I 2026-07-14 20:02:20,568] Trial 21 finished with value: -0.09957968416407688 and parameters: {'scalers': 'standard', 'ratios': 'norm_ratio', 'imputers': 'median', 'n_estimators': 1950, 'learning_rate': 0.15510584826290263, 'max_depth': 6, 'min_child_weight': 5, 'subsample': 0.9, 'colsample_bytree': 0.5, 'colsample_bylevel': 0.5, 'reg_alpha': 7.63527334159716e-06, 'reg_lambda': 1.5507423514074645, 'gamma': 1.4178378737994365e-06}. Best is trial 5 with value: -0.11436360435469548.
[I 2026-07-14 20:02:26,130] Trial 22 finished with value: -0.09566999082781426 and parameters: {'scalers': 'standard', 'ratios': 'norm_ratio', 'imputers': 'median', 'n_estimators': 1950, 'learning_rate': 0.16192638819616276, 'max_depth': 6, 'min_child_weight': 5, 'subsample': 0.9, 'colsample_bytree': 0.5, 'colsample_bylevel': 0.5, 'reg_alpha': 1.1597891243771188e-05, 'reg_lambda': 0.4533797051287898, 'gamma': 2.0063082848853965e-06}. Best is trial 5 with value: -0.11436360435469548.
[I 2026-07-14 20:02:31,782] Trial 23 finished with value: -0.0982524101489599 and parameters: {'scalers': 'standard', 'ratios': 'norm_ratio', 'imputers': 'median', 'n_estimators': 1950, 'learning_rate': 0.17238799462809912, 'max_depth': 6, 'min_child_weight': 5, 'subsample': 0.9, 'colsample_bytree': 0.5, 'colsample_bylevel': 0.5, 'reg_alpha': 3.0697497971425327e-05, 'reg_lambda': 0.39023068254295645, 'gamma': 1.8736147980556052e-06}. Best is trial 5 with value: -0.11436360435469548.
[I 2026-07-14 20:02:37,460] Trial 24 finished with value: -0.09391831881528018 and parameters: {'scalers': 'standard', 'ratios': 'norm_ratio', 'imputers': 'mean', 'n_estimators': 1950, 'learning_rate': 0.1517547762692358, 'max_depth': 6, 'min_child_weight': 5, 'subsample': 0.9, 'colsample_bytree': 0.5, 'colsample_bylevel': 0.5, 'reg_alpha': 2.919938232376809e-05, 'reg_lambda': 0.26292450562377023, 'gamma': 1.3012748430899706e-06}. Best is trial 5 with value: -0.11436360435469548.
[I 2026-07-14 20:02:45,011] Trial 25 finished with value: -0.10866468865585018 and parameters: {'scalers': 'standard', 'ratios': 'norm_ratio', 'imputers': 'median', 'n_estimators': 1950, 'learning_rate': 0.17543994128759732, 'max_depth': 7, 'min_child_weight': 5, 'subsample': 0.9, 'colsample_bytree': 0.6, 'colsample_bylevel': 0.6, 'reg_alpha': 3.831979809525296e-05, 'reg_lambda': 0.18163065393802227, 'gamma': 1.2732258544902145e-06}. Best is trial 5 with value: -0.11436360435469548.
[I 2026-07-14 20:02:47,253] Trial 26 finished with value: -0.05539277007435109 and parameters: {'scalers': 'standard', 'ratios': 'norm_ratio', 'imputers': 'mean', 'n_estimators': 1900, 'learning_rate': 0.16070579582259098, 'max_depth': 10, 'min_child_weight': 6, 'subsample': 0.9, 'colsample_bytree': 0.6, 'colsample_bylevel': 0.6, 'reg_alpha': 6.464148062917245e-05, 'reg_lambda': 0.16657512285876638, 'gamma': 1.5521421689740835}. Best is trial 5 with value: -0.11436360435469548.
[I 2026-07-14 20:02:59,186] Trial 27 finished with value: -0.12661564536885056 and parameters: {'scalers': 'standard', 'ratios': 'norm_ratio', 'imputers': 'mean', 'n_estimators': 1850, 'learning_rate': 0.15151985211184005, 'max_depth': 10, 'min_child_weight': 6, 'subsample': 0.9, 'colsample_bytree': 0.6, 'colsample_bylevel': 0.6, 'reg_alpha': 9.713513880076268e-05, 'reg_lambda': 0.4231012114113766, 'gamma': 2.2107932830284166e-06}. Best is trial 27 with value: -0.12661564536885056.
[I 2026-07-14 20:03:07,677] Trial 28 finished with value: -0.1164060681662899 and parameters: {'scalers': 'standard', 'ratios': 'norm_ratio', 'imputers': 'median', 'n_estimators': 2300, 'learning_rate': 0.16784663665356508, 'max_depth': 7, 'min_child_weight': 6, 'subsample': 0.7, 'colsample_bytree': 0.6, 'colsample_bylevel': 0.6, 'reg_alpha': 7.0116966684316e-05, 'reg_lambda': 0.20081701309594382, 'gamma': 1.119251287728877e-06}. Best is trial 27 with value: -0.12661564536885056.
[I 2026-07-14 20:03:17,726] Trial 29 finished with value: -0.12048284664631102 and parameters: {'scalers': 'standard', 'ratios': 'norm_ratio', 'imputers': 'mean', 'n_estimators': 1700, 'learning_rate': 0.18507431979475455, 'max_depth': 10, 'min_child_weight': 6, 'subsample': 1.0, 'colsample_bytree': 0.6, 'colsample_bylevel': 0.6, 'reg_alpha': 5.445147169457196e-05, 'reg_lambda': 0.21676077837460242, 'gamma': 4.3957313222576725e-06}. Best is trial 27 with value: -0.12661564536885056.
[I 2026-07-14 20:03:28,105] Trial 30 finished with value: -0.11102122874787021 and parameters: {'scalers': 'standard', 'ratios': 'norm_ratio', 'imputers': 'mean', 'n_estimators': 1650, 'learning_rate': 0.13137365219910913, 'max_depth': 10, 'min_child_weight': 6, 'subsample': 1.0, 'colsample_bytree': 0.6, 'colsample_bylevel': 0.6, 'reg_alpha': 7.092697605103987e-05, 'reg_lambda': 0.11452536734175102, 'gamma': 0.0011548434813704888}. Best is trial 27 with value: -0.12661564536885056.
[I 2026-07-14 20:03:31,563] Trial 31 finished with value: -0.071684895391474 and parameters: {'scalers': 'standard', 'ratios': 'norm_ratio', 'imputers': 'mean', 'n_estimators': 1600, 'learning_rate': 0.11304605913679124, 'max_depth': 4, 'min_child_weight': 6, 'subsample': 0.7, 'colsample_bytree': 0.6, 'colsample_bylevel': 0.6, 'reg_alpha': 9.811714492288176e-05, 'reg_lambda': 0.2279753945037403, 'gamma': 7.5535003934907334e-06}. Best is trial 27 with value: -0.12661564536885056.
[I 2026-07-14 20:03:35,020] Trial 32 finished with value: -0.07014113678518077 and parameters: {'scalers': 'standard', 'ratios': 'norm_ratio', 'imputers': 'mean', 'n_estimators': 1600, 'learning_rate': 0.09560941210551223, 'max_depth': 4, 'min_child_weight': 6, 'subsample': 0.7, 'colsample_bytree': 0.6, 'colsample_bylevel': 0.6, 'reg_alpha': 9.392519718737277e-05, 'reg_lambda': 0.09205131929306715, 'gamma': 8.710260358221005e-06}. Best is trial 27 with value: -0.12661564536885056.
[I 2026-07-14 20:03:45,847] Trial 33 finished with value: -0.1964220490593926 and parameters: {'scalers': 'standard', 'ratios': 'norm_ratio', 'imputers': 'mean', 'n_estimators': 1650, 'learning_rate': 0.41665963843752335, 'max_depth': 10, 'min_child_weight': 6, 'subsample': 0.7, 'colsample_bytree': 0.6, 'colsample_bylevel': 0.6, 'reg_alpha': 0.00015542330009030663, 'reg_lambda': 13.643780244446873, 'gamma': 1.0764943682878323e-05}. Best is trial 33 with value: -0.1964220490593926.
[I 2026-07-14 20:03:53,709] Trial 34 finished with value: -0.1714047944946559 and parameters: {'scalers': 'standard', 'ratios': 'norm_ratio', 'imputers': 'mean', 'n_estimators': 1650, 'learning_rate': 0.40625814688220446, 'max_depth': 7, 'min_child_weight': 6, 'subsample': 0.7, 'colsample_bytree': 0.6, 'colsample_bylevel': 0.7, 'reg_alpha': 0.0005452934033425913, 'reg_lambda': 16.78382000659246, 'gamma': 1.2283894228870142e-05}. Best is trial 33 with value: -0.1964220490593926.
[I 2026-07-14 20:04:03,878] Trial 35 finished with value: -0.18242135592406736 and parameters: {'scalers': 'standard', 'ratios': 'norm_ratio', 'imputers': 'mean', 'n_estimators': 1550, 'learning_rate': 0.4622894325400584, 'max_depth': 10, 'min_child_weight': 6, 'subsample': 0.7, 'colsample_bytree': 0.6, 'colsample_bylevel': 0.7, 'reg_alpha': 0.00019535322405706462, 'reg_lambda': 0.043721779183842395, 'gamma': 8.920129781547989e-06}. Best is trial 33 with value: -0.1964220490593926.
[I 2026-07-14 20:04:14,127] Trial 36 finished with value: -0.16117885292511394 and parameters: {'scalers': 'standard', 'ratios': 'norm_ratio', 'imputers': 'mean', 'n_estimators': 1600, 'learning_rate': 0.3668521885101159, 'max_depth': 10, 'min_child_weight': 8, 'subsample': 0.7, 'colsample_bytree': 0.6, 'colsample_bylevel': 0.7, 'reg_alpha': 0.0003528614523045263, 'reg_lambda': 18.152126376402972, 'gamma': 1.1983280371667587e-05}. Best is trial 33 with value: -0.1964220490593926.
[I 2026-07-14 20:04:30,247] Trial 37 finished with value: -0.17279817990036864 and parameters: {'scalers': 'standard', 'ratios': 'norm_ratio', 'imputers': 'mean', 'n_estimators': 2300, 'learning_rate': 0.4301529942544484, 'max_depth': 11, 'min_child_weight': 8, 'subsample': 0.7, 'colsample_bytree': 0.6, 'colsample_bylevel': 0.7, 'reg_alpha': 0.00022651205595814676, 'reg_lambda': 0.02390131516708529, 'gamma': 8.091457047628308e-06}. Best is trial 33 with value: -0.1964220490593926.
[I 2026-07-14 20:04:42,776] Trial 38 finished with value: -0.2106275776719057 and parameters: {'scalers': 'standard', 'ratios': 'norm_ratio', 'imputers': 'mean', 'n_estimators': 1650, 'learning_rate': 0.49580129503448095, 'max_depth': 11, 'min_child_weight': 6, 'subsample': 0.7, 'colsample_bytree': 0.6, 'colsample_bylevel': 0.7, 'reg_alpha': 0.0002988278417263221, 'reg_lambda': 13.80094267083102, 'gamma': 1.0232686560198497e-05}. Best is trial 38 with value: -0.2106275776719057.
[I 2026-07-14 20:04:58,637] Trial 39 finished with value: -0.19382601039429798 and parameters: {'scalers': 'standard', 'ratios': 'norm_ratio', 'imputers': 'mean', 'n_estimators': 2350, 'learning_rate': 0.46108965008486247, 'max_depth': 11, 'min_child_weight': 8, 'subsample': 0.6, 'colsample_bytree': 0.7, 'colsample_bylevel': 0.7, 'reg_alpha': 0.0004676442800124225, 'reg_lambda': 12.017199081319403, 'gamma': 9.472077710417293e-06}. Best is trial 38 with value: -0.2106275776719057.
[I 2026-07-14 20:05:04,240] Trial 40 finished with value: -0.16302527580635526 and parameters: {'scalers': 'standard', 'ratios': 'norm_ratio', 'imputers': 'mean', 'n_estimators': 800, 'learning_rate': 0.4567304878721259, 'max_depth': 11, 'min_child_weight': 8, 'subsample': 0.6, 'colsample_bytree': 0.7, 'colsample_bylevel': 0.7, 'reg_alpha': 0.0006364525805327598, 'reg_lambda': 7.816650869910007, 'gamma': 6.213250315690815e-06}. Best is trial 38 with value: -0.2106275776719057.
[I 2026-07-14 20:05:19,305] Trial 41 finished with value: -0.14352297426733512 and parameters: {'scalers': 'standard', 'ratios': 'norm_ratio', 'imputers': 'mean', 'n_estimators': 2400, 'learning_rate': 0.4836056628110469, 'max_depth': 11, 'min_child_weight': 8, 'subsample': 1.0, 'colsample_bytree': 0.6, 'colsample_bylevel': 0.7, 'reg_alpha': 0.0006172143434545835, 'reg_lambda': 11.144225293417215, 'gamma': 0.00021945510175380966}. Best is trial 38 with value: -0.2106275776719057.
[I 2026-07-14 20:05:24,875] Trial 42 finished with value: -0.12672062207089765 and parameters: {'scalers': 'standard', 'ratios': 'norm_ratio', 'imputers': 'mean', 'n_estimators': 800, 'learning_rate': 0.4512358753807534, 'max_depth': 11, 'min_child_weight': 8, 'subsample': 1.0, 'colsample_bytree': 0.6, 'colsample_bylevel': 0.7, 'reg_alpha': 0.0006047333756548951, 'reg_lambda': 13.483548853587504, 'gamma': 0.00015503050477206585}. Best is trial 38 with value: -0.2106275776719057.
[I 2026-07-14 20:05:31,373] Trial 43 finished with value: -0.16718863084912167 and parameters: {'scalers': 'standard', 'ratios': 'norm_ratio', 'imputers': 'mean', 'n_estimators': 950, 'learning_rate': 0.45312689155207836, 'max_depth': 11, 'min_child_weight': 8, 'subsample': 0.6, 'colsample_bytree': 0.7, 'colsample_bylevel': 0.7, 'reg_alpha': 0.0006502010123806479, 'reg_lambda': 12.48003721845624, 'gamma': 0.00023854812062301968}. Best is trial 38 with value: -0.2106275776719057.
[I 2026-07-14 20:05:38,075] Trial 44 finished with value: -0.16995565608268517 and parameters: {'scalers': 'standard', 'ratios': 'norm_ratio', 'imputers': 'mean', 'n_estimators': 850, 'learning_rate': 0.4928719618099802, 'max_depth': 11, 'min_child_weight': 8, 'subsample': 0.6, 'colsample_bytree': 0.8, 'colsample_bylevel': 0.7, 'reg_alpha': 0.0005874979167596508, 'reg_lambda': 11.81295032639985, 'gamma': 0.00019237219529970456}. Best is trial 38 with value: -0.2106275776719057.
