[I 2026-07-14 22:07:58,780] Trial 314 finished with value: -0.15234660290210233 and parameters: {'scalers': 'standard', 'ratios': 'norm_ratio', 'imputers': 'median', 'n_estimators': 2950, 'learning_rate': 0.30214440519451874, 'max_depth': 12, 'min_child_weight': 1, 'subsample': 0.9, 'colsample_bytree': 0.6, 'colsample_bylevel': 0.6, 'reg_alpha': 0.9381569671790774, 'reg_lambda': 0.0008512743700596517, 'gamma': 0.00012114330201995515}. Best is trial 231 with value: -0.16552329325872672.
[I 2026-07-14 22:08:32,732] Trial 315 finished with value: -0.15241727317804601 and parameters: {'scalers': 'standard', 'ratios': 'norm_ratio', 'imputers': 'median', 'n_estimators': 2950, 'learning_rate': 0.3044237179352759, 'max_depth': 12, 'min_child_weight': 1, 'subsample': 0.9, 'colsample_bytree': 0.6, 'colsample_bylevel': 0.6, 'reg_alpha': 1.03426167860583, 'reg_lambda': 0.00018798277831713273, 'gamma': 2.1468005448618267e-05}. Best is trial 231 with value: -0.16552329325872672.
[I 2026-07-14 22:09:09,232] Trial 316 finished with value: -0.1567881500225945 and parameters: {'scalers': 'standard', 'ratios': 'norm_ratio', 'imputers': 'median', 'n_estimators': 2950, 'learning_rate': 0.3043557036238857, 'max_depth': 12, 'min_child_weight': 1, 'subsample': 0.9, 'colsample_bytree': 0.6, 'colsample_bylevel': 0.6, 'reg_alpha': 0.9242059719480272, 'reg_lambda': 0.00018675653446306568, 'gamma': 2.2713327470281175e-05}. Best is trial 231 with value: -0.16552329325872672.
[I 2026-07-14 22:09:45,585] Trial 317 finished with value: -0.15307934968200618 and parameters: {'scalers': 'standard', 'ratios': 'norm_ratio', 'imputers': 'median', 'n_estimators': 2950, 'learning_rate': 0.3003922748305434, 'max_depth': 12, 'min_child_weight': 1, 'subsample': 0.9, 'colsample_bytree': 0.6, 'colsample_bylevel': 0.6, 'reg_alpha': 0.9380976360252635, 'reg_lambda': 0.00010290474039045069, 'gamma': 2.1804611229693127e-05}. Best is trial 231 with value: -0.16552329325872672.
[I 2026-07-14 22:10:20,964] Trial 318 finished with value: -0.14879562018336928 and parameters: {'scalers': 'standard', 'ratios': 'norm_ratio', 'imputers': 'median', 'n_estimators': 2950, 'learning_rate': 0.27782285643095644, 'max_depth': 12, 'min_child_weight': 1, 'subsample': 0.9, 'colsample_bytree': 0.6, 'colsample_bylevel': 0.6, 'reg_alpha': 0.9426284214050406, 'reg_lambda': 9.689028018828593e-05, 'gamma': 2.1226763146092096e-05}. Best is trial 231 with value: -0.16552329325872672.
[I 2026-07-14 22:10:52,030] Trial 319 finished with value: -0.1454802173986179 and parameters: {'scalers': 'standard', 'ratios': 'norm_ratio', 'imputers': 'median', 'n_estimators': 2950, 'learning_rate': 0.26083138761497054, 'max_depth': 12, 'min_child_weight': 1, 'subsample': 0.9, 'colsample_bytree': 0.6, 'colsample_bylevel': 0.6, 'reg_alpha': 1.0613625024935829, 'reg_lambda': 0.00010383880783150372, 'gamma': 1.1894959725017074e-05}. Best is trial 231 with value: -0.16552329325872672.
