[I 2026-07-14 18:55:35,735] Trial 315 finished with value: -0.6903072556202541 and parameters: {'scalers': 'robust', 'ratios': 'log_ratio', 'imputers': 'mean', 'n_estimators': 2900, 'learning_rate': 0.4115545455450759, 'max_depth': 11, 'min_child_weight': 1, 'subsample': 0.5, 'colsample_bytree': 0.5, 'colsample_bylevel': 0.6, 'reg_alpha': 3.3674351022969775, 'reg_lambda': 2.8493174169384915e-05, 'gamma': 1.4374720566658059e-06}. Best is trial 294 with value: -1.7803384917759804.
[I 2026-07-14 18:56:10,186] Trial 316 finished with value: -0.802671067578978 and parameters: {'scalers': 'robust', 'ratios': 'log_ratio', 'imputers': 'mean', 'n_estimators': 2900, 'learning_rate': 0.42027870094330533, 'max_depth': 11, 'min_child_weight': 1, 'subsample': 0.5, 'colsample_bytree': 0.5, 'colsample_bylevel': 0.6, 'reg_alpha': 3.0161989254712513, 'reg_lambda': 3.199219313782971e-05, 'gamma': 1.0177102877164278e-06}. Best is trial 294 with value: -1.7803384917759804.
[I 2026-07-14 18:56:36,938] Trial 318 finished with value: -0.1765917919472557 and parameters: {'scalers': 'robust', 'ratios': 'norm_ratio', 'imputers': 'mean', 'n_estimators': 2900, 'learning_rate': 0.41154422359136766, 'max_depth': 11, 'min_child_weight': 1, 'subsample': 0.5, 'colsample_bytree': 0.5, 'colsample_bylevel': 0.6, 'reg_alpha': 55.28413923772684, 'reg_lambda': 8.805496727514423e-05, 'gamma': 1.4147948661278611e-06}. Best is trial 294 with value: -1.7803384917759804.
[I 2026-07-14 18:56:46,779] Trial 317 finished with value: -0.7639145646797708 and parameters: {'scalers': 'robust', 'ratios': 'log_ratio', 'imputers': 'mean', 'n_estimators': 2900, 'learning_rate': 0.4199416782912245, 'max_depth': 11, 'min_child_weight': 1, 'subsample': 0.5, 'colsample_bytree': 0.5, 'colsample_bylevel': 0.6, 'reg_alpha': 2.9336527209170598, 'reg_lambda': 2.6682788749140474e-05, 'gamma': 1.386668215190526e-06}. Best is trial 294 with value: -1.7803384917759804.
[I 2026-07-14 18:57:20,477] Trial 319 finished with value: -0.7223866192552504 and parameters: {'scalers': 'robust', 'ratios': 'norm_ratio', 'imputers': 'mean', 'n_estimators': 2800, 'learning_rate': 0.40515895989949435, 'max_depth': 11, 'min_child_weight': 1, 'subsample': 0.5, 'colsample_bytree': 0.5, 'colsample_bylevel': 0.6, 'reg_alpha': 2.8576856029250783, 'reg_lambda': 8.864861849507081e-05, 'gamma': 1.4926364118924697e-06}. Best is trial 294 with value: -1.7803384917759804.
