[I 2026-07-14 20:30:31,534] Trial 180 finished with value: -0.4842783791387247 and parameters: {'scalers': 'none', 'ratios': 'log_ratio', 'imputers': 'median', 'n_estimators': 2350, 'learning_rate': 0.4977878564003903, 'max_depth': 10, 'min_child_weight': 1, 'subsample': 0.5, 'colsample_bytree': 0.5, 'colsample_bylevel': 0.5, 'reg_alpha': 0.08910760462376854, 'reg_lambda': 0.0004753940994568678, 'gamma': 0.0012381476462253688}. Best is trial 170 with value: -0.522356396541512.
[I 2026-07-14 20:30:41,811] Trial 181 finished with value: -0.450989982202605 and parameters: {'scalers': 'none', 'ratios': 'log_ratio', 'imputers': 'median', 'n_estimators': 2400, 'learning_rate': 0.48173306172746566, 'max_depth': 10, 'min_child_weight': 1, 'subsample': 0.5, 'colsample_bytree': 0.5, 'colsample_bylevel': 0.5, 'reg_alpha': 0.07465709852754544, 'reg_lambda': 0.00046622952736003837, 'gamma': 0.0012170099042379987}. Best is trial 170 with value: -0.522356396541512.
[I 2026-07-14 20:30:52,391] Trial 182 finished with value: -0.4838103842632875 and parameters: {'scalers': 'none', 'ratios': 'log_ratio', 'imputers': 'median', 'n_estimators': 2450, 'learning_rate': 0.4957987865171488, 'max_depth': 10, 'min_child_weight': 1, 'subsample': 0.5, 'colsample_bytree': 0.5, 'colsample_bylevel': 0.5, 'reg_alpha': 0.07867249140737834, 'reg_lambda': 0.0004851794397093753, 'gamma': 0.0012432274596360661}. Best is trial 170 with value: -0.522356396541512.
[I 2026-07-14 20:31:03,205] Trial 183 finished with value: -0.47556469600279716 and parameters: {'scalers': 'none', 'ratios': 'log_ratio', 'imputers': 'median', 'n_estimators': 2450, 'learning_rate': 0.49903399411768307, 'max_depth': 10, 'min_child_weight': 1, 'subsample': 0.5, 'colsample_bytree': 0.5, 'colsample_bylevel': 0.5, 'reg_alpha': 0.09903470923791202, 'reg_lambda': 0.00047739572269071454, 'gamma': 0.0023894655058734286}. Best is trial 170 with value: -0.522356396541512.
[I 2026-07-14 20:31:13,687] Trial 184 finished with value: -0.45091957197538396 and parameters: {'scalers': 'none', 'ratios': 'log_ratio', 'imputers': 'median', 'n_estimators': 2450, 'learning_rate': 0.47777195935006456, 'max_depth': 10, 'min_child_weight': 1, 'subsample': 0.5, 'colsample_bytree': 0.5, 'colsample_bylevel': 0.5, 'reg_alpha': 0.07846151577745825, 'reg_lambda': 0.0004439922551608704, 'gamma': 0.001281585545726743}. Best is trial 170 with value: -0.522356396541512.
[I 2026-07-14 20:31:24,203] Trial 185 finished with value: -0.4566908464892749 and parameters: {'scalers': 'none', 'ratios': 'log_ratio', 'imputers': 'median', 'n_estimators': 2450, 'learning_rate': 0.4727305552534621, 'max_depth': 10, 'min_child_weight': 1, 'subsample': 0.5, 'colsample_bytree': 0.5, 'colsample_bylevel': 0.5, 'reg_alpha': 0.07954586636983477, 'reg_lambda': 0.000490933935103507, 'gamma': 0.002468897712879969}. Best is trial 170 with value: -0.522356396541512.
[I 2026-07-14 20:31:34,548] Trial 186 finished with value: -0.44630073306088996 and parameters: {'scalers': 'none', 'ratios': 'log_ratio', 'imputers': 'median', 'n_estimators': 2450, 'learning_rate': 0.48952696424181197, 'max_depth': 10, 'min_child_weight': 1, 'subsample': 0.5, 'colsample_bytree': 0.5, 'colsample_bylevel': 0.5, 'reg_alpha': 0.0754145049909172, 'reg_lambda': 0.000482405555479038, 'gamma': 0.0013650688627139791}. Best is trial 170 with value: -0.522356396541512.
[I 2026-07-14 20:31:43,192] Trial 187 finished with value: -0.29280682627804405 and parameters: {'scalers': 'none', 'ratios': 'log_ratio', 'imputers': 'median', 'n_estimators': 2450, 'learning_rate': 0.35064211814660184, 'max_depth': 9, 'min_child_weight': 1, 'subsample': 0.5, 'colsample_bytree': 0.5, 'colsample_bylevel': 0.5, 'reg_alpha': 0.07422874953535659, 'reg_lambda': 0.00048720706330257783, 'gamma': 0.001371976938269929}. Best is trial 170 with value: -0.522356396541512.
[I 2026-07-14 20:31:53,474] Trial 188 finished with value: -0.3298349465138881 and parameters: {'scalers': 'none', 'ratios': 'log_ratio', 'imputers': 'median', 'n_estimators': 2450, 'learning_rate': 0.34792001403558853, 'max_depth': 10, 'min_child_weight': 1, 'subsample': 0.5, 'colsample_bytree': 0.5, 'colsample_bylevel': 0.5, 'reg_alpha': 0.07797083387419722, 'reg_lambda': 0.0004996169618204955, 'gamma': 0.001335264251008952}. Best is trial 170 with value: -0.522356396541512.
[I 2026-07-14 20:32:03,879] Trial 189 finished with value: -0.34008164897944254 and parameters: {'scalers': 'none', 'ratios': 'log_ratio', 'imputers': 'median', 'n_estimators': 2450, 'learning_rate': 0.3501438900018654, 'max_depth': 10, 'min_child_weight': 1, 'subsample': 0.5, 'colsample_bytree': 0.5, 'colsample_bylevel': 0.5, 'reg_alpha': 0.08292973219810537, 'reg_lambda': 0.0005590211597858884, 'gamma': 0.0013196972232760698}. Best is trial 170 with value: -0.522356396541512.
[I 2026-07-14 20:32:12,766] Trial 190 finished with value: -0.29678736709039816 and parameters: {'scalers': 'none', 'ratios': 'log_ratio', 'imputers': 'median', 'n_estimators': 2450, 'learning_rate': 0.3534828433131608, 'max_depth': 9, 'min_child_weight': 1, 'subsample': 0.5, 'colsample_bytree': 0.5, 'colsample_bylevel': 0.5, 'reg_alpha': 0.07598314664891126, 'reg_lambda': 0.0005515024574384239, 'gamma': 0.0013523817962522913}. Best is trial 170 with value: -0.522356396541512.
[I 2026-07-14 20:32:21,509] Trial 191 finished with value: -0.2963390951706378 and parameters: {'scalers': 'none', 'ratios': 'log_ratio', 'imputers': 'median', 'n_estimators': 2450, 'learning_rate': 0.34712082289238766, 'max_depth': 9, 'min_child_weight': 1, 'subsample': 0.5, 'colsample_bytree': 0.5, 'colsample_bylevel': 0.5, 'reg_alpha': 0.07688013820227735, 'reg_lambda': 0.0005185602928265785, 'gamma': 0.002400687150865838}. Best is trial 170 with value: -0.522356396541512.
[I 2026-07-14 20:32:30,498] Trial 192 finished with value: -0.2931722761929754 and parameters: {'scalers': 'none', 'ratios': 'log_ratio', 'imputers': 'median', 'n_estimators': 2450, 'learning_rate': 0.3348941250520255, 'max_depth': 9, 'min_child_weight': 1, 'subsample': 0.5, 'colsample_bytree': 0.5, 'colsample_bylevel': 0.5, 'reg_alpha': 0.0834036661076287, 'reg_lambda': 0.0004927475894352201, 'gamma': 0.002469798243380758}. Best is trial 170 with value: -0.522356396541512.
[I 2026-07-14 20:32:39,384] Trial 193 finished with value: -0.29105072072958804 and parameters: {'scalers': 'none', 'ratios': 'log_ratio', 'imputers': 'median', 'n_estimators': 2450, 'learning_rate': 0.3395826752775933, 'max_depth': 9, 'min_child_weight': 1, 'subsample': 0.5, 'colsample_bytree': 0.5, 'colsample_bylevel': 0.5, 'reg_alpha': 0.07456127147191983, 'reg_lambda': 0.0005360418488967427, 'gamma': 0.002337291126097933}. Best is trial 170 with value: -0.522356396541512.
[I 2026-07-14 20:32:48,409] Trial 194 finished with value: -0.290485736287673 and parameters: {'scalers': 'none', 'ratios': 'log_ratio', 'imputers': 'median', 'n_estimators': 2450, 'learning_rate': 0.34572491871707595, 'max_depth': 9, 'min_child_weight': 1, 'subsample': 0.5, 'colsample_bytree': 0.5, 'colsample_bylevel': 0.5, 'reg_alpha': 0.07378453794998621, 'reg_lambda': 0.0005069879522540763, 'gamma': 0.0025667115700534543}. Best is trial 170 with value: -0.522356396541512.
[I 2026-07-14 20:32:57,133] Trial 195 finished with value: -0.27507179002829657 and parameters: {'scalers': 'none', 'ratios': 'log_ratio', 'imputers': 'median', 'n_estimators': 2450, 'learning_rate': 0.347035568269104, 'max_depth': 9, 'min_child_weight': 1, 'subsample': 0.5, 'colsample_bytree': 0.5, 'colsample_bylevel': 0.5, 'reg_alpha': 0.03930773388584175, 'reg_lambda': 0.0011149418402029156, 'gamma': 0.0024156469667746677}. Best is trial 170 with value: -0.522356396541512.
[I 2026-07-14 20:33:08,115] Trial 196 finished with value: -0.2642457179400149 and parameters: {'scalers': 'none', 'ratios': 'log_ratio', 'imputers': 'median', 'n_estimators': 2450, 'learning_rate': 0.3409011571774268, 'max_depth': 9, 'min_child_weight': 1, 'subsample': 0.5, 'colsample_bytree': 0.5, 'colsample_bylevel': 0.5, 'reg_alpha': 0.037066252530438076, 'reg_lambda': 0.0010087063195270347, 'gamma': 0.0025072510707623424}. Best is trial 170 with value: -0.522356396541512.
[I 2026-07-14 20:33:14,426] Trial 197 finished with value: -0.282075421661498 and parameters: {'scalers': 'none', 'ratios': 'log_ratio', 'imputers': 'median', 'n_estimators': 2450, 'learning_rate': 0.3526591783137592, 'max_depth': 9, 'min_child_weight': 1, 'subsample': 0.5, 'colsample_bytree': 0.5, 'colsample_bylevel': 0.5, 'reg_alpha': 0.03521732819555562, 'reg_lambda': 0.0008310197442224171, 'gamma': 0.0024226115398421877}. Best is trial 170 with value: -0.522356396541512.
[I 2026-07-14 20:33:24,422] Trial 198 finished with value: -0.3148901191356516 and parameters: {'scalers': 'none', 'ratios': 'log_ratio', 'imputers': 'median', 'n_estimators': 2400, 'learning_rate': 0.3525527812239046, 'max_depth': 10, 'min_child_weight': 1, 'subsample': 0.5, 'colsample_bytree': 0.5, 'colsample_bylevel': 0.5, 'reg_alpha': 0.02931396866207992, 'reg_lambda': 0.0010392781077468499, 'gamma': 0.0024363365683357117}. Best is trial 170 with value: -0.522356396541512.
[I 2026-07-14 20:33:39,480] Trial 199 finished with value: -0.058818378966268986 and parameters: {'scalers': 'none', 'ratios': 'log_ratio', 'imputers': 'median', 'n_estimators': 2400, 'learning_rate': 0.0009752103404929083, 'max_depth': 10, 'min_child_weight': 1, 'subsample': 0.5, 'colsample_bytree': 0.5, 'colsample_bylevel': 0.5, 'reg_alpha': 0.03472965533746045, 'reg_lambda': 0.0010615654719900503, 'gamma': 0.0028489007810662153}. Best is trial 170 with value: -0.522356396541512.
[I 2026-07-14 20:33:49,500] Trial 200 finished with value: -0.43572795317270613 and parameters: {'scalers': 'none', 'ratios': 'log_ratio', 'imputers': 'median', 'n_estimators': 2400, 'learning_rate': 0.4988956624012283, 'max_depth': 10, 'min_child_weight': 1, 'subsample': 0.5, 'colsample_bytree': 0.5, 'colsample_bylevel': 0.5, 'reg_alpha': 0.03421362155071107, 'reg_lambda': 0.0013659369061698688, 'gamma': 0.003515472523484007}. Best is trial 170 with value: -0.522356396541512.
[I 2026-07-14 20:33:59,506] Trial 201 finished with value: -0.4005601996247189 and parameters: {'scalers': 'none', 'ratios': 'log_ratio', 'imputers': 'median', 'n_estimators': 2400, 'learning_rate': 0.4974737813686451, 'max_depth': 10, 'min_child_weight': 1, 'subsample': 0.5, 'colsample_bytree': 0.5, 'colsample_bylevel': 0.5, 'reg_alpha': 0.035890346627954, 'reg_lambda': 0.0011713030022060585, 'gamma': 0.0034372405993993486}. Best is trial 170 with value: -0.522356396541512.
[I 2026-07-14 20:34:09,578] Trial 202 finished with value: -0.43454519542986647 and parameters: {'scalers': 'none', 'ratios': 'log_ratio', 'imputers': 'median', 'n_estimators': 2400, 'learning_rate': 0.4947528061770391, 'max_depth': 10, 'min_child_weight': 1, 'subsample': 0.5, 'colsample_bytree': 0.5, 'colsample_bylevel': 0.5, 'reg_alpha': 0.038415083998996714, 'reg_lambda': 0.001117115383240508, 'gamma': 0.0031368437948562167}. Best is trial 170 with value: -0.522356396541512.
[I 2026-07-14 20:34:19,581] Trial 203 finished with value: -0.42232672270003724 and parameters: {'scalers': 'none', 'ratios': 'log_ratio', 'imputers': 'median', 'n_estimators': 2400, 'learning_rate': 0.49991568637805256, 'max_depth': 10, 'min_child_weight': 1, 'subsample': 0.5, 'colsample_bytree': 0.5, 'colsample_bylevel': 0.5, 'reg_alpha': 0.02731098491044978, 'reg_lambda': 0.00029365293461827013, 'gamma': 0.0039564901815908595}. Best is trial 170 with value: -0.522356396541512.
[I 2026-07-14 20:34:29,051] Trial 204 finished with value: -0.4229202505401257 and parameters: {'scalers': 'none', 'ratios': 'log_ratio', 'imputers': 'median', 'n_estimators': 2300, 'learning_rate': 0.49950477637016366, 'max_depth': 10, 'min_child_weight': 1, 'subsample': 0.5, 'colsample_bytree': 0.5, 'colsample_bylevel': 0.5, 'reg_alpha': 0.02656123147847238, 'reg_lambda': 0.00030411836007000824, 'gamma': 0.0038746143972513934}. Best is trial 170 with value: -0.522356396541512.
[I 2026-07-14 20:34:38,734] Trial 205 finished with value: -0.44088893967448517 and parameters: {'scalers': 'none', 'ratios': 'log_ratio', 'imputers': 'median', 'n_estimators': 2300, 'learning_rate': 0.49911151101775975, 'max_depth': 10, 'min_child_weight': 1, 'subsample': 0.5, 'colsample_bytree': 0.5, 'colsample_bylevel': 0.5, 'reg_alpha': 0.0551857398131484, 'reg_lambda': 0.00027367904511904504, 'gamma': 0.0039915899978331115}. Best is trial 170 with value: -0.522356396541512.
[I 2026-07-14 20:34:48,226] Trial 206 finished with value: -0.41906811319324305 and parameters: {'scalers': 'none', 'ratios': 'log_ratio', 'imputers': 'median', 'n_estimators': 2300, 'learning_rate': 0.4970004907299744, 'max_depth': 10, 'min_child_weight': 1, 'subsample': 0.5, 'colsample_bytree': 0.5, 'colsample_bylevel': 0.5, 'reg_alpha': 0.05321010450179984, 'reg_lambda': 0.00031222217766914184, 'gamma': 0.0009573041610710429}. Best is trial 170 with value: -0.522356396541512.
[I 2026-07-14 20:34:58,044] Trial 207 finished with value: -0.48305992001369996 and parameters: {'scalers': 'none', 'ratios': 'log_ratio', 'imputers': 'median', 'n_estimators': 2300, 'learning_rate': 0.49005183741009717, 'max_depth': 10, 'min_child_weight': 1, 'subsample': 0.5, 'colsample_bytree': 0.5, 'colsample_bylevel': 0.5, 'reg_alpha': 0.11151263298594564, 'reg_lambda': 0.00033774790667975537, 'gamma': 0.0009215056339375066}. Best is trial 170 with value: -0.522356396541512.
[I 2026-07-14 20:35:07,371] Trial 208 finished with value: -0.4289493901291761 and parameters: {'scalers': 'none', 'ratios': 'log_ratio', 'imputers': 'median', 'n_estimators': 2300, 'learning_rate': 0.4929286515995982, 'max_depth': 10, 'min_child_weight': 1, 'subsample': 0.5, 'colsample_bytree': 0.5, 'colsample_bylevel': 0.5, 'reg_alpha': 0.05135678064940773, 'reg_lambda': 0.00031702730762462965, 'gamma': 0.000904635745163963}. Best is trial 170 with value: -0.522356396541512.
[I 2026-07-14 20:35:16,578] Trial 209 finished with value: -0.3979041521070207 and parameters: {'scalers': 'none', 'ratios': 'log_ratio', 'imputers': 'median', 'n_estimators': 2300, 'learning_rate': 0.48009042887301334, 'max_depth': 10, 'min_child_weight': 1, 'subsample': 0.5, 'colsample_bytree': 0.5, 'colsample_bylevel': 0.5, 'reg_alpha': 0.021593596678762105, 'reg_lambda': 0.0002766058035473167, 'gamma': 0.0009219983247134864}. Best is trial 170 with value: -0.522356396541512.
[I 2026-07-14 20:35:26,577] Trial 210 finished with value: -0.33069962961549526 and parameters: {'scalers': 'none', 'ratios': 'log_ratio', 'imputers': 'median', 'n_estimators': 2500, 'learning_rate': 0.38062817887111233, 'max_depth': 10, 'min_child_weight': 1, 'subsample': 0.5, 'colsample_bytree': 0.5, 'colsample_bylevel': 0.5, 'reg_alpha': 0.047211986235914875, 'reg_lambda': 0.0003180617777492587, 'gamma': 0.0043595912373897905}. Best is trial 170 with value: -0.522356396541512.
[I 2026-07-14 20:35:36,874] Trial 211 finished with value: -0.4566113976828714 and parameters: {'scalers': 'none', 'ratios': 'log_ratio', 'imputers': 'median', 'n_estimators': 2500, 'learning_rate': 0.4962385871579818, 'max_depth': 10, 'min_child_weight': 1, 'subsample': 0.5, 'colsample_bytree': 0.5, 'colsample_bylevel': 0.5, 'reg_alpha': 0.052755321399034, 'reg_lambda': 0.0003012767871648063, 'gamma': 0.004048030222115101}. Best is trial 170 with value: -0.522356396541512.
[I 2026-07-14 20:35:46,908] Trial 212 finished with value: -0.34700339722229645 and parameters: {'scalers': 'none', 'ratios': 'log_ratio', 'imputers': 'median', 'n_estimators': 2500, 'learning_rate': 0.3814200691844499, 'max_depth': 10, 'min_child_weight': 1, 'subsample': 0.5, 'colsample_bytree': 0.5, 'colsample_bylevel': 0.5, 'reg_alpha': 0.054366128156092285, 'reg_lambda': 0.0003050212431940769, 'gamma': 0.004298689649290644}. Best is trial 170 with value: -0.522356396541512.
[I 2026-07-14 20:35:59,484] Trial 213 finished with value: -0.30022552758772586 and parameters: {'scalers': 'none', 'ratios': 'log_ratio', 'imputers': 'median', 'n_estimators': 2500, 'learning_rate': 0.38752327656774654, 'max_depth': 10, 'min_child_weight': 1, 'subsample': 0.5, 'colsample_bytree': 0.5, 'colsample_bylevel': 1.0, 'reg_alpha': 0.016926122058747935, 'reg_lambda': 0.0003226071661379314, 'gamma': 0.0009354237681527512}. Best is trial 170 with value: -0.522356396541512.
[I 2026-07-14 20:36:09,400] Trial 214 finished with value: -0.3424326111205702 and parameters: {'scalers': 'none', 'ratios': 'log_ratio', 'imputers': 'none', 'n_estimators': 2500, 'learning_rate': 0.3881415956147579, 'max_depth': 10, 'min_child_weight': 1, 'subsample': 0.5, 'colsample_bytree': 0.5, 'colsample_bylevel': 0.5, 'reg_alpha': 0.01823540140476163, 'reg_lambda': 0.00033718839988539664, 'gamma': 0.005472652752386419}. Best is trial 170 with value: -0.522356396541512.
[I 2026-07-14 20:36:19,148] Trial 215 finished with value: -0.3261100993563998 and parameters: {'scalers': 'none', 'ratios': 'log_ratio', 'imputers': 'none', 'n_estimators': 2500, 'learning_rate': 0.38044356311185396, 'max_depth': 10, 'min_child_weight': 1, 'subsample': 0.5, 'colsample_bytree': 0.5, 'colsample_bylevel': 0.5, 'reg_alpha': 0.019226029039241244, 'reg_lambda': 0.0014599405425387534, 'gamma': 0.0009129794849871671}. Best is trial 170 with value: -0.522356396541512.
[I 2026-07-14 20:36:29,239] Trial 216 finished with value: -0.3257901721043195 and parameters: {'scalers': 'none', 'ratios': 'log_ratio', 'imputers': 'median', 'n_estimators': 2500, 'learning_rate': 0.3826007365073935, 'max_depth': 10, 'min_child_weight': 1, 'subsample': 0.5, 'colsample_bytree': 0.5, 'colsample_bylevel': 0.5, 'reg_alpha': 0.017385943025814934, 'reg_lambda': 0.0017362040507279443, 'gamma': 0.0008201592827677214}. Best is trial 170 with value: -0.522356396541512.
[I 2026-07-14 20:36:39,645] Trial 217 finished with value: -0.10556746812365651 and parameters: {'scalers': 'none', 'ratios': 'log_ratio', 'imputers': 'median', 'n_estimators': 2500, 'learning_rate': 0.020137225099561278, 'max_depth': 10, 'min_child_weight': 1, 'subsample': 0.5, 'colsample_bytree': 0.5, 'colsample_bylevel': 0.5, 'reg_alpha': 0.05284640452088897, 'reg_lambda': 0.000374174986415314, 'gamma': 0.0008739025651706257}. Best is trial 170 with value: -0.522356396541512.
[I 2026-07-14 20:36:49,910] Trial 218 finished with value: -0.34413218990627625 and parameters: {'scalers': 'none', 'ratios': 'log_ratio', 'imputers': 'none', 'n_estimators': 2500, 'learning_rate': 0.38342841627619795, 'max_depth': 10, 'min_child_weight': 1, 'subsample': 0.5, 'colsample_bytree': 0.5, 'colsample_bylevel': 0.5, 'reg_alpha': 0.05477041165828237, 'reg_lambda': 0.0015862957449025675, 'gamma': 0.001835893715902545}. Best is trial 170 with value: -0.522356396541512.
[I 2026-07-14 20:36:59,887] Trial 219 finished with value: -0.35872571247347484 and parameters: {'scalers': 'none', 'ratios': 'log_ratio', 'imputers': 'median', 'n_estimators': 2500, 'learning_rate': 0.39772485784807343, 'max_depth': 10, 'min_child_weight': 1, 'subsample': 0.5, 'colsample_bytree': 0.5, 'colsample_bylevel': 0.5, 'reg_alpha': 0.014936511851062087, 'reg_lambda': 0.001539343018234265, 'gamma': 0.000824917684333458}. Best is trial 170 with value: -0.522356396541512.
[I 2026-07-14 20:37:10,093] Trial 220 finished with value: -0.1034067095044925 and parameters: {'scalers': 'none', 'ratios': 'log_ratio', 'imputers': 'none', 'n_estimators': 2500, 'learning_rate': 0.017996750597517618, 'max_depth': 10, 'min_child_weight': 1, 'subsample': 0.5, 'colsample_bytree': 0.5, 'colsample_bylevel': 0.5, 'reg_alpha': 0.014196264878250228, 'reg_lambda': 0.0017645550177032515, 'gamma': 0.0007424777561156172}. Best is trial 170 with value: -0.522356396541512.
[I 2026-07-14 20:37:20,281] Trial 221 finished with value: -0.3027968990908513 and parameters: {'scalers': 'none', 'ratios': 'log_ratio', 'imputers': 'median', 'n_estimators': 2400, 'learning_rate': 0.28294335763049694, 'max_depth': 10, 'min_child_weight': 1, 'subsample': 0.5, 'colsample_bytree': 0.5, 'colsample_bylevel': 0.5, 'reg_alpha': 0.10636850505987785, 'reg_lambda': 0.0003754323391532986, 'gamma': 0.0019327380274513255}. Best is trial 170 with value: -0.522356396541512.
[I 2026-07-14 20:37:30,183] Trial 222 finished with value: -0.10720407295419754 and parameters: {'scalers': 'none', 'ratios': 'log_ratio', 'imputers': 'median', 'n_estimators': 2400, 'learning_rate': 0.020108946273615008, 'max_depth': 10, 'min_child_weight': 1, 'subsample': 0.5, 'colsample_bytree': 0.5, 'colsample_bylevel': 0.5, 'reg_alpha': 0.05621643026934189, 'reg_lambda': 0.0007269957787590157, 'gamma': 0.0018337574556333371}. Best is trial 170 with value: -0.522356396541512.
[I 2026-07-14 20:37:39,793] Trial 223 finished with value: -0.2953684637398493 and parameters: {'scalers': 'none', 'ratios': 'log_ratio', 'imputers': 'median', 'n_estimators': 2400, 'learning_rate': 0.2982136532383486, 'max_depth': 10, 'min_child_weight': 1, 'subsample': 0.5, 'colsample_bytree': 0.5, 'colsample_bylevel': 0.5, 'reg_alpha': 0.053442245005129084, 'reg_lambda': 0.0007628469807695007, 'gamma': 0.0018594383952839457}. Best is trial 170 with value: -0.522356396541512.
[I 2026-07-14 20:37:49,702] Trial 224 finished with value: -0.303733986302798 and parameters: {'scalers': 'none', 'ratios': 'log_ratio', 'imputers': 'median', 'n_estimators': 2400, 'learning_rate': 0.287836134154328, 'max_depth': 10, 'min_child_weight': 1, 'subsample': 0.5, 'colsample_bytree': 0.5, 'colsample_bylevel': 0.5, 'reg_alpha': 0.10764844677023386, 'reg_lambda': 0.0007438427789098148, 'gamma': 0.001834553667951702}. Best is trial 170 with value: -0.522356396541512.
