[I 2026-07-14 19:34:49,623] A new study created in RDB with name: my-study
[I 2026-07-14 19:35:00,232] Trial 0 finished with value: -0.04153064560826746 and parameters: {'scalers': 'standard', 'ratios': 'log_ratio', 'imputers': 'mean', 'n_estimators': 2750, 'learning_rate': 0.15993286468935833, 'max_depth': 8, 'min_child_weight': 10, 'subsample': 0.7, 'colsample_bytree': 0.6, 'colsample_bylevel': 0.5, 'reg_alpha': 4.632733683067157, 'reg_lambda': 20.883765818092936, 'gamma': 0.000269613465853742}. Best is trial 0 with value: -0.04153064560826746.
[I 2026-07-14 19:35:04,394] Trial 1 finished with value: -0.03042247481161437 and parameters: {'scalers': 'standard', 'ratios': 'log_ratio', 'imputers': 'none', 'n_estimators': 1100, 'learning_rate': 0.00022473899405123365, 'max_depth': 11, 'min_child_weight': 8, 'subsample': 0.8, 'colsample_bytree': 0.6, 'colsample_bylevel': 1.0, 'reg_alpha': 6.809119673348317, 'reg_lambda': 9.472763880144743, 'gamma': 1.0626586085079846e-05}. Best is trial 0 with value: -0.04153064560826746.
[I 2026-07-14 19:35:06,535] Trial 2 finished with value: -0.03255984195510876 and parameters: {'scalers': 'none', 'ratios': 'log_ratio', 'imputers': 'median', 'n_estimators': 2150, 'learning_rate': 0.00016803352439761409, 'max_depth': 12, 'min_child_weight': 5, 'subsample': 0.6, 'colsample_bytree': 0.5, 'colsample_bylevel': 0.5, 'reg_alpha': 50.76020737688802, 'reg_lambda': 0.041664057484145624, 'gamma': 0.0005066640923217237}. Best is trial 0 with value: -0.04153064560826746.
[I 2026-07-14 19:35:07,686] Trial 3 finished with value: -0.031149127950772987 and parameters: {'scalers': 'robust', 'ratios': 'log_ratio', 'imputers': 'median', 'n_estimators': 650, 'learning_rate': 0.0002806642024247773, 'max_depth': 7, 'min_child_weight': 2, 'subsample': 0.6, 'colsample_bytree': 0.7, 'colsample_bylevel': 0.9, 'reg_alpha': 1.2657132038210799, 'reg_lambda': 0.045585667356566294, 'gamma': 0.6350717006762795}. Best is trial 0 with value: -0.04153064560826746.
[I 2026-07-14 19:35:19,189] Trial 6 finished with value: -0.055604131175461584 and parameters: {'scalers': 'standard', 'ratios': 'norm_ratio', 'imputers': 'mean', 'n_estimators': 1750, 'learning_rate': 0.1993778001507083, 'max_depth': 10, 'min_child_weight': 6, 'subsample': 0.9, 'colsample_bytree': 0.8, 'colsample_bylevel': 0.5, 'reg_alpha': 0.0004218108152503958, 'reg_lambda': 0.015282453977986799, 'gamma': 5.312897647649651e-06}. Best is trial 6 with value: -0.055604131175461584.
[I 2026-07-14 19:35:20,561] Trial 4 finished with value: -0.029762500760340913 and parameters: {'scalers': 'robust', 'ratios': 'log_ratio', 'imputers': 'median', 'n_estimators': 400, 'learning_rate': 0.021853443166336188, 'max_depth': 6, 'min_child_weight': 7, 'subsample': 0.5, 'colsample_bytree': 0.5, 'colsample_bylevel': 0.8, 'reg_alpha': 0.07132874764672245, 'reg_lambda': 2.8260801516385743, 'gamma': 1.9296434093927416e-05}. Best is trial 6 with value: -0.055604131175461584.
[I 2026-07-14 19:35:21,847] Trial 5 finished with value: -0.03188647690731197 and parameters: {'scalers': 'none', 'ratios': 'norm_ratio', 'imputers': 'median', 'n_estimators': 550, 'learning_rate': 0.0001378861134492473, 'max_depth': 5, 'min_child_weight': 7, 'subsample': 1.0, 'colsample_bytree': 0.9, 'colsample_bylevel': 0.8, 'reg_alpha': 0.0034670563418403443, 'reg_lambda': 1.5956333057536907, 'gamma': 0.8292650647813821}. Best is trial 6 with value: -0.055604131175461584.
[I 2026-07-14 19:35:27,316] Trial 7 finished with value: -0.02916156811549967 and parameters: {'scalers': 'none', 'ratios': 'norm_ratio', 'imputers': 'mean', 'n_estimators': 1900, 'learning_rate': 0.019209718567273968, 'max_depth': 4, 'min_child_weight': 8, 'subsample': 1.0, 'colsample_bytree': 0.8, 'colsample_bylevel': 0.6, 'reg_alpha': 0.430242662561574, 'reg_lambda': 4.387357658438976, 'gamma': 2.6252699123318114e-06}. Best is trial 6 with value: -0.055604131175461584.
[I 2026-07-14 19:35:43,350] Trial 8 finished with value: -0.04162454340948736 and parameters: {'scalers': 'robust', 'ratios': 'log_ratio', 'imputers': 'none', 'n_estimators': 1800, 'learning_rate': 0.058644188062410535, 'max_depth': 11, 'min_child_weight': 8, 'subsample': 1.0, 'colsample_bytree': 0.7, 'colsample_bylevel': 1.0, 'reg_alpha': 0.004547568897437565, 'reg_lambda': 2.6275636078375726e-05, 'gamma': 1.6726113571965806e-05}. Best is trial 6 with value: -0.055604131175461584.
[I 2026-07-14 19:35:48,624] Trial 9 finished with value: -0.03172668075330066 and parameters: {'scalers': 'standard', 'ratios': 'norm_ratio', 'imputers': 'none', 'n_estimators': 550, 'learning_rate': 0.00030808157639440923, 'max_depth': 11, 'min_child_weight': 4, 'subsample': 0.7, 'colsample_bytree': 0.8, 'colsample_bylevel': 0.9, 'reg_alpha': 0.0013730796391917268, 'reg_lambda': 2.7249691193358167e-05, 'gamma': 2.2403657945782368e-06}. Best is trial 6 with value: -0.055604131175461584.
[I 2026-07-14 19:35:52,622] Trial 10 finished with value: -0.0290222450016163 and parameters: {'scalers': 'robust', 'ratios': 'log_ratio', 'imputers': 'none', 'n_estimators': 1650, 'learning_rate': 0.014964157121643992, 'max_depth': 4, 'min_child_weight': 3, 'subsample': 0.7, 'colsample_bytree': 0.8, 'colsample_bylevel': 0.6, 'reg_alpha': 2.81579690607486, 'reg_lambda': 0.00010319758986683224, 'gamma': 0.0003978463278175414}. Best is trial 6 with value: -0.055604131175461584.
[I 2026-07-14 19:35:58,634] Trial 11 finished with value: -0.02818830230705185 and parameters: {'scalers': 'none', 'ratios': 'norm_ratio', 'imputers': 'median', 'n_estimators': 1850, 'learning_rate': 0.002753008447098853, 'max_depth': 10, 'min_child_weight': 7, 'subsample': 0.6, 'colsample_bytree': 0.5, 'colsample_bylevel': 1.0, 'reg_alpha': 0.26496844190226265, 'reg_lambda': 0.47210670465243754, 'gamma': 0.058198296998665106}. Best is trial 6 with value: -0.055604131175461584.
[I 2026-07-14 19:35:58,877] Trial 12 finished with value: -0.027797749098620046 and parameters: {'scalers': 'standard', 'ratios': 'log_ratio', 'imputers': 'none', 'n_estimators': 250, 'learning_rate': 0.039638621078837956, 'max_depth': 10, 'min_child_weight': 1, 'subsample': 0.5, 'colsample_bytree': 0.7, 'colsample_bylevel': 0.6, 'reg_alpha': 7.0279394737969365e-06, 'reg_lambda': 32.663413988710175, 'gamma': 0.09216039216468738}. Best is trial 6 with value: -0.055604131175461584.
[I 2026-07-14 19:36:00,818] Trial 13 finished with value: -0.03253854514332368 and parameters: {'scalers': 'none', 'ratios': 'norm_ratio', 'imputers': 'none', 'n_estimators': 1850, 'learning_rate': 0.00011656838909354322, 'max_depth': 3, 'min_child_weight': 4, 'subsample': 0.5, 'colsample_bytree': 1.0, 'colsample_bylevel': 0.7, 'reg_alpha': 8.771049071313211, 'reg_lambda': 40.08151056737389, 'gamma': 1.29983792109134}. Best is trial 6 with value: -0.055604131175461584.
[I 2026-07-14 19:36:09,802] Trial 14 finished with value: -0.031143025723572408 and parameters: {'scalers': 'robust', 'ratios': 'log_ratio', 'imputers': 'mean', 'n_estimators': 1200, 'learning_rate': 0.004282230865248774, 'max_depth': 12, 'min_child_weight': 5, 'subsample': 0.8, 'colsample_bytree': 0.9, 'colsample_bylevel': 0.5, 'reg_alpha': 0.006269023277521763, 'reg_lambda': 0.0026350566376785707, 'gamma': 0.041722269318142026}. Best is trial 6 with value: -0.055604131175461584.
[I 2026-07-14 19:36:11,499] Trial 15 finished with value: -0.027664326080409658 and parameters: {'scalers': 'standard', 'ratios': 'norm_ratio', 'imputers': 'none', 'n_estimators': 500, 'learning_rate': 0.0026494538854988075, 'max_depth': 5, 'min_child_weight': 9, 'subsample': 1.0, 'colsample_bytree': 0.7, 'colsample_bylevel': 0.6, 'reg_alpha': 0.00016508055244074296, 'reg_lambda': 0.5882966540998745, 'gamma': 0.0066098357272332585}. Best is trial 6 with value: -0.055604131175461584.
[I 2026-07-14 19:36:14,139] Trial 16 finished with value: -0.032616886445591894 and parameters: {'scalers': 'standard', 'ratios': 'norm_ratio', 'imputers': 'mean', 'n_estimators': 2800, 'learning_rate': 0.33714704125074807, 'max_depth': 10, 'min_child_weight': 10, 'subsample': 0.5, 'colsample_bytree': 0.8, 'colsample_bylevel': 0.5, 'reg_alpha': 7.352450171957299e-05, 'reg_lambda': 1.903659335976067, 'gamma': 65.26799163680776}. Best is trial 6 with value: -0.055604131175461584.
[I 2026-07-14 19:36:17,871] Trial 17 finished with value: -0.03256491949901526 and parameters: {'scalers': 'standard', 'ratios': 'norm_ratio', 'imputers': 'mean', 'n_estimators': 3000, 'learning_rate': 0.002758730654361618, 'max_depth': 9, 'min_child_weight': 1, 'subsample': 0.9, 'colsample_bytree': 1.0, 'colsample_bylevel': 0.6, 'reg_alpha': 1.3543665844932078e-06, 'reg_lambda': 0.002230791592237928, 'gamma': 71.50934330598605}. Best is trial 6 with value: -0.055604131175461584.
[I 2026-07-14 19:36:35,773] Trial 18 finished with value: -0.06266766096047331 and parameters: {'scalers': 'standard', 'ratios': 'norm_ratio', 'imputers': 'mean', 'n_estimators': 2500, 'learning_rate': 0.36159466644953075, 'max_depth': 9, 'min_child_weight': 6, 'subsample': 0.9, 'colsample_bytree': 1.0, 'colsample_bylevel': 0.7, 'reg_alpha': 4.17926515128253e-06, 'reg_lambda': 1.172758498833853e-06, 'gamma': 0.013445367876866721}. Best is trial 18 with value: -0.06266766096047331.
[I 2026-07-14 19:36:44,786] Trial 19 finished with value: -0.05346028207475812 and parameters: {'scalers': 'standard', 'ratios': 'norm_ratio', 'imputers': 'mean', 'n_estimators': 1200, 'learning_rate': 0.42439787938572887, 'max_depth': 9, 'min_child_weight': 10, 'subsample': 0.9, 'colsample_bytree': 1.0, 'colsample_bylevel': 0.7, 'reg_alpha': 5.6328785881156985e-06, 'reg_lambda': 1.954523614045073e-06, 'gamma': 0.010930206250675313}. Best is trial 18 with value: -0.06266766096047331.
[I 2026-07-14 19:36:46,487] Trial 20 finished with value: -0.03255734286534632 and parameters: {'scalers': 'robust', 'ratios': 'norm_ratio', 'imputers': 'mean', 'n_estimators': 1300, 'learning_rate': 0.3550878292071173, 'max_depth': 9, 'min_child_weight': 5, 'subsample': 0.9, 'colsample_bytree': 1.0, 'colsample_bylevel': 0.7, 'reg_alpha': 2.4595025594479607e-05, 'reg_lambda': 1.0010345936557403e-06, 'gamma': 39.85802148841786}. Best is trial 18 with value: -0.06266766096047331.
[I 2026-07-14 19:36:48,098] Trial 21 finished with value: -0.03255573050230111 and parameters: {'scalers': 'robust', 'ratios': 'norm_ratio', 'imputers': 'mean', 'n_estimators': 1250, 'learning_rate': 0.3560456902371107, 'max_depth': 9, 'min_child_weight': 10, 'subsample': 0.9, 'colsample_bytree': 0.9, 'colsample_bylevel': 0.7, 'reg_alpha': 6.182716764107659e-05, 'reg_lambda': 1.0011149321283388e-06, 'gamma': 92.08002339432618}. Best is trial 18 with value: -0.06266766096047331.
[I 2026-07-14 19:36:51,189] Trial 22 finished with value: -0.03253897183072162 and parameters: {'scalers': 'standard', 'ratios': 'norm_ratio', 'imputers': 'mean', 'n_estimators': 2550, 'learning_rate': 0.4302446596128046, 'max_depth': 9, 'min_child_weight': 10, 'subsample': 0.9, 'colsample_bytree': 0.7, 'colsample_bylevel': 0.7, 'reg_alpha': 6.195601295185964e-05, 'reg_lambda': 1.8547276359018023e-06, 'gamma': 81.76852981067749}. Best is trial 18 with value: -0.06266766096047331.
[I 2026-07-14 19:36:54,355] Trial 23 finished with value: -0.03257713811603935 and parameters: {'scalers': 'robust', 'ratios': 'norm_ratio', 'imputers': 'mean', 'n_estimators': 2450, 'learning_rate': 0.3797014457482368, 'max_depth': 9, 'min_child_weight': 6, 'subsample': 0.9, 'colsample_bytree': 0.9, 'colsample_bylevel': 0.8, 'reg_alpha': 5.155750686695311e-05, 'reg_lambda': 2.2049090298057247e-06, 'gamma': 71.0613535227852}. Best is trial 18 with value: -0.06266766096047331.
[I 2026-07-14 19:37:09,600] Trial 24 finished with value: -0.04487820515249025 and parameters: {'scalers': 'robust', 'ratios': 'norm_ratio', 'imputers': 'mean', 'n_estimators': 2400, 'learning_rate': 0.1123076794301246, 'max_depth': 8, 'min_child_weight': 6, 'subsample': 0.9, 'colsample_bytree': 0.9, 'colsample_bylevel': 0.8, 'reg_alpha': 1.0935171512640056e-06, 'reg_lambda': 1.6756121126612892e-06, 'gamma': 3.56966480677576e-05}. Best is trial 18 with value: -0.06266766096047331.
[I 2026-07-14 19:37:24,509] Trial 25 finished with value: -0.0479310950079718 and parameters: {'scalers': 'robust', 'ratios': 'log_ratio', 'imputers': 'mean', 'n_estimators': 2350, 'learning_rate': 0.1413478544607047, 'max_depth': 8, 'min_child_weight': 6, 'subsample': 0.9, 'colsample_bytree': 0.9, 'colsample_bylevel': 0.8, 'reg_alpha': 0.030492060256131378, 'reg_lambda': 0.0006108789395678236, 'gamma': 3.60285155388772e-05}. Best is trial 18 with value: -0.06266766096047331.
[I 2026-07-14 19:37:38,100] Trial 26 finished with value: -0.06031121178896463 and parameters: {'scalers': 'standard', 'ratios': 'norm_ratio', 'imputers': 'mean', 'n_estimators': 2350, 'learning_rate': 0.3905816853049567, 'max_depth': 8, 'min_child_weight': 6, 'subsample': 0.9, 'colsample_bytree': 0.9, 'colsample_bylevel': 0.7, 'reg_alpha': 3.2591943637987946e-05, 'reg_lambda': 1.6004158854849925e-06, 'gamma': 0.007471353277523528}. Best is trial 18 with value: -0.06266766096047331.
[I 2026-07-14 19:37:40,989] Trial 27 finished with value: -0.03257480221321405 and parameters: {'scalers': 'standard', 'ratios': 'norm_ratio', 'imputers': 'mean', 'n_estimators': 2300, 'learning_rate': 0.12468990070730476, 'max_depth': 8, 'min_child_weight': 6, 'subsample': 0.9, 'colsample_bytree': 0.9, 'colsample_bylevel': 0.7, 'reg_alpha': 0.00019596363424815525, 'reg_lambda': 2.1759651659867885e-06, 'gamma': 7.676026211192822}. Best is trial 18 with value: -0.06266766096047331.
[I 2026-07-14 19:37:54,056] Trial 28 finished with value: -0.04882249315800163 and parameters: {'scalers': 'standard', 'ratios': 'norm_ratio', 'imputers': 'mean', 'n_estimators': 2250, 'learning_rate': 0.17431110051691845, 'max_depth': 8, 'min_child_weight': 6, 'subsample': 0.9, 'colsample_bytree': 0.9, 'colsample_bylevel': 0.7, 'reg_alpha': 1.7268071847828428e-06, 'reg_lambda': 1.6073754865029562e-06, 'gamma': 0.003645210340150678}. Best is trial 18 with value: -0.06266766096047331.
[I 2026-07-14 19:38:10,013] Trial 29 finished with value: -0.047121390731232816 and parameters: {'scalers': 'standard', 'ratios': 'norm_ratio', 'imputers': 'mean', 'n_estimators': 2400, 'learning_rate': 0.1334276515062756, 'max_depth': 8, 'min_child_weight': 6, 'subsample': 0.8, 'colsample_bytree': 1.0, 'colsample_bylevel': 0.8, 'reg_alpha': 1.0089928479527905e-06, 'reg_lambda': 6.393432825419204e-06, 'gamma': 0.011416459432335884}. Best is trial 18 with value: -0.06266766096047331.
[I 2026-07-14 19:38:16,064] Trial 30 finished with value: -0.038746364285209015 and parameters: {'scalers': 'standard', 'ratios': 'norm_ratio', 'imputers': 'mean', 'n_estimators': 900, 'learning_rate': 0.11692307794730744, 'max_depth': 8, 'min_child_weight': 6, 'subsample': 0.8, 'colsample_bytree': 1.0, 'colsample_bylevel': 0.8, 'reg_alpha': 1.5725427184144311e-06, 'reg_lambda': 8.755815422165659e-06, 'gamma': 0.004515344685454027}. Best is trial 18 with value: -0.06266766096047331.
[I 2026-07-14 19:38:24,599] Trial 31 finished with value: -0.04073636610491313 and parameters: {'scalers': 'standard', 'ratios': 'norm_ratio', 'imputers': 'mean', 'n_estimators': 1500, 'learning_rate': 0.12352947684710418, 'max_depth': 7, 'min_child_weight': 6, 'subsample': 0.8, 'colsample_bytree': 1.0, 'colsample_bylevel': 0.8, 'reg_alpha': 1.0329264518344014e-06, 'reg_lambda': 1.104580903422443e-05, 'gamma': 0.00326813825321136}. Best is trial 18 with value: -0.06266766096047331.
[I 2026-07-14 19:38:29,426] Trial 32 finished with value: -0.0394106137297113 and parameters: {'scalers': 'standard', 'ratios': 'norm_ratio', 'imputers': 'mean', 'n_estimators': 900, 'learning_rate': 0.14910006398063458, 'max_depth': 7, 'min_child_weight': 6, 'subsample': 0.8, 'colsample_bytree': 1.0, 'colsample_bylevel': 0.7, 'reg_alpha': 0.000538414259963902, 'reg_lambda': 0.0003226493676209084, 'gamma': 0.003349973983573843}. Best is trial 18 with value: -0.06266766096047331.
[I 2026-07-14 19:38:33,948] Trial 33 finished with value: -0.034989726268642544 and parameters: {'scalers': 'standard', 'ratios': 'norm_ratio', 'imputers': 'mean', 'n_estimators': 850, 'learning_rate': 0.07672490264981159, 'max_depth': 7, 'min_child_weight': 9, 'subsample': 0.8, 'colsample_bytree': 1.0, 'colsample_bylevel': 0.7, 'reg_alpha': 8.684155552485637e-06, 'reg_lambda': 1.3591050249533054e-05, 'gamma': 0.004672257560092168}. Best is trial 18 with value: -0.06266766096047331.
[I 2026-07-14 19:38:45,637] Trial 34 finished with value: -0.03911054765767073 and parameters: {'scalers': 'standard', 'ratios': 'norm_ratio', 'imputers': 'mean', 'n_estimators': 2100, 'learning_rate': 0.08402720952352197, 'max_depth': 7, 'min_child_weight': 4, 'subsample': 0.8, 'colsample_bytree': 1.0, 'colsample_bylevel': 0.9, 'reg_alpha': 0.000493164366331554, 'reg_lambda': 1.3577672450504214e-05, 'gamma': 0.0026370200863911953}. Best is trial 18 with value: -0.06266766096047331.
[I 2026-07-14 19:38:57,857] Trial 35 finished with value: -0.03762996079115124 and parameters: {'scalers': 'standard', 'ratios': 'norm_ratio', 'imputers': 'mean', 'n_estimators': 2150, 'learning_rate': 0.06979110582676185, 'max_depth': 7, 'min_child_weight': 4, 'subsample': 0.8, 'colsample_bytree': 1.0, 'colsample_bylevel': 0.9, 'reg_alpha': 0.0007188433008665699, 'reg_lambda': 2.2087309737777978e-05, 'gamma': 0.0021868448108628867}. Best is trial 18 with value: -0.06266766096047331.
[I 2026-07-14 19:39:06,439] Trial 36 finished with value: -0.03383352280508767 and parameters: {'scalers': 'standard', 'ratios': 'norm_ratio', 'imputers': 'mean', 'n_estimators': 1500, 'learning_rate': 0.04580396817426568, 'max_depth': 7, 'min_child_weight': 4, 'subsample': 0.8, 'colsample_bytree': 1.0, 'colsample_bylevel': 0.9, 'reg_alpha': 0.0007327921275738826, 'reg_lambda': 1.5735940830966578e-05, 'gamma': 0.0012368717550939213}. Best is trial 18 with value: -0.06266766096047331.
[I 2026-07-14 19:39:14,345] Trial 37 finished with value: -0.03431055557276675 and parameters: {'scalers': 'standard', 'ratios': 'norm_ratio', 'imputers': 'mean', 'n_estimators': 1550, 'learning_rate': 0.04885027194447402, 'max_depth': 7, 'min_child_weight': 4, 'subsample': 0.8, 'colsample_bytree': 0.8, 'colsample_bylevel': 0.9, 'reg_alpha': 0.0005348395457003932, 'reg_lambda': 0.0001242223537682924, 'gamma': 0.001874867685432666}. Best is trial 18 with value: -0.06266766096047331.
[I 2026-07-14 19:39:23,572] Trial 38 finished with value: -0.044777504442182474 and parameters: {'scalers': 'standard', 'ratios': 'norm_ratio', 'imputers': 'mean', 'n_estimators': 1450, 'learning_rate': 0.21389528497101543, 'max_depth': 7, 'min_child_weight': 9, 'subsample': 0.8, 'colsample_bytree': 1.0, 'colsample_bylevel': 0.9, 'reg_alpha': 8.807124459283656e-06, 'reg_lambda': 0.00011924469155756277, 'gamma': 0.0001502411229191433}. Best is trial 18 with value: -0.06266766096047331.
[I 2026-07-14 19:39:38,953] Trial 39 finished with value: -0.04165998538277292 and parameters: {'scalers': 'standard', 'ratios': 'norm_ratio', 'imputers': 'mean', 'n_estimators': 2700, 'learning_rate': 0.23617923294976154, 'max_depth': 7, 'min_child_weight': 9, 'subsample': 1.0, 'colsample_bytree': 1.0, 'colsample_bylevel': 0.9, 'reg_alpha': 8.138543919078745e-06, 'reg_lambda': 0.00012487680420395102, 'gamma': 0.00011825806991930383}. Best is trial 18 with value: -0.06266766096047331.
[I 2026-07-14 19:39:59,967] Trial 40 finished with value: -0.04179786190322974 and parameters: {'scalers': 'standard', 'ratios': 'norm_ratio', 'imputers': 'mean', 'n_estimators': 2650, 'learning_rate': 0.05832470082057473, 'max_depth': 10, 'min_child_weight': 9, 'subsample': 1.0, 'colsample_bytree': 0.8, 'colsample_bylevel': 0.9, 'reg_alpha': 9.088287858791647e-06, 'reg_lambda': 3.814518991370135e-05, 'gamma': 0.00018764460125461835}. Best is trial 18 with value: -0.06266766096047331.
[I 2026-07-14 19:40:18,789] Trial 41 finished with value: -0.052476707327858745 and parameters: {'scalers': 'standard', 'ratios': 'norm_ratio', 'imputers': 'mean', 'n_estimators': 2650, 'learning_rate': 0.22280286784390568, 'max_depth': 10, 'min_child_weight': 4, 'subsample': 1.0, 'colsample_bytree': 0.8, 'colsample_bylevel': 0.9, 'reg_alpha': 9.454410510633239e-06, 'reg_lambda': 0.03472362535715144, 'gamma': 0.0011111829900633029}. Best is trial 18 with value: -0.06266766096047331.
[I 2026-07-14 19:40:28,383] Trial 42 finished with value: -0.04834234679229926 and parameters: {'scalers': 'standard', 'ratios': 'norm_ratio', 'imputers': 'mean', 'n_estimators': 1550, 'learning_rate': 0.22284269586253513, 'max_depth': 10, 'min_child_weight': 8, 'subsample': 1.0, 'colsample_bytree': 0.8, 'colsample_bylevel': 0.5, 'reg_alpha': 6.928580394054559e-06, 'reg_lambda': 0.03958673765464142, 'gamma': 0.0009114866115871086}. Best is trial 18 with value: -0.06266766096047331.
[I 2026-07-14 19:40:37,572] Trial 43 finished with value: -0.05062174120458291 and parameters: {'scalers': 'standard', 'ratios': 'norm_ratio', 'imputers': 'median', 'n_estimators': 1550, 'learning_rate': 0.23367358777023728, 'max_depth': 10, 'min_child_weight': 7, 'subsample': 1.0, 'colsample_bytree': 0.8, 'colsample_bylevel': 0.5, 'reg_alpha': 1.1925253529479425e-05, 'reg_lambda': 0.02312700773438018, 'gamma': 0.0001207891346763885}. Best is trial 18 with value: -0.06266766096047331.
[I 2026-07-14 19:40:38,793] Trial 44 finished with value: -0.028043469204523077 and parameters: {'scalers': 'standard', 'ratios': 'norm_ratio', 'imputers': 'median', 'n_estimators': 2600, 'learning_rate': 0.23372463151223316, 'max_depth': 10, 'min_child_weight': 7, 'subsample': 1.0, 'colsample_bytree': 0.8, 'colsample_bylevel': 0.5, 'reg_alpha': 7.242111854383546e-06, 'reg_lambda': 0.015859268645827332, 'gamma': 0.215610904820052}. Best is trial 18 with value: -0.06266766096047331.
