[I 2026-07-14 21:40:22,856] Trial 90 finished with value: -0.6424845111497945 and parameters: {'scalers': 'standard', 'ratios': 'log_ratio', 'imputers': 'none', 'n_estimators': 2000, 'learning_rate': 0.4949913826676283, 'max_depth': 7, 'min_child_weight': 2, 'subsample': 0.8, 'colsample_bytree': 0.7, 'colsample_bylevel': 0.6, 'reg_alpha': 4.996066692917048e-06, 'reg_lambda': 0.0002117065233702543, 'gamma': 0.0016317567591374335}. Best is trial 23 with value: -0.88175068162932.
[I 2026-07-14 21:40:28,226] Trial 91 finished with value: -0.5688245911819634 and parameters: {'scalers': 'standard', 'ratios': 'log_ratio', 'imputers': 'none', 'n_estimators': 1600, 'learning_rate': 0.47248782233707404, 'max_depth': 7, 'min_child_weight': 2, 'subsample': 0.8, 'colsample_bytree': 0.7, 'colsample_bylevel': 0.6, 'reg_alpha': 3.6387996954885064e-06, 'reg_lambda': 8.885483853753784e-06, 'gamma': 0.0024318714394109017}. Best is trial 23 with value: -0.88175068162932.
[I 2026-07-14 21:40:30,441] Trial 92 finished with value: -0.244582263676498 and parameters: {'scalers': 'standard', 'ratios': 'log_ratio', 'imputers': 'none', 'n_estimators': 2000, 'learning_rate': 0.49085675717678384, 'max_depth': 7, 'min_child_weight': 2, 'subsample': 0.8, 'colsample_bytree': 0.6, 'colsample_bylevel': 0.6, 'reg_alpha': 19.39489304977762, 'reg_lambda': 0.0015344822428611901, 'gamma': 0.00015585682524861741}. Best is trial 23 with value: -0.88175068162932.
[I 2026-07-14 21:40:32,044] Trial 93 finished with value: -0.24386903533283927 and parameters: {'scalers': 'standard', 'ratios': 'log_ratio', 'imputers': 'none', 'n_estimators': 1600, 'learning_rate': 0.4592135254883173, 'max_depth': 8, 'min_child_weight': 2, 'subsample': 0.8, 'colsample_bytree': 0.7, 'colsample_bylevel': 0.7, 'reg_alpha': 16.72444534317139, 'reg_lambda': 0.00022300130946244746, 'gamma': 0.0032056832035532723}. Best is trial 23 with value: -0.88175068162932.
[I 2026-07-14 21:40:40,312] Trial 94 finished with value: -0.9885337572906049 and parameters: {'scalers': 'standard', 'ratios': 'log_ratio', 'imputers': 'none', 'n_estimators': 1550, 'learning_rate': 0.49590244766318176, 'max_depth': 8, 'min_child_weight': 2, 'subsample': 0.8, 'colsample_bytree': 0.6, 'colsample_bylevel': 0.7, 'reg_alpha': 0.4999714618893273, 'reg_lambda': 0.0002555838771949198, 'gamma': 0.005575699203498084}. Best is trial 94 with value: -0.9885337572906049.
[I 2026-07-14 21:40:47,909] Trial 95 finished with value: -0.5083739007939789 and parameters: {'scalers': 'standard', 'ratios': 'log_ratio', 'imputers': 'none', 'n_estimators': 1600, 'learning_rate': 0.22661461997166377, 'max_depth': 8, 'min_child_weight': 4, 'subsample': 0.9, 'colsample_bytree': 0.6, 'colsample_bylevel': 0.7, 'reg_alpha': 0.05282395073040254, 'reg_lambda': 0.001284906988214558, 'gamma': 0.00019487973924608082}. Best is trial 94 with value: -0.9885337572906049.
[I 2026-07-14 21:40:59,442] Trial 96 finished with value: -0.5690618792791039 and parameters: {'scalers': 'standard', 'ratios': 'log_ratio', 'imputers': 'none', 'n_estimators': 2000, 'learning_rate': 0.2276507722709361, 'max_depth': 8, 'min_child_weight': 5, 'subsample': 0.9, 'colsample_bytree': 0.6, 'colsample_bylevel': 0.7, 'reg_alpha': 0.4881027070413008, 'reg_lambda': 8.897056306497551e-05, 'gamma': 0.004286274547567366}. Best is trial 94 with value: -0.9885337572906049.
[I 2026-07-14 21:41:14,796] Trial 97 finished with value: -0.9398128116612942 and parameters: {'scalers': 'standard', 'ratios': 'log_ratio', 'imputers': 'none', 'n_estimators': 2250, 'learning_rate': 0.23896137825611077, 'max_depth': 8, 'min_child_weight': 2, 'subsample': 0.9, 'colsample_bytree': 0.6, 'colsample_bylevel': 0.7, 'reg_alpha': 1.3087240056809308, 'reg_lambda': 0.001454881604219041, 'gamma': 0.004303414652368894}. Best is trial 94 with value: -0.9885337572906049.
[I 2026-07-14 21:41:31,263] Trial 98 finished with value: -0.5902071285817481 and parameters: {'scalers': 'standard', 'ratios': 'log_ratio', 'imputers': 'none', 'n_estimators': 1600, 'learning_rate': 0.23982920152658763, 'max_depth': 8, 'min_child_weight': 5, 'subsample': 0.7, 'colsample_bytree': 0.6, 'colsample_bylevel': 0.7, 'reg_alpha': 0.611490754996957, 'reg_lambda': 7.624943549463206e-05, 'gamma': 0.00014605211114593518}. Best is trial 94 with value: -0.9885337572906049.
[I 2026-07-14 21:41:34,997] Trial 99 finished with value: -0.6390845052966858 and parameters: {'scalers': 'standard', 'ratios': 'log_ratio', 'imputers': 'none', 'n_estimators': 2000, 'learning_rate': 0.2312476172581512, 'max_depth': 8, 'min_child_weight': 5, 'subsample': 0.7, 'colsample_bytree': 0.6, 'colsample_bylevel': 0.7, 'reg_alpha': 0.6435986096563179, 'reg_lambda': 8.612348513584761e-05, 'gamma': 0.00013185814354785738}. Best is trial 94 with value: -0.9885337572906049.
[I 2026-07-14 21:41:45,671] Trial 100 finished with value: -0.5894801757710663 and parameters: {'scalers': 'standard', 'ratios': 'log_ratio', 'imputers': 'none', 'n_estimators': 2250, 'learning_rate': 0.23729459683872492, 'max_depth': 8, 'min_child_weight': 5, 'subsample': 0.7, 'colsample_bytree': 0.6, 'colsample_bylevel': 0.7, 'reg_alpha': 0.05062173213668683, 'reg_lambda': 9.187068032056525e-05, 'gamma': 0.008834170391373436}. Best is trial 94 with value: -0.9885337572906049.
[I 2026-07-14 21:41:57,772] Trial 101 finished with value: -0.6191870313508019 and parameters: {'scalers': 'standard', 'ratios': 'log_ratio', 'imputers': 'none', 'n_estimators': 2250, 'learning_rate': 0.22661206899455374, 'max_depth': 8, 'min_child_weight': 5, 'subsample': 0.7, 'colsample_bytree': 0.6, 'colsample_bylevel': 0.7, 'reg_alpha': 0.5064652156919637, 'reg_lambda': 7.157284359467494e-05, 'gamma': 0.0062492459026932765}. Best is trial 94 with value: -0.9885337572906049.
[I 2026-07-14 21:42:06,180] Trial 102 finished with value: -0.8543836702841526 and parameters: {'scalers': 'standard', 'ratios': 'log_ratio', 'imputers': 'none', 'n_estimators': 1500, 'learning_rate': 0.2363820015638208, 'max_depth': 8, 'min_child_weight': 1, 'subsample': 0.9, 'colsample_bytree': 0.6, 'colsample_bylevel': 0.7, 'reg_alpha': 0.4817316893363048, 'reg_lambda': 8.86222459800164e-05, 'gamma': 2.186373739721328e-06}. Best is trial 94 with value: -0.9885337572906049.
[I 2026-07-14 21:42:18,242] Trial 103 finished with value: -0.7621786079445563 and parameters: {'scalers': 'standard', 'ratios': 'log_ratio', 'imputers': 'none', 'n_estimators': 2250, 'learning_rate': 0.2546352278913472, 'max_depth': 8, 'min_child_weight': 3, 'subsample': 0.7, 'colsample_bytree': 0.6, 'colsample_bylevel': 0.7, 'reg_alpha': 0.4130004101924235, 'reg_lambda': 0.00010311681368646172, 'gamma': 0.0005758953918194661}. Best is trial 94 with value: -0.9885337572906049.
[I 2026-07-14 21:42:33,194] Trial 104 finished with value: -1.282368926906603 and parameters: {'scalers': 'standard', 'ratios': 'log_ratio', 'imputers': 'none', 'n_estimators': 2250, 'learning_rate': 0.2566498976105032, 'max_depth': 8, 'min_child_weight': 1, 'subsample': 0.7, 'colsample_bytree': 0.6, 'colsample_bylevel': 0.9, 'reg_alpha': 1.3811473711415556, 'reg_lambda': 7.97299861032395e-05, 'gamma': 0.01807190110865358}. Best is trial 104 with value: -1.282368926906603.
[I 2026-07-14 21:42:41,001] Trial 105 finished with value: -0.872268515089793 and parameters: {'scalers': 'standard', 'ratios': 'log_ratio', 'imputers': 'none', 'n_estimators': 2300, 'learning_rate': 0.25528004671362003, 'max_depth': 9, 'min_child_weight': 1, 'subsample': 0.9, 'colsample_bytree': 0.6, 'colsample_bylevel': 0.7, 'reg_alpha': 0.4910118688288864, 'reg_lambda': 0.045789359760165425, 'gamma': 0.09569417979036145}. Best is trial 104 with value: -1.282368926906603.
[I 2026-07-14 21:42:54,165] Trial 106 finished with value: -1.179577610859769 and parameters: {'scalers': 'standard', 'ratios': 'log_ratio', 'imputers': 'none', 'n_estimators': 2300, 'learning_rate': 0.19215361867997582, 'max_depth': 9, 'min_child_weight': 1, 'subsample': 0.9, 'colsample_bytree': 0.5, 'colsample_bylevel': 0.7, 'reg_alpha': 1.4942925152056363, 'reg_lambda': 0.05523145498043214, 'gamma': 0.010845156032289556}. Best is trial 104 with value: -1.282368926906603.
[I 2026-07-14 21:43:06,566] Trial 107 finished with value: -1.1380826592930742 and parameters: {'scalers': 'standard', 'ratios': 'log_ratio', 'imputers': 'none', 'n_estimators': 2300, 'learning_rate': 0.194398965744587, 'max_depth': 9, 'min_child_weight': 1, 'subsample': 0.9, 'colsample_bytree': 0.5, 'colsample_bylevel': 0.7, 'reg_alpha': 1.7428367409076904, 'reg_lambda': 0.004883568028289475, 'gamma': 0.007421653510228341}. Best is trial 104 with value: -1.282368926906603.
[I 2026-07-14 21:43:17,043] Trial 108 finished with value: -1.2193733253980454 and parameters: {'scalers': 'standard', 'ratios': 'log_ratio', 'imputers': 'none', 'n_estimators': 2300, 'learning_rate': 0.30823570752742296, 'max_depth': 9, 'min_child_weight': 1, 'subsample': 0.9, 'colsample_bytree': 0.6, 'colsample_bylevel': 0.8, 'reg_alpha': 1.6303622680105934, 'reg_lambda': 0.057176692903038846, 'gamma': 0.048025248667442136}. Best is trial 104 with value: -1.282368926906603.
[I 2026-07-14 21:43:19,088] Trial 109 finished with value: -0.24813173042113665 and parameters: {'scalers': 'standard', 'ratios': 'log_ratio', 'imputers': 'none', 'n_estimators': 1700, 'learning_rate': 0.29762743995420715, 'max_depth': 9, 'min_child_weight': 1, 'subsample': 0.9, 'colsample_bytree': 0.6, 'colsample_bylevel': 0.6, 'reg_alpha': 1.296500850235887, 'reg_lambda': 0.0003747013578328622, 'gamma': 0.14181234820336786}. Best is trial 104 with value: -1.282368926906603.
[I 2026-07-14 21:43:32,163] Trial 110 finished with value: -1.5018578568346757 and parameters: {'scalers': 'standard', 'ratios': 'log_ratio', 'imputers': 'none', 'n_estimators': 1700, 'learning_rate': 0.3140386107267122, 'max_depth': 9, 'min_child_weight': 1, 'subsample': 0.9, 'colsample_bytree': 0.5, 'colsample_bylevel': 0.7, 'reg_alpha': 1.4082005112324243, 'reg_lambda': 0.04529731919026721, 'gamma': 0.000628464630644236}. Best is trial 110 with value: -1.5018578568346757.
[I 2026-07-14 21:43:45,523] Trial 111 finished with value: -1.4221051543911043 and parameters: {'scalers': 'standard', 'ratios': 'log_ratio', 'imputers': 'none', 'n_estimators': 1500, 'learning_rate': 0.30920239656396814, 'max_depth': 9, 'min_child_weight': 1, 'subsample': 0.9, 'colsample_bytree': 0.6, 'colsample_bylevel': 0.7, 'reg_alpha': 1.464066045774522, 'reg_lambda': 0.004383010551222846, 'gamma': 2.2238507370548093e-06}. Best is trial 110 with value: -1.5018578568346757.
[I 2026-07-14 21:43:52,837] Trial 112 finished with value: -0.8480013116972945 and parameters: {'scalers': 'none', 'ratios': 'log_ratio', 'imputers': 'none', 'n_estimators': 1200, 'learning_rate': 0.3049315733926571, 'max_depth': 9, 'min_child_weight': 2, 'subsample': 0.9, 'colsample_bytree': 0.5, 'colsample_bylevel': 1.0, 'reg_alpha': 1.3698433760952282, 'reg_lambda': 0.0003496808760546455, 'gamma': 0.030657782275287846}. Best is trial 110 with value: -1.5018578568346757.
[I 2026-07-14 21:43:58,305] Trial 113 finished with value: -0.7969905924365228 and parameters: {'scalers': 'none', 'ratios': 'log_ratio', 'imputers': 'none', 'n_estimators': 1250, 'learning_rate': 0.19081209653946749, 'max_depth': 9, 'min_child_weight': 1, 'subsample': 0.9, 'colsample_bytree': 0.5, 'colsample_bylevel': 0.8, 'reg_alpha': 1.1673492182213212, 'reg_lambda': 0.0003800103455118054, 'gamma': 0.04222848988396281}. Best is trial 110 with value: -1.5018578568346757.
[I 2026-07-14 21:44:01,822] Trial 114 finished with value: -0.3782875945563661 and parameters: {'scalers': 'standard', 'ratios': 'log_ratio', 'imputers': 'none', 'n_estimators': 2350, 'learning_rate': 0.18664314281699382, 'max_depth': 9, 'min_child_weight': 1, 'subsample': 0.9, 'colsample_bytree': 0.5, 'colsample_bylevel': 0.9, 'reg_alpha': 1.4150246640728839, 'reg_lambda': 0.5536869222448236, 'gamma': 0.07924386502605726}. Best is trial 110 with value: -1.5018578568346757.
[I 2026-07-14 21:44:16,250] Trial 115 finished with value: -1.2989507523189119 and parameters: {'scalers': 'standard', 'ratios': 'log_ratio', 'imputers': 'none', 'n_estimators': 2400, 'learning_rate': 0.3127739413648929, 'max_depth': 9, 'min_child_weight': 1, 'subsample': 0.9, 'colsample_bytree': 0.5, 'colsample_bylevel': 0.8, 'reg_alpha': 1.113444216674208, 'reg_lambda': 0.006148043078339366, 'gamma': 0.05829707216926416}. Best is trial 110 with value: -1.5018578568346757.
[I 2026-07-14 21:44:16,666] Trial 116 finished with value: -0.2833774134705994 and parameters: {'scalers': 'standard', 'ratios': 'log_ratio', 'imputers': 'none', 'n_estimators': 2300, 'learning_rate': 0.09464188217551721, 'max_depth': 9, 'min_child_weight': 1, 'subsample': 0.9, 'colsample_bytree': 0.5, 'colsample_bylevel': 0.9, 'reg_alpha': 1.4537255142807572, 'reg_lambda': 0.005215069713896619, 'gamma': 0.0791112656074826}. Best is trial 110 with value: -1.5018578568346757.
[I 2026-07-14 21:44:22,607] Trial 117 finished with value: -0.559919937800464 and parameters: {'scalers': 'standard', 'ratios': 'log_ratio', 'imputers': 'none', 'n_estimators': 2400, 'learning_rate': 0.1853805500274956, 'max_depth': 9, 'min_child_weight': 1, 'subsample': 0.9, 'colsample_bytree': 0.5, 'colsample_bylevel': 0.9, 'reg_alpha': 3.195625987651506, 'reg_lambda': 0.0049593834415093355, 'gamma': 0.020094391022760838}. Best is trial 110 with value: -1.5018578568346757.
[I 2026-07-14 21:44:31,283] Trial 118 finished with value: -0.7349355216454692 and parameters: {'scalers': 'standard', 'ratios': 'log_ratio', 'imputers': 'none', 'n_estimators': 2400, 'learning_rate': 0.1918068176901847, 'max_depth': 9, 'min_child_weight': 1, 'subsample': 0.9, 'colsample_bytree': 0.5, 'colsample_bylevel': 0.9, 'reg_alpha': 2.525700842634465, 'reg_lambda': 0.05221827240171368, 'gamma': 0.022918325852375836}. Best is trial 110 with value: -1.5018578568346757.
[I 2026-07-14 21:44:37,588] Trial 119 finished with value: -0.4744809867991443 and parameters: {'scalers': 'standard', 'ratios': 'log_ratio', 'imputers': 'none', 'n_estimators': 2350, 'learning_rate': 0.18423666899840885, 'max_depth': 9, 'min_child_weight': 1, 'subsample': 0.9, 'colsample_bytree': 0.5, 'colsample_bylevel': 0.9, 'reg_alpha': 3.4184606081379516, 'reg_lambda': 0.047356592728875394, 'gamma': 0.023931021224668586}. Best is trial 110 with value: -1.5018578568346757.
[I 2026-07-14 21:44:40,278] Trial 120 finished with value: -0.315240744722045 and parameters: {'scalers': 'standard', 'ratios': 'log_ratio', 'imputers': 'none', 'n_estimators': 850, 'learning_rate': 0.0890825206307885, 'max_depth': 9, 'min_child_weight': 1, 'subsample': 0.9, 'colsample_bytree': 0.5, 'colsample_bylevel': 0.9, 'reg_alpha': 2.5584208945535942, 'reg_lambda': 0.0048337324295380955, 'gamma': 0.022022679513076578}. Best is trial 110 with value: -1.5018578568346757.
[I 2026-07-14 21:44:41,876] Trial 121 finished with value: -0.2952907805102994 and parameters: {'scalers': 'standard', 'ratios': 'log_ratio', 'imputers': 'none', 'n_estimators': 750, 'learning_rate': 0.09204357007957034, 'max_depth': 9, 'min_child_weight': 1, 'subsample': 0.9, 'colsample_bytree': 0.5, 'colsample_bylevel': 0.9, 'reg_alpha': 2.9927873531874902, 'reg_lambda': 0.005594379280690363, 'gamma': 0.021021859550524893}. Best is trial 110 with value: -1.5018578568346757.
[I 2026-07-14 21:44:45,620] Trial 122 finished with value: -0.3697233297244918 and parameters: {'scalers': 'standard', 'ratios': 'log_ratio', 'imputers': 'none', 'n_estimators': 950, 'learning_rate': 0.12414692089014755, 'max_depth': 9, 'min_child_weight': 1, 'subsample': 0.9, 'colsample_bytree': 0.5, 'colsample_bylevel': 0.9, 'reg_alpha': 2.9001694376811016, 'reg_lambda': 0.005655490711234384, 'gamma': 0.00885183600537289}. Best is trial 110 with value: -1.5018578568346757.
[I 2026-07-14 21:44:50,050] Trial 123 finished with value: -0.3813215261970213 and parameters: {'scalers': 'standard', 'ratios': 'log_ratio', 'imputers': 'none', 'n_estimators': 1500, 'learning_rate': 0.12942316670109805, 'max_depth': 9, 'min_child_weight': 1, 'subsample': 0.9, 'colsample_bytree': 0.5, 'colsample_bylevel': 0.8, 'reg_alpha': 3.2448159482779846, 'reg_lambda': 0.03994367368664793, 'gamma': 0.01670947738819478}. Best is trial 110 with value: -1.5018578568346757.
[I 2026-07-14 21:44:55,059] Trial 124 finished with value: -0.41454878879445595 and parameters: {'scalers': 'standard', 'ratios': 'log_ratio', 'imputers': 'none', 'n_estimators': 1500, 'learning_rate': 0.13003350788761478, 'max_depth': 9, 'min_child_weight': 1, 'subsample': 0.9, 'colsample_bytree': 0.5, 'colsample_bylevel': 0.8, 'reg_alpha': 3.000776259666144, 'reg_lambda': 0.04687006421152639, 'gamma': 0.013694021834885477}. Best is trial 110 with value: -1.5018578568346757.
[I 2026-07-14 21:45:01,793] Trial 125 finished with value: -0.37475290257588334 and parameters: {'scalers': 'standard', 'ratios': 'log_ratio', 'imputers': 'none', 'n_estimators': 2400, 'learning_rate': 0.12856401330562348, 'max_depth': 9, 'min_child_weight': 1, 'subsample': 0.9, 'colsample_bytree': 0.5, 'colsample_bylevel': 0.8, 'reg_alpha': 4.2531484966699615, 'reg_lambda': 0.04790471833890227, 'gamma': 0.01195025824707049}. Best is trial 110 with value: -1.5018578568346757.
[I 2026-07-14 21:45:03,202] Trial 126 finished with value: -0.24418529574687087 and parameters: {'scalers': 'standard', 'ratios': 'log_ratio', 'imputers': 'none', 'n_estimators': 1450, 'learning_rate': 0.08217809104395606, 'max_depth': 9, 'min_child_weight': 1, 'subsample': 0.9, 'colsample_bytree': 0.5, 'colsample_bylevel': 0.8, 'reg_alpha': 8.689853578701463, 'reg_lambda': 0.020102330684027735, 'gamma': 0.008696394996462478}. Best is trial 110 with value: -1.5018578568346757.
[I 2026-07-14 21:45:04,081] Trial 127 finished with value: -0.24478918733864108 and parameters: {'scalers': 'standard', 'ratios': 'log_ratio', 'imputers': 'none', 'n_estimators': 950, 'learning_rate': 0.11806600201688434, 'max_depth': 6, 'min_child_weight': 1, 'subsample': 0.9, 'colsample_bytree': 0.5, 'colsample_bylevel': 0.8, 'reg_alpha': 7.192879855870044, 'reg_lambda': 0.033267941611083984, 'gamma': 0.010596933454608262}. Best is trial 110 with value: -1.5018578568346757.
[I 2026-07-14 21:45:10,580] Trial 128 finished with value: -0.5914202897670582 and parameters: {'scalers': 'standard', 'ratios': 'log_ratio', 'imputers': 'none', 'n_estimators': 1500, 'learning_rate': 0.13177143229014007, 'max_depth': 9, 'min_child_weight': 1, 'subsample': 0.9, 'colsample_bytree': 0.5, 'colsample_bylevel': 0.8, 'reg_alpha': 2.044219771008243, 'reg_lambda': 0.031195025945329618, 'gamma': 0.011125558778925614}. Best is trial 110 with value: -1.5018578568346757.
[I 2026-07-14 21:45:12,368] Trial 129 finished with value: -0.24356533483434856 and parameters: {'scalers': 'standard', 'ratios': 'log_ratio', 'imputers': 'none', 'n_estimators': 1450, 'learning_rate': 0.32996545096551866, 'max_depth': 9, 'min_child_weight': 2, 'subsample': 0.9, 'colsample_bytree': 0.5, 'colsample_bylevel': 1.0, 'reg_alpha': 1.7965763810494895, 'reg_lambda': 0.030125186934988286, 'gamma': 0.6866541544497586}. Best is trial 110 with value: -1.5018578568346757.
[I 2026-07-14 21:45:14,236] Trial 130 finished with value: -0.2562348216261663 and parameters: {'scalers': 'standard', 'ratios': 'log_ratio', 'imputers': 'none', 'n_estimators': 1500, 'learning_rate': 0.3251035937986281, 'max_depth': 6, 'min_child_weight': 2, 'subsample': 0.9, 'colsample_bytree': 0.5, 'colsample_bylevel': 1.0, 'reg_alpha': 7.783389787842089, 'reg_lambda': 0.031116193417778912, 'gamma': 0.011222288845307028}. Best is trial 110 with value: -1.5018578568346757.
[I 2026-07-14 21:45:15,809] Trial 131 finished with value: -0.23988206895359246 and parameters: {'scalers': 'standard', 'ratios': 'log_ratio', 'imputers': 'none', 'n_estimators': 1250, 'learning_rate': 0.3178827339109839, 'max_depth': 10, 'min_child_weight': 2, 'subsample': 0.9, 'colsample_bytree': 0.5, 'colsample_bylevel': 1.0, 'reg_alpha': 0.35635436611338944, 'reg_lambda': 0.02071534162951849, 'gamma': 0.2029945845205389}. Best is trial 110 with value: -1.5018578568346757.
[I 2026-07-14 21:45:17,297] Trial 132 finished with value: -0.2430509403842792 and parameters: {'scalers': 'standard', 'ratios': 'log_ratio', 'imputers': 'none', 'n_estimators': 1250, 'learning_rate': 0.29606771245516206, 'max_depth': 6, 'min_child_weight': 2, 'subsample': 0.9, 'colsample_bytree': 0.5, 'colsample_bylevel': 0.7, 'reg_alpha': 9.220025082147904, 'reg_lambda': 0.016728397263140748, 'gamma': 0.04947000854263367}. Best is trial 110 with value: -1.5018578568346757.
[I 2026-07-14 21:45:19,964] Trial 133 finished with value: -0.24378791145504022 and parameters: {'scalers': 'standard', 'ratios': 'log_ratio', 'imputers': 'none', 'n_estimators': 2200, 'learning_rate': 0.28351748513746033, 'max_depth': 6, 'min_child_weight': 2, 'subsample': 0.9, 'colsample_bytree': 0.5, 'colsample_bylevel': 1.0, 'reg_alpha': 7.0594477627453855, 'reg_lambda': 0.023476924972930097, 'gamma': 0.500728155241672}. Best is trial 110 with value: -1.5018578568346757.
[I 2026-07-14 21:45:22,654] Trial 134 finished with value: -0.4556987462095986 and parameters: {'scalers': 'standard', 'ratios': 'log_ratio', 'imputers': 'none', 'n_estimators': 1200, 'learning_rate': 0.3082252811231234, 'max_depth': 6, 'min_child_weight': 2, 'subsample': 0.9, 'colsample_bytree': 0.5, 'colsample_bylevel': 0.7, 'reg_alpha': 1.8107287342637595, 'reg_lambda': 0.014949334474069318, 'gamma': 0.046687409539588616}. Best is trial 110 with value: -1.5018578568346757.
