[I 2026-07-14 22:13:07,263] Trial 315 finished with value: -1.0424292512625868 and parameters: {'scalers': 'standard', 'ratios': 'norm_ratio', 'imputers': 'mean', 'n_estimators': 2700, 'learning_rate': 0.3790858945473793, 'max_depth': 9, 'min_child_weight': 1, 'subsample': 0.5, 'colsample_bytree': 0.6, 'colsample_bylevel': 0.9, 'reg_alpha': 0.35454809329916387, 'reg_lambda': 40.44699929975388, 'gamma': 6.995042589470753e-06}. Best is trial 249 with value: -10.250805495445526.
[I 2026-07-14 22:13:30,982] Trial 316 finished with value: -0.15318059214948132 and parameters: {'scalers': 'standard', 'ratios': 'norm_ratio', 'imputers': 'mean', 'n_estimators': 2700, 'learning_rate': 0.020447067435593325, 'max_depth': 9, 'min_child_weight': 1, 'subsample': 0.5, 'colsample_bytree': 0.6, 'colsample_bylevel': 0.9, 'reg_alpha': 0.3559656341796993, 'reg_lambda': 36.790849245778084, 'gamma': 6.853728318459233e-06}. Best is trial 249 with value: -10.250805495445526.
[I 2026-07-14 22:13:56,404] Trial 317 finished with value: -0.9220350216700963 and parameters: {'scalers': 'standard', 'ratios': 'norm_ratio', 'imputers': 'mean', 'n_estimators': 2800, 'learning_rate': 0.4073665681393304, 'max_depth': 9, 'min_child_weight': 1, 'subsample': 0.5, 'colsample_bytree': 0.6, 'colsample_bylevel': 0.9, 'reg_alpha': 0.38115569261432747, 'reg_lambda': 21.623506136407798, 'gamma': 3.374668452753542e-06}. Best is trial 249 with value: -10.250805495445526.
[I 2026-07-14 22:14:07,431] Trial 318 finished with value: -0.22332272648393978 and parameters: {'scalers': 'standard', 'ratios': 'norm_ratio', 'imputers': 'mean', 'n_estimators': 2800, 'learning_rate': 0.41144423410988573, 'max_depth': 9, 'min_child_weight': 1, 'subsample': 0.5, 'colsample_bytree': 0.6, 'colsample_bylevel': 0.9, 'reg_alpha': 5.659673034683447, 'reg_lambda': 22.45066255512941, 'gamma': 3.2464472125330418e-06}. Best is trial 249 with value: -10.250805495445526.
[I 2026-07-14 22:14:32,810] Trial 319 finished with value: -0.970780689142089 and parameters: {'scalers': 'standard', 'ratios': 'norm_ratio', 'imputers': 'mean', 'n_estimators': 2800, 'learning_rate': 0.41796975606665066, 'max_depth': 9, 'min_child_weight': 1, 'subsample': 0.5, 'colsample_bytree': 0.6, 'colsample_bylevel': 0.9, 'reg_alpha': 0.39442781927480686, 'reg_lambda': 21.230257687513696, 'gamma': 6.684088822252217e-06}. Best is trial 249 with value: -10.250805495445526.
