[I 2026-07-14 18:26:45,369] Trial 45 finished with value: -0.09500322606735812 and parameters: {'scalers': 'robust', 'ratios': 'log_ratio', 'imputers': 'none', 'n_estimators': 450, 'learning_rate': 0.40842076537788424, 'max_depth': 7, 'min_child_weight': 9, 'subsample': 0.8, 'colsample_bytree': 0.6, 'colsample_bylevel': 0.7, 'reg_alpha': 0.005212899642741007, 'reg_lambda': 0.023528205296496234, 'gamma': 0.014920630164616637}. Best is trial 42 with value: -0.13583041874987337.
[I 2026-07-14 18:26:47,389] Trial 46 finished with value: -0.1023564309239859 and parameters: {'scalers': 'robust', 'ratios': 'log_ratio', 'imputers': 'none', 'n_estimators': 450, 'learning_rate': 0.43781163124972095, 'max_depth': 7, 'min_child_weight': 9, 'subsample': 0.8, 'colsample_bytree': 0.6, 'colsample_bylevel': 0.7, 'reg_alpha': 0.005355830819593276, 'reg_lambda': 0.01343842726254187, 'gamma': 0.0058258835390057485}. Best is trial 42 with value: -0.13583041874987337.
[I 2026-07-14 18:26:58,343] Trial 47 finished with value: -0.14915604335153118 and parameters: {'scalers': 'robust', 'ratios': 'log_ratio', 'imputers': 'none', 'n_estimators': 1650, 'learning_rate': 0.4761682147244964, 'max_depth': 12, 'min_child_weight': 9, 'subsample': 0.8, 'colsample_bytree': 0.6, 'colsample_bylevel': 0.5, 'reg_alpha': 0.0038824460558249756, 'reg_lambda': 0.016145790441275946, 'gamma': 0.004152433730541629}. Best is trial 47 with value: -0.14915604335153118.
[I 2026-07-14 18:27:00,502] Trial 48 finished with value: -0.1000981536453348 and parameters: {'scalers': 'robust', 'ratios': 'log_ratio', 'imputers': 'none', 'n_estimators': 450, 'learning_rate': 0.48279265517716957, 'max_depth': 7, 'min_child_weight': 10, 'subsample': 0.8, 'colsample_bytree': 0.6, 'colsample_bylevel': 0.8, 'reg_alpha': 0.0037690299089974074, 'reg_lambda': 0.022823502343276483, 'gamma': 0.005826766909590685}. Best is trial 47 with value: -0.14915604335153118.
[I 2026-07-14 18:27:03,665] Trial 49 finished with value: -0.1103484229219304 and parameters: {'scalers': 'robust', 'ratios': 'log_ratio', 'imputers': 'none', 'n_estimators': 400, 'learning_rate': 0.481779699935272, 'max_depth': 12, 'min_child_weight': 9, 'subsample': 1.0, 'colsample_bytree': 0.6, 'colsample_bylevel': 0.7, 'reg_alpha': 0.003976810819942341, 'reg_lambda': 0.023542676691597264, 'gamma': 0.01798652782986026}. Best is trial 47 with value: -0.14915604335153118.
[I 2026-07-14 18:27:05,673] Trial 50 finished with value: -0.12146215099844457 and parameters: {'scalers': 'robust', 'ratios': 'log_ratio', 'imputers': 'none', 'n_estimators': 500, 'learning_rate': 0.4982412740179259, 'max_depth': 6, 'min_child_weight': 7, 'subsample': 0.6, 'colsample_bytree': 0.6, 'colsample_bylevel': 0.7, 'reg_alpha': 1.3957789811199608, 'reg_lambda': 0.01096035228748682, 'gamma': 0.007981740860610473}. Best is trial 47 with value: -0.14915604335153118.
[I 2026-07-14 18:27:07,085] Trial 51 finished with value: -0.12125673935759294 and parameters: {'scalers': 'robust', 'ratios': 'log_ratio', 'imputers': 'mean', 'n_estimators': 400, 'learning_rate': 0.49937953318271566, 'max_depth': 6, 'min_child_weight': 7, 'subsample': 0.5, 'colsample_bytree': 0.6, 'colsample_bylevel': 0.8, 'reg_alpha': 2.2720400797008997, 'reg_lambda': 0.0006518019236200007, 'gamma': 0.009789453595443335}. Best is trial 47 with value: -0.14915604335153118.
[I 2026-07-14 18:27:08,101] Trial 52 finished with value: -0.07828045324607602 and parameters: {'scalers': 'robust', 'ratios': 'log_ratio', 'imputers': 'mean', 'n_estimators': 450, 'learning_rate': 0.21452352995569107, 'max_depth': 6, 'min_child_weight': 7, 'subsample': 0.5, 'colsample_bytree': 0.8, 'colsample_bylevel': 0.8, 'reg_alpha': 2.5675680062665656, 'reg_lambda': 0.0007368665710856078, 'gamma': 0.041569808349804366}. Best is trial 47 with value: -0.14915604335153118.
[I 2026-07-14 18:27:09,672] Trial 53 finished with value: -0.08618504152095781 and parameters: {'scalers': 'robust', 'ratios': 'log_ratio', 'imputers': 'mean', 'n_estimators': 350, 'learning_rate': 0.2114726340424812, 'max_depth': 6, 'min_child_weight': 7, 'subsample': 0.5, 'colsample_bytree': 0.8, 'colsample_bylevel': 0.8, 'reg_alpha': 1.1200734218718469, 'reg_lambda': 0.0006192930717343863, 'gamma': 0.02612479573288689}. Best is trial 47 with value: -0.14915604335153118.
[I 2026-07-14 18:27:10,797] Trial 54 finished with value: -0.08171418521606136 and parameters: {'scalers': 'none', 'ratios': 'log_ratio', 'imputers': 'mean', 'n_estimators': 350, 'learning_rate': 0.2058886697602915, 'max_depth': 6, 'min_child_weight': 7, 'subsample': 0.6, 'colsample_bytree': 0.8, 'colsample_bylevel': 0.5, 'reg_alpha': 1.3545419154011034, 'reg_lambda': 0.0009127701598320693, 'gamma': 0.02943893084632854}. Best is trial 47 with value: -0.14915604335153118.
[I 2026-07-14 18:27:15,720] Trial 55 finished with value: -0.09868083120377771 and parameters: {'scalers': 'robust', 'ratios': 'log_ratio', 'imputers': 'mean', 'n_estimators': 1850, 'learning_rate': 0.21274159212756413, 'max_depth': 5, 'min_child_weight': 7, 'subsample': 0.6, 'colsample_bytree': 0.8, 'colsample_bylevel': 0.5, 'reg_alpha': 1.5691383217319068, 'reg_lambda': 0.0011533536695465957, 'gamma': 0.029072392831939443}. Best is trial 47 with value: -0.14915604335153118.
[I 2026-07-14 18:27:21,135] Trial 56 finished with value: -0.11261908375318327 and parameters: {'scalers': 'robust', 'ratios': 'norm_ratio', 'imputers': 'mean', 'n_estimators': 1800, 'learning_rate': 0.2046675345914593, 'max_depth': 12, 'min_child_weight': 7, 'subsample': 0.6, 'colsample_bytree': 0.8, 'colsample_bylevel': 0.5, 'reg_alpha': 1.4795773490958368, 'reg_lambda': 0.0008323745228213541, 'gamma': 0.0406044091108532}. Best is trial 47 with value: -0.14915604335153118.
[I 2026-07-14 18:27:24,217] Trial 57 finished with value: -0.08580747212765795 and parameters: {'scalers': 'robust', 'ratios': 'norm_ratio', 'imputers': 'mean', 'n_estimators': 1700, 'learning_rate': 0.20753020034907332, 'max_depth': 5, 'min_child_weight': 7, 'subsample': 0.6, 'colsample_bytree': 0.8, 'colsample_bylevel': 0.5, 'reg_alpha': 1.7283439645569894, 'reg_lambda': 0.0006522676432857822, 'gamma': 0.05753767476724726}. Best is trial 47 with value: -0.14915604335153118.
[I 2026-07-14 18:27:29,389] Trial 58 finished with value: -0.10344706766207126 and parameters: {'scalers': 'robust', 'ratios': 'log_ratio', 'imputers': 'mean', 'n_estimators': 1600, 'learning_rate': 0.21066549551287145, 'max_depth': 5, 'min_child_weight': 7, 'subsample': 0.6, 'colsample_bytree': 0.8, 'colsample_bylevel': 0.5, 'reg_alpha': 1.5403912255983003, 'reg_lambda': 0.0008314716714397781, 'gamma': 0.002357338777515224}. Best is trial 47 with value: -0.14915604335153118.
[I 2026-07-14 18:27:31,427] Trial 59 finished with value: -0.06927365337148984 and parameters: {'scalers': 'robust', 'ratios': 'norm_ratio', 'imputers': 'median', 'n_estimators': 1750, 'learning_rate': 0.19533532928306896, 'max_depth': 5, 'min_child_weight': 5, 'subsample': 0.6, 'colsample_bytree': 0.8, 'colsample_bylevel': 0.5, 'reg_alpha': 1.0039378827000094, 'reg_lambda': 0.0011198427193492456, 'gamma': 0.13253018840652106}. Best is trial 47 with value: -0.14915604335153118.
[I 2026-07-14 18:27:36,219] Trial 60 finished with value: -0.1022186950038005 and parameters: {'scalers': 'robust', 'ratios': 'norm_ratio', 'imputers': 'median', 'n_estimators': 1800, 'learning_rate': 0.17770645223089798, 'max_depth': 5, 'min_child_weight': 5, 'subsample': 0.6, 'colsample_bytree': 0.8, 'colsample_bylevel': 0.5, 'reg_alpha': 0.8216525891955669, 'reg_lambda': 0.00021616851962442198, 'gamma': 0.04592072632133418}. Best is trial 47 with value: -0.14915604335153118.
[I 2026-07-14 18:27:38,146] Trial 61 finished with value: -0.06368943359862655 and parameters: {'scalers': 'robust', 'ratios': 'norm_ratio', 'imputers': 'median', 'n_estimators': 1750, 'learning_rate': 0.2965225110607738, 'max_depth': 5, 'min_child_weight': 5, 'subsample': 0.6, 'colsample_bytree': 0.8, 'colsample_bylevel': 0.5, 'reg_alpha': 10.561584470512914, 'reg_lambda': 6.0282884696738147e-05, 'gamma': 0.00227811344469508}. Best is trial 47 with value: -0.14915604335153118.
[I 2026-07-14 18:27:39,979] Trial 62 finished with value: -0.059354432620275246 and parameters: {'scalers': 'robust', 'ratios': 'norm_ratio', 'imputers': 'median', 'n_estimators': 1850, 'learning_rate': 0.2768730690711706, 'max_depth': 5, 'min_child_weight': 5, 'subsample': 0.6, 'colsample_bytree': 0.7, 'colsample_bylevel': 0.5, 'reg_alpha': 73.42686189527507, 'reg_lambda': 5.3409099487735314e-05, 'gamma': 0.0023412913536512694}. Best is trial 47 with value: -0.14915604335153118.
[I 2026-07-14 18:27:42,569] Trial 63 finished with value: -0.09935475446437449 and parameters: {'scalers': 'robust', 'ratios': 'norm_ratio', 'imputers': 'median', 'n_estimators': 850, 'learning_rate': 0.316913870753695, 'max_depth': 5, 'min_child_weight': 5, 'subsample': 0.6, 'colsample_bytree': 0.6, 'colsample_bylevel': 0.9, 'reg_alpha': 0.0548804810036065, 'reg_lambda': 0.00020449721289643336, 'gamma': 0.002677828066682281}. Best is trial 47 with value: -0.14915604335153118.
[I 2026-07-14 18:27:44,131] Trial 64 finished with value: -0.08368622263103635 and parameters: {'scalers': 'robust', 'ratios': 'norm_ratio', 'imputers': 'median', 'n_estimators': 850, 'learning_rate': 0.3045158495388105, 'max_depth': 5, 'min_child_weight': 5, 'subsample': 0.6, 'colsample_bytree': 0.6, 'colsample_bylevel': 0.7, 'reg_alpha': 0.06258045024821669, 'reg_lambda': 5.140008517748161e-05, 'gamma': 0.13600963202782365}. Best is trial 47 with value: -0.14915604335153118.
[I 2026-07-14 18:27:45,733] Trial 65 finished with value: -0.05797263899881233 and parameters: {'scalers': 'none', 'ratios': 'log_ratio', 'imputers': 'median', 'n_estimators': 850, 'learning_rate': 0.0009953890070923995, 'max_depth': 3, 'min_child_weight': 5, 'subsample': 0.6, 'colsample_bytree': 0.6, 'colsample_bylevel': 0.7, 'reg_alpha': 0.06420317101654438, 'reg_lambda': 0.007096240782157444, 'gamma': 0.002125700533083192}. Best is trial 47 with value: -0.14915604335153118.
[I 2026-07-14 18:27:47,541] Trial 66 finished with value: -0.08231928860189233 and parameters: {'scalers': 'none', 'ratios': 'log_ratio', 'imputers': 'median', 'n_estimators': 850, 'learning_rate': 0.29687810837977013, 'max_depth': 10, 'min_child_weight': 5, 'subsample': 0.7, 'colsample_bytree': 0.6, 'colsample_bylevel': 0.7, 'reg_alpha': 7.683972570228722, 'reg_lambda': 0.007432912709777461, 'gamma': 0.002630999113626787}. Best is trial 47 with value: -0.14915604335153118.
[I 2026-07-14 18:27:48,300] Trial 67 finished with value: -0.059349987269753234 and parameters: {'scalers': 'none', 'ratios': 'log_ratio', 'imputers': 'none', 'n_estimators': 850, 'learning_rate': 0.2987207250193334, 'max_depth': 11, 'min_child_weight': 6, 'subsample': 0.7, 'colsample_bytree': 0.6, 'colsample_bylevel': 0.9, 'reg_alpha': 94.71422172742231, 'reg_lambda': 0.0002740029692680106, 'gamma': 0.00029170001506902794}. Best is trial 47 with value: -0.14915604335153118.
[I 2026-07-14 18:27:49,170] Trial 68 finished with value: -0.05940846692947944 and parameters: {'scalers': 'none', 'ratios': 'log_ratio', 'imputers': 'none', 'n_estimators': 850, 'learning_rate': 0.3219129641565035, 'max_depth': 6, 'min_child_weight': 6, 'subsample': 0.5, 'colsample_bytree': 0.6, 'colsample_bylevel': 0.9, 'reg_alpha': 82.27609841050823, 'reg_lambda': 4.31501290838263e-05, 'gamma': 0.0025480936111278514}. Best is trial 47 with value: -0.14915604335153118.
[I 2026-07-14 18:27:50,029] Trial 69 finished with value: -0.059403169917469405 and parameters: {'scalers': 'robust', 'ratios': 'log_ratio', 'imputers': 'none', 'n_estimators': 850, 'learning_rate': 0.2884247597797526, 'max_depth': 6, 'min_child_weight': 6, 'subsample': 0.5, 'colsample_bytree': 0.6, 'colsample_bylevel': 0.9, 'reg_alpha': 58.363163037919726, 'reg_lambda': 0.013071119977796983, 'gamma': 0.0002714281007996253}. Best is trial 47 with value: -0.14915604335153118.
[I 2026-07-14 18:27:51,649] Trial 71 finished with value: -0.05774604881529073 and parameters: {'scalers': 'none', 'ratios': 'log_ratio', 'imputers': 'none', 'n_estimators': 250, 'learning_rate': 0.343364855308102, 'max_depth': 6, 'min_child_weight': 6, 'subsample': 0.5, 'colsample_bytree': 0.6, 'colsample_bylevel': 0.9, 'reg_alpha': 5.669843359615792, 'reg_lambda': 0.03538717477097989, 'gamma': 0.16783235893857631}. Best is trial 47 with value: -0.14915604335153118.
[I 2026-07-14 18:27:51,773] Trial 70 finished with value: -0.07535902953928834 and parameters: {'scalers': 'none', 'ratios': 'log_ratio', 'imputers': 'none', 'n_estimators': 850, 'learning_rate': 0.3221793269294603, 'max_depth': 3, 'min_child_weight': 6, 'subsample': 0.5, 'colsample_bytree': 0.6, 'colsample_bylevel': 0.9, 'reg_alpha': 4.397452620831008, 'reg_lambda': 0.006678592656382216, 'gamma': 0.0002545815259995108}. Best is trial 47 with value: -0.14915604335153118.
[I 2026-07-14 18:27:53,276] Trial 72 finished with value: -0.058845901972602255 and parameters: {'scalers': 'none', 'ratios': 'log_ratio', 'imputers': 'none', 'n_estimators': 550, 'learning_rate': 0.00044950052315845956, 'max_depth': 6, 'min_child_weight': 6, 'subsample': 0.5, 'colsample_bytree': 0.6, 'colsample_bylevel': 0.9, 'reg_alpha': 7.610425186539555, 'reg_lambda': 0.007848384987776394, 'gamma': 1.0218048829739071e-05}. Best is trial 47 with value: -0.14915604335153118.
[I 2026-07-14 18:27:55,563] Trial 73 finished with value: -0.1112632013574017 and parameters: {'scalers': 'none', 'ratios': 'log_ratio', 'imputers': 'none', 'n_estimators': 600, 'learning_rate': 0.36164296745686025, 'max_depth': 6, 'min_child_weight': 6, 'subsample': 0.5, 'colsample_bytree': 0.6, 'colsample_bylevel': 0.9, 'reg_alpha': 7.078821074147198e-05, 'reg_lambda': 0.0073223386553759534, 'gamma': 0.00031846390913938373}. Best is trial 47 with value: -0.14915604335153118.
[I 2026-07-14 18:27:57,559] Trial 74 finished with value: -0.09687827588819636 and parameters: {'scalers': 'standard', 'ratios': 'log_ratio', 'imputers': 'none', 'n_estimators': 600, 'learning_rate': 0.34501615099859667, 'max_depth': 6, 'min_child_weight': 6, 'subsample': 0.5, 'colsample_bytree': 0.6, 'colsample_bylevel': 0.9, 'reg_alpha': 4.349937270307945, 'reg_lambda': 0.03927286251575124, 'gamma': 0.0003313652167751655}. Best is trial 47 with value: -0.14915604335153118.
[I 2026-07-14 18:27:58,405] Trial 75 finished with value: -0.08482067076234076 and parameters: {'scalers': 'standard', 'ratios': 'log_ratio', 'imputers': 'none', 'n_estimators': 250, 'learning_rate': 0.3537073960871438, 'max_depth': 6, 'min_child_weight': 6, 'subsample': 0.5, 'colsample_bytree': 0.7, 'colsample_bylevel': 0.8, 'reg_alpha': 4.716460740931021, 'reg_lambda': 0.03848821003746415, 'gamma': 0.0002886662560899799}. Best is trial 47 with value: -0.14915604335153118.
[I 2026-07-14 18:28:00,673] Trial 76 finished with value: -0.10761343453471992 and parameters: {'scalers': 'standard', 'ratios': 'log_ratio', 'imputers': 'none', 'n_estimators': 600, 'learning_rate': 0.3541881872904641, 'max_depth': 6, 'min_child_weight': 8, 'subsample': 0.5, 'colsample_bytree': 0.7, 'colsample_bylevel': 0.8, 'reg_alpha': 0.0001013039660663671, 'reg_lambda': 0.035607331142267086, 'gamma': 0.0003767363148168513}. Best is trial 47 with value: -0.14915604335153118.
[I 2026-07-14 18:28:01,821] Trial 77 finished with value: -0.06721683135035676 and parameters: {'scalers': 'standard', 'ratios': 'log_ratio', 'imputers': 'none', 'n_estimators': 300, 'learning_rate': 0.0652647869470746, 'max_depth': 6, 'min_child_weight': 8, 'subsample': 0.5, 'colsample_bytree': 0.7, 'colsample_bylevel': 0.8, 'reg_alpha': 0.00013624145979699014, 'reg_lambda': 0.03737327684442452, 'gamma': 1.3667160701801008e-05}. Best is trial 47 with value: -0.14915604335153118.
[I 2026-07-14 18:28:02,995] Trial 78 finished with value: -0.0976387215195095 and parameters: {'scalers': 'standard', 'ratios': 'log_ratio', 'imputers': 'none', 'n_estimators': 250, 'learning_rate': 0.37816696720290816, 'max_depth': 7, 'min_child_weight': 9, 'subsample': 0.5, 'colsample_bytree': 0.7, 'colsample_bylevel': 0.8, 'reg_alpha': 9.137100370240845e-05, 'reg_lambda': 0.006450282193102381, 'gamma': 0.009838921831278269}. Best is trial 47 with value: -0.14915604335153118.
[I 2026-07-14 18:28:05,538] Trial 79 finished with value: -0.11422537795073569 and parameters: {'scalers': 'standard', 'ratios': 'log_ratio', 'imputers': 'none', 'n_estimators': 550, 'learning_rate': 0.3864863008401454, 'max_depth': 7, 'min_child_weight': 9, 'subsample': 0.5, 'colsample_bytree': 0.7, 'colsample_bylevel': 0.8, 'reg_alpha': 0.0003479416373213109, 'reg_lambda': 0.001769376450380664, 'gamma': 1.873334202115508e-05}. Best is trial 47 with value: -0.14915604335153118.
[I 2026-07-14 18:28:08,255] Trial 80 finished with value: -0.11814064685902712 and parameters: {'scalers': 'standard', 'ratios': 'log_ratio', 'imputers': 'none', 'n_estimators': 550, 'learning_rate': 0.38819012844003836, 'max_depth': 7, 'min_child_weight': 9, 'subsample': 0.5, 'colsample_bytree': 0.7, 'colsample_bylevel': 0.8, 'reg_alpha': 0.5298838861306939, 'reg_lambda': 0.12380355420081934, 'gamma': 1.97391389889881e-05}. Best is trial 47 with value: -0.14915604335153118.
[I 2026-07-14 18:28:09,430] Trial 81 finished with value: -0.1084997923866896 and parameters: {'scalers': 'standard', 'ratios': 'log_ratio', 'imputers': 'none', 'n_estimators': 250, 'learning_rate': 0.48856501994530604, 'max_depth': 7, 'min_child_weight': 9, 'subsample': 0.5, 'colsample_bytree': 0.7, 'colsample_bylevel': 0.8, 'reg_alpha': 0.0008238975104819953, 'reg_lambda': 0.0015521084835294098, 'gamma': 0.01094666636826728}. Best is trial 47 with value: -0.14915604335153118.
[I 2026-07-14 18:28:16,324] Trial 82 finished with value: -0.14910957322251325 and parameters: {'scalers': 'standard', 'ratios': 'log_ratio', 'imputers': 'none', 'n_estimators': 1500, 'learning_rate': 0.4879676684388017, 'max_depth': 7, 'min_child_weight': 9, 'subsample': 0.5, 'colsample_bytree': 0.7, 'colsample_bylevel': 0.8, 'reg_alpha': 0.0008592083178460086, 'reg_lambda': 0.0018341853494431384, 'gamma': 0.009462622483114061}. Best is trial 47 with value: -0.14915604335153118.
[I 2026-07-14 18:28:24,497] Trial 83 finished with value: -0.14024545638977579 and parameters: {'scalers': 'standard', 'ratios': 'log_ratio', 'imputers': 'none', 'n_estimators': 2000, 'learning_rate': 0.49206187682762614, 'max_depth': 7, 'min_child_weight': 9, 'subsample': 0.7, 'colsample_bytree': 0.5, 'colsample_bylevel': 0.7, 'reg_alpha': 0.5537482241478777, 'reg_lambda': 0.0018979519088114186, 'gamma': 0.010865552484937202}. Best is trial 47 with value: -0.14915604335153118.
[I 2026-07-14 18:28:35,472] Trial 84 finished with value: -0.1520422837565353 and parameters: {'scalers': 'standard', 'ratios': 'log_ratio', 'imputers': 'none', 'n_estimators': 2650, 'learning_rate': 0.49913369830223764, 'max_depth': 7, 'min_child_weight': 9, 'subsample': 0.7, 'colsample_bytree': 0.5, 'colsample_bylevel': 0.7, 'reg_alpha': 0.5954812500537772, 'reg_lambda': 0.001859272826393374, 'gamma': 0.0073893986740222566}. Best is trial 84 with value: -0.1520422837565353.
[I 2026-07-14 18:28:42,871] Trial 85 finished with value: -0.09931156635612717 and parameters: {'scalers': 'standard', 'ratios': 'log_ratio', 'imputers': 'none', 'n_estimators': 2050, 'learning_rate': 0.1468392166897494, 'max_depth': 7, 'min_child_weight': 9, 'subsample': 0.7, 'colsample_bytree': 0.5, 'colsample_bylevel': 0.7, 'reg_alpha': 0.0005337578396681816, 'reg_lambda': 0.11050428808802197, 'gamma': 0.009219394822877492}. Best is trial 84 with value: -0.1520422837565353.
[I 2026-07-14 18:28:49,783] Trial 86 finished with value: -0.13633652881375713 and parameters: {'scalers': 'standard', 'ratios': 'log_ratio', 'imputers': 'none', 'n_estimators': 1500, 'learning_rate': 0.478479428885301, 'max_depth': 8, 'min_child_weight': 10, 'subsample': 0.7, 'colsample_bytree': 0.5, 'colsample_bylevel': 0.7, 'reg_alpha': 0.664607601341252, 'reg_lambda': 0.0019867550920217845, 'gamma': 0.00992598039007034}. Best is trial 84 with value: -0.1520422837565353.
[I 2026-07-14 18:28:58,694] Trial 87 finished with value: -0.1375339786914202 and parameters: {'scalers': 'standard', 'ratios': 'log_ratio', 'imputers': 'none', 'n_estimators': 2050, 'learning_rate': 0.4784102088941347, 'max_depth': 8, 'min_child_weight': 10, 'subsample': 0.7, 'colsample_bytree': 0.5, 'colsample_bylevel': 0.7, 'reg_alpha': 0.0005898847610347244, 'reg_lambda': 0.12422896707719294, 'gamma': 0.01015488784489256}. Best is trial 84 with value: -0.1520422837565353.
[I 2026-07-14 18:29:03,540] Trial 88 finished with value: -0.09673871626109472 and parameters: {'scalers': 'standard', 'ratios': 'log_ratio', 'imputers': 'none', 'n_estimators': 1100, 'learning_rate': 0.15196399563169277, 'max_depth': 8, 'min_child_weight': 10, 'subsample': 0.7, 'colsample_bytree': 0.5, 'colsample_bylevel': 0.7, 'reg_alpha': 0.5964361264348756, 'reg_lambda': 0.1946316203011096, 'gamma': 5.952583555848297e-06}. Best is trial 84 with value: -0.1520422837565353.
[I 2026-07-14 18:29:13,542] Trial 89 finished with value: -0.1223279788269173 and parameters: {'scalers': 'standard', 'ratios': 'log_ratio', 'imputers': 'none', 'n_estimators': 2150, 'learning_rate': 0.2487186681440138, 'max_depth': 8, 'min_child_weight': 10, 'subsample': 0.7, 'colsample_bytree': 0.5, 'colsample_bylevel': 0.7, 'reg_alpha': 0.5292618306397574, 'reg_lambda': 0.12018978928853014, 'gamma': 4.0615794569879805e-05}. Best is trial 84 with value: -0.1520422837565353.
