[I 2026-07-14 16:32:32,194] A new study created in RDB with name: my-study
[I 2026-07-14 16:32:38,288] Trial 0 finished with value: -0.2366942720401096 and parameters: {'scalers': 'standard', 'ratios': 'norm_ratio', 'imputers': 'none', 'n_estimators': 700, 'learning_rate': 0.004795887974348618, 'max_depth': 9, 'min_child_weight': 8, 'subsample': 0.5, 'colsample_bytree': 1.0, 'colsample_bylevel': 0.9, 'reg_alpha': 40.16060869994472, 'reg_lambda': 5.403530904355496e-06, 'gamma': 0.9629738034733635}. Best is trial 0 with value: -0.2366942720401096.
[I 2026-07-14 16:32:46,883] Trial 1 finished with value: -0.30803312364784236 and parameters: {'scalers': 'robust', 'ratios': 'norm_ratio', 'imputers': 'none', 'n_estimators': 2100, 'learning_rate': 0.00010467287380986315, 'max_depth': 6, 'min_child_weight': 3, 'subsample': 0.7, 'colsample_bytree': 0.7, 'colsample_bylevel': 0.9, 'reg_alpha': 6.964195655194469e-05, 'reg_lambda': 1.4655523703025492e-06, 'gamma': 2.1142447684307553}. Best is trial 1 with value: -0.30803312364784236.
[I 2026-07-14 16:32:56,360] Trial 3 finished with value: -0.20483612144671112 and parameters: {'scalers': 'none', 'ratios': 'log_ratio', 'imputers': 'none', 'n_estimators': 850, 'learning_rate': 0.05043201606705017, 'max_depth': 8, 'min_child_weight': 1, 'subsample': 0.9, 'colsample_bytree': 0.7, 'colsample_bylevel': 0.8, 'reg_alpha': 0.00013809725537142589, 'reg_lambda': 9.98157359814466e-06, 'gamma': 0.00010287921447066466}. Best is trial 1 with value: -0.30803312364784236.
[I 2026-07-14 16:33:08,889] Trial 2 finished with value: -0.2561841922715579 and parameters: {'scalers': 'none', 'ratios': 'norm_ratio', 'imputers': 'none', 'n_estimators': 2050, 'learning_rate': 0.0005324076254597254, 'max_depth': 6, 'min_child_weight': 1, 'subsample': 0.8, 'colsample_bytree': 0.5, 'colsample_bylevel': 0.6, 'reg_alpha': 0.000142405874019842, 'reg_lambda': 64.51246060088013, 'gamma': 0.0013663175795681948}. Best is trial 1 with value: -0.30803312364784236.
[I 2026-07-14 16:33:34,789] Trial 4 finished with value: -0.26456027405533555 and parameters: {'scalers': 'none', 'ratios': 'log_ratio', 'imputers': 'median', 'n_estimators': 1350, 'learning_rate': 0.0004145824614909569, 'max_depth': 8, 'min_child_weight': 3, 'subsample': 0.8, 'colsample_bytree': 0.8, 'colsample_bylevel': 1.0, 'reg_alpha': 0.02060162623839331, 'reg_lambda': 0.03888465859038177, 'gamma': 0.00013888010592300783}. Best is trial 1 with value: -0.30803312364784236.
[I 2026-07-14 16:33:51,937] Trial 5 finished with value: -0.21840934946715465 and parameters: {'scalers': 'none', 'ratios': 'norm_ratio', 'imputers': 'none', 'n_estimators': 2800, 'learning_rate': 0.16054022755220151, 'max_depth': 5, 'min_child_weight': 2, 'subsample': 0.5, 'colsample_bytree': 1.0, 'colsample_bylevel': 1.0, 'reg_alpha': 0.0014816702663928525, 'reg_lambda': 0.00010597422369164397, 'gamma': 0.005408718768958968}. Best is trial 1 with value: -0.30803312364784236.
[I 2026-07-14 16:33:58,566] Trial 6 finished with value: -0.22883134209192085 and parameters: {'scalers': 'robust', 'ratios': 'log_ratio', 'imputers': 'none', 'n_estimators': 1550, 'learning_rate': 0.42175322530364834, 'max_depth': 4, 'min_child_weight': 2, 'subsample': 1.0, 'colsample_bytree': 0.6, 'colsample_bylevel': 0.8, 'reg_alpha': 2.637038334842499e-05, 'reg_lambda': 24.360143696425407, 'gamma': 0.003113296796049499}. Best is trial 1 with value: -0.30803312364784236.
[I 2026-07-14 16:34:06,289] Trial 7 finished with value: -0.1918964968090245 and parameters: {'scalers': 'none', 'ratios': 'norm_ratio', 'imputers': 'mean', 'n_estimators': 400, 'learning_rate': 0.0082885982091822, 'max_depth': 10, 'min_child_weight': 1, 'subsample': 1.0, 'colsample_bytree': 1.0, 'colsample_bylevel': 0.6, 'reg_alpha': 3.8609830415591007, 'reg_lambda': 2.77713164145386e-06, 'gamma': 0.0004090433472576064}. Best is trial 1 with value: -0.30803312364784236.
[I 2026-07-14 16:34:09,887] Trial 8 finished with value: -0.1855208817498624 and parameters: {'scalers': 'none', 'ratios': 'log_ratio', 'imputers': 'median', 'n_estimators': 1100, 'learning_rate': 0.10666303263060901, 'max_depth': 3, 'min_child_weight': 8, 'subsample': 0.7, 'colsample_bytree': 0.7, 'colsample_bylevel': 1.0, 'reg_alpha': 2.568452463049732e-06, 'reg_lambda': 0.0034959530785413943, 'gamma': 4.9651468855441685e-06}. Best is trial 1 with value: -0.30803312364784236.
[I 2026-07-14 16:34:13,483] Trial 9 finished with value: -0.2687408185217185 and parameters: {'scalers': 'robust', 'ratios': 'norm_ratio', 'imputers': 'none', 'n_estimators': 1900, 'learning_rate': 0.022993402015583066, 'max_depth': 9, 'min_child_weight': 5, 'subsample': 0.8, 'colsample_bytree': 1.0, 'colsample_bylevel': 0.9, 'reg_alpha': 5.755982544484152, 'reg_lambda': 84.28213676435801, 'gamma': 43.19356996339416}. Best is trial 1 with value: -0.30803312364784236.
[I 2026-07-14 16:34:17,230] Trial 10 finished with value: -0.2039215997468533 and parameters: {'scalers': 'standard', 'ratios': 'log_ratio', 'imputers': 'none', 'n_estimators': 2400, 'learning_rate': 0.004937710270900529, 'max_depth': 8, 'min_child_weight': 3, 'subsample': 0.5, 'colsample_bytree': 0.5, 'colsample_bylevel': 0.6, 'reg_alpha': 7.578736848647501e-06, 'reg_lambda': 2.53202462036428e-05, 'gamma': 3.467004037685097}. Best is trial 1 with value: -0.30803312364784236.
[I 2026-07-14 16:34:25,509] Trial 11 finished with value: -0.3041731514443263 and parameters: {'scalers': 'none', 'ratios': 'log_ratio', 'imputers': 'none', 'n_estimators': 850, 'learning_rate': 0.0002774014627047307, 'max_depth': 9, 'min_child_weight': 9, 'subsample': 0.8, 'colsample_bytree': 0.7, 'colsample_bylevel': 0.5, 'reg_alpha': 0.004546438502107267, 'reg_lambda': 1.401360862531622e-06, 'gamma': 0.028893177549540856}. Best is trial 1 with value: -0.30803312364784236.
[I 2026-07-14 16:34:29,053] Trial 12 finished with value: -0.23492915464393413 and parameters: {'scalers': 'robust', 'ratios': 'norm_ratio', 'imputers': 'none', 'n_estimators': 1950, 'learning_rate': 0.01794851139602244, 'max_depth': 7, 'min_child_weight': 8, 'subsample': 0.9, 'colsample_bytree': 0.5, 'colsample_bylevel': 1.0, 'reg_alpha': 0.0011730961338482762, 'reg_lambda': 6.394479083189204, 'gamma': 20.725177319117197}. Best is trial 1 with value: -0.30803312364784236.
[I 2026-07-14 16:34:37,148] Trial 13 finished with value: -0.19075073598296827 and parameters: {'scalers': 'standard', 'ratios': 'log_ratio', 'imputers': 'none', 'n_estimators': 2450, 'learning_rate': 0.07764879522761622, 'max_depth': 3, 'min_child_weight': 1, 'subsample': 0.8, 'colsample_bytree': 0.7, 'colsample_bylevel': 0.9, 'reg_alpha': 0.30505213448408974, 'reg_lambda': 1.5543808964450993e-06, 'gamma': 3.428665006364085e-05}. Best is trial 1 with value: -0.30803312364784236.
[I 2026-07-14 16:34:41,645] Trial 14 finished with value: -0.24897298557964664 and parameters: {'scalers': 'none', 'ratios': 'norm_ratio', 'imputers': 'median', 'n_estimators': 2100, 'learning_rate': 0.0026338471743789322, 'max_depth': 4, 'min_child_weight': 9, 'subsample': 1.0, 'colsample_bytree': 0.7, 'colsample_bylevel': 0.9, 'reg_alpha': 1.8829297573581856, 'reg_lambda': 65.16051276310358, 'gamma': 25.094784163531674}. Best is trial 1 with value: -0.30803312364784236.
[I 2026-07-14 16:34:42,916] Trial 15 finished with value: -0.3223082133927973 and parameters: {'scalers': 'standard', 'ratios': 'log_ratio', 'imputers': 'mean', 'n_estimators': 250, 'learning_rate': 0.00027663105821959007, 'max_depth': 7, 'min_child_weight': 9, 'subsample': 1.0, 'colsample_bytree': 1.0, 'colsample_bylevel': 0.7, 'reg_alpha': 14.03583155640683, 'reg_lambda': 22.761160505976665, 'gamma': 0.002742205526895409}. Best is trial 15 with value: -0.3223082133927973.
[I 2026-07-14 16:35:13,928] Trial 16 finished with value: -0.18929945975345502 and parameters: {'scalers': 'standard', 'ratios': 'log_ratio', 'imputers': 'median', 'n_estimators': 2950, 'learning_rate': 0.0018492431387225855, 'max_depth': 9, 'min_child_weight': 9, 'subsample': 1.0, 'colsample_bytree': 0.7, 'colsample_bylevel': 0.5, 'reg_alpha': 0.00018349867728972648, 'reg_lambda': 2.671291484929798, 'gamma': 0.00024456093393453957}. Best is trial 15 with value: -0.3223082133927973.
[I 2026-07-14 16:35:36,083] Trial 17 finished with value: -0.2936921608110777 and parameters: {'scalers': 'robust', 'ratios': 'norm_ratio', 'imputers': 'mean', 'n_estimators': 2900, 'learning_rate': 0.00010535157872884591, 'max_depth': 11, 'min_child_weight': 10, 'subsample': 0.6, 'colsample_bytree': 0.8, 'colsample_bylevel': 0.5, 'reg_alpha': 0.04096799289468849, 'reg_lambda': 0.1431393176306169, 'gamma': 0.18290928076133164}. Best is trial 15 with value: -0.3223082133927973.
[I 2026-07-14 16:35:40,180] Trial 18 finished with value: -0.30921787714328586 and parameters: {'scalers': 'robust', 'ratios': 'norm_ratio', 'imputers': 'mean', 'n_estimators': 2150, 'learning_rate': 0.000228939836740681, 'max_depth': 12, 'min_child_weight': 5, 'subsample': 0.7, 'colsample_bytree': 0.8, 'colsample_bylevel': 0.8, 'reg_alpha': 0.014765615787987515, 'reg_lambda': 0.5988046150959468, 'gamma': 66.49021877872273}. Best is trial 15 with value: -0.3223082133927973.
[I 2026-07-14 16:36:08,326] Trial 19 finished with value: -0.2948369012743836 and parameters: {'scalers': 'robust', 'ratios': 'log_ratio', 'imputers': 'mean', 'n_estimators': 2850, 'learning_rate': 0.00010071990498427649, 'max_depth': 12, 'min_child_weight': 10, 'subsample': 0.7, 'colsample_bytree': 0.8, 'colsample_bylevel': 0.5, 'reg_alpha': 0.0244602251736028, 'reg_lambda': 0.0002478918137252671, 'gamma': 0.07949710212348907}. Best is trial 15 with value: -0.3223082133927973.
[I 2026-07-14 16:36:33,527] Trial 21 finished with value: -0.33230596364243753 and parameters: {'scalers': 'robust', 'ratios': 'norm_ratio', 'imputers': 'mean', 'n_estimators': 100, 'learning_rate': 0.0001287403916761543, 'max_depth': 12, 'min_child_weight': 10, 'subsample': 0.6, 'colsample_bytree': 0.8, 'colsample_bylevel': 0.5, 'reg_alpha': 0.013012551051220362, 'reg_lambda': 0.00028137924905731595, 'gamma': 0.09700923125506075}. Best is trial 21 with value: -0.33230596364243753.
[I 2026-07-14 16:36:33,962] Trial 20 finished with value: -0.2848501637445866 and parameters: {'scalers': 'robust', 'ratios': 'log_ratio', 'imputers': 'mean', 'n_estimators': 2700, 'learning_rate': 0.0001404814035179427, 'max_depth': 12, 'min_child_weight': 10, 'subsample': 0.7, 'colsample_bytree': 0.8, 'colsample_bylevel': 0.5, 'reg_alpha': 0.047206851086638295, 'reg_lambda': 0.00025922640563072463, 'gamma': 0.10683010237484873}. Best is trial 21 with value: -0.33230596364243753.
[I 2026-07-14 16:36:37,441] Trial 22 finished with value: -0.3293034040306706 and parameters: {'scalers': 'robust', 'ratios': 'log_ratio', 'imputers': 'mean', 'n_estimators': 300, 'learning_rate': 0.00010780436491974624, 'max_depth': 12, 'min_child_weight': 6, 'subsample': 0.6, 'colsample_bytree': 0.8, 'colsample_bylevel': 0.5, 'reg_alpha': 0.0295048801307364, 'reg_lambda': 0.00019473961637167764, 'gamma': 0.08732707937029317}. Best is trial 21 with value: -0.33230596364243753.
[I 2026-07-14 16:36:38,904] Trial 23 finished with value: -0.3325431029825609 and parameters: {'scalers': 'robust', 'ratios': 'norm_ratio', 'imputers': 'mean', 'n_estimators': 100, 'learning_rate': 0.00010425287950789775, 'max_depth': 11, 'min_child_weight': 6, 'subsample': 0.6, 'colsample_bytree': 0.9, 'colsample_bylevel': 0.7, 'reg_alpha': 0.036151503643286065, 'reg_lambda': 0.28330043998094706, 'gamma': 0.06042098166675325}. Best is trial 23 with value: -0.3325431029825609.
[I 2026-07-14 16:36:42,179] Trial 24 finished with value: -0.3281046625397041 and parameters: {'scalers': 'robust', 'ratios': 'norm_ratio', 'imputers': 'mean', 'n_estimators': 250, 'learning_rate': 0.0001452092737699384, 'max_depth': 12, 'min_child_weight': 6, 'subsample': 0.6, 'colsample_bytree': 0.9, 'colsample_bylevel': 0.7, 'reg_alpha': 0.06774568902921012, 'reg_lambda': 0.06981304444157005, 'gamma': 0.09950185393969212}. Best is trial 23 with value: -0.3325431029825609.
[I 2026-07-14 16:36:42,917] Trial 25 finished with value: -0.3315413580754688 and parameters: {'scalers': 'standard', 'ratios': 'log_ratio', 'imputers': 'mean', 'n_estimators': 150, 'learning_rate': 0.0001097346104329211, 'max_depth': 6, 'min_child_weight': 6, 'subsample': 0.6, 'colsample_bytree': 0.9, 'colsample_bylevel': 0.7, 'reg_alpha': 0.2745579560192097, 'reg_lambda': 0.0023906222349198807, 'gamma': 0.15087953399790527}. Best is trial 23 with value: -0.3325431029825609.
[I 2026-07-14 16:36:43,725] Trial 27 finished with value: -0.3215824898381076 and parameters: {'scalers': 'standard', 'ratios': 'log_ratio', 'imputers': 'mean', 'n_estimators': 100, 'learning_rate': 0.0011651469528247466, 'max_depth': 12, 'min_child_weight': 6, 'subsample': 0.6, 'colsample_bytree': 0.9, 'colsample_bylevel': 0.7, 'reg_alpha': 35.18457969803096, 'reg_lambda': 0.48540193072958693, 'gamma': 5.448556433941407e-06}. Best is trial 23 with value: -0.3325431029825609.
[I 2026-07-14 16:36:43,763] Trial 26 finished with value: -0.30990813479300733 and parameters: {'scalers': 'standard', 'ratios': 'log_ratio', 'imputers': 'mean', 'n_estimators': 250, 'learning_rate': 0.0009910108121307917, 'max_depth': 12, 'min_child_weight': 5, 'subsample': 0.6, 'colsample_bytree': 0.9, 'colsample_bylevel': 0.7, 'reg_alpha': 60.853976766968465, 'reg_lambda': 0.6742370189530583, 'gamma': 2.501173593509419e-06}. Best is trial 23 with value: -0.3325431029825609.
[I 2026-07-14 16:36:44,165] Trial 28 finished with value: -0.3238205240390496 and parameters: {'scalers': 'robust', 'ratios': 'norm_ratio', 'imputers': 'mean', 'n_estimators': 100, 'learning_rate': 0.0010075895463288614, 'max_depth': 12, 'min_child_weight': 6, 'subsample': 0.6, 'colsample_bytree': 0.9, 'colsample_bylevel': 0.7, 'reg_alpha': 72.2345030161227, 'reg_lambda': 0.49855866093707524, 'gamma': 0.012075215522659949}. Best is trial 23 with value: -0.3325431029825609.
[I 2026-07-14 16:36:45,436] Trial 29 finished with value: -0.31746501516783954 and parameters: {'scalers': 'standard', 'ratios': 'norm_ratio', 'imputers': 'mean', 'n_estimators': 100, 'learning_rate': 0.0010131768661687452, 'max_depth': 11, 'min_child_weight': 6, 'subsample': 0.6, 'colsample_bytree': 0.9, 'colsample_bylevel': 0.7, 'reg_alpha': 0.34772095022420696, 'reg_lambda': 0.8420260977037181, 'gamma': 0.0220083205919233}. Best is trial 23 with value: -0.3325431029825609.
[I 2026-07-14 16:36:46,172] Trial 30 finished with value: -0.3165101271345786 and parameters: {'scalers': 'standard', 'ratios': 'log_ratio', 'imputers': 'mean', 'n_estimators': 250, 'learning_rate': 0.0008821687274775308, 'max_depth': 11, 'min_child_weight': 6, 'subsample': 0.6, 'colsample_bytree': 0.9, 'colsample_bylevel': 0.7, 'reg_alpha': 94.41742427361312, 'reg_lambda': 0.0029596469926913855, 'gamma': 0.014880001801129228}. Best is trial 23 with value: -0.3325431029825609.
[I 2026-07-14 16:36:48,983] Trial 31 finished with value: -0.30591356745486215 and parameters: {'scalers': 'robust', 'ratios': 'norm_ratio', 'imputers': 'mean', 'n_estimators': 200, 'learning_rate': 0.0008867142592551686, 'max_depth': 11, 'min_child_weight': 6, 'subsample': 0.6, 'colsample_bytree': 0.9, 'colsample_bylevel': 0.7, 'reg_alpha': 0.23616650405915243, 'reg_lambda': 0.005083099799655219, 'gamma': 0.013083856798473728}. Best is trial 23 with value: -0.3325431029825609.
[I 2026-07-14 16:36:50,314] Trial 32 finished with value: -0.3194253469267102 and parameters: {'scalers': 'robust', 'ratios': 'norm_ratio', 'imputers': 'mean', 'n_estimators': 100, 'learning_rate': 0.0009162760061770962, 'max_depth': 11, 'min_child_weight': 6, 'subsample': 0.6, 'colsample_bytree': 0.9, 'colsample_bylevel': 0.6, 'reg_alpha': 0.329043082705451, 'reg_lambda': 0.0014844274148920027, 'gamma': 0.01434812813728039}. Best is trial 23 with value: -0.3325431029825609.
[I 2026-07-14 16:36:57,314] Trial 33 finished with value: -0.27325182878759535 and parameters: {'scalers': 'standard', 'ratios': 'norm_ratio', 'imputers': 'mean', 'n_estimators': 500, 'learning_rate': 0.0008894197482137439, 'max_depth': 11, 'min_child_weight': 6, 'subsample': 0.6, 'colsample_bytree': 0.9, 'colsample_bylevel': 0.7, 'reg_alpha': 0.3484586146375954, 'reg_lambda': 0.0015224970339391812, 'gamma': 0.012259513619697418}. Best is trial 23 with value: -0.3325431029825609.
[I 2026-07-14 16:37:03,138] Trial 35 finished with value: -0.2855028947690936 and parameters: {'scalers': 'robust', 'ratios': 'norm_ratio', 'imputers': 'mean', 'n_estimators': 550, 'learning_rate': 0.0006256683027965498, 'max_depth': 11, 'min_child_weight': 7, 'subsample': 0.5, 'colsample_bytree': 0.9, 'colsample_bylevel': 0.6, 'reg_alpha': 0.3449058782596652, 'reg_lambda': 0.005065429273524563, 'gamma': 0.01882580165144791}. Best is trial 23 with value: -0.3325431029825609.
[I 2026-07-14 16:37:10,370] Trial 34 finished with value: -0.2840074687131482 and parameters: {'scalers': 'robust', 'ratios': 'norm_ratio', 'imputers': 'mean', 'n_estimators': 550, 'learning_rate': 0.0006536293348348467, 'max_depth': 11, 'min_child_weight': 4, 'subsample': 0.5, 'colsample_bytree': 0.9, 'colsample_bylevel': 0.6, 'reg_alpha': 0.46779725184619714, 'reg_lambda': 0.006390285935144104, 'gamma': 0.015479688818099548}. Best is trial 23 with value: -0.3325431029825609.
[I 2026-07-14 16:37:13,670] Trial 36 finished with value: -0.29359377346747273 and parameters: {'scalers': 'standard', 'ratios': 'norm_ratio', 'imputers': 'mean', 'n_estimators': 550, 'learning_rate': 0.0005532332409303811, 'max_depth': 10, 'min_child_weight': 7, 'subsample': 0.5, 'colsample_bytree': 0.9, 'colsample_bylevel': 0.6, 'reg_alpha': 0.38280345939792465, 'reg_lambda': 0.0021340446176774143, 'gamma': 0.6293443141999889}. Best is trial 23 with value: -0.3325431029825609.
[I 2026-07-14 16:37:17,005] Trial 37 finished with value: -0.29522112899792374 and parameters: {'scalers': 'standard', 'ratios': 'norm_ratio', 'imputers': 'mean', 'n_estimators': 550, 'learning_rate': 0.000529378800423956, 'max_depth': 11, 'min_child_weight': 7, 'subsample': 0.5, 'colsample_bytree': 0.9, 'colsample_bylevel': 0.6, 'reg_alpha': 0.22567804396923394, 'reg_lambda': 0.003527426395688741, 'gamma': 0.7047722383397947}. Best is trial 23 with value: -0.3325431029825609.
[I 2026-07-14 16:37:20,506] Trial 38 finished with value: -0.31913589125909464 and parameters: {'scalers': 'robust', 'ratios': 'norm_ratio', 'imputers': 'mean', 'n_estimators': 550, 'learning_rate': 0.00019435556081654604, 'max_depth': 10, 'min_child_weight': 7, 'subsample': 0.5, 'colsample_bytree': 0.8, 'colsample_bylevel': 0.6, 'reg_alpha': 0.20578203358572353, 'reg_lambda': 0.002229020795906229, 'gamma': 0.5186879502654357}. Best is trial 23 with value: -0.3325431029825609.
[I 2026-07-14 16:37:24,206] Trial 39 finished with value: -0.3194475472849399 and parameters: {'scalers': 'robust', 'ratios': 'norm_ratio', 'imputers': 'mean', 'n_estimators': 550, 'learning_rate': 0.00019194350402554808, 'max_depth': 11, 'min_child_weight': 7, 'subsample': 0.5, 'colsample_bytree': 0.8, 'colsample_bylevel': 0.6, 'reg_alpha': 0.00414888444863723, 'reg_lambda': 0.0010564400328002752, 'gamma': 0.5841144189850186}. Best is trial 23 with value: -0.3325431029825609.
[I 2026-07-14 16:37:27,885] Trial 40 finished with value: -0.3183258169683077 and parameters: {'scalers': 'robust', 'ratios': 'norm_ratio', 'imputers': 'mean', 'n_estimators': 550, 'learning_rate': 0.00020562781899042518, 'max_depth': 10, 'min_child_weight': 7, 'subsample': 0.5, 'colsample_bytree': 0.8, 'colsample_bylevel': 0.6, 'reg_alpha': 0.00513165507765629, 'reg_lambda': 4.2127020701862735e-05, 'gamma': 0.5357850353103806}. Best is trial 23 with value: -0.3325431029825609.
[I 2026-07-14 16:37:31,213] Trial 41 finished with value: -0.3200314083959623 and parameters: {'scalers': 'robust', 'ratios': 'log_ratio', 'imputers': 'mean', 'n_estimators': 550, 'learning_rate': 0.00018548506059367614, 'max_depth': 10, 'min_child_weight': 7, 'subsample': 0.5, 'colsample_bytree': 0.8, 'colsample_bylevel': 0.6, 'reg_alpha': 0.004507377117756226, 'reg_lambda': 0.018549852812651205, 'gamma': 0.6973549552173612}. Best is trial 23 with value: -0.3325431029825609.
[I 2026-07-14 16:37:38,588] Trial 42 finished with value: -0.30962875799081935 and parameters: {'scalers': 'robust', 'ratios': 'log_ratio', 'imputers': 'mean', 'n_estimators': 750, 'learning_rate': 0.0002306471530594095, 'max_depth': 10, 'min_child_weight': 4, 'subsample': 0.5, 'colsample_bytree': 0.8, 'colsample_bylevel': 0.8, 'reg_alpha': 0.004596255696470325, 'reg_lambda': 0.016082723854376004, 'gamma': 0.5165915683733612}. Best is trial 23 with value: -0.3325431029825609.
[I 2026-07-14 16:37:44,541] Trial 43 finished with value: -0.3112972768608867 and parameters: {'scalers': 'robust', 'ratios': 'log_ratio', 'imputers': 'mean', 'n_estimators': 850, 'learning_rate': 0.0001926480924547221, 'max_depth': 10, 'min_child_weight': 7, 'subsample': 0.5, 'colsample_bytree': 0.8, 'colsample_bylevel': 0.8, 'reg_alpha': 0.004648488303980625, 'reg_lambda': 2.555915554323857e-05, 'gamma': 0.7842850634361386}. Best is trial 23 with value: -0.3325431029825609.
[I 2026-07-14 16:37:51,318] Trial 44 finished with value: -0.3127087551609623 and parameters: {'scalers': 'robust', 'ratios': 'log_ratio', 'imputers': 'median', 'n_estimators': 750, 'learning_rate': 0.0001946794278874301, 'max_depth': 10, 'min_child_weight': 7, 'subsample': 0.7, 'colsample_bytree': 0.8, 'colsample_bylevel': 0.8, 'reg_alpha': 0.004827918434034335, 'reg_lambda': 2.536108526397254e-05, 'gamma': 0.7397155887550727}. Best is trial 23 with value: -0.3325431029825609.
