[I 2026-07-14 16:55:56,109] A new study created in RDB with name: my-study
[I 2026-07-14 16:56:18,673] Trial 1 finished with value: -0.6640253609435467 and parameters: {'scalers': 'robust', 'ratios': 'log_ratio', 'imputers': 'none', 'n_estimators': 1750, 'learning_rate': 0.000633025521792057, 'max_depth': 8, 'min_child_weight': 7, 'subsample': 0.8, 'colsample_bytree': 0.8, 'colsample_bylevel': 0.6, 'reg_alpha': 0.001756219327679546, 'reg_lambda': 1.0064899268793127e-05, 'gamma': 2.0050573550072405e-06}. Best is trial 1 with value: -0.6640253609435467.
[I 2026-07-14 16:56:21,288] Trial 0 finished with value: -0.7196728849824321 and parameters: {'scalers': 'standard', 'ratios': 'log_ratio', 'imputers': 'none', 'n_estimators': 1050, 'learning_rate': 0.0006336761873734201, 'max_depth': 12, 'min_child_weight': 2, 'subsample': 0.5, 'colsample_bytree': 0.6, 'colsample_bylevel': 0.7, 'reg_alpha': 12.479566604728472, 'reg_lambda': 0.5048911165733914, 'gamma': 0.49512207584867196}. Best is trial 0 with value: -0.7196728849824321.
[I 2026-07-14 16:56:29,694] Trial 3 finished with value: -0.6330691284163467 and parameters: {'scalers': 'none', 'ratios': 'norm_ratio', 'imputers': 'median', 'n_estimators': 2600, 'learning_rate': 0.004108777367436912, 'max_depth': 5, 'min_child_weight': 7, 'subsample': 0.9, 'colsample_bytree': 0.8, 'colsample_bylevel': 0.5, 'reg_alpha': 0.9892067570248086, 'reg_lambda': 0.0032556060751913907, 'gamma': 0.15475153469334602}. Best is trial 0 with value: -0.7196728849824321.
[I 2026-07-14 16:56:31,728] Trial 2 finished with value: -0.7082919268632004 and parameters: {'scalers': 'standard', 'ratios': 'log_ratio', 'imputers': 'mean', 'n_estimators': 150, 'learning_rate': 0.12032439500448455, 'max_depth': 12, 'min_child_weight': 7, 'subsample': 0.6, 'colsample_bytree': 0.6, 'colsample_bylevel': 0.6, 'reg_alpha': 9.202025112338479e-05, 'reg_lambda': 13.328167616266834, 'gamma': 0.0018137569468092102}. Best is trial 0 with value: -0.7196728849824321.
[I 2026-07-14 16:56:53,570] Trial 4 finished with value: -0.6932998807866199 and parameters: {'scalers': 'none', 'ratios': 'norm_ratio', 'imputers': 'mean', 'n_estimators': 2150, 'learning_rate': 0.00032799213881112865, 'max_depth': 12, 'min_child_weight': 7, 'subsample': 0.5, 'colsample_bytree': 0.6, 'colsample_bylevel': 0.8, 'reg_alpha': 0.08121841147292796, 'reg_lambda': 19.888230192372454, 'gamma': 0.0015636095153091281}. Best is trial 0 with value: -0.7196728849824321.
[I 2026-07-14 16:56:56,919] Trial 5 finished with value: -0.652994840405678 and parameters: {'scalers': 'none', 'ratios': 'norm_ratio', 'imputers': 'median', 'n_estimators': 1850, 'learning_rate': 0.23174338435764172, 'max_depth': 9, 'min_child_weight': 6, 'subsample': 0.9, 'colsample_bytree': 0.9, 'colsample_bylevel': 0.5, 'reg_alpha': 4.669666842299577e-05, 'reg_lambda': 1.4265975773583185e-06, 'gamma': 4.520083593250122}. Best is trial 0 with value: -0.7196728849824321.
[I 2026-07-14 16:57:15,667] Trial 6 finished with value: -0.7567289272208537 and parameters: {'scalers': 'robust', 'ratios': 'norm_ratio', 'imputers': 'none', 'n_estimators': 2850, 'learning_rate': 0.11182703260898945, 'max_depth': 8, 'min_child_weight': 4, 'subsample': 0.7, 'colsample_bytree': 0.8, 'colsample_bylevel': 0.6, 'reg_alpha': 0.010165059582999918, 'reg_lambda': 0.0014966206372006305, 'gamma': 0.12458915324735961}. Best is trial 6 with value: -0.7567289272208537.
[I 2026-07-14 16:57:28,841] Trial 7 finished with value: -0.7556342720041902 and parameters: {'scalers': 'standard', 'ratios': 'norm_ratio', 'imputers': 'median', 'n_estimators': 3000, 'learning_rate': 0.05853756843959451, 'max_depth': 5, 'min_child_weight': 1, 'subsample': 0.6, 'colsample_bytree': 0.7, 'colsample_bylevel': 0.7, 'reg_alpha': 1.1350549213546754e-05, 'reg_lambda': 0.9739783291997428, 'gamma': 0.00020857640788491}. Best is trial 6 with value: -0.7567289272208537.
[I 2026-07-14 16:57:52,955] Trial 8 finished with value: -0.6426046149281666 and parameters: {'scalers': 'none', 'ratios': 'log_ratio', 'imputers': 'none', 'n_estimators': 3000, 'learning_rate': 0.002615954880658331, 'max_depth': 6, 'min_child_weight': 7, 'subsample': 0.8, 'colsample_bytree': 0.8, 'colsample_bylevel': 0.8, 'reg_alpha': 9.603209354854295e-06, 'reg_lambda': 17.37195655661828, 'gamma': 1.6246106746445315e-05}. Best is trial 6 with value: -0.7567289272208537.
[I 2026-07-14 16:57:57,027] Trial 9 finished with value: -0.7912456063047164 and parameters: {'scalers': 'robust', 'ratios': 'norm_ratio', 'imputers': 'mean', 'n_estimators': 2800, 'learning_rate': 0.005783206311969169, 'max_depth': 9, 'min_child_weight': 1, 'subsample': 0.6, 'colsample_bytree': 0.5, 'colsample_bylevel': 0.8, 'reg_alpha': 6.691452573285088e-05, 'reg_lambda': 0.0022426030410150903, 'gamma': 90.2143125741117}. Best is trial 9 with value: -0.7912456063047164.
[I 2026-07-14 16:57:59,456] Trial 10 finished with value: -0.7009350106768576 and parameters: {'scalers': 'robust', 'ratios': 'norm_ratio', 'imputers': 'none', 'n_estimators': 1100, 'learning_rate': 0.0012832029661399352, 'max_depth': 11, 'min_child_weight': 7, 'subsample': 0.7, 'colsample_bytree': 0.9, 'colsample_bylevel': 0.6, 'reg_alpha': 65.57477117202653, 'reg_lambda': 0.03223236715061172, 'gamma': 0.5766474812709389}. Best is trial 9 with value: -0.7912456063047164.
[I 2026-07-14 16:58:40,616] Trial 11 finished with value: -0.6518854560437071 and parameters: {'scalers': 'none', 'ratios': 'norm_ratio', 'imputers': 'none', 'n_estimators': 1700, 'learning_rate': 0.0021764629166767403, 'max_depth': 12, 'min_child_weight': 3, 'subsample': 0.9, 'colsample_bytree': 0.6, 'colsample_bylevel': 0.8, 'reg_alpha': 3.9528113505528495e-06, 'reg_lambda': 0.012327097221411903, 'gamma': 5.638643096842235e-06}. Best is trial 9 with value: -0.7912456063047164.
[I 2026-07-14 16:58:44,989] Trial 12 finished with value: -0.6493045086919345 and parameters: {'scalers': 'robust', 'ratios': 'log_ratio', 'imputers': 'none', 'n_estimators': 1500, 'learning_rate': 0.0011654741014207478, 'max_depth': 3, 'min_child_weight': 7, 'subsample': 0.7, 'colsample_bytree': 1.0, 'colsample_bylevel': 0.5, 'reg_alpha': 1.76937389429193e-05, 'reg_lambda': 0.7588546444438196, 'gamma': 0.005595566976011962}. Best is trial 9 with value: -0.7912456063047164.
[I 2026-07-14 16:58:47,523] Trial 13 finished with value: -0.6546838718936457 and parameters: {'scalers': 'none', 'ratios': 'norm_ratio', 'imputers': 'none', 'n_estimators': 1400, 'learning_rate': 0.0066697642474119, 'max_depth': 9, 'min_child_weight': 1, 'subsample': 0.8, 'colsample_bytree': 0.7, 'colsample_bylevel': 0.7, 'reg_alpha': 0.01630858350881741, 'reg_lambda': 1.7378363759777238e-06, 'gamma': 4.013876309451522}. Best is trial 9 with value: -0.7912456063047164.
[I 2026-07-14 16:59:20,386] Trial 14 finished with value: -0.7382072013241041 and parameters: {'scalers': 'none', 'ratios': 'norm_ratio', 'imputers': 'median', 'n_estimators': 1900, 'learning_rate': 0.00014667600794203257, 'max_depth': 12, 'min_child_weight': 8, 'subsample': 0.8, 'colsample_bytree': 0.7, 'colsample_bylevel': 0.9, 'reg_alpha': 9.82266593862612e-05, 'reg_lambda': 2.917592651399722, 'gamma': 0.02673370807618356}. Best is trial 9 with value: -0.7912456063047164.
[I 2026-07-14 16:59:20,489] Trial 15 finished with value: -0.664955437325999 and parameters: {'scalers': 'standard', 'ratios': 'log_ratio', 'imputers': 'median', 'n_estimators': 100, 'learning_rate': 0.011191648304087486, 'max_depth': 12, 'min_child_weight': 8, 'subsample': 0.6, 'colsample_bytree': 0.6, 'colsample_bylevel': 0.5, 'reg_alpha': 4.949571263273273e-06, 'reg_lambda': 8.426076185527708e-06, 'gamma': 1.1697656689036774e-05}. Best is trial 9 with value: -0.7912456063047164.
[I 2026-07-14 16:59:28,227] Trial 16 finished with value: -0.6839196685769574 and parameters: {'scalers': 'standard', 'ratios': 'log_ratio', 'imputers': 'median', 'n_estimators': 350, 'learning_rate': 0.03549535781686305, 'max_depth': 12, 'min_child_weight': 9, 'subsample': 0.8, 'colsample_bytree': 0.9, 'colsample_bylevel': 0.9, 'reg_alpha': 8.009979867960687e-05, 'reg_lambda': 2.2808086067158158, 'gamma': 7.50067826155711e-06}. Best is trial 9 with value: -0.7912456063047164.
[I 2026-07-14 16:59:28,457] Trial 17 finished with value: -0.7828511025020446 and parameters: {'scalers': 'robust', 'ratios': 'norm_ratio', 'imputers': 'mean', 'n_estimators': 300, 'learning_rate': 0.0133286669627161, 'max_depth': 10, 'min_child_weight': 9, 'subsample': 1.0, 'colsample_bytree': 1.0, 'colsample_bylevel': 1.0, 'reg_alpha': 63.97951403363543, 'reg_lambda': 0.0004673374799643802, 'gamma': 59.053898287604376}. Best is trial 9 with value: -0.7912456063047164.
[I 2026-07-14 16:59:32,388] Trial 18 finished with value: -0.7357291729969841 and parameters: {'scalers': 'robust', 'ratios': 'norm_ratio', 'imputers': 'mean', 'n_estimators': 2450, 'learning_rate': 0.013094422229279553, 'max_depth': 8, 'min_child_weight': 4, 'subsample': 0.7, 'colsample_bytree': 0.5, 'colsample_bylevel': 1.0, 'reg_alpha': 0.005061063863148977, 'reg_lambda': 0.00035848321927932385, 'gamma': 48.377897162151065}. Best is trial 9 with value: -0.7912456063047164.
[I 2026-07-14 16:59:36,167] Trial 19 finished with value: -0.7596776372480256 and parameters: {'scalers': 'robust', 'ratios': 'norm_ratio', 'imputers': 'mean', 'n_estimators': 2400, 'learning_rate': 0.021945105707294698, 'max_depth': 8, 'min_child_weight': 10, 'subsample': 0.7, 'colsample_bytree': 0.5, 'colsample_bylevel': 0.9, 'reg_alpha': 0.007338970152023355, 'reg_lambda': 0.0003937545424207107, 'gamma': 69.23911386364517}. Best is trial 9 with value: -0.7912456063047164.
[I 2026-07-14 16:59:40,004] Trial 20 finished with value: -0.7900559281079973 and parameters: {'scalers': 'robust', 'ratios': 'norm_ratio', 'imputers': 'mean', 'n_estimators': 2450, 'learning_rate': 0.018823972780778686, 'max_depth': 9, 'min_child_weight': 4, 'subsample': 0.7, 'colsample_bytree': 0.5, 'colsample_bylevel': 0.9, 'reg_alpha': 0.002163612416579573, 'reg_lambda': 0.00022348375266803344, 'gamma': 94.20587275491992}. Best is trial 9 with value: -0.7912456063047164.
[I 2026-07-14 16:59:43,621] Trial 21 finished with value: -0.7913973345232271 and parameters: {'scalers': 'robust', 'ratios': 'norm_ratio', 'imputers': 'mean', 'n_estimators': 2400, 'learning_rate': 0.022412304461070388, 'max_depth': 8, 'min_child_weight': 4, 'subsample': 0.6, 'colsample_bytree': 0.5, 'colsample_bylevel': 1.0, 'reg_alpha': 0.0014092902125336605, 'reg_lambda': 0.0002416138027808112, 'gamma': 92.37196109079967}. Best is trial 21 with value: -0.7913973345232271.
[I 2026-07-14 16:59:47,554] Trial 22 finished with value: -0.776708709976645 and parameters: {'scalers': 'robust', 'ratios': 'norm_ratio', 'imputers': 'mean', 'n_estimators': 2450, 'learning_rate': 0.024908775526647945, 'max_depth': 8, 'min_child_weight': 4, 'subsample': 0.7, 'colsample_bytree': 0.5, 'colsample_bylevel': 1.0, 'reg_alpha': 0.0012947315065585988, 'reg_lambda': 0.0004685315579999384, 'gamma': 84.33704653714226}. Best is trial 21 with value: -0.7913973345232271.
[I 2026-07-14 16:59:51,640] Trial 23 finished with value: -0.7835168724188464 and parameters: {'scalers': 'robust', 'ratios': 'norm_ratio', 'imputers': 'mean', 'n_estimators': 2550, 'learning_rate': 0.026148578335490127, 'max_depth': 8, 'min_child_weight': 4, 'subsample': 0.7, 'colsample_bytree': 0.5, 'colsample_bylevel': 1.0, 'reg_alpha': 0.001298971599208288, 'reg_lambda': 0.00040157701898116714, 'gamma': 89.19805380675247}. Best is trial 21 with value: -0.7913973345232271.
[I 2026-07-14 16:59:55,656] Trial 24 finished with value: -0.791049075318615 and parameters: {'scalers': 'robust', 'ratios': 'norm_ratio', 'imputers': 'mean', 'n_estimators': 2500, 'learning_rate': 0.016317319895080326, 'max_depth': 8, 'min_child_weight': 4, 'subsample': 0.7, 'colsample_bytree': 0.5, 'colsample_bylevel': 1.0, 'reg_alpha': 0.0011804236967945846, 'reg_lambda': 0.0005503471696964894, 'gamma': 99.32762965588026}. Best is trial 21 with value: -0.7913973345232271.
[I 2026-07-14 16:59:56,878] Trial 25 finished with value: -0.7385166484043593 and parameters: {'scalers': 'robust', 'ratios': 'norm_ratio', 'imputers': 'mean', 'n_estimators': 650, 'learning_rate': 0.015948855259742805, 'max_depth': 10, 'min_child_weight': 10, 'subsample': 1.0, 'colsample_bytree': 0.5, 'colsample_bylevel': 1.0, 'reg_alpha': 1.147039202377813, 'reg_lambda': 0.00026485833214501384, 'gamma': 57.557853921617316}. Best is trial 21 with value: -0.7913973345232271.
[I 2026-07-14 16:59:58,140] Trial 26 finished with value: -0.7716594186627365 and parameters: {'scalers': 'robust', 'ratios': 'norm_ratio', 'imputers': 'mean', 'n_estimators': 600, 'learning_rate': 0.022490633839442668, 'max_depth': 10, 'min_child_weight': 5, 'subsample': 1.0, 'colsample_bytree': 1.0, 'colsample_bylevel': 1.0, 'reg_alpha': 1.1600024915666578, 'reg_lambda': 0.0001363091825922812, 'gamma': 93.14934547502742}. Best is trial 21 with value: -0.7913973345232271.
[I 2026-07-14 16:59:59,489] Trial 27 finished with value: -0.6778450330001703 and parameters: {'scalers': 'robust', 'ratios': 'norm_ratio', 'imputers': 'mean', 'n_estimators': 550, 'learning_rate': 0.0067219800966320025, 'max_depth': 10, 'min_child_weight': 5, 'subsample': 1.0, 'colsample_bytree': 1.0, 'colsample_bylevel': 1.0, 'reg_alpha': 0.5695220814625447, 'reg_lambda': 3.7684832889373003e-05, 'gamma': 10.032460064119489}. Best is trial 21 with value: -0.7913973345232271.
[I 2026-07-14 17:00:01,170] Trial 28 finished with value: -0.6790061623261847 and parameters: {'scalers': 'robust', 'ratios': 'norm_ratio', 'imputers': 'mean', 'n_estimators': 850, 'learning_rate': 0.007688339534553388, 'max_depth': 10, 'min_child_weight': 5, 'subsample': 1.0, 'colsample_bytree': 0.5, 'colsample_bylevel': 1.0, 'reg_alpha': 0.0006263763677983701, 'reg_lambda': 0.00011734106424080518, 'gamma': 10.951999015147523}. Best is trial 21 with value: -0.7913973345232271.
[I 2026-07-14 17:00:05,191] Trial 29 finished with value: -0.6696800874822075 and parameters: {'scalers': 'robust', 'ratios': 'norm_ratio', 'imputers': 'mean', 'n_estimators': 2650, 'learning_rate': 0.039731513749887565, 'max_depth': 7, 'min_child_weight': 5, 'subsample': 0.6, 'colsample_bytree': 0.5, 'colsample_bylevel': 1.0, 'reg_alpha': 0.0006945462254930644, 'reg_lambda': 5.5735823589787556e-05, 'gamma': 9.114805282137889}. Best is trial 21 with value: -0.7913973345232271.
[I 2026-07-14 17:00:09,368] Trial 30 finished with value: -0.6570201940875344 and parameters: {'scalers': 'robust', 'ratios': 'norm_ratio', 'imputers': 'mean', 'n_estimators': 2700, 'learning_rate': 0.006939047329612254, 'max_depth': 10, 'min_child_weight': 5, 'subsample': 0.6, 'colsample_bytree': 0.5, 'colsample_bylevel': 0.9, 'reg_alpha': 0.0003937621204025662, 'reg_lambda': 5.6915544685232213e-05, 'gamma': 5.134402784817803}. Best is trial 21 with value: -0.7913973345232271.
[I 2026-07-14 17:00:13,455] Trial 31 finished with value: -0.6657063216457518 and parameters: {'scalers': 'robust', 'ratios': 'norm_ratio', 'imputers': 'mean', 'n_estimators': 2750, 'learning_rate': 0.06118984668069859, 'max_depth': 10, 'min_child_weight': 5, 'subsample': 0.6, 'colsample_bytree': 0.5, 'colsample_bylevel': 0.9, 'reg_alpha': 0.00031338731163563715, 'reg_lambda': 1.7799412466506212e-05, 'gamma': 8.273347311478256}. Best is trial 21 with value: -0.7913973345232271.
[I 2026-07-14 17:00:16,838] Trial 32 finished with value: -0.6750379695586377 and parameters: {'scalers': 'robust', 'ratios': 'norm_ratio', 'imputers': 'mean', 'n_estimators': 2150, 'learning_rate': 0.006094473479356435, 'max_depth': 7, 'min_child_weight': 5, 'subsample': 0.6, 'colsample_bytree': 0.5, 'colsample_bylevel': 1.0, 'reg_alpha': 0.0003455470216272165, 'reg_lambda': 3.4859790420598486e-05, 'gamma': 10.161415103838387}. Best is trial 21 with value: -0.7913973345232271.
[I 2026-07-14 17:00:20,172] Trial 33 finished with value: -0.6597415744067745 and parameters: {'scalers': 'robust', 'ratios': 'norm_ratio', 'imputers': 'mean', 'n_estimators': 2150, 'learning_rate': 0.006413379132725117, 'max_depth': 6, 'min_child_weight': 5, 'subsample': 0.6, 'colsample_bytree': 0.5, 'colsample_bylevel': 0.9, 'reg_alpha': 0.0004069286345384421, 'reg_lambda': 2.352595655095555e-05, 'gamma': 5.5784021078954}. Best is trial 21 with value: -0.7913973345232271.
[I 2026-07-14 17:00:23,392] Trial 34 finished with value: -0.672355855629603 and parameters: {'scalers': 'robust', 'ratios': 'norm_ratio', 'imputers': 'mean', 'n_estimators': 2100, 'learning_rate': 0.006399258361116149, 'max_depth': 7, 'min_child_weight': 2, 'subsample': 0.6, 'colsample_bytree': 0.5, 'colsample_bylevel': 0.9, 'reg_alpha': 0.0004236083908466866, 'reg_lambda': 3.406338837984731e-05, 'gamma': 8.80322239415599}. Best is trial 21 with value: -0.7913973345232271.
[I 2026-07-14 17:00:26,579] Trial 35 finished with value: -0.6770825049560512 and parameters: {'scalers': 'robust', 'ratios': 'norm_ratio', 'imputers': 'mean', 'n_estimators': 2150, 'learning_rate': 0.4241721439084415, 'max_depth': 7, 'min_child_weight': 2, 'subsample': 0.6, 'colsample_bytree': 0.5, 'colsample_bylevel': 0.9, 'reg_alpha': 0.0003903562319472379, 'reg_lambda': 0.06476110348176671, 'gamma': 10.691211975737767}. Best is trial 21 with value: -0.7913973345232271.
[I 2026-07-14 17:00:31,863] Trial 36 finished with value: -0.6530119049385247 and parameters: {'scalers': 'robust', 'ratios': 'norm_ratio', 'imputers': 'mean', 'n_estimators': 2150, 'learning_rate': 0.07236054886366554, 'max_depth': 7, 'min_child_weight': 2, 'subsample': 0.5, 'colsample_bytree': 0.6, 'colsample_bylevel': 0.9, 'reg_alpha': 1.1159260082877666e-06, 'reg_lambda': 0.07093791632450258, 'gamma': 1.2674274736513373}. Best is trial 21 with value: -0.7913973345232271.
[I 2026-07-14 17:00:36,303] Trial 37 finished with value: -0.6472661842776818 and parameters: {'scalers': 'robust', 'ratios': 'norm_ratio', 'imputers': 'mean', 'n_estimators': 2250, 'learning_rate': 0.05411763049938277, 'max_depth': 7, 'min_child_weight': 2, 'subsample': 0.5, 'colsample_bytree': 0.6, 'colsample_bylevel': 0.9, 'reg_alpha': 1.4617670621391047e-06, 'reg_lambda': 0.06008809001090495, 'gamma': 1.4164875316818886}. Best is trial 21 with value: -0.7913973345232271.
[I 2026-07-14 17:00:42,792] Trial 38 finished with value: -0.6578465776360859 and parameters: {'scalers': 'robust', 'ratios': 'norm_ratio', 'imputers': 'mean', 'n_estimators': 2150, 'learning_rate': 0.07351187216641929, 'max_depth': 7, 'min_child_weight': 2, 'subsample': 0.5, 'colsample_bytree': 0.6, 'colsample_bylevel': 0.9, 'reg_alpha': 0.029929213449056337, 'reg_lambda': 0.026578400471169213, 'gamma': 1.1330397926189988}. Best is trial 21 with value: -0.7913973345232271.
[I 2026-07-14 17:00:49,546] Trial 39 finished with value: -0.6409031493728093 and parameters: {'scalers': 'robust', 'ratios': 'norm_ratio', 'imputers': 'mean', 'n_estimators': 2200, 'learning_rate': 0.0035640961213119953, 'max_depth': 7, 'min_child_weight': 2, 'subsample': 0.5, 'colsample_bytree': 0.6, 'colsample_bylevel': 0.8, 'reg_alpha': 0.044223804772570006, 'reg_lambda': 0.032940376295618176, 'gamma': 1.198851144027708}. Best is trial 21 with value: -0.7913973345232271.
[I 2026-07-14 17:00:58,611] Trial 40 finished with value: -0.6402014105142436 and parameters: {'scalers': 'robust', 'ratios': 'norm_ratio', 'imputers': 'mean', 'n_estimators': 2150, 'learning_rate': 0.0037133838031558003, 'max_depth': 9, 'min_child_weight': 2, 'subsample': 0.5, 'colsample_bytree': 0.6, 'colsample_bylevel': 0.8, 'reg_alpha': 0.057687449510473346, 'reg_lambda': 0.0649085291041394, 'gamma': 1.0718894830905832}. Best is trial 21 with value: -0.7913973345232271.
[I 2026-07-14 17:01:01,966] Trial 41 finished with value: -0.7173347940122393 and parameters: {'scalers': 'robust', 'ratios': 'log_ratio', 'imputers': 'mean', 'n_estimators': 2300, 'learning_rate': 0.0034177696762913365, 'max_depth': 9, 'min_child_weight': 2, 'subsample': 0.5, 'colsample_bytree': 0.6, 'colsample_bylevel': 0.8, 'reg_alpha': 0.023667791511642385, 'reg_lambda': 0.07338470365216802, 'gamma': 27.027530729783496}. Best is trial 21 with value: -0.7913973345232271.
[I 2026-07-14 17:01:05,299] Trial 42 finished with value: -0.7068865668492793 and parameters: {'scalers': 'standard', 'ratios': 'log_ratio', 'imputers': 'mean', 'n_estimators': 2350, 'learning_rate': 0.09928132267407416, 'max_depth': 9, 'min_child_weight': 3, 'subsample': 0.5, 'colsample_bytree': 0.6, 'colsample_bylevel': 0.8, 'reg_alpha': 1.0396884348038279e-06, 'reg_lambda': 0.0030706629837327494, 'gamma': 25.24149879645553}. Best is trial 21 with value: -0.7913973345232271.
[I 2026-07-14 17:01:13,745] Trial 43 finished with value: -0.6407384893556157 and parameters: {'scalers': 'standard', 'ratios': 'log_ratio', 'imputers': 'mean', 'n_estimators': 2350, 'learning_rate': 0.0028638800153087487, 'max_depth': 8, 'min_child_weight': 3, 'subsample': 0.5, 'colsample_bytree': 0.6, 'colsample_bylevel': 0.8, 'reg_alpha': 0.04468737088339673, 'reg_lambda': 0.00242761801089798, 'gamma': 1.1127276664566101}. Best is trial 21 with value: -0.7913973345232271.
[I 2026-07-14 17:01:17,158] Trial 44 finished with value: -0.7126164681636636 and parameters: {'scalers': 'standard', 'ratios': 'log_ratio', 'imputers': 'mean', 'n_estimators': 2350, 'learning_rate': 0.0033692138926084505, 'max_depth': 9, 'min_child_weight': 3, 'subsample': 0.5, 'colsample_bytree': 0.6, 'colsample_bylevel': 0.8, 'reg_alpha': 0.04353739926636487, 'reg_lambda': 0.0017511285729819278, 'gamma': 24.66476690226005}. Best is trial 21 with value: -0.7913973345232271.
