[I 2026-07-14 20:53:22,327] A new study created in RDB with name: my-study
[I 2026-07-14 20:53:28,342] Trial 2 finished with value: -0.0526495379198037 and parameters: {'scalers': 'standard', 'ratios': 'log_ratio', 'imputers': 'mean', 'n_estimators': 2150, 'learning_rate': 0.0001965292150059182, 'max_depth': 8, 'min_child_weight': 4, 'subsample': 1.0, 'colsample_bytree': 0.8, 'colsample_bylevel': 0.6, 'reg_alpha': 86.5764018155784, 'reg_lambda': 0.142029510195343, 'gamma': 1.902070947275369e-05}. Best is trial 2 with value: -0.0526495379198037.
[I 2026-07-14 20:53:33,622] Trial 0 finished with value: -0.05906109974900096 and parameters: {'scalers': 'none', 'ratios': 'log_ratio', 'imputers': 'median', 'n_estimators': 1450, 'learning_rate': 0.043734009246303586, 'max_depth': 5, 'min_child_weight': 6, 'subsample': 0.8, 'colsample_bytree': 0.9, 'colsample_bylevel': 0.9, 'reg_alpha': 0.050118556778805, 'reg_lambda': 9.49321673060984e-06, 'gamma': 0.0007349027080948419}. Best is trial 0 with value: -0.05906109974900096.
[I 2026-07-14 20:53:42,323] Trial 1 finished with value: -0.051635854492577356 and parameters: {'scalers': 'robust', 'ratios': 'log_ratio', 'imputers': 'none', 'n_estimators': 2550, 'learning_rate': 0.0005042427440942787, 'max_depth': 7, 'min_child_weight': 5, 'subsample': 0.6, 'colsample_bytree': 0.5, 'colsample_bylevel': 0.5, 'reg_alpha': 0.000463454867220249, 'reg_lambda': 6.344978371442002e-06, 'gamma': 5.0556067207028864e-05}. Best is trial 0 with value: -0.05906109974900096.
[I 2026-07-14 20:53:59,573] Trial 3 finished with value: -0.052654318370315915 and parameters: {'scalers': 'none', 'ratios': 'log_ratio', 'imputers': 'mean', 'n_estimators': 1650, 'learning_rate': 0.0003610497232672488, 'max_depth': 11, 'min_child_weight': 2, 'subsample': 0.6, 'colsample_bytree': 0.6, 'colsample_bylevel': 1.0, 'reg_alpha': 0.1694273263956078, 'reg_lambda': 0.0013966815866497276, 'gamma': 1.0173365876110816e-06}. Best is trial 0 with value: -0.05906109974900096.
[I 2026-07-14 20:54:01,473] Trial 4 finished with value: -0.08227560502062162 and parameters: {'scalers': 'none', 'ratios': 'log_ratio', 'imputers': 'none', 'n_estimators': 250, 'learning_rate': 0.18542460698143387, 'max_depth': 10, 'min_child_weight': 3, 'subsample': 0.6, 'colsample_bytree': 0.9, 'colsample_bylevel': 0.8, 'reg_alpha': 0.000546921057893935, 'reg_lambda': 0.0017054730180719145, 'gamma': 0.054523914261750905}. Best is trial 4 with value: -0.08227560502062162.
[I 2026-07-14 20:54:15,727] Trial 5 finished with value: -0.052397816633265995 and parameters: {'scalers': 'none', 'ratios': 'norm_ratio', 'imputers': 'mean', 'n_estimators': 2400, 'learning_rate': 0.0010598560282900433, 'max_depth': 7, 'min_child_weight': 8, 'subsample': 0.9, 'colsample_bytree': 0.9, 'colsample_bylevel': 0.7, 'reg_alpha': 0.09633122585723582, 'reg_lambda': 15.521172887021507, 'gamma': 1.2558996563153124e-06}. Best is trial 4 with value: -0.08227560502062162.
[I 2026-07-14 20:54:17,477] Trial 6 finished with value: -0.052636440042359095 and parameters: {'scalers': 'standard', 'ratios': 'norm_ratio', 'imputers': 'median', 'n_estimators': 1450, 'learning_rate': 0.02101544977843335, 'max_depth': 6, 'min_child_weight': 10, 'subsample': 0.7, 'colsample_bytree': 0.9, 'colsample_bylevel': 0.8, 'reg_alpha': 5.284585380665982, 'reg_lambda': 3.131594987156284e-05, 'gamma': 4.5359412981366924}. Best is trial 4 with value: -0.08227560502062162.
[I 2026-07-14 20:54:37,446] Trial 7 finished with value: -0.07757714001827873 and parameters: {'scalers': 'none', 'ratios': 'norm_ratio', 'imputers': 'none', 'n_estimators': 2400, 'learning_rate': 0.010661344605513181, 'max_depth': 11, 'min_child_weight': 5, 'subsample': 0.9, 'colsample_bytree': 0.6, 'colsample_bylevel': 0.7, 'reg_alpha': 0.0027728611458712684, 'reg_lambda': 4.235637827585459e-05, 'gamma': 0.000515316889487516}. Best is trial 4 with value: -0.08227560502062162.
[I 2026-07-14 20:54:40,041] Trial 8 finished with value: -0.0526495379198037 and parameters: {'scalers': 'robust', 'ratios': 'norm_ratio', 'imputers': 'none', 'n_estimators': 2050, 'learning_rate': 0.10978043190476788, 'max_depth': 5, 'min_child_weight': 7, 'subsample': 1.0, 'colsample_bytree': 0.9, 'colsample_bylevel': 0.6, 'reg_alpha': 2.6123366441403286, 'reg_lambda': 0.015601167873815821, 'gamma': 60.56999115658072}. Best is trial 4 with value: -0.08227560502062162.
[I 2026-07-14 20:54:50,239] Trial 10 finished with value: -0.05253273892654299 and parameters: {'scalers': 'none', 'ratios': 'log_ratio', 'imputers': 'mean', 'n_estimators': 150, 'learning_rate': 0.0002746076277419671, 'max_depth': 5, 'min_child_weight': 10, 'subsample': 0.7, 'colsample_bytree': 0.8, 'colsample_bylevel': 0.8, 'reg_alpha': 0.008112900908640086, 'reg_lambda': 55.52334846024719, 'gamma': 0.1733872617111292}. Best is trial 4 with value: -0.08227560502062162.
[I 2026-07-14 20:54:50,342] Trial 9 finished with value: -0.054446478166766545 and parameters: {'scalers': 'robust', 'ratios': 'log_ratio', 'imputers': 'median', 'n_estimators': 2500, 'learning_rate': 0.0025928208986973032, 'max_depth': 7, 'min_child_weight': 4, 'subsample': 0.7, 'colsample_bytree': 0.5, 'colsample_bylevel': 0.9, 'reg_alpha': 0.0020031294270193276, 'reg_lambda': 0.00022443817589481942, 'gamma': 0.0017950308393141147}. Best is trial 4 with value: -0.08227560502062162.
[I 2026-07-14 20:54:52,479] Trial 11 finished with value: -0.052644997451251514 and parameters: {'scalers': 'standard', 'ratios': 'log_ratio', 'imputers': 'none', 'n_estimators': 2050, 'learning_rate': 0.00010175299089586816, 'max_depth': 12, 'min_child_weight': 10, 'subsample': 0.6, 'colsample_bytree': 0.9, 'colsample_bylevel': 0.6, 'reg_alpha': 0.0004913956469013505, 'reg_lambda': 0.13033702752097776, 'gamma': 4.537661690157651}. Best is trial 4 with value: -0.08227560502062162.
[I 2026-07-14 20:54:55,695] Trial 12 finished with value: -0.0526550177731453 and parameters: {'scalers': 'standard', 'ratios': 'log_ratio', 'imputers': 'mean', 'n_estimators': 2800, 'learning_rate': 0.0374666309848578, 'max_depth': 8, 'min_child_weight': 1, 'subsample': 0.8, 'colsample_bytree': 0.5, 'colsample_bylevel': 1.0, 'reg_alpha': 0.00017085380735495093, 'reg_lambda': 60.82870500887513, 'gamma': 38.87767669784264}. Best is trial 4 with value: -0.08227560502062162.
[I 2026-07-14 20:54:58,249] Trial 13 finished with value: -0.05262562939291825 and parameters: {'scalers': 'standard', 'ratios': 'norm_ratio', 'imputers': 'none', 'n_estimators': 2650, 'learning_rate': 0.0008135052383898019, 'max_depth': 4, 'min_child_weight': 1, 'subsample': 0.5, 'colsample_bytree': 0.8, 'colsample_bylevel': 0.6, 'reg_alpha': 0.010291410630679659, 'reg_lambda': 1.1258413323417813e-06, 'gamma': 97.03839751305523}. Best is trial 4 with value: -0.08227560502062162.
[I 2026-07-14 20:54:59,560] Trial 14 finished with value: -0.05261362737455644 and parameters: {'scalers': 'robust', 'ratios': 'log_ratio', 'imputers': 'median', 'n_estimators': 1250, 'learning_rate': 0.1835991529481046, 'max_depth': 10, 'min_child_weight': 9, 'subsample': 0.5, 'colsample_bytree': 0.9, 'colsample_bylevel': 0.9, 'reg_alpha': 20.31565930579543, 'reg_lambda': 91.55835152976736, 'gamma': 0.06447551723795551}. Best is trial 4 with value: -0.08227560502062162.
[I 2026-07-14 20:55:01,175] Trial 15 finished with value: -0.05190999629620818 and parameters: {'scalers': 'none', 'ratios': 'norm_ratio', 'imputers': 'none', 'n_estimators': 250, 'learning_rate': 0.00326848232743652, 'max_depth': 9, 'min_child_weight': 10, 'subsample': 1.0, 'colsample_bytree': 0.6, 'colsample_bylevel': 0.7, 'reg_alpha': 0.004926349705856219, 'reg_lambda': 0.7950833944962453, 'gamma': 7.544348834043074e-06}. Best is trial 4 with value: -0.08227560502062162.
[I 2026-07-14 20:55:04,575] Trial 16 finished with value: -0.052361006009023374 and parameters: {'scalers': 'none', 'ratios': 'norm_ratio', 'imputers': 'median', 'n_estimators': 550, 'learning_rate': 0.00029505068920086764, 'max_depth': 8, 'min_child_weight': 7, 'subsample': 0.7, 'colsample_bytree': 0.7, 'colsample_bylevel': 0.8, 'reg_alpha': 7.6769165710841e-05, 'reg_lambda': 12.35470643205504, 'gamma': 0.007396923127811735}. Best is trial 4 with value: -0.08227560502062162.
[I 2026-07-14 20:55:05,546] Trial 17 finished with value: -0.053007730117438805 and parameters: {'scalers': 'none', 'ratios': 'norm_ratio', 'imputers': 'none', 'n_estimators': 100, 'learning_rate': 0.007922244287308207, 'max_depth': 11, 'min_child_weight': 1, 'subsample': 0.5, 'colsample_bytree': 0.7, 'colsample_bylevel': 0.7, 'reg_alpha': 1.987973632251576e-06, 'reg_lambda': 0.002790234884597842, 'gamma': 0.021712220409278764}. Best is trial 4 with value: -0.08227560502062162.
[I 2026-07-14 20:55:06,273] Trial 18 finished with value: -0.11574410172077959 and parameters: {'scalers': 'none', 'ratios': 'norm_ratio', 'imputers': 'none', 'n_estimators': 100, 'learning_rate': 0.4082379199228873, 'max_depth': 11, 'min_child_weight': 1, 'subsample': 0.5, 'colsample_bytree': 0.7, 'colsample_bylevel': 0.7, 'reg_alpha': 2.4493066639424077e-06, 'reg_lambda': 0.001788933051280009, 'gamma': 0.035231239476663685}. Best is trial 18 with value: -0.11574410172077959.
[I 2026-07-14 20:55:07,904] Trial 19 finished with value: -0.12695368866118845 and parameters: {'scalers': 'none', 'ratios': 'norm_ratio', 'imputers': 'none', 'n_estimators': 250, 'learning_rate': 0.3937628290459952, 'max_depth': 10, 'min_child_weight': 2, 'subsample': 0.5, 'colsample_bytree': 0.7, 'colsample_bylevel': 0.8, 'reg_alpha': 2.834037874754745e-06, 'reg_lambda': 0.0012307943164754972, 'gamma': 0.0065757186779509015}. Best is trial 19 with value: -0.12695368866118845.
[I 2026-07-14 20:55:09,145] Trial 20 finished with value: -0.10240420594112791 and parameters: {'scalers': 'none', 'ratios': 'norm_ratio', 'imputers': 'none', 'n_estimators': 200, 'learning_rate': 0.28037165883586024, 'max_depth': 10, 'min_child_weight': 3, 'subsample': 0.5, 'colsample_bytree': 0.7, 'colsample_bylevel': 0.7, 'reg_alpha': 6.414376061604909e-06, 'reg_lambda': 0.0008055588855054123, 'gamma': 0.031328780747939905}. Best is trial 19 with value: -0.12695368866118845.
[I 2026-07-14 20:55:11,392] Trial 21 finished with value: -0.1095644531487741 and parameters: {'scalers': 'none', 'ratios': 'norm_ratio', 'imputers': 'none', 'n_estimators': 300, 'learning_rate': 0.4295542321800708, 'max_depth': 10, 'min_child_weight': 3, 'subsample': 0.9, 'colsample_bytree': 0.7, 'colsample_bylevel': 0.8, 'reg_alpha': 2.0027767920144176e-06, 'reg_lambda': 0.001396243132536095, 'gamma': 0.012521500910424617}. Best is trial 19 with value: -0.12695368866118845.
[I 2026-07-14 20:55:12,372] Trial 22 finished with value: -0.05250369026165624 and parameters: {'scalers': 'none', 'ratios': 'norm_ratio', 'imputers': 'none', 'n_estimators': 100, 'learning_rate': 0.00880711826584614, 'max_depth': 10, 'min_child_weight': 3, 'subsample': 0.9, 'colsample_bytree': 0.7, 'colsample_bylevel': 0.7, 'reg_alpha': 1.4194180030035526e-05, 'reg_lambda': 0.0011689632976511766, 'gamma': 0.011906527670474263}. Best is trial 19 with value: -0.12695368866118845.
[I 2026-07-14 20:55:20,345] Trial 23 finished with value: -0.14902554234632484 and parameters: {'scalers': 'none', 'ratios': 'norm_ratio', 'imputers': 'none', 'n_estimators': 700, 'learning_rate': 0.4859762141281817, 'max_depth': 12, 'min_child_weight': 3, 'subsample': 0.9, 'colsample_bytree': 1.0, 'colsample_bylevel': 0.8, 'reg_alpha': 2.051829004944399e-06, 'reg_lambda': 0.001903907733199596, 'gamma': 0.005204241487281263}. Best is trial 23 with value: -0.14902554234632484.
[I 2026-07-14 20:55:32,022] Trial 24 finished with value: -0.06259988284602651 and parameters: {'scalers': 'none', 'ratios': 'norm_ratio', 'imputers': 'none', 'n_estimators': 850, 'learning_rate': 0.008184292804254763, 'max_depth': 12, 'min_child_weight': 3, 'subsample': 0.9, 'colsample_bytree': 1.0, 'colsample_bylevel': 0.7, 'reg_alpha': 1.3256284064922492e-06, 'reg_lambda': 0.0005106459466127514, 'gamma': 0.00020086440572584204}. Best is trial 23 with value: -0.14902554234632484.
[I 2026-07-14 20:55:42,288] Trial 25 finished with value: -0.12837680668272933 and parameters: {'scalers': 'none', 'ratios': 'norm_ratio', 'imputers': 'none', 'n_estimators': 900, 'learning_rate': 0.24188807782393199, 'max_depth': 12, 'min_child_weight': 3, 'subsample': 0.9, 'colsample_bytree': 1.0, 'colsample_bylevel': 0.8, 'reg_alpha': 1.300656134811442e-05, 'reg_lambda': 0.0002292767904128881, 'gamma': 0.00031185690314191147}. Best is trial 23 with value: -0.14902554234632484.
[I 2026-07-14 20:55:43,065] Trial 26 finished with value: -0.05152917642153311 and parameters: {'scalers': 'none', 'ratios': 'norm_ratio', 'imputers': 'none', 'n_estimators': 800, 'learning_rate': 0.42575945937623844, 'max_depth': 10, 'min_child_weight': 3, 'subsample': 0.6, 'colsample_bytree': 1.0, 'colsample_bylevel': 0.5, 'reg_alpha': 1.2961321939499425e-06, 'reg_lambda': 0.002851322998463074, 'gamma': 0.4953618888405031}. Best is trial 23 with value: -0.14902554234632484.
[I 2026-07-14 20:55:43,808] Trial 27 finished with value: -0.0514779561074766 and parameters: {'scalers': 'none', 'ratios': 'norm_ratio', 'imputers': 'none', 'n_estimators': 800, 'learning_rate': 0.4326350259078553, 'max_depth': 12, 'min_child_weight': 2, 'subsample': 0.5, 'colsample_bytree': 0.7, 'colsample_bylevel': 0.5, 'reg_alpha': 7.965806577712e-06, 'reg_lambda': 0.0002286159538038564, 'gamma': 0.5815390922031161}. Best is trial 23 with value: -0.14902554234632484.
[I 2026-07-14 20:55:44,644] Trial 28 finished with value: -0.051708850507060734 and parameters: {'scalers': 'none', 'ratios': 'norm_ratio', 'imputers': 'none', 'n_estimators': 800, 'learning_rate': 0.47018128118643493, 'max_depth': 12, 'min_child_weight': 2, 'subsample': 0.5, 'colsample_bytree': 0.7, 'colsample_bylevel': 0.7, 'reg_alpha': 1.0430595443495201e-06, 'reg_lambda': 0.00034255443182950056, 'gamma': 0.5130397268185929}. Best is trial 23 with value: -0.14902554234632484.
[I 2026-07-14 20:55:45,344] Trial 29 finished with value: -0.05180049489844686 and parameters: {'scalers': 'none', 'ratios': 'norm_ratio', 'imputers': 'none', 'n_estimators': 600, 'learning_rate': 0.4906137258422428, 'max_depth': 12, 'min_child_weight': 2, 'subsample': 0.8, 'colsample_bytree': 0.7, 'colsample_bylevel': 0.8, 'reg_alpha': 1.5996529988531764e-05, 'reg_lambda': 0.01456103136388445, 'gamma': 0.3677803546165128}. Best is trial 23 with value: -0.14902554234632484.
[I 2026-07-14 20:55:46,272] Trial 30 finished with value: -0.051765926613135484 and parameters: {'scalers': 'none', 'ratios': 'norm_ratio', 'imputers': 'none', 'n_estimators': 700, 'learning_rate': 0.45821545653015594, 'max_depth': 12, 'min_child_weight': 2, 'subsample': 0.8, 'colsample_bytree': 0.8, 'colsample_bylevel': 0.8, 'reg_alpha': 1.448136350732774e-06, 'reg_lambda': 0.012786556063120395, 'gamma': 0.4261428885839947}. Best is trial 23 with value: -0.14902554234632484.
[I 2026-07-14 20:55:47,245] Trial 31 finished with value: -0.05182507566457792 and parameters: {'scalers': 'none', 'ratios': 'norm_ratio', 'imputers': 'none', 'n_estimators': 750, 'learning_rate': 0.4721804100377581, 'max_depth': 12, 'min_child_weight': 2, 'subsample': 0.8, 'colsample_bytree': 1.0, 'colsample_bylevel': 0.9, 'reg_alpha': 2.0151305091412302e-05, 'reg_lambda': 0.015736615162897483, 'gamma': 1.000388881957108}. Best is trial 23 with value: -0.14902554234632484.
[I 2026-07-14 20:55:48,229] Trial 32 finished with value: -0.05146726087262878 and parameters: {'scalers': 'none', 'ratios': 'norm_ratio', 'imputers': 'none', 'n_estimators': 700, 'learning_rate': 0.08481648134209693, 'max_depth': 12, 'min_child_weight': 2, 'subsample': 0.8, 'colsample_bytree': 1.0, 'colsample_bylevel': 0.9, 'reg_alpha': 2.241349534586544e-05, 'reg_lambda': 0.014043973566203379, 'gamma': 0.4259768060283146}. Best is trial 23 with value: -0.14902554234632484.
[I 2026-07-14 20:55:49,227] Trial 33 finished with value: -0.051553690571037716 and parameters: {'scalers': 'none', 'ratios': 'norm_ratio', 'imputers': 'none', 'n_estimators': 750, 'learning_rate': 0.080292390298272, 'max_depth': 12, 'min_child_weight': 2, 'subsample': 0.8, 'colsample_bytree': 1.0, 'colsample_bylevel': 0.9, 'reg_alpha': 3.3222115013753216e-05, 'reg_lambda': 0.00933044358116482, 'gamma': 0.5399083277065908}. Best is trial 23 with value: -0.14902554234632484.
[I 2026-07-14 20:55:58,842] Trial 34 finished with value: -0.09120955000017067 and parameters: {'scalers': 'none', 'ratios': 'norm_ratio', 'imputers': 'none', 'n_estimators': 900, 'learning_rate': 0.08387791133351183, 'max_depth': 12, 'min_child_weight': 2, 'subsample': 0.8, 'colsample_bytree': 1.0, 'colsample_bylevel': 0.9, 'reg_alpha': 1.645742291153635e-05, 'reg_lambda': 0.012765466767980732, 'gamma': 0.0019393006268658565}. Best is trial 23 with value: -0.14902554234632484.
[I 2026-07-14 20:56:09,946] Trial 35 finished with value: -0.10051134574547332 and parameters: {'scalers': 'robust', 'ratios': 'norm_ratio', 'imputers': 'none', 'n_estimators': 1050, 'learning_rate': 0.09896684815966358, 'max_depth': 12, 'min_child_weight': 2, 'subsample': 0.8, 'colsample_bytree': 1.0, 'colsample_bylevel': 0.9, 'reg_alpha': 3.572983038289782e-05, 'reg_lambda': 0.060296008991201785, 'gamma': 0.0032244070102566465}. Best is trial 23 with value: -0.14902554234632484.
[I 2026-07-14 20:56:18,950] Trial 36 finished with value: -0.08234929647507022 and parameters: {'scalers': 'robust', 'ratios': 'norm_ratio', 'imputers': 'none', 'n_estimators': 1150, 'learning_rate': 0.09866479976433917, 'max_depth': 9, 'min_child_weight': 5, 'subsample': 0.8, 'colsample_bytree': 1.0, 'colsample_bylevel': 0.9, 'reg_alpha': 3.6718216516605524e-05, 'reg_lambda': 0.009342854292996142, 'gamma': 0.0029283783607336753}. Best is trial 23 with value: -0.14902554234632484.
[I 2026-07-14 20:56:26,460] Trial 37 finished with value: -0.07489942335561735 and parameters: {'scalers': 'robust', 'ratios': 'norm_ratio', 'imputers': 'median', 'n_estimators': 1050, 'learning_rate': 0.07088720035299821, 'max_depth': 9, 'min_child_weight': 4, 'subsample': 0.8, 'colsample_bytree': 1.0, 'colsample_bylevel': 0.9, 'reg_alpha': 4.8035205696661815e-05, 'reg_lambda': 0.009576664772396234, 'gamma': 0.0026969528631836013}. Best is trial 23 with value: -0.14902554234632484.
[I 2026-07-14 20:56:36,837] Trial 38 finished with value: -0.08725992559105186 and parameters: {'scalers': 'none', 'ratios': 'norm_ratio', 'imputers': 'none', 'n_estimators': 1050, 'learning_rate': 0.08312185593471967, 'max_depth': 11, 'min_child_weight': 4, 'subsample': 0.8, 'colsample_bytree': 1.0, 'colsample_bylevel': 0.9, 'reg_alpha': 7.05490683311129e-05, 'reg_lambda': 6.531671599835831e-05, 'gamma': 0.002864618564357278}. Best is trial 23 with value: -0.14902554234632484.
[I 2026-07-14 20:56:42,414] Trial 39 finished with value: -0.07439785338494814 and parameters: {'scalers': 'robust', 'ratios': 'norm_ratio', 'imputers': 'none', 'n_estimators': 450, 'learning_rate': 0.07987358917271146, 'max_depth': 11, 'min_child_weight': 4, 'subsample': 1.0, 'colsample_bytree': 1.0, 'colsample_bylevel': 0.9, 'reg_alpha': 5.948492332356393e-05, 'reg_lambda': 6.321029180718647e-05, 'gamma': 0.0018599401888679413}. Best is trial 23 with value: -0.14902554234632484.
[I 2026-07-14 20:56:53,122] Trial 40 finished with value: -0.08391829719824351 and parameters: {'scalers': 'robust', 'ratios': 'norm_ratio', 'imputers': 'none', 'n_estimators': 1100, 'learning_rate': 0.08567812167831539, 'max_depth': 11, 'min_child_weight': 4, 'subsample': 1.0, 'colsample_bytree': 1.0, 'colsample_bylevel': 0.8, 'reg_alpha': 0.00010631031302506368, 'reg_lambda': 5.775786099982701e-05, 'gamma': 0.0035361914447188413}. Best is trial 23 with value: -0.14902554234632484.
[I 2026-07-14 20:57:01,934] Trial 41 finished with value: -0.1023769911366701 and parameters: {'scalers': 'robust', 'ratios': 'norm_ratio', 'imputers': 'none', 'n_estimators': 1050, 'learning_rate': 0.1816455766367891, 'max_depth': 11, 'min_child_weight': 4, 'subsample': 1.0, 'colsample_bytree': 0.8, 'colsample_bylevel': 0.8, 'reg_alpha': 5.1969774522536935e-06, 'reg_lambda': 4.896710701309241e-05, 'gamma': 0.001616669226612054}. Best is trial 23 with value: -0.14902554234632484.
[I 2026-07-14 20:57:10,522] Trial 42 finished with value: -0.10827136824354862 and parameters: {'scalers': 'robust', 'ratios': 'norm_ratio', 'imputers': 'median', 'n_estimators': 1100, 'learning_rate': 0.1746067774940593, 'max_depth': 11, 'min_child_weight': 4, 'subsample': 1.0, 'colsample_bytree': 0.6, 'colsample_bylevel': 0.8, 'reg_alpha': 4.758572843059966e-06, 'reg_lambda': 9.14687802018212e-05, 'gamma': 9.715491811086454e-05}. Best is trial 23 with value: -0.14902554234632484.
[I 2026-07-14 20:57:14,929] Trial 43 finished with value: -0.09172349842029702 and parameters: {'scalers': 'none', 'ratios': 'norm_ratio', 'imputers': 'mean', 'n_estimators': 450, 'learning_rate': 0.1963057535484237, 'max_depth': 11, 'min_child_weight': 4, 'subsample': 1.0, 'colsample_bytree': 0.8, 'colsample_bylevel': 0.8, 'reg_alpha': 4.953435407713247e-06, 'reg_lambda': 9.956094015275902e-05, 'gamma': 0.00019478056648433367}. Best is trial 23 with value: -0.14902554234632484.
[I 2026-07-14 20:57:19,313] Trial 44 finished with value: -0.08957004169998939 and parameters: {'scalers': 'none', 'ratios': 'norm_ratio', 'imputers': 'mean', 'n_estimators': 450, 'learning_rate': 0.20739791038547953, 'max_depth': 11, 'min_child_weight': 4, 'subsample': 1.0, 'colsample_bytree': 0.8, 'colsample_bylevel': 0.8, 'reg_alpha': 5.06499131734728e-06, 'reg_lambda': 4.009011519364897e-05, 'gamma': 6.0696056225530494e-05}. Best is trial 23 with value: -0.14902554234632484.
