[I 2026-07-14 20:20:49,501] Trial 135 finished with value: -0.22614815374884475 and parameters: {'scalers': 'none', 'ratios': 'norm_ratio', 'imputers': 'median', 'n_estimators': 2050, 'learning_rate': 0.24145573895017142, 'max_depth': 11, 'min_child_weight': 3, 'subsample': 0.5, 'colsample_bytree': 0.5, 'colsample_bylevel': 0.5, 'reg_alpha': 0.732397255246614, 'reg_lambda': 2.903752451246565e-05, 'gamma': 0.029594924837732572}. Best is trial 130 with value: -0.3248176519434903.
[I 2026-07-14 20:21:01,963] Trial 136 finished with value: -0.30514769805748887 and parameters: {'scalers': 'none', 'ratios': 'norm_ratio', 'imputers': 'median', 'n_estimators': 2100, 'learning_rate': 0.4142776623207072, 'max_depth': 11, 'min_child_weight': 3, 'subsample': 0.5, 'colsample_bytree': 0.5, 'colsample_bylevel': 0.5, 'reg_alpha': 0.5271840818010901, 'reg_lambda': 8.477142130788889e-06, 'gamma': 0.027496567381735715}. Best is trial 130 with value: -0.3248176519434903.
[I 2026-07-14 20:21:14,056] Trial 137 finished with value: -0.30796411169579657 and parameters: {'scalers': 'none', 'ratios': 'norm_ratio', 'imputers': 'median', 'n_estimators': 2350, 'learning_rate': 0.4178514928293621, 'max_depth': 11, 'min_child_weight': 3, 'subsample': 0.5, 'colsample_bytree': 0.5, 'colsample_bylevel': 0.5, 'reg_alpha': 0.6275861113078187, 'reg_lambda': 5.2741208258252395e-05, 'gamma': 0.029578286247526578}. Best is trial 130 with value: -0.3248176519434903.
[I 2026-07-14 20:21:30,801] Trial 138 finished with value: -0.32349643355086255 and parameters: {'scalers': 'none', 'ratios': 'norm_ratio', 'imputers': 'median', 'n_estimators': 2350, 'learning_rate': 0.4263082629980171, 'max_depth': 11, 'min_child_weight': 3, 'subsample': 0.5, 'colsample_bytree': 0.5, 'colsample_bylevel': 0.5, 'reg_alpha': 0.4794991661705317, 'reg_lambda': 3.997356986842336e-05, 'gamma': 0.0004490375406688682}. Best is trial 130 with value: -0.3248176519434903.
[I 2026-07-14 20:21:45,046] Trial 139 finished with value: -0.3072558572208105 and parameters: {'scalers': 'none', 'ratios': 'norm_ratio', 'imputers': 'median', 'n_estimators': 2050, 'learning_rate': 0.409737487812219, 'max_depth': 11, 'min_child_weight': 3, 'subsample': 0.5, 'colsample_bytree': 0.5, 'colsample_bylevel': 0.5, 'reg_alpha': 0.46272692340849364, 'reg_lambda': 4.511676490697362e-05, 'gamma': 0.000415508727826519}. Best is trial 130 with value: -0.3248176519434903.
[I 2026-07-14 20:21:59,675] Trial 140 finished with value: -0.29988912361397263 and parameters: {'scalers': 'none', 'ratios': 'norm_ratio', 'imputers': 'median', 'n_estimators': 2100, 'learning_rate': 0.40646007314780436, 'max_depth': 11, 'min_child_weight': 3, 'subsample': 0.5, 'colsample_bytree': 0.5, 'colsample_bylevel': 0.5, 'reg_alpha': 0.5013141600166016, 'reg_lambda': 6.514196305164314e-05, 'gamma': 0.0005794353623535562}. Best is trial 130 with value: -0.3248176519434903.
[I 2026-07-14 20:22:16,568] Trial 141 finished with value: -0.3078558259339396 and parameters: {'scalers': 'none', 'ratios': 'norm_ratio', 'imputers': 'median', 'n_estimators': 2450, 'learning_rate': 0.4091931687859153, 'max_depth': 11, 'min_child_weight': 3, 'subsample': 0.5, 'colsample_bytree': 0.5, 'colsample_bylevel': 0.5, 'reg_alpha': 0.4649468810306796, 'reg_lambda': 3.720847627299659e-05, 'gamma': 0.00040379385682265287}. Best is trial 130 with value: -0.3248176519434903.
[I 2026-07-14 20:22:32,712] Trial 142 finished with value: -0.3150636155156064 and parameters: {'scalers': 'none', 'ratios': 'norm_ratio', 'imputers': 'median', 'n_estimators': 2350, 'learning_rate': 0.41389838494165393, 'max_depth': 11, 'min_child_weight': 3, 'subsample': 0.5, 'colsample_bytree': 0.5, 'colsample_bylevel': 0.5, 'reg_alpha': 0.44500241470855517, 'reg_lambda': 7.565832808162636e-05, 'gamma': 0.00040757360309558085}. Best is trial 130 with value: -0.3248176519434903.
[I 2026-07-14 20:22:49,014] Trial 143 finished with value: -0.3163786672248459 and parameters: {'scalers': 'none', 'ratios': 'norm_ratio', 'imputers': 'median', 'n_estimators': 2350, 'learning_rate': 0.41801394065235403, 'max_depth': 11, 'min_child_weight': 3, 'subsample': 0.5, 'colsample_bytree': 0.5, 'colsample_bylevel': 0.5, 'reg_alpha': 0.4984139035166136, 'reg_lambda': 5.273407038414987e-05, 'gamma': 0.0003911118224296841}. Best is trial 130 with value: -0.3248176519434903.
[I 2026-07-14 20:23:03,625] Trial 144 finished with value: -0.30284934305579014 and parameters: {'scalers': 'none', 'ratios': 'norm_ratio', 'imputers': 'median', 'n_estimators': 2150, 'learning_rate': 0.40877412300876764, 'max_depth': 11, 'min_child_weight': 3, 'subsample': 0.5, 'colsample_bytree': 0.5, 'colsample_bylevel': 0.5, 'reg_alpha': 0.42710642892704087, 'reg_lambda': 5.5754387389452726e-05, 'gamma': 0.00015011559325282936}. Best is trial 130 with value: -0.3248176519434903.
[I 2026-07-14 20:23:18,903] Trial 145 finished with value: -0.3032440544550254 and parameters: {'scalers': 'none', 'ratios': 'norm_ratio', 'imputers': 'median', 'n_estimators': 2250, 'learning_rate': 0.4212181790266221, 'max_depth': 11, 'min_child_weight': 3, 'subsample': 0.5, 'colsample_bytree': 0.5, 'colsample_bylevel': 0.5, 'reg_alpha': 0.42991839233580625, 'reg_lambda': 7.13655500775606e-05, 'gamma': 0.0004575440978889998}. Best is trial 130 with value: -0.3248176519434903.
[I 2026-07-14 20:23:33,794] Trial 146 finished with value: -0.30724494481282827 and parameters: {'scalers': 'none', 'ratios': 'norm_ratio', 'imputers': 'median', 'n_estimators': 2150, 'learning_rate': 0.41019719157695556, 'max_depth': 11, 'min_child_weight': 3, 'subsample': 0.5, 'colsample_bytree': 0.5, 'colsample_bylevel': 0.5, 'reg_alpha': 0.426081959497639, 'reg_lambda': 5.4506605883996826e-05, 'gamma': 0.00047052672386470285}. Best is trial 130 with value: -0.3248176519434903.
[I 2026-07-14 20:23:48,688] Trial 147 finished with value: -0.3134779066382718 and parameters: {'scalers': 'none', 'ratios': 'norm_ratio', 'imputers': 'median', 'n_estimators': 2150, 'learning_rate': 0.42254386418892714, 'max_depth': 11, 'min_child_weight': 3, 'subsample': 0.5, 'colsample_bytree': 0.5, 'colsample_bylevel': 0.5, 'reg_alpha': 0.4472762947089566, 'reg_lambda': 6.139721120627229e-05, 'gamma': 0.0004354348130605307}. Best is trial 130 with value: -0.3248176519434903.
[I 2026-07-14 20:24:01,521] Trial 148 finished with value: -0.2972927771145412 and parameters: {'scalers': 'none', 'ratios': 'norm_ratio', 'imputers': 'median', 'n_estimators': 1900, 'learning_rate': 0.4031000262143851, 'max_depth': 11, 'min_child_weight': 3, 'subsample': 0.5, 'colsample_bytree': 0.5, 'colsample_bylevel': 0.5, 'reg_alpha': 0.4008321029805636, 'reg_lambda': 6.908813199499328e-05, 'gamma': 0.00014236686857401328}. Best is trial 130 with value: -0.3248176519434903.
[I 2026-07-14 20:24:16,734] Trial 149 finished with value: -0.30252240396565167 and parameters: {'scalers': 'none', 'ratios': 'norm_ratio', 'imputers': 'median', 'n_estimators': 2250, 'learning_rate': 0.41354875518754697, 'max_depth': 11, 'min_child_weight': 3, 'subsample': 0.5, 'colsample_bytree': 0.5, 'colsample_bylevel': 0.5, 'reg_alpha': 0.3472682611804311, 'reg_lambda': 7.022471733914957e-05, 'gamma': 0.00037991305248926294}. Best is trial 130 with value: -0.3248176519434903.
[I 2026-07-14 20:24:32,292] Trial 150 finished with value: -0.3040256256135381 and parameters: {'scalers': 'none', 'ratios': 'norm_ratio', 'imputers': 'median', 'n_estimators': 2250, 'learning_rate': 0.396375575373297, 'max_depth': 11, 'min_child_weight': 3, 'subsample': 0.5, 'colsample_bytree': 0.5, 'colsample_bylevel': 0.5, 'reg_alpha': 0.4640171601692682, 'reg_lambda': 6.035090791298288e-05, 'gamma': 0.000361222678315186}. Best is trial 130 with value: -0.3248176519434903.
[I 2026-07-14 20:24:47,666] Trial 151 finished with value: -0.3101664155513049 and parameters: {'scalers': 'none', 'ratios': 'norm_ratio', 'imputers': 'median', 'n_estimators': 2250, 'learning_rate': 0.4104171624439791, 'max_depth': 11, 'min_child_weight': 3, 'subsample': 0.5, 'colsample_bytree': 0.5, 'colsample_bylevel': 0.5, 'reg_alpha': 0.39870089955740357, 'reg_lambda': 5.6816545392945906e-05, 'gamma': 0.00014649514555659698}. Best is trial 130 with value: -0.3248176519434903.
[I 2026-07-14 20:25:01,469] Trial 152 finished with value: -0.3023143453456755 and parameters: {'scalers': 'none', 'ratios': 'norm_ratio', 'imputers': 'median', 'n_estimators': 2250, 'learning_rate': 0.41789817997054834, 'max_depth': 10, 'min_child_weight': 3, 'subsample': 0.5, 'colsample_bytree': 0.5, 'colsample_bylevel': 0.5, 'reg_alpha': 0.502941439001624, 'reg_lambda': 5.985935190454364e-05, 'gamma': 0.00034671444440489133}. Best is trial 130 with value: -0.3248176519434903.
[I 2026-07-14 20:25:14,451] Trial 153 finished with value: -0.2944709978945407 and parameters: {'scalers': 'none', 'ratios': 'log_ratio', 'imputers': 'median', 'n_estimators': 2200, 'learning_rate': 0.41127719267134977, 'max_depth': 10, 'min_child_weight': 3, 'subsample': 0.5, 'colsample_bytree': 0.5, 'colsample_bylevel': 0.5, 'reg_alpha': 0.37733801513745757, 'reg_lambda': 6.142326549177692e-05, 'gamma': 0.0006965187861330015}. Best is trial 130 with value: -0.3248176519434903.
[I 2026-07-14 20:25:27,891] Trial 154 finished with value: -0.2940209617393207 and parameters: {'scalers': 'none', 'ratios': 'log_ratio', 'imputers': 'median', 'n_estimators': 2250, 'learning_rate': 0.42514553659289894, 'max_depth': 10, 'min_child_weight': 3, 'subsample': 0.5, 'colsample_bytree': 0.5, 'colsample_bylevel': 0.5, 'reg_alpha': 0.3931910288006774, 'reg_lambda': 8.602707690369649e-05, 'gamma': 0.00016841138178577298}. Best is trial 130 with value: -0.3248176519434903.
[I 2026-07-14 20:25:41,312] Trial 155 finished with value: -0.33097982190789643 and parameters: {'scalers': 'none', 'ratios': 'norm_ratio', 'imputers': 'median', 'n_estimators': 2250, 'learning_rate': 0.49762294634155696, 'max_depth': 10, 'min_child_weight': 3, 'subsample': 0.5, 'colsample_bytree': 0.5, 'colsample_bylevel': 0.5, 'reg_alpha': 0.3450499287889013, 'reg_lambda': 0.00010022435200171095, 'gamma': 0.00016452422036733737}. Best is trial 155 with value: -0.33097982190789643.
[I 2026-07-14 20:25:54,479] Trial 156 finished with value: -0.3273998185146974 and parameters: {'scalers': 'none', 'ratios': 'log_ratio', 'imputers': 'median', 'n_estimators': 2250, 'learning_rate': 0.492562756790974, 'max_depth': 10, 'min_child_weight': 3, 'subsample': 0.5, 'colsample_bytree': 0.5, 'colsample_bylevel': 0.5, 'reg_alpha': 0.3610407121544221, 'reg_lambda': 0.00012496153111983793, 'gamma': 0.00029638684598478916}. Best is trial 155 with value: -0.33097982190789643.
[I 2026-07-14 20:26:05,124] Trial 157 finished with value: -0.3278512357575682 and parameters: {'scalers': 'none', 'ratios': 'log_ratio', 'imputers': 'median', 'n_estimators': 2150, 'learning_rate': 0.4946810036675066, 'max_depth': 10, 'min_child_weight': 2, 'subsample': 0.5, 'colsample_bytree': 0.5, 'colsample_bylevel': 0.5, 'reg_alpha': 0.11700588638419765, 'reg_lambda': 0.00011436253479769365, 'gamma': 0.00016605164700169933}. Best is trial 155 with value: -0.33097982190789643.
[I 2026-07-14 20:26:17,151] Trial 158 finished with value: -0.30364092812023136 and parameters: {'scalers': 'none', 'ratios': 'log_ratio', 'imputers': 'median', 'n_estimators': 2200, 'learning_rate': 0.49295557374022403, 'max_depth': 10, 'min_child_weight': 3, 'subsample': 0.5, 'colsample_bytree': 0.5, 'colsample_bylevel': 0.5, 'reg_alpha': 0.14521064834030337, 'reg_lambda': 0.00013824337240052825, 'gamma': 0.00016318292327334701}. Best is trial 155 with value: -0.33097982190789643.
[I 2026-07-14 20:26:29,432] Trial 159 finished with value: -0.2975601770662102 and parameters: {'scalers': 'none', 'ratios': 'log_ratio', 'imputers': 'median', 'n_estimators': 2300, 'learning_rate': 0.4650425248978684, 'max_depth': 10, 'min_child_weight': 3, 'subsample': 0.5, 'colsample_bytree': 0.5, 'colsample_bylevel': 0.5, 'reg_alpha': 0.15129616399458953, 'reg_lambda': 0.00011762678190913816, 'gamma': 0.0008014887517752938}. Best is trial 155 with value: -0.33097982190789643.
[I 2026-07-14 20:26:42,251] Trial 160 finished with value: -0.3116079804084212 and parameters: {'scalers': 'none', 'ratios': 'log_ratio', 'imputers': 'median', 'n_estimators': 2300, 'learning_rate': 0.49191233946629626, 'max_depth': 10, 'min_child_weight': 3, 'subsample': 0.5, 'colsample_bytree': 0.5, 'colsample_bylevel': 0.5, 'reg_alpha': 0.16485019274350274, 'reg_lambda': 0.00010627657577782169, 'gamma': 0.0007350124380085477}. Best is trial 155 with value: -0.33097982190789643.
[I 2026-07-14 20:26:56,252] Trial 161 finished with value: -0.3649394946709807 and parameters: {'scalers': 'none', 'ratios': 'norm_ratio', 'imputers': 'median', 'n_estimators': 2300, 'learning_rate': 0.4838851326653865, 'max_depth': 11, 'min_child_weight': 2, 'subsample': 0.5, 'colsample_bytree': 0.5, 'colsample_bylevel': 0.5, 'reg_alpha': 0.146844229579476, 'reg_lambda': 0.00012019163106994671, 'gamma': 0.0015853485075444172}. Best is trial 161 with value: -0.3649394946709807.
[I 2026-07-14 20:27:09,884] Trial 162 finished with value: -0.37008123016150063 and parameters: {'scalers': 'none', 'ratios': 'norm_ratio', 'imputers': 'median', 'n_estimators': 2300, 'learning_rate': 0.4894509987355617, 'max_depth': 11, 'min_child_weight': 2, 'subsample': 0.5, 'colsample_bytree': 0.5, 'colsample_bylevel': 0.5, 'reg_alpha': 0.11697839355321553, 'reg_lambda': 0.0001605241044928651, 'gamma': 0.0013796110253768968}. Best is trial 162 with value: -0.37008123016150063.
[I 2026-07-14 20:27:21,929] Trial 163 finished with value: -0.3468404354033122 and parameters: {'scalers': 'none', 'ratios': 'norm_ratio', 'imputers': 'median', 'n_estimators': 2350, 'learning_rate': 0.4963004036073988, 'max_depth': 10, 'min_child_weight': 2, 'subsample': 0.5, 'colsample_bytree': 0.5, 'colsample_bylevel': 0.5, 'reg_alpha': 0.15796987968332596, 'reg_lambda': 0.0001342334256559014, 'gamma': 0.0012894480474327848}. Best is trial 162 with value: -0.37008123016150063.
[I 2026-07-14 20:27:33,890] Trial 164 finished with value: -0.34089762380152244 and parameters: {'scalers': 'none', 'ratios': 'log_ratio', 'imputers': 'median', 'n_estimators': 2350, 'learning_rate': 0.47278570606393033, 'max_depth': 10, 'min_child_weight': 2, 'subsample': 0.5, 'colsample_bytree': 0.5, 'colsample_bylevel': 0.5, 'reg_alpha': 0.13957238492283464, 'reg_lambda': 0.0001465859286226666, 'gamma': 0.00025430131017542}. Best is trial 162 with value: -0.37008123016150063.
[I 2026-07-14 20:27:46,232] Trial 165 finished with value: -0.3301225791275292 and parameters: {'scalers': 'none', 'ratios': 'log_ratio', 'imputers': 'median', 'n_estimators': 2350, 'learning_rate': 0.4792770517487145, 'max_depth': 10, 'min_child_weight': 2, 'subsample': 0.5, 'colsample_bytree': 0.5, 'colsample_bylevel': 0.5, 'reg_alpha': 0.1546597961800801, 'reg_lambda': 0.00015874923568405367, 'gamma': 0.00023737629157912548}. Best is trial 162 with value: -0.37008123016150063.
[I 2026-07-14 20:28:00,950] Trial 166 finished with value: -0.3626419361651716 and parameters: {'scalers': 'none', 'ratios': 'log_ratio', 'imputers': 'median', 'n_estimators': 2350, 'learning_rate': 0.4775610601386507, 'max_depth': 11, 'min_child_weight': 2, 'subsample': 0.5, 'colsample_bytree': 0.5, 'colsample_bylevel': 0.5, 'reg_alpha': 0.16885990872958515, 'reg_lambda': 0.00017401058521381295, 'gamma': 0.00026327988658989904}. Best is trial 162 with value: -0.37008123016150063.
[I 2026-07-14 20:28:13,113] Trial 167 finished with value: -0.3372082512259768 and parameters: {'scalers': 'none', 'ratios': 'log_ratio', 'imputers': 'median', 'n_estimators': 2350, 'learning_rate': 0.48271528314518064, 'max_depth': 10, 'min_child_weight': 2, 'subsample': 0.5, 'colsample_bytree': 0.5, 'colsample_bylevel': 0.5, 'reg_alpha': 0.16145809682130904, 'reg_lambda': 0.00017427097858200094, 'gamma': 0.0012833568465336045}. Best is trial 162 with value: -0.37008123016150063.
[I 2026-07-14 20:28:25,141] Trial 168 finished with value: -0.33966431571737365 and parameters: {'scalers': 'none', 'ratios': 'log_ratio', 'imputers': 'median', 'n_estimators': 2350, 'learning_rate': 0.4980902430631821, 'max_depth': 10, 'min_child_weight': 2, 'subsample': 0.5, 'colsample_bytree': 0.5, 'colsample_bylevel': 0.5, 'reg_alpha': 0.16582005944029238, 'reg_lambda': 0.00017937972009276988, 'gamma': 0.00022589402555335734}. Best is trial 162 with value: -0.37008123016150063.
[I 2026-07-14 20:28:37,082] Trial 169 finished with value: -0.3451295974584911 and parameters: {'scalers': 'none', 'ratios': 'log_ratio', 'imputers': 'median', 'n_estimators': 2350, 'learning_rate': 0.49877296214334493, 'max_depth': 10, 'min_child_weight': 2, 'subsample': 0.5, 'colsample_bytree': 0.5, 'colsample_bylevel': 0.5, 'reg_alpha': 0.15014488159291878, 'reg_lambda': 0.00017870854464429367, 'gamma': 0.0013553496510247465}. Best is trial 162 with value: -0.37008123016150063.
[I 2026-07-14 20:28:48,179] Trial 170 finished with value: -0.522356396541512 and parameters: {'scalers': 'none', 'ratios': 'log_ratio', 'imputers': 'median', 'n_estimators': 2350, 'learning_rate': 0.48150471655734167, 'max_depth': 10, 'min_child_weight': 1, 'subsample': 0.5, 'colsample_bytree': 0.5, 'colsample_bylevel': 0.5, 'reg_alpha': 0.17061603679113904, 'reg_lambda': 0.0002098022310370551, 'gamma': 0.001362797535534069}. Best is trial 170 with value: -0.522356396541512.
[I 2026-07-14 20:28:59,220] Trial 171 finished with value: -0.49882105798245935 and parameters: {'scalers': 'none', 'ratios': 'log_ratio', 'imputers': 'median', 'n_estimators': 2350, 'learning_rate': 0.48742903664326026, 'max_depth': 10, 'min_child_weight': 1, 'subsample': 0.5, 'colsample_bytree': 0.5, 'colsample_bylevel': 0.5, 'reg_alpha': 0.15042954564224306, 'reg_lambda': 0.0004000480122090941, 'gamma': 0.0014716654083687542}. Best is trial 170 with value: -0.522356396541512.
[I 2026-07-14 20:29:09,415] Trial 172 finished with value: -0.42532294753617855 and parameters: {'scalers': 'none', 'ratios': 'log_ratio', 'imputers': 'median', 'n_estimators': 2350, 'learning_rate': 0.4662763613245579, 'max_depth': 10, 'min_child_weight': 1, 'subsample': 0.5, 'colsample_bytree': 0.5, 'colsample_bylevel': 0.5, 'reg_alpha': 0.0865377941928399, 'reg_lambda': 0.00018777697130319495, 'gamma': 0.0014865803867147327}. Best is trial 170 with value: -0.522356396541512.
[I 2026-07-14 20:29:19,623] Trial 173 finished with value: -0.4697424405158727 and parameters: {'scalers': 'none', 'ratios': 'log_ratio', 'imputers': 'median', 'n_estimators': 2350, 'learning_rate': 0.4912708734405022, 'max_depth': 10, 'min_child_weight': 1, 'subsample': 0.5, 'colsample_bytree': 0.5, 'colsample_bylevel': 0.5, 'reg_alpha': 0.08871074801665896, 'reg_lambda': 0.00043849006398645983, 'gamma': 0.001375761350345237}. Best is trial 170 with value: -0.522356396541512.
[I 2026-07-14 20:29:30,177] Trial 174 finished with value: -0.4833170902654133 and parameters: {'scalers': 'none', 'ratios': 'log_ratio', 'imputers': 'median', 'n_estimators': 2350, 'learning_rate': 0.4954836520563607, 'max_depth': 10, 'min_child_weight': 1, 'subsample': 0.5, 'colsample_bytree': 0.5, 'colsample_bylevel': 0.5, 'reg_alpha': 0.09700568737199075, 'reg_lambda': 0.00035249707255786814, 'gamma': 0.0018028489019236097}. Best is trial 170 with value: -0.522356396541512.
[I 2026-07-14 20:29:40,530] Trial 175 finished with value: -0.4690187350399265 and parameters: {'scalers': 'none', 'ratios': 'log_ratio', 'imputers': 'median', 'n_estimators': 2350, 'learning_rate': 0.485045899660374, 'max_depth': 10, 'min_child_weight': 1, 'subsample': 0.5, 'colsample_bytree': 0.5, 'colsample_bylevel': 0.5, 'reg_alpha': 0.09162887839016147, 'reg_lambda': 0.00019862803440138185, 'gamma': 0.0012624807458125333}. Best is trial 170 with value: -0.522356396541512.
[I 2026-07-14 20:29:50,672] Trial 176 finished with value: -0.44065337464445126 and parameters: {'scalers': 'none', 'ratios': 'log_ratio', 'imputers': 'median', 'n_estimators': 2350, 'learning_rate': 0.4673896060247662, 'max_depth': 10, 'min_child_weight': 1, 'subsample': 0.5, 'colsample_bytree': 0.5, 'colsample_bylevel': 0.5, 'reg_alpha': 0.08491801210540022, 'reg_lambda': 0.00019363246325835093, 'gamma': 0.0013473058647234415}. Best is trial 170 with value: -0.522356396541512.
[I 2026-07-14 20:30:00,917] Trial 177 finished with value: -0.42884214625667694 and parameters: {'scalers': 'none', 'ratios': 'log_ratio', 'imputers': 'median', 'n_estimators': 2350, 'learning_rate': 0.4629895731187219, 'max_depth': 10, 'min_child_weight': 1, 'subsample': 0.5, 'colsample_bytree': 0.5, 'colsample_bylevel': 0.5, 'reg_alpha': 0.09671295868890245, 'reg_lambda': 0.00040605138900084265, 'gamma': 0.0012584028002030716}. Best is trial 170 with value: -0.522356396541512.
[I 2026-07-14 20:30:11,118] Trial 178 finished with value: -0.4704076655680645 and parameters: {'scalers': 'none', 'ratios': 'log_ratio', 'imputers': 'median', 'n_estimators': 2350, 'learning_rate': 0.4829296758305658, 'max_depth': 10, 'min_child_weight': 1, 'subsample': 0.5, 'colsample_bytree': 0.5, 'colsample_bylevel': 0.5, 'reg_alpha': 0.0933602018394425, 'reg_lambda': 0.0004657724084290487, 'gamma': 0.0012975303241568586}. Best is trial 170 with value: -0.522356396541512.
[I 2026-07-14 20:30:21,300] Trial 179 finished with value: -0.46135305571044954 and parameters: {'scalers': 'none', 'ratios': 'log_ratio', 'imputers': 'median', 'n_estimators': 2350, 'learning_rate': 0.4853357241767347, 'max_depth': 10, 'min_child_weight': 1, 'subsample': 0.5, 'colsample_bytree': 0.5, 'colsample_bylevel': 0.5, 'reg_alpha': 0.07974451589081165, 'reg_lambda': 0.0005129478986949244, 'gamma': 0.0012246853834836148}. Best is trial 170 with value: -0.522356396541512.
