[I 2026-07-14 16:38:17,423] Trial 90 finished with value: -0.38818476197709784 and parameters: {'scalers': 'robust', 'ratios': 'log_ratio', 'imputers': 'none', 'n_estimators': 200, 'learning_rate': 0.00010200243474330436, 'max_depth': 4, 'min_child_weight': 7, 'subsample': 0.5, 'colsample_bytree': 0.5, 'colsample_bylevel': 0.7, 'reg_alpha': 45.54478881887138, 'reg_lambda': 0.0005188300398251544, 'gamma': 2.1306304010617088e-05}. Best is trial 68 with value: -0.38881930205365695.
[I 2026-07-14 16:38:18,045] Trial 91 finished with value: -0.3867184651752581 and parameters: {'scalers': 'robust', 'ratios': 'log_ratio', 'imputers': 'none', 'n_estimators': 300, 'learning_rate': 0.00010342756358140107, 'max_depth': 4, 'min_child_weight': 10, 'subsample': 0.5, 'colsample_bytree': 0.5, 'colsample_bylevel': 0.7, 'reg_alpha': 41.78506555082539, 'reg_lambda': 0.0006177294167739054, 'gamma': 2.2888278211488652e-05}. Best is trial 68 with value: -0.38881930205365695.
[I 2026-07-14 16:38:21,127] Trial 92 finished with value: -0.3655193580593647 and parameters: {'scalers': 'standard', 'ratios': 'log_ratio', 'imputers': 'none', 'n_estimators': 1650, 'learning_rate': 0.00012275326810642058, 'max_depth': 4, 'min_child_weight': 10, 'subsample': 0.5, 'colsample_bytree': 0.5, 'colsample_bylevel': 0.7, 'reg_alpha': 68.65545311847666, 'reg_lambda': 0.000730629965300452, 'gamma': 2.491048764212479e-05}. Best is trial 68 with value: -0.38881930205365695.
[I 2026-07-14 16:38:22,095] Trial 93 finished with value: -0.3832107854805841 and parameters: {'scalers': 'standard', 'ratios': 'log_ratio', 'imputers': 'none', 'n_estimators': 300, 'learning_rate': 0.0001323114041837665, 'max_depth': 4, 'min_child_weight': 10, 'subsample': 0.5, 'colsample_bytree': 0.5, 'colsample_bylevel': 0.7, 'reg_alpha': 2.2319669481667126, 'reg_lambda': 0.0006871276247322741, 'gamma': 2.5391828239761244e-05}. Best is trial 68 with value: -0.38881930205365695.
[I 2026-07-14 16:38:27,513] Trial 94 finished with value: -0.1012832419957132 and parameters: {'scalers': 'robust', 'ratios': 'log_ratio', 'imputers': 'none', 'n_estimators': 1700, 'learning_rate': 0.02579802531607873, 'max_depth': 4, 'min_child_weight': 10, 'subsample': 0.5, 'colsample_bytree': 0.5, 'colsample_bylevel': 0.8, 'reg_alpha': 3.02518777348769, 'reg_lambda': 0.0004330280964287505, 'gamma': 2.4930454552798366e-05}. Best is trial 68 with value: -0.38881930205365695.
[I 2026-07-14 16:38:29,832] Trial 95 finished with value: -0.19326312934157044 and parameters: {'scalers': 'standard', 'ratios': 'log_ratio', 'imputers': 'none', 'n_estimators': 1600, 'learning_rate': 0.011710382793660311, 'max_depth': 4, 'min_child_weight': 6, 'subsample': 0.5, 'colsample_bytree': 0.5, 'colsample_bylevel': 0.5, 'reg_alpha': 64.97472720316419, 'reg_lambda': 0.000533036753790367, 'gamma': 1.995511533469878e-05}. Best is trial 68 with value: -0.38881930205365695.
[I 2026-07-14 16:38:33,160] Trial 96 finished with value: -0.19612947890264731 and parameters: {'scalers': 'standard', 'ratios': 'log_ratio', 'imputers': 'none', 'n_estimators': 2000, 'learning_rate': 0.01484377721096302, 'max_depth': 4, 'min_child_weight': 10, 'subsample': 0.7, 'colsample_bytree': 0.5, 'colsample_bylevel': 0.8, 'reg_alpha': 89.53154624950987, 'reg_lambda': 0.0005894644458659179, 'gamma': 2.122961629831751e-05}. Best is trial 68 with value: -0.38881930205365695.
[I 2026-07-14 16:38:35,055] Trial 97 finished with value: -0.37653203462244655 and parameters: {'scalers': 'standard', 'ratios': 'log_ratio', 'imputers': 'none', 'n_estimators': 550, 'learning_rate': 0.00012908288995911718, 'max_depth': 4, 'min_child_weight': 10, 'subsample': 0.8, 'colsample_bytree': 0.9, 'colsample_bylevel': 0.7, 'reg_alpha': 40.220735210370194, 'reg_lambda': 6.013453253396417e-06, 'gamma': 0.0008622051534355932}. Best is trial 68 with value: -0.38881930205365695.
[I 2026-07-14 16:38:35,612] Trial 98 finished with value: -0.3856125656869933 and parameters: {'scalers': 'standard', 'ratios': 'log_ratio', 'imputers': 'none', 'n_estimators': 300, 'learning_rate': 0.0001344467118783509, 'max_depth': 4, 'min_child_weight': 10, 'subsample': 0.5, 'colsample_bytree': 0.5, 'colsample_bylevel': 0.7, 'reg_alpha': 62.79320671037457, 'reg_lambda': 0.0006434490756482019, 'gamma': 4.221941199407054e-06}. Best is trial 68 with value: -0.38881930205365695.
[I 2026-07-14 16:38:36,322] Trial 99 finished with value: -0.21223184946610482 and parameters: {'scalers': 'standard', 'ratios': 'log_ratio', 'imputers': 'none', 'n_estimators': 300, 'learning_rate': 0.01005186419431045, 'max_depth': 4, 'min_child_weight': 3, 'subsample': 0.7, 'colsample_bytree': 0.5, 'colsample_bylevel': 0.7, 'reg_alpha': 37.285084574500246, 'reg_lambda': 6.5029170843717955e-06, 'gamma': 1.1912757039308149e-05}. Best is trial 68 with value: -0.38881930205365695.
[I 2026-07-14 16:38:38,847] Trial 100 finished with value: -0.10506084544876802 and parameters: {'scalers': 'none', 'ratios': 'log_ratio', 'imputers': 'none', 'n_estimators': 550, 'learning_rate': 0.01900468456940495, 'max_depth': 4, 'min_child_weight': 3, 'subsample': 0.7, 'colsample_bytree': 0.9, 'colsample_bylevel': 0.7, 'reg_alpha': 3.2603226262663894, 'reg_lambda': 7.3752292306022655e-06, 'gamma': 4.846527668583076e-06}. Best is trial 68 with value: -0.38881930205365695.
[I 2026-07-14 16:38:40,872] Trial 101 finished with value: -0.37137756727843096 and parameters: {'scalers': 'none', 'ratios': 'log_ratio', 'imputers': 'none', 'n_estimators': 550, 'learning_rate': 0.00017296212948447867, 'max_depth': 4, 'min_child_weight': 6, 'subsample': 0.7, 'colsample_bytree': 0.9, 'colsample_bylevel': 0.8, 'reg_alpha': 34.34892405149414, 'reg_lambda': 4.259467177809631e-05, 'gamma': 1.0290094956774966e-05}. Best is trial 68 with value: -0.38881930205365695.
[I 2026-07-14 16:38:44,067] Trial 102 finished with value: -0.37014504609062393 and parameters: {'scalers': 'none', 'ratios': 'norm_ratio', 'imputers': 'none', 'n_estimators': 550, 'learning_rate': 0.0001651574184522211, 'max_depth': 8, 'min_child_weight': 6, 'subsample': 0.8, 'colsample_bytree': 0.9, 'colsample_bylevel': 0.8, 'reg_alpha': 31.22611626416316, 'reg_lambda': 7.418322459603066e-06, 'gamma': 0.0009211284002028424}. Best is trial 68 with value: -0.38881930205365695.
[I 2026-07-14 16:38:48,582] Trial 103 finished with value: -0.3677688307666032 and parameters: {'scalers': 'none', 'ratios': 'norm_ratio', 'imputers': 'none', 'n_estimators': 550, 'learning_rate': 0.00017083644122070963, 'max_depth': 8, 'min_child_weight': 3, 'subsample': 0.7, 'colsample_bytree': 0.9, 'colsample_bylevel': 0.8, 'reg_alpha': 7.665985866289918, 'reg_lambda': 3.106009307633578e-05, 'gamma': 9.448500990881559e-06}. Best is trial 68 with value: -0.38881930205365695.
[I 2026-07-14 16:38:51,988] Trial 104 finished with value: -0.3740393770703261 and parameters: {'scalers': 'none', 'ratios': 'norm_ratio', 'imputers': 'none', 'n_estimators': 400, 'learning_rate': 0.00016750382421831914, 'max_depth': 9, 'min_child_weight': 3, 'subsample': 0.8, 'colsample_bytree': 0.9, 'colsample_bylevel': 0.7, 'reg_alpha': 7.964984144350616, 'reg_lambda': 3.34468251572253e-05, 'gamma': 1.124438829591949e-05}. Best is trial 68 with value: -0.38881930205365695.
[I 2026-07-14 16:38:55,269] Trial 105 finished with value: -0.3749950614186248 and parameters: {'scalers': 'none', 'ratios': 'norm_ratio', 'imputers': 'none', 'n_estimators': 400, 'learning_rate': 0.00015957732351885352, 'max_depth': 8, 'min_child_weight': 3, 'subsample': 0.7, 'colsample_bytree': 0.9, 'colsample_bylevel': 0.8, 'reg_alpha': 7.840662203656592, 'reg_lambda': 3.444430326081806e-05, 'gamma': 4.225980261618525e-06}. Best is trial 68 with value: -0.38881930205365695.
[I 2026-07-14 16:38:58,400] Trial 106 finished with value: -0.37445732823136413 and parameters: {'scalers': 'none', 'ratios': 'norm_ratio', 'imputers': 'none', 'n_estimators': 400, 'learning_rate': 0.0001649198005273675, 'max_depth': 7, 'min_child_weight': 3, 'subsample': 0.7, 'colsample_bytree': 0.9, 'colsample_bylevel': 0.8, 'reg_alpha': 7.622067896893921, 'reg_lambda': 3.8114315727370634e-05, 'gamma': 8.855753698590256e-06}. Best is trial 68 with value: -0.38881930205365695.
[I 2026-07-14 16:39:02,053] Trial 107 finished with value: -0.3749363064915396 and parameters: {'scalers': 'none', 'ratios': 'norm_ratio', 'imputers': 'none', 'n_estimators': 400, 'learning_rate': 0.00016800838598671113, 'max_depth': 8, 'min_child_weight': 6, 'subsample': 0.9, 'colsample_bytree': 0.7, 'colsample_bylevel': 0.8, 'reg_alpha': 1.4248981948362944, 'reg_lambda': 3.756779328797139e-05, 'gamma': 0.0004678372064603718}. Best is trial 68 with value: -0.38881930205365695.
[I 2026-07-14 16:39:04,221] Trial 108 finished with value: -0.3758689850097589 and parameters: {'scalers': 'robust', 'ratios': 'norm_ratio', 'imputers': 'none', 'n_estimators': 400, 'learning_rate': 0.00016626080432272732, 'max_depth': 8, 'min_child_weight': 6, 'subsample': 0.9, 'colsample_bytree': 0.7, 'colsample_bylevel': 0.5, 'reg_alpha': 8.068208867554162, 'reg_lambda': 3.149594314560407e-05, 'gamma': 1.1404072237103252e-06}. Best is trial 68 with value: -0.38881930205365695.
[I 2026-07-14 16:39:06,307] Trial 109 finished with value: -0.36387458702620035 and parameters: {'scalers': 'robust', 'ratios': 'log_ratio', 'imputers': 'none', 'n_estimators': 400, 'learning_rate': 0.00030844377213811906, 'max_depth': 8, 'min_child_weight': 8, 'subsample': 0.9, 'colsample_bytree': 0.7, 'colsample_bylevel': 0.5, 'reg_alpha': 7.505325942295358, 'reg_lambda': 2.7781434507838845e-05, 'gamma': 1.2123499065583273e-06}. Best is trial 68 with value: -0.38881930205365695.
[I 2026-07-14 16:39:08,396] Trial 110 finished with value: -0.36361622431016666 and parameters: {'scalers': 'robust', 'ratios': 'log_ratio', 'imputers': 'none', 'n_estimators': 400, 'learning_rate': 0.00031046077999657447, 'max_depth': 8, 'min_child_weight': 8, 'subsample': 0.9, 'colsample_bytree': 0.7, 'colsample_bylevel': 0.5, 'reg_alpha': 7.526187952691725, 'reg_lambda': 0.0002082527024609377, 'gamma': 1.0020960684324455e-06}. Best is trial 68 with value: -0.38881930205365695.
[I 2026-07-14 16:39:11,781] Trial 111 finished with value: -0.36441303028078464 and parameters: {'scalers': 'robust', 'ratios': 'log_ratio', 'imputers': 'none', 'n_estimators': 400, 'learning_rate': 0.0002881531201838783, 'max_depth': 9, 'min_child_weight': 8, 'subsample': 0.9, 'colsample_bytree': 0.7, 'colsample_bylevel': 0.5, 'reg_alpha': 0.3730189255975925, 'reg_lambda': 0.00018474880288922837, 'gamma': 1.0457061624390408e-06}. Best is trial 68 with value: -0.38881930205365695.
[I 2026-07-14 16:39:12,206] Trial 112 finished with value: -0.38233686397769007 and parameters: {'scalers': 'robust', 'ratios': 'log_ratio', 'imputers': 'none', 'n_estimators': 150, 'learning_rate': 0.0002904024261290297, 'max_depth': 3, 'min_child_weight': 8, 'subsample': 0.9, 'colsample_bytree': 0.7, 'colsample_bylevel': 0.5, 'reg_alpha': 0.16904805123512368, 'reg_lambda': 0.00020241916227472015, 'gamma': 1.1723151850211012e-06}. Best is trial 68 with value: -0.38881930205365695.
[I 2026-07-14 16:39:13,092] Trial 113 finished with value: -0.3803674798917649 and parameters: {'scalers': 'robust', 'ratios': 'log_ratio', 'imputers': 'none', 'n_estimators': 150, 'learning_rate': 0.00029956229657606055, 'max_depth': 7, 'min_child_weight': 8, 'subsample': 0.9, 'colsample_bytree': 0.7, 'colsample_bylevel': 0.5, 'reg_alpha': 1.5753766076835587, 'reg_lambda': 0.006723445190398555, 'gamma': 1.2549787182091995e-06}. Best is trial 68 with value: -0.38881930205365695.
[I 2026-07-14 16:39:13,583] Trial 114 finished with value: -0.38124996442593195 and parameters: {'scalers': 'robust', 'ratios': 'log_ratio', 'imputers': 'none', 'n_estimators': 150, 'learning_rate': 0.00032472834173902904, 'max_depth': 3, 'min_child_weight': 8, 'subsample': 0.9, 'colsample_bytree': 0.7, 'colsample_bylevel': 0.5, 'reg_alpha': 1.3676462267154688, 'reg_lambda': 6.493341777968026e-05, 'gamma': 1.1195746899705882e-06}. Best is trial 68 with value: -0.38881930205365695.
[I 2026-07-14 16:39:14,020] Trial 115 finished with value: -0.3819612911679738 and parameters: {'scalers': 'robust', 'ratios': 'log_ratio', 'imputers': 'none', 'n_estimators': 150, 'learning_rate': 0.00030330043716382847, 'max_depth': 3, 'min_child_weight': 8, 'subsample': 0.9, 'colsample_bytree': 0.7, 'colsample_bylevel': 0.5, 'reg_alpha': 0.13679848400062533, 'reg_lambda': 0.0002128168655125002, 'gamma': 1.2252258033213012e-06}. Best is trial 68 with value: -0.38881930205365695.
[I 2026-07-14 16:39:14,466] Trial 116 finished with value: -0.38244757558516884 and parameters: {'scalers': 'robust', 'ratios': 'log_ratio', 'imputers': 'none', 'n_estimators': 150, 'learning_rate': 0.00029861114844015194, 'max_depth': 3, 'min_child_weight': 8, 'subsample': 0.9, 'colsample_bytree': 0.6, 'colsample_bylevel': 0.5, 'reg_alpha': 0.4424418703505869, 'reg_lambda': 0.0015681754558363428, 'gamma': 1.1317621017030816e-06}. Best is trial 68 with value: -0.38881930205365695.
[I 2026-07-14 16:39:14,846] Trial 117 finished with value: -0.384296415118545 and parameters: {'scalers': 'robust', 'ratios': 'log_ratio', 'imputers': 'none', 'n_estimators': 150, 'learning_rate': 0.0002382780251528408, 'max_depth': 3, 'min_child_weight': 8, 'subsample': 0.5, 'colsample_bytree': 0.6, 'colsample_bylevel': 0.5, 'reg_alpha': 0.4559391715395145, 'reg_lambda': 0.00018181044508150016, 'gamma': 0.050166222328990505}. Best is trial 68 with value: -0.38881930205365695.
[I 2026-07-14 16:39:15,282] Trial 118 finished with value: -0.3839356202428814 and parameters: {'scalers': 'robust', 'ratios': 'log_ratio', 'imputers': 'none', 'n_estimators': 150, 'learning_rate': 0.0002470511385146712, 'max_depth': 3, 'min_child_weight': 8, 'subsample': 0.9, 'colsample_bytree': 0.6, 'colsample_bylevel': 0.5, 'reg_alpha': 0.15458796729658042, 'reg_lambda': 0.0001519787237898353, 'gamma': 3.115881460116301e-06}. Best is trial 68 with value: -0.38881930205365695.
[I 2026-07-14 16:39:15,709] Trial 119 finished with value: -0.387286987466496 and parameters: {'scalers': 'robust', 'ratios': 'log_ratio', 'imputers': 'none', 'n_estimators': 150, 'learning_rate': 0.00012998759467749385, 'max_depth': 3, 'min_child_weight': 9, 'subsample': 0.9, 'colsample_bytree': 0.6, 'colsample_bylevel': 0.5, 'reg_alpha': 0.16171811774569256, 'reg_lambda': 0.00015854081848270775, 'gamma': 4.420750771166685e-05}. Best is trial 68 with value: -0.38881930205365695.
[I 2026-07-14 16:39:16,083] Trial 120 finished with value: -0.3862520872725834 and parameters: {'scalers': 'robust', 'ratios': 'log_ratio', 'imputers': 'none', 'n_estimators': 100, 'learning_rate': 0.00024497041961343456, 'max_depth': 3, 'min_child_weight': 9, 'subsample': 0.9, 'colsample_bytree': 0.6, 'colsample_bylevel': 0.5, 'reg_alpha': 1.1411863107383278, 'reg_lambda': 6.25111266167909e-05, 'gamma': 4.113614658878957e-05}. Best is trial 68 with value: -0.38881930205365695.
[I 2026-07-14 16:39:16,319] Trial 121 finished with value: -0.3865754983078202 and parameters: {'scalers': 'robust', 'ratios': 'log_ratio', 'imputers': 'none', 'n_estimators': 100, 'learning_rate': 0.00023039296566255667, 'max_depth': 3, 'min_child_weight': 9, 'subsample': 0.9, 'colsample_bytree': 0.6, 'colsample_bylevel': 0.5, 'reg_alpha': 8.714861363308079e-05, 'reg_lambda': 6.872868385360343e-05, 'gamma': 6.576525560382267e-06}. Best is trial 68 with value: -0.38881930205365695.
[I 2026-07-14 16:39:16,657] Trial 122 finished with value: -0.3861600822250403 and parameters: {'scalers': 'robust', 'ratios': 'log_ratio', 'imputers': 'none', 'n_estimators': 100, 'learning_rate': 0.0002314263867348232, 'max_depth': 4, 'min_child_weight': 9, 'subsample': 0.5, 'colsample_bytree': 0.6, 'colsample_bylevel': 0.5, 'reg_alpha': 7.380830758583438e-05, 'reg_lambda': 0.0015354278079760795, 'gamma': 6.704239213718437e-06}. Best is trial 68 with value: -0.38881930205365695.
[I 2026-07-14 16:39:17,064] Trial 123 finished with value: -0.38603326172288355 and parameters: {'scalers': 'robust', 'ratios': 'log_ratio', 'imputers': 'none', 'n_estimators': 100, 'learning_rate': 0.00023146028351780674, 'max_depth': 4, 'min_child_weight': 9, 'subsample': 0.9, 'colsample_bytree': 0.6, 'colsample_bylevel': 0.5, 'reg_alpha': 0.9708626054291309, 'reg_lambda': 0.00014369037947059403, 'gamma': 6.640414126788401e-06}. Best is trial 68 with value: -0.38881930205365695.
[I 2026-07-14 16:39:17,433] Trial 124 finished with value: -0.385329612831395 and parameters: {'scalers': 'robust', 'ratios': 'log_ratio', 'imputers': 'none', 'n_estimators': 100, 'learning_rate': 0.000233739792334566, 'max_depth': 4, 'min_child_weight': 9, 'subsample': 0.5, 'colsample_bytree': 0.9, 'colsample_bylevel': 0.5, 'reg_alpha': 0.9043776278157076, 'reg_lambda': 0.0001359478614332929, 'gamma': 4.167240022498896e-05}. Best is trial 68 with value: -0.38881930205365695.
[I 2026-07-14 16:39:18,416] Trial 125 finished with value: -0.3831129372950905 and parameters: {'scalers': 'robust', 'ratios': 'log_ratio', 'imputers': 'median', 'n_estimators': 250, 'learning_rate': 0.00012925294332300175, 'max_depth': 4, 'min_child_weight': 9, 'subsample': 0.9, 'colsample_bytree': 0.9, 'colsample_bylevel': 0.5, 'reg_alpha': 1.8709551901449322e-05, 'reg_lambda': 2.97473160727188e-06, 'gamma': 7.019914637538157e-06}. Best is trial 68 with value: -0.38881930205365695.
[I 2026-07-14 16:39:19,323] Trial 126 finished with value: -0.3832513804352415 and parameters: {'scalers': 'robust', 'ratios': 'log_ratio', 'imputers': 'median', 'n_estimators': 250, 'learning_rate': 0.00012984714079310926, 'max_depth': 4, 'min_child_weight': 9, 'subsample': 0.5, 'colsample_bytree': 0.9, 'colsample_bylevel': 0.5, 'reg_alpha': 0.00011691431792003154, 'reg_lambda': 0.00031425345691510424, 'gamma': 3.8427391796015e-05}. Best is trial 68 with value: -0.38881930205365695.
[I 2026-07-14 16:39:20,208] Trial 127 finished with value: -0.38363240988228575 and parameters: {'scalers': 'robust', 'ratios': 'log_ratio', 'imputers': 'median', 'n_estimators': 250, 'learning_rate': 0.00012343269709881062, 'max_depth': 4, 'min_child_weight': 9, 'subsample': 0.5, 'colsample_bytree': 0.9, 'colsample_bylevel': 0.5, 'reg_alpha': 1.4668213903358761e-05, 'reg_lambda': 0.025464594106290265, 'gamma': 6.83380008667022e-06}. Best is trial 68 with value: -0.38881930205365695.
[I 2026-07-14 16:39:21,113] Trial 128 finished with value: -0.38412881073453714 and parameters: {'scalers': 'robust', 'ratios': 'log_ratio', 'imputers': 'none', 'n_estimators': 250, 'learning_rate': 0.00013248001032095872, 'max_depth': 4, 'min_child_weight': 9, 'subsample': 0.9, 'colsample_bytree': 0.6, 'colsample_bylevel': 0.5, 'reg_alpha': 0.0002994799267107027, 'reg_lambda': 0.028485200764006013, 'gamma': 6.8843809867549325e-06}. Best is trial 68 with value: -0.38881930205365695.
[I 2026-07-14 16:39:22,113] Trial 129 finished with value: -0.3826613186634837 and parameters: {'scalers': 'robust', 'ratios': 'log_ratio', 'imputers': 'median', 'n_estimators': 250, 'learning_rate': 0.00013524673263803487, 'max_depth': 4, 'min_child_weight': 9, 'subsample': 0.9, 'colsample_bytree': 0.9, 'colsample_bylevel': 0.5, 'reg_alpha': 3.7389867890057222, 'reg_lambda': 0.0003335430983702285, 'gamma': 0.00012490160956684697}. Best is trial 68 with value: -0.38881930205365695.
[I 2026-07-14 16:39:23,169] Trial 130 finished with value: -0.38323185946391203 and parameters: {'scalers': 'robust', 'ratios': 'log_ratio', 'imputers': 'median', 'n_estimators': 250, 'learning_rate': 0.0001270184843144402, 'max_depth': 4, 'min_child_weight': 9, 'subsample': 0.9, 'colsample_bytree': 0.9, 'colsample_bylevel': 0.5, 'reg_alpha': 0.07986539536982605, 'reg_lambda': 0.00035123483518818247, 'gamma': 9.650140214827563e-05}. Best is trial 68 with value: -0.38881930205365695.
[I 2026-07-14 16:39:24,507] Trial 131 finished with value: -0.38268344051740705 and parameters: {'scalers': 'robust', 'ratios': 'log_ratio', 'imputers': 'median', 'n_estimators': 250, 'learning_rate': 0.00013037333666883464, 'max_depth': 5, 'min_child_weight': 9, 'subsample': 0.9, 'colsample_bytree': 0.9, 'colsample_bylevel': 0.5, 'reg_alpha': 0.06774812529711181, 'reg_lambda': 0.0003530340244744841, 'gamma': 0.009157135852567699}. Best is trial 68 with value: -0.38881930205365695.
[I 2026-07-14 16:39:25,893] Trial 132 finished with value: -0.3833174455368548 and parameters: {'scalers': 'robust', 'ratios': 'log_ratio', 'imputers': 'median', 'n_estimators': 250, 'learning_rate': 0.00011962526293647704, 'max_depth': 5, 'min_child_weight': 9, 'subsample': 0.8, 'colsample_bytree': 0.9, 'colsample_bylevel': 0.6, 'reg_alpha': 0.05353067486156111, 'reg_lambda': 0.00040509937191349373, 'gamma': 0.00014071403853086294}. Best is trial 68 with value: -0.38881930205365695.
[I 2026-07-14 16:39:27,294] Trial 133 finished with value: -0.38309360030022893 and parameters: {'scalers': 'robust', 'ratios': 'log_ratio', 'imputers': 'median', 'n_estimators': 250, 'learning_rate': 0.0001231546541871733, 'max_depth': 5, 'min_child_weight': 9, 'subsample': 0.8, 'colsample_bytree': 0.9, 'colsample_bylevel': 0.6, 'reg_alpha': 0.05030799105566638, 'reg_lambda': 0.0003259206682026346, 'gamma': 0.008436522046739328}. Best is trial 68 with value: -0.38881930205365695.
[I 2026-07-14 16:39:28,946] Trial 134 finished with value: -0.38189968639294536 and parameters: {'scalers': 'robust', 'ratios': 'log_ratio', 'imputers': 'none', 'n_estimators': 300, 'learning_rate': 0.00011826679256587755, 'max_depth': 5, 'min_child_weight': 9, 'subsample': 0.8, 'colsample_bytree': 0.9, 'colsample_bylevel': 0.6, 'reg_alpha': 0.0924349592959744, 'reg_lambda': 0.0003725760587274266, 'gamma': 0.010023745865974489}. Best is trial 68 with value: -0.38881930205365695.
