[I 2026-07-14 16:39:30,308] Trial 135 finished with value: -0.3807292704964049 and parameters: {'scalers': 'robust', 'ratios': 'log_ratio', 'imputers': 'none', 'n_estimators': 300, 'learning_rate': 0.00014009464052792863, 'max_depth': 5, 'min_child_weight': 9, 'subsample': 0.8, 'colsample_bytree': 0.9, 'colsample_bylevel': 0.6, 'reg_alpha': 20.094899903985585, 'reg_lambda': 0.002833902792657905, 'gamma': 8.914248061110425e-05}. Best is trial 68 with value: -0.38881930205365695.
[I 2026-07-14 16:39:31,692] Trial 136 finished with value: -0.38024122466065396 and parameters: {'scalers': 'robust', 'ratios': 'log_ratio', 'imputers': 'none', 'n_estimators': 300, 'learning_rate': 0.0001460477488207879, 'max_depth': 5, 'min_child_weight': 8, 'subsample': 0.8, 'colsample_bytree': 0.9, 'colsample_bylevel': 0.6, 'reg_alpha': 19.218027303578754, 'reg_lambda': 0.00038085339266023913, 'gamma': 0.00012660015983070752}. Best is trial 68 with value: -0.38881930205365695.
[I 2026-07-14 16:39:32,280] Trial 137 finished with value: -0.38712863732537056 and parameters: {'scalers': 'robust', 'ratios': 'log_ratio', 'imputers': 'none', 'n_estimators': 200, 'learning_rate': 0.00011388417208029932, 'max_depth': 5, 'min_child_weight': 8, 'subsample': 0.8, 'colsample_bytree': 0.9, 'colsample_bylevel': 0.6, 'reg_alpha': 97.78366735475178, 'reg_lambda': 0.0029521190502721836, 'gamma': 0.009463496045038117}. Best is trial 68 with value: -0.38881930205365695.
[I 2026-07-14 16:39:33,557] Trial 138 finished with value: -0.38586500630715365 and parameters: {'scalers': 'robust', 'ratios': 'log_ratio', 'imputers': 'median', 'n_estimators': 200, 'learning_rate': 0.0001009607265078788, 'max_depth': 5, 'min_child_weight': 2, 'subsample': 0.9, 'colsample_bytree': 0.9, 'colsample_bylevel': 0.6, 'reg_alpha': 0.049695076338829705, 'reg_lambda': 0.006421736572873587, 'gamma': 0.00014769213386084352}. Best is trial 68 with value: -0.38881930205365695.
[I 2026-07-14 16:39:37,349] Trial 139 finished with value: -0.3831160139123577 and parameters: {'scalers': 'robust', 'ratios': 'log_ratio', 'imputers': 'median', 'n_estimators': 200, 'learning_rate': 0.00014955862887073857, 'max_depth': 12, 'min_child_weight': 2, 'subsample': 0.8, 'colsample_bytree': 0.9, 'colsample_bylevel': 0.6, 'reg_alpha': 0.0495939640562964, 'reg_lambda': 0.00241667804609188, 'gamma': 0.00014344957772205954}. Best is trial 68 with value: -0.38881930205365695.
[I 2026-07-14 16:39:40,956] Trial 140 finished with value: -0.38306171639428704 and parameters: {'scalers': 'robust', 'ratios': 'log_ratio', 'imputers': 'none', 'n_estimators': 200, 'learning_rate': 0.00015084914817839817, 'max_depth': 12, 'min_child_weight': 2, 'subsample': 0.9, 'colsample_bytree': 0.9, 'colsample_bylevel': 0.5, 'reg_alpha': 0.1939114825804875, 'reg_lambda': 0.006494028443233064, 'gamma': 0.0019311410377100258}. Best is trial 68 with value: -0.38881930205365695.
[I 2026-07-14 16:39:43,052] Trial 141 finished with value: -0.3832033170830491 and parameters: {'scalers': 'robust', 'ratios': 'log_ratio', 'imputers': 'none', 'n_estimators': 200, 'learning_rate': 0.00014657355099150746, 'max_depth': 12, 'min_child_weight': 8, 'subsample': 0.9, 'colsample_bytree': 0.9, 'colsample_bylevel': 0.5, 'reg_alpha': 0.16361339708212183, 'reg_lambda': 0.002772701200693069, 'gamma': 0.0018432307357678487}. Best is trial 68 with value: -0.38881930205365695.
[I 2026-07-14 16:39:46,655] Trial 142 finished with value: -0.385635540852757 and parameters: {'scalers': 'robust', 'ratios': 'log_ratio', 'imputers': 'none', 'n_estimators': 200, 'learning_rate': 0.00010171689999263181, 'max_depth': 12, 'min_child_weight': 2, 'subsample': 0.9, 'colsample_bytree': 0.9, 'colsample_bylevel': 0.5, 'reg_alpha': 0.18390981540944523, 'reg_lambda': 0.0061799946694422615, 'gamma': 0.0018833088881793645}. Best is trial 68 with value: -0.38881930205365695.
[I 2026-07-14 16:39:49,213] Trial 143 finished with value: -0.3826743807759633 and parameters: {'scalers': 'robust', 'ratios': 'log_ratio', 'imputers': 'none', 'n_estimators': 200, 'learning_rate': 0.0001496745457133513, 'max_depth': 12, 'min_child_weight': 2, 'subsample': 0.9, 'colsample_bytree': 1.0, 'colsample_bylevel': 0.5, 'reg_alpha': 2.0379858910075086, 'reg_lambda': 0.00494798098459094, 'gamma': 0.00036875590997412656}. Best is trial 68 with value: -0.38881930205365695.
[I 2026-07-14 16:39:52,748] Trial 144 finished with value: -0.385148514849987 and parameters: {'scalers': 'robust', 'ratios': 'log_ratio', 'imputers': 'mean', 'n_estimators': 200, 'learning_rate': 0.00010536757270121033, 'max_depth': 12, 'min_child_weight': 2, 'subsample': 0.9, 'colsample_bytree': 1.0, 'colsample_bylevel': 0.5, 'reg_alpha': 0.19474394598143688, 'reg_lambda': 0.007805939700174211, 'gamma': 0.00188780446586025}. Best is trial 68 with value: -0.38881930205365695.
[I 2026-07-14 16:39:55,487] Trial 145 finished with value: -0.129402373558823 and parameters: {'scalers': 'robust', 'ratios': 'log_ratio', 'imputers': 'none', 'n_estimators': 100, 'learning_rate': 0.2452840392791578, 'max_depth': 12, 'min_child_weight': 2, 'subsample': 0.9, 'colsample_bytree': 1.0, 'colsample_bylevel': 0.5, 'reg_alpha': 1.8641934432403817, 'reg_lambda': 0.007785634613185188, 'gamma': 0.0015093795510121761}. Best is trial 68 with value: -0.38881930205365695.
[I 2026-07-14 16:39:56,899] Trial 146 finished with value: -0.385706503037455 and parameters: {'scalers': 'robust', 'ratios': 'log_ratio', 'imputers': 'mean', 'n_estimators': 100, 'learning_rate': 0.00018914003820878512, 'max_depth': 12, 'min_child_weight': 2, 'subsample': 1.0, 'colsample_bytree': 1.0, 'colsample_bylevel': 0.5, 'reg_alpha': 1.8006301746418147, 'reg_lambda': 0.00010306587006148396, 'gamma': 2.132849076683664e-06}. Best is trial 68 with value: -0.38881930205365695.
[I 2026-07-14 16:39:57,744] Trial 147 finished with value: -0.38574356496400103 and parameters: {'scalers': 'robust', 'ratios': 'log_ratio', 'imputers': 'mean', 'n_estimators': 100, 'learning_rate': 0.00019333244941279804, 'max_depth': 6, 'min_child_weight': 2, 'subsample': 0.9, 'colsample_bytree': 1.0, 'colsample_bylevel': 0.5, 'reg_alpha': 0.36227192090487315, 'reg_lambda': 8.501830143478905e-05, 'gamma': 0.001997340755341486}. Best is trial 68 with value: -0.38881930205365695.
[I 2026-07-14 16:40:01,438] Trial 148 finished with value: -0.35420780356018305 and parameters: {'scalers': 'robust', 'ratios': 'log_ratio', 'imputers': 'none', 'n_estimators': 1150, 'learning_rate': 0.0001864920917900185, 'max_depth': 6, 'min_child_weight': 8, 'subsample': 0.9, 'colsample_bytree': 1.0, 'colsample_bylevel': 0.7, 'reg_alpha': 99.63195801812704, 'reg_lambda': 0.014822714904983885, 'gamma': 0.0003360354044518202}. Best is trial 68 with value: -0.38881930205365695.
[I 2026-07-14 16:40:01,471] Trial 149 finished with value: -0.38744317494595176 and parameters: {'scalers': 'robust', 'ratios': 'log_ratio', 'imputers': 'none', 'n_estimators': 100, 'learning_rate': 0.00019066947893543024, 'max_depth': 6, 'min_child_weight': 8, 'subsample': 0.9, 'colsample_bytree': 1.0, 'colsample_bylevel': 0.7, 'reg_alpha': 93.97861789726741, 'reg_lambda': 0.01540933938083167, 'gamma': 0.003723632448250197}. Best is trial 68 with value: -0.38881930205365695.
[I 2026-07-14 16:40:02,352] Trial 150 finished with value: -0.38561247056836156 and parameters: {'scalers': 'robust', 'ratios': 'log_ratio', 'imputers': 'mean', 'n_estimators': 100, 'learning_rate': 0.00019191679629094698, 'max_depth': 6, 'min_child_weight': 8, 'subsample': 1.0, 'colsample_bytree': 1.0, 'colsample_bylevel': 0.7, 'reg_alpha': 0.3407097803464039, 'reg_lambda': 0.014069511638724391, 'gamma': 0.015031274613128774}. Best is trial 68 with value: -0.38881930205365695.
[I 2026-07-14 16:40:02,723] Trial 151 finished with value: -0.38763966129473093 and parameters: {'scalers': 'robust', 'ratios': 'log_ratio', 'imputers': 'mean', 'n_estimators': 100, 'learning_rate': 0.00018813698948574737, 'max_depth': 6, 'min_child_weight': 8, 'subsample': 1.0, 'colsample_bytree': 0.9, 'colsample_bylevel': 0.7, 'reg_alpha': 91.41593052094449, 'reg_lambda': 0.011021046501852785, 'gamma': 0.0034821958032582056}. Best is trial 68 with value: -0.38881930205365695.
[I 2026-07-14 16:40:03,012] Trial 152 finished with value: -0.1990572639770572 and parameters: {'scalers': 'robust', 'ratios': 'log_ratio', 'imputers': 'none', 'n_estimators': 100, 'learning_rate': 0.1626644844728005, 'max_depth': 6, 'min_child_weight': 8, 'subsample': 1.0, 'colsample_bytree': 0.9, 'colsample_bylevel': 0.7, 'reg_alpha': 77.69376822944331, 'reg_lambda': 0.00010775226389711187, 'gamma': 2.0674968923778058e-06}. Best is trial 68 with value: -0.38881930205365695.
[I 2026-07-14 16:40:03,358] Trial 153 finished with value: -0.3875697993783749 and parameters: {'scalers': 'robust', 'ratios': 'log_ratio', 'imputers': 'none', 'n_estimators': 100, 'learning_rate': 0.0001943314286984427, 'max_depth': 6, 'min_child_weight': 7, 'subsample': 1.0, 'colsample_bytree': 0.9, 'colsample_bylevel': 0.7, 'reg_alpha': 99.2832346792111, 'reg_lambda': 0.015063314600625755, 'gamma': 2.0418844075321114e-06}. Best is trial 68 with value: -0.38881930205365695.
[I 2026-07-14 16:40:03,746] Trial 154 finished with value: -0.3874724190629388 and parameters: {'scalers': 'robust', 'ratios': 'log_ratio', 'imputers': 'none', 'n_estimators': 100, 'learning_rate': 0.00018698586848049005, 'max_depth': 6, 'min_child_weight': 8, 'subsample': 0.9, 'colsample_bytree': 0.9, 'colsample_bylevel': 0.7, 'reg_alpha': 54.745454216601836, 'reg_lambda': 0.01438716729837242, 'gamma': 1.4859118028004414e-05}. Best is trial 68 with value: -0.38881930205365695.
[I 2026-07-14 16:40:04,798] Trial 155 finished with value: -0.38010638951178854 and parameters: {'scalers': 'robust', 'ratios': 'log_ratio', 'imputers': 'none', 'n_estimators': 350, 'learning_rate': 0.0001790235356218366, 'max_depth': 6, 'min_child_weight': 7, 'subsample': 0.8, 'colsample_bytree': 0.9, 'colsample_bylevel': 0.7, 'reg_alpha': 97.74271105995086, 'reg_lambda': 0.01152197490267497, 'gamma': 2.9990886328310033e-06}. Best is trial 68 with value: -0.38881930205365695.
[I 2026-07-14 16:40:05,193] Trial 156 finished with value: -0.3879613411360273 and parameters: {'scalers': 'robust', 'ratios': 'log_ratio', 'imputers': 'none', 'n_estimators': 100, 'learning_rate': 0.00017294635032357329, 'max_depth': 6, 'min_child_weight': 7, 'subsample': 0.9, 'colsample_bytree': 0.8, 'colsample_bylevel': 0.7, 'reg_alpha': 58.90835230543389, 'reg_lambda': 0.012225867092116191, 'gamma': 2.973083042698572e-06}. Best is trial 68 with value: -0.38881930205365695.
[I 2026-07-14 16:40:05,745] Trial 157 finished with value: -0.38675904260782407 and parameters: {'scalers': 'robust', 'ratios': 'log_ratio', 'imputers': 'none', 'n_estimators': 100, 'learning_rate': 0.00017807473173900878, 'max_depth': 6, 'min_child_weight': 7, 'subsample': 0.9, 'colsample_bytree': 0.8, 'colsample_bylevel': 0.7, 'reg_alpha': 25.973492949990728, 'reg_lambda': 0.00013520468899979492, 'gamma': 3.4189743672836875e-06}. Best is trial 68 with value: -0.38881930205365695.
[I 2026-07-14 16:40:06,293] Trial 158 finished with value: -0.3883124463405488 and parameters: {'scalers': 'robust', 'ratios': 'log_ratio', 'imputers': 'none', 'n_estimators': 150, 'learning_rate': 0.00010021469225819897, 'max_depth': 7, 'min_child_weight': 7, 'subsample': 0.9, 'colsample_bytree': 0.8, 'colsample_bylevel': 0.7, 'reg_alpha': 58.47703949459209, 'reg_lambda': 0.003602667888373907, 'gamma': 0.003282142763262976}. Best is trial 68 with value: -0.38881930205365695.
[I 2026-07-14 16:40:07,042] Trial 159 finished with value: -0.38590393510495186 and parameters: {'scalers': 'robust', 'ratios': 'log_ratio', 'imputers': 'mean', 'n_estimators': 150, 'learning_rate': 0.00016658633450193432, 'max_depth': 7, 'min_child_weight': 7, 'subsample': 1.0, 'colsample_bytree': 0.8, 'colsample_bylevel': 0.7, 'reg_alpha': 49.64412035510344, 'reg_lambda': 0.03253632237150964, 'gamma': 3.6738909256726565e-06}. Best is trial 68 with value: -0.38881930205365695.
[I 2026-07-14 16:40:07,599] Trial 160 finished with value: -0.386272494688224 and parameters: {'scalers': 'robust', 'ratios': 'log_ratio', 'imputers': 'mean', 'n_estimators': 150, 'learning_rate': 0.0001739290869994074, 'max_depth': 7, 'min_child_weight': 7, 'subsample': 1.0, 'colsample_bytree': 0.8, 'colsample_bylevel': 0.7, 'reg_alpha': 56.79192088344219, 'reg_lambda': 0.01865426298623488, 'gamma': 0.003094686637466439}. Best is trial 68 with value: -0.38881930205365695.
[I 2026-07-14 16:40:08,129] Trial 161 finished with value: -0.38693070578294797 and parameters: {'scalers': 'robust', 'ratios': 'log_ratio', 'imputers': 'none', 'n_estimators': 150, 'learning_rate': 0.00017133452157509833, 'max_depth': 7, 'min_child_weight': 8, 'subsample': 1.0, 'colsample_bytree': 0.6, 'colsample_bylevel': 0.7, 'reg_alpha': 58.237192569610954, 'reg_lambda': 0.017756575742394205, 'gamma': 0.003600537069448816}. Best is trial 68 with value: -0.38881930205365695.
[I 2026-07-14 16:40:08,847] Trial 162 finished with value: -0.38561249998225805 and parameters: {'scalers': 'robust', 'ratios': 'log_ratio', 'imputers': 'none', 'n_estimators': 150, 'learning_rate': 0.00016961804900783665, 'max_depth': 6, 'min_child_weight': 7, 'subsample': 1.0, 'colsample_bytree': 0.9, 'colsample_bylevel': 0.7, 'reg_alpha': 48.49422700936687, 'reg_lambda': 0.025778319161761338, 'gamma': 3.3846672760219147e-06}. Best is trial 68 with value: -0.38881930205365695.
[I 2026-07-14 16:40:09,567] Trial 163 finished with value: -0.38458920756811166 and parameters: {'scalers': 'robust', 'ratios': 'log_ratio', 'imputers': 'mean', 'n_estimators': 150, 'learning_rate': 0.00021259637972930457, 'max_depth': 7, 'min_child_weight': 7, 'subsample': 1.0, 'colsample_bytree': 0.8, 'colsample_bylevel': 0.7, 'reg_alpha': 50.906304133332746, 'reg_lambda': 0.024884624257668606, 'gamma': 0.003302199870195893}. Best is trial 68 with value: -0.38881930205365695.
[I 2026-07-14 16:40:14,158] Trial 164 finished with value: -0.18176428390345467 and parameters: {'scalers': 'robust', 'ratios': 'log_ratio', 'imputers': 'mean', 'n_estimators': 2450, 'learning_rate': 0.06236506156232775, 'max_depth': 7, 'min_child_weight': 7, 'subsample': 1.0, 'colsample_bytree': 0.8, 'colsample_bylevel': 0.7, 'reg_alpha': 53.117919944062855, 'reg_lambda': 0.010071450795083153, 'gamma': 3.486147324061367e-06}. Best is trial 68 with value: -0.38881930205365695.
[I 2026-07-14 16:40:14,811] Trial 165 finished with value: -0.38463495322714336 and parameters: {'scalers': 'robust', 'ratios': 'log_ratio', 'imputers': 'mean', 'n_estimators': 150, 'learning_rate': 0.00021541829256716872, 'max_depth': 6, 'min_child_weight': 7, 'subsample': 1.0, 'colsample_bytree': 0.8, 'colsample_bylevel': 0.7, 'reg_alpha': 51.39551653550287, 'reg_lambda': 0.011268881693166326, 'gamma': 0.003366756256013801}. Best is trial 68 with value: -0.38881930205365695.
[I 2026-07-14 16:40:15,461] Trial 166 finished with value: -0.32336881521285626 and parameters: {'scalers': 'standard', 'ratios': 'log_ratio', 'imputers': 'mean', 'n_estimators': 150, 'learning_rate': 0.0026563131986591434, 'max_depth': 7, 'min_child_weight': 7, 'subsample': 1.0, 'colsample_bytree': 0.8, 'colsample_bylevel': 0.7, 'reg_alpha': 47.17025557964564, 'reg_lambda': 0.003864873947015951, 'gamma': 1.7460557362215146e-06}. Best is trial 68 with value: -0.38881930205365695.
[I 2026-07-14 16:40:16,079] Trial 167 finished with value: -0.33175321806301683 and parameters: {'scalers': 'standard', 'ratios': 'log_ratio', 'imputers': 'none', 'n_estimators': 150, 'learning_rate': 0.0024574306103740395, 'max_depth': 7, 'min_child_weight': 7, 'subsample': 1.0, 'colsample_bytree': 0.8, 'colsample_bylevel': 0.7, 'reg_alpha': 51.70303986175805, 'reg_lambda': 0.02359236155291456, 'gamma': 0.0032175752065749996}. Best is trial 68 with value: -0.38881930205365695.
[I 2026-07-14 16:40:16,712] Trial 168 finished with value: -0.3881042947697838 and parameters: {'scalers': 'robust', 'ratios': 'log_ratio', 'imputers': 'none', 'n_estimators': 150, 'learning_rate': 0.00010081444112123478, 'max_depth': 7, 'min_child_weight': 7, 'subsample': 1.0, 'colsample_bytree': 0.8, 'colsample_bylevel': 0.7, 'reg_alpha': 51.89815614396473, 'reg_lambda': 0.00480188816338262, 'gamma': 0.0036338370332138765}. Best is trial 68 with value: -0.38881930205365695.
[I 2026-07-14 16:40:17,298] Trial 169 finished with value: -0.3860390701612771 and parameters: {'scalers': 'robust', 'ratios': 'log_ratio', 'imputers': 'none', 'n_estimators': 100, 'learning_rate': 0.00021315746268393913, 'max_depth': 6, 'min_child_weight': 7, 'subsample': 1.0, 'colsample_bytree': 0.8, 'colsample_bylevel': 0.7, 'reg_alpha': 30.92014488768217, 'reg_lambda': 0.009881249881240338, 'gamma': 0.0041538005529005734}. Best is trial 68 with value: -0.38881930205365695.
[I 2026-07-14 16:40:28,756] Trial 170 finished with value: -0.2521036151946661 and parameters: {'scalers': 'robust', 'ratios': 'log_ratio', 'imputers': 'none', 'n_estimators': 2550, 'learning_rate': 0.00037552931175373973, 'max_depth': 6, 'min_child_weight': 7, 'subsample': 1.0, 'colsample_bytree': 0.8, 'colsample_bylevel': 0.7, 'reg_alpha': 36.44708034527776, 'reg_lambda': 0.020472728931682813, 'gamma': 0.0037691913238518007}. Best is trial 68 with value: -0.38881930205365695.
[I 2026-07-14 16:40:29,324] Trial 171 finished with value: -0.3886357910944327 and parameters: {'scalers': 'standard', 'ratios': 'log_ratio', 'imputers': 'none', 'n_estimators': 100, 'learning_rate': 0.00010120266177119634, 'max_depth': 6, 'min_child_weight': 7, 'subsample': 0.9, 'colsample_bytree': 0.8, 'colsample_bylevel': 0.7, 'reg_alpha': 26.44955594280965, 'reg_lambda': 0.009724666965754636, 'gamma': 0.0010536287975439018}. Best is trial 68 with value: -0.38881930205365695.
[I 2026-07-14 16:40:29,885] Trial 172 finished with value: -0.3885245782305634 and parameters: {'scalers': 'standard', 'ratios': 'log_ratio', 'imputers': 'none', 'n_estimators': 100, 'learning_rate': 0.00010067716665362352, 'max_depth': 6, 'min_child_weight': 7, 'subsample': 0.9, 'colsample_bytree': 0.9, 'colsample_bylevel': 0.7, 'reg_alpha': 25.70237882991303, 'reg_lambda': 0.003929352900126316, 'gamma': 0.0010666020953515425}. Best is trial 68 with value: -0.38881930205365695.
[I 2026-07-14 16:40:31,631] Trial 173 finished with value: -0.3837809925580495 and parameters: {'scalers': 'robust', 'ratios': 'log_ratio', 'imputers': 'none', 'n_estimators': 300, 'learning_rate': 0.0001022462670439509, 'max_depth': 6, 'min_child_weight': 3, 'subsample': 0.9, 'colsample_bytree': 0.9, 'colsample_bylevel': 0.7, 'reg_alpha': 33.43396998790209, 'reg_lambda': 0.0035934002301761096, 'gamma': 1.6983628013515434e-06}. Best is trial 68 with value: -0.38881930205365695.
[I 2026-07-14 16:40:32,287] Trial 174 finished with value: -0.3818862737470045 and parameters: {'scalers': 'robust', 'ratios': 'log_ratio', 'imputers': 'none', 'n_estimators': 100, 'learning_rate': 0.0003818072228705378, 'max_depth': 6, 'min_child_weight': 3, 'subsample': 0.9, 'colsample_bytree': 0.9, 'colsample_bylevel': 0.7, 'reg_alpha': 29.438873096514076, 'reg_lambda': 0.04266116579080947, 'gamma': 0.0009929117543787036}. Best is trial 68 with value: -0.38881930205365695.
[I 2026-07-14 16:40:46,191] Trial 175 finished with value: -0.33323830051614345 and parameters: {'scalers': 'robust', 'ratios': 'log_ratio', 'imputers': 'none', 'n_estimators': 2800, 'learning_rate': 0.00010114453245165113, 'max_depth': 6, 'min_child_weight': 6, 'subsample': 0.9, 'colsample_bytree': 0.9, 'colsample_bylevel': 0.7, 'reg_alpha': 34.70199477177951, 'reg_lambda': 0.004625580318175654, 'gamma': 0.0006314332098990117}. Best is trial 68 with value: -0.38881930205365695.
[I 2026-07-14 16:40:48,036] Trial 176 finished with value: -0.3835049328488528 and parameters: {'scalers': 'robust', 'ratios': 'log_ratio', 'imputers': 'none', 'n_estimators': 300, 'learning_rate': 0.00010350474215352637, 'max_depth': 9, 'min_child_weight': 6, 'subsample': 1.0, 'colsample_bytree': 0.9, 'colsample_bylevel': 0.7, 'reg_alpha': 31.898452716357973, 'reg_lambda': 0.005300750806536836, 'gamma': 0.0010769301226847274}. Best is trial 68 with value: -0.38881930205365695.
[I 2026-07-14 16:40:49,502] Trial 177 finished with value: -0.3835349931069869 and parameters: {'scalers': 'robust', 'ratios': 'log_ratio', 'imputers': 'none', 'n_estimators': 300, 'learning_rate': 0.00010167928362179916, 'max_depth': 6, 'min_child_weight': 6, 'subsample': 0.5, 'colsample_bytree': 0.9, 'colsample_bylevel': 0.7, 'reg_alpha': 13.533236895004682, 'reg_lambda': 0.0034660123713650065, 'gamma': 0.000601375666683366}. Best is trial 68 with value: -0.38881930205365695.
[I 2026-07-14 16:40:51,342] Trial 178 finished with value: -0.3835426047672415 and parameters: {'scalers': 'robust', 'ratios': 'log_ratio', 'imputers': 'none', 'n_estimators': 300, 'learning_rate': 0.00010116197671797338, 'max_depth': 6, 'min_child_weight': 3, 'subsample': 0.9, 'colsample_bytree': 0.9, 'colsample_bylevel': 0.7, 'reg_alpha': 26.554667457857185, 'reg_lambda': 0.004040156468296606, 'gamma': 0.000960281151633305}. Best is trial 68 with value: -0.38881930205365695.
[I 2026-07-14 16:40:53,008] Trial 179 finished with value: -0.38339607552856664 and parameters: {'scalers': 'standard', 'ratios': 'log_ratio', 'imputers': 'none', 'n_estimators': 300, 'learning_rate': 0.00010228981920536794, 'max_depth': 6, 'min_child_weight': 6, 'subsample': 0.9, 'colsample_bytree': 0.9, 'colsample_bylevel': 0.7, 'reg_alpha': 25.22788330200086, 'reg_lambda': 0.00503870955619322, 'gamma': 0.001286910168349505}. Best is trial 68 with value: -0.38881930205365695.
