[I 2026-07-14 19:51:29,261] A new study created in RDB with name: my-study
[I 2026-07-14 19:51:32,837] Trial 2 finished with value: -0.026333533215876215 and parameters: {'scalers': 'none', 'ratios': 'norm_ratio', 'imputers': 'median', 'n_estimators': 100, 'learning_rate': 0.0005153510809662121, 'max_depth': 9, 'min_child_weight': 10, 'subsample': 0.7, 'colsample_bytree': 0.5, 'colsample_bylevel': 1.0, 'reg_alpha': 34.637058344836625, 'reg_lambda': 0.0021769613729117005, 'gamma': 11.875880376700104}. Best is trial 2 with value: -0.026333533215876215.
[I 2026-07-14 19:51:36,685] Trial 0 finished with value: -0.02576955046366888 and parameters: {'scalers': 'standard', 'ratios': 'log_ratio', 'imputers': 'median', 'n_estimators': 3000, 'learning_rate': 0.047887760612306714, 'max_depth': 6, 'min_child_weight': 4, 'subsample': 1.0, 'colsample_bytree': 1.0, 'colsample_bylevel': 0.6, 'reg_alpha': 6.990671170872073e-05, 'reg_lambda': 0.00043567395609859225, 'gamma': 1.8402586777754992}. Best is trial 2 with value: -0.026333533215876215.
[I 2026-07-14 19:51:47,188] Trial 1 finished with value: -0.024746919245476645 and parameters: {'scalers': 'none', 'ratios': 'norm_ratio', 'imputers': 'mean', 'n_estimators': 2850, 'learning_rate': 0.0003537611523056365, 'max_depth': 9, 'min_child_weight': 5, 'subsample': 0.5, 'colsample_bytree': 0.6, 'colsample_bylevel': 0.9, 'reg_alpha': 0.0032603326513525066, 'reg_lambda': 9.97903202586403e-06, 'gamma': 0.10795403886682632}. Best is trial 2 with value: -0.026333533215876215.
[I 2026-07-14 19:52:06,285] Trial 4 finished with value: -0.030763228774300683 and parameters: {'scalers': 'robust', 'ratios': 'norm_ratio', 'imputers': 'none', 'n_estimators': 2850, 'learning_rate': 0.006677959507808457, 'max_depth': 8, 'min_child_weight': 9, 'subsample': 0.7, 'colsample_bytree': 0.9, 'colsample_bylevel': 0.7, 'reg_alpha': 0.00014459841390926354, 'reg_lambda': 2.5052742473630945e-06, 'gamma': 0.0016247894038632048}. Best is trial 4 with value: -0.030763228774300683.
[I 2026-07-14 19:52:06,915] Trial 3 finished with value: -0.02633095346089597 and parameters: {'scalers': 'standard', 'ratios': 'norm_ratio', 'imputers': 'median', 'n_estimators': 850, 'learning_rate': 0.0013540225841139333, 'max_depth': 11, 'min_child_weight': 7, 'subsample': 0.8, 'colsample_bytree': 0.5, 'colsample_bylevel': 0.9, 'reg_alpha': 10.54926444381976, 'reg_lambda': 38.60877217792774, 'gamma': 6.436458219525958}. Best is trial 4 with value: -0.030763228774300683.
[I 2026-07-14 19:52:07,520] Trial 5 finished with value: -0.024754318947646715 and parameters: {'scalers': 'none', 'ratios': 'norm_ratio', 'imputers': 'mean', 'n_estimators': 600, 'learning_rate': 0.0019275489894448438, 'max_depth': 4, 'min_child_weight': 8, 'subsample': 0.5, 'colsample_bytree': 0.7, 'colsample_bylevel': 0.5, 'reg_alpha': 0.017992841586316543, 'reg_lambda': 1.4957258233173608e-05, 'gamma': 0.47764784650520803}. Best is trial 4 with value: -0.030763228774300683.
[I 2026-07-14 19:52:09,421] Trial 6 finished with value: -0.024278723911893427 and parameters: {'scalers': 'none', 'ratios': 'log_ratio', 'imputers': 'mean', 'n_estimators': 700, 'learning_rate': 0.014757933287027656, 'max_depth': 5, 'min_child_weight': 5, 'subsample': 1.0, 'colsample_bytree': 1.0, 'colsample_bylevel': 0.8, 'reg_alpha': 2.39658004296043e-06, 'reg_lambda': 0.14215347443579202, 'gamma': 0.09587627119132705}. Best is trial 4 with value: -0.030763228774300683.
[I 2026-07-14 19:52:11,308] Trial 7 finished with value: -0.025885776067988368 and parameters: {'scalers': 'standard', 'ratios': 'log_ratio', 'imputers': 'none', 'n_estimators': 1350, 'learning_rate': 0.0005689766196558367, 'max_depth': 12, 'min_child_weight': 1, 'subsample': 0.7, 'colsample_bytree': 0.7, 'colsample_bylevel': 1.0, 'reg_alpha': 23.19430170955819, 'reg_lambda': 0.32539182928934896, 'gamma': 0.001069292076102129}. Best is trial 4 with value: -0.030763228774300683.
[I 2026-07-14 19:52:14,725] Trial 8 finished with value: -0.02560408816647569 and parameters: {'scalers': 'robust', 'ratios': 'log_ratio', 'imputers': 'median', 'n_estimators': 2550, 'learning_rate': 0.000479978620552353, 'max_depth': 8, 'min_child_weight': 2, 'subsample': 1.0, 'colsample_bytree': 0.7, 'colsample_bylevel': 0.9, 'reg_alpha': 0.05428646522747274, 'reg_lambda': 0.04319509805850908, 'gamma': 1.3214628565902915}. Best is trial 4 with value: -0.030763228774300683.
[I 2026-07-14 19:52:16,665] Trial 9 finished with value: -0.029361690428673738 and parameters: {'scalers': 'standard', 'ratios': 'log_ratio', 'imputers': 'none', 'n_estimators': 550, 'learning_rate': 0.07034747431217955, 'max_depth': 6, 'min_child_weight': 4, 'subsample': 0.6, 'colsample_bytree': 0.7, 'colsample_bylevel': 0.6, 'reg_alpha': 9.488677313632239e-05, 'reg_lambda': 1.279336007156703, 'gamma': 1.3274812833574922e-05}. Best is trial 4 with value: -0.030763228774300683.
[I 2026-07-14 19:52:49,761] Trial 11 finished with value: -0.024855304180966993 and parameters: {'scalers': 'none', 'ratios': 'norm_ratio', 'imputers': 'mean', 'n_estimators': 450, 'learning_rate': 0.10637596818518345, 'max_depth': 9, 'min_child_weight': 2, 'subsample': 0.9, 'colsample_bytree': 0.5, 'colsample_bylevel': 0.6, 'reg_alpha': 21.29654002309117, 'reg_lambda': 7.0051968833380476e-06, 'gamma': 0.0005285285612554284}. Best is trial 4 with value: -0.030763228774300683.
[I 2026-07-14 19:52:50,198] Trial 10 finished with value: -0.033856804697394355 and parameters: {'scalers': 'none', 'ratios': 'log_ratio', 'imputers': 'mean', 'n_estimators': 2850, 'learning_rate': 0.007836807560300382, 'max_depth': 11, 'min_child_weight': 10, 'subsample': 0.9, 'colsample_bytree': 0.9, 'colsample_bylevel': 0.9, 'reg_alpha': 0.003417288435085453, 'reg_lambda': 0.0034311931088127977, 'gamma': 1.884097207888615e-05}. Best is trial 10 with value: -0.033856804697394355.
[I 2026-07-14 19:52:51,812] Trial 12 finished with value: -0.026005744601236284 and parameters: {'scalers': 'standard', 'ratios': 'norm_ratio', 'imputers': 'median', 'n_estimators': 300, 'learning_rate': 0.0003061092838186806, 'max_depth': 7, 'min_child_weight': 2, 'subsample': 0.6, 'colsample_bytree': 0.5, 'colsample_bylevel': 0.9, 'reg_alpha': 0.011555241462917672, 'reg_lambda': 5.2022812090959155e-06, 'gamma': 0.0006818499799240368}. Best is trial 10 with value: -0.033856804697394355.
[I 2026-07-14 19:53:06,945] Trial 13 finished with value: -0.024918123704636058 and parameters: {'scalers': 'robust', 'ratios': 'log_ratio', 'imputers': 'none', 'n_estimators': 2650, 'learning_rate': 0.00018691166530926983, 'max_depth': 7, 'min_child_weight': 5, 'subsample': 1.0, 'colsample_bytree': 0.6, 'colsample_bylevel': 0.8, 'reg_alpha': 1.8076889799561043e-05, 'reg_lambda': 9.68161288297085e-06, 'gamma': 0.009256853826818786}. Best is trial 10 with value: -0.033856804697394355.
[I 2026-07-14 19:53:15,284] Trial 14 finished with value: -0.02502404000442433 and parameters: {'scalers': 'robust', 'ratios': 'log_ratio', 'imputers': 'mean', 'n_estimators': 2200, 'learning_rate': 0.004001064084694793, 'max_depth': 6, 'min_child_weight': 7, 'subsample': 0.9, 'colsample_bytree': 0.7, 'colsample_bylevel': 0.7, 'reg_alpha': 0.0006927144741566379, 'reg_lambda': 0.00011172222762530405, 'gamma': 0.010114470929246118}. Best is trial 10 with value: -0.033856804697394355.
[I 2026-07-14 19:53:26,422] Trial 15 finished with value: -0.025175619189190722 and parameters: {'scalers': 'robust', 'ratios': 'log_ratio', 'imputers': 'none', 'n_estimators': 2950, 'learning_rate': 0.003047980700758323, 'max_depth': 5, 'min_child_weight': 10, 'subsample': 0.5, 'colsample_bytree': 0.9, 'colsample_bylevel': 1.0, 'reg_alpha': 0.015728716271573226, 'reg_lambda': 0.008057636248426139, 'gamma': 1.152377273027483e-05}. Best is trial 10 with value: -0.033856804697394355.
[I 2026-07-14 19:53:36,565] Trial 16 finished with value: -0.024248262982172003 and parameters: {'scalers': 'robust', 'ratios': 'log_ratio', 'imputers': 'median', 'n_estimators': 1850, 'learning_rate': 0.0007043241673711165, 'max_depth': 8, 'min_child_weight': 1, 'subsample': 0.7, 'colsample_bytree': 0.8, 'colsample_bylevel': 0.5, 'reg_alpha': 0.01128773338853307, 'reg_lambda': 70.78729749307008, 'gamma': 0.002205502746311279}. Best is trial 10 with value: -0.033856804697394355.
[I 2026-07-14 19:53:41,240] Trial 17 finished with value: -0.03452922336273701 and parameters: {'scalers': 'robust', 'ratios': 'norm_ratio', 'imputers': 'none', 'n_estimators': 2000, 'learning_rate': 0.4050294965696452, 'max_depth': 3, 'min_child_weight': 9, 'subsample': 0.8, 'colsample_bytree': 0.9, 'colsample_bylevel': 0.7, 'reg_alpha': 0.41853143966167855, 'reg_lambda': 1.5974559533521865e-06, 'gamma': 2.358040257958871e-06}. Best is trial 17 with value: -0.03452922336273701.
[I 2026-07-14 19:53:51,514] Trial 18 finished with value: -0.05180194180469041 and parameters: {'scalers': 'robust', 'ratios': 'log_ratio', 'imputers': 'none', 'n_estimators': 1950, 'learning_rate': 0.32226220851569876, 'max_depth': 7, 'min_child_weight': 10, 'subsample': 0.6, 'colsample_bytree': 0.9, 'colsample_bylevel': 0.7, 'reg_alpha': 9.796256477306349e-05, 'reg_lambda': 77.48414926701199, 'gamma': 1.0390178568815736e-06}. Best is trial 18 with value: -0.05180194180469041.
[I 2026-07-14 19:54:15,239] Trial 19 finished with value: -0.034346989609942515 and parameters: {'scalers': 'robust', 'ratios': 'log_ratio', 'imputers': 'none', 'n_estimators': 2250, 'learning_rate': 0.009072745333015995, 'max_depth': 11, 'min_child_weight': 10, 'subsample': 0.8, 'colsample_bytree': 0.9, 'colsample_bylevel': 0.7, 'reg_alpha': 0.0013173301708745086, 'reg_lambda': 0.00042955740852650717, 'gamma': 3.6728822897607097e-06}. Best is trial 18 with value: -0.05180194180469041.
[I 2026-07-14 19:54:37,265] Trial 20 finished with value: -0.03289148686409443 and parameters: {'scalers': 'robust', 'ratios': 'log_ratio', 'imputers': 'none', 'n_estimators': 2200, 'learning_rate': 0.006871379385357134, 'max_depth': 11, 'min_child_weight': 10, 'subsample': 0.8, 'colsample_bytree': 0.9, 'colsample_bylevel': 0.7, 'reg_alpha': 0.00033790056941210956, 'reg_lambda': 0.0004278747225964336, 'gamma': 1.1343632972311782e-06}. Best is trial 18 with value: -0.05180194180469041.
[I 2026-07-14 19:54:58,806] Trial 21 finished with value: -0.032571426670122285 and parameters: {'scalers': 'robust', 'ratios': 'norm_ratio', 'imputers': 'none', 'n_estimators': 2200, 'learning_rate': 0.006187912449049023, 'max_depth': 11, 'min_child_weight': 10, 'subsample': 0.8, 'colsample_bytree': 0.9, 'colsample_bylevel': 0.7, 'reg_alpha': 0.0010079711132327707, 'reg_lambda': 0.0020166932428578414, 'gamma': 1.449561625749062e-06}. Best is trial 18 with value: -0.05180194180469041.
[I 2026-07-14 19:55:16,508] Trial 22 finished with value: -0.055618658145236866 and parameters: {'scalers': 'robust', 'ratios': 'norm_ratio', 'imputers': 'none', 'n_estimators': 2050, 'learning_rate': 0.3991932543057228, 'max_depth': 11, 'min_child_weight': 10, 'subsample': 0.8, 'colsample_bytree': 0.9, 'colsample_bylevel': 0.7, 'reg_alpha': 0.3861675575415084, 'reg_lambda': 0.005565066097014711, 'gamma': 1.0089461057302104e-06}. Best is trial 22 with value: -0.055618658145236866.
[I 2026-07-14 19:55:39,871] Trial 23 finished with value: -0.03550902505644468 and parameters: {'scalers': 'robust', 'ratios': 'norm_ratio', 'imputers': 'none', 'n_estimators': 2150, 'learning_rate': 0.009757500510093413, 'max_depth': 11, 'min_child_weight': 9, 'subsample': 0.8, 'colsample_bytree': 0.9, 'colsample_bylevel': 0.7, 'reg_alpha': 0.4684547625335041, 'reg_lambda': 0.0001690875178065684, 'gamma': 1.360262286182599e-06}. Best is trial 22 with value: -0.055618658145236866.
[I 2026-07-14 19:56:03,482] Trial 24 finished with value: -0.03541327456741412 and parameters: {'scalers': 'robust', 'ratios': 'norm_ratio', 'imputers': 'none', 'n_estimators': 2200, 'learning_rate': 0.010221877516755237, 'max_depth': 11, 'min_child_weight': 9, 'subsample': 0.8, 'colsample_bytree': 0.9, 'colsample_bylevel': 0.7, 'reg_alpha': 0.32536194708749894, 'reg_lambda': 0.00014359019458227943, 'gamma': 1.915540555339016e-06}. Best is trial 22 with value: -0.055618658145236866.
[I 2026-07-14 19:56:08,047] Trial 25 finished with value: -0.03494609265924055 and parameters: {'scalers': 'none', 'ratios': 'norm_ratio', 'imputers': 'none', 'n_estimators': 1850, 'learning_rate': 0.4569503041569982, 'max_depth': 3, 'min_child_weight': 8, 'subsample': 0.8, 'colsample_bytree': 0.9, 'colsample_bylevel': 0.8, 'reg_alpha': 1.1661610462065184, 'reg_lambda': 0.00013164202910806468, 'gamma': 1.1260113170654561e-06}. Best is trial 22 with value: -0.055618658145236866.
[I 2026-07-14 19:56:11,844] Trial 26 finished with value: -0.035823969571655206 and parameters: {'scalers': 'robust', 'ratios': 'norm_ratio', 'imputers': 'none', 'n_estimators': 1700, 'learning_rate': 0.48567056421836996, 'max_depth': 3, 'min_child_weight': 8, 'subsample': 0.8, 'colsample_bytree': 0.8, 'colsample_bylevel': 0.7, 'reg_alpha': 0.6296726529376206, 'reg_lambda': 5.095170916880111, 'gamma': 1.1035295427950252e-06}. Best is trial 22 with value: -0.055618658145236866.
[I 2026-07-14 19:56:15,247] Trial 27 finished with value: -0.04062092910803405 and parameters: {'scalers': 'robust', 'ratios': 'norm_ratio', 'imputers': 'none', 'n_estimators': 1500, 'learning_rate': 0.4863599426036641, 'max_depth': 3, 'min_child_weight': 8, 'subsample': 0.6, 'colsample_bytree': 0.8, 'colsample_bylevel': 0.8, 'reg_alpha': 0.9204848517530481, 'reg_lambda': 1.8508244659628943, 'gamma': 1.2354297328472014e-06}. Best is trial 22 with value: -0.055618658145236866.
[I 2026-07-14 19:56:19,106] Trial 28 finished with value: -0.0356673546544564 and parameters: {'scalers': 'robust', 'ratios': 'norm_ratio', 'imputers': 'none', 'n_estimators': 1650, 'learning_rate': 0.46920049320862073, 'max_depth': 3, 'min_child_weight': 8, 'subsample': 0.8, 'colsample_bytree': 0.8, 'colsample_bylevel': 0.8, 'reg_alpha': 0.6258843265140335, 'reg_lambda': 2.3383242818749137, 'gamma': 1.0508066319547618e-06}. Best is trial 22 with value: -0.055618658145236866.
[I 2026-07-14 19:56:22,888] Trial 29 finished with value: -0.03962793233913013 and parameters: {'scalers': 'robust', 'ratios': 'log_ratio', 'imputers': 'none', 'n_estimators': 1700, 'learning_rate': 0.4520888520634523, 'max_depth': 3, 'min_child_weight': 8, 'subsample': 0.6, 'colsample_bytree': 0.8, 'colsample_bylevel': 0.8, 'reg_alpha': 0.42178526644463676, 'reg_lambda': 4.2142087933288925, 'gamma': 6.883749385376166e-05}. Best is trial 22 with value: -0.055618658145236866.
[I 2026-07-14 19:56:26,613] Trial 30 finished with value: -0.040435056598627256 and parameters: {'scalers': 'robust', 'ratios': 'norm_ratio', 'imputers': 'none', 'n_estimators': 1650, 'learning_rate': 0.4542459990883178, 'max_depth': 3, 'min_child_weight': 8, 'subsample': 0.6, 'colsample_bytree': 0.8, 'colsample_bylevel': 0.8, 'reg_alpha': 0.533078377783847, 'reg_lambda': 6.735364103354779, 'gamma': 0.00010436209054214224}. Best is trial 22 with value: -0.055618658145236866.
[I 2026-07-14 19:56:38,534] Trial 31 finished with value: -0.06509177343750938 and parameters: {'scalers': 'robust', 'ratios': 'norm_ratio', 'imputers': 'none', 'n_estimators': 1500, 'learning_rate': 0.4276499607219165, 'max_depth': 12, 'min_child_weight': 8, 'subsample': 0.6, 'colsample_bytree': 0.8, 'colsample_bylevel': 0.8, 'reg_alpha': 0.8766409524472143, 'reg_lambda': 2.2219969123773473, 'gamma': 6.627459625174711e-05}. Best is trial 31 with value: -0.06509177343750938.
[I 2026-07-14 19:56:48,015] Trial 32 finished with value: -0.06781896034622135 and parameters: {'scalers': 'robust', 'ratios': 'norm_ratio', 'imputers': 'none', 'n_estimators': 1550, 'learning_rate': 0.46691633666267374, 'max_depth': 10, 'min_child_weight': 8, 'subsample': 0.6, 'colsample_bytree': 0.8, 'colsample_bylevel': 0.8, 'reg_alpha': 2.3977141000394564, 'reg_lambda': 2.752262902754208, 'gamma': 7.356381813609018e-05}. Best is trial 32 with value: -0.06781896034622135.
[I 2026-07-14 19:56:53,523] Trial 33 finished with value: -0.0294203968887811 and parameters: {'scalers': 'robust', 'ratios': 'norm_ratio', 'imputers': 'none', 'n_estimators': 1400, 'learning_rate': 0.026534586822991008, 'max_depth': 10, 'min_child_weight': 8, 'subsample': 0.6, 'colsample_bytree': 0.8, 'colsample_bylevel': 0.6, 'reg_alpha': 3.0334037668453857, 'reg_lambda': 11.633788709492254, 'gamma': 5.883958050896046e-05}. Best is trial 32 with value: -0.06781896034622135.
[I 2026-07-14 19:56:57,581] Trial 34 finished with value: -0.03169836212413149 and parameters: {'scalers': 'robust', 'ratios': 'norm_ratio', 'imputers': 'none', 'n_estimators': 1550, 'learning_rate': 0.17508301824986716, 'max_depth': 4, 'min_child_weight': 8, 'subsample': 0.6, 'colsample_bytree': 0.8, 'colsample_bylevel': 0.6, 'reg_alpha': 3.394782919779168, 'reg_lambda': 17.126710694555594, 'gamma': 7.72594092466763e-05}. Best is trial 32 with value: -0.06781896034622135.
[I 2026-07-14 19:57:01,388] Trial 35 finished with value: -0.03250396544231905 and parameters: {'scalers': 'robust', 'ratios': 'norm_ratio', 'imputers': 'none', 'n_estimators': 1350, 'learning_rate': 0.19732059830796986, 'max_depth': 4, 'min_child_weight': 7, 'subsample': 0.6, 'colsample_bytree': 0.8, 'colsample_bylevel': 0.8, 'reg_alpha': 4.233355382584638, 'reg_lambda': 5.9045111961649415, 'gamma': 8.415300969431416e-05}. Best is trial 32 with value: -0.06781896034622135.
[I 2026-07-14 19:57:03,658] Trial 36 finished with value: -0.029249213237361765 and parameters: {'scalers': 'robust', 'ratios': 'norm_ratio', 'imputers': 'none', 'n_estimators': 1050, 'learning_rate': 0.1485081635681211, 'max_depth': 4, 'min_child_weight': 7, 'subsample': 0.6, 'colsample_bytree': 1.0, 'colsample_bylevel': 0.6, 'reg_alpha': 4.791310513014119, 'reg_lambda': 16.30370185783079, 'gamma': 9.477737045409546e-05}. Best is trial 32 with value: -0.06781896034622135.
[I 2026-07-14 19:57:06,877] Trial 37 finished with value: -0.029994671596261558 and parameters: {'scalers': 'robust', 'ratios': 'norm_ratio', 'imputers': 'none', 'n_estimators': 1300, 'learning_rate': 0.16151304059136112, 'max_depth': 5, 'min_child_weight': 7, 'subsample': 0.6, 'colsample_bytree': 1.0, 'colsample_bylevel': 0.6, 'reg_alpha': 7.345842901810916, 'reg_lambda': 16.778308215751288, 'gamma': 6.697743729685826e-05}. Best is trial 32 with value: -0.06781896034622135.
[I 2026-07-14 19:57:10,702] Trial 38 finished with value: -0.033043041260025385 and parameters: {'scalers': 'robust', 'ratios': 'norm_ratio', 'imputers': 'none', 'n_estimators': 1300, 'learning_rate': 0.1953190038907272, 'max_depth': 4, 'min_child_weight': 7, 'subsample': 0.6, 'colsample_bytree': 1.0, 'colsample_bylevel': 0.6, 'reg_alpha': 3.4698130159038625, 'reg_lambda': 24.428246386670175, 'gamma': 4.285053595433713e-05}. Best is trial 32 with value: -0.06781896034622135.
[I 2026-07-14 19:57:17,007] Trial 39 finished with value: -0.048072817961939046 and parameters: {'scalers': 'robust', 'ratios': 'norm_ratio', 'imputers': 'none', 'n_estimators': 1300, 'learning_rate': 0.22143381835086506, 'max_depth': 12, 'min_child_weight': 7, 'subsample': 0.6, 'colsample_bytree': 1.0, 'colsample_bylevel': 0.6, 'reg_alpha': 2.7843491777198066, 'reg_lambda': 13.516699815557967, 'gamma': 5.3824424381498325e-05}. Best is trial 32 with value: -0.06781896034622135.
[I 2026-07-14 19:57:21,618] Trial 40 finished with value: -0.04244792486730627 and parameters: {'scalers': 'robust', 'ratios': 'norm_ratio', 'imputers': 'none', 'n_estimators': 1200, 'learning_rate': 0.18989200585458305, 'max_depth': 12, 'min_child_weight': 7, 'subsample': 0.5, 'colsample_bytree': 1.0, 'colsample_bylevel': 0.6, 'reg_alpha': 4.190235822851529, 'reg_lambda': 23.27022696788263, 'gamma': 7.606678811083306e-05}. Best is trial 32 with value: -0.06781896034622135.
[I 2026-07-14 19:57:28,797] Trial 41 finished with value: -0.05185937028201158 and parameters: {'scalers': 'robust', 'ratios': 'norm_ratio', 'imputers': 'none', 'n_estimators': 1100, 'learning_rate': 0.20805428513775315, 'max_depth': 12, 'min_child_weight': 7, 'subsample': 0.5, 'colsample_bytree': 1.0, 'colsample_bylevel': 0.6, 'reg_alpha': 0.07488065208248618, 'reg_lambda': 17.98172606008527, 'gamma': 0.00023852259762523778}. Best is trial 32 with value: -0.06781896034622135.
[I 2026-07-14 19:57:29,671] Trial 42 finished with value: -0.026301055820642318 and parameters: {'scalers': 'standard', 'ratios': 'norm_ratio', 'imputers': 'none', 'n_estimators': 1150, 'learning_rate': 0.201279364468887, 'max_depth': 12, 'min_child_weight': 6, 'subsample': 0.5, 'colsample_bytree': 1.0, 'colsample_bylevel': 0.9, 'reg_alpha': 77.5984658537838, 'reg_lambda': 0.3523233339918507, 'gamma': 0.00024943246588703084}. Best is trial 32 with value: -0.06781896034622135.
[I 2026-07-14 19:57:30,766] Trial 43 finished with value: -0.02633196402538644 and parameters: {'scalers': 'standard', 'ratios': 'norm_ratio', 'imputers': 'median', 'n_estimators': 1100, 'learning_rate': 0.22308090259645386, 'max_depth': 12, 'min_child_weight': 6, 'subsample': 0.5, 'colsample_bytree': 1.0, 'colsample_bylevel': 0.6, 'reg_alpha': 84.82345869224899, 'reg_lambda': 0.34197416918807644, 'gamma': 5.861961506070391e-06}. Best is trial 32 with value: -0.06781896034622135.
[I 2026-07-14 19:57:31,943] Trial 44 finished with value: -0.026334039239629875 and parameters: {'scalers': 'standard', 'ratios': 'norm_ratio', 'imputers': 'median', 'n_estimators': 1100, 'learning_rate': 0.2487575407163662, 'max_depth': 12, 'min_child_weight': 6, 'subsample': 0.5, 'colsample_bytree': 1.0, 'colsample_bylevel': 0.9, 'reg_alpha': 97.84760501200138, 'reg_lambda': 0.7098823728805014, 'gamma': 73.54301755646665}. Best is trial 32 with value: -0.06781896034622135.
