[I 2026-07-14 22:08:39,992] Trial 315 finished with value: -4.051401413377494 and parameters: {'scalers': 'robust', 'ratios': 'log_ratio', 'imputers': 'median', 'n_estimators': 2650, 'learning_rate': 0.41405692519667286, 'max_depth': 11, 'min_child_weight': 1, 'subsample': 0.8, 'colsample_bytree': 0.8, 'colsample_bylevel': 0.9, 'reg_alpha': 0.00027960954075416356, 'reg_lambda': 51.75556489474356, 'gamma': 5.0202118743127356e-05}. Best is trial 286 with value: -4.973512667829732.
[I 2026-07-14 22:09:42,745] Trial 316 finished with value: -3.938634203683385 and parameters: {'scalers': 'robust', 'ratios': 'log_ratio', 'imputers': 'median', 'n_estimators': 2650, 'learning_rate': 0.4169782470336233, 'max_depth': 10, 'min_child_weight': 1, 'subsample': 0.8, 'colsample_bytree': 0.8, 'colsample_bylevel': 0.9, 'reg_alpha': 0.0007960707758623992, 'reg_lambda': 52.16221848837017, 'gamma': 4.734632623202029e-05}. Best is trial 286 with value: -4.973512667829732.
[I 2026-07-14 22:10:48,212] Trial 317 finished with value: -3.843134247411911 and parameters: {'scalers': 'robust', 'ratios': 'log_ratio', 'imputers': 'median', 'n_estimators': 2650, 'learning_rate': 0.4240661852725198, 'max_depth': 10, 'min_child_weight': 1, 'subsample': 0.8, 'colsample_bytree': 0.8, 'colsample_bylevel': 0.9, 'reg_alpha': 0.0001834089071758931, 'reg_lambda': 53.53670643454017, 'gamma': 0.00010458600961694306}. Best is trial 286 with value: -4.973512667829732.
[I 2026-07-14 22:11:54,867] Trial 318 finished with value: -4.218866195822673 and parameters: {'scalers': 'robust', 'ratios': 'log_ratio', 'imputers': 'median', 'n_estimators': 2650, 'learning_rate': 0.4324547234663641, 'max_depth': 11, 'min_child_weight': 1, 'subsample': 0.8, 'colsample_bytree': 0.8, 'colsample_bylevel': 0.9, 'reg_alpha': 0.0008124737990769433, 'reg_lambda': 58.78009636840811, 'gamma': 1.070674934531074e-05}. Best is trial 286 with value: -4.973512667829732.
[I 2026-07-14 22:13:15,127] Trial 319 finished with value: -1.3489728399410423 and parameters: {'scalers': 'robust', 'ratios': 'log_ratio', 'imputers': 'median', 'n_estimators': 2700, 'learning_rate': 0.0003823997805160739, 'max_depth': 11, 'min_child_weight': 1, 'subsample': 0.8, 'colsample_bytree': 0.8, 'colsample_bylevel': 0.9, 'reg_alpha': 0.0009771891372748873, 'reg_lambda': 60.08963999142116, 'gamma': 1.1140970292636106e-05}. Best is trial 286 with value: -4.973512667829732.
