[I 2026-07-14 19:57:04,901] Trial 315 finished with value: -0.6923502957098067 and parameters: {'scalers': 'standard', 'ratios': 'norm_ratio', 'imputers': 'median', 'n_estimators': 1400, 'learning_rate': 0.39214358524176807, 'max_depth': 12, 'min_child_weight': 1, 'subsample': 0.6, 'colsample_bytree': 0.6, 'colsample_bylevel': 1.0, 'reg_alpha': 0.08667364458511691, 'reg_lambda': 93.5748411587589, 'gamma': 0.0012644216147119768}. Best is trial 306 with value: -1.1987573770827704.
[I 2026-07-14 19:57:51,428] Trial 316 finished with value: -0.4882851764882198 and parameters: {'scalers': 'standard', 'ratios': 'norm_ratio', 'imputers': 'median', 'n_estimators': 1400, 'learning_rate': 0.38018387034144946, 'max_depth': 12, 'min_child_weight': 1, 'subsample': 0.7, 'colsample_bytree': 0.6, 'colsample_bylevel': 1.0, 'reg_alpha': 0.13231898735656278, 'reg_lambda': 90.94882916287894, 'gamma': 0.0015695076723648948}. Best is trial 306 with value: -1.1987573770827704.
[I 2026-07-14 19:58:40,582] Trial 317 finished with value: -0.4812518436671572 and parameters: {'scalers': 'standard', 'ratios': 'norm_ratio', 'imputers': 'median', 'n_estimators': 1550, 'learning_rate': 0.39805810290562366, 'max_depth': 12, 'min_child_weight': 1, 'subsample': 0.8, 'colsample_bytree': 0.6, 'colsample_bylevel': 1.0, 'reg_alpha': 0.13133487758905496, 'reg_lambda': 70.94375507190128, 'gamma': 0.0014670992299793564}. Best is trial 306 with value: -1.1987573770827704.
[I 2026-07-14 19:59:30,753] Trial 318 finished with value: -0.45936238119142325 and parameters: {'scalers': 'standard', 'ratios': 'norm_ratio', 'imputers': 'median', 'n_estimators': 1550, 'learning_rate': 0.38472733940347736, 'max_depth': 12, 'min_child_weight': 1, 'subsample': 0.8, 'colsample_bytree': 0.6, 'colsample_bylevel': 1.0, 'reg_alpha': 0.027033717576165017, 'reg_lambda': 90.4149906273354, 'gamma': 0.0020726886215405404}. Best is trial 306 with value: -1.1987573770827704.
[I 2026-07-14 20:00:09,034] Trial 319 finished with value: -0.3546919186180584 and parameters: {'scalers': 'standard', 'ratios': 'norm_ratio', 'imputers': 'median', 'n_estimators': 1200, 'learning_rate': 0.38393666019905504, 'max_depth': 12, 'min_child_weight': 1, 'subsample': 0.8, 'colsample_bytree': 0.6, 'colsample_bylevel': 1.0, 'reg_alpha': 0.07361305135838353, 'reg_lambda': 90.92740304841851, 'gamma': 0.006573773299296932}. Best is trial 306 with value: -1.1987573770827704.
