[I 2026-07-14 20:05:49,645] Trial 135 finished with value: -0.2501322677914982 and parameters: {'scalers': 'none', 'ratios': 'log_ratio', 'imputers': 'none', 'n_estimators': 2900, 'learning_rate': 0.4126156293903685, 'max_depth': 12, 'min_child_weight': 1, 'subsample': 0.7, 'colsample_bytree': 0.7, 'colsample_bylevel': 0.5, 'reg_alpha': 2.0614790262218445, 'reg_lambda': 11.659111588914323, 'gamma': 1.0112266242026922e-06}. Best is trial 122 with value: -0.3173209406195531.
[I 2026-07-14 20:05:52,824] Trial 136 finished with value: -0.03255441628154455 and parameters: {'scalers': 'none', 'ratios': 'log_ratio', 'imputers': 'none', 'n_estimators': 2900, 'learning_rate': 0.22526066246363025, 'max_depth': 12, 'min_child_weight': 1, 'subsample': 0.7, 'colsample_bytree': 0.7, 'colsample_bylevel': 0.7, 'reg_alpha': 68.11771318961443, 'reg_lambda': 2.093185949775837, 'gamma': 0.000499066834519556}. Best is trial 122 with value: -0.3173209406195531.
[I 2026-07-14 20:06:07,671] Trial 137 finished with value: -0.21011397209411123 and parameters: {'scalers': 'none', 'ratios': 'log_ratio', 'imputers': 'none', 'n_estimators': 2900, 'learning_rate': 0.4231393095935231, 'max_depth': 12, 'min_child_weight': 1, 'subsample': 0.7, 'colsample_bytree': 0.7, 'colsample_bylevel': 0.5, 'reg_alpha': 3.141323666763002, 'reg_lambda': 12.834070955714221, 'gamma': 0.0003326803137238537}. Best is trial 122 with value: -0.3173209406195531.
[I 2026-07-14 20:06:27,997] Trial 138 finished with value: -0.2154836872548832 and parameters: {'scalers': 'none', 'ratios': 'log_ratio', 'imputers': 'none', 'n_estimators': 3000, 'learning_rate': 0.4035044651414943, 'max_depth': 12, 'min_child_weight': 1, 'subsample': 0.7, 'colsample_bytree': 0.7, 'colsample_bylevel': 0.6, 'reg_alpha': 2.7121362899481745, 'reg_lambda': 2.1276678631370642, 'gamma': 1.0292705278997476e-06}. Best is trial 122 with value: -0.3173209406195531.
[I 2026-07-14 20:06:55,735] Trial 139 finished with value: -0.19915011026001417 and parameters: {'scalers': 'none', 'ratios': 'log_ratio', 'imputers': 'none', 'n_estimators': 3000, 'learning_rate': 0.40202785094466387, 'max_depth': 12, 'min_child_weight': 1, 'subsample': 0.7, 'colsample_bytree': 0.7, 'colsample_bylevel': 0.6, 'reg_alpha': 0.04700046597243054, 'reg_lambda': 2.0321854986205543, 'gamma': 1.0638892592678667e-06}. Best is trial 122 with value: -0.3173209406195531.
[I 2026-07-14 20:06:59,102] Trial 140 finished with value: -0.027897415243036027 and parameters: {'scalers': 'none', 'ratios': 'log_ratio', 'imputers': 'none', 'n_estimators': 3000, 'learning_rate': 0.4039990045554947, 'max_depth': 10, 'min_child_weight': 1, 'subsample': 0.7, 'colsample_bytree': 0.7, 'colsample_bylevel': 0.6, 'reg_alpha': 19.961286579096335, 'reg_lambda': 2.2720173090603923, 'gamma': 1.0426807685091573e-06}. Best is trial 122 with value: -0.3173209406195531.
[I 2026-07-14 20:07:26,608] Trial 141 finished with value: -0.23731054869323698 and parameters: {'scalers': 'none', 'ratios': 'log_ratio', 'imputers': 'none', 'n_estimators': 2900, 'learning_rate': 0.41637588597868996, 'max_depth': 10, 'min_child_weight': 1, 'subsample': 0.7, 'colsample_bytree': 0.7, 'colsample_bylevel': 0.6, 'reg_alpha': 0.1602447562318148, 'reg_lambda': 13.187990376967631, 'gamma': 0.00043296765840388125}. Best is trial 122 with value: -0.3173209406195531.
[I 2026-07-14 20:07:45,076] Trial 142 finished with value: -0.1825797779567116 and parameters: {'scalers': 'none', 'ratios': 'log_ratio', 'imputers': 'none', 'n_estimators': 3000, 'learning_rate': 0.40510227038371804, 'max_depth': 10, 'min_child_weight': 1, 'subsample': 0.7, 'colsample_bytree': 0.7, 'colsample_bylevel': 0.5, 'reg_alpha': 0.04518317258246102, 'reg_lambda': 2.1280746038610117, 'gamma': 0.00032803775215188216}. Best is trial 122 with value: -0.3173209406195531.
[I 2026-07-14 20:08:02,564] Trial 143 finished with value: -0.2056096238549893 and parameters: {'scalers': 'none', 'ratios': 'log_ratio', 'imputers': 'none', 'n_estimators': 3000, 'learning_rate': 0.38730072291240925, 'max_depth': 10, 'min_child_weight': 1, 'subsample': 0.7, 'colsample_bytree': 0.7, 'colsample_bylevel': 0.5, 'reg_alpha': 2.2029367898286814, 'reg_lambda': 8.161640634543343, 'gamma': 0.0004842782411333254}. Best is trial 122 with value: -0.3173209406195531.
[I 2026-07-14 20:08:28,423] Trial 144 finished with value: -0.24855146732149994 and parameters: {'scalers': 'none', 'ratios': 'log_ratio', 'imputers': 'median', 'n_estimators': 2950, 'learning_rate': 0.4157731861043632, 'max_depth': 10, 'min_child_weight': 1, 'subsample': 0.7, 'colsample_bytree': 0.7, 'colsample_bylevel': 0.5, 'reg_alpha': 0.9049485963845335, 'reg_lambda': 8.18258768512559, 'gamma': 0.0003239488651617044}. Best is trial 122 with value: -0.3173209406195531.
[I 2026-07-14 20:08:47,898] Trial 145 finished with value: -0.22618739388116393 and parameters: {'scalers': 'none', 'ratios': 'log_ratio', 'imputers': 'median', 'n_estimators': 3000, 'learning_rate': 0.41045476513333395, 'max_depth': 10, 'min_child_weight': 1, 'subsample': 0.7, 'colsample_bytree': 0.7, 'colsample_bylevel': 0.5, 'reg_alpha': 1.9023054622094844, 'reg_lambda': 9.238075342805326, 'gamma': 5.13159218888495e-05}. Best is trial 122 with value: -0.3173209406195531.
[I 2026-07-14 20:09:03,554] Trial 146 finished with value: -0.17938036554048958 and parameters: {'scalers': 'none', 'ratios': 'log_ratio', 'imputers': 'median', 'n_estimators': 3000, 'learning_rate': 0.3984987710591695, 'max_depth': 10, 'min_child_weight': 1, 'subsample': 0.7, 'colsample_bytree': 0.7, 'colsample_bylevel': 0.5, 'reg_alpha': 2.626408585289867, 'reg_lambda': 4.885037998765717, 'gamma': 0.0008182010891770909}. Best is trial 122 with value: -0.3173209406195531.
[I 2026-07-14 20:09:27,290] Trial 147 finished with value: -0.264442614625318 and parameters: {'scalers': 'none', 'ratios': 'log_ratio', 'imputers': 'median', 'n_estimators': 3000, 'learning_rate': 0.4320397861761637, 'max_depth': 12, 'min_child_weight': 1, 'subsample': 0.7, 'colsample_bytree': 0.7, 'colsample_bylevel': 0.5, 'reg_alpha': 1.7482449768923405, 'reg_lambda': 4.612352970242023, 'gamma': 0.0003354510910905194}. Best is trial 122 with value: -0.3173209406195531.
[I 2026-07-14 20:09:47,894] Trial 148 finished with value: -0.3062706900571268 and parameters: {'scalers': 'none', 'ratios': 'log_ratio', 'imputers': 'median', 'n_estimators': 3000, 'learning_rate': 0.49712059048272983, 'max_depth': 11, 'min_child_weight': 1, 'subsample': 0.7, 'colsample_bytree': 0.7, 'colsample_bylevel': 0.5, 'reg_alpha': 2.1833818075620695, 'reg_lambda': 4.545441757741801, 'gamma': 0.00020324620819715073}. Best is trial 122 with value: -0.3173209406195531.
[I 2026-07-14 20:10:10,884] Trial 149 finished with value: -0.30303600955636206 and parameters: {'scalers': 'none', 'ratios': 'log_ratio', 'imputers': 'median', 'n_estimators': 3000, 'learning_rate': 0.4920775674227169, 'max_depth': 10, 'min_child_weight': 1, 'subsample': 0.7, 'colsample_bytree': 0.7, 'colsample_bylevel': 0.5, 'reg_alpha': 1.6778997045613548, 'reg_lambda': 4.436961117186256, 'gamma': 0.0002451456947422218}. Best is trial 122 with value: -0.3173209406195531.
[I 2026-07-14 20:10:33,820] Trial 150 finished with value: -0.2835210916723265 and parameters: {'scalers': 'none', 'ratios': 'log_ratio', 'imputers': 'none', 'n_estimators': 3000, 'learning_rate': 0.4793392298744158, 'max_depth': 9, 'min_child_weight': 1, 'subsample': 0.7, 'colsample_bytree': 0.7, 'colsample_bylevel': 0.5, 'reg_alpha': 1.0639327894162687, 'reg_lambda': 8.953659553813475, 'gamma': 0.0002708952148277072}. Best is trial 122 with value: -0.3173209406195531.
[I 2026-07-14 20:10:58,244] Trial 151 finished with value: -0.32779777873876004 and parameters: {'scalers': 'none', 'ratios': 'log_ratio', 'imputers': 'none', 'n_estimators': 3000, 'learning_rate': 0.49090850953226256, 'max_depth': 10, 'min_child_weight': 1, 'subsample': 0.7, 'colsample_bytree': 0.7, 'colsample_bylevel': 0.5, 'reg_alpha': 1.4298572736459931, 'reg_lambda': 8.695569272299686, 'gamma': 0.00028603916185938893}. Best is trial 151 with value: -0.32779777873876004.
[I 2026-07-14 20:11:17,983] Trial 152 finished with value: -0.27075283014190926 and parameters: {'scalers': 'none', 'ratios': 'log_ratio', 'imputers': 'median', 'n_estimators': 2950, 'learning_rate': 0.48087239148663674, 'max_depth': 9, 'min_child_weight': 1, 'subsample': 0.7, 'colsample_bytree': 0.7, 'colsample_bylevel': 0.5, 'reg_alpha': 1.708582907958898, 'reg_lambda': 8.477411740369538, 'gamma': 0.0002189920664888181}. Best is trial 151 with value: -0.32779777873876004.
[I 2026-07-14 20:11:39,935] Trial 153 finished with value: -0.16769161562921553 and parameters: {'scalers': 'none', 'ratios': 'log_ratio', 'imputers': 'median', 'n_estimators': 2900, 'learning_rate': 0.49628749729746136, 'max_depth': 10, 'min_child_weight': 2, 'subsample': 0.7, 'colsample_bytree': 0.7, 'colsample_bylevel': 0.5, 'reg_alpha': 1.2194849593409294, 'reg_lambda': 4.458408355022723, 'gamma': 0.00018543129271117188}. Best is trial 151 with value: -0.32779777873876004.
[I 2026-07-14 20:12:01,982] Trial 154 finished with value: -0.17637256435814247 and parameters: {'scalers': 'none', 'ratios': 'log_ratio', 'imputers': 'median', 'n_estimators': 2900, 'learning_rate': 0.49247851954983707, 'max_depth': 10, 'min_child_weight': 2, 'subsample': 0.7, 'colsample_bytree': 0.7, 'colsample_bylevel': 0.5, 'reg_alpha': 1.0903134606194624, 'reg_lambda': 9.563797187297544, 'gamma': 0.00022713901032686632}. Best is trial 151 with value: -0.32779777873876004.
[I 2026-07-14 20:12:23,014] Trial 155 finished with value: -0.16316169732543243 and parameters: {'scalers': 'none', 'ratios': 'log_ratio', 'imputers': 'median', 'n_estimators': 2950, 'learning_rate': 0.48336526823780196, 'max_depth': 9, 'min_child_weight': 2, 'subsample': 0.7, 'colsample_bytree': 0.7, 'colsample_bylevel': 0.5, 'reg_alpha': 0.6246027762107668, 'reg_lambda': 9.09020588866372, 'gamma': 0.00020992950466655364}. Best is trial 151 with value: -0.32779777873876004.
[I 2026-07-14 20:12:42,812] Trial 156 finished with value: -0.17021123776044167 and parameters: {'scalers': 'none', 'ratios': 'log_ratio', 'imputers': 'median', 'n_estimators': 2950, 'learning_rate': 0.49157904038361966, 'max_depth': 9, 'min_child_weight': 2, 'subsample': 0.7, 'colsample_bytree': 0.7, 'colsample_bylevel': 0.5, 'reg_alpha': 1.2682466591025647, 'reg_lambda': 9.140212366736403, 'gamma': 0.0002424122101248548}. Best is trial 151 with value: -0.32779777873876004.
[I 2026-07-14 20:13:03,405] Trial 157 finished with value: -0.15903452443219926 and parameters: {'scalers': 'none', 'ratios': 'log_ratio', 'imputers': 'median', 'n_estimators': 2950, 'learning_rate': 0.49422422759120094, 'max_depth': 9, 'min_child_weight': 2, 'subsample': 0.8, 'colsample_bytree': 0.7, 'colsample_bylevel': 0.5, 'reg_alpha': 1.3354645543511285, 'reg_lambda': 9.506864749858003, 'gamma': 0.00021789203412621855}. Best is trial 151 with value: -0.32779777873876004.
[I 2026-07-14 20:13:25,805] Trial 158 finished with value: -0.2901901597253654 and parameters: {'scalers': 'none', 'ratios': 'log_ratio', 'imputers': 'median', 'n_estimators': 2950, 'learning_rate': 0.4921251533623226, 'max_depth': 9, 'min_child_weight': 1, 'subsample': 0.7, 'colsample_bytree': 0.7, 'colsample_bylevel': 0.5, 'reg_alpha': 1.0273046956937033, 'reg_lambda': 9.200418379824859, 'gamma': 0.00022684927767695236}. Best is trial 151 with value: -0.32779777873876004.
[I 2026-07-14 20:13:46,856] Trial 159 finished with value: -0.27984608399452815 and parameters: {'scalers': 'none', 'ratios': 'log_ratio', 'imputers': 'median', 'n_estimators': 2950, 'learning_rate': 0.483735713104467, 'max_depth': 9, 'min_child_weight': 1, 'subsample': 0.7, 'colsample_bytree': 0.7, 'colsample_bylevel': 0.5, 'reg_alpha': 1.5482556712195648, 'reg_lambda': 4.091421232499752, 'gamma': 0.0002259896983450956}. Best is trial 151 with value: -0.32779777873876004.
[I 2026-07-14 20:14:07,025] Trial 160 finished with value: -0.17037829916485123 and parameters: {'scalers': 'none', 'ratios': 'log_ratio', 'imputers': 'median', 'n_estimators': 2950, 'learning_rate': 0.4973523770188719, 'max_depth': 9, 'min_child_weight': 2, 'subsample': 0.7, 'colsample_bytree': 0.7, 'colsample_bylevel': 0.5, 'reg_alpha': 1.3032903580605941, 'reg_lambda': 4.462595473647241, 'gamma': 0.0002134269024167537}. Best is trial 151 with value: -0.32779777873876004.
[I 2026-07-14 20:14:27,066] Trial 161 finished with value: -0.26882362851365926 and parameters: {'scalers': 'none', 'ratios': 'log_ratio', 'imputers': 'median', 'n_estimators': 2950, 'learning_rate': 0.47768369624128765, 'max_depth': 9, 'min_child_weight': 1, 'subsample': 0.7, 'colsample_bytree': 0.7, 'colsample_bylevel': 0.5, 'reg_alpha': 1.6737757209098978, 'reg_lambda': 9.234019712056515, 'gamma': 0.00023013436881177374}. Best is trial 151 with value: -0.32779777873876004.
[I 2026-07-14 20:14:50,473] Trial 162 finished with value: -0.2870031771457827 and parameters: {'scalers': 'none', 'ratios': 'log_ratio', 'imputers': 'median', 'n_estimators': 2950, 'learning_rate': 0.4748493322825581, 'max_depth': 9, 'min_child_weight': 1, 'subsample': 0.7, 'colsample_bytree': 0.7, 'colsample_bylevel': 0.5, 'reg_alpha': 0.7552083431085688, 'reg_lambda': 8.934713647972938, 'gamma': 0.0002616251872591422}. Best is trial 151 with value: -0.32779777873876004.
[I 2026-07-14 20:15:10,605] Trial 163 finished with value: -0.2781555506939197 and parameters: {'scalers': 'none', 'ratios': 'log_ratio', 'imputers': 'median', 'n_estimators': 2950, 'learning_rate': 0.49702131169401254, 'max_depth': 9, 'min_child_weight': 1, 'subsample': 0.7, 'colsample_bytree': 0.7, 'colsample_bylevel': 0.5, 'reg_alpha': 1.7544304610844867, 'reg_lambda': 4.22016476060381, 'gamma': 0.0001299879874902823}. Best is trial 151 with value: -0.32779777873876004.
[I 2026-07-14 20:15:29,226] Trial 164 finished with value: -0.18774352191429322 and parameters: {'scalers': 'none', 'ratios': 'log_ratio', 'imputers': 'median', 'n_estimators': 2850, 'learning_rate': 0.3274720934470974, 'max_depth': 9, 'min_child_weight': 1, 'subsample': 0.7, 'colsample_bytree': 0.7, 'colsample_bylevel': 0.5, 'reg_alpha': 1.5620263189666101, 'reg_lambda': 4.088374422680496, 'gamma': 0.0006762177171790758}. Best is trial 151 with value: -0.32779777873876004.
[I 2026-07-14 20:15:45,629] Trial 165 finished with value: -0.16769975266312273 and parameters: {'scalers': 'none', 'ratios': 'log_ratio', 'imputers': 'median', 'n_estimators': 2850, 'learning_rate': 0.3093336810599612, 'max_depth': 9, 'min_child_weight': 1, 'subsample': 0.7, 'colsample_bytree': 0.7, 'colsample_bylevel': 0.5, 'reg_alpha': 1.848475805203536, 'reg_lambda': 4.36788106109495, 'gamma': 0.0007251908017509432}. Best is trial 151 with value: -0.32779777873876004.
[I 2026-07-14 20:16:01,952] Trial 166 finished with value: -0.169339625651419 and parameters: {'scalers': 'none', 'ratios': 'log_ratio', 'imputers': 'median', 'n_estimators': 2850, 'learning_rate': 0.3126805921927317, 'max_depth': 9, 'min_child_weight': 1, 'subsample': 0.7, 'colsample_bytree': 0.7, 'colsample_bylevel': 0.5, 'reg_alpha': 1.893292442315703, 'reg_lambda': 4.094915448050525, 'gamma': 0.0007227483472352787}. Best is trial 151 with value: -0.32779777873876004.
[I 2026-07-14 20:16:22,567] Trial 167 finished with value: -0.18591192879379687 and parameters: {'scalers': 'none', 'ratios': 'log_ratio', 'imputers': 'median', 'n_estimators': 2850, 'learning_rate': 0.3183623039734143, 'max_depth': 9, 'min_child_weight': 1, 'subsample': 0.7, 'colsample_bytree': 0.7, 'colsample_bylevel': 0.5, 'reg_alpha': 0.6545701396667796, 'reg_lambda': 3.826297926998179, 'gamma': 0.0006045773979609044}. Best is trial 151 with value: -0.32779777873876004.
[I 2026-07-14 20:16:38,264] Trial 168 finished with value: -0.15780636583120844 and parameters: {'scalers': 'none', 'ratios': 'log_ratio', 'imputers': 'median', 'n_estimators': 2850, 'learning_rate': 0.3039408239164801, 'max_depth': 9, 'min_child_weight': 1, 'subsample': 0.7, 'colsample_bytree': 0.7, 'colsample_bylevel': 0.5, 'reg_alpha': 1.9084381670870965, 'reg_lambda': 12.380977859254644, 'gamma': 0.0006447379173272952}. Best is trial 151 with value: -0.32779777873876004.
[I 2026-07-14 20:16:59,193] Trial 169 finished with value: -0.19267454612299106 and parameters: {'scalers': 'none', 'ratios': 'log_ratio', 'imputers': 'median', 'n_estimators': 2850, 'learning_rate': 0.30624545187009694, 'max_depth': 9, 'min_child_weight': 1, 'subsample': 0.7, 'colsample_bytree': 0.7, 'colsample_bylevel': 0.5, 'reg_alpha': 0.7637090860854505, 'reg_lambda': 13.034373673189188, 'gamma': 0.0006620382058078737}. Best is trial 151 with value: -0.32779777873876004.
[I 2026-07-14 20:17:19,909] Trial 170 finished with value: -0.1876575554457726 and parameters: {'scalers': 'none', 'ratios': 'log_ratio', 'imputers': 'median', 'n_estimators': 2850, 'learning_rate': 0.2990511911345243, 'max_depth': 9, 'min_child_weight': 1, 'subsample': 0.7, 'colsample_bytree': 0.7, 'colsample_bylevel': 0.5, 'reg_alpha': 0.6940194966475347, 'reg_lambda': 13.467559170665188, 'gamma': 0.0007430001197183449}. Best is trial 151 with value: -0.32779777873876004.
[I 2026-07-14 20:17:40,847] Trial 171 finished with value: -0.18542209630683565 and parameters: {'scalers': 'none', 'ratios': 'log_ratio', 'imputers': 'median', 'n_estimators': 2850, 'learning_rate': 0.2908041196775532, 'max_depth': 9, 'min_child_weight': 1, 'subsample': 0.7, 'colsample_bytree': 0.7, 'colsample_bylevel': 0.5, 'reg_alpha': 0.7897033760666443, 'reg_lambda': 13.971928248179346, 'gamma': 0.0006468808118478778}. Best is trial 151 with value: -0.32779777873876004.
[I 2026-07-14 20:18:01,434] Trial 172 finished with value: -0.186646888123097 and parameters: {'scalers': 'none', 'ratios': 'log_ratio', 'imputers': 'median', 'n_estimators': 2850, 'learning_rate': 0.3071261159241492, 'max_depth': 9, 'min_child_weight': 1, 'subsample': 0.7, 'colsample_bytree': 0.7, 'colsample_bylevel': 0.5, 'reg_alpha': 0.7947154035189908, 'reg_lambda': 13.756899091381227, 'gamma': 0.001443746528800503}. Best is trial 151 with value: -0.32779777873876004.
[I 2026-07-14 20:18:22,566] Trial 173 finished with value: -0.21378743923877855 and parameters: {'scalers': 'none', 'ratios': 'log_ratio', 'imputers': 'median', 'n_estimators': 2850, 'learning_rate': 0.3433369628554339, 'max_depth': 9, 'min_child_weight': 1, 'subsample': 0.7, 'colsample_bytree': 0.7, 'colsample_bylevel': 0.5, 'reg_alpha': 0.7067828752840773, 'reg_lambda': 14.136984739104896, 'gamma': 0.0001002552941705718}. Best is trial 151 with value: -0.32779777873876004.
[I 2026-07-14 20:18:40,366] Trial 174 finished with value: -0.17992410562069377 and parameters: {'scalers': 'none', 'ratios': 'log_ratio', 'imputers': 'median', 'n_estimators': 2850, 'learning_rate': 0.3430554794777923, 'max_depth': 8, 'min_child_weight': 1, 'subsample': 0.7, 'colsample_bytree': 0.7, 'colsample_bylevel': 0.5, 'reg_alpha': 0.7868670576025865, 'reg_lambda': 14.301644733224034, 'gamma': 0.0017420502981524034}. Best is trial 151 with value: -0.32779777873876004.
[I 2026-07-14 20:18:57,794] Trial 175 finished with value: -0.15949743314214732 and parameters: {'scalers': 'none', 'ratios': 'log_ratio', 'imputers': 'median', 'n_estimators': 2900, 'learning_rate': 0.24516246651669488, 'max_depth': 8, 'min_child_weight': 1, 'subsample': 0.7, 'colsample_bytree': 0.7, 'colsample_bylevel': 0.5, 'reg_alpha': 0.8648298985925872, 'reg_lambda': 12.712538759996905, 'gamma': 0.00011522115505457239}. Best is trial 151 with value: -0.32779777873876004.
[I 2026-07-14 20:19:18,157] Trial 176 finished with value: -0.17445520520319102 and parameters: {'scalers': 'none', 'ratios': 'log_ratio', 'imputers': 'median', 'n_estimators': 3000, 'learning_rate': 0.24189333776393995, 'max_depth': 9, 'min_child_weight': 1, 'subsample': 0.7, 'colsample_bytree': 0.7, 'colsample_bylevel': 0.5, 'reg_alpha': 0.8099945109254282, 'reg_lambda': 16.54387356549825, 'gamma': 0.00011407925893739684}. Best is trial 151 with value: -0.32779777873876004.
[I 2026-07-14 20:19:24,559] Trial 177 finished with value: -0.1088975701279955 and parameters: {'scalers': 'none', 'ratios': 'log_ratio', 'imputers': 'median', 'n_estimators': 3000, 'learning_rate': 0.4972051103948338, 'max_depth': 8, 'min_child_weight': 1, 'subsample': 0.7, 'colsample_bytree': 0.7, 'colsample_bylevel': 0.5, 'reg_alpha': 4.042448204249634, 'reg_lambda': 0.8838297908360766, 'gamma': 0.001489984974943687}. Best is trial 151 with value: -0.32779777873876004.
[I 2026-07-14 20:19:35,847] Trial 178 finished with value: -0.10203909601624808 and parameters: {'scalers': 'none', 'ratios': 'log_ratio', 'imputers': 'median', 'n_estimators': 3000, 'learning_rate': 0.4448276882216567, 'max_depth': 8, 'min_child_weight': 1, 'subsample': 0.7, 'colsample_bytree': 0.7, 'colsample_bylevel': 0.5, 'reg_alpha': 4.071688713394044, 'reg_lambda': 2.7666075637574483, 'gamma': 0.00011191352951051192}. Best is trial 151 with value: -0.32779777873876004.
[I 2026-07-14 20:19:55,144] Trial 179 finished with value: -0.22286343553093924 and parameters: {'scalers': 'none', 'ratios': 'log_ratio', 'imputers': 'median', 'n_estimators': 3000, 'learning_rate': 0.43799953712703926, 'max_depth': 8, 'min_child_weight': 1, 'subsample': 0.7, 'colsample_bytree': 0.7, 'colsample_bylevel': 0.5, 'reg_alpha': 0.9437584447939605, 'reg_lambda': 2.707374761511049, 'gamma': 0.0015263670779228327}. Best is trial 151 with value: -0.32779777873876004.
