[I 2026-07-14 16:39:24,516] Trial 90 finished with value: -0.3294643006079573 and parameters: {'scalers': 'none', 'ratios': 'norm_ratio', 'imputers': 'mean', 'n_estimators': 100, 'learning_rate': 0.00046239817105451375, 'max_depth': 8, 'min_child_weight': 10, 'subsample': 0.9, 'colsample_bytree': 0.5, 'colsample_bylevel': 1.0, 'reg_alpha': 34.87946509462062, 'reg_lambda': 7.978848224285846e-06, 'gamma': 4.7597216318845816e-05}. Best is trial 75 with value: -0.3333648405007181.
[I 2026-07-14 16:39:24,980] Trial 91 finished with value: -0.3288045023094621 and parameters: {'scalers': 'standard', 'ratios': 'norm_ratio', 'imputers': 'none', 'n_estimators': 100, 'learning_rate': 0.000460110512327548, 'max_depth': 8, 'min_child_weight': 10, 'subsample': 0.8, 'colsample_bytree': 0.5, 'colsample_bylevel': 1.0, 'reg_alpha': 0.0003465163065999928, 'reg_lambda': 8.363333817995872e-06, 'gamma': 1.268153696918738}. Best is trial 75 with value: -0.3333648405007181.
[I 2026-07-14 16:39:41,433] Trial 92 finished with value: -0.30472854232471536 and parameters: {'scalers': 'standard', 'ratios': 'norm_ratio', 'imputers': 'none', 'n_estimators': 1650, 'learning_rate': 0.0001661309291626078, 'max_depth': 8, 'min_child_weight': 10, 'subsample': 0.9, 'colsample_bytree': 0.5, 'colsample_bylevel': 1.0, 'reg_alpha': 0.0005874595146729367, 'reg_lambda': 1.503015438400519e-05, 'gamma': 0.0302985228249533}. Best is trial 75 with value: -0.3333648405007181.
[I 2026-07-14 16:39:44,632] Trial 93 finished with value: -0.3226183412867557 and parameters: {'scalers': 'standard', 'ratios': 'norm_ratio', 'imputers': 'none', 'n_estimators': 650, 'learning_rate': 0.00016410532563798644, 'max_depth': 8, 'min_child_weight': 10, 'subsample': 0.9, 'colsample_bytree': 0.5, 'colsample_bylevel': 1.0, 'reg_alpha': 0.0006790660892901508, 'reg_lambda': 7.61093856928874e-06, 'gamma': 1.315256538021651}. Best is trial 75 with value: -0.3333648405007181.
[I 2026-07-14 16:39:45,368] Trial 94 finished with value: -0.3300591768578437 and parameters: {'scalers': 'standard', 'ratios': 'norm_ratio', 'imputers': 'none', 'n_estimators': 300, 'learning_rate': 0.00016096475978297307, 'max_depth': 8, 'min_child_weight': 10, 'subsample': 0.9, 'colsample_bytree': 0.5, 'colsample_bylevel': 1.0, 'reg_alpha': 0.00040742988522863465, 'reg_lambda': 8.75169087012703e-06, 'gamma': 10.68923053903723}. Best is trial 75 with value: -0.3333648405007181.
[I 2026-07-14 16:39:46,863] Trial 95 finished with value: -0.3249385079279124 and parameters: {'scalers': 'standard', 'ratios': 'norm_ratio', 'imputers': 'none', 'n_estimators': 650, 'learning_rate': 0.00016526599932554538, 'max_depth': 8, 'min_child_weight': 10, 'subsample': 0.9, 'colsample_bytree': 0.5, 'colsample_bylevel': 1.0, 'reg_alpha': 0.00023191180800336588, 'reg_lambda': 7.81819400125056e-06, 'gamma': 11.886291125472953}. Best is trial 75 with value: -0.3333648405007181.
[I 2026-07-14 16:39:48,233] Trial 96 finished with value: -0.3288663961318603 and parameters: {'scalers': 'standard', 'ratios': 'norm_ratio', 'imputers': 'none', 'n_estimators': 300, 'learning_rate': 0.00016372174194959334, 'max_depth': 8, 'min_child_weight': 10, 'subsample': 0.9, 'colsample_bytree': 0.5, 'colsample_bylevel': 1.0, 'reg_alpha': 0.0004448772029107706, 'reg_lambda': 1.1836428856177524e-05, 'gamma': 1.5755691731820989}. Best is trial 75 with value: -0.3333648405007181.
[I 2026-07-14 16:39:52,239] Trial 97 finished with value: -0.3110385075860433 and parameters: {'scalers': 'standard', 'ratios': 'norm_ratio', 'imputers': 'none', 'n_estimators': 1650, 'learning_rate': 0.00016369147130510832, 'max_depth': 8, 'min_child_weight': 10, 'subsample': 1.0, 'colsample_bytree': 0.5, 'colsample_bylevel': 1.0, 'reg_alpha': 0.00039693191814673057, 'reg_lambda': 8.731504286137566e-06, 'gamma': 10.66141816715792}. Best is trial 75 with value: -0.3333648405007181.
[I 2026-07-14 16:39:53,042] Trial 98 finished with value: -0.3295513221369821 and parameters: {'scalers': 'standard', 'ratios': 'norm_ratio', 'imputers': 'none', 'n_estimators': 300, 'learning_rate': 0.0001670500591726358, 'max_depth': 8, 'min_child_weight': 10, 'subsample': 1.0, 'colsample_bytree': 0.5, 'colsample_bylevel': 1.0, 'reg_alpha': 0.0005206629212030823, 'reg_lambda': 3.105706119402222e-06, 'gamma': 8.314115074706338}. Best is trial 75 with value: -0.3333648405007181.
[I 2026-07-14 16:39:53,726] Trial 99 finished with value: -0.33052271123724036 and parameters: {'scalers': 'standard', 'ratios': 'norm_ratio', 'imputers': 'none', 'n_estimators': 300, 'learning_rate': 0.00015779020283194982, 'max_depth': 7, 'min_child_weight': 10, 'subsample': 1.0, 'colsample_bytree': 0.5, 'colsample_bylevel': 0.9, 'reg_alpha': 8.75526145929972e-05, 'reg_lambda': 0.0007374546867493179, 'gamma': 13.390455490472732}. Best is trial 75 with value: -0.3333648405007181.
[I 2026-07-14 16:39:54,339] Trial 100 finished with value: -0.33223446974400833 and parameters: {'scalers': 'standard', 'ratios': 'norm_ratio', 'imputers': 'none', 'n_estimators': 300, 'learning_rate': 0.00017467862891602285, 'max_depth': 7, 'min_child_weight': 10, 'subsample': 1.0, 'colsample_bytree': 0.5, 'colsample_bylevel': 0.9, 'reg_alpha': 0.00022300648246773749, 'reg_lambda': 0.0007702170257626597, 'gamma': 81.81449374230131}. Best is trial 75 with value: -0.3333648405007181.
[I 2026-07-14 16:39:55,071] Trial 101 finished with value: -0.32865532018099114 and parameters: {'scalers': 'standard', 'ratios': 'norm_ratio', 'imputers': 'none', 'n_estimators': 300, 'learning_rate': 0.00022457112701068226, 'max_depth': 7, 'min_child_weight': 10, 'subsample': 1.0, 'colsample_bytree': 0.5, 'colsample_bylevel': 0.9, 'reg_alpha': 0.00020216912449159497, 'reg_lambda': 0.0008706542780872759, 'gamma': 8.926251933405666}. Best is trial 75 with value: -0.3333648405007181.
[I 2026-07-14 16:39:57,245] Trial 102 finished with value: -0.326665743820205 and parameters: {'scalers': 'none', 'ratios': 'norm_ratio', 'imputers': 'none', 'n_estimators': 300, 'learning_rate': 0.0002234255858652807, 'max_depth': 7, 'min_child_weight': 10, 'subsample': 1.0, 'colsample_bytree': 0.5, 'colsample_bylevel': 0.9, 'reg_alpha': 0.00010822107834222815, 'reg_lambda': 3.3518247667817797e-06, 'gamma': 0.12237519085308561}. Best is trial 75 with value: -0.3333648405007181.
[I 2026-07-14 16:39:58,038] Trial 103 finished with value: -0.3292422595999585 and parameters: {'scalers': 'none', 'ratios': 'norm_ratio', 'imputers': 'none', 'n_estimators': 300, 'learning_rate': 0.00019463983857235376, 'max_depth': 7, 'min_child_weight': 10, 'subsample': 1.0, 'colsample_bytree': 0.5, 'colsample_bylevel': 0.9, 'reg_alpha': 9.939011633322452e-05, 'reg_lambda': 4.2298788218346985e-06, 'gamma': 7.365629428113478}. Best is trial 75 with value: -0.3333648405007181.
[I 2026-07-14 16:40:00,879] Trial 104 finished with value: -0.32412544181520486 and parameters: {'scalers': 'none', 'ratios': 'norm_ratio', 'imputers': 'mean', 'n_estimators': 400, 'learning_rate': 0.00022484085995878397, 'max_depth': 7, 'min_child_weight': 10, 'subsample': 1.0, 'colsample_bytree': 0.5, 'colsample_bylevel': 0.9, 'reg_alpha': 3.6826406888893593e-05, 'reg_lambda': 0.0009160704217634032, 'gamma': 0.11729997898958211}. Best is trial 75 with value: -0.3333648405007181.
[I 2026-07-14 16:40:03,520] Trial 105 finished with value: -0.32347244642016304 and parameters: {'scalers': 'none', 'ratios': 'norm_ratio', 'imputers': 'mean', 'n_estimators': 400, 'learning_rate': 0.00023904941288707787, 'max_depth': 7, 'min_child_weight': 10, 'subsample': 1.0, 'colsample_bytree': 0.5, 'colsample_bylevel': 0.9, 'reg_alpha': 0.000107710699173998, 'reg_lambda': 12.904940579846036, 'gamma': 0.11098518338068374}. Best is trial 75 with value: -0.3333648405007181.
[I 2026-07-14 16:40:03,976] Trial 106 finished with value: -0.3309752684653764 and parameters: {'scalers': 'none', 'ratios': 'norm_ratio', 'imputers': 'mean', 'n_estimators': 150, 'learning_rate': 0.00024021289868513912, 'max_depth': 7, 'min_child_weight': 10, 'subsample': 0.9, 'colsample_bytree': 0.5, 'colsample_bylevel': 0.9, 'reg_alpha': 4.92417950981653e-05, 'reg_lambda': 0.0011142120809518163, 'gamma': 5.779298152534976}. Best is trial 75 with value: -0.3333648405007181.
[I 2026-07-14 16:40:09,796] Trial 107 finished with value: -0.32466282132332097 and parameters: {'scalers': 'none', 'ratios': 'norm_ratio', 'imputers': 'mean', 'n_estimators': 400, 'learning_rate': 0.00021635575433429072, 'max_depth': 9, 'min_child_weight': 2, 'subsample': 0.9, 'colsample_bytree': 0.5, 'colsample_bylevel': 0.9, 'reg_alpha': 2.831401154599284e-05, 'reg_lambda': 3.92668808935503e-05, 'gamma': 0.11211004583029571}. Best is trial 75 with value: -0.3333648405007181.
[I 2026-07-14 16:40:10,083] Trial 108 finished with value: -0.3331332374869721 and parameters: {'scalers': 'none', 'ratios': 'norm_ratio', 'imputers': 'mean', 'n_estimators': 150, 'learning_rate': 0.00021636121586827026, 'max_depth': 7, 'min_child_weight': 10, 'subsample': 1.0, 'colsample_bytree': 0.5, 'colsample_bylevel': 0.9, 'reg_alpha': 0.001024950156050863, 'reg_lambda': 20.34139702401696, 'gamma': 48.7716464222527}. Best is trial 75 with value: -0.3333648405007181.
[I 2026-07-14 16:40:10,383] Trial 109 finished with value: -0.33317096076229324 and parameters: {'scalers': 'none', 'ratios': 'norm_ratio', 'imputers': 'mean', 'n_estimators': 150, 'learning_rate': 0.00021110917489244036, 'max_depth': 7, 'min_child_weight': 10, 'subsample': 0.8, 'colsample_bytree': 0.5, 'colsample_bylevel': 0.9, 'reg_alpha': 8.96397695449853e-05, 'reg_lambda': 17.788589560849445, 'gamma': 99.21976195179803}. Best is trial 75 with value: -0.3333648405007181.
[I 2026-07-14 16:40:11,723] Trial 110 finished with value: -0.3304413325830187 and parameters: {'scalers': 'none', 'ratios': 'norm_ratio', 'imputers': 'mean', 'n_estimators': 150, 'learning_rate': 0.00022144296767677156, 'max_depth': 7, 'min_child_weight': 2, 'subsample': 0.8, 'colsample_bytree': 0.5, 'colsample_bylevel': 0.9, 'reg_alpha': 3.913487285817501e-05, 'reg_lambda': 13.811239607195153, 'gamma': 0.03033203367437623}. Best is trial 75 with value: -0.3333648405007181.
[I 2026-07-14 16:40:12,048] Trial 111 finished with value: -0.3324339179362173 and parameters: {'scalers': 'none', 'ratios': 'norm_ratio', 'imputers': 'mean', 'n_estimators': 150, 'learning_rate': 0.0003045187492740631, 'max_depth': 9, 'min_child_weight': 2, 'subsample': 0.8, 'colsample_bytree': 0.5, 'colsample_bylevel': 0.9, 'reg_alpha': 0.0009748342313370854, 'reg_lambda': 4.1287008229715425e-05, 'gamma': 31.364068298296306}. Best is trial 75 with value: -0.3333648405007181.
[I 2026-07-14 16:40:12,372] Trial 112 finished with value: -0.3305374186050188 and parameters: {'scalers': 'none', 'ratios': 'norm_ratio', 'imputers': 'mean', 'n_estimators': 150, 'learning_rate': 0.0006880963483752176, 'max_depth': 9, 'min_child_weight': 9, 'subsample': 0.8, 'colsample_bytree': 0.5, 'colsample_bylevel': 0.9, 'reg_alpha': 23.91117000063907, 'reg_lambda': 0.00026947870751260766, 'gamma': 23.820326060396972}. Best is trial 75 with value: -0.3333648405007181.
[I 2026-07-14 16:40:12,635] Trial 113 finished with value: -0.3326439267727074 and parameters: {'scalers': 'none', 'ratios': 'norm_ratio', 'imputers': 'mean', 'n_estimators': 150, 'learning_rate': 0.00030447713549848867, 'max_depth': 9, 'min_child_weight': 9, 'subsample': 0.8, 'colsample_bytree': 0.5, 'colsample_bylevel': 0.9, 'reg_alpha': 0.0008629778110453025, 'reg_lambda': 3.788678072838739e-05, 'gamma': 46.560568482886005}. Best is trial 75 with value: -0.3333648405007181.
[I 2026-07-14 16:40:13,023] Trial 114 finished with value: -0.3312975788417349 and parameters: {'scalers': 'none', 'ratios': 'norm_ratio', 'imputers': 'mean', 'n_estimators': 150, 'learning_rate': 0.0003026981185162182, 'max_depth': 9, 'min_child_weight': 9, 'subsample': 0.8, 'colsample_bytree': 0.5, 'colsample_bylevel': 0.9, 'reg_alpha': 0.0009486450603087027, 'reg_lambda': 0.0002542364395145255, 'gamma': 21.215204424690352}. Best is trial 75 with value: -0.3333648405007181.
[I 2026-07-14 16:40:14,038] Trial 115 finished with value: -0.3236607191637599 and parameters: {'scalers': 'standard', 'ratios': 'norm_ratio', 'imputers': 'mean', 'n_estimators': 150, 'learning_rate': 0.0006508005998326813, 'max_depth': 9, 'min_child_weight': 9, 'subsample': 0.8, 'colsample_bytree': 0.5, 'colsample_bylevel': 0.9, 'reg_alpha': 0.0010863478227424274, 'reg_lambda': 0.00023431554962116593, 'gamma': 0.43551516000641777}. Best is trial 75 with value: -0.3333648405007181.
[I 2026-07-14 16:40:14,403] Trial 116 finished with value: -0.33212935947151556 and parameters: {'scalers': 'standard', 'ratios': 'norm_ratio', 'imputers': 'mean', 'n_estimators': 150, 'learning_rate': 0.0003057661303142957, 'max_depth': 6, 'min_child_weight': 9, 'subsample': 0.8, 'colsample_bytree': 0.6, 'colsample_bylevel': 0.9, 'reg_alpha': 0.0013593996166097189, 'reg_lambda': 1.7554277300947762e-06, 'gamma': 80.075819262473}. Best is trial 75 with value: -0.3333648405007181.
[I 2026-07-14 16:40:14,731] Trial 117 finished with value: -0.33136669456731155 and parameters: {'scalers': 'none', 'ratios': 'norm_ratio', 'imputers': 'mean', 'n_estimators': 150, 'learning_rate': 0.0004513659894646989, 'max_depth': 6, 'min_child_weight': 9, 'subsample': 0.8, 'colsample_bytree': 0.6, 'colsample_bylevel': 0.8, 'reg_alpha': 0.0010969721610506876, 'reg_lambda': 30.890474790267913, 'gamma': 40.45342942065545}. Best is trial 75 with value: -0.3333648405007181.
[I 2026-07-14 16:40:15,102] Trial 118 finished with value: -0.33160482115690565 and parameters: {'scalers': 'none', 'ratios': 'norm_ratio', 'imputers': 'mean', 'n_estimators': 150, 'learning_rate': 0.0003204708745323251, 'max_depth': 6, 'min_child_weight': 9, 'subsample': 0.8, 'colsample_bytree': 0.5, 'colsample_bylevel': 0.9, 'reg_alpha': 1.330106174913072e-05, 'reg_lambda': 56.2431445082871, 'gamma': 17.42313204320831}. Best is trial 75 with value: -0.3333648405007181.
[I 2026-07-14 16:40:15,307] Trial 119 finished with value: -0.33263306254547254 and parameters: {'scalers': 'none', 'ratios': 'norm_ratio', 'imputers': 'mean', 'n_estimators': 150, 'learning_rate': 0.00030642478315567927, 'max_depth': 6, 'min_child_weight': 9, 'subsample': 0.8, 'colsample_bytree': 0.5, 'colsample_bylevel': 0.9, 'reg_alpha': 0.009316020968845297, 'reg_lambda': 5.862504291067188, 'gamma': 35.66146664943883}. Best is trial 75 with value: -0.3333648405007181.
[I 2026-07-14 16:40:15,676] Trial 120 finished with value: -0.3315320992383657 and parameters: {'scalers': 'none', 'ratios': 'norm_ratio', 'imputers': 'mean', 'n_estimators': 150, 'learning_rate': 0.00042600030641552533, 'max_depth': 6, 'min_child_weight': 1, 'subsample': 0.8, 'colsample_bytree': 0.6, 'colsample_bylevel': 0.8, 'reg_alpha': 0.0010772644838488005, 'reg_lambda': 90.08928456108669, 'gamma': 54.14041414645548}. Best is trial 75 with value: -0.3333648405007181.
[I 2026-07-14 16:40:16,124] Trial 121 finished with value: -0.3304447829943001 and parameters: {'scalers': 'none', 'ratios': 'norm_ratio', 'imputers': 'mean', 'n_estimators': 250, 'learning_rate': 0.0003027400399358416, 'max_depth': 9, 'min_child_weight': 1, 'subsample': 0.8, 'colsample_bytree': 0.6, 'colsample_bylevel': 0.9, 'reg_alpha': 0.0011193808325314822, 'reg_lambda': 99.0836158097161, 'gamma': 41.76542144564055}. Best is trial 75 with value: -0.3333648405007181.
[I 2026-07-14 16:40:16,578] Trial 122 finished with value: -0.3280955132350007 and parameters: {'scalers': 'none', 'ratios': 'norm_ratio', 'imputers': 'mean', 'n_estimators': 250, 'learning_rate': 0.0004950934735603739, 'max_depth': 6, 'min_child_weight': 1, 'subsample': 0.8, 'colsample_bytree': 0.6, 'colsample_bylevel': 0.9, 'reg_alpha': 1.4753220352166944e-05, 'reg_lambda': 35.761768163177024, 'gamma': 42.66645159686187}. Best is trial 75 with value: -0.3333648405007181.
[I 2026-07-14 16:40:17,100] Trial 123 finished with value: -0.32965807442347334 and parameters: {'scalers': 'none', 'ratios': 'norm_ratio', 'imputers': 'mean', 'n_estimators': 250, 'learning_rate': 0.0004391843507457753, 'max_depth': 6, 'min_child_weight': 3, 'subsample': 0.8, 'colsample_bytree': 0.6, 'colsample_bylevel': 0.8, 'reg_alpha': 8.800659160055769e-06, 'reg_lambda': 31.7017670316883, 'gamma': 41.871064933124764}. Best is trial 75 with value: -0.3333648405007181.
[I 2026-07-14 16:40:17,567] Trial 124 finished with value: -0.333183591934053 and parameters: {'scalers': 'none', 'ratios': 'norm_ratio', 'imputers': 'mean', 'n_estimators': 250, 'learning_rate': 0.00012156255204509685, 'max_depth': 6, 'min_child_weight': 1, 'subsample': 0.8, 'colsample_bytree': 0.5, 'colsample_bylevel': 0.8, 'reg_alpha': 0.009442629395089632, 'reg_lambda': 50.471052439297736, 'gamma': 47.3702720138445}. Best is trial 75 with value: -0.3333648405007181.
[I 2026-07-14 16:40:18,039] Trial 125 finished with value: -0.32891376760519375 and parameters: {'scalers': 'none', 'ratios': 'norm_ratio', 'imputers': 'mean', 'n_estimators': 250, 'learning_rate': 0.0005227506290929421, 'max_depth': 9, 'min_child_weight': 1, 'subsample': 0.8, 'colsample_bytree': 0.5, 'colsample_bylevel': 0.9, 'reg_alpha': 0.00209931402913483, 'reg_lambda': 2.972896031119317e-05, 'gamma': 51.403694972877055}. Best is trial 75 with value: -0.3333648405007181.
[I 2026-07-14 16:40:18,537] Trial 126 finished with value: -0.3306320726831907 and parameters: {'scalers': 'none', 'ratios': 'norm_ratio', 'imputers': 'mean', 'n_estimators': 250, 'learning_rate': 0.00039009267928084737, 'max_depth': 9, 'min_child_weight': 10, 'subsample': 0.8, 'colsample_bytree': 0.5, 'colsample_bylevel': 0.8, 'reg_alpha': 0.002671527930128457, 'reg_lambda': 4.817009407200906, 'gamma': 45.35076454090523}. Best is trial 75 with value: -0.3333648405007181.
[I 2026-07-14 16:40:18,987] Trial 127 finished with value: -0.3294402815093912 and parameters: {'scalers': 'none', 'ratios': 'norm_ratio', 'imputers': 'mean', 'n_estimators': 250, 'learning_rate': 0.000520391444589687, 'max_depth': 6, 'min_child_weight': 9, 'subsample': 0.8, 'colsample_bytree': 0.5, 'colsample_bylevel': 0.8, 'reg_alpha': 0.002688736617067881, 'reg_lambda': 11.311534380143597, 'gamma': 57.61543041021894}. Best is trial 75 with value: -0.3333648405007181.
[I 2026-07-14 16:40:19,454] Trial 128 finished with value: -0.3287478583439397 and parameters: {'scalers': 'none', 'ratios': 'norm_ratio', 'imputers': 'mean', 'n_estimators': 250, 'learning_rate': 0.0005405853876005826, 'max_depth': 9, 'min_child_weight': 9, 'subsample': 0.8, 'colsample_bytree': 0.5, 'colsample_bylevel': 0.9, 'reg_alpha': 0.0027285303124204244, 'reg_lambda': 5.373706246983528, 'gamma': 35.6413471958669}. Best is trial 75 with value: -0.3333648405007181.
[I 2026-07-14 16:40:19,957] Trial 129 finished with value: -0.33021981148097596 and parameters: {'scalers': 'none', 'ratios': 'norm_ratio', 'imputers': 'mean', 'n_estimators': 250, 'learning_rate': 0.0003938435930876792, 'max_depth': 10, 'min_child_weight': 9, 'subsample': 0.8, 'colsample_bytree': 0.5, 'colsample_bylevel': 0.9, 'reg_alpha': 0.0032386709950619256, 'reg_lambda': 2.6325703947718557e-05, 'gamma': 36.379063696078155}. Best is trial 75 with value: -0.3333648405007181.
[I 2026-07-14 16:40:20,434] Trial 130 finished with value: -0.3328382669169006 and parameters: {'scalers': 'none', 'ratios': 'norm_ratio', 'imputers': 'mean', 'n_estimators': 250, 'learning_rate': 0.00013638451331368244, 'max_depth': 10, 'min_child_weight': 3, 'subsample': 0.8, 'colsample_bytree': 0.5, 'colsample_bylevel': 0.9, 'reg_alpha': 0.0023199863043496852, 'reg_lambda': 12.238691895506236, 'gamma': 31.59718360537023}. Best is trial 75 with value: -0.3333648405007181.
[I 2026-07-14 16:40:20,805] Trial 131 finished with value: -0.3332839498124782 and parameters: {'scalers': 'none', 'ratios': 'norm_ratio', 'imputers': 'mean', 'n_estimators': 200, 'learning_rate': 0.00012756361504711287, 'max_depth': 10, 'min_child_weight': 3, 'subsample': 0.8, 'colsample_bytree': 0.5, 'colsample_bylevel': 0.9, 'reg_alpha': 0.0029936031391025225, 'reg_lambda': 5.34784707163614, 'gamma': 32.60156462271764}. Best is trial 75 with value: -0.3333648405007181.
[I 2026-07-14 16:40:21,241] Trial 132 finished with value: -0.33324713327825417 and parameters: {'scalers': 'none', 'ratios': 'norm_ratio', 'imputers': 'mean', 'n_estimators': 200, 'learning_rate': 0.00013716905326232982, 'max_depth': 7, 'min_child_weight': 9, 'subsample': 0.8, 'colsample_bytree': 0.5, 'colsample_bylevel': 0.8, 'reg_alpha': 0.0030776816722023173, 'reg_lambda': 20.63647746039047, 'gamma': 60.80249061600496}. Best is trial 75 with value: -0.3333648405007181.
[I 2026-07-14 16:40:21,630] Trial 133 finished with value: -0.3333556193528014 and parameters: {'scalers': 'none', 'ratios': 'norm_ratio', 'imputers': 'mean', 'n_estimators': 200, 'learning_rate': 0.00012383714238958855, 'max_depth': 7, 'min_child_weight': 3, 'subsample': 0.9, 'colsample_bytree': 0.5, 'colsample_bylevel': 0.8, 'reg_alpha': 0.009282188730067179, 'reg_lambda': 6.023696725702249, 'gamma': 99.94809255023402}. Best is trial 75 with value: -0.3333648405007181.
[I 2026-07-14 16:40:22,255] Trial 134 finished with value: -0.20874888474754275 and parameters: {'scalers': 'none', 'ratios': 'norm_ratio', 'imputers': 'mean', 'n_estimators': 350, 'learning_rate': 0.03998277572025354, 'max_depth': 7, 'min_child_weight': 9, 'subsample': 0.7, 'colsample_bytree': 0.5, 'colsample_bylevel': 0.9, 'reg_alpha': 0.010677230589769798, 'reg_lambda': 13.74213247592034, 'gamma': 5.362668375416736}. Best is trial 75 with value: -0.3333648405007181.
