[I 2026-07-14 17:41:57,788] Trial 179 finished with value: -0.4316677779137093 and parameters: {'scalers': 'robust', 'ratios': 'norm_ratio', 'imputers': 'mean', 'n_estimators': 2000, 'learning_rate': 0.23128336897642668, 'max_depth': 11, 'min_child_weight': 1, 'subsample': 0.5, 'colsample_bytree': 0.9, 'colsample_bylevel': 0.6, 'reg_alpha': 1.1469548143063542, 'reg_lambda': 0.00040639067102603765, 'gamma': 2.4761496496080447e-05}. Best is trial 117 with value: -0.6588856402745613.
[I 2026-07-14 17:42:58,513] Trial 181 finished with value: -0.4327440134310946 and parameters: {'scalers': 'robust', 'ratios': 'norm_ratio', 'imputers': 'mean', 'n_estimators': 2650, 'learning_rate': 0.24784849239527273, 'max_depth': 11, 'min_child_weight': 1, 'subsample': 0.5, 'colsample_bytree': 0.9, 'colsample_bylevel': 0.6, 'reg_alpha': 0.5463191047427621, 'reg_lambda': 0.0005361304134690573, 'gamma': 3.3305688708216576e-05}. Best is trial 117 with value: -0.6588856402745613.
[I 2026-07-14 17:43:50,512] Trial 182 finished with value: -0.4480893310539974 and parameters: {'scalers': 'robust', 'ratios': 'norm_ratio', 'imputers': 'mean', 'n_estimators': 2150, 'learning_rate': 0.23999920524095178, 'max_depth': 11, 'min_child_weight': 1, 'subsample': 0.5, 'colsample_bytree': 0.9, 'colsample_bylevel': 0.6, 'reg_alpha': 1.2062787549249, 'reg_lambda': 0.00011727614960269012, 'gamma': 4.859589648896073e-06}. Best is trial 117 with value: -0.6588856402745613.
[I 2026-07-14 17:44:52,169] Trial 183 finished with value: -0.17819550366292553 and parameters: {'scalers': 'robust', 'ratios': 'norm_ratio', 'imputers': 'mean', 'n_estimators': 2600, 'learning_rate': 0.0012407919257270443, 'max_depth': 11, 'min_child_weight': 1, 'subsample': 0.5, 'colsample_bytree': 0.9, 'colsample_bylevel': 0.6, 'reg_alpha': 0.5831198813297126, 'reg_lambda': 1.7755023113964847e-06, 'gamma': 3.154814796560315e-05}. Best is trial 117 with value: -0.6588856402745613.
[I 2026-07-14 17:45:35,038] Trial 184 finished with value: -0.17505433265223297 and parameters: {'scalers': 'robust', 'ratios': 'norm_ratio', 'imputers': 'mean', 'n_estimators': 2500, 'learning_rate': 0.0024967464066218874, 'max_depth': 11, 'min_child_weight': 1, 'subsample': 0.5, 'colsample_bytree': 0.9, 'colsample_bylevel': 0.6, 'reg_alpha': 2.6890033224548064, 'reg_lambda': 0.00010386367605844161, 'gamma': 4.9062836134948855e-06}. Best is trial 117 with value: -0.6588856402745613.
[I 2026-07-14 17:46:23,156] Trial 185 finished with value: -0.6308036387336261 and parameters: {'scalers': 'robust', 'ratios': 'norm_ratio', 'imputers': 'mean', 'n_estimators': 2650, 'learning_rate': 0.41405519882466363, 'max_depth': 11, 'min_child_weight': 1, 'subsample': 0.5, 'colsample_bytree': 0.9, 'colsample_bylevel': 0.6, 'reg_alpha': 3.2930271887779172, 'reg_lambda': 0.0004628478852335245, 'gamma': 4.751492978620984e-06}. Best is trial 117 with value: -0.6588856402745613.
[I 2026-07-14 17:47:04,806] Trial 186 finished with value: -0.17317480400785562 and parameters: {'scalers': 'robust', 'ratios': 'norm_ratio', 'imputers': 'mean', 'n_estimators': 2500, 'learning_rate': 0.002145655441540702, 'max_depth': 11, 'min_child_weight': 1, 'subsample': 0.5, 'colsample_bytree': 0.9, 'colsample_bylevel': 0.6, 'reg_alpha': 2.7799192736597336, 'reg_lambda': 2.1504362763803835e-06, 'gamma': 4.6454395440063535e-06}. Best is trial 117 with value: -0.6588856402745613.
[I 2026-07-14 17:47:49,123] Trial 187 finished with value: -0.17505301011443591 and parameters: {'scalers': 'robust', 'ratios': 'norm_ratio', 'imputers': 'mean', 'n_estimators': 2600, 'learning_rate': 0.00235449374454818, 'max_depth': 11, 'min_child_weight': 1, 'subsample': 0.5, 'colsample_bytree': 0.9, 'colsample_bylevel': 0.6, 'reg_alpha': 2.695617965123585, 'reg_lambda': 0.00010862956746065413, 'gamma': 5.2868942002562235e-06}. Best is trial 117 with value: -0.6588856402745613.
[I 2026-07-14 17:48:30,542] Trial 188 finished with value: -0.5365037495129944 and parameters: {'scalers': 'robust', 'ratios': 'norm_ratio', 'imputers': 'mean', 'n_estimators': 2500, 'learning_rate': 0.40454881143625837, 'max_depth': 10, 'min_child_weight': 1, 'subsample': 0.5, 'colsample_bytree': 0.9, 'colsample_bylevel': 0.6, 'reg_alpha': 3.0698267119552294, 'reg_lambda': 9.472337216118338e-05, 'gamma': 3.426237500889725e-05}. Best is trial 117 with value: -0.6588856402745613.
[I 2026-07-14 17:49:15,875] Trial 189 finished with value: -0.6206681698648066 and parameters: {'scalers': 'robust', 'ratios': 'norm_ratio', 'imputers': 'mean', 'n_estimators': 2100, 'learning_rate': 0.4095216261082185, 'max_depth': 10, 'min_child_weight': 1, 'subsample': 0.5, 'colsample_bytree': 0.9, 'colsample_bylevel': 0.6, 'reg_alpha': 1.5538700253507827, 'reg_lambda': 0.00011210336610330733, 'gamma': 5.35336567751602e-06}. Best is trial 117 with value: -0.6588856402745613.
[I 2026-07-14 17:49:42,454] Trial 190 finished with value: -0.6406934479719723 and parameters: {'scalers': 'robust', 'ratios': 'norm_ratio', 'imputers': 'mean', 'n_estimators': 2100, 'learning_rate': 0.40737043660003414, 'max_depth': 10, 'min_child_weight': 1, 'subsample': 0.5, 'colsample_bytree': 0.5, 'colsample_bylevel': 0.6, 'reg_alpha': 2.22703770094453, 'reg_lambda': 2.0041176142590283e-06, 'gamma': 9.266745967133885e-06}. Best is trial 117 with value: -0.6588856402745613.
[I 2026-07-14 17:50:27,146] Trial 191 finished with value: -0.5596203032650027 and parameters: {'scalers': 'robust', 'ratios': 'norm_ratio', 'imputers': 'mean', 'n_estimators': 2500, 'learning_rate': 0.3951629679750285, 'max_depth': 10, 'min_child_weight': 1, 'subsample': 0.5, 'colsample_bytree': 0.9, 'colsample_bylevel': 0.6, 'reg_alpha': 2.6939740677627437, 'reg_lambda': 6.694544605312211e-05, 'gamma': 9.423551698628624e-06}. Best is trial 117 with value: -0.6588856402745613.
[I 2026-07-14 17:51:08,817] Trial 192 finished with value: -0.6134626732748489 and parameters: {'scalers': 'robust', 'ratios': 'norm_ratio', 'imputers': 'mean', 'n_estimators': 2150, 'learning_rate': 0.4124074513467611, 'max_depth': 10, 'min_child_weight': 1, 'subsample': 0.5, 'colsample_bytree': 0.9, 'colsample_bylevel': 0.6, 'reg_alpha': 2.2734542170676955, 'reg_lambda': 7.475351562612007e-05, 'gamma': 9.656462267844756e-06}. Best is trial 117 with value: -0.6588856402745613.
[I 2026-07-14 17:51:40,717] Trial 193 finished with value: -0.46849298130153066 and parameters: {'scalers': 'robust', 'ratios': 'norm_ratio', 'imputers': 'mean', 'n_estimators': 2100, 'learning_rate': 0.40530909500601964, 'max_depth': 10, 'min_child_weight': 1, 'subsample': 0.5, 'colsample_bytree': 0.9, 'colsample_bylevel': 0.6, 'reg_alpha': 3.7054096575632904, 'reg_lambda': 8.22786739132285e-05, 'gamma': 8.944145049148802e-06}. Best is trial 117 with value: -0.6588856402745613.
[I 2026-07-14 17:52:22,157] Trial 194 finished with value: -0.43329083377507877 and parameters: {'scalers': 'robust', 'ratios': 'norm_ratio', 'imputers': 'mean', 'n_estimators': 2650, 'learning_rate': 0.3990540133592684, 'max_depth': 10, 'min_child_weight': 1, 'subsample': 0.5, 'colsample_bytree': 0.9, 'colsample_bylevel': 0.6, 'reg_alpha': 0.19211415976206994, 'reg_lambda': 0.0001781536832853484, 'gamma': 9.061336706231654e-06}. Best is trial 117 with value: -0.6588856402745613.
[I 2026-07-14 17:52:51,637] Trial 195 finished with value: -0.6827835618492663 and parameters: {'scalers': 'robust', 'ratios': 'norm_ratio', 'imputers': 'mean', 'n_estimators': 2100, 'learning_rate': 0.41550942600022467, 'max_depth': 10, 'min_child_weight': 1, 'subsample': 0.5, 'colsample_bytree': 0.5, 'colsample_bylevel': 0.6, 'reg_alpha': 1.756165838531994, 'reg_lambda': 0.0001768073554108802, 'gamma': 1.0291219536156974e-05}. Best is trial 195 with value: -0.6827835618492663.
[I 2026-07-14 17:53:25,395] Trial 196 finished with value: -0.4602745321481721 and parameters: {'scalers': 'robust', 'ratios': 'norm_ratio', 'imputers': 'mean', 'n_estimators': 2400, 'learning_rate': 0.4221487171908614, 'max_depth': 10, 'min_child_weight': 1, 'subsample': 0.5, 'colsample_bytree': 0.9, 'colsample_bylevel': 0.6, 'reg_alpha': 4.260543886468306, 'reg_lambda': 0.0001653759991916006, 'gamma': 9.40181084934539e-06}. Best is trial 195 with value: -0.6827835618492663.
[I 2026-07-14 17:54:04,931] Trial 197 finished with value: -0.49674828605713073 and parameters: {'scalers': 'robust', 'ratios': 'norm_ratio', 'imputers': 'mean', 'n_estimators': 2650, 'learning_rate': 0.4223895150813575, 'max_depth': 10, 'min_child_weight': 1, 'subsample': 0.5, 'colsample_bytree': 0.9, 'colsample_bylevel': 0.6, 'reg_alpha': 3.990026710851313, 'reg_lambda': 0.00013726044331946994, 'gamma': 2.6294287989744803e-06}. Best is trial 195 with value: -0.6827835618492663.
[I 2026-07-14 17:54:28,553] Trial 198 finished with value: -0.49156851321411543 and parameters: {'scalers': 'robust', 'ratios': 'norm_ratio', 'imputers': 'mean', 'n_estimators': 2650, 'learning_rate': 0.4193510178689195, 'max_depth': 10, 'min_child_weight': 1, 'subsample': 0.5, 'colsample_bytree': 0.5, 'colsample_bylevel': 0.6, 'reg_alpha': 4.440453090502596, 'reg_lambda': 8.055892478038821e-05, 'gamma': 9.233147682121496e-06}. Best is trial 195 with value: -0.6827835618492663.
[I 2026-07-14 17:55:04,425] Trial 199 finished with value: -0.4606689454953563 and parameters: {'scalers': 'robust', 'ratios': 'norm_ratio', 'imputers': 'mean', 'n_estimators': 2550, 'learning_rate': 0.4152263819692342, 'max_depth': 10, 'min_child_weight': 1, 'subsample': 0.5, 'colsample_bytree': 0.9, 'colsample_bylevel': 0.6, 'reg_alpha': 4.29727381795559, 'reg_lambda': 0.0001892692347700028, 'gamma': 8.643047041026305e-06}. Best is trial 195 with value: -0.6827835618492663.
[I 2026-07-14 17:55:30,533] Trial 200 finished with value: -0.6068757880494436 and parameters: {'scalers': 'robust', 'ratios': 'norm_ratio', 'imputers': 'mean', 'n_estimators': 2500, 'learning_rate': 0.43257567601350516, 'max_depth': 10, 'min_child_weight': 1, 'subsample': 0.5, 'colsample_bytree': 0.5, 'colsample_bylevel': 0.6, 'reg_alpha': 3.431750181389976, 'reg_lambda': 7.594466625013753e-05, 'gamma': 4.023131967331733e-06}. Best is trial 195 with value: -0.6827835618492663.
[I 2026-07-14 17:55:54,071] Trial 201 finished with value: -0.5374642204912374 and parameters: {'scalers': 'robust', 'ratios': 'norm_ratio', 'imputers': 'mean', 'n_estimators': 2400, 'learning_rate': 0.41689724132000816, 'max_depth': 10, 'min_child_weight': 1, 'subsample': 0.5, 'colsample_bytree': 0.5, 'colsample_bylevel': 0.6, 'reg_alpha': 3.624528945731065, 'reg_lambda': 0.00017944261378161105, 'gamma': 2.53635783038744e-06}. Best is trial 195 with value: -0.6827835618492663.
[I 2026-07-14 17:56:11,776] Trial 202 finished with value: -0.4376016104671844 and parameters: {'scalers': 'robust', 'ratios': 'norm_ratio', 'imputers': 'mean', 'n_estimators': 2500, 'learning_rate': 0.4194905651958554, 'max_depth': 10, 'min_child_weight': 1, 'subsample': 0.5, 'colsample_bytree': 0.5, 'colsample_bylevel': 0.6, 'reg_alpha': 5.013695014231184, 'reg_lambda': 6.209586977304786e-05, 'gamma': 2.6957866644008867e-06}. Best is trial 195 with value: -0.6827835618492663.
[I 2026-07-14 17:56:36,207] Trial 203 finished with value: -0.5548859757013658 and parameters: {'scalers': 'robust', 'ratios': 'norm_ratio', 'imputers': 'mean', 'n_estimators': 2500, 'learning_rate': 0.42290671652674133, 'max_depth': 10, 'min_child_weight': 1, 'subsample': 0.5, 'colsample_bytree': 0.5, 'colsample_bylevel': 0.6, 'reg_alpha': 3.645815337513553, 'reg_lambda': 7.31096207173259e-05, 'gamma': 2.691402527607015e-06}. Best is trial 195 with value: -0.6827835618492663.
[I 2026-07-14 17:57:09,216] Trial 204 finished with value: -0.7822264657152813 and parameters: {'scalers': 'robust', 'ratios': 'norm_ratio', 'imputers': 'mean', 'n_estimators': 2550, 'learning_rate': 0.4384222397724363, 'max_depth': 10, 'min_child_weight': 1, 'subsample': 0.5, 'colsample_bytree': 0.5, 'colsample_bylevel': 0.6, 'reg_alpha': 2.0538891425417636, 'reg_lambda': 8.035683378214173e-05, 'gamma': 2.0774504483992594e-06}. Best is trial 204 with value: -0.7822264657152813.
[I 2026-07-14 17:57:33,083] Trial 205 finished with value: -0.5324643077163693 and parameters: {'scalers': 'robust', 'ratios': 'norm_ratio', 'imputers': 'mean', 'n_estimators': 2500, 'learning_rate': 0.43009649808133293, 'max_depth': 10, 'min_child_weight': 1, 'subsample': 0.5, 'colsample_bytree': 0.5, 'colsample_bylevel': 0.6, 'reg_alpha': 3.844383753924019, 'reg_lambda': 6.115130810138915e-05, 'gamma': 2.5799741040203037e-06}. Best is trial 204 with value: -0.7822264657152813.
[I 2026-07-14 17:58:22,650] Trial 206 finished with value: -0.4602693010533693 and parameters: {'scalers': 'robust', 'ratios': 'norm_ratio', 'imputers': 'mean', 'n_estimators': 2500, 'learning_rate': 0.2853337608014679, 'max_depth': 10, 'min_child_weight': 1, 'subsample': 0.5, 'colsample_bytree': 0.9, 'colsample_bylevel': 0.6, 'reg_alpha': 1.9091139478554384, 'reg_lambda': 0.00018034270394405697, 'gamma': 2.538254949290479e-06}. Best is trial 204 with value: -0.7822264657152813.
[I 2026-07-14 17:58:55,412] Trial 207 finished with value: -1.153987212305631 and parameters: {'scalers': 'robust', 'ratios': 'norm_ratio', 'imputers': 'mean', 'n_estimators': 2500, 'learning_rate': 0.4976711996978742, 'max_depth': 10, 'min_child_weight': 1, 'subsample': 0.5, 'colsample_bytree': 0.5, 'colsample_bylevel': 0.6, 'reg_alpha': 2.020216229225, 'reg_lambda': 6.310649365102236e-05, 'gamma': 2.550928078515513e-06}. Best is trial 207 with value: -1.153987212305631.
[I 2026-07-14 17:59:27,867] Trial 208 finished with value: -1.1371134975201644 and parameters: {'scalers': 'robust', 'ratios': 'norm_ratio', 'imputers': 'mean', 'n_estimators': 2500, 'learning_rate': 0.49116488974683803, 'max_depth': 10, 'min_child_weight': 1, 'subsample': 0.5, 'colsample_bytree': 0.5, 'colsample_bylevel': 0.6, 'reg_alpha': 2.150373292887167, 'reg_lambda': 6.6983039269874e-05, 'gamma': 2.2544726771195956e-06}. Best is trial 207 with value: -1.153987212305631.
[I 2026-07-14 18:00:00,272] Trial 209 finished with value: -1.081054745410909 and parameters: {'scalers': 'robust', 'ratios': 'norm_ratio', 'imputers': 'mean', 'n_estimators': 2500, 'learning_rate': 0.4908917663387055, 'max_depth': 10, 'min_child_weight': 1, 'subsample': 0.5, 'colsample_bytree': 0.5, 'colsample_bylevel': 0.6, 'reg_alpha': 2.201578456581039, 'reg_lambda': 6.115141598002142e-05, 'gamma': 1.4940751065628232e-06}. Best is trial 207 with value: -1.153987212305631.
[I 2026-07-14 18:00:31,665] Trial 210 finished with value: -1.0097190229319881 and parameters: {'scalers': 'robust', 'ratios': 'norm_ratio', 'imputers': 'mean', 'n_estimators': 2400, 'learning_rate': 0.48513742457500764, 'max_depth': 10, 'min_child_weight': 1, 'subsample': 0.5, 'colsample_bytree': 0.5, 'colsample_bylevel': 0.6, 'reg_alpha': 2.109456779864144, 'reg_lambda': 8.237366701084995e-05, 'gamma': 1.7107522513225915e-06}. Best is trial 207 with value: -1.153987212305631.
[I 2026-07-14 18:01:05,995] Trial 211 finished with value: -1.1212143966402397 and parameters: {'scalers': 'robust', 'ratios': 'norm_ratio', 'imputers': 'mean', 'n_estimators': 2500, 'learning_rate': 0.49602253505038857, 'max_depth': 10, 'min_child_weight': 1, 'subsample': 0.5, 'colsample_bytree': 0.5, 'colsample_bylevel': 0.6, 'reg_alpha': 1.9708554370231393, 'reg_lambda': 6.846751340282718e-05, 'gamma': 1.5790500336662426e-06}. Best is trial 207 with value: -1.153987212305631.
[I 2026-07-14 18:01:37,992] Trial 212 finished with value: -1.162187748754269 and parameters: {'scalers': 'robust', 'ratios': 'norm_ratio', 'imputers': 'mean', 'n_estimators': 2500, 'learning_rate': 0.49185691152901545, 'max_depth': 10, 'min_child_weight': 1, 'subsample': 0.5, 'colsample_bytree': 0.5, 'colsample_bylevel': 0.6, 'reg_alpha': 2.3264955296237666, 'reg_lambda': 8.334132710824388e-05, 'gamma': 2.1145170984106647e-06}. Best is trial 212 with value: -1.162187748754269.
[I 2026-07-14 18:02:10,370] Trial 213 finished with value: -0.9888250910603815 and parameters: {'scalers': 'robust', 'ratios': 'norm_ratio', 'imputers': 'mean', 'n_estimators': 2500, 'learning_rate': 0.47566822476826986, 'max_depth': 10, 'min_child_weight': 1, 'subsample': 0.5, 'colsample_bytree': 0.5, 'colsample_bylevel': 0.6, 'reg_alpha': 2.1240340424638737, 'reg_lambda': 6.310835655344056e-05, 'gamma': 1.7666837723502034e-06}. Best is trial 212 with value: -1.162187748754269.
[I 2026-07-14 18:02:38,923] Trial 214 finished with value: -1.0473209341072829 and parameters: {'scalers': 'robust', 'ratios': 'norm_ratio', 'imputers': 'mean', 'n_estimators': 2400, 'learning_rate': 0.49304258811544793, 'max_depth': 10, 'min_child_weight': 1, 'subsample': 0.5, 'colsample_bytree': 0.5, 'colsample_bylevel': 0.6, 'reg_alpha': 2.65061398715761, 'reg_lambda': 6.893125998304854e-05, 'gamma': 1.7681105627844711e-06}. Best is trial 212 with value: -1.162187748754269.
[I 2026-07-14 18:03:07,428] Trial 215 finished with value: -0.9982266927092579 and parameters: {'scalers': 'robust', 'ratios': 'norm_ratio', 'imputers': 'mean', 'n_estimators': 2400, 'learning_rate': 0.4840842180536624, 'max_depth': 10, 'min_child_weight': 1, 'subsample': 0.5, 'colsample_bytree': 0.5, 'colsample_bylevel': 0.6, 'reg_alpha': 2.5701647786174457, 'reg_lambda': 6.843780947404695e-05, 'gamma': 1.597533740191251e-06}. Best is trial 212 with value: -1.162187748754269.
[I 2026-07-14 18:03:33,495] Trial 216 finished with value: -0.8801341924340124 and parameters: {'scalers': 'robust', 'ratios': 'norm_ratio', 'imputers': 'mean', 'n_estimators': 2400, 'learning_rate': 0.4794031255938328, 'max_depth': 10, 'min_child_weight': 1, 'subsample': 0.5, 'colsample_bytree': 0.5, 'colsample_bylevel': 0.6, 'reg_alpha': 2.7509388868765376, 'reg_lambda': 4.074738620988994e-05, 'gamma': 1.5213768043371635e-06}. Best is trial 212 with value: -1.162187748754269.
[I 2026-07-14 18:04:02,567] Trial 217 finished with value: -1.0921035369860994 and parameters: {'scalers': 'robust', 'ratios': 'norm_ratio', 'imputers': 'mean', 'n_estimators': 2550, 'learning_rate': 0.4976287269723019, 'max_depth': 10, 'min_child_weight': 1, 'subsample': 0.5, 'colsample_bytree': 0.5, 'colsample_bylevel': 0.6, 'reg_alpha': 2.763784714939838, 'reg_lambda': 4.232260844177074e-05, 'gamma': 1.482511321323998e-06}. Best is trial 212 with value: -1.162187748754269.
[I 2026-07-14 18:04:31,644] Trial 218 finished with value: -1.0695638026913774 and parameters: {'scalers': 'robust', 'ratios': 'norm_ratio', 'imputers': 'mean', 'n_estimators': 2550, 'learning_rate': 0.49485645378627763, 'max_depth': 10, 'min_child_weight': 1, 'subsample': 0.5, 'colsample_bytree': 0.5, 'colsample_bylevel': 0.6, 'reg_alpha': 2.7794718828991054, 'reg_lambda': 4.3026544043294164e-05, 'gamma': 1.6014320735135872e-06}. Best is trial 212 with value: -1.162187748754269.
[I 2026-07-14 18:05:00,822] Trial 219 finished with value: -0.9113968960581651 and parameters: {'scalers': 'robust', 'ratios': 'norm_ratio', 'imputers': 'mean', 'n_estimators': 2550, 'learning_rate': 0.47742263569864485, 'max_depth': 10, 'min_child_weight': 1, 'subsample': 0.5, 'colsample_bytree': 0.5, 'colsample_bylevel': 0.6, 'reg_alpha': 2.721455238276051, 'reg_lambda': 4.326887956697436e-05, 'gamma': 1.8528957495913281e-06}. Best is trial 212 with value: -1.162187748754269.
[I 2026-07-14 18:05:29,004] Trial 220 finished with value: -1.035717727220224 and parameters: {'scalers': 'robust', 'ratios': 'norm_ratio', 'imputers': 'mean', 'n_estimators': 2400, 'learning_rate': 0.4857122011250584, 'max_depth': 10, 'min_child_weight': 1, 'subsample': 0.5, 'colsample_bytree': 0.5, 'colsample_bylevel': 0.6, 'reg_alpha': 2.5249704964724207, 'reg_lambda': 4.2145750921665036e-05, 'gamma': 1.5294998936471758e-06}. Best is trial 212 with value: -1.162187748754269.
[I 2026-07-14 18:05:59,320] Trial 221 finished with value: -1.1122953075568467 and parameters: {'scalers': 'robust', 'ratios': 'norm_ratio', 'imputers': 'mean', 'n_estimators': 2400, 'learning_rate': 0.4931964965197186, 'max_depth': 10, 'min_child_weight': 1, 'subsample': 0.5, 'colsample_bytree': 0.5, 'colsample_bylevel': 0.6, 'reg_alpha': 2.15964779807845, 'reg_lambda': 4.403434333109434e-05, 'gamma': 1.6497668373669386e-06}. Best is trial 212 with value: -1.162187748754269.
[I 2026-07-14 18:06:29,737] Trial 222 finished with value: -1.0831365717443278 and parameters: {'scalers': 'robust', 'ratios': 'norm_ratio', 'imputers': 'mean', 'n_estimators': 2600, 'learning_rate': 0.488029859158273, 'max_depth': 10, 'min_child_weight': 1, 'subsample': 0.5, 'colsample_bytree': 0.5, 'colsample_bylevel': 0.6, 'reg_alpha': 2.5296765470806806, 'reg_lambda': 3.896355157313879e-05, 'gamma': 1.594856411361855e-06}. Best is trial 212 with value: -1.162187748754269.
[I 2026-07-14 18:07:00,249] Trial 223 finished with value: -1.0998343700150255 and parameters: {'scalers': 'robust', 'ratios': 'norm_ratio', 'imputers': 'mean', 'n_estimators': 2400, 'learning_rate': 0.4905750437269099, 'max_depth': 10, 'min_child_weight': 1, 'subsample': 0.5, 'colsample_bytree': 0.5, 'colsample_bylevel': 0.6, 'reg_alpha': 2.1559914437954477, 'reg_lambda': 4.271692062080798e-05, 'gamma': 1.399914131700385e-06}. Best is trial 212 with value: -1.162187748754269.
[I 2026-07-14 18:07:29,396] Trial 224 finished with value: -1.1106415789978943 and parameters: {'scalers': 'robust', 'ratios': 'norm_ratio', 'imputers': 'mean', 'n_estimators': 2350, 'learning_rate': 0.4966090633416242, 'max_depth': 10, 'min_child_weight': 1, 'subsample': 0.5, 'colsample_bytree': 0.5, 'colsample_bylevel': 0.6, 'reg_alpha': 2.4027642534194062, 'reg_lambda': 4.532043397196368e-05, 'gamma': 1.6530795354293418e-06}. Best is trial 212 with value: -1.162187748754269.
