[I 2026-07-14 17:09:15,598] Trial 137 finished with value: -0.7194629187711229 and parameters: {'scalers': 'none', 'ratios': 'norm_ratio', 'imputers': 'mean', 'n_estimators': 750, 'learning_rate': 0.0027472019906575103, 'max_depth': 3, 'min_child_weight': 1, 'subsample': 1.0, 'colsample_bytree': 0.8, 'colsample_bylevel': 1.0, 'reg_alpha': 11.592331262397941, 'reg_lambda': 0.0002230995770499915, 'gamma': 31.69359320797593}. Best is trial 21 with value: -0.7913973345232271.
[I 2026-07-14 17:09:18,281] Trial 138 finished with value: -0.7837998944518525 and parameters: {'scalers': 'none', 'ratios': 'norm_ratio', 'imputers': 'mean', 'n_estimators': 1300, 'learning_rate': 0.00013241693246167756, 'max_depth': 5, 'min_child_weight': 1, 'subsample': 1.0, 'colsample_bytree': 0.8, 'colsample_bylevel': 1.0, 'reg_alpha': 13.032389593565842, 'reg_lambda': 0.002330919655493556, 'gamma': 93.32111249578244}. Best is trial 21 with value: -0.7913973345232271.
[I 2026-07-14 17:09:19,049] Trial 139 finished with value: -0.7903635950445602 and parameters: {'scalers': 'none', 'ratios': 'norm_ratio', 'imputers': 'mean', 'n_estimators': 450, 'learning_rate': 0.004046040315996413, 'max_depth': 6, 'min_child_weight': 1, 'subsample': 1.0, 'colsample_bytree': 0.8, 'colsample_bylevel': 1.0, 'reg_alpha': 18.47731054754406, 'reg_lambda': 0.0002006036586039118, 'gamma': 96.94074080257487}. Best is trial 21 with value: -0.7913973345232271.
[I 2026-07-14 17:09:20,052] Trial 140 finished with value: -0.7281152568542326 and parameters: {'scalers': 'none', 'ratios': 'norm_ratio', 'imputers': 'mean', 'n_estimators': 500, 'learning_rate': 0.011225176806707355, 'max_depth': 4, 'min_child_weight': 1, 'subsample': 0.9, 'colsample_bytree': 0.8, 'colsample_bylevel': 1.0, 'reg_alpha': 22.063692971715472, 'reg_lambda': 13.054755452115845, 'gamma': 34.115384966460375}. Best is trial 21 with value: -0.7913973345232271.
[I 2026-07-14 17:09:21,054] Trial 141 finished with value: -0.7897701043301368 and parameters: {'scalers': 'none', 'ratios': 'norm_ratio', 'imputers': 'mean', 'n_estimators': 500, 'learning_rate': 0.005715246327940696, 'max_depth': 6, 'min_child_weight': 6, 'subsample': 0.9, 'colsample_bytree': 0.8, 'colsample_bylevel': 1.0, 'reg_alpha': 14.101089435930213, 'reg_lambda': 0.0029202801270363033, 'gamma': 97.49086796139946}. Best is trial 21 with value: -0.7913973345232271.
[I 2026-07-14 17:09:21,951] Trial 142 finished with value: -0.7575192413217046 and parameters: {'scalers': 'none', 'ratios': 'norm_ratio', 'imputers': 'mean', 'n_estimators': 450, 'learning_rate': 0.004114636031140879, 'max_depth': 6, 'min_child_weight': 6, 'subsample': 0.9, 'colsample_bytree': 0.8, 'colsample_bylevel': 1.0, 'reg_alpha': 46.712067557068444, 'reg_lambda': 0.0025538996356308796, 'gamma': 43.91688482506498}. Best is trial 21 with value: -0.7913973345232271.
[I 2026-07-14 17:09:23,193] Trial 143 finished with value: -0.7440312734061463 and parameters: {'scalers': 'none', 'ratios': 'norm_ratio', 'imputers': 'mean', 'n_estimators': 600, 'learning_rate': 0.004201833020204152, 'max_depth': 6, 'min_child_weight': 6, 'subsample': 0.9, 'colsample_bytree': 0.8, 'colsample_bylevel': 1.0, 'reg_alpha': 20.444758905322644, 'reg_lambda': 0.0002256194213199647, 'gamma': 49.352588210419924}. Best is trial 21 with value: -0.7913973345232271.
[I 2026-07-14 17:09:24,279] Trial 144 finished with value: -0.7627687371365532 and parameters: {'scalers': 'none', 'ratios': 'norm_ratio', 'imputers': 'mean', 'n_estimators': 550, 'learning_rate': 0.0041027532783450725, 'max_depth': 6, 'min_child_weight': 6, 'subsample': 0.9, 'colsample_bytree': 0.6, 'colsample_bylevel': 1.0, 'reg_alpha': 46.59839374559319, 'reg_lambda': 0.00020514403599679413, 'gamma': 49.01953483371047}. Best is trial 21 with value: -0.7913973345232271.
[I 2026-07-14 17:09:25,255] Trial 145 finished with value: -0.7614801916791116 and parameters: {'scalers': 'none', 'ratios': 'norm_ratio', 'imputers': 'mean', 'n_estimators': 500, 'learning_rate': 0.006211404396916246, 'max_depth': 6, 'min_child_weight': 6, 'subsample': 0.9, 'colsample_bytree': 0.6, 'colsample_bylevel': 0.9, 'reg_alpha': 47.920522561429046, 'reg_lambda': 0.000205793324591112, 'gamma': 46.627348553889505}. Best is trial 21 with value: -0.7913973345232271.
[I 2026-07-14 17:09:26,025] Trial 146 finished with value: -0.7627878651008678 and parameters: {'scalers': 'none', 'ratios': 'norm_ratio', 'imputers': 'mean', 'n_estimators': 450, 'learning_rate': 0.005957779717130571, 'max_depth': 6, 'min_child_weight': 6, 'subsample': 0.9, 'colsample_bytree': 0.6, 'colsample_bylevel': 0.9, 'reg_alpha': 49.24425403866207, 'reg_lambda': 0.00020011478136431745, 'gamma': 47.767930838847626}. Best is trial 21 with value: -0.7913973345232271.
[I 2026-07-14 17:09:26,608] Trial 147 finished with value: -0.7611676726534351 and parameters: {'scalers': 'none', 'ratios': 'norm_ratio', 'imputers': 'mean', 'n_estimators': 350, 'learning_rate': 0.009026519011795124, 'max_depth': 4, 'min_child_weight': 6, 'subsample': 0.9, 'colsample_bytree': 0.6, 'colsample_bylevel': 0.9, 'reg_alpha': 48.23534114592705, 'reg_lambda': 5.616569555998021, 'gamma': 46.3142387587406}. Best is trial 21 with value: -0.7913973345232271.
[I 2026-07-14 17:09:27,155] Trial 148 finished with value: -0.7911178354955756 and parameters: {'scalers': 'none', 'ratios': 'norm_ratio', 'imputers': 'mean', 'n_estimators': 300, 'learning_rate': 0.00047469231203888234, 'max_depth': 6, 'min_child_weight': 1, 'subsample': 0.9, 'colsample_bytree': 0.8, 'colsample_bylevel': 1.0, 'reg_alpha': 99.09238204707796, 'reg_lambda': 0.0003855939603541797, 'gamma': 50.46214487532121}. Best is trial 21 with value: -0.7913973345232271.
[I 2026-07-14 17:09:30,969] Trial 149 finished with value: -0.7912898059686791 and parameters: {'scalers': 'none', 'ratios': 'norm_ratio', 'imputers': 'mean', 'n_estimators': 2100, 'learning_rate': 0.0016572756114648327, 'max_depth': 4, 'min_child_weight': 1, 'subsample': 0.9, 'colsample_bytree': 0.6, 'colsample_bylevel': 1.0, 'reg_alpha': 99.76239681877429, 'reg_lambda': 0.0003948434025063996, 'gamma': 49.00156382842383}. Best is trial 21 with value: -0.7913973345232271.
[I 2026-07-14 17:09:31,757] Trial 150 finished with value: -0.6964285598372197 and parameters: {'scalers': 'none', 'ratios': 'norm_ratio', 'imputers': 'mean', 'n_estimators': 350, 'learning_rate': 0.009118907965633216, 'max_depth': 4, 'min_child_weight': 1, 'subsample': 0.9, 'colsample_bytree': 0.6, 'colsample_bylevel': 1.0, 'reg_alpha': 98.19800804307485, 'reg_lambda': 0.00038445801089526896, 'gamma': 0.008310155313035115}. Best is trial 21 with value: -0.7913973345232271.
[I 2026-07-14 17:09:35,671] Trial 151 finished with value: -0.7912802728058279 and parameters: {'scalers': 'none', 'ratios': 'norm_ratio', 'imputers': 'mean', 'n_estimators': 2200, 'learning_rate': 0.0015265856349359211, 'max_depth': 4, 'min_child_weight': 1, 'subsample': 0.9, 'colsample_bytree': 0.6, 'colsample_bylevel': 1.0, 'reg_alpha': 96.52471808236378, 'reg_lambda': 0.00039249496808757724, 'gamma': 53.68140365255804}. Best is trial 21 with value: -0.7913973345232271.
[I 2026-07-14 17:09:39,368] Trial 152 finished with value: -0.7912754570181758 and parameters: {'scalers': 'none', 'ratios': 'norm_ratio', 'imputers': 'mean', 'n_estimators': 2050, 'learning_rate': 0.0012621963750741383, 'max_depth': 4, 'min_child_weight': 1, 'subsample': 0.9, 'colsample_bytree': 0.6, 'colsample_bylevel': 1.0, 'reg_alpha': 97.65913968468138, 'reg_lambda': 0.000635566305053543, 'gamma': 54.13964983673604}. Best is trial 21 with value: -0.7913973345232271.
[I 2026-07-14 17:09:43,434] Trial 153 finished with value: -0.7582376864296214 and parameters: {'scalers': 'none', 'ratios': 'norm_ratio', 'imputers': 'mean', 'n_estimators': 2100, 'learning_rate': 0.0007412160271861132, 'max_depth': 4, 'min_child_weight': 1, 'subsample': 0.9, 'colsample_bytree': 0.7, 'colsample_bylevel': 1.0, 'reg_alpha': 2.16646525241849e-06, 'reg_lambda': 0.0004907831807523903, 'gamma': 74.33990643132246}. Best is trial 21 with value: -0.7913973345232271.
[I 2026-07-14 17:09:44,104] Trial 154 finished with value: -0.7524019482874611 and parameters: {'scalers': 'none', 'ratios': 'norm_ratio', 'imputers': 'mean', 'n_estimators': 300, 'learning_rate': 0.017757592503825317, 'max_depth': 4, 'min_child_weight': 1, 'subsample': 0.9, 'colsample_bytree': 0.7, 'colsample_bylevel': 1.0, 'reg_alpha': 2.494905589188453e-06, 'reg_lambda': 0.00040465475294891655, 'gamma': 71.5146174285649}. Best is trial 21 with value: -0.7913973345232271.
[I 2026-07-14 17:09:47,957] Trial 155 finished with value: -0.7585100425577441 and parameters: {'scalers': 'standard', 'ratios': 'norm_ratio', 'imputers': 'mean', 'n_estimators': 2050, 'learning_rate': 0.0007520541243394541, 'max_depth': 4, 'min_child_weight': 1, 'subsample': 0.9, 'colsample_bytree': 0.7, 'colsample_bylevel': 1.0, 'reg_alpha': 0.13166626169169593, 'reg_lambda': 0.0006062456254772703, 'gamma': 74.50709520550345}. Best is trial 21 with value: -0.7913973345232271.
[I 2026-07-14 17:09:51,665] Trial 156 finished with value: -0.6939118646769825 and parameters: {'scalers': 'standard', 'ratios': 'norm_ratio', 'imputers': 'mean', 'n_estimators': 2100, 'learning_rate': 0.017682329226172206, 'max_depth': 4, 'min_child_weight': 2, 'subsample': 0.8, 'colsample_bytree': 0.7, 'colsample_bylevel': 1.0, 'reg_alpha': 93.00146194404186, 'reg_lambda': 0.0006157013019920208, 'gamma': 0.022088381934463903}. Best is trial 21 with value: -0.7913973345232271.
[I 2026-07-14 17:09:55,173] Trial 157 finished with value: -0.7912381174124485 and parameters: {'scalers': 'standard', 'ratios': 'norm_ratio', 'imputers': 'mean', 'n_estimators': 2050, 'learning_rate': 0.01791339279364269, 'max_depth': 4, 'min_child_weight': 2, 'subsample': 0.8, 'colsample_bytree': 0.7, 'colsample_bylevel': 1.0, 'reg_alpha': 96.70921366167399, 'reg_lambda': 0.000639611983427697, 'gamma': 70.6361580589348}. Best is trial 21 with value: -0.7913973345232271.
[I 2026-07-14 17:09:57,950] Trial 158 finished with value: -0.7910467052870026 and parameters: {'scalers': 'none', 'ratios': 'norm_ratio', 'imputers': 'mean', 'n_estimators': 1500, 'learning_rate': 0.01888154550541935, 'max_depth': 4, 'min_child_weight': 1, 'subsample': 0.9, 'colsample_bytree': 0.7, 'colsample_bylevel': 1.0, 'reg_alpha': 63.67026743817303, 'reg_lambda': 0.000695782403032993, 'gamma': 67.2911011697071}. Best is trial 21 with value: -0.7913973345232271.
[I 2026-07-14 17:10:01,634] Trial 159 finished with value: -0.7912854271362195 and parameters: {'scalers': 'standard', 'ratios': 'norm_ratio', 'imputers': 'mean', 'n_estimators': 2050, 'learning_rate': 0.001708321953526817, 'max_depth': 4, 'min_child_weight': 2, 'subsample': 0.9, 'colsample_bytree': 0.7, 'colsample_bylevel': 1.0, 'reg_alpha': 96.48082340372619, 'reg_lambda': 0.0005692461854036661, 'gamma': 69.15749789244714}. Best is trial 21 with value: -0.7913973345232271.
[I 2026-07-14 17:10:05,551] Trial 160 finished with value: -0.7531630255370747 and parameters: {'scalers': 'none', 'ratios': 'norm_ratio', 'imputers': 'mean', 'n_estimators': 2050, 'learning_rate': 0.0008592353314088404, 'max_depth': 4, 'min_child_weight': 2, 'subsample': 0.9, 'colsample_bytree': 0.6, 'colsample_bylevel': 1.0, 'reg_alpha': 0.13563536872243537, 'reg_lambda': 0.0006044959279423583, 'gamma': 70.1405830058119}. Best is trial 21 with value: -0.7913973345232271.
[I 2026-07-14 17:10:09,396] Trial 161 finished with value: -0.7651928786164285 and parameters: {'scalers': 'none', 'ratios': 'norm_ratio', 'imputers': 'mean', 'n_estimators': 2100, 'learning_rate': 0.0013905792862504555, 'max_depth': 4, 'min_child_weight': 2, 'subsample': 0.9, 'colsample_bytree': 0.6, 'colsample_bylevel': 1.0, 'reg_alpha': 93.08216217040136, 'reg_lambda': 0.0006240047806561719, 'gamma': 27.978671777280006}. Best is trial 21 with value: -0.7913973345232271.
[I 2026-07-14 17:10:13,250] Trial 162 finished with value: -0.7640940115258991 and parameters: {'scalers': 'none', 'ratios': 'norm_ratio', 'imputers': 'mean', 'n_estimators': 2100, 'learning_rate': 0.001347943215845675, 'max_depth': 3, 'min_child_weight': 2, 'subsample': 0.9, 'colsample_bytree': 0.6, 'colsample_bylevel': 1.0, 'reg_alpha': 92.65983530930679, 'reg_lambda': 0.0006277447205122948, 'gamma': 27.53024221170207}. Best is trial 21 with value: -0.7913973345232271.
[I 2026-07-14 17:10:17,113] Trial 163 finished with value: -0.7649270585125776 and parameters: {'scalers': 'none', 'ratios': 'norm_ratio', 'imputers': 'mean', 'n_estimators': 2100, 'learning_rate': 0.0013621062798314845, 'max_depth': 3, 'min_child_weight': 2, 'subsample': 0.9, 'colsample_bytree': 0.6, 'colsample_bylevel': 1.0, 'reg_alpha': 95.05090097244533, 'reg_lambda': 0.00065705208478514, 'gamma': 27.009365109241447}. Best is trial 21 with value: -0.7913973345232271.
[I 2026-07-14 17:10:21,421] Trial 164 finished with value: -0.7031845034035753 and parameters: {'scalers': 'none', 'ratios': 'norm_ratio', 'imputers': 'mean', 'n_estimators': 2200, 'learning_rate': 0.0016138334356123262, 'max_depth': 3, 'min_child_weight': 2, 'subsample': 0.9, 'colsample_bytree': 0.6, 'colsample_bylevel': 1.0, 'reg_alpha': 0.0009248816566295836, 'reg_lambda': 0.00010215754899023053, 'gamma': 26.294070855918456}. Best is trial 21 with value: -0.7913973345232271.
[I 2026-07-14 17:10:25,527] Trial 165 finished with value: -0.7403116523427236 and parameters: {'scalers': 'none', 'ratios': 'norm_ratio', 'imputers': 'mean', 'n_estimators': 2200, 'learning_rate': 0.001377146335645732, 'max_depth': 3, 'min_child_weight': 2, 'subsample': 0.9, 'colsample_bytree': 0.6, 'colsample_bylevel': 1.0, 'reg_alpha': 57.92793717787224, 'reg_lambda': 0.0013387444169940445, 'gamma': 26.14358403019773}. Best is trial 21 with value: -0.7913973345232271.
[I 2026-07-14 17:10:29,737] Trial 166 finished with value: -0.7202738832471488 and parameters: {'scalers': 'none', 'ratios': 'norm_ratio', 'imputers': 'mean', 'n_estimators': 2200, 'learning_rate': 0.0013103854248259698, 'max_depth': 3, 'min_child_weight': 2, 'subsample': 0.9, 'colsample_bytree': 0.6, 'colsample_bylevel': 1.0, 'reg_alpha': 26.18441527674512, 'reg_lambda': 0.0012354434248443601, 'gamma': 25.338606209411292}. Best is trial 21 with value: -0.7913973345232271.
[I 2026-07-14 17:10:33,424] Trial 167 finished with value: -0.742381114533271 and parameters: {'scalers': 'none', 'ratios': 'norm_ratio', 'imputers': 'mean', 'n_estimators': 1950, 'learning_rate': 0.0012498075698151548, 'max_depth': 3, 'min_child_weight': 2, 'subsample': 0.9, 'colsample_bytree': 0.6, 'colsample_bylevel': 1.0, 'reg_alpha': 59.474586032205934, 'reg_lambda': 0.0011331386788843265, 'gamma': 26.475339567306328}. Best is trial 21 with value: -0.7913973345232271.
[I 2026-07-14 17:10:36,893] Trial 168 finished with value: -0.7416583401811528 and parameters: {'scalers': 'standard', 'ratios': 'norm_ratio', 'imputers': 'mean', 'n_estimators': 1900, 'learning_rate': 0.001420561844351375, 'max_depth': 3, 'min_child_weight': 2, 'subsample': 0.9, 'colsample_bytree': 0.6, 'colsample_bylevel': 1.0, 'reg_alpha': 62.321685558262615, 'reg_lambda': 0.0012956093920521512, 'gamma': 24.851446261580776}. Best is trial 21 with value: -0.7913973345232271.
[I 2026-07-14 17:10:40,541] Trial 169 finished with value: -0.7065759476026411 and parameters: {'scalers': 'standard', 'ratios': 'norm_ratio', 'imputers': 'mean', 'n_estimators': 1900, 'learning_rate': 0.0015593924815137724, 'max_depth': 3, 'min_child_weight': 2, 'subsample': 0.9, 'colsample_bytree': 0.6, 'colsample_bylevel': 1.0, 'reg_alpha': 0.0007092349834250957, 'reg_lambda': 0.0011893595980522619, 'gamma': 28.049265668279876}. Best is trial 21 with value: -0.7913973345232271.
[I 2026-07-14 17:10:44,525] Trial 170 finished with value: -0.7722267266022509 and parameters: {'scalers': 'standard', 'ratios': 'norm_ratio', 'imputers': 'mean', 'n_estimators': 2200, 'learning_rate': 0.0020264745025649436, 'max_depth': 3, 'min_child_weight': 2, 'subsample': 0.9, 'colsample_bytree': 0.7, 'colsample_bylevel': 1.0, 'reg_alpha': 62.54068996437654, 'reg_lambda': 0.0012508031569650982, 'gamma': 48.320489825501035}. Best is trial 21 with value: -0.7913973345232271.
[I 2026-07-14 17:10:48,770] Trial 171 finished with value: -0.7321232972228905 and parameters: {'scalers': 'standard', 'ratios': 'norm_ratio', 'imputers': 'mean', 'n_estimators': 2200, 'learning_rate': 0.001015563853448413, 'max_depth': 3, 'min_child_weight': 2, 'subsample': 0.9, 'colsample_bytree': 0.7, 'colsample_bylevel': 1.0, 'reg_alpha': 0.0009404666054134541, 'reg_lambda': 0.0011729762521770282, 'gamma': 49.47803509393864}. Best is trial 21 with value: -0.7913973345232271.
[I 2026-07-14 17:10:52,777] Trial 172 finished with value: -0.7661430771869071 and parameters: {'scalers': 'standard', 'ratios': 'norm_ratio', 'imputers': 'mean', 'n_estimators': 2300, 'learning_rate': 0.002100676122815232, 'max_depth': 12, 'min_child_weight': 1, 'subsample': 0.9, 'colsample_bytree': 0.5, 'colsample_bylevel': 1.0, 'reg_alpha': 58.174608140806654, 'reg_lambda': 2.9807415572519495e-06, 'gamma': 46.284292311554765}. Best is trial 21 with value: -0.7913973345232271.
[I 2026-07-14 17:10:56,329] Trial 173 finished with value: -0.7548616663218516 and parameters: {'scalers': 'standard', 'ratios': 'norm_ratio', 'imputers': 'median', 'n_estimators': 2000, 'learning_rate': 0.0010813569995006748, 'max_depth': 12, 'min_child_weight': 1, 'subsample': 0.9, 'colsample_bytree': 0.5, 'colsample_bylevel': 1.0, 'reg_alpha': 29.35079026963402, 'reg_lambda': 0.0013142921044674535, 'gamma': 51.45469229306706}. Best is trial 21 with value: -0.7913973345232271.
[I 2026-07-14 17:10:59,993] Trial 174 finished with value: -0.739912883720389 and parameters: {'scalers': 'standard', 'ratios': 'norm_ratio', 'imputers': 'median', 'n_estimators': 2000, 'learning_rate': 0.0011050141301120102, 'max_depth': 4, 'min_child_weight': 1, 'subsample': 0.9, 'colsample_bytree': 0.5, 'colsample_bylevel': 1.0, 'reg_alpha': 0.7189630067542654, 'reg_lambda': 0.00032793044212859284, 'gamma': 56.93275852058336}. Best is trial 21 with value: -0.7913973345232271.
[I 2026-07-14 17:11:03,300] Trial 175 finished with value: -0.7572059474204541 and parameters: {'scalers': 'standard', 'ratios': 'norm_ratio', 'imputers': 'median', 'n_estimators': 1850, 'learning_rate': 0.001036275242041038, 'max_depth': 12, 'min_child_weight': 1, 'subsample': 0.9, 'colsample_bytree': 0.5, 'colsample_bylevel': 1.0, 'reg_alpha': 38.85574577026905, 'reg_lambda': 0.0003914394809904249, 'gamma': 47.421808103674806}. Best is trial 21 with value: -0.7913973345232271.
[I 2026-07-14 17:11:07,672] Trial 176 finished with value: -0.7610325575062289 and parameters: {'scalers': 'standard', 'ratios': 'norm_ratio', 'imputers': 'median', 'n_estimators': 2500, 'learning_rate': 0.0011242934697461384, 'max_depth': 5, 'min_child_weight': 1, 'subsample': 0.9, 'colsample_bytree': 0.5, 'colsample_bylevel': 1.0, 'reg_alpha': 39.37461006365509, 'reg_lambda': 2.683167981326288e-06, 'gamma': 50.84662852912993}. Best is trial 21 with value: -0.7913973345232271.
[I 2026-07-14 17:11:12,134] Trial 177 finished with value: -0.7532810791275687 and parameters: {'scalers': 'none', 'ratios': 'norm_ratio', 'imputers': 'median', 'n_estimators': 2500, 'learning_rate': 0.00225233531213397, 'max_depth': 5, 'min_child_weight': 1, 'subsample': 0.9, 'colsample_bytree': 0.5, 'colsample_bylevel': 1.0, 'reg_alpha': 39.6229154962144, 'reg_lambda': 3.488068344611121e-06, 'gamma': 44.929803299782336}. Best is trial 21 with value: -0.7913973345232271.
[I 2026-07-14 17:11:16,510] Trial 178 finished with value: -0.7912835098416703 and parameters: {'scalers': 'none', 'ratios': 'norm_ratio', 'imputers': 'none', 'n_estimators': 2500, 'learning_rate': 0.0010523595392509708, 'max_depth': 5, 'min_child_weight': 1, 'subsample': 0.9, 'colsample_bytree': 0.5, 'colsample_bylevel': 1.0, 'reg_alpha': 42.85641411775277, 'reg_lambda': 0.000303759543494521, 'gamma': 94.00228812347713}. Best is trial 21 with value: -0.7913973345232271.
[I 2026-07-14 17:11:20,099] Trial 179 finished with value: -0.7766759778523176 and parameters: {'scalers': 'none', 'ratios': 'norm_ratio', 'imputers': 'none', 'n_estimators': 2000, 'learning_rate': 0.013294551399498221, 'max_depth': 5, 'min_child_weight': 1, 'subsample': 0.9, 'colsample_bytree': 0.5, 'colsample_bylevel': 1.0, 'reg_alpha': 1.735140158260467e-05, 'reg_lambda': 2.9523328837835017e-06, 'gamma': 96.80510263095772}. Best is trial 21 with value: -0.7913973345232271.
[I 2026-07-14 17:11:25,056] Trial 180 finished with value: -0.6612844119620479 and parameters: {'scalers': 'none', 'ratios': 'norm_ratio', 'imputers': 'none', 'n_estimators': 2500, 'learning_rate': 0.013551711397348174, 'max_depth': 5, 'min_child_weight': 1, 'subsample': 0.9, 'colsample_bytree': 0.7, 'colsample_bylevel': 1.0, 'reg_alpha': 39.666696579746635, 'reg_lambda': 0.00034598326508924175, 'gamma': 3.315005991292025e-06}. Best is trial 21 with value: -0.7913973345232271.
[I 2026-07-14 17:11:29,674] Trial 181 finished with value: -0.7913253555357421 and parameters: {'scalers': 'none', 'ratios': 'norm_ratio', 'imputers': 'none', 'n_estimators': 2500, 'learning_rate': 0.01436981042153553, 'max_depth': 5, 'min_child_weight': 1, 'subsample': 0.9, 'colsample_bytree': 0.7, 'colsample_bylevel': 1.0, 'reg_alpha': 43.57915384134808, 'reg_lambda': 0.00037908171947246443, 'gamma': 94.45182146310313}. Best is trial 21 with value: -0.7913973345232271.
