[I 2026-07-14 20:52:17,779] Trial 315 finished with value: -0.3631218784475709 and parameters: {'scalers': 'robust', 'ratios': 'log_ratio', 'imputers': 'none', 'n_estimators': 2200, 'learning_rate': 0.42165071553893674, 'max_depth': 10, 'min_child_weight': 2, 'subsample': 0.5, 'colsample_bytree': 0.5, 'colsample_bylevel': 0.5, 'reg_alpha': 0.571756139532524, 'reg_lambda': 0.001206503052404341, 'gamma': 0.006353714397105081}. Best is trial 241 with value: -0.5902833642852945.
[I 2026-07-14 20:52:28,522] Trial 316 finished with value: -0.34395025873286866 and parameters: {'scalers': 'robust', 'ratios': 'log_ratio', 'imputers': 'none', 'n_estimators': 2200, 'learning_rate': 0.49862362020865864, 'max_depth': 10, 'min_child_weight': 2, 'subsample': 0.5, 'colsample_bytree': 0.5, 'colsample_bylevel': 0.5, 'reg_alpha': 0.12973878022931426, 'reg_lambda': 0.0011939707111648164, 'gamma': 0.007666057540552529}. Best is trial 241 with value: -0.5902833642852945.
[I 2026-07-14 20:52:38,361] Trial 317 finished with value: -0.2988030484661682 and parameters: {'scalers': 'robust', 'ratios': 'log_ratio', 'imputers': 'median', 'n_estimators': 2000, 'learning_rate': 0.42747489825308177, 'max_depth': 10, 'min_child_weight': 2, 'subsample': 0.5, 'colsample_bytree': 0.5, 'colsample_bylevel': 0.5, 'reg_alpha': 0.1302252205474359, 'reg_lambda': 0.0079146364470291, 'gamma': 0.006738993103794854}. Best is trial 241 with value: -0.5902833642852945.
[I 2026-07-14 20:52:54,379] Trial 318 finished with value: -0.07460117328256058 and parameters: {'scalers': 'robust', 'ratios': 'log_ratio', 'imputers': 'median', 'n_estimators': 2250, 'learning_rate': 0.002767666487191406, 'max_depth': 10, 'min_child_weight': 2, 'subsample': 0.5, 'colsample_bytree': 0.5, 'colsample_bylevel': 0.5, 'reg_alpha': 0.5346972346114052, 'reg_lambda': 0.00826357445149667, 'gamma': 0.006139484735890389}. Best is trial 241 with value: -0.5902833642852945.
[I 2026-07-14 20:53:08,832] Trial 319 finished with value: -0.07362039755997564 and parameters: {'scalers': 'robust', 'ratios': 'log_ratio', 'imputers': 'median', 'n_estimators': 2250, 'learning_rate': 0.0036542928194644698, 'max_depth': 10, 'min_child_weight': 1, 'subsample': 0.5, 'colsample_bytree': 0.5, 'colsample_bylevel': 0.5, 'reg_alpha': 0.1323855416869409, 'reg_lambda': 0.001480298444472725, 'gamma': 0.0020224867265831573}. Best is trial 241 with value: -0.5902833642852945.
