[I 2026-07-14 16:53:01,263] Trial 90 finished with value: -0.26027252678742835 and parameters: {'scalers': 'standard', 'ratios': 'norm_ratio', 'imputers': 'none', 'n_estimators': 1450, 'learning_rate': 0.41738481285393697, 'max_depth': 10, 'min_child_weight': 10, 'subsample': 0.5, 'colsample_bytree': 1.0, 'colsample_bylevel': 0.5, 'reg_alpha': 0.38864964498366733, 'reg_lambda': 0.00028828902026397523, 'gamma': 0.0007203878530674866}. Best is trial 85 with value: -0.4246834161822451.
[I 2026-07-14 16:53:30,196] Trial 91 finished with value: -0.3205769936192119 and parameters: {'scalers': 'standard', 'ratios': 'norm_ratio', 'imputers': 'none', 'n_estimators': 1450, 'learning_rate': 0.2636076254067113, 'max_depth': 11, 'min_child_weight': 2, 'subsample': 0.5, 'colsample_bytree': 1.0, 'colsample_bylevel': 0.6, 'reg_alpha': 2.34182348332878, 'reg_lambda': 0.00025699356617724643, 'gamma': 0.0007217008105136106}. Best is trial 85 with value: -0.4246834161822451.
[I 2026-07-14 16:53:51,922] Trial 92 finished with value: -0.26414257033979766 and parameters: {'scalers': 'standard', 'ratios': 'norm_ratio', 'imputers': 'none', 'n_estimators': 1850, 'learning_rate': 0.44507797549344175, 'max_depth': 11, 'min_child_weight': 10, 'subsample': 0.5, 'colsample_bytree': 1.0, 'colsample_bylevel': 0.6, 'reg_alpha': 1.9709042909319998, 'reg_lambda': 0.011541735719084114, 'gamma': 0.0006839006680137059}. Best is trial 85 with value: -0.4246834161822451.
[I 2026-07-14 16:54:15,902] Trial 93 finished with value: -0.3636742646288799 and parameters: {'scalers': 'standard', 'ratios': 'norm_ratio', 'imputers': 'none', 'n_estimators': 1850, 'learning_rate': 0.4507006947650857, 'max_depth': 9, 'min_child_weight': 2, 'subsample': 0.5, 'colsample_bytree': 1.0, 'colsample_bylevel': 0.6, 'reg_alpha': 4.246912753400578, 'reg_lambda': 0.012506359022335567, 'gamma': 2.9958241731864604e-06}. Best is trial 85 with value: -0.4246834161822451.
[I 2026-07-14 16:54:47,881] Trial 94 finished with value: -0.44990654297174865 and parameters: {'scalers': 'standard', 'ratios': 'norm_ratio', 'imputers': 'none', 'n_estimators': 1900, 'learning_rate': 0.48336071279823106, 'max_depth': 9, 'min_child_weight': 2, 'subsample': 0.5, 'colsample_bytree': 1.0, 'colsample_bylevel': 0.6, 'reg_alpha': 2.3093411519872156, 'reg_lambda': 0.015257858414755195, 'gamma': 3.167394250316537e-06}. Best is trial 94 with value: -0.44990654297174865.
[I 2026-07-14 16:55:05,778] Trial 95 finished with value: -0.34924257526599883 and parameters: {'scalers': 'standard', 'ratios': 'norm_ratio', 'imputers': 'none', 'n_estimators': 1450, 'learning_rate': 0.46730282989091737, 'max_depth': 9, 'min_child_weight': 2, 'subsample': 0.5, 'colsample_bytree': 1.0, 'colsample_bylevel': 0.6, 'reg_alpha': 4.722924309769175, 'reg_lambda': 0.07480749691548537, 'gamma': 4.187975730112962e-05}. Best is trial 94 with value: -0.44990654297174865.
[I 2026-07-14 16:55:26,708] Trial 96 finished with value: -0.29356707549656297 and parameters: {'scalers': 'standard', 'ratios': 'norm_ratio', 'imputers': 'none', 'n_estimators': 1450, 'learning_rate': 0.25809118590586944, 'max_depth': 9, 'min_child_weight': 2, 'subsample': 0.5, 'colsample_bytree': 1.0, 'colsample_bylevel': 0.6, 'reg_alpha': 3.0368033425146157, 'reg_lambda': 0.016119915085215777, 'gamma': 3.2085934437193848e-06}. Best is trial 94 with value: -0.44990654297174865.
[I 2026-07-14 16:55:53,628] Trial 97 finished with value: -0.30405771533671133 and parameters: {'scalers': 'standard', 'ratios': 'norm_ratio', 'imputers': 'none', 'n_estimators': 1800, 'learning_rate': 0.25262654447504246, 'max_depth': 9, 'min_child_weight': 2, 'subsample': 0.5, 'colsample_bytree': 1.0, 'colsample_bylevel': 0.6, 'reg_alpha': 2.965986863794579, 'reg_lambda': 0.08147131787645469, 'gamma': 3.731247212217464e-05}. Best is trial 94 with value: -0.44990654297174865.
[I 2026-07-14 16:56:14,066] Trial 98 finished with value: -0.3920868554417053 and parameters: {'scalers': 'standard', 'ratios': 'norm_ratio', 'imputers': 'none', 'n_estimators': 1450, 'learning_rate': 0.4897452907492453, 'max_depth': 9, 'min_child_weight': 2, 'subsample': 0.5, 'colsample_bytree': 1.0, 'colsample_bylevel': 0.6, 'reg_alpha': 3.6784171725920323, 'reg_lambda': 0.003441894563307442, 'gamma': 4.240166697833095e-05}. Best is trial 94 with value: -0.44990654297174865.
[I 2026-07-14 16:56:41,094] Trial 99 finished with value: -0.44140419681761794 and parameters: {'scalers': 'standard', 'ratios': 'norm_ratio', 'imputers': 'none', 'n_estimators': 1800, 'learning_rate': 0.49582949558614287, 'max_depth': 9, 'min_child_weight': 2, 'subsample': 0.5, 'colsample_bytree': 1.0, 'colsample_bylevel': 0.6, 'reg_alpha': 3.195927960340228, 'reg_lambda': 0.016367671295591038, 'gamma': 4.504520451479065e-05}. Best is trial 94 with value: -0.44990654297174865.
[I 2026-07-14 16:57:11,463] Trial 100 finished with value: -0.4472039780324167 and parameters: {'scalers': 'standard', 'ratios': 'norm_ratio', 'imputers': 'none', 'n_estimators': 1800, 'learning_rate': 0.49682265008681437, 'max_depth': 9, 'min_child_weight': 2, 'subsample': 0.5, 'colsample_bytree': 1.0, 'colsample_bylevel': 0.6, 'reg_alpha': 2.391617372072449, 'reg_lambda': 0.06736732457359605, 'gamma': 6.663599749654115e-05}. Best is trial 94 with value: -0.44990654297174865.
[I 2026-07-14 16:57:37,232] Trial 101 finished with value: -0.2980011933350356 and parameters: {'scalers': 'standard', 'ratios': 'norm_ratio', 'imputers': 'none', 'n_estimators': 1800, 'learning_rate': 0.255551088613536, 'max_depth': 9, 'min_child_weight': 2, 'subsample': 0.5, 'colsample_bytree': 1.0, 'colsample_bylevel': 0.6, 'reg_alpha': 3.161755117396451, 'reg_lambda': 0.015303774785728372, 'gamma': 3.3571354766682103e-06}. Best is trial 94 with value: -0.44990654297174865.
[I 2026-07-14 16:58:05,914] Trial 102 finished with value: -0.3231922825276071 and parameters: {'scalers': 'standard', 'ratios': 'norm_ratio', 'imputers': 'none', 'n_estimators': 1800, 'learning_rate': 0.2496784961491575, 'max_depth': 9, 'min_child_weight': 2, 'subsample': 0.5, 'colsample_bytree': 1.0, 'colsample_bylevel': 0.6, 'reg_alpha': 2.2259117749231803, 'reg_lambda': 0.015163088376801758, 'gamma': 3.0576624327168207e-06}. Best is trial 94 with value: -0.44990654297174865.
[I 2026-07-14 16:58:25,328] Trial 103 finished with value: -0.2546786926918436 and parameters: {'scalers': 'standard', 'ratios': 'norm_ratio', 'imputers': 'none', 'n_estimators': 1750, 'learning_rate': 0.25258658915494253, 'max_depth': 9, 'min_child_weight': 2, 'subsample': 0.5, 'colsample_bytree': 1.0, 'colsample_bylevel': 0.6, 'reg_alpha': 5.321279921624274, 'reg_lambda': 0.015831567230670158, 'gamma': 2.008308997349189e-06}. Best is trial 94 with value: -0.44990654297174865.
[I 2026-07-14 16:58:43,852] Trial 104 finished with value: -0.2556992682529343 and parameters: {'scalers': 'standard', 'ratios': 'norm_ratio', 'imputers': 'none', 'n_estimators': 1750, 'learning_rate': 0.26556415998972527, 'max_depth': 9, 'min_child_weight': 2, 'subsample': 0.5, 'colsample_bytree': 1.0, 'colsample_bylevel': 0.6, 'reg_alpha': 5.502203029881724, 'reg_lambda': 0.056115051159088034, 'gamma': 2.000281638805914e-06}. Best is trial 94 with value: -0.44990654297174865.
[I 2026-07-14 16:58:55,583] Trial 105 finished with value: -0.23295540271361023 and parameters: {'scalers': 'standard', 'ratios': 'norm_ratio', 'imputers': 'none', 'n_estimators': 1700, 'learning_rate': 0.2575418632509269, 'max_depth': 9, 'min_child_weight': 2, 'subsample': 0.5, 'colsample_bytree': 1.0, 'colsample_bylevel': 0.6, 'reg_alpha': 7.03241319685314, 'reg_lambda': 0.0031665302346213986, 'gamma': 2.3355604993787797e-06}. Best is trial 94 with value: -0.44990654297174865.
[I 2026-07-14 16:59:03,020] Trial 106 finished with value: -0.20172534067583237 and parameters: {'scalers': 'standard', 'ratios': 'norm_ratio', 'imputers': 'none', 'n_estimators': 1750, 'learning_rate': 0.2505610563209175, 'max_depth': 9, 'min_child_weight': 2, 'subsample': 0.5, 'colsample_bytree': 1.0, 'colsample_bylevel': 0.6, 'reg_alpha': 10.14545424509711, 'reg_lambda': 0.0031033742094180596, 'gamma': 4.694717527738201e-06}. Best is trial 94 with value: -0.44990654297174865.
[I 2026-07-14 16:59:15,356] Trial 107 finished with value: -0.25251827180307346 and parameters: {'scalers': 'standard', 'ratios': 'norm_ratio', 'imputers': 'none', 'n_estimators': 1950, 'learning_rate': 0.4921937081493677, 'max_depth': 8, 'min_child_weight': 2, 'subsample': 0.5, 'colsample_bytree': 1.0, 'colsample_bylevel': 0.6, 'reg_alpha': 8.849764009142305, 'reg_lambda': 0.003132036747017373, 'gamma': 3.7637634182633467e-06}. Best is trial 94 with value: -0.44990654297174865.
[I 2026-07-14 16:59:29,211] Trial 108 finished with value: -0.22649098381056432 and parameters: {'scalers': 'standard', 'ratios': 'norm_ratio', 'imputers': 'none', 'n_estimators': 1700, 'learning_rate': 0.2633442989268531, 'max_depth': 8, 'min_child_weight': 2, 'subsample': 0.5, 'colsample_bytree': 1.0, 'colsample_bylevel': 0.6, 'reg_alpha': 6.930069367412079, 'reg_lambda': 0.0010328645617535396, 'gamma': 4.716630167724686e-06}. Best is trial 94 with value: -0.44990654297174865.
[I 2026-07-14 16:59:42,632] Trial 109 finished with value: -0.2165265413767398 and parameters: {'scalers': 'standard', 'ratios': 'norm_ratio', 'imputers': 'none', 'n_estimators': 1950, 'learning_rate': 0.2682009933098977, 'max_depth': 8, 'min_child_weight': 3, 'subsample': 0.5, 'colsample_bytree': 1.0, 'colsample_bylevel': 0.6, 'reg_alpha': 7.782795654483738, 'reg_lambda': 0.003237689047207451, 'gamma': 1.8397530038158999e-06}. Best is trial 94 with value: -0.44990654297174865.
[I 2026-07-14 17:00:00,816] Trial 110 finished with value: -0.29791402774122333 and parameters: {'scalers': 'standard', 'ratios': 'norm_ratio', 'imputers': 'none', 'n_estimators': 2000, 'learning_rate': 0.48136262047168865, 'max_depth': 8, 'min_child_weight': 3, 'subsample': 0.5, 'colsample_bytree': 1.0, 'colsample_bylevel': 0.6, 'reg_alpha': 5.702317361092372, 'reg_lambda': 0.003586925005660972, 'gamma': 1.3912486604522705e-06}. Best is trial 94 with value: -0.44990654297174865.
[I 2026-07-14 17:00:11,960] Trial 111 finished with value: -0.2350335171639753 and parameters: {'scalers': 'standard', 'ratios': 'norm_ratio', 'imputers': 'none', 'n_estimators': 1950, 'learning_rate': 0.4766254404582745, 'max_depth': 8, 'min_child_weight': 3, 'subsample': 0.5, 'colsample_bytree': 1.0, 'colsample_bylevel': 0.6, 'reg_alpha': 9.223984234272331, 'reg_lambda': 0.0009412301322254151, 'gamma': 9.745219015372084e-06}. Best is trial 94 with value: -0.44990654297174865.
[I 2026-07-14 17:00:19,523] Trial 112 finished with value: -0.2148282391502881 and parameters: {'scalers': 'standard', 'ratios': 'norm_ratio', 'imputers': 'none', 'n_estimators': 1950, 'learning_rate': 0.4889577526075317, 'max_depth': 8, 'min_child_weight': 3, 'subsample': 0.5, 'colsample_bytree': 1.0, 'colsample_bylevel': 0.6, 'reg_alpha': 11.27464182489328, 'reg_lambda': 0.0032281678631639475, 'gamma': 4.582629565524597e-06}. Best is trial 94 with value: -0.44990654297174865.
[I 2026-07-14 17:00:46,178] Trial 113 finished with value: -0.37328707364879277 and parameters: {'scalers': 'standard', 'ratios': 'norm_ratio', 'imputers': 'none', 'n_estimators': 1950, 'learning_rate': 0.499246763959372, 'max_depth': 8, 'min_child_weight': 3, 'subsample': 0.5, 'colsample_bytree': 1.0, 'colsample_bylevel': 0.6, 'reg_alpha': 1.2024014960238665, 'reg_lambda': 0.025804193957084415, 'gamma': 6.06674165146577e-06}. Best is trial 94 with value: -0.44990654297174865.
[I 2026-07-14 17:01:12,931] Trial 114 finished with value: -0.3837702486226426 and parameters: {'scalers': 'standard', 'ratios': 'norm_ratio', 'imputers': 'none', 'n_estimators': 1950, 'learning_rate': 0.4992085221558531, 'max_depth': 8, 'min_child_weight': 3, 'subsample': 0.5, 'colsample_bytree': 1.0, 'colsample_bylevel': 0.6, 'reg_alpha': 1.3286071017106547, 'reg_lambda': 0.02806120953776804, 'gamma': 1.0271818625189122e-06}. Best is trial 94 with value: -0.44990654297174865.
[I 2026-07-14 17:01:39,545] Trial 115 finished with value: -0.36616116716344965 and parameters: {'scalers': 'standard', 'ratios': 'norm_ratio', 'imputers': 'none', 'n_estimators': 1950, 'learning_rate': 0.4820365881923853, 'max_depth': 8, 'min_child_weight': 3, 'subsample': 0.5, 'colsample_bytree': 1.0, 'colsample_bylevel': 0.6, 'reg_alpha': 1.1512207224036952, 'reg_lambda': 0.00094860995690928, 'gamma': 1.060324030937735e-05}. Best is trial 94 with value: -0.44990654297174865.
[I 2026-07-14 17:02:08,045] Trial 116 finished with value: -0.33406445392840245 and parameters: {'scalers': 'standard', 'ratios': 'norm_ratio', 'imputers': 'none', 'n_estimators': 2100, 'learning_rate': 0.36356591243857306, 'max_depth': 8, 'min_child_weight': 3, 'subsample': 0.5, 'colsample_bytree': 1.0, 'colsample_bylevel': 0.6, 'reg_alpha': 1.1952307829048605, 'reg_lambda': 0.03029377993839643, 'gamma': 1.1285174296855083e-06}. Best is trial 94 with value: -0.44990654297174865.
[I 2026-07-14 17:02:49,505] Trial 117 finished with value: -0.6588856402745613 and parameters: {'scalers': 'standard', 'ratios': 'norm_ratio', 'imputers': 'none', 'n_estimators': 2000, 'learning_rate': 0.4953601938801132, 'max_depth': 9, 'min_child_weight': 1, 'subsample': 0.5, 'colsample_bytree': 1.0, 'colsample_bylevel': 0.6, 'reg_alpha': 1.1714507440928255, 'reg_lambda': 0.028660735914572296, 'gamma': 1.186602503933407e-05}. Best is trial 117 with value: -0.6588856402745613.
[I 2026-07-14 17:03:14,025] Trial 118 finished with value: -0.47075114027201953 and parameters: {'scalers': 'standard', 'ratios': 'norm_ratio', 'imputers': 'none', 'n_estimators': 1200, 'learning_rate': 0.367446337363743, 'max_depth': 9, 'min_child_weight': 1, 'subsample': 0.5, 'colsample_bytree': 1.0, 'colsample_bylevel': 0.6, 'reg_alpha': 1.455537687814025, 'reg_lambda': 0.03181806084366294, 'gamma': 1.1015681065048901e-05}. Best is trial 117 with value: -0.6588856402745613.
[I 2026-07-14 17:03:56,278] Trial 119 finished with value: -0.5084050152186637 and parameters: {'scalers': 'standard', 'ratios': 'norm_ratio', 'imputers': 'none', 'n_estimators': 2100, 'learning_rate': 0.3728741778242515, 'max_depth': 9, 'min_child_weight': 1, 'subsample': 0.5, 'colsample_bytree': 1.0, 'colsample_bylevel': 0.6, 'reg_alpha': 1.0785862942598525, 'reg_lambda': 9.93310560893105e-05, 'gamma': 2.7799985023797144e-05}. Best is trial 117 with value: -0.6588856402745613.
[I 2026-07-14 17:04:39,160] Trial 120 finished with value: -0.5247555395684096 and parameters: {'scalers': 'standard', 'ratios': 'norm_ratio', 'imputers': 'none', 'n_estimators': 2100, 'learning_rate': 0.3599930011744955, 'max_depth': 9, 'min_child_weight': 1, 'subsample': 0.5, 'colsample_bytree': 1.0, 'colsample_bylevel': 0.6, 'reg_alpha': 1.4222991643353022, 'reg_lambda': 0.031779914202261894, 'gamma': 3.019078733169309e-05}. Best is trial 117 with value: -0.6588856402745613.
[I 2026-07-14 17:05:16,883] Trial 121 finished with value: -0.5008330295051233 and parameters: {'scalers': 'standard', 'ratios': 'norm_ratio', 'imputers': 'none', 'n_estimators': 1850, 'learning_rate': 0.35973378360367875, 'max_depth': 9, 'min_child_weight': 1, 'subsample': 0.5, 'colsample_bytree': 1.0, 'colsample_bylevel': 0.6, 'reg_alpha': 1.2857117741605568, 'reg_lambda': 0.029793922464651477, 'gamma': 3.2681093758153294e-05}. Best is trial 117 with value: -0.6588856402745613.
[I 2026-07-14 17:05:59,038] Trial 122 finished with value: -0.5109748934891907 and parameters: {'scalers': 'standard', 'ratios': 'norm_ratio', 'imputers': 'none', 'n_estimators': 2100, 'learning_rate': 0.36906956773546873, 'max_depth': 9, 'min_child_weight': 1, 'subsample': 0.5, 'colsample_bytree': 1.0, 'colsample_bylevel': 0.6, 'reg_alpha': 1.0913327574180807, 'reg_lambda': 0.030536897929964446, 'gamma': 1.0518744067511568e-06}. Best is trial 117 with value: -0.6588856402745613.
[I 2026-07-14 17:06:27,218] Trial 123 finished with value: -0.3063564065857118 and parameters: {'scalers': 'standard', 'ratios': 'norm_ratio', 'imputers': 'none', 'n_estimators': 2100, 'learning_rate': 0.37023175672963143, 'max_depth': 8, 'min_child_weight': 1, 'subsample': 1.0, 'colsample_bytree': 1.0, 'colsample_bylevel': 0.6, 'reg_alpha': 1.1753259457791927, 'reg_lambda': 0.02518858651616504, 'gamma': 1.0642823238678471e-06}. Best is trial 117 with value: -0.6588856402745613.
[I 2026-07-14 17:07:01,799] Trial 124 finished with value: -0.29993883261903465 and parameters: {'scalers': 'standard', 'ratios': 'norm_ratio', 'imputers': 'none', 'n_estimators': 2050, 'learning_rate': 0.3604363670095943, 'max_depth': 9, 'min_child_weight': 1, 'subsample': 1.0, 'colsample_bytree': 1.0, 'colsample_bylevel': 0.6, 'reg_alpha': 0.8426070618616591, 'reg_lambda': 0.03533446764609719, 'gamma': 6.312728069348635e-06}. Best is trial 117 with value: -0.6588856402745613.
[I 2026-07-14 17:07:32,484] Trial 125 finished with value: -0.18649681323484266 and parameters: {'scalers': 'standard', 'ratios': 'norm_ratio', 'imputers': 'none', 'n_estimators': 2050, 'learning_rate': 0.011205045562683116, 'max_depth': 8, 'min_child_weight': 1, 'subsample': 1.0, 'colsample_bytree': 0.9, 'colsample_bylevel': 0.6, 'reg_alpha': 0.25585722309688846, 'reg_lambda': 0.03078420511586609, 'gamma': 2.5821643788869364e-05}. Best is trial 117 with value: -0.6588856402745613.
[I 2026-07-14 17:08:11,515] Trial 126 finished with value: -0.4905033955496054 and parameters: {'scalers': 'standard', 'ratios': 'norm_ratio', 'imputers': 'none', 'n_estimators': 2050, 'learning_rate': 0.36844598326946937, 'max_depth': 9, 'min_child_weight': 1, 'subsample': 0.5, 'colsample_bytree': 0.9, 'colsample_bylevel': 0.6, 'reg_alpha': 0.7660492033598367, 'reg_lambda': 0.03409300251046958, 'gamma': 2.6503273308131023e-05}. Best is trial 117 with value: -0.6588856402745613.
[I 2026-07-14 17:08:38,379] Trial 127 finished with value: -0.31392334724458704 and parameters: {'scalers': 'standard', 'ratios': 'norm_ratio', 'imputers': 'none', 'n_estimators': 2100, 'learning_rate': 0.19923060031884968, 'max_depth': 9, 'min_child_weight': 1, 'subsample': 0.5, 'colsample_bytree': 0.9, 'colsample_bylevel': 0.7, 'reg_alpha': 0.2897848489749396, 'reg_lambda': 0.0359404925856715, 'gamma': 3.071405095304004e-05}. Best is trial 117 with value: -0.6588856402745613.
[I 2026-07-14 17:09:17,691] Trial 128 finished with value: -0.4770494630714128 and parameters: {'scalers': 'standard', 'ratios': 'norm_ratio', 'imputers': 'none', 'n_estimators': 2100, 'learning_rate': 0.3667479684511396, 'max_depth': 9, 'min_child_weight': 1, 'subsample': 0.5, 'colsample_bytree': 1.0, 'colsample_bylevel': 0.6, 'reg_alpha': 0.7532000826942554, 'reg_lambda': 6.070668864008045e-05, 'gamma': 3.0513413640235593e-05}. Best is trial 117 with value: -0.6588856402745613.
[I 2026-07-14 17:09:48,110] Trial 129 finished with value: -0.3742394715645512 and parameters: {'scalers': 'standard', 'ratios': 'norm_ratio', 'imputers': 'none', 'n_estimators': 2050, 'learning_rate': 0.3675283380525503, 'max_depth': 9, 'min_child_weight': 1, 'subsample': 0.5, 'colsample_bytree': 1.0, 'colsample_bylevel': 0.6, 'reg_alpha': 0.2771140086024078, 'reg_lambda': 7.69823846269995e-05, 'gamma': 2.8789579614379602e-05}. Best is trial 117 with value: -0.6588856402745613.
[I 2026-07-14 17:10:15,654] Trial 130 finished with value: -0.4009824850915186 and parameters: {'scalers': 'standard', 'ratios': 'norm_ratio', 'imputers': 'none', 'n_estimators': 2100, 'learning_rate': 0.3715719681406141, 'max_depth': 9, 'min_child_weight': 1, 'subsample': 0.5, 'colsample_bytree': 0.9, 'colsample_bylevel': 0.6, 'reg_alpha': 0.2884244685744475, 'reg_lambda': 4.8394464927144456e-05, 'gamma': 2.5735802441608217e-05}. Best is trial 117 with value: -0.6588856402745613.
[I 2026-07-14 17:10:44,837] Trial 131 finished with value: -0.30562789320571554 and parameters: {'scalers': 'standard', 'ratios': 'norm_ratio', 'imputers': 'none', 'n_estimators': 2050, 'learning_rate': 0.20326733260454316, 'max_depth': 9, 'min_child_weight': 1, 'subsample': 0.5, 'colsample_bytree': 1.0, 'colsample_bylevel': 0.6, 'reg_alpha': 0.27559745318103623, 'reg_lambda': 1.3667666138630003e-05, 'gamma': 6.807716951664839e-05}. Best is trial 117 with value: -0.6588856402745613.
[I 2026-07-14 17:11:13,748] Trial 132 finished with value: -0.31325934001285904 and parameters: {'scalers': 'standard', 'ratios': 'norm_ratio', 'imputers': 'none', 'n_estimators': 2250, 'learning_rate': 0.20244414099993155, 'max_depth': 9, 'min_child_weight': 1, 'subsample': 0.5, 'colsample_bytree': 0.9, 'colsample_bylevel': 0.6, 'reg_alpha': 0.24960525384911428, 'reg_lambda': 9.273094150268657e-06, 'gamma': 2.3191761906023402e-05}. Best is trial 117 with value: -0.6588856402745613.
[I 2026-07-14 17:11:52,242] Trial 133 finished with value: -0.3765703352339971 and parameters: {'scalers': 'standard', 'ratios': 'norm_ratio', 'imputers': 'none', 'n_estimators': 2150, 'learning_rate': 0.2021799945548574, 'max_depth': 9, 'min_child_weight': 1, 'subsample': 0.5, 'colsample_bytree': 1.0, 'colsample_bylevel': 0.6, 'reg_alpha': 0.7253052153135469, 'reg_lambda': 2.184488498313183e-05, 'gamma': 6.238179056039978e-05}. Best is trial 117 with value: -0.6588856402745613.
[I 2026-07-14 17:12:30,537] Trial 134 finished with value: -0.40417820963052126 and parameters: {'scalers': 'standard', 'ratios': 'norm_ratio', 'imputers': 'none', 'n_estimators': 2250, 'learning_rate': 0.21244772975663298, 'max_depth': 9, 'min_child_weight': 1, 'subsample': 0.5, 'colsample_bytree': 0.9, 'colsample_bylevel': 0.6, 'reg_alpha': 1.6050257245018593, 'reg_lambda': 0.048860439123015, 'gamma': 7.697129843994555e-05}. Best is trial 117 with value: -0.6588856402745613.
