[I 2026-07-14 19:53:09,741] Trial 90 finished with value: -0.11805098976474737 and parameters: {'scalers': 'none', 'ratios': 'log_ratio', 'imputers': 'none', 'n_estimators': 2400, 'learning_rate': 0.09685888262019181, 'max_depth': 12, 'min_child_weight': 1, 'subsample': 0.6, 'colsample_bytree': 0.5, 'colsample_bylevel': 0.7, 'reg_alpha': 0.013234245738039984, 'reg_lambda': 3.0991742986279296, 'gamma': 1.862808264478721e-05}. Best is trial 76 with value: -0.21268338311282475.
[I 2026-07-14 19:53:28,034] Trial 91 finished with value: -0.13336263317173147 and parameters: {'scalers': 'none', 'ratios': 'log_ratio', 'imputers': 'none', 'n_estimators': 2600, 'learning_rate': 0.09640616155716214, 'max_depth': 12, 'min_child_weight': 1, 'subsample': 0.6, 'colsample_bytree': 0.5, 'colsample_bylevel': 0.7, 'reg_alpha': 0.006889125418457377, 'reg_lambda': 48.43915851389475, 'gamma': 3.0545237727523736e-06}. Best is trial 76 with value: -0.21268338311282475.
[I 2026-07-14 19:53:45,151] Trial 92 finished with value: -0.13755506734380568 and parameters: {'scalers': 'none', 'ratios': 'log_ratio', 'imputers': 'none', 'n_estimators': 2400, 'learning_rate': 0.11351299079769485, 'max_depth': 12, 'min_child_weight': 1, 'subsample': 0.6, 'colsample_bytree': 0.5, 'colsample_bylevel': 0.7, 'reg_alpha': 0.008125277740265472, 'reg_lambda': 49.022225093822435, 'gamma': 2.770608459499837e-06}. Best is trial 76 with value: -0.21268338311282475.
[I 2026-07-14 19:54:05,991] Trial 93 finished with value: -0.12376550510867537 and parameters: {'scalers': 'none', 'ratios': 'log_ratio', 'imputers': 'none', 'n_estimators': 2750, 'learning_rate': 0.1013056640013924, 'max_depth': 12, 'min_child_weight': 1, 'subsample': 0.6, 'colsample_bytree': 0.5, 'colsample_bylevel': 0.7, 'reg_alpha': 0.005856437258906418, 'reg_lambda': 3.1756899735330095, 'gamma': 2.9620160230935556e-06}. Best is trial 76 with value: -0.21268338311282475.
[I 2026-07-14 19:54:25,890] Trial 94 finished with value: -0.1452416507501007 and parameters: {'scalers': 'robust', 'ratios': 'log_ratio', 'imputers': 'none', 'n_estimators': 2750, 'learning_rate': 0.0937213036219158, 'max_depth': 12, 'min_child_weight': 1, 'subsample': 0.5, 'colsample_bytree': 0.5, 'colsample_bylevel': 0.7, 'reg_alpha': 0.06484123682631336, 'reg_lambda': 30.25288418159442, 'gamma': 3.467719422872665e-06}. Best is trial 76 with value: -0.21268338311282475.
[I 2026-07-14 19:54:43,454] Trial 95 finished with value: -0.14996743915636854 and parameters: {'scalers': 'robust', 'ratios': 'log_ratio', 'imputers': 'none', 'n_estimators': 2400, 'learning_rate': 0.11125860762088119, 'max_depth': 12, 'min_child_weight': 1, 'subsample': 0.5, 'colsample_bytree': 0.5, 'colsample_bylevel': 0.7, 'reg_alpha': 0.10529152779637724, 'reg_lambda': 32.85601589613675, 'gamma': 3.1739308835199377e-06}. Best is trial 76 with value: -0.21268338311282475.
[I 2026-07-14 19:55:01,834] Trial 96 finished with value: -0.12081952239228524 and parameters: {'scalers': 'robust', 'ratios': 'log_ratio', 'imputers': 'none', 'n_estimators': 2400, 'learning_rate': 0.06620326045167065, 'max_depth': 12, 'min_child_weight': 1, 'subsample': 0.5, 'colsample_bytree': 0.5, 'colsample_bylevel': 0.7, 'reg_alpha': 0.0331860644399069, 'reg_lambda': 38.61613833560361, 'gamma': 3.4511407041000428e-06}. Best is trial 76 with value: -0.21268338311282475.
[I 2026-07-14 19:55:21,882] Trial 97 finished with value: -0.12482290050213886 and parameters: {'scalers': 'robust', 'ratios': 'log_ratio', 'imputers': 'none', 'n_estimators': 2650, 'learning_rate': 0.06539270774211725, 'max_depth': 12, 'min_child_weight': 1, 'subsample': 0.5, 'colsample_bytree': 0.5, 'colsample_bylevel': 0.7, 'reg_alpha': 0.07935835544562635, 'reg_lambda': 33.9536719123046, 'gamma': 3.7107537180370545e-06}. Best is trial 76 with value: -0.21268338311282475.
[I 2026-07-14 19:55:40,570] Trial 98 finished with value: -0.16121337539380365 and parameters: {'scalers': 'robust', 'ratios': 'log_ratio', 'imputers': 'none', 'n_estimators': 2650, 'learning_rate': 0.1292652265427961, 'max_depth': 12, 'min_child_weight': 1, 'subsample': 0.5, 'colsample_bytree': 0.5, 'colsample_bylevel': 0.7, 'reg_alpha': 0.10146919981954362, 'reg_lambda': 45.32385505653125, 'gamma': 3.5785895106911808e-06}. Best is trial 76 with value: -0.21268338311282475.
[I 2026-07-14 19:55:58,697] Trial 99 finished with value: -0.17393468616511867 and parameters: {'scalers': 'robust', 'ratios': 'log_ratio', 'imputers': 'none', 'n_estimators': 2650, 'learning_rate': 0.13791157939525547, 'max_depth': 12, 'min_child_weight': 1, 'subsample': 0.5, 'colsample_bytree': 0.5, 'colsample_bylevel': 0.7, 'reg_alpha': 0.07779275736408212, 'reg_lambda': 66.0381822000142, 'gamma': 3.7883393682608737e-06}. Best is trial 76 with value: -0.21268338311282475.
[I 2026-07-14 19:56:15,778] Trial 100 finished with value: -0.12352503313737227 and parameters: {'scalers': 'robust', 'ratios': 'log_ratio', 'imputers': 'none', 'n_estimators': 2650, 'learning_rate': 0.07238256849615522, 'max_depth': 12, 'min_child_weight': 1, 'subsample': 0.5, 'colsample_bytree': 0.5, 'colsample_bylevel': 0.7, 'reg_alpha': 0.10077369364150689, 'reg_lambda': 98.6195432376667, 'gamma': 4.084081555670856e-06}. Best is trial 76 with value: -0.21268338311282475.
[I 2026-07-14 19:56:29,839] Trial 101 finished with value: -0.08179152998668117 and parameters: {'scalers': 'robust', 'ratios': 'log_ratio', 'imputers': 'none', 'n_estimators': 2650, 'learning_rate': 0.07002568665922523, 'max_depth': 12, 'min_child_weight': 2, 'subsample': 0.5, 'colsample_bytree': 0.5, 'colsample_bylevel': 0.7, 'reg_alpha': 0.0627973935893234, 'reg_lambda': 97.82900383816799, 'gamma': 1.0267531126712523e-05}. Best is trial 76 with value: -0.21268338311282475.
[I 2026-07-14 19:56:45,110] Trial 102 finished with value: -0.07995181737364127 and parameters: {'scalers': 'none', 'ratios': 'log_ratio', 'imputers': 'none', 'n_estimators': 2650, 'learning_rate': 0.062444378950798116, 'max_depth': 12, 'min_child_weight': 2, 'subsample': 0.5, 'colsample_bytree': 0.5, 'colsample_bylevel': 0.8, 'reg_alpha': 0.0010463792904792575, 'reg_lambda': 93.1165927032951, 'gamma': 1.0965945534961775e-05}. Best is trial 76 with value: -0.21268338311282475.
[I 2026-07-14 19:57:01,228] Trial 103 finished with value: -0.07339014657673325 and parameters: {'scalers': 'none', 'ratios': 'log_ratio', 'imputers': 'none', 'n_estimators': 2650, 'learning_rate': 0.05990660531422093, 'max_depth': 12, 'min_child_weight': 2, 'subsample': 0.6, 'colsample_bytree': 0.5, 'colsample_bylevel': 0.8, 'reg_alpha': 0.0031000353264556595, 'reg_lambda': 94.32675692525105, 'gamma': 4.461891714165836e-06}. Best is trial 76 with value: -0.21268338311282475.
[I 2026-07-14 19:57:17,304] Trial 104 finished with value: -0.09571857687989384 and parameters: {'scalers': 'none', 'ratios': 'log_ratio', 'imputers': 'none', 'n_estimators': 2700, 'learning_rate': 0.12791134916298819, 'max_depth': 12, 'min_child_weight': 2, 'subsample': 0.6, 'colsample_bytree': 0.5, 'colsample_bylevel': 0.8, 'reg_alpha': 0.0010525318237935418, 'reg_lambda': 99.65336278422492, 'gamma': 1.1060505991456795e-05}. Best is trial 76 with value: -0.21268338311282475.
[I 2026-07-14 19:57:34,925] Trial 105 finished with value: -0.11623358891374061 and parameters: {'scalers': 'none', 'ratios': 'log_ratio', 'imputers': 'none', 'n_estimators': 2650, 'learning_rate': 0.1929544866382741, 'max_depth': 12, 'min_child_weight': 2, 'subsample': 0.6, 'colsample_bytree': 0.5, 'colsample_bylevel': 0.8, 'reg_alpha': 0.002766768521087611, 'reg_lambda': 82.35039331137531, 'gamma': 8.332889447393966e-06}. Best is trial 76 with value: -0.21268338311282475.
[I 2026-07-14 19:57:52,063] Trial 106 finished with value: -0.11201359338976725 and parameters: {'scalers': 'robust', 'ratios': 'log_ratio', 'imputers': 'none', 'n_estimators': 2600, 'learning_rate': 0.198030116529525, 'max_depth': 12, 'min_child_weight': 2, 'subsample': 0.7, 'colsample_bytree': 0.5, 'colsample_bylevel': 0.8, 'reg_alpha': 0.0003161125364304367, 'reg_lambda': 98.28799832085848, 'gamma': 9.150981472794129e-06}. Best is trial 76 with value: -0.21268338311282475.
[I 2026-07-14 19:57:54,923] Trial 107 finished with value: -0.03835810727840044 and parameters: {'scalers': 'robust', 'ratios': 'log_ratio', 'imputers': 'none', 'n_estimators': 2650, 'learning_rate': 0.19376118583293983, 'max_depth': 3, 'min_child_weight': 2, 'subsample': 0.5, 'colsample_bytree': 0.6, 'colsample_bylevel': 0.8, 'reg_alpha': 0.642115805994384, 'reg_lambda': 99.32449030049746, 'gamma': 1.036160827256216e-05}. Best is trial 76 with value: -0.21268338311282475.
[I 2026-07-14 19:58:15,196] Trial 108 finished with value: -0.14912333889889476 and parameters: {'scalers': 'robust', 'ratios': 'log_ratio', 'imputers': 'none', 'n_estimators': 2700, 'learning_rate': 0.2744831549922329, 'max_depth': 12, 'min_child_weight': 2, 'subsample': 0.5, 'colsample_bytree': 0.5, 'colsample_bylevel': 0.8, 'reg_alpha': 0.0009875985383843507, 'reg_lambda': 23.23098281752427, 'gamma': 1.0299355939102232e-05}. Best is trial 76 with value: -0.21268338311282475.
[I 2026-07-14 19:58:31,982] Trial 109 finished with value: -0.11182315055497483 and parameters: {'scalers': 'robust', 'ratios': 'log_ratio', 'imputers': 'none', 'n_estimators': 2700, 'learning_rate': 0.19398621437858415, 'max_depth': 12, 'min_child_weight': 2, 'subsample': 0.7, 'colsample_bytree': 0.5, 'colsample_bylevel': 0.8, 'reg_alpha': 1.1434930093117568, 'reg_lambda': 21.628786448250032, 'gamma': 9.08033498327316e-06}. Best is trial 76 with value: -0.21268338311282475.
[I 2026-07-14 19:58:52,647] Trial 110 finished with value: -0.11478960706600284 and parameters: {'scalers': 'robust', 'ratios': 'log_ratio', 'imputers': 'none', 'n_estimators': 2800, 'learning_rate': 0.19307840841372814, 'max_depth': 12, 'min_child_weight': 2, 'subsample': 0.7, 'colsample_bytree': 0.5, 'colsample_bylevel': 0.8, 'reg_alpha': 0.24820297657118973, 'reg_lambda': 22.239780555425018, 'gamma': 7.1648080828688575e-06}. Best is trial 76 with value: -0.21268338311282475.
[I 2026-07-14 19:59:14,778] Trial 111 finished with value: -0.13415053838469904 and parameters: {'scalers': 'robust', 'ratios': 'log_ratio', 'imputers': 'none', 'n_estimators': 2800, 'learning_rate': 0.2756860360314478, 'max_depth': 12, 'min_child_weight': 2, 'subsample': 0.7, 'colsample_bytree': 0.5, 'colsample_bylevel': 0.7, 'reg_alpha': 0.0002959151284611071, 'reg_lambda': 21.388189288499042, 'gamma': 6.949234161439162e-06}. Best is trial 76 with value: -0.21268338311282475.
[I 2026-07-14 19:59:22,210] Trial 112 finished with value: -0.053744959872858745 and parameters: {'scalers': 'robust', 'ratios': 'log_ratio', 'imputers': 'none', 'n_estimators': 2800, 'learning_rate': 0.19486903901265376, 'max_depth': 4, 'min_child_weight': 1, 'subsample': 0.7, 'colsample_bytree': 0.6, 'colsample_bylevel': 0.7, 'reg_alpha': 0.43250677468308807, 'reg_lambda': 23.45148589361291, 'gamma': 7.420629817680268e-06}. Best is trial 76 with value: -0.21268338311282475.
[I 2026-07-14 19:59:27,752] Trial 113 finished with value: -0.04288374540614 and parameters: {'scalers': 'robust', 'ratios': 'log_ratio', 'imputers': 'none', 'n_estimators': 2800, 'learning_rate': 0.27160184279605354, 'max_depth': 3, 'min_child_weight': 1, 'subsample': 0.7, 'colsample_bytree': 0.6, 'colsample_bylevel': 0.7, 'reg_alpha': 0.4208336289296075, 'reg_lambda': 15.894659231981755, 'gamma': 1.6537305021272072e-06}. Best is trial 76 with value: -0.21268338311282475.
[I 2026-07-14 19:59:57,128] Trial 114 finished with value: -0.2111085374958819 and parameters: {'scalers': 'robust', 'ratios': 'log_ratio', 'imputers': 'none', 'n_estimators': 2800, 'learning_rate': 0.2778074286537764, 'max_depth': 12, 'min_child_weight': 1, 'subsample': 0.7, 'colsample_bytree': 0.6, 'colsample_bylevel': 0.7, 'reg_alpha': 0.402972545788248, 'reg_lambda': 21.519204439285268, 'gamma': 5.920289076003339e-05}. Best is trial 76 with value: -0.21268338311282475.
[I 2026-07-14 20:00:07,570] Trial 115 finished with value: -0.115488305360714 and parameters: {'scalers': 'robust', 'ratios': 'log_ratio', 'imputers': 'none', 'n_estimators': 2800, 'learning_rate': 0.27495294988023816, 'max_depth': 6, 'min_child_weight': 1, 'subsample': 0.7, 'colsample_bytree': 0.5, 'colsample_bylevel': 0.7, 'reg_alpha': 0.024310252080342324, 'reg_lambda': 19.93448982892308, 'gamma': 3.6943630312573676e-05}. Best is trial 76 with value: -0.21268338311282475.
[I 2026-07-14 20:00:18,560] Trial 116 finished with value: -0.08060279476372409 and parameters: {'scalers': 'robust', 'ratios': 'log_ratio', 'imputers': 'none', 'n_estimators': 2800, 'learning_rate': 0.1340183574476798, 'max_depth': 6, 'min_child_weight': 1, 'subsample': 0.7, 'colsample_bytree': 0.6, 'colsample_bylevel': 0.7, 'reg_alpha': 0.022747531685874737, 'reg_lambda': 22.24603918058899, 'gamma': 1.773071185158624e-06}. Best is trial 76 with value: -0.21268338311282475.
[I 2026-07-14 20:00:31,376] Trial 117 finished with value: -0.11105113389399637 and parameters: {'scalers': 'none', 'ratios': 'log_ratio', 'imputers': 'none', 'n_estimators': 2800, 'learning_rate': 0.261982492114879, 'max_depth': 6, 'min_child_weight': 1, 'subsample': 0.7, 'colsample_bytree': 0.6, 'colsample_bylevel': 0.7, 'reg_alpha': 0.28149051240512285, 'reg_lambda': 56.937218476466484, 'gamma': 3.276400834525705e-05}. Best is trial 76 with value: -0.21268338311282475.
[I 2026-07-14 20:00:39,721] Trial 118 finished with value: -0.07995178338218485 and parameters: {'scalers': 'none', 'ratios': 'log_ratio', 'imputers': 'none', 'n_estimators': 2300, 'learning_rate': 0.13265979900907934, 'max_depth': 6, 'min_child_weight': 1, 'subsample': 0.6, 'colsample_bytree': 0.5, 'colsample_bylevel': 0.7, 'reg_alpha': 0.004006357060111607, 'reg_lambda': 59.82362481477518, 'gamma': 1.7083747479269903e-06}. Best is trial 76 with value: -0.21268338311282475.
[I 2026-07-14 20:00:57,089] Trial 119 finished with value: -0.15064058428837668 and parameters: {'scalers': 'none', 'ratios': 'log_ratio', 'imputers': 'none', 'n_estimators': 2550, 'learning_rate': 0.13813079086127888, 'max_depth': 11, 'min_child_weight': 1, 'subsample': 0.6, 'colsample_bytree': 0.5, 'colsample_bylevel': 0.7, 'reg_alpha': 0.0039318691794865065, 'reg_lambda': 63.019511873314435, 'gamma': 1.9100581530744795e-06}. Best is trial 76 with value: -0.21268338311282475.
[I 2026-07-14 20:01:12,022] Trial 120 finished with value: -0.1458582597621498 and parameters: {'scalers': 'none', 'ratios': 'log_ratio', 'imputers': 'none', 'n_estimators': 2150, 'learning_rate': 0.1450551935342564, 'max_depth': 11, 'min_child_weight': 1, 'subsample': 0.6, 'colsample_bytree': 0.5, 'colsample_bylevel': 0.7, 'reg_alpha': 0.02991508438498895, 'reg_lambda': 60.673133246495816, 'gamma': 1.8694971105644477e-06}. Best is trial 76 with value: -0.21268338311282475.
[I 2026-07-14 20:01:26,596] Trial 121 finished with value: -0.14014691889995978 and parameters: {'scalers': 'none', 'ratios': 'log_ratio', 'imputers': 'none', 'n_estimators': 2150, 'learning_rate': 0.1400269032109147, 'max_depth': 11, 'min_child_weight': 1, 'subsample': 0.6, 'colsample_bytree': 0.5, 'colsample_bylevel': 0.7, 'reg_alpha': 0.022613937984457936, 'reg_lambda': 60.55362016821521, 'gamma': 2.0362917116646104e-06}. Best is trial 76 with value: -0.21268338311282475.
[I 2026-07-14 20:01:57,095] Trial 122 finished with value: -0.3173209406195531 and parameters: {'scalers': 'none', 'ratios': 'log_ratio', 'imputers': 'none', 'n_estimators': 2950, 'learning_rate': 0.40150220675312803, 'max_depth': 11, 'min_child_weight': 1, 'subsample': 0.7, 'colsample_bytree': 0.6, 'colsample_bylevel': 0.7, 'reg_alpha': 0.021674827891467296, 'reg_lambda': 54.594021983090386, 'gamma': 5.770019074645074e-05}. Best is trial 122 with value: -0.3173209406195531.
[I 2026-07-14 20:02:20,377] Trial 125 finished with value: -0.02979601215574675 and parameters: {'scalers': 'none', 'ratios': 'log_ratio', 'imputers': 'none', 'n_estimators': 100, 'learning_rate': 0.14680962789964366, 'max_depth': 11, 'min_child_weight': 1, 'subsample': 0.7, 'colsample_bytree': 0.5, 'colsample_bylevel': 0.6, 'reg_alpha': 5.426040152697195, 'reg_lambda': 6.198172618910159, 'gamma': 7.974495282779438e-05}. Best is trial 122 with value: -0.3173209406195531.
[I 2026-07-14 20:02:20,475] Trial 123 finished with value: -0.14294539589763522 and parameters: {'scalers': 'none', 'ratios': 'log_ratio', 'imputers': 'none', 'n_estimators': 2950, 'learning_rate': 0.1406917932823763, 'max_depth': 11, 'min_child_weight': 1, 'subsample': 0.7, 'colsample_bytree': 0.6, 'colsample_bylevel': 0.6, 'reg_alpha': 0.19191491314986395, 'reg_lambda': 6.837303844738308, 'gamma': 8.164607806161209e-05}. Best is trial 122 with value: -0.3173209406195531.
[I 2026-07-14 20:02:21,570] Trial 124 finished with value: -0.12856310787076636 and parameters: {'scalers': 'none', 'ratios': 'log_ratio', 'imputers': 'none', 'n_estimators': 250, 'learning_rate': 0.41587144535423887, 'max_depth': 11, 'min_child_weight': 1, 'subsample': 0.7, 'colsample_bytree': 0.5, 'colsample_bylevel': 0.6, 'reg_alpha': 0.0015224890103451812, 'reg_lambda': 51.06124357673536, 'gamma': 1.4402800023017153e-06}. Best is trial 122 with value: -0.3173209406195531.
[I 2026-07-14 20:02:36,748] Trial 126 finished with value: -0.17456891299000765 and parameters: {'scalers': 'none', 'ratios': 'log_ratio', 'imputers': 'none', 'n_estimators': 2550, 'learning_rate': 0.38452927278947535, 'max_depth': 11, 'min_child_weight': 1, 'subsample': 0.7, 'colsample_bytree': 0.7, 'colsample_bylevel': 0.6, 'reg_alpha': 2.9706454023017406, 'reg_lambda': 5.7077920447846475, 'gamma': 1.1298310616803713e-06}. Best is trial 122 with value: -0.3173209406195531.
[I 2026-07-14 20:02:42,720] Trial 127 finished with value: -0.02736589914702242 and parameters: {'scalers': 'none', 'ratios': 'log_ratio', 'imputers': 'median', 'n_estimators': 2950, 'learning_rate': 0.0007060109816312047, 'max_depth': 11, 'min_child_weight': 1, 'subsample': 0.7, 'colsample_bytree': 0.5, 'colsample_bylevel': 0.6, 'reg_alpha': 12.845921565482513, 'reg_lambda': 5.997999696635168, 'gamma': 5.9359196453799265e-05}. Best is trial 122 with value: -0.3173209406195531.
[I 2026-07-14 20:03:09,700] Trial 128 finished with value: -0.21777940355616182 and parameters: {'scalers': 'none', 'ratios': 'log_ratio', 'imputers': 'none', 'n_estimators': 2450, 'learning_rate': 0.4002797674612444, 'max_depth': 12, 'min_child_weight': 1, 'subsample': 0.7, 'colsample_bytree': 0.7, 'colsample_bylevel': 0.6, 'reg_alpha': 0.0015800360400984148, 'reg_lambda': 5.767921276129061, 'gamma': 1.2334315899273766e-06}. Best is trial 122 with value: -0.3173209406195531.
[I 2026-07-14 20:03:43,617] Trial 129 finished with value: -0.2359498709940485 and parameters: {'scalers': 'none', 'ratios': 'log_ratio', 'imputers': 'none', 'n_estimators': 2950, 'learning_rate': 0.41112340421607335, 'max_depth': 12, 'min_child_weight': 1, 'subsample': 0.7, 'colsample_bytree': 0.7, 'colsample_bylevel': 0.6, 'reg_alpha': 0.001651613600834331, 'reg_lambda': 8.138358054584184, 'gamma': 1.0155730650953618e-06}. Best is trial 122 with value: -0.3173209406195531.
[I 2026-07-14 20:04:12,722] Trial 130 finished with value: -0.23106531268608582 and parameters: {'scalers': 'none', 'ratios': 'log_ratio', 'imputers': 'none', 'n_estimators': 2950, 'learning_rate': 0.3987274110493857, 'max_depth': 11, 'min_child_weight': 1, 'subsample': 0.7, 'colsample_bytree': 0.6, 'colsample_bylevel': 0.6, 'reg_alpha': 0.1558428159073774, 'reg_lambda': 6.742296101983869, 'gamma': 6.191099110420642e-05}. Best is trial 122 with value: -0.3173209406195531.
[I 2026-07-14 20:04:48,217] Trial 131 finished with value: -0.23814273094722263 and parameters: {'scalers': 'none', 'ratios': 'log_ratio', 'imputers': 'median', 'n_estimators': 2950, 'learning_rate': 0.3953133453106459, 'max_depth': 12, 'min_child_weight': 1, 'subsample': 0.7, 'colsample_bytree': 0.7, 'colsample_bylevel': 0.6, 'reg_alpha': 0.14971673332662158, 'reg_lambda': 13.730058686197864, 'gamma': 1.0279946319077896e-06}. Best is trial 122 with value: -0.3173209406195531.
[I 2026-07-14 20:05:23,455] Trial 132 finished with value: -0.2569317204981246 and parameters: {'scalers': 'none', 'ratios': 'log_ratio', 'imputers': 'median', 'n_estimators': 2900, 'learning_rate': 0.43198784187060657, 'max_depth': 12, 'min_child_weight': 1, 'subsample': 0.7, 'colsample_bytree': 0.7, 'colsample_bylevel': 0.6, 'reg_alpha': 0.0017453894684908927, 'reg_lambda': 14.012875817560857, 'gamma': 0.00041908660521077726}. Best is trial 122 with value: -0.3173209406195531.
[I 2026-07-14 20:05:26,386] Trial 133 finished with value: -0.03256350668932519 and parameters: {'scalers': 'none', 'ratios': 'log_ratio', 'imputers': 'median', 'n_estimators': 2900, 'learning_rate': 0.40340307908062334, 'max_depth': 12, 'min_child_weight': 1, 'subsample': 0.7, 'colsample_bytree': 0.6, 'colsample_bylevel': 0.6, 'reg_alpha': 43.0506488709521, 'reg_lambda': 38.19505102620818, 'gamma': 1.040229412224496e-06}. Best is trial 122 with value: -0.3173209406195531.
[I 2026-07-14 20:05:29,622] Trial 134 finished with value: -0.029897361860497504 and parameters: {'scalers': 'none', 'ratios': 'log_ratio', 'imputers': 'none', 'n_estimators': 2900, 'learning_rate': 0.3818767243770187, 'max_depth': 12, 'min_child_weight': 1, 'subsample': 0.7, 'colsample_bytree': 0.7, 'colsample_bylevel': 0.6, 'reg_alpha': 14.926948373629017, 'reg_lambda': 12.681617596008806, 'gamma': 1.1114683671810198e-06}. Best is trial 122 with value: -0.3173209406195531.
