[I 2026-07-14 16:32:32,199] A new study created in RDB with name: my-study
[I 2026-07-14 16:32:46,642] Trial 0 finished with value: -0.11069447587347964 and parameters: {'scalers': 'standard', 'ratios': 'norm_ratio', 'imputers': 'mean', 'n_estimators': 950, 'learning_rate': 0.007345107964578437, 'max_depth': 6, 'min_child_weight': 6, 'subsample': 0.5, 'colsample_bytree': 1.0, 'colsample_bylevel': 1.0, 'reg_alpha': 1.6115489528642566, 'reg_lambda': 1.3159685815328776e-05, 'gamma': 1.4537402441504419e-05}. Best is trial 0 with value: -0.11069447587347964.
[I 2026-07-14 16:32:47,533] Trial 1 finished with value: -0.3749941374876557 and parameters: {'scalers': 'robust', 'ratios': 'log_ratio', 'imputers': 'median', 'n_estimators': 300, 'learning_rate': 0.00032636677809681655, 'max_depth': 3, 'min_child_weight': 6, 'subsample': 1.0, 'colsample_bytree': 0.7, 'colsample_bylevel': 0.9, 'reg_alpha': 52.69937965481381, 'reg_lambda': 0.0030235645277688077, 'gamma': 0.001584879306375464}. Best is trial 1 with value: -0.3749941374876557.
[I 2026-07-14 16:32:49,427] Trial 2 finished with value: -0.16570371704809167 and parameters: {'scalers': 'standard', 'ratios': 'log_ratio', 'imputers': 'mean', 'n_estimators': 1200, 'learning_rate': 0.037975942707060305, 'max_depth': 3, 'min_child_weight': 7, 'subsample': 0.5, 'colsample_bytree': 0.7, 'colsample_bylevel': 0.9, 'reg_alpha': 25.004064356609167, 'reg_lambda': 4.156602250255392e-06, 'gamma': 0.16945059112408334}. Best is trial 1 with value: -0.3749941374876557.
[I 2026-07-14 16:32:52,941] Trial 3 finished with value: -0.16861263993883244 and parameters: {'scalers': 'robust', 'ratios': 'norm_ratio', 'imputers': 'mean', 'n_estimators': 1700, 'learning_rate': 0.011099945951219083, 'max_depth': 11, 'min_child_weight': 7, 'subsample': 0.7, 'colsample_bytree': 1.0, 'colsample_bylevel': 0.6, 'reg_alpha': 21.36611263766583, 'reg_lambda': 0.2314679346428982, 'gamma': 0.8753108812386718}. Best is trial 1 with value: -0.3749941374876557.
[I 2026-07-14 16:32:56,389] Trial 4 finished with value: -0.10098582116085833 and parameters: {'scalers': 'none', 'ratios': 'norm_ratio', 'imputers': 'mean', 'n_estimators': 900, 'learning_rate': 0.055019115718947, 'max_depth': 3, 'min_child_weight': 9, 'subsample': 1.0, 'colsample_bytree': 0.9, 'colsample_bylevel': 0.8, 'reg_alpha': 6.056015681631954e-05, 'reg_lambda': 59.20762625973837, 'gamma': 2.032394509150864e-06}. Best is trial 1 with value: -0.3749941374876557.
[I 2026-07-14 16:33:02,312] Trial 5 finished with value: -0.11114202229240393 and parameters: {'scalers': 'none', 'ratios': 'log_ratio', 'imputers': 'none', 'n_estimators': 600, 'learning_rate': 0.05492693568219647, 'max_depth': 7, 'min_child_weight': 1, 'subsample': 0.5, 'colsample_bytree': 0.8, 'colsample_bylevel': 0.9, 'reg_alpha': 0.0010519220217705843, 'reg_lambda': 5.027701895422226e-06, 'gamma': 0.004211951562225966}. Best is trial 1 with value: -0.3749941374876557.
[I 2026-07-14 16:33:13,962] Trial 6 finished with value: -0.31623653494584875 and parameters: {'scalers': 'robust', 'ratios': 'log_ratio', 'imputers': 'none', 'n_estimators': 1250, 'learning_rate': 0.0003048171747757569, 'max_depth': 9, 'min_child_weight': 1, 'subsample': 0.7, 'colsample_bytree': 0.7, 'colsample_bylevel': 1.0, 'reg_alpha': 0.0008847108047997491, 'reg_lambda': 0.07989779564842271, 'gamma': 1.0066527227230988}. Best is trial 1 with value: -0.3749941374876557.
[I 2026-07-14 16:33:16,631] Trial 7 finished with value: -0.17380494885300807 and parameters: {'scalers': 'none', 'ratios': 'log_ratio', 'imputers': 'median', 'n_estimators': 1800, 'learning_rate': 0.11914287525781127, 'max_depth': 5, 'min_child_weight': 9, 'subsample': 0.5, 'colsample_bytree': 0.5, 'colsample_bylevel': 0.9, 'reg_alpha': 42.822438710320114, 'reg_lambda': 0.05205269140449207, 'gamma': 2.070488915915359e-06}. Best is trial 1 with value: -0.3749941374876557.
[I 2026-07-14 16:33:18,867] Trial 8 finished with value: -0.3430536748057071 and parameters: {'scalers': 'standard', 'ratios': 'log_ratio', 'imputers': 'none', 'n_estimators': 500, 'learning_rate': 0.000571893473516039, 'max_depth': 12, 'min_child_weight': 3, 'subsample': 1.0, 'colsample_bytree': 1.0, 'colsample_bylevel': 0.8, 'reg_alpha': 90.49486056064191, 'reg_lambda': 0.00017517735573294844, 'gamma': 0.0028117175549944706}. Best is trial 1 with value: -0.3749941374876557.
[I 2026-07-14 16:33:24,250] Trial 9 finished with value: -0.1163129362111484 and parameters: {'scalers': 'none', 'ratios': 'norm_ratio', 'imputers': 'mean', 'n_estimators': 2700, 'learning_rate': 0.10246578179495262, 'max_depth': 6, 'min_child_weight': 8, 'subsample': 0.9, 'colsample_bytree': 0.6, 'colsample_bylevel': 0.7, 'reg_alpha': 0.017425098053453037, 'reg_lambda': 0.0004199687092017033, 'gamma': 1.0093609806542827}. Best is trial 1 with value: -0.3749941374876557.
[I 2026-07-14 16:33:35,477] Trial 10 finished with value: -0.12682803836324713 and parameters: {'scalers': 'standard', 'ratios': 'log_ratio', 'imputers': 'none', 'n_estimators': 2550, 'learning_rate': 0.003922287306473965, 'max_depth': 11, 'min_child_weight': 5, 'subsample': 1.0, 'colsample_bytree': 0.7, 'colsample_bylevel': 0.8, 'reg_alpha': 3.8581816649449665e-05, 'reg_lambda': 5.844510520495544, 'gamma': 1.1048224523620347}. Best is trial 1 with value: -0.3749941374876557.
[I 2026-07-14 16:33:38,744] Trial 11 finished with value: -0.1047251780737005 and parameters: {'scalers': 'robust', 'ratios': 'log_ratio', 'imputers': 'none', 'n_estimators': 1300, 'learning_rate': 0.11546682822683958, 'max_depth': 3, 'min_child_weight': 4, 'subsample': 0.5, 'colsample_bytree': 0.5, 'colsample_bylevel': 0.9, 'reg_alpha': 7.741407467468667e-06, 'reg_lambda': 0.9515466190551665, 'gamma': 0.07290910065177356}. Best is trial 1 with value: -0.3749941374876557.
[I 2026-07-14 16:33:41,713] Trial 12 finished with value: -0.1603595505378709 and parameters: {'scalers': 'robust', 'ratios': 'norm_ratio', 'imputers': 'mean', 'n_estimators': 1350, 'learning_rate': 0.004820356540939174, 'max_depth': 3, 'min_child_weight': 6, 'subsample': 0.8, 'colsample_bytree': 0.8, 'colsample_bylevel': 0.6, 'reg_alpha': 0.005983071852178257, 'reg_lambda': 2.892892622956275e-06, 'gamma': 6.671777749543155}. Best is trial 1 with value: -0.3749941374876557.
[I 2026-07-14 16:33:57,808] Trial 13 finished with value: -0.16288793539546195 and parameters: {'scalers': 'standard', 'ratios': 'log_ratio', 'imputers': 'mean', 'n_estimators': 2100, 'learning_rate': 0.001123476388532618, 'max_depth': 9, 'min_child_weight': 4, 'subsample': 0.8, 'colsample_bytree': 0.9, 'colsample_bylevel': 0.8, 'reg_alpha': 12.997435541269956, 'reg_lambda': 0.002063612553150387, 'gamma': 4.8917652148291535e-06}. Best is trial 1 with value: -0.3749941374876557.
[I 2026-07-14 16:34:01,827] Trial 14 finished with value: -0.18622865090966562 and parameters: {'scalers': 'standard', 'ratios': 'log_ratio', 'imputers': 'none', 'n_estimators': 2200, 'learning_rate': 0.02163074604647371, 'max_depth': 10, 'min_child_weight': 2, 'subsample': 1.0, 'colsample_bytree': 0.5, 'colsample_bylevel': 0.7, 'reg_alpha': 1.1999192820822956e-06, 'reg_lambda': 1.4241708352505706e-06, 'gamma': 17.22234449627357}. Best is trial 1 with value: -0.3749941374876557.
[I 2026-07-14 16:34:06,779] Trial 15 finished with value: -0.2064408050317692 and parameters: {'scalers': 'robust', 'ratios': 'norm_ratio', 'imputers': 'none', 'n_estimators': 2400, 'learning_rate': 0.004397461177188466, 'max_depth': 11, 'min_child_weight': 5, 'subsample': 1.0, 'colsample_bytree': 0.6, 'colsample_bylevel': 1.0, 'reg_alpha': 48.04868195278434, 'reg_lambda': 0.00036579109553013217, 'gamma': 7.514477898276863}. Best is trial 1 with value: -0.3749941374876557.
[I 2026-07-14 16:34:11,149] Trial 16 finished with value: -0.25956923441311114 and parameters: {'scalers': 'none', 'ratios': 'log_ratio', 'imputers': 'median', 'n_estimators': 1450, 'learning_rate': 0.0007297931622917804, 'max_depth': 7, 'min_child_weight': 7, 'subsample': 1.0, 'colsample_bytree': 0.6, 'colsample_bylevel': 0.6, 'reg_alpha': 2.480237044286163, 'reg_lambda': 0.8984952767991985, 'gamma': 4.308970147967584}. Best is trial 1 with value: -0.3749941374876557.
[I 2026-07-14 16:34:16,140] Trial 17 finished with value: -0.37634403618591616 and parameters: {'scalers': 'robust', 'ratios': 'log_ratio', 'imputers': 'median', 'n_estimators': 2900, 'learning_rate': 0.00010500177750061582, 'max_depth': 9, 'min_child_weight': 4, 'subsample': 0.8, 'colsample_bytree': 0.5, 'colsample_bylevel': 0.5, 'reg_alpha': 1.164014702025491e-06, 'reg_lambda': 19.848862359360446, 'gamma': 96.13885464798784}. Best is trial 17 with value: -0.37634403618591616.
[I 2026-07-14 16:34:17,866] Trial 18 finished with value: -0.38379483697174016 and parameters: {'scalers': 'robust', 'ratios': 'log_ratio', 'imputers': 'median', 'n_estimators': 150, 'learning_rate': 0.00018258267608135237, 'max_depth': 9, 'min_child_weight': 4, 'subsample': 0.9, 'colsample_bytree': 0.9, 'colsample_bylevel': 0.5, 'reg_alpha': 0.5310203520909335, 'reg_lambda': 0.0008928457894917718, 'gamma': 0.001204004760576523}. Best is trial 18 with value: -0.38379483697174016.
[I 2026-07-14 16:34:19,307] Trial 19 finished with value: -0.38583729775068876 and parameters: {'scalers': 'robust', 'ratios': 'log_ratio', 'imputers': 'median', 'n_estimators': 100, 'learning_rate': 0.0001922877493570363, 'max_depth': 12, 'min_child_weight': 3, 'subsample': 0.9, 'colsample_bytree': 0.9, 'colsample_bylevel': 0.7, 'reg_alpha': 1.1356485627299882, 'reg_lambda': 0.0007825139146489237, 'gamma': 0.0008314574696526205}. Best is trial 19 with value: -0.38583729775068876.
[I 2026-07-14 16:34:21,529] Trial 20 finished with value: -0.38366968820346803 and parameters: {'scalers': 'standard', 'ratios': 'log_ratio', 'imputers': 'median', 'n_estimators': 150, 'learning_rate': 0.00018349520142694025, 'max_depth': 9, 'min_child_weight': 3, 'subsample': 0.9, 'colsample_bytree': 0.9, 'colsample_bylevel': 0.7, 'reg_alpha': 0.4518288280070368, 'reg_lambda': 0.0008004671916606499, 'gamma': 0.0006902432711656487}. Best is trial 19 with value: -0.38583729775068876.
[I 2026-07-14 16:34:23,963] Trial 21 finished with value: -0.3868398804153802 and parameters: {'scalers': 'robust', 'ratios': 'log_ratio', 'imputers': 'median', 'n_estimators': 150, 'learning_rate': 0.00010402981868621252, 'max_depth': 12, 'min_child_weight': 3, 'subsample': 1.0, 'colsample_bytree': 0.9, 'colsample_bylevel': 0.5, 'reg_alpha': 0.4135854158970182, 'reg_lambda': 0.0007902384998778897, 'gamma': 0.000592769462631635}. Best is trial 21 with value: -0.3868398804153802.
[I 2026-07-14 16:34:26,812] Trial 22 finished with value: -0.3856892761726433 and parameters: {'scalers': 'robust', 'ratios': 'log_ratio', 'imputers': 'median', 'n_estimators': 200, 'learning_rate': 0.00010047277643579018, 'max_depth': 12, 'min_child_weight': 3, 'subsample': 0.9, 'colsample_bytree': 0.9, 'colsample_bylevel': 0.5, 'reg_alpha': 0.563150015752037, 'reg_lambda': 0.00039423946344671926, 'gamma': 0.0004597524181873655}. Best is trial 21 with value: -0.3868398804153802.
[I 2026-07-14 16:34:27,615] Trial 23 finished with value: -0.38590941064454143 and parameters: {'scalers': 'robust', 'ratios': 'log_ratio', 'imputers': 'median', 'n_estimators': 100, 'learning_rate': 0.00019355320329574974, 'max_depth': 8, 'min_child_weight': 3, 'subsample': 0.9, 'colsample_bytree': 0.9, 'colsample_bylevel': 0.5, 'reg_alpha': 0.771450147173208, 'reg_lambda': 0.003592139076227164, 'gamma': 0.0004502981112980761}. Best is trial 21 with value: -0.3868398804153802.
[I 2026-07-14 16:34:28,823] Trial 24 finished with value: -0.38803344028462017 and parameters: {'scalers': 'standard', 'ratios': 'log_ratio', 'imputers': 'median', 'n_estimators': 100, 'learning_rate': 0.00011525307404732311, 'max_depth': 8, 'min_child_weight': 3, 'subsample': 0.9, 'colsample_bytree': 0.9, 'colsample_bylevel': 0.5, 'reg_alpha': 0.36987378361769363, 'reg_lambda': 0.00423991743454755, 'gamma': 0.0005427647804738669}. Best is trial 24 with value: -0.38803344028462017.
[I 2026-07-14 16:34:29,518] Trial 25 finished with value: -0.3863630879769851 and parameters: {'scalers': 'robust', 'ratios': 'log_ratio', 'imputers': 'median', 'n_estimators': 350, 'learning_rate': 0.0001790326469807283, 'max_depth': 5, 'min_child_weight': 10, 'subsample': 0.9, 'colsample_bytree': 0.6, 'colsample_bylevel': 0.5, 'reg_alpha': 0.1397816623294957, 'reg_lambda': 0.010029392788037161, 'gamma': 91.52990731507415}. Best is trial 24 with value: -0.38803344028462017.
[I 2026-07-14 16:34:35,287] Trial 26 finished with value: -0.36180414486811885 and parameters: {'scalers': 'robust', 'ratios': 'log_ratio', 'imputers': 'median', 'n_estimators': 2950, 'learning_rate': 0.00010782041508539518, 'max_depth': 8, 'min_child_weight': 3, 'subsample': 0.8, 'colsample_bytree': 0.9, 'colsample_bylevel': 0.5, 'reg_alpha': 0.07652730774228585, 'reg_lambda': 90.6391748473915, 'gamma': 68.24675842175121}. Best is trial 24 with value: -0.38803344028462017.
[I 2026-07-14 16:34:37,145] Trial 27 finished with value: -0.3871631922284405 and parameters: {'scalers': 'robust', 'ratios': 'log_ratio', 'imputers': 'median', 'n_estimators': 100, 'learning_rate': 0.00014605882005929243, 'max_depth': 12, 'min_child_weight': 2, 'subsample': 0.9, 'colsample_bytree': 0.9, 'colsample_bylevel': 0.5, 'reg_alpha': 0.14446217005298367, 'reg_lambda': 0.01062678895919145, 'gamma': 0.00011548342855684132}. Best is trial 24 with value: -0.38803344028462017.
[I 2026-07-14 16:34:38,384] Trial 28 finished with value: -0.3879106822555936 and parameters: {'scalers': 'robust', 'ratios': 'log_ratio', 'imputers': 'median', 'n_estimators': 100, 'learning_rate': 0.00011886177528028702, 'max_depth': 8, 'min_child_weight': 3, 'subsample': 0.9, 'colsample_bytree': 0.9, 'colsample_bylevel': 0.5, 'reg_alpha': 0.1749111580938072, 'reg_lambda': 0.007140812413847978, 'gamma': 0.00016099831910382125}. Best is trial 24 with value: -0.38803344028462017.
[I 2026-07-14 16:34:41,209] Trial 29 finished with value: -0.38671917207108036 and parameters: {'scalers': 'robust', 'ratios': 'log_ratio', 'imputers': 'median', 'n_estimators': 150, 'learning_rate': 0.00010855829449001262, 'max_depth': 12, 'min_child_weight': 2, 'subsample': 0.9, 'colsample_bytree': 0.9, 'colsample_bylevel': 0.5, 'reg_alpha': 0.106802584670987, 'reg_lambda': 6.41913013495615e-05, 'gamma': 0.00010823627802010723}. Best is trial 24 with value: -0.38803344028462017.
[I 2026-07-14 16:34:51,222] Trial 30 finished with value: -0.3756664430775467 and parameters: {'scalers': 'robust', 'ratios': 'log_ratio', 'imputers': 'median', 'n_estimators': 550, 'learning_rate': 0.00011133952435036323, 'max_depth': 12, 'min_child_weight': 2, 'subsample': 0.9, 'colsample_bytree': 0.8, 'colsample_bylevel': 0.5, 'reg_alpha': 0.08731464164829651, 'reg_lambda': 5.427203787243427e-05, 'gamma': 0.00012029623093342852}. Best is trial 24 with value: -0.38803344028462017.
[I 2026-07-14 16:35:03,634] Trial 31 finished with value: -0.19767805836855998 and parameters: {'scalers': 'robust', 'ratios': 'log_ratio', 'imputers': 'median', 'n_estimators': 550, 'learning_rate': 0.4194976687046364, 'max_depth': 12, 'min_child_weight': 2, 'subsample': 0.9, 'colsample_bytree': 0.8, 'colsample_bylevel': 0.6, 'reg_alpha': 0.0640949865440199, 'reg_lambda': 0.010017809920367186, 'gamma': 8.87541880661886e-05}. Best is trial 24 with value: -0.38803344028462017.
[I 2026-07-14 16:35:10,937] Trial 32 finished with value: -0.24348761290884474 and parameters: {'scalers': 'robust', 'ratios': 'log_ratio', 'imputers': 'median', 'n_estimators': 600, 'learning_rate': 0.0014409331578387249, 'max_depth': 8, 'min_child_weight': 2, 'subsample': 0.8, 'colsample_bytree': 0.8, 'colsample_bylevel': 0.5, 'reg_alpha': 0.046138099354994716, 'reg_lambda': 0.00807295737428678, 'gamma': 6.963652389909177e-05}. Best is trial 24 with value: -0.38803344028462017.
[I 2026-07-14 16:35:13,515] Trial 33 finished with value: -0.24391088847696232 and parameters: {'scalers': 'standard', 'ratios': 'log_ratio', 'imputers': 'median', 'n_estimators': 500, 'learning_rate': 0.0017528385737003562, 'max_depth': 5, 'min_child_weight': 10, 'subsample': 0.8, 'colsample_bytree': 0.8, 'colsample_bylevel': 0.6, 'reg_alpha': 0.09388126879394523, 'reg_lambda': 0.0177504764288775, 'gamma': 6.334016076975208e-05}. Best is trial 24 with value: -0.38803344028462017.
[I 2026-07-14 16:35:16,530] Trial 34 finished with value: -0.2703308424829355 and parameters: {'scalers': 'standard', 'ratios': 'log_ratio', 'imputers': 'median', 'n_estimators': 600, 'learning_rate': 0.0010904189344695015, 'max_depth': 5, 'min_child_weight': 10, 'subsample': 0.7, 'colsample_bytree': 0.8, 'colsample_bylevel': 0.6, 'reg_alpha': 0.11248968769756386, 'reg_lambda': 0.013936051720494188, 'gamma': 6.672645494732772e-05}. Best is trial 24 with value: -0.38803344028462017.
[I 2026-07-14 16:35:27,696] Trial 35 finished with value: -0.228045936934571 and parameters: {'scalers': 'standard', 'ratios': 'log_ratio', 'imputers': 'median', 'n_estimators': 650, 'learning_rate': 0.0015662989411489505, 'max_depth': 10, 'min_child_weight': 2, 'subsample': 0.7, 'colsample_bytree': 0.8, 'colsample_bylevel': 0.6, 'reg_alpha': 0.057145983266760465, 'reg_lambda': 5.3723230311022295e-05, 'gamma': 5.067971104963379e-05}. Best is trial 24 with value: -0.38803344028462017.
[I 2026-07-14 16:35:32,772] Trial 36 finished with value: -0.30927342416514164 and parameters: {'scalers': 'standard', 'ratios': 'norm_ratio', 'imputers': 'median', 'n_estimators': 750, 'learning_rate': 0.0005397904826201514, 'max_depth': 7, 'min_child_weight': 2, 'subsample': 0.7, 'colsample_bytree': 0.8, 'colsample_bylevel': 0.6, 'reg_alpha': 6.191963198794583, 'reg_lambda': 6.389543312223748e-05, 'gamma': 6.215720589349123e-05}. Best is trial 24 with value: -0.38803344028462017.
[I 2026-07-14 16:35:40,396] Trial 37 finished with value: -0.21934175859002297 and parameters: {'scalers': 'standard', 'ratios': 'norm_ratio', 'imputers': 'median', 'n_estimators': 750, 'learning_rate': 0.001485992068268045, 'max_depth': 7, 'min_child_weight': 2, 'subsample': 0.7, 'colsample_bytree': 0.8, 'colsample_bylevel': 0.6, 'reg_alpha': 0.017259904773451334, 'reg_lambda': 0.012645420557958838, 'gamma': 3.396182869568553e-05}. Best is trial 24 with value: -0.38803344028462017.
[I 2026-07-14 16:35:51,611] Trial 38 finished with value: -0.1478674741987002 and parameters: {'scalers': 'standard', 'ratios': 'log_ratio', 'imputers': 'median', 'n_estimators': 700, 'learning_rate': 0.34457544763334624, 'max_depth': 10, 'min_child_weight': 2, 'subsample': 0.8, 'colsample_bytree': 1.0, 'colsample_bylevel': 0.6, 'reg_alpha': 5.25519957622243, 'reg_lambda': 0.010300210751264716, 'gamma': 6.870231134268757e-05}. Best is trial 24 with value: -0.38803344028462017.
[I 2026-07-14 16:36:01,071] Trial 39 finished with value: -0.31397151641420434 and parameters: {'scalers': 'standard', 'ratios': 'log_ratio', 'imputers': 'median', 'n_estimators': 800, 'learning_rate': 0.00042548656934621453, 'max_depth': 10, 'min_child_weight': 1, 'subsample': 0.8, 'colsample_bytree': 1.0, 'colsample_bylevel': 0.6, 'reg_alpha': 5.461897211975276, 'reg_lambda': 0.01810512233307462, 'gamma': 1.908589708534326e-05}. Best is trial 24 with value: -0.38803344028462017.
[I 2026-07-14 16:36:11,516] Trial 40 finished with value: -0.30285735602347097 and parameters: {'scalers': 'standard', 'ratios': 'log_ratio', 'imputers': 'median', 'n_estimators': 950, 'learning_rate': 0.0004276076087966085, 'max_depth': 10, 'min_child_weight': 1, 'subsample': 0.7, 'colsample_bytree': 1.0, 'colsample_bylevel': 0.6, 'reg_alpha': 4.6894224885128875, 'reg_lambda': 0.04827083871610725, 'gamma': 0.01158414776244478}. Best is trial 24 with value: -0.38803344028462017.
[I 2026-07-14 16:36:20,963] Trial 41 finished with value: -0.30937323755032536 and parameters: {'scalers': 'standard', 'ratios': 'norm_ratio', 'imputers': 'median', 'n_estimators': 850, 'learning_rate': 0.0004326827384461387, 'max_depth': 10, 'min_child_weight': 1, 'subsample': 0.7, 'colsample_bytree': 1.0, 'colsample_bylevel': 0.6, 'reg_alpha': 4.311186846057235, 'reg_lambda': 0.1214307056236902, 'gamma': 0.017899749176415243}. Best is trial 24 with value: -0.38803344028462017.
[I 2026-07-14 16:36:33,992] Trial 42 finished with value: -0.300070935092348 and parameters: {'scalers': 'standard', 'ratios': 'norm_ratio', 'imputers': 'median', 'n_estimators': 950, 'learning_rate': 0.0004302316592728917, 'max_depth': 10, 'min_child_weight': 1, 'subsample': 1.0, 'colsample_bytree': 1.0, 'colsample_bylevel': 0.6, 'reg_alpha': 4.126493066308773, 'reg_lambda': 0.15246120210803502, 'gamma': 0.027985371273259233}. Best is trial 24 with value: -0.38803344028462017.
[I 2026-07-14 16:36:47,306] Trial 43 finished with value: -0.306429852198223 and parameters: {'scalers': 'robust', 'ratios': 'norm_ratio', 'imputers': 'median', 'n_estimators': 900, 'learning_rate': 0.0003959583689838971, 'max_depth': 10, 'min_child_weight': 5, 'subsample': 1.0, 'colsample_bytree': 1.0, 'colsample_bylevel': 0.5, 'reg_alpha': 0.007153255391826839, 'reg_lambda': 0.041613057710334175, 'gamma': 0.019416229641095663}. Best is trial 24 with value: -0.38803344028462017.
[I 2026-07-14 16:36:54,908] Trial 44 finished with value: -0.3591517353819258 and parameters: {'scalers': 'robust', 'ratios': 'norm_ratio', 'imputers': 'median', 'n_estimators': 350, 'learning_rate': 0.00034187091114905863, 'max_depth': 10, 'min_child_weight': 1, 'subsample': 1.0, 'colsample_bytree': 1.0, 'colsample_bylevel': 0.5, 'reg_alpha': 0.00765457661283125, 'reg_lambda': 0.0740048997447503, 'gamma': 0.011334596595472642}. Best is trial 24 with value: -0.38803344028462017.
