[I 2026-07-14 17:22:43,923] Trial 180 finished with value: -0.5241690476000868 and parameters: {'scalers': 'robust', 'ratios': 'norm_ratio', 'imputers': 'none', 'n_estimators': 2450, 'learning_rate': 0.49663528983669963, 'max_depth': 6, 'min_child_weight': 1, 'subsample': 0.5, 'colsample_bytree': 1.0, 'colsample_bylevel': 1.0, 'reg_alpha': 1.0412618214015474e-06, 'reg_lambda': 32.61510958392854, 'gamma': 0.00016521558856655145}. Best is trial 180 with value: -0.5241690476000868.
[I 2026-07-14 17:23:12,302] Trial 181 finished with value: -0.5043427704949113 and parameters: {'scalers': 'robust', 'ratios': 'norm_ratio', 'imputers': 'none', 'n_estimators': 2100, 'learning_rate': 0.49396542988214354, 'max_depth': 6, 'min_child_weight': 1, 'subsample': 0.5, 'colsample_bytree': 1.0, 'colsample_bylevel': 1.0, 'reg_alpha': 4.8112746424258815e-06, 'reg_lambda': 33.61411375761141, 'gamma': 0.00013925555433466258}. Best is trial 180 with value: -0.5241690476000868.
[I 2026-07-14 17:23:40,295] Trial 182 finished with value: -0.4741025311258644 and parameters: {'scalers': 'robust', 'ratios': 'norm_ratio', 'imputers': 'none', 'n_estimators': 2150, 'learning_rate': 0.4939586507079985, 'max_depth': 6, 'min_child_weight': 1, 'subsample': 0.5, 'colsample_bytree': 1.0, 'colsample_bylevel': 1.0, 'reg_alpha': 1.035925527911847e-06, 'reg_lambda': 20.88763648574703, 'gamma': 0.0001452373745157265}. Best is trial 180 with value: -0.5241690476000868.
[I 2026-07-14 17:24:01,194] Trial 183 finished with value: -0.36615713116800463 and parameters: {'scalers': 'robust', 'ratios': 'norm_ratio', 'imputers': 'none', 'n_estimators': 2100, 'learning_rate': 0.459280424685517, 'max_depth': 6, 'min_child_weight': 1, 'subsample': 0.5, 'colsample_bytree': 1.0, 'colsample_bylevel': 1.0, 'reg_alpha': 5.147489293042806e-06, 'reg_lambda': 4.125636415704659, 'gamma': 0.00013109652926528132}. Best is trial 180 with value: -0.5241690476000868.
[I 2026-07-14 17:24:23,894] Trial 184 finished with value: -0.37870235768329796 and parameters: {'scalers': 'robust', 'ratios': 'norm_ratio', 'imputers': 'none', 'n_estimators': 2150, 'learning_rate': 0.46877613139415136, 'max_depth': 6, 'min_child_weight': 1, 'subsample': 0.5, 'colsample_bytree': 1.0, 'colsample_bylevel': 1.0, 'reg_alpha': 4.763758410717982e-06, 'reg_lambda': 4.196502497880179, 'gamma': 0.00011090316826614942}. Best is trial 180 with value: -0.5241690476000868.
[I 2026-07-14 17:24:44,546] Trial 185 finished with value: -0.3937808963624569 and parameters: {'scalers': 'robust', 'ratios': 'norm_ratio', 'imputers': 'none', 'n_estimators': 2100, 'learning_rate': 0.4922662972883247, 'max_depth': 6, 'min_child_weight': 1, 'subsample': 0.5, 'colsample_bytree': 1.0, 'colsample_bylevel': 0.9, 'reg_alpha': 2.5137180021267685e-05, 'reg_lambda': 4.725193121000965, 'gamma': 9.221875078896754e-05}. Best is trial 180 with value: -0.5241690476000868.
[I 2026-07-14 17:25:11,836] Trial 186 finished with value: -0.3684339988989708 and parameters: {'scalers': 'robust', 'ratios': 'norm_ratio', 'imputers': 'none', 'n_estimators': 2650, 'learning_rate': 0.43246116302551435, 'max_depth': 6, 'min_child_weight': 1, 'subsample': 0.5, 'colsample_bytree': 1.0, 'colsample_bylevel': 1.0, 'reg_alpha': 1.0775882875181614e-06, 'reg_lambda': 3.7963221690354856, 'gamma': 0.0001103481027947329}. Best is trial 180 with value: -0.5241690476000868.
[I 2026-07-14 17:25:34,772] Trial 187 finished with value: -0.38565424787322644 and parameters: {'scalers': 'robust', 'ratios': 'norm_ratio', 'imputers': 'none', 'n_estimators': 2100, 'learning_rate': 0.47497469870234255, 'max_depth': 6, 'min_child_weight': 1, 'subsample': 0.5, 'colsample_bytree': 1.0, 'colsample_bylevel': 1.0, 'reg_alpha': 1.9361475288219964e-05, 'reg_lambda': 5.12565327117824, 'gamma': 0.0003359718942332821}. Best is trial 180 with value: -0.5241690476000868.
[I 2026-07-14 17:26:01,863] Trial 188 finished with value: -0.3886995492867758 and parameters: {'scalers': 'robust', 'ratios': 'norm_ratio', 'imputers': 'none', 'n_estimators': 2600, 'learning_rate': 0.4639511260032625, 'max_depth': 6, 'min_child_weight': 1, 'subsample': 0.5, 'colsample_bytree': 1.0, 'colsample_bylevel': 1.0, 'reg_alpha': 2.3244026177418892e-05, 'reg_lambda': 3.9665589600698232, 'gamma': 0.0003586493621220646}. Best is trial 180 with value: -0.5241690476000868.
[I 2026-07-14 17:26:24,567] Trial 189 finished with value: -0.3941321008450232 and parameters: {'scalers': 'robust', 'ratios': 'norm_ratio', 'imputers': 'none', 'n_estimators': 2150, 'learning_rate': 0.4929391359813388, 'max_depth': 6, 'min_child_weight': 1, 'subsample': 0.5, 'colsample_bytree': 1.0, 'colsample_bylevel': 1.0, 'reg_alpha': 1.0968352148786915e-06, 'reg_lambda': 4.003220118998008, 'gamma': 5.966987872633388e-05}. Best is trial 180 with value: -0.5241690476000868.
[I 2026-07-14 17:26:52,124] Trial 190 finished with value: -0.4507437040126673 and parameters: {'scalers': 'robust', 'ratios': 'norm_ratio', 'imputers': 'none', 'n_estimators': 2100, 'learning_rate': 0.4623785839836484, 'max_depth': 6, 'min_child_weight': 1, 'subsample': 0.5, 'colsample_bytree': 1.0, 'colsample_bylevel': 1.0, 'reg_alpha': 1.1509047573567805e-06, 'reg_lambda': 22.666929288873376, 'gamma': 0.00035513755529070144}. Best is trial 180 with value: -0.5241690476000868.
[I 2026-07-14 17:27:20,311] Trial 191 finished with value: -0.4649553992196502 and parameters: {'scalers': 'robust', 'ratios': 'norm_ratio', 'imputers': 'none', 'n_estimators': 2150, 'learning_rate': 0.47918888605298454, 'max_depth': 6, 'min_child_weight': 1, 'subsample': 0.5, 'colsample_bytree': 1.0, 'colsample_bylevel': 1.0, 'reg_alpha': 2.3695295994615597e-05, 'reg_lambda': 21.734716763180053, 'gamma': 0.0003563873768696714}. Best is trial 180 with value: -0.5241690476000868.
[I 2026-07-14 17:27:55,075] Trial 192 finished with value: -0.49700755508058403 and parameters: {'scalers': 'robust', 'ratios': 'norm_ratio', 'imputers': 'none', 'n_estimators': 2550, 'learning_rate': 0.4767732416502003, 'max_depth': 6, 'min_child_weight': 1, 'subsample': 0.5, 'colsample_bytree': 1.0, 'colsample_bylevel': 1.0, 'reg_alpha': 0.5515099732804479, 'reg_lambda': 22.18508160417906, 'gamma': 0.0003882914573756056}. Best is trial 180 with value: -0.5241690476000868.
[I 2026-07-14 17:28:23,218] Trial 193 finished with value: -0.4724599663915672 and parameters: {'scalers': 'robust', 'ratios': 'norm_ratio', 'imputers': 'none', 'n_estimators': 2150, 'learning_rate': 0.48206180957227895, 'max_depth': 6, 'min_child_weight': 1, 'subsample': 0.5, 'colsample_bytree': 1.0, 'colsample_bylevel': 1.0, 'reg_alpha': 2.4302494873268366e-05, 'reg_lambda': 20.955501073053465, 'gamma': 0.0004359213347780437}. Best is trial 180 with value: -0.5241690476000868.
[I 2026-07-14 17:28:47,394] Trial 194 finished with value: -0.4468915564541527 and parameters: {'scalers': 'robust', 'ratios': 'norm_ratio', 'imputers': 'none', 'n_estimators': 1850, 'learning_rate': 0.46882172221880564, 'max_depth': 6, 'min_child_weight': 1, 'subsample': 0.5, 'colsample_bytree': 1.0, 'colsample_bylevel': 1.0, 'reg_alpha': 1.946813151106326e-05, 'reg_lambda': 21.647465341214634, 'gamma': 0.0003366736272360709}. Best is trial 180 with value: -0.5241690476000868.
[I 2026-07-14 17:29:12,506] Trial 195 finished with value: -0.45627329620980145 and parameters: {'scalers': 'robust', 'ratios': 'log_ratio', 'imputers': 'none', 'n_estimators': 1900, 'learning_rate': 0.48174444680855816, 'max_depth': 6, 'min_child_weight': 1, 'subsample': 0.5, 'colsample_bytree': 1.0, 'colsample_bylevel': 1.0, 'reg_alpha': 2.5456970896044816e-05, 'reg_lambda': 23.131364127847586, 'gamma': 5.018197529844816e-05}. Best is trial 180 with value: -0.5241690476000868.
[I 2026-07-14 17:29:36,976] Trial 196 finished with value: -0.45931362740275955 and parameters: {'scalers': 'robust', 'ratios': 'log_ratio', 'imputers': 'none', 'n_estimators': 1850, 'learning_rate': 0.49282072362018875, 'max_depth': 6, 'min_child_weight': 1, 'subsample': 0.5, 'colsample_bytree': 1.0, 'colsample_bylevel': 1.0, 'reg_alpha': 4.487496927091636e-05, 'reg_lambda': 23.946882775677242, 'gamma': 6.476789810240904e-05}. Best is trial 180 with value: -0.5241690476000868.
[I 2026-07-14 17:30:02,727] Trial 197 finished with value: -0.36517426182195495 and parameters: {'scalers': 'robust', 'ratios': 'log_ratio', 'imputers': 'none', 'n_estimators': 1900, 'learning_rate': 0.487743842105167, 'max_depth': 6, 'min_child_weight': 1, 'subsample': 0.5, 'colsample_bytree': 1.0, 'colsample_bylevel': 1.0, 'reg_alpha': 1.9248685716645684, 'reg_lambda': 20.275263229647525, 'gamma': 5.027264205515808e-05}. Best is trial 180 with value: -0.5241690476000868.
[I 2026-07-14 17:30:27,060] Trial 198 finished with value: -0.4658856861488418 and parameters: {'scalers': 'robust', 'ratios': 'norm_ratio', 'imputers': 'none', 'n_estimators': 1850, 'learning_rate': 0.4996025631965889, 'max_depth': 6, 'min_child_weight': 1, 'subsample': 0.5, 'colsample_bytree': 1.0, 'colsample_bylevel': 1.0, 'reg_alpha': 1.0433485218825352e-06, 'reg_lambda': 21.949170515438986, 'gamma': 0.0003602994458602756}. Best is trial 180 with value: -0.5241690476000868.
[I 2026-07-14 17:30:53,220] Trial 199 finished with value: -0.46534970240372425 and parameters: {'scalers': 'robust', 'ratios': 'log_ratio', 'imputers': 'none', 'n_estimators': 2000, 'learning_rate': 0.49137247126589423, 'max_depth': 6, 'min_child_weight': 1, 'subsample': 0.5, 'colsample_bytree': 1.0, 'colsample_bylevel': 1.0, 'reg_alpha': 3.9789190490075666e-05, 'reg_lambda': 21.791425149356908, 'gamma': 5.5944931489336705e-05}. Best is trial 180 with value: -0.5241690476000868.
[I 2026-07-14 17:31:26,428] Trial 200 finished with value: -0.4824706457576289 and parameters: {'scalers': 'robust', 'ratios': 'log_ratio', 'imputers': 'none', 'n_estimators': 2550, 'learning_rate': 0.473613269280759, 'max_depth': 6, 'min_child_weight': 1, 'subsample': 0.5, 'colsample_bytree': 1.0, 'colsample_bylevel': 1.0, 'reg_alpha': 3.9539511771104514e-05, 'reg_lambda': 21.69483802568764, 'gamma': 0.0003568043603767691}. Best is trial 180 with value: -0.5241690476000868.
[I 2026-07-14 17:31:53,372] Trial 201 finished with value: -0.43976942383961 and parameters: {'scalers': 'robust', 'ratios': 'log_ratio', 'imputers': 'none', 'n_estimators': 1950, 'learning_rate': 0.4985978530942353, 'max_depth': 6, 'min_child_weight': 1, 'subsample': 0.5, 'colsample_bytree': 1.0, 'colsample_bylevel': 1.0, 'reg_alpha': 0.9372908118589507, 'reg_lambda': 21.75037171877755, 'gamma': 0.00037569228994776806}. Best is trial 180 with value: -0.5241690476000868.
[I 2026-07-14 17:32:18,932] Trial 202 finished with value: -0.46361425841797077 and parameters: {'scalers': 'robust', 'ratios': 'log_ratio', 'imputers': 'none', 'n_estimators': 1950, 'learning_rate': 0.4974887603101808, 'max_depth': 6, 'min_child_weight': 1, 'subsample': 0.5, 'colsample_bytree': 1.0, 'colsample_bylevel': 1.0, 'reg_alpha': 3.372850071206203e-05, 'reg_lambda': 21.234290895996423, 'gamma': 0.0003163246545624462}. Best is trial 180 with value: -0.5241690476000868.
[I 2026-07-14 17:32:47,348] Trial 203 finished with value: -0.42574968871506685 and parameters: {'scalers': 'robust', 'ratios': 'log_ratio', 'imputers': 'none', 'n_estimators': 2050, 'learning_rate': 0.4965149104254186, 'max_depth': 6, 'min_child_weight': 1, 'subsample': 0.5, 'colsample_bytree': 1.0, 'colsample_bylevel': 1.0, 'reg_alpha': 1.057401517813578, 'reg_lambda': 23.765064821498136, 'gamma': 0.00030034495897193666}. Best is trial 180 with value: -0.5241690476000868.
[I 2026-07-14 17:33:13,267] Trial 204 finished with value: -0.46303913789126155 and parameters: {'scalers': 'robust', 'ratios': 'log_ratio', 'imputers': 'none', 'n_estimators': 1900, 'learning_rate': 0.4814511108782447, 'max_depth': 6, 'min_child_weight': 1, 'subsample': 0.5, 'colsample_bytree': 1.0, 'colsample_bylevel': 1.0, 'reg_alpha': 0.7092860321857435, 'reg_lambda': 23.754639142871618, 'gamma': 1.4758821576829548e-05}. Best is trial 180 with value: -0.5241690476000868.
[I 2026-07-14 17:33:39,415] Trial 205 finished with value: -0.46832365752150923 and parameters: {'scalers': 'robust', 'ratios': 'log_ratio', 'imputers': 'none', 'n_estimators': 1900, 'learning_rate': 0.4916949002525518, 'max_depth': 6, 'min_child_weight': 1, 'subsample': 0.5, 'colsample_bytree': 1.0, 'colsample_bylevel': 1.0, 'reg_alpha': 0.702843537394728, 'reg_lambda': 23.977799206056442, 'gamma': 1.7377402528129176e-05}. Best is trial 180 with value: -0.5241690476000868.
[I 2026-07-14 17:34:01,913] Trial 206 finished with value: -0.4543683424053984 and parameters: {'scalers': 'robust', 'ratios': 'log_ratio', 'imputers': 'none', 'n_estimators': 1850, 'learning_rate': 0.48303797271333293, 'max_depth': 6, 'min_child_weight': 1, 'subsample': 0.5, 'colsample_bytree': 1.0, 'colsample_bylevel': 1.0, 'reg_alpha': 3.711729194426742e-05, 'reg_lambda': 22.708587163962587, 'gamma': 1.8076818438797614e-05}. Best is trial 180 with value: -0.5241690476000868.
[I 2026-07-14 17:34:26,348] Trial 207 finished with value: -0.4534844926115275 and parameters: {'scalers': 'robust', 'ratios': 'log_ratio', 'imputers': 'none', 'n_estimators': 1850, 'learning_rate': 0.4768900142795023, 'max_depth': 6, 'min_child_weight': 1, 'subsample': 0.5, 'colsample_bytree': 1.0, 'colsample_bylevel': 1.0, 'reg_alpha': 3.046689982294026e-05, 'reg_lambda': 24.261380532176766, 'gamma': 0.00038533691027318285}. Best is trial 180 with value: -0.5241690476000868.
[I 2026-07-14 17:34:51,356] Trial 208 finished with value: -0.4638782120029089 and parameters: {'scalers': 'robust', 'ratios': 'log_ratio', 'imputers': 'none', 'n_estimators': 1900, 'learning_rate': 0.4915961502016878, 'max_depth': 6, 'min_child_weight': 1, 'subsample': 0.5, 'colsample_bytree': 1.0, 'colsample_bylevel': 1.0, 'reg_alpha': 1.6349469985990046e-05, 'reg_lambda': 22.427455913806277, 'gamma': 1.2438021269010418e-05}. Best is trial 180 with value: -0.5241690476000868.
[I 2026-07-14 17:35:16,841] Trial 209 finished with value: -0.42916495142985467 and parameters: {'scalers': 'robust', 'ratios': 'log_ratio', 'imputers': 'none', 'n_estimators': 1850, 'learning_rate': 0.47406686151472577, 'max_depth': 6, 'min_child_weight': 1, 'subsample': 0.5, 'colsample_bytree': 1.0, 'colsample_bylevel': 1.0, 'reg_alpha': 0.7841026248513036, 'reg_lambda': 22.8173319836419, 'gamma': 0.0006510721884818867}. Best is trial 180 with value: -0.5241690476000868.
[I 2026-07-14 17:35:41,432] Trial 210 finished with value: -0.4593937374898621 and parameters: {'scalers': 'robust', 'ratios': 'log_ratio', 'imputers': 'none', 'n_estimators': 1800, 'learning_rate': 0.49411590129646016, 'max_depth': 6, 'min_child_weight': 1, 'subsample': 0.5, 'colsample_bytree': 1.0, 'colsample_bylevel': 1.0, 'reg_alpha': 0.4784302607719863, 'reg_lambda': 24.14274310485245, 'gamma': 0.0005364503991962453}. Best is trial 180 with value: -0.5241690476000868.
[I 2026-07-14 17:36:06,997] Trial 211 finished with value: -0.4137329544044955 and parameters: {'scalers': 'robust', 'ratios': 'log_ratio', 'imputers': 'none', 'n_estimators': 1850, 'learning_rate': 0.4953841045172339, 'max_depth': 6, 'min_child_weight': 1, 'subsample': 0.5, 'colsample_bytree': 1.0, 'colsample_bylevel': 1.0, 'reg_alpha': 1.406999560773461, 'reg_lambda': 22.382299257090132, 'gamma': 0.000646408713631928}. Best is trial 180 with value: -0.5241690476000868.
[I 2026-07-14 17:36:31,517] Trial 212 finished with value: -0.4641781082654002 and parameters: {'scalers': 'robust', 'ratios': 'log_ratio', 'imputers': 'none', 'n_estimators': 1850, 'learning_rate': 0.49834982665352084, 'max_depth': 6, 'min_child_weight': 1, 'subsample': 0.5, 'colsample_bytree': 1.0, 'colsample_bylevel': 1.0, 'reg_alpha': 3.390016427281913e-05, 'reg_lambda': 23.689716040423605, 'gamma': 3.828525753531884e-06}. Best is trial 180 with value: -0.5241690476000868.
[I 2026-07-14 17:36:57,565] Trial 213 finished with value: -0.4735033893804772 and parameters: {'scalers': 'robust', 'ratios': 'log_ratio', 'imputers': 'none', 'n_estimators': 1900, 'learning_rate': 0.49949006784487554, 'max_depth': 6, 'min_child_weight': 1, 'subsample': 0.5, 'colsample_bytree': 1.0, 'colsample_bylevel': 1.0, 'reg_alpha': 0.4994800992278915, 'reg_lambda': 24.593105674123585, 'gamma': 1.3921153810273155e-05}. Best is trial 180 with value: -0.5241690476000868.
[I 2026-07-14 17:37:22,203] Trial 214 finished with value: -0.4026542594821613 and parameters: {'scalers': 'robust', 'ratios': 'log_ratio', 'imputers': 'none', 'n_estimators': 1800, 'learning_rate': 0.4218942280771884, 'max_depth': 6, 'min_child_weight': 1, 'subsample': 0.5, 'colsample_bytree': 1.0, 'colsample_bylevel': 1.0, 'reg_alpha': 0.5890502622975327, 'reg_lambda': 25.301044096123302, 'gamma': 8.038016103196855e-06}. Best is trial 180 with value: -0.5241690476000868.
[I 2026-07-14 17:37:45,258] Trial 215 finished with value: -0.39957652624086604 and parameters: {'scalers': 'robust', 'ratios': 'log_ratio', 'imputers': 'none', 'n_estimators': 1750, 'learning_rate': 0.4094308393193446, 'max_depth': 6, 'min_child_weight': 1, 'subsample': 0.5, 'colsample_bytree': 1.0, 'colsample_bylevel': 1.0, 'reg_alpha': 0.48895722137776654, 'reg_lambda': 26.602156808125272, 'gamma': 8.6633963834704e-06}. Best is trial 180 with value: -0.5241690476000868.
[I 2026-07-14 17:38:09,604] Trial 216 finished with value: -0.39948138749861223 and parameters: {'scalers': 'robust', 'ratios': 'log_ratio', 'imputers': 'none', 'n_estimators': 1800, 'learning_rate': 0.40734444491963984, 'max_depth': 6, 'min_child_weight': 1, 'subsample': 0.5, 'colsample_bytree': 1.0, 'colsample_bylevel': 1.0, 'reg_alpha': 0.45619892049129857, 'reg_lambda': 26.514489582980943, 'gamma': 8.29597297281132e-06}. Best is trial 180 with value: -0.5241690476000868.
[I 2026-07-14 17:38:32,532] Trial 217 finished with value: -0.3992608303315237 and parameters: {'scalers': 'robust', 'ratios': 'log_ratio', 'imputers': 'none', 'n_estimators': 1750, 'learning_rate': 0.40704748858363365, 'max_depth': 6, 'min_child_weight': 1, 'subsample': 0.5, 'colsample_bytree': 1.0, 'colsample_bylevel': 1.0, 'reg_alpha': 3.860597052583861e-05, 'reg_lambda': 27.06930764393337, 'gamma': 6.1095053598829024e-06}. Best is trial 180 with value: -0.5241690476000868.
[I 2026-07-14 17:38:56,294] Trial 218 finished with value: -0.40226086859221694 and parameters: {'scalers': 'robust', 'ratios': 'log_ratio', 'imputers': 'none', 'n_estimators': 1750, 'learning_rate': 0.4109964561683481, 'max_depth': 6, 'min_child_weight': 1, 'subsample': 0.5, 'colsample_bytree': 1.0, 'colsample_bylevel': 1.0, 'reg_alpha': 0.43484611168324294, 'reg_lambda': 29.136145815233807, 'gamma': 2.712989738596034e-06}. Best is trial 180 with value: -0.5241690476000868.
[I 2026-07-14 17:39:19,717] Trial 219 finished with value: -0.3948622980758035 and parameters: {'scalers': 'robust', 'ratios': 'log_ratio', 'imputers': 'none', 'n_estimators': 1750, 'learning_rate': 0.4015745105403291, 'max_depth': 6, 'min_child_weight': 1, 'subsample': 0.5, 'colsample_bytree': 1.0, 'colsample_bylevel': 1.0, 'reg_alpha': 0.45974616776651095, 'reg_lambda': 25.427431384595444, 'gamma': 1.0634229610053052e-05}. Best is trial 180 with value: -0.5241690476000868.
[I 2026-07-14 17:39:42,778] Trial 220 finished with value: -0.40197265134571253 and parameters: {'scalers': 'robust', 'ratios': 'log_ratio', 'imputers': 'none', 'n_estimators': 1750, 'learning_rate': 0.41087288205665073, 'max_depth': 6, 'min_child_weight': 1, 'subsample': 0.5, 'colsample_bytree': 1.0, 'colsample_bylevel': 1.0, 'reg_alpha': 0.42016540406926706, 'reg_lambda': 17.041983360418726, 'gamma': 5.78936288715985e-06}. Best is trial 180 with value: -0.5241690476000868.
[I 2026-07-14 17:40:06,030] Trial 221 finished with value: -0.39109296604268695 and parameters: {'scalers': 'robust', 'ratios': 'log_ratio', 'imputers': 'none', 'n_estimators': 1750, 'learning_rate': 0.40584775158437314, 'max_depth': 6, 'min_child_weight': 1, 'subsample': 0.5, 'colsample_bytree': 1.0, 'colsample_bylevel': 1.0, 'reg_alpha': 0.7519470517531759, 'reg_lambda': 15.444839751480755, 'gamma': 5.326469664697485e-06}. Best is trial 180 with value: -0.5241690476000868.
[I 2026-07-14 17:40:27,737] Trial 222 finished with value: -0.39394256207097195 and parameters: {'scalers': 'robust', 'ratios': 'log_ratio', 'imputers': 'none', 'n_estimators': 1700, 'learning_rate': 0.40767906808979765, 'max_depth': 6, 'min_child_weight': 1, 'subsample': 0.5, 'colsample_bytree': 1.0, 'colsample_bylevel': 1.0, 'reg_alpha': 0.4704368976554573, 'reg_lambda': 12.21011693550692, 'gamma': 6.063225198749051e-06}. Best is trial 180 with value: -0.5241690476000868.
[I 2026-07-14 17:40:52,582] Trial 223 finished with value: -0.3282336932358879 and parameters: {'scalers': 'robust', 'ratios': 'log_ratio', 'imputers': 'none', 'n_estimators': 1950, 'learning_rate': 0.403693545927458, 'max_depth': 6, 'min_child_weight': 1, 'subsample': 0.8, 'colsample_bytree': 1.0, 'colsample_bylevel': 1.0, 'reg_alpha': 0.12025470879222995, 'reg_lambda': 14.370153818334101, 'gamma': 2.836892605267503e-06}. Best is trial 180 with value: -0.5241690476000868.
[I 2026-07-14 17:41:18,068] Trial 224 finished with value: -0.3943303898977217 and parameters: {'scalers': 'robust', 'ratios': 'log_ratio', 'imputers': 'none', 'n_estimators': 1950, 'learning_rate': 0.3963814424747548, 'max_depth': 6, 'min_child_weight': 1, 'subsample': 0.5, 'colsample_bytree': 1.0, 'colsample_bylevel': 1.0, 'reg_alpha': 0.3339869022536842, 'reg_lambda': 15.919874422114658, 'gamma': 5.780074195536805e-06}. Best is trial 180 with value: -0.5241690476000868.
