[I 2026-07-14 20:39:28,948] Trial 135 finished with value: -0.40095210689226773 and parameters: {'scalers': 'standard', 'ratios': 'log_ratio', 'imputers': 'none', 'n_estimators': 2200, 'learning_rate': 0.27280827951684083, 'max_depth': 11, 'min_child_weight': 1, 'subsample': 0.8, 'colsample_bytree': 0.7, 'colsample_bylevel': 0.6, 'reg_alpha': 0.6205515979591242, 'reg_lambda': 77.06904948891413, 'gamma': 0.00032770101647318264}. Best is trial 123 with value: -0.7862010225542801.
[I 2026-07-14 20:39:52,066] Trial 136 finished with value: -0.4165807626978656 and parameters: {'scalers': 'robust', 'ratios': 'log_ratio', 'imputers': 'none', 'n_estimators': 2250, 'learning_rate': 0.2791052601514183, 'max_depth': 11, 'min_child_weight': 1, 'subsample': 0.8, 'colsample_bytree': 0.7, 'colsample_bylevel': 0.6, 'reg_alpha': 0.2383052116864751, 'reg_lambda': 25.51168906449071, 'gamma': 0.0003953914127132661}. Best is trial 123 with value: -0.7862010225542801.
[I 2026-07-14 20:40:08,665] Trial 137 finished with value: -0.15644236331740644 and parameters: {'scalers': 'standard', 'ratios': 'log_ratio', 'imputers': 'none', 'n_estimators': 2150, 'learning_rate': 0.28218973407863274, 'max_depth': 11, 'min_child_weight': 7, 'subsample': 0.8, 'colsample_bytree': 1.0, 'colsample_bylevel': 0.6, 'reg_alpha': 0.1883916554500376, 'reg_lambda': 89.3838328100264, 'gamma': 0.0003506816284457007}. Best is trial 123 with value: -0.7862010225542801.
[I 2026-07-14 20:40:39,967] Trial 138 finished with value: -0.7330504217430588 and parameters: {'scalers': 'standard', 'ratios': 'log_ratio', 'imputers': 'none', 'n_estimators': 2850, 'learning_rate': 0.496557898204087, 'max_depth': 11, 'min_child_weight': 1, 'subsample': 0.8, 'colsample_bytree': 0.7, 'colsample_bylevel': 0.6, 'reg_alpha': 0.21344401794604576, 'reg_lambda': 79.25341735929636, 'gamma': 0.0003838452344687386}. Best is trial 123 with value: -0.7862010225542801.
[I 2026-07-14 20:41:06,065] Trial 139 finished with value: -0.8731930178617182 and parameters: {'scalers': 'standard', 'ratios': 'log_ratio', 'imputers': 'none', 'n_estimators': 2800, 'learning_rate': 0.3526569521229765, 'max_depth': 11, 'min_child_weight': 1, 'subsample': 0.6, 'colsample_bytree': 0.7, 'colsample_bylevel': 0.6, 'reg_alpha': 0.21050770133925076, 'reg_lambda': 82.20222545053913, 'gamma': 0.00042715194418505833}. Best is trial 139 with value: -0.8731930178617182.
[I 2026-07-14 20:41:27,295] Trial 140 finished with value: -2.9803742159464854 and parameters: {'scalers': 'robust', 'ratios': 'log_ratio', 'imputers': 'none', 'n_estimators': 2150, 'learning_rate': 0.49775283399663023, 'max_depth': 11, 'min_child_weight': 1, 'subsample': 0.6, 'colsample_bytree': 0.7, 'colsample_bylevel': 0.6, 'reg_alpha': 0.2186902048093719, 'reg_lambda': 88.83328615264922, 'gamma': 0.0002879853879072256}. Best is trial 140 with value: -2.9803742159464854.
[I 2026-07-14 20:41:47,200] Trial 141 finished with value: -0.6552314614481063 and parameters: {'scalers': 'robust', 'ratios': 'log_ratio', 'imputers': 'none', 'n_estimators': 2850, 'learning_rate': 0.40080555316283256, 'max_depth': 11, 'min_child_weight': 1, 'subsample': 0.6, 'colsample_bytree': 0.7, 'colsample_bylevel': 0.6, 'reg_alpha': 1.9738589108610427, 'reg_lambda': 32.69889795613677, 'gamma': 0.00029670360846548345}. Best is trial 140 with value: -2.9803742159464854.
[I 2026-07-14 20:42:01,522] Trial 142 finished with value: -0.17911598140568943 and parameters: {'scalers': 'robust', 'ratios': 'log_ratio', 'imputers': 'none', 'n_estimators': 2150, 'learning_rate': 0.3572463727904338, 'max_depth': 11, 'min_child_weight': 7, 'subsample': 0.6, 'colsample_bytree': 0.7, 'colsample_bylevel': 0.6, 'reg_alpha': 0.3200784260130646, 'reg_lambda': 83.92159708254151, 'gamma': 0.0003800129492561838}. Best is trial 140 with value: -2.9803742159464854.
[I 2026-07-14 20:42:26,261] Trial 143 finished with value: -2.9387919716167197 and parameters: {'scalers': 'standard', 'ratios': 'log_ratio', 'imputers': 'none', 'n_estimators': 2850, 'learning_rate': 0.4917030539594682, 'max_depth': 12, 'min_child_weight': 1, 'subsample': 0.6, 'colsample_bytree': 0.7, 'colsample_bylevel': 0.6, 'reg_alpha': 0.3398161408633483, 'reg_lambda': 96.66402380648228, 'gamma': 0.002077183368816554}. Best is trial 140 with value: -2.9803742159464854.
[I 2026-07-14 20:42:56,837] Trial 144 finished with value: -0.4502177298941924 and parameters: {'scalers': 'robust', 'ratios': 'log_ratio', 'imputers': 'none', 'n_estimators': 2800, 'learning_rate': 0.3499847381341796, 'max_depth': 12, 'min_child_weight': 1, 'subsample': 0.9, 'colsample_bytree': 0.7, 'colsample_bylevel': 0.6, 'reg_alpha': 0.18299162781480163, 'reg_lambda': 88.2394311289736, 'gamma': 0.00154414077352179}. Best is trial 140 with value: -2.9803742159464854.
[I 2026-07-14 20:43:22,464] Trial 145 finished with value: -0.5265758897726767 and parameters: {'scalers': 'robust', 'ratios': 'log_ratio', 'imputers': 'none', 'n_estimators': 2000, 'learning_rate': 0.49930209456084496, 'max_depth': 12, 'min_child_weight': 1, 'subsample': 0.9, 'colsample_bytree': 0.7, 'colsample_bylevel': 0.6, 'reg_alpha': 0.2625322145270507, 'reg_lambda': 36.71179381680586, 'gamma': 0.0017237478094760778}. Best is trial 140 with value: -2.9803742159464854.
[I 2026-07-14 20:43:58,920] Trial 146 finished with value: -0.5623727102024674 and parameters: {'scalers': 'robust', 'ratios': 'log_ratio', 'imputers': 'none', 'n_estimators': 2850, 'learning_rate': 0.49971186590748506, 'max_depth': 12, 'min_child_weight': 1, 'subsample': 0.9, 'colsample_bytree': 0.7, 'colsample_bylevel': 0.6, 'reg_alpha': 0.2727793568490763, 'reg_lambda': 34.79031855842813, 'gamma': 0.00187941330702319}. Best is trial 140 with value: -2.9803742159464854.
[I 2026-07-14 20:44:32,799] Trial 147 finished with value: -0.47690300227815163 and parameters: {'scalers': 'standard', 'ratios': 'log_ratio', 'imputers': 'none', 'n_estimators': 2850, 'learning_rate': 0.35790927839841546, 'max_depth': 12, 'min_child_weight': 1, 'subsample': 0.9, 'colsample_bytree': 0.7, 'colsample_bylevel': 0.6, 'reg_alpha': 0.324866814480598, 'reg_lambda': 35.49042374728483, 'gamma': 0.0018644697755819891}. Best is trial 140 with value: -2.9803742159464854.
[I 2026-07-14 20:45:03,075] Trial 148 finished with value: -0.6938882786448757 and parameters: {'scalers': 'robust', 'ratios': 'log_ratio', 'imputers': 'none', 'n_estimators': 2900, 'learning_rate': 0.351261708970234, 'max_depth': 12, 'min_child_weight': 1, 'subsample': 0.6, 'colsample_bytree': 0.7, 'colsample_bylevel': 0.6, 'reg_alpha': 0.34667563274144936, 'reg_lambda': 38.60432322473235, 'gamma': 0.001810426824805116}. Best is trial 140 with value: -2.9803742159464854.
[I 2026-07-14 20:45:38,547] Trial 149 finished with value: -0.5618593403392078 and parameters: {'scalers': 'robust', 'ratios': 'log_ratio', 'imputers': 'none', 'n_estimators': 2800, 'learning_rate': 0.49607277944286665, 'max_depth': 12, 'min_child_weight': 1, 'subsample': 0.9, 'colsample_bytree': 0.7, 'colsample_bylevel': 0.6, 'reg_alpha': 0.3362558706954506, 'reg_lambda': 37.88899678143299, 'gamma': 0.0015784208388677382}. Best is trial 140 with value: -2.9803742159464854.
[I 2026-07-14 20:46:11,783] Trial 150 finished with value: -1.6413418158117374 and parameters: {'scalers': 'robust', 'ratios': 'log_ratio', 'imputers': 'none', 'n_estimators': 2800, 'learning_rate': 0.4859161609068847, 'max_depth': 12, 'min_child_weight': 1, 'subsample': 0.6, 'colsample_bytree': 0.7, 'colsample_bylevel': 0.6, 'reg_alpha': 0.095097328809714, 'reg_lambda': 36.847657410675936, 'gamma': 0.001421580438067903}. Best is trial 140 with value: -2.9803742159464854.
[I 2026-07-14 20:46:42,332] Trial 151 finished with value: -0.33664387736006995 and parameters: {'scalers': 'robust', 'ratios': 'log_ratio', 'imputers': 'none', 'n_estimators': 2850, 'learning_rate': 0.36266111447771865, 'max_depth': 12, 'min_child_weight': 1, 'subsample': 1.0, 'colsample_bytree': 0.7, 'colsample_bylevel': 0.6, 'reg_alpha': 0.19443397920971708, 'reg_lambda': 35.339223653993514, 'gamma': 0.001661249790194213}. Best is trial 140 with value: -2.9803742159464854.
[I 2026-07-14 20:47:08,609] Trial 153 finished with value: -0.05435476807231962 and parameters: {'scalers': 'robust', 'ratios': 'log_ratio', 'imputers': 'none', 'n_estimators': 2800, 'learning_rate': 0.4994342530314517, 'max_depth': 12, 'min_child_weight': 1, 'subsample': 0.9, 'colsample_bytree': 0.7, 'colsample_bylevel': 0.6, 'reg_alpha': 89.14715022470183, 'reg_lambda': 34.722571513075984, 'gamma': 0.002093820606471298}. Best is trial 140 with value: -2.9803742159464854.
[I 2026-07-14 20:47:13,941] Trial 152 finished with value: -0.7261575265850996 and parameters: {'scalers': 'robust', 'ratios': 'log_ratio', 'imputers': 'none', 'n_estimators': 2850, 'learning_rate': 0.3846892635025662, 'max_depth': 12, 'min_child_weight': 1, 'subsample': 0.6, 'colsample_bytree': 0.7, 'colsample_bylevel': 0.6, 'reg_alpha': 0.12013883958443833, 'reg_lambda': 33.13000276211609, 'gamma': 0.0020795471013678075}. Best is trial 140 with value: -2.9803742159464854.
[I 2026-07-14 20:47:46,313] Trial 154 finished with value: -0.39086346556218393 and parameters: {'scalers': 'robust', 'ratios': 'log_ratio', 'imputers': 'none', 'n_estimators': 2900, 'learning_rate': 0.4881693135801553, 'max_depth': 12, 'min_child_weight': 1, 'subsample': 1.0, 'colsample_bytree': 0.7, 'colsample_bylevel': 0.6, 'reg_alpha': 0.12194408312026966, 'reg_lambda': 32.6890752816209, 'gamma': 0.0021468870476515473}. Best is trial 140 with value: -2.9803742159464854.
[I 2026-07-14 20:48:20,268] Trial 155 finished with value: -0.4619365114962037 and parameters: {'scalers': 'robust', 'ratios': 'log_ratio', 'imputers': 'none', 'n_estimators': 2850, 'learning_rate': 0.35870015072277067, 'max_depth': 12, 'min_child_weight': 1, 'subsample': 0.9, 'colsample_bytree': 0.7, 'colsample_bylevel': 0.6, 'reg_alpha': 0.14537161672458815, 'reg_lambda': 38.377683798986716, 'gamma': 0.002294355537839241}. Best is trial 140 with value: -2.9803742159464854.
[I 2026-07-14 20:48:33,585] Trial 156 finished with value: -0.11091288906044391 and parameters: {'scalers': 'robust', 'ratios': 'log_ratio', 'imputers': 'none', 'n_estimators': 2900, 'learning_rate': 0.03308157389147723, 'max_depth': 12, 'min_child_weight': 1, 'subsample': 1.0, 'colsample_bytree': 0.7, 'colsample_bylevel': 0.6, 'reg_alpha': 0.10206997090873744, 'reg_lambda': 34.083870438340426, 'gamma': 0.0023078895460714142}. Best is trial 140 with value: -2.9803742159464854.
[I 2026-07-14 20:49:11,178] Trial 157 finished with value: -0.5519709076876032 and parameters: {'scalers': 'robust', 'ratios': 'log_ratio', 'imputers': 'none', 'n_estimators': 2900, 'learning_rate': 0.4959122154217258, 'max_depth': 12, 'min_child_weight': 1, 'subsample': 0.9, 'colsample_bytree': 0.7, 'colsample_bylevel': 0.6, 'reg_alpha': 0.10561920695482241, 'reg_lambda': 30.78851632476618, 'gamma': 0.0023244731989149935}. Best is trial 140 with value: -2.9803742159464854.
[I 2026-07-14 20:49:48,413] Trial 158 finished with value: -0.5596717364719079 and parameters: {'scalers': 'robust', 'ratios': 'log_ratio', 'imputers': 'none', 'n_estimators': 2900, 'learning_rate': 0.4980717873824691, 'max_depth': 12, 'min_child_weight': 1, 'subsample': 0.9, 'colsample_bytree': 0.7, 'colsample_bylevel': 0.6, 'reg_alpha': 0.08858695204463281, 'reg_lambda': 34.92020452606813, 'gamma': 0.0021623333337745286}. Best is trial 140 with value: -2.9803742159464854.
[I 2026-07-14 20:50:21,755] Trial 159 finished with value: -0.4856509901068257 and parameters: {'scalers': 'robust', 'ratios': 'log_ratio', 'imputers': 'none', 'n_estimators': 2700, 'learning_rate': 0.40232725837897415, 'max_depth': 12, 'min_child_weight': 1, 'subsample': 0.9, 'colsample_bytree': 0.7, 'colsample_bylevel': 0.6, 'reg_alpha': 0.10422451837597373, 'reg_lambda': 34.02265181965616, 'gamma': 0.0022125314073678007}. Best is trial 140 with value: -2.9803742159464854.
[I 2026-07-14 20:50:54,161] Trial 160 finished with value: -0.45374539879002146 and parameters: {'scalers': 'robust', 'ratios': 'log_ratio', 'imputers': 'none', 'n_estimators': 3000, 'learning_rate': 0.4000955635615257, 'max_depth': 12, 'min_child_weight': 1, 'subsample': 0.9, 'colsample_bytree': 0.7, 'colsample_bylevel': 0.6, 'reg_alpha': 0.1043301515537868, 'reg_lambda': 99.19538817602664, 'gamma': 0.002721519551362445}. Best is trial 140 with value: -2.9803742159464854.
[I 2026-07-14 20:51:27,408] Trial 161 finished with value: -0.49380684636239636 and parameters: {'scalers': 'robust', 'ratios': 'log_ratio', 'imputers': 'none', 'n_estimators': 2700, 'learning_rate': 0.38560263793488886, 'max_depth': 12, 'min_child_weight': 1, 'subsample': 0.9, 'colsample_bytree': 0.7, 'colsample_bylevel': 0.6, 'reg_alpha': 0.11231476577877672, 'reg_lambda': 28.422225974070454, 'gamma': 0.0027618195644906044}. Best is trial 140 with value: -2.9803742159464854.
[I 2026-07-14 20:52:04,817] Trial 162 finished with value: -0.4882534648920469 and parameters: {'scalers': 'robust', 'ratios': 'log_ratio', 'imputers': 'none', 'n_estimators': 3000, 'learning_rate': 0.38847563442254895, 'max_depth': 12, 'min_child_weight': 1, 'subsample': 0.9, 'colsample_bytree': 0.7, 'colsample_bylevel': 0.6, 'reg_alpha': 0.10237842273427124, 'reg_lambda': 24.462956500507573, 'gamma': 0.003264215050540527}. Best is trial 140 with value: -2.9803742159464854.
[I 2026-07-14 20:52:40,105] Trial 163 finished with value: -0.5007256652157898 and parameters: {'scalers': 'robust', 'ratios': 'log_ratio', 'imputers': 'none', 'n_estimators': 3000, 'learning_rate': 0.40671598764064487, 'max_depth': 12, 'min_child_weight': 1, 'subsample': 0.9, 'colsample_bytree': 0.7, 'colsample_bylevel': 0.6, 'reg_alpha': 0.09576712363295205, 'reg_lambda': 69.59690481949617, 'gamma': 0.0012633832044757227}. Best is trial 140 with value: -2.9803742159464854.
[I 2026-07-14 20:53:12,889] Trial 164 finished with value: -0.4618444112934119 and parameters: {'scalers': 'robust', 'ratios': 'log_ratio', 'imputers': 'none', 'n_estimators': 3000, 'learning_rate': 0.39262466777487876, 'max_depth': 12, 'min_child_weight': 1, 'subsample': 0.9, 'colsample_bytree': 0.7, 'colsample_bylevel': 0.6, 'reg_alpha': 0.38628840729008707, 'reg_lambda': 66.4427041105879, 'gamma': 0.0030194912816128745}. Best is trial 140 with value: -2.9803742159464854.
[I 2026-07-14 20:53:45,256] Trial 165 finished with value: -0.46091683318630966 and parameters: {'scalers': 'robust', 'ratios': 'log_ratio', 'imputers': 'none', 'n_estimators': 3000, 'learning_rate': 0.3981361038838819, 'max_depth': 12, 'min_child_weight': 1, 'subsample': 0.9, 'colsample_bytree': 0.7, 'colsample_bylevel': 0.6, 'reg_alpha': 0.3839614475202532, 'reg_lambda': 67.70768164923156, 'gamma': 0.003344457970613671}. Best is trial 140 with value: -2.9803742159464854.
[I 2026-07-14 20:54:18,169] Trial 166 finished with value: -0.45577894367534294 and parameters: {'scalers': 'robust', 'ratios': 'log_ratio', 'imputers': 'none', 'n_estimators': 3000, 'learning_rate': 0.38250240279781056, 'max_depth': 12, 'min_child_weight': 1, 'subsample': 0.9, 'colsample_bytree': 0.7, 'colsample_bylevel': 0.6, 'reg_alpha': 0.07204622220334157, 'reg_lambda': 69.90701298368757, 'gamma': 0.0039999333775303895}. Best is trial 140 with value: -2.9803742159464854.
[I 2026-07-14 20:54:50,839] Trial 167 finished with value: -0.45758475090120987 and parameters: {'scalers': 'robust', 'ratios': 'log_ratio', 'imputers': 'none', 'n_estimators': 3000, 'learning_rate': 0.3312666008444759, 'max_depth': 12, 'min_child_weight': 1, 'subsample': 0.9, 'colsample_bytree': 0.7, 'colsample_bylevel': 0.6, 'reg_alpha': 0.4123178659761477, 'reg_lambda': 66.62057991826798, 'gamma': 0.0012893625845831506}. Best is trial 140 with value: -2.9803742159464854.
[I 2026-07-14 20:55:21,304] Trial 168 finished with value: -0.451281190038189 and parameters: {'scalers': 'robust', 'ratios': 'log_ratio', 'imputers': 'none', 'n_estimators': 2700, 'learning_rate': 0.33577699691603524, 'max_depth': 12, 'min_child_weight': 1, 'subsample': 0.9, 'colsample_bytree': 0.7, 'colsample_bylevel': 0.6, 'reg_alpha': 0.07605818230338708, 'reg_lambda': 68.18201047183067, 'gamma': 0.001350146693113215}. Best is trial 140 with value: -2.9803742159464854.
[I 2026-07-14 20:55:53,812] Trial 169 finished with value: -0.45131728170240687 and parameters: {'scalers': 'robust', 'ratios': 'log_ratio', 'imputers': 'none', 'n_estimators': 2950, 'learning_rate': 0.3199847547460216, 'max_depth': 12, 'min_child_weight': 1, 'subsample': 0.9, 'colsample_bytree': 0.7, 'colsample_bylevel': 0.6, 'reg_alpha': 0.4126961409458448, 'reg_lambda': 62.24591348931796, 'gamma': 0.0012391793897024723}. Best is trial 140 with value: -2.9803742159464854.
[I 2026-07-14 20:56:23,800] Trial 170 finished with value: -0.445265822877321 and parameters: {'scalers': 'robust', 'ratios': 'log_ratio', 'imputers': 'none', 'n_estimators': 2750, 'learning_rate': 0.32148157798038673, 'max_depth': 12, 'min_child_weight': 1, 'subsample': 0.9, 'colsample_bytree': 0.7, 'colsample_bylevel': 0.6, 'reg_alpha': 0.4343653735066907, 'reg_lambda': 64.06087806065729, 'gamma': 0.0014995990370886057}. Best is trial 140 with value: -2.9803742159464854.
[I 2026-07-14 20:57:02,606] Trial 171 finished with value: -0.44472167574987087 and parameters: {'scalers': 'robust', 'ratios': 'log_ratio', 'imputers': 'none', 'n_estimators': 2750, 'learning_rate': 0.31120545703637764, 'max_depth': 12, 'min_child_weight': 1, 'subsample': 0.9, 'colsample_bytree': 0.9, 'colsample_bylevel': 0.6, 'reg_alpha': 0.4117723783193149, 'reg_lambda': 14.754378613560336, 'gamma': 0.0013549789639574162}. Best is trial 140 with value: -2.9803742159464854.
[I 2026-07-14 20:57:35,623] Trial 172 finished with value: -0.45462055067718704 and parameters: {'scalers': 'robust', 'ratios': 'log_ratio', 'imputers': 'none', 'n_estimators': 2650, 'learning_rate': 0.33857569622405215, 'max_depth': 12, 'min_child_weight': 1, 'subsample': 0.9, 'colsample_bytree': 0.7, 'colsample_bylevel': 0.6, 'reg_alpha': 0.25300744688372234, 'reg_lambda': 13.577229031306537, 'gamma': 0.0011713183207868435}. Best is trial 140 with value: -2.9803742159464854.
[I 2026-07-14 20:58:15,149] Trial 173 finished with value: -0.46672833195759283 and parameters: {'scalers': 'robust', 'ratios': 'log_ratio', 'imputers': 'none', 'n_estimators': 2750, 'learning_rate': 0.3395016360838707, 'max_depth': 12, 'min_child_weight': 1, 'subsample': 0.9, 'colsample_bytree': 0.9, 'colsample_bylevel': 0.6, 'reg_alpha': 0.25753890325508655, 'reg_lambda': 13.88756239815253, 'gamma': 0.0012736763376020065}. Best is trial 140 with value: -2.9803742159464854.
[I 2026-07-14 20:58:46,201] Trial 174 finished with value: -0.5491802930053821 and parameters: {'scalers': 'robust', 'ratios': 'log_ratio', 'imputers': 'none', 'n_estimators': 2750, 'learning_rate': 0.3340943499176645, 'max_depth': 12, 'min_child_weight': 1, 'subsample': 0.6, 'colsample_bytree': 0.7, 'colsample_bylevel': 0.6, 'reg_alpha': 0.44086558507007645, 'reg_lambda': 14.180451822298254, 'gamma': 0.0012555080330389897}. Best is trial 140 with value: -2.9803742159464854.
[I 2026-07-14 20:59:19,366] Trial 175 finished with value: -0.4807179258935139 and parameters: {'scalers': 'robust', 'ratios': 'log_ratio', 'imputers': 'none', 'n_estimators': 2750, 'learning_rate': 0.31139619032458815, 'max_depth': 11, 'min_child_weight': 1, 'subsample': 0.6, 'colsample_bytree': 0.9, 'colsample_bylevel': 0.6, 'reg_alpha': 0.3063062071841332, 'reg_lambda': 13.997313639202973, 'gamma': 0.00123882350398211}. Best is trial 140 with value: -2.9803742159464854.
[I 2026-07-14 20:59:51,228] Trial 176 finished with value: -0.8787995451358016 and parameters: {'scalers': 'robust', 'ratios': 'log_ratio', 'imputers': 'none', 'n_estimators': 2750, 'learning_rate': 0.4940579806250615, 'max_depth': 11, 'min_child_weight': 1, 'subsample': 0.6, 'colsample_bytree': 0.7, 'colsample_bylevel': 0.6, 'reg_alpha': 0.2370563366845005, 'reg_lambda': 15.520165749100023, 'gamma': 0.0002507395166310104}. Best is trial 140 with value: -2.9803742159464854.
[I 2026-07-14 21:00:07,794] Trial 178 finished with value: -0.054440683847373675 and parameters: {'scalers': 'robust', 'ratios': 'log_ratio', 'imputers': 'none', 'n_estimators': 2800, 'learning_rate': 0.4989956138214835, 'max_depth': 11, 'min_child_weight': 1, 'subsample': 0.6, 'colsample_bytree': 0.7, 'colsample_bylevel': 0.6, 'reg_alpha': 0.19032888897446656, 'reg_lambda': 17.553722567063655, 'gamma': 56.33577542762803}. Best is trial 140 with value: -2.9803742159464854.
[I 2026-07-14 21:00:17,873] Trial 177 finished with value: -0.43478715882727914 and parameters: {'scalers': 'robust', 'ratios': 'log_ratio', 'imputers': 'none', 'n_estimators': 2800, 'learning_rate': 0.23278160542140092, 'max_depth': 11, 'min_child_weight': 1, 'subsample': 0.6, 'colsample_bytree': 0.7, 'colsample_bylevel': 0.6, 'reg_alpha': 0.20259087630866726, 'reg_lambda': 16.46336191598778, 'gamma': 0.00027963461427384746}. Best is trial 140 with value: -2.9803742159464854.
[I 2026-07-14 21:00:50,953] Trial 179 finished with value: -1.0720617074825247 and parameters: {'scalers': 'robust', 'ratios': 'log_ratio', 'imputers': 'none', 'n_estimators': 2900, 'learning_rate': 0.4950612658359507, 'max_depth': 11, 'min_child_weight': 1, 'subsample': 0.6, 'colsample_bytree': 0.7, 'colsample_bylevel': 0.6, 'reg_alpha': 0.2801835691558546, 'reg_lambda': 20.606442780952378, 'gamma': 0.0004583541372954643}. Best is trial 140 with value: -2.9803742159464854.
