[I 2026-07-14 18:39:14,786] Trial 135 finished with value: -0.058626739901439635 and parameters: {'scalers': 'standard', 'ratios': 'log_ratio', 'imputers': 'none', 'n_estimators': 2850, 'learning_rate': 0.00010592148574408499, 'max_depth': 11, 'min_child_weight': 8, 'subsample': 0.8, 'colsample_bytree': 0.9, 'colsample_bylevel': 0.6, 'reg_alpha': 0.08240951396998128, 'reg_lambda': 3.6046942799310883e-06, 'gamma': 5.694752797569145e-05}. Best is trial 134 with value: -0.15313984895317048.
[I 2026-07-14 18:39:31,821] Trial 136 finished with value: -0.14901644734122285 and parameters: {'scalers': 'standard', 'ratios': 'log_ratio', 'imputers': 'none', 'n_estimators': 2800, 'learning_rate': 0.31137670806820106, 'max_depth': 11, 'min_child_weight': 8, 'subsample': 0.8, 'colsample_bytree': 0.5, 'colsample_bylevel': 0.6, 'reg_alpha': 0.06537717675686656, 'reg_lambda': 4.632600235351513e-06, 'gamma': 0.0001582543835776673}. Best is trial 134 with value: -0.15313984895317048.
[I 2026-07-14 18:39:56,210] Trial 137 finished with value: -0.1416590302885848 and parameters: {'scalers': 'standard', 'ratios': 'log_ratio', 'imputers': 'none', 'n_estimators': 2850, 'learning_rate': 0.3252972241937651, 'max_depth': 11, 'min_child_weight': 8, 'subsample': 0.9, 'colsample_bytree': 0.9, 'colsample_bylevel': 0.6, 'reg_alpha': 0.06591451303556835, 'reg_lambda': 4.000257929200613e-06, 'gamma': 0.00014305594777319896}. Best is trial 134 with value: -0.15313984895317048.
[I 2026-07-14 18:40:14,892] Trial 138 finished with value: -0.15008534791492853 and parameters: {'scalers': 'standard', 'ratios': 'log_ratio', 'imputers': 'none', 'n_estimators': 2850, 'learning_rate': 0.3233309138577335, 'max_depth': 12, 'min_child_weight': 8, 'subsample': 0.8, 'colsample_bytree': 0.5, 'colsample_bylevel': 0.6, 'reg_alpha': 0.057649516630647865, 'reg_lambda': 4.699960721746152e-06, 'gamma': 6.697349460412198e-05}. Best is trial 134 with value: -0.15313984895317048.
[I 2026-07-14 18:40:33,650] Trial 139 finished with value: -0.14886844518116316 and parameters: {'scalers': 'standard', 'ratios': 'log_ratio', 'imputers': 'none', 'n_estimators': 2850, 'learning_rate': 0.33114209588116694, 'max_depth': 12, 'min_child_weight': 8, 'subsample': 0.8, 'colsample_bytree': 0.5, 'colsample_bylevel': 0.6, 'reg_alpha': 0.06625279903678791, 'reg_lambda': 3.4798246991246265e-06, 'gamma': 6.784059420221418e-05}. Best is trial 134 with value: -0.15313984895317048.
[I 2026-07-14 18:40:52,163] Trial 140 finished with value: -0.16021011785038244 and parameters: {'scalers': 'standard', 'ratios': 'log_ratio', 'imputers': 'none', 'n_estimators': 2800, 'learning_rate': 0.3241851015392529, 'max_depth': 12, 'min_child_weight': 8, 'subsample': 0.8, 'colsample_bytree': 0.5, 'colsample_bylevel': 0.6, 'reg_alpha': 0.07122200022267249, 'reg_lambda': 5.48775568094315e-06, 'gamma': 6.617738201791368e-05}. Best is trial 140 with value: -0.16021011785038244.
[I 2026-07-14 18:41:16,976] Trial 141 finished with value: -0.1503527602973738 and parameters: {'scalers': 'standard', 'ratios': 'log_ratio', 'imputers': 'none', 'n_estimators': 2800, 'learning_rate': 0.3234553641238227, 'max_depth': 12, 'min_child_weight': 8, 'subsample': 0.8, 'colsample_bytree': 0.9, 'colsample_bylevel': 0.6, 'reg_alpha': 0.07013954411106077, 'reg_lambda': 1.039153720877388e-06, 'gamma': 0.00014151469853844283}. Best is trial 140 with value: -0.16021011785038244.
[I 2026-07-14 18:41:34,800] Trial 142 finished with value: -0.1458218978995025 and parameters: {'scalers': 'standard', 'ratios': 'log_ratio', 'imputers': 'none', 'n_estimators': 2800, 'learning_rate': 0.31777891806947006, 'max_depth': 11, 'min_child_weight': 8, 'subsample': 0.9, 'colsample_bytree': 0.5, 'colsample_bylevel': 0.6, 'reg_alpha': 0.06786991142691229, 'reg_lambda': 2.692955378495759e-06, 'gamma': 0.00017657722716727344}. Best is trial 140 with value: -0.16021011785038244.
[I 2026-07-14 18:41:52,024] Trial 143 finished with value: -0.15121571099317305 and parameters: {'scalers': 'standard', 'ratios': 'log_ratio', 'imputers': 'none', 'n_estimators': 2750, 'learning_rate': 0.29850949581025055, 'max_depth': 12, 'min_child_weight': 8, 'subsample': 0.8, 'colsample_bytree': 0.5, 'colsample_bylevel': 0.5, 'reg_alpha': 0.15698473175809113, 'reg_lambda': 3.207661233663361e-05, 'gamma': 0.0001479572177157573}. Best is trial 140 with value: -0.16021011785038244.
[I 2026-07-14 18:42:10,118] Trial 144 finished with value: -0.14732548977943621 and parameters: {'scalers': 'standard', 'ratios': 'log_ratio', 'imputers': 'none', 'n_estimators': 2750, 'learning_rate': 0.2951573755118549, 'max_depth': 12, 'min_child_weight': 8, 'subsample': 0.9, 'colsample_bytree': 0.5, 'colsample_bylevel': 0.5, 'reg_alpha': 0.05559730626989171, 'reg_lambda': 1.2892586413433623e-06, 'gamma': 0.0001397324911061447}. Best is trial 140 with value: -0.16021011785038244.
[I 2026-07-14 18:42:27,398] Trial 145 finished with value: -0.15321810403572872 and parameters: {'scalers': 'standard', 'ratios': 'log_ratio', 'imputers': 'none', 'n_estimators': 2750, 'learning_rate': 0.2994100210773806, 'max_depth': 12, 'min_child_weight': 8, 'subsample': 0.8, 'colsample_bytree': 0.5, 'colsample_bylevel': 0.5, 'reg_alpha': 0.178419834643672, 'reg_lambda': 1.8548760397790078e-06, 'gamma': 6.881206571524748e-05}. Best is trial 140 with value: -0.16021011785038244.
[I 2026-07-14 18:42:45,901] Trial 146 finished with value: -0.14898368059563122 and parameters: {'scalers': 'standard', 'ratios': 'log_ratio', 'imputers': 'none', 'n_estimators': 2750, 'learning_rate': 0.292497810645312, 'max_depth': 12, 'min_child_weight': 8, 'subsample': 0.9, 'colsample_bytree': 0.5, 'colsample_bylevel': 0.5, 'reg_alpha': 0.211379980164674, 'reg_lambda': 1.0512435154572633e-06, 'gamma': 0.00011524050843464598}. Best is trial 140 with value: -0.16021011785038244.
[I 2026-07-14 18:43:04,174] Trial 147 finished with value: -0.14950783283098013 and parameters: {'scalers': 'standard', 'ratios': 'log_ratio', 'imputers': 'none', 'n_estimators': 2750, 'learning_rate': 0.2991857034359702, 'max_depth': 12, 'min_child_weight': 8, 'subsample': 0.9, 'colsample_bytree': 0.5, 'colsample_bylevel': 0.5, 'reg_alpha': 0.16860232886276905, 'reg_lambda': 1.3085388411858026e-06, 'gamma': 6.707076102688185e-05}. Best is trial 140 with value: -0.16021011785038244.
[I 2026-07-14 18:43:21,014] Trial 148 finished with value: -0.14799715038286762 and parameters: {'scalers': 'standard', 'ratios': 'log_ratio', 'imputers': 'none', 'n_estimators': 2750, 'learning_rate': 0.2968054963848665, 'max_depth': 12, 'min_child_weight': 8, 'subsample': 0.8, 'colsample_bytree': 0.5, 'colsample_bylevel': 0.5, 'reg_alpha': 0.05426216306296571, 'reg_lambda': 2.0099228609656954e-06, 'gamma': 8.11240397673975e-05}. Best is trial 140 with value: -0.16021011785038244.
[I 2026-07-14 18:43:44,446] Trial 149 finished with value: -0.14547636216825147 and parameters: {'scalers': 'standard', 'ratios': 'log_ratio', 'imputers': 'none', 'n_estimators': 2750, 'learning_rate': 0.29649859988682753, 'max_depth': 12, 'min_child_weight': 8, 'subsample': 0.8, 'colsample_bytree': 1.0, 'colsample_bylevel': 0.5, 'reg_alpha': 0.20773300984135254, 'reg_lambda': 1.0345223466826856e-06, 'gamma': 7.411120136559791e-05}. Best is trial 140 with value: -0.16021011785038244.
[I 2026-07-14 18:44:06,951] Trial 150 finished with value: -0.13849216845441373 and parameters: {'scalers': 'standard', 'ratios': 'log_ratio', 'imputers': 'none', 'n_estimators': 2750, 'learning_rate': 0.21507286934782122, 'max_depth': 12, 'min_child_weight': 8, 'subsample': 0.8, 'colsample_bytree': 1.0, 'colsample_bylevel': 0.5, 'reg_alpha': 0.18473399063343815, 'reg_lambda': 1.8472046544253666e-06, 'gamma': 7.621740590854224e-05}. Best is trial 140 with value: -0.16021011785038244.
[I 2026-07-14 18:44:29,913] Trial 151 finished with value: -0.1385036209636372 and parameters: {'scalers': 'standard', 'ratios': 'log_ratio', 'imputers': 'none', 'n_estimators': 2750, 'learning_rate': 0.22926204002908152, 'max_depth': 12, 'min_child_weight': 8, 'subsample': 0.8, 'colsample_bytree': 1.0, 'colsample_bylevel': 0.5, 'reg_alpha': 0.017959129228099592, 'reg_lambda': 1.0018871656533659e-06, 'gamma': 0.00010731597433952377}. Best is trial 140 with value: -0.16021011785038244.
[I 2026-07-14 18:44:46,352] Trial 152 finished with value: -0.14228257296090707 and parameters: {'scalers': 'standard', 'ratios': 'log_ratio', 'imputers': 'none', 'n_estimators': 2750, 'learning_rate': 0.21769436440498302, 'max_depth': 12, 'min_child_weight': 8, 'subsample': 0.8, 'colsample_bytree': 0.5, 'colsample_bylevel': 0.5, 'reg_alpha': 0.20944896103379673, 'reg_lambda': 1.8943170055697582e-06, 'gamma': 8.735915653659312e-05}. Best is trial 140 with value: -0.16021011785038244.
[I 2026-07-14 18:45:08,861] Trial 153 finished with value: -0.14052308163266253 and parameters: {'scalers': 'standard', 'ratios': 'norm_ratio', 'imputers': 'none', 'n_estimators': 2750, 'learning_rate': 0.23412951782737063, 'max_depth': 12, 'min_child_weight': 8, 'subsample': 0.8, 'colsample_bytree': 1.0, 'colsample_bylevel': 0.5, 'reg_alpha': 0.34867650477740614, 'reg_lambda': 1.8944664491932779e-06, 'gamma': 8.978475897113398e-05}. Best is trial 140 with value: -0.16021011785038244.
[I 2026-07-14 18:45:31,278] Trial 154 finished with value: -0.1416360746093516 and parameters: {'scalers': 'standard', 'ratios': 'norm_ratio', 'imputers': 'mean', 'n_estimators': 2600, 'learning_rate': 0.21810755654879388, 'max_depth': 12, 'min_child_weight': 7, 'subsample': 0.8, 'colsample_bytree': 1.0, 'colsample_bylevel': 0.5, 'reg_alpha': 0.16704630882343388, 'reg_lambda': 1.8694189024254039e-06, 'gamma': 8.31641192500543e-05}. Best is trial 140 with value: -0.16021011785038244.
[I 2026-07-14 18:45:46,348] Trial 155 finished with value: -0.1312798865614232 and parameters: {'scalers': 'standard', 'ratios': 'norm_ratio', 'imputers': 'mean', 'n_estimators': 2600, 'learning_rate': 0.2808904527927064, 'max_depth': 12, 'min_child_weight': 7, 'subsample': 1.0, 'colsample_bytree': 0.9, 'colsample_bylevel': 0.5, 'reg_alpha': 0.3410556422511267, 'reg_lambda': 2.0438069532372323e-06, 'gamma': 3.0087963052345328e-05}. Best is trial 140 with value: -0.16021011785038244.
[I 2026-07-14 18:46:03,272] Trial 156 finished with value: -0.12503813836388078 and parameters: {'scalers': 'standard', 'ratios': 'norm_ratio', 'imputers': 'mean', 'n_estimators': 2600, 'learning_rate': 0.21847892141104538, 'max_depth': 12, 'min_child_weight': 7, 'subsample': 1.0, 'colsample_bytree': 0.9, 'colsample_bylevel': 0.5, 'reg_alpha': 0.3763902801402866, 'reg_lambda': 1.8473740317121874e-06, 'gamma': 2.928229053073968e-05}. Best is trial 140 with value: -0.16021011785038244.
[I 2026-07-14 18:46:20,781] Trial 157 finished with value: -0.1200800777015521 and parameters: {'scalers': 'standard', 'ratios': 'norm_ratio', 'imputers': 'mean', 'n_estimators': 2600, 'learning_rate': 0.22088645300775822, 'max_depth': 12, 'min_child_weight': 8, 'subsample': 1.0, 'colsample_bytree': 0.9, 'colsample_bylevel': 0.5, 'reg_alpha': 0.15112755005561113, 'reg_lambda': 6.629756476751197e-06, 'gamma': 5.316068102370416e-05}. Best is trial 140 with value: -0.16021011785038244.
[I 2026-07-14 18:46:34,337] Trial 158 finished with value: -0.13343874909680778 and parameters: {'scalers': 'standard', 'ratios': 'norm_ratio', 'imputers': 'mean', 'n_estimators': 2600, 'learning_rate': 0.21612298564025265, 'max_depth': 12, 'min_child_weight': 7, 'subsample': 1.0, 'colsample_bytree': 0.5, 'colsample_bylevel': 0.5, 'reg_alpha': 0.357522299830316, 'reg_lambda': 8.602653982908638e-06, 'gamma': 2.4263687449604852e-05}. Best is trial 140 with value: -0.16021011785038244.
[I 2026-07-14 18:46:52,700] Trial 159 finished with value: -0.1504824443765423 and parameters: {'scalers': 'standard', 'ratios': 'norm_ratio', 'imputers': 'mean', 'n_estimators': 2950, 'learning_rate': 0.21455384420906853, 'max_depth': 12, 'min_child_weight': 7, 'subsample': 0.8, 'colsample_bytree': 0.5, 'colsample_bylevel': 0.5, 'reg_alpha': 0.3087156729091982, 'reg_lambda': 7.58983161499214e-06, 'gamma': 3.979784691232346e-05}. Best is trial 140 with value: -0.16021011785038244.
[I 2026-07-14 18:47:08,679] Trial 160 finished with value: -0.13079349841085763 and parameters: {'scalers': 'standard', 'ratios': 'norm_ratio', 'imputers': 'mean', 'n_estimators': 2950, 'learning_rate': 0.12925862035479904, 'max_depth': 12, 'min_child_weight': 7, 'subsample': 0.8, 'colsample_bytree': 0.5, 'colsample_bylevel': 0.5, 'reg_alpha': 0.34537764813462407, 'reg_lambda': 7.591757646565196e-06, 'gamma': 3.8011808227413096e-05}. Best is trial 140 with value: -0.16021011785038244.
[I 2026-07-14 18:47:24,752] Trial 161 finished with value: -0.13088542231003678 and parameters: {'scalers': 'standard', 'ratios': 'log_ratio', 'imputers': 'mean', 'n_estimators': 2600, 'learning_rate': 0.3561579460384173, 'max_depth': 12, 'min_child_weight': 7, 'subsample': 1.0, 'colsample_bytree': 0.9, 'colsample_bylevel': 0.5, 'reg_alpha': 0.15242494701174167, 'reg_lambda': 6.865171252886492e-06, 'gamma': 2.8365399644833405e-05}. Best is trial 140 with value: -0.16021011785038244.
[I 2026-07-14 18:47:37,678] Trial 162 finished with value: -0.1368168539007333 and parameters: {'scalers': 'standard', 'ratios': 'log_ratio', 'imputers': 'none', 'n_estimators': 2950, 'learning_rate': 0.3357476151624117, 'max_depth': 11, 'min_child_weight': 7, 'subsample': 1.0, 'colsample_bytree': 0.5, 'colsample_bylevel': 0.5, 'reg_alpha': 0.014359320716998648, 'reg_lambda': 6.3063078968480984e-06, 'gamma': 2.8733573919470576e-05}. Best is trial 140 with value: -0.16021011785038244.
[I 2026-07-14 18:47:50,779] Trial 163 finished with value: -0.1368734054919442 and parameters: {'scalers': 'standard', 'ratios': 'log_ratio', 'imputers': 'none', 'n_estimators': 2950, 'learning_rate': 0.3518539514584788, 'max_depth': 11, 'min_child_weight': 7, 'subsample': 1.0, 'colsample_bytree': 0.5, 'colsample_bylevel': 0.5, 'reg_alpha': 0.01397840657235549, 'reg_lambda': 8.977967819105955e-06, 'gamma': 4.811811861276661e-05}. Best is trial 140 with value: -0.16021011785038244.
[I 2026-07-14 18:48:07,007] Trial 164 finished with value: -0.15488243562193496 and parameters: {'scalers': 'standard', 'ratios': 'log_ratio', 'imputers': 'none', 'n_estimators': 2900, 'learning_rate': 0.36305831485867546, 'max_depth': 11, 'min_child_weight': 8, 'subsample': 0.8, 'colsample_bytree': 0.5, 'colsample_bylevel': 0.5, 'reg_alpha': 0.14584867154677178, 'reg_lambda': 6.918157791029615e-06, 'gamma': 4.173309165000009e-05}. Best is trial 140 with value: -0.16021011785038244.
[I 2026-07-14 18:48:24,294] Trial 165 finished with value: -0.15431982173162115 and parameters: {'scalers': 'standard', 'ratios': 'log_ratio', 'imputers': 'none', 'n_estimators': 2950, 'learning_rate': 0.3439085502637044, 'max_depth': 11, 'min_child_weight': 8, 'subsample': 0.8, 'colsample_bytree': 0.5, 'colsample_bylevel': 0.6, 'reg_alpha': 0.010014575110056868, 'reg_lambda': 7.93923114652323e-06, 'gamma': 0.0002446702254309914}. Best is trial 140 with value: -0.16021011785038244.
[I 2026-07-14 18:48:39,834] Trial 166 finished with value: -0.32876806987460405 and parameters: {'scalers': 'standard', 'ratios': 'log_ratio', 'imputers': 'none', 'n_estimators': 2950, 'learning_rate': 0.4892526517075631, 'max_depth': 11, 'min_child_weight': 1, 'subsample': 0.8, 'colsample_bytree': 0.5, 'colsample_bylevel': 0.6, 'reg_alpha': 0.009757272713293085, 'reg_lambda': 3.996942977234348e-05, 'gamma': 0.0002451788836383976}. Best is trial 166 with value: -0.32876806987460405.
[I 2026-07-14 18:48:56,040] Trial 167 finished with value: -0.17209029075246643 and parameters: {'scalers': 'standard', 'ratios': 'log_ratio', 'imputers': 'mean', 'n_estimators': 2950, 'learning_rate': 0.16493629168082827, 'max_depth': 11, 'min_child_weight': 3, 'subsample': 0.8, 'colsample_bytree': 0.5, 'colsample_bylevel': 0.5, 'reg_alpha': 0.009813655054935623, 'reg_lambda': 3.2425627368202414e-05, 'gamma': 4.382389547434276e-05}. Best is trial 166 with value: -0.32876806987460405.
[I 2026-07-14 18:49:12,851] Trial 168 finished with value: -0.15444602792302822 and parameters: {'scalers': 'standard', 'ratios': 'log_ratio', 'imputers': 'none', 'n_estimators': 2950, 'learning_rate': 0.3609171870286633, 'max_depth': 11, 'min_child_weight': 8, 'subsample': 0.8, 'colsample_bytree': 0.5, 'colsample_bylevel': 0.5, 'reg_alpha': 0.0009243388259448783, 'reg_lambda': 3.233476121161611e-05, 'gamma': 0.0001246235190154436}. Best is trial 166 with value: -0.32876806987460405.
[I 2026-07-14 18:49:29,614] Trial 169 finished with value: -0.23832306307879245 and parameters: {'scalers': 'standard', 'ratios': 'log_ratio', 'imputers': 'none', 'n_estimators': 2950, 'learning_rate': 0.3479590948165219, 'max_depth': 11, 'min_child_weight': 2, 'subsample': 0.8, 'colsample_bytree': 0.5, 'colsample_bylevel': 0.6, 'reg_alpha': 0.09464734533406642, 'reg_lambda': 3.6471714655687544e-05, 'gamma': 0.00023357920429912572}. Best is trial 166 with value: -0.32876806987460405.
[I 2026-07-14 18:49:46,775] Trial 170 finished with value: -0.15567085164021133 and parameters: {'scalers': 'standard', 'ratios': 'log_ratio', 'imputers': 'none', 'n_estimators': 2850, 'learning_rate': 0.3568378214374045, 'max_depth': 11, 'min_child_weight': 8, 'subsample': 0.8, 'colsample_bytree': 0.5, 'colsample_bylevel': 0.6, 'reg_alpha': 0.09338584421065523, 'reg_lambda': 2.952295653960629e-06, 'gamma': 0.0002580212041730668}. Best is trial 166 with value: -0.32876806987460405.
[I 2026-07-14 18:50:02,394] Trial 171 finished with value: -0.20932427986361674 and parameters: {'scalers': 'standard', 'ratios': 'log_ratio', 'imputers': 'none', 'n_estimators': 2900, 'learning_rate': 0.16794558518045358, 'max_depth': 11, 'min_child_weight': 1, 'subsample': 0.8, 'colsample_bytree': 0.5, 'colsample_bylevel': 0.6, 'reg_alpha': 0.000937540506345751, 'reg_lambda': 2.861346921675798e-05, 'gamma': 0.00022542674470381379}. Best is trial 166 with value: -0.32876806987460405.
[I 2026-07-14 18:50:09,503] Trial 172 finished with value: -0.18919191628437584 and parameters: {'scalers': 'standard', 'ratios': 'log_ratio', 'imputers': 'none', 'n_estimators': 1400, 'learning_rate': 0.16669030248468453, 'max_depth': 11, 'min_child_weight': 1, 'subsample': 0.8, 'colsample_bytree': 0.5, 'colsample_bylevel': 0.5, 'reg_alpha': 0.0912114507406407, 'reg_lambda': 2.9951488031996683e-05, 'gamma': 5.306156864427081e-05}. Best is trial 166 with value: -0.32876806987460405.
[I 2026-07-14 18:50:25,309] Trial 173 finished with value: -0.16796563785765947 and parameters: {'scalers': 'robust', 'ratios': 'log_ratio', 'imputers': 'median', 'n_estimators': 2850, 'learning_rate': 0.16389297644285197, 'max_depth': 11, 'min_child_weight': 3, 'subsample': 0.8, 'colsample_bytree': 0.5, 'colsample_bylevel': 0.5, 'reg_alpha': 0.006133674713518104, 'reg_lambda': 3.792454114374159e-05, 'gamma': 0.00025757061717363884}. Best is trial 166 with value: -0.32876806987460405.
[I 2026-07-14 18:50:41,916] Trial 174 finished with value: -0.2216943230058011 and parameters: {'scalers': 'standard', 'ratios': 'log_ratio', 'imputers': 'median', 'n_estimators': 2850, 'learning_rate': 0.26332576250627276, 'max_depth': 11, 'min_child_weight': 2, 'subsample': 0.8, 'colsample_bytree': 0.5, 'colsample_bylevel': 0.6, 'reg_alpha': 0.10138615757895394, 'reg_lambda': 3.433911001039394e-05, 'gamma': 0.0002855417001104047}. Best is trial 166 with value: -0.32876806987460405.
[I 2026-07-14 18:50:57,426] Trial 175 finished with value: -0.1864652763892268 and parameters: {'scalers': 'standard', 'ratios': 'log_ratio', 'imputers': 'mean', 'n_estimators': 2850, 'learning_rate': 0.16702266208721128, 'max_depth': 11, 'min_child_weight': 2, 'subsample': 0.8, 'colsample_bytree': 0.5, 'colsample_bylevel': 0.6, 'reg_alpha': 0.007004293158736576, 'reg_lambda': 3.646560994919308e-05, 'gamma': 0.00022866530608888364}. Best is trial 166 with value: -0.32876806987460405.
[I 2026-07-14 18:51:12,984] Trial 176 finished with value: -0.12837091689296617 and parameters: {'scalers': 'standard', 'ratios': 'log_ratio', 'imputers': 'mean', 'n_estimators': 2850, 'learning_rate': 0.1648962758888578, 'max_depth': 11, 'min_child_weight': 8, 'subsample': 0.8, 'colsample_bytree': 0.5, 'colsample_bylevel': 0.5, 'reg_alpha': 0.08347394720361405, 'reg_lambda': 4.5221695180202215e-05, 'gamma': 0.00023384606447135042}. Best is trial 166 with value: -0.32876806987460405.
[I 2026-07-14 18:51:27,794] Trial 177 finished with value: -0.18857376457810068 and parameters: {'scalers': 'standard', 'ratios': 'log_ratio', 'imputers': 'mean', 'n_estimators': 2850, 'learning_rate': 0.17794602265499432, 'max_depth': 11, 'min_child_weight': 2, 'subsample': 0.8, 'colsample_bytree': 0.5, 'colsample_bylevel': 0.5, 'reg_alpha': 0.008959741665587485, 'reg_lambda': 3.982681960883084e-05, 'gamma': 0.0002719526707755913}. Best is trial 166 with value: -0.32876806987460405.
[I 2026-07-14 18:51:43,492] Trial 178 finished with value: -0.18551254436726589 and parameters: {'scalers': 'standard', 'ratios': 'log_ratio', 'imputers': 'mean', 'n_estimators': 2850, 'learning_rate': 0.17918732993399258, 'max_depth': 11, 'min_child_weight': 2, 'subsample': 0.8, 'colsample_bytree': 0.5, 'colsample_bylevel': 0.6, 'reg_alpha': 0.008597045789426066, 'reg_lambda': 3.2825137646741226e-05, 'gamma': 0.0002570563376133144}. Best is trial 166 with value: -0.32876806987460405.
[I 2026-07-14 18:51:59,052] Trial 179 finished with value: -0.1941702729339214 and parameters: {'scalers': 'standard', 'ratios': 'log_ratio', 'imputers': 'mean', 'n_estimators': 2850, 'learning_rate': 0.12812735747845466, 'max_depth': 11, 'min_child_weight': 1, 'subsample': 0.8, 'colsample_bytree': 0.5, 'colsample_bylevel': 0.6, 'reg_alpha': 0.007371396551871809, 'reg_lambda': 3.6438110296777746e-05, 'gamma': 0.0002510148864600382}. Best is trial 166 with value: -0.32876806987460405.
