[I 2026-07-14 17:36:59,676] Trial 135 finished with value: -1.2411418206113636 and parameters: {'scalers': 'standard', 'ratios': 'log_ratio', 'imputers': 'median', 'n_estimators': 650, 'learning_rate': 0.29119833368903664, 'max_depth': 7, 'min_child_weight': 1, 'subsample': 0.5, 'colsample_bytree': 0.6, 'colsample_bylevel': 0.9, 'reg_alpha': 0.0058157020791647215, 'reg_lambda': 21.673285106075785, 'gamma': 2.2347745458122553e-05}. Best is trial 124 with value: -1.812333989930264.
[I 2026-07-14 17:37:04,159] Trial 136 finished with value: -1.023605145693392 and parameters: {'scalers': 'standard', 'ratios': 'log_ratio', 'imputers': 'median', 'n_estimators': 800, 'learning_rate': 0.30747560021223486, 'max_depth': 6, 'min_child_weight': 1, 'subsample': 0.5, 'colsample_bytree': 0.6, 'colsample_bylevel': 0.9, 'reg_alpha': 0.005840119429832585, 'reg_lambda': 2.4182380677094883, 'gamma': 5.62414050138575e-06}. Best is trial 124 with value: -1.812333989930264.
[I 2026-07-14 17:37:13,828] Trial 137 finished with value: -1.3226934949853524 and parameters: {'scalers': 'standard', 'ratios': 'log_ratio', 'imputers': 'median', 'n_estimators': 850, 'learning_rate': 0.30634337872988465, 'max_depth': 7, 'min_child_weight': 1, 'subsample': 0.5, 'colsample_bytree': 0.6, 'colsample_bylevel': 0.9, 'reg_alpha': 0.023967266586282034, 'reg_lambda': 49.152632520838765, 'gamma': 4.634443265574219e-06}. Best is trial 124 with value: -1.812333989930264.
[I 2026-07-14 17:37:20,465] Trial 138 finished with value: -1.1681180453304032 and parameters: {'scalers': 'standard', 'ratios': 'log_ratio', 'imputers': 'median', 'n_estimators': 800, 'learning_rate': 0.30711016468067937, 'max_depth': 6, 'min_child_weight': 1, 'subsample': 0.5, 'colsample_bytree': 0.6, 'colsample_bylevel': 0.9, 'reg_alpha': 0.00618162800239398, 'reg_lambda': 31.596737981296013, 'gamma': 1.8105900012259728e-06}. Best is trial 124 with value: -1.812333989930264.
[I 2026-07-14 17:37:26,830] Trial 139 finished with value: -1.1336877957445346 and parameters: {'scalers': 'standard', 'ratios': 'log_ratio', 'imputers': 'median', 'n_estimators': 750, 'learning_rate': 0.29600267742730585, 'max_depth': 6, 'min_child_weight': 1, 'subsample': 0.5, 'colsample_bytree': 0.6, 'colsample_bylevel': 0.9, 'reg_alpha': 0.005507337215853362, 'reg_lambda': 42.01216573334669, 'gamma': 6.9219908485986505e-06}. Best is trial 124 with value: -1.812333989930264.
[I 2026-07-14 17:37:33,111] Trial 140 finished with value: -1.1691005134163168 and parameters: {'scalers': 'standard', 'ratios': 'log_ratio', 'imputers': 'median', 'n_estimators': 750, 'learning_rate': 0.30638980827850243, 'max_depth': 6, 'min_child_weight': 1, 'subsample': 0.5, 'colsample_bytree': 0.6, 'colsample_bylevel': 0.9, 'reg_alpha': 0.022938684520950686, 'reg_lambda': 43.80027912454145, 'gamma': 1.8825037529113133e-06}. Best is trial 124 with value: -1.812333989930264.
[I 2026-07-14 17:37:38,956] Trial 141 finished with value: -1.1487960456590809 and parameters: {'scalers': 'standard', 'ratios': 'log_ratio', 'imputers': 'median', 'n_estimators': 700, 'learning_rate': 0.30691211730297735, 'max_depth': 6, 'min_child_weight': 1, 'subsample': 0.5, 'colsample_bytree': 0.6, 'colsample_bylevel': 0.9, 'reg_alpha': 0.004638527625547314, 'reg_lambda': 32.07155137367431, 'gamma': 1.8450258103309239e-06}. Best is trial 124 with value: -1.812333989930264.
[I 2026-07-14 17:37:44,988] Trial 142 finished with value: -0.7508726364255243 and parameters: {'scalers': 'standard', 'ratios': 'log_ratio', 'imputers': 'median', 'n_estimators': 750, 'learning_rate': 0.0003292941026301187, 'max_depth': 6, 'min_child_weight': 1, 'subsample': 0.5, 'colsample_bytree': 0.6, 'colsample_bylevel': 0.9, 'reg_alpha': 0.03327475164699361, 'reg_lambda': 44.26641560913555, 'gamma': 1.8221595251541667e-06}. Best is trial 124 with value: -1.812333989930264.
[I 2026-07-14 17:37:52,249] Trial 143 finished with value: -1.1848747542806073 and parameters: {'scalers': 'standard', 'ratios': 'log_ratio', 'imputers': 'median', 'n_estimators': 850, 'learning_rate': 0.3132747653426923, 'max_depth': 6, 'min_child_weight': 1, 'subsample': 0.5, 'colsample_bytree': 0.6, 'colsample_bylevel': 0.9, 'reg_alpha': 0.16815132512680114, 'reg_lambda': 82.16578148573646, 'gamma': 6.6315186115736656e-06}. Best is trial 124 with value: -1.812333989930264.
[I 2026-07-14 17:37:58,370] Trial 144 finished with value: -1.3994717356437705 and parameters: {'scalers': 'standard', 'ratios': 'log_ratio', 'imputers': 'median', 'n_estimators': 900, 'learning_rate': 0.41618579690764496, 'max_depth': 6, 'min_child_weight': 1, 'subsample': 0.5, 'colsample_bytree': 0.5, 'colsample_bylevel': 0.8, 'reg_alpha': 0.037273323486579545, 'reg_lambda': 32.714743459369906, 'gamma': 1.7796840279514652e-06}. Best is trial 124 with value: -1.812333989930264.
[I 2026-07-14 17:38:06,349] Trial 145 finished with value: -1.3380285595894628 and parameters: {'scalers': 'standard', 'ratios': 'log_ratio', 'imputers': 'median', 'n_estimators': 1000, 'learning_rate': 0.41682522443588926, 'max_depth': 6, 'min_child_weight': 1, 'subsample': 0.5, 'colsample_bytree': 0.6, 'colsample_bylevel': 1.0, 'reg_alpha': 0.03974127018424603, 'reg_lambda': 6.369672678767721, 'gamma': 1.7071352684586272e-06}. Best is trial 124 with value: -1.812333989930264.
[I 2026-07-14 17:38:14,411] Trial 146 finished with value: -1.298966679090883 and parameters: {'scalers': 'standard', 'ratios': 'log_ratio', 'imputers': 'median', 'n_estimators': 1000, 'learning_rate': 0.40982320292517693, 'max_depth': 6, 'min_child_weight': 1, 'subsample': 0.5, 'colsample_bytree': 0.6, 'colsample_bylevel': 1.0, 'reg_alpha': 0.035839005694865415, 'reg_lambda': 6.765758116651001, 'gamma': 7.4299834002788356e-06}. Best is trial 124 with value: -1.812333989930264.
[I 2026-07-14 17:38:22,393] Trial 147 finished with value: -1.5387937092634218 and parameters: {'scalers': 'standard', 'ratios': 'log_ratio', 'imputers': 'median', 'n_estimators': 1000, 'learning_rate': 0.41224626875461395, 'max_depth': 7, 'min_child_weight': 1, 'subsample': 0.5, 'colsample_bytree': 0.5, 'colsample_bylevel': 0.8, 'reg_alpha': 0.04122389254640656, 'reg_lambda': 7.055434983097412, 'gamma': 1.5475261000781683e-06}. Best is trial 124 with value: -1.812333989930264.
[I 2026-07-14 17:38:33,750] Trial 148 finished with value: -1.496812200909201 and parameters: {'scalers': 'standard', 'ratios': 'log_ratio', 'imputers': 'median', 'n_estimators': 1050, 'learning_rate': 0.40594354692424767, 'max_depth': 7, 'min_child_weight': 1, 'subsample': 0.5, 'colsample_bytree': 0.6, 'colsample_bylevel': 1.0, 'reg_alpha': 0.03463667668106441, 'reg_lambda': 7.1077196001936525, 'gamma': 1.0060588735964825e-06}. Best is trial 124 with value: -1.812333989930264.
[I 2026-07-14 17:38:42,197] Trial 149 finished with value: -1.556534137249834 and parameters: {'scalers': 'standard', 'ratios': 'log_ratio', 'imputers': 'median', 'n_estimators': 1050, 'learning_rate': 0.4090024017770527, 'max_depth': 7, 'min_child_weight': 1, 'subsample': 0.5, 'colsample_bytree': 0.5, 'colsample_bylevel': 0.8, 'reg_alpha': 0.03706400290664434, 'reg_lambda': 7.297518020582278, 'gamma': 7.192540801402453e-06}. Best is trial 124 with value: -1.812333989930264.
[I 2026-07-14 17:38:50,757] Trial 150 finished with value: -1.601999503622652 and parameters: {'scalers': 'standard', 'ratios': 'log_ratio', 'imputers': 'median', 'n_estimators': 1050, 'learning_rate': 0.4107439908801573, 'max_depth': 7, 'min_child_weight': 1, 'subsample': 0.5, 'colsample_bytree': 0.5, 'colsample_bylevel': 0.8, 'reg_alpha': 0.14940434245167214, 'reg_lambda': 6.850374965003181, 'gamma': 7.281459837167462e-06}. Best is trial 124 with value: -1.812333989930264.
[I 2026-07-14 17:39:00,067] Trial 151 finished with value: -1.6078684427378753 and parameters: {'scalers': 'standard', 'ratios': 'log_ratio', 'imputers': 'median', 'n_estimators': 1050, 'learning_rate': 0.40632337469093777, 'max_depth': 7, 'min_child_weight': 1, 'subsample': 0.5, 'colsample_bytree': 0.5, 'colsample_bylevel': 0.8, 'reg_alpha': 1.346150303945191, 'reg_lambda': 7.822317026866619, 'gamma': 3.9105087319560475e-06}. Best is trial 124 with value: -1.812333989930264.
[I 2026-07-14 17:39:08,007] Trial 152 finished with value: -1.543676707750075 and parameters: {'scalers': 'standard', 'ratios': 'log_ratio', 'imputers': 'median', 'n_estimators': 1000, 'learning_rate': 0.41092382644352776, 'max_depth': 7, 'min_child_weight': 1, 'subsample': 0.5, 'colsample_bytree': 0.5, 'colsample_bylevel': 0.8, 'reg_alpha': 0.050182067316496604, 'reg_lambda': 7.111304554065776, 'gamma': 3.88332067538826e-06}. Best is trial 124 with value: -1.812333989930264.
[I 2026-07-14 17:39:16,711] Trial 153 finished with value: -1.610262204217615 and parameters: {'scalers': 'standard', 'ratios': 'log_ratio', 'imputers': 'median', 'n_estimators': 1050, 'learning_rate': 0.40413104501143504, 'max_depth': 7, 'min_child_weight': 1, 'subsample': 0.5, 'colsample_bytree': 0.5, 'colsample_bylevel': 0.8, 'reg_alpha': 0.3046238288637269, 'reg_lambda': 7.817840619151993, 'gamma': 1.0827731428706559e-06}. Best is trial 124 with value: -1.812333989930264.
[I 2026-07-14 17:39:25,715] Trial 154 finished with value: -1.708548867135979 and parameters: {'scalers': 'standard', 'ratios': 'log_ratio', 'imputers': 'median', 'n_estimators': 1050, 'learning_rate': 0.42008896679716035, 'max_depth': 7, 'min_child_weight': 1, 'subsample': 0.5, 'colsample_bytree': 0.5, 'colsample_bylevel': 0.8, 'reg_alpha': 0.05747890509729426, 'reg_lambda': 17.366532106315763, 'gamma': 1.1473214599133948e-06}. Best is trial 124 with value: -1.812333989930264.
[I 2026-07-14 17:39:27,231] Trial 155 finished with value: -0.9263673820907212 and parameters: {'scalers': 'standard', 'ratios': 'log_ratio', 'imputers': 'median', 'n_estimators': 900, 'learning_rate': 0.4038266343510861, 'max_depth': 4, 'min_child_weight': 1, 'subsample': 0.6, 'colsample_bytree': 0.5, 'colsample_bylevel': 0.8, 'reg_alpha': 0.43204628566556036, 'reg_lambda': 7.077024354989931, 'gamma': 1.1682759930079602e-06}. Best is trial 124 with value: -1.812333989930264.
[I 2026-07-14 17:39:34,946] Trial 156 finished with value: -1.2944177339998264 and parameters: {'scalers': 'standard', 'ratios': 'log_ratio', 'imputers': 'median', 'n_estimators': 1050, 'learning_rate': 0.3989525317763507, 'max_depth': 7, 'min_child_weight': 1, 'subsample': 0.6, 'colsample_bytree': 0.5, 'colsample_bylevel': 0.8, 'reg_alpha': 0.053684404311552934, 'reg_lambda': 3.060321894423094, 'gamma': 1.072698393207587e-06}. Best is trial 124 with value: -1.812333989930264.
[I 2026-07-14 17:39:43,773] Trial 157 finished with value: -1.4653115495075018 and parameters: {'scalers': 'standard', 'ratios': 'log_ratio', 'imputers': 'median', 'n_estimators': 1200, 'learning_rate': 0.4160425180489377, 'max_depth': 7, 'min_child_weight': 1, 'subsample': 0.5, 'colsample_bytree': 0.5, 'colsample_bylevel': 0.8, 'reg_alpha': 0.06797133293214089, 'reg_lambda': 3.377978515952361, 'gamma': 1.13660721397466e-06}. Best is trial 124 with value: -1.812333989930264.
[I 2026-07-14 17:39:53,526] Trial 158 finished with value: -1.604746411402511 and parameters: {'scalers': 'standard', 'ratios': 'log_ratio', 'imputers': 'median', 'n_estimators': 1200, 'learning_rate': 0.40644319350043756, 'max_depth': 7, 'min_child_weight': 1, 'subsample': 0.5, 'colsample_bytree': 0.5, 'colsample_bylevel': 0.8, 'reg_alpha': 0.42858998689404326, 'reg_lambda': 3.250122765456123, 'gamma': 3.399344927611761e-06}. Best is trial 124 with value: -1.812333989930264.
[I 2026-07-14 17:40:04,083] Trial 159 finished with value: -1.6228424267556747 and parameters: {'scalers': 'standard', 'ratios': 'log_ratio', 'imputers': 'median', 'n_estimators': 1200, 'learning_rate': 0.40438933924283416, 'max_depth': 7, 'min_child_weight': 1, 'subsample': 0.5, 'colsample_bytree': 0.5, 'colsample_bylevel': 0.8, 'reg_alpha': 1.0775952376229108, 'reg_lambda': 3.210533702242903, 'gamma': 1.3121651693835895e-06}. Best is trial 124 with value: -1.812333989930264.
[I 2026-07-14 17:40:14,642] Trial 160 finished with value: -1.6262767090106918 and parameters: {'scalers': 'standard', 'ratios': 'log_ratio', 'imputers': 'median', 'n_estimators': 1200, 'learning_rate': 0.3917502363437044, 'max_depth': 7, 'min_child_weight': 1, 'subsample': 0.5, 'colsample_bytree': 0.5, 'colsample_bylevel': 0.8, 'reg_alpha': 1.2708793413866832, 'reg_lambda': 3.31249699189664, 'gamma': 1.1181846249762195e-06}. Best is trial 124 with value: -1.812333989930264.
[I 2026-07-14 17:40:25,133] Trial 161 finished with value: -1.638114536033073 and parameters: {'scalers': 'standard', 'ratios': 'log_ratio', 'imputers': 'median', 'n_estimators': 1200, 'learning_rate': 0.40036015915814743, 'max_depth': 7, 'min_child_weight': 1, 'subsample': 0.5, 'colsample_bytree': 0.5, 'colsample_bylevel': 0.8, 'reg_alpha': 1.4320453099921915, 'reg_lambda': 3.055193779105808, 'gamma': 2.662241784189699e-06}. Best is trial 124 with value: -1.812333989930264.
[I 2026-07-14 17:40:33,708] Trial 162 finished with value: -1.406449052226306 and parameters: {'scalers': 'standard', 'ratios': 'log_ratio', 'imputers': 'median', 'n_estimators': 1200, 'learning_rate': 0.39309036617064647, 'max_depth': 7, 'min_child_weight': 1, 'subsample': 0.5, 'colsample_bytree': 0.5, 'colsample_bylevel': 0.8, 'reg_alpha': 0.05467588987844736, 'reg_lambda': 2.692104957482691, 'gamma': 1.2171084889154982e-06}. Best is trial 124 with value: -1.812333989930264.
[I 2026-07-14 17:40:43,563] Trial 163 finished with value: -1.4555727280641266 and parameters: {'scalers': 'standard', 'ratios': 'log_ratio', 'imputers': 'median', 'n_estimators': 1200, 'learning_rate': 0.3976323447133679, 'max_depth': 7, 'min_child_weight': 1, 'subsample': 0.5, 'colsample_bytree': 0.5, 'colsample_bylevel': 0.8, 'reg_alpha': 2.0008307574957422, 'reg_lambda': 3.272761849300508, 'gamma': 1.009124125704452e-06}. Best is trial 124 with value: -1.812333989930264.
[I 2026-07-14 17:40:53,829] Trial 164 finished with value: -1.6122728496763246 and parameters: {'scalers': 'standard', 'ratios': 'log_ratio', 'imputers': 'median', 'n_estimators': 1200, 'learning_rate': 0.3708850140137919, 'max_depth': 7, 'min_child_weight': 1, 'subsample': 0.5, 'colsample_bytree': 0.5, 'colsample_bylevel': 0.8, 'reg_alpha': 0.8139357937017562, 'reg_lambda': 3.192605503785527, 'gamma': 2.7020573597878706e-06}. Best is trial 124 with value: -1.812333989930264.
[I 2026-07-14 17:41:02,644] Trial 165 finished with value: -1.222638816526792 and parameters: {'scalers': 'standard', 'ratios': 'log_ratio', 'imputers': 'median', 'n_estimators': 1150, 'learning_rate': 0.36239297685594624, 'max_depth': 7, 'min_child_weight': 1, 'subsample': 0.5, 'colsample_bytree': 0.5, 'colsample_bylevel': 0.8, 'reg_alpha': 2.600961805572893, 'reg_lambda': 8.08919579316492, 'gamma': 2.537886353873339e-06}. Best is trial 124 with value: -1.812333989930264.
[I 2026-07-14 17:41:12,656] Trial 166 finished with value: -1.4242896055041137 and parameters: {'scalers': 'standard', 'ratios': 'log_ratio', 'imputers': 'median', 'n_estimators': 1200, 'learning_rate': 0.3644043464022787, 'max_depth': 7, 'min_child_weight': 1, 'subsample': 0.5, 'colsample_bytree': 0.5, 'colsample_bylevel': 0.8, 'reg_alpha': 1.879755483229479, 'reg_lambda': 2.0247798117646423, 'gamma': 2.4984001125738454e-06}. Best is trial 124 with value: -1.812333989930264.
[I 2026-07-14 17:41:22,635] Trial 167 finished with value: -1.4524999133856236 and parameters: {'scalers': 'standard', 'ratios': 'norm_ratio', 'imputers': 'median', 'n_estimators': 1150, 'learning_rate': 0.36253071428511924, 'max_depth': 7, 'min_child_weight': 1, 'subsample': 0.5, 'colsample_bytree': 0.5, 'colsample_bylevel': 0.8, 'reg_alpha': 1.6288927203152248, 'reg_lambda': 19.37629675038216, 'gamma': 2.469963655273022e-06}. Best is trial 124 with value: -1.812333989930264.
[I 2026-07-14 17:41:32,898] Trial 168 finished with value: -1.5693432487315147 and parameters: {'scalers': 'standard', 'ratios': 'log_ratio', 'imputers': 'median', 'n_estimators': 1200, 'learning_rate': 0.3638425105101294, 'max_depth': 7, 'min_child_weight': 1, 'subsample': 0.5, 'colsample_bytree': 0.5, 'colsample_bylevel': 0.8, 'reg_alpha': 0.9032647267805521, 'reg_lambda': 2.054952285080478, 'gamma': 2.5594477070137926e-06}. Best is trial 124 with value: -1.812333989930264.
[I 2026-07-14 17:41:43,452] Trial 169 finished with value: -1.516298916394348 and parameters: {'scalers': 'standard', 'ratios': 'log_ratio', 'imputers': 'median', 'n_estimators': 1200, 'learning_rate': 0.35360923705429964, 'max_depth': 7, 'min_child_weight': 1, 'subsample': 0.5, 'colsample_bytree': 0.5, 'colsample_bylevel': 0.8, 'reg_alpha': 1.4832279140075282, 'reg_lambda': 2.132238219974116, 'gamma': 2.6209509777888345e-06}. Best is trial 124 with value: -1.812333989930264.
[I 2026-07-14 17:41:53,907] Trial 170 finished with value: -1.5062231269581972 and parameters: {'scalers': 'standard', 'ratios': 'log_ratio', 'imputers': 'median', 'n_estimators': 1200, 'learning_rate': 0.3520338380723697, 'max_depth': 7, 'min_child_weight': 1, 'subsample': 0.5, 'colsample_bytree': 0.5, 'colsample_bylevel': 0.8, 'reg_alpha': 1.4958596375765425, 'reg_lambda': 1.9115882341799677, 'gamma': 2.5160734096334328e-06}. Best is trial 124 with value: -1.812333989930264.
[I 2026-07-14 17:42:03,791] Trial 171 finished with value: -1.247882071948099 and parameters: {'scalers': 'standard', 'ratios': 'log_ratio', 'imputers': 'median', 'n_estimators': 1150, 'learning_rate': 0.24837248856108635, 'max_depth': 7, 'min_child_weight': 1, 'subsample': 0.5, 'colsample_bytree': 0.5, 'colsample_bylevel': 0.8, 'reg_alpha': 1.3780475975637583, 'reg_lambda': 1.9979601388239452, 'gamma': 2.6431747848077395e-06}. Best is trial 124 with value: -1.812333989930264.
[I 2026-07-14 17:42:13,607] Trial 172 finished with value: -1.267505530136895 and parameters: {'scalers': 'standard', 'ratios': 'norm_ratio', 'imputers': 'median', 'n_estimators': 1150, 'learning_rate': 0.24845202491041016, 'max_depth': 7, 'min_child_weight': 1, 'subsample': 0.5, 'colsample_bytree': 0.5, 'colsample_bylevel': 0.8, 'reg_alpha': 1.040632200037536, 'reg_lambda': 2.3994719211229008, 'gamma': 2.6797359557548982e-06}. Best is trial 124 with value: -1.812333989930264.
[I 2026-07-14 17:42:24,132] Trial 173 finished with value: -1.2631499653371565 and parameters: {'scalers': 'standard', 'ratios': 'norm_ratio', 'imputers': 'median', 'n_estimators': 1250, 'learning_rate': 0.24230465951306115, 'max_depth': 7, 'min_child_weight': 1, 'subsample': 0.5, 'colsample_bytree': 0.5, 'colsample_bylevel': 0.8, 'reg_alpha': 1.007097133726527, 'reg_lambda': 2.086185753141864, 'gamma': 2.509604242431115e-06}. Best is trial 124 with value: -1.812333989930264.
[I 2026-07-14 17:42:35,224] Trial 174 finished with value: -1.3318350783134232 and parameters: {'scalers': 'standard', 'ratios': 'norm_ratio', 'imputers': 'median', 'n_estimators': 1250, 'learning_rate': 0.2458780776096798, 'max_depth': 7, 'min_child_weight': 1, 'subsample': 0.5, 'colsample_bytree': 0.5, 'colsample_bylevel': 0.8, 'reg_alpha': 0.8002563841343442, 'reg_lambda': 19.915143429372108, 'gamma': 3.488551192025415e-06}. Best is trial 124 with value: -1.812333989930264.
[I 2026-07-14 17:42:45,597] Trial 175 finished with value: -1.557540331583209 and parameters: {'scalers': 'standard', 'ratios': 'log_ratio', 'imputers': 'median', 'n_estimators': 1250, 'learning_rate': 0.357353904402532, 'max_depth': 7, 'min_child_weight': 1, 'subsample': 0.5, 'colsample_bytree': 0.5, 'colsample_bylevel': 0.8, 'reg_alpha': 0.7237830882077068, 'reg_lambda': 1.9644663004411385, 'gamma': 3.89626648524562e-06}. Best is trial 124 with value: -1.812333989930264.
[I 2026-07-14 17:42:55,567] Trial 176 finished with value: -1.297411015907293 and parameters: {'scalers': 'standard', 'ratios': 'log_ratio', 'imputers': 'median', 'n_estimators': 1250, 'learning_rate': 0.25409919259060554, 'max_depth': 7, 'min_child_weight': 1, 'subsample': 0.5, 'colsample_bytree': 0.5, 'colsample_bylevel': 0.8, 'reg_alpha': 0.5421345396804031, 'reg_lambda': 1.9895679746794999, 'gamma': 3.5761581436311218e-06}. Best is trial 124 with value: -1.812333989930264.
[I 2026-07-14 17:43:06,136] Trial 177 finished with value: -1.321068248015315 and parameters: {'scalers': 'standard', 'ratios': 'log_ratio', 'imputers': 'median', 'n_estimators': 1250, 'learning_rate': 0.2566186638398451, 'max_depth': 7, 'min_child_weight': 1, 'subsample': 0.5, 'colsample_bytree': 0.5, 'colsample_bylevel': 0.8, 'reg_alpha': 1.025172237568237, 'reg_lambda': 1.972492445198225, 'gamma': 3.2911456661692427e-06}. Best is trial 124 with value: -1.812333989930264.
[I 2026-07-14 17:43:21,249] Trial 178 finished with value: -1.3925900856563334 and parameters: {'scalers': 'standard', 'ratios': 'log_ratio', 'imputers': 'median', 'n_estimators': 1250, 'learning_rate': 0.2812217690327517, 'max_depth': 7, 'min_child_weight': 1, 'subsample': 0.5, 'colsample_bytree': 0.5, 'colsample_bylevel': 0.8, 'reg_alpha': 0.6439987104477956, 'reg_lambda': 3.9788324203893484, 'gamma': 3.5109768164333972e-06}. Best is trial 124 with value: -1.812333989930264.
[I 2026-07-14 17:43:27,256] Trial 179 finished with value: -1.2756497054614029 and parameters: {'scalers': 'standard', 'ratios': 'log_ratio', 'imputers': 'median', 'n_estimators': 1250, 'learning_rate': 0.23175041203548843, 'max_depth': 7, 'min_child_weight': 1, 'subsample': 0.5, 'colsample_bytree': 0.5, 'colsample_bylevel': 0.8, 'reg_alpha': 0.9742230829343401, 'reg_lambda': 3.5667284873818925, 'gamma': 7.900228374772524e-06}. Best is trial 124 with value: -1.812333989930264.
