[I 2026-07-14 17:13:14,521] Trial 135 finished with value: -0.34909764913184943 and parameters: {'scalers': 'standard', 'ratios': 'norm_ratio', 'imputers': 'mean', 'n_estimators': 2250, 'learning_rate': 0.1956176625231806, 'max_depth': 9, 'min_child_weight': 1, 'subsample': 0.9, 'colsample_bytree': 0.9, 'colsample_bylevel': 0.6, 'reg_alpha': 1.8677678243660425, 'reg_lambda': 2.7828343728240663e-05, 'gamma': 6.803481947674133e-05}. Best is trial 117 with value: -0.6588856402745613.
[I 2026-07-14 17:13:58,593] Trial 136 finished with value: -0.3623421762796967 and parameters: {'scalers': 'standard', 'ratios': 'norm_ratio', 'imputers': 'mean', 'n_estimators': 2200, 'learning_rate': 0.2055941723889595, 'max_depth': 9, 'min_child_weight': 1, 'subsample': 0.9, 'colsample_bytree': 0.9, 'colsample_bylevel': 0.6, 'reg_alpha': 1.7900683282765153, 'reg_lambda': 9.035774132493133e-05, 'gamma': 6.373102374740353e-05}. Best is trial 117 with value: -0.6588856402745613.
[I 2026-07-14 17:15:02,890] Trial 137 finished with value: -0.3613103915265206 and parameters: {'scalers': 'standard', 'ratios': 'norm_ratio', 'imputers': 'mean', 'n_estimators': 2250, 'learning_rate': 0.19739257244588904, 'max_depth': 9, 'min_child_weight': 1, 'subsample': 0.9, 'colsample_bytree': 0.9, 'colsample_bylevel': 1.0, 'reg_alpha': 1.8048453839846172, 'reg_lambda': 5.292493351354496e-05, 'gamma': 6.200946089646481e-05}. Best is trial 117 with value: -0.6588856402745613.
[I 2026-07-14 17:15:42,279] Trial 138 finished with value: -0.45396512362036107 and parameters: {'scalers': 'standard', 'ratios': 'norm_ratio', 'imputers': 'none', 'n_estimators': 2300, 'learning_rate': 0.3115272752415395, 'max_depth': 9, 'min_child_weight': 1, 'subsample': 0.5, 'colsample_bytree': 0.9, 'colsample_bylevel': 0.6, 'reg_alpha': 0.7691755888728457, 'reg_lambda': 3.458091429864744e-05, 'gamma': 6.384926241161352e-05}. Best is trial 117 with value: -0.6588856402745613.
[I 2026-07-14 17:16:20,616] Trial 139 finished with value: -0.45347843242328406 and parameters: {'scalers': 'standard', 'ratios': 'norm_ratio', 'imputers': 'mean', 'n_estimators': 2200, 'learning_rate': 0.30422559249159775, 'max_depth': 9, 'min_child_weight': 1, 'subsample': 0.5, 'colsample_bytree': 0.9, 'colsample_bylevel': 0.6, 'reg_alpha': 0.8107679822869234, 'reg_lambda': 2.7937342693308115e-05, 'gamma': 1.4769662756799816e-05}. Best is trial 117 with value: -0.6588856402745613.
[I 2026-07-14 17:16:59,554] Trial 140 finished with value: -0.47642391419742 and parameters: {'scalers': 'standard', 'ratios': 'norm_ratio', 'imputers': 'mean', 'n_estimators': 2250, 'learning_rate': 0.30652694841589995, 'max_depth': 9, 'min_child_weight': 1, 'subsample': 0.5, 'colsample_bytree': 0.9, 'colsample_bylevel': 0.6, 'reg_alpha': 1.7737394520006091, 'reg_lambda': 2.6782468522149007e-05, 'gamma': 1.3952144175699624e-05}. Best is trial 117 with value: -0.6588856402745613.
[I 2026-07-14 17:17:25,350] Trial 141 finished with value: -0.31370305863342685 and parameters: {'scalers': 'standard', 'ratios': 'norm_ratio', 'imputers': 'mean', 'n_estimators': 2250, 'learning_rate': 0.3172682946032523, 'max_depth': 9, 'min_child_weight': 1, 'subsample': 0.5, 'colsample_bytree': 0.9, 'colsample_bylevel': 0.6, 'reg_alpha': 0.07256738217699903, 'reg_lambda': 5.474340628631761e-05, 'gamma': 0.00012189007351984317}. Best is trial 117 with value: -0.6588856402745613.
[I 2026-07-14 17:18:02,513] Trial 142 finished with value: -0.4402554544870181 and parameters: {'scalers': 'standard', 'ratios': 'norm_ratio', 'imputers': 'none', 'n_estimators': 2300, 'learning_rate': 0.29996575691448574, 'max_depth': 9, 'min_child_weight': 1, 'subsample': 0.5, 'colsample_bytree': 0.9, 'colsample_bylevel': 0.6, 'reg_alpha': 2.1972265277480414, 'reg_lambda': 0.056500334374530455, 'gamma': 1.4739942011596038e-05}. Best is trial 117 with value: -0.6588856402745613.
[I 2026-07-14 17:18:41,378] Trial 143 finished with value: -0.4701518755013424 and parameters: {'scalers': 'standard', 'ratios': 'norm_ratio', 'imputers': 'none', 'n_estimators': 2200, 'learning_rate': 0.3077212019474107, 'max_depth': 9, 'min_child_weight': 1, 'subsample': 0.5, 'colsample_bytree': 0.9, 'colsample_bylevel': 0.6, 'reg_alpha': 1.648329481984962, 'reg_lambda': 0.058345276314920015, 'gamma': 1.3097046950253195e-05}. Best is trial 117 with value: -0.6588856402745613.
[I 2026-07-14 17:19:00,863] Trial 144 finished with value: -0.4027449169381726 and parameters: {'scalers': 'standard', 'ratios': 'norm_ratio', 'imputers': 'none', 'n_estimators': 1100, 'learning_rate': 0.3034133319825903, 'max_depth': 9, 'min_child_weight': 1, 'subsample': 0.5, 'colsample_bytree': 0.9, 'colsample_bylevel': 0.6, 'reg_alpha': 0.8876397845101746, 'reg_lambda': 0.05496186939369085, 'gamma': 0.00012633520570450873}. Best is trial 117 with value: -0.6588856402745613.
[I 2026-07-14 17:19:20,101] Trial 145 finished with value: -0.4088493888408679 and parameters: {'scalers': 'standard', 'ratios': 'norm_ratio', 'imputers': 'none', 'n_estimators': 1100, 'learning_rate': 0.3101092736356254, 'max_depth': 9, 'min_child_weight': 1, 'subsample': 0.5, 'colsample_bytree': 0.9, 'colsample_bylevel': 0.6, 'reg_alpha': 0.8129799486033933, 'reg_lambda': 0.049405335149030706, 'gamma': 0.0001312449479652428}. Best is trial 117 with value: -0.6588856402745613.
[I 2026-07-14 17:20:03,489] Trial 146 finished with value: -0.456034433336427 and parameters: {'scalers': 'standard', 'ratios': 'norm_ratio', 'imputers': 'none', 'n_estimators': 1850, 'learning_rate': 0.3123840585020459, 'max_depth': 10, 'min_child_weight': 1, 'subsample': 0.5, 'colsample_bytree': 1.0, 'colsample_bylevel': 0.6, 'reg_alpha': 0.8262558019146503, 'reg_lambda': 0.00016111704858892548, 'gamma': 0.00011565475006614444}. Best is trial 117 with value: -0.6588856402745613.
[I 2026-07-14 17:20:24,716] Trial 147 finished with value: -0.408917762692597 and parameters: {'scalers': 'standard', 'ratios': 'norm_ratio', 'imputers': 'mean', 'n_estimators': 1100, 'learning_rate': 0.3186341757996074, 'max_depth': 9, 'min_child_weight': 1, 'subsample': 0.5, 'colsample_bytree': 1.0, 'colsample_bylevel': 0.6, 'reg_alpha': 0.8324925573817187, 'reg_lambda': 4.786198450712175e-06, 'gamma': 1.5340492643004023e-05}. Best is trial 117 with value: -0.6588856402745613.
[I 2026-07-14 17:21:05,313] Trial 148 finished with value: -0.45886045033313794 and parameters: {'scalers': 'standard', 'ratios': 'norm_ratio', 'imputers': 'mean', 'n_estimators': 2300, 'learning_rate': 0.30582221039460206, 'max_depth': 9, 'min_child_weight': 1, 'subsample': 0.5, 'colsample_bytree': 0.9, 'colsample_bylevel': 0.6, 'reg_alpha': 0.8773893588944522, 'reg_lambda': 4.033374602265997e-05, 'gamma': 0.00012628840026957276}. Best is trial 117 with value: -0.6588856402745613.
[I 2026-07-14 17:21:43,042] Trial 149 finished with value: -0.45787347655941496 and parameters: {'scalers': 'standard', 'ratios': 'norm_ratio', 'imputers': 'mean', 'n_estimators': 2150, 'learning_rate': 0.3073799831794208, 'max_depth': 9, 'min_child_weight': 1, 'subsample': 0.5, 'colsample_bytree': 0.9, 'colsample_bylevel': 0.6, 'reg_alpha': 0.8545975055096019, 'reg_lambda': 3.3086957940884645e-06, 'gamma': 1.2216819346596238e-05}. Best is trial 117 with value: -0.6588856402745613.
[I 2026-07-14 17:22:22,315] Trial 150 finished with value: -0.47257930251199537 and parameters: {'scalers': 'standard', 'ratios': 'norm_ratio', 'imputers': 'mean', 'n_estimators': 2300, 'learning_rate': 0.32991944081589786, 'max_depth': 9, 'min_child_weight': 1, 'subsample': 0.5, 'colsample_bytree': 0.9, 'colsample_bylevel': 0.6, 'reg_alpha': 0.7613599487030903, 'reg_lambda': 2.9856552960285904e-05, 'gamma': 1.6760793226074064e-05}. Best is trial 117 with value: -0.6588856402745613.
[I 2026-07-14 17:22:59,088] Trial 151 finished with value: -0.45597127573209767 and parameters: {'scalers': 'standard', 'ratios': 'norm_ratio', 'imputers': 'mean', 'n_estimators': 2150, 'learning_rate': 0.2996391039566228, 'max_depth': 9, 'min_child_weight': 1, 'subsample': 0.5, 'colsample_bytree': 0.9, 'colsample_bylevel': 0.6, 'reg_alpha': 0.7799788940023638, 'reg_lambda': 1.4718574737769452e-05, 'gamma': 1.2584325703027034e-05}. Best is trial 117 with value: -0.6588856402745613.
[I 2026-07-14 17:23:22,868] Trial 153 finished with value: -0.1859426865902726 and parameters: {'scalers': 'standard', 'ratios': 'norm_ratio', 'imputers': 'mean', 'n_estimators': 600, 'learning_rate': 0.3673456876174862, 'max_depth': 9, 'min_child_weight': 1, 'subsample': 0.5, 'colsample_bytree': 0.9, 'colsample_bylevel': 0.6, 'reg_alpha': 16.492288617373134, 'reg_lambda': 2.372097485269158e-06, 'gamma': 1.1769765958832577e-05}. Best is trial 117 with value: -0.6588856402745613.
[I 2026-07-14 17:23:35,341] Trial 152 finished with value: -0.4786350672698198 and parameters: {'scalers': 'standard', 'ratios': 'norm_ratio', 'imputers': 'mean', 'n_estimators': 2150, 'learning_rate': 0.35132311638471925, 'max_depth': 9, 'min_child_weight': 1, 'subsample': 0.5, 'colsample_bytree': 0.9, 'colsample_bylevel': 0.6, 'reg_alpha': 0.7186805287983454, 'reg_lambda': 2.433089457356108e-06, 'gamma': 1.1503198538202019e-05}. Best is trial 117 with value: -0.6588856402745613.
[I 2026-07-14 17:23:42,910] Trial 154 finished with value: -0.3780410002599166 and parameters: {'scalers': 'standard', 'ratios': 'norm_ratio', 'imputers': 'mean', 'n_estimators': 500, 'learning_rate': 0.3626747985424961, 'max_depth': 10, 'min_child_weight': 1, 'subsample': 0.5, 'colsample_bytree': 0.9, 'colsample_bylevel': 0.6, 'reg_alpha': 0.6748409066237356, 'reg_lambda': 0.00013227707922319775, 'gamma': 1.1233865061842255e-05}. Best is trial 117 with value: -0.6588856402745613.
[I 2026-07-14 17:24:36,231] Trial 155 finished with value: -0.5566268981147828 and parameters: {'scalers': 'standard', 'ratios': 'norm_ratio', 'imputers': 'mean', 'n_estimators': 2450, 'learning_rate': 0.3673201974570624, 'max_depth': 10, 'min_child_weight': 1, 'subsample': 0.5, 'colsample_bytree': 0.9, 'colsample_bylevel': 0.6, 'reg_alpha': 1.3132557522723525, 'reg_lambda': 0.0001343347542370641, 'gamma': 8.11055709146051e-06}. Best is trial 117 with value: -0.6588856402745613.
[I 2026-07-14 17:25:25,434] Trial 156 finished with value: -0.5151680978161784 and parameters: {'scalers': 'standard', 'ratios': 'norm_ratio', 'imputers': 'mean', 'n_estimators': 2450, 'learning_rate': 0.37222318905167445, 'max_depth': 10, 'min_child_weight': 1, 'subsample': 0.5, 'colsample_bytree': 0.9, 'colsample_bylevel': 0.6, 'reg_alpha': 0.6238092515228939, 'reg_lambda': 0.0001351549428366374, 'gamma': 1.024064623784906e-05}. Best is trial 117 with value: -0.6588856402745613.
[I 2026-07-14 17:26:09,233] Trial 157 finished with value: -0.4851273472382537 and parameters: {'scalers': 'standard', 'ratios': 'norm_ratio', 'imputers': 'mean', 'n_estimators': 2150, 'learning_rate': 0.36504404423372483, 'max_depth': 10, 'min_child_weight': 1, 'subsample': 0.5, 'colsample_bytree': 0.9, 'colsample_bylevel': 0.6, 'reg_alpha': 0.642409026512784, 'reg_lambda': 0.0001297406850682465, 'gamma': 1.1720326300343807e-05}. Best is trial 117 with value: -0.6588856402745613.
[I 2026-07-14 17:26:52,924] Trial 158 finished with value: -0.49878583125963166 and parameters: {'scalers': 'standard', 'ratios': 'norm_ratio', 'imputers': 'mean', 'n_estimators': 2150, 'learning_rate': 0.3715537024279672, 'max_depth': 10, 'min_child_weight': 1, 'subsample': 0.5, 'colsample_bytree': 0.9, 'colsample_bylevel': 0.6, 'reg_alpha': 0.6548791277017667, 'reg_lambda': 0.00015911723531574596, 'gamma': 1.2140496196063766e-05}. Best is trial 117 with value: -0.6588856402745613.
[I 2026-07-14 17:27:36,452] Trial 159 finished with value: -0.3479474303485589 and parameters: {'scalers': 'standard', 'ratios': 'norm_ratio', 'imputers': 'mean', 'n_estimators': 2300, 'learning_rate': 0.13365656782215807, 'max_depth': 10, 'min_child_weight': 1, 'subsample': 0.5, 'colsample_bytree': 0.9, 'colsample_bylevel': 0.6, 'reg_alpha': 0.6038787498065546, 'reg_lambda': 0.00013085889939166965, 'gamma': 8.422773009157122e-06}. Best is trial 117 with value: -0.6588856402745613.
[I 2026-07-14 17:28:18,922] Trial 160 finished with value: -0.48502571951474766 and parameters: {'scalers': 'standard', 'ratios': 'norm_ratio', 'imputers': 'mean', 'n_estimators': 2150, 'learning_rate': 0.36243035355243897, 'max_depth': 10, 'min_child_weight': 1, 'subsample': 0.5, 'colsample_bytree': 0.9, 'colsample_bylevel': 0.6, 'reg_alpha': 0.5912598784316262, 'reg_lambda': 0.00014908642500359147, 'gamma': 8.305347742361086e-06}. Best is trial 117 with value: -0.6588856402745613.
[I 2026-07-14 17:29:01,300] Trial 161 finished with value: -0.48742281338963245 and parameters: {'scalers': 'standard', 'ratios': 'norm_ratio', 'imputers': 'mean', 'n_estimators': 2150, 'learning_rate': 0.38525789720076653, 'max_depth': 10, 'min_child_weight': 1, 'subsample': 0.5, 'colsample_bytree': 0.9, 'colsample_bylevel': 0.6, 'reg_alpha': 0.5686470876306711, 'reg_lambda': 4.015643006144089e-06, 'gamma': 7.12825211889399e-06}. Best is trial 117 with value: -0.6588856402745613.
[I 2026-07-14 17:29:43,760] Trial 162 finished with value: -0.3259580751019669 and parameters: {'scalers': 'standard', 'ratios': 'norm_ratio', 'imputers': 'mean', 'n_estimators': 2450, 'learning_rate': 0.1374078240017883, 'max_depth': 10, 'min_child_weight': 1, 'subsample': 0.5, 'colsample_bytree': 0.9, 'colsample_bylevel': 0.6, 'reg_alpha': 0.40933448452114957, 'reg_lambda': 3.4509375976558857e-06, 'gamma': 8.200237826757919e-06}. Best is trial 117 with value: -0.6588856402745613.
[I 2026-07-14 17:30:30,651] Trial 163 finished with value: -0.381574387382198 and parameters: {'scalers': 'standard', 'ratios': 'norm_ratio', 'imputers': 'mean', 'n_estimators': 2350, 'learning_rate': 0.14648532968250852, 'max_depth': 10, 'min_child_weight': 1, 'subsample': 0.5, 'colsample_bytree': 0.9, 'colsample_bylevel': 0.6, 'reg_alpha': 1.3617159475093488, 'reg_lambda': 3.1222510380846167e-06, 'gamma': 7.2793484408934566e-06}. Best is trial 117 with value: -0.6588856402745613.
[I 2026-07-14 17:31:25,129] Trial 164 finished with value: -0.573941484919794 and parameters: {'scalers': 'robust', 'ratios': 'norm_ratio', 'imputers': 'mean', 'n_estimators': 2450, 'learning_rate': 0.38264967952831386, 'max_depth': 10, 'min_child_weight': 1, 'subsample': 0.5, 'colsample_bytree': 0.9, 'colsample_bylevel': 0.6, 'reg_alpha': 1.4466087821076776, 'reg_lambda': 2.2151497452588004e-06, 'gamma': 7.201796294224226e-06}. Best is trial 117 with value: -0.6588856402745613.
[I 2026-07-14 17:32:06,592] Trial 165 finished with value: -0.46199463889639886 and parameters: {'scalers': 'robust', 'ratios': 'norm_ratio', 'imputers': 'mean', 'n_estimators': 2350, 'learning_rate': 0.3711259550372631, 'max_depth': 10, 'min_child_weight': 1, 'subsample': 0.5, 'colsample_bytree': 0.9, 'colsample_bylevel': 0.6, 'reg_alpha': 0.39611765650630804, 'reg_lambda': 0.00022642120929020694, 'gamma': 5.849128847049755e-06}. Best is trial 117 with value: -0.6588856402745613.
[I 2026-07-14 17:32:48,156] Trial 166 finished with value: -0.3235951325182621 and parameters: {'scalers': 'standard', 'ratios': 'norm_ratio', 'imputers': 'mean', 'n_estimators': 2450, 'learning_rate': 0.1482605508127454, 'max_depth': 10, 'min_child_weight': 1, 'subsample': 0.5, 'colsample_bytree': 0.9, 'colsample_bylevel': 0.6, 'reg_alpha': 0.36900045308939616, 'reg_lambda': 0.0002653691311905864, 'gamma': 7.460395613678156e-06}. Best is trial 117 with value: -0.6588856402745613.
[I 2026-07-14 17:33:41,790] Trial 167 finished with value: -0.5693896376965921 and parameters: {'scalers': 'robust', 'ratios': 'norm_ratio', 'imputers': 'mean', 'n_estimators': 2450, 'learning_rate': 0.3816091239222841, 'max_depth': 10, 'min_child_weight': 1, 'subsample': 0.5, 'colsample_bytree': 0.9, 'colsample_bylevel': 0.6, 'reg_alpha': 1.4343732097828348, 'reg_lambda': 0.00021171162516915685, 'gamma': 6.729975266639836e-06}. Best is trial 117 with value: -0.6588856402745613.
[I 2026-07-14 17:34:24,661] Trial 168 finished with value: -0.47201353546845776 and parameters: {'scalers': 'robust', 'ratios': 'norm_ratio', 'imputers': 'mean', 'n_estimators': 2450, 'learning_rate': 0.3808470588094345, 'max_depth': 10, 'min_child_weight': 1, 'subsample': 0.5, 'colsample_bytree': 0.9, 'colsample_bylevel': 0.6, 'reg_alpha': 0.375228027019573, 'reg_lambda': 0.00023297773965264134, 'gamma': 6.5331181906863875e-06}. Best is trial 117 with value: -0.6588856402745613.
[I 2026-07-14 17:35:07,973] Trial 169 finished with value: -0.4622559329546563 and parameters: {'scalers': 'robust', 'ratios': 'norm_ratio', 'imputers': 'mean', 'n_estimators': 2450, 'learning_rate': 0.38385803568571636, 'max_depth': 10, 'min_child_weight': 1, 'subsample': 0.5, 'colsample_bytree': 0.9, 'colsample_bylevel': 0.6, 'reg_alpha': 0.3657222090503499, 'reg_lambda': 1.0564351119425937e-06, 'gamma': 7.463575902184848e-06}. Best is trial 117 with value: -0.6588856402745613.
[I 2026-07-14 17:36:00,717] Trial 170 finished with value: -0.5737530552911361 and parameters: {'scalers': 'robust', 'ratios': 'norm_ratio', 'imputers': 'mean', 'n_estimators': 2400, 'learning_rate': 0.3914353227080569, 'max_depth': 10, 'min_child_weight': 1, 'subsample': 0.5, 'colsample_bytree': 0.9, 'colsample_bylevel': 0.6, 'reg_alpha': 1.39151023412612, 'reg_lambda': 0.0002160733626264338, 'gamma': 7.425784738253298e-06}. Best is trial 117 with value: -0.6588856402745613.
[I 2026-07-14 17:36:43,565] Trial 171 finished with value: -0.4601217225791262 and parameters: {'scalers': 'robust', 'ratios': 'norm_ratio', 'imputers': 'mean', 'n_estimators': 2450, 'learning_rate': 0.3869202326089089, 'max_depth': 10, 'min_child_weight': 1, 'subsample': 0.5, 'colsample_bytree': 0.9, 'colsample_bylevel': 0.6, 'reg_alpha': 0.3542554020086106, 'reg_lambda': 0.00028698609693249386, 'gamma': 2.057549889561613e-05}. Best is trial 117 with value: -0.6588856402745613.
[I 2026-07-14 17:37:27,228] Trial 172 finished with value: -0.47030299215507443 and parameters: {'scalers': 'robust', 'ratios': 'norm_ratio', 'imputers': 'mean', 'n_estimators': 2450, 'learning_rate': 0.3916335320383075, 'max_depth': 10, 'min_child_weight': 1, 'subsample': 0.5, 'colsample_bytree': 0.9, 'colsample_bylevel': 0.6, 'reg_alpha': 0.3827727149096257, 'reg_lambda': 1.2208285866969012e-06, 'gamma': 2.1137233436945075e-05}. Best is trial 117 with value: -0.6588856402745613.
[I 2026-07-14 17:38:15,735] Trial 173 finished with value: -0.5266821439426265 and parameters: {'scalers': 'robust', 'ratios': 'norm_ratio', 'imputers': 'mean', 'n_estimators': 2500, 'learning_rate': 0.40951088642259287, 'max_depth': 10, 'min_child_weight': 1, 'subsample': 0.5, 'colsample_bytree': 0.9, 'colsample_bylevel': 0.6, 'reg_alpha': 0.4901486113385, 'reg_lambda': 1.089512789275708e-06, 'gamma': 1.823737661638769e-05}. Best is trial 117 with value: -0.6588856402745613.
[I 2026-07-14 17:38:56,968] Trial 175 finished with value: -0.17450578075160994 and parameters: {'scalers': 'robust', 'ratios': 'norm_ratio', 'imputers': 'mean', 'n_estimators': 2000, 'learning_rate': 0.39644196853620045, 'max_depth': 10, 'min_child_weight': 1, 'subsample': 0.5, 'colsample_bytree': 0.9, 'colsample_bylevel': 0.6, 'reg_alpha': 0.4983146535164752, 'reg_lambda': 1.262468956898858e-06, 'gamma': 1.895358942138314}. Best is trial 117 with value: -0.6588856402745613.
[I 2026-07-14 17:39:01,062] Trial 174 finished with value: -0.4376015961871526 and parameters: {'scalers': 'robust', 'ratios': 'norm_ratio', 'imputers': 'mean', 'n_estimators': 2150, 'learning_rate': 0.2364879844395001, 'max_depth': 10, 'min_child_weight': 1, 'subsample': 0.5, 'colsample_bytree': 0.9, 'colsample_bylevel': 0.6, 'reg_alpha': 1.2070695952419974, 'reg_lambda': 1.1809755593789545e-06, 'gamma': 1.985498702358308e-05}. Best is trial 117 with value: -0.6588856402745613.
[I 2026-07-14 17:39:39,701] Trial 176 finished with value: -0.39523342327082417 and parameters: {'scalers': 'robust', 'ratios': 'norm_ratio', 'imputers': 'mean', 'n_estimators': 2000, 'learning_rate': 0.22800557914379985, 'max_depth': 10, 'min_child_weight': 1, 'subsample': 0.5, 'colsample_bytree': 0.9, 'colsample_bylevel': 0.6, 'reg_alpha': 0.5485594329743623, 'reg_lambda': 1.4688848757459384e-06, 'gamma': 2.663328301244683e-05}. Best is trial 117 with value: -0.6588856402745613.
[I 2026-07-14 17:40:27,803] Trial 177 finished with value: -0.4360255138168095 and parameters: {'scalers': 'robust', 'ratios': 'norm_ratio', 'imputers': 'mean', 'n_estimators': 2000, 'learning_rate': 0.2405468666564621, 'max_depth': 11, 'min_child_weight': 1, 'subsample': 0.5, 'colsample_bytree': 0.9, 'colsample_bylevel': 0.6, 'reg_alpha': 1.1840794623599569, 'reg_lambda': 0.0003683253521557708, 'gamma': 2.4754642901021147e-05}. Best is trial 117 with value: -0.6588856402745613.
[I 2026-07-14 17:41:09,977] Trial 178 finished with value: -0.4265817410322621 and parameters: {'scalers': 'robust', 'ratios': 'norm_ratio', 'imputers': 'mean', 'n_estimators': 2000, 'learning_rate': 0.2315338342304558, 'max_depth': 10, 'min_child_weight': 1, 'subsample': 0.5, 'colsample_bytree': 0.9, 'colsample_bylevel': 0.6, 'reg_alpha': 1.2919331064637862, 'reg_lambda': 0.0005183036591868758, 'gamma': 2.2995141183720008e-05}. Best is trial 117 with value: -0.6588856402745613.
[I 2026-07-14 17:41:56,025] Trial 180 finished with value: -0.17323968709812898 and parameters: {'scalers': 'robust', 'ratios': 'norm_ratio', 'imputers': 'mean', 'n_estimators': 2000, 'learning_rate': 0.2574565396942935, 'max_depth': 10, 'min_child_weight': 1, 'subsample': 0.5, 'colsample_bytree': 0.9, 'colsample_bylevel': 0.6, 'reg_alpha': 1.3584642476938755, 'reg_lambda': 0.000379460340178403, 'gamma': 3.7911149138751297}. Best is trial 117 with value: -0.6588856402745613.
