[I 2026-07-14 18:09:11,309] Trial 315 finished with value: -0.7305689728134377 and parameters: {'scalers': 'robust', 'ratios': 'log_ratio', 'imputers': 'median', 'n_estimators': 900, 'learning_rate': 0.42479775852560775, 'max_depth': 11, 'min_child_weight': 1, 'subsample': 0.5, 'colsample_bytree': 0.5, 'colsample_bylevel': 0.5, 'reg_alpha': 0.5103666800913972, 'reg_lambda': 21.82255604901348, 'gamma': 0.00573194565149799}. Best is trial 195 with value: -1.1550506307893376.
[I 2026-07-14 18:09:15,143] Trial 316 finished with value: -0.5088942842685291 and parameters: {'scalers': 'robust', 'ratios': 'log_ratio', 'imputers': 'median', 'n_estimators': 300, 'learning_rate': 0.4256593693581887, 'max_depth': 11, 'min_child_weight': 1, 'subsample': 0.5, 'colsample_bytree': 0.5, 'colsample_bylevel': 0.5, 'reg_alpha': 0.6133054374031665, 'reg_lambda': 31.410363880630953, 'gamma': 0.0008596078133593103}. Best is trial 195 with value: -1.1550506307893376.
[I 2026-07-14 18:09:29,851] Trial 317 finished with value: -1.0730117146465552 and parameters: {'scalers': 'robust', 'ratios': 'log_ratio', 'imputers': 'median', 'n_estimators': 900, 'learning_rate': 0.42491968732948104, 'max_depth': 11, 'min_child_weight': 1, 'subsample': 0.5, 'colsample_bytree': 0.5, 'colsample_bylevel': 0.5, 'reg_alpha': 0.5833350836232348, 'reg_lambda': 62.609983825693455, 'gamma': 0.00017911057074881104}. Best is trial 195 with value: -1.1550506307893376.
[I 2026-07-14 18:09:45,366] Trial 318 finished with value: -0.9548091409500655 and parameters: {'scalers': 'robust', 'ratios': 'log_ratio', 'imputers': 'median', 'n_estimators': 900, 'learning_rate': 0.4304865075459555, 'max_depth': 11, 'min_child_weight': 1, 'subsample': 0.5, 'colsample_bytree': 0.5, 'colsample_bylevel': 0.5, 'reg_alpha': 0.6556403350236063, 'reg_lambda': 32.42239942761628, 'gamma': 0.00025482498100019}. Best is trial 195 with value: -1.1550506307893376.
[I 2026-07-14 18:09:59,835] Trial 319 finished with value: -1.0737216736675443 and parameters: {'scalers': 'robust', 'ratios': 'log_ratio', 'imputers': 'median', 'n_estimators': 900, 'learning_rate': 0.4314116395062347, 'max_depth': 11, 'min_child_weight': 1, 'subsample': 0.5, 'colsample_bytree': 0.5, 'colsample_bylevel': 0.5, 'reg_alpha': 0.6202966875028297, 'reg_lambda': 58.38781886834677, 'gamma': 0.0002574056486035323}. Best is trial 195 with value: -1.1550506307893376.
