[I 2026-07-14 21:09:55,344] Trial 134 finished with value: -0.8151663182102049 and parameters: {'scalers': 'robust', 'ratios': 'norm_ratio', 'imputers': 'median', 'n_estimators': 1600, 'learning_rate': 0.43196946669537867, 'max_depth': 11, 'min_child_weight': 1, 'subsample': 0.5, 'colsample_bytree': 0.7, 'colsample_bylevel': 0.9, 'reg_alpha': 0.0009310552085434244, 'reg_lambda': 21.464019796382985, 'gamma': 0.005310139493143264}. Best is trial 134 with value: -0.8151663182102049.
[I 2026-07-14 21:10:00,171] Trial 136 finished with value: -0.14438321651071903 and parameters: {'scalers': 'none', 'ratios': 'norm_ratio', 'imputers': 'median', 'n_estimators': 1650, 'learning_rate': 0.41120908350520385, 'max_depth': 4, 'min_child_weight': 1, 'subsample': 0.5, 'colsample_bytree': 0.6, 'colsample_bylevel': 0.9, 'reg_alpha': 0.002715458816828291, 'reg_lambda': 42.87181746888585, 'gamma': 0.00452681714534358}. Best is trial 134 with value: -0.8151663182102049.
[I 2026-07-14 21:10:05,583] Trial 137 finished with value: -0.14574002692994614 and parameters: {'scalers': 'none', 'ratios': 'norm_ratio', 'imputers': 'median', 'n_estimators': 1750, 'learning_rate': 0.416099510215961, 'max_depth': 4, 'min_child_weight': 1, 'subsample': 0.5, 'colsample_bytree': 0.6, 'colsample_bylevel': 1.0, 'reg_alpha': 3.7681107581325702e-06, 'reg_lambda': 48.60929967906682, 'gamma': 0.005034450796855384}. Best is trial 134 with value: -0.8151663182102049.
[I 2026-07-14 21:10:10,391] Trial 138 finished with value: -0.1197651076774089 and parameters: {'scalers': 'robust', 'ratios': 'norm_ratio', 'imputers': 'median', 'n_estimators': 1550, 'learning_rate': 0.31076180178949653, 'max_depth': 4, 'min_child_weight': 1, 'subsample': 0.5, 'colsample_bytree': 0.7, 'colsample_bylevel': 0.9, 'reg_alpha': 0.0005279901413141692, 'reg_lambda': 49.66596425218142, 'gamma': 0.004989024677105048}. Best is trial 134 with value: -0.8151663182102049.
[I 2026-07-14 21:10:16,265] Trial 139 finished with value: -0.10860352144850657 and parameters: {'scalers': 'robust', 'ratios': 'norm_ratio', 'imputers': 'median', 'n_estimators': 1750, 'learning_rate': 0.32018504819409, 'max_depth': 4, 'min_child_weight': 1, 'subsample': 0.5, 'colsample_bytree': 0.7, 'colsample_bylevel': 1.0, 'reg_alpha': 0.003344407336256633, 'reg_lambda': 99.04445551580636, 'gamma': 0.0038460114410243914}. Best is trial 134 with value: -0.8151663182102049.
[I 2026-07-14 21:10:35,732] Trial 140 finished with value: -0.5172882816001155 and parameters: {'scalers': 'robust', 'ratios': 'norm_ratio', 'imputers': 'median', 'n_estimators': 1750, 'learning_rate': 0.3177901652962862, 'max_depth': 11, 'min_child_weight': 1, 'subsample': 0.5, 'colsample_bytree': 0.7, 'colsample_bylevel': 1.0, 'reg_alpha': 0.0005840297598568928, 'reg_lambda': 75.64062202040611, 'gamma': 0.005108362938780172}. Best is trial 134 with value: -0.8151663182102049.
[I 2026-07-14 21:10:53,717] Trial 141 finished with value: -0.26009313545708695 and parameters: {'scalers': 'robust', 'ratios': 'norm_ratio', 'imputers': 'median', 'n_estimators': 1750, 'learning_rate': 0.09840898581672403, 'max_depth': 11, 'min_child_weight': 1, 'subsample': 0.5, 'colsample_bytree': 0.7, 'colsample_bylevel': 0.9, 'reg_alpha': 0.0009782826180820144, 'reg_lambda': 11.98736808088648, 'gamma': 0.0009167886105164868}. Best is trial 134 with value: -0.8151663182102049.
[I 2026-07-14 21:11:15,083] Trial 142 finished with value: -0.5664227053136296 and parameters: {'scalers': 'robust', 'ratios': 'norm_ratio', 'imputers': 'median', 'n_estimators': 1800, 'learning_rate': 0.4140580199205517, 'max_depth': 11, 'min_child_weight': 1, 'subsample': 0.5, 'colsample_bytree': 0.6, 'colsample_bylevel': 0.9, 'reg_alpha': 0.003023340912313276, 'reg_lambda': 9.06295098906806, 'gamma': 0.00571380509194401}. Best is trial 134 with value: -0.8151663182102049.
[I 2026-07-14 21:11:36,027] Trial 143 finished with value: -1.8205328077610767 and parameters: {'scalers': 'robust', 'ratios': 'norm_ratio', 'imputers': 'median', 'n_estimators': 1750, 'learning_rate': 0.40886036044360735, 'max_depth': 11, 'min_child_weight': 1, 'subsample': 0.5, 'colsample_bytree': 0.6, 'colsample_bylevel': 1.0, 'reg_alpha': 0.0009466547924932135, 'reg_lambda': 51.79439978946839, 'gamma': 0.001096678324870902}. Best is trial 143 with value: -1.8205328077610767.
[I 2026-07-14 21:11:55,274] Trial 144 finished with value: -0.26116195008846477 and parameters: {'scalers': 'robust', 'ratios': 'norm_ratio', 'imputers': 'median', 'n_estimators': 1750, 'learning_rate': 0.10016680187098283, 'max_depth': 11, 'min_child_weight': 1, 'subsample': 0.5, 'colsample_bytree': 0.7, 'colsample_bylevel': 1.0, 'reg_alpha': 0.0008382712253415846, 'reg_lambda': 10.558419807102386, 'gamma': 0.0028237870301219136}. Best is trial 143 with value: -1.8205328077610767.
[I 2026-07-14 21:12:13,933] Trial 145 finished with value: -0.5891820825671873 and parameters: {'scalers': 'robust', 'ratios': 'norm_ratio', 'imputers': 'median', 'n_estimators': 1550, 'learning_rate': 0.32035192590092615, 'max_depth': 11, 'min_child_weight': 1, 'subsample': 0.5, 'colsample_bytree': 0.7, 'colsample_bylevel': 0.9, 'reg_alpha': 0.0008522089100041025, 'reg_lambda': 38.33409905278018, 'gamma': 0.0008657605757666867}. Best is trial 143 with value: -1.8205328077610767.
[I 2026-07-14 21:12:30,602] Trial 146 finished with value: -0.434866450589116 and parameters: {'scalers': 'robust', 'ratios': 'norm_ratio', 'imputers': 'median', 'n_estimators': 1350, 'learning_rate': 0.32318608013760164, 'max_depth': 11, 'min_child_weight': 1, 'subsample': 0.5, 'colsample_bytree': 0.7, 'colsample_bylevel': 0.9, 'reg_alpha': 0.0011903699871565218, 'reg_lambda': 11.503549502736387, 'gamma': 0.0009354801831459023}. Best is trial 143 with value: -1.8205328077610767.
[I 2026-07-14 21:12:49,560] Trial 147 finished with value: -0.26235538993797736 and parameters: {'scalers': 'robust', 'ratios': 'log_ratio', 'imputers': 'median', 'n_estimators': 1850, 'learning_rate': 0.100869399639083, 'max_depth': 11, 'min_child_weight': 1, 'subsample': 0.5, 'colsample_bytree': 0.7, 'colsample_bylevel': 0.9, 'reg_alpha': 0.0009898908595744344, 'reg_lambda': 10.213325867716577, 'gamma': 0.0009400888879260611}. Best is trial 143 with value: -1.8205328077610767.
[I 2026-07-14 21:13:13,860] Trial 148 finished with value: -0.5635794296808813 and parameters: {'scalers': 'robust', 'ratios': 'norm_ratio', 'imputers': 'median', 'n_estimators': 1850, 'learning_rate': 0.414109043611781, 'max_depth': 11, 'min_child_weight': 1, 'subsample': 0.5, 'colsample_bytree': 0.7, 'colsample_bylevel': 0.9, 'reg_alpha': 0.0010131831884414098, 'reg_lambda': 10.470875556633263, 'gamma': 0.0020773845512712216}. Best is trial 143 with value: -1.8205328077610767.
[I 2026-07-14 21:13:29,853] Trial 149 finished with value: -0.18984247358729878 and parameters: {'scalers': 'robust', 'ratios': 'norm_ratio', 'imputers': 'median', 'n_estimators': 1400, 'learning_rate': 0.05738138854877131, 'max_depth': 11, 'min_child_weight': 1, 'subsample': 0.5, 'colsample_bytree': 0.7, 'colsample_bylevel': 1.0, 'reg_alpha': 0.0010090094597868596, 'reg_lambda': 10.070524061291886, 'gamma': 0.0009355406729666567}. Best is trial 143 with value: -1.8205328077610767.
[I 2026-07-14 21:13:43,145] Trial 150 finished with value: -0.24202200884121505 and parameters: {'scalers': 'robust', 'ratios': 'norm_ratio', 'imputers': 'median', 'n_estimators': 1400, 'learning_rate': 0.10284655232846866, 'max_depth': 11, 'min_child_weight': 1, 'subsample': 0.5, 'colsample_bytree': 0.6, 'colsample_bylevel': 0.9, 'reg_alpha': 0.0010753756653951764, 'reg_lambda': 8.72406230952949, 'gamma': 0.0010853859771992782}. Best is trial 143 with value: -1.8205328077610767.
[I 2026-07-14 21:13:57,709] Trial 151 finished with value: -0.24263267765627322 and parameters: {'scalers': 'robust', 'ratios': 'norm_ratio', 'imputers': 'median', 'n_estimators': 1400, 'learning_rate': 0.10434752442414805, 'max_depth': 11, 'min_child_weight': 1, 'subsample': 0.5, 'colsample_bytree': 0.6, 'colsample_bylevel': 1.0, 'reg_alpha': 0.00088817084710107, 'reg_lambda': 11.059494186827255, 'gamma': 0.001169423053890655}. Best is trial 143 with value: -1.8205328077610767.
[I 2026-07-14 21:14:13,620] Trial 152 finished with value: -0.24555330425008562 and parameters: {'scalers': 'robust', 'ratios': 'log_ratio', 'imputers': 'median', 'n_estimators': 1550, 'learning_rate': 0.09852102843336473, 'max_depth': 11, 'min_child_weight': 1, 'subsample': 0.5, 'colsample_bytree': 0.6, 'colsample_bylevel': 1.0, 'reg_alpha': 0.0009947174473549471, 'reg_lambda': 10.038838012806552, 'gamma': 0.0010197592683646043}. Best is trial 143 with value: -1.8205328077610767.
[I 2026-07-14 21:14:29,421] Trial 153 finished with value: -0.19964611523327674 and parameters: {'scalers': 'robust', 'ratios': 'log_ratio', 'imputers': 'median', 'n_estimators': 1450, 'learning_rate': 0.057705739156544, 'max_depth': 11, 'min_child_weight': 1, 'subsample': 0.5, 'colsample_bytree': 0.6, 'colsample_bylevel': 1.0, 'reg_alpha': 0.0013099747668536199, 'reg_lambda': 11.536411784486601, 'gamma': 0.0009259981373801658}. Best is trial 143 with value: -1.8205328077610767.
[I 2026-07-14 21:14:44,497] Trial 154 finished with value: -0.32784721921189863 and parameters: {'scalers': 'robust', 'ratios': 'norm_ratio', 'imputers': 'median', 'n_estimators': 1350, 'learning_rate': 0.19983840447369192, 'max_depth': 11, 'min_child_weight': 1, 'subsample': 0.5, 'colsample_bytree': 0.6, 'colsample_bylevel': 1.0, 'reg_alpha': 0.0009241515424461532, 'reg_lambda': 9.92456457687488, 'gamma': 0.0010088866462127195}. Best is trial 143 with value: -1.8205328077610767.
[I 2026-07-14 21:14:58,368] Trial 155 finished with value: -0.19772642252367256 and parameters: {'scalers': 'robust', 'ratios': 'log_ratio', 'imputers': 'median', 'n_estimators': 1300, 'learning_rate': 0.06857567443175011, 'max_depth': 11, 'min_child_weight': 1, 'subsample': 0.5, 'colsample_bytree': 0.6, 'colsample_bylevel': 1.0, 'reg_alpha': 0.00108034577790253, 'reg_lambda': 10.53271558102769, 'gamma': 0.0010801676886352386}. Best is trial 143 with value: -1.8205328077610767.
[I 2026-07-14 21:15:12,263] Trial 156 finished with value: -0.1943954141765452 and parameters: {'scalers': 'robust', 'ratios': 'log_ratio', 'imputers': 'median', 'n_estimators': 1400, 'learning_rate': 0.06615561190496264, 'max_depth': 11, 'min_child_weight': 1, 'subsample': 0.5, 'colsample_bytree': 0.6, 'colsample_bylevel': 1.0, 'reg_alpha': 0.0011348943381657226, 'reg_lambda': 7.876757181971976, 'gamma': 0.002271544229575608}. Best is trial 143 with value: -1.8205328077610767.
[I 2026-07-14 21:15:25,607] Trial 157 finished with value: -0.2355879810542296 and parameters: {'scalers': 'robust', 'ratios': 'log_ratio', 'imputers': 'median', 'n_estimators': 1300, 'learning_rate': 0.10667488528157926, 'max_depth': 11, 'min_child_weight': 1, 'subsample': 0.5, 'colsample_bytree': 0.6, 'colsample_bylevel': 1.0, 'reg_alpha': 0.001501751492319406, 'reg_lambda': 7.4133397924807225, 'gamma': 0.0022012208779386383}. Best is trial 143 with value: -1.8205328077610767.
[I 2026-07-14 21:15:41,561] Trial 158 finished with value: -0.2616366543632235 and parameters: {'scalers': 'robust', 'ratios': 'norm_ratio', 'imputers': 'median', 'n_estimators': 1500, 'learning_rate': 0.10764397950564637, 'max_depth': 11, 'min_child_weight': 1, 'subsample': 0.5, 'colsample_bytree': 0.6, 'colsample_bylevel': 1.0, 'reg_alpha': 0.0015939371924102786, 'reg_lambda': 16.98708686828288, 'gamma': 0.0022595534624639947}. Best is trial 143 with value: -1.8205328077610767.
[I 2026-07-14 21:15:57,671] Trial 159 finished with value: -0.23116443656902333 and parameters: {'scalers': 'robust', 'ratios': 'log_ratio', 'imputers': 'median', 'n_estimators': 1500, 'learning_rate': 0.07802900575599053, 'max_depth': 11, 'min_child_weight': 1, 'subsample': 0.5, 'colsample_bytree': 0.6, 'colsample_bylevel': 1.0, 'reg_alpha': 0.0020001533774462637, 'reg_lambda': 14.91126797364998, 'gamma': 0.0021947033116864845}. Best is trial 143 with value: -1.8205328077610767.
[I 2026-07-14 21:16:12,367] Trial 160 finished with value: -0.19146675572172583 and parameters: {'scalers': 'robust', 'ratios': 'log_ratio', 'imputers': 'median', 'n_estimators': 1300, 'learning_rate': 0.05540040498492212, 'max_depth': 11, 'min_child_weight': 1, 'subsample': 0.5, 'colsample_bytree': 0.7, 'colsample_bylevel': 0.9, 'reg_alpha': 0.0017027145804042563, 'reg_lambda': 17.669167814552303, 'gamma': 0.0023361231678676406}. Best is trial 143 with value: -1.8205328077610767.
[I 2026-07-14 21:16:31,581] Trial 161 finished with value: -0.23678429924133965 and parameters: {'scalers': 'robust', 'ratios': 'log_ratio', 'imputers': 'median', 'n_estimators': 1750, 'learning_rate': 0.07016492629575484, 'max_depth': 11, 'min_child_weight': 1, 'subsample': 0.5, 'colsample_bytree': 0.7, 'colsample_bylevel': 0.9, 'reg_alpha': 0.001677374868912954, 'reg_lambda': 18.43419908994283, 'gamma': 0.001906871505241961}. Best is trial 143 with value: -1.8205328077610767.
[I 2026-07-14 21:16:46,061] Trial 162 finished with value: -0.21787249517165005 and parameters: {'scalers': 'robust', 'ratios': 'log_ratio', 'imputers': 'median', 'n_estimators': 1300, 'learning_rate': 0.07326304460430762, 'max_depth': 11, 'min_child_weight': 1, 'subsample': 0.5, 'colsample_bytree': 0.6, 'colsample_bylevel': 1.0, 'reg_alpha': 0.001717480775689856, 'reg_lambda': 19.323733760418687, 'gamma': 0.002285577118478447}. Best is trial 143 with value: -1.8205328077610767.
[I 2026-07-14 21:16:57,608] Trial 163 finished with value: -0.0530859097573868 and parameters: {'scalers': 'robust', 'ratios': 'log_ratio', 'imputers': 'median', 'n_estimators': 1300, 'learning_rate': 0.0007268210058941257, 'max_depth': 11, 'min_child_weight': 1, 'subsample': 0.5, 'colsample_bytree': 0.6, 'colsample_bylevel': 0.9, 'reg_alpha': 0.0017840052665671128, 'reg_lambda': 18.197455374078917, 'gamma': 0.002192491844513692}. Best is trial 143 with value: -1.8205328077610767.
[I 2026-07-14 21:17:14,186] Trial 164 finished with value: -0.30730728900982107 and parameters: {'scalers': 'robust', 'ratios': 'log_ratio', 'imputers': 'median', 'n_estimators': 1550, 'learning_rate': 0.14652773477866682, 'max_depth': 11, 'min_child_weight': 1, 'subsample': 0.5, 'colsample_bytree': 0.7, 'colsample_bylevel': 0.9, 'reg_alpha': 0.005390211909203927, 'reg_lambda': 18.186728973575452, 'gamma': 0.0003776463772744142}. Best is trial 143 with value: -1.8205328077610767.
[I 2026-07-14 21:17:31,376] Trial 165 finished with value: -0.34149452932048663 and parameters: {'scalers': 'robust', 'ratios': 'log_ratio', 'imputers': 'median', 'n_estimators': 1550, 'learning_rate': 0.18666046155176488, 'max_depth': 11, 'min_child_weight': 1, 'subsample': 0.5, 'colsample_bytree': 0.7, 'colsample_bylevel': 0.9, 'reg_alpha': 0.0003976638715228281, 'reg_lambda': 18.03733143167264, 'gamma': 0.0005598885181496157}. Best is trial 143 with value: -1.8205328077610767.
[I 2026-07-14 21:17:43,351] Trial 166 finished with value: -0.2839522597436038 and parameters: {'scalers': 'robust', 'ratios': 'log_ratio', 'imputers': 'median', 'n_estimators': 1200, 'learning_rate': 0.14597861199342782, 'max_depth': 11, 'min_child_weight': 1, 'subsample': 0.5, 'colsample_bytree': 0.6, 'colsample_bylevel': 0.9, 'reg_alpha': 0.0003638140281063118, 'reg_lambda': 18.046068387219158, 'gamma': 0.0005931604431070213}. Best is trial 143 with value: -1.8205328077610767.
[I 2026-07-14 21:17:54,787] Trial 167 finished with value: -0.28908431982857635 and parameters: {'scalers': 'robust', 'ratios': 'norm_ratio', 'imputers': 'median', 'n_estimators': 1250, 'learning_rate': 0.14464823713766267, 'max_depth': 11, 'min_child_weight': 1, 'subsample': 0.5, 'colsample_bytree': 0.6, 'colsample_bylevel': 0.9, 'reg_alpha': 0.0076743876675730155, 'reg_lambda': 64.29792740958771, 'gamma': 0.0005565710777097474}. Best is trial 143 with value: -1.8205328077610767.
[I 2026-07-14 21:18:09,955] Trial 168 finished with value: -0.3203725669860186 and parameters: {'scalers': 'robust', 'ratios': 'norm_ratio', 'imputers': 'median', 'n_estimators': 1600, 'learning_rate': 0.19351369790875755, 'max_depth': 11, 'min_child_weight': 1, 'subsample': 0.5, 'colsample_bytree': 0.6, 'colsample_bylevel': 0.9, 'reg_alpha': 0.000602955996801268, 'reg_lambda': 5.097844985601762, 'gamma': 0.000669624601039501}. Best is trial 143 with value: -1.8205328077610767.
[I 2026-07-14 21:18:24,810] Trial 169 finished with value: -0.37478178277075425 and parameters: {'scalers': 'robust', 'ratios': 'norm_ratio', 'imputers': 'median', 'n_estimators': 1600, 'learning_rate': 0.1920824835903287, 'max_depth': 11, 'min_child_weight': 1, 'subsample': 0.5, 'colsample_bytree': 0.6, 'colsample_bylevel': 0.9, 'reg_alpha': 0.0006580170603215715, 'reg_lambda': 62.43120853479554, 'gamma': 0.0005451360586306682}. Best is trial 143 with value: -1.8205328077610767.
[I 2026-07-14 21:18:37,934] Trial 170 finished with value: -0.0688681174068771 and parameters: {'scalers': 'robust', 'ratios': 'norm_ratio', 'imputers': 'median', 'n_estimators': 1200, 'learning_rate': 0.0054330979621911545, 'max_depth': 11, 'min_child_weight': 1, 'subsample': 0.5, 'colsample_bytree': 0.7, 'colsample_bylevel': 0.9, 'reg_alpha': 0.0003642047470277024, 'reg_lambda': 68.06613386426497, 'gamma': 0.00038078754813138}. Best is trial 143 with value: -1.8205328077610767.
[I 2026-07-14 21:18:53,507] Trial 171 finished with value: -0.3800993866485476 and parameters: {'scalers': 'robust', 'ratios': 'norm_ratio', 'imputers': 'median', 'n_estimators': 1550, 'learning_rate': 0.19694962333618746, 'max_depth': 11, 'min_child_weight': 1, 'subsample': 0.5, 'colsample_bytree': 0.7, 'colsample_bylevel': 0.9, 'reg_alpha': 0.00041728795789586345, 'reg_lambda': 67.30979568048612, 'gamma': 0.0005486133249542312}. Best is trial 143 with value: -1.8205328077610767.
[I 2026-07-14 21:19:07,546] Trial 172 finished with value: -0.2959454806818737 and parameters: {'scalers': 'robust', 'ratios': 'norm_ratio', 'imputers': 'median', 'n_estimators': 1550, 'learning_rate': 0.14898642118909403, 'max_depth': 10, 'min_child_weight': 1, 'subsample': 0.5, 'colsample_bytree': 0.7, 'colsample_bylevel': 0.9, 'reg_alpha': 0.005055925015223976, 'reg_lambda': 67.27885519235979, 'gamma': 0.0006360085797040111}. Best is trial 143 with value: -1.8205328077610767.
[I 2026-07-14 21:19:17,212] Trial 173 finished with value: -0.21677364619373082 and parameters: {'scalers': 'robust', 'ratios': 'log_ratio', 'imputers': 'median', 'n_estimators': 1200, 'learning_rate': 0.13759826813646228, 'max_depth': 10, 'min_child_weight': 1, 'subsample': 0.5, 'colsample_bytree': 0.7, 'colsample_bylevel': 0.9, 'reg_alpha': 0.006435650165986021, 'reg_lambda': 4.907922737013399, 'gamma': 0.0006033180756063226}. Best is trial 143 with value: -1.8205328077610767.
[I 2026-07-14 21:19:32,370] Trial 174 finished with value: -0.3479544883981433 and parameters: {'scalers': 'robust', 'ratios': 'log_ratio', 'imputers': 'median', 'n_estimators': 1600, 'learning_rate': 0.19302207625936385, 'max_depth': 10, 'min_child_weight': 1, 'subsample': 0.5, 'colsample_bytree': 0.7, 'colsample_bylevel': 0.9, 'reg_alpha': 0.008493703367007985, 'reg_lambda': 64.51909498620236, 'gamma': 0.0005628644531699977}. Best is trial 143 with value: -1.8205328077610767.
[I 2026-07-14 21:19:41,689] Trial 175 finished with value: -0.2586672434510721 and parameters: {'scalers': 'robust', 'ratios': 'log_ratio', 'imputers': 'median', 'n_estimators': 1150, 'learning_rate': 0.14396594540527824, 'max_depth': 10, 'min_child_weight': 1, 'subsample': 0.5, 'colsample_bytree': 0.6, 'colsample_bylevel': 0.9, 'reg_alpha': 0.009092929680730203, 'reg_lambda': 65.79381962956523, 'gamma': 0.0003767685405385906}. Best is trial 143 with value: -1.8205328077610767.
[I 2026-07-14 21:20:06,782] Trial 176 finished with value: -0.4519282914423127 and parameters: {'scalers': 'robust', 'ratios': 'norm_ratio', 'imputers': 'median', 'n_estimators': 2950, 'learning_rate': 0.19612671560749165, 'max_depth': 10, 'min_child_weight': 1, 'subsample': 0.5, 'colsample_bytree': 0.6, 'colsample_bylevel': 0.9, 'reg_alpha': 0.0076885364902816375, 'reg_lambda': 63.67755607278279, 'gamma': 0.0003176494932737802}. Best is trial 143 with value: -1.8205328077610767.
[I 2026-07-14 21:20:20,244] Trial 177 finished with value: -0.3121398815622201 and parameters: {'scalers': 'robust', 'ratios': 'norm_ratio', 'imputers': 'median', 'n_estimators': 1600, 'learning_rate': 0.22063868017682292, 'max_depth': 10, 'min_child_weight': 1, 'subsample': 0.5, 'colsample_bytree': 0.6, 'colsample_bylevel': 0.9, 'reg_alpha': 0.0006601511577589256, 'reg_lambda': 5.209349186371063, 'gamma': 0.0003864607597219371}. Best is trial 143 with value: -1.8205328077610767.
[I 2026-07-14 21:20:34,479] Trial 178 finished with value: -0.3436499460080949 and parameters: {'scalers': 'robust', 'ratios': 'norm_ratio', 'imputers': 'median', 'n_estimators': 1600, 'learning_rate': 0.19414328786523566, 'max_depth': 10, 'min_child_weight': 1, 'subsample': 0.5, 'colsample_bytree': 0.6, 'colsample_bylevel': 0.9, 'reg_alpha': 0.0063246598196598, 'reg_lambda': 36.243348896275485, 'gamma': 0.00013651701363228842}. Best is trial 143 with value: -1.8205328077610767.
[I 2026-07-14 21:20:50,357] Trial 179 finished with value: -0.3468611128846792 and parameters: {'scalers': 'robust', 'ratios': 'norm_ratio', 'imputers': 'median', 'n_estimators': 1600, 'learning_rate': 0.19478223611874879, 'max_depth': 10, 'min_child_weight': 1, 'subsample': 0.5, 'colsample_bytree': 0.7, 'colsample_bylevel': 0.9, 'reg_alpha': 0.0005597446385449585, 'reg_lambda': 35.44018355986055, 'gamma': 0.00012038029246673307}. Best is trial 143 with value: -1.8205328077610767.
