[I 2026-07-20 13:38:03,304] Trial 549 finished with value: -0.2420610430395863 and parameters: {'error_threshold': 0.0, 'scalers': 'robust', 'ratios': 'log_ratio', 'imputers': 'none', 'n_estimators': 300, 'learning_rate': 0.0004136592545311764, 'max_depth': 6, 'min_child_weight': 10, 'subsample': 0.7, 'colsample_bytree': 0.5, 'colsample_bylevel': 0.6, 'reg_alpha': 68.0322839054503, 'reg_lambda': 71.62328403918534, 'gamma': 40.3994047811717}. Best is trial 370 with value: -0.24379341779244815.
/bsuscratch/alexanderemert/miniforge3/envs/starform-alex/lib/python3.14/site-packages/numpy/lib/_nanfunctions_impl.py:1215: RuntimeWarning: All-NaN slice encountered
  return fnb._ureduce(a, func=_nanmedian, keepdims=keepdims,
/bsuscratch/alexanderemert/miniforge3/envs/starform-alex/lib/python3.14/site-packages/numpy/lib/_nanfunctions_impl.py:1215: RuntimeWarning: All-NaN slice encountered
  return fnb._ureduce(a, func=_nanmedian, keepdims=keepdims,
/bsuscratch/alexanderemert/miniforge3/envs/starform-alex/lib/python3.14/site-packages/numpy/lib/_nanfunctions_impl.py:1396: RuntimeWarning: All-NaN slice encountered
  return _nanquantile_unchecked(
/bsuscratch/alexanderemert/miniforge3/envs/starform-alex/lib/python3.14/site-packages/numpy/lib/_nanfunctions_impl.py:1396: RuntimeWarning: All-NaN slice encountered
  return _nanquantile_unchecked(
/bsuscratch/alexanderemert/miniforge3/envs/starform-alex/lib/python3.14/site-packages/numpy/lib/_nanfunctions_impl.py:1215: RuntimeWarning: All-NaN slice encountered
  return fnb._ureduce(a, func=_nanmedian, keepdims=keepdims,
/bsuscratch/alexanderemert/miniforge3/envs/starform-alex/lib/python3.14/site-packages/numpy/lib/_nanfunctions_impl.py:1396: RuntimeWarning: All-NaN slice encountered
  return _nanquantile_unchecked(
/bsuscratch/alexanderemert/miniforge3/envs/starform-alex/lib/python3.14/site-packages/numpy/lib/_nanfunctions_impl.py:1215: RuntimeWarning: All-NaN slice encountered
  return fnb._ureduce(a, func=_nanmedian, keepdims=keepdims,
/bsuscratch/alexanderemert/miniforge3/envs/starform-alex/lib/python3.14/site-packages/numpy/lib/_nanfunctions_impl.py:1396: RuntimeWarning: All-NaN slice encountered
  return _nanquantile_unchecked(
/bsuscratch/alexanderemert/miniforge3/envs/starform-alex/lib/python3.14/site-packages/numpy/lib/_nanfunctions_impl.py:1215: RuntimeWarning: All-NaN slice encountered
  return fnb._ureduce(a, func=_nanmedian, keepdims=keepdims,
/bsuscratch/alexanderemert/miniforge3/envs/starform-alex/lib/python3.14/site-packages/numpy/lib/_nanfunctions_impl.py:1396: RuntimeWarning: All-NaN slice encountered
  return _nanquantile_unchecked(
/bsuscratch/alexanderemert/miniforge3/envs/starform-alex/lib/python3.14/site-packages/numpy/lib/_nanfunctions_impl.py:1215: RuntimeWarning: All-NaN slice encountered
  return fnb._ureduce(a, func=_nanmedian, keepdims=keepdims,
/bsuscratch/alexanderemert/miniforge3/envs/starform-alex/lib/python3.14/site-packages/numpy/lib/_nanfunctions_impl.py:1396: RuntimeWarning: All-NaN slice encountered
  return _nanquantile_unchecked(
/bsuscratch/alexanderemert/miniforge3/envs/starform-alex/lib/python3.14/site-packages/numpy/lib/_nanfunctions_impl.py:1215: RuntimeWarning: All-NaN slice encountered
  return fnb._ureduce(a, func=_nanmedian, keepdims=keepdims,
/bsuscratch/alexanderemert/miniforge3/envs/starform-alex/lib/python3.14/site-packages/numpy/lib/_nanfunctions_impl.py:1396: RuntimeWarning: All-NaN slice encountered
  return _nanquantile_unchecked(
/bsuscratch/alexanderemert/miniforge3/envs/starform-alex/lib/python3.14/site-packages/numpy/lib/_nanfunctions_impl.py:1215: RuntimeWarning: All-NaN slice encountered
  return fnb._ureduce(a, func=_nanmedian, keepdims=keepdims,
/bsuscratch/alexanderemert/miniforge3/envs/starform-alex/lib/python3.14/site-packages/numpy/lib/_nanfunctions_impl.py:1215: RuntimeWarning: All-NaN slice encountered
  return fnb._ureduce(a, func=_nanmedian, keepdims=keepdims,
/bsuscratch/alexanderemert/miniforge3/envs/starform-alex/lib/python3.14/site-packages/numpy/lib/_nanfunctions_impl.py:1396: RuntimeWarning: All-NaN slice encountered
  return _nanquantile_unchecked(
/bsuscratch/alexanderemert/miniforge3/envs/starform-alex/lib/python3.14/site-packages/numpy/lib/_nanfunctions_impl.py:1396: RuntimeWarning: All-NaN slice encountered
  return _nanquantile_unchecked(
[I 2026-07-20 13:38:03,510] Trial 550 finished with value: -0.24302761665310776 and parameters: {'error_threshold': 0.0, 'scalers': 'robust', 'ratios': 'log_ratio', 'imputers': 'none', 'n_estimators': 300, 'learning_rate': 0.0006063254688947629, 'max_depth': 6, 'min_child_weight': 10, 'subsample': 0.7, 'colsample_bytree': 0.5, 'colsample_bylevel': 0.6, 'reg_alpha': 74.40223987050653, 'reg_lambda': 97.22803640641295, 'gamma': 42.14579911632048}. Best is trial 370 with value: -0.24379341779244815.
/bsuscratch/alexanderemert/miniforge3/envs/starform-alex/lib/python3.14/site-packages/numpy/lib/_nanfunctions_impl.py:1215: RuntimeWarning: All-NaN slice encountered
  return fnb._ureduce(a, func=_nanmedian, keepdims=keepdims,
/bsuscratch/alexanderemert/miniforge3/envs/starform-alex/lib/python3.14/site-packages/numpy/lib/_nanfunctions_impl.py:1396: RuntimeWarning: All-NaN slice encountered
  return _nanquantile_unchecked(
/bsuscratch/alexanderemert/miniforge3/envs/starform-alex/lib/python3.14/site-packages/numpy/lib/_nanfunctions_impl.py:1215: RuntimeWarning: All-NaN slice encountered
  return fnb._ureduce(a, func=_nanmedian, keepdims=keepdims,
/bsuscratch/alexanderemert/miniforge3/envs/starform-alex/lib/python3.14/site-packages/numpy/lib/_nanfunctions_impl.py:1396: RuntimeWarning: All-NaN slice encountered
  return _nanquantile_unchecked(
/bsuscratch/alexanderemert/miniforge3/envs/starform-alex/lib/python3.14/site-packages/numpy/lib/_nanfunctions_impl.py:1215: RuntimeWarning: All-NaN slice encountered
  return fnb._ureduce(a, func=_nanmedian, keepdims=keepdims,
/bsuscratch/alexanderemert/miniforge3/envs/starform-alex/lib/python3.14/site-packages/numpy/lib/_nanfunctions_impl.py:1396: RuntimeWarning: All-NaN slice encountered
  return _nanquantile_unchecked(
/bsuscratch/alexanderemert/miniforge3/envs/starform-alex/lib/python3.14/site-packages/numpy/lib/_nanfunctions_impl.py:1215: RuntimeWarning: All-NaN slice encountered
  return fnb._ureduce(a, func=_nanmedian, keepdims=keepdims,
/bsuscratch/alexanderemert/miniforge3/envs/starform-alex/lib/python3.14/site-packages/numpy/lib/_nanfunctions_impl.py:1396: RuntimeWarning: All-NaN slice encountered
  return _nanquantile_unchecked(
/bsuscratch/alexanderemert/miniforge3/envs/starform-alex/lib/python3.14/site-packages/numpy/lib/_nanfunctions_impl.py:1215: RuntimeWarning: All-NaN slice encountered
  return fnb._ureduce(a, func=_nanmedian, keepdims=keepdims,
/bsuscratch/alexanderemert/miniforge3/envs/starform-alex/lib/python3.14/site-packages/numpy/lib/_nanfunctions_impl.py:1396: RuntimeWarning: All-NaN slice encountered
  return _nanquantile_unchecked(
/bsuscratch/alexanderemert/miniforge3/envs/starform-alex/lib/python3.14/site-packages/numpy/lib/_nanfunctions_impl.py:1215: RuntimeWarning: All-NaN slice encountered
  return fnb._ureduce(a, func=_nanmedian, keepdims=keepdims,
/bsuscratch/alexanderemert/miniforge3/envs/starform-alex/lib/python3.14/site-packages/numpy/lib/_nanfunctions_impl.py:1396: RuntimeWarning: All-NaN slice encountered
  return _nanquantile_unchecked(
/bsuscratch/alexanderemert/miniforge3/envs/starform-alex/lib/python3.14/site-packages/numpy/lib/_nanfunctions_impl.py:1215: RuntimeWarning: All-NaN slice encountered
  return fnb._ureduce(a, func=_nanmedian, keepdims=keepdims,
/bsuscratch/alexanderemert/miniforge3/envs/starform-alex/lib/python3.14/site-packages/numpy/lib/_nanfunctions_impl.py:1396: RuntimeWarning: All-NaN slice encountered
  return _nanquantile_unchecked(
/bsuscratch/alexanderemert/miniforge3/envs/starform-alex/lib/python3.14/site-packages/numpy/lib/_nanfunctions_impl.py:1215: RuntimeWarning: All-NaN slice encountered
  return fnb._ureduce(a, func=_nanmedian, keepdims=keepdims,
/bsuscratch/alexanderemert/miniforge3/envs/starform-alex/lib/python3.14/site-packages/numpy/lib/_nanfunctions_impl.py:1396: RuntimeWarning: All-NaN slice encountered
  return _nanquantile_unchecked(
/bsuscratch/alexanderemert/miniforge3/envs/starform-alex/lib/python3.14/site-packages/numpy/lib/_nanfunctions_impl.py:1215: RuntimeWarning: All-NaN slice encountered
  return fnb._ureduce(a, func=_nanmedian, keepdims=keepdims,
/bsuscratch/alexanderemert/miniforge3/envs/starform-alex/lib/python3.14/site-packages/numpy/lib/_nanfunctions_impl.py:1396: RuntimeWarning: All-NaN slice encountered
  return _nanquantile_unchecked(
/bsuscratch/alexanderemert/miniforge3/envs/starform-alex/lib/python3.14/site-packages/numpy/lib/_nanfunctions_impl.py:1215: RuntimeWarning: All-NaN slice encountered
  return fnb._ureduce(a, func=_nanmedian, keepdims=keepdims,
/bsuscratch/alexanderemert/miniforge3/envs/starform-alex/lib/python3.14/site-packages/numpy/lib/_nanfunctions_impl.py:1396: RuntimeWarning: All-NaN slice encountered
  return _nanquantile_unchecked(
/bsuscratch/alexanderemert/miniforge3/envs/starform-alex/lib/python3.14/site-packages/numpy/lib/_nanfunctions_impl.py:1215: RuntimeWarning: All-NaN slice encountered
  return fnb._ureduce(a, func=_nanmedian, keepdims=keepdims,
/bsuscratch/alexanderemert/miniforge3/envs/starform-alex/lib/python3.14/site-packages/numpy/lib/_nanfunctions_impl.py:1396: RuntimeWarning: All-NaN slice encountered
  return _nanquantile_unchecked(
/bsuscratch/alexanderemert/miniforge3/envs/starform-alex/lib/python3.14/site-packages/numpy/lib/_nanfunctions_impl.py:1215: RuntimeWarning: All-NaN slice encountered
  return fnb._ureduce(a, func=_nanmedian, keepdims=keepdims,
/bsuscratch/alexanderemert/miniforge3/envs/starform-alex/lib/python3.14/site-packages/numpy/lib/_nanfunctions_impl.py:1396: RuntimeWarning: All-NaN slice encountered
  return _nanquantile_unchecked(
/bsuscratch/alexanderemert/miniforge3/envs/starform-alex/lib/python3.14/site-packages/numpy/lib/_nanfunctions_impl.py:1215: RuntimeWarning: All-NaN slice encountered
  return fnb._ureduce(a, func=_nanmedian, keepdims=keepdims,
/bsuscratch/alexanderemert/miniforge3/envs/starform-alex/lib/python3.14/site-packages/numpy/lib/_nanfunctions_impl.py:1396: RuntimeWarning: All-NaN slice encountered
  return _nanquantile_unchecked(
/bsuscratch/alexanderemert/miniforge3/envs/starform-alex/lib/python3.14/site-packages/numpy/lib/_nanfunctions_impl.py:1215: RuntimeWarning: All-NaN slice encountered
  return fnb._ureduce(a, func=_nanmedian, keepdims=keepdims,
[I 2026-07-20 13:38:03,868] Trial 551 finished with value: -0.24167718862900792 and parameters: {'error_threshold': 0.0, 'scalers': 'robust', 'ratios': 'log_ratio', 'imputers': 'none', 'n_estimators': 300, 'learning_rate': 0.00039815401715880504, 'max_depth': 3, 'min_child_weight': 10, 'subsample': 0.7, 'colsample_bytree': 0.9, 'colsample_bylevel': 0.6, 'reg_alpha': 71.0691109688747, 'reg_lambda': 71.52756742579216, 'gamma': 40.3971916601709}. Best is trial 370 with value: -0.24379341779244815.
/bsuscratch/alexanderemert/miniforge3/envs/starform-alex/lib/python3.14/site-packages/numpy/lib/_nanfunctions_impl.py:1396: RuntimeWarning: All-NaN slice encountered
  return _nanquantile_unchecked(
/bsuscratch/alexanderemert/miniforge3/envs/starform-alex/lib/python3.14/site-packages/numpy/lib/_nanfunctions_impl.py:1215: RuntimeWarning: All-NaN slice encountered
  return fnb._ureduce(a, func=_nanmedian, keepdims=keepdims,
/bsuscratch/alexanderemert/miniforge3/envs/starform-alex/lib/python3.14/site-packages/numpy/lib/_nanfunctions_impl.py:1396: RuntimeWarning: All-NaN slice encountered
  return _nanquantile_unchecked(
/bsuscratch/alexanderemert/miniforge3/envs/starform-alex/lib/python3.14/site-packages/numpy/lib/_nanfunctions_impl.py:1215: RuntimeWarning: All-NaN slice encountered
  return fnb._ureduce(a, func=_nanmedian, keepdims=keepdims,
/bsuscratch/alexanderemert/miniforge3/envs/starform-alex/lib/python3.14/site-packages/numpy/lib/_nanfunctions_impl.py:1396: RuntimeWarning: All-NaN slice encountered
  return _nanquantile_unchecked(
/bsuscratch/alexanderemert/miniforge3/envs/starform-alex/lib/python3.14/site-packages/numpy/lib/_nanfunctions_impl.py:1215: RuntimeWarning: All-NaN slice encountered
  return fnb._ureduce(a, func=_nanmedian, keepdims=keepdims,
/bsuscratch/alexanderemert/miniforge3/envs/starform-alex/lib/python3.14/site-packages/numpy/lib/_nanfunctions_impl.py:1396: RuntimeWarning: All-NaN slice encountered
  return _nanquantile_unchecked(
/bsuscratch/alexanderemert/miniforge3/envs/starform-alex/lib/python3.14/site-packages/numpy/lib/_nanfunctions_impl.py:1215: RuntimeWarning: All-NaN slice encountered
  return fnb._ureduce(a, func=_nanmedian, keepdims=keepdims,
/bsuscratch/alexanderemert/miniforge3/envs/starform-alex/lib/python3.14/site-packages/numpy/lib/_nanfunctions_impl.py:1396: RuntimeWarning: All-NaN slice encountered
  return _nanquantile_unchecked(
/bsuscratch/alexanderemert/miniforge3/envs/starform-alex/lib/python3.14/site-packages/numpy/lib/_nanfunctions_impl.py:1215: RuntimeWarning: All-NaN slice encountered
  return fnb._ureduce(a, func=_nanmedian, keepdims=keepdims,
/bsuscratch/alexanderemert/miniforge3/envs/starform-alex/lib/python3.14/site-packages/numpy/lib/_nanfunctions_impl.py:1396: RuntimeWarning: All-NaN slice encountered
  return _nanquantile_unchecked(
[I 2026-07-20 13:38:04,041] Trial 552 finished with value: -0.24378862373289353 and parameters: {'error_threshold': 0.0, 'scalers': 'robust', 'ratios': 'log_ratio', 'imputers': 'none', 'n_estimators': 300, 'learning_rate': 0.0005870251692225303, 'max_depth': 6, 'min_child_weight': 10, 'subsample': 0.7, 'colsample_bytree': 0.6, 'colsample_bylevel': 0.6, 'reg_alpha': 71.52511076058703, 'reg_lambda': 98.32940296438042, 'gamma': 65.95434543359366}. Best is trial 370 with value: -0.24379341779244815.
/bsuscratch/alexanderemert/miniforge3/envs/starform-alex/lib/python3.14/site-packages/numpy/lib/_nanfunctions_impl.py:1215: RuntimeWarning: All-NaN slice encountered
  return fnb._ureduce(a, func=_nanmedian, keepdims=keepdims,
/bsuscratch/alexanderemert/miniforge3/envs/starform-alex/lib/python3.14/site-packages/numpy/lib/_nanfunctions_impl.py:1396: RuntimeWarning: All-NaN slice encountered
  return _nanquantile_unchecked(
/bsuscratch/alexanderemert/miniforge3/envs/starform-alex/lib/python3.14/site-packages/numpy/lib/_nanfunctions_impl.py:1215: RuntimeWarning: All-NaN slice encountered
  return fnb._ureduce(a, func=_nanmedian, keepdims=keepdims,
/bsuscratch/alexanderemert/miniforge3/envs/starform-alex/lib/python3.14/site-packages/numpy/lib/_nanfunctions_impl.py:1396: RuntimeWarning: All-NaN slice encountered
  return _nanquantile_unchecked(
/bsuscratch/alexanderemert/miniforge3/envs/starform-alex/lib/python3.14/site-packages/numpy/lib/_nanfunctions_impl.py:1215: RuntimeWarning: All-NaN slice encountered
  return fnb._ureduce(a, func=_nanmedian, keepdims=keepdims,
/bsuscratch/alexanderemert/miniforge3/envs/starform-alex/lib/python3.14/site-packages/numpy/lib/_nanfunctions_impl.py:1396: RuntimeWarning: All-NaN slice encountered
  return _nanquantile_unchecked(
/bsuscratch/alexanderemert/miniforge3/envs/starform-alex/lib/python3.14/site-packages/numpy/lib/_nanfunctions_impl.py:1215: RuntimeWarning: All-NaN slice encountered
  return fnb._ureduce(a, func=_nanmedian, keepdims=keepdims,
/bsuscratch/alexanderemert/miniforge3/envs/starform-alex/lib/python3.14/site-packages/numpy/lib/_nanfunctions_impl.py:1396: RuntimeWarning: All-NaN slice encountered
  return _nanquantile_unchecked(
/bsuscratch/alexanderemert/miniforge3/envs/starform-alex/lib/python3.14/site-packages/numpy/lib/_nanfunctions_impl.py:1215: RuntimeWarning: All-NaN slice encountered
  return fnb._ureduce(a, func=_nanmedian, keepdims=keepdims,
/bsuscratch/alexanderemert/miniforge3/envs/starform-alex/lib/python3.14/site-packages/numpy/lib/_nanfunctions_impl.py:1396: RuntimeWarning: All-NaN slice encountered
  return _nanquantile_unchecked(
/bsuscratch/alexanderemert/miniforge3/envs/starform-alex/lib/python3.14/site-packages/numpy/lib/_nanfunctions_impl.py:1215: RuntimeWarning: All-NaN slice encountered
  return fnb._ureduce(a, func=_nanmedian, keepdims=keepdims,
/bsuscratch/alexanderemert/miniforge3/envs/starform-alex/lib/python3.14/site-packages/numpy/lib/_nanfunctions_impl.py:1396: RuntimeWarning: All-NaN slice encountered
  return _nanquantile_unchecked(
/bsuscratch/alexanderemert/miniforge3/envs/starform-alex/lib/python3.14/site-packages/numpy/lib/_nanfunctions_impl.py:1215: RuntimeWarning: All-NaN slice encountered
  return fnb._ureduce(a, func=_nanmedian, keepdims=keepdims,
/bsuscratch/alexanderemert/miniforge3/envs/starform-alex/lib/python3.14/site-packages/numpy/lib/_nanfunctions_impl.py:1396: RuntimeWarning: All-NaN slice encountered
  return _nanquantile_unchecked(
/bsuscratch/alexanderemert/miniforge3/envs/starform-alex/lib/python3.14/site-packages/numpy/lib/_nanfunctions_impl.py:1215: RuntimeWarning: All-NaN slice encountered
  return fnb._ureduce(a, func=_nanmedian, keepdims=keepdims,
/bsuscratch/alexanderemert/miniforge3/envs/starform-alex/lib/python3.14/site-packages/numpy/lib/_nanfunctions_impl.py:1396: RuntimeWarning: All-NaN slice encountered
  return _nanquantile_unchecked(
/bsuscratch/alexanderemert/miniforge3/envs/starform-alex/lib/python3.14/site-packages/numpy/lib/_nanfunctions_impl.py:1215: RuntimeWarning: All-NaN slice encountered
  return fnb._ureduce(a, func=_nanmedian, keepdims=keepdims,
/bsuscratch/alexanderemert/miniforge3/envs/starform-alex/lib/python3.14/site-packages/numpy/lib/_nanfunctions_impl.py:1396: RuntimeWarning: All-NaN slice encountered
  return _nanquantile_unchecked(
/bsuscratch/alexanderemert/miniforge3/envs/starform-alex/lib/python3.14/site-packages/numpy/lib/_nanfunctions_impl.py:1215: RuntimeWarning: All-NaN slice encountered
  return fnb._ureduce(a, func=_nanmedian, keepdims=keepdims,
/bsuscratch/alexanderemert/miniforge3/envs/starform-alex/lib/python3.14/site-packages/numpy/lib/_nanfunctions_impl.py:1396: RuntimeWarning: All-NaN slice encountered
  return _nanquantile_unchecked(
/bsuscratch/alexanderemert/miniforge3/envs/starform-alex/lib/python3.14/site-packages/numpy/lib/_nanfunctions_impl.py:1215: RuntimeWarning: All-NaN slice encountered
  return fnb._ureduce(a, func=_nanmedian, keepdims=keepdims,
/bsuscratch/alexanderemert/miniforge3/envs/starform-alex/lib/python3.14/site-packages/numpy/lib/_nanfunctions_impl.py:1396: RuntimeWarning: All-NaN slice encountered
  return _nanquantile_unchecked(
