[I 2026-07-20 14:46:13,495] Trial 272 finished with value: -0.13680040874775004 and parameters: {'error_threshold': 0.35, 'scalers': 'robust', 'ratios': 'norm_ratio', 'imputers': 'mean', 'n_estimators': 200, 'learning_rate': 0.0001405745591819124, 'max_depth': 8, 'min_child_weight': 9, 'subsample': 0.6, 'colsample_bytree': 0.5, 'colsample_bylevel': 1.0, 'reg_alpha': 38.24305063089112, 'reg_lambda': 0.001078100867522358, 'gamma': 10.375514915742402}. Best is trial 205 with value: -0.13735526511479842.
/bsuhome/alexanderemert/Research/Star-Formation-Research-Project-2026/pipeline/scripts/optuna/final_preds_and_models/optuna_search_mult_quant_reg.py:75: UserWarning: The distribution is specified by [0.1, 5] and step=0.25, but the range is not divisible by `step`. It will be replaced with [0.1, 4.85].
  error_threshold = trial.suggest_float("error_threshold", 0.1, 5, step=0.25)
[I 2026-07-20 14:46:13,694] Trial 273 finished with value: -0.13674889314305091 and parameters: {'error_threshold': 0.35, 'scalers': 'robust', 'ratios': 'norm_ratio', 'imputers': 'mean', 'n_estimators': 200, 'learning_rate': 0.0001404811600317877, 'max_depth': 8, 'min_child_weight': 6, 'subsample': 0.6, 'colsample_bytree': 0.5, 'colsample_bylevel': 1.0, 'reg_alpha': 45.03042765869024, 'reg_lambda': 0.0005814785642646318, 'gamma': 3.656563830534892}. Best is trial 205 with value: -0.13735526511479842.
/bsuhome/alexanderemert/Research/Star-Formation-Research-Project-2026/pipeline/scripts/optuna/final_preds_and_models/optuna_search_mult_quant_reg.py:75: UserWarning: The distribution is specified by [0.1, 5] and step=0.25, but the range is not divisible by `step`. It will be replaced with [0.1, 4.85].
  error_threshold = trial.suggest_float("error_threshold", 0.1, 5, step=0.25)
[I 2026-07-20 14:46:13,960] Trial 274 finished with value: -0.13658748717163352 and parameters: {'error_threshold': 0.35, 'scalers': 'robust', 'ratios': 'norm_ratio', 'imputers': 'mean', 'n_estimators': 200, 'learning_rate': 0.00016235638146890665, 'max_depth': 8, 'min_child_weight': 5, 'subsample': 0.6, 'colsample_bytree': 0.5, 'colsample_bylevel': 1.0, 'reg_alpha': 39.83927225276636, 'reg_lambda': 0.0004859140440564599, 'gamma': 0.9020270011623885}. Best is trial 205 with value: -0.13735526511479842.
/bsuhome/alexanderemert/Research/Star-Formation-Research-Project-2026/pipeline/scripts/optuna/final_preds_and_models/optuna_search_mult_quant_reg.py:75: UserWarning: The distribution is specified by [0.1, 5] and step=0.25, but the range is not divisible by `step`. It will be replaced with [0.1, 4.85].
  error_threshold = trial.suggest_float("error_threshold", 0.1, 5, step=0.25)
[I 2026-07-20 14:46:14,173] Trial 275 finished with value: -0.1367148430707831 and parameters: {'error_threshold': 0.35, 'scalers': 'robust', 'ratios': 'norm_ratio', 'imputers': 'mean', 'n_estimators': 200, 'learning_rate': 0.0001677288990013177, 'max_depth': 8, 'min_child_weight': 9, 'subsample': 0.6, 'colsample_bytree': 0.5, 'colsample_bylevel': 1.0, 'reg_alpha': 37.362580534573546, 'reg_lambda': 1.3903877187821507e-05, 'gamma': 31.667592876069474}. Best is trial 205 with value: -0.13735526511479842.
/bsuhome/alexanderemert/Research/Star-Formation-Research-Project-2026/pipeline/scripts/optuna/final_preds_and_models/optuna_search_mult_quant_reg.py:75: UserWarning: The distribution is specified by [0.1, 5] and step=0.25, but the range is not divisible by `step`. It will be replaced with [0.1, 4.85].
  error_threshold = trial.suggest_float("error_threshold", 0.1, 5, step=0.25)
[I 2026-07-20 14:46:14,649] Trial 276 finished with value: -0.1367139605367243 and parameters: {'error_threshold': 0.35, 'scalers': 'robust', 'ratios': 'norm_ratio', 'imputers': 'mean', 'n_estimators': 200, 'learning_rate': 0.000167888660062269, 'max_depth': 8, 'min_child_weight': 6, 'subsample': 0.6, 'colsample_bytree': 0.5, 'colsample_bylevel': 1.0, 'reg_alpha': 38.78240853394307, 'reg_lambda': 0.000625661317217505, 'gamma': 33.15450846104245}. Best is trial 205 with value: -0.13735526511479842.
/bsuhome/alexanderemert/Research/Star-Formation-Research-Project-2026/pipeline/scripts/optuna/final_preds_and_models/optuna_search_mult_quant_reg.py:75: UserWarning: The distribution is specified by [0.1, 5] and step=0.25, but the range is not divisible by `step`. It will be replaced with [0.1, 4.85].
  error_threshold = trial.suggest_float("error_threshold", 0.1, 5, step=0.25)
[I 2026-07-20 14:46:15,049] Trial 277 finished with value: -0.0989038895700427 and parameters: {'error_threshold': 0.35, 'scalers': 'robust', 'ratios': 'norm_ratio', 'imputers': 'mean', 'n_estimators': 100, 'learning_rate': 0.16097229775228777, 'max_depth': 7, 'min_child_weight': 9, 'subsample': 0.6, 'colsample_bytree': 0.5, 'colsample_bylevel': 1.0, 'reg_alpha': 38.55144020048434, 'reg_lambda': 0.00044783106790026163, 'gamma': 32.57924301788628}. Best is trial 205 with value: -0.13735526511479842.
/bsuhome/alexanderemert/Research/Star-Formation-Research-Project-2026/pipeline/scripts/optuna/final_preds_and_models/optuna_search_mult_quant_reg.py:75: UserWarning: The distribution is specified by [0.1, 5] and step=0.25, but the range is not divisible by `step`. It will be replaced with [0.1, 4.85].
  error_threshold = trial.suggest_float("error_threshold", 0.1, 5, step=0.25)
[I 2026-07-20 14:46:15,303] Trial 278 finished with value: -0.1371716492567795 and parameters: {'error_threshold': 0.35, 'scalers': 'robust', 'ratios': 'norm_ratio', 'imputers': 'mean', 'n_estimators': 100, 'learning_rate': 0.000174851864928067, 'max_depth': 7, 'min_child_weight': 9, 'subsample': 0.6, 'colsample_bytree': 0.5, 'colsample_bylevel': 1.0, 'reg_alpha': 33.003868702190985, 'reg_lambda': 0.0005676862408069262, 'gamma': 16.59089164968892}. Best is trial 205 with value: -0.13735526511479842.
/bsuhome/alexanderemert/Research/Star-Formation-Research-Project-2026/pipeline/scripts/optuna/final_preds_and_models/optuna_search_mult_quant_reg.py:75: UserWarning: The distribution is specified by [0.1, 5] and step=0.25, but the range is not divisible by `step`. It will be replaced with [0.1, 4.85].
  error_threshold = trial.suggest_float("error_threshold", 0.1, 5, step=0.25)
[I 2026-07-20 14:46:15,593] Trial 279 finished with value: -0.13719058482583993 and parameters: {'error_threshold': 0.1, 'scalers': 'robust', 'ratios': 'norm_ratio', 'imputers': 'mean', 'n_estimators': 100, 'learning_rate': 0.0001687365082126112, 'max_depth': 7, 'min_child_weight': 10, 'subsample': 0.6, 'colsample_bytree': 0.5, 'colsample_bylevel': 1.0, 'reg_alpha': 35.27417076363841, 'reg_lambda': 0.0005779846450037613, 'gamma': 18.249781838794714}. Best is trial 205 with value: -0.13735526511479842.
/bsuhome/alexanderemert/Research/Star-Formation-Research-Project-2026/pipeline/scripts/optuna/final_preds_and_models/optuna_search_mult_quant_reg.py:75: UserWarning: The distribution is specified by [0.1, 5] and step=0.25, but the range is not divisible by `step`. It will be replaced with [0.1, 4.85].
  error_threshold = trial.suggest_float("error_threshold", 0.1, 5, step=0.25)
[I 2026-07-20 14:46:15,759] Trial 280 finished with value: -0.1369183648685983 and parameters: {'error_threshold': 0.1, 'scalers': 'robust', 'ratios': 'norm_ratio', 'imputers': 'mean', 'n_estimators': 100, 'learning_rate': 0.000270168186346381, 'max_depth': 7, 'min_child_weight': 10, 'subsample': 0.6, 'colsample_bytree': 0.5, 'colsample_bylevel': 1.0, 'reg_alpha': 42.50840162122162, 'reg_lambda': 0.0002185172360851891, 'gamma': 17.380860785021877}. Best is trial 205 with value: -0.13735526511479842.
/bsuhome/alexanderemert/Research/Star-Formation-Research-Project-2026/pipeline/scripts/optuna/final_preds_and_models/optuna_search_mult_quant_reg.py:75: UserWarning: The distribution is specified by [0.1, 5] and step=0.25, but the range is not divisible by `step`. It will be replaced with [0.1, 4.85].
  error_threshold = trial.suggest_float("error_threshold", 0.1, 5, step=0.25)
[I 2026-07-20 14:46:15,915] Trial 281 finished with value: -0.13683011440382808 and parameters: {'error_threshold': 0.1, 'scalers': 'robust', 'ratios': 'norm_ratio', 'imputers': 'mean', 'n_estimators': 100, 'learning_rate': 0.00026721832359773504, 'max_depth': 7, 'min_child_weight': 10, 'subsample': 0.6, 'colsample_bytree': 0.5, 'colsample_bylevel': 1.0, 'reg_alpha': 3.1606019785493715, 'reg_lambda': 4.873243693268893e-05, 'gamma': 18.60226172570291}. Best is trial 205 with value: -0.13735526511479842.
/bsuhome/alexanderemert/Research/Star-Formation-Research-Project-2026/pipeline/scripts/optuna/final_preds_and_models/optuna_search_mult_quant_reg.py:75: UserWarning: The distribution is specified by [0.1, 5] and step=0.25, but the range is not divisible by `step`. It will be replaced with [0.1, 4.85].
  error_threshold = trial.suggest_float("error_threshold", 0.1, 5, step=0.25)
[I 2026-07-20 14:46:16,164] Trial 282 finished with value: -0.13692168590243273 and parameters: {'error_threshold': 0.1, 'scalers': 'robust', 'ratios': 'norm_ratio', 'imputers': 'mean', 'n_estimators': 100, 'learning_rate': 0.00026931325087414684, 'max_depth': 7, 'min_child_weight': 10, 'subsample': 0.6, 'colsample_bytree': 0.5, 'colsample_bylevel': 1.0, 'reg_alpha': 95.82951526586086, 'reg_lambda': 0.00020663550725899971, 'gamma': 20.302106166392516}. Best is trial 205 with value: -0.13735526511479842.
/bsuhome/alexanderemert/Research/Star-Formation-Research-Project-2026/pipeline/scripts/optuna/final_preds_and_models/optuna_search_mult_quant_reg.py:75: UserWarning: The distribution is specified by [0.1, 5] and step=0.25, but the range is not divisible by `step`. It will be replaced with [0.1, 4.85].
  error_threshold = trial.suggest_float("error_threshold", 0.1, 5, step=0.25)
[I 2026-07-20 14:46:16,252] Trial 283 finished with value: -0.1369056151475687 and parameters: {'error_threshold': 0.1, 'scalers': 'robust', 'ratios': 'norm_ratio', 'imputers': 'mean', 'n_estimators': 100, 'learning_rate': 0.0002532921570141495, 'max_depth': 7, 'min_child_weight': 10, 'subsample': 0.6, 'colsample_bytree': 0.5, 'colsample_bylevel': 1.0, 'reg_alpha': 4.223462987474334, 'reg_lambda': 0.00016397113538103291, 'gamma': 19.0245581122879}. Best is trial 205 with value: -0.13735526511479842.
/bsuhome/alexanderemert/Research/Star-Formation-Research-Project-2026/pipeline/scripts/optuna/final_preds_and_models/optuna_search_mult_quant_reg.py:75: UserWarning: The distribution is specified by [0.1, 5] and step=0.25, but the range is not divisible by `step`. It will be replaced with [0.1, 4.85].
  error_threshold = trial.suggest_float("error_threshold", 0.1, 5, step=0.25)
[I 2026-07-20 14:46:16,614] Trial 284 finished with value: -0.13681708345734742 and parameters: {'error_threshold': 0.1, 'scalers': 'robust', 'ratios': 'norm_ratio', 'imputers': 'mean', 'n_estimators': 100, 'learning_rate': 0.00026271513507296796, 'max_depth': 7, 'min_child_weight': 10, 'subsample': 0.6, 'colsample_bytree': 0.5, 'colsample_bylevel': 1.0, 'reg_alpha': 3.5303206316116307, 'reg_lambda': 5.178859987100132e-05, 'gamma': 17.474378875577337}. Best is trial 205 with value: -0.13735526511479842.
/bsuhome/alexanderemert/Research/Star-Formation-Research-Project-2026/pipeline/scripts/optuna/final_preds_and_models/optuna_search_mult_quant_reg.py:75: UserWarning: The distribution is specified by [0.1, 5] and step=0.25, but the range is not divisible by `step`. It will be replaced with [0.1, 4.85].
  error_threshold = trial.suggest_float("error_threshold", 0.1, 5, step=0.25)
[I 2026-07-20 14:46:16,873] Trial 285 finished with value: -0.13674904611818314 and parameters: {'error_threshold': 0.1, 'scalers': 'robust', 'ratios': 'norm_ratio', 'imputers': 'mean', 'n_estimators': 100, 'learning_rate': 0.00027003195545232447, 'max_depth': 7, 'min_child_weight': 10, 'subsample': 0.6, 'colsample_bytree': 0.5, 'colsample_bylevel': 1.0, 'reg_alpha': 4.502370466485283, 'reg_lambda': 0.0002296982458463207, 'gamma': 15.085840944969132}. Best is trial 205 with value: -0.13735526511479842.
/bsuhome/alexanderemert/Research/Star-Formation-Research-Project-2026/pipeline/scripts/optuna/final_preds_and_models/optuna_search_mult_quant_reg.py:75: UserWarning: The distribution is specified by [0.1, 5] and step=0.25, but the range is not divisible by `step`. It will be replaced with [0.1, 4.85].
  error_threshold = trial.suggest_float("error_threshold", 0.1, 5, step=0.25)
[I 2026-07-20 14:46:17,337] Trial 286 finished with value: -0.13663927227601977 and parameters: {'error_threshold': 0.1, 'scalers': 'robust', 'ratios': 'norm_ratio', 'imputers': 'mean', 'n_estimators': 100, 'learning_rate': 0.00028992617824995486, 'max_depth': 7, 'min_child_weight': 10, 'subsample': 0.6, 'colsample_bytree': 0.5, 'colsample_bylevel': 1.0, 'reg_alpha': 3.886237869737182, 'reg_lambda': 0.0002099474379642754, 'gamma': 14.10557749181395}. Best is trial 205 with value: -0.13735526511479842.
/bsuhome/alexanderemert/Research/Star-Formation-Research-Project-2026/pipeline/scripts/optuna/final_preds_and_models/optuna_search_mult_quant_reg.py:75: UserWarning: The distribution is specified by [0.1, 5] and step=0.25, but the range is not divisible by `step`. It will be replaced with [0.1, 4.85].
  error_threshold = trial.suggest_float("error_threshold", 0.1, 5, step=0.25)
[I 2026-07-20 14:46:17,420] Trial 287 finished with value: -0.13677408839331703 and parameters: {'error_threshold': 0.1, 'scalers': 'robust', 'ratios': 'norm_ratio', 'imputers': 'mean', 'n_estimators': 100, 'learning_rate': 0.00028572697853642033, 'max_depth': 7, 'min_child_weight': 10, 'subsample': 0.6, 'colsample_bytree': 0.5, 'colsample_bylevel': 1.0, 'reg_alpha': 4.100086012666372, 'reg_lambda': 0.00025565623382093873, 'gamma': 17.685857011729844}. Best is trial 205 with value: -0.13735526511479842.
/bsuhome/alexanderemert/Research/Star-Formation-Research-Project-2026/pipeline/scripts/optuna/final_preds_and_models/optuna_search_mult_quant_reg.py:75: UserWarning: The distribution is specified by [0.1, 5] and step=0.25, but the range is not divisible by `step`. It will be replaced with [0.1, 4.85].
  error_threshold = trial.suggest_float("error_threshold", 0.1, 5, step=0.25)
[I 2026-07-20 14:46:17,685] Trial 288 finished with value: -0.10637086669448287 and parameters: {'error_threshold': 0.1, 'scalers': 'robust', 'ratios': 'norm_ratio', 'imputers': 'mean', 'n_estimators': 100, 'learning_rate': 0.05486941415684572, 'max_depth': 7, 'min_child_weight': 10, 'subsample': 0.6, 'colsample_bytree': 0.5, 'colsample_bylevel': 1.0, 'reg_alpha': 99.3376715254006, 'reg_lambda': 0.00022182309875532375, 'gamma': 18.416680280861435}. Best is trial 205 with value: -0.13735526511479842.
/bsuhome/alexanderemert/Research/Star-Formation-Research-Project-2026/pipeline/scripts/optuna/final_preds_and_models/optuna_search_mult_quant_reg.py:75: UserWarning: The distribution is specified by [0.1, 5] and step=0.25, but the range is not divisible by `step`. It will be replaced with [0.1, 4.85].
  error_threshold = trial.suggest_float("error_threshold", 0.1, 5, step=0.25)
[I 2026-07-20 14:46:19,878] Trial 290 finished with value: -0.08319740198548418 and parameters: {'error_threshold': 0.1, 'scalers': 'robust', 'ratios': 'norm_ratio', 'imputers': 'mean', 'n_estimators': 250, 'learning_rate': 0.039185744185750666, 'max_depth': 7, 'min_child_weight': 10, 'subsample': 0.6, 'colsample_bytree': 0.5, 'colsample_bylevel': 1.0, 'reg_alpha': 6.550019285231181, 'reg_lambda': 0.00044673064258475944, 'gamma': 12.141431762333834}. Best is trial 205 with value: -0.13735526511479842.
/bsuhome/alexanderemert/Research/Star-Formation-Research-Project-2026/pipeline/scripts/optuna/final_preds_and_models/optuna_search_mult_quant_reg.py:75: UserWarning: The distribution is specified by [0.1, 5] and step=0.25, but the range is not divisible by `step`. It will be replaced with [0.1, 4.85].
  error_threshold = trial.suggest_float("error_threshold", 0.1, 5, step=0.25)
[I 2026-07-20 14:46:20,026] Trial 291 finished with value: -0.09479904877773261 and parameters: {'error_threshold': 0.1, 'scalers': 'robust', 'ratios': 'norm_ratio', 'imputers': 'mean', 'n_estimators': 250, 'learning_rate': 0.010051420029331059, 'max_depth': 7, 'min_child_weight': 10, 'subsample': 0.6, 'colsample_bytree': 0.5, 'colsample_bylevel': 1.0, 'reg_alpha': 6.216099828911703, 'reg_lambda': 4.798245643177541e-05, 'gamma': 13.08727290429142}. Best is trial 205 with value: -0.13735526511479842.
/bsuhome/alexanderemert/Research/Star-Formation-Research-Project-2026/pipeline/scripts/optuna/final_preds_and_models/optuna_search_mult_quant_reg.py:75: UserWarning: The distribution is specified by [0.1, 5] and step=0.25, but the range is not divisible by `step`. It will be replaced with [0.1, 4.85].
  error_threshold = trial.suggest_float("error_threshold", 0.1, 5, step=0.25)
[I 2026-07-20 14:46:22,954] Trial 292 finished with value: -0.13537949203608124 and parameters: {'error_threshold': 0.1, 'scalers': 'robust', 'ratios': 'norm_ratio', 'imputers': 'mean', 'n_estimators': 250, 'learning_rate': 0.00032898051612393595, 'max_depth': 7, 'min_child_weight': 10, 'subsample': 0.6, 'colsample_bytree': 0.5, 'colsample_bylevel': 1.0, 'reg_alpha': 6.232699240287129, 'reg_lambda': 0.00046165413574817527, 'gamma': 25.624050981743473}. Best is trial 205 with value: -0.13735526511479842.
/bsuhome/alexanderemert/Research/Star-Formation-Research-Project-2026/pipeline/scripts/optuna/final_preds_and_models/optuna_search_mult_quant_reg.py:75: UserWarning: The distribution is specified by [0.1, 5] and step=0.25, but the range is not divisible by `step`. It will be replaced with [0.1, 4.85].
  error_threshold = trial.suggest_float("error_threshold", 0.1, 5, step=0.25)
[I 2026-07-20 14:46:23,392] Trial 294 finished with value: -0.13598992183141836 and parameters: {'error_threshold': 0.1, 'scalers': 'robust', 'ratios': 'norm_ratio', 'imputers': 'mean', 'n_estimators': 250, 'learning_rate': 0.00021452824819181485, 'max_depth': 7, 'min_child_weight': 10, 'subsample': 0.6, 'colsample_bytree': 0.5, 'colsample_bylevel': 1.0, 'reg_alpha': 19.79460731080084, 'reg_lambda': 0.0004129821430103913, 'gamma': 11.759803850968858}. Best is trial 205 with value: -0.13735526511479842.
/bsuhome/alexanderemert/Research/Star-Formation-Research-Project-2026/pipeline/scripts/optuna/final_preds_and_models/optuna_search_mult_quant_reg.py:75: UserWarning: The distribution is specified by [0.1, 5] and step=0.25, but the range is not divisible by `step`. It will be replaced with [0.1, 4.85].
  error_threshold = trial.suggest_float("error_threshold", 0.1, 5, step=0.25)
[I 2026-07-20 14:46:25,167] Trial 295 finished with value: -0.13612587012917995 and parameters: {'error_threshold': 0.1, 'scalers': 'robust', 'ratios': 'norm_ratio', 'imputers': 'mean', 'n_estimators': 250, 'learning_rate': 0.00021476908401227618, 'max_depth': 7, 'min_child_weight': 9, 'subsample': 0.6, 'colsample_bytree': 0.5, 'colsample_bylevel': 1.0, 'reg_alpha': 0.747171411033013, 'reg_lambda': 0.00035823971489480123, 'gamma': 24.95766442381019}. Best is trial 205 with value: -0.13735526511479842.
/bsuhome/alexanderemert/Research/Star-Formation-Research-Project-2026/pipeline/scripts/optuna/final_preds_and_models/optuna_search_mult_quant_reg.py:75: UserWarning: The distribution is specified by [0.1, 5] and step=0.25, but the range is not divisible by `step`. It will be replaced with [0.1, 4.85].
  error_threshold = trial.suggest_float("error_threshold", 0.1, 5, step=0.25)
[I 2026-07-20 14:46:31,098] Trial 289 finished with value: -0.11845648412945654 and parameters: {'error_threshold': 0.1, 'scalers': 'robust', 'ratios': 'norm_ratio', 'imputers': 'mean', 'n_estimators': 2250, 'learning_rate': 0.0003328496341188358, 'max_depth': 7, 'min_child_weight': 9, 'subsample': 0.6, 'colsample_bytree': 0.5, 'colsample_bylevel': 1.0, 'reg_alpha': 5.544094248568283, 'reg_lambda': 0.0002159075464336325, 'gamma': 18.273762043265698}. Best is trial 205 with value: -0.13735526511479842.
/bsuhome/alexanderemert/Research/Star-Formation-Research-Project-2026/pipeline/scripts/optuna/final_preds_and_models/optuna_search_mult_quant_reg.py:75: UserWarning: The distribution is specified by [0.1, 5] and step=0.25, but the range is not divisible by `step`. It will be replaced with [0.1, 4.85].
  error_threshold = trial.suggest_float("error_threshold", 0.1, 5, step=0.25)
[I 2026-07-20 14:46:31,470] Trial 297 finished with value: -0.13578061770766953 and parameters: {'error_threshold': 0.35, 'scalers': 'robust', 'ratios': 'norm_ratio', 'imputers': 'mean', 'n_estimators': 300, 'learning_rate': 0.00022076080850943824, 'max_depth': 7, 'min_child_weight': 9, 'subsample': 0.6, 'colsample_bytree': 0.5, 'colsample_bylevel': 1.0, 'reg_alpha': 19.02591943562471, 'reg_lambda': 0.0006790580193688436, 'gamma': 26.667152900629915}. Best is trial 205 with value: -0.13735526511479842.
/bsuhome/alexanderemert/Research/Star-Formation-Research-Project-2026/pipeline/scripts/optuna/final_preds_and_models/optuna_search_mult_quant_reg.py:75: UserWarning: The distribution is specified by [0.1, 5] and step=0.25, but the range is not divisible by `step`. It will be replaced with [0.1, 4.85].
  error_threshold = trial.suggest_float("error_threshold", 0.1, 5, step=0.25)
