[I 2026-07-20 14:22:46,596] Trial 380 finished with value: -0.24690011186213937 and parameters: {'error_threshold': 2.75, 'scalers': 'standard', 'ratios': 'log_ratio', 'imputers': 'mean', 'n_estimators': 150, 'learning_rate': 0.34716211436281885, 'max_depth': 8, 'min_child_weight': 1, 'subsample': 0.5, 'colsample_bytree': 0.5, 'colsample_bylevel': 0.7, 'reg_alpha': 2.317095306935336, 'reg_lambda': 0.00029439681468895675, 'gamma': 7.985897944463017e-05}. Best is trial 359 with value: -0.8315037537709427.
[I 2026-07-20 14:25:20,059] Trial 381 finished with value: -0.479670454844991 and parameters: {'error_threshold': 2.5, 'scalers': 'standard', 'ratios': 'log_ratio', 'imputers': 'mean', 'n_estimators': 2700, 'learning_rate': 0.34155561890051445, 'max_depth': 8, 'min_child_weight': 1, 'subsample': 0.5, 'colsample_bytree': 0.5, 'colsample_bylevel': 0.7, 'reg_alpha': 2.2371426119204676, 'reg_lambda': 0.0002713983166187107, 'gamma': 9.107521534382145e-05}. Best is trial 359 with value: -0.8315037537709427.
[I 2026-07-20 14:25:25,614] Trial 382 finished with value: -0.38391149191280943 and parameters: {'error_threshold': 1.75, 'scalers': 'standard', 'ratios': 'log_ratio', 'imputers': 'mean', 'n_estimators': 2700, 'learning_rate': 0.23635789430629203, 'max_depth': 8, 'min_child_weight': 1, 'subsample': 0.5, 'colsample_bytree': 0.5, 'colsample_bylevel': 0.7, 'reg_alpha': 2.0437494513712338, 'reg_lambda': 0.0002746816556046726, 'gamma': 3.688366206052974e-05}. Best is trial 359 with value: -0.8315037537709427.
[I 2026-07-20 14:25:31,399] Trial 383 finished with value: -0.47715474841449806 and parameters: {'error_threshold': 2.75, 'scalers': 'standard', 'ratios': 'log_ratio', 'imputers': 'mean', 'n_estimators': 2700, 'learning_rate': 0.3353022367370528, 'max_depth': 8, 'min_child_weight': 1, 'subsample': 0.5, 'colsample_bytree': 0.5, 'colsample_bylevel': 0.7, 'reg_alpha': 2.155800339986518, 'reg_lambda': 0.00031436845199245224, 'gamma': 0.00011340410514194546}. Best is trial 359 with value: -0.8315037537709427.
[I 2026-07-20 14:25:37,386] Trial 384 finished with value: -0.4804650009476117 and parameters: {'error_threshold': 2.75, 'scalers': 'standard', 'ratios': 'log_ratio', 'imputers': 'median', 'n_estimators': 2700, 'learning_rate': 0.3328299689795098, 'max_depth': 8, 'min_child_weight': 1, 'subsample': 0.5, 'colsample_bytree': 0.5, 'colsample_bylevel': 0.7, 'reg_alpha': 1.968746204835468, 'reg_lambda': 0.0002923386988506559, 'gamma': 0.00011124481473722863}. Best is trial 359 with value: -0.8315037537709427.
[I 2026-07-20 14:25:42,586] Trial 385 finished with value: -0.3257261173499167 and parameters: {'error_threshold': 2.75, 'scalers': 'standard', 'ratios': 'norm_ratio', 'imputers': 'median', 'n_estimators': 2700, 'learning_rate': 0.23766272546359452, 'max_depth': 8, 'min_child_weight': 2, 'subsample': 0.5, 'colsample_bytree': 0.5, 'colsample_bylevel': 0.7, 'reg_alpha': 2.0503111903788875, 'reg_lambda': 0.0002747864134630717, 'gamma': 0.00012927056065721685}. Best is trial 359 with value: -0.8315037537709427.
[I 2026-07-20 14:25:47,672] Trial 386 finished with value: -0.16811306017406114 and parameters: {'error_threshold': 1.75, 'scalers': 'standard', 'ratios': 'norm_ratio', 'imputers': 'median', 'n_estimators': 2700, 'learning_rate': 0.0012165727073233552, 'max_depth': 8, 'min_child_weight': 1, 'subsample': 0.5, 'colsample_bytree': 0.5, 'colsample_bylevel': 0.7, 'reg_alpha': 1.5363054720895253, 'reg_lambda': 0.0002913218072468675, 'gamma': 0.00011236651881207882}. Best is trial 359 with value: -0.8315037537709427.
[I 2026-07-20 14:25:54,286] Trial 387 finished with value: -0.5027338329806921 and parameters: {'error_threshold': 2.75, 'scalers': 'standard', 'ratios': 'norm_ratio', 'imputers': 'median', 'n_estimators': 2700, 'learning_rate': 0.49735653538268293, 'max_depth': 8, 'min_child_weight': 2, 'subsample': 0.5, 'colsample_bytree': 0.5, 'colsample_bylevel': 0.7, 'reg_alpha': 1.652530955839234, 'reg_lambda': 0.0003072067815413449, 'gamma': 0.00017199732575961968}. Best is trial 359 with value: -0.8315037537709427.
[I 2026-07-20 14:26:01,827] Trial 388 finished with value: -0.402993951369416 and parameters: {'error_threshold': 2.75, 'scalers': 'standard', 'ratios': 'norm_ratio', 'imputers': 'median', 'n_estimators': 2700, 'learning_rate': 0.22335329284394467, 'max_depth': 8, 'min_child_weight': 1, 'subsample': 0.5, 'colsample_bytree': 0.6, 'colsample_bylevel': 0.7, 'reg_alpha': 1.5655824748906846, 'reg_lambda': 0.0003312051038607565, 'gamma': 0.00012492723470797427}. Best is trial 359 with value: -0.8315037537709427.
[I 2026-07-20 14:27:00,976] Trial 389 finished with value: -0.169438707888647 and parameters: {'error_threshold': 2.75, 'scalers': 'standard', 'ratios': 'norm_ratio', 'imputers': 'median', 'n_estimators': 2450, 'learning_rate': 0.2420796916933236, 'max_depth': 8, 'min_child_weight': 2, 'subsample': 0.5, 'colsample_bytree': 0.5, 'colsample_bylevel': 0.7, 'reg_alpha': 1.4534899079027397, 'reg_lambda': 0.00033380857527166906, 'gamma': 2.624621682777351}. Best is trial 359 with value: -0.8315037537709427.
[I 2026-07-20 14:27:39,030] Trial 391 finished with value: -0.22273262917682915 and parameters: {'error_threshold': 2.75, 'scalers': 'standard', 'ratios': 'norm_ratio', 'imputers': 'median', 'n_estimators': 2650, 'learning_rate': 0.441925080024969, 'max_depth': 3, 'min_child_weight': 2, 'subsample': 0.5, 'colsample_bytree': 0.6, 'colsample_bylevel': 0.7, 'reg_alpha': 1.4469762083480817, 'reg_lambda': 0.000715669679748548, 'gamma': 0.0001830569433472732}. Best is trial 359 with value: -0.8315037537709427.
[I 2026-07-20 14:28:11,235] Trial 390 finished with value: -0.44696025091305397 and parameters: {'error_threshold': 2.75, 'scalers': 'standard', 'ratios': 'norm_ratio', 'imputers': 'mean', 'n_estimators': 2650, 'learning_rate': 0.4308929560630459, 'max_depth': 8, 'min_child_weight': 2, 'subsample': 0.5, 'colsample_bytree': 0.5, 'colsample_bylevel': 0.7, 'reg_alpha': 1.565108068560412, 'reg_lambda': 0.0006627995494998095, 'gamma': 0.00013980631500402237}. Best is trial 359 with value: -0.8315037537709427.
[I 2026-07-20 14:28:22,568] Trial 392 finished with value: -0.18560804128142225 and parameters: {'error_threshold': 2.25, 'scalers': 'standard', 'ratios': 'norm_ratio', 'imputers': 'mean', 'n_estimators': 2450, 'learning_rate': 0.0001904212892458883, 'max_depth': 8, 'min_child_weight': 2, 'subsample': 0.5, 'colsample_bytree': 0.5, 'colsample_bylevel': 0.7, 'reg_alpha': 1.3643296454918963, 'reg_lambda': 0.0008248625793723348, 'gamma': 0.00020410694953043436}. Best is trial 359 with value: -0.8315037537709427.
[I 2026-07-20 14:28:30,526] Trial 393 finished with value: -0.6006001734993626 and parameters: {'error_threshold': 2.25, 'scalers': 'standard', 'ratios': 'norm_ratio', 'imputers': 'mean', 'n_estimators': 2450, 'learning_rate': 0.43406348767094677, 'max_depth': 8, 'min_child_weight': 1, 'subsample': 0.5, 'colsample_bytree': 0.6, 'colsample_bylevel': 0.7, 'reg_alpha': 1.321622881013876, 'reg_lambda': 0.0007532226028884164, 'gamma': 0.000200836418216431}. Best is trial 359 with value: -0.8315037537709427.
[I 2026-07-20 14:28:36,857] Trial 394 finished with value: -0.4275772335242309 and parameters: {'error_threshold': 2.5, 'scalers': 'standard', 'ratios': 'norm_ratio', 'imputers': 'mean', 'n_estimators': 2450, 'learning_rate': 0.4326687703927855, 'max_depth': 8, 'min_child_weight': 2, 'subsample': 0.5, 'colsample_bytree': 0.5, 'colsample_bylevel': 0.7, 'reg_alpha': 1.0120715886008067, 'reg_lambda': 0.0010707518840347174, 'gamma': 0.00021456361148468596}. Best is trial 359 with value: -0.8315037537709427.
[I 2026-07-20 14:28:51,624] Trial 395 finished with value: -0.5746616549619789 and parameters: {'error_threshold': 2.5, 'scalers': 'standard', 'ratios': 'norm_ratio', 'imputers': 'mean', 'n_estimators': 2450, 'learning_rate': 0.420761000935569, 'max_depth': 8, 'min_child_weight': 1, 'subsample': 0.5, 'colsample_bytree': 0.6, 'colsample_bylevel': 0.7, 'reg_alpha': 1.1185217373834073, 'reg_lambda': 0.0006950649145977427, 'gamma': 0.00022632581885224877}. Best is trial 359 with value: -0.8315037537709427.
[I 2026-07-20 14:28:58,638] Trial 396 finished with value: -0.6138377396175801 and parameters: {'error_threshold': 2.5, 'scalers': 'standard', 'ratios': 'norm_ratio', 'imputers': 'mean', 'n_estimators': 2450, 'learning_rate': 0.4302767140855547, 'max_depth': 8, 'min_child_weight': 1, 'subsample': 0.5, 'colsample_bytree': 0.5, 'colsample_bylevel': 0.7, 'reg_alpha': 1.0083100878295352, 'reg_lambda': 0.0007278537166489425, 'gamma': 0.00018569341182220374}. Best is trial 359 with value: -0.8315037537709427.
[I 2026-07-20 14:30:07,242] Trial 397 finished with value: -0.6121098311159674 and parameters: {'error_threshold': 2.5, 'scalers': 'standard', 'ratios': 'norm_ratio', 'imputers': 'mean', 'n_estimators': 2500, 'learning_rate': 0.4376549510112175, 'max_depth': 8, 'min_child_weight': 1, 'subsample': 0.5, 'colsample_bytree': 0.5, 'colsample_bylevel': 0.7, 'reg_alpha': 0.9997561273825916, 'reg_lambda': 0.0007206696141542461, 'gamma': 0.00022086923787037135}. Best is trial 359 with value: -0.8315037537709427.
[I 2026-07-20 14:30:42,407] Trial 398 finished with value: -0.6134987742320587 and parameters: {'error_threshold': 2.5, 'scalers': 'standard', 'ratios': 'norm_ratio', 'imputers': 'mean', 'n_estimators': 2450, 'learning_rate': 0.42987723110221365, 'max_depth': 8, 'min_child_weight': 1, 'subsample': 0.5, 'colsample_bytree': 0.5, 'colsample_bylevel': 0.7, 'reg_alpha': 1.0447276828682641, 'reg_lambda': 0.0010862307404337094, 'gamma': 0.000196929356046057}. Best is trial 359 with value: -0.8315037537709427.
[I 2026-07-20 14:30:58,803] Trial 399 finished with value: -0.5357037203161567 and parameters: {'error_threshold': 2.5, 'scalers': 'standard', 'ratios': 'norm_ratio', 'imputers': 'mean', 'n_estimators': 2350, 'learning_rate': 0.4983631116810298, 'max_depth': 6, 'min_child_weight': 1, 'subsample': 0.5, 'colsample_bytree': 0.5, 'colsample_bylevel': 0.7, 'reg_alpha': 1.15774638241519, 'reg_lambda': 0.0012373307500678067, 'gamma': 0.0002123128917690599}. Best is trial 359 with value: -0.8315037537709427.
[I 2026-07-20 14:31:17,987] Trial 401 finished with value: -0.23796502847403941 and parameters: {'error_threshold': 2.5, 'scalers': 'standard', 'ratios': 'norm_ratio', 'imputers': 'mean', 'n_estimators': 2500, 'learning_rate': 0.43397135294966027, 'max_depth': 8, 'min_child_weight': 1, 'subsample': 0.5, 'colsample_bytree': 0.5, 'colsample_bylevel': 0.7, 'reg_alpha': 9.318806033313242, 'reg_lambda': 0.0011895921247964847, 'gamma': 0.00030510211425217464}. Best is trial 359 with value: -0.8315037537709427.
[I 2026-07-20 14:31:25,285] Trial 400 finished with value: -0.5999112279553356 and parameters: {'error_threshold': 2.5, 'scalers': 'standard', 'ratios': 'norm_ratio', 'imputers': 'mean', 'n_estimators': 2500, 'learning_rate': 0.4301001633085704, 'max_depth': 8, 'min_child_weight': 1, 'subsample': 0.5, 'colsample_bytree': 0.5, 'colsample_bylevel': 0.7, 'reg_alpha': 1.028025419202672, 'reg_lambda': 0.0010269403369304242, 'gamma': 0.0003084485288477463}. Best is trial 359 with value: -0.8315037537709427.
[I 2026-07-20 14:31:32,083] Trial 402 finished with value: -0.6979708859382107 and parameters: {'error_threshold': 2.5, 'scalers': 'standard', 'ratios': 'norm_ratio', 'imputers': 'mean', 'n_estimators': 2350, 'learning_rate': 0.49759597725844673, 'max_depth': 8, 'min_child_weight': 1, 'subsample': 0.5, 'colsample_bytree': 0.5, 'colsample_bylevel': 0.7, 'reg_alpha': 0.9389619245009081, 'reg_lambda': 0.00020681246615395835, 'gamma': 0.00030732099394038446}. Best is trial 359 with value: -0.8315037537709427.
[I 2026-07-20 14:31:46,185] Trial 403 finished with value: -0.6929264065973267 and parameters: {'error_threshold': 2.5, 'scalers': 'standard', 'ratios': 'norm_ratio', 'imputers': 'mean', 'n_estimators': 2550, 'learning_rate': 0.4924099843240286, 'max_depth': 8, 'min_child_weight': 1, 'subsample': 0.5, 'colsample_bytree': 0.5, 'colsample_bylevel': 0.7, 'reg_alpha': 0.8426026547191854, 'reg_lambda': 0.0002101331920053557, 'gamma': 0.00030947292043238643}. Best is trial 359 with value: -0.8315037537709427.
[I 2026-07-20 14:32:01,131] Trial 404 finished with value: -0.7000610073458816 and parameters: {'error_threshold': 2.5, 'scalers': 'standard', 'ratios': 'norm_ratio', 'imputers': 'mean', 'n_estimators': 2550, 'learning_rate': 0.4987137326671502, 'max_depth': 8, 'min_child_weight': 1, 'subsample': 0.5, 'colsample_bytree': 0.5, 'colsample_bylevel': 0.8, 'reg_alpha': 0.9381659030739773, 'reg_lambda': 0.00020978820042452247, 'gamma': 0.0002825647110150982}. Best is trial 359 with value: -0.8315037537709427.
[I 2026-07-20 14:33:27,697] Trial 405 finished with value: -0.7020108401583457 and parameters: {'error_threshold': 2.25, 'scalers': 'standard', 'ratios': 'norm_ratio', 'imputers': 'mean', 'n_estimators': 2350, 'learning_rate': 0.48915286664693114, 'max_depth': 8, 'min_child_weight': 1, 'subsample': 0.5, 'colsample_bytree': 0.5, 'colsample_bylevel': 0.7, 'reg_alpha': 0.9300089217329736, 'reg_lambda': 7.606448793994317e-06, 'gamma': 0.0002556375382703388}. Best is trial 359 with value: -0.8315037537709427.
[I 2026-07-20 14:33:58,635] Trial 406 finished with value: -0.7459977019691829 and parameters: {'error_threshold': 2.25, 'scalers': 'standard', 'ratios': 'norm_ratio', 'imputers': 'mean', 'n_estimators': 2550, 'learning_rate': 0.4979550918702894, 'max_depth': 8, 'min_child_weight': 1, 'subsample': 0.5, 'colsample_bytree': 0.5, 'colsample_bylevel': 0.7, 'reg_alpha': 0.8887162105468717, 'reg_lambda': 0.00021291892156466059, 'gamma': 0.00032511245006238435}. Best is trial 359 with value: -0.8315037537709427.
[I 2026-07-20 14:34:27,271] Trial 407 finished with value: -0.6019157141504428 and parameters: {'error_threshold': 2.25, 'scalers': 'standard', 'ratios': 'norm_ratio', 'imputers': 'mean', 'n_estimators': 2600, 'learning_rate': 0.42780622659019846, 'max_depth': 8, 'min_child_weight': 1, 'subsample': 0.5, 'colsample_bytree': 0.5, 'colsample_bylevel': 0.7, 'reg_alpha': 0.8177777714641008, 'reg_lambda': 0.0002127473236728352, 'gamma': 0.0003263034554878324}. Best is trial 359 with value: -0.8315037537709427.
[I 2026-07-20 14:34:34,584] Trial 408 finished with value: -0.7395743362488059 and parameters: {'error_threshold': 2.25, 'scalers': 'standard', 'ratios': 'norm_ratio', 'imputers': 'mean', 'n_estimators': 2600, 'learning_rate': 0.4923901737623517, 'max_depth': 8, 'min_child_weight': 1, 'subsample': 0.5, 'colsample_bytree': 0.5, 'colsample_bylevel': 0.7, 'reg_alpha': 0.9274153659387275, 'reg_lambda': 0.00042265125472010066, 'gamma': 0.0002706560807097331}. Best is trial 359 with value: -0.8315037537709427.
[I 2026-07-20 14:34:49,104] Trial 409 finished with value: -0.6970883988472445 and parameters: {'error_threshold': 2.25, 'scalers': 'standard', 'ratios': 'norm_ratio', 'imputers': 'mean', 'n_estimators': 2600, 'learning_rate': 0.4915173112235172, 'max_depth': 8, 'min_child_weight': 1, 'subsample': 0.5, 'colsample_bytree': 0.5, 'colsample_bylevel': 0.7, 'reg_alpha': 0.8584368919313097, 'reg_lambda': 0.0002025542248129077, 'gamma': 3.243110322814257e-05}. Best is trial 359 with value: -0.8315037537709427.
[I 2026-07-20 14:34:55,582] Trial 410 finished with value: -0.7263290964812641 and parameters: {'error_threshold': 2.25, 'scalers': 'standard', 'ratios': 'norm_ratio', 'imputers': 'mean', 'n_estimators': 2350, 'learning_rate': 0.4878829102490962, 'max_depth': 8, 'min_child_weight': 1, 'subsample': 0.5, 'colsample_bytree': 0.5, 'colsample_bylevel': 0.7, 'reg_alpha': 1.0275807194906026, 'reg_lambda': 0.0002002372125490008, 'gamma': 0.002164026660713173}. Best is trial 359 with value: -0.8315037537709427.
[I 2026-07-20 14:35:09,270] Trial 411 finished with value: -0.4806670589469439 and parameters: {'error_threshold': 2.75, 'scalers': 'standard', 'ratios': 'norm_ratio', 'imputers': 'mean', 'n_estimators': 2600, 'learning_rate': 0.3221667067886212, 'max_depth': 8, 'min_child_weight': 1, 'subsample': 0.5, 'colsample_bytree': 0.5, 'colsample_bylevel': 0.7, 'reg_alpha': 0.8762870143922997, 'reg_lambda': 0.00021315253854023756, 'gamma': 0.00037493048618595336}. Best is trial 359 with value: -0.8315037537709427.
[I 2026-07-20 14:35:12,188] Trial 412 finished with value: -0.41392372765699753 and parameters: {'error_threshold': 2.25, 'scalers': 'standard', 'ratios': 'norm_ratio', 'imputers': 'mean', 'n_estimators': 2350, 'learning_rate': 0.4972097217418969, 'max_depth': 8, 'min_child_weight': 1, 'subsample': 0.5, 'colsample_bytree': 0.5, 'colsample_bylevel': 0.8, 'reg_alpha': 1.7955883068469605e-06, 'reg_lambda': 0.0001704304380296103, 'gamma': 0.0003245619048910919}. Best is trial 359 with value: -0.8315037537709427.
[I 2026-07-20 14:36:46,455] Trial 413 finished with value: -0.6498989760905493 and parameters: {'error_threshold': 2.25, 'scalers': 'standard', 'ratios': 'norm_ratio', 'imputers': 'mean', 'n_estimators': 2300, 'learning_rate': 0.49750294805011297, 'max_depth': 8, 'min_child_weight': 1, 'subsample': 0.5, 'colsample_bytree': 0.5, 'colsample_bylevel': 0.9, 'reg_alpha': 0.799733987673074, 'reg_lambda': 3.6521504377944204e-06, 'gamma': 0.0003851690630973295}. Best is trial 359 with value: -0.8315037537709427.
[I 2026-07-20 14:37:15,425] Trial 414 finished with value: -0.6658082805358245 and parameters: {'error_threshold': 2.25, 'scalers': 'standard', 'ratios': 'norm_ratio', 'imputers': 'mean', 'n_estimators': 2350, 'learning_rate': 0.48628740038912416, 'max_depth': 8, 'min_child_weight': 1, 'subsample': 0.5, 'colsample_bytree': 0.5, 'colsample_bylevel': 0.8, 'reg_alpha': 0.8675807238475262, 'reg_lambda': 2.297397601094703e-06, 'gamma': 0.00031786692178759247}. Best is trial 359 with value: -0.8315037537709427.
[I 2026-07-20 14:37:43,853] Trial 415 finished with value: -0.6883466232497831 and parameters: {'error_threshold': 2.25, 'scalers': 'standard', 'ratios': 'norm_ratio', 'imputers': 'mean', 'n_estimators': 2300, 'learning_rate': 0.49206570989895376, 'max_depth': 8, 'min_child_weight': 1, 'subsample': 0.5, 'colsample_bytree': 0.5, 'colsample_bylevel': 0.8, 'reg_alpha': 0.8629381753050474, 'reg_lambda': 0.00016510658714135917, 'gamma': 0.0003406833879366708}. Best is trial 359 with value: -0.8315037537709427.
[I 2026-07-20 14:37:50,562] Trial 416 finished with value: -0.6397001207851666 and parameters: {'error_threshold': 2.5, 'scalers': 'standard', 'ratios': 'norm_ratio', 'imputers': 'mean', 'n_estimators': 2300, 'learning_rate': 0.4796841108444225, 'max_depth': 8, 'min_child_weight': 1, 'subsample': 0.5, 'colsample_bytree': 0.5, 'colsample_bylevel': 0.8, 'reg_alpha': 0.8686279221204535, 'reg_lambda': 3.989573036169946e-06, 'gamma': 0.00031756786333251154}. Best is trial 359 with value: -0.8315037537709427.
[I 2026-07-20 14:38:03,527] Trial 417 finished with value: -0.5169452855992059 and parameters: {'error_threshold': 2.25, 'scalers': 'standard', 'ratios': 'norm_ratio', 'imputers': 'mean', 'n_estimators': 2400, 'learning_rate': 0.3763064810146979, 'max_depth': 8, 'min_child_weight': 1, 'subsample': 0.5, 'colsample_bytree': 0.5, 'colsample_bylevel': 0.7, 'reg_alpha': 0.8574319880694602, 'reg_lambda': 3.2170129384979067e-06, 'gamma': 0.0003239148384033965}. Best is trial 359 with value: -0.8315037537709427.
[I 2026-07-20 14:38:10,108] Trial 418 finished with value: -0.7039360085956332 and parameters: {'error_threshold': 2.25, 'scalers': 'standard', 'ratios': 'norm_ratio', 'imputers': 'mean', 'n_estimators': 2300, 'learning_rate': 0.49360962481169035, 'max_depth': 8, 'min_child_weight': 1, 'subsample': 0.5, 'colsample_bytree': 0.5, 'colsample_bylevel': 0.7, 'reg_alpha': 0.9589032701552356, 'reg_lambda': 5.905500385400868e-06, 'gamma': 1.2601716522689143e-05}. Best is trial 359 with value: -0.8315037537709427.
[I 2026-07-20 14:38:23,802] Trial 419 finished with value: -0.5189694239132185 and parameters: {'error_threshold': 2.25, 'scalers': 'standard', 'ratios': 'norm_ratio', 'imputers': 'mean', 'n_estimators': 2400, 'learning_rate': 0.3806889617521292, 'max_depth': 8, 'min_child_weight': 1, 'subsample': 0.5, 'colsample_bytree': 0.5, 'colsample_bylevel': 0.7, 'reg_alpha': 0.7768092552363888, 'reg_lambda': 8.601092708897372e-05, 'gamma': 4.642592641430002e-06}. Best is trial 359 with value: -0.8315037537709427.
[I 2026-07-20 14:38:30,634] Trial 420 finished with value: -0.6798669573191475 and parameters: {'error_threshold': 2.25, 'scalers': 'standard', 'ratios': 'norm_ratio', 'imputers': 'mean', 'n_estimators': 2350, 'learning_rate': 0.4906219329747475, 'max_depth': 8, 'min_child_weight': 1, 'subsample': 0.5, 'colsample_bytree': 0.5, 'colsample_bylevel': 0.7, 'reg_alpha': 0.8092027918352798, 'reg_lambda': 2.368034861375242e-06, 'gamma': 0.002481601394929569}. Best is trial 359 with value: -0.8315037537709427.
[I 2026-07-20 14:40:03,246] Trial 421 finished with value: -0.71359475109207 and parameters: {'error_threshold': 2.25, 'scalers': 'standard', 'ratios': 'norm_ratio', 'imputers': 'mean', 'n_estimators': 2350, 'learning_rate': 0.49165781685587023, 'max_depth': 8, 'min_child_weight': 1, 'subsample': 0.5, 'colsample_bytree': 0.5, 'colsample_bylevel': 0.7, 'reg_alpha': 0.8584141286069416, 'reg_lambda': 4.352132631493328e-06, 'gamma': 0.0021161618241477883}. Best is trial 359 with value: -0.8315037537709427.
[I 2026-07-20 14:40:32,599] Trial 422 finished with value: -0.6739392417471848 and parameters: {'error_threshold': 2.25, 'scalers': 'standard', 'ratios': 'norm_ratio', 'imputers': 'mean', 'n_estimators': 2350, 'learning_rate': 0.49786975724175325, 'max_depth': 8, 'min_child_weight': 1, 'subsample': 0.5, 'colsample_bytree': 0.5, 'colsample_bylevel': 0.9, 'reg_alpha': 0.8762731059755559, 'reg_lambda': 4.335379790232793e-06, 'gamma': 0.0003420273576302968}. Best is trial 359 with value: -0.8315037537709427.
