[I 2026-07-21 09:34:02,768] Trial 48 finished with value: -0.18407125073230443 and parameters: {'error_threshold': 2.35, 'scalers': 'robust', 'ratios': 'log_ratio', 'imputers': 'none', 'n_estimators': 2100, 'learning_rate': 0.02947959733309627, 'max_depth': 6, 'min_child_weight': 9, 'subsample': 0.9, 'colsample_bytree': 0.7, 'colsample_bylevel': 0.7, 'reg_alpha': 1.3037382889542772, 'reg_lambda': 1.528193151297143e-05, 'gamma': 0.2831817714278524}. Best is trial 35 with value: -0.18163929183600333.
/bsuhome/alexanderemert/Research/Star-Formation-Research-Project-2026/pipeline/scripts/optuna/final_preds_and_models/optuna_search_mult_quant_reg.py:75: UserWarning: The distribution is specified by [0.1, 5] and step=0.25, but the range is not divisible by `step`. It will be replaced with [0.1, 4.85].
  error_threshold = trial.suggest_float("error_threshold", 0.1, 5, step=0.25)
[I 2026-07-21 09:34:04,135] Trial 49 finished with value: -0.18793046460540766 and parameters: {'error_threshold': 2.35, 'scalers': 'robust', 'ratios': 'log_ratio', 'imputers': 'none', 'n_estimators': 2050, 'learning_rate': 0.004557278270048233, 'max_depth': 6, 'min_child_weight': 9, 'subsample': 0.9, 'colsample_bytree': 0.7, 'colsample_bylevel': 0.7, 'reg_alpha': 1.806213859523623, 'reg_lambda': 8.963644147962626e-06, 'gamma': 0.6077980154178182}. Best is trial 35 with value: -0.18163929183600333.
/bsuhome/alexanderemert/Research/Star-Formation-Research-Project-2026/pipeline/scripts/optuna/final_preds_and_models/optuna_search_mult_quant_reg.py:75: UserWarning: The distribution is specified by [0.1, 5] and step=0.25, but the range is not divisible by `step`. It will be replaced with [0.1, 4.85].
  error_threshold = trial.suggest_float("error_threshold", 0.1, 5, step=0.25)
[I 2026-07-21 09:34:08,268] Trial 50 finished with value: -0.1863818053837921 and parameters: {'error_threshold': 2.35, 'scalers': 'robust', 'ratios': 'log_ratio', 'imputers': 'none', 'n_estimators': 2250, 'learning_rate': 0.0057896911409568465, 'max_depth': 6, 'min_child_weight': 9, 'subsample': 0.9, 'colsample_bytree': 0.7, 'colsample_bylevel': 0.7, 'reg_alpha': 2.0263758522248168, 'reg_lambda': 1.1606137396934735e-05, 'gamma': 0.5037917730796546}. Best is trial 35 with value: -0.18163929183600333.
/bsuhome/alexanderemert/Research/Star-Formation-Research-Project-2026/pipeline/scripts/optuna/final_preds_and_models/optuna_search_mult_quant_reg.py:75: UserWarning: The distribution is specified by [0.1, 5] and step=0.25, but the range is not divisible by `step`. It will be replaced with [0.1, 4.85].
  error_threshold = trial.suggest_float("error_threshold", 0.1, 5, step=0.25)
[I 2026-07-21 09:34:08,811] Trial 52 finished with value: -0.19223342912252053 and parameters: {'error_threshold': 2.6, 'scalers': 'robust', 'ratios': 'log_ratio', 'imputers': 'median', 'n_estimators': 1000, 'learning_rate': 0.004440658924438094, 'max_depth': 6, 'min_child_weight': 9, 'subsample': 0.9, 'colsample_bytree': 0.7, 'colsample_bylevel': 0.7, 'reg_alpha': 1.1833148041118104, 'reg_lambda': 0.0028498320103355155, 'gamma': 0.4931962742925861}. Best is trial 35 with value: -0.18163929183600333.
/bsuhome/alexanderemert/Research/Star-Formation-Research-Project-2026/pipeline/scripts/optuna/final_preds_and_models/optuna_search_mult_quant_reg.py:75: UserWarning: The distribution is specified by [0.1, 5] and step=0.25, but the range is not divisible by `step`. It will be replaced with [0.1, 4.85].
  error_threshold = trial.suggest_float("error_threshold", 0.1, 5, step=0.25)
[I 2026-07-21 09:34:13,390] Trial 51 finished with value: -0.18509720273423924 and parameters: {'error_threshold': 2.35, 'scalers': 'robust', 'ratios': 'log_ratio', 'imputers': 'median', 'n_estimators': 2250, 'learning_rate': 0.0057782733002842935, 'max_depth': 6, 'min_child_weight': 9, 'subsample': 0.9, 'colsample_bytree': 0.7, 'colsample_bylevel': 0.7, 'reg_alpha': 0.9383612507776795, 'reg_lambda': 0.005108251012531832, 'gamma': 0.45266627361992023}. Best is trial 35 with value: -0.18163929183600333.
/bsuhome/alexanderemert/Research/Star-Formation-Research-Project-2026/pipeline/scripts/optuna/final_preds_and_models/optuna_search_mult_quant_reg.py:75: UserWarning: The distribution is specified by [0.1, 5] and step=0.25, but the range is not divisible by `step`. It will be replaced with [0.1, 4.85].
  error_threshold = trial.suggest_float("error_threshold", 0.1, 5, step=0.25)
[I 2026-07-21 09:34:14,863] Trial 53 finished with value: -0.18529677583874452 and parameters: {'error_threshold': 2.35, 'scalers': 'robust', 'ratios': 'log_ratio', 'imputers': 'median', 'n_estimators': 2150, 'learning_rate': 0.005898125414265154, 'max_depth': 6, 'min_child_weight': 8, 'subsample': 0.9, 'colsample_bytree': 0.7, 'colsample_bylevel': 0.7, 'reg_alpha': 1.3481415392593479, 'reg_lambda': 0.003972139258021531, 'gamma': 0.4248682395624549}. Best is trial 35 with value: -0.18163929183600333.
/bsuhome/alexanderemert/Research/Star-Formation-Research-Project-2026/pipeline/scripts/optuna/final_preds_and_models/optuna_search_mult_quant_reg.py:75: UserWarning: The distribution is specified by [0.1, 5] and step=0.25, but the range is not divisible by `step`. It will be replaced with [0.1, 4.85].
  error_threshold = trial.suggest_float("error_threshold", 0.1, 5, step=0.25)
[I 2026-07-21 09:34:40,074] Trial 54 finished with value: -0.18398197260368834 and parameters: {'error_threshold': 2.35, 'scalers': 'robust', 'ratios': 'log_ratio', 'imputers': 'median', 'n_estimators': 1950, 'learning_rate': 0.004761202114592127, 'max_depth': 4, 'min_child_weight': 1, 'subsample': 0.9, 'colsample_bytree': 0.7, 'colsample_bylevel': 0.7, 'reg_alpha': 1.33899313910388, 'reg_lambda': 0.002042115692982771, 'gamma': 0.026521522341461795}. Best is trial 35 with value: -0.18163929183600333.
/bsuhome/alexanderemert/Research/Star-Formation-Research-Project-2026/pipeline/scripts/optuna/final_preds_and_models/optuna_search_mult_quant_reg.py:75: UserWarning: The distribution is specified by [0.1, 5] and step=0.25, but the range is not divisible by `step`. It will be replaced with [0.1, 4.85].
  error_threshold = trial.suggest_float("error_threshold", 0.1, 5, step=0.25)
[I 2026-07-21 09:34:47,435] Trial 55 finished with value: -0.18328917765072597 and parameters: {'error_threshold': 3.1, 'scalers': 'robust', 'ratios': 'log_ratio', 'imputers': 'median', 'n_estimators': 2300, 'learning_rate': 0.006564221455741825, 'max_depth': 4, 'min_child_weight': 1, 'subsample': 0.9, 'colsample_bytree': 0.7, 'colsample_bylevel': 0.7, 'reg_alpha': 0.8288112444656247, 'reg_lambda': 0.0017435292481459033, 'gamma': 0.021518899444657378}. Best is trial 35 with value: -0.18163929183600333.
/bsuhome/alexanderemert/Research/Star-Formation-Research-Project-2026/pipeline/scripts/optuna/final_preds_and_models/optuna_search_mult_quant_reg.py:75: UserWarning: The distribution is specified by [0.1, 5] and step=0.25, but the range is not divisible by `step`. It will be replaced with [0.1, 4.85].
  error_threshold = trial.suggest_float("error_threshold", 0.1, 5, step=0.25)
[I 2026-07-21 09:34:48,823] Trial 56 finished with value: -0.18780809124574518 and parameters: {'error_threshold': 2.35, 'scalers': 'robust', 'ratios': 'log_ratio', 'imputers': 'median', 'n_estimators': 2250, 'learning_rate': 0.06214649599118491, 'max_depth': 8, 'min_child_weight': 8, 'subsample': 0.9, 'colsample_bytree': 0.7, 'colsample_bylevel': 0.7, 'reg_alpha': 1.4323602780653937, 'reg_lambda': 0.002576963500536029, 'gamma': 0.808051729381597}. Best is trial 35 with value: -0.18163929183600333.
/bsuhome/alexanderemert/Research/Star-Formation-Research-Project-2026/pipeline/scripts/optuna/final_preds_and_models/optuna_search_mult_quant_reg.py:75: UserWarning: The distribution is specified by [0.1, 5] and step=0.25, but the range is not divisible by `step`. It will be replaced with [0.1, 4.85].
  error_threshold = trial.suggest_float("error_threshold", 0.1, 5, step=0.25)
[I 2026-07-21 09:35:00,190] Trial 57 finished with value: -0.22207281186507663 and parameters: {'error_threshold': 3.35, 'scalers': 'robust', 'ratios': 'log_ratio', 'imputers': 'median', 'n_estimators': 2250, 'learning_rate': 0.05875564398705129, 'max_depth': 8, 'min_child_weight': 4, 'subsample': 0.9, 'colsample_bytree': 0.7, 'colsample_bylevel': 0.7, 'reg_alpha': 0.9713482315425965, 'reg_lambda': 0.0014103656062417899, 'gamma': 11.602392172939254}. Best is trial 35 with value: -0.18163929183600333.
/bsuhome/alexanderemert/Research/Star-Formation-Research-Project-2026/pipeline/scripts/optuna/final_preds_and_models/optuna_search_mult_quant_reg.py:75: UserWarning: The distribution is specified by [0.1, 5] and step=0.25, but the range is not divisible by `step`. It will be replaced with [0.1, 4.85].
  error_threshold = trial.suggest_float("error_threshold", 0.1, 5, step=0.25)
[I 2026-07-21 09:35:00,783] Trial 59 finished with value: -0.18640862321714033 and parameters: {'error_threshold': 2.85, 'scalers': 'robust', 'ratios': 'log_ratio', 'imputers': 'median', 'n_estimators': 1450, 'learning_rate': 0.06756992517055911, 'max_depth': 8, 'min_child_weight': 8, 'subsample': 0.9, 'colsample_bytree': 0.7, 'colsample_bylevel': 0.7, 'reg_alpha': 12.827495127106994, 'reg_lambda': 0.0006304198722091143, 'gamma': 0.020111092787442643}. Best is trial 35 with value: -0.18163929183600333.
/bsuhome/alexanderemert/Research/Star-Formation-Research-Project-2026/pipeline/scripts/optuna/final_preds_and_models/optuna_search_mult_quant_reg.py:75: UserWarning: The distribution is specified by [0.1, 5] and step=0.25, but the range is not divisible by `step`. It will be replaced with [0.1, 4.85].
  error_threshold = trial.suggest_float("error_threshold", 0.1, 5, step=0.25)
[I 2026-07-21 09:35:02,846] Trial 60 finished with value: -0.1866794513701873 and parameters: {'error_threshold': 3.35, 'scalers': 'none', 'ratios': 'log_ratio', 'imputers': 'none', 'n_estimators': 1800, 'learning_rate': 0.0637560502285744, 'max_depth': 8, 'min_child_weight': 8, 'subsample': 0.5, 'colsample_bytree': 0.5, 'colsample_bylevel': 0.7, 'reg_alpha': 10.147494298084553, 'reg_lambda': 0.0009106435192082159, 'gamma': 0.029280051622234113}. Best is trial 35 with value: -0.18163929183600333.
/bsuhome/alexanderemert/Research/Star-Formation-Research-Project-2026/pipeline/scripts/optuna/final_preds_and_models/optuna_search_mult_quant_reg.py:75: UserWarning: The distribution is specified by [0.1, 5] and step=0.25, but the range is not divisible by `step`. It will be replaced with [0.1, 4.85].
  error_threshold = trial.suggest_float("error_threshold", 0.1, 5, step=0.25)
[I 2026-07-21 09:35:03,924] Trial 61 finished with value: -0.1863041529677907 and parameters: {'error_threshold': 3.35, 'scalers': 'none', 'ratios': 'log_ratio', 'imputers': 'none', 'n_estimators': 1700, 'learning_rate': 0.0571891249263496, 'max_depth': 4, 'min_child_weight': 4, 'subsample': 1.0, 'colsample_bytree': 0.5, 'colsample_bylevel': 0.8, 'reg_alpha': 9.395737715079713, 'reg_lambda': 0.0011475027561102524, 'gamma': 0.02433291049165464}. Best is trial 35 with value: -0.18163929183600333.
/bsuhome/alexanderemert/Research/Star-Formation-Research-Project-2026/pipeline/scripts/optuna/final_preds_and_models/optuna_search_mult_quant_reg.py:75: UserWarning: The distribution is specified by [0.1, 5] and step=0.25, but the range is not divisible by `step`. It will be replaced with [0.1, 4.85].
  error_threshold = trial.suggest_float("error_threshold", 0.1, 5, step=0.25)
[I 2026-07-21 09:35:12,661] Trial 58 finished with value: -0.24794448096619412 and parameters: {'error_threshold': 3.35, 'scalers': 'robust', 'ratios': 'log_ratio', 'imputers': 'median', 'n_estimators': 1700, 'learning_rate': 0.07308740936619157, 'max_depth': 8, 'min_child_weight': 1, 'subsample': 0.9, 'colsample_bytree': 0.7, 'colsample_bylevel': 0.7, 'reg_alpha': 0.9091536489555885, 'reg_lambda': 0.0014633334765526145, 'gamma': 0.023295944151841226}. Best is trial 35 with value: -0.18163929183600333.
/bsuhome/alexanderemert/Research/Star-Formation-Research-Project-2026/pipeline/scripts/optuna/final_preds_and_models/optuna_search_mult_quant_reg.py:75: UserWarning: The distribution is specified by [0.1, 5] and step=0.25, but the range is not divisible by `step`. It will be replaced with [0.1, 4.85].
  error_threshold = trial.suggest_float("error_threshold", 0.1, 5, step=0.25)
[I 2026-07-21 09:35:33,599] Trial 62 finished with value: -0.1859895856389204 and parameters: {'error_threshold': 3.1, 'scalers': 'robust', 'ratios': 'log_ratio', 'imputers': 'median', 'n_estimators': 1800, 'learning_rate': 0.0826963621259377, 'max_depth': 5, 'min_child_weight': 2, 'subsample': 1.0, 'colsample_bytree': 0.7, 'colsample_bylevel': 0.7, 'reg_alpha': 7.604693279663742, 'reg_lambda': 0.0009147627490802403, 'gamma': 0.024034347813291536}. Best is trial 35 with value: -0.18163929183600333.
/bsuhome/alexanderemert/Research/Star-Formation-Research-Project-2026/pipeline/scripts/optuna/final_preds_and_models/optuna_search_mult_quant_reg.py:75: UserWarning: The distribution is specified by [0.1, 5] and step=0.25, but the range is not divisible by `step`. It will be replaced with [0.1, 4.85].
  error_threshold = trial.suggest_float("error_threshold", 0.1, 5, step=0.25)
[I 2026-07-21 09:35:38,924] Trial 67 finished with value: -0.19638810290811115 and parameters: {'error_threshold': 0.6, 'scalers': 'none', 'ratios': 'log_ratio', 'imputers': 'median', 'n_estimators': 350, 'learning_rate': 0.00857611112011075, 'max_depth': 4, 'min_child_weight': 1, 'subsample': 1.0, 'colsample_bytree': 0.9, 'colsample_bylevel': 0.5, 'reg_alpha': 4.210268940878761, 'reg_lambda': 0.00031196253238631905, 'gamma': 0.004311277536154452}. Best is trial 35 with value: -0.18163929183600333.
/bsuhome/alexanderemert/Research/Star-Formation-Research-Project-2026/pipeline/scripts/optuna/final_preds_and_models/optuna_search_mult_quant_reg.py:75: UserWarning: The distribution is specified by [0.1, 5] and step=0.25, but the range is not divisible by `step`. It will be replaced with [0.1, 4.85].
  error_threshold = trial.suggest_float("error_threshold", 0.1, 5, step=0.25)
[I 2026-07-21 09:35:40,145] Trial 63 finished with value: -0.18676122032477513 and parameters: {'error_threshold': 3.35, 'scalers': 'none', 'ratios': 'log_ratio', 'imputers': 'median', 'n_estimators': 1850, 'learning_rate': 0.06545716131689933, 'max_depth': 4, 'min_child_weight': 1, 'subsample': 1.0, 'colsample_bytree': 0.9, 'colsample_bylevel': 0.8, 'reg_alpha': 10.346159932550462, 'reg_lambda': 0.0008202261524397218, 'gamma': 0.024714375417518024}. Best is trial 35 with value: -0.18163929183600333.
/bsuhome/alexanderemert/Research/Star-Formation-Research-Project-2026/pipeline/scripts/optuna/final_preds_and_models/optuna_search_mult_quant_reg.py:75: UserWarning: The distribution is specified by [0.1, 5] and step=0.25, but the range is not divisible by `step`. It will be replaced with [0.1, 4.85].
  error_threshold = trial.suggest_float("error_threshold", 0.1, 5, step=0.25)
[I 2026-07-21 09:35:41,527] Trial 64 finished with value: -0.18663618970889365 and parameters: {'error_threshold': 3.35, 'scalers': 'none', 'ratios': 'log_ratio', 'imputers': 'median', 'n_estimators': 1850, 'learning_rate': 0.00870198925761104, 'max_depth': 4, 'min_child_weight': 1, 'subsample': 1.0, 'colsample_bytree': 0.9, 'colsample_bylevel': 0.5, 'reg_alpha': 9.744812375716604, 'reg_lambda': 0.0007277091825132627, 'gamma': 0.03519773870384321}. Best is trial 35 with value: -0.18163929183600333.
/bsuhome/alexanderemert/Research/Star-Formation-Research-Project-2026/pipeline/scripts/optuna/final_preds_and_models/optuna_search_mult_quant_reg.py:75: UserWarning: The distribution is specified by [0.1, 5] and step=0.25, but the range is not divisible by `step`. It will be replaced with [0.1, 4.85].
  error_threshold = trial.suggest_float("error_threshold", 0.1, 5, step=0.25)
[I 2026-07-21 09:35:42,935] Trial 65 finished with value: -0.18619665906725405 and parameters: {'error_threshold': 3.6, 'scalers': 'none', 'ratios': 'log_ratio', 'imputers': 'median', 'n_estimators': 1750, 'learning_rate': 0.01030678951335541, 'max_depth': 4, 'min_child_weight': 1, 'subsample': 1.0, 'colsample_bytree': 0.9, 'colsample_bylevel': 0.8, 'reg_alpha': 10.263648115801875, 'reg_lambda': 0.00043205807904902343, 'gamma': 0.017511427700823718}. Best is trial 35 with value: -0.18163929183600333.
/bsuhome/alexanderemert/Research/Star-Formation-Research-Project-2026/pipeline/scripts/optuna/final_preds_and_models/optuna_search_mult_quant_reg.py:75: UserWarning: The distribution is specified by [0.1, 5] and step=0.25, but the range is not divisible by `step`. It will be replaced with [0.1, 4.85].
  error_threshold = trial.suggest_float("error_threshold", 0.1, 5, step=0.25)
[I 2026-07-21 09:35:45,706] Trial 66 finished with value: -0.18308180086463358 and parameters: {'error_threshold': 3.6, 'scalers': 'none', 'ratios': 'log_ratio', 'imputers': 'median', 'n_estimators': 1850, 'learning_rate': 0.009664891415793925, 'max_depth': 4, 'min_child_weight': 1, 'subsample': 1.0, 'colsample_bytree': 0.9, 'colsample_bylevel': 0.8, 'reg_alpha': 4.596321868963447, 'reg_lambda': 0.0003063861075119592, 'gamma': 0.0039592314134422844}. Best is trial 35 with value: -0.18163929183600333.
/bsuhome/alexanderemert/Research/Star-Formation-Research-Project-2026/pipeline/scripts/optuna/final_preds_and_models/optuna_search_mult_quant_reg.py:75: UserWarning: The distribution is specified by [0.1, 5] and step=0.25, but the range is not divisible by `step`. It will be replaced with [0.1, 4.85].
  error_threshold = trial.suggest_float("error_threshold", 0.1, 5, step=0.25)
[I 2026-07-21 09:35:56,465] Trial 68 finished with value: -0.18462914209618386 and parameters: {'error_threshold': 3.85, 'scalers': 'robust', 'ratios': 'log_ratio', 'imputers': 'median', 'n_estimators': 1850, 'learning_rate': 0.010275587290401723, 'max_depth': 5, 'min_child_weight': 1, 'subsample': 0.9, 'colsample_bytree': 0.9, 'colsample_bylevel': 0.8, 'reg_alpha': 4.348976068891172, 'reg_lambda': 0.011390051727136646, 'gamma': 0.1554376104754015}. Best is trial 35 with value: -0.18163929183600333.
/bsuhome/alexanderemert/Research/Star-Formation-Research-Project-2026/pipeline/scripts/optuna/final_preds_and_models/optuna_search_mult_quant_reg.py:75: UserWarning: The distribution is specified by [0.1, 5] and step=0.25, but the range is not divisible by `step`. It will be replaced with [0.1, 4.85].
  error_threshold = trial.suggest_float("error_threshold", 0.1, 5, step=0.25)
[I 2026-07-21 09:36:10,318] Trial 69 finished with value: -0.18461467890390926 and parameters: {'error_threshold': 0.6, 'scalers': 'robust', 'ratios': 'log_ratio', 'imputers': 'median', 'n_estimators': 2400, 'learning_rate': 0.008973175281105566, 'max_depth': 5, 'min_child_weight': 1, 'subsample': 0.9, 'colsample_bytree': 0.9, 'colsample_bylevel': 0.8, 'reg_alpha': 3.8627116227774034, 'reg_lambda': 0.00018166505125310938, 'gamma': 0.15166127756142467}. Best is trial 35 with value: -0.18163929183600333.
/bsuhome/alexanderemert/Research/Star-Formation-Research-Project-2026/pipeline/scripts/optuna/final_preds_and_models/optuna_search_mult_quant_reg.py:75: UserWarning: The distribution is specified by [0.1, 5] and step=0.25, but the range is not divisible by `step`. It will be replaced with [0.1, 4.85].
  error_threshold = trial.suggest_float("error_threshold", 0.1, 5, step=0.25)
[I 2026-07-21 09:36:29,283] Trial 72 finished with value: -0.20559000247598389 and parameters: {'error_threshold': 3.85, 'scalers': 'robust', 'ratios': 'log_ratio', 'imputers': 'none', 'n_estimators': 200, 'learning_rate': 0.011446449154882056, 'max_depth': 5, 'min_child_weight': 2, 'subsample': 0.9, 'colsample_bytree': 0.9, 'colsample_bylevel': 0.5, 'reg_alpha': 3.76936858788907, 'reg_lambda': 2.5886074892573804e-05, 'gamma': 0.1390614347869787}. Best is trial 35 with value: -0.18163929183600333.
/bsuhome/alexanderemert/Research/Star-Formation-Research-Project-2026/pipeline/scripts/optuna/final_preds_and_models/optuna_search_mult_quant_reg.py:75: UserWarning: The distribution is specified by [0.1, 5] and step=0.25, but the range is not divisible by `step`. It will be replaced with [0.1, 4.85].
  error_threshold = trial.suggest_float("error_threshold", 0.1, 5, step=0.25)
[I 2026-07-21 09:36:42,529] Trial 70 finished with value: -0.18356934032427008 and parameters: {'error_threshold': 0.6, 'scalers': 'robust', 'ratios': 'log_ratio', 'imputers': 'median', 'n_estimators': 2400, 'learning_rate': 0.010760829344729208, 'max_depth': 4, 'min_child_weight': 1, 'subsample': 0.9, 'colsample_bytree': 0.9, 'colsample_bylevel': 0.8, 'reg_alpha': 0.1447579159531293, 'reg_lambda': 0.00027253137950232026, 'gamma': 0.14007146433162615}. Best is trial 35 with value: -0.18163929183600333.
/bsuhome/alexanderemert/Research/Star-Formation-Research-Project-2026/pipeline/scripts/optuna/final_preds_and_models/optuna_search_mult_quant_reg.py:75: UserWarning: The distribution is specified by [0.1, 5] and step=0.25, but the range is not divisible by `step`. It will be replaced with [0.1, 4.85].
  error_threshold = trial.suggest_float("error_threshold", 0.1, 5, step=0.25)
