[I 2026-07-20 12:24:16,394] Trial 43 finished with value: -0.21530490461342314 and parameters: {'error_threshold': 3.75, 'scalers': 'robust', 'ratios': 'log_ratio', 'imputers': 'median', 'n_estimators': 2750, 'learning_rate': 0.0005559960931649656, 'max_depth': 5, 'min_child_weight': 8, 'subsample': 0.5, 'colsample_bytree': 0.7, 'colsample_bylevel': 0.8, 'reg_alpha': 7.654312074826912, 'reg_lambda': 0.0004742855468327363, 'gamma': 0.10243428099473605}. Best is trial 24 with value: -0.39109814374671975.
[I 2026-07-20 12:24:17,724] Trial 44 finished with value: -0.25459859966254794 and parameters: {'error_threshold': 3.75, 'scalers': 'standard', 'ratios': 'log_ratio', 'imputers': 'median', 'n_estimators': 1950, 'learning_rate': 0.0005701617151232437, 'max_depth': 5, 'min_child_weight': 3, 'subsample': 0.5, 'colsample_bytree': 0.7, 'colsample_bylevel': 0.8, 'reg_alpha': 13.590785261885705, 'reg_lambda': 0.00037978665526690466, 'gamma': 0.14056776176966826}. Best is trial 24 with value: -0.39109814374671975.
[I 2026-07-20 12:24:19,085] Trial 45 finished with value: -0.24147485210439135 and parameters: {'error_threshold': 3.75, 'scalers': 'standard', 'ratios': 'log_ratio', 'imputers': 'median', 'n_estimators': 2750, 'learning_rate': 0.00065483726200191, 'max_depth': 5, 'min_child_weight': 3, 'subsample': 0.5, 'colsample_bytree': 0.7, 'colsample_bylevel': 0.8, 'reg_alpha': 17.952835528539435, 'reg_lambda': 0.0003594276508671302, 'gamma': 1.5991888604211402}. Best is trial 24 with value: -0.39109814374671975.
[I 2026-07-20 12:24:37,173] Trial 46 finished with value: -0.27634308938099933 and parameters: {'error_threshold': 2.0, 'scalers': 'standard', 'ratios': 'log_ratio', 'imputers': 'mean', 'n_estimators': 1950, 'learning_rate': 0.0005760835911178869, 'max_depth': 9, 'min_child_weight': 3, 'subsample': 0.5, 'colsample_bytree': 0.5, 'colsample_bylevel': 0.8, 'reg_alpha': 19.294922154141954, 'reg_lambda': 0.00024075685859560798, 'gamma': 0.08115543541149524}. Best is trial 24 with value: -0.39109814374671975.
[I 2026-07-20 12:24:43,131] Trial 48 finished with value: -0.39083834919256333 and parameters: {'error_threshold': 2.0, 'scalers': 'standard', 'ratios': 'log_ratio', 'imputers': 'median', 'n_estimators': 2050, 'learning_rate': 0.00020205263018018146, 'max_depth': 7, 'min_child_weight': 3, 'subsample': 0.5, 'colsample_bytree': 0.7, 'colsample_bylevel': 0.8, 'reg_alpha': 0.018250765079056683, 'reg_lambda': 0.000141235656311883, 'gamma': 94.88084863980589}. Best is trial 24 with value: -0.39109814374671975.
[I 2026-07-20 12:24:44,228] Trial 49 finished with value: -0.3665867808768553 and parameters: {'error_threshold': 2.0, 'scalers': 'standard', 'ratios': 'log_ratio', 'imputers': 'mean', 'n_estimators': 2000, 'learning_rate': 0.00018636233231624129, 'max_depth': 7, 'min_child_weight': 3, 'subsample': 0.7, 'colsample_bytree': 0.7, 'colsample_bylevel': 0.8, 'reg_alpha': 0.020580259811963496, 'reg_lambda': 0.009515347472193411, 'gamma': 89.6178535945815}. Best is trial 24 with value: -0.39109814374671975.
[I 2026-07-20 12:24:48,690] Trial 47 finished with value: -0.22551222018645647 and parameters: {'error_threshold': 4.5, 'scalers': 'standard', 'ratios': 'log_ratio', 'imputers': 'mean', 'n_estimators': 1950, 'learning_rate': 0.0006133732319998285, 'max_depth': 9, 'min_child_weight': 3, 'subsample': 0.5, 'colsample_bytree': 0.7, 'colsample_bylevel': 0.8, 'reg_alpha': 0.017531993860085436, 'reg_lambda': 0.007597336539217954, 'gamma': 0.1229973435748718}. Best is trial 24 with value: -0.39109814374671975.
[I 2026-07-20 12:24:55,159] Trial 50 finished with value: -0.38999208892758014 and parameters: {'error_threshold': 2.0, 'scalers': 'standard', 'ratios': 'log_ratio', 'imputers': 'mean', 'n_estimators': 2150, 'learning_rate': 0.00019416620861866616, 'max_depth': 7, 'min_child_weight': 1, 'subsample': 0.7, 'colsample_bytree': 0.7, 'colsample_bylevel': 1.0, 'reg_alpha': 18.9947316410192, 'reg_lambda': 95.29347690601602, 'gamma': 91.97042341245134}. Best is trial 24 with value: -0.39109814374671975.
[I 2026-07-20 12:25:02,876] Trial 51 finished with value: -0.3460843624658813 and parameters: {'error_threshold': 2.0, 'scalers': 'standard', 'ratios': 'log_ratio', 'imputers': 'mean', 'n_estimators': 2000, 'learning_rate': 0.00020360688605641016, 'max_depth': 7, 'min_child_weight': 3, 'subsample': 0.8, 'colsample_bytree': 0.5, 'colsample_bylevel': 1.0, 'reg_alpha': 19.672618015926055, 'reg_lambda': 5.097496688442291e-06, 'gamma': 14.115285153951662}. Best is trial 24 with value: -0.39109814374671975.
[I 2026-07-20 12:25:04,108] Trial 52 finished with value: -0.3721946933752755 and parameters: {'error_threshold': 2.0, 'scalers': 'standard', 'ratios': 'norm_ratio', 'imputers': 'mean', 'n_estimators': 2200, 'learning_rate': 0.00018251712739912734, 'max_depth': 7, 'min_child_weight': 1, 'subsample': 0.7, 'colsample_bytree': 0.5, 'colsample_bylevel': 1.0, 'reg_alpha': 0.0169865048942975, 'reg_lambda': 0.0022505861325282056, 'gamma': 97.60280230772358}. Best is trial 24 with value: -0.39109814374671975.
[I 2026-07-20 12:25:05,277] Trial 53 finished with value: -0.3668129685491281 and parameters: {'error_threshold': 2.25, 'scalers': 'robust', 'ratios': 'norm_ratio', 'imputers': 'mean', 'n_estimators': 2100, 'learning_rate': 0.0002037852796762079, 'max_depth': 7, 'min_child_weight': 1, 'subsample': 0.7, 'colsample_bytree': 0.5, 'colsample_bylevel': 1.0, 'reg_alpha': 0.024279104866114454, 'reg_lambda': 0.00657734494786359, 'gamma': 93.06026875179339}. Best is trial 24 with value: -0.39109814374671975.
[I 2026-07-20 12:25:11,577] Trial 54 finished with value: -0.34211708372664446 and parameters: {'error_threshold': 2.75, 'scalers': 'robust', 'ratios': 'norm_ratio', 'imputers': 'none', 'n_estimators': 2150, 'learning_rate': 0.00021499536402808296, 'max_depth': 7, 'min_child_weight': 7, 'subsample': 0.7, 'colsample_bytree': 0.5, 'colsample_bylevel': 1.0, 'reg_alpha': 0.019780968435102804, 'reg_lambda': 91.19770859008341, 'gamma': 15.023563382087765}. Best is trial 24 with value: -0.39109814374671975.
[I 2026-07-20 12:25:24,033] Trial 55 finished with value: -0.32286232185135655 and parameters: {'error_threshold': 1.0, 'scalers': 'standard', 'ratios': 'norm_ratio', 'imputers': 'none', 'n_estimators': 2150, 'learning_rate': 0.00020306614352281411, 'max_depth': 7, 'min_child_weight': 1, 'subsample': 0.7, 'colsample_bytree': 0.8, 'colsample_bylevel': 1.0, 'reg_alpha': 0.013492511561587626, 'reg_lambda': 0.008211752293627547, 'gamma': 12.755553851370125}. Best is trial 24 with value: -0.39109814374671975.
[I 2026-07-20 12:25:26,520] Trial 56 finished with value: -0.3211718960136451 and parameters: {'error_threshold': 1.0, 'scalers': 'standard', 'ratios': 'norm_ratio', 'imputers': 'none', 'n_estimators': 2200, 'learning_rate': 0.00020410935465880754, 'max_depth': 7, 'min_child_weight': 1, 'subsample': 0.7, 'colsample_bytree': 0.8, 'colsample_bylevel': 1.0, 'reg_alpha': 0.0006735857286461562, 'reg_lambda': 0.003028019748631738, 'gamma': 12.577115263819246}. Best is trial 24 with value: -0.39109814374671975.
[I 2026-07-20 12:25:27,829] Trial 57 finished with value: -0.18556891303267253 and parameters: {'error_threshold': 1.25, 'scalers': 'standard', 'ratios': 'norm_ratio', 'imputers': 'none', 'n_estimators': 2150, 'learning_rate': 0.004125796882139083, 'max_depth': 7, 'min_child_weight': 1, 'subsample': 0.7, 'colsample_bytree': 0.8, 'colsample_bylevel': 1.0, 'reg_alpha': 0.0007148861590664796, 'reg_lambda': 4.02802356731702e-06, 'gamma': 13.020847850794231}. Best is trial 24 with value: -0.39109814374671975.
[I 2026-07-20 12:25:32,766] Trial 58 finished with value: -0.3346894943279643 and parameters: {'error_threshold': 1.25, 'scalers': 'standard', 'ratios': 'norm_ratio', 'imputers': 'mean', 'n_estimators': 2200, 'learning_rate': 0.0002011996754891117, 'max_depth': 7, 'min_child_weight': 1, 'subsample': 0.7, 'colsample_bytree': 0.8, 'colsample_bylevel': 1.0, 'reg_alpha': 44.416965760018336, 'reg_lambda': 17.377596946337114, 'gamma': 14.753291832406916}. Best is trial 24 with value: -0.39109814374671975.
[I 2026-07-20 12:25:35,268] Trial 60 finished with value: -0.280517932035485 and parameters: {'error_threshold': 1.25, 'scalers': 'standard', 'ratios': 'norm_ratio', 'imputers': 'none', 'n_estimators': 300, 'learning_rate': 0.009905655859113755, 'max_depth': 8, 'min_child_weight': 1, 'subsample': 0.8, 'colsample_bytree': 0.8, 'colsample_bylevel': 1.0, 'reg_alpha': 51.75420315341028, 'reg_lambda': 91.70447702151365, 'gamma': 32.14159978339536}. Best is trial 24 with value: -0.39109814374671975.
[I 2026-07-20 12:25:38,762] Trial 61 finished with value: -0.3079953977553928 and parameters: {'error_threshold': 1.25, 'scalers': 'standard', 'ratios': 'norm_ratio', 'imputers': 'mean', 'n_estimators': 1750, 'learning_rate': 0.006980923811905174, 'max_depth': 8, 'min_child_weight': 7, 'subsample': 0.5, 'colsample_bytree': 0.8, 'colsample_bylevel': 1.0, 'reg_alpha': 48.046197080161505, 'reg_lambda': 26.79677246892818, 'gamma': 27.36144647817471}. Best is trial 24 with value: -0.39109814374671975.
[I 2026-07-20 12:25:40,061] Trial 59 finished with value: -0.3406603464050702 and parameters: {'error_threshold': 1.0, 'scalers': 'standard', 'ratios': 'norm_ratio', 'imputers': 'none', 'n_estimators': 2150, 'learning_rate': 0.00018963373161855716, 'max_depth': 8, 'min_child_weight': 1, 'subsample': 0.8, 'colsample_bytree': 0.8, 'colsample_bylevel': 1.0, 'reg_alpha': 48.843992317530976, 'reg_lambda': 96.41206512811101, 'gamma': 26.571918452960297}. Best is trial 24 with value: -0.39109814374671975.
[I 2026-07-20 12:25:44,295] Trial 62 finished with value: -0.3167604425244406 and parameters: {'error_threshold': 3.0, 'scalers': 'standard', 'ratios': 'log_ratio', 'imputers': 'none', 'n_estimators': 1750, 'learning_rate': 0.007290866369109729, 'max_depth': 8, 'min_child_weight': 2, 'subsample': 0.8, 'colsample_bytree': 0.8, 'colsample_bylevel': 1.0, 'reg_alpha': 98.30612141843869, 'reg_lambda': 0.028024790382503238, 'gamma': 29.58091066250851}. Best is trial 24 with value: -0.39109814374671975.
[I 2026-07-20 12:25:51,476] Trial 63 finished with value: -0.27073993640473426 and parameters: {'error_threshold': 1.25, 'scalers': 'none', 'ratios': 'log_ratio', 'imputers': 'mean', 'n_estimators': 1800, 'learning_rate': 0.0043422795860179235, 'max_depth': 8, 'min_child_weight': 2, 'subsample': 0.8, 'colsample_bytree': 0.8, 'colsample_bylevel': 1.0, 'reg_alpha': 60.84931511237326, 'reg_lambda': 0.07448504553206069, 'gamma': 27.46209151103099}. Best is trial 24 with value: -0.39109814374671975.
[I 2026-07-20 12:25:57,762] Trial 64 finished with value: -0.30446998933782315 and parameters: {'error_threshold': 3.0, 'scalers': 'none', 'ratios': 'log_ratio', 'imputers': 'mean', 'n_estimators': 2850, 'learning_rate': 0.15248192762152263, 'max_depth': 8, 'min_child_weight': 2, 'subsample': 0.8, 'colsample_bytree': 0.7, 'colsample_bylevel': 0.7, 'reg_alpha': 99.10794621589177, 'reg_lambda': 0.035544224568226854, 'gamma': 31.76305251469276}. Best is trial 24 with value: -0.39109814374671975.
[I 2026-07-20 12:25:58,734] Trial 65 finished with value: -0.26246993842193145 and parameters: {'error_threshold': 3.0, 'scalers': 'none', 'ratios': 'log_ratio', 'imputers': 'mean', 'n_estimators': 1550, 'learning_rate': 0.1803561151007136, 'max_depth': 8, 'min_child_weight': 2, 'subsample': 0.8, 'colsample_bytree': 0.7, 'colsample_bylevel': 0.7, 'reg_alpha': 59.00509480025884, 'reg_lambda': 0.0767984598573641, 'gamma': 31.342246948594298}. Best is trial 24 with value: -0.39109814374671975.
[I 2026-07-20 12:26:04,063] Trial 66 finished with value: -0.2389003864365237 and parameters: {'error_threshold': 3.0, 'scalers': 'none', 'ratios': 'log_ratio', 'imputers': 'median', 'n_estimators': 2850, 'learning_rate': 0.0010306491320900351, 'max_depth': 8, 'min_child_weight': 2, 'subsample': 0.8, 'colsample_bytree': 0.7, 'colsample_bylevel': 0.7, 'reg_alpha': 0.003002381444768232, 'reg_lambda': 0.06563781608757856, 'gamma': 32.090269227957876}. Best is trial 24 with value: -0.39109814374671975.
[I 2026-07-20 12:26:05,098] Trial 67 finished with value: -0.29683832586336667 and parameters: {'error_threshold': 3.0, 'scalers': 'none', 'ratios': 'log_ratio', 'imputers': 'median', 'n_estimators': 1700, 'learning_rate': 0.17713740690176757, 'max_depth': 8, 'min_child_weight': 2, 'subsample': 0.8, 'colsample_bytree': 0.7, 'colsample_bylevel': 0.7, 'reg_alpha': 85.97487851531106, 'reg_lambda': 0.09886209758980548, 'gamma': 34.99404775057838}. Best is trial 24 with value: -0.39109814374671975.
[I 2026-07-20 12:26:08,569] Trial 68 finished with value: -0.2814579362189704 and parameters: {'error_threshold': 3.0, 'scalers': 'none', 'ratios': 'log_ratio', 'imputers': 'median', 'n_estimators': 1550, 'learning_rate': 0.0009596708573900617, 'max_depth': 6, 'min_child_weight': 10, 'subsample': 0.8, 'colsample_bytree': 0.7, 'colsample_bylevel': 0.7, 'reg_alpha': 0.0028650314126713334, 'reg_lambda': 0.027111222002366278, 'gamma': 41.04820602115673}. Best is trial 24 with value: -0.39109814374671975.
[I 2026-07-20 12:26:09,750] Trial 69 finished with value: -0.3911874830873789 and parameters: {'error_threshold': 3.0, 'scalers': 'none', 'ratios': 'log_ratio', 'imputers': 'median', 'n_estimators': 2350, 'learning_rate': 0.30956397292667087, 'max_depth': 6, 'min_child_weight': 10, 'subsample': 0.5, 'colsample_bytree': 0.7, 'colsample_bylevel': 0.7, 'reg_alpha': 95.47648658145285, 'reg_lambda': 0.0689769843172634, 'gamma': 43.70427526645376}. Best is trial 69 with value: -0.3911874830873789.
[I 2026-07-20 12:26:10,604] Trial 70 finished with value: -0.2508243084364255 and parameters: {'error_threshold': 2.75, 'scalers': 'none', 'ratios': 'log_ratio', 'imputers': 'median', 'n_estimators': 1550, 'learning_rate': 0.18877607021768525, 'max_depth': 6, 'min_child_weight': 10, 'subsample': 0.5, 'colsample_bytree': 0.7, 'colsample_bylevel': 0.7, 'reg_alpha': 0.002731685899882041, 'reg_lambda': 0.1614247467094713, 'gamma': 51.367395599156865}. Best is trial 69 with value: -0.3911874830873789.
[I 2026-07-20 12:26:11,757] Trial 71 finished with value: -0.2611901037145404 and parameters: {'error_threshold': 2.75, 'scalers': 'none', 'ratios': 'log_ratio', 'imputers': 'median', 'n_estimators': 100, 'learning_rate': 0.10947854422715618, 'max_depth': 6, 'min_child_weight': 10, 'subsample': 0.5, 'colsample_bytree': 0.7, 'colsample_bylevel': 0.7, 'reg_alpha': 0.10151652644301988, 'reg_lambda': 4.4911843444948105e-05, 'gamma': 50.369262875620784}. Best is trial 69 with value: -0.3911874830873789.
[I 2026-07-20 12:26:24,755] Trial 72 finished with value: -0.27436268497196004 and parameters: {'error_threshold': 2.75, 'scalers': 'robust', 'ratios': 'log_ratio', 'imputers': 'median', 'n_estimators': 2400, 'learning_rate': 0.02423406356948661, 'max_depth': 6, 'min_child_weight': 10, 'subsample': 0.5, 'colsample_bytree': 0.5, 'colsample_bylevel': 0.7, 'reg_alpha': 0.0062615428605465396, 'reg_lambda': 6.268495464237452, 'gamma': 55.99993326654938}. Best is trial 69 with value: -0.3911874830873789.
[I 2026-07-20 12:26:26,107] Trial 73 finished with value: -0.36830068986986864 and parameters: {'error_threshold': 2.75, 'scalers': 'robust', 'ratios': 'log_ratio', 'imputers': 'median', 'n_estimators': 2850, 'learning_rate': 0.00011119083492219124, 'max_depth': 6, 'min_child_weight': 10, 'subsample': 0.5, 'colsample_bytree': 0.5, 'colsample_bylevel': 0.9, 'reg_alpha': 0.08507624582524448, 'reg_lambda': 8.465213305417487e-06, 'gamma': 54.76295044888618}. Best is trial 69 with value: -0.3911874830873789.
[I 2026-07-20 12:26:30,245] Trial 74 finished with value: -0.2694337953240556 and parameters: {'error_threshold': 2.75, 'scalers': 'robust', 'ratios': 'log_ratio', 'imputers': 'median', 'n_estimators': 2400, 'learning_rate': 0.02899136173873046, 'max_depth': 6, 'min_child_weight': 10, 'subsample': 0.5, 'colsample_bytree': 0.5, 'colsample_bylevel': 0.9, 'reg_alpha': 6.82059969554063e-05, 'reg_lambda': 7.518796906696874e-06, 'gamma': 55.19329915663273}. Best is trial 69 with value: -0.3911874830873789.
[I 2026-07-20 12:26:32,068] Trial 76 finished with value: -0.38451632284899656 and parameters: {'error_threshold': 1.75, 'scalers': 'robust', 'ratios': 'log_ratio', 'imputers': 'median', 'n_estimators': 550, 'learning_rate': 0.00010522830413218679, 'max_depth': 6, 'min_child_weight': 9, 'subsample': 1.0, 'colsample_bytree': 0.5, 'colsample_bylevel': 0.9, 'reg_alpha': 0.12233114808872958, 'reg_lambda': 4.3165644022356044, 'gamma': 53.310252531609905}. Best is trial 69 with value: -0.3911874830873789.
[I 2026-07-20 12:26:33,165] Trial 75 finished with value: -0.26303500746971464 and parameters: {'error_threshold': 1.75, 'scalers': 'robust', 'ratios': 'log_ratio', 'imputers': 'median', 'n_estimators': 2400, 'learning_rate': 0.3147140224483339, 'max_depth': 6, 'min_child_weight': 10, 'subsample': 0.5, 'colsample_bytree': 0.5, 'colsample_bylevel': 0.9, 'reg_alpha': 0.0945678217066435, 'reg_lambda': 7.2198279812001256e-06, 'gamma': 58.74690881358002}. Best is trial 69 with value: -0.3911874830873789.
[I 2026-07-20 12:26:37,594] Trial 77 finished with value: -0.23285936195545243 and parameters: {'error_threshold': 1.75, 'scalers': 'none', 'ratios': 'log_ratio', 'imputers': 'median', 'n_estimators': 2400, 'learning_rate': 0.3001281083866955, 'max_depth': 6, 'min_child_weight': 10, 'subsample': 1.0, 'colsample_bytree': 0.5, 'colsample_bylevel': 0.5, 'reg_alpha': 6.455704489384394e-05, 'reg_lambda': 4.654746737151478, 'gamma': 59.40117650934573}. Best is trial 69 with value: -0.3911874830873789.
[I 2026-07-20 12:26:39,027] Trial 78 finished with value: -0.2790816344332631 and parameters: {'error_threshold': 2.25, 'scalers': 'robust', 'ratios': 'log_ratio', 'imputers': 'median', 'n_estimators': 2400, 'learning_rate': 0.3180963275204023, 'max_depth': 6, 'min_child_weight': 9, 'subsample': 1.0, 'colsample_bytree': 0.5, 'colsample_bylevel': 0.6, 'reg_alpha': 0.5012475888025788, 'reg_lambda': 8.826899684370355e-06, 'gamma': 96.76442758822212}. Best is trial 69 with value: -0.3911874830873789.
[I 2026-07-20 12:26:42,286] Trial 79 finished with value: -0.26982055768015595 and parameters: {'error_threshold': 2.25, 'scalers': 'robust', 'ratios': 'log_ratio', 'imputers': 'median', 'n_estimators': 2350, 'learning_rate': 0.25764020118165837, 'max_depth': 6, 'min_child_weight': 9, 'subsample': 1.0, 'colsample_bytree': 0.5, 'colsample_bylevel': 0.6, 'reg_alpha': 0.6484405464612124, 'reg_lambda': 5.534171712952697, 'gamma': 93.07877028176162}. Best is trial 69 with value: -0.3911874830873789.
[I 2026-07-20 12:26:53,097] Trial 80 finished with value: -0.30934506327756683 and parameters: {'error_threshold': 2.25, 'scalers': 'robust', 'ratios': 'log_ratio', 'imputers': 'median', 'n_estimators': 2650, 'learning_rate': 0.3808947590330819, 'max_depth': 6, 'min_child_weight': 9, 'subsample': 0.6, 'colsample_bytree': 0.6, 'colsample_bylevel': 0.6, 'reg_alpha': 0.05557702903463207, 'reg_lambda': 8.310682237314827e-06, 'gamma': 94.86059929593279}. Best is trial 69 with value: -0.3911874830873789.
[I 2026-07-20 12:26:54,682] Trial 81 finished with value: -0.17951285218788873 and parameters: {'error_threshold': 2.25, 'scalers': 'robust', 'ratios': 'log_ratio', 'imputers': 'median', 'n_estimators': 2650, 'learning_rate': 0.4596649516460412, 'max_depth': 6, 'min_child_weight': 9, 'subsample': 1.0, 'colsample_bytree': 0.6, 'colsample_bylevel': 0.6, 'reg_alpha': 0.32356550078711943, 'reg_lambda': 1.8278692073883279e-06, 'gamma': 7.690230123543972}. Best is trial 69 with value: -0.3911874830873789.
[I 2026-07-20 12:26:56,711] Trial 83 finished with value: -0.17743567699274632 and parameters: {'error_threshold': 1.75, 'scalers': 'robust', 'ratios': 'log_ratio', 'imputers': 'median', 'n_estimators': 800, 'learning_rate': 0.35770120851772513, 'max_depth': 4, 'min_child_weight': 9, 'subsample': 1.0, 'colsample_bytree': 0.5, 'colsample_bylevel': 0.6, 'reg_alpha': 0.46591790619557355, 'reg_lambda': 2.9548575954249108, 'gamma': 8.456288055253657}. Best is trial 69 with value: -0.3911874830873789.
[I 2026-07-20 12:26:58,874] Trial 84 finished with value: -0.16968031156992958 and parameters: {'error_threshold': 2.25, 'scalers': 'robust', 'ratios': 'log_ratio', 'imputers': 'median', 'n_estimators': 1100, 'learning_rate': 0.2834118804332094, 'max_depth': 4, 'min_child_weight': 9, 'subsample': 1.0, 'colsample_bytree': 0.5, 'colsample_bylevel': 0.6, 'reg_alpha': 0.37455069434601024, 'reg_lambda': 3.972753635459893, 'gamma': 7.7144500318532625}. Best is trial 69 with value: -0.3911874830873789.
[I 2026-07-20 12:27:00,210] Trial 82 finished with value: -0.3018501345953808 and parameters: {'error_threshold': 2.25, 'scalers': 'robust', 'ratios': 'log_ratio', 'imputers': 'median', 'n_estimators': 2600, 'learning_rate': 0.3954589609122512, 'max_depth': 3, 'min_child_weight': 9, 'subsample': 0.6, 'colsample_bytree': 0.6, 'colsample_bylevel': 0.9, 'reg_alpha': 0.3190179802995772, 'reg_lambda': 1.716337648895002e-06, 'gamma': 90.62189982946477}. Best is trial 69 with value: -0.3911874830873789.
[I 2026-07-20 12:27:06,463] Trial 85 finished with value: -0.36353946579315566 and parameters: {'error_threshold': 2.25, 'scalers': 'robust', 'ratios': 'log_ratio', 'imputers': 'median', 'n_estimators': 1150, 'learning_rate': 0.00014912236652902462, 'max_depth': 11, 'min_child_weight': 9, 'subsample': 0.9, 'colsample_bytree': 0.6, 'colsample_bylevel': 0.6, 'reg_alpha': 0.3911349047495182, 'reg_lambda': 0.46851550071841713, 'gamma': 9.324169216101133}. Best is trial 69 with value: -0.3911874830873789.
