[I 2026-07-20 13:41:03,223] Trial 450 finished with value: -0.13718603539960403 and parameters: {'error_threshold': 1.25, 'scalers': 'robust', 'ratios': 'log_ratio', 'imputers': 'median', 'n_estimators': 200, 'learning_rate': 0.00013409512999957562, 'max_depth': 3, 'min_child_weight': 1, 'subsample': 0.5, 'colsample_bytree': 0.5, 'colsample_bylevel': 0.6, 'reg_alpha': 1.9342144896579925e-05, 'reg_lambda': 10.36871141153541, 'gamma': 34.68772344678449}. Best is trial 68 with value: -0.1376473786634981.
[I 2026-07-20 13:41:04,062] Trial 449 finished with value: -0.1359833813524458 and parameters: {'error_threshold': 1.25, 'scalers': 'robust', 'ratios': 'log_ratio', 'imputers': 'median', 'n_estimators': 700, 'learning_rate': 0.00013800258685121695, 'max_depth': 3, 'min_child_weight': 1, 'subsample': 0.5, 'colsample_bytree': 0.5, 'colsample_bylevel': 0.6, 'reg_alpha': 2.0510137454692832e-05, 'reg_lambda': 10.081708266589802, 'gamma': 31.47325094336671}. Best is trial 68 with value: -0.1376473786634981.
[I 2026-07-20 13:41:04,355] Trial 451 finished with value: -0.09183191251952166 and parameters: {'error_threshold': 1.25, 'scalers': 'none', 'ratios': 'log_ratio', 'imputers': 'mean', 'n_estimators': 200, 'learning_rate': 0.2569827474923145, 'max_depth': 3, 'min_child_weight': 1, 'subsample': 0.5, 'colsample_bytree': 0.5, 'colsample_bylevel': 0.6, 'reg_alpha': 5.115376385729691, 'reg_lambda': 1.756359658930884, 'gamma': 28.897736538827232}. Best is trial 68 with value: -0.1376473786634981.
[I 2026-07-20 13:41:04,985] Trial 453 finished with value: -0.13734005637848004 and parameters: {'error_threshold': 1.25, 'scalers': 'none', 'ratios': 'log_ratio', 'imputers': 'mean', 'n_estimators': 200, 'learning_rate': 0.00011581339400771083, 'max_depth': 3, 'min_child_weight': 1, 'subsample': 0.5, 'colsample_bytree': 0.5, 'colsample_bylevel': 0.5, 'reg_alpha': 2.102755307276799e-05, 'reg_lambda': 11.626671226916468, 'gamma': 28.313629205334937}. Best is trial 68 with value: -0.1376473786634981.
[I 2026-07-20 13:41:05,318] Trial 452 finished with value: -0.1360506906868325 and parameters: {'error_threshold': 1.25, 'scalers': 'robust', 'ratios': 'log_ratio', 'imputers': 'mean', 'n_estimators': 700, 'learning_rate': 0.0001323116595568503, 'max_depth': 3, 'min_child_weight': 1, 'subsample': 0.5, 'colsample_bytree': 0.5, 'colsample_bylevel': 0.6, 'reg_alpha': 2.1968319591337414e-05, 'reg_lambda': 12.016328741228914, 'gamma': 29.84938841962833}. Best is trial 68 with value: -0.1376473786634981.
[I 2026-07-20 13:41:05,553] Trial 454 finished with value: -0.13734057144954107 and parameters: {'error_threshold': 1.25, 'scalers': 'none', 'ratios': 'log_ratio', 'imputers': 'mean', 'n_estimators': 200, 'learning_rate': 0.000115617891638774, 'max_depth': 3, 'min_child_weight': 1, 'subsample': 0.5, 'colsample_bytree': 0.5, 'colsample_bylevel': 0.5, 'reg_alpha': 6.162099011309545e-06, 'reg_lambda': 2.0808534453137617, 'gamma': 30.49207067445336}. Best is trial 68 with value: -0.1376473786634981.
[I 2026-07-20 13:41:05,756] Trial 455 finished with value: -0.09418320006100811 and parameters: {'error_threshold': 1.25, 'scalers': 'none', 'ratios': 'log_ratio', 'imputers': 'mean', 'n_estimators': 200, 'learning_rate': 0.041950000475235213, 'max_depth': 3, 'min_child_weight': 1, 'subsample': 0.5, 'colsample_bytree': 0.5, 'colsample_bylevel': 0.6, 'reg_alpha': 3.952096688244872e-06, 'reg_lambda': 2.015369063946083, 'gamma': 34.38206192246906}. Best is trial 68 with value: -0.1376473786634981.
[I 2026-07-20 13:41:06,640] Trial 457 finished with value: -0.13744333670682418 and parameters: {'error_threshold': 2.0, 'scalers': 'none', 'ratios': 'log_ratio', 'imputers': 'mean', 'n_estimators': 100, 'learning_rate': 0.00011228191012374342, 'max_depth': 3, 'min_child_weight': 1, 'subsample': 0.5, 'colsample_bytree': 0.5, 'colsample_bylevel': 0.6, 'reg_alpha': 6.026011064406098e-06, 'reg_lambda': 2.4231356783826117, 'gamma': 68.11526412760692}. Best is trial 68 with value: -0.1376473786634981.
[I 2026-07-20 13:41:07,637] Trial 458 finished with value: -0.13749286415385134 and parameters: {'error_threshold': 2.0, 'scalers': 'none', 'ratios': 'log_ratio', 'imputers': 'mean', 'n_estimators': 100, 'learning_rate': 0.00010202608362861464, 'max_depth': 7, 'min_child_weight': 1, 'subsample': 0.5, 'colsample_bytree': 0.5, 'colsample_bylevel': 0.5, 'reg_alpha': 19.20717081166317, 'reg_lambda': 1.8460123440823106, 'gamma': 66.17176640222966}. Best is trial 68 with value: -0.1376473786634981.
[I 2026-07-20 13:41:07,800] Trial 459 finished with value: -0.1373619084678202 and parameters: {'error_threshold': 2.0, 'scalers': 'robust', 'ratios': 'log_ratio', 'imputers': 'mean', 'n_estimators': 100, 'learning_rate': 0.00011844386297951377, 'max_depth': 7, 'min_child_weight': 1, 'subsample': 0.5, 'colsample_bytree': 0.5, 'colsample_bylevel': 0.9, 'reg_alpha': 4.4298872619832196e-05, 'reg_lambda': 2.0280834348898273, 'gamma': 68.45076143733603}. Best is trial 68 with value: -0.1376473786634981.
[I 2026-07-20 13:41:08,136] Trial 456 finished with value: -0.1362482690897759 and parameters: {'error_threshold': 1.25, 'scalers': 'robust', 'ratios': 'log_ratio', 'imputers': 'mean', 'n_estimators': 700, 'learning_rate': 0.00011563589721567601, 'max_depth': 3, 'min_child_weight': 1, 'subsample': 0.5, 'colsample_bytree': 0.5, 'colsample_bylevel': 0.6, 'reg_alpha': 5.18180929537333e-05, 'reg_lambda': 2.161671965378081, 'gamma': 32.83178552510574}. Best is trial 68 with value: -0.1376473786634981.
[I 2026-07-20 13:41:08,435] Trial 461 finished with value: -0.11300886974868934 and parameters: {'error_threshold': 1.0, 'scalers': 'robust', 'ratios': 'norm_ratio', 'imputers': 'mean', 'n_estimators': 100, 'learning_rate': 0.015165095332313779, 'max_depth': 4, 'min_child_weight': 1, 'subsample': 0.5, 'colsample_bytree': 0.5, 'colsample_bylevel': 0.9, 'reg_alpha': 3.7052957406448785e-06, 'reg_lambda': 2.1399507954998658, 'gamma': 67.74217010691157}. Best is trial 68 with value: -0.1376473786634981.
[I 2026-07-20 13:41:08,721] Trial 462 finished with value: -0.13734794704166745 and parameters: {'error_threshold': 1.0, 'scalers': 'robust', 'ratios': 'log_ratio', 'imputers': 'mean', 'n_estimators': 100, 'learning_rate': 0.00010270338603769478, 'max_depth': 3, 'min_child_weight': 1, 'subsample': 0.5, 'colsample_bytree': 0.5, 'colsample_bylevel': 0.9, 'reg_alpha': 5.62092238756304e-05, 'reg_lambda': 2.5666838875765836, 'gamma': 15.913779765379465}. Best is trial 68 with value: -0.1376473786634981.
[I 2026-07-20 13:41:08,813] Trial 463 finished with value: -0.13746217889407533 and parameters: {'error_threshold': 2.0, 'scalers': 'robust', 'ratios': 'norm_ratio', 'imputers': 'mean', 'n_estimators': 100, 'learning_rate': 0.00010188505694417933, 'max_depth': 3, 'min_child_weight': 1, 'subsample': 0.5, 'colsample_bytree': 0.5, 'colsample_bylevel': 0.6, 'reg_alpha': 5.048459270475075e-05, 'reg_lambda': 0.507997576092811, 'gamma': 67.92249953134433}. Best is trial 68 with value: -0.1376473786634981.
[I 2026-07-20 13:41:10,652] Trial 464 finished with value: -0.13746429453932899 and parameters: {'error_threshold': 2.0, 'scalers': 'none', 'ratios': 'norm_ratio', 'imputers': 'mean', 'n_estimators': 100, 'learning_rate': 0.00010071292190713252, 'max_depth': 3, 'min_child_weight': 1, 'subsample': 0.5, 'colsample_bytree': 0.5, 'colsample_bylevel': 0.6, 'reg_alpha': 2.9510900711225196e-06, 'reg_lambda': 0.5272813253446016, 'gamma': 63.11510742281659}. Best is trial 68 with value: -0.1376473786634981.
[I 2026-07-20 13:41:11,001] Trial 465 finished with value: -0.13756181950829496 and parameters: {'error_threshold': 2.0, 'scalers': 'none', 'ratios': 'norm_ratio', 'imputers': 'mean', 'n_estimators': 100, 'learning_rate': 0.0001009963412032511, 'max_depth': 4, 'min_child_weight': 1, 'subsample': 0.5, 'colsample_bytree': 0.5, 'colsample_bylevel': 0.5, 'reg_alpha': 86.13241364888552, 'reg_lambda': 0.5349689596187782, 'gamma': 68.46788773625492}. Best is trial 68 with value: -0.1376473786634981.
[I 2026-07-20 13:41:11,009] Trial 466 finished with value: -0.137219670499561 and parameters: {'error_threshold': 2.0, 'scalers': 'none', 'ratios': 'norm_ratio', 'imputers': 'mean', 'n_estimators': 100, 'learning_rate': 0.00010392340529622093, 'max_depth': 9, 'min_child_weight': 1, 'subsample': 0.5, 'colsample_bytree': 0.5, 'colsample_bylevel': 0.7, 'reg_alpha': 21.137553835418956, 'reg_lambda': 1.6941491929529298, 'gamma': 1.820110063712342e-06}. Best is trial 68 with value: -0.1376473786634981.
[I 2026-07-20 13:41:12,182] Trial 467 finished with value: -0.1374935280175995 and parameters: {'error_threshold': 2.0, 'scalers': 'none', 'ratios': 'norm_ratio', 'imputers': 'mean', 'n_estimators': 100, 'learning_rate': 0.00010191865068398508, 'max_depth': 8, 'min_child_weight': 1, 'subsample': 1.0, 'colsample_bytree': 0.5, 'colsample_bylevel': 0.5, 'reg_alpha': 83.14994968732871, 'reg_lambda': 1.5503382223480355, 'gamma': 74.87001547005225}. Best is trial 68 with value: -0.1376473786634981.
[I 2026-07-20 13:41:12,375] Trial 468 finished with value: -0.13683677675065795 and parameters: {'error_threshold': 2.0, 'scalers': 'none', 'ratios': 'log_ratio', 'imputers': 'mean', 'n_estimators': 350, 'learning_rate': 0.0001026380663642771, 'max_depth': 7, 'min_child_weight': 1, 'subsample': 0.5, 'colsample_bytree': 0.5, 'colsample_bylevel': 0.5, 'reg_alpha': 6.552813478847694e-06, 'reg_lambda': 1.5317642786850179, 'gamma': 4.137522896095865}. Best is trial 68 with value: -0.1376473786634981.
[I 2026-07-20 13:41:13,193] Trial 460 finished with value: -0.13423148737926413 and parameters: {'error_threshold': 1.0, 'scalers': 'robust', 'ratios': 'log_ratio', 'imputers': 'mean', 'n_estimators': 1850, 'learning_rate': 0.00011424555862086203, 'max_depth': 3, 'min_child_weight': 1, 'subsample': 0.5, 'colsample_bytree': 0.5, 'colsample_bylevel': 0.6, 'reg_alpha': 14.074329560214665, 'reg_lambda': 2.0051511198756047, 'gamma': 69.30039369242495}. Best is trial 68 with value: -0.1376473786634981.
[I 2026-07-20 13:41:13,689] Trial 469 finished with value: -0.13749482368665372 and parameters: {'error_threshold': 2.0, 'scalers': 'robust', 'ratios': 'log_ratio', 'imputers': 'mean', 'n_estimators': 100, 'learning_rate': 0.00010072166734277962, 'max_depth': 4, 'min_child_weight': 1, 'subsample': 0.5, 'colsample_bytree': 0.5, 'colsample_bylevel': 0.5, 'reg_alpha': 6.321514582861245e-06, 'reg_lambda': 0.4916393182714421, 'gamma': 69.4032069797119}. Best is trial 68 with value: -0.1376473786634981.
[I 2026-07-20 13:41:16,596] Trial 472 finished with value: -0.13764739925059793 and parameters: {'error_threshold': 2.0, 'scalers': 'none', 'ratios': 'norm_ratio', 'imputers': 'mean', 'n_estimators': 150, 'learning_rate': 0.00010306832105965196, 'max_depth': 7, 'min_child_weight': 9, 'subsample': 0.5, 'colsample_bytree': 0.5, 'colsample_bylevel': 0.5, 'reg_alpha': 94.55316508369437, 'reg_lambda': 0.34717767213788653, 'gamma': 98.0576378053014}. Best is trial 472 with value: -0.13764739925059793.
[I 2026-07-20 13:41:17,525] Trial 470 finished with value: -0.13466678523436826 and parameters: {'error_threshold': 2.25, 'scalers': 'none', 'ratios': 'norm_ratio', 'imputers': 'mean', 'n_estimators': 1950, 'learning_rate': 0.00010389041037766601, 'max_depth': 4, 'min_child_weight': 9, 'subsample': 0.5, 'colsample_bytree': 0.5, 'colsample_bylevel': 0.5, 'reg_alpha': 81.16188326594214, 'reg_lambda': 0.8847323982152657, 'gamma': 2.4640409320476744}. Best is trial 472 with value: -0.13764739925059793.
[I 2026-07-20 13:41:17,673] Trial 473 finished with value: -0.1376402441635169 and parameters: {'error_threshold': 2.0, 'scalers': 'none', 'ratios': 'norm_ratio', 'imputers': 'mean', 'n_estimators': 150, 'learning_rate': 0.00010128798606162475, 'max_depth': 4, 'min_child_weight': 1, 'subsample': 0.5, 'colsample_bytree': 0.5, 'colsample_bylevel': 0.5, 'reg_alpha': 93.34146290235736, 'reg_lambda': 0.24138922549014652, 'gamma': 74.00417758658105}. Best is trial 472 with value: -0.13764739925059793.
[I 2026-07-20 13:41:17,867] Trial 471 finished with value: -0.13697050489896626 and parameters: {'error_threshold': 2.0, 'scalers': 'none', 'ratios': 'norm_ratio', 'imputers': 'mean', 'n_estimators': 350, 'learning_rate': 0.00010844996460552914, 'max_depth': 4, 'min_child_weight': 1, 'subsample': 0.5, 'colsample_bytree': 0.5, 'colsample_bylevel': 0.7, 'reg_alpha': 1.9839936872209384e-06, 'reg_lambda': 0.43525875062469976, 'gamma': 99.52326608643959}. Best is trial 472 with value: -0.13764739925059793.
[I 2026-07-20 13:41:17,979] Trial 474 finished with value: -0.1374574498783675 and parameters: {'error_threshold': 2.25, 'scalers': 'none', 'ratios': 'norm_ratio', 'imputers': 'mean', 'n_estimators': 150, 'learning_rate': 0.0001015327381744892, 'max_depth': 8, 'min_child_weight': 1, 'subsample': 1.0, 'colsample_bytree': 0.5, 'colsample_bylevel': 0.5, 'reg_alpha': 86.05223480063627, 'reg_lambda': 0.26627269674494836, 'gamma': 98.85202595642689}. Best is trial 472 with value: -0.13764739925059793.
[I 2026-07-20 13:41:18,183] Trial 476 finished with value: -0.13745704686474763 and parameters: {'error_threshold': 2.25, 'scalers': 'none', 'ratios': 'norm_ratio', 'imputers': 'mean', 'n_estimators': 150, 'learning_rate': 0.00010148223378521706, 'max_depth': 7, 'min_child_weight': 1, 'subsample': 0.5, 'colsample_bytree': 0.5, 'colsample_bylevel': 0.5, 'reg_alpha': 42.34325747936969, 'reg_lambda': 0.3291172737002489, 'gamma': 98.45527141818039}. Best is trial 472 with value: -0.13764739925059793.
[I 2026-07-20 13:41:19,699] Trial 477 finished with value: -0.13745273072772482 and parameters: {'error_threshold': 2.25, 'scalers': 'none', 'ratios': 'norm_ratio', 'imputers': 'mean', 'n_estimators': 150, 'learning_rate': 0.0001040623411528508, 'max_depth': 4, 'min_child_weight': 2, 'subsample': 1.0, 'colsample_bytree': 0.5, 'colsample_bylevel': 0.5, 'reg_alpha': 67.41199898619745, 'reg_lambda': 0.2271064201331939, 'gamma': 94.02520004813663}. Best is trial 472 with value: -0.13764739925059793.
[I 2026-07-20 13:41:21,495] Trial 475 finished with value: -0.13587556213908547 and parameters: {'error_threshold': 2.25, 'scalers': 'none', 'ratios': 'norm_ratio', 'imputers': 'mean', 'n_estimators': 1200, 'learning_rate': 0.00010210537823429332, 'max_depth': 8, 'min_child_weight': 1, 'subsample': 1.0, 'colsample_bytree': 0.5, 'colsample_bylevel': 0.5, 'reg_alpha': 98.83046330667793, 'reg_lambda': 0.33017511084518375, 'gamma': 74.68575208098224}. Best is trial 472 with value: -0.13764739925059793.
[I 2026-07-20 13:41:22,278] Trial 478 finished with value: -0.13745994813730136 and parameters: {'error_threshold': 2.25, 'scalers': 'none', 'ratios': 'norm_ratio', 'imputers': 'mean', 'n_estimators': 150, 'learning_rate': 0.00010015516679841143, 'max_depth': 8, 'min_child_weight': 2, 'subsample': 0.9, 'colsample_bytree': 0.5, 'colsample_bylevel': 0.5, 'reg_alpha': 80.97019799845489, 'reg_lambda': 0.2524988592573035, 'gamma': 97.82930023883917}. Best is trial 472 with value: -0.13764739925059793.
[I 2026-07-20 13:41:22,419] Trial 479 finished with value: -0.13745716639679165 and parameters: {'error_threshold': 2.25, 'scalers': 'none', 'ratios': 'norm_ratio', 'imputers': 'mean', 'n_estimators': 150, 'learning_rate': 0.00010166401967916439, 'max_depth': 8, 'min_child_weight': 8, 'subsample': 0.9, 'colsample_bytree': 0.5, 'colsample_bylevel': 0.5, 'reg_alpha': 67.82873410246374, 'reg_lambda': 0.21436943571838568, 'gamma': 93.56326369575004}. Best is trial 472 with value: -0.13764739925059793.
[I 2026-07-20 13:41:22,622] Trial 480 finished with value: -0.13717233242819765 and parameters: {'error_threshold': 2.25, 'scalers': 'none', 'ratios': 'norm_ratio', 'imputers': 'mean', 'n_estimators': 350, 'learning_rate': 0.00010254495849354014, 'max_depth': 8, 'min_child_weight': 9, 'subsample': 0.7, 'colsample_bytree': 0.5, 'colsample_bylevel': 0.5, 'reg_alpha': 57.226601248020394, 'reg_lambda': 0.2613280255880173, 'gamma': 83.28594515141569}. Best is trial 472 with value: -0.13764739925059793.
[I 2026-07-20 13:41:22,803] Trial 481 finished with value: -0.13732113324332448 and parameters: {'error_threshold': 2.0, 'scalers': 'none', 'ratios': 'norm_ratio', 'imputers': 'mean', 'n_estimators': 200, 'learning_rate': 0.0001148921253926677, 'max_depth': 8, 'min_child_weight': 2, 'subsample': 0.9, 'colsample_bytree': 0.5, 'colsample_bylevel': 0.5, 'reg_alpha': 82.96010244203103, 'reg_lambda': 0.2887373276802156, 'gamma': 4.564307517417403e-05}. Best is trial 472 with value: -0.13764739925059793.
[I 2026-07-20 13:41:23,389] Trial 482 finished with value: -0.1372616984043743 and parameters: {'error_threshold': 2.25, 'scalers': 'none', 'ratios': 'norm_ratio', 'imputers': 'mean', 'n_estimators': 300, 'learning_rate': 0.00010334099381508898, 'max_depth': 8, 'min_child_weight': 2, 'subsample': 1.0, 'colsample_bytree': 0.5, 'colsample_bylevel': 0.5, 'reg_alpha': 58.279967177218715, 'reg_lambda': 0.23206145042080087, 'gamma': 98.05048294949223}. Best is trial 472 with value: -0.13764739925059793.
[I 2026-07-20 13:41:23,591] Trial 483 finished with value: -0.13727315636064538 and parameters: {'error_threshold': 2.25, 'scalers': 'none', 'ratios': 'norm_ratio', 'imputers': 'mean', 'n_estimators': 300, 'learning_rate': 0.00010025955175520648, 'max_depth': 8, 'min_child_weight': 2, 'subsample': 1.0, 'colsample_bytree': 0.5, 'colsample_bylevel': 0.5, 'reg_alpha': 59.18447280501726, 'reg_lambda': 0.23123105334164193, 'gamma': 98.26341607571206}. Best is trial 472 with value: -0.13764739925059793.
[I 2026-07-20 13:41:24,853] Trial 484 finished with value: -0.13727176093363957 and parameters: {'error_threshold': 2.25, 'scalers': 'none', 'ratios': 'norm_ratio', 'imputers': 'mean', 'n_estimators': 300, 'learning_rate': 0.00010063463302272082, 'max_depth': 8, 'min_child_weight': 8, 'subsample': 1.0, 'colsample_bytree': 0.5, 'colsample_bylevel': 0.5, 'reg_alpha': 93.41967998438865, 'reg_lambda': 0.21963307759431905, 'gamma': 98.96376312940924}. Best is trial 472 with value: -0.13764739925059793.
[I 2026-07-20 13:41:25,925] Trial 485 finished with value: -0.13726593836458026 and parameters: {'error_threshold': 2.25, 'scalers': 'none', 'ratios': 'norm_ratio', 'imputers': 'mean', 'n_estimators': 300, 'learning_rate': 0.0001022005118981828, 'max_depth': 7, 'min_child_weight': 9, 'subsample': 1.0, 'colsample_bytree': 0.5, 'colsample_bylevel': 0.5, 'reg_alpha': 60.202987802485595, 'reg_lambda': 0.21944557316268165, 'gamma': 95.79680428072932}. Best is trial 472 with value: -0.13764739925059793.
[I 2026-07-20 13:41:27,180] Trial 486 finished with value: -0.13715386800055154 and parameters: {'error_threshold': 2.25, 'scalers': 'none', 'ratios': 'norm_ratio', 'imputers': 'mean', 'n_estimators': 350, 'learning_rate': 0.00010659135469303289, 'max_depth': 7, 'min_child_weight': 3, 'subsample': 1.0, 'colsample_bytree': 0.5, 'colsample_bylevel': 0.5, 'reg_alpha': 56.885260688338555, 'reg_lambda': 0.23572679987725131, 'gamma': 97.06013536582707}. Best is trial 472 with value: -0.13764739925059793.
[I 2026-07-20 13:41:27,386] Trial 487 finished with value: -0.13724474230333503 and parameters: {'error_threshold': 2.25, 'scalers': 'none', 'ratios': 'norm_ratio', 'imputers': 'mean', 'n_estimators': 300, 'learning_rate': 0.00010790341367129157, 'max_depth': 8, 'min_child_weight': 9, 'subsample': 1.0, 'colsample_bytree': 0.5, 'colsample_bylevel': 0.5, 'reg_alpha': 54.938688036613776, 'reg_lambda': 0.20738338895170252, 'gamma': 94.8853970078397}. Best is trial 472 with value: -0.13764739925059793.
[I 2026-07-20 13:41:27,742] Trial 488 finished with value: -0.13725557428223634 and parameters: {'error_threshold': 2.25, 'scalers': 'none', 'ratios': 'norm_ratio', 'imputers': 'mean', 'n_estimators': 300, 'learning_rate': 0.00010498872940661287, 'max_depth': 8, 'min_child_weight': 9, 'subsample': 1.0, 'colsample_bytree': 0.5, 'colsample_bylevel': 0.5, 'reg_alpha': 31.38289247814234, 'reg_lambda': 0.1902196299368842, 'gamma': 98.85009158778071}. Best is trial 472 with value: -0.13764739925059793.
[I 2026-07-20 13:41:27,909] Trial 489 finished with value: -0.13732159767899063 and parameters: {'error_threshold': 2.25, 'scalers': 'none', 'ratios': 'norm_ratio', 'imputers': 'none', 'n_estimators': 250, 'learning_rate': 0.00010204893255900232, 'max_depth': 8, 'min_child_weight': 8, 'subsample': 1.0, 'colsample_bytree': 0.5, 'colsample_bylevel': 0.5, 'reg_alpha': 37.59766077136632, 'reg_lambda': 0.15549715879052675, 'gamma': 98.63273849869415}. Best is trial 472 with value: -0.13764739925059793.
[I 2026-07-20 13:41:28,289] Trial 490 finished with value: -0.1372735870671271 and parameters: {'error_threshold': 2.25, 'scalers': 'none', 'ratios': 'norm_ratio', 'imputers': 'none', 'n_estimators': 300, 'learning_rate': 0.00010007251442693313, 'max_depth': 8, 'min_child_weight': 8, 'subsample': 0.9, 'colsample_bytree': 0.5, 'colsample_bylevel': 0.5, 'reg_alpha': 29.97119415265769, 'reg_lambda': 0.15997851571648053, 'gamma': 93.87063572787164}. Best is trial 472 with value: -0.13764739925059793.
[I 2026-07-20 13:41:28,505] Trial 491 finished with value: -0.13732240276591967 and parameters: {'error_threshold': 2.25, 'scalers': 'none', 'ratios': 'norm_ratio', 'imputers': 'none', 'n_estimators': 250, 'learning_rate': 0.00010179573210789596, 'max_depth': 8, 'min_child_weight': 8, 'subsample': 1.0, 'colsample_bytree': 0.5, 'colsample_bylevel': 0.5, 'reg_alpha': 32.397439000022885, 'reg_lambda': 0.12905377782988228, 'gamma': 97.76989595874025}. Best is trial 472 with value: -0.13764739925059793.
