[I 2026-07-21 09:38:25,794] Trial 96 finished with value: -0.10957072111845371 and parameters: {'error_threshold': 3.85, 'scalers': 'robust', 'ratios': 'log_ratio', 'imputers': 'mean', 'n_estimators': 400, 'learning_rate': 0.017655173834485206, 'max_depth': 4, 'min_child_weight': 6, 'subsample': 0.8, 'colsample_bytree': 0.6, 'colsample_bylevel': 1.0, 'reg_alpha': 0.07075633337676168, 'reg_lambda': 0.00020175667789813892, 'gamma': 2.307870189730157e-06}. Best is trial 71 with value: -0.09854883830457369.
/bsuhome/alexanderemert/Research/Star-Formation-Research-Project-2026/pipeline/scripts/optuna/final_preds_and_models/optuna_search_mult_quant_reg.py:75: UserWarning: The distribution is specified by [0.1, 5] and step=0.25, but the range is not divisible by `step`. It will be replaced with [0.1, 4.85].
  error_threshold = trial.suggest_float("error_threshold", 0.1, 5, step=0.25)
[I 2026-07-21 09:38:31,915] Trial 98 finished with value: -0.10229294056947795 and parameters: {'error_threshold': 4.85, 'scalers': 'robust', 'ratios': 'log_ratio', 'imputers': 'mean', 'n_estimators': 1150, 'learning_rate': 0.01064050498178248, 'max_depth': 4, 'min_child_weight': 6, 'subsample': 0.9, 'colsample_bytree': 0.5, 'colsample_bylevel': 0.9, 'reg_alpha': 0.0629764177823126, 'reg_lambda': 0.000245905128931946, 'gamma': 2.6064936729491405e-06}. Best is trial 71 with value: -0.09854883830457369.
/bsuhome/alexanderemert/Research/Star-Formation-Research-Project-2026/pipeline/scripts/optuna/final_preds_and_models/optuna_search_mult_quant_reg.py:75: UserWarning: The distribution is specified by [0.1, 5] and step=0.25, but the range is not divisible by `step`. It will be replaced with [0.1, 4.85].
  error_threshold = trial.suggest_float("error_threshold", 0.1, 5, step=0.25)
[I 2026-07-21 09:38:34,018] Trial 97 finished with value: -0.09998217348166603 and parameters: {'error_threshold': 4.85, 'scalers': 'robust', 'ratios': 'log_ratio', 'imputers': 'mean', 'n_estimators': 1750, 'learning_rate': 0.010720641707852993, 'max_depth': 4, 'min_child_weight': 6, 'subsample': 0.9, 'colsample_bytree': 0.5, 'colsample_bylevel': 0.9, 'reg_alpha': 0.0740196489751131, 'reg_lambda': 2.4721611422710065e-05, 'gamma': 2.310294588785337e-06}. Best is trial 71 with value: -0.09854883830457369.
/bsuhome/alexanderemert/Research/Star-Formation-Research-Project-2026/pipeline/scripts/optuna/final_preds_and_models/optuna_search_mult_quant_reg.py:75: UserWarning: The distribution is specified by [0.1, 5] and step=0.25, but the range is not divisible by `step`. It will be replaced with [0.1, 4.85].
  error_threshold = trial.suggest_float("error_threshold", 0.1, 5, step=0.25)
[I 2026-07-21 09:38:40,740] Trial 99 finished with value: -0.10210255618283325 and parameters: {'error_threshold': 4.35, 'scalers': 'robust', 'ratios': 'log_ratio', 'imputers': 'mean', 'n_estimators': 1150, 'learning_rate': 0.010378704680928216, 'max_depth': 4, 'min_child_weight': 6, 'subsample': 0.9, 'colsample_bytree': 0.6, 'colsample_bylevel': 0.9, 'reg_alpha': 0.06532869144150419, 'reg_lambda': 0.29804549031813377, 'gamma': 1.9740163586554226e-06}. Best is trial 71 with value: -0.09854883830457369.
/bsuhome/alexanderemert/Research/Star-Formation-Research-Project-2026/pipeline/scripts/optuna/final_preds_and_models/optuna_search_mult_quant_reg.py:75: UserWarning: The distribution is specified by [0.1, 5] and step=0.25, but the range is not divisible by `step`. It will be replaced with [0.1, 4.85].
  error_threshold = trial.suggest_float("error_threshold", 0.1, 5, step=0.25)
[I 2026-07-21 09:38:43,105] Trial 100 finished with value: -0.1003271197958117 and parameters: {'error_threshold': 4.85, 'scalers': 'robust', 'ratios': 'log_ratio', 'imputers': 'mean', 'n_estimators': 1750, 'learning_rate': 0.010059294296166298, 'max_depth': 4, 'min_child_weight': 6, 'subsample': 0.9, 'colsample_bytree': 0.6, 'colsample_bylevel': 0.9, 'reg_alpha': 0.37644226948122644, 'reg_lambda': 0.0002228779040355174, 'gamma': 1.9665512455167875e-06}. Best is trial 71 with value: -0.09854883830457369.
/bsuhome/alexanderemert/Research/Star-Formation-Research-Project-2026/pipeline/scripts/optuna/final_preds_and_models/optuna_search_mult_quant_reg.py:75: UserWarning: The distribution is specified by [0.1, 5] and step=0.25, but the range is not divisible by `step`. It will be replaced with [0.1, 4.85].
  error_threshold = trial.suggest_float("error_threshold", 0.1, 5, step=0.25)
[I 2026-07-21 09:38:46,550] Trial 101 finished with value: -0.14936164517077732 and parameters: {'error_threshold': 4.85, 'scalers': 'robust', 'ratios': 'log_ratio', 'imputers': 'mean', 'n_estimators': 250, 'learning_rate': 0.011526732270768707, 'max_depth': 4, 'min_child_weight': 6, 'subsample': 0.9, 'colsample_bytree': 0.6, 'colsample_bylevel': 0.9, 'reg_alpha': 0.010890715014252398, 'reg_lambda': 0.39648796507982137, 'gamma': 2.32127400191444e-06}. Best is trial 71 with value: -0.09854883830457369.
/bsuhome/alexanderemert/Research/Star-Formation-Research-Project-2026/pipeline/scripts/optuna/final_preds_and_models/optuna_search_mult_quant_reg.py:75: UserWarning: The distribution is specified by [0.1, 5] and step=0.25, but the range is not divisible by `step`. It will be replaced with [0.1, 4.85].
  error_threshold = trial.suggest_float("error_threshold", 0.1, 5, step=0.25)
[I 2026-07-21 09:39:03,267] Trial 102 finished with value: -0.10223657878989688 and parameters: {'error_threshold': 4.85, 'scalers': 'robust', 'ratios': 'log_ratio', 'imputers': 'mean', 'n_estimators': 1150, 'learning_rate': 0.010101334374041213, 'max_depth': 4, 'min_child_weight': 8, 'subsample': 0.9, 'colsample_bytree': 0.6, 'colsample_bylevel': 0.9, 'reg_alpha': 0.42577331899880017, 'reg_lambda': 1.4309675484221988e-05, 'gamma': 2.328089966046512e-06}. Best is trial 71 with value: -0.09854883830457369.
/bsuhome/alexanderemert/Research/Star-Formation-Research-Project-2026/pipeline/scripts/optuna/final_preds_and_models/optuna_search_mult_quant_reg.py:75: UserWarning: The distribution is specified by [0.1, 5] and step=0.25, but the range is not divisible by `step`. It will be replaced with [0.1, 4.85].
  error_threshold = trial.suggest_float("error_threshold", 0.1, 5, step=0.25)
[I 2026-07-21 09:39:04,769] Trial 103 finished with value: -0.10166775362774089 and parameters: {'error_threshold': 4.1, 'scalers': 'robust', 'ratios': 'norm_ratio', 'imputers': 'mean', 'n_estimators': 1100, 'learning_rate': 0.010769617596496141, 'max_depth': 4, 'min_child_weight': 8, 'subsample': 0.9, 'colsample_bytree': 0.6, 'colsample_bylevel': 0.9, 'reg_alpha': 0.06307326810726628, 'reg_lambda': 0.00014873703867430025, 'gamma': 2.1892768279483083e-06}. Best is trial 71 with value: -0.09854883830457369.
/bsuhome/alexanderemert/Research/Star-Formation-Research-Project-2026/pipeline/scripts/optuna/final_preds_and_models/optuna_search_mult_quant_reg.py:75: UserWarning: The distribution is specified by [0.1, 5] and step=0.25, but the range is not divisible by `step`. It will be replaced with [0.1, 4.85].
  error_threshold = trial.suggest_float("error_threshold", 0.1, 5, step=0.25)
[I 2026-07-21 09:39:06,258] Trial 104 finished with value: -0.10190543804013602 and parameters: {'error_threshold': 4.1, 'scalers': 'robust', 'ratios': 'norm_ratio', 'imputers': 'mean', 'n_estimators': 1100, 'learning_rate': 0.01015869533630666, 'max_depth': 4, 'min_child_weight': 8, 'subsample': 0.9, 'colsample_bytree': 0.6, 'colsample_bylevel': 0.9, 'reg_alpha': 0.011118664159060125, 'reg_lambda': 4.231208723536469e-06, 'gamma': 2.349566948946651e-06}. Best is trial 71 with value: -0.09854883830457369.
/bsuhome/alexanderemert/Research/Star-Formation-Research-Project-2026/pipeline/scripts/optuna/final_preds_and_models/optuna_search_mult_quant_reg.py:75: UserWarning: The distribution is specified by [0.1, 5] and step=0.25, but the range is not divisible by `step`. It will be replaced with [0.1, 4.85].
  error_threshold = trial.suggest_float("error_threshold", 0.1, 5, step=0.25)
[I 2026-07-21 09:39:08,944] Trial 105 finished with value: -0.10622735072680894 and parameters: {'error_threshold': 4.1, 'scalers': 'robust', 'ratios': 'norm_ratio', 'imputers': 'mean', 'n_estimators': 1100, 'learning_rate': 0.007183317882079828, 'max_depth': 4, 'min_child_weight': 8, 'subsample': 0.9, 'colsample_bytree': 0.6, 'colsample_bylevel': 0.9, 'reg_alpha': 0.3310883646169173, 'reg_lambda': 5.452352304528905e-06, 'gamma': 7.746162014676631e-06}. Best is trial 71 with value: -0.09854883830457369.
/bsuhome/alexanderemert/Research/Star-Formation-Research-Project-2026/pipeline/scripts/optuna/final_preds_and_models/optuna_search_mult_quant_reg.py:75: UserWarning: The distribution is specified by [0.1, 5] and step=0.25, but the range is not divisible by `step`. It will be replaced with [0.1, 4.85].
  error_threshold = trial.suggest_float("error_threshold", 0.1, 5, step=0.25)
[I 2026-07-21 09:39:14,572] Trial 106 finished with value: -0.10830289076629157 and parameters: {'error_threshold': 4.1, 'scalers': 'robust', 'ratios': 'norm_ratio', 'imputers': 'mean', 'n_estimators': 1050, 'learning_rate': 0.007115664666921232, 'max_depth': 4, 'min_child_weight': 8, 'subsample': 0.9, 'colsample_bytree': 0.6, 'colsample_bylevel': 0.9, 'reg_alpha': 0.7270363328497873, 'reg_lambda': 0.00015541820634727485, 'gamma': 8.954660312834258e-06}. Best is trial 71 with value: -0.09854883830457369.
/bsuhome/alexanderemert/Research/Star-Formation-Research-Project-2026/pipeline/scripts/optuna/final_preds_and_models/optuna_search_mult_quant_reg.py:75: UserWarning: The distribution is specified by [0.1, 5] and step=0.25, but the range is not divisible by `step`. It will be replaced with [0.1, 4.85].
  error_threshold = trial.suggest_float("error_threshold", 0.1, 5, step=0.25)
[I 2026-07-21 09:39:20,320] Trial 108 finished with value: -0.09850198812587381 and parameters: {'error_threshold': 4.1, 'scalers': 'robust', 'ratios': 'norm_ratio', 'imputers': 'mean', 'n_estimators': 1050, 'learning_rate': 0.04431986623491205, 'max_depth': 3, 'min_child_weight': 4, 'subsample': 0.8, 'colsample_bytree': 0.6, 'colsample_bylevel': 0.9, 'reg_alpha': 0.0003151274720157928, 'reg_lambda': 9.864525076535975e-06, 'gamma': 8.783029489962466e-06}. Best is trial 108 with value: -0.09850198812587381.
/bsuhome/alexanderemert/Research/Star-Formation-Research-Project-2026/pipeline/scripts/optuna/final_preds_and_models/optuna_search_mult_quant_reg.py:75: UserWarning: The distribution is specified by [0.1, 5] and step=0.25, but the range is not divisible by `step`. It will be replaced with [0.1, 4.85].
  error_threshold = trial.suggest_float("error_threshold", 0.1, 5, step=0.25)
[I 2026-07-21 09:39:31,324] Trial 109 finished with value: -0.09757409488906987 and parameters: {'error_threshold': 4.1, 'scalers': 'robust', 'ratios': 'norm_ratio', 'imputers': 'mean', 'n_estimators': 1350, 'learning_rate': 0.030136107684861625, 'max_depth': 3, 'min_child_weight': 8, 'subsample': 0.8, 'colsample_bytree': 0.6, 'colsample_bylevel': 0.9, 'reg_alpha': 0.00026698106765405294, 'reg_lambda': 0.022611370432417083, 'gamma': 2.0495802312883874e-05}. Best is trial 109 with value: -0.09757409488906987.
/bsuhome/alexanderemert/Research/Star-Formation-Research-Project-2026/pipeline/scripts/optuna/final_preds_and_models/optuna_search_mult_quant_reg.py:75: UserWarning: The distribution is specified by [0.1, 5] and step=0.25, but the range is not divisible by `step`. It will be replaced with [0.1, 4.85].
  error_threshold = trial.suggest_float("error_threshold", 0.1, 5, step=0.25)
[I 2026-07-21 09:39:35,312] Trial 107 finished with value: -0.1009994372049277 and parameters: {'error_threshold': 4.1, 'scalers': 'robust', 'ratios': 'norm_ratio', 'imputers': 'mean', 'n_estimators': 2900, 'learning_rate': 0.03007777070388929, 'max_depth': 4, 'min_child_weight': 7, 'subsample': 0.9, 'colsample_bytree': 0.6, 'colsample_bylevel': 0.9, 'reg_alpha': 0.7406263925367064, 'reg_lambda': 0.0002003704641030991, 'gamma': 2.04673415353223e-05}. Best is trial 109 with value: -0.09757409488906987.
/bsuhome/alexanderemert/Research/Star-Formation-Research-Project-2026/pipeline/scripts/optuna/final_preds_and_models/optuna_search_mult_quant_reg.py:75: UserWarning: The distribution is specified by [0.1, 5] and step=0.25, but the range is not divisible by `step`. It will be replaced with [0.1, 4.85].
  error_threshold = trial.suggest_float("error_threshold", 0.1, 5, step=0.25)
[I 2026-07-21 09:39:48,368] Trial 111 finished with value: -0.09766744360754853 and parameters: {'error_threshold': 4.35, 'scalers': 'robust', 'ratios': 'norm_ratio', 'imputers': 'mean', 'n_estimators': 1350, 'learning_rate': 0.03088779941105495, 'max_depth': 3, 'min_child_weight': 4, 'subsample': 0.8, 'colsample_bytree': 0.7, 'colsample_bylevel': 0.9, 'reg_alpha': 0.0016669186991685914, 'reg_lambda': 0.004273620678632503, 'gamma': 2.101542476143949e-05}. Best is trial 109 with value: -0.09757409488906987.
/bsuhome/alexanderemert/Research/Star-Formation-Research-Project-2026/pipeline/scripts/optuna/final_preds_and_models/optuna_search_mult_quant_reg.py:75: UserWarning: The distribution is specified by [0.1, 5] and step=0.25, but the range is not divisible by `step`. It will be replaced with [0.1, 4.85].
  error_threshold = trial.suggest_float("error_threshold", 0.1, 5, step=0.25)
[I 2026-07-21 09:40:02,157] Trial 112 finished with value: -0.10405649857884676 and parameters: {'error_threshold': 4.35, 'scalers': 'robust', 'ratios': 'log_ratio', 'imputers': 'mean', 'n_estimators': 1600, 'learning_rate': 0.006949995850227529, 'max_depth': 3, 'min_child_weight': 4, 'subsample': 0.8, 'colsample_bytree': 0.7, 'colsample_bylevel': 0.9, 'reg_alpha': 0.0037143172710399517, 'reg_lambda': 0.0006966420278196236, 'gamma': 8.680139850636344e-06}. Best is trial 109 with value: -0.09757409488906987.
/bsuhome/alexanderemert/Research/Star-Formation-Research-Project-2026/pipeline/scripts/optuna/final_preds_and_models/optuna_search_mult_quant_reg.py:75: UserWarning: The distribution is specified by [0.1, 5] and step=0.25, but the range is not divisible by `step`. It will be replaced with [0.1, 4.85].
  error_threshold = trial.suggest_float("error_threshold", 0.1, 5, step=0.25)
[I 2026-07-21 09:40:05,599] Trial 113 finished with value: -0.09848917121635248 and parameters: {'error_threshold': 4.35, 'scalers': 'robust', 'ratios': 'log_ratio', 'imputers': 'mean', 'n_estimators': 1550, 'learning_rate': 0.031825801593684075, 'max_depth': 3, 'min_child_weight': 4, 'subsample': 0.8, 'colsample_bytree': 0.7, 'colsample_bylevel': 1.0, 'reg_alpha': 0.00029674809209535413, 'reg_lambda': 0.004041424745761485, 'gamma': 6.51293842169693e-05}. Best is trial 109 with value: -0.09757409488906987.
/bsuhome/alexanderemert/Research/Star-Formation-Research-Project-2026/pipeline/scripts/optuna/final_preds_and_models/optuna_search_mult_quant_reg.py:75: UserWarning: The distribution is specified by [0.1, 5] and step=0.25, but the range is not divisible by `step`. It will be replaced with [0.1, 4.85].
  error_threshold = trial.suggest_float("error_threshold", 0.1, 5, step=0.25)
[I 2026-07-21 09:40:07,435] Trial 114 finished with value: -0.09848512675803482 and parameters: {'error_threshold': 4.35, 'scalers': 'none', 'ratios': 'log_ratio', 'imputers': 'mean', 'n_estimators': 1600, 'learning_rate': 0.044587025939930136, 'max_depth': 3, 'min_child_weight': 4, 'subsample': 0.8, 'colsample_bytree': 0.7, 'colsample_bylevel': 1.0, 'reg_alpha': 0.00028082938201283615, 'reg_lambda': 0.003474737157535527, 'gamma': 2.3336758856558576e-05}. Best is trial 109 with value: -0.09757409488906987.
/bsuhome/alexanderemert/Research/Star-Formation-Research-Project-2026/pipeline/scripts/optuna/final_preds_and_models/optuna_search_mult_quant_reg.py:75: UserWarning: The distribution is specified by [0.1, 5] and step=0.25, but the range is not divisible by `step`. It will be replaced with [0.1, 4.85].
  error_threshold = trial.suggest_float("error_threshold", 0.1, 5, step=0.25)
[I 2026-07-21 09:40:14,221] Trial 115 finished with value: -0.09870432655352661 and parameters: {'error_threshold': 3.35, 'scalers': 'none', 'ratios': 'norm_ratio', 'imputers': 'mean', 'n_estimators': 1350, 'learning_rate': 0.030205702361977817, 'max_depth': 3, 'min_child_weight': 4, 'subsample': 0.8, 'colsample_bytree': 0.7, 'colsample_bylevel': 1.0, 'reg_alpha': 0.0009469894063958516, 'reg_lambda': 0.0007359875694942028, 'gamma': 1.9940753171935307e-05}. Best is trial 109 with value: -0.09757409488906987.
/bsuhome/alexanderemert/Research/Star-Formation-Research-Project-2026/pipeline/scripts/optuna/final_preds_and_models/optuna_search_mult_quant_reg.py:75: UserWarning: The distribution is specified by [0.1, 5] and step=0.25, but the range is not divisible by `step`. It will be replaced with [0.1, 4.85].
  error_threshold = trial.suggest_float("error_threshold", 0.1, 5, step=0.25)
[I 2026-07-21 09:40:19,564] Trial 110 finished with value: -0.1106924132441869 and parameters: {'error_threshold': 4.1, 'scalers': 'robust', 'ratios': 'norm_ratio', 'imputers': 'mean', 'n_estimators': 1600, 'learning_rate': 0.007393238431433391, 'max_depth': 11, 'min_child_weight': 8, 'subsample': 0.8, 'colsample_bytree': 0.6, 'colsample_bylevel': 0.9, 'reg_alpha': 0.0035942246161757, 'reg_lambda': 0.004127110266720543, 'gamma': 1.994526683283291e-05}. Best is trial 109 with value: -0.09757409488906987.
/bsuhome/alexanderemert/Research/Star-Formation-Research-Project-2026/pipeline/scripts/optuna/final_preds_and_models/optuna_search_mult_quant_reg.py:75: UserWarning: The distribution is specified by [0.1, 5] and step=0.25, but the range is not divisible by `step`. It will be replaced with [0.1, 4.85].
  error_threshold = trial.suggest_float("error_threshold", 0.1, 5, step=0.25)
[I 2026-07-21 09:40:23,769] Trial 116 finished with value: -0.0992978917915302 and parameters: {'error_threshold': 3.35, 'scalers': 'none', 'ratios': 'norm_ratio', 'imputers': 'mean', 'n_estimators': 950, 'learning_rate': 0.03160480585517898, 'max_depth': 3, 'min_child_weight': 4, 'subsample': 0.8, 'colsample_bytree': 0.7, 'colsample_bylevel': 1.0, 'reg_alpha': 0.0003082313787451199, 'reg_lambda': 0.0038429172682649857, 'gamma': 1.2777732293011106e-05}. Best is trial 109 with value: -0.09757409488906987.
/bsuhome/alexanderemert/Research/Star-Formation-Research-Project-2026/pipeline/scripts/optuna/final_preds_and_models/optuna_search_mult_quant_reg.py:75: UserWarning: The distribution is specified by [0.1, 5] and step=0.25, but the range is not divisible by `step`. It will be replaced with [0.1, 4.85].
  error_threshold = trial.suggest_float("error_threshold", 0.1, 5, step=0.25)
[I 2026-07-21 09:40:25,198] Trial 117 finished with value: -0.09878915764341496 and parameters: {'error_threshold': 4.35, 'scalers': 'none', 'ratios': 'norm_ratio', 'imputers': 'mean', 'n_estimators': 1250, 'learning_rate': 0.04876111307310626, 'max_depth': 3, 'min_child_weight': 4, 'subsample': 0.8, 'colsample_bytree': 0.7, 'colsample_bylevel': 1.0, 'reg_alpha': 0.0002453345484957864, 'reg_lambda': 0.019928474521969237, 'gamma': 2.212909625376586e-05}. Best is trial 109 with value: -0.09757409488906987.
/bsuhome/alexanderemert/Research/Star-Formation-Research-Project-2026/pipeline/scripts/optuna/final_preds_and_models/optuna_search_mult_quant_reg.py:75: UserWarning: The distribution is specified by [0.1, 5] and step=0.25, but the range is not divisible by `step`. It will be replaced with [0.1, 4.85].
  error_threshold = trial.suggest_float("error_threshold", 0.1, 5, step=0.25)
[I 2026-07-21 09:40:39,262] Trial 118 finished with value: -0.09837797054453634 and parameters: {'error_threshold': 3.35, 'scalers': 'none', 'ratios': 'norm_ratio', 'imputers': 'mean', 'n_estimators': 1350, 'learning_rate': 0.04862826131181549, 'max_depth': 3, 'min_child_weight': 4, 'subsample': 0.8, 'colsample_bytree': 0.7, 'colsample_bylevel': 1.0, 'reg_alpha': 0.0003312693684052296, 'reg_lambda': 0.022903474626278564, 'gamma': 2.6409100228928656e-05}. Best is trial 109 with value: -0.09757409488906987.
/bsuhome/alexanderemert/Research/Star-Formation-Research-Project-2026/pipeline/scripts/optuna/final_preds_and_models/optuna_search_mult_quant_reg.py:75: UserWarning: The distribution is specified by [0.1, 5] and step=0.25, but the range is not divisible by `step`. It will be replaced with [0.1, 4.85].
  error_threshold = trial.suggest_float("error_threshold", 0.1, 5, step=0.25)
[I 2026-07-21 09:40:40,671] Trial 119 finished with value: -0.09775491971123396 and parameters: {'error_threshold': 3.35, 'scalers': 'none', 'ratios': 'norm_ratio', 'imputers': 'mean', 'n_estimators': 1250, 'learning_rate': 0.048602741449872915, 'max_depth': 3, 'min_child_weight': 4, 'subsample': 0.8, 'colsample_bytree': 0.7, 'colsample_bylevel': 1.0, 'reg_alpha': 0.00030200098424119454, 'reg_lambda': 0.004471882936117159, 'gamma': 6.348490746796856e-05}. Best is trial 109 with value: -0.09757409488906987.
/bsuhome/alexanderemert/Research/Star-Formation-Research-Project-2026/pipeline/scripts/optuna/final_preds_and_models/optuna_search_mult_quant_reg.py:75: UserWarning: The distribution is specified by [0.1, 5] and step=0.25, but the range is not divisible by `step`. It will be replaced with [0.1, 4.85].
  error_threshold = trial.suggest_float("error_threshold", 0.1, 5, step=0.25)
