[I 2026-07-20 13:41:29,375] Trial 492 finished with value: -0.13731764510458733 and parameters: {'error_threshold': 2.5, 'scalers': 'none', 'ratios': 'norm_ratio', 'imputers': 'none', 'n_estimators': 250, 'learning_rate': 0.0001032905774522252, 'max_depth': 7, 'min_child_weight': 9, 'subsample': 1.0, 'colsample_bytree': 0.5, 'colsample_bylevel': 0.5, 'reg_alpha': 33.55244910157834, 'reg_lambda': 0.16405452068350662, 'gamma': 72.7027952747474}. Best is trial 472 with value: -0.13764739925059793.
[I 2026-07-20 13:41:30,109] Trial 493 finished with value: -0.1373802919164477 and parameters: {'error_threshold': 2.5, 'scalers': 'none', 'ratios': 'norm_ratio', 'imputers': 'none', 'n_estimators': 200, 'learning_rate': 0.0001007095556951544, 'max_depth': 8, 'min_child_weight': 9, 'subsample': 1.0, 'colsample_bytree': 0.5, 'colsample_bylevel': 0.5, 'reg_alpha': 50.318932395216315, 'reg_lambda': 0.11487546072929573, 'gamma': 69.73583177370215}. Best is trial 472 with value: -0.13764739925059793.
[I 2026-07-20 13:41:31,026] Trial 494 finished with value: -0.13737362003191111 and parameters: {'error_threshold': 2.5, 'scalers': 'none', 'ratios': 'norm_ratio', 'imputers': 'none', 'n_estimators': 200, 'learning_rate': 0.00010323284727234098, 'max_depth': 8, 'min_child_weight': 8, 'subsample': 1.0, 'colsample_bytree': 0.5, 'colsample_bylevel': 0.5, 'reg_alpha': 32.757230614554004, 'reg_lambda': 0.11541379867194917, 'gamma': 68.55011762792901}. Best is trial 472 with value: -0.13764739925059793.
[I 2026-07-20 13:41:31,159] Trial 495 finished with value: -0.1373729177717683 and parameters: {'error_threshold': 2.5, 'scalers': 'none', 'ratios': 'norm_ratio', 'imputers': 'none', 'n_estimators': 200, 'learning_rate': 0.00010361621589066333, 'max_depth': 7, 'min_child_weight': 2, 'subsample': 0.8, 'colsample_bytree': 0.5, 'colsample_bylevel': 0.5, 'reg_alpha': 29.577317725489007, 'reg_lambda': 0.1513845711037298, 'gamma': 69.31349543571946}. Best is trial 472 with value: -0.13764739925059793.
[I 2026-07-20 13:41:31,653] Trial 497 finished with value: -0.13738215506592064 and parameters: {'error_threshold': 2.5, 'scalers': 'none', 'ratios': 'norm_ratio', 'imputers': 'mean', 'n_estimators': 200, 'learning_rate': 0.00010001904917928157, 'max_depth': 8, 'min_child_weight': 3, 'subsample': 0.9, 'colsample_bytree': 0.5, 'colsample_bylevel': 0.5, 'reg_alpha': 32.80928424321905, 'reg_lambda': 0.14769109717641007, 'gamma': 65.22570798386074}. Best is trial 472 with value: -0.13764739925059793.
[I 2026-07-20 13:41:31,654] Trial 496 finished with value: -0.13738175792671037 and parameters: {'error_threshold': 2.0, 'scalers': 'none', 'ratios': 'norm_ratio', 'imputers': 'none', 'n_estimators': 200, 'learning_rate': 0.00010027461349030707, 'max_depth': 7, 'min_child_weight': 8, 'subsample': 0.8, 'colsample_bytree': 0.5, 'colsample_bylevel': 0.5, 'reg_alpha': 34.64629322529328, 'reg_lambda': 0.13778867968724087, 'gamma': 65.17698229640396}. Best is trial 472 with value: -0.13764739925059793.
[I 2026-07-20 13:41:31,982] Trial 498 finished with value: -0.13737633312278083 and parameters: {'error_threshold': 2.5, 'scalers': 'none', 'ratios': 'norm_ratio', 'imputers': 'mean', 'n_estimators': 200, 'learning_rate': 0.00010228919264297518, 'max_depth': 8, 'min_child_weight': 3, 'subsample': 0.8, 'colsample_bytree': 0.5, 'colsample_bylevel': 0.5, 'reg_alpha': 98.03585496667073, 'reg_lambda': 0.13292382944227962, 'gamma': 67.04919127449007}. Best is trial 472 with value: -0.13764739925059793.
[I 2026-07-20 13:41:32,054] Trial 499 finished with value: -0.13737927480369927 and parameters: {'error_threshold': 2.5, 'scalers': 'none', 'ratios': 'norm_ratio', 'imputers': 'mean', 'n_estimators': 200, 'learning_rate': 0.00010109178120399422, 'max_depth': 7, 'min_child_weight': 2, 'subsample': 0.9, 'colsample_bytree': 0.5, 'colsample_bylevel': 0.5, 'reg_alpha': 94.77053718032414, 'reg_lambda': 0.3665446123104484, 'gamma': 61.68680727256366}. Best is trial 472 with value: -0.13764739925059793.
[I 2026-07-20 13:41:32,585] Trial 500 finished with value: -0.13733670234757955 and parameters: {'error_threshold': 2.0, 'scalers': 'none', 'ratios': 'norm_ratio', 'imputers': 'mean', 'n_estimators': 200, 'learning_rate': 0.00011720606743640489, 'max_depth': 8, 'min_child_weight': 6, 'subsample': 1.0, 'colsample_bytree': 0.5, 'colsample_bylevel': 0.5, 'reg_alpha': 76.53701508366852, 'reg_lambda': 0.3892888415687807, 'gamma': 65.15237124936638}. Best is trial 472 with value: -0.13764739925059793.
[I 2026-07-20 13:41:33,329] Trial 501 finished with value: -0.1371792504009245 and parameters: {'error_threshold': 2.0, 'scalers': 'none', 'ratios': 'norm_ratio', 'imputers': 'mean', 'n_estimators': 200, 'learning_rate': 0.00011615592178344386, 'max_depth': 7, 'min_child_weight': 3, 'subsample': 0.8, 'colsample_bytree': 0.7, 'colsample_bylevel': 0.5, 'reg_alpha': 87.66048245492594, 'reg_lambda': 0.3618585042849491, 'gamma': 60.548462132405746}. Best is trial 472 with value: -0.13764739925059793.
[I 2026-07-20 13:41:34,077] Trial 502 finished with value: -0.13737997640786606 and parameters: {'error_threshold': 2.0, 'scalers': 'none', 'ratios': 'norm_ratio', 'imputers': 'mean', 'n_estimators': 200, 'learning_rate': 0.00010090077581765692, 'max_depth': 8, 'min_child_weight': 3, 'subsample': 0.8, 'colsample_bytree': 0.5, 'colsample_bylevel': 0.5, 'reg_alpha': 91.8853738736677, 'reg_lambda': 0.40208253034060654, 'gamma': 62.144246656784894}. Best is trial 472 with value: -0.13764739925059793.
[I 2026-07-20 13:41:34,414] Trial 503 finished with value: -0.13742192902468872 and parameters: {'error_threshold': 2.0, 'scalers': 'none', 'ratios': 'norm_ratio', 'imputers': 'mean', 'n_estimators': 150, 'learning_rate': 0.00012051882945550913, 'max_depth': 7, 'min_child_weight': 6, 'subsample': 0.9, 'colsample_bytree': 0.5, 'colsample_bylevel': 0.5, 'reg_alpha': 94.63049210867727, 'reg_lambda': 0.30107850845996076, 'gamma': 57.98936792973201}. Best is trial 472 with value: -0.13764739925059793.
[I 2026-07-20 13:41:34,534] Trial 504 finished with value: -0.13742312828335743 and parameters: {'error_threshold': 2.0, 'scalers': 'none', 'ratios': 'norm_ratio', 'imputers': 'mean', 'n_estimators': 150, 'learning_rate': 0.00011987531948266248, 'max_depth': 7, 'min_child_weight': 2, 'subsample': 0.9, 'colsample_bytree': 0.5, 'colsample_bylevel': 0.5, 'reg_alpha': 99.38803795005889, 'reg_lambda': 0.34985621947484946, 'gamma': 49.9793998598936}. Best is trial 472 with value: -0.13764739925059793.
[I 2026-07-20 13:41:34,749] Trial 505 finished with value: -0.13742599349528453 and parameters: {'error_threshold': 2.0, 'scalers': 'none', 'ratios': 'norm_ratio', 'imputers': 'mean', 'n_estimators': 150, 'learning_rate': 0.00011833645384192323, 'max_depth': 7, 'min_child_weight': 2, 'subsample': 0.9, 'colsample_bytree': 0.5, 'colsample_bylevel': 0.5, 'reg_alpha': 95.18727669525252, 'reg_lambda': 0.3589600410373405, 'gamma': 53.5974286181836}. Best is trial 472 with value: -0.13764739925059793.
[I 2026-07-20 13:41:34,862] Trial 506 finished with value: -0.13734595114771087 and parameters: {'error_threshold': 2.0, 'scalers': 'none', 'ratios': 'norm_ratio', 'imputers': 'mean', 'n_estimators': 150, 'learning_rate': 0.00011904496130146225, 'max_depth': 7, 'min_child_weight': 6, 'subsample': 0.9, 'colsample_bytree': 0.6, 'colsample_bylevel': 0.5, 'reg_alpha': 75.21131930576266, 'reg_lambda': 0.3606009204667211, 'gamma': 52.722375767498036}. Best is trial 472 with value: -0.13764739925059793.
[I 2026-07-20 13:41:34,977] Trial 507 finished with value: -0.1374195669866818 and parameters: {'error_threshold': 2.0, 'scalers': 'none', 'ratios': 'norm_ratio', 'imputers': 'mean', 'n_estimators': 150, 'learning_rate': 0.00012185524472046936, 'max_depth': 9, 'min_child_weight': 10, 'subsample': 1.0, 'colsample_bytree': 0.5, 'colsample_bylevel': 0.5, 'reg_alpha': 66.98980785809505, 'reg_lambda': 0.3737648713820739, 'gamma': 55.23651405167167}. Best is trial 472 with value: -0.13764739925059793.
[I 2026-07-20 13:41:35,462] Trial 508 finished with value: -0.137422242871723 and parameters: {'error_threshold': 2.0, 'scalers': 'none', 'ratios': 'norm_ratio', 'imputers': 'mean', 'n_estimators': 150, 'learning_rate': 0.00012038800651169623, 'max_depth': 6, 'min_child_weight': 7, 'subsample': 0.9, 'colsample_bytree': 0.5, 'colsample_bylevel': 0.5, 'reg_alpha': 71.23027888204575, 'reg_lambda': 0.4890912698175081, 'gamma': 47.34433490323575}. Best is trial 472 with value: -0.13764739925059793.
[I 2026-07-20 13:41:36,226] Trial 509 finished with value: -0.13742573517233256 and parameters: {'error_threshold': 2.0, 'scalers': 'none', 'ratios': 'norm_ratio', 'imputers': 'mean', 'n_estimators': 150, 'learning_rate': 0.0001185151283637133, 'max_depth': 9, 'min_child_weight': 2, 'subsample': 0.9, 'colsample_bytree': 0.5, 'colsample_bylevel': 0.5, 'reg_alpha': 64.67255393669329, 'reg_lambda': 0.068211227910077, 'gamma': 49.32130326150301}. Best is trial 472 with value: -0.13764739925059793.
[I 2026-07-20 13:41:36,972] Trial 510 finished with value: -0.13742684140194814 and parameters: {'error_threshold': 2.0, 'scalers': 'none', 'ratios': 'norm_ratio', 'imputers': 'mean', 'n_estimators': 150, 'learning_rate': 0.00011795325220263969, 'max_depth': 9, 'min_child_weight': 2, 'subsample': 1.0, 'colsample_bytree': 0.5, 'colsample_bylevel': 0.5, 'reg_alpha': 65.07364274300012, 'reg_lambda': 0.522771400553166, 'gamma': 41.257255503136534}. Best is trial 472 with value: -0.13764739925059793.
[I 2026-07-20 13:41:37,299] Trial 511 finished with value: -0.13742167525486335 and parameters: {'error_threshold': 2.0, 'scalers': 'none', 'ratios': 'norm_ratio', 'imputers': 'mean', 'n_estimators': 150, 'learning_rate': 0.0001206973042382584, 'max_depth': 7, 'min_child_weight': 7, 'subsample': 0.9, 'colsample_bytree': 0.5, 'colsample_bylevel': 0.5, 'reg_alpha': 48.92268519505999, 'reg_lambda': 0.07038169555048648, 'gamma': 43.566084135375725}. Best is trial 472 with value: -0.13764739925059793.
[I 2026-07-20 13:41:37,425] Trial 512 finished with value: -0.13742340215529353 and parameters: {'error_threshold': 2.0, 'scalers': 'none', 'ratios': 'norm_ratio', 'imputers': 'mean', 'n_estimators': 150, 'learning_rate': 0.0001197625829079787, 'max_depth': 7, 'min_child_weight': 7, 'subsample': 0.9, 'colsample_bytree': 0.5, 'colsample_bylevel': 0.5, 'reg_alpha': 66.93868305873538, 'reg_lambda': 0.06896841445583006, 'gamma': 42.632598668692125}. Best is trial 472 with value: -0.13764739925059793.
[I 2026-07-20 13:41:37,991] Trial 513 finished with value: -0.13742582275922482 and parameters: {'error_threshold': 2.0, 'scalers': 'none', 'ratios': 'norm_ratio', 'imputers': 'mean', 'n_estimators': 150, 'learning_rate': 0.000118466849457657, 'max_depth': 7, 'min_child_weight': 2, 'subsample': 0.9, 'colsample_bytree': 0.5, 'colsample_bylevel': 0.5, 'reg_alpha': 64.49655985333308, 'reg_lambda': 0.300871562011517, 'gamma': 42.15447948460151}. Best is trial 472 with value: -0.13764739925059793.
[I 2026-07-20 13:41:38,113] Trial 514 finished with value: -0.1359108141597439 and parameters: {'error_threshold': 2.25, 'scalers': 'none', 'ratios': 'norm_ratio', 'imputers': 'mean', 'n_estimators': 150, 'learning_rate': 0.0009475189694929253, 'max_depth': 7, 'min_child_weight': 2, 'subsample': 0.9, 'colsample_bytree': 0.5, 'colsample_bylevel': 0.5, 'reg_alpha': 46.94650197375941, 'reg_lambda': 0.511424946092733, 'gamma': 40.46840334614721}. Best is trial 472 with value: -0.13764739925059793.
[I 2026-07-20 13:41:38,291] Trial 515 finished with value: -0.13726591173128647 and parameters: {'error_threshold': 2.0, 'scalers': 'none', 'ratios': 'norm_ratio', 'imputers': 'mean', 'n_estimators': 250, 'learning_rate': 0.00011955636595431476, 'max_depth': 7, 'min_child_weight': 10, 'subsample': 0.9, 'colsample_bytree': 0.5, 'colsample_bylevel': 0.5, 'reg_alpha': 49.137170229393, 'reg_lambda': 0.5294416283092063, 'gamma': 43.325823805749394}. Best is trial 472 with value: -0.13764739925059793.
[I 2026-07-20 13:41:39,297] Trial 516 finished with value: -0.1372746733475311 and parameters: {'error_threshold': 2.0, 'scalers': 'none', 'ratios': 'norm_ratio', 'imputers': 'mean', 'n_estimators': 250, 'learning_rate': 0.00011680000507610648, 'max_depth': 7, 'min_child_weight': 7, 'subsample': 0.9, 'colsample_bytree': 0.5, 'colsample_bylevel': 0.5, 'reg_alpha': 43.11593635058338, 'reg_lambda': 0.5625912434114179, 'gamma': 41.599359927494945}. Best is trial 472 with value: -0.13764739925059793.
[I 2026-07-20 13:41:41,990] Trial 517 finished with value: -0.13625532104466068 and parameters: {'error_threshold': 2.0, 'scalers': 'none', 'ratios': 'norm_ratio', 'imputers': 'mean', 'n_estimators': 450, 'learning_rate': 0.00011726542111837044, 'max_depth': 7, 'min_child_weight': 10, 'subsample': 0.9, 'colsample_bytree': 0.9, 'colsample_bylevel': 0.5, 'reg_alpha': 47.073186261181945, 'reg_lambda': 0.28868305243727876, 'gamma': 48.43242287677406}. Best is trial 472 with value: -0.13764739925059793.
[I 2026-07-20 13:41:43,188] Trial 518 finished with value: -0.13627016358466335 and parameters: {'error_threshold': 2.0, 'scalers': 'none', 'ratios': 'norm_ratio', 'imputers': 'mean', 'n_estimators': 450, 'learning_rate': 0.00011599012042942235, 'max_depth': 7, 'min_child_weight': 10, 'subsample': 0.9, 'colsample_bytree': 0.9, 'colsample_bylevel': 0.5, 'reg_alpha': 44.41567255371818, 'reg_lambda': 0.05449550631509774, 'gamma': 38.253098251347474}. Best is trial 472 with value: -0.13764739925059793.
[I 2026-07-20 13:41:43,498] Trial 519 finished with value: -0.13660222229685628 and parameters: {'error_threshold': 2.0, 'scalers': 'none', 'ratios': 'norm_ratio', 'imputers': 'mean', 'n_estimators': 350, 'learning_rate': 0.00011758583604176222, 'max_depth': 7, 'min_child_weight': 7, 'subsample': 0.9, 'colsample_bytree': 0.9, 'colsample_bylevel': 0.5, 'reg_alpha': 47.5202504490138, 'reg_lambda': 0.06286180607566934, 'gamma': 37.90531754714194}. Best is trial 472 with value: -0.13764739925059793.
[I 2026-07-20 13:41:43,775] Trial 520 finished with value: -0.13691056956690376 and parameters: {'error_threshold': 2.0, 'scalers': 'none', 'ratios': 'norm_ratio', 'imputers': 'mean', 'n_estimators': 450, 'learning_rate': 0.0001159329188611492, 'max_depth': 7, 'min_child_weight': 7, 'subsample': 0.9, 'colsample_bytree': 0.5, 'colsample_bylevel': 0.5, 'reg_alpha': 45.109986432471196, 'reg_lambda': 0.07264018928488453, 'gamma': 40.4720648466372}. Best is trial 472 with value: -0.13764739925059793.
[I 2026-07-20 13:41:44,581] Trial 521 finished with value: -0.1371000121353785 and parameters: {'error_threshold': 2.0, 'scalers': 'none', 'ratios': 'norm_ratio', 'imputers': 'mean', 'n_estimators': 400, 'learning_rate': 0.00010004679555284041, 'max_depth': 7, 'min_child_weight': 7, 'subsample': 0.9, 'colsample_bytree': 0.5, 'colsample_bylevel': 0.5, 'reg_alpha': 44.91177511652773, 'reg_lambda': 0.07854410129153062, 'gamma': 37.46980357589133}. Best is trial 472 with value: -0.13764739925059793.
[I 2026-07-20 13:41:44,811] Trial 522 finished with value: -0.13709940169983267 and parameters: {'error_threshold': 2.0, 'scalers': 'none', 'ratios': 'norm_ratio', 'imputers': 'mean', 'n_estimators': 350, 'learning_rate': 0.0001184045142518249, 'max_depth': 7, 'min_child_weight': 7, 'subsample': 0.9, 'colsample_bytree': 0.5, 'colsample_bylevel': 0.5, 'reg_alpha': 51.13237329077447, 'reg_lambda': 0.05623067159161424, 'gamma': 39.06416285845764}. Best is trial 472 with value: -0.13764739925059793.
[I 2026-07-20 13:41:45,089] Trial 523 finished with value: -0.13700864273522054 and parameters: {'error_threshold': 2.0, 'scalers': 'none', 'ratios': 'norm_ratio', 'imputers': 'mean', 'n_estimators': 450, 'learning_rate': 0.00010035656378934896, 'max_depth': 7, 'min_child_weight': 7, 'subsample': 0.9, 'colsample_bytree': 0.5, 'colsample_bylevel': 0.5, 'reg_alpha': 46.20376629777004, 'reg_lambda': 0.061432999362893516, 'gamma': 38.045971643127245}. Best is trial 472 with value: -0.13764739925059793.
[I 2026-07-20 13:41:45,981] Trial 524 finished with value: -0.13709602470249552 and parameters: {'error_threshold': 2.0, 'scalers': 'none', 'ratios': 'norm_ratio', 'imputers': 'mean', 'n_estimators': 400, 'learning_rate': 0.00010077948175121942, 'max_depth': 7, 'min_child_weight': 7, 'subsample': 0.9, 'colsample_bytree': 0.5, 'colsample_bylevel': 0.5, 'reg_alpha': 67.13800006795695, 'reg_lambda': 0.06241430779967946, 'gamma': 35.24629828882716}. Best is trial 472 with value: -0.13764739925059793.
[I 2026-07-20 13:41:47,922] Trial 525 finished with value: -0.13702514888941122 and parameters: {'error_threshold': 2.0, 'scalers': 'none', 'ratios': 'norm_ratio', 'imputers': 'mean', 'n_estimators': 400, 'learning_rate': 0.00011385198352692813, 'max_depth': 7, 'min_child_weight': 7, 'subsample': 0.9, 'colsample_bytree': 0.5, 'colsample_bylevel': 0.5, 'reg_alpha': 75.88932824602166, 'reg_lambda': 0.05852689467739809, 'gamma': 38.40429691934885}. Best is trial 472 with value: -0.13764739925059793.
[I 2026-07-20 13:41:48,759] Trial 526 finished with value: -0.1371767359381891 and parameters: {'error_threshold': 2.25, 'scalers': 'none', 'ratios': 'norm_ratio', 'imputers': 'mean', 'n_estimators': 350, 'learning_rate': 0.00010005965878021523, 'max_depth': 7, 'min_child_weight': 7, 'subsample': 0.9, 'colsample_bytree': 0.5, 'colsample_bylevel': 0.5, 'reg_alpha': 20.599311171588333, 'reg_lambda': 0.2719898224556485, 'gamma': 25.556078945653308}. Best is trial 472 with value: -0.13764739925059793.
[I 2026-07-20 13:41:48,925] Trial 527 finished with value: -0.13732485239895034 and parameters: {'error_threshold': 2.25, 'scalers': 'none', 'ratios': 'norm_ratio', 'imputers': 'mean', 'n_estimators': 250, 'learning_rate': 0.00010127547029002641, 'max_depth': 7, 'min_child_weight': 7, 'subsample': 0.9, 'colsample_bytree': 0.5, 'colsample_bylevel': 0.5, 'reg_alpha': 63.77819455715075, 'reg_lambda': 0.07788179546449253, 'gamma': 16.1958672802801}. Best is trial 472 with value: -0.13764739925059793.
[I 2026-07-20 13:41:49,124] Trial 528 finished with value: -0.13726311724885396 and parameters: {'error_threshold': 2.25, 'scalers': 'none', 'ratios': 'norm_ratio', 'imputers': 'mean', 'n_estimators': 300, 'learning_rate': 0.00010288253311281462, 'max_depth': 7, 'min_child_weight': 6, 'subsample': 0.9, 'colsample_bytree': 0.5, 'colsample_bylevel': 0.5, 'reg_alpha': 65.88203160377434, 'reg_lambda': 0.0917121099341622, 'gamma': 23.924108017260885}. Best is trial 472 with value: -0.13764739925059793.
[I 2026-07-20 13:41:49,728] Trial 529 finished with value: -0.13728315407198735 and parameters: {'error_threshold': 2.25, 'scalers': 'none', 'ratios': 'norm_ratio', 'imputers': 'mean', 'n_estimators': 300, 'learning_rate': 0.0001014492511762514, 'max_depth': 7, 'min_child_weight': 6, 'subsample': 0.9, 'colsample_bytree': 0.5, 'colsample_bylevel': 0.5, 'reg_alpha': 18.628200918457757, 'reg_lambda': 0.27871009991135615, 'gamma': 16.602668458161926}. Best is trial 472 with value: -0.13764739925059793.
[I 2026-07-20 13:41:49,885] Trial 530 finished with value: -0.13730589892310666 and parameters: {'error_threshold': 2.25, 'scalers': 'none', 'ratios': 'norm_ratio', 'imputers': 'mean', 'n_estimators': 250, 'learning_rate': 0.00010087467098548855, 'max_depth': 6, 'min_child_weight': 6, 'subsample': 0.9, 'colsample_bytree': 0.5, 'colsample_bylevel': 0.5, 'reg_alpha': 21.8036591786104, 'reg_lambda': 0.29301095660337084, 'gamma': 22.824724718852927}. Best is trial 472 with value: -0.13764739925059793.
[I 2026-07-20 13:41:50,037] Trial 531 finished with value: -0.13732830725483977 and parameters: {'error_threshold': 2.25, 'scalers': 'none', 'ratios': 'norm_ratio', 'imputers': 'mean', 'n_estimators': 250, 'learning_rate': 0.00010045127881784441, 'max_depth': 6, 'min_child_weight': 6, 'subsample': 0.9, 'colsample_bytree': 0.5, 'colsample_bylevel': 0.5, 'reg_alpha': 69.99127278872803, 'reg_lambda': 0.2770916152035283, 'gamma': 17.392654681622723}. Best is trial 472 with value: -0.13764739925059793.
[I 2026-07-20 13:41:50,752] Trial 532 finished with value: -0.13716686436572736 and parameters: {'error_threshold': 2.25, 'scalers': 'none', 'ratios': 'norm_ratio', 'imputers': 'mean', 'n_estimators': 250, 'learning_rate': 0.00011853222166178277, 'max_depth': 7, 'min_child_weight': 6, 'subsample': 0.9, 'colsample_bytree': 0.5, 'colsample_bylevel': 0.5, 'reg_alpha': 1.0015432329639694e-06, 'reg_lambda': 0.29392209022247556, 'gamma': 19.269983635045698}. Best is trial 472 with value: -0.13764739925059793.
[I 2026-07-20 13:41:52,131] Trial 533 finished with value: -0.13724480414576593 and parameters: {'error_threshold': 2.25, 'scalers': 'none', 'ratios': 'norm_ratio', 'imputers': 'mean', 'n_estimators': 250, 'learning_rate': 0.00011849925303761472, 'max_depth': 6, 'min_child_weight': 6, 'subsample': 0.9, 'colsample_bytree': 0.5, 'colsample_bylevel': 0.5, 'reg_alpha': 20.90110418769873, 'reg_lambda': 0.32007502387268216, 'gamma': 19.216886857115117}. Best is trial 472 with value: -0.13764739925059793.
[I 2026-07-20 13:41:52,666] Trial 534 finished with value: -0.1373239496704951 and parameters: {'error_threshold': 2.25, 'scalers': 'none', 'ratios': 'norm_ratio', 'imputers': 'mean', 'n_estimators': 250, 'learning_rate': 0.00010026326917872061, 'max_depth': 6, 'min_child_weight': 6, 'subsample': 0.9, 'colsample_bytree': 0.5, 'colsample_bylevel': 0.5, 'reg_alpha': 95.58981127627221, 'reg_lambda': 0.08899583311222614, 'gamma': 14.695705680676868}. Best is trial 472 with value: -0.13764739925059793.
