[I 2026-07-20 13:42:57,209] Trial 639 finished with value: -0.137402030955442 and parameters: {'error_threshold': 2.75, 'scalers': 'none', 'ratios': 'norm_ratio', 'imputers': 'median', 'n_estimators': 100, 'learning_rate': 0.00016288394358024945, 'max_depth': 8, 'min_child_weight': 3, 'subsample': 1.0, 'colsample_bytree': 0.5, 'colsample_bylevel': 0.5, 'reg_alpha': 18.615930005109956, 'reg_lambda': 0.0003791405301574326, 'gamma': 18.16563476364284}. Best is trial 472 with value: -0.13764739925059793.
[I 2026-07-20 13:42:57,219] Using an existing study with name 'final_predictive_mean_study' instead of creating a new one.
[W 2026-07-20 13:42:58,389] Trial 12 failed with parameters: {'error_threshold': 2.5, 'scalers': 'standard', 'ratios': 'log_ratio', 'imputers': 'none', 'n_estimators': 650, 'learning_rate': 0.0012806763603244024, 'max_depth': 5, 'min_child_weight': 5, 'subsample': 0.7, 'colsample_bytree': 0.7, 'colsample_bylevel': 0.5, 'reg_alpha': 6.739062600561649, 'reg_lambda': 30.030382712253033, 'gamma': 11.753534409984235} because of the following error: InvalidParameterError("The 'scoring' parameter of cross_val_score must be a str among {'mutual_info_score', 'd2_log_loss_score', 'neg_negative_likelihood_ratio', 'top_k_accuracy', 'roc_auc_ovo_weighted', 'd2_absolute_error_score', 'normalized_mutual_info_score', 'jaccard_weighted', 'jaccard', 'adjusted_mutual_info_score', 'neg_max_error', 'neg_mean_absolute_percentage_error', 'neg_mean_poisson_deviance', 'neg_root_mean_squared_log_error', 'precision', 'roc_auc', 'homogeneity_score', 'neg_brier_score', 'roc_auc_ovr_weighted', 'f1_macro', 'neg_mean_squared_log_error', 'jaccard_macro', 'jaccard_samples', 'f1_samples', 'recall', 'neg_root_mean_squared_error', 'roc_auc_ovo', 'matthews_corrcoef', 'recall_micro', 'fowlkes_mallows_score', 'v_measure_score', 'recall_weighted', 'neg_mean_squared_error', 'f1_weighted', 'precision_micro', 'average_precision', 'balanced_accuracy', 'neg_mean_absolute_error', 'f1', 'f1_micro', 'neg_median_absolute_error', 'positive_likelihood_ratio', 'recall_macro', 'jaccard_micro', 'neg_mean_gamma_deviance', 'r2', 'recall_samples', 'rand_score', 'explained_variance', 'roc_auc_ovr', 'precision_weighted', 'neg_log_loss', 'adjusted_rand_score', 'completeness_score', 'accuracy', 'precision_macro', 'precision_samples', 'd2_brier_score'}, a callable or None. Got 'root_mean_squared_error' instead.").
Traceback (most recent call last):
  File "/bsuscratch/alexanderemert/miniforge3/envs/starform-alex/lib/python3.14/site-packages/optuna/study/_optimize.py", line 206, in _run_trial
    value_or_values = func(trial)
  File "/bsuhome/alexanderemert/Research/Star-Formation-Research-Project-2026/pipeline/scripts/optuna/final_preds_and_models/optuna_search_mult_quant_reg.py", line 231, in objective
    scores = cross_val_score(model_pipe, X_train, y_train, scoring='root_mean_squared_error', cv=6, n_jobs=6)
  File "/bsuscratch/alexanderemert/miniforge3/envs/starform-alex/lib/python3.14/site-packages/sklearn/utils/_param_validation.py", line 208, in wrapper
    validate_parameter_constraints(
    ~~~~~~~~~~~~~~~~~~~~~~~~~~~~~~^
        parameter_constraints, params, caller_name=func.__qualname__
        ^^^^^^^^^^^^^^^^^^^^^^^^^^^^^^^^^^^^^^^^^^^^^^^^^^^^^^^^^^^^
    )
    ^
  File "/bsuscratch/alexanderemert/miniforge3/envs/starform-alex/lib/python3.14/site-packages/sklearn/utils/_param_validation.py", line 98, in validate_parameter_constraints
    raise InvalidParameterError(
    ...<2 lines>...
    )
sklearn.utils._param_validation.InvalidParameterError: The 'scoring' parameter of cross_val_score must be a str among {'mutual_info_score', 'd2_log_loss_score', 'neg_negative_likelihood_ratio', 'top_k_accuracy', 'roc_auc_ovo_weighted', 'd2_absolute_error_score', 'normalized_mutual_info_score', 'jaccard_weighted', 'jaccard', 'adjusted_mutual_info_score', 'neg_max_error', 'neg_mean_absolute_percentage_error', 'neg_mean_poisson_deviance', 'neg_root_mean_squared_log_error', 'precision', 'roc_auc', 'homogeneity_score', 'neg_brier_score', 'roc_auc_ovr_weighted', 'f1_macro', 'neg_mean_squared_log_error', 'jaccard_macro', 'jaccard_samples', 'f1_samples', 'recall', 'neg_root_mean_squared_error', 'roc_auc_ovo', 'matthews_corrcoef', 'recall_micro', 'fowlkes_mallows_score', 'v_measure_score', 'recall_weighted', 'neg_mean_squared_error', 'f1_weighted', 'precision_micro', 'average_precision', 'balanced_accuracy', 'neg_mean_absolute_error', 'f1', 'f1_micro', 'neg_median_absolute_error', 'positive_likelihood_ratio', 'recall_macro', 'jaccard_micro', 'neg_mean_gamma_deviance', 'r2', 'recall_samples', 'rand_score', 'explained_variance', 'roc_auc_ovr', 'precision_weighted', 'neg_log_loss', 'adjusted_rand_score', 'completeness_score', 'accuracy', 'precision_macro', 'precision_samples', 'd2_brier_score'}, a callable or None. Got 'root_mean_squared_error' instead.
[W 2026-07-20 13:42:58,396] Trial 12 failed with value None.
[W 2026-07-20 13:42:58,764] Trial 14 failed with parameters: {'error_threshold': 4.0, 'scalers': 'none', 'ratios': 'norm_ratio', 'imputers': 'mean', 'n_estimators': 750, 'learning_rate': 0.00020781840550509562, 'max_depth': 8, 'min_child_weight': 7, 'subsample': 0.5, 'colsample_bytree': 0.6, 'colsample_bylevel': 0.6, 'reg_alpha': 69.12705073213684, 'reg_lambda': 0.0045545782533693395, 'gamma': 0.0002727808406316053} because of the following error: InvalidParameterError("The 'scoring' parameter of cross_val_score must be a str among {'mutual_info_score', 'd2_log_loss_score', 'neg_negative_likelihood_ratio', 'top_k_accuracy', 'roc_auc_ovo_weighted', 'd2_absolute_error_score', 'normalized_mutual_info_score', 'jaccard_weighted', 'jaccard', 'adjusted_mutual_info_score', 'neg_max_error', 'neg_mean_absolute_percentage_error', 'neg_mean_poisson_deviance', 'neg_root_mean_squared_log_error', 'precision', 'roc_auc', 'homogeneity_score', 'neg_brier_score', 'roc_auc_ovr_weighted', 'f1_macro', 'neg_mean_squared_log_error', 'jaccard_macro', 'jaccard_samples', 'f1_samples', 'recall', 'neg_root_mean_squared_error', 'roc_auc_ovo', 'matthews_corrcoef', 'recall_micro', 'fowlkes_mallows_score', 'v_measure_score', 'recall_weighted', 'neg_mean_squared_error', 'f1_weighted', 'precision_micro', 'average_precision', 'balanced_accuracy', 'neg_mean_absolute_error', 'f1', 'f1_micro', 'neg_median_absolute_error', 'positive_likelihood_ratio', 'recall_macro', 'jaccard_micro', 'neg_mean_gamma_deviance', 'r2', 'recall_samples', 'rand_score', 'explained_variance', 'roc_auc_ovr', 'precision_weighted', 'neg_log_loss', 'adjusted_rand_score', 'completeness_score', 'accuracy', 'precision_macro', 'precision_samples', 'd2_brier_score'}, a callable or None. Got 'root_mean_squared_error' instead.").
Traceback (most recent call last):
  File "/bsuscratch/alexanderemert/miniforge3/envs/starform-alex/lib/python3.14/site-packages/optuna/study/_optimize.py", line 206, in _run_trial
    value_or_values = func(trial)
  File "/bsuhome/alexanderemert/Research/Star-Formation-Research-Project-2026/pipeline/scripts/optuna/final_preds_and_models/optuna_search_mult_quant_reg.py", line 231, in objective
    scores = cross_val_score(model_pipe, X_train, y_train, scoring='root_mean_squared_error', cv=6, n_jobs=6)
  File "/bsuscratch/alexanderemert/miniforge3/envs/starform-alex/lib/python3.14/site-packages/sklearn/utils/_param_validation.py", line 208, in wrapper
    validate_parameter_constraints(
    ~~~~~~~~~~~~~~~~~~~~~~~~~~~~~~^
        parameter_constraints, params, caller_name=func.__qualname__
        ^^^^^^^^^^^^^^^^^^^^^^^^^^^^^^^^^^^^^^^^^^^^^^^^^^^^^^^^^^^^
    )
    ^
  File "/bsuscratch/alexanderemert/miniforge3/envs/starform-alex/lib/python3.14/site-packages/sklearn/utils/_param_validation.py", line 98, in validate_parameter_constraints
    raise InvalidParameterError(
    ...<2 lines>...
    )
sklearn.utils._param_validation.InvalidParameterError: The 'scoring' parameter of cross_val_score must be a str among {'mutual_info_score', 'd2_log_loss_score', 'neg_negative_likelihood_ratio', 'top_k_accuracy', 'roc_auc_ovo_weighted', 'd2_absolute_error_score', 'normalized_mutual_info_score', 'jaccard_weighted', 'jaccard', 'adjusted_mutual_info_score', 'neg_max_error', 'neg_mean_absolute_percentage_error', 'neg_mean_poisson_deviance', 'neg_root_mean_squared_log_error', 'precision', 'roc_auc', 'homogeneity_score', 'neg_brier_score', 'roc_auc_ovr_weighted', 'f1_macro', 'neg_mean_squared_log_error', 'jaccard_macro', 'jaccard_samples', 'f1_samples', 'recall', 'neg_root_mean_squared_error', 'roc_auc_ovo', 'matthews_corrcoef', 'recall_micro', 'fowlkes_mallows_score', 'v_measure_score', 'recall_weighted', 'neg_mean_squared_error', 'f1_weighted', 'precision_micro', 'average_precision', 'balanced_accuracy', 'neg_mean_absolute_error', 'f1', 'f1_micro', 'neg_median_absolute_error', 'positive_likelihood_ratio', 'recall_macro', 'jaccard_micro', 'neg_mean_gamma_deviance', 'r2', 'recall_samples', 'rand_score', 'explained_variance', 'roc_auc_ovr', 'precision_weighted', 'neg_log_loss', 'adjusted_rand_score', 'completeness_score', 'accuracy', 'precision_macro', 'precision_samples', 'd2_brier_score'}, a callable or None. Got 'root_mean_squared_error' instead.
[W 2026-07-20 13:42:58,765] Trial 14 failed with value None.
[W 2026-07-20 13:42:59,004] Trial 11 failed with parameters: {'error_threshold': 2.75, 'scalers': 'standard', 'ratios': 'log_ratio', 'imputers': 'mean', 'n_estimators': 2850, 'learning_rate': 0.03871808281572622, 'max_depth': 8, 'min_child_weight': 4, 'subsample': 1.0, 'colsample_bytree': 0.8, 'colsample_bylevel': 1.0, 'reg_alpha': 6.880596653005235e-06, 'reg_lambda': 0.00010298183575559408, 'gamma': 74.44667459250587} because of the following error: InvalidParameterError("The 'scoring' parameter of cross_val_score must be a str among {'mutual_info_score', 'd2_log_loss_score', 'neg_negative_likelihood_ratio', 'top_k_accuracy', 'roc_auc_ovo_weighted', 'd2_absolute_error_score', 'normalized_mutual_info_score', 'jaccard_weighted', 'jaccard', 'adjusted_mutual_info_score', 'neg_max_error', 'neg_mean_absolute_percentage_error', 'neg_mean_poisson_deviance', 'neg_root_mean_squared_log_error', 'precision', 'roc_auc', 'homogeneity_score', 'neg_brier_score', 'roc_auc_ovr_weighted', 'f1_macro', 'neg_mean_squared_log_error', 'jaccard_macro', 'jaccard_samples', 'f1_samples', 'recall', 'neg_root_mean_squared_error', 'roc_auc_ovo', 'matthews_corrcoef', 'recall_micro', 'fowlkes_mallows_score', 'v_measure_score', 'recall_weighted', 'neg_mean_squared_error', 'f1_weighted', 'precision_micro', 'average_precision', 'balanced_accuracy', 'neg_mean_absolute_error', 'f1', 'f1_micro', 'neg_median_absolute_error', 'positive_likelihood_ratio', 'recall_macro', 'jaccard_micro', 'neg_mean_gamma_deviance', 'r2', 'recall_samples', 'rand_score', 'explained_variance', 'roc_auc_ovr', 'precision_weighted', 'neg_log_loss', 'adjusted_rand_score', 'completeness_score', 'accuracy', 'precision_macro', 'precision_samples', 'd2_brier_score'}, a callable or None. Got 'root_mean_squared_error' instead.").
Traceback (most recent call last):
  File "/bsuscratch/alexanderemert/miniforge3/envs/starform-alex/lib/python3.14/site-packages/optuna/study/_optimize.py", line 206, in _run_trial
    value_or_values = func(trial)
  File "/bsuhome/alexanderemert/Research/Star-Formation-Research-Project-2026/pipeline/scripts/optuna/final_preds_and_models/optuna_search_mult_quant_reg.py", line 231, in objective
    scores = cross_val_score(model_pipe, X_train, y_train, scoring='root_mean_squared_error', cv=6, n_jobs=6)
  File "/bsuscratch/alexanderemert/miniforge3/envs/starform-alex/lib/python3.14/site-packages/sklearn/utils/_param_validation.py", line 208, in wrapper
    validate_parameter_constraints(
    ~~~~~~~~~~~~~~~~~~~~~~~~~~~~~~^
        parameter_constraints, params, caller_name=func.__qualname__
        ^^^^^^^^^^^^^^^^^^^^^^^^^^^^^^^^^^^^^^^^^^^^^^^^^^^^^^^^^^^^
    )
    ^
  File "/bsuscratch/alexanderemert/miniforge3/envs/starform-alex/lib/python3.14/site-packages/sklearn/utils/_param_validation.py", line 98, in validate_parameter_constraints
    raise InvalidParameterError(
    ...<2 lines>...
    )
sklearn.utils._param_validation.InvalidParameterError: The 'scoring' parameter of cross_val_score must be a str among {'mutual_info_score', 'd2_log_loss_score', 'neg_negative_likelihood_ratio', 'top_k_accuracy', 'roc_auc_ovo_weighted', 'd2_absolute_error_score', 'normalized_mutual_info_score', 'jaccard_weighted', 'jaccard', 'adjusted_mutual_info_score', 'neg_max_error', 'neg_mean_absolute_percentage_error', 'neg_mean_poisson_deviance', 'neg_root_mean_squared_log_error', 'precision', 'roc_auc', 'homogeneity_score', 'neg_brier_score', 'roc_auc_ovr_weighted', 'f1_macro', 'neg_mean_squared_log_error', 'jaccard_macro', 'jaccard_samples', 'f1_samples', 'recall', 'neg_root_mean_squared_error', 'roc_auc_ovo', 'matthews_corrcoef', 'recall_micro', 'fowlkes_mallows_score', 'v_measure_score', 'recall_weighted', 'neg_mean_squared_error', 'f1_weighted', 'precision_micro', 'average_precision', 'balanced_accuracy', 'neg_mean_absolute_error', 'f1', 'f1_micro', 'neg_median_absolute_error', 'positive_likelihood_ratio', 'recall_macro', 'jaccard_micro', 'neg_mean_gamma_deviance', 'r2', 'recall_samples', 'rand_score', 'explained_variance', 'roc_auc_ovr', 'precision_weighted', 'neg_log_loss', 'adjusted_rand_score', 'completeness_score', 'accuracy', 'precision_macro', 'precision_samples', 'd2_brier_score'}, a callable or None. Got 'root_mean_squared_error' instead.
[W 2026-07-20 13:42:59,006] Trial 11 failed with value None.
[W 2026-07-20 13:43:00,723] Trial 9 failed with parameters: {'error_threshold': 3.75, 'scalers': 'robust', 'ratios': 'log_ratio', 'imputers': 'mean', 'n_estimators': 2850, 'learning_rate': 0.00022089550324085782, 'max_depth': 3, 'min_child_weight': 4, 'subsample': 0.5, 'colsample_bytree': 0.7, 'colsample_bylevel': 0.9, 'reg_alpha': 0.013258231123864777, 'reg_lambda': 0.001641612515744119, 'gamma': 4.196783287923233e-05} because of the following error: InvalidParameterError("The 'scoring' parameter of cross_val_score must be a str among {'mutual_info_score', 'd2_log_loss_score', 'neg_negative_likelihood_ratio', 'top_k_accuracy', 'roc_auc_ovo_weighted', 'd2_absolute_error_score', 'normalized_mutual_info_score', 'jaccard_weighted', 'jaccard', 'adjusted_mutual_info_score', 'neg_max_error', 'neg_mean_absolute_percentage_error', 'neg_mean_poisson_deviance', 'neg_root_mean_squared_log_error', 'precision', 'roc_auc', 'homogeneity_score', 'neg_brier_score', 'roc_auc_ovr_weighted', 'f1_macro', 'neg_mean_squared_log_error', 'jaccard_macro', 'jaccard_samples', 'f1_samples', 'recall', 'neg_root_mean_squared_error', 'roc_auc_ovo', 'matthews_corrcoef', 'recall_micro', 'fowlkes_mallows_score', 'v_measure_score', 'recall_weighted', 'neg_mean_squared_error', 'f1_weighted', 'precision_micro', 'average_precision', 'balanced_accuracy', 'neg_mean_absolute_error', 'f1', 'f1_micro', 'neg_median_absolute_error', 'positive_likelihood_ratio', 'recall_macro', 'jaccard_micro', 'neg_mean_gamma_deviance', 'r2', 'recall_samples', 'rand_score', 'explained_variance', 'roc_auc_ovr', 'precision_weighted', 'neg_log_loss', 'adjusted_rand_score', 'completeness_score', 'accuracy', 'precision_macro', 'precision_samples', 'd2_brier_score'}, a callable or None. Got 'root_mean_squared_error' instead.").
Traceback (most recent call last):
  File "/bsuscratch/alexanderemert/miniforge3/envs/starform-alex/lib/python3.14/site-packages/optuna/study/_optimize.py", line 206, in _run_trial
    value_or_values = func(trial)
  File "/bsuhome/alexanderemert/Research/Star-Formation-Research-Project-2026/pipeline/scripts/optuna/final_preds_and_models/optuna_search_mult_quant_reg.py", line 231, in objective
    scores = cross_val_score(model_pipe, X_train, y_train, scoring='root_mean_squared_error', cv=6, n_jobs=6)
  File "/bsuscratch/alexanderemert/miniforge3/envs/starform-alex/lib/python3.14/site-packages/sklearn/utils/_param_validation.py", line 208, in wrapper
    validate_parameter_constraints(
    ~~~~~~~~~~~~~~~~~~~~~~~~~~~~~~^
        parameter_constraints, params, caller_name=func.__qualname__
        ^^^^^^^^^^^^^^^^^^^^^^^^^^^^^^^^^^^^^^^^^^^^^^^^^^^^^^^^^^^^
    )
    ^
  File "/bsuscratch/alexanderemert/miniforge3/envs/starform-alex/lib/python3.14/site-packages/sklearn/utils/_param_validation.py", line 98, in validate_parameter_constraints
    raise InvalidParameterError(
    ...<2 lines>...
    )
sklearn.utils._param_validation.InvalidParameterError: The 'scoring' parameter of cross_val_score must be a str among {'mutual_info_score', 'd2_log_loss_score', 'neg_negative_likelihood_ratio', 'top_k_accuracy', 'roc_auc_ovo_weighted', 'd2_absolute_error_score', 'normalized_mutual_info_score', 'jaccard_weighted', 'jaccard', 'adjusted_mutual_info_score', 'neg_max_error', 'neg_mean_absolute_percentage_error', 'neg_mean_poisson_deviance', 'neg_root_mean_squared_log_error', 'precision', 'roc_auc', 'homogeneity_score', 'neg_brier_score', 'roc_auc_ovr_weighted', 'f1_macro', 'neg_mean_squared_log_error', 'jaccard_macro', 'jaccard_samples', 'f1_samples', 'recall', 'neg_root_mean_squared_error', 'roc_auc_ovo', 'matthews_corrcoef', 'recall_micro', 'fowlkes_mallows_score', 'v_measure_score', 'recall_weighted', 'neg_mean_squared_error', 'f1_weighted', 'precision_micro', 'average_precision', 'balanced_accuracy', 'neg_mean_absolute_error', 'f1', 'f1_micro', 'neg_median_absolute_error', 'positive_likelihood_ratio', 'recall_macro', 'jaccard_micro', 'neg_mean_gamma_deviance', 'r2', 'recall_samples', 'rand_score', 'explained_variance', 'roc_auc_ovr', 'precision_weighted', 'neg_log_loss', 'adjusted_rand_score', 'completeness_score', 'accuracy', 'precision_macro', 'precision_samples', 'd2_brier_score'}, a callable or None. Got 'root_mean_squared_error' instead.
[W 2026-07-20 13:43:00,725] Trial 9 failed with value None.
[W 2026-07-20 13:43:02,119] Trial 13 failed with parameters: {'error_threshold': 2.0, 'scalers': 'none', 'ratios': 'norm_ratio', 'imputers': 'median', 'n_estimators': 3000, 'learning_rate': 0.0030815045912346737, 'max_depth': 9, 'min_child_weight': 10, 'subsample': 0.5, 'colsample_bytree': 0.7, 'colsample_bylevel': 0.6, 'reg_alpha': 0.1278749674637007, 'reg_lambda': 0.016375333752194538, 'gamma': 0.4749088144639088} because of the following error: InvalidParameterError("The 'scoring' parameter of cross_val_score must be a str among {'mutual_info_score', 'd2_log_loss_score', 'neg_negative_likelihood_ratio', 'top_k_accuracy', 'roc_auc_ovo_weighted', 'd2_absolute_error_score', 'normalized_mutual_info_score', 'jaccard_weighted', 'jaccard', 'adjusted_mutual_info_score', 'neg_max_error', 'neg_mean_absolute_percentage_error', 'neg_mean_poisson_deviance', 'neg_root_mean_squared_log_error', 'precision', 'roc_auc', 'homogeneity_score', 'neg_brier_score', 'roc_auc_ovr_weighted', 'f1_macro', 'neg_mean_squared_log_error', 'jaccard_macro', 'jaccard_samples', 'f1_samples', 'recall', 'neg_root_mean_squared_error', 'roc_auc_ovo', 'matthews_corrcoef', 'recall_micro', 'fowlkes_mallows_score', 'v_measure_score', 'recall_weighted', 'neg_mean_squared_error', 'f1_weighted', 'precision_micro', 'average_precision', 'balanced_accuracy', 'neg_mean_absolute_error', 'f1', 'f1_micro', 'neg_median_absolute_error', 'positive_likelihood_ratio', 'recall_macro', 'jaccard_micro', 'neg_mean_gamma_deviance', 'r2', 'recall_samples', 'rand_score', 'explained_variance', 'roc_auc_ovr', 'precision_weighted', 'neg_log_loss', 'adjusted_rand_score', 'completeness_score', 'accuracy', 'precision_macro', 'precision_samples', 'd2_brier_score'}, a callable or None. Got 'root_mean_squared_error' instead.").
Traceback (most recent call last):
  File "/bsuscratch/alexanderemert/miniforge3/envs/starform-alex/lib/python3.14/site-packages/optuna/study/_optimize.py", line 206, in _run_trial
    value_or_values = func(trial)
  File "/bsuhome/alexanderemert/Research/Star-Formation-Research-Project-2026/pipeline/scripts/optuna/final_preds_and_models/optuna_search_mult_quant_reg.py", line 231, in objective
    scores = cross_val_score(model_pipe, X_train, y_train, scoring='root_mean_squared_error', cv=6, n_jobs=6)
  File "/bsuscratch/alexanderemert/miniforge3/envs/starform-alex/lib/python3.14/site-packages/sklearn/utils/_param_validation.py", line 208, in wrapper
    validate_parameter_constraints(
    ~~~~~~~~~~~~~~~~~~~~~~~~~~~~~~^
        parameter_constraints, params, caller_name=func.__qualname__
        ^^^^^^^^^^^^^^^^^^^^^^^^^^^^^^^^^^^^^^^^^^^^^^^^^^^^^^^^^^^^
    )
    ^
  File "/bsuscratch/alexanderemert/miniforge3/envs/starform-alex/lib/python3.14/site-packages/sklearn/utils/_param_validation.py", line 98, in validate_parameter_constraints
    raise InvalidParameterError(
    ...<2 lines>...
    )
sklearn.utils._param_validation.InvalidParameterError: The 'scoring' parameter of cross_val_score must be a str among {'mutual_info_score', 'd2_log_loss_score', 'neg_negative_likelihood_ratio', 'top_k_accuracy', 'roc_auc_ovo_weighted', 'd2_absolute_error_score', 'normalized_mutual_info_score', 'jaccard_weighted', 'jaccard', 'adjusted_mutual_info_score', 'neg_max_error', 'neg_mean_absolute_percentage_error', 'neg_mean_poisson_deviance', 'neg_root_mean_squared_log_error', 'precision', 'roc_auc', 'homogeneity_score', 'neg_brier_score', 'roc_auc_ovr_weighted', 'f1_macro', 'neg_mean_squared_log_error', 'jaccard_macro', 'jaccard_samples', 'f1_samples', 'recall', 'neg_root_mean_squared_error', 'roc_auc_ovo', 'matthews_corrcoef', 'recall_micro', 'fowlkes_mallows_score', 'v_measure_score', 'recall_weighted', 'neg_mean_squared_error', 'f1_weighted', 'precision_micro', 'average_precision', 'balanced_accuracy', 'neg_mean_absolute_error', 'f1', 'f1_micro', 'neg_median_absolute_error', 'positive_likelihood_ratio', 'recall_macro', 'jaccard_micro', 'neg_mean_gamma_deviance', 'r2', 'recall_samples', 'rand_score', 'explained_variance', 'roc_auc_ovr', 'precision_we