[I 2026-07-20 15:25:57,596] Trial 556 finished with value: -0.1718028733958836 and parameters: {'error_threshold': 2.5, 'scalers': 'standard', 'ratios': 'norm_ratio', 'imputers': 'mean', 'n_estimators': 2100, 'learning_rate': 0.347353925979158, 'max_depth': 8, 'min_child_weight': 1, 'subsample': 0.5, 'colsample_bytree': 0.6, 'colsample_bylevel': 0.7, 'reg_alpha': 2.0553132137283385, 'reg_lambda': 0.0030406585613686967, 'gamma': 1.3776205692037737}. Best is trial 513 with value: -0.8430338904698972.
[I 2026-07-20 15:26:01,631] Trial 551 finished with value: -0.40528684116002006 and parameters: {'error_threshold': 2.5, 'scalers': 'standard', 'ratios': 'norm_ratio', 'imputers': 'mean', 'n_estimators': 2150, 'learning_rate': 0.3199561714352806, 'max_depth': 8, 'min_child_weight': 1, 'subsample': 0.5, 'colsample_bytree': 0.5, 'colsample_bylevel': 0.7, 'reg_alpha': 2.373459537656663, 'reg_lambda': 2.523632560704047e-06, 'gamma': 0.0028230728949371524}. Best is trial 513 with value: -0.8430338904698972.
[I 2026-07-20 15:26:06,395] Trial 554 finished with value: -0.47426351121121485 and parameters: {'error_threshold': 2.5, 'scalers': 'standard', 'ratios': 'norm_ratio', 'imputers': 'mean', 'n_estimators': 2150, 'learning_rate': 0.32883256377049874, 'max_depth': 9, 'min_child_weight': 1, 'subsample': 0.5, 'colsample_bytree': 0.5, 'colsample_bylevel': 0.7, 'reg_alpha': 2.3543699391044006, 'reg_lambda': 0.002051648679155801, 'gamma': 2.3556725189509876e-05}. Best is trial 513 with value: -0.8430338904698972.
[I 2026-07-20 15:26:15,224] Trial 552 finished with value: -0.43921846626508443 and parameters: {'error_threshold': 2.5, 'scalers': 'standard', 'ratios': 'norm_ratio', 'imputers': 'mean', 'n_estimators': 2150, 'learning_rate': 0.325382887399038, 'max_depth': 9, 'min_child_weight': 1, 'subsample': 0.5, 'colsample_bytree': 0.8, 'colsample_bylevel': 0.7, 'reg_alpha': 0.6267573446729403, 'reg_lambda': 2.689250615416816e-06, 'gamma': 0.0019939075925887125}. Best is trial 513 with value: -0.8430338904698972.
[I 2026-07-20 15:26:19,595] Trial 555 finished with value: -0.44573809872916215 and parameters: {'error_threshold': 2.5, 'scalers': 'standard', 'ratios': 'norm_ratio', 'imputers': 'mean', 'n_estimators': 2150, 'learning_rate': 0.33940815464038726, 'max_depth': 9, 'min_child_weight': 1, 'subsample': 0.5, 'colsample_bytree': 0.5, 'colsample_bylevel': 0.7, 'reg_alpha': 2.633745769975501, 'reg_lambda': 0.0013509421884973227, 'gamma': 2.2457663249127046e-05}. Best is trial 513 with value: -0.8430338904698972.
[I 2026-07-20 15:27:44,911] Trial 557 finished with value: -0.43663934913898855 and parameters: {'error_threshold': 2.5, 'scalers': 'standard', 'ratios': 'norm_ratio', 'imputers': 'mean', 'n_estimators': 2050, 'learning_rate': 0.3348015174909512, 'max_depth': 8, 'min_child_weight': 1, 'subsample': 0.5, 'colsample_bytree': 0.5, 'colsample_bylevel': 0.7, 'reg_alpha': 2.395180652842191, 'reg_lambda': 0.0027996996935919878, 'gamma': 0.00014527873829215656}. Best is trial 513 with value: -0.8430338904698972.
[I 2026-07-20 15:27:54,940] Trial 561 finished with value: -0.18554403588015891 and parameters: {'error_threshold': 2.75, 'scalers': 'standard', 'ratios': 'norm_ratio', 'imputers': 'mean', 'n_estimators': 600, 'learning_rate': 0.0007772851921013027, 'max_depth': 8, 'min_child_weight': 1, 'subsample': 0.5, 'colsample_bytree': 0.5, 'colsample_bylevel': 0.7, 'reg_alpha': 2.3513322173672635, 'reg_lambda': 4.5876829826759285e-06, 'gamma': 2.7272311178496134e-05}. Best is trial 513 with value: -0.8430338904698972.
[I 2026-07-20 15:28:21,908] Trial 558 finished with value: -0.45319966806595785 and parameters: {'error_threshold': 2.75, 'scalers': 'standard', 'ratios': 'norm_ratio', 'imputers': 'mean', 'n_estimators': 2150, 'learning_rate': 0.3546586589418347, 'max_depth': 8, 'min_child_weight': 1, 'subsample': 0.5, 'colsample_bytree': 0.6, 'colsample_bylevel': 0.7, 'reg_alpha': 2.2990490944391753, 'reg_lambda': 0.0014650237225996986, 'gamma': 8.325028212046736e-05}. Best is trial 513 with value: -0.8430338904698972.
[I 2026-07-20 15:28:26,568] Trial 559 finished with value: -0.46622429294731704 and parameters: {'error_threshold': 2.75, 'scalers': 'standard', 'ratios': 'norm_ratio', 'imputers': 'mean', 'n_estimators': 2150, 'learning_rate': 0.3538232594758467, 'max_depth': 8, 'min_child_weight': 1, 'subsample': 0.5, 'colsample_bytree': 0.5, 'colsample_bylevel': 0.7, 'reg_alpha': 2.159395744389969, 'reg_lambda': 0.0028727803928770956, 'gamma': 0.00014835230841534104}. Best is trial 513 with value: -0.8430338904698972.
[I 2026-07-20 15:28:32,739] Trial 560 finished with value: -0.9539200882804951 and parameters: {'error_threshold': 2.75, 'scalers': 'standard', 'ratios': 'norm_ratio', 'imputers': 'mean', 'n_estimators': 2150, 'learning_rate': 0.4172554733457456, 'max_depth': 8, 'min_child_weight': 1, 'subsample': 0.5, 'colsample_bytree': 0.5, 'colsample_bylevel': 0.7, 'reg_alpha': 0.6145321909690223, 'reg_lambda': 35.505813108047526, 'gamma': 0.0001441205137402646}. Best is trial 560 with value: -0.9539200882804951.
[I 2026-07-20 15:28:44,443] Trial 562 finished with value: -0.5401044726305685 and parameters: {'error_threshold': 2.75, 'scalers': 'standard', 'ratios': 'norm_ratio', 'imputers': 'mean', 'n_estimators': 2300, 'learning_rate': 0.4252197229753564, 'max_depth': 8, 'min_child_weight': 1, 'subsample': 0.5, 'colsample_bytree': 0.5, 'colsample_bylevel': 0.7, 'reg_alpha': 0.631198850737669, 'reg_lambda': 0.0014448496586449506, 'gamma': 0.00014772104246333527}. Best is trial 560 with value: -0.9539200882804951.
[I 2026-07-20 15:28:57,273] Trial 563 finished with value: -0.6207856477524816 and parameters: {'error_threshold': 2.75, 'scalers': 'standard', 'ratios': 'norm_ratio', 'imputers': 'mean', 'n_estimators': 2300, 'learning_rate': 0.4222568923105988, 'max_depth': 8, 'min_child_weight': 1, 'subsample': 0.5, 'colsample_bytree': 0.5, 'colsample_bylevel': 0.7, 'reg_alpha': 1.476558459502826, 'reg_lambda': 0.001465125895432754, 'gamma': 8.375293050153782e-05}. Best is trial 560 with value: -0.9539200882804951.
[I 2026-07-20 15:29:02,960] Trial 564 finished with value: -0.6132257459420916 and parameters: {'error_threshold': 2.75, 'scalers': 'standard', 'ratios': 'norm_ratio', 'imputers': 'mean', 'n_estimators': 2050, 'learning_rate': 0.4224608731848422, 'max_depth': 8, 'min_child_weight': 1, 'subsample': 0.5, 'colsample_bytree': 0.5, 'colsample_bylevel': 0.7, 'reg_alpha': 1.5153371494165055, 'reg_lambda': 0.0014952486923281213, 'gamma': 4.427380356363688e-05}. Best is trial 560 with value: -0.9539200882804951.
[I 2026-07-20 15:30:38,402] Trial 565 finished with value: -0.5377829805839248 and parameters: {'error_threshold': 2.75, 'scalers': 'standard', 'ratios': 'norm_ratio', 'imputers': 'mean', 'n_estimators': 2300, 'learning_rate': 0.4248846143624715, 'max_depth': 8, 'min_child_weight': 1, 'subsample': 0.5, 'colsample_bytree': 0.5, 'colsample_bylevel': 0.7, 'reg_alpha': 0.6336520893586047, 'reg_lambda': 0.0014218333854527138, 'gamma': 8.522689902338654e-05}. Best is trial 560 with value: -0.9539200882804951.
[I 2026-07-20 15:30:56,763] Trial 566 finished with value: -0.6024193694356703 and parameters: {'error_threshold': 2.75, 'scalers': 'standard', 'ratios': 'norm_ratio', 'imputers': 'mean', 'n_estimators': 2300, 'learning_rate': 0.42058664425568726, 'max_depth': 8, 'min_child_weight': 1, 'subsample': 0.5, 'colsample_bytree': 0.5, 'colsample_bylevel': 0.8, 'reg_alpha': 1.4759010030121036, 'reg_lambda': 0.00013531997738696282, 'gamma': 4.1826473198218974e-05}. Best is trial 560 with value: -0.9539200882804951.
[I 2026-07-20 15:31:17,570] Trial 567 finished with value: -0.5103582420662377 and parameters: {'error_threshold': 2.75, 'scalers': 'standard', 'ratios': 'norm_ratio', 'imputers': 'mean', 'n_estimators': 2300, 'learning_rate': 0.42248341605562434, 'max_depth': 8, 'min_child_weight': 1, 'subsample': 0.5, 'colsample_bytree': 0.5, 'colsample_bylevel': 0.8, 'reg_alpha': 0.6040052002001775, 'reg_lambda': 0.0019209427925722022, 'gamma': 4.405720465199368e-05}. Best is trial 560 with value: -0.9539200882804951.
[I 2026-07-20 15:31:24,341] Trial 568 finished with value: -0.7999571119171377 and parameters: {'error_threshold': 2.25, 'scalers': 'standard', 'ratios': 'norm_ratio', 'imputers': 'mean', 'n_estimators': 2300, 'learning_rate': 0.4982210099923684, 'max_depth': 8, 'min_child_weight': 1, 'subsample': 0.5, 'colsample_bytree': 0.5, 'colsample_bylevel': 0.8, 'reg_alpha': 1.3766910775161443, 'reg_lambda': 0.0019442435895458067, 'gamma': 4.14998988263979e-05}. Best is trial 560 with value: -0.9539200882804951.
[I 2026-07-20 15:31:29,854] Trial 569 finished with value: -0.39805210989305717 and parameters: {'error_threshold': 2.75, 'scalers': 'standard', 'ratios': 'norm_ratio', 'imputers': 'mean', 'n_estimators': 2300, 'learning_rate': 0.2563004275501236, 'max_depth': 8, 'min_child_weight': 1, 'subsample': 0.5, 'colsample_bytree': 0.5, 'colsample_bylevel': 0.7, 'reg_alpha': 0.6318643598316145, 'reg_lambda': 0.00011520445762150402, 'gamma': 9.295285053243752e-05}. Best is trial 560 with value: -0.9539200882804951.
[I 2026-07-20 15:31:36,422] Trial 570 finished with value: -0.39907070423296126 and parameters: {'error_threshold': 2.75, 'scalers': 'standard', 'ratios': 'norm_ratio', 'imputers': 'mean', 'n_estimators': 2800, 'learning_rate': 0.23890303175796146, 'max_depth': 8, 'min_child_weight': 1, 'subsample': 0.5, 'colsample_bytree': 0.5, 'colsample_bylevel': 0.7, 'reg_alpha': 0.5781121809245789, 'reg_lambda': 5.8142759799296626e-05, 'gamma': 9.862126115493762e-05}. Best is trial 560 with value: -0.9539200882804951.
