[I 2026-07-21 10:00:22,468] Trial 308 finished with value: -0.5915524618670487 and parameters: {'error_threshold': 2.1, 'scalers': 'none', 'ratios': 'log_ratio', 'imputers': 'median', 'n_estimators': 2500, 'learning_rate': 0.00890333442639588, 'max_depth': 4, 'min_child_weight': 6, 'subsample': 0.6, 'colsample_bytree': 0.6, 'colsample_bylevel': 0.8, 'reg_alpha': 6.214938094772872e-06, 'reg_lambda': 9.349244239071193e-06, 'gamma': 2.062951640302637e-05}. Best is trial 117 with value: -0.5901931848144322.
/bsuhome/alexanderemert/Research/Star-Formation-Research-Project-2026/pipeline/scripts/optuna/final_preds_and_models/optuna_search_mult_quant_reg.py:161: UserWarning: The distribution is specified by [0.1, 5] and step=0.25, but the range is not divisible by `step`. It will be replaced with [0.1, 4.85].
  error_threshold = trial.suggest_float("error_threshold", 0.1, 5, step=0.25)
[I 2026-07-21 10:00:24,970] Trial 309 finished with value: -0.59177470442133 and parameters: {'error_threshold': 2.1, 'scalers': 'none', 'ratios': 'log_ratio', 'imputers': 'mean', 'n_estimators': 2500, 'learning_rate': 0.008621667868106477, 'max_depth': 4, 'min_child_weight': 6, 'subsample': 0.6, 'colsample_bytree': 0.6, 'colsample_bylevel': 0.8, 'reg_alpha': 4.9705449590458645e-06, 'reg_lambda': 9.022294704211278e-06, 'gamma': 2.1252719406883524e-05}. Best is trial 117 with value: -0.5901931848144322.
/bsuhome/alexanderemert/Research/Star-Formation-Research-Project-2026/pipeline/scripts/optuna/final_preds_and_models/optuna_search_mult_quant_reg.py:161: UserWarning: The distribution is specified by [0.1, 5] and step=0.25, but the range is not divisible by `step`. It will be replaced with [0.1, 4.85].
  error_threshold = trial.suggest_float("error_threshold", 0.1, 5, step=0.25)
[I 2026-07-21 10:00:27,730] Trial 310 finished with value: -0.5956555679067616 and parameters: {'error_threshold': 2.1, 'scalers': 'none', 'ratios': 'log_ratio', 'imputers': 'mean', 'n_estimators': 2500, 'learning_rate': 0.0034092055018971773, 'max_depth': 4, 'min_child_weight': 5, 'subsample': 0.6, 'colsample_bytree': 0.6, 'colsample_bylevel': 0.8, 'reg_alpha': 5.4858332196517855e-06, 'reg_lambda': 8.482189452797308e-06, 'gamma': 2.0286575624139275e-05}. Best is trial 117 with value: -0.5901931848144322.
/bsuhome/alexanderemert/Research/Star-Formation-Research-Project-2026/pipeline/scripts/optuna/final_preds_and_models/optuna_search_mult_quant_reg.py:161: UserWarning: The distribution is specified by [0.1, 5] and step=0.25, but the range is not divisible by `step`. It will be replaced with [0.1, 4.85].
  error_threshold = trial.suggest_float("error_threshold", 0.1, 5, step=0.25)
[I 2026-07-21 10:00:30,448] Trial 311 finished with value: -0.5930510827665868 and parameters: {'error_threshold': 2.1, 'scalers': 'none', 'ratios': 'log_ratio', 'imputers': 'mean', 'n_estimators': 2500, 'learning_rate': 0.003921717782284105, 'max_depth': 4, 'min_child_weight': 5, 'subsample': 0.6, 'colsample_bytree': 0.6, 'colsample_bylevel': 0.8, 'reg_alpha': 1.3895592682676473e-05, 'reg_lambda': 1.0984996720308737e-06, 'gamma': 2.0266997479709205e-05}. Best is trial 117 with value: -0.5901931848144322.
/bsuhome/alexanderemert/Research/Star-Formation-Research-Project-2026/pipeline/scripts/optuna/final_preds_and_models/optuna_search_mult_quant_reg.py:161: UserWarning: The distribution is specified by [0.1, 5] and step=0.25, but the range is not divisible by `step`. It will be replaced with [0.1, 4.85].
  error_threshold = trial.suggest_float("error_threshold", 0.1, 5, step=0.25)
[I 2026-07-21 10:00:33,067] Trial 312 finished with value: -0.5904252088539824 and parameters: {'error_threshold': 2.1, 'scalers': 'none', 'ratios': 'log_ratio', 'imputers': 'mean', 'n_estimators': 2550, 'learning_rate': 0.006658087816838824, 'max_depth': 4, 'min_child_weight': 5, 'subsample': 0.6, 'colsample_bytree': 0.6, 'colsample_bylevel': 0.8, 'reg_alpha': 5.8758933520977065e-06, 'reg_lambda': 1.132961589482988e-06, 'gamma': 2.1780760083760168e-05}. Best is trial 117 with value: -0.5901931848144322.
/bsuhome/alexanderemert/Research/Star-Formation-Research-Project-2026/pipeline/scripts/optuna/final_preds_and_models/optuna_search_mult_quant_reg.py:161: UserWarning: The distribution is specified by [0.1, 5] and step=0.25, but the range is not divisible by `step`. It will be replaced with [0.1, 4.85].
  error_threshold = trial.suggest_float("error_threshold", 0.1, 5, step=0.25)
[I 2026-07-21 10:00:35,924] Trial 313 finished with value: -0.5917614694871244 and parameters: {'error_threshold': 2.1, 'scalers': 'none', 'ratios': 'log_ratio', 'imputers': 'mean', 'n_estimators': 2650, 'learning_rate': 0.004062659973972783, 'max_depth': 4, 'min_child_weight': 5, 'subsample': 0.6, 'colsample_bytree': 0.6, 'colsample_bylevel': 0.8, 'reg_alpha': 1.3503800947085354e-05, 'reg_lambda': 1.7670776194284263e-06, 'gamma': 1.956767394592179e-05}. Best is trial 117 with value: -0.5901931848144322.
/bsuhome/alexanderemert/Research/Star-Formation-Research-Project-2026/pipeline/scripts/optuna/final_preds_and_models/optuna_search_mult_quant_reg.py:161: UserWarning: The distribution is specified by [0.1, 5] and step=0.25, but the range is not divisible by `step`. It will be replaced with [0.1, 4.85].
  error_threshold = trial.suggest_float("error_threshold", 0.1, 5, step=0.25)
[I 2026-07-21 10:00:38,703] Trial 314 finished with value: -0.5924567298692317 and parameters: {'error_threshold': 2.1, 'scalers': 'none', 'ratios': 'log_ratio', 'imputers': 'mean', 'n_estimators': 2550, 'learning_rate': 0.003980465635253763, 'max_depth': 4, 'min_child_weight': 5, 'subsample': 0.6, 'colsample_bytree': 0.6, 'colsample_bylevel': 0.8, 'reg_alpha': 5.873249996576035e-06, 'reg_lambda': 1.3673621676517928e-06, 'gamma': 5.665185280019362e-06}. Best is trial 117 with value: -0.5901931848144322.
/bsuhome/alexanderemert/Research/Star-Formation-Research-Project-2026/pipeline/scripts/optuna/final_preds_and_models/optuna_search_mult_quant_reg.py:161: UserWarning: The distribution is specified by [0.1, 5] and step=0.25, but the range is not divisible by `step`. It will be replaced with [0.1, 4.85].
  error_threshold = trial.suggest_float("error_threshold", 0.1, 5, step=0.25)
[I 2026-07-21 10:00:41,458] Trial 315 finished with value: -0.59226377682092 and parameters: {'error_threshold': 2.35, 'scalers': 'none', 'ratios': 'log_ratio', 'imputers': 'mean', 'n_estimators': 2550, 'learning_rate': 0.004036216542316347, 'max_depth': 4, 'min_child_weight': 5, 'subsample': 0.6, 'colsample_bytree': 0.6, 'colsample_bylevel': 0.8, 'reg_alpha': 1.3575000141306825e-05, 'reg_lambda': 1.502328795605971e-06, 'gamma': 1.8784604305908704e-05}. Best is trial 117 with value: -0.5901931848144322.
/bsuhome/alexanderemert/Research/Star-Formation-Research-Project-2026/pipeline/scripts/optuna/final_preds_and_models/optuna_search_mult_quant_reg.py:161: UserWarning: The distribution is specified by [0.1, 5] and step=0.25, but the range is not divisible by `step`. It will be replaced with [0.1, 4.85].
  error_threshold = trial.suggest_float("error_threshold", 0.1, 5, step=0.25)
[I 2026-07-21 10:00:44,267] Trial 316 finished with value: -0.5917888685697886 and parameters: {'error_threshold': 2.35, 'scalers': 'none', 'ratios': 'log_ratio', 'imputers': 'mean', 'n_estimators': 2650, 'learning_rate': 0.004028338822964645, 'max_depth': 4, 'min_child_weight': 5, 'subsample': 0.6, 'colsample_bytree': 0.6, 'colsample_bylevel': 0.8, 'reg_alpha': 1.4515649138905275e-05, 'reg_lambda': 1.906536025783908e-06, 'gamma': 7.092513850939733e-06}. Best is trial 117 with value: -0.5901931848144322.
/bsuhome/alexanderemert/Research/Star-Formation-Research-Project-2026/pipeline/scripts/optuna/final_preds_and_models/optuna_search_mult_quant_reg.py:161: UserWarning: The distribution is specified by [0.1, 5] and step=0.25, but the range is not divisible by `step`. It will be replaced with [0.1, 4.85].
  error_threshold = trial.suggest_float("error_threshold", 0.1, 5, step=0.25)
[I 2026-07-21 10:00:47,097] Trial 317 finished with value: -0.5919317202316429 and parameters: {'error_threshold': 1.85, 'scalers': 'none', 'ratios': 'log_ratio', 'imputers': 'mean', 'n_estimators': 2650, 'learning_rate': 0.003988974572216118, 'max_depth': 4, 'min_child_weight': 5, 'subsample': 0.6, 'colsample_bytree': 0.6, 'colsample_bylevel': 0.8, 'reg_alpha': 1.4200631206966902e-05, 'reg_lambda': 1.7642580940029036e-06, 'gamma': 6.388355269206303e-06}. Best is trial 117 with value: -0.5901931848144322.
/bsuhome/alexanderemert/Research/Star-Formation-Research-Project-2026/pipeline/scripts/optuna/final_preds_and_models/optuna_search_mult_quant_reg.py:161: UserWarning: The distribution is specified by [0.1, 5] and step=0.25, but the range is not divisible by `step`. It will be replaced with [0.1, 4.85].
  error_threshold = trial.suggest_float("error_threshold", 0.1, 5, step=0.25)
[I 2026-07-21 10:00:49,887] Trial 318 finished with value: -0.592512008176416 and parameters: {'error_threshold': 1.85, 'scalers': 'none', 'ratios': 'log_ratio', 'imputers': 'mean', 'n_estimators': 2650, 'learning_rate': 0.00413342581861941, 'max_depth': 4, 'min_child_weight': 6, 'subsample': 0.6, 'colsample_bytree': 0.6, 'colsample_bylevel': 0.8, 'reg_alpha': 3.1452233488306126e-05, 'reg_lambda': 1.6379108950058562e-06, 'gamma': 5.2725815339525503e-05}. Best is trial 117 with value: -0.5901931848144322.
/bsuhome/alexanderemert/Research/Star-Formation-Research-Project-2026/pipeline/scripts/optuna/final_preds_and_models/optuna_search_mult_quant_reg.py:161: UserWarning: The distribution is specified by [0.1, 5] and step=0.25, but the range is not divisible by `step`. It will be replaced with [0.1, 4.85].
  error_threshold = trial.suggest_float("error_threshold", 0.1, 5, step=0.25)
[I 2026-07-21 10:00:52,557] Trial 319 finished with value: -0.5916700171637691 and parameters: {'error_threshold': 1.85, 'scalers': 'none', 'ratios': 'log_ratio', 'imputers': 'mean', 'n_estimators': 2650, 'learning_rate': 0.0066292697076599655, 'max_depth': 4, 'min_child_weight': 6, 'subsample': 0.6, 'colsample_bytree': 0.6, 'colsample_bylevel': 0.8, 'reg_alpha': 3.1561149743026814e-05, 'reg_lambda': 1.7137123964589858e-06, 'gamma': 6.209356509820992e-06}. Best is trial 117 with value: -0.5901931848144322.
/bsuhome/alexanderemert/Research/Star-Formation-Research-Project-2026/pipeline/scripts/optuna/final_preds_and_models/optuna_search_mult_quant_reg.py:161: UserWarning: The distribution is specified by [0.1, 5] and step=0.25, but the range is not divisible by `step`. It will be replaced with [0.1, 4.85].
  error_threshold = trial.suggest_float("error_threshold", 0.1, 5, step=0.25)
[I 2026-07-21 10:00:55,269] Trial 320 finished with value: -0.5903588004129213 and parameters: {'error_threshold': 1.85, 'scalers': 'none', 'ratios': 'log_ratio', 'imputers': 'mean', 'n_estimators': 2650, 'learning_rate': 0.006581204467832697, 'max_depth': 4, 'min_child_weight': 5, 'subsample': 0.6, 'colsample_bytree': 0.6, 'colsample_bylevel': 0.8, 'reg_alpha': 3.3263271739336914e-05, 'reg_lambda': 1.6442511974358069e-06, 'gamma': 7.2579697341902516e-06}. Best is trial 117 with value: -0.5901931848144322.
/bsuhome/alexanderemert/Research/Star-Formation-Research-Project-2026/pipeline/scripts/optuna/final_preds_and_models/optuna_search_mult_quant_reg.py:161: UserWarning: The distribution is specified by [0.1, 5] and step=0.25, but the range is not divisible by `step`. It will be replaced with [0.1, 4.85].
  error_threshold = trial.suggest_float("error_threshold", 0.1, 5, step=0.25)
[I 2026-07-21 10:00:58,550] Trial 321 finished with value: -0.9025639409313354 and parameters: {'error_threshold': 2.35, 'scalers': 'none', 'ratios': 'log_ratio', 'imputers': 'mean', 'n_estimators': 2550, 'learning_rate': 0.0007701324832147298, 'max_depth': 4, 'min_child_weight': 5, 'subsample': 0.6, 'colsample_bytree': 0.6, 'colsample_bylevel': 0.8, 'reg_alpha': 3.345351690986398e-05, 'reg_lambda': 1.750021492152559e-06, 'gamma': 6.6820805789114214e-06}. Best is trial 117 with value: -0.5901931848144322.
/bsuhome/alexanderemert/Research/Star-Formation-Research-Project-2026/pipeline/scripts/optuna/final_preds_and_models/optuna_search_mult_quant_reg.py:161: UserWarning: The distribution is specified by [0.1, 5] and step=0.25, but the range is not divisible by `step`. It will be replaced with [0.1, 4.85].
  error_threshold = trial.suggest_float("error_threshold", 0.1, 5, step=0.25)
[I 2026-07-21 10:01:01,236] Trial 322 finished with value: -0.5915187238571954 and parameters: {'error_threshold': 2.35, 'scalers': 'none', 'ratios': 'log_ratio', 'imputers': 'mean', 'n_estimators': 2650, 'learning_rate': 0.006740240413895314, 'max_depth': 4, 'min_child_weight': 6, 'subsample': 0.6, 'colsample_bytree': 0.6, 'colsample_bylevel': 0.8, 'reg_alpha': 3.242377124556495e-05, 'reg_lambda': 1.5620263432608336e-06, 'gamma': 6.315419091086474e-06}. Best is trial 117 with value: -0.5901931848144322.
/bsuhome/alexanderemert/Research/Star-Formation-Research-Project-2026/pipeline/scripts/optuna/final_preds_and_models/optuna_search_mult_quant_reg.py:161: UserWarning: The distribution is specified by [0.1, 5] and step=0.25, but the range is not divisible by `step`. It will be replaced with [0.1, 4.85].
  error_threshold = trial.suggest_float("error_threshold", 0.1, 5, step=0.25)
[I 2026-07-21 10:01:03,911] Trial 323 finished with value: -0.5913606917439621 and parameters: {'error_threshold': 2.35, 'scalers': 'none', 'ratios': 'log_ratio', 'imputers': 'mean', 'n_estimators': 2650, 'learning_rate': 0.006370603659546992, 'max_depth': 4, 'min_child_weight': 6, 'subsample': 0.6, 'colsample_bytree': 0.6, 'colsample_bylevel': 0.8, 'reg_alpha': 1.385953135431107e-06, 'reg_lambda': 1.6175693440403092e-06, 'gamma': 6.184625537851859e-06}. Best is trial 117 with value: -0.5901931848144322.
/bsuhome/alexanderemert/Research/Star-Formation-Research-Project-2026/pipeline/scripts/optuna/final_preds_and_models/optuna_search_mult_quant_reg.py:161: UserWarning: The distribution is specified by [0.1, 5] and step=0.25, but the range is not divisible by `step`. It will be replaced with [0.1, 4.85].
  error_threshold = trial.suggest_float("error_threshold", 0.1, 5, step=0.25)
[I 2026-07-21 10:01:06,349] Trial 324 finished with value: -0.591217482585062 and parameters: {'error_threshold': 1.85, 'scalers': 'none', 'ratios': 'log_ratio', 'imputers': 'mean', 'n_estimators': 2400, 'learning_rate': 0.006575670970286726, 'max_depth': 4, 'min_child_weight': 6, 'subsample': 0.6, 'colsample_bytree': 0.6, 'colsample_bylevel': 0.8, 'reg_alpha': 3.167036676714387e-05, 'reg_lambda': 1.0145892857470157e-06, 'gamma': 1.063707513920137e-05}. Best is trial 117 with value: -0.5901931848144322.
/bsuhome/alexanderemert/Research/Star-Formation-Research-Project-2026/pipeline/scripts/optuna/final_preds_and_models/optuna_search_mult_quant_reg.py:161: UserWarning: The distribution is specified by [0.1, 5] and step=0.25, but the range is not divisible by `step`. It will be replaced with [0.1, 4.85].
  error_threshold = trial.suggest_float("error_threshold", 0.1, 5, step=0.25)
[I 2026-07-21 10:01:08,803] Trial 325 finished with value: -0.5912759544072328 and parameters: {'error_threshold': 1.85, 'scalers': 'none', 'ratios': 'log_ratio', 'imputers': 'mean', 'n_estimators': 2400, 'learning_rate': 0.006753945251476983, 'max_depth': 4, 'min_child_weight': 6, 'subsample': 0.6, 'colsample_bytree': 0.6, 'colsample_bylevel': 0.8, 'reg_alpha': 3.1652128648759954e-05, 'reg_lambda': 3.419214068221645e-06, 'gamma': 5.765474521585706e-05}. Best is trial 117 with value: -0.5901931848144322.
/bsuhome/alexanderemert/Research/Star-Formation-Research-Project-2026/pipeline/scripts/optuna/final_preds_and_models/optuna_search_mult_quant_reg.py:161: UserWarning: The distribution is specified by [0.1, 5] and step=0.25, but the range is not divisible by `step`. It will be replaced with [0.1, 4.85].
  error_threshold = trial.suggest_float("error_threshold", 0.1, 5, step=0.25)
[I 2026-07-21 10:01:11,388] Trial 326 finished with value: -0.5917130735066475 and parameters: {'error_threshold': 1.85, 'scalers': 'none', 'ratios': 'log_ratio', 'imputers': 'mean', 'n_estimators': 2550, 'learning_rate': 0.006627767777816099, 'max_depth': 4, 'min_child_weight': 6, 'subsample': 0.6, 'colsample_bytree': 0.6, 'colsample_bylevel': 0.8, 'reg_alpha': 3.320265664644666e-05, 'reg_lambda': 0.0008477527113482506, 'gamma': 1.1023421227394251e-05}. Best is trial 117 with value: -0.5901931848144322.
/bsuhome/alexanderemert/Research/Star-Formation-Research-Project-2026/pipeline/scripts/optuna/final_preds_and_models/optuna_search_mult_quant_reg.py:161: UserWarning: The distribution is specified by [0.1, 5] and step=0.25, but the range is not divisible by `step`. It will be replaced with [0.1, 4.85].
  error_threshold = trial.suggest_float("error_threshold", 0.1, 5, step=0.25)
[I 2026-07-21 10:01:13,858] Trial 327 finished with value: -0.5913416544840155 and parameters: {'error_threshold': 1.85, 'scalers': 'none', 'ratios': 'norm_ratio', 'imputers': 'mean', 'n_estimators': 2400, 'learning_rate': 0.00668653289534945, 'max_depth': 4, 'min_child_weight': 6, 'subsample': 0.6, 'colsample_bytree': 0.6, 'colsample_bylevel': 0.8, 'reg_alpha': 1.5481364071473487e-06, 'reg_lambda': 4.166507214869668e-06, 'gamma': 3.129255066583805e-05}. Best is trial 117 with value: -0.5901931848144322.
/bsuhome/alexanderemert/Research/Star-Formation-Research-Project-2026/pipeline/scripts/optuna/final_preds_and_models/optuna_search_mult_quant_reg.py:161: UserWarning: The distribution is specified by [0.1, 5] and step=0.25, but the range is not divisible by `step`. It will be replaced with [0.1, 4.85].
  error_threshold = trial.suggest_float("error_threshold", 0.1, 5, step=0.25)
[I 2026-07-21 10:01:16,456] Trial 329 finished with value: -0.5913330684319797 and parameters: {'error_threshold': 1.85, 'scalers': 'none', 'ratios': 'norm_ratio', 'imputers': 'mean', 'n_estimators': 2550, 'learning_rate': 0.007024269605677852, 'max_depth': 4, 'min_child_weight': 6, 'subsample': 0.6, 'colsample_bytree': 0.6, 'colsample_bylevel': 0.8, 'reg_alpha': 2.274724498665135e-05, 'reg_lambda': 1.0303010862799044e-06, 'gamma': 1.0989524541350082e-05}. Best is trial 117 with value: -0.5901931848144322.
/bsuhome/alexanderemert/Research/Star-Formation-Research-Project-2026/pipeline/scripts/optuna/final_preds_and_models/optuna_search_mult_quant_reg.py:161: UserWarning: The distribution is specified by [0.1, 5] and step=0.25, but the range is not divisible by `step`. It will be replaced with [0.1, 4.85].
  error_threshold = trial.suggest_float("error_threshold", 0.1, 5, step=0.25)
[I 2026-07-21 10:01:19,057] Trial 330 finished with value: -0.5915242423011501 and parameters: {'error_threshold': 1.85, 'scalers': 'none', 'ratios': 'log_ratio', 'imputers': 'mean', 'n_estimators': 2550, 'learning_rate': 0.006606492131346097, 'max_depth': 4, 'min_child_weight': 6, 'subsample': 0.6, 'colsample_bytree': 0.6, 'colsample_bylevel': 0.8, 'reg_alpha': 8.555355812351415e-06, 'reg_lambda': 2.668714712244374e-06, 'gamma': 1.0260547679914973e-05}. Best is trial 117 with value: -0.5901931848144322.
/bsuhome/alexanderemert/Research/Star-Formation-Research-Project-2026/pipeline/scripts/optuna/final_preds_and_models/optuna_search_mult_quant_reg.py:161: UserWarning: The distribution is specified by [0.1, 5] and step=0.25, but the range is not divisible by `step`. It will be replaced with [0.1, 4.85].
  error_threshold = trial.suggest_float("error_threshold", 0.1, 5, step=0.25)
[I 2026-07-21 10:01:28,542] Trial 328 finished with value: -0.6153319834813554 and parameters: {'error_threshold': 1.85, 'scalers': 'none', 'ratios': 'log_ratio', 'imputers': 'mean', 'n_estimators': 2550, 'learning_rate': 0.006707658088393454, 'max_depth': 8, 'min_child_weight': 5, 'subsample': 0.6, 'colsample_bytree': 0.6, 'colsample_bylevel': 0.8, 'reg_alpha': 8.3664411648093e-06, 'reg_lambda': 1.1256248317578432e-06, 'gamma': 9.449389977889923e-06}. Best is trial 117 with value: -0.5901931848144322.
/bsuhome/alexanderemert/Research/Star-Formation-Research-Project-2026/pipeline/scripts/optuna/final_preds_and_models/optuna_search_mult_quant_reg.py:161: UserWarning: The distribution is specified by [0.1, 5] and step=0.25, but the range is not divisible by `step`. It will be replaced with [0.1, 4.85].
  error_threshold = trial.suggest_float("error_threshold", 0.1, 5, step=0.25)
[I 2026-07-21 10:01:31,096] Trial 331 finished with value: -0.5917035984443538 and parameters: {'error_threshold': 1.85, 'scalers': 'none', 'ratios': 'norm_ratio', 'imputers': 'mean', 'n_estimators': 2550, 'learning_rate': 0.007604460806905868, 'max_depth': 4, 'min_child_weight': 6, 'subsample': 0.6, 'colsample_bytree': 0.6, 'colsample_bylevel': 0.8, 'reg_alpha': 9.263340115895724e-06, 'reg_lambda': 1.0875429948982766e-06, 'gamma': 1.0485836785247061e-05}. Best is trial 117 with value: -0.5901931848144322.
/bsuhome/alexanderemert/Research/Star-Formation-Research-Project-2026/pipeline/scripts/optuna/final_preds_and_models/optuna_search_mult_quant_reg.py:161: UserWarning: The distribution is specified by [0.1, 5] and step=0.25, but the range is not divisible by `step`. It will be replaced with [0.1, 4.85].
  error_threshold = trial.suggest_float("error_threshold", 0.1, 5, step=0.25)
