[I 2026-07-20 18:25:06,130] Trial 117 finished with value: -3.809650226195508 and parameters: {'error_threshold': 0.85, 'scalers': 'standard', 'ratios': 'log_ratio', 'imputers': 'none', 'n_estimators': 400, 'learning_rate': 0.07219324463609561, 'max_depth': 3, 'min_child_weight': 8, 'subsample': 0.5, 'colsample_bytree': 0.5, 'colsample_bylevel': 0.7, 'reg_alpha': 4.110663519635662e-06, 'reg_lambda': 0.013878221043249627, 'gamma': 72.79332983991895}. Best is trial 50 with value: -3.7835498517890067.
/bsuhome/alexanderemert/Research/Star-Formation-Research-Project-2026/pipeline/scripts/optuna/final_preds_and_models/optuna_search_mult_quant_reg.py:161: UserWarning: The distribution is specified by [0.1, 5] and step=0.25, but the range is not divisible by `step`. It will be replaced with [0.1, 4.85].
  error_threshold = trial.suggest_float("error_threshold", 0.1, 5, step=0.25)
[I 2026-07-20 18:25:06,588] Trial 116 finished with value: -4.029392126332663 and parameters: {'error_threshold': 0.1, 'scalers': 'standard', 'ratios': 'log_ratio', 'imputers': 'none', 'n_estimators': 100, 'learning_rate': 0.08223882886785645, 'max_depth': 11, 'min_child_weight': 8, 'subsample': 0.5, 'colsample_bytree': 0.5, 'colsample_bylevel': 0.7, 'reg_alpha': 4.151802450088876e-06, 'reg_lambda': 0.012494830796119847, 'gamma': 0.09225555555327657}. Best is trial 50 with value: -3.7835498517890067.
/bsuhome/alexanderemert/Research/Star-Formation-Research-Project-2026/pipeline/scripts/optuna/final_preds_and_models/optuna_search_mult_quant_reg.py:161: UserWarning: The distribution is specified by [0.1, 5] and step=0.25, but the range is not divisible by `step`. It will be replaced with [0.1, 4.85].
  error_threshold = trial.suggest_float("error_threshold", 0.1, 5, step=0.25)
[I 2026-07-20 18:25:07,130] Trial 118 finished with value: -4.037542626130541 and parameters: {'error_threshold': 0.85, 'scalers': 'robust', 'ratios': 'log_ratio', 'imputers': 'none', 'n_estimators': 350, 'learning_rate': 0.09180434339876217, 'max_depth': 5, 'min_child_weight': 8, 'subsample': 1.0, 'colsample_bytree': 0.9, 'colsample_bylevel': 0.7, 'reg_alpha': 3.2325410208559722e-06, 'reg_lambda': 0.005504887152173496, 'gamma': 0.0819346664047726}. Best is trial 50 with value: -3.7835498517890067.
/bsuhome/alexanderemert/Research/Star-Formation-Research-Project-2026/pipeline/scripts/optuna/final_preds_and_models/optuna_search_mult_quant_reg.py:161: UserWarning: The distribution is specified by [0.1, 5] and step=0.25, but the range is not divisible by `step`. It will be replaced with [0.1, 4.85].
  error_threshold = trial.suggest_float("error_threshold", 0.1, 5, step=0.25)
[I 2026-07-20 18:25:07,333] Trial 120 finished with value: -4.139371691459967 and parameters: {'error_threshold': 0.85, 'scalers': 'standard', 'ratios': 'norm_ratio', 'imputers': 'mean', 'n_estimators': 100, 'learning_rate': 0.005481309178873711, 'max_depth': 5, 'min_child_weight': 8, 'subsample': 0.5, 'colsample_bytree': 0.9, 'colsample_bylevel': 0.7, 'reg_alpha': 3.2144639797363115e-06, 'reg_lambda': 0.08508401969455423, 'gamma': 63.79734026702876}. Best is trial 50 with value: -3.7835498517890067.
/bsuhome/alexanderemert/Research/Star-Formation-Research-Project-2026/pipeline/scripts/optuna/final_preds_and_models/optuna_search_mult_quant_reg.py:161: UserWarning: The distribution is specified by [0.1, 5] and step=0.25, but the range is not divisible by `step`. It will be replaced with [0.1, 4.85].
  error_threshold = trial.suggest_float("error_threshold", 0.1, 5, step=0.25)
[I 2026-07-20 18:25:07,530] Trial 121 finished with value: -3.8123447584768235 and parameters: {'error_threshold': 0.85, 'scalers': 'standard', 'ratios': 'norm_ratio', 'imputers': 'mean', 'n_estimators': 400, 'learning_rate': 0.10846553427732857, 'max_depth': 5, 'min_child_weight': 7, 'subsample': 1.0, 'colsample_bytree': 0.9, 'colsample_bylevel': 0.7, 'reg_alpha': 3.5029316349466492e-06, 'reg_lambda': 0.10470272589290373, 'gamma': 63.48209353306202}. Best is trial 50 with value: -3.7835498517890067.
/bsuhome/alexanderemert/Research/Star-Formation-Research-Project-2026/pipeline/scripts/optuna/final_preds_and_models/optuna_search_mult_quant_reg.py:161: UserWarning: The distribution is specified by [0.1, 5] and step=0.25, but the range is not divisible by `step`. It will be replaced with [0.1, 4.85].
  error_threshold = trial.suggest_float("error_threshold", 0.1, 5, step=0.25)
[I 2026-07-20 18:25:08,160] Trial 119 finished with value: -3.813315113686331 and parameters: {'error_threshold': 0.85, 'scalers': 'robust', 'ratios': 'log_ratio', 'imputers': 'mean', 'n_estimators': 350, 'learning_rate': 0.013945296848776705, 'max_depth': 5, 'min_child_weight': 8, 'subsample': 0.5, 'colsample_bytree': 1.0, 'colsample_bylevel': 0.7, 'reg_alpha': 2.752829268492033e-06, 'reg_lambda': 0.08946756553624494, 'gamma': 0.14124255433006838}. Best is trial 50 with value: -3.7835498517890067.
/bsuhome/alexanderemert/Research/Star-Formation-Research-Project-2026/pipeline/scripts/optuna/final_preds_and_models/optuna_search_mult_quant_reg.py:161: UserWarning: The distribution is specified by [0.1, 5] and step=0.25, but the range is not divisible by `step`. It will be replaced with [0.1, 4.85].
  error_threshold = trial.suggest_float("error_threshold", 0.1, 5, step=0.25)
[I 2026-07-20 18:25:08,323] Trial 124 finished with value: -3.8433906468607444 and parameters: {'error_threshold': 3.85, 'scalers': 'standard', 'ratios': 'log_ratio', 'imputers': 'none', 'n_estimators': 400, 'learning_rate': 0.10775567977356855, 'max_depth': 3, 'min_child_weight': 8, 'subsample': 0.5, 'colsample_bytree': 0.5, 'colsample_bylevel': 0.7, 'reg_alpha': 3.642188962367509e-06, 'reg_lambda': 0.015014520477465055, 'gamma': 63.20354494493738}. Best is trial 50 with value: -3.7835498517890067.
/bsuhome/alexanderemert/Research/Star-Formation-Research-Project-2026/pipeline/scripts/optuna/final_preds_and_models/optuna_search_mult_quant_reg.py:161: UserWarning: The distribution is specified by [0.1, 5] and step=0.25, but the range is not divisible by `step`. It will be replaced with [0.1, 4.85].
  error_threshold = trial.suggest_float("error_threshold", 0.1, 5, step=0.25)
[I 2026-07-20 18:25:08,901] Trial 122 finished with value: -3.8129137396373394 and parameters: {'error_threshold': 0.85, 'scalers': 'standard', 'ratios': 'norm_ratio', 'imputers': 'mean', 'n_estimators': 350, 'learning_rate': 0.013912739309736067, 'max_depth': 11, 'min_child_weight': 8, 'subsample': 1.0, 'colsample_bytree': 0.9, 'colsample_bylevel': 0.7, 'reg_alpha': 3.046633674420144e-06, 'reg_lambda': 0.005701350964444404, 'gamma': 70.81790641412772}. Best is trial 50 with value: -3.7835498517890067.
/bsuhome/alexanderemert/Research/Star-Formation-Research-Project-2026/pipeline/scripts/optuna/final_preds_and_models/optuna_search_mult_quant_reg.py:161: UserWarning: The distribution is specified by [0.1, 5] and step=0.25, but the range is not divisible by `step`. It will be replaced with [0.1, 4.85].
  error_threshold = trial.suggest_float("error_threshold", 0.1, 5, step=0.25)
[I 2026-07-20 18:25:09,104] Trial 125 finished with value: -3.831151446012407 and parameters: {'error_threshold': 4.35, 'scalers': 'standard', 'ratios': 'log_ratio', 'imputers': 'none', 'n_estimators': 400, 'learning_rate': 0.09601072871205386, 'max_depth': 3, 'min_child_weight': 7, 'subsample': 0.5, 'colsample_bytree': 0.5, 'colsample_bylevel': 0.7, 'reg_alpha': 3.072461877368523e-06, 'reg_lambda': 0.0050540307591503755, 'gamma': 67.54756754160134}. Best is trial 50 with value: -3.7835498517890067.
/bsuhome/alexanderemert/Research/Star-Formation-Research-Project-2026/pipeline/scripts/optuna/final_preds_and_models/optuna_search_mult_quant_reg.py:161: UserWarning: The distribution is specified by [0.1, 5] and step=0.25, but the range is not divisible by `step`. It will be replaced with [0.1, 4.85].
  error_threshold = trial.suggest_float("error_threshold", 0.1, 5, step=0.25)
[I 2026-07-20 18:25:09,832] Trial 123 finished with value: -3.8068657376547015 and parameters: {'error_threshold': 3.35, 'scalers': 'robust', 'ratios': 'norm_ratio', 'imputers': 'mean', 'n_estimators': 400, 'learning_rate': 0.005509663484752745, 'max_depth': 5, 'min_child_weight': 7, 'subsample': 0.9, 'colsample_bytree': 0.9, 'colsample_bylevel': 0.7, 'reg_alpha': 1.5929003496669312e-06, 'reg_lambda': 0.00039002342032439034, 'gamma': 67.79972658572557}. Best is trial 50 with value: -3.7835498517890067.
/bsuhome/alexanderemert/Research/Star-Formation-Research-Project-2026/pipeline/scripts/optuna/final_preds_and_models/optuna_search_mult_quant_reg.py:161: UserWarning: The distribution is specified by [0.1, 5] and step=0.25, but the range is not divisible by `step`. It will be replaced with [0.1, 4.85].
  error_threshold = trial.suggest_float("error_threshold", 0.1, 5, step=0.25)
[I 2026-07-20 18:25:10,077] Trial 126 finished with value: -3.8230365225609817 and parameters: {'error_threshold': 4.35, 'scalers': 'standard', 'ratios': 'log_ratio', 'imputers': 'none', 'n_estimators': 400, 'learning_rate': 0.005507917807464236, 'max_depth': 3, 'min_child_weight': 7, 'subsample': 0.5, 'colsample_bytree': 0.5, 'colsample_bylevel': 0.7, 'reg_alpha': 1.5469253166317046e-06, 'reg_lambda': 0.020058122572788023, 'gamma': 74.38765287693423}. Best is trial 50 with value: -3.7835498517890067.
/bsuhome/alexanderemert/Research/Star-Formation-Research-Project-2026/pipeline/scripts/optuna/final_preds_and_models/optuna_search_mult_quant_reg.py:161: UserWarning: The distribution is specified by [0.1, 5] and step=0.25, but the range is not divisible by `step`. It will be replaced with [0.1, 4.85].
  error_threshold = trial.suggest_float("error_threshold", 0.1, 5, step=0.25)
[I 2026-07-20 18:25:10,316] Trial 127 finished with value: -3.7877883627558706 and parameters: {'error_threshold': 3.1, 'scalers': 'standard', 'ratios': 'log_ratio', 'imputers': 'none', 'n_estimators': 400, 'learning_rate': 0.01369745747515547, 'max_depth': 3, 'min_child_weight': 7, 'subsample': 0.9, 'colsample_bytree': 0.5, 'colsample_bylevel': 0.7, 'reg_alpha': 6.517127706222737e-05, 'reg_lambda': 0.02138236608535035, 'gamma': 96.50634520409277}. Best is trial 50 with value: -3.7835498517890067.
/bsuhome/alexanderemert/Research/Star-Formation-Research-Project-2026/pipeline/scripts/optuna/final_preds_and_models/optuna_search_mult_quant_reg.py:161: UserWarning: The distribution is specified by [0.1, 5] and step=0.25, but the range is not divisible by `step`. It will be replaced with [0.1, 4.85].
  error_threshold = trial.suggest_float("error_threshold", 0.1, 5, step=0.25)
[I 2026-07-20 18:25:10,454] Trial 128 finished with value: -3.7895101456950306 and parameters: {'error_threshold': 3.1, 'scalers': 'standard', 'ratios': 'norm_ratio', 'imputers': 'mean', 'n_estimators': 400, 'learning_rate': 0.20836625671575665, 'max_depth': 3, 'min_child_weight': 7, 'subsample': 0.9, 'colsample_bytree': 1.0, 'colsample_bylevel': 0.7, 'reg_alpha': 2.6123332746305838e-05, 'reg_lambda': 0.023268874176918412, 'gamma': 94.75114024750594}. Best is trial 50 with value: -3.7835498517890067.
/bsuhome/alexanderemert/Research/Star-Formation-Research-Project-2026/pipeline/scripts/optuna/final_preds_and_models/optuna_search_mult_quant_reg.py:161: UserWarning: The distribution is specified by [0.1, 5] and step=0.25, but the range is not divisible by `step`. It will be replaced with [0.1, 4.85].
  error_threshold = trial.suggest_float("error_threshold", 0.1, 5, step=0.25)
[I 2026-07-20 18:25:10,955] Trial 129 finished with value: -3.7953457323032236 and parameters: {'error_threshold': 0.85, 'scalers': 'standard', 'ratios': 'norm_ratio', 'imputers': 'mean', 'n_estimators': 400, 'learning_rate': 0.01363210603913707, 'max_depth': 11, 'min_child_weight': 9, 'subsample': 0.5, 'colsample_bytree': 1.0, 'colsample_bylevel': 0.7, 'reg_alpha': 2.8546756438093097e-06, 'reg_lambda': 0.02457676427174973, 'gamma': 88.39814342141499}. Best is trial 50 with value: -3.7835498517890067.
/bsuhome/alexanderemert/Research/Star-Formation-Research-Project-2026/pipeline/scripts/optuna/final_preds_and_models/optuna_search_mult_quant_reg.py:161: UserWarning: The distribution is specified by [0.1, 5] and step=0.25, but the range is not divisible by `step`. It will be replaced with [0.1, 4.85].
  error_threshold = trial.suggest_float("error_threshold", 0.1, 5, step=0.25)
[I 2026-07-20 18:25:11,416] Trial 130 finished with value: -3.792350649332004 and parameters: {'error_threshold': 0.85, 'scalers': 'standard', 'ratios': 'norm_ratio', 'imputers': 'mean', 'n_estimators': 400, 'learning_rate': 0.013119146833494067, 'max_depth': 11, 'min_child_weight': 9, 'subsample': 0.5, 'colsample_bytree': 1.0, 'colsample_bylevel': 0.7, 'reg_alpha': 1.706490272127179e-06, 'reg_lambda': 0.02592105140185735, 'gamma': 98.69599123807133}. Best is trial 50 with value: -3.7835498517890067.
/bsuhome/alexanderemert/Research/Star-Formation-Research-Project-2026/pipeline/scripts/optuna/final_preds_and_models/optuna_search_mult_quant_reg.py:161: UserWarning: The distribution is specified by [0.1, 5] and step=0.25, but the range is not divisible by `step`. It will be replaced with [0.1, 4.85].
  error_threshold = trial.suggest_float("error_threshold", 0.1, 5, step=0.25)
[I 2026-07-20 18:25:11,926] Trial 131 finished with value: -3.807633763655231 and parameters: {'error_threshold': 0.85, 'scalers': 'standard', 'ratios': 'norm_ratio', 'imputers': 'mean', 'n_estimators': 350, 'learning_rate': 0.01455015885744033, 'max_depth': 11, 'min_child_weight': 8, 'subsample': 1.0, 'colsample_bytree': 1.0, 'colsample_bylevel': 0.7, 'reg_alpha': 2.7174128915035745e-05, 'reg_lambda': 0.024343360115453228, 'gamma': 93.17895426971216}. Best is trial 50 with value: -3.7835498517890067.
/bsuhome/alexanderemert/Research/Star-Formation-Research-Project-2026/pipeline/scripts/optuna/final_preds_and_models/optuna_search_mult_quant_reg.py:161: UserWarning: The distribution is specified by [0.1, 5] and step=0.25, but the range is not divisible by `step`. It will be replaced with [0.1, 4.85].
  error_threshold = trial.suggest_float("error_threshold", 0.1, 5, step=0.25)
[I 2026-07-20 18:25:12,284] Trial 133 finished with value: -3.804558733648373 and parameters: {'error_threshold': 3.1, 'scalers': 'standard', 'ratios': 'norm_ratio', 'imputers': 'mean', 'n_estimators': 350, 'learning_rate': 0.014376678307369212, 'max_depth': 5, 'min_child_weight': 7, 'subsample': 1.0, 'colsample_bytree': 1.0, 'colsample_bylevel': 0.7, 'reg_alpha': 2.387572122159575e-05, 'reg_lambda': 0.023614116262291887, 'gamma': 99.23261149930708}. Best is trial 50 with value: -3.7835498517890067.
/bsuhome/alexanderemert/Research/Star-Formation-Research-Project-2026/pipeline/scripts/optuna/final_preds_and_models/optuna_search_mult_quant_reg.py:161: UserWarning: The distribution is specified by [0.1, 5] and step=0.25, but the range is not divisible by `step`. It will be replaced with [0.1, 4.85].
  error_threshold = trial.suggest_float("error_threshold", 0.1, 5, step=0.25)
[I 2026-07-20 18:25:13,395] Trial 132 finished with value: -3.8411806650931712 and parameters: {'error_threshold': 3.35, 'scalers': 'standard', 'ratios': 'norm_ratio', 'imputers': 'mean', 'n_estimators': 350, 'learning_rate': 0.01412777875558921, 'max_depth': 11, 'min_child_weight': 8, 'subsample': 1.0, 'colsample_bytree': 1.0, 'colsample_bylevel': 0.7, 'reg_alpha': 1.7241996669366835e-06, 'reg_lambda': 0.019487633882701944, 'gamma': 36.663330002391426}. Best is trial 50 with value: -3.7835498517890067.
/bsuhome/alexanderemert/Research/Star-Formation-Research-Project-2026/pipeline/scripts/optuna/final_preds_and_models/optuna_search_mult_quant_reg.py:161: UserWarning: The distribution is specified by [0.1, 5] and step=0.25, but the range is not divisible by `step`. It will be replaced with [0.1, 4.85].
  error_threshold = trial.suggest_float("error_threshold", 0.1, 5, step=0.25)
[I 2026-07-20 18:25:13,798] Trial 134 finished with value: -3.8132075411350512 and parameters: {'error_threshold': 0.85, 'scalers': 'robust', 'ratios': 'norm_ratio', 'imputers': 'mean', 'n_estimators': 500, 'learning_rate': 0.02947615383638179, 'max_depth': 5, 'min_child_weight': 7, 'subsample': 1.0, 'colsample_bytree': 1.0, 'colsample_bylevel': 0.7, 'reg_alpha': 2.709891097532119e-05, 'reg_lambda': 0.030143096043890847, 'gamma': 36.71396320896008}. Best is trial 50 with value: -3.7835498517890067.
/bsuhome/alexanderemert/Research/Star-Formation-Research-Project-2026/pipeline/scripts/optuna/final_preds_and_models/optuna_search_mult_quant_reg.py:161: UserWarning: The distribution is specified by [0.1, 5] and step=0.25, but the range is not divisible by `step`. It will be replaced with [0.1, 4.85].
  error_threshold = trial.suggest_float("error_threshold", 0.1, 5, step=0.25)
[I 2026-07-20 18:25:13,943] Trial 136 finished with value: -3.789804194765425 and parameters: {'error_threshold': 3.1, 'scalers': 'standard', 'ratios': 'norm_ratio', 'imputers': 'mean', 'n_estimators': 550, 'learning_rate': 0.20417012995558337, 'max_depth': 3, 'min_child_weight': 7, 'subsample': 0.9, 'colsample_bytree': 1.0, 'colsample_bylevel': 0.7, 'reg_alpha': 6.964352546052017e-05, 'reg_lambda': 0.00035262717504841207, 'gamma': 94.10508952181532}. Best is trial 50 with value: -3.7835498517890067.
/bsuhome/alexanderemert/Research/Star-Formation-Research-Project-2026/pipeline/scripts/optuna/final_preds_and_models/optuna_search_mult_quant_reg.py:161: UserWarning: The distribution is specified by [0.1, 5] and step=0.25, but the range is not divisible by `step`. It will be replaced with [0.1, 4.85].
  error_threshold = trial.suggest_float("error_threshold", 0.1, 5, step=0.25)
[I 2026-07-20 18:25:14,439] Trial 135 finished with value: -3.80711001978043 and parameters: {'error_threshold': 3.35, 'scalers': 'standard', 'ratios': 'norm_ratio', 'imputers': 'mean', 'n_estimators': 300, 'learning_rate': 0.013499796482051877, 'max_depth': 5, 'min_child_weight': 7, 'subsample': 1.0, 'colsample_bytree': 1.0, 'colsample_bylevel': 0.7, 'reg_alpha': 0.00010928015681266294, 'reg_lambda': 0.028395699043885017, 'gamma': 41.85377891385938}. Best is trial 50 with value: -3.7835498517890067.
/bsuhome/alexanderemert/Research/Star-Formation-Research-Project-2026/pipeline/scripts/optuna/final_preds_and_models/optuna_search_mult_quant_reg.py:161: UserWarning: The distribution is specified by [0.1, 5] and step=0.25, but the range is not divisible by `step`. It will be replaced with [0.1, 4.85].
  error_threshold = trial.suggest_float("error_threshold", 0.1, 5, step=0.25)
[I 2026-07-20 18:25:14,647] Trial 137 finished with value: -3.7940910043553733 and parameters: {'error_threshold': 1.35, 'scalers': 'standard', 'ratios': 'norm_ratio', 'imputers': 'mean', 'n_estimators': 550, 'learning_rate': 0.19834280000340357, 'max_depth': 3, 'min_child_weight': 7, 'subsample': 0.9, 'colsample_bytree': 1.0, 'colsample_bylevel': 0.7, 'reg_alpha': 2.7248358939067075e-05, 'reg_lambda': 0.00030667956180729754, 'gamma': 96.62696557282975}. Best is trial 50 with value: -3.7835498517890067.
/bsuhome/alexanderemert/Research/Star-Formation-Research-Project-2026/pipeline/scripts/optuna/final_preds_and_models/optuna_search_mult_quant_reg.py:161: UserWarning: The distribution is specified by [0.1, 5] and step=0.25, but the range is not divisible by `step`. It will be replaced with [0.1, 4.85].
  error_threshold = trial.suggest_float("error_threshold", 0.1, 5, step=0.25)
[I 2026-07-20 18:25:14,791] Trial 138 finished with value: -3.850719773215126 and parameters: {'error_threshold': 3.1, 'scalers': 'standard', 'ratios': 'norm_ratio', 'imputers': 'mean', 'n_estimators': 450, 'learning_rate': 0.2757465741086145, 'max_depth': 3, 'min_child_weight': 7, 'subsample': 0.9, 'colsample_bytree': 1.0, 'colsample_bylevel': 0.6, 'reg_alpha': 0.00011970983555730809, 'reg_lambda': 0.028125055606972902, 'gamma': 44.42766392164315}. Best is trial 50 with value: -3.7835498517890067.
/bsuhome/alexanderemert/Research/Star-Formation-Research-Project-2026/pipeline/scripts/optuna/final_preds_and_models/optuna_search_mult_quant_reg.py:161: UserWarning: The distribution is specified by [0.1, 5] and step=0.25, but the range is not divisible by `step`. It will be replaced with [0.1, 4.85].
  error_threshold = trial.suggest_float("error_threshold", 0.1, 5, step=0.25)
[I 2026-07-20 18:25:14,942] Trial 139 finished with value: -3.8281652371445536 and parameters: {'error_threshold': 3.1, 'scalers': 'standard', 'ratios': 'norm_ratio', 'imputers': 'mean', 'n_estimators': 450, 'learning_rate': 0.25883559782675064, 'max_depth': 11, 'min_child_weight': 9, 'subsample': 0.9, 'colsample_bytree': 1.0, 'colsample_bylevel': 0.6, 'reg_alpha': 6.654016671012968e-05, 'reg_lambda': 0.027913430209877615, 'gamma': 88.73265621071843}. Best is trial 50 with value: -3.7835498517890067.
/bsuhome/alexanderemert/Research/Star-Formation-Research-Project-2026/pipeline/scripts/optuna/final_preds_and_models/optuna_search_mult_quant_reg.py:161: UserWarning: The distribution is specified by [0.1, 5] and step=0.25, but the range is not divisible by `step`. It will be replaced with [0.1, 4.85].
  error_threshold = trial.suggest_float("error_threshold", 0.1, 5, step=0.25)
