[I 2026-07-20 18:22:50,469] Trial 71 finished with value: -4.190042573345419 and parameters: {'error_threshold': 1.35, 'scalers': 'robust', 'ratios': 'norm_ratio', 'imputers': 'mean', 'n_estimators': 250, 'learning_rate': 0.0019039448332964339, 'max_depth': 5, 'min_child_weight': 5, 'subsample': 1.0, 'colsample_bytree': 0.7, 'colsample_bylevel': 1.0, 'reg_alpha': 1.158467275297483e-06, 'reg_lambda': 0.504469230568818, 'gamma': 1.4725221130086559}. Best is trial 50 with value: -3.7835498517890067.
/bsuhome/alexanderemert/Research/Star-Formation-Research-Project-2026/pipeline/scripts/optuna/final_preds_and_models/optuna_search_mult_quant_reg.py:161: UserWarning: The distribution is specified by [0.1, 5] and step=0.25, but the range is not divisible by `step`. It will be replaced with [0.1, 4.85].
  error_threshold = trial.suggest_float("error_threshold", 0.1, 5, step=0.25)
[I 2026-07-20 18:23:00,745] Trial 59 finished with value: -3.889528175025923 and parameters: {'error_threshold': 4.85, 'scalers': 'robust', 'ratios': 'norm_ratio', 'imputers': 'median', 'n_estimators': 800, 'learning_rate': 0.004045227727957473, 'max_depth': 11, 'min_child_weight': 4, 'subsample': 0.8, 'colsample_bytree': 0.8, 'colsample_bylevel': 1.0, 'reg_alpha': 4.422304668597773e-05, 'reg_lambda': 0.15361501442520473, 'gamma': 6.4586498930278236}. Best is trial 50 with value: -3.7835498517890067.
/bsuhome/alexanderemert/Research/Star-Formation-Research-Project-2026/pipeline/scripts/optuna/final_preds_and_models/optuna_search_mult_quant_reg.py:161: UserWarning: The distribution is specified by [0.1, 5] and step=0.25, but the range is not divisible by `step`. It will be replaced with [0.1, 4.85].
  error_threshold = trial.suggest_float("error_threshold", 0.1, 5, step=0.25)
[I 2026-07-20 18:23:03,621] Trial 67 finished with value: -4.138280627983067 and parameters: {'error_threshold': 4.1, 'scalers': 'none', 'ratios': 'norm_ratio', 'imputers': 'mean', 'n_estimators': 300, 'learning_rate': 0.0019115572215888357, 'max_depth': 12, 'min_child_weight': 10, 'subsample': 1.0, 'colsample_bytree': 0.5, 'colsample_bylevel': 1.0, 'reg_alpha': 0.008616385709842795, 'reg_lambda': 0.9678249825997902, 'gamma': 1.769346004338985}. Best is trial 50 with value: -3.7835498517890067.
/bsuhome/alexanderemert/Research/Star-Formation-Research-Project-2026/pipeline/scripts/optuna/final_preds_and_models/optuna_search_mult_quant_reg.py:161: UserWarning: The distribution is specified by [0.1, 5] and step=0.25, but the range is not divisible by `step`. It will be replaced with [0.1, 4.85].
  error_threshold = trial.suggest_float("error_threshold", 0.1, 5, step=0.25)
[I 2026-07-20 18:23:05,318] Trial 70 finished with value: -3.846544763130416 and parameters: {'error_threshold': 1.1, 'scalers': 'robust', 'ratios': 'norm_ratio', 'imputers': 'mean', 'n_estimators': 650, 'learning_rate': 0.00769995374408487, 'max_depth': 5, 'min_child_weight': 3, 'subsample': 1.0, 'colsample_bytree': 0.9, 'colsample_bylevel': 1.0, 'reg_alpha': 1.1704419319689568e-06, 'reg_lambda': 0.5523692169581729, 'gamma': 2.0917224609927225}. Best is trial 50 with value: -3.7835498517890067.
/bsuhome/alexanderemert/Research/Star-Formation-Research-Project-2026/pipeline/scripts/optuna/final_preds_and_models/optuna_search_mult_quant_reg.py:161: UserWarning: The distribution is specified by [0.1, 5] and step=0.25, but the range is not divisible by `step`. It will be replaced with [0.1, 4.85].
  error_threshold = trial.suggest_float("error_threshold", 0.1, 5, step=0.25)
[I 2026-07-20 18:23:06,193] Trial 72 finished with value: -3.826603190225949 and parameters: {'error_threshold': 1.1, 'scalers': 'robust', 'ratios': 'norm_ratio', 'imputers': 'mean', 'n_estimators': 300, 'learning_rate': 0.008424288590181484, 'max_depth': 5, 'min_child_weight': 5, 'subsample': 1.0, 'colsample_bytree': 0.9, 'colsample_bylevel': 1.0, 'reg_alpha': 1.05045355441243e-06, 'reg_lambda': 0.5238388773586884, 'gamma': 0.432389315273772}. Best is trial 50 with value: -3.7835498517890067.
/bsuhome/alexanderemert/Research/Star-Formation-Research-Project-2026/pipeline/scripts/optuna/final_preds_and_models/optuna_search_mult_quant_reg.py:161: UserWarning: The distribution is specified by [0.1, 5] and step=0.25, but the range is not divisible by `step`. It will be replaced with [0.1, 4.85].
  error_threshold = trial.suggest_float("error_threshold", 0.1, 5, step=0.25)
[I 2026-07-20 18:23:07,025] Trial 73 finished with value: -4.37307878859127 and parameters: {'error_threshold': 1.35, 'scalers': 'robust', 'ratios': 'norm_ratio', 'imputers': 'mean', 'n_estimators': 300, 'learning_rate': 0.0008764910674218736, 'max_depth': 5, 'min_child_weight': 5, 'subsample': 0.5, 'colsample_bytree': 0.9, 'colsample_bylevel': 1.0, 'reg_alpha': 1.10339384074464e-06, 'reg_lambda': 0.07697893767041376, 'gamma': 0.6140121599884114}. Best is trial 50 with value: -3.7835498517890067.
/bsuhome/alexanderemert/Research/Star-Formation-Research-Project-2026/pipeline/scripts/optuna/final_preds_and_models/optuna_search_mult_quant_reg.py:161: UserWarning: The distribution is specified by [0.1, 5] and step=0.25, but the range is not divisible by `step`. It will be replaced with [0.1, 4.85].
  error_threshold = trial.suggest_float("error_threshold", 0.1, 5, step=0.25)
[I 2026-07-20 18:23:10,280] Trial 75 finished with value: -3.8880359820787103 and parameters: {'error_threshold': 2.1, 'scalers': 'robust', 'ratios': 'norm_ratio', 'imputers': 'mean', 'n_estimators': 2650, 'learning_rate': 0.007536473844855943, 'max_depth': 4, 'min_child_weight': 2, 'subsample': 0.5, 'colsample_bytree': 0.7, 'colsample_bylevel': 0.9, 'reg_alpha': 0.035259769236818596, 'reg_lambda': 1.3855198688986239, 'gamma': 18.4055141897674}. Best is trial 50 with value: -3.7835498517890067.
/bsuhome/alexanderemert/Research/Star-Formation-Research-Project-2026/pipeline/scripts/optuna/final_preds_and_models/optuna_search_mult_quant_reg.py:161: UserWarning: The distribution is specified by [0.1, 5] and step=0.25, but the range is not divisible by `step`. It will be replaced with [0.1, 4.85].
  error_threshold = trial.suggest_float("error_threshold", 0.1, 5, step=0.25)
[I 2026-07-20 18:23:14,446] Trial 76 finished with value: -3.9098753205095864 and parameters: {'error_threshold': 1.85, 'scalers': 'robust', 'ratios': 'norm_ratio', 'imputers': 'mean', 'n_estimators': 2800, 'learning_rate': 0.007645923855508535, 'max_depth': 10, 'min_child_weight': 9, 'subsample': 0.5, 'colsample_bytree': 0.7, 'colsample_bylevel': 0.6, 'reg_alpha': 0.08183386338849906, 'reg_lambda': 2.415288243925656, 'gamma': 19.165433578115213}. Best is trial 50 with value: -3.7835498517890067.
/bsuhome/alexanderemert/Research/Star-Formation-Research-Project-2026/pipeline/scripts/optuna/final_preds_and_models/optuna_search_mult_quant_reg.py:161: UserWarning: The distribution is specified by [0.1, 5] and step=0.25, but the range is not divisible by `step`. It will be replaced with [0.1, 4.85].
  error_threshold = trial.suggest_float("error_threshold", 0.1, 5, step=0.25)
[I 2026-07-20 18:23:20,618] Trial 77 finished with value: -3.9004936842517046 and parameters: {'error_threshold': 2.1, 'scalers': 'robust', 'ratios': 'norm_ratio', 'imputers': 'mean', 'n_estimators': 2800, 'learning_rate': 0.007703311435045026, 'max_depth': 10, 'min_child_weight': 3, 'subsample': 0.5, 'colsample_bytree': 1.0, 'colsample_bylevel': 0.6, 'reg_alpha': 0.0003565702789410309, 'reg_lambda': 2.483802862865968, 'gamma': 17.542173102975667}. Best is trial 50 with value: -3.7835498517890067.
/bsuhome/alexanderemert/Research/Star-Formation-Research-Project-2026/pipeline/scripts/optuna/final_preds_and_models/optuna_search_mult_quant_reg.py:161: UserWarning: The distribution is specified by [0.1, 5] and step=0.25, but the range is not divisible by `step`. It will be replaced with [0.1, 4.85].
  error_threshold = trial.suggest_float("error_threshold", 0.1, 5, step=0.25)
[I 2026-07-20 18:23:22,154] Trial 80 finished with value: -3.9085647648468775 and parameters: {'error_threshold': 2.1, 'scalers': 'robust', 'ratios': 'norm_ratio', 'imputers': 'mean', 'n_estimators': 150, 'learning_rate': 0.0078113602760117124, 'max_depth': 10, 'min_child_weight': 3, 'subsample': 0.5, 'colsample_bytree': 1.0, 'colsample_bylevel': 0.9, 'reg_alpha': 0.033328261062166326, 'reg_lambda': 1.9585199633711214, 'gamma': 18.093808710710682}. Best is trial 50 with value: -3.7835498517890067.
/bsuhome/alexanderemert/Research/Star-Formation-Research-Project-2026/pipeline/scripts/optuna/final_preds_and_models/optuna_search_mult_quant_reg.py:161: UserWarning: The distribution is specified by [0.1, 5] and step=0.25, but the range is not divisible by `step`. It will be replaced with [0.1, 4.85].
  error_threshold = trial.suggest_float("error_threshold", 0.1, 5, step=0.25)
[I 2026-07-20 18:23:24,664] Trial 81 finished with value: -3.9949341854587224 and parameters: {'error_threshold': 2.1, 'scalers': 'robust', 'ratios': 'norm_ratio', 'imputers': 'mean', 'n_estimators': 2850, 'learning_rate': 0.027986800922014207, 'max_depth': 4, 'min_child_weight': 3, 'subsample': 0.7, 'colsample_bytree': 1.0, 'colsample_bylevel': 0.9, 'reg_alpha': 2.551896480715575e-06, 'reg_lambda': 1.9722586077435016, 'gamma': 15.21074745734561}. Best is trial 50 with value: -3.7835498517890067.
/bsuhome/alexanderemert/Research/Star-Formation-Research-Project-2026/pipeline/scripts/optuna/final_preds_and_models/optuna_search_mult_quant_reg.py:161: UserWarning: The distribution is specified by [0.1, 5] and step=0.25, but the range is not divisible by `step`. It will be replaced with [0.1, 4.85].
  error_threshold = trial.suggest_float("error_threshold", 0.1, 5, step=0.25)
[I 2026-07-20 18:23:25,332] Trial 82 finished with value: -4.687084440224489 and parameters: {'error_threshold': 0.35, 'scalers': 'robust', 'ratios': 'norm_ratio', 'imputers': 'mean', 'n_estimators': 100, 'learning_rate': 0.00023758133431447758, 'max_depth': 10, 'min_child_weight': 9, 'subsample': 0.7, 'colsample_bytree': 1.0, 'colsample_bylevel': 0.9, 'reg_alpha': 2.3518667678906557e-06, 'reg_lambda': 2.8575327313532797, 'gamma': 39.33072404975555}. Best is trial 50 with value: -3.7835498517890067.
/bsuhome/alexanderemert/Research/Star-Formation-Research-Project-2026/pipeline/scripts/optuna/final_preds_and_models/optuna_search_mult_quant_reg.py:161: UserWarning: The distribution is specified by [0.1, 5] and step=0.25, but the range is not divisible by `step`. It will be replaced with [0.1, 4.85].
  error_threshold = trial.suggest_float("error_threshold", 0.1, 5, step=0.25)
[I 2026-07-20 18:23:50,017] Trial 74 finished with value: -3.890088557656046 and parameters: {'error_threshold': 1.1, 'scalers': 'robust', 'ratios': 'norm_ratio', 'imputers': 'mean', 'n_estimators': 2700, 'learning_rate': 0.0018725403916101133, 'max_depth': 12, 'min_child_weight': 5, 'subsample': 0.5, 'colsample_bytree': 0.7, 'colsample_bylevel': 1.0, 'reg_alpha': 4.0808860113808924e-06, 'reg_lambda': 0.446127562647481, 'gamma': 0.9513787780873795}. Best is trial 50 with value: -3.7835498517890067.
/bsuhome/alexanderemert/Research/Star-Formation-Research-Project-2026/pipeline/scripts/optuna/final_preds_and_models/optuna_search_mult_quant_reg.py:161: UserWarning: The distribution is specified by [0.1, 5] and step=0.25, but the range is not divisible by `step`. It will be replaced with [0.1, 4.85].
  error_threshold = trial.suggest_float("error_threshold", 0.1, 5, step=0.25)
[I 2026-07-20 18:24:02,364] Trial 78 finished with value: -3.8535967127452113 and parameters: {'error_threshold': 2.1, 'scalers': 'robust', 'ratios': 'log_ratio', 'imputers': 'mean', 'n_estimators': 1700, 'learning_rate': 0.0009766587101192913, 'max_depth': 10, 'min_child_weight': 9, 'subsample': 0.9, 'colsample_bytree': 0.7, 'colsample_bylevel': 0.9, 'reg_alpha': 0.02921858628340933, 'reg_lambda': 1.8121648477220593e-05, 'gamma': 16.33948403668068}. Best is trial 50 with value: -3.7835498517890067.
/bsuhome/alexanderemert/Research/Star-Formation-Research-Project-2026/pipeline/scripts/optuna/final_preds_and_models/optuna_search_mult_quant_reg.py:161: UserWarning: The distribution is specified by [0.1, 5] and step=0.25, but the range is not divisible by `step`. It will be replaced with [0.1, 4.85].
  error_threshold = trial.suggest_float("error_threshold", 0.1, 5, step=0.25)
[I 2026-07-20 18:24:06,600] Trial 83 finished with value: -4.027044700167617 and parameters: {'error_threshold': 0.6, 'scalers': 'robust', 'ratios': 'norm_ratio', 'imputers': 'mean', 'n_estimators': 600, 'learning_rate': 0.026989478569227433, 'max_depth': 10, 'min_child_weight': 8, 'subsample': 0.7, 'colsample_bytree': 1.0, 'colsample_bylevel': 0.9, 'reg_alpha': 0.00031318666315545955, 'reg_lambda': 0.017829562801119688, 'gamma': 6.14760892240594e-05}. Best is trial 50 with value: -3.7835498517890067.
/bsuhome/alexanderemert/Research/Star-Formation-Research-Project-2026/pipeline/scripts/optuna/final_preds_and_models/optuna_search_mult_quant_reg.py:161: UserWarning: The distribution is specified by [0.1, 5] and step=0.25, but the range is not divisible by `step`. It will be replaced with [0.1, 4.85].
  error_threshold = trial.suggest_float("error_threshold", 0.1, 5, step=0.25)
[I 2026-07-20 18:24:19,982] Trial 84 finished with value: -3.7924335131348066 and parameters: {'error_threshold': 0.6, 'scalers': 'robust', 'ratios': 'norm_ratio', 'imputers': 'mean', 'n_estimators': 100, 'learning_rate': 0.026419550479042108, 'max_depth': 4, 'min_child_weight': 8, 'subsample': 0.7, 'colsample_bytree': 1.0, 'colsample_bylevel': 0.9, 'reg_alpha': 2.6256002704969977e-06, 'reg_lambda': 0.0031640389102489835, 'gamma': 0.013791254473468772}. Best is trial 50 with value: -3.7835498517890067.
/bsuhome/alexanderemert/Research/Star-Formation-Research-Project-2026/pipeline/scripts/optuna/final_preds_and_models/optuna_search_mult_quant_reg.py:161: UserWarning: The distribution is specified by [0.1, 5] and step=0.25, but the range is not divisible by `step`. It will be replaced with [0.1, 4.85].
  error_threshold = trial.suggest_float("error_threshold", 0.1, 5, step=0.25)
[I 2026-07-20 18:24:20,526] Trial 85 finished with value: -3.801180116212125 and parameters: {'error_threshold': 0.6, 'scalers': 'robust', 'ratios': 'log_ratio', 'imputers': 'mean', 'n_estimators': 600, 'learning_rate': 0.024498714052458296, 'max_depth': 4, 'min_child_weight': 8, 'subsample': 0.9, 'colsample_bytree': 0.6, 'colsample_bylevel': 0.9, 'reg_alpha': 1.9897550184760465e-05, 'reg_lambda': 0.01608526166308659, 'gamma': 42.55590260517443}. Best is trial 50 with value: -3.7835498517890067.
/bsuhome/alexanderemert/Research/Star-Formation-Research-Project-2026/pipeline/scripts/optuna/final_preds_and_models/optuna_search_mult_quant_reg.py:161: UserWarning: The distribution is specified by [0.1, 5] and step=0.25, but the range is not divisible by `step`. It will be replaced with [0.1, 4.85].
  error_threshold = trial.suggest_float("error_threshold", 0.1, 5, step=0.25)
[I 2026-07-20 18:24:20,868] Trial 79 finished with value: -3.856471312697165 and parameters: {'error_threshold': 2.1, 'scalers': 'robust', 'ratios': 'log_ratio', 'imputers': 'mean', 'n_estimators': 1750, 'learning_rate': 0.0009643918169318747, 'max_depth': 10, 'min_child_weight': 8, 'subsample': 0.9, 'colsample_bytree': 0.7, 'colsample_bylevel': 0.9, 'reg_alpha': 0.07796971387592089, 'reg_lambda': 2.8399820077637526e-05, 'gamma': 15.76493220776205}. Best is trial 50 with value: -3.7835498517890067.
/bsuhome/alexanderemert/Research/Star-Formation-Research-Project-2026/pipeline/scripts/optuna/final_preds_and_models/optuna_search_mult_quant_reg.py:161: UserWarning: The distribution is specified by [0.1, 5] and step=0.25, but the range is not divisible by `step`. It will be replaced with [0.1, 4.85].
  error_threshold = trial.suggest_float("error_threshold", 0.1, 5, step=0.25)
[I 2026-07-20 18:24:24,687] Trial 86 finished with value: -4.542755290380452 and parameters: {'error_threshold': 4.6, 'scalers': 'robust', 'ratios': 'log_ratio', 'imputers': 'mean', 'n_estimators': 600, 'learning_rate': 0.0002561987128257315, 'max_depth': 12, 'min_child_weight': 8, 'subsample': 0.9, 'colsample_bytree': 0.6, 'colsample_bylevel': 0.9, 'reg_alpha': 1.7966676520821734e-05, 'reg_lambda': 28.256239576915494, 'gamma': 3.889336416512514e-05}. Best is trial 50 with value: -3.7835498517890067.
/bsuhome/alexanderemert/Research/Star-Formation-Research-Project-2026/pipeline/scripts/optuna/final_preds_and_models/optuna_search_mult_quant_reg.py:161: UserWarning: The distribution is specified by [0.1, 5] and step=0.25, but the range is not divisible by `step`. It will be replaced with [0.1, 4.85].
  error_threshold = trial.suggest_float("error_threshold", 0.1, 5, step=0.25)
[I 2026-07-20 18:24:28,305] Trial 87 finished with value: -4.0943711754273915 and parameters: {'error_threshold': 4.6, 'scalers': 'robust', 'ratios': 'log_ratio', 'imputers': 'mean', 'n_estimators': 600, 'learning_rate': 0.0010143091357204337, 'max_depth': 12, 'min_child_weight': 8, 'subsample': 0.9, 'colsample_bytree': 0.6, 'colsample_bylevel': 0.8, 'reg_alpha': 2.0006869348325682e-05, 'reg_lambda': 0.017024312244996034, 'gamma': 47.068121259095776}. Best is trial 50 with value: -3.7835498517890067.
/bsuhome/alexanderemert/Research/Star-Formation-Research-Project-2026/pipeline/scripts/optuna/final_preds_and_models/optuna_search_mult_quant_reg.py:161: UserWarning: The distribution is specified by [0.1, 5] and step=0.25, but the range is not divisible by `step`. It will be replaced with [0.1, 4.85].
  error_threshold = trial.suggest_float("error_threshold", 0.1, 5, step=0.25)
[I 2026-07-20 18:24:34,184] Trial 88 finished with value: -3.836868067096565 and parameters: {'error_threshold': 4.6, 'scalers': 'standard', 'ratios': 'log_ratio', 'imputers': 'mean', 'n_estimators': 1750, 'learning_rate': 0.0022694668246715658, 'max_depth': 7, 'min_child_weight': 7, 'subsample': 0.9, 'colsample_bytree': 0.6, 'colsample_bylevel': 1.0, 'reg_alpha': 1.8991484137550912e-05, 'reg_lambda': 3.5129940013412286e-05, 'gamma': 0.25234341992251286}. Best is trial 50 with value: -3.7835498517890067.
/bsuhome/alexanderemert/Research/Star-Formation-Research-Project-2026/pipeline/scripts/optuna/final_preds_and_models/optuna_search_mult_quant_reg.py:161: UserWarning: The distribution is specified by [0.1, 5] and step=0.25, but the range is not divisible by `step`. It will be replaced with [0.1, 4.85].
  error_threshold = trial.suggest_float("error_threshold", 0.1, 5, step=0.25)
[I 2026-07-20 18:24:36,690] Trial 89 finished with value: -3.8664712039953493 and parameters: {'error_threshold': 4.6, 'scalers': 'standard', 'ratios': 'log_ratio', 'imputers': 'mean', 'n_estimators': 600, 'learning_rate': 0.0024117532119461906, 'max_depth': 7, 'min_child_weight': 7, 'subsample': 0.9, 'colsample_bytree': 0.6, 'colsample_bylevel': 1.0, 'reg_alpha': 3.219292230031268, 'reg_lambda': 0.2491801820466139, 'gamma': 0.2742332532148005}. Best is trial 50 with value: -3.7835498517890067.
/bsuhome/alexanderemert/Research/Star-Formation-Research-Project-2026/pipeline/scripts/optuna/final_preds_and_models/optuna_search_mult_quant_reg.py:161: UserWarning: The distribution is specified by [0.1, 5] and step=0.25, but the range is not divisible by `step`. It will be replaced with [0.1, 4.85].
  error_threshold = trial.suggest_float("error_threshold", 0.1, 5, step=0.25)
[I 2026-07-20 18:24:46,988] Trial 90 finished with value: -3.8626851410736727 and parameters: {'error_threshold': 4.6, 'scalers': 'standard', 'ratios': 'log_ratio', 'imputers': 'mean', 'n_estimators': 900, 'learning_rate': 0.0024358307726633703, 'max_depth': 12, 'min_child_weight': 7, 'subsample': 0.9, 'colsample_bytree': 0.6, 'colsample_bylevel': 1.0, 'reg_alpha': 1.5526055070067633e-05, 'reg_lambda': 0.25345826817129136, 'gamma': 0.26634280912095765}. Best is trial 50 with value: -3.7835498517890067.
/bsuhome/alexanderemert/Research/Star-Formation-Research-Project-2026/pipeline/scripts/optuna/final_preds_and_models/optuna_search_mult_quant_reg.py:161: UserWarning: The distribution is specified by [0.1, 5] and step=0.25, but the range is not divisible by `step`. It will be replaced with [0.1, 4.85].
  error_threshold = trial.suggest_float("error_threshold", 0.1, 5, step=0.25)
[I 2026-07-20 18:24:47,119] Trial 93 finished with value: -3.78527949389685 and parameters: {'error_threshold': 4.6, 'scalers': 'robust', 'ratios': 'log_ratio', 'imputers': 'none', 'n_estimators': 900, 'learning_rate': 0.04094284074943182, 'max_depth': 3, 'min_child_weight': 7, 'subsample': 0.9, 'colsample_bytree': 0.6, 'colsample_bylevel': 0.8, 'reg_alpha': 1.9142044090948294e-05, 'reg_lambda': 0.0030905124618354585, 'gamma': 50.591545660744366}. Best is trial 50 with value: -3.7835498517890067.
/bsuhome/alexanderemert/Research/Star-Formation-Research-Project-2026/pipeline/scripts/optuna/final_preds_and_models/optuna_search_mult_quant_reg.py:161: UserWarning: The distribution is specified by [0.1, 5] and step=0.25, but the range is not divisible by `step`. It will be replaced with [0.1, 4.85].
  error_threshold = trial.suggest_float("error_threshold", 0.1, 5, step=0.25)
