[I 2026-07-20 13:46:39,056] Trial 598 finished with value: -0.312361058031476 and parameters: {'error_threshold': 2.5, 'scalers': 'standard', 'ratios': 'log_ratio', 'imputers': 'mean', 'n_estimators': 700, 'learning_rate': 0.0862381731445306, 'max_depth': 5, 'min_child_weight': 2, 'subsample': 0.5, 'colsample_bytree': 0.6, 'colsample_bylevel': 0.8, 'reg_alpha': 36.083945365846546, 'reg_lambda': 5.877505055644258e-06, 'gamma': 60.44112834923281}. Best is trial 540 with value: -0.33471006256374375.
[I 2026-07-20 13:46:39,325] Trial 599 finished with value: -0.21974900965446909 and parameters: {'error_threshold': 2.0, 'scalers': 'standard', 'ratios': 'log_ratio', 'imputers': 'mean', 'n_estimators': 550, 'learning_rate': 0.3121321140736615, 'max_depth': 5, 'min_child_weight': 2, 'subsample': 0.5, 'colsample_bytree': 0.6, 'colsample_bylevel': 0.8, 'reg_alpha': 36.78410065593392, 'reg_lambda': 5.346499093882638e-06, 'gamma': 8.728053367119077e-06}. Best is trial 540 with value: -0.33471006256374375.
[I 2026-07-20 13:46:45,719] Trial 600 finished with value: -0.2968100079819259 and parameters: {'error_threshold': 2.5, 'scalers': 'standard', 'ratios': 'log_ratio', 'imputers': 'mean', 'n_estimators': 700, 'learning_rate': 0.16397221134056564, 'max_depth': 5, 'min_child_weight': 2, 'subsample': 0.5, 'colsample_bytree': 0.6, 'colsample_bylevel': 0.8, 'reg_alpha': 11.503217742151696, 'reg_lambda': 4.957843401808086e-06, 'gamma': 67.63076396809461}. Best is trial 540 with value: -0.33471006256374375.
[I 2026-07-20 13:46:46,030] Trial 601 finished with value: -0.3151259605137615 and parameters: {'error_threshold': 2.0, 'scalers': 'standard', 'ratios': 'log_ratio', 'imputers': 'mean', 'n_estimators': 550, 'learning_rate': 0.15313756884480376, 'max_depth': 5, 'min_child_weight': 2, 'subsample': 0.5, 'colsample_bytree': 0.6, 'colsample_bylevel': 0.8, 'reg_alpha': 32.925397657482, 'reg_lambda': 1.4776272909273911e-06, 'gamma': 68.739146526436}. Best is trial 540 with value: -0.33471006256374375.
[I 2026-07-20 13:46:46,382] Trial 602 finished with value: -0.29879518434294045 and parameters: {'error_threshold': 2.5, 'scalers': 'standard', 'ratios': 'log_ratio', 'imputers': 'mean', 'n_estimators': 700, 'learning_rate': 0.33749328488126273, 'max_depth': 5, 'min_child_weight': 2, 'subsample': 0.5, 'colsample_bytree': 0.6, 'colsample_bylevel': 0.8, 'reg_alpha': 10.406732014886165, 'reg_lambda': 1.1092652022164254e-05, 'gamma': 68.00205148741887}. Best is trial 540 with value: -0.33471006256374375.
[I 2026-07-20 13:46:46,653] Trial 604 finished with value: -0.29973046306773804 and parameters: {'error_threshold': 2.0, 'scalers': 'standard', 'ratios': 'log_ratio', 'imputers': 'mean', 'n_estimators': 550, 'learning_rate': 0.39131456352908817, 'max_depth': 5, 'min_child_weight': 2, 'subsample': 0.5, 'colsample_bytree': 0.6, 'colsample_bylevel': 0.8, 'reg_alpha': 9.075902774148648, 'reg_lambda': 1.1791343428577144e-05, 'gamma': 72.92305726079174}. Best is trial 540 with value: -0.33471006256374375.
[I 2026-07-20 13:46:46,925] Trial 605 finished with value: -0.30463569945509344 and parameters: {'error_threshold': 2.5, 'scalers': 'standard', 'ratios': 'log_ratio', 'imputers': 'mean', 'n_estimators': 550, 'learning_rate': 0.32268985921598636, 'max_depth': 5, 'min_child_weight': 2, 'subsample': 0.5, 'colsample_bytree': 0.6, 'colsample_bylevel': 0.8, 'reg_alpha': 36.2583455961533, 'reg_lambda': 1.1396996382380795e-05, 'gamma': 69.96250227279589}. Best is trial 540 with value: -0.33471006256374375.
[I 2026-07-20 13:46:47,402] Trial 603 finished with value: -0.20799226072113122 and parameters: {'error_threshold': 2.5, 'scalers': 'standard', 'ratios': 'log_ratio', 'imputers': 'mean', 'n_estimators': 550, 'learning_rate': 0.3290309713296009, 'max_depth': 5, 'min_child_weight': 2, 'subsample': 0.5, 'colsample_bytree': 0.6, 'colsample_bylevel': 0.8, 'reg_alpha': 8.992365338662294, 'reg_lambda': 1.1303163578022403e-05, 'gamma': 7.916983684782979e-06}. Best is trial 540 with value: -0.33471006256374375.
[I 2026-07-20 13:46:47,667] Trial 606 finished with value: -0.29730698884657575 and parameters: {'error_threshold': 2.0, 'scalers': 'standard', 'ratios': 'log_ratio', 'imputers': 'mean', 'n_estimators': 500, 'learning_rate': 0.4089130805530246, 'max_depth': 5, 'min_child_weight': 2, 'subsample': 0.5, 'colsample_bytree': 0.6, 'colsample_bylevel': 0.8, 'reg_alpha': 40.12240259945377, 'reg_lambda': 1.2600356477391357e-05, 'gamma': 71.64500927626821}. Best is trial 540 with value: -0.33471006256374375.
[I 2026-07-20 13:46:48,032] Trial 607 finished with value: -0.2986023995913696 and parameters: {'error_threshold': 2.5, 'scalers': 'standard', 'ratios': 'log_ratio', 'imputers': 'mean', 'n_estimators': 800, 'learning_rate': 0.41026355998091135, 'max_depth': 5, 'min_child_weight': 2, 'subsample': 0.5, 'colsample_bytree': 0.6, 'colsample_bylevel': 0.8, 'reg_alpha': 12.309989254390022, 'reg_lambda': 8.550107427928225e-06, 'gamma': 70.49655930339392}. Best is trial 540 with value: -0.33471006256374375.
[I 2026-07-20 13:46:54,100] Trial 608 finished with value: -0.29904946044657826 and parameters: {'error_threshold': 2.0, 'scalers': 'standard', 'ratios': 'log_ratio', 'imputers': 'mean', 'n_estimators': 800, 'learning_rate': 0.3044183877133953, 'max_depth': 5, 'min_child_weight': 2, 'subsample': 0.5, 'colsample_bytree': 0.6, 'colsample_bylevel': 0.8, 'reg_alpha': 7.482523145387325, 'reg_lambda': 1.4501127280965329e-06, 'gamma': 71.6891658212669}. Best is trial 540 with value: -0.33471006256374375.
[I 2026-07-20 13:46:54,376] Trial 609 finished with value: -0.33453649213834447 and parameters: {'error_threshold': 2.0, 'scalers': 'standard', 'ratios': 'log_ratio', 'imputers': 'mean', 'n_estimators': 450, 'learning_rate': 0.31130755421119116, 'max_depth': 5, 'min_child_weight': 2, 'subsample': 0.5, 'colsample_bytree': 0.6, 'colsample_bylevel': 0.8, 'reg_alpha': 44.11561023526149, 'reg_lambda': 1.1004680622220952e-05, 'gamma': 99.85167503430365}. Best is trial 540 with value: -0.33471006256374375.
[I 2026-07-20 13:46:54,624] Trial 610 finished with value: -0.3345487802540095 and parameters: {'error_threshold': 2.5, 'scalers': 'standard', 'ratios': 'log_ratio', 'imputers': 'mean', 'n_estimators': 500, 'learning_rate': 0.04182900821582311, 'max_depth': 5, 'min_child_weight': 2, 'subsample': 0.5, 'colsample_bytree': 0.6, 'colsample_bylevel': 0.8, 'reg_alpha': 44.02048100465072, 'reg_lambda': 1.4036676564191829e-05, 'gamma': 98.37514545330252}. Best is trial 540 with value: -0.33471006256374375.
[I 2026-07-20 13:46:55,006] Trial 611 finished with value: -0.30111604981260176 and parameters: {'error_threshold': 2.5, 'scalers': 'standard', 'ratios': 'log_ratio', 'imputers': 'mean', 'n_estimators': 800, 'learning_rate': 0.20061927761315773, 'max_depth': 5, 'min_child_weight': 7, 'subsample': 0.5, 'colsample_bytree': 0.6, 'colsample_bylevel': 0.8, 'reg_alpha': 44.314686922940844, 'reg_lambda': 8.341366635799849e-06, 'gamma': 42.75581932103362}. Best is trial 540 with value: -0.33471006256374375.
[I 2026-07-20 13:46:55,266] Trial 612 finished with value: -0.3012651532012986 and parameters: {'error_threshold': 2.5, 'scalers': 'standard', 'ratios': 'log_ratio', 'imputers': 'mean', 'n_estimators': 500, 'learning_rate': 0.19871802520198925, 'max_depth': 5, 'min_child_weight': 2, 'subsample': 0.5, 'colsample_bytree': 0.6, 'colsample_bylevel': 0.8, 'reg_alpha': 45.8693626640604, 'reg_lambda': 1.673964721482412e-05, 'gamma': 43.02429025512685}. Best is trial 540 with value: -0.33471006256374375.
[I 2026-07-20 13:46:55,695] Trial 613 finished with value: -0.3014321659841875 and parameters: {'error_threshold': 2.5, 'scalers': 'standard', 'ratios': 'log_ratio', 'imputers': 'mean', 'n_estimators': 800, 'learning_rate': 0.1964328079177384, 'max_depth': 5, 'min_child_weight': 2, 'subsample': 0.5, 'colsample_bytree': 0.6, 'colsample_bylevel': 0.8, 'reg_alpha': 45.29485358852378, 'reg_lambda': 1.608695694995994e-05, 'gamma': 43.003299844156636}. Best is trial 540 with value: -0.33471006256374375.
[I 2026-07-20 13:46:56,085] Trial 614 finished with value: -0.3013081462853713 and parameters: {'error_threshold': 2.5, 'scalers': 'standard', 'ratios': 'log_ratio', 'imputers': 'mean', 'n_estimators': 800, 'learning_rate': 0.19940747721955118, 'max_depth': 5, 'min_child_weight': 2, 'subsample': 0.5, 'colsample_bytree': 0.6, 'colsample_bylevel': 0.8, 'reg_alpha': 48.368299845278266, 'reg_lambda': 7.81089402455902e-06, 'gamma': 40.91340706316912}. Best is trial 540 with value: -0.33471006256374375.
[I 2026-07-20 13:46:56,469] Trial 615 finished with value: -0.3067195487835857 and parameters: {'error_threshold': 2.5, 'scalers': 'standard', 'ratios': 'log_ratio', 'imputers': 'mean', 'n_estimators': 800, 'learning_rate': 0.040832657919993715, 'max_depth': 5, 'min_child_weight': 2, 'subsample': 0.5, 'colsample_bytree': 0.6, 'colsample_bylevel': 0.8, 'reg_alpha': 47.0687896103472, 'reg_lambda': 7.608814901472168e-06, 'gamma': 42.62983902262025}. Best is trial 540 with value: -0.33471006256374375.
[I 2026-07-20 13:47:03,410] Trial 616 finished with value: -0.3157621225659566 and parameters: {'error_threshold': 2.5, 'scalers': 'standard', 'ratios': 'log_ratio', 'imputers': 'mean', 'n_estimators': 800, 'learning_rate': 0.19051651746914774, 'max_depth': 5, 'min_child_weight': 2, 'subsample': 0.5, 'colsample_bytree': 0.6, 'colsample_bylevel': 0.8, 'reg_alpha': 5.1416238160490355, 'reg_lambda': 7.820850539831978e-06, 'gamma': 98.32146295048074}. Best is trial 540 with value: -0.33471006256374375.
[I 2026-07-20 13:47:03,812] Trial 617 finished with value: -0.30761536904747605 and parameters: {'error_threshold': 2.5, 'scalers': 'standard', 'ratios': 'log_ratio', 'imputers': 'mean', 'n_estimators': 800, 'learning_rate': 0.04742500064920826, 'max_depth': 5, 'min_child_weight': 7, 'subsample': 0.5, 'colsample_bytree': 0.6, 'colsample_bylevel': 0.8, 'reg_alpha': 48.106835070446074, 'reg_lambda': 7.634488480837722e-06, 'gamma': 41.702916090334064}. Best is trial 540 with value: -0.33471006256374375.
[I 2026-07-20 13:47:04,247] Trial 618 finished with value: -0.3117530049996713 and parameters: {'error_threshold': 2.5, 'scalers': 'standard', 'ratios': 'log_ratio', 'imputers': 'mean', 'n_estimators': 750, 'learning_rate': 0.04322743484144029, 'max_depth': 5, 'min_child_weight': 2, 'subsample': 0.5, 'colsample_bytree': 0.6, 'colsample_bylevel': 0.8, 'reg_alpha': 52.995118333119265, 'reg_lambda': 8.225892931748094e-06, 'gamma': 43.626445815413454}. Best is trial 540 with value: -0.33471006256374375.
[I 2026-07-20 13:47:04,610] Trial 619 finished with value: -0.2939813518764152 and parameters: {'error_threshold': 2.5, 'scalers': 'standard', 'ratios': 'log_ratio', 'imputers': 'mean', 'n_estimators': 750, 'learning_rate': 0.04491986452827697, 'max_depth': 5, 'min_child_weight': 2, 'subsample': 0.5, 'colsample_bytree': 0.6, 'colsample_bylevel': 0.8, 'reg_alpha': 26.38029071167797, 'reg_lambda': 7.048531182775834e-06, 'gamma': 40.5452806464537}. Best is trial 540 with value: -0.33471006256374375.
[I 2026-07-20 13:47:05,006] Trial 620 finished with value: -0.2927026740542608 and parameters: {'error_threshold': 3.0, 'scalers': 'standard', 'ratios': 'log_ratio', 'imputers': 'mean', 'n_estimators': 800, 'learning_rate': 0.0770396539486387, 'max_depth': 5, 'min_child_weight': 2, 'subsample': 0.5, 'colsample_bytree': 0.6, 'colsample_bylevel': 0.8, 'reg_alpha': 28.42436152137067, 'reg_lambda': 6.777616677289485e-06, 'gamma': 37.791055827404605}. Best is trial 540 with value: -0.33471006256374375.
[I 2026-07-20 13:47:05,424] Trial 621 finished with value: -0.21025437389323376 and parameters: {'error_threshold': 2.25, 'scalers': 'standard', 'ratios': 'log_ratio', 'imputers': 'mean', 'n_estimators': 750, 'learning_rate': 0.07392629722536082, 'max_depth': 5, 'min_child_weight': 2, 'subsample': 0.5, 'colsample_bytree': 0.6, 'colsample_bylevel': 0.8, 'reg_alpha': 25.657789237975436, 'reg_lambda': 8.035317937584494e-06, 'gamma': 0.05718389607333808}. Best is trial 540 with value: -0.33471006256374375.
[I 2026-07-20 13:47:05,826] Trial 622 finished with value: -0.2989868876611161 and parameters: {'error_threshold': 2.25, 'scalers': 'standard', 'ratios': 'log_ratio', 'imputers': 'mean', 'n_estimators': 750, 'learning_rate': 0.07863121203458528, 'max_depth': 5, 'min_child_weight': 2, 'subsample': 0.5, 'colsample_bytree': 0.6, 'colsample_bylevel': 0.8, 'reg_alpha': 24.14534157847682, 'reg_lambda': 8.158530546482581e-06, 'gamma': 49.87285895478393}. Best is trial 540 with value: -0.33471006256374375.
[I 2026-07-20 13:47:06,420] Trial 623 finished with value: -0.33299137350588864 and parameters: {'error_threshold': 2.25, 'scalers': 'standard', 'ratios': 'log_ratio', 'imputers': 'mean', 'n_estimators': 750, 'learning_rate': 0.045347622704442064, 'max_depth': 5, 'min_child_weight': 2, 'subsample': 0.5, 'colsample_bytree': 0.6, 'colsample_bylevel': 0.8, 'reg_alpha': 24.885549121558636, 'reg_lambda': 7.00521476344367e-06, 'gamma': 99.96567941792067}. Best is trial 540 with value: -0.33471006256374375.
[I 2026-07-20 13:47:12,353] Trial 624 finished with value: -0.30445975040790074 and parameters: {'error_threshold': 3.0, 'scalers': 'standard', 'ratios': 'log_ratio', 'imputers': 'mean', 'n_estimators': 750, 'learning_rate': 0.07433216943814656, 'max_depth': 5, 'min_child_weight': 2, 'subsample': 0.5, 'colsample_bytree': 0.6, 'colsample_bylevel': 0.8, 'reg_alpha': 26.063471297711438, 'reg_lambda': 1.8163988158778736e-06, 'gamma': 54.89285660868124}. Best is trial 540 with value: -0.33471006256374375.
[I 2026-07-20 13:47:12,734] Trial 625 finished with value: -0.3318662699865019 and parameters: {'error_threshold': 2.25, 'scalers': 'standard', 'ratios': 'log_ratio', 'imputers': 'mean', 'n_estimators': 750, 'learning_rate': 0.07890303797837474, 'max_depth': 5, 'min_child_weight': 2, 'subsample': 0.5, 'colsample_bytree': 0.6, 'colsample_bylevel': 0.8, 'reg_alpha': 25.31853161605343, 'reg_lambda': 3.574414748323842e-06, 'gamma': 99.3673411567664}. Best is trial 540 with value: -0.33471006256374375.
[I 2026-07-20 13:47:13,053] Trial 626 finished with value: -0.31419669840320913 and parameters: {'error_threshold': 2.25, 'scalers': 'standard', 'ratios': 'log_ratio', 'imputers': 'mean', 'n_estimators': 650, 'learning_rate': 0.07740720562729402, 'max_depth': 5, 'min_child_weight': 2, 'subsample': 0.5, 'colsample_bytree': 0.6, 'colsample_bylevel': 0.8, 'reg_alpha': 28.094402456356754, 'reg_lambda': 1.7958483276343384e-06, 'gamma': 69.61495739858846}. Best is trial 540 with value: -0.33471006256374375.
[I 2026-07-20 13:47:13,392] Trial 627 finished with value: -0.3345149490244191 and parameters: {'error_threshold': 2.25, 'scalers': 'standard', 'ratios': 'log_ratio', 'imputers': 'mean', 'n_estimators': 650, 'learning_rate': 0.07521372628250797, 'max_depth': 5, 'min_child_weight': 2, 'subsample': 0.5, 'colsample_bytree': 0.6, 'colsample_bylevel': 0.8, 'reg_alpha': 26.62140903316255, 'reg_lambda': 1.7795698970002787e-06, 'gamma': 98.77797705470965}. Best is trial 540 with value: -0.33471006256374375.
[I 2026-07-20 13:47:13,710] Trial 628 finished with value: -0.31432034038024376 and parameters: {'error_threshold': 2.25, 'scalers': 'standard', 'ratios': 'log_ratio', 'imputers': 'mean', 'n_estimators': 650, 'learning_rate': 0.06850810124750122, 'max_depth': 5, 'min_child_weight': 2, 'subsample': 0.5, 'colsample_bytree': 0.6, 'colsample_bylevel': 0.8, 'reg_alpha': 25.368184938880656, 'reg_lambda': 1.8965474318202432e-06, 'gamma': 70.88119984147055}. Best is trial 540 with value: -0.33471006256374375.
[I 2026-07-20 13:47:14,041] Trial 629 finished with value: -0.2948415163857065 and parameters: {'error_threshold': 2.25, 'scalers': 'standard', 'ratios': 'log_ratio', 'imputers': 'mean', 'n_estimators': 650, 'learning_rate': 0.2589833553574954, 'max_depth': 5, 'min_child_weight': 6, 'subsample': 0.5, 'colsample_bytree': 0.6, 'colsample_bylevel': 0.8, 'reg_alpha': 0.11908499369626144, 'reg_lambda': 1.70687091501532e-06, 'gamma': 72.81424654844052}. Best is trial 540 with value: -0.33471006256374375.
[I 2026-07-20 13:47:14,402] Trial 630 finished with value: -0.3345141941709104 and parameters: {'error_threshold': 2.25, 'scalers': 'standard', 'ratios': 'log_ratio', 'imputers': 'mean', 'n_estimators': 650, 'learning_rate': 0.06129985355692974, 'max_depth': 5, 'min_child_weight': 2, 'subsample': 0.5, 'colsample_bytree': 0.6, 'colsample_bylevel': 0.8, 'reg_alpha': 59.439029537954134, 'reg_lambda': 3.4000200463402236e-06, 'gamma': 70.69593503698196}. Best is trial 540 with value: -0.33471006256374375.
[I 2026-07-20 13:47:14,737] Trial 631 finished with value: -0.3300499434888791 and parameters: {'error_threshold': 2.75, 'scalers': 'standard', 'ratios': 'log_ratio', 'imputers': 'mean', 'n_estimators': 700, 'learning_rate': 0.06242560256897075, 'max_depth': 5, 'min_child_weight': 2, 'subsample': 0.5, 'colsample_bytree': 0.6, 'colsample_bylevel': 0.8, 'reg_alpha': 55.13050097970452, 'reg_lambda': 1.9300369406769046e-06, 'gamma': 68.67885832548241}. Best is trial 540 with value: -0.33471006256374375.
[I 2026-07-20 13:47:21,411] Trial 632 finished with value: -0.3345372277388899 and parameters: {'error_threshold': 2.75, 'scalers': 'standard', 'ratios': 'log_ratio', 'imputers': 'mean', 'n_estimators': 650, 'learning_rate': 0.2616709294382648, 'max_depth': 5, 'min_child_weight': 2, 'subsample': 0.5, 'colsample_bytree': 0.6, 'colsample_bylevel': 0.8, 'reg_alpha': 60.898658899470114, 'reg_lambda': 3.3205858628806193e-06, 'gamma': 71.25150866013125}. Best is trial 540 with value: -0.33471006256374375.
[I 2026-07-20 13:47:21,728] Trial 633 finished with value: -0.33451419350721556 and parameters: {'error_threshold': 2.75, 'scalers': 'standard', 'ratios': 'log_ratio', 'imputers': 'mean', 'n_estimators': 650, 'learning_rate': 0.06119603775360287, 'max_depth': 5, 'min_child_weight': 6, 'subsample': 0.5, 'colsample_bytree': 0.6, 'colsample_bylevel': 0.8, 'reg_alpha': 59.54247935996713, 'reg_lambda': 1.7103777363140783e-05, 'gamma': 67.58124346993526}. Best is trial 540 with value: -0.33471006256374375.
[I 2026-07-20 13:47:22,090] Trial 634 finished with value: -0.3001241794145167 and parameters: {'error_threshold': 2.75, 'scalers': 'standard', 'ratios': 'log_ratio', 'imputers': 'mean', 'n_estimators': 650, 'learning_rate': 0.06208636980945911, 'max_depth': 5, 'min_child_weight': 2, 'subsample': 0.5, 'colsample_bytree': 0.6, 'colsample_bylevel': 0.8, 'reg_alpha': 0.00020130867044085445, 'reg_lambda': 3.61796909398906e-06, 'gamma': 71.86865281909387}. Best is trial 540 with value: -0.33471006256374375.
[I 2026-07-20 13:47:22,414] Trial 635 finished with value: -0.33456963457053673 and parameters: {'error_threshold': 2.5, 'scalers': 'standard', 'ratios': 'log_ratio', 'imputers': 'mean', 'n_estimators': 700, 'learning_rate': 0.2578028137007006, 'max_depth': 5, 'min_child_weight': 2, 'subsample': 0.5, 'colsample_bytree': 0.6, 'colsample_bylevel': 0.8, 'reg_alpha': 59.722489028949354, 'reg_lambda': 3.1358240205683333e-06, 'gamma': 68.95652050595027}. Best is trial 540 with value: -0.33471006256374375.
[I 2026-07-20 13:47:22,754] Trial 636 finished with value: -0.2964381586819766 and parameters: {'error_threshold': 2.75, 'scalers': 'standard', 'ratios': 'log_ratio', 'imputers': 'mean', 'n_estimators': 700, 'learning_rate': 0.24464589637650191, 'max_depth': 5, 'min_child_weight': 2, 'subsample': 0.5, 'colsample_bytree': 0.6, 'colsample_bylevel': 0.8, 'reg_alpha': 59.34693108152496, 'reg_lambda': 1.7586576208236582e-05, 'gamma': 31.506625637769194}. Best is trial 540 with value: -0.33471006256374375.
[I 2026-07-20 13:47:23,078] Trial 637 finished with value: -0.30424405860842607 and parameters: {'error_threshold': 2.75, 'scalers': 'standard', 'ratios': 'log_ratio', 'imputers': 'mean', 'n_estimators': 700, 'learning_rate': 0.15188472857020086, 'max_depth': 5, 'min_child_weight': 2, 'subsample': 0.5, 'colsample_bytree': 0.6, 'colsample_bylevel': 0.8, 'reg_alpha': 59.19779092227079, 'reg_lambda': 3.6951676286533395e-06, 'gamma': 34.013825233012554}. Best is trial 540 with value: -0.33471006256374375.
[I 2026-07-20 13:47:24,890] Trial 639 finished with value: -0.30207407241159556 and parameters: {'error_threshold': 2.75, 'scalers': 'standard', 'ratios': 'log_ratio', 'imputers': 'mean', 'n_estimators': 800, 'learning_rate': 0.03724790206061081, 'max_depth': 5, 'min_child_weight': 2, 'subsample': 0.5, 'colsample_bytree': 0.6, 'colsample_bylevel': 0.8, 'reg_alpha': 59.70853210913806, 'reg_lambda': 1.0544375448156064e-06, 'gamma': 28.87155618263824}. Best is trial 540 with value: -0.33471006256374375.
