[I 2026-07-20 13:43:30,766] Trial 449 finished with value: -0.3345395840516354 and parameters: {'error_threshold': 4.75, 'scalers': 'robust', 'ratios': 'norm_ratio', 'imputers': 'mean', 'n_estimators': 900, 'learning_rate': 0.00567384474492894, 'max_depth': 5, 'min_child_weight': 2, 'subsample': 0.5, 'colsample_bytree': 0.6, 'colsample_bylevel': 0.6, 'reg_alpha': 98.36229323545457, 'reg_lambda': 0.000546742812584057, 'gamma': 65.79433176615147}. Best is trial 355 with value: -0.3345736073215237.
[I 2026-07-20 13:43:31,202] Trial 450 finished with value: -0.32337769971571734 and parameters: {'error_threshold': 4.75, 'scalers': 'robust', 'ratios': 'norm_ratio', 'imputers': 'mean', 'n_estimators': 900, 'learning_rate': 0.004883452532899223, 'max_depth': 5, 'min_child_weight': 2, 'subsample': 0.5, 'colsample_bytree': 0.6, 'colsample_bylevel': 0.9, 'reg_alpha': 34.99799667397298, 'reg_lambda': 6.174775169318083e-06, 'gamma': 69.31405009249274}. Best is trial 355 with value: -0.3345736073215237.
[I 2026-07-20 13:43:31,689] Trial 451 finished with value: -0.33456532051292337 and parameters: {'error_threshold': 4.75, 'scalers': 'robust', 'ratios': 'norm_ratio', 'imputers': 'mean', 'n_estimators': 900, 'learning_rate': 0.06505644053300452, 'max_depth': 5, 'min_child_weight': 2, 'subsample': 0.5, 'colsample_bytree': 0.6, 'colsample_bylevel': 0.9, 'reg_alpha': 99.13628695962808, 'reg_lambda': 5.825623058025688e-06, 'gamma': 66.58217797459757}. Best is trial 355 with value: -0.3345736073215237.
[I 2026-07-20 13:43:32,129] Trial 452 finished with value: -0.33456497287008585 and parameters: {'error_threshold': 4.75, 'scalers': 'robust', 'ratios': 'norm_ratio', 'imputers': 'mean', 'n_estimators': 900, 'learning_rate': 0.06339181830369423, 'max_depth': 5, 'min_child_weight': 2, 'subsample': 0.5, 'colsample_bytree': 0.6, 'colsample_bylevel': 0.9, 'reg_alpha': 97.8729399926207, 'reg_lambda': 43.050175335582516, 'gamma': 63.08255019530706}. Best is trial 355 with value: -0.3345736073215237.
[I 2026-07-20 13:43:32,566] Trial 453 finished with value: -0.3345375789135359 and parameters: {'error_threshold': 4.75, 'scalers': 'robust', 'ratios': 'norm_ratio', 'imputers': 'mean', 'n_estimators': 900, 'learning_rate': 0.004845367781280695, 'max_depth': 5, 'min_child_weight': 2, 'subsample': 0.5, 'colsample_bytree': 0.6, 'colsample_bylevel': 0.9, 'reg_alpha': 99.52411030599869, 'reg_lambda': 41.82333415385384, 'gamma': 65.59596537219274}. Best is trial 355 with value: -0.3345736073215237.
[I 2026-07-20 13:43:33,492] Trial 454 finished with value: -0.33456439976659985 and parameters: {'error_threshold': 4.75, 'scalers': 'robust', 'ratios': 'norm_ratio', 'imputers': 'mean', 'n_estimators': 900, 'learning_rate': 0.060835039401934216, 'max_depth': 5, 'min_child_weight': 2, 'subsample': 0.5, 'colsample_bytree': 0.6, 'colsample_bylevel': 0.9, 'reg_alpha': 99.09074342410446, 'reg_lambda': 42.30038733698883, 'gamma': 62.34852469520404}. Best is trial 355 with value: -0.3345736073215237.
[I 2026-07-20 13:43:33,926] Trial 455 finished with value: -0.3166699743809924 and parameters: {'error_threshold': 4.75, 'scalers': 'robust', 'ratios': 'norm_ratio', 'imputers': 'mean', 'n_estimators': 900, 'learning_rate': 0.06577348691266209, 'max_depth': 4, 'min_child_weight': 2, 'subsample': 0.5, 'colsample_bytree': 0.6, 'colsample_bylevel': 0.9, 'reg_alpha': 40.115233707466565, 'reg_lambda': 0.460679014520394, 'gamma': 63.459098752421085}. Best is trial 355 with value: -0.3345736073215237.
[I 2026-07-20 13:43:39,767] Trial 456 finished with value: -0.32249171003864713 and parameters: {'error_threshold': 4.75, 'scalers': 'robust', 'ratios': 'norm_ratio', 'imputers': 'mean', 'n_estimators': 900, 'learning_rate': 0.06431572934868218, 'max_depth': 5, 'min_child_weight': 2, 'subsample': 0.5, 'colsample_bytree': 0.6, 'colsample_bylevel': 0.9, 'reg_alpha': 37.350151872628665, 'reg_lambda': 40.65333333038546, 'gamma': 68.12709249444224}. Best is trial 355 with value: -0.3345736073215237.
[I 2026-07-20 13:43:40,995] Trial 457 finished with value: -0.29661732331566926 and parameters: {'error_threshold': 4.75, 'scalers': 'robust', 'ratios': 'norm_ratio', 'imputers': 'mean', 'n_estimators': 900, 'learning_rate': 0.06281569026396103, 'max_depth': 5, 'min_child_weight': 2, 'subsample': 0.5, 'colsample_bytree': 0.5, 'colsample_bylevel': 0.6, 'reg_alpha': 40.42820819989851, 'reg_lambda': 0.0004512992636237813, 'gamma': 34.73193919834033}. Best is trial 355 with value: -0.3345736073215237.
[I 2026-07-20 13:43:41,410] Trial 458 finished with value: -0.29994280168684556 and parameters: {'error_threshold': 4.75, 'scalers': 'robust', 'ratios': 'norm_ratio', 'imputers': 'mean', 'n_estimators': 800, 'learning_rate': 0.007635704546890383, 'max_depth': 5, 'min_child_weight': 2, 'subsample': 0.5, 'colsample_bytree': 0.5, 'colsample_bylevel': 0.7, 'reg_alpha': 38.64987367089832, 'reg_lambda': 0.00032532152577574607, 'gamma': 34.99369883933323}. Best is trial 355 with value: -0.3345736073215237.
[I 2026-07-20 13:43:41,807] Trial 459 finished with value: -0.2994077092896614 and parameters: {'error_threshold': 4.75, 'scalers': 'robust', 'ratios': 'norm_ratio', 'imputers': 'mean', 'n_estimators': 800, 'learning_rate': 0.007730834206638319, 'max_depth': 5, 'min_child_weight': 2, 'subsample': 0.5, 'colsample_bytree': 0.6, 'colsample_bylevel': 0.8, 'reg_alpha': 37.93047566368278, 'reg_lambda': 2.4969591596714614e-06, 'gamma': 36.04521659909801}. Best is trial 355 with value: -0.3345736073215237.
[I 2026-07-20 13:43:42,187] Trial 460 finished with value: -0.29208801551481306 and parameters: {'error_threshold': 4.75, 'scalers': 'robust', 'ratios': 'norm_ratio', 'imputers': 'mean', 'n_estimators': 800, 'learning_rate': 0.09366519228070526, 'max_depth': 5, 'min_child_weight': 2, 'subsample': 0.5, 'colsample_bytree': 0.6, 'colsample_bylevel': 0.6, 'reg_alpha': 42.11419028153761, 'reg_lambda': 3.8017037971032907e-06, 'gamma': 29.427253008067158}. Best is trial 355 with value: -0.3345736073215237.
[I 2026-07-20 13:43:42,614] Trial 461 finished with value: -0.32581764337414637 and parameters: {'error_threshold': 4.75, 'scalers': 'robust', 'ratios': 'norm_ratio', 'imputers': 'mean', 'n_estimators': 800, 'learning_rate': 0.06149055878391382, 'max_depth': 5, 'min_child_weight': 2, 'subsample': 0.5, 'colsample_bytree': 0.6, 'colsample_bylevel': 0.7, 'reg_alpha': 96.54415209087803, 'reg_lambda': 1.6023125773879202e-05, 'gamma': 30.573471068173383}. Best is trial 355 with value: -0.3345736073215237.
[I 2026-07-20 13:43:43,365] Trial 462 finished with value: -0.3227026091410215 and parameters: {'error_threshold': 4.75, 'scalers': 'robust', 'ratios': 'norm_ratio', 'imputers': 'mean', 'n_estimators': 800, 'learning_rate': 0.06286155849571512, 'max_depth': 5, 'min_child_weight': 7, 'subsample': 0.5, 'colsample_bytree': 0.6, 'colsample_bylevel': 0.6, 'reg_alpha': 90.83407041607512, 'reg_lambda': 4.721849396505827e-06, 'gamma': 32.318746734821076}. Best is trial 355 with value: -0.3345736073215237.
[I 2026-07-20 13:43:43,799] Trial 463 finished with value: -0.3271769391870974 and parameters: {'error_threshold': 4.75, 'scalers': 'robust', 'ratios': 'norm_ratio', 'imputers': 'mean', 'n_estimators': 800, 'learning_rate': 0.058735468990129186, 'max_depth': 5, 'min_child_weight': 2, 'subsample': 0.5, 'colsample_bytree': 0.6, 'colsample_bylevel': 0.5, 'reg_alpha': 98.99722927463505, 'reg_lambda': 1.6506775801637556e-05, 'gamma': 31.530938231604516}. Best is trial 355 with value: -0.3345736073215237.
[I 2026-07-20 13:43:49,862] Trial 464 finished with value: -0.3180860883142886 and parameters: {'error_threshold': 4.75, 'scalers': 'robust', 'ratios': 'norm_ratio', 'imputers': 'mean', 'n_estimators': 800, 'learning_rate': 0.061360489761456714, 'max_depth': 5, 'min_child_weight': 2, 'subsample': 0.5, 'colsample_bytree': 0.6, 'colsample_bylevel': 0.6, 'reg_alpha': 76.92407140556132, 'reg_lambda': 53.901005356221944, 'gamma': 31.884811698806107}. Best is trial 355 with value: -0.3345736073215237.
[I 2026-07-20 13:43:52,245] Trial 465 finished with value: -0.33028810053764884 and parameters: {'error_threshold': 4.75, 'scalers': 'robust', 'ratios': 'norm_ratio', 'imputers': 'mean', 'n_estimators': 800, 'learning_rate': 0.058653523310667054, 'max_depth': 5, 'min_child_weight': 2, 'subsample': 0.5, 'colsample_bytree': 0.6, 'colsample_bylevel': 0.6, 'reg_alpha': 99.4247322420002, 'reg_lambda': 3.9959753578019714e-06, 'gamma': 33.291321597081364}. Best is trial 355 with value: -0.3345736073215237.
[I 2026-07-20 13:43:52,995] Trial 467 finished with value: -0.30980453410241604 and parameters: {'error_threshold': 4.75, 'scalers': 'robust', 'ratios': 'norm_ratio', 'imputers': 'mean', 'n_estimators': 850, 'learning_rate': 0.08497089940712417, 'max_depth': 5, 'min_child_weight': 2, 'subsample': 0.5, 'colsample_bytree': 0.6, 'colsample_bylevel': 0.9, 'reg_alpha': 78.19711714853294, 'reg_lambda': 6.163705117720658e-06, 'gamma': 27.16647628035187}. Best is trial 355 with value: -0.3345736073215237.
[I 2026-07-20 13:43:53,118] Trial 468 finished with value: -0.33460998995432994 and parameters: {'error_threshold': 4.75, 'scalers': 'robust', 'ratios': 'norm_ratio', 'imputers': 'mean', 'n_estimators': 800, 'learning_rate': 0.05654352327515232, 'max_depth': 5, 'min_child_weight': 7, 'subsample': 0.5, 'colsample_bytree': 0.6, 'colsample_bylevel': 1.0, 'reg_alpha': 93.55476567161165, 'reg_lambda': 44.41317026418443, 'gamma': 46.6444739092316}. Best is trial 468 with value: -0.33460998995432994.
[I 2026-07-20 13:43:53,513] Trial 469 finished with value: -0.334564986820522 and parameters: {'error_threshold': 4.75, 'scalers': 'robust', 'ratios': 'norm_ratio', 'imputers': 'mean', 'n_estimators': 850, 'learning_rate': 0.04661935107941188, 'max_depth': 5, 'min_child_weight': 2, 'subsample': 0.5, 'colsample_bytree': 0.6, 'colsample_bylevel': 0.9, 'reg_alpha': 95.43741446745753, 'reg_lambda': 52.09991335152398, 'gamma': 45.66508890639767}. Best is trial 468 with value: -0.33460998995432994.
[I 2026-07-20 13:43:54,384] Trial 470 finished with value: -0.33456534545472577 and parameters: {'error_threshold': 4.75, 'scalers': 'robust', 'ratios': 'norm_ratio', 'imputers': 'mean', 'n_estimators': 850, 'learning_rate': 0.051825288255575745, 'max_depth': 5, 'min_child_weight': 2, 'subsample': 0.5, 'colsample_bytree': 0.6, 'colsample_bylevel': 0.8, 'reg_alpha': 95.93863981886474, 'reg_lambda': 49.39737235940691, 'gamma': 46.13911041983849}. Best is trial 468 with value: -0.33460998995432994.
[I 2026-07-20 13:43:55,438] Trial 466 finished with value: -0.3257751684164772 and parameters: {'error_threshold': 4.75, 'scalers': 'robust', 'ratios': 'norm_ratio', 'imputers': 'mean', 'n_estimators': 2400, 'learning_rate': 0.05578227665524371, 'max_depth': 5, 'min_child_weight': 2, 'subsample': 0.5, 'colsample_bytree': 0.6, 'colsample_bylevel': 0.5, 'reg_alpha': 99.15854357503369, 'reg_lambda': 47.56420293768367, 'gamma': 29.023789352129434}. Best is trial 468 with value: -0.33460998995432994.
[I 2026-07-20 13:43:55,881] Trial 471 finished with value: -0.33456493873767906 and parameters: {'error_threshold': 4.75, 'scalers': 'robust', 'ratios': 'norm_ratio', 'imputers': 'mean', 'n_estimators': 850, 'learning_rate': 0.046104758501718884, 'max_depth': 5, 'min_child_weight': 2, 'subsample': 0.5, 'colsample_bytree': 0.6, 'colsample_bylevel': 0.5, 'reg_alpha': 95.80091081798899, 'reg_lambda': 50.93367699854968, 'gamma': 44.69156156725738}. Best is trial 468 with value: -0.33460998995432994.
[I 2026-07-20 13:44:01,862] Trial 472 finished with value: -0.3345647208613969 and parameters: {'error_threshold': 4.75, 'scalers': 'robust', 'ratios': 'norm_ratio', 'imputers': 'mean', 'n_estimators': 850, 'learning_rate': 0.08928245082871111, 'max_depth': 5, 'min_child_weight': 3, 'subsample': 0.5, 'colsample_bytree': 0.6, 'colsample_bylevel': 0.9, 'reg_alpha': 97.54715081288657, 'reg_lambda': 46.978811200713324, 'gamma': 47.72080127051096}. Best is trial 468 with value: -0.33460998995432994.
[I 2026-07-20 13:44:03,716] Trial 473 finished with value: -0.33456046856113547 and parameters: {'error_threshold': 4.75, 'scalers': 'robust', 'ratios': 'norm_ratio', 'imputers': 'mean', 'n_estimators': 900, 'learning_rate': 0.04691074915709191, 'max_depth': 5, 'min_child_weight': 3, 'subsample': 0.5, 'colsample_bytree': 0.6, 'colsample_bylevel': 1.0, 'reg_alpha': 96.50224312278243, 'reg_lambda': 46.56442824638365, 'gamma': 44.64862148367896}. Best is trial 468 with value: -0.33460998995432994.
[I 2026-07-20 13:44:04,221] Trial 474 finished with value: -0.33448660341083863 and parameters: {'error_threshold': 4.75, 'scalers': 'robust', 'ratios': 'norm_ratio', 'imputers': 'mean', 'n_estimators': 950, 'learning_rate': 0.07685361786029522, 'max_depth': 5, 'min_child_weight': 3, 'subsample': 0.5, 'colsample_bytree': 0.6, 'colsample_bylevel': 0.8, 'reg_alpha': 95.96026214571907, 'reg_lambda': 49.814062221587626, 'gamma': 46.34536772527654}. Best is trial 468 with value: -0.33460998995432994.
[I 2026-07-20 13:44:04,697] Trial 475 finished with value: -0.325876367119577 and parameters: {'error_threshold': 4.75, 'scalers': 'robust', 'ratios': 'norm_ratio', 'imputers': 'mean', 'n_estimators': 950, 'learning_rate': 0.04864354770674378, 'max_depth': 5, 'min_child_weight': 6, 'subsample': 0.5, 'colsample_bytree': 0.6, 'colsample_bylevel': 1.0, 'reg_alpha': 69.51641003501591, 'reg_lambda': 53.44391805083258, 'gamma': 47.16786388698299}. Best is trial 468 with value: -0.33460998995432994.
[I 2026-07-20 13:44:05,115] Trial 476 finished with value: -0.31930145221723333 and parameters: {'error_threshold': 4.75, 'scalers': 'robust', 'ratios': 'norm_ratio', 'imputers': 'mean', 'n_estimators': 850, 'learning_rate': 0.049078224753364486, 'max_depth': 5, 'min_child_weight': 10, 'subsample': 0.5, 'colsample_bytree': 0.6, 'colsample_bylevel': 1.0, 'reg_alpha': 99.32780351900652, 'reg_lambda': 63.243699707554434, 'gamma': 21.131554861859396}. Best is trial 468 with value: -0.33460998995432994.
[I 2026-07-20 13:44:06,008] Trial 477 finished with value: -0.29523494416227214 and parameters: {'error_threshold': 4.75, 'scalers': 'robust', 'ratios': 'norm_ratio', 'imputers': 'mean', 'n_estimators': 850, 'learning_rate': 0.034608927471467904, 'max_depth': 5, 'min_child_weight': 7, 'subsample': 0.8, 'colsample_bytree': 0.6, 'colsample_bylevel': 1.0, 'reg_alpha': 98.08334284468468, 'reg_lambda': 53.64666642496098, 'gamma': 23.093266396279372}. Best is trial 468 with value: -0.33460998995432994.
[I 2026-07-20 13:44:06,481] Trial 478 finished with value: -0.2979215646302457 and parameters: {'error_threshold': 4.75, 'scalers': 'robust', 'ratios': 'norm_ratio', 'imputers': 'mean', 'n_estimators': 850, 'learning_rate': 0.04834166640713227, 'max_depth': 5, 'min_child_weight': 3, 'subsample': 0.5, 'colsample_bytree': 0.6, 'colsample_bylevel': 1.0, 'reg_alpha': 70.32347201211998, 'reg_lambda': 99.0796584236257, 'gamma': 15.831812111791372}. Best is trial 468 with value: -0.33460998995432994.
[I 2026-07-20 13:44:06,854] Trial 479 finished with value: -0.3172084744885168 and parameters: {'error_threshold': 4.75, 'scalers': 'robust', 'ratios': 'norm_ratio', 'imputers': 'mean', 'n_estimators': 750, 'learning_rate': 0.03421424025366287, 'max_depth': 5, 'min_child_weight': 9, 'subsample': 0.5, 'colsample_bytree': 0.6, 'colsample_bylevel': 1.0, 'reg_alpha': 98.35404126244485, 'reg_lambda': 60.68369414681116, 'gamma': 19.21795917262933}. Best is trial 468 with value: -0.33460998995432994.
[I 2026-07-20 13:44:12,197] Trial 480 finished with value: -0.2847459287676685 and parameters: {'error_threshold': 4.5, 'scalers': 'robust', 'ratios': 'norm_ratio', 'imputers': 'mean', 'n_estimators': 750, 'learning_rate': 0.044678924423133475, 'max_depth': 5, 'min_child_weight': 9, 'subsample': 0.5, 'colsample_bytree': 0.6, 'colsample_bylevel': 0.8, 'reg_alpha': 60.90266706763281, 'reg_lambda': 99.82408541002776, 'gamma': 9.50188407684521}. Best is trial 468 with value: -0.33460998995432994.
[I 2026-07-20 13:44:13,832] Trial 481 finished with value: -0.3035461494377118 and parameters: {'error_threshold': 4.5, 'scalers': 'robust', 'ratios': 'norm_ratio', 'imputers': 'mean', 'n_estimators': 750, 'learning_rate': 0.04743168451549967, 'max_depth': 5, 'min_child_weight': 7, 'subsample': 0.5, 'colsample_bytree': 0.6, 'colsample_bylevel': 1.0, 'reg_alpha': 99.69807360441708, 'reg_lambda': 80.48847243470084, 'gamma': 9.605894157445528}. Best is trial 468 with value: -0.33460998995432994.
[I 2026-07-20 13:44:14,255] Trial 482 finished with value: -0.2834124411746623 and parameters: {'error_threshold': 4.5, 'scalers': 'robust', 'ratios': 'norm_ratio', 'imputers': 'mean', 'n_estimators': 750, 'learning_rate': 0.047301876493864074, 'max_depth': 5, 'min_child_weight': 3, 'subsample': 0.5, 'colsample_bytree': 0.6, 'colsample_bylevel': 1.0, 'reg_alpha': 58.216050052235374, 'reg_lambda': 66.55455535875956, 'gamma': 9.9942959111506}. Best is trial 468 with value: -0.33460998995432994.
[I 2026-07-20 13:44:14,691] Trial 483 finished with value: -0.27235658126685647 and parameters: {'error_threshold': 4.5, 'scalers': 'robust', 'ratios': 'norm_ratio', 'imputers': 'mean', 'n_estimators': 750, 'learning_rate': 0.04567739195253601, 'max_depth': 5, 'min_child_weight': 3, 'subsample': 0.8, 'colsample_bytree': 0.6, 'colsample_bylevel': 1.0, 'reg_alpha': 54.6584988670599, 'reg_lambda': 89.36760559466137, 'gamma': 18.186992117755228}. Best is trial 468 with value: -0.33460998995432994.
[I 2026-07-20 13:44:15,075] Trial 484 finished with value: -0.29164076156899177 and parameters: {'error_threshold': 4.5, 'scalers': 'robust', 'ratios': 'norm_ratio', 'imputers': 'mean', 'n_estimators': 750, 'learning_rate': 0.03995883190744244, 'max_depth': 5, 'min_child_weight': 3, 'subsample': 0.5, 'colsample_bytree': 0.6, 'colsample_bylevel': 1.0, 'reg_alpha': 53.47891410955813, 'reg_lambda': 92.25410772061073, 'gamma': 16.945851356018252}. Best is trial 468 with value: -0.33460998995432994.
[I 2026-07-20 13:44:15,874] Trial 485 finished with value: -0.2871050653011322 and parameters: {'error_threshold': 4.5, 'scalers': 'robust', 'ratios': 'norm_ratio', 'imputers': 'mean', 'n_estimators': 750, 'learning_rate': 0.04574071138739916, 'max_depth': 5, 'min_child_weight': 3, 'subsample': 0.5, 'colsample_bytree': 0.6, 'colsample_bylevel': 1.0, 'reg_alpha': 56.081303459236345, 'reg_lambda': 40.821315298113255, 'gamma': 13.363021791485577}. Best is trial 468 with value: -0.33460998995432994.
[I 2026-07-20 13:44:16,255] Trial 486 finished with value: -0.2933408360879752 and parameters: {'error_threshold': 4.5, 'scalers': 'robust', 'ratios': 'norm_ratio', 'imputers': 'mean', 'n_estimators': 750, 'learning_rate': 0.03683315948678143, 'max_depth': 5, 'min_child_weight': 3, 'subsample': 0.5, 'colsample_bytree': 0.6, 'colsample_bylevel': 1.0, 'reg_alpha': 54.280857549890314, 'reg_lambda': 73.71842808826884, 'gamma': 18.84392551544728}. Best is trial 468 with value: -0.33460998995432994.
[I 2026-07-20 13:44:16,699] Trial 487 finished with value: -0.28517600185695563 and parameters: {'error_threshold': 4.5, 'scalers': 'robust', 'ratios': 'norm_ratio', 'imputers': 'mean', 'n_estimators': 800, 'learning_rate': 0.04358927168134747, 'max_depth': 5, 'min_child_weight': 8, 'subsample': 0.5, 'colsample_bytree': 0.6, 'colsample_bylevel': 1.0, 'reg_alpha': 54.05523641631745, 'reg_lambda': 4.665689762871198e-05, 'gamma': 13.795477526850128}. Best is trial 468 with value: -0.33460998995432994.
[I 2026-07-20 13:44:22,212] Trial 488 finished with value: -0.28778600235343615 and parameters: {'error_threshold': 4.5, 'scalers': 'robust', 'ratios': 'norm_ratio', 'imputers': 'mean', 'n_estimators': 750, 'learning_rate': 0.07206095104754873, 'max_depth': 5, 'min_child_weight': 3, 'subsample': 0.5, 'colsample_bytree': 0.6, 'colsample_bylevel': 1.0, 'reg_alpha': 60.92193126244073, 'reg_lambda': 72.51424098438599, 'gamma': 11.73503037786704}. Best is trial 468 with value: -0.33460998995432994.
[I 2026-07-20 13:44:24,005] Trial 489 finished with value: -0.2925984615536999 and parameters: {'error_threshold': 4.5, 'scalers': 'robust', 'ratios': 'norm_ratio', 'imputers': 'mean', 'n_estimators': 800, 'learning_rate': 0.038035564024354936, 'max_depth': 5, 'min_child_weight': 3, 'subsample': 0.5, 'colsample_bytree': 0.6, 'colsample_bylevel': 1.0, 'reg_alpha': 54.85019940635643, 'reg_lambda': 40.125955035593975, 'gamma': 18.740531907055328}. Best is trial 468 with value: -0.33460998995432994.
[I 2026-07-20 13:44:24,411] Trial 490 finished with value: -0.3115518439558164 and parameters: {'error_threshold': 4.5, 'scalers': 'robust', 'ratios': 'norm_ratio', 'imputers': 'mean', 'n_estimators': 800, 'learning_rate': 0.0734208960723438, 'max_depth': 5, 'min_child_weight': 4, 'subsample': 0.5, 'colsample_bytree': 0.6, 'colsample_bylevel': 1.0, 'reg_alpha': 56.55577792840195, 'reg_lambda': 5.97546783397874e-05, 'gamma': 43.586012296885414}. Best is trial 468 with value: -0.33460998995432994.
[I 2026-07-20 13:44:24,810] Trial 491 finished with value: -0.31523090653105845 and parameters: {'error_threshold': 4.5, 'scalers': 'robust', 'ratios': 'norm_ratio', 'imputers': 'mean', 'n_estimators': 800, 'learning_rate': 0.029330366696419467, 'max_depth': 5, 'min_child_weight': 4, 'subsample': 0.5, 'colsample_bytree': 0.6, 'colsample_bylevel': 1.0, 'reg_alpha': 54.10594599361488, 'reg_lambda': 47.196409253830296, 'gamma': 43.40225360876042}. Best is trial 468 with value: -0.33460998995432994.
