[I 2026-07-21 13:25:19,889] A new study created in Journal with name: quantile_study_7_21_26_final
/bsuhome/alexanderemert/Research/Star-Formation-Research-Project-2026/pipeline/scripts/optuna/final_preds_and_models/optuna_search_mult_quant_reg.py:75: UserWarning: The distribution is specified by [0.1, 5] and step=0.25, but the range is not divisible by `step`. It will be replaced with [0.1, 4.85].
  error_threshold = trial.suggest_float("error_threshold", 0.1, 5, step=0.25)
[I 2026-07-21 13:26:02,472] Trial 5 finished with value: -0.9155290353077093 and parameters: {'error_threshold': 0.1, 'scalers': 'standard', 'ratios': 'log_ratio', 'imputers': 'mean', 'n_estimators': 100, 'learning_rate': 0.4656601591605124, 'max_depth': 12, 'min_child_weight': 7, 'subsample': 0.5, 'colsample_bytree': 0.8, 'colsample_bylevel': 1.0, 'reg_alpha': 1.4531237731063525e-06, 'reg_lambda': 2.4457079214640474e-06, 'gamma': 3.787375356495885e-05}. Best is trial 5 with value: -0.9155290353077093.
/bsuhome/alexanderemert/Research/Star-Formation-Research-Project-2026/pipeline/scripts/optuna/final_preds_and_models/optuna_search_mult_quant_reg.py:75: UserWarning: The distribution is specified by [0.1, 5] and step=0.25, but the range is not divisible by `step`. It will be replaced with [0.1, 4.85].
  error_threshold = trial.suggest_float("error_threshold", 0.1, 5, step=0.25)
[I 2026-07-21 13:26:08,783] Trial 1 finished with value: -0.6802277300747152 and parameters: {'error_threshold': 0.1, 'scalers': 'none', 'ratios': 'norm_ratio', 'imputers': 'mean', 'n_estimators': 2250, 'learning_rate': 0.4677280747455991, 'max_depth': 10, 'min_child_weight': 10, 'subsample': 0.8, 'colsample_bytree': 1.0, 'colsample_bylevel': 0.6, 'reg_alpha': 0.0022195521352606027, 'reg_lambda': 0.00011286527687146146, 'gamma': 4.58222524955618}. Best is trial 1 with value: -0.6802277300747152.
/bsuhome/alexanderemert/Research/Star-Formation-Research-Project-2026/pipeline/scripts/optuna/final_preds_and_models/optuna_search_mult_quant_reg.py:75: UserWarning: The distribution is specified by [0.1, 5] and step=0.25, but the range is not divisible by `step`. It will be replaced with [0.1, 4.85].
  error_threshold = trial.suggest_float("error_threshold", 0.1, 5, step=0.25)
[I 2026-07-21 13:26:09,664] Trial 7 finished with value: -0.633733757977015 and parameters: {'error_threshold': 1.6, 'scalers': 'none', 'ratios': 'log_ratio', 'imputers': 'median', 'n_estimators': 700, 'learning_rate': 0.010816385680754477, 'max_depth': 11, 'min_child_weight': 10, 'subsample': 0.6, 'colsample_bytree': 0.5, 'colsample_bylevel': 0.9, 'reg_alpha': 4.73384796704278e-06, 'reg_lambda': 2.753468708805961e-05, 'gamma': 0.08811543958999281}. Best is trial 7 with value: -0.633733757977015.
/bsuhome/alexanderemert/Research/Star-Formation-Research-Project-2026/pipeline/scripts/optuna/final_preds_and_models/optuna_search_mult_quant_reg.py:75: UserWarning: The distribution is specified by [0.1, 5] and step=0.25, but the range is not divisible by `step`. It will be replaced with [0.1, 4.85].
  error_threshold = trial.suggest_float("error_threshold", 0.1, 5, step=0.25)
[I 2026-07-21 13:26:24,257] Trial 2 finished with value: -0.6424510583153631 and parameters: {'error_threshold': 2.6, 'scalers': 'robust', 'ratios': 'log_ratio', 'imputers': 'mean', 'n_estimators': 700, 'learning_rate': 0.006031089363366884, 'max_depth': 11, 'min_child_weight': 7, 'subsample': 0.6, 'colsample_bytree': 0.6, 'colsample_bylevel': 0.8, 'reg_alpha': 0.0004889319716877849, 'reg_lambda': 0.9384872822383498, 'gamma': 1.339633680781025e-06}. Best is trial 7 with value: -0.633733757977015.
/bsuhome/alexanderemert/Research/Star-Formation-Research-Project-2026/pipeline/scripts/optuna/final_preds_and_models/optuna_search_mult_quant_reg.py:75: UserWarning: The distribution is specified by [0.1, 5] and step=0.25, but the range is not divisible by `step`. It will be replaced with [0.1, 4.85].
  error_threshold = trial.suggest_float("error_threshold", 0.1, 5, step=0.25)
[I 2026-07-21 13:26:27,802] Trial 3 finished with value: -0.6976133491921482 and parameters: {'error_threshold': 1.85, 'scalers': 'robust', 'ratios': 'norm_ratio', 'imputers': 'none', 'n_estimators': 2250, 'learning_rate': 0.11417651094039258, 'max_depth': 4, 'min_child_weight': 10, 'subsample': 0.6, 'colsample_bytree': 0.6, 'colsample_bylevel': 0.9, 'reg_alpha': 0.007278279788345325, 'reg_lambda': 2.5281749505376876, 'gamma': 0.04456897738479857}. Best is trial 7 with value: -0.633733757977015.
/bsuhome/alexanderemert/Research/Star-Formation-Research-Project-2026/pipeline/scripts/optuna/final_preds_and_models/optuna_search_mult_quant_reg.py:75: UserWarning: The distribution is specified by [0.1, 5] and step=0.25, but the range is not divisible by `step`. It will be replaced with [0.1, 4.85].
  error_threshold = trial.suggest_float("error_threshold", 0.1, 5, step=0.25)
[I 2026-07-21 13:26:30,726] Trial 4 finished with value: -0.6632635392801 and parameters: {'error_threshold': 0.35, 'scalers': 'none', 'ratios': 'norm_ratio', 'imputers': 'mean', 'n_estimators': 750, 'learning_rate': 0.01157107782478917, 'max_depth': 10, 'min_child_weight': 9, 'subsample': 0.7, 'colsample_bytree': 0.6, 'colsample_bylevel': 1.0, 'reg_alpha': 6.951222694920497e-06, 'reg_lambda': 0.02666537835461804, 'gamma': 0.0017023296383414756}. Best is trial 7 with value: -0.633733757977015.
/bsuhome/alexanderemert/Research/Star-Formation-Research-Project-2026/pipeline/scripts/optuna/final_preds_and_models/optuna_search_mult_quant_reg.py:75: UserWarning: The distribution is specified by [0.1, 5] and step=0.25, but the range is not divisible by `step`. It will be replaced with [0.1, 4.85].
  error_threshold = trial.suggest_float("error_threshold", 0.1, 5, step=0.25)
[I 2026-07-21 13:27:05,948] Trial 6 finished with value: -0.6525674477362193 and parameters: {'error_threshold': 1.1, 'scalers': 'none', 'ratios': 'norm_ratio', 'imputers': 'mean', 'n_estimators': 1400, 'learning_rate': 0.001165632598299801, 'max_depth': 10, 'min_child_weight': 2, 'subsample': 0.7, 'colsample_bytree': 0.8, 'colsample_bylevel': 0.5, 'reg_alpha': 0.0156836821739034, 'reg_lambda': 45.39750097690088, 'gamma': 0.04152211865672695}. Best is trial 7 with value: -0.633733757977015.
/bsuhome/alexanderemert/Research/Star-Formation-Research-Project-2026/pipeline/scripts/optuna/final_preds_and_models/optuna_search_mult_quant_reg.py:75: UserWarning: The distribution is specified by [0.1, 5] and step=0.25, but the range is not divisible by `step`. It will be replaced with [0.1, 4.85].
  error_threshold = trial.suggest_float("error_threshold", 0.1, 5, step=0.25)
[I 2026-07-21 13:27:57,163] Trial 8 finished with value: -0.6713820137688374 and parameters: {'error_threshold': 3.85, 'scalers': 'standard', 'ratios': 'log_ratio', 'imputers': 'median', 'n_estimators': 1550, 'learning_rate': 0.0025934563723997665, 'max_depth': 11, 'min_child_weight': 2, 'subsample': 0.7, 'colsample_bytree': 0.8, 'colsample_bylevel': 0.6, 'reg_alpha': 43.82861336840883, 'reg_lambda': 0.0002006299775097442, 'gamma': 8.078516383022914e-06}. Best is trial 7 with value: -0.633733757977015.
/bsuhome/alexanderemert/Research/Star-Formation-Research-Project-2026/pipeline/scripts/optuna/final_preds_and_models/optuna_search_mult_quant_reg.py:75: UserWarning: The distribution is specified by [0.1, 5] and step=0.25, but the range is not divisible by `step`. It will be replaced with [0.1, 4.85].
  error_threshold = trial.suggest_float("error_threshold", 0.1, 5, step=0.25)
[I 2026-07-21 13:28:06,834] Trial 0 finished with value: -0.7432186553054713 and parameters: {'error_threshold': 4.35, 'scalers': 'robust', 'ratios': 'log_ratio', 'imputers': 'none', 'n_estimators': 2450, 'learning_rate': 0.06684784458712438, 'max_depth': 12, 'min_child_weight': 8, 'subsample': 0.9, 'colsample_bytree': 0.7, 'colsample_bylevel': 1.0, 'reg_alpha': 2.0722575460623112e-05, 'reg_lambda': 6.028689532794904e-06, 'gamma': 3.5455740049882756e-05}. Best is trial 7 with value: -0.633733757977015.
/bsuhome/alexanderemert/Research/Star-Formation-Research-Project-2026/pipeline/scripts/optuna/final_preds_and_models/optuna_search_mult_quant_reg.py:75: UserWarning: The distribution is specified by [0.1, 5] and step=0.25, but the range is not divisible by `step`. It will be replaced with [0.1, 4.85].
  error_threshold = trial.suggest_float("error_threshold", 0.1, 5, step=0.25)
[I 2026-07-21 13:28:51,645] Trial 9 finished with value: -0.7068423349517451 and parameters: {'error_threshold': 3.35, 'scalers': 'standard', 'ratios': 'norm_ratio', 'imputers': 'none', 'n_estimators': 1150, 'learning_rate': 0.05491155060903609, 'max_depth': 12, 'min_child_weight': 7, 'subsample': 1.0, 'colsample_bytree': 0.7, 'colsample_bylevel': 0.9, 'reg_alpha': 0.0005122730132666738, 'reg_lambda': 5.664003659315375, 'gamma': 0.02943946515191078}. Best is trial 7 with value: -0.633733757977015.
/bsuhome/alexanderemert/Research/Star-Formation-Research-Project-2026/pipeline/scripts/optuna/final_preds_and_models/optuna_search_mult_quant_reg.py:75: UserWarning: The distribution is specified by [0.1, 5] and step=0.25, but the range is not divisible by `step`. It will be replaced with [0.1, 4.85].
  error_threshold = trial.suggest_float("error_threshold", 0.1, 5, step=0.25)
[I 2026-07-21 13:28:57,616] Trial 10 finished with value: -0.6884225745082159 and parameters: {'error_threshold': 2.6, 'scalers': 'standard', 'ratios': 'norm_ratio', 'imputers': 'mean', 'n_estimators': 900, 'learning_rate': 0.0008000850638853436, 'max_depth': 11, 'min_child_weight': 4, 'subsample': 0.8, 'colsample_bytree': 0.9, 'colsample_bylevel': 0.7, 'reg_alpha': 0.0003534223438187792, 'reg_lambda': 0.00033364947458874546, 'gamma': 0.010885104756494972}. Best is trial 7 with value: -0.633733757977015.
/bsuhome/alexanderemert/Research/Star-Formation-Research-Project-2026/pipeline/scripts/optuna/final_preds_and_models/optuna_search_mult_quant_reg.py:75: UserWarning: The distribution is specified by [0.1, 5] and step=0.25, but the range is not divisible by `step`. It will be replaced with [0.1, 4.85].
  error_threshold = trial.suggest_float("error_threshold", 0.1, 5, step=0.25)
[I 2026-07-21 13:29:00,974] Trial 12 finished with value: -0.6504840944035929 and parameters: {'error_threshold': 4.6, 'scalers': 'none', 'ratios': 'log_ratio', 'imputers': 'none', 'n_estimators': 1800, 'learning_rate': 0.0008466592136518502, 'max_depth': 5, 'min_child_weight': 7, 'subsample': 0.6, 'colsample_bytree': 0.8, 'colsample_bylevel': 0.7, 'reg_alpha': 0.00016751594849738683, 'reg_lambda': 0.0022420734140928184, 'gamma': 0.005420010949974125}. Best is trial 7 with value: -0.633733757977015.
/bsuhome/alexanderemert/Research/Star-Formation-Research-Project-2026/pipeline/scripts/optuna/final_preds_and_models/optuna_search_mult_quant_reg.py:75: UserWarning: The distribution is specified by [0.1, 5] and step=0.25, but the range is not divisible by `step`. It will be replaced with [0.1, 4.85].
  error_threshold = trial.suggest_float("error_threshold", 0.1, 5, step=0.25)
[I 2026-07-21 13:29:10,576] Trial 11 finished with value: -0.8196276965785464 and parameters: {'error_threshold': 4.6, 'scalers': 'robust', 'ratios': 'norm_ratio', 'imputers': 'median', 'n_estimators': 2900, 'learning_rate': 0.12062815109019528, 'max_depth': 12, 'min_child_weight': 8, 'subsample': 0.6, 'colsample_bytree': 0.7, 'colsample_bylevel': 0.9, 'reg_alpha': 0.0007599205928521159, 'reg_lambda': 0.0006746192725756003, 'gamma': 0.0031294501761689668}. Best is trial 7 with value: -0.633733757977015.
/bsuhome/alexanderemert/Research/Star-Formation-Research-Project-2026/pipeline/scripts/optuna/final_preds_and_models/optuna_search_mult_quant_reg.py:75: UserWarning: The distribution is specified by [0.1, 5] and step=0.25, but the range is not divisible by `step`. It will be replaced with [0.1, 4.85].
  error_threshold = trial.suggest_float("error_threshold", 0.1, 5, step=0.25)
[I 2026-07-21 13:29:11,139] Trial 14 finished with value: -0.7372686586233234 and parameters: {'error_threshold': 2.35, 'scalers': 'robust', 'ratios': 'log_ratio', 'imputers': 'none', 'n_estimators': 1050, 'learning_rate': 0.000372226012490018, 'max_depth': 8, 'min_child_weight': 4, 'subsample': 0.7, 'colsample_bytree': 0.7, 'colsample_bylevel': 0.7, 'reg_alpha': 0.0002730659658421004, 'reg_lambda': 0.18286580236606098, 'gamma': 4.560946791412292}. Best is trial 7 with value: -0.633733757977015.
/bsuhome/alexanderemert/Research/Star-Formation-Research-Project-2026/pipeline/scripts/optuna/final_preds_and_models/optuna_search_mult_quant_reg.py:75: UserWarning: The distribution is specified by [0.1, 5] and step=0.25, but the range is not divisible by `step`. It will be replaced with [0.1, 4.85].
  error_threshold = trial.suggest_float("error_threshold", 0.1, 5, step=0.25)
[I 2026-07-21 13:29:21,049] Trial 13 finished with value: -0.8653967367207889 and parameters: {'error_threshold': 3.85, 'scalers': 'standard', 'ratios': 'log_ratio', 'imputers': 'median', 'n_estimators': 2900, 'learning_rate': 0.3327300976916496, 'max_depth': 9, 'min_child_weight': 10, 'subsample': 0.7, 'colsample_bytree': 1.0, 'colsample_bylevel': 0.7, 'reg_alpha': 5.2070781595683115, 'reg_lambda': 98.29051802762179, 'gamma': 2.005620671482804e-06}. Best is trial 7 with value: -0.633733757977015.
/bsuhome/alexanderemert/Research/Star-Formation-Research-Project-2026/pipeline/scripts/optuna/final_preds_and_models/optuna_search_mult_quant_reg.py:75: UserWarning: The distribution is specified by [0.1, 5] and step=0.25, but the range is not divisible by `step`. It will be replaced with [0.1, 4.85].
  error_threshold = trial.suggest_float("error_threshold", 0.1, 5, step=0.25)
[I 2026-07-21 13:29:26,843] Trial 15 finished with value: -0.7908583168413351 and parameters: {'error_threshold': 3.85, 'scalers': 'none', 'ratios': 'norm_ratio', 'imputers': 'none', 'n_estimators': 2800, 'learning_rate': 0.0029985922470042795, 'max_depth': 12, 'min_child_weight': 6, 'subsample': 0.5, 'colsample_bytree': 0.6, 'colsample_bylevel': 0.8, 'reg_alpha': 0.11190319808648783, 'reg_lambda': 0.01213325997915317, 'gamma': 91.34239686145246}. Best is trial 7 with value: -0.633733757977015.
/bsuhome/alexanderemert/Research/Star-Formation-Research-Project-2026/pipeline/scripts/optuna/final_preds_and_models/optuna_search_mult_quant_reg.py:75: UserWarning: The distribution is specified by [0.1, 5] and step=0.25, but the range is not divisible by `step`. It will be replaced with [0.1, 4.85].
  error_threshold = trial.suggest_float("error_threshold", 0.1, 5, step=0.25)
[I 2026-07-21 13:29:29,811] Trial 16 finished with value: -0.6964082111886389 and parameters: {'error_threshold': 1.1, 'scalers': 'standard', 'ratios': 'log_ratio', 'imputers': 'median', 'n_estimators': 1850, 'learning_rate': 0.007306922824230539, 'max_depth': 7, 'min_child_weight': 5, 'subsample': 0.5, 'colsample_bytree': 0.6, 'colsample_bylevel': 0.7, 'reg_alpha': 0.00017862727796600668, 'reg_lambda': 3.706426000526209e-06, 'gamma': 17.3267303124878}. Best is trial 7 with value: -0.633733757977015.
/bsuhome/alexanderemert/Research/Star-Formation-Research-Project-2026/pipeline/scripts/optuna/final_preds_and_models/optuna_search_mult_quant_reg.py:75: UserWarning: The distribution is specified by [0.1, 5] and step=0.25, but the range is not divisible by `step`. It will be replaced with [0.1, 4.85].
  error_threshold = trial.suggest_float("error_threshold", 0.1, 5, step=0.25)
[I 2026-07-21 13:29:31,636] Trial 17 finished with value: -0.7656202386958378 and parameters: {'error_threshold': 4.85, 'scalers': 'none', 'ratios': 'log_ratio', 'imputers': 'median', 'n_estimators': 2700, 'learning_rate': 0.00011825364063947687, 'max_depth': 6, 'min_child_weight': 4, 'subsample': 1.0, 'colsample_bytree': 1.0, 'colsample_bylevel': 0.7, 'reg_alpha': 1.9328031817370157, 'reg_lambda': 0.010666472037147283, 'gamma': 80.83286407495838}. Best is trial 7 with value: -0.633733757977015.
/bsuhome/alexanderemert/Research/Star-Formation-Research-Project-2026/pipeline/scripts/optuna/final_preds_and_models/optuna_search_mult_quant_reg.py:75: UserWarning: The distribution is specified by [0.1, 5] and step=0.25, but the range is not divisible by `step`. It will be replaced with [0.1, 4.85].
  error_threshold = trial.suggest_float("error_threshold", 0.1, 5, step=0.25)
[I 2026-07-21 13:29:32,784] Trial 19 finished with value: -0.7868961247620798 and parameters: {'error_threshold': 2.35, 'scalers': 'robust', 'ratios': 'log_ratio', 'imputers': 'median', 'n_estimators': 350, 'learning_rate': 0.00010372483672108822, 'max_depth': 8, 'min_child_weight': 5, 'subsample': 0.5, 'colsample_bytree': 0.5, 'colsample_bylevel': 0.8, 'reg_alpha': 0.1382239610833559, 'reg_lambda': 0.08654101890931795, 'gamma': 18.748545163273235}. Best is trial 7 with value: -0.633733757977015.
/bsuhome/alexanderemert/Research/Star-Formation-Research-Project-2026/pipeline/scripts/optuna/final_preds_and_models/optuna_search_mult_quant_reg.py:75: UserWarning: The distribution is specified by [0.1, 5] and step=0.25, but the range is not divisible by `step`. It will be replaced with [0.1, 4.85].
  error_threshold = trial.suggest_float("error_threshold", 0.1, 5, step=0.25)
[I 2026-07-21 13:29:33,383] Trial 18 finished with value: -0.7850306572459708 and parameters: {'error_threshold': 2.35, 'scalers': 'robust', 'ratios': 'log_ratio', 'imputers': 'median', 'n_estimators': 250, 'learning_rate': 0.00011219074389720841, 'max_depth': 8, 'min_child_weight': 5, 'subsample': 0.5, 'colsample_bytree': 0.5, 'colsample_bylevel': 0.8, 'reg_alpha': 8.55112544673475e-05, 'reg_lambda': 0.051459284757837405, 'gamma': 1.0215218682402325e-06}. Best is trial 7 with value: -0.633733757977015.
/bsuhome/alexanderemert/Research/Star-Formation-Research-Project-2026/pipeline/scripts/optuna/final_preds_and_models/optuna_search_mult_quant_reg.py:75: UserWarning: The distribution is specified by [0.1, 5] and step=0.25, but the range is not divisible by `step`. It will be replaced with [0.1, 4.85].
  error_threshold = trial.suggest_float("error_threshold", 0.1, 5, step=0.25)
[I 2026-07-21 13:29:33,578] Trial 20 finished with value: -0.7880075575549993 and parameters: {'error_threshold': 2.35, 'scalers': 'robust', 'ratios': 'log_ratio', 'imputers': 'median', 'n_estimators': 350, 'learning_rate': 0.00012348114309998517, 'max_depth': 8, 'min_child_weight': 5, 'subsample': 0.5, 'colsample_bytree': 0.5, 'colsample_bylevel': 0.8, 'reg_alpha': 0.14921815896495885, 'reg_lambda': 0.10985643588155408, 'gamma': 48.29865873967058}. Best is trial 7 with value: -0.633733757977015.
/bsuhome/alexanderemert/Research/Star-Formation-Research-Project-2026/pipeline/scripts/optuna/final_preds_and_models/optuna_search_mult_quant_reg.py:75: UserWarning: The distribution is specified by [0.1, 5] and step=0.25, but the range is not divisible by `step`. It will be replaced with [0.1, 4.85].
  error_threshold = trial.suggest_float("error_threshold", 0.1, 5, step=0.25)
[I 2026-07-21 13:29:33,736] Trial 21 finished with value: -0.7901393252291739 and parameters: {'error_threshold': 1.35, 'scalers': 'none', 'ratios': 'log_ratio', 'imputers': 'median', 'n_estimators': 250, 'learning_rate': 0.007962621262442291, 'max_depth': 8, 'min_child_weight': 5, 'subsample': 0.5, 'colsample_bytree': 0.5, 'colsample_bylevel': 0.8, 'reg_alpha': 0.257652012176493, 'reg_lambda': 0.023151034291393542, 'gamma': 68.6648926855659}. Best is trial 7 with value: -0.633733757977015.
/bsuhome/alexanderemert/Research/Star-Formation-Research-Project-2026/pipeline/scripts/optuna/final_preds_and_models/optuna_search_mult_quant_reg.py:75: UserWarning: The distribution is specified by [0.1, 5] and step=0.25, but the range is not divisible by `step`. It will be replaced with [0.1, 4.85].
  error_threshold = trial.suggest_float("error_threshold", 0.1, 5, step=0.25)
[I 2026-07-21 13:29:35,009] Trial 22 finished with value: -0.790880038379033 and parameters: {'error_threshold': 1.35, 'scalers': 'none', 'ratios': 'log_ratio', 'imputers': 'median', 'n_estimators': 400, 'learning_rate': 0.012932412844860635, 'max_depth': 7, 'min_child_weight': 5, 'subsample': 0.5, 'colsample_bytree': 0.5, 'colsample_bylevel': 0.8, 'reg_alpha': 0.12376322027631251, 'reg_lambda': 0.024936102277389138, 'gamma': 91.4145403246837}. Best is trial 7 with value: -0.633733757977015.
/bsuhome/alexanderemert/Research/Star-Formation-Research-Project-2026/pipeline/scripts/optuna/final_preds_and_models/optuna_search_mult_quant_reg.py:75: UserWarning: The distribution is specified by [0.1, 5] and step=0.25, but the range is not divisible by `step`. It will be replaced with [0.1, 4.85].
  error_threshold = trial.suggest_float("error_threshold", 0.1, 5, step=0.25)
[I 2026-07-21 13:29:42,739] Trial 23 finished with value: -0.6357526745688715 and parameters: {'error_threshold': 1.35, 'scalers': 'robust', 'ratios': 'log_ratio', 'imputers': 'median', 'n_estimators': 350, 'learning_rate': 0.013496884996117295, 'max_depth': 7, 'min_child_weight': 5, 'subsample': 0.5, 'colsample_bytree': 0.5, 'colsample_bylevel': 0.8, 'reg_alpha': 2.4795268487099888e-05, 'reg_lambda': 2.6769995910217508e-05, 'gamma': 0.00022470974714662115}. Best is trial 7 with value: -0.633733757977015.
/bsuhome/alexanderemert/Research/Star-Formation-Research-Project-2026/pipeline/scripts/optuna/final_preds_and_models/optuna_search_mult_quant_reg.py:75: UserWarning: The distribution is specified by [0.1, 5] and step=0.25, but the range is not divisible by `step`. It will be replaced with [0.1, 4.85].
  error_threshold = trial.suggest_float("error_threshold", 0.1, 5, step=0.25)
