[I 2026-07-21 10:24:39,594] Trial 451 finished with value: -1.0287796769959021 and parameters: {'error_threshold': 1.35, 'scalers': 'robust', 'ratios': 'norm_ratio', 'imputers': 'median', 'n_estimators': 2700, 'learning_rate': 0.005288011291647012, 'max_depth': 3, 'min_child_weight': 3, 'subsample': 0.9, 'colsample_bytree': 0.5, 'colsample_bylevel': 0.9, 'reg_alpha': 0.00024588980217704533, 'reg_lambda': 0.00024976279855616314, 'gamma': 0.0012043977463494391}. Best is trial 420 with value: -1.0247060900564386.
/bsuhome/alexanderemert/Research/Star-Formation-Research-Project-2026/pipeline/scripts/optuna/final_preds_and_models/optuna_search_mult_quant_reg.py:161: UserWarning: The distribution is specified by [0.1, 5] and step=0.25, but the range is not divisible by `step`. It will be replaced with [0.1, 4.85].
  error_threshold = trial.suggest_float("error_threshold", 0.1, 5, step=0.25)
[I 2026-07-21 10:24:41,411] Trial 452 finished with value: -1.0265442484134468 and parameters: {'error_threshold': 1.35, 'scalers': 'robust', 'ratios': 'norm_ratio', 'imputers': 'median', 'n_estimators': 2750, 'learning_rate': 0.0054732206518536, 'max_depth': 3, 'min_child_weight': 3, 'subsample': 0.6, 'colsample_bytree': 0.5, 'colsample_bylevel': 0.9, 'reg_alpha': 0.6490725202059503, 'reg_lambda': 0.00023342391439833037, 'gamma': 0.0011522470867433212}. Best is trial 420 with value: -1.0247060900564386.
/bsuhome/alexanderemert/Research/Star-Formation-Research-Project-2026/pipeline/scripts/optuna/final_preds_and_models/optuna_search_mult_quant_reg.py:161: UserWarning: The distribution is specified by [0.1, 5] and step=0.25, but the range is not divisible by `step`. It will be replaced with [0.1, 4.85].
  error_threshold = trial.suggest_float("error_threshold", 0.1, 5, step=0.25)
[I 2026-07-21 10:24:43,176] Trial 453 finished with value: -1.0263778913139383 and parameters: {'error_threshold': 1.35, 'scalers': 'robust', 'ratios': 'norm_ratio', 'imputers': 'median', 'n_estimators': 2750, 'learning_rate': 0.005424966135225655, 'max_depth': 3, 'min_child_weight': 3, 'subsample': 0.6, 'colsample_bytree': 0.5, 'colsample_bylevel': 0.9, 'reg_alpha': 0.00010646892245393379, 'reg_lambda': 0.3239442571129265, 'gamma': 3.4722834461773285e-06}. Best is trial 420 with value: -1.0247060900564386.
/bsuhome/alexanderemert/Research/Star-Formation-Research-Project-2026/pipeline/scripts/optuna/final_preds_and_models/optuna_search_mult_quant_reg.py:161: UserWarning: The distribution is specified by [0.1, 5] and step=0.25, but the range is not divisible by `step`. It will be replaced with [0.1, 4.85].
  error_threshold = trial.suggest_float("error_threshold", 0.1, 5, step=0.25)
[I 2026-07-21 10:24:45,055] Trial 454 finished with value: -1.0269676110671413 and parameters: {'error_threshold': 1.35, 'scalers': 'robust', 'ratios': 'norm_ratio', 'imputers': 'median', 'n_estimators': 2750, 'learning_rate': 0.005254961187522766, 'max_depth': 3, 'min_child_weight': 3, 'subsample': 0.6, 'colsample_bytree': 0.6, 'colsample_bylevel': 0.9, 'reg_alpha': 0.0001194292557030939, 'reg_lambda': 0.00023082624535722496, 'gamma': 3.431506919648001}. Best is trial 420 with value: -1.0247060900564386.
/bsuhome/alexanderemert/Research/Star-Formation-Research-Project-2026/pipeline/scripts/optuna/final_preds_and_models/optuna_search_mult_quant_reg.py:161: UserWarning: The distribution is specified by [0.1, 5] and step=0.25, but the range is not divisible by `step`. It will be replaced with [0.1, 4.85].
  error_threshold = trial.suggest_float("error_threshold", 0.1, 5, step=0.25)
[I 2026-07-21 10:24:46,605] Trial 455 finished with value: -1.1046546688258754 and parameters: {'error_threshold': 1.35, 'scalers': 'robust', 'ratios': 'norm_ratio', 'imputers': 'median', 'n_estimators': 2750, 'learning_rate': 0.005401934136938975, 'max_depth': 3, 'min_child_weight': 3, 'subsample': 0.6, 'colsample_bytree': 0.6, 'colsample_bylevel': 0.9, 'reg_alpha': 64.89497343537093, 'reg_lambda': 0.0005819242908041931, 'gamma': 0.628405568626243}. Best is trial 420 with value: -1.0247060900564386.
/bsuhome/alexanderemert/Research/Star-Formation-Research-Project-2026/pipeline/scripts/optuna/final_preds_and_models/optuna_search_mult_quant_reg.py:161: UserWarning: The distribution is specified by [0.1, 5] and step=0.25, but the range is not divisible by `step`. It will be replaced with [0.1, 4.85].
  error_threshold = trial.suggest_float("error_threshold", 0.1, 5, step=0.25)
[I 2026-07-21 10:24:48,465] Trial 456 finished with value: -1.0261190498359098 and parameters: {'error_threshold': 1.35, 'scalers': 'robust', 'ratios': 'norm_ratio', 'imputers': 'median', 'n_estimators': 2800, 'learning_rate': 0.005313334230862042, 'max_depth': 3, 'min_child_weight': 3, 'subsample': 0.6, 'colsample_bytree': 0.5, 'colsample_bylevel': 0.9, 'reg_alpha': 1.001229434096295, 'reg_lambda': 0.00018589255970242086, 'gamma': 0.00015760709420639871}. Best is trial 420 with value: -1.0247060900564386.
/bsuhome/alexanderemert/Research/Star-Formation-Research-Project-2026/pipeline/scripts/optuna/final_preds_and_models/optuna_search_mult_quant_reg.py:161: UserWarning: The distribution is specified by [0.1, 5] and step=0.25, but the range is not divisible by `step`. It will be replaced with [0.1, 4.85].
  error_threshold = trial.suggest_float("error_threshold", 0.1, 5, step=0.25)
[I 2026-07-21 10:24:50,329] Trial 457 finished with value: -1.0296851741315503 and parameters: {'error_threshold': 1.35, 'scalers': 'robust', 'ratios': 'norm_ratio', 'imputers': 'median', 'n_estimators': 2800, 'learning_rate': 0.0027857002135612857, 'max_depth': 3, 'min_child_weight': 3, 'subsample': 0.6, 'colsample_bytree': 0.5, 'colsample_bylevel': 0.9, 'reg_alpha': 0.00011284114937125199, 'reg_lambda': 0.00023636278688010624, 'gamma': 5.230167862405496e-06}. Best is trial 420 with value: -1.0247060900564386.
/bsuhome/alexanderemert/Research/Star-Formation-Research-Project-2026/pipeline/scripts/optuna/final_preds_and_models/optuna_search_mult_quant_reg.py:161: UserWarning: The distribution is specified by [0.1, 5] and step=0.25, but the range is not divisible by `step`. It will be replaced with [0.1, 4.85].
  error_threshold = trial.suggest_float("error_threshold", 0.1, 5, step=0.25)
[I 2026-07-21 10:24:52,191] Trial 458 finished with value: -1.0301832928607242 and parameters: {'error_threshold': 1.35, 'scalers': 'robust', 'ratios': 'norm_ratio', 'imputers': 'median', 'n_estimators': 2800, 'learning_rate': 0.0027168209089380884, 'max_depth': 3, 'min_child_weight': 3, 'subsample': 0.6, 'colsample_bytree': 0.5, 'colsample_bylevel': 0.9, 'reg_alpha': 0.00011488560880616855, 'reg_lambda': 0.00045716430959982655, 'gamma': 2.154298532085707e-06}. Best is trial 420 with value: -1.0247060900564386.
/bsuhome/alexanderemert/Research/Star-Formation-Research-Project-2026/pipeline/scripts/optuna/final_preds_and_models/optuna_search_mult_quant_reg.py:161: UserWarning: The distribution is specified by [0.1, 5] and step=0.25, but the range is not divisible by `step`. It will be replaced with [0.1, 4.85].
  error_threshold = trial.suggest_float("error_threshold", 0.1, 5, step=0.25)
[I 2026-07-21 10:24:54,060] Trial 459 finished with value: -1.0249977950632732 and parameters: {'error_threshold': 1.1, 'scalers': 'robust', 'ratios': 'norm_ratio', 'imputers': 'median', 'n_estimators': 2800, 'learning_rate': 0.005472394457997821, 'max_depth': 3, 'min_child_weight': 3, 'subsample': 0.6, 'colsample_bytree': 0.5, 'colsample_bylevel': 0.9, 'reg_alpha': 8.911801857646297e-05, 'reg_lambda': 0.0004998744747819168, 'gamma': 0.21137590127835865}. Best is trial 420 with value: -1.0247060900564386.
/bsuhome/alexanderemert/Research/Star-Formation-Research-Project-2026/pipeline/scripts/optuna/final_preds_and_models/optuna_search_mult_quant_reg.py:161: UserWarning: The distribution is specified by [0.1, 5] and step=0.25, but the range is not divisible by `step`. It will be replaced with [0.1, 4.85].
  error_threshold = trial.suggest_float("error_threshold", 0.1, 5, step=0.25)
[I 2026-07-21 10:24:55,438] Trial 460 finished with value: -1.053223056542661 and parameters: {'error_threshold': 1.1, 'scalers': 'robust', 'ratios': 'norm_ratio', 'imputers': 'median', 'n_estimators': 2800, 'learning_rate': 0.0026864433319624763, 'max_depth': 3, 'min_child_weight': 3, 'subsample': 0.6, 'colsample_bytree': 0.5, 'colsample_bylevel': 0.9, 'reg_alpha': 0.0001258357008726845, 'reg_lambda': 0.0005106140735908427, 'gamma': 17.163763666586995}. Best is trial 420 with value: -1.0247060900564386.
/bsuhome/alexanderemert/Research/Star-Formation-Research-Project-2026/pipeline/scripts/optuna/final_preds_and_models/optuna_search_mult_quant_reg.py:161: UserWarning: The distribution is specified by [0.1, 5] and step=0.25, but the range is not divisible by `step`. It will be replaced with [0.1, 4.85].
  error_threshold = trial.suggest_float("error_threshold", 0.1, 5, step=0.25)
[I 2026-07-21 10:24:57,210] Trial 461 finished with value: -1.030097842972426 and parameters: {'error_threshold': 1.1, 'scalers': 'robust', 'ratios': 'norm_ratio', 'imputers': 'median', 'n_estimators': 2800, 'learning_rate': 0.002713394950007322, 'max_depth': 3, 'min_child_weight': 3, 'subsample': 0.6, 'colsample_bytree': 0.5, 'colsample_bylevel': 0.9, 'reg_alpha': 0.0004407471249414246, 'reg_lambda': 0.0006888576250702476, 'gamma': 4.8215672421966185e-06}. Best is trial 420 with value: -1.0247060900564386.
/bsuhome/alexanderemert/Research/Star-Formation-Research-Project-2026/pipeline/scripts/optuna/final_preds_and_models/optuna_search_mult_quant_reg.py:161: UserWarning: The distribution is specified by [0.1, 5] and step=0.25, but the range is not divisible by `step`. It will be replaced with [0.1, 4.85].
  error_threshold = trial.suggest_float("error_threshold", 0.1, 5, step=0.25)
[I 2026-07-21 10:24:58,650] Trial 462 finished with value: -1.0431153604399928 and parameters: {'error_threshold': 1.1, 'scalers': 'robust', 'ratios': 'norm_ratio', 'imputers': 'median', 'n_estimators': 2900, 'learning_rate': 0.002863448941141705, 'max_depth': 3, 'min_child_weight': 3, 'subsample': 0.6, 'colsample_bytree': 0.5, 'colsample_bylevel': 0.9, 'reg_alpha': 0.0004766154674122097, 'reg_lambda': 8.990218065674376e-05, 'gamma': 12.471688181405467}. Best is trial 420 with value: -1.0247060900564386.
/bsuhome/alexanderemert/Research/Star-Formation-Research-Project-2026/pipeline/scripts/optuna/final_preds_and_models/optuna_search_mult_quant_reg.py:161: UserWarning: The distribution is specified by [0.1, 5] and step=0.25, but the range is not divisible by `step`. It will be replaced with [0.1, 4.85].
  error_threshold = trial.suggest_float("error_threshold", 0.1, 5, step=0.25)
[I 2026-07-21 10:25:00,565] Trial 463 finished with value: -1.0293383306617512 and parameters: {'error_threshold': 1.1, 'scalers': 'robust', 'ratios': 'norm_ratio', 'imputers': 'median', 'n_estimators': 2900, 'learning_rate': 0.002708814012663282, 'max_depth': 3, 'min_child_weight': 3, 'subsample': 0.6, 'colsample_bytree': 0.5, 'colsample_bylevel': 0.9, 'reg_alpha': 0.0004365932804417171, 'reg_lambda': 0.004352671992161768, 'gamma': 5.379726882964854e-06}. Best is trial 420 with value: -1.0247060900564386.
/bsuhome/alexanderemert/Research/Star-Formation-Research-Project-2026/pipeline/scripts/optuna/final_preds_and_models/optuna_search_mult_quant_reg.py:161: UserWarning: The distribution is specified by [0.1, 5] and step=0.25, but the range is not divisible by `step`. It will be replaced with [0.1, 4.85].
  error_threshold = trial.suggest_float("error_threshold", 0.1, 5, step=0.25)
[I 2026-07-21 10:25:01,896] Trial 464 finished with value: -1.059290861505686 and parameters: {'error_threshold': 1.1, 'scalers': 'robust', 'ratios': 'norm_ratio', 'imputers': 'median', 'n_estimators': 2900, 'learning_rate': 0.0027018946798206675, 'max_depth': 3, 'min_child_weight': 3, 'subsample': 0.6, 'colsample_bytree': 0.5, 'colsample_bylevel': 0.9, 'reg_alpha': 0.000392785943315493, 'reg_lambda': 0.0004898468615189866, 'gamma': 21.354042856277992}. Best is trial 420 with value: -1.0247060900564386.
/bsuhome/alexanderemert/Research/Star-Formation-Research-Project-2026/pipeline/scripts/optuna/final_preds_and_models/optuna_search_mult_quant_reg.py:161: UserWarning: The distribution is specified by [0.1, 5] and step=0.25, but the range is not divisible by `step`. It will be replaced with [0.1, 4.85].
  error_threshold = trial.suggest_float("error_threshold", 0.1, 5, step=0.25)
[I 2026-07-21 10:25:03,749] Trial 465 finished with value: -1.024241428557761 and parameters: {'error_threshold': 1.1, 'scalers': 'robust', 'ratios': 'norm_ratio', 'imputers': 'median', 'n_estimators': 2900, 'learning_rate': 0.0045008948733388085, 'max_depth': 3, 'min_child_weight': 3, 'subsample': 0.6, 'colsample_bytree': 0.5, 'colsample_bylevel': 0.9, 'reg_alpha': 0.0003920374418752904, 'reg_lambda': 9.592523443692254e-05, 'gamma': 2.2123847572194585e-06}. Best is trial 465 with value: -1.024241428557761.
/bsuhome/alexanderemert/Research/Star-Formation-Research-Project-2026/pipeline/scripts/optuna/final_preds_and_models/optuna_search_mult_quant_reg.py:161: UserWarning: The distribution is specified by [0.1, 5] and step=0.25, but the range is not divisible by `step`. It will be replaced with [0.1, 4.85].
  error_threshold = trial.suggest_float("error_threshold", 0.1, 5, step=0.25)
[I 2026-07-21 10:25:05,676] Trial 466 finished with value: -1.0306195710975918 and parameters: {'error_threshold': 1.1, 'scalers': 'none', 'ratios': 'norm_ratio', 'imputers': 'median', 'n_estimators': 2900, 'learning_rate': 0.008912767602598681, 'max_depth': 3, 'min_child_weight': 3, 'subsample': 0.6, 'colsample_bytree': 0.5, 'colsample_bylevel': 0.9, 'reg_alpha': 0.0004283463014655952, 'reg_lambda': 8.394728696289274e-05, 'gamma': 8.038460256322251e-05}. Best is trial 465 with value: -1.024241428557761.
/bsuhome/alexanderemert/Research/Star-Formation-Research-Project-2026/pipeline/scripts/optuna/final_preds_and_models/optuna_search_mult_quant_reg.py:161: UserWarning: The distribution is specified by [0.1, 5] and step=0.25, but the range is not divisible by `step`. It will be replaced with [0.1, 4.85].
  error_threshold = trial.suggest_float("error_threshold", 0.1, 5, step=0.25)
[I 2026-07-21 10:25:06,280] Trial 467 finished with value: -1.1631038555016646 and parameters: {'error_threshold': 1.1, 'scalers': 'robust', 'ratios': 'norm_ratio', 'imputers': 'median', 'n_estimators': 2900, 'learning_rate': 0.272852427185428, 'max_depth': 3, 'min_child_weight': 3, 'subsample': 0.6, 'colsample_bytree': 0.5, 'colsample_bylevel': 0.9, 'reg_alpha': 0.0004975200651631773, 'reg_lambda': 0.0006410654076213871, 'gamma': 1.5846252103492275}. Best is trial 465 with value: -1.024241428557761.
/bsuhome/alexanderemert/Research/Star-Formation-Research-Project-2026/pipeline/scripts/optuna/final_preds_and_models/optuna_search_mult_quant_reg.py:161: UserWarning: The distribution is specified by [0.1, 5] and step=0.25, but the range is not divisible by `step`. It will be replaced with [0.1, 4.85].
  error_threshold = trial.suggest_float("error_threshold", 0.1, 5, step=0.25)
[I 2026-07-21 10:25:08,125] Trial 468 finished with value: -1.0243791020357715 and parameters: {'error_threshold': 1.1, 'scalers': 'robust', 'ratios': 'norm_ratio', 'imputers': 'median', 'n_estimators': 2900, 'learning_rate': 0.004418397935577192, 'max_depth': 3, 'min_child_weight': 3, 'subsample': 0.6, 'colsample_bytree': 0.5, 'colsample_bylevel': 0.9, 'reg_alpha': 0.0003958359258162238, 'reg_lambda': 0.0003393365477847692, 'gamma': 0.20557918624325341}. Best is trial 465 with value: -1.024241428557761.
/bsuhome/alexanderemert/Research/Star-Formation-Research-Project-2026/pipeline/scripts/optuna/final_preds_and_models/optuna_search_mult_quant_reg.py:161: UserWarning: The distribution is specified by [0.1, 5] and step=0.25, but the range is not divisible by `step`. It will be replaced with [0.1, 4.85].
  error_threshold = trial.suggest_float("error_threshold", 0.1, 5, step=0.25)
[I 2026-07-21 10:25:09,918] Trial 469 finished with value: -1.0327014361485378 and parameters: {'error_threshold': 1.1, 'scalers': 'robust', 'ratios': 'norm_ratio', 'imputers': 'median', 'n_estimators': 2900, 'learning_rate': 0.009492729915448464, 'max_depth': 3, 'min_child_weight': 5, 'subsample': 0.6, 'colsample_bytree': 0.5, 'colsample_bylevel': 0.9, 'reg_alpha': 0.0004175992691574293, 'reg_lambda': 0.0008214637193917169, 'gamma': 0.20242927574133265}. Best is trial 465 with value: -1.024241428557761.
/bsuhome/alexanderemert/Research/Star-Formation-Research-Project-2026/pipeline/scripts/optuna/final_preds_and_models/optuna_search_mult_quant_reg.py:161: UserWarning: The distribution is specified by [0.1, 5] and step=0.25, but the range is not divisible by `step`. It will be replaced with [0.1, 4.85].
  error_threshold = trial.suggest_float("error_threshold", 0.1, 5, step=0.25)
[I 2026-07-21 10:25:11,732] Trial 470 finished with value: -1.0371340038193664 and parameters: {'error_threshold': 0.35, 'scalers': 'robust', 'ratios': 'norm_ratio', 'imputers': 'median', 'n_estimators': 2900, 'learning_rate': 0.00952829425660827, 'max_depth': 3, 'min_child_weight': 3, 'subsample': 0.6, 'colsample_bytree': 0.5, 'colsample_bylevel': 0.9, 'reg_alpha': 0.0003698377350426337, 'reg_lambda': 0.004490200536487707, 'gamma': 6.165791607537223e-06}. Best is trial 465 with value: -1.024241428557761.
/bsuhome/alexanderemert/Research/Star-Formation-Research-Project-2026/pipeline/scripts/optuna/final_preds_and_models/optuna_search_mult_quant_reg.py:161: UserWarning: The distribution is specified by [0.1, 5] and step=0.25, but the range is not divisible by `step`. It will be replaced with [0.1, 4.85].
  error_threshold = trial.suggest_float("error_threshold", 0.1, 5, step=0.25)
[I 2026-07-21 10:25:13,551] Trial 471 finished with value: -1.0245401254957207 and parameters: {'error_threshold': 1.1, 'scalers': 'robust', 'ratios': 'norm_ratio', 'imputers': 'median', 'n_estimators': 2900, 'learning_rate': 0.0045372706567160135, 'max_depth': 3, 'min_child_weight': 5, 'subsample': 0.6, 'colsample_bytree': 0.5, 'colsample_bylevel': 0.9, 'reg_alpha': 0.0001607458014232796, 'reg_lambda': 0.0003377280101465516, 'gamma': 0.19389140490915466}. Best is trial 465 with value: -1.024241428557761.
/bsuhome/alexanderemert/Research/Star-Formation-Research-Project-2026/pipeline/scripts/optuna/final_preds_and_models/optuna_search_mult_quant_reg.py:161: UserWarning: The distribution is specified by [0.1, 5] and step=0.25, but the range is not divisible by `step`. It will be replaced with [0.1, 4.85].
  error_threshold = trial.suggest_float("error_threshold", 0.1, 5, step=0.25)
[I 2026-07-21 10:25:15,146] Trial 472 finished with value: -1.030385825982056 and parameters: {'error_threshold': 0.6, 'scalers': 'robust', 'ratios': 'norm_ratio', 'imputers': 'median', 'n_estimators': 2550, 'learning_rate': 0.008923328779205219, 'max_depth': 3, 'min_child_weight': 5, 'subsample': 0.6, 'colsample_bytree': 0.5, 'colsample_bylevel': 0.9, 'reg_alpha': 0.00015576540114698283, 'reg_lambda': 0.0004027479484349686, 'gamma': 0.008052617232297514}. Best is trial 465 with value: -1.024241428557761.
[I 2026-07-21 10:25:17,027] Trial 473 finished with value: -1.0246930363695523 and parameters: {'error_threshold': 1.1, 'scalers': 'robust', 'ratios': 'norm_ratio', 'imputers': 'median', 'n_estimators': 2900, 'learning_rate': 0.003978401345242879, 'max_depth': 3, 'min_child_weight': 3, 'subsample': 0.6, 'colsample_bytree': 0.5, 'colsample_bylevel': 0.9, 'reg_alpha': 4.4142258358603105e-05, 'reg_lambda': 0.0008591578692207696, 'gamma': 0.007729697166816979}. Best is trial 465 with value: -1.024241428557761.
[I 2026-07-21 10:25:17,188] Trial 474 finished with value: -1.3272241795328514 and parameters: {'error_threshold': 1.6, 'scalers': 'robust', 'ratios': 'norm_ratio', 'imputers': 'median', 'n_estimators': 350, 'learning_rate': 0.004601812472645639, 'max_depth': 3, 'min_child_weight': 5, 'subsample': 0.6, 'colsample_bytree': 0.5, 'colsample_bylevel': 0.9, 'reg_alpha': 8.370813309104715e-05, 'reg_lambda': 0.0007255788446756289, 'gamma': 1.4509492652776979}. Best is trial 465 with value: -1.024241428557761.
[I 2026-07-21 10:25:18,804] Trial 475 finished with value: -1.0262320297565364 and parameters: {'error_threshold': 1.1, 'scalers': 'robust', 'ratios': 'norm_ratio', 'imputers': 'median', 'n_estimators': 2850, 'learning_rate': 0.0037665943514419683, 'max_depth': 3, 'min_child_weight': 5, 'subsample': 0.6, 'colsample_bytree': 0.5, 'colsample_bylevel': 0.9, 'reg_alpha': 8.705462234002187e-05, 'reg_lambda': 0.0025500142815824338, 'gamma': 4.497819834855559}. Best is trial 465 with value: -1.024241428557761.
[I 2026-07-21 10:25:20,579] Trial 476 finished with value: -1.0249062734811787 and parameters: {'error_threshold': 1.1, 'scalers': 'robust', 'ratios': 'norm_ratio', 'imputers': 'median', 'n_estimators': 2900, 'learning_rate': 0.0036643122938959916, 'max_depth': 3, 'min_child_weight': 5, 'subsample': 0.6, 'colsample_bytree': 0.5, 'colsample_bylevel': 0.9, 'reg_alpha': 0.00036093040354452015, 'reg_lambda': 0.0003797805773999486, 'gamma': 0.22777137973161815}. Best is trial 465 with value: -1.024241428557761.
[I 2026-07-21 10:25:22,265] Trial 477 finished with value: -1.0284452289694934 and parameters: {'error_threshold': 0.35, 'scalers': 'robust', 'ratios': 'norm_ratio', 'imputers': 'median', 'n_estimators': 2850, 'learning_rate': 0.0038072986651421434, 'max_depth': 3, 'min_child_weight': 5, 'subsample': 0.6, 'colsample_bytree': 0.5, 'colsample_bylevel': 0.8, 'reg_alpha': 0.00036371898649389695, 'reg_lambda': 0.00035097498778183467, 'gamma': 0.474220569474445}. Best is trial 465 with value: -1.024241428557761.
