[I 2026-07-20 12:29:05,740] Trial 122 finished with value: -0.3657793156391984 and parameters: {'error_threshold': 1.75, 'scalers': 'standard', 'ratios': 'norm_ratio', 'imputers': 'median', 'n_estimators': 250, 'learning_rate': 0.012524262826789628, 'max_depth': 6, 'min_child_weight': 5, 'subsample': 0.6, 'colsample_bytree': 0.7, 'colsample_bylevel': 1.0, 'reg_alpha': 38.2085143490473, 'reg_lambda': 7.712924567113908e-05, 'gamma': 58.74487437336037}. Best is trial 69 with value: -0.3911874830873789.
/bsuscratch/alexanderemert/miniforge3/envs/starform-alex/lib/python3.14/site-packages/sklearn/utils/extmath.py:1207: RuntimeWarning: invalid value encountered in divide
  updated_mean = (last_sum + new_sum) / updated_sample_count
/bsuscratch/alexanderemert/miniforge3/envs/starform-alex/lib/python3.14/site-packages/sklearn/utils/extmath.py:1212: RuntimeWarning: invalid value encountered in divide
  T = new_sum / new_sample_count
/bsuscratch/alexanderemert/miniforge3/envs/starform-alex/lib/python3.14/site-packages/sklearn/utils/extmath.py:1236: RuntimeWarning: invalid value encountered in divide
  new_unnormalized_variance -= correction**2 / new_sample_count
/bsuscratch/alexanderemert/miniforge3/envs/starform-alex/lib/python3.14/site-packages/sklearn/utils/extmath.py:1207: RuntimeWarning: invalid value encountered in divide
  updated_mean = (last_sum + new_sum) / updated_sample_count
/bsuscratch/alexanderemert/miniforge3/envs/starform-alex/lib/python3.14/site-packages/sklearn/utils/extmath.py:1212: RuntimeWarning: invalid value encountered in divide
  T = new_sum / new_sample_count
/bsuscratch/alexanderemert/miniforge3/envs/starform-alex/lib/python3.14/site-packages/sklearn/utils/extmath.py:1236: RuntimeWarning: invalid value encountered in divide
  new_unnormalized_variance -= correction**2 / new_sample_count
/bsuscratch/alexanderemert/miniforge3/envs/starform-alex/lib/python3.14/site-packages/sklearn/utils/extmath.py:1207: RuntimeWarning: invalid value encountered in divide
  updated_mean = (last_sum + new_sum) / updated_sample_count
/bsuscratch/alexanderemert/miniforge3/envs/starform-alex/lib/python3.14/site-packages/sklearn/utils/extmath.py:1212: RuntimeWarning: invalid value encountered in divide
  T = new_sum / new_sample_count
/bsuscratch/alexanderemert/miniforge3/envs/starform-alex/lib/python3.14/site-packages/sklearn/utils/extmath.py:1236: RuntimeWarning: invalid value encountered in divide
  new_unnormalized_variance -= correction**2 / new_sample_count
/bsuscratch/alexanderemert/miniforge3/envs/starform-alex/lib/python3.14/site-packages/sklearn/utils/extmath.py:1207: RuntimeWarning: invalid value encountered in divide
  updated_mean = (last_sum + new_sum) / updated_sample_count
/bsuscratch/alexanderemert/miniforge3/envs/starform-alex/lib/python3.14/site-packages/sklearn/utils/extmath.py:1212: RuntimeWarning: invalid value encountered in divide
  T = new_sum / new_sample_count
/bsuscratch/alexanderemert/miniforge3/envs/starform-alex/lib/python3.14/site-packages/sklearn/utils/extmath.py:1236: RuntimeWarning: invalid value encountered in divide
  new_unnormalized_variance -= correction**2 / new_sample_count
/bsuscratch/alexanderemert/miniforge3/envs/starform-alex/lib/python3.14/site-packages/sklearn/utils/extmath.py:1207: RuntimeWarning: invalid value encountered in divide
  updated_mean = (last_sum + new_sum) / updated_sample_count
/bsuscratch/alexanderemert/miniforge3/envs/starform-alex/lib/python3.14/site-packages/sklearn/utils/extmath.py:1212: RuntimeWarning: invalid value encountered in divide
  T = new_sum / new_sample_count
/bsuscratch/alexanderemert/miniforge3/envs/starform-alex/lib/python3.14/site-packages/sklearn/utils/extmath.py:1236: RuntimeWarning: invalid value encountered in divide
  new_unnormalized_variance -= correction**2 / new_sample_count
/bsuscratch/alexanderemert/miniforge3/envs/starform-alex/lib/python3.14/site-packages/sklearn/utils/extmath.py:1207: RuntimeWarning: invalid value encountered in divide
  updated_mean = (last_sum + new_sum) / updated_sample_count
/bsuscratch/alexanderemert/miniforge3/envs/starform-alex/lib/python3.14/site-packages/sklearn/utils/extmath.py:1212: RuntimeWarning: invalid value encountered in divide
  T = new_sum / new_sample_count
/bsuscratch/alexanderemert/miniforge3/envs/starform-alex/lib/python3.14/site-packages/sklearn/utils/extmath.py:1236: RuntimeWarning: invalid value encountered in divide
  new_unnormalized_variance -= correction**2 / new_sample_count
/bsuscratch/alexanderemert/miniforge3/envs/starform-alex/lib/python3.14/site-packages/sklearn/utils/extmath.py:1207: RuntimeWarning: invalid value encountered in divide
  updated_mean = (last_sum + new_sum) / updated_sample_count
/bsuscratch/alexanderemert/miniforge3/envs/starform-alex/lib/python3.14/site-packages/sklearn/utils/extmath.py:1212: RuntimeWarning: invalid value encountered in divide
  T = new_sum / new_sample_count
/bsuscratch/alexanderemert/miniforge3/envs/starform-alex/lib/python3.14/site-packages/sklearn/utils/extmath.py:1236: RuntimeWarning: invalid value encountered in divide
  new_unnormalized_variance -= correction**2 / new_sample_count
/bsuscratch/alexanderemert/miniforge3/envs/starform-alex/lib/python3.14/site-packages/sklearn/utils/extmath.py:1207: RuntimeWarning: invalid value encountered in divide
  updated_mean = (last_sum + new_sum) / updated_sample_count
/bsuscratch/alexanderemert/miniforge3/envs/starform-alex/lib/python3.14/site-packages/sklearn/utils/extmath.py:1212: RuntimeWarning: invalid value encountered in divide
  T = new_sum / new_sample_count
/bsuscratch/alexanderemert/miniforge3/envs/starform-alex/lib/python3.14/site-packages/sklearn/utils/extmath.py:1236: RuntimeWarning: invalid value encountered in divide
  new_unnormalized_variance -= correction**2 / new_sample_count
/bsuscratch/alexanderemert/miniforge3/envs/starform-alex/lib/python3.14/site-packages/sklearn/utils/extmath.py:1207: RuntimeWarning: invalid value encountered in divide
  updated_mean = (last_sum + new_sum) / updated_sample_count
/bsuscratch/alexanderemert/miniforge3/envs/starform-alex/lib/python3.14/site-packages/sklearn/utils/extmath.py:1212: RuntimeWarning: invalid value encountered in divide
  T = new_sum / new_sample_count
/bsuscratch/alexanderemert/miniforge3/envs/starform-alex/lib/python3.14/site-packages/sklearn/utils/extmath.py:1236: RuntimeWarning: invalid value encountered in divide
  new_unnormalized_variance -= correction**2 / new_sample_count
/bsuscratch/alexanderemert/miniforge3/envs/starform-alex/lib/python3.14/site-packages/sklearn/utils/extmath.py:1207: RuntimeWarning: invalid value encountered in divide
  updated_mean = (last_sum + new_sum) / updated_sample_count
/bsuscratch/alexanderemert/miniforge3/envs/starform-alex/lib/python3.14/site-packages/sklearn/utils/extmath.py:1212: RuntimeWarning: invalid value encountered in divide
  T = new_sum / new_sample_count
/bsuscratch/alexanderemert/miniforge3/envs/starform-alex/lib/python3.14/site-packages/sklearn/utils/extmath.py:1236: RuntimeWarning: invalid value encountered in divide
  new_unnormalized_variance -= correction**2 / new_sample_count
/bsuscratch/alexanderemert/miniforge3/envs/starform-alex/lib/python3.14/site-packages/sklearn/utils/extmath.py:1207: RuntimeWarning: invalid value encountered in divide
  updated_mean = (last_sum + new_sum) / updated_sample_count
/bsuscratch/alexanderemert/miniforge3/envs/starform-alex/lib/python3.14/site-packages/sklearn/utils/extmath.py:1212: RuntimeWarning: invalid value encountered in divide
  T = new_sum / new_sample_count
/bsuscratch/alexanderemert/miniforge3/envs/starform-alex/lib/python3.14/site-packages/sklearn/utils/extmath.py:1236: RuntimeWarning: invalid value encountered in divide
  new_unnormalized_variance -= correction**2 / new_sample_count
/bsuscratch/alexanderemert/miniforge3/envs/starform-alex/lib/python3.14/site-packages/sklearn/utils/extmath.py:1207: RuntimeWarning: invalid value encountered in divide
  updated_mean = (last_sum + new_sum) / updated_sample_count
/bsuscratch/alexanderemert/miniforge3/envs/starform-alex/lib/python3.14/site-packages/sklearn/utils/extmath.py:1212: RuntimeWarning: invalid value encountered in divide
  T = new_sum / new_sample_count
/bsuscratch/alexanderemert/miniforge3/envs/starform-alex/lib/python3.14/site-packages/sklearn/utils/extmath.py:1236: RuntimeWarning: invalid value encountered in divide
  new_unnormalized_variance -= correction**2 / new_sample_count
/bsuscratch/alexanderemert/miniforge3/envs/starform-alex/lib/python3.14/site-packages/sklearn/utils/extmath.py:1207: RuntimeWarning: invalid value encountered in divide
  updated_mean = (last_sum + new_sum) / updated_sample_count
/bsuscratch/alexanderemert/miniforge3/envs/starform-alex/lib/python3.14/site-packages/sklearn/utils/extmath.py:1212: RuntimeWarning: invalid value encountered in divide
  T = new_sum / new_sample_count
/bsuscratch/alexanderemert/miniforge3/envs/starform-alex/lib/python3.14/site-packages/sklearn/utils/extmath.py:1236: RuntimeWarning: invalid value encountered in divide
  new_unnormalized_variance -= correction**2 / new_sample_count
/bsuscratch/alexanderemert/miniforge3/envs/starform-alex/lib/python3.14/site-packages/sklearn/utils/extmath.py:1207: RuntimeWarning: invalid value encountered in divide
  updated_mean = (last_sum + new_sum) / updated_sample_count
/bsuscratch/alexanderemert/miniforge3/envs/starform-alex/lib/python3.14/site-packages/sklearn/utils/extmath.py:1212: RuntimeWarning: invalid value encountered in divide
  T = new_sum / new_sample_count
/bsuscratch/alexanderemert/miniforge3/envs/starform-alex/lib/python3.14/site-packages/sklearn/utils/extmath.py:1236: RuntimeWarning: invalid value encountered in divide
  new_unnormalized_variance -= correction**2 / new_sample_count
/bsuscratch/alexanderemert/miniforge3/envs/starform-alex/lib/python3.14/site-packages/sklearn/utils/extmath.py:1207: RuntimeWarning: invalid value encountered in divide
  updated_mean = (last_sum + new_sum) / updated_sample_count
/bsuscratch/alexanderemert/miniforge3/envs/starform-alex/lib/python3.14/site-packages/sklearn/utils/extmath.py:1212: RuntimeWarning: invalid value encountered in divide
  T = new_sum / new_sample_count
/bsuscratch/alexanderemert/miniforge3/envs/starform-alex/lib/python3.14/site-packages/sklearn/utils/extmath.py:1236: RuntimeWarning: invalid value encountered in divide
  new_unnormalized_variance -= correction**2 / new_sample_count
/bsuscratch/alexanderemert/miniforge3/envs/starform-alex/lib/python3.14/site-packages/sklearn/utils/extmath.py:1207: RuntimeWarning: invalid value encountered in divide
  updated_mean = (last_sum + new_sum) / updated_sample_count
/bsuscratch/alexanderemert/miniforge3/envs/starform-alex/lib/python3.14/site-packages/sklearn/utils/extmath.py:1212: RuntimeWarning: invalid value encountered in divide
  T = new_sum / new_sample_count
/bsuscratch/alexanderemert/miniforge3/envs/starform-alex/lib/python3.14/site-packages/sklearn/utils/extmath.py:1236: RuntimeWarning: invalid value encountered in divide
  new_unnormalized_variance -= correction**2 / new_sample_count
/bsuscratch/alexanderemert/miniforge3/envs/starform-alex/lib/python3.14/site-packages/sklearn/utils/extmath.py:1207: RuntimeWarning: invalid value encountered in divide
  updated_mean = (last_sum + new_sum) / updated_sample_count
/bsuscratch/alexanderemert/miniforge3/envs/starform-alex/lib/python3.14/site-packages/sklearn/utils/extmath.py:1212: RuntimeWarning: invalid value encountered in divide
  T = new_sum / new_sample_count
/bsuscratch/alexanderemert/miniforge3/envs/starform-alex/lib/python3.14/site-packages/sklearn/utils/extmath.py:1236: RuntimeWarning: invalid value encountered in divide
  new_unnormalized_variance -= correction**2 / new_sample_count
/bsuscratch/alexanderemert/miniforge3/envs/starform-alex/lib/python3.14/site-packages/sklearn/utils/extmath.py:1207: RuntimeWarning: invalid value encountered in divide
  updated_mean = (last_sum + new_sum) / updated_sample_count
/bsuscratch/alexanderemert/miniforge3/envs/starform-alex/lib/python3.14/site-packages/sklearn/utils/extmath.py:1212: RuntimeWarning: invalid value encountered in divide
  T = new_sum / new_sample_count
/bsuscratch/alexanderemert/miniforge3/envs/starform-alex/lib/python3.14/site-packages/sklearn/utils/extmath.py:1236: RuntimeWarning: invalid value encountered in divide
  new_unnormalized_variance -= correction**2 / new_sample_count
/bsuscratch/alexanderemert/miniforge3/envs/starform-alex/lib/python3.14/site-packages/sklearn/utils/extmath.py:1207: RuntimeWarning: invalid value encountered in divide
  updated_mean = (last_sum + new_sum) / updated_sample_count
/bsuscratch/alexanderemert/miniforge3/envs/starform-alex/lib/python3.14/site-packages/sklearn/utils/extmath.py:1212: RuntimeWarning: invalid value encountered in divide
  T = new_sum / new_sample_count
/bsuscratch/alexanderemert/miniforge3/envs/starform-alex/lib/python3.14/site-packages/sklearn/utils/extmath.py:1236: RuntimeWarning: invalid value encountered in divide
  new_unnormalized_variance -= correction**2 / new_sample_count
/bsuscratch/alexanderemert/miniforge3/envs/starform-alex/lib/python3.14/site-packages/sklearn/utils/extmath.py:1207: RuntimeWarning: invalid value encountered in divide
  updated_mean = (last_sum + new_sum) / updated_sample_count
/bsuscratch/alexanderemert/miniforge3/envs/starform-alex/lib/python3.14/site-packages/sklearn/utils/extmath.py:1212: RuntimeWarning: invalid value encountered in divide
  T = new_sum / new_sample_count
/bsuscratch/alexanderemert/miniforge3/envs/starform-alex/lib/python3.14/site-packages/sklearn/utils/extmath.py:1236: RuntimeWarning: invalid value encountered in divide
  new_unnormalized_variance -= correction**2 / new_sample_count
/bsuscratch/alexanderemert/miniforge3/envs/starform-alex/lib/python3.14/site-packages/sklearn/utils/extmath.py:1207: RuntimeWarning: invalid value encountered in divide
  updated_mean = (last_sum + new_sum) / updated_sample_count
/bsuscratch/alexanderemert/miniforge3/envs/starform-alex/lib/python3.14/site-packages/sklearn/utils/extmath.py:1212: RuntimeWarning: invalid value encountered in divide
  T = new_sum / new_sample_count
/bsuscratch/alexanderemert/miniforge3/envs/starform-alex/lib/python3.14/site-packages/sklearn/utils/extmath.py:1236: RuntimeWarning: invalid value encountered in divide
  new_unnormalized_variance -= correction**2 / new_sample_count
/bsuscratch/alexanderemert/miniforge3/envs/starform-alex/lib/python3.14/site-packages/sklearn/utils/extmath.py:1207: RuntimeWarning: invalid value encountered in divide
  updated_mean = (last_sum + new_sum) / updated_sample_count
/bsuscratch/alexanderemert/miniforge3/envs/starform-alex/lib/python3.14/site-packages/sklearn/utils/extmath.py:1212: RuntimeWarning: invalid value encountered in divide
  T = new_sum / new_sample_count
/bsuscratch/alexanderemert/miniforge3/envs/starform-alex/lib/python3.14/site-packages/sklearn/utils/extmath.py:1236: RuntimeWarning: invalid value encountered in divide
  new_unnormalized_variance -= correction**2 / new_sample_count
/bsuscratch/alexanderemert/miniforge3/envs/starform-alex/lib/python3.14/site-packages/sklearn/utils/extmath.py:1207: RuntimeWarning: invalid value encountered in divide
  updated_mean = (last_sum + new_sum) / updated_sample_count
/bsuscratch/alexanderemert/miniforge3/envs/starform-alex/lib/python3.14/site-packages/sklearn/utils/extmath.py:1212: RuntimeWarning: invalid value encountered in divide
  T = new_sum / new_sample_count
/bsuscratch/alexanderemert/miniforge3/envs/starform-alex/lib/python3.14/site-packages/sklearn/utils/extmath.py:1236: RuntimeWarning: invalid value encountered in divide
  new_unnormalized_variance -= correction**2 / new_sample_count
/bsuscratch/alexanderemert/miniforge3/envs/starform-alex/lib/python3.14/site-packages/sklearn/utils/extmath.py:1207: RuntimeWarning: invalid value encountered in divide
  updated_mean = (last_sum + new_sum) / updated_sample_count
/bsuscratch/alexanderemert/miniforge3/envs/starform-alex/lib/python3.14/site-packages/sklearn/utils/extmath.py:1212: RuntimeWarning: invalid value encountered in divide
  T = new_sum / new_sample_count
/bsuscratch/alexanderemert/miniforge3/envs/starform-alex/lib/python3.14/site-packages/sklearn/utils/extmath.py:1236: RuntimeWarning: invalid value encountered in divide
  new_unnormalized_variance -= correction**2 / new_sample_count
/bsuscratch/alexanderemert/miniforge3/envs/starform-alex/lib/python3.14/site-packages/sklearn/utils/extmath.py:1207: RuntimeWarning: invalid value encountered in divide
  updated_mean = (last_sum + new_sum) / updated_sample_count
/bsuscratch/alexanderemert/miniforge3/envs/starform-alex/lib/python3.14/site-packages/sklearn/utils/extmath.py:1212: RuntimeWarning: invalid value encountered in divide
  T = new_sum / new_sample_count
/bsuscratch/alexanderemert/miniforge3/envs/starform-alex/lib/python3.14/site-packages/sklearn/utils/extmath.py:1236: RuntimeWarning: invalid value encountered in divide
  new_unnormalized_variance -= correction**2 / new_sample_count
/bsuscratch/alexanderemert/miniforge3/envs/starform-alex/lib/python3.14/site-packages/sklearn/utils/extmath.py:1207: RuntimeWarning: invalid value encountered in divide
  updated_mean = (last_sum + new_sum) / updated_sample_count
/bsuscratch/alexanderemert/miniforge3/envs/starform-alex/lib/python3.14/site-packages/sklearn/utils/extmath.py:1212: RuntimeWarning: invalid value encountered in divide
  T = new_sum / new_sample_count
/bsuscratch/alexanderemert/miniforge3/envs/starform-alex/lib/python3.14/site-packages/sklearn/utils/extmath.py:1236: RuntimeWarning: invalid value encountered in divide
  new_unnormalized_variance -= correction**2 / new_sample_count
/bsuscratch/alexanderemert/miniforge3/envs/starform-alex/lib/python3.14/site-packages/sklearn/utils/extmath.py:1207: RuntimeWarning: invalid value encountered in divide
  updated_mean = (last_sum + new_sum) / updated_sample_count
/bsuscratch/alexanderemert/miniforge3/envs/starform-alex/lib/python3.14/site-packages/sklearn/utils/extmath.py:1212: RuntimeWarning: invalid value encountered in divide
  T = new_sum / new_sample_count
/bsuscratch/alexanderemert/miniforge3/envs/starform-alex/lib/python3.14/site-packages/sklearn/utils/extmath.py:1236: RuntimeWarning: invalid value encountered in divide
  new_unnormalized_variance -= correction**2 / new_sample_count
/bsuscratch/alexanderemert/miniforge3/envs/starform-alex/lib/python3.14/site-packages/sklearn/utils/extmath.py:1207: RuntimeWarning: invalid value encountered in divide
  updated_mean = (last_sum + new_sum) / updated_sample_count
/bsuscratch/alexanderemert/miniforge3/envs/starform-alex/lib/python3.14/site-packages/sklearn/utils/extmath.py:1212: RuntimeWarning: invalid value encountered in divide
  T = new_sum / new_sample_count
/bsuscratch/alexanderemert/miniforge3/envs/starform-alex/lib/python3.14/site-packages/sklearn/utils/extmath.py:1236: RuntimeWarning: invalid value encountered in divide
  new_unnormalized_variance -= correction**2 / new_sample_count
/bsuscratch/alexanderemert/miniforge3/envs/starform-alex/lib/python3.14/site-packages/sklearn/utils/extmath.py:1207: RuntimeWarning: invalid value encountered in divide
  updated_mean = (last_sum + new_sum) / updated_sample_count
/bsuscratch/alexanderemert/miniforge3/envs/starform-alex/lib/python3.14/site-packages/sklearn/utils/extmath.py:1212: RuntimeWarning: invalid value encountered in divide
  T = new_sum / new_sample_count
/bsuscratch/alexanderemert/miniforge3/envs/starform-alex/lib/python3.14/site-packages/sklearn/utils/extmath.py:1236: RuntimeWarning: invalid value encountered in divide
  new_unnormalized_variance -= correction**2 / new_sample_count
/bsuscratch/alexanderemert/miniforge3/envs/starform-alex/lib/python3.14/site-packages/sklearn/utils/extmath.py:1207: RuntimeWarning: invalid value encountered in divide
  updated_mean = (last_sum + new_sum) / updated_sample_count
/bsuscratch/alexanderemert/miniforge3/envs/starform-alex/lib/python3.14/site-packages/sklearn/utils/extmath.py:1212: RuntimeWarning: invalid value encountered in divide
  T = new_sum / new_sample_count
/bsuscratch/alexanderemert/miniforge3/envs/starform-alex/lib/python3.14/site-packages/sklearn/utils/extmath.py:1236: RuntimeWarning: invalid value encountered in divide
  new_unnormalized_variance -= correction**2 / new_sample_count
/bsuscratch/alexanderemert/miniforge3/envs/starform-alex/lib/python3.14/site-packages/sklearn/utils/extmath.py:1207: RuntimeWarning: invalid value encountered in divide
  updated_mean = (last_sum + new_sum) / updated_sample_count
/bsuscratch/alexanderemert/miniforge3/envs/starform-alex/lib/python3.14/site-packages/sklearn/utils/extmath.py:1212: RuntimeWarning: invalid value encountered in divide
  T = new_sum / new_sample_count
/bsuscratch/alexanderemert/miniforge3/envs/starform-alex/lib/python3.14/site-packages/sklearn/utils/extmath.py:1236: RuntimeWarning: invalid value encountered in divide
  new_unnormalized_variance -= correction**2 / new_sample_count
/bsuscratch/alexanderemert/miniforge3/envs/starform-alex/lib/python3.14/site-packages/sklearn/utils/extmath.py:1207: RuntimeWarning: invalid value encountered in divide
  updated_mean = (last_sum + new_sum) / updated_sample_count
/bsuscratch/alexanderemert/miniforge3/envs/starform-alex/lib/python3.14/site-packages/sklearn/utils/extmath.py:1212: RuntimeWarning: invalid value encountered in divide
  T = new_sum / new_sample_count
/bsuscratch/alexanderemert/miniforge3/envs/starform-alex/lib/python3.14/site-packages/sklearn/utils/extmath.py:1236: RuntimeWarning: invalid value encountered in divide
  new_unnormalized_variance -= correction**2 / new_sample_count
/bsuscratch/alexanderemert/miniforge3/envs/starform-alex/lib/python3.14/site-packages/sklearn/utils/extmath.py:1207: RuntimeWarning: invalid value encountered in divide
  updated_mean = (last_sum + new_sum) / update