[I 2026-07-21 09:39:43,471] Trial 96 finished with value: -0.18555673686181717 and parameters: {'error_threshold': 0.85, 'scalers': 'none', 'ratios': 'log_ratio', 'imputers': 'median', 'n_estimators': 2750, 'learning_rate': 0.04353684616910283, 'max_depth': 3, 'min_child_weight': 3, 'subsample': 0.8, 'colsample_bytree': 1.0, 'colsample_bylevel': 1.0, 'reg_alpha': 0.05737106491278824, 'reg_lambda': 3.4428495979459576e-06, 'gamma': 0.003174707124876977}. Best is trial 80 with value: -0.18058446388775626.
/bsuhome/alexanderemert/Research/Star-Formation-Research-Project-2026/pipeline/scripts/optuna/final_preds_and_models/optuna_search_mult_quant_reg.py:75: UserWarning: The distribution is specified by [0.1, 5] and step=0.25, but the range is not divisible by `step`. It will be replaced with [0.1, 4.85].
  error_threshold = trial.suggest_float("error_threshold", 0.1, 5, step=0.25)
[I 2026-07-21 09:39:57,709] Trial 97 finished with value: -0.18643146867357577 and parameters: {'error_threshold': 0.35, 'scalers': 'none', 'ratios': 'norm_ratio', 'imputers': 'median', 'n_estimators': 2750, 'learning_rate': 0.03876541645159053, 'max_depth': 3, 'min_child_weight': 3, 'subsample': 0.6, 'colsample_bytree': 1.0, 'colsample_bylevel': 0.9, 'reg_alpha': 0.001249552934670684, 'reg_lambda': 2.5956525563996943e-06, 'gamma': 0.002614660092190323}. Best is trial 80 with value: -0.18058446388775626.
/bsuhome/alexanderemert/Research/Star-Formation-Research-Project-2026/pipeline/scripts/optuna/final_preds_and_models/optuna_search_mult_quant_reg.py:75: UserWarning: The distribution is specified by [0.1, 5] and step=0.25, but the range is not divisible by `step`. It will be replaced with [0.1, 4.85].
  error_threshold = trial.suggest_float("error_threshold", 0.1, 5, step=0.25)
[I 2026-07-21 09:40:04,512] Trial 98 finished with value: -0.18728622629907166 and parameters: {'error_threshold': 0.85, 'scalers': 'none', 'ratios': 'norm_ratio', 'imputers': 'median', 'n_estimators': 2750, 'learning_rate': 0.0435408420429281, 'max_depth': 3, 'min_child_weight': 3, 'subsample': 0.6, 'colsample_bytree': 1.0, 'colsample_bylevel': 0.9, 'reg_alpha': 0.017311588794775037, 'reg_lambda': 3.0419015439714484e-06, 'gamma': 0.0009559696751095163}. Best is trial 80 with value: -0.18058446388775626.
/bsuhome/alexanderemert/Research/Star-Formation-Research-Project-2026/pipeline/scripts/optuna/final_preds_and_models/optuna_search_mult_quant_reg.py:75: UserWarning: The distribution is specified by [0.1, 5] and step=0.25, but the range is not divisible by `step`. It will be replaced with [0.1, 4.85].
  error_threshold = trial.suggest_float("error_threshold", 0.1, 5, step=0.25)
[I 2026-07-21 09:40:07,766] Trial 99 finished with value: -0.18543690394537846 and parameters: {'error_threshold': 1.6, 'scalers': 'none', 'ratios': 'norm_ratio', 'imputers': 'median', 'n_estimators': 2750, 'learning_rate': 0.039041885436211156, 'max_depth': 3, 'min_child_weight': 3, 'subsample': 0.7, 'colsample_bytree': 1.0, 'colsample_bylevel': 0.9, 'reg_alpha': 0.015562615418917309, 'reg_lambda': 0.398082771494949, 'gamma': 0.0029813471166839104}. Best is trial 80 with value: -0.18058446388775626.
/bsuhome/alexanderemert/Research/Star-Formation-Research-Project-2026/pipeline/scripts/optuna/final_preds_and_models/optuna_search_mult_quant_reg.py:75: UserWarning: The distribution is specified by [0.1, 5] and step=0.25, but the range is not divisible by `step`. It will be replaced with [0.1, 4.85].
  error_threshold = trial.suggest_float("error_threshold", 0.1, 5, step=0.25)
[I 2026-07-21 09:40:15,364] Trial 100 finished with value: -0.18710762460309427 and parameters: {'error_threshold': 1.6, 'scalers': 'none', 'ratios': 'norm_ratio', 'imputers': 'median', 'n_estimators': 2700, 'learning_rate': 0.04425111153468039, 'max_depth': 3, 'min_child_weight': 3, 'subsample': 0.6, 'colsample_bytree': 1.0, 'colsample_bylevel': 0.9, 'reg_alpha': 0.0014790602574165604, 'reg_lambda': 9.416925741555617e-05, 'gamma': 0.0009375609879009475}. Best is trial 80 with value: -0.18058446388775626.
/bsuhome/alexanderemert/Research/Star-Formation-Research-Project-2026/pipeline/scripts/optuna/final_preds_and_models/optuna_search_mult_quant_reg.py:75: UserWarning: The distribution is specified by [0.1, 5] and step=0.25, but the range is not divisible by `step`. It will be replaced with [0.1, 4.85].
  error_threshold = trial.suggest_float("error_threshold", 0.1, 5, step=0.25)
[I 2026-07-21 09:40:18,755] Trial 101 finished with value: -0.18602444951890695 and parameters: {'error_threshold': 0.85, 'scalers': 'none', 'ratios': 'norm_ratio', 'imputers': 'median', 'n_estimators': 2850, 'learning_rate': 0.04500825478005863, 'max_depth': 3, 'min_child_weight': 4, 'subsample': 0.6, 'colsample_bytree': 1.0, 'colsample_bylevel': 1.0, 'reg_alpha': 0.0012636269322652384, 'reg_lambda': 1.7149361577251954e-06, 'gamma': 0.0010838348162484194}. Best is trial 80 with value: -0.18058446388775626.
/bsuhome/alexanderemert/Research/Star-Formation-Research-Project-2026/pipeline/scripts/optuna/final_preds_and_models/optuna_search_mult_quant_reg.py:75: UserWarning: The distribution is specified by [0.1, 5] and step=0.25, but the range is not divisible by `step`. It will be replaced with [0.1, 4.85].
  error_threshold = trial.suggest_float("error_threshold", 0.1, 5, step=0.25)
[I 2026-07-21 09:41:05,618] Trial 102 finished with value: -0.18074240419011497 and parameters: {'error_threshold': 0.85, 'scalers': 'none', 'ratios': 'norm_ratio', 'imputers': 'median', 'n_estimators': 3000, 'learning_rate': 0.01401456418690745, 'max_depth': 3, 'min_child_weight': 4, 'subsample': 0.6, 'colsample_bytree': 1.0, 'colsample_bylevel': 1.0, 'reg_alpha': 0.016408445308842882, 'reg_lambda': 1.725000814374755e-06, 'gamma': 0.0007939589713053757}. Best is trial 80 with value: -0.18058446388775626.
/bsuhome/alexanderemert/Research/Star-Formation-Research-Project-2026/pipeline/scripts/optuna/final_preds_and_models/optuna_search_mult_quant_reg.py:75: UserWarning: The distribution is specified by [0.1, 5] and step=0.25, but the range is not divisible by `step`. It will be replaced with [0.1, 4.85].
  error_threshold = trial.suggest_float("error_threshold", 0.1, 5, step=0.25)
[I 2026-07-21 09:41:09,289] Trial 103 finished with value: -0.1807484141852472 and parameters: {'error_threshold': 0.85, 'scalers': 'none', 'ratios': 'norm_ratio', 'imputers': 'median', 'n_estimators': 3000, 'learning_rate': 0.01389973683698894, 'max_depth': 3, 'min_child_weight': 4, 'subsample': 0.6, 'colsample_bytree': 1.0, 'colsample_bylevel': 1.0, 'reg_alpha': 0.01648877849367672, 'reg_lambda': 1.6312112056795233e-06, 'gamma': 0.0014465638573560196}. Best is trial 80 with value: -0.18058446388775626.
/bsuhome/alexanderemert/Research/Star-Formation-Research-Project-2026/pipeline/scripts/optuna/final_preds_and_models/optuna_search_mult_quant_reg.py:75: UserWarning: The distribution is specified by [0.1, 5] and step=0.25, but the range is not divisible by `step`. It will be replaced with [0.1, 4.85].
  error_threshold = trial.suggest_float("error_threshold", 0.1, 5, step=0.25)
[I 2026-07-21 09:41:24,151] Trial 104 finished with value: -0.18252754251437017 and parameters: {'error_threshold': 0.85, 'scalers': 'none', 'ratios': 'norm_ratio', 'imputers': 'median', 'n_estimators': 2850, 'learning_rate': 0.012854350671607015, 'max_depth': 4, 'min_child_weight': 4, 'subsample': 0.6, 'colsample_bytree': 1.0, 'colsample_bylevel': 1.0, 'reg_alpha': 0.0012710274401088232, 'reg_lambda': 2.004471734792533e-06, 'gamma': 0.00048127940887077186}. Best is trial 80 with value: -0.18058446388775626.
/bsuhome/alexanderemert/Research/Star-Formation-Research-Project-2026/pipeline/scripts/optuna/final_preds_and_models/optuna_search_mult_quant_reg.py:75: UserWarning: The distribution is specified by [0.1, 5] and step=0.25, but the range is not divisible by `step`. It will be replaced with [0.1, 4.85].
  error_threshold = trial.suggest_float("error_threshold", 0.1, 5, step=0.25)
[I 2026-07-21 09:42:20,083] Trial 106 finished with value: -0.1827168804357724 and parameters: {'error_threshold': 0.85, 'scalers': 'standard', 'ratios': 'norm_ratio', 'imputers': 'median', 'n_estimators': 2500, 'learning_rate': 0.013957017883754953, 'max_depth': 4, 'min_child_weight': 4, 'subsample': 0.7, 'colsample_bytree': 1.0, 'colsample_bylevel': 1.0, 'reg_alpha': 0.022605897060103738, 'reg_lambda': 1.6901556527119869e-06, 'gamma': 0.0005274364592245578}. Best is trial 80 with value: -0.18058446388775626.
/bsuhome/alexanderemert/Research/Star-Formation-Research-Project-2026/pipeline/scripts/optuna/final_preds_and_models/optuna_search_mult_quant_reg.py:75: UserWarning: The distribution is specified by [0.1, 5] and step=0.25, but the range is not divisible by `step`. It will be replaced with [0.1, 4.85].
  error_threshold = trial.suggest_float("error_threshold", 0.1, 5, step=0.25)
[I 2026-07-21 09:42:24,636] Trial 107 finished with value: -0.1839222004278487 and parameters: {'error_threshold': 0.85, 'scalers': 'standard', 'ratios': 'norm_ratio', 'imputers': 'median', 'n_estimators': 2850, 'learning_rate': 0.014613722159596328, 'max_depth': 4, 'min_child_weight': 4, 'subsample': 0.7, 'colsample_bytree': 1.0, 'colsample_bylevel': 1.0, 'reg_alpha': 0.010105603569878576, 'reg_lambda': 1.4013431962937125e-06, 'gamma': 9.15606771014126e-05}. Best is trial 80 with value: -0.18058446388775626.
/bsuhome/alexanderemert/Research/Star-Formation-Research-Project-2026/pipeline/scripts/optuna/final_preds_and_models/optuna_search_mult_quant_reg.py:75: UserWarning: The distribution is specified by [0.1, 5] and step=0.25, but the range is not divisible by `step`. It will be replaced with [0.1, 4.85].
  error_threshold = trial.suggest_float("error_threshold", 0.1, 5, step=0.25)
[I 2026-07-21 09:42:32,840] Trial 108 finished with value: -0.1829580428251667 and parameters: {'error_threshold': 0.85, 'scalers': 'none', 'ratios': 'norm_ratio', 'imputers': 'median', 'n_estimators': 2500, 'learning_rate': 0.014124678869193408, 'max_depth': 4, 'min_child_weight': 4, 'subsample': 0.8, 'colsample_bytree': 1.0, 'colsample_bylevel': 1.0, 'reg_alpha': 0.009573491746129155, 'reg_lambda': 6.959198179216878e-06, 'gamma': 0.0004885169889931961}. Best is trial 80 with value: -0.18058446388775626.
/bsuhome/alexanderemert/Research/Star-Formation-Research-Project-2026/pipeline/scripts/optuna/final_preds_and_models/optuna_search_mult_quant_reg.py:75: UserWarning: The distribution is specified by [0.1, 5] and step=0.25, but the range is not divisible by `step`. It will be replaced with [0.1, 4.85].
  error_threshold = trial.suggest_float("error_threshold", 0.1, 5, step=0.25)
[I 2026-07-21 09:42:37,489] Trial 109 finished with value: -0.18355640567613243 and parameters: {'error_threshold': 0.6, 'scalers': 'none', 'ratios': 'norm_ratio', 'imputers': 'median', 'n_estimators': 3000, 'learning_rate': 0.014339213521493796, 'max_depth': 4, 'min_child_weight': 4, 'subsample': 0.8, 'colsample_bytree': 1.0, 'colsample_bylevel': 0.9, 'reg_alpha': 0.01015006699347956, 'reg_lambda': 7.498033966419198e-06, 'gamma': 0.0004120728789554012}. Best is trial 80 with value: -0.18058446388775626.
/bsuhome/alexanderemert/Research/Star-Formation-Research-Project-2026/pipeline/scripts/optuna/final_preds_and_models/optuna_search_mult_quant_reg.py:75: UserWarning: The distribution is specified by [0.1, 5] and step=0.25, but the range is not divisible by `step`. It will be replaced with [0.1, 4.85].
  error_threshold = trial.suggest_float("error_threshold", 0.1, 5, step=0.25)
[I 2026-07-21 09:43:07,404] Trial 105 finished with value: -0.20474341166053356 and parameters: {'error_threshold': 0.85, 'scalers': 'none', 'ratios': 'norm_ratio', 'imputers': 'median', 'n_estimators': 2850, 'learning_rate': 0.01273392435029035, 'max_depth': 10, 'min_child_weight': 4, 'subsample': 0.6, 'colsample_bytree': 1.0, 'colsample_bylevel': 1.0, 'reg_alpha': 0.015640574955713776, 'reg_lambda': 6.832386643448944e-06, 'gamma': 0.0004917590325466983}. Best is trial 80 with value: -0.18058446388775626.
/bsuhome/alexanderemert/Research/Star-Formation-Research-Project-2026/pipeline/scripts/optuna/final_preds_and_models/optuna_search_mult_quant_reg.py:75: UserWarning: The distribution is specified by [0.1, 5] and step=0.25, but the range is not divisible by `step`. It will be replaced with [0.1, 4.85].
  error_threshold = trial.suggest_float("error_threshold", 0.1, 5, step=0.25)
[I 2026-07-21 09:43:37,463] Trial 110 finished with value: -0.18400932631592815 and parameters: {'error_threshold': 0.6, 'scalers': 'standard', 'ratios': 'norm_ratio', 'imputers': 'median', 'n_estimators': 3000, 'learning_rate': 0.014911939059714037, 'max_depth': 4, 'min_child_weight': 4, 'subsample': 0.7, 'colsample_bytree': 1.0, 'colsample_bylevel': 1.0, 'reg_alpha': 0.009712492935150927, 'reg_lambda': 8.211546707875024e-06, 'gamma': 0.0004842619657290384}. Best is trial 80 with value: -0.18058446388775626.
/bsuhome/alexanderemert/Research/Star-Formation-Research-Project-2026/pipeline/scripts/optuna/final_preds_and_models/optuna_search_mult_quant_reg.py:75: UserWarning: The distribution is specified by [0.1, 5] and step=0.25, but the range is not divisible by `step`. It will be replaced with [0.1, 4.85].
  error_threshold = trial.suggest_float("error_threshold", 0.1, 5, step=0.25)
[I 2026-07-21 09:43:57,448] Trial 111 finished with value: -0.18356086230382365 and parameters: {'error_threshold': 0.85, 'scalers': 'standard', 'ratios': 'norm_ratio', 'imputers': 'median', 'n_estimators': 3000, 'learning_rate': 0.014322611918736922, 'max_depth': 4, 'min_child_weight': 4, 'subsample': 0.6, 'colsample_bytree': 1.0, 'colsample_bylevel': 1.0, 'reg_alpha': 0.025460881420110985, 'reg_lambda': 7.773031833264813e-06, 'gamma': 0.0014403395712150554}. Best is trial 80 with value: -0.18058446388775626.
/bsuhome/alexanderemert/Research/Star-Formation-Research-Project-2026/pipeline/scripts/optuna/final_preds_and_models/optuna_search_mult_quant_reg.py:75: UserWarning: The distribution is specified by [0.1, 5] and step=0.25, but the range is not divisible by `step`. It will be replaced with [0.1, 4.85].
  error_threshold = trial.suggest_float("error_threshold", 0.1, 5, step=0.25)
[I 2026-07-21 09:44:12,054] Trial 112 finished with value: -0.18342709116476777 and parameters: {'error_threshold': 1.1, 'scalers': 'standard', 'ratios': 'norm_ratio', 'imputers': 'median', 'n_estimators': 2950, 'learning_rate': 0.014062470731816941, 'max_depth': 4, 'min_child_weight': 4, 'subsample': 0.5, 'colsample_bytree': 1.0, 'colsample_bylevel': 1.0, 'reg_alpha': 0.010534367363869824, 'reg_lambda': 1.01282242485299e-06, 'gamma': 0.00017850694382371766}. Best is trial 80 with value: -0.18058446388775626.
/bsuhome/alexanderemert/Research/Star-Formation-Research-Project-2026/pipeline/scripts/optuna/final_preds_and_models/optuna_search_mult_quant_reg.py:75: UserWarning: The distribution is specified by [0.1, 5] and step=0.25, but the range is not divisible by `step`. It will be replaced with [0.1, 4.85].
  error_threshold = trial.suggest_float("error_threshold", 0.1, 5, step=0.25)
[I 2026-07-21 09:44:27,311] Trial 113 finished with value: -0.19110808659684497 and parameters: {'error_threshold': 1.1, 'scalers': 'none', 'ratios': 'norm_ratio', 'imputers': 'median', 'n_estimators': 2900, 'learning_rate': 0.024956442421805836, 'max_depth': 4, 'min_child_weight': 2, 'subsample': 0.5, 'colsample_bytree': 1.0, 'colsample_bylevel': 1.0, 'reg_alpha': 0.5170419099153364, 'reg_lambda': 1.0672824596137803e-06, 'gamma': 0.00017119143587217923}. Best is trial 80 with value: -0.18058446388775626.
/bsuhome/alexanderemert/Research/Star-Formation-Research-Project-2026/pipeline/scripts/optuna/final_preds_and_models/optuna_search_mult_quant_reg.py:75: UserWarning: The distribution is specified by [0.1, 5] and step=0.25, but the range is not divisible by `step`. It will be replaced with [0.1, 4.85].
  error_threshold = trial.suggest_float("error_threshold", 0.1, 5, step=0.25)
[I 2026-07-21 09:44:38,562] Trial 116 finished with value: -0.18054786063136866 and parameters: {'error_threshold': 1.35, 'scalers': 'none', 'ratios': 'norm_ratio', 'imputers': 'mean', 'n_estimators': 2950, 'learning_rate': 0.007543904952285907, 'max_depth': 3, 'min_child_weight': 2, 'subsample': 0.5, 'colsample_bytree': 1.0, 'colsample_bylevel': 1.0, 'reg_alpha': 0.07982570915330714, 'reg_lambda': 3.9296002040191554e-05, 'gamma': 0.0013095479259949401}. Best is trial 116 with value: -0.18054786063136866.
/bsuhome/alexanderemert/Research/Star-Formation-Research-Project-2026/pipeline/scripts/optuna/final_preds_and_models/optuna_search_mult_quant_reg.py:75: UserWarning: The distribution is specified by [0.1, 5] and step=0.25, but the range is not divisible by `step`. It will be replaced with [0.1, 4.85].
  error_threshold = trial.suggest_float("error_threshold", 0.1, 5, step=0.25)
[I 2026-07-21 09:45:43,119] Trial 117 finished with value: -0.18335004523456191 and parameters: {'error_threshold': 1.35, 'scalers': 'none', 'ratios': 'norm_ratio', 'imputers': 'mean', 'n_estimators': 2950, 'learning_rate': 0.007039977586212249, 'max_depth': 3, 'min_child_weight': 2, 'subsample': 0.5, 'colsample_bytree': 1.0, 'colsample_bylevel': 1.0, 'reg_alpha': 0.4637487933918252, 'reg_lambda': 81.4278116771975, 'gamma': 0.001472231871219669}. Best is trial 116 with value: -0.18054786063136866.
/bsuhome/alexanderemert/Research/Star-Formation-Research-Project-2026/pipeline/scripts/optuna/final_preds_and_models/optuna_search_mult_quant_reg.py:75: UserWarning: The distribution is specified by [0.1, 5] and step=0.25, but the range is not divisible by `step`. It will be replaced with [0.1, 4.85].
  error_threshold = trial.suggest_float("error_threshold", 0.1, 5, step=0.25)
[I 2026-07-21 09:46:42,247] Trial 118 finished with value: -0.18120924706880745 and parameters: {'error_threshold': 1.1, 'scalers': 'none', 'ratios': 'norm_ratio', 'imputers': 'median', 'n_estimators': 2950, 'learning_rate': 0.00771352383746153, 'max_depth': 3, 'min_child_weight': 2, 'subsample': 0.5, 'colsample_bytree': 1.0, 'colsample_bylevel': 0.9, 'reg_alpha': 0.48525067063677674, 'reg_lambda': 1.008772126319505e-06, 'gamma': 0.00543177872681408}. Best is trial 116 with value: -0.18054786063136866.
/bsuhome/alexanderemert/Research/Star-Formation-Research-Project-2026/pipeline/scripts/optuna/final_preds_and_models/optuna_search_mult_quant_reg.py:75: UserWarning: The distribution is specified by [0.1, 5] and step=0.25, but the range is not divisible by `step`. It will be replaced with [0.1, 4.85].
  error_threshold = trial.suggest_float("error_threshold", 0.1, 5, step=0.25)
[I 2026-07-21 09:46:45,644] Trial 119 finished with value: -0.1864127536397686 and parameters: {'error_threshold': 1.35, 'scalers': 'none', 'ratios': 'norm_ratio', 'imputers': 'mean', 'n_estimators': 2900, 'learning_rate': 0.025195293950975348, 'max_depth': 3, 'min_child_weight': 2, 'subsample': 0.5, 'colsample_bytree': 1.0, 'colsample_bylevel': 0.9, 'reg_alpha': 0.49347398161030104, 'reg_lambda': 2.0496826125503643e-05, 'gamma': 0.005975113293187151}. Best is trial 116 with value: -0.18054786063136866.
/bsuhome/alexanderemert/Research/Star-Formation-Research-Project-2026/pipeline/scripts/optuna/final_preds_and_models/optuna_search_mult_quant_reg.py:75: UserWarning: The distribution is specified by [0.1, 5] and step=0.25, but the range is not divisible by `step`. It will be replaced with [0.1, 4.85].
  error_threshold = trial.suggest_float("error_threshold", 0.1, 5, step=0.25)
[I 2026-07-21 09:46:55,387] Trial 120 finished with value: -0.1853989758049341 and parameters: {'error_threshold': 1.35, 'scalers': 'none', 'ratios': 'norm_ratio', 'imputers': 'mean', 'n_estimators': 2600, 'learning_rate': 0.028267770073846187, 'max_depth': 3, 'min_child_weight': 2, 'subsample': 0.7, 'colsample_bytree': 1.0, 'colsample_bylevel': 0.9, 'reg_alpha': 0.5341080130957948, 'reg_lambda': 2.1325564502775243e-05, 'gamma': 0.001460990078195148}. Best is trial 116 with value: -0.18054786063136866.
/bsuhome/alexanderemert/Research/Star-Formation-Research-Project-2026/pipeline/scripts/optuna/final_preds_and_models/optuna_search_mult_quant_reg.py:75: UserWarning: The distribution is specified by [0.1, 5] and step=0.25, but the range is not divisible by `step`. It will be replaced with [0.1, 4.85].
  error_threshold = trial.suggest_float("error_threshold", 0.1, 5, step=0.25)
[I 2026-07-21 09:47:16,393] Trial 114 finished with value: -0.20441494252815615 and parameters: {'error_threshold': 1.1, 'scalers': 'none', 'ratios': 'norm_ratio', 'imputers': 'median', 'n_estimators': 2900, 'learning_rate': 0.007429723522211138, 'max_depth': 11, 'min_child_weight': 2, 'subsample': 0.6, 'colsample_bytree': 1.0, 'colsample_bylevel': 1.0, 'reg_alpha': 0.0767552633978708, 'reg_lambda': 3.256930480183117e-05, 'gamma': 0.04490521504083554}. Best is trial 116 with value: -0.18054786063136866.
/bsuhome/alexanderemert/Research/Star-Formation-Research-Project-2026/pipeline/scripts/optuna/final_preds_and_models/optuna_search_mult_quant_reg.py:75: UserWarning: The distribution is specified by [0.1, 5] and step=0.25, but the range is not divisible by `step`. It will be replaced with [0.1, 4.85].
  error_threshold = trial.suggest_float("error_threshold", 0.1, 5, step=0.25)
