[I 2026-07-20 13:41:52,826] Trial 535 finished with value: -0.1372694992193248 and parameters: {'error_threshold': 2.25, 'scalers': 'none', 'ratios': 'norm_ratio', 'imputers': 'mean', 'n_estimators': 250, 'learning_rate': 0.00011838723010657133, 'max_depth': 6, 'min_child_weight': 2, 'subsample': 0.9, 'colsample_bytree': 0.5, 'colsample_bylevel': 0.5, 'reg_alpha': 93.05608065012967, 'reg_lambda': 0.3054325011480634, 'gamma': 18.539554793634455}. Best is trial 472 with value: -0.13764739925059793.
[I 2026-07-20 13:41:54,513] Trial 536 finished with value: -0.13721372481118374 and parameters: {'error_threshold': 2.25, 'scalers': 'none', 'ratios': 'norm_ratio', 'imputers': 'mean', 'n_estimators': 250, 'learning_rate': 0.00012673637380112304, 'max_depth': 6, 'min_child_weight': 2, 'subsample': 0.9, 'colsample_bytree': 0.5, 'colsample_bylevel': 0.5, 'reg_alpha': 96.67307313206854, 'reg_lambda': 0.01724778648124952, 'gamma': 0.03343282600546983}. Best is trial 472 with value: -0.13764739925059793.
[I 2026-07-20 13:41:54,954] Trial 538 finished with value: -0.13726334825260422 and parameters: {'error_threshold': 2.25, 'scalers': 'none', 'ratios': 'norm_ratio', 'imputers': 'mean', 'n_estimators': 250, 'learning_rate': 0.00012032683538809796, 'max_depth': 6, 'min_child_weight': 2, 'subsample': 0.9, 'colsample_bytree': 0.5, 'colsample_bylevel': 0.5, 'reg_alpha': 91.70253319754562, 'reg_lambda': 0.5242065940319891, 'gamma': 50.58549086840638}. Best is trial 472 with value: -0.13764739925059793.
[I 2026-07-20 13:41:55,111] Trial 539 finished with value: -0.13732504672427645 and parameters: {'error_threshold': 2.0, 'scalers': 'none', 'ratios': 'norm_ratio', 'imputers': 'mean', 'n_estimators': 200, 'learning_rate': 0.00012162959557027225, 'max_depth': 6, 'min_child_weight': 2, 'subsample': 0.9, 'colsample_bytree': 0.5, 'colsample_bylevel': 0.5, 'reg_alpha': 98.55692024234988, 'reg_lambda': 0.4588665616116407, 'gamma': 53.54189516626381}. Best is trial 472 with value: -0.13764739925059793.
[I 2026-07-20 13:41:55,558] Trial 540 finished with value: -0.13731753509580716 and parameters: {'error_threshold': 2.0, 'scalers': 'none', 'ratios': 'norm_ratio', 'imputers': 'mean', 'n_estimators': 200, 'learning_rate': 0.00012447539248631854, 'max_depth': 6, 'min_child_weight': 2, 'subsample': 0.9, 'colsample_bytree': 0.5, 'colsample_bylevel': 0.5, 'reg_alpha': 95.72284996703065, 'reg_lambda': 0.5097407982621096, 'gamma': 52.330384384616195}. Best is trial 472 with value: -0.13764739925059793.
[I 2026-07-20 13:41:56,796] Trial 541 finished with value: -0.1373273020234829 and parameters: {'error_threshold': 2.0, 'scalers': 'none', 'ratios': 'norm_ratio', 'imputers': 'mean', 'n_estimators': 200, 'learning_rate': 0.00012077954016722066, 'max_depth': 9, 'min_child_weight': 2, 'subsample': 0.9, 'colsample_bytree': 0.5, 'colsample_bylevel': 0.5, 'reg_alpha': 98.40101297645825, 'reg_lambda': 0.500845928780095, 'gamma': 52.28775360178707}. Best is trial 472 with value: -0.13764739925059793.
[I 2026-07-20 13:41:57,049] Trial 542 finished with value: -0.13732362749999003 and parameters: {'error_threshold': 2.0, 'scalers': 'none', 'ratios': 'norm_ratio', 'imputers': 'mean', 'n_estimators': 200, 'learning_rate': 0.00012216856733922698, 'max_depth': 9, 'min_child_weight': 2, 'subsample': 0.9, 'colsample_bytree': 0.5, 'colsample_bylevel': 0.5, 'reg_alpha': 94.89885530073876, 'reg_lambda': 0.03038145187804631, 'gamma': 54.400003480076165}. Best is trial 472 with value: -0.13764739925059793.
[I 2026-07-20 13:41:58,943] Trial 543 finished with value: -0.13732235541281554 and parameters: {'error_threshold': 2.0, 'scalers': 'none', 'ratios': 'norm_ratio', 'imputers': 'mean', 'n_estimators': 200, 'learning_rate': 0.0001226500744543176, 'max_depth': 9, 'min_child_weight': 2, 'subsample': 0.9, 'colsample_bytree': 0.5, 'colsample_bylevel': 0.5, 'reg_alpha': 99.72685456049486, 'reg_lambda': 0.5025829664311433, 'gamma': 53.7968718641643}. Best is trial 472 with value: -0.13764739925059793.
[I 2026-07-20 13:41:59,207] Trial 544 finished with value: -0.13732948076212428 and parameters: {'error_threshold': 2.0, 'scalers': 'none', 'ratios': 'norm_ratio', 'imputers': 'mean', 'n_estimators': 200, 'learning_rate': 0.00011995188782530036, 'max_depth': 9, 'min_child_weight': 2, 'subsample': 0.9, 'colsample_bytree': 0.5, 'colsample_bylevel': 0.5, 'reg_alpha': 99.92668528640723, 'reg_lambda': 0.5072846479020825, 'gamma': 52.43102934869207}. Best is trial 472 with value: -0.13764739925059793.
[I 2026-07-20 13:41:59,309] Trial 545 finished with value: -0.1374191699595992 and parameters: {'error_threshold': 2.75, 'scalers': 'none', 'ratios': 'norm_ratio', 'imputers': 'mean', 'n_estimators': 150, 'learning_rate': 0.00012203737152109291, 'max_depth': 9, 'min_child_weight': 2, 'subsample': 0.9, 'colsample_bytree': 0.5, 'colsample_bylevel': 0.5, 'reg_alpha': 66.28868108481537, 'reg_lambda': 0.565396767804684, 'gamma': 28.818059569161754}. Best is trial 472 with value: -0.13764739925059793.
[I 2026-07-20 13:41:59,426] Trial 546 finished with value: -0.13742272865256222 and parameters: {'error_threshold': 2.0, 'scalers': 'none', 'ratios': 'norm_ratio', 'imputers': 'mean', 'n_estimators': 150, 'learning_rate': 0.00012012981494567172, 'max_depth': 9, 'min_child_weight': 2, 'subsample': 0.9, 'colsample_bytree': 0.5, 'colsample_bylevel': 0.5, 'reg_alpha': 58.9710430084101, 'reg_lambda': 0.03548771576642672, 'gamma': 71.1965040137589}. Best is trial 472 with value: -0.13764739925059793.
[I 2026-07-20 13:42:02,260] Trial 547 finished with value: -0.1374171446282819 and parameters: {'error_threshold': 2.0, 'scalers': 'none', 'ratios': 'norm_ratio', 'imputers': 'mean', 'n_estimators': 150, 'learning_rate': 0.00012312094673358628, 'max_depth': 7, 'min_child_weight': 2, 'subsample': 0.9, 'colsample_bytree': 0.5, 'colsample_bylevel': 0.5, 'reg_alpha': 65.05944652602597, 'reg_lambda': 0.03215568996347444, 'gamma': 70.58574205941564}. Best is trial 472 with value: -0.13764739925059793.
[I 2026-07-20 13:42:04,078] Trial 537 finished with value: -0.13346619449832775 and parameters: {'error_threshold': 2.25, 'scalers': 'none', 'ratios': 'norm_ratio', 'imputers': 'mean', 'n_estimators': 2500, 'learning_rate': 0.00012006060765995993, 'max_depth': 6, 'min_child_weight': 2, 'subsample': 0.9, 'colsample_bytree': 0.5, 'colsample_bylevel': 0.5, 'reg_alpha': 91.01242432590601, 'reg_lambda': 0.4837966908111068, 'gamma': 26.739900533974396}. Best is trial 472 with value: -0.13764739925059793.
[I 2026-07-20 13:42:09,270] Trial 550 finished with value: -0.1373569095954437 and parameters: {'error_threshold': 2.0, 'scalers': 'none', 'ratios': 'norm_ratio', 'imputers': 'mean', 'n_estimators': 150, 'learning_rate': 0.00015549168088751359, 'max_depth': 7, 'min_child_weight': 2, 'subsample': 1.0, 'colsample_bytree': 0.5, 'colsample_bylevel': 0.5, 'reg_alpha': 60.016585657675336, 'reg_lambda': 0.17827221960593775, 'gamma': 28.7013479709367}. Best is trial 472 with value: -0.13764739925059793.
[I 2026-07-20 13:42:11,179] Trial 552 finished with value: -0.13735364518467583 and parameters: {'error_threshold': 2.0, 'scalers': 'none', 'ratios': 'norm_ratio', 'imputers': 'mean', 'n_estimators': 150, 'learning_rate': 0.0001572449034098281, 'max_depth': 7, 'min_child_weight': 2, 'subsample': 1.0, 'colsample_bytree': 0.5, 'colsample_bylevel': 0.5, 'reg_alpha': 61.562747566138945, 'reg_lambda': 0.16948476653517056, 'gamma': 99.14037396443501}. Best is trial 472 with value: -0.13764739925059793.
[I 2026-07-20 13:42:11,293] Trial 553 finished with value: -0.13746009570707285 and parameters: {'error_threshold': 2.0, 'scalers': 'none', 'ratios': 'norm_ratio', 'imputers': 'mean', 'n_estimators': 150, 'learning_rate': 0.00010011425813866848, 'max_depth': 9, 'min_child_weight': 2, 'subsample': 1.0, 'colsample_bytree': 0.5, 'colsample_bylevel': 0.5, 'reg_alpha': 64.18155472833593, 'reg_lambda': 0.03867521762527167, 'gamma': 72.30397338751865}. Best is trial 472 with value: -0.13764739925059793.
[I 2026-07-20 13:42:12,589] Trial 548 finished with value: -0.13320051750101214 and parameters: {'error_threshold': 2.0, 'scalers': 'none', 'ratios': 'norm_ratio', 'imputers': 'mean', 'n_estimators': 2200, 'learning_rate': 0.0001479635871631069, 'max_depth': 9, 'min_child_weight': 2, 'subsample': 1.0, 'colsample_bytree': 0.5, 'colsample_bylevel': 0.5, 'reg_alpha': 66.8623668651768, 'reg_lambda': 0.1997891576376748, 'gamma': 31.0546565112205}. Best is trial 472 with value: -0.13764739925059793.
[I 2026-07-20 13:42:12,878] Trial 554 finished with value: -0.13736002439695838 and parameters: {'error_threshold': 2.0, 'scalers': 'none', 'ratios': 'norm_ratio', 'imputers': 'mean', 'n_estimators': 150, 'learning_rate': 0.00015381896439556656, 'max_depth': 9, 'min_child_weight': 2, 'subsample': 1.0, 'colsample_bytree': 0.5, 'colsample_bylevel': 0.5, 'reg_alpha': 58.32371165421182, 'reg_lambda': 0.19137489112041287, 'gamma': 99.23025794918989}. Best is trial 472 with value: -0.13764739925059793.
[I 2026-07-20 13:42:14,295] Trial 549 finished with value: -0.13301852013566517 and parameters: {'error_threshold': 2.0, 'scalers': 'none', 'ratios': 'norm_ratio', 'imputers': 'mean', 'n_estimators': 2200, 'learning_rate': 0.00015436084778109585, 'max_depth': 7, 'min_child_weight': 2, 'subsample': 1.0, 'colsample_bytree': 0.5, 'colsample_bylevel': 0.5, 'reg_alpha': 66.04971127219696, 'reg_lambda': 0.18900454922073778, 'gamma': 28.070672349574053}. Best is trial 472 with value: -0.13764739925059793.
[I 2026-07-20 13:42:16,164] Trial 551 finished with value: -0.1323894071788424 and parameters: {'error_threshold': 2.75, 'scalers': 'none', 'ratios': 'norm_ratio', 'imputers': 'mean', 'n_estimators': 2500, 'learning_rate': 0.00015329030326737282, 'max_depth': 7, 'min_child_weight': 2, 'subsample': 1.0, 'colsample_bytree': 0.5, 'colsample_bylevel': 0.5, 'reg_alpha': 59.43538488345804, 'reg_lambda': 0.19630521652691071, 'gamma': 32.781076693536605}. Best is trial 472 with value: -0.13764739925059793.
[I 2026-07-20 13:42:16,326] Trial 555 finished with value: -0.1373580179545694 and parameters: {'error_threshold': 2.0, 'scalers': 'none', 'ratios': 'norm_ratio', 'imputers': 'mean', 'n_estimators': 150, 'learning_rate': 0.00015489683892787735, 'max_depth': 7, 'min_child_weight': 8, 'subsample': 1.0, 'colsample_bytree': 0.5, 'colsample_bylevel': 0.5, 'reg_alpha': 62.11985282738259, 'reg_lambda': 0.19334451808074843, 'gamma': 98.1223493831138}. Best is trial 472 with value: -0.13764739925059793.
[I 2026-07-20 13:42:17,378] Trial 556 finished with value: -0.13648423684516967 and parameters: {'error_threshold': 2.0, 'scalers': 'none', 'ratios': 'norm_ratio', 'imputers': 'mean', 'n_estimators': 150, 'learning_rate': 0.0006295440949093546, 'max_depth': 9, 'min_child_weight': 8, 'subsample': 1.0, 'colsample_bytree': 0.5, 'colsample_bylevel': 0.5, 'reg_alpha': 29.18472122137404, 'reg_lambda': 0.19667287354578655, 'gamma': 74.99086930831092}. Best is trial 472 with value: -0.13764739925059793.
[I 2026-07-20 13:42:17,927] Trial 557 finished with value: -0.13737351816175505 and parameters: {'error_threshold': 2.0, 'scalers': 'none', 'ratios': 'norm_ratio', 'imputers': 'mean', 'n_estimators': 150, 'learning_rate': 0.00014657102147892543, 'max_depth': 9, 'min_child_weight': 8, 'subsample': 1.0, 'colsample_bytree': 0.5, 'colsample_bylevel': 0.5, 'reg_alpha': 28.285277563805273, 'reg_lambda': 0.17752887086198785, 'gamma': 69.61110447379593}. Best is trial 472 with value: -0.13764739925059793.
[I 2026-07-20 13:42:18,049] Trial 558 finished with value: -0.13745900020559845 and parameters: {'error_threshold': 2.75, 'scalers': 'none', 'ratios': 'norm_ratio', 'imputers': 'mean', 'n_estimators': 150, 'learning_rate': 0.00010070228532704712, 'max_depth': 9, 'min_child_weight': 2, 'subsample': 1.0, 'colsample_bytree': 0.5, 'colsample_bylevel': 0.5, 'reg_alpha': 36.275106997467276, 'reg_lambda': 0.03514942268664553, 'gamma': 74.54389284856852}. Best is trial 472 with value: -0.13764739925059793.
[I 2026-07-20 13:42:18,213] Trial 559 finished with value: -0.13745999385347665 and parameters: {'error_threshold': 2.25, 'scalers': 'none', 'ratios': 'norm_ratio', 'imputers': 'median', 'n_estimators': 150, 'learning_rate': 0.00010016879277133448, 'max_depth': 9, 'min_child_weight': 2, 'subsample': 1.0, 'colsample_bytree': 0.5, 'colsample_bylevel': 0.5, 'reg_alpha': 36.12373967663946, 'reg_lambda': 0.044993820660725097, 'gamma': 71.29902996171896}. Best is trial 472 with value: -0.13764739925059793.
[I 2026-07-20 13:42:18,552] Trial 560 finished with value: -0.1374592518377756 and parameters: {'error_threshold': 2.25, 'scalers': 'none', 'ratios': 'norm_ratio', 'imputers': 'median', 'n_estimators': 150, 'learning_rate': 0.00010056752973707541, 'max_depth': 9, 'min_child_weight': 2, 'subsample': 1.0, 'colsample_bytree': 0.5, 'colsample_bylevel': 0.5, 'reg_alpha': 36.502352228394194, 'reg_lambda': 0.11596755894162598, 'gamma': 69.78452747620817}. Best is trial 472 with value: -0.13764739925059793.
[I 2026-07-20 13:42:18,734] Trial 561 finished with value: -0.13745635815434812 and parameters: {'error_threshold': 2.25, 'scalers': 'none', 'ratios': 'norm_ratio', 'imputers': 'median', 'n_estimators': 150, 'learning_rate': 0.00010211817464021406, 'max_depth': 9, 'min_child_weight': 2, 'subsample': 1.0, 'colsample_bytree': 0.5, 'colsample_bylevel': 0.5, 'reg_alpha': 29.18542705653648, 'reg_lambda': 0.011200424627011207, 'gamma': 74.47876090939873}. Best is trial 472 with value: -0.13764739925059793.
[I 2026-07-20 13:42:19,096] Trial 562 finished with value: -0.13726529231190765 and parameters: {'error_threshold': 2.25, 'scalers': 'none', 'ratios': 'norm_ratio', 'imputers': 'mean', 'n_estimators': 300, 'learning_rate': 0.00010237288749787912, 'max_depth': 9, 'min_child_weight': 2, 'subsample': 1.0, 'colsample_bytree': 0.5, 'colsample_bylevel': 0.5, 'reg_alpha': 26.370229506607124, 'reg_lambda': 0.04133869927663826, 'gamma': 72.00292525727613}. Best is trial 472 with value: -0.13764739925059793.
[I 2026-07-20 13:42:20,659] Trial 563 finished with value: -0.13727371506620475 and parameters: {'error_threshold': 2.25, 'scalers': 'none', 'ratios': 'norm_ratio', 'imputers': 'median', 'n_estimators': 300, 'learning_rate': 0.00010010902917372031, 'max_depth': 9, 'min_child_weight': 2, 'subsample': 1.0, 'colsample_bytree': 0.5, 'colsample_bylevel': 0.5, 'reg_alpha': 32.72245559130407, 'reg_lambda': 0.023842132924711313, 'gamma': 67.51487710191292}. Best is trial 472 with value: -0.13764739925059793.
[I 2026-07-20 13:42:23,343] Trial 566 finished with value: -0.13726839926206594 and parameters: {'error_threshold': 2.75, 'scalers': 'none', 'ratios': 'norm_ratio', 'imputers': 'median', 'n_estimators': 300, 'learning_rate': 0.0001015387634779143, 'max_depth': 9, 'min_child_weight': 2, 'subsample': 1.0, 'colsample_bytree': 0.5, 'colsample_bylevel': 0.5, 'reg_alpha': 33.64367781740872, 'reg_lambda': 0.04250706027906913, 'gamma': 72.17563272247786}. Best is trial 472 with value: -0.13764739925059793.
[I 2026-07-20 13:42:24,870] Trial 567 finished with value: -0.1372648802288041 and parameters: {'error_threshold': 2.75, 'scalers': 'none', 'ratios': 'norm_ratio', 'imputers': 'median', 'n_estimators': 300, 'learning_rate': 0.00010248500454449394, 'max_depth': 9, 'min_child_weight': 2, 'subsample': 1.0, 'colsample_bytree': 0.5, 'colsample_bylevel': 0.5, 'reg_alpha': 36.39732668906607, 'reg_lambda': 0.024629847822231925, 'gamma': 73.05208957798153}. Best is trial 472 with value: -0.13764739925059793.
[I 2026-07-20 13:42:25,813] Trial 568 finished with value: -0.13726751170008308 and parameters: {'error_threshold': 2.5, 'scalers': 'none', 'ratios': 'norm_ratio', 'imputers': 'median', 'n_estimators': 300, 'learning_rate': 0.00010177641392477795, 'max_depth': 10, 'min_child_weight': 2, 'subsample': 1.0, 'colsample_bytree': 0.5, 'colsample_bylevel': 0.5, 'reg_alpha': 37.33328828522712, 'reg_lambda': 0.04921076315391159, 'gamma': 75.39839702028978}. Best is trial 472 with value: -0.13764739925059793.
[I 2026-07-20 13:42:27,235] Trial 569 finished with value: -0.1372693964717734 and parameters: {'error_threshold': 2.5, 'scalers': 'none', 'ratios': 'norm_ratio', 'imputers': 'median', 'n_estimators': 300, 'learning_rate': 0.00010126988966297096, 'max_depth': 9, 'min_child_weight': 2, 'subsample': 1.0, 'colsample_bytree': 0.5, 'colsample_bylevel': 0.5, 'reg_alpha': 15.812754524479963, 'reg_lambda': 0.014193462681931225, 'gamma': 73.5869118871656}. Best is trial 472 with value: -0.13764739925059793.
[I 2026-07-20 13:42:28,338] Trial 564 finished with value: -0.13536888403053435 and parameters: {'error_threshold': 2.25, 'scalers': 'none', 'ratios': 'norm_ratio', 'imputers': 'mean', 'n_estimators': 1600, 'learning_rate': 0.00010040457760816104, 'max_depth': 9, 'min_child_weight': 2, 'subsample': 1.0, 'colsample_bytree': 0.5, 'colsample_bylevel': 0.5, 'reg_alpha': 37.60226952013551, 'reg_lambda': 0.03605347301738267, 'gamma': 73.7476707566869}. Best is trial 472 with value: -0.13764739925059793.
[I 2026-07-20 13:42:28,637] Trial 570 finished with value: -0.13649525989669378 and parameters: {'error_threshold': 2.5, 'scalers': 'none', 'ratios': 'norm_ratio', 'imputers': 'median', 'n_estimators': 300, 'learning_rate': 0.00010241373962853257, 'max_depth': 10, 'min_child_weight': 2, 'subsample': 1.0, 'colsample_bytree': 0.5, 'colsample_bylevel': 0.5, 'reg_alpha': 36.30564665419349, 'reg_lambda': 0.012435726090224489, 'gamma': 0.0013666374916265036}. Best is trial 472 with value: -0.13764739925059793.
[I 2026-07-20 13:42:28,806] Trial 571 finished with value: -0.1373238564803312 and parameters: {'error_threshold': 2.75, 'scalers': 'none', 'ratios': 'norm_ratio', 'imputers': 'median', 'n_estimators': 250, 'learning_rate': 0.00010133956072421581, 'max_depth': 9, 'min_child_weight': 2, 'subsample': 1.0, 'colsample_bytree': 0.5, 'colsample_bylevel': 0.5, 'reg_alpha': 15.722042726825661, 'reg_lambda': 0.005078310607212183, 'gamma': 76.11735519253754}. Best is trial 472 with value: -0.13764739925059793.
[I 2026-07-20 13:42:30,375] Trial 565 finished with value: -0.13530886393289077 and parameters: {'error_threshold': 2.25, 'scalers': 'none', 'ratios': 'norm_ratio', 'imputers': 'mean', 'n_estimators': 1600, 'learning_rate': 0.0001031318658713198, 'max_depth': 9, 'min_child_weight': 2, 'subsample': 1.0, 'colsample_bytree': 0.5, 'colsample_bylevel': 0.5, 'reg_alpha': 38.160320067233776, 'reg_lambda': 0.030393193637932477, 'gamma': 72.59524506421997}. Best is trial 472 with value: -0.13764739925059793.
[I 2026-07-20 13:42:31,144] Trial 572 finished with value: -0.13737994291714486 and parameters: {'error_threshold': 2.5, 'scalers': 'none', 'ratios': 'norm_ratio', 'imputers': 'median', 'n_estimators': 200, 'learning_rate': 0.00010084184656737694, 'max_depth': 9, 'min_child_weight': 2, 'subsample': 1.0, 'colsample_bytree': 0.5, 'colsample_bylevel': 0.5, 'reg_alpha': 15.20029160521022, 'reg_lambda': 0.01260089333831447, 'gamma': 98.15798517267596}. Best is trial 472 with value: -0.13764739925059793.
[I 2026-07-20 13:42:31,439] Trial 573 finished with value: -0.13737815029886158 and parameters: {'error_threshold': 2.5, 'scalers': 'none', 'ratios': 'norm_ratio', 'imputers': 'median', 'n_estimators': 200, 'learning_rate': 0.00010151891032136454, 'max_depth': 9, 'min_child_weight': 2, 'subsample': 1.0, 'colsample_bytree': 0.5, 'colsample_bylevel': 0.5, 'reg_alpha': 14.16317515790319, 'reg_lambda': 0.012705998225636596, 'gamma': 75.38478557721977}. Best is trial 472 with value: -0.13764739925059793.
[I 2026-07-20 13:42:31,917] Trial 574 finished with value: -0.13737454991213652 and parameters: {'error_threshold': 2.5, 'scalers': 'none', 'ratios': 'norm_ratio', 'imputers': 'median', 'n_estimators': 200, 'learning_rate': 0.00010288011951299384, 'max_depth': 9, 'min_child_weight': 2, 'subsample': 1.0, 'colsample_bytree': 0.5, 'colsample_bylevel': 0.5, 'reg_alpha': 9.893541903142685, 'reg_lambda': 0.10848389781451809, 'gamma': 71.30041300759382}. Best is trial 472 with value: -0.13764739925059793.
[I 2026-07-20 13:42:32,701] Trial 575 finished with value: -0.13738197975230282 and parameters: {'error_threshold': 3.0, 'scalers': 'none', 'ratios': 'norm_ratio', 'imputers': 'median', 'n_estimators': 200, 'learning_rate': 0.0001000705020815481, 'max_depth': 9, 'min_child_weight': 2, 'subsample': 1.0, 'colsample_bytree': 0.5, 'colsample_bylevel': 0.5, 'reg_alpha': 20.19810952577453, 'reg_lambda': 0.003713199320587846, 'gamma': 78.22904494489713}. Best is trial 472 with value: -0.13764739925059793.
[I 2026-07-20 13:42:33,174] Trial 576 finished with value: -0.13737979334181474 and parameters: {'error_threshold': 2.5, 'scalers': 'none', 'ratios': 'norm_ratio', 'imputers': 'median', 'n_estimators': 200, 'learning_rate': 0.00010089660381734125, 'max_depth': 9, 'min_child_weight': 3, 'subsample': 1.0, 'colsample_bytree': 0.5, 'colsample_bylevel': 0.5, 'reg_alpha': 14.302716296156596, 'reg_lambda': 0.10813490803495793, 'gamma': 95.58538836506618}. Best is trial 472 with value: -0.13764739925059793.
[I 2026-07-20 13:42:33,492] Trial 577 finished with value: -0.13689629582680596 and parameters: {'error_threshold': 3.0, 'scalers': 'none', 'ratios': 'norm_ratio', 'imputers': 'median', 'n_estimators': 200, 'learning_rate': 0.00010064154799509509, 'max_depth': 9, 'min_child_weight': 2, 'subsample': 1.0, 'colsample_bytree': 0.5, 'colsample_bylevel': 0.5, 'reg_alpha': 21.279129509857608, 'reg_lambda': 0.10480165788388447, 'gamma': 0.12830143206563555}. Best is trial 472 with value: -0.13764739925059793.
