[I 2026-07-20 12:27:07,232] Trial 86 finished with value: -0.3681740579537385 and parameters: {'error_threshold': 3.5, 'scalers': 'robust', 'ratios': 'log_ratio', 'imputers': 'median', 'n_estimators': 1150, 'learning_rate': 0.0001398604334087196, 'max_depth': 4, 'min_child_weight': 9, 'subsample': 0.9, 'colsample_bytree': 0.6, 'colsample_bylevel': 0.9, 'reg_alpha': 23.663497950606413, 'reg_lambda': 3.0654911670375116, 'gamma': 7.400552175748926}. Best is trial 69 with value: -0.3911874830873789.
[I 2026-07-20 12:27:21,907] Trial 87 finished with value: -0.331712950028197 and parameters: {'error_threshold': 3.5, 'scalers': 'robust', 'ratios': 'log_ratio', 'imputers': 'median', 'n_estimators': 2600, 'learning_rate': 0.00014250143709069178, 'max_depth': 4, 'min_child_weight': 4, 'subsample': 0.9, 'colsample_bytree': 0.6, 'colsample_bylevel': 0.9, 'reg_alpha': 0.0498948303519647, 'reg_lambda': 1.74382407060735e-06, 'gamma': 8.023652668465248}. Best is trial 69 with value: -0.3911874830873789.
[I 2026-07-20 12:27:26,578] Trial 88 finished with value: -0.3612790372565095 and parameters: {'error_threshold': 3.5, 'scalers': 'robust', 'ratios': 'log_ratio', 'imputers': 'median', 'n_estimators': 1250, 'learning_rate': 0.00014500023716814832, 'max_depth': 4, 'min_child_weight': 9, 'subsample': 0.6, 'colsample_bytree': 0.6, 'colsample_bylevel': 0.9, 'reg_alpha': 0.30769506364874066, 'reg_lambda': 2.3091568297634815e-06, 'gamma': 7.926774406485696}. Best is trial 69 with value: -0.3911874830873789.
[I 2026-07-20 12:27:34,633] Trial 89 finished with value: -0.36592623076207714 and parameters: {'error_threshold': 3.5, 'scalers': 'robust', 'ratios': 'log_ratio', 'imputers': 'median', 'n_estimators': 1200, 'learning_rate': 0.00015015219308590278, 'max_depth': 7, 'min_child_weight': 4, 'subsample': 0.9, 'colsample_bytree': 0.6, 'colsample_bylevel': 0.9, 'reg_alpha': 24.686540926341788, 'reg_lambda': 0.5079002152048364, 'gamma': 7.494975819109426}. Best is trial 69 with value: -0.3911874830873789.
[I 2026-07-20 12:27:37,327] Trial 92 finished with value: -0.34859102532200464 and parameters: {'error_threshold': 3.5, 'scalers': 'robust', 'ratios': 'log_ratio', 'imputers': 'median', 'n_estimators': 2300, 'learning_rate': 0.00014390286069708642, 'max_depth': 7, 'min_child_weight': 4, 'subsample': 0.9, 'colsample_bytree': 0.6, 'colsample_bylevel': 0.9, 'reg_alpha': 0.14961869746488599, 'reg_lambda': 2.497573425572491e-05, 'gamma': 21.19315763464301}. Best is trial 69 with value: -0.3911874830873789.
[I 2026-07-20 12:28:00,787] Trial 93 finished with value: -0.3815629054255179 and parameters: {'error_threshold': 3.5, 'scalers': 'robust', 'ratios': 'log_ratio', 'imputers': 'median', 'n_estimators': 650, 'learning_rate': 0.00010046727894695954, 'max_depth': 7, 'min_child_weight': 8, 'subsample': 0.9, 'colsample_bytree': 0.6, 'colsample_bylevel': 0.9, 'reg_alpha': 0.1462173496290377, 'reg_lambda': 2.9588427887543245e-06, 'gamma': 23.116016793442686}. Best is trial 69 with value: -0.3911874830873789.
[I 2026-07-20 12:28:02,797] Trial 90 finished with value: -0.35510069269997774 and parameters: {'error_threshold': 3.5, 'scalers': 'robust', 'ratios': 'log_ratio', 'imputers': 'median', 'n_estimators': 1200, 'learning_rate': 0.00014338754326884744, 'max_depth': 7, 'min_child_weight': 4, 'subsample': 0.6, 'colsample_bytree': 0.6, 'colsample_bylevel': 0.9, 'reg_alpha': 0.22213854966989294, 'reg_lambda': 10.032269959807827, 'gamma': 0.0012604219659596023}. Best is trial 69 with value: -0.3911874830873789.
[I 2026-07-20 12:28:18,732] Trial 91 finished with value: -0.3207345363487322 and parameters: {'error_threshold': 3.5, 'scalers': 'robust', 'ratios': 'log_ratio', 'imputers': 'median', 'n_estimators': 2600, 'learning_rate': 0.0001370509806929135, 'max_depth': 7, 'min_child_weight': 8, 'subsample': 0.9, 'colsample_bytree': 0.6, 'colsample_bylevel': 0.9, 'reg_alpha': 0.159009397543461, 'reg_lambda': 0.4640251290171358, 'gamma': 7.523794595483391e-05}. Best is trial 69 with value: -0.3911874830873789.
[I 2026-07-20 12:28:22,364] Trial 94 finished with value: -0.3478939953869962 and parameters: {'error_threshold': 3.5, 'scalers': 'robust', 'ratios': 'log_ratio', 'imputers': 'median', 'n_estimators': 2300, 'learning_rate': 0.00010072883340495413, 'max_depth': 7, 'min_child_weight': 4, 'subsample': 0.5, 'colsample_bytree': 0.5, 'colsample_bylevel': 0.9, 'reg_alpha': 0.042344673911403986, 'reg_lambda': 3.0912687403720677e-06, 'gamma': 0.0001569857716245572}. Best is trial 69 with value: -0.3911874830873789.
[I 2026-07-20 12:28:22,872] Trial 95 finished with value: -0.3810083882675293 and parameters: {'error_threshold': 3.25, 'scalers': 'robust', 'ratios': 'log_ratio', 'imputers': 'median', 'n_estimators': 500, 'learning_rate': 0.00010278770639461746, 'max_depth': 7, 'min_child_weight': 8, 'subsample': 0.5, 'colsample_bytree': 0.5, 'colsample_bylevel': 0.8, 'reg_alpha': 8.522297129935493, 'reg_lambda': 10.08672560715952, 'gamma': 0.0006610914571299111}. Best is trial 69 with value: -0.3911874830873789.
[I 2026-07-20 12:28:30,057] Trial 96 finished with value: -0.281733376691124 and parameters: {'error_threshold': 3.25, 'scalers': 'robust', 'ratios': 'log_ratio', 'imputers': 'median', 'n_estimators': 2300, 'learning_rate': 0.00024648301425040937, 'max_depth': 7, 'min_child_weight': 8, 'subsample': 0.5, 'colsample_bytree': 0.9, 'colsample_bylevel': 0.8, 'reg_alpha': 0.17139239010683777, 'reg_lambda': 11.805482227343601, 'gamma': 1.0335655815786172e-06}. Best is trial 69 with value: -0.3911874830873789.
[I 2026-07-20 12:28:33,099] Trial 97 finished with value: -0.3291589937150164 and parameters: {'error_threshold': 3.25, 'scalers': 'robust', 'ratios': 'log_ratio', 'imputers': 'median', 'n_estimators': 2300, 'learning_rate': 0.00029051270298268697, 'max_depth': 7, 'min_child_weight': 8, 'subsample': 0.5, 'colsample_bytree': 0.5, 'colsample_bylevel': 0.8, 'reg_alpha': 0.1765271695518779, 'reg_lambda': 12.630872777459958, 'gamma': 18.306149859206073}. Best is trial 69 with value: -0.3911874830873789.
[I 2026-07-20 12:28:34,088] Trial 98 finished with value: -0.33576228424674226 and parameters: {'error_threshold': 1.5, 'scalers': 'standard', 'ratios': 'norm_ratio', 'imputers': 'mean', 'n_estimators': 2300, 'learning_rate': 0.00024412517469609915, 'max_depth': 7, 'min_child_weight': 8, 'subsample': 0.5, 'colsample_bytree': 0.5, 'colsample_bylevel': 1.0, 'reg_alpha': 1.606631905566912, 'reg_lambda': 0.00011364146519654024, 'gamma': 18.9090208803521}. Best is trial 69 with value: -0.3911874830873789.
[I 2026-07-20 12:28:34,661] Trial 99 finished with value: -0.3755138464655167 and parameters: {'error_threshold': 3.25, 'scalers': 'robust', 'ratios': 'log_ratio', 'imputers': 'median', 'n_estimators': 550, 'learning_rate': 0.00025844472248678983, 'max_depth': 7, 'min_child_weight': 8, 'subsample': 0.5, 'colsample_bytree': 0.5, 'colsample_bylevel': 0.8, 'reg_alpha': 1.7418567148368114, 'reg_lambda': 3.15137793955495e-06, 'gamma': 21.956306515421904}. Best is trial 69 with value: -0.3911874830873789.
[I 2026-07-20 12:28:34,941] Trial 100 finished with value: -0.3758377505257697 and parameters: {'error_threshold': 3.25, 'scalers': 'robust', 'ratios': 'log_ratio', 'imputers': 'median', 'n_estimators': 550, 'learning_rate': 0.00024591696265381565, 'max_depth': 7, 'min_child_weight': 8, 'subsample': 0.5, 'colsample_bytree': 0.7, 'colsample_bylevel': 0.8, 'reg_alpha': 1.5876572561158637, 'reg_lambda': 4.026611942398013e-06, 'gamma': 39.39497930818517}. Best is trial 69 with value: -0.3911874830873789.
[I 2026-07-20 12:28:39,504] Trial 101 finished with value: -0.38009363747148833 and parameters: {'error_threshold': 3.25, 'scalers': 'robust', 'ratios': 'log_ratio', 'imputers': 'median', 'n_estimators': 800, 'learning_rate': 0.00010019716780065014, 'max_depth': 7, 'min_child_weight': 6, 'subsample': 0.5, 'colsample_bytree': 0.7, 'colsample_bylevel': 0.8, 'reg_alpha': 7.428972167109379, 'reg_lambda': 3.10141632984865e-06, 'gamma': 16.68211199756021}. Best is trial 69 with value: -0.3911874830873789.
[I 2026-07-20 12:28:39,763] Trial 102 finished with value: -0.3726657754782872 and parameters: {'error_threshold': 2.5, 'scalers': 'robust', 'ratios': 'log_ratio', 'imputers': 'median', 'n_estimators': 550, 'learning_rate': 0.00025712629326369517, 'max_depth': 9, 'min_child_weight': 8, 'subsample': 0.5, 'colsample_bytree': 0.7, 'colsample_bylevel': 0.8, 'reg_alpha': 8.232866357792343, 'reg_lambda': 1.0684943531989375e-06, 'gamma': 19.75073923880347}. Best is trial 69 with value: -0.3911874830873789.
[I 2026-07-20 12:28:40,058] Trial 103 finished with value: -0.3719712234069323 and parameters: {'error_threshold': 3.25, 'scalers': 'standard', 'ratios': 'log_ratio', 'imputers': 'median', 'n_estimators': 550, 'learning_rate': 0.0002594767487765488, 'max_depth': 9, 'min_child_weight': 8, 'subsample': 0.5, 'colsample_bytree': 0.7, 'colsample_bylevel': 1.0, 'reg_alpha': 1.0205820068144533, 'reg_lambda': 1.0370857710116992e-06, 'gamma': 23.301938250207524}. Best is trial 69 with value: -0.3911874830873789.
[I 2026-07-20 12:28:41,525] Trial 104 finished with value: -0.37125002977843646 and parameters: {'error_threshold': 1.5, 'scalers': 'standard', 'ratios': 'log_ratio', 'imputers': 'median', 'n_estimators': 550, 'learning_rate': 0.00026944483568988, 'max_depth': 5, 'min_child_weight': 6, 'subsample': 0.5, 'colsample_bytree': 0.7, 'colsample_bylevel': 1.0, 'reg_alpha': 12.450849782236837, 'reg_lambda': 0.2469982882243055, 'gamma': 19.705622876184307}. Best is trial 69 with value: -0.3911874830873789.
[I 2026-07-20 12:28:45,248] Trial 105 finished with value: -0.3711122480235358 and parameters: {'error_threshold': 2.5, 'scalers': 'standard', 'ratios': 'log_ratio', 'imputers': 'median', 'n_estimators': 650, 'learning_rate': 0.00023055056015470674, 'max_depth': 5, 'min_child_weight': 6, 'subsample': 0.5, 'colsample_bytree': 0.7, 'colsample_bylevel': 1.0, 'reg_alpha': 2.106861487320753, 'reg_lambda': 43.996358588677005, 'gamma': 19.90805503664657}. Best is trial 69 with value: -0.3911874830873789.
[I 2026-07-20 12:28:45,547] Trial 106 finished with value: -0.3845626999661301 and parameters: {'error_threshold': 2.5, 'scalers': 'standard', 'ratios': 'log_ratio', 'imputers': 'median', 'n_estimators': 550, 'learning_rate': 0.0001722732533080814, 'max_depth': 5, 'min_child_weight': 7, 'subsample': 0.5, 'colsample_bytree': 0.7, 'colsample_bylevel': 1.0, 'reg_alpha': 0.7425319802589675, 'reg_lambda': 0.223595370147153, 'gamma': 69.4382917384824}. Best is trial 69 with value: -0.3911874830873789.
[I 2026-07-20 12:28:45,879] Trial 107 finished with value: -0.3836577968468155 and parameters: {'error_threshold': 1.5, 'scalers': 'standard', 'ratios': 'log_ratio', 'imputers': 'median', 'n_estimators': 600, 'learning_rate': 0.00011783431730144813, 'max_depth': 9, 'min_child_weight': 5, 'subsample': 0.6, 'colsample_bytree': 0.7, 'colsample_bylevel': 1.0, 'reg_alpha': 12.93682521869463, 'reg_lambda': 46.31322033029232, 'gamma': 43.578947741600224}. Best is trial 69 with value: -0.3911874830873789.
[I 2026-07-20 12:28:47,083] Trial 108 finished with value: -0.37981619160791086 and parameters: {'error_threshold': 2.5, 'scalers': 'robust', 'ratios': 'log_ratio', 'imputers': 'median', 'n_estimators': 500, 'learning_rate': 0.0001168506337593131, 'max_depth': 5, 'min_child_weight': 7, 'subsample': 0.5, 'colsample_bytree': 0.5, 'colsample_bylevel': 1.0, 'reg_alpha': 10.725751189540826, 'reg_lambda': 1.0182107480599253e-06, 'gamma': 0.012200084059642426}. Best is trial 69 with value: -0.3911874830873789.
[I 2026-07-20 12:28:53,517] Trial 109 finished with value: -0.3770394581856252 and parameters: {'error_threshold': 2.5, 'scalers': 'robust', 'ratios': 'log_ratio', 'imputers': 'median', 'n_estimators': 600, 'learning_rate': 0.00012667752897655977, 'max_depth': 9, 'min_child_weight': 6, 'subsample': 0.5, 'colsample_bytree': 0.5, 'colsample_bylevel': 1.0, 'reg_alpha': 13.62621685435591, 'reg_lambda': 50.66745505108441, 'gamma': 0.015510361222161656}. Best is trial 69 with value: -0.3911874830873789.
[I 2026-07-20 12:28:54,409] Trial 110 finished with value: -0.37371991681278977 and parameters: {'error_threshold': 2.5, 'scalers': 'standard', 'ratios': 'log_ratio', 'imputers': 'median', 'n_estimators': 500, 'learning_rate': 0.00017378957751083932, 'max_depth': 5, 'min_child_weight': 7, 'subsample': 0.5, 'colsample_bytree': 0.5, 'colsample_bylevel': 1.0, 'reg_alpha': 0.9039072456038347, 'reg_lambda': 3.8266756079158845e-05, 'gamma': 8.819483063150387e-06}. Best is trial 69 with value: -0.3911874830873789.
[I 2026-07-20 12:28:54,987] Trial 111 finished with value: -0.3800302071165291 and parameters: {'error_threshold': 2.5, 'scalers': 'robust', 'ratios': 'log_ratio', 'imputers': 'median', 'n_estimators': 450, 'learning_rate': 0.00012053855551449117, 'max_depth': 5, 'min_child_weight': 7, 'subsample': 0.6, 'colsample_bytree': 0.5, 'colsample_bylevel': 1.0, 'reg_alpha': 0.7577140333702079, 'reg_lambda': 2.3111447723401226, 'gamma': 0.013911079050178172}. Best is trial 69 with value: -0.3911874830873789.
/bsuscratch/alexanderemert/miniforge3/envs/starform-alex/lib/python3.14/site-packages/sklearn/utils/extmath.py:1207: RuntimeWarning: invalid value encountered in divide
  updated_mean = (last_sum + new_sum) / updated_sample_count
/bsuscratch/alexanderemert/miniforge3/envs/starform-alex/lib/python3.14/site-packages/sklearn/utils/extmath.py:1212: RuntimeWarning: invalid value encountered in divide
  T = new_sum / new_sample_count
/bsuscratch/alexanderemert/miniforge3/envs/starform-alex/lib/python3.14/site-packages/sklearn/utils/extmath.py:1236: RuntimeWarning: invalid value encountered in divide
  new_unnormalized_variance -= correction**2 / new_sample_count
[I 2026-07-20 12:28:57,948] Trial 112 finished with value: -0.37682355430772335 and parameters: {'error_threshold': 2.5, 'scalers': 'robust', 'ratios': 'log_ratio', 'imputers': 'median', 'n_estimators': 400, 'learning_rate': 0.00017495604697229472, 'max_depth': 6, 'min_child_weight': 7, 'subsample': 0.6, 'colsample_bytree': 0.5, 'colsample_bylevel': 1.0, 'reg_alpha': 0.03239456473818747, 'reg_lambda': 26.472574367682803, 'gamma': 5.0229519621062315e-06}. Best is trial 69 with value: -0.3911874830873789.
/bsuscratch/alexanderemert/miniforge3/envs/starform-alex/lib/python3.14/site-packages/sklearn/utils/extmath.py:1207: RuntimeWarning: invalid value encountered in divide
  updated_mean = (last_sum + new_sum) / updated_sample_count
/bsuscratch/alexanderemert/miniforge3/envs/starform-alex/lib/python3.14/site-packages/sklearn/utils/extmath.py:1212: RuntimeWarning: invalid value encountered in divide
  T = new_sum / new_sample_count
/bsuscratch/alexanderemert/miniforge3/envs/starform-alex/lib/python3.14/site-packages/sklearn/utils/extmath.py:1236: RuntimeWarning: invalid value encountered in divide
  new_unnormalized_variance -= correction**2 / new_sample_count
