[I 2026-07-21 10:01:33,800] Trial 332 finished with value: -0.6728840917707304 and parameters: {'error_threshold': 1.85, 'scalers': 'none', 'ratios': 'log_ratio', 'imputers': 'mean', 'n_estimators': 2550, 'learning_rate': 0.1633371836728556, 'max_depth': 4, 'min_child_weight': 6, 'subsample': 0.6, 'colsample_bytree': 0.6, 'colsample_bylevel': 0.8, 'reg_alpha': 8.92489915247385e-06, 'reg_lambda': 3.3614658151789273e-06, 'gamma': 1.1456519777707437e-05}. Best is trial 117 with value: -0.5901931848144322.
/bsuhome/alexanderemert/Research/Star-Formation-Research-Project-2026/pipeline/scripts/optuna/final_preds_and_models/optuna_search_mult_quant_reg.py:161: UserWarning: The distribution is specified by [0.1, 5] and step=0.25, but the range is not divisible by `step`. It will be replaced with [0.1, 4.85].
  error_threshold = trial.suggest_float("error_threshold", 0.1, 5, step=0.25)
[I 2026-07-21 10:01:36,415] Trial 333 finished with value: -0.591618339526811 and parameters: {'error_threshold': 1.85, 'scalers': 'none', 'ratios': 'norm_ratio', 'imputers': 'mean', 'n_estimators': 2550, 'learning_rate': 0.007725709317713435, 'max_depth': 4, 'min_child_weight': 5, 'subsample': 0.6, 'colsample_bytree': 0.6, 'colsample_bylevel': 0.8, 'reg_alpha': 1.0163678684704985e-05, 'reg_lambda': 3.6525330558319184e-06, 'gamma': 1.0729287848153357e-05}. Best is trial 117 with value: -0.5901931848144322.
/bsuhome/alexanderemert/Research/Star-Formation-Research-Project-2026/pipeline/scripts/optuna/final_preds_and_models/optuna_search_mult_quant_reg.py:161: UserWarning: The distribution is specified by [0.1, 5] and step=0.25, but the range is not divisible by `step`. It will be replaced with [0.1, 4.85].
  error_threshold = trial.suggest_float("error_threshold", 0.1, 5, step=0.25)
[I 2026-07-21 10:01:39,003] Trial 334 finished with value: -0.5914782238566324 and parameters: {'error_threshold': 1.85, 'scalers': 'none', 'ratios': 'norm_ratio', 'imputers': 'mean', 'n_estimators': 2550, 'learning_rate': 0.008060125957271654, 'max_depth': 4, 'min_child_weight': 5, 'subsample': 0.7, 'colsample_bytree': 0.6, 'colsample_bylevel': 0.8, 'reg_alpha': 2.28559368753501e-05, 'reg_lambda': 2.5307940309951614e-06, 'gamma': 3.224667917306259e-05}. Best is trial 117 with value: -0.5901931848144322.
/bsuhome/alexanderemert/Research/Star-Formation-Research-Project-2026/pipeline/scripts/optuna/final_preds_and_models/optuna_search_mult_quant_reg.py:161: UserWarning: The distribution is specified by [0.1, 5] and step=0.25, but the range is not divisible by `step`. It will be replaced with [0.1, 4.85].
  error_threshold = trial.suggest_float("error_threshold", 0.1, 5, step=0.25)
[I 2026-07-21 10:01:41,457] Trial 335 finished with value: -0.6144475363532873 and parameters: {'error_threshold': 0.35, 'scalers': 'robust', 'ratios': 'log_ratio', 'imputers': 'mean', 'n_estimators': 2550, 'learning_rate': 0.004715051701980348, 'max_depth': 4, 'min_child_weight': 9, 'subsample': 0.6, 'colsample_bytree': 0.6, 'colsample_bylevel': 0.8, 'reg_alpha': 9.641022231003317e-06, 'reg_lambda': 2.5932737977829527e-06, 'gamma': 1.1326834435835527e-05}. Best is trial 117 with value: -0.5901931848144322.
/bsuhome/alexanderemert/Research/Star-Formation-Research-Project-2026/pipeline/scripts/optuna/final_preds_and_models/optuna_search_mult_quant_reg.py:161: UserWarning: The distribution is specified by [0.1, 5] and step=0.25, but the range is not divisible by `step`. It will be replaced with [0.1, 4.85].
  error_threshold = trial.suggest_float("error_threshold", 0.1, 5, step=0.25)
[I 2026-07-21 10:01:44,086] Trial 336 finished with value: -0.5980693445781707 and parameters: {'error_threshold': 1.85, 'scalers': 'robust', 'ratios': 'log_ratio', 'imputers': 'mean', 'n_estimators': 2600, 'learning_rate': 0.007899740929240395, 'max_depth': 4, 'min_child_weight': 5, 'subsample': 1.0, 'colsample_bytree': 0.6, 'colsample_bylevel': 0.8, 'reg_alpha': 9.324365183359056e-06, 'reg_lambda': 2.3810886335699135e-06, 'gamma': 1.4990162015591495e-05}. Best is trial 117 with value: -0.5901931848144322.
/bsuhome/alexanderemert/Research/Star-Formation-Research-Project-2026/pipeline/scripts/optuna/final_preds_and_models/optuna_search_mult_quant_reg.py:161: UserWarning: The distribution is specified by [0.1, 5] and step=0.25, but the range is not divisible by `step`. It will be replaced with [0.1, 4.85].
  error_threshold = trial.suggest_float("error_threshold", 0.1, 5, step=0.25)
[I 2026-07-21 10:01:46,698] Trial 337 finished with value: -0.5906873098167201 and parameters: {'error_threshold': 1.85, 'scalers': 'robust', 'ratios': 'log_ratio', 'imputers': 'mean', 'n_estimators': 2600, 'learning_rate': 0.004822909817615587, 'max_depth': 4, 'min_child_weight': 5, 'subsample': 0.6, 'colsample_bytree': 0.6, 'colsample_bylevel': 0.8, 'reg_alpha': 1.0142402444863212e-05, 'reg_lambda': 2.416983986987242e-06, 'gamma': 3.331321004645137e-05}. Best is trial 117 with value: -0.5901931848144322.
/bsuhome/alexanderemert/Research/Star-Formation-Research-Project-2026/pipeline/scripts/optuna/final_preds_and_models/optuna_search_mult_quant_reg.py:161: UserWarning: The distribution is specified by [0.1, 5] and step=0.25, but the range is not divisible by `step`. It will be replaced with [0.1, 4.85].
  error_threshold = trial.suggest_float("error_threshold", 0.1, 5, step=0.25)
[I 2026-07-21 10:01:49,429] Trial 338 finished with value: -0.5917377531468264 and parameters: {'error_threshold': 2.1, 'scalers': 'none', 'ratios': 'log_ratio', 'imputers': 'mean', 'n_estimators': 2650, 'learning_rate': 0.004779049330577606, 'max_depth': 4, 'min_child_weight': 6, 'subsample': 0.6, 'colsample_bytree': 0.6, 'colsample_bylevel': 0.8, 'reg_alpha': 1.0184528530973678e-05, 'reg_lambda': 2.4050037181571373e-06, 'gamma': 1.4722386739431768e-05}. Best is trial 117 with value: -0.5901931848144322.
/bsuhome/alexanderemert/Research/Star-Formation-Research-Project-2026/pipeline/scripts/optuna/final_preds_and_models/optuna_search_mult_quant_reg.py:161: UserWarning: The distribution is specified by [0.1, 5] and step=0.25, but the range is not divisible by `step`. It will be replaced with [0.1, 4.85].
  error_threshold = trial.suggest_float("error_threshold", 0.1, 5, step=0.25)
[I 2026-07-21 10:01:52,060] Trial 339 finished with value: -0.5920213040718354 and parameters: {'error_threshold': 2.1, 'scalers': 'robust', 'ratios': 'log_ratio', 'imputers': 'median', 'n_estimators': 2650, 'learning_rate': 0.004736011353168464, 'max_depth': 4, 'min_child_weight': 6, 'subsample': 0.6, 'colsample_bytree': 0.6, 'colsample_bylevel': 0.8, 'reg_alpha': 2.0968406573496946e-05, 'reg_lambda': 2.6553324163777632e-06, 'gamma': 3.202960873268858e-05}. Best is trial 117 with value: -0.5901931848144322.
/bsuhome/alexanderemert/Research/Star-Formation-Research-Project-2026/pipeline/scripts/optuna/final_preds_and_models/optuna_search_mult_quant_reg.py:161: UserWarning: The distribution is specified by [0.1, 5] and step=0.25, but the range is not divisible by `step`. It will be replaced with [0.1, 4.85].
  error_threshold = trial.suggest_float("error_threshold", 0.1, 5, step=0.25)
[I 2026-07-21 10:01:54,812] Trial 340 finished with value: -0.5901329867736675 and parameters: {'error_threshold': 2.1, 'scalers': 'none', 'ratios': 'log_ratio', 'imputers': 'median', 'n_estimators': 2650, 'learning_rate': 0.00493548072414702, 'max_depth': 4, 'min_child_weight': 5, 'subsample': 0.6, 'colsample_bytree': 0.6, 'colsample_bylevel': 0.8, 'reg_alpha': 2.17695717454466e-05, 'reg_lambda': 2.4140527435957116e-06, 'gamma': 3.052166250903768e-05}. Best is trial 340 with value: -0.5901329867736675.
/bsuhome/alexanderemert/Research/Star-Formation-Research-Project-2026/pipeline/scripts/optuna/final_preds_and_models/optuna_search_mult_quant_reg.py:161: UserWarning: The distribution is specified by [0.1, 5] and step=0.25, but the range is not divisible by `step`. It will be replaced with [0.1, 4.85].
  error_threshold = trial.suggest_float("error_threshold", 0.1, 5, step=0.25)
[I 2026-07-21 10:01:55,561] Trial 341 finished with value: -0.7691996907844043 and parameters: {'error_threshold': 2.1, 'scalers': 'robust', 'ratios': 'log_ratio', 'imputers': 'median', 'n_estimators': 550, 'learning_rate': 0.004648811836685066, 'max_depth': 4, 'min_child_weight': 6, 'subsample': 1.0, 'colsample_bytree': 0.6, 'colsample_bylevel': 0.8, 'reg_alpha': 2.180072929134442e-05, 'reg_lambda': 2.452275674251934e-06, 'gamma': 3.205974961970575e-05}. Best is trial 340 with value: -0.5901329867736675.
/bsuhome/alexanderemert/Research/Star-Formation-Research-Project-2026/pipeline/scripts/optuna/final_preds_and_models/optuna_search_mult_quant_reg.py:161: UserWarning: The distribution is specified by [0.1, 5] and step=0.25, but the range is not divisible by `step`. It will be replaced with [0.1, 4.85].
  error_threshold = trial.suggest_float("error_threshold", 0.1, 5, step=0.25)
[I 2026-07-21 10:01:58,137] Trial 342 finished with value: -0.5914463382104111 and parameters: {'error_threshold': 2.1, 'scalers': 'robust', 'ratios': 'log_ratio', 'imputers': 'median', 'n_estimators': 2650, 'learning_rate': 0.004822433624434874, 'max_depth': 4, 'min_child_weight': 6, 'subsample': 0.6, 'colsample_bytree': 0.6, 'colsample_bylevel': 0.8, 'reg_alpha': 1.8148215379122275e-05, 'reg_lambda': 2.3882030964926925e-06, 'gamma': 1.5117163504448614e-05}. Best is trial 340 with value: -0.5901329867736675.
/bsuhome/alexanderemert/Research/Star-Formation-Research-Project-2026/pipeline/scripts/optuna/final_preds_and_models/optuna_search_mult_quant_reg.py:161: UserWarning: The distribution is specified by [0.1, 5] and step=0.25, but the range is not divisible by `step`. It will be replaced with [0.1, 4.85].
  error_threshold = trial.suggest_float("error_threshold", 0.1, 5, step=0.25)
[I 2026-07-21 10:02:00,836] Trial 343 finished with value: -0.5907117183559463 and parameters: {'error_threshold': 2.1, 'scalers': 'none', 'ratios': 'log_ratio', 'imputers': 'median', 'n_estimators': 2650, 'learning_rate': 0.00549017158580077, 'max_depth': 4, 'min_child_weight': 6, 'subsample': 0.6, 'colsample_bytree': 0.6, 'colsample_bylevel': 0.8, 'reg_alpha': 1.8267703626187825e-05, 'reg_lambda': 7.226318034412627e-06, 'gamma': 1.5097530479556622e-05}. Best is trial 340 with value: -0.5901329867736675.
/bsuhome/alexanderemert/Research/Star-Formation-Research-Project-2026/pipeline/scripts/optuna/final_preds_and_models/optuna_search_mult_quant_reg.py:161: UserWarning: The distribution is specified by [0.1, 5] and step=0.25, but the range is not divisible by `step`. It will be replaced with [0.1, 4.85].
  error_threshold = trial.suggest_float("error_threshold", 0.1, 5, step=0.25)
[I 2026-07-21 10:02:00,904] Trial 344 finished with value: -1.3845699614475464 and parameters: {'error_threshold': 2.1, 'scalers': 'none', 'ratios': 'log_ratio', 'imputers': 'median', 'n_estimators': 150, 'learning_rate': 0.005687151732203434, 'max_depth': 4, 'min_child_weight': 6, 'subsample': 0.6, 'colsample_bytree': 0.6, 'colsample_bylevel': 0.8, 'reg_alpha': 1.6923869723856485e-05, 'reg_lambda': 6.439505354081711e-06, 'gamma': 3.2826315716527744e-05}. Best is trial 340 with value: -0.5901329867736675.
/bsuhome/alexanderemert/Research/Star-Formation-Research-Project-2026/pipeline/scripts/optuna/final_preds_and_models/optuna_search_mult_quant_reg.py:161: UserWarning: The distribution is specified by [0.1, 5] and step=0.25, but the range is not divisible by `step`. It will be replaced with [0.1, 4.85].
  error_threshold = trial.suggest_float("error_threshold", 0.1, 5, step=0.25)
[I 2026-07-21 10:02:03,592] Trial 345 finished with value: -0.5897092333049717 and parameters: {'error_threshold': 2.1, 'scalers': 'none', 'ratios': 'log_ratio', 'imputers': 'mean', 'n_estimators': 2650, 'learning_rate': 0.005415337805716943, 'max_depth': 4, 'min_child_weight': 5, 'subsample': 0.6, 'colsample_bytree': 0.6, 'colsample_bylevel': 0.8, 'reg_alpha': 4.211180080725157e-06, 'reg_lambda': 6.7710937162501245e-06, 'gamma': 5.857544499741991e-05}. Best is trial 345 with value: -0.5897092333049717.
/bsuhome/alexanderemert/Research/Star-Formation-Research-Project-2026/pipeline/scripts/optuna/final_preds_and_models/optuna_search_mult_quant_reg.py:161: UserWarning: The distribution is specified by [0.1, 5] and step=0.25, but the range is not divisible by `step`. It will be replaced with [0.1, 4.85].
  error_threshold = trial.suggest_float("error_threshold", 0.1, 5, step=0.25)
[I 2026-07-21 10:02:06,232] Trial 346 finished with value: -0.589942824754533 and parameters: {'error_threshold': 2.1, 'scalers': 'robust', 'ratios': 'log_ratio', 'imputers': 'mean', 'n_estimators': 2650, 'learning_rate': 0.005844767358976452, 'max_depth': 4, 'min_child_weight': 5, 'subsample': 0.6, 'colsample_bytree': 0.6, 'colsample_bylevel': 0.8, 'reg_alpha': 3.547658400455272e-06, 'reg_lambda': 7.119540250065033e-06, 'gamma': 4.935214053155019e-05}. Best is trial 345 with value: -0.5897092333049717.
/bsuhome/alexanderemert/Research/Star-Formation-Research-Project-2026/pipeline/scripts/optuna/final_preds_and_models/optuna_search_mult_quant_reg.py:161: UserWarning: The distribution is specified by [0.1, 5] and step=0.25, but the range is not divisible by `step`. It will be replaced with [0.1, 4.85].
  error_threshold = trial.suggest_float("error_threshold", 0.1, 5, step=0.25)
[I 2026-07-21 10:02:08,895] Trial 347 finished with value: -0.5896472086171253 and parameters: {'error_threshold': 2.1, 'scalers': 'robust', 'ratios': 'log_ratio', 'imputers': 'mean', 'n_estimators': 2650, 'learning_rate': 0.005704996397614681, 'max_depth': 4, 'min_child_weight': 5, 'subsample': 0.6, 'colsample_bytree': 0.6, 'colsample_bylevel': 0.8, 'reg_alpha': 0.00010817769194495475, 'reg_lambda': 6.9694662553099565e-06, 'gamma': 5.3380421399740786e-05}. Best is trial 347 with value: -0.5896472086171253.
/bsuhome/alexanderemert/Research/Star-Formation-Research-Project-2026/pipeline/scripts/optuna/final_preds_and_models/optuna_search_mult_quant_reg.py:161: UserWarning: The distribution is specified by [0.1, 5] and step=0.25, but the range is not divisible by `step`. It will be replaced with [0.1, 4.85].
  error_threshold = trial.suggest_float("error_threshold", 0.1, 5, step=0.25)
[I 2026-07-21 10:02:11,517] Trial 348 finished with value: -0.5904446249260825 and parameters: {'error_threshold': 4.85, 'scalers': 'robust', 'ratios': 'log_ratio', 'imputers': 'mean', 'n_estimators': 2650, 'learning_rate': 0.005791352317674715, 'max_depth': 4, 'min_child_weight': 5, 'subsample': 0.6, 'colsample_bytree': 0.6, 'colsample_bylevel': 0.8, 'reg_alpha': 5.00112358946403e-06, 'reg_lambda': 7.46598797318082e-06, 'gamma': 6.087912567657967e-05}. Best is trial 347 with value: -0.5896472086171253.
/bsuhome/alexanderemert/Research/Star-Formation-Research-Project-2026/pipeline/scripts/optuna/final_preds_and_models/optuna_search_mult_quant_reg.py:161: UserWarning: The distribution is specified by [0.1, 5] and step=0.25, but the range is not divisible by `step`. It will be replaced with [0.1, 4.85].
  error_threshold = trial.suggest_float("error_threshold", 0.1, 5, step=0.25)
[I 2026-07-21 10:02:15,379] Trial 349 finished with value: -0.5928657810488535 and parameters: {'error_threshold': 2.1, 'scalers': 'robust', 'ratios': 'log_ratio', 'imputers': 'mean', 'n_estimators': 2650, 'learning_rate': 0.005710318528829432, 'max_depth': 5, 'min_child_weight': 5, 'subsample': 0.6, 'colsample_bytree': 0.6, 'colsample_bylevel': 0.8, 'reg_alpha': 3.8120936194925146e-06, 'reg_lambda': 3.7388205255302646e-06, 'gamma': 6.191244719731711e-05}. Best is trial 347 with value: -0.5896472086171253.
/bsuhome/alexanderemert/Research/Star-Formation-Research-Project-2026/pipeline/scripts/optuna/final_preds_and_models/optuna_search_mult_quant_reg.py:161: UserWarning: The distribution is specified by [0.1, 5] and step=0.25, but the range is not divisible by `step`. It will be replaced with [0.1, 4.85].
  error_threshold = trial.suggest_float("error_threshold", 0.1, 5, step=0.25)
[I 2026-07-21 10:02:19,242] Trial 350 finished with value: -0.5928110882870608 and parameters: {'error_threshold': 2.1, 'scalers': 'robust', 'ratios': 'log_ratio', 'imputers': 'mean', 'n_estimators': 2650, 'learning_rate': 0.005681369008682724, 'max_depth': 5, 'min_child_weight': 5, 'subsample': 0.6, 'colsample_bytree': 0.6, 'colsample_bylevel': 0.8, 'reg_alpha': 3.783639913025462e-06, 'reg_lambda': 7.055792322517786e-06, 'gamma': 4.70666202873058e-05}. Best is trial 347 with value: -0.5896472086171253.
/bsuhome/alexanderemert/Research/Star-Formation-Research-Project-2026/pipeline/scripts/optuna/final_preds_and_models/optuna_search_mult_quant_reg.py:161: UserWarning: The distribution is specified by [0.1, 5] and step=0.25, but the range is not divisible by `step`. It will be replaced with [0.1, 4.85].
  error_threshold = trial.suggest_float("error_threshold", 0.1, 5, step=0.25)
[I 2026-07-21 10:02:23,081] Trial 352 finished with value: -0.5934977310731681 and parameters: {'error_threshold': 2.1, 'scalers': 'robust', 'ratios': 'log_ratio', 'imputers': 'mean', 'n_estimators': 2650, 'learning_rate': 0.005953881436788956, 'max_depth': 5, 'min_child_weight': 5, 'subsample': 0.6, 'colsample_bytree': 0.6, 'colsample_bylevel': 0.8, 'reg_alpha': 4.984954370189214e-06, 'reg_lambda': 6.932399065579699e-06, 'gamma': 5.8434892118417717e-05}. Best is trial 347 with value: -0.5896472086171253.
/bsuhome/alexanderemert/Research/Star-Formation-Research-Project-2026/pipeline/scripts/optuna/final_preds_and_models/optuna_search_mult_quant_reg.py:161: UserWarning: The distribution is specified by [0.1, 5] and step=0.25, but the range is not divisible by `step`. It will be replaced with [0.1, 4.85].
  error_threshold = trial.suggest_float("error_threshold", 0.1, 5, step=0.25)
[I 2026-07-21 10:02:27,001] Trial 351 finished with value: -0.5925740370667406 and parameters: {'error_threshold': 2.1, 'scalers': 'robust', 'ratios': 'log_ratio', 'imputers': 'mean', 'n_estimators': 2700, 'learning_rate': 0.0056379753403910954, 'max_depth': 5, 'min_child_weight': 5, 'subsample': 0.6, 'colsample_bytree': 0.6, 'colsample_bylevel': 0.8, 'reg_alpha': 4.77744423110662e-06, 'reg_lambda': 7.429968830135713e-06, 'gamma': 3.8189097449493065e-05}. Best is trial 347 with value: -0.5896472086171253.
/bsuhome/alexanderemert/Research/Star-Formation-Research-Project-2026/pipeline/scripts/optuna/final_preds_and_models/optuna_search_mult_quant_reg.py:161: UserWarning: The distribution is specified by [0.1, 5] and step=0.25, but the range is not divisible by `step`. It will be replaced with [0.1, 4.85].
  error_threshold = trial.suggest_float("error_threshold", 0.1, 5, step=0.25)
[I 2026-07-21 10:02:31,027] Trial 353 finished with value: -0.5932970385344905 and parameters: {'error_threshold': 2.1, 'scalers': 'none', 'ratios': 'log_ratio', 'imputers': 'mean', 'n_estimators': 2700, 'learning_rate': 0.00598518639821848, 'max_depth': 5, 'min_child_weight': 5, 'subsample': 0.6, 'colsample_bytree': 0.6, 'colsample_bylevel': 0.8, 'reg_alpha': 3.7709200053510767e-06, 'reg_lambda': 8.61363305326953e-06, 'gamma': 6.659259009401696e-05}. Best is trial 347 with value: -0.5896472086171253.
/bsuhome/alexanderemert/Research/Star-Formation-Research-Project-2026/pipeline/scripts/optuna/final_preds_and_models/optuna_search_mult_quant_reg.py:161: UserWarning: The distribution is specified by [0.1, 5] and step=0.25, but the range is not divisible by `step`. It will be replaced with [0.1, 4.85].
  error_threshold = trial.suggest_float("error_threshold", 0.1, 5, step=0.25)
[I 2026-07-21 10:02:34,483] Trial 354 finished with value: -0.5965291728187584 and parameters: {'error_threshold': 2.35, 'scalers': 'none', 'ratios': 'log_ratio', 'imputers': 'mean', 'n_estimators': 2700, 'learning_rate': 0.005714366894364743, 'max_depth': 5, 'min_child_weight': 5, 'subsample': 0.6, 'colsample_bytree': 0.5, 'colsample_bylevel': 0.8, 'reg_alpha': 2.803484255037957e-06, 'reg_lambda': 8.059955939142769e-06, 'gamma': 4.9576710295313805e-05}. Best is trial 347 with value: -0.5896472086171253.
/bsuhome/alexanderemert/Research/Star-Formation-Research-Project-2026/pipeline/scripts/optuna/final_preds_and_models/optuna_search_mult_quant_reg.py:161: UserWarning: The distribution is specified by [0.1, 5] and step=0.25, but the range is not divisible by `step`. It will be replaced with [0.1, 4.85].
  error_threshold = trial.suggest_float("error_threshold", 0.1, 5, step=0.25)
[I 2026-07-21 10:02:38,388] Trial 355 finished with value: -0.5936139171719113 and parameters: {'error_threshold': 2.35, 'scalers': 'robust', 'ratios': 'log_ratio', 'imputers': 'mean', 'n_estimators': 2700, 'learning_rate': 0.006033153717872473, 'max_depth': 5, 'min_child_weight': 5, 'subsample': 0.6, 'colsample_bytree': 0.6, 'colsample_bylevel': 0.8, 'reg_alpha': 3.3477481745387437e-06, 'reg_lambda': 9.06317049078437e-06, 'gamma': 6.744448910364799e-05}. Best is trial 347 with value: -0.5896472086171253.
/bsuhome/alexanderemert/Research/Star-Formation-Research-Project-2026/pipeline/scripts/optuna/final_preds_and_models/optuna_search_mult_quant_reg.py:161: UserWarning: The distribution is specified by [0.1, 5] and step=0.25, but the range is not divisible by `step`. It will be replaced with [0.1, 4.85].
  error_threshold = trial.suggest_float("error_threshold", 0.1, 5, step=0.25)
