[I 2026-07-21 13:44:14,412] Trial 240 finished with value: -0.626587786019929 and parameters: {'error_threshold': 2.85, 'scalers': 'robust', 'ratios': 'log_ratio', 'imputers': 'mean', 'n_estimators': 2850, 'learning_rate': 0.00398749292845756, 'max_depth': 3, 'min_child_weight': 4, 'subsample': 0.6, 'colsample_bytree': 0.7, 'colsample_bylevel': 0.5, 'reg_alpha': 0.029999606123835964, 'reg_lambda': 7.61622282890279e-06, 'gamma': 0.035124950326302924}. Best is trial 207 with value: -0.6258838991735501.
/bsuhome/alexanderemert/Research/Star-Formation-Research-Project-2026/pipeline/scripts/optuna/final_preds_and_models/optuna_search_mult_quant_reg.py:75: UserWarning: The distribution is specified by [0.1, 5] and step=0.25, but the range is not divisible by `step`. It will be replaced with [0.1, 4.85].
  error_threshold = trial.suggest_float("error_threshold", 0.1, 5, step=0.25)
[I 2026-07-21 13:44:23,874] Trial 241 finished with value: -0.6261846589072987 and parameters: {'error_threshold': 2.85, 'scalers': 'robust', 'ratios': 'log_ratio', 'imputers': 'mean', 'n_estimators': 2300, 'learning_rate': 0.004080865785075512, 'max_depth': 3, 'min_child_weight': 4, 'subsample': 0.6, 'colsample_bytree': 0.7, 'colsample_bylevel': 0.5, 'reg_alpha': 0.0828484522202341, 'reg_lambda': 1.3082623481230275e-05, 'gamma': 0.038258896530018995}. Best is trial 207 with value: -0.6258838991735501.
/bsuhome/alexanderemert/Research/Star-Formation-Research-Project-2026/pipeline/scripts/optuna/final_preds_and_models/optuna_search_mult_quant_reg.py:75: UserWarning: The distribution is specified by [0.1, 5] and step=0.25, but the range is not divisible by `step`. It will be replaced with [0.1, 4.85].
  error_threshold = trial.suggest_float("error_threshold", 0.1, 5, step=0.25)
[I 2026-07-21 13:44:45,386] Trial 242 finished with value: -0.6375534523769614 and parameters: {'error_threshold': 2.85, 'scalers': 'robust', 'ratios': 'log_ratio', 'imputers': 'mean', 'n_estimators': 2800, 'learning_rate': 0.004058904845377053, 'max_depth': 6, 'min_child_weight': 6, 'subsample': 0.6, 'colsample_bytree': 0.7, 'colsample_bylevel': 0.5, 'reg_alpha': 0.03238308115543043, 'reg_lambda': 1.2968879758708264e-05, 'gamma': 0.038860012662416885}. Best is trial 207 with value: -0.6258838991735501.
/bsuhome/alexanderemert/Research/Star-Formation-Research-Project-2026/pipeline/scripts/optuna/final_preds_and_models/optuna_search_mult_quant_reg.py:75: UserWarning: The distribution is specified by [0.1, 5] and step=0.25, but the range is not divisible by `step`. It will be replaced with [0.1, 4.85].
  error_threshold = trial.suggest_float("error_threshold", 0.1, 5, step=0.25)
[I 2026-07-21 13:44:52,456] Trial 243 finished with value: -0.6263784843232398 and parameters: {'error_threshold': 2.85, 'scalers': 'robust', 'ratios': 'log_ratio', 'imputers': 'mean', 'n_estimators': 2800, 'learning_rate': 0.004146912017767196, 'max_depth': 3, 'min_child_weight': 6, 'subsample': 0.6, 'colsample_bytree': 0.7, 'colsample_bylevel': 0.5, 'reg_alpha': 0.029534305108622025, 'reg_lambda': 3.6005897729529625e-06, 'gamma': 0.042298629778230096}. Best is trial 207 with value: -0.6258838991735501.
/bsuhome/alexanderemert/Research/Star-Formation-Research-Project-2026/pipeline/scripts/optuna/final_preds_and_models/optuna_search_mult_quant_reg.py:75: UserWarning: The distribution is specified by [0.1, 5] and step=0.25, but the range is not divisible by `step`. It will be replaced with [0.1, 4.85].
  error_threshold = trial.suggest_float("error_threshold", 0.1, 5, step=0.25)
[I 2026-07-21 13:45:04,561] Trial 244 finished with value: -0.6269471643177432 and parameters: {'error_threshold': 2.85, 'scalers': 'robust', 'ratios': 'log_ratio', 'imputers': 'mean', 'n_estimators': 2800, 'learning_rate': 0.004162464798070411, 'max_depth': 3, 'min_child_weight': 6, 'subsample': 0.6, 'colsample_bytree': 0.7, 'colsample_bylevel': 0.5, 'reg_alpha': 0.03230286226190566, 'reg_lambda': 3.2733374403583457e-06, 'gamma': 0.025605009956553206}. Best is trial 207 with value: -0.6258838991735501.
/bsuhome/alexanderemert/Research/Star-Formation-Research-Project-2026/pipeline/scripts/optuna/final_preds_and_models/optuna_search_mult_quant_reg.py:75: UserWarning: The distribution is specified by [0.1, 5] and step=0.25, but the range is not divisible by `step`. It will be replaced with [0.1, 4.85].
  error_threshold = trial.suggest_float("error_threshold", 0.1, 5, step=0.25)
[I 2026-07-21 13:45:10,790] Trial 245 finished with value: -0.6260214536800816 and parameters: {'error_threshold': 2.85, 'scalers': 'robust', 'ratios': 'log_ratio', 'imputers': 'mean', 'n_estimators': 2850, 'learning_rate': 0.003957932844739522, 'max_depth': 3, 'min_child_weight': 6, 'subsample': 0.6, 'colsample_bytree': 0.7, 'colsample_bylevel': 0.5, 'reg_alpha': 0.028447436342047112, 'reg_lambda': 3.5712682922941222e-06, 'gamma': 0.12720150923009954}. Best is trial 207 with value: -0.6258838991735501.
/bsuhome/alexanderemert/Research/Star-Formation-Research-Project-2026/pipeline/scripts/optuna/final_preds_and_models/optuna_search_mult_quant_reg.py:75: UserWarning: The distribution is specified by [0.1, 5] and step=0.25, but the range is not divisible by `step`. It will be replaced with [0.1, 4.85].
  error_threshold = trial.suggest_float("error_threshold", 0.1, 5, step=0.25)
[I 2026-07-21 13:45:13,094] Trial 247 finished with value: -0.6262204780854458 and parameters: {'error_threshold': 2.85, 'scalers': 'robust', 'ratios': 'log_ratio', 'imputers': 'mean', 'n_estimators': 2850, 'learning_rate': 0.004302341105462055, 'max_depth': 3, 'min_child_weight': 6, 'subsample': 0.6, 'colsample_bytree': 0.7, 'colsample_bylevel': 0.5, 'reg_alpha': 0.03613837392847403, 'reg_lambda': 2.7917522568155672e-05, 'gamma': 0.024405870503645833}. Best is trial 207 with value: -0.6258838991735501.
/bsuhome/alexanderemert/Research/Star-Formation-Research-Project-2026/pipeline/scripts/optuna/final_preds_and_models/optuna_search_mult_quant_reg.py:75: UserWarning: The distribution is specified by [0.1, 5] and step=0.25, but the range is not divisible by `step`. It will be replaced with [0.1, 4.85].
  error_threshold = trial.suggest_float("error_threshold", 0.1, 5, step=0.25)
[I 2026-07-21 13:45:35,320] Trial 248 finished with value: -0.6258471339443799 and parameters: {'error_threshold': 2.85, 'scalers': 'robust', 'ratios': 'log_ratio', 'imputers': 'mean', 'n_estimators': 2800, 'learning_rate': 0.004282129098305381, 'max_depth': 3, 'min_child_weight': 6, 'subsample': 0.6, 'colsample_bytree': 0.7, 'colsample_bylevel': 0.5, 'reg_alpha': 0.03618145432019283, 'reg_lambda': 3.350039779537232e-05, 'gamma': 0.1256932800089262}. Best is trial 248 with value: -0.6258471339443799.
/bsuhome/alexanderemert/Research/Star-Formation-Research-Project-2026/pipeline/scripts/optuna/final_preds_and_models/optuna_search_mult_quant_reg.py:75: UserWarning: The distribution is specified by [0.1, 5] and step=0.25, but the range is not divisible by `step`. It will be replaced with [0.1, 4.85].
  error_threshold = trial.suggest_float("error_threshold", 0.1, 5, step=0.25)
[I 2026-07-21 13:45:41,989] Trial 249 finished with value: -0.6265196511481551 and parameters: {'error_threshold': 2.85, 'scalers': 'robust', 'ratios': 'log_ratio', 'imputers': 'mean', 'n_estimators': 2750, 'learning_rate': 0.0042467642501841565, 'max_depth': 3, 'min_child_weight': 6, 'subsample': 0.6, 'colsample_bytree': 0.7, 'colsample_bylevel': 0.5, 'reg_alpha': 0.039790332509669006, 'reg_lambda': 1.3659912463007454e-05, 'gamma': 0.02310553897634532}. Best is trial 248 with value: -0.6258471339443799.
/bsuhome/alexanderemert/Research/Star-Formation-Research-Project-2026/pipeline/scripts/optuna/final_preds_and_models/optuna_search_mult_quant_reg.py:75: UserWarning: The distribution is specified by [0.1, 5] and step=0.25, but the range is not divisible by `step`. It will be replaced with [0.1, 4.85].
  error_threshold = trial.suggest_float("error_threshold", 0.1, 5, step=0.25)
[I 2026-07-21 13:45:53,428] Trial 250 finished with value: -0.6266316320396931 and parameters: {'error_threshold': 2.85, 'scalers': 'robust', 'ratios': 'log_ratio', 'imputers': 'mean', 'n_estimators': 2800, 'learning_rate': 0.004342928801617455, 'max_depth': 3, 'min_child_weight': 7, 'subsample': 0.6, 'colsample_bytree': 0.7, 'colsample_bylevel': 0.5, 'reg_alpha': 0.04165875794960377, 'reg_lambda': 3.529677294717988e-05, 'gamma': 0.024257056327499634}. Best is trial 248 with value: -0.6258471339443799.
/bsuhome/alexanderemert/Research/Star-Formation-Research-Project-2026/pipeline/scripts/optuna/final_preds_and_models/optuna_search_mult_quant_reg.py:75: UserWarning: The distribution is specified by [0.1, 5] and step=0.25, but the range is not divisible by `step`. It will be replaced with [0.1, 4.85].
  error_threshold = trial.suggest_float("error_threshold", 0.1, 5, step=0.25)
[I 2026-07-21 13:46:01,681] Trial 246 finished with value: -0.6455132976266795 and parameters: {'error_threshold': 2.85, 'scalers': 'robust', 'ratios': 'log_ratio', 'imputers': 'mean', 'n_estimators': 2950, 'learning_rate': 0.0014845280386155044, 'max_depth': 12, 'min_child_weight': 6, 'subsample': 0.6, 'colsample_bytree': 0.7, 'colsample_bylevel': 0.5, 'reg_alpha': 0.03219789725824137, 'reg_lambda': 3.587185279171594e-05, 'gamma': 0.02566849439655802}. Best is trial 248 with value: -0.6258471339443799.
/bsuhome/alexanderemert/Research/Star-Formation-Research-Project-2026/pipeline/scripts/optuna/final_preds_and_models/optuna_search_mult_quant_reg.py:75: UserWarning: The distribution is specified by [0.1, 5] and step=0.25, but the range is not divisible by `step`. It will be replaced with [0.1, 4.85].
  error_threshold = trial.suggest_float("error_threshold", 0.1, 5, step=0.25)
[I 2026-07-21 13:46:07,972] Trial 251 finished with value: -0.6261185388373732 and parameters: {'error_threshold': 4.85, 'scalers': 'robust', 'ratios': 'log_ratio', 'imputers': 'mean', 'n_estimators': 2700, 'learning_rate': 0.004180960794306726, 'max_depth': 3, 'min_child_weight': 6, 'subsample': 0.6, 'colsample_bytree': 0.7, 'colsample_bylevel': 0.5, 'reg_alpha': 0.04045017597822009, 'reg_lambda': 3.488983957605077e-05, 'gamma': 0.11597822158735582}. Best is trial 248 with value: -0.6258471339443799.
/bsuhome/alexanderemert/Research/Star-Formation-Research-Project-2026/pipeline/scripts/optuna/final_preds_and_models/optuna_search_mult_quant_reg.py:75: UserWarning: The distribution is specified by [0.1, 5] and step=0.25, but the range is not divisible by `step`. It will be replaced with [0.1, 4.85].
  error_threshold = trial.suggest_float("error_threshold", 0.1, 5, step=0.25)
[I 2026-07-21 13:46:19,345] Trial 252 finished with value: -0.6260237536770286 and parameters: {'error_threshold': 2.85, 'scalers': 'robust', 'ratios': 'log_ratio', 'imputers': 'mean', 'n_estimators': 2700, 'learning_rate': 0.00440769382432053, 'max_depth': 3, 'min_child_weight': 6, 'subsample': 0.6, 'colsample_bytree': 0.7, 'colsample_bylevel': 0.5, 'reg_alpha': 0.10414432810438345, 'reg_lambda': 3.454381378030935e-05, 'gamma': 0.10682126887742426}. Best is trial 248 with value: -0.6258471339443799.
/bsuhome/alexanderemert/Research/Star-Formation-Research-Project-2026/pipeline/scripts/optuna/final_preds_and_models/optuna_search_mult_quant_reg.py:75: UserWarning: The distribution is specified by [0.1, 5] and step=0.25, but the range is not divisible by `step`. It will be replaced with [0.1, 4.85].
  error_threshold = trial.suggest_float("error_threshold", 0.1, 5, step=0.25)
[I 2026-07-21 13:46:45,795] Trial 253 finished with value: -0.6303848638134568 and parameters: {'error_threshold': 3.35, 'scalers': 'robust', 'ratios': 'log_ratio', 'imputers': 'mean', 'n_estimators': 2950, 'learning_rate': 0.0014455994750132324, 'max_depth': 3, 'min_child_weight': 6, 'subsample': 0.6, 'colsample_bytree': 0.7, 'colsample_bylevel': 0.5, 'reg_alpha': 0.04486022611072202, 'reg_lambda': 1.4178886709070366e-05, 'gamma': 0.11742005726298615}. Best is trial 248 with value: -0.6258471339443799.
/bsuhome/alexanderemert/Research/Star-Formation-Research-Project-2026/pipeline/scripts/optuna/final_preds_and_models/optuna_search_mult_quant_reg.py:75: UserWarning: The distribution is specified by [0.1, 5] and step=0.25, but the range is not divisible by `step`. It will be replaced with [0.1, 4.85].
  error_threshold = trial.suggest_float("error_threshold", 0.1, 5, step=0.25)
[I 2026-07-21 13:46:47,527] Trial 254 finished with value: -0.6259705938933603 and parameters: {'error_threshold': 3.35, 'scalers': 'robust', 'ratios': 'log_ratio', 'imputers': 'mean', 'n_estimators': 2900, 'learning_rate': 0.004472241839928365, 'max_depth': 3, 'min_child_weight': 6, 'subsample': 0.6, 'colsample_bytree': 0.7, 'colsample_bylevel': 0.5, 'reg_alpha': 0.04136857483594815, 'reg_lambda': 2.79896469960049e-05, 'gamma': 0.13499773354460406}. Best is trial 248 with value: -0.6258471339443799.
/bsuhome/alexanderemert/Research/Star-Formation-Research-Project-2026/pipeline/scripts/optuna/final_preds_and_models/optuna_search_mult_quant_reg.py:75: UserWarning: The distribution is specified by [0.1, 5] and step=0.25, but the range is not divisible by `step`. It will be replaced with [0.1, 4.85].
  error_threshold = trial.suggest_float("error_threshold", 0.1, 5, step=0.25)
[I 2026-07-21 13:46:56,465] Trial 256 finished with value: -0.6264189345883837 and parameters: {'error_threshold': 3.35, 'scalers': 'robust', 'ratios': 'log_ratio', 'imputers': 'mean', 'n_estimators': 2950, 'learning_rate': 0.005558126948399975, 'max_depth': 3, 'min_child_weight': 6, 'subsample': 0.6, 'colsample_bytree': 0.7, 'colsample_bylevel': 0.5, 'reg_alpha': 0.01733999563941044, 'reg_lambda': 6.922273528362486e-05, 'gamma': 0.12379220738379322}. Best is trial 248 with value: -0.6258471339443799.
/bsuhome/alexanderemert/Research/Star-Formation-Research-Project-2026/pipeline/scripts/optuna/final_preds_and_models/optuna_search_mult_quant_reg.py:75: UserWarning: The distribution is specified by [0.1, 5] and step=0.25, but the range is not divisible by `step`. It will be replaced with [0.1, 4.85].
  error_threshold = trial.suggest_float("error_threshold", 0.1, 5, step=0.25)
[I 2026-07-21 13:46:58,717] Trial 255 finished with value: -0.6414895618790044 and parameters: {'error_threshold': 2.85, 'scalers': 'robust', 'ratios': 'log_ratio', 'imputers': 'mean', 'n_estimators': 2950, 'learning_rate': 0.004417530402433831, 'max_depth': 12, 'min_child_weight': 6, 'subsample': 0.6, 'colsample_bytree': 0.7, 'colsample_bylevel': 0.5, 'reg_alpha': 0.04304525517781126, 'reg_lambda': 7.362313943474539e-05, 'gamma': 0.1352855066666993}. Best is trial 248 with value: -0.6258471339443799.
/bsuhome/alexanderemert/Research/Star-Formation-Research-Project-2026/pipeline/scripts/optuna/final_preds_and_models/optuna_search_mult_quant_reg.py:75: UserWarning: The distribution is specified by [0.1, 5] and step=0.25, but the range is not divisible by `step`. It will be replaced with [0.1, 4.85].
  error_threshold = trial.suggest_float("error_threshold", 0.1, 5, step=0.25)
[I 2026-07-21 13:47:07,206] Trial 257 finished with value: -0.6316315639669224 and parameters: {'error_threshold': 2.85, 'scalers': 'robust', 'ratios': 'log_ratio', 'imputers': 'mean', 'n_estimators': 2850, 'learning_rate': 0.0013616851164450056, 'max_depth': 3, 'min_child_weight': 6, 'subsample': 0.6, 'colsample_bytree': 0.7, 'colsample_bylevel': 0.5, 'reg_alpha': 0.018727590607230008, 'reg_lambda': 3.0473521659356758e-05, 'gamma': 0.1252671407296842}. Best is trial 248 with value: -0.6258471339443799.
/bsuhome/alexanderemert/Research/Star-Formation-Research-Project-2026/pipeline/scripts/optuna/final_preds_and_models/optuna_search_mult_quant_reg.py:75: UserWarning: The distribution is specified by [0.1, 5] and step=0.25, but the range is not divisible by `step`. It will be replaced with [0.1, 4.85].
  error_threshold = trial.suggest_float("error_threshold", 0.1, 5, step=0.25)
[I 2026-07-21 13:47:09,215] Trial 258 finished with value: -0.6261628795149178 and parameters: {'error_threshold': 3.35, 'scalers': 'robust', 'ratios': 'log_ratio', 'imputers': 'mean', 'n_estimators': 2900, 'learning_rate': 0.003156029318012894, 'max_depth': 3, 'min_child_weight': 6, 'subsample': 0.6, 'colsample_bytree': 0.7, 'colsample_bylevel': 0.5, 'reg_alpha': 0.018145024902865552, 'reg_lambda': 1.04083002212035e-05, 'gamma': 0.12308525970679669}. Best is trial 248 with value: -0.6258471339443799.
/bsuhome/alexanderemert/Research/Star-Formation-Research-Project-2026/pipeline/scripts/optuna/final_preds_and_models/optuna_search_mult_quant_reg.py:75: UserWarning: The distribution is specified by [0.1, 5] and step=0.25, but the range is not divisible by `step`. It will be replaced with [0.1, 4.85].
  error_threshold = trial.suggest_float("error_threshold", 0.1, 5, step=0.25)
[I 2026-07-21 13:47:17,045] Trial 259 finished with value: -0.6258171477404484 and parameters: {'error_threshold': 3.35, 'scalers': 'robust', 'ratios': 'log_ratio', 'imputers': 'mean', 'n_estimators': 2900, 'learning_rate': 0.0032438618816893554, 'max_depth': 3, 'min_child_weight': 6, 'subsample': 0.6, 'colsample_bytree': 0.7, 'colsample_bylevel': 0.5, 'reg_alpha': 0.016050245951629023, 'reg_lambda': 4.9825726824787074e-05, 'gamma': 0.1205470148600004}. Best is trial 259 with value: -0.6258171477404484.
/bsuhome/alexanderemert/Research/Star-Formation-Research-Project-2026/pipeline/scripts/optuna/final_preds_and_models/optuna_search_mult_quant_reg.py:75: UserWarning: The distribution is specified by [0.1, 5] and step=0.25, but the range is not divisible by `step`. It will be replaced with [0.1, 4.85].
  error_threshold = trial.suggest_float("error_threshold", 0.1, 5, step=0.25)
[I 2026-07-21 13:47:26,834] Trial 260 finished with value: -0.6263408107750853 and parameters: {'error_threshold': 3.85, 'scalers': 'robust', 'ratios': 'log_ratio', 'imputers': 'mean', 'n_estimators': 2700, 'learning_rate': 0.0031502925125011924, 'max_depth': 3, 'min_child_weight': 6, 'subsample': 0.6, 'colsample_bytree': 0.7, 'colsample_bylevel': 0.5, 'reg_alpha': 0.015067585793157989, 'reg_lambda': 1.2319483901034538e-05, 'gamma': 0.12479023545188084}. Best is trial 259 with value: -0.6258171477404484.
/bsuhome/alexanderemert/Research/Star-Formation-Research-Project-2026/pipeline/scripts/optuna/final_preds_and_models/optuna_search_mult_quant_reg.py:75: UserWarning: The distribution is specified by [0.1, 5] and step=0.25, but the range is not divisible by `step`. It will be replaced with [0.1, 4.85].
  error_threshold = trial.suggest_float("error_threshold", 0.1, 5, step=0.25)
[I 2026-07-21 13:47:35,002] Trial 261 finished with value: -0.6263206792010322 and parameters: {'error_threshold': 4.85, 'scalers': 'robust', 'ratios': 'log_ratio', 'imputers': 'mean', 'n_estimators': 2700, 'learning_rate': 0.0033031412519735374, 'max_depth': 3, 'min_child_weight': 6, 'subsample': 0.6, 'colsample_bytree': 0.7, 'colsample_bylevel': 0.5, 'reg_alpha': 0.014428300733768424, 'reg_lambda': 7.133664198749655e-05, 'gamma': 0.1204032666609073}. Best is trial 259 with value: -0.6258171477404484.
/bsuhome/alexanderemert/Research/Star-Formation-Research-Project-2026/pipeline/scripts/optuna/final_preds_and_models/optuna_search_mult_quant_reg.py:75: UserWarning: The distribution is specified by [0.1, 5] and step=0.25, but the range is not divisible by `step`. It will be replaced with [0.1, 4.85].
  error_threshold = trial.suggest_float("error_threshold", 0.1, 5, step=0.25)
[I 2026-07-21 13:47:36,846] Trial 262 finished with value: -0.6261484570988399 and parameters: {'error_threshold': 2.6, 'scalers': 'robust', 'ratios': 'log_ratio', 'imputers': 'mean', 'n_estimators': 2700, 'learning_rate': 0.0031809013481099487, 'max_depth': 3, 'min_child_weight': 6, 'subsample': 0.6, 'colsample_bytree': 0.7, 'colsample_bylevel': 0.5, 'reg_alpha': 0.01614553048143945, 'reg_lambda': 9.450708946399742e-06, 'gamma': 0.1409917415839559}. Best is trial 259 with value: -0.6258171477404484.
/bsuhome/alexanderemert/Research/Star-Formation-Research-Project-2026/pipeline/scripts/optuna/final_preds_and_models/optuna_search_mult_quant_reg.py:75: UserWarning: The distribution is specified by [0.1, 5] and step=0.25, but the range is not divisible by `step`. It will be replaced with [0.1, 4.85].
  error_threshold = trial.suggest_float("error_threshold", 0.1, 5, step=0.25)
[I 2026-07-21 13:47:46,567] Trial 263 finished with value: -0.6261038160857082 and parameters: {'error_threshold': 4.6, 'scalers': 'robust', 'ratios': 'log_ratio', 'imputers': 'mean', 'n_estimators': 2700, 'learning_rate': 0.0032111339361689073, 'max_depth': 3, 'min_child_weight': 6, 'subsample': 0.6, 'colsample_bytree': 0.7, 'colsample_bylevel': 0.5, 'reg_alpha': 0.015020644345023145, 'reg_lambda': 5.800088157838878e-05, 'gamma': 0.13706566203267564}. Best is trial 259 with value: -0.6258171477404484.
/bsuhome/alexanderemert/Research/Star-Formation-Research-Project-2026/pipeline/scripts/optuna/final_preds_and_models/optuna_search_mult_quant_reg.py:75: UserWarning: The distribution is specified by [0.1, 5] and step=0.25, but the range is not divisible by `step`. It will be replaced with [0.1, 4.85].
  error_threshold = trial.suggest_float("error_threshold", 0.1, 5, step=0.25)
