[I 2026-07-21 09:36:45,080] Trial 71 finished with value: -0.1822252689317411 and parameters: {'error_threshold': 1.1, 'scalers': 'robust', 'ratios': 'log_ratio', 'imputers': 'median', 'n_estimators': 2400, 'learning_rate': 0.012686688689140224, 'max_depth': 4, 'min_child_weight': 2, 'subsample': 0.9, 'colsample_bytree': 0.9, 'colsample_bylevel': 0.8, 'reg_alpha': 0.17855794767039224, 'reg_lambda': 2.446470366361805e-05, 'gamma': 0.16170007686760632}. Best is trial 35 with value: -0.18163929183600333.
/bsuhome/alexanderemert/Research/Star-Formation-Research-Project-2026/pipeline/scripts/optuna/final_preds_and_models/optuna_search_mult_quant_reg.py:75: UserWarning: The distribution is specified by [0.1, 5] and step=0.25, but the range is not divisible by `step`. It will be replaced with [0.1, 4.85].
  error_threshold = trial.suggest_float("error_threshold", 0.1, 5, step=0.25)
[I 2026-07-21 09:36:47,684] Trial 73 finished with value: -0.1843939618771541 and parameters: {'error_threshold': 1.6, 'scalers': 'robust', 'ratios': 'log_ratio', 'imputers': 'none', 'n_estimators': 2400, 'learning_rate': 0.011802771462654581, 'max_depth': 5, 'min_child_weight': 2, 'subsample': 0.9, 'colsample_bytree': 0.7, 'colsample_bylevel': 0.8, 'reg_alpha': 0.09869551024061336, 'reg_lambda': 2.6954909535614745e-05, 'gamma': 0.15904843723002293}. Best is trial 35 with value: -0.18163929183600333.
/bsuhome/alexanderemert/Research/Star-Formation-Research-Project-2026/pipeline/scripts/optuna/final_preds_and_models/optuna_search_mult_quant_reg.py:75: UserWarning: The distribution is specified by [0.1, 5] and step=0.25, but the range is not divisible by `step`. It will be replaced with [0.1, 4.85].
  error_threshold = trial.suggest_float("error_threshold", 0.1, 5, step=0.25)
[I 2026-07-21 09:36:49,398] Trial 74 finished with value: -0.18385154039635002 and parameters: {'error_threshold': 1.1, 'scalers': 'robust', 'ratios': 'log_ratio', 'imputers': 'none', 'n_estimators': 2450, 'learning_rate': 0.02139075967893325, 'max_depth': 5, 'min_child_weight': 2, 'subsample': 0.9, 'colsample_bytree': 0.7, 'colsample_bylevel': 0.5, 'reg_alpha': 0.10566620579253541, 'reg_lambda': 1.2757195949038829, 'gamma': 0.20515042271054143}. Best is trial 35 with value: -0.18163929183600333.
/bsuhome/alexanderemert/Research/Star-Formation-Research-Project-2026/pipeline/scripts/optuna/final_preds_and_models/optuna_search_mult_quant_reg.py:75: UserWarning: The distribution is specified by [0.1, 5] and step=0.25, but the range is not divisible by `step`. It will be replaced with [0.1, 4.85].
  error_threshold = trial.suggest_float("error_threshold", 0.1, 5, step=0.25)
[I 2026-07-21 09:36:54,231] Trial 76 finished with value: -0.18177275818197966 and parameters: {'error_threshold': 1.1, 'scalers': 'none', 'ratios': 'log_ratio', 'imputers': 'median', 'n_estimators': 2400, 'learning_rate': 0.020854660935430584, 'max_depth': 3, 'min_child_weight': 3, 'subsample': 0.7, 'colsample_bytree': 1.0, 'colsample_bylevel': 0.5, 'reg_alpha': 0.175949641939355, 'reg_lambda': 0.00017818556998306398, 'gamma': 0.007689579375483048}. Best is trial 35 with value: -0.18163929183600333.
/bsuhome/alexanderemert/Research/Star-Formation-Research-Project-2026/pipeline/scripts/optuna/final_preds_and_models/optuna_search_mult_quant_reg.py:75: UserWarning: The distribution is specified by [0.1, 5] and step=0.25, but the range is not divisible by `step`. It will be replaced with [0.1, 4.85].
  error_threshold = trial.suggest_float("error_threshold", 0.1, 5, step=0.25)
[I 2026-07-21 09:36:59,080] Trial 75 finished with value: -0.18522553210799433 and parameters: {'error_threshold': 4.1, 'scalers': 'robust', 'ratios': 'log_ratio', 'imputers': 'median', 'n_estimators': 2400, 'learning_rate': 0.011859870558907316, 'max_depth': 5, 'min_child_weight': 2, 'subsample': 0.7, 'colsample_bytree': 1.0, 'colsample_bylevel': 0.9, 'reg_alpha': 3.402172625600386, 'reg_lambda': 0.00016900795073266817, 'gamma': 0.0007959031689874148}. Best is trial 35 with value: -0.18163929183600333.
/bsuhome/alexanderemert/Research/Star-Formation-Research-Project-2026/pipeline/scripts/optuna/final_preds_and_models/optuna_search_mult_quant_reg.py:75: UserWarning: The distribution is specified by [0.1, 5] and step=0.25, but the range is not divisible by `step`. It will be replaced with [0.1, 4.85].
  error_threshold = trial.suggest_float("error_threshold", 0.1, 5, step=0.25)
[I 2026-07-21 09:37:02,629] Trial 77 finished with value: -0.18319350645292332 and parameters: {'error_threshold': 1.1, 'scalers': 'none', 'ratios': 'log_ratio', 'imputers': 'median', 'n_estimators': 250, 'learning_rate': 0.02259092555282878, 'max_depth': 3, 'min_child_weight': 2, 'subsample': 0.7, 'colsample_bytree': 1.0, 'colsample_bylevel': 0.9, 'reg_alpha': 0.14877047031497534, 'reg_lambda': 0.09404798013497152, 'gamma': 0.008041379741526014}. Best is trial 35 with value: -0.18163929183600333.
/bsuhome/alexanderemert/Research/Star-Formation-Research-Project-2026/pipeline/scripts/optuna/final_preds_and_models/optuna_search_mult_quant_reg.py:75: UserWarning: The distribution is specified by [0.1, 5] and step=0.25, but the range is not divisible by `step`. It will be replaced with [0.1, 4.85].
  error_threshold = trial.suggest_float("error_threshold", 0.1, 5, step=0.25)
[I 2026-07-21 09:37:30,625] Trial 78 finished with value: -0.18180314807068423 and parameters: {'error_threshold': 1.1, 'scalers': 'robust', 'ratios': 'log_ratio', 'imputers': 'none', 'n_estimators': 1950, 'learning_rate': 0.0212497412843467, 'max_depth': 3, 'min_child_weight': 2, 'subsample': 0.8, 'colsample_bytree': 1.0, 'colsample_bylevel': 0.9, 'reg_alpha': 0.1675077112335951, 'reg_lambda': 3.1040260644349603e-05, 'gamma': 0.008396675255153682}. Best is trial 35 with value: -0.18163929183600333.
/bsuhome/alexanderemert/Research/Star-Formation-Research-Project-2026/pipeline/scripts/optuna/final_preds_and_models/optuna_search_mult_quant_reg.py:75: UserWarning: The distribution is specified by [0.1, 5] and step=0.25, but the range is not divisible by `step`. It will be replaced with [0.1, 4.85].
  error_threshold = trial.suggest_float("error_threshold", 0.1, 5, step=0.25)
[I 2026-07-21 09:37:32,270] Trial 81 finished with value: -0.2125808624321687 and parameters: {'error_threshold': 1.1, 'scalers': 'robust', 'ratios': 'log_ratio', 'imputers': 'median', 'n_estimators': 500, 'learning_rate': 0.0033569542418494095, 'max_depth': 3, 'min_child_weight': 2, 'subsample': 0.8, 'colsample_bytree': 1.0, 'colsample_bylevel': 0.9, 'reg_alpha': 0.2238527761207958, 'reg_lambda': 5.838006744022128e-06, 'gamma': 0.003684088468250903}. Best is trial 35 with value: -0.18163929183600333.
/bsuhome/alexanderemert/Research/Star-Formation-Research-Project-2026/pipeline/scripts/optuna/final_preds_and_models/optuna_search_mult_quant_reg.py:75: UserWarning: The distribution is specified by [0.1, 5] and step=0.25, but the range is not divisible by `step`. It will be replaced with [0.1, 4.85].
  error_threshold = trial.suggest_float("error_threshold", 0.1, 5, step=0.25)
[I 2026-07-21 09:37:39,284] Trial 79 finished with value: -0.18206946652987108 and parameters: {'error_threshold': 1.1, 'scalers': 'robust', 'ratios': 'log_ratio', 'imputers': 'median', 'n_estimators': 2800, 'learning_rate': 0.02066546487193212, 'max_depth': 3, 'min_child_weight': 2, 'subsample': 0.8, 'colsample_bytree': 1.0, 'colsample_bylevel': 0.9, 'reg_alpha': 0.17533914383433913, 'reg_lambda': 0.11534789897866048, 'gamma': 0.010591570753277785}. Best is trial 35 with value: -0.18163929183600333.
/bsuhome/alexanderemert/Research/Star-Formation-Research-Project-2026/pipeline/scripts/optuna/final_preds_and_models/optuna_search_mult_quant_reg.py:75: UserWarning: The distribution is specified by [0.1, 5] and step=0.25, but the range is not divisible by `step`. It will be replaced with [0.1, 4.85].
  error_threshold = trial.suggest_float("error_threshold", 0.1, 5, step=0.25)
[I 2026-07-21 09:37:42,332] Trial 80 finished with value: -0.18058446388775626 and parameters: {'error_threshold': 1.1, 'scalers': 'robust', 'ratios': 'log_ratio', 'imputers': 'median', 'n_estimators': 2450, 'learning_rate': 0.007056492248392825, 'max_depth': 3, 'min_child_weight': 2, 'subsample': 0.8, 'colsample_bytree': 1.0, 'colsample_bylevel': 0.9, 'reg_alpha': 0.06733246101392652, 'reg_lambda': 4.76912381939262e-06, 'gamma': 0.008448212545741372}. Best is trial 80 with value: -0.18058446388775626.
/bsuhome/alexanderemert/Research/Star-Formation-Research-Project-2026/pipeline/scripts/optuna/final_preds_and_models/optuna_search_mult_quant_reg.py:75: UserWarning: The distribution is specified by [0.1, 5] and step=0.25, but the range is not divisible by `step`. It will be replaced with [0.1, 4.85].
  error_threshold = trial.suggest_float("error_threshold", 0.1, 5, step=0.25)
[I 2026-07-21 09:37:43,051] Trial 84 finished with value: -0.1862656983283402 and parameters: {'error_threshold': 0.6, 'scalers': 'none', 'ratios': 'log_ratio', 'imputers': 'median', 'n_estimators': 250, 'learning_rate': 0.18805187343471805, 'max_depth': 3, 'min_child_weight': 3, 'subsample': 0.7, 'colsample_bytree': 1.0, 'colsample_bylevel': 0.8, 'reg_alpha': 0.004598765066568479, 'reg_lambda': 4.809192420438974e-06, 'gamma': 0.008392378673807838}. Best is trial 80 with value: -0.18058446388775626.
/bsuhome/alexanderemert/Research/Star-Formation-Research-Project-2026/pipeline/scripts/optuna/final_preds_and_models/optuna_search_mult_quant_reg.py:75: UserWarning: The distribution is specified by [0.1, 5] and step=0.25, but the range is not divisible by `step`. It will be replaced with [0.1, 4.85].
  error_threshold = trial.suggest_float("error_threshold", 0.1, 5, step=0.25)
[I 2026-07-21 09:37:46,570] Trial 82 finished with value: -0.18264356851559008 and parameters: {'error_threshold': 1.1, 'scalers': 'none', 'ratios': 'log_ratio', 'imputers': 'median', 'n_estimators': 2750, 'learning_rate': 0.01874846107353028, 'max_depth': 3, 'min_child_weight': 2, 'subsample': 0.8, 'colsample_bytree': 1.0, 'colsample_bylevel': 0.9, 'reg_alpha': 0.25410744329253976, 'reg_lambda': 4.58486867849748e-06, 'gamma': 0.0086351839532561}. Best is trial 80 with value: -0.18058446388775626.
/bsuhome/alexanderemert/Research/Star-Formation-Research-Project-2026/pipeline/scripts/optuna/final_preds_and_models/optuna_search_mult_quant_reg.py:75: UserWarning: The distribution is specified by [0.1, 5] and step=0.25, but the range is not divisible by `step`. It will be replaced with [0.1, 4.85].
  error_threshold = trial.suggest_float("error_threshold", 0.1, 5, step=0.25)
[I 2026-07-21 09:37:47,241] Trial 85 finished with value: -0.18801691750874952 and parameters: {'error_threshold': 1.6, 'scalers': 'none', 'ratios': 'log_ratio', 'imputers': 'median', 'n_estimators': 500, 'learning_rate': 0.16692612592753758, 'max_depth': 3, 'min_child_weight': 3, 'subsample': 0.7, 'colsample_bytree': 1.0, 'colsample_bylevel': 0.9, 'reg_alpha': 0.0061776503127432695, 'reg_lambda': 0.11036702974080342, 'gamma': 0.008687642348919047}. Best is trial 80 with value: -0.18058446388775626.
/bsuhome/alexanderemert/Research/Star-Formation-Research-Project-2026/pipeline/scripts/optuna/final_preds_and_models/optuna_search_mult_quant_reg.py:75: UserWarning: The distribution is specified by [0.1, 5] and step=0.25, but the range is not divisible by `step`. It will be replaced with [0.1, 4.85].
  error_threshold = trial.suggest_float("error_threshold", 0.1, 5, step=0.25)
[I 2026-07-21 09:37:50,816] Trial 83 finished with value: -0.18231306164929043 and parameters: {'error_threshold': 0.6, 'scalers': 'none', 'ratios': 'log_ratio', 'imputers': 'median', 'n_estimators': 2750, 'learning_rate': 0.020946468026780345, 'max_depth': 3, 'min_child_weight': 3, 'subsample': 0.7, 'colsample_bytree': 1.0, 'colsample_bylevel': 0.9, 'reg_alpha': 0.006442045832946822, 'reg_lambda': 3.7486197627949856e-06, 'gamma': 0.00790822823318042}. Best is trial 80 with value: -0.18058446388775626.
/bsuhome/alexanderemert/Research/Star-Formation-Research-Project-2026/pipeline/scripts/optuna/final_preds_and_models/optuna_search_mult_quant_reg.py:75: UserWarning: The distribution is specified by [0.1, 5] and step=0.25, but the range is not divisible by `step`. It will be replaced with [0.1, 4.85].
  error_threshold = trial.suggest_float("error_threshold", 0.1, 5, step=0.25)
[I 2026-07-21 09:38:08,944] Trial 86 finished with value: -0.18443755210435606 and parameters: {'error_threshold': 1.1, 'scalers': 'none', 'ratios': 'log_ratio', 'imputers': 'median', 'n_estimators': 250, 'learning_rate': 0.019554325965990577, 'max_depth': 3, 'min_child_weight': 2, 'subsample': 0.7, 'colsample_bytree': 1.0, 'colsample_bylevel': 0.9, 'reg_alpha': 0.0063187941411902565, 'reg_lambda': 0.15037272411106303, 'gamma': 0.009937650299324833}. Best is trial 80 with value: -0.18058446388775626.
/bsuhome/alexanderemert/Research/Star-Formation-Research-Project-2026/pipeline/scripts/optuna/final_preds_and_models/optuna_search_mult_quant_reg.py:75: UserWarning: The distribution is specified by [0.1, 5] and step=0.25, but the range is not divisible by `step`. It will be replaced with [0.1, 4.85].
  error_threshold = trial.suggest_float("error_threshold", 0.1, 5, step=0.25)
[I 2026-07-21 09:38:12,974] Trial 87 finished with value: -0.1835356054159294 and parameters: {'error_threshold': 1.1, 'scalers': 'none', 'ratios': 'log_ratio', 'imputers': 'median', 'n_estimators': 250, 'learning_rate': 0.020859109868904054, 'max_depth': 3, 'min_child_weight': 3, 'subsample': 0.7, 'colsample_bytree': 1.0, 'colsample_bylevel': 0.9, 'reg_alpha': 0.0051970861140557744, 'reg_lambda': 0.16809021281258263, 'gamma': 0.008695588498245735}. Best is trial 80 with value: -0.18058446388775626.
/bsuhome/alexanderemert/Research/Star-Formation-Research-Project-2026/pipeline/scripts/optuna/final_preds_and_models/optuna_search_mult_quant_reg.py:75: UserWarning: The distribution is specified by [0.1, 5] and step=0.25, but the range is not divisible by `step`. It will be replaced with [0.1, 4.85].
  error_threshold = trial.suggest_float("error_threshold", 0.1, 5, step=0.25)
[I 2026-07-21 09:38:20,530] Trial 89 finished with value: -0.18487278331472412 and parameters: {'error_threshold': 1.1, 'scalers': 'none', 'ratios': 'log_ratio', 'imputers': 'median', 'n_estimators': 250, 'learning_rate': 0.019077045160030243, 'max_depth': 3, 'min_child_weight': 3, 'subsample': 0.7, 'colsample_bytree': 1.0, 'colsample_bylevel': 0.9, 'reg_alpha': 0.04895902778860679, 'reg_lambda': 0.23935290683232752, 'gamma': 0.00851340052693678}. Best is trial 80 with value: -0.18058446388775626.
/bsuhome/alexanderemert/Research/Star-Formation-Research-Project-2026/pipeline/scripts/optuna/final_preds_and_models/optuna_search_mult_quant_reg.py:75: UserWarning: The distribution is specified by [0.1, 5] and step=0.25, but the range is not divisible by `step`. It will be replaced with [0.1, 4.85].
  error_threshold = trial.suggest_float("error_threshold", 0.1, 5, step=0.25)
[I 2026-07-21 09:38:34,385] Trial 88 finished with value: -0.1823463700793999 and parameters: {'error_threshold': 1.6, 'scalers': 'none', 'ratios': 'log_ratio', 'imputers': 'median', 'n_estimators': 2750, 'learning_rate': 0.021269269853053347, 'max_depth': 3, 'min_child_weight': 3, 'subsample': 0.7, 'colsample_bytree': 1.0, 'colsample_bylevel': 0.9, 'reg_alpha': 0.03425744841070639, 'reg_lambda': 0.0720390951902967, 'gamma': 0.008216914131877903}. Best is trial 80 with value: -0.18058446388775626.
/bsuhome/alexanderemert/Research/Star-Formation-Research-Project-2026/pipeline/scripts/optuna/final_preds_and_models/optuna_search_mult_quant_reg.py:75: UserWarning: The distribution is specified by [0.1, 5] and step=0.25, but the range is not divisible by `step`. It will be replaced with [0.1, 4.85].
  error_threshold = trial.suggest_float("error_threshold", 0.1, 5, step=0.25)
[I 2026-07-21 09:38:41,181] Trial 90 finished with value: -0.1816108870117117 and parameters: {'error_threshold': 1.1, 'scalers': 'none', 'ratios': 'log_ratio', 'imputers': 'median', 'n_estimators': 2750, 'learning_rate': 0.020316202626530472, 'max_depth': 3, 'min_child_weight': 3, 'subsample': 0.7, 'colsample_bytree': 1.0, 'colsample_bylevel': 0.9, 'reg_alpha': 0.05155245961193355, 'reg_lambda': 0.11660794587417454, 'gamma': 0.0067502270275964825}. Best is trial 80 with value: -0.18058446388775626.
/bsuhome/alexanderemert/Research/Star-Formation-Research-Project-2026/pipeline/scripts/optuna/final_preds_and_models/optuna_search_mult_quant_reg.py:75: UserWarning: The distribution is specified by [0.1, 5] and step=0.25, but the range is not divisible by `step`. It will be replaced with [0.1, 4.85].
  error_threshold = trial.suggest_float("error_threshold", 0.1, 5, step=0.25)
[I 2026-07-21 09:38:44,506] Trial 91 finished with value: -0.18231578374305055 and parameters: {'error_threshold': 1.6, 'scalers': 'none', 'ratios': 'log_ratio', 'imputers': 'median', 'n_estimators': 2700, 'learning_rate': 0.02205011950389667, 'max_depth': 3, 'min_child_weight': 3, 'subsample': 0.8, 'colsample_bytree': 1.0, 'colsample_bylevel': 0.9, 'reg_alpha': 0.056361511173883265, 'reg_lambda': 9.37274026841223e-05, 'gamma': 0.0030007982469680973}. Best is trial 80 with value: -0.18058446388775626.
/bsuhome/alexanderemert/Research/Star-Formation-Research-Project-2026/pipeline/scripts/optuna/final_preds_and_models/optuna_search_mult_quant_reg.py:75: UserWarning: The distribution is specified by [0.1, 5] and step=0.25, but the range is not divisible by `step`. It will be replaced with [0.1, 4.85].
  error_threshold = trial.suggest_float("error_threshold", 0.1, 5, step=0.25)
[I 2026-07-21 09:38:51,421] Trial 92 finished with value: -0.1827548413507386 and parameters: {'error_threshold': 0.35, 'scalers': 'none', 'ratios': 'log_ratio', 'imputers': 'median', 'n_estimators': 2750, 'learning_rate': 0.020958042569705727, 'max_depth': 3, 'min_child_weight': 3, 'subsample': 0.8, 'colsample_bytree': 1.0, 'colsample_bylevel': 0.9, 'reg_alpha': 0.041614851760375715, 'reg_lambda': 3.732876901270355e-06, 'gamma': 0.0027947499375982014}. Best is trial 80 with value: -0.18058446388775626.
/bsuhome/alexanderemert/Research/Star-Formation-Research-Project-2026/pipeline/scripts/optuna/final_preds_and_models/optuna_search_mult_quant_reg.py:75: UserWarning: The distribution is specified by [0.1, 5] and step=0.25, but the range is not divisible by `step`. It will be replaced with [0.1, 4.85].
  error_threshold = trial.suggest_float("error_threshold", 0.1, 5, step=0.25)
[I 2026-07-21 09:38:54,689] Trial 93 finished with value: -0.18151461729487894 and parameters: {'error_threshold': 0.35, 'scalers': 'none', 'ratios': 'norm_ratio', 'imputers': 'median', 'n_estimators': 2700, 'learning_rate': 0.014864426675368112, 'max_depth': 3, 'min_child_weight': 3, 'subsample': 0.7, 'colsample_bytree': 1.0, 'colsample_bylevel': 0.9, 'reg_alpha': 0.0420539538846639, 'reg_lambda': 3.3189746871612345e-06, 'gamma': 0.003218353934185592}. Best is trial 80 with value: -0.18058446388775626.
/bsuhome/alexanderemert/Research/Star-Formation-Research-Project-2026/pipeline/scripts/optuna/final_preds_and_models/optuna_search_mult_quant_reg.py:75: UserWarning: The distribution is specified by [0.1, 5] and step=0.25, but the range is not divisible by `step`. It will be replaced with [0.1, 4.85].
  error_threshold = trial.suggest_float("error_threshold", 0.1, 5, step=0.25)
[I 2026-07-21 09:39:25,537] Trial 94 finished with value: -0.1857056295680752 and parameters: {'error_threshold': 0.35, 'scalers': 'none', 'ratios': 'norm_ratio', 'imputers': 'median', 'n_estimators': 2750, 'learning_rate': 0.044372110676060214, 'max_depth': 3, 'min_child_weight': 3, 'subsample': 0.8, 'colsample_bytree': 1.0, 'colsample_bylevel': 0.9, 'reg_alpha': 0.050407982185090516, 'reg_lambda': 3.2314666368460013e-06, 'gamma': 0.002857891262058341}. Best is trial 80 with value: -0.18058446388775626.
/bsuhome/alexanderemert/Research/Star-Formation-Research-Project-2026/pipeline/scripts/optuna/final_preds_and_models/optuna_search_mult_quant_reg.py:75: UserWarning: The distribution is specified by [0.1, 5] and step=0.25, but the range is not divisible by `step`. It will be replaced with [0.1, 4.85].
  error_threshold = trial.suggest_float("error_threshold", 0.1, 5, step=0.25)
[I 2026-07-21 09:39:32,611] Trial 95 finished with value: -0.18183991824921505 and parameters: {'error_threshold': 0.85, 'scalers': 'none', 'ratios': 'norm_ratio', 'imputers': 'median', 'n_estimators': 2800, 'learning_rate': 0.015181930870344541, 'max_depth': 3, 'min_child_weight': 3, 'subsample': 0.8, 'colsample_bytree': 1.0, 'colsample_bylevel': 0.9, 'reg_alpha': 0.051719236022028006, 'reg_lambda': 3.997125688820852e-06, 'gamma': 0.0010752380077339214}. Best is trial 80 with value: -0.18058446388775626.
/bsuhome/alexanderemert/Research/Star-Formation-Research-Project-2026/pipeline/scripts/optuna/final_preds_and_models/optuna_search_mult_quant_reg.py:75: UserWarning: The distribution is specified by [0.1, 5] and step=0.25, but the range is not divisible by `step`. It will be replaced with [0.1, 4.85].
  error_threshold = trial.suggest_float("error_threshold", 0.1, 5, step=0.25)
