[I 2026-07-21 10:16:18,072] Trial 312 finished with value: -0.17943063398590983 and parameters: {'error_threshold': 3.6, 'scalers': 'standard', 'ratios': 'norm_ratio', 'imputers': 'none', 'n_estimators': 2300, 'learning_rate': 0.006258177611010989, 'max_depth': 3, 'min_child_weight': 4, 'subsample': 0.5, 'colsample_bytree': 1.0, 'colsample_bylevel': 1.0, 'reg_alpha': 6.266652532380258e-05, 'reg_lambda': 0.003918291304101803, 'gamma': 1.7352014549051985e-05}. Best is trial 254 with value: -0.17915665564650896.
[I 2026-07-21 10:16:20,795] Trial 313 finished with value: -0.1792082347896515 and parameters: {'error_threshold': 3.6, 'scalers': 'standard', 'ratios': 'norm_ratio', 'imputers': 'mean', 'n_estimators': 2300, 'learning_rate': 0.0064049076319185015, 'max_depth': 3, 'min_child_weight': 4, 'subsample': 0.5, 'colsample_bytree': 1.0, 'colsample_bylevel': 1.0, 'reg_alpha': 9.207630237096585e-05, 'reg_lambda': 0.003651734644597628, 'gamma': 2.06771788875719e-05}. Best is trial 254 with value: -0.17915665564650896.
[I 2026-07-21 10:16:40,158] Trial 315 finished with value: -0.1794987359075202 and parameters: {'error_threshold': 3.6, 'scalers': 'standard', 'ratios': 'norm_ratio', 'imputers': 'none', 'n_estimators': 2300, 'learning_rate': 0.005589968413673629, 'max_depth': 3, 'min_child_weight': 4, 'subsample': 0.5, 'colsample_bytree': 1.0, 'colsample_bylevel': 1.0, 'reg_alpha': 0.0003681290977245489, 'reg_lambda': 0.003981836736735179, 'gamma': 1.8540998795527986e-05}. Best is trial 254 with value: -0.17915665564650896.
[I 2026-07-21 10:17:13,243] Trial 316 finished with value: -0.17919314946686385 and parameters: {'error_threshold': 3.6, 'scalers': 'standard', 'ratios': 'norm_ratio', 'imputers': 'mean', 'n_estimators': 2300, 'learning_rate': 0.006171924951782659, 'max_depth': 3, 'min_child_weight': 5, 'subsample': 0.5, 'colsample_bytree': 1.0, 'colsample_bylevel': 1.0, 'reg_alpha': 0.00011266039002962732, 'reg_lambda': 0.0036396868041800056, 'gamma': 3.6406140503615656e-05}. Best is trial 254 with value: -0.17915665564650896.
[I 2026-07-21 10:17:15,919] Trial 317 finished with value: -0.1793787201419957 and parameters: {'error_threshold': 3.6, 'scalers': 'standard', 'ratios': 'norm_ratio', 'imputers': 'mean', 'n_estimators': 2300, 'learning_rate': 0.006104464603834951, 'max_depth': 3, 'min_child_weight': 4, 'subsample': 0.5, 'colsample_bytree': 1.0, 'colsample_bylevel': 1.0, 'reg_alpha': 0.000468175695358145, 'reg_lambda': 0.0038096588155333688, 'gamma': 4.288374895131233e-05}. Best is trial 254 with value: -0.17915665564650896.
[I 2026-07-21 10:17:20,923] Trial 318 finished with value: -0.17925129672861337 and parameters: {'error_threshold': 3.6, 'scalers': 'standard', 'ratios': 'norm_ratio', 'imputers': 'none', 'n_estimators': 2300, 'learning_rate': 0.006241948692111303, 'max_depth': 3, 'min_child_weight': 5, 'subsample': 0.5, 'colsample_bytree': 1.0, 'colsample_bylevel': 1.0, 'reg_alpha': 0.00048144766469455377, 'reg_lambda': 0.0036156662175667064, 'gamma': 3.5989772119384655e-05}. Best is trial 254 with value: -0.17915665564650896.
[I 2026-07-21 10:17:23,079] Trial 319 finished with value: -0.17932615319294223 and parameters: {'error_threshold': 3.6, 'scalers': 'standard', 'ratios': 'norm_ratio', 'imputers': 'none', 'n_estimators': 2300, 'learning_rate': 0.005988726574508876, 'max_depth': 3, 'min_child_weight': 5, 'subsample': 0.5, 'colsample_bytree': 0.6, 'colsample_bylevel': 1.0, 'reg_alpha': 0.0001920671813804448, 'reg_lambda': 0.0040810063040068135, 'gamma': 3.4211854398823584e-05}. Best is trial 254 with value: -0.17915665564650896.
[I 2026-07-21 10:17:42,888] Trial 314 finished with value: -0.20034025922883436 and parameters: {'error_threshold': 3.6, 'scalers': 'standard', 'ratios': 'norm_ratio', 'imputers': 'none', 'n_estimators': 2300, 'learning_rate': 0.0061442594567297296, 'max_depth': 12, 'min_child_weight': 4, 'subsample': 0.5, 'colsample_bytree': 1.0, 'colsample_bylevel': 1.0, 'reg_alpha': 8.069776115250682e-05, 'reg_lambda': 0.004048863847183704, 'gamma': 1.7778485438455978e-05}. Best is trial 254 with value: -0.17915665564650896.
[I 2026-07-21 10:17:42,894] Using an existing study with name 'mean_study_7_20_26' instead of creating a new one.
/bsuhome/alexanderemert/Research/Star-Formation-Research-Project-2026/pipeline/scripts/optuna/final_preds_and_models/optuna_search_mult_quant_reg.py:161: UserWarning: The distribution is specified by [0.1, 5] and step=0.25, but the range is not divisible by `step`. It will be replaced with [0.1, 4.85].
  error_threshold = trial.suggest_float("error_threshold", 0.1, 5, step=0.25)
[I 2026-07-21 10:17:48,718] Trial 246 finished with value: -1.0252957502059643 and parameters: {'error_threshold': 3.35, 'scalers': 'none', 'ratios': 'norm_ratio', 'imputers': 'none', 'n_estimators': 3000, 'learning_rate': 0.003667108309513554, 'max_depth': 3, 'min_child_weight': 3, 'subsample': 0.6, 'colsample_bytree': 0.5, 'colsample_bylevel': 0.9, 'reg_alpha': 0.0002468169108773562, 'reg_lambda': 7.748483670117532e-06, 'gamma': 2.5357206023367605e-06}. Best is trial 217 with value: -1.0247384784192415.
/bsuhome/alexanderemert/Research/Star-Formation-Research-Project-2026/pipeline/scripts/optuna/final_preds_and_models/optuna_search_mult_quant_reg.py:161: UserWarning: The distribution is specified by [0.1, 5] and step=0.25, but the range is not divisible by `step`. It will be replaced with [0.1, 4.85].
  error_threshold = trial.suggest_float("error_threshold", 0.1, 5, step=0.25)
[I 2026-07-21 10:17:50,786] Trial 240 finished with value: -1.0253682085755793 and parameters: {'error_threshold': 3.35, 'scalers': 'none', 'ratios': 'norm_ratio', 'imputers': 'none', 'n_estimators': 3000, 'learning_rate': 0.0037385250603948167, 'max_depth': 3, 'min_child_weight': 3, 'subsample': 0.6, 'colsample_bytree': 0.5, 'colsample_bylevel': 0.9, 'reg_alpha': 6.203579154759121e-05, 'reg_lambda': 8.286559566916108e-06, 'gamma': 1.0105889093594238e-06}. Best is trial 217 with value: -1.0247384784192415.
/bsuhome/alexanderemert/Research/Star-Formation-Research-Project-2026/pipeline/scripts/optuna/final_preds_and_models/optuna_search_mult_quant_reg.py:161: UserWarning: The distribution is specified by [0.1, 5] and step=0.25, but the range is not divisible by `step`. It will be replaced with [0.1, 4.85].
  error_threshold = trial.suggest_float("error_threshold", 0.1, 5, step=0.25)
[I 2026-07-21 10:17:52,827] Trial 245 finished with value: -1.025589270421466 and parameters: {'error_threshold': 3.35, 'scalers': 'none', 'ratios': 'norm_ratio', 'imputers': 'none', 'n_estimators': 3000, 'learning_rate': 0.0036327285486395977, 'max_depth': 3, 'min_child_weight': 3, 'subsample': 0.6, 'colsample_bytree': 0.5, 'colsample_bylevel': 0.9, 'reg_alpha': 0.00023794246047664604, 'reg_lambda': 8.213574968739047e-06, 'gamma': 2.5612431611594746e-06}. Best is trial 217 with value: -1.0247384784192415.
/bsuhome/alexanderemert/Research/Star-Formation-Research-Project-2026/pipeline/scripts/optuna/final_preds_and_models/optuna_search_mult_quant_reg.py:161: UserWarning: The distribution is specified by [0.1, 5] and step=0.25, but the range is not divisible by `step`. It will be replaced with [0.1, 4.85].
  error_threshold = trial.suggest_float("error_threshold", 0.1, 5, step=0.25)
[I 2026-07-21 10:17:54,877] Trial 244 finished with value: -1.0256307182378086 and parameters: {'error_threshold': 3.35, 'scalers': 'none', 'ratios': 'norm_ratio', 'imputers': 'none', 'n_estimators': 3000, 'learning_rate': 0.003602367802488449, 'max_depth': 3, 'min_child_weight': 3, 'subsample': 0.6, 'colsample_bytree': 0.5, 'colsample_bylevel': 0.9, 'reg_alpha': 7.062505654716206e-05, 'reg_lambda': 8.656630582813918e-06, 'gamma': 2.2727127501565242e-06}. Best is trial 217 with value: -1.0247384784192415.
/bsuhome/alexanderemert/Research/Star-Formation-Research-Project-2026/pipeline/scripts/optuna/final_preds_and_models/optuna_search_mult_quant_reg.py:161: UserWarning: The distribution is specified by [0.1, 5] and step=0.25, but the range is not divisible by `step`. It will be replaced with [0.1, 4.85].
  error_threshold = trial.suggest_float("error_threshold", 0.1, 5, step=0.25)
[I 2026-07-21 10:17:56,927] Trial 242 finished with value: -1.025259665444115 and parameters: {'error_threshold': 3.35, 'scalers': 'none', 'ratios': 'norm_ratio', 'imputers': 'none', 'n_estimators': 3000, 'learning_rate': 0.0036800734109067247, 'max_depth': 3, 'min_child_weight': 3, 'subsample': 0.6, 'colsample_bytree': 0.5, 'colsample_bylevel': 0.9, 'reg_alpha': 3.8445025513372084e-05, 'reg_lambda': 7.440121677842052e-06, 'gamma': 1.024103000281712e-06}. Best is trial 217 with value: -1.0247384784192415.
/bsuhome/alexanderemert/Research/Star-Formation-Research-Project-2026/pipeline/scripts/optuna/final_preds_and_models/optuna_search_mult_quant_reg.py:161: UserWarning: The distribution is specified by [0.1, 5] and step=0.25, but the range is not divisible by `step`. It will be replaced with [0.1, 4.85].
  error_threshold = trial.suggest_float("error_threshold", 0.1, 5, step=0.25)
[I 2026-07-21 10:17:58,969] Trial 241 finished with value: -1.0256251483063341 and parameters: {'error_threshold': 3.35, 'scalers': 'none', 'ratios': 'norm_ratio', 'imputers': 'none', 'n_estimators': 3000, 'learning_rate': 0.0036220174721470016, 'max_depth': 3, 'min_child_weight': 3, 'subsample': 0.6, 'colsample_bytree': 0.5, 'colsample_bylevel': 0.9, 'reg_alpha': 7.007808731556383e-05, 'reg_lambda': 7.432716448273402e-06, 'gamma': 2.191734394024579e-06}. Best is trial 217 with value: -1.0247384784192415.
/bsuhome/alexanderemert/Research/Star-Formation-Research-Project-2026/pipeline/scripts/optuna/final_preds_and_models/optuna_search_mult_quant_reg.py:161: UserWarning: The distribution is specified by [0.1, 5] and step=0.25, but the range is not divisible by `step`. It will be replaced with [0.1, 4.85].
  error_threshold = trial.suggest_float("error_threshold", 0.1, 5, step=0.25)
[I 2026-07-21 10:18:01,039] Trial 247 finished with value: -1.0258104605410125 and parameters: {'error_threshold': 3.35, 'scalers': 'none', 'ratios': 'norm_ratio', 'imputers': 'none', 'n_estimators': 3000, 'learning_rate': 0.003583029991430564, 'max_depth': 3, 'min_child_weight': 3, 'subsample': 0.6, 'colsample_bytree': 0.5, 'colsample_bylevel': 0.9, 'reg_alpha': 0.0002485816330981991, 'reg_lambda': 8.47034073803977e-06, 'gamma': 2.272464585366935e-06}. Best is trial 217 with value: -1.0247384784192415.
/bsuhome/alexanderemert/Research/Star-Formation-Research-Project-2026/pipeline/scripts/optuna/final_preds_and_models/optuna_search_mult_quant_reg.py:161: UserWarning: The distribution is specified by [0.1, 5] and step=0.25, but the range is not divisible by `step`. It will be replaced with [0.1, 4.85].
  error_threshold = trial.suggest_float("error_threshold", 0.1, 5, step=0.25)
[I 2026-07-21 10:18:03,100] Trial 243 finished with value: -1.025337466561491 and parameters: {'error_threshold': 3.35, 'scalers': 'none', 'ratios': 'norm_ratio', 'imputers': 'none', 'n_estimators': 3000, 'learning_rate': 0.003709510494615753, 'max_depth': 3, 'min_child_weight': 3, 'subsample': 0.6, 'colsample_bytree': 0.5, 'colsample_bylevel': 0.9, 'reg_alpha': 2.5948646792658914e-05, 'reg_lambda': 7.896771873229102e-06, 'gamma': 1.016405480380621e-06}. Best is trial 217 with value: -1.0247384784192415.
/bsuhome/alexanderemert/Research/Star-Formation-Research-Project-2026/pipeline/scripts/optuna/final_preds_and_models/optuna_search_mult_quant_reg.py:161: UserWarning: The distribution is specified by [0.1, 5] and step=0.25, but the range is not divisible by `step`. It will be replaced with [0.1, 4.85].
  error_threshold = trial.suggest_float("error_threshold", 0.1, 5, step=0.25)
[I 2026-07-21 10:18:05,182] Trial 248 finished with value: -1.0268678425038729 and parameters: {'error_threshold': 3.35, 'scalers': 'none', 'ratios': 'norm_ratio', 'imputers': 'none', 'n_estimators': 3000, 'learning_rate': 0.0030832633340267326, 'max_depth': 3, 'min_child_weight': 3, 'subsample': 0.6, 'colsample_bytree': 0.5, 'colsample_bylevel': 0.9, 'reg_alpha': 0.00023601631524522665, 'reg_lambda': 8.503926065833375e-06, 'gamma': 2.241240506369166e-06}. Best is trial 217 with value: -1.0247384784192415.
/bsuhome/alexanderemert/Research/Star-Formation-Research-Project-2026/pipeline/scripts/optuna/final_preds_and_models/optuna_search_mult_quant_reg.py:161: UserWarning: The distribution is specified by [0.1, 5] and step=0.25, but the range is not divisible by `step`. It will be replaced with [0.1, 4.85].
  error_threshold = trial.suggest_float("error_threshold", 0.1, 5, step=0.25)
[I 2026-07-21 10:18:07,233] Trial 249 finished with value: -1.025814439196421 and parameters: {'error_threshold': 3.35, 'scalers': 'none', 'ratios': 'norm_ratio', 'imputers': 'none', 'n_estimators': 3000, 'learning_rate': 0.0035627172454099783, 'max_depth': 3, 'min_child_weight': 3, 'subsample': 0.6, 'colsample_bytree': 0.5, 'colsample_bylevel': 0.9, 'reg_alpha': 3.1469955189643425e-05, 'reg_lambda': 8.430792275878321e-06, 'gamma': 2.3711531645323943e-06}. Best is trial 217 with value: -1.0247384784192415.
/bsuhome/alexanderemert/Research/Star-Formation-Research-Project-2026/pipeline/scripts/optuna/final_preds_and_models/optuna_search_mult_quant_reg.py:161: UserWarning: The distribution is specified by [0.1, 5] and step=0.25, but the range is not divisible by `step`. It will be replaced with [0.1, 4.85].
  error_threshold = trial.suggest_float("error_threshold", 0.1, 5, step=0.25)
[I 2026-07-21 10:18:09,288] Trial 250 finished with value: -1.025632321767093 and parameters: {'error_threshold': 3.35, 'scalers': 'none', 'ratios': 'norm_ratio', 'imputers': 'none', 'n_estimators': 3000, 'learning_rate': 0.003647372964482955, 'max_depth': 3, 'min_child_weight': 3, 'subsample': 0.6, 'colsample_bytree': 0.5, 'colsample_bylevel': 0.9, 'reg_alpha': 3.416241604685966e-05, 'reg_lambda': 7.835129357796016e-06, 'gamma': 2.3140303091453643e-06}. Best is trial 217 with value: -1.0247384784192415.
/bsuhome/alexanderemert/Research/Star-Formation-Research-Project-2026/pipeline/scripts/optuna/final_preds_and_models/optuna_search_mult_quant_reg.py:161: UserWarning: The distribution is specified by [0.1, 5] and step=0.25, but the range is not divisible by `step`. It will be replaced with [0.1, 4.85].
  error_threshold = trial.suggest_float("error_threshold", 0.1, 5, step=0.25)
[I 2026-07-21 10:18:11,432] Trial 251 finished with value: -1.0338177227851955 and parameters: {'error_threshold': 3.35, 'scalers': 'none', 'ratios': 'norm_ratio', 'imputers': 'none', 'n_estimators': 3000, 'learning_rate': 0.0022317146815293474, 'max_depth': 3, 'min_child_weight': 3, 'subsample': 0.6, 'colsample_bytree': 0.5, 'colsample_bylevel': 0.9, 'reg_alpha': 6.348506132460084e-05, 'reg_lambda': 8.093003918740194e-06, 'gamma': 1.0168183922366648e-06}. Best is trial 217 with value: -1.0247384784192415.
/bsuhome/alexanderemert/Research/Star-Formation-Research-Project-2026/pipeline/scripts/optuna/final_preds_and_models/optuna_search_mult_quant_reg.py:161: UserWarning: The distribution is specified by [0.1, 5] and step=0.25, but the range is not divisible by `step`. It will be replaced with [0.1, 4.85].
  error_threshold = trial.suggest_float("error_threshold", 0.1, 5, step=0.25)
[I 2026-07-21 10:18:13,474] Trial 252 finished with value: -1.0256683190935747 and parameters: {'error_threshold': 3.35, 'scalers': 'none', 'ratios': 'norm_ratio', 'imputers': 'none', 'n_estimators': 3000, 'learning_rate': 0.0035836219046445003, 'max_depth': 3, 'min_child_weight': 3, 'subsample': 0.6, 'colsample_bytree': 0.5, 'colsample_bylevel': 0.9, 'reg_alpha': 3.803959075614906e-05, 'reg_lambda': 1.444160030514174e-05, 'gamma': 1.0688615686930491e-06}. Best is trial 217 with value: -1.0247384784192415.
/bsuhome/alexanderemert/Research/Star-Formation-Research-Project-2026/pipeline/scripts/optuna/final_preds_and_models/optuna_search_mult_quant_reg.py:161: UserWarning: The distribution is specified by [0.1, 5] and step=0.25, but the range is not divisible by `step`. It will be replaced with [0.1, 4.85].
  error_threshold = trial.suggest_float("error_threshold", 0.1, 5, step=0.25)
[I 2026-07-21 10:18:15,506] Trial 253 finished with value: -1.0254778290601347 and parameters: {'error_threshold': 3.35, 'scalers': 'none', 'ratios': 'norm_ratio', 'imputers': 'none', 'n_estimators': 3000, 'learning_rate': 0.003639934039731092, 'max_depth': 3, 'min_child_weight': 3, 'subsample': 0.6, 'colsample_bytree': 0.5, 'colsample_bylevel': 0.9, 'reg_alpha': 3.5574902632963845e-05, 'reg_lambda': 8.396709051417483e-06, 'gamma': 1.0381711696297821e-06}. Best is trial 217 with value: -1.0247384784192415.
/bsuhome/alexanderemert/Research/Star-Formation-Research-Project-2026/pipeline/scripts/optuna/final_preds_and_models/optuna_search_mult_quant_reg.py:161: UserWarning: The distribution is specified by [0.1, 5] and step=0.25, but the range is not divisible by `step`. It will be replaced with [0.1, 4.85].
  error_threshold = trial.suggest_float("error_threshold", 0.1, 5, step=0.25)
[I 2026-07-21 10:18:17,537] Trial 254 finished with value: -1.0253001386707499 and parameters: {'error_threshold': 3.35, 'scalers': 'none', 'ratios': 'norm_ratio', 'imputers': 'none', 'n_estimators': 3000, 'learning_rate': 0.00367726141317626, 'max_depth': 3, 'min_child_weight': 3, 'subsample': 0.6, 'colsample_bytree': 0.5, 'colsample_bylevel': 0.9, 'reg_alpha': 3.3506676078601015e-05, 'reg_lambda': 7.733252756485531e-06, 'gamma': 1.0808559134379704e-06}. Best is trial 217 with value: -1.0247384784192415.
/bsuhome/alexanderemert/Research/Star-Formation-Research-Project-2026/pipeline/scripts/optuna/final_preds_and_models/optuna_search_mult_quant_reg.py:161: UserWarning: The distribution is specified by [0.1, 5] and step=0.25, but the range is not divisible by `step`. It will be replaced with [0.1, 4.85].
  error_threshold = trial.suggest_float("error_threshold", 0.1, 5, step=0.25)
[I 2026-07-21 10:18:19,577] Trial 255 finished with value: -1.0258427191555521 and parameters: {'error_threshold': 3.35, 'scalers': 'none', 'ratios': 'norm_ratio', 'imputers': 'none', 'n_estimators': 3000, 'learning_rate': 0.00335432259203716, 'max_depth': 3, 'min_child_weight': 3, 'subsample': 0.6, 'colsample_bytree': 0.5, 'colsample_bylevel': 0.9, 'reg_alpha': 3.2866300439269105e-05, 'reg_lambda': 8.07549325104809e-06, 'gamma': 1.1941660539282602e-06}. Best is trial 217 with value: -1.0247384784192415.
/bsuhome/alexanderemert/Research/Star-Formation-Research-Project-2026/pipeline/scripts/optuna/final_preds_and_models/optuna_search_mult_quant_reg.py:161: UserWarning: The distribution is specified by [0.1, 5] and step=0.25, but the range is not divisible by `step`. It will be replaced with [0.1, 4.85].
  error_threshold = trial.suggest_float("error_threshold", 0.1, 5, step=0.25)
[I 2026-07-21 10:18:21,617] Trial 256 finished with value: -1.0256627271818404 and parameters: {'error_threshold': 3.35, 'scalers': 'none', 'ratios': 'norm_ratio', 'imputers': 'none', 'n_estimators': 3000, 'learning_rate': 0.003595277166530177, 'max_depth': 3, 'min_child_weight': 3, 'subsample': 0.6, 'colsample_bytree': 0.5, 'colsample_bylevel': 0.9, 'reg_alpha': 3.369593014347093e-05, 'reg_lambda': 1.320964775375501e-05, 'gamma': 1.0355014116413655e-06}. Best is trial 217 with value: -1.0247384784192415.
/bsuhome/alexanderemert/Research/Star-Formation-Research-Project-2026/pipeline/scripts/optuna/final_preds_and_models/optuna_search_mult_quant_reg.py:161: UserWarning: The distribution is specified by [0.1, 5] and step=0.25, but the range is not divisible by `step`. It will be replaced with [0.1, 4.85].
  error_threshold = trial.suggest_float("error_threshold", 0.1, 5, step=0.25)
[I 2026-07-21 10:18:23,661] Trial 257 finished with value: -1.025404431993295 and parameters: {'error_threshold': 3.35, 'scalers': 'none', 'ratios': 'norm_ratio', 'imputers': 'none', 'n_estimators': 3000, 'learning_rate': 0.0036661982552662854, 'max_depth': 3, 'min_child_weight': 3, 'subsample': 0.6, 'colsample_bytree': 0.5, 'colsample_bylevel': 0.9, 'reg_alpha': 3.560724147502551e-05, 'reg_lambda': 1.4842681506509337e-05, 'gamma': 1.0785382580443526e-06}. Best is trial 217 with value: -1.0247384784192415.
/bsuhome/alexanderemert/Research/Star-Formation-Research-Project-2026/pipeline/scripts/optuna/final_preds_and_models/optuna_search_mult_quant_reg.py:161: UserWarning: The distribution is specified by [0.1, 5] and step=0.25, but the range is not divisible by `step`. It will be replaced with [0.1, 4.85].
  error_threshold = trial.suggest_float("error_threshold", 0.1, 5, step=0.25)
[I 2026-07-21 10:18:25,707] Trial 258 finished with value: -1.025368856142321 and parameters: {'error_threshold': 3.35, 'scalers': 'none', 'ratios': 'norm_ratio', 'imputers': 'none', 'n_estimators': 3000, 'learning_rate': 0.0037052843649477423, 'max_depth': 3, 'min_child_weight': 3, 'subsample': 0.6, 'colsample_bytree': 0.5, 'colsample_bylevel': 0.9, 'reg_alpha': 2.9160357713439238e-05, 'reg_lambda': 1.3824558137823826e-05, 'gamma': 1.178964603039356e-06}. Best is trial 217 with value: -1.0247384784192415.
/bsuhome/alexanderemert/Research/Star-Formation-Research-Project-2026/pipeline/scripts/optuna/final_preds_and_models/optuna_search_mult_quant_reg.py:161: UserWarning: The distribution is specified by [0.1, 5] and step=0.25, but the range is not divisible by `step`. It will be replaced with [0.1, 4.85].
  error_threshold = trial.suggest_float("error_threshold", 0.1, 5, step=0.25)
