[I 2026-07-20 14:46:31,582] Trial 298 finished with value: -0.13650110987312694 and parameters: {'error_threshold': 0.35, 'scalers': 'robust', 'ratios': 'norm_ratio', 'imputers': 'mean', 'n_estimators': 200, 'learning_rate': 0.00020680510366195436, 'max_depth': 9, 'min_child_weight': 9, 'subsample': 0.6, 'colsample_bytree': 0.5, 'colsample_bylevel': 1.0, 'reg_alpha': 19.36262811428964, 'reg_lambda': 0.00038817599263130163, 'gamma': 41.52036975608902}. Best is trial 205 with value: -0.13735526511479842.
/bsuhome/alexanderemert/Research/Star-Formation-Research-Project-2026/pipeline/scripts/optuna/final_preds_and_models/optuna_search_mult_quant_reg.py:75: UserWarning: The distribution is specified by [0.1, 5] and step=0.25, but the range is not divisible by `step`. It will be replaced with [0.1, 4.85].
  error_threshold = trial.suggest_float("error_threshold", 0.1, 5, step=0.25)
[I 2026-07-20 14:46:32,733] Trial 293 finished with value: -0.11853241729264297 and parameters: {'error_threshold': 0.1, 'scalers': 'robust', 'ratios': 'norm_ratio', 'imputers': 'mean', 'n_estimators': 2300, 'learning_rate': 0.0003304154823513397, 'max_depth': 7, 'min_child_weight': 10, 'subsample': 0.6, 'colsample_bytree': 0.5, 'colsample_bylevel': 1.0, 'reg_alpha': 19.341847750024943, 'reg_lambda': 0.00039733838324446216, 'gamma': 13.835807116282906}. Best is trial 205 with value: -0.13735526511479842.
/bsuhome/alexanderemert/Research/Star-Formation-Research-Project-2026/pipeline/scripts/optuna/final_preds_and_models/optuna_search_mult_quant_reg.py:75: UserWarning: The distribution is specified by [0.1, 5] and step=0.25, but the range is not divisible by `step`. It will be replaced with [0.1, 4.85].
  error_threshold = trial.suggest_float("error_threshold", 0.1, 5, step=0.25)
[I 2026-07-20 14:46:33,943] Trial 296 finished with value: -0.1255377120975524 and parameters: {'error_threshold': 0.1, 'scalers': 'robust', 'ratios': 'norm_ratio', 'imputers': 'mean', 'n_estimators': 2300, 'learning_rate': 0.00021886966016964048, 'max_depth': 7, 'min_child_weight': 9, 'subsample': 0.6, 'colsample_bytree': 0.5, 'colsample_bylevel': 1.0, 'reg_alpha': 6.440760884629652, 'reg_lambda': 0.00042883531929326427, 'gamma': 44.199905888691845}. Best is trial 205 with value: -0.13735526511479842.
/bsuhome/alexanderemert/Research/Star-Formation-Research-Project-2026/pipeline/scripts/optuna/final_preds_and_models/optuna_search_mult_quant_reg.py:75: UserWarning: The distribution is specified by [0.1, 5] and step=0.25, but the range is not divisible by `step`. It will be replaced with [0.1, 4.85].
  error_threshold = trial.suggest_float("error_threshold", 0.1, 5, step=0.25)
[I 2026-07-20 14:46:34,364] Trial 299 finished with value: -0.13647863075871317 and parameters: {'error_threshold': 0.35, 'scalers': 'robust', 'ratios': 'norm_ratio', 'imputers': 'mean', 'n_estimators': 200, 'learning_rate': 0.0002108856606965082, 'max_depth': 7, 'min_child_weight': 9, 'subsample': 0.6, 'colsample_bytree': 0.5, 'colsample_bylevel': 1.0, 'reg_alpha': 0.7389602321366667, 'reg_lambda': 0.00015392179114924164, 'gamma': 42.74075860060462}. Best is trial 205 with value: -0.13735526511479842.
/bsuhome/alexanderemert/Research/Star-Formation-Research-Project-2026/pipeline/scripts/optuna/final_preds_and_models/optuna_search_mult_quant_reg.py:75: UserWarning: The distribution is specified by [0.1, 5] and step=0.25, but the range is not divisible by `step`. It will be replaced with [0.1, 4.85].
  error_threshold = trial.suggest_float("error_threshold", 0.1, 5, step=0.25)
[I 2026-07-20 14:46:36,386] Trial 301 finished with value: -0.13698774389045296 and parameters: {'error_threshold': 0.35, 'scalers': 'robust', 'ratios': 'norm_ratio', 'imputers': 'mean', 'n_estimators': 200, 'learning_rate': 0.00011819253479437518, 'max_depth': 7, 'min_child_weight': 1, 'subsample': 0.6, 'colsample_bytree': 0.5, 'colsample_bylevel': 1.0, 'reg_alpha': 1.41895981128234, 'reg_lambda': 0.000141699877328585, 'gamma': 39.55480453154938}. Best is trial 205 with value: -0.13735526511479842.
/bsuhome/alexanderemert/Research/Star-Formation-Research-Project-2026/pipeline/scripts/optuna/final_preds_and_models/optuna_search_mult_quant_reg.py:75: UserWarning: The distribution is specified by [0.1, 5] and step=0.25, but the range is not divisible by `step`. It will be replaced with [0.1, 4.85].
  error_threshold = trial.suggest_float("error_threshold", 0.1, 5, step=0.25)
[I 2026-07-20 14:46:37,440] Trial 302 finished with value: -0.13698942813303785 and parameters: {'error_threshold': 0.35, 'scalers': 'robust', 'ratios': 'norm_ratio', 'imputers': 'mean', 'n_estimators': 200, 'learning_rate': 0.00011789098331179566, 'max_depth': 9, 'min_child_weight': 1, 'subsample': 0.6, 'colsample_bytree': 0.5, 'colsample_bylevel': 1.0, 'reg_alpha': 0.8740915084725234, 'reg_lambda': 2.9617930230930274e-05, 'gamma': 40.02687061223629}. Best is trial 205 with value: -0.13735526511479842.
/bsuhome/alexanderemert/Research/Star-Formation-Research-Project-2026/pipeline/scripts/optuna/final_preds_and_models/optuna_search_mult_quant_reg.py:75: UserWarning: The distribution is specified by [0.1, 5] and step=0.25, but the range is not divisible by `step`. It will be replaced with [0.1, 4.85].
  error_threshold = trial.suggest_float("error_threshold", 0.1, 5, step=0.25)
[I 2026-07-20 14:46:37,704] Trial 303 finished with value: -0.13699970250163332 and parameters: {'error_threshold': 0.35, 'scalers': 'robust', 'ratios': 'norm_ratio', 'imputers': 'mean', 'n_estimators': 200, 'learning_rate': 0.00011603493913305094, 'max_depth': 8, 'min_child_weight': 4, 'subsample': 0.6, 'colsample_bytree': 0.5, 'colsample_bylevel': 1.0, 'reg_alpha': 1.3527996000768834, 'reg_lambda': 0.0019445228944998927, 'gamma': 39.09536930050539}. Best is trial 205 with value: -0.13735526511479842.
/bsuhome/alexanderemert/Research/Star-Formation-Research-Project-2026/pipeline/scripts/optuna/final_preds_and_models/optuna_search_mult_quant_reg.py:75: UserWarning: The distribution is specified by [0.1, 5] and step=0.25, but the range is not divisible by `step`. It will be replaced with [0.1, 4.85].
  error_threshold = trial.suggest_float("error_threshold", 0.1, 5, step=0.25)
[I 2026-07-20 14:46:37,814] Trial 304 finished with value: -0.13718773048564645 and parameters: {'error_threshold': 0.35, 'scalers': 'robust', 'ratios': 'norm_ratio', 'imputers': 'mean', 'n_estimators': 150, 'learning_rate': 0.00011965701071097922, 'max_depth': 8, 'min_child_weight': 4, 'subsample': 0.6, 'colsample_bytree': 0.5, 'colsample_bylevel': 1.0, 'reg_alpha': 1.7132072090764068, 'reg_lambda': 3.219116003796231e-05, 'gamma': 40.92354565773362}. Best is trial 205 with value: -0.13735526511479842.
/bsuhome/alexanderemert/Research/Star-Formation-Research-Project-2026/pipeline/scripts/optuna/final_preds_and_models/optuna_search_mult_quant_reg.py:75: UserWarning: The distribution is specified by [0.1, 5] and step=0.25, but the range is not divisible by `step`. It will be replaced with [0.1, 4.85].
  error_threshold = trial.suggest_float("error_threshold", 0.1, 5, step=0.25)
[I 2026-07-20 14:46:37,911] Trial 305 finished with value: -0.1372259923731386 and parameters: {'error_threshold': 0.35, 'scalers': 'robust', 'ratios': 'norm_ratio', 'imputers': 'none', 'n_estimators': 150, 'learning_rate': 0.00011921538836800039, 'max_depth': 8, 'min_child_weight': 8, 'subsample': 0.6, 'colsample_bytree': 0.5, 'colsample_bylevel': 0.6, 'reg_alpha': 1.4382246899016105, 'reg_lambda': 3.072193968771546e-05, 'gamma': 7.796433277741608}. Best is trial 205 with value: -0.13735526511479842.
/bsuhome/alexanderemert/Research/Star-Formation-Research-Project-2026/pipeline/scripts/optuna/final_preds_and_models/optuna_search_mult_quant_reg.py:75: UserWarning: The distribution is specified by [0.1, 5] and step=0.25, but the range is not divisible by `step`. It will be replaced with [0.1, 4.85].
  error_threshold = trial.suggest_float("error_threshold", 0.1, 5, step=0.25)
[I 2026-07-20 14:46:38,035] Trial 306 finished with value: -0.1369735804860137 and parameters: {'error_threshold': 0.35, 'scalers': 'robust', 'ratios': 'norm_ratio', 'imputers': 'mean', 'n_estimators': 150, 'learning_rate': 0.00011952201585061196, 'max_depth': 8, 'min_child_weight': 4, 'subsample': 0.6, 'colsample_bytree': 0.5, 'colsample_bylevel': 1.0, 'reg_alpha': 1.2558728196976534, 'reg_lambda': 5.200523805321251e-05, 'gamma': 7.817444573844162}. Best is trial 205 with value: -0.13735526511479842.
/bsuhome/alexanderemert/Research/Star-Formation-Research-Project-2026/pipeline/scripts/optuna/final_preds_and_models/optuna_search_mult_quant_reg.py:75: UserWarning: The distribution is specified by [0.1, 5] and step=0.25, but the range is not divisible by `step`. It will be replaced with [0.1, 4.85].
  error_threshold = trial.suggest_float("error_threshold", 0.1, 5, step=0.25)
[I 2026-07-20 14:46:39,213] Trial 300 finished with value: -0.13040418038709084 and parameters: {'error_threshold': 0.35, 'scalers': 'robust', 'ratios': 'norm_ratio', 'imputers': 'mean', 'n_estimators': 2300, 'learning_rate': 0.00012107631105165263, 'max_depth': 9, 'min_child_weight': 9, 'subsample': 0.6, 'colsample_bytree': 0.5, 'colsample_bylevel': 1.0, 'reg_alpha': 0.8203252073902711, 'reg_lambda': 3.0310736414693104e-05, 'gamma': 38.3117850436264}. Best is trial 205 with value: -0.13735526511479842.
/bsuhome/alexanderemert/Research/Star-Formation-Research-Project-2026/pipeline/scripts/optuna/final_preds_and_models/optuna_search_mult_quant_reg.py:75: UserWarning: The distribution is specified by [0.1, 5] and step=0.25, but the range is not divisible by `step`. It will be replaced with [0.1, 4.85].
  error_threshold = trial.suggest_float("error_threshold", 0.1, 5, step=0.25)
[I 2026-07-20 14:46:39,582] Trial 307 finished with value: -0.1366710990523596 and parameters: {'error_threshold': 0.35, 'scalers': 'robust', 'ratios': 'norm_ratio', 'imputers': 'mean', 'n_estimators': 150, 'learning_rate': 0.00017309413256206147, 'max_depth': 8, 'min_child_weight': 8, 'subsample': 0.6, 'colsample_bytree': 0.5, 'colsample_bylevel': 1.0, 'reg_alpha': 1.363921117939765, 'reg_lambda': 0.0017863357921124754, 'gamma': 7.496464152588784}. Best is trial 205 with value: -0.13735526511479842.
/bsuhome/alexanderemert/Research/Star-Formation-Research-Project-2026/pipeline/scripts/optuna/final_preds_and_models/optuna_search_mult_quant_reg.py:75: UserWarning: The distribution is specified by [0.1, 5] and step=0.25, but the range is not divisible by `step`. It will be replaced with [0.1, 4.85].
  error_threshold = trial.suggest_float("error_threshold", 0.1, 5, step=0.25)
[I 2026-07-20 14:46:40,220] Trial 308 finished with value: -0.13666082277757172 and parameters: {'error_threshold': 0.35, 'scalers': 'robust', 'ratios': 'norm_ratio', 'imputers': 'none', 'n_estimators': 150, 'learning_rate': 0.00017790617817881434, 'max_depth': 8, 'min_child_weight': 8, 'subsample': 0.6, 'colsample_bytree': 0.5, 'colsample_bylevel': 1.0, 'reg_alpha': 2.1125302337795695, 'reg_lambda': 2.9886701841775206e-05, 'gamma': 9.415265572842817}. Best is trial 205 with value: -0.13735526511479842.
/bsuhome/alexanderemert/Research/Star-Formation-Research-Project-2026/pipeline/scripts/optuna/final_preds_and_models/optuna_search_mult_quant_reg.py:75: UserWarning: The distribution is specified by [0.1, 5] and step=0.25, but the range is not divisible by `step`. It will be replaced with [0.1, 4.85].
  error_threshold = trial.suggest_float("error_threshold", 0.1, 5, step=0.25)
[I 2026-07-20 14:46:41,197] Trial 309 finished with value: -0.137206230649396 and parameters: {'error_threshold': 0.1, 'scalers': 'robust', 'ratios': 'norm_ratio', 'imputers': 'none', 'n_estimators': 150, 'learning_rate': 0.00017666393415367604, 'max_depth': 8, 'min_child_weight': 8, 'subsample': 0.6, 'colsample_bytree': 0.5, 'colsample_bylevel': 0.6, 'reg_alpha': 2.158843524135733, 'reg_lambda': 5.659897870252477e-05, 'gamma': 26.159105423882416}. Best is trial 205 with value: -0.13735526511479842.
/bsuhome/alexanderemert/Research/Star-Formation-Research-Project-2026/pipeline/scripts/optuna/final_preds_and_models/optuna_search_mult_quant_reg.py:75: UserWarning: The distribution is specified by [0.1, 5] and step=0.25, but the range is not divisible by `step`. It will be replaced with [0.1, 4.85].
  error_threshold = trial.suggest_float("error_threshold", 0.1, 5, step=0.25)
[I 2026-07-20 14:46:41,632] Trial 310 finished with value: -0.13669882956596127 and parameters: {'error_threshold': 0.1, 'scalers': 'robust', 'ratios': 'norm_ratio', 'imputers': 'none', 'n_estimators': 150, 'learning_rate': 0.00017204018163750748, 'max_depth': 8, 'min_child_weight': 8, 'subsample': 0.6, 'colsample_bytree': 0.5, 'colsample_bylevel': 1.0, 'reg_alpha': 2.3635663335559873, 'reg_lambda': 5.547691914807702e-05, 'gamma': 9.654485428239967}. Best is trial 205 with value: -0.13735526511479842.
/bsuhome/alexanderemert/Research/Star-Formation-Research-Project-2026/pipeline/scripts/optuna/final_preds_and_models/optuna_search_mult_quant_reg.py:75: UserWarning: The distribution is specified by [0.1, 5] and step=0.25, but the range is not divisible by `step`. It will be replaced with [0.1, 4.85].
  error_threshold = trial.suggest_float("error_threshold", 0.1, 5, step=0.25)
[I 2026-07-20 14:46:41,751] Trial 311 finished with value: -0.13690705511991139 and parameters: {'error_threshold': 0.35, 'scalers': 'robust', 'ratios': 'norm_ratio', 'imputers': 'none', 'n_estimators': 150, 'learning_rate': 0.00013141513935360677, 'max_depth': 8, 'min_child_weight': 8, 'subsample': 0.6, 'colsample_bytree': 0.5, 'colsample_bylevel': 1.0, 'reg_alpha': 1.7815283644583186, 'reg_lambda': 3.431615895855027e-06, 'gamma': 7.6498196380534305}. Best is trial 205 with value: -0.13735526511479842.
/bsuhome/alexanderemert/Research/Star-Formation-Research-Project-2026/pipeline/scripts/optuna/final_preds_and_models/optuna_search_mult_quant_reg.py:75: UserWarning: The distribution is specified by [0.1, 5] and step=0.25, but the range is not divisible by `step`. It will be replaced with [0.1, 4.85].
  error_threshold = trial.suggest_float("error_threshold", 0.1, 5, step=0.25)
[I 2026-07-20 14:46:41,850] Trial 312 finished with value: -0.13733933646959726 and parameters: {'error_threshold': 0.35, 'scalers': 'robust', 'ratios': 'norm_ratio', 'imputers': 'mean', 'n_estimators': 150, 'learning_rate': 0.00012308412787409353, 'max_depth': 8, 'min_child_weight': 8, 'subsample': 0.6, 'colsample_bytree': 0.5, 'colsample_bylevel': 0.5, 'reg_alpha': 1.8337056826005518, 'reg_lambda': 8.238178882899924e-06, 'gamma': 9.117525969896084}. Best is trial 205 with value: -0.13735526511479842.
[I 2026-07-20 14:46:41,930] Trial 313 finished with value: -0.13694895194749282 and parameters: {'error_threshold': 0.1, 'scalers': 'robust', 'ratios': 'norm_ratio', 'imputers': 'none', 'n_estimators': 150, 'learning_rate': 0.0001254240666492204, 'max_depth': 8, 'min_child_weight': 8, 'subsample': 0.6, 'colsample_bytree': 0.5, 'colsample_bylevel': 1.0, 'reg_alpha': 2.0529013478598506, 'reg_lambda': 2.138274684132769e-05, 'gamma': 9.045860209494514}. Best is trial 205 with value: -0.13735526511479842.
[I 2026-07-20 14:46:42,037] Trial 314 finished with value: -0.13718049207766544 and parameters: {'error_threshold': 0.1, 'scalers': 'robust', 'ratios': 'norm_ratio', 'imputers': 'none', 'n_estimators': 150, 'learning_rate': 0.00013266230753440303, 'max_depth': 8, 'min_child_weight': 8, 'subsample': 0.6, 'colsample_bytree': 0.5, 'colsample_bylevel': 0.6, 'reg_alpha': 1.8293662515997502, 'reg_lambda': 7.078992854409233e-06, 'gamma': 7.3403960449564245}. Best is trial 205 with value: -0.13735526511479842.
[I 2026-07-20 14:46:42,309] Trial 315 finished with value: -0.1371988197050448 and parameters: {'error_threshold': 0.1, 'scalers': 'robust', 'ratios': 'norm_ratio', 'imputers': 'none', 'n_estimators': 150, 'learning_rate': 0.00012903261429005581, 'max_depth': 7, 'min_child_weight': 8, 'subsample': 0.6, 'colsample_bytree': 0.5, 'colsample_bylevel': 0.6, 'reg_alpha': 2.2446513602998515, 'reg_lambda': 1.5430154714988128e-05, 'gamma': 8.278835178587935}. Best is trial 205 with value: -0.13735526511479842.
[I 2026-07-20 14:46:43,354] Trial 316 finished with value: -0.13640136187219548 and parameters: {'error_threshold': 0.1, 'scalers': 'robust', 'ratios': 'norm_ratio', 'imputers': 'none', 'n_estimators': 300, 'learning_rate': 0.0001248984767145402, 'max_depth': 7, 'min_child_weight': 8, 'subsample': 0.6, 'colsample_bytree': 0.5, 'colsample_bylevel': 0.7, 'reg_alpha': 1.8554669059855116, 'reg_lambda': 1.5581391469104846e-05, 'gamma': 3.791725406078297}. Best is trial 205 with value: -0.13735526511479842.
[I 2026-07-20 14:46:44,015] Trial 317 finished with value: -0.1364184302825272 and parameters: {'error_threshold': 0.1, 'scalers': 'robust', 'ratios': 'norm_ratio', 'imputers': 'none', 'n_estimators': 300, 'learning_rate': 0.000135615607090431, 'max_depth': 8, 'min_child_weight': 8, 'subsample': 0.6, 'colsample_bytree': 0.5, 'colsample_bylevel': 0.6, 'reg_alpha': 2.1519529640317754, 'reg_lambda': 1.5233670622798051e-05, 'gamma': 3.758376173497542}. Best is trial 205 with value: -0.13735526511479842.
[I 2026-07-20 14:46:44,184] Trial 318 finished with value: -0.1362495634627462 and parameters: {'error_threshold': 0.1, 'scalers': 'robust', 'ratios': 'norm_ratio', 'imputers': 'none', 'n_estimators': 300, 'learning_rate': 0.00012952810768487343, 'max_depth': 8, 'min_child_weight': 8, 'subsample': 0.6, 'colsample_bytree': 0.5, 'colsample_bylevel': 0.8, 'reg_alpha': 1.7082669576050096, 'reg_lambda': 1.5934848107010693e-05, 'gamma': 3.7903812648059585}. Best is trial 205 with value: -0.13735526511479842.
[I 2026-07-20 14:46:44,348] Trial 319 finished with value: -0.13694427783661242 and parameters: {'error_threshold': 0.1, 'scalers': 'robust', 'ratios': 'norm_ratio', 'imputers': 'none', 'n_estimators': 300, 'learning_rate': 0.00013415159203784342, 'max_depth': 8, 'min_child_weight': 8, 'subsample': 0.6, 'colsample_bytree': 0.5, 'colsample_bylevel': 0.6, 'reg_alpha': 2.9907087533024668, 'reg_lambda': 7.934312858548617e-06, 'gamma': 25.10218197804571}. Best is trial 205 with value: -0.13735526511479842.
[I 2026-07-20 14:46:44,354] A new study created in Journal with name: mean_study_7_20_26
/bsuhome/alexanderemert/Research/Star-Formation-Research-Project-2026/pipeline/scripts/optuna/final_preds_and_models/optuna_search_mult_quant_reg.py:161: UserWarning: The distribution is specified by [0.1, 5] and step=0.25, but the range is not divisible by `step`. It will be replaced with [0.1, 4.85].
  error_threshold = trial.suggest_float("error_threshold", 0.1, 5, step=0.25)
[I 2026-07-20 14:46:46,179] Trial 0 finished with value: -0.3979700007274077 and parameters: {'error_threshold': 2.35, 'scalers': 'robust', 'ratios': 'norm_ratio', 'imputers': 'none', 'n_estimators': 2050, 'learning_rate': 0.02822624360539412, 'max_depth': 9, 'min_child_weight': 9, 'subsample': 0.8, 'colsample_bytree': 1.0, 'colsample_bylevel': 0.5, 'reg_alpha': 0.15836274800263342, 'reg_lambda': 0.06803298267979292, 'gamma': 18.48617230555791}. Best is trial 0 with value: -0.3979700007274077.
/bsuhome/alexanderemert/Research/Star-Formation-Research-Project-2026/pipeline/scripts/optuna/final_preds_and_models/optuna_search_mult_quant_reg.py:161: UserWarning: The distribution is specified by [0.1, 5] and step=0.25, but the range is not divisible by `step`. It will be replaced with [0.1, 4.85].
  error_threshold = trial.suggest_float("error_threshold", 0.1, 5, step=0.25)
[I 2026-07-20 14:46:46,820] Trial 6 finished with value: -0.47611268168667326 and parameters: {'error_threshold': 0.6, 'scalers': 'none', 'ratios': 'norm_ratio', 'imputers': 'none', 'n_estimators': 400, 'learning_rate': 0.0025510733987260613, 'max_depth': 4, 'min_child_weight': 5, 'subsample': 0.6, 'colsample_bytree': 0.9, 'colsample_bylevel': 0.7, 'reg_alpha': 0.09669600772832485, 'reg_lambda': 0.07461254322010583, 'gamma': 7.4768000328795415e-06}. Best is trial 0 with value: -0.3979700007274077.
/bsuhome/alexanderemert/Research/Star-Formation-Research-Project-2026/pipeline/scripts/optuna/final_preds_and_models/optuna_search_mult_quant_reg.py:161: UserWarning: The distribution is specified by [0.1, 5] and step=0.25, but the range is not divisible by `step`. It will be replaced with [0.1, 4.85].
  error_threshold = trial.suggest_float("error_threshold", 0.1, 5, step=0.25)
[I 2026-07-20 14:46:47,652] Trial 1 finished with value: -0.6719262987908512 and parameters: {'error_threshold': 1.1, 'scalers': 'robust', 'ratios': 'log_ratio', 'imputers': 'none', 'n_estimators': 900, 'learning_rate': 0.0004254864148135333, 'max_depth': 12, 'min_child_weight': 7, 'subsample': 0.9, 'colsample_bytree': 0.8, 'colsample_bylevel': 0.9, 'reg_alpha': 2.1743335969852408e-06, 'reg_lambda': 5.392065924625575e-06, 'gamma': 27.111575881375863}. Best is trial 0 with value: -0.3979700007274077.
/bsuhome/alexanderemert/Research/Star-Formation-Research-Project-2026/pipeline/scripts/optuna/final_preds_and_models/optuna_search_mult_quant_reg.py:161: UserWarning: The distribution is specified by [0.1, 5] and step=0.25, but the range is not divisible by `step`. It will be replaced with [0.1, 4.85].
  error_threshold = trial.suggest_float("error_threshold", 0.1, 5, step=0.25)
