[I 2026-07-21 09:55:01,460] Trial 288 finished with value: -0.19682180562332915 and parameters: {'error_threshold': 1.85, 'scalers': 'standard', 'ratios': 'norm_ratio', 'imputers': 'none', 'n_estimators': 1400, 'learning_rate': 0.020817004727042118, 'max_depth': 3, 'min_child_weight': 7, 'subsample': 0.8, 'colsample_bytree': 0.5, 'colsample_bylevel': 0.9, 'reg_alpha': 0.00016079120999990914, 'reg_lambda': 0.026300386379392807, 'gamma': 24.12300667439606}. Best is trial 277 with value: -0.09711472095390473.
/bsuhome/alexanderemert/Research/Star-Formation-Research-Project-2026/pipeline/scripts/optuna/final_preds_and_models/optuna_search_mult_quant_reg.py:75: UserWarning: The distribution is specified by [0.1, 5] and step=0.25, but the range is not divisible by `step`. It will be replaced with [0.1, 4.85].
  error_threshold = trial.suggest_float("error_threshold", 0.1, 5, step=0.25)
[I 2026-07-21 09:55:08,195] Trial 289 finished with value: -0.09962670541211055 and parameters: {'error_threshold': 1.85, 'scalers': 'standard', 'ratios': 'norm_ratio', 'imputers': 'none', 'n_estimators': 1400, 'learning_rate': 0.021661993207801013, 'max_depth': 4, 'min_child_weight': 7, 'subsample': 0.8, 'colsample_bytree': 0.5, 'colsample_bylevel': 1.0, 'reg_alpha': 0.0001809833932849796, 'reg_lambda': 0.025015204865277876, 'gamma': 0.0034826943653944254}. Best is trial 277 with value: -0.09711472095390473.
/bsuhome/alexanderemert/Research/Star-Formation-Research-Project-2026/pipeline/scripts/optuna/final_preds_and_models/optuna_search_mult_quant_reg.py:75: UserWarning: The distribution is specified by [0.1, 5] and step=0.25, but the range is not divisible by `step`. It will be replaced with [0.1, 4.85].
  error_threshold = trial.suggest_float("error_threshold", 0.1, 5, step=0.25)
[I 2026-07-21 09:55:09,879] Trial 290 finished with value: -0.09932955009245598 and parameters: {'error_threshold': 1.85, 'scalers': 'standard', 'ratios': 'norm_ratio', 'imputers': 'none', 'n_estimators': 1400, 'learning_rate': 0.019521549877153495, 'max_depth': 4, 'min_child_weight': 8, 'subsample': 0.8, 'colsample_bytree': 0.5, 'colsample_bylevel': 1.0, 'reg_alpha': 0.00015860564500633123, 'reg_lambda': 0.03228275627667735, 'gamma': 0.003608958566040078}. Best is trial 277 with value: -0.09711472095390473.
/bsuhome/alexanderemert/Research/Star-Formation-Research-Project-2026/pipeline/scripts/optuna/final_preds_and_models/optuna_search_mult_quant_reg.py:75: UserWarning: The distribution is specified by [0.1, 5] and step=0.25, but the range is not divisible by `step`. It will be replaced with [0.1, 4.85].
  error_threshold = trial.suggest_float("error_threshold", 0.1, 5, step=0.25)
[I 2026-07-21 09:55:17,322] Trial 291 finished with value: -0.09996916789477907 and parameters: {'error_threshold': 1.85, 'scalers': 'standard', 'ratios': 'norm_ratio', 'imputers': 'none', 'n_estimators': 1400, 'learning_rate': 0.020573959253622452, 'max_depth': 4, 'min_child_weight': 8, 'subsample': 0.8, 'colsample_bytree': 0.5, 'colsample_bylevel': 1.0, 'reg_alpha': 0.0001785591311733551, 'reg_lambda': 0.028001983840613486, 'gamma': 0.0035334817195229826}. Best is trial 277 with value: -0.09711472095390473.
/bsuhome/alexanderemert/Research/Star-Formation-Research-Project-2026/pipeline/scripts/optuna/final_preds_and_models/optuna_search_mult_quant_reg.py:75: UserWarning: The distribution is specified by [0.1, 5] and step=0.25, but the range is not divisible by `step`. It will be replaced with [0.1, 4.85].
  error_threshold = trial.suggest_float("error_threshold", 0.1, 5, step=0.25)
[I 2026-07-21 09:55:18,622] Trial 292 finished with value: -0.09800629691836338 and parameters: {'error_threshold': 1.85, 'scalers': 'standard', 'ratios': 'norm_ratio', 'imputers': 'none', 'n_estimators': 1350, 'learning_rate': 0.02126140271441429, 'max_depth': 3, 'min_child_weight': 8, 'subsample': 0.8, 'colsample_bytree': 0.5, 'colsample_bylevel': 1.0, 'reg_alpha': 0.0002020413322001186, 'reg_lambda': 0.02187890600575538, 'gamma': 0.003133177246658773}. Best is trial 277 with value: -0.09711472095390473.
/bsuhome/alexanderemert/Research/Star-Formation-Research-Project-2026/pipeline/scripts/optuna/final_preds_and_models/optuna_search_mult_quant_reg.py:75: UserWarning: The distribution is specified by [0.1, 5] and step=0.25, but the range is not divisible by `step`. It will be replaced with [0.1, 4.85].
  error_threshold = trial.suggest_float("error_threshold", 0.1, 5, step=0.25)
[I 2026-07-21 09:55:27,141] Trial 293 finished with value: -0.09920974162666424 and parameters: {'error_threshold': 1.85, 'scalers': 'standard', 'ratios': 'norm_ratio', 'imputers': 'none', 'n_estimators': 1400, 'learning_rate': 0.019504223763942504, 'max_depth': 4, 'min_child_weight': 8, 'subsample': 0.8, 'colsample_bytree': 0.5, 'colsample_bylevel': 1.0, 'reg_alpha': 0.0001800738534695803, 'reg_lambda': 0.025332889340459054, 'gamma': 0.0031566404656345826}. Best is trial 277 with value: -0.09711472095390473.
/bsuhome/alexanderemert/Research/Star-Formation-Research-Project-2026/pipeline/scripts/optuna/final_preds_and_models/optuna_search_mult_quant_reg.py:75: UserWarning: The distribution is specified by [0.1, 5] and step=0.25, but the range is not divisible by `step`. It will be replaced with [0.1, 4.85].
  error_threshold = trial.suggest_float("error_threshold", 0.1, 5, step=0.25)
[I 2026-07-21 09:55:33,960] Trial 294 finished with value: -0.09775030090407762 and parameters: {'error_threshold': 1.85, 'scalers': 'standard', 'ratios': 'norm_ratio', 'imputers': 'none', 'n_estimators': 1350, 'learning_rate': 0.018218403176571637, 'max_depth': 3, 'min_child_weight': 8, 'subsample': 0.8, 'colsample_bytree': 0.5, 'colsample_bylevel': 0.9, 'reg_alpha': 0.00019627678951254172, 'reg_lambda': 0.018833183863373647, 'gamma': 0.003076075720310996}. Best is trial 277 with value: -0.09711472095390473.
/bsuhome/alexanderemert/Research/Star-Formation-Research-Project-2026/pipeline/scripts/optuna/final_preds_and_models/optuna_search_mult_quant_reg.py:75: UserWarning: The distribution is specified by [0.1, 5] and step=0.25, but the range is not divisible by `step`. It will be replaced with [0.1, 4.85].
  error_threshold = trial.suggest_float("error_threshold", 0.1, 5, step=0.25)
[I 2026-07-21 09:55:35,234] Trial 295 finished with value: -0.09745042923024477 and parameters: {'error_threshold': 1.85, 'scalers': 'standard', 'ratios': 'norm_ratio', 'imputers': 'none', 'n_estimators': 1350, 'learning_rate': 0.018637498436651117, 'max_depth': 3, 'min_child_weight': 8, 'subsample': 0.8, 'colsample_bytree': 0.5, 'colsample_bylevel': 0.9, 'reg_alpha': 0.00020525261960608457, 'reg_lambda': 0.017313985345260584, 'gamma': 0.003479450189928961}. Best is trial 277 with value: -0.09711472095390473.
/bsuhome/alexanderemert/Research/Star-Formation-Research-Project-2026/pipeline/scripts/optuna/final_preds_and_models/optuna_search_mult_quant_reg.py:75: UserWarning: The distribution is specified by [0.1, 5] and step=0.25, but the range is not divisible by `step`. It will be replaced with [0.1, 4.85].
  error_threshold = trial.suggest_float("error_threshold", 0.1, 5, step=0.25)
[I 2026-07-21 09:55:36,565] Trial 296 finished with value: -0.09803358731180722 and parameters: {'error_threshold': 2.1, 'scalers': 'standard', 'ratios': 'norm_ratio', 'imputers': 'none', 'n_estimators': 1350, 'learning_rate': 0.018309873464174353, 'max_depth': 3, 'min_child_weight': 8, 'subsample': 0.8, 'colsample_bytree': 0.5, 'colsample_bylevel': 1.0, 'reg_alpha': 9.2635191319387e-05, 'reg_lambda': 0.01909216929886382, 'gamma': 0.003359663369542251}. Best is trial 277 with value: -0.09711472095390473.
/bsuhome/alexanderemert/Research/Star-Formation-Research-Project-2026/pipeline/scripts/optuna/final_preds_and_models/optuna_search_mult_quant_reg.py:75: UserWarning: The distribution is specified by [0.1, 5] and step=0.25, but the range is not divisible by `step`. It will be replaced with [0.1, 4.85].
  error_threshold = trial.suggest_float("error_threshold", 0.1, 5, step=0.25)
[I 2026-07-21 09:55:42,200] Trial 297 finished with value: -0.09796478057777604 and parameters: {'error_threshold': 2.1, 'scalers': 'standard', 'ratios': 'norm_ratio', 'imputers': 'none', 'n_estimators': 1350, 'learning_rate': 0.025450368910839138, 'max_depth': 3, 'min_child_weight': 8, 'subsample': 0.8, 'colsample_bytree': 0.5, 'colsample_bylevel': 1.0, 'reg_alpha': 0.00011293216244252915, 'reg_lambda': 0.015626432829560985, 'gamma': 0.006299636215872325}. Best is trial 277 with value: -0.09711472095390473.
/bsuhome/alexanderemert/Research/Star-Formation-Research-Project-2026/pipeline/scripts/optuna/final_preds_and_models/optuna_search_mult_quant_reg.py:75: UserWarning: The distribution is specified by [0.1, 5] and step=0.25, but the range is not divisible by `step`. It will be replaced with [0.1, 4.85].
  error_threshold = trial.suggest_float("error_threshold", 0.1, 5, step=0.25)
[I 2026-07-21 09:55:43,519] Trial 298 finished with value: -0.0979626526071128 and parameters: {'error_threshold': 2.1, 'scalers': 'standard', 'ratios': 'norm_ratio', 'imputers': 'none', 'n_estimators': 1350, 'learning_rate': 0.017513495082760802, 'max_depth': 3, 'min_child_weight': 8, 'subsample': 0.8, 'colsample_bytree': 0.5, 'colsample_bylevel': 1.0, 'reg_alpha': 0.00010203602205418196, 'reg_lambda': 0.0163753252384254, 'gamma': 0.005795657090775022}. Best is trial 277 with value: -0.09711472095390473.
/bsuhome/alexanderemert/Research/Star-Formation-Research-Project-2026/pipeline/scripts/optuna/final_preds_and_models/optuna_search_mult_quant_reg.py:75: UserWarning: The distribution is specified by [0.1, 5] and step=0.25, but the range is not divisible by `step`. It will be replaced with [0.1, 4.85].
  error_threshold = trial.suggest_float("error_threshold", 0.1, 5, step=0.25)
[I 2026-07-21 09:55:50,334] Trial 299 finished with value: -0.09757626970927835 and parameters: {'error_threshold': 2.1, 'scalers': 'standard', 'ratios': 'norm_ratio', 'imputers': 'none', 'n_estimators': 1350, 'learning_rate': 0.02509976739393287, 'max_depth': 3, 'min_child_weight': 8, 'subsample': 0.8, 'colsample_bytree': 0.5, 'colsample_bylevel': 1.0, 'reg_alpha': 9.495742770804626e-05, 'reg_lambda': 0.01575533390934828, 'gamma': 0.005839094428338853}. Best is trial 277 with value: -0.09711472095390473.
/bsuhome/alexanderemert/Research/Star-Formation-Research-Project-2026/pipeline/scripts/optuna/final_preds_and_models/optuna_search_mult_quant_reg.py:75: UserWarning: The distribution is specified by [0.1, 5] and step=0.25, but the range is not divisible by `step`. It will be replaced with [0.1, 4.85].
  error_threshold = trial.suggest_float("error_threshold", 0.1, 5, step=0.25)
[I 2026-07-21 09:55:51,605] Trial 300 finished with value: -0.0976409392850849 and parameters: {'error_threshold': 2.1, 'scalers': 'standard', 'ratios': 'norm_ratio', 'imputers': 'none', 'n_estimators': 1350, 'learning_rate': 0.01748843454271022, 'max_depth': 3, 'min_child_weight': 8, 'subsample': 0.8, 'colsample_bytree': 0.5, 'colsample_bylevel': 0.9, 'reg_alpha': 9.111219686827216e-05, 'reg_lambda': 0.015199953463994024, 'gamma': 0.0020210897724009906}. Best is trial 277 with value: -0.09711472095390473.
/bsuhome/alexanderemert/Research/Star-Formation-Research-Project-2026/pipeline/scripts/optuna/final_preds_and_models/optuna_search_mult_quant_reg.py:75: UserWarning: The distribution is specified by [0.1, 5] and step=0.25, but the range is not divisible by `step`. It will be replaced with [0.1, 4.85].
  error_threshold = trial.suggest_float("error_threshold", 0.1, 5, step=0.25)
[I 2026-07-21 09:55:59,596] Trial 301 finished with value: -0.09722022023356947 and parameters: {'error_threshold': 2.1, 'scalers': 'standard', 'ratios': 'norm_ratio', 'imputers': 'none', 'n_estimators': 1550, 'learning_rate': 0.023840679108141024, 'max_depth': 3, 'min_child_weight': 8, 'subsample': 0.8, 'colsample_bytree': 0.5, 'colsample_bylevel': 0.9, 'reg_alpha': 0.00010406157373677515, 'reg_lambda': 0.008909936165404938, 'gamma': 0.006141051372602244}. Best is trial 277 with value: -0.09711472095390473.
/bsuhome/alexanderemert/Research/Star-Formation-Research-Project-2026/pipeline/scripts/optuna/final_preds_and_models/optuna_search_mult_quant_reg.py:75: UserWarning: The distribution is specified by [0.1, 5] and step=0.25, but the range is not divisible by `step`. It will be replaced with [0.1, 4.85].
  error_threshold = trial.suggest_float("error_threshold", 0.1, 5, step=0.25)
[I 2026-07-21 09:56:06,062] Trial 302 finished with value: -0.09767857826883382 and parameters: {'error_threshold': 2.1, 'scalers': 'standard', 'ratios': 'norm_ratio', 'imputers': 'none', 'n_estimators': 1350, 'learning_rate': 0.024981396217392874, 'max_depth': 3, 'min_child_weight': 8, 'subsample': 0.8, 'colsample_bytree': 0.5, 'colsample_bylevel': 1.0, 'reg_alpha': 0.00010600965377856942, 'reg_lambda': 0.01647174297531494, 'gamma': 0.005481867557525321}. Best is trial 277 with value: -0.09711472095390473.
/bsuhome/alexanderemert/Research/Star-Formation-Research-Project-2026/pipeline/scripts/optuna/final_preds_and_models/optuna_search_mult_quant_reg.py:75: UserWarning: The distribution is specified by [0.1, 5] and step=0.25, but the range is not divisible by `step`. It will be replaced with [0.1, 4.85].
  error_threshold = trial.suggest_float("error_threshold", 0.1, 5, step=0.25)
[I 2026-07-21 09:56:07,326] Trial 303 finished with value: -0.09802423396808309 and parameters: {'error_threshold': 2.1, 'scalers': 'standard', 'ratios': 'norm_ratio', 'imputers': 'none', 'n_estimators': 1350, 'learning_rate': 0.017155494590827134, 'max_depth': 3, 'min_child_weight': 8, 'subsample': 0.8, 'colsample_bytree': 0.5, 'colsample_bylevel': 0.9, 'reg_alpha': 0.00010380519909478181, 'reg_lambda': 0.013485631422827448, 'gamma': 0.006932240554580449}. Best is trial 277 with value: -0.09711472095390473.
/bsuhome/alexanderemert/Research/Star-Formation-Research-Project-2026/pipeline/scripts/optuna/final_preds_and_models/optuna_search_mult_quant_reg.py:75: UserWarning: The distribution is specified by [0.1, 5] and step=0.25, but the range is not divisible by `step`. It will be replaced with [0.1, 4.85].
  error_threshold = trial.suggest_float("error_threshold", 0.1, 5, step=0.25)
[I 2026-07-21 09:56:08,542] Trial 304 finished with value: -0.0991245825694382 and parameters: {'error_threshold': 2.1, 'scalers': 'standard', 'ratios': 'norm_ratio', 'imputers': 'none', 'n_estimators': 1300, 'learning_rate': 0.01289510190609662, 'max_depth': 3, 'min_child_weight': 8, 'subsample': 0.8, 'colsample_bytree': 0.5, 'colsample_bylevel': 0.9, 'reg_alpha': 0.00011343921778039107, 'reg_lambda': 0.014324272002591797, 'gamma': 0.005443181153400987}. Best is trial 277 with value: -0.09711472095390473.
/bsuhome/alexanderemert/Research/Star-Formation-Research-Project-2026/pipeline/scripts/optuna/final_preds_and_models/optuna_search_mult_quant_reg.py:75: UserWarning: The distribution is specified by [0.1, 5] and step=0.25, but the range is not divisible by `step`. It will be replaced with [0.1, 4.85].
  error_threshold = trial.suggest_float("error_threshold", 0.1, 5, step=0.25)
[I 2026-07-21 09:56:13,859] Trial 305 finished with value: -0.09794983763560548 and parameters: {'error_threshold': 2.1, 'scalers': 'standard', 'ratios': 'norm_ratio', 'imputers': 'none', 'n_estimators': 1300, 'learning_rate': 0.01704051807109415, 'max_depth': 3, 'min_child_weight': 8, 'subsample': 0.8, 'colsample_bytree': 0.5, 'colsample_bylevel': 0.9, 'reg_alpha': 0.0001052672832957558, 'reg_lambda': 0.009845444043600615, 'gamma': 0.005858834040759311}. Best is trial 277 with value: -0.09711472095390473.
/bsuhome/alexanderemert/Research/Star-Formation-Research-Project-2026/pipeline/scripts/optuna/final_preds_and_models/optuna_search_mult_quant_reg.py:75: UserWarning: The distribution is specified by [0.1, 5] and step=0.25, but the range is not divisible by `step`. It will be replaced with [0.1, 4.85].
  error_threshold = trial.suggest_float("error_threshold", 0.1, 5, step=0.25)
[I 2026-07-21 09:56:15,088] Trial 306 finished with value: -0.09895279318639705 and parameters: {'error_threshold': 2.1, 'scalers': 'standard', 'ratios': 'norm_ratio', 'imputers': 'none', 'n_estimators': 1300, 'learning_rate': 0.013685409553358532, 'max_depth': 3, 'min_child_weight': 8, 'subsample': 0.8, 'colsample_bytree': 0.5, 'colsample_bylevel': 0.9, 'reg_alpha': 0.0005861755660103383, 'reg_lambda': 0.008793715936513503, 'gamma': 0.0019390341954217043}. Best is trial 277 with value: -0.09711472095390473.
/bsuhome/alexanderemert/Research/Star-Formation-Research-Project-2026/pipeline/scripts/optuna/final_preds_and_models/optuna_search_mult_quant_reg.py:75: UserWarning: The distribution is specified by [0.1, 5] and step=0.25, but the range is not divisible by `step`. It will be replaced with [0.1, 4.85].
  error_threshold = trial.suggest_float("error_threshold", 0.1, 5, step=0.25)
[I 2026-07-21 09:56:20,876] Trial 307 finished with value: -0.09947020837451047 and parameters: {'error_threshold': 2.1, 'scalers': 'standard', 'ratios': 'norm_ratio', 'imputers': 'none', 'n_estimators': 1300, 'learning_rate': 0.012230523402735224, 'max_depth': 3, 'min_child_weight': 8, 'subsample': 0.8, 'colsample_bytree': 0.5, 'colsample_bylevel': 0.9, 'reg_alpha': 0.00023690445903831197, 'reg_lambda': 0.014295683845718754, 'gamma': 0.00732910810918261}. Best is trial 277 with value: -0.09711472095390473.
/bsuhome/alexanderemert/Research/Star-Formation-Research-Project-2026/pipeline/scripts/optuna/final_preds_and_models/optuna_search_mult_quant_reg.py:75: UserWarning: The distribution is specified by [0.1, 5] and step=0.25, but the range is not divisible by `step`. It will be replaced with [0.1, 4.85].
  error_threshold = trial.suggest_float("error_threshold", 0.1, 5, step=0.25)
[I 2026-07-21 09:56:26,928] Trial 308 finished with value: -0.09787966913115242 and parameters: {'error_threshold': 2.1, 'scalers': 'standard', 'ratios': 'norm_ratio', 'imputers': 'none', 'n_estimators': 1300, 'learning_rate': 0.016407296600999266, 'max_depth': 3, 'min_child_weight': 8, 'subsample': 0.8, 'colsample_bytree': 0.5, 'colsample_bylevel': 0.9, 'reg_alpha': 0.0005563285255456628, 'reg_lambda': 0.014521952813686248, 'gamma': 0.0054149119389990015}. Best is trial 277 with value: -0.09711472095390473.
/bsuhome/alexanderemert/Research/Star-Formation-Research-Project-2026/pipeline/scripts/optuna/final_preds_and_models/optuna_search_mult_quant_reg.py:75: UserWarning: The distribution is specified by [0.1, 5] and step=0.25, but the range is not divisible by `step`. It will be replaced with [0.1, 4.85].
  error_threshold = trial.suggest_float("error_threshold", 0.1, 5, step=0.25)
[I 2026-07-21 09:56:32,956] Trial 309 finished with value: -0.09830218602346713 and parameters: {'error_threshold': 2.1, 'scalers': 'standard', 'ratios': 'norm_ratio', 'imputers': 'none', 'n_estimators': 1550, 'learning_rate': 0.013125558879036787, 'max_depth': 3, 'min_child_weight': 8, 'subsample': 0.8, 'colsample_bytree': 0.5, 'colsample_bylevel': 0.9, 'reg_alpha': 0.00052832092706572, 'reg_lambda': 0.01749020658229326, 'gamma': 0.006375054049918287}. Best is trial 277 with value: -0.09711472095390473.
/bsuhome/alexanderemert/Research/Star-Formation-Research-Project-2026/pipeline/scripts/optuna/final_preds_and_models/optuna_search_mult_quant_reg.py:75: UserWarning: The distribution is specified by [0.1, 5] and step=0.25, but the range is not divisible by `step`. It will be replaced with [0.1, 4.85].
  error_threshold = trial.suggest_float("error_threshold", 0.1, 5, step=0.25)
[I 2026-07-21 09:56:38,869] Trial 310 finished with value: -0.0984183961713435 and parameters: {'error_threshold': 2.1, 'scalers': 'standard', 'ratios': 'norm_ratio', 'imputers': 'none', 'n_estimators': 1550, 'learning_rate': 0.012652717550529302, 'max_depth': 3, 'min_child_weight': 8, 'subsample': 0.8, 'colsample_bytree': 0.5, 'colsample_bylevel': 0.9, 'reg_alpha': 0.0001015642472641123, 'reg_lambda': 0.016484789423070814, 'gamma': 0.006312239306535474}. Best is trial 277 with value: -0.09711472095390473.
/bsuhome/alexanderemert/Research/Star-Formation-Research-Project-2026/pipeline/scripts/optuna/final_preds_and_models/optuna_search_mult_quant_reg.py:75: UserWarning: The distribution is specified by [0.1, 5] and step=0.25, but the range is not divisible by `step`. It will be replaced with [0.1, 4.85].
  error_threshold = trial.suggest_float("error_threshold", 0.1, 5, step=0.25)
[I 2026-07-21 09:56:40,305] Trial 312 finished with value: -0.0980115363727065 and parameters: {'error_threshold': 2.1, 'scalers': 'standard', 'ratios': 'norm_ratio', 'imputers': 'none', 'n_estimators': 1550, 'learning_rate': 0.01372936621177939, 'max_depth': 3, 'min_child_weight': 8, 'subsample': 0.8, 'colsample_bytree': 0.5, 'colsample_bylevel': 0.9, 'reg_alpha': 0.00024438647361565513, 'reg_lambda': 0.018750491732091288, 'gamma': 0.004595763130522093}. Best is trial 277 with value: -0.09711472095390473.
/bsuhome/alexanderemert/Research/Star-Formation-Research-Project-2026/pipeline/scripts/optuna/final_preds_and_models/optuna_search_mult_quant_reg.py:75: UserWarning: The distribution is specified by [0.1, 5] and step=0.25, but the range is not divisible by `step`. It will be replaced with [0.1, 4.85].
  error_threshold = trial.suggest_float("error_threshold", 0.1, 5, step=0.25)
[I 2026-07-21 09:56:48,709] Trial 314 finished with value: -0.22121701821322307 and parameters: {'error_threshold': 2.1, 'scalers': 'standard', 'ratios': 'norm_ratio', 'imputers': 'none', 'n_estimators': 100, 'learning_rate': 0.017397983030619645, 'max_depth': 3, 'min_child_weight': 8, 'subsample': 0.8, 'colsample_bytree': 0.5, 'colsample_bylevel': 0.9, 'reg_alpha': 0.00023035902935894273, 'reg_lambda': 0.04478928884623069, 'gamma': 0.009277968690139604}. Best is trial 277 with value: -0.09711472095390473.
