[I 2026-07-21 09:58:42,545] Trial 192 finished with value: -0.18000975411040224 and parameters: {'error_threshold': 1.85, 'scalers': 'none', 'ratios': 'norm_ratio', 'imputers': 'mean', 'n_estimators': 2500, 'learning_rate': 0.005001983101483759, 'max_depth': 3, 'min_child_weight': 2, 'subsample': 0.5, 'colsample_bytree': 1.0, 'colsample_bylevel': 1.0, 'reg_alpha': 0.05504424889639849, 'reg_lambda': 0.0010012884695931982, 'gamma': 0.045962098186354744}. Best is trial 148 with value: -0.17981388443431892.
/bsuhome/alexanderemert/Research/Star-Formation-Research-Project-2026/pipeline/scripts/optuna/final_preds_and_models/optuna_search_mult_quant_reg.py:75: UserWarning: The distribution is specified by [0.1, 5] and step=0.25, but the range is not divisible by `step`. It will be replaced with [0.1, 4.85].
  error_threshold = trial.suggest_float("error_threshold", 0.1, 5, step=0.25)
[I 2026-07-21 09:58:49,461] Trial 193 finished with value: -0.18052734110056293 and parameters: {'error_threshold': 1.85, 'scalers': 'none', 'ratios': 'norm_ratio', 'imputers': 'mean', 'n_estimators': 2500, 'learning_rate': 0.00903733539296603, 'max_depth': 3, 'min_child_weight': 2, 'subsample': 0.5, 'colsample_bytree': 1.0, 'colsample_bylevel': 1.0, 'reg_alpha': 0.04968601363738704, 'reg_lambda': 0.0010938239430544167, 'gamma': 0.05543989596138029}. Best is trial 148 with value: -0.17981388443431892.
/bsuhome/alexanderemert/Research/Star-Formation-Research-Project-2026/pipeline/scripts/optuna/final_preds_and_models/optuna_search_mult_quant_reg.py:75: UserWarning: The distribution is specified by [0.1, 5] and step=0.25, but the range is not divisible by `step`. It will be replaced with [0.1, 4.85].
  error_threshold = trial.suggest_float("error_threshold", 0.1, 5, step=0.25)
[I 2026-07-21 09:58:52,828] Trial 194 finished with value: -0.18091345476632303 and parameters: {'error_threshold': 1.85, 'scalers': 'none', 'ratios': 'norm_ratio', 'imputers': 'mean', 'n_estimators': 2800, 'learning_rate': 0.008943517860507476, 'max_depth': 3, 'min_child_weight': 2, 'subsample': 0.5, 'colsample_bytree': 1.0, 'colsample_bylevel': 1.0, 'reg_alpha': 0.054535357871821045, 'reg_lambda': 0.000983722145697841, 'gamma': 0.04948933910852492}. Best is trial 148 with value: -0.17981388443431892.
/bsuhome/alexanderemert/Research/Star-Formation-Research-Project-2026/pipeline/scripts/optuna/final_preds_and_models/optuna_search_mult_quant_reg.py:75: UserWarning: The distribution is specified by [0.1, 5] and step=0.25, but the range is not divisible by `step`. It will be replaced with [0.1, 4.85].
  error_threshold = trial.suggest_float("error_threshold", 0.1, 5, step=0.25)
[I 2026-07-21 09:59:13,893] Trial 195 finished with value: -0.18088487050988436 and parameters: {'error_threshold': 1.6, 'scalers': 'none', 'ratios': 'norm_ratio', 'imputers': 'mean', 'n_estimators': 2800, 'learning_rate': 0.00962248011367421, 'max_depth': 3, 'min_child_weight': 2, 'subsample': 0.5, 'colsample_bytree': 1.0, 'colsample_bylevel': 1.0, 'reg_alpha': 0.05248275180051266, 'reg_lambda': 0.0009532134010493835, 'gamma': 0.06144650824817479}. Best is trial 148 with value: -0.17981388443431892.
/bsuhome/alexanderemert/Research/Star-Formation-Research-Project-2026/pipeline/scripts/optuna/final_preds_and_models/optuna_search_mult_quant_reg.py:75: UserWarning: The distribution is specified by [0.1, 5] and step=0.25, but the range is not divisible by `step`. It will be replaced with [0.1, 4.85].
  error_threshold = trial.suggest_float("error_threshold", 0.1, 5, step=0.25)
[I 2026-07-21 09:59:27,386] Trial 196 finished with value: -0.180298213077314 and parameters: {'error_threshold': 1.85, 'scalers': 'none', 'ratios': 'norm_ratio', 'imputers': 'mean', 'n_estimators': 2800, 'learning_rate': 0.004864198234037765, 'max_depth': 3, 'min_child_weight': 2, 'subsample': 0.5, 'colsample_bytree': 1.0, 'colsample_bylevel': 1.0, 'reg_alpha': 0.11691818579530439, 'reg_lambda': 0.001113224673692405, 'gamma': 0.05135261788919989}. Best is trial 148 with value: -0.17981388443431892.
/bsuhome/alexanderemert/Research/Star-Formation-Research-Project-2026/pipeline/scripts/optuna/final_preds_and_models/optuna_search_mult_quant_reg.py:75: UserWarning: The distribution is specified by [0.1, 5] and step=0.25, but the range is not divisible by `step`. It will be replaced with [0.1, 4.85].
  error_threshold = trial.suggest_float("error_threshold", 0.1, 5, step=0.25)
[I 2026-07-21 09:59:34,425] Trial 197 finished with value: -0.18026238568680586 and parameters: {'error_threshold': 2.35, 'scalers': 'none', 'ratios': 'norm_ratio', 'imputers': 'mean', 'n_estimators': 2500, 'learning_rate': 0.005010234981567646, 'max_depth': 3, 'min_child_weight': 2, 'subsample': 0.5, 'colsample_bytree': 1.0, 'colsample_bylevel': 1.0, 'reg_alpha': 1.3353421454026336e-06, 'reg_lambda': 0.0002573061914806031, 'gamma': 0.04437322676139737}. Best is trial 148 with value: -0.17981388443431892.
/bsuhome/alexanderemert/Research/Star-Formation-Research-Project-2026/pipeline/scripts/optuna/final_preds_and_models/optuna_search_mult_quant_reg.py:75: UserWarning: The distribution is specified by [0.1, 5] and step=0.25, but the range is not divisible by `step`. It will be replaced with [0.1, 4.85].
  error_threshold = trial.suggest_float("error_threshold", 0.1, 5, step=0.25)
[I 2026-07-21 09:59:48,877] Trial 198 finished with value: -0.1800287162038032 and parameters: {'error_threshold': 1.85, 'scalers': 'none', 'ratios': 'norm_ratio', 'imputers': 'mean', 'n_estimators': 2800, 'learning_rate': 0.005088997577094546, 'max_depth': 3, 'min_child_weight': 2, 'subsample': 0.5, 'colsample_bytree': 1.0, 'colsample_bylevel': 1.0, 'reg_alpha': 0.05583516134115562, 'reg_lambda': 0.0008146931070205455, 'gamma': 0.05844212643082623}. Best is trial 148 with value: -0.17981388443431892.
/bsuhome/alexanderemert/Research/Star-Formation-Research-Project-2026/pipeline/scripts/optuna/final_preds_and_models/optuna_search_mult_quant_reg.py:75: UserWarning: The distribution is specified by [0.1, 5] and step=0.25, but the range is not divisible by `step`. It will be replaced with [0.1, 4.85].
  error_threshold = trial.suggest_float("error_threshold", 0.1, 5, step=0.25)
[I 2026-07-21 09:59:55,266] Trial 199 finished with value: -0.18013127273222596 and parameters: {'error_threshold': 2.35, 'scalers': 'none', 'ratios': 'norm_ratio', 'imputers': 'mean', 'n_estimators': 2800, 'learning_rate': 0.005075448747167365, 'max_depth': 3, 'min_child_weight': 2, 'subsample': 0.5, 'colsample_bytree': 1.0, 'colsample_bylevel': 1.0, 'reg_alpha': 0.048505067693259636, 'reg_lambda': 0.0002874899171774209, 'gamma': 0.05521932828603972}. Best is trial 148 with value: -0.17981388443431892.
/bsuhome/alexanderemert/Research/Star-Formation-Research-Project-2026/pipeline/scripts/optuna/final_preds_and_models/optuna_search_mult_quant_reg.py:75: UserWarning: The distribution is specified by [0.1, 5] and step=0.25, but the range is not divisible by `step`. It will be replaced with [0.1, 4.85].
  error_threshold = trial.suggest_float("error_threshold", 0.1, 5, step=0.25)
[I 2026-07-21 10:00:02,693] Trial 200 finished with value: -0.18016091465571896 and parameters: {'error_threshold': 2.35, 'scalers': 'none', 'ratios': 'norm_ratio', 'imputers': 'mean', 'n_estimators': 2800, 'learning_rate': 0.0052906918634215375, 'max_depth': 3, 'min_child_weight': 2, 'subsample': 0.5, 'colsample_bytree': 1.0, 'colsample_bylevel': 1.0, 'reg_alpha': 0.10190248927912884, 'reg_lambda': 0.0015920886091347838, 'gamma': 0.024711485346448053}. Best is trial 148 with value: -0.17981388443431892.
/bsuhome/alexanderemert/Research/Star-Formation-Research-Project-2026/pipeline/scripts/optuna/final_preds_and_models/optuna_search_mult_quant_reg.py:75: UserWarning: The distribution is specified by [0.1, 5] and step=0.25, but the range is not divisible by `step`. It will be replaced with [0.1, 4.85].
  error_threshold = trial.suggest_float("error_threshold", 0.1, 5, step=0.25)
[I 2026-07-21 10:00:05,765] Trial 201 finished with value: -0.18030494476298378 and parameters: {'error_threshold': 2.35, 'scalers': 'none', 'ratios': 'norm_ratio', 'imputers': 'mean', 'n_estimators': 2500, 'learning_rate': 0.005101215568509984, 'max_depth': 3, 'min_child_weight': 2, 'subsample': 0.5, 'colsample_bytree': 1.0, 'colsample_bylevel': 1.0, 'reg_alpha': 0.052340143651671084, 'reg_lambda': 0.0018610666094126705, 'gamma': 0.028383968233804624}. Best is trial 148 with value: -0.17981388443431892.
/bsuhome/alexanderemert/Research/Star-Formation-Research-Project-2026/pipeline/scripts/optuna/final_preds_and_models/optuna_search_mult_quant_reg.py:75: UserWarning: The distribution is specified by [0.1, 5] and step=0.25, but the range is not divisible by `step`. It will be replaced with [0.1, 4.85].
  error_threshold = trial.suggest_float("error_threshold", 0.1, 5, step=0.25)
[I 2026-07-21 10:00:08,753] Trial 202 finished with value: -0.1803401791431828 and parameters: {'error_threshold': 2.1, 'scalers': 'none', 'ratios': 'norm_ratio', 'imputers': 'mean', 'n_estimators': 2450, 'learning_rate': 0.005129494783114761, 'max_depth': 3, 'min_child_weight': 2, 'subsample': 0.5, 'colsample_bytree': 1.0, 'colsample_bylevel': 1.0, 'reg_alpha': 2.0698633228530266e-06, 'reg_lambda': 0.0017910304076726297, 'gamma': 0.02133360876367623}. Best is trial 148 with value: -0.17981388443431892.
/bsuhome/alexanderemert/Research/Star-Formation-Research-Project-2026/pipeline/scripts/optuna/final_preds_and_models/optuna_search_mult_quant_reg.py:75: UserWarning: The distribution is specified by [0.1, 5] and step=0.25, but the range is not divisible by `step`. It will be replaced with [0.1, 4.85].
  error_threshold = trial.suggest_float("error_threshold", 0.1, 5, step=0.25)
[I 2026-07-21 10:00:19,130] Trial 203 finished with value: -0.18700790398272057 and parameters: {'error_threshold': 2.1, 'scalers': 'none', 'ratios': 'norm_ratio', 'imputers': 'mean', 'n_estimators': 850, 'learning_rate': 0.005084470106746254, 'max_depth': 3, 'min_child_weight': 2, 'subsample': 0.5, 'colsample_bytree': 1.0, 'colsample_bylevel': 1.0, 'reg_alpha': 2.173227334918799e-06, 'reg_lambda': 0.004162278280948353, 'gamma': 0.023678837418958595}. Best is trial 148 with value: -0.17981388443431892.
/bsuhome/alexanderemert/Research/Star-Formation-Research-Project-2026/pipeline/scripts/optuna/final_preds_and_models/optuna_search_mult_quant_reg.py:75: UserWarning: The distribution is specified by [0.1, 5] and step=0.25, but the range is not divisible by `step`. It will be replaced with [0.1, 4.85].
  error_threshold = trial.suggest_float("error_threshold", 0.1, 5, step=0.25)
[I 2026-07-21 10:00:38,364] Trial 204 finished with value: -0.18044490419850046 and parameters: {'error_threshold': 2.35, 'scalers': 'none', 'ratios': 'norm_ratio', 'imputers': 'mean', 'n_estimators': 2400, 'learning_rate': 0.005097215036887147, 'max_depth': 3, 'min_child_weight': 2, 'subsample': 0.5, 'colsample_bytree': 1.0, 'colsample_bylevel': 1.0, 'reg_alpha': 0.09555860393749471, 'reg_lambda': 0.0024309316097666255, 'gamma': 0.02190956781981542}. Best is trial 148 with value: -0.17981388443431892.
/bsuhome/alexanderemert/Research/Star-Formation-Research-Project-2026/pipeline/scripts/optuna/final_preds_and_models/optuna_search_mult_quant_reg.py:75: UserWarning: The distribution is specified by [0.1, 5] and step=0.25, but the range is not divisible by `step`. It will be replaced with [0.1, 4.85].
  error_threshold = trial.suggest_float("error_threshold", 0.1, 5, step=0.25)
[I 2026-07-21 10:00:48,306] Trial 205 finished with value: -0.17999087051574905 and parameters: {'error_threshold': 2.35, 'scalers': 'none', 'ratios': 'norm_ratio', 'imputers': 'mean', 'n_estimators': 2400, 'learning_rate': 0.005026300346097911, 'max_depth': 3, 'min_child_weight': 3, 'subsample': 0.5, 'colsample_bytree': 1.0, 'colsample_bylevel': 1.0, 'reg_alpha': 0.0006642356382071692, 'reg_lambda': 0.0022063372324676147, 'gamma': 0.024668041481044015}. Best is trial 148 with value: -0.17981388443431892.
/bsuhome/alexanderemert/Research/Star-Formation-Research-Project-2026/pipeline/scripts/optuna/final_preds_and_models/optuna_search_mult_quant_reg.py:75: UserWarning: The distribution is specified by [0.1, 5] and step=0.25, but the range is not divisible by `step`. It will be replaced with [0.1, 4.85].
  error_threshold = trial.suggest_float("error_threshold", 0.1, 5, step=0.25)
[I 2026-07-21 10:01:03,192] Trial 206 finished with value: -0.18027581275874968 and parameters: {'error_threshold': 2.35, 'scalers': 'none', 'ratios': 'norm_ratio', 'imputers': 'mean', 'n_estimators': 2450, 'learning_rate': 0.005041924475754949, 'max_depth': 3, 'min_child_weight': 2, 'subsample': 0.5, 'colsample_bytree': 1.0, 'colsample_bylevel': 1.0, 'reg_alpha': 1.5680304839586073e-06, 'reg_lambda': 0.0014057197265603001, 'gamma': 0.024062814490972886}. Best is trial 148 with value: -0.17981388443431892.
/bsuhome/alexanderemert/Research/Star-Formation-Research-Project-2026/pipeline/scripts/optuna/final_preds_and_models/optuna_search_mult_quant_reg.py:75: UserWarning: The distribution is specified by [0.1, 5] and step=0.25, but the range is not divisible by `step`. It will be replaced with [0.1, 4.85].
  error_threshold = trial.suggest_float("error_threshold", 0.1, 5, step=0.25)
[I 2026-07-21 10:01:09,855] Trial 207 finished with value: -0.1808327549860207 and parameters: {'error_threshold': 2.35, 'scalers': 'none', 'ratios': 'norm_ratio', 'imputers': 'mean', 'n_estimators': 2450, 'learning_rate': 0.0034431378499850695, 'max_depth': 3, 'min_child_weight': 3, 'subsample': 0.5, 'colsample_bytree': 1.0, 'colsample_bylevel': 1.0, 'reg_alpha': 1.381463431721811e-06, 'reg_lambda': 0.0019267225661488976, 'gamma': 0.024749016615183295}. Best is trial 148 with value: -0.17981388443431892.
/bsuhome/alexanderemert/Research/Star-Formation-Research-Project-2026/pipeline/scripts/optuna/final_preds_and_models/optuna_search_mult_quant_reg.py:75: UserWarning: The distribution is specified by [0.1, 5] and step=0.25, but the range is not divisible by `step`. It will be replaced with [0.1, 4.85].
  error_threshold = trial.suggest_float("error_threshold", 0.1, 5, step=0.25)
[I 2026-07-21 10:01:20,115] Trial 208 finished with value: -0.1801039453470771 and parameters: {'error_threshold': 2.35, 'scalers': 'none', 'ratios': 'norm_ratio', 'imputers': 'mean', 'n_estimators': 2800, 'learning_rate': 0.00497763302689933, 'max_depth': 3, 'min_child_weight': 2, 'subsample': 0.5, 'colsample_bytree': 1.0, 'colsample_bylevel': 1.0, 'reg_alpha': 5.557807833612335e-06, 'reg_lambda': 0.0032230442541410606, 'gamma': 0.023956419517915786}. Best is trial 148 with value: -0.17981388443431892.
/bsuhome/alexanderemert/Research/Star-Formation-Research-Project-2026/pipeline/scripts/optuna/final_preds_and_models/optuna_search_mult_quant_reg.py:75: UserWarning: The distribution is specified by [0.1, 5] and step=0.25, but the range is not divisible by `step`. It will be replaced with [0.1, 4.85].
  error_threshold = trial.suggest_float("error_threshold", 0.1, 5, step=0.25)
[I 2026-07-21 10:01:23,170] Trial 209 finished with value: -0.18114775624687104 and parameters: {'error_threshold': 2.35, 'scalers': 'none', 'ratios': 'norm_ratio', 'imputers': 'mean', 'n_estimators': 2400, 'learning_rate': 0.0034437432019208147, 'max_depth': 3, 'min_child_weight': 2, 'subsample': 0.5, 'colsample_bytree': 1.0, 'colsample_bylevel': 1.0, 'reg_alpha': 2.5438077176590836e-06, 'reg_lambda': 0.0023711649588369988, 'gamma': 0.02043439245336798}. Best is trial 148 with value: -0.17981388443431892.
/bsuhome/alexanderemert/Research/Star-Formation-Research-Project-2026/pipeline/scripts/optuna/final_preds_and_models/optuna_search_mult_quant_reg.py:75: UserWarning: The distribution is specified by [0.1, 5] and step=0.25, but the range is not divisible by `step`. It will be replaced with [0.1, 4.85].
  error_threshold = trial.suggest_float("error_threshold", 0.1, 5, step=0.25)
[I 2026-07-21 10:01:26,807] Trial 210 finished with value: -0.23018933574470246 and parameters: {'error_threshold': 2.35, 'scalers': 'none', 'ratios': 'norm_ratio', 'imputers': 'mean', 'n_estimators': 2800, 'learning_rate': 0.00040535694058693787, 'max_depth': 3, 'min_child_weight': 2, 'subsample': 0.5, 'colsample_bytree': 1.0, 'colsample_bylevel': 1.0, 'reg_alpha': 0.00019837013581331037, 'reg_lambda': 0.002934818786283929, 'gamma': 0.041526183729430684}. Best is trial 148 with value: -0.17981388443431892.
/bsuhome/alexanderemert/Research/Star-Formation-Research-Project-2026/pipeline/scripts/optuna/final_preds_and_models/optuna_search_mult_quant_reg.py:75: UserWarning: The distribution is specified by [0.1, 5] and step=0.25, but the range is not divisible by `step`. It will be replaced with [0.1, 4.85].
  error_threshold = trial.suggest_float("error_threshold", 0.1, 5, step=0.25)
[I 2026-07-21 10:01:40,594] Trial 211 finished with value: -0.18053498344179622 and parameters: {'error_threshold': 2.35, 'scalers': 'none', 'ratios': 'norm_ratio', 'imputers': 'mean', 'n_estimators': 2800, 'learning_rate': 0.003391403693211754, 'max_depth': 3, 'min_child_weight': 2, 'subsample': 0.5, 'colsample_bytree': 1.0, 'colsample_bylevel': 1.0, 'reg_alpha': 0.10071116513456174, 'reg_lambda': 0.006682849820893154, 'gamma': 0.024011096398759382}. Best is trial 148 with value: -0.17981388443431892.
/bsuhome/alexanderemert/Research/Star-Formation-Research-Project-2026/pipeline/scripts/optuna/final_preds_and_models/optuna_search_mult_quant_reg.py:75: UserWarning: The distribution is specified by [0.1, 5] and step=0.25, but the range is not divisible by `step`. It will be replaced with [0.1, 4.85].
  error_threshold = trial.suggest_float("error_threshold", 0.1, 5, step=0.25)
[I 2026-07-21 10:02:00,006] Trial 212 finished with value: -0.23622561494689442 and parameters: {'error_threshold': 2.35, 'scalers': 'none', 'ratios': 'norm_ratio', 'imputers': 'mean', 'n_estimators': 2850, 'learning_rate': 0.00034997648393320714, 'max_depth': 3, 'min_child_weight': 2, 'subsample': 0.5, 'colsample_bytree': 1.0, 'colsample_bylevel': 1.0, 'reg_alpha': 9.422648679643333e-06, 'reg_lambda': 0.0007928402148570123, 'gamma': 0.03886514423158707}. Best is trial 148 with value: -0.17981388443431892.
/bsuhome/alexanderemert/Research/Star-Formation-Research-Project-2026/pipeline/scripts/optuna/final_preds_and_models/optuna_search_mult_quant_reg.py:75: UserWarning: The distribution is specified by [0.1, 5] and step=0.25, but the range is not divisible by `step`. It will be replaced with [0.1, 4.85].
  error_threshold = trial.suggest_float("error_threshold", 0.1, 5, step=0.25)
[I 2026-07-21 10:02:09,025] Trial 213 finished with value: -0.17943057073290683 and parameters: {'error_threshold': 2.6, 'scalers': 'none', 'ratios': 'norm_ratio', 'imputers': 'mean', 'n_estimators': 2400, 'learning_rate': 0.007057127975980645, 'max_depth': 3, 'min_child_weight': 3, 'subsample': 0.5, 'colsample_bytree': 1.0, 'colsample_bylevel': 1.0, 'reg_alpha': 5.160079730329841e-05, 'reg_lambda': 0.0026589565612808266, 'gamma': 0.0270569367704786}. Best is trial 213 with value: -0.17943057073290683.
/bsuhome/alexanderemert/Research/Star-Formation-Research-Project-2026/pipeline/scripts/optuna/final_preds_and_models/optuna_search_mult_quant_reg.py:75: UserWarning: The distribution is specified by [0.1, 5] and step=0.25, but the range is not divisible by `step`. It will be replaced with [0.1, 4.85].
  error_threshold = trial.suggest_float("error_threshold", 0.1, 5, step=0.25)
[I 2026-07-21 10:02:22,615] Trial 214 finished with value: -0.18080426701907296 and parameters: {'error_threshold': 2.6, 'scalers': 'none', 'ratios': 'norm_ratio', 'imputers': 'mean', 'n_estimators': 2400, 'learning_rate': 0.003439936963659204, 'max_depth': 3, 'min_child_weight': 3, 'subsample': 0.5, 'colsample_bytree': 1.0, 'colsample_bylevel': 1.0, 'reg_alpha': 1.0798466092106914e-06, 'reg_lambda': 0.002677052569280479, 'gamma': 0.03287339176777454}. Best is trial 213 with value: -0.17943057073290683.
/bsuhome/alexanderemert/Research/Star-Formation-Research-Project-2026/pipeline/scripts/optuna/final_preds_and_models/optuna_search_mult_quant_reg.py:75: UserWarning: The distribution is specified by [0.1, 5] and step=0.25, but the range is not divisible by `step`. It will be replaced with [0.1, 4.85].
  error_threshold = trial.suggest_float("error_threshold", 0.1, 5, step=0.25)
[I 2026-07-21 10:02:28,486] Trial 215 finished with value: -0.18071863923641565 and parameters: {'error_threshold': 2.35, 'scalers': 'none', 'ratios': 'norm_ratio', 'imputers': 'mean', 'n_estimators': 2350, 'learning_rate': 0.003487084704264765, 'max_depth': 3, 'min_child_weight': 3, 'subsample': 0.5, 'colsample_bytree': 1.0, 'colsample_bylevel': 1.0, 'reg_alpha': 0.00014571989544996384, 'reg_lambda': 0.007541405768702041, 'gamma': 0.03023560379066815}. Best is trial 213 with value: -0.17943057073290683.
/bsuhome/alexanderemert/Research/Star-Formation-Research-Project-2026/pipeline/scripts/optuna/final_preds_and_models/optuna_search_mult_quant_reg.py:75: UserWarning: The distribution is specified by [0.1, 5] and step=0.25, but the range is not divisible by `step`. It will be replaced with [0.1, 4.85].
  error_threshold = trial.suggest_float("error_threshold", 0.1, 5, step=0.25)
