[I 2026-07-20 13:42:19,864] Trial 406 finished with value: -0.33018141346800617 and parameters: {'error_threshold': 4.5, 'scalers': 'robust', 'ratios': 'norm_ratio', 'imputers': 'mean', 'n_estimators': 850, 'learning_rate': 0.006514548431077131, 'max_depth': 5, 'min_child_weight': 2, 'subsample': 0.5, 'colsample_bytree': 0.5, 'colsample_bylevel': 0.9, 'reg_alpha': 51.9543217603444, 'reg_lambda': 71.17330366525206, 'gamma': 58.34027875134249}. Best is trial 355 with value: -0.3345736073215237.
[I 2026-07-20 13:42:20,365] Trial 407 finished with value: -0.33454872454282164 and parameters: {'error_threshold': 4.5, 'scalers': 'robust', 'ratios': 'norm_ratio', 'imputers': 'mean', 'n_estimators': 850, 'learning_rate': 0.01044952978467305, 'max_depth': 5, 'min_child_weight': 2, 'subsample': 0.5, 'colsample_bytree': 0.5, 'colsample_bylevel': 0.9, 'reg_alpha': 97.70769213634657, 'reg_lambda': 0.00031135542375472654, 'gamma': 60.8475178934141}. Best is trial 355 with value: -0.3345736073215237.
[I 2026-07-20 13:42:28,703] Trial 408 finished with value: -0.33453965111425427 and parameters: {'error_threshold': 4.5, 'scalers': 'robust', 'ratios': 'norm_ratio', 'imputers': 'mean', 'n_estimators': 850, 'learning_rate': 0.00578153575270414, 'max_depth': 5, 'min_child_weight': 2, 'subsample': 0.5, 'colsample_bytree': 0.5, 'colsample_bylevel': 0.9, 'reg_alpha': 97.15504238855883, 'reg_lambda': 38.40617977137553, 'gamma': 53.704609458631204}. Best is trial 355 with value: -0.3345736073215237.
[I 2026-07-20 13:42:29,258] Trial 409 finished with value: -0.33452496184978586 and parameters: {'error_threshold': 4.0, 'scalers': 'robust', 'ratios': 'norm_ratio', 'imputers': 'mean', 'n_estimators': 1100, 'learning_rate': 0.01179450301472688, 'max_depth': 4, 'min_child_weight': 2, 'subsample': 0.5, 'colsample_bytree': 0.5, 'colsample_bylevel': 0.9, 'reg_alpha': 99.29117338127078, 'reg_lambda': 0.00032325229623151404, 'gamma': 58.97330176152048}. Best is trial 355 with value: -0.3345736073215237.
[I 2026-07-20 13:42:29,712] Trial 410 finished with value: -0.33453451279293156 and parameters: {'error_threshold': 4.5, 'scalers': 'robust', 'ratios': 'norm_ratio', 'imputers': 'mean', 'n_estimators': 950, 'learning_rate': 0.006590259178783536, 'max_depth': 3, 'min_child_weight': 2, 'subsample': 0.5, 'colsample_bytree': 0.5, 'colsample_bylevel': 0.9, 'reg_alpha': 96.97545346013501, 'reg_lambda': 0.0026832766261532, 'gamma': 58.4423865208226}. Best is trial 355 with value: -0.3345736073215237.
[I 2026-07-20 13:42:30,159] Trial 411 finished with value: -0.3345329640578627 and parameters: {'error_threshold': 4.5, 'scalers': 'robust', 'ratios': 'norm_ratio', 'imputers': 'mean', 'n_estimators': 950, 'learning_rate': 0.011880577876527593, 'max_depth': 3, 'min_child_weight': 2, 'subsample': 0.5, 'colsample_bytree': 0.5, 'colsample_bylevel': 0.9, 'reg_alpha': 98.36698023733831, 'reg_lambda': 0.210417213091985, 'gamma': 61.359611610010994}. Best is trial 355 with value: -0.3345736073215237.
[I 2026-07-20 13:42:30,763] Trial 412 finished with value: -0.3252677525569565 and parameters: {'error_threshold': 4.5, 'scalers': 'robust', 'ratios': 'norm_ratio', 'imputers': 'mean', 'n_estimators': 1200, 'learning_rate': 0.011490200325436807, 'max_depth': 3, 'min_child_weight': 2, 'subsample': 0.5, 'colsample_bytree': 0.5, 'colsample_bylevel': 0.9, 'reg_alpha': 90.55533222057045, 'reg_lambda': 99.03279491671961, 'gamma': 27.563856549767216}. Best is trial 355 with value: -0.3345736073215237.
[I 2026-07-20 13:42:31,278] Trial 413 finished with value: -0.327541513188155 and parameters: {'error_threshold': 4.0, 'scalers': 'robust', 'ratios': 'norm_ratio', 'imputers': 'mean', 'n_estimators': 1100, 'learning_rate': 0.006077993167939786, 'max_depth': 3, 'min_child_weight': 2, 'subsample': 0.5, 'colsample_bytree': 0.5, 'colsample_bylevel': 0.9, 'reg_alpha': 98.88438765203439, 'reg_lambda': 83.85712898546629, 'gamma': 24.68559022462363}. Best is trial 355 with value: -0.3345736073215237.
[I 2026-07-20 13:42:31,768] Trial 414 finished with value: -0.32121257969173006 and parameters: {'error_threshold': 4.25, 'scalers': 'robust', 'ratios': 'norm_ratio', 'imputers': 'mean', 'n_estimators': 950, 'learning_rate': 0.011600108508361103, 'max_depth': 3, 'min_child_weight': 2, 'subsample': 0.5, 'colsample_bytree': 0.5, 'colsample_bylevel': 0.9, 'reg_alpha': 97.9910240091759, 'reg_lambda': 0.1243185135220912, 'gamma': 23.026503081839234}. Best is trial 355 with value: -0.3345736073215237.
[I 2026-07-20 13:42:32,222] Trial 415 finished with value: -0.32771506917520327 and parameters: {'error_threshold': 4.25, 'scalers': 'robust', 'ratios': 'norm_ratio', 'imputers': 'mean', 'n_estimators': 950, 'learning_rate': 0.012575646048303413, 'max_depth': 5, 'min_child_weight': 2, 'subsample': 0.5, 'colsample_bytree': 0.5, 'colsample_bylevel': 0.9, 'reg_alpha': 99.62767815311413, 'reg_lambda': 90.35883103918937, 'gamma': 24.75037146523491}. Best is trial 355 with value: -0.3345736073215237.
[I 2026-07-20 13:42:40,280] Trial 416 finished with value: -0.31833065956043444 and parameters: {'error_threshold': 4.0, 'scalers': 'robust', 'ratios': 'norm_ratio', 'imputers': 'mean', 'n_estimators': 1100, 'learning_rate': 0.013783461297784735, 'max_depth': 5, 'min_child_weight': 2, 'subsample': 0.5, 'colsample_bytree': 0.5, 'colsample_bylevel': 0.9, 'reg_alpha': 93.27425204233352, 'reg_lambda': 0.00033687800654332224, 'gamma': 23.54765517543882}. Best is trial 355 with value: -0.3345736073215237.
[I 2026-07-20 13:42:40,729] Trial 417 finished with value: -0.3228624171942593 and parameters: {'error_threshold': 4.25, 'scalers': 'robust', 'ratios': 'norm_ratio', 'imputers': 'mean', 'n_estimators': 950, 'learning_rate': 0.012281266567824994, 'max_depth': 5, 'min_child_weight': 2, 'subsample': 0.5, 'colsample_bytree': 0.5, 'colsample_bylevel': 0.9, 'reg_alpha': 90.56051573392584, 'reg_lambda': 0.0023491194905464786, 'gamma': 29.152648874627427}. Best is trial 355 with value: -0.3345736073215237.
[I 2026-07-20 13:42:41,218] Trial 418 finished with value: -0.32490477165942994 and parameters: {'error_threshold': 4.25, 'scalers': 'robust', 'ratios': 'norm_ratio', 'imputers': 'mean', 'n_estimators': 950, 'learning_rate': 0.016386383313844052, 'max_depth': 3, 'min_child_weight': 2, 'subsample': 0.5, 'colsample_bytree': 0.5, 'colsample_bylevel': 0.9, 'reg_alpha': 98.69162421886732, 'reg_lambda': 0.0009305463106671823, 'gamma': 26.430472161029407}. Best is trial 355 with value: -0.3345736073215237.
[I 2026-07-20 13:42:41,660] Trial 419 finished with value: -0.32044159687030654 and parameters: {'error_threshold': 4.25, 'scalers': 'robust', 'ratios': 'norm_ratio', 'imputers': 'mean', 'n_estimators': 950, 'learning_rate': 0.01548137350397283, 'max_depth': 3, 'min_child_weight': 2, 'subsample': 0.5, 'colsample_bytree': 0.5, 'colsample_bylevel': 0.9, 'reg_alpha': 97.25111212669783, 'reg_lambda': 0.11014801488502503, 'gamma': 23.02642852470795}. Best is trial 355 with value: -0.3345736073215237.
[I 2026-07-20 13:42:42,114] Trial 420 finished with value: -0.3190975580038449 and parameters: {'error_threshold': 4.25, 'scalers': 'robust', 'ratios': 'norm_ratio', 'imputers': 'mean', 'n_estimators': 950, 'learning_rate': 0.013918526706198373, 'max_depth': 3, 'min_child_weight': 2, 'subsample': 0.5, 'colsample_bytree': 0.5, 'colsample_bylevel': 0.9, 'reg_alpha': 98.06063337155994, 'reg_lambda': 0.000805699761398886, 'gamma': 21.28710220555687}. Best is trial 355 with value: -0.3345736073215237.
[I 2026-07-20 13:42:42,611] Trial 421 finished with value: -0.33162649750323414 and parameters: {'error_threshold': 4.25, 'scalers': 'robust', 'ratios': 'norm_ratio', 'imputers': 'mean', 'n_estimators': 950, 'learning_rate': 0.014775185844199139, 'max_depth': 3, 'min_child_weight': 2, 'subsample': 0.5, 'colsample_bytree': 0.5, 'colsample_bylevel': 0.9, 'reg_alpha': 96.21474303097263, 'reg_lambda': 0.0038543387954515047, 'gamma': 33.560895009705256}. Best is trial 355 with value: -0.3345736073215237.
[I 2026-07-20 13:42:43,019] Trial 422 finished with value: -0.30905860100710963 and parameters: {'error_threshold': 4.25, 'scalers': 'robust', 'ratios': 'norm_ratio', 'imputers': 'mean', 'n_estimators': 850, 'learning_rate': 0.01331254180195543, 'max_depth': 3, 'min_child_weight': 2, 'subsample': 0.5, 'colsample_bytree': 0.5, 'colsample_bylevel': 0.9, 'reg_alpha': 49.92411582636849, 'reg_lambda': 0.002574658845236349, 'gamma': 40.85649058814945}. Best is trial 355 with value: -0.3345736073215237.
[I 2026-07-20 13:42:43,413] Trial 423 finished with value: -0.3339551783299026 and parameters: {'error_threshold': 4.5, 'scalers': 'robust', 'ratios': 'norm_ratio', 'imputers': 'mean', 'n_estimators': 850, 'learning_rate': 0.01768453656516184, 'max_depth': 3, 'min_child_weight': 2, 'subsample': 0.5, 'colsample_bytree': 0.5, 'colsample_bylevel': 0.9, 'reg_alpha': 99.8347480878236, 'reg_lambda': 0.1027001014508605, 'gamma': 34.165623808987355}. Best is trial 355 with value: -0.3345736073215237.
[I 2026-07-20 13:42:52,024] Trial 424 finished with value: -0.3042449058672873 and parameters: {'error_threshold': 4.25, 'scalers': 'robust', 'ratios': 'norm_ratio', 'imputers': 'mean', 'n_estimators': 850, 'learning_rate': 0.01024313259690087, 'max_depth': 3, 'min_child_weight': 2, 'subsample': 0.5, 'colsample_bytree': 0.5, 'colsample_bylevel': 0.9, 'reg_alpha': 47.37733870284167, 'reg_lambda': 0.26598699940148884, 'gamma': 36.163174435155206}. Best is trial 355 with value: -0.3345736073215237.
[I 2026-07-20 13:42:53,743] Trial 425 finished with value: -0.3094469188648219 and parameters: {'error_threshold': 4.5, 'scalers': 'robust', 'ratios': 'norm_ratio', 'imputers': 'mean', 'n_estimators': 850, 'learning_rate': 0.010006042820211138, 'max_depth': 3, 'min_child_weight': 2, 'subsample': 0.5, 'colsample_bytree': 0.5, 'colsample_bylevel': 0.9, 'reg_alpha': 51.70141352854377, 'reg_lambda': 0.0008259958952847837, 'gamma': 38.53474664387119}. Best is trial 355 with value: -0.3345736073215237.
[I 2026-07-20 13:42:54,144] Trial 426 finished with value: -0.30673316340895107 and parameters: {'error_threshold': 4.5, 'scalers': 'robust', 'ratios': 'norm_ratio', 'imputers': 'mean', 'n_estimators': 850, 'learning_rate': 0.010056813966101743, 'max_depth': 3, 'min_child_weight': 2, 'subsample': 0.5, 'colsample_bytree': 0.5, 'colsample_bylevel': 0.9, 'reg_alpha': 48.19222968120304, 'reg_lambda': 0.03777521736033583, 'gamma': 37.86864306833464}. Best is trial 355 with value: -0.3345736073215237.
[I 2026-07-20 13:42:54,595] Trial 428 finished with value: -0.30331974871096185 and parameters: {'error_threshold': 4.5, 'scalers': 'robust', 'ratios': 'norm_ratio', 'imputers': 'mean', 'n_estimators': 850, 'learning_rate': 0.00969287385853119, 'max_depth': 3, 'min_child_weight': 2, 'subsample': 0.5, 'colsample_bytree': 0.5, 'colsample_bylevel': 0.9, 'reg_alpha': 49.02080932311691, 'reg_lambda': 0.22265441909909994, 'gamma': 33.50335177099364}. Best is trial 355 with value: -0.3345736073215237.
[I 2026-07-20 13:42:55,003] Trial 430 finished with value: -0.3082967568836495 and parameters: {'error_threshold': 4.5, 'scalers': 'robust', 'ratios': 'norm_ratio', 'imputers': 'mean', 'n_estimators': 850, 'learning_rate': 0.010349709350347784, 'max_depth': 3, 'min_child_weight': 3, 'subsample': 0.5, 'colsample_bytree': 0.5, 'colsample_bylevel': 0.9, 'reg_alpha': 49.981384402172026, 'reg_lambda': 0.03491483193633976, 'gamma': 38.613798480966054}. Best is trial 355 with value: -0.3345736073215237.
[I 2026-07-20 13:42:55,401] Trial 431 finished with value: -0.3079267032790948 and parameters: {'error_threshold': 4.5, 'scalers': 'robust', 'ratios': 'norm_ratio', 'imputers': 'mean', 'n_estimators': 850, 'learning_rate': 0.1497644185592599, 'max_depth': 3, 'min_child_weight': 2, 'subsample': 0.5, 'colsample_bytree': 0.5, 'colsample_bylevel': 0.9, 'reg_alpha': 50.49329576836156, 'reg_lambda': 0.30828641274916696, 'gamma': 44.71696116228369}. Best is trial 355 with value: -0.3345736073215237.
[I 2026-07-20 13:42:56,432] Trial 427 finished with value: -0.3083166547784963 and parameters: {'error_threshold': 4.5, 'scalers': 'robust', 'ratios': 'norm_ratio', 'imputers': 'mean', 'n_estimators': 2150, 'learning_rate': 0.00984575277896818, 'max_depth': 3, 'min_child_weight': 2, 'subsample': 0.5, 'colsample_bytree': 0.5, 'colsample_bylevel': 0.9, 'reg_alpha': 50.754004309883726, 'reg_lambda': 0.0010446540213704212, 'gamma': 39.42981671709296}. Best is trial 355 with value: -0.3345736073215237.
[I 2026-07-20 13:42:58,201] Trial 429 finished with value: -0.2287417731653809 and parameters: {'error_threshold': 4.5, 'scalers': 'robust', 'ratios': 'norm_ratio', 'imputers': 'mean', 'n_estimators': 2000, 'learning_rate': 0.006949034419954974, 'max_depth': 3, 'min_child_weight': 2, 'subsample': 0.5, 'colsample_bytree': 0.5, 'colsample_bylevel': 0.9, 'reg_alpha': 50.32964340955719, 'reg_lambda': 0.26766842710899386, 'gamma': 1.1975866962719785e-06}. Best is trial 355 with value: -0.3345736073215237.
[I 2026-07-20 13:43:05,695] Trial 432 finished with value: -0.31175802990337337 and parameters: {'error_threshold': 4.5, 'scalers': 'robust', 'ratios': 'norm_ratio', 'imputers': 'mean', 'n_estimators': 850, 'learning_rate': 0.009562847024085814, 'max_depth': 3, 'min_child_weight': 2, 'subsample': 0.5, 'colsample_bytree': 0.5, 'colsample_bylevel': 0.9, 'reg_alpha': 50.25169003035134, 'reg_lambda': 0.032276642857723865, 'gamma': 42.47267955714915}. Best is trial 355 with value: -0.3345736073215237.
[I 2026-07-20 13:43:06,095] Trial 433 finished with value: -0.3141004381566166 and parameters: {'error_threshold': 4.5, 'scalers': 'robust', 'ratios': 'norm_ratio', 'imputers': 'mean', 'n_estimators': 850, 'learning_rate': 0.021067497539163333, 'max_depth': 4, 'min_child_weight': 2, 'subsample': 0.5, 'colsample_bytree': 0.5, 'colsample_bylevel': 0.9, 'reg_alpha': 55.63657710619716, 'reg_lambda': 0.03387172143662449, 'gamma': 43.34960282661304}. Best is trial 355 with value: -0.3345736073215237.
[I 2026-07-20 13:43:07,132] Trial 434 finished with value: -0.3230754951597104 and parameters: {'error_threshold': 4.5, 'scalers': 'robust', 'ratios': 'norm_ratio', 'imputers': 'mean', 'n_estimators': 1000, 'learning_rate': 0.0065878624909651235, 'max_depth': 4, 'min_child_weight': 3, 'subsample': 0.5, 'colsample_bytree': 0.5, 'colsample_bylevel': 0.9, 'reg_alpha': 54.94468822278262, 'reg_lambda': 0.00023287880325144203, 'gamma': 52.72640194662573}. Best is trial 355 with value: -0.3345736073215237.
[I 2026-07-20 13:43:07,606] Trial 435 finished with value: -0.3243037448657819 and parameters: {'error_threshold': 4.5, 'scalers': 'robust', 'ratios': 'norm_ratio', 'imputers': 'mean', 'n_estimators': 1000, 'learning_rate': 0.006843713319668641, 'max_depth': 4, 'min_child_weight': 2, 'subsample': 0.5, 'colsample_bytree': 0.5, 'colsample_bylevel': 0.9, 'reg_alpha': 55.634795862815736, 'reg_lambda': 0.013259781657385117, 'gamma': 54.61885639509581}. Best is trial 355 with value: -0.3345736073215237.
[I 2026-07-20 13:43:08,248] Trial 436 finished with value: -0.31986917734618225 and parameters: {'error_threshold': 4.5, 'scalers': 'robust', 'ratios': 'norm_ratio', 'imputers': 'mean', 'n_estimators': 1400, 'learning_rate': 0.14034780989776185, 'max_depth': 4, 'min_child_weight': 2, 'subsample': 0.5, 'colsample_bytree': 0.5, 'colsample_bylevel': 0.9, 'reg_alpha': 64.73039270187522, 'reg_lambda': 0.00026237194461107774, 'gamma': 57.8018007758626}. Best is trial 355 with value: -0.3345736073215237.
[I 2026-07-20 13:43:08,942] Trial 437 finished with value: -0.3342925616767541 and parameters: {'error_threshold': 4.5, 'scalers': 'robust', 'ratios': 'norm_ratio', 'imputers': 'mean', 'n_estimators': 1400, 'learning_rate': 0.006565207412656215, 'max_depth': 4, 'min_child_weight': 2, 'subsample': 0.5, 'colsample_bytree': 0.5, 'colsample_bylevel': 0.9, 'reg_alpha': 67.23355442831246, 'reg_lambda': 0.008604949512834865, 'gamma': 59.016032275098205}. Best is trial 355 with value: -0.3345736073215237.
[I 2026-07-20 13:43:09,410] Trial 438 finished with value: -0.3344059242250017 and parameters: {'error_threshold': 4.5, 'scalers': 'robust', 'ratios': 'log_ratio', 'imputers': 'mean', 'n_estimators': 1000, 'learning_rate': 0.006918516131775664, 'max_depth': 4, 'min_child_weight': 2, 'subsample': 0.5, 'colsample_bytree': 0.5, 'colsample_bylevel': 0.9, 'reg_alpha': 70.22106255885149, 'reg_lambda': 0.07519267817615312, 'gamma': 58.05756007475893}. Best is trial 355 with value: -0.3345736073215237.
[I 2026-07-20 13:43:11,082] Trial 439 finished with value: -0.2352356576238023 and parameters: {'error_threshold': 4.5, 'scalers': 'robust', 'ratios': 'log_ratio', 'imputers': 'mean', 'n_estimators': 1000, 'learning_rate': 0.041271495284209016, 'max_depth': 4, 'min_child_weight': 3, 'subsample': 0.5, 'colsample_bytree': 0.5, 'colsample_bylevel': 0.9, 'reg_alpha': 69.69008708129255, 'reg_lambda': 0.0054359945841187685, 'gamma': 0.0005008553211866199}. Best is trial 355 with value: -0.3345736073215237.
[I 2026-07-20 13:43:18,350] Trial 440 finished with value: -0.29361085579749874 and parameters: {'error_threshold': 4.5, 'scalers': 'robust', 'ratios': 'log_ratio', 'imputers': 'mean', 'n_estimators': 1000, 'learning_rate': 0.023912864583262524, 'max_depth': 4, 'min_child_weight': 3, 'subsample': 0.5, 'colsample_bytree': 0.5, 'colsample_bylevel': 0.9, 'reg_alpha': 64.38073791155736, 'reg_lambda': 0.007031882611309212, 'gamma': 16.006732317909105}. Best is trial 355 with value: -0.3345736073215237.
[I 2026-07-20 13:43:18,999] Trial 441 finished with value: -0.33451732462867106 and parameters: {'error_threshold': 4.5, 'scalers': 'robust', 'ratios': 'norm_ratio', 'imputers': 'mean', 'n_estimators': 1400, 'learning_rate': 0.007162963769411606, 'max_depth': 4, 'min_child_weight': 2, 'subsample': 0.5, 'colsample_bytree': 0.5, 'colsample_bylevel': 0.9, 'reg_alpha': 71.01868400141198, 'reg_lambda': 0.06000061027297657, 'gamma': 62.105784684800874}. Best is trial 355 with value: -0.3345736073215237.
[I 2026-07-20 13:43:20,251] Trial 442 finished with value: -0.2979413659567224 and parameters: {'error_threshold': 4.5, 'scalers': 'robust', 'ratios': 'log_ratio', 'imputers': 'mean', 'n_estimators': 1050, 'learning_rate': 0.005802688318180021, 'max_depth': 4, 'min_child_weight': 2, 'subsample': 0.5, 'colsample_bytree': 0.5, 'colsample_bylevel': 0.7, 'reg_alpha': 69.94635054108949, 'reg_lambda': 0.018974775775319065, 'gamma': 15.631778905001621}. Best is trial 355 with value: -0.3345736073215237.
[I 2026-07-20 13:43:20,625] Trial 443 finished with value: -0.2356508367247654 and parameters: {'error_threshold': 4.5, 'scalers': 'robust', 'ratios': 'log_ratio', 'imputers': 'mean', 'n_estimators': 1050, 'learning_rate': 0.04089307718980561, 'max_depth': 4, 'min_child_weight': 2, 'subsample': 0.5, 'colsample_bytree': 0.5, 'colsample_bylevel': 0.9, 'reg_alpha': 70.01554821645477, 'reg_lambda': 0.018672628449604847, 'gamma': 0.0005920763347412592}. Best is trial 355 with value: -0.3345736073215237.
[I 2026-07-20 13:43:21,084] Trial 444 finished with value: -0.33452967299215347 and parameters: {'error_threshold': 4.5, 'scalers': 'robust', 'ratios': 'norm_ratio', 'imputers': 'mean', 'n_estimators': 1000, 'learning_rate': 0.04099901677261136, 'max_depth': 5, 'min_child_weight': 2, 'subsample': 0.5, 'colsample_bytree': 0.5, 'colsample_bylevel': 0.7, 'reg_alpha': 74.0987245153416, 'reg_lambda': 0.005878960066873552, 'gamma': 66.96538752046837}. Best is trial 355 with value: -0.3345736073215237.
[I 2026-07-20 13:43:21,578] Trial 445 finished with value: -0.33453243225542617 and parameters: {'error_threshold': 3.0, 'scalers': 'robust', 'ratios': 'log_ratio', 'imputers': 'mean', 'n_estimators': 1000, 'learning_rate': 0.00544007840668195, 'max_depth': 5, 'min_child_weight': 2, 'subsample': 0.5, 'colsample_bytree': 0.5, 'colsample_bylevel': 0.9, 'reg_alpha': 72.55223770272879, 'reg_lambda': 42.182742795954354, 'gamma': 62.71288109860619}. Best is trial 355 with value: -0.3345736073215237.
[I 2026-07-20 13:43:22,129] Trial 446 finished with value: -0.29965649455475685 and parameters: {'error_threshold': 4.5, 'scalers': 'robust', 'ratios': 'norm_ratio', 'imputers': 'mean', 'n_estimators': 1050, 'learning_rate': 0.005388984463090519, 'max_depth': 5, 'min_child_weight': 3, 'subsample': 0.5, 'colsample_bytree': 0.6, 'colsample_bylevel': 0.9, 'reg_alpha': 71.44482820233586, 'reg_lambda': 0.0005509457189713321, 'gamma': 17.0107500647482}. Best is trial 355 with value: -0.3345736073215237.
[I 2026-07-20 13:43:22,982] Trial 447 finished with value: -0.26405101120468977 and parameters: {'error_threshold': 4.75, 'scalers': 'robust', 'ratios': 'norm_ratio', 'imputers': 'mean', 'n_estimators': 900, 'learning_rate': 0.005659384470891483, 'max_depth': 5, 'min_child_weight': 2, 'subsample': 0.5, 'colsample_bytree': 0.6, 'colsample_bylevel': 0.6, 'reg_alpha': 99.18406013442062, 'reg_lambda': 41.52397223206662, 'gamma': 0.024953461156435066}. Best is trial 355 with value: -0.3345736073215237.
[I 2026-07-20 13:43:29,379] Trial 448 finished with value: -0.3345396441527428 and parameters: {'error_threshold': 4.75, 'scalers': 'robust', 'ratios': 'norm_ratio', 'imputers': 'mean', 'n_estimators': 900, 'learning_rate': 0.005697131861893878, 'max_depth': 5, 'min_child_weight': 2, 'subsample': 0.5, 'colsample_bytree': 0.5, 'colsample_bylevel': 0.9, 'reg_alpha': 99.18553444646035, 'reg_lambda': 41.31973070123854, 'gamma': 65.81371910347727}. Best is trial 355 with value: -0.3345736073215237.
