[I 2026-07-20 15:02:51,336] Trial 20 finished with value: -9.10623484528572 and parameters: {'error_threshold': 1.85, 'scalers': 'robust', 'ratios': 'norm_ratio', 'imputers': 'mean', 'n_estimators': 950, 'learning_rate': 0.3430384312419671, 'max_depth': 6, 'min_child_weight': 5, 'subsample': 0.6, 'colsample_bytree': 1.0, 'colsample_bylevel': 0.7, 'reg_alpha': 3.1554208730561537e-06, 'reg_lambda': 0.40707157202025723, 'gamma': 0.00033250362797206063}. Best is trial 2 with value: -7.759525805205968.
/bsuhome/alexanderemert/Research/Star-Formation-Research-Project-2026/pipeline/scripts/optuna/final_preds_and_models/optuna_search_mult_quant_reg.py:161: UserWarning: The distribution is specified by [0.1, 5] and step=0.25, but the range is not divisible by `step`. It will be replaced with [0.1, 4.85].
  error_threshold = trial.suggest_float("error_threshold", 0.1, 5, step=0.25)
[I 2026-07-20 15:02:54,991] Trial 21 finished with value: -7.87686395392862 and parameters: {'error_threshold': 1.85, 'scalers': 'robust', 'ratios': 'norm_ratio', 'imputers': 'mean', 'n_estimators': 1200, 'learning_rate': 0.0012892003017802387, 'max_depth': 6, 'min_child_weight': 8, 'subsample': 0.6, 'colsample_bytree': 1.0, 'colsample_bylevel': 0.7, 'reg_alpha': 1.3117040468736191e-06, 'reg_lambda': 0.7762741534549016, 'gamma': 0.0004751381430304426}. Best is trial 2 with value: -7.759525805205968.
/bsuhome/alexanderemert/Research/Star-Formation-Research-Project-2026/pipeline/scripts/optuna/final_preds_and_models/optuna_search_mult_quant_reg.py:161: UserWarning: The distribution is specified by [0.1, 5] and step=0.25, but the range is not divisible by `step`. It will be replaced with [0.1, 4.85].
  error_threshold = trial.suggest_float("error_threshold", 0.1, 5, step=0.25)
[I 2026-07-20 15:02:55,874] Trial 22 finished with value: -7.914603909598149 and parameters: {'error_threshold': 1.6, 'scalers': 'robust', 'ratios': 'norm_ratio', 'imputers': 'mean', 'n_estimators': 1150, 'learning_rate': 0.0015104290960063777, 'max_depth': 3, 'min_child_weight': 8, 'subsample': 0.6, 'colsample_bytree': 1.0, 'colsample_bylevel': 0.7, 'reg_alpha': 4.484805741098681e-06, 'reg_lambda': 0.9291552827348443, 'gamma': 0.0009098166987713996}. Best is trial 2 with value: -7.759525805205968.
/bsuhome/alexanderemert/Research/Star-Formation-Research-Project-2026/pipeline/scripts/optuna/final_preds_and_models/optuna_search_mult_quant_reg.py:161: UserWarning: The distribution is specified by [0.1, 5] and step=0.25, but the range is not divisible by `step`. It will be replaced with [0.1, 4.85].
  error_threshold = trial.suggest_float("error_threshold", 0.1, 5, step=0.25)
[I 2026-07-20 15:02:56,913] Trial 23 finished with value: -8.022736616892614 and parameters: {'error_threshold': 1.85, 'scalers': 'robust', 'ratios': 'norm_ratio', 'imputers': 'mean', 'n_estimators': 1100, 'learning_rate': 0.0012449249972305962, 'max_depth': 3, 'min_child_weight': 8, 'subsample': 0.6, 'colsample_bytree': 1.0, 'colsample_bylevel': 0.7, 'reg_alpha': 1.4858759009837638e-06, 'reg_lambda': 0.5101870543966059, 'gamma': 0.000348351927805093}. Best is trial 2 with value: -7.759525805205968.
/bsuhome/alexanderemert/Research/Star-Formation-Research-Project-2026/pipeline/scripts/optuna/final_preds_and_models/optuna_search_mult_quant_reg.py:161: UserWarning: The distribution is specified by [0.1, 5] and step=0.25, but the range is not divisible by `step`. It will be replaced with [0.1, 4.85].
  error_threshold = trial.suggest_float("error_threshold", 0.1, 5, step=0.25)
[I 2026-07-20 15:02:57,785] Trial 24 finished with value: -7.930575087227197 and parameters: {'error_threshold': 3.35, 'scalers': 'robust', 'ratios': 'norm_ratio', 'imputers': 'mean', 'n_estimators': 1050, 'learning_rate': 0.0015797620343515114, 'max_depth': 3, 'min_child_weight': 8, 'subsample': 0.6, 'colsample_bytree': 0.9, 'colsample_bylevel': 0.7, 'reg_alpha': 1.1740270216134265e-06, 'reg_lambda': 1.2309629685066484e-06, 'gamma': 0.0008287661573796732}. Best is trial 2 with value: -7.759525805205968.
/bsuhome/alexanderemert/Research/Star-Formation-Research-Project-2026/pipeline/scripts/optuna/final_preds_and_models/optuna_search_mult_quant_reg.py:161: UserWarning: The distribution is specified by [0.1, 5] and step=0.25, but the range is not divisible by `step`. It will be replaced with [0.1, 4.85].
  error_threshold = trial.suggest_float("error_threshold", 0.1, 5, step=0.25)
[I 2026-07-20 15:02:58,707] Trial 25 finished with value: -7.904928420486723 and parameters: {'error_threshold': 2.85, 'scalers': 'robust', 'ratios': 'norm_ratio', 'imputers': 'mean', 'n_estimators': 1100, 'learning_rate': 0.001647017996746674, 'max_depth': 3, 'min_child_weight': 5, 'subsample': 0.6, 'colsample_bytree': 0.9, 'colsample_bylevel': 0.7, 'reg_alpha': 3.6227230258864416e-06, 'reg_lambda': 0.15573143843372736, 'gamma': 0.0007139474822238761}. Best is trial 2 with value: -7.759525805205968.
/bsuhome/alexanderemert/Research/Star-Formation-Research-Project-2026/pipeline/scripts/optuna/final_preds_and_models/optuna_search_mult_quant_reg.py:161: UserWarning: The distribution is specified by [0.1, 5] and step=0.25, but the range is not divisible by `step`. It will be replaced with [0.1, 4.85].
  error_threshold = trial.suggest_float("error_threshold", 0.1, 5, step=0.25)
[I 2026-07-20 15:02:59,426] Trial 26 finished with value: -8.071291436214025 and parameters: {'error_threshold': 1.35, 'scalers': 'robust', 'ratios': 'norm_ratio', 'imputers': 'mean', 'n_estimators': 900, 'learning_rate': 0.0014125318524989766, 'max_depth': 3, 'min_child_weight': 5, 'subsample': 0.6, 'colsample_bytree': 0.9, 'colsample_bylevel': 0.7, 'reg_alpha': 0.003396722218455999, 'reg_lambda': 1.7576401339321199e-06, 'gamma': 0.0012494640441846664}. Best is trial 2 with value: -7.759525805205968.
/bsuhome/alexanderemert/Research/Star-Formation-Research-Project-2026/pipeline/scripts/optuna/final_preds_and_models/optuna_search_mult_quant_reg.py:161: UserWarning: The distribution is specified by [0.1, 5] and step=0.25, but the range is not divisible by `step`. It will be replaced with [0.1, 4.85].
  error_threshold = trial.suggest_float("error_threshold", 0.1, 5, step=0.25)
[I 2026-07-20 15:03:03,342] Trial 27 finished with value: -7.903172972182044 and parameters: {'error_threshold': 3.1, 'scalers': 'none', 'ratios': 'norm_ratio', 'imputers': 'mean', 'n_estimators': 900, 'learning_rate': 0.0016118456057625907, 'max_depth': 7, 'min_child_weight': 5, 'subsample': 0.6, 'colsample_bytree': 0.9, 'colsample_bylevel': 0.7, 'reg_alpha': 0.0027840924164445014, 'reg_lambda': 0.03219089495170042, 'gamma': 2.5966078394363024}. Best is trial 2 with value: -7.759525805205968.
/bsuhome/alexanderemert/Research/Star-Formation-Research-Project-2026/pipeline/scripts/optuna/final_preds_and_models/optuna_search_mult_quant_reg.py:161: UserWarning: The distribution is specified by [0.1, 5] and step=0.25, but the range is not divisible by `step`. It will be replaced with [0.1, 4.85].
  error_threshold = trial.suggest_float("error_threshold", 0.1, 5, step=0.25)
[I 2026-07-20 15:03:05,584] Trial 28 finished with value: -7.791434291890691 and parameters: {'error_threshold': 3.1, 'scalers': 'none', 'ratios': 'log_ratio', 'imputers': 'none', 'n_estimators': 2600, 'learning_rate': 0.0014068077621792658, 'max_depth': 3, 'min_child_weight': 4, 'subsample': 0.7, 'colsample_bytree': 0.8, 'colsample_bylevel': 0.8, 'reg_alpha': 0.0061809166390179625, 'reg_lambda': 1.8285178859805505e-06, 'gamma': 0.0021334521365955882}. Best is trial 2 with value: -7.759525805205968.
/bsuhome/alexanderemert/Research/Star-Formation-Research-Project-2026/pipeline/scripts/optuna/final_preds_and_models/optuna_search_mult_quant_reg.py:161: UserWarning: The distribution is specified by [0.1, 5] and step=0.25, but the range is not divisible by `step`. It will be replaced with [0.1, 4.85].
  error_threshold = trial.suggest_float("error_threshold", 0.1, 5, step=0.25)
[I 2026-07-20 15:03:06,927] Trial 29 finished with value: -7.937174557030018 and parameters: {'error_threshold': 1.1, 'scalers': 'robust', 'ratios': 'norm_ratio', 'imputers': 'mean', 'n_estimators': 1450, 'learning_rate': 0.0011164781141711827, 'max_depth': 3, 'min_child_weight': 9, 'subsample': 0.6, 'colsample_bytree': 0.9, 'colsample_bylevel': 0.8, 'reg_alpha': 2.393593466976675e-05, 'reg_lambda': 2.7837178335144115e-06, 'gamma': 3.172076775772814}. Best is trial 2 with value: -7.759525805205968.
/bsuhome/alexanderemert/Research/Star-Formation-Research-Project-2026/pipeline/scripts/optuna/final_preds_and_models/optuna_search_mult_quant_reg.py:161: UserWarning: The distribution is specified by [0.1, 5] and step=0.25, but the range is not divisible by `step`. It will be replaced with [0.1, 4.85].
  error_threshold = trial.suggest_float("error_threshold", 0.1, 5, step=0.25)
[I 2026-07-20 15:03:12,668] Trial 30 finished with value: -7.8138236735705915 and parameters: {'error_threshold': 2.85, 'scalers': 'robust', 'ratios': 'norm_ratio', 'imputers': 'mean', 'n_estimators': 1550, 'learning_rate': 0.001154365112177685, 'max_depth': 7, 'min_child_weight': 9, 'subsample': 0.5, 'colsample_bytree': 0.9, 'colsample_bylevel': 0.8, 'reg_alpha': 0.004157271891582127, 'reg_lambda': 0.06320735784442136, 'gamma': 0.0494939397876356}. Best is trial 2 with value: -7.759525805205968.
/bsuhome/alexanderemert/Research/Star-Formation-Research-Project-2026/pipeline/scripts/optuna/final_preds_and_models/optuna_search_mult_quant_reg.py:161: UserWarning: The distribution is specified by [0.1, 5] and step=0.25, but the range is not divisible by `step`. It will be replaced with [0.1, 4.85].
  error_threshold = trial.suggest_float("error_threshold", 0.1, 5, step=0.25)
[I 2026-07-20 15:03:15,699] Trial 33 finished with value: -8.657759839681347 and parameters: {'error_threshold': 1.1, 'scalers': 'none', 'ratios': 'norm_ratio', 'imputers': 'mean', 'n_estimators': 750, 'learning_rate': 0.0006433691862565, 'max_depth': 7, 'min_child_weight': 9, 'subsample': 0.5, 'colsample_bytree': 0.8, 'colsample_bylevel': 0.8, 'reg_alpha': 2.869426045628914e-05, 'reg_lambda': 0.04943517750025555, 'gamma': 0.03222469989717873}. Best is trial 2 with value: -7.759525805205968.
/bsuhome/alexanderemert/Research/Star-Formation-Research-Project-2026/pipeline/scripts/optuna/final_preds_and_models/optuna_search_mult_quant_reg.py:161: UserWarning: The distribution is specified by [0.1, 5] and step=0.25, but the range is not divisible by `step`. It will be replaced with [0.1, 4.85].
  error_threshold = trial.suggest_float("error_threshold", 0.1, 5, step=0.25)
[I 2026-07-20 15:03:21,631] Trial 31 finished with value: -7.784530183876689 and parameters: {'error_threshold': 2.85, 'scalers': 'none', 'ratios': 'norm_ratio', 'imputers': 'mean', 'n_estimators': 1650, 'learning_rate': 0.0012870246900375149, 'max_depth': 7, 'min_child_weight': 9, 'subsample': 0.5, 'colsample_bytree': 0.9, 'colsample_bylevel': 0.8, 'reg_alpha': 0.0027038670629831465, 'reg_lambda': 0.07497115846758345, 'gamma': 0.06572545631033504}. Best is trial 2 with value: -7.759525805205968.
/bsuhome/alexanderemert/Research/Star-Formation-Research-Project-2026/pipeline/scripts/optuna/final_preds_and_models/optuna_search_mult_quant_reg.py:161: UserWarning: The distribution is specified by [0.1, 5] and step=0.25, but the range is not divisible by `step`. It will be replaced with [0.1, 4.85].
  error_threshold = trial.suggest_float("error_threshold", 0.1, 5, step=0.25)
[I 2026-07-20 15:03:27,702] Trial 32 finished with value: -8.065913590043024 and parameters: {'error_threshold': 2.6, 'scalers': 'none', 'ratios': 'norm_ratio', 'imputers': 'mean', 'n_estimators': 1550, 'learning_rate': 0.0006596765395837223, 'max_depth': 7, 'min_child_weight': 9, 'subsample': 0.5, 'colsample_bytree': 0.8, 'colsample_bylevel': 0.8, 'reg_alpha': 3.0543370324564236e-05, 'reg_lambda': 0.11524662561680225, 'gamma': 0.04669161872778543}. Best is trial 2 with value: -7.759525805205968.
/bsuhome/alexanderemert/Research/Star-Formation-Research-Project-2026/pipeline/scripts/optuna/final_preds_and_models/optuna_search_mult_quant_reg.py:161: UserWarning: The distribution is specified by [0.1, 5] and step=0.25, but the range is not divisible by `step`. It will be replaced with [0.1, 4.85].
  error_threshold = trial.suggest_float("error_threshold", 0.1, 5, step=0.25)
[I 2026-07-20 15:03:32,139] Trial 34 finished with value: -7.806559403935009 and parameters: {'error_threshold': 2.6, 'scalers': 'none', 'ratios': 'norm_ratio', 'imputers': 'mean', 'n_estimators': 1600, 'learning_rate': 0.0035790344517404623, 'max_depth': 7, 'min_child_weight': 9, 'subsample': 0.5, 'colsample_bytree': 0.8, 'colsample_bylevel': 0.8, 'reg_alpha': 3.195080867743103e-05, 'reg_lambda': 0.04998779677748861, 'gamma': 3.3617256557276693}. Best is trial 2 with value: -7.759525805205968.
/bsuhome/alexanderemert/Research/Star-Formation-Research-Project-2026/pipeline/scripts/optuna/final_preds_and_models/optuna_search_mult_quant_reg.py:161: UserWarning: The distribution is specified by [0.1, 5] and step=0.25, but the range is not divisible by `step`. It will be replaced with [0.1, 4.85].
  error_threshold = trial.suggest_float("error_threshold", 0.1, 5, step=0.25)
[I 2026-07-20 15:03:41,191] Trial 35 finished with value: -8.234186125926987 and parameters: {'error_threshold': 1.1, 'scalers': 'none', 'ratios': 'norm_ratio', 'imputers': 'mean', 'n_estimators': 1400, 'learning_rate': 0.0005595910307270869, 'max_depth': 10, 'min_child_weight': 9, 'subsample': 0.5, 'colsample_bytree': 0.8, 'colsample_bylevel': 0.8, 'reg_alpha': 3.359166896715841e-05, 'reg_lambda': 0.06357334490868141, 'gamma': 0.053046378746074756}. Best is trial 2 with value: -7.759525805205968.
/bsuhome/alexanderemert/Research/Star-Formation-Research-Project-2026/pipeline/scripts/optuna/final_preds_and_models/optuna_search_mult_quant_reg.py:161: UserWarning: The distribution is specified by [0.1, 5] and step=0.25, but the range is not divisible by `step`. It will be replaced with [0.1, 4.85].
  error_threshold = trial.suggest_float("error_threshold", 0.1, 5, step=0.25)
[I 2026-07-20 15:03:44,094] Trial 40 finished with value: -7.780347781626538 and parameters: {'error_threshold': 3.85, 'scalers': 'none', 'ratios': 'log_ratio', 'imputers': 'mean', 'n_estimators': 2600, 'learning_rate': 0.00352375972009388, 'max_depth': 4, 'min_child_weight': 9, 'subsample': 0.5, 'colsample_bytree': 0.8, 'colsample_bylevel': 0.8, 'reg_alpha': 0.06973809834005332, 'reg_lambda': 1.8488920699034892e-05, 'gamma': 6.494056800773908e-05}. Best is trial 2 with value: -7.759525805205968.
/bsuhome/alexanderemert/Research/Star-Formation-Research-Project-2026/pipeline/scripts/optuna/final_preds_and_models/optuna_search_mult_quant_reg.py:161: UserWarning: The distribution is specified by [0.1, 5] and step=0.25, but the range is not divisible by `step`. It will be replaced with [0.1, 4.85].
  error_threshold = trial.suggest_float("error_threshold", 0.1, 5, step=0.25)
[I 2026-07-20 15:03:54,650] Trial 39 finished with value: -7.981972209930767 and parameters: {'error_threshold': 3.85, 'scalers': 'none', 'ratios': 'log_ratio', 'imputers': 'none', 'n_estimators': 2550, 'learning_rate': 0.004243856316544402, 'max_depth': 10, 'min_child_weight': 9, 'subsample': 0.5, 'colsample_bytree': 0.8, 'colsample_bylevel': 0.8, 'reg_alpha': 0.061174182996553556, 'reg_lambda': 2.405102135711502e-05, 'gamma': 0.08239427083149771}. Best is trial 2 with value: -7.759525805205968.
/bsuhome/alexanderemert/Research/Star-Formation-Research-Project-2026/pipeline/scripts/optuna/final_preds_and_models/optuna_search_mult_quant_reg.py:161: UserWarning: The distribution is specified by [0.1, 5] and step=0.25, but the range is not divisible by `step`. It will be replaced with [0.1, 4.85].
  error_threshold = trial.suggest_float("error_threshold", 0.1, 5, step=0.25)
[I 2026-07-20 15:04:14,629] Trial 36 finished with value: -7.8427449037388035 and parameters: {'error_threshold': 3.85, 'scalers': 'none', 'ratios': 'log_ratio', 'imputers': 'none', 'n_estimators': 2800, 'learning_rate': 0.0007148671196278125, 'max_depth': 10, 'min_child_weight': 9, 'subsample': 0.7, 'colsample_bytree': 0.8, 'colsample_bylevel': 0.8, 'reg_alpha': 0.08008554109383208, 'reg_lambda': 1.2842932824575135e-05, 'gamma': 0.04251059493283545}. Best is trial 2 with value: -7.759525805205968.
/bsuhome/alexanderemert/Research/Star-Formation-Research-Project-2026/pipeline/scripts/optuna/final_preds_and_models/optuna_search_mult_quant_reg.py:161: UserWarning: The distribution is specified by [0.1, 5] and step=0.25, but the range is not divisible by `step`. It will be replaced with [0.1, 4.85].
  error_threshold = trial.suggest_float("error_threshold", 0.1, 5, step=0.25)
[I 2026-07-20 15:04:28,445] Trial 38 finished with value: -7.912911214980812 and parameters: {'error_threshold': 3.6, 'scalers': 'none', 'ratios': 'log_ratio', 'imputers': 'none', 'n_estimators': 2600, 'learning_rate': 0.0005070461743872908, 'max_depth': 9, 'min_child_weight': 9, 'subsample': 0.5, 'colsample_bytree': 0.8, 'colsample_bylevel': 0.8, 'reg_alpha': 0.08426608399992144, 'reg_lambda': 1.902874272425062e-05, 'gamma': 0.05573219604056034}. Best is trial 2 with value: -7.759525805205968.
/bsuhome/alexanderemert/Research/Star-Formation-Research-Project-2026/pipeline/scripts/optuna/final_preds_and_models/optuna_search_mult_quant_reg.py:161: UserWarning: The distribution is specified by [0.1, 5] and step=0.25, but the range is not divisible by `step`. It will be replaced with [0.1, 4.85].
  error_threshold = trial.suggest_float("error_threshold", 0.1, 5, step=0.25)
[I 2026-07-20 15:04:32,365] Trial 41 finished with value: -7.755420611753795 and parameters: {'error_threshold': 3.6, 'scalers': 'none', 'ratios': 'log_ratio', 'imputers': 'median', 'n_estimators': 2600, 'learning_rate': 0.002842197646872651, 'max_depth': 4, 'min_child_weight': 9, 'subsample': 0.5, 'colsample_bytree': 0.8, 'colsample_bylevel': 1.0, 'reg_alpha': 0.04776261548907108, 'reg_lambda': 84.83831226150431, 'gamma': 0.004834880926792405}. Best is trial 41 with value: -7.755420611753795.
/bsuhome/alexanderemert/Research/Star-Formation-Research-Project-2026/pipeline/scripts/optuna/final_preds_and_models/optuna_search_mult_quant_reg.py:161: UserWarning: The distribution is specified by [0.1, 5] and step=0.25, but the range is not divisible by `step`. It will be replaced with [0.1, 4.85].
  error_threshold = trial.suggest_float("error_threshold", 0.1, 5, step=0.25)
[I 2026-07-20 15:05:00,492] Trial 37 finished with value: -8.07367032216783 and parameters: {'error_threshold': 3.85, 'scalers': 'none', 'ratios': 'log_ratio', 'imputers': 'none', 'n_estimators': 3000, 'learning_rate': 0.00403915755489205, 'max_depth': 10, 'min_child_weight': 3, 'subsample': 0.7, 'colsample_bytree': 0.8, 'colsample_bylevel': 0.8, 'reg_alpha': 0.10712695146832128, 'reg_lambda': 1.8818708778830144e-05, 'gamma': 0.05222218563262021}. Best is trial 41 with value: -7.755420611753795.
/bsuhome/alexanderemert/Research/Star-Formation-Research-Project-2026/pipeline/scripts/optuna/final_preds_and_models/optuna_search_mult_quant_reg.py:161: UserWarning: The distribution is specified by [0.1, 5] and step=0.25, but the range is not divisible by `step`. It will be replaced with [0.1, 4.85].
  error_threshold = trial.suggest_float("error_threshold", 0.1, 5, step=0.25)
[I 2026-07-20 15:05:10,506] Trial 42 finished with value: -7.914749897107651 and parameters: {'error_threshold': 3.85, 'scalers': 'none', 'ratios': 'log_ratio', 'imputers': 'median', 'n_estimators': 2600, 'learning_rate': 0.003454116750262262, 'max_depth': 9, 'min_child_weight': 10, 'subsample': 0.5, 'colsample_bytree': 0.8, 'colsample_bylevel': 1.0, 'reg_alpha': 0.09412756077569646, 'reg_lambda': 1.5855581519731775e-05, 'gamma': 0.007224674739953785}. Best is trial 41 with value: -7.755420611753795.
/bsuhome/alexanderemert/Research/Star-Formation-Research-Project-2026/pipeline/scripts/optuna/final_preds_and_models/optuna_search_mult_quant_reg.py:161: UserWarning: The distribution is specified by [0.1, 5] and step=0.25, but the range is not divisible by `step`. It will be replaced with [0.1, 4.85].
  error_threshold = trial.suggest_float("error_threshold", 0.1, 5, step=0.25)
[I 2026-07-20 15:05:12,035] Trial 43 finished with value: -7.798792652757378 and parameters: {'error_threshold': 3.85, 'scalers': 'none', 'ratios': 'log_ratio', 'imputers': 'median', 'n_estimators': 2600, 'learning_rate': 0.0035236471180822696, 'max_depth': 4, 'min_child_weight': 10, 'subsample': 0.8, 'colsample_bytree': 0.7, 'colsample_bylevel': 1.0, 'reg_alpha': 0.10658980566237683, 'reg_lambda': 4.1780245436363585e-05, 'gamma': 97.15995680096854}. Best is trial 41 with value: -7.755420611753795.
/bsuhome/alexanderemert/Research/Star-Formation-Research-Project-2026/pipeline/scripts/optuna/final_preds_and_models/optuna_search_mult_quant_reg.py:161: UserWarning: The distribution is specified by [0.1, 5] and step=0.25, but the range is not divisible by `step`. It will be replaced with [0.1, 4.85].
  error_threshold = trial.suggest_float("error_threshold", 0.1, 5, step=0.25)
