[I 2026-07-20 14:55:47,421] Trial 43 finished with value: -0.987864094527665 and parameters: {'error_threshold': 1.6, 'scalers': 'none', 'ratios': 'log_ratio', 'imputers': 'mean', 'n_estimators': 2400, 'learning_rate': 0.16159377120555227, 'max_depth': 11, 'min_child_weight': 4, 'subsample': 0.5, 'colsample_bytree': 0.6, 'colsample_bylevel': 0.6, 'reg_alpha': 4.155898184442606e-06, 'reg_lambda': 0.0005776478939145454, 'gamma': 1.035987144743884e-05}. Best is trial 23 with value: -1.1407585920679295.
/bsuhome/alexanderemert/Research/Star-Formation-Research-Project-2026/pipeline/scripts/optuna/final_preds_and_models/optuna_search_mult_quant_reg.py:75: UserWarning: The distribution is specified by [0.1, 5] and step=0.25, but the range is not divisible by `step`. It will be replaced with [0.1, 4.85].
  error_threshold = trial.suggest_float("error_threshold", 0.1, 5, step=0.25)
[I 2026-07-20 14:56:01,607] Trial 51 finished with value: -0.7908578617236408 and parameters: {'error_threshold': 1.6, 'scalers': 'none', 'ratios': 'norm_ratio', 'imputers': 'median', 'n_estimators': 100, 'learning_rate': 0.00032620738306734533, 'max_depth': 11, 'min_child_weight': 7, 'subsample': 0.7, 'colsample_bytree': 0.5, 'colsample_bylevel': 0.9, 'reg_alpha': 3.3282098184698853e-05, 'reg_lambda': 0.0009547677783810503, 'gamma': 84.62546176740122}. Best is trial 23 with value: -1.1407585920679295.
/bsuhome/alexanderemert/Research/Star-Formation-Research-Project-2026/pipeline/scripts/optuna/final_preds_and_models/optuna_search_mult_quant_reg.py:75: UserWarning: The distribution is specified by [0.1, 5] and step=0.25, but the range is not divisible by `step`. It will be replaced with [0.1, 4.85].
  error_threshold = trial.suggest_float("error_threshold", 0.1, 5, step=0.25)
[I 2026-07-20 14:56:30,698] Trial 50 finished with value: -0.7907860805648771 and parameters: {'error_threshold': 1.6, 'scalers': 'standard', 'ratios': 'norm_ratio', 'imputers': 'median', 'n_estimators': 2700, 'learning_rate': 0.0003589298396126555, 'max_depth': 6, 'min_child_weight': 5, 'subsample': 0.7, 'colsample_bytree': 0.7, 'colsample_bylevel': 0.9, 'reg_alpha': 3.563588662647799e-06, 'reg_lambda': 0.0008998024935971051, 'gamma': 92.91072155657638}. Best is trial 23 with value: -1.1407585920679295.
/bsuhome/alexanderemert/Research/Star-Formation-Research-Project-2026/pipeline/scripts/optuna/final_preds_and_models/optuna_search_mult_quant_reg.py:75: UserWarning: The distribution is specified by [0.1, 5] and step=0.25, but the range is not divisible by `step`. It will be replaced with [0.1, 4.85].
  error_threshold = trial.suggest_float("error_threshold", 0.1, 5, step=0.25)
[I 2026-07-20 14:56:51,903] Trial 53 finished with value: -0.791188900544168 and parameters: {'error_threshold': 3.1, 'scalers': 'standard', 'ratios': 'log_ratio', 'imputers': 'median', 'n_estimators': 2850, 'learning_rate': 0.49959561373951705, 'max_depth': 11, 'min_child_weight': 5, 'subsample': 0.6, 'colsample_bytree': 0.5, 'colsample_bylevel': 0.9, 'reg_alpha': 0.004270631323692221, 'reg_lambda': 51.260918509660684, 'gamma': 94.82529352007988}. Best is trial 23 with value: -1.1407585920679295.
/bsuhome/alexanderemert/Research/Star-Formation-Research-Project-2026/pipeline/scripts/optuna/final_preds_and_models/optuna_search_mult_quant_reg.py:75: UserWarning: The distribution is specified by [0.1, 5] and step=0.25, but the range is not divisible by `step`. It will be replaced with [0.1, 4.85].
  error_threshold = trial.suggest_float("error_threshold", 0.1, 5, step=0.25)
[I 2026-07-20 14:57:32,071] Trial 49 finished with value: -0.7011903168516519 and parameters: {'error_threshold': 1.6, 'scalers': 'standard', 'ratios': 'norm_ratio', 'imputers': 'median', 'n_estimators': 2000, 'learning_rate': 0.0002915316946273922, 'max_depth': 11, 'min_child_weight': 7, 'subsample': 0.7, 'colsample_bytree': 0.5, 'colsample_bylevel': 0.9, 'reg_alpha': 3.3425794271214328e-06, 'reg_lambda': 0.000604384190238237, 'gamma': 3.587056213182591e-06}. Best is trial 23 with value: -1.1407585920679295.
/bsuhome/alexanderemert/Research/Star-Formation-Research-Project-2026/pipeline/scripts/optuna/final_preds_and_models/optuna_search_mult_quant_reg.py:75: UserWarning: The distribution is specified by [0.1, 5] and step=0.25, but the range is not divisible by `step`. It will be replaced with [0.1, 4.85].
  error_threshold = trial.suggest_float("error_threshold", 0.1, 5, step=0.25)
[I 2026-07-20 14:57:38,823] Trial 54 finished with value: -0.7884817233518565 and parameters: {'error_threshold': 3.1, 'scalers': 'standard', 'ratios': 'log_ratio', 'imputers': 'median', 'n_estimators': 2800, 'learning_rate': 0.12808757361762024, 'max_depth': 11, 'min_child_weight': 9, 'subsample': 0.6, 'colsample_bytree': 0.5, 'colsample_bylevel': 0.9, 'reg_alpha': 0.005489865577117461, 'reg_lambda': 3.120172696255815e-05, 'gamma': 86.89315575553225}. Best is trial 23 with value: -1.1407585920679295.
/bsuhome/alexanderemert/Research/Star-Formation-Research-Project-2026/pipeline/scripts/optuna/final_preds_and_models/optuna_search_mult_quant_reg.py:75: UserWarning: The distribution is specified by [0.1, 5] and step=0.25, but the range is not divisible by `step`. It will be replaced with [0.1, 4.85].
  error_threshold = trial.suggest_float("error_threshold", 0.1, 5, step=0.25)
[I 2026-07-20 14:58:38,003] Trial 52 finished with value: -1.160831181899583 and parameters: {'error_threshold': 3.1, 'scalers': 'standard', 'ratios': 'norm_ratio', 'imputers': 'median', 'n_estimators': 2750, 'learning_rate': 0.4809673231033143, 'max_depth': 11, 'min_child_weight': 5, 'subsample': 0.7, 'colsample_bytree': 0.5, 'colsample_bylevel': 0.9, 'reg_alpha': 0.006214608469501612, 'reg_lambda': 4.0719336699970545e-05, 'gamma': 6.922267793734174e-06}. Best is trial 52 with value: -1.160831181899583.
/bsuhome/alexanderemert/Research/Star-Formation-Research-Project-2026/pipeline/scripts/optuna/final_preds_and_models/optuna_search_mult_quant_reg.py:75: UserWarning: The distribution is specified by [0.1, 5] and step=0.25, but the range is not divisible by `step`. It will be replaced with [0.1, 4.85].
  error_threshold = trial.suggest_float("error_threshold", 0.1, 5, step=0.25)
[I 2026-07-20 14:58:46,194] Trial 55 finished with value: -0.873482044912261 and parameters: {'error_threshold': 3.1, 'scalers': 'standard', 'ratios': 'log_ratio', 'imputers': 'median', 'n_estimators': 2800, 'learning_rate': 0.11089376583213215, 'max_depth': 11, 'min_child_weight': 5, 'subsample': 0.6, 'colsample_bytree': 0.5, 'colsample_bylevel': 0.9, 'reg_alpha': 0.003640716099461052, 'reg_lambda': 3.8870355827499503e-05, 'gamma': 6.551790254987763e-06}. Best is trial 52 with value: -1.160831181899583.
/bsuhome/alexanderemert/Research/Star-Formation-Research-Project-2026/pipeline/scripts/optuna/final_preds_and_models/optuna_search_mult_quant_reg.py:75: UserWarning: The distribution is specified by [0.1, 5] and step=0.25, but the range is not divisible by `step`. It will be replaced with [0.1, 4.85].
  error_threshold = trial.suggest_float("error_threshold", 0.1, 5, step=0.25)
[I 2026-07-20 14:59:38,033] Trial 56 finished with value: -0.7914274321917659 and parameters: {'error_threshold': 0.85, 'scalers': 'robust', 'ratios': 'log_ratio', 'imputers': 'median', 'n_estimators': 2850, 'learning_rate': 0.027046764991928908, 'max_depth': 12, 'min_child_weight': 5, 'subsample': 0.6, 'colsample_bytree': 0.5, 'colsample_bylevel': 0.9, 'reg_alpha': 0.007772546492086111, 'reg_lambda': 3.886619548776061e-05, 'gamma': 4.646160277135869e-06}. Best is trial 52 with value: -1.160831181899583.
/bsuhome/alexanderemert/Research/Star-Formation-Research-Project-2026/pipeline/scripts/optuna/final_preds_and_models/optuna_search_mult_quant_reg.py:75: UserWarning: The distribution is specified by [0.1, 5] and step=0.25, but the range is not divisible by `step`. It will be replaced with [0.1, 4.85].
  error_threshold = trial.suggest_float("error_threshold", 0.1, 5, step=0.25)
[I 2026-07-20 14:59:46,362] Trial 57 finished with value: -0.7474865042684083 and parameters: {'error_threshold': 2.85, 'scalers': 'robust', 'ratios': 'log_ratio', 'imputers': 'median', 'n_estimators': 2800, 'learning_rate': 0.026092939488283614, 'max_depth': 12, 'min_child_weight': 8, 'subsample': 0.6, 'colsample_bytree': 0.5, 'colsample_bylevel': 0.9, 'reg_alpha': 4.893907860921219e-05, 'reg_lambda': 7.127619451323622e-05, 'gamma': 4.288559135241529e-06}. Best is trial 52 with value: -1.160831181899583.
/bsuhome/alexanderemert/Research/Star-Formation-Research-Project-2026/pipeline/scripts/optuna/final_preds_and_models/optuna_search_mult_quant_reg.py:75: UserWarning: The distribution is specified by [0.1, 5] and step=0.25, but the range is not divisible by `step`. It will be replaced with [0.1, 4.85].
  error_threshold = trial.suggest_float("error_threshold", 0.1, 5, step=0.25)
[I 2026-07-20 15:00:39,801] Trial 58 finished with value: -0.7404659483810733 and parameters: {'error_threshold': 0.85, 'scalers': 'robust', 'ratios': 'log_ratio', 'imputers': 'median', 'n_estimators': 2050, 'learning_rate': 0.027808430855680903, 'max_depth': 12, 'min_child_weight': 8, 'subsample': 0.6, 'colsample_bytree': 0.5, 'colsample_bylevel': 0.9, 'reg_alpha': 0.0027984524089011836, 'reg_lambda': 7.338273939612661e-05, 'gamma': 5.155718347727093e-06}. Best is trial 52 with value: -1.160831181899583.
/bsuhome/alexanderemert/Research/Star-Formation-Research-Project-2026/pipeline/scripts/optuna/final_preds_and_models/optuna_search_mult_quant_reg.py:75: UserWarning: The distribution is specified by [0.1, 5] and step=0.25, but the range is not divisible by `step`. It will be replaced with [0.1, 4.85].
  error_threshold = trial.suggest_float("error_threshold", 0.1, 5, step=0.25)
[I 2026-07-20 15:00:48,369] Trial 59 finished with value: -0.9995643268650712 and parameters: {'error_threshold': 3.1, 'scalers': 'robust', 'ratios': 'log_ratio', 'imputers': 'median', 'n_estimators': 2900, 'learning_rate': 0.37761993603231236, 'max_depth': 12, 'min_child_weight': 9, 'subsample': 0.6, 'colsample_bytree': 0.5, 'colsample_bylevel': 0.8, 'reg_alpha': 0.00508910935651625, 'reg_lambda': 7.28508168727872e-05, 'gamma': 6.770640000077788e-06}. Best is trial 52 with value: -1.160831181899583.
/bsuhome/alexanderemert/Research/Star-Formation-Research-Project-2026/pipeline/scripts/optuna/final_preds_and_models/optuna_search_mult_quant_reg.py:75: UserWarning: The distribution is specified by [0.1, 5] and step=0.25, but the range is not divisible by `step`. It will be replaced with [0.1, 4.85].
  error_threshold = trial.suggest_float("error_threshold", 0.1, 5, step=0.25)
[I 2026-07-20 15:01:47,240] Trial 60 finished with value: -1.0419711168293337 and parameters: {'error_threshold': 2.85, 'scalers': 'robust', 'ratios': 'log_ratio', 'imputers': 'median', 'n_estimators': 2800, 'learning_rate': 0.480029383883962, 'max_depth': 12, 'min_child_weight': 9, 'subsample': 0.6, 'colsample_bytree': 0.5, 'colsample_bylevel': 0.8, 'reg_alpha': 0.0035246233430450053, 'reg_lambda': 5.114914109810151e-05, 'gamma': 2.9036900880426164e-05}. Best is trial 52 with value: -1.160831181899583.
/bsuhome/alexanderemert/Research/Star-Formation-Research-Project-2026/pipeline/scripts/optuna/final_preds_and_models/optuna_search_mult_quant_reg.py:75: UserWarning: The distribution is specified by [0.1, 5] and step=0.25, but the range is not divisible by `step`. It will be replaced with [0.1, 4.85].
  error_threshold = trial.suggest_float("error_threshold", 0.1, 5, step=0.25)
[I 2026-07-20 15:01:54,019] Trial 61 finished with value: -1.0785982155412024 and parameters: {'error_threshold': 4.35, 'scalers': 'robust', 'ratios': 'log_ratio', 'imputers': 'median', 'n_estimators': 2050, 'learning_rate': 0.4368049142190912, 'max_depth': 12, 'min_child_weight': 7, 'subsample': 0.6, 'colsample_bytree': 0.5, 'colsample_bylevel': 0.8, 'reg_alpha': 0.036256337546904, 'reg_lambda': 1.3943375166859904, 'gamma': 9.218594150053824e-05}. Best is trial 52 with value: -1.160831181899583.
/bsuhome/alexanderemert/Research/Star-Formation-Research-Project-2026/pipeline/scripts/optuna/final_preds_and_models/optuna_search_mult_quant_reg.py:75: UserWarning: The distribution is specified by [0.1, 5] and step=0.25, but the range is not divisible by `step`. It will be replaced with [0.1, 4.85].
  error_threshold = trial.suggest_float("error_threshold", 0.1, 5, step=0.25)
[I 2026-07-20 15:02:43,372] Trial 62 finished with value: -1.192444623876916 and parameters: {'error_threshold': 3.35, 'scalers': 'robust', 'ratios': 'log_ratio', 'imputers': 'median', 'n_estimators': 2900, 'learning_rate': 0.41800616825735226, 'max_depth': 12, 'min_child_weight': 5, 'subsample': 0.6, 'colsample_bytree': 0.5, 'colsample_bylevel': 0.8, 'reg_alpha': 0.013705014804228451, 'reg_lambda': 6.927491831955061e-05, 'gamma': 1.8865527254090756e-05}. Best is trial 62 with value: -1.192444623876916.
/bsuhome/alexanderemert/Research/Star-Formation-Research-Project-2026/pipeline/scripts/optuna/final_preds_and_models/optuna_search_mult_quant_reg.py:75: UserWarning: The distribution is specified by [0.1, 5] and step=0.25, but the range is not divisible by `step`. It will be replaced with [0.1, 4.85].
  error_threshold = trial.suggest_float("error_threshold", 0.1, 5, step=0.25)
[I 2026-07-20 15:02:52,360] Trial 63 finished with value: -1.151086122885091 and parameters: {'error_threshold': 3.6, 'scalers': 'robust', 'ratios': 'log_ratio', 'imputers': 'median', 'n_estimators': 2900, 'learning_rate': 0.3755766710610085, 'max_depth': 12, 'min_child_weight': 6, 'subsample': 0.5, 'colsample_bytree': 0.5, 'colsample_bylevel': 0.8, 'reg_alpha': 0.027241200287727613, 'reg_lambda': 8.924770525367609e-05, 'gamma': 5.090706255386057e-05}. Best is trial 62 with value: -1.192444623876916.
/bsuhome/alexanderemert/Research/Star-Formation-Research-Project-2026/pipeline/scripts/optuna/final_preds_and_models/optuna_search_mult_quant_reg.py:75: UserWarning: The distribution is specified by [0.1, 5] and step=0.25, but the range is not divisible by `step`. It will be replaced with [0.1, 4.85].
  error_threshold = trial.suggest_float("error_threshold", 0.1, 5, step=0.25)
[I 2026-07-20 15:03:36,569] Trial 64 finished with value: -1.1097869507685378 and parameters: {'error_threshold': 3.6, 'scalers': 'robust', 'ratios': 'log_ratio', 'imputers': 'median', 'n_estimators': 2550, 'learning_rate': 0.34951643722620385, 'max_depth': 12, 'min_child_weight': 6, 'subsample': 0.5, 'colsample_bytree': 0.5, 'colsample_bylevel': 0.8, 'reg_alpha': 0.05011588703324967, 'reg_lambda': 0.0001419114595714785, 'gamma': 4.271287139649333e-05}. Best is trial 62 with value: -1.192444623876916.
/bsuhome/alexanderemert/Research/Star-Formation-Research-Project-2026/pipeline/scripts/optuna/final_preds_and_models/optuna_search_mult_quant_reg.py:75: UserWarning: The distribution is specified by [0.1, 5] and step=0.25, but the range is not divisible by `step`. It will be replaced with [0.1, 4.85].
  error_threshold = trial.suggest_float("error_threshold", 0.1, 5, step=0.25)
[I 2026-07-20 15:03:42,805] Trial 65 finished with value: -1.0507405933799665 and parameters: {'error_threshold': 4.35, 'scalers': 'standard', 'ratios': 'log_ratio', 'imputers': 'mean', 'n_estimators': 2050, 'learning_rate': 0.34213972183002833, 'max_depth': 9, 'min_child_weight': 6, 'subsample': 0.5, 'colsample_bytree': 0.7, 'colsample_bylevel': 0.8, 'reg_alpha': 0.10992855668578044, 'reg_lambda': 0.00012250016753660224, 'gamma': 3.7605794930278704e-05}. Best is trial 62 with value: -1.192444623876916.
/bsuhome/alexanderemert/Research/Star-Formation-Research-Project-2026/pipeline/scripts/optuna/final_preds_and_models/optuna_search_mult_quant_reg.py:75: UserWarning: The distribution is specified by [0.1, 5] and step=0.25, but the range is not divisible by `step`. It will be replaced with [0.1, 4.85].
  error_threshold = trial.suggest_float("error_threshold", 0.1, 5, step=0.25)
[I 2026-07-20 15:04:28,679] Trial 66 finished with value: -1.038277286789249 and parameters: {'error_threshold': 4.35, 'scalers': 'standard', 'ratios': 'log_ratio', 'imputers': 'mean', 'n_estimators': 2300, 'learning_rate': 0.31726996888461656, 'max_depth': 9, 'min_child_weight': 6, 'subsample': 0.5, 'colsample_bytree': 0.6, 'colsample_bylevel': 0.8, 'reg_alpha': 0.06907702088556225, 'reg_lambda': 0.0002711604494012707, 'gamma': 4.310961568509512e-05}. Best is trial 62 with value: -1.192444623876916.
/bsuhome/alexanderemert/Research/Star-Formation-Research-Project-2026/pipeline/scripts/optuna/final_preds_and_models/optuna_search_mult_quant_reg.py:75: UserWarning: The distribution is specified by [0.1, 5] and step=0.25, but the range is not divisible by `step`. It will be replaced with [0.1, 4.85].
  error_threshold = trial.suggest_float("error_threshold", 0.1, 5, step=0.25)
[I 2026-07-20 15:04:35,845] Trial 67 finished with value: -0.970346899026885 and parameters: {'error_threshold': 4.35, 'scalers': 'robust', 'ratios': 'log_ratio', 'imputers': 'mean', 'n_estimators': 2300, 'learning_rate': 0.3159456420420354, 'max_depth': 12, 'min_child_weight': 9, 'subsample': 0.5, 'colsample_bytree': 0.7, 'colsample_bylevel': 0.8, 'reg_alpha': 0.041262498318321586, 'reg_lambda': 0.00020232638589505716, 'gamma': 4.6762059851713555e-05}. Best is trial 62 with value: -1.192444623876916.
/bsuhome/alexanderemert/Research/Star-Formation-Research-Project-2026/pipeline/scripts/optuna/final_preds_and_models/optuna_search_mult_quant_reg.py:75: UserWarning: The distribution is specified by [0.1, 5] and step=0.25, but the range is not divisible by `step`. It will be replaced with [0.1, 4.85].
  error_threshold = trial.suggest_float("error_threshold", 0.1, 5, step=0.25)
[I 2026-07-20 15:05:03,783] Trial 69 finished with value: -0.8956190869890025 and parameters: {'error_threshold': 4.6, 'scalers': 'robust', 'ratios': 'log_ratio', 'imputers': 'median', 'n_estimators': 1700, 'learning_rate': 0.35655186013124934, 'max_depth': 12, 'min_child_weight': 10, 'subsample': 0.7, 'colsample_bytree': 0.5, 'colsample_bylevel': 0.8, 'reg_alpha': 0.062434513937137275, 'reg_lambda': 0.00014001379901847674, 'gamma': 4.3127494890271526e-05}. Best is trial 62 with value: -1.192444623876916.
/bsuhome/alexanderemert/Research/Star-Formation-Research-Project-2026/pipeline/scripts/optuna/final_preds_and_models/optuna_search_mult_quant_reg.py:75: UserWarning: The distribution is specified by [0.1, 5] and step=0.25, but the range is not divisible by `step`. It will be replaced with [0.1, 4.85].
  error_threshold = trial.suggest_float("error_threshold", 0.1, 5, step=0.25)
[I 2026-07-20 15:05:29,535] Trial 68 finished with value: -1.0150642262362306 and parameters: {'error_threshold': 3.6, 'scalers': 'robust', 'ratios': 'log_ratio', 'imputers': 'median', 'n_estimators': 2550, 'learning_rate': 0.3682420825528537, 'max_depth': 12, 'min_child_weight': 9, 'subsample': 0.5, 'colsample_bytree': 0.7, 'colsample_bylevel': 0.8, 'reg_alpha': 0.019232646693313357, 'reg_lambda': 0.0002315631530294757, 'gamma': 5.8368155199803476e-05}. Best is trial 62 with value: -1.192444623876916.
/bsuhome/alexanderemert/Research/Star-Formation-Research-Project-2026/pipeline/scripts/optuna/final_preds_and_models/optuna_search_mult_quant_reg.py:75: UserWarning: The distribution is specified by [0.1, 5] and step=0.25, but the range is not divisible by `step`. It will be replaced with [0.1, 4.85].
  error_threshold = trial.suggest_float("error_threshold", 0.1, 5, step=0.25)
[I 2026-07-20 15:06:07,215] Trial 70 finished with value: -0.9750927803295223 and parameters: {'error_threshold': 4.35, 'scalers': 'robust', 'ratios': 'log_ratio', 'imputers': 'median', 'n_estimators': 1700, 'learning_rate': 0.3093780082251331, 'max_depth': 12, 'min_child_weight': 6, 'subsample': 0.7, 'colsample_bytree': 0.5, 'colsample_bylevel': 0.8, 'reg_alpha': 0.04507781676795437, 'reg_lambda': 0.00022171008113115444, 'gamma': 3.517019029286528e-05}. Best is trial 62 with value: -1.192444623876916.
/bsuhome/alexanderemert/Research/Star-Formation-Research-Project-2026/pipeline/scripts/optuna/final_preds_and_models/optuna_search_mult_quant_reg.py:75: UserWarning: The distribution is specified by [0.1, 5] and step=0.25, but the range is not divisible by `step`. It will be replaced with [0.1, 4.85].
  error_threshold = trial.suggest_float("error_threshold", 0.1, 5, step=0.25)
[I 2026-07-20 15:06:23,604] Trial 71 finished with value: -1.1059307466291726 and parameters: {'error_threshold': 4.35, 'scalers': 'robust', 'ratios': 'log_ratio', 'imputers': 'median', 'n_estimators': 3000, 'learning_rate': 0.3195822474963766, 'max_depth': 12, 'min_child_weight': 6, 'subsample': 0.5, 'colsample_bytree': 0.5, 'colsample_bylevel': 0.8, 'reg_alpha': 0.0714392972232594, 'reg_lambda': 0.0001917720781550473, 'gamma': 5.515732082179753e-05}. Best is trial 62 with value: -1.192444623876916.
/bsuhome/alexanderemert/Research/Star-Formation-Research-Project-2026/pipeline/scripts/optuna/final_preds_and_models/optuna_search_mult_quant_reg.py:75: UserWarning: The distribution is specified by [0.1, 5] and step=0.25, but the range is not divisible by `step`. It will be replaced with [0.1, 4.85].
  error_threshold = trial.suggest_float("error_threshold", 0.1, 5, step=0.25)
