[I 2026-07-20 12:29:11,386] Trial 139 finished with value: -0.3180898151509667 and parameters: {'error_threshold': 0.25, 'scalers': 'standard', 'ratios': 'norm_ratio', 'imputers': 'mean', 'n_estimators': 150, 'learning_rate': 0.03807706994951227, 'max_depth': 11, 'min_child_weight': 5, 'subsample': 0.7, 'colsample_bytree': 0.7, 'colsample_bylevel': 1.0, 'reg_alpha': 68.17795110359916, 'reg_lambda': 0.0001644823306517248, 'gamma': 36.371977598181935}. Best is trial 69 with value: -0.3911874830873789.
/bsuscratch/alexanderemert/miniforge3/envs/starform-alex/lib/python3.14/site-packages/sklearn/utils/extmath.py:1207: RuntimeWarning: invalid value encountered in divide
  updated_mean = (last_sum + new_sum) / updated_sample_count
/bsuscratch/alexanderemert/miniforge3/envs/starform-alex/lib/python3.14/site-packages/sklearn/utils/extmath.py:1212: RuntimeWarning: invalid value encountered in divide
  T = new_sum / new_sample_count
/bsuscratch/alexanderemert/miniforge3/envs/starform-alex/lib/python3.14/site-packages/sklearn/utils/extmath.py:1236: RuntimeWarning: invalid value encountered in divide
  new_unnormalized_variance -= correction**2 / new_sample_count
/bsuscratch/alexanderemert/miniforge3/envs/starform-alex/lib/python3.14/site-packages/sklearn/utils/extmath.py:1207: RuntimeWarning: invalid value encountered in divide
  updated_mean = (last_sum + new_sum) / updated_sample_count
/bsuscratch/alexanderemert/miniforge3/envs/starform-alex/lib/python3.14/site-packages/sklearn/utils/extmath.py:1212: RuntimeWarning: invalid value encountered in divide
  T = new_sum / new_sample_count
/bsuscratch/alexanderemert/miniforge3/envs/starform-alex/lib/python3.14/site-packages/sklearn/utils/extmath.py:1236: RuntimeWarning: invalid value encountered in divide
  new_unnormalized_variance -= correction**2 / new_sample_count
/bsuscratch/alexanderemert/miniforge3/envs/starform-alex/lib/python3.14/site-packages/sklearn/utils/extmath.py:1207: RuntimeWarning: invalid value encountered in divide
  updated_mean = (last_sum + new_sum) / updated_sample_count
/bsuscratch/alexanderemert/miniforge3/envs/starform-alex/lib/python3.14/site-packages/sklearn/utils/extmath.py:1212: RuntimeWarning: invalid value encountered in divide
  T = new_sum / new_sample_count
/bsuscratch/alexanderemert/miniforge3/envs/starform-alex/lib/python3.14/site-packages/sklearn/utils/extmath.py:1236: RuntimeWarning: invalid value encountered in divide
  new_unnormalized_variance -= correction**2 / new_sample_count
/bsuscratch/alexanderemert/miniforge3/envs/starform-alex/lib/python3.14/site-packages/sklearn/utils/extmath.py:1207: RuntimeWarning: invalid value encountered in divide
  updated_mean = (last_sum + new_sum) / updated_sample_count
/bsuscratch/alexanderemert/miniforge3/envs/starform-alex/lib/python3.14/site-packages/sklearn/utils/extmath.py:1212: RuntimeWarning: invalid value encountered in divide
  T = new_sum / new_sample_count
/bsuscratch/alexanderemert/miniforge3/envs/starform-alex/lib/python3.14/site-packages/sklearn/utils/extmath.py:1236: RuntimeWarning: invalid value encountered in divide
  new_unnormalized_variance -= correction**2 / new_sample_count
/bsuscratch/alexanderemert/miniforge3/envs/starform-alex/lib/python3.14/site-packages/sklearn/utils/extmath.py:1207: RuntimeWarning: invalid value encountered in divide
  updated_mean = (last_sum + new_sum) / updated_sample_count
/bsuscratch/alexanderemert/miniforge3/envs/starform-alex/lib/python3.14/site-packages/sklearn/utils/extmath.py:1212: RuntimeWarning: invalid value encountered in divide
  T = new_sum / new_sample_count
/bsuscratch/alexanderemert/miniforge3/envs/starform-alex/lib/python3.14/site-packages/sklearn/utils/extmath.py:1236: RuntimeWarning: invalid value encountered in divide
  new_unnormalized_variance -= correction**2 / new_sample_count
/bsuscratch/alexanderemert/miniforge3/envs/starform-alex/lib/python3.14/site-packages/sklearn/utils/extmath.py:1207: RuntimeWarning: invalid value encountered in divide
  updated_mean = (last_sum + new_sum) / updated_sample_count
/bsuscratch/alexanderemert/miniforge3/envs/starform-alex/lib/python3.14/site-packages/sklearn/utils/extmath.py:1212: RuntimeWarning: invalid value encountered in divide
  T = new_sum / new_sample_count
/bsuscratch/alexanderemert/miniforge3/envs/starform-alex/lib/python3.14/site-packages/sklearn/utils/extmath.py:1236: RuntimeWarning: invalid value encountered in divide
  new_unnormalized_variance -= correction**2 / new_sample_count
/bsuscratch/alexanderemert/miniforge3/envs/starform-alex/lib/python3.14/site-packages/sklearn/utils/extmath.py:1207: RuntimeWarning: invalid value encountered in divide
  updated_mean = (last_sum + new_sum) / updated_sample_count
/bsuscratch/alexanderemert/miniforge3/envs/starform-alex/lib/python3.14/site-packages/sklearn/utils/extmath.py:1212: RuntimeWarning: invalid value encountered in divide
  T = new_sum / new_sample_count
/bsuscratch/alexanderemert/miniforge3/envs/starform-alex/lib/python3.14/site-packages/sklearn/utils/extmath.py:1236: RuntimeWarning: invalid value encountered in divide
  new_unnormalized_variance -= correction**2 / new_sample_count
/bsuscratch/alexanderemert/miniforge3/envs/starform-alex/lib/python3.14/site-packages/sklearn/utils/extmath.py:1207: RuntimeWarning: invalid value encountered in divide
  updated_mean = (last_sum + new_sum) / updated_sample_count
/bsuscratch/alexanderemert/miniforge3/envs/starform-alex/lib/python3.14/site-packages/sklearn/utils/extmath.py:1212: RuntimeWarning: invalid value encountered in divide
  T = new_sum / new_sample_count
/bsuscratch/alexanderemert/miniforge3/envs/starform-alex/lib/python3.14/site-packages/sklearn/utils/extmath.py:1236: RuntimeWarning: invalid value encountered in divide
  new_unnormalized_variance -= correction**2 / new_sample_count
/bsuscratch/alexanderemert/miniforge3/envs/starform-alex/lib/python3.14/site-packages/sklearn/utils/extmath.py:1207: RuntimeWarning: invalid value encountered in divide
  updated_mean = (last_sum + new_sum) / updated_sample_count
/bsuscratch/alexanderemert/miniforge3/envs/starform-alex/lib/python3.14/site-packages/sklearn/utils/extmath.py:1212: RuntimeWarning: invalid value encountered in divide
  T = new_sum / new_sample_count
/bsuscratch/alexanderemert/miniforge3/envs/starform-alex/lib/python3.14/site-packages/sklearn/utils/extmath.py:1236: RuntimeWarning: invalid value encountered in divide
  new_unnormalized_variance -= correction**2 / new_sample_count
/bsuscratch/alexanderemert/miniforge3/envs/starform-alex/lib/python3.14/site-packages/sklearn/utils/extmath.py:1207: RuntimeWarning: invalid value encountered in divide
  updated_mean = (last_sum + new_sum) / updated_sample_count
/bsuscratch/alexanderemert/miniforge3/envs/starform-alex/lib/python3.14/site-packages/sklearn/utils/extmath.py:1212: RuntimeWarning: invalid value encountered in divide
  T = new_sum / new_sample_count
/bsuscratch/alexanderemert/miniforge3/envs/starform-alex/lib/python3.14/site-packages/sklearn/utils/extmath.py:1236: RuntimeWarning: invalid value encountered in divide
  new_unnormalized_variance -= correction**2 / new_sample_count
/bsuscratch/alexanderemert/miniforge3/envs/starform-alex/lib/python3.14/site-packages/sklearn/utils/extmath.py:1207: RuntimeWarning: invalid value encountered in divide
  updated_mean = (last_sum + new_sum) / updated_sample_count
/bsuscratch/alexanderemert/miniforge3/envs/starform-alex/lib/python3.14/site-packages/sklearn/utils/extmath.py:1212: RuntimeWarning: invalid value encountered in divide
  T = new_sum / new_sample_count
/bsuscratch/alexanderemert/miniforge3/envs/starform-alex/lib/python3.14/site-packages/sklearn/utils/extmath.py:1236: RuntimeWarning: invalid value encountered in divide
  new_unnormalized_variance -= correction**2 / new_sample_count
/bsuscratch/alexanderemert/miniforge3/envs/starform-alex/lib/python3.14/site-packages/sklearn/utils/extmath.py:1207: RuntimeWarning: invalid value encountered in divide
  updated_mean = (last_sum + new_sum) / updated_sample_count
/bsuscratch/alexanderemert/miniforge3/envs/starform-alex/lib/python3.14/site-packages/sklearn/utils/extmath.py:1212: RuntimeWarning: invalid value encountered in divide
  T = new_sum / new_sample_count
/bsuscratch/alexanderemert/miniforge3/envs/starform-alex/lib/python3.14/site-packages/sklearn/utils/extmath.py:1236: RuntimeWarning: invalid value encountered in divide
  new_unnormalized_variance -= correction**2 / new_sample_count
/bsuscratch/alexanderemert/miniforge3/envs/starform-alex/lib/python3.14/site-packages/sklearn/utils/extmath.py:1207: RuntimeWarning: invalid value encountered in divide
  updated_mean = (last_sum + new_sum) / updated_sample_count
/bsuscratch/alexanderemert/miniforge3/envs/starform-alex/lib/python3.14/site-packages/sklearn/utils/extmath.py:1212: RuntimeWarning: invalid value encountered in divide
  T = new_sum / new_sample_count
/bsuscratch/alexanderemert/miniforge3/envs/starform-alex/lib/python3.14/site-packages/sklearn/utils/extmath.py:1236: RuntimeWarning: invalid value encountered in divide
  new_unnormalized_variance -= correction**2 / new_sample_count
/bsuscratch/alexanderemert/miniforge3/envs/starform-alex/lib/python3.14/site-packages/sklearn/utils/extmath.py:1207: RuntimeWarning: invalid value encountered in divide
  updated_mean = (last_sum + new_sum) / updated_sample_count
/bsuscratch/alexanderemert/miniforge3/envs/starform-alex/lib/python3.14/site-packages/sklearn/utils/extmath.py:1212: RuntimeWarning: invalid value encountered in divide
  T = new_sum / new_sample_count
/bsuscratch/alexanderemert/miniforge3/envs/starform-alex/lib/python3.14/site-packages/sklearn/utils/extmath.py:1236: RuntimeWarning: invalid value encountered in divide
  new_unnormalized_variance -= correction**2 / new_sample_count
/bsuscratch/alexanderemert/miniforge3/envs/starform-alex/lib/python3.14/site-packages/sklearn/utils/extmath.py:1207: RuntimeWarning: invalid value encountered in divide
  updated_mean = (last_sum + new_sum) / updated_sample_count
/bsuscratch/alexanderemert/miniforge3/envs/starform-alex/lib/python3.14/site-packages/sklearn/utils/extmath.py:1212: RuntimeWarning: invalid value encountered in divide
  T = new_sum / new_sample_count
/bsuscratch/alexanderemert/miniforge3/envs/starform-alex/lib/python3.14/site-packages/sklearn/utils/extmath.py:1236: RuntimeWarning: invalid value encountered in divide
  new_unnormalized_variance -= correction**2 / new_sample_count
/bsuscratch/alexanderemert/miniforge3/envs/starform-alex/lib/python3.14/site-packages/sklearn/utils/extmath.py:1207: RuntimeWarning: invalid value encountered in divide
  updated_mean = (last_sum + new_sum) / updated_sample_count
/bsuscratch/alexanderemert/miniforge3/envs/starform-alex/lib/python3.14/site-packages/sklearn/utils/extmath.py:1212: RuntimeWarning: invalid value encountered in divide
  T = new_sum / new_sample_count
/bsuscratch/alexanderemert/miniforge3/envs/starform-alex/lib/python3.14/site-packages/sklearn/utils/extmath.py:1236: RuntimeWarning: invalid value encountered in divide
  new_unnormalized_variance -= correction**2 / new_sample_count
