[I 2026-07-20 13:43:21,647] Trial 337 finished with value: -0.19366969263738767 and parameters: {'error_threshold': 0.0, 'scalers': 'robust', 'ratios': 'norm_ratio', 'imputers': 'none', 'n_estimators': 100, 'learning_rate': 0.08317013947248977, 'max_depth': 3, 'min_child_weight': 6, 'subsample': 0.5, 'colsample_bytree': 0.6, 'colsample_bylevel': 0.5, 'reg_alpha': 34.128624572120806, 'reg_lambda': 0.00010372992100293795, 'gamma': 7.6184775615322105}. Best is trial 299 with value: -0.22091430699488926.
/bsuscratch/alexanderemert/miniforge3/envs/starform-alex/lib/python3.14/site-packages/numpy/lib/_nanfunctions_impl.py:1215: RuntimeWarning: All-NaN slice encountered
  return fnb._ureduce(a, func=_nanmedian, keepdims=keepdims,
/bsuscratch/alexanderemert/miniforge3/envs/starform-alex/lib/python3.14/site-packages/numpy/lib/_nanfunctions_impl.py:1396: RuntimeWarning: All-NaN slice encountered
  return _nanquantile_unchecked(
/bsuscratch/alexanderemert/miniforge3/envs/starform-alex/lib/python3.14/site-packages/numpy/lib/_nanfunctions_impl.py:1215: RuntimeWarning: All-NaN slice encountered
  return fnb._ureduce(a, func=_nanmedian, keepdims=keepdims,
/bsuscratch/alexanderemert/miniforge3/envs/starform-alex/lib/python3.14/site-packages/numpy/lib/_nanfunctions_impl.py:1396: RuntimeWarning: All-NaN slice encountered
  return _nanquantile_unchecked(
/bsuscratch/alexanderemert/miniforge3/envs/starform-alex/lib/python3.14/site-packages/numpy/lib/_nanfunctions_impl.py:1215: RuntimeWarning: All-NaN slice encountered
  return fnb._ureduce(a, func=_nanmedian, keepdims=keepdims,
/bsuscratch/alexanderemert/miniforge3/envs/starform-alex/lib/python3.14/site-packages/numpy/lib/_nanfunctions_impl.py:1396: RuntimeWarning: All-NaN slice encountered
  return _nanquantile_unchecked(
/bsuscratch/alexanderemert/miniforge3/envs/starform-alex/lib/python3.14/site-packages/numpy/lib/_nanfunctions_impl.py:1215: RuntimeWarning: All-NaN slice encountered
  return fnb._ureduce(a, func=_nanmedian, keepdims=keepdims,
/bsuscratch/alexanderemert/miniforge3/envs/starform-alex/lib/python3.14/site-packages/numpy/lib/_nanfunctions_impl.py:1396: RuntimeWarning: All-NaN slice encountered
  return _nanquantile_unchecked(
/bsuscratch/alexanderemert/miniforge3/envs/starform-alex/lib/python3.14/site-packages/numpy/lib/_nanfunctions_impl.py:1215: RuntimeWarning: All-NaN slice encountered
  return fnb._ureduce(a, func=_nanmedian, keepdims=keepdims,
/bsuscratch/alexanderemert/miniforge3/envs/starform-alex/lib/python3.14/site-packages/numpy/lib/_nanfunctions_impl.py:1396: RuntimeWarning: All-NaN slice encountered
  return _nanquantile_unchecked(
/bsuscratch/alexanderemert/miniforge3/envs/starform-alex/lib/python3.14/site-packages/numpy/lib/_nanfunctions_impl.py:1215: RuntimeWarning: All-NaN slice encountered
  return fnb._ureduce(a, func=_nanmedian, keepdims=keepdims,
/bsuscratch/alexanderemert/miniforge3/envs/starform-alex/lib/python3.14/site-packages/numpy/lib/_nanfunctions_impl.py:1396: RuntimeWarning: All-NaN slice encountered
  return _nanquantile_unchecked(
/bsuscratch/alexanderemert/miniforge3/envs/starform-alex/lib/python3.14/site-packages/numpy/lib/_nanfunctions_impl.py:1215: RuntimeWarning: All-NaN slice encountered
  return fnb._ureduce(a, func=_nanmedian, keepdims=keepdims,
/bsuscratch/alexanderemert/miniforge3/envs/starform-alex/lib/python3.14/site-packages/numpy/lib/_nanfunctions_impl.py:1215: RuntimeWarning: All-NaN slice encountered
  return fnb._ureduce(a, func=_nanmedian, keepdims=keepdims,
/bsuscratch/alexanderemert/miniforge3/envs/starform-alex/lib/python3.14/site-packages/numpy/lib/_nanfunctions_impl.py:1396: RuntimeWarning: All-NaN slice encountered
  return _nanquantile_unchecked(
/bsuscratch/alexanderemert/miniforge3/envs/starform-alex/lib/python3.14/site-packages/numpy/lib/_nanfunctions_impl.py:1396: RuntimeWarning: All-NaN slice encountered
  return _nanquantile_unchecked(
/bsuscratch/alexanderemert/miniforge3/envs/starform-alex/lib/python3.14/site-packages/numpy/lib/_nanfunctions_impl.py:1215: RuntimeWarning: All-NaN slice encountered
  return fnb._ureduce(a, func=_nanmedian, keepdims=keepdims,
/bsuscratch/alexanderemert/miniforge3/envs/starform-alex/lib/python3.14/site-packages/numpy/lib/_nanfunctions_impl.py:1215: RuntimeWarning: All-NaN slice encountered
  return fnb._ureduce(a, func=_nanmedian, keepdims=keepdims,
/bsuscratch/alexanderemert/miniforge3/envs/starform-alex/lib/python3.14/site-packages/numpy/lib/_nanfunctions_impl.py:1396: RuntimeWarning: All-NaN slice encountered
  return _nanquantile_unchecked(
/bsuscratch/alexanderemert/miniforge3/envs/starform-alex/lib/python3.14/site-packages/numpy/lib/_nanfunctions_impl.py:1396: RuntimeWarning: All-NaN slice encountered
  return _nanquantile_unchecked(
/bsuscratch/alexanderemert/miniforge3/envs/starform-alex/lib/python3.14/site-packages/numpy/lib/_nanfunctions_impl.py:1215: RuntimeWarning: All-NaN slice encountered
  return fnb._ureduce(a, func=_nanmedian, keepdims=keepdims,
/bsuscratch/alexanderemert/miniforge3/envs/starform-alex/lib/python3.14/site-packages/numpy/lib/_nanfunctions_impl.py:1396: RuntimeWarning: All-NaN slice encountered
  return _nanquantile_unchecked(
[I 2026-07-20 13:43:21,809] Trial 335 finished with value: -0.19470991398748852 and parameters: {'error_threshold': 0.0, 'scalers': 'robust', 'ratios': 'norm_ratio', 'imputers': 'none', 'n_estimators': 300, 'learning_rate': 0.055992797120213524, 'max_depth': 3, 'min_child_weight': 7, 'subsample': 0.5, 'colsample_bytree': 0.6, 'colsample_bylevel': 0.5, 'reg_alpha': 36.73768220563279, 'reg_lambda': 0.00019506417386208977, 'gamma': 8.148537519079223}. Best is trial 299 with value: -0.22091430699488926.
/bsuscratch/alexanderemert/miniforge3/envs/starform-alex/lib/python3.14/site-packages/numpy/lib/_nanfunctions_impl.py:1215: RuntimeWarning: All-NaN slice encountered
  return fnb._ureduce(a, func=_nanmedian, keepdims=keepdims,
/bsuscratch/alexanderemert/miniforge3/envs/starform-alex/lib/python3.14/site-packages/numpy/lib/_nanfunctions_impl.py:1396: RuntimeWarning: All-NaN slice encountered
  return _nanquantile_unchecked(
/bsuscratch/alexanderemert/miniforge3/envs/starform-alex/lib/python3.14/site-packages/numpy/lib/_nanfunctions_impl.py:1215: RuntimeWarning: All-NaN slice encountered
  return fnb._ureduce(a, func=_nanmedian, keepdims=keepdims,
/bsuscratch/alexanderemert/miniforge3/envs/starform-alex/lib/python3.14/site-packages/numpy/lib/_nanfunctions_impl.py:1215: RuntimeWarning: All-NaN slice encountered
  return fnb._ureduce(a, func=_nanmedian, keepdims=keepdims,
/bsuscratch/alexanderemert/miniforge3/envs/starform-alex/lib/python3.14/site-packages/numpy/lib/_nanfunctions_impl.py:1396: RuntimeWarning: All-NaN slice encountered
  return _nanquantile_unchecked(
/bsuscratch/alexanderemert/miniforge3/envs/starform-alex/lib/python3.14/site-packages/numpy/lib/_nanfunctions_impl.py:1396: RuntimeWarning: All-NaN slice encountered
  return _nanquantile_unchecked(
/bsuscratch/alexanderemert/miniforge3/envs/starform-alex/lib/python3.14/site-packages/numpy/lib/_nanfunctions_impl.py:1215: RuntimeWarning: All-NaN slice encountered
  return fnb._ureduce(a, func=_nanmedian, keepdims=keepdims,
/bsuscratch/alexanderemert/miniforge3/envs/starform-alex/lib/python3.14/site-packages/numpy/lib/_nanfunctions_impl.py:1215: RuntimeWarning: All-NaN slice encountered
  return fnb._ureduce(a, func=_nanmedian, keepdims=keepdims,
/bsuscratch/alexanderemert/miniforge3/envs/starform-alex/lib/python3.14/site-packages/numpy/lib/_nanfunctions_impl.py:1396: RuntimeWarning: All-NaN slice encountered
  return _nanquantile_unchecked(
/bsuscratch/alexanderemert/miniforge3/envs/starform-alex/lib/python3.14/site-packages/numpy/lib/_nanfunctions_impl.py:1396: RuntimeWarning: All-NaN slice encountered
  return _nanquantile_unchecked(
/bsuscratch/alexanderemert/miniforge3/envs/starform-alex/lib/python3.14/site-packages/numpy/lib/_nanfunctions_impl.py:1215: RuntimeWarning: All-NaN slice encountered
  return fnb._ureduce(a, func=_nanmedian, keepdims=keepdims,
/bsuscratch/alexanderemert/miniforge3/envs/starform-alex/lib/python3.14/site-packages/numpy/lib/_nanfunctions_impl.py:1396: RuntimeWarning: All-NaN slice encountered
  return _nanquantile_unchecked(
/bsuscratch/alexanderemert/miniforge3/envs/starform-alex/lib/python3.14/site-packages/numpy/lib/_nanfunctions_impl.py:1215: RuntimeWarning: All-NaN slice encountered
  return fnb._ureduce(a, func=_nanmedian, keepdims=keepdims,
/bsuscratch/alexanderemert/miniforge3/envs/starform-alex/lib/python3.14/site-packages/numpy/lib/_nanfunctions_impl.py:1396: RuntimeWarning: All-NaN slice encountered
  return _nanquantile_unchecked(
/bsuscratch/alexanderemert/miniforge3/envs/starform-alex/lib/python3.14/site-packages/numpy/lib/_nanfunctions_impl.py:1215: RuntimeWarning: All-NaN slice encountered
  return fnb._ureduce(a, func=_nanmedian, keepdims=keepdims,
/bsuscratch/alexanderemert/miniforge3/envs/starform-alex/lib/python3.14/site-packages/numpy/lib/_nanfunctions_impl.py:1396: RuntimeWarning: All-NaN slice encountered
  return _nanquantile_unchecked(
/bsuscratch/alexanderemert/miniforge3/envs/starform-alex/lib/python3.14/site-packages/numpy/lib/_nanfunctions_impl.py:1215: RuntimeWarning: All-NaN slice encountered
  return fnb._ureduce(a, func=_nanmedian, keepdims=keepdims,
/bsuscratch/alexanderemert/miniforge3/envs/starform-alex/lib/python3.14/site-packages/numpy/lib/_nanfunctions_impl.py:1215: RuntimeWarning: All-NaN slice encountered
  return fnb._ureduce(a, func=_nanmedian, keepdims=keepdims,
/bsuscratch/alexanderemert/miniforge3/envs/starform-alex/lib/python3.14/site-packages/numpy/lib/_nanfunctions_impl.py:1396: RuntimeWarning: All-NaN slice encountered
  return _nanquantile_unchecked(
/bsuscratch/alexanderemert/miniforge3/envs/starform-alex/lib/python3.14/site-packages/numpy/lib/_nanfunctions_impl.py:1396: RuntimeWarning: All-NaN slice encountered
  return _nanquantile_unchecked(
/bsuscratch/alexanderemert/miniforge3/envs/starform-alex/lib/python3.14/site-packages/numpy/lib/_nanfunctions_impl.py:1215: RuntimeWarning: All-NaN slice encountered
  return fnb._ureduce(a, func=_nanmedian, keepdims=keepdims,
/bsuscratch/alexanderemert/miniforge3/envs/starform-alex/lib/python3.14/site-packages/numpy/lib/_nanfunctions_impl.py:1396: RuntimeWarning: All-NaN slice encountered
  return _nanquantile_unchecked(
/bsuscratch/alexanderemert/miniforge3/envs/starform-alex/lib/python3.14/site-packages/numpy/lib/_nanfunctions_impl.py:1215: RuntimeWarning: All-NaN slice encountered
  return fnb._ureduce(a, func=_nanmedian, keepdims=keepdims,
/bsuscratch/alexanderemert/miniforge3/envs/starform-alex/lib/python3.14/site-packages/numpy/lib/_nanfunctions_impl.py:1396: RuntimeWarning: All-NaN slice encountered
  return _nanquantile_unchecked(
/bsuscratch/alexanderemert/miniforge3/envs/starform-alex/lib/python3.14/site-packages/numpy/lib/_nanfunctions_impl.py:1215: RuntimeWarning: All-NaN slice encountered
  return fnb._ureduce(a, func=_nanmedian, keepdims=keepdims,
/bsuscratch/alexanderemert/miniforge3/envs/starform-alex/lib/python3.14/site-packages/numpy/lib/_nanfunctions_impl.py:1215: RuntimeWarning: All-NaN slice encountered
  return fnb._ureduce(a, func=_nanmedian, keepdims=keepdims,
/bsuscratch/alexanderemert/miniforge3/envs/starform-alex/lib/python3.14/site-packages/numpy/lib/_nanfunctions_impl.py:1396: RuntimeWarning: All-NaN slice encountered
  return _nanquantile_unchecked(
/bsuscratch/alexanderemert/miniforge3/envs/starform-alex/lib/python3.14/site-packages/numpy/lib/_nanfunctions_impl.py:1396: RuntimeWarning: All-NaN slice encountered
  return _nanquantile_unchecked(
[I 2026-07-20 13:43:21,920] Trial 338 finished with value: -0.1927292817537556 and parameters: {'error_threshold': 0.0, 'scalers': 'robust', 'ratios': 'norm_ratio', 'imputers': 'none', 'n_estimators': 100, 'learning_rate': 0.1877832317302411, 'max_depth': 4, 'min_child_weight': 6, 'subsample': 0.5, 'colsample_bytree': 0.6, 'colsample_bylevel': 0.5, 'reg_alpha': 36.468321128944595, 'reg_lambda': 0.000729732135746384, 'gamma': 6.787110078090801}. Best is trial 299 with value: -0.22091430699488926.
/bsuscratch/alexanderemert/miniforge3/envs/starform-alex/lib/python3.14/site-packages/numpy/lib/_nanfunctions_impl.py:1215: RuntimeWarning: All-NaN slice encountered
  return fnb._ureduce(a, func=_nanmedian, keepdims=keepdims,
/bsuscratch/alexanderemert/miniforge3/envs/starform-alex/lib/python3.14/site-packages/numpy/lib/_nanfunctions_impl.py:1396: RuntimeWarning: All-NaN slice encountered
  return _nanquantile_unchecked(
/bsuscratch/alexanderemert/miniforge3/envs/starform-alex/lib/python3.14/site-packages/numpy/lib/_nanfunctions_impl.py:1215: RuntimeWarning: All-NaN slice encountered
  return fnb._ureduce(a, func=_nanmedian, keepdims=keepdims,
/bsuscratch/alexanderemert/miniforge3/envs/starform-alex/lib/python3.14/site-packages/numpy/lib/_nanfunctions_impl.py:1396: RuntimeWarning: All-NaN slice encountered
  return _nanquantile_unchecked(
/bsuscratch/alexanderemert/miniforge3/envs/starform-alex/lib/python3.14/site-packages/numpy/lib/_nanfunctions_impl.py:1215: RuntimeWarning: All-NaN slice encountered
  return fnb._ureduce(a, func=_nanmedian, keepdims=keepdims,
/bsuscratch/alexanderemert/miniforge3/envs/starform-alex/lib/python3.14/site-packages/numpy/lib/_nanfunctions_impl.py:1396: RuntimeWarning: All-NaN slice encountered
  return _nanquantile_unchecked(
/bsuscratch/alexanderemert/miniforge3/envs/starform-alex/lib/python3.14/site-packages/numpy/lib/_nanfunctions_impl.py:1215: RuntimeWarning: All-NaN slice encountered
  return fnb._ureduce(a, func=_nanmedian, keepdims=keepdims,
/bsuscratch/alexanderemert/miniforge3/envs/starform-alex/lib/python3.14/site-packages/numpy/lib/_nanfunctions_impl.py:1396: RuntimeWarning: All-NaN slice encountered
  return _nanquantile_unchecked(
/bsuscratch/alexanderemert/miniforge3/envs/starform-alex/lib/python3.14/site-packages/numpy/lib/_nanfunctions_impl.py:1215: RuntimeWarning: All-NaN slice encountered
  return fnb._ureduce(a, func=_nanmedian, keepdims=keepdims,
/bsuscratch/alexanderemert/miniforge3/envs/starform-alex/lib/python3.14/site-packages/numpy/lib/_nanfunctions_impl.py:1396: RuntimeWarning: All-NaN slice encountered
  return _nanquantile_unchecked(
/bsuscratch/alexanderemert/miniforge3/envs/starform-alex/lib/python3.14/site-packages/numpy/lib/_nanfunctions_impl.py:1215: RuntimeWarning: All-NaN slice encountered
  return fnb._ureduce(a, func=_nanmedian, keepdims=keepdims,
/bsuscratch/alexanderemert/miniforge3/envs/starform-alex/lib/python3.14/site-packages/numpy/lib/_nanfunctions_impl.py:1396: RuntimeWarning: All-NaN slice encountered
  return _nanquantile_unchecked(
/bsuscratch/alexanderemert/miniforge3/envs/starform-alex/lib/python3.14/site-packages/numpy/lib/_nanfunctions_impl.py:1396: RuntimeWarning: All-NaN slice encountered
  return _nanquantile_unchecked(
/bsuscratch/alexanderemert/miniforge3/envs/starform-alex/lib/python3.14/site-packages/numpy/lib/_nanfunctions_impl.py:1215: RuntimeWarning: All-NaN slice encountered
  return fnb._ureduce(a, func=_nanmedian, keepdims=keepdims,
/bsuscratch/alexanderemert/miniforge3/envs/starform-alex/lib/python3.14/site-packages/numpy/lib/_nanfunctions_impl.py:1396: RuntimeWarning: All-NaN slice encountered
  return _nanquantile_unchecked(
/bsuscratch/alexanderemert/miniforge3/envs/starform-alex/lib/python3.14/site-packages/numpy/lib/_nanfunctions_impl.py:1215: RuntimeWarning: All-NaN slice encountered
  return fnb._ureduce(a, func=_nanmedian, keepdims=keepdims,
/bsuscratch/alexanderemert/miniforge3/envs/starform-alex/lib/python3.14/site-packages/numpy/lib/_nanfunctions_impl.py:1396: RuntimeWarning: All-NaN slice encountered
  return _nanquantile_unchecked(
/bsuscratch/alexanderemert/miniforge3/envs/starform-alex/lib/python3.14/site-packages/numpy/lib/_nanfunctions_impl.py:1215: RuntimeWarning: All-NaN slice encountered
  return fnb._ureduce(a, func=_nanmedian, keepdims=keepdims,
/bsuscratch/alexanderemert/miniforge3/envs/starform-alex/lib/python3.14/site-packages/numpy/lib/_nanfunctions_impl.py:1396: RuntimeWarning: All-NaN slice encountered
  return _nanquantile_unchecked(
/bsuscratch/alexanderemert/miniforge3/envs/starform-alex/lib/python3.14/site-packages/numpy/lib/_nanfunctions_impl.py:1215: RuntimeWarning: All-NaN slice encountered
  return fnb._ureduce(a, func=_nanmedian, keepdims=keepdims,
/bsuscratch/alexanderemert/miniforge3/envs/starform-alex/lib/python3.14/site-packages/numpy/lib/_nanfunctions_impl.py:1215: RuntimeWarning: All-NaN slice encountered
  return fnb._ureduce(a, func=_nanmedian, keepdims=keepdims,
/bsuscratch/alexanderemert/miniforge3/envs/starform-alex/lib/python3.14/site-packages/numpy/lib/_nanfunctions_impl.py:1396: RuntimeWarning: All-NaN slice encountered
  return _nanquantile_unchecked(
/bsuscratch/alexanderemert/miniforge3/envs/starform-alex/lib/python3.14/site-packages/numpy/lib/_nanfunctions_impl.py:1396: RuntimeWarning: All-NaN slice encountered
  return _nanquantile_unchecked(
/bsuscratch/alexanderemert/miniforge3/envs/starform-alex/lib/python3.14/site-packages/numpy/lib/_nanfunctions_impl.py:1215: RuntimeWarning: All-NaN slice encountered
  return fnb._ureduce(a, func=_nanmedian, keepdims=keepdims,
/bsuscratch/alexanderemert/miniforge3/envs/starform-alex/lib/python3.14/site-packages/numpy/lib/_nanfunctions_impl.py:1396: RuntimeWarning: All-NaN slice encountered
  return _nanquantile_unchecked(
/bsuscratch/alexanderemert/miniforge3/envs/starform-alex/lib/python3.14/site-packages/numpy/lib/_nanfunctions_impl.py:1215: RuntimeWarning: All-NaN slice encountered
  return fnb._ureduce(a, func=_nanmedian, keepdims=keepdims,
/bsuscratch/alexanderemert/miniforge3/envs/starform-alex/lib/python3.14/site-packages/numpy/lib/_nanfunctions_impl.py:1396: RuntimeWarning: All-NaN slice encountered
  return _nanquantile_unchecked(
/bsuscratch/alexanderemert/miniforge3/envs/starform-alex/lib/python3.14/site-packages/numpy/lib/_nanfunctions_impl.py:1215: RuntimeWarning: All-NaN slice encountered
  return fnb._ureduce(a, func=_nanmedian, keepdims=keepdims,
/bsuscratch/alexanderemert/miniforge3/envs/starform-alex/lib/python3.14/site-packages/numpy/lib/_nanfunctions_impl.py:1396: RuntimeWarning: All-NaN slice encountered
  return _nanquantile_unchecked(
