[I 2026-07-20 13:45:59,685] Trial 567 finished with value: -0.21084523348696893 and parameters: {'error_threshold': 2.75, 'scalers': 'robust', 'ratios': 'norm_ratio', 'imputers': 'none', 'n_estimators': 200, 'learning_rate': 0.23237130284486496, 'max_depth': 4, 'min_child_weight': 6, 'subsample': 0.5, 'colsample_bytree': 0.6, 'colsample_bylevel': 1.0, 'reg_alpha': 40.274791878614835, 'reg_lambda': 93.88637464247586, 'gamma': 33.96519474410179}. Best is trial 478 with value: -0.2209472207879047.
/bsuscratch/alexanderemert/miniforge3/envs/starform-alex/lib/python3.14/site-packages/numpy/lib/_nanfunctions_impl.py:1215: RuntimeWarning: All-NaN slice encountered
  return fnb._ureduce(a, func=_nanmedian, keepdims=keepdims,
/bsuscratch/alexanderemert/miniforge3/envs/starform-alex/lib/python3.14/site-packages/numpy/lib/_nanfunctions_impl.py:1396: RuntimeWarning: All-NaN slice encountered
  return _nanquantile_unchecked(
/bsuscratch/alexanderemert/miniforge3/envs/starform-alex/lib/python3.14/site-packages/numpy/lib/_nanfunctions_impl.py:1215: RuntimeWarning: All-NaN slice encountered
  return fnb._ureduce(a, func=_nanmedian, keepdims=keepdims,
/bsuscratch/alexanderemert/miniforge3/envs/starform-alex/lib/python3.14/site-packages/numpy/lib/_nanfunctions_impl.py:1396: RuntimeWarning: All-NaN slice encountered
  return _nanquantile_unchecked(
/bsuscratch/alexanderemert/miniforge3/envs/starform-alex/lib/python3.14/site-packages/numpy/lib/_nanfunctions_impl.py:1215: RuntimeWarning: All-NaN slice encountered
  return fnb._ureduce(a, func=_nanmedian, keepdims=keepdims,
/bsuscratch/alexanderemert/miniforge3/envs/starform-alex/lib/python3.14/site-packages/numpy/lib/_nanfunctions_impl.py:1396: RuntimeWarning: All-NaN slice encountered
  return _nanquantile_unchecked(
/bsuscratch/alexanderemert/miniforge3/envs/starform-alex/lib/python3.14/site-packages/numpy/lib/_nanfunctions_impl.py:1215: RuntimeWarning: All-NaN slice encountered
  return fnb._ureduce(a, func=_nanmedian, keepdims=keepdims,
/bsuscratch/alexanderemert/miniforge3/envs/starform-alex/lib/python3.14/site-packages/numpy/lib/_nanfunctions_impl.py:1396: RuntimeWarning: All-NaN slice encountered
  return _nanquantile_unchecked(
/bsuscratch/alexanderemert/miniforge3/envs/starform-alex/lib/python3.14/site-packages/numpy/lib/_nanfunctions_impl.py:1215: RuntimeWarning: All-NaN slice encountered
  return fnb._ureduce(a, func=_nanmedian, keepdims=keepdims,
/bsuscratch/alexanderemert/miniforge3/envs/starform-alex/lib/python3.14/site-packages/numpy/lib/_nanfunctions_impl.py:1396: RuntimeWarning: All-NaN slice encountered
  return _nanquantile_unchecked(
/bsuscratch/alexanderemert/miniforge3/envs/starform-alex/lib/python3.14/site-packages/numpy/lib/_nanfunctions_impl.py:1215: RuntimeWarning: All-NaN slice encountered
  return fnb._ureduce(a, func=_nanmedian, keepdims=keepdims,
/bsuscratch/alexanderemert/miniforge3/envs/starform-alex/lib/python3.14/site-packages/numpy/lib/_nanfunctions_impl.py:1396: RuntimeWarning: All-NaN slice encountered
  return _nanquantile_unchecked(
[I 2026-07-20 13:46:01,457] Trial 564 finished with value: -0.2021984481465026 and parameters: {'error_threshold': 5.0, 'scalers': 'robust', 'ratios': 'norm_ratio', 'imputers': 'none', 'n_estimators': 1550, 'learning_rate': 0.13707065304137953, 'max_depth': 4, 'min_child_weight': 6, 'subsample': 0.9, 'colsample_bytree': 0.6, 'colsample_bylevel': 0.8, 'reg_alpha': 97.187762411869, 'reg_lambda': 29.032802800018775, 'gamma': 19.192832701923905}. Best is trial 478 with value: -0.2209472207879047.
/bsuscratch/alexanderemert/miniforge3/envs/starform-alex/lib/python3.14/site-packages/numpy/lib/_nanfunctions_impl.py:1215: RuntimeWarning: All-NaN slice encountered
  return fnb._ureduce(a, func=_nanmedian, keepdims=keepdims,
/bsuscratch/alexanderemert/miniforge3/envs/starform-alex/lib/python3.14/site-packages/numpy/lib/_nanfunctions_impl.py:1396: RuntimeWarning: All-NaN slice encountered
  return _nanquantile_unchecked(
/bsuscratch/alexanderemert/miniforge3/envs/starform-alex/lib/python3.14/site-packages/numpy/lib/_nanfunctions_impl.py:1215: RuntimeWarning: All-NaN slice encountered
  return fnb._ureduce(a, func=_nanmedian, keepdims=keepdims,
/bsuscratch/alexanderemert/miniforge3/envs/starform-alex/lib/python3.14/site-packages/numpy/lib/_nanfunctions_impl.py:1396: RuntimeWarning: All-NaN slice encountered
  return _nanquantile_unchecked(
[I 2026-07-20 13:46:01,590] Trial 568 finished with value: -0.193706788947586 and parameters: {'error_threshold': 0.0, 'scalers': 'robust', 'ratios': 'norm_ratio', 'imputers': 'none', 'n_estimators': 200, 'learning_rate': 0.129786459408603, 'max_depth': 4, 'min_child_weight': 6, 'subsample': 0.5, 'colsample_bytree': 0.6, 'colsample_bylevel': 0.9, 'reg_alpha': 43.38878919076672, 'reg_lambda': 0.0009618093692286394, 'gamma': 6.996624051803082}. Best is trial 478 with value: -0.2209472207879047.
/bsuscratch/alexanderemert/miniforge3/envs/starform-alex/lib/python3.14/site-packages/numpy/lib/_nanfunctions_impl.py:1215: RuntimeWarning: All-NaN slice encountered
  return fnb._ureduce(a, func=_nanmedian, keepdims=keepdims,
/bsuscratch/alexanderemert/miniforge3/envs/starform-alex/lib/python3.14/site-packages/numpy/lib/_nanfunctions_impl.py:1396: RuntimeWarning: All-NaN slice encountered
  return _nanquantile_unchecked(
/bsuscratch/alexanderemert/miniforge3/envs/starform-alex/lib/python3.14/site-packages/numpy/lib/_nanfunctions_impl.py:1215: RuntimeWarning: All-NaN slice encountered
  return fnb._ureduce(a, func=_nanmedian, keepdims=keepdims,
/bsuscratch/alexanderemert/miniforge3/envs/starform-alex/lib/python3.14/site-packages/numpy/lib/_nanfunctions_impl.py:1396: RuntimeWarning: All-NaN slice encountered
  return _nanquantile_unchecked(
/bsuscratch/alexanderemert/miniforge3/envs/starform-alex/lib/python3.14/site-packages/numpy/lib/_nanfunctions_impl.py:1215: RuntimeWarning: All-NaN slice encountered
  return fnb._ureduce(a, func=_nanmedian, keepdims=keepdims,
/bsuscratch/alexanderemert/miniforge3/envs/starform-alex/lib/python3.14/site-packages/numpy/lib/_nanfunctions_impl.py:1396: RuntimeWarning: All-NaN slice encountered
  return _nanquantile_unchecked(
/bsuscratch/alexanderemert/miniforge3/envs/starform-alex/lib/python3.14/site-packages/numpy/lib/_nanfunctions_impl.py:1215: RuntimeWarning: All-NaN slice encountered
  return fnb._ureduce(a, func=_nanmedian, keepdims=keepdims,
/bsuscratch/alexanderemert/miniforge3/envs/starform-alex/lib/python3.14/site-packages/numpy/lib/_nanfunctions_impl.py:1396: RuntimeWarning: All-NaN slice encountered
  return _nanquantile_unchecked(
[I 2026-07-20 13:46:02,476] Trial 565 finished with value: -0.2102816547801585 and parameters: {'error_threshold': 0.0, 'scalers': 'robust', 'ratios': 'norm_ratio', 'imputers': 'none', 'n_estimators': 1650, 'learning_rate': 0.13129906225024507, 'max_depth': 4, 'min_child_weight': 6, 'subsample': 0.5, 'colsample_bytree': 0.6, 'colsample_bylevel': 0.8, 'reg_alpha': 95.61694111068341, 'reg_lambda': 16.486196405698102, 'gamma': 8.005657857588075}. Best is trial 478 with value: -0.2209472207879047.
[I 2026-07-20 13:46:05,801] Trial 569 finished with value: -0.18738016243450006 and parameters: {'error_threshold': 3.75, 'scalers': 'robust', 'ratios': 'norm_ratio', 'imputers': 'none', 'n_estimators': 1700, 'learning_rate': 0.2268673292911877, 'max_depth': 4, 'min_child_weight': 6, 'subsample': 0.5, 'colsample_bytree': 0.6, 'colsample_bylevel': 0.9, 'reg_alpha': 40.302456212892544, 'reg_lambda': 0.0007498044018581365, 'gamma': 5.448428425262064}. Best is trial 478 with value: -0.2209472207879047.
[I 2026-07-20 13:46:09,081] Trial 570 finished with value: -0.1891435028794314 and parameters: {'error_threshold': 3.0, 'scalers': 'robust', 'ratios': 'norm_ratio', 'imputers': 'none', 'n_estimators': 1550, 'learning_rate': 0.25843096467993537, 'max_depth': 4, 'min_child_weight': 6, 'subsample': 0.5, 'colsample_bytree': 0.6, 'colsample_bylevel': 1.0, 'reg_alpha': 41.628763485016876, 'reg_lambda': 0.0013329001359140948, 'gamma': 5.753125991268051}. Best is trial 478 with value: -0.2209472207879047.
[I 2026-07-20 13:46:10,977] Trial 571 finished with value: -0.18949561793286493 and parameters: {'error_threshold': 4.75, 'scalers': 'robust', 'ratios': 'norm_ratio', 'imputers': 'none', 'n_estimators': 200, 'learning_rate': 0.22115239305130416, 'max_depth': 4, 'min_child_weight': 6, 'subsample': 0.5, 'colsample_bytree': 0.6, 'colsample_bylevel': 1.0, 'reg_alpha': 36.8208906995123, 'reg_lambda': 66.4440928856593, 'gamma': 5.837450587133348}. Best is trial 478 with value: -0.2209472207879047.
[I 2026-07-20 13:46:15,993] Trial 572 finished with value: -0.20912309582487879 and parameters: {'error_threshold': 4.25, 'scalers': 'robust', 'ratios': 'norm_ratio', 'imputers': 'none', 'n_estimators': 1700, 'learning_rate': 0.13791956778498518, 'max_depth': 4, 'min_child_weight': 6, 'subsample': 0.5, 'colsample_bytree': 0.6, 'colsample_bylevel': 1.0, 'reg_alpha': 38.09344634688108, 'reg_lambda': 5.7487241967272755, 'gamma': 34.08633995713155}. Best is trial 478 with value: -0.2209472207879047.
[I 2026-07-20 13:46:16,864] Trial 573 finished with value: -0.19412827647101727 and parameters: {'error_threshold': 0.5, 'scalers': 'robust', 'ratios': 'norm_ratio', 'imputers': 'none', 'n_estimators': 1850, 'learning_rate': 0.14295405965907937, 'max_depth': 4, 'min_child_weight': 6, 'subsample': 0.5, 'colsample_bytree': 0.6, 'colsample_bylevel': 0.6, 'reg_alpha': 40.89434902391077, 'reg_lambda': 0.001440515908505063, 'gamma': 10.675634752448175}. Best is trial 478 with value: -0.2209472207879047.
[I 2026-07-20 13:46:19,208] Trial 574 finished with value: -0.1944120797984673 and parameters: {'error_threshold': 3.75, 'scalers': 'robust', 'ratios': 'norm_ratio', 'imputers': 'none', 'n_estimators': 1750, 'learning_rate': 0.21802032410036667, 'max_depth': 4, 'min_child_weight': 6, 'subsample': 0.5, 'colsample_bytree': 0.6, 'colsample_bylevel': 0.9, 'reg_alpha': 43.283010441355145, 'reg_lambda': 4.65865801983992, 'gamma': 10.049914419683555}. Best is trial 478 with value: -0.2209472207879047.
[I 2026-07-20 13:46:20,025] Trial 575 finished with value: -0.2080068922989399 and parameters: {'error_threshold': 2.75, 'scalers': 'robust', 'ratios': 'norm_ratio', 'imputers': 'none', 'n_estimators': 1650, 'learning_rate': 0.30802370540336516, 'max_depth': 4, 'min_child_weight': 6, 'subsample': 0.5, 'colsample_bytree': 0.5, 'colsample_bylevel': 1.0, 'reg_alpha': 57.11861664401594, 'reg_lambda': 5.536789977144364, 'gamma': 35.77333187709715}. Best is trial 478 with value: -0.2209472207879047.
[I 2026-07-20 13:46:20,766] Trial 576 finished with value: -0.2189793575884986 and parameters: {'error_threshold': 2.75, 'scalers': 'robust', 'ratios': 'norm_ratio', 'imputers': 'none', 'n_estimators': 1700, 'learning_rate': 0.29193165872041626, 'max_depth': 4, 'min_child_weight': 6, 'subsample': 0.5, 'colsample_bytree': 0.5, 'colsample_bylevel': 0.6, 'reg_alpha': 61.19338417882901, 'reg_lambda': 0.0014168435104523105, 'gamma': 35.43873561801549}. Best is trial 478 with value: -0.2209472207879047.
[I 2026-07-20 13:46:26,758] Trial 577 finished with value: -0.21937157363191373 and parameters: {'error_threshold': 2.0, 'scalers': 'robust', 'ratios': 'norm_ratio', 'imputers': 'none', 'n_estimators': 1650, 'learning_rate': 0.2575517408674529, 'max_depth': 4, 'min_child_weight': 6, 'subsample': 0.5, 'colsample_bytree': 0.5, 'colsample_bylevel': 0.6, 'reg_alpha': 57.65355583405012, 'reg_lambda': 5.4032377517397405, 'gamma': 36.207964251505466}. Best is trial 478 with value: -0.2209472207879047.
[I 2026-07-20 13:46:28,840] Trial 578 finished with value: -0.2134928568950627 and parameters: {'error_threshold': 2.25, 'scalers': 'robust', 'ratios': 'norm_ratio', 'imputers': 'none', 'n_estimators': 1900, 'learning_rate': 0.1636289259273551, 'max_depth': 4, 'min_child_weight': 6, 'subsample': 0.5, 'colsample_bytree': 0.5, 'colsample_bylevel': 1.0, 'reg_alpha': 58.51061384684841, 'reg_lambda': 0.0017733906561757486, 'gamma': 35.361646361712054}. Best is trial 478 with value: -0.2209472207879047.
[I 2026-07-20 13:46:30,361] Trial 579 finished with value: -0.2140482256254704 and parameters: {'error_threshold': 2.5, 'scalers': 'robust', 'ratios': 'norm_ratio', 'imputers': 'none', 'n_estimators': 1650, 'learning_rate': 0.15271405429110235, 'max_depth': 4, 'min_child_weight': 6, 'subsample': 0.5, 'colsample_bytree': 0.5, 'colsample_bylevel': 0.5, 'reg_alpha': 56.223414505823, 'reg_lambda': 3.968593270743383, 'gamma': 31.983457300595866}. Best is trial 478 with value: -0.2209472207879047.
[I 2026-07-20 13:46:33,116] Trial 583 finished with value: -0.2208409713089037 and parameters: {'error_threshold': 0.25, 'scalers': 'robust', 'ratios': 'norm_ratio', 'imputers': 'none', 'n_estimators': 150, 'learning_rate': 0.17259576747220892, 'max_depth': 4, 'min_child_weight': 6, 'subsample': 0.5, 'colsample_bytree': 0.6, 'colsample_bylevel': 0.6, 'reg_alpha': 62.54878714621601, 'reg_lambda': 0.001861587366319854, 'gamma': 44.58564228834295}. Best is trial 478 with value: -0.2209472207879047.
[I 2026-07-20 13:46:33,837] Trial 580 finished with value: -0.22086750958919332 and parameters: {'error_threshold': 0.5, 'scalers': 'robust', 'ratios': 'norm_ratio', 'imputers': 'none', 'n_estimators': 1600, 'learning_rate': 0.1609633351051165, 'max_depth': 4, 'min_child_weight': 6, 'subsample': 0.5, 'colsample_bytree': 0.6, 'colsample_bylevel': 0.6, 'reg_alpha': 62.47589688511685, 'reg_lambda': 0.0015900414704567683, 'gamma': 47.042848447658315}. Best is trial 478 with value: -0.2209472207879047.
[I 2026-07-20 13:46:35,328] Trial 581 finished with value: -0.2208256137367414 and parameters: {'error_threshold': 2.5, 'scalers': 'robust', 'ratios': 'norm_ratio', 'imputers': 'none', 'n_estimators': 1600, 'learning_rate': 0.304118914453186, 'max_depth': 4, 'min_child_weight': 6, 'subsample': 0.5, 'colsample_bytree': 0.5, 'colsample_bylevel': 0.6, 'reg_alpha': 60.17574930000435, 'reg_lambda': 3.2628760343166574, 'gamma': 48.554419477844085}. Best is trial 478 with value: -0.2209472207879047.
[I 2026-07-20 13:46:37,450] Trial 582 finished with value: -0.22090701874239335 and parameters: {'error_threshold': 3.5, 'scalers': 'robust', 'ratios': 'norm_ratio', 'imputers': 'none', 'n_estimators': 2850, 'learning_rate': 0.1644112622456633, 'max_depth': 4, 'min_child_weight': 6, 'subsample': 0.5, 'colsample_bytree': 0.5, 'colsample_bylevel': 0.6, 'reg_alpha': 59.45098554427625, 'reg_lambda': 0.001928582589948872, 'gamma': 45.46720947761608}. Best is trial 478 with value: -0.2209472207879047.
[I 2026-07-20 13:46:38,650] Trial 584 finished with value: -0.17898619586397488 and parameters: {'error_threshold': 2.25, 'scalers': 'robust', 'ratios': 'norm_ratio', 'imputers': 'none', 'n_estimators': 2550, 'learning_rate': 0.1672218393751594, 'max_depth': 4, 'min_child_weight': 6, 'subsample': 0.5, 'colsample_bytree': 0.6, 'colsample_bylevel': 0.5, 'reg_alpha': 64.03750807935889, 'reg_lambda': 0.0021072807546061046, 'gamma': 0.036068271264681304}. Best is trial 478 with value: -0.2209472207879047.
[I 2026-07-20 13:46:41,422] Trial 585 finished with value: -0.22084100500810747 and parameters: {'error_threshold': 0.25, 'scalers': 'robust', 'ratios': 'norm_ratio', 'imputers': 'none', 'n_estimators': 150, 'learning_rate': 0.17315673374979235, 'max_depth': 4, 'min_child_weight': 6, 'subsample': 0.5, 'colsample_bytree': 0.6, 'colsample_bylevel': 0.6, 'reg_alpha': 64.92694478200008, 'reg_lambda': 0.0025185722327238816, 'gamma': 53.105710571632024}. Best is trial 478 with value: -0.2209472207879047.
[I 2026-07-20 13:46:46,602] Trial 586 finished with value: -0.22086805900633952 and parameters: {'error_threshold': 0.25, 'scalers': 'robust', 'ratios': 'norm_ratio', 'imputers': 'none', 'n_estimators': 1600, 'learning_rate': 0.15933532415448326, 'max_depth': 4, 'min_child_weight': 6, 'subsample': 0.5, 'colsample_bytree': 0.6, 'colsample_bylevel': 0.6, 'reg_alpha': 69.41505003503947, 'reg_lambda': 0.00037394903062686725, 'gamma': 51.535774446208876}. Best is trial 478 with value: -0.2209472207879047.
[I 2026-07-20 13:46:47,361] Trial 588 finished with value: -0.18615637317268974 and parameters: {'error_threshold': 0.25, 'scalers': 'robust', 'ratios': 'norm_ratio', 'imputers': 'none', 'n_estimators': 100, 'learning_rate': 0.13167917367694723, 'max_depth': 4, 'min_child_weight': 6, 'subsample': 0.5, 'colsample_bytree': 0.6, 'colsample_bylevel': 0.6, 'reg_alpha': 71.04740510939457, 'reg_lambda': 0.002834522791150539, 'gamma': 0.04034044216841044}. Best is trial 478 with value: -0.2209472207879047.
[I 2026-07-20 13:46:48,053] Trial 587 finished with value: -0.22086464673335957 and parameters: {'error_threshold': 0.25, 'scalers': 'robust', 'ratios': 'norm_ratio', 'imputers': 'none', 'n_estimators': 1600, 'learning_rate': 0.16966585475120025, 'max_depth': 4, 'min_child_weight': 6, 'subsample': 0.5, 'colsample_bytree': 0.6, 'colsample_bylevel': 0.5, 'reg_alpha': 67.22411424661831, 'reg_lambda': 0.0023397716087892925, 'gamma': 52.90305182539922}. Best is trial 478 with value: -0.2209472207879047.
[I 2026-07-20 13:46:52,929] Trial 589 finished with value: -0.2115195099196353 and parameters: {'error_threshold': 0.25, 'scalers': 'robust', 'ratios': 'norm_ratio', 'imputers': 'none', 'n_estimators': 2500, 'learning_rate': 0.1143963163041043, 'max_depth': 4, 'min_child_weight': 6, 'subsample': 0.5, 'colsample_bytree': 0.6, 'colsample_bylevel': 0.6, 'reg_alpha': 64.30430263516229, 'reg_lambda': 0.0004156274048135591, 'gamma': 22.696516380466534}. Best is trial 478 with value: -0.2209472207879047.
[I 2026-07-20 13:46:54,154] Trial 590 finished with value: -0.21493805289415113 and parameters: {'error_threshold': 0.25, 'scalers': 'robust', 'ratios': 'norm_ratio', 'imputers': 'none', 'n_estimators': 1450, 'learning_rate': 0.12390818093801817, 'max_depth': 4, 'min_child_weight': 6, 'subsample': 0.5, 'colsample_bytree': 0.6, 'colsample_bylevel': 0.5, 'reg_alpha': 74.1754432882145, 'reg_lambda': 0.0007016621775978544, 'gamma': 22.987355059362727}. Best is trial 478 with value: -0.2209472207879047.
[I 2026-07-20 13:46:56,853] Trial 591 finished with value: -0.22077487019042621 and parameters: {'error_threshold': 3.5, 'scalers': 'robust', 'ratios': 'norm_ratio', 'imputers': 'none', 'n_estimators': 2950, 'learning_rate': 0.19843988597628026, 'max_depth': 4, 'min_child_weight': 6, 'subsample': 0.5, 'colsample_bytree': 0.5, 'colsample_bylevel': 0.6, 'reg_alpha': 71.27956268616008, 'reg_lambda': 0.0006682260532929205, 'gamma': 72.87065074419431}. Best is trial 478 with value: -0.2209472207879047.
[I 2026-07-20 13:46:57,950] Trial 592 finished with value: -0.22093427308271565 and parameters: {'error_threshold': 0.25, 'scalers': 'robust', 'ratios': 'norm_ratio', 'imputers': 'none', 'n_estimators': 2400, 'learning_rate': 0.19782280608773342, 'max_depth': 4, 'min_child_weight': 6, 'subsample': 0.5, 'colsample_bytree': 0.5, 'colsample_bylevel': 0.6, 'reg_alpha': 72.72908296256438, 'reg_lambda': 0.0007061257749421312, 'gamma': 74.37101565915648}. Best is trial 478 with value: -0.2209472207879047.
[I 2026-07-20 13:47:02,321] Trial 593 finished with value: -0.22000240402562218 and parameters: {'error_threshold': 3.5, 'scalers': 'robust', 'ratios': 'norm_ratio', 'imputers': 'none', 'n_estimators': 2650, 'learning_rate': 0.1297746457913912, 'max_depth': 4, 'min_child_weight': 6, 'subsample': 0.5, 'colsample_bytree': 0.5, 'colsample_bylevel': 0.6, 'reg_alpha': 14.789122723554614, 'reg_lambda': 0.0007632660098998886, 'gamma': 77.17373629973851}. Best is trial 478 with value: -0.2209472207879047.
[I 2026-07-20 13:47:02,497] Trial 595 finished with value: -0.20074854100986875 and parameters: {'error_threshold': 3.5, 'scalers': 'robust', 'ratios': 'norm_ratio', 'imputers': 'none', 'n_estimators': 100, 'learning_rate': 0.19937026138850428, 'max_depth': 4, 'min_child_weight': 6, 'subsample': 0.5, 'colsample_bytree': 0.6, 'colsample_bylevel': 0.6, 'reg_alpha': 29.57431255522775, 'reg_lambda': 0.0007350546541321621, 'gamma': 23.25006170535533}. Best is trial 478 with value: -0.2209472207879047.
[I 2026-07-20 13:47:02,654] Trial 596 finished with value: -0.21125395088144946 and parameters: {'error_threshold': 3.25, 'scalers': 'robust', 'ratios': 'norm_ratio', 'imputers': 'none', 'n_estimators': 100, 'learning_rate': 0.20791027183083996, 'max_depth': 4, 'min_child_weight': 6, 'subsample': 0.8, 'colsample_bytree': 0.5, 'colsample_bylevel': 0.5, 'reg_alpha': 28.263349772721693, 'reg_lambda': 0.0007682037751247612, 'gamma': 75.67498323266024}. Best is trial 478 with value: -0.2209472207879047.
[I 2026-07-20 13:47:03,172] Trial 594 finished with value: -0.19570716452202697 and parameters: {'error_threshold': 3.5, 'scalers': 'robust', 'ratios': 'norm_ratio', 'imputers': 'none', 'n_estimators': 1150, 'learning_rate': 0.12718496234393542, 'max_depth': 4, 'min_child_weight': 6, 'subsample': 0.5, 'colsample_bytree': 0.5, 'colsample_bylevel': 0.6, 'reg_alpha': 35.62509699176679, 'reg_lambda': 0.0006227295328164559, 'gamma': 14.732067901546277}. Best is trial 478 with value: -0.2209472207879047.
[I 2026-07-20 13:47:07,350] Trial 599 finished with value: -0.17409366011235164 and parameters: {'error_threshold': 3.0, 'scalers': 'robust', 'ratios': 'norm_ratio', 'imputers': 'none', 'n_estimators': 100, 'learning_rate': 0.20544558700271326, 'max_depth': 4, 'min_child_weight': 6, 'subsample': 0.5, 'colsample_bytree': 0.5, 'colsample_bylevel': 0.5, 'reg_alpha': 32.614733181629916, 'reg_lambda': 0.0013989597898075672, 'gamma': 1.2456834433534733e-05}. Best is trial 478 with value: -0.2209472207879047.
