[I 2026-07-21 10:23:47,689] Trial 427 finished with value: -1.0261794303669616 and parameters: {'error_threshold': 1.1, 'scalers': 'robust', 'ratios': 'norm_ratio', 'imputers': 'median', 'n_estimators': 2450, 'learning_rate': 0.004078871144326935, 'max_depth': 3, 'min_child_weight': 4, 'subsample': 0.6, 'colsample_bytree': 0.5, 'colsample_bylevel': 0.9, 'reg_alpha': 0.00013814900254181169, 'reg_lambda': 3.360963116051651e-05, 'gamma': 9.146647759206705e-06}. Best is trial 420 with value: -1.0247060900564386.
/bsuhome/alexanderemert/Research/Star-Formation-Research-Project-2026/pipeline/scripts/optuna/final_preds_and_models/optuna_search_mult_quant_reg.py:161: UserWarning: The distribution is specified by [0.1, 5] and step=0.25, but the range is not divisible by `step`. It will be replaced with [0.1, 4.85].
  error_threshold = trial.suggest_float("error_threshold", 0.1, 5, step=0.25)
[I 2026-07-21 10:23:49,579] Trial 428 finished with value: -1.0344665445341603 and parameters: {'error_threshold': 1.1, 'scalers': 'robust', 'ratios': 'norm_ratio', 'imputers': 'median', 'n_estimators': 2800, 'learning_rate': 0.005138078681898603, 'max_depth': 3, 'min_child_weight': 4, 'subsample': 0.6, 'colsample_bytree': 0.5, 'colsample_bylevel': 0.9, 'reg_alpha': 11.871267436206093, 'reg_lambda': 0.00028041216915386974, 'gamma': 0.00023436376021338862}. Best is trial 420 with value: -1.0247060900564386.
/bsuhome/alexanderemert/Research/Star-Formation-Research-Project-2026/pipeline/scripts/optuna/final_preds_and_models/optuna_search_mult_quant_reg.py:161: UserWarning: The distribution is specified by [0.1, 5] and step=0.25, but the range is not divisible by `step`. It will be replaced with [0.1, 4.85].
  error_threshold = trial.suggest_float("error_threshold", 0.1, 5, step=0.25)
[I 2026-07-21 10:23:49,963] Trial 429 finished with value: -1.072253036124468 and parameters: {'error_threshold': 1.1, 'scalers': 'robust', 'ratios': 'norm_ratio', 'imputers': 'median', 'n_estimators': 600, 'learning_rate': 0.006944982434355436, 'max_depth': 3, 'min_child_weight': 4, 'subsample': 0.6, 'colsample_bytree': 0.5, 'colsample_bylevel': 0.9, 'reg_alpha': 0.00013902193432564956, 'reg_lambda': 0.000340437215237706, 'gamma': 0.3072084115131453}. Best is trial 420 with value: -1.0247060900564386.
/bsuhome/alexanderemert/Research/Star-Formation-Research-Project-2026/pipeline/scripts/optuna/final_preds_and_models/optuna_search_mult_quant_reg.py:161: UserWarning: The distribution is specified by [0.1, 5] and step=0.25, but the range is not divisible by `step`. It will be replaced with [0.1, 4.85].
  error_threshold = trial.suggest_float("error_threshold", 0.1, 5, step=0.25)
[I 2026-07-21 10:23:51,664] Trial 430 finished with value: -1.0266618757750094 and parameters: {'error_threshold': 1.1, 'scalers': 'robust', 'ratios': 'norm_ratio', 'imputers': 'median', 'n_estimators': 2800, 'learning_rate': 0.006783630783776564, 'max_depth': 3, 'min_child_weight': 4, 'subsample': 0.6, 'colsample_bytree': 0.5, 'colsample_bylevel': 0.9, 'reg_alpha': 0.00037321905989860067, 'reg_lambda': 0.031126309060154324, 'gamma': 0.8388764524949388}. Best is trial 420 with value: -1.0247060900564386.
/bsuhome/alexanderemert/Research/Star-Formation-Research-Project-2026/pipeline/scripts/optuna/final_preds_and_models/optuna_search_mult_quant_reg.py:161: UserWarning: The distribution is specified by [0.1, 5] and step=0.25, but the range is not divisible by `step`. It will be replaced with [0.1, 4.85].
  error_threshold = trial.suggest_float("error_threshold", 0.1, 5, step=0.25)
[I 2026-07-21 10:23:53,410] Trial 432 finished with value: -1.0270375509281748 and parameters: {'error_threshold': 1.1, 'scalers': 'robust', 'ratios': 'norm_ratio', 'imputers': 'median', 'n_estimators': 2800, 'learning_rate': 0.006805177606890702, 'max_depth': 3, 'min_child_weight': 4, 'subsample': 0.6, 'colsample_bytree': 0.5, 'colsample_bylevel': 0.9, 'reg_alpha': 0.0004153285156042252, 'reg_lambda': 0.0002798419190384187, 'gamma': 0.731724085052627}. Best is trial 420 with value: -1.0247060900564386.
/bsuhome/alexanderemert/Research/Star-Formation-Research-Project-2026/pipeline/scripts/optuna/final_preds_and_models/optuna_search_mult_quant_reg.py:161: UserWarning: The distribution is specified by [0.1, 5] and step=0.25, but the range is not divisible by `step`. It will be replaced with [0.1, 4.85].
  error_threshold = trial.suggest_float("error_threshold", 0.1, 5, step=0.25)
[I 2026-07-21 10:23:55,190] Trial 433 finished with value: -1.027312773137197 and parameters: {'error_threshold': 1.1, 'scalers': 'robust', 'ratios': 'norm_ratio', 'imputers': 'median', 'n_estimators': 2850, 'learning_rate': 0.006943724505215705, 'max_depth': 3, 'min_child_weight': 4, 'subsample': 0.6, 'colsample_bytree': 0.5, 'colsample_bylevel': 0.9, 'reg_alpha': 0.0006732150128723353, 'reg_lambda': 0.0004157398845984057, 'gamma': 0.0002548179816120417}. Best is trial 420 with value: -1.0247060900564386.
/bsuhome/alexanderemert/Research/Star-Formation-Research-Project-2026/pipeline/scripts/optuna/final_preds_and_models/optuna_search_mult_quant_reg.py:161: UserWarning: The distribution is specified by [0.1, 5] and step=0.25, but the range is not divisible by `step`. It will be replaced with [0.1, 4.85].
  error_threshold = trial.suggest_float("error_threshold", 0.1, 5, step=0.25)
[I 2026-07-21 10:23:57,061] Trial 434 finished with value: -1.0352558049950524 and parameters: {'error_threshold': 1.1, 'scalers': 'robust', 'ratios': 'norm_ratio', 'imputers': 'median', 'n_estimators': 2850, 'learning_rate': 0.0068001077692699495, 'max_depth': 3, 'min_child_weight': 4, 'subsample': 0.6, 'colsample_bytree': 0.5, 'colsample_bylevel': 0.9, 'reg_alpha': 13.844711162644632, 'reg_lambda': 0.0005666671059141047, 'gamma': 0.3680714703745436}. Best is trial 420 with value: -1.0247060900564386.
/bsuhome/alexanderemert/Research/Star-Formation-Research-Project-2026/pipeline/scripts/optuna/final_preds_and_models/optuna_search_mult_quant_reg.py:161: UserWarning: The distribution is specified by [0.1, 5] and step=0.25, but the range is not divisible by `step`. It will be replaced with [0.1, 4.85].
  error_threshold = trial.suggest_float("error_threshold", 0.1, 5, step=0.25)
[I 2026-07-21 10:24:02,599] Trial 431 finished with value: -1.0568170574244111 and parameters: {'error_threshold': 1.1, 'scalers': 'robust', 'ratios': 'norm_ratio', 'imputers': 'median', 'n_estimators': 2800, 'learning_rate': 0.006848287271683007, 'max_depth': 6, 'min_child_weight': 4, 'subsample': 0.6, 'colsample_bytree': 0.5, 'colsample_bylevel': 0.9, 'reg_alpha': 0.0006262560051365904, 'reg_lambda': 0.010777557168015348, 'gamma': 0.0006923196189435011}. Best is trial 420 with value: -1.0247060900564386.
/bsuhome/alexanderemert/Research/Star-Formation-Research-Project-2026/pipeline/scripts/optuna/final_preds_and_models/optuna_search_mult_quant_reg.py:161: UserWarning: The distribution is specified by [0.1, 5] and step=0.25, but the range is not divisible by `step`. It will be replaced with [0.1, 4.85].
  error_threshold = trial.suggest_float("error_threshold", 0.1, 5, step=0.25)
[I 2026-07-21 10:24:05,245] Trial 437 finished with value: -1.0339652726877029 and parameters: {'error_threshold': 1.1, 'scalers': 'robust', 'ratios': 'norm_ratio', 'imputers': 'median', 'n_estimators': 2850, 'learning_rate': 0.006423993709458667, 'max_depth': 4, 'min_child_weight': 4, 'subsample': 0.6, 'colsample_bytree': 0.5, 'colsample_bylevel': 0.9, 'reg_alpha': 0.0007494666667219405, 'reg_lambda': 0.0011664333575808568, 'gamma': 1.1864330149128406}. Best is trial 420 with value: -1.0247060900564386.
/bsuhome/alexanderemert/Research/Star-Formation-Research-Project-2026/pipeline/scripts/optuna/final_preds_and_models/optuna_search_mult_quant_reg.py:161: UserWarning: The distribution is specified by [0.1, 5] and step=0.25, but the range is not divisible by `step`. It will be replaced with [0.1, 4.85].
  error_threshold = trial.suggest_float("error_threshold", 0.1, 5, step=0.25)
[I 2026-07-21 10:24:08,315] Trial 436 finished with value: -1.4647189040045117 and parameters: {'error_threshold': 1.1, 'scalers': 'robust', 'ratios': 'norm_ratio', 'imputers': 'median', 'n_estimators': 2850, 'learning_rate': 0.00033038294622212414, 'max_depth': 4, 'min_child_weight': 4, 'subsample': 0.6, 'colsample_bytree': 0.5, 'colsample_bylevel': 0.9, 'reg_alpha': 0.0006680847888983359, 'reg_lambda': 0.03737004695928067, 'gamma': 0.002924108590414359}. Best is trial 420 with value: -1.0247060900564386.
/bsuhome/alexanderemert/Research/Star-Formation-Research-Project-2026/pipeline/scripts/optuna/final_preds_and_models/optuna_search_mult_quant_reg.py:161: UserWarning: The distribution is specified by [0.1, 5] and step=0.25, but the range is not divisible by `step`. It will be replaced with [0.1, 4.85].
  error_threshold = trial.suggest_float("error_threshold", 0.1, 5, step=0.25)
[I 2026-07-21 10:24:13,923] Trial 435 finished with value: -1.0599533899434723 and parameters: {'error_threshold': 1.1, 'scalers': 'robust', 'ratios': 'norm_ratio', 'imputers': 'median', 'n_estimators': 2850, 'learning_rate': 0.007097702931195472, 'max_depth': 6, 'min_child_weight': 4, 'subsample': 0.6, 'colsample_bytree': 0.5, 'colsample_bylevel': 0.9, 'reg_alpha': 0.0007489135510323661, 'reg_lambda': 0.04060975017657845, 'gamma': 0.0002613313283411152}. Best is trial 420 with value: -1.0247060900564386.
/bsuhome/alexanderemert/Research/Star-Formation-Research-Project-2026/pipeline/scripts/optuna/final_preds_and_models/optuna_search_mult_quant_reg.py:161: UserWarning: The distribution is specified by [0.1, 5] and step=0.25, but the range is not divisible by `step`. It will be replaced with [0.1, 4.85].
  error_threshold = trial.suggest_float("error_threshold", 0.1, 5, step=0.25)
[I 2026-07-21 10:24:15,894] Trial 438 finished with value: -1.5106818478291653 and parameters: {'error_threshold': 1.1, 'scalers': 'robust', 'ratios': 'norm_ratio', 'imputers': 'median', 'n_estimators': 2850, 'learning_rate': 0.00031845372623617364, 'max_depth': 3, 'min_child_weight': 4, 'subsample': 0.6, 'colsample_bytree': 0.5, 'colsample_bylevel': 0.9, 'reg_alpha': 0.0006808134004698872, 'reg_lambda': 0.014348759338199173, 'gamma': 1.531013706171094}. Best is trial 420 with value: -1.0247060900564386.
/bsuhome/alexanderemert/Research/Star-Formation-Research-Project-2026/pipeline/scripts/optuna/final_preds_and_models/optuna_search_mult_quant_reg.py:161: UserWarning: The distribution is specified by [0.1, 5] and step=0.25, but the range is not divisible by `step`. It will be replaced with [0.1, 4.85].
  error_threshold = trial.suggest_float("error_threshold", 0.1, 5, step=0.25)
[I 2026-07-21 10:24:18,580] Trial 439 finished with value: -1.0319919547689052 and parameters: {'error_threshold': 0.85, 'scalers': 'robust', 'ratios': 'norm_ratio', 'imputers': 'median', 'n_estimators': 2850, 'learning_rate': 0.005649341487511726, 'max_depth': 4, 'min_child_weight': 4, 'subsample': 0.6, 'colsample_bytree': 0.5, 'colsample_bylevel': 0.9, 'reg_alpha': 0.0007283142436033123, 'reg_lambda': 0.0001221805386606455, 'gamma': 0.0007285546541064376}. Best is trial 420 with value: -1.0247060900564386.
/bsuhome/alexanderemert/Research/Star-Formation-Research-Project-2026/pipeline/scripts/optuna/final_preds_and_models/optuna_search_mult_quant_reg.py:161: UserWarning: The distribution is specified by [0.1, 5] and step=0.25, but the range is not divisible by `step`. It will be replaced with [0.1, 4.85].
  error_threshold = trial.suggest_float("error_threshold", 0.1, 5, step=0.25)
[I 2026-07-21 10:24:19,823] Trial 440 finished with value: -1.044034973083532 and parameters: {'error_threshold': 0.85, 'scalers': 'robust', 'ratios': 'norm_ratio', 'imputers': 'median', 'n_estimators': 1200, 'learning_rate': 0.004140347219879178, 'max_depth': 4, 'min_child_weight': 4, 'subsample': 0.6, 'colsample_bytree': 0.5, 'colsample_bylevel': 0.9, 'reg_alpha': 0.0004946385575183377, 'reg_lambda': 0.012545272895895547, 'gamma': 2.7912054580469626e-06}. Best is trial 420 with value: -1.0247060900564386.
/bsuhome/alexanderemert/Research/Star-Formation-Research-Project-2026/pipeline/scripts/optuna/final_preds_and_models/optuna_search_mult_quant_reg.py:161: UserWarning: The distribution is specified by [0.1, 5] and step=0.25, but the range is not divisible by `step`. It will be replaced with [0.1, 4.85].
  error_threshold = trial.suggest_float("error_threshold", 0.1, 5, step=0.25)
[I 2026-07-21 10:24:22,414] Trial 441 finished with value: -1.0283551781937026 and parameters: {'error_threshold': 0.85, 'scalers': 'robust', 'ratios': 'norm_ratio', 'imputers': 'median', 'n_estimators': 2700, 'learning_rate': 0.0042361318919880596, 'max_depth': 4, 'min_child_weight': 4, 'subsample': 0.6, 'colsample_bytree': 0.5, 'colsample_bylevel': 0.9, 'reg_alpha': 0.0009973829017656576, 'reg_lambda': 0.00012084107847141905, 'gamma': 0.0026636749814085456}. Best is trial 420 with value: -1.0247060900564386.
/bsuhome/alexanderemert/Research/Star-Formation-Research-Project-2026/pipeline/scripts/optuna/final_preds_and_models/optuna_search_mult_quant_reg.py:161: UserWarning: The distribution is specified by [0.1, 5] and step=0.25, but the range is not divisible by `step`. It will be replaced with [0.1, 4.85].
  error_threshold = trial.suggest_float("error_threshold", 0.1, 5, step=0.25)
[I 2026-07-21 10:24:24,995] Trial 442 finished with value: -1.0280877134850859 and parameters: {'error_threshold': 0.85, 'scalers': 'robust', 'ratios': 'norm_ratio', 'imputers': 'median', 'n_estimators': 2700, 'learning_rate': 0.0040874461676642364, 'max_depth': 4, 'min_child_weight': 4, 'subsample': 0.6, 'colsample_bytree': 0.5, 'colsample_bylevel': 0.9, 'reg_alpha': 0.0008323148072596664, 'reg_lambda': 0.0010957833662468587, 'gamma': 0.0028633749620621506}. Best is trial 420 with value: -1.0247060900564386.
/bsuhome/alexanderemert/Research/Star-Formation-Research-Project-2026/pipeline/scripts/optuna/final_preds_and_models/optuna_search_mult_quant_reg.py:161: UserWarning: The distribution is specified by [0.1, 5] and step=0.25, but the range is not divisible by `step`. It will be replaced with [0.1, 4.85].
  error_threshold = trial.suggest_float("error_threshold", 0.1, 5, step=0.25)
[I 2026-07-21 10:24:26,879] Trial 443 finished with value: -1.522577441075103 and parameters: {'error_threshold': 0.85, 'scalers': 'robust', 'ratios': 'norm_ratio', 'imputers': 'median', 'n_estimators': 2700, 'learning_rate': 0.00032343603603998135, 'max_depth': 3, 'min_child_weight': 4, 'subsample': 0.6, 'colsample_bytree': 0.5, 'colsample_bylevel': 0.9, 'reg_alpha': 0.0002337569236425604, 'reg_lambda': 0.000127940437627447, 'gamma': 0.08103695900982025}. Best is trial 420 with value: -1.0247060900564386.
/bsuhome/alexanderemert/Research/Star-Formation-Research-Project-2026/pipeline/scripts/optuna/final_preds_and_models/optuna_search_mult_quant_reg.py:161: UserWarning: The distribution is specified by [0.1, 5] and step=0.25, but the range is not divisible by `step`. It will be replaced with [0.1, 4.85].
  error_threshold = trial.suggest_float("error_threshold", 0.1, 5, step=0.25)
[I 2026-07-21 10:24:28,528] Trial 444 finished with value: -1.0373182692522287 and parameters: {'error_threshold': 0.85, 'scalers': 'robust', 'ratios': 'norm_ratio', 'imputers': 'median', 'n_estimators': 2700, 'learning_rate': 0.011253216073048971, 'max_depth': 3, 'min_child_weight': 7, 'subsample': 0.6, 'colsample_bytree': 0.5, 'colsample_bylevel': 0.9, 'reg_alpha': 0.00023307855007120607, 'reg_lambda': 0.00013607547458914298, 'gamma': 0.03854847622932428}. Best is trial 420 with value: -1.0247060900564386.
/bsuhome/alexanderemert/Research/Star-Formation-Research-Project-2026/pipeline/scripts/optuna/final_preds_and_models/optuna_search_mult_quant_reg.py:161: UserWarning: The distribution is specified by [0.1, 5] and step=0.25, but the range is not divisible by `step`. It will be replaced with [0.1, 4.85].
  error_threshold = trial.suggest_float("error_threshold", 0.1, 5, step=0.25)
[I 2026-07-21 10:24:29,982] Trial 445 finished with value: -1.0269593305838731 and parameters: {'error_threshold': 0.85, 'scalers': 'robust', 'ratios': 'norm_ratio', 'imputers': 'median', 'n_estimators': 2700, 'learning_rate': 0.0042570344073709, 'max_depth': 3, 'min_child_weight': 3, 'subsample': 0.6, 'colsample_bytree': 0.5, 'colsample_bylevel': 0.9, 'reg_alpha': 0.0002324321151443762, 'reg_lambda': 0.02110890383662698, 'gamma': 5.436703889807633}. Best is trial 420 with value: -1.0247060900564386.
/bsuhome/alexanderemert/Research/Star-Formation-Research-Project-2026/pipeline/scripts/optuna/final_preds_and_models/optuna_search_mult_quant_reg.py:161: UserWarning: The distribution is specified by [0.1, 5] and step=0.25, but the range is not divisible by `step`. It will be replaced with [0.1, 4.85].
  error_threshold = trial.suggest_float("error_threshold", 0.1, 5, step=0.25)
[I 2026-07-21 10:24:30,860] Trial 446 finished with value: -1.051105870007471 and parameters: {'error_threshold': 0.85, 'scalers': 'robust', 'ratios': 'norm_ratio', 'imputers': 'median', 'n_estimators': 1250, 'learning_rate': 0.004081326733578431, 'max_depth': 3, 'min_child_weight': 3, 'subsample': 0.9, 'colsample_bytree': 0.5, 'colsample_bylevel': 0.9, 'reg_alpha': 0.0002169847583559447, 'reg_lambda': 0.00013055910282928855, 'gamma': 3.4448511755190354e-06}. Best is trial 420 with value: -1.0247060900564386.
/bsuhome/alexanderemert/Research/Star-Formation-Research-Project-2026/pipeline/scripts/optuna/final_preds_and_models/optuna_search_mult_quant_reg.py:161: UserWarning: The distribution is specified by [0.1, 5] and step=0.25, but the range is not divisible by `step`. It will be replaced with [0.1, 4.85].
  error_threshold = trial.suggest_float("error_threshold", 0.1, 5, step=0.25)
[I 2026-07-21 10:24:32,474] Trial 447 finished with value: -1.0370844970745363 and parameters: {'error_threshold': 0.85, 'scalers': 'robust', 'ratios': 'norm_ratio', 'imputers': 'median', 'n_estimators': 2700, 'learning_rate': 0.010959521125263827, 'max_depth': 3, 'min_child_weight': 7, 'subsample': 0.6, 'colsample_bytree': 0.5, 'colsample_bylevel': 0.9, 'reg_alpha': 0.00023527509978221291, 'reg_lambda': 0.00024232365032871632, 'gamma': 0.0012749253086241654}. Best is trial 420 with value: -1.0247060900564386.
/bsuhome/alexanderemert/Research/Star-Formation-Research-Project-2026/pipeline/scripts/optuna/final_preds_and_models/optuna_search_mult_quant_reg.py:161: UserWarning: The distribution is specified by [0.1, 5] and step=0.25, but the range is not divisible by `step`. It will be replaced with [0.1, 4.85].
  error_threshold = trial.suggest_float("error_threshold", 0.1, 5, step=0.25)
[I 2026-07-21 10:24:34,191] Trial 448 finished with value: -1.0257506526941578 and parameters: {'error_threshold': 0.85, 'scalers': 'robust', 'ratios': 'norm_ratio', 'imputers': 'median', 'n_estimators': 2700, 'learning_rate': 0.0039029533356449374, 'max_depth': 3, 'min_child_weight': 3, 'subsample': 0.6, 'colsample_bytree': 0.5, 'colsample_bylevel': 0.9, 'reg_alpha': 0.00023655709002617375, 'reg_lambda': 0.00026780611049258014, 'gamma': 3.4966907664357083e-06}. Best is trial 420 with value: -1.0247060900564386.
/bsuhome/alexanderemert/Research/Star-Formation-Research-Project-2026/pipeline/scripts/optuna/final_preds_and_models/optuna_search_mult_quant_reg.py:161: UserWarning: The distribution is specified by [0.1, 5] and step=0.25, but the range is not divisible by `step`. It will be replaced with [0.1, 4.85].
  error_threshold = trial.suggest_float("error_threshold", 0.1, 5, step=0.25)
[I 2026-07-21 10:24:35,915] Trial 449 finished with value: -1.0254160726340553 and parameters: {'error_threshold': 0.85, 'scalers': 'robust', 'ratios': 'norm_ratio', 'imputers': 'median', 'n_estimators': 2700, 'learning_rate': 0.005421414214432378, 'max_depth': 3, 'min_child_weight': 3, 'subsample': 0.6, 'colsample_bytree': 0.5, 'colsample_bylevel': 0.9, 'reg_alpha': 0.0002654760490396535, 'reg_lambda': 0.0076739027230555866, 'gamma': 3.0665209280846854e-06}. Best is trial 420 with value: -1.0247060900564386.
/bsuhome/alexanderemert/Research/Star-Formation-Research-Project-2026/pipeline/scripts/optuna/final_preds_and_models/optuna_search_mult_quant_reg.py:161: UserWarning: The distribution is specified by [0.1, 5] and step=0.25, but the range is not divisible by `step`. It will be replaced with [0.1, 4.85].
  error_threshold = trial.suggest_float("error_threshold", 0.1, 5, step=0.25)
[I 2026-07-21 10:24:37,878] Trial 450 finished with value: -1.0271091939760886 and parameters: {'error_threshold': 1.35, 'scalers': 'robust', 'ratios': 'norm_ratio', 'imputers': 'median', 'n_estimators': 2700, 'learning_rate': 0.005408975543777408, 'max_depth': 3, 'min_child_weight': 3, 'subsample': 0.6, 'colsample_bytree': 0.6, 'colsample_bylevel': 0.9, 'reg_alpha': 0.00024381030964515252, 'reg_lambda': 0.0002640314842099092, 'gamma': 0.2769201388890123}. Best is trial 420 with value: -1.0247060900564386.
/bsuhome/alexanderemert/Research/Star-Formation-Research-Project-2026/pipeline/scripts/optuna/final_preds_and_models/optuna_search_mult_quant_reg.py:161: UserWarning: The distribution is specified by [0.1, 5] and step=0.25, but the range is not divisible by `step`. It will be replaced with [0.1, 4.85].
  error_threshold = trial.suggest_float("error_threshold", 0.1, 5, step=0.25)
