[I 2026-07-21 13:58:19,642] Trial 68 finished with value: -3.812471715586718 and parameters: {'error_threshold': 4.35, 'scalers': 'robust', 'ratios': 'log_ratio', 'imputers': 'median', 'n_estimators': 1350, 'learning_rate': 0.0015643072010807966, 'max_depth': 6, 'min_child_weight': 10, 'subsample': 0.7, 'colsample_bytree': 0.9, 'colsample_bylevel': 0.9, 'reg_alpha': 0.036347464269372354, 'reg_lambda': 3.642602366573721, 'gamma': 0.24351663328816636}. Best is trial 36 with value: -3.7867713089644206.
/bsuhome/alexanderemert/Research/Star-Formation-Research-Project-2026/pipeline/scripts/optuna/final_preds_and_models/optuna_search_mult_quant_reg.py:162: UserWarning: The distribution is specified by [0.1, 5] and step=0.25, but the range is not divisible by `step`. It will be replaced with [0.1, 4.85].
  error_threshold = trial.suggest_float("error_threshold", 0.1, 5, step=0.25)
[I 2026-07-21 13:58:25,261] Trial 69 finished with value: -3.7974030161408696 and parameters: {'error_threshold': 1.35, 'scalers': 'robust', 'ratios': 'log_ratio', 'imputers': 'median', 'n_estimators': 1850, 'learning_rate': 0.0016178278674579163, 'max_depth': 6, 'min_child_weight': 8, 'subsample': 0.7, 'colsample_bytree': 0.9, 'colsample_bylevel': 0.9, 'reg_alpha': 0.00022832816132104122, 'reg_lambda': 3.2228538755430174, 'gamma': 0.08554988378719629}. Best is trial 36 with value: -3.7867713089644206.
/bsuhome/alexanderemert/Research/Star-Formation-Research-Project-2026/pipeline/scripts/optuna/final_preds_and_models/optuna_search_mult_quant_reg.py:162: UserWarning: The distribution is specified by [0.1, 5] and step=0.25, but the range is not divisible by `step`. It will be replaced with [0.1, 4.85].
  error_threshold = trial.suggest_float("error_threshold", 0.1, 5, step=0.25)
[I 2026-07-21 13:58:32,107] Trial 70 finished with value: -3.812991222417588 and parameters: {'error_threshold': 1.35, 'scalers': 'robust', 'ratios': 'log_ratio', 'imputers': 'median', 'n_estimators': 1850, 'learning_rate': 0.0019178287561342903, 'max_depth': 7, 'min_child_weight': 8, 'subsample': 0.7, 'colsample_bytree': 0.9, 'colsample_bylevel': 0.8, 'reg_alpha': 0.010723211941570606, 'reg_lambda': 4.021417357408494, 'gamma': 0.16182474580292008}. Best is trial 36 with value: -3.7867713089644206.
/bsuhome/alexanderemert/Research/Star-Formation-Research-Project-2026/pipeline/scripts/optuna/final_preds_and_models/optuna_search_mult_quant_reg.py:162: UserWarning: The distribution is specified by [0.1, 5] and step=0.25, but the range is not divisible by `step`. It will be replaced with [0.1, 4.85].
  error_threshold = trial.suggest_float("error_threshold", 0.1, 5, step=0.25)
[I 2026-07-21 13:58:39,609] Trial 71 finished with value: -3.97392287815688 and parameters: {'error_threshold': 0.85, 'scalers': 'robust', 'ratios': 'log_ratio', 'imputers': 'median', 'n_estimators': 1900, 'learning_rate': 0.0005024700343740482, 'max_depth': 7, 'min_child_weight': 8, 'subsample': 0.7, 'colsample_bytree': 0.8, 'colsample_bylevel': 0.8, 'reg_alpha': 0.0001891971470862743, 'reg_lambda': 3.43396129349806, 'gamma': 0.35915207637577246}. Best is trial 36 with value: -3.7867713089644206.
/bsuhome/alexanderemert/Research/Star-Formation-Research-Project-2026/pipeline/scripts/optuna/final_preds_and_models/optuna_search_mult_quant_reg.py:162: UserWarning: The distribution is specified by [0.1, 5] and step=0.25, but the range is not divisible by `step`. It will be replaced with [0.1, 4.85].
  error_threshold = trial.suggest_float("error_threshold", 0.1, 5, step=0.25)
[I 2026-07-21 13:58:45,483] Trial 72 finished with value: -3.8091133701212456 and parameters: {'error_threshold': 4.1, 'scalers': 'robust', 'ratios': 'log_ratio', 'imputers': 'median', 'n_estimators': 1900, 'learning_rate': 0.0010544205765077896, 'max_depth': 7, 'min_child_weight': 8, 'subsample': 0.5, 'colsample_bytree': 0.8, 'colsample_bylevel': 0.8, 'reg_alpha': 0.007625321392138876, 'reg_lambda': 0.18071753403976717, 'gamma': 28.682721470423473}. Best is trial 36 with value: -3.7867713089644206.
/bsuhome/alexanderemert/Research/Star-Formation-Research-Project-2026/pipeline/scripts/optuna/final_preds_and_models/optuna_search_mult_quant_reg.py:162: UserWarning: The distribution is specified by [0.1, 5] and step=0.25, but the range is not divisible by `step`. It will be replaced with [0.1, 4.85].
  error_threshold = trial.suggest_float("error_threshold", 0.1, 5, step=0.25)
[I 2026-07-21 13:58:47,963] Trial 74 finished with value: -3.786771952095655 and parameters: {'error_threshold': 2.85, 'scalers': 'robust', 'ratios': 'log_ratio', 'imputers': 'none', 'n_estimators': 1400, 'learning_rate': 0.002124041682187737, 'max_depth': 5, 'min_child_weight': 8, 'subsample': 0.5, 'colsample_bytree': 0.8, 'colsample_bylevel': 0.8, 'reg_alpha': 0.007626683957097638, 'reg_lambda': 0.19995912500294208, 'gamma': 0.14859354912488887}. Best is trial 36 with value: -3.7867713089644206.
/bsuhome/alexanderemert/Research/Star-Formation-Research-Project-2026/pipeline/scripts/optuna/final_preds_and_models/optuna_search_mult_quant_reg.py:162: UserWarning: The distribution is specified by [0.1, 5] and step=0.25, but the range is not divisible by `step`. It will be replaced with [0.1, 4.85].
  error_threshold = trial.suggest_float("error_threshold", 0.1, 5, step=0.25)
[I 2026-07-21 13:58:55,108] Trial 73 finished with value: -3.9375686762682 and parameters: {'error_threshold': 2.85, 'scalers': 'robust', 'ratios': 'log_ratio', 'imputers': 'median', 'n_estimators': 2000, 'learning_rate': 0.00048370343361631656, 'max_depth': 7, 'min_child_weight': 8, 'subsample': 0.5, 'colsample_bytree': 0.8, 'colsample_bylevel': 0.8, 'reg_alpha': 0.008159457109408817, 'reg_lambda': 0.1258315898625012, 'gamma': 0.2218763731654637}. Best is trial 36 with value: -3.7867713089644206.
/bsuhome/alexanderemert/Research/Star-Formation-Research-Project-2026/pipeline/scripts/optuna/final_preds_and_models/optuna_search_mult_quant_reg.py:162: UserWarning: The distribution is specified by [0.1, 5] and step=0.25, but the range is not divisible by `step`. It will be replaced with [0.1, 4.85].
  error_threshold = trial.suggest_float("error_threshold", 0.1, 5, step=0.25)
[I 2026-07-21 13:59:00,378] Trial 75 finished with value: -3.9254493375464605 and parameters: {'error_threshold': 2.85, 'scalers': 'robust', 'ratios': 'log_ratio', 'imputers': 'median', 'n_estimators': 2000, 'learning_rate': 0.0005120292281770269, 'max_depth': 7, 'min_child_weight': 8, 'subsample': 0.6, 'colsample_bytree': 0.8, 'colsample_bylevel': 0.5, 'reg_alpha': 0.00898146029007639, 'reg_lambda': 0.09686314009419293, 'gamma': 23.088106003978215}. Best is trial 36 with value: -3.7867713089644206.
/bsuhome/alexanderemert/Research/Star-Formation-Research-Project-2026/pipeline/scripts/optuna/final_preds_and_models/optuna_search_mult_quant_reg.py:162: UserWarning: The distribution is specified by [0.1, 5] and step=0.25, but the range is not divisible by `step`. It will be replaced with [0.1, 4.85].
  error_threshold = trial.suggest_float("error_threshold", 0.1, 5, step=0.25)
[I 2026-07-21 13:59:05,623] Trial 76 finished with value: -3.8826714168690213 and parameters: {'error_threshold': 0.85, 'scalers': 'robust', 'ratios': 'log_ratio', 'imputers': 'median', 'n_estimators': 2000, 'learning_rate': 0.0009322206141538688, 'max_depth': 7, 'min_child_weight': 8, 'subsample': 0.5, 'colsample_bytree': 0.8, 'colsample_bylevel': 0.8, 'reg_alpha': 0.007554635552453722, 'reg_lambda': 32.3316702859684, 'gamma': 24.09708415564805}. Best is trial 36 with value: -3.7867713089644206.
/bsuhome/alexanderemert/Research/Star-Formation-Research-Project-2026/pipeline/scripts/optuna/final_preds_and_models/optuna_search_mult_quant_reg.py:162: UserWarning: The distribution is specified by [0.1, 5] and step=0.25, but the range is not divisible by `step`. It will be replaced with [0.1, 4.85].
  error_threshold = trial.suggest_float("error_threshold", 0.1, 5, step=0.25)
[I 2026-07-21 13:59:12,608] Trial 77 finished with value: -3.9579890336622405 and parameters: {'error_threshold': 2.85, 'scalers': 'robust', 'ratios': 'log_ratio', 'imputers': 'median', 'n_estimators': 2050, 'learning_rate': 0.00043970457029413284, 'max_depth': 7, 'min_child_weight': 8, 'subsample': 0.5, 'colsample_bytree': 0.8, 'colsample_bylevel': 0.8, 'reg_alpha': 0.008860779879681143, 'reg_lambda': 0.10318353269656759, 'gamma': 21.20472325155919}. Best is trial 36 with value: -3.7867713089644206.
/bsuhome/alexanderemert/Research/Star-Formation-Research-Project-2026/pipeline/scripts/optuna/final_preds_and_models/optuna_search_mult_quant_reg.py:162: UserWarning: The distribution is specified by [0.1, 5] and step=0.25, but the range is not divisible by `step`. It will be replaced with [0.1, 4.85].
  error_threshold = trial.suggest_float("error_threshold", 0.1, 5, step=0.25)
[I 2026-07-21 13:59:15,246] Trial 78 finished with value: -3.8369134495101975 and parameters: {'error_threshold': 0.85, 'scalers': 'none', 'ratios': 'norm_ratio', 'imputers': 'median', 'n_estimators': 1600, 'learning_rate': 0.0009842814322860436, 'max_depth': 5, 'min_child_weight': 9, 'subsample': 0.6, 'colsample_bytree': 1.0, 'colsample_bylevel': 0.5, 'reg_alpha': 0.20655364598485876, 'reg_lambda': 0.09545103215291585, 'gamma': 0.9077403645160971}. Best is trial 36 with value: -3.7867713089644206.
/bsuhome/alexanderemert/Research/Star-Formation-Research-Project-2026/pipeline/scripts/optuna/final_preds_and_models/optuna_search_mult_quant_reg.py:162: UserWarning: The distribution is specified by [0.1, 5] and step=0.25, but the range is not divisible by `step`. It will be replaced with [0.1, 4.85].
  error_threshold = trial.suggest_float("error_threshold", 0.1, 5, step=0.25)
[I 2026-07-21 13:59:20,283] Trial 79 finished with value: -3.822510794665913 and parameters: {'error_threshold': 1.6, 'scalers': 'none', 'ratios': 'norm_ratio', 'imputers': 'median', 'n_estimators': 2000, 'learning_rate': 0.0023574189559509235, 'max_depth': 5, 'min_child_weight': 9, 'subsample': 1.0, 'colsample_bytree': 1.0, 'colsample_bylevel': 1.0, 'reg_alpha': 0.6532786120419831, 'reg_lambda': 0.09031209954746407, 'gamma': 0.872029646608593}. Best is trial 36 with value: -3.7867713089644206.
/bsuhome/alexanderemert/Research/Star-Formation-Research-Project-2026/pipeline/scripts/optuna/final_preds_and_models/optuna_search_mult_quant_reg.py:162: UserWarning: The distribution is specified by [0.1, 5] and step=0.25, but the range is not divisible by `step`. It will be replaced with [0.1, 4.85].
  error_threshold = trial.suggest_float("error_threshold", 0.1, 5, step=0.25)
[I 2026-07-21 13:59:22,056] Trial 81 finished with value: -3.957341492546696 and parameters: {'error_threshold': 2.6, 'scalers': 'robust', 'ratios': 'log_ratio', 'imputers': 'none', 'n_estimators': 900, 'learning_rate': 0.0010641889754436323, 'max_depth': 5, 'min_child_weight': 9, 'subsample': 0.5, 'colsample_bytree': 0.8, 'colsample_bylevel': 1.0, 'reg_alpha': 0.21067348971386018, 'reg_lambda': 0.4386196022567644, 'gamma': 95.69253561075173}. Best is trial 36 with value: -3.7867713089644206.
/bsuhome/alexanderemert/Research/Star-Formation-Research-Project-2026/pipeline/scripts/optuna/final_preds_and_models/optuna_search_mult_quant_reg.py:162: UserWarning: The distribution is specified by [0.1, 5] and step=0.25, but the range is not divisible by `step`. It will be replaced with [0.1, 4.85].
  error_threshold = trial.suggest_float("error_threshold", 0.1, 5, step=0.25)
[I 2026-07-21 13:59:26,211] Trial 80 finished with value: -3.808941498665158 and parameters: {'error_threshold': 2.85, 'scalers': 'none', 'ratios': 'norm_ratio', 'imputers': 'median', 'n_estimators': 1650, 'learning_rate': 0.002633217370752232, 'max_depth': 5, 'min_child_weight': 9, 'subsample': 0.9, 'colsample_bytree': 1.0, 'colsample_bylevel': 1.0, 'reg_alpha': 0.6502852459501928, 'reg_lambda': 0.07147988680673095, 'gamma': 0.8547413947818611}. Best is trial 36 with value: -3.7867713089644206.
/bsuhome/alexanderemert/Research/Star-Formation-Research-Project-2026/pipeline/scripts/optuna/final_preds_and_models/optuna_search_mult_quant_reg.py:162: UserWarning: The distribution is specified by [0.1, 5] and step=0.25, but the range is not divisible by `step`. It will be replaced with [0.1, 4.85].
  error_threshold = trial.suggest_float("error_threshold", 0.1, 5, step=0.25)
[I 2026-07-21 13:59:27,241] Trial 82 finished with value: -3.8009772236153663 and parameters: {'error_threshold': 3.1, 'scalers': 'robust', 'ratios': 'log_ratio', 'imputers': 'none', 'n_estimators': 950, 'learning_rate': 0.0025984472835666075, 'max_depth': 5, 'min_child_weight': 9, 'subsample': 0.5, 'colsample_bytree': 0.5, 'colsample_bylevel': 0.5, 'reg_alpha': 0.6394156870858788, 'reg_lambda': 0.4313104285430316, 'gamma': 0.013842532550152449}. Best is trial 36 with value: -3.7867713089644206.
/bsuhome/alexanderemert/Research/Star-Formation-Research-Project-2026/pipeline/scripts/optuna/final_preds_and_models/optuna_search_mult_quant_reg.py:162: UserWarning: The distribution is specified by [0.1, 5] and step=0.25, but the range is not divisible by `step`. It will be replaced with [0.1, 4.85].
  error_threshold = trial.suggest_float("error_threshold", 0.1, 5, step=0.25)
[I 2026-07-21 13:59:30,998] Trial 83 finished with value: -3.7970238627916637 and parameters: {'error_threshold': 3.1, 'scalers': 'robust', 'ratios': 'log_ratio', 'imputers': 'none', 'n_estimators': 1650, 'learning_rate': 0.002534369887286688, 'max_depth': 5, 'min_child_weight': 9, 'subsample': 0.5, 'colsample_bytree': 1.0, 'colsample_bylevel': 1.0, 'reg_alpha': 0.0010954799904826045, 'reg_lambda': 0.5718965595876709, 'gamma': 0.013301972819339232}. Best is trial 36 with value: -3.7867713089644206.
/bsuhome/alexanderemert/Research/Star-Formation-Research-Project-2026/pipeline/scripts/optuna/final_preds_and_models/optuna_search_mult_quant_reg.py:162: UserWarning: The distribution is specified by [0.1, 5] and step=0.25, but the range is not divisible by `step`. It will be replaced with [0.1, 4.85].
  error_threshold = trial.suggest_float("error_threshold", 0.1, 5, step=0.25)
[I 2026-07-21 13:59:33,145] Trial 84 finished with value: -3.799419052527588 and parameters: {'error_threshold': 4.85, 'scalers': 'robust', 'ratios': 'log_ratio', 'imputers': 'none', 'n_estimators': 850, 'learning_rate': 0.002563349635158938, 'max_depth': 5, 'min_child_weight': 9, 'subsample': 0.5, 'colsample_bytree': 1.0, 'colsample_bylevel': 1.0, 'reg_alpha': 0.7612326704031853, 'reg_lambda': 0.5107748987263109, 'gamma': 0.016964060246892003}. Best is trial 36 with value: -3.7867713089644206.
/bsuhome/alexanderemert/Research/Star-Formation-Research-Project-2026/pipeline/scripts/optuna/final_preds_and_models/optuna_search_mult_quant_reg.py:162: UserWarning: The distribution is specified by [0.1, 5] and step=0.25, but the range is not divisible by `step`. It will be replaced with [0.1, 4.85].
  error_threshold = trial.suggest_float("error_threshold", 0.1, 5, step=0.25)
[I 2026-07-21 13:59:35,373] Trial 85 finished with value: -3.803798255286876 and parameters: {'error_threshold': 3.1, 'scalers': 'robust', 'ratios': 'log_ratio', 'imputers': 'none', 'n_estimators': 850, 'learning_rate': 0.002513721961064669, 'max_depth': 5, 'min_child_weight': 9, 'subsample': 0.6, 'colsample_bytree': 1.0, 'colsample_bylevel': 1.0, 'reg_alpha': 0.24227721930866838, 'reg_lambda': 0.34490371641305767, 'gamma': 0.02665612095187465}. Best is trial 36 with value: -3.7867713089644206.
/bsuhome/alexanderemert/Research/Star-Formation-Research-Project-2026/pipeline/scripts/optuna/final_preds_and_models/optuna_search_mult_quant_reg.py:162: UserWarning: The distribution is specified by [0.1, 5] and step=0.25, but the range is not divisible by `step`. It will be replaced with [0.1, 4.85].
  error_threshold = trial.suggest_float("error_threshold", 0.1, 5, step=0.25)
[I 2026-07-21 13:59:36,312] Trial 86 finished with value: -3.8546164081302217 and parameters: {'error_threshold': 3.1, 'scalers': 'robust', 'ratios': 'log_ratio', 'imputers': 'none', 'n_estimators': 700, 'learning_rate': 0.0022037124567336674, 'max_depth': 5, 'min_child_weight': 7, 'subsample': 0.6, 'colsample_bytree': 0.5, 'colsample_bylevel': 0.7, 'reg_alpha': 0.41212338504488544, 'reg_lambda': 0.39978772992337547, 'gamma': 0.06064458331949713}. Best is trial 36 with value: -3.7867713089644206.
/bsuhome/alexanderemert/Research/Star-Formation-Research-Project-2026/pipeline/scripts/optuna/final_preds_and_models/optuna_search_mult_quant_reg.py:162: UserWarning: The distribution is specified by [0.1, 5] and step=0.25, but the range is not divisible by `step`. It will be replaced with [0.1, 4.85].
  error_threshold = trial.suggest_float("error_threshold", 0.1, 5, step=0.25)
[I 2026-07-21 13:59:37,500] Trial 87 finished with value: -3.816948500584509 and parameters: {'error_threshold': 3.35, 'scalers': 'robust', 'ratios': 'log_ratio', 'imputers': 'none', 'n_estimators': 750, 'learning_rate': 0.0026252808364785824, 'max_depth': 5, 'min_child_weight': 7, 'subsample': 0.6, 'colsample_bytree': 0.5, 'colsample_bylevel': 1.0, 'reg_alpha': 0.01768618061478719, 'reg_lambda': 0.5882079881362052, 'gamma': 0.03218858727265034}. Best is trial 36 with value: -3.7867713089644206.
/bsuhome/alexanderemert/Research/Star-Formation-Research-Project-2026/pipeline/scripts/optuna/final_preds_and_models/optuna_search_mult_quant_reg.py:162: UserWarning: The distribution is specified by [0.1, 5] and step=0.25, but the range is not divisible by `step`. It will be replaced with [0.1, 4.85].
  error_threshold = trial.suggest_float("error_threshold", 0.1, 5, step=0.25)
[I 2026-07-21 13:59:40,086] Trial 88 finished with value: -3.7858848711711595 and parameters: {'error_threshold': 3.35, 'scalers': 'none', 'ratios': 'norm_ratio', 'imputers': 'none', 'n_estimators': 1650, 'learning_rate': 0.002595256590218271, 'max_depth': 4, 'min_child_weight': 7, 'subsample': 0.6, 'colsample_bytree': 1.0, 'colsample_bylevel': 0.9, 'reg_alpha': 0.016142458992009494, 'reg_lambda': 0.2706337047587378, 'gamma': 0.01777466348200858}. Best is trial 88 with value: -3.7858848711711595.
/bsuhome/alexanderemert/Research/Star-Formation-Research-Project-2026/pipeline/scripts/optuna/final_preds_and_models/optuna_search_mult_quant_reg.py:162: UserWarning: The distribution is specified by [0.1, 5] and step=0.25, but the range is not divisible by `step`. It will be replaced with [0.1, 4.85].
  error_threshold = trial.suggest_float("error_threshold", 0.1, 5, step=0.25)
[I 2026-07-21 13:59:42,535] Trial 89 finished with value: -3.8044826933810385 and parameters: {'error_threshold': 1.6, 'scalers': 'robust', 'ratios': 'norm_ratio', 'imputers': 'none', 'n_estimators': 1650, 'learning_rate': 0.004215921913338718, 'max_depth': 4, 'min_child_weight': 7, 'subsample': 0.6, 'colsample_bytree': 1.0, 'colsample_bylevel': 0.9, 'reg_alpha': 0.0160386552994841, 'reg_lambda': 0.03311513398219644, 'gamma': 0.013233005175344741}. Best is trial 88 with value: -3.7858848711711595.
/bsuhome/alexanderemert/Research/Star-Formation-Research-Project-2026/pipeline/scripts/optuna/final_preds_and_models/optuna_search_mult_quant_reg.py:162: UserWarning: The distribution is specified by [0.1, 5] and step=0.25, but the range is not divisible by `step`. It will be replaced with [0.1, 4.85].
  error_threshold = trial.suggest_float("error_threshold", 0.1, 5, step=0.25)
[I 2026-07-21 13:59:44,024] Trial 90 finished with value: -5.014249503612855 and parameters: {'error_threshold': 1.6, 'scalers': 'robust', 'ratios': 'norm_ratio', 'imputers': 'mean', 'n_estimators': 1450, 'learning_rate': 0.4850343664493204, 'max_depth': 4, 'min_child_weight': 1, 'subsample': 0.6, 'colsample_bytree': 1.0, 'colsample_bylevel': 0.9, 'reg_alpha': 0.017510600885080035, 'reg_lambda': 0.0024144170432552976, 'gamma': 0.050290594622521737}. Best is trial 88 with value: -3.7858848711711595.
/bsuhome/alexanderemert/Research/Star-Formation-Research-Project-2026/pipeline/scripts/optuna/final_preds_and_models/optuna_search_mult_quant_reg.py:162: UserWarning: The distribution is specified by [0.1, 5] and step=0.25, but the range is not divisible by `step`. It will be replaced with [0.1, 4.85].
  error_threshold = trial.suggest_float("error_threshold", 0.1, 5, step=0.25)
[I 2026-07-21 13:59:46,480] Trial 91 finished with value: -3.8434763980617546 and parameters: {'error_threshold': 2.1, 'scalers': 'none', 'ratios': 'norm_ratio', 'imputers': 'mean', 'n_estimators': 2300, 'learning_rate': 0.005875471517539763, 'max_depth': 4, 'min_child_weight': 7, 'subsample': 0.6, 'colsample_bytree': 0.6, 'colsample_bylevel': 0.9, 'reg_alpha': 0.020423392618711244, 'reg_lambda': 0.03191989474782181, 'gamma': 5.54229617877475}. Best is trial 88 with value: -3.7858848711711595.
/bsuhome/alexanderemert/Research/Star-Formation-Research-Project-2026/pipeline/scripts/optuna/final_preds_and_models/optuna_search_mult_quant_reg.py:162: UserWarning: The distribution is specified by [0.1, 5] and step=0.25, but the range is not divisible by `step`. It will be replaced with [0.1, 4.85].
  error_threshold = trial.suggest_float("error_threshold", 0.1, 5, step=0.25)
