[I 2026-07-20 12:49:20,900] Trial 61 finished with value: -0.857170832244925 and parameters: {'error_threshold': 1.0, 'scalers': 'robust', 'ratios': 'norm_ratio', 'imputers': 'none', 'n_estimators': 1700, 'learning_rate': 0.030153773754800463, 'max_depth': 12, 'min_child_weight': 1, 'subsample': 0.5, 'colsample_bytree': 0.8, 'colsample_bylevel': 0.7, 'reg_alpha': 0.0050039142098422685, 'reg_lambda': 0.006957452459383705, 'gamma': 0.021945198005228716}. Best is trial 52 with value: -2.0785744484814006.
/bsuscratch/alexanderemert/miniforge3/envs/starform-alex/lib/python3.14/site-packages/sklearn/utils/extmath.py:1207: RuntimeWarning: invalid value encountered in divide
  updated_mean = (last_sum + new_sum) / updated_sample_count
/bsuscratch/alexanderemert/miniforge3/envs/starform-alex/lib/python3.14/site-packages/sklearn/utils/extmath.py:1212: RuntimeWarning: invalid value encountered in divide
  T = new_sum / new_sample_count
/bsuscratch/alexanderemert/miniforge3/envs/starform-alex/lib/python3.14/site-packages/sklearn/utils/extmath.py:1236: RuntimeWarning: invalid value encountered in divide
  new_unnormalized_variance -= correction**2 / new_sample_count
/bsuscratch/alexanderemert/miniforge3/envs/starform-alex/lib/python3.14/site-packages/sklearn/utils/extmath.py:1207: RuntimeWarning: invalid value encountered in divide
  updated_mean = (last_sum + new_sum) / updated_sample_count
/bsuscratch/alexanderemert/miniforge3/envs/starform-alex/lib/python3.14/site-packages/sklearn/utils/extmath.py:1212: RuntimeWarning: invalid value encountered in divide
  T = new_sum / new_sample_count
/bsuscratch/alexanderemert/miniforge3/envs/starform-alex/lib/python3.14/site-packages/sklearn/utils/extmath.py:1236: RuntimeWarning: invalid value encountered in divide
  new_unnormalized_variance -= correction**2 / new_sample_count
/bsuscratch/alexanderemert/miniforge3/envs/starform-alex/lib/python3.14/site-packages/numpy/lib/_nanfunctions_impl.py:1215: RuntimeWarning: All-NaN slice encountered
  return fnb._ureduce(a, func=_nanmedian, keepdims=keepdims,
/bsuscratch/alexanderemert/miniforge3/envs/starform-alex/lib/python3.14/site-packages/numpy/lib/_nanfunctions_impl.py:1396: RuntimeWarning: All-NaN slice encountered
  return _nanquantile_unchecked(
/bsuscratch/alexanderemert/miniforge3/envs/starform-alex/lib/python3.14/site-packages/sklearn/utils/extmath.py:1207: RuntimeWarning: invalid value encountered in divide
  updated_mean = (last_sum + new_sum) / updated_sample_count
/bsuscratch/alexanderemert/miniforge3/envs/starform-alex/lib/python3.14/site-packages/sklearn/utils/extmath.py:1212: RuntimeWarning: invalid value encountered in divide
  T = new_sum / new_sample_count
/bsuscratch/alexanderemert/miniforge3/envs/starform-alex/lib/python3.14/site-packages/sklearn/utils/extmath.py:1236: RuntimeWarning: invalid value encountered in divide
  new_unnormalized_variance -= correction**2 / new_sample_count
/bsuscratch/alexanderemert/miniforge3/envs/starform-alex/lib/python3.14/site-packages/sklearn/utils/extmath.py:1207: RuntimeWarning: invalid value encountered in divide
  updated_mean = (last_sum + new_sum) / updated_sample_count
/bsuscratch/alexanderemert/miniforge3/envs/starform-alex/lib/python3.14/site-packages/sklearn/utils/extmath.py:1212: RuntimeWarning: invalid value encountered in divide
  T = new_sum / new_sample_count
/bsuscratch/alexanderemert/miniforge3/envs/starform-alex/lib/python3.14/site-packages/sklearn/utils/extmath.py:1236: RuntimeWarning: invalid value encountered in divide
  new_unnormalized_variance -= correction**2 / new_sample_count
/bsuscratch/alexanderemert/miniforge3/envs/starform-alex/lib/python3.14/site-packages/sklearn/utils/extmath.py:1207: RuntimeWarning: invalid value encountered in divide
  updated_mean = (last_sum + new_sum) / updated_sample_count
/bsuscratch/alexanderemert/miniforge3/envs/starform-alex/lib/python3.14/site-packages/sklearn/utils/extmath.py:1212: RuntimeWarning: invalid value encountered in divide
  T = new_sum / new_sample_count
/bsuscratch/alexanderemert/miniforge3/envs/starform-alex/lib/python3.14/site-packages/sklearn/utils/extmath.py:1236: RuntimeWarning: invalid value encountered in divide
  new_unnormalized_variance -= correction**2 / new_sample_count
/bsuscratch/alexanderemert/miniforge3/envs/starform-alex/lib/python3.14/site-packages/sklearn/utils/extmath.py:1207: RuntimeWarning: invalid value encountered in divide
  updated_mean = (last_sum + new_sum) / updated_sample_count
/bsuscratch/alexanderemert/miniforge3/envs/starform-alex/lib/python3.14/site-packages/sklearn/utils/extmath.py:1212: RuntimeWarning: invalid value encountered in divide
  T = new_sum / new_sample_count
/bsuscratch/alexanderemert/miniforge3/envs/starform-alex/lib/python3.14/site-packages/sklearn/utils/extmath.py:1236: RuntimeWarning: invalid value encountered in divide
  new_unnormalized_variance -= correction**2 / new_sample_count
/bsuscratch/alexanderemert/miniforge3/envs/starform-alex/lib/python3.14/site-packages/sklearn/utils/extmath.py:1207: RuntimeWarning: invalid value encountered in divide
  updated_mean = (last_sum + new_sum) / updated_sample_count
/bsuscratch/alexanderemert/miniforge3/envs/starform-alex/lib/python3.14/site-packages/sklearn/utils/extmath.py:1212: RuntimeWarning: invalid value encountered in divide
  T = new_sum / new_sample_count
/bsuscratch/alexanderemert/miniforge3/envs/starform-alex/lib/python3.14/site-packages/sklearn/utils/extmath.py:1236: RuntimeWarning: invalid value encountered in divide
  new_unnormalized_variance -= correction**2 / new_sample_count
/bsuscratch/alexanderemert/miniforge3/envs/starform-alex/lib/python3.14/site-packages/sklearn/utils/extmath.py:1207: RuntimeWarning: invalid value encountered in divide
  updated_mean = (last_sum + new_sum) / updated_sample_count
/bsuscratch/alexanderemert/miniforge3/envs/starform-alex/lib/python3.14/site-packages/sklearn/utils/extmath.py:1212: RuntimeWarning: invalid value encountered in divide
  T = new_sum / new_sample_count
/bsuscratch/alexanderemert/miniforge3/envs/starform-alex/lib/python3.14/site-packages/sklearn/utils/extmath.py:1236: RuntimeWarning: invalid value encountered in divide
  new_unnormalized_variance -= correction**2 / new_sample_count
/bsuscratch/alexanderemert/miniforge3/envs/starform-alex/lib/python3.14/site-packages/sklearn/utils/extmath.py:1207: RuntimeWarning: invalid value encountered in divide
  updated_mean = (last_sum + new_sum) / updated_sample_count
/bsuscratch/alexanderemert/miniforge3/envs/starform-alex/lib/python3.14/site-packages/sklearn/utils/extmath.py:1212: RuntimeWarning: invalid value encountered in divide
  T = new_sum / new_sample_count
/bsuscratch/alexanderemert/miniforge3/envs/starform-alex/lib/python3.14/site-packages/sklearn/utils/extmath.py:1236: RuntimeWarning: invalid value encountered in divide
  new_unnormalized_variance -= correction**2 / new_sample_count
/bsuscratch/alexanderemert/miniforge3/envs/starform-alex/lib/python3.14/site-packages/sklearn/utils/extmath.py:1207: RuntimeWarning: invalid value encountered in divide
  updated_mean = (last_sum + new_sum) / updated_sample_count
/bsuscratch/alexanderemert/miniforge3/envs/starform-alex/lib/python3.14/site-packages/sklearn/utils/extmath.py:1212: RuntimeWarning: invalid value encountered in divide
  T = new_sum / new_sample_count
/bsuscratch/alexanderemert/miniforge3/envs/starform-alex/lib/python3.14/site-packages/sklearn/utils/extmath.py:1236: RuntimeWarning: invalid value encountered in divide
  new_unnormalized_variance -= correction**2 / new_sample_count
/bsuscratch/alexanderemert/miniforge3/envs/starform-alex/lib/python3.14/site-packages/sklearn/utils/extmath.py:1207: RuntimeWarning: invalid value encountered in divide
  updated_mean = (last_sum + new_sum) / updated_sample_count
/bsuscratch/alexanderemert/miniforge3/envs/starform-alex/lib/python3.14/site-packages/sklearn/utils/extmath.py:1212: RuntimeWarning: invalid value encountered in divide
  T = new_sum / new_sample_count
/bsuscratch/alexanderemert/miniforge3/envs/starform-alex/lib/python3.14/site-packages/sklearn/utils/extmath.py:1236: RuntimeWarning: invalid value encountered in divide
  new_unnormalized_variance -= correction**2 / new_sample_count
/bsuscratch/alexanderemert/miniforge3/envs/starform-alex/lib/python3.14/site-packages/sklearn/utils/extmath.py:1207: RuntimeWarning: invalid value encountered in divide
  updated_mean = (last_sum + new_sum) / updated_sample_count
/bsuscratch/alexanderemert/miniforge3/envs/starform-alex/lib/python3.14/site-packages/sklearn/utils/extmath.py:1212: RuntimeWarning: invalid value encountered in divide
  T = new_sum / new_sample_count
/bsuscratch/alexanderemert/miniforge3/envs/starform-alex/lib/python3.14/site-packages/sklearn/utils/extmath.py:1236: RuntimeWarning: invalid value encountered in divide
  new_unnormalized_variance -= correction**2 / new_sample_count
/bsuscratch/alexanderemert/miniforge3/envs/starform-alex/lib/python3.14/site-packages/sklearn/utils/extmath.py:1207: RuntimeWarning: invalid value encountered in divide
  updated_mean = (last_sum + new_sum) / updated_sample_count
/bsuscratch/alexanderemert/miniforge3/envs/starform-alex/lib/python3.14/site-packages/sklearn/utils/extmath.py:1212: RuntimeWarning: invalid value encountered in divide
  T = new_sum / new_sample_count
/bsuscratch/alexanderemert/miniforge3/envs/starform-alex/lib/python3.14/site-packages/sklearn/utils/extmath.py:1236: RuntimeWarning: invalid value encountered in divide
  new_unnormalized_variance -= correction**2 / new_sample_count
/bsuscratch/alexanderemert/miniforge3/envs/starform-alex/lib/python3.14/site-packages/sklearn/utils/extmath.py:1207: RuntimeWarning: invalid value encountered in divide
  updated_mean = (last_sum + new_sum) / updated_sample_count
/bsuscratch/alexanderemert/miniforge3/envs/starform-alex/lib/python3.14/site-packages/sklearn/utils/extmath.py:1212: RuntimeWarning: invalid value encountered in divide
  T = new_sum / new_sample_count
/bsuscratch/alexanderemert/miniforge3/envs/starform-alex/lib/python3.14/site-packages/sklearn/utils/extmath.py:1236: RuntimeWarning: invalid value encountered in divide
  new_unnormalized_variance -= correction**2 / new_sample_count
/bsuscratch/alexanderemert/miniforge3/envs/starform-alex/lib/python3.14/site-packages/sklearn/utils/extmath.py:1207: RuntimeWarning: invalid value encountered in divide
  updated_mean = (last_sum + new_sum) / updated_sample_count
/bsuscratch/alexanderemert/miniforge3/envs/starform-alex/lib/python3.14/site-packages/sklearn/utils/extmath.py:1212: RuntimeWarning: invalid value encountered in divide
  T = new_sum / new_sample_count
/bsuscratch/alexanderemert/miniforge3/envs/starform-alex/lib/python3.14/site-packages/sklearn/utils/extmath.py:1236: RuntimeWarning: invalid value encountered in divide
  new_unnormalized_variance -= correction**2 / new_sample_count
/bsuscratch/alexanderemert/miniforge3/envs/starform-alex/lib/python3.14/site-packages/sklearn/utils/extmath.py:1207: RuntimeWarning: invalid value encountered in divide
  updated_mean = (last_sum + new_sum) / updated_sample_count
/bsuscratch/alexanderemert/miniforge3/envs/starform-alex/lib/python3.14/site-packages/sklearn/utils/extmath.py:1212: RuntimeWarning: invalid value encountered in divide
  T = new_sum / new_sample_count
/bsuscratch/alexanderemert/miniforge3/envs/starform-alex/lib/python3.14/site-packages/sklearn/utils/extmath.py:1236: RuntimeWarning: invalid value encountered in divide
  new_unnormalized_variance -= correction**2 / new_sample_count
/bsuscratch/alexanderemert/miniforge3/envs/starform-alex/lib/python3.14/site-packages/sklearn/utils/extmath.py:1207: RuntimeWarning: invalid value encountered in divide
  updated_mean = (last_sum + new_sum) / updated_sample_count
/bsuscratch/alexanderemert/miniforge3/envs/starform-alex/lib/python3.14/site-packages/sklearn/utils/extmath.py:1212: RuntimeWarning: invalid value encountered in divide
  T = new_sum / new_sample_count
/bsuscratch/alexanderemert/miniforge3/envs/starform-alex/lib/python3.14/site-packages/sklearn/utils/extmath.py:1236: RuntimeWarning: invalid value encountered in divide
  new_unnormalized_variance -= correction**2 / new_sample_count
/bsuscratch/alexanderemert/miniforge3/envs/starform-alex/lib/python3.14/site-packages/sklearn/utils/extmath.py:1207: RuntimeWarning: invalid value encountered in divide
  updated_mean = (last_sum + new_sum) / updated_sample_count
/bsuscratch/alexanderemert/miniforge3/envs/starform-alex/lib/python3.14/site-packages/sklearn/utils/extmath.py:1212: RuntimeWarning: invalid value encountered in divide
  T = new_sum / new_sample_count
/bsuscratch/alexanderemert/miniforge3/envs/starform-alex/lib/python3.14/site-packages/sklearn/utils/extmath.py:1236: RuntimeWarning: invalid value encountered in divide
  new_unnormalized_variance -= correction**2 / new_sample_count
/bsuscratch/alexanderemert/miniforge3/envs/starform-alex/lib/python3.14/site-packages/sklearn/utils/extmath.py:1207: RuntimeWarning: invalid value encountered in divide
  updated_mean = (last_sum + new_sum) / updated_sample_count
/bsuscratch/alexanderemert/miniforge3/envs/starform-alex/lib/python3.14/site-packages/sklearn/utils/extmath.py:1212: RuntimeWarning: invalid value encountered in divide
  T = new_sum / new_sample_count
/bsuscratch/alexanderemert/miniforge3/envs/starform-alex/lib/python3.14/site-packages/sklearn/utils/extmath.py:1236: RuntimeWarning: invalid value encountered in divide
  new_unnormalized_variance -= correction**2 / new_sample_count
/bsuscratch/alexanderemert/miniforge3/envs/starform-alex/lib/python3.14/site-packages/sklearn/utils/extmath.py:1207: RuntimeWarning: invalid value encountered in divide
  updated_mean = (last_sum + new_sum) / updated_sample_count
/bsuscratch/alexanderemert/miniforge3/envs/starform-alex/lib/python3.14/site-packages/sklearn/utils/extmath.py:1212: RuntimeWarning: invalid value encountered in divide
  T = new_sum / new_sample_count
/bsuscratch/alexanderemert/miniforge3/envs/starform-alex/lib/python3.14/site-packages/sklearn/utils/extmath.py:1236: RuntimeWarning: invalid value encountered in divide
  new_unnormalized_variance -= correction**2 / new_sample_count
/bsuscratch/alexanderemert/miniforge3/envs/starform-alex/lib/python3.14/site-packages/sklearn/utils/extmath.py:1207: RuntimeWarning: invalid value encountered in divide
  updated_mean = (last_sum + new_sum) / updated_sample_count
/bsuscratch/alexanderemert/miniforge3/envs/starform-alex/lib/python3.14/site-packages/sklearn/utils/extmath.py:1212: RuntimeWarning: invalid value encountered in divide
  T = new_sum / new_sample_count
/bsuscratch/alexanderemert/miniforge3/envs/starform-alex/lib/python3.14/site-packages/sklearn/utils/extmath.py:1236: RuntimeWarning: invalid value encountered in divide
  new_unnormalized_variance -= correction**2 / new_sample_count
/bsuscratch/alexanderemert/miniforge3/envs/starform-alex/lib/python3.14/site-packages/sklearn/utils/extmath.py:1207: RuntimeWarning: invalid value encountered in divide
  updated_mean = (last_sum + new_sum) / updated_sample_count
/bsuscratch/alexanderemert/miniforge3/envs/starform-alex/lib/python3.14/site-packages/sklearn/utils/extmath.py:1212: RuntimeWarning: invalid value encountered in divide
  T = new_sum / new_sample_count
/bsuscratch/alexanderemert/miniforge3/envs/starform-alex/lib/python3.14/site-packages/sklearn/utils/extmath.py:1236: RuntimeWarning: invalid value encountered in divide
  new_unnormalized_variance -= correction**2 / new_sample_count
/bsuscratch/alexanderemert/miniforge3/envs/starform-alex/lib/python3.14/site-packages/sklearn/utils/extmath.py:1207: RuntimeWarning: invalid value encountered in divide
  updated_mean = (last_sum + new_sum) / updated_sample_count
/bsuscratch/alexanderemert/miniforge3/envs/starform-alex/lib/python3.14/site-packages/sklearn/utils/extmath.py:1212: RuntimeWarning: invalid value encountered in divide
  T = new_sum / new_sample_count
/bsuscratch/alexanderemert/miniforge3/envs/starform-alex/lib/python3.14/site-packages/sklearn/utils/extmath.py:1236: RuntimeWarning: invalid value encountered in divide
  new_unnormalized_variance -= correction**2 / new_sample_count
/bsuscratch/alexanderemert/miniforge3/envs/starform-alex/lib/python3.14/site-packages/sklearn/utils/extmath.py:1207: RuntimeWarning: invalid value encountered in divide
  updated_mean = (last_sum + new_sum) / updated_sample_count
/bsuscratch/alexanderemert/miniforge3/envs/starform-alex/lib/python3.14/site-packages/sklearn/utils/extmath.py:1212: RuntimeWarning: invalid value encountered in divide
  T = new_sum / new_sample_count
/bsuscratch/alexanderemert/miniforge3/envs/starform-alex/lib/python3.14/site-packages/sklearn/utils/extmath.py:1236: RuntimeWarning: invalid value encountered in divide
  new_unnormalized_variance -= correction**2 / new_sample_count
/bsuscratch/alexanderemert/miniforge3/envs/starform-alex/lib/python3.14/site-packages/sklearn/utils/extmath.py:1207: RuntimeWarning: invalid value encountered in divide
  updated_mean = (last_sum + new_sum) / updated_sample_count
/bsuscratch/alexanderemert/miniforge3/envs/starform-alex/lib/python3.14/site-packages/sklearn/utils/extmath.py:1212: RuntimeWarning: invalid value encountered in divide
  T = new_sum / new_sample_count
/bsuscratch/alexanderemert/miniforge3/envs/starform-alex/lib/python3.14/site-packages/sklearn/utils/extmath.py:1236: RuntimeWarning: invalid value encountered in divide
  new_unnormalized_variance -= correction**2 / new_sample_count
/bsuscratch/alexanderemert/miniforge3/envs/starform-alex/lib/python3.14/site-packages/sklearn/utils/extmath.py:1207: RuntimeWarning: invalid value encountered in divide
  updated_mean = (last_sum + new_sum) / updated_sample_count
/bsuscratch/alexanderemert/miniforge3/envs/starform-alex/lib/python3.14/site-packages/sklearn/utils/extmath.py:1212: RuntimeWarning: invalid value encountered in divide
  T = new_sum / new_sample_count
/bsuscratch/alexanderemert/miniforge3/envs/starform-alex/lib/python3.14/site-packages/sklearn/utils/extmath.py:1236: RuntimeWarning: invalid value encountered in divide
  new_unnormalized_variance -= correction**2 / new_sample_count
/bsuscratch/alexanderemert/miniforge3/envs/starform-alex/lib/python3.14/site-packages/sklearn/utils/extmath.py:1207: RuntimeWarning: invalid value encountered in divide
  updated_mean = (last_sum + new_sum) / updated_sample_count
/bsuscratch/alexanderemert/miniforge3/envs/starform-alex/lib/python3.14/site-packages/sklearn/utils/extmath.py:1212: RuntimeWarning: invalid value encountered in divide
  T = new_sum / new_sample_count
/bsuscratch/alexanderemert/miniforge3/envs/starform-alex/lib/python3.14/site-packages/sklearn/utils/extmath.py:1236: RuntimeWarning: invalid value encountered in divide
  new_unnormalized_variance -= correction**2 / new_sample_count
/bsuscratch/alexanderemert/miniforge3/envs/starform-alex/lib/python3.14/site-packages/sklearn/utils/extmath.py:1207: RuntimeWarning: invalid value encountered in divide
  updated_mean = (last_sum + new_sum) / updated_sample_count
/bsuscratch/alexanderemert/miniforge3/envs/starform-alex/lib/python3.14/site-packages/sklearn/utils/extmath.py:1212: RuntimeWarning: invalid value encountered in divide
  T = new_sum / new_sample_count
/bsuscratch/alexanderemert/miniforge3/envs/starform-alex/lib/python3.14/site-packages/sklearn/utils/extmath.py:1236: RuntimeWarning: invalid value encountered in divide
  new_unnormalized_variance -= correction**2 / new_sample_count
