[I 2026-07-20 15:05:15,142] Trial 44 finished with value: -7.8069673510435225 and parameters: {'error_threshold': 3.85, 'scalers': 'none', 'ratios': 'log_ratio', 'imputers': 'median', 'n_estimators': 2650, 'learning_rate': 0.003703112338014999, 'max_depth': 4, 'min_child_weight': 10, 'subsample': 0.8, 'colsample_bytree': 0.7, 'colsample_bylevel': 1.0, 'reg_alpha': 0.11689947511062708, 'reg_lambda': 2.216378067882573e-05, 'gamma': 1.970676180629509e-05}. Best is trial 41 with value: -7.755420611753795.
/bsuhome/alexanderemert/Research/Star-Formation-Research-Project-2026/pipeline/scripts/optuna/final_preds_and_models/optuna_search_mult_quant_reg.py:161: UserWarning: The distribution is specified by [0.1, 5] and step=0.25, but the range is not divisible by `step`. It will be replaced with [0.1, 4.85].
  error_threshold = trial.suggest_float("error_threshold", 0.1, 5, step=0.25)
[I 2026-07-20 15:05:19,643] Trial 45 finished with value: -8.468492519292713 and parameters: {'error_threshold': 3.6, 'scalers': 'none', 'ratios': 'log_ratio', 'imputers': 'median', 'n_estimators': 3000, 'learning_rate': 0.00022260348458129367, 'max_depth': 4, 'min_child_weight': 10, 'subsample': 0.8, 'colsample_bytree': 0.7, 'colsample_bylevel': 1.0, 'reg_alpha': 0.15003732598065148, 'reg_lambda': 5.649220241672561e-06, 'gamma': 3.9938933247638175e-05}. Best is trial 41 with value: -7.755420611753795.
/bsuhome/alexanderemert/Research/Star-Formation-Research-Project-2026/pipeline/scripts/optuna/final_preds_and_models/optuna_search_mult_quant_reg.py:161: UserWarning: The distribution is specified by [0.1, 5] and step=0.25, but the range is not divisible by `step`. It will be replaced with [0.1, 4.85].
  error_threshold = trial.suggest_float("error_threshold", 0.1, 5, step=0.25)
[I 2026-07-20 15:05:22,665] Trial 46 finished with value: -7.84322557359021 and parameters: {'error_threshold': 4.35, 'scalers': 'none', 'ratios': 'log_ratio', 'imputers': 'median', 'n_estimators': 2650, 'learning_rate': 0.005802136598119596, 'max_depth': 4, 'min_child_weight': 10, 'subsample': 0.8, 'colsample_bytree': 0.7, 'colsample_bylevel': 1.0, 'reg_alpha': 0.026858686682485533, 'reg_lambda': 3.830439870497794e-06, 'gamma': 2.1031273045655438e-06}. Best is trial 41 with value: -7.755420611753795.
/bsuhome/alexanderemert/Research/Star-Formation-Research-Project-2026/pipeline/scripts/optuna/final_preds_and_models/optuna_search_mult_quant_reg.py:161: UserWarning: The distribution is specified by [0.1, 5] and step=0.25, but the range is not divisible by `step`. It will be replaced with [0.1, 4.85].
  error_threshold = trial.suggest_float("error_threshold", 0.1, 5, step=0.25)
[I 2026-07-20 15:05:27,014] Trial 47 finished with value: -8.528872422567622 and parameters: {'error_threshold': 4.35, 'scalers': 'none', 'ratios': 'log_ratio', 'imputers': 'median', 'n_estimators': 3000, 'learning_rate': 0.00028227614186320974, 'max_depth': 4, 'min_child_weight': 10, 'subsample': 0.8, 'colsample_bytree': 0.7, 'colsample_bylevel': 1.0, 'reg_alpha': 0.3010571675333018, 'reg_lambda': 81.19524197841456, 'gamma': 5.215125821267249e-05}. Best is trial 41 with value: -7.755420611753795.
/bsuhome/alexanderemert/Research/Star-Formation-Research-Project-2026/pipeline/scripts/optuna/final_preds_and_models/optuna_search_mult_quant_reg.py:161: UserWarning: The distribution is specified by [0.1, 5] and step=0.25, but the range is not divisible by `step`. It will be replaced with [0.1, 4.85].
  error_threshold = trial.suggest_float("error_threshold", 0.1, 5, step=0.25)
[I 2026-07-20 15:05:30,393] Trial 48 finished with value: -7.784670318273856 and parameters: {'error_threshold': 3.35, 'scalers': 'none', 'ratios': 'log_ratio', 'imputers': 'median', 'n_estimators': 3000, 'learning_rate': 0.0024556573857766753, 'max_depth': 4, 'min_child_weight': 10, 'subsample': 0.8, 'colsample_bytree': 0.7, 'colsample_bylevel': 0.9, 'reg_alpha': 0.3178198107085235, 'reg_lambda': 5.236549757099196e-06, 'gamma': 5.1393675179910835e-05}. Best is trial 41 with value: -7.755420611753795.
/bsuhome/alexanderemert/Research/Star-Formation-Research-Project-2026/pipeline/scripts/optuna/final_preds_and_models/optuna_search_mult_quant_reg.py:161: UserWarning: The distribution is specified by [0.1, 5] and step=0.25, but the range is not divisible by `step`. It will be replaced with [0.1, 4.85].
  error_threshold = trial.suggest_float("error_threshold", 0.1, 5, step=0.25)
[I 2026-07-20 15:05:33,578] Trial 49 finished with value: -7.747929139256562 and parameters: {'error_threshold': 4.35, 'scalers': 'none', 'ratios': 'log_ratio', 'imputers': 'median', 'n_estimators': 2750, 'learning_rate': 0.0025203705055633265, 'max_depth': 4, 'min_child_weight': 10, 'subsample': 0.5, 'colsample_bytree': 0.7, 'colsample_bylevel': 1.0, 'reg_alpha': 0.02326823724416715, 'reg_lambda': 3.470653249405438e-06, 'gamma': 1.0156079426506963e-06}. Best is trial 49 with value: -7.747929139256562.
/bsuhome/alexanderemert/Research/Star-Formation-Research-Project-2026/pipeline/scripts/optuna/final_preds_and_models/optuna_search_mult_quant_reg.py:161: UserWarning: The distribution is specified by [0.1, 5] and step=0.25, but the range is not divisible by `step`. It will be replaced with [0.1, 4.85].
  error_threshold = trial.suggest_float("error_threshold", 0.1, 5, step=0.25)
[I 2026-07-20 15:05:37,261] Trial 50 finished with value: -7.757605375117824 and parameters: {'error_threshold': 4.35, 'scalers': 'none', 'ratios': 'log_ratio', 'imputers': 'median', 'n_estimators': 2800, 'learning_rate': 0.0028253902726163033, 'max_depth': 4, 'min_child_weight': 10, 'subsample': 0.8, 'colsample_bytree': 0.7, 'colsample_bylevel': 1.0, 'reg_alpha': 0.024314808648343633, 'reg_lambda': 84.6036692057396, 'gamma': 3.737581288255417e-05}. Best is trial 49 with value: -7.747929139256562.
/bsuhome/alexanderemert/Research/Star-Formation-Research-Project-2026/pipeline/scripts/optuna/final_preds_and_models/optuna_search_mult_quant_reg.py:161: UserWarning: The distribution is specified by [0.1, 5] and step=0.25, but the range is not divisible by `step`. It will be replaced with [0.1, 4.85].
  error_threshold = trial.suggest_float("error_threshold", 0.1, 5, step=0.25)
[I 2026-07-20 15:05:40,980] Trial 51 finished with value: -8.606489967408537 and parameters: {'error_threshold': 4.35, 'scalers': 'none', 'ratios': 'log_ratio', 'imputers': 'median', 'n_estimators': 2750, 'learning_rate': 0.00027055636179411634, 'max_depth': 4, 'min_child_weight': 10, 'subsample': 0.8, 'colsample_bytree': 0.7, 'colsample_bylevel': 0.9, 'reg_alpha': 0.02279214943581582, 'reg_lambda': 67.77154532031308, 'gamma': 1.1615415822199453e-06}. Best is trial 49 with value: -7.747929139256562.
/bsuhome/alexanderemert/Research/Star-Formation-Research-Project-2026/pipeline/scripts/optuna/final_preds_and_models/optuna_search_mult_quant_reg.py:161: UserWarning: The distribution is specified by [0.1, 5] and step=0.25, but the range is not divisible by `step`. It will be replaced with [0.1, 4.85].
  error_threshold = trial.suggest_float("error_threshold", 0.1, 5, step=0.25)
[I 2026-07-20 15:05:46,685] Trial 52 finished with value: -8.5944070137089 and parameters: {'error_threshold': 4.35, 'scalers': 'none', 'ratios': 'log_ratio', 'imputers': 'median', 'n_estimators': 2800, 'learning_rate': 0.00019580723010132272, 'max_depth': 5, 'min_child_weight': 6, 'subsample': 0.5, 'colsample_bytree': 0.7, 'colsample_bylevel': 0.9, 'reg_alpha': 0.015513449088202083, 'reg_lambda': 5.375725079073018e-06, 'gamma': 1.3270082805776563e-06}. Best is trial 49 with value: -7.747929139256562.
/bsuhome/alexanderemert/Research/Star-Formation-Research-Project-2026/pipeline/scripts/optuna/final_preds_and_models/optuna_search_mult_quant_reg.py:161: UserWarning: The distribution is specified by [0.1, 5] and step=0.25, but the range is not divisible by `step`. It will be replaced with [0.1, 4.85].
  error_threshold = trial.suggest_float("error_threshold", 0.1, 5, step=0.25)
[I 2026-07-20 15:05:53,798] Trial 53 finished with value: -7.891154616228609 and parameters: {'error_threshold': 4.35, 'scalers': 'none', 'ratios': 'log_ratio', 'imputers': 'median', 'n_estimators': 2800, 'learning_rate': 0.006723343824124939, 'max_depth': 5, 'min_child_weight': 1, 'subsample': 0.5, 'colsample_bytree': 0.9, 'colsample_bylevel': 0.9, 'reg_alpha': 0.01854565426434544, 'reg_lambda': 19.787416457642472, 'gamma': 1.2054696423512099e-06}. Best is trial 49 with value: -7.747929139256562.
/bsuhome/alexanderemert/Research/Star-Formation-Research-Project-2026/pipeline/scripts/optuna/final_preds_and_models/optuna_search_mult_quant_reg.py:161: UserWarning: The distribution is specified by [0.1, 5] and step=0.25, but the range is not divisible by `step`. It will be replaced with [0.1, 4.85].
  error_threshold = trial.suggest_float("error_threshold", 0.1, 5, step=0.25)
[I 2026-07-20 15:05:58,421] Trial 54 finished with value: -7.797470240781794 and parameters: {'error_threshold': 3.35, 'scalers': 'standard', 'ratios': 'log_ratio', 'imputers': 'median', 'n_estimators': 2000, 'learning_rate': 0.0023080068917006634, 'max_depth': 5, 'min_child_weight': 6, 'subsample': 1.0, 'colsample_bytree': 0.9, 'colsample_bylevel': 0.9, 'reg_alpha': 0.0004838019616165424, 'reg_lambda': 47.79204522384018, 'gamma': 0.013403290169744748}. Best is trial 49 with value: -7.747929139256562.
/bsuhome/alexanderemert/Research/Star-Formation-Research-Project-2026/pipeline/scripts/optuna/final_preds_and_models/optuna_search_mult_quant_reg.py:161: UserWarning: The distribution is specified by [0.1, 5] and step=0.25, but the range is not divisible by `step`. It will be replaced with [0.1, 4.85].
  error_threshold = trial.suggest_float("error_threshold", 0.1, 5, step=0.25)
[I 2026-07-20 15:06:03,595] Trial 55 finished with value: -7.822331217878307 and parameters: {'error_threshold': 3.35, 'scalers': 'standard', 'ratios': 'log_ratio', 'imputers': 'median', 'n_estimators': 2000, 'learning_rate': 0.0023002112459038545, 'max_depth': 5, 'min_child_weight': 1, 'subsample': 1.0, 'colsample_bytree': 0.9, 'colsample_bylevel': 0.9, 'reg_alpha': 0.0004457045808501552, 'reg_lambda': 10.86355636936378, 'gamma': 0.004081509799809302}. Best is trial 49 with value: -7.747929139256562.
/bsuhome/alexanderemert/Research/Star-Formation-Research-Project-2026/pipeline/scripts/optuna/final_preds_and_models/optuna_search_mult_quant_reg.py:161: UserWarning: The distribution is specified by [0.1, 5] and step=0.25, but the range is not divisible by `step`. It will be replaced with [0.1, 4.85].
  error_threshold = trial.suggest_float("error_threshold", 0.1, 5, step=0.25)
[I 2026-07-20 15:06:07,534] Trial 56 finished with value: -7.78129418631525 and parameters: {'error_threshold': 4.85, 'scalers': 'standard', 'ratios': 'log_ratio', 'imputers': 'median', 'n_estimators': 1850, 'learning_rate': 0.0024465677346322367, 'max_depth': 5, 'min_child_weight': 10, 'subsample': 0.9, 'colsample_bytree': 0.9, 'colsample_bylevel': 0.9, 'reg_alpha': 0.35390938817861994, 'reg_lambda': 17.7362821812597, 'gamma': 4.4119220363353886e-06}. Best is trial 49 with value: -7.747929139256562.
/bsuhome/alexanderemert/Research/Star-Formation-Research-Project-2026/pipeline/scripts/optuna/final_preds_and_models/optuna_search_mult_quant_reg.py:161: UserWarning: The distribution is specified by [0.1, 5] and step=0.25, but the range is not divisible by `step`. It will be replaced with [0.1, 4.85].
  error_threshold = trial.suggest_float("error_threshold", 0.1, 5, step=0.25)
[I 2026-07-20 15:06:10,981] Trial 57 finished with value: -7.912458066097593 and parameters: {'error_threshold': 4.6, 'scalers': 'standard', 'ratios': 'log_ratio', 'imputers': 'median', 'n_estimators': 2400, 'learning_rate': 0.009032420507478087, 'max_depth': 5, 'min_child_weight': 8, 'subsample': 0.5, 'colsample_bytree': 0.9, 'colsample_bylevel': 0.6, 'reg_alpha': 0.00039610024564398045, 'reg_lambda': 7.458327260314306, 'gamma': 4.545196162307994e-06}. Best is trial 49 with value: -7.747929139256562.
/bsuhome/alexanderemert/Research/Star-Formation-Research-Project-2026/pipeline/scripts/optuna/final_preds_and_models/optuna_search_mult_quant_reg.py:161: UserWarning: The distribution is specified by [0.1, 5] and step=0.25, but the range is not divisible by `step`. It will be replaced with [0.1, 4.85].
  error_threshold = trial.suggest_float("error_threshold", 0.1, 5, step=0.25)
[I 2026-07-20 15:06:14,608] Trial 58 finished with value: -7.8992638634309245 and parameters: {'error_threshold': 4.6, 'scalers': 'standard', 'ratios': 'log_ratio', 'imputers': 'median', 'n_estimators': 2850, 'learning_rate': 0.0095304931151519, 'max_depth': 5, 'min_child_weight': 10, 'subsample': 1.0, 'colsample_bytree': 0.6, 'colsample_bylevel': 0.9, 'reg_alpha': 0.02207682237685785, 'reg_lambda': 19.25938543978752, 'gamma': 5.2917735062245435e-06}. Best is trial 49 with value: -7.747929139256562.
/bsuhome/alexanderemert/Research/Star-Formation-Research-Project-2026/pipeline/scripts/optuna/final_preds_and_models/optuna_search_mult_quant_reg.py:161: UserWarning: The distribution is specified by [0.1, 5] and step=0.25, but the range is not divisible by `step`. It will be replaced with [0.1, 4.85].
  error_threshold = trial.suggest_float("error_threshold", 0.1, 5, step=0.25)
[I 2026-07-20 15:06:18,775] Trial 59 finished with value: -7.779864424843303 and parameters: {'error_threshold': 4.85, 'scalers': 'standard', 'ratios': 'log_ratio', 'imputers': 'median', 'n_estimators': 2850, 'learning_rate': 0.00252534815266333, 'max_depth': 5, 'min_child_weight': 9, 'subsample': 1.0, 'colsample_bytree': 0.6, 'colsample_bylevel': 0.9, 'reg_alpha': 0.0009906805007995642, 'reg_lambda': 22.082970085052445, 'gamma': 4.76428453977431e-06}. Best is trial 49 with value: -7.747929139256562.
/bsuhome/alexanderemert/Research/Star-Formation-Research-Project-2026/pipeline/scripts/optuna/final_preds_and_models/optuna_search_mult_quant_reg.py:161: UserWarning: The distribution is specified by [0.1, 5] and step=0.25, but the range is not divisible by `step`. It will be replaced with [0.1, 4.85].
  error_threshold = trial.suggest_float("error_threshold", 0.1, 5, step=0.25)
[I 2026-07-20 15:06:21,215] Trial 60 finished with value: -7.84130159186827 and parameters: {'error_threshold': 4.85, 'scalers': 'standard', 'ratios': 'log_ratio', 'imputers': 'median', 'n_estimators': 2400, 'learning_rate': 0.009178487367049014, 'max_depth': 5, 'min_child_weight': 9, 'subsample': 1.0, 'colsample_bytree': 0.6, 'colsample_bylevel': 0.6, 'reg_alpha': 0.0018602919204579944, 'reg_lambda': 19.28137068252201, 'gamma': 5.064031444162505e-06}. Best is trial 49 with value: -7.747929139256562.
/bsuhome/alexanderemert/Research/Star-Formation-Research-Project-2026/pipeline/scripts/optuna/final_preds_and_models/optuna_search_mult_quant_reg.py:161: UserWarning: The distribution is specified by [0.1, 5] and step=0.25, but the range is not divisible by `step`. It will be replaced with [0.1, 4.85].
  error_threshold = trial.suggest_float("error_threshold", 0.1, 5, step=0.25)
[I 2026-07-20 15:06:24,217] Trial 61 finished with value: -7.760729068847426 and parameters: {'error_threshold': 4.85, 'scalers': 'standard', 'ratios': 'log_ratio', 'imputers': 'median', 'n_estimators': 2450, 'learning_rate': 0.0023712210192467767, 'max_depth': 5, 'min_child_weight': 9, 'subsample': 1.0, 'colsample_bytree': 0.6, 'colsample_bylevel': 0.6, 'reg_alpha': 0.0013369432566513182, 'reg_lambda': 21.815394543707352, 'gamma': 6.4074837573473414e-06}. Best is trial 49 with value: -7.747929139256562.
/bsuhome/alexanderemert/Research/Star-Formation-Research-Project-2026/pipeline/scripts/optuna/final_preds_and_models/optuna_search_mult_quant_reg.py:161: UserWarning: The distribution is specified by [0.1, 5] and step=0.25, but the range is not divisible by `step`. It will be replaced with [0.1, 4.85].
  error_threshold = trial.suggest_float("error_threshold", 0.1, 5, step=0.25)
[I 2026-07-20 15:06:27,642] Trial 62 finished with value: -7.966825231645053 and parameters: {'error_threshold': 4.85, 'scalers': 'standard', 'ratios': 'log_ratio', 'imputers': 'median', 'n_estimators': 2400, 'learning_rate': 0.008732810915323646, 'max_depth': 5, 'min_child_weight': 8, 'subsample': 0.9, 'colsample_bytree': 0.9, 'colsample_bylevel': 0.6, 'reg_alpha': 0.0010118767334618705, 'reg_lambda': 4.908555895099134, 'gamma': 5.992258529218352e-06}. Best is trial 49 with value: -7.747929139256562.
/bsuhome/alexanderemert/Research/Star-Formation-Research-Project-2026/pipeline/scripts/optuna/final_preds_and_models/optuna_search_mult_quant_reg.py:161: UserWarning: The distribution is specified by [0.1, 5] and step=0.25, but the range is not divisible by `step`. It will be replaced with [0.1, 4.85].
  error_threshold = trial.suggest_float("error_threshold", 0.1, 5, step=0.25)
[I 2026-07-20 15:06:30,383] Trial 63 finished with value: -8.002683495005774 and parameters: {'error_threshold': 4.85, 'scalers': 'none', 'ratios': 'log_ratio', 'imputers': 'median', 'n_estimators': 2400, 'learning_rate': 0.010346407123115905, 'max_depth': 5, 'min_child_weight': 8, 'subsample': 0.9, 'colsample_bytree': 0.6, 'colsample_bylevel': 0.6, 'reg_alpha': 0.0011337808121389206, 'reg_lambda': 6.101946241310087e-05, 'gamma': 1.0447451540622686e-05}. Best is trial 49 with value: -7.747929139256562.
/bsuhome/alexanderemert/Research/Star-Formation-Research-Project-2026/pipeline/scripts/optuna/final_preds_and_models/optuna_search_mult_quant_reg.py:161: UserWarning: The distribution is specified by [0.1, 5] and step=0.25, but the range is not divisible by `step`. It will be replaced with [0.1, 4.85].
  error_threshold = trial.suggest_float("error_threshold", 0.1, 5, step=0.25)
[I 2026-07-20 15:06:34,250] Trial 64 finished with value: -8.040206355372051 and parameters: {'error_threshold': 4.85, 'scalers': 'standard', 'ratios': 'log_ratio', 'imputers': 'median', 'n_estimators': 2450, 'learning_rate': 0.013220578934657013, 'max_depth': 5, 'min_child_weight': 10, 'subsample': 0.9, 'colsample_bytree': 0.6, 'colsample_bylevel': 1.0, 'reg_alpha': 5.061485241204242, 'reg_lambda': 5.60806026921847, 'gamma': 6.201659649004817e-06}. Best is trial 49 with value: -7.747929139256562.
/bsuhome/alexanderemert/Research/Star-Formation-Research-Project-2026/pipeline/scripts/optuna/final_preds_and_models/optuna_search_mult_quant_reg.py:161: UserWarning: The distribution is specified by [0.1, 5] and step=0.25, but the range is not divisible by `step`. It will be replaced with [0.1, 4.85].
  error_threshold = trial.suggest_float("error_threshold", 0.1, 5, step=0.25)
[I 2026-07-20 15:06:36,884] Trial 65 finished with value: -7.9424469622951195 and parameters: {'error_threshold': 4.85, 'scalers': 'standard', 'ratios': 'log_ratio', 'imputers': 'median', 'n_estimators': 2300, 'learning_rate': 0.012219747708616878, 'max_depth': 4, 'min_child_weight': 10, 'subsample': 0.9, 'colsample_bytree': 0.6, 'colsample_bylevel': 1.0, 'reg_alpha': 17.521284534523637, 'reg_lambda': 5.5562065178755455, 'gamma': 5.6567161830810826e-06}. Best is trial 49 with value: -7.747929139256562.
/bsuhome/alexanderemert/Research/Star-Formation-Research-Project-2026/pipeline/scripts/optuna/final_preds_and_models/optuna_search_mult_quant_reg.py:161: UserWarning: The distribution is specified by [0.1, 5] and step=0.25, but the range is not divisible by `step`. It will be replaced with [0.1, 4.85].
  error_threshold = trial.suggest_float("error_threshold", 0.1, 5, step=0.25)
[I 2026-07-20 15:06:42,477] Trial 66 finished with value: -7.9169814143285615 and parameters: {'error_threshold': 4.85, 'scalers': 'standard', 'ratios': 'log_ratio', 'imputers': 'median', 'n_estimators': 2450, 'learning_rate': 0.005161409169882456, 'max_depth': 6, 'min_child_weight': 10, 'subsample': 0.9, 'colsample_bytree': 0.6, 'colsample_bylevel': 1.0, 'reg_alpha': 12.559078001859064, 'reg_lambda': 3.3738038424832664, 'gamma': 1.0583318259943088e-05}. Best is trial 49 with value: -7.747929139256562.
/bsuhome/alexanderemert/Research/Star-Formation-Research-Project-2026/pipeline/scripts/optuna/final_preds_and_models/optuna_search_mult_quant_reg.py:161: UserWarning: The distribution is specified by [0.1, 5] and step=0.25, but the range is not divisible by `step`. It will be replaced with [0.1, 4.85].
  error_threshold = trial.suggest_float("error_threshold", 0.1, 5, step=0.25)
[I 2026-07-20 15:06:47,374] Trial 67 finished with value: -7.929048040335037 and parameters: {'error_threshold': 4.85, 'scalers': 'standard', 'ratios': 'log_ratio', 'imputers': 'median', 'n_estimators': 2300, 'learning_rate': 0.0057271334482517046, 'max_depth': 6, 'min_child_weight': 8, 'subsample': 0.9, 'colsample_bytree': 0.6, 'colsample_bylevel': 1.0, 'reg_alpha': 0.008449292887654326, 'reg_lambda': 4.523373049880215, 'gamma': 1.2214336973666119e-05}. Best is trial 49 with value: -7.747929139256562.
/bsuhome/alexanderemert/Research/Star-Formation-Research-Project-2026/pipeline/scripts/optuna/final_preds_and_models/optuna_search_mult_quant_reg.py:161: UserWarning: The distribution is specified by [0.1, 5] and step=0.25, but the range is not divisible by `step`. It will be replaced with [0.1, 4.85].
  error_threshold = trial.suggest_float("error_threshold", 0.1, 5, step=0.25)
