[I 2026-07-20 12:32:58,101] Trial 313 finished with value: -0.2987650040422501 and parameters: {'error_threshold': 1.0, 'scalers': 'none', 'ratios': 'norm_ratio', 'imputers': 'mean', 'n_estimators': 500, 'learning_rate': 0.18678157298165587, 'max_depth': 11, 'min_child_weight': 4, 'subsample': 0.7, 'colsample_bytree': 0.8, 'colsample_bylevel': 0.7, 'reg_alpha': 52.60338989127636, 'reg_lambda': 7.751186938540079, 'gamma': 45.87334213637452}. Best is trial 69 with value: -0.3911874830873789.
[I 2026-07-20 12:33:01,616] Trial 316 finished with value: -0.28956108720612284 and parameters: {'error_threshold': 1.0, 'scalers': 'none', 'ratios': 'norm_ratio', 'imputers': 'mean', 'n_estimators': 700, 'learning_rate': 0.17988945075341883, 'max_depth': 11, 'min_child_weight': 4, 'subsample': 0.7, 'colsample_bytree': 0.9, 'colsample_bylevel': 1.0, 'reg_alpha': 31.17370135371718, 'reg_lambda': 7.112539754525311, 'gamma': 51.77833378995455}. Best is trial 69 with value: -0.3911874830873789.
[I 2026-07-20 12:33:01,968] Trial 317 finished with value: -0.30048385271459194 and parameters: {'error_threshold': 3.0, 'scalers': 'none', 'ratios': 'norm_ratio', 'imputers': 'mean', 'n_estimators': 500, 'learning_rate': 0.18841314468229253, 'max_depth': 11, 'min_child_weight': 4, 'subsample': 0.7, 'colsample_bytree': 0.9, 'colsample_bylevel': 0.6, 'reg_alpha': 30.376585589433436, 'reg_lambda': 6.668702739874175, 'gamma': 61.49068220401623}. Best is trial 69 with value: -0.3911874830873789.
[I 2026-07-20 12:33:02,155] Trial 318 finished with value: -0.2872553950702645 and parameters: {'error_threshold': 4.75, 'scalers': 'none', 'ratios': 'norm_ratio', 'imputers': 'mean', 'n_estimators': 300, 'learning_rate': 0.19372243933633426, 'max_depth': 11, 'min_child_weight': 4, 'subsample': 0.7, 'colsample_bytree': 0.9, 'colsample_bylevel': 1.0, 'reg_alpha': 30.90791213324756, 'reg_lambda': 7.8265729086032, 'gamma': 52.19853088412597}. Best is trial 69 with value: -0.3911874830873789.
[I 2026-07-20 12:33:02,353] Trial 319 finished with value: -0.29658796430363715 and parameters: {'error_threshold': 1.0, 'scalers': 'none', 'ratios': 'norm_ratio', 'imputers': 'mean', 'n_estimators': 300, 'learning_rate': 0.05300843129295274, 'max_depth': 11, 'min_child_weight': 4, 'subsample': 0.7, 'colsample_bytree': 0.9, 'colsample_bylevel': 1.0, 'reg_alpha': 30.09662733505932, 'reg_lambda': 0.7613272000409205, 'gamma': 52.82487477475146}. Best is trial 69 with value: -0.3911874830873789.
