[I 2026-07-20 17:52:17,803] Trial 288 finished with value: -1.593135867833583 and parameters: {'error_threshold': 4.1, 'scalers': 'standard', 'ratios': 'norm_ratio', 'imputers': 'mean', 'n_estimators': 2150, 'learning_rate': 0.20628326717341025, 'max_depth': 12, 'min_child_weight': 1, 'subsample': 0.7, 'colsample_bytree': 0.5, 'colsample_bylevel': 1.0, 'reg_alpha': 9.85805889806006e-06, 'reg_lambda': 27.945317990531667, 'gamma': 0.00016616716379303084}. Best is trial 209 with value: -2.117388370040747.
/bsuhome/alexanderemert/Research/Star-Formation-Research-Project-2026/pipeline/scripts/optuna/final_preds_and_models/optuna_search_mult_quant_reg.py:75: UserWarning: The distribution is specified by [0.1, 5] and step=0.25, but the range is not divisible by `step`. It will be replaced with [0.1, 4.85].
  error_threshold = trial.suggest_float("error_threshold", 0.1, 5, step=0.25)
[I 2026-07-20 17:52:28,179] Trial 289 finished with value: -1.6167230734152838 and parameters: {'error_threshold': 3.85, 'scalers': 'standard', 'ratios': 'norm_ratio', 'imputers': 'mean', 'n_estimators': 2100, 'learning_rate': 0.2113946060829562, 'max_depth': 12, 'min_child_weight': 1, 'subsample': 0.7, 'colsample_bytree': 0.5, 'colsample_bylevel': 1.0, 'reg_alpha': 1.0688303407267694e-05, 'reg_lambda': 26.675411949948472, 'gamma': 0.00013814470943408912}. Best is trial 209 with value: -2.117388370040747.
/bsuhome/alexanderemert/Research/Star-Formation-Research-Project-2026/pipeline/scripts/optuna/final_preds_and_models/optuna_search_mult_quant_reg.py:75: UserWarning: The distribution is specified by [0.1, 5] and step=0.25, but the range is not divisible by `step`. It will be replaced with [0.1, 4.85].
  error_threshold = trial.suggest_float("error_threshold", 0.1, 5, step=0.25)
[I 2026-07-20 17:56:38,784] Trial 292 finished with value: -1.3920250005896604 and parameters: {'error_threshold': 3.85, 'scalers': 'standard', 'ratios': 'norm_ratio', 'imputers': 'mean', 'n_estimators': 2050, 'learning_rate': 0.21553162899901096, 'max_depth': 8, 'min_child_weight': 1, 'subsample': 0.7, 'colsample_bytree': 0.5, 'colsample_bylevel': 1.0, 'reg_alpha': 1.0905486329330358e-05, 'reg_lambda': 28.485484829516626, 'gamma': 0.00014376916721839774}. Best is trial 209 with value: -2.117388370040747.
/bsuhome/alexanderemert/Research/Star-Formation-Research-Project-2026/pipeline/scripts/optuna/final_preds_and_models/optuna_search_mult_quant_reg.py:75: UserWarning: The distribution is specified by [0.1, 5] and step=0.25, but the range is not divisible by `step`. It will be replaced with [0.1, 4.85].
  error_threshold = trial.suggest_float("error_threshold", 0.1, 5, step=0.25)
[I 2026-07-20 17:57:50,386] Trial 290 finished with value: -1.6237154456609526 and parameters: {'error_threshold': 3.85, 'scalers': 'none', 'ratios': 'norm_ratio', 'imputers': 'mean', 'n_estimators': 2050, 'learning_rate': 0.21859766677137443, 'max_depth': 12, 'min_child_weight': 1, 'subsample': 0.7, 'colsample_bytree': 0.5, 'colsample_bylevel': 1.0, 'reg_alpha': 1.1020533847854657e-05, 'reg_lambda': 25.675337537557354, 'gamma': 0.00014451152896483968}. Best is trial 209 with value: -2.117388370040747.
/bsuhome/alexanderemert/Research/Star-Formation-Research-Project-2026/pipeline/scripts/optuna/final_preds_and_models/optuna_search_mult_quant_reg.py:75: UserWarning: The distribution is specified by [0.1, 5] and step=0.25, but the range is not divisible by `step`. It will be replaced with [0.1, 4.85].
  error_threshold = trial.suggest_float("error_threshold", 0.1, 5, step=0.25)
[I 2026-07-20 17:58:00,017] Trial 291 finished with value: -1.623976384424594 and parameters: {'error_threshold': 4.1, 'scalers': 'standard', 'ratios': 'norm_ratio', 'imputers': 'mean', 'n_estimators': 2000, 'learning_rate': 0.20622710840412417, 'max_depth': 12, 'min_child_weight': 1, 'subsample': 0.7, 'colsample_bytree': 0.5, 'colsample_bylevel': 1.0, 'reg_alpha': 1.0870777212822488e-05, 'reg_lambda': 30.137160657904488, 'gamma': 0.00013418572571342294}. Best is trial 209 with value: -2.117388370040747.
/bsuhome/alexanderemert/Research/Star-Formation-Research-Project-2026/pipeline/scripts/optuna/final_preds_and_models/optuna_search_mult_quant_reg.py:75: UserWarning: The distribution is specified by [0.1, 5] and step=0.25, but the range is not divisible by `step`. It will be replaced with [0.1, 4.85].
  error_threshold = trial.suggest_float("error_threshold", 0.1, 5, step=0.25)
[I 2026-07-20 17:58:10,231] Trial 293 finished with value: -1.5902501928438906 and parameters: {'error_threshold': 3.85, 'scalers': 'standard', 'ratios': 'norm_ratio', 'imputers': 'mean', 'n_estimators': 2050, 'learning_rate': 0.21588563424636528, 'max_depth': 12, 'min_child_weight': 1, 'subsample': 0.7, 'colsample_bytree': 0.5, 'colsample_bylevel': 1.0, 'reg_alpha': 1.4683437051804659e-05, 'reg_lambda': 27.06946850297702, 'gamma': 0.00014053003262793392}. Best is trial 209 with value: -2.117388370040747.
/bsuhome/alexanderemert/Research/Star-Formation-Research-Project-2026/pipeline/scripts/optuna/final_preds_and_models/optuna_search_mult_quant_reg.py:75: UserWarning: The distribution is specified by [0.1, 5] and step=0.25, but the range is not divisible by `step`. It will be replaced with [0.1, 4.85].
  error_threshold = trial.suggest_float("error_threshold", 0.1, 5, step=0.25)
[I 2026-07-20 17:58:19,956] Trial 294 finished with value: -1.621975326790058 and parameters: {'error_threshold': 3.85, 'scalers': 'standard', 'ratios': 'norm_ratio', 'imputers': 'mean', 'n_estimators': 2000, 'learning_rate': 0.2183642811535684, 'max_depth': 12, 'min_child_weight': 1, 'subsample': 0.7, 'colsample_bytree': 0.5, 'colsample_bylevel': 1.0, 'reg_alpha': 1.1591294619972834e-05, 'reg_lambda': 28.132873412672122, 'gamma': 0.0001398243339675086}. Best is trial 209 with value: -2.117388370040747.
/bsuhome/alexanderemert/Research/Star-Formation-Research-Project-2026/pipeline/scripts/optuna/final_preds_and_models/optuna_search_mult_quant_reg.py:75: UserWarning: The distribution is specified by [0.1, 5] and step=0.25, but the range is not divisible by `step`. It will be replaced with [0.1, 4.85].
  error_threshold = trial.suggest_float("error_threshold", 0.1, 5, step=0.25)
[I 2026-07-20 17:58:30,191] Trial 295 finished with value: -1.600767996339904 and parameters: {'error_threshold': 3.85, 'scalers': 'standard', 'ratios': 'norm_ratio', 'imputers': 'mean', 'n_estimators': 2000, 'learning_rate': 0.2161068396826097, 'max_depth': 12, 'min_child_weight': 1, 'subsample': 0.7, 'colsample_bytree': 0.5, 'colsample_bylevel': 1.0, 'reg_alpha': 9.337784331958746e-06, 'reg_lambda': 28.69359353211727, 'gamma': 0.00013081885180593565}. Best is trial 209 with value: -2.117388370040747.
/bsuhome/alexanderemert/Research/Star-Formation-Research-Project-2026/pipeline/scripts/optuna/final_preds_and_models/optuna_search_mult_quant_reg.py:75: UserWarning: The distribution is specified by [0.1, 5] and step=0.25, but the range is not divisible by `step`. It will be replaced with [0.1, 4.85].
  error_threshold = trial.suggest_float("error_threshold", 0.1, 5, step=0.25)
[I 2026-07-20 17:58:51,612] Trial 296 finished with value: -1.613162756137804 and parameters: {'error_threshold': 3.85, 'scalers': 'standard', 'ratios': 'norm_ratio', 'imputers': 'mean', 'n_estimators': 2050, 'learning_rate': 0.21865510989429782, 'max_depth': 12, 'min_child_weight': 1, 'subsample': 0.7, 'colsample_bytree': 0.5, 'colsample_bylevel': 1.0, 'reg_alpha': 1.0541439832819526e-05, 'reg_lambda': 28.68922280081293, 'gamma': 0.00014521427808109999}. Best is trial 209 with value: -2.117388370040747.
/bsuhome/alexanderemert/Research/Star-Formation-Research-Project-2026/pipeline/scripts/optuna/final_preds_and_models/optuna_search_mult_quant_reg.py:75: UserWarning: The distribution is specified by [0.1, 5] and step=0.25, but the range is not divisible by `step`. It will be replaced with [0.1, 4.85].
  error_threshold = trial.suggest_float("error_threshold", 0.1, 5, step=0.25)
[I 2026-07-20 17:59:01,739] Trial 297 finished with value: -1.5755230753914287 and parameters: {'error_threshold': 3.85, 'scalers': 'standard', 'ratios': 'norm_ratio', 'imputers': 'mean', 'n_estimators': 2000, 'learning_rate': 0.21006949204978256, 'max_depth': 12, 'min_child_weight': 1, 'subsample': 0.7, 'colsample_bytree': 0.5, 'colsample_bylevel': 1.0, 'reg_alpha': 8.734327194455179e-06, 'reg_lambda': 29.076202026050073, 'gamma': 0.00014880769612844632}. Best is trial 209 with value: -2.117388370040747.
/bsuhome/alexanderemert/Research/Star-Formation-Research-Project-2026/pipeline/scripts/optuna/final_preds_and_models/optuna_search_mult_quant_reg.py:75: UserWarning: The distribution is specified by [0.1, 5] and step=0.25, but the range is not divisible by `step`. It will be replaced with [0.1, 4.85].
  error_threshold = trial.suggest_float("error_threshold", 0.1, 5, step=0.25)
[I 2026-07-20 18:04:25,772] Trial 298 finished with value: -1.628112203442577 and parameters: {'error_threshold': 3.85, 'scalers': 'standard', 'ratios': 'norm_ratio', 'imputers': 'mean', 'n_estimators': 2000, 'learning_rate': 0.2202822076281156, 'max_depth': 12, 'min_child_weight': 1, 'subsample': 0.7, 'colsample_bytree': 0.5, 'colsample_bylevel': 1.0, 'reg_alpha': 8.352340505057876e-06, 'reg_lambda': 29.717382858429318, 'gamma': 0.00013629879539113368}. Best is trial 209 with value: -2.117388370040747.
/bsuhome/alexanderemert/Research/Star-Formation-Research-Project-2026/pipeline/scripts/optuna/final_preds_and_models/optuna_search_mult_quant_reg.py:75: UserWarning: The distribution is specified by [0.1, 5] and step=0.25, but the range is not divisible by `step`. It will be replaced with [0.1, 4.85].
  error_threshold = trial.suggest_float("error_threshold", 0.1, 5, step=0.25)
[I 2026-07-20 18:04:35,746] Trial 299 finished with value: -1.6394352026083538 and parameters: {'error_threshold': 3.85, 'scalers': 'standard', 'ratios': 'norm_ratio', 'imputers': 'mean', 'n_estimators': 2000, 'learning_rate': 0.22360428145409006, 'max_depth': 12, 'min_child_weight': 1, 'subsample': 0.7, 'colsample_bytree': 0.5, 'colsample_bylevel': 1.0, 'reg_alpha': 1.194836640987007e-05, 'reg_lambda': 28.710032474222608, 'gamma': 0.00014206165563659788}. Best is trial 209 with value: -2.117388370040747.
/bsuhome/alexanderemert/Research/Star-Formation-Research-Project-2026/pipeline/scripts/optuna/final_preds_and_models/optuna_search_mult_quant_reg.py:75: UserWarning: The distribution is specified by [0.1, 5] and step=0.25, but the range is not divisible by `step`. It will be replaced with [0.1, 4.85].
  error_threshold = trial.suggest_float("error_threshold", 0.1, 5, step=0.25)
[I 2026-07-20 18:04:45,366] Trial 300 finished with value: -1.6382621452853934 and parameters: {'error_threshold': 3.85, 'scalers': 'standard', 'ratios': 'norm_ratio', 'imputers': 'mean', 'n_estimators': 1950, 'learning_rate': 0.2234526994236898, 'max_depth': 12, 'min_child_weight': 1, 'subsample': 0.7, 'colsample_bytree': 0.5, 'colsample_bylevel': 1.0, 'reg_alpha': 8.291735529868109e-06, 'reg_lambda': 30.888772182734687, 'gamma': 0.00013773462132804262}. Best is trial 209 with value: -2.117388370040747.
/bsuhome/alexanderemert/Research/Star-Formation-Research-Project-2026/pipeline/scripts/optuna/final_preds_and_models/optuna_search_mult_quant_reg.py:75: UserWarning: The distribution is specified by [0.1, 5] and step=0.25, but the range is not divisible by `step`. It will be replaced with [0.1, 4.85].
  error_threshold = trial.suggest_float("error_threshold", 0.1, 5, step=0.25)
[I 2026-07-20 18:04:55,309] Trial 301 finished with value: -1.6108430863277439 and parameters: {'error_threshold': 3.85, 'scalers': 'standard', 'ratios': 'norm_ratio', 'imputers': 'mean', 'n_estimators': 1950, 'learning_rate': 0.2285428009012372, 'max_depth': 12, 'min_child_weight': 1, 'subsample': 0.7, 'colsample_bytree': 0.5, 'colsample_bylevel': 1.0, 'reg_alpha': 8.380014478971698e-06, 'reg_lambda': 24.434112491838064, 'gamma': 0.00012996915873669159}. Best is trial 209 with value: -2.117388370040747.
/bsuhome/alexanderemert/Research/Star-Formation-Research-Project-2026/pipeline/scripts/optuna/final_preds_and_models/optuna_search_mult_quant_reg.py:75: UserWarning: The distribution is specified by [0.1, 5] and step=0.25, but the range is not divisible by `step`. It will be replaced with [0.1, 4.85].
  error_threshold = trial.suggest_float("error_threshold", 0.1, 5, step=0.25)
[I 2026-07-20 18:05:05,018] Trial 302 finished with value: -1.6492556092910455 and parameters: {'error_threshold': 3.85, 'scalers': 'standard', 'ratios': 'norm_ratio', 'imputers': 'mean', 'n_estimators': 1950, 'learning_rate': 0.23234966876831387, 'max_depth': 12, 'min_child_weight': 1, 'subsample': 0.7, 'colsample_bytree': 0.5, 'colsample_bylevel': 1.0, 'reg_alpha': 8.371290429678388e-06, 'reg_lambda': 31.401292041593987, 'gamma': 0.00012638434756237225}. Best is trial 209 with value: -2.117388370040747.
/bsuhome/alexanderemert/Research/Star-Formation-Research-Project-2026/pipeline/scripts/optuna/final_preds_and_models/optuna_search_mult_quant_reg.py:75: UserWarning: The distribution is specified by [0.1, 5] and step=0.25, but the range is not divisible by `step`. It will be replaced with [0.1, 4.85].
  error_threshold = trial.suggest_float("error_threshold", 0.1, 5, step=0.25)
[I 2026-07-20 18:05:14,673] Trial 303 finished with value: -1.6136770754129872 and parameters: {'error_threshold': 3.85, 'scalers': 'standard', 'ratios': 'norm_ratio', 'imputers': 'mean', 'n_estimators': 1950, 'learning_rate': 0.22857146957425406, 'max_depth': 12, 'min_child_weight': 1, 'subsample': 0.7, 'colsample_bytree': 0.5, 'colsample_bylevel': 1.0, 'reg_alpha': 7.759437633908385e-06, 'reg_lambda': 31.149027622311046, 'gamma': 0.00012043798410114195}. Best is trial 209 with value: -2.117388370040747.
/bsuhome/alexanderemert/Research/Star-Formation-Research-Project-2026/pipeline/scripts/optuna/final_preds_and_models/optuna_search_mult_quant_reg.py:75: UserWarning: The distribution is specified by [0.1, 5] and step=0.25, but the range is not divisible by `step`. It will be replaced with [0.1, 4.85].
  error_threshold = trial.suggest_float("error_threshold", 0.1, 5, step=0.25)
[I 2026-07-20 18:05:24,605] Trial 305 finished with value: -1.6686151093359864 and parameters: {'error_threshold': 3.85, 'scalers': 'standard', 'ratios': 'norm_ratio', 'imputers': 'mean', 'n_estimators': 2000, 'learning_rate': 0.23640392809662691, 'max_depth': 12, 'min_child_weight': 1, 'subsample': 0.7, 'colsample_bytree': 0.5, 'colsample_bylevel': 1.0, 'reg_alpha': 9.151700028657406e-06, 'reg_lambda': 30.197248690138, 'gamma': 0.00013264533832147427}. Best is trial 209 with value: -2.117388370040747.
/bsuhome/alexanderemert/Research/Star-Formation-Research-Project-2026/pipeline/scripts/optuna/final_preds_and_models/optuna_search_mult_quant_reg.py:75: UserWarning: The distribution is specified by [0.1, 5] and step=0.25, but the range is not divisible by `step`. It will be replaced with [0.1, 4.85].
  error_threshold = trial.suggest_float("error_threshold", 0.1, 5, step=0.25)
[I 2026-07-20 18:05:39,141] Trial 304 finished with value: -1.6344915948462262 and parameters: {'error_threshold': 3.85, 'scalers': 'standard', 'ratios': 'norm_ratio', 'imputers': 'mean', 'n_estimators': 1950, 'learning_rate': 0.24091736802371652, 'max_depth': 12, 'min_child_weight': 1, 'subsample': 0.7, 'colsample_bytree': 0.9, 'colsample_bylevel': 1.0, 'reg_alpha': 9.831736291026526e-06, 'reg_lambda': 31.773040699485993, 'gamma': 0.00012871428712500128}. Best is trial 209 with value: -2.117388370040747.
/bsuhome/alexanderemert/Research/Star-Formation-Research-Project-2026/pipeline/scripts/optuna/final_preds_and_models/optuna_search_mult_quant_reg.py:75: UserWarning: The distribution is specified by [0.1, 5] and step=0.25, but the range is not divisible by `step`. It will be replaced with [0.1, 4.85].
  error_threshold = trial.suggest_float("error_threshold", 0.1, 5, step=0.25)
[I 2026-07-20 18:10:34,665] Trial 306 finished with value: -1.6579693059989788 and parameters: {'error_threshold': 3.85, 'scalers': 'standard', 'ratios': 'norm_ratio', 'imputers': 'mean', 'n_estimators': 2000, 'learning_rate': 0.24513518947450855, 'max_depth': 12, 'min_child_weight': 1, 'subsample': 0.7, 'colsample_bytree': 0.5, 'colsample_bylevel': 1.0, 'reg_alpha': 1.0836969038365881e-05, 'reg_lambda': 31.18150262571586, 'gamma': 0.00013570175463289527}. Best is trial 209 with value: -2.117388370040747.
/bsuhome/alexanderemert/Research/Star-Formation-Research-Project-2026/pipeline/scripts/optuna/final_preds_and_models/optuna_search_mult_quant_reg.py:75: UserWarning: The distribution is specified by [0.1, 5] and step=0.25, but the range is not divisible by `step`. It will be replaced with [0.1, 4.85].
  error_threshold = trial.suggest_float("error_threshold", 0.1, 5, step=0.25)
[I 2026-07-20 18:11:29,045] Trial 307 finished with value: -1.7225632218168927 and parameters: {'error_threshold': 3.85, 'scalers': 'standard', 'ratios': 'norm_ratio', 'imputers': 'mean', 'n_estimators': 2000, 'learning_rate': 0.26228233751359264, 'max_depth': 12, 'min_child_weight': 1, 'subsample': 0.7, 'colsample_bytree': 0.5, 'colsample_bylevel': 1.0, 'reg_alpha': 8.708495658267282e-06, 'reg_lambda': 30.534105255217195, 'gamma': 0.00013263102495827064}. Best is trial 209 with value: -2.117388370040747.
/bsuhome/alexanderemert/Research/Star-Formation-Research-Project-2026/pipeline/scripts/optuna/final_preds_and_models/optuna_search_mult_quant_reg.py:75: UserWarning: The distribution is specified by [0.1, 5] and step=0.25, but the range is not divisible by `step`. It will be replaced with [0.1, 4.85].
  error_threshold = trial.suggest_float("error_threshold", 0.1, 5, step=0.25)
[I 2026-07-20 18:11:39,039] Trial 308 finished with value: -1.7148820987827647 and parameters: {'error_threshold': 3.85, 'scalers': 'standard', 'ratios': 'norm_ratio', 'imputers': 'mean', 'n_estimators': 1950, 'learning_rate': 0.25543115040849224, 'max_depth': 12, 'min_child_weight': 1, 'subsample': 0.7, 'colsample_bytree': 0.5, 'colsample_bylevel': 1.0, 'reg_alpha': 8.271602755682386e-06, 'reg_lambda': 32.55140540245305, 'gamma': 0.00012930593756490676}. Best is trial 209 with value: -2.117388370040747.
/bsuhome/alexanderemert/Research/Star-Formation-Research-Project-2026/pipeline/scripts/optuna/final_preds_and_models/optuna_search_mult_quant_reg.py:75: UserWarning: The distribution is specified by [0.1, 5] and step=0.25, but the range is not divisible by `step`. It will be replaced with [0.1, 4.85].
  error_threshold = trial.suggest_float("error_threshold", 0.1, 5, step=0.25)
[I 2026-07-20 18:11:48,864] Trial 309 finished with value: -1.7337559905314792 and parameters: {'error_threshold': 3.85, 'scalers': 'standard', 'ratios': 'norm_ratio', 'imputers': 'mean', 'n_estimators': 2000, 'learning_rate': 0.25810109086694377, 'max_depth': 12, 'min_child_weight': 1, 'subsample': 0.7, 'colsample_bytree': 0.5, 'colsample_bylevel': 1.0, 'reg_alpha': 9.935654879300704e-06, 'reg_lambda': 60.26753884017246, 'gamma': 0.00010372228099385342}. Best is trial 209 with value: -2.117388370040747.
/bsuhome/alexanderemert/Research/Star-Formation-Research-Project-2026/pipeline/scripts/optuna/final_preds_and_models/optuna_search_mult_quant_reg.py:75: UserWarning: The distribution is specified by [0.1, 5] and step=0.25, but the range is not divisible by `step`. It will be replaced with [0.1, 4.85].
  error_threshold = trial.suggest_float("error_threshold", 0.1, 5, step=0.25)
[I 2026-07-20 18:11:59,237] Trial 310 finished with value: -1.7337313545396986 and parameters: {'error_threshold': 3.85, 'scalers': 'standard', 'ratios': 'norm_ratio', 'imputers': 'mean', 'n_estimators': 2000, 'learning_rate': 0.26006461340617604, 'max_depth': 12, 'min_child_weight': 1, 'subsample': 0.7, 'colsample_bytree': 0.5, 'colsample_bylevel': 1.0, 'reg_alpha': 8.989266385543032e-06, 'reg_lambda': 32.29730871518056, 'gamma': 0.0001415617410677466}. Best is trial 209 with value: -2.117388370040747.
/bsuhome/alexanderemert/Research/Star-Formation-Research-Project-2026/pipeline/scripts/optuna/final_preds_and_models/optuna_search_mult_quant_reg.py:75: UserWarning: The distribution is specified by [0.1, 5] and step=0.25, but the range is not divisible by `step`. It will be replaced with [0.1, 4.85].
  error_threshold = trial.suggest_float("error_threshold", 0.1, 5, step=0.25)
[I 2026-07-20 18:12:08,784] Trial 311 finished with value: -1.7669260894761976 and parameters: {'error_threshold': 3.85, 'scalers': 'standard', 'ratios': 'norm_ratio', 'imputers': 'mean', 'n_estimators': 1950, 'learning_rate': 0.2669155842696094, 'max_depth': 12, 'min_child_weight': 1, 'subsample': 0.7, 'colsample_bytree': 0.5, 'colsample_bylevel': 1.0, 'reg_alpha': 7.5617392158503165e-06, 'reg_lambda': 63.89592929868533, 'gamma': 0.00011554666939817682}. Best is trial 209 with value: -2.117388370040747.
/bsuhome/alexanderemert/Research/Star-Formation-Research-Project-2026/pipeline/scripts/optuna/final_preds_and_models/optuna_search_mult_quant_reg.py:75: UserWarning: The distribution is specified by [0.1, 5] and step=0.25, but the range is not divisible by `step`. It will be replaced with [0.1, 4.85].
  error_threshold = trial.suggest_float("error_threshold", 0.1, 5, step=0.25)
[I 2026-07-20 18:12:18,211] Trial 312 finished with value: -1.7481192519654485 and parameters: {'error_threshold': 3.85, 'scalers': 'standard', 'ratios': 'norm_ratio', 'imputers': 'mean', 'n_estimators': 1950, 'learning_rate': 0.2666887508511315, 'max_depth': 12, 'min_child_weight': 1, 'subsample': 0.7, 'colsample_bytree': 0.5, 'colsample_bylevel': 1.0, 'reg_alpha': 8.685915826250598e-06, 'reg_lambda': 60.7268754403295, 'gamma': 0.00011878076306999941}. Best is trial 209 with value: -2.117388370040747.
