[I 2026-07-20 13:40:20,245] Trial 349 finished with value: -0.13736442040108895 and parameters: {'error_threshold': 1.75, 'scalers': 'robust', 'ratios': 'log_ratio', 'imputers': 'mean', 'n_estimators': 150, 'learning_rate': 0.00011416564318769893, 'max_depth': 8, 'min_child_weight': 1, 'subsample': 0.5, 'colsample_bytree': 0.5, 'colsample_bylevel': 0.6, 'reg_alpha': 5.56935880238369e-05, 'reg_lambda': 2.7993865656909938, 'gamma': 27.012267599859186}. Best is trial 68 with value: -0.1376473786634981.
[I 2026-07-20 13:40:21,149] Trial 350 finished with value: -0.13739855713017837 and parameters: {'error_threshold': 1.25, 'scalers': 'robust', 'ratios': 'log_ratio', 'imputers': 'mean', 'n_estimators': 150, 'learning_rate': 0.0001003488735525805, 'max_depth': 3, 'min_child_weight': 1, 'subsample': 0.5, 'colsample_bytree': 0.5, 'colsample_bylevel': 0.6, 'reg_alpha': 5.85825501363381e-05, 'reg_lambda': 2.889398986659739, 'gamma': 27.084505159745806}. Best is trial 68 with value: -0.1376473786634981.
[I 2026-07-20 13:40:21,271] Trial 351 finished with value: -0.13736621385559641 and parameters: {'error_threshold': 1.25, 'scalers': 'robust', 'ratios': 'log_ratio', 'imputers': 'mean', 'n_estimators': 150, 'learning_rate': 0.0001134384333061392, 'max_depth': 3, 'min_child_weight': 1, 'subsample': 0.5, 'colsample_bytree': 0.5, 'colsample_bylevel': 0.6, 'reg_alpha': 1.929574657151625e-05, 'reg_lambda': 2.9574065948957386, 'gamma': 26.35261337691199}. Best is trial 68 with value: -0.1376473786634981.
[I 2026-07-20 13:40:21,769] Trial 352 finished with value: -0.13736058711676144 and parameters: {'error_threshold': 1.25, 'scalers': 'robust', 'ratios': 'log_ratio', 'imputers': 'mean', 'n_estimators': 150, 'learning_rate': 0.00011563124984065037, 'max_depth': 3, 'min_child_weight': 1, 'subsample': 0.5, 'colsample_bytree': 0.5, 'colsample_bylevel': 0.6, 'reg_alpha': 6.565035617893062e-05, 'reg_lambda': 0.7067437632642993, 'gamma': 26.7206059986381}. Best is trial 68 with value: -0.1376473786634981.
[I 2026-07-20 13:40:22,013] Trial 353 finished with value: -0.13736795514616043 and parameters: {'error_threshold': 1.25, 'scalers': 'robust', 'ratios': 'log_ratio', 'imputers': 'mean', 'n_estimators': 150, 'learning_rate': 0.00011273314248173868, 'max_depth': 3, 'min_child_weight': 1, 'subsample': 0.5, 'colsample_bytree': 0.5, 'colsample_bylevel': 0.6, 'reg_alpha': 6.226060124456137e-05, 'reg_lambda': 4.738928989521707, 'gamma': 55.25215081450289}. Best is trial 68 with value: -0.1376473786634981.
[I 2026-07-20 13:40:22,787] Trial 354 finished with value: -0.13717519526028574 and parameters: {'error_threshold': 1.25, 'scalers': 'robust', 'ratios': 'log_ratio', 'imputers': 'mean', 'n_estimators': 300, 'learning_rate': 0.0001004774119424128, 'max_depth': 3, 'min_child_weight': 1, 'subsample': 0.5, 'colsample_bytree': 0.5, 'colsample_bylevel': 0.6, 'reg_alpha': 9.80555045591186e-06, 'reg_lambda': 5.179183947186001, 'gamma': 54.36889793572844}. Best is trial 68 with value: -0.1376473786634981.
[I 2026-07-20 13:40:22,889] Trial 355 finished with value: -0.13739474063886772 and parameters: {'error_threshold': 1.25, 'scalers': 'robust', 'ratios': 'log_ratio', 'imputers': 'mean', 'n_estimators': 150, 'learning_rate': 0.00010189401881411883, 'max_depth': 3, 'min_child_weight': 2, 'subsample': 0.5, 'colsample_bytree': 0.5, 'colsample_bylevel': 0.6, 'reg_alpha': 5.1002853104250786e-05, 'reg_lambda': 4.728792585767714, 'gamma': 25.47899332792733}. Best is trial 68 with value: -0.1376473786634981.
[I 2026-07-20 13:40:23,184] Trial 356 finished with value: -0.1373939266745165 and parameters: {'error_threshold': 1.25, 'scalers': 'robust', 'ratios': 'norm_ratio', 'imputers': 'mean', 'n_estimators': 150, 'learning_rate': 0.00010220657007939695, 'max_depth': 3, 'min_child_weight': 2, 'subsample': 0.5, 'colsample_bytree': 0.5, 'colsample_bylevel': 0.6, 'reg_alpha': 6.358176190024832e-05, 'reg_lambda': 12.177569726887917, 'gamma': 55.65884698078656}. Best is trial 68 with value: -0.1376473786634981.
[I 2026-07-20 13:40:23,691] Trial 357 finished with value: -0.13717523617521646 and parameters: {'error_threshold': 1.25, 'scalers': 'robust', 'ratios': 'log_ratio', 'imputers': 'mean', 'n_estimators': 300, 'learning_rate': 0.00010046929103445976, 'max_depth': 3, 'min_child_weight': 2, 'subsample': 0.5, 'colsample_bytree': 0.5, 'colsample_bylevel': 0.6, 'reg_alpha': 5.752186895005124e-05, 'reg_lambda': 5.032457310314458, 'gamma': 55.184224679969475}. Best is trial 68 with value: -0.1376473786634981.
[I 2026-07-20 13:40:24,939] Trial 358 finished with value: -0.13705076910640254 and parameters: {'error_threshold': 2.0, 'scalers': 'robust', 'ratios': 'norm_ratio', 'imputers': 'mean', 'n_estimators': 300, 'learning_rate': 0.00011122749415703689, 'max_depth': 3, 'min_child_weight': 2, 'subsample': 0.5, 'colsample_bytree': 0.5, 'colsample_bylevel': 0.6, 'reg_alpha': 5.227124356803128e-05, 'reg_lambda': 4.72719975891338, 'gamma': 12.40369276365436}. Best is trial 68 with value: -0.1376473786634981.
[I 2026-07-20 13:40:25,106] Trial 359 finished with value: -0.13706734616482918 and parameters: {'error_threshold': 2.0, 'scalers': 'robust', 'ratios': 'norm_ratio', 'imputers': 'mean', 'n_estimators': 300, 'learning_rate': 0.00010144351886814758, 'max_depth': 3, 'min_child_weight': 2, 'subsample': 0.5, 'colsample_bytree': 0.5, 'colsample_bylevel': 0.6, 'reg_alpha': 6.812268911822343e-05, 'reg_lambda': 6.325463894602675, 'gamma': 8.522977363748035}. Best is trial 68 with value: -0.1376473786634981.
[I 2026-07-20 13:40:25,695] Trial 360 finished with value: -0.13706195160343063 and parameters: {'error_threshold': 2.0, 'scalers': 'robust', 'ratios': 'norm_ratio', 'imputers': 'mean', 'n_estimators': 300, 'learning_rate': 0.00010890384748572111, 'max_depth': 3, 'min_child_weight': 2, 'subsample': 0.5, 'colsample_bytree': 0.5, 'colsample_bylevel': 0.6, 'reg_alpha': 6.0338362123066556e-05, 'reg_lambda': 5.009601224251574, 'gamma': 12.440406886036461}. Best is trial 68 with value: -0.1376473786634981.
[I 2026-07-20 13:40:26,028] Trial 361 finished with value: -0.1370595716090286 and parameters: {'error_threshold': 2.0, 'scalers': 'robust', 'ratios': 'norm_ratio', 'imputers': 'mean', 'n_estimators': 300, 'learning_rate': 0.00010165671750189022, 'max_depth': 3, 'min_child_weight': 2, 'subsample': 0.5, 'colsample_bytree': 0.5, 'colsample_bylevel': 0.6, 'reg_alpha': 1.0912902888478067e-05, 'reg_lambda': 5.218638123601721, 'gamma': 7.92167100169229}. Best is trial 68 with value: -0.1376473786634981.
[I 2026-07-20 13:40:27,512] Trial 362 finished with value: -0.13715978678010163 and parameters: {'error_threshold': 2.0, 'scalers': 'robust', 'ratios': 'log_ratio', 'imputers': 'mean', 'n_estimators': 300, 'learning_rate': 0.00010376110493275769, 'max_depth': 3, 'min_child_weight': 2, 'subsample': 0.5, 'colsample_bytree': 0.5, 'colsample_bylevel': 0.6, 'reg_alpha': 2.744684353429627e-05, 'reg_lambda': 11.60534651214112, 'gamma': 59.90469919704254}. Best is trial 68 with value: -0.1376473786634981.
[I 2026-07-20 13:40:27,674] Trial 363 finished with value: -0.13697493891462068 and parameters: {'error_threshold': 2.0, 'scalers': 'robust', 'ratios': 'norm_ratio', 'imputers': 'mean', 'n_estimators': 300, 'learning_rate': 0.00011663638704236563, 'max_depth': 3, 'min_child_weight': 2, 'subsample': 0.5, 'colsample_bytree': 0.5, 'colsample_bylevel': 0.6, 'reg_alpha': 1.1054738656383439e-05, 'reg_lambda': 1.0707640478923424, 'gamma': 8.011120593466192}. Best is trial 68 with value: -0.1376473786634981.
[I 2026-07-20 13:40:27,892] Trial 364 finished with value: -0.1370821428648265 and parameters: {'error_threshold': 2.0, 'scalers': 'robust', 'ratios': 'log_ratio', 'imputers': 'mean', 'n_estimators': 300, 'learning_rate': 0.00012039485798544235, 'max_depth': 3, 'min_child_weight': 1, 'subsample': 0.5, 'colsample_bytree': 0.5, 'colsample_bylevel': 0.6, 'reg_alpha': 2.7847163707857515e-05, 'reg_lambda': 1.1130037423171546, 'gamma': 99.42458976966135}. Best is trial 68 with value: -0.1376473786634981.
[I 2026-07-20 13:40:28,473] Trial 366 finished with value: -0.13734648158067295 and parameters: {'error_threshold': 1.5, 'scalers': 'robust', 'ratios': 'log_ratio', 'imputers': 'mean', 'n_estimators': 100, 'learning_rate': 0.0001320441447218656, 'max_depth': 3, 'min_child_weight': 1, 'subsample': 0.5, 'colsample_bytree': 0.5, 'colsample_bylevel': 0.6, 'reg_alpha': 2.789339888104648e-05, 'reg_lambda': 1.1928319074975553, 'gamma': 8.872969864706791}. Best is trial 68 with value: -0.1376473786634981.
[I 2026-07-20 13:40:28,699] Trial 367 finished with value: -0.13740600375525394 and parameters: {'error_threshold': 1.5, 'scalers': 'robust', 'ratios': 'log_ratio', 'imputers': 'mean', 'n_estimators': 100, 'learning_rate': 0.00013289848642384413, 'max_depth': 3, 'min_child_weight': 1, 'subsample': 0.5, 'colsample_bytree': 0.5, 'colsample_bylevel': 0.6, 'reg_alpha': 2.8247802915549374e-05, 'reg_lambda': 1.0449366321548021, 'gamma': 76.32677215001833}. Best is trial 68 with value: -0.1376473786634981.
[I 2026-07-20 13:40:28,850] Trial 368 finished with value: -0.13740319275732285 and parameters: {'error_threshold': 1.5, 'scalers': 'robust', 'ratios': 'log_ratio', 'imputers': 'mean', 'n_estimators': 100, 'learning_rate': 0.00013444987321021377, 'max_depth': 3, 'min_child_weight': 1, 'subsample': 0.5, 'colsample_bytree': 0.5, 'colsample_bylevel': 0.6, 'reg_alpha': 1.0874055061158252e-05, 'reg_lambda': 2.473811650415583, 'gamma': 73.59776210421127}. Best is trial 68 with value: -0.1376473786634981.
[I 2026-07-20 13:40:29,171] Trial 369 finished with value: -0.13739846270519637 and parameters: {'error_threshold': 1.5, 'scalers': 'robust', 'ratios': 'log_ratio', 'imputers': 'mean', 'n_estimators': 100, 'learning_rate': 0.00013706551034611537, 'max_depth': 3, 'min_child_weight': 1, 'subsample': 0.5, 'colsample_bytree': 0.5, 'colsample_bylevel': 0.6, 'reg_alpha': 2.8546716992869357e-05, 'reg_lambda': 1.200755231090445, 'gamma': 96.23568443252523}. Best is trial 68 with value: -0.1376473786634981.
[I 2026-07-20 13:40:29,291] Trial 370 finished with value: -0.13740431794054364 and parameters: {'error_threshold': 1.5, 'scalers': 'robust', 'ratios': 'log_ratio', 'imputers': 'mean', 'n_estimators': 100, 'learning_rate': 0.00013382989255504495, 'max_depth': 3, 'min_child_weight': 1, 'subsample': 0.5, 'colsample_bytree': 0.5, 'colsample_bylevel': 0.6, 'reg_alpha': 1.4591709608417189e-05, 'reg_lambda': 1.0255967511687292, 'gamma': 95.76547625360386}. Best is trial 68 with value: -0.1376473786634981.
[I 2026-07-20 13:40:29,445] Trial 371 finished with value: -0.13739652782893833 and parameters: {'error_threshold': 1.5, 'scalers': 'robust', 'ratios': 'log_ratio', 'imputers': 'mean', 'n_estimators': 100, 'learning_rate': 0.0001381319195665952, 'max_depth': 3, 'min_child_weight': 1, 'subsample': 0.5, 'colsample_bytree': 0.5, 'colsample_bylevel': 0.6, 'reg_alpha': 2.738075637405959e-05, 'reg_lambda': 1.1656461277577035, 'gamma': 94.77755435070772}. Best is trial 68 with value: -0.1376473786634981.
[I 2026-07-20 13:40:29,781] Trial 372 finished with value: -0.13738472909031743 and parameters: {'error_threshold': 1.5, 'scalers': 'robust', 'ratios': 'log_ratio', 'imputers': 'mean', 'n_estimators': 100, 'learning_rate': 0.0001446529750686207, 'max_depth': 3, 'min_child_weight': 1, 'subsample': 0.5, 'colsample_bytree': 0.5, 'colsample_bylevel': 0.6, 'reg_alpha': 1.391713984958608e-05, 'reg_lambda': 2.2960410689980546, 'gamma': 97.61614528768976}. Best is trial 68 with value: -0.1376473786634981.
[I 2026-07-20 13:40:31,530] Trial 373 finished with value: -0.13737620418010357 and parameters: {'error_threshold': 1.5, 'scalers': 'robust', 'ratios': 'log_ratio', 'imputers': 'mean', 'n_estimators': 100, 'learning_rate': 0.00014936497088856827, 'max_depth': 3, 'min_child_weight': 1, 'subsample': 0.5, 'colsample_bytree': 0.5, 'colsample_bylevel': 0.6, 'reg_alpha': 1.546562135658034e-05, 'reg_lambda': 2.3901789983769186, 'gamma': 69.01535373380783}. Best is trial 68 with value: -0.1376473786634981.
[I 2026-07-20 13:40:31,616] Trial 374 finished with value: -0.13736805729591975 and parameters: {'error_threshold': 1.5, 'scalers': 'robust', 'ratios': 'log_ratio', 'imputers': 'mean', 'n_estimators': 100, 'learning_rate': 0.00015386466706896298, 'max_depth': 3, 'min_child_weight': 1, 'subsample': 0.5, 'colsample_bytree': 0.5, 'colsample_bylevel': 0.6, 'reg_alpha': 1.5001682456329088e-05, 'reg_lambda': 0.9919569982425971, 'gamma': 74.0526830543001}. Best is trial 68 with value: -0.1376473786634981.
[I 2026-07-20 13:40:31,787] Trial 375 finished with value: -0.1373697513153011 and parameters: {'error_threshold': 1.5, 'scalers': 'robust', 'ratios': 'log_ratio', 'imputers': 'mean', 'n_estimators': 100, 'learning_rate': 0.00015292932632710054, 'max_depth': 3, 'min_child_weight': 1, 'subsample': 0.5, 'colsample_bytree': 0.5, 'colsample_bylevel': 0.6, 'reg_alpha': 1.4997108233682776e-05, 'reg_lambda': 0.8617974501537391, 'gamma': 98.7530102458753}. Best is trial 68 with value: -0.1376473786634981.
[I 2026-07-20 13:40:32,118] Trial 376 finished with value: -0.1373652248149611 and parameters: {'error_threshold': 1.5, 'scalers': 'robust', 'ratios': 'log_ratio', 'imputers': 'mean', 'n_estimators': 100, 'learning_rate': 0.00015543174039737596, 'max_depth': 3, 'min_child_weight': 1, 'subsample': 0.5, 'colsample_bytree': 0.5, 'colsample_bylevel': 0.6, 'reg_alpha': 1.637123735410809e-05, 'reg_lambda': 2.095812222492217, 'gamma': 77.38183646393367}. Best is trial 68 with value: -0.1376473786634981.
[I 2026-07-20 13:40:32,257] Trial 377 finished with value: -0.1373599339301028 and parameters: {'error_threshold': 1.5, 'scalers': 'robust', 'ratios': 'log_ratio', 'imputers': 'mean', 'n_estimators': 100, 'learning_rate': 0.00015835500751621947, 'max_depth': 3, 'min_child_weight': 1, 'subsample': 0.5, 'colsample_bytree': 0.5, 'colsample_bylevel': 0.6, 'reg_alpha': 1.4091957517055695e-05, 'reg_lambda': 0.7022999170240998, 'gamma': 75.0664824030297}. Best is trial 68 with value: -0.1376473786634981.
[I 2026-07-20 13:40:32,349] Trial 378 finished with value: -0.13717495811961003 and parameters: {'error_threshold': 0.5, 'scalers': 'robust', 'ratios': 'log_ratio', 'imputers': 'mean', 'n_estimators': 100, 'learning_rate': 0.00015998947367731845, 'max_depth': 3, 'min_child_weight': 1, 'subsample': 0.5, 'colsample_bytree': 0.9, 'colsample_bylevel': 0.6, 'reg_alpha': 1.5184867352107889e-05, 'reg_lambda': 0.6211331556421177, 'gamma': 73.27931335647797}. Best is trial 68 with value: -0.1376473786634981.
[I 2026-07-20 13:40:32,577] Trial 379 finished with value: -0.13734523092266757 and parameters: {'error_threshold': 1.75, 'scalers': 'robust', 'ratios': 'log_ratio', 'imputers': 'mean', 'n_estimators': 100, 'learning_rate': 0.00016648195207515372, 'max_depth': 3, 'min_child_weight': 1, 'subsample': 0.5, 'colsample_bytree': 0.5, 'colsample_bylevel': 0.6, 'reg_alpha': 7.98050905173834e-06, 'reg_lambda': 0.7557535399865652, 'gamma': 69.93823807305598}. Best is trial 68 with value: -0.1376473786634981.
[I 2026-07-20 13:40:33,886] Trial 365 finished with value: -0.1315685160098157 and parameters: {'error_threshold': 2.0, 'scalers': 'robust', 'ratios': 'log_ratio', 'imputers': 'mean', 'n_estimators': 2400, 'learning_rate': 0.00012303945356220605, 'max_depth': 3, 'min_child_weight': 1, 'subsample': 0.5, 'colsample_bytree': 0.5, 'colsample_bylevel': 0.6, 'reg_alpha': 2.6930781561386516e-05, 'reg_lambda': 1.2633387886468908, 'gamma': 11.248947272031495}. Best is trial 68 with value: -0.1376473786634981.
[I 2026-07-20 13:40:34,108] Trial 380 finished with value: -0.13735747108390364 and parameters: {'error_threshold': 1.75, 'scalers': 'robust', 'ratios': 'log_ratio', 'imputers': 'mean', 'n_estimators': 100, 'learning_rate': 0.00015971557358923348, 'max_depth': 3, 'min_child_weight': 1, 'subsample': 0.5, 'colsample_bytree': 0.5, 'colsample_bylevel': 0.6, 'reg_alpha': 1.4814963982446217e-05, 'reg_lambda': 0.6960038414827887, 'gamma': 71.48207311079922}. Best is trial 68 with value: -0.1376473786634981.
[I 2026-07-20 13:40:34,501] Trial 381 finished with value: -0.13732804422253747 and parameters: {'error_threshold': 1.75, 'scalers': 'robust', 'ratios': 'log_ratio', 'imputers': 'mean', 'n_estimators': 100, 'learning_rate': 0.0001760198715718893, 'max_depth': 3, 'min_child_weight': 1, 'subsample': 0.5, 'colsample_bytree': 0.5, 'colsample_bylevel': 0.6, 'reg_alpha': 1.4354664775372931e-05, 'reg_lambda': 0.8181461231340426, 'gamma': 68.93142544116643}. Best is trial 68 with value: -0.1376473786634981.
[I 2026-07-20 13:40:34,688] Trial 382 finished with value: -0.1373204206124279 and parameters: {'error_threshold': 1.75, 'scalers': 'robust', 'ratios': 'log_ratio', 'imputers': 'mean', 'n_estimators': 100, 'learning_rate': 0.00018023589095058807, 'max_depth': 3, 'min_child_weight': 1, 'subsample': 0.5, 'colsample_bytree': 0.5, 'colsample_bylevel': 0.6, 'reg_alpha': 8.47493402635795e-06, 'reg_lambda': 1.3309720674742502, 'gamma': 65.74982191802522}. Best is trial 68 with value: -0.1376473786634981.
[I 2026-07-20 13:40:35,036] Trial 383 finished with value: -0.13720518012056104 and parameters: {'error_threshold': 1.75, 'scalers': 'robust', 'ratios': 'log_ratio', 'imputers': 'mean', 'n_estimators': 150, 'learning_rate': 0.00017874884167985326, 'max_depth': 3, 'min_child_weight': 1, 'subsample': 0.5, 'colsample_bytree': 0.5, 'colsample_bylevel': 0.6, 'reg_alpha': 8.867069397153107e-06, 'reg_lambda': 0.7503103014360323, 'gamma': 67.68962992645659}. Best is trial 68 with value: -0.1376473786634981.
[I 2026-07-20 13:40:35,939] Trial 384 finished with value: -0.1370218431491362 and parameters: {'error_threshold': 1.75, 'scalers': 'robust', 'ratios': 'log_ratio', 'imputers': 'mean', 'n_estimators': 200, 'learning_rate': 0.00018213402301147047, 'max_depth': 4, 'min_child_weight': 1, 'subsample': 0.5, 'colsample_bytree': 0.5, 'colsample_bylevel': 0.6, 'reg_alpha': 8.279253986151336e-06, 'reg_lambda': 1.4150089410047912, 'gamma': 55.762937355071436}. Best is trial 68 with value: -0.1376473786634981.
[I 2026-07-20 13:40:36,338] Trial 385 finished with value: -0.13700980615751215 and parameters: {'error_threshold': 1.75, 'scalers': 'robust', 'ratios': 'log_ratio', 'imputers': 'mean', 'n_estimators': 200, 'learning_rate': 0.0001856663944086219, 'max_depth': 3, 'min_child_weight': 1, 'subsample': 0.5, 'colsample_bytree': 0.5, 'colsample_bylevel': 0.6, 'reg_alpha': 9.49537276134576e-06, 'reg_lambda': 1.5547338134013853, 'gamma': 53.85576813976955}. Best is trial 68 with value: -0.1376473786634981.
[I 2026-07-20 13:40:36,664] Trial 386 finished with value: -0.13690859220206233 and parameters: {'error_threshold': 1.75, 'scalers': 'robust', 'ratios': 'log_ratio', 'imputers': 'mean', 'n_estimators': 200, 'learning_rate': 0.00021542517262662617, 'max_depth': 4, 'min_child_weight': 1, 'subsample': 0.5, 'colsample_bytree': 0.5, 'colsample_bylevel': 0.6, 'reg_alpha': 9.857654245704457e-06, 'reg_lambda': 1.4704932521251617, 'gamma': 50.165307454624596}. Best is trial 68 with value: -0.1376473786634981.
[I 2026-07-20 13:40:36,860] Trial 387 finished with value: -0.1370196740507175 and parameters: {'error_threshold': 1.75, 'scalers': 'robust', 'ratios': 'log_ratio', 'imputers': 'mean', 'n_estimators': 200, 'learning_rate': 0.00018277344155509582, 'max_depth': 4, 'min_child_weight': 1, 'subsample': 0.5, 'colsample_bytree': 0.5, 'colsample_bylevel': 0.6, 'reg_alpha': 8.108628489996856e-06, 'reg_lambda': 1.6390685444836468, 'gamma': 57.79687814801449}. Best is trial 68 with value: -0.1376473786634981.
[I 2026-07-20 13:40:37,203] Trial 388 finished with value: -0.1370186337872874 and parameters: {'error_threshold': 1.75, 'scalers': 'robust', 'ratios': 'log_ratio', 'imputers': 'mean', 'n_estimators': 200, 'learning_rate': 0.00018307954078869583, 'max_depth': 4, 'min_child_weight': 1, 'subsample': 0.5, 'colsample_bytree': 0.5, 'colsample_bylevel': 0.6, 'reg_alpha': 8.48987098989139e-06, 'reg_lambda': 1.548346781035906, 'gamma': 51.18100717672487}. Best is trial 68 with value: -0.1376473786634981.
[I 2026-07-20 13:40:37,327] Trial 389 finished with value: -0.13689134639826042 and parameters: {'error_threshold': 1.75, 'scalers': 'robust', 'ratios': 'log_ratio', 'imputers': 'mean', 'n_estimators': 200, 'learning_rate': 0.000220460036341883, 'max_depth': 4, 'min_child_weight': 1, 'subsample': 0.5, 'colsample_bytree': 0.5, 'colsample_bylevel': 0.6, 'reg_alpha': 8.497195913858783e-06, 'reg_lambda': 1.7061916059542306, 'gamma': 53.01940125606109}. Best is trial 68 with value: -0.1376473786634981.
[I 2026-07-20 13:40:37,619] Trial 390 finished with value: -0.13694381531935204 and parameters: {'error_threshold': 1.75, 'scalers': 'robust', 'ratios': 'log_ratio', 'imputers': 'mean', 'n_estimators': 200, 'learning_rate': 0.00020499452546519507, 'max_depth': 4, 'min_child_weight': 1, 'subsample': 0.5, 'colsample_bytree': 0.5, 'colsample_bylevel': 0.6, 'reg_alpha': 2.2408086724603562e-05, 'reg_lambda': 8.014959069896497, 'gamma': 51.18770985013059}. Best is trial 68 with value: -0.1376473786634981.
[I 2026-07-20 13:40:37,826] Trial 391 finished with value: -0.1371935643661935 and parameters: {'error_threshold': 1.5, 'scalers': 'robust', 'ratios': 'log_ratio', 'imputers': 'mean', 'n_estimators': 200, 'learning_rate': 0.00013189806625610575, 'max_depth': 9, 'min_child_weight': 1, 'subsample': 0.5, 'colsample_bytree': 0.5, 'colsample_bylevel': 0.6, 'reg_alpha': 2.468052537255412e-05, 'reg_lambda': 8.398052310207257, 'gamma': 50.62534921869957}. Best is trial 68 with value: -0.1376473786634981.
