[I 2026-07-20 15:31:43,400] Trial 571 finished with value: -0.531797425288658 and parameters: {'error_threshold': 2.75, 'scalers': 'standard', 'ratios': 'norm_ratio', 'imputers': 'mean', 'n_estimators': 2800, 'learning_rate': 0.25538660574632854, 'max_depth': 8, 'min_child_weight': 1, 'subsample': 0.5, 'colsample_bytree': 0.5, 'colsample_bylevel': 0.7, 'reg_alpha': 0.5712937542100145, 'reg_lambda': 52.04380884477549, 'gamma': 0.00012217935546652585}. Best is trial 560 with value: -0.9539200882804951.
[I 2026-07-20 15:31:43,405] A new study created in Journal with name: final_predictive_mean_study
[W 2026-07-20 15:31:44,706] Trial 1 failed with parameters: {'error_threshold': 4.5, 'scalers': 'robust', 'ratios': 'log_ratio', 'imputers': 'mean', 'n_estimators': 500, 'learning_rate': 0.001977942597383597, 'max_depth': 4, 'min_child_weight': 6, 'subsample': 0.9, 'colsample_bytree': 0.7, 'colsample_bylevel': 0.5, 'reg_alpha': 6.69541599448041e-06, 'reg_lambda': 0.018196484034139867, 'gamma': 2.828725836540543} because of the following error: InvalidParameterError("The 'scoring' parameter of cross_val_score must be a str among {'positive_likelihood_ratio', 'rand_score', 'roc_auc_ovo', 'recall_samples', 'd2_brier_score', 'jaccard', 'adjusted_mutual_info_score', 'jaccard_micro', 'neg_root_mean_squared_error', 'neg_brier_score', 'precision_macro', 'd2_absolute_error_score', 'balanced_accuracy', 'recall_micro', 'jaccard_weighted', 'neg_mean_poisson_deviance', 'neg_max_error', 'recall_weighted', 'f1_macro', 'f1_samples', 'precision_micro', 'neg_mean_absolute_percentage_error', 'jaccard_macro', 'neg_mean_absolute_error', 'adjusted_rand_score', 'explained_variance', 'top_k_accuracy', 'fowlkes_mallows_score', 'mutual_info_score', 'f1', 'homogeneity_score', 'matthews_corrcoef', 'average_precision', 'recall', 'f1_micro', 'precision', 'neg_negative_likelihood_ratio', 'recall_macro', 'neg_mean_gamma_deviance', 'roc_auc_ovr', 'roc_auc_ovr_weighted', 'precision_weighted', 'f1_weighted', 'neg_mean_squared_log_error', 'neg_median_absolute_error', 'r2', 'neg_mean_squared_error', 'precision_samples', 'v_measure_score', 'neg_log_loss', 'roc_auc', 'neg_root_mean_squared_log_error', 'd2_log_loss_score', 'jaccard_samples', 'normalized_mutual_info_score', 'completeness_score', 'accuracy', 'roc_auc_ovo_weighted'}, a callable or None. Got 'root_mean_squared_error' instead.").
Traceback (most recent call last):
  File "/bsuscratch/alexanderemert/miniforge3/envs/starform-alex/lib/python3.14/site-packages/optuna/study/_optimize.py", line 206, in _run_trial
    value_or_values = func(trial)
  File "/bsuhome/alexanderemert/Research/Star-Formation-Research-Project-2026/pipeline/scripts/optuna/final_preds_and_models/optuna_search_mult_quant_reg.py", line 231, in objective
    pickle.dump(results, file)
             ~~^^^^^^^^^^^^^^^
  File "/bsuscratch/alexanderemert/miniforge3/envs/starform-alex/lib/python3.14/site-packages/sklearn/utils/_param_validation.py", line 208, in wrapper
    validate_parameter_constraints(
    ~~~~~~~~~~~~~~~~~~~~~~~~~~~~~~^
        parameter_constraints, params, caller_name=func.__qualname__
        ^^^^^^^^^^^^^^^^^^^^^^^^^^^^^^^^^^^^^^^^^^^^^^^^^^^^^^^^^^^^
    )
    ^
  File "/bsuscratch/alexanderemert/miniforge3/envs/starform-alex/lib/python3.14/site-packages/sklearn/utils/_param_validation.py", line 98, in validate_parameter_constraints
    raise InvalidParameterError(
    ...<2 lines>...
    )
sklearn.utils._param_validation.InvalidParameterError: The 'scoring' parameter of cross_val_score must be a str among {'positive_likelihood_ratio', 'rand_score', 'roc_auc_ovo', 'recall_samples', 'd2_brier_score', 'jaccard', 'adjusted_mutual_info_score', 'jaccard_micro', 'neg_root_mean_squared_error', 'neg_brier_score', 'precision_macro', 'd2_absolute_error_score', 'balanced_accuracy', 'recall_micro', 'jaccard_weighted', 'neg_mean_poisson_deviance', 'neg_max_error', 'recall_weighted', 'f1_macro', 'f1_samples', 'precision_micro', 'neg_mean_absolute_percentage_error', 'jaccard_macro', 'neg_mean_absolute_error', 'adjusted_rand_score', 'explained_variance', 'top_k_accuracy', 'fowlkes_mallows_score', 'mutual_info_score', 'f1', 'homogeneity_score', 'matthews_corrcoef', 'average_precision', 'recall', 'f1_micro', 'precision', 'neg_negative_likelihood_ratio', 'recall_macro', 'neg_mean_gamma_deviance', 'roc_auc_ovr', 'roc_auc_ovr_weighted', 'precision_weighted', 'f1_weighted', 'neg_mean_squared_log_error', 'neg_median_absolute_error', 'r2', 'neg_mean_squared_error', 'precision_samples', 'v_measure_score', 'neg_log_loss', 'roc_auc', 'neg_root_mean_squared_log_error', 'd2_log_loss_score', 'jaccard_samples', 'normalized_mutual_info_score', 'completeness_score', 'accuracy', 'roc_auc_ovo_weighted'}, a callable or None. Got 'root_mean_squared_error' instead.
[W 2026-07-20 15:31:44,745] Trial 1 failed with value None.
[W 2026-07-20 15:31:45,942] Trial 3 failed with parameters: {'error_threshold': 4.75, 'scalers': 'standard', 'ratios': 'norm_ratio', 'imputers': 'mean', 'n_estimators': 1100, 'learning_rate': 0.3841004513754392, 'max_depth': 4, 'min_child_weight': 3, 'subsample': 0.8, 'colsample_bytree': 0.9, 'colsample_bylevel': 0.9, 'reg_alpha': 0.03850640019558224, 'reg_lambda': 0.0010490982998046878, 'gamma': 1.3555841028263442e-05} because of the following error: InvalidParameterError("The 'scoring' parameter of cross_val_score must be a str among {'positive_likelihood_ratio', 'rand_score', 'roc_auc_ovo', 'recall_samples', 'd2_brier_score', 'jaccard', 'adjusted_mutual_info_score', 'jaccard_micro', 'neg_root_mean_squared_error', 'neg_brier_score', 'precision_macro', 'd2_absolute_error_score', 'balanced_accuracy', 'recall_micro', 'jaccard_weighted', 'neg_mean_poisson_deviance', 'neg_max_error', 'recall_weighted', 'f1_macro', 'f1_samples', 'precision_micro', 'neg_mean_absolute_percentage_error', 'jaccard_macro', 'neg_mean_absolute_error', 'adjusted_rand_score', 'explained_variance', 'top_k_accuracy', 'fowlkes_mallows_score', 'mutual_info_score', 'f1', 'homogeneity_score', 'matthews_corrcoef', 'average_precision', 'recall', 'f1_micro', 'precision', 'neg_negative_likelihood_ratio', 'recall_macro', 'neg_mean_gamma_deviance', 'roc_auc_ovr', 'roc_auc_ovr_weighted', 'precision_weighted', 'f1_weighted', 'neg_mean_squared_log_error', 'neg_median_absolute_error', 'r2', 'neg_mean_squared_error', 'precision_samples', 'v_measure_score', 'neg_log_loss', 'roc_auc', 'neg_root_mean_squared_log_error', 'd2_log_loss_score', 'jaccard_samples', 'normalized_mutual_info_score', 'completeness_score', 'accuracy', 'roc_auc_ovo_weighted'}, a callable or None. Got 'root_mean_squared_error' instead.").
Traceback (most recent call last):
  File "/bsuscratch/alexanderemert/miniforge3/envs/starform-alex/lib/python3.14/site-packages/optuna/study/_optimize.py", line 206, in _run_trial
    value_or_values = func(trial)
  File "/bsuhome/alexanderemert/Research/Star-Formation-Research-Project-2026/pipeline/scripts/optuna/final_preds_and_models/optuna_search_mult_quant_reg.py", line 231, in objective
    pickle.dump(results, file)
             ~~^^^^^^^^^^^^^^^
  File "/bsuscratch/alexanderemert/miniforge3/envs/starform-alex/lib/python3.14/site-packages/sklearn/utils/_param_validation.py", line 208, in wrapper
    validate_parameter_constraints(
    ~~~~~~~~~~~~~~~~~~~~~~~~~~~~~~^
        parameter_constraints, params, caller_name=func.__qualname__
        ^^^^^^^^^^^^^^^^^^^^^^^^^^^^^^^^^^^^^^^^^^^^^^^^^^^^^^^^^^^^
    )
    ^
  File "/bsuscratch/alexanderemert/miniforge3/envs/starform-alex/lib/python3.14/site-packages/sklearn/utils/_param_validation.py", line 98, in validate_parameter_constraints
    raise InvalidParameterError(
    ...<2 lines>...
    )
sklearn.utils._param_validation.InvalidParameterError: The 'scoring' parameter of cross_val_score must be a str among {'positive_likelihood_ratio', 'rand_score', 'roc_auc_ovo', 'recall_samples', 'd2_brier_score', 'jaccard', 'adjusted_mutual_info_score', 'jaccard_micro', 'neg_root_mean_squared_error', 'neg_brier_score', 'precision_macro', 'd2_absolute_error_score', 'balanced_accuracy', 'recall_micro', 'jaccard_weighted', 'neg_mean_poisson_deviance', 'neg_max_error', 'recall_weighted', 'f1_macro', 'f1_samples', 'precision_micro', 'neg_mean_absolute_percentage_error', 'jaccard_macro', 'neg_mean_absolute_error', 'adjusted_rand_score', 'explained_variance', 'top_k_accuracy', 'fowlkes_mallows_score', 'mutual_info_score', 'f1', 'homogeneity_score', 'matthews_corrcoef', 'average_precision', 'recall', 'f1_micro', 'precision', 'neg_negative_likelihood_ratio', 'recall_macro', 'neg_mean_gamma_deviance', 'roc_auc_ovr', 'roc_auc_ovr_weighted', 'precision_weighted', 'f1_weighted', 'neg_mean_squared_log_error', 'neg_median_absolute_error', 'r2', 'neg_mean_squared_error', 'precision_samples', 'v_measure_score', 'neg_log_loss', 'roc_auc', 'neg_root_mean_squared_log_error', 'd2_log_loss_score', 'jaccard_samples', 'normalized_mutual_info_score', 'completeness_score', 'accuracy', 'roc_auc_ovo_weighted'}, a callable or None. Got 'root_mean_squared_error' instead.
[W 2026-07-20 15:31:45,944] Trial 3 failed with value None.
[W 2026-07-20 15:31:46,086] Trial 6 failed with parameters: {'error_threshold': 3.0, 'scalers': 'robust', 'ratios': 'log_ratio', 'imputers': 'median', 'n_estimators': 500, 'learning_rate': 0.29188173615265733, 'max_depth': 6, 'min_child_weight': 3, 'subsample': 0.9, 'colsample_bytree': 0.8, 'colsample_bylevel': 0.9, 'reg_alpha': 0.3033047603847655, 'reg_lambda': 0.000817284484784843, 'gamma': 3.933534295417821e-06} because of the following error: InvalidParameterError("The 'scoring' parameter of cross_val_score must be a str among {'positive_likelihood_ratio', 'rand_score', 'roc_auc_ovo', 'recall_samples', 'd2_brier_score', 'jaccard', 'adjusted_mutual_info_score', 'jaccard_micro', 'neg_root_mean_squared_error', 'neg_brier_score', 'precision_macro', 'd2_absolute_error_score', 'balanced_accuracy', 'recall_micro', 'jaccard_weighted', 'neg_mean_poisson_deviance', 'neg_max_error', 'recall_weighted', 'f1_macro', 'f1_samples', 'precision_micro', 'neg_mean_absolute_percentage_error', 'jaccard_macro', 'neg_mean_absolute_error', 'adjusted_rand_score', 'explained_variance', 'top_k_accuracy', 'fowlkes_mallows_score', 'mutual_info_score', 'f1', 'homogeneity_score', 'matthews_corrcoef', 'average_precision', 'recall', 'f1_micro', 'precision', 'neg_negative_likelihood_ratio', 'recall_macro', 'neg_mean_gamma_deviance', 'roc_auc_ovr', 'roc_auc_ovr_weighted', 'precision_weighted', 'f1_weighted', 'neg_mean_squared_log_error', 'neg_median_absolute_error', 'r2', 'neg_mean_squared_error', 'precision_samples', 'v_measure_score', 'neg_log_loss', 'roc_auc', 'neg_root_mean_squared_log_error', 'd2_log_loss_score', 'jaccard_samples', 'normalized_mutual_info_score', 'completeness_score', 'accuracy', 'roc_auc_ovo_weighted'}, a callable or None. Got 'root_mean_squared_error' instead.").
Traceback (most recent call last):
  File "/bsuscratch/alexanderemert/miniforge3/envs/starform-alex/lib/python3.14/site-packages/optuna/study/_optimize.py", line 206, in _run_trial
    value_or_values = func(trial)
  File "/bsuhome/alexanderemert/Research/Star-Formation-Research-Project-2026/pipeline/scripts/optuna/final_preds_and_models/optuna_search_mult_quant_reg.py", line 231, in objective
    pickle.dump(results, file)
             ~~^^^^^^^^^^^^^^^
  File "/bsuscratch/alexanderemert/miniforge3/envs/starform-alex/lib/python3.14/site-packages/sklearn/utils/_param_validation.py", line 208, in wrapper
    validate_parameter_constraints(
    ~~~~~~~~~~~~~~~~~~~~~~~~~~~~~~^
        parameter_constraints, params, caller_name=func.__qualname__
        ^^^^^^^^^^^^^^^^^^^^^^^^^^^^^^^^^^^^^^^^^^^^^^^^^^^^^^^^^^^^
    )
    ^
  File "/bsuscratch/alexanderemert/miniforge3/envs/starform-alex/lib/python3.14/site-packages/sklearn/utils/_param_validation.py", line 98, in validate_parameter_constraints
    raise InvalidParameterError(
    ...<2 lines>...
    )
sklearn.utils._param_validation.InvalidParameterError: The 'scoring' parameter of cross_val_score must be a str among {'positive_likelihood_ratio', 'rand_score', 'roc_auc_ovo', 'recall_samples', 'd2_brier_score', 'jaccard', 'adjusted_mutual_info_score', 'jaccard_micro', 'neg_root_mean_squared_error', 'neg_brier_score', 'precision_macro', 'd2_absolute_error_score', 'balanced_accuracy', 'recall_micro', 'jaccard_weighted', 'neg_mean_poisson_deviance', 'neg_max_error', 'recall_weighted', 'f1_macro', 'f1_samples', 'precision_micro', 'neg_mean_absolute_percentage_error', 'jaccard_macro', 'neg_mean_absolute_error', 'adjusted_rand_score', 'explained_variance', 'top_k_accuracy', 'fowlkes_mallows_score', 'mutual_info_score', 'f1', 'homogeneity_score', 'matthews_corrcoef', 'average_precision', 'recall', 'f1_micro', 'precision', 'neg_negative_likelihood_ratio', 'recall_macro', 'neg_mean_gamma_deviance', 'roc_auc_ovr', 'roc_auc_ovr_weighted', 'precision_weighted', 'f1_weighted', 'neg_mean_squared_log_error', 'neg_median_absolute_error', 'r2', 'neg_mean_squared_error', 'precision_samples', 'v_measure_score', 'neg_log_loss', 'roc_auc', 'neg_root_mean_squared_log_error', 'd2_log_loss_score', 'jaccard_samples', 'normalized_mutual_info_score', 'completeness_score', 'accuracy', 'roc_auc_ovo_weighted'}, a callable or None. Got 'root_mean_squared_error' instead.
[W 2026-07-20 15:31:46,087] Trial 6 failed with value None.
[W 2026-07-20 15:31:46,153] Trial 2 failed with parameters: {'error_threshold': 3.0, 'scalers': 'robust', 'ratios': 'norm_ratio', 'imputers': 'median', 'n_estimators': 2750, 'learning_rate': 0.026714729739291433, 'max_depth': 11, 'min_child_weight': 4, 'subsample': 0.8, 'colsample_bytree': 0.6, 'colsample_bylevel': 0.6, 'reg_alpha': 33.38545398025414, 'reg_lambda': 0.00012605317641857936, 'gamma': 0.17116370422250798} because of the following error: InvalidParameterError("The 'scoring' parameter of cross_val_score must be a str among {'positive_likelihood_ratio', 'rand_score', 'roc_auc_ovo', 'recall_samples', 'd2_brier_score', 'jaccard', 'adjusted_mutual_info_score', 'jaccard_micro', 'neg_root_mean_squared_error', 'neg_brier_score', 'precision_macro', 'd2_absolute_error_score', 'balanced_accuracy', 'recall_micro', 'jaccard_weighted', 'neg_mean_poisson_deviance', 'neg_max_error', 'recall_weighted', 'f1_macro', 'f1_samples', 'precision_micro', 'neg_mean_absolute_percentage_error', 'jaccard_macro', 'neg_mean_absolute_error', 'adjusted_rand_score', 'explained_variance', 'top_k_accuracy', 'fowlkes_mallows_score', 'mutual_info_score', 'f1', 'homogeneity_score', 'matthews_corrcoef', 'average_precision', 'recall', 'f1_micro', 'precision', 'neg_negative_likelihood_ratio', 'recall_macro', 'neg_mean_gamma_deviance', 'roc_auc_ovr', 'roc_auc_ovr_weighted', 'precision_weighted', 'f1_weighted', 'neg_mean_squared_log_error', 'neg_median_absolute_error', 'r2', 'neg_mean_squared_error', 'precision_samples', 'v_measure_score', 'neg_log_loss', 'roc_auc', 'neg_root_mean_squared_log_error', 'd2_log_loss_score', 'jaccard_samples', 'normalized_mutual_info_score', 'completeness_score', 'accuracy', 'roc_auc_ovo_weighted'}, a callable or None. Got 'root_mean_squared_error' instead.").
Traceback (most recent call last):
  File "/bsuscratch/alexanderemert/miniforge3/envs/starform-alex/lib/python3.14/site-packages/optuna/study/_optimize.py", line 206, in _run_trial
    value_or_values = func(trial)
  File "/bsuhome/alexanderemert/Research/Star-Formation-Research-Project-2026/pipeline/scripts/optuna/final_preds_and_models/optuna_search_mult_quant_reg.py", line 231, in objective
    pickle.dump(results, file)
             ~~^^^^^^^^^^^^^^^
  File "/bsuscratch/alexanderemert/miniforge3/envs/starform-alex/lib/python3.14/site-packages/sklearn/utils/_param_validation.py", line 208, in wrapper
    validate_parameter_constraints(
    ~~~~~~~~~~~~~~~~~~~~~~~~~~~~~~^
        parameter_constraints, params, caller_name=func.__qualname__
        ^^^^^^^^^^^^^^^^^^^^^^^^^^^^^^^^^^^^^^^^^^^^^^^^^^^^^^^^^^^^
    )
    ^
  File "/bsuscratch/alexanderemert/miniforge3/envs/starform-alex/lib/python3.14/site-packages/sklearn/utils/_param_validation.py", line 98, in validate_parameter_constraints
    raise InvalidParameterError(
    ...<2 lines>...
    )
sklearn.utils._param_validation.InvalidParameterError: The 'scoring' parameter of cross_val_score must be a str among {'positive_likelihood_ratio', 'rand_score', 'roc_auc_ovo', 'recall_samples', 'd2_brier_score', 'jaccard', 'adjusted_mutual_info_score', 'jaccard_micro', 'neg_root_mean_squared_error', 'neg_brier_score', 'precision_macro', 'd2_absolute_error_score', 'balanced_accuracy', 'recall_micro', 'jaccard_weighted', 'neg_mean_poisson_deviance', 'neg_max_error', 'recall_weighted', 'f1_macro', 'f1_samples', 'precision_micro', 'neg_mean_absolute_percentage_error', 'jaccard_macro', 'neg_mean_absolute_error', 'adjusted_rand_score', 'explained_variance', 'top_k_accuracy', 'fowlkes_mallows_score', 'mutual_info_score', 'f1', 'homogeneity_score', 'matthews_corrcoef', 'average_precision', 'recall', 'f1_micro', 'precision', 'neg_negative_likelihood_ratio', 'recall_macro', 'neg_mean_gamma_deviance', 'roc_auc_ovr', 'roc_auc_ovr_weighted', 'precision_weighted', 'f1_weighted', 'neg_mean_squared_log_error', 'neg_median_absolute_error', 'r2', 'neg_mean_squared_error', 'precision_samples', 'v_measure_score', 'neg_log_loss', 'roc_auc', 'neg_root_mean_squared_log_error', 'd2_log_loss_score', 'jaccard_samples', 'normalized_mutual_info_score', 'completeness_score', 'accuracy', 'roc_auc_ovo_weighted'}, a callable or None. Got 'root_mean_squared_error' instead.
[W 2026-07-20 15:31:46,154] Trial 2 failed with value None.
[W 2026-07-20 15:31:46,159] Trial 4 failed with parameters: {'error_threshold': 0.5, 'scalers': 'robust', 'ratios': 'norm_ratio', 'imputers': 'none', 'n_estimators': 1250, 'learning_rate': 0.020029360073103932, 'max_depth': 5, 'min_child_weight': 10, 'subsample': 1.0, 'colsample_bytree': 1.0, 'colsample_bylevel': 0.6, 'reg_alpha': 0.00032125804651449114, 'reg_lambda': 3.9763371358293665e-06, 'gamma': 0.0016509930061899525} because of the following error: InvalidParameterError("The 'scoring' parameter of cross_val_score must be a str among {'positive_likelihood_ratio', 'rand_score', 'roc_auc_ovo', 'recall_samples', 'd2_brier_score', 'jaccard', 'adjusted_mutual_info_score', 'jaccard_micro', 'neg_root_mean_squared_error', 'neg_brier_score', 'precision_macro', 'd2_absolute_error_score', 'balanced_accuracy', 'recall_micro', 'jaccard_weighted', 'neg_mean_poisson_deviance', 'neg_max_error', 'recall_weighted', 'f1_macro', 'f1_samples', 'precision_micro', 'neg_mean_absolute_percentage_error', 'jaccard_macro', 'neg_mean_absolute_error', 'adjusted_rand_score', 'explained_variance', 'top_k_accuracy', 'fowlkes_mallows_score', 'mutual_info_score', 'f1', 'homogeneity_score', 'matthews_corrcoef', 'average_precision', 'recall', 'f1_micro', 'precision', 'neg_negative_likelihood_ratio', 'recall_macro', 'neg_mean_gamma_deviance', 'roc_auc_ovr', 'roc_auc_ovr_weighted', 'precision_weighted', 'f1_weighted', 'neg_mean_squared_log_error', 'neg_median_absolute_error', 'r2', 'neg_mean_squared_error', 'precision_samples', 'v_measure_score', 'neg_log_loss', 'roc_auc', 'neg_root_mean_squared_log_error', 'd2_log_loss_score', 'jaccard_samples', 'normalized_mutual_info_score', 'completeness_score', 'accuracy', 'roc_auc_ovo_weighted'}, a callable or None. Got 'root_mean_squared_error' instead.").
Traceback (most recent call last):
  File "/bsuscratch/alexanderemert/miniforge3/envs/starform-alex/lib/python3.14/site-packages/optuna/study/_optimize.py", line 206, in _run_trial
    value_or_values = func(trial)
  File "/bsuhome/alexanderemert/Research/Star-Formation-Research-Project-2026/pipeline/scripts/optuna/final_preds_and_models/optuna_search_mult_quant_reg.py", line 231, in objective
    pickle.dump(results, file)
             ~~^^^^^^^^^^^^^^^
  File "/bsuscratch/alexanderemert/miniforge3/envs/starform-alex/lib/python3.14/site-packages/sklearn/utils/_param_validation.py", line 208, in wrapper
    validate_parameter_constraints(
    ~~~~~~~~~~~~~~~~~~~~~~~~~~~~~~^
        parameter_constraints, params, caller_name=func.__qualname__
        ^^^^^^^^^^^^^^^^^^^^^^^^^^^^^^^^^^^^^^^^^^^^^^^^^^^^^^^^^^^^
    )
    ^
  File "/bsuscratch/alexanderemert/miniforge3/envs/starform-alex/lib/python3.14/site-packages/sklearn/utils/_param_validation.py", line 98, in validate_parameter_constraints
    raise InvalidParameterError(
    ...<2 lines>...
    )
sklearn.utils._param_validation.InvalidParameterError: The 'scoring' parameter of cross_val_score must be a str among {'positive_likelihood_ratio', 'rand_score', 'roc_auc_ovo', 'recall_samples', 'd2_brier_score', 'jaccard', 'adjusted_mutual_info_score', 'jaccard_micro', 'neg_root_mean_squared_error', 'neg_brier_score', 'precision_macro', 'd2_absolute_error_score', 'balanced_accuracy', 'recall_micro', 'jaccard_weighted', 'neg_mean_poisson_deviance', 'neg_max_error', 'recall_weighted', 'f1_macro', 'f1_samples', 'precision_micro', 'neg_mean_absolute_percentage_error', 'jaccard_macro', 'neg_mean_absolute_error', 'adjusted_rand_score', 'explained_variance', 'top_k_accuracy', 'fowlkes_mallows_score', 'mutual_info_score', 'f1', 'homogeneity_score', 'matthews_corrcoef', 'average_precision', 'recall', 'f1_micro', 'precision', 'neg_negative_likelihood_ratio', 'recall_macro', 'neg_mean_gamma_deviance', 'roc_auc_ovr', 'roc_auc_ovr_weighted', 'precision_weighted', 'f1_weighted', 'neg_mean_squared_log_error', 'neg_median_absolute_error', 'r2', 'neg_mean_squared_error', 'precision_samples', 'v_measure_score', 'neg_log_loss', 'roc_auc', 'neg_root_mean_squared_log_error', 'd2_log_loss_score', 'jaccard_samples', 'normalized_mutual_info_score', 'completeness_score', 'accuracy', 'roc_auc_ovo_weighted'}, a callable or None. Got 'root_mean_squared_error' instead.
[W 2026-07-20 15:31:46,160] Trial 4 failed with value None.
[W 