[I 2026-07-20 13:42:53,213] Trial 621 finished with value: -0.13726974569524567 and parameters: {'error_threshold': 2.75, 'scalers': 'none', 'ratios': 'norm_ratio', 'imputers': 'median', 'n_estimators': 250, 'learning_rate': 0.00011835824857769633, 'max_depth': 8, 'min_child_weight': 2, 'subsample': 1.0, 'colsample_bytree': 0.5, 'colsample_bylevel': 0.5, 'reg_alpha': 48.086858314736794, 'reg_lambda': 0.3636626026812822, 'gamma': 94.50387925182123}. Best is trial 472 with value: -0.13764739925059793.
[I 2026-07-20 13:42:53,408] Trial 622 finished with value: -0.13745977667527118 and parameters: {'error_threshold': 2.75, 'scalers': 'none', 'ratios': 'norm_ratio', 'imputers': 'median', 'n_estimators': 150, 'learning_rate': 0.00010028466686619062, 'max_depth': 8, 'min_child_weight': 2, 'subsample': 1.0, 'colsample_bytree': 0.5, 'colsample_bylevel': 0.5, 'reg_alpha': 42.53845181094871, 'reg_lambda': 0.4178436249608781, 'gamma': 33.26349760499948}. Best is trial 472 with value: -0.13764739925059793.
[I 2026-07-20 13:42:53,538] Trial 623 finished with value: -0.13744556524497417 and parameters: {'error_threshold': 2.75, 'scalers': 'none', 'ratios': 'norm_ratio', 'imputers': 'median', 'n_estimators': 100, 'learning_rate': 0.000117696008108657, 'max_depth': 8, 'min_child_weight': 2, 'subsample': 1.0, 'colsample_bytree': 0.5, 'colsample_bylevel': 0.5, 'reg_alpha': 1.892078269340863e-06, 'reg_lambda': 0.15109096445715312, 'gamma': 31.011884482864566}. Best is trial 472 with value: -0.13764739925059793.
[I 2026-07-20 13:42:53,701] Trial 624 finished with value: -0.13744598977374753 and parameters: {'error_threshold': 2.75, 'scalers': 'none', 'ratios': 'norm_ratio', 'imputers': 'median', 'n_estimators': 100, 'learning_rate': 0.00011744554167932426, 'max_depth': 8, 'min_child_weight': 2, 'subsample': 1.0, 'colsample_bytree': 0.5, 'colsample_bylevel': 0.5, 'reg_alpha': 1.3959798470297784e-06, 'reg_lambda': 0.3771383380360958, 'gamma': 30.62288636109466}. Best is trial 472 with value: -0.13764739925059793.
[I 2026-07-20 13:42:53,877] Trial 625 finished with value: -0.13746687490851506 and parameters: {'error_threshold': 2.75, 'scalers': 'none', 'ratios': 'norm_ratio', 'imputers': 'median', 'n_estimators': 100, 'learning_rate': 0.00011963590648687713, 'max_depth': 8, 'min_child_weight': 2, 'subsample': 1.0, 'colsample_bytree': 0.5, 'colsample_bylevel': 0.5, 'reg_alpha': 43.068240133373564, 'reg_lambda': 0.4003574070069013, 'gamma': 30.046735372117112}. Best is trial 472 with value: -0.13764739925059793.
[I 2026-07-20 13:42:53,956] Trial 626 finished with value: -0.1374445624802366 and parameters: {'error_threshold': 2.25, 'scalers': 'none', 'ratios': 'norm_ratio', 'imputers': 'median', 'n_estimators': 100, 'learning_rate': 0.00013447367086668723, 'max_depth': 8, 'min_child_weight': 2, 'subsample': 1.0, 'colsample_bytree': 0.5, 'colsample_bylevel': 0.5, 'reg_alpha': 49.76971169642059, 'reg_lambda': 0.40994148325326935, 'gamma': 27.409487948999022}. Best is trial 472 with value: -0.13764739925059793.
[I 2026-07-20 13:42:54,926] Trial 627 finished with value: -0.1374442815132799 and parameters: {'error_threshold': 2.25, 'scalers': 'none', 'ratios': 'norm_ratio', 'imputers': 'median', 'n_estimators': 100, 'learning_rate': 0.00013535522125480965, 'max_depth': 8, 'min_child_weight': 2, 'subsample': 1.0, 'colsample_bytree': 0.5, 'colsample_bylevel': 0.5, 'reg_alpha': 50.514104253551224, 'reg_lambda': 0.0030007111787330137, 'gamma': 24.18939270238329}. Best is trial 472 with value: -0.13764739925059793.
[I 2026-07-20 13:42:55,104] Trial 628 finished with value: -0.13738929244123 and parameters: {'error_threshold': 2.25, 'scalers': 'none', 'ratios': 'norm_ratio', 'imputers': 'median', 'n_estimators': 100, 'learning_rate': 0.00013605858460943702, 'max_depth': 8, 'min_child_weight': 2, 'subsample': 1.0, 'colsample_bytree': 0.5, 'colsample_bylevel': 0.5, 'reg_alpha': 1.784543900283252e-06, 'reg_lambda': 0.38052317266629154, 'gamma': 26.27481790615092}. Best is trial 472 with value: -0.13764739925059793.
[I 2026-07-20 13:42:55,363] Trial 629 finished with value: -0.13738830509200403 and parameters: {'error_threshold': 2.25, 'scalers': 'none', 'ratios': 'norm_ratio', 'imputers': 'median', 'n_estimators': 100, 'learning_rate': 0.00013658048113084957, 'max_depth': 8, 'min_child_weight': 2, 'subsample': 1.0, 'colsample_bytree': 0.5, 'colsample_bylevel': 0.5, 'reg_alpha': 1.7238018249114796e-06, 'reg_lambda': 0.005170398932477707, 'gamma': 23.765734106175195}. Best is trial 472 with value: -0.13764739925059793.
[I 2026-07-20 13:42:55,463] Trial 630 finished with value: -0.13739361750081777 and parameters: {'error_threshold': 2.25, 'scalers': 'none', 'ratios': 'norm_ratio', 'imputers': 'median', 'n_estimators': 100, 'learning_rate': 0.0001331613701294567, 'max_depth': 8, 'min_child_weight': 2, 'subsample': 1.0, 'colsample_bytree': 0.5, 'colsample_bylevel': 0.5, 'reg_alpha': 1.0305696998389355e-06, 'reg_lambda': 0.0063788266420376815, 'gamma': 13.398609758684369}. Best is trial 472 with value: -0.13764739925059793.
[I 2026-07-20 13:42:55,732] Trial 631 finished with value: -0.13743825216440375 and parameters: {'error_threshold': 2.25, 'scalers': 'none', 'ratios': 'norm_ratio', 'imputers': 'median', 'n_estimators': 100, 'learning_rate': 0.00013932978235892989, 'max_depth': 8, 'min_child_weight': 2, 'subsample': 1.0, 'colsample_bytree': 0.5, 'colsample_bylevel': 0.5, 'reg_alpha': 49.61150080744129, 'reg_lambda': 0.4468503295363438, 'gamma': 25.066500601835944}. Best is trial 472 with value: -0.13764739925059793.
[I 2026-07-20 13:42:55,889] Trial 632 finished with value: -0.13738943522458522 and parameters: {'error_threshold': 2.25, 'scalers': 'none', 'ratios': 'norm_ratio', 'imputers': 'median', 'n_estimators': 100, 'learning_rate': 0.00013598115610244927, 'max_depth': 8, 'min_child_weight': 2, 'subsample': 1.0, 'colsample_bytree': 0.5, 'colsample_bylevel': 0.5, 'reg_alpha': 1.1208781022278511e-06, 'reg_lambda': 0.44430302004612837, 'gamma': 22.391184207687775}. Best is trial 472 with value: -0.13764739925059793.
[I 2026-07-20 13:42:56,024] Trial 633 finished with value: -0.13737077394565947 and parameters: {'error_threshold': 2.75, 'scalers': 'none', 'ratios': 'norm_ratio', 'imputers': 'median', 'n_estimators': 100, 'learning_rate': 0.00014427484515308747, 'max_depth': 8, 'min_child_weight': 2, 'subsample': 1.0, 'colsample_bytree': 0.5, 'colsample_bylevel': 0.5, 'reg_alpha': 1.0879902864042377e-06, 'reg_lambda': 0.4099773614373633, 'gamma': 11.998884812944606}. Best is trial 472 with value: -0.13764739925059793.
[I 2026-07-20 13:42:56,065] Trial 634 finished with value: -0.1373855587329047 and parameters: {'error_threshold': 2.75, 'scalers': 'none', 'ratios': 'norm_ratio', 'imputers': 'median', 'n_estimators': 100, 'learning_rate': 0.00013803041777886684, 'max_depth': 8, 'min_child_weight': 2, 'subsample': 1.0, 'colsample_bytree': 0.5, 'colsample_bylevel': 0.5, 'reg_alpha': 1.009304528150739e-06, 'reg_lambda': 0.45936199213701634, 'gamma': 14.619559323228815}. Best is trial 472 with value: -0.13764739925059793.
[I 2026-07-20 13:42:56,712] Trial 635 finished with value: -0.13732430967442877 and parameters: {'error_threshold': 2.75, 'scalers': 'none', 'ratios': 'norm_ratio', 'imputers': 'median', 'n_estimators': 100, 'learning_rate': 0.0001704193700395336, 'max_depth': 8, 'min_child_weight': 2, 'subsample': 1.0, 'colsample_bytree': 0.5, 'colsample_bylevel': 0.5, 'reg_alpha': 1.208533767789922e-06, 'reg_lambda': 0.46456008307658836, 'gamma': 15.876449632223125}. Best is trial 472 with value: -0.13764739925059793.
[I 2026-07-20 13:42:56,874] Trial 636 finished with value: -0.13732983119699316 and parameters: {'error_threshold': 2.75, 'scalers': 'none', 'ratios': 'norm_ratio', 'imputers': 'median', 'n_estimators': 100, 'learning_rate': 0.00016722109441893448, 'max_depth': 8, 'min_child_weight': 2, 'subsample': 1.0, 'colsample_bytree': 0.5, 'colsample_bylevel': 0.5, 'reg_alpha': 1.2813726087691484e-06, 'reg_lambda': 0.5433632456367564, 'gamma': 13.615253247321794}. Best is trial 472 with value: -0.13764739925059793.
[I 2026-07-20 13:42:57,047] Trial 637 finished with value: -0.13739808406569964 and parameters: {'error_threshold': 2.75, 'scalers': 'none', 'ratios': 'norm_ratio', 'imputers': 'median', 'n_estimators': 100, 'learning_rate': 0.00016551681354854523, 'max_depth': 8, 'min_child_weight': 2, 'subsample': 1.0, 'colsample_bytree': 0.5, 'colsample_bylevel': 0.5, 'reg_alpha': 18.581450645643002, 'reg_lambda': 0.5428765109254058, 'gamma': 14.536352185172934}. Best is trial 472 with value: -0.13764739925059793.
[I 2026-07-20 13:42:57,128] Trial 638 finished with value: -0.08920411064730305 and parameters: {'error_threshold': 2.75, 'scalers': 'none', 'ratios': 'norm_ratio', 'imputers': 'median', 'n_estimators': 100, 'learning_rate': 0.09491537729779205, 'max_depth': 8, 'min_child_weight': 2, 'subsample': 1.0, 'colsample_bytree': 0.5, 'colsample_bylevel': 0.5, 'reg_alpha': 18.994538089360052, 'reg_lambda': 0.47954558643607564, 'gamma': 15.728555212584574}. Best is trial 472 with value: -0.13764739925059793.
