[I 2026-07-20 12:31:58,654] Trial 270 finished with value: -0.30726157896515494 and parameters: {'error_threshold': 0.75, 'scalers': 'none', 'ratios': 'norm_ratio', 'imputers': 'mean', 'n_estimators': 650, 'learning_rate': 0.037216903515369305, 'max_depth': 12, 'min_child_weight': 4, 'subsample': 0.7, 'colsample_bytree': 0.8, 'colsample_bylevel': 1.0, 'reg_alpha': 64.41774169951296, 'reg_lambda': 0.03903668025221277, 'gamma': 35.00252397480444}. Best is trial 69 with value: -0.3911874830873789.
[I 2026-07-20 12:31:59,433] Trial 271 finished with value: -0.2889030022593697 and parameters: {'error_threshold': 0.75, 'scalers': 'none', 'ratios': 'norm_ratio', 'imputers': 'mean', 'n_estimators': 600, 'learning_rate': 0.21651570961674727, 'max_depth': 12, 'min_child_weight': 4, 'subsample': 0.7, 'colsample_bytree': 0.9, 'colsample_bylevel': 1.0, 'reg_alpha': 60.997162424056526, 'reg_lambda': 0.0355897307259125, 'gamma': 36.46427860810555}. Best is trial 69 with value: -0.3911874830873789.
[I 2026-07-20 12:32:01,925] Trial 272 finished with value: -0.3911007167759679 and parameters: {'error_threshold': 0.75, 'scalers': 'none', 'ratios': 'norm_ratio', 'imputers': 'mean', 'n_estimators': 600, 'learning_rate': 0.03589390484456408, 'max_depth': 12, 'min_child_weight': 4, 'subsample': 0.7, 'colsample_bytree': 0.9, 'colsample_bylevel': 1.0, 'reg_alpha': 65.23030094884676, 'reg_lambda': 0.03188981797291083, 'gamma': 96.86401334636294}. Best is trial 69 with value: -0.3911874830873789.
[I 2026-07-20 12:32:02,587] Trial 273 finished with value: -0.2725966889201779 and parameters: {'error_threshold': 0.75, 'scalers': 'none', 'ratios': 'norm_ratio', 'imputers': 'mean', 'n_estimators': 400, 'learning_rate': 0.03698604214049962, 'max_depth': 12, 'min_child_weight': 3, 'subsample': 0.7, 'colsample_bytree': 0.9, 'colsample_bylevel': 1.0, 'reg_alpha': 64.01553254581334, 'reg_lambda': 0.0372567097394471, 'gamma': 19.395981530326726}. Best is trial 69 with value: -0.3911874830873789.
[I 2026-07-20 12:32:03,653] Trial 274 finished with value: -0.39110129149746226 and parameters: {'error_threshold': 0.75, 'scalers': 'none', 'ratios': 'norm_ratio', 'imputers': 'mean', 'n_estimators': 600, 'learning_rate': 0.03723046706164687, 'max_depth': 12, 'min_child_weight': 4, 'subsample': 0.7, 'colsample_bytree': 0.8, 'colsample_bylevel': 1.0, 'reg_alpha': 62.47338879418619, 'reg_lambda': 0.034922959900924734, 'gamma': 98.39773000536223}. Best is trial 69 with value: -0.3911874830873789.
[I 2026-07-20 12:32:06,105] Trial 275 finished with value: -0.27179327886394083 and parameters: {'error_threshold': 0.75, 'scalers': 'none', 'ratios': 'norm_ratio', 'imputers': 'mean', 'n_estimators': 600, 'learning_rate': 0.05346561913226468, 'max_depth': 12, 'min_child_weight': 4, 'subsample': 0.7, 'colsample_bytree': 0.8, 'colsample_bylevel': 1.0, 'reg_alpha': 65.43629467244148, 'reg_lambda': 3.702032758145578, 'gamma': 19.286550513237827}. Best is trial 69 with value: -0.3911874830873789.
[I 2026-07-20 12:32:06,371] Trial 276 finished with value: -0.24220244507872998 and parameters: {'error_threshold': 0.75, 'scalers': 'none', 'ratios': 'norm_ratio', 'imputers': 'mean', 'n_estimators': 400, 'learning_rate': 0.2222650434528243, 'max_depth': 12, 'min_child_weight': 4, 'subsample': 0.8, 'colsample_bytree': 0.8, 'colsample_bylevel': 1.0, 'reg_alpha': 44.75998896011217, 'reg_lambda': 0.026984819959301777, 'gamma': 20.30319820553723}. Best is trial 69 with value: -0.3911874830873789.
[I 2026-07-20 12:32:07,126] Trial 277 finished with value: -0.2859647314547729 and parameters: {'error_threshold': 0.75, 'scalers': 'none', 'ratios': 'norm_ratio', 'imputers': 'mean', 'n_estimators': 600, 'learning_rate': 0.23472429803965575, 'max_depth': 12, 'min_child_weight': 4, 'subsample': 0.8, 'colsample_bytree': 0.9, 'colsample_bylevel': 1.0, 'reg_alpha': 70.82520874449517, 'reg_lambda': 0.03531030636027944, 'gamma': 35.16543227781359}. Best is trial 69 with value: -0.3911874830873789.
[I 2026-07-20 12:32:07,507] Trial 278 finished with value: -0.2469609471225508 and parameters: {'error_threshold': 0.75, 'scalers': 'none', 'ratios': 'norm_ratio', 'imputers': 'mean', 'n_estimators': 600, 'learning_rate': 0.036296105542845264, 'max_depth': 12, 'min_child_weight': 4, 'subsample': 0.8, 'colsample_bytree': 0.9, 'colsample_bylevel': 1.0, 'reg_alpha': 45.79843873321413, 'reg_lambda': 0.025503328866264906, 'gamma': 19.263112601455582}. Best is trial 69 with value: -0.3911874830873789.
[I 2026-07-20 12:32:08,403] Trial 279 finished with value: -0.2784876485725199 and parameters: {'error_threshold': 0.75, 'scalers': 'none', 'ratios': 'norm_ratio', 'imputers': 'mean', 'n_estimators': 600, 'learning_rate': 0.31459014102150273, 'max_depth': 12, 'min_child_weight': 4, 'subsample': 0.8, 'colsample_bytree': 0.9, 'colsample_bylevel': 1.0, 'reg_alpha': 43.29668115431828, 'reg_lambda': 4.5810590037931895, 'gamma': 44.205593255117165}. Best is trial 69 with value: -0.3911874830873789.
[I 2026-07-20 12:32:11,137] Trial 280 finished with value: -0.2776203853967264 and parameters: {'error_threshold': 0.75, 'scalers': 'none', 'ratios': 'norm_ratio', 'imputers': 'mean', 'n_estimators': 750, 'learning_rate': 0.30316430393561855, 'max_depth': 12, 'min_child_weight': 4, 'subsample': 0.7, 'colsample_bytree': 0.9, 'colsample_bylevel': 1.0, 'reg_alpha': 38.92405201586313, 'reg_lambda': 2.172727910055752, 'gamma': 44.31255763980763}. Best is trial 69 with value: -0.3911874830873789.
[I 2026-07-20 12:32:11,850] Trial 281 finished with value: -0.2829690267547531 and parameters: {'error_threshold': 0.75, 'scalers': 'none', 'ratios': 'norm_ratio', 'imputers': 'mean', 'n_estimators': 550, 'learning_rate': 0.3319770578206161, 'max_depth': 12, 'min_child_weight': 4, 'subsample': 0.7, 'colsample_bytree': 0.9, 'colsample_bylevel': 1.0, 'reg_alpha': 39.41419863982602, 'reg_lambda': 3.6615439251740636, 'gamma': 45.37889598258964}. Best is trial 69 with value: -0.3911874830873789.
[I 2026-07-20 12:32:13,080] Trial 282 finished with value: -0.3193666446670122 and parameters: {'error_threshold': 0.75, 'scalers': 'none', 'ratios': 'norm_ratio', 'imputers': 'mean', 'n_estimators': 550, 'learning_rate': 0.3162164391396841, 'max_depth': 12, 'min_child_weight': 4, 'subsample': 0.7, 'colsample_bytree': 0.9, 'colsample_bylevel': 1.0, 'reg_alpha': 39.76388117115768, 'reg_lambda': 0.02537651662217656, 'gamma': 71.88232962733424}. Best is trial 69 with value: -0.3911874830873789.
[I 2026-07-20 12:32:15,481] Trial 283 finished with value: -0.2723655946894352 and parameters: {'error_threshold': 0.75, 'scalers': 'none', 'ratios': 'norm_ratio', 'imputers': 'mean', 'n_estimators': 750, 'learning_rate': 0.3382112006979888, 'max_depth': 12, 'min_child_weight': 4, 'subsample': 0.8, 'colsample_bytree': 0.9, 'colsample_bylevel': 1.0, 'reg_alpha': 38.62510718686169, 'reg_lambda': 0.0245867678433938, 'gamma': 44.043058379796925}. Best is trial 69 with value: -0.3911874830873789.
[I 2026-07-20 12:32:15,814] Trial 284 finished with value: -0.3228051211166831 and parameters: {'error_threshold': 0.5, 'scalers': 'none', 'ratios': 'norm_ratio', 'imputers': 'mean', 'n_estimators': 550, 'learning_rate': 0.3981669282725657, 'max_depth': 12, 'min_child_weight': 4, 'subsample': 0.7, 'colsample_bytree': 0.9, 'colsample_bylevel': 1.0, 'reg_alpha': 39.28689491286403, 'reg_lambda': 0.05884270231570136, 'gamma': 72.74453460711939}. Best is trial 69 with value: -0.3911874830873789.
[I 2026-07-20 12:32:16,640] Trial 285 finished with value: -0.32651383334201334 and parameters: {'error_threshold': 0.5, 'scalers': 'none', 'ratios': 'norm_ratio', 'imputers': 'mean', 'n_estimators': 550, 'learning_rate': 0.3592903362760321, 'max_depth': 12, 'min_child_weight': 4, 'subsample': 0.7, 'colsample_bytree': 0.9, 'colsample_bylevel': 1.0, 'reg_alpha': 41.65097843615432, 'reg_lambda': 0.20327914617337436, 'gamma': 74.72294425197545}. Best is trial 69 with value: -0.3911874830873789.
[I 2026-07-20 12:32:16,982] Trial 286 finished with value: -0.391093182075167 and parameters: {'error_threshold': 0.5, 'scalers': 'none', 'ratios': 'norm_ratio', 'imputers': 'mean', 'n_estimators': 550, 'learning_rate': 0.026907739536041177, 'max_depth': 12, 'min_child_weight': 4, 'subsample': 0.7, 'colsample_bytree': 0.9, 'colsample_bylevel': 1.0, 'reg_alpha': 41.655808626258306, 'reg_lambda': 0.02263547861889037, 'gamma': 99.84317723966856}. Best is trial 69 with value: -0.3911874830873789.
[I 2026-07-20 12:32:17,704] Trial 287 finished with value: -0.39117334869876313 and parameters: {'error_threshold': 0.5, 'scalers': 'none', 'ratios': 'norm_ratio', 'imputers': 'mean', 'n_estimators': 550, 'learning_rate': 0.37092247369145476, 'max_depth': 12, 'min_child_weight': 4, 'subsample': 0.7, 'colsample_bytree': 0.9, 'colsample_bylevel': 1.0, 'reg_alpha': 37.42562123101654, 'reg_lambda': 0.023414270923069674, 'gamma': 98.68565759471358}. Best is trial 69 with value: -0.3911874830873789.
[I 2026-07-20 12:32:20,938] Trial 288 finished with value: -0.36169435166706015 and parameters: {'error_threshold': 0.5, 'scalers': 'none', 'ratios': 'norm_ratio', 'imputers': 'mean', 'n_estimators': 550, 'learning_rate': 0.02670597783385674, 'max_depth': 12, 'min_child_weight': 4, 'subsample': 0.7, 'colsample_bytree': 0.8, 'colsample_bylevel': 1.0, 'reg_alpha': 39.06143098536828, 'reg_lambda': 2.9695564388455312e-05, 'gamma': 72.62161193681678}. Best is trial 69 with value: -0.3911874830873789.
[I 2026-07-20 12:32:21,401] Trial 289 finished with value: -0.39102119533174035 and parameters: {'error_threshold': 0.5, 'scalers': 'none', 'ratios': 'norm_ratio', 'imputers': 'mean', 'n_estimators': 750, 'learning_rate': 0.3890213606308856, 'max_depth': 12, 'min_child_weight': 4, 'subsample': 0.7, 'colsample_bytree': 0.8, 'colsample_bylevel': 1.0, 'reg_alpha': 98.82573513737489, 'reg_lambda': 0.056536465332124496, 'gamma': 70.24660211202298}. Best is trial 69 with value: -0.3911874830873789.
[I 2026-07-20 12:32:23,072] Trial 290 finished with value: -0.39102080667982614 and parameters: {'error_threshold': 0.5, 'scalers': 'none', 'ratios': 'norm_ratio', 'imputers': 'mean', 'n_estimators': 750, 'learning_rate': 0.392923420648182, 'max_depth': 12, 'min_child_weight': 4, 'subsample': 0.7, 'colsample_bytree': 0.8, 'colsample_bylevel': 1.0, 'reg_alpha': 75.18880182716596, 'reg_lambda': 0.06375667421754275, 'gamma': 76.45618675571674}. Best is trial 69 with value: -0.3911874830873789.
[I 2026-07-20 12:32:26,419] Trial 291 finished with value: -0.391182687659787 and parameters: {'error_threshold': 0.5, 'scalers': 'none', 'ratios': 'norm_ratio', 'imputers': 'mean', 'n_estimators': 550, 'learning_rate': 0.4113726670073574, 'max_depth': 12, 'min_child_weight': 4, 'subsample': 0.7, 'colsample_bytree': 0.8, 'colsample_bylevel': 1.0, 'reg_alpha': 72.78494219266761, 'reg_lambda': 4.2064358391896044e-05, 'gamma': 68.65655436894585}. Best is trial 69 with value: -0.3911874830873789.
[I 2026-07-20 12:32:27,803] Trial 293 finished with value: -0.3910890964917401 and parameters: {'error_threshold': 1.0, 'scalers': 'none', 'ratios': 'norm_ratio', 'imputers': 'none', 'n_estimators': 400, 'learning_rate': 0.028187738069842826, 'max_depth': 11, 'min_child_weight': 4, 'subsample': 0.7, 'colsample_bytree': 0.8, 'colsample_bylevel': 1.0, 'reg_alpha': 74.12052211377002, 'reg_lambda': 0.08388404903882837, 'gamma': 69.56463992937526}. Best is trial 69 with value: -0.3911874830873789.
[I 2026-07-20 12:32:28,041] Trial 294 finished with value: -0.39108882870153844 and parameters: {'error_threshold': 1.25, 'scalers': 'none', 'ratios': 'norm_ratio', 'imputers': 'none', 'n_estimators': 400, 'learning_rate': 0.02516912024606963, 'max_depth': 11, 'min_child_weight': 4, 'subsample': 0.7, 'colsample_bytree': 0.8, 'colsample_bylevel': 0.7, 'reg_alpha': 99.72098084294325, 'reg_lambda': 0.047018009557860604, 'gamma': 69.11728379292204}. Best is trial 69 with value: -0.3911874830873789.
[I 2026-07-20 12:32:29,414] Trial 292 finished with value: -0.39107389956398314 and parameters: {'error_threshold': 0.5, 'scalers': 'none', 'ratios': 'norm_ratio', 'imputers': 'mean', 'n_estimators': 1850, 'learning_rate': 0.027224518365639248, 'max_depth': 11, 'min_child_weight': 4, 'subsample': 0.7, 'colsample_bytree': 0.8, 'colsample_bylevel': 1.0, 'reg_alpha': 71.98626744051923, 'reg_lambda': 0.07464618510699608, 'gamma': 72.60098325734614}. Best is trial 69 with value: -0.3911874830873789.
[I 2026-07-20 12:32:32,756] Trial 295 finished with value: -0.3910840891167924 and parameters: {'error_threshold': 1.25, 'scalers': 'none', 'ratios': 'norm_ratio', 'imputers': 'none', 'n_estimators': 1450, 'learning_rate': 0.030522825706506183, 'max_depth': 11, 'min_child_weight': 4, 'subsample': 0.7, 'colsample_bytree': 0.8, 'colsample_bylevel': 0.7, 'reg_alpha': 75.08416791397218, 'reg_lambda': 0.05480455971972986, 'gamma': 70.23698355532167}. Best is trial 69 with value: -0.3911874830873789.
[I 2026-07-20 12:32:33,387] Trial 297 finished with value: -0.39110467793618825 and parameters: {'error_threshold': 1.25, 'scalers': 'none', 'ratios': 'norm_ratio', 'imputers': 'mean', 'n_estimators': 400, 'learning_rate': 0.10350817898288471, 'max_depth': 11, 'min_child_weight': 4, 'subsample': 0.7, 'colsample_bytree': 0.8, 'colsample_bylevel': 0.7, 'reg_alpha': 65.20923574656578, 'reg_lambda': 0.016474950990938295, 'gamma': 99.99671336985408}. Best is trial 69 with value: -0.3911874830873789.
[I 2026-07-20 12:32:34,394] Trial 298 finished with value: -0.36390173879382903 and parameters: {'error_threshold': 1.25, 'scalers': 'none', 'ratios': 'norm_ratio', 'imputers': 'mean', 'n_estimators': 400, 'learning_rate': 0.03145007108333629, 'max_depth': 11, 'min_child_weight': 4, 'subsample': 0.7, 'colsample_bytree': 0.8, 'colsample_bylevel': 1.0, 'reg_alpha': 10.475038939745824, 'reg_lambda': 4.805386361936894e-05, 'gamma': 98.15891308558972}. Best is trial 69 with value: -0.3911874830873789.
[I 2026-07-20 12:32:35,463] Trial 296 finished with value: -0.39108291021811564 and parameters: {'error_threshold': 5.0, 'scalers': 'none', 'ratios': 'norm_ratio', 'imputers': 'none', 'n_estimators': 1900, 'learning_rate': 0.10216404025176642, 'max_depth': 11, 'min_child_weight': 4, 'subsample': 0.7, 'colsample_bytree': 0.8, 'colsample_bylevel': 0.7, 'reg_alpha': 70.98018192117961, 'reg_lambda': 0.057778213867192015, 'gamma': 96.65191751800805}. Best is trial 69 with value: -0.3911874830873789.
[I 2026-07-20 12:32:40,103] Trial 300 finished with value: -0.32158159188772184 and parameters: {'error_threshold': 1.25, 'scalers': 'none', 'ratios': 'norm_ratio', 'imputers': 'mean', 'n_estimators': 600, 'learning_rate': 0.4529855074736773, 'max_depth': 8, 'min_child_weight': 4, 'subsample': 0.7, 'colsample_bytree': 0.8, 'colsample_bylevel': 1.0, 'reg_alpha': 10.403338296149489, 'reg_lambda': 4.7099933415400905e-05, 'gamma': 97.78135738843137}. Best is trial 69 with value: -0.3911874830873789.
[I 2026-07-20 12:32:41,220] Trial 299 finished with value: -0.3116631013615053 and parameters: {'error_threshold': 1.25, 'scalers': 'none', 'ratios': 'norm_ratio', 'imputers': 'none', 'n_estimators': 1850, 'learning_rate': 0.2692977145470488, 'max_depth': 11, 'min_child_weight': 4, 'subsample': 0.7, 'colsample_bytree': 0.8, 'colsample_bylevel': 1.0, 'reg_alpha': 11.002531968649278, 'reg_lambda': 1.530610575266466e-05, 'gamma': 90.84374919120647}. Best is trial 69 with value: -0.3911874830873789.
[I 2026-07-20 12:32:42,020] Trial 301 finished with value: -0.3206020446000663 and parameters: {'error_threshold': 3.75, 'scalers': 'none', 'ratios': 'norm_ratio', 'imputers': 'mean', 'n_estimators': 600, 'learning_rate': 0.45732050216164694, 'max_depth': 8, 'min_child_weight': 4, 'subsample': 0.7, 'colsample_bytree': 0.8, 'colsample_bylevel': 1.0, 'reg_alpha': 18.52767237055804, 'reg_lambda': 1.8657484941600498e-05, 'gamma': 94.83896827293506}. Best is trial 69 with value: -0.3911874830873789.
[I 2026-07-20 12:32:42,392] Trial 302 finished with value: -0.2451001832535847 and parameters: {'error_threshold': 3.75, 'scalers': 'none', 'ratios': 'norm_ratio', 'imputers': 'mean', 'n_estimators': 600, 'learning_rate': 0.4450716940412446, 'max_depth': 8, 'min_child_weight': 4, 'subsample': 0.7, 'colsample_bytree': 0.8, 'colsample_bylevel': 1.0, 'reg_alpha': 17.730996593258677, 'reg_lambda': 4.116839659668121e-05, 'gamma': 28.8637453936625}. Best is trial 69 with value: -0.3911874830873789.
[I 2026-07-20 12:32:43,527] Trial 303 finished with value: -0.24104974097013118 and parameters: {'error_threshold': 1.5, 'scalers': 'none', 'ratios': 'norm_ratio', 'imputers': 'mean', 'n_estimators': 600, 'learning_rate': 0.4417224595397283, 'max_depth': 10, 'min_child_weight': 4, 'subsample': 0.7, 'colsample_bytree': 0.8, 'colsample_bylevel': 1.0, 'reg_alpha': 10.756474270208027, 'reg_lambda': 0.016470158794990163, 'gamma': 29.997073649298947}. Best is trial 69 with value: -0.3911874830873789.
[I 2026-07-20 12:32:44,832] Trial 304 finished with value: -0.31957088344555634 and parameters: {'error_threshold': 1.5, 'scalers': 'none', 'ratios': 'norm_ratio', 'imputers': 'mean', 'n_estimators': 600, 'learning_rate': 0.41968366579444194, 'max_depth': 8, 'min_child_weight': 4, 'subsample': 0.7, 'colsample_bytree': 0.8, 'colsample_bylevel': 1.0, 'reg_alpha': 10.574758977135733, 'reg_lambda': 0.01895842864847713, 'gamma': 95.25547309771956}. Best is trial 69 with value: -0.3911874830873789.
[I 2026-07-20 12:32:45,523] Trial 305 finished with value: -0.3632342140675204 and parameters: {'error_threshold': 1.5, 'scalers': 'none', 'ratios': 'norm_ratio', 'imputers': 'mean', 'n_estimators': 600, 'learning_rate': 0.10198728890128977, 'max_depth': 10, 'min_child_weight': 4, 'subsample': 0.7, 'colsample_bytree': 1.0, 'colsample_bylevel': 0.7, 'reg_alpha': 18.886430685954657, 'reg_lambda': 0.012930018988363014, 'gamma': 96.81412128178508}. Best is trial 69 with value: -0.3911874830873789.
[I 2026-07-20 12:32:45,842] Trial 306 finished with value: -0.2720830708377588 and parameters: {'error_threshold': 1.5, 'scalers': 'none', 'ratios': 'norm_ratio', 'imputers': 'mean', 'n_estimators': 550, 'learning_rate': 0.2723801473506468, 'max_depth': 8, 'min_child_weight': 4, 'subsample': 0.7, 'colsample_bytree': 0.8, 'colsample_bylevel': 0.7, 'reg_alpha': 53.048012325472314, 'reg_lambda': 1.0324693218822372, 'gamma': 29.74517406073645}. Best is trial 69 with value: -0.3911874830873789.
[I 2026-07-20 12:32:50,222] Trial 307 finished with value: -0.282479465720125 and parameters: {'error_threshold': 1.5, 'scalers': 'none', 'ratios': 'norm_ratio', 'imputers': 'mean', 'n_estimators': 500, 'learning_rate': 0.035247102471794946, 'max_depth': 10, 'min_child_weight': 4, 'subsample': 0.7, 'colsample_bytree': 0.8, 'colsample_bylevel': 0.7, 'reg_alpha': 53.97755140039969, 'reg_lambda': 0.01873739511040781, 'gamma': 28.798511119297466}. Best is trial 69 with value: -0.3911874830873789.
[I 2026-07-20 12:32:52,608] Trial 308 finished with value: -0.2657001706371727 and parameters: {'error_threshold': 1.0, 'scalers': 'none', 'ratios': 'norm_ratio', 'imputers': 'mean', 'n_estimators': 1050, 'learning_rate': 0.44969076459791973, 'max_depth': 10, 'min_child_weight': 4, 'subsample': 0.7, 'colsample_bytree': 0.8, 'colsample_bylevel': 0.7, 'reg_alpha': 52.75125960309607, 'reg_lambda': 0.017183067946181033, 'gamma': 28.308147367514415}. Best is trial 69 with value: -0.3911874830873789.
[I 2026-07-20 12:32:52,902] Trial 310 finished with value: -0.3194824467584515 and parameters: {'error_threshold': 1.0, 'scalers': 'none', 'ratios': 'norm_ratio', 'imputers': 'mean', 'n_estimators': 500, 'learning_rate': 0.03531098694491237, 'max_depth': 10, 'min_child_weight': 4, 'subsample': 0.7, 'colsample_bytree': 1.0, 'colsample_bylevel': 0.7, 'reg_alpha': 52.71366444260329, 'reg_lambda': 0.014869253467086663, 'gamma': 47.2260373802827}. Best is trial 69 with value: -0.3911874830873789.
[I 2026-07-20 12:32:53,747] Trial 311 finished with value: -0.33622853275869957 and parameters: {'error_threshold': 1.5, 'scalers': 'none', 'ratios': 'norm_ratio', 'imputers': 'mean', 'n_estimators': 500, 'learning_rate': 0.03494981803661957, 'max_depth': 10, 'min_child_weight': 4, 'subsample': 0.7, 'colsample_bytree': 1.0, 'colsample_bylevel': 0.6, 'reg_alpha': 55.03648594607441, 'reg_lambda': 0.006445406312411557, 'gamma': 52.107446961291295}. Best is trial 69 with value: -0.3911874830873789.
[I 2026-07-20 12:32:55,474] Trial 312 finished with value: -0.32314464362590695 and parameters: {'error_threshold': 1.0, 'scalers': 'none', 'ratios': 'norm_ratio', 'imputers': 'mean', 'n_estimators': 500, 'learning_rate': 0.18380970068124466, 'max_depth': 10, 'min_child_weight': 4, 'subsample': 0.7, 'colsample_bytree': 0.8, 'colsample_bylevel': 0.6, 'reg_alpha': 54.82423241498516, 'reg_lambda': 0.02752052951075843, 'gamma': 53.93113369287463}. Best is trial 69 with value: -0.3911874830873789.
[I 2026-07-20 12:32:56,076] Trial 314 finished with value: -0.3248614002812683 and parameters: {'error_threshold': 1.0, 'scalers': 'none', 'ratios': 'norm_ratio', 'imputers': 'mean', 'n_estimators': 300, 'learning_rate': 0.03267750402803616, 'max_depth': 11, 'min_child_weight': 4, 'subsample': 0.7, 'colsample_bytree': 0.9, 'colsample_bylevel': 0.7, 'reg_alpha': 49.693706802568634, 'reg_lambda': 0.028165688004498687, 'gamma': 50.3942381116584}. Best is trial 69 with value: -0.3911874830873789.
[I 2026-07-20 12:32:57,467] Trial 309 finished with value: -0.2774956116934438 and parameters: {'error_threshold': 1.0, 'scalers': 'none', 'ratios': 'norm_ratio', 'imputers': 'mean', 'n_estimators': 2500, 'learning_rate': 0.05020318444026493, 'max_depth': 10, 'min_child_weight': 4, 'subsample': 0.7, 'colsample_bytree': 0.8, 'colsample_bylevel': 0.7, 'reg_alpha': 52.57832338125404, 'reg_lambda': 0.01418611644664566, 'gamma': 28.931320410554545}. Best is trial 69 with value: -0.3911874830873789.
