[I 2026-07-20 15:12:51,606] Trial 188 finished with value: -7.73694440479073 and parameters: {'error_threshold': 4.6, 'scalers': 'none', 'ratios': 'log_ratio', 'imputers': 'none', 'n_estimators': 2100, 'learning_rate': 0.0028633177463761542, 'max_depth': 4, 'min_child_weight': 8, 'subsample': 0.5, 'colsample_bytree': 1.0, 'colsample_bylevel': 0.5, 'reg_alpha': 8.508129260907182, 'reg_lambda': 0.0038865673824583446, 'gamma': 1.383283677798722e-06}. Best is trial 82 with value: -7.731843858789701.
/bsuhome/alexanderemert/Research/Star-Formation-Research-Project-2026/pipeline/scripts/optuna/final_preds_and_models/optuna_search_mult_quant_reg.py:161: UserWarning: The distribution is specified by [0.1, 5] and step=0.25, but the range is not divisible by `step`. It will be replaced with [0.1, 4.85].
  error_threshold = trial.suggest_float("error_threshold", 0.1, 5, step=0.25)
[I 2026-07-20 15:12:53,771] Trial 189 finished with value: -7.751632691852443 and parameters: {'error_threshold': 4.6, 'scalers': 'none', 'ratios': 'log_ratio', 'imputers': 'none', 'n_estimators': 2100, 'learning_rate': 0.003921224189689144, 'max_depth': 4, 'min_child_weight': 8, 'subsample': 0.5, 'colsample_bytree': 1.0, 'colsample_bylevel': 0.5, 'reg_alpha': 8.30885346795825, 'reg_lambda': 0.003508236359157276, 'gamma': 1.4134250381782683e-06}. Best is trial 82 with value: -7.731843858789701.
/bsuhome/alexanderemert/Research/Star-Formation-Research-Project-2026/pipeline/scripts/optuna/final_preds_and_models/optuna_search_mult_quant_reg.py:161: UserWarning: The distribution is specified by [0.1, 5] and step=0.25, but the range is not divisible by `step`. It will be replaced with [0.1, 4.85].
  error_threshold = trial.suggest_float("error_threshold", 0.1, 5, step=0.25)
[I 2026-07-20 15:12:55,924] Trial 190 finished with value: -7.734288371980729 and parameters: {'error_threshold': 4.6, 'scalers': 'none', 'ratios': 'log_ratio', 'imputers': 'none', 'n_estimators': 2050, 'learning_rate': 0.002898507872387853, 'max_depth': 4, 'min_child_weight': 9, 'subsample': 0.5, 'colsample_bytree': 1.0, 'colsample_bylevel': 0.5, 'reg_alpha': 10.11794179466563, 'reg_lambda': 0.003388784645094241, 'gamma': 1.5761110005037692e-06}. Best is trial 82 with value: -7.731843858789701.
/bsuhome/alexanderemert/Research/Star-Formation-Research-Project-2026/pipeline/scripts/optuna/final_preds_and_models/optuna_search_mult_quant_reg.py:161: UserWarning: The distribution is specified by [0.1, 5] and step=0.25, but the range is not divisible by `step`. It will be replaced with [0.1, 4.85].
  error_threshold = trial.suggest_float("error_threshold", 0.1, 5, step=0.25)
[I 2026-07-20 15:12:58,061] Trial 191 finished with value: -7.737360618656414 and parameters: {'error_threshold': 4.6, 'scalers': 'none', 'ratios': 'log_ratio', 'imputers': 'none', 'n_estimators': 2050, 'learning_rate': 0.0029015655173341777, 'max_depth': 4, 'min_child_weight': 8, 'subsample': 0.5, 'colsample_bytree': 1.0, 'colsample_bylevel': 0.5, 'reg_alpha': 8.534477630761625, 'reg_lambda': 0.004098321110045185, 'gamma': 1.5199108267041054e-06}. Best is trial 82 with value: -7.731843858789701.
/bsuhome/alexanderemert/Research/Star-Formation-Research-Project-2026/pipeline/scripts/optuna/final_preds_and_models/optuna_search_mult_quant_reg.py:161: UserWarning: The distribution is specified by [0.1, 5] and step=0.25, but the range is not divisible by `step`. It will be replaced with [0.1, 4.85].
  error_threshold = trial.suggest_float("error_threshold", 0.1, 5, step=0.25)
[I 2026-07-20 15:13:00,253] Trial 192 finished with value: -7.733738671359276 and parameters: {'error_threshold': 4.6, 'scalers': 'none', 'ratios': 'log_ratio', 'imputers': 'none', 'n_estimators': 2100, 'learning_rate': 0.002766096936276099, 'max_depth': 4, 'min_child_weight': 9, 'subsample': 0.5, 'colsample_bytree': 1.0, 'colsample_bylevel': 0.5, 'reg_alpha': 9.084895604106057, 'reg_lambda': 0.0036328872995154164, 'gamma': 2.107582327609816e-06}. Best is trial 82 with value: -7.731843858789701.
/bsuhome/alexanderemert/Research/Star-Formation-Research-Project-2026/pipeline/scripts/optuna/final_preds_and_models/optuna_search_mult_quant_reg.py:161: UserWarning: The distribution is specified by [0.1, 5] and step=0.25, but the range is not divisible by `step`. It will be replaced with [0.1, 4.85].
  error_threshold = trial.suggest_float("error_threshold", 0.1, 5, step=0.25)
[I 2026-07-20 15:13:02,230] Trial 193 finished with value: -7.734286420959129 and parameters: {'error_threshold': 4.6, 'scalers': 'none', 'ratios': 'log_ratio', 'imputers': 'none', 'n_estimators': 1950, 'learning_rate': 0.0027297747300412925, 'max_depth': 4, 'min_child_weight': 9, 'subsample': 0.5, 'colsample_bytree': 1.0, 'colsample_bylevel': 0.5, 'reg_alpha': 10.631992622680185, 'reg_lambda': 0.00984786857511822, 'gamma': 2.1742201974725137e-06}. Best is trial 82 with value: -7.731843858789701.
/bsuhome/alexanderemert/Research/Star-Formation-Research-Project-2026/pipeline/scripts/optuna/final_preds_and_models/optuna_search_mult_quant_reg.py:161: UserWarning: The distribution is specified by [0.1, 5] and step=0.25, but the range is not divisible by `step`. It will be replaced with [0.1, 4.85].
  error_threshold = trial.suggest_float("error_threshold", 0.1, 5, step=0.25)
[I 2026-07-20 15:13:04,385] Trial 194 finished with value: -7.735237915946225 and parameters: {'error_threshold': 4.6, 'scalers': 'none', 'ratios': 'log_ratio', 'imputers': 'none', 'n_estimators': 2000, 'learning_rate': 0.002612608228030095, 'max_depth': 4, 'min_child_weight': 9, 'subsample': 0.5, 'colsample_bytree': 1.0, 'colsample_bylevel': 0.5, 'reg_alpha': 16.951828286370112, 'reg_lambda': 0.009624586867610611, 'gamma': 2.1063811994937376e-06}. Best is trial 82 with value: -7.731843858789701.
/bsuhome/alexanderemert/Research/Star-Formation-Research-Project-2026/pipeline/scripts/optuna/final_preds_and_models/optuna_search_mult_quant_reg.py:161: UserWarning: The distribution is specified by [0.1, 5] and step=0.25, but the range is not divisible by `step`. It will be replaced with [0.1, 4.85].
  error_threshold = trial.suggest_float("error_threshold", 0.1, 5, step=0.25)
[I 2026-07-20 15:13:06,467] Trial 196 finished with value: -7.735755919030717 and parameters: {'error_threshold': 4.6, 'scalers': 'none', 'ratios': 'log_ratio', 'imputers': 'none', 'n_estimators': 1950, 'learning_rate': 0.0029893020176554506, 'max_depth': 4, 'min_child_weight': 9, 'subsample': 0.5, 'colsample_bytree': 1.0, 'colsample_bylevel': 0.5, 'reg_alpha': 16.619776092048212, 'reg_lambda': 0.00997562062635905, 'gamma': 2.1111269726182735e-06}. Best is trial 82 with value: -7.731843858789701.
/bsuhome/alexanderemert/Research/Star-Formation-Research-Project-2026/pipeline/scripts/optuna/final_preds_and_models/optuna_search_mult_quant_reg.py:161: UserWarning: The distribution is specified by [0.1, 5] and step=0.25, but the range is not divisible by `step`. It will be replaced with [0.1, 4.85].
  error_threshold = trial.suggest_float("error_threshold", 0.1, 5, step=0.25)
[I 2026-07-20 15:13:08,605] Trial 197 finished with value: -7.734792655252487 and parameters: {'error_threshold': 4.6, 'scalers': 'none', 'ratios': 'log_ratio', 'imputers': 'none', 'n_estimators': 1950, 'learning_rate': 0.002933003092874182, 'max_depth': 4, 'min_child_weight': 9, 'subsample': 0.5, 'colsample_bytree': 1.0, 'colsample_bylevel': 0.5, 'reg_alpha': 32.212552893338625, 'reg_lambda': 0.010503528387482993, 'gamma': 2.1464737587034397e-06}. Best is trial 82 with value: -7.731843858789701.
/bsuhome/alexanderemert/Research/Star-Formation-Research-Project-2026/pipeline/scripts/optuna/final_preds_and_models/optuna_search_mult_quant_reg.py:161: UserWarning: The distribution is specified by [0.1, 5] and step=0.25, but the range is not divisible by `step`. It will be replaced with [0.1, 4.85].
  error_threshold = trial.suggest_float("error_threshold", 0.1, 5, step=0.25)
[I 2026-07-20 15:13:15,172] Trial 195 finished with value: -7.800591285622428 and parameters: {'error_threshold': 4.6, 'scalers': 'none', 'ratios': 'log_ratio', 'imputers': 'none', 'n_estimators': 1950, 'learning_rate': 0.0026662833219941277, 'max_depth': 8, 'min_child_weight': 9, 'subsample': 0.5, 'colsample_bytree': 1.0, 'colsample_bylevel': 0.5, 'reg_alpha': 22.478937580153264, 'reg_lambda': 0.010795204929046648, 'gamma': 2.047612829102313e-06}. Best is trial 82 with value: -7.731843858789701.
/bsuhome/alexanderemert/Research/Star-Formation-Research-Project-2026/pipeline/scripts/optuna/final_preds_and_models/optuna_search_mult_quant_reg.py:161: UserWarning: The distribution is specified by [0.1, 5] and step=0.25, but the range is not divisible by `step`. It will be replaced with [0.1, 4.85].
  error_threshold = trial.suggest_float("error_threshold", 0.1, 5, step=0.25)
[I 2026-07-20 15:13:17,127] Trial 198 finished with value: -7.735433258755116 and parameters: {'error_threshold': 4.6, 'scalers': 'none', 'ratios': 'log_ratio', 'imputers': 'none', 'n_estimators': 2000, 'learning_rate': 0.0029224155415851685, 'max_depth': 4, 'min_child_weight': 9, 'subsample': 0.5, 'colsample_bytree': 1.0, 'colsample_bylevel': 0.5, 'reg_alpha': 24.086580203494044, 'reg_lambda': 0.009474808579464939, 'gamma': 2.178637509870254e-06}. Best is trial 82 with value: -7.731843858789701.
/bsuhome/alexanderemert/Research/Star-Formation-Research-Project-2026/pipeline/scripts/optuna/final_preds_and_models/optuna_search_mult_quant_reg.py:161: UserWarning: The distribution is specified by [0.1, 5] and step=0.25, but the range is not divisible by `step`. It will be replaced with [0.1, 4.85].
  error_threshold = trial.suggest_float("error_threshold", 0.1, 5, step=0.25)
[I 2026-07-20 15:13:19,207] Trial 199 finished with value: -7.734544831490724 and parameters: {'error_threshold': 4.6, 'scalers': 'none', 'ratios': 'log_ratio', 'imputers': 'none', 'n_estimators': 1950, 'learning_rate': 0.0030210487992175586, 'max_depth': 4, 'min_child_weight': 9, 'subsample': 0.5, 'colsample_bytree': 1.0, 'colsample_bylevel': 0.5, 'reg_alpha': 22.74481563893717, 'reg_lambda': 0.008360274322971529, 'gamma': 2.069163167507224e-06}. Best is trial 82 with value: -7.731843858789701.
/bsuhome/alexanderemert/Research/Star-Formation-Research-Project-2026/pipeline/scripts/optuna/final_preds_and_models/optuna_search_mult_quant_reg.py:161: UserWarning: The distribution is specified by [0.1, 5] and step=0.25, but the range is not divisible by `step`. It will be replaced with [0.1, 4.85].
  error_threshold = trial.suggest_float("error_threshold", 0.1, 5, step=0.25)
[I 2026-07-20 15:13:21,357] Trial 200 finished with value: -7.73276989655002 and parameters: {'error_threshold': 4.6, 'scalers': 'none', 'ratios': 'log_ratio', 'imputers': 'none', 'n_estimators': 2000, 'learning_rate': 0.0029764280173238187, 'max_depth': 4, 'min_child_weight': 9, 'subsample': 0.5, 'colsample_bytree': 1.0, 'colsample_bylevel': 0.5, 'reg_alpha': 21.754582679474666, 'reg_lambda': 0.009701790847800349, 'gamma': 2.1954309573664084e-06}. Best is trial 82 with value: -7.731843858789701.
/bsuhome/alexanderemert/Research/Star-Formation-Research-Project-2026/pipeline/scripts/optuna/final_preds_and_models/optuna_search_mult_quant_reg.py:161: UserWarning: The distribution is specified by [0.1, 5] and step=0.25, but the range is not divisible by `step`. It will be replaced with [0.1, 4.85].
  error_threshold = trial.suggest_float("error_threshold", 0.1, 5, step=0.25)
[I 2026-07-20 15:13:23,458] Trial 201 finished with value: -7.735505890884531 and parameters: {'error_threshold': 4.6, 'scalers': 'none', 'ratios': 'log_ratio', 'imputers': 'none', 'n_estimators': 1950, 'learning_rate': 0.0030667510959761835, 'max_depth': 4, 'min_child_weight': 8, 'subsample': 0.5, 'colsample_bytree': 1.0, 'colsample_bylevel': 0.5, 'reg_alpha': 19.74496011628428, 'reg_lambda': 0.011156190252510299, 'gamma': 2.159751247783633e-06}. Best is trial 82 with value: -7.731843858789701.
/bsuhome/alexanderemert/Research/Star-Formation-Research-Project-2026/pipeline/scripts/optuna/final_preds_and_models/optuna_search_mult_quant_reg.py:161: UserWarning: The distribution is specified by [0.1, 5] and step=0.25, but the range is not divisible by `step`. It will be replaced with [0.1, 4.85].
  error_threshold = trial.suggest_float("error_threshold", 0.1, 5, step=0.25)
[I 2026-07-20 15:13:25,547] Trial 202 finished with value: -7.735103219136147 and parameters: {'error_threshold': 4.6, 'scalers': 'none', 'ratios': 'log_ratio', 'imputers': 'none', 'n_estimators': 1950, 'learning_rate': 0.0031328420879099417, 'max_depth': 4, 'min_child_weight': 8, 'subsample': 0.5, 'colsample_bytree': 1.0, 'colsample_bylevel': 0.5, 'reg_alpha': 21.595143003934293, 'reg_lambda': 0.012278229575332533, 'gamma': 2.094374950169499e-06}. Best is trial 82 with value: -7.731843858789701.
/bsuhome/alexanderemert/Research/Star-Formation-Research-Project-2026/pipeline/scripts/optuna/final_preds_and_models/optuna_search_mult_quant_reg.py:161: UserWarning: The distribution is specified by [0.1, 5] and step=0.25, but the range is not divisible by `step`. It will be replaced with [0.1, 4.85].
  error_threshold = trial.suggest_float("error_threshold", 0.1, 5, step=0.25)
[I 2026-07-20 15:13:27,679] Trial 203 finished with value: -7.735096686393036 and parameters: {'error_threshold': 4.6, 'scalers': 'none', 'ratios': 'log_ratio', 'imputers': 'none', 'n_estimators': 1950, 'learning_rate': 0.002999012480096598, 'max_depth': 4, 'min_child_weight': 8, 'subsample': 0.5, 'colsample_bytree': 1.0, 'colsample_bylevel': 0.5, 'reg_alpha': 25.872438173372007, 'reg_lambda': 0.012189805036643507, 'gamma': 1.958217997107901e-06}. Best is trial 82 with value: -7.731843858789701.
/bsuhome/alexanderemert/Research/Star-Formation-Research-Project-2026/pipeline/scripts/optuna/final_preds_and_models/optuna_search_mult_quant_reg.py:161: UserWarning: The distribution is specified by [0.1, 5] and step=0.25, but the range is not divisible by `step`. It will be replaced with [0.1, 4.85].
  error_threshold = trial.suggest_float("error_threshold", 0.1, 5, step=0.25)
[I 2026-07-20 15:13:30,667] Trial 204 finished with value: -7.763565918129146 and parameters: {'error_threshold': 4.6, 'scalers': 'none', 'ratios': 'log_ratio', 'imputers': 'none', 'n_estimators': 1950, 'learning_rate': 0.0031214452336998932, 'max_depth': 5, 'min_child_weight': 8, 'subsample': 0.5, 'colsample_bytree': 1.0, 'colsample_bylevel': 0.5, 'reg_alpha': 20.953314721710086, 'reg_lambda': 0.009147404134558418, 'gamma': 2.1761979711891352e-06}. Best is trial 82 with value: -7.731843858789701.
/bsuhome/alexanderemert/Research/Star-Formation-Research-Project-2026/pipeline/scripts/optuna/final_preds_and_models/optuna_search_mult_quant_reg.py:161: UserWarning: The distribution is specified by [0.1, 5] and step=0.25, but the range is not divisible by `step`. It will be replaced with [0.1, 4.85].
  error_threshold = trial.suggest_float("error_threshold", 0.1, 5, step=0.25)
[I 2026-07-20 15:13:33,604] Trial 205 finished with value: -7.7618273231937875 and parameters: {'error_threshold': 4.35, 'scalers': 'none', 'ratios': 'log_ratio', 'imputers': 'none', 'n_estimators': 1950, 'learning_rate': 0.003050630185090552, 'max_depth': 5, 'min_child_weight': 8, 'subsample': 0.5, 'colsample_bytree': 1.0, 'colsample_bylevel': 0.5, 'reg_alpha': 13.922199483779137, 'reg_lambda': 0.01943118073450443, 'gamma': 2.14763333253029e-06}. Best is trial 82 with value: -7.731843858789701.
/bsuhome/alexanderemert/Research/Star-Formation-Research-Project-2026/pipeline/scripts/optuna/final_preds_and_models/optuna_search_mult_quant_reg.py:161: UserWarning: The distribution is specified by [0.1, 5] and step=0.25, but the range is not divisible by `step`. It will be replaced with [0.1, 4.85].
  error_threshold = trial.suggest_float("error_threshold", 0.1, 5, step=0.25)
[I 2026-07-20 15:13:36,554] Trial 206 finished with value: -7.767444280782201 and parameters: {'error_threshold': 4.35, 'scalers': 'none', 'ratios': 'log_ratio', 'imputers': 'none', 'n_estimators': 2000, 'learning_rate': 0.0031786921389703386, 'max_depth': 5, 'min_child_weight': 8, 'subsample': 0.5, 'colsample_bytree': 1.0, 'colsample_bylevel': 0.5, 'reg_alpha': 12.546323715110308, 'reg_lambda': 0.014010974796129125, 'gamma': 2.1839356919729587e-06}. Best is trial 82 with value: -7.731843858789701.
/bsuhome/alexanderemert/Research/Star-Formation-Research-Project-2026/pipeline/scripts/optuna/final_preds_and_models/optuna_search_mult_quant_reg.py:161: UserWarning: The distribution is specified by [0.1, 5] and step=0.25, but the range is not divisible by `step`. It will be replaced with [0.1, 4.85].
  error_threshold = trial.suggest_float("error_threshold", 0.1, 5, step=0.25)
[I 2026-07-20 15:13:39,731] Trial 207 finished with value: -7.7658921667616845 and parameters: {'error_threshold': 4.35, 'scalers': 'none', 'ratios': 'log_ratio', 'imputers': 'none', 'n_estimators': 2000, 'learning_rate': 0.0031007498161980504, 'max_depth': 5, 'min_child_weight': 8, 'subsample': 0.5, 'colsample_bytree': 1.0, 'colsample_bylevel': 0.5, 'reg_alpha': 37.369199496239794, 'reg_lambda': 0.01910783574371334, 'gamma': 2.6277006604341515e-06}. Best is trial 82 with value: -7.731843858789701.
/bsuhome/alexanderemert/Research/Star-Formation-Research-Project-2026/pipeline/scripts/optuna/final_preds_and_models/optuna_search_mult_quant_reg.py:161: UserWarning: The distribution is specified by [0.1, 5] and step=0.25, but the range is not divisible by `step`. It will be replaced with [0.1, 4.85].
  error_threshold = trial.suggest_float("error_threshold", 0.1, 5, step=0.25)
[I 2026-07-20 15:13:41,829] Trial 208 finished with value: -7.736465500768264 and parameters: {'error_threshold': 4.35, 'scalers': 'none', 'ratios': 'log_ratio', 'imputers': 'none', 'n_estimators': 1950, 'learning_rate': 0.0031272375547126982, 'max_depth': 4, 'min_child_weight': 8, 'subsample': 0.5, 'colsample_bytree': 1.0, 'colsample_bylevel': 0.5, 'reg_alpha': 31.972684320454384, 'reg_lambda': 0.017398319486188422, 'gamma': 2.1435842567435422e-06}. Best is trial 82 with value: -7.731843858789701.
/bsuhome/alexanderemert/Research/Star-Formation-Research-Project-2026/pipeline/scripts/optuna/final_preds_and_models/optuna_search_mult_quant_reg.py:161: UserWarning: The distribution is specified by [0.1, 5] and step=0.25, but the range is not divisible by `step`. It will be replaced with [0.1, 4.85].
  error_threshold = trial.suggest_float("error_threshold", 0.1, 5, step=0.25)
[I 2026-07-20 15:13:43,990] Trial 209 finished with value: -7.7339605436368934 and parameters: {'error_threshold': 4.35, 'scalers': 'none', 'ratios': 'log_ratio', 'imputers': 'none', 'n_estimators': 1950, 'learning_rate': 0.0030656675214184655, 'max_depth': 4, 'min_child_weight': 8, 'subsample': 0.5, 'colsample_bytree': 1.0, 'colsample_bylevel': 0.5, 'reg_alpha': 35.709495247465775, 'reg_lambda': 0.023190268220187694, 'gamma': 2.111998167911371e-06}. Best is trial 82 with value: -7.731843858789701.
/bsuhome/alexanderemert/Research/Star-Formation-Research-Project-2026/pipeline/scripts/optuna/final_preds_and_models/optuna_search_mult_quant_reg.py:161: UserWarning: The distribution is specified by [0.1, 5] and step=0.25, but the range is not divisible by `step`. It will be replaced with [0.1, 4.85].
  error_threshold = trial.suggest_float("error_threshold", 0.1, 5, step=0.25)
[I 2026-07-20 15:13:46,027] Trial 210 finished with value: -7.737358602235059 and parameters: {'error_threshold': 4.35, 'scalers': 'none', 'ratios': 'log_ratio', 'imputers': 'none', 'n_estimators': 1900, 'learning_rate': 0.003160671868431924, 'max_depth': 4, 'min_child_weight': 9, 'subsample': 0.5, 'colsample_bytree': 1.0, 'colsample_bylevel': 0.5, 'reg_alpha': 40.05440644834513, 'reg_lambda': 0.01813251869041944, 'gamma': 2.2458539486792867e-06}. Best is trial 82 with value: -7.731843858789701.
/bsuhome/alexanderemert/Research/Star-Formation-Research-Project-2026/pipeline/scripts/optuna/final_preds_and_models/optuna_search_mult_quant_reg.py:161: UserWarning: The distribution is specified by [0.1, 5] and step=0.25, but the range is not divisible by `step`. It will be replaced with [0.1, 4.85].
  error_threshold = trial.suggest_float("error_threshold", 0.1, 5, step=0.25)
[I 2026-07-20 15:13:48,042] Trial 211 finished with value: -7.734240039452087 and parameters: {'error_threshold': 4.35, 'scalers': 'none', 'ratios': 'log_ratio', 'imputers': 'none', 'n_estimators': 1900, 'learning_rate': 0.00319063992362716, 'max_depth': 4, 'min_child_weight': 8, 'subsample': 0.5, 'colsample_bytree': 1.0, 'colsample_bylevel': 0.5, 'reg_alpha': 21.177221641573205, 'reg_lambda': 0.016114729257445587, 'gamma': 2.236700859807485e-06}. Best is trial 82 with value: -7.731843858789701.
/bsuhome/alexanderemert/Research/Star-Formation-Research-Project-2026/pipeline/scripts/optuna/final_preds_and_models/optuna_search_mult_quant_reg.py:161: UserWarning: The distribution is specified by [0.1, 5] and step=0.25, but the range is not divisible by `step`. It will be replaced with [0.1, 4.85].
  error_threshold = trial.suggest_float("error_threshold", 0.1, 5, step=0.25)
