[I 2026-07-21 14:02:54,911] Trial 165 finished with value: -3.786941541764378 and parameters: {'error_threshold': 2.35, 'scalers': 'none', 'ratios': 'log_ratio', 'imputers': 'none', 'n_estimators': 2500, 'learning_rate': 0.0013993027724242455, 'max_depth': 3, 'min_child_weight': 7, 'subsample': 0.9, 'colsample_bytree': 0.7, 'colsample_bylevel': 0.7, 'reg_alpha': 3.727436051503491, 'reg_lambda': 0.005965729283062206, 'gamma': 0.029840299873131308}. Best is trial 141 with value: -3.7776086043215.
/bsuhome/alexanderemert/Research/Star-Formation-Research-Project-2026/pipeline/scripts/optuna/final_preds_and_models/optuna_search_mult_quant_reg.py:162: UserWarning: The distribution is specified by [0.1, 5] and step=0.25, but the range is not divisible by `step`. It will be replaced with [0.1, 4.85].
  error_threshold = trial.suggest_float("error_threshold", 0.1, 5, step=0.25)
[I 2026-07-21 14:03:18,334] Trial 155 finished with value: -3.9186984748537683 and parameters: {'error_threshold': 2.35, 'scalers': 'none', 'ratios': 'log_ratio', 'imputers': 'none', 'n_estimators': 2400, 'learning_rate': 0.0022224009667971925, 'max_depth': 12, 'min_child_weight': 7, 'subsample': 0.9, 'colsample_bytree': 0.7, 'colsample_bylevel': 0.7, 'reg_alpha': 2.5620947685422872, 'reg_lambda': 0.004841576027942887, 'gamma': 0.043530833259357304}. Best is trial 141 with value: -3.7776086043215.
/bsuhome/alexanderemert/Research/Star-Formation-Research-Project-2026/pipeline/scripts/optuna/final_preds_and_models/optuna_search_mult_quant_reg.py:162: UserWarning: The distribution is specified by [0.1, 5] and step=0.25, but the range is not divisible by `step`. It will be replaced with [0.1, 4.85].
  error_threshold = trial.suggest_float("error_threshold", 0.1, 5, step=0.25)
[I 2026-07-21 14:03:19,885] Trial 166 finished with value: -3.787321849177728 and parameters: {'error_threshold': 2.35, 'scalers': 'none', 'ratios': 'log_ratio', 'imputers': 'none', 'n_estimators': 2500, 'learning_rate': 0.0013684558777781095, 'max_depth': 3, 'min_child_weight': 7, 'subsample': 1.0, 'colsample_bytree': 0.7, 'colsample_bylevel': 0.7, 'reg_alpha': 3.5099021678893534, 'reg_lambda': 0.0056024347595162935, 'gamma': 0.022298199721145016}. Best is trial 141 with value: -3.7776086043215.
/bsuhome/alexanderemert/Research/Star-Formation-Research-Project-2026/pipeline/scripts/optuna/final_preds_and_models/optuna_search_mult_quant_reg.py:162: UserWarning: The distribution is specified by [0.1, 5] and step=0.25, but the range is not divisible by `step`. It will be replaced with [0.1, 4.85].
  error_threshold = trial.suggest_float("error_threshold", 0.1, 5, step=0.25)
[I 2026-07-21 14:03:21,685] Trial 167 finished with value: -3.791285881798162 and parameters: {'error_threshold': 2.6, 'scalers': 'none', 'ratios': 'log_ratio', 'imputers': 'none', 'n_estimators': 2500, 'learning_rate': 0.0012694613891432824, 'max_depth': 3, 'min_child_weight': 7, 'subsample': 1.0, 'colsample_bytree': 0.7, 'colsample_bylevel': 0.7, 'reg_alpha': 3.6433188250298767, 'reg_lambda': 0.00752540663706024, 'gamma': 0.02839636117947219}. Best is trial 141 with value: -3.7776086043215.
/bsuhome/alexanderemert/Research/Star-Formation-Research-Project-2026/pipeline/scripts/optuna/final_preds_and_models/optuna_search_mult_quant_reg.py:162: UserWarning: The distribution is specified by [0.1, 5] and step=0.25, but the range is not divisible by `step`. It will be replaced with [0.1, 4.85].
  error_threshold = trial.suggest_float("error_threshold", 0.1, 5, step=0.25)
[I 2026-07-21 14:03:23,488] Trial 168 finished with value: -3.786732553547832 and parameters: {'error_threshold': 2.6, 'scalers': 'none', 'ratios': 'log_ratio', 'imputers': 'none', 'n_estimators': 2500, 'learning_rate': 0.0013931995354078436, 'max_depth': 3, 'min_child_weight': 7, 'subsample': 1.0, 'colsample_bytree': 0.7, 'colsample_bylevel': 0.7, 'reg_alpha': 3.600532100086437, 'reg_lambda': 0.006722905250368588, 'gamma': 0.023230586936009563}. Best is trial 141 with value: -3.7776086043215.
/bsuhome/alexanderemert/Research/Star-Formation-Research-Project-2026/pipeline/scripts/optuna/final_preds_and_models/optuna_search_mult_quant_reg.py:162: UserWarning: The distribution is specified by [0.1, 5] and step=0.25, but the range is not divisible by `step`. It will be replaced with [0.1, 4.85].
  error_threshold = trial.suggest_float("error_threshold", 0.1, 5, step=0.25)
[I 2026-07-21 14:03:25,598] Trial 169 finished with value: -3.7816294029082953 and parameters: {'error_threshold': 2.6, 'scalers': 'none', 'ratios': 'log_ratio', 'imputers': 'none', 'n_estimators': 2950, 'learning_rate': 0.0014217349789418991, 'max_depth': 3, 'min_child_weight': 7, 'subsample': 0.9, 'colsample_bytree': 0.7, 'colsample_bylevel': 0.7, 'reg_alpha': 9.576775747950258, 'reg_lambda': 0.006529746330483104, 'gamma': 0.022242267765240426}. Best is trial 141 with value: -3.7776086043215.
/bsuhome/alexanderemert/Research/Star-Formation-Research-Project-2026/pipeline/scripts/optuna/final_preds_and_models/optuna_search_mult_quant_reg.py:162: UserWarning: The distribution is specified by [0.1, 5] and step=0.25, but the range is not divisible by `step`. It will be replaced with [0.1, 4.85].
  error_threshold = trial.suggest_float("error_threshold", 0.1, 5, step=0.25)
[I 2026-07-21 14:03:27,559] Trial 170 finished with value: -3.7805724669884757 and parameters: {'error_threshold': 2.6, 'scalers': 'none', 'ratios': 'log_ratio', 'imputers': 'none', 'n_estimators': 2800, 'learning_rate': 0.0026148457065035915, 'max_depth': 3, 'min_child_weight': 7, 'subsample': 0.9, 'colsample_bytree': 0.7, 'colsample_bylevel': 0.7, 'reg_alpha': 3.769597418277262, 'reg_lambda': 0.005336021939150824, 'gamma': 0.05976186994711357}. Best is trial 141 with value: -3.7776086043215.
/bsuhome/alexanderemert/Research/Star-Formation-Research-Project-2026/pipeline/scripts/optuna/final_preds_and_models/optuna_search_mult_quant_reg.py:162: UserWarning: The distribution is specified by [0.1, 5] and step=0.25, but the range is not divisible by `step`. It will be replaced with [0.1, 4.85].
  error_threshold = trial.suggest_float("error_threshold", 0.1, 5, step=0.25)
[I 2026-07-21 14:03:29,494] Trial 171 finished with value: -3.7814589269774124 and parameters: {'error_threshold': 2.6, 'scalers': 'none', 'ratios': 'log_ratio', 'imputers': 'none', 'n_estimators': 2800, 'learning_rate': 0.0027044697765861605, 'max_depth': 3, 'min_child_weight': 7, 'subsample': 0.9, 'colsample_bytree': 0.7, 'colsample_bylevel': 0.7, 'reg_alpha': 4.04923850723256, 'reg_lambda': 0.010044070651423218, 'gamma': 0.020944648933674273}. Best is trial 141 with value: -3.7776086043215.
/bsuhome/alexanderemert/Research/Star-Formation-Research-Project-2026/pipeline/scripts/optuna/final_preds_and_models/optuna_search_mult_quant_reg.py:162: UserWarning: The distribution is specified by [0.1, 5] and step=0.25, but the range is not divisible by `step`. It will be replaced with [0.1, 4.85].
  error_threshold = trial.suggest_float("error_threshold", 0.1, 5, step=0.25)
[I 2026-07-21 14:03:31,460] Trial 172 finished with value: -3.7803102656047485 and parameters: {'error_threshold': 2.6, 'scalers': 'none', 'ratios': 'log_ratio', 'imputers': 'none', 'n_estimators': 2800, 'learning_rate': 0.002603622904450914, 'max_depth': 3, 'min_child_weight': 7, 'subsample': 0.9, 'colsample_bytree': 0.7, 'colsample_bylevel': 0.7, 'reg_alpha': 3.989859066990768, 'reg_lambda': 0.010299798881458365, 'gamma': 0.020207625846402465}. Best is trial 141 with value: -3.7776086043215.
/bsuhome/alexanderemert/Research/Star-Formation-Research-Project-2026/pipeline/scripts/optuna/final_preds_and_models/optuna_search_mult_quant_reg.py:162: UserWarning: The distribution is specified by [0.1, 5] and step=0.25, but the range is not divisible by `step`. It will be replaced with [0.1, 4.85].
  error_threshold = trial.suggest_float("error_threshold", 0.1, 5, step=0.25)
[I 2026-07-21 14:03:33,458] Trial 173 finished with value: -3.78081448095536 and parameters: {'error_threshold': 2.6, 'scalers': 'none', 'ratios': 'log_ratio', 'imputers': 'none', 'n_estimators': 2850, 'learning_rate': 0.0026612103268588627, 'max_depth': 3, 'min_child_weight': 7, 'subsample': 0.9, 'colsample_bytree': 0.7, 'colsample_bylevel': 0.7, 'reg_alpha': 4.28081232189079, 'reg_lambda': 0.0020612880659122814, 'gamma': 0.021742745984083118}. Best is trial 141 with value: -3.7776086043215.
/bsuhome/alexanderemert/Research/Star-Formation-Research-Project-2026/pipeline/scripts/optuna/final_preds_and_models/optuna_search_mult_quant_reg.py:162: UserWarning: The distribution is specified by [0.1, 5] and step=0.25, but the range is not divisible by `step`. It will be replaced with [0.1, 4.85].
  error_threshold = trial.suggest_float("error_threshold", 0.1, 5, step=0.25)
[I 2026-07-21 14:03:35,446] Trial 174 finished with value: -3.7781661833009372 and parameters: {'error_threshold': 2.6, 'scalers': 'none', 'ratios': 'log_ratio', 'imputers': 'none', 'n_estimators': 2800, 'learning_rate': 0.0025219012404718464, 'max_depth': 3, 'min_child_weight': 7, 'subsample': 0.9, 'colsample_bytree': 0.7, 'colsample_bylevel': 0.7, 'reg_alpha': 28.05135878092535, 'reg_lambda': 0.00965660635168107, 'gamma': 0.06675245253042286}. Best is trial 141 with value: -3.7776086043215.
/bsuhome/alexanderemert/Research/Star-Formation-Research-Project-2026/pipeline/scripts/optuna/final_preds_and_models/optuna_search_mult_quant_reg.py:162: UserWarning: The distribution is specified by [0.1, 5] and step=0.25, but the range is not divisible by `step`. It will be replaced with [0.1, 4.85].
  error_threshold = trial.suggest_float("error_threshold", 0.1, 5, step=0.25)
[I 2026-07-21 14:03:38,528] Trial 175 finished with value: -3.7911932842564 and parameters: {'error_threshold': 2.6, 'scalers': 'none', 'ratios': 'log_ratio', 'imputers': 'none', 'n_estimators': 2850, 'learning_rate': 0.002663884189305152, 'max_depth': 4, 'min_child_weight': 7, 'subsample': 0.9, 'colsample_bytree': 0.7, 'colsample_bylevel': 0.7, 'reg_alpha': 29.59807567714966, 'reg_lambda': 0.002302344233291151, 'gamma': 0.0664836997991156}. Best is trial 141 with value: -3.7776086043215.
/bsuhome/alexanderemert/Research/Star-Formation-Research-Project-2026/pipeline/scripts/optuna/final_preds_and_models/optuna_search_mult_quant_reg.py:162: UserWarning: The distribution is specified by [0.1, 5] and step=0.25, but the range is not divisible by `step`. It will be replaced with [0.1, 4.85].
  error_threshold = trial.suggest_float("error_threshold", 0.1, 5, step=0.25)
[I 2026-07-21 14:03:41,222] Trial 176 finished with value: -3.7954669911645134 and parameters: {'error_threshold': 2.1, 'scalers': 'none', 'ratios': 'log_ratio', 'imputers': 'none', 'n_estimators': 2600, 'learning_rate': 0.0026588829574147907, 'max_depth': 4, 'min_child_weight': 7, 'subsample': 0.9, 'colsample_bytree': 0.7, 'colsample_bylevel': 0.7, 'reg_alpha': 5.229717624234605, 'reg_lambda': 0.011658441481817536, 'gamma': 0.05844447005143446}. Best is trial 141 with value: -3.7776086043215.
/bsuhome/alexanderemert/Research/Star-Formation-Research-Project-2026/pipeline/scripts/optuna/final_preds_and_models/optuna_search_mult_quant_reg.py:162: UserWarning: The distribution is specified by [0.1, 5] and step=0.25, but the range is not divisible by `step`. It will be replaced with [0.1, 4.85].
  error_threshold = trial.suggest_float("error_threshold", 0.1, 5, step=0.25)
[I 2026-07-21 14:03:44,214] Trial 177 finished with value: -4.39587141239272 and parameters: {'error_threshold': 2.1, 'scalers': 'none', 'ratios': 'log_ratio', 'imputers': 'none', 'n_estimators': 2600, 'learning_rate': 0.00010124116017510159, 'max_depth': 4, 'min_child_weight': 7, 'subsample': 0.9, 'colsample_bytree': 0.7, 'colsample_bylevel': 0.7, 'reg_alpha': 5.056367683685421, 'reg_lambda': 0.0023580621863920044, 'gamma': 0.060234263805416986}. Best is trial 141 with value: -3.7776086043215.
/bsuhome/alexanderemert/Research/Star-Formation-Research-Project-2026/pipeline/scripts/optuna/final_preds_and_models/optuna_search_mult_quant_reg.py:162: UserWarning: The distribution is specified by [0.1, 5] and step=0.25, but the range is not divisible by `step`. It will be replaced with [0.1, 4.85].
  error_threshold = trial.suggest_float("error_threshold", 0.1, 5, step=0.25)
[I 2026-07-21 14:03:46,051] Trial 178 finished with value: -3.7810613382441023 and parameters: {'error_threshold': 2.1, 'scalers': 'none', 'ratios': 'log_ratio', 'imputers': 'none', 'n_estimators': 2650, 'learning_rate': 0.0025518319026044322, 'max_depth': 3, 'min_child_weight': 7, 'subsample': 0.9, 'colsample_bytree': 0.7, 'colsample_bylevel': 0.7, 'reg_alpha': 0.8888169983096835, 'reg_lambda': 0.0021517417569073146, 'gamma': 0.05425219664097726}. Best is trial 141 with value: -3.7776086043215.
/bsuhome/alexanderemert/Research/Star-Formation-Research-Project-2026/pipeline/scripts/optuna/final_preds_and_models/optuna_search_mult_quant_reg.py:162: UserWarning: The distribution is specified by [0.1, 5] and step=0.25, but the range is not divisible by `step`. It will be replaced with [0.1, 4.85].
  error_threshold = trial.suggest_float("error_threshold", 0.1, 5, step=0.25)
[I 2026-07-21 14:03:48,048] Trial 179 finished with value: -4.3810558873875385 and parameters: {'error_threshold': 2.1, 'scalers': 'none', 'ratios': 'log_ratio', 'imputers': 'none', 'n_estimators': 2600, 'learning_rate': 0.00011387633998664682, 'max_depth': 3, 'min_child_weight': 7, 'subsample': 0.9, 'colsample_bytree': 0.7, 'colsample_bylevel': 0.7, 'reg_alpha': 0.9223951150544248, 'reg_lambda': 0.0026588766929692195, 'gamma': 0.00015626781416659344}. Best is trial 141 with value: -3.7776086043215.
/bsuhome/alexanderemert/Research/Star-Formation-Research-Project-2026/pipeline/scripts/optuna/final_preds_and_models/optuna_search_mult_quant_reg.py:162: UserWarning: The distribution is specified by [0.1, 5] and step=0.25, but the range is not divisible by `step`. It will be replaced with [0.1, 4.85].
  error_threshold = trial.suggest_float("error_threshold", 0.1, 5, step=0.25)
[I 2026-07-21 14:03:49,917] Trial 180 finished with value: -3.7815614717232897 and parameters: {'error_threshold': 2.1, 'scalers': 'none', 'ratios': 'log_ratio', 'imputers': 'none', 'n_estimators': 2650, 'learning_rate': 0.0025759325865398696, 'max_depth': 3, 'min_child_weight': 7, 'subsample': 0.9, 'colsample_bytree': 0.7, 'colsample_bylevel': 0.7, 'reg_alpha': 0.7992045115452399, 'reg_lambda': 0.0019815451668282564, 'gamma': 0.062171210073288734}. Best is trial 141 with value: -3.7776086043215.
/bsuhome/alexanderemert/Research/Star-Formation-Research-Project-2026/pipeline/scripts/optuna/final_preds_and_models/optuna_search_mult_quant_reg.py:162: UserWarning: The distribution is specified by [0.1, 5] and step=0.25, but the range is not divisible by `step`. It will be replaced with [0.1, 4.85].
  error_threshold = trial.suggest_float("error_threshold", 0.1, 5, step=0.25)
[I 2026-07-21 14:03:52,880] Trial 181 finished with value: -3.8078744899872965 and parameters: {'error_threshold': 2.1, 'scalers': 'none', 'ratios': 'log_ratio', 'imputers': 'none', 'n_estimators': 2650, 'learning_rate': 0.001021192746051291, 'max_depth': 4, 'min_child_weight': 7, 'subsample': 0.9, 'colsample_bytree': 0.7, 'colsample_bylevel': 0.7, 'reg_alpha': 32.44462076432022, 'reg_lambda': 0.002083833409161652, 'gamma': 0.05889637970540992}. Best is trial 141 with value: -3.7776086043215.
/bsuhome/alexanderemert/Research/Star-Formation-Research-Project-2026/pipeline/scripts/optuna/final_preds_and_models/optuna_search_mult_quant_reg.py:162: UserWarning: The distribution is specified by [0.1, 5] and step=0.25, but the range is not divisible by `step`. It will be replaced with [0.1, 4.85].
  error_threshold = trial.suggest_float("error_threshold", 0.1, 5, step=0.25)
[I 2026-07-21 14:03:55,702] Trial 182 finished with value: -3.8024767789952567 and parameters: {'error_threshold': 2.1, 'scalers': 'none', 'ratios': 'log_ratio', 'imputers': 'none', 'n_estimators': 2600, 'learning_rate': 0.0038503247232743428, 'max_depth': 4, 'min_child_weight': 8, 'subsample': 0.9, 'colsample_bytree': 0.7, 'colsample_bylevel': 0.7, 'reg_alpha': 35.676811685515815, 'reg_lambda': 0.0019711683612837374, 'gamma': 0.19800603318634516}. Best is trial 141 with value: -3.7776086043215.
/bsuhome/alexanderemert/Research/Star-Formation-Research-Project-2026/pipeline/scripts/optuna/final_preds_and_models/optuna_search_mult_quant_reg.py:162: UserWarning: The distribution is specified by [0.1, 5] and step=0.25, but the range is not divisible by `step`. It will be replaced with [0.1, 4.85].
  error_threshold = trial.suggest_float("error_threshold", 0.1, 5, step=0.25)
[I 2026-07-21 14:03:57,520] Trial 183 finished with value: -3.7891089155333066 and parameters: {'error_threshold': 2.1, 'scalers': 'none', 'ratios': 'log_ratio', 'imputers': 'none', 'n_estimators': 2650, 'learning_rate': 0.003684967547009427, 'max_depth': 3, 'min_child_weight': 8, 'subsample': 0.9, 'colsample_bytree': 0.7, 'colsample_bylevel': 0.7, 'reg_alpha': 0.8538440175432536, 'reg_lambda': 0.0020396799573456723, 'gamma': 0.00015518948421309575}. Best is trial 141 with value: -3.7776086043215.
/bsuhome/alexanderemert/Research/Star-Formation-Research-Project-2026/pipeline/scripts/optuna/final_preds_and_models/optuna_search_mult_quant_reg.py:162: UserWarning: The distribution is specified by [0.1, 5] and step=0.25, but the range is not divisible by `step`. It will be replaced with [0.1, 4.85].
  error_threshold = trial.suggest_float("error_threshold", 0.1, 5, step=0.25)
[I 2026-07-21 14:03:59,332] Trial 184 finished with value: -3.8355036954008797 and parameters: {'error_threshold': 2.35, 'scalers': 'none', 'ratios': 'log_ratio', 'imputers': 'none', 'n_estimators': 2450, 'learning_rate': 0.0010355641291804108, 'max_depth': 3, 'min_child_weight': 8, 'subsample': 0.9, 'colsample_bytree': 0.7, 'colsample_bylevel': 0.7, 'reg_alpha': 51.03854402364655, 'reg_lambda': 0.001886376610612963, 'gamma': 0.00021283486769020863}. Best is trial 141 with value: -3.7776086043215.
/bsuhome/alexanderemert/Research/Star-Formation-Research-Project-2026/pipeline/scripts/optuna/final_preds_and_models/optuna_search_mult_quant_reg.py:162: UserWarning: The distribution is specified by [0.1, 5] and step=0.25, but the range is not divisible by `step`. It will be replaced with [0.1, 4.85].
  error_threshold = trial.suggest_float("error_threshold", 0.1, 5, step=0.25)
[I 2026-07-21 14:04:01,098] Trial 185 finished with value: -3.785046727729286 and parameters: {'error_threshold': 2.35, 'scalers': 'none', 'ratios': 'log_ratio', 'imputers': 'none', 'n_estimators': 2450, 'learning_rate': 0.003946667427889933, 'max_depth': 3, 'min_child_weight': 8, 'subsample': 0.9, 'colsample_bytree': 0.7, 'colsample_bylevel': 0.7, 'reg_alpha': 52.97537332938789, 'reg_lambda': 0.0018385401570244918, 'gamma': 0.0001365620146086069}. Best is trial 141 with value: -3.7776086043215.
/bsuhome/alexanderemert/Research/Star-Formation-Research-Project-2026/pipeline/scripts/optuna/final_preds_and_models/optuna_search_mult_quant_reg.py:162: UserWarning: The distribution is specified by [0.1, 5] and step=0.25, but the range is not divisible by `step`. It will be replaced with [0.1, 4.85].
  error_threshold = trial.suggest_float("error_threshold", 0.1, 5, step=0.25)
[I 2026-07-21 14:04:02,872] Trial 186 finished with value: -3.783830256429304 and parameters: {'error_threshold': 2.35, 'scalers': 'none', 'ratios': 'log_ratio', 'imputers': 'none', 'n_estimators': 2450, 'learning_rate': 0.003923424368455965, 'max_depth': 3, 'min_child_weight': 7, 'subsample': 0.9, 'colsample_bytree': 0.7, 'colsample_bylevel': 0.7, 'reg_alpha': 45.76051649944394, 'reg_lambda': 0.019507368996433974, 'gamma': 0.2052925369039771}. Best is trial 141 with value: -3.7776086043215.
/bsuhome/alexanderemert/Research/Star-Formation-Research-Project-2026/pipeline/scripts/optuna/final_preds_and_models/optuna_search_mult_quant_reg.py:162: UserWarning: The distribution is specified by [0.1, 5] and step=0.25, but the range is not divisible by `step`. It will be replaced with [0.1, 4.85].
  error_threshold = trial.suggest_float("error_threshold", 0.1, 5, step=0.25)
[I 2026-07-21 14:04:04,598] Trial 187 finished with value: -3.7824424744374086 and parameters: {'error_threshold': 2.35, 'scalers': 'none', 'ratios': 'log_ratio', 'imputers': 'none', 'n_estimators': 2450, 'learning_rate': 0.0035535593425399616, 'max_depth': 3, 'min_child_weight': 8, 'subsample': 0.9, 'colsample_bytree': 0.7, 'colsample_bylevel': 0.7, 'reg_alpha': 7.134388648555113, 'reg_lambda': 0.0018565636809360162, 'gamma': 0.18689095837368788}. Best is trial 141 with value: -3.7776086043215.
/bsuhome/alexanderemert/Research/Star-Formation-Research-Project-2026/pipeline/scripts/optuna/final_preds_and_models/optuna_search_mult_quant_reg.py:162: UserWarning: The distribution is specified by [0.1, 5] and step=0.25, but the range is not divisible by `step`. It will be replaced with [0.1, 4.85].
  error_threshold = trial.suggest_float("error_threshold", 0.1, 5, step=0.25)
