[I 2026-07-21 10:04:41,974] Trial 406 finished with value: -0.5943694285973596 and parameters: {'error_threshold': 4.6, 'scalers': 'robust', 'ratios': 'log_ratio', 'imputers': 'mean', 'n_estimators': 2300, 'learning_rate': 0.01113424023077579, 'max_depth': 4, 'min_child_weight': 3, 'subsample': 0.6, 'colsample_bytree': 0.7, 'colsample_bylevel': 0.8, 'reg_alpha': 1.3522553902975209e-06, 'reg_lambda': 2.017405059816633e-06, 'gamma': 0.00011476476132744865}. Best is trial 347 with value: -0.5896472086171253.
/bsuhome/alexanderemert/Research/Star-Formation-Research-Project-2026/pipeline/scripts/optuna/final_preds_and_models/optuna_search_mult_quant_reg.py:161: UserWarning: The distribution is specified by [0.1, 5] and step=0.25, but the range is not divisible by `step`. It will be replaced with [0.1, 4.85].
  error_threshold = trial.suggest_float("error_threshold", 0.1, 5, step=0.25)
[I 2026-07-21 10:04:44,298] Trial 407 finished with value: -0.5910487915886737 and parameters: {'error_threshold': 4.85, 'scalers': 'robust', 'ratios': 'log_ratio', 'imputers': 'mean', 'n_estimators': 2250, 'learning_rate': 0.010469286779283488, 'max_depth': 4, 'min_child_weight': 3, 'subsample': 0.6, 'colsample_bytree': 0.6, 'colsample_bylevel': 0.8, 'reg_alpha': 1.864450472622141e-06, 'reg_lambda': 1.4208554089074224e-06, 'gamma': 0.00011703651119601427}. Best is trial 347 with value: -0.5896472086171253.
/bsuhome/alexanderemert/Research/Star-Formation-Research-Project-2026/pipeline/scripts/optuna/final_preds_and_models/optuna_search_mult_quant_reg.py:161: UserWarning: The distribution is specified by [0.1, 5] and step=0.25, but the range is not divisible by `step`. It will be replaced with [0.1, 4.85].
  error_threshold = trial.suggest_float("error_threshold", 0.1, 5, step=0.25)
[I 2026-07-21 10:05:13,119] Trial 397 finished with value: -0.6655947426569315 and parameters: {'error_threshold': 4.85, 'scalers': 'robust', 'ratios': 'log_ratio', 'imputers': 'mean', 'n_estimators': 2850, 'learning_rate': 0.007862762527944598, 'max_depth': 12, 'min_child_weight': 3, 'subsample': 0.6, 'colsample_bytree': 0.6, 'colsample_bylevel': 0.8, 'reg_alpha': 2.534198738767364e-06, 'reg_lambda': 1.759956209116924e-05, 'gamma': 6.75925809900041e-05}. Best is trial 347 with value: -0.5896472086171253.
/bsuhome/alexanderemert/Research/Star-Formation-Research-Project-2026/pipeline/scripts/optuna/final_preds_and_models/optuna_search_mult_quant_reg.py:161: UserWarning: The distribution is specified by [0.1, 5] and step=0.25, but the range is not divisible by `step`. It will be replaced with [0.1, 4.85].
  error_threshold = trial.suggest_float("error_threshold", 0.1, 5, step=0.25)
[I 2026-07-21 10:05:15,955] Trial 408 finished with value: -0.5931552089486454 and parameters: {'error_threshold': 4.6, 'scalers': 'robust', 'ratios': 'log_ratio', 'imputers': 'mean', 'n_estimators': 2800, 'learning_rate': 0.009916724474395257, 'max_depth': 4, 'min_child_weight': 3, 'subsample': 0.6, 'colsample_bytree': 0.6, 'colsample_bylevel': 0.8, 'reg_alpha': 1.2288343787427075e-06, 'reg_lambda': 1.377965815822849e-06, 'gamma': 0.00014344008209214924}. Best is trial 347 with value: -0.5896472086171253.
/bsuhome/alexanderemert/Research/Star-Formation-Research-Project-2026/pipeline/scripts/optuna/final_preds_and_models/optuna_search_mult_quant_reg.py:161: UserWarning: The distribution is specified by [0.1, 5] and step=0.25, but the range is not divisible by `step`. It will be replaced with [0.1, 4.85].
  error_threshold = trial.suggest_float("error_threshold", 0.1, 5, step=0.25)
[I 2026-07-21 10:05:18,403] Trial 409 finished with value: -0.591726217182707 and parameters: {'error_threshold': 4.6, 'scalers': 'robust', 'ratios': 'log_ratio', 'imputers': 'mean', 'n_estimators': 2400, 'learning_rate': 0.009647364823148645, 'max_depth': 4, 'min_child_weight': 3, 'subsample': 0.6, 'colsample_bytree': 0.6, 'colsample_bylevel': 0.8, 'reg_alpha': 1.120863045755192e-06, 'reg_lambda': 1.0209207062855253e-06, 'gamma': 0.00011558253708738503}. Best is trial 347 with value: -0.5896472086171253.
/bsuhome/alexanderemert/Research/Star-Formation-Research-Project-2026/pipeline/scripts/optuna/final_preds_and_models/optuna_search_mult_quant_reg.py:161: UserWarning: The distribution is specified by [0.1, 5] and step=0.25, but the range is not divisible by `step`. It will be replaced with [0.1, 4.85].
  error_threshold = trial.suggest_float("error_threshold", 0.1, 5, step=0.25)
[I 2026-07-21 10:05:20,494] Trial 410 finished with value: -0.591022092218258 and parameters: {'error_threshold': 4.85, 'scalers': 'robust', 'ratios': 'log_ratio', 'imputers': 'mean', 'n_estimators': 2100, 'learning_rate': 0.012120299788006815, 'max_depth': 4, 'min_child_weight': 3, 'subsample': 0.6, 'colsample_bytree': 0.6, 'colsample_bylevel': 0.8, 'reg_alpha': 1.1521814507953686e-06, 'reg_lambda': 1.4734497946434525e-06, 'gamma': 9.708754030795829e-05}. Best is trial 347 with value: -0.5896472086171253.
/bsuhome/alexanderemert/Research/Star-Formation-Research-Project-2026/pipeline/scripts/optuna/final_preds_and_models/optuna_search_mult_quant_reg.py:161: UserWarning: The distribution is specified by [0.1, 5] and step=0.25, but the range is not divisible by `step`. It will be replaced with [0.1, 4.85].
  error_threshold = trial.suggest_float("error_threshold", 0.1, 5, step=0.25)
[I 2026-07-21 10:05:23,009] Trial 411 finished with value: -0.5940759852546127 and parameters: {'error_threshold': 4.85, 'scalers': 'robust', 'ratios': 'log_ratio', 'imputers': 'mean', 'n_estimators': 2400, 'learning_rate': 0.012801585742582071, 'max_depth': 4, 'min_child_weight': 2, 'subsample': 0.6, 'colsample_bytree': 0.6, 'colsample_bylevel': 0.8, 'reg_alpha': 1.016699223027646e-06, 'reg_lambda': 1.8845071384328188e-06, 'gamma': 8.497845607427688e-05}. Best is trial 347 with value: -0.5896472086171253.
/bsuhome/alexanderemert/Research/Star-Formation-Research-Project-2026/pipeline/scripts/optuna/final_preds_and_models/optuna_search_mult_quant_reg.py:161: UserWarning: The distribution is specified by [0.1, 5] and step=0.25, but the range is not divisible by `step`. It will be replaced with [0.1, 4.85].
  error_threshold = trial.suggest_float("error_threshold", 0.1, 5, step=0.25)
[I 2026-07-21 10:05:25,539] Trial 412 finished with value: -0.5904347044130114 and parameters: {'error_threshold': 4.85, 'scalers': 'robust', 'ratios': 'log_ratio', 'imputers': 'mean', 'n_estimators': 2400, 'learning_rate': 0.008126473963025325, 'max_depth': 4, 'min_child_weight': 2, 'subsample': 0.6, 'colsample_bytree': 0.6, 'colsample_bylevel': 0.8, 'reg_alpha': 1.3908303571282827e-06, 'reg_lambda': 2.2046824076778475e-06, 'gamma': 8.530399695385334e-05}. Best is trial 347 with value: -0.5896472086171253.
/bsuhome/alexanderemert/Research/Star-Formation-Research-Project-2026/pipeline/scripts/optuna/final_preds_and_models/optuna_search_mult_quant_reg.py:161: UserWarning: The distribution is specified by [0.1, 5] and step=0.25, but the range is not divisible by `step`. It will be replaced with [0.1, 4.85].
  error_threshold = trial.suggest_float("error_threshold", 0.1, 5, step=0.25)
[I 2026-07-21 10:05:46,891] Trial 405 finished with value: -0.666733802766017 and parameters: {'error_threshold': 4.6, 'scalers': 'robust', 'ratios': 'log_ratio', 'imputers': 'mean', 'n_estimators': 2250, 'learning_rate': 0.010393221225590067, 'max_depth': 12, 'min_child_weight': 3, 'subsample': 0.6, 'colsample_bytree': 0.6, 'colsample_bylevel': 0.8, 'reg_alpha': 1.017078300002839e-06, 'reg_lambda': 1.0423653712268954e-06, 'gamma': 0.00010722623440914171}. Best is trial 347 with value: -0.5896472086171253.
/bsuhome/alexanderemert/Research/Star-Formation-Research-Project-2026/pipeline/scripts/optuna/final_preds_and_models/optuna_search_mult_quant_reg.py:161: UserWarning: The distribution is specified by [0.1, 5] and step=0.25, but the range is not divisible by `step`. It will be replaced with [0.1, 4.85].
  error_threshold = trial.suggest_float("error_threshold", 0.1, 5, step=0.25)
[I 2026-07-21 10:05:49,439] Trial 413 finished with value: -0.5900092728254468 and parameters: {'error_threshold': 4.85, 'scalers': 'robust', 'ratios': 'log_ratio', 'imputers': 'mean', 'n_estimators': 2400, 'learning_rate': 0.008325923349724566, 'max_depth': 4, 'min_child_weight': 2, 'subsample': 0.6, 'colsample_bytree': 0.6, 'colsample_bylevel': 0.8, 'reg_alpha': 1.5667066299944224e-06, 'reg_lambda': 1.990809008561962e-06, 'gamma': 9.991706120525274e-05}. Best is trial 347 with value: -0.5896472086171253.
/bsuhome/alexanderemert/Research/Star-Formation-Research-Project-2026/pipeline/scripts/optuna/final_preds_and_models/optuna_search_mult_quant_reg.py:161: UserWarning: The distribution is specified by [0.1, 5] and step=0.25, but the range is not divisible by `step`. It will be replaced with [0.1, 4.85].
  error_threshold = trial.suggest_float("error_threshold", 0.1, 5, step=0.25)
[I 2026-07-21 10:05:52,404] Trial 414 finished with value: -0.5903431036358595 and parameters: {'error_threshold': 4.85, 'scalers': 'robust', 'ratios': 'log_ratio', 'imputers': 'mean', 'n_estimators': 2800, 'learning_rate': 0.008073282802612176, 'max_depth': 4, 'min_child_weight': 2, 'subsample': 0.6, 'colsample_bytree': 0.6, 'colsample_bylevel': 0.8, 'reg_alpha': 1.0161457788986994e-06, 'reg_lambda': 2.1844853929971877e-06, 'gamma': 8.015465593538474e-05}. Best is trial 347 with value: -0.5896472086171253.
/bsuhome/alexanderemert/Research/Star-Formation-Research-Project-2026/pipeline/scripts/optuna/final_preds_and_models/optuna_search_mult_quant_reg.py:161: UserWarning: The distribution is specified by [0.1, 5] and step=0.25, but the range is not divisible by `step`. It will be replaced with [0.1, 4.85].
  error_threshold = trial.suggest_float("error_threshold", 0.1, 5, step=0.25)
[I 2026-07-21 10:05:54,701] Trial 415 finished with value: -0.5899061473150277 and parameters: {'error_threshold': 4.85, 'scalers': 'robust', 'ratios': 'log_ratio', 'imputers': 'mean', 'n_estimators': 2150, 'learning_rate': 0.008476968716445057, 'max_depth': 4, 'min_child_weight': 2, 'subsample': 0.6, 'colsample_bytree': 0.6, 'colsample_bylevel': 0.8, 'reg_alpha': 3.452545234556012e-06, 'reg_lambda': 1.9946904105548336e-06, 'gamma': 9.094432093010808e-05}. Best is trial 347 with value: -0.5896472086171253.
/bsuhome/alexanderemert/Research/Star-Formation-Research-Project-2026/pipeline/scripts/optuna/final_preds_and_models/optuna_search_mult_quant_reg.py:161: UserWarning: The distribution is specified by [0.1, 5] and step=0.25, but the range is not divisible by `step`. It will be replaced with [0.1, 4.85].
  error_threshold = trial.suggest_float("error_threshold", 0.1, 5, step=0.25)
[I 2026-07-21 10:05:57,185] Trial 416 finished with value: -0.5900977770730058 and parameters: {'error_threshold': 4.85, 'scalers': 'robust', 'ratios': 'log_ratio', 'imputers': 'mean', 'n_estimators': 2350, 'learning_rate': 0.008376336487704914, 'max_depth': 4, 'min_child_weight': 2, 'subsample': 0.6, 'colsample_bytree': 0.6, 'colsample_bylevel': 0.8, 'reg_alpha': 3.36925076096985e-06, 'reg_lambda': 2.3286673199960324e-06, 'gamma': 8.002609296428275e-05}. Best is trial 347 with value: -0.5896472086171253.
/bsuhome/alexanderemert/Research/Star-Formation-Research-Project-2026/pipeline/scripts/optuna/final_preds_and_models/optuna_search_mult_quant_reg.py:161: UserWarning: The distribution is specified by [0.1, 5] and step=0.25, but the range is not divisible by `step`. It will be replaced with [0.1, 4.85].
  error_threshold = trial.suggest_float("error_threshold", 0.1, 5, step=0.25)
[I 2026-07-21 10:06:00,106] Trial 417 finished with value: -1.4225731888323956 and parameters: {'error_threshold': 4.85, 'scalers': 'robust', 'ratios': 'log_ratio', 'imputers': 'mean', 'n_estimators': 2250, 'learning_rate': 0.0003680245415558779, 'max_depth': 4, 'min_child_weight': 2, 'subsample': 0.6, 'colsample_bytree': 0.6, 'colsample_bylevel': 0.8, 'reg_alpha': 1.6152689864674237e-06, 'reg_lambda': 2.185025568945574e-06, 'gamma': 6.62020194934175e-05}. Best is trial 347 with value: -0.5896472086171253.
/bsuhome/alexanderemert/Research/Star-Formation-Research-Project-2026/pipeline/scripts/optuna/final_preds_and_models/optuna_search_mult_quant_reg.py:161: UserWarning: The distribution is specified by [0.1, 5] and step=0.25, but the range is not divisible by `step`. It will be replaced with [0.1, 4.85].
  error_threshold = trial.suggest_float("error_threshold", 0.1, 5, step=0.25)
[I 2026-07-21 10:06:02,470] Trial 418 finished with value: -0.6314288650756387 and parameters: {'error_threshold': 4.85, 'scalers': 'robust', 'ratios': 'log_ratio', 'imputers': 'mean', 'n_estimators': 2250, 'learning_rate': 0.060594032334840904, 'max_depth': 4, 'min_child_weight': 3, 'subsample': 0.6, 'colsample_bytree': 0.6, 'colsample_bylevel': 0.8, 'reg_alpha': 1.687415842854148e-06, 'reg_lambda': 2.3551509775771685e-06, 'gamma': 6.043488571788916e-05}. Best is trial 347 with value: -0.5896472086171253.
/bsuhome/alexanderemert/Research/Star-Formation-Research-Project-2026/pipeline/scripts/optuna/final_preds_and_models/optuna_search_mult_quant_reg.py:161: UserWarning: The distribution is specified by [0.1, 5] and step=0.25, but the range is not divisible by `step`. It will be replaced with [0.1, 4.85].
  error_threshold = trial.suggest_float("error_threshold", 0.1, 5, step=0.25)
[I 2026-07-21 10:06:04,795] Trial 419 finished with value: -0.5902469814356919 and parameters: {'error_threshold': 4.85, 'scalers': 'robust', 'ratios': 'log_ratio', 'imputers': 'mean', 'n_estimators': 2200, 'learning_rate': 0.008281902740142044, 'max_depth': 4, 'min_child_weight': 2, 'subsample': 0.6, 'colsample_bytree': 0.6, 'colsample_bylevel': 0.8, 'reg_alpha': 3.5504096771243205e-06, 'reg_lambda': 2.0068049056125356e-06, 'gamma': 7.599630280734892e-05}. Best is trial 347 with value: -0.5896472086171253.
/bsuhome/alexanderemert/Research/Star-Formation-Research-Project-2026/pipeline/scripts/optuna/final_preds_and_models/optuna_search_mult_quant_reg.py:161: UserWarning: The distribution is specified by [0.1, 5] and step=0.25, but the range is not divisible by `step`. It will be replaced with [0.1, 4.85].
  error_threshold = trial.suggest_float("error_threshold", 0.1, 5, step=0.25)
[I 2026-07-21 10:06:07,457] Trial 420 finished with value: -0.5913633040863612 and parameters: {'error_threshold': 4.85, 'scalers': 'robust', 'ratios': 'norm_ratio', 'imputers': 'mean', 'n_estimators': 2400, 'learning_rate': 0.007766220699170887, 'max_depth': 4, 'min_child_weight': 1, 'subsample': 0.6, 'colsample_bytree': 0.6, 'colsample_bylevel': 0.8, 'reg_alpha': 3.0506611963517238e-06, 'reg_lambda': 1.9272794464729933e-06, 'gamma': 7.322114591148948e-05}. Best is trial 347 with value: -0.5896472086171253.
/bsuhome/alexanderemert/Research/Star-Formation-Research-Project-2026/pipeline/scripts/optuna/final_preds_and_models/optuna_search_mult_quant_reg.py:161: UserWarning: The distribution is specified by [0.1, 5] and step=0.25, but the range is not divisible by `step`. It will be replaced with [0.1, 4.85].
  error_threshold = trial.suggest_float("error_threshold", 0.1, 5, step=0.25)
[I 2026-07-21 10:06:10,593] Trial 421 finished with value: -1.960073975086974 and parameters: {'error_threshold': 4.85, 'scalers': 'robust', 'ratios': 'log_ratio', 'imputers': 'mean', 'n_estimators': 2400, 'learning_rate': 0.00010044054347822093, 'max_depth': 4, 'min_child_weight': 2, 'subsample': 0.6, 'colsample_bytree': 0.6, 'colsample_bylevel': 0.8, 'reg_alpha': 1.6316926507512085e-06, 'reg_lambda': 2.106030407923624e-06, 'gamma': 0.00023456622916251328}. Best is trial 347 with value: -0.5896472086171253.
/bsuhome/alexanderemert/Research/Star-Formation-Research-Project-2026/pipeline/scripts/optuna/final_preds_and_models/optuna_search_mult_quant_reg.py:161: UserWarning: The distribution is specified by [0.1, 5] and step=0.25, but the range is not divisible by `step`. It will be replaced with [0.1, 4.85].
  error_threshold = trial.suggest_float("error_threshold", 0.1, 5, step=0.25)
[I 2026-07-21 10:06:13,082] Trial 422 finished with value: -0.5897448457981171 and parameters: {'error_threshold': 4.85, 'scalers': 'robust', 'ratios': 'norm_ratio', 'imputers': 'mean', 'n_estimators': 2350, 'learning_rate': 0.008489257117276645, 'max_depth': 4, 'min_child_weight': 2, 'subsample': 0.6, 'colsample_bytree': 0.6, 'colsample_bylevel': 0.8, 'reg_alpha': 1.6636978505808453e-06, 'reg_lambda': 2.193377869981918e-06, 'gamma': 0.00020445888183833277}. Best is trial 347 with value: -0.5896472086171253.
/bsuhome/alexanderemert/Research/Star-Formation-Research-Project-2026/pipeline/scripts/optuna/final_preds_and_models/optuna_search_mult_quant_reg.py:161: UserWarning: The distribution is specified by [0.1, 5] and step=0.25, but the range is not divisible by `step`. It will be replaced with [0.1, 4.85].
  error_threshold = trial.suggest_float("error_threshold", 0.1, 5, step=0.25)
[I 2026-07-21 10:06:15,691] Trial 423 finished with value: -1.9958443862348705 and parameters: {'error_threshold': 4.85, 'scalers': 'robust', 'ratios': 'norm_ratio', 'imputers': 'mean', 'n_estimators': 2000, 'learning_rate': 0.0001047263864881551, 'max_depth': 4, 'min_child_weight': 2, 'subsample': 0.6, 'colsample_bytree': 0.6, 'colsample_bylevel': 0.8, 'reg_alpha': 1.8219113969791717e-06, 'reg_lambda': 2.2074906074526806e-06, 'gamma': 7.019500417867265e-05}. Best is trial 347 with value: -0.5896472086171253.
/bsuhome/alexanderemert/Research/Star-Formation-Research-Project-2026/pipeline/scripts/optuna/final_preds_and_models/optuna_search_mult_quant_reg.py:161: UserWarning: The distribution is specified by [0.1, 5] and step=0.25, but the range is not divisible by `step`. It will be replaced with [0.1, 4.85].
  error_threshold = trial.suggest_float("error_threshold", 0.1, 5, step=0.25)
[I 2026-07-21 10:06:18,065] Trial 424 finished with value: -0.5888711747749842 and parameters: {'error_threshold': 4.85, 'scalers': 'robust', 'ratios': 'norm_ratio', 'imputers': 'mean', 'n_estimators': 2200, 'learning_rate': 0.008812859586255417, 'max_depth': 4, 'min_child_weight': 2, 'subsample': 0.6, 'colsample_bytree': 0.6, 'colsample_bylevel': 0.8, 'reg_alpha': 3.2499903931486856e-06, 'reg_lambda': 2.129883991832902e-06, 'gamma': 0.0002169765302803929}. Best is trial 424 with value: -0.5888711747749842.
/bsuhome/alexanderemert/Research/Star-Formation-Research-Project-2026/pipeline/scripts/optuna/final_preds_and_models/optuna_search_mult_quant_reg.py:161: UserWarning: The distribution is specified by [0.1, 5] and step=0.25, but the range is not divisible by `step`. It will be replaced with [0.1, 4.85].
  error_threshold = trial.suggest_float("error_threshold", 0.1, 5, step=0.25)
[I 2026-07-21 10:06:20,374] Trial 425 finished with value: -0.5946730980826268 and parameters: {'error_threshold': 4.85, 'scalers': 'robust', 'ratios': 'log_ratio', 'imputers': 'mean', 'n_estimators': 2150, 'learning_rate': 0.013944446959572828, 'max_depth': 4, 'min_child_weight': 2, 'subsample': 0.6, 'colsample_bytree': 0.6, 'colsample_bylevel': 0.8, 'reg_alpha': 3.228763524460924e-06, 'reg_lambda': 2.1010306592693313e-06, 'gamma': 0.00024115886045852908}. Best is trial 424 with value: -0.5888711747749842.
/bsuhome/alexanderemert/Research/Star-Formation-Research-Project-2026/pipeline/scripts/optuna/final_preds_and_models/optuna_search_mult_quant_reg.py:161: UserWarning: The distribution is specified by [0.1, 5] and step=0.25, but the range is not divisible by `step`. It will be replaced with [0.1, 4.85].
  error_threshold = trial.suggest_float("error_threshold", 0.1, 5, step=0.25)
[I 2026-07-21 10:06:22,721] Trial 426 finished with value: -0.593469835157907 and parameters: {'error_threshold': 4.85, 'scalers': 'robust', 'ratios': 'norm_ratio', 'imputers': 'mean', 'n_estimators': 2200, 'learning_rate': 0.012718004551103272, 'max_depth': 4, 'min_child_weight': 2, 'subsample': 0.6, 'colsample_bytree': 0.6, 'colsample_bylevel': 0.8, 'reg_alpha': 3.437067740142931e-06, 'reg_lambda': 2.011922183159973e-06, 'gamma': 0.00016638895991365356}. Best is trial 424 with value: -0.5888711747749842.
/bsuhome/alexanderemert/Research/Star-Formation-Research-Project-2026/pipeline/scripts/optuna/final_preds_and_models/optuna_search_mult_quant_reg.py:161: UserWarning: The distribution is specified by [0.1, 5] and step=0.25, but the range is not divisible by `step`. It will be replaced with [0.1, 4.85].
  error_threshold = trial.suggest_float("error_threshold", 0.1, 5, step=0.25)
[I 2026-07-21 10:06:24,978] Trial 427 finished with value: -0.5903196181809135 and parameters: {'error_threshold': 4.85, 'scalers': 'robust', 'ratios': 'norm_ratio', 'imputers': 'mean', 'n_estimators': 2100, 'learning_rate': 0.008290145902875207, 'max_depth': 4, 'min_child_weight': 2, 'subsample': 0.6, 'colsample_bytree': 0.6, 'colsample_bylevel': 0.8, 'reg_alpha': 3.400542292792251e-06, 'reg_lambda': 1.8768383626541625e-06, 'gamma': 0.00019280862056285532}. Best is trial 424 with value: -0.5888711747749842.
/bsuhome/alexanderemert/Research/Star-Formation-Research-Project-2026/pipeline/scripts/optuna/final_preds_and_models/optuna_search_mult_quant_reg.py:161: UserWarning: The distribution is specified by [0.1, 5] and step=0.25, but the range is not divisible by `step`. It will be replaced with [0.1, 4.85].
  error_threshold = trial.suggest_float("error_threshold", 0.1, 5, step=0.25)
