[I 2026-07-20 14:46:03,104] Trial 249 finished with value: -0.13687407621856254 and parameters: {'error_threshold': 0.1, 'scalers': 'robust', 'ratios': 'norm_ratio', 'imputers': 'mean', 'n_estimators': 100, 'learning_rate': 0.00019051246303054034, 'max_depth': 7, 'min_child_weight': 8, 'subsample': 0.6, 'colsample_bytree': 0.5, 'colsample_bylevel': 1.0, 'reg_alpha': 1.6195254387194993, 'reg_lambda': 9.67952570199984e-05, 'gamma': 4.84498033923826}. Best is trial 205 with value: -0.13735526511479842.
/bsuhome/alexanderemert/Research/Star-Formation-Research-Project-2026/pipeline/scripts/optuna/final_preds_and_models/optuna_search_mult_quant_reg.py:75: UserWarning: The distribution is specified by [0.1, 5] and step=0.25, but the range is not divisible by `step`. It will be replaced with [0.1, 4.85].
  error_threshold = trial.suggest_float("error_threshold", 0.1, 5, step=0.25)
[I 2026-07-20 14:46:03,283] Trial 250 finished with value: -0.1368617065772688 and parameters: {'error_threshold': 0.1, 'scalers': 'robust', 'ratios': 'norm_ratio', 'imputers': 'mean', 'n_estimators': 100, 'learning_rate': 0.00019528088374128345, 'max_depth': 7, 'min_child_weight': 8, 'subsample': 0.6, 'colsample_bytree': 0.5, 'colsample_bylevel': 1.0, 'reg_alpha': 2.7392985085268187, 'reg_lambda': 0.00011438612623053321, 'gamma': 5.546646268813434}. Best is trial 205 with value: -0.13735526511479842.
/bsuhome/alexanderemert/Research/Star-Formation-Research-Project-2026/pipeline/scripts/optuna/final_preds_and_models/optuna_search_mult_quant_reg.py:75: UserWarning: The distribution is specified by [0.1, 5] and step=0.25, but the range is not divisible by `step`. It will be replaced with [0.1, 4.85].
  error_threshold = trial.suggest_float("error_threshold", 0.1, 5, step=0.25)
[I 2026-07-20 14:46:04,784] Trial 251 finished with value: -0.1369237185584941 and parameters: {'error_threshold': 0.1, 'scalers': 'robust', 'ratios': 'norm_ratio', 'imputers': 'mean', 'n_estimators': 100, 'learning_rate': 0.00017932463745486742, 'max_depth': 7, 'min_child_weight': 8, 'subsample': 0.6, 'colsample_bytree': 0.5, 'colsample_bylevel': 1.0, 'reg_alpha': 1.2643680135309197, 'reg_lambda': 9.267096190094776e-05, 'gamma': 5.5451994261959605}. Best is trial 205 with value: -0.13735526511479842.
/bsuhome/alexanderemert/Research/Star-Formation-Research-Project-2026/pipeline/scripts/optuna/final_preds_and_models/optuna_search_mult_quant_reg.py:75: UserWarning: The distribution is specified by [0.1, 5] and step=0.25, but the range is not divisible by `step`. It will be replaced with [0.1, 4.85].
  error_threshold = trial.suggest_float("error_threshold", 0.1, 5, step=0.25)
[I 2026-07-20 14:46:04,941] Trial 252 finished with value: -0.1368998180501552 and parameters: {'error_threshold': 0.1, 'scalers': 'robust', 'ratios': 'norm_ratio', 'imputers': 'mean', 'n_estimators': 100, 'learning_rate': 0.0001857265589512165, 'max_depth': 7, 'min_child_weight': 8, 'subsample': 0.6, 'colsample_bytree': 0.5, 'colsample_bylevel': 1.0, 'reg_alpha': 1.4184885607156397, 'reg_lambda': 0.00010268497385716899, 'gamma': 5.821928057634183}. Best is trial 205 with value: -0.13735526511479842.
/bsuhome/alexanderemert/Research/Star-Formation-Research-Project-2026/pipeline/scripts/optuna/final_preds_and_models/optuna_search_mult_quant_reg.py:75: UserWarning: The distribution is specified by [0.1, 5] and step=0.25, but the range is not divisible by `step`. It will be replaced with [0.1, 4.85].
  error_threshold = trial.suggest_float("error_threshold", 0.1, 5, step=0.25)
[I 2026-07-20 14:46:05,264] Trial 253 finished with value: -0.1371114629061387 and parameters: {'error_threshold': 0.1, 'scalers': 'robust', 'ratios': 'norm_ratio', 'imputers': 'mean', 'n_estimators': 100, 'learning_rate': 0.0001802673384015057, 'max_depth': 7, 'min_child_weight': 8, 'subsample': 0.6, 'colsample_bytree': 0.5, 'colsample_bylevel': 1.0, 'reg_alpha': 1.4006251851697833, 'reg_lambda': 9.780020721202969e-05, 'gamma': 21.01717762694284}. Best is trial 205 with value: -0.13735526511479842.
/bsuhome/alexanderemert/Research/Star-Formation-Research-Project-2026/pipeline/scripts/optuna/final_preds_and_models/optuna_search_mult_quant_reg.py:75: UserWarning: The distribution is specified by [0.1, 5] and step=0.25, but the range is not divisible by `step`. It will be replaced with [0.1, 4.85].
  error_threshold = trial.suggest_float("error_threshold", 0.1, 5, step=0.25)
[I 2026-07-20 14:46:05,654] Trial 254 finished with value: -0.13720545526970598 and parameters: {'error_threshold': 0.1, 'scalers': 'robust', 'ratios': 'norm_ratio', 'imputers': 'mean', 'n_estimators': 100, 'learning_rate': 0.0001498385346860216, 'max_depth': 7, 'min_child_weight': 8, 'subsample': 0.6, 'colsample_bytree': 0.5, 'colsample_bylevel': 1.0, 'reg_alpha': 1.5471181286065772, 'reg_lambda': 0.0012884420585570335, 'gamma': 21.121840862662143}. Best is trial 205 with value: -0.13735526511479842.
/bsuhome/alexanderemert/Research/Star-Formation-Research-Project-2026/pipeline/scripts/optuna/final_preds_and_models/optuna_search_mult_quant_reg.py:75: UserWarning: The distribution is specified by [0.1, 5] and step=0.25, but the range is not divisible by `step`. It will be replaced with [0.1, 4.85].
  error_threshold = trial.suggest_float("error_threshold", 0.1, 5, step=0.25)
[I 2026-07-20 14:46:06,242] Trial 255 finished with value: -0.1370167782884216 and parameters: {'error_threshold': 0.1, 'scalers': 'robust', 'ratios': 'norm_ratio', 'imputers': 'mean', 'n_estimators': 100, 'learning_rate': 0.00014808510557275456, 'max_depth': 7, 'min_child_weight': 8, 'subsample': 0.6, 'colsample_bytree': 0.5, 'colsample_bylevel': 1.0, 'reg_alpha': 1.8656649114264097, 'reg_lambda': 0.00011064017550913676, 'gamma': 2.2275898071236475}. Best is trial 205 with value: -0.13735526511479842.
/bsuhome/alexanderemert/Research/Star-Formation-Research-Project-2026/pipeline/scripts/optuna/final_preds_and_models/optuna_search_mult_quant_reg.py:75: UserWarning: The distribution is specified by [0.1, 5] and step=0.25, but the range is not divisible by `step`. It will be replaced with [0.1, 4.85].
  error_threshold = trial.suggest_float("error_threshold", 0.1, 5, step=0.25)
[I 2026-07-20 14:46:06,328] Trial 256 finished with value: -0.1372149454524863 and parameters: {'error_threshold': 0.1, 'scalers': 'robust', 'ratios': 'norm_ratio', 'imputers': 'mean', 'n_estimators': 100, 'learning_rate': 0.000146446728431244, 'max_depth': 7, 'min_child_weight': 8, 'subsample': 0.6, 'colsample_bytree': 0.5, 'colsample_bylevel': 1.0, 'reg_alpha': 1.2692473268501965, 'reg_lambda': 0.00031163093252693926, 'gamma': 21.41841544987514}. Best is trial 205 with value: -0.13735526511479842.
/bsuhome/alexanderemert/Research/Star-Formation-Research-Project-2026/pipeline/scripts/optuna/final_preds_and_models/optuna_search_mult_quant_reg.py:75: UserWarning: The distribution is specified by [0.1, 5] and step=0.25, but the range is not divisible by `step`. It will be replaced with [0.1, 4.85].
  error_threshold = trial.suggest_float("error_threshold", 0.1, 5, step=0.25)
[I 2026-07-20 14:46:06,403] Trial 257 finished with value: -0.13720443571118104 and parameters: {'error_threshold': 0.1, 'scalers': 'robust', 'ratios': 'norm_ratio', 'imputers': 'mean', 'n_estimators': 100, 'learning_rate': 0.00015026419539866136, 'max_depth': 7, 'min_child_weight': 7, 'subsample': 0.6, 'colsample_bytree': 0.5, 'colsample_bylevel': 1.0, 'reg_alpha': 1.4997221835690084, 'reg_lambda': 0.00034007907901547794, 'gamma': 21.206840964027247}. Best is trial 205 with value: -0.13735526511479842.
/bsuhome/alexanderemert/Research/Star-Formation-Research-Project-2026/pipeline/scripts/optuna/final_preds_and_models/optuna_search_mult_quant_reg.py:75: UserWarning: The distribution is specified by [0.1, 5] and step=0.25, but the range is not divisible by `step`. It will be replaced with [0.1, 4.85].
  error_threshold = trial.suggest_float("error_threshold", 0.1, 5, step=0.25)
[I 2026-07-20 14:46:07,699] Trial 245 finished with value: -0.12854798257797673 and parameters: {'error_threshold': 0.1, 'scalers': 'robust', 'ratios': 'norm_ratio', 'imputers': 'mean', 'n_estimators': 1900, 'learning_rate': 0.00018785952717997027, 'max_depth': 7, 'min_child_weight': 9, 'subsample': 0.6, 'colsample_bytree': 0.5, 'colsample_bylevel': 1.0, 'reg_alpha': 2.261495468822977, 'reg_lambda': 7.396655269849587e-05, 'gamma': 55.94481195066166}. Best is trial 205 with value: -0.13735526511479842.
/bsuhome/alexanderemert/Research/Star-Formation-Research-Project-2026/pipeline/scripts/optuna/final_preds_and_models/optuna_search_mult_quant_reg.py:75: UserWarning: The distribution is specified by [0.1, 5] and step=0.25, but the range is not divisible by `step`. It will be replaced with [0.1, 4.85].
  error_threshold = trial.suggest_float("error_threshold", 0.1, 5, step=0.25)
[I 2026-07-20 14:46:07,803] Trial 258 finished with value: -0.13701353686833712 and parameters: {'error_threshold': 0.1, 'scalers': 'robust', 'ratios': 'norm_ratio', 'imputers': 'mean', 'n_estimators': 100, 'learning_rate': 0.0001477345951268433, 'max_depth': 7, 'min_child_weight': 7, 'subsample': 0.6, 'colsample_bytree': 0.5, 'colsample_bylevel': 1.0, 'reg_alpha': 1.4297724741277593, 'reg_lambda': 0.00037723016957159585, 'gamma': 1.9490800938512671}. Best is trial 205 with value: -0.13735526511479842.
/bsuhome/alexanderemert/Research/Star-Formation-Research-Project-2026/pipeline/scripts/optuna/final_preds_and_models/optuna_search_mult_quant_reg.py:75: UserWarning: The distribution is specified by [0.1, 5] and step=0.25, but the range is not divisible by `step`. It will be replaced with [0.1, 4.85].
  error_threshold = trial.suggest_float("error_threshold", 0.1, 5, step=0.25)
[I 2026-07-20 14:46:08,556] Trial 259 finished with value: -0.13674811327580821 and parameters: {'error_threshold': 0.1, 'scalers': 'robust', 'ratios': 'norm_ratio', 'imputers': 'mean', 'n_estimators': 150, 'learning_rate': 0.00014833722435117648, 'max_depth': 7, 'min_child_weight': 7, 'subsample': 0.6, 'colsample_bytree': 0.5, 'colsample_bylevel': 1.0, 'reg_alpha': 1.66613106187466, 'reg_lambda': 0.00027056888479903564, 'gamma': 2.1904547215984445}. Best is trial 205 with value: -0.13735526511479842.
/bsuhome/alexanderemert/Research/Star-Formation-Research-Project-2026/pipeline/scripts/optuna/final_preds_and_models/optuna_search_mult_quant_reg.py:75: UserWarning: The distribution is specified by [0.1, 5] and step=0.25, but the range is not divisible by `step`. It will be replaced with [0.1, 4.85].
  error_threshold = trial.suggest_float("error_threshold", 0.1, 5, step=0.25)
[I 2026-07-20 14:46:08,930] Trial 260 finished with value: -0.1367413078322565 and parameters: {'error_threshold': 0.1, 'scalers': 'robust', 'ratios': 'norm_ratio', 'imputers': 'mean', 'n_estimators': 150, 'learning_rate': 0.0001489298690026831, 'max_depth': 8, 'min_child_weight': 7, 'subsample': 0.6, 'colsample_bytree': 0.5, 'colsample_bylevel': 1.0, 'reg_alpha': 0.9382557134340047, 'reg_lambda': 0.0013997843920918764, 'gamma': 2.1779962499274657}. Best is trial 205 with value: -0.13735526511479842.
/bsuhome/alexanderemert/Research/Star-Formation-Research-Project-2026/pipeline/scripts/optuna/final_preds_and_models/optuna_search_mult_quant_reg.py:75: UserWarning: The distribution is specified by [0.1, 5] and step=0.25, but the range is not divisible by `step`. It will be replaced with [0.1, 4.85].
  error_threshold = trial.suggest_float("error_threshold", 0.1, 5, step=0.25)
[I 2026-07-20 14:46:09,299] Trial 261 finished with value: -0.13682336741146375 and parameters: {'error_threshold': 0.1, 'scalers': 'robust', 'ratios': 'norm_ratio', 'imputers': 'mean', 'n_estimators': 150, 'learning_rate': 0.00014787206027479642, 'max_depth': 8, 'min_child_weight': 7, 'subsample': 0.6, 'colsample_bytree': 0.5, 'colsample_bylevel': 1.0, 'reg_alpha': 1.9576525593990552, 'reg_lambda': 0.000743976186079537, 'gamma': 8.971848801360299}. Best is trial 205 with value: -0.13735526511479842.
/bsuhome/alexanderemert/Research/Star-Formation-Research-Project-2026/pipeline/scripts/optuna/final_preds_and_models/optuna_search_mult_quant_reg.py:75: UserWarning: The distribution is specified by [0.1, 5] and step=0.25, but the range is not divisible by `step`. It will be replaced with [0.1, 4.85].
  error_threshold = trial.suggest_float("error_threshold", 0.1, 5, step=0.25)
[I 2026-07-20 14:46:10,053] Trial 262 finished with value: -0.13699916154450184 and parameters: {'error_threshold': 0.1, 'scalers': 'robust', 'ratios': 'norm_ratio', 'imputers': 'mean', 'n_estimators': 150, 'learning_rate': 0.00014755241006338625, 'max_depth': 8, 'min_child_weight': 7, 'subsample': 0.6, 'colsample_bytree': 0.5, 'colsample_bylevel': 1.0, 'reg_alpha': 64.64432527804725, 'reg_lambda': 0.0003233981553317552, 'gamma': 2.2157422296574776}. Best is trial 205 with value: -0.13735526511479842.
/bsuhome/alexanderemert/Research/Star-Formation-Research-Project-2026/pipeline/scripts/optuna/final_preds_and_models/optuna_search_mult_quant_reg.py:75: UserWarning: The distribution is specified by [0.1, 5] and step=0.25, but the range is not divisible by `step`. It will be replaced with [0.1, 4.85].
  error_threshold = trial.suggest_float("error_threshold", 0.1, 5, step=0.25)
[I 2026-07-20 14:46:10,175] Trial 263 finished with value: -0.13681811280473918 and parameters: {'error_threshold': 0.1, 'scalers': 'robust', 'ratios': 'norm_ratio', 'imputers': 'mean', 'n_estimators': 150, 'learning_rate': 0.00014824207466974677, 'max_depth': 8, 'min_child_weight': 7, 'subsample': 0.6, 'colsample_bytree': 0.5, 'colsample_bylevel': 1.0, 'reg_alpha': 2.3261004645903514, 'reg_lambda': 0.00034226217242442166, 'gamma': 8.40676584262849}. Best is trial 205 with value: -0.13735526511479842.
/bsuhome/alexanderemert/Research/Star-Formation-Research-Project-2026/pipeline/scripts/optuna/final_preds_and_models/optuna_search_mult_quant_reg.py:75: UserWarning: The distribution is specified by [0.1, 5] and step=0.25, but the range is not divisible by `step`. It will be replaced with [0.1, 4.85].
  error_threshold = trial.suggest_float("error_threshold", 0.1, 5, step=0.25)
[I 2026-07-20 14:46:10,275] Trial 264 finished with value: -0.13697143737409231 and parameters: {'error_threshold': 0.1, 'scalers': 'robust', 'ratios': 'norm_ratio', 'imputers': 'mean', 'n_estimators': 150, 'learning_rate': 0.00015409515302642894, 'max_depth': 8, 'min_child_weight': 7, 'subsample': 0.6, 'colsample_bytree': 0.5, 'colsample_bylevel': 1.0, 'reg_alpha': 66.50396280513485, 'reg_lambda': 0.0003059852588567895, 'gamma': 2.273175947534973}. Best is trial 205 with value: -0.13735526511479842.
/bsuhome/alexanderemert/Research/Star-Formation-Research-Project-2026/pipeline/scripts/optuna/final_preds_and_models/optuna_search_mult_quant_reg.py:75: UserWarning: The distribution is specified by [0.1, 5] and step=0.25, but the range is not divisible by `step`. It will be replaced with [0.1, 4.85].
  error_threshold = trial.suggest_float("error_threshold", 0.1, 5, step=0.25)
[I 2026-07-20 14:46:10,487] Trial 265 finished with value: -0.1370114179648992 and parameters: {'error_threshold': 0.1, 'scalers': 'robust', 'ratios': 'norm_ratio', 'imputers': 'mean', 'n_estimators': 150, 'learning_rate': 0.00014456345850573168, 'max_depth': 8, 'min_child_weight': 7, 'subsample': 0.6, 'colsample_bytree': 0.5, 'colsample_bylevel': 1.0, 'reg_alpha': 64.98482333235904, 'reg_lambda': 0.0015690134339527463, 'gamma': 1.9506300943357202}. Best is trial 205 with value: -0.13735526511479842.
/bsuhome/alexanderemert/Research/Star-Formation-Research-Project-2026/pipeline/scripts/optuna/final_preds_and_models/optuna_search_mult_quant_reg.py:75: UserWarning: The distribution is specified by [0.1, 5] and step=0.25, but the range is not divisible by `step`. It will be replaced with [0.1, 4.85].
  error_threshold = trial.suggest_float("error_threshold", 0.1, 5, step=0.25)
[I 2026-07-20 14:46:10,683] Trial 266 finished with value: -0.1367826430225369 and parameters: {'error_threshold': 0.1, 'scalers': 'robust', 'ratios': 'norm_ratio', 'imputers': 'mean', 'n_estimators': 150, 'learning_rate': 0.0001465240793867975, 'max_depth': 8, 'min_child_weight': 7, 'subsample': 0.6, 'colsample_bytree': 0.5, 'colsample_bylevel': 1.0, 'reg_alpha': 0.8430280284719707, 'reg_lambda': 0.00029168467755212634, 'gamma': 3.6051054218915013}. Best is trial 205 with value: -0.13735526511479842.
/bsuhome/alexanderemert/Research/Star-Formation-Research-Project-2026/pipeline/scripts/optuna/final_preds_and_models/optuna_search_mult_quant_reg.py:75: UserWarning: The distribution is specified by [0.1, 5] and step=0.25, but the range is not divisible by `step`. It will be replaced with [0.1, 4.85].
  error_threshold = trial.suggest_float("error_threshold", 0.1, 5, step=0.25)
[I 2026-07-20 14:46:11,035] Trial 267 finished with value: -0.137088222506673 and parameters: {'error_threshold': 0.35, 'scalers': 'robust', 'ratios': 'norm_ratio', 'imputers': 'mean', 'n_estimators': 150, 'learning_rate': 0.0001415375214306146, 'max_depth': 8, 'min_child_weight': 7, 'subsample': 0.6, 'colsample_bytree': 0.5, 'colsample_bylevel': 1.0, 'reg_alpha': 67.86014654831347, 'reg_lambda': 0.0008794850559549951, 'gamma': 9.0434104530359}. Best is trial 205 with value: -0.13735526511479842.
/bsuhome/alexanderemert/Research/Star-Formation-Research-Project-2026/pipeline/scripts/optuna/final_preds_and_models/optuna_search_mult_quant_reg.py:75: UserWarning: The distribution is specified by [0.1, 5] and step=0.25, but the range is not divisible by `step`. It will be replaced with [0.1, 4.85].
  error_threshold = trial.suggest_float("error_threshold", 0.1, 5, step=0.25)
[I 2026-07-20 14:46:11,655] Trial 268 finished with value: -0.13706221321880085 and parameters: {'error_threshold': 0.35, 'scalers': 'robust', 'ratios': 'norm_ratio', 'imputers': 'mean', 'n_estimators': 150, 'learning_rate': 0.00014837307744263215, 'max_depth': 8, 'min_child_weight': 6, 'subsample': 0.6, 'colsample_bytree': 0.5, 'colsample_bylevel': 1.0, 'reg_alpha': 62.395195872131445, 'reg_lambda': 0.0009331883678588756, 'gamma': 9.818915887399237}. Best is trial 205 with value: -0.13735526511479842.
/bsuhome/alexanderemert/Research/Star-Formation-Research-Project-2026/pipeline/scripts/optuna/final_preds_and_models/optuna_search_mult_quant_reg.py:75: UserWarning: The distribution is specified by [0.1, 5] and step=0.25, but the range is not divisible by `step`. It will be replaced with [0.1, 4.85].
  error_threshold = trial.suggest_float("error_threshold", 0.1, 5, step=0.25)
[I 2026-07-20 14:46:12,488] Trial 269 finished with value: -0.1369946528962278 and parameters: {'error_threshold': 0.35, 'scalers': 'robust', 'ratios': 'norm_ratio', 'imputers': 'mean', 'n_estimators': 150, 'learning_rate': 0.0001449966801736864, 'max_depth': 8, 'min_child_weight': 9, 'subsample': 0.6, 'colsample_bytree': 0.5, 'colsample_bylevel': 1.0, 'reg_alpha': 43.37847768438543, 'reg_lambda': 0.001140003789378702, 'gamma': 0.9176339718709032}. Best is trial 205 with value: -0.13735526511479842.
/bsuhome/alexanderemert/Research/Star-Formation-Research-Project-2026/pipeline/scripts/optuna/final_preds_and_models/optuna_search_mult_quant_reg.py:75: UserWarning: The distribution is specified by [0.1, 5] and step=0.25, but the range is not divisible by `step`. It will be replaced with [0.1, 4.85].
  error_threshold = trial.suggest_float("error_threshold", 0.1, 5, step=0.25)
[I 2026-07-20 14:46:13,054] Trial 270 finished with value: -0.13701949534043173 and parameters: {'error_threshold': 0.35, 'scalers': 'robust', 'ratios': 'norm_ratio', 'imputers': 'mean', 'n_estimators': 150, 'learning_rate': 0.00013915569407123356, 'max_depth': 8, 'min_child_weight': 6, 'subsample': 0.6, 'colsample_bytree': 0.5, 'colsample_bylevel': 1.0, 'reg_alpha': 39.73578142206675, 'reg_lambda': 0.0009764107975819243, 'gamma': 0.8665977971841734}. Best is trial 205 with value: -0.13735526511479842.
/bsuhome/alexanderemert/Research/Star-Formation-Research-Project-2026/pipeline/scripts/optuna/final_preds_and_models/optuna_search_mult_quant_reg.py:75: UserWarning: The distribution is specified by [0.1, 5] and step=0.25, but the range is not divisible by `step`. It will be replaced with [0.1, 4.85].
  error_threshold = trial.suggest_float("error_threshold", 0.1, 5, step=0.25)
[I 2026-07-20 14:46:13,376] Trial 271 finished with value: -0.12877022641987299 and parameters: {'error_threshold': 0.35, 'scalers': 'robust', 'ratios': 'norm_ratio', 'imputers': 'mean', 'n_estimators': 200, 'learning_rate': 0.001776983553099208, 'max_depth': 8, 'min_child_weight': 6, 'subsample': 0.6, 'colsample_bytree': 0.5, 'colsample_bylevel': 1.0, 'reg_alpha': 64.97836418759023, 'reg_lambda': 0.001312206149106894, 'gamma': 36.07381718252071}. Best is trial 205 with value: -0.13735526511479842.
/bsuhome/alexanderemert/Research/Star-Formation-Research-Project-2026/pipeline/scripts/optuna/final_preds_and_models/optuna_search_mult_quant_reg.py:75: UserWarning: The distribution is specified by [0.1, 5] and step=0.25, but the range is not divisible by `step`. It will be replaced with [0.1, 4.85].
  error_threshold = trial.suggest_float("error_threshold", 0.1, 5, step=0.25)
