[I 2026-07-20 14:50:28,384] Trial 99 finished with value: -0.3487847389803942 and parameters: {'error_threshold': 2.85, 'scalers': 'none', 'ratios': 'log_ratio', 'imputers': 'none', 'n_estimators': 1100, 'learning_rate': 0.012886406659998628, 'max_depth': 3, 'min_child_weight': 3, 'subsample': 0.7, 'colsample_bytree': 0.7, 'colsample_bylevel': 0.5, 'reg_alpha': 6.5183758356752115, 'reg_lambda': 1.456044517611654e-06, 'gamma': 0.0013236562117604138}. Best is trial 98 with value: -0.3423999251867887.
/bsuhome/alexanderemert/Research/Star-Formation-Research-Project-2026/pipeline/scripts/optuna/final_preds_and_models/optuna_search_mult_quant_reg.py:161: UserWarning: The distribution is specified by [0.1, 5] and step=0.25, but the range is not divisible by `step`. It will be replaced with [0.1, 4.85].
  error_threshold = trial.suggest_float("error_threshold", 0.1, 5, step=0.25)
[I 2026-07-20 14:50:29,052] Trial 100 finished with value: -0.35578242081536926 and parameters: {'error_threshold': 2.85, 'scalers': 'none', 'ratios': 'log_ratio', 'imputers': 'none', 'n_estimators': 1100, 'learning_rate': 0.00599877413217107, 'max_depth': 3, 'min_child_weight': 3, 'subsample': 0.7, 'colsample_bytree': 0.6, 'colsample_bylevel': 0.5, 'reg_alpha': 0.4805634471851351, 'reg_lambda': 1.1124056605492797e-05, 'gamma': 0.00909158938260757}. Best is trial 98 with value: -0.3423999251867887.
/bsuhome/alexanderemert/Research/Star-Formation-Research-Project-2026/pipeline/scripts/optuna/final_preds_and_models/optuna_search_mult_quant_reg.py:161: UserWarning: The distribution is specified by [0.1, 5] and step=0.25, but the range is not divisible by `step`. It will be replaced with [0.1, 4.85].
  error_threshold = trial.suggest_float("error_threshold", 0.1, 5, step=0.25)
[I 2026-07-20 14:50:30,359] Trial 101 finished with value: -0.3470926427990495 and parameters: {'error_threshold': 2.85, 'scalers': 'none', 'ratios': 'log_ratio', 'imputers': 'none', 'n_estimators': 1400, 'learning_rate': 0.005820113905616058, 'max_depth': 4, 'min_child_weight': 1, 'subsample': 0.6, 'colsample_bytree': 0.6, 'colsample_bylevel': 0.5, 'reg_alpha': 0.4956255425428242, 'reg_lambda': 1.5843182303909663e-06, 'gamma': 0.00045922392049623287}. Best is trial 98 with value: -0.3423999251867887.
/bsuhome/alexanderemert/Research/Star-Formation-Research-Project-2026/pipeline/scripts/optuna/final_preds_and_models/optuna_search_mult_quant_reg.py:161: UserWarning: The distribution is specified by [0.1, 5] and step=0.25, but the range is not divisible by `step`. It will be replaced with [0.1, 4.85].
  error_threshold = trial.suggest_float("error_threshold", 0.1, 5, step=0.25)
[I 2026-07-20 14:50:30,975] Trial 103 finished with value: -0.35931043460796447 and parameters: {'error_threshold': 3.1, 'scalers': 'none', 'ratios': 'log_ratio', 'imputers': 'none', 'n_estimators': 1100, 'learning_rate': 0.006194814085841709, 'max_depth': 3, 'min_child_weight': 1, 'subsample': 0.5, 'colsample_bytree': 0.6, 'colsample_bylevel': 0.6, 'reg_alpha': 0.42666053132064363, 'reg_lambda': 0.16529810395264735, 'gamma': 1.6111172702828052}. Best is trial 98 with value: -0.3423999251867887.
/bsuhome/alexanderemert/Research/Star-Formation-Research-Project-2026/pipeline/scripts/optuna/final_preds_and_models/optuna_search_mult_quant_reg.py:161: UserWarning: The distribution is specified by [0.1, 5] and step=0.25, but the range is not divisible by `step`. It will be replaced with [0.1, 4.85].
  error_threshold = trial.suggest_float("error_threshold", 0.1, 5, step=0.25)
[I 2026-07-20 14:50:34,366] Trial 102 finished with value: -0.3483462331734242 and parameters: {'error_threshold': 2.85, 'scalers': 'none', 'ratios': 'log_ratio', 'imputers': 'none', 'n_estimators': 1100, 'learning_rate': 0.006066849467478141, 'max_depth': 6, 'min_child_weight': 1, 'subsample': 0.5, 'colsample_bytree': 0.9, 'colsample_bylevel': 0.6, 'reg_alpha': 0.5291545897684916, 'reg_lambda': 2.847935476226945e-06, 'gamma': 0.0013493683095286617}. Best is trial 98 with value: -0.3423999251867887.
/bsuhome/alexanderemert/Research/Star-Formation-Research-Project-2026/pipeline/scripts/optuna/final_preds_and_models/optuna_search_mult_quant_reg.py:161: UserWarning: The distribution is specified by [0.1, 5] and step=0.25, but the range is not divisible by `step`. It will be replaced with [0.1, 4.85].
  error_threshold = trial.suggest_float("error_threshold", 0.1, 5, step=0.25)
[I 2026-07-20 14:50:35,087] Trial 104 finished with value: -0.3567925686588189 and parameters: {'error_threshold': 3.1, 'scalers': 'none', 'ratios': 'log_ratio', 'imputers': 'none', 'n_estimators': 1100, 'learning_rate': 0.00594055478924579, 'max_depth': 3, 'min_child_weight': 1, 'subsample': 0.6, 'colsample_bytree': 0.6, 'colsample_bylevel': 0.5, 'reg_alpha': 0.4315658558888177, 'reg_lambda': 2.713612359739847e-06, 'gamma': 1.026607030943295e-06}. Best is trial 98 with value: -0.3423999251867887.
/bsuhome/alexanderemert/Research/Star-Formation-Research-Project-2026/pipeline/scripts/optuna/final_preds_and_models/optuna_search_mult_quant_reg.py:161: UserWarning: The distribution is specified by [0.1, 5] and step=0.25, but the range is not divisible by `step`. It will be replaced with [0.1, 4.85].
  error_threshold = trial.suggest_float("error_threshold", 0.1, 5, step=0.25)
[I 2026-07-20 14:50:35,763] Trial 105 finished with value: -0.3573997852302848 and parameters: {'error_threshold': 3.1, 'scalers': 'none', 'ratios': 'log_ratio', 'imputers': 'none', 'n_estimators': 1100, 'learning_rate': 0.005939107912437644, 'max_depth': 3, 'min_child_weight': 1, 'subsample': 0.5, 'colsample_bytree': 0.6, 'colsample_bylevel': 0.5, 'reg_alpha': 0.3969841795977304, 'reg_lambda': 0.15405331859243504, 'gamma': 0.010110679326726208}. Best is trial 98 with value: -0.3423999251867887.
/bsuhome/alexanderemert/Research/Star-Formation-Research-Project-2026/pipeline/scripts/optuna/final_preds_and_models/optuna_search_mult_quant_reg.py:161: UserWarning: The distribution is specified by [0.1, 5] and step=0.25, but the range is not divisible by `step`. It will be replaced with [0.1, 4.85].
  error_threshold = trial.suggest_float("error_threshold", 0.1, 5, step=0.25)
[I 2026-07-20 14:50:36,848] Trial 106 finished with value: -0.34323740838407985 and parameters: {'error_threshold': 3.1, 'scalers': 'none', 'ratios': 'log_ratio', 'imputers': 'mean', 'n_estimators': 1400, 'learning_rate': 0.006236548889570965, 'max_depth': 3, 'min_child_weight': 1, 'subsample': 0.6, 'colsample_bytree': 0.9, 'colsample_bylevel': 0.5, 'reg_alpha': 0.42049527055707725, 'reg_lambda': 0.13011863367767645, 'gamma': 0.2925826083974574}. Best is trial 98 with value: -0.3423999251867887.
/bsuhome/alexanderemert/Research/Star-Formation-Research-Project-2026/pipeline/scripts/optuna/final_preds_and_models/optuna_search_mult_quant_reg.py:161: UserWarning: The distribution is specified by [0.1, 5] and step=0.25, but the range is not divisible by `step`. It will be replaced with [0.1, 4.85].
  error_threshold = trial.suggest_float("error_threshold", 0.1, 5, step=0.25)
[I 2026-07-20 14:50:37,914] Trial 107 finished with value: -0.3426741395751706 and parameters: {'error_threshold': 3.1, 'scalers': 'none', 'ratios': 'log_ratio', 'imputers': 'mean', 'n_estimators': 1400, 'learning_rate': 0.01036972997777142, 'max_depth': 3, 'min_child_weight': 1, 'subsample': 0.6, 'colsample_bytree': 0.9, 'colsample_bylevel': 0.5, 'reg_alpha': 0.46752851988882976, 'reg_lambda': 2.2785822362678005e-06, 'gamma': 1.4349170273853757e-06}. Best is trial 98 with value: -0.3423999251867887.
/bsuhome/alexanderemert/Research/Star-Formation-Research-Project-2026/pipeline/scripts/optuna/final_preds_and_models/optuna_search_mult_quant_reg.py:161: UserWarning: The distribution is specified by [0.1, 5] and step=0.25, but the range is not divisible by `step`. It will be replaced with [0.1, 4.85].
  error_threshold = trial.suggest_float("error_threshold", 0.1, 5, step=0.25)
[I 2026-07-20 14:50:38,585] Trial 108 finished with value: -0.34967123201841144 and parameters: {'error_threshold': 3.1, 'scalers': 'none', 'ratios': 'log_ratio', 'imputers': 'none', 'n_estimators': 1400, 'learning_rate': 0.01054201323479158, 'max_depth': 3, 'min_child_weight': 1, 'subsample': 0.6, 'colsample_bytree': 0.9, 'colsample_bylevel': 0.6, 'reg_alpha': 0.4236591291526401, 'reg_lambda': 2.7252404104794897e-06, 'gamma': 1.8787166465309226}. Best is trial 98 with value: -0.3423999251867887.
/bsuhome/alexanderemert/Research/Star-Formation-Research-Project-2026/pipeline/scripts/optuna/final_preds_and_models/optuna_search_mult_quant_reg.py:161: UserWarning: The distribution is specified by [0.1, 5] and step=0.25, but the range is not divisible by `step`. It will be replaced with [0.1, 4.85].
  error_threshold = trial.suggest_float("error_threshold", 0.1, 5, step=0.25)
[I 2026-07-20 14:50:39,692] Trial 109 finished with value: -0.34279512343414015 and parameters: {'error_threshold': 3.1, 'scalers': 'none', 'ratios': 'log_ratio', 'imputers': 'mean', 'n_estimators': 1400, 'learning_rate': 0.009686165072924562, 'max_depth': 3, 'min_child_weight': 1, 'subsample': 0.5, 'colsample_bytree': 0.9, 'colsample_bylevel': 0.6, 'reg_alpha': 0.07543006461580194, 'reg_lambda': 0.15035183365098023, 'gamma': 0.026499030835421173}. Best is trial 98 with value: -0.3423999251867887.
/bsuhome/alexanderemert/Research/Star-Formation-Research-Project-2026/pipeline/scripts/optuna/final_preds_and_models/optuna_search_mult_quant_reg.py:161: UserWarning: The distribution is specified by [0.1, 5] and step=0.25, but the range is not divisible by `step`. It will be replaced with [0.1, 4.85].
  error_threshold = trial.suggest_float("error_threshold", 0.1, 5, step=0.25)
[I 2026-07-20 14:50:40,700] Trial 110 finished with value: -0.34626635665326866 and parameters: {'error_threshold': 3.1, 'scalers': 'none', 'ratios': 'log_ratio', 'imputers': 'mean', 'n_estimators': 1400, 'learning_rate': 0.01935306639569063, 'max_depth': 3, 'min_child_weight': 4, 'subsample': 0.6, 'colsample_bytree': 0.9, 'colsample_bylevel': 0.6, 'reg_alpha': 0.06695546487939075, 'reg_lambda': 2.478878603922626e-06, 'gamma': 0.2806083990431756}. Best is trial 98 with value: -0.3423999251867887.
/bsuhome/alexanderemert/Research/Star-Formation-Research-Project-2026/pipeline/scripts/optuna/final_preds_and_models/optuna_search_mult_quant_reg.py:161: UserWarning: The distribution is specified by [0.1, 5] and step=0.25, but the range is not divisible by `step`. It will be replaced with [0.1, 4.85].
  error_threshold = trial.suggest_float("error_threshold", 0.1, 5, step=0.25)
[I 2026-07-20 14:50:41,678] Trial 111 finished with value: -0.34597542148112476 and parameters: {'error_threshold': 3.1, 'scalers': 'none', 'ratios': 'log_ratio', 'imputers': 'median', 'n_estimators': 1400, 'learning_rate': 0.017754351679823942, 'max_depth': 3, 'min_child_weight': 4, 'subsample': 0.6, 'colsample_bytree': 0.9, 'colsample_bylevel': 0.5, 'reg_alpha': 0.06313614359895751, 'reg_lambda': 2.7941104307526243e-06, 'gamma': 0.024288088359044405}. Best is trial 98 with value: -0.3423999251867887.
/bsuhome/alexanderemert/Research/Star-Formation-Research-Project-2026/pipeline/scripts/optuna/final_preds_and_models/optuna_search_mult_quant_reg.py:161: UserWarning: The distribution is specified by [0.1, 5] and step=0.25, but the range is not divisible by `step`. It will be replaced with [0.1, 4.85].
  error_threshold = trial.suggest_float("error_threshold", 0.1, 5, step=0.25)
[I 2026-07-20 14:50:42,829] Trial 112 finished with value: -0.34474510555136634 and parameters: {'error_threshold': 3.1, 'scalers': 'none', 'ratios': 'log_ratio', 'imputers': 'median', 'n_estimators': 1400, 'learning_rate': 0.010010030073489842, 'max_depth': 3, 'min_child_weight': 4, 'subsample': 0.6, 'colsample_bytree': 0.9, 'colsample_bylevel': 0.6, 'reg_alpha': 3.159963403137255, 'reg_lambda': 0.002535503934387505, 'gamma': 0.024883714754883355}. Best is trial 98 with value: -0.3423999251867887.
/bsuhome/alexanderemert/Research/Star-Formation-Research-Project-2026/pipeline/scripts/optuna/final_preds_and_models/optuna_search_mult_quant_reg.py:161: UserWarning: The distribution is specified by [0.1, 5] and step=0.25, but the range is not divisible by `step`. It will be replaced with [0.1, 4.85].
  error_threshold = trial.suggest_float("error_threshold", 0.1, 5, step=0.25)
[I 2026-07-20 14:50:43,935] Trial 113 finished with value: -0.3429833884106334 and parameters: {'error_threshold': 2.1, 'scalers': 'none', 'ratios': 'log_ratio', 'imputers': 'median', 'n_estimators': 1450, 'learning_rate': 0.01024233313439716, 'max_depth': 3, 'min_child_weight': 4, 'subsample': 0.6, 'colsample_bytree': 0.9, 'colsample_bylevel': 0.6, 'reg_alpha': 0.0004467363264677036, 'reg_lambda': 1.0150158786272677e-06, 'gamma': 0.3245799021821336}. Best is trial 98 with value: -0.3423999251867887.
/bsuhome/alexanderemert/Research/Star-Formation-Research-Project-2026/pipeline/scripts/optuna/final_preds_and_models/optuna_search_mult_quant_reg.py:161: UserWarning: The distribution is specified by [0.1, 5] and step=0.25, but the range is not divisible by `step`. It will be replaced with [0.1, 4.85].
  error_threshold = trial.suggest_float("error_threshold", 0.1, 5, step=0.25)
[I 2026-07-20 14:50:45,014] Trial 114 finished with value: -0.3450248149654529 and parameters: {'error_threshold': 2.1, 'scalers': 'none', 'ratios': 'log_ratio', 'imputers': 'mean', 'n_estimators': 1400, 'learning_rate': 0.009812839515151623, 'max_depth': 3, 'min_child_weight': 2, 'subsample': 0.6, 'colsample_bytree': 0.9, 'colsample_bylevel': 0.5, 'reg_alpha': 3.0318831655332668, 'reg_lambda': 0.06304806818053786, 'gamma': 0.028032468572350998}. Best is trial 98 with value: -0.3423999251867887.
/bsuhome/alexanderemert/Research/Star-Formation-Research-Project-2026/pipeline/scripts/optuna/final_preds_and_models/optuna_search_mult_quant_reg.py:161: UserWarning: The distribution is specified by [0.1, 5] and step=0.25, but the range is not divisible by `step`. It will be replaced with [0.1, 4.85].
  error_threshold = trial.suggest_float("error_threshold", 0.1, 5, step=0.25)
[I 2026-07-20 14:50:46,118] Trial 115 finished with value: -0.7362513767328688 and parameters: {'error_threshold': 3.6, 'scalers': 'none', 'ratios': 'log_ratio', 'imputers': 'mean', 'n_estimators': 1400, 'learning_rate': 0.00013903869245320856, 'max_depth': 3, 'min_child_weight': 2, 'subsample': 0.6, 'colsample_bytree': 0.9, 'colsample_bylevel': 0.5, 'reg_alpha': 0.9151141815528591, 'reg_lambda': 0.7497972503831298, 'gamma': 8.681068541746384e-06}. Best is trial 98 with value: -0.3423999251867887.
/bsuhome/alexanderemert/Research/Star-Formation-Research-Project-2026/pipeline/scripts/optuna/final_preds_and_models/optuna_search_mult_quant_reg.py:161: UserWarning: The distribution is specified by [0.1, 5] and step=0.25, but the range is not divisible by `step`. It will be replaced with [0.1, 4.85].
  error_threshold = trial.suggest_float("error_threshold", 0.1, 5, step=0.25)
[I 2026-07-20 14:50:47,113] Trial 116 finished with value: -0.36713114717441697 and parameters: {'error_threshold': 3.6, 'scalers': 'none', 'ratios': 'log_ratio', 'imputers': 'mean', 'n_estimators': 1300, 'learning_rate': 0.0029271357446031955, 'max_depth': 3, 'min_child_weight': 2, 'subsample': 0.6, 'colsample_bytree': 0.9, 'colsample_bylevel': 0.5, 'reg_alpha': 2.732444801312551, 'reg_lambda': 0.23913984437964417, 'gamma': 4.9083198975517944e-05}. Best is trial 98 with value: -0.3423999251867887.
/bsuhome/alexanderemert/Research/Star-Formation-Research-Project-2026/pipeline/scripts/optuna/final_preds_and_models/optuna_search_mult_quant_reg.py:161: UserWarning: The distribution is specified by [0.1, 5] and step=0.25, but the range is not divisible by `step`. It will be replaced with [0.1, 4.85].
  error_threshold = trial.suggest_float("error_threshold", 0.1, 5, step=0.25)
[I 2026-07-20 14:50:48,047] Trial 117 finished with value: -0.3449380573257714 and parameters: {'error_threshold': 3.6, 'scalers': 'none', 'ratios': 'log_ratio', 'imputers': 'mean', 'n_estimators': 1600, 'learning_rate': 0.018208791303617716, 'max_depth': 3, 'min_child_weight': 2, 'subsample': 0.5, 'colsample_bytree': 0.9, 'colsample_bylevel': 0.5, 'reg_alpha': 0.8456849665965541, 'reg_lambda': 0.24434767608632788, 'gamma': 0.3221792463316171}. Best is trial 98 with value: -0.3423999251867887.
/bsuhome/alexanderemert/Research/Star-Formation-Research-Project-2026/pipeline/scripts/optuna/final_preds_and_models/optuna_search_mult_quant_reg.py:161: UserWarning: The distribution is specified by [0.1, 5] and step=0.25, but the range is not divisible by `step`. It will be replaced with [0.1, 4.85].
  error_threshold = trial.suggest_float("error_threshold", 0.1, 5, step=0.25)
[I 2026-07-20 14:50:49,259] Trial 118 finished with value: -0.34469327862570415 and parameters: {'error_threshold': 3.6, 'scalers': 'none', 'ratios': 'log_ratio', 'imputers': 'mean', 'n_estimators': 1600, 'learning_rate': 0.009844362096464663, 'max_depth': 3, 'min_child_weight': 2, 'subsample': 0.5, 'colsample_bytree': 0.9, 'colsample_bylevel': 0.5, 'reg_alpha': 2.5864062496611306, 'reg_lambda': 0.11157787233152824, 'gamma': 0.02694017448474219}. Best is trial 98 with value: -0.3423999251867887.
/bsuhome/alexanderemert/Research/Star-Formation-Research-Project-2026/pipeline/scripts/optuna/final_preds_and_models/optuna_search_mult_quant_reg.py:161: UserWarning: The distribution is specified by [0.1, 5] and step=0.25, but the range is not divisible by `step`. It will be replaced with [0.1, 4.85].
  error_threshold = trial.suggest_float("error_threshold", 0.1, 5, step=0.25)
[I 2026-07-20 14:50:50,467] Trial 119 finished with value: -0.34557409208955553 and parameters: {'error_threshold': 3.35, 'scalers': 'none', 'ratios': 'log_ratio', 'imputers': 'mean', 'n_estimators': 1600, 'learning_rate': 0.008941628016741577, 'max_depth': 3, 'min_child_weight': 2, 'subsample': 0.5, 'colsample_bytree': 0.9, 'colsample_bylevel': 0.5, 'reg_alpha': 2.8943638520589454, 'reg_lambda': 0.6218028580824908, 'gamma': 2.517322177341998e-05}. Best is trial 98 with value: -0.3423999251867887.
/bsuhome/alexanderemert/Research/Star-Formation-Research-Project-2026/pipeline/scripts/optuna/final_preds_and_models/optuna_search_mult_quant_reg.py:161: UserWarning: The distribution is specified by [0.1, 5] and step=0.25, but the range is not divisible by `step`. It will be replaced with [0.1, 4.85].
  error_threshold = trial.suggest_float("error_threshold", 0.1, 5, step=0.25)
[I 2026-07-20 14:50:51,461] Trial 120 finished with value: -0.3428841848071551 and parameters: {'error_threshold': 3.6, 'scalers': 'none', 'ratios': 'log_ratio', 'imputers': 'mean', 'n_estimators': 1300, 'learning_rate': 0.009502901094356406, 'max_depth': 3, 'min_child_weight': 2, 'subsample': 0.5, 'colsample_bytree': 0.9, 'colsample_bylevel': 0.5, 'reg_alpha': 0.9227476289387258, 'reg_lambda': 0.6736584672164561, 'gamma': 7.726302831200875e-06}. Best is trial 98 with value: -0.3423999251867887.
/bsuhome/alexanderemert/Research/Star-Formation-Research-Project-2026/pipeline/scripts/optuna/final_preds_and_models/optuna_search_mult_quant_reg.py:161: UserWarning: The distribution is specified by [0.1, 5] and step=0.25, but the range is not divisible by `step`. It will be replaced with [0.1, 4.85].
  error_threshold = trial.suggest_float("error_threshold", 0.1, 5, step=0.25)
[I 2026-07-20 14:50:52,716] Trial 121 finished with value: -0.3492169073240059 and parameters: {'error_threshold': 2.1, 'scalers': 'none', 'ratios': 'log_ratio', 'imputers': 'median', 'n_estimators': 1600, 'learning_rate': 0.0028138987647068647, 'max_depth': 3, 'min_child_weight': 2, 'subsample': 0.5, 'colsample_bytree': 0.9, 'colsample_bylevel': 0.6, 'reg_alpha': 0.00044047215247354087, 'reg_lambda': 0.06327869704548722, 'gamma': 1.4314891123974608e-05}. Best is trial 98 with value: -0.3423999251867887.
/bsuhome/alexanderemert/Research/Star-Formation-Research-Project-2026/pipeline/scripts/optuna/final_preds_and_models/optuna_search_mult_quant_reg.py:161: UserWarning: The distribution is specified by [0.1, 5] and step=0.25, but the range is not divisible by `step`. It will be replaced with [0.1, 4.85].
  error_threshold = trial.suggest_float("error_threshold", 0.1, 5, step=0.25)
[I 2026-07-20 14:50:54,042] Trial 122 finished with value: -0.34657408661663974 and parameters: {'error_threshold': 3.6, 'scalers': 'none', 'ratios': 'log_ratio', 'imputers': 'median', 'n_estimators': 1600, 'learning_rate': 0.015041289973174266, 'max_depth': 3, 'min_child_weight': 1, 'subsample': 0.5, 'colsample_bytree': 0.9, 'colsample_bylevel': 0.6, 'reg_alpha': 1.0130984475996025, 'reg_lambda': 0.25182450430632125, 'gamma': 8.393979513355708e-05}. Best is trial 98 with value: -0.3423999251867887.
/bsuhome/alexanderemert/Research/Star-Formation-Research-Project-2026/pipeline/scripts/optuna/final_preds_and_models/optuna_search_mult_quant_reg.py:161: UserWarning: The distribution is specified by [0.1, 5] and step=0.25, but the range is not divisible by `step`. It will be replaced with [0.1, 4.85].
  error_threshold = trial.suggest_float("error_threshold", 0.1, 5, step=0.25)
