[I 2026-07-20 12:18:29,927] A new study created in Journal with name: final_predictive_quantile_study
[I 2026-07-20 12:18:49,548] Trial 1 finished with value: -0.13827966436400105 and parameters: {'error_threshold': 1.5, 'scalers': 'standard', 'ratios': 'log_ratio', 'imputers': 'none', 'n_estimators': 350, 'learning_rate': 0.01617538250997642, 'max_depth': 3, 'min_child_weight': 3, 'subsample': 1.0, 'colsample_bytree': 0.7, 'colsample_bylevel': 0.7, 'reg_alpha': 1.9832818116469534e-05, 'reg_lambda': 0.001170062312541676, 'gamma': 0.8949297818133054}. Best is trial 1 with value: -0.13827966436400105.
[I 2026-07-20 12:19:18,234] Trial 0 finished with value: -0.19303964796271014 and parameters: {'error_threshold': 5.0, 'scalers': 'none', 'ratios': 'norm_ratio', 'imputers': 'none', 'n_estimators': 1650, 'learning_rate': 0.20145998371166773, 'max_depth': 7, 'min_child_weight': 4, 'subsample': 0.7, 'colsample_bytree': 0.7, 'colsample_bylevel': 0.5, 'reg_alpha': 60.74056253842947, 'reg_lambda': 0.00029459493129488243, 'gamma': 0.00025991108153247835}. Best is trial 0 with value: -0.19303964796271014.
[I 2026-07-20 12:19:31,904] Trial 5 finished with value: -0.10944700311504345 and parameters: {'error_threshold': 5.0, 'scalers': 'none', 'ratios': 'norm_ratio', 'imputers': 'mean', 'n_estimators': 1300, 'learning_rate': 0.05571779106666647, 'max_depth': 10, 'min_child_weight': 2, 'subsample': 0.9, 'colsample_bytree': 0.9, 'colsample_bylevel': 0.6, 'reg_alpha': 2.5731376388486516e-06, 'reg_lambda': 16.703983870323178, 'gamma': 0.542504088693169}. Best is trial 0 with value: -0.19303964796271014.
[I 2026-07-20 12:19:45,999] Trial 6 finished with value: -0.13687437506504807 and parameters: {'error_threshold': 4.0, 'scalers': 'robust', 'ratios': 'norm_ratio', 'imputers': 'none', 'n_estimators': 2200, 'learning_rate': 0.001609772152967399, 'max_depth': 4, 'min_child_weight': 10, 'subsample': 0.9, 'colsample_bytree': 0.8, 'colsample_bylevel': 0.5, 'reg_alpha': 0.008228222951530847, 'reg_lambda': 4.807498681189581, 'gamma': 2.0866067534636086e-06}. Best is trial 0 with value: -0.19303964796271014.
[I 2026-07-20 12:19:47,656] Trial 3 finished with value: -0.11463091869281983 and parameters: {'error_threshold': 0.75, 'scalers': 'standard', 'ratios': 'norm_ratio', 'imputers': 'mean', 'n_estimators': 2100, 'learning_rate': 0.02042459941351613, 'max_depth': 7, 'min_child_weight': 2, 'subsample': 0.9, 'colsample_bytree': 1.0, 'colsample_bylevel': 0.7, 'reg_alpha': 0.00015375344276826892, 'reg_lambda': 0.05878740603674838, 'gamma': 0.737827051570597}. Best is trial 0 with value: -0.19303964796271014.
[I 2026-07-20 12:19:49,501] Trial 7 finished with value: -0.18995326643160595 and parameters: {'error_threshold': 2.25, 'scalers': 'standard', 'ratios': 'log_ratio', 'imputers': 'mean', 'n_estimators': 2200, 'learning_rate': 0.0009425100969919976, 'max_depth': 12, 'min_child_weight': 6, 'subsample': 1.0, 'colsample_bytree': 0.6, 'colsample_bylevel': 0.5, 'reg_alpha': 3.952504415010589e-06, 'reg_lambda': 40.66963331874402, 'gamma': 0.3345500211558748}. Best is trial 0 with value: -0.19303964796271014.
[I 2026-07-20 12:19:57,671] Trial 2 finished with value: -0.2553947524208307 and parameters: {'error_threshold': 3.25, 'scalers': 'robust', 'ratios': 'norm_ratio', 'imputers': 'median', 'n_estimators': 2950, 'learning_rate': 0.00033859884763980715, 'max_depth': 10, 'min_child_weight': 7, 'subsample': 0.7, 'colsample_bytree': 0.5, 'colsample_bylevel': 0.9, 'reg_alpha': 3.0422850258830995e-06, 'reg_lambda': 16.522780278869515, 'gamma': 0.1863826354035817}. Best is trial 2 with value: -0.2553947524208307.
[I 2026-07-20 12:20:01,272] Trial 4 finished with value: -0.1654217526540862 and parameters: {'error_threshold': 0.5, 'scalers': 'none', 'ratios': 'norm_ratio', 'imputers': 'mean', 'n_estimators': 950, 'learning_rate': 0.08708807925646454, 'max_depth': 10, 'min_child_weight': 1, 'subsample': 0.9, 'colsample_bytree': 0.7, 'colsample_bylevel': 0.6, 'reg_alpha': 3.4181287282084357e-06, 'reg_lambda': 7.003632059851533, 'gamma': 1.8845367271777963e-06}. Best is trial 2 with value: -0.2553947524208307.
[I 2026-07-20 12:20:14,757] Trial 8 finished with value: -0.09912650091292756 and parameters: {'error_threshold': 1.75, 'scalers': 'none', 'ratios': 'norm_ratio', 'imputers': 'median', 'n_estimators': 1600, 'learning_rate': 0.01789999722256045, 'max_depth': 4, 'min_child_weight': 7, 'subsample': 0.7, 'colsample_bytree': 0.6, 'colsample_bylevel': 1.0, 'reg_alpha': 0.0015153571179843822, 'reg_lambda': 0.012163392619779506, 'gamma': 1.69159135372408e-05}. Best is trial 2 with value: -0.2553947524208307.
[I 2026-07-20 12:20:19,600] Trial 9 finished with value: -0.11388423331674968 and parameters: {'error_threshold': 1.5, 'scalers': 'robust', 'ratios': 'norm_ratio', 'imputers': 'mean', 'n_estimators': 800, 'learning_rate': 0.0077889873031024865, 'max_depth': 4, 'min_child_weight': 2, 'subsample': 0.7, 'colsample_bytree': 0.9, 'colsample_bylevel': 0.7, 'reg_alpha': 0.00037659743704991904, 'reg_lambda': 5.928557731509922e-05, 'gamma': 0.00047844113038858146}. Best is trial 2 with value: -0.2553947524208307.
[I 2026-07-20 12:20:31,437] Trial 10 finished with value: -0.1024419679116374 and parameters: {'error_threshold': 4.0, 'scalers': 'none', 'ratios': 'norm_ratio', 'imputers': 'none', 'n_estimators': 1800, 'learning_rate': 0.007751010006458422, 'max_depth': 3, 'min_child_weight': 7, 'subsample': 0.9, 'colsample_bytree': 0.7, 'colsample_bylevel': 0.5, 'reg_alpha': 1.00190155741942, 'reg_lambda': 0.41603424523824195, 'gamma': 0.002795172734774132}. Best is trial 2 with value: -0.2553947524208307.
[I 2026-07-20 12:21:07,127] Trial 11 finished with value: -0.11652754356022432 and parameters: {'error_threshold': 5.0, 'scalers': 'standard', 'ratios': 'log_ratio', 'imputers': 'none', 'n_estimators': 1450, 'learning_rate': 0.05042085854755979, 'max_depth': 8, 'min_child_weight': 2, 'subsample': 0.8, 'colsample_bytree': 0.9, 'colsample_bylevel': 0.8, 'reg_alpha': 0.003883652577334457, 'reg_lambda': 0.12972695171294032, 'gamma': 3.772219375781331e-05}. Best is trial 2 with value: -0.2553947524208307.
[I 2026-07-20 12:21:08,916] Trial 14 finished with value: -0.10505232690912224 and parameters: {'error_threshold': 1.5, 'scalers': 'robust', 'ratios': 'norm_ratio', 'imputers': 'mean', 'n_estimators': 750, 'learning_rate': 0.039013601439996375, 'max_depth': 7, 'min_child_weight': 6, 'subsample': 0.7, 'colsample_bytree': 0.5, 'colsample_bylevel': 0.6, 'reg_alpha': 10.09776327551927, 'reg_lambda': 5.272144506276061e-06, 'gamma': 7.89015457526455e-06}. Best is trial 2 with value: -0.2553947524208307.
[I 2026-07-20 12:21:15,202] Trial 15 finished with value: -0.15223407624678706 and parameters: {'error_threshold': 0.25, 'scalers': 'standard', 'ratios': 'log_ratio', 'imputers': 'none', 'n_estimators': 1100, 'learning_rate': 0.0025405687853846007, 'max_depth': 4, 'min_child_weight': 10, 'subsample': 0.6, 'colsample_bytree': 0.8, 'colsample_bylevel': 0.8, 'reg_alpha': 0.0002462393434590855, 'reg_lambda': 0.0008297627989440297, 'gamma': 0.014110841935976203}. Best is trial 2 with value: -0.2553947524208307.
[I 2026-07-20 12:21:17,360] Trial 13 finished with value: -0.17857580109965676 and parameters: {'error_threshold': 1.5, 'scalers': 'none', 'ratios': 'log_ratio', 'imputers': 'median', 'n_estimators': 1700, 'learning_rate': 0.0010150755523576406, 'max_depth': 10, 'min_child_weight': 8, 'subsample': 0.9, 'colsample_bytree': 1.0, 'colsample_bylevel': 0.7, 'reg_alpha': 0.07957657473173001, 'reg_lambda': 0.00012859928108809154, 'gamma': 0.7061349708324898}. Best is trial 2 with value: -0.2553947524208307.
[I 2026-07-20 12:21:23,312] Trial 12 finished with value: -0.12139841628222038 and parameters: {'error_threshold': 5.0, 'scalers': 'none', 'ratios': 'log_ratio', 'imputers': 'none', 'n_estimators': 2750, 'learning_rate': 0.10373951636372626, 'max_depth': 10, 'min_child_weight': 2, 'subsample': 0.5, 'colsample_bytree': 1.0, 'colsample_bylevel': 0.6, 'reg_alpha': 7.821134836793443, 'reg_lambda': 5.153948539168701e-05, 'gamma': 1.1244724976280072e-05}. Best is trial 2 with value: -0.2553947524208307.
[I 2026-07-20 12:21:29,275] Trial 16 finished with value: -0.15585655514222888 and parameters: {'error_threshold': 0.75, 'scalers': 'none', 'ratios': 'log_ratio', 'imputers': 'median', 'n_estimators': 2850, 'learning_rate': 0.0018730539024375413, 'max_depth': 6, 'min_child_weight': 6, 'subsample': 0.6, 'colsample_bytree': 0.9, 'colsample_bylevel': 0.7, 'reg_alpha': 1.0404450459290105e-05, 'reg_lambda': 3.046401655571317e-06, 'gamma': 3.930699653018597}. Best is trial 2 with value: -0.2553947524208307.
[I 2026-07-20 12:21:33,580] Trial 17 finished with value: -0.36927262181354203 and parameters: {'error_threshold': 3.25, 'scalers': 'robust', 'ratios': 'log_ratio', 'imputers': 'median', 'n_estimators': 2950, 'learning_rate': 0.0001267755653189383, 'max_depth': 7, 'min_child_weight': 10, 'subsample': 0.5, 'colsample_bytree': 0.5, 'colsample_bylevel': 1.0, 'reg_alpha': 0.18356453879899434, 'reg_lambda': 8.9491656797007e-06, 'gamma': 66.32516301622613}. Best is trial 17 with value: -0.36927262181354203.
[I 2026-07-20 12:21:37,985] Trial 18 finished with value: -0.3910464149520945 and parameters: {'error_threshold': 3.0, 'scalers': 'robust', 'ratios': 'log_ratio', 'imputers': 'median', 'n_estimators': 2900, 'learning_rate': 0.00014234552687287797, 'max_depth': 7, 'min_child_weight': 5, 'subsample': 0.5, 'colsample_bytree': 0.5, 'colsample_bylevel': 1.0, 'reg_alpha': 95.8393393180581, 'reg_lambda': 1.1902845029969433e-06, 'gamma': 90.04744884847686}. Best is trial 18 with value: -0.3910464149520945.
[I 2026-07-20 12:21:50,773] Trial 19 finished with value: -0.2834647050294135 and parameters: {'error_threshold': 3.5, 'scalers': 'robust', 'ratios': 'norm_ratio', 'imputers': 'median', 'n_estimators': 2950, 'learning_rate': 0.4186714722309594, 'max_depth': 7, 'min_child_weight': 5, 'subsample': 0.5, 'colsample_bytree': 0.5, 'colsample_bylevel': 1.0, 'reg_alpha': 32.72460424310787, 'reg_lambda': 1.0848832354967908e-05, 'gamma': 40.458274819205215}. Best is trial 18 with value: -0.3910464149520945.
[I 2026-07-20 12:21:53,460] Trial 20 finished with value: -0.306051121297534 and parameters: {'error_threshold': 3.0, 'scalers': 'robust', 'ratios': 'norm_ratio', 'imputers': 'median', 'n_estimators': 3000, 'learning_rate': 0.3832530976887049, 'max_depth': 9, 'min_child_weight': 4, 'subsample': 0.5, 'colsample_bytree': 0.5, 'colsample_bylevel': 1.0, 'reg_alpha': 89.3665147645884, 'reg_lambda': 1.0738666077056594e-06, 'gamma': 17.425883554866406}. Best is trial 18 with value: -0.3910464149520945.
[I 2026-07-20 12:21:56,298] Trial 21 finished with value: -0.36346397767890193 and parameters: {'error_threshold': 3.25, 'scalers': 'robust', 'ratios': 'norm_ratio', 'imputers': 'median', 'n_estimators': 3000, 'learning_rate': 0.0001094621997610757, 'max_depth': 9, 'min_child_weight': 4, 'subsample': 0.5, 'colsample_bytree': 0.5, 'colsample_bylevel': 1.0, 'reg_alpha': 0.22009199425497006, 'reg_lambda': 1.1527999445592937e-06, 'gamma': 48.89696513686907}. Best is trial 18 with value: -0.3910464149520945.
[I 2026-07-20 12:21:57,714] Trial 22 finished with value: -0.35633208261378013 and parameters: {'error_threshold': 3.25, 'scalers': 'robust', 'ratios': 'norm_ratio', 'imputers': 'median', 'n_estimators': 3000, 'learning_rate': 0.00011775494034284993, 'max_depth': 8, 'min_child_weight': 4, 'subsample': 0.5, 'colsample_bytree': 0.5, 'colsample_bylevel': 1.0, 'reg_alpha': 34.37952533074575, 'reg_lambda': 2.006754533659628e-06, 'gamma': 21.206346874641692}. Best is trial 18 with value: -0.3910464149520945.
[I 2026-07-20 12:22:01,941] Trial 23 finished with value: -0.34962455993528674 and parameters: {'error_threshold': 3.25, 'scalers': 'robust', 'ratios': 'norm_ratio', 'imputers': 'median', 'n_estimators': 3000, 'learning_rate': 0.0001439399787056732, 'max_depth': 8, 'min_child_weight': 4, 'subsample': 0.6, 'colsample_bytree': 0.5, 'colsample_bylevel': 1.0, 'reg_alpha': 0.09575141557762497, 'reg_lambda': 1.8315828576630419e-06, 'gamma': 38.789087449504024}. Best is trial 18 with value: -0.3910464149520945.
[I 2026-07-20 12:22:07,197] Trial 24 finished with value: -0.39109814374671975 and parameters: {'error_threshold': 3.25, 'scalers': 'robust', 'ratios': 'norm_ratio', 'imputers': 'median', 'n_estimators': 2600, 'learning_rate': 0.4850413352510997, 'max_depth': 8, 'min_child_weight': 4, 'subsample': 0.6, 'colsample_bytree': 0.5, 'colsample_bylevel': 1.0, 'reg_alpha': 62.454544387859656, 'reg_lambda': 1.2516762894234184, 'gamma': 91.79299290330458}. Best is trial 24 with value: -0.39109814374671975.
[I 2026-07-20 12:22:11,314] Trial 25 finished with value: -0.35385857703310974 and parameters: {'error_threshold': 3.0, 'scalers': 'robust', 'ratios': 'log_ratio', 'imputers': 'median', 'n_estimators': 3000, 'learning_rate': 0.00011346716565210239, 'max_depth': 12, 'min_child_weight': 9, 'subsample': 0.5, 'colsample_bytree': 0.5, 'colsample_bylevel': 1.0, 'reg_alpha': 0.04492975042824843, 'reg_lambda': 0.006901877070019836, 'gamma': 17.807286845376876}. Best is trial 24 with value: -0.39109814374671975.
[I 2026-07-20 12:22:15,493] Trial 26 finished with value: -0.38488738116099025 and parameters: {'error_threshold': 3.0, 'scalers': 'robust', 'ratios': 'log_ratio', 'imputers': 'median', 'n_estimators': 2600, 'learning_rate': 0.00015536811237221794, 'max_depth': 6, 'min_child_weight': 9, 'subsample': 0.5, 'colsample_bytree': 0.5, 'colsample_bylevel': 1.0, 'reg_alpha': 0.5497947341037189, 'reg_lambda': 1.0218820142962052e-05, 'gamma': 79.67335772100262}. Best is trial 24 with value: -0.39109814374671975.
[I 2026-07-20 12:22:25,235] Trial 27 finished with value: -0.38773299480005696 and parameters: {'error_threshold': 2.5, 'scalers': 'robust', 'ratios': 'log_ratio', 'imputers': 'median', 'n_estimators': 2550, 'learning_rate': 0.00010826947267431442, 'max_depth': 6, 'min_child_weight': 9, 'subsample': 0.5, 'colsample_bytree': 0.6, 'colsample_bylevel': 0.9, 'reg_alpha': 0.5772161898397116, 'reg_lambda': 1.1917961067502313e-06, 'gamma': 82.22189127649813}. Best is trial 24 with value: -0.39109814374671975.
[I 2026-07-20 12:22:31,572] Trial 28 finished with value: -0.37084916030938486 and parameters: {'error_threshold': 2.75, 'scalers': 'robust', 'ratios': 'log_ratio', 'imputers': 'median', 'n_estimators': 2550, 'learning_rate': 0.00010759201695792486, 'max_depth': 8, 'min_child_weight': 4, 'subsample': 0.5, 'colsample_bytree': 0.6, 'colsample_bylevel': 1.0, 'reg_alpha': 0.6476186277855296, 'reg_lambda': 1.1174198298317244e-06, 'gamma': 63.494547897091714}. Best is trial 24 with value: -0.39109814374671975.
[I 2026-07-20 12:22:32,897] Trial 29 finished with value: -0.36135546297552484 and parameters: {'error_threshold': 2.5, 'scalers': 'robust', 'ratios': 'log_ratio', 'imputers': 'median', 'n_estimators': 2500, 'learning_rate': 0.00014697537551678532, 'max_depth': 6, 'min_child_weight': 9, 'subsample': 0.6, 'colsample_bytree': 0.6, 'colsample_bylevel': 0.9, 'reg_alpha': 0.23221691027700683, 'reg_lambda': 1.675423926686163e-05, 'gamma': 64.73288750079386}. Best is trial 24 with value: -0.39109814374671975.
[I 2026-07-20 12:22:38,138] Trial 30 finished with value: -0.38124777975774765 and parameters: {'error_threshold': 2.5, 'scalers': 'robust', 'ratios': 'log_ratio', 'imputers': 'median', 'n_estimators': 2500, 'learning_rate': 0.0001290417294909885, 'max_depth': 6, 'min_child_weight': 9, 'subsample': 0.6, 'colsample_bytree': 0.6, 'colsample_bylevel': 0.9, 'reg_alpha': 0.19920341365358976, 'reg_lambda': 1.145120280874791e-05, 'gamma': 89.98656416550688}. Best is trial 24 with value: -0.39109814374671975.
[I 2026-07-20 12:22:45,003] Trial 31 finished with value: -0.29638732992748956 and parameters: {'error_threshold': 2.5, 'scalers': 'robust', 'ratios': 'log_ratio', 'imputers': 'median', 'n_estimators': 2550, 'learning_rate': 0.0002874449373805082, 'max_depth': 6, 'min_child_weight': 9, 'subsample': 0.6, 'colsample_bytree': 0.6, 'colsample_bylevel': 0.9, 'reg_alpha': 0.4077191855675634, 'reg_lambda': 1.6142133006117576e-05, 'gamma': 7.792047506607617}. Best is trial 24 with value: -0.39109814374671975.
[I 2026-07-20 12:22:53,449] Trial 32 finished with value: -0.27143097763123797 and parameters: {'error_threshold': 2.5, 'scalers': 'robust', 'ratios': 'log_ratio', 'imputers': 'median', 'n_estimators': 2500, 'learning_rate': 0.00038246347287503274, 'max_depth': 6, 'min_child_weight': 8, 'subsample': 0.6, 'colsample_bytree': 0.6, 'colsample_bylevel': 0.9, 'reg_alpha': 1.18853165288064, 'reg_lambda': 2.0903489340436498e-05, 'gamma': 4.8191820873401205}. Best is trial 24 with value: -0.39109814374671975.
[I 2026-07-20 12:23:00,348] Trial 33 finished with value: -0.2852767527165094 and parameters: {'error_threshold': 2.5, 'scalers': 'robust', 'ratios': 'log_ratio', 'imputers': 'median', 'n_estimators': 2500, 'learning_rate': 0.00031302693435129186, 'max_depth': 6, 'min_child_weight': 9, 'subsample': 0.6, 'colsample_bytree': 0.6, 'colsample_bylevel': 0.9, 'reg_alpha': 1.4708462177690755, 'reg_lambda': 1.524362874836649e-05, 'gamma': 4.450642439256074}. Best is trial 24 with value: -0.39109814374671975.
[I 2026-07-20 12:23:10,651] Trial 34 finished with value: -0.2931753118308615 and parameters: {'error_threshold': 2.5, 'scalers': 'robust', 'ratios': 'log_ratio', 'imputers': 'median', 'n_estimators': 2550, 'learning_rate': 0.0002716361749076361, 'max_depth': 6, 'min_child_weight': 5, 'subsample': 0.6, 'colsample_bytree': 0.6, 'colsample_bylevel': 0.9, 'reg_alpha': 1.087897092323667, 'reg_lambda': 1.4302462866629497, 'gamma': 4.417341606405623}. Best is trial 24 with value: -0.39109814374671975.
[I 2026-07-20 12:23:17,598] Trial 35 finished with value: -0.2764054038354094 and parameters: {'error_threshold': 2.0, 'scalers': 'robust', 'ratios': 'log_ratio', 'imputers': 'median', 'n_estimators': 2500, 'learning_rate': 0.0003713188904809187, 'max_depth': 5, 'min_child_weight': 5, 'subsample': 0.6, 'colsample_bytree': 0.6, 'colsample_bylevel': 0.9, 'reg_alpha': 3.0512931477927654, 'reg_lambda': 1.2108387167364625, 'gamma': 4.5513666588955655}. Best is trial 24 with value: -0.39109814374671975.
[I 2026-07-20 12:23:24,522] Trial 36 finished with value: -0.2834033660806743 and parameters: {'error_threshold': 4.25, 'scalers': 'robust', 'ratios': 'log_ratio', 'imputers': 'median', 'n_estimators': 2400, 'learning_rate': 0.00035787732491871904, 'max_depth': 6, 'min_child_weight': 5, 'subsample': 0.6, 'colsample_bytree': 0.6, 'colsample_bylevel': 0.9, 'reg_alpha': 3.5227040994156553, 'reg_lambda': 1.3755336614277869, 'gamma': 4.731687982667444}. Best is trial 24 with value: -0.39109814374671975.
[I 2026-07-20 12:23:25,887] Trial 37 finished with value: -0.2896295616800065 and parameters: {'error_threshold': 4.0, 'scalers': 'robust', 'ratios': 'log_ratio', 'imputers': 'median', 'n_estimators': 2350, 'learning_rate': 0.0003358792572629857, 'max_depth': 5, 'min_child_weight': 5, 'subsample': 0.6, 'colsample_bytree': 0.6, 'colsample_bylevel': 0.9, 'reg_alpha': 4.474000807767154, 'reg_lambda': 1.2437995836510045, 'gamma': 4.47939078235348}. Best is trial 24 with value: -0.39109814374671975.
[I 2026-07-20 12:23:33,545] Trial 38 finished with value: -0.29111340958853876 and parameters: {'error_threshold': 4.0, 'scalers': 'robust', 'ratios': 'log_ratio', 'imputers': 'median', 'n_estimators': 2650, 'learning_rate': 0.0002821139202625509, 'max_depth': 5, 'min_child_weight': 8, 'subsample': 0.6, 'colsample_bytree': 0.6, 'colsample_bylevel': 0.9, 'reg_alpha': 2.9869500301561493, 'reg_lambda': 2.8720148417488267e-05, 'gamma': 4.522250704695553}. Best is trial 24 with value: -0.39109814374671975.
[I 2026-07-20 12:23:40,339] Trial 39 finished with value: -0.2647049874854694 and parameters: {'error_threshold': 4.0, 'scalers': 'robust', 'ratios': 'log_ratio', 'imputers': 'median', 'n_estimators': 2700, 'learning_rate': 0.0003780584680501658, 'max_depth': 5, 'min_child_weight': 8, 'subsample': 0.6, 'colsample_bytree': 0.6, 'colsample_bylevel': 0.9, 'reg_alpha': 2.3895068506484356, 'reg_lambda': 0.0008468695804307204, 'gamma': 3.7425148916446616}. Best is trial 24 with value: -0.39109814374671975.
[I 2026-07-20 12:23:48,703] Trial 40 finished with value: -0.2456606630182588 and parameters: {'error_threshold': 4.0, 'scalers': 'robust', 'ratios': 'log_ratio', 'imputers': 'median', 'n_estimators': 2700, 'learning_rate': 0.0005006594279961354, 'max_depth': 5, 'min_child_weight': 5, 'subsample': 0.5, 'colsample_bytree': 0.6, 'colsample_bylevel': 0.9, 'reg_alpha': 4.167198196121352, 'reg_lambda': 0.00047963187735809037, 'gamma': 2.6109728270733354}. Best is trial 24 with value: -0.39109814374671975.
[I 2026-07-20 12:23:50,670] Trial 41 finished with value: -0.25149408664686473 and parameters: {'error_threshold': 4.0, 'scalers': 'robust', 'ratios': 'log_ratio', 'imputers': 'median', 'n_estimators': 2300, 'learning_rate': 0.0005705465172713257, 'max_depth': 5, 'min_child_weight': 5, 'subsample': 0.5, 'colsample_bytree': 0.5, 'colsample_bylevel': 0.8, 'reg_alpha': 3.094622177389631, 'reg_lambda': 0.00011239064598159008, 'gamma': 1.710987567163743}. Best is trial 24 with value: -0.39109814374671975.
[I 2026-07-20 12:24:08,713] Trial 42 finished with value: -0.25002786360066637 and parameters: {'error_threshold': 3.75, 'scalers': 'robust', 'ratios': 'log_ratio', 'imputers': 'median', 'n_estimators': 2000, 'learning_rate': 0.0004929413768928133, 'max_depth': 5, 'min_child_weight': 3, 'subsample': 0.5, 'colsample_bytree': 0.7, 'colsample_bylevel': 0.8, 'reg_alpha': 5.304895664566753, 'reg_lambda': 0.00043024345147966205, 'gamma': 0.08311178282072101}. Best is trial 24 with value: -0.39109814374671975.
