[I 2026-07-21 09:47:23,266] Trial 121 finished with value: -0.18062913123784144 and parameters: {'error_threshold': 1.35, 'scalers': 'none', 'ratios': 'norm_ratio', 'imputers': 'mean', 'n_estimators': 2650, 'learning_rate': 0.007619688817771364, 'max_depth': 3, 'min_child_weight': 2, 'subsample': 0.7, 'colsample_bytree': 1.0, 'colsample_bylevel': 0.9, 'reg_alpha': 0.07580463582408146, 'reg_lambda': 4.114311316206239e-05, 'gamma': 0.005794481616193293}. Best is trial 116 with value: -0.18054786063136866.
/bsuhome/alexanderemert/Research/Star-Formation-Research-Project-2026/pipeline/scripts/optuna/final_preds_and_models/optuna_search_mult_quant_reg.py:75: UserWarning: The distribution is specified by [0.1, 5] and step=0.25, but the range is not divisible by `step`. It will be replaced with [0.1, 4.85].
  error_threshold = trial.suggest_float("error_threshold", 0.1, 5, step=0.25)
[I 2026-07-21 09:47:43,833] Trial 115 finished with value: -0.24031167154031233 and parameters: {'error_threshold': 1.1, 'scalers': 'none', 'ratios': 'norm_ratio', 'imputers': 'mean', 'n_estimators': 3000, 'learning_rate': 0.02599284442305787, 'max_depth': 11, 'min_child_weight': 2, 'subsample': 0.5, 'colsample_bytree': 1.0, 'colsample_bylevel': 1.0, 'reg_alpha': 0.5216506509898053, 'reg_lambda': 8.094762983788899e-06, 'gamma': 0.04348417642020573}. Best is trial 116 with value: -0.18054786063136866.
/bsuhome/alexanderemert/Research/Star-Formation-Research-Project-2026/pipeline/scripts/optuna/final_preds_and_models/optuna_search_mult_quant_reg.py:75: UserWarning: The distribution is specified by [0.1, 5] and step=0.25, but the range is not divisible by `step`. It will be replaced with [0.1, 4.85].
  error_threshold = trial.suggest_float("error_threshold", 0.1, 5, step=0.25)
[I 2026-07-21 09:47:50,068] Trial 122 finished with value: -0.18006968921626898 and parameters: {'error_threshold': 1.35, 'scalers': 'none', 'ratios': 'norm_ratio', 'imputers': 'mean', 'n_estimators': 2600, 'learning_rate': 0.006575841116612696, 'max_depth': 3, 'min_child_weight': 2, 'subsample': 0.5, 'colsample_bytree': 1.0, 'colsample_bylevel': 1.0, 'reg_alpha': 0.08315046562857041, 'reg_lambda': 3.682069013907638e-05, 'gamma': 0.040895153196196556}. Best is trial 122 with value: -0.18006968921626898.
/bsuhome/alexanderemert/Research/Star-Formation-Research-Project-2026/pipeline/scripts/optuna/final_preds_and_models/optuna_search_mult_quant_reg.py:75: UserWarning: The distribution is specified by [0.1, 5] and step=0.25, but the range is not divisible by `step`. It will be replaced with [0.1, 4.85].
  error_threshold = trial.suggest_float("error_threshold", 0.1, 5, step=0.25)
[I 2026-07-21 09:48:04,041] Trial 123 finished with value: -0.180729860725935 and parameters: {'error_threshold': 1.35, 'scalers': 'none', 'ratios': 'norm_ratio', 'imputers': 'mean', 'n_estimators': 2650, 'learning_rate': 0.007760376101938626, 'max_depth': 3, 'min_child_weight': 2, 'subsample': 0.5, 'colsample_bytree': 1.0, 'colsample_bylevel': 0.9, 'reg_alpha': 0.2039976813458932, 'reg_lambda': 2.053998461593118e-05, 'gamma': 0.01316172103023622}. Best is trial 122 with value: -0.18006968921626898.
/bsuhome/alexanderemert/Research/Star-Formation-Research-Project-2026/pipeline/scripts/optuna/final_preds_and_models/optuna_search_mult_quant_reg.py:75: UserWarning: The distribution is specified by [0.1, 5] and step=0.25, but the range is not divisible by `step`. It will be replaced with [0.1, 4.85].
  error_threshold = trial.suggest_float("error_threshold", 0.1, 5, step=0.25)
[I 2026-07-21 09:48:13,406] Trial 125 finished with value: -0.18095533702942065 and parameters: {'error_threshold': 1.35, 'scalers': 'none', 'ratios': 'norm_ratio', 'imputers': 'mean', 'n_estimators': 1100, 'learning_rate': 0.0073549452348796495, 'max_depth': 3, 'min_child_weight': 2, 'subsample': 0.5, 'colsample_bytree': 1.0, 'colsample_bylevel': 0.9, 'reg_alpha': 0.06998880251473083, 'reg_lambda': 3.874539324476214e-05, 'gamma': 0.005074443688399111}. Best is trial 122 with value: -0.18006968921626898.
/bsuhome/alexanderemert/Research/Star-Formation-Research-Project-2026/pipeline/scripts/optuna/final_preds_and_models/optuna_search_mult_quant_reg.py:75: UserWarning: The distribution is specified by [0.1, 5] and step=0.25, but the range is not divisible by `step`. It will be replaced with [0.1, 4.85].
  error_threshold = trial.suggest_float("error_threshold", 0.1, 5, step=0.25)
[I 2026-07-21 09:48:19,914] Trial 124 finished with value: -0.1802259059795199 and parameters: {'error_threshold': 1.35, 'scalers': 'none', 'ratios': 'norm_ratio', 'imputers': 'mean', 'n_estimators': 2650, 'learning_rate': 0.007371763085420484, 'max_depth': 3, 'min_child_weight': 2, 'subsample': 0.5, 'colsample_bytree': 1.0, 'colsample_bylevel': 0.9, 'reg_alpha': 0.09922889818053478, 'reg_lambda': 3.820866487733311e-05, 'gamma': 0.005018884706482902}. Best is trial 122 with value: -0.18006968921626898.
/bsuhome/alexanderemert/Research/Star-Formation-Research-Project-2026/pipeline/scripts/optuna/final_preds_and_models/optuna_search_mult_quant_reg.py:75: UserWarning: The distribution is specified by [0.1, 5] and step=0.25, but the range is not divisible by `step`. It will be replaced with [0.1, 4.85].
  error_threshold = trial.suggest_float("error_threshold", 0.1, 5, step=0.25)
[I 2026-07-21 09:48:33,182] Trial 126 finished with value: -0.17997165366779197 and parameters: {'error_threshold': 1.85, 'scalers': 'none', 'ratios': 'norm_ratio', 'imputers': 'mean', 'n_estimators': 2650, 'learning_rate': 0.0068714659183682645, 'max_depth': 3, 'min_child_weight': 2, 'subsample': 0.5, 'colsample_bytree': 1.0, 'colsample_bylevel': 0.9, 'reg_alpha': 0.07303722670602594, 'reg_lambda': 4.88737036273678e-05, 'gamma': 0.004779187857884417}. Best is trial 126 with value: -0.17997165366779197.
/bsuhome/alexanderemert/Research/Star-Formation-Research-Project-2026/pipeline/scripts/optuna/final_preds_and_models/optuna_search_mult_quant_reg.py:75: UserWarning: The distribution is specified by [0.1, 5] and step=0.25, but the range is not divisible by `step`. It will be replaced with [0.1, 4.85].
  error_threshold = trial.suggest_float("error_threshold", 0.1, 5, step=0.25)
[I 2026-07-21 09:48:41,527] Trial 127 finished with value: -0.18047722244924247 and parameters: {'error_threshold': 1.35, 'scalers': 'none', 'ratios': 'norm_ratio', 'imputers': 'mean', 'n_estimators': 2550, 'learning_rate': 0.007769032518554674, 'max_depth': 3, 'min_child_weight': 2, 'subsample': 0.5, 'colsample_bytree': 1.0, 'colsample_bylevel': 0.9, 'reg_alpha': 0.10884345548750012, 'reg_lambda': 3.875286453172145e-05, 'gamma': 0.0019516000562105262}. Best is trial 126 with value: -0.17997165366779197.
/bsuhome/alexanderemert/Research/Star-Formation-Research-Project-2026/pipeline/scripts/optuna/final_preds_and_models/optuna_search_mult_quant_reg.py:75: UserWarning: The distribution is specified by [0.1, 5] and step=0.25, but the range is not divisible by `step`. It will be replaced with [0.1, 4.85].
  error_threshold = trial.suggest_float("error_threshold", 0.1, 5, step=0.25)
[I 2026-07-21 09:48:47,780] Trial 128 finished with value: -0.18028309573915713 and parameters: {'error_threshold': 1.35, 'scalers': 'none', 'ratios': 'norm_ratio', 'imputers': 'mean', 'n_estimators': 2650, 'learning_rate': 0.003722447347002093, 'max_depth': 3, 'min_child_weight': 2, 'subsample': 0.5, 'colsample_bytree': 1.0, 'colsample_bylevel': 0.9, 'reg_alpha': 0.07237714246799411, 'reg_lambda': 5.972064488926918e-05, 'gamma': 0.001927551143255012}. Best is trial 126 with value: -0.17997165366779197.
/bsuhome/alexanderemert/Research/Star-Formation-Research-Project-2026/pipeline/scripts/optuna/final_preds_and_models/optuna_search_mult_quant_reg.py:75: UserWarning: The distribution is specified by [0.1, 5] and step=0.25, but the range is not divisible by `step`. It will be replaced with [0.1, 4.85].
  error_threshold = trial.suggest_float("error_threshold", 0.1, 5, step=0.25)
[I 2026-07-21 09:48:54,462] Trial 129 finished with value: -0.1821428553487947 and parameters: {'error_threshold': 1.35, 'scalers': 'none', 'ratios': 'norm_ratio', 'imputers': 'mean', 'n_estimators': 2550, 'learning_rate': 0.017338241596513735, 'max_depth': 3, 'min_child_weight': 2, 'subsample': 0.5, 'colsample_bytree': 1.0, 'colsample_bylevel': 0.9, 'reg_alpha': 0.07199547516121978, 'reg_lambda': 5.8227365800283696e-05, 'gamma': 0.005827928476332923}. Best is trial 126 with value: -0.17997165366779197.
/bsuhome/alexanderemert/Research/Star-Formation-Research-Project-2026/pipeline/scripts/optuna/final_preds_and_models/optuna_search_mult_quant_reg.py:75: UserWarning: The distribution is specified by [0.1, 5] and step=0.25, but the range is not divisible by `step`. It will be replaced with [0.1, 4.85].
  error_threshold = trial.suggest_float("error_threshold", 0.1, 5, step=0.25)
[I 2026-07-21 09:48:59,077] Trial 130 finished with value: -0.18031550885638203 and parameters: {'error_threshold': 1.85, 'scalers': 'none', 'ratios': 'norm_ratio', 'imputers': 'mean', 'n_estimators': 1350, 'learning_rate': 0.007589188105448279, 'max_depth': 3, 'min_child_weight': 2, 'subsample': 0.5, 'colsample_bytree': 1.0, 'colsample_bylevel': 1.0, 'reg_alpha': 0.07970657096193912, 'reg_lambda': 4.760399382948057e-05, 'gamma': 0.013101180633876521}. Best is trial 126 with value: -0.17997165366779197.
/bsuhome/alexanderemert/Research/Star-Formation-Research-Project-2026/pipeline/scripts/optuna/final_preds_and_models/optuna_search_mult_quant_reg.py:75: UserWarning: The distribution is specified by [0.1, 5] and step=0.25, but the range is not divisible by `step`. It will be replaced with [0.1, 4.85].
  error_threshold = trial.suggest_float("error_threshold", 0.1, 5, step=0.25)
[I 2026-07-21 09:49:15,305] Trial 131 finished with value: -0.18028727600008287 and parameters: {'error_threshold': 1.85, 'scalers': 'none', 'ratios': 'norm_ratio', 'imputers': 'mean', 'n_estimators': 2650, 'learning_rate': 0.004066986997552644, 'max_depth': 3, 'min_child_weight': 2, 'subsample': 0.5, 'colsample_bytree': 1.0, 'colsample_bylevel': 1.0, 'reg_alpha': 0.08515892570884089, 'reg_lambda': 4.4097527561889636e-05, 'gamma': 0.00471832481515992}. Best is trial 126 with value: -0.17997165366779197.
/bsuhome/alexanderemert/Research/Star-Formation-Research-Project-2026/pipeline/scripts/optuna/final_preds_and_models/optuna_search_mult_quant_reg.py:75: UserWarning: The distribution is specified by [0.1, 5] and step=0.25, but the range is not divisible by `step`. It will be replaced with [0.1, 4.85].
  error_threshold = trial.suggest_float("error_threshold", 0.1, 5, step=0.25)
[I 2026-07-21 09:49:24,661] Trial 132 finished with value: -0.18075054903236001 and parameters: {'error_threshold': 1.85, 'scalers': 'none', 'ratios': 'norm_ratio', 'imputers': 'mean', 'n_estimators': 2650, 'learning_rate': 0.00339660717789655, 'max_depth': 3, 'min_child_weight': 2, 'subsample': 0.5, 'colsample_bytree': 1.0, 'colsample_bylevel': 1.0, 'reg_alpha': 0.08354118883920574, 'reg_lambda': 6.0748713566681995e-05, 'gamma': 0.004845984474882624}. Best is trial 126 with value: -0.17997165366779197.
/bsuhome/alexanderemert/Research/Star-Formation-Research-Project-2026/pipeline/scripts/optuna/final_preds_and_models/optuna_search_mult_quant_reg.py:75: UserWarning: The distribution is specified by [0.1, 5] and step=0.25, but the range is not divisible by `step`. It will be replaced with [0.1, 4.85].
  error_threshold = trial.suggest_float("error_threshold", 0.1, 5, step=0.25)
[I 2026-07-21 09:49:31,325] Trial 133 finished with value: -0.18046947983246908 and parameters: {'error_threshold': 1.85, 'scalers': 'none', 'ratios': 'norm_ratio', 'imputers': 'mean', 'n_estimators': 2550, 'learning_rate': 0.003746831880162908, 'max_depth': 3, 'min_child_weight': 2, 'subsample': 0.5, 'colsample_bytree': 1.0, 'colsample_bylevel': 0.9, 'reg_alpha': 0.0709261974690784, 'reg_lambda': 4.4686355545333665e-05, 'gamma': 0.0052564435077134845}. Best is trial 126 with value: -0.17997165366779197.
/bsuhome/alexanderemert/Research/Star-Formation-Research-Project-2026/pipeline/scripts/optuna/final_preds_and_models/optuna_search_mult_quant_reg.py:75: UserWarning: The distribution is specified by [0.1, 5] and step=0.25, but the range is not divisible by `step`. It will be replaced with [0.1, 4.85].
  error_threshold = trial.suggest_float("error_threshold", 0.1, 5, step=0.25)
[I 2026-07-21 09:49:42,871] Trial 134 finished with value: -0.18053475760109847 and parameters: {'error_threshold': 2.1, 'scalers': 'none', 'ratios': 'norm_ratio', 'imputers': 'mean', 'n_estimators': 2650, 'learning_rate': 0.0035132417072527415, 'max_depth': 3, 'min_child_weight': 2, 'subsample': 0.5, 'colsample_bytree': 1.0, 'colsample_bylevel': 0.9, 'reg_alpha': 0.07767716902841097, 'reg_lambda': 7.511753672158468e-05, 'gamma': 0.01248898910566503}. Best is trial 126 with value: -0.17997165366779197.
/bsuhome/alexanderemert/Research/Star-Formation-Research-Project-2026/pipeline/scripts/optuna/final_preds_and_models/optuna_search_mult_quant_reg.py:75: UserWarning: The distribution is specified by [0.1, 5] and step=0.25, but the range is not divisible by `step`. It will be replaced with [0.1, 4.85].
  error_threshold = trial.suggest_float("error_threshold", 0.1, 5, step=0.25)
[I 2026-07-21 09:49:49,377] Trial 135 finished with value: -0.18035507112446306 and parameters: {'error_threshold': 1.85, 'scalers': 'none', 'ratios': 'norm_ratio', 'imputers': 'mean', 'n_estimators': 2650, 'learning_rate': 0.003835279693492925, 'max_depth': 3, 'min_child_weight': 2, 'subsample': 0.5, 'colsample_bytree': 1.0, 'colsample_bylevel': 0.9, 'reg_alpha': 0.0901299096155522, 'reg_lambda': 0.0001200306797831458, 'gamma': 0.004722451934152533}. Best is trial 126 with value: -0.17997165366779197.
/bsuhome/alexanderemert/Research/Star-Formation-Research-Project-2026/pipeline/scripts/optuna/final_preds_and_models/optuna_search_mult_quant_reg.py:75: UserWarning: The distribution is specified by [0.1, 5] and step=0.25, but the range is not divisible by `step`. It will be replaced with [0.1, 4.85].
  error_threshold = trial.suggest_float("error_threshold", 0.1, 5, step=0.25)
[I 2026-07-21 09:49:55,612] Trial 136 finished with value: -0.17992694799232442 and parameters: {'error_threshold': 1.85, 'scalers': 'none', 'ratios': 'norm_ratio', 'imputers': 'mean', 'n_estimators': 2550, 'learning_rate': 0.005390515361683157, 'max_depth': 3, 'min_child_weight': 2, 'subsample': 0.5, 'colsample_bytree': 1.0, 'colsample_bylevel': 0.9, 'reg_alpha': 0.08382325268005303, 'reg_lambda': 4.835575037766247e-05, 'gamma': 0.004806418917332504}. Best is trial 136 with value: -0.17992694799232442.
/bsuhome/alexanderemert/Research/Star-Formation-Research-Project-2026/pipeline/scripts/optuna/final_preds_and_models/optuna_search_mult_quant_reg.py:75: UserWarning: The distribution is specified by [0.1, 5] and step=0.25, but the range is not divisible by `step`. It will be replaced with [0.1, 4.85].
  error_threshold = trial.suggest_float("error_threshold", 0.1, 5, step=0.25)
[I 2026-07-21 09:49:58,647] Trial 137 finished with value: -0.18366226183625134 and parameters: {'error_threshold': 1.85, 'scalers': 'none', 'ratios': 'norm_ratio', 'imputers': 'mean', 'n_estimators': 1100, 'learning_rate': 0.004865963730796313, 'max_depth': 3, 'min_child_weight': 2, 'subsample': 0.5, 'colsample_bytree': 1.0, 'colsample_bylevel': 0.9, 'reg_alpha': 0.31419422610799047, 'reg_lambda': 4.231305499092513e-05, 'gamma': 0.0018947829212440117}. Best is trial 136 with value: -0.17992694799232442.
/bsuhome/alexanderemert/Research/Star-Formation-Research-Project-2026/pipeline/scripts/optuna/final_preds_and_models/optuna_search_mult_quant_reg.py:75: UserWarning: The distribution is specified by [0.1, 5] and step=0.25, but the range is not divisible by `step`. It will be replaced with [0.1, 4.85].
  error_threshold = trial.suggest_float("error_threshold", 0.1, 5, step=0.25)
[I 2026-07-21 09:50:00,140] Trial 138 finished with value: -0.18722551930987097 and parameters: {'error_threshold': 1.85, 'scalers': 'none', 'ratios': 'norm_ratio', 'imputers': 'mean', 'n_estimators': 1100, 'learning_rate': 0.0036448787071070095, 'max_depth': 3, 'min_child_weight': 2, 'subsample': 0.5, 'colsample_bytree': 1.0, 'colsample_bylevel': 1.0, 'reg_alpha': 0.3148081102622891, 'reg_lambda': 4.322341327242071e-05, 'gamma': 0.002041007791355688}. Best is trial 136 with value: -0.17992694799232442.
/bsuhome/alexanderemert/Research/Star-Formation-Research-Project-2026/pipeline/scripts/optuna/final_preds_and_models/optuna_search_mult_quant_reg.py:75: UserWarning: The distribution is specified by [0.1, 5] and step=0.25, but the range is not divisible by `step`. It will be replaced with [0.1, 4.85].
  error_threshold = trial.suggest_float("error_threshold", 0.1, 5, step=0.25)
[I 2026-07-21 09:50:17,965] Trial 139 finished with value: -0.18472323094443985 and parameters: {'error_threshold': 2.1, 'scalers': 'none', 'ratios': 'norm_ratio', 'imputers': 'mean', 'n_estimators': 1300, 'learning_rate': 0.0038609572372216, 'max_depth': 3, 'min_child_weight': 2, 'subsample': 0.5, 'colsample_bytree': 1.0, 'colsample_bylevel': 1.0, 'reg_alpha': 0.10951753924964688, 'reg_lambda': 4.258208709499456e-05, 'gamma': 0.0018847278482090183}. Best is trial 136 with value: -0.17992694799232442.
/bsuhome/alexanderemert/Research/Star-Formation-Research-Project-2026/pipeline/scripts/optuna/final_preds_and_models/optuna_search_mult_quant_reg.py:75: UserWarning: The distribution is specified by [0.1, 5] and step=0.25, but the range is not divisible by `step`. It will be replaced with [0.1, 4.85].
  error_threshold = trial.suggest_float("error_threshold", 0.1, 5, step=0.25)
[I 2026-07-21 09:50:31,137] Trial 140 finished with value: -0.1841089522672906 and parameters: {'error_threshold': 1.85, 'scalers': 'none', 'ratios': 'norm_ratio', 'imputers': 'mean', 'n_estimators': 2650, 'learning_rate': 0.001965688737014981, 'max_depth': 3, 'min_child_weight': 2, 'subsample': 0.5, 'colsample_bytree': 1.0, 'colsample_bylevel': 1.0, 'reg_alpha': 0.10097954912877581, 'reg_lambda': 0.00012445167538083828, 'gamma': 0.013411677620575036}. Best is trial 136 with value: -0.17992694799232442.
/bsuhome/alexanderemert/Research/Star-Formation-Research-Project-2026/pipeline/scripts/optuna/final_preds_and_models/optuna_search_mult_quant_reg.py:75: UserWarning: The distribution is specified by [0.1, 5] and step=0.25, but the range is not divisible by `step`. It will be replaced with [0.1, 4.85].
  error_threshold = trial.suggest_float("error_threshold", 0.1, 5, step=0.25)
[I 2026-07-21 09:50:37,946] Trial 141 finished with value: -0.1802904424796347 and parameters: {'error_threshold': 2.1, 'scalers': 'none', 'ratios': 'norm_ratio', 'imputers': 'mean', 'n_estimators': 2550, 'learning_rate': 0.004963053514130748, 'max_depth': 3, 'min_child_weight': 2, 'subsample': 0.5, 'colsample_bytree': 1.0, 'colsample_bylevel': 1.0, 'reg_alpha': 0.10355099052630719, 'reg_lambda': 0.00012525496167236757, 'gamma': 0.013018166562977258}. Best is trial 136 with value: -0.17992694799232442.
/bsuhome/alexanderemert/Research/Star-Formation-Research-Project-2026/pipeline/scripts/optuna/final_preds_and_models/optuna_search_mult_quant_reg.py:75: UserWarning: The distribution is specified by [0.1, 5] and step=0.25, but the range is not divisible by `step`. It will be replaced with [0.1, 4.85].
  error_threshold = trial.suggest_float("error_threshold", 0.1, 5, step=0.25)
[I 2026-07-21 09:50:54,944] Trial 142 finished with value: -0.1805184766583228 and parameters: {'error_threshold': 1.85, 'scalers': 'none', 'ratios': 'norm_ratio', 'imputers': 'mean', 'n_estimators': 2550, 'learning_rate': 0.003766618860145391, 'max_depth': 3, 'min_child_weight': 2, 'subsample': 0.5, 'colsample_bytree': 1.0, 'colsample_bylevel': 0.9, 'reg_alpha': 0.11292373873785405, 'reg_lambda': 0.00011355036006184278, 'gamma': 0.012848387459516128}. Best is trial 136 with value: -0.17992694799232442.
/bsuhome/alexanderemert/Research/Star-Formation-Research-Project-2026/pipeline/scripts/optuna/final_preds_and_models/optuna_search_mult_quant_reg.py:75: UserWarning: The distribution is specified by [0.1, 5] and step=0.25, but the range is not divisible by `step`. It will be replaced with [0.1, 4.85].
  error_threshold = trial.suggest_float("error_threshold", 0.1, 5, step=0.25)
[I 2026-07-21 09:51:01,060] Trial 143 finished with value: -0.18552302533804266 and parameters: {'error_threshold': 2.1, 'scalers': 'none', 'ratios': 'norm_ratio', 'imputers': 'mean', 'n_estimators': 2550, 'learning_rate': 0.0018293972511125981, 'max_depth': 3, 'min_child_weight': 2, 'subsample': 0.5, 'colsample_bytree': 1.0, 'colsample_bylevel': 0.9, 'reg_alpha': 0.10803264753329538, 'reg_lambda': 0.0001093488731293986, 'gamma': 0.013404734940178603}. Best is trial 136 with value: -0.17992694799232442.
/bsuhome/alexanderemert/Research/Star-Formation-Research-Project-2026/pipeline/scripts/optuna/final_preds_and_models/optuna_search_mult_quant_reg.py:75: UserWarning: The distribution is specified by [0.1, 5] and step=0.25, but the range is not divisible by `step`. It will be replaced with [0.1, 4.85].
  error_threshold = trial.suggest_float("error_threshold", 0.1, 5, step=0.25)
