[I 2026-07-20 14:53:53,519] Trial 219 finished with value: -0.3421221392289522 and parameters: {'error_threshold': 1.6, 'scalers': 'none', 'ratios': 'log_ratio', 'imputers': 'median', 'n_estimators': 2150, 'learning_rate': 0.004161653721092164, 'max_depth': 3, 'min_child_weight': 3, 'subsample': 0.5, 'colsample_bytree': 1.0, 'colsample_bylevel': 0.6, 'reg_alpha': 1.202683032028168e-05, 'reg_lambda': 0.9152531376207065, 'gamma': 1.3584386763064355e-05}. Best is trial 178 with value: -0.3417086857439106.
/bsuhome/alexanderemert/Research/Star-Formation-Research-Project-2026/pipeline/scripts/optuna/final_preds_and_models/optuna_search_mult_quant_reg.py:161: UserWarning: The distribution is specified by [0.1, 5] and step=0.25, but the range is not divisible by `step`. It will be replaced with [0.1, 4.85].
  error_threshold = trial.suggest_float("error_threshold", 0.1, 5, step=0.25)
[I 2026-07-20 14:53:55,255] Trial 220 finished with value: -0.34209664834943343 and parameters: {'error_threshold': 1.6, 'scalers': 'none', 'ratios': 'log_ratio', 'imputers': 'median', 'n_estimators': 2150, 'learning_rate': 0.004203697011684584, 'max_depth': 3, 'min_child_weight': 3, 'subsample': 0.5, 'colsample_bytree': 1.0, 'colsample_bylevel': 0.6, 'reg_alpha': 1.1608887115730441e-05, 'reg_lambda': 0.7404466379001666, 'gamma': 6.18515243506876e-06}. Best is trial 178 with value: -0.3417086857439106.
/bsuhome/alexanderemert/Research/Star-Formation-Research-Project-2026/pipeline/scripts/optuna/final_preds_and_models/optuna_search_mult_quant_reg.py:161: UserWarning: The distribution is specified by [0.1, 5] and step=0.25, but the range is not divisible by `step`. It will be replaced with [0.1, 4.85].
  error_threshold = trial.suggest_float("error_threshold", 0.1, 5, step=0.25)
[I 2026-07-20 14:53:57,035] Trial 221 finished with value: -0.342201710466925 and parameters: {'error_threshold': 1.6, 'scalers': 'none', 'ratios': 'log_ratio', 'imputers': 'median', 'n_estimators': 2150, 'learning_rate': 0.004012744379427147, 'max_depth': 3, 'min_child_weight': 4, 'subsample': 0.5, 'colsample_bytree': 1.0, 'colsample_bylevel': 0.6, 'reg_alpha': 9.621822506495721e-06, 'reg_lambda': 1.0284857858007213, 'gamma': 1.3211540017987007e-05}. Best is trial 178 with value: -0.3417086857439106.
/bsuhome/alexanderemert/Research/Star-Formation-Research-Project-2026/pipeline/scripts/optuna/final_preds_and_models/optuna_search_mult_quant_reg.py:161: UserWarning: The distribution is specified by [0.1, 5] and step=0.25, but the range is not divisible by `step`. It will be replaced with [0.1, 4.85].
  error_threshold = trial.suggest_float("error_threshold", 0.1, 5, step=0.25)
[I 2026-07-20 14:53:58,818] Trial 222 finished with value: -0.34204004398425925 and parameters: {'error_threshold': 1.6, 'scalers': 'none', 'ratios': 'log_ratio', 'imputers': 'median', 'n_estimators': 2150, 'learning_rate': 0.0039957893850549025, 'max_depth': 3, 'min_child_weight': 4, 'subsample': 0.5, 'colsample_bytree': 1.0, 'colsample_bylevel': 0.6, 'reg_alpha': 1.0654104119003236e-05, 'reg_lambda': 0.4262861032682944, 'gamma': 6.565910313595049e-06}. Best is trial 178 with value: -0.3417086857439106.
/bsuhome/alexanderemert/Research/Star-Formation-Research-Project-2026/pipeline/scripts/optuna/final_preds_and_models/optuna_search_mult_quant_reg.py:161: UserWarning: The distribution is specified by [0.1, 5] and step=0.25, but the range is not divisible by `step`. It will be replaced with [0.1, 4.85].
  error_threshold = trial.suggest_float("error_threshold", 0.1, 5, step=0.25)
[I 2026-07-20 14:54:00,598] Trial 223 finished with value: -0.34206587360583063 and parameters: {'error_threshold': 1.6, 'scalers': 'none', 'ratios': 'log_ratio', 'imputers': 'median', 'n_estimators': 2150, 'learning_rate': 0.004023775344590932, 'max_depth': 3, 'min_child_weight': 4, 'subsample': 0.5, 'colsample_bytree': 1.0, 'colsample_bylevel': 0.6, 'reg_alpha': 3.0402106539866567e-05, 'reg_lambda': 0.46461571840747773, 'gamma': 6.702140676280705e-06}. Best is trial 178 with value: -0.3417086857439106.
/bsuhome/alexanderemert/Research/Star-Formation-Research-Project-2026/pipeline/scripts/optuna/final_preds_and_models/optuna_search_mult_quant_reg.py:161: UserWarning: The distribution is specified by [0.1, 5] and step=0.25, but the range is not divisible by `step`. It will be replaced with [0.1, 4.85].
  error_threshold = trial.suggest_float("error_threshold", 0.1, 5, step=0.25)
[I 2026-07-20 14:54:02,412] Trial 224 finished with value: -0.34204028171182843 and parameters: {'error_threshold': 1.6, 'scalers': 'none', 'ratios': 'log_ratio', 'imputers': 'median', 'n_estimators': 2150, 'learning_rate': 0.00409740258080823, 'max_depth': 3, 'min_child_weight': 3, 'subsample': 0.5, 'colsample_bytree': 1.0, 'colsample_bylevel': 0.6, 'reg_alpha': 1.0745715620347917e-05, 'reg_lambda': 0.9673134294446397, 'gamma': 6.2020012848143765e-06}. Best is trial 178 with value: -0.3417086857439106.
/bsuhome/alexanderemert/Research/Star-Formation-Research-Project-2026/pipeline/scripts/optuna/final_preds_and_models/optuna_search_mult_quant_reg.py:161: UserWarning: The distribution is specified by [0.1, 5] and step=0.25, but the range is not divisible by `step`. It will be replaced with [0.1, 4.85].
  error_threshold = trial.suggest_float("error_threshold", 0.1, 5, step=0.25)
[I 2026-07-20 14:54:04,210] Trial 225 finished with value: -0.34212566884217105 and parameters: {'error_threshold': 1.6, 'scalers': 'none', 'ratios': 'log_ratio', 'imputers': 'median', 'n_estimators': 2150, 'learning_rate': 0.004288909976865657, 'max_depth': 3, 'min_child_weight': 3, 'subsample': 0.5, 'colsample_bytree': 1.0, 'colsample_bylevel': 0.6, 'reg_alpha': 1.103535352314065e-05, 'reg_lambda': 1.2216891600561488, 'gamma': 1.3517048693552741e-05}. Best is trial 178 with value: -0.3417086857439106.
/bsuhome/alexanderemert/Research/Star-Formation-Research-Project-2026/pipeline/scripts/optuna/final_preds_and_models/optuna_search_mult_quant_reg.py:161: UserWarning: The distribution is specified by [0.1, 5] and step=0.25, but the range is not divisible by `step`. It will be replaced with [0.1, 4.85].
  error_threshold = trial.suggest_float("error_threshold", 0.1, 5, step=0.25)
[I 2026-07-20 14:54:06,009] Trial 226 finished with value: -0.3421385671335711 and parameters: {'error_threshold': 1.6, 'scalers': 'none', 'ratios': 'log_ratio', 'imputers': 'median', 'n_estimators': 2150, 'learning_rate': 0.0039859934997686156, 'max_depth': 3, 'min_child_weight': 3, 'subsample': 0.5, 'colsample_bytree': 1.0, 'colsample_bylevel': 0.6, 'reg_alpha': 1.1538823613037637e-05, 'reg_lambda': 1.0117935557696867, 'gamma': 1.4940633438177868e-05}. Best is trial 178 with value: -0.3417086857439106.
/bsuhome/alexanderemert/Research/Star-Formation-Research-Project-2026/pipeline/scripts/optuna/final_preds_and_models/optuna_search_mult_quant_reg.py:161: UserWarning: The distribution is specified by [0.1, 5] and step=0.25, but the range is not divisible by `step`. It will be replaced with [0.1, 4.85].
  error_threshold = trial.suggest_float("error_threshold", 0.1, 5, step=0.25)
[I 2026-07-20 14:54:07,813] Trial 227 finished with value: -0.34224820394576505 and parameters: {'error_threshold': 1.6, 'scalers': 'none', 'ratios': 'log_ratio', 'imputers': 'median', 'n_estimators': 2150, 'learning_rate': 0.004160437492647851, 'max_depth': 3, 'min_child_weight': 3, 'subsample': 0.5, 'colsample_bytree': 1.0, 'colsample_bylevel': 0.6, 'reg_alpha': 3.0705933480353716e-05, 'reg_lambda': 1.346390973292134, 'gamma': 1.4320246015546285e-05}. Best is trial 178 with value: -0.3417086857439106.
/bsuhome/alexanderemert/Research/Star-Formation-Research-Project-2026/pipeline/scripts/optuna/final_preds_and_models/optuna_search_mult_quant_reg.py:161: UserWarning: The distribution is specified by [0.1, 5] and step=0.25, but the range is not divisible by `step`. It will be replaced with [0.1, 4.85].
  error_threshold = trial.suggest_float("error_threshold", 0.1, 5, step=0.25)
[I 2026-07-20 14:54:09,612] Trial 228 finished with value: -0.34227602068418084 and parameters: {'error_threshold': 1.6, 'scalers': 'none', 'ratios': 'log_ratio', 'imputers': 'median', 'n_estimators': 2150, 'learning_rate': 0.003906499772640494, 'max_depth': 3, 'min_child_weight': 3, 'subsample': 0.5, 'colsample_bytree': 1.0, 'colsample_bylevel': 0.6, 'reg_alpha': 1.1507925828892666e-05, 'reg_lambda': 1.4065576582048187, 'gamma': 1.4188260921835021e-05}. Best is trial 178 with value: -0.3417086857439106.
/bsuhome/alexanderemert/Research/Star-Formation-Research-Project-2026/pipeline/scripts/optuna/final_preds_and_models/optuna_search_mult_quant_reg.py:161: UserWarning: The distribution is specified by [0.1, 5] and step=0.25, but the range is not divisible by `step`. It will be replaced with [0.1, 4.85].
  error_threshold = trial.suggest_float("error_threshold", 0.1, 5, step=0.25)
[I 2026-07-20 14:54:11,414] Trial 229 finished with value: -0.342181954141852 and parameters: {'error_threshold': 1.6, 'scalers': 'none', 'ratios': 'log_ratio', 'imputers': 'median', 'n_estimators': 2150, 'learning_rate': 0.003952221322759005, 'max_depth': 3, 'min_child_weight': 3, 'subsample': 0.5, 'colsample_bytree': 1.0, 'colsample_bylevel': 0.6, 'reg_alpha': 1.2802968896919356e-05, 'reg_lambda': 0.8554412142371027, 'gamma': 1.3520250603250773e-05}. Best is trial 178 with value: -0.3417086857439106.
/bsuhome/alexanderemert/Research/Star-Formation-Research-Project-2026/pipeline/scripts/optuna/final_preds_and_models/optuna_search_mult_quant_reg.py:161: UserWarning: The distribution is specified by [0.1, 5] and step=0.25, but the range is not divisible by `step`. It will be replaced with [0.1, 4.85].
  error_threshold = trial.suggest_float("error_threshold", 0.1, 5, step=0.25)
[I 2026-07-20 14:54:13,217] Trial 230 finished with value: -0.3422343351667025 and parameters: {'error_threshold': 1.6, 'scalers': 'none', 'ratios': 'log_ratio', 'imputers': 'median', 'n_estimators': 2150, 'learning_rate': 0.003989687215675167, 'max_depth': 3, 'min_child_weight': 3, 'subsample': 0.5, 'colsample_bytree': 1.0, 'colsample_bylevel': 0.6, 'reg_alpha': 1.0559256883226047e-05, 'reg_lambda': 1.4411948188999328, 'gamma': 5.917370903182968e-05}. Best is trial 178 with value: -0.3417086857439106.
/bsuhome/alexanderemert/Research/Star-Formation-Research-Project-2026/pipeline/scripts/optuna/final_preds_and_models/optuna_search_mult_quant_reg.py:161: UserWarning: The distribution is specified by [0.1, 5] and step=0.25, but the range is not divisible by `step`. It will be replaced with [0.1, 4.85].
  error_threshold = trial.suggest_float("error_threshold", 0.1, 5, step=0.25)
[I 2026-07-20 14:54:15,014] Trial 231 finished with value: -0.3421761522951518 and parameters: {'error_threshold': 1.6, 'scalers': 'none', 'ratios': 'log_ratio', 'imputers': 'median', 'n_estimators': 2150, 'learning_rate': 0.0040631773449102135, 'max_depth': 3, 'min_child_weight': 3, 'subsample': 0.5, 'colsample_bytree': 1.0, 'colsample_bylevel': 0.6, 'reg_alpha': 1.1129284379162278e-05, 'reg_lambda': 1.365749707248598, 'gamma': 1.3879155861276605e-05}. Best is trial 178 with value: -0.3417086857439106.
/bsuhome/alexanderemert/Research/Star-Formation-Research-Project-2026/pipeline/scripts/optuna/final_preds_and_models/optuna_search_mult_quant_reg.py:161: UserWarning: The distribution is specified by [0.1, 5] and step=0.25, but the range is not divisible by `step`. It will be replaced with [0.1, 4.85].
  error_threshold = trial.suggest_float("error_threshold", 0.1, 5, step=0.25)
[I 2026-07-20 14:54:16,870] Trial 232 finished with value: -0.342081167975897 and parameters: {'error_threshold': 1.6, 'scalers': 'none', 'ratios': 'log_ratio', 'imputers': 'median', 'n_estimators': 2200, 'learning_rate': 0.003822709294894862, 'max_depth': 3, 'min_child_weight': 3, 'subsample': 0.5, 'colsample_bytree': 1.0, 'colsample_bylevel': 0.6, 'reg_alpha': 1.2091452355713842e-05, 'reg_lambda': 1.2999593598584736, 'gamma': 5.8025820431542806e-05}. Best is trial 178 with value: -0.3417086857439106.
[I 2026-07-20 14:54:18,667] Trial 233 finished with value: -0.34223794970235427 and parameters: {'error_threshold': 1.6, 'scalers': 'none', 'ratios': 'log_ratio', 'imputers': 'median', 'n_estimators': 2150, 'learning_rate': 0.004085497820181599, 'max_depth': 3, 'min_child_weight': 3, 'subsample': 0.5, 'colsample_bytree': 1.0, 'colsample_bylevel': 0.6, 'reg_alpha': 1.1775457757547594e-05, 'reg_lambda': 1.3410893874460976, 'gamma': 5.5013941552635666e-05}. Best is trial 178 with value: -0.3417086857439106.
[I 2026-07-20 14:54:20,456] Trial 234 finished with value: -0.34214796142948445 and parameters: {'error_threshold': 1.6, 'scalers': 'none', 'ratios': 'log_ratio', 'imputers': 'median', 'n_estimators': 2150, 'learning_rate': 0.003917325776555347, 'max_depth': 3, 'min_child_weight': 3, 'subsample': 0.5, 'colsample_bytree': 1.0, 'colsample_bylevel': 0.6, 'reg_alpha': 2.703468241771134e-05, 'reg_lambda': 1.1799013264898741, 'gamma': 1.5217537922762312e-05}. Best is trial 178 with value: -0.3417086857439106.
[I 2026-07-20 14:54:22,233] Trial 235 finished with value: -0.3422607982927073 and parameters: {'error_threshold': 1.6, 'scalers': 'none', 'ratios': 'log_ratio', 'imputers': 'median', 'n_estimators': 2150, 'learning_rate': 0.003878369795923737, 'max_depth': 3, 'min_child_weight': 3, 'subsample': 0.5, 'colsample_bytree': 1.0, 'colsample_bylevel': 0.6, 'reg_alpha': 1.1047650372150367e-05, 'reg_lambda': 0.8399161218377862, 'gamma': 2.0828997916492368e-05}. Best is trial 178 with value: -0.3417086857439106.
[I 2026-07-20 14:54:24,086] Trial 236 finished with value: -0.3425630158300386 and parameters: {'error_threshold': 1.85, 'scalers': 'none', 'ratios': 'log_ratio', 'imputers': 'median', 'n_estimators': 2250, 'learning_rate': 0.003941711868814945, 'max_depth': 3, 'min_child_weight': 3, 'subsample': 0.5, 'colsample_bytree': 1.0, 'colsample_bylevel': 0.6, 'reg_alpha': 1.1274997362448967e-05, 'reg_lambda': 3.737834776830519, 'gamma': 2.0667378844251902e-05}. Best is trial 178 with value: -0.3417086857439106.
[I 2026-07-20 14:54:25,889] Trial 237 finished with value: -0.3420594911522934 and parameters: {'error_threshold': 1.85, 'scalers': 'none', 'ratios': 'log_ratio', 'imputers': 'median', 'n_estimators': 2200, 'learning_rate': 0.003811438891624774, 'max_depth': 3, 'min_child_weight': 3, 'subsample': 0.5, 'colsample_bytree': 1.0, 'colsample_bylevel': 0.6, 'reg_alpha': 2.306331710119547e-05, 'reg_lambda': 0.877396118022208, 'gamma': 5.772008496344235e-05}. Best is trial 178 with value: -0.3417086857439106.
[I 2026-07-20 14:54:27,732] Trial 238 finished with value: -0.34205511626478385 and parameters: {'error_threshold': 1.6, 'scalers': 'none', 'ratios': 'log_ratio', 'imputers': 'median', 'n_estimators': 2250, 'learning_rate': 0.0038330865121873584, 'max_depth': 3, 'min_child_weight': 3, 'subsample': 0.5, 'colsample_bytree': 1.0, 'colsample_bylevel': 0.6, 'reg_alpha': 2.553530289338182e-05, 'reg_lambda': 0.7830988262210276, 'gamma': 2.1900117240922236e-05}. Best is trial 178 with value: -0.3417086857439106.
[I 2026-07-20 14:54:29,560] Trial 239 finished with value: -0.34193642427900994 and parameters: {'error_threshold': 1.85, 'scalers': 'none', 'ratios': 'log_ratio', 'imputers': 'median', 'n_estimators': 2250, 'learning_rate': 0.0040268056442608014, 'max_depth': 3, 'min_child_weight': 3, 'subsample': 0.5, 'colsample_bytree': 1.0, 'colsample_bylevel': 0.6, 'reg_alpha': 2.5958190588394463e-05, 'reg_lambda': 0.856769631119814, 'gamma': 2.265617532589964e-05}. Best is trial 178 with value: -0.3417086857439106.
