[I 2026-07-21 13:35:16,962] Trial 144 finished with value: -0.6265755018233764 and parameters: {'error_threshold': 3.1, 'scalers': 'robust', 'ratios': 'log_ratio', 'imputers': 'mean', 'n_estimators': 1000, 'learning_rate': 0.01143050406409429, 'max_depth': 3, 'min_child_weight': 4, 'subsample': 0.6, 'colsample_bytree': 0.7, 'colsample_bylevel': 0.5, 'reg_alpha': 0.006376772221170512, 'reg_lambda': 0.0003792942951518279, 'gamma': 0.00012334609351923091}. Best is trial 68 with value: -0.6263534597333049.
/bsuhome/alexanderemert/Research/Star-Formation-Research-Project-2026/pipeline/scripts/optuna/final_preds_and_models/optuna_search_mult_quant_reg.py:75: UserWarning: The distribution is specified by [0.1, 5] and step=0.25, but the range is not divisible by `step`. It will be replaced with [0.1, 4.85].
  error_threshold = trial.suggest_float("error_threshold", 0.1, 5, step=0.25)
[I 2026-07-21 13:35:18,380] Trial 145 finished with value: -0.6267547466834297 and parameters: {'error_threshold': 2.1, 'scalers': 'robust', 'ratios': 'log_ratio', 'imputers': 'mean', 'n_estimators': 500, 'learning_rate': 0.01143740120995378, 'max_depth': 3, 'min_child_weight': 5, 'subsample': 0.6, 'colsample_bytree': 0.7, 'colsample_bylevel': 0.5, 'reg_alpha': 0.005712747222282072, 'reg_lambda': 0.0005211146296062119, 'gamma': 1.8301775755663893e-05}. Best is trial 68 with value: -0.6263534597333049.
/bsuhome/alexanderemert/Research/Star-Formation-Research-Project-2026/pipeline/scripts/optuna/final_preds_and_models/optuna_search_mult_quant_reg.py:75: UserWarning: The distribution is specified by [0.1, 5] and step=0.25, but the range is not divisible by `step`. It will be replaced with [0.1, 4.85].
  error_threshold = trial.suggest_float("error_threshold", 0.1, 5, step=0.25)
[I 2026-07-21 13:35:23,589] Trial 146 finished with value: -0.6266244053953164 and parameters: {'error_threshold': 2.1, 'scalers': 'robust', 'ratios': 'log_ratio', 'imputers': 'mean', 'n_estimators': 500, 'learning_rate': 0.01159302384194829, 'max_depth': 3, 'min_child_weight': 1, 'subsample': 0.6, 'colsample_bytree': 0.7, 'colsample_bylevel': 0.5, 'reg_alpha': 0.005713539833108932, 'reg_lambda': 0.0006353026019672514, 'gamma': 0.004619390430719869}. Best is trial 68 with value: -0.6263534597333049.
/bsuhome/alexanderemert/Research/Star-Formation-Research-Project-2026/pipeline/scripts/optuna/final_preds_and_models/optuna_search_mult_quant_reg.py:75: UserWarning: The distribution is specified by [0.1, 5] and step=0.25, but the range is not divisible by `step`. It will be replaced with [0.1, 4.85].
  error_threshold = trial.suggest_float("error_threshold", 0.1, 5, step=0.25)
[I 2026-07-21 13:35:28,353] Trial 147 finished with value: -0.6322839917827608 and parameters: {'error_threshold': 3.1, 'scalers': 'robust', 'ratios': 'log_ratio', 'imputers': 'mean', 'n_estimators': 1650, 'learning_rate': 0.011872821984709084, 'max_depth': 3, 'min_child_weight': 1, 'subsample': 0.6, 'colsample_bytree': 0.7, 'colsample_bylevel': 0.5, 'reg_alpha': 0.0016597272352451608, 'reg_lambda': 0.00038453082175723995, 'gamma': 0.00012087023605170856}. Best is trial 68 with value: -0.6263534597333049.
/bsuhome/alexanderemert/Research/Star-Formation-Research-Project-2026/pipeline/scripts/optuna/final_preds_and_models/optuna_search_mult_quant_reg.py:75: UserWarning: The distribution is specified by [0.1, 5] and step=0.25, but the range is not divisible by `step`. It will be replaced with [0.1, 4.85].
  error_threshold = trial.suggest_float("error_threshold", 0.1, 5, step=0.25)
[I 2026-07-21 13:35:29,626] Trial 148 finished with value: -0.6274167069518714 and parameters: {'error_threshold': 3.1, 'scalers': 'robust', 'ratios': 'log_ratio', 'imputers': 'mean', 'n_estimators': 500, 'learning_rate': 0.012421805481494281, 'max_depth': 3, 'min_child_weight': 1, 'subsample': 0.6, 'colsample_bytree': 0.7, 'colsample_bylevel': 0.5, 'reg_alpha': 4.87692492112078e-06, 'reg_lambda': 0.0005707498656935074, 'gamma': 0.004214245535653314}. Best is trial 68 with value: -0.6263534597333049.
/bsuhome/alexanderemert/Research/Star-Formation-Research-Project-2026/pipeline/scripts/optuna/final_preds_and_models/optuna_search_mult_quant_reg.py:75: UserWarning: The distribution is specified by [0.1, 5] and step=0.25, but the range is not divisible by `step`. It will be replaced with [0.1, 4.85].
  error_threshold = trial.suggest_float("error_threshold", 0.1, 5, step=0.25)
[I 2026-07-21 13:35:33,214] Trial 149 finished with value: -0.6275317047736428 and parameters: {'error_threshold': 2.1, 'scalers': 'robust', 'ratios': 'log_ratio', 'imputers': 'mean', 'n_estimators': 500, 'learning_rate': 0.011133199679975664, 'max_depth': 3, 'min_child_weight': 5, 'subsample': 0.6, 'colsample_bytree': 0.7, 'colsample_bylevel': 0.7, 'reg_alpha': 0.00691459035166277, 'reg_lambda': 0.0006253203083097681, 'gamma': 0.00010631317542398308}. Best is trial 68 with value: -0.6263534597333049.
/bsuhome/alexanderemert/Research/Star-Formation-Research-Project-2026/pipeline/scripts/optuna/final_preds_and_models/optuna_search_mult_quant_reg.py:75: UserWarning: The distribution is specified by [0.1, 5] and step=0.25, but the range is not divisible by `step`. It will be replaced with [0.1, 4.85].
  error_threshold = trial.suggest_float("error_threshold", 0.1, 5, step=0.25)
[I 2026-07-21 13:35:38,212] Trial 150 finished with value: -0.6407731311729584 and parameters: {'error_threshold': 2.1, 'scalers': 'robust', 'ratios': 'log_ratio', 'imputers': 'mean', 'n_estimators': 800, 'learning_rate': 0.0030040529451523107, 'max_depth': 3, 'min_child_weight': 5, 'subsample': 0.6, 'colsample_bytree': 0.7, 'colsample_bylevel': 0.5, 'reg_alpha': 0.009433652075163198, 'reg_lambda': 0.0039853128184480086, 'gamma': 0.004287754253577614}. Best is trial 68 with value: -0.6263534597333049.
/bsuhome/alexanderemert/Research/Star-Formation-Research-Project-2026/pipeline/scripts/optuna/final_preds_and_models/optuna_search_mult_quant_reg.py:75: UserWarning: The distribution is specified by [0.1, 5] and step=0.25, but the range is not divisible by `step`. It will be replaced with [0.1, 4.85].
  error_threshold = trial.suggest_float("error_threshold", 0.1, 5, step=0.25)
[I 2026-07-21 13:35:40,644] Trial 151 finished with value: -0.6281622451243191 and parameters: {'error_threshold': 3.1, 'scalers': 'standard', 'ratios': 'log_ratio', 'imputers': 'mean', 'n_estimators': 1600, 'learning_rate': 0.0032271356799817405, 'max_depth': 3, 'min_child_weight': 5, 'subsample': 0.6, 'colsample_bytree': 0.7, 'colsample_bylevel': 0.7, 'reg_alpha': 0.001990411322885328, 'reg_lambda': 0.46572757243786855, 'gamma': 0.00011200608050787504}. Best is trial 68 with value: -0.6263534597333049.
/bsuhome/alexanderemert/Research/Star-Formation-Research-Project-2026/pipeline/scripts/optuna/final_preds_and_models/optuna_search_mult_quant_reg.py:75: UserWarning: The distribution is specified by [0.1, 5] and step=0.25, but the range is not divisible by `step`. It will be replaced with [0.1, 4.85].
  error_threshold = trial.suggest_float("error_threshold", 0.1, 5, step=0.25)
[I 2026-07-21 13:35:45,163] Trial 152 finished with value: -0.6292490558759626 and parameters: {'error_threshold': 3.1, 'scalers': 'standard', 'ratios': 'log_ratio', 'imputers': 'mean', 'n_estimators': 1550, 'learning_rate': 0.00291538073635472, 'max_depth': 3, 'min_child_weight': 5, 'subsample': 0.6, 'colsample_bytree': 0.7, 'colsample_bylevel': 0.7, 'reg_alpha': 0.00958875719288275, 'reg_lambda': 1.9122424917899185e-06, 'gamma': 0.004222943922118486}. Best is trial 68 with value: -0.6263534597333049.
/bsuhome/alexanderemert/Research/Star-Formation-Research-Project-2026/pipeline/scripts/optuna/final_preds_and_models/optuna_search_mult_quant_reg.py:75: UserWarning: The distribution is specified by [0.1, 5] and step=0.25, but the range is not divisible by `step`. It will be replaced with [0.1, 4.85].
  error_threshold = trial.suggest_float("error_threshold", 0.1, 5, step=0.25)
[I 2026-07-21 13:35:46,479] Trial 153 finished with value: -0.6281959229859023 and parameters: {'error_threshold': 3.35, 'scalers': 'standard', 'ratios': 'log_ratio', 'imputers': 'mean', 'n_estimators': 1600, 'learning_rate': 0.0030901884940334676, 'max_depth': 3, 'min_child_weight': 5, 'subsample': 0.6, 'colsample_bytree': 0.7, 'colsample_bylevel': 0.5, 'reg_alpha': 0.001456331689897258, 'reg_lambda': 0.0005425478662611484, 'gamma': 0.00029622694003970896}. Best is trial 68 with value: -0.6263534597333049.
/bsuhome/alexanderemert/Research/Star-Formation-Research-Project-2026/pipeline/scripts/optuna/final_preds_and_models/optuna_search_mult_quant_reg.py:75: UserWarning: The distribution is specified by [0.1, 5] and step=0.25, but the range is not divisible by `step`. It will be replaced with [0.1, 4.85].
  error_threshold = trial.suggest_float("error_threshold", 0.1, 5, step=0.25)
[I 2026-07-21 13:35:51,538] Trial 154 finished with value: -0.6291968306210093 and parameters: {'error_threshold': 3.35, 'scalers': 'standard', 'ratios': 'norm_ratio', 'imputers': 'mean', 'n_estimators': 1650, 'learning_rate': 0.012581147079887129, 'max_depth': 3, 'min_child_weight': 5, 'subsample': 0.6, 'colsample_bytree': 0.7, 'colsample_bylevel': 0.5, 'reg_alpha': 0.0021492800479276496, 'reg_lambda': 1.286565567432705e-05, 'gamma': 0.0039608358472530665}. Best is trial 68 with value: -0.6263534597333049.
/bsuhome/alexanderemert/Research/Star-Formation-Research-Project-2026/pipeline/scripts/optuna/final_preds_and_models/optuna_search_mult_quant_reg.py:75: UserWarning: The distribution is specified by [0.1, 5] and step=0.25, but the range is not divisible by `step`. It will be replaced with [0.1, 4.85].
  error_threshold = trial.suggest_float("error_threshold", 0.1, 5, step=0.25)
[I 2026-07-21 13:35:58,298] Trial 155 finished with value: -0.6302854259975249 and parameters: {'error_threshold': 2.1, 'scalers': 'standard', 'ratios': 'norm_ratio', 'imputers': 'mean', 'n_estimators': 1400, 'learning_rate': 0.0028731788767998334, 'max_depth': 3, 'min_child_weight': 5, 'subsample': 0.6, 'colsample_bytree': 0.7, 'colsample_bylevel': 0.5, 'reg_alpha': 0.015760239550303645, 'reg_lambda': 1.4901069481710912e-05, 'gamma': 0.0003592192400350842}. Best is trial 68 with value: -0.6263534597333049.
/bsuhome/alexanderemert/Research/Star-Formation-Research-Project-2026/pipeline/scripts/optuna/final_preds_and_models/optuna_search_mult_quant_reg.py:75: UserWarning: The distribution is specified by [0.1, 5] and step=0.25, but the range is not divisible by `step`. It will be replaced with [0.1, 4.85].
  error_threshold = trial.suggest_float("error_threshold", 0.1, 5, step=0.25)
[I 2026-07-21 13:36:00,673] Trial 156 finished with value: -0.6368716359162135 and parameters: {'error_threshold': 3.35, 'scalers': 'standard', 'ratios': 'norm_ratio', 'imputers': 'mean', 'n_estimators': 1150, 'learning_rate': 0.0024162483540277717, 'max_depth': 3, 'min_child_weight': 4, 'subsample': 0.6, 'colsample_bytree': 0.7, 'colsample_bylevel': 0.5, 'reg_alpha': 0.009336362971159666, 'reg_lambda': 0.00016203193783378178, 'gamma': 0.004203483895378919}. Best is trial 68 with value: -0.6263534597333049.
/bsuhome/alexanderemert/Research/Star-Formation-Research-Project-2026/pipeline/scripts/optuna/final_preds_and_models/optuna_search_mult_quant_reg.py:75: UserWarning: The distribution is specified by [0.1, 5] and step=0.25, but the range is not divisible by `step`. It will be replaced with [0.1, 4.85].
  error_threshold = trial.suggest_float("error_threshold", 0.1, 5, step=0.25)
[I 2026-07-21 13:36:03,406] Trial 157 finished with value: -0.6284509109993593 and parameters: {'error_threshold': 3.35, 'scalers': 'standard', 'ratios': 'norm_ratio', 'imputers': 'mean', 'n_estimators': 1900, 'learning_rate': 0.002526502921633147, 'max_depth': 3, 'min_child_weight': 5, 'subsample': 0.6, 'colsample_bytree': 0.7, 'colsample_bylevel': 0.5, 'reg_alpha': 0.017022945551347653, 'reg_lambda': 2.2031573941267227e-06, 'gamma': 0.004738927562599502}. Best is trial 68 with value: -0.6263534597333049.
/bsuhome/alexanderemert/Research/Star-Formation-Research-Project-2026/pipeline/scripts/optuna/final_preds_and_models/optuna_search_mult_quant_reg.py:75: UserWarning: The distribution is specified by [0.1, 5] and step=0.25, but the range is not divisible by `step`. It will be replaced with [0.1, 4.85].
  error_threshold = trial.suggest_float("error_threshold", 0.1, 5, step=0.25)
[I 2026-07-21 13:36:09,008] Trial 158 finished with value: -0.6264673174620323 and parameters: {'error_threshold': 2.85, 'scalers': 'standard', 'ratios': 'norm_ratio', 'imputers': 'mean', 'n_estimators': 950, 'learning_rate': 0.0064712760992928975, 'max_depth': 3, 'min_child_weight': 5, 'subsample': 0.6, 'colsample_bytree': 0.7, 'colsample_bylevel': 0.5, 'reg_alpha': 0.017400078116104233, 'reg_lambda': 1.539176875355759e-05, 'gamma': 0.0003226474505669255}. Best is trial 68 with value: -0.6263534597333049.
/bsuhome/alexanderemert/Research/Star-Formation-Research-Project-2026/pipeline/scripts/optuna/final_preds_and_models/optuna_search_mult_quant_reg.py:75: UserWarning: The distribution is specified by [0.1, 5] and step=0.25, but the range is not divisible by `step`. It will be replaced with [0.1, 4.85].
  error_threshold = trial.suggest_float("error_threshold", 0.1, 5, step=0.25)
[I 2026-07-21 13:36:09,418] Trial 159 finished with value: -0.6329694912021031 and parameters: {'error_threshold': 2.85, 'scalers': 'standard', 'ratios': 'log_ratio', 'imputers': 'mean', 'n_estimators': 500, 'learning_rate': 0.00681523680014473, 'max_depth': 3, 'min_child_weight': 4, 'subsample': 0.6, 'colsample_bytree': 0.7, 'colsample_bylevel': 0.5, 'reg_alpha': 0.015097293314731614, 'reg_lambda': 0.0005571771024536676, 'gamma': 0.004873157348987377}. Best is trial 68 with value: -0.6263534597333049.
/bsuhome/alexanderemert/Research/Star-Formation-Research-Project-2026/pipeline/scripts/optuna/final_preds_and_models/optuna_search_mult_quant_reg.py:75: UserWarning: The distribution is specified by [0.1, 5] and step=0.25, but the range is not divisible by `step`. It will be replaced with [0.1, 4.85].
  error_threshold = trial.suggest_float("error_threshold", 0.1, 5, step=0.25)
[I 2026-07-21 13:36:16,566] Trial 160 finished with value: -0.6294100153682329 and parameters: {'error_threshold': 3.35, 'scalers': 'standard', 'ratios': 'norm_ratio', 'imputers': 'mean', 'n_estimators': 1950, 'learning_rate': 0.01206366913327847, 'max_depth': 3, 'min_child_weight': 4, 'subsample': 0.6, 'colsample_bytree': 0.7, 'colsample_bylevel': 0.5, 'reg_alpha': 0.014441115488265077, 'reg_lambda': 1.0947662530954007e-05, 'gamma': 7.299806140979273e-05}. Best is trial 68 with value: -0.6263534597333049.
/bsuhome/alexanderemert/Research/Star-Formation-Research-Project-2026/pipeline/scripts/optuna/final_preds_and_models/optuna_search_mult_quant_reg.py:75: UserWarning: The distribution is specified by [0.1, 5] and step=0.25, but the range is not divisible by `step`. It will be replaced with [0.1, 4.85].
  error_threshold = trial.suggest_float("error_threshold", 0.1, 5, step=0.25)
[I 2026-07-21 13:36:19,784] Trial 161 finished with value: -0.6281915444914447 and parameters: {'error_threshold': 2.85, 'scalers': 'standard', 'ratios': 'norm_ratio', 'imputers': 'mean', 'n_estimators': 2650, 'learning_rate': 0.006805857988342561, 'max_depth': 3, 'min_child_weight': 4, 'subsample': 0.6, 'colsample_bytree': 0.7, 'colsample_bylevel': 0.5, 'reg_alpha': 0.016977551619847916, 'reg_lambda': 0.00043190283520688717, 'gamma': 0.0002550752275497789}. Best is trial 68 with value: -0.6263534597333049.
/bsuhome/alexanderemert/Research/Star-Formation-Research-Project-2026/pipeline/scripts/optuna/final_preds_and_models/optuna_search_mult_quant_reg.py:75: UserWarning: The distribution is specified by [0.1, 5] and step=0.25, but the range is not divisible by `step`. It will be replaced with [0.1, 4.85].
  error_threshold = trial.suggest_float("error_threshold", 0.1, 5, step=0.25)
[I 2026-07-21 13:36:24,012] Trial 162 finished with value: -0.6261434029442071 and parameters: {'error_threshold': 2.85, 'scalers': 'robust', 'ratios': 'log_ratio', 'imputers': 'mean', 'n_estimators': 1400, 'learning_rate': 0.0065686633751589575, 'max_depth': 3, 'min_child_weight': 4, 'subsample': 0.6, 'colsample_bytree': 0.7, 'colsample_bylevel': 0.5, 'reg_alpha': 0.01560959637517922, 'reg_lambda': 0.0001535403030106503, 'gamma': 0.00037120307646869137}. Best is trial 162 with value: -0.6261434029442071.
/bsuhome/alexanderemert/Research/Star-Formation-Research-Project-2026/pipeline/scripts/optuna/final_preds_and_models/optuna_search_mult_quant_reg.py:75: UserWarning: The distribution is specified by [0.1, 5] and step=0.25, but the range is not divisible by `step`. It will be replaced with [0.1, 4.85].
  error_threshold = trial.suggest_float("error_threshold", 0.1, 5, step=0.25)
[I 2026-07-21 13:36:24,727] Trial 163 finished with value: -0.6268120917979615 and parameters: {'error_threshold': 2.6, 'scalers': 'robust', 'ratios': 'log_ratio', 'imputers': 'mean', 'n_estimators': 800, 'learning_rate': 0.00849080589271192, 'max_depth': 3, 'min_child_weight': 4, 'subsample': 0.6, 'colsample_bytree': 0.7, 'colsample_bylevel': 0.5, 'reg_alpha': 0.014550138727308521, 'reg_lambda': 0.0005540246924449537, 'gamma': 0.008320141344139602}. Best is trial 162 with value: -0.6261434029442071.
/bsuhome/alexanderemert/Research/Star-Formation-Research-Project-2026/pipeline/scripts/optuna/final_preds_and_models/optuna_search_mult_quant_reg.py:75: UserWarning: The distribution is specified by [0.1, 5] and step=0.25, but the range is not divisible by `step`. It will be replaced with [0.1, 4.85].
  error_threshold = trial.suggest_float("error_threshold", 0.1, 5, step=0.25)
[I 2026-07-21 13:36:32,161] Trial 164 finished with value: -0.6267085060657113 and parameters: {'error_threshold': 2.6, 'scalers': 'robust', 'ratios': 'log_ratio', 'imputers': 'mean', 'n_estimators': 2150, 'learning_rate': 0.0066136668839198815, 'max_depth': 3, 'min_child_weight': 4, 'subsample': 0.6, 'colsample_bytree': 0.7, 'colsample_bylevel': 0.5, 'reg_alpha': 0.017858444568551703, 'reg_lambda': 0.0005876980909871883, 'gamma': 0.009739193865538875}. Best is trial 162 with value: -0.6261434029442071.
/bsuhome/alexanderemert/Research/Star-Formation-Research-Project-2026/pipeline/scripts/optuna/final_preds_and_models/optuna_search_mult_quant_reg.py:75: UserWarning: The distribution is specified by [0.1, 5] and step=0.25, but the range is not divisible by `step`. It will be replaced with [0.1, 4.85].
  error_threshold = trial.suggest_float("error_threshold", 0.1, 5, step=0.25)
[I 2026-07-21 13:36:36,434] Trial 165 finished with value: -0.626868854236034 and parameters: {'error_threshold': 2.6, 'scalers': 'robust', 'ratios': 'log_ratio', 'imputers': 'mean', 'n_estimators': 2000, 'learning_rate': 0.006649565691125831, 'max_depth': 3, 'min_child_weight': 4, 'subsample': 0.6, 'colsample_bytree': 0.7, 'colsample_bylevel': 0.5, 'reg_alpha': 0.011831933246403952, 'reg_lambda': 0.0003416115893685201, 'gamma': 0.010244612845775446}. Best is trial 162 with value: -0.6261434029442071.
/bsuhome/alexanderemert/Research/Star-Formation-Research-Project-2026/pipeline/scripts/optuna/final_preds_and_models/optuna_search_mult_quant_reg.py:75: UserWarning: The distribution is specified by [0.1, 5] and step=0.25, but the range is not divisible by `step`. It will be replaced with [0.1, 4.85].
  error_threshold = trial.suggest_float("error_threshold", 0.1, 5, step=0.25)
[I 2026-07-21 13:36:38,305] Trial 166 finished with value: -0.6281612837816366 and parameters: {'error_threshold': 2.85, 'scalers': 'standard', 'ratios': 'norm_ratio', 'imputers': 'mean', 'n_estimators': 950, 'learning_rate': 0.006445415787740328, 'max_depth': 4, 'min_child_weight': 6, 'subsample': 0.6, 'colsample_bytree': 0.7, 'colsample_bylevel': 0.5, 'reg_alpha': 0.020254502197631603, 'reg_lambda': 6.105196652403825e-05, 'gamma': 0.008720954285473209}. Best is trial 162 with value: -0.6261434029442071.
/bsuhome/alexanderemert/Research/Star-Formation-Research-Project-2026/pipeline/scripts/optuna/final_preds_and_models/optuna_search_mult_quant_reg.py:75: UserWarning: The distribution is specified by [0.1, 5] and step=0.25, but the range is not divisible by `step`. It will be replaced with [0.1, 4.85].
  error_threshold = trial.suggest_float("error_threshold", 0.1, 5, step=0.25)
[I 2026-07-21 13:36:40,152] Trial 167 finished with value: -0.6280472257960998 and parameters: {'error_threshold': 2.6, 'scalers': 'standard', 'ratios': 'norm_ratio', 'imputers': 'mean', 'n_estimators': 950, 'learning_rate': 0.006830305452879579, 'max_depth': 4, 'min_child_weight': 6, 'subsample': 0.6, 'colsample_bytree': 0.7, 'colsample_bylevel': 0.5, 'reg_alpha': 0.0060681119535439376, 'reg_lambda': 0.00032231415209662027, 'gamma': 0.00024824829959887166}. Best is trial 162 with value: -0.6261434029442071.
/bsuhome/alexanderemert/Research/Star-Formation-Research-Project-2026/pipeline/scripts/optuna/final_preds_and_models/optuna_search_mult_quant_reg.py:75: UserWarning: The distribution is specified by [0.1, 5] and step=0.25, but the range is not divisible by `step`. It will be replaced with [0.1, 4.85].
  error_threshold = trial.suggest_float("error_threshold", 0.1, 5, step=0.25)
