[I 2026-07-20 13:44:25,270] Trial 492 finished with value: -0.3110188123221069 and parameters: {'error_threshold': 4.75, 'scalers': 'robust', 'ratios': 'norm_ratio', 'imputers': 'mean', 'n_estimators': 850, 'learning_rate': 0.07300380179510478, 'max_depth': 5, 'min_child_weight': 3, 'subsample': 0.5, 'colsample_bytree': 0.6, 'colsample_bylevel': 1.0, 'reg_alpha': 54.66815271535968, 'reg_lambda': 5.9420082974436414e-05, 'gamma': 42.54003935558408}. Best is trial 468 with value: -0.33460998995432994.
[I 2026-07-20 13:44:26,123] Trial 493 finished with value: -0.3180353622488538 and parameters: {'error_threshold': 4.75, 'scalers': 'robust', 'ratios': 'norm_ratio', 'imputers': 'mean', 'n_estimators': 850, 'learning_rate': 0.07247808744677185, 'max_depth': 5, 'min_child_weight': 4, 'subsample': 0.5, 'colsample_bytree': 0.6, 'colsample_bylevel': 1.0, 'reg_alpha': 65.71492964201157, 'reg_lambda': 6.474283643169876e-05, 'gamma': 43.82966798995252}. Best is trial 468 with value: -0.33460998995432994.
[I 2026-07-20 13:44:26,588] Trial 494 finished with value: -0.3198685852015516 and parameters: {'error_threshold': 4.75, 'scalers': 'robust', 'ratios': 'norm_ratio', 'imputers': 'mean', 'n_estimators': 850, 'learning_rate': 0.07295877320800738, 'max_depth': 5, 'min_child_weight': 2, 'subsample': 0.5, 'colsample_bytree': 0.6, 'colsample_bylevel': 0.8, 'reg_alpha': 66.30447983839149, 'reg_lambda': 4.3674977486128026e-05, 'gamma': 43.97467317340216}. Best is trial 468 with value: -0.33460998995432994.
[I 2026-07-20 13:44:27,044] Trial 495 finished with value: -0.3196238049345936 and parameters: {'error_threshold': 4.75, 'scalers': 'robust', 'ratios': 'norm_ratio', 'imputers': 'mean', 'n_estimators': 850, 'learning_rate': 0.07467720952058181, 'max_depth': 5, 'min_child_weight': 4, 'subsample': 0.5, 'colsample_bytree': 0.6, 'colsample_bylevel': 1.0, 'reg_alpha': 70.44434171603265, 'reg_lambda': 0.0001245683230003392, 'gamma': 42.158213598789864}. Best is trial 468 with value: -0.33460998995432994.
[I 2026-07-20 13:44:32,789] Trial 496 finished with value: -0.321886738979701 and parameters: {'error_threshold': 4.75, 'scalers': 'robust', 'ratios': 'norm_ratio', 'imputers': 'mean', 'n_estimators': 850, 'learning_rate': 0.09243261289359918, 'max_depth': 5, 'min_child_weight': 4, 'subsample': 0.5, 'colsample_bytree': 0.6, 'colsample_bylevel': 1.0, 'reg_alpha': 70.18073531458823, 'reg_lambda': 37.14460333123407, 'gamma': 43.61169841064302}. Best is trial 468 with value: -0.33460998995432994.
[I 2026-07-20 13:44:34,635] Trial 497 finished with value: -0.3246800237754946 and parameters: {'error_threshold': 4.75, 'scalers': 'robust', 'ratios': 'norm_ratio', 'imputers': 'mean', 'n_estimators': 850, 'learning_rate': 0.029443620652223813, 'max_depth': 5, 'min_child_weight': 4, 'subsample': 0.5, 'colsample_bytree': 0.6, 'colsample_bylevel': 0.8, 'reg_alpha': 72.48567123982522, 'reg_lambda': 49.619614682187056, 'gamma': 41.74506496067617}. Best is trial 468 with value: -0.33460998995432994.
[I 2026-07-20 13:44:35,089] Trial 498 finished with value: -0.33456479263193284 and parameters: {'error_threshold': 4.75, 'scalers': 'robust', 'ratios': 'norm_ratio', 'imputers': 'mean', 'n_estimators': 850, 'learning_rate': 0.08782220066218938, 'max_depth': 5, 'min_child_weight': 3, 'subsample': 0.5, 'colsample_bytree': 0.6, 'colsample_bylevel': 0.8, 'reg_alpha': 99.86855302215906, 'reg_lambda': 39.968446739915215, 'gamma': 43.334876881816506}. Best is trial 468 with value: -0.33460998995432994.
[I 2026-07-20 13:44:35,506] Trial 499 finished with value: -0.32432654440466624 and parameters: {'error_threshold': 4.75, 'scalers': 'robust', 'ratios': 'norm_ratio', 'imputers': 'mean', 'n_estimators': 850, 'learning_rate': 0.0935171625028072, 'max_depth': 5, 'min_child_weight': 3, 'subsample': 0.5, 'colsample_bytree': 0.6, 'colsample_bylevel': 0.8, 'reg_alpha': 74.86014865922266, 'reg_lambda': 35.97459057418157, 'gamma': 43.33813868741647}. Best is trial 468 with value: -0.33460998995432994.
[I 2026-07-20 13:44:35,916] Trial 500 finished with value: -0.32276214849224555 and parameters: {'error_threshold': 4.75, 'scalers': 'robust', 'ratios': 'norm_ratio', 'imputers': 'mean', 'n_estimators': 850, 'learning_rate': 0.08482923523518768, 'max_depth': 5, 'min_child_weight': 6, 'subsample': 0.5, 'colsample_bytree': 0.6, 'colsample_bylevel': 0.8, 'reg_alpha': 72.19599475713336, 'reg_lambda': 0.00012559764533471435, 'gamma': 45.152422453303785}. Best is trial 468 with value: -0.33460998995432994.
[I 2026-07-20 13:44:36,856] Trial 501 finished with value: -0.323648283546554 and parameters: {'error_threshold': 4.75, 'scalers': 'robust', 'ratios': 'norm_ratio', 'imputers': 'mean', 'n_estimators': 950, 'learning_rate': 0.08762262256017665, 'max_depth': 5, 'min_child_weight': 5, 'subsample': 0.5, 'colsample_bytree': 0.6, 'colsample_bylevel': 0.8, 'reg_alpha': 99.39611522061648, 'reg_lambda': 34.5547472625941, 'gamma': 27.85223497679525}. Best is trial 468 with value: -0.33460998995432994.
[I 2026-07-20 13:44:37,318] Trial 502 finished with value: -0.3076782385838306 and parameters: {'error_threshold': 4.75, 'scalers': 'robust', 'ratios': 'norm_ratio', 'imputers': 'mean', 'n_estimators': 950, 'learning_rate': 0.0891772330436629, 'max_depth': 5, 'min_child_weight': 2, 'subsample': 0.5, 'colsample_bytree': 0.6, 'colsample_bylevel': 0.8, 'reg_alpha': 71.90450281085225, 'reg_lambda': 34.669565639311934, 'gamma': 28.257978811232753}. Best is trial 468 with value: -0.33460998995432994.
[I 2026-07-20 13:44:37,788] Trial 503 finished with value: -0.3081944178315322 and parameters: {'error_threshold': 4.25, 'scalers': 'robust', 'ratios': 'norm_ratio', 'imputers': 'mean', 'n_estimators': 950, 'learning_rate': 0.10722019425711285, 'max_depth': 5, 'min_child_weight': 2, 'subsample': 0.5, 'colsample_bytree': 0.6, 'colsample_bylevel': 0.5, 'reg_alpha': 73.91308953564696, 'reg_lambda': 36.52765451805676, 'gamma': 25.68096793087827}. Best is trial 468 with value: -0.33460998995432994.
[I 2026-07-20 13:44:43,871] Trial 504 finished with value: -0.32069284873588805 and parameters: {'error_threshold': 4.25, 'scalers': 'robust', 'ratios': 'norm_ratio', 'imputers': 'mean', 'n_estimators': 950, 'learning_rate': 0.12754323004481607, 'max_depth': 5, 'min_child_weight': 5, 'subsample': 0.5, 'colsample_bytree': 0.6, 'colsample_bylevel': 0.5, 'reg_alpha': 99.46092278890197, 'reg_lambda': 36.38526684527033, 'gamma': 26.98611163769944}. Best is trial 468 with value: -0.33460998995432994.
[I 2026-07-20 13:44:45,764] Trial 505 finished with value: -0.3204567606146271 and parameters: {'error_threshold': 4.25, 'scalers': 'robust', 'ratios': 'norm_ratio', 'imputers': 'mean', 'n_estimators': 950, 'learning_rate': 0.13161420984649452, 'max_depth': 5, 'min_child_weight': 6, 'subsample': 0.5, 'colsample_bytree': 0.6, 'colsample_bylevel': 0.8, 'reg_alpha': 99.2542099870325, 'reg_lambda': 0.00019814337996689358, 'gamma': 27.24341460429806}. Best is trial 468 with value: -0.33460998995432994.
[I 2026-07-20 13:44:46,262] Trial 506 finished with value: -0.24800407496433982 and parameters: {'error_threshold': 4.75, 'scalers': 'robust', 'ratios': 'norm_ratio', 'imputers': 'mean', 'n_estimators': 950, 'learning_rate': 0.13260630421846809, 'max_depth': 5, 'min_child_weight': 3, 'subsample': 0.5, 'colsample_bytree': 0.6, 'colsample_bylevel': 0.7, 'reg_alpha': 2.916237333116596e-06, 'reg_lambda': 0.0002096859437009949, 'gamma': 26.478329470838197}. Best is trial 468 with value: -0.33460998995432994.
[I 2026-07-20 13:44:46,711] Trial 507 finished with value: -0.32178134938030134 and parameters: {'error_threshold': 4.75, 'scalers': 'robust', 'ratios': 'norm_ratio', 'imputers': 'mean', 'n_estimators': 950, 'learning_rate': 0.05408402751725649, 'max_depth': 5, 'min_child_weight': 3, 'subsample': 0.5, 'colsample_bytree': 0.6, 'colsample_bylevel': 0.7, 'reg_alpha': 98.17202483865799, 'reg_lambda': 0.0001839872095126011, 'gamma': 26.534195370787977}. Best is trial 468 with value: -0.33460998995432994.
[I 2026-07-20 13:44:47,169] Trial 508 finished with value: -0.29081844905831816 and parameters: {'error_threshold': 4.75, 'scalers': 'robust', 'ratios': 'norm_ratio', 'imputers': 'mean', 'n_estimators': 950, 'learning_rate': 0.128663318309395, 'max_depth': 5, 'min_child_weight': 3, 'subsample': 0.5, 'colsample_bytree': 0.6, 'colsample_bylevel': 0.7, 'reg_alpha': 44.5926059020507, 'reg_lambda': 0.0001859268103604006, 'gamma': 27.4758774623458}. Best is trial 468 with value: -0.33460998995432994.
[I 2026-07-20 13:44:48,139] Trial 509 finished with value: -0.28817441317433395 and parameters: {'error_threshold': 4.75, 'scalers': 'robust', 'ratios': 'norm_ratio', 'imputers': 'mean', 'n_estimators': 950, 'learning_rate': 0.1221481189761449, 'max_depth': 5, 'min_child_weight': 3, 'subsample': 0.5, 'colsample_bytree': 0.6, 'colsample_bylevel': 0.7, 'reg_alpha': 42.43073415446702, 'reg_lambda': 0.0001949514306017208, 'gamma': 25.19090775180513}. Best is trial 468 with value: -0.33460998995432994.
[I 2026-07-20 13:44:48,571] Trial 510 finished with value: -0.3208878072924487 and parameters: {'error_threshold': 3.5, 'scalers': 'robust', 'ratios': 'norm_ratio', 'imputers': 'mean', 'n_estimators': 950, 'learning_rate': 0.11551685570301312, 'max_depth': 5, 'min_child_weight': 3, 'subsample': 0.5, 'colsample_bytree': 0.6, 'colsample_bylevel': 0.5, 'reg_alpha': 99.69772433621516, 'reg_lambda': 0.00019682707222351117, 'gamma': 25.04015191038732}. Best is trial 468 with value: -0.33460998995432994.
[I 2026-07-20 13:44:49,066] Trial 511 finished with value: -0.3207675862795181 and parameters: {'error_threshold': 4.75, 'scalers': 'robust', 'ratios': 'norm_ratio', 'imputers': 'mean', 'n_estimators': 950, 'learning_rate': 0.1338037189454095, 'max_depth': 5, 'min_child_weight': 3, 'subsample': 0.5, 'colsample_bytree': 0.6, 'colsample_bylevel': 0.7, 'reg_alpha': 99.6667671478153, 'reg_lambda': 59.19792548094655, 'gamma': 23.350534581760588}. Best is trial 468 with value: -0.33460998995432994.
[I 2026-07-20 13:44:55,986] Trial 512 finished with value: -0.2914195157766814 and parameters: {'error_threshold': 4.75, 'scalers': 'robust', 'ratios': 'norm_ratio', 'imputers': 'mean', 'n_estimators': 1000, 'learning_rate': 0.054038658553815955, 'max_depth': 5, 'min_child_weight': 3, 'subsample': 0.5, 'colsample_bytree': 0.6, 'colsample_bylevel': 0.7, 'reg_alpha': 47.73497851919916, 'reg_lambda': 0.7221427072486015, 'gamma': 23.11368486173943}. Best is trial 468 with value: -0.33460998995432994.
[I 2026-07-20 13:44:58,223] Trial 513 finished with value: -0.3144343949414983 and parameters: {'error_threshold': 3.5, 'scalers': 'robust', 'ratios': 'norm_ratio', 'imputers': 'mean', 'n_estimators': 1050, 'learning_rate': 0.05420218924805812, 'max_depth': 4, 'min_child_weight': 3, 'subsample': 0.5, 'colsample_bytree': 0.6, 'colsample_bylevel': 1.0, 'reg_alpha': 43.62629482208267, 'reg_lambda': 60.36547292764895, 'gamma': 50.43501253538554}. Best is trial 468 with value: -0.33460998995432994.
[I 2026-07-20 13:44:58,791] Trial 514 finished with value: -0.28808437844111284 and parameters: {'error_threshold': 3.5, 'scalers': 'robust', 'ratios': 'norm_ratio', 'imputers': 'mean', 'n_estimators': 1100, 'learning_rate': 0.05742837754742308, 'max_depth': 4, 'min_child_weight': 3, 'subsample': 0.5, 'colsample_bytree': 0.6, 'colsample_bylevel': 0.7, 'reg_alpha': 0.007093518248719196, 'reg_lambda': 60.37494271609718, 'gamma': 46.99298093578883}. Best is trial 468 with value: -0.33460998995432994.
[I 2026-07-20 13:44:59,292] Trial 515 finished with value: -0.3187178049765606 and parameters: {'error_threshold': 4.75, 'scalers': 'robust', 'ratios': 'norm_ratio', 'imputers': 'mean', 'n_estimators': 1050, 'learning_rate': 0.057281787300209545, 'max_depth': 4, 'min_child_weight': 3, 'subsample': 0.5, 'colsample_bytree': 0.6, 'colsample_bylevel': 0.7, 'reg_alpha': 47.2450539441165, 'reg_lambda': 56.59354849409769, 'gamma': 53.27245844024745}. Best is trial 468 with value: -0.33460998995432994.
[I 2026-07-20 13:44:59,818] Trial 516 finished with value: -0.3190990958226507 and parameters: {'error_threshold': 4.75, 'scalers': 'robust', 'ratios': 'norm_ratio', 'imputers': 'mean', 'n_estimators': 1050, 'learning_rate': 0.055900421007840366, 'max_depth': 4, 'min_child_weight': 3, 'subsample': 0.5, 'colsample_bytree': 0.6, 'colsample_bylevel': 0.8, 'reg_alpha': 46.55281123895556, 'reg_lambda': 57.4559395967325, 'gamma': 54.00246166316055}. Best is trial 468 with value: -0.33460998995432994.
[I 2026-07-20 13:45:00,935] Trial 517 finished with value: -0.3144820389771333 and parameters: {'error_threshold': 4.75, 'scalers': 'robust', 'ratios': 'norm_ratio', 'imputers': 'mean', 'n_estimators': 1050, 'learning_rate': 0.1796053090046831, 'max_depth': 4, 'min_child_weight': 3, 'subsample': 0.5, 'colsample_bytree': 0.6, 'colsample_bylevel': 0.8, 'reg_alpha': 48.13545462028437, 'reg_lambda': 57.3957002502923, 'gamma': 51.40787386783073}. Best is trial 468 with value: -0.33460998995432994.
[I 2026-07-20 13:45:01,477] Trial 518 finished with value: -0.3116849501397326 and parameters: {'error_threshold': 4.75, 'scalers': 'robust', 'ratios': 'norm_ratio', 'imputers': 'mean', 'n_estimators': 1050, 'learning_rate': 0.05673629017329804, 'max_depth': 4, 'min_child_weight': 3, 'subsample': 0.5, 'colsample_bytree': 0.6, 'colsample_bylevel': 1.0, 'reg_alpha': 46.692374938375536, 'reg_lambda': 2.5031741080469783e-06, 'gamma': 49.429477870265885}. Best is trial 468 with value: -0.33460998995432994.
[I 2026-07-20 13:45:02,051] Trial 519 finished with value: -0.31416812593820254 and parameters: {'error_threshold': 4.75, 'scalers': 'robust', 'ratios': 'norm_ratio', 'imputers': 'mean', 'n_estimators': 1100, 'learning_rate': 0.0550761432285866, 'max_depth': 4, 'min_child_weight': 3, 'subsample': 0.5, 'colsample_bytree': 0.6, 'colsample_bylevel': 1.0, 'reg_alpha': 40.65787853444393, 'reg_lambda': 63.03290561003694, 'gamma': 52.04043060093375}. Best is trial 468 with value: -0.33460998995432994.
[I 2026-07-20 13:45:08,436] Trial 520 finished with value: -0.30212158502747527 and parameters: {'error_threshold': 4.75, 'scalers': 'robust', 'ratios': 'norm_ratio', 'imputers': 'mean', 'n_estimators': 1050, 'learning_rate': 0.05692706177532625, 'max_depth': 4, 'min_child_weight': 2, 'subsample': 0.7, 'colsample_bytree': 0.6, 'colsample_bylevel': 0.8, 'reg_alpha': 44.776171687263556, 'reg_lambda': 56.70665948594605, 'gamma': 56.93687858714182}. Best is trial 468 with value: -0.33460998995432994.
[I 2026-07-20 13:45:10,429] Trial 521 finished with value: -0.280125894149058 and parameters: {'error_threshold': 4.75, 'scalers': 'robust', 'ratios': 'norm_ratio', 'imputers': 'mean', 'n_estimators': 1100, 'learning_rate': 0.19049442149281867, 'max_depth': 4, 'min_child_weight': 2, 'subsample': 0.5, 'colsample_bytree': 0.6, 'colsample_bylevel': 0.8, 'reg_alpha': 1.081007173001343e-06, 'reg_lambda': 1.0378447695082766e-06, 'gamma': 51.579678837019365}. Best is trial 468 with value: -0.33460998995432994.
[I 2026-07-20 13:45:10,881] Trial 522 finished with value: -0.3345578852532216 and parameters: {'error_threshold': 4.75, 'scalers': 'robust', 'ratios': 'norm_ratio', 'imputers': 'mean', 'n_estimators': 900, 'learning_rate': 0.17183839683618332, 'max_depth': 4, 'min_child_weight': 2, 'subsample': 0.5, 'colsample_bytree': 0.6, 'colsample_bylevel': 0.8, 'reg_alpha': 73.23367385325506, 'reg_lambda': 1.2975392406826663e-05, 'gamma': 56.86782581365887}. Best is trial 468 with value: -0.33460998995432994.
[I 2026-07-20 13:45:11,310] Trial 523 finished with value: -0.33111987516396896 and parameters: {'error_threshold': 4.5, 'scalers': 'robust', 'ratios': 'norm_ratio', 'imputers': 'mean', 'n_estimators': 900, 'learning_rate': 0.2005446010199623, 'max_depth': 4, 'min_child_weight': 8, 'subsample': 0.5, 'colsample_bytree': 0.6, 'colsample_bylevel': 0.8, 'reg_alpha': 64.89772101670819, 'reg_lambda': 26.3657261718985, 'gamma': 61.42990728475826}. Best is trial 468 with value: -0.33460998995432994.
[I 2026-07-20 13:45:11,769] Trial 524 finished with value: -0.31670406771214893 and parameters: {'error_threshold': 4.5, 'scalers': 'robust', 'ratios': 'norm_ratio', 'imputers': 'mean', 'n_estimators': 900, 'learning_rate': 0.17867824181501013, 'max_depth': 4, 'min_child_weight': 2, 'subsample': 0.5, 'colsample_bytree': 0.6, 'colsample_bylevel': 0.8, 'reg_alpha': 69.03306030246263, 'reg_lambda': 23.594543540017813, 'gamma': 39.51618995756739}. Best is trial 468 with value: -0.33460998995432994.
[I 2026-07-20 13:45:12,715] Trial 525 finished with value: -0.2643797852624645 and parameters: {'error_threshold': 4.5, 'scalers': 'robust', 'ratios': 'norm_ratio', 'imputers': 'mean', 'n_estimators': 900, 'learning_rate': 0.06993445672242032, 'max_depth': 4, 'min_child_weight': 2, 'subsample': 0.5, 'colsample_bytree': 0.6, 'colsample_bylevel': 1.0, 'reg_alpha': 6.126032360187278e-06, 'reg_lambda': 1.513980769204173e-05, 'gamma': 35.93488058970094}. Best is trial 468 with value: -0.33460998995432994.
[I 2026-07-20 13:45:13,159] Trial 526 finished with value: -0.30860531267397057 and parameters: {'error_threshold': 4.5, 'scalers': 'robust', 'ratios': 'norm_ratio', 'imputers': 'mean', 'n_estimators': 900, 'learning_rate': 0.2719082677408493, 'max_depth': 5, 'min_child_weight': 10, 'subsample': 0.5, 'colsample_bytree': 0.6, 'colsample_bylevel': 1.0, 'reg_alpha': 69.78589450018004, 'reg_lambda': 1.4527888219766245e-05, 'gamma': 37.20261201260603}. Best is trial 468 with value: -0.33460998995432994.
[I 2026-07-20 13:45:13,624] Trial 527 finished with value: -0.31616310816183385 and parameters: {'error_threshold': 4.5, 'scalers': 'robust', 'ratios': 'norm_ratio', 'imputers': 'mean', 'n_estimators': 900, 'learning_rate': 0.06803679641587168, 'max_depth': 5, 'min_child_weight': 2, 'subsample': 0.5, 'colsample_bytree': 0.6, 'colsample_bylevel': 0.8, 'reg_alpha': 70.14251301590018, 'reg_lambda': 25.185674565004547, 'gamma': 36.379950401530195}. Best is trial 468 with value: -0.33460998995432994.
[I 2026-07-20 13:45:20,119] Trial 528 finished with value: -0.31522645785414033 and parameters: {'error_threshold': 4.5, 'scalers': 'robust', 'ratios': 'norm_ratio', 'imputers': 'mean', 'n_estimators': 900, 'learning_rate': 0.09950820918471717, 'max_depth': 5, 'min_child_weight': 2, 'subsample': 0.5, 'colsample_bytree': 0.6, 'colsample_bylevel': 0.9, 'reg_alpha': 73.75460188096804, 'reg_lambda': 24.340744360288813, 'gamma': 34.9315975981612}. Best is trial 468 with value: -0.33460998995432994.
[I 2026-07-20 13:45:24,487] Trial 529 finished with value: -0.33456615893512937 and parameters: {'error_threshold': 4.5, 'scalers': 'robust', 'ratios': 'norm_ratio', 'imputers': 'mean', 'n_estimators': 900, 'learning_rate': 0.06969970714176449, 'max_depth': 5, 'min_child_weight': 2, 'subsample': 0.5, 'colsample_bytree': 0.6, 'colsample_bylevel': 0.9, 'reg_alpha': 69.99757628193291, 'reg_lambda': 24.61910721888481, 'gamma': 71.69698217782}. Best is trial 468 with value: -0.33460998995432994.
[I 2026-07-20 13:45:24,931] Trial 531 finished with value: -0.3033755003491669 and parameters: {'error_threshold': 4.5, 'scalers': 'robust', 'ratios': 'norm_ratio', 'imputers': 'mean', 'n_estimators': 900, 'learning_rate': 0.33876871676415027, 'max_depth': 4, 'min_child_weight': 2, 'subsample': 0.5, 'colsample_bytree': 0.6, 'colsample_bylevel': 0.8, 'reg_alpha': 71.05032621933404, 'reg_lambda': 8.304643293575991e-06, 'gamma': 36.120783850978206}. Best is trial 468 with value: -0.33460998995432994.
[I 2026-07-20 13:45:25,766] Trial 533 finished with value: -0.3345887215443333 and parameters: {'error_threshold': 4.5, 'scalers': 'robust', 'ratios': 'norm_ratio', 'imputers': 'mean', 'n_estimators': 800, 'learning_rate': 0.0384288478989282, 'max_depth': 5, 'min_child_weight': 2, 'subsample': 0.5, 'colsample_bytree': 0.6, 'colsample_bylevel': 0.8, 'reg_alpha': 99.57971511321236, 'reg_lambda': 1.4258752788651224e-05, 'gamma': 37.16817203325704}. Best is trial 468 with value: -0.33460998995432994.
[I 2026-07-20 13:45:26,171] Trial 534 finished with value: -0.3347059407146143 and parameters: {'error_threshold': 4.5, 'scalers': 'robust', 'ratios': 'norm_ratio', 'imputers': 'mean', 'n_estimators': 800, 'learning_rate': 0.2339259288178237, 'max_depth': 4, 'min_child_weight': 2, 'subsample': 0.5, 'colsample_bytree': 0.6, 'colsample_bylevel': 0.8, 'reg_alpha': 71.61842830410309, 'reg_lambda': 8.443726572373064e-06, 'gamma': 71.44753588669337}. Best is trial 534 with value: -0.3347059407146143.
[I 2026-07-20 13:45:27,484] Trial 530 finished with value: -0.317187923220465 and parameters: {'error_threshold': 4.5, 'scalers': 'robust', 'ratios': 'norm_ratio', 'imputers': 'mean', 'n_estimators': 2650, 'learning_rate': 0.06756689676260604, 'max_depth': 4, 'min_child_weight': 2, 'subsample': 0.5, 'colsample_bytree': 0.6, 'colsample_bylevel': 1.0, 'reg_alpha': 69.71734318316466, 'reg_lambda': 1.8882395600887e-05, 'gamma': 40.29599909103628}. Best is trial 534 with value: -0.3347059407146143.
[I 2026-07-20 13:45:27,908] Trial 535 finished with value: -0.3346473947374338 and parameters: {'error_threshold': 4.75, 'scalers': 'robust', 'ratios': 'norm_ratio', 'imputers': 'mean', 'n_estimators': 800, 'learning_rate': 0.0991817620706949, 'max_depth': 4, 'min_child_weight': 2, 'subsample': 0.5, 'colsample_bytree': 0.6, 'colsample_bylevel': 0.8, 'reg_alpha': 71.30810904599899, 'reg_lambda': 9.953118338001812e-06, 'gamma': 71.99099167498008}. Best is trial 534 with value: -0.3347059407146143.
