[I 2026-07-21 10:25:24,053] Trial 478 finished with value: -1.0253475474544067 and parameters: {'error_threshold': 1.1, 'scalers': 'robust', 'ratios': 'norm_ratio', 'imputers': 'median', 'n_estimators': 2850, 'learning_rate': 0.003594626209678793, 'max_depth': 3, 'min_child_weight': 5, 'subsample': 0.6, 'colsample_bytree': 0.5, 'colsample_bylevel': 0.9, 'reg_alpha': 0.0003167914761284226, 'reg_lambda': 0.0003600140004442118, 'gamma': 0.19206876317983548}. Best is trial 465 with value: -1.024241428557761.
[I 2026-07-21 10:25:24,794] Trial 479 finished with value: -1.0667469024793632 and parameters: {'error_threshold': 1.1, 'scalers': 'robust', 'ratios': 'norm_ratio', 'imputers': 'median', 'n_estimators': 1100, 'learning_rate': 0.004053852881877287, 'max_depth': 3, 'min_child_weight': 5, 'subsample': 0.6, 'colsample_bytree': 0.5, 'colsample_bylevel': 0.8, 'reg_alpha': 0.00030250836191083463, 'reg_lambda': 0.002674556003904247, 'gamma': 0.45850129805464385}. Best is trial 465 with value: -1.024241428557761.
