[I 2026-07-20 12:33:03,733] Trial 315 finished with value: -0.2936479584318522 and parameters: {'error_threshold': 1.0, 'scalers': 'none', 'ratios': 'norm_ratio', 'imputers': 'mean', 'n_estimators': 2500, 'learning_rate': 0.03716737358662493, 'max_depth': 11, 'min_child_weight': 4, 'subsample': 0.7, 'colsample_bytree': 0.8, 'colsample_bylevel': 0.7, 'reg_alpha': 32.52820654083744, 'reg_lambda': 0.6249678665971519, 'gamma': 50.0969073003009}. Best is trial 69 with value: -0.3911874830873789.
[I 2026-07-20 12:33:03,746] A new study created in Journal with name: final_predictive_mean_study
/bsuscratch/alexanderemert/miniforge3/envs/starform-alex/lib/python3.14/site-packages/numpy/lib/_nanfunctions_impl.py:1215: RuntimeWarning: All-NaN slice encountered
  return fnb._ureduce(a, func=_nanmedian, keepdims=keepdims,
/bsuscratch/alexanderemert/miniforge3/envs/starform-alex/lib/python3.14/site-packages/numpy/lib/_nanfunctions_impl.py:1215: RuntimeWarning: All-NaN slice encountered
  return fnb._ureduce(a, func=_nanmedian, keepdims=keepdims,
/bsuscratch/alexanderemert/miniforge3/envs/starform-alex/lib/python3.14/site-packages/sklearn/utils/extmath.py:1207: RuntimeWarning: invalid value encountered in divide
  updated_mean = (last_sum + new_sum) / updated_sample_count
/bsuscratch/alexanderemert/miniforge3/envs/starform-alex/lib/python3.14/site-packages/sklearn/utils/extmath.py:1212: RuntimeWarning: invalid value encountered in divide
  T = new_sum / new_sample_count
/bsuscratch/alexanderemert/miniforge3/envs/starform-alex/lib/python3.14/site-packages/numpy/lib/_nanfunctions_impl.py:1396: RuntimeWarning: All-NaN slice encountered
  return _nanquantile_unchecked(
/bsuscratch/alexanderemert/miniforge3/envs/starform-alex/lib/python3.14/site-packages/sklearn/utils/extmath.py:1236: RuntimeWarning: invalid value encountered in divide
  new_unnormalized_variance -= correction**2 / new_sample_count
/bsuscratch/alexanderemert/miniforge3/envs/starform-alex/lib/python3.14/site-packages/numpy/lib/_nanfunctions_impl.py:1396: RuntimeWarning: All-NaN slice encountered
  return _nanquantile_unchecked(
/bsuscratch/alexanderemert/miniforge3/envs/starform-alex/lib/python3.14/site-packages/numpy/lib/_nanfunctions_impl.py:1396: RuntimeWarning: All-NaN slice encountered
  return _nanquantile_unchecked(
/bsuscratch/alexanderemert/miniforge3/envs/starform-alex/lib/python3.14/site-packages/numpy/lib/_nanfunctions_impl.py:1215: RuntimeWarning: All-NaN slice encountered
  return fnb._ureduce(a, func=_nanmedian, keepdims=keepdims,
/bsuscratch/alexanderemert/miniforge3/envs/starform-alex/lib/python3.14/site-packages/numpy/lib/_nanfunctions_impl.py:1215: RuntimeWarning: All-NaN slice encountered
  return fnb._ureduce(a, func=_nanmedian, keepdims=keepdims,
/bsuscratch/alexanderemert/miniforge3/envs/starform-alex/lib/python3.14/site-packages/sklearn/utils/extmath.py:1207: RuntimeWarning: invalid value encountered in divide
  updated_mean = (last_sum + new_sum) / updated_sample_count
/bsuscratch/alexanderemert/miniforge3/envs/starform-alex/lib/python3.14/site-packages/sklearn/utils/extmath.py:1212: RuntimeWarning: invalid value encountered in divide
  T = new_sum / new_sample_count
/bsuscratch/alexanderemert/miniforge3/envs/starform-alex/lib/python3.14/site-packages/sklearn/utils/extmath.py:1236: RuntimeWarning: invalid value encountered in divide
  new_unnormalized_variance -= correction**2 / new_sample_count
/bsuscratch/alexanderemert/miniforge3/envs/starform-alex/lib/python3.14/site-packages/numpy/lib/_nanfunctions_impl.py:1396: RuntimeWarning: All-NaN slice encountered
  return _nanquantile_unchecked(
/bsuscratch/alexanderemert/miniforge3/envs/starform-alex/lib/python3.14/site-packages/numpy/lib/_nanfunctions_impl.py:1215: RuntimeWarning: All-NaN slice encountered
  return fnb._ureduce(a, func=_nanmedian, keepdims=keepdims,
/bsuscratch/alexanderemert/miniforge3/envs/starform-alex/lib/python3.14/site-packages/numpy/lib/_nanfunctions_impl.py:1396: RuntimeWarning: All-NaN slice encountered
  return _nanquantile_unchecked(
/bsuscratch/alexanderemert/miniforge3/envs/starform-alex/lib/python3.14/site-packages/numpy/lib/_nanfunctions_impl.py:1215: RuntimeWarning: All-NaN slice encountered
  return fnb._ureduce(a, func=_nanmedian, keepdims=keepdims,
/bsuscratch/alexanderemert/miniforge3/envs/starform-alex/lib/python3.14/site-packages/numpy/lib/_nanfunctions_impl.py:1396: RuntimeWarning: All-NaN slice encountered
  return _nanquantile_unchecked(
/bsuscratch/alexanderemert/miniforge3/envs/starform-alex/lib/python3.14/site-packages/numpy/lib/_nanfunctions_impl.py:1215: RuntimeWarning: All-NaN slice encountered
  return fnb._ureduce(a, func=_nanmedian, keepdims=keepdims,
/bsuscratch/alexanderemert/miniforge3/envs/starform-alex/lib/python3.14/site-packages/numpy/lib/_nanfunctions_impl.py:1396: RuntimeWarning: All-NaN slice encountered
  return _nanquantile_unchecked(
/bsuscratch/alexanderemert/miniforge3/envs/starform-alex/lib/python3.14/site-packages/numpy/lib/_nanfunctions_impl.py:1396: RuntimeWarning: All-NaN slice encountered
  return _nanquantile_unchecked(
/bsuscratch/alexanderemert/miniforge3/envs/starform-alex/lib/python3.14/site-packages/numpy/lib/_nanfunctions_impl.py:1396: RuntimeWarning: All-NaN slice encountered
  return _nanquantile_unchecked(
/bsuscratch/alexanderemert/miniforge3/envs/starform-alex/lib/python3.14/site-packages/numpy/lib/_nanfunctions_impl.py:1215: RuntimeWarning: All-NaN slice encountered
  return fnb._ureduce(a, func=_nanmedian, keepdims=keepdims,
/bsuscratch/alexanderemert/miniforge3/envs/starform-alex/lib/python3.14/site-packages/numpy/lib/_nanfunctions_impl.py:1396: RuntimeWarning: All-NaN slice encountered
  return _nanquantile_unchecked(
/bsuscratch/alexanderemert/miniforge3/envs/starform-alex/lib/python3.14/site-packages/numpy/lib/_nanfunctions_impl.py:1396: RuntimeWarning: All-NaN slice encountered
  return _nanquantile_unchecked(
/bsuscratch/alexanderemert/miniforge3/envs/starform-alex/lib/python3.14/site-packages/numpy/lib/_nanfunctions_impl.py:1215: RuntimeWarning: All-NaN slice encountered
  return fnb._ureduce(a, func=_nanmedian, keepdims=keepdims,
/bsuscratch/alexanderemert/miniforge3/envs/starform-alex/lib/python3.14/site-packages/numpy/lib/_nanfunctions_impl.py:1396: RuntimeWarning: All-NaN slice encountered
  return _nanquantile_unchecked(
[W 2026-07-20 12:33:05,267] Trial 0 failed with parameters: {'error_threshold': 1.5, 'scalers': 'robust', 'ratios': 'norm_ratio', 'imputers': 'median', 'n_estimators': 100, 'learning_rate': 0.00014786264684121003, 'max_depth': 9, 'min_child_weight': 7, 'subsample': 0.8, 'colsample_bytree': 0.6, 'colsample_bylevel': 0.9, 'reg_alpha': 2.0191964719103204e-06, 'reg_lambda': 1.0438793203756677e-05, 'gamma': 1.768202368483536} because of the following error: InvalidParameterError("The 'scoring' parameter of cross_val_score must be a str among {'neg_mean_poisson_deviance', 'jaccard_weighted', 'precision_samples', 'homogeneity_score', 'd2_brier_score', 'f1_micro', 'roc_auc_ovr_weighted', 'v_measure_score', 'neg_max_error', 'neg_negative_likelihood_ratio', 'recall_macro', 'neg_log_loss', 'mutual_info_score', 'rand_score', 'recall_samples', 'jaccard_micro', 'neg_mean_absolute_percentage_error', 'neg_mean_gamma_deviance', 'matthews_corrcoef', 'neg_root_mean_squared_log_error', 'r2', 'f1_samples', 'jaccard_samples', 'balanced_accuracy', 'recall_weighted', 'top_k_accuracy', 'precision_weighted', 'neg_brier_score', 'f1_macro', 'adjusted_mutual_info_score', 'normalized_mutual_info_score', 'recall_micro', 'd2_absolute_error_score', 'explained_variance', 'roc_auc', 'neg_mean_absolute_error', 'roc_auc_ovo', 'precision_macro', 'average_precision', 'neg_root_mean_squared_error', 'neg_median_absolute_error', 'f1', 'jaccard_macro', 'positive_likelihood_ratio', 'recall', 'f1_weighted', 'adjusted_rand_score', 'completeness_score', 'd2_log_loss_score', 'neg_mean_squared_log_error', 'precision', 'precision_micro', 'fowlkes_mallows_score', 'jaccard', 'roc_auc_ovo_weighted', 'accuracy', 'neg_mean_squared_error', 'roc_auc_ovr'}, a callable or None. Got 'root_mean_squared_error' instead.").
Traceback (most recent call last):
  File "/bsuscratch/alexanderemert/miniforge3/envs/starform-alex/lib/python3.14/site-packages/optuna/study/_optimize.py", line 206, in _run_trial
    value_or_values = func(trial)
  File "/bsuhome/alexanderemert/Research/Star-Formation-Research-Project-2026/pipeline/scripts/optuna/final_preds_and_models/optuna_search_mult_quant_reg.py", line 227, in objective
    scores = cross_val_score(model_pipe, X_train, y_train, scoring='root_mean_squared_error', cv=6, n_jobs=6)
  File "/bsuscratch/alexanderemert/miniforge3/envs/starform-alex/lib/python3.14/site-packages/sklearn/utils/_param_validation.py", line 208, in wrapper
    validate_parameter_constraints(
    ~~~~~~~~~~~~~~~~~~~~~~~~~~~~~~^
        parameter_constraints, params, caller_name=func.__qualname__
        ^^^^^^^^^^^^^^^^^^^^^^^^^^^^^^^^^^^^^^^^^^^^^^^^^^^^^^^^^^^^
    )
    ^
  File "/bsuscratch/alexanderemert/miniforge3/envs/starform-alex/lib/python3.14/site-packages/sklearn/utils/_param_validation.py", line 98, in validate_parameter_constraints
    raise InvalidParameterError(
    ...<2 lines>...
    )
sklearn.utils._param_validation.InvalidParameterError: The 'scoring' parameter of cross_val_score must be a str among {'neg_mean_poisson_deviance', 'jaccard_weighted', 'precision_samples', 'homogeneity_score', 'd2_brier_score', 'f1_micro', 'roc_auc_ovr_weighted', 'v_measure_score', 'neg_max_error', 'neg_negative_likelihood_ratio', 'recall_macro', 'neg_log_loss', 'mutual_info_score', 'rand_score', 'recall_samples', 'jaccard_micro', 'neg_mean_absolute_percentage_error', 'neg_mean_gamma_deviance', 'matthews_corrcoef', 'neg_root_mean_squared_log_error', 'r2', 'f1_samples', 'jaccard_samples', 'balanced_accuracy', 'recall_weighted', 'top_k_accuracy', 'precision_weighted', 'neg_brier_score', 'f1_macro', 'adjusted_mutual_info_score', 'normalized_mutual_info_score', 'recall_micro', 'd2_absolute_error_score', 'explained_variance', 'roc_auc', 'neg_mean_absolute_error', 'roc_auc_ovo', 'precision_macro', 'average_precision', 'neg_root_mean_squared_error', 'neg_median_absolute_error', 'f1', 'jaccard_macro', 'positive_likelihood_ratio', 'recall', 'f1_weighted', 'adjusted_rand_score', 'completeness_score', 'd2_log_loss_score', 'neg_mean_squared_log_error', 'precision', 'precision_micro', 'fowlkes_mallows_score', 'jaccard', 'roc_auc_ovo_weighted', 'accuracy', 'neg_mean_squared_error', 'roc_auc_ovr'}, a callable or None. Got 'root_mean_squared_error' instead.
[W 2026-07-20 12:33:05,277] Trial 0 failed with value None.
[W 2026-07-20 12:33:05,528] Trial 6 failed with parameters: {'error_threshold': 1.25, 'scalers': 'robust', 'ratios': 'log_ratio', 'imputers': 'none', 'n_estimators': 300, 'learning_rate': 0.24769163421834398, 'max_depth': 10, 'min_child_weight': 2, 'subsample': 0.8, 'colsample_bytree': 0.8, 'colsample_bylevel': 0.7, 'reg_alpha': 0.00015703045006094425, 'reg_lambda': 0.0002584060501809625, 'gamma': 0.00027746879861442807} because of the following error: InvalidParameterError("The 'scoring' parameter of cross_val_score must be a str among {'neg_mean_poisson_deviance', 'jaccard_weighted', 'precision_samples', 'homogeneity_score', 'd2_brier_score', 'f1_micro', 'roc_auc_ovr_weighted', 'v_measure_score', 'neg_max_error', 'neg_negative_likelihood_ratio', 'recall_macro', 'neg_log_loss', 'mutual_info_score', 'rand_score', 'recall_samples', 'jaccard_micro', 'neg_mean_absolute_percentage_error', 'neg_mean_gamma_deviance', 'matthews_corrcoef', 'neg_root_mean_squared_log_error', 'r2', 'f1_samples', 'jaccard_samples', 'balanced_accuracy', 'recall_weighted', 'top_k_accuracy', 'precision_weighted', 'neg_brier_score', 'f1_macro', 'adjusted_mutual_info_score', 'normalized_mutual_info_score', 'recall_micro', 'd2_absolute_error_score', 'explained_variance', 'roc_auc', 'neg_mean_absolute_error', 'roc_auc_ovo', 'precision_macro', 'average_precision', 'neg_root_mean_squared_error', 'neg_median_absolute_error', 'f1', 'jaccard_macro', 'positive_likelihood_ratio', 'recall', 'f1_weighted', 'adjusted_rand_score', 'completeness_score', 'd2_log_loss_score', 'neg_mean_squared_log_error', 'precision', 'precision_micro', 'fowlkes_mallows_score', 'jaccard', 'roc_auc_ovo_weighted', 'accuracy', 'neg_mean_squared_error', 'roc_auc_ovr'}, a callable or None. Got 'root_mean_squared_error' instead.").
Traceback (most recent call last):
  File "/bsuscratch/alexanderemert/miniforge3/envs/starform-alex/lib/python3.14/site-packages/optuna/study/_optimize.py", line 206, in _run_trial
    value_or_values = func(trial)
  File "/bsuhome/alexanderemert/Research/Star-Formation-Research-Project-2026/pipeline/scripts/optuna/final_preds_and_models/optuna_search_mult_quant_reg.py", line 227, in objective
    scores = cross_val_score(model_pipe, X_train, y_train, scoring='root_mean_squared_error', cv=6, n_jobs=6)
  File "/bsuscratch/alexanderemert/miniforge3/envs/starform-alex/lib/python3.14/site-packages/sklearn/utils/_param_validation.py", line 208, in wrapper
    validate_parameter_constraints(
    ~~~~~~~~~~~~~~~~~~~~~~~~~~~~~~^
        parameter_constraints, params, caller_name=func.__qualname__
        ^^^^^^^^^^^^^^^^^^^^^^^^^^^^^^^^^^^^^^^^^^^^^^^^^^^^^^^^^^^^
    )
    ^
  File "/bsuscratch/alexanderemert/miniforge3/envs/starform-alex/lib/python3.14/site-packages/sklearn/utils/_param_validation.py", line 98, in validate_parameter_constraints
    raise InvalidParameterError(
    ...<2 lines>...
    )
sklearn.utils._param_validation.InvalidParameterError: The 'scoring' parameter of cross_val_score must be a str among {'neg_mean_poisson_deviance', 'jaccard_weighted', 'precision_samples', 'homogeneity_score', 'd2_brier_score', 'f1_micro', 'roc_auc_ovr_weighted', 'v_measure_score', 'neg_max_error', 'neg_negative_likelihood_ratio', 'recall_macro', 'neg_log_loss', 'mutual_info_score', 'rand_score', 'recall_samples', 'jaccard_micro', 'neg_mean_absolute_percentage_error', 'neg_mean_gamma_deviance', 'matthews_corrcoef', 'neg_root_mean_squared_log_error', 'r2', 'f1_samples', 'jaccard_samples', 'balanced_accuracy', 'recall_weighted', 'top_k_accuracy', 'precision_weighted', 'neg_brier_score', 'f1_macro', 'adjusted_mutual_info_score', 'normalized_mutual_info_score', 'recall_micro', 'd2_absolute_error_score', 'explained_variance', 'roc_auc', 'neg_mean_absolute_error', 'roc_auc_ovo', 'precision_macro', 'average_precision', 'neg_root_mean_squared_error', 'neg_median_absolute_error', 'f1', 'jaccard_macro', 'positive_likelihood_ratio', 'recall', 'f1_weighted', 'adjusted_rand_score', 'completeness_score', 'd2_log_loss_score', 'neg_mean_squared_log_error', 'precision', 'precision_micro', 'fowlkes_mallows_score', 'jaccard', 'roc_auc_ovo_weighted', 'accuracy', 'neg_mean_squared_error', 'roc_auc_ovr'}, a callable or None. Got 'root_mean_squared_error' instead.
[W 2026-07-20 12:33:05,530] Trial 6 failed with value None.
[W 2026-07-20 12:33:05,541] Trial 4 failed with parameters: {'error_threshold': 0.5, 'scalers': 'robust', 'ratios': 'log_ratio', 'imputers': 'mean', 'n_estimators': 2150, 'learning_rate': 0.02867958772757811, 'max_depth': 10, 'min_child_weight': 5, 'subsample': 0.8, 'colsample_bytree': 0.9, 'colsample_bylevel': 0.6, 'reg_alpha': 1.0405326039021392, 'reg_lambda': 0.0004139260440512215, 'gamma': 2.8994138657041817} because of the following error: InvalidParameterError("The 'scoring' parameter of cross_val_score must be a str among {'neg_mean_poisson_deviance', 'jaccard_weighted', 'precision_samples', 'homogeneity_score', 'd2_brier_score', 'f1_micro', 'roc_auc_ovr_weighted', 'v_measure_score', 'neg_max_error', 'neg_negative_likelihood_ratio', 'recall_macro', 'neg_log_loss', 'mutual_info_score', 'rand_score', 'recall_samples', 'jaccard_micro', 'neg_mean_absolute_percentage_error', 'neg_mean_gamma_deviance', 'matthews_corrcoef', 'neg_root_mean_squared_log_error', 'r2', 'f1_samples', 'jaccard_samples', 'balanced_accuracy', 'recall_weighted', 'top_k_accuracy', 'precision_weighted', 'neg_brier_score', 'f1_macro', 'adjusted_mutual_info_score', 'normalized_mutual_info_score', 'recall_micro', 'd2_absolute_error_score', 'explained_variance', 'roc_auc', 'neg_mean_absolute_error', 'roc_auc_ovo', 'precision_macro', 'average_precision', 'neg_root_mean_squared_error', 'neg_median_absolute_error', 'f1', 'jaccard_macro', 'positive_likelihood_ratio', 'recall', 'f1_weighted', 'adjusted_rand_score', 'completeness_score', 'd2_log_loss_score', 'neg_mean_squared_log_error', 'precision', 'precision_micro', 'fowlkes_mallows_score', 'jaccard', 'roc_auc_ovo_weighted', 'accuracy', 'neg_mean_squared_error', 'roc_auc_ovr'}, a callable or None. Got 'root_mean_squared_error' instead.").
Traceback (most recent call last):
  File "/bsuscratch/alexanderemert/miniforge3/envs/starform-alex/lib/python3.14/site-packages/optuna/study/_optimize.py", line 206, in _run_trial
    value_or_values = func(trial)
  File "/bsuhome/alexanderemert/Research/Star-Formation-Research-Project-2026/pipeline/scripts/optuna/final_preds_and_models/optuna_search_mult_quant_reg.py", line 227, in objective
    scores = cross_val_score(model_pipe, X_train, y_train, scoring='root_mean_squared_error', cv=6, n_jobs=6)
  File "/bsuscratch/alexanderemert/miniforge3/envs/starform-alex/lib/python3.14/site-packages/sklearn/utils/_param_validation.py", line 208, in wrapper
    validate_parameter_constraints(
    ~~~~~~~~~~~~~~~~~~~~~~~~~~~~~~^
        parameter_constraints, params, caller_name=func.__qualname__
        ^^^^^^^^^^^^^^^^^^^^^^^^^^^^^^^^^^^^^^^^^^^^^^^^^^^^^^^^^^^^
    )
    ^
  File "/bsuscratch/alexanderemert/miniforge3/envs/starform-alex/lib/python3.14/site-packages/sklearn/utils/_param_validation.py", line 98, in validate_parameter_constraints
    raise InvalidParameterError(
    ...<2 lines>...
    )
sklearn.utils._param_validation.InvalidParameterError: The 'scoring' parameter of cross_val_score must be a str among {'neg_mean_poisson_deviance', 'jaccard_weighted', 'precision_samples', 'homogeneity_score', 'd2_brier_score', 'f1_micro', 'roc_auc_ovr_weighted', 'v_measure_score', 'neg_max_error', 'neg_negative_likelihood_ratio', 'recall_macro', 'neg_log_loss', 'mutual_info_score', 'rand_score', 'recall_samples', 'jaccard_micro', 'neg_mean_absolute_percentage_error', 'neg_mean_gamma_deviance', 'matthews_corrcoef', 'neg_root_mean_squared_log_error', 'r2', 'f1_samples', 'jaccard_samples', 'balanced_accuracy', 'recall_weighted', 'top_k_accuracy', 'precision_weighted', 'neg_brier_score', 'f1_macro', 'adjusted_mutual_info_score', 'normalized_mutual_info_score', 'recall_micro', 'd2_absolute_error_score', 'explained_variance', 'roc_auc', 'neg_mean_absolute_error', 'roc_auc_ovo', 'precision_macro', 'average_precision', 'neg_root_mean_squared_error', 'neg_median_absolute_error', 'f1', 'jaccard_macro', 'positive_likelihood_ratio', 'recall', 'f1_weighted', 'adjusted_rand_score', 'completeness_score', 'd2_log_loss_score', 'neg_mean_squared_log_error', 'precision', 'precision_micro', 'fowlkes_mallows_score', 'jaccard', 'roc_auc_ovo_weighted', 'accuracy', 'neg_mean_squared_error', 'roc_auc_ovr'}, a callable or None. Got 'root_mean_squared_error' instead.
[W 2026-07-20 12:33:05,542] Trial 4 failed with value None.
[W 2026-07-20 12:33:06,546] Trial 2 failed with parameters: {'error_threshold': 2.75, 'scalers': 'robust', 'ratios': 'log_ratio', 'imputers': 'median', 'n_estimators': 1300, 'learning_rate': 0.003622075922200762, 'max_depth': 6, 'min_child_weight': 3, 'subsample': 0.5, 'colsample_bytree': 0.5, 'colsample_bylevel': 0.9, 'reg_alpha': 0.585157074145163, 'reg_lambda': 6.698722480624553e-05, 'gamma': 2.7569793411698567} because of the following error: InvalidParameterError("The 'scoring' parameter of cross_val_score must be a str among {'neg_mean_poisson_deviance', 'jaccard_weighted', 'precision_samples', 'homogeneity_score', 'd2_brier_score', 'f1_micro', 'roc_auc_ovr_weighted', 'v_measure_score', 'neg_max_error', 'neg_negative_likelihood_ratio', 'recall_macro', 'neg_log_loss', 'mutual_info_score', 'rand_score', 'recall_samples', 'jaccard_micro', 'neg_mean_absolute_percentage_error', 'neg_mean_gamma_deviance', 'matthews_corrcoef', 'neg_root_mean_squared_log_error', 'r2', 'f1_samples', 'jaccard_samples', 'balanced_accuracy', 'recall_weighted', 'top_k_accuracy', 'precision_weighted', 'neg_brier_score', 'f1_macro', 'adjusted_mutual_info_score', 'normalized_mutual_info_score', 'recall_micro', 'd2_absolute_error_score', 'explained_variance', 'roc_auc', 'neg_mean_absolute_error', 'roc_auc_ovo', 'precision_macro', 'average_precision', 'neg_root_mean_squared_error', 'neg_median_absolute_error', 'f1', 'jaccard_macro', 'positive_likelihood_ratio', 'recall', 'f1_weighted', 'adjusted_rand_score', 'completeness_score', 'd2_log_loss_score', 'neg_mean_squared_log_error', 'precision', 'precision_micro', 'fowlkes_mallows_score', 'jaccard', 'roc_auc_ovo_weighted', 'accuracy', 'neg_mean_squared_error', 'roc_auc_ovr'}, a callable or None. Got 'root_mean_squared_error' instead.").
Traceback (most recent call last):
  File "/bsuscratch/alexanderemert/miniforge3/envs/starform-alex/lib/python3.14/site-packages/optuna/study/_optimize.py", line 206, in _run_trial
    value_or_values = func(trial)
  File "/bsuhome/alexanderemert/Research/Star-Formation-Research-Project-2026/pipeline/scripts/optuna/final_preds_and_models/optuna_search_mult_quant_reg.py", line 227, in objective
    scores = cross_val_score(model_pipe, X_train, y_train, scoring='root_mean_squared_error', cv=6, n_jobs=6)
  File "/bsuscratch/alexanderemert/miniforge3/envs/starform-alex/lib/python3.14/site-packages/sklearn/utils/_param_validation.py", line 208, in wrapper
    validate_parameter_constraints(
    ~~~~~~~~~~~~~~~~~~~~~~~~~~~~~~^
        parameter_constraints, params, caller_name=func.__qualname__
        ^^^^^^^^^^^^^^^^^^^^^^^^^^^^^^^^^^^^^^^^^^^^^^^^^^^^^^^^^^^^
    )
  