[I 2026-07-20 13:47:28,931] Trial 636 finished with value: -0.2133189519082248 and parameters: {'error_threshold': 0.5, 'scalers': 'none', 'ratios': 'norm_ratio', 'imputers': 'none', 'n_estimators': 200, 'learning_rate': 0.2650096010280288, 'max_depth': 3, 'min_child_weight': 9, 'subsample': 0.5, 'colsample_bytree': 0.5, 'colsample_bylevel': 0.5, 'reg_alpha': 24.518993000988864, 'reg_lambda': 0.0001803148503748298, 'gamma': 57.127027937648116}. Best is trial 478 with value: -0.2209472207879047.
[I 2026-07-20 13:47:29,082] Trial 637 finished with value: -0.22090828871195242 and parameters: {'error_threshold': 0.5, 'scalers': 'none', 'ratios': 'norm_ratio', 'imputers': 'none', 'n_estimators': 200, 'learning_rate': 0.18323140979702726, 'max_depth': 3, 'min_child_weight': 9, 'subsample': 0.5, 'colsample_bytree': 0.5, 'colsample_bylevel': 0.9, 'reg_alpha': 20.876350826972516, 'reg_lambda': 0.00017748942633077542, 'gamma': 93.40744425406965}. Best is trial 478 with value: -0.2209472207879047.
[I 2026-07-20 13:47:29,193] Trial 638 finished with value: -0.21304676219696025 and parameters: {'error_threshold': 0.5, 'scalers': 'none', 'ratios': 'norm_ratio', 'imputers': 'none', 'n_estimators': 200, 'learning_rate': 0.17799781362813827, 'max_depth': 3, 'min_child_weight': 9, 'subsample': 0.5, 'colsample_bytree': 0.5, 'colsample_bylevel': 0.5, 'reg_alpha': 26.555201118960603, 'reg_lambda': 0.00020738554858584521, 'gamma': 53.36090384452646}. Best is trial 478 with value: -0.2209472207879047.
