[I 2026-07-20 13:43:25,313] Trial 349 finished with value: -0.21473860239290113 and parameters: {'error_threshold': 0.0, 'scalers': 'robust', 'ratios': 'norm_ratio', 'imputers': 'none', 'n_estimators': 150, 'learning_rate': 0.1028259321455924, 'max_depth': 4, 'min_child_weight': 6, 'subsample': 0.5, 'colsample_bytree': 0.6, 'colsample_bylevel': 0.5, 'reg_alpha': 70.29483950159643, 'reg_lambda': 0.002541388807450885, 'gamma': 21.601608517874023}. Best is trial 299 with value: -0.22091430699488926.
/bsuscratch/alexanderemert/miniforge3/envs/starform-alex/lib/python3.14/site-packages/numpy/lib/_nanfunctions_impl.py:1215: RuntimeWarning: All-NaN slice encountered
  return fnb._ureduce(a, func=_nanmedian, keepdims=keepdims,
/bsuscratch/alexanderemert/miniforge3/envs/starform-alex/lib/python3.14/site-packages/numpy/lib/_nanfunctions_impl.py:1396: RuntimeWarning: All-NaN slice encountered
  return _nanquantile_unchecked(
/bsuscratch/alexanderemert/miniforge3/envs/starform-alex/lib/python3.14/site-packages/numpy/lib/_nanfunctions_impl.py:1215: RuntimeWarning: All-NaN slice encountered
  return fnb._ureduce(a, func=_nanmedian, keepdims=keepdims,
/bsuscratch/alexanderemert/miniforge3/envs/starform-alex/lib/python3.14/site-packages/numpy/lib/_nanfunctions_impl.py:1396: RuntimeWarning: All-NaN slice encountered
  return _nanquantile_unchecked(
/bsuscratch/alexanderemert/miniforge3/envs/starform-alex/lib/python3.14/site-packages/numpy/lib/_nanfunctions_impl.py:1215: RuntimeWarning: All-NaN slice encountered
  return fnb._ureduce(a, func=_nanmedian, keepdims=keepdims,
/bsuscratch/alexanderemert/miniforge3/envs/starform-alex/lib/python3.14/site-packages/numpy/lib/_nanfunctions_impl.py:1396: RuntimeWarning: All-NaN slice encountered
  return _nanquantile_unchecked(
/bsuscratch/alexanderemert/miniforge3/envs/starform-alex/lib/python3.14/site-packages/numpy/lib/_nanfunctions_impl.py:1215: RuntimeWarning: All-NaN slice encountered
  return fnb._ureduce(a, func=_nanmedian, keepdims=keepdims,
/bsuscratch/alexanderemert/miniforge3/envs/starform-alex/lib/python3.14/site-packages/numpy/lib/_nanfunctions_impl.py:1396: RuntimeWarning: All-NaN slice encountered
  return _nanquantile_unchecked(
/bsuscratch/alexanderemert/miniforge3/envs/starform-alex/lib/python3.14/site-packages/numpy/lib/_nanfunctions_impl.py:1215: RuntimeWarning: All-NaN slice encountered
  return fnb._ureduce(a, func=_nanmedian, keepdims=keepdims,
/bsuscratch/alexanderemert/miniforge3/envs/starform-alex/lib/python3.14/site-packages/numpy/lib/_nanfunctions_impl.py:1396: RuntimeWarning: All-NaN slice encountered
  return _nanquantile_unchecked(
/bsuscratch/alexanderemert/miniforge3/envs/starform-alex/lib/python3.14/site-packages/numpy/lib/_nanfunctions_impl.py:1215: RuntimeWarning: All-NaN slice encountered
  return fnb._ureduce(a, func=_nanmedian, keepdims=keepdims,
/bsuscratch/alexanderemert/miniforge3/envs/starform-alex/lib/python3.14/site-packages/numpy/lib/_nanfunctions_impl.py:1396: RuntimeWarning: All-NaN slice encountered
  return _nanquantile_unchecked(
/bsuscratch/alexanderemert/miniforge3/envs/starform-alex/lib/python3.14/site-packages/numpy/lib/_nanfunctions_impl.py:1215: RuntimeWarning: All-NaN slice encountered
  return fnb._ureduce(a, func=_nanmedian, keepdims=keepdims,
/bsuscratch/alexanderemert/miniforge3/envs/starform-alex/lib/python3.14/site-packages/numpy/lib/_nanfunctions_impl.py:1396: RuntimeWarning: All-NaN slice encountered
  return _nanquantile_unchecked(
/bsuscratch/alexanderemert/miniforge3/envs/starform-alex/lib/python3.14/site-packages/numpy/lib/_nanfunctions_impl.py:1215: RuntimeWarning: All-NaN slice encountered
  return fnb._ureduce(a, func=_nanmedian, keepdims=keepdims,
/bsuscratch/alexanderemert/miniforge3/envs/starform-alex/lib/python3.14/site-packages/numpy/lib/_nanfunctions_impl.py:1396: RuntimeWarning: All-NaN slice encountered
  return _nanquantile_unchecked(
/bsuscratch/alexanderemert/miniforge3/envs/starform-alex/lib/python3.14/site-packages/numpy/lib/_nanfunctions_impl.py:1215: RuntimeWarning: All-NaN slice encountered
  return fnb._ureduce(a, func=_nanmedian, keepdims=keepdims,
/bsuscratch/alexanderemert/miniforge3/envs/starform-alex/lib/python3.14/site-packages/numpy/lib/_nanfunctions_impl.py:1215: RuntimeWarning: All-NaN slice encountered
  return fnb._ureduce(a, func=_nanmedian, keepdims=keepdims,
/bsuscratch/alexanderemert/miniforge3/envs/starform-alex/lib/python3.14/site-packages/numpy/lib/_nanfunctions_impl.py:1396: RuntimeWarning: All-NaN slice encountered
  return _nanquantile_unchecked(
/bsuscratch/alexanderemert/miniforge3/envs/starform-alex/lib/python3.14/site-packages/numpy/lib/_nanfunctions_impl.py:1396: RuntimeWarning: All-NaN slice encountered
  return _nanquantile_unchecked(
/bsuscratch/alexanderemert/miniforge3/envs/starform-alex/lib/python3.14/site-packages/numpy/lib/_nanfunctions_impl.py:1215: RuntimeWarning: All-NaN slice encountered
  return fnb._ureduce(a, func=_nanmedian, keepdims=keepdims,
/bsuscratch/alexanderemert/miniforge3/envs/starform-alex/lib/python3.14/site-packages/numpy/lib/_nanfunctions_impl.py:1396: RuntimeWarning: All-NaN slice encountered
  return _nanquantile_unchecked(
/bsuscratch/alexanderemert/miniforge3/envs/starform-alex/lib/python3.14/site-packages/numpy/lib/_nanfunctions_impl.py:1215: RuntimeWarning: All-NaN slice encountered
  return fnb._ureduce(a, func=_nanmedian, keepdims=keepdims,
/bsuscratch/alexanderemert/miniforge3/envs/starform-alex/lib/python3.14/site-packages/numpy/lib/_nanfunctions_impl.py:1396: RuntimeWarning: All-NaN slice encountered
  return _nanquantile_unchecked(
/bsuscratch/alexanderemert/miniforge3/envs/starform-alex/lib/python3.14/site-packages/numpy/lib/_nanfunctions_impl.py:1215: RuntimeWarning: All-NaN slice encountered
  return fnb._ureduce(a, func=_nanmedian, keepdims=keepdims,
/bsuscratch/alexanderemert/miniforge3/envs/starform-alex/lib/python3.14/site-packages/numpy/lib/_nanfunctions_impl.py:1215: RuntimeWarning: All-NaN slice encountered
  return fnb._ureduce(a, func=_nanmedian, keepdims=keepdims,
/bsuscratch/alexanderemert/miniforge3/envs/starform-alex/lib/python3.14/site-packages/numpy/lib/_nanfunctions_impl.py:1396: RuntimeWarning: All-NaN slice encountered
  return _nanquantile_unchecked(
/bsuscratch/alexanderemert/miniforge3/envs/starform-alex/lib/python3.14/site-packages/numpy/lib/_nanfunctions_impl.py:1396: RuntimeWarning: All-NaN slice encountered
  return _nanquantile_unchecked(
/bsuscratch/alexanderemert/miniforge3/envs/starform-alex/lib/python3.14/site-packages/numpy/lib/_nanfunctions_impl.py:1215: RuntimeWarning: All-NaN slice encountered
  return fnb._ureduce(a, func=_nanmedian, keepdims=keepdims,
/bsuscratch/alexanderemert/miniforge3/envs/starform-alex/lib/python3.14/site-packages/numpy/lib/_nanfunctions_impl.py:1396: RuntimeWarning: All-NaN slice encountered
  return _nanquantile_unchecked(
/bsuscratch/alexanderemert/miniforge3/envs/starform-alex/lib/python3.14/site-packages/numpy/lib/_nanfunctions_impl.py:1215: RuntimeWarning: All-NaN slice encountered
  return fnb._ureduce(a, func=_nanmedian, keepdims=keepdims,
/bsuscratch/alexanderemert/miniforge3/envs/starform-alex/lib/python3.14/site-packages/numpy/lib/_nanfunctions_impl.py:1215: RuntimeWarning: All-NaN slice encountered
  return fnb._ureduce(a, func=_nanmedian, keepdims=keepdims,
/bsuscratch/alexanderemert/miniforge3/envs/starform-alex/lib/python3.14/site-packages/numpy/lib/_nanfunctions_impl.py:1396: RuntimeWarning: All-NaN slice encountered
  return _nanquantile_unchecked(
/bsuscratch/alexanderemert/miniforge3/envs/starform-alex/lib/python3.14/site-packages/numpy/lib/_nanfunctions_impl.py:1396: RuntimeWarning: All-NaN slice encountered
  return _nanquantile_unchecked(
/bsuscratch/alexanderemert/miniforge3/envs/starform-alex/lib/python3.14/site-packages/numpy/lib/_nanfunctions_impl.py:1215: RuntimeWarning: All-NaN slice encountered
  return fnb._ureduce(a, func=_nanmedian, keepdims=keepdims,
/bsuscratch/alexanderemert/miniforge3/envs/starform-alex/lib/python3.14/site-packages/numpy/lib/_nanfunctions_impl.py:1396: RuntimeWarning: All-NaN slice encountered
  return _nanquantile_unchecked(
/bsuscratch/alexanderemert/miniforge3/envs/starform-alex/lib/python3.14/site-packages/numpy/lib/_nanfunctions_impl.py:1215: RuntimeWarning: All-NaN slice encountered
  return fnb._ureduce(a, func=_nanmedian, keepdims=keepdims,
/bsuscratch/alexanderemert/miniforge3/envs/starform-alex/lib/python3.14/site-packages/numpy/lib/_nanfunctions_impl.py:1215: RuntimeWarning: All-NaN slice encountered
  return fnb._ureduce(a, func=_nanmedian, keepdims=keepdims,
/bsuscratch/alexanderemert/miniforge3/envs/starform-alex/lib/python3.14/site-packages/numpy/lib/_nanfunctions_impl.py:1396: RuntimeWarning: All-NaN slice encountered
  return _nanquantile_unchecked(
/bsuscratch/alexanderemert/miniforge3/envs/starform-alex/lib/python3.14/site-packages/numpy/lib/_nanfunctions_impl.py:1215: RuntimeWarning: All-NaN slice encountered
  return fnb._ureduce(a, func=_nanmedian, keepdims=keepdims,
/bsuscratch/alexanderemert/miniforge3/envs/starform-alex/lib/python3.14/site-packages/numpy/lib/_nanfunctions_impl.py:1396: RuntimeWarning: All-NaN slice encountered
  return _nanquantile_unchecked(
/bsuscratch/alexanderemert/miniforge3/envs/starform-alex/lib/python3.14/site-packages/numpy/lib/_nanfunctions_impl.py:1396: RuntimeWarning: All-NaN slice encountered
  return _nanquantile_unchecked(
/bsuscratch/alexanderemert/miniforge3/envs/starform-alex/lib/python3.14/site-packages/numpy/lib/_nanfunctions_impl.py:1215: RuntimeWarning: All-NaN slice encountered
  return fnb._ureduce(a, func=_nanmedian, keepdims=keepdims,
/bsuscratch/alexanderemert/miniforge3/envs/starform-alex/lib/python3.14/site-packages/numpy/lib/_nanfunctions_impl.py:1396: RuntimeWarning: All-NaN slice encountered
  return _nanquantile_unchecked(
/bsuscratch/alexanderemert/miniforge3/envs/starform-alex/lib/python3.14/site-packages/numpy/lib/_nanfunctions_impl.py:1215: RuntimeWarning: All-NaN slice encountered
  return fnb._ureduce(a, func=_nanmedian, keepdims=keepdims,
/bsuscratch/alexanderemert/miniforge3/envs/starform-alex/lib/python3.14/site-packages/numpy/lib/_nanfunctions_impl.py:1215: RuntimeWarning: All-NaN slice encountered
  return fnb._ureduce(a, func=_nanmedian, keepdims=keepdims,
/bsuscratch/alexanderemert/miniforge3/envs/starform-alex/lib/python3.14/site-packages/numpy/lib/_nanfunctions_impl.py:1396: RuntimeWarning: All-NaN slice encountered
  return _nanquantile_unchecked(
/bsuscratch/alexanderemert/miniforge3/envs/starform-alex/lib/python3.14/site-packages/numpy/lib/_nanfunctions_impl.py:1396: RuntimeWarning: All-NaN slice encountered
  return _nanquantile_unchecked(
/bsuscratch/alexanderemert/miniforge3/envs/starform-alex/lib/python3.14/site-packages/numpy/lib/_nanfunctions_impl.py:1215: RuntimeWarning: All-NaN slice encountered
  return fnb._ureduce(a, func=_nanmedian, keepdims=keepdims,
/bsuscratch/alexanderemert/miniforge3/envs/starform-alex/lib/python3.14/site-packages/numpy/lib/_nanfunctions_impl.py:1396: RuntimeWarning: All-NaN slice encountered
  return _nanquantile_unchecked(
/bsuscratch/alexanderemert/miniforge3/envs/starform-alex/lib/python3.14/site-packages/numpy/lib/_nanfunctions_impl.py:1215: RuntimeWarning: All-NaN slice encountered
  return fnb._ureduce(a, func=_nanmedian, keepdims=keepdims,
/bsuscratch/alexanderemert/miniforge3/envs/starform-alex/lib/python3.14/site-packages/numpy/lib/_nanfunctions_impl.py:1396: RuntimeWarning: All-NaN slice encountered
  return _nanquantile_unchecked(
[I 2026-07-20 13:43:25,694] Trial 350 finished with value: -0.21582209550961784 and parameters: {'error_threshold': 0.0, 'scalers': 'robust', 'ratios': 'norm_ratio', 'imputers': 'none', 'n_estimators': 150, 'learning_rate': 0.1026398186418726, 'max_depth': 4, 'min_child_weight': 6, 'subsample': 0.5, 'colsample_bytree': 0.6, 'colsample_bylevel': 0.5, 'reg_alpha': 99.29487047911799, 'reg_lambda': 0.0024680623125425067, 'gamma': 11.043675637971836}. Best is trial 299 with value: -0.22091430699488926.
[I 2026-07-20 13:43:25,790] Trial 351 finished with value: -0.2157673361149286 and parameters: {'error_threshold': 0.0, 'scalers': 'robust', 'ratios': 'norm_ratio', 'imputers': 'none', 'n_estimators': 150, 'learning_rate': 0.10426369904846265, 'max_depth': 4, 'min_child_weight': 6, 'subsample': 0.5, 'colsample_bytree': 0.6, 'colsample_bylevel': 0.5, 'reg_alpha': 99.33373256297543, 'reg_lambda': 4.310547081560821e-05, 'gamma': 10.690528577830646}. Best is trial 299 with value: -0.22091430699488926.
/bsuscratch/alexanderemert/miniforge3/envs/starform-alex/lib/python3.14/site-packages/numpy/lib/_nanfunctions_impl.py:1215: RuntimeWarning: All-NaN slice encountered
  return fnb._ureduce(a, func=_nanmedian, keepdims=keepdims,
/bsuscratch/alexanderemert/miniforge3/envs/starform-alex/lib/python3.14/site-packages/numpy/lib/_nanfunctions_impl.py:1396: RuntimeWarning: All-NaN slice encountered
  return _nanquantile_unchecked(
/bsuscratch/alexanderemert/miniforge3/envs/starform-alex/lib/python3.14/site-packages/numpy/lib/_nanfunctions_impl.py:1215: RuntimeWarning: All-NaN slice encountered
  return fnb._ureduce(a, func=_nanmedian, keepdims=keepdims,
/bsuscratch/alexanderemert/miniforge3/envs/starform-alex/lib/python3.14/site-packages/numpy/lib/_nanfunctions_impl.py:1396: RuntimeWarning: All-NaN slice encountered
  return _nanquantile_unchecked(
/bsuscratch/alexanderemert/miniforge3/envs/starform-alex/lib/python3.14/site-packages/numpy/lib/_nanfunctions_impl.py:1215: RuntimeWarning: All-NaN slice encountered
  return fnb._ureduce(a, func=_nanmedian, keepdims=keepdims,
/bsuscratch/alexanderemert/miniforge3/envs/starform-alex/lib/python3.14/site-packages/numpy/lib/_nanfunctions_impl.py:1396: RuntimeWarning: All-NaN slice encountered
  return _nanquantile_unchecked(
/bsuscratch/alexanderemert/miniforge3/envs/starform-alex/lib/python3.14/site-packages/numpy/lib/_nanfunctions_impl.py:1215: RuntimeWarning: All-NaN slice encountered
  return fnb._ureduce(a, func=_nanmedian, keepdims=keepdims,
/bsuscratch/alexanderemert/miniforge3/envs/starform-alex/lib/python3.14/site-packages/numpy/lib/_nanfunctions_impl.py:1396: RuntimeWarning: All-NaN slice encountered
  return _nanquantile_unchecked(
/bsuscratch/alexanderemert/miniforge3/envs/starform-alex/lib/python3.14/site-packages/numpy/lib/_nanfunctions_impl.py:1215: RuntimeWarning: All-NaN slice encountered
  return fnb._ureduce(a, func=_nanmedian, keepdims=keepdims,
/bsuscratch/alexanderemert/miniforge3/envs/starform-alex/lib/python3.14/site-packages/numpy/lib/_nanfunctions_impl.py:1396: RuntimeWarning: All-NaN slice encountered
  return _nanquantile_unchecked(
/bsuscratch/alexanderemert/miniforge3/envs/starform-alex/lib/python3.14/site-packages/numpy/lib/_nanfunctions_impl.py:1215: RuntimeWarning: All-NaN slice encountered
  return fnb._ureduce(a, func=_nanmedian, keepdims=keepdims,
/bsuscratch/alexanderemert/miniforge3/envs/starform-alex/lib/python3.14/site-packages/numpy/lib/_nanfunctions_impl.py:1396: RuntimeWarning: All-NaN slice encountered
  return _nanquantile_unchecked(
/bsuscratch/alexanderemert/miniforge3/envs/starform-alex/lib/python3.14/site-packages/numpy/lib/_nanfunctions_impl.py:1215: RuntimeWarning: All-NaN slice encountered
  return fnb._ureduce(a, func=_nanmedian, keepdims=keepdims,
/bsuscratch/alexanderemert/miniforge3/envs/starform-alex/lib/python3.14/site-packages/numpy/lib/_nanfunctions_impl.py:1396: RuntimeWarning: All-NaN slice encountered
  return _nanquantile_unchecked(
/bsuscratch/alexanderemert/miniforge3/envs/starform-alex/lib/python3.14/site-packages/numpy/lib/_nanfunctions_impl.py:1215: RuntimeWarning: All-NaN slice encountered
  return fnb._ureduce(a, func=_nanmedian, keepdims=keepdims,
/bsuscratch/alexanderemert/miniforge3/envs/starform-alex/lib/python3.14/site-packages/numpy/lib/_nanfunctions_impl.py:1396: RuntimeWarning: All-NaN slice encountered
  return _nanquantile_unchecked(
/bsuscratch/alexanderemert/miniforge3/envs/starform-alex/lib/python3.14/site-packages/numpy/lib/_nanfunctions_impl.py:1215: RuntimeWarning: All-NaN slice encountered
  return fnb._ureduce(a, func=_nanmedian, keepdims=keepdims,
/bsuscratch/alexanderemert/miniforge3/envs/starform-alex/lib/python3.14/site-packages/numpy/lib/_nanfunctions_impl.py:1215: RuntimeWarning: All-NaN slice encountered
  return fnb._ureduce(a, func=_nanmedian, keepdims=keepdims,
/bsuscratch/alexanderemert/miniforge3/envs/starform-alex/lib/python3.14/site-packages/numpy/lib/_nanfunctions_impl.py:1396: RuntimeWarning: All-NaN slice encountered
  return _nanquantile_unchecked(
/bsuscratch/alexanderemert/miniforge3/envs/starform-alex/lib/python3.14/site-packages/numpy/lib/_nanfunctions_impl.py:1396: RuntimeWarning: All-NaN slice encountered
  return _nanquantile_unchecked(
/bsuscratch/alexanderemert/miniforge3/envs/starform-alex/lib/python3.14/site-packages/numpy/lib/_nanfunctions_impl.py:1215: RuntimeWarning: All-NaN slice encountered
  return fnb._ureduce(a, func=_nanmedian, keepdims=keepdims,
/bsuscratch/alexanderemert/miniforge3/envs/starform-alex/lib/python3.14/site-packages/numpy/lib/_nanfunctions_impl.py:1396: RuntimeWarning: All-NaN slice encountered
  return _nanquantile_unchecked(
/bsuscratch/alexanderemert/miniforge3/envs/starform-alex/lib/python3.14/site-packages/numpy/lib/_nanfunctions_impl.py:1215: RuntimeWarning: All-NaN slice encountered
  return fnb._ureduce(a, func=_nanmedian, keepdims=keepdims,
/bsuscratch/alexanderemert/miniforge3/envs/starform-alex/lib/python3.14/site-packages/numpy/lib/_nanfunctions_impl.py:1396: RuntimeWarning: All-NaN slice encountered
  return _nanquantile_unchecked(
[I 2026-07-20 13:43:26,149] Trial 352 finished with value: -0.2153622972682205 and parameters: {'error_threshold': 0.0, 'scalers': 'robust', 'ratios': 'norm_ratio', 'imputers': 'none', 'n_estimators': 150, 'learning_rate': 0.10218909832425245, 'max_depth': 4, 'min_child_weight': 6, 'subsample': 0.5, 'colsample_bytree': 0.6, 'colsample_bylevel': 0.5, 'reg_alpha': 96.3809536742431, 'reg_lambda': 1.4641454519147008e-05, 'gamma': 10.710705293724432}. Best is trial 299 with value: -0.22091430699488926.
[I 2026-07-20 13:43:26,250] Trial 353 finished with value: -0.21775162662493397 and parameters: {'error_threshold': 0.0, 'scalers': 'robust', 'ratios': 'norm_ratio', 'imputers': 'none', 'n_estimators': 150, 'learning_rate': 0.07746698433224047, 'max_depth': 4, 'min_child_weight': 6, 'subsample': 0.5, 'colsample_bytree': 0.6, 'colsample_bylevel': 0.5, 'reg_alpha': 99.53556710074191, 'reg_lambda': 3.811077937723765e-05, 'gamma': 12.849949432420367}. Best is trial 299 with value: -0.22091430699488926.
/bsuscratch/alexanderemert/miniforge3/envs/starform-alex/lib/python3.14/site-packages/numpy/lib/_nanfunctions_impl.py:1215: RuntimeWarning: All-NaN slice encountered
  return fnb._ureduce(a, func=_nanmedian, keepdims=keepdims,
/bsuscratch/alexanderemert/miniforge3/envs/starform-alex/lib/python3.14/site-packages/numpy/lib/_nanfunctions_impl.py:1396: RuntimeWarning: All-NaN slice encountered
  return _nanquantile_unchecked(
/bsuscratch/alexanderemert/miniforge3/envs/starform-alex/lib/python3.14/site-packages/numpy/lib/_nanfunctions_impl.py:1215: RuntimeWarning: All-NaN slice encountered
  return fnb._ureduce(a, func=_nanmedian, keepdims=keepdims,
/bsuscratch/alexanderemert/miniforge3/envs/starform-alex/lib/python3.14/site-packages/numpy/lib/_nanfunctions_impl.py:1396: RuntimeWarning: All-NaN slice encountered
  return _nanquantile_unchecked(
/bsuscratch/alexanderemert/miniforge3/envs/starform-alex/lib/python3.14/site-packages/numpy/lib/_nanfunctions_impl.py:1215: RuntimeWarning: All-NaN slice encountered
  return fnb._ureduce(a, func=_nanmedian, keepdims=keepdims,
/bsuscratch/alexanderemert/miniforge3/envs/starform-alex/lib/python3.14/site-packages/numpy/lib/_nanfunctions_impl.py:1396: RuntimeWarning: All-NaN slice encountered
  return _nanquantile_unchecked(
/bsuscratch/alexanderemert/miniforge3/envs/starform-alex/lib/python3.14/site-packages/numpy/lib/_nanfunctions_impl.py:1215: RuntimeWarning: All-NaN slice encountered
  return fnb._ureduce(a, func=_nanmedian, keepdims=keepdims,
/bsuscratch/alexanderemert/miniforge3/envs/starform-alex/lib/python3.14/site-packages/numpy/lib/_nanfunctions_impl.py:1396: RuntimeWarning: All-NaN slice encountered
  return _nanquantile_unchecked(
/bsuscratch/alexanderemert/miniforge3/envs/starform-alex/lib/python3.14/site-packages/numpy/lib/_nanfunctions_impl.py:1215: RuntimeWarning: All-NaN slice encountered
  return fnb._ureduce(a, func=_nanmedian, keepdims=keepdims,
/bsuscratch/alexanderemert/miniforge3/envs/starform-alex/lib/python3.14/site-packages/numpy/lib/_nanfunctions_impl.py:1396: RuntimeWarning: All-NaN slice encountered
  return _nanquantile_unchecked(
/bsuscratch/alexanderemert/miniforge3/envs/starform-alex/lib/python3.14/site-packages/numpy/lib/_nanfunctions_impl.py:1215: RuntimeWarning: All-NaN slice encountered
  return fnb._ureduce(a, func=_nanmedian, keepdims=keepdims,
/bsuscratch/alexanderemert/miniforge3/envs/starform-alex/lib/python3.14/site-packages/numpy/lib/_nanfunctions_impl.py:1396: RuntimeWarning: All-NaN slice encountered
  return _nanquantile_unchecked(
/bsuscratch/alexanderemert/miniforge3/envs/starform-alex/lib/python3.14/site-packages/numpy/lib/_nanfunctions_impl.py:1215: RuntimeWarning: All-NaN slice encountered
  return fnb._ureduce(a, func=_nanmedian, keepdims=keepdims,
/bsuscratch/alexanderemert/miniforge3/envs/starform-alex/lib/python3.14/site-packages/numpy/lib/_nanfunctions_impl.py:1396: RuntimeWarning: All-NaN slice encountered
  return _nanquantile_unchecked(
