[I 2026-07-20 18:19:53,238] Trial 21 finished with value: -3.8237204915596545 and parameters: {'error_threshold': 4.6, 'scalers': 'standard', 'ratios': 'log_ratio', 'imputers': 'none', 'n_estimators': 1650, 'learning_rate': 0.006283307376419442, 'max_depth': 10, 'min_child_weight': 9, 'subsample': 0.5, 'colsample_bytree': 0.5, 'colsample_bylevel': 1.0, 'reg_alpha': 1.61874560605863e-06, 'reg_lambda': 82.22936762619995, 'gamma': 0.008154114184366014}. Best is trial 9 with value: -3.821424554703333.
/bsuhome/alexanderemert/Research/Star-Formation-Research-Project-2026/pipeline/scripts/optuna/final_preds_and_models/optuna_search_mult_quant_reg.py:161: UserWarning: The distribution is specified by [0.1, 5] and step=0.25, but the range is not divisible by `step`. It will be replaced with [0.1, 4.85].
  error_threshold = trial.suggest_float("error_threshold", 0.1, 5, step=0.25)
[I 2026-07-20 18:20:21,482] Trial 15 finished with value: -3.8951307193208344 and parameters: {'error_threshold': 0.85, 'scalers': 'none', 'ratios': 'norm_ratio', 'imputers': 'mean', 'n_estimators': 1850, 'learning_rate': 0.0009315892040260515, 'max_depth': 12, 'min_child_weight': 5, 'subsample': 1.0, 'colsample_bytree': 0.9, 'colsample_bylevel': 0.6, 'reg_alpha': 7.262408877039712e-05, 'reg_lambda': 2.855266678878562e-06, 'gamma': 0.00014530006109137177}. Best is trial 9 with value: -3.821424554703333.
/bsuhome/alexanderemert/Research/Star-Formation-Research-Project-2026/pipeline/scripts/optuna/final_preds_and_models/optuna_search_mult_quant_reg.py:161: UserWarning: The distribution is specified by [0.1, 5] and step=0.25, but the range is not divisible by `step`. It will be replaced with [0.1, 4.85].
  error_threshold = trial.suggest_float("error_threshold", 0.1, 5, step=0.25)
[I 2026-07-20 18:20:31,202] Trial 22 finished with value: -3.839512583642762 and parameters: {'error_threshold': 4.85, 'scalers': 'standard', 'ratios': 'log_ratio', 'imputers': 'none', 'n_estimators': 1550, 'learning_rate': 0.002821577666595385, 'max_depth': 11, 'min_child_weight': 3, 'subsample': 0.5, 'colsample_bytree': 0.5, 'colsample_bylevel': 1.0, 'reg_alpha': 1.6635897233782181e-06, 'reg_lambda': 96.46315775711768, 'gamma': 0.00176669458914461}. Best is trial 9 with value: -3.821424554703333.
/bsuhome/alexanderemert/Research/Star-Formation-Research-Project-2026/pipeline/scripts/optuna/final_preds_and_models/optuna_search_mult_quant_reg.py:161: UserWarning: The distribution is specified by [0.1, 5] and step=0.25, but the range is not divisible by `step`. It will be replaced with [0.1, 4.85].
  error_threshold = trial.suggest_float("error_threshold", 0.1, 5, step=0.25)
[I 2026-07-20 18:20:36,177] Trial 25 finished with value: -3.837751142456657 and parameters: {'error_threshold': 3.6, 'scalers': 'standard', 'ratios': 'log_ratio', 'imputers': 'none', 'n_estimators': 1750, 'learning_rate': 0.0013458299019349612, 'max_depth': 9, 'min_child_weight': 8, 'subsample': 0.8, 'colsample_bytree': 0.5, 'colsample_bylevel': 0.8, 'reg_alpha': 47.32159166456018, 'reg_lambda': 0.0009529552596346937, 'gamma': 0.005328481140761409}. Best is trial 9 with value: -3.821424554703333.
/bsuhome/alexanderemert/Research/Star-Formation-Research-Project-2026/pipeline/scripts/optuna/final_preds_and_models/optuna_search_mult_quant_reg.py:161: UserWarning: The distribution is specified by [0.1, 5] and step=0.25, but the range is not divisible by `step`. It will be replaced with [0.1, 4.85].
  error_threshold = trial.suggest_float("error_threshold", 0.1, 5, step=0.25)
[I 2026-07-20 18:20:42,817] Trial 23 finished with value: -3.8370927591890767 and parameters: {'error_threshold': 4.6, 'scalers': 'standard', 'ratios': 'log_ratio', 'imputers': 'none', 'n_estimators': 1600, 'learning_rate': 0.0059266440666524735, 'max_depth': 10, 'min_child_weight': 8, 'subsample': 0.5, 'colsample_bytree': 0.5, 'colsample_bylevel': 1.0, 'reg_alpha': 2.7092827606333682e-06, 'reg_lambda': 41.61839296144696, 'gamma': 0.007115640696560767}. Best is trial 9 with value: -3.821424554703333.
/bsuhome/alexanderemert/Research/Star-Formation-Research-Project-2026/pipeline/scripts/optuna/final_preds_and_models/optuna_search_mult_quant_reg.py:161: UserWarning: The distribution is specified by [0.1, 5] and step=0.25, but the range is not divisible by `step`. It will be replaced with [0.1, 4.85].
  error_threshold = trial.suggest_float("error_threshold", 0.1, 5, step=0.25)
[I 2026-07-20 18:20:49,530] Trial 24 finished with value: -3.9350944334492524 and parameters: {'error_threshold': 3.85, 'scalers': 'standard', 'ratios': 'log_ratio', 'imputers': 'none', 'n_estimators': 1650, 'learning_rate': 0.00632600558066435, 'max_depth': 10, 'min_child_weight': 8, 'subsample': 0.5, 'colsample_bytree': 0.5, 'colsample_bylevel': 1.0, 'reg_alpha': 0.0005001971525412901, 'reg_lambda': 0.0009726776485229758, 'gamma': 0.00750021869843692}. Best is trial 9 with value: -3.821424554703333.
/bsuhome/alexanderemert/Research/Star-Formation-Research-Project-2026/pipeline/scripts/optuna/final_preds_and_models/optuna_search_mult_quant_reg.py:161: UserWarning: The distribution is specified by [0.1, 5] and step=0.25, but the range is not divisible by `step`. It will be replaced with [0.1, 4.85].
  error_threshold = trial.suggest_float("error_threshold", 0.1, 5, step=0.25)
[I 2026-07-20 18:20:52,689] Trial 26 finished with value: -3.8988697777090913 and parameters: {'error_threshold': 3.6, 'scalers': 'standard', 'ratios': 'log_ratio', 'imputers': 'none', 'n_estimators': 1500, 'learning_rate': 0.0012696778240386304, 'max_depth': 9, 'min_child_weight': 8, 'subsample': 0.8, 'colsample_bytree': 0.5, 'colsample_bylevel': 0.8, 'reg_alpha': 93.03607736558223, 'reg_lambda': 0.0001383593022225347, 'gamma': 0.00021798683452354934}. Best is trial 9 with value: -3.821424554703333.
/bsuhome/alexanderemert/Research/Star-Formation-Research-Project-2026/pipeline/scripts/optuna/final_preds_and_models/optuna_search_mult_quant_reg.py:161: UserWarning: The distribution is specified by [0.1, 5] and step=0.25, but the range is not divisible by `step`. It will be replaced with [0.1, 4.85].
  error_threshold = trial.suggest_float("error_threshold", 0.1, 5, step=0.25)
[I 2026-07-20 18:20:57,615] Trial 27 finished with value: -3.849540093128768 and parameters: {'error_threshold': 3.6, 'scalers': 'standard', 'ratios': 'log_ratio', 'imputers': 'none', 'n_estimators': 1550, 'learning_rate': 0.0014820871195344607, 'max_depth': 9, 'min_child_weight': 7, 'subsample': 0.8, 'colsample_bytree': 0.7, 'colsample_bylevel': 0.8, 'reg_alpha': 79.84570202124065, 'reg_lambda': 0.0006801629096048998, 'gamma': 0.0001611610768296812}. Best is trial 9 with value: -3.821424554703333.
/bsuhome/alexanderemert/Research/Star-Formation-Research-Project-2026/pipeline/scripts/optuna/final_preds_and_models/optuna_search_mult_quant_reg.py:161: UserWarning: The distribution is specified by [0.1, 5] and step=0.25, but the range is not divisible by `step`. It will be replaced with [0.1, 4.85].
  error_threshold = trial.suggest_float("error_threshold", 0.1, 5, step=0.25)
[I 2026-07-20 18:21:00,216] Trial 28 finished with value: -3.8841490221177817 and parameters: {'error_threshold': 3.35, 'scalers': 'standard', 'ratios': 'log_ratio', 'imputers': 'none', 'n_estimators': 1550, 'learning_rate': 0.0016890355561711959, 'max_depth': 10, 'min_child_weight': 8, 'subsample': 0.5, 'colsample_bytree': 0.5, 'colsample_bylevel': 0.8, 'reg_alpha': 97.47243662315198, 'reg_lambda': 0.001770850849927004, 'gamma': 0.00021006581455013996}. Best is trial 9 with value: -3.821424554703333.
/bsuhome/alexanderemert/Research/Star-Formation-Research-Project-2026/pipeline/scripts/optuna/final_preds_and_models/optuna_search_mult_quant_reg.py:161: UserWarning: The distribution is specified by [0.1, 5] and step=0.25, but the range is not divisible by `step`. It will be replaced with [0.1, 4.85].
  error_threshold = trial.suggest_float("error_threshold", 0.1, 5, step=0.25)
[I 2026-07-20 18:21:04,698] Trial 29 finished with value: -4.052578527632253 and parameters: {'error_threshold': 3.6, 'scalers': 'standard', 'ratios': 'log_ratio', 'imputers': 'none', 'n_estimators': 1450, 'learning_rate': 0.01741119270128139, 'max_depth': 9, 'min_child_weight': 8, 'subsample': 0.5, 'colsample_bytree': 0.5, 'colsample_bylevel': 0.8, 'reg_alpha': 0.0012104714546234496, 'reg_lambda': 0.0009318621357437177, 'gamma': 0.03162992767838807}. Best is trial 9 with value: -3.821424554703333.
/bsuhome/alexanderemert/Research/Star-Formation-Research-Project-2026/pipeline/scripts/optuna/final_preds_and_models/optuna_search_mult_quant_reg.py:161: UserWarning: The distribution is specified by [0.1, 5] and step=0.25, but the range is not divisible by `step`. It will be replaced with [0.1, 4.85].
  error_threshold = trial.suggest_float("error_threshold", 0.1, 5, step=0.25)
[I 2026-07-20 18:21:10,548] Trial 30 finished with value: -4.022291645768386 and parameters: {'error_threshold': 3.85, 'scalers': 'standard', 'ratios': 'log_ratio', 'imputers': 'none', 'n_estimators': 1400, 'learning_rate': 0.017436020602202028, 'max_depth': 9, 'min_child_weight': 8, 'subsample': 0.8, 'colsample_bytree': 0.7, 'colsample_bylevel': 0.8, 'reg_alpha': 0.0006357098238614758, 'reg_lambda': 0.0009418656973864537, 'gamma': 0.03038081605393422}. Best is trial 9 with value: -3.821424554703333.
/bsuhome/alexanderemert/Research/Star-Formation-Research-Project-2026/pipeline/scripts/optuna/final_preds_and_models/optuna_search_mult_quant_reg.py:161: UserWarning: The distribution is specified by [0.1, 5] and step=0.25, but the range is not divisible by `step`. It will be replaced with [0.1, 4.85].
  error_threshold = trial.suggest_float("error_threshold", 0.1, 5, step=0.25)
[I 2026-07-20 18:21:16,093] Trial 31 finished with value: -4.013557790628999 and parameters: {'error_threshold': 3.85, 'scalers': 'standard', 'ratios': 'log_ratio', 'imputers': 'none', 'n_estimators': 1300, 'learning_rate': 0.014765750436204988, 'max_depth': 9, 'min_child_weight': 7, 'subsample': 0.6, 'colsample_bytree': 0.7, 'colsample_bylevel': 0.8, 'reg_alpha': 0.0011094170500780057, 'reg_lambda': 0.00027218298090066055, 'gamma': 0.02737423800296775}. Best is trial 9 with value: -3.821424554703333.
/bsuhome/alexanderemert/Research/Star-Formation-Research-Project-2026/pipeline/scripts/optuna/final_preds_and_models/optuna_search_mult_quant_reg.py:161: UserWarning: The distribution is specified by [0.1, 5] and step=0.25, but the range is not divisible by `step`. It will be replaced with [0.1, 4.85].
  error_threshold = trial.suggest_float("error_threshold", 0.1, 5, step=0.25)
[I 2026-07-20 18:21:21,477] Trial 32 finished with value: -4.029028902258392 and parameters: {'error_threshold': 3.6, 'scalers': 'standard', 'ratios': 'log_ratio', 'imputers': 'none', 'n_estimators': 1300, 'learning_rate': 0.016773289699632755, 'max_depth': 9, 'min_child_weight': 7, 'subsample': 0.6, 'colsample_bytree': 0.7, 'colsample_bylevel': 0.8, 'reg_alpha': 0.001298279586595889, 'reg_lambda': 9.076305032209276e-05, 'gamma': 0.028851526709490885}. Best is trial 9 with value: -3.821424554703333.
/bsuhome/alexanderemert/Research/Star-Formation-Research-Project-2026/pipeline/scripts/optuna/final_preds_and_models/optuna_search_mult_quant_reg.py:161: UserWarning: The distribution is specified by [0.1, 5] and step=0.25, but the range is not divisible by `step`. It will be replaced with [0.1, 4.85].
  error_threshold = trial.suggest_float("error_threshold", 0.1, 5, step=0.25)
[I 2026-07-20 18:21:26,217] Trial 33 finished with value: -4.029344577222218 and parameters: {'error_threshold': 3.85, 'scalers': 'standard', 'ratios': 'log_ratio', 'imputers': 'none', 'n_estimators': 1300, 'learning_rate': 0.02031822672625986, 'max_depth': 8, 'min_child_weight': 7, 'subsample': 0.6, 'colsample_bytree': 0.7, 'colsample_bylevel': 0.8, 'reg_alpha': 0.0016439143742799159, 'reg_lambda': 5.218874306939101, 'gamma': 0.000398727208685057}. Best is trial 9 with value: -3.821424554703333.
/bsuhome/alexanderemert/Research/Star-Formation-Research-Project-2026/pipeline/scripts/optuna/final_preds_and_models/optuna_search_mult_quant_reg.py:161: UserWarning: The distribution is specified by [0.1, 5] and step=0.25, but the range is not divisible by `step`. It will be replaced with [0.1, 4.85].
  error_threshold = trial.suggest_float("error_threshold", 0.1, 5, step=0.25)
[I 2026-07-20 18:21:31,582] Trial 34 finished with value: -4.006769917244841 and parameters: {'error_threshold': 2.85, 'scalers': 'standard', 'ratios': 'log_ratio', 'imputers': 'none', 'n_estimators': 1300, 'learning_rate': 0.01649659681000687, 'max_depth': 8, 'min_child_weight': 7, 'subsample': 0.6, 'colsample_bytree': 0.7, 'colsample_bylevel': 0.9, 'reg_alpha': 0.0013193554791008258, 'reg_lambda': 7.3519151237290785, 'gamma': 0.049142674987131735}. Best is trial 9 with value: -3.821424554703333.
/bsuhome/alexanderemert/Research/Star-Formation-Research-Project-2026/pipeline/scripts/optuna/final_preds_and_models/optuna_search_mult_quant_reg.py:161: UserWarning: The distribution is specified by [0.1, 5] and step=0.25, but the range is not divisible by `step`. It will be replaced with [0.1, 4.85].
  error_threshold = trial.suggest_float("error_threshold", 0.1, 5, step=0.25)
[I 2026-07-20 18:21:37,492] Trial 35 finished with value: -4.0148799609641825 and parameters: {'error_threshold': 2.85, 'scalers': 'standard', 'ratios': 'log_ratio', 'imputers': 'none', 'n_estimators': 1200, 'learning_rate': 0.017944599482383916, 'max_depth': 8, 'min_child_weight': 6, 'subsample': 0.6, 'colsample_bytree': 0.8, 'colsample_bylevel': 0.9, 'reg_alpha': 0.0014333271499787736, 'reg_lambda': 5.997222742817391, 'gamma': 0.11486807326177158}. Best is trial 9 with value: -3.821424554703333.
/bsuhome/alexanderemert/Research/Star-Formation-Research-Project-2026/pipeline/scripts/optuna/final_preds_and_models/optuna_search_mult_quant_reg.py:161: UserWarning: The distribution is specified by [0.1, 5] and step=0.25, but the range is not divisible by `step`. It will be replaced with [0.1, 4.85].
  error_threshold = trial.suggest_float("error_threshold", 0.1, 5, step=0.25)
[I 2026-07-20 18:21:42,156] Trial 36 finished with value: -3.920762141511622 and parameters: {'error_threshold': 2.85, 'scalers': 'standard', 'ratios': 'norm_ratio', 'imputers': 'none', 'n_estimators': 1150, 'learning_rate': 0.01135130546929433, 'max_depth': 8, 'min_child_weight': 6, 'subsample': 0.9, 'colsample_bytree': 0.6, 'colsample_bylevel': 0.9, 'reg_alpha': 0.0019540794660569826, 'reg_lambda': 6.949177722424794, 'gamma': 0.0680605757595852}. Best is trial 9 with value: -3.821424554703333.
/bsuhome/alexanderemert/Research/Star-Formation-Research-Project-2026/pipeline/scripts/optuna/final_preds_and_models/optuna_search_mult_quant_reg.py:161: UserWarning: The distribution is specified by [0.1, 5] and step=0.25, but the range is not divisible by `step`. It will be replaced with [0.1, 4.85].
  error_threshold = trial.suggest_float("error_threshold", 0.1, 5, step=0.25)
[I 2026-07-20 18:21:47,855] Trial 37 finished with value: -3.94595430677341 and parameters: {'error_threshold': 2.6, 'scalers': 'standard', 'ratios': 'norm_ratio', 'imputers': 'mean', 'n_estimators': 1150, 'learning_rate': 0.01132142707240085, 'max_depth': 8, 'min_child_weight': 6, 'subsample': 0.9, 'colsample_bytree': 0.8, 'colsample_bylevel': 0.9, 'reg_alpha': 3.911822238759498e-05, 'reg_lambda': 5.567338398640963, 'gamma': 0.037853168638958476}. Best is trial 9 with value: -3.821424554703333.
/bsuhome/alexanderemert/Research/Star-Formation-Research-Project-2026/pipeline/scripts/optuna/final_preds_and_models/optuna_search_mult_quant_reg.py:161: UserWarning: The distribution is specified by [0.1, 5] and step=0.25, but the range is not divisible by `step`. It will be replaced with [0.1, 4.85].
  error_threshold = trial.suggest_float("error_threshold", 0.1, 5, step=0.25)
[I 2026-07-20 18:21:52,829] Trial 38 finished with value: -3.9310536778032508 and parameters: {'error_threshold': 4.1, 'scalers': 'standard', 'ratios': 'log_ratio', 'imputers': 'none', 'n_estimators': 1250, 'learning_rate': 0.01130835361959637, 'max_depth': 8, 'min_child_weight': 6, 'subsample': 0.6, 'colsample_bytree': 0.6, 'colsample_bylevel': 0.9, 'reg_alpha': 1.5100828130326769e-05, 'reg_lambda': 10.728697808475145, 'gamma': 0.0008378637796317848}. Best is trial 9 with value: -3.821424554703333.
/bsuhome/alexanderemert/Research/Star-Formation-Research-Project-2026/pipeline/scripts/optuna/final_preds_and_models/optuna_search_mult_quant_reg.py:161: UserWarning: The distribution is specified by [0.1, 5] and step=0.25, but the range is not divisible by `step`. It will be replaced with [0.1, 4.85].
  error_threshold = trial.suggest_float("error_threshold", 0.1, 5, step=0.25)
[I 2026-07-20 18:21:55,825] Trial 39 finished with value: -3.897110547042073 and parameters: {'error_threshold': 2.85, 'scalers': 'standard', 'ratios': 'log_ratio', 'imputers': 'none', 'n_estimators': 1000, 'learning_rate': 0.011307599162635542, 'max_depth': 7, 'min_child_weight': 6, 'subsample': 0.6, 'colsample_bytree': 0.6, 'colsample_bylevel': 0.9, 'reg_alpha': 1.2492080435897983e-05, 'reg_lambda': 7.735441330596349, 'gamma': 0.0005404321366857366}. Best is trial 9 with value: -3.821424554703333.
/bsuhome/alexanderemert/Research/Star-Formation-Research-Project-2026/pipeline/scripts/optuna/final_preds_and_models/optuna_search_mult_quant_reg.py:161: UserWarning: The distribution is specified by [0.1, 5] and step=0.25, but the range is not divisible by `step`. It will be replaced with [0.1, 4.85].
  error_threshold = trial.suggest_float("error_threshold", 0.1, 5, step=0.25)
[I 2026-07-20 18:21:57,835] Trial 40 finished with value: -3.8371923152749816 and parameters: {'error_threshold': 2.6, 'scalers': 'standard', 'ratios': 'log_ratio', 'imputers': 'mean', 'n_estimators': 1100, 'learning_rate': 0.010952095173355084, 'max_depth': 7, 'min_child_weight': 6, 'subsample': 0.9, 'colsample_bytree': 0.6, 'colsample_bylevel': 0.9, 'reg_alpha': 1.4806315300138585e-05, 'reg_lambda': 10.678905743931333, 'gamma': 15.338109718288528}. Best is trial 9 with value: -3.821424554703333.
/bsuhome/alexanderemert/Research/Star-Formation-Research-Project-2026/pipeline/scripts/optuna/final_preds_and_models/optuna_search_mult_quant_reg.py:161: UserWarning: The distribution is specified by [0.1, 5] and step=0.25, but the range is not divisible by `step`. It will be replaced with [0.1, 4.85].
  error_threshold = trial.suggest_float("error_threshold", 0.1, 5, step=0.25)
[I 2026-07-20 18:22:03,222] Trial 41 finished with value: -4.122243442896305 and parameters: {'error_threshold': 2.6, 'scalers': 'standard', 'ratios': 'norm_ratio', 'imputers': 'mean', 'n_estimators': 1000, 'learning_rate': 0.0006358296228992163, 'max_depth': 8, 'min_child_weight': 6, 'subsample': 0.9, 'colsample_bytree': 0.6, 'colsample_bylevel': 0.9, 'reg_alpha': 9.347193819440783e-06, 'reg_lambda': 5.70343987890512, 'gamma': 0.0009181793424815204}. Best is trial 9 with value: -3.821424554703333.
/bsuhome/alexanderemert/Research/Star-Formation-Research-Project-2026/pipeline/scripts/optuna/final_preds_and_models/optuna_search_mult_quant_reg.py:161: UserWarning: The distribution is specified by [0.1, 5] and step=0.25, but the range is not divisible by `step`. It will be replaced with [0.1, 4.85].
  error_threshold = trial.suggest_float("error_threshold", 0.1, 5, step=0.25)
[I 2026-07-20 18:22:05,117] Trial 42 finished with value: -3.8011694370501554 and parameters: {'error_threshold': 4.35, 'scalers': 'robust', 'ratios': 'norm_ratio', 'imputers': 'mean', 'n_estimators': 1050, 'learning_rate': 0.002639481120240895, 'max_depth': 11, 'min_child_weight': 6, 'subsample': 0.9, 'colsample_bytree': 0.6, 'colsample_bylevel': 0.9, 'reg_alpha': 1.2434467962522436e-05, 'reg_lambda': 0.08263133453638973, 'gamma': 94.75241239063674}. Best is trial 42 with value: -3.8011694370501554.
/bsuhome/alexanderemert/Research/Star-Formation-Research-Project-2026/pipeline/scripts/optuna/final_preds_and_models/optuna_search_mult_quant_reg.py:161: UserWarning: The distribution is specified by [0.1, 5] and step=0.25, but the range is not divisible by `step`. It will be replaced with [0.1, 4.85].
  error_threshold = trial.suggest_float("error_threshold", 0.1, 5, step=0.25)
[I 2026-07-20 18:22:07,494] Trial 43 finished with value: -3.81349737450903 and parameters: {'error_threshold': 4.35, 'scalers': 'robust', 'ratios': 'norm_ratio', 'imputers': 'mean', 'n_estimators': 900, 'learning_rate': 0.002748258886252852, 'max_depth': 7, 'min_child_weight': 6, 'subsample': 0.9, 'colsample_bytree': 0.6, 'colsample_bylevel': 0.7, 'reg_alpha': 3.69625233455988e-05, 'reg_lambda': 0.11615837572138729, 'gamma': 33.98284112812186}. Best is trial 42 with value: -3.8011694370501554.
/bsuhome/alexanderemert/Research/Star-Formation-Research-Project-2026/pipeline/scripts/optuna/final_preds_and_models/optuna_search_mult_quant_reg.py:161: UserWarning: The distribution is specified by [0.1, 5] and step=0.25, but the range is not divisible by `step`. It will be replaced with [0.1, 4.85].
  error_threshold = trial.suggest_float("error_threshold", 0.1, 5, step=0.25)
