[I 2026-07-20 15:00:27,827] Trial 242 finished with value: -1.653721744684946 and parameters: {'error_threshold': 1.85, 'scalers': 'standard', 'ratios': 'log_ratio', 'imputers': 'none', 'n_estimators': 150, 'learning_rate': 0.00012254399047585153, 'max_depth': 6, 'min_child_weight': 5, 'subsample': 0.7, 'colsample_bytree': 0.5, 'colsample_bylevel': 0.8, 'reg_alpha': 0.021673246301426172, 'reg_lambda': 64.33648590757635, 'gamma': 56.18307280753864}. Best is trial 183 with value: -1.6583770069254369.
/bsuhome/alexanderemert/Research/Star-Formation-Research-Project-2026/pipeline/scripts/optuna/final_preds_and_models/optuna_search_mult_quant_reg.py:75: UserWarning: The distribution is specified by [0.1, 5] and step=0.25, but the range is not divisible by `step`. It will be replaced with [0.1, 4.85].
  error_threshold = trial.suggest_float("error_threshold", 0.1, 5, step=0.25)
[I 2026-07-20 15:00:28,739] Trial 235 finished with value: -1.6001952825235188 and parameters: {'error_threshold': 1.6, 'scalers': 'standard', 'ratios': 'log_ratio', 'imputers': 'mean', 'n_estimators': 1250, 'learning_rate': 0.0002110162967026519, 'max_depth': 6, 'min_child_weight': 5, 'subsample': 0.7, 'colsample_bytree': 0.5, 'colsample_bylevel': 0.8, 'reg_alpha': 0.032290498305106684, 'reg_lambda': 35.44122086088512, 'gamma': 60.70929232345815}. Best is trial 183 with value: -1.6583770069254369.
/bsuhome/alexanderemert/Research/Star-Formation-Research-Project-2026/pipeline/scripts/optuna/final_preds_and_models/optuna_search_mult_quant_reg.py:75: UserWarning: The distribution is specified by [0.1, 5] and step=0.25, but the range is not divisible by `step`. It will be replaced with [0.1, 4.85].
  error_threshold = trial.suggest_float("error_threshold", 0.1, 5, step=0.25)
[I 2026-07-20 15:00:30,960] Trial 243 finished with value: -1.6538051811807755 and parameters: {'error_threshold': 1.85, 'scalers': 'standard', 'ratios': 'log_ratio', 'imputers': 'none', 'n_estimators': 150, 'learning_rate': 0.00012042778533598177, 'max_depth': 6, 'min_child_weight': 5, 'subsample': 0.7, 'colsample_bytree': 0.5, 'colsample_bylevel': 0.8, 'reg_alpha': 0.003956928217139009, 'reg_lambda': 61.818063611315935, 'gamma': 51.092911372561964}. Best is trial 183 with value: -1.6583770069254369.
/bsuhome/alexanderemert/Research/Star-Formation-Research-Project-2026/pipeline/scripts/optuna/final_preds_and_models/optuna_search_mult_quant_reg.py:75: UserWarning: The distribution is specified by [0.1, 5] and step=0.25, but the range is not divisible by `step`. It will be replaced with [0.1, 4.85].
  error_threshold = trial.suggest_float("error_threshold", 0.1, 5, step=0.25)
[I 2026-07-20 15:00:31,263] Trial 245 finished with value: -1.6536498324777196 and parameters: {'error_threshold': 1.6, 'scalers': 'standard', 'ratios': 'log_ratio', 'imputers': 'none', 'n_estimators': 150, 'learning_rate': 0.00012292235642474725, 'max_depth': 6, 'min_child_weight': 6, 'subsample': 0.7, 'colsample_bytree': 0.5, 'colsample_bylevel': 0.8, 'reg_alpha': 0.00363045176872279, 'reg_lambda': 64.81775670243152, 'gamma': 46.72519172973918}. Best is trial 183 with value: -1.6583770069254369.
/bsuhome/alexanderemert/Research/Star-Formation-Research-Project-2026/pipeline/scripts/optuna/final_preds_and_models/optuna_search_mult_quant_reg.py:75: UserWarning: The distribution is specified by [0.1, 5] and step=0.25, but the range is not divisible by `step`. It will be replaced with [0.1, 4.85].
  error_threshold = trial.suggest_float("error_threshold", 0.1, 5, step=0.25)
[I 2026-07-20 15:00:31,377] Trial 246 finished with value: -1.6539443812028978 and parameters: {'error_threshold': 3.35, 'scalers': 'standard', 'ratios': 'log_ratio', 'imputers': 'mean', 'n_estimators': 150, 'learning_rate': 0.00012004940256673535, 'max_depth': 6, 'min_child_weight': 6, 'subsample': 0.7, 'colsample_bytree': 0.5, 'colsample_bylevel': 0.8, 'reg_alpha': 0.004709683529960068, 'reg_lambda': 64.39925331158487, 'gamma': 69.46053502294505}. Best is trial 183 with value: -1.6583770069254369.
/bsuhome/alexanderemert/Research/Star-Formation-Research-Project-2026/pipeline/scripts/optuna/final_preds_and_models/optuna_search_mult_quant_reg.py:75: UserWarning: The distribution is specified by [0.1, 5] and step=0.25, but the range is not divisible by `step`. It will be replaced with [0.1, 4.85].
  error_threshold = trial.suggest_float("error_threshold", 0.1, 5, step=0.25)
[I 2026-07-20 15:00:35,695] Trial 237 finished with value: -1.5812055554955862 and parameters: {'error_threshold': 1.6, 'scalers': 'standard', 'ratios': 'log_ratio', 'imputers': 'none', 'n_estimators': 2950, 'learning_rate': 0.00012673559406391096, 'max_depth': 6, 'min_child_weight': 5, 'subsample': 0.7, 'colsample_bytree': 0.5, 'colsample_bylevel': 0.8, 'reg_alpha': 0.02574939666361686, 'reg_lambda': 65.02147082106917, 'gamma': 59.4844661786907}. Best is trial 183 with value: -1.6583770069254369.
/bsuhome/alexanderemert/Research/Star-Formation-Research-Project-2026/pipeline/scripts/optuna/final_preds_and_models/optuna_search_mult_quant_reg.py:75: UserWarning: The distribution is specified by [0.1, 5] and step=0.25, but the range is not divisible by `step`. It will be replaced with [0.1, 4.85].
  error_threshold = trial.suggest_float("error_threshold", 0.1, 5, step=0.25)
[I 2026-07-20 15:00:35,976] Trial 247 finished with value: -1.6522242789377595 and parameters: {'error_threshold': 3.35, 'scalers': 'standard', 'ratios': 'log_ratio', 'imputers': 'none', 'n_estimators': 150, 'learning_rate': 0.00016776801280241, 'max_depth': 6, 'min_child_weight': 6, 'subsample': 0.7, 'colsample_bytree': 0.5, 'colsample_bylevel': 0.8, 'reg_alpha': 0.05602428314200803, 'reg_lambda': 65.96135189175314, 'gamma': 68.48261200514771}. Best is trial 183 with value: -1.6583770069254369.
/bsuhome/alexanderemert/Research/Star-Formation-Research-Project-2026/pipeline/scripts/optuna/final_preds_and_models/optuna_search_mult_quant_reg.py:75: UserWarning: The distribution is specified by [0.1, 5] and step=0.25, but the range is not divisible by `step`. It will be replaced with [0.1, 4.85].
  error_threshold = trial.suggest_float("error_threshold", 0.1, 5, step=0.25)
[I 2026-07-20 15:00:36,079] Trial 248 finished with value: -1.6539927336317823 and parameters: {'error_threshold': 3.35, 'scalers': 'standard', 'ratios': 'log_ratio', 'imputers': 'none', 'n_estimators': 150, 'learning_rate': 0.00011929463746001254, 'max_depth': 6, 'min_child_weight': 6, 'subsample': 0.7, 'colsample_bytree': 0.5, 'colsample_bylevel': 0.8, 'reg_alpha': 0.0036958206611717023, 'reg_lambda': 15.647136643001124, 'gamma': 72.92574226776574}. Best is trial 183 with value: -1.6583770069254369.
/bsuhome/alexanderemert/Research/Star-Formation-Research-Project-2026/pipeline/scripts/optuna/final_preds_and_models/optuna_search_mult_quant_reg.py:75: UserWarning: The distribution is specified by [0.1, 5] and step=0.25, but the range is not divisible by `step`. It will be replaced with [0.1, 4.85].
  error_threshold = trial.suggest_float("error_threshold", 0.1, 5, step=0.25)
[I 2026-07-20 15:00:36,413] Trial 249 finished with value: -1.6540550136966778 and parameters: {'error_threshold': 3.35, 'scalers': 'standard', 'ratios': 'log_ratio', 'imputers': 'none', 'n_estimators': 150, 'learning_rate': 0.00011747188112432877, 'max_depth': 6, 'min_child_weight': 6, 'subsample': 0.7, 'colsample_bytree': 0.5, 'colsample_bylevel': 0.8, 'reg_alpha': 0.018058884102258074, 'reg_lambda': 17.082847146557008, 'gamma': 72.22557260830058}. Best is trial 183 with value: -1.6583770069254369.
/bsuhome/alexanderemert/Research/Star-Formation-Research-Project-2026/pipeline/scripts/optuna/final_preds_and_models/optuna_search_mult_quant_reg.py:75: UserWarning: The distribution is specified by [0.1, 5] and step=0.25, but the range is not divisible by `step`. It will be replaced with [0.1, 4.85].
  error_threshold = trial.suggest_float("error_threshold", 0.1, 5, step=0.25)
[I 2026-07-20 15:00:37,936] Trial 244 finished with value: -1.5820857565223267 and parameters: {'error_threshold': 1.85, 'scalers': 'standard', 'ratios': 'log_ratio', 'imputers': 'none', 'n_estimators': 2950, 'learning_rate': 0.00012115457819468079, 'max_depth': 6, 'min_child_weight': 6, 'subsample': 0.7, 'colsample_bytree': 0.5, 'colsample_bylevel': 0.8, 'reg_alpha': 0.004475115205700875, 'reg_lambda': 63.10329881533331, 'gamma': 49.788020103448694}. Best is trial 183 with value: -1.6583770069254369.
/bsuhome/alexanderemert/Research/Star-Formation-Research-Project-2026/pipeline/scripts/optuna/final_preds_and_models/optuna_search_mult_quant_reg.py:75: UserWarning: The distribution is specified by [0.1, 5] and step=0.25, but the range is not divisible by `step`. It will be replaced with [0.1, 4.85].
  error_threshold = trial.suggest_float("error_threshold", 0.1, 5, step=0.25)
[I 2026-07-20 15:00:38,161] Trial 250 finished with value: -1.6539979160181002 and parameters: {'error_threshold': 3.35, 'scalers': 'standard', 'ratios': 'log_ratio', 'imputers': 'none', 'n_estimators': 150, 'learning_rate': 0.00011868261662097754, 'max_depth': 6, 'min_child_weight': 6, 'subsample': 0.7, 'colsample_bytree': 0.5, 'colsample_bylevel': 0.8, 'reg_alpha': 0.01832769963599742, 'reg_lambda': 15.891475865612719, 'gamma': 76.84406898889604}. Best is trial 183 with value: -1.6583770069254369.
/bsuhome/alexanderemert/Research/Star-Formation-Research-Project-2026/pipeline/scripts/optuna/final_preds_and_models/optuna_search_mult_quant_reg.py:75: UserWarning: The distribution is specified by [0.1, 5] and step=0.25, but the range is not divisible by `step`. It will be replaced with [0.1, 4.85].
  error_threshold = trial.suggest_float("error_threshold", 0.1, 5, step=0.25)
[I 2026-07-20 15:00:38,330] Trial 251 finished with value: -1.6546861675781699 and parameters: {'error_threshold': 3.35, 'scalers': 'standard', 'ratios': 'log_ratio', 'imputers': 'none', 'n_estimators': 150, 'learning_rate': 0.00010029759899244697, 'max_depth': 6, 'min_child_weight': 6, 'subsample': 0.7, 'colsample_bytree': 0.5, 'colsample_bylevel': 0.8, 'reg_alpha': 0.01726542797166211, 'reg_lambda': 17.211876927356652, 'gamma': 72.44485214934033}. Best is trial 183 with value: -1.6583770069254369.
/bsuhome/alexanderemert/Research/Star-Formation-Research-Project-2026/pipeline/scripts/optuna/final_preds_and_models/optuna_search_mult_quant_reg.py:75: UserWarning: The distribution is specified by [0.1, 5] and step=0.25, but the range is not divisible by `step`. It will be replaced with [0.1, 4.85].
  error_threshold = trial.suggest_float("error_threshold", 0.1, 5, step=0.25)
[I 2026-07-20 15:00:38,416] Trial 252 finished with value: -1.6542661877398432 and parameters: {'error_threshold': 3.35, 'scalers': 'standard', 'ratios': 'log_ratio', 'imputers': 'none', 'n_estimators': 100, 'learning_rate': 0.0001646082145829852, 'max_depth': 6, 'min_child_weight': 6, 'subsample': 0.7, 'colsample_bytree': 0.5, 'colsample_bylevel': 0.8, 'reg_alpha': 0.01682284302820275, 'reg_lambda': 16.135444020187528, 'gamma': 74.00488937505536}. Best is trial 183 with value: -1.6583770069254369.
/bsuhome/alexanderemert/Research/Star-Formation-Research-Project-2026/pipeline/scripts/optuna/final_preds_and_models/optuna_search_mult_quant_reg.py:75: UserWarning: The distribution is specified by [0.1, 5] and step=0.25, but the range is not divisible by `step`. It will be replaced with [0.1, 4.85].
  error_threshold = trial.suggest_float("error_threshold", 0.1, 5, step=0.25)
[I 2026-07-20 15:00:39,690] Trial 253 finished with value: -1.6542470530840596 and parameters: {'error_threshold': 3.35, 'scalers': 'standard', 'ratios': 'log_ratio', 'imputers': 'none', 'n_estimators': 100, 'learning_rate': 0.00016550349078800768, 'max_depth': 6, 'min_child_weight': 6, 'subsample': 0.7, 'colsample_bytree': 0.5, 'colsample_bylevel': 0.8, 'reg_alpha': 0.017568175905227995, 'reg_lambda': 17.725941119122872, 'gamma': 76.78095016660666}. Best is trial 183 with value: -1.6583770069254369.
/bsuhome/alexanderemert/Research/Star-Formation-Research-Project-2026/pipeline/scripts/optuna/final_preds_and_models/optuna_search_mult_quant_reg.py:75: UserWarning: The distribution is specified by [0.1, 5] and step=0.25, but the range is not divisible by `step`. It will be replaced with [0.1, 4.85].
  error_threshold = trial.suggest_float("error_threshold", 0.1, 5, step=0.25)
[I 2026-07-20 15:00:40,024] Trial 254 finished with value: -1.6570617539890051 and parameters: {'error_threshold': 3.35, 'scalers': 'standard', 'ratios': 'log_ratio', 'imputers': 'none', 'n_estimators': 100, 'learning_rate': 0.00010114766699908179, 'max_depth': 6, 'min_child_weight': 6, 'subsample': 0.7, 'colsample_bytree': 0.5, 'colsample_bylevel': 0.8, 'reg_alpha': 0.017363795288999295, 'reg_lambda': 16.735552460010727, 'gamma': 98.28839916160898}. Best is trial 183 with value: -1.6583770069254369.
/bsuhome/alexanderemert/Research/Star-Formation-Research-Project-2026/pipeline/scripts/optuna/final_preds_and_models/optuna_search_mult_quant_reg.py:75: UserWarning: The distribution is specified by [0.1, 5] and step=0.25, but the range is not divisible by `step`. It will be replaced with [0.1, 4.85].
  error_threshold = trial.suggest_float("error_threshold", 0.1, 5, step=0.25)
[I 2026-07-20 15:00:40,743] Trial 256 finished with value: -1.6543447535876643 and parameters: {'error_threshold': 3.35, 'scalers': 'standard', 'ratios': 'log_ratio', 'imputers': 'none', 'n_estimators': 100, 'learning_rate': 0.00015442916448473915, 'max_depth': 6, 'min_child_weight': 6, 'subsample': 0.7, 'colsample_bytree': 0.5, 'colsample_bylevel': 0.8, 'reg_alpha': 0.016551837371181915, 'reg_lambda': 21.055274334848672, 'gamma': 41.76440530274065}. Best is trial 183 with value: -1.6583770069254369.
/bsuhome/alexanderemert/Research/Star-Formation-Research-Project-2026/pipeline/scripts/optuna/final_preds_and_models/optuna_search_mult_quant_reg.py:75: UserWarning: The distribution is specified by [0.1, 5] and step=0.25, but the range is not divisible by `step`. It will be replaced with [0.1, 4.85].
  error_threshold = trial.suggest_float("error_threshold", 0.1, 5, step=0.25)
[I 2026-07-20 15:00:41,298] Trial 255 finished with value: -1.652547106527697 and parameters: {'error_threshold': 3.35, 'scalers': 'standard', 'ratios': 'log_ratio', 'imputers': 'none', 'n_estimators': 100, 'learning_rate': 0.00010200629257640855, 'max_depth': 6, 'min_child_weight': 6, 'subsample': 0.7, 'colsample_bytree': 0.5, 'colsample_bylevel': 0.8, 'reg_alpha': 0.01791580667280912, 'reg_lambda': 19.84831773103723, 'gamma': 0.00016598478937554539}. Best is trial 183 with value: -1.6583770069254369.
/bsuhome/alexanderemert/Research/Star-Formation-Research-Project-2026/pipeline/scripts/optuna/final_preds_and_models/optuna_search_mult_quant_reg.py:75: UserWarning: The distribution is specified by [0.1, 5] and step=0.25, but the range is not divisible by `step`. It will be replaced with [0.1, 4.85].
  error_threshold = trial.suggest_float("error_threshold", 0.1, 5, step=0.25)
[I 2026-07-20 15:00:41,612] Trial 257 finished with value: -1.6475510748326112 and parameters: {'error_threshold': 3.35, 'scalers': 'standard', 'ratios': 'log_ratio', 'imputers': 'none', 'n_estimators': 250, 'learning_rate': 0.00016104300705277396, 'max_depth': 6, 'min_child_weight': 8, 'subsample': 0.7, 'colsample_bytree': 0.5, 'colsample_bylevel': 0.8, 'reg_alpha': 0.017391984018774932, 'reg_lambda': 27.37216604527691, 'gamma': 38.424333119718035}. Best is trial 183 with value: -1.6583770069254369.
/bsuhome/alexanderemert/Research/Star-Formation-Research-Project-2026/pipeline/scripts/optuna/final_preds_and_models/optuna_search_mult_quant_reg.py:75: UserWarning: The distribution is specified by [0.1, 5] and step=0.25, but the range is not divisible by `step`. It will be replaced with [0.1, 4.85].
  error_threshold = trial.suggest_float("error_threshold", 0.1, 5, step=0.25)
[I 2026-07-20 15:00:41,765] Trial 258 finished with value: -1.6477680047653358 and parameters: {'error_threshold': 3.1, 'scalers': 'standard', 'ratios': 'log_ratio', 'imputers': 'none', 'n_estimators': 250, 'learning_rate': 0.00015695185373111337, 'max_depth': 6, 'min_child_weight': 6, 'subsample': 0.7, 'colsample_bytree': 0.5, 'colsample_bylevel': 0.8, 'reg_alpha': 0.015710353137606804, 'reg_lambda': 30.128474551135728, 'gamma': 36.40504428748662}. Best is trial 183 with value: -1.6583770069254369.
/bsuhome/alexanderemert/Research/Star-Formation-Research-Project-2026/pipeline/scripts/optuna/final_preds_and_models/optuna_search_mult_quant_reg.py:75: UserWarning: The distribution is specified by [0.1, 5] and step=0.25, but the range is not divisible by `step`. It will be replaced with [0.1, 4.85].
  error_threshold = trial.suggest_float("error_threshold", 0.1, 5, step=0.25)
[I 2026-07-20 15:00:41,916] Trial 259 finished with value: -1.6473319909314883 and parameters: {'error_threshold': 3.1, 'scalers': 'standard', 'ratios': 'log_ratio', 'imputers': 'none', 'n_estimators': 250, 'learning_rate': 0.0001643152453223419, 'max_depth': 6, 'min_child_weight': 6, 'subsample': 0.7, 'colsample_bytree': 0.5, 'colsample_bylevel': 0.8, 'reg_alpha': 0.011310953206110464, 'reg_lambda': 26.025114235497213, 'gamma': 38.293352950148545}. Best is trial 183 with value: -1.6583770069254369.
/bsuhome/alexanderemert/Research/Star-Formation-Research-Project-2026/pipeline/scripts/optuna/final_preds_and_models/optuna_search_mult_quant_reg.py:75: UserWarning: The distribution is specified by [0.1, 5] and step=0.25, but the range is not divisible by `step`. It will be replaced with [0.1, 4.85].
  error_threshold = trial.suggest_float("error_threshold", 0.1, 5, step=0.25)
[I 2026-07-20 15:00:42,224] Trial 260 finished with value: -1.6515351980930963 and parameters: {'error_threshold': 3.1, 'scalers': 'standard', 'ratios': 'log_ratio', 'imputers': 'none', 'n_estimators': 250, 'learning_rate': 0.00010110423583368918, 'max_depth': 6, 'min_child_weight': 6, 'subsample': 0.7, 'colsample_bytree': 0.5, 'colsample_bylevel': 0.8, 'reg_alpha': 0.046395169556274686, 'reg_lambda': 25.98608342003326, 'gamma': 39.216922097289114}. Best is trial 183 with value: -1.6583770069254369.
/bsuhome/alexanderemert/Research/Star-Formation-Research-Project-2026/pipeline/scripts/optuna/final_preds_and_models/optuna_search_mult_quant_reg.py:75: UserWarning: The distribution is specified by [0.1, 5] and step=0.25, but the range is not divisible by `step`. It will be replaced with [0.1, 4.85].
  error_threshold = trial.suggest_float("error_threshold", 0.1, 5, step=0.25)
[I 2026-07-20 15:00:43,761] Trial 261 finished with value: -1.6489466785515619 and parameters: {'error_threshold': 3.1, 'scalers': 'standard', 'ratios': 'log_ratio', 'imputers': 'none', 'n_estimators': 250, 'learning_rate': 0.00014131317050706195, 'max_depth': 6, 'min_child_weight': 8, 'subsample': 0.7, 'colsample_bytree': 0.5, 'colsample_bylevel': 0.8, 'reg_alpha': 0.0532231206682881, 'reg_lambda': 31.2387108593504, 'gamma': 39.601244411621366}. Best is trial 183 with value: -1.6583770069254369.
/bsuhome/alexanderemert/Research/Star-Formation-Research-Project-2026/pipeline/scripts/optuna/final_preds_and_models/optuna_search_mult_quant_reg.py:75: UserWarning: The distribution is specified by [0.1, 5] and step=0.25, but the range is not divisible by `step`. It will be replaced with [0.1, 4.85].
  error_threshold = trial.suggest_float("error_threshold", 0.1, 5, step=0.25)
[I 2026-07-20 15:00:44,090] Trial 262 finished with value: -1.6489626382496425 and parameters: {'error_threshold': 3.1, 'scalers': 'standard', 'ratios': 'log_ratio', 'imputers': 'none', 'n_estimators': 250, 'learning_rate': 0.00014170220992419948, 'max_depth': 6, 'min_child_weight': 6, 'subsample': 0.7, 'colsample_bytree': 0.5, 'colsample_bylevel': 0.8, 'reg_alpha': 0.05382257059272081, 'reg_lambda': 27.618963765457597, 'gamma': 40.84396846621805}. Best is trial 183 with value: -1.6583770069254369.
/bsuhome/alexanderemert/Research/Star-Formation-Research-Project-2026/pipeline/scripts/optuna/final_preds_and_models/optuna_search_mult_quant_reg.py:75: UserWarning: The distribution is specified by [0.1, 5] and step=0.25, but the range is not divisible by `step`. It will be replaced with [0.1, 4.85].
  error_threshold = trial.suggest_float("error_threshold", 0.1, 5, step=0.25)
[I 2026-07-20 15:00:44,715] Trial 263 finished with value: -1.651679620418963 and parameters: {'error_threshold': 3.1, 'scalers': 'standard', 'ratios': 'log_ratio', 'imputers': 'none', 'n_estimators': 250, 'learning_rate': 0.00010001057456127937, 'max_depth': 6, 'min_child_weight': 6, 'subsample': 0.7, 'colsample_bytree': 0.5, 'colsample_bylevel': 0.8, 'reg_alpha': 0.01142190935365568, 'reg_lambda': 28.117759390169674, 'gamma': 41.78259305363666}. Best is trial 183 with value: -1.6583770069254369.
/bsuhome/alexanderemert/Research/Star-Formation-Research-Project-2026/pipeline/scripts/optuna/final_preds_and_models/optuna_search_mult_quant_reg.py:75: UserWarning: The distribution is specified by [0.1, 5] and step=0.25, but the range is not divisible by `step`. It will be replaced with [0.1, 4.85].
  error_threshold = trial.suggest_float("error_threshold", 0.1, 5, step=0.25)
