[I 2026-07-20 15:09:13,483] Trial 116 finished with value: -7.745266406619254 and parameters: {'error_threshold': 4.1, 'scalers': 'none', 'ratios': 'norm_ratio', 'imputers': 'mean', 'n_estimators': 2550, 'learning_rate': 0.0013549537081363994, 'max_depth': 4, 'min_child_weight': 10, 'subsample': 0.5, 'colsample_bytree': 1.0, 'colsample_bylevel': 0.6, 'reg_alpha': 1.880781926810622e-06, 'reg_lambda': 1.0459192870163753e-05, 'gamma': 3.636131516212494e-06}. Best is trial 82 with value: -7.731843858789701.
/bsuhome/alexanderemert/Research/Star-Formation-Research-Project-2026/pipeline/scripts/optuna/final_preds_and_models/optuna_search_mult_quant_reg.py:161: UserWarning: The distribution is specified by [0.1, 5] and step=0.25, but the range is not divisible by `step`. It will be replaced with [0.1, 4.85].
  error_threshold = trial.suggest_float("error_threshold", 0.1, 5, step=0.25)
[I 2026-07-20 15:09:16,720] Trial 117 finished with value: -7.828037675830067 and parameters: {'error_threshold': 4.1, 'scalers': 'none', 'ratios': 'norm_ratio', 'imputers': 'mean', 'n_estimators': 2500, 'learning_rate': 0.0007536494986986681, 'max_depth': 4, 'min_child_weight': 10, 'subsample': 0.5, 'colsample_bytree': 1.0, 'colsample_bylevel': 0.6, 'reg_alpha': 1.965941829954959e-06, 'reg_lambda': 0.0024608161532706295, 'gamma': 0.2477833310147001}. Best is trial 82 with value: -7.731843858789701.
/bsuhome/alexanderemert/Research/Star-Formation-Research-Project-2026/pipeline/scripts/optuna/final_preds_and_models/optuna_search_mult_quant_reg.py:161: UserWarning: The distribution is specified by [0.1, 5] and step=0.25, but the range is not divisible by `step`. It will be replaced with [0.1, 4.85].
  error_threshold = trial.suggest_float("error_threshold", 0.1, 5, step=0.25)
[I 2026-07-20 15:09:19,482] Trial 118 finished with value: -7.745947111171847 and parameters: {'error_threshold': 4.1, 'scalers': 'none', 'ratios': 'norm_ratio', 'imputers': 'mean', 'n_estimators': 2500, 'learning_rate': 0.0014060996496925678, 'max_depth': 4, 'min_child_weight': 10, 'subsample': 0.5, 'colsample_bytree': 1.0, 'colsample_bylevel': 0.6, 'reg_alpha': 2.336360047402215e-06, 'reg_lambda': 3.609878342914748e-05, 'gamma': 8.532302594773242e-06}. Best is trial 82 with value: -7.731843858789701.
/bsuhome/alexanderemert/Research/Star-Formation-Research-Project-2026/pipeline/scripts/optuna/final_preds_and_models/optuna_search_mult_quant_reg.py:161: UserWarning: The distribution is specified by [0.1, 5] and step=0.25, but the range is not divisible by `step`. It will be replaced with [0.1, 4.85].
  error_threshold = trial.suggest_float("error_threshold", 0.1, 5, step=0.25)
[I 2026-07-20 15:09:22,508] Trial 119 finished with value: -7.749353020457903 and parameters: {'error_threshold': 4.6, 'scalers': 'none', 'ratios': 'norm_ratio', 'imputers': 'mean', 'n_estimators': 2550, 'learning_rate': 0.0015029482711840108, 'max_depth': 4, 'min_child_weight': 7, 'subsample': 0.5, 'colsample_bytree': 1.0, 'colsample_bylevel': 0.6, 'reg_alpha': 2.4625859328026753e-06, 'reg_lambda': 3.69214645529141e-05, 'gamma': 3.855853846703133e-06}. Best is trial 82 with value: -7.731843858789701.
/bsuhome/alexanderemert/Research/Star-Formation-Research-Project-2026/pipeline/scripts/optuna/final_preds_and_models/optuna_search_mult_quant_reg.py:161: UserWarning: The distribution is specified by [0.1, 5] and step=0.25, but the range is not divisible by `step`. It will be replaced with [0.1, 4.85].
  error_threshold = trial.suggest_float("error_threshold", 0.1, 5, step=0.25)
[I 2026-07-20 15:09:25,742] Trial 120 finished with value: -7.744215909961587 and parameters: {'error_threshold': 4.1, 'scalers': 'none', 'ratios': 'norm_ratio', 'imputers': 'mean', 'n_estimators': 2800, 'learning_rate': 0.0014038346353447697, 'max_depth': 4, 'min_child_weight': 10, 'subsample': 0.5, 'colsample_bytree': 1.0, 'colsample_bylevel': 0.6, 'reg_alpha': 2.9678333505532957e-06, 'reg_lambda': 4.983541609347702e-05, 'gamma': 3.873234793358056e-06}. Best is trial 82 with value: -7.731843858789701.
/bsuhome/alexanderemert/Research/Star-Formation-Research-Project-2026/pipeline/scripts/optuna/final_preds_and_models/optuna_search_mult_quant_reg.py:161: UserWarning: The distribution is specified by [0.1, 5] and step=0.25, but the range is not divisible by `step`. It will be replaced with [0.1, 4.85].
  error_threshold = trial.suggest_float("error_threshold", 0.1, 5, step=0.25)
[I 2026-07-20 15:09:28,942] Trial 121 finished with value: -7.743036838857907 and parameters: {'error_threshold': 3.6, 'scalers': 'none', 'ratios': 'norm_ratio', 'imputers': 'mean', 'n_estimators': 2800, 'learning_rate': 0.0015220311589545334, 'max_depth': 4, 'min_child_weight': 10, 'subsample': 0.5, 'colsample_bytree': 1.0, 'colsample_bylevel': 0.6, 'reg_alpha': 1.5636867309821174e-06, 'reg_lambda': 4.514100952157715e-06, 'gamma': 8.356725849990992e-06}. Best is trial 82 with value: -7.731843858789701.
/bsuhome/alexanderemert/Research/Star-Formation-Research-Project-2026/pipeline/scripts/optuna/final_preds_and_models/optuna_search_mult_quant_reg.py:161: UserWarning: The distribution is specified by [0.1, 5] and step=0.25, but the range is not divisible by `step`. It will be replaced with [0.1, 4.85].
  error_threshold = trial.suggest_float("error_threshold", 0.1, 5, step=0.25)
[I 2026-07-20 15:09:32,477] Trial 122 finished with value: -7.803345836381613 and parameters: {'error_threshold': 3.6, 'scalers': 'none', 'ratios': 'norm_ratio', 'imputers': 'mean', 'n_estimators': 2800, 'learning_rate': 0.0007384817357708414, 'max_depth': 4, 'min_child_weight': 10, 'subsample': 0.5, 'colsample_bytree': 1.0, 'colsample_bylevel': 0.6, 'reg_alpha': 1.719269919256048e-06, 'reg_lambda': 3.709939099095088e-05, 'gamma': 3.6730007484057576e-06}. Best is trial 82 with value: -7.731843858789701.
/bsuhome/alexanderemert/Research/Star-Formation-Research-Project-2026/pipeline/scripts/optuna/final_preds_and_models/optuna_search_mult_quant_reg.py:161: UserWarning: The distribution is specified by [0.1, 5] and step=0.25, but the range is not divisible by `step`. It will be replaced with [0.1, 4.85].
  error_threshold = trial.suggest_float("error_threshold", 0.1, 5, step=0.25)
[I 2026-07-20 15:09:37,477] Trial 123 finished with value: -7.785154190266635 and parameters: {'error_threshold': 3.6, 'scalers': 'none', 'ratios': 'norm_ratio', 'imputers': 'mean', 'n_estimators': 2800, 'learning_rate': 0.0007478409727437287, 'max_depth': 5, 'min_child_weight': 10, 'subsample': 0.5, 'colsample_bytree': 1.0, 'colsample_bylevel': 0.6, 'reg_alpha': 1.6880109657974689e-06, 'reg_lambda': 6.268852047543553e-05, 'gamma': 8.175847162102168e-06}. Best is trial 82 with value: -7.731843858789701.
/bsuhome/alexanderemert/Research/Star-Formation-Research-Project-2026/pipeline/scripts/optuna/final_preds_and_models/optuna_search_mult_quant_reg.py:161: UserWarning: The distribution is specified by [0.1, 5] and step=0.25, but the range is not divisible by `step`. It will be replaced with [0.1, 4.85].
  error_threshold = trial.suggest_float("error_threshold", 0.1, 5, step=0.25)
[I 2026-07-20 15:09:42,558] Trial 124 finished with value: -7.839004427222097 and parameters: {'error_threshold': 3.85, 'scalers': 'none', 'ratios': 'norm_ratio', 'imputers': 'mean', 'n_estimators': 2800, 'learning_rate': 0.0005997046157915918, 'max_depth': 5, 'min_child_weight': 10, 'subsample': 0.5, 'colsample_bytree': 1.0, 'colsample_bylevel': 0.6, 'reg_alpha': 3.1497889027043605e-06, 'reg_lambda': 3.8470949489502324e-05, 'gamma': 7.753010504557538e-06}. Best is trial 82 with value: -7.731843858789701.
/bsuhome/alexanderemert/Research/Star-Formation-Research-Project-2026/pipeline/scripts/optuna/final_preds_and_models/optuna_search_mult_quant_reg.py:161: UserWarning: The distribution is specified by [0.1, 5] and step=0.25, but the range is not divisible by `step`. It will be replaced with [0.1, 4.85].
  error_threshold = trial.suggest_float("error_threshold", 0.1, 5, step=0.25)
[I 2026-07-20 15:09:48,223] Trial 125 finished with value: -7.813756213129401 and parameters: {'error_threshold': 3.6, 'scalers': 'none', 'ratios': 'norm_ratio', 'imputers': 'mean', 'n_estimators': 2800, 'learning_rate': 0.0006660728163160691, 'max_depth': 5, 'min_child_weight': 10, 'subsample': 0.6, 'colsample_bytree': 1.0, 'colsample_bylevel': 0.7, 'reg_alpha': 3.4862616769870715e-06, 'reg_lambda': 7.494286754424036e-05, 'gamma': 7.993735252699103e-06}. Best is trial 82 with value: -7.731843858789701.
/bsuhome/alexanderemert/Research/Star-Formation-Research-Project-2026/pipeline/scripts/optuna/final_preds_and_models/optuna_search_mult_quant_reg.py:161: UserWarning: The distribution is specified by [0.1, 5] and step=0.25, but the range is not divisible by `step`. It will be replaced with [0.1, 4.85].
  error_threshold = trial.suggest_float("error_threshold", 0.1, 5, step=0.25)
[I 2026-07-20 15:09:52,466] Trial 126 finished with value: -7.808368588836949 and parameters: {'error_threshold': 3.85, 'scalers': 'robust', 'ratios': 'norm_ratio', 'imputers': 'mean', 'n_estimators': 2800, 'learning_rate': 0.0033195782363657678, 'max_depth': 5, 'min_child_weight': 10, 'subsample': 0.5, 'colsample_bytree': 1.0, 'colsample_bylevel': 0.7, 'reg_alpha': 4.6012171512971644e-05, 'reg_lambda': 4.195594410454911e-06, 'gamma': 3.971569248677505e-06}. Best is trial 82 with value: -7.731843858789701.
/bsuhome/alexanderemert/Research/Star-Formation-Research-Project-2026/pipeline/scripts/optuna/final_preds_and_models/optuna_search_mult_quant_reg.py:161: UserWarning: The distribution is specified by [0.1, 5] and step=0.25, but the range is not divisible by `step`. It will be replaced with [0.1, 4.85].
  error_threshold = trial.suggest_float("error_threshold", 0.1, 5, step=0.25)
[I 2026-07-20 15:09:58,120] Trial 127 finished with value: -7.852843468425991 and parameters: {'error_threshold': 3.85, 'scalers': 'robust', 'ratios': 'norm_ratio', 'imputers': 'mean', 'n_estimators': 2800, 'learning_rate': 0.0005803869312060587, 'max_depth': 5, 'min_child_weight': 10, 'subsample': 0.6, 'colsample_bytree': 1.0, 'colsample_bylevel': 0.7, 'reg_alpha': 1.111628329703081e-06, 'reg_lambda': 5.221924045827053e-06, 'gamma': 6.622033156900409e-06}. Best is trial 82 with value: -7.731843858789701.
/bsuhome/alexanderemert/Research/Star-Formation-Research-Project-2026/pipeline/scripts/optuna/final_preds_and_models/optuna_search_mult_quant_reg.py:161: UserWarning: The distribution is specified by [0.1, 5] and step=0.25, but the range is not divisible by `step`. It will be replaced with [0.1, 4.85].
  error_threshold = trial.suggest_float("error_threshold", 0.1, 5, step=0.25)
[I 2026-07-20 15:10:02,938] Trial 128 finished with value: -7.7550693902031265 and parameters: {'error_threshold': 3.85, 'scalers': 'none', 'ratios': 'norm_ratio', 'imputers': 'mean', 'n_estimators': 2800, 'learning_rate': 0.0009556202602790408, 'max_depth': 5, 'min_child_weight': 10, 'subsample': 0.5, 'colsample_bytree': 1.0, 'colsample_bylevel': 0.6, 'reg_alpha': 1.009334796374304e-06, 'reg_lambda': 4.986871150127493e-06, 'gamma': 7.346335630131376e-06}. Best is trial 82 with value: -7.731843858789701.
/bsuhome/alexanderemert/Research/Star-Formation-Research-Project-2026/pipeline/scripts/optuna/final_preds_and_models/optuna_search_mult_quant_reg.py:161: UserWarning: The distribution is specified by [0.1, 5] and step=0.25, but the range is not divisible by `step`. It will be replaced with [0.1, 4.85].
  error_threshold = trial.suggest_float("error_threshold", 0.1, 5, step=0.25)
[I 2026-07-20 15:10:08,114] Trial 129 finished with value: -7.755526914413989 and parameters: {'error_threshold': 3.6, 'scalers': 'none', 'ratios': 'norm_ratio', 'imputers': 'mean', 'n_estimators': 2800, 'learning_rate': 0.000984191511227611, 'max_depth': 5, 'min_child_weight': 10, 'subsample': 0.5, 'colsample_bytree': 1.0, 'colsample_bylevel': 0.7, 'reg_alpha': 3.678093965718744e-06, 'reg_lambda': 8.358155047191872e-05, 'gamma': 8.131856457030513e-06}. Best is trial 82 with value: -7.731843858789701.
/bsuhome/alexanderemert/Research/Star-Formation-Research-Project-2026/pipeline/scripts/optuna/final_preds_and_models/optuna_search_mult_quant_reg.py:161: UserWarning: The distribution is specified by [0.1, 5] and step=0.25, but the range is not divisible by `step`. It will be replaced with [0.1, 4.85].
  error_threshold = trial.suggest_float("error_threshold", 0.1, 5, step=0.25)
[I 2026-07-20 15:10:13,281] Trial 130 finished with value: -7.754682404226376 and parameters: {'error_threshold': 3.85, 'scalers': 'robust', 'ratios': 'norm_ratio', 'imputers': 'mean', 'n_estimators': 2850, 'learning_rate': 0.0009728138593822674, 'max_depth': 5, 'min_child_weight': 10, 'subsample': 0.5, 'colsample_bytree': 1.0, 'colsample_bylevel': 0.7, 'reg_alpha': 3.2845063381262197e-06, 'reg_lambda': 4.368517697060664e-06, 'gamma': 7.476093813302344e-06}. Best is trial 82 with value: -7.731843858789701.
/bsuhome/alexanderemert/Research/Star-Formation-Research-Project-2026/pipeline/scripts/optuna/final_preds_and_models/optuna_search_mult_quant_reg.py:161: UserWarning: The distribution is specified by [0.1, 5] and step=0.25, but the range is not divisible by `step`. It will be replaced with [0.1, 4.85].
  error_threshold = trial.suggest_float("error_threshold", 0.1, 5, step=0.25)
[I 2026-07-20 15:10:17,584] Trial 131 finished with value: -7.805985003658205 and parameters: {'error_threshold': 4.6, 'scalers': 'robust', 'ratios': 'norm_ratio', 'imputers': 'mean', 'n_estimators': 2850, 'learning_rate': 0.0031560566520063196, 'max_depth': 5, 'min_child_weight': 10, 'subsample': 0.5, 'colsample_bytree': 1.0, 'colsample_bylevel': 0.7, 'reg_alpha': 1.0725774592656043e-06, 'reg_lambda': 1.3582663529164878e-06, 'gamma': 1.7732379408493917e-06}. Best is trial 82 with value: -7.731843858789701.
/bsuhome/alexanderemert/Research/Star-Formation-Research-Project-2026/pipeline/scripts/optuna/final_preds_and_models/optuna_search_mult_quant_reg.py:161: UserWarning: The distribution is specified by [0.1, 5] and step=0.25, but the range is not divisible by `step`. It will be replaced with [0.1, 4.85].
  error_threshold = trial.suggest_float("error_threshold", 0.1, 5, step=0.25)
[I 2026-07-20 15:10:19,772] Trial 133 finished with value: -7.765390367364712 and parameters: {'error_threshold': 3.85, 'scalers': 'robust', 'ratios': 'norm_ratio', 'imputers': 'mean', 'n_estimators': 2350, 'learning_rate': 0.003868577887755425, 'max_depth': 4, 'min_child_weight': 10, 'subsample': 0.5, 'colsample_bytree': 1.0, 'colsample_bylevel': 0.7, 'reg_alpha': 4.483307841609426e-05, 'reg_lambda': 4.564414052326546e-06, 'gamma': 1.893366879075894e-06}. Best is trial 82 with value: -7.731843858789701.
/bsuhome/alexanderemert/Research/Star-Formation-Research-Project-2026/pipeline/scripts/optuna/final_preds_and_models/optuna_search_mult_quant_reg.py:161: UserWarning: The distribution is specified by [0.1, 5] and step=0.25, but the range is not divisible by `step`. It will be replaced with [0.1, 4.85].
  error_threshold = trial.suggest_float("error_threshold", 0.1, 5, step=0.25)
[I 2026-07-20 15:10:31,077] Trial 132 finished with value: -7.926211250085978 and parameters: {'error_threshold': 3.85, 'scalers': 'robust', 'ratios': 'norm_ratio', 'imputers': 'mean', 'n_estimators': 2600, 'learning_rate': 0.0032660040475918925, 'max_depth': 11, 'min_child_weight': 10, 'subsample': 0.5, 'colsample_bytree': 1.0, 'colsample_bylevel': 0.7, 'reg_alpha': 1.0857447474023807e-06, 'reg_lambda': 4.721277402755784e-06, 'gamma': 1.98635163103632e-06}. Best is trial 82 with value: -7.731843858789701.
/bsuhome/alexanderemert/Research/Star-Formation-Research-Project-2026/pipeline/scripts/optuna/final_preds_and_models/optuna_search_mult_quant_reg.py:161: UserWarning: The distribution is specified by [0.1, 5] and step=0.25, but the range is not divisible by `step`. It will be replaced with [0.1, 4.85].
  error_threshold = trial.suggest_float("error_threshold", 0.1, 5, step=0.25)
[I 2026-07-20 15:10:34,224] Trial 134 finished with value: -7.761531298765263 and parameters: {'error_threshold': 4.6, 'scalers': 'none', 'ratios': 'norm_ratio', 'imputers': 'mean', 'n_estimators': 2600, 'learning_rate': 0.0010430322891371057, 'max_depth': 4, 'min_child_weight': 10, 'subsample': 0.5, 'colsample_bytree': 1.0, 'colsample_bylevel': 0.6, 'reg_alpha': 1.0972143769832908e-06, 'reg_lambda': 3.7877795432152836e-06, 'gamma': 1.9104124338732152e-06}. Best is trial 82 with value: -7.731843858789701.
/bsuhome/alexanderemert/Research/Star-Formation-Research-Project-2026/pipeline/scripts/optuna/final_preds_and_models/optuna_search_mult_quant_reg.py:161: UserWarning: The distribution is specified by [0.1, 5] and step=0.25, but the range is not divisible by `step`. It will be replaced with [0.1, 4.85].
  error_threshold = trial.suggest_float("error_threshold", 0.1, 5, step=0.25)
[I 2026-07-20 15:10:37,198] Trial 135 finished with value: -7.788610600643789 and parameters: {'error_threshold': 4.6, 'scalers': 'none', 'ratios': 'norm_ratio', 'imputers': 'mean', 'n_estimators': 2350, 'learning_rate': 0.0009588030559341814, 'max_depth': 4, 'min_child_weight': 10, 'subsample': 0.5, 'colsample_bytree': 1.0, 'colsample_bylevel': 0.6, 'reg_alpha': 0.7908062843152385, 'reg_lambda': 1.519414469660131e-06, 'gamma': 1.833093419053614e-06}. Best is trial 82 with value: -7.731843858789701.
/bsuhome/alexanderemert/Research/Star-Formation-Research-Project-2026/pipeline/scripts/optuna/final_preds_and_models/optuna_search_mult_quant_reg.py:161: UserWarning: The distribution is specified by [0.1, 5] and step=0.25, but the range is not divisible by `step`. It will be replaced with [0.1, 4.85].
  error_threshold = trial.suggest_float("error_threshold", 0.1, 5, step=0.25)
[I 2026-07-20 15:10:39,405] Trial 137 finished with value: -7.787156774433698 and parameters: {'error_threshold': 0.1, 'scalers': 'none', 'ratios': 'norm_ratio', 'imputers': 'none', 'n_estimators': 2350, 'learning_rate': 0.003172637196100943, 'max_depth': 4, 'min_child_weight': 10, 'subsample': 0.5, 'colsample_bytree': 0.9, 'colsample_bylevel': 0.6, 'reg_alpha': 0.49027849128904405, 'reg_lambda': 1.3935437073285155e-06, 'gamma': 1.8467252563030243e-06}. Best is trial 82 with value: -7.731843858789701.
/bsuhome/alexanderemert/Research/Star-Formation-Research-Project-2026/pipeline/scripts/optuna/final_preds_and_models/optuna_search_mult_quant_reg.py:161: UserWarning: The distribution is specified by [0.1, 5] and step=0.25, but the range is not divisible by `step`. It will be replaced with [0.1, 4.85].
  error_threshold = trial.suggest_float("error_threshold", 0.1, 5, step=0.25)
[I 2026-07-20 15:10:49,367] Trial 136 finished with value: -7.89793441256063 and parameters: {'error_threshold': 4.6, 'scalers': 'none', 'ratios': 'norm_ratio', 'imputers': 'mean', 'n_estimators': 2350, 'learning_rate': 0.0031844840840589517, 'max_depth': 11, 'min_child_weight': 10, 'subsample': 0.5, 'colsample_bytree': 1.0, 'colsample_bylevel': 0.6, 'reg_alpha': 2.4752643535323317e-05, 'reg_lambda': 0.024031066806769103, 'gamma': 2.0417765031260856e-06}. Best is trial 82 with value: -7.731843858789701.
/bsuhome/alexanderemert/Research/Star-Formation-Research-Project-2026/pipeline/scripts/optuna/final_preds_and_models/optuna_search_mult_quant_reg.py:161: UserWarning: The distribution is specified by [0.1, 5] and step=0.25, but the range is not divisible by `step`. It will be replaced with [0.1, 4.85].
  error_threshold = trial.suggest_float("error_threshold", 0.1, 5, step=0.25)
[I 2026-07-20 15:10:52,157] Trial 138 finished with value: -7.7586624802458966 and parameters: {'error_threshold': 4.6, 'scalers': 'none', 'ratios': 'norm_ratio', 'imputers': 'mean', 'n_estimators': 2600, 'learning_rate': 0.0031478340394266264, 'max_depth': 4, 'min_child_weight': 10, 'subsample': 0.5, 'colsample_bytree': 1.0, 'colsample_bylevel': 0.6, 'reg_alpha': 0.4820354794579176, 'reg_lambda': 1.3036830996938203e-06, 'gamma': 1.8054133955945736e-06}. Best is trial 82 with value: -7.731843858789701.
/bsuhome/alexanderemert/Research/Star-Formation-Research-Project-2026/pipeline/scripts/optuna/final_preds_and_models/optuna_search_mult_quant_reg.py:161: UserWarning: The distribution is specified by [0.1, 5] and step=0.25, but the range is not divisible by `step`. It will be replaced with [0.1, 4.85].
  error_threshold = trial.suggest_float("error_threshold", 0.1, 5, step=0.25)
[I 2026-07-20 15:10:55,042] Trial 139 finished with value: -7.743067089111078 and parameters: {'error_threshold': 4.6, 'scalers': 'none', 'ratios': 'norm_ratio', 'imputers': 'mean', 'n_estimators': 2600, 'learning_rate': 0.002101945388053407, 'max_depth': 4, 'min_child_weight': 10, 'subsample': 0.5, 'colsample_bytree': 1.0, 'colsample_bylevel': 0.6, 'reg_alpha': 2.0734870619585046e-05, 'reg_lambda': 0.2504597459149405, 'gamma': 2.9774947476987823e-06}. Best is trial 82 with value: -7.731843858789701.
/bsuhome/alexanderemert/Research/Star-Formation-Research-Project-2026/pipeline/scripts/optuna/final_preds_and_models/optuna_search_mult_quant_reg.py:161: UserWarning: The distribution is specified by [0.1, 5] and step=0.25, but the range is not divisible by `step`. It will be replaced with [0.1, 4.85].
  error_threshold = trial.suggest_float("error_threshold", 0.1, 5, step=0.25)
