[I 2026-07-21 13:59:49,289] Trial 92 finished with value: -3.8185953317320287 and parameters: {'error_threshold': 1.6, 'scalers': 'none', 'ratios': 'norm_ratio', 'imputers': 'mean', 'n_estimators': 2300, 'learning_rate': 0.004117800170489129, 'max_depth': 4, 'min_child_weight': 1, 'subsample': 0.6, 'colsample_bytree': 0.6, 'colsample_bylevel': 0.9, 'reg_alpha': 0.018264767291848543, 'reg_lambda': 0.031063626481933154, 'gamma': 0.05503376145032107}. Best is trial 88 with value: -3.7858848711711595.
/bsuhome/alexanderemert/Research/Star-Formation-Research-Project-2026/pipeline/scripts/optuna/final_preds_and_models/optuna_search_mult_quant_reg.py:162: UserWarning: The distribution is specified by [0.1, 5] and step=0.25, but the range is not divisible by `step`. It will be replaced with [0.1, 4.85].
  error_threshold = trial.suggest_float("error_threshold", 0.1, 5, step=0.25)
[I 2026-07-21 13:59:51,821] Trial 93 finished with value: -3.8178873007822562 and parameters: {'error_threshold': 1.6, 'scalers': 'none', 'ratios': 'norm_ratio', 'imputers': 'mean', 'n_estimators': 2300, 'learning_rate': 0.0043517314571599386, 'max_depth': 4, 'min_child_weight': 7, 'subsample': 0.6, 'colsample_bytree': 0.6, 'colsample_bylevel': 0.9, 'reg_alpha': 0.05314715067890306, 'reg_lambda': 0.03555398214804147, 'gamma': 4.608067561725826}. Best is trial 88 with value: -3.7858848711711595.
/bsuhome/alexanderemert/Research/Star-Formation-Research-Project-2026/pipeline/scripts/optuna/final_preds_and_models/optuna_search_mult_quant_reg.py:162: UserWarning: The distribution is specified by [0.1, 5] and step=0.25, but the range is not divisible by `step`. It will be replaced with [0.1, 4.85].
  error_threshold = trial.suggest_float("error_threshold", 0.1, 5, step=0.25)
[I 2026-07-21 13:59:53,649] Trial 94 finished with value: -3.7995160165481088 and parameters: {'error_threshold': 1.6, 'scalers': 'none', 'ratios': 'norm_ratio', 'imputers': 'mean', 'n_estimators': 1450, 'learning_rate': 0.004316529428594776, 'max_depth': 4, 'min_child_weight': 1, 'subsample': 0.7, 'colsample_bytree': 0.6, 'colsample_bylevel': 0.9, 'reg_alpha': 0.017758014165039027, 'reg_lambda': 2.793566510976182e-06, 'gamma': 2.5175780312549106e-06}. Best is trial 88 with value: -3.7858848711711595.
/bsuhome/alexanderemert/Research/Star-Formation-Research-Project-2026/pipeline/scripts/optuna/final_preds_and_models/optuna_search_mult_quant_reg.py:162: UserWarning: The distribution is specified by [0.1, 5] and step=0.25, but the range is not divisible by `step`. It will be replaced with [0.1, 4.85].
  error_threshold = trial.suggest_float("error_threshold", 0.1, 5, step=0.25)
[I 2026-07-21 13:59:54,683] Trial 95 finished with value: -3.94201069189038 and parameters: {'error_threshold': 1.6, 'scalers': 'none', 'ratios': 'norm_ratio', 'imputers': 'mean', 'n_estimators': 150, 'learning_rate': 0.006417283356235741, 'max_depth': 10, 'min_child_weight': 10, 'subsample': 0.7, 'colsample_bytree': 0.6, 'colsample_bylevel': 0.9, 'reg_alpha': 0.06363680388895125, 'reg_lambda': 0.035916698720378976, 'gamma': 0.5823025140243575}. Best is trial 88 with value: -3.7858848711711595.
/bsuhome/alexanderemert/Research/Star-Formation-Research-Project-2026/pipeline/scripts/optuna/final_preds_and_models/optuna_search_mult_quant_reg.py:162: UserWarning: The distribution is specified by [0.1, 5] and step=0.25, but the range is not divisible by `step`. It will be replaced with [0.1, 4.85].
  error_threshold = trial.suggest_float("error_threshold", 0.1, 5, step=0.25)
[I 2026-07-21 13:59:56,533] Trial 96 finished with value: -3.799713658268096 and parameters: {'error_threshold': 2.6, 'scalers': 'standard', 'ratios': 'norm_ratio', 'imputers': 'mean', 'n_estimators': 1500, 'learning_rate': 0.0046806078723244885, 'max_depth': 4, 'min_child_weight': 1, 'subsample': 0.6, 'colsample_bytree': 0.6, 'colsample_bylevel': 0.9, 'reg_alpha': 4.042297436065221, 'reg_lambda': 0.036191887391262396, 'gamma': 5.561576764534407}. Best is trial 88 with value: -3.7858848711711595.
/bsuhome/alexanderemert/Research/Star-Formation-Research-Project-2026/pipeline/scripts/optuna/final_preds_and_models/optuna_search_mult_quant_reg.py:162: UserWarning: The distribution is specified by [0.1, 5] and step=0.25, but the range is not divisible by `step`. It will be replaced with [0.1, 4.85].
  error_threshold = trial.suggest_float("error_threshold", 0.1, 5, step=0.25)
[I 2026-07-21 13:59:58,362] Trial 97 finished with value: -3.8066989703195495 and parameters: {'error_threshold': 3.35, 'scalers': 'standard', 'ratios': 'norm_ratio', 'imputers': 'mean', 'n_estimators': 2300, 'learning_rate': 0.006452269108546497, 'max_depth': 3, 'min_child_weight': 1, 'subsample': 0.6, 'colsample_bytree': 0.6, 'colsample_bylevel': 0.9, 'reg_alpha': 3.784304403903239, 'reg_lambda': 1.9598723315362736, 'gamma': 6.101995716875484e-06}. Best is trial 88 with value: -3.7858848711711595.
/bsuhome/alexanderemert/Research/Star-Formation-Research-Project-2026/pipeline/scripts/optuna/final_preds_and_models/optuna_search_mult_quant_reg.py:162: UserWarning: The distribution is specified by [0.1, 5] and step=0.25, but the range is not divisible by `step`. It will be replaced with [0.1, 4.85].
  error_threshold = trial.suggest_float("error_threshold", 0.1, 5, step=0.25)
[I 2026-07-21 14:00:00,989] Trial 98 finished with value: -3.825599811024221 and parameters: {'error_threshold': 3.85, 'scalers': 'none', 'ratios': 'norm_ratio', 'imputers': 'mean', 'n_estimators': 2350, 'learning_rate': 0.0043749875087221906, 'max_depth': 4, 'min_child_weight': 5, 'subsample': 0.7, 'colsample_bytree': 0.6, 'colsample_bylevel': 0.9, 'reg_alpha': 0.0766762228903306, 'reg_lambda': 0.26625710554128046, 'gamma': 0.5260454437804929}. Best is trial 88 with value: -3.7858848711711595.
/bsuhome/alexanderemert/Research/Star-Formation-Research-Project-2026/pipeline/scripts/optuna/final_preds_and_models/optuna_search_mult_quant_reg.py:162: UserWarning: The distribution is specified by [0.1, 5] and step=0.25, but the range is not divisible by `step`. It will be replaced with [0.1, 4.85].
  error_threshold = trial.suggest_float("error_threshold", 0.1, 5, step=0.25)
[I 2026-07-21 14:00:02,208] Trial 100 finished with value: -3.796272574348342 and parameters: {'error_threshold': 3.35, 'scalers': 'none', 'ratios': 'norm_ratio', 'imputers': 'none', 'n_estimators': 1550, 'learning_rate': 0.006869955533026124, 'max_depth': 3, 'min_child_weight': 5, 'subsample': 0.7, 'colsample_bytree': 0.6, 'colsample_bylevel': 0.9, 'reg_alpha': 0.057395301225191785, 'reg_lambda': 2.3179976072500006e-05, 'gamma': 4.957031945811324}. Best is trial 88 with value: -3.7858848711711595.
/bsuhome/alexanderemert/Research/Star-Formation-Research-Project-2026/pipeline/scripts/optuna/final_preds_and_models/optuna_search_mult_quant_reg.py:162: UserWarning: The distribution is specified by [0.1, 5] and step=0.25, but the range is not divisible by `step`. It will be replaced with [0.1, 4.85].
  error_threshold = trial.suggest_float("error_threshold", 0.1, 5, step=0.25)
[I 2026-07-21 14:00:03,498] Trial 101 finished with value: -3.794694344232786 and parameters: {'error_threshold': 2.6, 'scalers': 'none', 'ratios': 'norm_ratio', 'imputers': 'none', 'n_estimators': 1550, 'learning_rate': 0.006318431021796686, 'max_depth': 3, 'min_child_weight': 5, 'subsample': 0.7, 'colsample_bytree': 0.7, 'colsample_bylevel': 0.9, 'reg_alpha': 0.13667507976656393, 'reg_lambda': 0.0007041090177671119, 'gamma': 0.5115278242849526}. Best is trial 88 with value: -3.7858848711711595.
/bsuhome/alexanderemert/Research/Star-Formation-Research-Project-2026/pipeline/scripts/optuna/final_preds_and_models/optuna_search_mult_quant_reg.py:162: UserWarning: The distribution is specified by [0.1, 5] and step=0.25, but the range is not divisible by `step`. It will be replaced with [0.1, 4.85].
  error_threshold = trial.suggest_float("error_threshold", 0.1, 5, step=0.25)
[I 2026-07-21 14:00:05,058] Trial 103 finished with value: -3.8596371986715408 and parameters: {'error_threshold': 3.85, 'scalers': 'standard', 'ratios': 'norm_ratio', 'imputers': 'none', 'n_estimators': 2150, 'learning_rate': 0.000789607185760401, 'max_depth': 3, 'min_child_weight': 3, 'subsample': 0.7, 'colsample_bytree': 0.7, 'colsample_bylevel': 0.7, 'reg_alpha': 0.14997625684683463, 'reg_lambda': 2.1495588402879364, 'gamma': 0.0024107995016013086}. Best is trial 88 with value: -3.7858848711711595.
/bsuhome/alexanderemert/Research/Star-Formation-Research-Project-2026/pipeline/scripts/optuna/final_preds_and_models/optuna_search_mult_quant_reg.py:162: UserWarning: The distribution is specified by [0.1, 5] and step=0.25, but the range is not divisible by `step`. It will be replaced with [0.1, 4.85].
  error_threshold = trial.suggest_float("error_threshold", 0.1, 5, step=0.25)
[I 2026-07-21 14:00:15,021] Trial 99 finished with value: -3.8949704571524078 and parameters: {'error_threshold': 3.35, 'scalers': 'none', 'ratios': 'norm_ratio', 'imputers': 'none', 'n_estimators': 1550, 'learning_rate': 0.004450502338338683, 'max_depth': 10, 'min_child_weight': 5, 'subsample': 0.7, 'colsample_bytree': 0.6, 'colsample_bylevel': 0.9, 'reg_alpha': 0.12927397673847155, 'reg_lambda': 1.7185994729096994, 'gamma': 4.722128317618523}. Best is trial 88 with value: -3.7858848711711595.
/bsuhome/alexanderemert/Research/Star-Formation-Research-Project-2026/pipeline/scripts/optuna/final_preds_and_models/optuna_search_mult_quant_reg.py:162: UserWarning: The distribution is specified by [0.1, 5] and step=0.25, but the range is not divisible by `step`. It will be replaced with [0.1, 4.85].
  error_threshold = trial.suggest_float("error_threshold", 0.1, 5, step=0.25)
[I 2026-07-21 14:00:15,985] Trial 104 finished with value: -3.8036506754128063 and parameters: {'error_threshold': 3.85, 'scalers': 'none', 'ratios': 'norm_ratio', 'imputers': 'none', 'n_estimators': 1300, 'learning_rate': 0.002004798010214483, 'max_depth': 3, 'min_child_weight': 3, 'subsample': 0.7, 'colsample_bytree': 0.7, 'colsample_bylevel': 0.7, 'reg_alpha': 0.004968829515395693, 'reg_lambda': 1.9819313820044535, 'gamma': 1.3792181092399904}. Best is trial 88 with value: -3.7858848711711595.
/bsuhome/alexanderemert/Research/Star-Formation-Research-Project-2026/pipeline/scripts/optuna/final_preds_and_models/optuna_search_mult_quant_reg.py:162: UserWarning: The distribution is specified by [0.1, 5] and step=0.25, but the range is not divisible by `step`. It will be replaced with [0.1, 4.85].
  error_threshold = trial.suggest_float("error_threshold", 0.1, 5, step=0.25)
[I 2026-07-21 14:00:17,419] Trial 105 finished with value: -3.831309168039106 and parameters: {'error_threshold': 4.1, 'scalers': 'none', 'ratios': 'log_ratio', 'imputers': 'none', 'n_estimators': 2100, 'learning_rate': 0.0018727939519186695, 'max_depth': 3, 'min_child_weight': 8, 'subsample': 0.7, 'colsample_bytree': 0.7, 'colsample_bylevel': 0.7, 'reg_alpha': 93.06236247119395, 'reg_lambda': 0.8583863852473216, 'gamma': 40.84578594683753}. Best is trial 88 with value: -3.7858848711711595.
/bsuhome/alexanderemert/Research/Star-Formation-Research-Project-2026/pipeline/scripts/optuna/final_preds_and_models/optuna_search_mult_quant_reg.py:162: UserWarning: The distribution is specified by [0.1, 5] and step=0.25, but the range is not divisible by `step`. It will be replaced with [0.1, 4.85].
  error_threshold = trial.suggest_float("error_threshold", 0.1, 5, step=0.25)
[I 2026-07-21 14:00:18,973] Trial 106 finished with value: -3.779169236656063 and parameters: {'error_threshold': 1.35, 'scalers': 'none', 'ratios': 'log_ratio', 'imputers': 'none', 'n_estimators': 2100, 'learning_rate': 0.0018728297240770166, 'max_depth': 3, 'min_child_weight': 3, 'subsample': 0.7, 'colsample_bytree': 0.7, 'colsample_bylevel': 0.7, 'reg_alpha': 0.1509429860016571, 'reg_lambda': 0.8479747438434735, 'gamma': 1.5062206483776779}. Best is trial 106 with value: -3.779169236656063.
/bsuhome/alexanderemert/Research/Star-Formation-Research-Project-2026/pipeline/scripts/optuna/final_preds_and_models/optuna_search_mult_quant_reg.py:162: UserWarning: The distribution is specified by [0.1, 5] and step=0.25, but the range is not divisible by `step`. It will be replaced with [0.1, 4.85].
  error_threshold = trial.suggest_float("error_threshold", 0.1, 5, step=0.25)
[I 2026-07-21 14:00:19,833] Trial 107 finished with value: -3.8810947760525103 and parameters: {'error_threshold': 1.35, 'scalers': 'standard', 'ratios': 'log_ratio', 'imputers': 'median', 'n_estimators': 1250, 'learning_rate': 0.001185161936801341, 'max_depth': 3, 'min_child_weight': 3, 'subsample': 0.7, 'colsample_bytree': 0.7, 'colsample_bylevel': 0.7, 'reg_alpha': 0.005872570059352453, 'reg_lambda': 0.8646781272698669, 'gamma': 13.671098556970634}. Best is trial 106 with value: -3.779169236656063.
/bsuhome/alexanderemert/Research/Star-Formation-Research-Project-2026/pipeline/scripts/optuna/final_preds_and_models/optuna_search_mult_quant_reg.py:162: UserWarning: The distribution is specified by [0.1, 5] and step=0.25, but the range is not divisible by `step`. It will be replaced with [0.1, 4.85].
  error_threshold = trial.suggest_float("error_threshold", 0.1, 5, step=0.25)
[I 2026-07-21 14:00:20,845] Trial 108 finished with value: -3.8784741863071766 and parameters: {'error_threshold': 0.6, 'scalers': 'none', 'ratios': 'norm_ratio', 'imputers': 'none', 'n_estimators': 1250, 'learning_rate': 0.0012397927326772496, 'max_depth': 3, 'min_child_weight': 3, 'subsample': 0.7, 'colsample_bytree': 0.7, 'colsample_bylevel': 0.7, 'reg_alpha': 0.13909892329390472, 'reg_lambda': 0.8501284782309246, 'gamma': 1.452891418597832}. Best is trial 106 with value: -3.779169236656063.
/bsuhome/alexanderemert/Research/Star-Formation-Research-Project-2026/pipeline/scripts/optuna/final_preds_and_models/optuna_search_mult_quant_reg.py:162: UserWarning: The distribution is specified by [0.1, 5] and step=0.25, but the range is not divisible by `step`. It will be replaced with [0.1, 4.85].
  error_threshold = trial.suggest_float("error_threshold", 0.1, 5, step=0.25)
[I 2026-07-21 14:00:33,046] Trial 102 finished with value: -3.948427537831341 and parameters: {'error_threshold': 0.6, 'scalers': 'none', 'ratios': 'norm_ratio', 'imputers': 'none', 'n_estimators': 1550, 'learning_rate': 0.0068650475401936025, 'max_depth': 10, 'min_child_weight': 5, 'subsample': 0.7, 'colsample_bytree': 0.7, 'colsample_bylevel': 0.9, 'reg_alpha': 0.06166685874200424, 'reg_lambda': 1.8884914921761657, 'gamma': 0.5987629202110819}. Best is trial 106 with value: -3.779169236656063.
/bsuhome/alexanderemert/Research/Star-Formation-Research-Project-2026/pipeline/scripts/optuna/final_preds_and_models/optuna_search_mult_quant_reg.py:162: UserWarning: The distribution is specified by [0.1, 5] and step=0.25, but the range is not divisible by `step`. It will be replaced with [0.1, 4.85].
  error_threshold = trial.suggest_float("error_threshold", 0.1, 5, step=0.25)
[I 2026-07-21 14:00:34,160] Trial 109 finished with value: -3.779523855862888 and parameters: {'error_threshold': 2.6, 'scalers': 'none', 'ratios': 'norm_ratio', 'imputers': 'none', 'n_estimators': 1350, 'learning_rate': 0.0030850683783751323, 'max_depth': 3, 'min_child_weight': 6, 'subsample': 0.7, 'colsample_bytree': 0.7, 'colsample_bylevel': 0.9, 'reg_alpha': 0.12385417757623603, 'reg_lambda': 0.0007074348221592172, 'gamma': 1.1564720731122367}. Best is trial 106 with value: -3.779169236656063.
/bsuhome/alexanderemert/Research/Star-Formation-Research-Project-2026/pipeline/scripts/optuna/final_preds_and_models/optuna_search_mult_quant_reg.py:162: UserWarning: The distribution is specified by [0.1, 5] and step=0.25, but the range is not divisible by `step`. It will be replaced with [0.1, 4.85].
  error_threshold = trial.suggest_float("error_threshold", 0.1, 5, step=0.25)
[I 2026-07-21 14:00:35,337] Trial 110 finished with value: -3.881889968483246 and parameters: {'error_threshold': 4.1, 'scalers': 'none', 'ratios': 'log_ratio', 'imputers': 'none', 'n_estimators': 1300, 'learning_rate': 0.0011782711405294278, 'max_depth': 3, 'min_child_weight': 6, 'subsample': 0.7, 'colsample_bytree': 0.7, 'colsample_bylevel': 0.9, 'reg_alpha': 0.02665362088235777, 'reg_lambda': 6.009564513561825, 'gamma': 1.3553876543930112}. Best is trial 106 with value: -3.779169236656063.
/bsuhome/alexanderemert/Research/Star-Formation-Research-Project-2026/pipeline/scripts/optuna/final_preds_and_models/optuna_search_mult_quant_reg.py:162: UserWarning: The distribution is specified by [0.1, 5] and step=0.25, but the range is not divisible by `step`. It will be replaced with [0.1, 4.85].
  error_threshold = trial.suggest_float("error_threshold", 0.1, 5, step=0.25)
[I 2026-07-21 14:00:37,034] Trial 111 finished with value: -3.7822466759113493 and parameters: {'error_threshold': 1.35, 'scalers': 'none', 'ratios': 'log_ratio', 'imputers': 'median', 'n_estimators': 2100, 'learning_rate': 0.003551762705659141, 'max_depth': 3, 'min_child_weight': 6, 'subsample': 0.7, 'colsample_bytree': 0.7, 'colsample_bylevel': 0.9, 'reg_alpha': 0.02711520986944485, 'reg_lambda': 0.00048760861537058456, 'gamma': 0.09484779169584615}. Best is trial 106 with value: -3.779169236656063.
/bsuhome/alexanderemert/Research/Star-Formation-Research-Project-2026/pipeline/scripts/optuna/final_preds_and_models/optuna_search_mult_quant_reg.py:162: UserWarning: The distribution is specified by [0.1, 5] and step=0.25, but the range is not divisible by `step`. It will be replaced with [0.1, 4.85].
  error_threshold = trial.suggest_float("error_threshold", 0.1, 5, step=0.25)
[I 2026-07-21 14:00:38,413] Trial 112 finished with value: -3.7813186632079603 and parameters: {'error_threshold': 0.6, 'scalers': 'none', 'ratios': 'log_ratio', 'imputers': 'median', 'n_estimators': 1650, 'learning_rate': 0.0031229772336315905, 'max_depth': 3, 'min_child_weight': 6, 'subsample': 0.7, 'colsample_bytree': 0.7, 'colsample_bylevel': 0.9, 'reg_alpha': 1.1805223963984623, 'reg_lambda': 0.0006474612025344594, 'gamma': 14.172385273071466}. Best is trial 106 with value: -3.779169236656063.
/bsuhome/alexanderemert/Research/Star-Formation-Research-Project-2026/pipeline/scripts/optuna/final_preds_and_models/optuna_search_mult_quant_reg.py:162: UserWarning: The distribution is specified by [0.1, 5] and step=0.25, but the range is not divisible by `step`. It will be replaced with [0.1, 4.85].
  error_threshold = trial.suggest_float("error_threshold", 0.1, 5, step=0.25)
[I 2026-07-21 14:00:40,256] Trial 113 finished with value: -3.7956458285445227 and parameters: {'error_threshold': 1.35, 'scalers': 'none', 'ratios': 'log_ratio', 'imputers': 'median', 'n_estimators': 2100, 'learning_rate': 0.001256548049567811, 'max_depth': 3, 'min_child_weight': 2, 'subsample': 0.7, 'colsample_bytree': 0.9, 'colsample_bylevel': 0.7, 'reg_alpha': 0.025523657556191588, 'reg_lambda': 0.8127214940172838, 'gamma': 13.22375956063362}. Best is trial 106 with value: -3.779169236656063.
/bsuhome/alexanderemert/Research/Star-Formation-Research-Project-2026/pipeline/scripts/optuna/final_preds_and_models/optuna_search_mult_quant_reg.py:162: UserWarning: The distribution is specified by [0.1, 5] and step=0.25, but the range is not divisible by `step`. It will be replaced with [0.1, 4.85].
  error_threshold = trial.suggest_float("error_threshold", 0.1, 5, step=0.25)
[I 2026-07-21 14:00:44,656] Trial 115 finished with value: -3.7942762783930006 and parameters: {'error_threshold': 1.35, 'scalers': 'none', 'ratios': 'log_ratio', 'imputers': 'median', 'n_estimators': 2100, 'learning_rate': 0.002999067026534308, 'max_depth': 9, 'min_child_weight': 6, 'subsample': 0.7, 'colsample_bytree': 0.9, 'colsample_bylevel': 0.8, 'reg_alpha': 0.025602659805073, 'reg_lambda': 5.636641418222716, 'gamma': 48.72739697188322}. Best is trial 106 with value: -3.779169236656063.
/bsuhome/alexanderemert/Research/Star-Formation-Research-Project-2026/pipeline/scripts/optuna/final_preds_and_models/optuna_search_mult_quant_reg.py:162: UserWarning: The distribution is specified by [0.1, 5] and step=0.25, but the range is not divisible by `step`. It will be replaced with [0.1, 4.85].
  error_threshold = trial.suggest_float("error_threshold", 0.1, 5, step=0.25)
[I 2026-07-21 14:00:47,263] Trial 118 finished with value: -3.792938760340636 and parameters: {'error_threshold': 1.35, 'scalers': 'none', 'ratios': 'log_ratio', 'imputers': 'median', 'n_estimators': 1900, 'learning_rate': 0.0030956727835952575, 'max_depth': 4, 'min_child_weight': 2, 'subsample': 0.7, 'colsample_bytree': 0.8, 'colsample_bylevel': 0.8, 'reg_alpha': 1.3438122479443873, 'reg_lambda': 0.274735208629269, 'gamma': 0.29426953444670084}. Best is trial 106 with value: -3.779169236656063.
/bsuhome/alexanderemert/Research/Star-Formation-Research-Project-2026/pipeline/scripts/optuna/final_preds_and_models/optuna_search_mult_quant_reg.py:162: UserWarning: The distribution is specified by [0.1, 5] and step=0.25, but the range is not divisible by `step`. It will be replaced with [0.1, 4.85].
  error_threshold = trial.suggest_float("error_threshold", 0.1, 5, step=0.25)
