[I 2026-07-20 13:10:51,818] Trial 104 finished with value: -1.7623679345264474 and parameters: {'error_threshold': 0.25, 'scalers': 'none', 'ratios': 'log_ratio', 'imputers': 'mean', 'n_estimators': 2550, 'learning_rate': 0.22623395207937175, 'max_depth': 9, 'min_child_weight': 1, 'subsample': 0.6, 'colsample_bytree': 0.5, 'colsample_bylevel': 0.6, 'reg_alpha': 0.0006443960068429816, 'reg_lambda': 80.17282576796508, 'gamma': 0.0008098904021861619}. Best is trial 91 with value: -3.5956052874304505.
[I 2026-07-20 13:10:55,728] Trial 105 finished with value: -1.3867052559693238 and parameters: {'error_threshold': 0.25, 'scalers': 'none', 'ratios': 'log_ratio', 'imputers': 'mean', 'n_estimators': 2550, 'learning_rate': 0.23919820763258223, 'max_depth': 9, 'min_child_weight': 2, 'subsample': 0.6, 'colsample_bytree': 0.5, 'colsample_bylevel': 0.6, 'reg_alpha': 1.0837721009192727, 'reg_lambda': 63.11340546369484, 'gamma': 0.0009026356054274335}. Best is trial 91 with value: -3.5956052874304505.
[I 2026-07-20 13:11:41,667] Trial 106 finished with value: -1.8966468227453122 and parameters: {'error_threshold': 0.25, 'scalers': 'none', 'ratios': 'log_ratio', 'imputers': 'mean', 'n_estimators': 2550, 'learning_rate': 0.4910076659182803, 'max_depth': 9, 'min_child_weight': 2, 'subsample': 0.6, 'colsample_bytree': 0.5, 'colsample_bylevel': 1.0, 'reg_alpha': 2.4283873203002573, 'reg_lambda': 25.461083264247968, 'gamma': 0.00026522146727723356}. Best is trial 91 with value: -3.5956052874304505.
[I 2026-07-20 13:12:39,632] Trial 107 finished with value: -2.0699258347373646 and parameters: {'error_threshold': 4.75, 'scalers': 'none', 'ratios': 'log_ratio', 'imputers': 'mean', 'n_estimators': 2600, 'learning_rate': 0.49375141646272547, 'max_depth': 9, 'min_child_weight': 2, 'subsample': 0.6, 'colsample_bytree': 1.0, 'colsample_bylevel': 0.7, 'reg_alpha': 0.0005854186659106703, 'reg_lambda': 62.65045830457429, 'gamma': 0.0003359573188348054}. Best is trial 91 with value: -3.5956052874304505.
[I 2026-07-20 13:12:48,042] Trial 108 finished with value: -2.0483523779958834 and parameters: {'error_threshold': 4.75, 'scalers': 'none', 'ratios': 'log_ratio', 'imputers': 'mean', 'n_estimators': 2550, 'learning_rate': 0.49571135933209676, 'max_depth': 10, 'min_child_weight': 2, 'subsample': 0.6, 'colsample_bytree': 0.5, 'colsample_bylevel': 0.7, 'reg_alpha': 0.0006221597712226259, 'reg_lambda': 24.967415562945533, 'gamma': 0.0018764086799137126}. Best is trial 91 with value: -3.5956052874304505.
[I 2026-07-20 13:12:59,726] Trial 109 finished with value: -1.829641758975398 and parameters: {'error_threshold': 4.75, 'scalers': 'none', 'ratios': 'log_ratio', 'imputers': 'mean', 'n_estimators': 2500, 'learning_rate': 0.49286397887919503, 'max_depth': 9, 'min_child_weight': 2, 'subsample': 0.6, 'colsample_bytree': 1.0, 'colsample_bylevel': 0.7, 'reg_alpha': 0.0006007794835299794, 'reg_lambda': 23.738796531603743, 'gamma': 0.000746862398306859}. Best is trial 91 with value: -3.5956052874304505.
[I 2026-07-20 13:13:26,699] Trial 110 finished with value: -1.7630489975442636 and parameters: {'error_threshold': 5.0, 'scalers': 'none', 'ratios': 'log_ratio', 'imputers': 'mean', 'n_estimators': 2500, 'learning_rate': 0.4343711468153335, 'max_depth': 9, 'min_child_weight': 2, 'subsample': 0.6, 'colsample_bytree': 0.6, 'colsample_bylevel': 0.7, 'reg_alpha': 0.0005180980577331785, 'reg_lambda': 21.399676195908494, 'gamma': 0.0009289570945345501}. Best is trial 91 with value: -3.5956052874304505.
[I 2026-07-20 13:13:39,654] Trial 112 finished with value: -0.6914482800598168 and parameters: {'error_threshold': 4.75, 'scalers': 'none', 'ratios': 'log_ratio', 'imputers': 'mean', 'n_estimators': 2900, 'learning_rate': 0.4557399014989831, 'max_depth': 9, 'min_child_weight': 2, 'subsample': 0.6, 'colsample_bytree': 0.6, 'colsample_bylevel': 0.7, 'reg_alpha': 56.23040075110835, 'reg_lambda': 24.824273212465613, 'gamma': 0.0008441270792617483}. Best is trial 91 with value: -3.5956052874304505.
[I 2026-07-20 13:13:50,412] Trial 113 finished with value: -0.7060175982454139 and parameters: {'error_threshold': 4.75, 'scalers': 'none', 'ratios': 'log_ratio', 'imputers': 'mean', 'n_estimators': 2900, 'learning_rate': 0.31002769558463444, 'max_depth': 12, 'min_child_weight': 2, 'subsample': 0.6, 'colsample_bytree': 0.6, 'colsample_bylevel': 0.7, 'reg_alpha': 80.92528444380729, 'reg_lambda': 24.686957995471342, 'gamma': 0.0002694001083188533}. Best is trial 91 with value: -3.5956052874304505.
[I 2026-07-20 13:14:07,715] Trial 111 finished with value: -1.9542363556562858 and parameters: {'error_threshold': 4.75, 'scalers': 'none', 'ratios': 'log_ratio', 'imputers': 'mean', 'n_estimators': 2900, 'learning_rate': 0.4923485348264113, 'max_depth': 9, 'min_child_weight': 2, 'subsample': 0.6, 'colsample_bytree': 0.6, 'colsample_bylevel': 0.7, 'reg_alpha': 0.0006903795421246133, 'reg_lambda': 25.389485671109657, 'gamma': 0.0009516238094298845}. Best is trial 91 with value: -3.5956052874304505.
[I 2026-07-20 13:14:09,064] Trial 114 finished with value: -0.7359853690536472 and parameters: {'error_threshold': 4.75, 'scalers': 'none', 'ratios': 'log_ratio', 'imputers': 'mean', 'n_estimators': 2900, 'learning_rate': 0.3051138094934028, 'max_depth': 12, 'min_child_weight': 2, 'subsample': 0.6, 'colsample_bytree': 0.9, 'colsample_bylevel': 0.7, 'reg_alpha': 0.008240276305722775, 'reg_lambda': 25.093620444859607, 'gamma': 44.62752070531302}. Best is trial 91 with value: -3.5956052874304505.
[I 2026-07-20 13:17:47,672] Trial 115 finished with value: -1.4793124840866845 and parameters: {'error_threshold': 4.75, 'scalers': 'none', 'ratios': 'log_ratio', 'imputers': 'mean', 'n_estimators': 2400, 'learning_rate': 0.31200005917936324, 'max_depth': 10, 'min_child_weight': 2, 'subsample': 0.6, 'colsample_bytree': 1.0, 'colsample_bylevel': 0.7, 'reg_alpha': 0.0005024701786075196, 'reg_lambda': 21.960619914103788, 'gamma': 6.246784296053403e-05}. Best is trial 91 with value: -3.5956052874304505.
[I 2026-07-20 13:17:56,622] Trial 116 finished with value: -1.5014921856162733 and parameters: {'error_threshold': 4.75, 'scalers': 'none', 'ratios': 'log_ratio', 'imputers': 'mean', 'n_estimators': 2400, 'learning_rate': 0.31489155757725595, 'max_depth': 9, 'min_child_weight': 2, 'subsample': 0.6, 'colsample_bytree': 1.0, 'colsample_bylevel': 0.7, 'reg_alpha': 0.000218316796448675, 'reg_lambda': 55.989153256333594, 'gamma': 0.00035360961379173115}. Best is trial 91 with value: -3.5956052874304505.
[I 2026-07-20 13:18:04,442] Trial 117 finished with value: -1.4279229564293783 and parameters: {'error_threshold': 4.5, 'scalers': 'none', 'ratios': 'log_ratio', 'imputers': 'mean', 'n_estimators': 2900, 'learning_rate': 0.28937332273499106, 'max_depth': 9, 'min_child_weight': 2, 'subsample': 0.6, 'colsample_bytree': 0.6, 'colsample_bylevel': 0.7, 'reg_alpha': 0.00020844315124590338, 'reg_lambda': 9.672387398858852, 'gamma': 9.195965733952386e-05}. Best is trial 91 with value: -3.5956052874304505.
[I 2026-07-20 13:19:14,367] Trial 118 finished with value: -1.547774707836771 and parameters: {'error_threshold': 4.75, 'scalers': 'none', 'ratios': 'log_ratio', 'imputers': 'mean', 'n_estimators': 2900, 'learning_rate': 0.30509813425459564, 'max_depth': 10, 'min_child_weight': 2, 'subsample': 0.6, 'colsample_bytree': 0.9, 'colsample_bylevel': 0.7, 'reg_alpha': 0.002442113499017125, 'reg_lambda': 52.19149384186276, 'gamma': 0.001780989676886206}. Best is trial 91 with value: -3.5956052874304505.
[I 2026-07-20 13:19:23,283] Trial 119 finished with value: -1.568872609066643 and parameters: {'error_threshold': 4.5, 'scalers': 'none', 'ratios': 'log_ratio', 'imputers': 'mean', 'n_estimators': 2400, 'learning_rate': 0.32420162027382343, 'max_depth': 10, 'min_child_weight': 2, 'subsample': 0.6, 'colsample_bytree': 0.9, 'colsample_bylevel': 0.7, 'reg_alpha': 0.00022198642357997182, 'reg_lambda': 51.13016949004105, 'gamma': 0.0003187214032381401}. Best is trial 91 with value: -3.5956052874304505.
[I 2026-07-20 13:19:35,666] Trial 120 finished with value: -2.328208610953066 and parameters: {'error_threshold': 4.5, 'scalers': 'none', 'ratios': 'log_ratio', 'imputers': 'mean', 'n_estimators': 2950, 'learning_rate': 0.3192568090503842, 'max_depth': 10, 'min_child_weight': 1, 'subsample': 0.6, 'colsample_bytree': 0.9, 'colsample_bylevel': 0.7, 'reg_alpha': 0.0024446032012776335, 'reg_lambda': 54.758761241015605, 'gamma': 0.001814897969050482}. Best is trial 91 with value: -3.5956052874304505.
[I 2026-07-20 13:20:15,413] Trial 121 finished with value: -1.930015394570548 and parameters: {'error_threshold': 4.5, 'scalers': 'none', 'ratios': 'log_ratio', 'imputers': 'mean', 'n_estimators': 2400, 'learning_rate': 0.33298382027577017, 'max_depth': 10, 'min_child_weight': 1, 'subsample': 0.6, 'colsample_bytree': 0.9, 'colsample_bylevel': 0.7, 'reg_alpha': 0.00021808966625693773, 'reg_lambda': 10.191196910623942, 'gamma': 0.0018551777972255303}. Best is trial 91 with value: -3.5956052874304505.
[I 2026-07-20 13:20:28,563] Trial 122 finished with value: -2.4934125632185173 and parameters: {'error_threshold': 4.5, 'scalers': 'none', 'ratios': 'log_ratio', 'imputers': 'mean', 'n_estimators': 3000, 'learning_rate': 0.3320173793536831, 'max_depth': 10, 'min_child_weight': 1, 'subsample': 0.6, 'colsample_bytree': 0.9, 'colsample_bylevel': 0.7, 'reg_alpha': 0.00021051391391874806, 'reg_lambda': 51.017136437794036, 'gamma': 8.524840345679336e-05}. Best is trial 91 with value: -3.5956052874304505.
[I 2026-07-20 13:23:13,329] Trial 124 finished with value: -0.9391486518065163 and parameters: {'error_threshold': 3.0, 'scalers': 'none', 'ratios': 'log_ratio', 'imputers': 'mean', 'n_estimators': 3000, 'learning_rate': 0.1653650835995768, 'max_depth': 10, 'min_child_weight': 7, 'subsample': 0.6, 'colsample_bytree': 0.9, 'colsample_bylevel': 0.7, 'reg_alpha': 0.0023079037375023123, 'reg_lambda': 10.990979730512123, 'gamma': 0.00010404209835578691}. Best is trial 91 with value: -3.5956052874304505.
[I 2026-07-20 13:23:19,461] Trial 125 finished with value: -0.9223434794212886 and parameters: {'error_threshold': 4.5, 'scalers': 'none', 'ratios': 'log_ratio', 'imputers': 'mean', 'n_estimators': 3000, 'learning_rate': 0.17492089592359478, 'max_depth': 10, 'min_child_weight': 8, 'subsample': 0.6, 'colsample_bytree': 0.9, 'colsample_bylevel': 0.7, 'reg_alpha': 0.0014739730208451936, 'reg_lambda': 51.40810636508932, 'gamma': 0.005314037040721562}. Best is trial 91 with value: -3.5956052874304505.
[I 2026-07-20 13:23:44,368] Trial 123 finished with value: -2.282828461962948 and parameters: {'error_threshold': 4.5, 'scalers': 'none', 'ratios': 'log_ratio', 'imputers': 'mean', 'n_estimators': 3000, 'learning_rate': 0.3386674351307028, 'max_depth': 10, 'min_child_weight': 1, 'subsample': 0.6, 'colsample_bytree': 0.9, 'colsample_bylevel': 0.7, 'reg_alpha': 0.00020392127889122213, 'reg_lambda': 56.665497286425214, 'gamma': 0.0043754919221299935}. Best is trial 91 with value: -3.5956052874304505.
[I 2026-07-20 13:23:51,748] Trial 126 finished with value: -0.9489772350960791 and parameters: {'error_threshold': 4.5, 'scalers': 'none', 'ratios': 'log_ratio', 'imputers': 'median', 'n_estimators': 3000, 'learning_rate': 0.17146483970636262, 'max_depth': 10, 'min_child_weight': 7, 'subsample': 0.6, 'colsample_bytree': 0.9, 'colsample_bylevel': 0.7, 'reg_alpha': 0.0009276502310427034, 'reg_lambda': 37.841095749460166, 'gamma': 0.004030726665892603}. Best is trial 91 with value: -3.5956052874304505.
[I 2026-07-20 13:24:34,204] Trial 127 finished with value: -1.1200812110213831 and parameters: {'error_threshold': 4.5, 'scalers': 'none', 'ratios': 'log_ratio', 'imputers': 'median', 'n_estimators': 2800, 'learning_rate': 0.3928444373516737, 'max_depth': 10, 'min_child_weight': 7, 'subsample': 0.6, 'colsample_bytree': 0.9, 'colsample_bylevel': 0.7, 'reg_alpha': 0.0015613742167219589, 'reg_lambda': 13.102901861374056, 'gamma': 0.004893562276352783}. Best is trial 91 with value: -3.5956052874304505.
[I 2026-07-20 13:24:42,580] Trial 128 finished with value: -1.1031138612136573 and parameters: {'error_threshold': 5.0, 'scalers': 'none', 'ratios': 'log_ratio', 'imputers': 'mean', 'n_estimators': 3000, 'learning_rate': 0.40711567344452176, 'max_depth': 10, 'min_child_weight': 8, 'subsample': 0.6, 'colsample_bytree': 0.9, 'colsample_bylevel': 0.7, 'reg_alpha': 0.0016712004733747266, 'reg_lambda': 37.55426164653494, 'gamma': 0.0018049068710823517}. Best is trial 91 with value: -3.5956052874304505.
[I 2026-07-20 13:25:16,480] Trial 129 finished with value: -0.6672555888977006 and parameters: {'error_threshold': 5.0, 'scalers': 'none', 'ratios': 'log_ratio', 'imputers': 'mean', 'n_estimators': 2800, 'learning_rate': 0.0006595876624394324, 'max_depth': 10, 'min_child_weight': 8, 'subsample': 0.6, 'colsample_bytree': 0.9, 'colsample_bylevel': 0.7, 'reg_alpha': 0.001365727307732021, 'reg_lambda': 39.20188560063095, 'gamma': 0.004888721995117637}. Best is trial 91 with value: -3.5956052874304505.
[I 2026-07-20 13:25:53,603] Trial 130 finished with value: -1.5730698135898702 and parameters: {'error_threshold': 5.0, 'scalers': 'none', 'ratios': 'log_ratio', 'imputers': 'median', 'n_estimators': 3000, 'learning_rate': 0.1751466442902192, 'max_depth': 10, 'min_child_weight': 1, 'subsample': 0.6, 'colsample_bytree': 0.9, 'colsample_bylevel': 0.7, 'reg_alpha': 0.4366796881768904, 'reg_lambda': 37.40049463317294, 'gamma': 0.005734925951279896}. Best is trial 91 with value: -3.5956052874304505.
[I 2026-07-20 13:30:36,638] Trial 131 finished with value: -2.7755123133434414 and parameters: {'error_threshold': 5.0, 'scalers': 'none', 'ratios': 'log_ratio', 'imputers': 'median', 'n_estimators': 2800, 'learning_rate': 0.4052903098343043, 'max_depth': 10, 'min_child_weight': 1, 'subsample': 0.6, 'colsample_bytree': 0.9, 'colsample_bylevel': 0.7, 'reg_alpha': 0.0012868701500565614, 'reg_lambda': 37.07267700876732, 'gamma': 0.004086498231265822}. Best is trial 91 with value: -3.5956052874304505.
[I 2026-07-20 13:31:27,923] Trial 132 finished with value: -3.2393515355965365 and parameters: {'error_threshold': 4.25, 'scalers': 'none', 'ratios': 'log_ratio', 'imputers': 'median', 'n_estimators': 2800, 'learning_rate': 0.40739247422714825, 'max_depth': 12, 'min_child_weight': 1, 'subsample': 0.6, 'colsample_bytree': 0.9, 'colsample_bylevel': 0.7, 'reg_alpha': 0.0009519766189563792, 'reg_lambda': 36.103260711955315, 'gamma': 3.650281798402684e-05}. Best is trial 91 with value: -3.5956052874304505.
[I 2026-07-20 13:31:40,804] Trial 133 finished with value: -2.7016650440035224 and parameters: {'error_threshold': 4.25, 'scalers': 'none', 'ratios': 'log_ratio', 'imputers': 'median', 'n_estimators': 2800, 'learning_rate': 0.405803149184347, 'max_depth': 10, 'min_child_weight': 1, 'subsample': 0.6, 'colsample_bytree': 0.9, 'colsample_bylevel': 0.7, 'reg_alpha': 0.0011951969413069754, 'reg_lambda': 38.47269334688135, 'gamma': 0.005106398659648812}. Best is trial 91 with value: -3.5956052874304505.
[I 2026-07-20 13:31:53,900] Trial 134 finished with value: -2.24357915958503 and parameters: {'error_threshold': 4.25, 'scalers': 'none', 'ratios': 'log_ratio', 'imputers': 'median', 'n_estimators': 2800, 'learning_rate': 0.382634885282904, 'max_depth': 10, 'min_child_weight': 1, 'subsample': 0.6, 'colsample_bytree': 0.9, 'colsample_bylevel': 0.7, 'reg_alpha': 3.123288165608437e-05, 'reg_lambda': 14.591681898223937, 'gamma': 2.5208684431502823e-05}. Best is trial 91 with value: -3.5956052874304505.
[I 2026-07-20 13:32:47,196] Trial 135 finished with value: -3.5302004661359034 and parameters: {'error_threshold': 4.25, 'scalers': 'none', 'ratios': 'log_ratio', 'imputers': 'median', 'n_estimators': 2800, 'learning_rate': 0.3987010758496769, 'max_depth': 12, 'min_child_weight': 1, 'subsample': 0.6, 'colsample_bytree': 0.9, 'colsample_bylevel': 0.7, 'reg_alpha': 0.38389667786189585, 'reg_lambda': 35.824820441317925, 'gamma': 2.6603904705665847e-05}. Best is trial 91 with value: -3.5956052874304505.
[I 2026-07-20 13:33:03,729] Trial 136 finished with value: -0.7718173095180522 and parameters: {'error_threshold': 4.25, 'scalers': 'none', 'ratios': 'log_ratio', 'imputers': 'median', 'n_estimators': 2800, 'learning_rate': 0.002650445053782645, 'max_depth': 12, 'min_child_weight': 1, 'subsample': 0.6, 'colsample_bytree': 0.9, 'colsample_bylevel': 0.7, 'reg_alpha': 3.5400652894376516e-05, 'reg_lambda': 16.00480963783696, 'gamma': 2.060433058077639e-05}. Best is trial 91 with value: -3.5956052874304505.
[I 2026-07-20 13:33:34,458] Trial 137 finished with value: -2.1341229398668933 and parameters: {'error_threshold': 4.25, 'scalers': 'none', 'ratios': 'log_ratio', 'imputers': 'median', 'n_estimators': 2800, 'learning_rate': 0.35885550114502784, 'max_depth': 12, 'min_child_weight': 1, 'subsample': 0.6, 'colsample_bytree': 0.9, 'colsample_bylevel': 0.7, 'reg_alpha': 2.6925863428986024e-05, 'reg_lambda': 16.170528307068796, 'gamma': 0.012554056357070355}. Best is trial 91 with value: -3.5956052874304505.
[I 2026-07-20 13:34:33,900] Trial 138 finished with value: -2.2400592195966738 and parameters: {'error_threshold': 4.25, 'scalers': 'none', 'ratios': 'log_ratio', 'imputers': 'mean', 'n_estimators': 2800, 'learning_rate': 0.35984407292121906, 'max_depth': 12, 'min_child_weight': 1, 'subsample': 0.6, 'colsample_bytree': 0.9, 'colsample_bylevel': 0.7, 'reg_alpha': 0.0003082102006441067, 'reg_lambda': 16.004187213728045, 'gamma': 3.756547422445165e-05}. Best is trial 91 with value: -3.5956052874304505.
slurmstepd: error: *** JOB 3103451 ON cpu105 CANCELLED AT 2026-07-20T13:34:56 ***
