[I 2026-07-20 18:12:45,682] Trial 313 finished with value: -1.702234851287576 and parameters: {'error_threshold': 3.85, 'scalers': 'standard', 'ratios': 'norm_ratio', 'imputers': 'mean', 'n_estimators': 1950, 'learning_rate': 0.2613342387234421, 'max_depth': 12, 'min_child_weight': 1, 'subsample': 0.7, 'colsample_bytree': 1.0, 'colsample_bylevel': 1.0, 'reg_alpha': 8.901765094517975e-06, 'reg_lambda': 64.37333462146321, 'gamma': 0.000119645821720652}. Best is trial 209 with value: -2.117388370040747.
[I 2026-07-20 18:17:24,974] Trial 314 finished with value: -1.7452576369775137 and parameters: {'error_threshold': 3.85, 'scalers': 'standard', 'ratios': 'norm_ratio', 'imputers': 'mean', 'n_estimators': 1950, 'learning_rate': 0.2648265735965614, 'max_depth': 12, 'min_child_weight': 1, 'subsample': 0.7, 'colsample_bytree': 0.7, 'colsample_bylevel': 1.0, 'reg_alpha': 8.336328897800196e-06, 'reg_lambda': 64.48992384027073, 'gamma': 0.0001232506867637534}. Best is trial 209 with value: -2.117388370040747.
[I 2026-07-20 18:17:36,559] Trial 316 finished with value: -1.7697069852316856 and parameters: {'error_threshold': 3.85, 'scalers': 'standard', 'ratios': 'norm_ratio', 'imputers': 'mean', 'n_estimators': 1900, 'learning_rate': 0.27788650139917664, 'max_depth': 12, 'min_child_weight': 1, 'subsample': 0.7, 'colsample_bytree': 0.7, 'colsample_bylevel': 1.0, 'reg_alpha': 8.471181609579652e-06, 'reg_lambda': 65.09455360094056, 'gamma': 9.277546956118447e-05}. Best is trial 209 with value: -2.117388370040747.
[I 2026-07-20 18:17:51,357] Trial 315 finished with value: -1.6910974209099576 and parameters: {'error_threshold': 3.85, 'scalers': 'standard', 'ratios': 'norm_ratio', 'imputers': 'mean', 'n_estimators': 1900, 'learning_rate': 0.26203037621594855, 'max_depth': 12, 'min_child_weight': 1, 'subsample': 0.7, 'colsample_bytree': 1.0, 'colsample_bylevel': 1.0, 'reg_alpha': 7.5684711194288125e-06, 'reg_lambda': 71.6334728750204, 'gamma': 9.692856814489013e-05}. Best is trial 209 with value: -2.117388370040747.
[I 2026-07-20 18:17:59,482] Trial 318 finished with value: -1.762260480279673 and parameters: {'error_threshold': 3.85, 'scalers': 'standard', 'ratios': 'norm_ratio', 'imputers': 'mean', 'n_estimators': 1900, 'learning_rate': 0.2663873472203229, 'max_depth': 12, 'min_child_weight': 1, 'subsample': 0.7, 'colsample_bytree': 0.5, 'colsample_bylevel': 1.0, 'reg_alpha': 7.228615641774054e-06, 'reg_lambda': 52.59069316811615, 'gamma': 8.590706442772101e-05}. Best is trial 209 with value: -2.117388370040747.
[I 2026-07-20 18:18:08,069] Trial 319 finished with value: -1.7496596024060522 and parameters: {'error_threshold': 3.6, 'scalers': 'standard', 'ratios': 'norm_ratio', 'imputers': 'mean', 'n_estimators': 1900, 'learning_rate': 0.26219698009042935, 'max_depth': 12, 'min_child_weight': 1, 'subsample': 0.7, 'colsample_bytree': 0.5, 'colsample_bylevel': 1.0, 'reg_alpha': 3.624290387277787e-06, 'reg_lambda': 69.02226918304676, 'gamma': 8.768715096808711e-05}. Best is trial 209 with value: -2.117388370040747.
[I 2026-07-20 18:18:20,954] Trial 317 finished with value: -1.6856362226226285 and parameters: {'error_threshold': 3.85, 'scalers': 'standard', 'ratios': 'norm_ratio', 'imputers': 'mean', 'n_estimators': 1900, 'learning_rate': 0.2550140443453721, 'max_depth': 12, 'min_child_weight': 1, 'subsample': 0.7, 'colsample_bytree': 0.9, 'colsample_bylevel': 1.0, 'reg_alpha': 8.034778584084646e-06, 'reg_lambda': 68.12065133084874, 'gamma': 8.603240450418264e-05}. Best is trial 209 with value: -2.117388370040747.
[I 2026-07-20 18:18:20,959] A new study created in Journal with name: mean_study_7_20_26
/bsuhome/alexanderemert/Research/Star-Formation-Research-Project-2026/pipeline/scripts/optuna/final_preds_and_models/optuna_search_mult_quant_reg.py:161: UserWarning: The distribution is specified by [0.1, 5] and step=0.25, but the range is not divisible by `step`. It will be replaced with [0.1, 4.85].
  error_threshold = trial.suggest_float("error_threshold", 0.1, 5, step=0.25)
[I 2026-07-20 18:18:21,771] Trial 5 finished with value: -4.702709374151207 and parameters: {'error_threshold': 0.85, 'scalers': 'none', 'ratios': 'log_ratio', 'imputers': 'median', 'n_estimators': 100, 'learning_rate': 0.00014719912339272178, 'max_depth': 3, 'min_child_weight': 1, 'subsample': 0.7, 'colsample_bytree': 0.8, 'colsample_bylevel': 0.6, 'reg_alpha': 0.00011293375993676515, 'reg_lambda': 0.4298066097644027, 'gamma': 0.5681703396800006}. Best is trial 5 with value: -4.702709374151207.
/bsuhome/alexanderemert/Research/Star-Formation-Research-Project-2026/pipeline/scripts/optuna/final_preds_and_models/optuna_search_mult_quant_reg.py:161: UserWarning: The distribution is specified by [0.1, 5] and step=0.25, but the range is not divisible by `step`. It will be replaced with [0.1, 4.85].
  error_threshold = trial.suggest_float("error_threshold", 0.1, 5, step=0.25)
[I 2026-07-20 18:18:24,024] Trial 3 finished with value: -3.9044359467633956 and parameters: {'error_threshold': 0.35, 'scalers': 'robust', 'ratios': 'log_ratio', 'imputers': 'mean', 'n_estimators': 1200, 'learning_rate': 0.025124058949389214, 'max_depth': 3, 'min_child_weight': 5, 'subsample': 0.6, 'colsample_bytree': 1.0, 'colsample_bylevel': 0.9, 'reg_alpha': 0.1851485480996213, 'reg_lambda': 0.020734076986035088, 'gamma': 0.4612053772936833}. Best is trial 3 with value: -3.9044359467633956.
/bsuhome/alexanderemert/Research/Star-Formation-Research-Project-2026/pipeline/scripts/optuna/final_preds_and_models/optuna_search_mult_quant_reg.py:161: UserWarning: The distribution is specified by [0.1, 5] and step=0.25, but the range is not divisible by `step`. It will be replaced with [0.1, 4.85].
  error_threshold = trial.suggest_float("error_threshold", 0.1, 5, step=0.25)
[I 2026-07-20 18:18:24,970] Trial 8 finished with value: -4.3287885307708835 and parameters: {'error_threshold': 1.1, 'scalers': 'none', 'ratios': 'norm_ratio', 'imputers': 'mean', 'n_estimators': 3000, 'learning_rate': 0.3494548402576073, 'max_depth': 5, 'min_child_weight': 2, 'subsample': 0.9, 'colsample_bytree': 0.6, 'colsample_bylevel': 0.5, 'reg_alpha': 1.8604633967216402, 'reg_lambda': 2.671874588205246e-06, 'gamma': 1.8523494928871769}. Best is trial 3 with value: -3.9044359467633956.
/bsuhome/alexanderemert/Research/Star-Formation-Research-Project-2026/pipeline/scripts/optuna/final_preds_and_models/optuna_search_mult_quant_reg.py:161: UserWarning: The distribution is specified by [0.1, 5] and step=0.25, but the range is not divisible by `step`. It will be replaced with [0.1, 4.85].
  error_threshold = trial.suggest_float("error_threshold", 0.1, 5, step=0.25)
[I 2026-07-20 18:18:26,240] Trial 4 finished with value: -4.214622591186106 and parameters: {'error_threshold': 0.6, 'scalers': 'standard', 'ratios': 'log_ratio', 'imputers': 'median', 'n_estimators': 1500, 'learning_rate': 0.12047046800867621, 'max_depth': 12, 'min_child_weight': 7, 'subsample': 0.5, 'colsample_bytree': 0.9, 'colsample_bylevel': 0.7, 'reg_alpha': 0.003077802818576092, 'reg_lambda': 0.3799239945479214, 'gamma': 4.162860530861731}. Best is trial 3 with value: -3.9044359467633956.
/bsuhome/alexanderemert/Research/Star-Formation-Research-Project-2026/pipeline/scripts/optuna/final_preds_and_models/optuna_search_mult_quant_reg.py:161: UserWarning: The distribution is specified by [0.1, 5] and step=0.25, but the range is not divisible by `step`. It will be replaced with [0.1, 4.85].
  error_threshold = trial.suggest_float("error_threshold", 0.1, 5, step=0.25)
[I 2026-07-20 18:18:28,485] Trial 7 finished with value: -4.05562512512592 and parameters: {'error_threshold': 0.6, 'scalers': 'robust', 'ratios': 'norm_ratio', 'imputers': 'mean', 'n_estimators': 650, 'learning_rate': 0.0010901779937183514, 'max_depth': 7, 'min_child_weight': 8, 'subsample': 0.7, 'colsample_bytree': 0.9, 'colsample_bylevel': 0.5, 'reg_alpha': 1.8262826132667147, 'reg_lambda': 0.6463655773624872, 'gamma': 3.106304304897717e-06}. Best is trial 3 with value: -3.9044359467633956.
/bsuhome/alexanderemert/Research/Star-Formation-Research-Project-2026/pipeline/scripts/optuna/final_preds_and_models/optuna_search_mult_quant_reg.py:161: UserWarning: The distribution is specified by [0.1, 5] and step=0.25, but the range is not divisible by `step`. It will be replaced with [0.1, 4.85].
  error_threshold = trial.suggest_float("error_threshold", 0.1, 5, step=0.25)
[I 2026-07-20 18:18:29,018] Trial 9 finished with value: -3.821424554703333 and parameters: {'error_threshold': 4.85, 'scalers': 'standard', 'ratios': 'log_ratio', 'imputers': 'none', 'n_estimators': 200, 'learning_rate': 0.009113750668326934, 'max_depth': 11, 'min_child_weight': 9, 'subsample': 0.5, 'colsample_bytree': 0.8, 'colsample_bylevel': 0.8, 'reg_alpha': 0.009588645602972855, 'reg_lambda': 0.5668765983118039, 'gamma': 81.96074445063948}. Best is trial 9 with value: -3.821424554703333.
/bsuhome/alexanderemert/Research/Star-Formation-Research-Project-2026/pipeline/scripts/optuna/final_preds_and_models/optuna_search_mult_quant_reg.py:161: UserWarning: The distribution is specified by [0.1, 5] and step=0.25, but the range is not divisible by `step`. It will be replaced with [0.1, 4.85].
  error_threshold = trial.suggest_float("error_threshold", 0.1, 5, step=0.25)
[I 2026-07-20 18:18:32,473] Trial 1 finished with value: -4.180153700634203 and parameters: {'error_threshold': 1.85, 'scalers': 'robust', 'ratios': 'log_ratio', 'imputers': 'mean', 'n_estimators': 1100, 'learning_rate': 0.0004398420015032358, 'max_depth': 7, 'min_child_weight': 6, 'subsample': 0.7, 'colsample_bytree': 0.6, 'colsample_bylevel': 0.8, 'reg_alpha': 0.015374053620546106, 'reg_lambda': 0.006293617390826299, 'gamma': 50.73967447571533}. Best is trial 9 with value: -3.821424554703333.
/bsuhome/alexanderemert/Research/Star-Formation-Research-Project-2026/pipeline/scripts/optuna/final_preds_and_models/optuna_search_mult_quant_reg.py:161: UserWarning: The distribution is specified by [0.1, 5] and step=0.25, but the range is not divisible by `step`. It will be replaced with [0.1, 4.85].
  error_threshold = trial.suggest_float("error_threshold", 0.1, 5, step=0.25)
[I 2026-07-20 18:18:36,958] Trial 0 finished with value: -3.8381249117016236 and parameters: {'error_threshold': 2.1, 'scalers': 'robust', 'ratios': 'norm_ratio', 'imputers': 'mean', 'n_estimators': 2500, 'learning_rate': 0.003266061034592041, 'max_depth': 6, 'min_child_weight': 4, 'subsample': 1.0, 'colsample_bytree': 0.6, 'colsample_bylevel': 0.5, 'reg_alpha': 11.130847957376082, 'reg_lambda': 0.20638862751297282, 'gamma': 1.8064168601673177e-06}. Best is trial 9 with value: -3.821424554703333.
/bsuhome/alexanderemert/Research/Star-Formation-Research-Project-2026/pipeline/scripts/optuna/final_preds_and_models/optuna_search_mult_quant_reg.py:161: UserWarning: The distribution is specified by [0.1, 5] and step=0.25, but the range is not divisible by `step`. It will be replaced with [0.1, 4.85].
  error_threshold = trial.suggest_float("error_threshold", 0.1, 5, step=0.25)
[I 2026-07-20 18:18:37,351] Trial 11 finished with value: -4.2021753213764255 and parameters: {'error_threshold': 0.6, 'scalers': 'standard', 'ratios': 'log_ratio', 'imputers': 'median', 'n_estimators': 900, 'learning_rate': 0.4640676163581866, 'max_depth': 5, 'min_child_weight': 7, 'subsample': 0.8, 'colsample_bytree': 0.9, 'colsample_bylevel': 0.9, 'reg_alpha': 7.842438767729426, 'reg_lambda': 4.3171299127408035e-05, 'gamma': 30.62780246310213}. Best is trial 9 with value: -3.821424554703333.
/bsuhome/alexanderemert/Research/Star-Formation-Research-Project-2026/pipeline/scripts/optuna/final_preds_and_models/optuna_search_mult_quant_reg.py:161: UserWarning: The distribution is specified by [0.1, 5] and step=0.25, but the range is not divisible by `step`. It will be replaced with [0.1, 4.85].
  error_threshold = trial.suggest_float("error_threshold", 0.1, 5, step=0.25)
[I 2026-07-20 18:18:42,838] Trial 6 finished with value: -4.153386421190164 and parameters: {'error_threshold': 1.6, 'scalers': 'none', 'ratios': 'norm_ratio', 'imputers': 'mean', 'n_estimators': 2150, 'learning_rate': 0.031018180568244395, 'max_depth': 8, 'min_child_weight': 10, 'subsample': 0.6, 'colsample_bytree': 0.6, 'colsample_bylevel': 0.6, 'reg_alpha': 0.00019918702979482264, 'reg_lambda': 0.06469926086495648, 'gamma': 3.2520095417277052e-06}. Best is trial 9 with value: -3.821424554703333.
/bsuhome/alexanderemert/Research/Star-Formation-Research-Project-2026/pipeline/scripts/optuna/final_preds_and_models/optuna_search_mult_quant_reg.py:161: UserWarning: The distribution is specified by [0.1, 5] and step=0.25, but the range is not divisible by `step`. It will be replaced with [0.1, 4.85].
  error_threshold = trial.suggest_float("error_threshold", 0.1, 5, step=0.25)
[I 2026-07-20 18:18:51,489] Trial 2 finished with value: -3.8309224892179894 and parameters: {'error_threshold': 1.85, 'scalers': 'standard', 'ratios': 'log_ratio', 'imputers': 'mean', 'n_estimators': 1500, 'learning_rate': 0.002177143764482768, 'max_depth': 8, 'min_child_weight': 6, 'subsample': 0.9, 'colsample_bytree': 0.6, 'colsample_bylevel': 1.0, 'reg_alpha': 12.162325305272116, 'reg_lambda': 1.3844883144048693e-06, 'gamma': 0.00730724005351053}. Best is trial 9 with value: -3.821424554703333.
/bsuhome/alexanderemert/Research/Star-Formation-Research-Project-2026/pipeline/scripts/optuna/final_preds_and_models/optuna_search_mult_quant_reg.py:161: UserWarning: The distribution is specified by [0.1, 5] and step=0.25, but the range is not divisible by `step`. It will be replaced with [0.1, 4.85].
  error_threshold = trial.suggest_float("error_threshold", 0.1, 5, step=0.25)
[I 2026-07-20 18:18:54,169] Trial 12 finished with value: -4.619464257098605 and parameters: {'error_threshold': 2.1, 'scalers': 'robust', 'ratios': 'log_ratio', 'imputers': 'median', 'n_estimators': 2600, 'learning_rate': 0.4475124376977846, 'max_depth': 3, 'min_child_weight': 10, 'subsample': 1.0, 'colsample_bytree': 1.0, 'colsample_bylevel': 0.9, 'reg_alpha': 0.23836304261767718, 'reg_lambda': 1.0789441142702184e-06, 'gamma': 3.0610217752184746e-05}. Best is trial 9 with value: -3.821424554703333.
/bsuhome/alexanderemert/Research/Star-Formation-Research-Project-2026/pipeline/scripts/optuna/final_preds_and_models/optuna_search_mult_quant_reg.py:161: UserWarning: The distribution is specified by [0.1, 5] and step=0.25, but the range is not divisible by `step`. It will be replaced with [0.1, 4.85].
  error_threshold = trial.suggest_float("error_threshold", 0.1, 5, step=0.25)
[I 2026-07-20 18:18:55,239] Trial 14 finished with value: -4.019065455986207 and parameters: {'error_threshold': 0.85, 'scalers': 'standard', 'ratios': 'log_ratio', 'imputers': 'median', 'n_estimators': 750, 'learning_rate': 0.06603266157692066, 'max_depth': 4, 'min_child_weight': 1, 'subsample': 0.9, 'colsample_bytree': 0.8, 'colsample_bylevel': 0.7, 'reg_alpha': 8.429655685961002, 'reg_lambda': 3.828329548373013, 'gamma': 0.11991342018213315}. Best is trial 9 with value: -3.821424554703333.
/bsuhome/alexanderemert/Research/Star-Formation-Research-Project-2026/pipeline/scripts/optuna/final_preds_and_models/optuna_search_mult_quant_reg.py:161: UserWarning: The distribution is specified by [0.1, 5] and step=0.25, but the range is not divisible by `step`. It will be replaced with [0.1, 4.85].
  error_threshold = trial.suggest_float("error_threshold", 0.1, 5, step=0.25)
[I 2026-07-20 18:18:57,291] Trial 16 finished with value: -4.273448783697504 and parameters: {'error_threshold': 3.1, 'scalers': 'robust', 'ratios': 'log_ratio', 'imputers': 'mean', 'n_estimators': 450, 'learning_rate': 0.2768477698671108, 'max_depth': 12, 'min_child_weight': 5, 'subsample': 1.0, 'colsample_bytree': 1.0, 'colsample_bylevel': 0.6, 'reg_alpha': 0.01866654972881046, 'reg_lambda': 1.5625638838240562e-06, 'gamma': 4.541811174049054e-06}. Best is trial 9 with value: -3.821424554703333.
/bsuhome/alexanderemert/Research/Star-Formation-Research-Project-2026/pipeline/scripts/optuna/final_preds_and_models/optuna_search_mult_quant_reg.py:161: UserWarning: The distribution is specified by [0.1, 5] and step=0.25, but the range is not divisible by `step`. It will be replaced with [0.1, 4.85].
  error_threshold = trial.suggest_float("error_threshold", 0.1, 5, step=0.25)
[I 2026-07-20 18:19:14,274] Trial 10 finished with value: -4.170467850644528 and parameters: {'error_threshold': 4.85, 'scalers': 'none', 'ratios': 'log_ratio', 'imputers': 'none', 'n_estimators': 2250, 'learning_rate': 0.0002154876947091589, 'max_depth': 9, 'min_child_weight': 9, 'subsample': 0.6, 'colsample_bytree': 1.0, 'colsample_bylevel': 0.9, 'reg_alpha': 0.009733168296842168, 'reg_lambda': 0.4333553707028421, 'gamma': 0.21011160887015012}. Best is trial 9 with value: -3.821424554703333.
/bsuhome/alexanderemert/Research/Star-Formation-Research-Project-2026/pipeline/scripts/optuna/final_preds_and_models/optuna_search_mult_quant_reg.py:161: UserWarning: The distribution is specified by [0.1, 5] and step=0.25, but the range is not divisible by `step`. It will be replaced with [0.1, 4.85].
  error_threshold = trial.suggest_float("error_threshold", 0.1, 5, step=0.25)
[I 2026-07-20 18:19:34,305] Trial 13 finished with value: -4.3853504066790805 and parameters: {'error_threshold': 0.85, 'scalers': 'standard', 'ratios': 'norm_ratio', 'imputers': 'mean', 'n_estimators': 2050, 'learning_rate': 0.000128044320661561, 'max_depth': 10, 'min_child_weight': 4, 'subsample': 0.7, 'colsample_bytree': 0.9, 'colsample_bylevel': 0.6, 'reg_alpha': 0.0629677607856057, 'reg_lambda': 1.008015166991526, 'gamma': 1.96687756214195}. Best is trial 9 with value: -3.821424554703333.
/bsuhome/alexanderemert/Research/Star-Formation-Research-Project-2026/pipeline/scripts/optuna/final_preds_and_models/optuna_search_mult_quant_reg.py:161: UserWarning: The distribution is specified by [0.1, 5] and step=0.25, but the range is not divisible by `step`. It will be replaced with [0.1, 4.85].
  error_threshold = trial.suggest_float("error_threshold", 0.1, 5, step=0.25)
[I 2026-07-20 18:19:35,652] Trial 18 finished with value: -4.0543843042092504 and parameters: {'error_threshold': 4.6, 'scalers': 'standard', 'ratios': 'log_ratio', 'imputers': 'none', 'n_estimators': 200, 'learning_rate': 0.005183909380310784, 'max_depth': 11, 'min_child_weight': 10, 'subsample': 1.0, 'colsample_bytree': 0.7, 'colsample_bylevel': 1.0, 'reg_alpha': 2.2080218922526357e-06, 'reg_lambda': 79.12011671302675, 'gamma': 0.0021662751956435682}. Best is trial 9 with value: -3.821424554703333.
/bsuhome/alexanderemert/Research/Star-Formation-Research-Project-2026/pipeline/scripts/optuna/final_preds_and_models/optuna_search_mult_quant_reg.py:161: UserWarning: The distribution is specified by [0.1, 5] and step=0.25, but the range is not divisible by `step`. It will be replaced with [0.1, 4.85].
  error_threshold = trial.suggest_float("error_threshold", 0.1, 5, step=0.25)
[I 2026-07-20 18:19:36,213] Trial 19 finished with value: -4.063417820480435 and parameters: {'error_threshold': 4.6, 'scalers': 'standard', 'ratios': 'log_ratio', 'imputers': 'none', 'n_estimators': 150, 'learning_rate': 0.006062135248398667, 'max_depth': 11, 'min_child_weight': 9, 'subsample': 0.5, 'colsample_bytree': 0.7, 'colsample_bylevel': 1.0, 'reg_alpha': 1.078400947444226e-05, 'reg_lambda': 22.073325544900747, 'gamma': 0.003456561985449267}. Best is trial 9 with value: -3.821424554703333.
/bsuhome/alexanderemert/Research/Star-Formation-Research-Project-2026/pipeline/scripts/optuna/final_preds_and_models/optuna_search_mult_quant_reg.py:161: UserWarning: The distribution is specified by [0.1, 5] and step=0.25, but the range is not divisible by `step`. It will be replaced with [0.1, 4.85].
  error_threshold = trial.suggest_float("error_threshold", 0.1, 5, step=0.25)
[I 2026-07-20 18:19:47,172] Trial 17 finished with value: -3.843322080974167 and parameters: {'error_threshold': 4.6, 'scalers': 'standard', 'ratios': 'log_ratio', 'imputers': 'none', 'n_estimators': 1800, 'learning_rate': 0.0048642523912487716, 'max_depth': 12, 'min_child_weight': 10, 'subsample': 1.0, 'colsample_bytree': 0.5, 'colsample_bylevel': 1.0, 'reg_alpha': 1.1849328345313162e-06, 'reg_lambda': 53.17379724191725, 'gamma': 0.0032489304234252585}. Best is trial 9 with value: -3.821424554703333.
/bsuhome/alexanderemert/Research/Star-Formation-Research-Project-2026/pipeline/scripts/optuna/final_preds_and_models/optuna_search_mult_quant_reg.py:161: UserWarning: The distribution is specified by [0.1, 5] and step=0.25, but the range is not divisible by `step`. It will be replaced with [0.1, 4.85].
  error_threshold = trial.suggest_float("error_threshold", 0.1, 5, step=0.25)
[I 2026-07-20 18:19:47,382] Trial 20 finished with value: -4.251794033470982 and parameters: {'error_threshold': 4.6, 'scalers': 'standard', 'ratios': 'log_ratio', 'imputers': 'none', 'n_estimators': 100, 'learning_rate': 0.006277098121271415, 'max_depth': 10, 'min_child_weight': 9, 'subsample': 0.5, 'colsample_bytree': 0.5, 'colsample_bylevel': 1.0, 'reg_alpha': 1.7344052755562104e-06, 'reg_lambda': 49.7281228786764, 'gamma': 0.008137565411968122}. Best is trial 9 with value: -3.821424554703333.
/bsuhome/alexanderemert/Research/Star-Formation-Research-Project-2026/pipeline/scripts/optuna/final_preds_and_models/optuna_search_mult_quant_reg.py:161: UserWarning: The distribution is specified by [0.1, 5] and step=0.25, but the range is not divisible by `step`. It will be replaced with [0.1, 4.85].
  error_threshold = trial.suggest_float("error_threshold", 0.1, 5, step=0.25)
