[I 2026-07-21 09:53:19,247] Trial 264 finished with value: -0.09829904530057909 and parameters: {'error_threshold': 1.35, 'scalers': 'standard', 'ratios': 'norm_ratio', 'imputers': 'median', 'n_estimators': 1400, 'learning_rate': 0.03416287597644917, 'max_depth': 3, 'min_child_weight': 7, 'subsample': 0.8, 'colsample_bytree': 0.7, 'colsample_bylevel': 1.0, 'reg_alpha': 0.00011294955216177136, 'reg_lambda': 0.0042937992059304585, 'gamma': 0.006697514224836387}. Best is trial 263 with value: -0.09753725374857396.
/bsuhome/alexanderemert/Research/Star-Formation-Research-Project-2026/pipeline/scripts/optuna/final_preds_and_models/optuna_search_mult_quant_reg.py:75: UserWarning: The distribution is specified by [0.1, 5] and step=0.25, but the range is not divisible by `step`. It will be replaced with [0.1, 4.85].
  error_threshold = trial.suggest_float("error_threshold", 0.1, 5, step=0.25)
[I 2026-07-21 09:53:22,005] Trial 265 finished with value: -0.09815139340622625 and parameters: {'error_threshold': 1.35, 'scalers': 'standard', 'ratios': 'norm_ratio', 'imputers': 'median', 'n_estimators': 1100, 'learning_rate': 0.03561044852396822, 'max_depth': 3, 'min_child_weight': 7, 'subsample': 0.8, 'colsample_bytree': 0.7, 'colsample_bylevel': 1.0, 'reg_alpha': 3.7617042934298785e-05, 'reg_lambda': 0.004051646039254239, 'gamma': 0.0006539920622612817}. Best is trial 263 with value: -0.09753725374857396.
/bsuhome/alexanderemert/Research/Star-Formation-Research-Project-2026/pipeline/scripts/optuna/final_preds_and_models/optuna_search_mult_quant_reg.py:75: UserWarning: The distribution is specified by [0.1, 5] and step=0.25, but the range is not divisible by `step`. It will be replaced with [0.1, 4.85].
  error_threshold = trial.suggest_float("error_threshold", 0.1, 5, step=0.25)
[I 2026-07-21 09:53:24,749] Trial 266 finished with value: -0.09829080069254953 and parameters: {'error_threshold': 1.35, 'scalers': 'standard', 'ratios': 'norm_ratio', 'imputers': 'median', 'n_estimators': 1100, 'learning_rate': 0.021520547646478146, 'max_depth': 3, 'min_child_weight': 6, 'subsample': 0.8, 'colsample_bytree': 0.5, 'colsample_bylevel': 1.0, 'reg_alpha': 0.00010882266501811009, 'reg_lambda': 0.003849628614897621, 'gamma': 0.007554486886877694}. Best is trial 263 with value: -0.09753725374857396.
/bsuhome/alexanderemert/Research/Star-Formation-Research-Project-2026/pipeline/scripts/optuna/final_preds_and_models/optuna_search_mult_quant_reg.py:75: UserWarning: The distribution is specified by [0.1, 5] and step=0.25, but the range is not divisible by `step`. It will be replaced with [0.1, 4.85].
  error_threshold = trial.suggest_float("error_threshold", 0.1, 5, step=0.25)
[I 2026-07-21 09:53:28,689] Trial 267 finished with value: -0.12148560933795939 and parameters: {'error_threshold': 1.35, 'scalers': 'standard', 'ratios': 'norm_ratio', 'imputers': 'none', 'n_estimators': 1450, 'learning_rate': 0.030039114927767667, 'max_depth': 3, 'min_child_weight': 6, 'subsample': 0.8, 'colsample_bytree': 0.5, 'colsample_bylevel': 1.0, 'reg_alpha': 25.980642904095475, 'reg_lambda': 0.00420889719217776, 'gamma': 0.007540773460016286}. Best is trial 263 with value: -0.09753725374857396.
/bsuhome/alexanderemert/Research/Star-Formation-Research-Project-2026/pipeline/scripts/optuna/final_preds_and_models/optuna_search_mult_quant_reg.py:75: UserWarning: The distribution is specified by [0.1, 5] and step=0.25, but the range is not divisible by `step`. It will be replaced with [0.1, 4.85].
  error_threshold = trial.suggest_float("error_threshold", 0.1, 5, step=0.25)
[I 2026-07-21 09:53:31,541] Trial 268 finished with value: -0.097462601251184 and parameters: {'error_threshold': 1.35, 'scalers': 'standard', 'ratios': 'norm_ratio', 'imputers': 'none', 'n_estimators': 1450, 'learning_rate': 0.0301536992469937, 'max_depth': 3, 'min_child_weight': 6, 'subsample': 0.8, 'colsample_bytree': 0.5, 'colsample_bylevel': 1.0, 'reg_alpha': 0.00011184370106286872, 'reg_lambda': 0.0039876225368071505, 'gamma': 0.0006319904233868191}. Best is trial 268 with value: -0.097462601251184.
/bsuhome/alexanderemert/Research/Star-Formation-Research-Project-2026/pipeline/scripts/optuna/final_preds_and_models/optuna_search_mult_quant_reg.py:75: UserWarning: The distribution is specified by [0.1, 5] and step=0.25, but the range is not divisible by `step`. It will be replaced with [0.1, 4.85].
  error_threshold = trial.suggest_float("error_threshold", 0.1, 5, step=0.25)
[I 2026-07-21 09:53:39,570] Trial 269 finished with value: -0.0974912163294286 and parameters: {'error_threshold': 1.85, 'scalers': 'standard', 'ratios': 'norm_ratio', 'imputers': 'none', 'n_estimators': 1450, 'learning_rate': 0.03007837694129396, 'max_depth': 3, 'min_child_weight': 6, 'subsample': 0.8, 'colsample_bytree': 0.5, 'colsample_bylevel': 1.0, 'reg_alpha': 3.6241097420960975e-05, 'reg_lambda': 0.024895793863100982, 'gamma': 0.0005888542615656391}. Best is trial 268 with value: -0.097462601251184.
/bsuhome/alexanderemert/Research/Star-Formation-Research-Project-2026/pipeline/scripts/optuna/final_preds_and_models/optuna_search_mult_quant_reg.py:75: UserWarning: The distribution is specified by [0.1, 5] and step=0.25, but the range is not divisible by `step`. It will be replaced with [0.1, 4.85].
  error_threshold = trial.suggest_float("error_threshold", 0.1, 5, step=0.25)
[I 2026-07-21 09:53:47,142] Trial 270 finished with value: -0.09836302980015982 and parameters: {'error_threshold': 1.35, 'scalers': 'standard', 'ratios': 'norm_ratio', 'imputers': 'none', 'n_estimators': 1450, 'learning_rate': 0.02988250483865569, 'max_depth': 3, 'min_child_weight': 7, 'subsample': 0.8, 'colsample_bytree': 0.7, 'colsample_bylevel': 1.0, 'reg_alpha': 3.50618793501897e-05, 'reg_lambda': 0.004262544815177125, 'gamma': 0.0006640696920350217}. Best is trial 268 with value: -0.097462601251184.
/bsuhome/alexanderemert/Research/Star-Formation-Research-Project-2026/pipeline/scripts/optuna/final_preds_and_models/optuna_search_mult_quant_reg.py:75: UserWarning: The distribution is specified by [0.1, 5] and step=0.25, but the range is not divisible by `step`. It will be replaced with [0.1, 4.85].
  error_threshold = trial.suggest_float("error_threshold", 0.1, 5, step=0.25)
[I 2026-07-21 09:53:50,442] Trial 271 finished with value: -0.09750240262689285 and parameters: {'error_threshold': 1.35, 'scalers': 'standard', 'ratios': 'norm_ratio', 'imputers': 'none', 'n_estimators': 1450, 'learning_rate': 0.02905732568663418, 'max_depth': 3, 'min_child_weight': 7, 'subsample': 0.8, 'colsample_bytree': 0.7, 'colsample_bylevel': 1.0, 'reg_alpha': 9.855354039546655e-05, 'reg_lambda': 0.00441850999937115, 'gamma': 0.005800017186518551}. Best is trial 268 with value: -0.097462601251184.
/bsuhome/alexanderemert/Research/Star-Formation-Research-Project-2026/pipeline/scripts/optuna/final_preds_and_models/optuna_search_mult_quant_reg.py:75: UserWarning: The distribution is specified by [0.1, 5] and step=0.25, but the range is not divisible by `step`. It will be replaced with [0.1, 4.85].
  error_threshold = trial.suggest_float("error_threshold", 0.1, 5, step=0.25)
[I 2026-07-21 09:53:54,853] Trial 272 finished with value: -0.098487907527255 and parameters: {'error_threshold': 0.85, 'scalers': 'standard', 'ratios': 'norm_ratio', 'imputers': 'none', 'n_estimators': 1450, 'learning_rate': 0.028990723836503158, 'max_depth': 3, 'min_child_weight': 7, 'subsample': 0.8, 'colsample_bytree': 0.5, 'colsample_bylevel': 1.0, 'reg_alpha': 0.00011179127747930008, 'reg_lambda': 0.004153099471927731, 'gamma': 0.006575608689531104}. Best is trial 268 with value: -0.097462601251184.
/bsuhome/alexanderemert/Research/Star-Formation-Research-Project-2026/pipeline/scripts/optuna/final_preds_and_models/optuna_search_mult_quant_reg.py:75: UserWarning: The distribution is specified by [0.1, 5] and step=0.25, but the range is not divisible by `step`. It will be replaced with [0.1, 4.85].
  error_threshold = trial.suggest_float("error_threshold", 0.1, 5, step=0.25)
[I 2026-07-21 09:53:57,735] Trial 273 finished with value: -0.09861228707267077 and parameters: {'error_threshold': 0.85, 'scalers': 'standard', 'ratios': 'norm_ratio', 'imputers': 'none', 'n_estimators': 1450, 'learning_rate': 0.028903239304122953, 'max_depth': 3, 'min_child_weight': 6, 'subsample': 0.8, 'colsample_bytree': 0.7, 'colsample_bylevel': 1.0, 'reg_alpha': 8.47586313586116e-05, 'reg_lambda': 0.004662692104670151, 'gamma': 0.0011240609355289972}. Best is trial 268 with value: -0.097462601251184.
/bsuhome/alexanderemert/Research/Star-Formation-Research-Project-2026/pipeline/scripts/optuna/final_preds_and_models/optuna_search_mult_quant_reg.py:75: UserWarning: The distribution is specified by [0.1, 5] and step=0.25, but the range is not divisible by `step`. It will be replaced with [0.1, 4.85].
  error_threshold = trial.suggest_float("error_threshold", 0.1, 5, step=0.25)
[I 2026-07-21 09:54:00,759] Trial 274 finished with value: -0.09772030115301981 and parameters: {'error_threshold': 1.85, 'scalers': 'standard', 'ratios': 'norm_ratio', 'imputers': 'none', 'n_estimators': 1450, 'learning_rate': 0.028357439568250594, 'max_depth': 3, 'min_child_weight': 6, 'subsample': 0.8, 'colsample_bytree': 0.7, 'colsample_bylevel': 1.0, 'reg_alpha': 0.0001134429822260924, 'reg_lambda': 0.004659760626970333, 'gamma': 0.0036192733856829254}. Best is trial 268 with value: -0.097462601251184.
/bsuhome/alexanderemert/Research/Star-Formation-Research-Project-2026/pipeline/scripts/optuna/final_preds_and_models/optuna_search_mult_quant_reg.py:75: UserWarning: The distribution is specified by [0.1, 5] and step=0.25, but the range is not divisible by `step`. It will be replaced with [0.1, 4.85].
  error_threshold = trial.suggest_float("error_threshold", 0.1, 5, step=0.25)
[I 2026-07-21 09:54:05,127] Trial 275 finished with value: -0.09838325634470735 and parameters: {'error_threshold': 1.85, 'scalers': 'standard', 'ratios': 'norm_ratio', 'imputers': 'none', 'n_estimators': 1300, 'learning_rate': 0.02793698337650072, 'max_depth': 3, 'min_child_weight': 6, 'subsample': 0.8, 'colsample_bytree': 0.7, 'colsample_bylevel': 1.0, 'reg_alpha': 0.00013663711741319207, 'reg_lambda': 0.0047956121167258845, 'gamma': 0.0035810053887645765}. Best is trial 268 with value: -0.097462601251184.
/bsuhome/alexanderemert/Research/Star-Formation-Research-Project-2026/pipeline/scripts/optuna/final_preds_and_models/optuna_search_mult_quant_reg.py:75: UserWarning: The distribution is specified by [0.1, 5] and step=0.25, but the range is not divisible by `step`. It will be replaced with [0.1, 4.85].
  error_threshold = trial.suggest_float("error_threshold", 0.1, 5, step=0.25)
[I 2026-07-21 09:54:07,689] Trial 276 finished with value: -0.09966662674056813 and parameters: {'error_threshold': 0.35, 'scalers': 'standard', 'ratios': 'norm_ratio', 'imputers': 'none', 'n_estimators': 1300, 'learning_rate': 0.027915626086498505, 'max_depth': 3, 'min_child_weight': 6, 'subsample': 0.8, 'colsample_bytree': 0.5, 'colsample_bylevel': 1.0, 'reg_alpha': 0.00014490659665121597, 'reg_lambda': 0.005192192214448412, 'gamma': 0.0006276485670757808}. Best is trial 268 with value: -0.097462601251184.
/bsuhome/alexanderemert/Research/Star-Formation-Research-Project-2026/pipeline/scripts/optuna/final_preds_and_models/optuna_search_mult_quant_reg.py:75: UserWarning: The distribution is specified by [0.1, 5] and step=0.25, but the range is not divisible by `step`. It will be replaced with [0.1, 4.85].
  error_threshold = trial.suggest_float("error_threshold", 0.1, 5, step=0.25)
[I 2026-07-21 09:54:14,292] Trial 277 finished with value: -0.09711472095390473 and parameters: {'error_threshold': 1.85, 'scalers': 'standard', 'ratios': 'norm_ratio', 'imputers': 'none', 'n_estimators': 1450, 'learning_rate': 0.027489109098214896, 'max_depth': 3, 'min_child_weight': 6, 'subsample': 0.8, 'colsample_bytree': 0.5, 'colsample_bylevel': 1.0, 'reg_alpha': 0.0001370323156468188, 'reg_lambda': 0.0053438941387382475, 'gamma': 0.0009955898068735585}. Best is trial 277 with value: -0.09711472095390473.
/bsuhome/alexanderemert/Research/Star-Formation-Research-Project-2026/pipeline/scripts/optuna/final_preds_and_models/optuna_search_mult_quant_reg.py:75: UserWarning: The distribution is specified by [0.1, 5] and step=0.25, but the range is not divisible by `step`. It will be replaced with [0.1, 4.85].
  error_threshold = trial.suggest_float("error_threshold", 0.1, 5, step=0.25)
[I 2026-07-21 09:54:21,631] Trial 278 finished with value: -0.09764931289958467 and parameters: {'error_threshold': 1.85, 'scalers': 'standard', 'ratios': 'norm_ratio', 'imputers': 'none', 'n_estimators': 1450, 'learning_rate': 0.027793745779319614, 'max_depth': 3, 'min_child_weight': 6, 'subsample': 0.8, 'colsample_bytree': 0.5, 'colsample_bylevel': 1.0, 'reg_alpha': 0.00014386591573621347, 'reg_lambda': 0.01599396088196863, 'gamma': 0.0010289321101250115}. Best is trial 277 with value: -0.09711472095390473.
/bsuhome/alexanderemert/Research/Star-Formation-Research-Project-2026/pipeline/scripts/optuna/final_preds_and_models/optuna_search_mult_quant_reg.py:75: UserWarning: The distribution is specified by [0.1, 5] and step=0.25, but the range is not divisible by `step`. It will be replaced with [0.1, 4.85].
  error_threshold = trial.suggest_float("error_threshold", 0.1, 5, step=0.25)
[I 2026-07-21 09:54:23,859] Trial 279 finished with value: -0.09759833742378765 and parameters: {'error_threshold': 1.85, 'scalers': 'standard', 'ratios': 'norm_ratio', 'imputers': 'none', 'n_estimators': 1450, 'learning_rate': 0.025604493395786035, 'max_depth': 3, 'min_child_weight': 7, 'subsample': 0.8, 'colsample_bytree': 0.5, 'colsample_bylevel': 1.0, 'reg_alpha': 0.00017140130617072441, 'reg_lambda': 0.007992188827703856, 'gamma': 0.0037100704515299794}. Best is trial 277 with value: -0.09711472095390473.
/bsuhome/alexanderemert/Research/Star-Formation-Research-Project-2026/pipeline/scripts/optuna/final_preds_and_models/optuna_search_mult_quant_reg.py:75: UserWarning: The distribution is specified by [0.1, 5] and step=0.25, but the range is not divisible by `step`. It will be replaced with [0.1, 4.85].
  error_threshold = trial.suggest_float("error_threshold", 0.1, 5, step=0.25)
[I 2026-07-21 09:54:28,001] Trial 280 finished with value: -0.09796914167022341 and parameters: {'error_threshold': 1.85, 'scalers': 'standard', 'ratios': 'norm_ratio', 'imputers': 'none', 'n_estimators': 1300, 'learning_rate': 0.024271260023767182, 'max_depth': 3, 'min_child_weight': 6, 'subsample': 0.8, 'colsample_bytree': 0.5, 'colsample_bylevel': 1.0, 'reg_alpha': 0.0001520958439747548, 'reg_lambda': 0.01635701159811413, 'gamma': 0.0038078111587462175}. Best is trial 277 with value: -0.09711472095390473.
/bsuhome/alexanderemert/Research/Star-Formation-Research-Project-2026/pipeline/scripts/optuna/final_preds_and_models/optuna_search_mult_quant_reg.py:75: UserWarning: The distribution is specified by [0.1, 5] and step=0.25, but the range is not divisible by `step`. It will be replaced with [0.1, 4.85].
  error_threshold = trial.suggest_float("error_threshold", 0.1, 5, step=0.25)
[I 2026-07-21 09:54:31,183] Trial 281 finished with value: -0.09764536505390897 and parameters: {'error_threshold': 1.85, 'scalers': 'standard', 'ratios': 'norm_ratio', 'imputers': 'none', 'n_estimators': 1300, 'learning_rate': 0.025632819217525714, 'max_depth': 3, 'min_child_weight': 8, 'subsample': 0.8, 'colsample_bytree': 0.5, 'colsample_bylevel': 1.0, 'reg_alpha': 0.00015320039175924224, 'reg_lambda': 0.016354198883847457, 'gamma': 0.0036343931247843687}. Best is trial 277 with value: -0.09711472095390473.
/bsuhome/alexanderemert/Research/Star-Formation-Research-Project-2026/pipeline/scripts/optuna/final_preds_and_models/optuna_search_mult_quant_reg.py:75: UserWarning: The distribution is specified by [0.1, 5] and step=0.25, but the range is not divisible by `step`. It will be replaced with [0.1, 4.85].
  error_threshold = trial.suggest_float("error_threshold", 0.1, 5, step=0.25)
[I 2026-07-21 09:54:32,024] Trial 282 finished with value: -0.26110702320688023 and parameters: {'error_threshold': 1.85, 'scalers': 'standard', 'ratios': 'norm_ratio', 'imputers': 'none', 'n_estimators': 1400, 'learning_rate': 0.024598836503745496, 'max_depth': 3, 'min_child_weight': 8, 'subsample': 0.8, 'colsample_bytree': 0.5, 'colsample_bylevel': 1.0, 'reg_alpha': 0.000141559443211884, 'reg_lambda': 0.005969355773056095, 'gamma': 74.4684745449537}. Best is trial 277 with value: -0.09711472095390473.
/bsuhome/alexanderemert/Research/Star-Formation-Research-Project-2026/pipeline/scripts/optuna/final_preds_and_models/optuna_search_mult_quant_reg.py:75: UserWarning: The distribution is specified by [0.1, 5] and step=0.25, but the range is not divisible by `step`. It will be replaced with [0.1, 4.85].
  error_threshold = trial.suggest_float("error_threshold", 0.1, 5, step=0.25)
[I 2026-07-21 09:54:38,307] Trial 283 finished with value: -0.0977203000029681 and parameters: {'error_threshold': 1.85, 'scalers': 'standard', 'ratios': 'norm_ratio', 'imputers': 'none', 'n_estimators': 1400, 'learning_rate': 0.023122682245976977, 'max_depth': 3, 'min_child_weight': 8, 'subsample': 0.8, 'colsample_bytree': 0.5, 'colsample_bylevel': 1.0, 'reg_alpha': 0.00014391361772236582, 'reg_lambda': 0.007325712123913993, 'gamma': 0.003842098826075683}. Best is trial 277 with value: -0.09711472095390473.
/bsuhome/alexanderemert/Research/Star-Formation-Research-Project-2026/pipeline/scripts/optuna/final_preds_and_models/optuna_search_mult_quant_reg.py:75: UserWarning: The distribution is specified by [0.1, 5] and step=0.25, but the range is not divisible by `step`. It will be replaced with [0.1, 4.85].
  error_threshold = trial.suggest_float("error_threshold", 0.1, 5, step=0.25)
[I 2026-07-21 09:54:40,743] Trial 284 finished with value: -0.09934470607198843 and parameters: {'error_threshold': 1.85, 'scalers': 'standard', 'ratios': 'norm_ratio', 'imputers': 'none', 'n_estimators': 1400, 'learning_rate': 0.023214059805105793, 'max_depth': 4, 'min_child_weight': 8, 'subsample': 0.8, 'colsample_bytree': 0.5, 'colsample_bylevel': 1.0, 'reg_alpha': 0.00014780773945573605, 'reg_lambda': 0.008068267435404527, 'gamma': 0.004984746964805001}. Best is trial 277 with value: -0.09711472095390473.
/bsuhome/alexanderemert/Research/Star-Formation-Research-Project-2026/pipeline/scripts/optuna/final_preds_and_models/optuna_search_mult_quant_reg.py:75: UserWarning: The distribution is specified by [0.1, 5] and step=0.25, but the range is not divisible by `step`. It will be replaced with [0.1, 4.85].
  error_threshold = trial.suggest_float("error_threshold", 0.1, 5, step=0.25)
[I 2026-07-21 09:54:49,481] Trial 285 finished with value: -0.09784324399208816 and parameters: {'error_threshold': 1.85, 'scalers': 'standard', 'ratios': 'norm_ratio', 'imputers': 'none', 'n_estimators': 1400, 'learning_rate': 0.023166050784419735, 'max_depth': 3, 'min_child_weight': 8, 'subsample': 0.8, 'colsample_bytree': 0.5, 'colsample_bylevel': 1.0, 'reg_alpha': 0.0001442301828175424, 'reg_lambda': 0.007191756722844363, 'gamma': 0.003647452150742998}. Best is trial 277 with value: -0.09711472095390473.
/bsuhome/alexanderemert/Research/Star-Formation-Research-Project-2026/pipeline/scripts/optuna/final_preds_and_models/optuna_search_mult_quant_reg.py:75: UserWarning: The distribution is specified by [0.1, 5] and step=0.25, but the range is not divisible by `step`. It will be replaced with [0.1, 4.85].
  error_threshold = trial.suggest_float("error_threshold", 0.1, 5, step=0.25)
[I 2026-07-21 09:54:58,964] Trial 286 finished with value: -0.09973912389229027 and parameters: {'error_threshold': 1.85, 'scalers': 'standard', 'ratios': 'norm_ratio', 'imputers': 'none', 'n_estimators': 1400, 'learning_rate': 0.02051029097818064, 'max_depth': 4, 'min_child_weight': 7, 'subsample': 0.8, 'colsample_bytree': 0.5, 'colsample_bylevel': 1.0, 'reg_alpha': 0.00013906273466344108, 'reg_lambda': 0.02537075242506017, 'gamma': 0.003822054524661602}. Best is trial 277 with value: -0.09711472095390473.
/bsuhome/alexanderemert/Research/Star-Formation-Research-Project-2026/pipeline/scripts/optuna/final_preds_and_models/optuna_search_mult_quant_reg.py:75: UserWarning: The distribution is specified by [0.1, 5] and step=0.25, but the range is not divisible by `step`. It will be replaced with [0.1, 4.85].
  error_threshold = trial.suggest_float("error_threshold", 0.1, 5, step=0.25)
[I 2026-07-21 09:55:00,632] Trial 287 finished with value: -0.09981787590075214 and parameters: {'error_threshold': 1.85, 'scalers': 'standard', 'ratios': 'norm_ratio', 'imputers': 'none', 'n_estimators': 1400, 'learning_rate': 0.02012129531486411, 'max_depth': 4, 'min_child_weight': 8, 'subsample': 0.8, 'colsample_bytree': 0.5, 'colsample_bylevel': 1.0, 'reg_alpha': 0.00016465615526618826, 'reg_lambda': 0.029980333376336293, 'gamma': 0.00460363559048907}. Best is trial 277 with value: -0.09711472095390473.
/bsuhome/alexanderemert/Research/Star-Formation-Research-Project-2026/pipeline/scripts/optuna/final_preds_and_models/optuna_search_mult_quant_reg.py:75: UserWarning: The distribution is specified by [0.1, 5] and step=0.25, but the range is not divisible by `step`. It will be replaced with [0.1, 4.85].
  error_threshold = trial.suggest_float("error_threshold", 0.1, 5, step=0.25)
