[I 2026-07-20 15:21:33,957] Trial 120 finished with value: -1.1186164862738774 and parameters: {'error_threshold': 4.6, 'scalers': 'none', 'ratios': 'norm_ratio', 'imputers': 'none', 'n_estimators': 2700, 'learning_rate': 0.347393942012198, 'max_depth': 12, 'min_child_weight': 6, 'subsample': 0.5, 'colsample_bytree': 0.5, 'colsample_bylevel': 0.8, 'reg_alpha': 0.08545382200672874, 'reg_lambda': 9.539953442057083e-05, 'gamma': 3.840227436476804e-06}. Best is trial 119 with value: -1.2709619152900486.
/bsuhome/alexanderemert/Research/Star-Formation-Research-Project-2026/pipeline/scripts/optuna/final_preds_and_models/optuna_search_mult_quant_reg.py:75: UserWarning: The distribution is specified by [0.1, 5] and step=0.25, but the range is not divisible by `step`. It will be replaced with [0.1, 4.85].
  error_threshold = trial.suggest_float("error_threshold", 0.1, 5, step=0.25)
[I 2026-07-20 15:21:46,012] Trial 121 finished with value: -1.1120857881065427 and parameters: {'error_threshold': 4.6, 'scalers': 'none', 'ratios': 'norm_ratio', 'imputers': 'median', 'n_estimators': 2650, 'learning_rate': 0.349023320115154, 'max_depth': 12, 'min_child_weight': 6, 'subsample': 0.5, 'colsample_bytree': 0.5, 'colsample_bylevel': 0.8, 'reg_alpha': 0.07995559894220619, 'reg_lambda': 0.00011066254418036064, 'gamma': 3.4730393210913286e-06}. Best is trial 119 with value: -1.2709619152900486.
/bsuhome/alexanderemert/Research/Star-Formation-Research-Project-2026/pipeline/scripts/optuna/final_preds_and_models/optuna_search_mult_quant_reg.py:75: UserWarning: The distribution is specified by [0.1, 5] and step=0.25, but the range is not divisible by `step`. It will be replaced with [0.1, 4.85].
  error_threshold = trial.suggest_float("error_threshold", 0.1, 5, step=0.25)
[I 2026-07-20 15:21:54,601] Trial 122 finished with value: -1.1098984429237049 and parameters: {'error_threshold': 4.6, 'scalers': 'robust', 'ratios': 'norm_ratio', 'imputers': 'median', 'n_estimators': 2700, 'learning_rate': 0.34587629893257593, 'max_depth': 12, 'min_child_weight': 6, 'subsample': 0.5, 'colsample_bytree': 0.5, 'colsample_bylevel': 0.9, 'reg_alpha': 0.10839584578944834, 'reg_lambda': 0.00010367733109450797, 'gamma': 3.423258002104272e-06}. Best is trial 119 with value: -1.2709619152900486.
/bsuhome/alexanderemert/Research/Star-Formation-Research-Project-2026/pipeline/scripts/optuna/final_preds_and_models/optuna_search_mult_quant_reg.py:75: UserWarning: The distribution is specified by [0.1, 5] and step=0.25, but the range is not divisible by `step`. It will be replaced with [0.1, 4.85].
  error_threshold = trial.suggest_float("error_threshold", 0.1, 5, step=0.25)
[I 2026-07-20 15:21:55,409] Trial 124 finished with value: -0.9618407533617311 and parameters: {'error_threshold': 2.85, 'scalers': 'none', 'ratios': 'norm_ratio', 'imputers': 'none', 'n_estimators': 600, 'learning_rate': 0.33417503624431316, 'max_depth': 12, 'min_child_weight': 6, 'subsample': 0.5, 'colsample_bytree': 0.5, 'colsample_bylevel': 0.9, 'reg_alpha': 0.03381001212055794, 'reg_lambda': 9.939097643134846e-05, 'gamma': 3.847468637113702e-06}. Best is trial 119 with value: -1.2709619152900486.
/bsuhome/alexanderemert/Research/Star-Formation-Research-Project-2026/pipeline/scripts/optuna/final_preds_and_models/optuna_search_mult_quant_reg.py:75: UserWarning: The distribution is specified by [0.1, 5] and step=0.25, but the range is not divisible by `step`. It will be replaced with [0.1, 4.85].
  error_threshold = trial.suggest_float("error_threshold", 0.1, 5, step=0.25)
[I 2026-07-20 15:22:05,797] Trial 123 finished with value: -1.2227907760425982 and parameters: {'error_threshold': 3.85, 'scalers': 'robust', 'ratios': 'norm_ratio', 'imputers': 'median', 'n_estimators': 2700, 'learning_rate': 0.346148132888363, 'max_depth': 12, 'min_child_weight': 4, 'subsample': 0.5, 'colsample_bytree': 0.5, 'colsample_bylevel': 0.9, 'reg_alpha': 0.029164569677106057, 'reg_lambda': 1.0360091094303436e-06, 'gamma': 6.872860270570389e-06}. Best is trial 119 with value: -1.2709619152900486.
/bsuhome/alexanderemert/Research/Star-Formation-Research-Project-2026/pipeline/scripts/optuna/final_preds_and_models/optuna_search_mult_quant_reg.py:75: UserWarning: The distribution is specified by [0.1, 5] and step=0.25, but the range is not divisible by `step`. It will be replaced with [0.1, 4.85].
  error_threshold = trial.suggest_float("error_threshold", 0.1, 5, step=0.25)
[I 2026-07-20 15:22:10,301] Trial 125 finished with value: -0.9528094912530296 and parameters: {'error_threshold': 2.35, 'scalers': 'none', 'ratios': 'norm_ratio', 'imputers': 'none', 'n_estimators': 600, 'learning_rate': 0.3507779288974921, 'max_depth': 12, 'min_child_weight': 6, 'subsample': 0.6, 'colsample_bytree': 0.5, 'colsample_bylevel': 0.9, 'reg_alpha': 0.028009482084177955, 'reg_lambda': 25.009511626802436, 'gamma': 0.00633224842625061}. Best is trial 119 with value: -1.2709619152900486.
/bsuhome/alexanderemert/Research/Star-Formation-Research-Project-2026/pipeline/scripts/optuna/final_preds_and_models/optuna_search_mult_quant_reg.py:75: UserWarning: The distribution is specified by [0.1, 5] and step=0.25, but the range is not divisible by `step`. It will be replaced with [0.1, 4.85].
  error_threshold = trial.suggest_float("error_threshold", 0.1, 5, step=0.25)
[I 2026-07-20 15:22:13,871] Trial 126 finished with value: -1.1687130588729866 and parameters: {'error_threshold': 2.6, 'scalers': 'none', 'ratios': 'norm_ratio', 'imputers': 'none', 'n_estimators': 550, 'learning_rate': 0.4881660599587026, 'max_depth': 12, 'min_child_weight': 4, 'subsample': 0.6, 'colsample_bytree': 0.5, 'colsample_bylevel': 0.9, 'reg_alpha': 0.03297338282648298, 'reg_lambda': 91.24195052768447, 'gamma': 0.0053177738041733265}. Best is trial 119 with value: -1.2709619152900486.
/bsuhome/alexanderemert/Research/Star-Formation-Research-Project-2026/pipeline/scripts/optuna/final_preds_and_models/optuna_search_mult_quant_reg.py:75: UserWarning: The distribution is specified by [0.1, 5] and step=0.25, but the range is not divisible by `step`. It will be replaced with [0.1, 4.85].
  error_threshold = trial.suggest_float("error_threshold", 0.1, 5, step=0.25)
[I 2026-07-20 15:23:23,077] Trial 128 finished with value: -0.9846983268871404 and parameters: {'error_threshold': 4.6, 'scalers': 'none', 'ratios': 'norm_ratio', 'imputers': 'none', 'n_estimators': 550, 'learning_rate': 0.35471315507029644, 'max_depth': 12, 'min_child_weight': 6, 'subsample': 0.5, 'colsample_bytree': 0.5, 'colsample_bylevel': 0.9, 'reg_alpha': 0.02826699021908509, 'reg_lambda': 19.467078702767896, 'gamma': 0.005168185417154737}. Best is trial 119 with value: -1.2709619152900486.
/bsuhome/alexanderemert/Research/Star-Formation-Research-Project-2026/pipeline/scripts/optuna/final_preds_and_models/optuna_search_mult_quant_reg.py:75: UserWarning: The distribution is specified by [0.1, 5] and step=0.25, but the range is not divisible by `step`. It will be replaced with [0.1, 4.85].
  error_threshold = trial.suggest_float("error_threshold", 0.1, 5, step=0.25)
[I 2026-07-20 15:23:25,877] Trial 127 finished with value: -1.1575965741330738 and parameters: {'error_threshold': 4.6, 'scalers': 'none', 'ratios': 'norm_ratio', 'imputers': 'none', 'n_estimators': 650, 'learning_rate': 0.4922162052289724, 'max_depth': 12, 'min_child_weight': 4, 'subsample': 0.7, 'colsample_bytree': 0.5, 'colsample_bylevel': 0.9, 'reg_alpha': 0.03500081701996102, 'reg_lambda': 23.6684520637106, 'gamma': 3.76990430374204e-06}. Best is trial 119 with value: -1.2709619152900486.
/bsuhome/alexanderemert/Research/Star-Formation-Research-Project-2026/pipeline/scripts/optuna/final_preds_and_models/optuna_search_mult_quant_reg.py:75: UserWarning: The distribution is specified by [0.1, 5] and step=0.25, but the range is not divisible by `step`. It will be replaced with [0.1, 4.85].
  error_threshold = trial.suggest_float("error_threshold", 0.1, 5, step=0.25)
[I 2026-07-20 15:23:49,285] Trial 129 finished with value: -0.9281760403981987 and parameters: {'error_threshold': 4.85, 'scalers': 'none', 'ratios': 'norm_ratio', 'imputers': 'none', 'n_estimators': 650, 'learning_rate': 0.2730619168705216, 'max_depth': 12, 'min_child_weight': 6, 'subsample': 0.5, 'colsample_bytree': 0.5, 'colsample_bylevel': 0.9, 'reg_alpha': 0.03444023255257455, 'reg_lambda': 0.3076562301568111, 'gamma': 0.005815438212227589}. Best is trial 119 with value: -1.2709619152900486.
/bsuhome/alexanderemert/Research/Star-Formation-Research-Project-2026/pipeline/scripts/optuna/final_preds_and_models/optuna_search_mult_quant_reg.py:75: UserWarning: The distribution is specified by [0.1, 5] and step=0.25, but the range is not divisible by `step`. It will be replaced with [0.1, 4.85].
  error_threshold = trial.suggest_float("error_threshold", 0.1, 5, step=0.25)
[I 2026-07-20 15:25:45,759] Trial 130 finished with value: -1.483093684021246 and parameters: {'error_threshold': 4.85, 'scalers': 'none', 'ratios': 'norm_ratio', 'imputers': 'none', 'n_estimators': 2750, 'learning_rate': 0.49927370742002225, 'max_depth': 12, 'min_child_weight': 4, 'subsample': 0.5, 'colsample_bytree': 0.5, 'colsample_bylevel': 0.8, 'reg_alpha': 0.028260486485222277, 'reg_lambda': 24.123315864554673, 'gamma': 5.736560239194802e-06}. Best is trial 130 with value: -1.483093684021246.
/bsuhome/alexanderemert/Research/Star-Formation-Research-Project-2026/pipeline/scripts/optuna/final_preds_and_models/optuna_search_mult_quant_reg.py:75: UserWarning: The distribution is specified by [0.1, 5] and step=0.25, but the range is not divisible by `step`. It will be replaced with [0.1, 4.85].
  error_threshold = trial.suggest_float("error_threshold", 0.1, 5, step=0.25)
[I 2026-07-20 15:25:54,835] Trial 131 finished with value: -1.3539107101517034 and parameters: {'error_threshold': 4.85, 'scalers': 'none', 'ratios': 'norm_ratio', 'imputers': 'none', 'n_estimators': 2750, 'learning_rate': 0.4878885025487098, 'max_depth': 12, 'min_child_weight': 4, 'subsample': 0.7, 'colsample_bytree': 0.5, 'colsample_bylevel': 0.8, 'reg_alpha': 0.026921088747725586, 'reg_lambda': 79.23778433186233, 'gamma': 6.50967328185519e-06}. Best is trial 130 with value: -1.483093684021246.
/bsuhome/alexanderemert/Research/Star-Formation-Research-Project-2026/pipeline/scripts/optuna/final_preds_and_models/optuna_search_mult_quant_reg.py:75: UserWarning: The distribution is specified by [0.1, 5] and step=0.25, but the range is not divisible by `step`. It will be replaced with [0.1, 4.85].
  error_threshold = trial.suggest_float("error_threshold", 0.1, 5, step=0.25)
[I 2026-07-20 15:26:12,216] Trial 132 finished with value: -1.2699344352929967 and parameters: {'error_threshold': 4.85, 'scalers': 'none', 'ratios': 'norm_ratio', 'imputers': 'none', 'n_estimators': 2750, 'learning_rate': 0.49549555840105, 'max_depth': 12, 'min_child_weight': 4, 'subsample': 0.7, 'colsample_bytree': 0.5, 'colsample_bylevel': 0.9, 'reg_alpha': 0.025248022929782312, 'reg_lambda': 1.1493470885498867e-06, 'gamma': 5.153845666663279e-06}. Best is trial 130 with value: -1.483093684021246.
/bsuhome/alexanderemert/Research/Star-Formation-Research-Project-2026/pipeline/scripts/optuna/final_preds_and_models/optuna_search_mult_quant_reg.py:75: UserWarning: The distribution is specified by [0.1, 5] and step=0.25, but the range is not divisible by `step`. It will be replaced with [0.1, 4.85].
  error_threshold = trial.suggest_float("error_threshold", 0.1, 5, step=0.25)
[I 2026-07-20 15:26:46,647] Trial 133 finished with value: -1.3042049083340208 and parameters: {'error_threshold': 3.1, 'scalers': 'none', 'ratios': 'norm_ratio', 'imputers': 'none', 'n_estimators': 2750, 'learning_rate': 0.48607649716469725, 'max_depth': 12, 'min_child_weight': 4, 'subsample': 0.7, 'colsample_bytree': 0.5, 'colsample_bylevel': 0.9, 'reg_alpha': 0.001907673316716572, 'reg_lambda': 77.90635680733175, 'gamma': 6.569171348273033e-06}. Best is trial 130 with value: -1.483093684021246.
/bsuhome/alexanderemert/Research/Star-Formation-Research-Project-2026/pipeline/scripts/optuna/final_preds_and_models/optuna_search_mult_quant_reg.py:75: UserWarning: The distribution is specified by [0.1, 5] and step=0.25, but the range is not divisible by `step`. It will be replaced with [0.1, 4.85].
  error_threshold = trial.suggest_float("error_threshold", 0.1, 5, step=0.25)
[I 2026-07-20 15:26:56,478] Trial 134 finished with value: -1.3361113287290853 and parameters: {'error_threshold': 4.85, 'scalers': 'none', 'ratios': 'norm_ratio', 'imputers': 'none', 'n_estimators': 2850, 'learning_rate': 0.4985542437326705, 'max_depth': 12, 'min_child_weight': 4, 'subsample': 0.7, 'colsample_bytree': 0.5, 'colsample_bylevel': 0.9, 'reg_alpha': 1.0584474530955876e-06, 'reg_lambda': 87.58381158244907, 'gamma': 8.10637902045346e-06}. Best is trial 130 with value: -1.483093684021246.
/bsuhome/alexanderemert/Research/Star-Formation-Research-Project-2026/pipeline/scripts/optuna/final_preds_and_models/optuna_search_mult_quant_reg.py:75: UserWarning: The distribution is specified by [0.1, 5] and step=0.25, but the range is not divisible by `step`. It will be replaced with [0.1, 4.85].
  error_threshold = trial.suggest_float("error_threshold", 0.1, 5, step=0.25)
[I 2026-07-20 15:27:07,732] Trial 136 finished with value: -1.030960931901564 and parameters: {'error_threshold': 4.85, 'scalers': 'none', 'ratios': 'norm_ratio', 'imputers': 'none', 'n_estimators': 700, 'learning_rate': 0.48086171389409993, 'max_depth': 12, 'min_child_weight': 4, 'subsample': 0.7, 'colsample_bytree': 0.5, 'colsample_bylevel': 0.9, 'reg_alpha': 0.018352233101597712, 'reg_lambda': 86.54845732708986, 'gamma': 0.02248187604382566}. Best is trial 130 with value: -1.483093684021246.
/bsuhome/alexanderemert/Research/Star-Formation-Research-Project-2026/pipeline/scripts/optuna/final_preds_and_models/optuna_search_mult_quant_reg.py:75: UserWarning: The distribution is specified by [0.1, 5] and step=0.25, but the range is not divisible by `step`. It will be replaced with [0.1, 4.85].
  error_threshold = trial.suggest_float("error_threshold", 0.1, 5, step=0.25)
[I 2026-07-20 15:27:25,661] Trial 137 finished with value: -1.0475902123531862 and parameters: {'error_threshold': 2.35, 'scalers': 'none', 'ratios': 'norm_ratio', 'imputers': 'none', 'n_estimators': 300, 'learning_rate': 0.4977370189004975, 'max_depth': 12, 'min_child_weight': 4, 'subsample': 0.7, 'colsample_bytree': 0.5, 'colsample_bylevel': 0.9, 'reg_alpha': 0.009006741787874844, 'reg_lambda': 66.4351241420573, 'gamma': 5.691972816249294e-06}. Best is trial 130 with value: -1.483093684021246.
/bsuhome/alexanderemert/Research/Star-Formation-Research-Project-2026/pipeline/scripts/optuna/final_preds_and_models/optuna_search_mult_quant_reg.py:75: UserWarning: The distribution is specified by [0.1, 5] and step=0.25, but the range is not divisible by `step`. It will be replaced with [0.1, 4.85].
  error_threshold = trial.suggest_float("error_threshold", 0.1, 5, step=0.25)
[I 2026-07-20 15:27:32,401] Trial 135 finished with value: -1.0214618589978615 and parameters: {'error_threshold': 2.6, 'scalers': 'none', 'ratios': 'norm_ratio', 'imputers': 'none', 'n_estimators': 2750, 'learning_rate': 0.27059008721144406, 'max_depth': 12, 'min_child_weight': 4, 'subsample': 0.7, 'colsample_bytree': 0.5, 'colsample_bylevel': 0.9, 'reg_alpha': 0.018834938018372285, 'reg_lambda': 92.87455771763726, 'gamma': 0.019121432435777318}. Best is trial 130 with value: -1.483093684021246.
/bsuhome/alexanderemert/Research/Star-Formation-Research-Project-2026/pipeline/scripts/optuna/final_preds_and_models/optuna_search_mult_quant_reg.py:75: UserWarning: The distribution is specified by [0.1, 5] and step=0.25, but the range is not divisible by `step`. It will be replaced with [0.1, 4.85].
  error_threshold = trial.suggest_float("error_threshold", 0.1, 5, step=0.25)
[I 2026-07-20 15:31:00,114] Trial 138 finished with value: -1.339571006614525 and parameters: {'error_threshold': 4.85, 'scalers': 'none', 'ratios': 'norm_ratio', 'imputers': 'none', 'n_estimators': 2750, 'learning_rate': 0.4874580700424607, 'max_depth': 12, 'min_child_weight': 4, 'subsample': 0.7, 'colsample_bytree': 0.5, 'colsample_bylevel': 0.9, 'reg_alpha': 0.016714583471164696, 'reg_lambda': 96.76091959002603, 'gamma': 6.354667899113424e-06}. Best is trial 130 with value: -1.483093684021246.
/bsuhome/alexanderemert/Research/Star-Formation-Research-Project-2026/pipeline/scripts/optuna/final_preds_and_models/optuna_search_mult_quant_reg.py:75: UserWarning: The distribution is specified by [0.1, 5] and step=0.25, but the range is not divisible by `step`. It will be replaced with [0.1, 4.85].
  error_threshold = trial.suggest_float("error_threshold", 0.1, 5, step=0.25)
[I 2026-07-20 15:31:06,915] Trial 139 finished with value: -1.181453226032956 and parameters: {'error_threshold': 4.85, 'scalers': 'none', 'ratios': 'norm_ratio', 'imputers': 'none', 'n_estimators': 2750, 'learning_rate': 0.49610602319522124, 'max_depth': 12, 'min_child_weight': 4, 'subsample': 0.7, 'colsample_bytree': 0.5, 'colsample_bylevel': 0.9, 'reg_alpha': 0.01768480546200227, 'reg_lambda': 88.86700358265817, 'gamma': 0.026528901724880725}. Best is trial 130 with value: -1.483093684021246.
/bsuhome/alexanderemert/Research/Star-Formation-Research-Project-2026/pipeline/scripts/optuna/final_preds_and_models/optuna_search_mult_quant_reg.py:75: UserWarning: The distribution is specified by [0.1, 5] and step=0.25, but the range is not divisible by `step`. It will be replaced with [0.1, 4.85].
  error_threshold = trial.suggest_float("error_threshold", 0.1, 5, step=0.25)
[I 2026-07-20 15:31:32,740] Trial 144 finished with value: -0.6860563772715796 and parameters: {'error_threshold': 4.85, 'scalers': 'none', 'ratios': 'norm_ratio', 'imputers': 'none', 'n_estimators': 2850, 'learning_rate': 0.28506757895320517, 'max_depth': 12, 'min_child_weight': 4, 'subsample': 0.7, 'colsample_bytree': 0.5, 'colsample_bylevel': 0.9, 'reg_alpha': 14.688077731683492, 'reg_lambda': 1.1938842878331206e-06, 'gamma': 6.938828464672262e-06}. Best is trial 130 with value: -1.483093684021246.
/bsuhome/alexanderemert/Research/Star-Formation-Research-Project-2026/pipeline/scripts/optuna/final_preds_and_models/optuna_search_mult_quant_reg.py:75: UserWarning: The distribution is specified by [0.1, 5] and step=0.25, but the range is not divisible by `step`. It will be replaced with [0.1, 4.85].
  error_threshold = trial.suggest_float("error_threshold", 0.1, 5, step=0.25)
[I 2026-07-20 15:31:42,045] Trial 140 finished with value: -1.328156931608255 and parameters: {'error_threshold': 2.35, 'scalers': 'none', 'ratios': 'norm_ratio', 'imputers': 'none', 'n_estimators': 2750, 'learning_rate': 0.4927073498992485, 'max_depth': 12, 'min_child_weight': 4, 'subsample': 0.7, 'colsample_bytree': 0.5, 'colsample_bylevel': 0.9, 'reg_alpha': 0.02070532293714307, 'reg_lambda': 89.70567724184882, 'gamma': 6.48045448575694e-06}. Best is trial 130 with value: -1.483093684021246.
/bsuhome/alexanderemert/Research/Star-Formation-Research-Project-2026/pipeline/scripts/optuna/final_preds_and_models/optuna_search_mult_quant_reg.py:75: UserWarning: The distribution is specified by [0.1, 5] and step=0.25, but the range is not divisible by `step`. It will be replaced with [0.1, 4.85].
  error_threshold = trial.suggest_float("error_threshold", 0.1, 5, step=0.25)
[I 2026-07-20 15:31:50,726] Trial 141 finished with value: -1.140562235777657 and parameters: {'error_threshold': 4.85, 'scalers': 'none', 'ratios': 'norm_ratio', 'imputers': 'none', 'n_estimators': 2850, 'learning_rate': 0.27833057422541546, 'max_depth': 12, 'min_child_weight': 4, 'subsample': 0.7, 'colsample_bytree': 0.5, 'colsample_bylevel': 0.9, 'reg_alpha': 0.019608410729811815, 'reg_lambda': 85.4226777748656, 'gamma': 6.022817821688533e-06}. Best is trial 130 with value: -1.483093684021246.
/bsuhome/alexanderemert/Research/Star-Formation-Research-Project-2026/pipeline/scripts/optuna/final_preds_and_models/optuna_search_mult_quant_reg.py:75: UserWarning: The distribution is specified by [0.1, 5] and step=0.25, but the range is not divisible by `step`. It will be replaced with [0.1, 4.85].
  error_threshold = trial.suggest_float("error_threshold", 0.1, 5, step=0.25)
[I 2026-07-20 15:32:00,479] Trial 142 finished with value: -1.3361786478275934 and parameters: {'error_threshold': 4.85, 'scalers': 'none', 'ratios': 'norm_ratio', 'imputers': 'none', 'n_estimators': 2850, 'learning_rate': 0.48543292988582576, 'max_depth': 12, 'min_child_weight': 4, 'subsample': 0.7, 'colsample_bytree': 0.5, 'colsample_bylevel': 0.9, 'reg_alpha': 0.015943859955494254, 'reg_lambda': 86.07601664853719, 'gamma': 5.585987801009597e-06}. Best is trial 130 with value: -1.483093684021246.
/bsuhome/alexanderemert/Research/Star-Formation-Research-Project-2026/pipeline/scripts/optuna/final_preds_and_models/optuna_search_mult_quant_reg.py:75: UserWarning: The distribution is specified by [0.1, 5] and step=0.25, but the range is not divisible by `step`. It will be replaced with [0.1, 4.85].
  error_threshold = trial.suggest_float("error_threshold", 0.1, 5, step=0.25)
