[I 2026-07-21 09:32:32,369] Trial 47 finished with value: -0.16253772480924453 and parameters: {'error_threshold': 1.85, 'scalers': 'none', 'ratios': 'log_ratio', 'imputers': 'mean', 'n_estimators': 1350, 'learning_rate': 0.0017133433776463866, 'max_depth': 6, 'min_child_weight': 3, 'subsample': 0.7, 'colsample_bytree': 0.7, 'colsample_bylevel': 0.7, 'reg_alpha': 5.409585794332931e-06, 'reg_lambda': 0.09675746796812237, 'gamma': 0.0007845049907633178}. Best is trial 36 with value: -0.09921358665081918.
/bsuhome/alexanderemert/Research/Star-Formation-Research-Project-2026/pipeline/scripts/optuna/final_preds_and_models/optuna_search_mult_quant_reg.py:75: UserWarning: The distribution is specified by [0.1, 5] and step=0.25, but the range is not divisible by `step`. It will be replaced with [0.1, 4.85].
  error_threshold = trial.suggest_float("error_threshold", 0.1, 5, step=0.25)
[I 2026-07-21 09:32:41,170] Trial 49 finished with value: -0.10628084091001931 and parameters: {'error_threshold': 3.1, 'scalers': 'none', 'ratios': 'log_ratio', 'imputers': 'mean', 'n_estimators': 2150, 'learning_rate': 0.03169446652056263, 'max_depth': 6, 'min_child_weight': 4, 'subsample': 0.6, 'colsample_bytree': 0.7, 'colsample_bylevel': 0.7, 'reg_alpha': 1.3233295184885002e-05, 'reg_lambda': 0.08513269639932379, 'gamma': 0.0006107818068909004}. Best is trial 36 with value: -0.09921358665081918.
/bsuhome/alexanderemert/Research/Star-Formation-Research-Project-2026/pipeline/scripts/optuna/final_preds_and_models/optuna_search_mult_quant_reg.py:75: UserWarning: The distribution is specified by [0.1, 5] and step=0.25, but the range is not divisible by `step`. It will be replaced with [0.1, 4.85].
  error_threshold = trial.suggest_float("error_threshold", 0.1, 5, step=0.25)
[I 2026-07-21 09:32:49,649] Trial 50 finished with value: -0.10616412064483938 and parameters: {'error_threshold': 2.85, 'scalers': 'none', 'ratios': 'log_ratio', 'imputers': 'mean', 'n_estimators': 1300, 'learning_rate': 0.040902392635664815, 'max_depth': 6, 'min_child_weight': 4, 'subsample': 0.6, 'colsample_bytree': 0.7, 'colsample_bylevel': 0.7, 'reg_alpha': 2.012084772973577e-05, 'reg_lambda': 0.05530881750315335, 'gamma': 0.0011288069937212609}. Best is trial 36 with value: -0.09921358665081918.
/bsuhome/alexanderemert/Research/Star-Formation-Research-Project-2026/pipeline/scripts/optuna/final_preds_and_models/optuna_search_mult_quant_reg.py:75: UserWarning: The distribution is specified by [0.1, 5] and step=0.25, but the range is not divisible by `step`. It will be replaced with [0.1, 4.85].
  error_threshold = trial.suggest_float("error_threshold", 0.1, 5, step=0.25)
[I 2026-07-21 09:33:07,238] Trial 51 finished with value: -0.1041773181273797 and parameters: {'error_threshold': 2.85, 'scalers': 'none', 'ratios': 'log_ratio', 'imputers': 'mean', 'n_estimators': 2050, 'learning_rate': 0.047916400255578924, 'max_depth': 5, 'min_child_weight': 4, 'subsample': 0.6, 'colsample_bytree': 0.7, 'colsample_bylevel': 0.7, 'reg_alpha': 3.2723823372963104e-05, 'reg_lambda': 0.1748810231237554, 'gamma': 0.0005304872568304405}. Best is trial 36 with value: -0.09921358665081918.
/bsuhome/alexanderemert/Research/Star-Formation-Research-Project-2026/pipeline/scripts/optuna/final_preds_and_models/optuna_search_mult_quant_reg.py:75: UserWarning: The distribution is specified by [0.1, 5] and step=0.25, but the range is not divisible by `step`. It will be replaced with [0.1, 4.85].
  error_threshold = trial.suggest_float("error_threshold", 0.1, 5, step=0.25)
[I 2026-07-21 09:33:25,559] Trial 52 finished with value: -0.10529919798425345 and parameters: {'error_threshold': 3.1, 'scalers': 'none', 'ratios': 'log_ratio', 'imputers': 'mean', 'n_estimators': 1250, 'learning_rate': 0.06433899337077588, 'max_depth': 5, 'min_child_weight': 4, 'subsample': 0.6, 'colsample_bytree': 0.7, 'colsample_bylevel': 0.8, 'reg_alpha': 3.255288247495386e-05, 'reg_lambda': 0.04643604909526449, 'gamma': 0.0037810872227292836}. Best is trial 36 with value: -0.09921358665081918.
/bsuhome/alexanderemert/Research/Star-Formation-Research-Project-2026/pipeline/scripts/optuna/final_preds_and_models/optuna_search_mult_quant_reg.py:75: UserWarning: The distribution is specified by [0.1, 5] and step=0.25, but the range is not divisible by `step`. It will be replaced with [0.1, 4.85].
  error_threshold = trial.suggest_float("error_threshold", 0.1, 5, step=0.25)
[I 2026-07-21 09:33:57,859] Trial 53 finished with value: -0.10940333359811792 and parameters: {'error_threshold': 3.6, 'scalers': 'none', 'ratios': 'log_ratio', 'imputers': 'mean', 'n_estimators': 2050, 'learning_rate': 0.05312607976664168, 'max_depth': 5, 'min_child_weight': 2, 'subsample': 0.6, 'colsample_bytree': 0.8, 'colsample_bylevel': 0.8, 'reg_alpha': 2.9134039536245943e-05, 'reg_lambda': 0.045862149244351245, 'gamma': 0.0003561494322294884}. Best is trial 36 with value: -0.09921358665081918.
/bsuhome/alexanderemert/Research/Star-Formation-Research-Project-2026/pipeline/scripts/optuna/final_preds_and_models/optuna_search_mult_quant_reg.py:75: UserWarning: The distribution is specified by [0.1, 5] and step=0.25, but the range is not divisible by `step`. It will be replaced with [0.1, 4.85].
  error_threshold = trial.suggest_float("error_threshold", 0.1, 5, step=0.25)
[I 2026-07-21 09:34:01,138] Trial 54 finished with value: -0.10024415703207523 and parameters: {'error_threshold': 2.6, 'scalers': 'none', 'ratios': 'log_ratio', 'imputers': 'mean', 'n_estimators': 2050, 'learning_rate': 0.01332548743675765, 'max_depth': 5, 'min_child_weight': 4, 'subsample': 0.5, 'colsample_bytree': 0.8, 'colsample_bylevel': 0.8, 'reg_alpha': 2.4598552806791914e-05, 'reg_lambda': 0.041473330430017524, 'gamma': 0.00037785759058610535}. Best is trial 36 with value: -0.09921358665081918.
/bsuhome/alexanderemert/Research/Star-Formation-Research-Project-2026/pipeline/scripts/optuna/final_preds_and_models/optuna_search_mult_quant_reg.py:75: UserWarning: The distribution is specified by [0.1, 5] and step=0.25, but the range is not divisible by `step`. It will be replaced with [0.1, 4.85].
  error_threshold = trial.suggest_float("error_threshold", 0.1, 5, step=0.25)
[I 2026-07-21 09:34:15,220] Trial 55 finished with value: -0.10672242818558635 and parameters: {'error_threshold': 3.6, 'scalers': 'none', 'ratios': 'log_ratio', 'imputers': 'none', 'n_estimators': 2700, 'learning_rate': 0.01234525706635573, 'max_depth': 7, 'min_child_weight': 2, 'subsample': 0.5, 'colsample_bytree': 0.8, 'colsample_bylevel': 0.8, 'reg_alpha': 3.8471788231285227e-05, 'reg_lambda': 0.03033072623425528, 'gamma': 0.004947439042323726}. Best is trial 36 with value: -0.09921358665081918.
/bsuhome/alexanderemert/Research/Star-Formation-Research-Project-2026/pipeline/scripts/optuna/final_preds_and_models/optuna_search_mult_quant_reg.py:75: UserWarning: The distribution is specified by [0.1, 5] and step=0.25, but the range is not divisible by `step`. It will be replaced with [0.1, 4.85].
  error_threshold = trial.suggest_float("error_threshold", 0.1, 5, step=0.25)
[I 2026-07-21 09:34:26,152] Trial 56 finished with value: -0.12425770116465491 and parameters: {'error_threshold': 3.6, 'scalers': 'none', 'ratios': 'log_ratio', 'imputers': 'none', 'n_estimators': 2700, 'learning_rate': 0.13470712651969832, 'max_depth': 7, 'min_child_weight': 8, 'subsample': 0.5, 'colsample_bytree': 0.8, 'colsample_bylevel': 0.8, 'reg_alpha': 0.13031290072567148, 'reg_lambda': 1.0951124838364807, 'gamma': 0.006687574949842696}. Best is trial 36 with value: -0.09921358665081918.
/bsuhome/alexanderemert/Research/Star-Formation-Research-Project-2026/pipeline/scripts/optuna/final_preds_and_models/optuna_search_mult_quant_reg.py:75: UserWarning: The distribution is specified by [0.1, 5] and step=0.25, but the range is not divisible by `step`. It will be replaced with [0.1, 4.85].
  error_threshold = trial.suggest_float("error_threshold", 0.1, 5, step=0.25)
[I 2026-07-21 09:34:30,385] Trial 57 finished with value: -0.10444642950753708 and parameters: {'error_threshold': 3.6, 'scalers': 'none', 'ratios': 'log_ratio', 'imputers': 'none', 'n_estimators': 2750, 'learning_rate': 0.005739574676469131, 'max_depth': 5, 'min_child_weight': 2, 'subsample': 0.6, 'colsample_bytree': 0.6, 'colsample_bylevel': 0.8, 'reg_alpha': 0.23911709070672804, 'reg_lambda': 0.9560057825020816, 'gamma': 0.00665811293283178}. Best is trial 36 with value: -0.09921358665081918.
/bsuhome/alexanderemert/Research/Star-Formation-Research-Project-2026/pipeline/scripts/optuna/final_preds_and_models/optuna_search_mult_quant_reg.py:75: UserWarning: The distribution is specified by [0.1, 5] and step=0.25, but the range is not divisible by `step`. It will be replaced with [0.1, 4.85].
  error_threshold = trial.suggest_float("error_threshold", 0.1, 5, step=0.25)
[I 2026-07-21 09:34:42,166] Trial 58 finished with value: -0.10234806963478395 and parameters: {'error_threshold': 3.6, 'scalers': 'none', 'ratios': 'log_ratio', 'imputers': 'none', 'n_estimators': 2000, 'learning_rate': 0.013873627123854638, 'max_depth': 5, 'min_child_weight': 2, 'subsample': 0.5, 'colsample_bytree': 0.8, 'colsample_bylevel': 0.8, 'reg_alpha': 4.7613578542341793e-05, 'reg_lambda': 1.0569501898209204, 'gamma': 0.005236504060848619}. Best is trial 36 with value: -0.09921358665081918.
/bsuhome/alexanderemert/Research/Star-Formation-Research-Project-2026/pipeline/scripts/optuna/final_preds_and_models/optuna_search_mult_quant_reg.py:75: UserWarning: The distribution is specified by [0.1, 5] and step=0.25, but the range is not divisible by `step`. It will be replaced with [0.1, 4.85].
  error_threshold = trial.suggest_float("error_threshold", 0.1, 5, step=0.25)
[I 2026-07-21 09:34:57,882] Trial 59 finished with value: -0.1008636485650279 and parameters: {'error_threshold': 3.6, 'scalers': 'none', 'ratios': 'log_ratio', 'imputers': 'none', 'n_estimators': 2650, 'learning_rate': 0.01419362394519851, 'max_depth': 4, 'min_child_weight': 2, 'subsample': 0.7, 'colsample_bytree': 0.8, 'colsample_bylevel': 0.8, 'reg_alpha': 0.13678085023022266, 'reg_lambda': 0.8803705024998902, 'gamma': 4.294702954229588e-05}. Best is trial 36 with value: -0.09921358665081918.
/bsuhome/alexanderemert/Research/Star-Formation-Research-Project-2026/pipeline/scripts/optuna/final_preds_and_models/optuna_search_mult_quant_reg.py:75: UserWarning: The distribution is specified by [0.1, 5] and step=0.25, but the range is not divisible by `step`. It will be replaced with [0.1, 4.85].
  error_threshold = trial.suggest_float("error_threshold", 0.1, 5, step=0.25)
[I 2026-07-21 09:35:08,764] Trial 60 finished with value: -0.10136431172592497 and parameters: {'error_threshold': 3.6, 'scalers': 'none', 'ratios': 'norm_ratio', 'imputers': 'none', 'n_estimators': 2750, 'learning_rate': 0.013371864329270013, 'max_depth': 4, 'min_child_weight': 2, 'subsample': 0.5, 'colsample_bytree': 0.8, 'colsample_bylevel': 0.8, 'reg_alpha': 0.00014795479027942258, 'reg_lambda': 2.025451523582337, 'gamma': 0.005378558058660431}. Best is trial 36 with value: -0.09921358665081918.
/bsuhome/alexanderemert/Research/Star-Formation-Research-Project-2026/pipeline/scripts/optuna/final_preds_and_models/optuna_search_mult_quant_reg.py:75: UserWarning: The distribution is specified by [0.1, 5] and step=0.25, but the range is not divisible by `step`. It will be replaced with [0.1, 4.85].
  error_threshold = trial.suggest_float("error_threshold", 0.1, 5, step=0.25)
[I 2026-07-21 09:35:40,419] Trial 61 finished with value: -0.1003597399963556 and parameters: {'error_threshold': 3.6, 'scalers': 'none', 'ratios': 'norm_ratio', 'imputers': 'none', 'n_estimators': 1650, 'learning_rate': 0.014085276531951125, 'max_depth': 4, 'min_child_weight': 2, 'subsample': 0.7, 'colsample_bytree': 0.8, 'colsample_bylevel': 0.8, 'reg_alpha': 0.15104828060135886, 'reg_lambda': 0.8837834174041261, 'gamma': 0.005425592225221618}. Best is trial 36 with value: -0.09921358665081918.
/bsuhome/alexanderemert/Research/Star-Formation-Research-Project-2026/pipeline/scripts/optuna/final_preds_and_models/optuna_search_mult_quant_reg.py:75: UserWarning: The distribution is specified by [0.1, 5] and step=0.25, but the range is not divisible by `step`. It will be replaced with [0.1, 4.85].
  error_threshold = trial.suggest_float("error_threshold", 0.1, 5, step=0.25)
[I 2026-07-21 09:35:46,242] Trial 64 finished with value: -0.10657665066841072 and parameters: {'error_threshold': 1.35, 'scalers': 'robust', 'ratios': 'log_ratio', 'imputers': 'mean', 'n_estimators': 1650, 'learning_rate': 0.005856959912308809, 'max_depth': 3, 'min_child_weight': 7, 'subsample': 0.5, 'colsample_bytree': 0.8, 'colsample_bylevel': 0.8, 'reg_alpha': 0.00018348455179053767, 'reg_lambda': 0.7210431336458151, 'gamma': 0.0106197927829302}. Best is trial 36 with value: -0.09921358665081918.
/bsuhome/alexanderemert/Research/Star-Formation-Research-Project-2026/pipeline/scripts/optuna/final_preds_and_models/optuna_search_mult_quant_reg.py:75: UserWarning: The distribution is specified by [0.1, 5] and step=0.25, but the range is not divisible by `step`. It will be replaced with [0.1, 4.85].
  error_threshold = trial.suggest_float("error_threshold", 0.1, 5, step=0.25)
[I 2026-07-21 09:35:47,370] Trial 65 finished with value: -0.10209922633676334 and parameters: {'error_threshold': 2.35, 'scalers': 'robust', 'ratios': 'log_ratio', 'imputers': 'mean', 'n_estimators': 1050, 'learning_rate': 0.013906764742753245, 'max_depth': 3, 'min_child_weight': 7, 'subsample': 1.0, 'colsample_bytree': 0.8, 'colsample_bylevel': 0.8, 'reg_alpha': 0.0001555422457321214, 'reg_lambda': 0.006667074218775794, 'gamma': 3.481822693414353e-05}. Best is trial 36 with value: -0.09921358665081918.
/bsuhome/alexanderemert/Research/Star-Formation-Research-Project-2026/pipeline/scripts/optuna/final_preds_and_models/optuna_search_mult_quant_reg.py:75: UserWarning: The distribution is specified by [0.1, 5] and step=0.25, but the range is not divisible by `step`. It will be replaced with [0.1, 4.85].
  error_threshold = trial.suggest_float("error_threshold", 0.1, 5, step=0.25)
[I 2026-07-21 09:35:53,613] Trial 62 finished with value: -0.10916407158815646 and parameters: {'error_threshold': 2.35, 'scalers': 'none', 'ratios': 'log_ratio', 'imputers': 'none', 'n_estimators': 2750, 'learning_rate': 0.014493795756050603, 'max_depth': 7, 'min_child_weight': 2, 'subsample': 0.5, 'colsample_bytree': 0.8, 'colsample_bylevel': 0.8, 'reg_alpha': 0.00014517784086284734, 'reg_lambda': 1.2713958213946273, 'gamma': 0.004375562232666482}. Best is trial 36 with value: -0.09921358665081918.
/bsuhome/alexanderemert/Research/Star-Formation-Research-Project-2026/pipeline/scripts/optuna/final_preds_and_models/optuna_search_mult_quant_reg.py:75: UserWarning: The distribution is specified by [0.1, 5] and step=0.25, but the range is not divisible by `step`. It will be replaced with [0.1, 4.85].
  error_threshold = trial.suggest_float("error_threshold", 0.1, 5, step=0.25)
[I 2026-07-21 09:36:00,814] Trial 66 finished with value: -0.09949799162715818 and parameters: {'error_threshold': 4.35, 'scalers': 'robust', 'ratios': 'log_ratio', 'imputers': 'mean', 'n_estimators': 1600, 'learning_rate': 0.02282127067605298, 'max_depth': 3, 'min_child_weight': 5, 'subsample': 1.0, 'colsample_bytree': 0.8, 'colsample_bylevel': 0.9, 'reg_alpha': 0.005781579827379512, 'reg_lambda': 0.0065814516034987175, 'gamma': 4.705370552107929e-05}. Best is trial 36 with value: -0.09921358665081918.
/bsuhome/alexanderemert/Research/Star-Formation-Research-Project-2026/pipeline/scripts/optuna/final_preds_and_models/optuna_search_mult_quant_reg.py:75: UserWarning: The distribution is specified by [0.1, 5] and step=0.25, but the range is not divisible by `step`. It will be replaced with [0.1, 4.85].
  error_threshold = trial.suggest_float("error_threshold", 0.1, 5, step=0.25)
[I 2026-07-21 09:36:07,972] Trial 63 finished with value: -0.12428765727842589 and parameters: {'error_threshold': 3.85, 'scalers': 'none', 'ratios': 'log_ratio', 'imputers': 'none', 'n_estimators': 2750, 'learning_rate': 0.12465275627473324, 'max_depth': 8, 'min_child_weight': 8, 'subsample': 0.5, 'colsample_bytree': 0.8, 'colsample_bylevel': 0.8, 'reg_alpha': 0.00018880448010358185, 'reg_lambda': 0.9581919548612535, 'gamma': 0.007341432164089485}. Best is trial 36 with value: -0.09921358665081918.
/bsuhome/alexanderemert/Research/Star-Formation-Research-Project-2026/pipeline/scripts/optuna/final_preds_and_models/optuna_search_mult_quant_reg.py:75: UserWarning: The distribution is specified by [0.1, 5] and step=0.25, but the range is not divisible by `step`. It will be replaced with [0.1, 4.85].
  error_threshold = trial.suggest_float("error_threshold", 0.1, 5, step=0.25)
[I 2026-07-21 09:36:20,026] Trial 67 finished with value: -0.0990229319358027 and parameters: {'error_threshold': 2.35, 'scalers': 'robust', 'ratios': 'log_ratio', 'imputers': 'mean', 'n_estimators': 3000, 'learning_rate': 0.02331956163689424, 'max_depth': 3, 'min_child_weight': 7, 'subsample': 1.0, 'colsample_bytree': 0.8, 'colsample_bylevel': 0.9, 'reg_alpha': 0.00016744150933716354, 'reg_lambda': 0.0052652867713515955, 'gamma': 5.6294379073512606e-06}. Best is trial 67 with value: -0.0990229319358027.
/bsuhome/alexanderemert/Research/Star-Formation-Research-Project-2026/pipeline/scripts/optuna/final_preds_and_models/optuna_search_mult_quant_reg.py:75: UserWarning: The distribution is specified by [0.1, 5] and step=0.25, but the range is not divisible by `step`. It will be replaced with [0.1, 4.85].
  error_threshold = trial.suggest_float("error_threshold", 0.1, 5, step=0.25)
[I 2026-07-21 09:36:27,676] Trial 68 finished with value: -0.10003505693734578 and parameters: {'error_threshold': 4.35, 'scalers': 'robust', 'ratios': 'norm_ratio', 'imputers': 'mean', 'n_estimators': 1650, 'learning_rate': 0.023063570010697077, 'max_depth': 3, 'min_child_weight': 5, 'subsample': 1.0, 'colsample_bytree': 1.0, 'colsample_bylevel': 0.9, 'reg_alpha': 0.007380685370442823, 'reg_lambda': 0.0061670629272014815, 'gamma': 2.937187780659547e-05}. Best is trial 67 with value: -0.0990229319358027.
/bsuhome/alexanderemert/Research/Star-Formation-Research-Project-2026/pipeline/scripts/optuna/final_preds_and_models/optuna_search_mult_quant_reg.py:75: UserWarning: The distribution is specified by [0.1, 5] and step=0.25, but the range is not divisible by `step`. It will be replaced with [0.1, 4.85].
  error_threshold = trial.suggest_float("error_threshold", 0.1, 5, step=0.25)
[I 2026-07-21 09:36:38,118] Trial 69 finished with value: -0.10847194031393147 and parameters: {'error_threshold': 4.35, 'scalers': 'robust', 'ratios': 'norm_ratio', 'imputers': 'mean', 'n_estimators': 1450, 'learning_rate': 0.006037353885557198, 'max_depth': 3, 'min_child_weight': 7, 'subsample': 1.0, 'colsample_bytree': 0.8, 'colsample_bylevel': 0.9, 'reg_alpha': 0.006059704884109952, 'reg_lambda': 0.005600741405349968, 'gamma': 0.05759398946375875}. Best is trial 67 with value: -0.0990229319358027.
/bsuhome/alexanderemert/Research/Star-Formation-Research-Project-2026/pipeline/scripts/optuna/final_preds_and_models/optuna_search_mult_quant_reg.py:75: UserWarning: The distribution is specified by [0.1, 5] and step=0.25, but the range is not divisible by `step`. It will be replaced with [0.1, 4.85].
  error_threshold = trial.suggest_float("error_threshold", 0.1, 5, step=0.25)
[I 2026-07-21 09:36:45,890] Trial 70 finished with value: -0.10049822355431352 and parameters: {'error_threshold': 2.1, 'scalers': 'none', 'ratios': 'norm_ratio', 'imputers': 'mean', 'n_estimators': 1650, 'learning_rate': 0.017647375897184646, 'max_depth': 4, 'min_child_weight': 5, 'subsample': 1.0, 'colsample_bytree': 0.8, 'colsample_bylevel': 0.9, 'reg_alpha': 0.0046876814980512495, 'reg_lambda': 0.006806466341650906, 'gamma': 0.0020930831836160177}. Best is trial 67 with value: -0.0990229319358027.
/bsuhome/alexanderemert/Research/Star-Formation-Research-Project-2026/pipeline/scripts/optuna/final_preds_and_models/optuna_search_mult_quant_reg.py:75: UserWarning: The distribution is specified by [0.1, 5] and step=0.25, but the range is not divisible by `step`. It will be replaced with [0.1, 4.85].
  error_threshold = trial.suggest_float("error_threshold", 0.1, 5, step=0.25)
[I 2026-07-21 09:36:47,824] Trial 71 finished with value: -0.09854883830457369 and parameters: {'error_threshold': 4.35, 'scalers': 'none', 'ratios': 'norm_ratio', 'imputers': 'mean', 'n_estimators': 1650, 'learning_rate': 0.023337855893453354, 'max_depth': 3, 'min_child_weight': 3, 'subsample': 0.8, 'colsample_bytree': 0.9, 'colsample_bylevel': 0.9, 'reg_alpha': 0.005690370275750412, 'reg_lambda': 0.005528612257796262, 'gamma': 0.0002770880394008986}. Best is trial 71 with value: -0.09854883830457369.
/bsuhome/alexanderemert/Research/Star-Formation-Research-Project-2026/pipeline/scripts/optuna/final_preds_and_models/optuna_search_mult_quant_reg.py:75: UserWarning: The distribution is specified by [0.1, 5] and step=0.25, but the range is not divisible by `step`. It will be replaced with [0.1, 4.85].
  error_threshold = trial.suggest_float("error_threshold", 0.1, 5, step=0.25)
