[I 2026-07-20 12:52:26,987] Trial 76 finished with value: -1.1005890789453787 and parameters: {'error_threshold': 2.0, 'scalers': 'robust', 'ratios': 'norm_ratio', 'imputers': 'none', 'n_estimators': 1400, 'learning_rate': 0.18742600133398296, 'max_depth': 11, 'min_child_weight': 1, 'subsample': 0.7, 'colsample_bytree': 0.8, 'colsample_bylevel': 0.8, 'reg_alpha': 0.00010677739889574959, 'reg_lambda': 0.31802053806425795, 'gamma': 0.0016084528552431734}. Best is trial 52 with value: -2.0785744484814006.
/bsuscratch/alexanderemert/miniforge3/envs/starform-alex/lib/python3.14/site-packages/numpy/lib/_nanfunctions_impl.py:1215: RuntimeWarning: All-NaN slice encountered
  return fnb._ureduce(a, func=_nanmedian, keepdims=keepdims,
/bsuscratch/alexanderemert/miniforge3/envs/starform-alex/lib/python3.14/site-packages/numpy/lib/_nanfunctions_impl.py:1396: RuntimeWarning: All-NaN slice encountered
  return _nanquantile_unchecked(
/bsuscratch/alexanderemert/miniforge3/envs/starform-alex/lib/python3.14/site-packages/numpy/lib/_nanfunctions_impl.py:1215: RuntimeWarning: All-NaN slice encountered
  return fnb._ureduce(a, func=_nanmedian, keepdims=keepdims,
/bsuscratch/alexanderemert/miniforge3/envs/starform-alex/lib/python3.14/site-packages/numpy/lib/_nanfunctions_impl.py:1396: RuntimeWarning: All-NaN slice encountered
  return _nanquantile_unchecked(
/bsuscratch/alexanderemert/miniforge3/envs/starform-alex/lib/python3.14/site-packages/numpy/lib/_nanfunctions_impl.py:1215: RuntimeWarning: All-NaN slice encountered
  return fnb._ureduce(a, func=_nanmedian, keepdims=keepdims,
/bsuscratch/alexanderemert/miniforge3/envs/starform-alex/lib/python3.14/site-packages/numpy/lib/_nanfunctions_impl.py:1396: RuntimeWarning: All-NaN slice encountered
  return _nanquantile_unchecked(
/bsuscratch/alexanderemert/miniforge3/envs/starform-alex/lib/python3.14/site-packages/numpy/lib/_nanfunctions_impl.py:1215: RuntimeWarning: All-NaN slice encountered
  return fnb._ureduce(a, func=_nanmedian, keepdims=keepdims,
/bsuscratch/alexanderemert/miniforge3/envs/starform-alex/lib/python3.14/site-packages/numpy/lib/_nanfunctions_impl.py:1396: RuntimeWarning: All-NaN slice encountered
  return _nanquantile_unchecked(
/bsuscratch/alexanderemert/miniforge3/envs/starform-alex/lib/python3.14/site-packages/numpy/lib/_nanfunctions_impl.py:1215: RuntimeWarning: All-NaN slice encountered
  return fnb._ureduce(a, func=_nanmedian, keepdims=keepdims,
/bsuscratch/alexanderemert/miniforge3/envs/starform-alex/lib/python3.14/site-packages/numpy/lib/_nanfunctions_impl.py:1396: RuntimeWarning: All-NaN slice encountered
  return _nanquantile_unchecked(
/bsuscratch/alexanderemert/miniforge3/envs/starform-alex/lib/python3.14/site-packages/numpy/lib/_nanfunctions_impl.py:1215: RuntimeWarning: All-NaN slice encountered
  return fnb._ureduce(a, func=_nanmedian, keepdims=keepdims,
/bsuscratch/alexanderemert/miniforge3/envs/starform-alex/lib/python3.14/site-packages/numpy/lib/_nanfunctions_impl.py:1396: RuntimeWarning: All-NaN slice encountered
  return _nanquantile_unchecked(
/bsuscratch/alexanderemert/miniforge3/envs/starform-alex/lib/python3.14/site-packages/numpy/lib/_nanfunctions_impl.py:1215: RuntimeWarning: All-NaN slice encountered
  return fnb._ureduce(a, func=_nanmedian, keepdims=keepdims,
/bsuscratch/alexanderemert/miniforge3/envs/starform-alex/lib/python3.14/site-packages/numpy/lib/_nanfunctions_impl.py:1396: RuntimeWarning: All-NaN slice encountered
  return _nanquantile_unchecked(
/bsuscratch/alexanderemert/miniforge3/envs/starform-alex/lib/python3.14/site-packages/numpy/lib/_nanfunctions_impl.py:1215: RuntimeWarning: All-NaN slice encountered
  return fnb._ureduce(a, func=_nanmedian, keepdims=keepdims,
/bsuscratch/alexanderemert/miniforge3/envs/starform-alex/lib/python3.14/site-packages/numpy/lib/_nanfunctions_impl.py:1396: RuntimeWarning: All-NaN slice encountered
  return _nanquantile_unchecked(
/bsuscratch/alexanderemert/miniforge3/envs/starform-alex/lib/python3.14/site-packages/numpy/lib/_nanfunctions_impl.py:1215: RuntimeWarning: All-NaN slice encountered
  return fnb._ureduce(a, func=_nanmedian, keepdims=keepdims,
/bsuscratch/alexanderemert/miniforge3/envs/starform-alex/lib/python3.14/site-packages/numpy/lib/_nanfunctions_impl.py:1396: RuntimeWarning: All-NaN slice encountered
  return _nanquantile_unchecked(
/bsuscratch/alexanderemert/miniforge3/envs/starform-alex/lib/python3.14/site-packages/numpy/lib/_nanfunctions_impl.py:1215: RuntimeWarning: All-NaN slice encountered
  return fnb._ureduce(a, func=_nanmedian, keepdims=keepdims,
/bsuscratch/alexanderemert/miniforge3/envs/starform-alex/lib/python3.14/site-packages/numpy/lib/_nanfunctions_impl.py:1396: RuntimeWarning: All-NaN slice encountered
  return _nanquantile_unchecked(
/bsuscratch/alexanderemert/miniforge3/envs/starform-alex/lib/python3.14/site-packages/numpy/lib/_nanfunctions_impl.py:1215: RuntimeWarning: All-NaN slice encountered
  return fnb._ureduce(a, func=_nanmedian, keepdims=keepdims,
/bsuscratch/alexanderemert/miniforge3/envs/starform-alex/lib/python3.14/site-packages/numpy/lib/_nanfunctions_impl.py:1396: RuntimeWarning: All-NaN slice encountered
  return _nanquantile_unchecked(
/bsuscratch/alexanderemert/miniforge3/envs/starform-alex/lib/python3.14/site-packages/numpy/lib/_nanfunctions_impl.py:1215: RuntimeWarning: All-NaN slice encountered
  return fnb._ureduce(a, func=_nanmedian, keepdims=keepdims,
/bsuscratch/alexanderemert/miniforge3/envs/starform-alex/lib/python3.14/site-packages/numpy/lib/_nanfunctions_impl.py:1396: RuntimeWarning: All-NaN slice encountered
  return _nanquantile_unchecked(
/bsuscratch/alexanderemert/miniforge3/envs/starform-alex/lib/python3.14/site-packages/numpy/lib/_nanfunctions_impl.py:1215: RuntimeWarning: All-NaN slice encountered
  return fnb._ureduce(a, func=_nanmedian, keepdims=keepdims,
/bsuscratch/alexanderemert/miniforge3/envs/starform-alex/lib/python3.14/site-packages/numpy/lib/_nanfunctions_impl.py:1396: RuntimeWarning: All-NaN slice encountered
  return _nanquantile_unchecked(
[I 2026-07-20 12:53:04,431] Trial 78 finished with value: -1.2841146343123226 and parameters: {'error_threshold': 1.25, 'scalers': 'robust', 'ratios': 'norm_ratio', 'imputers': 'none', 'n_estimators': 1400, 'learning_rate': 0.37161537560212005, 'max_depth': 11, 'min_child_weight': 1, 'subsample': 0.7, 'colsample_bytree': 0.8, 'colsample_bylevel': 0.7, 'reg_alpha': 0.00010847439895512559, 'reg_lambda': 0.25308027016253526, 'gamma': 0.00862882048648638}. Best is trial 52 with value: -2.0785744484814006.
[I 2026-07-20 12:53:42,582] Trial 80 finished with value: -1.185053881374096 and parameters: {'error_threshold': 1.25, 'scalers': 'none', 'ratios': 'norm_ratio', 'imputers': 'median', 'n_estimators': 1850, 'learning_rate': 0.37592603131220836, 'max_depth': 11, 'min_child_weight': 4, 'subsample': 0.6, 'colsample_bytree': 0.8, 'colsample_bylevel': 0.7, 'reg_alpha': 0.0001688297978039008, 'reg_lambda': 0.34770903086914756, 'gamma': 0.008154628816941152}. Best is trial 52 with value: -2.0785744484814006.
/bsuscratch/alexanderemert/miniforge3/envs/starform-alex/lib/python3.14/site-packages/numpy/lib/_nanfunctions_impl.py:1215: RuntimeWarning: All-NaN slice encountered
  return fnb._ureduce(a, func=_nanmedian, keepdims=keepdims,
/bsuscratch/alexanderemert/miniforge3/envs/starform-alex/lib/python3.14/site-packages/numpy/lib/_nanfunctions_impl.py:1396: RuntimeWarning: All-NaN slice encountered
  return _nanquantile_unchecked(
/bsuscratch/alexanderemert/miniforge3/envs/starform-alex/lib/python3.14/site-packages/numpy/lib/_nanfunctions_impl.py:1215: RuntimeWarning: All-NaN slice encountered
  return fnb._ureduce(a, func=_nanmedian, keepdims=keepdims,
/bsuscratch/alexanderemert/miniforge3/envs/starform-alex/lib/python3.14/site-packages/numpy/lib/_nanfunctions_impl.py:1396: RuntimeWarning: All-NaN slice encountered
  return _nanquantile_unchecked(
/bsuscratch/alexanderemert/miniforge3/envs/starform-alex/lib/python3.14/site-packages/numpy/lib/_nanfunctions_impl.py:1215: RuntimeWarning: All-NaN slice encountered
  return fnb._ureduce(a, func=_nanmedian, keepdims=keepdims,
/bsuscratch/alexanderemert/miniforge3/envs/starform-alex/lib/python3.14/site-packages/numpy/lib/_nanfunctions_impl.py:1396: RuntimeWarning: All-NaN slice encountered
  return _nanquantile_unchecked(
/bsuscratch/alexanderemert/miniforge3/envs/starform-alex/lib/python3.14/site-packages/numpy/lib/_nanfunctions_impl.py:1215: RuntimeWarning: All-NaN slice encountered
  return fnb._ureduce(a, func=_nanmedian, keepdims=keepdims,
/bsuscratch/alexanderemert/miniforge3/envs/starform-alex/lib/python3.14/site-packages/numpy/lib/_nanfunctions_impl.py:1396: RuntimeWarning: All-NaN slice encountered
  return _nanquantile_unchecked(
/bsuscratch/alexanderemert/miniforge3/envs/starform-alex/lib/python3.14/site-packages/numpy/lib/_nanfunctions_impl.py:1215: RuntimeWarning: All-NaN slice encountered
  return fnb._ureduce(a, func=_nanmedian, keepdims=keepdims,
/bsuscratch/alexanderemert/miniforge3/envs/starform-alex/lib/python3.14/site-packages/numpy/lib/_nanfunctions_impl.py:1396: RuntimeWarning: All-NaN slice encountered
  return _nanquantile_unchecked(
/bsuscratch/alexanderemert/miniforge3/envs/starform-alex/lib/python3.14/site-packages/numpy/lib/_nanfunctions_impl.py:1215: RuntimeWarning: All-NaN slice encountered
  return fnb._ureduce(a, func=_nanmedian, keepdims=keepdims,
/bsuscratch/alexanderemert/miniforge3/envs/starform-alex/lib/python3.14/site-packages/numpy/lib/_nanfunctions_impl.py:1396: RuntimeWarning: All-NaN slice encountered
  return _nanquantile_unchecked(
[I 2026-07-20 12:54:37,960] Trial 79 finished with value: -1.7969271388558479 and parameters: {'error_threshold': 1.25, 'scalers': 'robust', 'ratios': 'norm_ratio', 'imputers': 'none', 'n_estimators': 2750, 'learning_rate': 0.40743118315098265, 'max_depth': 11, 'min_child_weight': 1, 'subsample': 0.6, 'colsample_bytree': 0.8, 'colsample_bylevel': 0.7, 'reg_alpha': 0.00010092185871868189, 'reg_lambda': 1.1057960895235803, 'gamma': 0.010826154986730922}. Best is trial 52 with value: -2.0785744484814006.
[I 2026-07-20 12:54:50,715] Trial 81 finished with value: -1.4251086003197484 and parameters: {'error_threshold': 1.75, 'scalers': 'none', 'ratios': 'norm_ratio', 'imputers': 'median', 'n_estimators': 1850, 'learning_rate': 0.36729321327476716, 'max_depth': 11, 'min_child_weight': 1, 'subsample': 0.6, 'colsample_bytree': 0.8, 'colsample_bylevel': 0.7, 'reg_alpha': 0.0003365118788647405, 'reg_lambda': 0.2874305380932004, 'gamma': 0.008117924786861503}. Best is trial 52 with value: -2.0785744484814006.
[I 2026-07-20 12:54:55,803] Trial 82 finished with value: -1.351863138642572 and parameters: {'error_threshold': 1.25, 'scalers': 'none', 'ratios': 'log_ratio', 'imputers': 'median', 'n_estimators': 1600, 'learning_rate': 0.34935064355699347, 'max_depth': 11, 'min_child_weight': 1, 'subsample': 0.6, 'colsample_bytree': 0.8, 'colsample_bylevel': 0.7, 'reg_alpha': 0.00045183411641093755, 'reg_lambda': 0.2889267428572909, 'gamma': 0.008883876365318032}. Best is trial 52 with value: -2.0785744484814006.
[I 2026-07-20 12:55:07,960] Trial 84 finished with value: -0.978912079222218 and parameters: {'error_threshold': 1.25, 'scalers': 'none', 'ratios': 'log_ratio', 'imputers': 'median', 'n_estimators': 1850, 'learning_rate': 0.3831873831505673, 'max_depth': 11, 'min_child_weight': 10, 'subsample': 0.6, 'colsample_bytree': 0.7, 'colsample_bylevel': 0.7, 'reg_alpha': 0.02713293519563701, 'reg_lambda': 0.25436487956954135, 'gamma': 0.0072427156739418835}. Best is trial 52 with value: -2.0785744484814006.
[I 2026-07-20 12:55:36,326] Trial 83 finished with value: -2.2462802385212317 and parameters: {'error_threshold': 1.25, 'scalers': 'none', 'ratios': 'log_ratio', 'imputers': 'median', 'n_estimators': 2700, 'learning_rate': 0.37084339087817536, 'max_depth': 11, 'min_child_weight': 1, 'subsample': 0.6, 'colsample_bytree': 0.8, 'colsample_bylevel': 0.7, 'reg_alpha': 0.031667014406496725, 'reg_lambda': 18.622077275498317, 'gamma': 0.00821054736064058}. Best is trial 83 with value: -2.2462802385212317.
[I 2026-07-20 12:57:15,988] Trial 85 finished with value: -1.5211340907820128 and parameters: {'error_threshold': 1.25, 'scalers': 'none', 'ratios': 'log_ratio', 'imputers': 'median', 'n_estimators': 1850, 'learning_rate': 0.3825072800918662, 'max_depth': 11, 'min_child_weight': 1, 'subsample': 0.6, 'colsample_bytree': 0.7, 'colsample_bylevel': 0.7, 'reg_alpha': 0.0003625443442961474, 'reg_lambda': 0.2797987950311164, 'gamma': 0.0075054739900402}. Best is trial 83 with value: -2.2462802385212317.
[I 2026-07-20 12:57:36,365] Trial 86 finished with value: -1.2479971065642685 and parameters: {'error_threshold': 0.75, 'scalers': 'none', 'ratios': 'log_ratio', 'imputers': 'median', 'n_estimators': 1850, 'learning_rate': 0.4007105484182482, 'max_depth': 11, 'min_child_weight': 4, 'subsample': 0.6, 'colsample_bytree': 0.9, 'colsample_bylevel': 0.7, 'reg_alpha': 0.0003724282968394673, 'reg_lambda': 13.76704810678576, 'gamma': 0.00906108854299071}. Best is trial 83 with value: -2.2462802385212317.
[I 2026-07-20 12:58:33,772] Trial 87 finished with value: -1.3797314806550238 and parameters: {'error_threshold': 4.75, 'scalers': 'none', 'ratios': 'log_ratio', 'imputers': 'median', 'n_estimators': 1800, 'learning_rate': 0.4935762765778271, 'max_depth': 12, 'min_child_weight': 1, 'subsample': 0.9, 'colsample_bytree': 0.9, 'colsample_bylevel': 0.7, 'reg_alpha': 0.0004016258332280426, 'reg_lambda': 0.15927800543230955, 'gamma': 0.00017785676191211746}. Best is trial 83 with value: -2.2462802385212317.
[I 2026-07-20 13:00:12,875] Trial 90 finished with value: -1.0655739538553273 and parameters: {'error_threshold': 4.75, 'scalers': 'none', 'ratios': 'norm_ratio', 'imputers': 'mean', 'n_estimators': 2800, 'learning_rate': 0.4452530334365682, 'max_depth': 12, 'min_child_weight': 10, 'subsample': 0.6, 'colsample_bytree': 0.9, 'colsample_bylevel': 0.7, 'reg_alpha': 0.00027270585820087943, 'reg_lambda': 0.050871476612083036, 'gamma': 0.00019738618856527407}. Best is trial 83 with value: -2.2462802385212317.
[I 2026-07-20 13:01:08,211] Trial 88 finished with value: -2.8054399236500807 and parameters: {'error_threshold': 4.75, 'scalers': 'none', 'ratios': 'log_ratio', 'imputers': 'median', 'n_estimators': 2750, 'learning_rate': 0.4555988664966799, 'max_depth': 12, 'min_child_weight': 1, 'subsample': 0.6, 'colsample_bytree': 0.9, 'colsample_bylevel': 0.7, 'reg_alpha': 0.00040399266242094583, 'reg_lambda': 16.812213368981496, 'gamma': 0.0030984652776987467}. Best is trial 88 with value: -2.8054399236500807.
[I 2026-07-20 13:01:24,429] Trial 89 finished with value: -2.668568303379601 and parameters: {'error_threshold': 4.75, 'scalers': 'none', 'ratios': 'norm_ratio', 'imputers': 'median', 'n_estimators': 2800, 'learning_rate': 0.4258637736542167, 'max_depth': 12, 'min_child_weight': 1, 'subsample': 0.6, 'colsample_bytree': 0.9, 'colsample_bylevel': 0.7, 'reg_alpha': 0.000407510232157689, 'reg_lambda': 18.55870610152579, 'gamma': 0.0028159358088839254}. Best is trial 88 with value: -2.8054399236500807.
[I 2026-07-20 13:02:33,373] Trial 91 finished with value: -3.5956052874304505 and parameters: {'error_threshold': 4.75, 'scalers': 'none', 'ratios': 'norm_ratio', 'imputers': 'mean', 'n_estimators': 2750, 'learning_rate': 0.49690972097936853, 'max_depth': 12, 'min_child_weight': 1, 'subsample': 0.6, 'colsample_bytree': 0.9, 'colsample_bylevel': 0.7, 'reg_alpha': 0.0003660799749313172, 'reg_lambda': 19.149529472801206, 'gamma': 0.00014168162331546644}. Best is trial 91 with value: -3.5956052874304505.
[I 2026-07-20 13:02:46,491] Trial 92 finished with value: -2.628153395908886 and parameters: {'error_threshold': 0.75, 'scalers': 'none', 'ratios': 'norm_ratio', 'imputers': 'mean', 'n_estimators': 2700, 'learning_rate': 0.4297557896188417, 'max_depth': 10, 'min_child_weight': 1, 'subsample': 0.6, 'colsample_bytree': 0.9, 'colsample_bylevel': 0.7, 'reg_alpha': 0.000606026711233337, 'reg_lambda': 19.891015554360617, 'gamma': 0.002695182515919394}. Best is trial 91 with value: -3.5956052874304505.
[I 2026-07-20 13:03:35,388] Trial 93 finished with value: -2.791164685126215 and parameters: {'error_threshold': 0.75, 'scalers': 'none', 'ratios': 'log_ratio', 'imputers': 'median', 'n_estimators': 2700, 'learning_rate': 0.42799716757393674, 'max_depth': 10, 'min_child_weight': 1, 'subsample': 0.6, 'colsample_bytree': 0.7, 'colsample_bylevel': 0.7, 'reg_alpha': 0.8922303766201621, 'reg_lambda': 78.72133786951073, 'gamma': 0.0027201716225681294}. Best is trial 91 with value: -3.5956052874304505.
[I 2026-07-20 13:03:44,427] Trial 94 finished with value: -3.1711281038615713 and parameters: {'error_threshold': 1.75, 'scalers': 'none', 'ratios': 'log_ratio', 'imputers': 'median', 'n_estimators': 2750, 'learning_rate': 0.4431552484409377, 'max_depth': 10, 'min_child_weight': 1, 'subsample': 0.6, 'colsample_bytree': 0.5, 'colsample_bylevel': 0.7, 'reg_alpha': 0.0004036918405444659, 'reg_lambda': 22.762372250125598, 'gamma': 0.002251496905115631}. Best is trial 91 with value: -3.5956052874304505.
[I 2026-07-20 13:05:06,628] Trial 95 finished with value: -3.2917853070135696 and parameters: {'error_threshold': 1.75, 'scalers': 'none', 'ratios': 'log_ratio', 'imputers': 'mean', 'n_estimators': 2900, 'learning_rate': 0.4274550184607737, 'max_depth': 10, 'min_child_weight': 1, 'subsample': 0.6, 'colsample_bytree': 0.7, 'colsample_bylevel': 0.7, 'reg_alpha': 6.833230762890366e-05, 'reg_lambda': 99.94506438189516, 'gamma': 0.0028037199492865015}. Best is trial 91 with value: -3.5956052874304505.
[I 2026-07-20 13:05:45,654] Trial 96 finished with value: -1.4518689856817755 and parameters: {'error_threshold': 1.75, 'scalers': 'none', 'ratios': 'log_ratio', 'imputers': 'median', 'n_estimators': 2750, 'learning_rate': 0.12618512905198948, 'max_depth': 10, 'min_child_weight': 1, 'subsample': 0.6, 'colsample_bytree': 0.7, 'colsample_bylevel': 0.7, 'reg_alpha': 0.8167061809472298, 'reg_lambda': 17.664666268759188, 'gamma': 0.002861419053137219}. Best is trial 91 with value: -3.5956052874304505.
[I 2026-07-20 13:06:33,910] Trial 97 finished with value: -0.7286977218682408 and parameters: {'error_threshold': 0.75, 'scalers': 'none', 'ratios': 'log_ratio', 'imputers': 'median', 'n_estimators': 2700, 'learning_rate': 0.00016385760251189647, 'max_depth': 10, 'min_child_weight': 1, 'subsample': 0.6, 'colsample_bytree': 1.0, 'colsample_bylevel': 0.6, 'reg_alpha': 5.925173637421929e-05, 'reg_lambda': 96.24203256530004, 'gamma': 0.002905621918788222}. Best is trial 91 with value: -3.5956052874304505.
[I 2026-07-20 13:07:21,782] Trial 98 finished with value: -1.6782582609003216 and parameters: {'error_threshold': 4.0, 'scalers': 'none', 'ratios': 'log_ratio', 'imputers': 'median', 'n_estimators': 2700, 'learning_rate': 0.23362504154307817, 'max_depth': 10, 'min_child_weight': 1, 'subsample': 0.6, 'colsample_bytree': 0.5, 'colsample_bylevel': 0.7, 'reg_alpha': 6.667713213777088e-05, 'reg_lambda': 98.80653784650988, 'gamma': 0.002505061442633337}. Best is trial 91 with value: -3.5956052874304505.
[I 2026-07-20 13:08:23,088] Trial 99 finished with value: -2.1635234783935076 and parameters: {'error_threshold': 4.75, 'scalers': 'none', 'ratios': 'log_ratio', 'imputers': 'mean', 'n_estimators': 2700, 'learning_rate': 0.30978765877155795, 'max_depth': 12, 'min_child_weight': 1, 'subsample': 0.6, 'colsample_bytree': 1.0, 'colsample_bylevel': 0.7, 'reg_alpha': 0.0005855607499423148, 'reg_lambda': 97.42074387866104, 'gamma': 0.0035325333767456334}. Best is trial 91 with value: -3.5956052874304505.
[I 2026-07-20 13:08:33,461] Trial 100 finished with value: -1.5678169574327308 and parameters: {'error_threshold': 4.0, 'scalers': 'none', 'ratios': 'log_ratio', 'imputers': 'mean', 'n_estimators': 2700, 'learning_rate': 0.230795009934625, 'max_depth': 10, 'min_child_weight': 1, 'subsample': 0.6, 'colsample_bytree': 1.0, 'colsample_bylevel': 0.7, 'reg_alpha': 5.430078961155611e-05, 'reg_lambda': 89.97715208894894, 'gamma': 0.0036746962491652443}. Best is trial 91 with value: -3.5956052874304505.
[I 2026-07-20 13:08:42,976] Trial 102 finished with value: -0.7368141075141338 and parameters: {'error_threshold': 4.0, 'scalers': 'none', 'ratios': 'log_ratio', 'imputers': 'mean', 'n_estimators': 2650, 'learning_rate': 0.00015300856711306668, 'max_depth': 9, 'min_child_weight': 1, 'subsample': 0.6, 'colsample_bytree': 0.5, 'colsample_bylevel': 0.6, 'reg_alpha': 2.3690081400358296, 'reg_lambda': 98.65947980034633, 'gamma': 0.002867356376985548}. Best is trial 91 with value: -3.5956052874304505.
[I 2026-07-20 13:09:19,460] Trial 101 finished with value: -1.4801063288689729 and parameters: {'error_threshold': 0.25, 'scalers': 'none', 'ratios': 'log_ratio', 'imputers': 'mean', 'n_estimators': 2700, 'learning_rate': 0.23837862336238957, 'max_depth': 10, 'min_child_weight': 1, 'subsample': 0.6, 'colsample_bytree': 1.0, 'colsample_bylevel': 0.7, 'reg_alpha': 1.51215701936415, 'reg_lambda': 75.77001887128185, 'gamma': 0.0025944998391002486}. Best is trial 91 with value: -3.5956052874304505.
[I 2026-07-20 13:10:38,760] Trial 103 finished with value: -1.516680297452429 and parameters: {'error_threshold': 0.25, 'scalers': 'none', 'ratios': 'log_ratio', 'imputers': 'mean', 'n_estimators': 2600, 'learning_rate': 0.23851538102246453, 'max_depth': 10, 'min_child_weight': 1, 'subsample': 0.6, 'colsample_bytree': 1.0, 'colsample_bylevel': 0.6, 'reg_alpha': 0.8074568827940466, 'reg_lambda': 92.63643724591488, 'gamma': 0.0026551914074162733}. Best is trial 91 with value: -3.5956052874304505.
