[I 2026-07-21 09:40:45,525] Trial 120 finished with value: -0.0986420960784123 and parameters: {'error_threshold': 3.35, 'scalers': 'none', 'ratios': 'norm_ratio', 'imputers': 'mean', 'n_estimators': 1350, 'learning_rate': 0.04816161424392278, 'max_depth': 3, 'min_child_weight': 4, 'subsample': 0.8, 'colsample_bytree': 0.7, 'colsample_bylevel': 1.0, 'reg_alpha': 0.0002764595759233125, 'reg_lambda': 0.023105995225900924, 'gamma': 7.293535994441324e-05}. Best is trial 109 with value: -0.09757409488906987.
/bsuhome/alexanderemert/Research/Star-Formation-Research-Project-2026/pipeline/scripts/optuna/final_preds_and_models/optuna_search_mult_quant_reg.py:75: UserWarning: The distribution is specified by [0.1, 5] and step=0.25, but the range is not divisible by `step`. It will be replaced with [0.1, 4.85].
  error_threshold = trial.suggest_float("error_threshold", 0.1, 5, step=0.25)
[I 2026-07-21 09:40:47,065] Trial 121 finished with value: -0.09864772158134066 and parameters: {'error_threshold': 3.35, 'scalers': 'none', 'ratios': 'norm_ratio', 'imputers': 'mean', 'n_estimators': 1350, 'learning_rate': 0.045500274699227926, 'max_depth': 3, 'min_child_weight': 4, 'subsample': 0.8, 'colsample_bytree': 0.7, 'colsample_bylevel': 1.0, 'reg_alpha': 0.00027475848810461364, 'reg_lambda': 0.019845401890299597, 'gamma': 6.281672302142663e-05}. Best is trial 109 with value: -0.09757409488906987.
/bsuhome/alexanderemert/Research/Star-Formation-Research-Project-2026/pipeline/scripts/optuna/final_preds_and_models/optuna_search_mult_quant_reg.py:75: UserWarning: The distribution is specified by [0.1, 5] and step=0.25, but the range is not divisible by `step`. It will be replaced with [0.1, 4.85].
  error_threshold = trial.suggest_float("error_threshold", 0.1, 5, step=0.25)
[I 2026-07-21 09:40:53,319] Trial 122 finished with value: -0.09846065793052194 and parameters: {'error_threshold': 3.35, 'scalers': 'none', 'ratios': 'norm_ratio', 'imputers': 'mean', 'n_estimators': 1350, 'learning_rate': 0.04844212067979702, 'max_depth': 3, 'min_child_weight': 4, 'subsample': 0.8, 'colsample_bytree': 0.7, 'colsample_bylevel': 1.0, 'reg_alpha': 0.00034251739900140123, 'reg_lambda': 0.019730093832124367, 'gamma': 6.814459256351577e-05}. Best is trial 109 with value: -0.09757409488906987.
/bsuhome/alexanderemert/Research/Star-Formation-Research-Project-2026/pipeline/scripts/optuna/final_preds_and_models/optuna_search_mult_quant_reg.py:75: UserWarning: The distribution is specified by [0.1, 5] and step=0.25, but the range is not divisible by `step`. It will be replaced with [0.1, 4.85].
  error_threshold = trial.suggest_float("error_threshold", 0.1, 5, step=0.25)
[I 2026-07-21 09:41:00,257] Trial 123 finished with value: -0.09866816937839513 and parameters: {'error_threshold': 4.35, 'scalers': 'none', 'ratios': 'norm_ratio', 'imputers': 'mean', 'n_estimators': 1350, 'learning_rate': 0.061574450281786264, 'max_depth': 3, 'min_child_weight': 4, 'subsample': 0.8, 'colsample_bytree': 0.7, 'colsample_bylevel': 1.0, 'reg_alpha': 0.0002377538133060999, 'reg_lambda': 0.028134806242090853, 'gamma': 8.392543144800277e-05}. Best is trial 109 with value: -0.09757409488906987.
/bsuhome/alexanderemert/Research/Star-Formation-Research-Project-2026/pipeline/scripts/optuna/final_preds_and_models/optuna_search_mult_quant_reg.py:75: UserWarning: The distribution is specified by [0.1, 5] and step=0.25, but the range is not divisible by `step`. It will be replaced with [0.1, 4.85].
  error_threshold = trial.suggest_float("error_threshold", 0.1, 5, step=0.25)
[I 2026-07-21 09:41:04,790] Trial 124 finished with value: -0.0979877870643127 and parameters: {'error_threshold': 4.35, 'scalers': 'none', 'ratios': 'norm_ratio', 'imputers': 'mean', 'n_estimators': 1250, 'learning_rate': 0.044119819789365994, 'max_depth': 3, 'min_child_weight': 4, 'subsample': 0.8, 'colsample_bytree': 0.7, 'colsample_bylevel': 1.0, 'reg_alpha': 0.0015513747206987187, 'reg_lambda': 0.024677910962481373, 'gamma': 7.677259162343818e-05}. Best is trial 109 with value: -0.09757409488906987.
/bsuhome/alexanderemert/Research/Star-Formation-Research-Project-2026/pipeline/scripts/optuna/final_preds_and_models/optuna_search_mult_quant_reg.py:75: UserWarning: The distribution is specified by [0.1, 5] and step=0.25, but the range is not divisible by `step`. It will be replaced with [0.1, 4.85].
  error_threshold = trial.suggest_float("error_threshold", 0.1, 5, step=0.25)
[I 2026-07-21 09:41:06,354] Trial 125 finished with value: -0.09871715884570952 and parameters: {'error_threshold': 4.35, 'scalers': 'none', 'ratios': 'norm_ratio', 'imputers': 'mean', 'n_estimators': 1350, 'learning_rate': 0.05000868767898765, 'max_depth': 3, 'min_child_weight': 4, 'subsample': 0.8, 'colsample_bytree': 0.7, 'colsample_bylevel': 1.0, 'reg_alpha': 0.0013150074219288176, 'reg_lambda': 0.012312621605968426, 'gamma': 0.0001244458352521625}. Best is trial 109 with value: -0.09757409488906987.
/bsuhome/alexanderemert/Research/Star-Formation-Research-Project-2026/pipeline/scripts/optuna/final_preds_and_models/optuna_search_mult_quant_reg.py:75: UserWarning: The distribution is specified by [0.1, 5] and step=0.25, but the range is not divisible by `step`. It will be replaced with [0.1, 4.85].
  error_threshold = trial.suggest_float("error_threshold", 0.1, 5, step=0.25)
[I 2026-07-21 09:41:18,799] Trial 127 finished with value: -0.09925192976673974 and parameters: {'error_threshold': 4.35, 'scalers': 'none', 'ratios': 'norm_ratio', 'imputers': 'mean', 'n_estimators': 1250, 'learning_rate': 0.047533234007135314, 'max_depth': 3, 'min_child_weight': 4, 'subsample': 0.8, 'colsample_bytree': 0.7, 'colsample_bylevel': 1.0, 'reg_alpha': 0.0014414067547404029, 'reg_lambda': 0.025227161574583896, 'gamma': 0.00010370714761592937}. Best is trial 109 with value: -0.09757409488906987.
/bsuhome/alexanderemert/Research/Star-Formation-Research-Project-2026/pipeline/scripts/optuna/final_preds_and_models/optuna_search_mult_quant_reg.py:75: UserWarning: The distribution is specified by [0.1, 5] and step=0.25, but the range is not divisible by `step`. It will be replaced with [0.1, 4.85].
  error_threshold = trial.suggest_float("error_threshold", 0.1, 5, step=0.25)
[I 2026-07-21 09:41:35,168] Trial 128 finished with value: -0.09821411751355004 and parameters: {'error_threshold': 3.35, 'scalers': 'none', 'ratios': 'norm_ratio', 'imputers': 'mean', 'n_estimators': 1350, 'learning_rate': 0.04670751164564829, 'max_depth': 3, 'min_child_weight': 4, 'subsample': 0.8, 'colsample_bytree': 0.7, 'colsample_bylevel': 1.0, 'reg_alpha': 0.0012798519073778571, 'reg_lambda': 0.01968714572909911, 'gamma': 7.017546923732925e-05}. Best is trial 109 with value: -0.09757409488906987.
/bsuhome/alexanderemert/Research/Star-Formation-Research-Project-2026/pipeline/scripts/optuna/final_preds_and_models/optuna_search_mult_quant_reg.py:75: UserWarning: The distribution is specified by [0.1, 5] and step=0.25, but the range is not divisible by `step`. It will be replaced with [0.1, 4.85].
  error_threshold = trial.suggest_float("error_threshold", 0.1, 5, step=0.25)
[I 2026-07-21 09:41:36,685] Trial 129 finished with value: -0.09916622483979011 and parameters: {'error_threshold': 3.35, 'scalers': 'none', 'ratios': 'norm_ratio', 'imputers': 'mean', 'n_estimators': 1350, 'learning_rate': 0.05882163922874897, 'max_depth': 3, 'min_child_weight': 4, 'subsample': 0.8, 'colsample_bytree': 0.7, 'colsample_bylevel': 1.0, 'reg_alpha': 0.0007339739582683487, 'reg_lambda': 0.029962599233975026, 'gamma': 7.506987961254954e-05}. Best is trial 109 with value: -0.09757409488906987.
/bsuhome/alexanderemert/Research/Star-Formation-Research-Project-2026/pipeline/scripts/optuna/final_preds_and_models/optuna_search_mult_quant_reg.py:75: UserWarning: The distribution is specified by [0.1, 5] and step=0.25, but the range is not divisible by `step`. It will be replaced with [0.1, 4.85].
  error_threshold = trial.suggest_float("error_threshold", 0.1, 5, step=0.25)
[I 2026-07-21 09:41:42,967] Trial 130 finished with value: -0.09948370650531574 and parameters: {'error_threshold': 3.35, 'scalers': 'none', 'ratios': 'norm_ratio', 'imputers': 'mean', 'n_estimators': 1350, 'learning_rate': 0.06336585517012218, 'max_depth': 3, 'min_child_weight': 4, 'subsample': 0.8, 'colsample_bytree': 0.7, 'colsample_bylevel': 1.0, 'reg_alpha': 0.0007591601355583286, 'reg_lambda': 0.009426983296704407, 'gamma': 6.129958481775943e-05}. Best is trial 109 with value: -0.09757409488906987.
/bsuhome/alexanderemert/Research/Star-Formation-Research-Project-2026/pipeline/scripts/optuna/final_preds_and_models/optuna_search_mult_quant_reg.py:75: UserWarning: The distribution is specified by [0.1, 5] and step=0.25, but the range is not divisible by `step`. It will be replaced with [0.1, 4.85].
  error_threshold = trial.suggest_float("error_threshold", 0.1, 5, step=0.25)
[I 2026-07-21 09:41:44,475] Trial 131 finished with value: -0.09921387574041433 and parameters: {'error_threshold': 3.35, 'scalers': 'none', 'ratios': 'norm_ratio', 'imputers': 'mean', 'n_estimators': 1350, 'learning_rate': 0.0637863896851278, 'max_depth': 3, 'min_child_weight': 4, 'subsample': 0.8, 'colsample_bytree': 0.7, 'colsample_bylevel': 1.0, 'reg_alpha': 0.0014462278601386008, 'reg_lambda': 0.010342419278389293, 'gamma': 7.670186971921128e-05}. Best is trial 109 with value: -0.09757409488906987.
/bsuhome/alexanderemert/Research/Star-Formation-Research-Project-2026/pipeline/scripts/optuna/final_preds_and_models/optuna_search_mult_quant_reg.py:75: UserWarning: The distribution is specified by [0.1, 5] and step=0.25, but the range is not divisible by `step`. It will be replaced with [0.1, 4.85].
  error_threshold = trial.suggest_float("error_threshold", 0.1, 5, step=0.25)
[I 2026-07-21 09:41:49,885] Trial 126 finished with value: -0.11932745213391355 and parameters: {'error_threshold': 3.35, 'scalers': 'none', 'ratios': 'norm_ratio', 'imputers': 'mean', 'n_estimators': 1350, 'learning_rate': 0.05195244882923313, 'max_depth': 10, 'min_child_weight': 4, 'subsample': 0.8, 'colsample_bytree': 0.7, 'colsample_bylevel': 1.0, 'reg_alpha': 0.0014628351219703863, 'reg_lambda': 0.020931344454021283, 'gamma': 0.00011177393819583321}. Best is trial 109 with value: -0.09757409488906987.
/bsuhome/alexanderemert/Research/Star-Formation-Research-Project-2026/pipeline/scripts/optuna/final_preds_and_models/optuna_search_mult_quant_reg.py:75: UserWarning: The distribution is specified by [0.1, 5] and step=0.25, but the range is not divisible by `step`. It will be replaced with [0.1, 4.85].
  error_threshold = trial.suggest_float("error_threshold", 0.1, 5, step=0.25)
[I 2026-07-21 09:41:54,380] Trial 132 finished with value: -0.09945939094475768 and parameters: {'error_threshold': 3.35, 'scalers': 'none', 'ratios': 'norm_ratio', 'imputers': 'mean', 'n_estimators': 1350, 'learning_rate': 0.05894776472484472, 'max_depth': 3, 'min_child_weight': 4, 'subsample': 0.8, 'colsample_bytree': 0.7, 'colsample_bylevel': 1.0, 'reg_alpha': 0.0006685997001484367, 'reg_lambda': 0.010417166783559193, 'gamma': 0.00011850619452447757}. Best is trial 109 with value: -0.09757409488906987.
/bsuhome/alexanderemert/Research/Star-Formation-Research-Project-2026/pipeline/scripts/optuna/final_preds_and_models/optuna_search_mult_quant_reg.py:75: UserWarning: The distribution is specified by [0.1, 5] and step=0.25, but the range is not divisible by `step`. It will be replaced with [0.1, 4.85].
  error_threshold = trial.suggest_float("error_threshold", 0.1, 5, step=0.25)
[I 2026-07-21 09:41:55,821] Trial 133 finished with value: -0.09916617966202164 and parameters: {'error_threshold': 3.35, 'scalers': 'none', 'ratios': 'norm_ratio', 'imputers': 'mean', 'n_estimators': 1250, 'learning_rate': 0.0599711774335954, 'max_depth': 3, 'min_child_weight': 4, 'subsample': 0.8, 'colsample_bytree': 0.7, 'colsample_bylevel': 1.0, 'reg_alpha': 0.0001145871164490696, 'reg_lambda': 0.024936095223016604, 'gamma': 8.246465101668498e-05}. Best is trial 109 with value: -0.09757409488906987.
/bsuhome/alexanderemert/Research/Star-Formation-Research-Project-2026/pipeline/scripts/optuna/final_preds_and_models/optuna_search_mult_quant_reg.py:75: UserWarning: The distribution is specified by [0.1, 5] and step=0.25, but the range is not divisible by `step`. It will be replaced with [0.1, 4.85].
  error_threshold = trial.suggest_float("error_threshold", 0.1, 5, step=0.25)
[I 2026-07-21 09:42:09,200] Trial 134 finished with value: -0.09949349777425344 and parameters: {'error_threshold': 3.35, 'scalers': 'none', 'ratios': 'norm_ratio', 'imputers': 'mean', 'n_estimators': 1400, 'learning_rate': 0.06587860848825301, 'max_depth': 3, 'min_child_weight': 4, 'subsample': 0.8, 'colsample_bytree': 0.7, 'colsample_bylevel': 1.0, 'reg_alpha': 0.0006923818215055362, 'reg_lambda': 0.031112491227573057, 'gamma': 7.214243898601215e-05}. Best is trial 109 with value: -0.09757409488906987.
/bsuhome/alexanderemert/Research/Star-Formation-Research-Project-2026/pipeline/scripts/optuna/final_preds_and_models/optuna_search_mult_quant_reg.py:75: UserWarning: The distribution is specified by [0.1, 5] and step=0.25, but the range is not divisible by `step`. It will be replaced with [0.1, 4.85].
  error_threshold = trial.suggest_float("error_threshold", 0.1, 5, step=0.25)
[I 2026-07-21 09:42:15,254] Trial 135 finished with value: -0.10038155381738913 and parameters: {'error_threshold': 3.35, 'scalers': 'none', 'ratios': 'norm_ratio', 'imputers': 'mean', 'n_estimators': 1400, 'learning_rate': 0.10879756449727461, 'max_depth': 3, 'min_child_weight': 4, 'subsample': 0.8, 'colsample_bytree': 0.7, 'colsample_bylevel': 1.0, 'reg_alpha': 0.0005438140716928152, 'reg_lambda': 0.009164532832906531, 'gamma': 0.00018935978986877146}. Best is trial 109 with value: -0.09757409488906987.
/bsuhome/alexanderemert/Research/Star-Formation-Research-Project-2026/pipeline/scripts/optuna/final_preds_and_models/optuna_search_mult_quant_reg.py:75: UserWarning: The distribution is specified by [0.1, 5] and step=0.25, but the range is not divisible by `step`. It will be replaced with [0.1, 4.85].
  error_threshold = trial.suggest_float("error_threshold", 0.1, 5, step=0.25)
[I 2026-07-21 09:42:16,500] Trial 136 finished with value: -0.09973087125084583 and parameters: {'error_threshold': 3.35, 'scalers': 'none', 'ratios': 'norm_ratio', 'imputers': 'mean', 'n_estimators': 1200, 'learning_rate': 0.06971158413945217, 'max_depth': 3, 'min_child_weight': 4, 'subsample': 0.8, 'colsample_bytree': 0.7, 'colsample_bylevel': 1.0, 'reg_alpha': 0.0001114866485482799, 'reg_lambda': 0.010009229734786065, 'gamma': 0.00020949601162019394}. Best is trial 109 with value: -0.09757409488906987.
/bsuhome/alexanderemert/Research/Star-Formation-Research-Project-2026/pipeline/scripts/optuna/final_preds_and_models/optuna_search_mult_quant_reg.py:75: UserWarning: The distribution is specified by [0.1, 5] and step=0.25, but the range is not divisible by `step`. It will be replaced with [0.1, 4.85].
  error_threshold = trial.suggest_float("error_threshold", 0.1, 5, step=0.25)
[I 2026-07-21 09:42:22,278] Trial 137 finished with value: -0.10133540388541129 and parameters: {'error_threshold': 3.1, 'scalers': 'none', 'ratios': 'norm_ratio', 'imputers': 'mean', 'n_estimators': 1200, 'learning_rate': 0.11442249699386477, 'max_depth': 3, 'min_child_weight': 3, 'subsample': 0.8, 'colsample_bytree': 0.7, 'colsample_bylevel': 1.0, 'reg_alpha': 0.00047377614116658805, 'reg_lambda': 0.06655273405493713, 'gamma': 0.00018819100915968965}. Best is trial 109 with value: -0.09757409488906987.
/bsuhome/alexanderemert/Research/Star-Formation-Research-Project-2026/pipeline/scripts/optuna/final_preds_and_models/optuna_search_mult_quant_reg.py:75: UserWarning: The distribution is specified by [0.1, 5] and step=0.25, but the range is not divisible by `step`. It will be replaced with [0.1, 4.85].
  error_threshold = trial.suggest_float("error_threshold", 0.1, 5, step=0.25)
[I 2026-07-21 09:42:23,644] Trial 138 finished with value: -0.10174134271924533 and parameters: {'error_threshold': 3.1, 'scalers': 'none', 'ratios': 'norm_ratio', 'imputers': 'mean', 'n_estimators': 1200, 'learning_rate': 0.12080966396858717, 'max_depth': 3, 'min_child_weight': 4, 'subsample': 0.8, 'colsample_bytree': 0.7, 'colsample_bylevel': 1.0, 'reg_alpha': 0.00042910609791895594, 'reg_lambda': 0.05961624168514285, 'gamma': 3.161596843591687e-05}. Best is trial 109 with value: -0.09757409488906987.
/bsuhome/alexanderemert/Research/Star-Formation-Research-Project-2026/pipeline/scripts/optuna/final_preds_and_models/optuna_search_mult_quant_reg.py:75: UserWarning: The distribution is specified by [0.1, 5] and step=0.25, but the range is not divisible by `step`. It will be replaced with [0.1, 4.85].
  error_threshold = trial.suggest_float("error_threshold", 0.1, 5, step=0.25)
[I 2026-07-21 09:42:25,021] Trial 139 finished with value: -0.10024727845138266 and parameters: {'error_threshold': 3.1, 'scalers': 'none', 'ratios': 'norm_ratio', 'imputers': 'mean', 'n_estimators': 1200, 'learning_rate': 0.07693203809893513, 'max_depth': 3, 'min_child_weight': 4, 'subsample': 0.8, 'colsample_bytree': 0.7, 'colsample_bylevel': 1.0, 'reg_alpha': 9.75050447445411e-05, 'reg_lambda': 0.06207658066472106, 'gamma': 0.00018606567565986992}. Best is trial 109 with value: -0.09757409488906987.
/bsuhome/alexanderemert/Research/Star-Formation-Research-Project-2026/pipeline/scripts/optuna/final_preds_and_models/optuna_search_mult_quant_reg.py:75: UserWarning: The distribution is specified by [0.1, 5] and step=0.25, but the range is not divisible by `step`. It will be replaced with [0.1, 4.85].
  error_threshold = trial.suggest_float("error_threshold", 0.1, 5, step=0.25)
[I 2026-07-21 09:42:29,220] Trial 140 finished with value: -0.10059852204311938 and parameters: {'error_threshold': 3.1, 'scalers': 'none', 'ratios': 'norm_ratio', 'imputers': 'mean', 'n_estimators': 1200, 'learning_rate': 0.07364310400758674, 'max_depth': 3, 'min_child_weight': 3, 'subsample': 0.8, 'colsample_bytree': 0.7, 'colsample_bylevel': 1.0, 'reg_alpha': 0.00010441740969153172, 'reg_lambda': 0.015515639149012623, 'gamma': 0.00019580954757762788}. Best is trial 109 with value: -0.09757409488906987.
/bsuhome/alexanderemert/Research/Star-Formation-Research-Project-2026/pipeline/scripts/optuna/final_preds_and_models/optuna_search_mult_quant_reg.py:75: UserWarning: The distribution is specified by [0.1, 5] and step=0.25, but the range is not divisible by `step`. It will be replaced with [0.1, 4.85].
  error_threshold = trial.suggest_float("error_threshold", 0.1, 5, step=0.25)
[I 2026-07-21 09:42:30,573] Trial 141 finished with value: -0.10127300880011321 and parameters: {'error_threshold': 3.1, 'scalers': 'none', 'ratios': 'norm_ratio', 'imputers': 'mean', 'n_estimators': 1200, 'learning_rate': 0.10790646036245692, 'max_depth': 3, 'min_child_weight': 3, 'subsample': 0.8, 'colsample_bytree': 0.7, 'colsample_bylevel': 1.0, 'reg_alpha': 0.0003597744376187194, 'reg_lambda': 0.06726468732460988, 'gamma': 0.00022563398698528277}. Best is trial 109 with value: -0.09757409488906987.
/bsuhome/alexanderemert/Research/Star-Formation-Research-Project-2026/pipeline/scripts/optuna/final_preds_and_models/optuna_search_mult_quant_reg.py:75: UserWarning: The distribution is specified by [0.1, 5] and step=0.25, but the range is not divisible by `step`. It will be replaced with [0.1, 4.85].
  error_threshold = trial.suggest_float("error_threshold", 0.1, 5, step=0.25)
[I 2026-07-21 09:42:45,591] Trial 142 finished with value: -0.0984475391915487 and parameters: {'error_threshold': 3.1, 'scalers': 'none', 'ratios': 'norm_ratio', 'imputers': 'mean', 'n_estimators': 1250, 'learning_rate': 0.038874299287036625, 'max_depth': 3, 'min_child_weight': 3, 'subsample': 0.8, 'colsample_bytree': 0.7, 'colsample_bylevel': 1.0, 'reg_alpha': 0.00038223094473207805, 'reg_lambda': 0.016434764986038266, 'gamma': 0.0001965421861079966}. Best is trial 109 with value: -0.09757409488906987.
/bsuhome/alexanderemert/Research/Star-Formation-Research-Project-2026/pipeline/scripts/optuna/final_preds_and_models/optuna_search_mult_quant_reg.py:75: UserWarning: The distribution is specified by [0.1, 5] and step=0.25, but the range is not divisible by `step`. It will be replaced with [0.1, 4.85].
  error_threshold = trial.suggest_float("error_threshold", 0.1, 5, step=0.25)
[I 2026-07-21 09:42:52,666] Trial 143 finished with value: -0.09872022316692364 and parameters: {'error_threshold': 3.1, 'scalers': 'none', 'ratios': 'norm_ratio', 'imputers': 'mean', 'n_estimators': 1200, 'learning_rate': 0.04286033843360795, 'max_depth': 3, 'min_child_weight': 3, 'subsample': 0.8, 'colsample_bytree': 0.7, 'colsample_bylevel': 1.0, 'reg_alpha': 0.0003556902633476482, 'reg_lambda': 0.039587693233152185, 'gamma': 3.248293090598172e-05}. Best is trial 109 with value: -0.09757409488906987.
/bsuhome/alexanderemert/Research/Star-Formation-Research-Project-2026/pipeline/scripts/optuna/final_preds_and_models/optuna_search_mult_quant_reg.py:75: UserWarning: The distribution is specified by [0.1, 5] and step=0.25, but the range is not divisible by `step`. It will be replaced with [0.1, 4.85].
  error_threshold = trial.suggest_float("error_threshold", 0.1, 5, step=0.25)
