[I 2026-07-20 11:09:20,273] Trial 84 finished with value: -0.4098032161476886 and parameters: {'error_threshold': 3.581784118536765, 'scalers': 'standard', 'ratios': 'log_ratio', 'imputers': 'mean', 'n_estimators': 1950, 'learning_rate': 0.36389090548852904, 'max_depth': 8, 'min_child_weight': 1, 'subsample': 0.5, 'colsample_bytree': 0.7, 'colsample_bylevel': 0.8, 'reg_alpha': 1.9789779874274884, 'reg_lambda': 76.75764683513513, 'gamma': 0.0016126571536734526}. Best is trial 83 with value: -0.4352718686197284.
[I 2026-07-20 11:10:03,440] Trial 85 finished with value: -0.3636471321410022 and parameters: {'error_threshold': 3.67472885813145, 'scalers': 'standard', 'ratios': 'log_ratio', 'imputers': 'mean', 'n_estimators': 1950, 'learning_rate': 0.35582211017910903, 'max_depth': 8, 'min_child_weight': 1, 'subsample': 0.5, 'colsample_bytree': 0.9, 'colsample_bylevel': 0.8, 'reg_alpha': 2.5111507410473384, 'reg_lambda': 66.79386936836453, 'gamma': 0.0019718327730518528}. Best is trial 83 with value: -0.4352718686197284.
[I 2026-07-20 11:10:04,121] Trial 86 finished with value: -0.18704370965683362 and parameters: {'error_threshold': 3.674091010815339, 'scalers': 'standard', 'ratios': 'norm_ratio', 'imputers': 'mean', 'n_estimators': 2250, 'learning_rate': 0.3686424598638107, 'max_depth': 8, 'min_child_weight': 1, 'subsample': 0.5, 'colsample_bytree': 0.9, 'colsample_bylevel': 0.6, 'reg_alpha': 2.286779242590026, 'reg_lambda': 4.629597241313555, 'gamma': 0.5272960375592067}. Best is trial 83 with value: -0.4352718686197284.
[I 2026-07-20 11:10:48,410] Trial 87 finished with value: -0.31822792179582143 and parameters: {'error_threshold': 3.620205727063328, 'scalers': 'standard', 'ratios': 'norm_ratio', 'imputers': 'mean', 'n_estimators': 2500, 'learning_rate': 0.34662951341006004, 'max_depth': 8, 'min_child_weight': 1, 'subsample': 0.5, 'colsample_bytree': 0.9, 'colsample_bylevel': 0.8, 'reg_alpha': 1.9319657306249338, 'reg_lambda': 90.47582048205115, 'gamma': 0.009656425982952039}. Best is trial 83 with value: -0.4352718686197284.
[I 2026-07-20 11:10:54,633] Trial 88 finished with value: -0.3733247537945803 and parameters: {'error_threshold': 3.992032595719552, 'scalers': 'standard', 'ratios': 'log_ratio', 'imputers': 'mean', 'n_estimators': 2150, 'learning_rate': 0.49852695244685835, 'max_depth': 8, 'min_child_weight': 1, 'subsample': 0.5, 'colsample_bytree': 0.9, 'colsample_bylevel': 0.8, 'reg_alpha': 2.2871522432113647, 'reg_lambda': 79.59819663626234, 'gamma': 0.010753347170347564}. Best is trial 83 with value: -0.4352718686197284.
[I 2026-07-20 11:11:18,788] Trial 89 finished with value: -0.2720122514385952 and parameters: {'error_threshold': 4.827954948909068, 'scalers': 'standard', 'ratios': 'log_ratio', 'imputers': 'none', 'n_estimators': 2750, 'learning_rate': 0.28562322624862, 'max_depth': 8, 'min_child_weight': 5, 'subsample': 0.5, 'colsample_bytree': 0.9, 'colsample_bylevel': 0.8, 'reg_alpha': 2.0460807081017345, 'reg_lambda': 2.931536722742406, 'gamma': 0.01776109717215927}. Best is trial 83 with value: -0.4352718686197284.
[I 2026-07-20 11:13:18,991] Trial 90 finished with value: -0.4715152138462349 and parameters: {'error_threshold': 3.7792566510553796, 'scalers': 'standard', 'ratios': 'log_ratio', 'imputers': 'none', 'n_estimators': 2350, 'learning_rate': 0.49356020374713894, 'max_depth': 8, 'min_child_weight': 2, 'subsample': 0.5, 'colsample_bytree': 0.9, 'colsample_bylevel': 0.6, 'reg_alpha': 2.0566107534697355, 'reg_lambda': 2.411506395362511, 'gamma': 0.0008117540321235184}. Best is trial 90 with value: -0.4715152138462349.
[I 2026-07-20 11:13:23,854] Trial 92 finished with value: -0.3338945107997504 and parameters: {'error_threshold': 3.7481136286321997, 'scalers': 'standard', 'ratios': 'norm_ratio', 'imputers': 'mean', 'n_estimators': 2100, 'learning_rate': 0.4367633480742373, 'max_depth': 8, 'min_child_weight': 1, 'subsample': 0.5, 'colsample_bytree': 0.9, 'colsample_bylevel': 0.6, 'reg_alpha': 2.3356610197325054, 'reg_lambda': 95.75867816552477, 'gamma': 0.009896398910008495}. Best is trial 90 with value: -0.4715152138462349.
[I 2026-07-20 11:13:31,705] Trial 91 finished with value: -0.5991553216558785 and parameters: {'error_threshold': 4.035571378072515, 'scalers': 'standard', 'ratios': 'log_ratio', 'imputers': 'mean', 'n_estimators': 2300, 'learning_rate': 0.4907024352827025, 'max_depth': 8, 'min_child_weight': 1, 'subsample': 0.5, 'colsample_bytree': 0.9, 'colsample_bylevel': 0.8, 'reg_alpha': 2.2677054554354985, 'reg_lambda': 3.0174617709496125, 'gamma': 0.010343860503722694}. Best is trial 91 with value: -0.5991553216558785.
[I 2026-07-20 11:14:15,450] Trial 93 finished with value: -0.3457416340388601 and parameters: {'error_threshold': 3.7321686351326373, 'scalers': 'standard', 'ratios': 'norm_ratio', 'imputers': 'mean', 'n_estimators': 2200, 'learning_rate': 0.2312123130797689, 'max_depth': 8, 'min_child_weight': 1, 'subsample': 0.5, 'colsample_bytree': 0.9, 'colsample_bylevel': 0.8, 'reg_alpha': 2.263106013610788, 'reg_lambda': 5.925802726030783, 'gamma': 0.0008327457753618638}. Best is trial 91 with value: -0.5991553216558785.
[I 2026-07-20 11:14:46,847] Trial 94 finished with value: -1.1681551353554707 and parameters: {'error_threshold': 3.4883576619962864, 'scalers': 'standard', 'ratios': 'log_ratio', 'imputers': 'mean', 'n_estimators': 2100, 'learning_rate': 0.4842952152585242, 'max_depth': 8, 'min_child_weight': 1, 'subsample': 0.5, 'colsample_bytree': 0.9, 'colsample_bylevel': 0.8, 'reg_alpha': 0.5511962336935212, 'reg_lambda': 51.95528936283253, 'gamma': 0.0012391581779771191}. Best is trial 94 with value: -1.1681551353554707.
[I 2026-07-20 11:15:19,799] Trial 95 finished with value: -0.3705693432782808 and parameters: {'error_threshold': 3.5309822981301116, 'scalers': 'standard', 'ratios': 'norm_ratio', 'imputers': 'mean', 'n_estimators': 2600, 'learning_rate': 0.47570681774185203, 'max_depth': 7, 'min_child_weight': 1, 'subsample': 0.5, 'colsample_bytree': 0.9, 'colsample_bylevel': 0.8, 'reg_alpha': 2.031106755500094, 'reg_lambda': 60.08551774924933, 'gamma': 0.010216083134459443}. Best is trial 94 with value: -1.1681551353554707.
[I 2026-07-20 11:15:27,446] Trial 96 finished with value: -0.3939571304657534 and parameters: {'error_threshold': 3.807545002976879, 'scalers': 'standard', 'ratios': 'norm_ratio', 'imputers': 'mean', 'n_estimators': 2650, 'learning_rate': 0.48780648046339586, 'max_depth': 8, 'min_child_weight': 1, 'subsample': 0.5, 'colsample_bytree': 0.9, 'colsample_bylevel': 0.8, 'reg_alpha': 2.203015193354458, 'reg_lambda': 67.62117611519436, 'gamma': 0.011913735450874853}. Best is trial 94 with value: -1.1681551353554707.
[I 2026-07-20 11:15:45,958] Trial 97 finished with value: -0.7493418411945806 and parameters: {'error_threshold': 3.78703687396375, 'scalers': 'standard', 'ratios': 'norm_ratio', 'imputers': 'mean', 'n_estimators': 2500, 'learning_rate': 0.4950678249341603, 'max_depth': 8, 'min_child_weight': 1, 'subsample': 0.5, 'colsample_bytree': 0.9, 'colsample_bylevel': 0.8, 'reg_alpha': 1.915976532606222, 'reg_lambda': 97.90255775381169, 'gamma': 0.0009603777307514209}. Best is trial 94 with value: -1.1681551353554707.
[I 2026-07-20 11:18:07,835] Trial 99 finished with value: -0.4295861436132642 and parameters: {'error_threshold': 3.780582035295971, 'scalers': 'standard', 'ratios': 'norm_ratio', 'imputers': 'mean', 'n_estimators': 2150, 'learning_rate': 0.4912574973568634, 'max_depth': 8, 'min_child_weight': 2, 'subsample': 0.5, 'colsample_bytree': 0.9, 'colsample_bylevel': 0.8, 'reg_alpha': 2.8377212897901045, 'reg_lambda': 42.537801864190236, 'gamma': 0.001249356211348032}. Best is trial 94 with value: -1.1681551353554707.
[I 2026-07-20 11:18:18,268] Trial 98 finished with value: -0.8770321493596357 and parameters: {'error_threshold': 3.8830266130308333, 'scalers': 'standard', 'ratios': 'norm_ratio', 'imputers': 'mean', 'n_estimators': 2600, 'learning_rate': 0.49165172629644815, 'max_depth': 8, 'min_child_weight': 1, 'subsample': 0.5, 'colsample_bytree': 0.9, 'colsample_bylevel': 0.8, 'reg_alpha': 1.7035152673153373, 'reg_lambda': 53.75795020638841, 'gamma': 0.0011225268873690263}. Best is trial 94 with value: -1.1681551353554707.
[I 2026-07-20 11:18:41,695] Trial 100 finished with value: -0.5574413049666375 and parameters: {'error_threshold': 3.9819481587250625, 'scalers': 'standard', 'ratios': 'log_ratio', 'imputers': 'mean', 'n_estimators': 2150, 'learning_rate': 0.49733422966153673, 'max_depth': 8, 'min_child_weight': 2, 'subsample': 0.5, 'colsample_bytree': 0.9, 'colsample_bylevel': 0.8, 'reg_alpha': 0.5461884459540634, 'reg_lambda': 50.60544971136804, 'gamma': 0.0009665962647799017}. Best is trial 94 with value: -1.1681551353554707.
[I 2026-07-20 11:19:11,933] Trial 101 finished with value: -0.5386059454337928 and parameters: {'error_threshold': 3.84378573211287, 'scalers': 'standard', 'ratios': 'norm_ratio', 'imputers': 'mean', 'n_estimators': 2150, 'learning_rate': 0.4754505305735493, 'max_depth': 8, 'min_child_weight': 2, 'subsample': 0.5, 'colsample_bytree': 0.9, 'colsample_bylevel': 0.8, 'reg_alpha': 0.5887073036576238, 'reg_lambda': 51.644885392206966, 'gamma': 0.0009553106595743633}. Best is trial 94 with value: -1.1681551353554707.
[I 2026-07-20 11:19:45,091] Trial 102 finished with value: -0.5885830698066701 and parameters: {'error_threshold': 3.852694986046135, 'scalers': 'standard', 'ratios': 'log_ratio', 'imputers': 'mean', 'n_estimators': 2450, 'learning_rate': 0.4999360092792618, 'max_depth': 8, 'min_child_weight': 2, 'subsample': 0.5, 'colsample_bytree': 0.9, 'colsample_bylevel': 0.8, 'reg_alpha': 0.4574451163049959, 'reg_lambda': 52.76591374318386, 'gamma': 0.0022580960718010393}. Best is trial 94 with value: -1.1681551353554707.
[I 2026-07-20 11:20:05,205] Trial 103 finished with value: -0.44683444472536055 and parameters: {'error_threshold': 3.851434268939739, 'scalers': 'standard', 'ratios': 'norm_ratio', 'imputers': 'mean', 'n_estimators': 2400, 'learning_rate': 0.48192885733111146, 'max_depth': 7, 'min_child_weight': 2, 'subsample': 0.5, 'colsample_bytree': 0.9, 'colsample_bylevel': 0.8, 'reg_alpha': 0.607643600127016, 'reg_lambda': 47.43840601089241, 'gamma': 0.006781226109875484}. Best is trial 94 with value: -1.1681551353554707.
[I 2026-07-20 11:20:30,240] Trial 104 finished with value: -0.5408322457329617 and parameters: {'error_threshold': 3.468724687218829, 'scalers': 'standard', 'ratios': 'norm_ratio', 'imputers': 'mean', 'n_estimators': 2500, 'learning_rate': 0.4841932978728743, 'max_depth': 8, 'min_child_weight': 2, 'subsample': 0.5, 'colsample_bytree': 0.9, 'colsample_bylevel': 0.8, 'reg_alpha': 0.7068429543662077, 'reg_lambda': 46.509466630753764, 'gamma': 0.0015616013123636568}. Best is trial 94 with value: -1.1681551353554707.
[I 2026-07-20 11:20:52,016] Trial 105 finished with value: -0.3347823844324282 and parameters: {'error_threshold': 2.9896273983897124, 'scalers': 'standard', 'ratios': 'log_ratio', 'imputers': 'mean', 'n_estimators': 2400, 'learning_rate': 0.22424453699021538, 'max_depth': 8, 'min_child_weight': 2, 'subsample': 0.5, 'colsample_bytree': 1.0, 'colsample_bylevel': 0.8, 'reg_alpha': 0.6225875742626108, 'reg_lambda': 56.45425759374582, 'gamma': 0.0006232407276877694}. Best is trial 94 with value: -1.1681551353554707.
[I 2026-07-20 11:22:17,349] Trial 107 finished with value: -0.17483902634922385 and parameters: {'error_threshold': 3.846455476351211, 'scalers': 'standard', 'ratios': 'norm_ratio', 'imputers': 'mean', 'n_estimators': 2350, 'learning_rate': 0.22959503117044774, 'max_depth': 9, 'min_child_weight': 2, 'subsample': 0.5, 'colsample_bytree': 1.0, 'colsample_bylevel': 0.8, 'reg_alpha': 32.00669966182136, 'reg_lambda': 35.99925042294737, 'gamma': 0.000660793961368751}. Best is trial 94 with value: -1.1681551353554707.
slurmstepd: error: *** JOB 3103395 ON cpu109 CANCELLED AT 2026-07-20T11:22:35 ***
