[I 2026-07-20 15:13:50,089] Trial 212 finished with value: -7.774355314214094 and parameters: {'error_threshold': 4.35, 'scalers': 'none', 'ratios': 'log_ratio', 'imputers': 'none', 'n_estimators': 1850, 'learning_rate': 0.006160248542396711, 'max_depth': 4, 'min_child_weight': 8, 'subsample': 0.5, 'colsample_bytree': 1.0, 'colsample_bylevel': 0.5, 'reg_alpha': 44.373049400751455, 'reg_lambda': 0.018682079600619763, 'gamma': 2.3502045066314614e-06}. Best is trial 82 with value: -7.731843858789701.
/bsuhome/alexanderemert/Research/Star-Formation-Research-Project-2026/pipeline/scripts/optuna/final_preds_and_models/optuna_search_mult_quant_reg.py:161: UserWarning: The distribution is specified by [0.1, 5] and step=0.25, but the range is not divisible by `step`. It will be replaced with [0.1, 4.85].
  error_threshold = trial.suggest_float("error_threshold", 0.1, 5, step=0.25)
[I 2026-07-20 15:13:52,129] Trial 213 finished with value: -7.779298692411793 and parameters: {'error_threshold': 4.35, 'scalers': 'none', 'ratios': 'log_ratio', 'imputers': 'none', 'n_estimators': 1850, 'learning_rate': 0.006324291265547427, 'max_depth': 4, 'min_child_weight': 7, 'subsample': 0.5, 'colsample_bytree': 1.0, 'colsample_bylevel': 0.5, 'reg_alpha': 33.830984066404646, 'reg_lambda': 0.014142685547659005, 'gamma': 2.2043282013833967e-06}. Best is trial 82 with value: -7.731843858789701.
/bsuhome/alexanderemert/Research/Star-Formation-Research-Project-2026/pipeline/scripts/optuna/final_preds_and_models/optuna_search_mult_quant_reg.py:161: UserWarning: The distribution is specified by [0.1, 5] and step=0.25, but the range is not divisible by `step`. It will be replaced with [0.1, 4.85].
  error_threshold = trial.suggest_float("error_threshold", 0.1, 5, step=0.25)
[I 2026-07-20 15:13:54,182] Trial 214 finished with value: -7.763213553076848 and parameters: {'error_threshold': 4.35, 'scalers': 'none', 'ratios': 'log_ratio', 'imputers': 'none', 'n_estimators': 1850, 'learning_rate': 0.0048500295504692575, 'max_depth': 4, 'min_child_weight': 7, 'subsample': 0.5, 'colsample_bytree': 1.0, 'colsample_bylevel': 0.5, 'reg_alpha': 38.7340970592878, 'reg_lambda': 0.006297148550564796, 'gamma': 2.439992118999212e-06}. Best is trial 82 with value: -7.731843858789701.
/bsuhome/alexanderemert/Research/Star-Formation-Research-Project-2026/pipeline/scripts/optuna/final_preds_and_models/optuna_search_mult_quant_reg.py:161: UserWarning: The distribution is specified by [0.1, 5] and step=0.25, but the range is not divisible by `step`. It will be replaced with [0.1, 4.85].
  error_threshold = trial.suggest_float("error_threshold", 0.1, 5, step=0.25)
[I 2026-07-20 15:13:56,191] Trial 215 finished with value: -7.760684247286555 and parameters: {'error_threshold': 4.6, 'scalers': 'none', 'ratios': 'log_ratio', 'imputers': 'none', 'n_estimators': 1850, 'learning_rate': 0.004985013849929299, 'max_depth': 4, 'min_child_weight': 7, 'subsample': 0.5, 'colsample_bytree': 1.0, 'colsample_bylevel': 0.5, 'reg_alpha': 35.51130058078098, 'reg_lambda': 0.006459976571019748, 'gamma': 1.9626962212301456e-06}. Best is trial 82 with value: -7.731843858789701.
/bsuhome/alexanderemert/Research/Star-Formation-Research-Project-2026/pipeline/scripts/optuna/final_preds_and_models/optuna_search_mult_quant_reg.py:161: UserWarning: The distribution is specified by [0.1, 5] and step=0.25, but the range is not divisible by `step`. It will be replaced with [0.1, 4.85].
  error_threshold = trial.suggest_float("error_threshold", 0.1, 5, step=0.25)
[I 2026-07-20 15:13:58,277] Trial 216 finished with value: -7.755785202910697 and parameters: {'error_threshold': 4.35, 'scalers': 'none', 'ratios': 'log_ratio', 'imputers': 'none', 'n_estimators': 1900, 'learning_rate': 0.004471578476907535, 'max_depth': 4, 'min_child_weight': 9, 'subsample': 0.5, 'colsample_bytree': 1.0, 'colsample_bylevel': 0.5, 'reg_alpha': 43.551689654336855, 'reg_lambda': 0.006472605719138952, 'gamma': 2.2914221615983466e-06}. Best is trial 82 with value: -7.731843858789701.
/bsuhome/alexanderemert/Research/Star-Formation-Research-Project-2026/pipeline/scripts/optuna/final_preds_and_models/optuna_search_mult_quant_reg.py:161: UserWarning: The distribution is specified by [0.1, 5] and step=0.25, but the range is not divisible by `step`. It will be replaced with [0.1, 4.85].
  error_threshold = trial.suggest_float("error_threshold", 0.1, 5, step=0.25)
[I 2026-07-20 15:14:00,306] Trial 217 finished with value: -7.761263242098699 and parameters: {'error_threshold': 4.35, 'scalers': 'none', 'ratios': 'log_ratio', 'imputers': 'none', 'n_estimators': 1850, 'learning_rate': 0.004902797557658941, 'max_depth': 4, 'min_child_weight': 7, 'subsample': 0.5, 'colsample_bytree': 1.0, 'colsample_bylevel': 0.5, 'reg_alpha': 31.188073390742236, 'reg_lambda': 0.006677070506390227, 'gamma': 2.2165735810174504e-06}. Best is trial 82 with value: -7.731843858789701.
/bsuhome/alexanderemert/Research/Star-Formation-Research-Project-2026/pipeline/scripts/optuna/final_preds_and_models/optuna_search_mult_quant_reg.py:161: UserWarning: The distribution is specified by [0.1, 5] and step=0.25, but the range is not divisible by `step`. It will be replaced with [0.1, 4.85].
  error_threshold = trial.suggest_float("error_threshold", 0.1, 5, step=0.25)
[I 2026-07-20 15:14:02,311] Trial 218 finished with value: -7.765812304093282 and parameters: {'error_threshold': 4.35, 'scalers': 'none', 'ratios': 'log_ratio', 'imputers': 'none', 'n_estimators': 1800, 'learning_rate': 0.006035068267380713, 'max_depth': 4, 'min_child_weight': 9, 'subsample': 0.5, 'colsample_bytree': 1.0, 'colsample_bylevel': 0.5, 'reg_alpha': 65.8510103031092, 'reg_lambda': 0.007588818255765729, 'gamma': 2.436350814154191e-06}. Best is trial 82 with value: -7.731843858789701.
/bsuhome/alexanderemert/Research/Star-Formation-Research-Project-2026/pipeline/scripts/optuna/final_preds_and_models/optuna_search_mult_quant_reg.py:161: UserWarning: The distribution is specified by [0.1, 5] and step=0.25, but the range is not divisible by `step`. It will be replaced with [0.1, 4.85].
  error_threshold = trial.suggest_float("error_threshold", 0.1, 5, step=0.25)
[I 2026-07-20 15:14:04,190] Trial 219 finished with value: -7.75893382994424 and parameters: {'error_threshold': 4.35, 'scalers': 'none', 'ratios': 'log_ratio', 'imputers': 'none', 'n_estimators': 1700, 'learning_rate': 0.00422783856228805, 'max_depth': 4, 'min_child_weight': 7, 'subsample': 0.5, 'colsample_bytree': 1.0, 'colsample_bylevel': 0.5, 'reg_alpha': 75.82603165985886, 'reg_lambda': 0.007235606297637361, 'gamma': 4.37663024635732e-06}. Best is trial 82 with value: -7.731843858789701.
/bsuhome/alexanderemert/Research/Star-Formation-Research-Project-2026/pipeline/scripts/optuna/final_preds_and_models/optuna_search_mult_quant_reg.py:161: UserWarning: The distribution is specified by [0.1, 5] and step=0.25, but the range is not divisible by `step`. It will be replaced with [0.1, 4.85].
  error_threshold = trial.suggest_float("error_threshold", 0.1, 5, step=0.25)
[I 2026-07-20 15:14:06,009] Trial 220 finished with value: -7.74851949262834 and parameters: {'error_threshold': 4.35, 'scalers': 'none', 'ratios': 'log_ratio', 'imputers': 'none', 'n_estimators': 1700, 'learning_rate': 0.004433998901542713, 'max_depth': 4, 'min_child_weight': 8, 'subsample': 0.5, 'colsample_bytree': 1.0, 'colsample_bylevel': 0.5, 'reg_alpha': 28.240207048564805, 'reg_lambda': 0.006728616325906352, 'gamma': 4.038423525835944e-06}. Best is trial 82 with value: -7.731843858789701.
/bsuhome/alexanderemert/Research/Star-Formation-Research-Project-2026/pipeline/scripts/optuna/final_preds_and_models/optuna_search_mult_quant_reg.py:161: UserWarning: The distribution is specified by [0.1, 5] and step=0.25, but the range is not divisible by `step`. It will be replaced with [0.1, 4.85].
  error_threshold = trial.suggest_float("error_threshold", 0.1, 5, step=0.25)
[I 2026-07-20 15:14:07,905] Trial 221 finished with value: -7.751437977263155 and parameters: {'error_threshold': 4.35, 'scalers': 'none', 'ratios': 'log_ratio', 'imputers': 'none', 'n_estimators': 1750, 'learning_rate': 0.004648001333115054, 'max_depth': 4, 'min_child_weight': 8, 'subsample': 0.5, 'colsample_bytree': 1.0, 'colsample_bylevel': 0.5, 'reg_alpha': 26.137951824882343, 'reg_lambda': 0.006087324360848944, 'gamma': 3.859620365681754e-06}. Best is trial 82 with value: -7.731843858789701.
/bsuhome/alexanderemert/Research/Star-Formation-Research-Project-2026/pipeline/scripts/optuna/final_preds_and_models/optuna_search_mult_quant_reg.py:161: UserWarning: The distribution is specified by [0.1, 5] and step=0.25, but the range is not divisible by `step`. It will be replaced with [0.1, 4.85].
  error_threshold = trial.suggest_float("error_threshold", 0.1, 5, step=0.25)
[I 2026-07-20 15:14:09,954] Trial 222 finished with value: -7.750689047622548 and parameters: {'error_threshold': 4.35, 'scalers': 'none', 'ratios': 'log_ratio', 'imputers': 'none', 'n_estimators': 1900, 'learning_rate': 0.004376197251969252, 'max_depth': 4, 'min_child_weight': 8, 'subsample': 0.5, 'colsample_bytree': 1.0, 'colsample_bylevel': 0.5, 'reg_alpha': 24.499888324855597, 'reg_lambda': 0.007326407815479999, 'gamma': 4.031756825074154e-06}. Best is trial 82 with value: -7.731843858789701.
/bsuhome/alexanderemert/Research/Star-Formation-Research-Project-2026/pipeline/scripts/optuna/final_preds_and_models/optuna_search_mult_quant_reg.py:161: UserWarning: The distribution is specified by [0.1, 5] and step=0.25, but the range is not divisible by `step`. It will be replaced with [0.1, 4.85].
  error_threshold = trial.suggest_float("error_threshold", 0.1, 5, step=0.25)
[I 2026-07-20 15:14:11,800] Trial 223 finished with value: -7.736717338958283 and parameters: {'error_threshold': 4.35, 'scalers': 'none', 'ratios': 'log_ratio', 'imputers': 'none', 'n_estimators': 1700, 'learning_rate': 0.003928625489710579, 'max_depth': 4, 'min_child_weight': 8, 'subsample': 0.5, 'colsample_bytree': 1.0, 'colsample_bylevel': 0.5, 'reg_alpha': 23.52684199270893, 'reg_lambda': 0.035816793237042385, 'gamma': 4.178111766537427e-06}. Best is trial 82 with value: -7.731843858789701.
/bsuhome/alexanderemert/Research/Star-Formation-Research-Project-2026/pipeline/scripts/optuna/final_preds_and_models/optuna_search_mult_quant_reg.py:161: UserWarning: The distribution is specified by [0.1, 5] and step=0.25, but the range is not divisible by `step`. It will be replaced with [0.1, 4.85].
  error_threshold = trial.suggest_float("error_threshold", 0.1, 5, step=0.25)
[I 2026-07-20 15:14:13,763] Trial 224 finished with value: -7.753070785369885 and parameters: {'error_threshold': 4.6, 'scalers': 'none', 'ratios': 'log_ratio', 'imputers': 'none', 'n_estimators': 1750, 'learning_rate': 0.00360075192500195, 'max_depth': 4, 'min_child_weight': 8, 'subsample': 0.5, 'colsample_bytree': 1.0, 'colsample_bylevel': 0.5, 'reg_alpha': 76.48475313963164, 'reg_lambda': 0.01071382219345355, 'gamma': 3.654134531942646e-06}. Best is trial 82 with value: -7.731843858789701.
/bsuhome/alexanderemert/Research/Star-Formation-Research-Project-2026/pipeline/scripts/optuna/final_preds_and_models/optuna_search_mult_quant_reg.py:161: UserWarning: The distribution is specified by [0.1, 5] and step=0.25, but the range is not divisible by `step`. It will be replaced with [0.1, 4.85].
  error_threshold = trial.suggest_float("error_threshold", 0.1, 5, step=0.25)
[I 2026-07-20 15:14:15,748] Trial 225 finished with value: -7.756051569808155 and parameters: {'error_threshold': 4.6, 'scalers': 'none', 'ratios': 'log_ratio', 'imputers': 'none', 'n_estimators': 1750, 'learning_rate': 0.0038868515105265925, 'max_depth': 4, 'min_child_weight': 8, 'subsample': 0.5, 'colsample_bytree': 1.0, 'colsample_bylevel': 0.5, 'reg_alpha': 72.8791490643774, 'reg_lambda': 0.03600825430477819, 'gamma': 5.009081878321803e-06}. Best is trial 82 with value: -7.731843858789701.
/bsuhome/alexanderemert/Research/Star-Formation-Research-Project-2026/pipeline/scripts/optuna/final_preds_and_models/optuna_search_mult_quant_reg.py:161: UserWarning: The distribution is specified by [0.1, 5] and step=0.25, but the range is not divisible by `step`. It will be replaced with [0.1, 4.85].
  error_threshold = trial.suggest_float("error_threshold", 0.1, 5, step=0.25)
[I 2026-07-20 15:14:17,624] Trial 226 finished with value: -7.73651011207032 and parameters: {'error_threshold': 4.6, 'scalers': 'none', 'ratios': 'log_ratio', 'imputers': 'none', 'n_estimators': 1750, 'learning_rate': 0.003606923145857092, 'max_depth': 4, 'min_child_weight': 8, 'subsample': 0.5, 'colsample_bytree': 1.0, 'colsample_bylevel': 0.5, 'reg_alpha': 17.56389053149228, 'reg_lambda': 0.010028027307604754, 'gamma': 4.442642251593542e-06}. Best is trial 82 with value: -7.731843858789701.
/bsuhome/alexanderemert/Research/Star-Formation-Research-Project-2026/pipeline/scripts/optuna/final_preds_and_models/optuna_search_mult_quant_reg.py:161: UserWarning: The distribution is specified by [0.1, 5] and step=0.25, but the range is not divisible by `step`. It will be replaced with [0.1, 4.85].
  error_threshold = trial.suggest_float("error_threshold", 0.1, 5, step=0.25)
[I 2026-07-20 15:14:19,747] Trial 227 finished with value: -7.736653860550803 and parameters: {'error_threshold': 4.6, 'scalers': 'none', 'ratios': 'log_ratio', 'imputers': 'none', 'n_estimators': 2000, 'learning_rate': 0.0035209470235986187, 'max_depth': 4, 'min_child_weight': 8, 'subsample': 0.5, 'colsample_bytree': 1.0, 'colsample_bylevel': 0.5, 'reg_alpha': 18.396933276985138, 'reg_lambda': 0.04631248336253472, 'gamma': 4.111388820459487e-06}. Best is trial 82 with value: -7.731843858789701.
/bsuhome/alexanderemert/Research/Star-Formation-Research-Project-2026/pipeline/scripts/optuna/final_preds_and_models/optuna_search_mult_quant_reg.py:161: UserWarning: The distribution is specified by [0.1, 5] and step=0.25, but the range is not divisible by `step`. It will be replaced with [0.1, 4.85].
  error_threshold = trial.suggest_float("error_threshold", 0.1, 5, step=0.25)
[I 2026-07-20 15:14:21,857] Trial 228 finished with value: -7.738461058182087 and parameters: {'error_threshold': 4.6, 'scalers': 'none', 'ratios': 'log_ratio', 'imputers': 'none', 'n_estimators': 2000, 'learning_rate': 0.0035711504268382825, 'max_depth': 4, 'min_child_weight': 9, 'subsample': 0.5, 'colsample_bytree': 1.0, 'colsample_bylevel': 0.5, 'reg_alpha': 17.425267198734115, 'reg_lambda': 0.03822078279267829, 'gamma': 3.602214675794267e-06}. Best is trial 82 with value: -7.731843858789701.
/bsuhome/alexanderemert/Research/Star-Formation-Research-Project-2026/pipeline/scripts/optuna/final_preds_and_models/optuna_search_mult_quant_reg.py:161: UserWarning: The distribution is specified by [0.1, 5] and step=0.25, but the range is not divisible by `step`. It will be replaced with [0.1, 4.85].
  error_threshold = trial.suggest_float("error_threshold", 0.1, 5, step=0.25)
[I 2026-07-20 15:14:23,969] Trial 229 finished with value: -7.733984044312193 and parameters: {'error_threshold': 4.6, 'scalers': 'none', 'ratios': 'log_ratio', 'imputers': 'none', 'n_estimators': 2000, 'learning_rate': 0.0035026494921160493, 'max_depth': 4, 'min_child_weight': 9, 'subsample': 0.5, 'colsample_bytree': 1.0, 'colsample_bylevel': 0.5, 'reg_alpha': 16.940197881842142, 'reg_lambda': 0.03467965209185606, 'gamma': 1.636092023508566e-06}. Best is trial 82 with value: -7.731843858789701.
/bsuhome/alexanderemert/Research/Star-Formation-Research-Project-2026/pipeline/scripts/optuna/final_preds_and_models/optuna_search_mult_quant_reg.py:161: UserWarning: The distribution is specified by [0.1, 5] and step=0.25, but the range is not divisible by `step`. It will be replaced with [0.1, 4.85].
  error_threshold = trial.suggest_float("error_threshold", 0.1, 5, step=0.25)
[I 2026-07-20 15:14:26,061] Trial 230 finished with value: -7.734765717196879 and parameters: {'error_threshold': 4.6, 'scalers': 'none', 'ratios': 'log_ratio', 'imputers': 'none', 'n_estimators': 2000, 'learning_rate': 0.003457642097568928, 'max_depth': 4, 'min_child_weight': 9, 'subsample': 0.5, 'colsample_bytree': 1.0, 'colsample_bylevel': 0.5, 'reg_alpha': 15.821120927334517, 'reg_lambda': 0.0341870673553002, 'gamma': 1.9178783931617077e-06}. Best is trial 82 with value: -7.731843858789701.
/bsuhome/alexanderemert/Research/Star-Formation-Research-Project-2026/pipeline/scripts/optuna/final_preds_and_models/optuna_search_mult_quant_reg.py:161: UserWarning: The distribution is specified by [0.1, 5] and step=0.25, but the range is not divisible by `step`. It will be replaced with [0.1, 4.85].
  error_threshold = trial.suggest_float("error_threshold", 0.1, 5, step=0.25)
[I 2026-07-20 15:14:28,187] Trial 231 finished with value: -7.7370825963451 and parameters: {'error_threshold': 4.6, 'scalers': 'none', 'ratios': 'log_ratio', 'imputers': 'none', 'n_estimators': 2000, 'learning_rate': 0.0033047461631213002, 'max_depth': 4, 'min_child_weight': 8, 'subsample': 0.5, 'colsample_bytree': 1.0, 'colsample_bylevel': 0.5, 'reg_alpha': 16.85628412094734, 'reg_lambda': 0.02862186642260568, 'gamma': 3.2889276649773133e-06}. Best is trial 82 with value: -7.731843858789701.
/bsuhome/alexanderemert/Research/Star-Formation-Research-Project-2026/pipeline/scripts/optuna/final_preds_and_models/optuna_search_mult_quant_reg.py:161: UserWarning: The distribution is specified by [0.1, 5] and step=0.25, but the range is not divisible by `step`. It will be replaced with [0.1, 4.85].
  error_threshold = trial.suggest_float("error_threshold", 0.1, 5, step=0.25)
[I 2026-07-20 15:14:30,384] Trial 232 finished with value: -7.735403760701787 and parameters: {'error_threshold': 4.6, 'scalers': 'none', 'ratios': 'log_ratio', 'imputers': 'none', 'n_estimators': 2000, 'learning_rate': 0.0033790828561635357, 'max_depth': 4, 'min_child_weight': 9, 'subsample': 0.5, 'colsample_bytree': 1.0, 'colsample_bylevel': 0.5, 'reg_alpha': 16.64449906152452, 'reg_lambda': 0.03835866706390126, 'gamma': 1.8647759191273344e-06}. Best is trial 82 with value: -7.731843858789701.
[I 2026-07-20 15:14:32,369] Trial 233 finished with value: -7.735959127802709 and parameters: {'error_threshold': 4.6, 'scalers': 'none', 'ratios': 'log_ratio', 'imputers': 'none', 'n_estimators': 2000, 'learning_rate': 0.003313324376151871, 'max_depth': 4, 'min_child_weight': 9, 'subsample': 0.5, 'colsample_bytree': 1.0, 'colsample_bylevel': 0.5, 'reg_alpha': 17.18961862145813, 'reg_lambda': 0.03487253323704952, 'gamma': 1.8006797787160786e-06}. Best is trial 82 with value: -7.731843858789701.
[I 2026-07-20 15:14:34,438] Trial 234 finished with value: -7.733833155061327 and parameters: {'error_threshold': 4.6, 'scalers': 'none', 'ratios': 'log_ratio', 'imputers': 'none', 'n_estimators': 2000, 'learning_rate': 0.003184809462411177, 'max_depth': 4, 'min_child_weight': 9, 'subsample': 0.5, 'colsample_bytree': 1.0, 'colsample_bylevel': 0.5, 'reg_alpha': 15.111587105374943, 'reg_lambda': 0.012797654018552415, 'gamma': 1.7339731253736576e-06}. Best is trial 82 with value: -7.731843858789701.
[I 2026-07-20 15:14:36,559] Trial 235 finished with value: -7.733763791192071 and parameters: {'error_threshold': 4.6, 'scalers': 'none', 'ratios': 'log_ratio', 'imputers': 'none', 'n_estimators': 2050, 'learning_rate': 0.0029667682551691604, 'max_depth': 4, 'min_child_weight': 9, 'subsample': 0.5, 'colsample_bytree': 1.0, 'colsample_bylevel': 0.5, 'reg_alpha': 13.727232208838345, 'reg_lambda': 0.012832280525753257, 'gamma': 1.8350631338001363e-06}. Best is trial 82 with value: -7.731843858789701.
[I 2026-07-20 15:14:38,655] Trial 236 finished with value: -7.7353285139895585 and parameters: {'error_threshold': 4.6, 'scalers': 'none', 'ratios': 'log_ratio', 'imputers': 'none', 'n_estimators': 2050, 'learning_rate': 0.002977508534574871, 'max_depth': 4, 'min_child_weight': 9, 'subsample': 0.5, 'colsample_bytree': 1.0, 'colsample_bylevel': 0.5, 'reg_alpha': 11.950699225092038, 'reg_lambda': 0.011122288746849757, 'gamma': 1.8261179826752957e-06}. Best is trial 82 with value: -7.731843858789701.
[I 2026-07-20 15:14:40,763] Trial 237 finished with value: -7.740954087222151 and parameters: {'error_threshold': 0.85, 'scalers': 'none', 'ratios': 'log_ratio', 'imputers': 'none', 'n_estimators': 2050, 'learning_rate': 0.0028788495151840826, 'max_depth': 4, 'min_child_weight': 9, 'subsample': 0.5, 'colsample_bytree': 1.0, 'colsample_bylevel': 0.5, 'reg_alpha': 11.50365204458803, 'reg_lambda': 0.01209780377733087, 'gamma': 1.7184139701400044e-06}. Best is trial 82 with value: -7.731843858789701.
[I 2026-07-20 15:14:42,862] Trial 238 finished with value: -7.733418958400953 and parameters: {'error_threshold': 4.6, 'scalers': 'none', 'ratios': 'log_ratio', 'imputers': 'none', 'n_estimators': 2050, 'learning_rate': 0.0029536633647839483, 'max_depth': 4, 'min_child_weight': 9, 'subsample': 0.5, 'colsample_bytree': 1.0, 'colsample_bylevel': 0.5, 'reg_alpha': 13.555195698462889, 'reg_lambda': 0.027826785570978833, 'gamma': 1.7855396001409276e-06}. Best is trial 82 with value: -7.731843858789701.
[I 2026-07-20 15:14:44,932] Trial 239 finished with value: -7.734112708568266 and parameters: {'error_threshold': 4.6, 'scalers': 'none', 'ratios': 'log_ratio', 'imputers': 'none', 'n_estimators': 2050, 'learning_rate': 0.002935955622295645, 'max_depth': 4, 'min_child_weight': 9, 'subsample': 0.5, 'colsample_bytree': 1.0, 'colsample_bylevel': 0.5, 'reg_alpha': 11.40490141330328, 'reg_lambda': 0.09890482514725506, 'gamma': 1.7641801769766458e-06}. Best is trial 82 with value: -7.731843858789701.
