[I 2026-07-21 09:44:55,516] Trial 168 finished with value: -0.09828187635792125 and parameters: {'error_threshold': 2.6, 'scalers': 'standard', 'ratios': 'norm_ratio', 'imputers': 'mean', 'n_estimators': 1300, 'learning_rate': 0.02910011307558953, 'max_depth': 3, 'min_child_weight': 4, 'subsample': 0.8, 'colsample_bytree': 0.7, 'colsample_bylevel': 1.0, 'reg_alpha': 0.0010269603089324607, 'reg_lambda': 0.007661982036142891, 'gamma': 0.0005088063804565627}. Best is trial 109 with value: -0.09757409488906987.
/bsuhome/alexanderemert/Research/Star-Formation-Research-Project-2026/pipeline/scripts/optuna/final_preds_and_models/optuna_search_mult_quant_reg.py:75: UserWarning: The distribution is specified by [0.1, 5] and step=0.25, but the range is not divisible by `step`. It will be replaced with [0.1, 4.85].
  error_threshold = trial.suggest_float("error_threshold", 0.1, 5, step=0.25)
[I 2026-07-21 09:45:01,623] Trial 169 finished with value: -0.09809393651092897 and parameters: {'error_threshold': 3.6, 'scalers': 'none', 'ratios': 'norm_ratio', 'imputers': 'mean', 'n_estimators': 1300, 'learning_rate': 0.029792883847510724, 'max_depth': 3, 'min_child_weight': 4, 'subsample': 0.8, 'colsample_bytree': 0.7, 'colsample_bylevel': 1.0, 'reg_alpha': 4.2392420610437786e-05, 'reg_lambda': 0.0025082279190244082, 'gamma': 2.6285975556784613e-05}. Best is trial 109 with value: -0.09757409488906987.
/bsuhome/alexanderemert/Research/Star-Formation-Research-Project-2026/pipeline/scripts/optuna/final_preds_and_models/optuna_search_mult_quant_reg.py:75: UserWarning: The distribution is specified by [0.1, 5] and step=0.25, but the range is not divisible by `step`. It will be replaced with [0.1, 4.85].
  error_threshold = trial.suggest_float("error_threshold", 0.1, 5, step=0.25)
[I 2026-07-21 09:45:03,082] Trial 170 finished with value: -0.09788976110792519 and parameters: {'error_threshold': 2.6, 'scalers': 'none', 'ratios': 'norm_ratio', 'imputers': 'median', 'n_estimators': 1300, 'learning_rate': 0.02947050361433138, 'max_depth': 3, 'min_child_weight': 4, 'subsample': 0.8, 'colsample_bytree': 0.7, 'colsample_bylevel': 1.0, 'reg_alpha': 5.5969142186619784e-05, 'reg_lambda': 0.007174834231193971, 'gamma': 0.0005618188923399581}. Best is trial 109 with value: -0.09757409488906987.
/bsuhome/alexanderemert/Research/Star-Formation-Research-Project-2026/pipeline/scripts/optuna/final_preds_and_models/optuna_search_mult_quant_reg.py:75: UserWarning: The distribution is specified by [0.1, 5] and step=0.25, but the range is not divisible by `step`. It will be replaced with [0.1, 4.85].
  error_threshold = trial.suggest_float("error_threshold", 0.1, 5, step=0.25)
[I 2026-07-21 09:45:04,545] Trial 171 finished with value: -0.09823044236366331 and parameters: {'error_threshold': 2.6, 'scalers': 'none', 'ratios': 'norm_ratio', 'imputers': 'median', 'n_estimators': 1300, 'learning_rate': 0.027421100603895625, 'max_depth': 3, 'min_child_weight': 5, 'subsample': 0.8, 'colsample_bytree': 0.7, 'colsample_bylevel': 1.0, 'reg_alpha': 0.0010281539233616063, 'reg_lambda': 0.002223281902110211, 'gamma': 2.659371140718651e-05}. Best is trial 109 with value: -0.09757409488906987.
/bsuhome/alexanderemert/Research/Star-Formation-Research-Project-2026/pipeline/scripts/optuna/final_preds_and_models/optuna_search_mult_quant_reg.py:75: UserWarning: The distribution is specified by [0.1, 5] and step=0.25, but the range is not divisible by `step`. It will be replaced with [0.1, 4.85].
  error_threshold = trial.suggest_float("error_threshold", 0.1, 5, step=0.25)
[I 2026-07-21 09:45:08,897] Trial 172 finished with value: -0.09827875325809023 and parameters: {'error_threshold': 2.6, 'scalers': 'none', 'ratios': 'norm_ratio', 'imputers': 'median', 'n_estimators': 1250, 'learning_rate': 0.02844038664832396, 'max_depth': 3, 'min_child_weight': 5, 'subsample': 0.8, 'colsample_bytree': 0.7, 'colsample_bylevel': 1.0, 'reg_alpha': 0.0010321197543462358, 'reg_lambda': 0.008022669821686933, 'gamma': 2.456610222408268e-05}. Best is trial 109 with value: -0.09757409488906987.
/bsuhome/alexanderemert/Research/Star-Formation-Research-Project-2026/pipeline/scripts/optuna/final_preds_and_models/optuna_search_mult_quant_reg.py:75: UserWarning: The distribution is specified by [0.1, 5] and step=0.25, but the range is not divisible by `step`. It will be replaced with [0.1, 4.85].
  error_threshold = trial.suggest_float("error_threshold", 0.1, 5, step=0.25)
[I 2026-07-21 09:45:10,364] Trial 173 finished with value: -0.09826625699445625 and parameters: {'error_threshold': 2.6, 'scalers': 'none', 'ratios': 'norm_ratio', 'imputers': 'median', 'n_estimators': 1300, 'learning_rate': 0.02851381566750626, 'max_depth': 3, 'min_child_weight': 4, 'subsample': 0.8, 'colsample_bytree': 0.7, 'colsample_bylevel': 1.0, 'reg_alpha': 0.0010330056754655262, 'reg_lambda': 0.007212642405569551, 'gamma': 0.0005342920441663719}. Best is trial 109 with value: -0.09757409488906987.
/bsuhome/alexanderemert/Research/Star-Formation-Research-Project-2026/pipeline/scripts/optuna/final_preds_and_models/optuna_search_mult_quant_reg.py:75: UserWarning: The distribution is specified by [0.1, 5] and step=0.25, but the range is not divisible by `step`. It will be replaced with [0.1, 4.85].
  error_threshold = trial.suggest_float("error_threshold", 0.1, 5, step=0.25)
[I 2026-07-21 09:45:23,665] Trial 174 finished with value: -0.09782742314921787 and parameters: {'error_threshold': 2.6, 'scalers': 'standard', 'ratios': 'norm_ratio', 'imputers': 'none', 'n_estimators': 1300, 'learning_rate': 0.025846153031567034, 'max_depth': 3, 'min_child_weight': 5, 'subsample': 0.8, 'colsample_bytree': 0.7, 'colsample_bylevel': 1.0, 'reg_alpha': 0.0019186576298362741, 'reg_lambda': 0.0057809343658300335, 'gamma': 0.0017884299629593028}. Best is trial 109 with value: -0.09757409488906987.
/bsuhome/alexanderemert/Research/Star-Formation-Research-Project-2026/pipeline/scripts/optuna/final_preds_and_models/optuna_search_mult_quant_reg.py:75: UserWarning: The distribution is specified by [0.1, 5] and step=0.25, but the range is not divisible by `step`. It will be replaced with [0.1, 4.85].
  error_threshold = trial.suggest_float("error_threshold", 0.1, 5, step=0.25)
[I 2026-07-21 09:45:29,701] Trial 175 finished with value: -0.098674259912874 and parameters: {'error_threshold': 2.6, 'scalers': 'standard', 'ratios': 'norm_ratio', 'imputers': 'median', 'n_estimators': 1300, 'learning_rate': 0.02751043367606631, 'max_depth': 3, 'min_child_weight': 5, 'subsample': 0.8, 'colsample_bytree': 0.7, 'colsample_bylevel': 1.0, 'reg_alpha': 0.0025941965686989057, 'reg_lambda': 0.007720183281996071, 'gamma': 0.00013572299581372134}. Best is trial 109 with value: -0.09757409488906987.
/bsuhome/alexanderemert/Research/Star-Formation-Research-Project-2026/pipeline/scripts/optuna/final_preds_and_models/optuna_search_mult_quant_reg.py:75: UserWarning: The distribution is specified by [0.1, 5] and step=0.25, but the range is not divisible by `step`. It will be replaced with [0.1, 4.85].
  error_threshold = trial.suggest_float("error_threshold", 0.1, 5, step=0.25)
[I 2026-07-21 09:45:31,117] Trial 176 finished with value: -0.09824745517667062 and parameters: {'error_threshold': 2.6, 'scalers': 'standard', 'ratios': 'norm_ratio', 'imputers': 'median', 'n_estimators': 1300, 'learning_rate': 0.027814051163270175, 'max_depth': 3, 'min_child_weight': 5, 'subsample': 0.8, 'colsample_bytree': 0.7, 'colsample_bylevel': 1.0, 'reg_alpha': 0.003403651678863225, 'reg_lambda': 0.007564682627548662, 'gamma': 0.0007809559868412519}. Best is trial 109 with value: -0.09757409488906987.
/bsuhome/alexanderemert/Research/Star-Formation-Research-Project-2026/pipeline/scripts/optuna/final_preds_and_models/optuna_search_mult_quant_reg.py:75: UserWarning: The distribution is specified by [0.1, 5] and step=0.25, but the range is not divisible by `step`. It will be replaced with [0.1, 4.85].
  error_threshold = trial.suggest_float("error_threshold", 0.1, 5, step=0.25)
[I 2026-07-21 09:45:36,969] Trial 177 finished with value: -0.09824711030962292 and parameters: {'error_threshold': 2.6, 'scalers': 'standard', 'ratios': 'norm_ratio', 'imputers': 'median', 'n_estimators': 1300, 'learning_rate': 0.027397852448501257, 'max_depth': 3, 'min_child_weight': 5, 'subsample': 0.8, 'colsample_bytree': 0.7, 'colsample_bylevel': 1.0, 'reg_alpha': 0.002807136931922465, 'reg_lambda': 0.007354637164116174, 'gamma': 0.001806820780657743}. Best is trial 109 with value: -0.09757409488906987.
/bsuhome/alexanderemert/Research/Star-Formation-Research-Project-2026/pipeline/scripts/optuna/final_preds_and_models/optuna_search_mult_quant_reg.py:75: UserWarning: The distribution is specified by [0.1, 5] and step=0.25, but the range is not divisible by `step`. It will be replaced with [0.1, 4.85].
  error_threshold = trial.suggest_float("error_threshold", 0.1, 5, step=0.25)
[I 2026-07-21 09:45:38,387] Trial 178 finished with value: -0.09848917638283135 and parameters: {'error_threshold': 2.6, 'scalers': 'standard', 'ratios': 'norm_ratio', 'imputers': 'median', 'n_estimators': 1300, 'learning_rate': 0.02758467767958444, 'max_depth': 3, 'min_child_weight': 5, 'subsample': 0.8, 'colsample_bytree': 0.7, 'colsample_bylevel': 1.0, 'reg_alpha': 1.1666604911748882e-05, 'reg_lambda': 0.007364333425618512, 'gamma': 0.0006054345032231864}. Best is trial 109 with value: -0.09757409488906987.
/bsuhome/alexanderemert/Research/Star-Formation-Research-Project-2026/pipeline/scripts/optuna/final_preds_and_models/optuna_search_mult_quant_reg.py:75: UserWarning: The distribution is specified by [0.1, 5] and step=0.25, but the range is not divisible by `step`. It will be replaced with [0.1, 4.85].
  error_threshold = trial.suggest_float("error_threshold", 0.1, 5, step=0.25)
[I 2026-07-21 09:45:39,823] Trial 179 finished with value: -0.0982286490655133 and parameters: {'error_threshold': 2.6, 'scalers': 'standard', 'ratios': 'norm_ratio', 'imputers': 'median', 'n_estimators': 1300, 'learning_rate': 0.027108936118642478, 'max_depth': 3, 'min_child_weight': 5, 'subsample': 0.8, 'colsample_bytree': 0.7, 'colsample_bylevel': 1.0, 'reg_alpha': 0.0019650954787373684, 'reg_lambda': 0.008233277640036726, 'gamma': 0.0008269107724828788}. Best is trial 109 with value: -0.09757409488906987.
/bsuhome/alexanderemert/Research/Star-Formation-Research-Project-2026/pipeline/scripts/optuna/final_preds_and_models/optuna_search_mult_quant_reg.py:75: UserWarning: The distribution is specified by [0.1, 5] and step=0.25, but the range is not divisible by `step`. It will be replaced with [0.1, 4.85].
  error_threshold = trial.suggest_float("error_threshold", 0.1, 5, step=0.25)
[I 2026-07-21 09:45:44,094] Trial 180 finished with value: -0.09776014298602916 and parameters: {'error_threshold': 2.6, 'scalers': 'standard', 'ratios': 'norm_ratio', 'imputers': 'median', 'n_estimators': 1300, 'learning_rate': 0.02623405389121891, 'max_depth': 3, 'min_child_weight': 5, 'subsample': 0.8, 'colsample_bytree': 0.7, 'colsample_bylevel': 1.0, 'reg_alpha': 0.0020692187315109827, 'reg_lambda': 0.007464224819876606, 'gamma': 0.0017482841983569365}. Best is trial 109 with value: -0.09757409488906987.
/bsuhome/alexanderemert/Research/Star-Formation-Research-Project-2026/pipeline/scripts/optuna/final_preds_and_models/optuna_search_mult_quant_reg.py:75: UserWarning: The distribution is specified by [0.1, 5] and step=0.25, but the range is not divisible by `step`. It will be replaced with [0.1, 4.85].
  error_threshold = trial.suggest_float("error_threshold", 0.1, 5, step=0.25)
[I 2026-07-21 09:45:45,488] Trial 181 finished with value: -0.09810830395188753 and parameters: {'error_threshold': 2.6, 'scalers': 'standard', 'ratios': 'norm_ratio', 'imputers': 'median', 'n_estimators': 1250, 'learning_rate': 0.027096276648413645, 'max_depth': 3, 'min_child_weight': 5, 'subsample': 0.8, 'colsample_bytree': 0.7, 'colsample_bylevel': 1.0, 'reg_alpha': 0.002049488778104407, 'reg_lambda': 0.006689925526968219, 'gamma': 0.002069720320482181}. Best is trial 109 with value: -0.09757409488906987.
/bsuhome/alexanderemert/Research/Star-Formation-Research-Project-2026/pipeline/scripts/optuna/final_preds_and_models/optuna_search_mult_quant_reg.py:75: UserWarning: The distribution is specified by [0.1, 5] and step=0.25, but the range is not divisible by `step`. It will be replaced with [0.1, 4.85].
  error_threshold = trial.suggest_float("error_threshold", 0.1, 5, step=0.25)
[I 2026-07-21 09:45:58,402] Trial 182 finished with value: -0.09805550575253809 and parameters: {'error_threshold': 2.35, 'scalers': 'standard', 'ratios': 'norm_ratio', 'imputers': 'median', 'n_estimators': 1250, 'learning_rate': 0.028601712538063068, 'max_depth': 3, 'min_child_weight': 5, 'subsample': 0.8, 'colsample_bytree': 0.7, 'colsample_bylevel': 1.0, 'reg_alpha': 0.0031894427104197506, 'reg_lambda': 0.006750993659913575, 'gamma': 0.001369503360829457}. Best is trial 109 with value: -0.09757409488906987.
/bsuhome/alexanderemert/Research/Star-Formation-Research-Project-2026/pipeline/scripts/optuna/final_preds_and_models/optuna_search_mult_quant_reg.py:75: UserWarning: The distribution is specified by [0.1, 5] and step=0.25, but the range is not divisible by `step`. It will be replaced with [0.1, 4.85].
  error_threshold = trial.suggest_float("error_threshold", 0.1, 5, step=0.25)
[I 2026-07-21 09:46:04,229] Trial 183 finished with value: -0.09785481267582634 and parameters: {'error_threshold': 2.35, 'scalers': 'standard', 'ratios': 'norm_ratio', 'imputers': 'median', 'n_estimators': 1250, 'learning_rate': 0.025846574467365803, 'max_depth': 3, 'min_child_weight': 5, 'subsample': 0.8, 'colsample_bytree': 0.7, 'colsample_bylevel': 1.0, 'reg_alpha': 0.0019661216987459477, 'reg_lambda': 0.0018110557411971362, 'gamma': 0.00238977080719527}. Best is trial 109 with value: -0.09757409488906987.
/bsuhome/alexanderemert/Research/Star-Formation-Research-Project-2026/pipeline/scripts/optuna/final_preds_and_models/optuna_search_mult_quant_reg.py:75: UserWarning: The distribution is specified by [0.1, 5] and step=0.25, but the range is not divisible by `step`. It will be replaced with [0.1, 4.85].
  error_threshold = trial.suggest_float("error_threshold", 0.1, 5, step=0.25)
[I 2026-07-21 09:46:05,600] Trial 184 finished with value: -0.09837372390183137 and parameters: {'error_threshold': 2.35, 'scalers': 'standard', 'ratios': 'norm_ratio', 'imputers': 'median', 'n_estimators': 1250, 'learning_rate': 0.025371550239254557, 'max_depth': 3, 'min_child_weight': 5, 'subsample': 0.8, 'colsample_bytree': 0.7, 'colsample_bylevel': 1.0, 'reg_alpha': 0.0028622730318628897, 'reg_lambda': 0.00199497463088736, 'gamma': 0.001954565846867215}. Best is trial 109 with value: -0.09757409488906987.
/bsuhome/alexanderemert/Research/Star-Formation-Research-Project-2026/pipeline/scripts/optuna/final_preds_and_models/optuna_search_mult_quant_reg.py:75: UserWarning: The distribution is specified by [0.1, 5] and step=0.25, but the range is not divisible by `step`. It will be replaced with [0.1, 4.85].
  error_threshold = trial.suggest_float("error_threshold", 0.1, 5, step=0.25)
[I 2026-07-21 09:46:11,286] Trial 185 finished with value: -0.09836460690030302 and parameters: {'error_threshold': 2.35, 'scalers': 'standard', 'ratios': 'norm_ratio', 'imputers': 'median', 'n_estimators': 1250, 'learning_rate': 0.02320636836359078, 'max_depth': 3, 'min_child_weight': 5, 'subsample': 0.8, 'colsample_bytree': 0.7, 'colsample_bylevel': 1.0, 'reg_alpha': 0.002141109737150135, 'reg_lambda': 0.001933615361061904, 'gamma': 0.0017452035948291873}. Best is trial 109 with value: -0.09757409488906987.
/bsuhome/alexanderemert/Research/Star-Formation-Research-Project-2026/pipeline/scripts/optuna/final_preds_and_models/optuna_search_mult_quant_reg.py:75: UserWarning: The distribution is specified by [0.1, 5] and step=0.25, but the range is not divisible by `step`. It will be replaced with [0.1, 4.85].
  error_threshold = trial.suggest_float("error_threshold", 0.1, 5, step=0.25)
[I 2026-07-21 09:46:12,667] Trial 186 finished with value: -0.09840230089300224 and parameters: {'error_threshold': 2.35, 'scalers': 'standard', 'ratios': 'norm_ratio', 'imputers': 'median', 'n_estimators': 1250, 'learning_rate': 0.023397655806527855, 'max_depth': 3, 'min_child_weight': 5, 'subsample': 0.8, 'colsample_bytree': 0.7, 'colsample_bylevel': 1.0, 'reg_alpha': 0.0035521133507900836, 'reg_lambda': 0.0027309558863118687, 'gamma': 0.002259972679442363}. Best is trial 109 with value: -0.09757409488906987.
/bsuhome/alexanderemert/Research/Star-Formation-Research-Project-2026/pipeline/scripts/optuna/final_preds_and_models/optuna_search_mult_quant_reg.py:75: UserWarning: The distribution is specified by [0.1, 5] and step=0.25, but the range is not divisible by `step`. It will be replaced with [0.1, 4.85].
  error_threshold = trial.suggest_float("error_threshold", 0.1, 5, step=0.25)
[I 2026-07-21 09:46:14,033] Trial 187 finished with value: -0.09805320628566959 and parameters: {'error_threshold': 2.35, 'scalers': 'standard', 'ratios': 'norm_ratio', 'imputers': 'median', 'n_estimators': 1250, 'learning_rate': 0.022081204204504046, 'max_depth': 3, 'min_child_weight': 5, 'subsample': 0.8, 'colsample_bytree': 0.7, 'colsample_bylevel': 1.0, 'reg_alpha': 0.0034463315329970514, 'reg_lambda': 0.0018253958558305033, 'gamma': 0.0017306783247907451}. Best is trial 109 with value: -0.09757409488906987.
/bsuhome/alexanderemert/Research/Star-Formation-Research-Project-2026/pipeline/scripts/optuna/final_preds_and_models/optuna_search_mult_quant_reg.py:75: UserWarning: The distribution is specified by [0.1, 5] and step=0.25, but the range is not divisible by `step`. It will be replaced with [0.1, 4.85].
  error_threshold = trial.suggest_float("error_threshold", 0.1, 5, step=0.25)
[I 2026-07-21 09:46:18,012] Trial 188 finished with value: -0.09823503559454631 and parameters: {'error_threshold': 2.35, 'scalers': 'standard', 'ratios': 'norm_ratio', 'imputers': 'median', 'n_estimators': 1250, 'learning_rate': 0.022675711135048855, 'max_depth': 3, 'min_child_weight': 5, 'subsample': 0.8, 'colsample_bytree': 0.7, 'colsample_bylevel': 1.0, 'reg_alpha': 0.001865424609178487, 'reg_lambda': 0.0024197347592594316, 'gamma': 0.0020116869330906013}. Best is trial 109 with value: -0.09757409488906987.
/bsuhome/alexanderemert/Research/Star-Formation-Research-Project-2026/pipeline/scripts/optuna/final_preds_and_models/optuna_search_mult_quant_reg.py:75: UserWarning: The distribution is specified by [0.1, 5] and step=0.25, but the range is not divisible by `step`. It will be replaced with [0.1, 4.85].
  error_threshold = trial.suggest_float("error_threshold", 0.1, 5, step=0.25)
[I 2026-07-21 09:46:19,384] Trial 189 finished with value: -0.09789417266432411 and parameters: {'error_threshold': 2.35, 'scalers': 'standard', 'ratios': 'norm_ratio', 'imputers': 'median', 'n_estimators': 1250, 'learning_rate': 0.024688305832590175, 'max_depth': 3, 'min_child_weight': 5, 'subsample': 0.8, 'colsample_bytree': 0.7, 'colsample_bylevel': 1.0, 'reg_alpha': 0.002133154777015122, 'reg_lambda': 0.0016652772370983338, 'gamma': 0.0022813766824865975}. Best is trial 109 with value: -0.09757409488906987.
/bsuhome/alexanderemert/Research/Star-Formation-Research-Project-2026/pipeline/scripts/optuna/final_preds_and_models/optuna_search_mult_quant_reg.py:75: UserWarning: The distribution is specified by [0.1, 5] and step=0.25, but the range is not divisible by `step`. It will be replaced with [0.1, 4.85].
  error_threshold = trial.suggest_float("error_threshold", 0.1, 5, step=0.25)
[I 2026-07-21 09:46:31,636] Trial 190 finished with value: -0.09874283727989248 and parameters: {'error_threshold': 2.35, 'scalers': 'standard', 'ratios': 'norm_ratio', 'imputers': 'median', 'n_estimators': 1150, 'learning_rate': 0.022150401780395002, 'max_depth': 3, 'min_child_weight': 5, 'subsample': 0.8, 'colsample_bytree': 0.7, 'colsample_bylevel': 1.0, 'reg_alpha': 0.0018447132657879008, 'reg_lambda': 0.002323184860570386, 'gamma': 0.0018649727408441973}. Best is trial 109 with value: -0.09757409488906987.
/bsuhome/alexanderemert/Research/Star-Formation-Research-Project-2026/pipeline/scripts/optuna/final_preds_and_models/optuna_search_mult_quant_reg.py:75: UserWarning: The distribution is specified by [0.1, 5] and step=0.25, but the range is not divisible by `step`. It will be replaced with [0.1, 4.85].
  error_threshold = trial.suggest_float("error_threshold", 0.1, 5, step=0.25)
[I 2026-07-21 09:46:37,122] Trial 191 finished with value: -0.09879287921793845 and parameters: {'error_threshold': 2.35, 'scalers': 'standard', 'ratios': 'norm_ratio', 'imputers': 'median', 'n_estimators': 1150, 'learning_rate': 0.020430877945726733, 'max_depth': 3, 'min_child_weight': 5, 'subsample': 0.8, 'colsample_bytree': 0.7, 'colsample_bylevel': 1.0, 'reg_alpha': 0.00203390699466026, 'reg_lambda': 0.0016613065210539658, 'gamma': 0.002557732253278928}. Best is trial 109 with value: -0.09757409488906987.
/bsuhome/alexanderemert/Research/Star-Formation-Research-Project-2026/pipeline/scripts/optuna/final_preds_and_models/optuna_search_mult_quant_reg.py:75: UserWarning: The distribution is specified by [0.1, 5] and step=0.25, but the range is not divisible by `step`. It will be replaced with [0.1, 4.85].
  error_threshold = trial.suggest_float("error_threshold", 0.1, 5, step=0.25)
