[I 2026-07-20 14:49:35,886] Trial 51 finished with value: -0.358928762777815 and parameters: {'error_threshold': 2.6, 'scalers': 'standard', 'ratios': 'norm_ratio', 'imputers': 'none', 'n_estimators': 1950, 'learning_rate': 0.03312401281543772, 'max_depth': 4, 'min_child_weight': 4, 'subsample': 0.7, 'colsample_bytree': 0.7, 'colsample_bylevel': 0.5, 'reg_alpha': 0.10269119088665124, 'reg_lambda': 1.3799303258747174e-05, 'gamma': 0.041655732508382275}. Best is trial 38 with value: -0.34395661591836896.
/bsuhome/alexanderemert/Research/Star-Formation-Research-Project-2026/pipeline/scripts/optuna/final_preds_and_models/optuna_search_mult_quant_reg.py:161: UserWarning: The distribution is specified by [0.1, 5] and step=0.25, but the range is not divisible by `step`. It will be replaced with [0.1, 4.85].
  error_threshold = trial.suggest_float("error_threshold", 0.1, 5, step=0.25)
[I 2026-07-20 14:49:48,857] Trial 43 finished with value: -0.3616450893660695 and parameters: {'error_threshold': 3.1, 'scalers': 'robust', 'ratios': 'norm_ratio', 'imputers': 'mean', 'n_estimators': 1350, 'learning_rate': 0.002352045372592381, 'max_depth': 12, 'min_child_weight': 7, 'subsample': 0.7, 'colsample_bytree': 0.8, 'colsample_bylevel': 0.8, 'reg_alpha': 0.051678853786237156, 'reg_lambda': 0.0010271373887499966, 'gamma': 0.12314292376817963}. Best is trial 38 with value: -0.34395661591836896.
/bsuhome/alexanderemert/Research/Star-Formation-Research-Project-2026/pipeline/scripts/optuna/final_preds_and_models/optuna_search_mult_quant_reg.py:161: UserWarning: The distribution is specified by [0.1, 5] and step=0.25, but the range is not divisible by `step`. It will be replaced with [0.1, 4.85].
  error_threshold = trial.suggest_float("error_threshold", 0.1, 5, step=0.25)
[I 2026-07-20 14:49:49,553] Trial 53 finished with value: -0.34796988683600477 and parameters: {'error_threshold': 2.6, 'scalers': 'standard', 'ratios': 'norm_ratio', 'imputers': 'none', 'n_estimators': 1150, 'learning_rate': 0.03161811331102001, 'max_depth': 4, 'min_child_weight': 3, 'subsample': 0.7, 'colsample_bytree': 0.6, 'colsample_bylevel': 0.6, 'reg_alpha': 0.2405209025432704, 'reg_lambda': 2.525836652371497e-05, 'gamma': 0.21039407300736412}. Best is trial 38 with value: -0.34395661591836896.
/bsuhome/alexanderemert/Research/Star-Formation-Research-Project-2026/pipeline/scripts/optuna/final_preds_and_models/optuna_search_mult_quant_reg.py:161: UserWarning: The distribution is specified by [0.1, 5] and step=0.25, but the range is not divisible by `step`. It will be replaced with [0.1, 4.85].
  error_threshold = trial.suggest_float("error_threshold", 0.1, 5, step=0.25)
[I 2026-07-20 14:49:49,771] Trial 55 finished with value: -0.3467854545282374 and parameters: {'error_threshold': 3.35, 'scalers': 'standard', 'ratios': 'norm_ratio', 'imputers': 'none', 'n_estimators': 1150, 'learning_rate': 0.03797819468104734, 'max_depth': 4, 'min_child_weight': 3, 'subsample': 0.8, 'colsample_bytree': 0.6, 'colsample_bylevel': 0.6, 'reg_alpha': 0.27459635936859844, 'reg_lambda': 2.1659701639289326e-05, 'gamma': 0.8166526896984242}. Best is trial 38 with value: -0.34395661591836896.
/bsuhome/alexanderemert/Research/Star-Formation-Research-Project-2026/pipeline/scripts/optuna/final_preds_and_models/optuna_search_mult_quant_reg.py:161: UserWarning: The distribution is specified by [0.1, 5] and step=0.25, but the range is not divisible by `step`. It will be replaced with [0.1, 4.85].
  error_threshold = trial.suggest_float("error_threshold", 0.1, 5, step=0.25)
[I 2026-07-20 14:49:50,918] Trial 54 finished with value: -0.48270827381735776 and parameters: {'error_threshold': 3.35, 'scalers': 'standard', 'ratios': 'norm_ratio', 'imputers': 'none', 'n_estimators': 1150, 'learning_rate': 0.0013020350137157733, 'max_depth': 4, 'min_child_weight': 10, 'subsample': 0.7, 'colsample_bytree': 0.6, 'colsample_bylevel': 0.6, 'reg_alpha': 0.20731360657388898, 'reg_lambda': 2.377432559461707e-05, 'gamma': 0.034444847107182736}. Best is trial 38 with value: -0.34395661591836896.
/bsuhome/alexanderemert/Research/Star-Formation-Research-Project-2026/pipeline/scripts/optuna/final_preds_and_models/optuna_search_mult_quant_reg.py:161: UserWarning: The distribution is specified by [0.1, 5] and step=0.25, but the range is not divisible by `step`. It will be replaced with [0.1, 4.85].
  error_threshold = trial.suggest_float("error_threshold", 0.1, 5, step=0.25)
[I 2026-07-20 14:49:51,329] Trial 56 finished with value: -0.3479066580454928 and parameters: {'error_threshold': 3.35, 'scalers': 'standard', 'ratios': 'norm_ratio', 'imputers': 'none', 'n_estimators': 1150, 'learning_rate': 0.03696693968443643, 'max_depth': 4, 'min_child_weight': 4, 'subsample': 0.8, 'colsample_bytree': 0.6, 'colsample_bylevel': 0.6, 'reg_alpha': 0.243311291633265, 'reg_lambda': 3.6447229308590594e-05, 'gamma': 0.8392886115943554}. Best is trial 38 with value: -0.34395661591836896.
/bsuhome/alexanderemert/Research/Star-Formation-Research-Project-2026/pipeline/scripts/optuna/final_preds_and_models/optuna_search_mult_quant_reg.py:161: UserWarning: The distribution is specified by [0.1, 5] and step=0.25, but the range is not divisible by `step`. It will be replaced with [0.1, 4.85].
  error_threshold = trial.suggest_float("error_threshold", 0.1, 5, step=0.25)
[I 2026-07-20 14:49:51,784] Trial 57 finished with value: -0.34486416807656856 and parameters: {'error_threshold': 3.35, 'scalers': 'standard', 'ratios': 'norm_ratio', 'imputers': 'none', 'n_estimators': 1150, 'learning_rate': 0.026035443573436998, 'max_depth': 4, 'min_child_weight': 4, 'subsample': 0.8, 'colsample_bytree': 0.6, 'colsample_bylevel': 0.6, 'reg_alpha': 0.28205187360785805, 'reg_lambda': 2.2845700367898336e-05, 'gamma': 0.5447780658951922}. Best is trial 38 with value: -0.34395661591836896.
/bsuhome/alexanderemert/Research/Star-Formation-Research-Project-2026/pipeline/scripts/optuna/final_preds_and_models/optuna_search_mult_quant_reg.py:161: UserWarning: The distribution is specified by [0.1, 5] and step=0.25, but the range is not divisible by `step`. It will be replaced with [0.1, 4.85].
  error_threshold = trial.suggest_float("error_threshold", 0.1, 5, step=0.25)
[I 2026-07-20 14:49:52,018] Trial 58 finished with value: -0.3485900736087146 and parameters: {'error_threshold': 3.35, 'scalers': 'standard', 'ratios': 'norm_ratio', 'imputers': 'none', 'n_estimators': 850, 'learning_rate': 0.03485518386832029, 'max_depth': 4, 'min_child_weight': 10, 'subsample': 0.8, 'colsample_bytree': 0.6, 'colsample_bylevel': 0.6, 'reg_alpha': 0.21931565250497412, 'reg_lambda': 0.004603675073667412, 'gamma': 0.9979462241517826}. Best is trial 38 with value: -0.34395661591836896.
/bsuhome/alexanderemert/Research/Star-Formation-Research-Project-2026/pipeline/scripts/optuna/final_preds_and_models/optuna_search_mult_quant_reg.py:161: UserWarning: The distribution is specified by [0.1, 5] and step=0.25, but the range is not divisible by `step`. It will be replaced with [0.1, 4.85].
  error_threshold = trial.suggest_float("error_threshold", 0.1, 5, step=0.25)
[I 2026-07-20 14:49:53,230] Trial 59 finished with value: -0.36749461311031856 and parameters: {'error_threshold': 3.35, 'scalers': 'standard', 'ratios': 'norm_ratio', 'imputers': 'none', 'n_estimators': 1150, 'learning_rate': 0.003550860434548481, 'max_depth': 5, 'min_child_weight': 6, 'subsample': 0.9, 'colsample_bytree': 0.6, 'colsample_bylevel': 0.6, 'reg_alpha': 0.3409278690607794, 'reg_lambda': 0.004521828744808756, 'gamma': 0.9183867261861952}. Best is trial 38 with value: -0.34395661591836896.
/bsuhome/alexanderemert/Research/Star-Formation-Research-Project-2026/pipeline/scripts/optuna/final_preds_and_models/optuna_search_mult_quant_reg.py:161: UserWarning: The distribution is specified by [0.1, 5] and step=0.25, but the range is not divisible by `step`. It will be replaced with [0.1, 4.85].
  error_threshold = trial.suggest_float("error_threshold", 0.1, 5, step=0.25)
[I 2026-07-20 14:49:53,762] Trial 61 finished with value: -0.3469398843550548 and parameters: {'error_threshold': 3.35, 'scalers': 'standard', 'ratios': 'norm_ratio', 'imputers': 'none', 'n_estimators': 1150, 'learning_rate': 0.017063669712108206, 'max_depth': 5, 'min_child_weight': 6, 'subsample': 0.8, 'colsample_bytree': 0.6, 'colsample_bylevel': 0.6, 'reg_alpha': 1.2921428940863462, 'reg_lambda': 0.0037102536536001924, 'gamma': 0.9060013418130798}. Best is trial 38 with value: -0.34395661591836896.
/bsuhome/alexanderemert/Research/Star-Formation-Research-Project-2026/pipeline/scripts/optuna/final_preds_and_models/optuna_search_mult_quant_reg.py:161: UserWarning: The distribution is specified by [0.1, 5] and step=0.25, but the range is not divisible by `step`. It will be replaced with [0.1, 4.85].
  error_threshold = trial.suggest_float("error_threshold", 0.1, 5, step=0.25)
[I 2026-07-20 14:49:54,942] Trial 60 finished with value: -0.3779194411238242 and parameters: {'error_threshold': 3.35, 'scalers': 'standard', 'ratios': 'norm_ratio', 'imputers': 'none', 'n_estimators': 850, 'learning_rate': 0.0037340783446409, 'max_depth': 5, 'min_child_weight': 6, 'subsample': 0.8, 'colsample_bytree': 0.6, 'colsample_bylevel': 0.6, 'reg_alpha': 0.32398426643331124, 'reg_lambda': 0.004530735522300494, 'gamma': 0.466427516861234}. Best is trial 38 with value: -0.34395661591836896.
/bsuhome/alexanderemert/Research/Star-Formation-Research-Project-2026/pipeline/scripts/optuna/final_preds_and_models/optuna_search_mult_quant_reg.py:161: UserWarning: The distribution is specified by [0.1, 5] and step=0.25, but the range is not divisible by `step`. It will be replaced with [0.1, 4.85].
  error_threshold = trial.suggest_float("error_threshold", 0.1, 5, step=0.25)
[I 2026-07-20 14:49:56,062] Trial 62 finished with value: -0.5471426071897937 and parameters: {'error_threshold': 2.35, 'scalers': 'standard', 'ratios': 'norm_ratio', 'imputers': 'none', 'n_estimators': 850, 'learning_rate': 0.0011932886209421105, 'max_depth': 5, 'min_child_weight': 6, 'subsample': 0.8, 'colsample_bytree': 0.7, 'colsample_bylevel': 0.5, 'reg_alpha': 1.4375696947411758, 'reg_lambda': 0.3776009542127535, 'gamma': 0.8425281512618203}. Best is trial 38 with value: -0.34395661591836896.
/bsuhome/alexanderemert/Research/Star-Formation-Research-Project-2026/pipeline/scripts/optuna/final_preds_and_models/optuna_search_mult_quant_reg.py:161: UserWarning: The distribution is specified by [0.1, 5] and step=0.25, but the range is not divisible by `step`. It will be replaced with [0.1, 4.85].
  error_threshold = trial.suggest_float("error_threshold", 0.1, 5, step=0.25)
[I 2026-07-20 14:49:56,504] Trial 64 finished with value: -0.4380710514884744 and parameters: {'error_threshold': 2.35, 'scalers': 'standard', 'ratios': 'norm_ratio', 'imputers': 'none', 'n_estimators': 850, 'learning_rate': 0.004033417131026305, 'max_depth': 5, 'min_child_weight': 6, 'subsample': 0.8, 'colsample_bytree': 0.7, 'colsample_bylevel': 0.5, 'reg_alpha': 1.7835754251507032, 'reg_lambda': 0.0040118894757818655, 'gamma': 5.660436784011974}. Best is trial 38 with value: -0.34395661591836896.
/bsuhome/alexanderemert/Research/Star-Formation-Research-Project-2026/pipeline/scripts/optuna/final_preds_and_models/optuna_search_mult_quant_reg.py:161: UserWarning: The distribution is specified by [0.1, 5] and step=0.25, but the range is not divisible by `step`. It will be replaced with [0.1, 4.85].
  error_threshold = trial.suggest_float("error_threshold", 0.1, 5, step=0.25)
[I 2026-07-20 14:49:57,431] Trial 63 finished with value: -0.3904861843247702 and parameters: {'error_threshold': 2.35, 'scalers': 'standard', 'ratios': 'norm_ratio', 'imputers': 'none', 'n_estimators': 800, 'learning_rate': 0.0035875178165785324, 'max_depth': 5, 'min_child_weight': 6, 'subsample': 0.8, 'colsample_bytree': 0.7, 'colsample_bylevel': 0.5, 'reg_alpha': 1.2749390279137782, 'reg_lambda': 0.3922567617517591, 'gamma': 0.6081876480086531}. Best is trial 38 with value: -0.34395661591836896.
/bsuhome/alexanderemert/Research/Star-Formation-Research-Project-2026/pipeline/scripts/optuna/final_preds_and_models/optuna_search_mult_quant_reg.py:161: UserWarning: The distribution is specified by [0.1, 5] and step=0.25, but the range is not divisible by `step`. It will be replaced with [0.1, 4.85].
  error_threshold = trial.suggest_float("error_threshold", 0.1, 5, step=0.25)
[I 2026-07-20 14:49:57,841] Trial 65 finished with value: -0.3743376478726605 and parameters: {'error_threshold': 3.6, 'scalers': 'standard', 'ratios': 'norm_ratio', 'imputers': 'none', 'n_estimators': 1500, 'learning_rate': 0.017479037320972744, 'max_depth': 5, 'min_child_weight': 6, 'subsample': 0.9, 'colsample_bytree': 0.7, 'colsample_bylevel': 0.5, 'reg_alpha': 1.67257580332695, 'reg_lambda': 0.005418087963880087, 'gamma': 8.374142198049245}. Best is trial 38 with value: -0.34395661591836896.
/bsuhome/alexanderemert/Research/Star-Formation-Research-Project-2026/pipeline/scripts/optuna/final_preds_and_models/optuna_search_mult_quant_reg.py:161: UserWarning: The distribution is specified by [0.1, 5] and step=0.25, but the range is not divisible by `step`. It will be replaced with [0.1, 4.85].
  error_threshold = trial.suggest_float("error_threshold", 0.1, 5, step=0.25)
[I 2026-07-20 14:49:58,073] Trial 66 finished with value: -0.3716213733578062 and parameters: {'error_threshold': 3.85, 'scalers': 'standard', 'ratios': 'log_ratio', 'imputers': 'none', 'n_estimators': 800, 'learning_rate': 0.015957028381615515, 'max_depth': 5, 'min_child_weight': 6, 'subsample': 0.9, 'colsample_bytree': 0.5, 'colsample_bylevel': 0.5, 'reg_alpha': 1.89131801791968, 'reg_lambda': 0.05153025623674372, 'gamma': 5.3809503687721865}. Best is trial 38 with value: -0.34395661591836896.
/bsuhome/alexanderemert/Research/Star-Formation-Research-Project-2026/pipeline/scripts/optuna/final_preds_and_models/optuna_search_mult_quant_reg.py:161: UserWarning: The distribution is specified by [0.1, 5] and step=0.25, but the range is not divisible by `step`. It will be replaced with [0.1, 4.85].
  error_threshold = trial.suggest_float("error_threshold", 0.1, 5, step=0.25)
[I 2026-07-20 14:49:58,496] Trial 67 finished with value: -0.35985465594721794 and parameters: {'error_threshold': 2.35, 'scalers': 'standard', 'ratios': 'log_ratio', 'imputers': 'none', 'n_estimators': 1550, 'learning_rate': 0.016463265678909517, 'max_depth': 5, 'min_child_weight': 6, 'subsample': 0.8, 'colsample_bytree': 0.7, 'colsample_bylevel': 0.5, 'reg_alpha': 1.8368135595582298, 'reg_lambda': 0.040061387535093904, 'gamma': 3.8341021051503135}. Best is trial 38 with value: -0.34395661591836896.
/bsuhome/alexanderemert/Research/Star-Formation-Research-Project-2026/pipeline/scripts/optuna/final_preds_and_models/optuna_search_mult_quant_reg.py:161: UserWarning: The distribution is specified by [0.1, 5] and step=0.25, but the range is not divisible by `step`. It will be replaced with [0.1, 4.85].
  error_threshold = trial.suggest_float("error_threshold", 0.1, 5, step=0.25)
[I 2026-07-20 14:49:59,051] Trial 68 finished with value: -0.3454539407570733 and parameters: {'error_threshold': 2.35, 'scalers': 'standard', 'ratios': 'norm_ratio', 'imputers': 'none', 'n_estimators': 1500, 'learning_rate': 0.023160892526950617, 'max_depth': 3, 'min_child_weight': 10, 'subsample': 0.8, 'colsample_bytree': 0.5, 'colsample_bylevel': 0.7, 'reg_alpha': 1.1850808475956227, 'reg_lambda': 0.3877016107624404, 'gamma': 0.3527536410814916}. Best is trial 38 with value: -0.34395661591836896.
/bsuhome/alexanderemert/Research/Star-Formation-Research-Project-2026/pipeline/scripts/optuna/final_preds_and_models/optuna_search_mult_quant_reg.py:161: UserWarning: The distribution is specified by [0.1, 5] and step=0.25, but the range is not divisible by `step`. It will be replaced with [0.1, 4.85].
  error_threshold = trial.suggest_float("error_threshold", 0.1, 5, step=0.25)
[I 2026-07-20 14:49:59,433] Trial 69 finished with value: -0.3681683122299048 and parameters: {'error_threshold': 2.35, 'scalers': 'standard', 'ratios': 'norm_ratio', 'imputers': 'none', 'n_estimators': 1500, 'learning_rate': 0.021956618293237758, 'max_depth': 3, 'min_child_weight': 1, 'subsample': 0.9, 'colsample_bytree': 0.7, 'colsample_bylevel': 0.7, 'reg_alpha': 0.013880943429603824, 'reg_lambda': 0.3575440315369127, 'gamma': 7.063576233140713}. Best is trial 38 with value: -0.34395661591836896.
/bsuhome/alexanderemert/Research/Star-Formation-Research-Project-2026/pipeline/scripts/optuna/final_preds_and_models/optuna_search_mult_quant_reg.py:161: UserWarning: The distribution is specified by [0.1, 5] and step=0.25, but the range is not divisible by `step`. It will be replaced with [0.1, 4.85].
  error_threshold = trial.suggest_float("error_threshold", 0.1, 5, step=0.25)
[I 2026-07-20 14:50:00,302] Trial 70 finished with value: -0.3488392973154215 and parameters: {'error_threshold': 2.35, 'scalers': 'standard', 'ratios': 'log_ratio', 'imputers': 'none', 'n_estimators': 1550, 'learning_rate': 0.02160065919862979, 'max_depth': 3, 'min_child_weight': 1, 'subsample': 0.9, 'colsample_bytree': 0.5, 'colsample_bylevel': 0.7, 'reg_alpha': 0.010924981816721557, 'reg_lambda': 0.04278716024096104, 'gamma': 0.01662196507635418}. Best is trial 38 with value: -0.34395661591836896.
/bsuhome/alexanderemert/Research/Star-Formation-Research-Project-2026/pipeline/scripts/optuna/final_preds_and_models/optuna_search_mult_quant_reg.py:161: UserWarning: The distribution is specified by [0.1, 5] and step=0.25, but the range is not divisible by `step`. It will be replaced with [0.1, 4.85].
  error_threshold = trial.suggest_float("error_threshold", 0.1, 5, step=0.25)
[I 2026-07-20 14:50:01,139] Trial 71 finished with value: -0.3515002188790464 and parameters: {'error_threshold': 3.85, 'scalers': 'standard', 'ratios': 'log_ratio', 'imputers': 'none', 'n_estimators': 1500, 'learning_rate': 0.024010244339631264, 'max_depth': 3, 'min_child_weight': 10, 'subsample': 0.9, 'colsample_bytree': 0.5, 'colsample_bylevel': 0.7, 'reg_alpha': 0.015471377972847556, 'reg_lambda': 0.032871496356525295, 'gamma': 0.017689169231962277}. Best is trial 38 with value: -0.34395661591836896.
/bsuhome/alexanderemert/Research/Star-Formation-Research-Project-2026/pipeline/scripts/optuna/final_preds_and_models/optuna_search_mult_quant_reg.py:161: UserWarning: The distribution is specified by [0.1, 5] and step=0.25, but the range is not divisible by `step`. It will be replaced with [0.1, 4.85].
  error_threshold = trial.suggest_float("error_threshold", 0.1, 5, step=0.25)
[I 2026-07-20 14:50:01,827] Trial 72 finished with value: -0.3509504008159719 and parameters: {'error_threshold': 1.6, 'scalers': 'standard', 'ratios': 'log_ratio', 'imputers': 'none', 'n_estimators': 1500, 'learning_rate': 0.02300652928163226, 'max_depth': 3, 'min_child_weight': 10, 'subsample': 1.0, 'colsample_bytree': 0.5, 'colsample_bylevel': 0.5, 'reg_alpha': 0.012358922865127317, 'reg_lambda': 0.03735697564325598, 'gamma': 0.018030906413746047}. Best is trial 38 with value: -0.34395661591836896.
/bsuhome/alexanderemert/Research/Star-Formation-Research-Project-2026/pipeline/scripts/optuna/final_preds_and_models/optuna_search_mult_quant_reg.py:161: UserWarning: The distribution is specified by [0.1, 5] and step=0.25, but the range is not divisible by `step`. It will be replaced with [0.1, 4.85].
  error_threshold = trial.suggest_float("error_threshold", 0.1, 5, step=0.25)
[I 2026-07-20 14:50:02,424] Trial 73 finished with value: -0.3491223533179537 and parameters: {'error_threshold': 1.85, 'scalers': 'standard', 'ratios': 'log_ratio', 'imputers': 'none', 'n_estimators': 1000, 'learning_rate': 0.02647719074699232, 'max_depth': 3, 'min_child_weight': 10, 'subsample': 0.9, 'colsample_bytree': 0.5, 'colsample_bylevel': 0.7, 'reg_alpha': 0.013474535722347865, 'reg_lambda': 0.03770613953607151, 'gamma': 0.01674289877472251}. Best is trial 38 with value: -0.34395661591836896.
/bsuhome/alexanderemert/Research/Star-Formation-Research-Project-2026/pipeline/scripts/optuna/final_preds_and_models/optuna_search_mult_quant_reg.py:161: UserWarning: The distribution is specified by [0.1, 5] and step=0.25, but the range is not divisible by `step`. It will be replaced with [0.1, 4.85].
  error_threshold = trial.suggest_float("error_threshold", 0.1, 5, step=0.25)
[I 2026-07-20 14:50:02,990] Trial 74 finished with value: -0.3447365812193537 and parameters: {'error_threshold': 2.35, 'scalers': 'standard', 'ratios': 'log_ratio', 'imputers': 'none', 'n_estimators': 1000, 'learning_rate': 0.022602438010861627, 'max_depth': 3, 'min_child_weight': 1, 'subsample': 0.7, 'colsample_bytree': 0.5, 'colsample_bylevel': 0.7, 'reg_alpha': 0.01669314114982331, 'reg_lambda': 9.200033455792188e-05, 'gamma': 0.016397438864574336}. Best is trial 38 with value: -0.34395661591836896.
/bsuhome/alexanderemert/Research/Star-Formation-Research-Project-2026/pipeline/scripts/optuna/final_preds_and_models/optuna_search_mult_quant_reg.py:161: UserWarning: The distribution is specified by [0.1, 5] and step=0.25, but the range is not divisible by `step`. It will be replaced with [0.1, 4.85].
  error_threshold = trial.suggest_float("error_threshold", 0.1, 5, step=0.25)
