[I 2026-07-21 10:07:42,687] Trial 452 finished with value: -0.6138871891320011 and parameters: {'error_threshold': 4.6, 'scalers': 'robust', 'ratios': 'norm_ratio', 'imputers': 'mean', 'n_estimators': 2250, 'learning_rate': 0.009801948912403323, 'max_depth': 7, 'min_child_weight': 2, 'subsample': 0.6, 'colsample_bytree': 0.6, 'colsample_bylevel': 0.8, 'reg_alpha': 1.0013269232844474e-06, 'reg_lambda': 2.981581148162492e-06, 'gamma': 0.0005479554405827691}. Best is trial 424 with value: -0.5888711747749842.
/bsuhome/alexanderemert/Research/Star-Formation-Research-Project-2026/pipeline/scripts/optuna/final_preds_and_models/optuna_search_mult_quant_reg.py:161: UserWarning: The distribution is specified by [0.1, 5] and step=0.25, but the range is not divisible by `step`. It will be replaced with [0.1, 4.85].
  error_threshold = trial.suggest_float("error_threshold", 0.1, 5, step=0.25)
[I 2026-07-21 10:07:46,443] Trial 453 finished with value: -0.596279520016071 and parameters: {'error_threshold': 4.6, 'scalers': 'robust', 'ratios': 'norm_ratio', 'imputers': 'mean', 'n_estimators': 2300, 'learning_rate': 0.009626554080454972, 'max_depth': 5, 'min_child_weight': 2, 'subsample': 0.6, 'colsample_bytree': 0.6, 'colsample_bylevel': 0.8, 'reg_alpha': 2.9180497469996637e-06, 'reg_lambda': 3.1215993737507453e-06, 'gamma': 0.0005024914199562137}. Best is trial 424 with value: -0.5888711747749842.
/bsuhome/alexanderemert/Research/Star-Formation-Research-Project-2026/pipeline/scripts/optuna/final_preds_and_models/optuna_search_mult_quant_reg.py:161: UserWarning: The distribution is specified by [0.1, 5] and step=0.25, but the range is not divisible by `step`. It will be replaced with [0.1, 4.85].
  error_threshold = trial.suggest_float("error_threshold", 0.1, 5, step=0.25)
[I 2026-07-21 10:07:50,040] Trial 454 finished with value: -0.5962018607366434 and parameters: {'error_threshold': 4.6, 'scalers': 'robust', 'ratios': 'norm_ratio', 'imputers': 'mean', 'n_estimators': 2250, 'learning_rate': 0.009360633044169545, 'max_depth': 5, 'min_child_weight': 2, 'subsample': 0.6, 'colsample_bytree': 0.6, 'colsample_bylevel': 0.8, 'reg_alpha': 2.6466154413650456e-06, 'reg_lambda': 3.163656654304235e-06, 'gamma': 0.0004934675238396117}. Best is trial 424 with value: -0.5888711747749842.
/bsuhome/alexanderemert/Research/Star-Formation-Research-Project-2026/pipeline/scripts/optuna/final_preds_and_models/optuna_search_mult_quant_reg.py:161: UserWarning: The distribution is specified by [0.1, 5] and step=0.25, but the range is not divisible by `step`. It will be replaced with [0.1, 4.85].
  error_threshold = trial.suggest_float("error_threshold", 0.1, 5, step=0.25)
[I 2026-07-21 10:07:52,385] Trial 455 finished with value: -0.5907332488869935 and parameters: {'error_threshold': 4.6, 'scalers': 'robust', 'ratios': 'norm_ratio', 'imputers': 'mean', 'n_estimators': 2200, 'learning_rate': 0.0108817143039581, 'max_depth': 4, 'min_child_weight': 2, 'subsample': 0.6, 'colsample_bytree': 0.6, 'colsample_bylevel': 0.8, 'reg_alpha': 1.4031202520372133e-06, 'reg_lambda': 3.255336098890372e-06, 'gamma': 0.0004886269354893608}. Best is trial 424 with value: -0.5888711747749842.
/bsuhome/alexanderemert/Research/Star-Formation-Research-Project-2026/pipeline/scripts/optuna/final_preds_and_models/optuna_search_mult_quant_reg.py:161: UserWarning: The distribution is specified by [0.1, 5] and step=0.25, but the range is not divisible by `step`. It will be replaced with [0.1, 4.85].
  error_threshold = trial.suggest_float("error_threshold", 0.1, 5, step=0.25)
[I 2026-07-21 10:07:54,758] Trial 456 finished with value: -0.5923156751465102 and parameters: {'error_threshold': 4.6, 'scalers': 'robust', 'ratios': 'norm_ratio', 'imputers': 'mean', 'n_estimators': 2250, 'learning_rate': 0.011112321518556293, 'max_depth': 4, 'min_child_weight': 2, 'subsample': 0.6, 'colsample_bytree': 0.6, 'colsample_bylevel': 0.8, 'reg_alpha': 1.3327846388779663e-06, 'reg_lambda': 3.413053366752998e-06, 'gamma': 0.0005583837683438084}. Best is trial 424 with value: -0.5888711747749842.
/bsuhome/alexanderemert/Research/Star-Formation-Research-Project-2026/pipeline/scripts/optuna/final_preds_and_models/optuna_search_mult_quant_reg.py:161: UserWarning: The distribution is specified by [0.1, 5] and step=0.25, but the range is not divisible by `step`. It will be replaced with [0.1, 4.85].
  error_threshold = trial.suggest_float("error_threshold", 0.1, 5, step=0.25)
[I 2026-07-21 10:07:57,065] Trial 457 finished with value: -0.5906440777286793 and parameters: {'error_threshold': 4.6, 'scalers': 'robust', 'ratios': 'norm_ratio', 'imputers': 'mean', 'n_estimators': 2200, 'learning_rate': 0.010820881117231054, 'max_depth': 4, 'min_child_weight': 2, 'subsample': 0.5, 'colsample_bytree': 0.6, 'colsample_bylevel': 0.8, 'reg_alpha': 1.395408396865001e-06, 'reg_lambda': 3.379862101077463e-06, 'gamma': 0.0003927784081201743}. Best is trial 424 with value: -0.5888711747749842.
/bsuhome/alexanderemert/Research/Star-Formation-Research-Project-2026/pipeline/scripts/optuna/final_preds_and_models/optuna_search_mult_quant_reg.py:161: UserWarning: The distribution is specified by [0.1, 5] and step=0.25, but the range is not divisible by `step`. It will be replaced with [0.1, 4.85].
  error_threshold = trial.suggest_float("error_threshold", 0.1, 5, step=0.25)
[I 2026-07-21 10:07:59,436] Trial 458 finished with value: -0.5986477671039049 and parameters: {'error_threshold': 4.6, 'scalers': 'robust', 'ratios': 'norm_ratio', 'imputers': 'mean', 'n_estimators': 2200, 'learning_rate': 0.01707474623131737, 'max_depth': 4, 'min_child_weight': 2, 'subsample': 0.5, 'colsample_bytree': 0.6, 'colsample_bylevel': 0.8, 'reg_alpha': 1.1007973935225311e-06, 'reg_lambda': 3.102355953743026e-06, 'gamma': 0.0003513613341992648}. Best is trial 424 with value: -0.5888711747749842.
/bsuhome/alexanderemert/Research/Star-Formation-Research-Project-2026/pipeline/scripts/optuna/final_preds_and_models/optuna_search_mult_quant_reg.py:161: UserWarning: The distribution is specified by [0.1, 5] and step=0.25, but the range is not divisible by `step`. It will be replaced with [0.1, 4.85].
  error_threshold = trial.suggest_float("error_threshold", 0.1, 5, step=0.25)
[I 2026-07-21 10:08:01,800] Trial 459 finished with value: -0.590514049166938 and parameters: {'error_threshold': 4.85, 'scalers': 'robust', 'ratios': 'norm_ratio', 'imputers': 'mean', 'n_estimators': 2200, 'learning_rate': 0.010584388075646801, 'max_depth': 4, 'min_child_weight': 2, 'subsample': 0.6, 'colsample_bytree': 0.6, 'colsample_bylevel': 0.8, 'reg_alpha': 1.2274608696352026e-06, 'reg_lambda': 3.4669801802896816e-06, 'gamma': 0.0006004455589323251}. Best is trial 424 with value: -0.5888711747749842.
/bsuhome/alexanderemert/Research/Star-Formation-Research-Project-2026/pipeline/scripts/optuna/final_preds_and_models/optuna_search_mult_quant_reg.py:161: UserWarning: The distribution is specified by [0.1, 5] and step=0.25, but the range is not divisible by `step`. It will be replaced with [0.1, 4.85].
  error_threshold = trial.suggest_float("error_threshold", 0.1, 5, step=0.25)
[I 2026-07-21 10:08:04,079] Trial 460 finished with value: -0.5910271033247686 and parameters: {'error_threshold': 4.85, 'scalers': 'robust', 'ratios': 'norm_ratio', 'imputers': 'mean', 'n_estimators': 2100, 'learning_rate': 0.0109535069246288, 'max_depth': 4, 'min_child_weight': 2, 'subsample': 0.6, 'colsample_bytree': 0.6, 'colsample_bylevel': 0.8, 'reg_alpha': 1.4678692764644797e-06, 'reg_lambda': 1.978539064999936e-06, 'gamma': 0.0003296990109380791}. Best is trial 424 with value: -0.5888711747749842.
/bsuhome/alexanderemert/Research/Star-Formation-Research-Project-2026/pipeline/scripts/optuna/final_preds_and_models/optuna_search_mult_quant_reg.py:161: UserWarning: The distribution is specified by [0.1, 5] and step=0.25, but the range is not divisible by `step`. It will be replaced with [0.1, 4.85].
  error_threshold = trial.suggest_float("error_threshold", 0.1, 5, step=0.25)
[I 2026-07-21 10:08:06,535] Trial 461 finished with value: -0.6009612047556586 and parameters: {'error_threshold': 4.85, 'scalers': 'robust', 'ratios': 'norm_ratio', 'imputers': 'mean', 'n_estimators': 2200, 'learning_rate': 0.017233272421075235, 'max_depth': 4, 'min_child_weight': 1, 'subsample': 0.5, 'colsample_bytree': 0.6, 'colsample_bylevel': 0.8, 'reg_alpha': 1.3665955177198568e-06, 'reg_lambda': 2.0263020131166504e-06, 'gamma': 0.0003547310560699954}. Best is trial 424 with value: -0.5888711747749842.
/bsuhome/alexanderemert/Research/Star-Formation-Research-Project-2026/pipeline/scripts/optuna/final_preds_and_models/optuna_search_mult_quant_reg.py:161: UserWarning: The distribution is specified by [0.1, 5] and step=0.25, but the range is not divisible by `step`. It will be replaced with [0.1, 4.85].
  error_threshold = trial.suggest_float("error_threshold", 0.1, 5, step=0.25)
[I 2026-07-21 10:08:09,003] Trial 462 finished with value: -0.594237909909031 and parameters: {'error_threshold': 4.85, 'scalers': 'robust', 'ratios': 'norm_ratio', 'imputers': 'mean', 'n_estimators': 2200, 'learning_rate': 0.011522273477059128, 'max_depth': 4, 'min_child_weight': 1, 'subsample': 0.6, 'colsample_bytree': 0.6, 'colsample_bylevel': 0.8, 'reg_alpha': 1.482706721984695e-06, 'reg_lambda': 1.9519418500177926e-06, 'gamma': 0.00026518616991494127}. Best is trial 424 with value: -0.5888711747749842.
/bsuhome/alexanderemert/Research/Star-Formation-Research-Project-2026/pipeline/scripts/optuna/final_preds_and_models/optuna_search_mult_quant_reg.py:161: UserWarning: The distribution is specified by [0.1, 5] and step=0.25, but the range is not divisible by `step`. It will be replaced with [0.1, 4.85].
  error_threshold = trial.suggest_float("error_threshold", 0.1, 5, step=0.25)
[I 2026-07-21 10:08:11,354] Trial 463 finished with value: -0.5942097166837633 and parameters: {'error_threshold': 4.85, 'scalers': 'robust', 'ratios': 'norm_ratio', 'imputers': 'mean', 'n_estimators': 2100, 'learning_rate': 0.01138511921796491, 'max_depth': 4, 'min_child_weight': 1, 'subsample': 0.6, 'colsample_bytree': 0.6, 'colsample_bylevel': 0.8, 'reg_alpha': 1.0202648534604273e-06, 'reg_lambda': 1.7279927464513072e-06, 'gamma': 0.00032964497885406847}. Best is trial 424 with value: -0.5888711747749842.
/bsuhome/alexanderemert/Research/Star-Formation-Research-Project-2026/pipeline/scripts/optuna/final_preds_and_models/optuna_search_mult_quant_reg.py:161: UserWarning: The distribution is specified by [0.1, 5] and step=0.25, but the range is not divisible by `step`. It will be replaced with [0.1, 4.85].
  error_threshold = trial.suggest_float("error_threshold", 0.1, 5, step=0.25)
[I 2026-07-21 10:08:13,742] Trial 465 finished with value: -0.5925445264322248 and parameters: {'error_threshold': 4.85, 'scalers': 'robust', 'ratios': 'norm_ratio', 'imputers': 'mean', 'n_estimators': 2050, 'learning_rate': 0.011906610553992685, 'max_depth': 4, 'min_child_weight': 2, 'subsample': 0.6, 'colsample_bytree': 0.6, 'colsample_bylevel': 0.8, 'reg_alpha': 4.1399173746476216e-06, 'reg_lambda': 1.8780532440091358e-06, 'gamma': 0.00020806576540524383}. Best is trial 424 with value: -0.5888711747749842.
/bsuhome/alexanderemert/Research/Star-Formation-Research-Project-2026/pipeline/scripts/optuna/final_preds_and_models/optuna_search_mult_quant_reg.py:161: UserWarning: The distribution is specified by [0.1, 5] and step=0.25, but the range is not divisible by `step`. It will be replaced with [0.1, 4.85].
  error_threshold = trial.suggest_float("error_threshold", 0.1, 5, step=0.25)
[I 2026-07-21 10:08:15,010] Trial 466 finished with value: -0.5919690615889528 and parameters: {'error_threshold': 4.85, 'scalers': 'robust', 'ratios': 'norm_ratio', 'imputers': 'mean', 'n_estimators': 2050, 'learning_rate': 0.008374710309637422, 'max_depth': 3, 'min_child_weight': 2, 'subsample': 0.6, 'colsample_bytree': 0.6, 'colsample_bylevel': 0.8, 'reg_alpha': 4.089508935569628e-06, 'reg_lambda': 2.002713688093817e-06, 'gamma': 0.0002931222046499419}. Best is trial 424 with value: -0.5888711747749842.
/bsuhome/alexanderemert/Research/Star-Formation-Research-Project-2026/pipeline/scripts/optuna/final_preds_and_models/optuna_search_mult_quant_reg.py:161: UserWarning: The distribution is specified by [0.1, 5] and step=0.25, but the range is not divisible by `step`. It will be replaced with [0.1, 4.85].
  error_threshold = trial.suggest_float("error_threshold", 0.1, 5, step=0.25)
[I 2026-07-21 10:08:16,693] Trial 467 finished with value: -0.5927087736262401 and parameters: {'error_threshold': 4.35, 'scalers': 'robust', 'ratios': 'norm_ratio', 'imputers': 'mean', 'n_estimators': 2350, 'learning_rate': 0.008056702289973119, 'max_depth': 3, 'min_child_weight': 1, 'subsample': 0.6, 'colsample_bytree': 0.6, 'colsample_bylevel': 0.8, 'reg_alpha': 3.6189747857877604e-06, 'reg_lambda': 1.8851476459865085e-06, 'gamma': 0.00022411262227464414}. Best is trial 424 with value: -0.5888711747749842.
/bsuhome/alexanderemert/Research/Star-Formation-Research-Project-2026/pipeline/scripts/optuna/final_preds_and_models/optuna_search_mult_quant_reg.py:161: UserWarning: The distribution is specified by [0.1, 5] and step=0.25, but the range is not divisible by `step`. It will be replaced with [0.1, 4.85].
  error_threshold = trial.suggest_float("error_threshold", 0.1, 5, step=0.25)
[I 2026-07-21 10:08:18,345] Trial 468 finished with value: -0.5916700852446238 and parameters: {'error_threshold': 4.85, 'scalers': 'robust', 'ratios': 'norm_ratio', 'imputers': 'mean', 'n_estimators': 2350, 'learning_rate': 0.008632377330185969, 'max_depth': 3, 'min_child_weight': 1, 'subsample': 0.6, 'colsample_bytree': 0.6, 'colsample_bylevel': 0.8, 'reg_alpha': 4.069409668935686e-06, 'reg_lambda': 1.8764744656732512e-06, 'gamma': 0.00019707076025956243}. Best is trial 424 with value: -0.5888711747749842.
/bsuhome/alexanderemert/Research/Star-Formation-Research-Project-2026/pipeline/scripts/optuna/final_preds_and_models/optuna_search_mult_quant_reg.py:161: UserWarning: The distribution is specified by [0.1, 5] and step=0.25, but the range is not divisible by `step`. It will be replaced with [0.1, 4.85].
  error_threshold = trial.suggest_float("error_threshold", 0.1, 5, step=0.25)
[I 2026-07-21 10:08:19,792] Trial 469 finished with value: -0.5926585302760038 and parameters: {'error_threshold': 4.35, 'scalers': 'robust', 'ratios': 'norm_ratio', 'imputers': 'mean', 'n_estimators': 2050, 'learning_rate': 0.008433117071924236, 'max_depth': 3, 'min_child_weight': 1, 'subsample': 0.6, 'colsample_bytree': 0.6, 'colsample_bylevel': 0.8, 'reg_alpha': 3.7572044090471497e-06, 'reg_lambda': 1.9207103473906656e-06, 'gamma': 0.00022425524189543378}. Best is trial 424 with value: -0.5888711747749842.
/bsuhome/alexanderemert/Research/Star-Formation-Research-Project-2026/pipeline/scripts/optuna/final_preds_and_models/optuna_search_mult_quant_reg.py:161: UserWarning: The distribution is specified by [0.1, 5] and step=0.25, but the range is not divisible by `step`. It will be replaced with [0.1, 4.85].
  error_threshold = trial.suggest_float("error_threshold", 0.1, 5, step=0.25)
[I 2026-07-21 10:08:21,249] Trial 470 finished with value: -0.5919154684591581 and parameters: {'error_threshold': 4.35, 'scalers': 'robust', 'ratios': 'norm_ratio', 'imputers': 'mean', 'n_estimators': 2100, 'learning_rate': 0.008269300096783805, 'max_depth': 3, 'min_child_weight': 2, 'subsample': 0.6, 'colsample_bytree': 0.6, 'colsample_bylevel': 0.8, 'reg_alpha': 4.1574592562351186e-06, 'reg_lambda': 1.9169334573309306e-06, 'gamma': 0.00020737558971012956}. Best is trial 424 with value: -0.5888711747749842.
/bsuhome/alexanderemert/Research/Star-Formation-Research-Project-2026/pipeline/scripts/optuna/final_preds_and_models/optuna_search_mult_quant_reg.py:161: UserWarning: The distribution is specified by [0.1, 5] and step=0.25, but the range is not divisible by `step`. It will be replaced with [0.1, 4.85].
  error_threshold = trial.suggest_float("error_threshold", 0.1, 5, step=0.25)
[I 2026-07-21 10:08:22,716] Trial 471 finished with value: -0.5924730906954946 and parameters: {'error_threshold': 4.35, 'scalers': 'robust', 'ratios': 'norm_ratio', 'imputers': 'mean', 'n_estimators': 2100, 'learning_rate': 0.00802618446663483, 'max_depth': 3, 'min_child_weight': 2, 'subsample': 0.6, 'colsample_bytree': 0.6, 'colsample_bylevel': 0.8, 'reg_alpha': 3.957665650104816e-06, 'reg_lambda': 1.8066415281095178e-06, 'gamma': 0.00017493721529871517}. Best is trial 424 with value: -0.5888711747749842.
/bsuhome/alexanderemert/Research/Star-Formation-Research-Project-2026/pipeline/scripts/optuna/final_preds_and_models/optuna_search_mult_quant_reg.py:161: UserWarning: The distribution is specified by [0.1, 5] and step=0.25, but the range is not divisible by `step`. It will be replaced with [0.1, 4.85].
  error_threshold = trial.suggest_float("error_threshold", 0.1, 5, step=0.25)
[I 2026-07-21 10:08:24,353] Trial 472 finished with value: -0.5918703613266953 and parameters: {'error_threshold': 4.35, 'scalers': 'robust', 'ratios': 'norm_ratio', 'imputers': 'mean', 'n_estimators': 2350, 'learning_rate': 0.008450816469365267, 'max_depth': 3, 'min_child_weight': 2, 'subsample': 0.6, 'colsample_bytree': 0.6, 'colsample_bylevel': 0.8, 'reg_alpha': 4.038885174184671e-06, 'reg_lambda': 2.0698271362764926e-06, 'gamma': 0.000181228186225516}. Best is trial 424 with value: -0.5888711747749842.
/bsuhome/alexanderemert/Research/Star-Formation-Research-Project-2026/pipeline/scripts/optuna/final_preds_and_models/optuna_search_mult_quant_reg.py:161: UserWarning: The distribution is specified by [0.1, 5] and step=0.25, but the range is not divisible by `step`. It will be replaced with [0.1, 4.85].
  error_threshold = trial.suggest_float("error_threshold", 0.1, 5, step=0.25)
[I 2026-07-21 10:08:26,872] Trial 473 finished with value: -0.5900693985858335 and parameters: {'error_threshold': 4.35, 'scalers': 'robust', 'ratios': 'norm_ratio', 'imputers': 'mean', 'n_estimators': 2350, 'learning_rate': 0.0083297652403755, 'max_depth': 4, 'min_child_weight': 2, 'subsample': 0.6, 'colsample_bytree': 0.6, 'colsample_bylevel': 0.8, 'reg_alpha': 1.970665625983846e-06, 'reg_lambda': 2.293104670947422e-06, 'gamma': 0.0001824775948408581}. Best is trial 424 with value: -0.5888711747749842.
[I 2026-07-21 10:08:47,816] Trial 464 finished with value: -0.6676826051364221 and parameters: {'error_threshold': 4.85, 'scalers': 'robust', 'ratios': 'norm_ratio', 'imputers': 'mean', 'n_estimators': 2050, 'learning_rate': 0.011325504649001141, 'max_depth': 10, 'min_child_weight': 1, 'subsample': 0.6, 'colsample_bytree': 0.6, 'colsample_bylevel': 0.8, 'reg_alpha': 3.925116637555919e-06, 'reg_lambda': 1.5364273823337081e-06, 'gamma': 0.00032975725918555563}. Best is trial 424 with value: -0.5888711747749842.
[I 2026-07-21 10:08:50,276] Trial 474 finished with value: -0.5892632646373629 and parameters: {'error_threshold': 4.35, 'scalers': 'robust', 'ratios': 'norm_ratio', 'imputers': 'mean', 'n_estimators': 2350, 'learning_rate': 0.008334556929129544, 'max_depth': 4, 'min_child_weight': 2, 'subsample': 0.6, 'colsample_bytree': 0.6, 'colsample_bylevel': 0.8, 'reg_alpha': 2.0258675004482327e-06, 'reg_lambda': 2.405020172566931e-06, 'gamma': 0.00016106590655958573}. Best is trial 424 with value: -0.5888711747749842.
[I 2026-07-21 10:08:52,694] Trial 476 finished with value: -0.5897949907870579 and parameters: {'error_threshold': 4.85, 'scalers': 'robust', 'ratios': 'norm_ratio', 'imputers': 'mean', 'n_estimators': 2300, 'learning_rate': 0.00822311834806604, 'max_depth': 4, 'min_child_weight': 2, 'subsample': 0.6, 'colsample_bytree': 0.6, 'colsample_bylevel': 0.8, 'reg_alpha': 1.9570310063669526e-06, 'reg_lambda': 2.4176859515015144e-06, 'gamma': 0.00014827394595543378}. Best is trial 424 with value: -0.5888711747749842.
[I 2026-07-21 10:08:55,171] Trial 477 finished with value: -0.5963030972380629 and parameters: {'error_threshold': 4.85, 'scalers': 'robust', 'ratios': 'norm_ratio', 'imputers': 'mean', 'n_estimators': 2350, 'learning_rate': 0.014291933726572446, 'max_depth': 4, 'min_child_weight': 2, 'subsample': 0.6, 'colsample_bytree': 0.6, 'colsample_bylevel': 0.8, 'reg_alpha': 2.1010613267620054e-06, 'reg_lambda': 2.5652230788119866e-06, 'gamma': 0.00015713991742819034}. Best is trial 424 with value: -0.5888711747749842.
[I 2026-07-21 10:08:56,987] Trial 478 finished with value: -0.6394913381455448 and parameters: {'error_threshold': 4.1, 'scalers': 'robust', 'ratios': 'norm_ratio', 'imputers': 'mean', 'n_estimators': 2350, 'learning_rate': 0.013671735092897952, 'max_depth': 4, 'min_child_weight': 2, 'subsample': 0.6, 'colsample_bytree': 0.6, 'colsample_bylevel': 0.8, 'reg_alpha': 25.84325711695774, 'reg_lambda': 2.573437890777408e-06, 'gamma': 0.0011758845397190497}. Best is trial 424 with value: -0.5888711747749842.
[I 2026-07-21 10:08:59,344] Trial 479 finished with value: -0.5963517922225842 and parameters: {'error_threshold': 4.1, 'scalers': 'robust', 'ratios': 'norm_ratio', 'imputers': 'mean', 'n_estimators': 2350, 'learning_rate': 0.014881245637647453, 'max_depth': 4, 'min_child_weight': 3, 'subsample': 0.6, 'colsample_bytree': 0.6, 'colsample_bylevel': 0.8, 'reg_alpha': 2.0549129906567355e-06, 'reg_lambda': 3.7808016498538603e-06, 'gamma': 0.00014266516162434828}. Best is trial 424 with value: -0.5888711747749842.
[I 2026-07-21 10:09:22,823] Trial 475 finished with value: -0.6546746587921629 and parameters: {'error_threshold': 4.35, 'scalers': 'robust', 'ratios': 'norm_ratio', 'imputers': 'mean', 'n_estimators': 2350, 'learning_rate': 0.008276541228857012, 'max_depth': 10, 'min_child_weight': 2, 'subsample': 0.6, 'colsample_bytree': 0.6, 'colsample_bylevel': 0.8, 'reg_alpha': 2.0420713352468235e-06, 'reg_lambda': 2.359402101667928e-06, 'gamma': 0.00014586693332002486}. Best is trial 424 with value: -0.5888711747749842.
