[I 2026-07-20 13:35:36,399] Using an existing study with name 'final_predictive_quantile_study' instead of creating a new one.
[I 2026-07-20 13:35:40,647] Trial 320 finished with value: -0.2426395012177278 and parameters: {'error_threshold': 0.5, 'scalers': 'robust', 'ratios': 'norm_ratio', 'imputers': 'none', 'n_estimators': 100, 'learning_rate': 0.00034376257495593487, 'max_depth': 7, 'min_child_weight': 3, 'subsample': 0.8, 'colsample_bytree': 0.6, 'colsample_bylevel': 0.5, 'reg_alpha': 21.413756008148614, 'reg_lambda': 48.63406818810399, 'gamma': 63.64184909944725}. Best is trial 308 with value: -0.24379312615503454.
[I 2026-07-20 13:35:40,731] Trial 322 finished with value: -0.2235147350738892 and parameters: {'error_threshold': 0.5, 'scalers': 'robust', 'ratios': 'norm_ratio', 'imputers': 'none', 'n_estimators': 100, 'learning_rate': 0.49656945627439614, 'max_depth': 7, 'min_child_weight': 3, 'subsample': 0.8, 'colsample_bytree': 0.6, 'colsample_bylevel': 0.5, 'reg_alpha': 43.24682985833271, 'reg_lambda': 53.413526832912446, 'gamma': 66.2807201909356}. Best is trial 308 with value: -0.24379312615503454.
[I 2026-07-20 13:35:41,074] Trial 321 finished with value: -0.24277009437570893 and parameters: {'error_threshold': 0.5, 'scalers': 'robust', 'ratios': 'norm_ratio', 'imputers': 'none', 'n_estimators': 100, 'learning_rate': 0.0003283065744499325, 'max_depth': 7, 'min_child_weight': 3, 'subsample': 0.8, 'colsample_bytree': 0.6, 'colsample_bylevel': 0.5, 'reg_alpha': 25.60268236291768, 'reg_lambda': 53.92046352682327, 'gamma': 66.40244011753366}. Best is trial 308 with value: -0.24379312615503454.
[I 2026-07-20 13:35:41,164] Trial 324 finished with value: -0.2428345640315236 and parameters: {'error_threshold': 0.5, 'scalers': 'robust', 'ratios': 'norm_ratio', 'imputers': 'none', 'n_estimators': 100, 'learning_rate': 0.0003389329688830023, 'max_depth': 7, 'min_child_weight': 3, 'subsample': 0.8, 'colsample_bytree': 0.6, 'colsample_bylevel': 0.5, 'reg_alpha': 33.2966234463246, 'reg_lambda': 42.070833181017036, 'gamma': 68.01174641252125}. Best is trial 308 with value: -0.24379312615503454.
[I 2026-07-20 13:35:41,247] Trial 323 finished with value: -0.24327428640015847 and parameters: {'error_threshold': 0.5, 'scalers': 'robust', 'ratios': 'norm_ratio', 'imputers': 'none', 'n_estimators': 100, 'learning_rate': 0.00017910896698406013, 'max_depth': 7, 'min_child_weight': 4, 'subsample': 0.8, 'colsample_bytree': 0.6, 'colsample_bylevel': 0.5, 'reg_alpha': 27.463591594100333, 'reg_lambda': 52.190513996156355, 'gamma': 71.63286525777295}. Best is trial 308 with value: -0.24379312615503454.
[I 2026-07-20 13:35:41,356] Trial 326 finished with value: -0.24325666991160955 and parameters: {'error_threshold': 0.5, 'scalers': 'robust', 'ratios': 'norm_ratio', 'imputers': 'none', 'n_estimators': 100, 'learning_rate': 0.00031521242594235104, 'max_depth': 7, 'min_child_weight': 4, 'subsample': 0.8, 'colsample_bytree': 0.6, 'colsample_bylevel': 0.5, 'reg_alpha': 47.8935341646345, 'reg_lambda': 44.784534045262255, 'gamma': 66.69859616893477}. Best is trial 308 with value: -0.24379312615503454.
[I 2026-07-20 13:35:41,461] Trial 327 finished with value: -0.2427193632092494 and parameters: {'error_threshold': 0.5, 'scalers': 'robust', 'ratios': 'norm_ratio', 'imputers': 'none', 'n_estimators': 100, 'learning_rate': 0.0003253668305074616, 'max_depth': 7, 'min_child_weight': 4, 'subsample': 0.8, 'colsample_bytree': 0.6, 'colsample_bylevel': 0.5, 'reg_alpha': 4.019663407597902e-05, 'reg_lambda': 46.611705733096024, 'gamma': 61.54411524489976}. Best is trial 308 with value: -0.24379312615503454.
[I 2026-07-20 13:35:41,845] Trial 325 finished with value: -0.24123974687192104 and parameters: {'error_threshold': 0.5, 'scalers': 'robust', 'ratios': 'norm_ratio', 'imputers': 'none', 'n_estimators': 100, 'learning_rate': 0.0003209574419969421, 'max_depth': 7, 'min_child_weight': 3, 'subsample': 0.8, 'colsample_bytree': 0.6, 'colsample_bylevel': 0.5, 'reg_alpha': 2.6306299633494215, 'reg_lambda': 49.21618062448538, 'gamma': 0.11078126690258104}. Best is trial 308 with value: -0.24379312615503454.
[I 2026-07-20 13:35:43,473] Trial 328 finished with value: -0.24318241267042728 and parameters: {'error_threshold': 0.5, 'scalers': 'robust', 'ratios': 'norm_ratio', 'imputers': 'none', 'n_estimators': 100, 'learning_rate': 0.00018342933967117797, 'max_depth': 7, 'min_child_weight': 3, 'subsample': 0.8, 'colsample_bytree': 0.6, 'colsample_bylevel': 0.5, 'reg_alpha': 2.625776958695181, 'reg_lambda': 19.394697219888823, 'gamma': 62.03131270011829}. Best is trial 308 with value: -0.24379312615503454.
[I 2026-07-20 13:35:44,028] Trial 330 finished with value: -0.24224669280856329 and parameters: {'error_threshold': 0.5, 'scalers': 'robust', 'ratios': 'norm_ratio', 'imputers': 'none', 'n_estimators': 150, 'learning_rate': 0.00024786443659388765, 'max_depth': 7, 'min_child_weight': 4, 'subsample': 0.8, 'colsample_bytree': 0.6, 'colsample_bylevel': 0.5, 'reg_alpha': 4.222066720863271e-05, 'reg_lambda': 19.96420442467836, 'gamma': 42.55231569406384}. Best is trial 308 with value: -0.24379312615503454.
[I 2026-07-20 13:35:44,502] Trial 331 finished with value: -0.2426745938695641 and parameters: {'error_threshold': 0.5, 'scalers': 'robust', 'ratios': 'norm_ratio', 'imputers': 'none', 'n_estimators': 150, 'learning_rate': 0.00018112249250336934, 'max_depth': 7, 'min_child_weight': 4, 'subsample': 0.8, 'colsample_bytree': 0.6, 'colsample_bylevel': 0.5, 'reg_alpha': 2.4620163678717057, 'reg_lambda': 19.315025470878666, 'gamma': 42.86472791485705}. Best is trial 308 with value: -0.24379312615503454.
[I 2026-07-20 13:35:44,684] Trial 329 finished with value: -0.24159837510905946 and parameters: {'error_threshold': 0.5, 'scalers': 'robust', 'ratios': 'norm_ratio', 'imputers': 'none', 'n_estimators': 150, 'learning_rate': 0.0001767952224186577, 'max_depth': 7, 'min_child_weight': 4, 'subsample': 0.8, 'colsample_bytree': 0.6, 'colsample_bylevel': 0.5, 'reg_alpha': 4.3774925855022624e-05, 'reg_lambda': 30.871300464071208, 'gamma': 0.1668495656842865}. Best is trial 308 with value: -0.24379312615503454.
[I 2026-07-20 13:35:44,960] Trial 332 finished with value: -0.24230241181181456 and parameters: {'error_threshold': 0.5, 'scalers': 'robust', 'ratios': 'norm_ratio', 'imputers': 'none', 'n_estimators': 150, 'learning_rate': 0.00024233665661673877, 'max_depth': 7, 'min_child_weight': 4, 'subsample': 0.8, 'colsample_bytree': 0.6, 'colsample_bylevel': 0.5, 'reg_alpha': 2.6018351400809063, 'reg_lambda': 18.527375091823554, 'gamma': 42.91140187553188}. Best is trial 308 with value: -0.24379312615503454.
[I 2026-07-20 13:35:45,073] Trial 333 finished with value: -0.24225253394215654 and parameters: {'error_threshold': 0.25, 'scalers': 'robust', 'ratios': 'norm_ratio', 'imputers': 'none', 'n_estimators': 150, 'learning_rate': 0.0002459676049157124, 'max_depth': 8, 'min_child_weight': 10, 'subsample': 0.8, 'colsample_bytree': 0.6, 'colsample_bylevel': 0.5, 'reg_alpha': 5.4008018128036834e-05, 'reg_lambda': 18.462243820688226, 'gamma': 42.286726494273765}. Best is trial 308 with value: -0.24379312615503454.
[I 2026-07-20 13:35:45,176] Trial 335 finished with value: -0.24267768797872089 and parameters: {'error_threshold': 0.25, 'scalers': 'robust', 'ratios': 'norm_ratio', 'imputers': 'none', 'n_estimators': 150, 'learning_rate': 0.00017820949844256058, 'max_depth': 8, 'min_child_weight': 10, 'subsample': 0.8, 'colsample_bytree': 0.6, 'colsample_bylevel': 0.5, 'reg_alpha': 1.3132503041625077, 'reg_lambda': 19.064732849233025, 'gamma': 41.54393522190471}. Best is trial 308 with value: -0.24379312615503454.
[I 2026-07-20 13:35:45,434] Trial 334 finished with value: -0.24076903801403535 and parameters: {'error_threshold': 0.25, 'scalers': 'robust', 'ratios': 'norm_ratio', 'imputers': 'none', 'n_estimators': 150, 'learning_rate': 0.000252007517958621, 'max_depth': 8, 'min_child_weight': 10, 'subsample': 0.8, 'colsample_bytree': 0.6, 'colsample_bylevel': 0.5, 'reg_alpha': 2.489322788588524, 'reg_lambda': 18.674485453752638, 'gamma': 0.18414057747633095}. Best is trial 308 with value: -0.24379312615503454.
[I 2026-07-20 13:35:47,137] Trial 336 finished with value: -0.2421941726383309 and parameters: {'error_threshold': 0.25, 'scalers': 'robust', 'ratios': 'norm_ratio', 'imputers': 'none', 'n_estimators': 150, 'learning_rate': 0.00025551854407552974, 'max_depth': 8, 'min_child_weight': 10, 'subsample': 0.8, 'colsample_bytree': 0.6, 'colsample_bylevel': 0.5, 'reg_alpha': 1.494063006879722, 'reg_lambda': 29.39781404621664, 'gamma': 40.8896411476309}. Best is trial 308 with value: -0.24379312615503454.
[I 2026-07-20 13:35:47,441] Trial 337 finished with value: -0.242671310073157 and parameters: {'error_threshold': 0.25, 'scalers': 'robust', 'ratios': 'norm_ratio', 'imputers': 'none', 'n_estimators': 150, 'learning_rate': 0.0001793631456733904, 'max_depth': 7, 'min_child_weight': 10, 'subsample': 0.8, 'colsample_bytree': 0.6, 'colsample_bylevel': 0.5, 'reg_alpha': 1.4369005511373056, 'reg_lambda': 30.207749737357265, 'gamma': 41.217864740937266}. Best is trial 308 with value: -0.24379312615503454.
[I 2026-07-20 13:35:47,907] Trial 338 finished with value: -0.2423574785445857 and parameters: {'error_threshold': 0.25, 'scalers': 'robust', 'ratios': 'norm_ratio', 'imputers': 'none', 'n_estimators': 150, 'learning_rate': 0.0002414956702744761, 'max_depth': 7, 'min_child_weight': 10, 'subsample': 0.8, 'colsample_bytree': 0.6, 'colsample_bylevel': 0.5, 'reg_alpha': 1.42165229528048, 'reg_lambda': 30.644322910927627, 'gamma': 46.70955379961284}. Best is trial 308 with value: -0.24379312615503454.
[I 2026-07-20 13:35:48,268] Trial 339 finished with value: -0.24132701884891425 and parameters: {'error_threshold': 0.25, 'scalers': 'robust', 'ratios': 'norm_ratio', 'imputers': 'none', 'n_estimators': 250, 'learning_rate': 0.0002468742859487582, 'max_depth': 7, 'min_child_weight': 10, 'subsample': 0.8, 'colsample_bytree': 0.6, 'colsample_bylevel': 0.5, 'reg_alpha': 1.4069208848854806, 'reg_lambda': 29.459466872922153, 'gamma': 44.47960571484623}. Best is trial 308 with value: -0.24379312615503454.
[I 2026-07-20 13:35:48,691] Trial 340 finished with value: -0.22889143560542333 and parameters: {'error_threshold': 0.25, 'scalers': 'robust', 'ratios': 'norm_ratio', 'imputers': 'none', 'n_estimators': 250, 'learning_rate': 0.04609722573507014, 'max_depth': 8, 'min_child_weight': 10, 'subsample': 0.8, 'colsample_bytree': 0.6, 'colsample_bylevel': 0.5, 'reg_alpha': 1.378840955373059, 'reg_lambda': 8.50711477604471, 'gamma': 76.81543497462667}. Best is trial 308 with value: -0.24379312615503454.
[I 2026-07-20 13:35:49,014] Trial 341 finished with value: -0.24294292777540338 and parameters: {'error_threshold': 0.25, 'scalers': 'robust', 'ratios': 'norm_ratio', 'imputers': 'none', 'n_estimators': 250, 'learning_rate': 0.0001525962180895174, 'max_depth': 7, 'min_child_weight': 10, 'subsample': 0.8, 'colsample_bytree': 0.6, 'colsample_bylevel': 0.5, 'reg_alpha': 1.3811693246257322, 'reg_lambda': 29.67687020841263, 'gamma': 98.56477354460186}. Best is trial 308 with value: -0.24379312615503454.
[I 2026-07-20 13:35:49,171] Trial 342 finished with value: -0.23530368831110227 and parameters: {'error_threshold': 0.25, 'scalers': 'robust', 'ratios': 'norm_ratio', 'imputers': 'none', 'n_estimators': 250, 'learning_rate': 0.06049694488676652, 'max_depth': 7, 'min_child_weight': 10, 'subsample': 0.8, 'colsample_bytree': 0.6, 'colsample_bylevel': 0.5, 'reg_alpha': 6.341984522107045, 'reg_lambda': 8.242201049386406, 'gamma': 97.34149912318603}. Best is trial 308 with value: -0.24379312615503454.
[I 2026-07-20 13:35:49,502] Trial 343 finished with value: -0.24249996168160326 and parameters: {'error_threshold': 0.75, 'scalers': 'robust', 'ratios': 'norm_ratio', 'imputers': 'none', 'n_estimators': 250, 'learning_rate': 0.00014924620482721884, 'max_depth': 7, 'min_child_weight': 10, 'subsample': 0.8, 'colsample_bytree': 0.6, 'colsample_bylevel': 0.5, 'reg_alpha': 5.399594544043112, 'reg_lambda': 32.17530035061757, 'gamma': 74.21297008597696}. Best is trial 308 with value: -0.24379312615503454.
[I 2026-07-20 13:35:51,283] Trial 344 finished with value: -0.24247285992517487 and parameters: {'error_threshold': 0.75, 'scalers': 'robust', 'ratios': 'norm_ratio', 'imputers': 'none', 'n_estimators': 250, 'learning_rate': 0.00014966003191083986, 'max_depth': 7, 'min_child_weight': 10, 'subsample': 0.9, 'colsample_bytree': 0.6, 'colsample_bylevel': 0.5, 'reg_alpha': 4.719558976192756, 'reg_lambda': 9.696838270811265, 'gamma': 76.73473501524933}. Best is trial 308 with value: -0.24379312615503454.
[I 2026-07-20 13:35:51,530] Trial 345 finished with value: -0.24292918576219139 and parameters: {'error_threshold': 0.75, 'scalers': 'robust', 'ratios': 'norm_ratio', 'imputers': 'none', 'n_estimators': 250, 'learning_rate': 0.00014840131986724035, 'max_depth': 7, 'min_child_weight': 10, 'subsample': 0.8, 'colsample_bytree': 0.6, 'colsample_bylevel': 0.5, 'reg_alpha': 5.448856780570144, 'reg_lambda': 8.150714812060874, 'gamma': 99.58315985386123}. Best is trial 308 with value: -0.24379312615503454.
[I 2026-07-20 13:35:51,916] Trial 346 finished with value: -0.2425295222652438 and parameters: {'error_threshold': 0.75, 'scalers': 'robust', 'ratios': 'norm_ratio', 'imputers': 'none', 'n_estimators': 250, 'learning_rate': 0.00015415837315341195, 'max_depth': 7, 'min_child_weight': 10, 'subsample': 0.9, 'colsample_bytree': 0.6, 'colsample_bylevel': 0.5, 'reg_alpha': 7.748262563801805e-05, 'reg_lambda': 8.482463618701907, 'gamma': 98.93918436368011}. Best is trial 308 with value: -0.24379312615503454.
[I 2026-07-20 13:35:52,717] Trial 347 finished with value: -0.24245461447883723 and parameters: {'error_threshold': 0.75, 'scalers': 'robust', 'ratios': 'norm_ratio', 'imputers': 'none', 'n_estimators': 250, 'learning_rate': 0.0001517981074734157, 'max_depth': 7, 'min_child_weight': 4, 'subsample': 0.8, 'colsample_bytree': 0.6, 'colsample_bylevel': 0.5, 'reg_alpha': 8.755437021451715e-05, 'reg_lambda': 8.825316585059856, 'gamma': 71.3552850485668}. Best is trial 308 with value: -0.24379312615503454.
[I 2026-07-20 13:35:52,843] Trial 349 finished with value: -0.2432882067270469 and parameters: {'error_threshold': 0.75, 'scalers': 'robust', 'ratios': 'norm_ratio', 'imputers': 'none', 'n_estimators': 100, 'learning_rate': 0.00014864616503099036, 'max_depth': 7, 'min_child_weight': 5, 'subsample': 0.9, 'colsample_bytree': 0.6, 'colsample_bylevel': 0.5, 'reg_alpha': 0.00010274811388966187, 'reg_lambda': 8.83593388670863, 'gamma': 69.9501762121043}. Best is trial 308 with value: -0.24379312615503454.
[I 2026-07-20 13:35:53,087] Trial 350 finished with value: -0.24328784727831196 and parameters: {'error_threshold': 0.75, 'scalers': 'robust', 'ratios': 'norm_ratio', 'imputers': 'none', 'n_estimators': 100, 'learning_rate': 0.00014847250489285905, 'max_depth': 7, 'min_child_weight': 5, 'subsample': 0.8, 'colsample_bytree': 0.6, 'colsample_bylevel': 0.5, 'reg_alpha': 0.7787049646214852, 'reg_lambda': 4.70531160374761, 'gamma': 69.8877085521684}. Best is trial 308 with value: -0.24379312615503454.
[I 2026-07-20 13:35:53,183] Trial 351 finished with value: -0.23921346378874522 and parameters: {'error_threshold': 0.75, 'scalers': 'robust', 'ratios': 'norm_ratio', 'imputers': 'none', 'n_estimators': 100, 'learning_rate': 0.010576069705844331, 'max_depth': 7, 'min_child_weight': 4, 'subsample': 0.8, 'colsample_bytree': 0.6, 'colsample_bylevel': 0.5, 'reg_alpha': 8.775380972991074e-05, 'reg_lambda': 94.72417254143527, 'gamma': 99.4760084708274}. Best is trial 308 with value: -0.24379312615503454.
[I 2026-07-20 13:35:53,688] Trial 348 finished with value: -0.2407505493485611 and parameters: {'error_threshold': 0.75, 'scalers': 'robust', 'ratios': 'norm_ratio', 'imputers': 'none', 'n_estimators': 250, 'learning_rate': 0.00014814551318467759, 'max_depth': 7, 'min_child_weight': 4, 'subsample': 0.8, 'colsample_bytree': 0.6, 'colsample_bylevel': 0.5, 'reg_alpha': 5.47247191137212, 'reg_lambda': 5.0179263916168155, 'gamma': 2.475350240471773e-05}. Best is trial 308 with value: -0.24379312615503454.
[I 2026-07-20 13:35:54,408] Trial 352 finished with value: -0.24322277872438913 and parameters: {'error_threshold': 0.5, 'scalers': 'robust', 'ratios': 'norm_ratio', 'imputers': 'none', 'n_estimators': 100, 'learning_rate': 0.00020406984100785228, 'max_depth': 7, 'min_child_weight': 5, 'subsample': 0.8, 'colsample_bytree': 0.6, 'colsample_bylevel': 0.5, 'reg_alpha': 7.477378646637718e-05, 'reg_lambda': 4.7316465339383305, 'gamma': 99.81045465128427}. Best is trial 308 with value: -0.24379312615503454.
[I 2026-07-20 13:35:55,336] Trial 353 finished with value: -0.24317355070396485 and parameters: {'error_threshold': 0.5, 'scalers': 'robust', 'ratios': 'norm_ratio', 'imputers': 'none', 'n_estimators': 100, 'learning_rate': 0.00018420760593304683, 'max_depth': 7, 'min_child_weight': 4, 'subsample': 0.8, 'colsample_bytree': 0.6, 'colsample_bylevel': 0.5, 'reg_alpha': 8.698812378054174e-05, 'reg_lambda': 4.948985383534425, 'gamma': 69.62964248950797}. Best is trial 308 with value: -0.24379312615503454.
[I 2026-07-20 13:35:55,424] Trial 354 finished with value: -0.2431208010330169 and parameters: {'error_threshold': 0.5, 'scalers': 'robust', 'ratios': 'norm_ratio', 'imputers': 'none', 'n_estimators': 100, 'learning_rate': 0.00020241227594046784, 'max_depth': 7, 'min_child_weight': 4, 'subsample': 0.8, 'colsample_bytree': 0.6, 'colsample_bylevel': 0.5, 'reg_alpha': 0.8397210106193566, 'reg_lambda': 5.719454157660957, 'gamma': 62.03261884462606}. Best is trial 308 with value: -0.24379312615503454.
[I 2026-07-20 13:35:55,510] Trial 355 finished with value: -0.24309316806672374 and parameters: {'error_threshold': 0.5, 'scalers': 'robust', 'ratios': 'norm_ratio', 'imputers': 'none', 'n_estimators': 100, 'learning_rate': 0.00020862886336355703, 'max_depth': 6, 'min_child_weight': 4, 'subsample': 0.8, 'colsample_bytree': 0.6, 'colsample_bylevel': 0.5, 'reg_alpha': 0.3549248297868703, 'reg_lambda': 4.66758909478778, 'gamma': 67.8466465757323}. Best is trial 308 with value: -0.24379312615503454.
[I 2026-07-20 13:35:55,851] Trial 356 finished with value: -0.24304148358385036 and parameters: {'error_threshold': 0.5, 'scalers': 'robust', 'ratios': 'norm_ratio', 'imputers': 'none', 'n_estimators': 100, 'learning_rate': 0.0002035849092363631, 'max_depth': 6, 'min_child_weight': 6, 'subsample': 0.8, 'colsample_bytree': 0.6, 'colsample_bylevel': 0.5, 'reg_alpha': 0.3688158050473897, 'reg_lambda': 5.445139446050245, 'gamma': 55.61309650499961}. Best is trial 308 with value: -0.24379312615503454.
[I 2026-07-20 13:35:56,436] Trial 358 finished with value: -0.24234791335123373 and parameters: {'error_threshold': 0.5, 'scalers': 'robust', 'ratios': 'norm_ratio', 'imputers': 'none', 'n_estimators': 200, 'learning_rate': 0.00019450772811881086, 'max_depth': 7, 'min_child_weight': 4, 'subsample': 0.8, 'colsample_bytree': 0.6, 'colsample_bylevel': 0.5, 'reg_alpha': 0.7424341371149579, 'reg_lambda': 14.141133447998259, 'gamma': 54.46208803305243}. Best is trial 308 with value: -0.24379312615503454.
[I 2026-07-20 13:35:56,643] Trial 359 finished with value: -0.24290049435210181 and parameters: {'error_threshold': 0.5, 'scalers': 'robust', 'ratios': 'norm_ratio', 'imputers': 'none', 'n_estimators': 100, 'learning_rate': 0.00022198693133392713, 'max_depth': 6, 'min_child_weight': 4, 'subsample': 0.8, 'colsample_bytree': 0.6, 'colsample_bylevel': 0.5, 'reg_alpha': 0.8274120176117484, 'reg_lambda': 24.006533552139327, 'gamma': 52.088898458330895}. Best is trial 308 with value: -0.24379312615503454.
[I 2026-07-20 13:35:58,839] Trial 360 finished with value: -0.2423312680878553 and parameters: {'error_threshold': 0.5, 'scalers': 'robust', 'ratios': 'norm_ratio', 'imputers': 'none', 'n_estimators': 200, 'learning_rate': 0.00020373190615930226, 'max_depth': 7, 'min_child_weight': 4, 'subsample': 0.8, 'colsample_bytree': 0.6, 'colsample_bylevel': 0.5, 'reg_alpha': 0.3757200934849609, 'reg_lambda': 13.692262514065304, 'gamma': 56.54709695919287}. Best is trial 308 with value: -0.24379312615503454.
[I 2026-07-20 13:35:59,036] Trial 361 finished with value: -0.24233031501488841 and parameters: {'error_threshold': 0.5, 'scalers': 'robust', 'ratios': 'norm_ratio', 'imputers': 'none', 'n_estimators': 200, 'learning_rate': 0.0002093825991532914, 'max_depth': 6, 'min_child_weight': 4, 'subsample': 0.8, 'colsample_bytree': 0.6, 'colsample_bylevel': 0.5, 'reg_alpha': 0.3364441507159082, 'reg_lambda': 13.650432674019088, 'gamma': 60.01952307256811}. Best is trial 308 with value: -0.24379312615503454.
[I 2026-07-20 13:35:59,168] Trial 362 finished with value: -0.24211592185278852 and parameters: {'error_threshold': 0.5, 'scalers': 'robust', 'ratios': 'norm_ratio', 'imputers': 'none', 'n_estimators': 200, 'learning_rate': 0.00021168874922465608, 'max_depth': 6, 'min_child_weight': 4, 'subsample': 0.8, 'colsample_bytree': 0.6, 'colsample_bylevel': 0.5, 'reg_alpha': 0.7054718829913484, 'reg_lambda': 14.303308870203294, 'gamma': 52.352093793004066}. Best is trial 308 with value: -0.24379312615503454.
[I 2026-07-20 13:35:59,953] Trial 357 finished with value: -0.23623266530741518 and parameters: {'error_threshold': 0.5, 'scalers': 'robust', 'ratios': 'norm_ratio', 'imputers': 'none', 'n_estimators': 1100, 'learning_rate': 0.00020641784777157158, 'max_depth': 6, 'min_child_weight': 4, 'subsample': 0.8, 'colsample_bytree': 0.6, 'colsample_bylevel': 0.5, 'reg_alpha': 0.3549829333121866, 'reg_lambda': 94.28008170885022, 'gamma': 53.83040003173276}. Best is trial 308 with value: -0.24379312615503454.
