[I 2026-07-20 13:37:14,750] Trial 475 finished with value: -0.2405751504138414 and parameters: {'error_threshold': 0.0, 'scalers': 'robust', 'ratios': 'log_ratio', 'imputers': 'none', 'n_estimators': 250, 'learning_rate': 0.0005607769082534063, 'max_depth': 6, 'min_child_weight': 10, 'subsample': 0.7, 'colsample_bytree': 0.6, 'colsample_bylevel': 0.5, 'reg_alpha': 32.88981574560941, 'reg_lambda': 53.28892754731551, 'gamma': 51.719492473776654}. Best is trial 370 with value: -0.24379341779244815.
/bsuscratch/alexanderemert/miniforge3/envs/starform-alex/lib/python3.14/site-packages/numpy/lib/_nanfunctions_impl.py:1215: RuntimeWarning: All-NaN slice encountered
  return fnb._ureduce(a, func=_nanmedian, keepdims=keepdims,
/bsuscratch/alexanderemert/miniforge3/envs/starform-alex/lib/python3.14/site-packages/numpy/lib/_nanfunctions_impl.py:1396: RuntimeWarning: All-NaN slice encountered
  return _nanquantile_unchecked(
/bsuscratch/alexanderemert/miniforge3/envs/starform-alex/lib/python3.14/site-packages/numpy/lib/_nanfunctions_impl.py:1215: RuntimeWarning: All-NaN slice encountered
  return fnb._ureduce(a, func=_nanmedian, keepdims=keepdims,
/bsuscratch/alexanderemert/miniforge3/envs/starform-alex/lib/python3.14/site-packages/numpy/lib/_nanfunctions_impl.py:1396: RuntimeWarning: All-NaN slice encountered
  return _nanquantile_unchecked(
/bsuscratch/alexanderemert/miniforge3/envs/starform-alex/lib/python3.14/site-packages/numpy/lib/_nanfunctions_impl.py:1215: RuntimeWarning: All-NaN slice encountered
  return fnb._ureduce(a, func=_nanmedian, keepdims=keepdims,
/bsuscratch/alexanderemert/miniforge3/envs/starform-alex/lib/python3.14/site-packages/numpy/lib/_nanfunctions_impl.py:1396: RuntimeWarning: All-NaN slice encountered
  return _nanquantile_unchecked(
/bsuscratch/alexanderemert/miniforge3/envs/starform-alex/lib/python3.14/site-packages/numpy/lib/_nanfunctions_impl.py:1215: RuntimeWarning: All-NaN slice encountered
  return fnb._ureduce(a, func=_nanmedian, keepdims=keepdims,
/bsuscratch/alexanderemert/miniforge3/envs/starform-alex/lib/python3.14/site-packages/numpy/lib/_nanfunctions_impl.py:1396: RuntimeWarning: All-NaN slice encountered
  return _nanquantile_unchecked(
/bsuscratch/alexanderemert/miniforge3/envs/starform-alex/lib/python3.14/site-packages/numpy/lib/_nanfunctions_impl.py:1215: RuntimeWarning: All-NaN slice encountered
  return fnb._ureduce(a, func=_nanmedian, keepdims=keepdims,
/bsuscratch/alexanderemert/miniforge3/envs/starform-alex/lib/python3.14/site-packages/numpy/lib/_nanfunctions_impl.py:1396: RuntimeWarning: All-NaN slice encountered
  return _nanquantile_unchecked(
/bsuscratch/alexanderemert/miniforge3/envs/starform-alex/lib/python3.14/site-packages/numpy/lib/_nanfunctions_impl.py:1215: RuntimeWarning: All-NaN slice encountered
  return fnb._ureduce(a, func=_nanmedian, keepdims=keepdims,
/bsuscratch/alexanderemert/miniforge3/envs/starform-alex/lib/python3.14/site-packages/numpy/lib/_nanfunctions_impl.py:1215: RuntimeWarning: All-NaN slice encountered
  return fnb._ureduce(a, func=_nanmedian, keepdims=keepdims,
/bsuscratch/alexanderemert/miniforge3/envs/starform-alex/lib/python3.14/site-packages/numpy/lib/_nanfunctions_impl.py:1215: RuntimeWarning: All-NaN slice encountered
  return fnb._ureduce(a, func=_nanmedian, keepdims=keepdims,
/bsuscratch/alexanderemert/miniforge3/envs/starform-alex/lib/python3.14/site-packages/numpy/lib/_nanfunctions_impl.py:1396: RuntimeWarning: All-NaN slice encountered
  return _nanquantile_unchecked(
/bsuscratch/alexanderemert/miniforge3/envs/starform-alex/lib/python3.14/site-packages/numpy/lib/_nanfunctions_impl.py:1396: RuntimeWarning: All-NaN slice encountered
  return _nanquantile_unchecked(
/bsuscratch/alexanderemert/miniforge3/envs/starform-alex/lib/python3.14/site-packages/numpy/lib/_nanfunctions_impl.py:1396: RuntimeWarning: All-NaN slice encountered
  return _nanquantile_unchecked(
/bsuscratch/alexanderemert/miniforge3/envs/starform-alex/lib/python3.14/site-packages/numpy/lib/_nanfunctions_impl.py:1215: RuntimeWarning: All-NaN slice encountered
  return fnb._ureduce(a, func=_nanmedian, keepdims=keepdims,
/bsuscratch/alexanderemert/miniforge3/envs/starform-alex/lib/python3.14/site-packages/numpy/lib/_nanfunctions_impl.py:1396: RuntimeWarning: All-NaN slice encountered
  return _nanquantile_unchecked(
/bsuscratch/alexanderemert/miniforge3/envs/starform-alex/lib/python3.14/site-packages/numpy/lib/_nanfunctions_impl.py:1215: RuntimeWarning: All-NaN slice encountered
  return fnb._ureduce(a, func=_nanmedian, keepdims=keepdims,
/bsuscratch/alexanderemert/miniforge3/envs/starform-alex/lib/python3.14/site-packages/numpy/lib/_nanfunctions_impl.py:1396: RuntimeWarning: All-NaN slice encountered
  return _nanquantile_unchecked(
/bsuscratch/alexanderemert/miniforge3/envs/starform-alex/lib/python3.14/site-packages/numpy/lib/_nanfunctions_impl.py:1215: RuntimeWarning: All-NaN slice encountered
  return fnb._ureduce(a, func=_nanmedian, keepdims=keepdims,
/bsuscratch/alexanderemert/miniforge3/envs/starform-alex/lib/python3.14/site-packages/numpy/lib/_nanfunctions_impl.py:1215: RuntimeWarning: All-NaN slice encountered
  return fnb._ureduce(a, func=_nanmedian, keepdims=keepdims,
/bsuscratch/alexanderemert/miniforge3/envs/starform-alex/lib/python3.14/site-packages/numpy/lib/_nanfunctions_impl.py:1396: RuntimeWarning: All-NaN slice encountered
  return _nanquantile_unchecked(
/bsuscratch/alexanderemert/miniforge3/envs/starform-alex/lib/python3.14/site-packages/numpy/lib/_nanfunctions_impl.py:1396: RuntimeWarning: All-NaN slice encountered
  return _nanquantile_unchecked(
/bsuscratch/alexanderemert/miniforge3/envs/starform-alex/lib/python3.14/site-packages/numpy/lib/_nanfunctions_impl.py:1215: RuntimeWarning: All-NaN slice encountered
  return fnb._ureduce(a, func=_nanmedian, keepdims=keepdims,
/bsuscratch/alexanderemert/miniforge3/envs/starform-alex/lib/python3.14/site-packages/numpy/lib/_nanfunctions_impl.py:1396: RuntimeWarning: All-NaN slice encountered
  return _nanquantile_unchecked(
/bsuscratch/alexanderemert/miniforge3/envs/starform-alex/lib/python3.14/site-packages/numpy/lib/_nanfunctions_impl.py:1215: RuntimeWarning: All-NaN slice encountered
  return fnb._ureduce(a, func=_nanmedian, keepdims=keepdims,
/bsuscratch/alexanderemert/miniforge3/envs/starform-alex/lib/python3.14/site-packages/numpy/lib/_nanfunctions_impl.py:1396: RuntimeWarning: All-NaN slice encountered
  return _nanquantile_unchecked(
/bsuscratch/alexanderemert/miniforge3/envs/starform-alex/lib/python3.14/site-packages/numpy/lib/_nanfunctions_impl.py:1215: RuntimeWarning: All-NaN slice encountered
  return fnb._ureduce(a, func=_nanmedian, keepdims=keepdims,
/bsuscratch/alexanderemert/miniforge3/envs/starform-alex/lib/python3.14/site-packages/numpy/lib/_nanfunctions_impl.py:1396: RuntimeWarning: All-NaN slice encountered
  return _nanquantile_unchecked(
/bsuscratch/alexanderemert/miniforge3/envs/starform-alex/lib/python3.14/site-packages/numpy/lib/_nanfunctions_impl.py:1215: RuntimeWarning: All-NaN slice encountered
  return fnb._ureduce(a, func=_nanmedian, keepdims=keepdims,
/bsuscratch/alexanderemert/miniforge3/envs/starform-alex/lib/python3.14/site-packages/numpy/lib/_nanfunctions_impl.py:1396: RuntimeWarning: All-NaN slice encountered
  return _nanquantile_unchecked(
/bsuscratch/alexanderemert/miniforge3/envs/starform-alex/lib/python3.14/site-packages/numpy/lib/_nanfunctions_impl.py:1215: RuntimeWarning: All-NaN slice encountered
  return fnb._ureduce(a, func=_nanmedian, keepdims=keepdims,
/bsuscratch/alexanderemert/miniforge3/envs/starform-alex/lib/python3.14/site-packages/numpy/lib/_nanfunctions_impl.py:1396: RuntimeWarning: All-NaN slice encountered
  return _nanquantile_unchecked(
/bsuscratch/alexanderemert/miniforge3/envs/starform-alex/lib/python3.14/site-packages/numpy/lib/_nanfunctions_impl.py:1215: RuntimeWarning: All-NaN slice encountered
  return fnb._ureduce(a, func=_nanmedian, keepdims=keepdims,
/bsuscratch/alexanderemert/miniforge3/envs/starform-alex/lib/python3.14/site-packages/numpy/lib/_nanfunctions_impl.py:1396: RuntimeWarning: All-NaN slice encountered
  return _nanquantile_unchecked(
/bsuscratch/alexanderemert/miniforge3/envs/starform-alex/lib/python3.14/site-packages/numpy/lib/_nanfunctions_impl.py:1215: RuntimeWarning: All-NaN slice encountered
  return fnb._ureduce(a, func=_nanmedian, keepdims=keepdims,
/bsuscratch/alexanderemert/miniforge3/envs/starform-alex/lib/python3.14/site-packages/numpy/lib/_nanfunctions_impl.py:1396: RuntimeWarning: All-NaN slice encountered
  return _nanquantile_unchecked(
/bsuscratch/alexanderemert/miniforge3/envs/starform-alex/lib/python3.14/site-packages/numpy/lib/_nanfunctions_impl.py:1215: RuntimeWarning: All-NaN slice encountered
  return fnb._ureduce(a, func=_nanmedian, keepdims=keepdims,
/bsuscratch/alexanderemert/miniforge3/envs/starform-alex/lib/python3.14/site-packages/numpy/lib/_nanfunctions_impl.py:1215: RuntimeWarning: All-NaN slice encountered
  return fnb._ureduce(a, func=_nanmedian, keepdims=keepdims,
/bsuscratch/alexanderemert/miniforge3/envs/starform-alex/lib/python3.14/site-packages/numpy/lib/_nanfunctions_impl.py:1396: RuntimeWarning: All-NaN slice encountered
  return _nanquantile_unchecked(
/bsuscratch/alexanderemert/miniforge3/envs/starform-alex/lib/python3.14/site-packages/numpy/lib/_nanfunctions_impl.py:1396: RuntimeWarning: All-NaN slice encountered
  return _nanquantile_unchecked(
/bsuscratch/alexanderemert/miniforge3/envs/starform-alex/lib/python3.14/site-packages/numpy/lib/_nanfunctions_impl.py:1215: RuntimeWarning: All-NaN slice encountered
  return fnb._ureduce(a, func=_nanmedian, keepdims=keepdims,
/bsuscratch/alexanderemert/miniforge3/envs/starform-alex/lib/python3.14/site-packages/numpy/lib/_nanfunctions_impl.py:1396: RuntimeWarning: All-NaN slice encountered
  return _nanquantile_unchecked(
/bsuscratch/alexanderemert/miniforge3/envs/starform-alex/lib/python3.14/site-packages/numpy/lib/_nanfunctions_impl.py:1215: RuntimeWarning: All-NaN slice encountered
  return fnb._ureduce(a, func=_nanmedian, keepdims=keepdims,
/bsuscratch/alexanderemert/miniforge3/envs/starform-alex/lib/python3.14/site-packages/numpy/lib/_nanfunctions_impl.py:1396: RuntimeWarning: All-NaN slice encountered
  return _nanquantile_unchecked(
/bsuscratch/alexanderemert/miniforge3/envs/starform-alex/lib/python3.14/site-packages/numpy/lib/_nanfunctions_impl.py:1215: RuntimeWarning: All-NaN slice encountered
  return fnb._ureduce(a, func=_nanmedian, keepdims=keepdims,
/bsuscratch/alexanderemert/miniforge3/envs/starform-alex/lib/python3.14/site-packages/numpy/lib/_nanfunctions_impl.py:1396: RuntimeWarning: All-NaN slice encountered
  return _nanquantile_unchecked(
/bsuscratch/alexanderemert/miniforge3/envs/starform-alex/lib/python3.14/site-packages/numpy/lib/_nanfunctions_impl.py:1215: RuntimeWarning: All-NaN slice encountered
  return fnb._ureduce(a, func=_nanmedian, keepdims=keepdims,
/bsuscratch/alexanderemert/miniforge3/envs/starform-alex/lib/python3.14/site-packages/numpy/lib/_nanfunctions_impl.py:1396: RuntimeWarning: All-NaN slice encountered
  return _nanquantile_unchecked(
/bsuscratch/alexanderemert/miniforge3/envs/starform-alex/lib/python3.14/site-packages/numpy/lib/_nanfunctions_impl.py:1215: RuntimeWarning: All-NaN slice encountered
  return fnb._ureduce(a, func=_nanmedian, keepdims=keepdims,
/bsuscratch/alexanderemert/miniforge3/envs/starform-alex/lib/python3.14/site-packages/numpy/lib/_nanfunctions_impl.py:1396: RuntimeWarning: All-NaN slice encountered
  return _nanquantile_unchecked(
/bsuscratch/alexanderemert/miniforge3/envs/starform-alex/lib/python3.14/site-packages/numpy/lib/_nanfunctions_impl.py:1215: RuntimeWarning: All-NaN slice encountered
  return fnb._ureduce(a, func=_nanmedian, keepdims=keepdims,
/bsuscratch/alexanderemert/miniforge3/envs/starform-alex/lib/python3.14/site-packages/numpy/lib/_nanfunctions_impl.py:1396: RuntimeWarning: All-NaN slice encountered
  return _nanquantile_unchecked(
/bsuscratch/alexanderemert/miniforge3/envs/starform-alex/lib/python3.14/site-packages/numpy/lib/_nanfunctions_impl.py:1215: RuntimeWarning: All-NaN slice encountered
  return fnb._ureduce(a, func=_nanmedian, keepdims=keepdims,
/bsuscratch/alexanderemert/miniforge3/envs/starform-alex/lib/python3.14/site-packages/numpy/lib/_nanfunctions_impl.py:1215: RuntimeWarning: All-NaN slice encountered
  return fnb._ureduce(a, func=_nanmedian, keepdims=keepdims,
/bsuscratch/alexanderemert/miniforge3/envs/starform-alex/lib/python3.14/site-packages/numpy/lib/_nanfunctions_impl.py:1396: RuntimeWarning: All-NaN slice encountered
  return _nanquantile_unchecked(
/bsuscratch/alexanderemert/miniforge3/envs/starform-alex/lib/python3.14/site-packages/numpy/lib/_nanfunctions_impl.py:1396: RuntimeWarning: All-NaN slice encountered
  return _nanquantile_unchecked(
