[I 2026-07-20 14:29:19,820] A new study created in Journal with name: quantile_study_7_20_26
/bsuhome/alexanderemert/Research/Star-Formation-Research-Project-2026/pipeline/scripts/optuna/final_preds_and_models/optuna_search_mult_quant_reg.py:75: UserWarning: The distribution is specified by [0.1, 5] and step=0.25, but the range is not divisible by `step`. It will be replaced with [0.1, 4.85].
  error_threshold = trial.suggest_float("error_threshold", 0.1, 5, step=0.25)
[I 2026-07-20 14:30:00,831] Trial 4 finished with value: -0.09189181303715077 and parameters: {'error_threshold': 1.6, 'scalers': 'none', 'ratios': 'log_ratio', 'imputers': 'mean', 'n_estimators': 1350, 'learning_rate': 0.022257705775749773, 'max_depth': 6, 'min_child_weight': 4, 'subsample': 1.0, 'colsample_bytree': 1.0, 'colsample_bylevel': 0.6, 'reg_alpha': 0.5134212467061627, 'reg_lambda': 40.073889683516356, 'gamma': 36.58490926609062}. Best is trial 4 with value: -0.09189181303715077.
/bsuhome/alexanderemert/Research/Star-Formation-Research-Project-2026/pipeline/scripts/optuna/final_preds_and_models/optuna_search_mult_quant_reg.py:75: UserWarning: The distribution is specified by [0.1, 5] and step=0.25, but the range is not divisible by `step`. It will be replaced with [0.1, 4.85].
  error_threshold = trial.suggest_float("error_threshold", 0.1, 5, step=0.25)
[I 2026-07-20 14:30:01,891] Trial 5 finished with value: -0.0919082105075662 and parameters: {'error_threshold': 0.85, 'scalers': 'robust', 'ratios': 'log_ratio', 'imputers': 'mean', 'n_estimators': 1750, 'learning_rate': 0.13595259585724326, 'max_depth': 3, 'min_child_weight': 6, 'subsample': 0.9, 'colsample_bytree': 0.9, 'colsample_bylevel': 0.6, 'reg_alpha': 0.058107895517383344, 'reg_lambda': 0.0004994457614751118, 'gamma': 46.34882504155788}. Best is trial 5 with value: -0.0919082105075662.
/bsuhome/alexanderemert/Research/Star-Formation-Research-Project-2026/pipeline/scripts/optuna/final_preds_and_models/optuna_search_mult_quant_reg.py:75: UserWarning: The distribution is specified by [0.1, 5] and step=0.25, but the range is not divisible by `step`. It will be replaced with [0.1, 4.85].
  error_threshold = trial.suggest_float("error_threshold", 0.1, 5, step=0.25)
[I 2026-07-20 14:30:07,980] Trial 6 finished with value: -0.09810285324674928 and parameters: {'error_threshold': 4.85, 'scalers': 'standard', 'ratios': 'log_ratio', 'imputers': 'median', 'n_estimators': 1400, 'learning_rate': 0.0009789961699369627, 'max_depth': 7, 'min_child_weight': 2, 'subsample': 0.8, 'colsample_bytree': 0.5, 'colsample_bylevel': 0.7, 'reg_alpha': 0.27125256325162206, 'reg_lambda': 0.0002467989309290205, 'gamma': 1.4549952951465583}. Best is trial 6 with value: -0.09810285324674928.
/bsuhome/alexanderemert/Research/Star-Formation-Research-Project-2026/pipeline/scripts/optuna/final_preds_and_models/optuna_search_mult_quant_reg.py:75: UserWarning: The distribution is specified by [0.1, 5] and step=0.25, but the range is not divisible by `step`. It will be replaced with [0.1, 4.85].
  error_threshold = trial.suggest_float("error_threshold", 0.1, 5, step=0.25)
[I 2026-07-20 14:30:08,847] Trial 1 finished with value: -0.0780068383123663 and parameters: {'error_threshold': 2.6, 'scalers': 'standard', 'ratios': 'log_ratio', 'imputers': 'mean', 'n_estimators': 1500, 'learning_rate': 0.002156385507861929, 'max_depth': 11, 'min_child_weight': 8, 'subsample': 0.7, 'colsample_bytree': 0.5, 'colsample_bylevel': 0.7, 'reg_alpha': 3.165058474718025e-05, 'reg_lambda': 0.0880046609207677, 'gamma': 0.8017473634651354}. Best is trial 6 with value: -0.09810285324674928.
/bsuhome/alexanderemert/Research/Star-Formation-Research-Project-2026/pipeline/scripts/optuna/final_preds_and_models/optuna_search_mult_quant_reg.py:75: UserWarning: The distribution is specified by [0.1, 5] and step=0.25, but the range is not divisible by `step`. It will be replaced with [0.1, 4.85].
  error_threshold = trial.suggest_float("error_threshold", 0.1, 5, step=0.25)
[I 2026-07-20 14:30:10,965] Trial 0 finished with value: -0.06577281038238723 and parameters: {'error_threshold': 3.35, 'scalers': 'none', 'ratios': 'log_ratio', 'imputers': 'none', 'n_estimators': 1150, 'learning_rate': 0.09196389943278581, 'max_depth': 6, 'min_child_weight': 10, 'subsample': 0.9, 'colsample_bytree': 0.7, 'colsample_bylevel': 0.6, 'reg_alpha': 0.0026299669827513895, 'reg_lambda': 0.04709812447250375, 'gamma': 8.209845629759518e-06}. Best is trial 6 with value: -0.09810285324674928.
/bsuhome/alexanderemert/Research/Star-Formation-Research-Project-2026/pipeline/scripts/optuna/final_preds_and_models/optuna_search_mult_quant_reg.py:75: UserWarning: The distribution is specified by [0.1, 5] and step=0.25, but the range is not divisible by `step`. It will be replaced with [0.1, 4.85].
  error_threshold = trial.suggest_float("error_threshold", 0.1, 5, step=0.25)
[I 2026-07-20 14:30:13,825] Trial 7 finished with value: -0.08442358251711257 and parameters: {'error_threshold': 2.1, 'scalers': 'none', 'ratios': 'log_ratio', 'imputers': 'mean', 'n_estimators': 1350, 'learning_rate': 0.0015510097130943413, 'max_depth': 7, 'min_child_weight': 4, 'subsample': 1.0, 'colsample_bytree': 0.5, 'colsample_bylevel': 0.6, 'reg_alpha': 0.0038933726928395995, 'reg_lambda': 4.929354287217223, 'gamma': 2.0710587791987473e-05}. Best is trial 6 with value: -0.09810285324674928.
/bsuhome/alexanderemert/Research/Star-Formation-Research-Project-2026/pipeline/scripts/optuna/final_preds_and_models/optuna_search_mult_quant_reg.py:75: UserWarning: The distribution is specified by [0.1, 5] and step=0.25, but the range is not divisible by `step`. It will be replaced with [0.1, 4.85].
  error_threshold = trial.suggest_float("error_threshold", 0.1, 5, step=0.25)
[I 2026-07-20 14:30:16,617] Trial 3 finished with value: -0.06213468830847888 and parameters: {'error_threshold': 2.6, 'scalers': 'robust', 'ratios': 'norm_ratio', 'imputers': 'median', 'n_estimators': 700, 'learning_rate': 0.00888051391235536, 'max_depth': 9, 'min_child_weight': 10, 'subsample': 0.9, 'colsample_bytree': 0.9, 'colsample_bylevel': 0.8, 'reg_alpha': 0.08533125397727762, 'reg_lambda': 0.011146086752805777, 'gamma': 1.7883149386550444e-05}. Best is trial 6 with value: -0.09810285324674928.
/bsuhome/alexanderemert/Research/Star-Formation-Research-Project-2026/pipeline/scripts/optuna/final_preds_and_models/optuna_search_mult_quant_reg.py:75: UserWarning: The distribution is specified by [0.1, 5] and step=0.25, but the range is not divisible by `step`. It will be replaced with [0.1, 4.85].
  error_threshold = trial.suggest_float("error_threshold", 0.1, 5, step=0.25)
[I 2026-07-20 14:30:27,848] Trial 2 finished with value: -0.07043797264021391 and parameters: {'error_threshold': 0.6, 'scalers': 'none', 'ratios': 'log_ratio', 'imputers': 'none', 'n_estimators': 1150, 'learning_rate': 0.07019957717319769, 'max_depth': 8, 'min_child_weight': 4, 'subsample': 0.9, 'colsample_bytree': 0.6, 'colsample_bylevel': 1.0, 'reg_alpha': 0.00039320365636833014, 'reg_lambda': 0.014363990842845337, 'gamma': 7.40429826850985e-06}. Best is trial 6 with value: -0.09810285324674928.
/bsuhome/alexanderemert/Research/Star-Formation-Research-Project-2026/pipeline/scripts/optuna/final_preds_and_models/optuna_search_mult_quant_reg.py:75: UserWarning: The distribution is specified by [0.1, 5] and step=0.25, but the range is not divisible by `step`. It will be replaced with [0.1, 4.85].
  error_threshold = trial.suggest_float("error_threshold", 0.1, 5, step=0.25)
[I 2026-07-20 14:31:10,559] Trial 11 finished with value: -0.11471679768708655 and parameters: {'error_threshold': 0.1, 'scalers': 'none', 'ratios': 'norm_ratio', 'imputers': 'mean', 'n_estimators': 600, 'learning_rate': 0.0008461312186882732, 'max_depth': 11, 'min_child_weight': 2, 'subsample': 0.5, 'colsample_bytree': 1.0, 'colsample_bylevel': 0.9, 'reg_alpha': 0.012915283551539324, 'reg_lambda': 71.11787795737024, 'gamma': 8.797779556005038}. Best is trial 11 with value: -0.11471679768708655.
/bsuhome/alexanderemert/Research/Star-Formation-Research-Project-2026/pipeline/scripts/optuna/final_preds_and_models/optuna_search_mult_quant_reg.py:75: UserWarning: The distribution is specified by [0.1, 5] and step=0.25, but the range is not divisible by `step`. It will be replaced with [0.1, 4.85].
  error_threshold = trial.suggest_float("error_threshold", 0.1, 5, step=0.25)
[I 2026-07-20 14:31:22,070] Trial 10 finished with value: -0.06642132937692652 and parameters: {'error_threshold': 1.1, 'scalers': 'standard', 'ratios': 'norm_ratio', 'imputers': 'mean', 'n_estimators': 2950, 'learning_rate': 0.4732864106149202, 'max_depth': 8, 'min_child_weight': 10, 'subsample': 1.0, 'colsample_bytree': 1.0, 'colsample_bylevel': 0.8, 'reg_alpha': 0.002501814551809494, 'reg_lambda': 2.740531646313715e-05, 'gamma': 2.2271455307829435}. Best is trial 11 with value: -0.11471679768708655.
/bsuhome/alexanderemert/Research/Star-Formation-Research-Project-2026/pipeline/scripts/optuna/final_preds_and_models/optuna_search_mult_quant_reg.py:75: UserWarning: The distribution is specified by [0.1, 5] and step=0.25, but the range is not divisible by `step`. It will be replaced with [0.1, 4.85].
  error_threshold = trial.suggest_float("error_threshold", 0.1, 5, step=0.25)
[I 2026-07-20 14:31:30,812] Trial 9 finished with value: -0.1259978769879854 and parameters: {'error_threshold': 3.1, 'scalers': 'standard', 'ratios': 'norm_ratio', 'imputers': 'mean', 'n_estimators': 1100, 'learning_rate': 0.0001297951193019435, 'max_depth': 11, 'min_child_weight': 9, 'subsample': 0.7, 'colsample_bytree': 0.9, 'colsample_bylevel': 1.0, 'reg_alpha': 7.284249043987374e-05, 'reg_lambda': 0.06669634114231722, 'gamma': 0.0610359352085106}. Best is trial 9 with value: -0.1259978769879854.
/bsuhome/alexanderemert/Research/Star-Formation-Research-Project-2026/pipeline/scripts/optuna/final_preds_and_models/optuna_search_mult_quant_reg.py:75: UserWarning: The distribution is specified by [0.1, 5] and step=0.25, but the range is not divisible by `step`. It will be replaced with [0.1, 4.85].
  error_threshold = trial.suggest_float("error_threshold", 0.1, 5, step=0.25)
[I 2026-07-20 14:31:34,711] Trial 15 finished with value: -0.08142307630595876 and parameters: {'error_threshold': 2.35, 'scalers': 'none', 'ratios': 'log_ratio', 'imputers': 'none', 'n_estimators': 150, 'learning_rate': 0.008490934359754555, 'max_depth': 7, 'min_child_weight': 8, 'subsample': 0.5, 'colsample_bytree': 0.9, 'colsample_bylevel': 0.7, 'reg_alpha': 0.0004969129312178924, 'reg_lambda': 0.0002412212366814132, 'gamma': 0.062838886211996}. Best is trial 9 with value: -0.1259978769879854.
/bsuhome/alexanderemert/Research/Star-Formation-Research-Project-2026/pipeline/scripts/optuna/final_preds_and_models/optuna_search_mult_quant_reg.py:75: UserWarning: The distribution is specified by [0.1, 5] and step=0.25, but the range is not divisible by `step`. It will be replaced with [0.1, 4.85].
  error_threshold = trial.suggest_float("error_threshold", 0.1, 5, step=0.25)
[I 2026-07-20 14:31:34,724] Trial 8 finished with value: -0.06462958868179648 and parameters: {'error_threshold': 4.1, 'scalers': 'robust', 'ratios': 'log_ratio', 'imputers': 'mean', 'n_estimators': 800, 'learning_rate': 0.006365170932749695, 'max_depth': 11, 'min_child_weight': 3, 'subsample': 0.8, 'colsample_bytree': 0.9, 'colsample_bylevel': 0.6, 'reg_alpha': 0.00012877174977150158, 'reg_lambda': 1.0136303308884638, 'gamma': 9.319013189942586e-05}. Best is trial 9 with value: -0.1259978769879854.
[I 2026-07-20 14:31:41,092] Trial 12 finished with value: -0.09839716557474916 and parameters: {'error_threshold': 2.35, 'scalers': 'none', 'ratios': 'log_ratio', 'imputers': 'median', 'n_estimators': 2600, 'learning_rate': 0.00026910923728468047, 'max_depth': 5, 'min_child_weight': 6, 'subsample': 0.5, 'colsample_bytree': 0.8, 'colsample_bylevel': 0.9, 'reg_alpha': 0.00029234727273011826, 'reg_lambda': 0.0010451757963696722, 'gamma': 6.576517775738001e-05}. Best is trial 9 with value: -0.1259978769879854.
/bsuhome/alexanderemert/Research/Star-Formation-Research-Project-2026/pipeline/scripts/optuna/final_preds_and_models/optuna_search_mult_quant_reg.py:75: UserWarning: The distribution is specified by [0.1, 5] and step=0.25, but the range is not divisible by `step`. It will be replaced with [0.1, 4.85].
  error_threshold = trial.suggest_float("error_threshold", 0.1, 5, step=0.25)
[I 2026-07-20 14:31:46,418] Trial 13 finished with value: -0.09541113942239154 and parameters: {'error_threshold': 2.6, 'scalers': 'none', 'ratios': 'log_ratio', 'imputers': 'mean', 'n_estimators': 2500, 'learning_rate': 0.0005711472879855723, 'max_depth': 8, 'min_child_weight': 5, 'subsample': 0.7, 'colsample_bytree': 0.5, 'colsample_bylevel': 0.5, 'reg_alpha': 0.00028987463861438324, 'reg_lambda': 0.06154906509520691, 'gamma': 0.009860341572688204}. Best is trial 9 with value: -0.1259978769879854.
/bsuhome/alexanderemert/Research/Star-Formation-Research-Project-2026/pipeline/scripts/optuna/final_preds_and_models/optuna_search_mult_quant_reg.py:75: UserWarning: The distribution is specified by [0.1, 5] and step=0.25, but the range is not divisible by `step`. It will be replaced with [0.1, 4.85].
  error_threshold = trial.suggest_float("error_threshold", 0.1, 5, step=0.25)
[I 2026-07-20 14:31:51,315] Trial 14 finished with value: -0.06793248331890714 and parameters: {'error_threshold': 4.85, 'scalers': 'standard', 'ratios': 'norm_ratio', 'imputers': 'mean', 'n_estimators': 2850, 'learning_rate': 0.09391686689211476, 'max_depth': 5, 'min_child_weight': 5, 'subsample': 1.0, 'colsample_bytree': 0.6, 'colsample_bylevel': 1.0, 'reg_alpha': 2.349193548192488e-06, 'reg_lambda': 2.7604384073002817, 'gamma': 0.00026097638195436175}. Best is trial 9 with value: -0.1259978769879854.
/bsuhome/alexanderemert/Research/Star-Formation-Research-Project-2026/pipeline/scripts/optuna/final_preds_and_models/optuna_search_mult_quant_reg.py:75: UserWarning: The distribution is specified by [0.1, 5] and step=0.25, but the range is not divisible by `step`. It will be replaced with [0.1, 4.85].
  error_threshold = trial.suggest_float("error_threshold", 0.1, 5, step=0.25)
[I 2026-07-20 14:32:07,422] Trial 16 finished with value: -0.11614996215003905 and parameters: {'error_threshold': 1.35, 'scalers': 'none', 'ratios': 'norm_ratio', 'imputers': 'mean', 'n_estimators': 2100, 'learning_rate': 0.0004211598987389077, 'max_depth': 7, 'min_child_weight': 1, 'subsample': 0.8, 'colsample_bytree': 0.7, 'colsample_bylevel': 0.8, 'reg_alpha': 6.021041049096975, 'reg_lambda': 0.002585626087233993, 'gamma': 36.106340032613666}. Best is trial 9 with value: -0.1259978769879854.
/bsuhome/alexanderemert/Research/Star-Formation-Research-Project-2026/pipeline/scripts/optuna/final_preds_and_models/optuna_search_mult_quant_reg.py:75: UserWarning: The distribution is specified by [0.1, 5] and step=0.25, but the range is not divisible by `step`. It will be replaced with [0.1, 4.85].
  error_threshold = trial.suggest_float("error_threshold", 0.1, 5, step=0.25)
[I 2026-07-20 14:32:09,731] Trial 18 finished with value: -0.1368228533315958 and parameters: {'error_threshold': 0.1, 'scalers': 'standard', 'ratios': 'norm_ratio', 'imputers': 'mean', 'n_estimators': 100, 'learning_rate': 0.0001300435212699425, 'max_depth': 12, 'min_child_weight': 1, 'subsample': 0.5, 'colsample_bytree': 0.8, 'colsample_bylevel': 1.0, 'reg_alpha': 32.38911239820283, 'reg_lambda': 3.695162068746436, 'gamma': 0.009138691603710919}. Best is trial 18 with value: -0.1368228533315958.
/bsuhome/alexanderemert/Research/Star-Formation-Research-Project-2026/pipeline/scripts/optuna/final_preds_and_models/optuna_search_mult_quant_reg.py:75: UserWarning: The distribution is specified by [0.1, 5] and step=0.25, but the range is not divisible by `step`. It will be replaced with [0.1, 4.85].
  error_threshold = trial.suggest_float("error_threshold", 0.1, 5, step=0.25)
[I 2026-07-20 14:32:10,894] Trial 17 finished with value: -0.13625571709687526 and parameters: {'error_threshold': 0.1, 'scalers': 'none', 'ratios': 'norm_ratio', 'imputers': 'median', 'n_estimators': 150, 'learning_rate': 0.00011420012740858108, 'max_depth': 12, 'min_child_weight': 1, 'subsample': 0.5, 'colsample_bytree': 0.8, 'colsample_bylevel': 1.0, 'reg_alpha': 1.4172515062337985e-06, 'reg_lambda': 1.8895816421620596e-06, 'gamma': 0.003272686861519658}. Best is trial 18 with value: -0.1368228533315958.
/bsuhome/alexanderemert/Research/Star-Formation-Research-Project-2026/pipeline/scripts/optuna/final_preds_and_models/optuna_search_mult_quant_reg.py:75: UserWarning: The distribution is specified by [0.1, 5] and step=0.25, but the range is not divisible by `step`. It will be replaced with [0.1, 4.85].
  error_threshold = trial.suggest_float("error_threshold", 0.1, 5, step=0.25)
[I 2026-07-20 14:32:11,591] Trial 19 finished with value: -0.13643124081927427 and parameters: {'error_threshold': 0.1, 'scalers': 'standard', 'ratios': 'norm_ratio', 'imputers': 'mean', 'n_estimators': 150, 'learning_rate': 0.00010156132604316129, 'max_depth': 12, 'min_child_weight': 1, 'subsample': 0.5, 'colsample_bytree': 0.8, 'colsample_bylevel': 1.0, 'reg_alpha': 1.3104604654922175e-06, 'reg_lambda': 83.09916484451861, 'gamma': 0.01249387004203705}. Best is trial 18 with value: -0.1368228533315958.
/bsuhome/alexanderemert/Research/Star-Formation-Research-Project-2026/pipeline/scripts/optuna/final_preds_and_models/optuna_search_mult_quant_reg.py:75: UserWarning: The distribution is specified by [0.1, 5] and step=0.25, but the range is not divisible by `step`. It will be replaced with [0.1, 4.85].
  error_threshold = trial.suggest_float("error_threshold", 0.1, 5, step=0.25)
[I 2026-07-20 14:32:18,230] Trial 21 finished with value: -0.13624690606602596 and parameters: {'error_threshold': 0.35, 'scalers': 'standard', 'ratios': 'norm_ratio', 'imputers': 'mean', 'n_estimators': 150, 'learning_rate': 0.00011339228891520158, 'max_depth': 12, 'min_child_weight': 1, 'subsample': 0.6, 'colsample_bytree': 0.8, 'colsample_bylevel': 1.0, 'reg_alpha': 1.4633164534686207e-06, 'reg_lambda': 1.0052921424294898, 'gamma': 0.005436175521335095}. Best is trial 18 with value: -0.1368228533315958.
/bsuhome/alexanderemert/Research/Star-Formation-Research-Project-2026/pipeline/scripts/optuna/final_preds_and_models/optuna_search_mult_quant_reg.py:75: UserWarning: The distribution is specified by [0.1, 5] and step=0.25, but the range is not divisible by `step`. It will be replaced with [0.1, 4.85].
  error_threshold = trial.suggest_float("error_threshold", 0.1, 5, step=0.25)
[I 2026-07-20 14:32:18,256] Trial 23 finished with value: -0.13705033781746384 and parameters: {'error_threshold': 0.1, 'scalers': 'standard', 'ratios': 'norm_ratio', 'imputers': 'mean', 'n_estimators': 100, 'learning_rate': 0.00010394813764288043, 'max_depth': 12, 'min_child_weight': 1, 'subsample': 0.6, 'colsample_bytree': 0.8, 'colsample_bylevel': 0.9, 'reg_alpha': 39.15989676485264, 'reg_lambda': 1.0173279132725065e-06, 'gamma': 0.003719402245960935}. Best is trial 23 with value: -0.13705033781746384.
/bsuhome/alexanderemert/Research/Star-Formation-Research-Project-2026/pipeline/scripts/optuna/final_preds_and_models/optuna_search_mult_quant_reg.py:75: UserWarning: The distribution is specified by [0.1, 5] and step=0.25, but the range is not divisible by `step`. It will be replaced with [0.1, 4.85].
  error_threshold = trial.suggest_float("error_threshold", 0.1, 5, step=0.25)
[I 2026-07-20 14:32:23,931] Trial 22 finished with value: -0.13547111679924728 and parameters: {'error_threshold': 0.1, 'scalers': 'standard', 'ratios': 'norm_ratio', 'imputers': 'mean', 'n_estimators': 250, 'learning_rate': 0.00010873641686779507, 'max_depth': 12, 'min_child_weight': 1, 'subsample': 0.6, 'colsample_bytree': 0.8, 'colsample_bylevel': 1.0, 'reg_alpha': 1.2448771349772585e-06, 'reg_lambda': 1.2354862130354781e-06, 'gamma': 0.004694208016707244}. Best is trial 23 with value: -0.13705033781746384.
/bsuhome/alexanderemert/Research/Star-Formation-Research-Project-2026/pipeline/scripts/optuna/final_preds_and_models/optuna_search_mult_quant_reg.py:75: UserWarning: The distribution is specified by [0.1, 5] and step=0.25, but the range is not divisible by `step`. It will be replaced with [0.1, 4.85].
  error_threshold = trial.suggest_float("error_threshold", 0.1, 5, step=0.25)
[I 2026-07-20 14:32:27,562] Trial 25 finished with value: -0.13564405674343094 and parameters: {'error_threshold': 3.35, 'scalers': 'standard', 'ratios': 'norm_ratio', 'imputers': 'none', 'n_estimators': 100, 'learning_rate': 0.00023390646149674032, 'max_depth': 12, 'min_child_weight': 8, 'subsample': 0.6, 'colsample_bytree': 0.8, 'colsample_bylevel': 1.0, 'reg_alpha': 6.281680058612184, 'reg_lambda': 0.42159162208405593, 'gamma': 0.002374057953059541}. Best is trial 23 with value: -0.13705033781746384.
/bsuhome/alexanderemert/Research/Star-Formation-Research-Project-2026/pipeline/scripts/optuna/final_preds_and_models/optuna_search_mult_quant_reg.py:75: UserWarning: The distribution is specified by [0.1, 5] and step=0.25, but the range is not divisible by `step`. It will be replaced with [0.1, 4.85].
  error_threshold = trial.suggest_float("error_threshold", 0.1, 5, step=0.25)
