[I 2026-07-20 13:39:04,310] Trial 600 finished with value: -0.24377955888372835 and parameters: {'error_threshold': 0.25, 'scalers': 'robust', 'ratios': 'log_ratio', 'imputers': 'none', 'n_estimators': 400, 'learning_rate': 0.0012947620523500274, 'max_depth': 5, 'min_child_weight': 10, 'subsample': 0.7, 'colsample_bytree': 1.0, 'colsample_bylevel': 0.6, 'reg_alpha': 98.2781581659747, 'reg_lambda': 54.65455658853704, 'gamma': 49.48226823091338}. Best is trial 370 with value: -0.24379341779244815.
[I 2026-07-20 13:39:04,825] Trial 601 finished with value: -0.24379015186370465 and parameters: {'error_threshold': 0.25, 'scalers': 'robust', 'ratios': 'log_ratio', 'imputers': 'none', 'n_estimators': 400, 'learning_rate': 0.00032485918069619427, 'max_depth': 5, 'min_child_weight': 10, 'subsample': 0.7, 'colsample_bytree': 1.0, 'colsample_bylevel': 0.6, 'reg_alpha': 99.09557352928829, 'reg_lambda': 55.45244177785241, 'gamma': 47.805782344686556}. Best is trial 370 with value: -0.24379341779244815.
[I 2026-07-20 13:39:05,056] Trial 602 finished with value: -0.24379002865131275 and parameters: {'error_threshold': 0.25, 'scalers': 'robust', 'ratios': 'log_ratio', 'imputers': 'none', 'n_estimators': 400, 'learning_rate': 0.00033399450678362104, 'max_depth': 5, 'min_child_weight': 10, 'subsample': 0.7, 'colsample_bytree': 0.8, 'colsample_bylevel': 0.6, 'reg_alpha': 69.45229698616848, 'reg_lambda': 58.14949272788955, 'gamma': 96.81799013113242}. Best is trial 370 with value: -0.24379341779244815.
[I 2026-07-20 13:39:05,745] Trial 603 finished with value: -0.2437900465232481 and parameters: {'error_threshold': 0.25, 'scalers': 'robust', 'ratios': 'log_ratio', 'imputers': 'none', 'n_estimators': 400, 'learning_rate': 0.00033285048236222654, 'max_depth': 5, 'min_child_weight': 10, 'subsample': 0.7, 'colsample_bytree': 0.8, 'colsample_bylevel': 0.6, 'reg_alpha': 99.48047550065546, 'reg_lambda': 57.69636364591535, 'gamma': 46.95124627898295}. Best is trial 370 with value: -0.24379341779244815.
[I 2026-07-20 13:39:06,922] Trial 604 finished with value: -0.24145199850188495 and parameters: {'error_threshold': 0.25, 'scalers': 'robust', 'ratios': 'log_ratio', 'imputers': 'none', 'n_estimators': 350, 'learning_rate': 0.0003402578327951968, 'max_depth': 5, 'min_child_weight': 10, 'subsample': 0.7, 'colsample_bytree': 0.9, 'colsample_bylevel': 0.6, 'reg_alpha': 16.530918426803538, 'reg_lambda': 57.25698504537005, 'gamma': 77.9865527297682}. Best is trial 370 with value: -0.24379341779244815.
[I 2026-07-20 13:39:08,262] Trial 606 finished with value: -0.2437906509379418 and parameters: {'error_threshold': 0.25, 'scalers': 'robust', 'ratios': 'log_ratio', 'imputers': 'none', 'n_estimators': 350, 'learning_rate': 0.0003338266791394356, 'max_depth': 6, 'min_child_weight': 10, 'subsample': 0.7, 'colsample_bytree': 0.8, 'colsample_bylevel': 0.6, 'reg_alpha': 54.83897643819745, 'reg_lambda': 53.53849241365965, 'gamma': 78.90485626448778}. Best is trial 370 with value: -0.24379341779244815.
[I 2026-07-20 13:39:10,365] Trial 605 finished with value: -0.24377767299944175 and parameters: {'error_threshold': 0.25, 'scalers': 'robust', 'ratios': 'log_ratio', 'imputers': 'none', 'n_estimators': 1650, 'learning_rate': 0.00033766514404640974, 'max_depth': 6, 'min_child_weight': 10, 'subsample': 0.7, 'colsample_bytree': 0.8, 'colsample_bylevel': 0.6, 'reg_alpha': 67.61869731875235, 'reg_lambda': 61.42030678868526, 'gamma': 94.73903553525896}. Best is trial 370 with value: -0.24379341779244815.
[I 2026-07-20 13:39:10,956] Trial 607 finished with value: -0.24357136808573776 and parameters: {'error_threshold': 0.25, 'scalers': 'robust', 'ratios': 'log_ratio', 'imputers': 'none', 'n_estimators': 350, 'learning_rate': 0.0005259433608488485, 'max_depth': 5, 'min_child_weight': 10, 'subsample': 0.7, 'colsample_bytree': 0.8, 'colsample_bylevel': 0.6, 'reg_alpha': 14.513534476475323, 'reg_lambda': 29.13147229955043, 'gamma': 96.40059997135509}. Best is trial 370 with value: -0.24379341779244815.
[I 2026-07-20 13:39:12,245] Trial 608 finished with value: -0.24378649044999298 and parameters: {'error_threshold': 0.25, 'scalers': 'robust', 'ratios': 'log_ratio', 'imputers': 'none', 'n_estimators': 500, 'learning_rate': 0.0005155898100261402, 'max_depth': 5, 'min_child_weight': 10, 'subsample': 0.7, 'colsample_bytree': 0.8, 'colsample_bylevel': 0.6, 'reg_alpha': 51.54875210174769, 'reg_lambda': 0.012918868594679736, 'gamma': 96.05249030655493}. Best is trial 370 with value: -0.24379341779244815.
[I 2026-07-20 13:39:12,479] Trial 609 finished with value: -0.2437801116378975 and parameters: {'error_threshold': 0.25, 'scalers': 'robust', 'ratios': 'log_ratio', 'imputers': 'none', 'n_estimators': 400, 'learning_rate': 0.0012322820156466115, 'max_depth': 5, 'min_child_weight': 10, 'subsample': 0.7, 'colsample_bytree': 0.9, 'colsample_bylevel': 0.6, 'reg_alpha': 45.91664460933587, 'reg_lambda': 56.42299560548744, 'gamma': 96.71940666020802}. Best is trial 370 with value: -0.24379341779244815.
[I 2026-07-20 13:39:13,140] Trial 610 finished with value: -0.24344505891172982 and parameters: {'error_threshold': 0.25, 'scalers': 'robust', 'ratios': 'log_ratio', 'imputers': 'none', 'n_estimators': 550, 'learning_rate': 0.00035449876212204865, 'max_depth': 5, 'min_child_weight': 10, 'subsample': 0.7, 'colsample_bytree': 0.8, 'colsample_bylevel': 0.6, 'reg_alpha': 14.748851996872416, 'reg_lambda': 58.07575346357193, 'gamma': 91.81069781778118}. Best is trial 370 with value: -0.24379341779244815.
[I 2026-07-20 13:39:14,064] Trial 611 finished with value: -0.24378845429821297 and parameters: {'error_threshold': 0.25, 'scalers': 'robust', 'ratios': 'log_ratio', 'imputers': 'none', 'n_estimators': 550, 'learning_rate': 0.0003272203421024885, 'max_depth': 5, 'min_child_weight': 10, 'subsample': 0.7, 'colsample_bytree': 0.8, 'colsample_bylevel': 0.6, 'reg_alpha': 44.57896439893413, 'reg_lambda': 29.62290272396118, 'gamma': 86.57446995668565}. Best is trial 370 with value: -0.24379341779244815.
[I 2026-07-20 13:39:14,420] Trial 612 finished with value: -0.24378860534725522 and parameters: {'error_threshold': 0.25, 'scalers': 'robust', 'ratios': 'log_ratio', 'imputers': 'none', 'n_estimators': 550, 'learning_rate': 0.0003190707544020111, 'max_depth': 5, 'min_child_weight': 10, 'subsample': 0.7, 'colsample_bytree': 0.8, 'colsample_bylevel': 0.6, 'reg_alpha': 41.700993531978924, 'reg_lambda': 34.35874917770914, 'gamma': 97.14172619459596}. Best is trial 370 with value: -0.24379341779244815.
[I 2026-07-20 13:39:16,147] Trial 613 finished with value: -0.2437890653249398 and parameters: {'error_threshold': 0.25, 'scalers': 'robust', 'ratios': 'log_ratio', 'imputers': 'none', 'n_estimators': 500, 'learning_rate': 0.00034044788127428756, 'max_depth': 5, 'min_child_weight': 10, 'subsample': 0.7, 'colsample_bytree': 0.8, 'colsample_bylevel': 0.6, 'reg_alpha': 39.877745248467, 'reg_lambda': 28.767692490278627, 'gamma': 98.84083601583083}. Best is trial 370 with value: -0.24379341779244815.
[I 2026-07-20 13:39:17,607] Trial 614 finished with value: -0.2437892347748102 and parameters: {'error_threshold': 0.25, 'scalers': 'robust', 'ratios': 'log_ratio', 'imputers': 'none', 'n_estimators': 500, 'learning_rate': 0.0003291788854445053, 'max_depth': 5, 'min_child_weight': 10, 'subsample': 0.7, 'colsample_bytree': 0.8, 'colsample_bylevel': 0.6, 'reg_alpha': 39.980246421222034, 'reg_lambda': 28.517754971859837, 'gamma': 92.82514260374937}. Best is trial 370 with value: -0.24379341779244815.
[I 2026-07-20 13:39:18,209] Trial 615 finished with value: -0.2437884363009546 and parameters: {'error_threshold': 0.25, 'scalers': 'robust', 'ratios': 'log_ratio', 'imputers': 'none', 'n_estimators': 550, 'learning_rate': 0.0003282694994822249, 'max_depth': 5, 'min_child_weight': 10, 'subsample': 0.7, 'colsample_bytree': 0.8, 'colsample_bylevel': 0.6, 'reg_alpha': 39.71391760718849, 'reg_lambda': 35.48788460910765, 'gamma': 98.2295080411648}. Best is trial 370 with value: -0.24379341779244815.
[I 2026-07-20 13:39:19,411] Trial 616 finished with value: -0.24378966103930333 and parameters: {'error_threshold': 0.25, 'scalers': 'robust', 'ratios': 'log_ratio', 'imputers': 'none', 'n_estimators': 450, 'learning_rate': 0.0003318562906828506, 'max_depth': 5, 'min_child_weight': 10, 'subsample': 0.7, 'colsample_bytree': 0.8, 'colsample_bylevel': 0.6, 'reg_alpha': 37.69350242497901, 'reg_lambda': 34.162185937066944, 'gamma': 96.48574695469381}. Best is trial 370 with value: -0.24379341779244815.
[I 2026-07-20 13:39:19,676] Trial 617 finished with value: -0.24378968634936046 and parameters: {'error_threshold': 0.25, 'scalers': 'robust', 'ratios': 'log_ratio', 'imputers': 'none', 'n_estimators': 450, 'learning_rate': 0.0003295389359277083, 'max_depth': 5, 'min_child_weight': 10, 'subsample': 0.7, 'colsample_bytree': 0.8, 'colsample_bylevel': 0.6, 'reg_alpha': 40.27888651336664, 'reg_lambda': 34.71108091200529, 'gamma': 99.59308825642684}. Best is trial 370 with value: -0.24379341779244815.
[I 2026-07-20 13:39:20,248] Trial 618 finished with value: -0.24379015607481833 and parameters: {'error_threshold': 0.25, 'scalers': 'robust', 'ratios': 'log_ratio', 'imputers': 'none', 'n_estimators': 400, 'learning_rate': 0.00032454231163202876, 'max_depth': 5, 'min_child_weight': 10, 'subsample': 0.7, 'colsample_bytree': 0.8, 'colsample_bylevel': 0.6, 'reg_alpha': 40.459369385031046, 'reg_lambda': 33.912309506399204, 'gamma': 99.31622717515232}. Best is trial 370 with value: -0.24379341779244815.
[I 2026-07-20 13:39:21,122] Trial 619 finished with value: -0.24379037213256627 and parameters: {'error_threshold': 0.25, 'scalers': 'robust', 'ratios': 'log_ratio', 'imputers': 'none', 'n_estimators': 500, 'learning_rate': 0.0002572849935073472, 'max_depth': 5, 'min_child_weight': 10, 'subsample': 0.7, 'colsample_bytree': 0.8, 'colsample_bylevel': 0.6, 'reg_alpha': 37.37574407823304, 'reg_lambda': 37.36098001929927, 'gamma': 96.73636756601813}. Best is trial 370 with value: -0.24379341779244815.
[I 2026-07-20 13:39:21,462] Trial 620 finished with value: -0.24378893965439144 and parameters: {'error_threshold': 0.25, 'scalers': 'robust', 'ratios': 'log_ratio', 'imputers': 'none', 'n_estimators': 500, 'learning_rate': 0.0003486586012170622, 'max_depth': 5, 'min_child_weight': 10, 'subsample': 0.7, 'colsample_bytree': 0.8, 'colsample_bylevel': 0.6, 'reg_alpha': 37.48452666297648, 'reg_lambda': 38.14600180248167, 'gamma': 97.11431268977456}. Best is trial 370 with value: -0.24379341779244815.
[I 2026-07-20 13:39:23,761] Trial 621 finished with value: -0.2437905134933626 and parameters: {'error_threshold': 0.25, 'scalers': 'robust', 'ratios': 'log_ratio', 'imputers': 'none', 'n_estimators': 500, 'learning_rate': 0.00024853641114345364, 'max_depth': 5, 'min_child_weight': 10, 'subsample': 0.7, 'colsample_bytree': 0.8, 'colsample_bylevel': 0.6, 'reg_alpha': 30.640497155628594, 'reg_lambda': 26.213088061097626, 'gamma': 99.72005852120004}. Best is trial 370 with value: -0.24379341779244815.
[I 2026-07-20 13:39:25,724] Trial 622 finished with value: -0.2361372394263592 and parameters: {'error_threshold': 0.25, 'scalers': 'robust', 'ratios': 'log_ratio', 'imputers': 'none', 'n_estimators': 500, 'learning_rate': 0.0002676572022048966, 'max_depth': 5, 'min_child_weight': 10, 'subsample': 0.7, 'colsample_bytree': 0.8, 'colsample_bylevel': 0.6, 'reg_alpha': 39.39019373489209, 'reg_lambda': 25.99753140631341, 'gamma': 0.0010077186525959234}. Best is trial 370 with value: -0.24379341779244815.
[I 2026-07-20 13:39:26,042] Trial 623 finished with value: -0.2437905354544042 and parameters: {'error_threshold': 0.25, 'scalers': 'robust', 'ratios': 'log_ratio', 'imputers': 'none', 'n_estimators': 500, 'learning_rate': 0.00024698883620779725, 'max_depth': 4, 'min_child_weight': 10, 'subsample': 0.7, 'colsample_bytree': 0.8, 'colsample_bylevel': 0.6, 'reg_alpha': 27.818679294856253, 'reg_lambda': 24.261120540919794, 'gamma': 99.54594022698065}. Best is trial 370 with value: -0.24379341779244815.
[I 2026-07-20 13:39:27,315] Trial 624 finished with value: -0.2437857055911017 and parameters: {'error_threshold': 0.25, 'scalers': 'robust', 'ratios': 'log_ratio', 'imputers': 'none', 'n_estimators': 500, 'learning_rate': 0.0003679606098054743, 'max_depth': 4, 'min_child_weight': 10, 'subsample': 0.7, 'colsample_bytree': 0.8, 'colsample_bylevel': 0.6, 'reg_alpha': 19.536942862649113, 'reg_lambda': 24.032661002836157, 'gamma': 99.38008068581449}. Best is trial 370 with value: -0.24379341779244815.
[I 2026-07-20 13:39:27,641] Trial 625 finished with value: -0.24060608053427257 and parameters: {'error_threshold': 0.25, 'scalers': 'robust', 'ratios': 'log_ratio', 'imputers': 'none', 'n_estimators': 500, 'learning_rate': 0.0002547650488380674, 'max_depth': 4, 'min_child_weight': 10, 'subsample': 0.7, 'colsample_bytree': 0.8, 'colsample_bylevel': 0.6, 'reg_alpha': 17.14226069745662, 'reg_lambda': 23.729430156190322, 'gamma': 75.30776068455684}. Best is trial 370 with value: -0.24379341779244815.
[I 2026-07-20 13:39:27,979] Trial 626 finished with value: -0.24378689122966926 and parameters: {'error_threshold': 0.25, 'scalers': 'robust', 'ratios': 'log_ratio', 'imputers': 'none', 'n_estimators': 600, 'learning_rate': 0.0002509273294101782, 'max_depth': 4, 'min_child_weight': 10, 'subsample': 0.7, 'colsample_bytree': 0.8, 'colsample_bylevel': 0.6, 'reg_alpha': 25.221790578789502, 'reg_lambda': 21.314049787077032, 'gamma': 96.78477978839454}. Best is trial 370 with value: -0.24379341779244815.
[I 2026-07-20 13:39:30,458] Trial 627 finished with value: -0.24378766108533623 and parameters: {'error_threshold': 0.25, 'scalers': 'robust', 'ratios': 'log_ratio', 'imputers': 'none', 'n_estimators': 500, 'learning_rate': 0.0002841588213545538, 'max_depth': 4, 'min_child_weight': 10, 'subsample': 0.7, 'colsample_bytree': 0.8, 'colsample_bylevel': 0.6, 'reg_alpha': 17.80825479089883, 'reg_lambda': 33.32687358635619, 'gamma': 99.30681448801353}. Best is trial 370 with value: -0.24379341779244815.
[I 2026-07-20 13:39:30,460] Trial 628 finished with value: -0.2437884257252461 and parameters: {'error_threshold': 0.25, 'scalers': 'robust', 'ratios': 'log_ratio', 'imputers': 'none', 'n_estimators': 500, 'learning_rate': 0.0002529431940465769, 'max_depth': 4, 'min_child_weight': 10, 'subsample': 0.7, 'colsample_bytree': 0.8, 'colsample_bylevel': 0.6, 'reg_alpha': 18.391041075849046, 'reg_lambda': 26.31366042618582, 'gamma': 99.37217868622056}. Best is trial 370 with value: -0.24379341779244815.
[I 2026-07-20 13:39:31,959] Trial 629 finished with value: -0.23858613266052842 and parameters: {'error_threshold': 0.25, 'scalers': 'robust', 'ratios': 'log_ratio', 'imputers': 'none', 'n_estimators': 600, 'learning_rate': 0.0002505412215452864, 'max_depth': 5, 'min_child_weight': 10, 'subsample': 0.7, 'colsample_bytree': 0.8, 'colsample_bylevel': 0.6, 'reg_alpha': 8.954464652974275, 'reg_lambda': 21.179668695005542, 'gamma': 71.98659428898515}. Best is trial 370 with value: -0.24379341779244815.
[I 2026-07-20 13:39:34,188] Trial 630 finished with value: -0.2437848112969249 and parameters: {'error_threshold': 0.25, 'scalers': 'robust', 'ratios': 'log_ratio', 'imputers': 'none', 'n_estimators': 600, 'learning_rate': 0.00025299257644672115, 'max_depth': 4, 'min_child_weight': 10, 'subsample': 0.7, 'colsample_bytree': 0.8, 'colsample_bylevel': 0.6, 'reg_alpha': 21.287687993255446, 'reg_lambda': 21.98509728586062, 'gamma': 98.66349926655349}. Best is trial 370 with value: -0.24379341779244815.
[I 2026-07-20 13:39:34,603] Trial 631 finished with value: -0.24378497732626422 and parameters: {'error_threshold': 0.25, 'scalers': 'robust', 'ratios': 'log_ratio', 'imputers': 'none', 'n_estimators': 650, 'learning_rate': 0.00023825448822188713, 'max_depth': 4, 'min_child_weight': 10, 'subsample': 0.7, 'colsample_bytree': 0.8, 'colsample_bylevel': 0.6, 'reg_alpha': 22.792890237555827, 'reg_lambda': 27.549565319892757, 'gamma': 97.61448902079168}. Best is trial 370 with value: -0.24379341779244815.
[I 2026-07-20 13:39:35,327] Trial 632 finished with value: -0.2434026508415403 and parameters: {'error_threshold': 0.25, 'scalers': 'robust', 'ratios': 'log_ratio', 'imputers': 'none', 'n_estimators': 600, 'learning_rate': 0.0002626297196917979, 'max_depth': 4, 'min_child_weight': 10, 'subsample': 0.7, 'colsample_bytree': 0.8, 'colsample_bylevel': 0.6, 'reg_alpha': 9.962393444801444, 'reg_lambda': 18.000388860197145, 'gamma': 99.37320105712497}. Best is trial 370 with value: -0.24379341779244815.
[I 2026-07-20 13:39:36,130] Trial 633 finished with value: -0.24113192021279928 and parameters: {'error_threshold': 0.25, 'scalers': 'robust', 'ratios': 'log_ratio', 'imputers': 'none', 'n_estimators': 600, 'learning_rate': 0.00025853153219959466, 'max_depth': 3, 'min_child_weight': 2, 'subsample': 0.7, 'colsample_bytree': 0.8, 'colsample_bylevel': 0.6, 'reg_alpha': 23.158760290817828, 'reg_lambda': 20.895725890673095, 'gamma': 75.82254465358287}. Best is trial 370 with value: -0.24379341779244815.
[I 2026-07-20 13:39:36,982] Trial 634 finished with value: -0.24345819438575747 and parameters: {'error_threshold': 0.25, 'scalers': 'robust', 'ratios': 'log_ratio', 'imputers': 'none', 'n_estimators': 600, 'learning_rate': 0.00025669401048822055, 'max_depth': 3, 'min_child_weight': 10, 'subsample': 0.7, 'colsample_bytree': 0.8, 'colsample_bylevel': 0.6, 'reg_alpha': 9.714048781976176, 'reg_lambda': 20.22127381746751, 'gamma': 99.86965748196161}. Best is trial 370 with value: -0.24379341779244815.
[I 2026-07-20 13:39:38,369] Trial 636 finished with value: -0.23804068519686472 and parameters: {'error_threshold': 0.25, 'scalers': 'robust', 'ratios': 'log_ratio', 'imputers': 'none', 'n_estimators': 550, 'learning_rate': 0.0002562878086964668, 'max_depth': 4, 'min_child_weight': 10, 'subsample': 0.7, 'colsample_bytree': 0.8, 'colsample_bylevel': 0.6, 'reg_alpha': 24.932600718389164, 'reg_lambda': 28.38500362267461, 'gamma': 52.138252616366266}. Best is trial 370 with value: -0.24379341779244815.
[I 2026-07-20 13:39:38,710] Trial 635 finished with value: -0.2375193228716994 and parameters: {'error_threshold': 0.25, 'scalers': 'robust', 'ratios': 'log_ratio', 'imputers': 'none', 'n_estimators': 600, 'learning_rate': 0.00025129228266905897, 'max_depth': 3, 'min_child_weight': 2, 'subsample': 0.7, 'colsample_bytree': 0.8, 'colsample_bylevel': 0.6, 'reg_alpha': 11.430404213868485, 'reg_lambda': 20.96465621169765, 'gamma': 51.892394021282655}. Best is trial 370 with value: -0.24379341779244815.
[I 2026-07-20 13:39:39,831] Trial 637 finished with value: -0.23718151114046185 and parameters: {'error_threshold': 0.25, 'scalers': 'robust', 'ratios': 'log_ratio', 'imputers': 'none', 'n_estimators': 650, 'learning_rate': 0.00024853309315262385, 'max_depth': 3, 'min_child_weight': 2, 'subsample': 0.7, 'colsample_bytree': 0.8, 'colsample_bylevel': 0.6, 'reg_alpha': 24.62090592789842, 'reg_lambda': 20.192267701141457, 'gamma': 50.04940685189886}. Best is trial 370 with value: -0.24379341779244815.
[I 2026-07-20 13:39:40,095] Trial 638 finished with value: -0.23885058523300082 and parameters: {'error_threshold': 0.25, 'scalers': 'robust', 'ratios': 'log_ratio', 'imputers': 'none', 'n_estimators': 450, 'learning_rate': 0.0002637859344370291, 'max_depth': 5, 'min_child_weight': 10, 'subsample': 0.7, 'colsample_bytree': 0.8, 'colsample_bylevel': 0.6, 'reg_alpha': 25.48882347657853, 'reg_lambda': 20.35901781235751, 'gamma': 52.80518939687078}. Best is trial 370 with value: -0.24379341779244815.
