[I 2026-07-21 10:09:31,947] Trial 264 finished with value: -0.1795909899247969 and parameters: {'error_threshold': 2.6, 'scalers': 'standard', 'ratios': 'norm_ratio', 'imputers': 'mean', 'n_estimators': 2250, 'learning_rate': 0.008176930181307603, 'max_depth': 3, 'min_child_weight': 3, 'subsample': 0.5, 'colsample_bytree': 1.0, 'colsample_bylevel': 1.0, 'reg_alpha': 3.5360525175147734e-05, 'reg_lambda': 0.04459167018763212, 'gamma': 6.117135879020669e-06}. Best is trial 254 with value: -0.17915665564650896.
/bsuhome/alexanderemert/Research/Star-Formation-Research-Project-2026/pipeline/scripts/optuna/final_preds_and_models/optuna_search_mult_quant_reg.py:75: UserWarning: The distribution is specified by [0.1, 5] and step=0.25, but the range is not divisible by `step`. It will be replaced with [0.1, 4.85].
  error_threshold = trial.suggest_float("error_threshold", 0.1, 5, step=0.25)
[I 2026-07-21 10:09:37,099] Trial 265 finished with value: -0.17965127037858744 and parameters: {'error_threshold': 2.6, 'scalers': 'standard', 'ratios': 'norm_ratio', 'imputers': 'mean', 'n_estimators': 2250, 'learning_rate': 0.008380105103669233, 'max_depth': 3, 'min_child_weight': 3, 'subsample': 0.5, 'colsample_bytree': 1.0, 'colsample_bylevel': 1.0, 'reg_alpha': 3.167110553593432e-06, 'reg_lambda': 0.046940026064618105, 'gamma': 2.9103932375703773e-05}. Best is trial 254 with value: -0.17915665564650896.
/bsuhome/alexanderemert/Research/Star-Formation-Research-Project-2026/pipeline/scripts/optuna/final_preds_and_models/optuna_search_mult_quant_reg.py:75: UserWarning: The distribution is specified by [0.1, 5] and step=0.25, but the range is not divisible by `step`. It will be replaced with [0.1, 4.85].
  error_threshold = trial.suggest_float("error_threshold", 0.1, 5, step=0.25)
[I 2026-07-21 10:09:51,066] Trial 266 finished with value: -0.17945448833559974 and parameters: {'error_threshold': 2.6, 'scalers': 'standard', 'ratios': 'norm_ratio', 'imputers': 'mean', 'n_estimators': 1950, 'learning_rate': 0.008486535332636824, 'max_depth': 3, 'min_child_weight': 3, 'subsample': 0.5, 'colsample_bytree': 1.0, 'colsample_bylevel': 1.0, 'reg_alpha': 2.9432711853966542e-05, 'reg_lambda': 0.00568154690034171, 'gamma': 2.002314181517294e-05}. Best is trial 254 with value: -0.17915665564650896.
/bsuhome/alexanderemert/Research/Star-Formation-Research-Project-2026/pipeline/scripts/optuna/final_preds_and_models/optuna_search_mult_quant_reg.py:75: UserWarning: The distribution is specified by [0.1, 5] and step=0.25, but the range is not divisible by `step`. It will be replaced with [0.1, 4.85].
  error_threshold = trial.suggest_float("error_threshold", 0.1, 5, step=0.25)
[I 2026-07-21 10:09:59,073] Trial 267 finished with value: -0.17946216338387322 and parameters: {'error_threshold': 2.6, 'scalers': 'standard', 'ratios': 'norm_ratio', 'imputers': 'mean', 'n_estimators': 1950, 'learning_rate': 0.00844459285208194, 'max_depth': 3, 'min_child_weight': 3, 'subsample': 0.5, 'colsample_bytree': 1.0, 'colsample_bylevel': 1.0, 'reg_alpha': 3.744518827154991e-06, 'reg_lambda': 0.031136743427249616, 'gamma': 2.016425314255603e-05}. Best is trial 254 with value: -0.17915665564650896.
/bsuhome/alexanderemert/Research/Star-Formation-Research-Project-2026/pipeline/scripts/optuna/final_preds_and_models/optuna_search_mult_quant_reg.py:75: UserWarning: The distribution is specified by [0.1, 5] and step=0.25, but the range is not divisible by `step`. It will be replaced with [0.1, 4.85].
  error_threshold = trial.suggest_float("error_threshold", 0.1, 5, step=0.25)
[I 2026-07-21 10:10:09,688] Trial 268 finished with value: -0.18055825352376265 and parameters: {'error_threshold': 2.6, 'scalers': 'standard', 'ratios': 'norm_ratio', 'imputers': 'mean', 'n_estimators': 2000, 'learning_rate': 0.007988478033904442, 'max_depth': 4, 'min_child_weight': 3, 'subsample': 0.5, 'colsample_bytree': 1.0, 'colsample_bylevel': 1.0, 'reg_alpha': 3.247329111075283e-06, 'reg_lambda': 0.03383880060417312, 'gamma': 1.8508433733834025e-06}. Best is trial 254 with value: -0.17915665564650896.
/bsuhome/alexanderemert/Research/Star-Formation-Research-Project-2026/pipeline/scripts/optuna/final_preds_and_models/optuna_search_mult_quant_reg.py:75: UserWarning: The distribution is specified by [0.1, 5] and step=0.25, but the range is not divisible by `step`. It will be replaced with [0.1, 4.85].
  error_threshold = trial.suggest_float("error_threshold", 0.1, 5, step=0.25)
[I 2026-07-21 10:10:14,411] Trial 269 finished with value: -0.18056286256913512 and parameters: {'error_threshold': 2.6, 'scalers': 'standard', 'ratios': 'norm_ratio', 'imputers': 'mean', 'n_estimators': 2300, 'learning_rate': 0.00756561408475313, 'max_depth': 4, 'min_child_weight': 3, 'subsample': 0.5, 'colsample_bytree': 1.0, 'colsample_bylevel': 1.0, 'reg_alpha': 3.3284208261594672e-06, 'reg_lambda': 0.00509508874783006, 'gamma': 3.912701427906968e-06}. Best is trial 254 with value: -0.17915665564650896.
/bsuhome/alexanderemert/Research/Star-Formation-Research-Project-2026/pipeline/scripts/optuna/final_preds_and_models/optuna_search_mult_quant_reg.py:75: UserWarning: The distribution is specified by [0.1, 5] and step=0.25, but the range is not divisible by `step`. It will be replaced with [0.1, 4.85].
  error_threshold = trial.suggest_float("error_threshold", 0.1, 5, step=0.25)
[I 2026-07-21 10:10:32,618] Trial 270 finished with value: -0.1805480819866155 and parameters: {'error_threshold': 2.6, 'scalers': 'standard', 'ratios': 'norm_ratio', 'imputers': 'mean', 'n_estimators': 2300, 'learning_rate': 0.00757457212124751, 'max_depth': 4, 'min_child_weight': 3, 'subsample': 0.5, 'colsample_bytree': 1.0, 'colsample_bylevel': 1.0, 'reg_alpha': 3.1738459153848416e-06, 'reg_lambda': 0.0054320904161295714, 'gamma': 3.298619242267019e-06}. Best is trial 254 with value: -0.17915665564650896.
/bsuhome/alexanderemert/Research/Star-Formation-Research-Project-2026/pipeline/scripts/optuna/final_preds_and_models/optuna_search_mult_quant_reg.py:75: UserWarning: The distribution is specified by [0.1, 5] and step=0.25, but the range is not divisible by `step`. It will be replaced with [0.1, 4.85].
  error_threshold = trial.suggest_float("error_threshold", 0.1, 5, step=0.25)
[I 2026-07-21 10:10:40,655] Trial 271 finished with value: -0.18051727133264917 and parameters: {'error_threshold': 2.6, 'scalers': 'standard', 'ratios': 'norm_ratio', 'imputers': 'mean', 'n_estimators': 1950, 'learning_rate': 0.007579114971110381, 'max_depth': 4, 'min_child_weight': 3, 'subsample': 0.5, 'colsample_bytree': 1.0, 'colsample_bylevel': 1.0, 'reg_alpha': 3.288933457006863e-06, 'reg_lambda': 0.005390830089648744, 'gamma': 4.563247158074534e-06}. Best is trial 254 with value: -0.17915665564650896.
/bsuhome/alexanderemert/Research/Star-Formation-Research-Project-2026/pipeline/scripts/optuna/final_preds_and_models/optuna_search_mult_quant_reg.py:75: UserWarning: The distribution is specified by [0.1, 5] and step=0.25, but the range is not divisible by `step`. It will be replaced with [0.1, 4.85].
  error_threshold = trial.suggest_float("error_threshold", 0.1, 5, step=0.25)
[I 2026-07-21 10:10:43,781] Trial 272 finished with value: -0.18058036459834725 and parameters: {'error_threshold': 2.6, 'scalers': 'standard', 'ratios': 'norm_ratio', 'imputers': 'mean', 'n_estimators': 1950, 'learning_rate': 0.007297443368253897, 'max_depth': 4, 'min_child_weight': 3, 'subsample': 0.5, 'colsample_bytree': 1.0, 'colsample_bylevel': 1.0, 'reg_alpha': 3.5309311156706225e-06, 'reg_lambda': 0.030514524202061605, 'gamma': 2.2866717642297993e-06}. Best is trial 254 with value: -0.17915665564650896.
/bsuhome/alexanderemert/Research/Star-Formation-Research-Project-2026/pipeline/scripts/optuna/final_preds_and_models/optuna_search_mult_quant_reg.py:75: UserWarning: The distribution is specified by [0.1, 5] and step=0.25, but the range is not divisible by `step`. It will be replaced with [0.1, 4.85].
  error_threshold = trial.suggest_float("error_threshold", 0.1, 5, step=0.25)
[I 2026-07-21 10:10:50,779] Trial 273 finished with value: -0.18037840445538078 and parameters: {'error_threshold': 2.6, 'scalers': 'standard', 'ratios': 'norm_ratio', 'imputers': 'mean', 'n_estimators': 2000, 'learning_rate': 0.0070945590277507525, 'max_depth': 4, 'min_child_weight': 3, 'subsample': 0.5, 'colsample_bytree': 1.0, 'colsample_bylevel': 1.0, 'reg_alpha': 3.4968659139078053e-06, 'reg_lambda': 0.005894651158649657, 'gamma': 3.2842278916870334e-06}. Best is trial 254 with value: -0.17915665564650896.
/bsuhome/alexanderemert/Research/Star-Formation-Research-Project-2026/pipeline/scripts/optuna/final_preds_and_models/optuna_search_mult_quant_reg.py:75: UserWarning: The distribution is specified by [0.1, 5] and step=0.25, but the range is not divisible by `step`. It will be replaced with [0.1, 4.85].
  error_threshold = trial.suggest_float("error_threshold", 0.1, 5, step=0.25)
[I 2026-07-21 10:10:54,768] Trial 274 finished with value: -0.20589718957269917 and parameters: {'error_threshold': 2.6, 'scalers': 'standard', 'ratios': 'norm_ratio', 'imputers': 'mean', 'n_estimators': 1900, 'learning_rate': 0.007164403392441303, 'max_depth': 3, 'min_child_weight': 3, 'subsample': 0.5, 'colsample_bytree': 1.0, 'colsample_bylevel': 1.0, 'reg_alpha': 3.425689056545286e-06, 'reg_lambda': 0.029768741344109576, 'gamma': 4.893125355056742}. Best is trial 254 with value: -0.17915665564650896.
/bsuhome/alexanderemert/Research/Star-Formation-Research-Project-2026/pipeline/scripts/optuna/final_preds_and_models/optuna_search_mult_quant_reg.py:75: UserWarning: The distribution is specified by [0.1, 5] and step=0.25, but the range is not divisible by `step`. It will be replaced with [0.1, 4.85].
  error_threshold = trial.suggest_float("error_threshold", 0.1, 5, step=0.25)
[I 2026-07-21 10:11:05,063] Trial 275 finished with value: -0.18027340753598398 and parameters: {'error_threshold': 2.6, 'scalers': 'standard', 'ratios': 'norm_ratio', 'imputers': 'mean', 'n_estimators': 1900, 'learning_rate': 0.007179008067070254, 'max_depth': 4, 'min_child_weight': 3, 'subsample': 0.5, 'colsample_bytree': 1.0, 'colsample_bylevel': 1.0, 'reg_alpha': 3.4455544364079535e-06, 'reg_lambda': 0.027753396780033954, 'gamma': 1.9471461443988653e-06}. Best is trial 254 with value: -0.17915665564650896.
/bsuhome/alexanderemert/Research/Star-Formation-Research-Project-2026/pipeline/scripts/optuna/final_preds_and_models/optuna_search_mult_quant_reg.py:75: UserWarning: The distribution is specified by [0.1, 5] and step=0.25, but the range is not divisible by `step`. It will be replaced with [0.1, 4.85].
  error_threshold = trial.suggest_float("error_threshold", 0.1, 5, step=0.25)
[I 2026-07-21 10:11:10,380] Trial 276 finished with value: -0.2039453074252 and parameters: {'error_threshold': 2.6, 'scalers': 'standard', 'ratios': 'norm_ratio', 'imputers': 'mean', 'n_estimators': 1950, 'learning_rate': 0.007446332669350693, 'max_depth': 4, 'min_child_weight': 3, 'subsample': 0.5, 'colsample_bytree': 1.0, 'colsample_bylevel': 1.0, 'reg_alpha': 7.593295360228467e-06, 'reg_lambda': 0.02847519981029912, 'gamma': 4.2985008618892}. Best is trial 254 with value: -0.17915665564650896.
/bsuhome/alexanderemert/Research/Star-Formation-Research-Project-2026/pipeline/scripts/optuna/final_preds_and_models/optuna_search_mult_quant_reg.py:75: UserWarning: The distribution is specified by [0.1, 5] and step=0.25, but the range is not divisible by `step`. It will be replaced with [0.1, 4.85].
  error_threshold = trial.suggest_float("error_threshold", 0.1, 5, step=0.25)
[I 2026-07-21 10:11:15,022] Trial 277 finished with value: -0.17967917821782398 and parameters: {'error_threshold': 3.1, 'scalers': 'standard', 'ratios': 'norm_ratio', 'imputers': 'mean', 'n_estimators': 1900, 'learning_rate': 0.007129643392968033, 'max_depth': 3, 'min_child_weight': 3, 'subsample': 0.5, 'colsample_bytree': 1.0, 'colsample_bylevel': 1.0, 'reg_alpha': 7.438971053269465e-06, 'reg_lambda': 0.028346948319614786, 'gamma': 4.79801257737931e-05}. Best is trial 254 with value: -0.17915665564650896.
/bsuhome/alexanderemert/Research/Star-Formation-Research-Project-2026/pipeline/scripts/optuna/final_preds_and_models/optuna_search_mult_quant_reg.py:75: UserWarning: The distribution is specified by [0.1, 5] and step=0.25, but the range is not divisible by `step`. It will be replaced with [0.1, 4.85].
  error_threshold = trial.suggest_float("error_threshold", 0.1, 5, step=0.25)
[I 2026-07-21 10:11:26,706] Trial 278 finished with value: -0.19927720246018063 and parameters: {'error_threshold': 3.1, 'scalers': 'standard', 'ratios': 'norm_ratio', 'imputers': 'mean', 'n_estimators': 1950, 'learning_rate': 0.006911509792911898, 'max_depth': 3, 'min_child_weight': 3, 'subsample': 0.5, 'colsample_bytree': 1.0, 'colsample_bylevel': 1.0, 'reg_alpha': 7.19341852204097e-06, 'reg_lambda': 0.026880605785052435, 'gamma': 2.9937617719815353}. Best is trial 254 with value: -0.17915665564650896.
/bsuhome/alexanderemert/Research/Star-Formation-Research-Project-2026/pipeline/scripts/optuna/final_preds_and_models/optuna_search_mult_quant_reg.py:75: UserWarning: The distribution is specified by [0.1, 5] and step=0.25, but the range is not divisible by `step`. It will be replaced with [0.1, 4.85].
  error_threshold = trial.suggest_float("error_threshold", 0.1, 5, step=0.25)
[I 2026-07-21 10:11:35,958] Trial 279 finished with value: -0.17994333350319702 and parameters: {'error_threshold': 3.1, 'scalers': 'standard', 'ratios': 'norm_ratio', 'imputers': 'mean', 'n_estimators': 1950, 'learning_rate': 0.012903719921473855, 'max_depth': 3, 'min_child_weight': 3, 'subsample': 0.5, 'colsample_bytree': 1.0, 'colsample_bylevel': 1.0, 'reg_alpha': 6.924076707228218e-06, 'reg_lambda': 0.02588698348305499, 'gamma': 3.7523107990479385e-05}. Best is trial 254 with value: -0.17915665564650896.
/bsuhome/alexanderemert/Research/Star-Formation-Research-Project-2026/pipeline/scripts/optuna/final_preds_and_models/optuna_search_mult_quant_reg.py:75: UserWarning: The distribution is specified by [0.1, 5] and step=0.25, but the range is not divisible by `step`. It will be replaced with [0.1, 4.85].
  error_threshold = trial.suggest_float("error_threshold", 0.1, 5, step=0.25)
[I 2026-07-21 10:11:38,449] Trial 280 finished with value: -0.17951655598536595 and parameters: {'error_threshold': 3.1, 'scalers': 'standard', 'ratios': 'norm_ratio', 'imputers': 'mean', 'n_estimators': 2100, 'learning_rate': 0.006886329015899364, 'max_depth': 3, 'min_child_weight': 3, 'subsample': 0.5, 'colsample_bytree': 1.0, 'colsample_bylevel': 1.0, 'reg_alpha': 7.254987710193481e-06, 'reg_lambda': 0.00897120855921552, 'gamma': 1.2072640574381039e-06}. Best is trial 254 with value: -0.17915665564650896.
/bsuhome/alexanderemert/Research/Star-Formation-Research-Project-2026/pipeline/scripts/optuna/final_preds_and_models/optuna_search_mult_quant_reg.py:75: UserWarning: The distribution is specified by [0.1, 5] and step=0.25, but the range is not divisible by `step`. It will be replaced with [0.1, 4.85].
  error_threshold = trial.suggest_float("error_threshold", 0.1, 5, step=0.25)
[I 2026-07-21 10:11:43,751] Trial 281 finished with value: -0.17979983208403713 and parameters: {'error_threshold': 3.1, 'scalers': 'standard', 'ratios': 'norm_ratio', 'imputers': 'mean', 'n_estimators': 2100, 'learning_rate': 0.01221452933557315, 'max_depth': 3, 'min_child_weight': 3, 'subsample': 0.5, 'colsample_bytree': 1.0, 'colsample_bylevel': 1.0, 'reg_alpha': 7.2592874942100945e-06, 'reg_lambda': 0.009906651318417533, 'gamma': 7.921454410296832e-06}. Best is trial 254 with value: -0.17915665564650896.
/bsuhome/alexanderemert/Research/Star-Formation-Research-Project-2026/pipeline/scripts/optuna/final_preds_and_models/optuna_search_mult_quant_reg.py:75: UserWarning: The distribution is specified by [0.1, 5] and step=0.25, but the range is not divisible by `step`. It will be replaced with [0.1, 4.85].
  error_threshold = trial.suggest_float("error_threshold", 0.1, 5, step=0.25)
[I 2026-07-21 10:11:50,538] Trial 282 finished with value: -0.179829395429259 and parameters: {'error_threshold': 3.1, 'scalers': 'standard', 'ratios': 'norm_ratio', 'imputers': 'mean', 'n_estimators': 2100, 'learning_rate': 0.013115284569763864, 'max_depth': 3, 'min_child_weight': 3, 'subsample': 0.5, 'colsample_bytree': 1.0, 'colsample_bylevel': 1.0, 'reg_alpha': 7.455773593546826e-06, 'reg_lambda': 0.00910549777808244, 'gamma': 5.0248782076451774e-05}. Best is trial 254 with value: -0.17915665564650896.
/bsuhome/alexanderemert/Research/Star-Formation-Research-Project-2026/pipeline/scripts/optuna/final_preds_and_models/optuna_search_mult_quant_reg.py:75: UserWarning: The distribution is specified by [0.1, 5] and step=0.25, but the range is not divisible by `step`. It will be replaced with [0.1, 4.85].
  error_threshold = trial.suggest_float("error_threshold", 0.1, 5, step=0.25)
[I 2026-07-21 10:12:00,594] Trial 283 finished with value: -0.17989332800658356 and parameters: {'error_threshold': 3.1, 'scalers': 'standard', 'ratios': 'norm_ratio', 'imputers': 'mean', 'n_estimators': 2100, 'learning_rate': 0.012329282734192678, 'max_depth': 3, 'min_child_weight': 3, 'subsample': 0.5, 'colsample_bytree': 1.0, 'colsample_bylevel': 1.0, 'reg_alpha': 6.908971645613585e-06, 'reg_lambda': 0.00946289355517985, 'gamma': 8.275458112515983e-06}. Best is trial 254 with value: -0.17915665564650896.
/bsuhome/alexanderemert/Research/Star-Formation-Research-Project-2026/pipeline/scripts/optuna/final_preds_and_models/optuna_search_mult_quant_reg.py:75: UserWarning: The distribution is specified by [0.1, 5] and step=0.25, but the range is not divisible by `step`. It will be replaced with [0.1, 4.85].
  error_threshold = trial.suggest_float("error_threshold", 0.1, 5, step=0.25)
[I 2026-07-21 10:12:07,631] Trial 284 finished with value: -0.17979999246681333 and parameters: {'error_threshold': 3.1, 'scalers': 'standard', 'ratios': 'norm_ratio', 'imputers': 'mean', 'n_estimators': 2100, 'learning_rate': 0.012425173462229778, 'max_depth': 3, 'min_child_weight': 3, 'subsample': 0.5, 'colsample_bytree': 0.5, 'colsample_bylevel': 1.0, 'reg_alpha': 7.031114627058255e-06, 'reg_lambda': 0.009671033279304648, 'gamma': 1.1104142449840805e-06}. Best is trial 254 with value: -0.17915665564650896.
/bsuhome/alexanderemert/Research/Star-Formation-Research-Project-2026/pipeline/scripts/optuna/final_preds_and_models/optuna_search_mult_quant_reg.py:75: UserWarning: The distribution is specified by [0.1, 5] and step=0.25, but the range is not divisible by `step`. It will be replaced with [0.1, 4.85].
  error_threshold = trial.suggest_float("error_threshold", 0.1, 5, step=0.25)
[I 2026-07-21 10:12:12,467] Trial 285 finished with value: -0.1795907116130928 and parameters: {'error_threshold': 2.85, 'scalers': 'standard', 'ratios': 'norm_ratio', 'imputers': 'mean', 'n_estimators': 2100, 'learning_rate': 0.009437824099261758, 'max_depth': 3, 'min_child_weight': 3, 'subsample': 0.5, 'colsample_bytree': 1.0, 'colsample_bylevel': 1.0, 'reg_alpha': 6.731787812016593e-06, 'reg_lambda': 0.009471760709891868, 'gamma': 9.0116887530401e-06}. Best is trial 254 with value: -0.17915665564650896.
/bsuhome/alexanderemert/Research/Star-Formation-Research-Project-2026/pipeline/scripts/optuna/final_preds_and_models/optuna_search_mult_quant_reg.py:75: UserWarning: The distribution is specified by [0.1, 5] and step=0.25, but the range is not divisible by `step`. It will be replaced with [0.1, 4.85].
  error_threshold = trial.suggest_float("error_threshold", 0.1, 5, step=0.25)
[I 2026-07-21 10:12:25,855] Trial 286 finished with value: -0.17951061282977432 and parameters: {'error_threshold': 2.85, 'scalers': 'standard', 'ratios': 'norm_ratio', 'imputers': 'mean', 'n_estimators': 2100, 'learning_rate': 0.009165756775678371, 'max_depth': 3, 'min_child_weight': 3, 'subsample': 0.5, 'colsample_bytree': 1.0, 'colsample_bylevel': 1.0, 'reg_alpha': 7.043074347246588e-05, 'reg_lambda': 0.009427152557030288, 'gamma': 6.9855015782233625e-06}. Best is trial 254 with value: -0.17915665564650896.
/bsuhome/alexanderemert/Research/Star-Formation-Research-Project-2026/pipeline/scripts/optuna/final_preds_and_models/optuna_search_mult_quant_reg.py:75: UserWarning: The distribution is specified by [0.1, 5] and step=0.25, but the range is not divisible by `step`. It will be replaced with [0.1, 4.85].
  error_threshold = trial.suggest_float("error_threshold", 0.1, 5, step=0.25)
[I 2026-07-21 10:12:36,071] Trial 287 finished with value: -0.179707784772852 and parameters: {'error_threshold': 2.85, 'scalers': 'standard', 'ratios': 'norm_ratio', 'imputers': 'mean', 'n_estimators': 2100, 'learning_rate': 0.009313441690212868, 'max_depth': 3, 'min_child_weight': 3, 'subsample': 0.5, 'colsample_bytree': 1.0, 'colsample_bylevel': 1.0, 'reg_alpha': 1.0055578392712009e-05, 'reg_lambda': 0.011120498081079865, 'gamma': 1.2764268883951583e-06}. Best is trial 254 with value: -0.17915665564650896.
/bsuhome/alexanderemert/Research/Star-Formation-Research-Project-2026/pipeline/scripts/optuna/final_preds_and_models/optuna_search_mult_quant_reg.py:75: UserWarning: The distribution is specified by [0.1, 5] and step=0.25, but the range is not divisible by `step`. It will be replaced with [0.1, 4.85].
  error_threshold = trial.suggest_float("error_threshold", 0.1, 5, step=0.25)
