[I 2026-07-20 12:29:18,215] Trial 152 finished with value: -0.3910947785977266 and parameters: {'error_threshold': 0.5, 'scalers': 'standard', 'ratios': 'norm_ratio', 'imputers': 'mean', 'n_estimators': 400, 'learning_rate': 0.06030747678138168, 'max_depth': 12, 'min_child_weight': 4, 'subsample': 0.7, 'colsample_bytree': 0.7, 'colsample_bylevel': 1.0, 'reg_alpha': 50.01441213340365, 'reg_lambda': 0.00023896664824046154, 'gamma': 96.92380737265404}. Best is trial 69 with value: -0.3911874830873789.
/bsuscratch/alexanderemert/miniforge3/envs/starform-alex/lib/python3.14/site-packages/sklearn/utils/extmath.py:1207: RuntimeWarning: invalid value encountered in divide
  updated_mean = (last_sum + new_sum) / updated_sample_count
/bsuscratch/alexanderemert/miniforge3/envs/starform-alex/lib/python3.14/site-packages/sklearn/utils/extmath.py:1212: RuntimeWarning: invalid value encountered in divide
  T = new_sum / new_sample_count
/bsuscratch/alexanderemert/miniforge3/envs/starform-alex/lib/python3.14/site-packages/sklearn/utils/extmath.py:1236: RuntimeWarning: invalid value encountered in divide
  new_unnormalized_variance -= correction**2 / new_sample_count
/bsuscratch/alexanderemert/miniforge3/envs/starform-alex/lib/python3.14/site-packages/sklearn/utils/extmath.py:1207: RuntimeWarning: invalid value encountered in divide
  updated_mean = (last_sum + new_sum) / updated_sample_count
/bsuscratch/alexanderemert/miniforge3/envs/starform-alex/lib/python3.14/site-packages/sklearn/utils/extmath.py:1212: RuntimeWarning: invalid value encountered in divide
  T = new_sum / new_sample_count
/bsuscratch/alexanderemert/miniforge3/envs/starform-alex/lib/python3.14/site-packages/sklearn/utils/extmath.py:1236: RuntimeWarning: invalid value encountered in divide
  new_unnormalized_variance -= correction**2 / new_sample_count
/bsuscratch/alexanderemert/miniforge3/envs/starform-alex/lib/python3.14/site-packages/sklearn/utils/extmath.py:1207: RuntimeWarning: invalid value encountered in divide
  updated_mean = (last_sum + new_sum) / updated_sample_count
/bsuscratch/alexanderemert/miniforge3/envs/starform-alex/lib/python3.14/site-packages/sklearn/utils/extmath.py:1212: RuntimeWarning: invalid value encountered in divide
  T = new_sum / new_sample_count
/bsuscratch/alexanderemert/miniforge3/envs/starform-alex/lib/python3.14/site-packages/sklearn/utils/extmath.py:1236: RuntimeWarning: invalid value encountered in divide
  new_unnormalized_variance -= correction**2 / new_sample_count
/bsuscratch/alexanderemert/miniforge3/envs/starform-alex/lib/python3.14/site-packages/sklearn/utils/extmath.py:1207: RuntimeWarning: invalid value encountered in divide
  updated_mean = (last_sum + new_sum) / updated_sample_count
/bsuscratch/alexanderemert/miniforge3/envs/starform-alex/lib/python3.14/site-packages/sklearn/utils/extmath.py:1212: RuntimeWarning: invalid value encountered in divide
  T = new_sum / new_sample_count
/bsuscratch/alexanderemert/miniforge3/envs/starform-alex/lib/python3.14/site-packages/sklearn/utils/extmath.py:1236: RuntimeWarning: invalid value encountered in divide
  new_unnormalized_variance -= correction**2 / new_sample_count
/bsuscratch/alexanderemert/miniforge3/envs/starform-alex/lib/python3.14/site-packages/sklearn/utils/extmath.py:1207: RuntimeWarning: invalid value encountered in divide
  updated_mean = (last_sum + new_sum) / updated_sample_count
/bsuscratch/alexanderemert/miniforge3/envs/starform-alex/lib/python3.14/site-packages/sklearn/utils/extmath.py:1212: RuntimeWarning: invalid value encountered in divide
  T = new_sum / new_sample_count
/bsuscratch/alexanderemert/miniforge3/envs/starform-alex/lib/python3.14/site-packages/sklearn/utils/extmath.py:1236: RuntimeWarning: invalid value encountered in divide
  new_unnormalized_variance -= correction**2 / new_sample_count
[I 2026-07-20 12:29:18,422] Trial 153 finished with value: -0.3777878815962172 and parameters: {'error_threshold': 0.75, 'scalers': 'standard', 'ratios': 'norm_ratio', 'imputers': 'mean', 'n_estimators': 350, 'learning_rate': 0.05584434934732889, 'max_depth': 12, 'min_child_weight': 4, 'subsample': 0.7, 'colsample_bytree': 0.7, 'colsample_bylevel': 1.0, 'reg_alpha': 22.059109700463832, 'reg_lambda': 0.0002922180007069156, 'gamma': 93.77714567853964}. Best is trial 69 with value: -0.3911874830873789.
/bsuscratch/alexanderemert/miniforge3/envs/starform-alex/lib/python3.14/site-packages/sklearn/utils/extmath.py:1207: RuntimeWarning: invalid value encountered in divide
  updated_mean = (last_sum + new_sum) / updated_sample_count
/bsuscratch/alexanderemert/miniforge3/envs/starform-alex/lib/python3.14/site-packages/sklearn/utils/extmath.py:1212: RuntimeWarning: invalid value encountered in divide
  T = new_sum / new_sample_count
/bsuscratch/alexanderemert/miniforge3/envs/starform-alex/lib/python3.14/site-packages/sklearn/utils/extmath.py:1236: RuntimeWarning: invalid value encountered in divide
  new_unnormalized_variance -= correction**2 / new_sample_count
/bsuscratch/alexanderemert/miniforge3/envs/starform-alex/lib/python3.14/site-packages/sklearn/utils/extmath.py:1207: RuntimeWarning: invalid value encountered in divide
  updated_mean = (last_sum + new_sum) / updated_sample_count
/bsuscratch/alexanderemert/miniforge3/envs/starform-alex/lib/python3.14/site-packages/sklearn/utils/extmath.py:1212: RuntimeWarning: invalid value encountered in divide
  T = new_sum / new_sample_count
/bsuscratch/alexanderemert/miniforge3/envs/starform-alex/lib/python3.14/site-packages/sklearn/utils/extmath.py:1236: RuntimeWarning: invalid value encountered in divide
  new_unnormalized_variance -= correction**2 / new_sample_count
/bsuscratch/alexanderemert/miniforge3/envs/starform-alex/lib/python3.14/site-packages/sklearn/utils/extmath.py:1207: RuntimeWarning: invalid value encountered in divide
  updated_mean = (last_sum + new_sum) / updated_sample_count
/bsuscratch/alexanderemert/miniforge3/envs/starform-alex/lib/python3.14/site-packages/sklearn/utils/extmath.py:1212: RuntimeWarning: invalid value encountered in divide
  T = new_sum / new_sample_count
/bsuscratch/alexanderemert/miniforge3/envs/starform-alex/lib/python3.14/site-packages/sklearn/utils/extmath.py:1236: RuntimeWarning: invalid value encountered in divide
  new_unnormalized_variance -= correction**2 / new_sample_count
/bsuscratch/alexanderemert/miniforge3/envs/starform-alex/lib/python3.14/site-packages/sklearn/utils/extmath.py:1207: RuntimeWarning: invalid value encountered in divide
  updated_mean = (last_sum + new_sum) / updated_sample_count
/bsuscratch/alexanderemert/miniforge3/envs/starform-alex/lib/python3.14/site-packages/sklearn/utils/extmath.py:1212: RuntimeWarning: invalid value encountered in divide
  T = new_sum / new_sample_count
/bsuscratch/alexanderemert/miniforge3/envs/starform-alex/lib/python3.14/site-packages/sklearn/utils/extmath.py:1236: RuntimeWarning: invalid value encountered in divide
  new_unnormalized_variance -= correction**2 / new_sample_count
/bsuscratch/alexanderemert/miniforge3/envs/starform-alex/lib/python3.14/site-packages/sklearn/utils/extmath.py:1207: RuntimeWarning: invalid value encountered in divide
  updated_mean = (last_sum + new_sum) / updated_sample_count
/bsuscratch/alexanderemert/miniforge3/envs/starform-alex/lib/python3.14/site-packages/sklearn/utils/extmath.py:1212: RuntimeWarning: invalid value encountered in divide
  T = new_sum / new_sample_count
/bsuscratch/alexanderemert/miniforge3/envs/starform-alex/lib/python3.14/site-packages/sklearn/utils/extmath.py:1236: RuntimeWarning: invalid value encountered in divide
  new_unnormalized_variance -= correction**2 / new_sample_count
/bsuscratch/alexanderemert/miniforge3/envs/starform-alex/lib/python3.14/site-packages/sklearn/utils/extmath.py:1207: RuntimeWarning: invalid value encountered in divide
  updated_mean = (last_sum + new_sum) / updated_sample_count
/bsuscratch/alexanderemert/miniforge3/envs/starform-alex/lib/python3.14/site-packages/sklearn/utils/extmath.py:1212: RuntimeWarning: invalid value encountered in divide
  T = new_sum / new_sample_count
/bsuscratch/alexanderemert/miniforge3/envs/starform-alex/lib/python3.14/site-packages/sklearn/utils/extmath.py:1236: RuntimeWarning: invalid value encountered in divide
  new_unnormalized_variance -= correction**2 / new_sample_count
/bsuscratch/alexanderemert/miniforge3/envs/starform-alex/lib/python3.14/site-packages/sklearn/utils/extmath.py:1207: RuntimeWarning: invalid value encountered in divide
  updated_mean = (last_sum + new_sum) / updated_sample_count
/bsuscratch/alexanderemert/miniforge3/envs/starform-alex/lib/python3.14/site-packages/sklearn/utils/extmath.py:1212: RuntimeWarning: invalid value encountered in divide
  T = new_sum / new_sample_count
/bsuscratch/alexanderemert/miniforge3/envs/starform-alex/lib/python3.14/site-packages/sklearn/utils/extmath.py:1236: RuntimeWarning: invalid value encountered in divide
  new_unnormalized_variance -= correction**2 / new_sample_count
/bsuscratch/alexanderemert/miniforge3/envs/starform-alex/lib/python3.14/site-packages/sklearn/utils/extmath.py:1207: RuntimeWarning: invalid value encountered in divide
  updated_mean = (last_sum + new_sum) / updated_sample_count
/bsuscratch/alexanderemert/miniforge3/envs/starform-alex/lib/python3.14/site-packages/sklearn/utils/extmath.py:1212: RuntimeWarning: invalid value encountered in divide
  T = new_sum / new_sample_count
/bsuscratch/alexanderemert/miniforge3/envs/starform-alex/lib/python3.14/site-packages/sklearn/utils/extmath.py:1236: RuntimeWarning: invalid value encountered in divide
  new_unnormalized_variance -= correction**2 / new_sample_count
/bsuscratch/alexanderemert/miniforge3/envs/starform-alex/lib/python3.14/site-packages/sklearn/utils/extmath.py:1207: RuntimeWarning: invalid value encountered in divide
  updated_mean = (last_sum + new_sum) / updated_sample_count
/bsuscratch/alexanderemert/miniforge3/envs/starform-alex/lib/python3.14/site-packages/sklearn/utils/extmath.py:1212: RuntimeWarning: invalid value encountered in divide
  T = new_sum / new_sample_count
/bsuscratch/alexanderemert/miniforge3/envs/starform-alex/lib/python3.14/site-packages/sklearn/utils/extmath.py:1236: RuntimeWarning: invalid value encountered in divide
  new_unnormalized_variance -= correction**2 / new_sample_count
/bsuscratch/alexanderemert/miniforge3/envs/starform-alex/lib/python3.14/site-packages/sklearn/utils/extmath.py:1207: RuntimeWarning: invalid value encountered in divide
  updated_mean = (last_sum + new_sum) / updated_sample_count
/bsuscratch/alexanderemert/miniforge3/envs/starform-alex/lib/python3.14/site-packages/sklearn/utils/extmath.py:1212: RuntimeWarning: invalid value encountered in divide
  T = new_sum / new_sample_count
/bsuscratch/alexanderemert/miniforge3/envs/starform-alex/lib/python3.14/site-packages/sklearn/utils/extmath.py:1236: RuntimeWarning: invalid value encountered in divide
  new_unnormalized_variance -= correction**2 / new_sample_count
/bsuscratch/alexanderemert/miniforge3/envs/starform-alex/lib/python3.14/site-packages/sklearn/utils/extmath.py:1207: RuntimeWarning: invalid value encountered in divide
  updated_mean = (last_sum + new_sum) / updated_sample_count
/bsuscratch/alexanderemert/miniforge3/envs/starform-alex/lib/python3.14/site-packages/sklearn/utils/extmath.py:1212: RuntimeWarning: invalid value encountered in divide
  T = new_sum / new_sample_count
/bsuscratch/alexanderemert/miniforge3/envs/starform-alex/lib/python3.14/site-packages/sklearn/utils/extmath.py:1236: RuntimeWarning: invalid value encountered in divide
  new_unnormalized_variance -= correction**2 / new_sample_count
/bsuscratch/alexanderemert/miniforge3/envs/starform-alex/lib/python3.14/site-packages/sklearn/utils/extmath.py:1207: RuntimeWarning: invalid value encountered in divide
  updated_mean = (last_sum + new_sum) / updated_sample_count
/bsuscratch/alexanderemert/miniforge3/envs/starform-alex/lib/python3.14/site-packages/sklearn/utils/extmath.py:1212: RuntimeWarning: invalid value encountered in divide
  T = new_sum / new_sample_count
/bsuscratch/alexanderemert/miniforge3/envs/starform-alex/lib/python3.14/site-packages/sklearn/utils/extmath.py:1236: RuntimeWarning: invalid value encountered in divide
  new_unnormalized_variance -= correction**2 / new_sample_count
/bsuscratch/alexanderemert/miniforge3/envs/starform-alex/lib/python3.14/site-packages/sklearn/utils/extmath.py:1207: RuntimeWarning: invalid value encountered in divide
  updated_mean = (last_sum + new_sum) / updated_sample_count
/bsuscratch/alexanderemert/miniforge3/envs/starform-alex/lib/python3.14/site-packages/sklearn/utils/extmath.py:1212: RuntimeWarning: invalid value encountered in divide
  T = new_sum / new_sample_count
/bsuscratch/alexanderemert/miniforge3/envs/starform-alex/lib/python3.14/site-packages/sklearn/utils/extmath.py:1236: RuntimeWarning: invalid value encountered in divide
  new_unnormalized_variance -= correction**2 / new_sample_count
/bsuscratch/alexanderemert/miniforge3/envs/starform-alex/lib/python3.14/site-packages/sklearn/utils/extmath.py:1207: RuntimeWarning: invalid value encountered in divide
  updated_mean = (last_sum + new_sum) / updated_sample_count
/bsuscratch/alexanderemert/miniforge3/envs/starform-alex/lib/python3.14/site-packages/sklearn/utils/extmath.py:1212: RuntimeWarning: invalid value encountered in divide
  T = new_sum / new_sample_count
/bsuscratch/alexanderemert/miniforge3/envs/starform-alex/lib/python3.14/site-packages/sklearn/utils/extmath.py:1236: RuntimeWarning: invalid value encountered in divide
  new_unnormalized_variance -= correction**2 / new_sample_count
/bsuscratch/alexanderemert/miniforge3/envs/starform-alex/lib/python3.14/site-packages/sklearn/utils/extmath.py:1207: RuntimeWarning: invalid value encountered in divide
  updated_mean = (last_sum + new_sum) / updated_sample_count
/bsuscratch/alexanderemert/miniforge3/envs/starform-alex/lib/python3.14/site-packages/sklearn/utils/extmath.py:1212: RuntimeWarning: invalid value encountered in divide
  T = new_sum / new_sample_count
/bsuscratch/alexanderemert/miniforge3/envs/starform-alex/lib/python3.14/site-packages/sklearn/utils/extmath.py:1236: RuntimeWarning: invalid value encountered in divide
  new_unnormalized_variance -= correction**2 / new_sample_count
/bsuscratch/alexanderemert/miniforge3/envs/starform-alex/lib/python3.14/site-packages/sklearn/utils/extmath.py:1207: RuntimeWarning: invalid value encountered in divide
  updated_mean = (last_sum + new_sum) / updated_sample_count
/bsuscratch/alexanderemert/miniforge3/envs/starform-alex/lib/python3.14/site-packages/sklearn/utils/extmath.py:1212: RuntimeWarning: invalid value encountered in divide
  T = new_sum / new_sample_count
/bsuscratch/alexanderemert/miniforge3/envs/starform-alex/lib/python3.14/site-packages/sklearn/utils/extmath.py:1236: RuntimeWarning: invalid value encountered in divide
  new_unnormalized_variance -= correction**2 / new_sample_count
/bsuscratch/alexanderemert/miniforge3/envs/starform-alex/lib/python3.14/site-packages/sklearn/utils/extmath.py:1207: RuntimeWarning: invalid value encountered in divide
  updated_mean = (last_sum + new_sum) / updated_sample_count
/bsuscratch/alexanderemert/miniforge3/envs/starform-alex/lib/python3.14/site-packages/sklearn/utils/extmath.py:1212: RuntimeWarning: invalid value encountered in divide
  T = new_sum / new_sample_count
/bsuscratch/alexanderemert/miniforge3/envs/starform-alex/lib/python3.14/site-packages/sklearn/utils/extmath.py:1236: RuntimeWarning: invalid value encountered in divide
  new_unnormalized_variance -= correction**2 / new_sample_count
/bsuscratch/alexanderemert/miniforge3/envs/starform-alex/lib/python3.14/site-packages/sklearn/utils/extmath.py:1207: RuntimeWarning: invalid value encountered in divide
  updated_mean = (last_sum + new_sum) / updated_sample_count
/bsuscratch/alexanderemert/miniforge3/envs/starform-alex/lib/python3.14/site-packages/sklearn/utils/extmath.py:1212: RuntimeWarning: invalid value encountered in divide
  T = new_sum / new_sample_count
/bsuscratch/alexanderemert/miniforge3/envs/starform-alex/lib/python3.14/site-packages/sklearn/utils/extmath.py:1236: RuntimeWarning: invalid value encountered in divide
  new_unnormalized_variance -= correction**2 / new_sample_count
/bsuscratch/alexanderemert/miniforge3/envs/starform-alex/lib/python3.14/site-packages/sklearn/utils/extmath.py:1207: RuntimeWarning: invalid value encountered in divide
  updated_mean = (last_sum + new_sum) / updated_sample_count
/bsuscratch/alexanderemert/miniforge3/envs/starform-alex/lib/python3.14/site-packages/sklearn/utils/extmath.py:1212: RuntimeWarning: invalid value encountered in divide
  T = new_sum / new_sample_count
/bsuscratch/alexanderemert/miniforge3/envs/starform-alex/lib/python3.14/site-packages/sklearn/utils/extmath.py:1236: RuntimeWarning: invalid value encountered in divide
  new_unnormalized_variance -= correction**2 / new_sample_count
/bsuscratch/alexanderemert/miniforge3/envs/starform-alex/lib/python3.14/site-packages/sklearn/utils/extmath.py:1207: RuntimeWarning: invalid value encountered in divide
  updated_mean = (last_sum + new_sum) / updated_sample_count
/bsuscratch/alexanderemert/miniforge3/envs/starform-alex/lib/python3.14/site-packages/sklearn/utils/extmath.py:1212: RuntimeWarning: invalid value encountered in divide
  T = new_sum / new_sample_count
/bsuscratch/alexanderemert/miniforge3/envs/starform-alex/lib/python3.14/site-packages/sklearn/utils/extmath.py:1236: RuntimeWarning: invalid value encountered in divide
  new_unnormalized_variance -= correction**2 / new_sample_count
/bsuscratch/alexanderemert/miniforge3/envs/starform-alex/lib/python3.14/site-packages/sklearn/utils/extmath.py:1207: RuntimeWarning: invalid value encountered in divide
  updated_mean = (last_sum + new_sum) / updated_sample_count
/bsuscratch/alexanderemert/miniforge3/envs/starform-alex/lib/python3.14/site-packages/sklearn/utils/extmath.py:1212: RuntimeWarning: invalid value encountered in divide
  T = new_sum / new_sample_count
/bsuscratch/alexanderemert/miniforge3/envs/starform-alex/lib/python3.14/site-packages/sklearn/utils/extmath.py:1236: RuntimeWarning: invalid value encountered in divide
  new_unnormalized_variance -= correction**2 / new_sample_count
/bsuscratch/alexanderemert/miniforge3/envs/starform-alex/lib/python3.14/site-packages/sklearn/utils/extmath.py:1207: RuntimeWarning: invalid value encountered in divide
  updated_mean = (last_sum + new_sum) / updated_sample_count
/bsuscratch/alexanderemert/miniforge3/envs/starform-alex/lib/python3.14/site-packages/sklearn/utils/extmath.py:1212: RuntimeWarning: invalid value encountered in divide
  T = new_sum / new_sample_count
/bsuscratch/alexanderemert/miniforge3/envs/starform-alex/lib/python3.14/site-packages/sklearn/utils/extmath.py:1236: RuntimeWarning: invalid value encountered in divide
  new_unnormalized_variance -= correction**2 / new_sample_count
