[I 2026-07-21 10:18:27,752] Trial 259 finished with value: -1.0257796072074894 and parameters: {'error_threshold': 3.35, 'scalers': 'none', 'ratios': 'norm_ratio', 'imputers': 'none', 'n_estimators': 3000, 'learning_rate': 0.003607724163673851, 'max_depth': 3, 'min_child_weight': 3, 'subsample': 0.6, 'colsample_bytree': 0.5, 'colsample_bylevel': 0.9, 'reg_alpha': 2.8816152726835844e-05, 'reg_lambda': 1.3383296835998017e-05, 'gamma': 1.0171715388967975e-06}. Best is trial 217 with value: -1.0247384784192415.
/bsuhome/alexanderemert/Research/Star-Formation-Research-Project-2026/pipeline/scripts/optuna/final_preds_and_models/optuna_search_mult_quant_reg.py:161: UserWarning: The distribution is specified by [0.1, 5] and step=0.25, but the range is not divisible by `step`. It will be replaced with [0.1, 4.85].
  error_threshold = trial.suggest_float("error_threshold", 0.1, 5, step=0.25)
[I 2026-07-21 10:18:29,802] Trial 260 finished with value: -1.0262416471668212 and parameters: {'error_threshold': 3.35, 'scalers': 'none', 'ratios': 'norm_ratio', 'imputers': 'none', 'n_estimators': 3000, 'learning_rate': 0.003221904382377937, 'max_depth': 3, 'min_child_weight': 3, 'subsample': 0.6, 'colsample_bytree': 0.5, 'colsample_bylevel': 0.9, 'reg_alpha': 2.339866524643431e-05, 'reg_lambda': 1.292230355628716e-05, 'gamma': 1.1356431740875338e-06}. Best is trial 217 with value: -1.0247384784192415.
/bsuhome/alexanderemert/Research/Star-Formation-Research-Project-2026/pipeline/scripts/optuna/final_preds_and_models/optuna_search_mult_quant_reg.py:161: UserWarning: The distribution is specified by [0.1, 5] and step=0.25, but the range is not divisible by `step`. It will be replaced with [0.1, 4.85].
  error_threshold = trial.suggest_float("error_threshold", 0.1, 5, step=0.25)
[I 2026-07-21 10:18:31,867] Trial 261 finished with value: -1.0270103817264788 and parameters: {'error_threshold': 3.35, 'scalers': 'none', 'ratios': 'norm_ratio', 'imputers': 'none', 'n_estimators': 3000, 'learning_rate': 0.0030092474404084155, 'max_depth': 3, 'min_child_weight': 3, 'subsample': 0.6, 'colsample_bytree': 0.5, 'colsample_bylevel': 0.9, 'reg_alpha': 2.6769030129161844e-05, 'reg_lambda': 1.1187643437550795e-05, 'gamma': 1.0345586070998503e-06}. Best is trial 217 with value: -1.0247384784192415.
/bsuhome/alexanderemert/Research/Star-Formation-Research-Project-2026/pipeline/scripts/optuna/final_preds_and_models/optuna_search_mult_quant_reg.py:161: UserWarning: The distribution is specified by [0.1, 5] and step=0.25, but the range is not divisible by `step`. It will be replaced with [0.1, 4.85].
  error_threshold = trial.suggest_float("error_threshold", 0.1, 5, step=0.25)
[I 2026-07-21 10:18:33,922] Trial 262 finished with value: -1.0269138262732131 and parameters: {'error_threshold': 3.35, 'scalers': 'none', 'ratios': 'norm_ratio', 'imputers': 'none', 'n_estimators': 3000, 'learning_rate': 0.0030367960178377972, 'max_depth': 3, 'min_child_weight': 3, 'subsample': 0.6, 'colsample_bytree': 0.5, 'colsample_bylevel': 0.9, 'reg_alpha': 2.7150380141509273e-05, 'reg_lambda': 1.2233551677522913e-05, 'gamma': 1.4718698251172126e-06}. Best is trial 217 with value: -1.0247384784192415.
/bsuhome/alexanderemert/Research/Star-Formation-Research-Project-2026/pipeline/scripts/optuna/final_preds_and_models/optuna_search_mult_quant_reg.py:161: UserWarning: The distribution is specified by [0.1, 5] and step=0.25, but the range is not divisible by `step`. It will be replaced with [0.1, 4.85].
  error_threshold = trial.suggest_float("error_threshold", 0.1, 5, step=0.25)
[I 2026-07-21 10:18:35,991] Trial 263 finished with value: -1.0269400938361697 and parameters: {'error_threshold': 3.35, 'scalers': 'none', 'ratios': 'norm_ratio', 'imputers': 'none', 'n_estimators': 3000, 'learning_rate': 0.0030237933803490104, 'max_depth': 3, 'min_child_weight': 3, 'subsample': 0.6, 'colsample_bytree': 0.5, 'colsample_bylevel': 0.9, 'reg_alpha': 2.3387480355950974e-05, 'reg_lambda': 1.3389396159093308e-05, 'gamma': 1.0280709246594521e-06}. Best is trial 217 with value: -1.0247384784192415.
/bsuhome/alexanderemert/Research/Star-Formation-Research-Project-2026/pipeline/scripts/optuna/final_preds_and_models/optuna_search_mult_quant_reg.py:161: UserWarning: The distribution is specified by [0.1, 5] and step=0.25, but the range is not divisible by `step`. It will be replaced with [0.1, 4.85].
  error_threshold = trial.suggest_float("error_threshold", 0.1, 5, step=0.25)
[I 2026-07-21 10:18:38,078] Trial 264 finished with value: -1.0314850444963992 and parameters: {'error_threshold': 3.35, 'scalers': 'none', 'ratios': 'norm_ratio', 'imputers': 'none', 'n_estimators': 3000, 'learning_rate': 0.002426777160486351, 'max_depth': 3, 'min_child_weight': 3, 'subsample': 0.6, 'colsample_bytree': 0.5, 'colsample_bylevel': 0.9, 'reg_alpha': 2.522935677685491e-05, 'reg_lambda': 1.4480506208575705e-05, 'gamma': 1.3888850336433778e-06}. Best is trial 217 with value: -1.0247384784192415.
/bsuhome/alexanderemert/Research/Star-Formation-Research-Project-2026/pipeline/scripts/optuna/final_preds_and_models/optuna_search_mult_quant_reg.py:161: UserWarning: The distribution is specified by [0.1, 5] and step=0.25, but the range is not divisible by `step`. It will be replaced with [0.1, 4.85].
  error_threshold = trial.suggest_float("error_threshold", 0.1, 5, step=0.25)
[I 2026-07-21 10:18:40,156] Trial 265 finished with value: -1.030842929545964 and parameters: {'error_threshold': 3.1, 'scalers': 'none', 'ratios': 'norm_ratio', 'imputers': 'none', 'n_estimators': 3000, 'learning_rate': 0.002485339010246726, 'max_depth': 3, 'min_child_weight': 3, 'subsample': 0.6, 'colsample_bytree': 0.5, 'colsample_bylevel': 0.9, 'reg_alpha': 5.57553450232224e-05, 'reg_lambda': 1.352535627648677e-05, 'gamma': 1.3828711235634278e-06}. Best is trial 217 with value: -1.0247384784192415.
/bsuhome/alexanderemert/Research/Star-Formation-Research-Project-2026/pipeline/scripts/optuna/final_preds_and_models/optuna_search_mult_quant_reg.py:161: UserWarning: The distribution is specified by [0.1, 5] and step=0.25, but the range is not divisible by `step`. It will be replaced with [0.1, 4.85].
  error_threshold = trial.suggest_float("error_threshold", 0.1, 5, step=0.25)
[I 2026-07-21 10:18:42,248] Trial 266 finished with value: -1.0330140943417818 and parameters: {'error_threshold': 3.1, 'scalers': 'none', 'ratios': 'norm_ratio', 'imputers': 'none', 'n_estimators': 3000, 'learning_rate': 0.0023052352821117117, 'max_depth': 3, 'min_child_weight': 3, 'subsample': 0.6, 'colsample_bytree': 0.5, 'colsample_bylevel': 0.9, 'reg_alpha': 2.4154200403012567e-05, 'reg_lambda': 1.329689866033057e-05, 'gamma': 1.042463142994672e-06}. Best is trial 217 with value: -1.0247384784192415.
/bsuhome/alexanderemert/Research/Star-Formation-Research-Project-2026/pipeline/scripts/optuna/final_preds_and_models/optuna_search_mult_quant_reg.py:161: UserWarning: The distribution is specified by [0.1, 5] and step=0.25, but the range is not divisible by `step`. It will be replaced with [0.1, 4.85].
  error_threshold = trial.suggest_float("error_threshold", 0.1, 5, step=0.25)
[I 2026-07-21 10:18:45,151] Trial 267 finished with value: -1.0297599480339639 and parameters: {'error_threshold': 3.1, 'scalers': 'none', 'ratios': 'norm_ratio', 'imputers': 'none', 'n_estimators': 3000, 'learning_rate': 0.0023795659090986585, 'max_depth': 3, 'min_child_weight': 3, 'subsample': 0.6, 'colsample_bytree': 0.9, 'colsample_bylevel': 0.9, 'reg_alpha': 2.1952014224149147e-05, 'reg_lambda': 3.394890305729212e-05, 'gamma': 1.4309464050412617e-06}. Best is trial 217 with value: -1.0247384784192415.
/bsuhome/alexanderemert/Research/Star-Formation-Research-Project-2026/pipeline/scripts/optuna/final_preds_and_models/optuna_search_mult_quant_reg.py:161: UserWarning: The distribution is specified by [0.1, 5] and step=0.25, but the range is not divisible by `step`. It will be replaced with [0.1, 4.85].
  error_threshold = trial.suggest_float("error_threshold", 0.1, 5, step=0.25)
[I 2026-07-21 10:18:47,193] Trial 268 finished with value: -1.0286142647695167 and parameters: {'error_threshold': 3.1, 'scalers': 'none', 'ratios': 'norm_ratio', 'imputers': 'none', 'n_estimators': 2950, 'learning_rate': 0.0027634504552387007, 'max_depth': 3, 'min_child_weight': 3, 'subsample': 0.6, 'colsample_bytree': 0.5, 'colsample_bylevel': 0.9, 'reg_alpha': 4.711567012045815e-05, 'reg_lambda': 6.272193739587583e-06, 'gamma': 1.3949345113045212e-06}. Best is trial 217 with value: -1.0247384784192415.
/bsuhome/alexanderemert/Research/Star-Formation-Research-Project-2026/pipeline/scripts/optuna/final_preds_and_models/optuna_search_mult_quant_reg.py:161: UserWarning: The distribution is specified by [0.1, 5] and step=0.25, but the range is not divisible by `step`. It will be replaced with [0.1, 4.85].
  error_threshold = trial.suggest_float("error_threshold", 0.1, 5, step=0.25)
[I 2026-07-21 10:18:49,256] Trial 269 finished with value: -1.0338573364651167 and parameters: {'error_threshold': 3.1, 'scalers': 'none', 'ratios': 'norm_ratio', 'imputers': 'none', 'n_estimators': 2950, 'learning_rate': 0.0022624430203421423, 'max_depth': 3, 'min_child_weight': 3, 'subsample': 0.6, 'colsample_bytree': 0.5, 'colsample_bylevel': 0.9, 'reg_alpha': 4.826449165858406e-05, 'reg_lambda': 2.8097293400116172e-05, 'gamma': 1.5266596297306298e-06}. Best is trial 217 with value: -1.0247384784192415.
/bsuhome/alexanderemert/Research/Star-Formation-Research-Project-2026/pipeline/scripts/optuna/final_preds_and_models/optuna_search_mult_quant_reg.py:161: UserWarning: The distribution is specified by [0.1, 5] and step=0.25, but the range is not divisible by `step`. It will be replaced with [0.1, 4.85].
  error_threshold = trial.suggest_float("error_threshold", 0.1, 5, step=0.25)
[I 2026-07-21 10:18:52,160] Trial 270 finished with value: -1.030216233036425 and parameters: {'error_threshold': 3.1, 'scalers': 'none', 'ratios': 'norm_ratio', 'imputers': 'none', 'n_estimators': 2950, 'learning_rate': 0.0023636947186920923, 'max_depth': 3, 'min_child_weight': 3, 'subsample': 0.6, 'colsample_bytree': 0.9, 'colsample_bylevel': 0.9, 'reg_alpha': 5.4966186197995094e-05, 'reg_lambda': 2.6036692311520763e-05, 'gamma': 1.499592155235766e-06}. Best is trial 217 with value: -1.0247384784192415.
/bsuhome/alexanderemert/Research/Star-Formation-Research-Project-2026/pipeline/scripts/optuna/final_preds_and_models/optuna_search_mult_quant_reg.py:161: UserWarning: The distribution is specified by [0.1, 5] and step=0.25, but the range is not divisible by `step`. It will be replaced with [0.1, 4.85].
  error_threshold = trial.suggest_float("error_threshold", 0.1, 5, step=0.25)
[I 2026-07-21 10:18:54,173] Trial 271 finished with value: -1.0252420983808126 and parameters: {'error_threshold': 3.1, 'scalers': 'none', 'ratios': 'norm_ratio', 'imputers': 'none', 'n_estimators': 2950, 'learning_rate': 0.003892641574456294, 'max_depth': 3, 'min_child_weight': 3, 'subsample': 0.6, 'colsample_bytree': 0.5, 'colsample_bylevel': 0.9, 'reg_alpha': 5.006106190464111e-05, 'reg_lambda': 2.8992262773301324e-05, 'gamma': 1.6004543954419568e-06}. Best is trial 217 with value: -1.0247384784192415.
/bsuhome/alexanderemert/Research/Star-Formation-Research-Project-2026/pipeline/scripts/optuna/final_preds_and_models/optuna_search_mult_quant_reg.py:161: UserWarning: The distribution is specified by [0.1, 5] and step=0.25, but the range is not divisible by `step`. It will be replaced with [0.1, 4.85].
  error_threshold = trial.suggest_float("error_threshold", 0.1, 5, step=0.25)
[I 2026-07-21 10:18:56,197] Trial 272 finished with value: -1.02501303583465 and parameters: {'error_threshold': 3.1, 'scalers': 'none', 'ratios': 'norm_ratio', 'imputers': 'none', 'n_estimators': 2950, 'learning_rate': 0.003933703217206476, 'max_depth': 3, 'min_child_weight': 3, 'subsample': 0.6, 'colsample_bytree': 0.5, 'colsample_bylevel': 0.9, 'reg_alpha': 5.209937743399631e-05, 'reg_lambda': 2.636676341432095e-05, 'gamma': 1.5667444165489878e-06}. Best is trial 217 with value: -1.0247384784192415.
/bsuhome/alexanderemert/Research/Star-Formation-Research-Project-2026/pipeline/scripts/optuna/final_preds_and_models/optuna_search_mult_quant_reg.py:161: UserWarning: The distribution is specified by [0.1, 5] and step=0.25, but the range is not divisible by `step`. It will be replaced with [0.1, 4.85].
  error_threshold = trial.suggest_float("error_threshold", 0.1, 5, step=0.25)
[I 2026-07-21 10:18:59,087] Trial 273 finished with value: -1.0311500818832549 and parameters: {'error_threshold': 3.1, 'scalers': 'none', 'ratios': 'norm_ratio', 'imputers': 'none', 'n_estimators': 2950, 'learning_rate': 0.002252205694833633, 'max_depth': 3, 'min_child_weight': 3, 'subsample': 0.6, 'colsample_bytree': 0.9, 'colsample_bylevel': 0.9, 'reg_alpha': 4.6717439532204314e-05, 'reg_lambda': 2.8145261951974708e-05, 'gamma': 1.5775896242033847e-06}. Best is trial 217 with value: -1.0247384784192415.
/bsuhome/alexanderemert/Research/Star-Formation-Research-Project-2026/pipeline/scripts/optuna/final_preds_and_models/optuna_search_mult_quant_reg.py:161: UserWarning: The distribution is specified by [0.1, 5] and step=0.25, but the range is not divisible by `step`. It will be replaced with [0.1, 4.85].
  error_threshold = trial.suggest_float("error_threshold", 0.1, 5, step=0.25)
[I 2026-07-21 10:19:01,883] Trial 274 finished with value: -1.0269721345529736 and parameters: {'error_threshold': 3.85, 'scalers': 'none', 'ratios': 'norm_ratio', 'imputers': 'none', 'n_estimators': 2950, 'learning_rate': 0.003951127615372179, 'max_depth': 3, 'min_child_weight': 3, 'subsample': 0.6, 'colsample_bytree': 0.9, 'colsample_bylevel': 0.9, 'reg_alpha': 4.9581784064367975e-05, 'reg_lambda': 3.029734810024035e-05, 'gamma': 1.5805208896769153e-06}. Best is trial 217 with value: -1.0247384784192415.
/bsuhome/alexanderemert/Research/Star-Formation-Research-Project-2026/pipeline/scripts/optuna/final_preds_and_models/optuna_search_mult_quant_reg.py:161: UserWarning: The distribution is specified by [0.1, 5] and step=0.25, but the range is not divisible by `step`. It will be replaced with [0.1, 4.85].
  error_threshold = trial.suggest_float("error_threshold", 0.1, 5, step=0.25)
[I 2026-07-21 10:19:03,916] Trial 275 finished with value: -1.0255137716911549 and parameters: {'error_threshold': 3.85, 'scalers': 'none', 'ratios': 'norm_ratio', 'imputers': 'none', 'n_estimators': 2950, 'learning_rate': 0.003881114949602821, 'max_depth': 3, 'min_child_weight': 3, 'subsample': 0.6, 'colsample_bytree': 0.5, 'colsample_bylevel': 0.9, 'reg_alpha': 4.707737208698318e-05, 'reg_lambda': 2.791318759302836e-05, 'gamma': 1.6901591140020162e-06}. Best is trial 217 with value: -1.0247384784192415.
/bsuhome/alexanderemert/Research/Star-Formation-Research-Project-2026/pipeline/scripts/optuna/final_preds_and_models/optuna_search_mult_quant_reg.py:161: UserWarning: The distribution is specified by [0.1, 5] and step=0.25, but the range is not divisible by `step`. It will be replaced with [0.1, 4.85].
  error_threshold = trial.suggest_float("error_threshold", 0.1, 5, step=0.25)
[I 2026-07-21 10:19:05,867] Trial 276 finished with value: -1.0249866709706004 and parameters: {'error_threshold': 3.85, 'scalers': 'none', 'ratios': 'norm_ratio', 'imputers': 'none', 'n_estimators': 2900, 'learning_rate': 0.004113404834837951, 'max_depth': 3, 'min_child_weight': 3, 'subsample': 0.6, 'colsample_bytree': 0.5, 'colsample_bylevel': 0.9, 'reg_alpha': 5.0160987418055856e-05, 'reg_lambda': 5.91098785125812e-06, 'gamma': 1.6898215554598106e-06}. Best is trial 217 with value: -1.0247384784192415.
/bsuhome/alexanderemert/Research/Star-Formation-Research-Project-2026/pipeline/scripts/optuna/final_preds_and_models/optuna_search_mult_quant_reg.py:161: UserWarning: The distribution is specified by [0.1, 5] and step=0.25, but the range is not divisible by `step`. It will be replaced with [0.1, 4.85].
  error_threshold = trial.suggest_float("error_threshold", 0.1, 5, step=0.25)
[I 2026-07-21 10:19:08,805] Trial 277 finished with value: -1.0290056389152136 and parameters: {'error_threshold': 3.85, 'scalers': 'none', 'ratios': 'norm_ratio', 'imputers': 'none', 'n_estimators': 2900, 'learning_rate': 0.00394579026502843, 'max_depth': 4, 'min_child_weight': 3, 'subsample': 0.6, 'colsample_bytree': 0.5, 'colsample_bylevel': 0.9, 'reg_alpha': 6.722414916684033e-05, 'reg_lambda': 5.875372754514322e-06, 'gamma': 1.7793520744190019e-06}. Best is trial 217 with value: -1.0247384784192415.
/bsuhome/alexanderemert/Research/Star-Formation-Research-Project-2026/pipeline/scripts/optuna/final_preds_and_models/optuna_search_mult_quant_reg.py:161: UserWarning: The distribution is specified by [0.1, 5] and step=0.25, but the range is not divisible by `step`. It will be replaced with [0.1, 4.85].
  error_threshold = trial.suggest_float("error_threshold", 0.1, 5, step=0.25)
[I 2026-07-21 10:19:11,738] Trial 278 finished with value: -1.0287789540108427 and parameters: {'error_threshold': 3.85, 'scalers': 'none', 'ratios': 'norm_ratio', 'imputers': 'none', 'n_estimators': 2900, 'learning_rate': 0.0038636252530847323, 'max_depth': 4, 'min_child_weight': 3, 'subsample': 0.6, 'colsample_bytree': 0.5, 'colsample_bylevel': 0.9, 'reg_alpha': 1.5479958235271647e-05, 'reg_lambda': 5.762161346646575e-06, 'gamma': 1.9164260103592335e-06}. Best is trial 217 with value: -1.0247384784192415.
/bsuhome/alexanderemert/Research/Star-Formation-Research-Project-2026/pipeline/scripts/optuna/final_preds_and_models/optuna_search_mult_quant_reg.py:161: UserWarning: The distribution is specified by [0.1, 5] and step=0.25, but the range is not divisible by `step`. It will be replaced with [0.1, 4.85].
  error_threshold = trial.suggest_float("error_threshold", 0.1, 5, step=0.25)
[I 2026-07-21 10:19:14,676] Trial 279 finished with value: -1.0292007745682203 and parameters: {'error_threshold': 3.6, 'scalers': 'none', 'ratios': 'norm_ratio', 'imputers': 'none', 'n_estimators': 2900, 'learning_rate': 0.003935214510850661, 'max_depth': 4, 'min_child_weight': 3, 'subsample': 0.6, 'colsample_bytree': 0.5, 'colsample_bylevel': 0.9, 'reg_alpha': 7.851228669017553e-05, 'reg_lambda': 2.1092465563744234e-05, 'gamma': 1.7621797541853862e-06}. Best is trial 217 with value: -1.0247384784192415.
/bsuhome/alexanderemert/Research/Star-Formation-Research-Project-2026/pipeline/scripts/optuna/final_preds_and_models/optuna_search_mult_quant_reg.py:161: UserWarning: The distribution is specified by [0.1, 5] and step=0.25, but the range is not divisible by `step`. It will be replaced with [0.1, 4.85].
  error_threshold = trial.suggest_float("error_threshold", 0.1, 5, step=0.25)
[I 2026-07-21 10:19:17,551] Trial 280 finished with value: -1.079186582113434 and parameters: {'error_threshold': 3.85, 'scalers': 'none', 'ratios': 'norm_ratio', 'imputers': 'none', 'n_estimators': 2900, 'learning_rate': 0.021926919787982297, 'max_depth': 4, 'min_child_weight': 3, 'subsample': 0.6, 'colsample_bytree': 0.5, 'colsample_bylevel': 0.9, 'reg_alpha': 1.3818801193172042e-05, 'reg_lambda': 4.269690341818496e-05, 'gamma': 1.6993203607637335e-06}. Best is trial 217 with value: -1.0247384784192415.
/bsuhome/alexanderemert/Research/Star-Formation-Research-Project-2026/pipeline/scripts/optuna/final_preds_and_models/optuna_search_mult_quant_reg.py:161: UserWarning: The distribution is specified by [0.1, 5] and step=0.25, but the range is not divisible by `step`. It will be replaced with [0.1, 4.85].
  error_threshold = trial.suggest_float("error_threshold", 0.1, 5, step=0.25)
[I 2026-07-21 10:19:20,482] Trial 281 finished with value: -1.0295612856699135 and parameters: {'error_threshold': 3.85, 'scalers': 'none', 'ratios': 'norm_ratio', 'imputers': 'none', 'n_estimators': 2900, 'learning_rate': 0.004125950750689623, 'max_depth': 4, 'min_child_weight': 3, 'subsample': 0.6, 'colsample_bytree': 0.5, 'colsample_bylevel': 0.9, 'reg_alpha': 1.3095865749513289e-05, 'reg_lambda': 2.05456615748424e-05, 'gamma': 1.7018675120852059e-06}. Best is trial 217 with value: -1.0247384784192415.
/bsuhome/alexanderemert/Research/Star-Formation-Research-Project-2026/pipeline/scripts/optuna/final_preds_and_models/optuna_search_mult_quant_reg.py:161: UserWarning: The distribution is specified by [0.1, 5] and step=0.25, but the range is not divisible by `step`. It will be replaced with [0.1, 4.85].
  error_threshold = trial.suggest_float("error_threshold", 0.1, 5, step=0.25)
[I 2026-07-21 10:19:23,416] Trial 282 finished with value: -1.0289435821060957 and parameters: {'error_threshold': 3.6, 'scalers': 'none', 'ratios': 'norm_ratio', 'imputers': 'none', 'n_estimators': 2900, 'learning_rate': 0.00401944327410415, 'max_depth': 4, 'min_child_weight': 3, 'subsample': 0.6, 'colsample_bytree': 0.5, 'colsample_bylevel': 0.9, 'reg_alpha': 1.1783712069257403e-05, 'reg_lambda': 2.301481516811327e-05, 'gamma': 1.0397700745346132e-06}. Best is trial 217 with value: -1.0247384784192415.
/bsuhome/alexanderemert/Research/Star-Formation-Research-Project-2026/pipeline/scripts/optuna/final_preds_and_models/optuna_search_mult_quant_reg.py:161: UserWarning: The distribution is specified by [0.1, 5] and step=0.25, but the range is not divisible by `step`. It will be replaced with [0.1, 4.85].
  error_threshold = trial.suggest_float("error_threshold", 0.1, 5, step=0.25)
