[I 2026-07-21 09:50:44,855] Trial 240 finished with value: -0.0983020292742763 and parameters: {'error_threshold': 1.6, 'scalers': 'standard', 'ratios': 'norm_ratio', 'imputers': 'none', 'n_estimators': 1200, 'learning_rate': 0.03890733748025927, 'max_depth': 3, 'min_child_weight': 6, 'subsample': 0.8, 'colsample_bytree': 0.7, 'colsample_bylevel': 1.0, 'reg_alpha': 8.296798874645263e-05, 'reg_lambda': 0.0015980415071703594, 'gamma': 0.01626695442291375}. Best is trial 109 with value: -0.09757409488906987.
/bsuhome/alexanderemert/Research/Star-Formation-Research-Project-2026/pipeline/scripts/optuna/final_preds_and_models/optuna_search_mult_quant_reg.py:75: UserWarning: The distribution is specified by [0.1, 5] and step=0.25, but the range is not divisible by `step`. It will be replaced with [0.1, 4.85].
  error_threshold = trial.suggest_float("error_threshold", 0.1, 5, step=0.25)
[I 2026-07-21 09:50:51,066] Trial 241 finished with value: -0.09907576511477972 and parameters: {'error_threshold': 1.1, 'scalers': 'standard', 'ratios': 'norm_ratio', 'imputers': 'none', 'n_estimators': 1500, 'learning_rate': 0.03909657684840296, 'max_depth': 3, 'min_child_weight': 6, 'subsample': 0.8, 'colsample_bytree': 0.7, 'colsample_bylevel': 1.0, 'reg_alpha': 8.175659377072553e-05, 'reg_lambda': 0.0014555202924683064, 'gamma': 0.0014019179268862918}. Best is trial 109 with value: -0.09757409488906987.
/bsuhome/alexanderemert/Research/Star-Formation-Research-Project-2026/pipeline/scripts/optuna/final_preds_and_models/optuna_search_mult_quant_reg.py:75: UserWarning: The distribution is specified by [0.1, 5] and step=0.25, but the range is not divisible by `step`. It will be replaced with [0.1, 4.85].
  error_threshold = trial.suggest_float("error_threshold", 0.1, 5, step=0.25)
[I 2026-07-21 09:50:52,690] Trial 242 finished with value: -0.09795684989320141 and parameters: {'error_threshold': 1.6, 'scalers': 'standard', 'ratios': 'norm_ratio', 'imputers': 'none', 'n_estimators': 1500, 'learning_rate': 0.038931989881732, 'max_depth': 3, 'min_child_weight': 6, 'subsample': 0.8, 'colsample_bytree': 0.7, 'colsample_bylevel': 1.0, 'reg_alpha': 7.104860333882705e-05, 'reg_lambda': 0.0017505581035759425, 'gamma': 0.014023293364258194}. Best is trial 109 with value: -0.09757409488906987.
/bsuhome/alexanderemert/Research/Star-Formation-Research-Project-2026/pipeline/scripts/optuna/final_preds_and_models/optuna_search_mult_quant_reg.py:75: UserWarning: The distribution is specified by [0.1, 5] and step=0.25, but the range is not divisible by `step`. It will be replaced with [0.1, 4.85].
  error_threshold = trial.suggest_float("error_threshold", 0.1, 5, step=0.25)
[I 2026-07-21 09:50:57,176] Trial 244 finished with value: -0.11521983440289663 and parameters: {'error_threshold': 1.1, 'scalers': 'standard', 'ratios': 'norm_ratio', 'imputers': 'none', 'n_estimators': 1200, 'learning_rate': 0.31933838054230496, 'max_depth': 3, 'min_child_weight': 6, 'subsample': 0.8, 'colsample_bytree': 0.7, 'colsample_bylevel': 1.0, 'reg_alpha': 6.869719960796675e-05, 'reg_lambda': 0.0015557447810187431, 'gamma': 0.010965164109766928}. Best is trial 109 with value: -0.09757409488906987.
/bsuhome/alexanderemert/Research/Star-Formation-Research-Project-2026/pipeline/scripts/optuna/final_preds_and_models/optuna_search_mult_quant_reg.py:75: UserWarning: The distribution is specified by [0.1, 5] and step=0.25, but the range is not divisible by `step`. It will be replaced with [0.1, 4.85].
  error_threshold = trial.suggest_float("error_threshold", 0.1, 5, step=0.25)
[I 2026-07-21 09:51:00,370] Trial 245 finished with value: -0.09787574019252278 and parameters: {'error_threshold': 1.85, 'scalers': 'standard', 'ratios': 'norm_ratio', 'imputers': 'none', 'n_estimators': 1200, 'learning_rate': 0.05130726112675492, 'max_depth': 3, 'min_child_weight': 6, 'subsample': 0.8, 'colsample_bytree': 0.7, 'colsample_bylevel': 1.0, 'reg_alpha': 7.81311192444717e-05, 'reg_lambda': 0.0015039682658781236, 'gamma': 0.0023597179839603957}. Best is trial 109 with value: -0.09757409488906987.
/bsuhome/alexanderemert/Research/Star-Formation-Research-Project-2026/pipeline/scripts/optuna/final_preds_and_models/optuna_search_mult_quant_reg.py:75: UserWarning: The distribution is specified by [0.1, 5] and step=0.25, but the range is not divisible by `step`. It will be replaced with [0.1, 4.85].
  error_threshold = trial.suggest_float("error_threshold", 0.1, 5, step=0.25)
[I 2026-07-21 09:51:27,183] Trial 246 finished with value: -0.09881114545585218 and parameters: {'error_threshold': 1.85, 'scalers': 'standard', 'ratios': 'norm_ratio', 'imputers': 'none', 'n_estimators': 1600, 'learning_rate': 0.049525192658468956, 'max_depth': 3, 'min_child_weight': 6, 'subsample': 0.8, 'colsample_bytree': 0.7, 'colsample_bylevel': 1.0, 'reg_alpha': 8.271092127551329e-05, 'reg_lambda': 0.001583525694513268, 'gamma': 0.009110320473834239}. Best is trial 109 with value: -0.09757409488906987.
/bsuhome/alexanderemert/Research/Star-Formation-Research-Project-2026/pipeline/scripts/optuna/final_preds_and_models/optuna_search_mult_quant_reg.py:75: UserWarning: The distribution is specified by [0.1, 5] and step=0.25, but the range is not divisible by `step`. It will be replaced with [0.1, 4.85].
  error_threshold = trial.suggest_float("error_threshold", 0.1, 5, step=0.25)
[I 2026-07-21 09:51:34,358] Trial 247 finished with value: -0.09920841478860803 and parameters: {'error_threshold': 1.85, 'scalers': 'standard', 'ratios': 'norm_ratio', 'imputers': 'none', 'n_estimators': 1600, 'learning_rate': 0.05621447456816959, 'max_depth': 3, 'min_child_weight': 6, 'subsample': 0.8, 'colsample_bytree': 0.7, 'colsample_bylevel': 1.0, 'reg_alpha': 5.04817514128937e-05, 'reg_lambda': 0.0014572501465379846, 'gamma': 0.01566473493190644}. Best is trial 109 with value: -0.09757409488906987.
/bsuhome/alexanderemert/Research/Star-Formation-Research-Project-2026/pipeline/scripts/optuna/final_preds_and_models/optuna_search_mult_quant_reg.py:75: UserWarning: The distribution is specified by [0.1, 5] and step=0.25, but the range is not divisible by `step`. It will be replaced with [0.1, 4.85].
  error_threshold = trial.suggest_float("error_threshold", 0.1, 5, step=0.25)
[I 2026-07-21 09:51:35,688] Trial 248 finished with value: -0.09900945375155806 and parameters: {'error_threshold': 1.1, 'scalers': 'standard', 'ratios': 'norm_ratio', 'imputers': 'none', 'n_estimators': 1200, 'learning_rate': 0.04981510846644362, 'max_depth': 3, 'min_child_weight': 6, 'subsample': 0.8, 'colsample_bytree': 0.7, 'colsample_bylevel': 1.0, 'reg_alpha': 7.583388026694296e-05, 'reg_lambda': 0.006367050504685848, 'gamma': 0.023624293580522898}. Best is trial 109 with value: -0.09757409488906987.
/bsuhome/alexanderemert/Research/Star-Formation-Research-Project-2026/pipeline/scripts/optuna/final_preds_and_models/optuna_search_mult_quant_reg.py:75: UserWarning: The distribution is specified by [0.1, 5] and step=0.25, but the range is not divisible by `step`. It will be replaced with [0.1, 4.85].
  error_threshold = trial.suggest_float("error_threshold", 0.1, 5, step=0.25)
[I 2026-07-21 09:51:43,985] Trial 243 finished with value: -0.11704535654680275 and parameters: {'error_threshold': 1.1, 'scalers': 'standard', 'ratios': 'norm_ratio', 'imputers': 'none', 'n_estimators': 1500, 'learning_rate': 0.037094185363412024, 'max_depth': 12, 'min_child_weight': 6, 'subsample': 0.8, 'colsample_bytree': 0.7, 'colsample_bylevel': 1.0, 'reg_alpha': 6.128145410794611e-05, 'reg_lambda': 0.00151750922301789, 'gamma': 0.0014474454252762423}. Best is trial 109 with value: -0.09757409488906987.
/bsuhome/alexanderemert/Research/Star-Formation-Research-Project-2026/pipeline/scripts/optuna/final_preds_and_models/optuna_search_mult_quant_reg.py:75: UserWarning: The distribution is specified by [0.1, 5] and step=0.25, but the range is not divisible by `step`. It will be replaced with [0.1, 4.85].
  error_threshold = trial.suggest_float("error_threshold", 0.1, 5, step=0.25)
[I 2026-07-21 09:51:48,976] Trial 249 finished with value: -0.0988140373447972 and parameters: {'error_threshold': 1.85, 'scalers': 'standard', 'ratios': 'norm_ratio', 'imputers': 'none', 'n_estimators': 1600, 'learning_rate': 0.05052067832022027, 'max_depth': 3, 'min_child_weight': 6, 'subsample': 0.8, 'colsample_bytree': 0.7, 'colsample_bylevel': 1.0, 'reg_alpha': 1.738538215072507e-05, 'reg_lambda': 0.006506110791686825, 'gamma': 0.02469308249271883}. Best is trial 109 with value: -0.09757409488906987.
/bsuhome/alexanderemert/Research/Star-Formation-Research-Project-2026/pipeline/scripts/optuna/final_preds_and_models/optuna_search_mult_quant_reg.py:75: UserWarning: The distribution is specified by [0.1, 5] and step=0.25, but the range is not divisible by `step`. It will be replaced with [0.1, 4.85].
  error_threshold = trial.suggest_float("error_threshold", 0.1, 5, step=0.25)
[I 2026-07-21 09:51:50,684] Trial 250 finished with value: -0.09858669591179943 and parameters: {'error_threshold': 1.85, 'scalers': 'standard', 'ratios': 'norm_ratio', 'imputers': 'none', 'n_estimators': 1600, 'learning_rate': 0.05163302216108933, 'max_depth': 3, 'min_child_weight': 6, 'subsample': 0.8, 'colsample_bytree': 0.7, 'colsample_bylevel': 1.0, 'reg_alpha': 5.18076416602907e-05, 'reg_lambda': 0.006753506755950727, 'gamma': 0.013079352911555415}. Best is trial 109 with value: -0.09757409488906987.
/bsuhome/alexanderemert/Research/Star-Formation-Research-Project-2026/pipeline/scripts/optuna/final_preds_and_models/optuna_search_mult_quant_reg.py:75: UserWarning: The distribution is specified by [0.1, 5] and step=0.25, but the range is not divisible by `step`. It will be replaced with [0.1, 4.85].
  error_threshold = trial.suggest_float("error_threshold", 0.1, 5, step=0.25)
[I 2026-07-21 09:51:53,930] Trial 251 finished with value: -0.09828555049189182 and parameters: {'error_threshold': 1.6, 'scalers': 'standard', 'ratios': 'norm_ratio', 'imputers': 'none', 'n_estimators': 1600, 'learning_rate': 0.05161080978925469, 'max_depth': 3, 'min_child_weight': 6, 'subsample': 0.8, 'colsample_bytree': 0.7, 'colsample_bylevel': 1.0, 'reg_alpha': 5.2069703205396554e-05, 'reg_lambda': 0.006546805622136429, 'gamma': 0.01723383554867516}. Best is trial 109 with value: -0.09757409488906987.
/bsuhome/alexanderemert/Research/Star-Formation-Research-Project-2026/pipeline/scripts/optuna/final_preds_and_models/optuna_search_mult_quant_reg.py:75: UserWarning: The distribution is specified by [0.1, 5] and step=0.25, but the range is not divisible by `step`. It will be replaced with [0.1, 4.85].
  error_threshold = trial.suggest_float("error_threshold", 0.1, 5, step=0.25)
[I 2026-07-21 09:52:04,700] Trial 252 finished with value: -0.09875757227691336 and parameters: {'error_threshold': 1.85, 'scalers': 'standard', 'ratios': 'norm_ratio', 'imputers': 'none', 'n_estimators': 1550, 'learning_rate': 0.04830303778983189, 'max_depth': 3, 'min_child_weight': 6, 'subsample': 0.8, 'colsample_bytree': 0.7, 'colsample_bylevel': 1.0, 'reg_alpha': 6.309746073979802e-05, 'reg_lambda': 0.0018316611248165142, 'gamma': 0.0022694155035667437}. Best is trial 109 with value: -0.09757409488906987.
/bsuhome/alexanderemert/Research/Star-Formation-Research-Project-2026/pipeline/scripts/optuna/final_preds_and_models/optuna_search_mult_quant_reg.py:75: UserWarning: The distribution is specified by [0.1, 5] and step=0.25, but the range is not divisible by `step`. It will be replaced with [0.1, 4.85].
  error_threshold = trial.suggest_float("error_threshold", 0.1, 5, step=0.25)
[I 2026-07-21 09:52:14,143] Trial 253 finished with value: -0.09947699642865616 and parameters: {'error_threshold': 1.6, 'scalers': 'standard', 'ratios': 'norm_ratio', 'imputers': 'none', 'n_estimators': 1300, 'learning_rate': 0.05652414665921095, 'max_depth': 3, 'min_child_weight': 6, 'subsample': 0.8, 'colsample_bytree': 0.7, 'colsample_bylevel': 1.0, 'reg_alpha': 1.5997543001155676e-05, 'reg_lambda': 0.0006199057252970222, 'gamma': 0.014689949732136212}. Best is trial 109 with value: -0.09757409488906987.
/bsuhome/alexanderemert/Research/Star-Formation-Research-Project-2026/pipeline/scripts/optuna/final_preds_and_models/optuna_search_mult_quant_reg.py:75: UserWarning: The distribution is specified by [0.1, 5] and step=0.25, but the range is not divisible by `step`. It will be replaced with [0.1, 4.85].
  error_threshold = trial.suggest_float("error_threshold", 0.1, 5, step=0.25)
[I 2026-07-21 09:52:20,331] Trial 254 finished with value: -0.09861812796955993 and parameters: {'error_threshold': 1.6, 'scalers': 'standard', 'ratios': 'norm_ratio', 'imputers': 'none', 'n_estimators': 1300, 'learning_rate': 0.04706078212571393, 'max_depth': 3, 'min_child_weight': 6, 'subsample': 0.8, 'colsample_bytree': 0.7, 'colsample_bylevel': 1.0, 'reg_alpha': 2.4335019618247077e-05, 'reg_lambda': 0.0022331167833885344, 'gamma': 0.023828391408705053}. Best is trial 109 with value: -0.09757409488906987.
/bsuhome/alexanderemert/Research/Star-Formation-Research-Project-2026/pipeline/scripts/optuna/final_preds_and_models/optuna_search_mult_quant_reg.py:75: UserWarning: The distribution is specified by [0.1, 5] and step=0.25, but the range is not divisible by `step`. It will be replaced with [0.1, 4.85].
  error_threshold = trial.suggest_float("error_threshold", 0.1, 5, step=0.25)
[I 2026-07-21 09:52:23,540] Trial 256 finished with value: -0.09824387812233158 and parameters: {'error_threshold': 1.6, 'scalers': 'standard', 'ratios': 'norm_ratio', 'imputers': 'none', 'n_estimators': 1350, 'learning_rate': 0.05407683124610447, 'max_depth': 3, 'min_child_weight': 6, 'subsample': 0.8, 'colsample_bytree': 0.7, 'colsample_bylevel': 1.0, 'reg_alpha': 2.4127721366137713e-05, 'reg_lambda': 0.0029612689056314145, 'gamma': 0.0020193405764443954}. Best is trial 109 with value: -0.09757409488906987.
/bsuhome/alexanderemert/Research/Star-Formation-Research-Project-2026/pipeline/scripts/optuna/final_preds_and_models/optuna_search_mult_quant_reg.py:75: UserWarning: The distribution is specified by [0.1, 5] and step=0.25, but the range is not divisible by `step`. It will be replaced with [0.1, 4.85].
  error_threshold = trial.suggest_float("error_threshold", 0.1, 5, step=0.25)
[I 2026-07-21 09:52:41,926] Trial 257 finished with value: -0.09839562731891856 and parameters: {'error_threshold': 1.6, 'scalers': 'standard', 'ratios': 'norm_ratio', 'imputers': 'none', 'n_estimators': 1350, 'learning_rate': 0.04565090413711559, 'max_depth': 3, 'min_child_weight': 6, 'subsample': 0.8, 'colsample_bytree': 0.7, 'colsample_bylevel': 1.0, 'reg_alpha': 2.4293292645465538e-05, 'reg_lambda': 0.0028239083714024994, 'gamma': 0.0023945804906949156}. Best is trial 109 with value: -0.09757409488906987.
/bsuhome/alexanderemert/Research/Star-Formation-Research-Project-2026/pipeline/scripts/optuna/final_preds_and_models/optuna_search_mult_quant_reg.py:75: UserWarning: The distribution is specified by [0.1, 5] and step=0.25, but the range is not divisible by `step`. It will be replaced with [0.1, 4.85].
  error_threshold = trial.suggest_float("error_threshold", 0.1, 5, step=0.25)
[I 2026-07-21 09:52:43,390] Trial 258 finished with value: -0.09855717921183375 and parameters: {'error_threshold': 1.6, 'scalers': 'standard', 'ratios': 'norm_ratio', 'imputers': 'none', 'n_estimators': 1350, 'learning_rate': 0.045171382604616284, 'max_depth': 3, 'min_child_weight': 6, 'subsample': 0.8, 'colsample_bytree': 0.7, 'colsample_bylevel': 1.0, 'reg_alpha': 2.4965822430406454e-05, 'reg_lambda': 0.0023314431982634086, 'gamma': 0.0026501589313047075}. Best is trial 109 with value: -0.09757409488906987.
/bsuhome/alexanderemert/Research/Star-Formation-Research-Project-2026/pipeline/scripts/optuna/final_preds_and_models/optuna_search_mult_quant_reg.py:75: UserWarning: The distribution is specified by [0.1, 5] and step=0.25, but the range is not divisible by `step`. It will be replaced with [0.1, 4.85].
  error_threshold = trial.suggest_float("error_threshold", 0.1, 5, step=0.25)
[I 2026-07-21 09:52:46,638] Trial 259 finished with value: -0.09849979716214069 and parameters: {'error_threshold': 1.6, 'scalers': 'standard', 'ratios': 'norm_ratio', 'imputers': 'none', 'n_estimators': 1400, 'learning_rate': 0.03539583352888725, 'max_depth': 3, 'min_child_weight': 6, 'subsample': 0.8, 'colsample_bytree': 0.7, 'colsample_bylevel': 1.0, 'reg_alpha': 2.804354802733193, 'reg_lambda': 0.0007162845018178475, 'gamma': 0.002508303146585102}. Best is trial 109 with value: -0.09757409488906987.
/bsuhome/alexanderemert/Research/Star-Formation-Research-Project-2026/pipeline/scripts/optuna/final_preds_and_models/optuna_search_mult_quant_reg.py:75: UserWarning: The distribution is specified by [0.1, 5] and step=0.25, but the range is not divisible by `step`. It will be replaced with [0.1, 4.85].
  error_threshold = trial.suggest_float("error_threshold", 0.1, 5, step=0.25)
[I 2026-07-21 09:52:51,456] Trial 260 finished with value: -0.09799682343110776 and parameters: {'error_threshold': 1.6, 'scalers': 'standard', 'ratios': 'norm_ratio', 'imputers': 'none', 'n_estimators': 1400, 'learning_rate': 0.03521370955233921, 'max_depth': 3, 'min_child_weight': 6, 'subsample': 0.8, 'colsample_bytree': 0.7, 'colsample_bylevel': 1.0, 'reg_alpha': 3.818291062650609e-05, 'reg_lambda': 0.0030393186307962157, 'gamma': 0.0022280108175586656}. Best is trial 109 with value: -0.09757409488906987.
/bsuhome/alexanderemert/Research/Star-Formation-Research-Project-2026/pipeline/scripts/optuna/final_preds_and_models/optuna_search_mult_quant_reg.py:75: UserWarning: The distribution is specified by [0.1, 5] and step=0.25, but the range is not divisible by `step`. It will be replaced with [0.1, 4.85].
  error_threshold = trial.suggest_float("error_threshold", 0.1, 5, step=0.25)
[I 2026-07-21 09:52:58,908] Trial 255 finished with value: -0.11689866857619689 and parameters: {'error_threshold': 1.6, 'scalers': 'standard', 'ratios': 'norm_ratio', 'imputers': 'none', 'n_estimators': 1350, 'learning_rate': 0.04485483751242712, 'max_depth': 12, 'min_child_weight': 6, 'subsample': 0.8, 'colsample_bytree': 0.7, 'colsample_bylevel': 1.0, 'reg_alpha': 1.7526441849443014e-05, 'reg_lambda': 0.0030327310500184385, 'gamma': 0.0025913485635839597}. Best is trial 109 with value: -0.09757409488906987.
/bsuhome/alexanderemert/Research/Star-Formation-Research-Project-2026/pipeline/scripts/optuna/final_preds_and_models/optuna_search_mult_quant_reg.py:75: UserWarning: The distribution is specified by [0.1, 5] and step=0.25, but the range is not divisible by `step`. It will be replaced with [0.1, 4.85].
  error_threshold = trial.suggest_float("error_threshold", 0.1, 5, step=0.25)
[I 2026-07-21 09:53:05,664] Trial 261 finished with value: -0.10129353202410248 and parameters: {'error_threshold': 1.6, 'scalers': 'standard', 'ratios': 'norm_ratio', 'imputers': 'none', 'n_estimators': 1400, 'learning_rate': 0.035406696154969365, 'max_depth': 3, 'min_child_weight': 6, 'subsample': 0.8, 'colsample_bytree': 0.7, 'colsample_bylevel': 1.0, 'reg_alpha': 11.701429923803492, 'reg_lambda': 0.002994395115637707, 'gamma': 0.002286415537147968}. Best is trial 109 with value: -0.09757409488906987.
/bsuhome/alexanderemert/Research/Star-Formation-Research-Project-2026/pipeline/scripts/optuna/final_preds_and_models/optuna_search_mult_quant_reg.py:75: UserWarning: The distribution is specified by [0.1, 5] and step=0.25, but the range is not divisible by `step`. It will be replaced with [0.1, 4.85].
  error_threshold = trial.suggest_float("error_threshold", 0.1, 5, step=0.25)
[I 2026-07-21 09:53:12,381] Trial 262 finished with value: -0.09766370509235968 and parameters: {'error_threshold': 1.6, 'scalers': 'standard', 'ratios': 'norm_ratio', 'imputers': 'none', 'n_estimators': 1400, 'learning_rate': 0.034211394224588916, 'max_depth': 3, 'min_child_weight': 6, 'subsample': 0.8, 'colsample_bytree': 0.7, 'colsample_bylevel': 1.0, 'reg_alpha': 0.0001183231261083298, 'reg_lambda': 0.00330571299769271, 'gamma': 0.0024965839382952194}. Best is trial 109 with value: -0.09757409488906987.
/bsuhome/alexanderemert/Research/Star-Formation-Research-Project-2026/pipeline/scripts/optuna/final_preds_and_models/optuna_search_mult_quant_reg.py:75: UserWarning: The distribution is specified by [0.1, 5] and step=0.25, but the range is not divisible by `step`. It will be replaced with [0.1, 4.85].
  error_threshold = trial.suggest_float("error_threshold", 0.1, 5, step=0.25)
[I 2026-07-21 09:53:15,107] Trial 263 finished with value: -0.09753725374857396 and parameters: {'error_threshold': 1.6, 'scalers': 'standard', 'ratios': 'norm_ratio', 'imputers': 'none', 'n_estimators': 1400, 'learning_rate': 0.034777498252462936, 'max_depth': 3, 'min_child_weight': 6, 'subsample': 0.8, 'colsample_bytree': 0.7, 'colsample_bylevel': 1.0, 'reg_alpha': 0.00012034415196943827, 'reg_lambda': 0.0038559309113738037, 'gamma': 0.0026138168707499}. Best is trial 263 with value: -0.09753725374857396.
/bsuhome/alexanderemert/Research/Star-Formation-Research-Project-2026/pipeline/scripts/optuna/final_preds_and_models/optuna_search_mult_quant_reg.py:75: UserWarning: The distribution is specified by [0.1, 5] and step=0.25, but the range is not divisible by `step`. It will be replaced with [0.1, 4.85].
  error_threshold = trial.suggest_float("error_threshold", 0.1, 5, step=0.25)
