[I 2026-07-20 15:00:45,189] Trial 264 finished with value: -1.6532995577750709 and parameters: {'error_threshold': 3.1, 'scalers': 'standard', 'ratios': 'log_ratio', 'imputers': 'none', 'n_estimators': 250, 'learning_rate': 0.00014457507352540774, 'max_depth': 6, 'min_child_weight': 6, 'subsample': 0.7, 'colsample_bytree': 0.5, 'colsample_bylevel': 0.8, 'reg_alpha': 0.009884910045797094, 'reg_lambda': 29.161203208110035, 'gamma': 93.65023808821451}. Best is trial 183 with value: -1.6583770069254369.
/bsuhome/alexanderemert/Research/Star-Formation-Research-Project-2026/pipeline/scripts/optuna/final_preds_and_models/optuna_search_mult_quant_reg.py:75: UserWarning: The distribution is specified by [0.1, 5] and step=0.25, but the range is not divisible by `step`. It will be replaced with [0.1, 4.85].
  error_threshold = trial.suggest_float("error_threshold", 0.1, 5, step=0.25)
[I 2026-07-20 15:00:45,469] Trial 265 finished with value: -1.6536677204986499 and parameters: {'error_threshold': 3.1, 'scalers': 'standard', 'ratios': 'log_ratio', 'imputers': 'none', 'n_estimators': 250, 'learning_rate': 0.00014180471307333534, 'max_depth': 6, 'min_child_weight': 6, 'subsample': 0.7, 'colsample_bytree': 0.5, 'colsample_bylevel': 0.8, 'reg_alpha': 0.010533090370217026, 'reg_lambda': 28.424865535043548, 'gamma': 98.19000744388875}. Best is trial 183 with value: -1.6583770069254369.
/bsuhome/alexanderemert/Research/Star-Formation-Research-Project-2026/pipeline/scripts/optuna/final_preds_and_models/optuna_search_mult_quant_reg.py:75: UserWarning: The distribution is specified by [0.1, 5] and step=0.25, but the range is not divisible by `step`. It will be replaced with [0.1, 4.85].
  error_threshold = trial.suggest_float("error_threshold", 0.1, 5, step=0.25)
[I 2026-07-20 15:00:45,599] Trial 266 finished with value: -1.6545098285960282 and parameters: {'error_threshold': 3.1, 'scalers': 'standard', 'ratios': 'log_ratio', 'imputers': 'none', 'n_estimators': 200, 'learning_rate': 0.00014371280369669516, 'max_depth': 6, 'min_child_weight': 6, 'subsample': 0.7, 'colsample_bytree': 0.5, 'colsample_bylevel': 0.8, 'reg_alpha': 0.04287152854570345, 'reg_lambda': 29.85024214109284, 'gamma': 98.78788085534835}. Best is trial 183 with value: -1.6583770069254369.
/bsuhome/alexanderemert/Research/Star-Formation-Research-Project-2026/pipeline/scripts/optuna/final_preds_and_models/optuna_search_mult_quant_reg.py:75: UserWarning: The distribution is specified by [0.1, 5] and step=0.25, but the range is not divisible by `step`. It will be replaced with [0.1, 4.85].
  error_threshold = trial.suggest_float("error_threshold", 0.1, 5, step=0.25)
[I 2026-07-20 15:00:45,727] Trial 267 finished with value: -1.6542118861404436 and parameters: {'error_threshold': 1.85, 'scalers': 'standard', 'ratios': 'log_ratio', 'imputers': 'none', 'n_estimators': 200, 'learning_rate': 0.0001415890375613272, 'max_depth': 6, 'min_child_weight': 6, 'subsample': 0.7, 'colsample_bytree': 0.5, 'colsample_bylevel': 0.8, 'reg_alpha': 0.0508157091556105, 'reg_lambda': 32.862193752647904, 'gamma': 92.31470757659761}. Best is trial 183 with value: -1.6583770069254369.
/bsuhome/alexanderemert/Research/Star-Formation-Research-Project-2026/pipeline/scripts/optuna/final_preds_and_models/optuna_search_mult_quant_reg.py:75: UserWarning: The distribution is specified by [0.1, 5] and step=0.25, but the range is not divisible by `step`. It will be replaced with [0.1, 4.85].
  error_threshold = trial.suggest_float("error_threshold", 0.1, 5, step=0.25)
[I 2026-07-20 15:00:46,026] Trial 268 finished with value: -1.6547745967447425 and parameters: {'error_threshold': 1.85, 'scalers': 'standard', 'ratios': 'log_ratio', 'imputers': 'none', 'n_estimators': 200, 'learning_rate': 0.00013898088737235575, 'max_depth': 6, 'min_child_weight': 6, 'subsample': 0.7, 'colsample_bytree': 0.5, 'colsample_bylevel': 0.8, 'reg_alpha': 0.010392659969833823, 'reg_lambda': 97.8046274154906, 'gamma': 97.7836945026841}. Best is trial 183 with value: -1.6583770069254369.
/bsuhome/alexanderemert/Research/Star-Formation-Research-Project-2026/pipeline/scripts/optuna/final_preds_and_models/optuna_search_mult_quant_reg.py:75: UserWarning: The distribution is specified by [0.1, 5] and step=0.25, but the range is not divisible by `step`. It will be replaced with [0.1, 4.85].
  error_threshold = trial.suggest_float("error_threshold", 0.1, 5, step=0.25)
[I 2026-07-20 15:00:47,078] Trial 269 finished with value: -1.6534548593568221 and parameters: {'error_threshold': 1.85, 'scalers': 'standard', 'ratios': 'log_ratio', 'imputers': 'none', 'n_estimators': 200, 'learning_rate': 0.00014332950844933622, 'max_depth': 6, 'min_child_weight': 6, 'subsample': 0.7, 'colsample_bytree': 0.5, 'colsample_bylevel': 0.8, 'reg_alpha': 0.009818541223208854, 'reg_lambda': 87.34885254527309, 'gamma': 82.7639209254727}. Best is trial 183 with value: -1.6583770069254369.
/bsuhome/alexanderemert/Research/Star-Formation-Research-Project-2026/pipeline/scripts/optuna/final_preds_and_models/optuna_search_mult_quant_reg.py:75: UserWarning: The distribution is specified by [0.1, 5] and step=0.25, but the range is not divisible by `step`. It will be replaced with [0.1, 4.85].
  error_threshold = trial.suggest_float("error_threshold", 0.1, 5, step=0.25)
[I 2026-07-20 15:00:47,391] Trial 270 finished with value: -1.6548253238202129 and parameters: {'error_threshold': 1.85, 'scalers': 'standard', 'ratios': 'log_ratio', 'imputers': 'none', 'n_estimators': 200, 'learning_rate': 0.00013651808939042822, 'max_depth': 6, 'min_child_weight': 6, 'subsample': 0.7, 'colsample_bytree': 0.5, 'colsample_bylevel': 0.8, 'reg_alpha': 0.011044029852548444, 'reg_lambda': 46.55670178292923, 'gamma': 99.42670012498327}. Best is trial 183 with value: -1.6583770069254369.
/bsuhome/alexanderemert/Research/Star-Formation-Research-Project-2026/pipeline/scripts/optuna/final_preds_and_models/optuna_search_mult_quant_reg.py:75: UserWarning: The distribution is specified by [0.1, 5] and step=0.25, but the range is not divisible by `step`. It will be replaced with [0.1, 4.85].
  error_threshold = trial.suggest_float("error_threshold", 0.1, 5, step=0.25)
[I 2026-07-20 15:00:47,811] Trial 271 finished with value: -1.6547042490732728 and parameters: {'error_threshold': 1.85, 'scalers': 'standard', 'ratios': 'log_ratio', 'imputers': 'none', 'n_estimators': 200, 'learning_rate': 0.00013531942434852774, 'max_depth': 6, 'min_child_weight': 6, 'subsample': 0.7, 'colsample_bytree': 0.5, 'colsample_bylevel': 0.8, 'reg_alpha': 0.02618603657109261, 'reg_lambda': 99.42703757687522, 'gamma': 91.06208834781351}. Best is trial 183 with value: -1.6583770069254369.
/bsuhome/alexanderemert/Research/Star-Formation-Research-Project-2026/pipeline/scripts/optuna/final_preds_and_models/optuna_search_mult_quant_reg.py:75: UserWarning: The distribution is specified by [0.1, 5] and step=0.25, but the range is not divisible by `step`. It will be replaced with [0.1, 4.85].
  error_threshold = trial.suggest_float("error_threshold", 0.1, 5, step=0.25)
[I 2026-07-20 15:00:48,126] Trial 272 finished with value: -1.655375460780097 and parameters: {'error_threshold': 1.85, 'scalers': 'standard', 'ratios': 'log_ratio', 'imputers': 'none', 'n_estimators': 200, 'learning_rate': 0.0001157119153870861, 'max_depth': 6, 'min_child_weight': 6, 'subsample': 0.7, 'colsample_bytree': 0.5, 'colsample_bylevel': 0.8, 'reg_alpha': 0.028897051415909855, 'reg_lambda': 97.72068464870516, 'gamma': 96.26479903344358}. Best is trial 183 with value: -1.6583770069254369.
/bsuhome/alexanderemert/Research/Star-Formation-Research-Project-2026/pipeline/scripts/optuna/final_preds_and_models/optuna_search_mult_quant_reg.py:75: UserWarning: The distribution is specified by [0.1, 5] and step=0.25, but the range is not divisible by `step`. It will be replaced with [0.1, 4.85].
  error_threshold = trial.suggest_float("error_threshold", 0.1, 5, step=0.25)
[I 2026-07-20 15:00:48,226] Trial 274 finished with value: -1.6568889891848313 and parameters: {'error_threshold': 1.85, 'scalers': 'standard', 'ratios': 'log_ratio', 'imputers': 'none', 'n_estimators': 100, 'learning_rate': 0.00011890335940687996, 'max_depth': 6, 'min_child_weight': 6, 'subsample': 0.7, 'colsample_bytree': 0.5, 'colsample_bylevel': 0.8, 'reg_alpha': 0.027137096567804997, 'reg_lambda': 48.39076441456788, 'gamma': 98.932060390635}. Best is trial 183 with value: -1.6583770069254369.
/bsuhome/alexanderemert/Research/Star-Formation-Research-Project-2026/pipeline/scripts/optuna/final_preds_and_models/optuna_search_mult_quant_reg.py:75: UserWarning: The distribution is specified by [0.1, 5] and step=0.25, but the range is not divisible by `step`. It will be replaced with [0.1, 4.85].
  error_threshold = trial.suggest_float("error_threshold", 0.1, 5, step=0.25)
[I 2026-07-20 15:00:48,488] Trial 273 finished with value: -1.6552659770924014 and parameters: {'error_threshold': 1.85, 'scalers': 'standard', 'ratios': 'log_ratio', 'imputers': 'none', 'n_estimators': 200, 'learning_rate': 0.00011721466367813722, 'max_depth': 6, 'min_child_weight': 6, 'subsample': 0.7, 'colsample_bytree': 0.5, 'colsample_bylevel': 0.8, 'reg_alpha': 0.027472269265644247, 'reg_lambda': 95.46771410655975, 'gamma': 93.37167401911006}. Best is trial 183 with value: -1.6583770069254369.
/bsuhome/alexanderemert/Research/Star-Formation-Research-Project-2026/pipeline/scripts/optuna/final_preds_and_models/optuna_search_mult_quant_reg.py:75: UserWarning: The distribution is specified by [0.1, 5] and step=0.25, but the range is not divisible by `step`. It will be replaced with [0.1, 4.85].
  error_threshold = trial.suggest_float("error_threshold", 0.1, 5, step=0.25)
[I 2026-07-20 15:00:48,539] Trial 275 finished with value: -1.6569466349514226 and parameters: {'error_threshold': 1.85, 'scalers': 'standard', 'ratios': 'log_ratio', 'imputers': 'none', 'n_estimators': 100, 'learning_rate': 0.00011383199292292671, 'max_depth': 6, 'min_child_weight': 6, 'subsample': 0.7, 'colsample_bytree': 0.5, 'colsample_bylevel': 0.8, 'reg_alpha': 0.029922316443581228, 'reg_lambda': 50.49023356359125, 'gamma': 99.20783411405652}. Best is trial 183 with value: -1.6583770069254369.
/bsuhome/alexanderemert/Research/Star-Formation-Research-Project-2026/pipeline/scripts/optuna/final_preds_and_models/optuna_search_mult_quant_reg.py:75: UserWarning: The distribution is specified by [0.1, 5] and step=0.25, but the range is not divisible by `step`. It will be replaced with [0.1, 4.85].
  error_threshold = trial.suggest_float("error_threshold", 0.1, 5, step=0.25)
[I 2026-07-20 15:00:48,816] Trial 276 finished with value: -1.655486642068519 and parameters: {'error_threshold': 1.85, 'scalers': 'standard', 'ratios': 'log_ratio', 'imputers': 'none', 'n_estimators': 100, 'learning_rate': 0.00011562008917957233, 'max_depth': 5, 'min_child_weight': 6, 'subsample': 0.7, 'colsample_bytree': 0.5, 'colsample_bylevel': 0.8, 'reg_alpha': 0.028183425438937725, 'reg_lambda': 8.21038539503671, 'gamma': 59.47944661885336}. Best is trial 183 with value: -1.6583770069254369.
/bsuhome/alexanderemert/Research/Star-Formation-Research-Project-2026/pipeline/scripts/optuna/final_preds_and_models/optuna_search_mult_quant_reg.py:75: UserWarning: The distribution is specified by [0.1, 5] and step=0.25, but the range is not divisible by `step`. It will be replaced with [0.1, 4.85].
  error_threshold = trial.suggest_float("error_threshold", 0.1, 5, step=0.25)
[I 2026-07-20 15:00:49,119] Trial 277 finished with value: -1.6558637825662643 and parameters: {'error_threshold': 2.35, 'scalers': 'standard', 'ratios': 'log_ratio', 'imputers': 'mean', 'n_estimators': 100, 'learning_rate': 0.0001001384870761655, 'max_depth': 5, 'min_child_weight': 6, 'subsample': 0.7, 'colsample_bytree': 0.5, 'colsample_bylevel': 0.8, 'reg_alpha': 0.029676415431974218, 'reg_lambda': 50.370593055408044, 'gamma': 56.214599317751755}. Best is trial 183 with value: -1.6583770069254369.
/bsuhome/alexanderemert/Research/Star-Formation-Research-Project-2026/pipeline/scripts/optuna/final_preds_and_models/optuna_search_mult_quant_reg.py:75: UserWarning: The distribution is specified by [0.1, 5] and step=0.25, but the range is not divisible by `step`. It will be replaced with [0.1, 4.85].
  error_threshold = trial.suggest_float("error_threshold", 0.1, 5, step=0.25)
[I 2026-07-20 15:00:49,386] Trial 278 finished with value: -1.6558590638535355 and parameters: {'error_threshold': 2.1, 'scalers': 'standard', 'ratios': 'log_ratio', 'imputers': 'mean', 'n_estimators': 100, 'learning_rate': 0.00010038293102893936, 'max_depth': 5, 'min_child_weight': 6, 'subsample': 0.7, 'colsample_bytree': 0.5, 'colsample_bylevel': 0.8, 'reg_alpha': 0.026697023539195737, 'reg_lambda': 47.017002098876766, 'gamma': 59.580141933492534}. Best is trial 183 with value: -1.6583770069254369.
/bsuhome/alexanderemert/Research/Star-Formation-Research-Project-2026/pipeline/scripts/optuna/final_preds_and_models/optuna_search_mult_quant_reg.py:75: UserWarning: The distribution is specified by [0.1, 5] and step=0.25, but the range is not divisible by `step`. It will be replaced with [0.1, 4.85].
  error_threshold = trial.suggest_float("error_threshold", 0.1, 5, step=0.25)
[I 2026-07-20 15:00:49,536] Trial 279 finished with value: -1.6554967877951003 and parameters: {'error_threshold': 2.1, 'scalers': 'standard', 'ratios': 'log_ratio', 'imputers': 'mean', 'n_estimators': 100, 'learning_rate': 0.00011405852596159132, 'max_depth': 5, 'min_child_weight': 6, 'subsample': 0.7, 'colsample_bytree': 0.5, 'colsample_bylevel': 0.8, 'reg_alpha': 0.02610791685569297, 'reg_lambda': 8.315308406015241, 'gamma': 51.51081062724733}. Best is trial 183 with value: -1.6583770069254369.
/bsuhome/alexanderemert/Research/Star-Formation-Research-Project-2026/pipeline/scripts/optuna/final_preds_and_models/optuna_search_mult_quant_reg.py:75: UserWarning: The distribution is specified by [0.1, 5] and step=0.25, but the range is not divisible by `step`. It will be replaced with [0.1, 4.85].
  error_threshold = trial.suggest_float("error_threshold", 0.1, 5, step=0.25)
[I 2026-07-20 15:00:49,944] Trial 280 finished with value: -1.6531845802524252 and parameters: {'error_threshold': 2.1, 'scalers': 'standard', 'ratios': 'log_ratio', 'imputers': 'mean', 'n_estimators': 100, 'learning_rate': 0.0002083990462720375, 'max_depth': 5, 'min_child_weight': 6, 'subsample': 0.7, 'colsample_bytree': 0.5, 'colsample_bylevel': 0.8, 'reg_alpha': 0.023713406057257642, 'reg_lambda': 50.22423364758842, 'gamma': 56.76521958236034}. Best is trial 183 with value: -1.6583770069254369.
/bsuhome/alexanderemert/Research/Star-Formation-Research-Project-2026/pipeline/scripts/optuna/final_preds_and_models/optuna_search_mult_quant_reg.py:75: UserWarning: The distribution is specified by [0.1, 5] and step=0.25, but the range is not divisible by `step`. It will be replaced with [0.1, 4.85].
  error_threshold = trial.suggest_float("error_threshold", 0.1, 5, step=0.25)
[I 2026-07-20 15:00:50,447] Trial 281 finished with value: -1.6554448066819205 and parameters: {'error_threshold': 2.1, 'scalers': 'standard', 'ratios': 'log_ratio', 'imputers': 'mean', 'n_estimators': 100, 'learning_rate': 0.00011734283961625348, 'max_depth': 5, 'min_child_weight': 7, 'subsample': 0.7, 'colsample_bytree': 0.5, 'colsample_bylevel': 0.8, 'reg_alpha': 0.022890555198215454, 'reg_lambda': 0.00022593909464648315, 'gamma': 59.372459092758795}. Best is trial 183 with value: -1.6583770069254369.
/bsuhome/alexanderemert/Research/Star-Formation-Research-Project-2026/pipeline/scripts/optuna/final_preds_and_models/optuna_search_mult_quant_reg.py:75: UserWarning: The distribution is specified by [0.1, 5] and step=0.25, but the range is not divisible by `step`. It will be replaced with [0.1, 4.85].
  error_threshold = trial.suggest_float("error_threshold", 0.1, 5, step=0.25)
[I 2026-07-20 15:00:50,620] Trial 282 finished with value: -1.655474357372572 and parameters: {'error_threshold': 2.1, 'scalers': 'standard', 'ratios': 'log_ratio', 'imputers': 'mean', 'n_estimators': 100, 'learning_rate': 0.0001161336367424965, 'max_depth': 6, 'min_child_weight': 6, 'subsample': 0.7, 'colsample_bytree': 0.5, 'colsample_bylevel': 0.8, 'reg_alpha': 0.02099945575433502, 'reg_lambda': 0.0002077410074731807, 'gamma': 58.86574829578075}. Best is trial 183 with value: -1.6583770069254369.
/bsuhome/alexanderemert/Research/Star-Formation-Research-Project-2026/pipeline/scripts/optuna/final_preds_and_models/optuna_search_mult_quant_reg.py:75: UserWarning: The distribution is specified by [0.1, 5] and step=0.25, but the range is not divisible by `step`. It will be replaced with [0.1, 4.85].
  error_threshold = trial.suggest_float("error_threshold", 0.1, 5, step=0.25)
[I 2026-07-20 15:00:50,936] Trial 283 finished with value: -1.6555102060750955 and parameters: {'error_threshold': 2.1, 'scalers': 'standard', 'ratios': 'log_ratio', 'imputers': 'mean', 'n_estimators': 100, 'learning_rate': 0.00011438723902565241, 'max_depth': 5, 'min_child_weight': 7, 'subsample': 0.7, 'colsample_bytree': 0.5, 'colsample_bylevel': 0.8, 'reg_alpha': 0.007069132023230712, 'reg_lambda': 48.99920947041464, 'gamma': 60.80860560959585}. Best is trial 183 with value: -1.6583770069254369.
/bsuhome/alexanderemert/Research/Star-Formation-Research-Project-2026/pipeline/scripts/optuna/final_preds_and_models/optuna_search_mult_quant_reg.py:75: UserWarning: The distribution is specified by [0.1, 5] and step=0.25, but the range is not divisible by `step`. It will be replaced with [0.1, 4.85].
  error_threshold = trial.suggest_float("error_threshold", 0.1, 5, step=0.25)
[I 2026-07-20 15:00:51,022] Trial 284 finished with value: -1.6532401662902927 and parameters: {'error_threshold': 2.1, 'scalers': 'standard', 'ratios': 'log_ratio', 'imputers': 'mean', 'n_estimators': 100, 'learning_rate': 0.0002060666505561854, 'max_depth': 6, 'min_child_weight': 7, 'subsample': 0.7, 'colsample_bytree': 0.5, 'colsample_bylevel': 0.8, 'reg_alpha': 0.005810189781028464, 'reg_lambda': 51.080024651918755, 'gamma': 60.83888208350238}. Best is trial 183 with value: -1.6583770069254369.
/bsuhome/alexanderemert/Research/Star-Formation-Research-Project-2026/pipeline/scripts/optuna/final_preds_and_models/optuna_search_mult_quant_reg.py:75: UserWarning: The distribution is specified by [0.1, 5] and step=0.25, but the range is not divisible by `step`. It will be replaced with [0.1, 4.85].
  error_threshold = trial.suggest_float("error_threshold", 0.1, 5, step=0.25)
[I 2026-07-20 15:00:51,110] Trial 285 finished with value: -1.653244187125323 and parameters: {'error_threshold': 2.35, 'scalers': 'standard', 'ratios': 'log_ratio', 'imputers': 'mean', 'n_estimators': 100, 'learning_rate': 0.00020593044356214058, 'max_depth': 6, 'min_child_weight': 6, 'subsample': 0.7, 'colsample_bytree': 0.5, 'colsample_bylevel': 0.8, 'reg_alpha': 0.03550044312940554, 'reg_lambda': 52.66183532139426, 'gamma': 58.33423041400123}. Best is trial 183 with value: -1.6583770069254369.
/bsuhome/alexanderemert/Research/Star-Formation-Research-Project-2026/pipeline/scripts/optuna/final_preds_and_models/optuna_search_mult_quant_reg.py:75: UserWarning: The distribution is specified by [0.1, 5] and step=0.25, but the range is not divisible by `step`. It will be replaced with [0.1, 4.85].
  error_threshold = trial.suggest_float("error_threshold", 0.1, 5, step=0.25)
[I 2026-07-20 15:00:51,468] Trial 286 finished with value: -1.6501567339671503 and parameters: {'error_threshold': 2.35, 'scalers': 'standard', 'ratios': 'log_ratio', 'imputers': 'mean', 'n_estimators': 150, 'learning_rate': 0.00021887851004954604, 'max_depth': 5, 'min_child_weight': 6, 'subsample': 0.7, 'colsample_bytree': 0.5, 'colsample_bylevel': 0.8, 'reg_alpha': 0.040107481566507716, 'reg_lambda': 49.87259999805147, 'gamma': 58.798659573493254}. Best is trial 183 with value: -1.6583770069254369.
/bsuhome/alexanderemert/Research/Star-Formation-Research-Project-2026/pipeline/scripts/optuna/final_preds_and_models/optuna_search_mult_quant_reg.py:75: UserWarning: The distribution is specified by [0.1, 5] and step=0.25, but the range is not divisible by `step`. It will be replaced with [0.1, 4.85].
  error_threshold = trial.suggest_float("error_threshold", 0.1, 5, step=0.25)
[I 2026-07-20 15:00:51,924] Trial 288 finished with value: -1.6545841168376219 and parameters: {'error_threshold': 2.35, 'scalers': 'standard', 'ratios': 'log_ratio', 'imputers': 'mean', 'n_estimators': 150, 'learning_rate': 0.00010004230334547531, 'max_depth': 5, 'min_child_weight': 7, 'subsample': 0.7, 'colsample_bytree': 0.5, 'colsample_bylevel': 0.8, 'reg_alpha': 6.373598311581863e-06, 'reg_lambda': 1.3773091308425105e-05, 'gamma': 65.62952458005671}. Best is trial 183 with value: -1.6583770069254369.
/bsuhome/alexanderemert/Research/Star-Formation-Research-Project-2026/pipeline/scripts/optuna/final_preds_and_models/optuna_search_mult_quant_reg.py:75: UserWarning: The distribution is specified by [0.1, 5] and step=0.25, but the range is not divisible by `step`. It will be replaced with [0.1, 4.85].
  error_threshold = trial.suggest_float("error_threshold", 0.1, 5, step=0.25)
