[I 2026-07-21 14:00:49,148] Trial 119 finished with value: -3.781468913151953 and parameters: {'error_threshold': 1.1, 'scalers': 'none', 'ratios': 'log_ratio', 'imputers': 'median', 'n_estimators': 2100, 'learning_rate': 0.0018152469603180362, 'max_depth': 3, 'min_child_weight': 6, 'subsample': 0.7, 'colsample_bytree': 0.8, 'colsample_bylevel': 0.8, 'reg_alpha': 1.5811811411967764, 'reg_lambda': 0.24929930182683183, 'gamma': 0.09645015773743659}. Best is trial 106 with value: -3.779169236656063.
/bsuhome/alexanderemert/Research/Star-Formation-Research-Project-2026/pipeline/scripts/optuna/final_preds_and_models/optuna_search_mult_quant_reg.py:162: UserWarning: The distribution is specified by [0.1, 5] and step=0.25, but the range is not divisible by `step`. It will be replaced with [0.1, 4.85].
  error_threshold = trial.suggest_float("error_threshold", 0.1, 5, step=0.25)
[I 2026-07-21 14:00:50,775] Trial 120 finished with value: -3.7801326542012768 and parameters: {'error_threshold': 1.85, 'scalers': 'none', 'ratios': 'log_ratio', 'imputers': 'median', 'n_estimators': 2100, 'learning_rate': 0.003204273331324461, 'max_depth': 3, 'min_child_weight': 6, 'subsample': 0.7, 'colsample_bytree': 0.7, 'colsample_bylevel': 0.8, 'reg_alpha': 1.4825957265801795, 'reg_lambda': 0.00077923830848211, 'gamma': 0.008635522827868582}. Best is trial 106 with value: -3.779169236656063.
/bsuhome/alexanderemert/Research/Star-Formation-Research-Project-2026/pipeline/scripts/optuna/final_preds_and_models/optuna_search_mult_quant_reg.py:162: UserWarning: The distribution is specified by [0.1, 5] and step=0.25, but the range is not divisible by `step`. It will be replaced with [0.1, 4.85].
  error_threshold = trial.suggest_float("error_threshold", 0.1, 5, step=0.25)
[I 2026-07-21 14:00:52,238] Trial 121 finished with value: -3.802243781946458 and parameters: {'error_threshold': 0.35, 'scalers': 'none', 'ratios': 'log_ratio', 'imputers': 'median', 'n_estimators': 1900, 'learning_rate': 0.003139040250455101, 'max_depth': 3, 'min_child_weight': 6, 'subsample': 0.7, 'colsample_bytree': 0.7, 'colsample_bylevel': 0.8, 'reg_alpha': 0.013224710256102125, 'reg_lambda': 0.24281297604971702, 'gamma': 0.007668552119666865}. Best is trial 106 with value: -3.779169236656063.
/bsuhome/alexanderemert/Research/Star-Formation-Research-Project-2026/pipeline/scripts/optuna/final_preds_and_models/optuna_search_mult_quant_reg.py:162: UserWarning: The distribution is specified by [0.1, 5] and step=0.25, but the range is not divisible by `step`. It will be replaced with [0.1, 4.85].
  error_threshold = trial.suggest_float("error_threshold", 0.1, 5, step=0.25)
[I 2026-07-21 14:01:14,624] Trial 114 finished with value: -3.8782124448524695 and parameters: {'error_threshold': 0.6, 'scalers': 'none', 'ratios': 'log_ratio', 'imputers': 'median', 'n_estimators': 2100, 'learning_rate': 0.0030844444103959047, 'max_depth': 9, 'min_child_weight': 2, 'subsample': 0.7, 'colsample_bytree': 0.9, 'colsample_bylevel': 0.8, 'reg_alpha': 0.02637435604219328, 'reg_lambda': 6.359611320170531, 'gamma': 0.007225432093208286}. Best is trial 106 with value: -3.779169236656063.
/bsuhome/alexanderemert/Research/Star-Formation-Research-Project-2026/pipeline/scripts/optuna/final_preds_and_models/optuna_search_mult_quant_reg.py:162: UserWarning: The distribution is specified by [0.1, 5] and step=0.25, but the range is not divisible by `step`. It will be replaced with [0.1, 4.85].
  error_threshold = trial.suggest_float("error_threshold", 0.1, 5, step=0.25)
[I 2026-07-21 14:01:23,612] Trial 117 finished with value: -3.85743490591174 and parameters: {'error_threshold': 1.1, 'scalers': 'robust', 'ratios': 'log_ratio', 'imputers': 'none', 'n_estimators': 2100, 'learning_rate': 0.0030924144267926025, 'max_depth': 9, 'min_child_weight': 6, 'subsample': 0.8, 'colsample_bytree': 0.8, 'colsample_bylevel': 0.8, 'reg_alpha': 0.02722992836575233, 'reg_lambda': 6.585400385207463, 'gamma': 15.848295635833145}. Best is trial 106 with value: -3.779169236656063.
/bsuhome/alexanderemert/Research/Star-Formation-Research-Project-2026/pipeline/scripts/optuna/final_preds_and_models/optuna_search_mult_quant_reg.py:162: UserWarning: The distribution is specified by [0.1, 5] and step=0.25, but the range is not divisible by `step`. It will be replaced with [0.1, 4.85].
  error_threshold = trial.suggest_float("error_threshold", 0.1, 5, step=0.25)
[I 2026-07-21 14:01:25,002] Trial 122 finished with value: -3.8071771519750897 and parameters: {'error_threshold': 0.35, 'scalers': 'none', 'ratios': 'log_ratio', 'imputers': 'median', 'n_estimators': 1900, 'learning_rate': 0.003580661538113627, 'max_depth': 3, 'min_child_weight': 6, 'subsample': 0.8, 'colsample_bytree': 0.7, 'colsample_bylevel': 0.9, 'reg_alpha': 0.012302715795091105, 'reg_lambda': 0.24299945726908578, 'gamma': 0.007011798566218191}. Best is trial 106 with value: -3.779169236656063.
/bsuhome/alexanderemert/Research/Star-Formation-Research-Project-2026/pipeline/scripts/optuna/final_preds_and_models/optuna_search_mult_quant_reg.py:162: UserWarning: The distribution is specified by [0.1, 5] and step=0.25, but the range is not divisible by `step`. It will be replaced with [0.1, 4.85].
  error_threshold = trial.suggest_float("error_threshold", 0.1, 5, step=0.25)
[I 2026-07-21 14:01:39,024] Trial 116 finished with value: -3.8788418492400627 and parameters: {'error_threshold': 1.35, 'scalers': 'robust', 'ratios': 'log_ratio', 'imputers': 'median', 'n_estimators': 1950, 'learning_rate': 0.0029568156216430476, 'max_depth': 9, 'min_child_weight': 6, 'subsample': 0.9, 'colsample_bytree': 0.9, 'colsample_bylevel': 0.8, 'reg_alpha': 0.02646568211415362, 'reg_lambda': 6.1282443345993, 'gamma': 0.007451280800172113}. Best is trial 106 with value: -3.779169236656063.
/bsuhome/alexanderemert/Research/Star-Formation-Research-Project-2026/pipeline/scripts/optuna/final_preds_and_models/optuna_search_mult_quant_reg.py:162: UserWarning: The distribution is specified by [0.1, 5] and step=0.25, but the range is not divisible by `step`. It will be replaced with [0.1, 4.85].
  error_threshold = trial.suggest_float("error_threshold", 0.1, 5, step=0.25)
[I 2026-07-21 14:01:40,682] Trial 123 finished with value: -3.783021865276496 and parameters: {'error_threshold': 1.1, 'scalers': 'none', 'ratios': 'log_ratio', 'imputers': 'none', 'n_estimators': 2150, 'learning_rate': 0.0017989401162977652, 'max_depth': 3, 'min_child_weight': 6, 'subsample': 0.8, 'colsample_bytree': 0.7, 'colsample_bylevel': 0.9, 'reg_alpha': 0.3217178644270592, 'reg_lambda': 0.0004601948576329473, 'gamma': 8.836489327747652e-05}. Best is trial 106 with value: -3.779169236656063.
/bsuhome/alexanderemert/Research/Star-Formation-Research-Project-2026/pipeline/scripts/optuna/final_preds_and_models/optuna_search_mult_quant_reg.py:162: UserWarning: The distribution is specified by [0.1, 5] and step=0.25, but the range is not divisible by `step`. It will be replaced with [0.1, 4.85].
  error_threshold = trial.suggest_float("error_threshold", 0.1, 5, step=0.25)
[I 2026-07-21 14:01:42,387] Trial 124 finished with value: -3.8501676040209034 and parameters: {'error_threshold': 0.35, 'scalers': 'none', 'ratios': 'log_ratio', 'imputers': 'none', 'n_estimators': 2050, 'learning_rate': 0.009418869001254349, 'max_depth': 3, 'min_child_weight': 6, 'subsample': 0.8, 'colsample_bytree': 0.7, 'colsample_bylevel': 0.9, 'reg_alpha': 5.887536409903608, 'reg_lambda': 0.00048341842615824644, 'gamma': 0.11574729324897788}. Best is trial 106 with value: -3.779169236656063.
/bsuhome/alexanderemert/Research/Star-Formation-Research-Project-2026/pipeline/scripts/optuna/final_preds_and_models/optuna_search_mult_quant_reg.py:162: UserWarning: The distribution is specified by [0.1, 5] and step=0.25, but the range is not divisible by `step`. It will be replaced with [0.1, 4.85].
  error_threshold = trial.suggest_float("error_threshold", 0.1, 5, step=0.25)
[I 2026-07-21 14:01:43,926] Trial 125 finished with value: -3.7857844612448748 and parameters: {'error_threshold': 2.1, 'scalers': 'none', 'ratios': 'log_ratio', 'imputers': 'none', 'n_estimators': 1950, 'learning_rate': 0.0017667891375326777, 'max_depth': 3, 'min_child_weight': 6, 'subsample': 0.7, 'colsample_bytree': 0.7, 'colsample_bylevel': 0.8, 'reg_alpha': 5.66659188326102, 'reg_lambda': 0.0006235002950788137, 'gamma': 0.11677670504476939}. Best is trial 106 with value: -3.779169236656063.
/bsuhome/alexanderemert/Research/Star-Formation-Research-Project-2026/pipeline/scripts/optuna/final_preds_and_models/optuna_search_mult_quant_reg.py:162: UserWarning: The distribution is specified by [0.1, 5] and step=0.25, but the range is not divisible by `step`. It will be replaced with [0.1, 4.85].
  error_threshold = trial.suggest_float("error_threshold", 0.1, 5, step=0.25)
[I 2026-07-21 14:01:45,604] Trial 126 finished with value: -3.7831082244750807 and parameters: {'error_threshold': 1.85, 'scalers': 'none', 'ratios': 'log_ratio', 'imputers': 'none', 'n_estimators': 2150, 'learning_rate': 0.0018090934096094207, 'max_depth': 3, 'min_child_weight': 6, 'subsample': 0.8, 'colsample_bytree': 0.7, 'colsample_bylevel': 0.8, 'reg_alpha': 7.38420092922742, 'reg_lambda': 0.0006418392039609557, 'gamma': 0.08630769399825786}. Best is trial 106 with value: -3.779169236656063.
/bsuhome/alexanderemert/Research/Star-Formation-Research-Project-2026/pipeline/scripts/optuna/final_preds_and_models/optuna_search_mult_quant_reg.py:162: UserWarning: The distribution is specified by [0.1, 5] and step=0.25, but the range is not divisible by `step`. It will be replaced with [0.1, 4.85].
  error_threshold = trial.suggest_float("error_threshold", 0.1, 5, step=0.25)
[I 2026-07-21 14:01:47,442] Trial 127 finished with value: -3.7783569759720605 and parameters: {'error_threshold': 2.1, 'scalers': 'none', 'ratios': 'log_ratio', 'imputers': 'none', 'n_estimators': 2200, 'learning_rate': 0.002045561964275624, 'max_depth': 3, 'min_child_weight': 6, 'subsample': 0.8, 'colsample_bytree': 0.7, 'colsample_bylevel': 0.9, 'reg_alpha': 7.149269747974555, 'reg_lambda': 0.0008657671657363384, 'gamma': 0.12217361274256841}. Best is trial 127 with value: -3.7783569759720605.
/bsuhome/alexanderemert/Research/Star-Formation-Research-Project-2026/pipeline/scripts/optuna/final_preds_and_models/optuna_search_mult_quant_reg.py:162: UserWarning: The distribution is specified by [0.1, 5] and step=0.25, but the range is not divisible by `step`. It will be replaced with [0.1, 4.85].
  error_threshold = trial.suggest_float("error_threshold", 0.1, 5, step=0.25)
[I 2026-07-21 14:01:49,364] Trial 128 finished with value: -3.7781823815595814 and parameters: {'error_threshold': 2.1, 'scalers': 'none', 'ratios': 'log_ratio', 'imputers': 'median', 'n_estimators': 2250, 'learning_rate': 0.0019331166438577717, 'max_depth': 3, 'min_child_weight': 6, 'subsample': 0.7, 'colsample_bytree': 0.7, 'colsample_bylevel': 0.9, 'reg_alpha': 7.709434199646957, 'reg_lambda': 0.000895883389847987, 'gamma': 0.03194502312633029}. Best is trial 128 with value: -3.7781823815595814.
/bsuhome/alexanderemert/Research/Star-Formation-Research-Project-2026/pipeline/scripts/optuna/final_preds_and_models/optuna_search_mult_quant_reg.py:162: UserWarning: The distribution is specified by [0.1, 5] and step=0.25, but the range is not divisible by `step`. It will be replaced with [0.1, 4.85].
  error_threshold = trial.suggest_float("error_threshold", 0.1, 5, step=0.25)
[I 2026-07-21 14:01:50,993] Trial 129 finished with value: -3.7819646393031334 and parameters: {'error_threshold': 1.85, 'scalers': 'none', 'ratios': 'log_ratio', 'imputers': 'median', 'n_estimators': 2200, 'learning_rate': 0.0017356163657302694, 'max_depth': 3, 'min_child_weight': 6, 'subsample': 0.7, 'colsample_bytree': 0.7, 'colsample_bylevel': 0.7, 'reg_alpha': 6.6338869378912415, 'reg_lambda': 0.0006705919565437651, 'gamma': 0.09374151295354377}. Best is trial 128 with value: -3.7781823815595814.
/bsuhome/alexanderemert/Research/Star-Formation-Research-Project-2026/pipeline/scripts/optuna/final_preds_and_models/optuna_search_mult_quant_reg.py:162: UserWarning: The distribution is specified by [0.1, 5] and step=0.25, but the range is not divisible by `step`. It will be replaced with [0.1, 4.85].
  error_threshold = trial.suggest_float("error_threshold", 0.1, 5, step=0.25)
[I 2026-07-21 14:01:52,583] Trial 130 finished with value: -3.7794125516911117 and parameters: {'error_threshold': 2.1, 'scalers': 'none', 'ratios': 'log_ratio', 'imputers': 'median', 'n_estimators': 2250, 'learning_rate': 0.0018425969973667143, 'max_depth': 3, 'min_child_weight': 6, 'subsample': 0.7, 'colsample_bytree': 0.7, 'colsample_bylevel': 0.7, 'reg_alpha': 1.3375830456984796, 'reg_lambda': 0.000697233701326762, 'gamma': 0.12549795902572242}. Best is trial 128 with value: -3.7781823815595814.
/bsuhome/alexanderemert/Research/Star-Formation-Research-Project-2026/pipeline/scripts/optuna/final_preds_and_models/optuna_search_mult_quant_reg.py:162: UserWarning: The distribution is specified by [0.1, 5] and step=0.25, but the range is not divisible by `step`. It will be replaced with [0.1, 4.85].
  error_threshold = trial.suggest_float("error_threshold", 0.1, 5, step=0.25)
[I 2026-07-21 14:01:54,384] Trial 131 finished with value: -3.7797866406414062 and parameters: {'error_threshold': 1.85, 'scalers': 'none', 'ratios': 'log_ratio', 'imputers': 'none', 'n_estimators': 2200, 'learning_rate': 0.0018814491497760712, 'max_depth': 3, 'min_child_weight': 7, 'subsample': 0.8, 'colsample_bytree': 0.7, 'colsample_bylevel': 0.9, 'reg_alpha': 1.898568120788855, 'reg_lambda': 0.0006390000349104219, 'gamma': 0.1298633449324942}. Best is trial 128 with value: -3.7781823815595814.
/bsuhome/alexanderemert/Research/Star-Formation-Research-Project-2026/pipeline/scripts/optuna/final_preds_and_models/optuna_search_mult_quant_reg.py:162: UserWarning: The distribution is specified by [0.1, 5] and step=0.25, but the range is not divisible by `step`. It will be replaced with [0.1, 4.85].
  error_threshold = trial.suggest_float("error_threshold", 0.1, 5, step=0.25)
[I 2026-07-21 14:01:56,213] Trial 132 finished with value: -3.781641682321061 and parameters: {'error_threshold': 2.1, 'scalers': 'none', 'ratios': 'log_ratio', 'imputers': 'none', 'n_estimators': 2200, 'learning_rate': 0.0018681048450281603, 'max_depth': 3, 'min_child_weight': 7, 'subsample': 0.9, 'colsample_bytree': 0.7, 'colsample_bylevel': 0.9, 'reg_alpha': 1.2909090145122162, 'reg_lambda': 0.001079258332909715, 'gamma': 3.5655413264299385e-05}. Best is trial 128 with value: -3.7781823815595814.
/bsuhome/alexanderemert/Research/Star-Formation-Research-Project-2026/pipeline/scripts/optuna/final_preds_and_models/optuna_search_mult_quant_reg.py:162: UserWarning: The distribution is specified by [0.1, 5] and step=0.25, but the range is not divisible by `step`. It will be replaced with [0.1, 4.85].
  error_threshold = trial.suggest_float("error_threshold", 0.1, 5, step=0.25)
[I 2026-07-21 14:01:57,940] Trial 133 finished with value: -3.781753785087671 and parameters: {'error_threshold': 2.1, 'scalers': 'none', 'ratios': 'log_ratio', 'imputers': 'none', 'n_estimators': 2200, 'learning_rate': 0.001837880721395066, 'max_depth': 3, 'min_child_weight': 7, 'subsample': 0.9, 'colsample_bytree': 0.7, 'colsample_bylevel': 0.8, 'reg_alpha': 1.2665690081818546, 'reg_lambda': 0.0013598204329352956, 'gamma': 0.039799707332244694}. Best is trial 128 with value: -3.7781823815595814.
/bsuhome/alexanderemert/Research/Star-Formation-Research-Project-2026/pipeline/scripts/optuna/final_preds_and_models/optuna_search_mult_quant_reg.py:162: UserWarning: The distribution is specified by [0.1, 5] and step=0.25, but the range is not divisible by `step`. It will be replaced with [0.1, 4.85].
  error_threshold = trial.suggest_float("error_threshold", 0.1, 5, step=0.25)
[I 2026-07-21 14:01:59,696] Trial 134 finished with value: -3.7834708697738555 and parameters: {'error_threshold': 1.85, 'scalers': 'none', 'ratios': 'log_ratio', 'imputers': 'none', 'n_estimators': 2200, 'learning_rate': 0.0018751839640817976, 'max_depth': 3, 'min_child_weight': 6, 'subsample': 0.9, 'colsample_bytree': 0.7, 'colsample_bylevel': 0.8, 'reg_alpha': 18.7471561517559, 'reg_lambda': 0.0014440319600480948, 'gamma': 0.10963828901113223}. Best is trial 128 with value: -3.7781823815595814.
/bsuhome/alexanderemert/Research/Star-Formation-Research-Project-2026/pipeline/scripts/optuna/final_preds_and_models/optuna_search_mult_quant_reg.py:162: UserWarning: The distribution is specified by [0.1, 5] and step=0.25, but the range is not divisible by `step`. It will be replaced with [0.1, 4.85].
  error_threshold = trial.suggest_float("error_threshold", 0.1, 5, step=0.25)
[I 2026-07-21 14:02:01,483] Trial 135 finished with value: -3.7810212323868484 and parameters: {'error_threshold': 2.1, 'scalers': 'none', 'ratios': 'log_ratio', 'imputers': 'none', 'n_estimators': 2200, 'learning_rate': 0.0020890231325460563, 'max_depth': 3, 'min_child_weight': 6, 'subsample': 0.8, 'colsample_bytree': 0.7, 'colsample_bylevel': 0.8, 'reg_alpha': 17.98079935477851, 'reg_lambda': 0.0011667104808605647, 'gamma': 0.09379072473912534}. Best is trial 128 with value: -3.7781823815595814.
/bsuhome/alexanderemert/Research/Star-Formation-Research-Project-2026/pipeline/scripts/optuna/final_preds_and_models/optuna_search_mult_quant_reg.py:162: UserWarning: The distribution is specified by [0.1, 5] and step=0.25, but the range is not divisible by `step`. It will be replaced with [0.1, 4.85].
  error_threshold = trial.suggest_float("error_threshold", 0.1, 5, step=0.25)
[I 2026-07-21 14:02:03,292] Trial 136 finished with value: -3.785282779152757 and parameters: {'error_threshold': 2.1, 'scalers': 'none', 'ratios': 'log_ratio', 'imputers': 'none', 'n_estimators': 2250, 'learning_rate': 0.0018238653561896167, 'max_depth': 3, 'min_child_weight': 6, 'subsample': 0.8, 'colsample_bytree': 0.7, 'colsample_bylevel': 0.8, 'reg_alpha': 22.286772985911036, 'reg_lambda': 0.0012902222163537497, 'gamma': 0.024811262351751337}. Best is trial 128 with value: -3.7781823815595814.
/bsuhome/alexanderemert/Research/Star-Formation-Research-Project-2026/pipeline/scripts/optuna/final_preds_and_models/optuna_search_mult_quant_reg.py:162: UserWarning: The distribution is specified by [0.1, 5] and step=0.25, but the range is not divisible by `step`. It will be replaced with [0.1, 4.85].
  error_threshold = trial.suggest_float("error_threshold", 0.1, 5, step=0.25)
[I 2026-07-21 14:02:05,077] Trial 137 finished with value: -3.7860575151237374 and parameters: {'error_threshold': 2.1, 'scalers': 'none', 'ratios': 'log_ratio', 'imputers': 'none', 'n_estimators': 2200, 'learning_rate': 0.0017404657916465101, 'max_depth': 3, 'min_child_weight': 6, 'subsample': 0.8, 'colsample_bytree': 0.7, 'colsample_bylevel': 0.8, 'reg_alpha': 18.34029723801733, 'reg_lambda': 0.0014218098311679736, 'gamma': 0.07212780708892723}. Best is trial 128 with value: -3.7781823815595814.
/bsuhome/alexanderemert/Research/Star-Formation-Research-Project-2026/pipeline/scripts/optuna/final_preds_and_models/optuna_search_mult_quant_reg.py:162: UserWarning: The distribution is specified by [0.1, 5] and step=0.25, but the range is not divisible by `step`. It will be replaced with [0.1, 4.85].
  error_threshold = trial.suggest_float("error_threshold", 0.1, 5, step=0.25)
[I 2026-07-21 14:02:06,708] Trial 138 finished with value: -3.783884207005324 and parameters: {'error_threshold': 2.1, 'scalers': 'none', 'ratios': 'log_ratio', 'imputers': 'none', 'n_estimators': 2200, 'learning_rate': 0.0018061566197971027, 'max_depth': 3, 'min_child_weight': 6, 'subsample': 0.8, 'colsample_bytree': 0.7, 'colsample_bylevel': 0.7, 'reg_alpha': 15.479509782032988, 'reg_lambda': 0.001372517387253179, 'gamma': 0.08633615976009784}. Best is trial 128 with value: -3.7781823815595814.
/bsuhome/alexanderemert/Research/Star-Formation-Research-Project-2026/pipeline/scripts/optuna/final_preds_and_models/optuna_search_mult_quant_reg.py:162: UserWarning: The distribution is specified by [0.1, 5] and step=0.25, but the range is not divisible by `step`. It will be replaced with [0.1, 4.85].
  error_threshold = trial.suggest_float("error_threshold", 0.1, 5, step=0.25)
[I 2026-07-21 14:02:08,387] Trial 139 finished with value: -3.7826695225576787 and parameters: {'error_threshold': 2.1, 'scalers': 'none', 'ratios': 'log_ratio', 'imputers': 'none', 'n_estimators': 2250, 'learning_rate': 0.0018790693020629796, 'max_depth': 3, 'min_child_weight': 6, 'subsample': 0.8, 'colsample_bytree': 0.7, 'colsample_bylevel': 0.7, 'reg_alpha': 17.60395540453179, 'reg_lambda': 0.0013057413771962437, 'gamma': 0.11043096927748224}. Best is trial 128 with value: -3.7781823815595814.
/bsuhome/alexanderemert/Research/Star-Formation-Research-Project-2026/pipeline/scripts/optuna/final_preds_and_models/optuna_search_mult_quant_reg.py:162: UserWarning: The distribution is specified by [0.1, 5] and step=0.25, but the range is not divisible by `step`. It will be replaced with [0.1, 4.85].
  error_threshold = trial.suggest_float("error_threshold", 0.1, 5, step=0.25)
