[I 2026-07-20 13:42:33,620] Trial 578 finished with value: -0.13729709505188706 and parameters: {'error_threshold': 2.5, 'scalers': 'none', 'ratios': 'norm_ratio', 'imputers': 'median', 'n_estimators': 200, 'learning_rate': 0.00013220437330317998, 'max_depth': 9, 'min_child_weight': 2, 'subsample': 1.0, 'colsample_bytree': 0.5, 'colsample_bylevel': 0.5, 'reg_alpha': 12.35924420794964, 'reg_lambda': 0.11679329369219242, 'gamma': 77.3908036050682}. Best is trial 472 with value: -0.13764739925059793.
[I 2026-07-20 13:42:34,192] Trial 579 finished with value: -0.13738119468986998 and parameters: {'error_threshold': 3.0, 'scalers': 'none', 'ratios': 'norm_ratio', 'imputers': 'median', 'n_estimators': 200, 'learning_rate': 0.00010036830234201277, 'max_depth': 9, 'min_child_weight': 2, 'subsample': 1.0, 'colsample_bytree': 0.5, 'colsample_bylevel': 0.5, 'reg_alpha': 13.520775597124878, 'reg_lambda': 0.3651860790177527, 'gamma': 93.07730319697873}. Best is trial 472 with value: -0.13764739925059793.
[I 2026-07-20 13:42:34,731] Trial 580 finished with value: -0.13738135093392465 and parameters: {'error_threshold': 2.25, 'scalers': 'none', 'ratios': 'norm_ratio', 'imputers': 'median', 'n_estimators': 200, 'learning_rate': 0.00010030900449887919, 'max_depth': 9, 'min_child_weight': 3, 'subsample': 1.0, 'colsample_bytree': 0.5, 'colsample_bylevel': 0.5, 'reg_alpha': 22.021317088923333, 'reg_lambda': 0.12012415684469586, 'gamma': 97.36581049374904}. Best is trial 472 with value: -0.13764739925059793.
[I 2026-07-20 13:42:35,004] Trial 581 finished with value: -0.137299870429148 and parameters: {'error_threshold': 3.0, 'scalers': 'none', 'ratios': 'norm_ratio', 'imputers': 'median', 'n_estimators': 200, 'learning_rate': 0.00013115313995654506, 'max_depth': 9, 'min_child_weight': 2, 'subsample': 1.0, 'colsample_bytree': 0.5, 'colsample_bylevel': 0.5, 'reg_alpha': 25.83933221544225, 'reg_lambda': 0.10813521632997128, 'gamma': 95.66813550805719}. Best is trial 472 with value: -0.13764739925059793.
[I 2026-07-20 13:42:35,371] Trial 582 finished with value: -0.13729334868698131 and parameters: {'error_threshold': 3.0, 'scalers': 'none', 'ratios': 'norm_ratio', 'imputers': 'median', 'n_estimators': 200, 'learning_rate': 0.00013362388682878923, 'max_depth': 9, 'min_child_weight': 3, 'subsample': 1.0, 'colsample_bytree': 0.5, 'colsample_bylevel': 0.5, 'reg_alpha': 2.604141212208129e-06, 'reg_lambda': 0.08695678435371347, 'gamma': 97.63478667039264}. Best is trial 472 with value: -0.13764739925059793.
[I 2026-07-20 13:42:35,591] Trial 583 finished with value: -0.13730927987728622 and parameters: {'error_threshold': 2.25, 'scalers': 'none', 'ratios': 'norm_ratio', 'imputers': 'median', 'n_estimators': 150, 'learning_rate': 0.00013366718914429134, 'max_depth': 9, 'min_child_weight': 3, 'subsample': 1.0, 'colsample_bytree': 0.6, 'colsample_bylevel': 0.5, 'reg_alpha': 25.356165084474103, 'reg_lambda': 0.10857561067992123, 'gamma': 99.24748869840748}. Best is trial 472 with value: -0.13764739925059793.
[I 2026-07-20 13:42:35,860] Trial 584 finished with value: -0.1373967669936262 and parameters: {'error_threshold': 2.25, 'scalers': 'none', 'ratios': 'norm_ratio', 'imputers': 'median', 'n_estimators': 150, 'learning_rate': 0.00013408892687220343, 'max_depth': 9, 'min_child_weight': 3, 'subsample': 1.0, 'colsample_bytree': 0.5, 'colsample_bylevel': 0.5, 'reg_alpha': 2.5980291137870986e-06, 'reg_lambda': 0.12177363460346378, 'gamma': 99.8418506845965}. Best is trial 472 with value: -0.13764739925059793.
[I 2026-07-20 13:42:36,076] Trial 585 finished with value: -0.13739532168427662 and parameters: {'error_threshold': 2.25, 'scalers': 'none', 'ratios': 'norm_ratio', 'imputers': 'median', 'n_estimators': 150, 'learning_rate': 0.00013488471210781533, 'max_depth': 10, 'min_child_weight': 3, 'subsample': 0.7, 'colsample_bytree': 0.5, 'colsample_bylevel': 0.5, 'reg_alpha': 45.059548383691194, 'reg_lambda': 0.11822289400776943, 'gamma': 44.02505282702692}. Best is trial 472 with value: -0.13764739925059793.
[I 2026-07-20 13:42:38,566] Trial 587 finished with value: -0.13730839972295542 and parameters: {'error_threshold': 2.25, 'scalers': 'none', 'ratios': 'norm_ratio', 'imputers': 'median', 'n_estimators': 150, 'learning_rate': 0.00013401541192723922, 'max_depth': 8, 'min_child_weight': 3, 'subsample': 1.0, 'colsample_bytree': 0.6, 'colsample_bylevel': 0.5, 'reg_alpha': 45.25017162573805, 'reg_lambda': 0.27146392674977476, 'gamma': 44.10887245028421}. Best is trial 472 with value: -0.13764739925059793.
[I 2026-07-20 13:42:38,876] Trial 588 finished with value: -0.1373281561187 and parameters: {'error_threshold': 2.25, 'scalers': 'none', 'ratios': 'norm_ratio', 'imputers': 'median', 'n_estimators': 150, 'learning_rate': 0.00012618003217151056, 'max_depth': 8, 'min_child_weight': 2, 'subsample': 1.0, 'colsample_bytree': 0.6, 'colsample_bylevel': 0.5, 'reg_alpha': 44.88772770120416, 'reg_lambda': 0.020834809379751667, 'gamma': 99.12061029952702}. Best is trial 472 with value: -0.13764739925059793.
[I 2026-07-20 13:42:39,903] Trial 590 finished with value: -0.137304672163161 and parameters: {'error_threshold': 2.25, 'scalers': 'none', 'ratios': 'norm_ratio', 'imputers': 'median', 'n_estimators': 150, 'learning_rate': 0.00013549569809501183, 'max_depth': 10, 'min_child_weight': 2, 'subsample': 1.0, 'colsample_bytree': 0.6, 'colsample_bylevel': 0.5, 'reg_alpha': 44.820630615572526, 'reg_lambda': 0.017722566738091694, 'gamma': 42.070480253443414}. Best is trial 472 with value: -0.13764739925059793.
[I 2026-07-20 13:42:40,086] Trial 591 finished with value: -0.13742421664965476 and parameters: {'error_threshold': 2.25, 'scalers': 'none', 'ratios': 'norm_ratio', 'imputers': 'median', 'n_estimators': 150, 'learning_rate': 0.0001193579153426574, 'max_depth': 11, 'min_child_weight': 2, 'subsample': 1.0, 'colsample_bytree': 0.5, 'colsample_bylevel': 0.5, 'reg_alpha': 44.9255225890215, 'reg_lambda': 0.25929221055928553, 'gamma': 46.099271753034536}. Best is trial 472 with value: -0.13764739925059793.
[I 2026-07-20 13:42:40,217] Trial 592 finished with value: -0.13720582805027998 and parameters: {'error_threshold': 2.25, 'scalers': 'none', 'ratios': 'norm_ratio', 'imputers': 'median', 'n_estimators': 100, 'learning_rate': 0.00011962878993296847, 'max_depth': 10, 'min_child_weight': 2, 'subsample': 1.0, 'colsample_bytree': 0.5, 'colsample_bylevel': 0.5, 'reg_alpha': 44.21012560804673, 'reg_lambda': 0.022589371698439737, 'gamma': 0.0005243468655339651}. Best is trial 472 with value: -0.13764739925059793.
[I 2026-07-20 13:42:40,564] Trial 589 finished with value: -0.13640964445889978 and parameters: {'error_threshold': 2.25, 'scalers': 'none', 'ratios': 'norm_ratio', 'imputers': 'none', 'n_estimators': 600, 'learning_rate': 0.00013687227050169053, 'max_depth': 10, 'min_child_weight': 2, 'subsample': 1.0, 'colsample_bytree': 0.5, 'colsample_bylevel': 0.5, 'reg_alpha': 40.818638017129814, 'reg_lambda': 0.2789142779162957, 'gamma': 45.22927807242109}. Best is trial 472 with value: -0.13764739925059793.
[I 2026-07-20 13:42:40,696] Trial 593 finished with value: -0.13746774317052787 and parameters: {'error_threshold': 2.25, 'scalers': 'none', 'ratios': 'norm_ratio', 'imputers': 'median', 'n_estimators': 100, 'learning_rate': 0.00011905770509039016, 'max_depth': 8, 'min_child_weight': 2, 'subsample': 1.0, 'colsample_bytree': 0.5, 'colsample_bylevel': 0.5, 'reg_alpha': 44.75520994654391, 'reg_lambda': 0.26799086725384785, 'gamma': 46.60400713868412}. Best is trial 472 with value: -0.13764739925059793.
[I 2026-07-20 13:42:42,969] Trial 594 finished with value: -0.1374699562639902 and parameters: {'error_threshold': 2.25, 'scalers': 'none', 'ratios': 'norm_ratio', 'imputers': 'median', 'n_estimators': 100, 'learning_rate': 0.00011758841975585541, 'max_depth': 10, 'min_child_weight': 2, 'subsample': 1.0, 'colsample_bytree': 0.5, 'colsample_bylevel': 0.5, 'reg_alpha': 50.186373131873154, 'reg_lambda': 0.3419274840030597, 'gamma': 52.12039612765221}. Best is trial 472 with value: -0.13764739925059793.
[I 2026-07-20 13:42:43,229] Trial 595 finished with value: -0.13746458677871873 and parameters: {'error_threshold': 2.25, 'scalers': 'none', 'ratios': 'norm_ratio', 'imputers': 'median', 'n_estimators': 100, 'learning_rate': 0.00012129387705831304, 'max_depth': 11, 'min_child_weight': 2, 'subsample': 0.7, 'colsample_bytree': 0.5, 'colsample_bylevel': 0.5, 'reg_alpha': 45.53234902694216, 'reg_lambda': 0.39486450284643304, 'gamma': 53.062245975516056}. Best is trial 472 with value: -0.13764739925059793.
[I 2026-07-20 13:42:44,076] Trial 596 finished with value: -0.1374656904226673 and parameters: {'error_threshold': 2.25, 'scalers': 'none', 'ratios': 'norm_ratio', 'imputers': 'median', 'n_estimators': 100, 'learning_rate': 0.00012042518705031175, 'max_depth': 11, 'min_child_weight': 2, 'subsample': 1.0, 'colsample_bytree': 0.5, 'colsample_bylevel': 0.5, 'reg_alpha': 64.73804499347088, 'reg_lambda': 0.359232780826402, 'gamma': 55.52607626775475}. Best is trial 472 with value: -0.13764739925059793.
[I 2026-07-20 13:42:44,156] Trial 597 finished with value: -0.13375582580919682 and parameters: {'error_threshold': 2.25, 'scalers': 'none', 'ratios': 'norm_ratio', 'imputers': 'median', 'n_estimators': 100, 'learning_rate': 0.002703865693590958, 'max_depth': 5, 'min_child_weight': 2, 'subsample': 0.7, 'colsample_bytree': 0.5, 'colsample_bylevel': 0.5, 'reg_alpha': 65.70704537820431, 'reg_lambda': 0.3576029545776243, 'gamma': 57.036060682466214}. Best is trial 472 with value: -0.13764739925059793.
[I 2026-07-20 13:42:44,489] Trial 598 finished with value: -0.13727014914110175 and parameters: {'error_threshold': 2.25, 'scalers': 'none', 'ratios': 'norm_ratio', 'imputers': 'median', 'n_estimators': 250, 'learning_rate': 0.00011830929665914386, 'max_depth': 5, 'min_child_weight': 2, 'subsample': 0.7, 'colsample_bytree': 0.5, 'colsample_bylevel': 0.5, 'reg_alpha': 69.20134131377866, 'reg_lambda': 0.6146125426662513, 'gamma': 57.40461475602259}. Best is trial 472 with value: -0.13764739925059793.
[I 2026-07-20 13:42:44,906] Trial 599 finished with value: -0.13726718336718177 and parameters: {'error_threshold': 2.25, 'scalers': 'none', 'ratios': 'norm_ratio', 'imputers': 'median', 'n_estimators': 250, 'learning_rate': 0.00011924692951635584, 'max_depth': 5, 'min_child_weight': 2, 'subsample': 0.7, 'colsample_bytree': 0.5, 'colsample_bylevel': 0.5, 'reg_alpha': 67.392833899359, 'reg_lambda': 0.6565191824580155, 'gamma': 55.15199002402079}. Best is trial 472 with value: -0.13764739925059793.
[I 2026-07-20 13:42:45,182] Trial 601 finished with value: -0.13746541333241072 and parameters: {'error_threshold': 2.25, 'scalers': 'none', 'ratios': 'norm_ratio', 'imputers': 'median', 'n_estimators': 100, 'learning_rate': 0.00012060973432493905, 'max_depth': 8, 'min_child_weight': 2, 'subsample': 1.0, 'colsample_bytree': 0.5, 'colsample_bylevel': 0.5, 'reg_alpha': 64.90927544544142, 'reg_lambda': 0.3903010122972675, 'gamma': 58.17020268140034}. Best is trial 472 with value: -0.13764739925059793.
[I 2026-07-20 13:42:46,858] Trial 586 finished with value: -0.13251522712066055 and parameters: {'error_threshold': 2.25, 'scalers': 'none', 'ratios': 'norm_ratio', 'imputers': 'median', 'n_estimators': 2800, 'learning_rate': 0.0001335615016382459, 'max_depth': 10, 'min_child_weight': 2, 'subsample': 0.7, 'colsample_bytree': 0.5, 'colsample_bylevel': 0.5, 'reg_alpha': 2.3529252058839744e-06, 'reg_lambda': 0.35142990341965413, 'gamma': 45.0711880693173}. Best is trial 472 with value: -0.13764739925059793.
[I 2026-07-20 13:42:47,073] Trial 600 finished with value: -0.13710444912469663 and parameters: {'error_threshold': 2.25, 'scalers': 'none', 'ratios': 'norm_ratio', 'imputers': 'median', 'n_estimators': 250, 'learning_rate': 0.00011902351434402282, 'max_depth': 8, 'min_child_weight': 2, 'subsample': 1.0, 'colsample_bytree': 0.5, 'colsample_bylevel': 0.5, 'reg_alpha': 62.096890680435635, 'reg_lambda': 0.5972343859029227, 'gamma': 6.62407123907112e-06}. Best is trial 472 with value: -0.13764739925059793.
[I 2026-07-20 13:42:47,164] Trial 602 finished with value: -0.13741224526943352 and parameters: {'error_threshold': 2.5, 'scalers': 'none', 'ratios': 'norm_ratio', 'imputers': 'median', 'n_estimators': 100, 'learning_rate': 0.00015597330392340265, 'max_depth': 11, 'min_child_weight': 2, 'subsample': 1.0, 'colsample_bytree': 0.5, 'colsample_bylevel': 0.5, 'reg_alpha': 24.578382684503932, 'reg_lambda': 0.6438062877162513, 'gamma': 60.00733836112877}. Best is trial 472 with value: -0.13764739925059793.
[I 2026-07-20 13:42:48,033] Trial 603 finished with value: -0.10803727618778525 and parameters: {'error_threshold': 2.5, 'scalers': 'none', 'ratios': 'norm_ratio', 'imputers': 'median', 'n_estimators': 100, 'learning_rate': 0.03241237904972775, 'max_depth': 11, 'min_child_weight': 2, 'subsample': 1.0, 'colsample_bytree': 0.5, 'colsample_bylevel': 0.5, 'reg_alpha': 24.006015426453217, 'reg_lambda': 0.6676911483067309, 'gamma': 59.14546303517762}. Best is trial 472 with value: -0.13764739925059793.
[I 2026-07-20 13:42:48,124] Trial 604 finished with value: -0.13741423350814164 and parameters: {'error_threshold': 2.5, 'scalers': 'none', 'ratios': 'norm_ratio', 'imputers': 'median', 'n_estimators': 100, 'learning_rate': 0.000154651255368234, 'max_depth': 11, 'min_child_weight': 2, 'subsample': 1.0, 'colsample_bytree': 0.5, 'colsample_bylevel': 0.5, 'reg_alpha': 25.88442503097131, 'reg_lambda': 0.7068449131195217, 'gamma': 64.96185406136898}. Best is trial 472 with value: -0.13764739925059793.
[I 2026-07-20 13:42:48,285] Trial 605 finished with value: -0.13732103505547535 and parameters: {'error_threshold': 2.25, 'scalers': 'none', 'ratios': 'norm_ratio', 'imputers': 'median', 'n_estimators': 100, 'learning_rate': 0.00015935774566193633, 'max_depth': 8, 'min_child_weight': 2, 'subsample': 1.0, 'colsample_bytree': 0.7, 'colsample_bylevel': 0.5, 'reg_alpha': 27.00005334502528, 'reg_lambda': 0.6868469542637521, 'gamma': 61.333919652177755}. Best is trial 472 with value: -0.13764739925059793.
[I 2026-07-20 13:42:48,543] Trial 606 finished with value: -0.13743253130974684 and parameters: {'error_threshold': 2.5, 'scalers': 'none', 'ratios': 'norm_ratio', 'imputers': 'median', 'n_estimators': 100, 'learning_rate': 0.00014247832247119918, 'max_depth': 11, 'min_child_weight': 2, 'subsample': 1.0, 'colsample_bytree': 0.5, 'colsample_bylevel': 0.5, 'reg_alpha': 27.358141925783276, 'reg_lambda': 0.4207098708343608, 'gamma': 65.53560568382537}. Best is trial 472 with value: -0.13764739925059793.
[I 2026-07-20 13:42:48,789] Trial 607 finished with value: -0.13741317440591092 and parameters: {'error_threshold': 2.5, 'scalers': 'none', 'ratios': 'norm_ratio', 'imputers': 'median', 'n_estimators': 100, 'learning_rate': 0.00015535658597080022, 'max_depth': 8, 'min_child_weight': 2, 'subsample': 1.0, 'colsample_bytree': 0.5, 'colsample_bylevel': 0.5, 'reg_alpha': 27.328650861805837, 'reg_lambda': 0.001186523665849089, 'gamma': 64.26854971002827}. Best is trial 472 with value: -0.13764739925059793.
[I 2026-07-20 13:42:48,973] Trial 608 finished with value: -0.13740023621799632 and parameters: {'error_threshold': 2.5, 'scalers': 'none', 'ratios': 'norm_ratio', 'imputers': 'median', 'n_estimators': 100, 'learning_rate': 0.0001639637425802128, 'max_depth': 11, 'min_child_weight': 2, 'subsample': 1.0, 'colsample_bytree': 0.5, 'colsample_bylevel': 0.5, 'reg_alpha': 29.819299630536204, 'reg_lambda': 0.22464524973625596, 'gamma': 65.9513925079336}. Best is trial 472 with value: -0.13764739925059793.
[I 2026-07-20 13:42:49,156] Trial 609 finished with value: -0.1098069431602281 and parameters: {'error_threshold': 2.5, 'scalers': 'none', 'ratios': 'norm_ratio', 'imputers': 'median', 'n_estimators': 100, 'learning_rate': 0.02933824355065834, 'max_depth': 11, 'min_child_weight': 2, 'subsample': 1.0, 'colsample_bytree': 0.5, 'colsample_bylevel': 0.5, 'reg_alpha': 26.012217007571515, 'reg_lambda': 0.2304099361230584, 'gamma': 65.87987010198306}. Best is trial 472 with value: -0.13764739925059793.
[I 2026-07-20 13:42:49,253] Trial 610 finished with value: -0.13741447856523348 and parameters: {'error_threshold': 2.5, 'scalers': 'none', 'ratios': 'norm_ratio', 'imputers': 'median', 'n_estimators': 100, 'learning_rate': 0.00015448698542822533, 'max_depth': 11, 'min_child_weight': 2, 'subsample': 1.0, 'colsample_bytree': 0.5, 'colsample_bylevel': 0.5, 'reg_alpha': 28.520988437507903, 'reg_lambda': 0.22892353136494667, 'gamma': 68.03767839906064}. Best is trial 472 with value: -0.13764739925059793.
[I 2026-07-20 13:42:50,008] Trial 611 finished with value: -0.13738815718244782 and parameters: {'error_threshold': 2.5, 'scalers': 'none', 'ratios': 'norm_ratio', 'imputers': 'median', 'n_estimators': 100, 'learning_rate': 0.00017200514443931235, 'max_depth': 11, 'min_child_weight': 2, 'subsample': 1.0, 'colsample_bytree': 0.5, 'colsample_bylevel': 0.5, 'reg_alpha': 28.401204170631765, 'reg_lambda': 0.22009265216882234, 'gamma': 67.81887690424665}. Best is trial 472 with value: -0.13764739925059793.
[I 2026-07-20 13:42:50,214] Trial 612 finished with value: -0.1374216045088994 and parameters: {'error_threshold': 2.5, 'scalers': 'none', 'ratios': 'norm_ratio', 'imputers': 'median', 'n_estimators': 100, 'learning_rate': 0.00014974603110443188, 'max_depth': 11, 'min_child_weight': 2, 'subsample': 1.0, 'colsample_bytree': 0.5, 'colsample_bylevel': 0.5, 'reg_alpha': 32.56245233594751, 'reg_lambda': 0.24072338898965157, 'gamma': 67.42586540144727}. Best is trial 472 with value: -0.13764739925059793.
[I 2026-07-20 13:42:50,390] Trial 613 finished with value: -0.1374713148354393 and parameters: {'error_threshold': 2.5, 'scalers': 'none', 'ratios': 'norm_ratio', 'imputers': 'median', 'n_estimators': 100, 'learning_rate': 0.00011668410790393817, 'max_depth': 11, 'min_child_weight': 2, 'subsample': 1.0, 'colsample_bytree': 0.5, 'colsample_bylevel': 0.5, 'reg_alpha': 35.10679978695756, 'reg_lambda': 0.22756005545244873, 'gamma': 99.94288846338347}. Best is trial 472 with value: -0.13764739925059793.
[I 2026-07-20 13:42:50,557] Trial 614 finished with value: -0.1374945717863744 and parameters: {'error_threshold': 2.25, 'scalers': 'none', 'ratios': 'norm_ratio', 'imputers': 'median', 'n_estimators': 100, 'learning_rate': 0.00010122507071036676, 'max_depth': 8, 'min_child_weight': 2, 'subsample': 1.0, 'colsample_bytree': 0.5, 'colsample_bylevel': 0.5, 'reg_alpha': 38.70855450891225, 'reg_lambda': 0.19473899480957882, 'gamma': 99.88213243743495}. Best is trial 472 with value: -0.13764739925059793.
[I 2026-07-20 13:42:50,929] Trial 615 finished with value: -0.13747451727726212 and parameters: {'error_threshold': 2.25, 'scalers': 'none', 'ratios': 'norm_ratio', 'imputers': 'median', 'n_estimators': 100, 'learning_rate': 0.00010038498134633546, 'max_depth': 8, 'min_child_weight': 2, 'subsample': 1.0, 'colsample_bytree': 0.5, 'colsample_bylevel': 0.5, 'reg_alpha': 1.5059775956455704e-06, 'reg_lambda': 0.21078061734114278, 'gamma': 33.560459658545625}. Best is trial 472 with value: -0.13764739925059793.
[I 2026-07-20 13:42:51,129] Trial 616 finished with value: -0.1374706590732603 and parameters: {'error_threshold': 2.25, 'scalers': 'none', 'ratios': 'norm_ratio', 'imputers': 'median', 'n_estimators': 100, 'learning_rate': 0.00011711968571783512, 'max_depth': 8, 'min_child_weight': 2, 'subsample': 1.0, 'colsample_bytree': 0.5, 'colsample_bylevel': 0.5, 'reg_alpha': 39.821441569750974, 'reg_lambda': 0.3806124341664554, 'gamma': 97.80854667103787}. Best is trial 472 with value: -0.13764739925059793.
[I 2026-07-20 13:42:51,255] Trial 617 finished with value: -0.13749476389469142 and parameters: {'error_threshold': 2.25, 'scalers': 'none', 'ratios': 'norm_ratio', 'imputers': 'median', 'n_estimators': 100, 'learning_rate': 0.00010109725584691005, 'max_depth': 8, 'min_child_weight': 2, 'subsample': 1.0, 'colsample_bytree': 0.5, 'colsample_bylevel': 0.5, 'reg_alpha': 41.7043059149151, 'reg_lambda': 0.35527086220167753, 'gamma': 33.52056877359383}. Best is trial 472 with value: -0.13764739925059793.
[I 2026-07-20 13:42:51,519] Trial 618 finished with value: -0.13747104150060394 and parameters: {'error_threshold': 2.25, 'scalers': 'none', 'ratios': 'norm_ratio', 'imputers': 'median', 'n_estimators': 100, 'learning_rate': 0.0001168637799433254, 'max_depth': 8, 'min_child_weight': 2, 'subsample': 1.0, 'colsample_bytree': 0.5, 'colsample_bylevel': 0.5, 'reg_alpha': 43.64961485408622, 'reg_lambda': 0.0027077869873261945, 'gamma': 33.922536075410555}. Best is trial 472 with value: -0.13764739925059793.
[I 2026-07-20 13:42:52,660] Trial 619 finished with value: -0.13745945638889648 and parameters: {'error_threshold': 2.25, 'scalers': 'none', 'ratios': 'norm_ratio', 'imputers': 'median', 'n_estimators': 150, 'learning_rate': 0.00010045863339405665, 'max_depth': 8, 'min_child_weight': 2, 'subsample': 1.0, 'colsample_bytree': 0.5, 'colsample_bylevel': 0.5, 'reg_alpha': 43.93210011915087, 'reg_lambda': 0.00845595322475053, 'gamma': 33.82051308130401}. Best is trial 472 with value: -0.13764739925059793.
[I 2026-07-20 13:42:52,869] Trial 620 finished with value: -0.13719995817529382 and parameters: {'error_threshold': 2.25, 'scalers': 'none', 'ratios': 'norm_ratio', 'imputers': 'median', 'n_estimators': 150, 'learning_rate': 0.00010051523530225436, 'max_depth': 8, 'min_child_weight': 2, 'subsample': 1.0, 'colsample_bytree': 1.0, 'colsample_bylevel': 0.5, 'reg_alpha': 1.5479346255337737e-06, 'reg_lambda': 0.4242661722768275, 'gamma': 98.41530319973549}. Best is trial 472 with value: -0.13764739925059793.
