[I 2026-07-20 14:54:37,581] Trial 466 finished with value: -0.7624981161201355 and parameters: {'error_threshold': 2.5, 'scalers': 'standard', 'ratios': 'norm_ratio', 'imputers': 'mean', 'n_estimators': 2400, 'learning_rate': 0.4954698222027653, 'max_depth': 8, 'min_child_weight': 1, 'subsample': 0.5, 'colsample_bytree': 0.5, 'colsample_bylevel': 0.8, 'reg_alpha': 1.2549415894638116, 'reg_lambda': 3.225466745172345e-06, 'gamma': 3.590244775751469e-05}. Best is trial 359 with value: -0.8315037537709427.
[I 2026-07-20 14:54:44,330] Trial 467 finished with value: -0.4480083498806009 and parameters: {'error_threshold': 2.5, 'scalers': 'standard', 'ratios': 'norm_ratio', 'imputers': 'mean', 'n_estimators': 2400, 'learning_rate': 0.2792789581756218, 'max_depth': 8, 'min_child_weight': 1, 'subsample': 0.5, 'colsample_bytree': 0.5, 'colsample_bylevel': 0.8, 'reg_alpha': 1.3009810404559747, 'reg_lambda': 3.0516603106835337e-06, 'gamma': 0.000153733787532133}. Best is trial 359 with value: -0.8315037537709427.
[I 2026-07-20 14:55:13,119] Trial 468 finished with value: -0.4553316621981149 and parameters: {'error_threshold': 2.5, 'scalers': 'standard', 'ratios': 'norm_ratio', 'imputers': 'mean', 'n_estimators': 2400, 'learning_rate': 0.26801019422126215, 'max_depth': 9, 'min_child_weight': 1, 'subsample': 0.5, 'colsample_bytree': 0.5, 'colsample_bylevel': 0.8, 'reg_alpha': 1.3237748651655703, 'reg_lambda': 1.953734151656468e-06, 'gamma': 1.118157014601726e-05}. Best is trial 359 with value: -0.8315037537709427.
[I 2026-07-20 14:57:48,818] Trial 469 finished with value: -0.46768792569339385 and parameters: {'error_threshold': 2.5, 'scalers': 'standard', 'ratios': 'norm_ratio', 'imputers': 'mean', 'n_estimators': 2400, 'learning_rate': 0.2770021203465137, 'max_depth': 9, 'min_child_weight': 1, 'subsample': 0.5, 'colsample_bytree': 0.5, 'colsample_bylevel': 0.8, 'reg_alpha': 1.4474217464584345, 'reg_lambda': 3.2117196962699227e-06, 'gamma': 3.191938814930038e-05}. Best is trial 359 with value: -0.8315037537709427.
[I 2026-07-20 14:57:55,567] Trial 470 finished with value: -0.4596539385062865 and parameters: {'error_threshold': 2.5, 'scalers': 'standard', 'ratios': 'norm_ratio', 'imputers': 'mean', 'n_estimators': 2300, 'learning_rate': 0.26940453511603374, 'max_depth': 9, 'min_child_weight': 1, 'subsample': 0.5, 'colsample_bytree': 0.5, 'colsample_bylevel': 0.8, 'reg_alpha': 1.6234988237509438, 'reg_lambda': 2.4427208118940934e-06, 'gamma': 3.697636766678916e-05}. Best is trial 359 with value: -0.8315037537709427.
[I 2026-07-20 14:58:14,351] Trial 471 finished with value: -0.5431769136224123 and parameters: {'error_threshold': 2.5, 'scalers': 'standard', 'ratios': 'norm_ratio', 'imputers': 'mean', 'n_estimators': 2400, 'learning_rate': 0.3592895616648338, 'max_depth': 9, 'min_child_weight': 1, 'subsample': 0.5, 'colsample_bytree': 0.5, 'colsample_bylevel': 0.8, 'reg_alpha': 1.8388310961892778, 'reg_lambda': 1.7471510733664413e-06, 'gamma': 2.1730571032246204e-05}. Best is trial 359 with value: -0.8315037537709427.
[I 2026-07-20 14:58:20,745] Trial 472 finished with value: -0.5346050195296067 and parameters: {'error_threshold': 2.5, 'scalers': 'standard', 'ratios': 'norm_ratio', 'imputers': 'mean', 'n_estimators': 2400, 'learning_rate': 0.35800840726889294, 'max_depth': 9, 'min_child_weight': 1, 'subsample': 0.5, 'colsample_bytree': 0.5, 'colsample_bylevel': 0.8, 'reg_alpha': 1.9363927968874388, 'reg_lambda': 3.951548075402882e-06, 'gamma': 3.245709332599571e-05}. Best is trial 359 with value: -0.8315037537709427.
[I 2026-07-20 14:58:27,499] Trial 473 finished with value: -0.5375535659910705 and parameters: {'error_threshold': 2.5, 'scalers': 'standard', 'ratios': 'norm_ratio', 'imputers': 'mean', 'n_estimators': 2400, 'learning_rate': 0.35137127633460624, 'max_depth': 9, 'min_child_weight': 1, 'subsample': 0.5, 'colsample_bytree': 0.5, 'colsample_bylevel': 0.8, 'reg_alpha': 1.8242251124970448, 'reg_lambda': 1.5276024277999881e-06, 'gamma': 9.182729721675482e-06}. Best is trial 359 with value: -0.8315037537709427.
[I 2026-07-20 14:58:34,563] Trial 474 finished with value: -0.5433883630014953 and parameters: {'error_threshold': 2.5, 'scalers': 'standard', 'ratios': 'norm_ratio', 'imputers': 'mean', 'n_estimators': 2400, 'learning_rate': 0.35622525348219947, 'max_depth': 9, 'min_child_weight': 1, 'subsample': 0.5, 'colsample_bytree': 0.5, 'colsample_bylevel': 0.8, 'reg_alpha': 1.7443943872603784, 'reg_lambda': 2.0031612327024077e-06, 'gamma': 4.161473224395536e-05}. Best is trial 359 with value: -0.8315037537709427.
[I 2026-07-20 14:58:40,817] Trial 475 finished with value: -0.5251990986948131 and parameters: {'error_threshold': 2.5, 'scalers': 'standard', 'ratios': 'norm_ratio', 'imputers': 'mean', 'n_estimators': 2400, 'learning_rate': 0.3493585580817071, 'max_depth': 9, 'min_child_weight': 1, 'subsample': 0.5, 'colsample_bytree': 0.5, 'colsample_bylevel': 0.8, 'reg_alpha': 2.022408793876888, 'reg_lambda': 2.725971696966619e-06, 'gamma': 2.0055984315537512e-05}. Best is trial 359 with value: -0.8315037537709427.
[I 2026-07-20 14:58:57,929] Trial 476 finished with value: -0.4828544489041054 and parameters: {'error_threshold': 2.5, 'scalers': 'standard', 'ratios': 'norm_ratio', 'imputers': 'mean', 'n_estimators': 2400, 'learning_rate': 0.3569114032646491, 'max_depth': 8, 'min_child_weight': 1, 'subsample': 0.5, 'colsample_bytree': 0.5, 'colsample_bylevel': 0.8, 'reg_alpha': 1.9291605923740436, 'reg_lambda': 1.7561804332554339e-06, 'gamma': 1.0892164029352152e-05}. Best is trial 359 with value: -0.8315037537709427.
[I 2026-07-20 15:01:02,454] Trial 477 finished with value: -0.4911757143335746 and parameters: {'error_threshold': 2.5, 'scalers': 'standard', 'ratios': 'norm_ratio', 'imputers': 'mean', 'n_estimators': 2400, 'learning_rate': 0.36045150535081794, 'max_depth': 8, 'min_child_weight': 1, 'subsample': 0.5, 'colsample_bytree': 0.5, 'colsample_bylevel': 0.8, 'reg_alpha': 2.0500946078040143, 'reg_lambda': 1.4022038171547663e-06, 'gamma': 2.318105574042014e-05}. Best is trial 359 with value: -0.8315037537709427.
[I 2026-07-20 15:01:08,266] Trial 478 finished with value: -0.48323972255923014 and parameters: {'error_threshold': 2.75, 'scalers': 'standard', 'ratios': 'norm_ratio', 'imputers': 'mean', 'n_estimators': 2400, 'learning_rate': 0.357552697429299, 'max_depth': 8, 'min_child_weight': 1, 'subsample': 0.5, 'colsample_bytree': 0.5, 'colsample_bylevel': 0.8, 'reg_alpha': 1.9957676052821693, 'reg_lambda': 1.4684314619356469e-06, 'gamma': 3.603514764951015e-05}. Best is trial 359 with value: -0.8315037537709427.
[I 2026-07-20 15:01:27,310] Trial 479 finished with value: -0.5230297550969513 and parameters: {'error_threshold': 2.75, 'scalers': 'standard', 'ratios': 'norm_ratio', 'imputers': 'mean', 'n_estimators': 2400, 'learning_rate': 0.37101952957155776, 'max_depth': 8, 'min_child_weight': 1, 'subsample': 0.5, 'colsample_bytree': 0.5, 'colsample_bylevel': 0.8, 'reg_alpha': 1.7880578027871512, 'reg_lambda': 2.6081542416626265e-06, 'gamma': 4.703914346947611e-05}. Best is trial 359 with value: -0.8315037537709427.
[I 2026-07-20 15:01:33,026] Trial 480 finished with value: -0.4900139685136784 and parameters: {'error_threshold': 2.75, 'scalers': 'standard', 'ratios': 'norm_ratio', 'imputers': 'mean', 'n_estimators': 2400, 'learning_rate': 0.3662930720357017, 'max_depth': 8, 'min_child_weight': 1, 'subsample': 0.5, 'colsample_bytree': 0.5, 'colsample_bylevel': 0.8, 'reg_alpha': 2.1061284424234255, 'reg_lambda': 1.5172713511413853e-06, 'gamma': 9.251948112767663e-06}. Best is trial 359 with value: -0.8315037537709427.
[I 2026-07-20 15:01:38,759] Trial 481 finished with value: -0.5070472579454205 and parameters: {'error_threshold': 2.5, 'scalers': 'standard', 'ratios': 'norm_ratio', 'imputers': 'mean', 'n_estimators': 2400, 'learning_rate': 0.37090855239770715, 'max_depth': 8, 'min_child_weight': 1, 'subsample': 0.5, 'colsample_bytree': 0.5, 'colsample_bylevel': 0.8, 'reg_alpha': 2.095697567819121, 'reg_lambda': 2.6034073272153326e-06, 'gamma': 4.431115405223608e-05}. Best is trial 359 with value: -0.8315037537709427.
[I 2026-07-20 15:01:42,131] Trial 482 finished with value: -0.3995252398387261 and parameters: {'error_threshold': 2.75, 'scalers': 'standard', 'ratios': 'norm_ratio', 'imputers': 'mean', 'n_estimators': 2450, 'learning_rate': 0.40328679509131826, 'max_depth': 8, 'min_child_weight': 1, 'subsample': 0.5, 'colsample_bytree': 0.5, 'colsample_bylevel': 0.8, 'reg_alpha': 3.7038436263140024, 'reg_lambda': 1.287507880499913e-06, 'gamma': 4.828840291868497e-05}. Best is trial 359 with value: -0.8315037537709427.
[I 2026-07-20 15:01:47,990] Trial 483 finished with value: -0.548214140393393 and parameters: {'error_threshold': 2.75, 'scalers': 'standard', 'ratios': 'norm_ratio', 'imputers': 'mean', 'n_estimators': 2450, 'learning_rate': 0.41511077369050486, 'max_depth': 8, 'min_child_weight': 1, 'subsample': 0.5, 'colsample_bytree': 0.5, 'colsample_bylevel': 0.8, 'reg_alpha': 2.1656924546028447, 'reg_lambda': 2.1925466282653787e-06, 'gamma': 1.2581605086955493e-05}. Best is trial 359 with value: -0.8315037537709427.
[I 2026-07-20 15:02:01,383] Trial 484 finished with value: -0.5937713228120898 and parameters: {'error_threshold': 2.75, 'scalers': 'standard', 'ratios': 'norm_ratio', 'imputers': 'mean', 'n_estimators': 2450, 'learning_rate': 0.4141830671762604, 'max_depth': 8, 'min_child_weight': 1, 'subsample': 0.5, 'colsample_bytree': 0.5, 'colsample_bylevel': 0.8, 'reg_alpha': 1.3566333619575388, 'reg_lambda': 3.051961296204051e-06, 'gamma': 6.1882108393109995e-06}. Best is trial 359 with value: -0.8315037537709427.
[I 2026-07-20 15:03:29,156] Trial 486 finished with value: -0.31807890284868695 and parameters: {'error_threshold': 2.75, 'scalers': 'standard', 'ratios': 'norm_ratio', 'imputers': 'mean', 'n_estimators': 2450, 'learning_rate': 0.4994760494622607, 'max_depth': 4, 'min_child_weight': 1, 'subsample': 0.5, 'colsample_bytree': 0.5, 'colsample_bylevel': 0.8, 'reg_alpha': 1.2741850377997568, 'reg_lambda': 3.3679808878594505e-06, 'gamma': 6.392717989907576e-06}. Best is trial 359 with value: -0.8315037537709427.
[I 2026-07-20 15:03:44,549] Trial 485 finished with value: -0.3960030074589503 and parameters: {'error_threshold': 2.75, 'scalers': 'standard', 'ratios': 'norm_ratio', 'imputers': 'mean', 'n_estimators': 2450, 'learning_rate': 0.41487915769714606, 'max_depth': 8, 'min_child_weight': 1, 'subsample': 0.5, 'colsample_bytree': 0.5, 'colsample_bylevel': 0.8, 'reg_alpha': 3.9649952173563356, 'reg_lambda': 3.0203417910553292e-06, 'gamma': 4.24358594446193e-05}. Best is trial 359 with value: -0.8315037537709427.
[I 2026-07-20 15:03:47,114] Trial 488 finished with value: -0.163817726976787 and parameters: {'error_threshold': 2.75, 'scalers': 'standard', 'ratios': 'norm_ratio', 'imputers': 'mean', 'n_estimators': 2300, 'learning_rate': 0.004653194438496413, 'max_depth': 8, 'min_child_weight': 1, 'subsample': 0.5, 'colsample_bytree': 0.5, 'colsample_bylevel': 0.8, 'reg_alpha': 6.374235997966541, 'reg_lambda': 3.960339927677278e-06, 'gamma': 2.2202115828537705e-05}. Best is trial 359 with value: -0.8315037537709427.
[I 2026-07-20 15:04:05,281] Trial 487 finished with value: -0.18729058105323085 and parameters: {'error_threshold': 2.75, 'scalers': 'standard', 'ratios': 'norm_ratio', 'imputers': 'mean', 'n_estimators': 2300, 'learning_rate': 0.006210801545913183, 'max_depth': 8, 'min_child_weight': 1, 'subsample': 0.5, 'colsample_bytree': 0.5, 'colsample_bylevel': 0.8, 'reg_alpha': 1.2579614555667726, 'reg_lambda': 3.2483775685334796e-06, 'gamma': 1.7392718289552193e-06}. Best is trial 359 with value: -0.8315037537709427.
[I 2026-07-20 15:04:08,132] Trial 489 finished with value: -0.285927392632272 and parameters: {'error_threshold': 2.75, 'scalers': 'standard', 'ratios': 'norm_ratio', 'imputers': 'mean', 'n_estimators': 2450, 'learning_rate': 0.42059392695070835, 'max_depth': 8, 'min_child_weight': 1, 'subsample': 0.5, 'colsample_bytree': 0.5, 'colsample_bylevel': 0.8, 'reg_alpha': 7.009747379805528, 'reg_lambda': 3.8176764917300165e-06, 'gamma': 5.7164531722519e-06}. Best is trial 359 with value: -0.8315037537709427.
[I 2026-07-20 15:04:18,922] Trial 490 finished with value: -0.7509955273952178 and parameters: {'error_threshold': 2.75, 'scalers': 'standard', 'ratios': 'norm_ratio', 'imputers': 'mean', 'n_estimators': 2300, 'learning_rate': 0.49989594317693303, 'max_depth': 8, 'min_child_weight': 1, 'subsample': 0.5, 'colsample_bytree': 0.5, 'colsample_bylevel': 0.8, 'reg_alpha': 1.2463775621506712, 'reg_lambda': 3.532203980909871e-06, 'gamma': 2.8110854422583182e-05}. Best is trial 359 with value: -0.8315037537709427.
[I 2026-07-20 15:04:25,785] Trial 491 finished with value: -0.5814161362273639 and parameters: {'error_threshold': 2.25, 'scalers': 'standard', 'ratios': 'norm_ratio', 'imputers': 'mean', 'n_estimators': 2300, 'learning_rate': 0.4256499453052907, 'max_depth': 8, 'min_child_weight': 1, 'subsample': 0.5, 'colsample_bytree': 0.5, 'colsample_bylevel': 0.8, 'reg_alpha': 1.1829617479486125, 'reg_lambda': 3.6856687711718567e-06, 'gamma': 6.536364953162062e-06}. Best is trial 359 with value: -0.8315037537709427.
[I 2026-07-20 15:04:45,339] Trial 492 finished with value: -0.18064989594151162 and parameters: {'error_threshold': 2.25, 'scalers': 'standard', 'ratios': 'norm_ratio', 'imputers': 'mean', 'n_estimators': 2300, 'learning_rate': 0.004295349643323949, 'max_depth': 8, 'min_child_weight': 1, 'subsample': 0.5, 'colsample_bytree': 0.5, 'colsample_bylevel': 0.8, 'reg_alpha': 1.231060043925249, 'reg_lambda': 4.9116258838883035e-06, 'gamma': 7.88581140141114e-06}. Best is trial 359 with value: -0.8315037537709427.
[I 2026-07-20 15:06:09,636] Trial 493 finished with value: -0.41223268790318784 and parameters: {'error_threshold': 2.25, 'scalers': 'standard', 'ratios': 'norm_ratio', 'imputers': 'mean', 'n_estimators': 2350, 'learning_rate': 0.42950466142946303, 'max_depth': 8, 'min_child_weight': 1, 'subsample': 0.5, 'colsample_bytree': 0.5, 'colsample_bylevel': 0.8, 'reg_alpha': 3.8478437753956234, 'reg_lambda': 3.9722944335276334e-06, 'gamma': 2.4809205806203547e-05}. Best is trial 359 with value: -0.8315037537709427.
[I 2026-07-20 15:06:36,596] Trial 494 finished with value: -0.6035425645979203 and parameters: {'error_threshold': 2.25, 'scalers': 'standard', 'ratios': 'norm_ratio', 'imputers': 'mean', 'n_estimators': 2300, 'learning_rate': 0.42682952734409796, 'max_depth': 8, 'min_child_weight': 1, 'subsample': 0.5, 'colsample_bytree': 0.5, 'colsample_bylevel': 0.8, 'reg_alpha': 1.1864125152648386, 'reg_lambda': 4.6865227760189485e-06, 'gamma': 0.0022018004025075306}. Best is trial 359 with value: -0.8315037537709427.
[I 2026-07-20 15:06:53,301] Trial 495 finished with value: -0.6301765323663535 and parameters: {'error_threshold': 2.25, 'scalers': 'standard', 'ratios': 'norm_ratio', 'imputers': 'mean', 'n_estimators': 2300, 'learning_rate': 0.44060929990488673, 'max_depth': 8, 'min_child_weight': 1, 'subsample': 0.5, 'colsample_bytree': 0.5, 'colsample_bylevel': 0.8, 'reg_alpha': 1.1834826883138172, 'reg_lambda': 4.3203418250606115e-06, 'gamma': 1.7265429912546932e-06}. Best is trial 359 with value: -0.8315037537709427.
[I 2026-07-20 15:06:59,723] Trial 496 finished with value: -0.580567979247542 and parameters: {'error_threshold': 2.25, 'scalers': 'standard', 'ratios': 'norm_ratio', 'imputers': 'mean', 'n_estimators': 2300, 'learning_rate': 0.41722454987981517, 'max_depth': 8, 'min_child_weight': 1, 'subsample': 0.5, 'colsample_bytree': 0.5, 'colsample_bylevel': 0.7, 'reg_alpha': 1.19759839228476, 'reg_lambda': 5.451473222172076e-06, 'gamma': 2.584039634270241e-05}. Best is trial 359 with value: -0.8315037537709427.
[I 2026-07-20 15:07:04,711] Trial 497 finished with value: -0.2987335036918959 and parameters: {'error_threshold': 2.25, 'scalers': 'standard', 'ratios': 'norm_ratio', 'imputers': 'mean', 'n_estimators': 2350, 'learning_rate': 0.43299378683594886, 'max_depth': 8, 'min_child_weight': 6, 'subsample': 0.5, 'colsample_bytree': 0.5, 'colsample_bylevel': 0.7, 'reg_alpha': 1.195468566604827, 'reg_lambda': 5.635121054560191e-06, 'gamma': 0.002186841707251196}. Best is trial 359 with value: -0.8315037537709427.
[I 2026-07-20 15:07:16,987] Trial 498 finished with value: -0.5360248228402067 and parameters: {'error_threshold': 2.25, 'scalers': 'standard', 'ratios': 'norm_ratio', 'imputers': 'mean', 'n_estimators': 2250, 'learning_rate': 0.4358204022652602, 'max_depth': 8, 'min_child_weight': 1, 'subsample': 0.6, 'colsample_bytree': 0.5, 'colsample_bylevel': 0.7, 'reg_alpha': 1.2634856301758661, 'reg_lambda': 5.3173557981055954e-06, 'gamma': 0.002124612764073621}. Best is trial 359 with value: -0.8315037537709427.
[I 2026-07-20 15:07:22,838] Trial 499 finished with value: -0.447456184521412 and parameters: {'error_threshold': 2.25, 'scalers': 'standard', 'ratios': 'norm_ratio', 'imputers': 'mean', 'n_estimators': 2200, 'learning_rate': 0.31236153628581015, 'max_depth': 8, 'min_child_weight': 1, 'subsample': 0.5, 'colsample_bytree': 0.5, 'colsample_bylevel': 0.7, 'reg_alpha': 0.7221777776574485, 'reg_lambda': 5.281823553805077e-06, 'gamma': 2.5757741123034386e-05}. Best is trial 359 with value: -0.8315037537709427.
[I 2026-07-20 15:07:32,430] Trial 500 finished with value: -0.37798701586170574 and parameters: {'error_threshold': 2.25, 'scalers': 'standard', 'ratios': 'norm_ratio', 'imputers': 'mean', 'n_estimators': 2200, 'learning_rate': 0.3092948037254965, 'max_depth': 8, 'min_child_weight': 1, 'subsample': 0.5, 'colsample_bytree': 0.5, 'colsample_bylevel': 0.7, 'reg_alpha': 2.9077038422389934, 'reg_lambda': 5.3274625361461435e-06, 'gamma': 2.7868930060130007e-05}. Best is trial 359 with value: -0.8315037537709427.
[I 2026-07-20 15:08:50,753] Trial 501 finished with value: -0.6364113299095498 and parameters: {'error_threshold': 2.5, 'scalers': 'standard', 'ratios': 'norm_ratio', 'imputers': 'mean', 'n_estimators': 2250, 'learning_rate': 0.4940398907578747, 'max_depth': 8, 'min_child_weight': 1, 'subsample': 0.5, 'colsample_bytree': 0.5, 'colsample_bylevel': 0.7, 'reg_alpha': 0.7081855967407465, 'reg_lambda': 2.2251154283362426e-06, 'gamma': 2.753485329469657e-05}. Best is trial 359 with value: -0.8315037537709427.
[I 2026-07-20 15:09:17,561] Trial 505 finished with value: -0.3001064137771568 and parameters: {'error_threshold': 2.5, 'scalers': 'standard', 'ratios': 'norm_ratio', 'imputers': 'mean', 'n_estimators': 300, 'learning_rate': 0.3225082162003071, 'max_depth': 8, 'min_child_weight': 1, 'subsample': 0.5, 'colsample_bytree': 0.5, 'colsample_bylevel': 0.7, 'reg_alpha': 0.7159967593848812, 'reg_lambda': 2.117893876775674e-06, 'gamma': 1.5726845169311535e-05}. Best is trial 359 with value: -0.8315037537709427.
[I 2026-07-20 15:09:17,862] Trial 502 finished with value: -0.44303978754156365 and parameters: {'error_threshold': 2.5, 'scalers': 'standard', 'ratios': 'norm_ratio', 'imputers': 'mean', 'n_estimators': 2250, 'learning_rate': 0.31189165682413017, 'max_depth': 8, 'min_child_weight': 1, 'subsample': 0.5, 'colsample_bytree': 0.5, 'colsample_bylevel': 0.7, 'reg_alpha': 0.7062436118207813, 'reg_lambda': 1.9493961429799736e-06, 'gamma': 1.3899706744101947e-05}. Best is trial 359 with value: -0.8315037537709427.
[I 2026-07-20 15:09:34,379] Trial 503 finished with value: -0.44409912677585134 and parameters: {'error_threshold': 2.5, 'scalers': 'standard', 'ratios': 'norm_ratio', 'imputers': 'mean', 'n_estimators': 2250, 'learning_rate': 0.3147693569826751, 'max_depth': 8, 'min_child_weight': 1, 'subsample': 0.5, 'colsample_bytree': 0.5, 'colsample_bylevel': 0.7, 'reg_alpha': 0.7306529361290053, 'reg_lambda': 7.0645926732979964e-06, 'gamma': 1.2510954626293007e-05}. Best is trial 359 with value: -0.8315037537709427.
[I 2026-07-20 15:09:40,030] Trial 504 finished with value: -0.44019638903734376 and parameters: {'error_threshold': 2.5, 'scalers': 'standard', 'ratios': 'norm_ratio', 'imputers': 'mean', 'n_estimators': 2200, 'learning_rate': 0.3085792661687562, 'max_depth': 8, 'min_child_weight': 1, 'subsample': 0.5, 'colsample_bytree': 0.5, 'colsample_bylevel': 0.7, 'reg_alpha': 0.7140650193122614, 'reg_lambda': 1.6328210042406722e-06, 'gamma': 1.08301857404718e-05}. Best is trial 359 with value: -0.8315037537709427.
[I 2026-07-20 15:09:52,365] Trial 506 finished with value: -0.44258596933435307 and parameters: {'error_threshold': 2.5, 'scalers': 'standard', 'ratios': 'norm_ratio', 'imputers': 'mean', 'n_estimators': 2350, 'learning_rate': 0.3110761732157085, 'max_depth': 8, 'min_child_weight': 1, 'subsample': 0.5, 'colsample_bytree': 0.5, 'colsample_bylevel': 0.7, 'reg_alpha': 0.7179737287351968, 'reg_lambda': 1.967793464396491e-06, 'gamma': 4.596991014060632e-05}. Best is trial 359 with value: -0.8315037537709427.
[I 2026-07-20 15:09:58,406] Trial 507 finished with value: -0.6635464475598086 and parameters: {'error_threshold': 2.5, 'scalers': 'standard', 'ratios': 'norm_ratio', 'imputers': 'mean', 'n_estimators': 2200, 'learning_rate': 0.4962785707840332, 'max_depth': 8, 'min_child_weight': 1, 'subsample': 0.5, 'colsample_bytree': 0.5, 'colsample_bylevel': 0.7, 'reg_alpha': 0.7561405880153985, 'reg_lambda': 1.6946942880728231e-06, 'gamma': 1.4397530426337342e-05}. Best is trial 359 with value: -0.8315037537709427.
[I 2026-07-20 15:10:13,963] Trial 508 finished with value: -0.6733292631763029 and parameters: {'error_threshold': 2.5, 'scalers': 'standard', 'ratios': 'norm_ratio', 'imputers': 'mean', 'n_estimators': 2350, 'learning_rate': 0.49284145640499566, 'max_depth': 8, 'min_child_weight': 1, 'subsample': 0.5, 'colsample_bytree': 0.5, 'colsample_bylevel': 0.7, 'reg_alpha': 0.7770251178971727, 'reg_lambda': 2.2157376636991916e-06, 'gamma': 1.367459499090914e-05}. Best is trial 359 with value: -0.8315037537709427.
