[I 2026-07-20 13:43:13,846] Using an existing study with name 'final_predictive_quantile_study' instead of creating a new one.
/bsuscratch/alexanderemert/miniforge3/envs/starform-alex/lib/python3.14/site-packages/numpy/lib/_nanfunctions_impl.py:1215: RuntimeWarning: All-NaN slice encountered
  return fnb._ureduce(a, func=_nanmedian, keepdims=keepdims,
/bsuscratch/alexanderemert/miniforge3/envs/starform-alex/lib/python3.14/site-packages/numpy/lib/_nanfunctions_impl.py:1396: RuntimeWarning: All-NaN slice encountered
  return _nanquantile_unchecked(
/bsuscratch/alexanderemert/miniforge3/envs/starform-alex/lib/python3.14/site-packages/numpy/lib/_nanfunctions_impl.py:1215: RuntimeWarning: All-NaN slice encountered
  return fnb._ureduce(a, func=_nanmedian, keepdims=keepdims,
/bsuscratch/alexanderemert/miniforge3/envs/starform-alex/lib/python3.14/site-packages/numpy/lib/_nanfunctions_impl.py:1215: RuntimeWarning: All-NaN slice encountered
  return fnb._ureduce(a, func=_nanmedian, keepdims=keepdims,
/bsuscratch/alexanderemert/miniforge3/envs/starform-alex/lib/python3.14/site-packages/numpy/lib/_nanfunctions_impl.py:1396: RuntimeWarning: All-NaN slice encountered
  return _nanquantile_unchecked(
/bsuscratch/alexanderemert/miniforge3/envs/starform-alex/lib/python3.14/site-packages/numpy/lib/_nanfunctions_impl.py:1396: RuntimeWarning: All-NaN slice encountered
  return _nanquantile_unchecked(
/bsuscratch/alexanderemert/miniforge3/envs/starform-alex/lib/python3.14/site-packages/numpy/lib/_nanfunctions_impl.py:1215: RuntimeWarning: All-NaN slice encountered
  return fnb._ureduce(a, func=_nanmedian, keepdims=keepdims,
/bsuscratch/alexanderemert/miniforge3/envs/starform-alex/lib/python3.14/site-packages/numpy/lib/_nanfunctions_impl.py:1396: RuntimeWarning: All-NaN slice encountered
  return _nanquantile_unchecked(
/bsuscratch/alexanderemert/miniforge3/envs/starform-alex/lib/python3.14/site-packages/numpy/lib/_nanfunctions_impl.py:1215: RuntimeWarning: All-NaN slice encountered
  return fnb._ureduce(a, func=_nanmedian, keepdims=keepdims,
/bsuscratch/alexanderemert/miniforge3/envs/starform-alex/lib/python3.14/site-packages/numpy/lib/_nanfunctions_impl.py:1396: RuntimeWarning: All-NaN slice encountered
  return _nanquantile_unchecked(
/bsuscratch/alexanderemert/miniforge3/envs/starform-alex/lib/python3.14/site-packages/numpy/lib/_nanfunctions_impl.py:1215: RuntimeWarning: All-NaN slice encountered
  return fnb._ureduce(a, func=_nanmedian, keepdims=keepdims,
/bsuscratch/alexanderemert/miniforge3/envs/starform-alex/lib/python3.14/site-packages/numpy/lib/_nanfunctions_impl.py:1396: RuntimeWarning: All-NaN slice encountered
  return _nanquantile_unchecked(
/bsuscratch/alexanderemert/miniforge3/envs/starform-alex/lib/python3.14/site-packages/numpy/lib/_nanfunctions_impl.py:1215: RuntimeWarning: All-NaN slice encountered
  return fnb._ureduce(a, func=_nanmedian, keepdims=keepdims,
/bsuscratch/alexanderemert/miniforge3/envs/starform-alex/lib/python3.14/site-packages/numpy/lib/_nanfunctions_impl.py:1396: RuntimeWarning: All-NaN slice encountered
  return _nanquantile_unchecked(
/bsuscratch/alexanderemert/miniforge3/envs/starform-alex/lib/python3.14/site-packages/numpy/lib/_nanfunctions_impl.py:1215: RuntimeWarning: All-NaN slice encountered
  return fnb._ureduce(a, func=_nanmedian, keepdims=keepdims,
/bsuscratch/alexanderemert/miniforge3/envs/starform-alex/lib/python3.14/site-packages/numpy/lib/_nanfunctions_impl.py:1396: RuntimeWarning: All-NaN slice encountered
  return _nanquantile_unchecked(
/bsuscratch/alexanderemert/miniforge3/envs/starform-alex/lib/python3.14/site-packages/numpy/lib/_nanfunctions_impl.py:1215: RuntimeWarning: All-NaN slice encountered
  return fnb._ureduce(a, func=_nanmedian, keepdims=keepdims,
/bsuscratch/alexanderemert/miniforge3/envs/starform-alex/lib/python3.14/site-packages/numpy/lib/_nanfunctions_impl.py:1215: RuntimeWarning: All-NaN slice encountered
  return fnb._ureduce(a, func=_nanmedian, keepdims=keepdims,
/bsuscratch/alexanderemert/miniforge3/envs/starform-alex/lib/python3.14/site-packages/numpy/lib/_nanfunctions_impl.py:1396: RuntimeWarning: All-NaN slice encountered
  return _nanquantile_unchecked(
/bsuscratch/alexanderemert/miniforge3/envs/starform-alex/lib/python3.14/site-packages/numpy/lib/_nanfunctions_impl.py:1215: RuntimeWarning: All-NaN slice encountered
  return fnb._ureduce(a, func=_nanmedian, keepdims=keepdims,
/bsuscratch/alexanderemert/miniforge3/envs/starform-alex/lib/python3.14/site-packages/numpy/lib/_nanfunctions_impl.py:1215: RuntimeWarning: All-NaN slice encountered
  return fnb._ureduce(a, func=_nanmedian, keepdims=keepdims,
/bsuscratch/alexanderemert/miniforge3/envs/starform-alex/lib/python3.14/site-packages/numpy/lib/_nanfunctions_impl.py:1396: RuntimeWarning: All-NaN slice encountered
  return _nanquantile_unchecked(
/bsuscratch/alexanderemert/miniforge3/envs/starform-alex/lib/python3.14/site-packages/numpy/lib/_nanfunctions_impl.py:1215: RuntimeWarning: All-NaN slice encountered
  return fnb._ureduce(a, func=_nanmedian, keepdims=keepdims,
/bsuscratch/alexanderemert/miniforge3/envs/starform-alex/lib/python3.14/site-packages/numpy/lib/_nanfunctions_impl.py:1215: RuntimeWarning: All-NaN slice encountered
  return fnb._ureduce(a, func=_nanmedian, keepdims=keepdims,
/bsuscratch/alexanderemert/miniforge3/envs/starform-alex/lib/python3.14/site-packages/numpy/lib/_nanfunctions_impl.py:1396: RuntimeWarning: All-NaN slice encountered
  return _nanquantile_unchecked(
/bsuscratch/alexanderemert/miniforge3/envs/starform-alex/lib/python3.14/site-packages/numpy/lib/_nanfunctions_impl.py:1396: RuntimeWarning: All-NaN slice encountered
  return _nanquantile_unchecked(
/bsuscratch/alexanderemert/miniforge3/envs/starform-alex/lib/python3.14/site-packages/numpy/lib/_nanfunctions_impl.py:1215: RuntimeWarning: All-NaN slice encountered
  return fnb._ureduce(a, func=_nanmedian, keepdims=keepdims,
/bsuscratch/alexanderemert/miniforge3/envs/starform-alex/lib/python3.14/site-packages/numpy/lib/_nanfunctions_impl.py:1396: RuntimeWarning: All-NaN slice encountered
  return _nanquantile_unchecked(
/bsuscratch/alexanderemert/miniforge3/envs/starform-alex/lib/python3.14/site-packages/numpy/lib/_nanfunctions_impl.py:1215: RuntimeWarning: All-NaN slice encountered
  return fnb._ureduce(a, func=_nanmedian, keepdims=keepdims,
/bsuscratch/alexanderemert/miniforge3/envs/starform-alex/lib/python3.14/site-packages/numpy/lib/_nanfunctions_impl.py:1215: RuntimeWarning: All-NaN slice encountered
  return fnb._ureduce(a, func=_nanmedian, keepdims=keepdims,
/bsuscratch/alexanderemert/miniforge3/envs/starform-alex/lib/python3.14/site-packages/numpy/lib/_nanfunctions_impl.py:1396: RuntimeWarning: All-NaN slice encountered
  return _nanquantile_unchecked(
/bsuscratch/alexanderemert/miniforge3/envs/starform-alex/lib/python3.14/site-packages/numpy/lib/_nanfunctions_impl.py:1396: RuntimeWarning: All-NaN slice encountered
  return _nanquantile_unchecked(
/bsuscratch/alexanderemert/miniforge3/envs/starform-alex/lib/python3.14/site-packages/numpy/lib/_nanfunctions_impl.py:1215: RuntimeWarning: All-NaN slice encountered
  return fnb._ureduce(a, func=_nanmedian, keepdims=keepdims,
/bsuscratch/alexanderemert/miniforge3/envs/starform-alex/lib/python3.14/site-packages/numpy/lib/_nanfunctions_impl.py:1215: RuntimeWarning: All-NaN slice encountered
  return fnb._ureduce(a, func=_nanmedian, keepdims=keepdims,
/bsuscratch/alexanderemert/miniforge3/envs/starform-alex/lib/python3.14/site-packages/numpy/lib/_nanfunctions_impl.py:1396: RuntimeWarning: All-NaN slice encountered
  return _nanquantile_unchecked(
/bsuscratch/alexanderemert/miniforge3/envs/starform-alex/lib/python3.14/site-packages/numpy/lib/_nanfunctions_impl.py:1396: RuntimeWarning: All-NaN slice encountered
  return _nanquantile_unchecked(
/bsuscratch/alexanderemert/miniforge3/envs/starform-alex/lib/python3.14/site-packages/numpy/lib/_nanfunctions_impl.py:1215: RuntimeWarning: All-NaN slice encountered
  return fnb._ureduce(a, func=_nanmedian, keepdims=keepdims,
/bsuscratch/alexanderemert/miniforge3/envs/starform-alex/lib/python3.14/site-packages/numpy/lib/_nanfunctions_impl.py:1396: RuntimeWarning: All-NaN slice encountered
  return _nanquantile_unchecked(
/bsuscratch/alexanderemert/miniforge3/envs/starform-alex/lib/python3.14/site-packages/numpy/lib/_nanfunctions_impl.py:1215: RuntimeWarning: All-NaN slice encountered
  return fnb._ureduce(a, func=_nanmedian, keepdims=keepdims,
/bsuscratch/alexanderemert/miniforge3/envs/starform-alex/lib/python3.14/site-packages/numpy/lib/_nanfunctions_impl.py:1396: RuntimeWarning: All-NaN slice encountered
  return _nanquantile_unchecked(
/bsuscratch/alexanderemert/miniforge3/envs/starform-alex/lib/python3.14/site-packages/numpy/lib/_nanfunctions_impl.py:1215: RuntimeWarning: All-NaN slice encountered
  return fnb._ureduce(a, func=_nanmedian, keepdims=keepdims,
/bsuscratch/alexanderemert/miniforge3/envs/starform-alex/lib/python3.14/site-packages/numpy/lib/_nanfunctions_impl.py:1396: RuntimeWarning: All-NaN slice encountered
  return _nanquantile_unchecked(
/bsuscratch/alexanderemert/miniforge3/envs/starform-alex/lib/python3.14/site-packages/numpy/lib/_nanfunctions_impl.py:1215: RuntimeWarning: All-NaN slice encountered
  return fnb._ureduce(a, func=_nanmedian, keepdims=keepdims,
/bsuscratch/alexanderemert/miniforge3/envs/starform-alex/lib/python3.14/site-packages/numpy/lib/_nanfunctions_impl.py:1215: RuntimeWarning: All-NaN slice encountered
  return fnb._ureduce(a, func=_nanmedian, keepdims=keepdims,
/bsuscratch/alexanderemert/miniforge3/envs/starform-alex/lib/python3.14/site-packages/numpy/lib/_nanfunctions_impl.py:1396: RuntimeWarning: All-NaN slice encountered
  return _nanquantile_unchecked(
/bsuscratch/alexanderemert/miniforge3/envs/starform-alex/lib/python3.14/site-packages/numpy/lib/_nanfunctions_impl.py:1215: RuntimeWarning: All-NaN slice encountered
  return fnb._ureduce(a, func=_nanmedian, keepdims=keepdims,
/bsuscratch/alexanderemert/miniforge3/envs/starform-alex/lib/python3.14/site-packages/numpy/lib/_nanfunctions_impl.py:1396: RuntimeWarning: All-NaN slice encountered
  return _nanquantile_unchecked(
/bsuscratch/alexanderemert/miniforge3/envs/starform-alex/lib/python3.14/site-packages/numpy/lib/_nanfunctions_impl.py:1396: RuntimeWarning: All-NaN slice encountered
  return _nanquantile_unchecked(
/bsuscratch/alexanderemert/miniforge3/envs/starform-alex/lib/python3.14/site-packages/numpy/lib/_nanfunctions_impl.py:1215: RuntimeWarning: All-NaN slice encountered
  return fnb._ureduce(a, func=_nanmedian, keepdims=keepdims,
/bsuscratch/alexanderemert/miniforge3/envs/starform-alex/lib/python3.14/site-packages/numpy/lib/_nanfunctions_impl.py:1396: RuntimeWarning: All-NaN slice encountered
  return _nanquantile_unchecked(
/bsuscratch/alexanderemert/miniforge3/envs/starform-alex/lib/python3.14/site-packages/numpy/lib/_nanfunctions_impl.py:1215: RuntimeWarning: All-NaN slice encountered
  return fnb._ureduce(a, func=_nanmedian, keepdims=keepdims,
/bsuscratch/alexanderemert/miniforge3/envs/starform-alex/lib/python3.14/site-packages/numpy/lib/_nanfunctions_impl.py:1396: RuntimeWarning: All-NaN slice encountered
  return _nanquantile_unchecked(
/bsuscratch/alexanderemert/miniforge3/envs/starform-alex/lib/python3.14/site-packages/numpy/lib/_nanfunctions_impl.py:1215: RuntimeWarning: All-NaN slice encountered
  return fnb._ureduce(a, func=_nanmedian, keepdims=keepdims,
/bsuscratch/alexanderemert/miniforge3/envs/starform-alex/lib/python3.14/site-packages/numpy/lib/_nanfunctions_impl.py:1396: RuntimeWarning: All-NaN slice encountered
  return _nanquantile_unchecked(
/bsuscratch/alexanderemert/miniforge3/envs/starform-alex/lib/python3.14/site-packages/numpy/lib/_nanfunctions_impl.py:1215: RuntimeWarning: All-NaN slice encountered
  return fnb._ureduce(a, func=_nanmedian, keepdims=keepdims,
/bsuscratch/alexanderemert/miniforge3/envs/starform-alex/lib/python3.14/site-packages/numpy/lib/_nanfunctions_impl.py:1215: RuntimeWarning: All-NaN slice encountered
  return fnb._ureduce(a, func=_nanmedian, keepdims=keepdims,
/bsuscratch/alexanderemert/miniforge3/envs/starform-alex/lib/python3.14/site-packages/numpy/lib/_nanfunctions_impl.py:1396: RuntimeWarning: All-NaN slice encountered
  return _nanquantile_unchecked(
/bsuscratch/alexanderemert/miniforge3/envs/starform-alex/lib/python3.14/site-packages/numpy/lib/_nanfunctions_impl.py:1215: RuntimeWarning: All-NaN slice encountered
  return fnb._ureduce(a, func=_nanmedian, keepdims=keepdims,
/bsuscratch/alexanderemert/miniforge3/envs/starform-alex/lib/python3.14/site-packages/numpy/lib/_nanfunctions_impl.py:1215: RuntimeWarning: All-NaN slice encountered
  return fnb._ureduce(a, func=_nanmedian, keepdims=keepdims,
/bsuscratch/alexanderemert/miniforge3/envs/starform-alex/lib/python3.14/site-packages/numpy/lib/_nanfunctions_impl.py:1396: RuntimeWarning: All-NaN slice encountered
  return _nanquantile_unchecked(
/bsuscratch/alexanderemert/miniforge3/envs/starform-alex/lib/python3.14/site-packages/numpy/lib/_nanfunctions_impl.py:1396: RuntimeWarning: All-NaN slice encountered
  return _nanquantile_unchecked(
/bsuscratch/alexanderemert/miniforge3/envs/starform-alex/lib/python3.14/site-packages/numpy/lib/_nanfunctions_impl.py:1396: RuntimeWarning: All-NaN slice encountered
  return _nanquantile_unchecked(
/bsuscratch/alexanderemert/miniforge3/envs/starform-alex/lib/python3.14/site-packages/numpy/lib/_nanfunctions_impl.py:1215: RuntimeWarning: All-NaN slice encountered
  return fnb._ureduce(a, func=_nanmedian, keepdims=keepdims,
/bsuscratch/alexanderemert/miniforge3/envs/starform-alex/lib/python3.14/site-packages/numpy/lib/_nanfunctions_impl.py:1396: RuntimeWarning: All-NaN slice encountered
  return _nanquantile_unchecked(
/bsuscratch/alexanderemert/miniforge3/envs/starform-alex/lib/python3.14/site-packages/numpy/lib/_nanfunctions_impl.py:1215: RuntimeWarning: All-NaN slice encountered
  return fnb._ureduce(a, func=_nanmedian, keepdims=keepdims,
/bsuscratch/alexanderemert/miniforge3/envs/starform-alex/lib/python3.14/site-packages/numpy/lib/_nanfunctions_impl.py:1396: RuntimeWarning: All-NaN slice encountered
  return _nanquantile_unchecked(
/bsuscratch/alexanderemert/miniforge3/envs/starform-alex/lib/python3.14/site-packages/numpy/lib/_nanfunctions_impl.py:1215: RuntimeWarning: All-NaN slice encountered
  return fnb._ureduce(a, func=_nanmedian, keepdims=keepdims,
/bsuscratch/alexanderemert/miniforge3/envs/starform-alex/lib/python3.14/site-packages/numpy/lib/_nanfunctions_impl.py:1396: RuntimeWarning: All-NaN slice encountered
  return _nanquantile_unchecked(
/bsuscratch/alexanderemert/miniforge3/envs/starform-alex/lib/python3.14/site-packages/numpy/lib/_nanfunctions_impl.py:1215: RuntimeWarning: All-NaN slice encountered
  return fnb._ureduce(a, func=_nanmedian, keepdims=keepdims,
/bsuscratch/alexanderemert/miniforge3/envs/starform-alex/lib/python3.14/site-packages/numpy/lib/_nanfunctions_impl.py:1396: RuntimeWarning: All-NaN slice encountered
  return _nanquantile_unchecked(
/bsuscratch/alexanderemert/miniforge3/envs/starform-alex/lib/python3.14/site-packages/numpy/lib/_nanfunctions_impl.py:1215: RuntimeWarning: All-NaN slice encountered
  return fnb._ureduce(a, func=_nanmedian, keepdims=keepdims,
/bsuscratch/alexanderemert/miniforge3/envs/starform-alex/lib/python3.14/site-packages/numpy/lib/_nanfunctions_impl.py:1215: RuntimeWarning: All-NaN slice encountered
  return fnb._ureduce(a, func=_nanmedian, keepdims=keepdims,
/bsuscratch/alexanderemert/miniforge3/envs/starform-alex/lib/python3.14/site-packages/numpy/lib/_nanfunctions_impl.py:1396: RuntimeWarning: All-NaN slice encountered
  return _nanquantile_unchecked(
/bsuscratch/alexanderemert/miniforge3/envs/starform-alex/lib/python3.14/site-packages/numpy/lib/_nanfunctions_impl.py:1215: RuntimeWarning: All-NaN slice encountered
  return fnb._ureduce(a, func=_nanmedian, keepdims=keepdims,
/bsuscratch/alexanderemert/miniforge3/envs/starform-alex/lib/python3.14/site-packages/numpy/lib/_nanfunctions_impl.py:1396: RuntimeWarning: All-NaN slice encountered
  return _nanquantile_unchecked(
/bsuscratch/alexanderemert/miniforge3/envs/starform-alex/lib/python3.14/site-packages/numpy/lib/_nanfunctions_impl.py:1396: RuntimeWarning: All-NaN slice encountered
  return _nanquantile_unchecked(
/bsuscratch/alexanderemert/miniforge3/envs/starform-alex/lib/python3.14/site-packages/numpy/lib/_nanfunctions_impl.py:1215: RuntimeWarning: All-NaN slice encountered
  return fnb._ureduce(a, func=_nanmedian, keepdims=keepdims,
/bsuscratch/alexanderemert/miniforge3/envs/starform-alex/lib/python3.14/site-packages/numpy/lib/_nanfunctions_impl.py:1396: RuntimeWarning: All-NaN slice encountered
  return _nanquantile_unchecked(
/bsuscratch/alexanderemert/miniforge3/envs/starform-alex/lib/python3.14/site-packages/numpy/lib/_nanfunctions_impl.py:1215: RuntimeWarning: All-NaN slice encountered
  return fnb._ureduce(a, func=_nanmedian, keepdims=keepdims,
/bsuscratch/alexanderemert/miniforge3/envs/starform-alex/lib/python3.14/site-packages/numpy/lib/_nanfunctions_impl.py:1396: RuntimeWarning: All-NaN slice encountered
  return _nanquantile_unchecked(
/bsuscratch/alexanderemert/miniforge3/envs/starform-alex/lib/python3.14/site-packages/numpy/lib/_nanfunctions_impl.py:1215: RuntimeWarning: All-NaN slice encountered
  return fnb._ureduce(a, func=_nanmedian, keepdims=keepdims,
/bsuscratch/alexanderemert/miniforge3/envs/starform-alex/lib/python3.14/site-packages/numpy/lib/_nanfunctions_impl.py:1396: RuntimeWarning: All-NaN slice encountered
  return _nanquantile_unchecked(
/bsuscratch/alexanderemert/miniforge3/envs/starform-alex/lib/python3.14/site-packages/numpy/lib/_nanfunctions_impl.py:1215: RuntimeWarning: All-NaN slice encountered
  return fnb._ureduce(a, func=_nanmedian, keepdims=keepdims,
/bsuscratch/alexanderemert/miniforge3/envs/starform-alex/lib/python3.14/site-packages/numpy/lib/_nanfunctions_impl.py:1396: RuntimeWarning: All-NaN slice encountered
  return _nanquantile_unchecked(
/bsuscratch/alexanderemert/miniforge3/envs/starform-alex/lib/python3.14/site-packages/numpy/lib/_nanfunctions_impl.py:1215: RuntimeWarning: All-NaN slice encountered
  return fnb._ureduce(a, func=_nanmedian, keepdims=keepdims,
/bsuscratch/alexanderemert/miniforge3/envs/starform-alex/lib/python3.14/site-packages/numpy/lib/_nanfunctions_impl.py:1215: RuntimeWarning: All-NaN slice encountered
  return fnb._ureduce(a, func=_nanmedian, keepdims=keepdims,
/bsuscratch/alexanderemert/miniforge3/envs/starform-alex/lib/python3.14/site-packages/numpy/lib/_nanfunctions_impl.py:1396: RuntimeWarning: All-NaN slice encountered
  return _nanquantile_unchecked(
/bsuscratch/alexanderemert/miniforge3/envs/starform-alex/lib/python3.14/site-packages/numpy/lib/_nanfunctions_impl.py:1215: RuntimeWarning: All-NaN slice encountered
  return fnb._ureduce(a, func=_nanmedian, keepdims=keepdims,
/bsuscratch/alexanderemert/miniforge3/envs/starform-alex/lib/python3.14/site-packages/numpy/lib/_nanfunctions_impl.py:1396: RuntimeWarning: All-NaN slice encountered
  return _nanquantile_unchecked(
/bsuscratch/alexanderemert/miniforge3/envs/starform-alex/lib/python3.14/site-packages/numpy/lib/_nanfunctions_impl.py:1396: RuntimeWarning: All-NaN slice encountered
  return _nanquantile_unchecked(
/bsuscratch/alexanderemert/miniforge3/envs/starform-alex/lib/python3.14/site-packages/numpy/lib/_nanfunctions_impl.py:1215: RuntimeWarning: All-NaN slice encountered
  return fnb._ureduce(a, func=_nanmedian, keepdims=keepdims,
/bsuscratch/alexanderemert/miniforge3/envs/starform-alex/lib/python3.14/site-packages/numpy/lib/_nanfunctions_impl.py:1396: RuntimeWarning: All-NaN slice encountered
  return _nanquantile_unchecked(
/bsuscratch/alexanderemert/miniforge3/envs/starform-alex/lib/python3.14/site-packages/numpy/lib/_nanfunctions_impl.py:1215: RuntimeWarning: All-NaN slice encountered
  return fnb._ureduce(a, func=_nanmedian, keepdims=keepdims,
/bsuscratch/alexanderemert/miniforge3/envs/starform-alex/lib/python3.14/site-packages/numpy/lib/_nanfunctions_impl.py:1396: RuntimeWarning: All-NaN slice encountered
  return _nanquantile_unchecked(
/bsuscratch/alexanderemert/miniforge3/envs/starform-alex/lib/python3.14/site-packages/numpy/lib/_nanfunctions_impl.py:1215: RuntimeWarning: All-NaN slice encountered
  return fnb._ureduce(a, func=_nanmedian, keepdims=keepdims,
/bsuscratch/alexanderemert/miniforge3/envs/starform-alex/lib/python3.14/site-packages/numpy/lib/_nanfunctions_impl.py:1396: RuntimeWarning: All-NaN slice encountered
  return _nanquantile_unchecked(
/bsuscratch/alexanderemert/miniforge3/envs/starform-alex/lib/python3.14/site-packages/numpy/lib/_nanfunctions_impl.py:1215: RuntimeWarning: All-NaN slice encountered
  return fnb._ureduce(a, func=_nanmedian, keepdims=keepdims,
/bsuscratch/alexanderemert/miniforge3/envs/starform-alex/lib/python3.14/site-packages/numpy/lib/_nanfunctions_impl.py:1396: RuntimeWarning: All-NaN slice encountered
  return _nanquantile_unchecked(
/bsuscratch/alexanderemert/miniforge3/envs/starform-alex/lib/python3.14/site-packages/numpy/lib/_nanfunctions_impl.py:1215: RuntimeWarning: All-NaN slice encountered
  return fnb._ureduce(a, func=_nanmedian, keepdims=keepdims,
/bsuscratch/alexanderemert/miniforge3/envs/starform-alex/lib/python3.14/site-packages/numpy/lib/_nanfunctions_impl.py:1215: RuntimeWarning: All-NaN slice encountered
  return fnb._ureduce(a, func=_nanmedian, keepdims=keepdims,
/bsuscratch/alexanderemert/miniforge3/envs/starform-alex/lib/python3.14/site-packages/numpy/lib/_nanfunctions_impl.py:1396: RuntimeWarning: All-NaN slice encountered
  return _nanquantile_unchecked(
/bsuscratch/alexanderemert/miniforge3/envs/starform-alex/lib/python3.14/site-packages/numpy/lib/_nanfunctions_impl.py:1396: RuntimeWarning: All-NaN slice encountered
  return _nanquantile_unchecked(
/bsuscratch/alexanderemert/miniforge3/envs/starform-alex/lib/python3.14/site-packages/numpy/lib/_nanfunctions_impl.py:1