[I 2026-07-20 13:39:40,345] Trial 639 finished with value: -0.23904754288342253 and parameters: {'error_threshold': 0.25, 'scalers': 'robust', 'ratios': 'log_ratio', 'imputers': 'none', 'n_estimators': 450, 'learning_rate': 0.0002585547477858951, 'max_depth': 5, 'min_child_weight': 10, 'subsample': 0.7, 'colsample_bytree': 0.8, 'colsample_bylevel': 0.6, 'reg_alpha': 28.961906877136308, 'reg_lambda': 21.41659737448343, 'gamma': 51.65259394416266}. Best is trial 370 with value: -0.24379341779244815.
[I 2026-07-20 13:39:40,351] Using an existing study with name 'final_predictive_mean_study' instead of creating a new one.
[W 2026-07-20 13:39:41,161] Trial 13 failed with parameters: {'error_threshold': 0.25, 'scalers': 'standard', 'ratios': 'norm_ratio', 'imputers': 'mean', 'n_estimators': 400, 'learning_rate': 0.10503753859202469, 'max_depth': 12, 'min_child_weight': 2, 'subsample': 0.5, 'colsample_bytree': 0.9, 'colsample_bylevel': 0.6, 'reg_alpha': 0.0412281383874604, 'reg_lambda': 78.4233114582299, 'gamma': 6.928393279276769} because of the following error: InvalidParameterError("The 'scoring' parameter of cross_val_score must be a str among {'completeness_score', 'f1', 'd2_log_loss_score', 'neg_brier_score', 'roc_auc', 'f1_micro', 'recall_macro', 'top_k_accuracy', 'homogeneity_score', 'neg_mean_absolute_percentage_error', 'matthews_corrcoef', 'neg_mean_poisson_deviance', 'neg_mean_gamma_deviance', 'v_measure_score', 'f1_samples', 'explained_variance', 'mutual_info_score', 'neg_log_loss', 'recall_micro', 'jaccard_micro', 'neg_negative_likelihood_ratio', 'rand_score', 'roc_auc_ovo', 'jaccard', 'jaccard_macro', 'accuracy', 'precision_weighted', 'f1_weighted', 'balanced_accuracy', 'f1_macro', 'neg_mean_squared_log_error', 'precision_samples', 'd2_brier_score', 'd2_absolute_error_score', 'normalized_mutual_info_score', 'precision_micro', 'precision_macro', 'roc_auc_ovr_weighted', 'jaccard_weighted', 'adjusted_rand_score', 'neg_max_error', 'roc_auc_ovr', 'r2', 'neg_mean_squared_error', 'recall_samples', 'jaccard_samples', 'adjusted_mutual_info_score', 'roc_auc_ovo_weighted', 'neg_root_mean_squared_log_error', 'average_precision', 'positive_likelihood_ratio', 'neg_median_absolute_error', 'precision', 'recall', 'recall_weighted', 'neg_mean_absolute_error', 'neg_root_mean_squared_error', 'fowlkes_mallows_score'}, a callable or None. Got 'root_mean_squared_error' instead.").
Traceback (most recent call last):
  File "/bsuscratch/alexanderemert/miniforge3/envs/starform-alex/lib/python3.14/site-packages/optuna/study/_optimize.py", line 206, in _run_trial
    value_or_values = func(trial)
  File "/bsuhome/alexanderemert/Research/Star-Formation-Research-Project-2026/pipeline/scripts/optuna/final_preds_and_models/optuna_search_mult_quant_reg.py", line 231, in objective
    scores = cross_val_score(model_pipe, X_train, y_train, scoring='root_mean_squared_error', cv=6, n_jobs=6)
  File "/bsuscratch/alexanderemert/miniforge3/envs/starform-alex/lib/python3.14/site-packages/sklearn/utils/_param_validation.py", line 208, in wrapper
    validate_parameter_constraints(
    ~~~~~~~~~~~~~~~~~~~~~~~~~~~~~~^
        parameter_constraints, params, caller_name=func.__qualname__
        ^^^^^^^^^^^^^^^^^^^^^^^^^^^^^^^^^^^^^^^^^^^^^^^^^^^^^^^^^^^^
    )
    ^
  File "/bsuscratch/alexanderemert/miniforge3/envs/starform-alex/lib/python3.14/site-packages/sklearn/utils/_param_validation.py", line 98, in validate_parameter_constraints
    raise InvalidParameterError(
    ...<2 lines>...
    )
sklearn.utils._param_validation.InvalidParameterError: The 'scoring' parameter of cross_val_score must be a str among {'completeness_score', 'f1', 'd2_log_loss_score', 'neg_brier_score', 'roc_auc', 'f1_micro', 'recall_macro', 'top_k_accuracy', 'homogeneity_score', 'neg_mean_absolute_percentage_error', 'matthews_corrcoef', 'neg_mean_poisson_deviance', 'neg_mean_gamma_deviance', 'v_measure_score', 'f1_samples', 'explained_variance', 'mutual_info_score', 'neg_log_loss', 'recall_micro', 'jaccard_micro', 'neg_negative_likelihood_ratio', 'rand_score', 'roc_auc_ovo', 'jaccard', 'jaccard_macro', 'accuracy', 'precision_weighted', 'f1_weighted', 'balanced_accuracy', 'f1_macro', 'neg_mean_squared_log_error', 'precision_samples', 'd2_brier_score', 'd2_absolute_error_score', 'normalized_mutual_info_score', 'precision_micro', 'precision_macro', 'roc_auc_ovr_weighted', 'jaccard_weighted', 'adjusted_rand_score', 'neg_max_error', 'roc_auc_ovr', 'r2', 'neg_mean_squared_error', 'recall_samples', 'jaccard_samples', 'adjusted_mutual_info_score', 'roc_auc_ovo_weighted', 'neg_root_mean_squared_log_error', 'average_precision', 'positive_likelihood_ratio', 'neg_median_absolute_error', 'precision', 'recall', 'recall_weighted', 'neg_mean_absolute_error', 'neg_root_mean_squared_error', 'fowlkes_mallows_score'}, a callable or None. Got 'root_mean_squared_error' instead.
[W 2026-07-20 13:39:41,186] Trial 13 failed with value None.
[W 2026-07-20 13:39:41,951] Trial 9 failed with parameters: {'error_threshold': 0.5, 'scalers': 'none', 'ratios': 'log_ratio', 'imputers': 'median', 'n_estimators': 100, 'learning_rate': 0.0003080497678663889, 'max_depth': 10, 'min_child_weight': 6, 'subsample': 0.7, 'colsample_bytree': 0.9, 'colsample_bylevel': 0.5, 'reg_alpha': 0.0015406282224917538, 'reg_lambda': 0.0006086688425578258, 'gamma': 0.0025967783972282226} because of the following error: InvalidParameterError("The 'scoring' parameter of cross_val_score must be a str among {'completeness_score', 'f1', 'd2_log_loss_score', 'neg_brier_score', 'roc_auc', 'f1_micro', 'recall_macro', 'top_k_accuracy', 'homogeneity_score', 'neg_mean_absolute_percentage_error', 'matthews_corrcoef', 'neg_mean_poisson_deviance', 'neg_mean_gamma_deviance', 'v_measure_score', 'f1_samples', 'explained_variance', 'mutual_info_score', 'neg_log_loss', 'recall_micro', 'jaccard_micro', 'neg_negative_likelihood_ratio', 'rand_score', 'roc_auc_ovo', 'jaccard', 'jaccard_macro', 'accuracy', 'precision_weighted', 'f1_weighted', 'balanced_accuracy', 'f1_macro', 'neg_mean_squared_log_error', 'precision_samples', 'd2_brier_score', 'd2_absolute_error_score', 'normalized_mutual_info_score', 'precision_micro', 'precision_macro', 'roc_auc_ovr_weighted', 'jaccard_weighted', 'adjusted_rand_score', 'neg_max_error', 'roc_auc_ovr', 'r2', 'neg_mean_squared_error', 'recall_samples', 'jaccard_samples', 'adjusted_mutual_info_score', 'roc_auc_ovo_weighted', 'neg_root_mean_squared_log_error', 'average_precision', 'positive_likelihood_ratio', 'neg_median_absolute_error', 'precision', 'recall', 'recall_weighted', 'neg_mean_absolute_error', 'neg_root_mean_squared_error', 'fowlkes_mallows_score'}, a callable or None. Got 'root_mean_squared_error' instead.").
Traceback (most recent call last):
  File "/bsuscratch/alexanderemert/miniforge3/envs/starform-alex/lib/python3.14/site-packages/optuna/study/_optimize.py", line 206, in _run_trial
    value_or_values = func(trial)
  File "/bsuhome/alexanderemert/Research/Star-Formation-Research-Project-2026/pipeline/scripts/optuna/final_preds_and_models/optuna_search_mult_quant_reg.py", line 231, in objective
    scores = cross_val_score(model_pipe, X_train, y_train, scoring='root_mean_squared_error', cv=6, n_jobs=6)
  File "/bsuscratch/alexanderemert/miniforge3/envs/starform-alex/lib/python3.14/site-packages/sklearn/utils/_param_validation.py", line 208, in wrapper
    validate_parameter_constraints(
    ~~~~~~~~~~~~~~~~~~~~~~~~~~~~~~^
        parameter_constraints, params, caller_name=func.__qualname__
        ^^^^^^^^^^^^^^^^^^^^^^^^^^^^^^^^^^^^^^^^^^^^^^^^^^^^^^^^^^^^
    )
    ^
  File "/bsuscratch/alexanderemert/miniforge3/envs/starform-alex/lib/python3.14/site-packages/sklearn/utils/_param_validation.py", line 98, in validate_parameter_constraints
    raise InvalidParameterError(
    ...<2 lines>...
    )
sklearn.utils._param_validation.InvalidParameterError: The 'scoring' parameter of cross_val_score must be a str among {'completeness_score', 'f1', 'd2_log_loss_score', 'neg_brier_score', 'roc_auc', 'f1_micro', 'recall_macro', 'top_k_accuracy', 'homogeneity_score', 'neg_mean_absolute_percentage_error', 'matthews_corrcoef', 'neg_mean_poisson_deviance', 'neg_mean_gamma_deviance', 'v_measure_score', 'f1_samples', 'explained_variance', 'mutual_info_score', 'neg_log_loss', 'recall_micro', 'jaccard_micro', 'neg_negative_likelihood_ratio', 'rand_score', 'roc_auc_ovo', 'jaccard', 'jaccard_macro', 'accuracy', 'precision_weighted', 'f1_weighted', 'balanced_accuracy', 'f1_macro', 'neg_mean_squared_log_error', 'precision_samples', 'd2_brier_score', 'd2_absolute_error_score', 'normalized_mutual_info_score', 'precision_micro', 'precision_macro', 'roc_auc_ovr_weighted', 'jaccard_weighted', 'adjusted_rand_score', 'neg_max_error', 'roc_auc_ovr', 'r2', 'neg_mean_squared_error', 'recall_samples', 'jaccard_samples', 'adjusted_mutual_info_score', 'roc_auc_ovo_weighted', 'neg_root_mean_squared_log_error', 'average_precision', 'positive_likelihood_ratio', 'neg_median_absolute_error', 'precision', 'recall', 'recall_weighted', 'neg_mean_absolute_error', 'neg_root_mean_squared_error', 'fowlkes_mallows_score'}, a callable or None. Got 'root_mean_squared_error' instead.
[W 2026-07-20 13:39:41,952] Trial 9 failed with value None.
[W 2026-07-20 13:39:42,208] Trial 15 failed with parameters: {'error_threshold': 3.0, 'scalers': 'robust', 'ratios': 'norm_ratio', 'imputers': 'mean', 'n_estimators': 450, 'learning_rate': 0.01638434628039296, 'max_depth': 6, 'min_child_weight': 10, 'subsample': 0.8, 'colsample_bytree': 0.9, 'colsample_bylevel': 0.8, 'reg_alpha': 0.26882067354028766, 'reg_lambda': 9.879963079288165e-06, 'gamma': 3.1957118194158216e-06} because of the following error: InvalidParameterError("The 'scoring' parameter of cross_val_score must be a str among {'completeness_score', 'f1', 'd2_log_loss_score', 'neg_brier_score', 'roc_auc', 'f1_micro', 'recall_macro', 'top_k_accuracy', 'homogeneity_score', 'neg_mean_absolute_percentage_error', 'matthews_corrcoef', 'neg_mean_poisson_deviance', 'neg_mean_gamma_deviance', 'v_measure_score', 'f1_samples', 'explained_variance', 'mutual_info_score', 'neg_log_loss', 'recall_micro', 'jaccard_micro', 'neg_negative_likelihood_ratio', 'rand_score', 'roc_auc_ovo', 'jaccard', 'jaccard_macro', 'accuracy', 'precision_weighted', 'f1_weighted', 'balanced_accuracy', 'f1_macro', 'neg_mean_squared_log_error', 'precision_samples', 'd2_brier_score', 'd2_absolute_error_score', 'normalized_mutual_info_score', 'precision_micro', 'precision_macro', 'roc_auc_ovr_weighted', 'jaccard_weighted', 'adjusted_rand_score', 'neg_max_error', 'roc_auc_ovr', 'r2', 'neg_mean_squared_error', 'recall_samples', 'jaccard_samples', 'adjusted_mutual_info_score', 'roc_auc_ovo_weighted', 'neg_root_mean_squared_log_error', 'average_precision', 'positive_likelihood_ratio', 'neg_median_absolute_error', 'precision', 'recall', 'recall_weighted', 'neg_mean_absolute_error', 'neg_root_mean_squared_error', 'fowlkes_mallows_score'}, a callable or None. Got 'root_mean_squared_error' instead.").
Traceback (most recent call last):
  File "/bsuscratch/alexanderemert/miniforge3/envs/starform-alex/lib/python3.14/site-packages/optuna/study/_optimize.py", line 206, in _run_trial
    value_or_values = func(trial)
  File "/bsuhome/alexanderemert/Research/Star-Formation-Research-Project-2026/pipeline/scripts/optuna/final_preds_and_models/optuna_search_mult_quant_reg.py", line 231, in objective
    scores = cross_val_score(model_pipe, X_train, y_train, scoring='root_mean_squared_error', cv=6, n_jobs=6)
  File "/bsuscratch/alexanderemert/miniforge3/envs/starform-alex/lib/python3.14/site-packages/sklearn/utils/_param_validation.py", line 208, in wrapper
    validate_parameter_constraints(
    ~~~~~~~~~~~~~~~~~~~~~~~~~~~~~~^
        parameter_constraints, params, caller_name=func.__qualname__
        ^^^^^^^^^^^^^^^^^^^^^^^^^^^^^^^^^^^^^^^^^^^^^^^^^^^^^^^^^^^^
    )
    ^
  File "/bsuscratch/alexanderemert/miniforge3/envs/starform-alex/lib/python3.14/site-packages/sklearn/utils/_param_validation.py", line 98, in validate_parameter_constraints
    raise InvalidParameterError(
    ...<2 lines>...
    )
sklearn.utils._param_validation.InvalidParameterError: The 'scoring' parameter of cross_val_score must be a str among {'completeness_score', 'f1', 'd2_log_loss_score', 'neg_brier_score', 'roc_auc', 'f1_micro', 'recall_macro', 'top_k_accuracy', 'homogeneity_score', 'neg_mean_absolute_percentage_error', 'matthews_corrcoef', 'neg_mean_poisson_deviance', 'neg_mean_gamma_deviance', 'v_measure_score', 'f1_samples', 'explained_variance', 'mutual_info_score', 'neg_log_loss', 'recall_micro', 'jaccard_micro', 'neg_negative_likelihood_ratio', 'rand_score', 'roc_auc_ovo', 'jaccard', 'jaccard_macro', 'accuracy', 'precision_weighted', 'f1_weighted', 'balanced_accuracy', 'f1_macro', 'neg_mean_squared_log_error', 'precision_samples', 'd2_brier_score', 'd2_absolute_error_score', 'normalized_mutual_info_score', 'precision_micro', 'precision_macro', 'roc_auc_ovr_weighted', 'jaccard_weighted', 'adjusted_rand_score', 'neg_max_error', 'roc_auc_ovr', 'r2', 'neg_mean_squared_error', 'recall_samples', 'jaccard_samples', 'adjusted_mutual_info_score', 'roc_auc_ovo_weighted', 'neg_root_mean_squared_log_error', 'average_precision', 'positive_likelihood_ratio', 'neg_median_absolute_error', 'precision', 'recall', 'recall_weighted', 'neg_mean_absolute_error', 'neg_root_mean_squared_error', 'fowlkes_mallows_score'}, a callable or None. Got 'root_mean_squared_error' instead.
[W 2026-07-20 13:39:42,209] Trial 15 failed with value None.
[W 2026-07-20 13:39:43,224] Trial 11 failed with parameters: {'error_threshold': 5.0, 'scalers': 'robust', 'ratios': 'norm_ratio', 'imputers': 'median', 'n_estimators': 2200, 'learning_rate': 0.06529284993865292, 'max_depth': 3, 'min_child_weight': 3, 'subsample': 0.8, 'colsample_bytree': 1.0, 'colsample_bylevel': 0.9, 'reg_alpha': 1.819810557827553e-06, 'reg_lambda': 0.002096026842506231, 'gamma': 7.529455121181664e-05} because of the following error: InvalidParameterError("The 'scoring' parameter of cross_val_score must be a str among {'completeness_score', 'f1', 'd2_log_loss_score', 'neg_brier_score', 'roc_auc', 'f1_micro', 'recall_macro', 'top_k_accuracy', 'homogeneity_score', 'neg_mean_absolute_percentage_error', 'matthews_corrcoef', 'neg_mean_poisson_deviance', 'neg_mean_gamma_deviance', 'v_measure_score', 'f1_samples', 'explained_variance', 'mutual_info_score', 'neg_log_loss', 'recall_micro', 'jaccard_micro', 'neg_negative_likelihood_ratio', 'rand_score', 'roc_auc_ovo', 'jaccard', 'jaccard_macro', 'accuracy', 'precision_weighted', 'f1_weighted', 'balanced_accuracy', 'f1_macro', 'neg_mean_squared_log_error', 'precision_samples', 'd2_brier_score', 'd2_absolute_error_score', 'normalized_mutual_info_score', 'precision_micro', 'precision_macro', 'roc_auc_ovr_weighted', 'jaccard_weighted', 'adjusted_rand_score', 'neg_max_error', 'roc_auc_ovr', 'r2', 'neg_mean_squared_error', 'recall_samples', 'jaccard_samples', 'adjusted_mutual_info_score', 'roc_auc_ovo_weighted', 'neg_root_mean_squared_log_error', 'average_precision', 'positive_likelihood_ratio', 'neg_median_absolute_error', 'precision', 'recall', 'recall_weighted', 'neg_mean_absolute_error', 'neg_root_mean_squared_error', 'fowlkes_mallows_score'}, a callable or None. Got 'root_mean_squared_error' instead.").
Traceback (most recent call last):
  File "/bsuscratch/alexanderemert/miniforge3/envs/starform-alex/lib/python3.14/site-packages/optuna/study/_optimize.py", line 206, in _run_trial
    value_or_values = func(trial)
  File "/bsuhome/alexanderemert/Research/Star-Formation-Research-Project-2026/pipeline/scripts/optuna/final_preds_and_models/optuna_search_mult_quant_reg.py", line 231, in objective
    scores = cross_val_score(model_pipe, X_train, y_train, scoring='root_mean_squared_error', cv=6, n_jobs=6)
  File "/bsuscratch/alexanderemert/miniforge3/envs/starform-alex/lib/python3.14/site-packages/sklearn/utils/_param_validation.py", line 208, in wrapper
    validate_parameter_constraints(
    ~~~~~~~~~~~~~~~~~~~~~~~~~~~~~~^
        parameter_constraints, params, caller_name=func.__qualname__
        ^^^^^^^^^^^^^^^^^^^^^^^^^^^^^^^^^^^^^^^^^^^^^^^^^^^^^^^^^^^^
    )
    ^
  File "/bsuscratch/alexanderemert/miniforge3/envs/starform-alex/lib/python3.14/site-packages/sklearn/utils/_param_validation.py", line 98, in validate_parameter_constraints
    raise InvalidParameterError(
    ...<2 lines>...
    )
sklearn.utils._param_validation.InvalidParameterError: The 'scoring' parameter of cross_val_score must be a str among {'completeness_score', 'f1', 'd2_log_loss_score', 'neg_brier_score', 'roc_auc', 'f1_micro', 'recall_macro', 'top_k_accuracy', 'homogeneity_score', 'neg_mean_absolute_percentage_error', 'matthews_corrcoef', 'neg_mean_poisson_deviance', 'neg_mean_gamma_deviance', 'v_measure_score', 'f1_samples', 'explained_variance', 'mutual_info_score', 'neg_log_loss', 'recall_micro', 'jaccard_micro', 'neg_negative_likelihood_ratio', 'rand_score', 'roc_auc_ovo', 'jaccard', 'jaccard_macro', 'accuracy', 'precision_weighted', 'f1_weighted', 'balanced_accuracy', 'f1_macro', 'neg_mean_squared_log_error', 'precision_samples', 'd2_brier_score', 'd2_absolute_error_score', 'normalized_mutual_info_score', 'precision_micro', 'precision_macro', 'roc_auc_ovr_weighted', 'jaccard_weighted', 'adjusted_rand_score', 'neg_max_error', 'roc_auc_ovr', 'r2', 'neg_mean_squared_error', 'recall_samples', 'jaccard_samples', 'adjusted_mutual_info_score', 'roc_auc_ovo_weighted', 'neg_root_mean_squared_log_error', 'average_precision', 'positive_likelihood_ratio', 'neg_median_absolute_error', 'precision', 'recall', 'recall_weighted', 'neg_mean_absolute_error', 'neg_root_mean_squared_error', 'fowlkes_mallows_score'}, a callable or None. Got 'root_mean_squared_error' instead.
[W 2026-07-20 13:39:43,226] Trial 11 failed with value None.
[W 2026-07-20 13:39:47,976] Trial 14 failed with parameters: {'error_threshold': 4.75, 'scalers': 'robust', 'ratios': 'norm_ratio', 'imputers': 'mean', 'n_estimators': 800, 'learning_rate': 0.008721800112859644, 'max_depth': 11, 'min_child_weight': 1, 'subsample': 0.5, 'colsample_bytree': 0.7, 'colsample_bylevel': 0.5, 'reg_alpha': 3.6923408616000923, 'reg_lambda': 17.360763610986343, 'gamma': 4.096589432623694e-06} because of the following error: InvalidParameterError("The 'scoring' parameter of cross_val_score must be a str among {'completeness_score', 'f1', 'd2_log_loss_score', 'neg_brier_score', 'roc_auc', 'f1_micro', 'recall_macro', 'top_k_accuracy', 'homogeneity_score', 'neg_mean_absolute_percentage_error', 'matthews_corrcoef', 'neg_mean_poisson_deviance', 'neg_mean_gamma_deviance', 'v_measure_score', 'f1_samples', 'explained_variance', 'mutual_info_score', 'neg_log_loss', 'recall_micro', 'jaccard_micro', 'neg_negative_likelihood_ratio', 'rand_score', 'roc_auc_ovo', 'jaccard', 'jaccard_macro', 'accuracy', 'precision_weighted', 'f1_weighted', 'balanced_accuracy', 'f1_macro', 'neg_mean_squared_log_error', 'precision_samples', 'd2_brier_score', 'd2_absolute_error_score', 'normalized_mutual_info_score', 'precision_micro', 'precision_macro', 'roc_auc_ovr_weighted', 'jaccard_weighted', 'adjusted_rand_score', 'neg_max_error', 'roc_auc_ovr', 'r2', 'neg_mean_squared_error', 'recall_samples', 'jaccard_samples', 'adjusted_mutual_info_score', 'roc_auc_ovo_weighted', 'neg_root_mean_squared_log_error', 'average_precision', 'positive_likelihood_ratio', 'neg_median_absolute_error', 'precision', 'recall', 'recall_weighted', 'neg_mean_absolute_error', 'neg_root_mean_squared_error', 'fowlkes_mallows_score'}, a callable or None. Got 'root_mean_squared_error' instead.").
Traceback (most recent call last):
  File "/bsuscratch/alexanderemert/miniforge3/envs/starform-alex/lib/python3.14/site-packages/optuna/study/_optimize.py", line 206, in _run_trial
    value_or_values = func(trial)
  File "/bsuhome/alexanderemert/Research/Star-Formation-Research-Project-2026/pipeline/scripts/optuna/final_preds_and_models/optuna_search_mult_quant_reg.py", line 231, in objective
    scores = cross_val_score(model_pipe, X_train, y_train, scoring='root_mean_squared_error', cv=6, n_jobs=6)
  File "/bsuscratch/alexanderemert/miniforge3/envs/starform-alex/lib/python3.14/site-packages/sklearn/utils/_param_validation.py", line 208, in wrapper
    validate_parameter_constraints(
    ~~~~~~~~~~~~~~~~~~~~~~~~~~~~~~^
        parameter_constraints, params, caller_name=func.__qualname__
        ^^^^^^^^^^^^^^^^^^^^^^^^^^^^^^^^^^^^^^^^^^^^^^^^^^^^^^^^^^^^
    )
    ^
  File "/bsuscratch/alexanderemert/miniforge3/envs/starform-alex/lib/python3.14/site-packages/sklearn/utils/_param_validation.py", line 98, in validate_parameter_constraints
    raise InvalidParameterError(
    ...<2 lines>...
    )
sklearn.utils._param_validation.InvalidParameterError: The 'scoring' parameter of cross_val_score must be a str among {'completeness_score', 'f1', 'd2_log_loss_score', 'neg_brier_score', 'roc_auc', 'f1_micro', 'recall_macro', 'top_k_accuracy', 'homogeneity_score', 'neg_mean_absolute_percentage_error', 'matthews_corrcoef', 'neg_mean_poisson_deviance', 'neg_mean_gamma_deviance', 'v_measure_score', 'f1_samples', 'explained_variance', 'mutual_info_score', 'neg_log_loss', 'recall_micro', 'jaccard_micro', 'neg_negative_likelihood_ratio', 'rand_score', 'roc_auc_ovo', 'jaccard', 'jaccard_macro', 'accuracy', 'precision_weighted', 'f1_weighted', 'balanced_accuracy', 'f1_macro', 'neg_mean_squared_log_error', 'precision_samples', 'd2_brier_score', 'd2_absolute_error_score', 'normalized_mutual_info_score', 'precision_micro', 'precision_macro', 'roc_auc_ovr_weighted', 'jaccard_weighted', 'adjusted_rand_score', 'neg_max_error', 'roc_auc_ovr', 'r2', 'neg_mean_squared_error', 'recall_samples', 'jaccard_samples', 'adjusted_mutual_info_score', 'roc_auc_ovo_weighted', 'neg_root_mean_squared_log_error', 'average_precision', 'positive_likelihood_ratio', 'neg_median_a