[I 2026-07-20 12:29:54,911] Trial 182 finished with value: -0.39109449153814246 and parameters: {'error_threshold': 1.0, 'scalers': 'none', 'ratios': 'norm_ratio', 'imputers': 'mean', 'n_estimators': 450, 'learning_rate': 0.011152947442745245, 'max_depth': 12, 'min_child_weight': 3, 'subsample': 0.7, 'colsample_bytree': 0.8, 'colsample_bylevel': 1.0, 'reg_alpha': 93.5475720273357, 'reg_lambda': 0.04052264719775394, 'gamma': 53.64253420192618}. Best is trial 69 with value: -0.3911874830873789.
[I 2026-07-20 12:29:56,411] Trial 183 finished with value: -0.3911032058194946 and parameters: {'error_threshold': 1.0, 'scalers': 'none', 'ratios': 'norm_ratio', 'imputers': 'mean', 'n_estimators': 450, 'learning_rate': 0.027699287357383303, 'max_depth': 12, 'min_child_weight': 3, 'subsample': 0.7, 'colsample_bytree': 0.8, 'colsample_bylevel': 1.0, 'reg_alpha': 99.80527376237633, 'reg_lambda': 1.9073315692470136, 'gamma': 52.85506879962564}. Best is trial 69 with value: -0.3911874830873789.
[I 2026-07-20 12:29:57,961] Trial 184 finished with value: -0.32489533643818774 and parameters: {'error_threshold': 1.0, 'scalers': 'none', 'ratios': 'norm_ratio', 'imputers': 'mean', 'n_estimators': 450, 'learning_rate': 0.013219561409964609, 'max_depth': 12, 'min_child_weight': 3, 'subsample': 0.7, 'colsample_bytree': 0.8, 'colsample_bylevel': 1.0, 'reg_alpha': 89.86657497481698, 'reg_lambda': 0.040070459039594004, 'gamma': 26.885767720926975}. Best is trial 69 with value: -0.3911874830873789.
[I 2026-07-20 12:29:58,237] Trial 185 finished with value: -0.2804703976382417 and parameters: {'error_threshold': 1.0, 'scalers': 'none', 'ratios': 'norm_ratio', 'imputers': 'mean', 'n_estimators': 450, 'learning_rate': 0.04491112446736491, 'max_depth': 12, 'min_child_weight': 3, 'subsample': 0.7, 'colsample_bytree': 0.8, 'colsample_bylevel': 1.0, 'reg_alpha': 93.99694882967371, 'reg_lambda': 1.905029868811454, 'gamma': 12.43255483574765}. Best is trial 69 with value: -0.3911874830873789.
[I 2026-07-20 12:29:58,512] Trial 186 finished with value: -0.3319630582048237 and parameters: {'error_threshold': 1.0, 'scalers': 'none', 'ratios': 'norm_ratio', 'imputers': 'mean', 'n_estimators': 450, 'learning_rate': 0.024938684811805747, 'max_depth': 12, 'min_child_weight': 3, 'subsample': 0.7, 'colsample_bytree': 0.8, 'colsample_bylevel': 1.0, 'reg_alpha': 99.53294747892092, 'reg_lambda': 1.8878866101464742, 'gamma': 25.088726719866365}. Best is trial 69 with value: -0.3911874830873789.
[I 2026-07-20 12:29:59,103] Trial 187 finished with value: -0.3072118108258503 and parameters: {'error_threshold': 1.0, 'scalers': 'none', 'ratios': 'norm_ratio', 'imputers': 'mean', 'n_estimators': 450, 'learning_rate': 0.12267494264153891, 'max_depth': 12, 'min_child_weight': 3, 'subsample': 0.7, 'colsample_bytree': 0.8, 'colsample_bylevel': 1.0, 'reg_alpha': 96.19014838529075, 'reg_lambda': 0.015388743642294485, 'gamma': 24.22322192198505}. Best is trial 69 with value: -0.3911874830873789.
[I 2026-07-20 12:29:59,383] Trial 188 finished with value: -0.3353350572718077 and parameters: {'error_threshold': 1.0, 'scalers': 'none', 'ratios': 'norm_ratio', 'imputers': 'mean', 'n_estimators': 450, 'learning_rate': 0.014298141661860624, 'max_depth': 12, 'min_child_weight': 3, 'subsample': 0.7, 'colsample_bytree': 0.8, 'colsample_bylevel': 1.0, 'reg_alpha': 94.8933269187988, 'reg_lambda': 0.041191698404983275, 'gamma': 27.48745855985721}. Best is trial 69 with value: -0.3911874830873789.
[I 2026-07-20 12:29:59,970] Trial 189 finished with value: -0.2929950064730153 and parameters: {'error_threshold': 1.0, 'scalers': 'none', 'ratios': 'norm_ratio', 'imputers': 'mean', 'n_estimators': 450, 'learning_rate': 0.013241065120720796, 'max_depth': 12, 'min_child_weight': 3, 'subsample': 0.7, 'colsample_bytree': 0.8, 'colsample_bylevel': 1.0, 'reg_alpha': 97.17902590019932, 'reg_lambda': 0.04838782320156417, 'gamma': 14.27912880576837}. Best is trial 69 with value: -0.3911874830873789.
[I 2026-07-20 12:30:02,325] Trial 190 finished with value: -0.32272154682755183 and parameters: {'error_threshold': 1.0, 'scalers': 'none', 'ratios': 'norm_ratio', 'imputers': 'mean', 'n_estimators': 450, 'learning_rate': 0.012635238180433996, 'max_depth': 12, 'min_child_weight': 3, 'subsample': 0.7, 'colsample_bytree': 0.8, 'colsample_bylevel': 1.0, 'reg_alpha': 90.69555110921252, 'reg_lambda': 0.04733723013145059, 'gamma': 25.762945067393737}. Best is trial 69 with value: -0.3911874830873789.
[I 2026-07-20 12:30:04,149] Trial 191 finished with value: -0.28574007972933624 and parameters: {'error_threshold': 1.0, 'scalers': 'none', 'ratios': 'norm_ratio', 'imputers': 'mean', 'n_estimators': 450, 'learning_rate': 0.01316337098325048, 'max_depth': 12, 'min_child_weight': 3, 'subsample': 0.7, 'colsample_bytree': 0.8, 'colsample_bylevel': 1.0, 'reg_alpha': 97.2263150479392, 'reg_lambda': 0.044552365972003606, 'gamma': 12.123678960867846}. Best is trial 69 with value: -0.3911874830873789.
[I 2026-07-20 12:30:06,129] Trial 192 finished with value: -0.22775795432361967 and parameters: {'error_threshold': 1.0, 'scalers': 'none', 'ratios': 'norm_ratio', 'imputers': 'mean', 'n_estimators': 450, 'learning_rate': 0.010952712426266581, 'max_depth': 12, 'min_child_weight': 3, 'subsample': 0.7, 'colsample_bytree': 0.8, 'colsample_bylevel': 1.0, 'reg_alpha': 28.419099444269413, 'reg_lambda': 0.017182373263121532, 'gamma': 11.919946665433779}. Best is trial 69 with value: -0.3911874830873789.
[I 2026-07-20 12:30:06,408] Trial 193 finished with value: -0.2536448520192584 and parameters: {'error_threshold': 1.0, 'scalers': 'none', 'ratios': 'norm_ratio', 'imputers': 'mean', 'n_estimators': 450, 'learning_rate': 0.00875172016127973, 'max_depth': 12, 'min_child_weight': 3, 'subsample': 0.7, 'colsample_bytree': 0.8, 'colsample_bylevel': 1.0, 'reg_alpha': 30.0169472060355, 'reg_lambda': 0.014375463938693616, 'gamma': 25.66109975048488}. Best is trial 69 with value: -0.3911874830873789.
[I 2026-07-20 12:30:06,689] Trial 194 finished with value: -0.26216821965150555 and parameters: {'error_threshold': 1.0, 'scalers': 'none', 'ratios': 'norm_ratio', 'imputers': 'mean', 'n_estimators': 450, 'learning_rate': 0.010905159497210454, 'max_depth': 12, 'min_child_weight': 3, 'subsample': 0.7, 'colsample_bytree': 0.8, 'colsample_bylevel': 1.0, 'reg_alpha': 32.647763311451506, 'reg_lambda': 0.020351108563238823, 'gamma': 28.875205997260522}. Best is trial 69 with value: -0.3911874830873789.
[I 2026-07-20 12:30:07,525] Trial 195 finished with value: -0.2637854872291238 and parameters: {'error_threshold': 1.25, 'scalers': 'none', 'ratios': 'norm_ratio', 'imputers': 'mean', 'n_estimators': 700, 'learning_rate': 0.008651075495547294, 'max_depth': 12, 'min_child_weight': 3, 'subsample': 0.7, 'colsample_bytree': 0.8, 'colsample_bylevel': 1.0, 'reg_alpha': 30.397845446331033, 'reg_lambda': 0.04275830821758843, 'gamma': 31.324622726962605}. Best is trial 69 with value: -0.3911874830873789.
[I 2026-07-20 12:30:07,918] Trial 196 finished with value: -0.22440068063733012 and parameters: {'error_threshold': 1.25, 'scalers': 'none', 'ratios': 'norm_ratio', 'imputers': 'mean', 'n_estimators': 650, 'learning_rate': 0.2350972245250058, 'max_depth': 12, 'min_child_weight': 3, 'subsample': 0.7, 'colsample_bytree': 0.8, 'colsample_bylevel': 1.0, 'reg_alpha': 28.98917180581387, 'reg_lambda': 0.018807591952747445, 'gamma': 13.003460995226106}. Best is trial 69 with value: -0.3911874830873789.
[I 2026-07-20 12:30:08,646] Trial 197 finished with value: -0.27719393572359174 and parameters: {'error_threshold': 1.25, 'scalers': 'none', 'ratios': 'norm_ratio', 'imputers': 'mean', 'n_estimators': 500, 'learning_rate': 0.009295351369765576, 'max_depth': 12, 'min_child_weight': 3, 'subsample': 0.7, 'colsample_bytree': 0.8, 'colsample_bylevel': 1.0, 'reg_alpha': 27.26155048371637, 'reg_lambda': 0.019732516792971, 'gamma': 39.62537146289663}. Best is trial 69 with value: -0.3911874830873789.
[I 2026-07-20 12:30:11,467] Trial 198 finished with value: -0.28466575713904996 and parameters: {'error_threshold': 1.25, 'scalers': 'none', 'ratios': 'norm_ratio', 'imputers': 'mean', 'n_estimators': 500, 'learning_rate': 0.009765322486090388, 'max_depth': 12, 'min_child_weight': 3, 'subsample': 0.7, 'colsample_bytree': 0.8, 'colsample_bylevel': 1.0, 'reg_alpha': 28.78603277487316, 'reg_lambda': 0.023850196789904892, 'gamma': 42.98387806519383}. Best is trial 69 with value: -0.3911874830873789.
[I 2026-07-20 12:30:13,612] Trial 199 finished with value: -0.2784709389269346 and parameters: {'error_threshold': 1.25, 'scalers': 'none', 'ratios': 'norm_ratio', 'imputers': 'mean', 'n_estimators': 600, 'learning_rate': 0.008851633829578093, 'max_depth': 12, 'min_child_weight': 3, 'subsample': 0.7, 'colsample_bytree': 0.8, 'colsample_bylevel': 1.0, 'reg_alpha': 29.783550570103014, 'reg_lambda': 0.02393160982644587, 'gamma': 38.73915402061975}. Best is trial 69 with value: -0.3911874830873789.
[I 2026-07-20 12:30:15,617] Trial 200 finished with value: -0.2771686177956954 and parameters: {'error_threshold': 1.25, 'scalers': 'none', 'ratios': 'norm_ratio', 'imputers': 'mean', 'n_estimators': 700, 'learning_rate': 0.0905148435022682, 'max_depth': 12, 'min_child_weight': 3, 'subsample': 0.7, 'colsample_bytree': 0.8, 'colsample_bylevel': 1.0, 'reg_alpha': 31.728263054085485, 'reg_lambda': 0.10662534023978061, 'gamma': 42.21417302562049}. Best is trial 69 with value: -0.3911874830873789.
[I 2026-07-20 12:30:16,071] Trial 201 finished with value: -0.30691894518064095 and parameters: {'error_threshold': 1.25, 'scalers': 'none', 'ratios': 'norm_ratio', 'imputers': 'mean', 'n_estimators': 700, 'learning_rate': 0.02056683408580286, 'max_depth': 12, 'min_child_weight': 3, 'subsample': 0.7, 'colsample_bytree': 0.8, 'colsample_bylevel': 1.0, 'reg_alpha': 53.43197464263906, 'reg_lambda': 2.880945323251186, 'gamma': 40.83917610099312}. Best is trial 69 with value: -0.3911874830873789.
[I 2026-07-20 12:30:16,490] Trial 202 finished with value: -0.3157392650334181 and parameters: {'error_threshold': 1.25, 'scalers': 'none', 'ratios': 'norm_ratio', 'imputers': 'mean', 'n_estimators': 700, 'learning_rate': 0.4932041289523613, 'max_depth': 12, 'min_child_weight': 2, 'subsample': 0.7, 'colsample_bytree': 0.9, 'colsample_bylevel': 1.0, 'reg_alpha': 53.92864668161914, 'reg_lambda': 3.0015047721630044, 'gamma': 54.321423589152616}. Best is trial 69 with value: -0.3911874830873789.
[I 2026-07-20 12:30:17,035] Trial 203 finished with value: -0.3128631255763508 and parameters: {'error_threshold': 1.25, 'scalers': 'none', 'ratios': 'norm_ratio', 'imputers': 'mean', 'n_estimators': 600, 'learning_rate': 0.020248645980685313, 'max_depth': 12, 'min_child_weight': 4, 'subsample': 0.7, 'colsample_bytree': 0.8, 'colsample_bylevel': 1.0, 'reg_alpha': 50.71723573229975, 'reg_lambda': 0.6144912387784098, 'gamma': 45.217229820857966}. Best is trial 69 with value: -0.3911874830873789.
[I 2026-07-20 12:30:17,403] Trial 204 finished with value: -0.321862344923946 and parameters: {'error_threshold': 1.25, 'scalers': 'none', 'ratios': 'norm_ratio', 'imputers': 'none', 'n_estimators': 600, 'learning_rate': 0.020562831526489286, 'max_depth': 12, 'min_child_weight': 2, 'subsample': 0.7, 'colsample_bytree': 0.9, 'colsample_bylevel': 1.0, 'reg_alpha': 52.44300354058827, 'reg_lambda': 2.9694143669015896, 'gamma': 48.11728482556931}. Best is trial 69 with value: -0.3911874830873789.
[I 2026-07-20 12:30:18,204] Trial 205 finished with value: -0.3326049794530116 and parameters: {'error_threshold': 0.75, 'scalers': 'none', 'ratios': 'norm_ratio', 'imputers': 'mean', 'n_estimators': 600, 'learning_rate': 0.020232446448410154, 'max_depth': 12, 'min_child_weight': 2, 'subsample': 0.7, 'colsample_bytree': 0.8, 'colsample_bylevel': 1.0, 'reg_alpha': 53.66190261116802, 'reg_lambda': 3.1200467625155244, 'gamma': 51.02430968903431}. Best is trial 69 with value: -0.3911874830873789.
[I 2026-07-20 12:30:19,945] Trial 206 finished with value: -0.3505518322602132 and parameters: {'error_threshold': 0.75, 'scalers': 'none', 'ratios': 'norm_ratio', 'imputers': 'none', 'n_estimators': 600, 'learning_rate': 0.019649630204523368, 'max_depth': 12, 'min_child_weight': 2, 'subsample': 0.7, 'colsample_bytree': 1.0, 'colsample_bylevel': 1.0, 'reg_alpha': 53.90234950627339, 'reg_lambda': 0.09360651245101455, 'gamma': 57.394608260335744}. Best is trial 69 with value: -0.3911874830873789.
[I 2026-07-20 12:30:21,124] Trial 207 finished with value: -0.34034342973023884 and parameters: {'error_threshold': 0.75, 'scalers': 'none', 'ratios': 'norm_ratio', 'imputers': 'mean', 'n_estimators': 350, 'learning_rate': 0.08946343313942866, 'max_depth': 12, 'min_child_weight': 2, 'subsample': 0.7, 'colsample_bytree': 0.8, 'colsample_bylevel': 1.0, 'reg_alpha': 55.52478061772938, 'reg_lambda': 0.09743175628346978, 'gamma': 56.67746585950439}. Best is trial 69 with value: -0.3911874830873789.
[I 2026-07-20 12:30:22,298] Trial 208 finished with value: -0.3561107769059329 and parameters: {'error_threshold': 0.75, 'scalers': 'none', 'ratios': 'norm_ratio', 'imputers': 'mean', 'n_estimators': 350, 'learning_rate': 0.02061936834068938, 'max_depth': 12, 'min_child_weight': 4, 'subsample': 0.7, 'colsample_bytree': 0.8, 'colsample_bylevel': 1.0, 'reg_alpha': 54.29252595993811, 'reg_lambda': 3.1219391666046477, 'gamma': 57.5110089795538}. Best is trial 69 with value: -0.3911874830873789.
[I 2026-07-20 12:30:22,558] Trial 209 finished with value: -0.3153125837488861 and parameters: {'error_threshold': 0.75, 'scalers': 'none', 'ratios': 'norm_ratio', 'imputers': 'none', 'n_estimators': 350, 'learning_rate': 0.49766499165713934, 'max_depth': 12, 'min_child_weight': 4, 'subsample': 0.7, 'colsample_bytree': 0.9, 'colsample_bylevel': 1.0, 'reg_alpha': 50.49261597247211, 'reg_lambda': 1.3094579639120856, 'gamma': 57.59820458710643}. Best is trial 69 with value: -0.3911874830873789.
[I 2026-07-20 12:30:22,775] Trial 210 finished with value: -0.33587778901386 and parameters: {'error_threshold': 0.75, 'scalers': 'none', 'ratios': 'norm_ratio', 'imputers': 'mean', 'n_estimators': 350, 'learning_rate': 0.14586207158088332, 'max_depth': 12, 'min_child_weight': 4, 'subsample': 0.7, 'colsample_bytree': 0.8, 'colsample_bylevel': 1.0, 'reg_alpha': 55.7794927010653, 'reg_lambda': 0.6046237972688889, 'gamma': 58.75402863482463}. Best is trial 69 with value: -0.3911874830873789.
[I 2026-07-20 12:30:23,248] Trial 211 finished with value: -0.3806303377754067 and parameters: {'error_threshold': 0.75, 'scalers': 'none', 'ratios': 'norm_ratio', 'imputers': 'none', 'n_estimators': 350, 'learning_rate': 0.027467932128353547, 'max_depth': 12, 'min_child_weight': 4, 'subsample': 0.7, 'colsample_bytree': 0.8, 'colsample_bylevel': 1.0, 'reg_alpha': 60.06733557403396, 'reg_lambda': 1.475113432658793, 'gamma': 61.92220160768654}. Best is trial 69 with value: -0.3911874830873789.
[I 2026-07-20 12:30:23,474] Trial 212 finished with value: -0.381463949195318 and parameters: {'error_threshold': 0.75, 'scalers': 'none', 'ratios': 'norm_ratio', 'imputers': 'mean', 'n_estimators': 350, 'learning_rate': 0.025622920204397777, 'max_depth': 12, 'min_child_weight': 4, 'subsample': 0.7, 'colsample_bytree': 1.0, 'colsample_bylevel': 1.0, 'reg_alpha': 62.188325287555834, 'reg_lambda': 1.2993777928655934, 'gamma': 61.91115433677565}. Best is trial 69 with value: -0.3911874830873789.
[I 2026-07-20 12:30:23,964] Trial 213 finished with value: -0.36324726387523104 and parameters: {'error_threshold': 0.75, 'scalers': 'none', 'ratios': 'norm_ratio', 'imputers': 'mean', 'n_estimators': 350, 'learning_rate': 0.12537529999024072, 'max_depth': 12, 'min_child_weight': 4, 'subsample': 0.7, 'colsample_bytree': 0.8, 'colsample_bylevel': 1.0, 'reg_alpha': 63.5129377318818, 'reg_lambda': 1.5007873840080326, 'gamma': 60.8867332545697}. Best is trial 69 with value: -0.3911874830873789.
[I 2026-07-20 12:30:24,989] Trial 214 finished with value: -0.35210823780331485 and parameters: {'error_threshold': 0.75, 'scalers': 'none', 'ratios': 'norm_ratio', 'imputers': 'mean', 'n_estimators': 350, 'learning_rate': 0.15922993321760606, 'max_depth': 12, 'min_child_weight': 4, 'subsample': 0.7, 'colsample_bytree': 0.8, 'colsample_bylevel': 1.0, 'reg_alpha': 61.78071425272604, 'reg_lambda': 7.230401603944828, 'gamma': 60.28945473409127}. Best is trial 69 with value: -0.3911874830873789.
[I 2026-07-20 12:30:25,752] Trial 215 finished with value: -0.3910888714574477 and parameters: {'error_threshold': 0.75, 'scalers': 'none', 'ratios': 'norm_ratio', 'imputers': 'mean', 'n_estimators': 400, 'learning_rate': 0.025680760647131776, 'max_depth': 11, 'min_child_weight': 4, 'subsample': 0.7, 'colsample_bytree': 0.8, 'colsample_bylevel': 1.0, 'reg_alpha': 70.20628160862637, 'reg_lambda': 1.4854903518779623, 'gamma': 65.30178103560402}. Best is trial 69 with value: -0.3911874830873789.
[I 2026-07-20 12:30:29,353] Trial 216 finished with value: -0.36768367013437225 and parameters: {'error_threshold': 0.75, 'scalers': 'none', 'ratios': 'norm_ratio', 'imputers': 'mean', 'n_estimators': 400, 'learning_rate': 0.13523413895780748, 'max_depth': 3, 'min_child_weight': 4, 'subsample': 0.7, 'colsample_bytree': 0.8, 'colsample_bylevel': 1.0, 'reg_alpha': 65.96140069140816, 'reg_lambda': 1.679027930648691, 'gamma': 61.251709405233825}. Best is trial 69 with value: -0.3911874830873789.
[I 2026-07-20 12:30:29,598] Trial 217 finished with value: -0.3892950080600484 and parameters: {'error_threshold': 1.0, 'scalers': 'none', 'ratios': 'norm_ratio', 'imputers': 'mean', 'n_estimators': 400, 'learning_rate': 0.12292307955783432, 'max_depth': 11, 'min_child_weight': 4, 'subsample': 0.7, 'colsample_bytree': 0.8, 'colsample_bylevel': 1.0, 'reg_alpha': 69.0087829885156, 'reg_lambda': 0.28755074585748075, 'gamma': 64.37356446883642}. Best is trial 69 with value: -0.3911874830873789.
[I 2026-07-20 12:30:46,997] Trial 218 finished with value: -0.39108549373753326 and parameters: {'error_threshold': 1.0, 'scalers': 'none', 'ratios': 'norm_ratio', 'imputers': 'mean', 'n_estimators': 2950, 'learning_rate': 0.02760166365528357, 'max_depth': 12, 'min_child_weight': 4, 'subsample': 0.7, 'colsample_bytree': 0.8, 'colsample_bylevel': 1.0, 'reg_alpha': 92.70427889711554, 'reg_lambda': 0.33889728918032447, 'gamma': 68.40028855377822}. Best is trial 69 with value: -0.3911874830873789.
[I 2026-07-20 12:30:47,287] Trial 223 finished with value: -0.3621524323662086 and parameters: {'error_threshold': 1.0, 'scalers': 'none', 'ratios': 'norm_ratio', 'imputers': 'mean', 'n_estimators': 400, 'learning_rate': 0.04232430867693058, 'max_depth': 11, 'min_child_weight': 4, 'subsample': 0.7, 'colsample_bytree': 0.8, 'colsample_bylevel': 1.0, 'reg_alpha': 95.97829868741407, 'reg_lambda': 2.4519184044831674, 'gamma': 35.25451321467015}. Best is trial 69 with value: -0.3911874830873789.
[I 2026-07-20 12:30:48,862] Trial 219 finished with value: -0.3910910230812749 and parameters: {'error_threshold': 1.0, 'scalers': 'none', 'ratios': 'norm_ratio', 'imputers': 'mean', 'n_estimators': 2750, 'learning_rate': 0.03186959114602934, 'max_depth': 12, 'min_child_weight': 4, 'subsample': 0.7, 'colsample_bytree': 0.8, 'colsample_bylevel': 1.0, 'reg_alpha': 99.72541705123871, 'reg_lambda': 1.9881888195711517, 'gamma': 67.57855364059657}. Best is trial 69 with value: -0.3911874830873789.
[I 2026-07-20 12:30:50,591] Trial 220 finished with value: -0.39108461446564674 and parameters: {'error_threshold': 1.0, 'scalers': 'none', 'ratios': 'norm_ratio', 'imputers': 'mean', 'n_estimators': 2950, 'learning_rate': 0.03191663725273941, 'max_depth': 11, 'min_child_weight': 4, 'subsample': 0.7, 'colsample_bytree': 0.8, 'colsample_bylevel': 1.0, 'reg_alpha': 99.98302706406392, 'reg_lambda': 0.30877092984303306, 'gamma': 66.76751252651343}. Best is trial 69 with value: -0.3911874830873789.
[I 2026-07-20 12:30:52,239] Trial 221 finished with value: -0.35741387542997743 and parameters: {'error_threshold': 1.0, 'scalers': 'none', 'ratios': 'norm_ratio', 'imputers': 'mean', 'n_estimators': 2800, 'learning_rate': 0.03345106687559265, 'max_depth': 3, 'min_child_weight': 4, 'subsample': 0.7, 'colsample_bytree': 0.8, 'colsample_bylevel': 1.0, 'reg_alpha': 99.81027343896467, 'reg_lambda': 1.129779249719539, 'gamma': 33.22313781143184}. Best is trial 69 with value: -0.3911874830873789.
[I 2026-07-20 12:30:52,588] Trial 224 finished with value: -0.34526742957410667 and parameters: {'error_threshold': 1.0, 'scalers': 'none', 'ratios': 'norm_ratio', 'imputers': 'mean', 'n_estimators': 500, 'learning_rate': 0.03981146473421778, 'max_depth': 11, 'min_child_weight': 4, 'subsample': 0.7, 'colsample_bytree': 0.8, 'colsample_bylevel': 1.0, 'reg_alpha': 94.78104581102157, 'reg_lambda': 0.3355884272624134, 'gamma': 31.779186051843237}. Best is trial 69 with value: -0.3911874830873789.
[I 2026-07-20 12:30:52,915] Trial 225 finished with value: -0.39109382135428206 and parameters: {'error_threshold': 1.0, 'scalers': 'none', 'ratios': 'norm_ratio', 'imputers': 'mean', 'n_estimators': 550, 'learning_rate': 0.04142879324365358, 'max_depth': 11, 'min_child_weight': 4, 'subsample': 0.7, 'colsample_bytree': 0.8, 'colsample_bylevel': 1.0, 'reg_alpha': 95.37189389603077, 'reg_lambda': 0.010482134362695582, 'gamma': 97.97776881162945}. Best is trial 69 with value: -0.3911874830873789.
[I 2026-07-20 12:30:54,581] Trial 222 finished with value: -0.39109187302911447 and parameters: {'error_threshold': 1.0, 'scalers': 'none', 'ratios': 'norm_ratio', 'imputers': 'mean', 'n_estimators': 2900, 'learning_rate': 0.03095882368914903, 'max_depth': 12, 'min_child_weight': 4, 'subsample': 0.7, 'colsample_bytree': 0.8, 'colsample_bylevel': 1.0, 'reg_alpha': 94.29388710020174, 'reg_lambda': 0.3030182895144575, 'gamma': 99.05654265588518}. Best is trial 69 with value: -0.3911874830873789.
