[I 2026-07-20 15:00:03,915] Trial 192 finished with value: -1.6558122287156418 and parameters: {'error_threshold': 3.1, 'scalers': 'robust', 'ratios': 'log_ratio', 'imputers': 'none', 'n_estimators': 100, 'learning_rate': 0.00010159439901098426, 'max_depth': 6, 'min_child_weight': 1, 'subsample': 0.7, 'colsample_bytree': 0.5, 'colsample_bylevel': 0.8, 'reg_alpha': 0.014729631712916197, 'reg_lambda': 61.74821760246048, 'gamma': 51.14056825121504}. Best is trial 183 with value: -1.6583770069254369.
/bsuhome/alexanderemert/Research/Star-Formation-Research-Project-2026/pipeline/scripts/optuna/final_preds_and_models/optuna_search_mult_quant_reg.py:75: UserWarning: The distribution is specified by [0.1, 5] and step=0.25, but the range is not divisible by `step`. It will be replaced with [0.1, 4.85].
  error_threshold = trial.suggest_float("error_threshold", 0.1, 5, step=0.25)
[I 2026-07-20 15:00:04,176] Trial 193 finished with value: -1.6558374685243038 and parameters: {'error_threshold': 3.1, 'scalers': 'robust', 'ratios': 'log_ratio', 'imputers': 'none', 'n_estimators': 100, 'learning_rate': 0.00010035991392727813, 'max_depth': 6, 'min_child_weight': 1, 'subsample': 0.7, 'colsample_bytree': 0.5, 'colsample_bylevel': 0.8, 'reg_alpha': 0.029754318789792133, 'reg_lambda': 17.267028964045306, 'gamma': 51.99176097333836}. Best is trial 183 with value: -1.6583770069254369.
/bsuhome/alexanderemert/Research/Star-Formation-Research-Project-2026/pipeline/scripts/optuna/final_preds_and_models/optuna_search_mult_quant_reg.py:75: UserWarning: The distribution is specified by [0.1, 5] and step=0.25, but the range is not divisible by `step`. It will be replaced with [0.1, 4.85].
  error_threshold = trial.suggest_float("error_threshold", 0.1, 5, step=0.25)
[I 2026-07-20 15:00:04,426] Trial 195 finished with value: -1.6558327753421016 and parameters: {'error_threshold': 3.1, 'scalers': 'standard', 'ratios': 'log_ratio', 'imputers': 'none', 'n_estimators': 100, 'learning_rate': 0.0001009608912313184, 'max_depth': 6, 'min_child_weight': 6, 'subsample': 0.7, 'colsample_bytree': 0.5, 'colsample_bylevel': 0.8, 'reg_alpha': 0.027378650349193952, 'reg_lambda': 54.92553885276065, 'gamma': 52.65056390359266}. Best is trial 183 with value: -1.6583770069254369.
/bsuhome/alexanderemert/Research/Star-Formation-Research-Project-2026/pipeline/scripts/optuna/final_preds_and_models/optuna_search_mult_quant_reg.py:75: UserWarning: The distribution is specified by [0.1, 5] and step=0.25, but the range is not divisible by `step`. It will be replaced with [0.1, 4.85].
  error_threshold = trial.suggest_float("error_threshold", 0.1, 5, step=0.25)
[I 2026-07-20 15:00:04,583] Trial 196 finished with value: -1.6558741908035797 and parameters: {'error_threshold': 3.1, 'scalers': 'standard', 'ratios': 'log_ratio', 'imputers': 'none', 'n_estimators': 100, 'learning_rate': 0.00010003827900678817, 'max_depth': 6, 'min_child_weight': 7, 'subsample': 0.7, 'colsample_bytree': 0.5, 'colsample_bylevel': 0.8, 'reg_alpha': 0.02285932864504291, 'reg_lambda': 22.68969729692386, 'gamma': 68.83464978571601}. Best is trial 183 with value: -1.6583770069254369.
/bsuhome/alexanderemert/Research/Star-Formation-Research-Project-2026/pipeline/scripts/optuna/final_preds_and_models/optuna_search_mult_quant_reg.py:75: UserWarning: The distribution is specified by [0.1, 5] and step=0.25, but the range is not divisible by `step`. It will be replaced with [0.1, 4.85].
  error_threshold = trial.suggest_float("error_threshold", 0.1, 5, step=0.25)
[I 2026-07-20 15:00:04,674] Trial 197 finished with value: -1.6541683655481911 and parameters: {'error_threshold': 3.1, 'scalers': 'standard', 'ratios': 'log_ratio', 'imputers': 'none', 'n_estimators': 100, 'learning_rate': 0.00016943122964058882, 'max_depth': 6, 'min_child_weight': 6, 'subsample': 0.7, 'colsample_bytree': 0.5, 'colsample_bylevel': 0.8, 'reg_alpha': 0.026420703064861502, 'reg_lambda': 0.018272351619799343, 'gamma': 74.52757875494041}. Best is trial 183 with value: -1.6583770069254369.
/bsuhome/alexanderemert/Research/Star-Formation-Research-Project-2026/pipeline/scripts/optuna/final_preds_and_models/optuna_search_mult_quant_reg.py:75: UserWarning: The distribution is specified by [0.1, 5] and step=0.25, but the range is not divisible by `step`. It will be replaced with [0.1, 4.85].
  error_threshold = trial.suggest_float("error_threshold", 0.1, 5, step=0.25)
[I 2026-07-20 15:00:06,400] Trial 198 finished with value: -1.655467800748226 and parameters: {'error_threshold': 3.1, 'scalers': 'robust', 'ratios': 'log_ratio', 'imputers': 'none', 'n_estimators': 100, 'learning_rate': 0.00011638293054345304, 'max_depth': 6, 'min_child_weight': 6, 'subsample': 0.7, 'colsample_bytree': 0.5, 'colsample_bylevel': 0.8, 'reg_alpha': 0.013826751393593854, 'reg_lambda': 23.61175916905822, 'gamma': 69.38168101479206}. Best is trial 183 with value: -1.6583770069254369.
/bsuhome/alexanderemert/Research/Star-Formation-Research-Project-2026/pipeline/scripts/optuna/final_preds_and_models/optuna_search_mult_quant_reg.py:75: UserWarning: The distribution is specified by [0.1, 5] and step=0.25, but the range is not divisible by `step`. It will be replaced with [0.1, 4.85].
  error_threshold = trial.suggest_float("error_threshold", 0.1, 5, step=0.25)
[I 2026-07-20 15:00:07,157] Trial 200 finished with value: -1.6557824723551289 and parameters: {'error_threshold': 3.1, 'scalers': 'robust', 'ratios': 'log_ratio', 'imputers': 'none', 'n_estimators': 100, 'learning_rate': 0.00010365943011638575, 'max_depth': 6, 'min_child_weight': 6, 'subsample': 0.7, 'colsample_bytree': 0.5, 'colsample_bylevel': 0.8, 'reg_alpha': 0.02673972551243133, 'reg_lambda': 24.152795972616, 'gamma': 74.99660182567614}. Best is trial 183 with value: -1.6583770069254369.
/bsuhome/alexanderemert/Research/Star-Formation-Research-Project-2026/pipeline/scripts/optuna/final_preds_and_models/optuna_search_mult_quant_reg.py:75: UserWarning: The distribution is specified by [0.1, 5] and step=0.25, but the range is not divisible by `step`. It will be replaced with [0.1, 4.85].
  error_threshold = trial.suggest_float("error_threshold", 0.1, 5, step=0.25)
[I 2026-07-20 15:00:07,325] Trial 201 finished with value: -1.6543668156878424 and parameters: {'error_threshold': 3.1, 'scalers': 'standard', 'ratios': 'log_ratio', 'imputers': 'none', 'n_estimators': 100, 'learning_rate': 0.0001616197593029827, 'max_depth': 6, 'min_child_weight': 1, 'subsample': 0.7, 'colsample_bytree': 0.5, 'colsample_bylevel': 0.8, 'reg_alpha': 0.020443719334073168, 'reg_lambda': 27.667374729550566, 'gamma': 76.74367614227998}. Best is trial 183 with value: -1.6583770069254369.
/bsuhome/alexanderemert/Research/Star-Formation-Research-Project-2026/pipeline/scripts/optuna/final_preds_and_models/optuna_search_mult_quant_reg.py:75: UserWarning: The distribution is specified by [0.1, 5] and step=0.25, but the range is not divisible by `step`. It will be replaced with [0.1, 4.85].
  error_threshold = trial.suggest_float("error_threshold", 0.1, 5, step=0.25)
[I 2026-07-20 15:00:07,909] Trial 194 finished with value: -1.637440120354903 and parameters: {'error_threshold': 3.1, 'scalers': 'robust', 'ratios': 'log_ratio', 'imputers': 'none', 'n_estimators': 850, 'learning_rate': 0.00010030102451123191, 'max_depth': 6, 'min_child_weight': 1, 'subsample': 0.7, 'colsample_bytree': 0.5, 'colsample_bylevel': 0.8, 'reg_alpha': 0.03222713472243321, 'reg_lambda': 23.31303574656674, 'gamma': 51.966608120236785}. Best is trial 183 with value: -1.6583770069254369.
/bsuhome/alexanderemert/Research/Star-Formation-Research-Project-2026/pipeline/scripts/optuna/final_preds_and_models/optuna_search_mult_quant_reg.py:75: UserWarning: The distribution is specified by [0.1, 5] and step=0.25, but the range is not divisible by `step`. It will be replaced with [0.1, 4.85].
  error_threshold = trial.suggest_float("error_threshold", 0.1, 5, step=0.25)
[I 2026-07-20 15:00:08,137] Trial 202 finished with value: -1.6565943425282914 and parameters: {'error_threshold': 1.85, 'scalers': 'standard', 'ratios': 'log_ratio', 'imputers': 'none', 'n_estimators': 100, 'learning_rate': 0.00010019226145618001, 'max_depth': 6, 'min_child_weight': 6, 'subsample': 0.7, 'colsample_bytree': 0.5, 'colsample_bylevel': 0.8, 'reg_alpha': 0.028767570952967066, 'reg_lambda': 88.34498071235349, 'gamma': 83.6601925152462}. Best is trial 183 with value: -1.6583770069254369.
/bsuhome/alexanderemert/Research/Star-Formation-Research-Project-2026/pipeline/scripts/optuna/final_preds_and_models/optuna_search_mult_quant_reg.py:75: UserWarning: The distribution is specified by [0.1, 5] and step=0.25, but the range is not divisible by `step`. It will be replaced with [0.1, 4.85].
  error_threshold = trial.suggest_float("error_threshold", 0.1, 5, step=0.25)
[I 2026-07-20 15:00:08,312] Trial 203 finished with value: -1.6561744728557912 and parameters: {'error_threshold': 3.1, 'scalers': 'standard', 'ratios': 'log_ratio', 'imputers': 'none', 'n_estimators': 100, 'learning_rate': 0.0001636745347282277, 'max_depth': 6, 'min_child_weight': 6, 'subsample': 0.7, 'colsample_bytree': 0.5, 'colsample_bylevel': 0.8, 'reg_alpha': 0.02677843134223121, 'reg_lambda': 70.56938635297362, 'gamma': 91.36584506238565}. Best is trial 183 with value: -1.6583770069254369.
/bsuhome/alexanderemert/Research/Star-Formation-Research-Project-2026/pipeline/scripts/optuna/final_preds_and_models/optuna_search_mult_quant_reg.py:75: UserWarning: The distribution is specified by [0.1, 5] and step=0.25, but the range is not divisible by `step`. It will be replaced with [0.1, 4.85].
  error_threshold = trial.suggest_float("error_threshold", 0.1, 5, step=0.25)
[I 2026-07-20 15:00:08,820] Trial 199 finished with value: -1.6385351080531294 and parameters: {'error_threshold': 3.1, 'scalers': 'robust', 'ratios': 'log_ratio', 'imputers': 'none', 'n_estimators': 800, 'learning_rate': 0.00010052114496264297, 'max_depth': 6, 'min_child_weight': 7, 'subsample': 0.7, 'colsample_bytree': 0.5, 'colsample_bylevel': 0.8, 'reg_alpha': 0.027094121527268537, 'reg_lambda': 18.824060931211, 'gamma': 50.64904797332293}. Best is trial 183 with value: -1.6583770069254369.
/bsuhome/alexanderemert/Research/Star-Formation-Research-Project-2026/pipeline/scripts/optuna/final_preds_and_models/optuna_search_mult_quant_reg.py:75: UserWarning: The distribution is specified by [0.1, 5] and step=0.25, but the range is not divisible by `step`. It will be replaced with [0.1, 4.85].
  error_threshold = trial.suggest_float("error_threshold", 0.1, 5, step=0.25)
[I 2026-07-20 15:00:08,928] Trial 204 finished with value: -1.6552076967232578 and parameters: {'error_threshold': 3.1, 'scalers': 'standard', 'ratios': 'log_ratio', 'imputers': 'none', 'n_estimators': 100, 'learning_rate': 0.00017226974625784947, 'max_depth': 6, 'min_child_weight': 6, 'subsample': 0.7, 'colsample_bytree': 0.5, 'colsample_bylevel': 0.8, 'reg_alpha': 0.023258654579478885, 'reg_lambda': 62.451636219827684, 'gamma': 84.49275610651253}. Best is trial 183 with value: -1.6583770069254369.
/bsuhome/alexanderemert/Research/Star-Formation-Research-Project-2026/pipeline/scripts/optuna/final_preds_and_models/optuna_search_mult_quant_reg.py:75: UserWarning: The distribution is specified by [0.1, 5] and step=0.25, but the range is not divisible by `step`. It will be replaced with [0.1, 4.85].
  error_threshold = trial.suggest_float("error_threshold", 0.1, 5, step=0.25)
[I 2026-07-20 15:00:09,761] Trial 205 finished with value: -1.6562445825331997 and parameters: {'error_threshold': 3.1, 'scalers': 'robust', 'ratios': 'log_ratio', 'imputers': 'none', 'n_estimators': 100, 'learning_rate': 0.00015408699639809497, 'max_depth': 6, 'min_child_weight': 6, 'subsample': 0.7, 'colsample_bytree': 0.5, 'colsample_bylevel': 0.8, 'reg_alpha': 0.02443804171684925, 'reg_lambda': 44.24658937521969, 'gamma': 92.29681522261808}. Best is trial 183 with value: -1.6583770069254369.
/bsuhome/alexanderemert/Research/Star-Formation-Research-Project-2026/pipeline/scripts/optuna/final_preds_and_models/optuna_search_mult_quant_reg.py:75: UserWarning: The distribution is specified by [0.1, 5] and step=0.25, but the range is not divisible by `step`. It will be replaced with [0.1, 4.85].
  error_threshold = trial.suggest_float("error_threshold", 0.1, 5, step=0.25)
[I 2026-07-20 15:00:09,925] Trial 206 finished with value: -1.655665555027688 and parameters: {'error_threshold': 3.1, 'scalers': 'standard', 'ratios': 'log_ratio', 'imputers': 'none', 'n_estimators': 100, 'learning_rate': 0.00014860445300753067, 'max_depth': 6, 'min_child_weight': 6, 'subsample': 0.7, 'colsample_bytree': 0.5, 'colsample_bylevel': 0.8, 'reg_alpha': 0.02949935339039912, 'reg_lambda': 23.019903300895383, 'gamma': 88.16548409509697}. Best is trial 183 with value: -1.6583770069254369.
/bsuhome/alexanderemert/Research/Star-Formation-Research-Project-2026/pipeline/scripts/optuna/final_preds_and_models/optuna_search_mult_quant_reg.py:75: UserWarning: The distribution is specified by [0.1, 5] and step=0.25, but the range is not divisible by `step`. It will be replaced with [0.1, 4.85].
  error_threshold = trial.suggest_float("error_threshold", 0.1, 5, step=0.25)
[I 2026-07-20 15:00:10,026] Trial 207 finished with value: -1.6559743822933803 and parameters: {'error_threshold': 3.35, 'scalers': 'standard', 'ratios': 'log_ratio', 'imputers': 'none', 'n_estimators': 100, 'learning_rate': 0.00012235695688500865, 'max_depth': 6, 'min_child_weight': 6, 'subsample': 0.7, 'colsample_bytree': 0.5, 'colsample_bylevel': 0.8, 'reg_alpha': 0.0298484026724651, 'reg_lambda': 46.54247172237455, 'gamma': 84.79909980820305}. Best is trial 183 with value: -1.6583770069254369.
/bsuhome/alexanderemert/Research/Star-Formation-Research-Project-2026/pipeline/scripts/optuna/final_preds_and_models/optuna_search_mult_quant_reg.py:75: UserWarning: The distribution is specified by [0.1, 5] and step=0.25, but the range is not divisible by `step`. It will be replaced with [0.1, 4.85].
  error_threshold = trial.suggest_float("error_threshold", 0.1, 5, step=0.25)
[I 2026-07-20 15:00:10,271] Trial 208 finished with value: -1.6561309497204728 and parameters: {'error_threshold': 3.35, 'scalers': 'standard', 'ratios': 'log_ratio', 'imputers': 'none', 'n_estimators': 100, 'learning_rate': 0.00012184001783032222, 'max_depth': 6, 'min_child_weight': 6, 'subsample': 0.7, 'colsample_bytree': 0.5, 'colsample_bylevel': 0.8, 'reg_alpha': 0.014077890672705939, 'reg_lambda': 62.50079736503387, 'gamma': 84.48182424826665}. Best is trial 183 with value: -1.6583770069254369.
/bsuhome/alexanderemert/Research/Star-Formation-Research-Project-2026/pipeline/scripts/optuna/final_preds_and_models/optuna_search_mult_quant_reg.py:75: UserWarning: The distribution is specified by [0.1, 5] and step=0.25, but the range is not divisible by `step`. It will be replaced with [0.1, 4.85].
  error_threshold = trial.suggest_float("error_threshold", 0.1, 5, step=0.25)
[I 2026-07-20 15:00:10,466] Trial 209 finished with value: -1.6568390870564171 and parameters: {'error_threshold': 1.85, 'scalers': 'standard', 'ratios': 'log_ratio', 'imputers': 'none', 'n_estimators': 100, 'learning_rate': 0.00012203116233700217, 'max_depth': 6, 'min_child_weight': 6, 'subsample': 0.7, 'colsample_bytree': 0.5, 'colsample_bylevel': 0.8, 'reg_alpha': 0.023344652404448375, 'reg_lambda': 80.94889788780397, 'gamma': 96.63227592443869}. Best is trial 183 with value: -1.6583770069254369.
/bsuhome/alexanderemert/Research/Star-Formation-Research-Project-2026/pipeline/scripts/optuna/final_preds_and_models/optuna_search_mult_quant_reg.py:75: UserWarning: The distribution is specified by [0.1, 5] and step=0.25, but the range is not divisible by `step`. It will be replaced with [0.1, 4.85].
  error_threshold = trial.suggest_float("error_threshold", 0.1, 5, step=0.25)
[I 2026-07-20 15:00:10,695] Trial 210 finished with value: -1.6559033739888198 and parameters: {'error_threshold': 1.85, 'scalers': 'standard', 'ratios': 'log_ratio', 'imputers': 'none', 'n_estimators': 100, 'learning_rate': 0.00012109742641832187, 'max_depth': 6, 'min_child_weight': 6, 'subsample': 0.7, 'colsample_bytree': 0.5, 'colsample_bylevel': 0.8, 'reg_alpha': 0.013644980591255768, 'reg_lambda': 73.64624624971958, 'gamma': 82.02541501393014}. Best is trial 183 with value: -1.6583770069254369.
/bsuhome/alexanderemert/Research/Star-Formation-Research-Project-2026/pipeline/scripts/optuna/final_preds_and_models/optuna_search_mult_quant_reg.py:75: UserWarning: The distribution is specified by [0.1, 5] and step=0.25, but the range is not divisible by `step`. It will be replaced with [0.1, 4.85].
  error_threshold = trial.suggest_float("error_threshold", 0.1, 5, step=0.25)
[I 2026-07-20 15:00:10,855] Trial 211 finished with value: -1.6568445197434187 and parameters: {'error_threshold': 1.85, 'scalers': 'standard', 'ratios': 'log_ratio', 'imputers': 'none', 'n_estimators': 100, 'learning_rate': 0.0001221510968037816, 'max_depth': 6, 'min_child_weight': 6, 'subsample': 0.7, 'colsample_bytree': 0.5, 'colsample_bylevel': 0.8, 'reg_alpha': 0.01201784254463219, 'reg_lambda': 82.23265788601603, 'gamma': 95.57680514317578}. Best is trial 183 with value: -1.6583770069254369.
/bsuhome/alexanderemert/Research/Star-Formation-Research-Project-2026/pipeline/scripts/optuna/final_preds_and_models/optuna_search_mult_quant_reg.py:75: UserWarning: The distribution is specified by [0.1, 5] and step=0.25, but the range is not divisible by `step`. It will be replaced with [0.1, 4.85].
  error_threshold = trial.suggest_float("error_threshold", 0.1, 5, step=0.25)
[I 2026-07-20 15:00:10,939] Trial 212 finished with value: -1.6565052409926455 and parameters: {'error_threshold': 3.35, 'scalers': 'standard', 'ratios': 'log_ratio', 'imputers': 'none', 'n_estimators': 100, 'learning_rate': 0.0001420277317936684, 'max_depth': 6, 'min_child_weight': 6, 'subsample': 0.7, 'colsample_bytree': 0.5, 'colsample_bylevel': 0.8, 'reg_alpha': 0.014198324282449824, 'reg_lambda': 72.624645034378, 'gamma': 94.57192713145814}. Best is trial 183 with value: -1.6583770069254369.
/bsuhome/alexanderemert/Research/Star-Formation-Research-Project-2026/pipeline/scripts/optuna/final_preds_and_models/optuna_search_mult_quant_reg.py:75: UserWarning: The distribution is specified by [0.1, 5] and step=0.25, but the range is not divisible by `step`. It will be replaced with [0.1, 4.85].
  error_threshold = trial.suggest_float("error_threshold", 0.1, 5, step=0.25)
[I 2026-07-20 15:00:11,696] Trial 213 finished with value: -1.6565383103866438 and parameters: {'error_threshold': 1.85, 'scalers': 'standard', 'ratios': 'log_ratio', 'imputers': 'none', 'n_estimators': 100, 'learning_rate': 0.0001457040552074703, 'max_depth': 6, 'min_child_weight': 6, 'subsample': 0.7, 'colsample_bytree': 0.5, 'colsample_bylevel': 0.8, 'reg_alpha': 0.01401053397451347, 'reg_lambda': 85.59983411515992, 'gamma': 96.19037902425525}. Best is trial 183 with value: -1.6583770069254369.
/bsuhome/alexanderemert/Research/Star-Formation-Research-Project-2026/pipeline/scripts/optuna/final_preds_and_models/optuna_search_mult_quant_reg.py:75: UserWarning: The distribution is specified by [0.1, 5] and step=0.25, but the range is not divisible by `step`. It will be replaced with [0.1, 4.85].
  error_threshold = trial.suggest_float("error_threshold", 0.1, 5, step=0.25)
[I 2026-07-20 15:00:11,773] Trial 214 finished with value: -1.6555326771221666 and parameters: {'error_threshold': 3.35, 'scalers': 'standard', 'ratios': 'log_ratio', 'imputers': 'none', 'n_estimators': 100, 'learning_rate': 0.00020383346633828174, 'max_depth': 6, 'min_child_weight': 6, 'subsample': 0.7, 'colsample_bytree': 0.5, 'colsample_bylevel': 0.8, 'reg_alpha': 0.014997351832034184, 'reg_lambda': 79.61723648073372, 'gamma': 89.87923250997974}. Best is trial 183 with value: -1.6583770069254369.
/bsuhome/alexanderemert/Research/Star-Formation-Research-Project-2026/pipeline/scripts/optuna/final_preds_and_models/optuna_search_mult_quant_reg.py:75: UserWarning: The distribution is specified by [0.1, 5] and step=0.25, but the range is not divisible by `step`. It will be replaced with [0.1, 4.85].
  error_threshold = trial.suggest_float("error_threshold", 0.1, 5, step=0.25)
[I 2026-07-20 15:00:12,539] Trial 215 finished with value: -1.65660394700008 and parameters: {'error_threshold': 1.85, 'scalers': 'standard', 'ratios': 'log_ratio', 'imputers': 'none', 'n_estimators': 100, 'learning_rate': 0.00014332228269202182, 'max_depth': 6, 'min_child_weight': 6, 'subsample': 0.7, 'colsample_bytree': 0.5, 'colsample_bylevel': 0.8, 'reg_alpha': 0.013931318497558432, 'reg_lambda': 85.64817926156643, 'gamma': 98.17624825694803}. Best is trial 183 with value: -1.6583770069254369.
/bsuhome/alexanderemert/Research/Star-Formation-Research-Project-2026/pipeline/scripts/optuna/final_preds_and_models/optuna_search_mult_quant_reg.py:75: UserWarning: The distribution is specified by [0.1, 5] and step=0.25, but the range is not divisible by `step`. It will be replaced with [0.1, 4.85].
  error_threshold = trial.suggest_float("error_threshold", 0.1, 5, step=0.25)
