[I 2026-07-20 12:36:41,459] Trial 27 finished with value: -1.1492275882647378 and parameters: {'error_threshold': 4.25, 'scalers': 'none', 'ratios': 'norm_ratio', 'imputers': 'none', 'n_estimators': 1700, 'learning_rate': 0.47475927345034535, 'max_depth': 10, 'min_child_weight': 2, 'subsample': 0.9, 'colsample_bytree': 0.8, 'colsample_bylevel': 0.7, 'reg_alpha': 6.75632948186982e-05, 'reg_lambda': 0.02376536875854231, 'gamma': 0.004800671304869728}. Best is trial 20 with value: -2.0408466825255984.
[I 2026-07-20 12:37:10,327] Trial 28 finished with value: -1.3801865930416042 and parameters: {'error_threshold': 1.5, 'scalers': 'none', 'ratios': 'log_ratio', 'imputers': 'median', 'n_estimators': 1850, 'learning_rate': 0.47841985134569776, 'max_depth': 11, 'min_child_weight': 2, 'subsample': 0.9, 'colsample_bytree': 0.8, 'colsample_bylevel': 0.7, 'reg_alpha': 0.09416330273473109, 'reg_lambda': 1.890307836073361, 'gamma': 0.004550913966025749}. Best is trial 20 with value: -2.0408466825255984.
[I 2026-07-20 12:37:50,018] Trial 29 finished with value: -1.2993899154049917 and parameters: {'error_threshold': 0.5, 'scalers': 'none', 'ratios': 'log_ratio', 'imputers': 'none', 'n_estimators': 1850, 'learning_rate': 0.41727164912153464, 'max_depth': 10, 'min_child_weight': 2, 'subsample': 0.9, 'colsample_bytree': 0.8, 'colsample_bylevel': 0.7, 'reg_alpha': 0.09174154365474418, 'reg_lambda': 2.150078571119115, 'gamma': 0.005286358438064445}. Best is trial 20 with value: -2.0408466825255984.
[I 2026-07-20 12:38:10,809] Trial 30 finished with value: -1.0352422516532298 and parameters: {'error_threshold': 4.25, 'scalers': 'none', 'ratios': 'norm_ratio', 'imputers': 'median', 'n_estimators': 2000, 'learning_rate': 0.15771656779281887, 'max_depth': 10, 'min_child_weight': 2, 'subsample': 0.8, 'colsample_bytree': 0.8, 'colsample_bylevel': 0.7, 'reg_alpha': 4.7072429490511785e-05, 'reg_lambda': 2.0062025456268002, 'gamma': 9.905553255829177e-05}. Best is trial 20 with value: -2.0408466825255984.
[I 2026-07-20 12:38:19,157] Trial 31 finished with value: -1.0481676541251026 and parameters: {'error_threshold': 4.25, 'scalers': 'none', 'ratios': 'norm_ratio', 'imputers': 'median', 'n_estimators': 1900, 'learning_rate': 0.14954980861160594, 'max_depth': 10, 'min_child_weight': 2, 'subsample': 0.8, 'colsample_bytree': 0.7, 'colsample_bylevel': 0.7, 'reg_alpha': 3.303657938734071e-05, 'reg_lambda': 2.1249114260214634, 'gamma': 0.0001474421088301608}. Best is trial 20 with value: -2.0408466825255984.
[I 2026-07-20 12:38:39,400] Trial 32 finished with value: -1.037074173363872 and parameters: {'error_threshold': 4.5, 'scalers': 'none', 'ratios': 'norm_ratio', 'imputers': 'median', 'n_estimators': 2000, 'learning_rate': 0.1391471698407532, 'max_depth': 10, 'min_child_weight': 2, 'subsample': 0.8, 'colsample_bytree': 0.7, 'colsample_bylevel': 0.8, 'reg_alpha': 3.236847464536854e-05, 'reg_lambda': 2.560848089025483, 'gamma': 0.002502143671852934}. Best is trial 20 with value: -2.0408466825255984.
[I 2026-07-20 12:38:59,282] Trial 33 finished with value: -1.0616532266549579 and parameters: {'error_threshold': 4.25, 'scalers': 'none', 'ratios': 'norm_ratio', 'imputers': 'median', 'n_estimators': 2000, 'learning_rate': 0.14926907641055373, 'max_depth': 10, 'min_child_weight': 2, 'subsample': 0.8, 'colsample_bytree': 0.7, 'colsample_bylevel': 0.8, 'reg_alpha': 2.005441826971177e-05, 'reg_lambda': 2.3138839210003748, 'gamma': 0.002685098444289836}. Best is trial 20 with value: -2.0408466825255984.
[I 2026-07-20 12:39:22,002] Trial 34 finished with value: -1.03110521893441 and parameters: {'error_threshold': 4.5, 'scalers': 'none', 'ratios': 'norm_ratio', 'imputers': 'median', 'n_estimators': 1950, 'learning_rate': 0.12826509029821034, 'max_depth': 10, 'min_child_weight': 2, 'subsample': 0.8, 'colsample_bytree': 0.7, 'colsample_bylevel': 0.7, 'reg_alpha': 4.000607585620428e-05, 'reg_lambda': 3.5076808655154017, 'gamma': 0.0039053760217185106}. Best is trial 20 with value: -2.0408466825255984.
[I 2026-07-20 12:39:38,479] Trial 35 finished with value: -0.7023229758774053 and parameters: {'error_threshold': 4.5, 'scalers': 'none', 'ratios': 'norm_ratio', 'imputers': 'median', 'n_estimators': 2050, 'learning_rate': 0.15280962667267045, 'max_depth': 10, 'min_child_weight': 2, 'subsample': 0.8, 'colsample_bytree': 0.7, 'colsample_bylevel': 0.8, 'reg_alpha': 1.967217789374396e-05, 'reg_lambda': 1.9952332342075951, 'gamma': 0.22686204647836045}. Best is trial 20 with value: -2.0408466825255984.
[I 2026-07-20 12:39:43,167] Trial 36 finished with value: -0.8494834827636003 and parameters: {'error_threshold': 4.25, 'scalers': 'none', 'ratios': 'norm_ratio', 'imputers': 'median', 'n_estimators': 2100, 'learning_rate': 0.16706941031079245, 'max_depth': 10, 'min_child_weight': 2, 'subsample': 0.8, 'colsample_bytree': 0.7, 'colsample_bylevel': 0.8, 'reg_alpha': 2.0247203080299546e-05, 'reg_lambda': 0.0366411570495134, 'gamma': 0.1390956918453685}. Best is trial 20 with value: -2.0408466825255984.
[I 2026-07-20 12:40:16,267] Trial 37 finished with value: -0.6937482868121491 and parameters: {'error_threshold': 4.5, 'scalers': 'none', 'ratios': 'norm_ratio', 'imputers': 'median', 'n_estimators': 2200, 'learning_rate': 0.12715994208791392, 'max_depth': 11, 'min_child_weight': 3, 'subsample': 0.8, 'colsample_bytree': 0.7, 'colsample_bylevel': 0.8, 'reg_alpha': 0.017210043751154768, 'reg_lambda': 0.02552661690551919, 'gamma': 0.33661436386162596}. Best is trial 20 with value: -2.0408466825255984.
[I 2026-07-20 12:40:51,513] Trial 38 finished with value: -0.8968035488868279 and parameters: {'error_threshold': 3.25, 'scalers': 'none', 'ratios': 'log_ratio', 'imputers': 'median', 'n_estimators': 2100, 'learning_rate': 0.1662024327239357, 'max_depth': 11, 'min_child_weight': 3, 'subsample': 0.8, 'colsample_bytree': 0.7, 'colsample_bylevel': 0.8, 'reg_alpha': 0.2310585183064046, 'reg_lambda': 0.023624272041199854, 'gamma': 0.09973683124060403}. Best is trial 20 with value: -2.0408466825255984.
[I 2026-07-20 12:40:52,847] Trial 39 finished with value: -0.6806832956455814 and parameters: {'error_threshold': 3.5, 'scalers': 'none', 'ratios': 'log_ratio', 'imputers': 'median', 'n_estimators': 2200, 'learning_rate': 0.07698419468886868, 'max_depth': 11, 'min_child_weight': 3, 'subsample': 1.0, 'colsample_bytree': 0.7, 'colsample_bylevel': 0.8, 'reg_alpha': 0.013980018535207028, 'reg_lambda': 0.026130740364524084, 'gamma': 0.2017999380157112}. Best is trial 20 with value: -2.0408466825255984.
[I 2026-07-20 12:40:58,834] Trial 40 finished with value: -0.6780819380757391 and parameters: {'error_threshold': 3.25, 'scalers': 'none', 'ratios': 'log_ratio', 'imputers': 'median', 'n_estimators': 2250, 'learning_rate': 0.0660736076570292, 'max_depth': 11, 'min_child_weight': 3, 'subsample': 1.0, 'colsample_bytree': 0.7, 'colsample_bylevel': 0.6, 'reg_alpha': 0.24926808063214737, 'reg_lambda': 0.025587281476644585, 'gamma': 0.18458523399456933}. Best is trial 20 with value: -2.0408466825255984.
[I 2026-07-20 12:41:36,740] Trial 41 finished with value: -0.6824690780715145 and parameters: {'error_threshold': 3.5, 'scalers': 'none', 'ratios': 'log_ratio', 'imputers': 'median', 'n_estimators': 2300, 'learning_rate': 0.06964918745043566, 'max_depth': 11, 'min_child_weight': 3, 'subsample': 1.0, 'colsample_bytree': 0.7, 'colsample_bylevel': 0.6, 'reg_alpha': 1.0372674902780123e-06, 'reg_lambda': 0.0199110222329898, 'gamma': 0.28916682360555346}. Best is trial 20 with value: -2.0408466825255984.
[I 2026-07-20 12:41:41,660] Trial 44 finished with value: -0.6699381336590449 and parameters: {'error_threshold': 3.75, 'scalers': 'none', 'ratios': 'log_ratio', 'imputers': 'mean', 'n_estimators': 1250, 'learning_rate': 0.05955338227983243, 'max_depth': 11, 'min_child_weight': 3, 'subsample': 1.0, 'colsample_bytree': 0.9, 'colsample_bylevel': 0.6, 'reg_alpha': 0.012306367996486281, 'reg_lambda': 10.193521642728628, 'gamma': 0.9445942830396211}. Best is trial 20 with value: -2.0408466825255984.
[I 2026-07-20 12:42:06,252] Trial 42 finished with value: -0.6817873237498904 and parameters: {'error_threshold': 3.5, 'scalers': 'none', 'ratios': 'log_ratio', 'imputers': 'median', 'n_estimators': 2300, 'learning_rate': 0.057923593839348884, 'max_depth': 11, 'min_child_weight': 3, 'subsample': 1.0, 'colsample_bytree': 0.9, 'colsample_bylevel': 0.6, 'reg_alpha': 0.10998818064889797, 'reg_lambda': 0.6662398767083392, 'gamma': 0.21653894861075706}. Best is trial 20 with value: -2.0408466825255984.
[I 2026-07-20 12:42:07,727] Trial 43 finished with value: -0.681911856333952 and parameters: {'error_threshold': 3.5, 'scalers': 'none', 'ratios': 'log_ratio', 'imputers': 'mean', 'n_estimators': 2300, 'learning_rate': 0.06352640360246739, 'max_depth': 11, 'min_child_weight': 3, 'subsample': 1.0, 'colsample_bytree': 0.9, 'colsample_bylevel': 0.6, 'reg_alpha': 0.21956487056098312, 'reg_lambda': 0.019202340759225785, 'gamma': 0.26791071119511417}. Best is trial 20 with value: -2.0408466825255984.
[I 2026-07-20 12:42:50,160] Trial 46 finished with value: -0.6714180477789217 and parameters: {'error_threshold': 0.75, 'scalers': 'none', 'ratios': 'log_ratio', 'imputers': 'mean', 'n_estimators': 1150, 'learning_rate': 0.25991363815072543, 'max_depth': 12, 'min_child_weight': 1, 'subsample': 1.0, 'colsample_bytree': 0.9, 'colsample_bylevel': 0.6, 'reg_alpha': 1.2826215597069047e-06, 'reg_lambda': 12.736052896546267, 'gamma': 1.0956461483219184}. Best is trial 20 with value: -2.0408466825255984.
[I 2026-07-20 12:42:50,780] Trial 45 finished with value: -0.8595674862685363 and parameters: {'error_threshold': 3.5, 'scalers': 'none', 'ratios': 'log_ratio', 'imputers': 'mean', 'n_estimators': 1250, 'learning_rate': 0.05833197114356409, 'max_depth': 11, 'min_child_weight': 1, 'subsample': 1.0, 'colsample_bytree': 0.9, 'colsample_bylevel': 0.6, 'reg_alpha': 0.22783070231821673, 'reg_lambda': 7.502967172257546, 'gamma': 0.0005848458673198034}. Best is trial 20 with value: -2.0408466825255984.
[I 2026-07-20 12:43:18,342] Trial 47 finished with value: -1.192236519593598 and parameters: {'error_threshold': 1.5, 'scalers': 'none', 'ratios': 'log_ratio', 'imputers': 'mean', 'n_estimators': 1200, 'learning_rate': 0.2600036722742198, 'max_depth': 12, 'min_child_weight': 1, 'subsample': 1.0, 'colsample_bytree': 0.9, 'colsample_bylevel': 0.6, 'reg_alpha': 0.0010421177592683027, 'reg_lambda': 83.71868218195452, 'gamma': 0.000489566516795918}. Best is trial 20 with value: -2.0408466825255984.
/bsuscratch/alexanderemert/miniforge3/envs/starform-alex/lib/python3.14/site-packages/numpy/lib/_nanfunctions_impl.py:1215: RuntimeWarning: All-NaN slice encountered
  return fnb._ureduce(a, func=_nanmedian, keepdims=keepdims,
/bsuscratch/alexanderemert/miniforge3/envs/starform-alex/lib/python3.14/site-packages/numpy/lib/_nanfunctions_impl.py:1396: RuntimeWarning: All-NaN slice encountered
  return _nanquantile_unchecked(
[I 2026-07-20 12:43:42,325] Trial 48 finished with value: -1.2097932313117212 and parameters: {'error_threshold': 1.5, 'scalers': 'none', 'ratios': 'log_ratio', 'imputers': 'mean', 'n_estimators': 1200, 'learning_rate': 0.257807182669588, 'max_depth': 12, 'min_child_weight': 1, 'subsample': 0.9, 'colsample_bytree': 0.9, 'colsample_bylevel': 0.6, 'reg_alpha': 0.000992041776491982, 'reg_lambda': 0.8092660850518341, 'gamma': 0.00045408888774880823}. Best is trial 20 with value: -2.0408466825255984.
/bsuscratch/alexanderemert/miniforge3/envs/starform-alex/lib/python3.14/site-packages/numpy/lib/_nanfunctions_impl.py:1215: RuntimeWarning: All-NaN slice encountered
  return fnb._ureduce(a, func=_nanmedian, keepdims=keepdims,
/bsuscratch/alexanderemert/miniforge3/envs/starform-alex/lib/python3.14/site-packages/numpy/lib/_nanfunctions_impl.py:1396: RuntimeWarning: All-NaN slice encountered
  return _nanquantile_unchecked(
[I 2026-07-20 12:44:13,379] Trial 49 finished with value: -1.1923728817103243 and parameters: {'error_threshold': 1.5, 'scalers': 'none', 'ratios': 'norm_ratio', 'imputers': 'mean', 'n_estimators': 1300, 'learning_rate': 0.2555206468501028, 'max_depth': 12, 'min_child_weight': 1, 'subsample': 0.9, 'colsample_bytree': 0.9, 'colsample_bylevel': 0.6, 'reg_alpha': 0.0008228594696178563, 'reg_lambda': 0.4596382799351475, 'gamma': 0.0005895881265754723}. Best is trial 20 with value: -2.0408466825255984.
/bsuscratch/alexanderemert/miniforge3/envs/starform-alex/lib/python3.14/site-packages/numpy/lib/_nanfunctions_impl.py:1215: RuntimeWarning: All-NaN slice encountered
  return fnb._ureduce(a, func=_nanmedian, keepdims=keepdims,
/bsuscratch/alexanderemert/miniforge3/envs/starform-alex/lib/python3.14/site-packages/numpy/lib/_nanfunctions_impl.py:1396: RuntimeWarning: All-NaN slice encountered
  return _nanquantile_unchecked(
/bsuscratch/alexanderemert/miniforge3/envs/starform-alex/lib/python3.14/site-packages/numpy/lib/_nanfunctions_impl.py:1215: RuntimeWarning: All-NaN slice encountered
  return fnb._ureduce(a, func=_nanmedian, keepdims=keepdims,
/bsuscratch/alexanderemert/miniforge3/envs/starform-alex/lib/python3.14/site-packages/numpy/lib/_nanfunctions_impl.py:1396: RuntimeWarning: All-NaN slice encountered
  return _nanquantile_unchecked(
/bsuscratch/alexanderemert/miniforge3/envs/starform-alex/lib/python3.14/site-packages/numpy/lib/_nanfunctions_impl.py:1215: RuntimeWarning: All-NaN slice encountered
  return fnb._ureduce(a, func=_nanmedian, keepdims=keepdims,
/bsuscratch/alexanderemert/miniforge3/envs/starform-alex/lib/python3.14/site-packages/numpy/lib/_nanfunctions_impl.py:1396: RuntimeWarning: All-NaN slice encountered
  return _nanquantile_unchecked(
/bsuscratch/alexanderemert/miniforge3/envs/starform-alex/lib/python3.14/site-packages/numpy/lib/_nanfunctions_impl.py:1215: RuntimeWarning: All-NaN slice encountered
  return fnb._ureduce(a, func=_nanmedian, keepdims=keepdims,
/bsuscratch/alexanderemert/miniforge3/envs/starform-alex/lib/python3.14/site-packages/numpy/lib/_nanfunctions_impl.py:1396: RuntimeWarning: All-NaN slice encountered
  return _nanquantile_unchecked(
/bsuscratch/alexanderemert/miniforge3/envs/starform-alex/lib/python3.14/site-packages/numpy/lib/_nanfunctions_impl.py:1215: RuntimeWarning: All-NaN slice encountered
  return fnb._ureduce(a, func=_nanmedian, keepdims=keepdims,
/bsuscratch/alexanderemert/miniforge3/envs/starform-alex/lib/python3.14/site-packages/numpy/lib/_nanfunctions_impl.py:1396: RuntimeWarning: All-NaN slice encountered
  return _nanquantile_unchecked(
/bsuscratch/alexanderemert/miniforge3/envs/starform-alex/lib/python3.14/site-packages/numpy/lib/_nanfunctions_impl.py:1215: RuntimeWarning: All-NaN slice encountered
  return fnb._ureduce(a, func=_nanmedian, keepdims=keepdims,
/bsuscratch/alexanderemert/miniforge3/envs/starform-alex/lib/python3.14/site-packages/numpy/lib/_nanfunctions_impl.py:1396: RuntimeWarning: All-NaN slice encountered
  return _nanquantile_unchecked(
/bsuscratch/alexanderemert/miniforge3/envs/starform-alex/lib/python3.14/site-packages/numpy/lib/_nanfunctions_impl.py:1215: RuntimeWarning: All-NaN slice encountered
  return fnb._ureduce(a, func=_nanmedian, keepdims=keepdims,
/bsuscratch/alexanderemert/miniforge3/envs/starform-alex/lib/python3.14/site-packages/numpy/lib/_nanfunctions_impl.py:1396: RuntimeWarning: All-NaN slice encountered
  return _nanquantile_unchecked(
/bsuscratch/alexanderemert/miniforge3/envs/starform-alex/lib/python3.14/site-packages/numpy/lib/_nanfunctions_impl.py:1215: RuntimeWarning: All-NaN slice encountered
  return fnb._ureduce(a, func=_nanmedian, keepdims=keepdims,
/bsuscratch/alexanderemert/miniforge3/envs/starform-alex/lib/python3.14/site-packages/numpy/lib/_nanfunctions_impl.py:1396: RuntimeWarning: All-NaN slice encountered
  return _nanquantile_unchecked(
/bsuscratch/alexanderemert/miniforge3/envs/starform-alex/lib/python3.14/site-packages/numpy/lib/_nanfunctions_impl.py:1215: RuntimeWarning: All-NaN slice encountered
  return fnb._ureduce(a, func=_nanmedian, keepdims=keepdims,
/bsuscratch/alexanderemert/miniforge3/envs/starform-alex/lib/python3.14/site-packages/numpy/lib/_nanfunctions_impl.py:1396: RuntimeWarning: All-NaN slice encountered
  return _nanquantile_unchecked(
/bsuscratch/alexanderemert/miniforge3/envs/starform-alex/lib/python3.14/site-packages/numpy/lib/_nanfunctions_impl.py:1215: RuntimeWarning: All-NaN slice encountered
  return fnb._ureduce(a, func=_nanmedian, keepdims=keepdims,
/bsuscratch/alexanderemert/miniforge3/envs/starform-alex/lib/python3.14/site-packages/numpy/lib/_nanfunctions_impl.py:1396: RuntimeWarning: All-NaN slice encountered
  return _nanquantile_unchecked(
/bsuscratch/alexanderemert/miniforge3/envs/starform-alex/lib/python3.14/site-packages/numpy/lib/_nanfunctions_impl.py:1215: RuntimeWarning: All-NaN slice encountered
  return fnb._ureduce(a, func=_nanmedian, keepdims=keepdims,
/bsuscratch/alexanderemert/miniforge3/envs/starform-alex/lib/python3.14/site-packages/numpy/lib/_nanfunctions_impl.py:1396: RuntimeWarning: All-NaN slice encountered
  return _nanquantile_unchecked(
/bsuscratch/alexanderemert/miniforge3/envs/starform-alex/lib/python3.14/site-packages/numpy/lib/_nanfunctions_impl.py:1215: RuntimeWarning: All-NaN slice encountered
  return fnb._ureduce(a, func=_nanmedian, keepdims=keepdims,
/bsuscratch/alexanderemert/miniforge3/envs/starform-alex/lib/python3.14/site-packages/numpy/lib/_nanfunctions_impl.py:1396: RuntimeWarning: All-NaN slice encountered
  return _nanquantile_unchecked(
/bsuscratch/alexanderemert/miniforge3/envs/starform-alex/lib/python3.14/site-packages/numpy/lib/_nanfunctions_impl.py:1215: RuntimeWarning: All-NaN slice encountered
  return fnb._ureduce(a, func=_nanmedian, keepdims=keepdims,
/bsuscratch/alexanderemert/miniforge3/envs/starform-alex/lib/python3.14/site-packages/numpy/lib/_nanfunctions_impl.py:1396: RuntimeWarning: All-NaN slice encountered
  return _nanquantile_unchecked(
/bsuscratch/alexanderemert/miniforge3/envs/starform-alex/lib/python3.14/site-packages/numpy/lib/_nanfunctions_impl.py:1215: RuntimeWarning: All-NaN slice encountered
  return fnb._ureduce(a, func=_nanmedian, keepdims=keepdims,
/bsuscratch/alexanderemert/miniforge3/envs/starform-alex/lib/python3.14/site-packages/numpy/lib/_nanfunctions_impl.py:1396: RuntimeWarning: All-NaN slice encountered
  return _nanquantile_unchecked(
[I 2026-07-20 12:44:42,516] Trial 50 finished with value: -1.507647911757411 and parameters: {'error_threshold': 1.5, 'scalers': 'none', 'ratios': 'norm_ratio', 'imputers': 'mean', 'n_estimators': 1700, 'learning_rate': 0.31314397576394426, 'max_depth': 12, 'min_child_weight': 1, 'subsample': 0.6, 'colsample_bytree': 0.8, 'colsample_bylevel': 0.7, 'reg_alpha': 0.0016821020356667029, 'reg_lambda': 0.7585047218736639, 'gamma': 0.0006402575800933254}. Best is trial 20 with value: -2.0408466825255984.
/bsuscratch/alexanderemert/miniforge3/envs/starform-alex/lib/python3.14/site-packages/numpy/lib/_nanfunctions_impl.py:1215: RuntimeWarning: All-NaN slice encountered
  return fnb._ureduce(a, func=_nanmedian, keepdims=keepdims,
/bsuscratch/alexanderemert/miniforge3/envs/starform-alex/lib/python3.14/site-packages/numpy/lib/_nanfunctions_impl.py:1396: RuntimeWarning: All-NaN slice encountered
  return _nanquantile_unchecked(
/bsuscratch/alexanderemert/miniforge3/envs/starform-alex/lib/python3.14/site-packages/numpy/lib/_nanfunctions_impl.py:1215: RuntimeWarning: All-NaN slice encountered
  return fnb._ureduce(a, func=_nanmedian, keepdims=keepdims,
/bsuscratch/alexanderemert/miniforge3/envs/starform-alex/lib/python3.14/site-packages/numpy/lib/_nanfunctions_impl.py:1396: RuntimeWarning: All-NaN slice encountered
  return _nanquantile_unchecked(
