[I 2026-07-20 14:54:58,689] Trial 25 finished with value: -1.220313121622304 and parameters: {'error_threshold': 3.35, 'scalers': 'none', 'ratios': 'log_ratio', 'imputers': 'median', 'n_estimators': 950, 'learning_rate': 0.05101475557047284, 'max_depth': 3, 'min_child_weight': 10, 'subsample': 0.6, 'colsample_bytree': 0.9, 'colsample_bylevel': 0.7, 'reg_alpha': 5.169502307191583, 'reg_lambda': 0.06434415478159626, 'gamma': 0.0065812095075055595}. Best is trial 10 with value: -1.6531965450170938.
/bsuhome/alexanderemert/Research/Star-Formation-Research-Project-2026/pipeline/scripts/optuna/final_preds_and_models/optuna_search_mult_quant_reg.py:75: UserWarning: The distribution is specified by [0.1, 5] and step=0.25, but the range is not divisible by `step`. It will be replaced with [0.1, 4.85].
  error_threshold = trial.suggest_float("error_threshold", 0.1, 5, step=0.25)
[I 2026-07-20 14:54:58,842] Trial 26 finished with value: -1.2087039119554592 and parameters: {'error_threshold': 3.6, 'scalers': 'robust', 'ratios': 'log_ratio', 'imputers': 'median', 'n_estimators': 100, 'learning_rate': 0.06222840070187146, 'max_depth': 3, 'min_child_weight': 10, 'subsample': 0.6, 'colsample_bytree': 0.9, 'colsample_bylevel': 0.7, 'reg_alpha': 7.708171522246554, 'reg_lambda': 0.05125012589531824, 'gamma': 0.003988176751373942}. Best is trial 10 with value: -1.6531965450170938.
/bsuhome/alexanderemert/Research/Star-Formation-Research-Project-2026/pipeline/scripts/optuna/final_preds_and_models/optuna_search_mult_quant_reg.py:75: UserWarning: The distribution is specified by [0.1, 5] and step=0.25, but the range is not divisible by `step`. It will be replaced with [0.1, 4.85].
  error_threshold = trial.suggest_float("error_threshold", 0.1, 5, step=0.25)
[I 2026-07-20 14:55:02,613] Trial 24 finished with value: -1.2524455261870928 and parameters: {'error_threshold': 3.6, 'scalers': 'none', 'ratios': 'log_ratio', 'imputers': 'median', 'n_estimators': 1050, 'learning_rate': 0.0696074991275917, 'max_depth': 12, 'min_child_weight': 10, 'subsample': 0.6, 'colsample_bytree': 0.9, 'colsample_bylevel': 0.6, 'reg_alpha': 6.761993942458279, 'reg_lambda': 0.12040751550773826, 'gamma': 0.009024857588686484}. Best is trial 10 with value: -1.6531965450170938.
/bsuhome/alexanderemert/Research/Star-Formation-Research-Project-2026/pipeline/scripts/optuna/final_preds_and_models/optuna_search_mult_quant_reg.py:75: UserWarning: The distribution is specified by [0.1, 5] and step=0.25, but the range is not divisible by `step`. It will be replaced with [0.1, 4.85].
  error_threshold = trial.suggest_float("error_threshold", 0.1, 5, step=0.25)
[I 2026-07-20 14:55:06,342] Trial 27 finished with value: -1.2081936104018554 and parameters: {'error_threshold': 0.6, 'scalers': 'robust', 'ratios': 'log_ratio', 'imputers': 'median', 'n_estimators': 150, 'learning_rate': 0.06466595679569768, 'max_depth': 3, 'min_child_weight': 10, 'subsample': 0.6, 'colsample_bytree': 0.9, 'colsample_bylevel': 0.9, 'reg_alpha': 10.093679534934381, 'reg_lambda': 0.0003402262413586505, 'gamma': 0.0030601679209376013}. Best is trial 10 with value: -1.6531965450170938.
/bsuhome/alexanderemert/Research/Star-Formation-Research-Project-2026/pipeline/scripts/optuna/final_preds_and_models/optuna_search_mult_quant_reg.py:75: UserWarning: The distribution is specified by [0.1, 5] and step=0.25, but the range is not divisible by `step`. It will be replaced with [0.1, 4.85].
  error_threshold = trial.suggest_float("error_threshold", 0.1, 5, step=0.25)
[I 2026-07-20 14:55:17,892] Trial 31 finished with value: -1.6453225249494006 and parameters: {'error_threshold': 0.85, 'scalers': 'robust', 'ratios': 'norm_ratio', 'imputers': 'median', 'n_estimators': 100, 'learning_rate': 0.0002307381610034536, 'max_depth': 3, 'min_child_weight': 10, 'subsample': 1.0, 'colsample_bytree': 1.0, 'colsample_bylevel': 0.6, 'reg_alpha': 7.547878801516496, 'reg_lambda': 0.020100461419721508, 'gamma': 0.17647991876605976}. Best is trial 10 with value: -1.6531965450170938.
/bsuhome/alexanderemert/Research/Star-Formation-Research-Project-2026/pipeline/scripts/optuna/final_preds_and_models/optuna_search_mult_quant_reg.py:75: UserWarning: The distribution is specified by [0.1, 5] and step=0.25, but the range is not divisible by `step`. It will be replaced with [0.1, 4.85].
  error_threshold = trial.suggest_float("error_threshold", 0.1, 5, step=0.25)
[I 2026-07-20 14:55:23,229] Trial 28 finished with value: -1.240116309986428 and parameters: {'error_threshold': 0.6, 'scalers': 'none', 'ratios': 'log_ratio', 'imputers': 'median', 'n_estimators': 900, 'learning_rate': 0.002670735425489387, 'max_depth': 11, 'min_child_weight': 10, 'subsample': 0.6, 'colsample_bytree': 0.9, 'colsample_bylevel': 0.6, 'reg_alpha': 8.441709264894458, 'reg_lambda': 0.02300210911134537, 'gamma': 0.0028340656701865714}. Best is trial 10 with value: -1.6531965450170938.
/bsuhome/alexanderemert/Research/Star-Formation-Research-Project-2026/pipeline/scripts/optuna/final_preds_and_models/optuna_search_mult_quant_reg.py:75: UserWarning: The distribution is specified by [0.1, 5] and step=0.25, but the range is not divisible by `step`. It will be replaced with [0.1, 4.85].
  error_threshold = trial.suggest_float("error_threshold", 0.1, 5, step=0.25)
[I 2026-07-20 14:55:35,486] Trial 29 finished with value: -1.541455116194151 and parameters: {'error_threshold': 0.85, 'scalers': 'none', 'ratios': 'norm_ratio', 'imputers': 'median', 'n_estimators': 850, 'learning_rate': 0.0002649676590836518, 'max_depth': 11, 'min_child_weight': 10, 'subsample': 0.6, 'colsample_bytree': 0.9, 'colsample_bylevel': 0.6, 'reg_alpha': 7.278248970241996, 'reg_lambda': 0.020243036662512235, 'gamma': 0.002585213865161779}. Best is trial 10 with value: -1.6531965450170938.
/bsuhome/alexanderemert/Research/Star-Formation-Research-Project-2026/pipeline/scripts/optuna/final_preds_and_models/optuna_search_mult_quant_reg.py:75: UserWarning: The distribution is specified by [0.1, 5] and step=0.25, but the range is not divisible by `step`. It will be replaced with [0.1, 4.85].
  error_threshold = trial.suggest_float("error_threshold", 0.1, 5, step=0.25)
[I 2026-07-20 14:55:36,460] Trial 30 finished with value: -1.5493372605928422 and parameters: {'error_threshold': 4.35, 'scalers': 'robust', 'ratios': 'norm_ratio', 'imputers': 'median', 'n_estimators': 850, 'learning_rate': 0.00025097904027984134, 'max_depth': 3, 'min_child_weight': 10, 'subsample': 1.0, 'colsample_bytree': 1.0, 'colsample_bylevel': 0.6, 'reg_alpha': 8.805432028063262, 'reg_lambda': 0.022385669292024787, 'gamma': 0.0019957608438649953}. Best is trial 10 with value: -1.6531965450170938.
/bsuhome/alexanderemert/Research/Star-Formation-Research-Project-2026/pipeline/scripts/optuna/final_preds_and_models/optuna_search_mult_quant_reg.py:75: UserWarning: The distribution is specified by [0.1, 5] and step=0.25, but the range is not divisible by `step`. It will be replaced with [0.1, 4.85].
  error_threshold = trial.suggest_float("error_threshold", 0.1, 5, step=0.25)
[I 2026-07-20 14:55:41,381] Trial 32 finished with value: -1.430744257100215 and parameters: {'error_threshold': 0.85, 'scalers': 'robust', 'ratios': 'norm_ratio', 'imputers': 'median', 'n_estimators': 1650, 'learning_rate': 0.00032359292535969587, 'max_depth': 11, 'min_child_weight': 9, 'subsample': 1.0, 'colsample_bytree': 1.0, 'colsample_bylevel': 0.6, 'reg_alpha': 9.922835780545935, 'reg_lambda': 0.0004101473841711002, 'gamma': 0.11967546522413298}. Best is trial 10 with value: -1.6531965450170938.
/bsuhome/alexanderemert/Research/Star-Formation-Research-Project-2026/pipeline/scripts/optuna/final_preds_and_models/optuna_search_mult_quant_reg.py:75: UserWarning: The distribution is specified by [0.1, 5] and step=0.25, but the range is not divisible by `step`. It will be replaced with [0.1, 4.85].
  error_threshold = trial.suggest_float("error_threshold", 0.1, 5, step=0.25)
[I 2026-07-20 14:55:52,469] Trial 36 finished with value: -1.6078469285097174 and parameters: {'error_threshold': 0.85, 'scalers': 'robust', 'ratios': 'norm_ratio', 'imputers': 'mean', 'n_estimators': 350, 'learning_rate': 0.0002567011601137714, 'max_depth': 7, 'min_child_weight': 2, 'subsample': 1.0, 'colsample_bytree': 1.0, 'colsample_bylevel': 0.6, 'reg_alpha': 0.27300060347231386, 'reg_lambda': 0.0032482414222125807, 'gamma': 0.13878366164709072}. Best is trial 10 with value: -1.6531965450170938.
/bsuhome/alexanderemert/Research/Star-Formation-Research-Project-2026/pipeline/scripts/optuna/final_preds_and_models/optuna_search_mult_quant_reg.py:75: UserWarning: The distribution is specified by [0.1, 5] and step=0.25, but the range is not divisible by `step`. It will be replaced with [0.1, 4.85].
  error_threshold = trial.suggest_float("error_threshold", 0.1, 5, step=0.25)
[I 2026-07-20 14:55:53,542] Trial 37 finished with value: -1.6152110803997453 and parameters: {'error_threshold': 0.85, 'scalers': 'robust', 'ratios': 'norm_ratio', 'imputers': 'mean', 'n_estimators': 300, 'learning_rate': 0.0002504900695983245, 'max_depth': 7, 'min_child_weight': 2, 'subsample': 1.0, 'colsample_bytree': 1.0, 'colsample_bylevel': 0.8, 'reg_alpha': 0.3334654576617953, 'reg_lambda': 0.00263203369356136, 'gamma': 0.17585831036369354}. Best is trial 10 with value: -1.6531965450170938.
/bsuhome/alexanderemert/Research/Star-Formation-Research-Project-2026/pipeline/scripts/optuna/final_preds_and_models/optuna_search_mult_quant_reg.py:75: UserWarning: The distribution is specified by [0.1, 5] and step=0.25, but the range is not divisible by `step`. It will be replaced with [0.1, 4.85].
  error_threshold = trial.suggest_float("error_threshold", 0.1, 5, step=0.25)
[I 2026-07-20 14:56:23,572] Trial 38 finished with value: -1.6139349710428055 and parameters: {'error_threshold': 1.85, 'scalers': 'robust', 'ratios': 'norm_ratio', 'imputers': 'median', 'n_estimators': 350, 'learning_rate': 0.0002134284021287276, 'max_depth': 7, 'min_child_weight': 9, 'subsample': 1.0, 'colsample_bytree': 1.0, 'colsample_bylevel': 0.6, 'reg_alpha': 0.3054852333082692, 'reg_lambda': 0.004199505815260074, 'gamma': 0.14446591932892808}. Best is trial 10 with value: -1.6531965450170938.
/bsuhome/alexanderemert/Research/Star-Formation-Research-Project-2026/pipeline/scripts/optuna/final_preds_and_models/optuna_search_mult_quant_reg.py:75: UserWarning: The distribution is specified by [0.1, 5] and step=0.25, but the range is not divisible by `step`. It will be replaced with [0.1, 4.85].
  error_threshold = trial.suggest_float("error_threshold", 0.1, 5, step=0.25)
[I 2026-07-20 14:56:49,495] Trial 39 finished with value: -1.6134963178394515 and parameters: {'error_threshold': 1.85, 'scalers': 'robust', 'ratios': 'norm_ratio', 'imputers': 'median', 'n_estimators': 400, 'learning_rate': 0.00018856624276476568, 'max_depth': 8, 'min_child_weight': 9, 'subsample': 1.0, 'colsample_bytree': 1.0, 'colsample_bylevel': 0.5, 'reg_alpha': 0.4849815424036914, 'reg_lambda': 0.003486921113709746, 'gamma': 0.13388021919457266}. Best is trial 10 with value: -1.6531965450170938.
/bsuhome/alexanderemert/Research/Star-Formation-Research-Project-2026/pipeline/scripts/optuna/final_preds_and_models/optuna_search_mult_quant_reg.py:75: UserWarning: The distribution is specified by [0.1, 5] and step=0.25, but the range is not divisible by `step`. It will be replaced with [0.1, 4.85].
  error_threshold = trial.suggest_float("error_threshold", 0.1, 5, step=0.25)
[I 2026-07-20 14:57:17,962] Trial 40 finished with value: -1.6268893595159735 and parameters: {'error_threshold': 2.1, 'scalers': 'robust', 'ratios': 'norm_ratio', 'imputers': 'mean', 'n_estimators': 400, 'learning_rate': 0.00016029787912618946, 'max_depth': 8, 'min_child_weight': 9, 'subsample': 0.5, 'colsample_bytree': 1.0, 'colsample_bylevel': 0.5, 'reg_alpha': 0.36148876882492836, 'reg_lambda': 0.003478076831417968, 'gamma': 1.6246705336426004}. Best is trial 10 with value: -1.6531965450170938.
/bsuhome/alexanderemert/Research/Star-Formation-Research-Project-2026/pipeline/scripts/optuna/final_preds_and_models/optuna_search_mult_quant_reg.py:75: UserWarning: The distribution is specified by [0.1, 5] and step=0.25, but the range is not divisible by `step`. It will be replaced with [0.1, 4.85].
  error_threshold = trial.suggest_float("error_threshold", 0.1, 5, step=0.25)
[I 2026-07-20 14:57:23,609] Trial 33 finished with value: -1.4832834361572944 and parameters: {'error_threshold': 4.35, 'scalers': 'robust', 'ratios': 'norm_ratio', 'imputers': 'median', 'n_estimators': 1650, 'learning_rate': 0.0002294069512091721, 'max_depth': 11, 'min_child_weight': 2, 'subsample': 1.0, 'colsample_bytree': 1.0, 'colsample_bylevel': 0.6, 'reg_alpha': 0.3467391016263737, 'reg_lambda': 0.0003879793732825798, 'gamma': 0.16710089731442604}. Best is trial 10 with value: -1.6531965450170938.
/bsuhome/alexanderemert/Research/Star-Formation-Research-Project-2026/pipeline/scripts/optuna/final_preds_and_models/optuna_search_mult_quant_reg.py:75: UserWarning: The distribution is specified by [0.1, 5] and step=0.25, but the range is not divisible by `step`. It will be replaced with [0.1, 4.85].
  error_threshold = trial.suggest_float("error_threshold", 0.1, 5, step=0.25)
[I 2026-07-20 14:57:29,147] Trial 34 finished with value: -1.52261541621416 and parameters: {'error_threshold': 0.85, 'scalers': 'robust', 'ratios': 'norm_ratio', 'imputers': 'median', 'n_estimators': 1450, 'learning_rate': 0.00018631085090513202, 'max_depth': 11, 'min_child_weight': 2, 'subsample': 1.0, 'colsample_bytree': 1.0, 'colsample_bylevel': 0.6, 'reg_alpha': 0.46003881748137304, 'reg_lambda': 0.0011231618250505384, 'gamma': 0.18974784379918808}. Best is trial 10 with value: -1.6531965450170938.
/bsuhome/alexanderemert/Research/Star-Formation-Research-Project-2026/pipeline/scripts/optuna/final_preds_and_models/optuna_search_mult_quant_reg.py:75: UserWarning: The distribution is specified by [0.1, 5] and step=0.25, but the range is not divisible by `step`. It will be replaced with [0.1, 4.85].
  error_threshold = trial.suggest_float("error_threshold", 0.1, 5, step=0.25)
[I 2026-07-20 14:57:36,000] Trial 35 finished with value: -1.4895231353056004 and parameters: {'error_threshold': 4.35, 'scalers': 'standard', 'ratios': 'norm_ratio', 'imputers': 'mean', 'n_estimators': 1550, 'learning_rate': 0.00023379683265919952, 'max_depth': 11, 'min_child_weight': 2, 'subsample': 1.0, 'colsample_bytree': 1.0, 'colsample_bylevel': 0.6, 'reg_alpha': 0.2711085076674504, 'reg_lambda': 0.010673104426718209, 'gamma': 0.1745257046479772}. Best is trial 10 with value: -1.6531965450170938.
/bsuhome/alexanderemert/Research/Star-Formation-Research-Project-2026/pipeline/scripts/optuna/final_preds_and_models/optuna_search_mult_quant_reg.py:75: UserWarning: The distribution is specified by [0.1, 5] and step=0.25, but the range is not divisible by `step`. It will be replaced with [0.1, 4.85].
  error_threshold = trial.suggest_float("error_threshold", 0.1, 5, step=0.25)
[I 2026-07-20 14:57:36,313] Trial 41 finished with value: -1.6275054319773306 and parameters: {'error_threshold': 1.6, 'scalers': 'robust', 'ratios': 'norm_ratio', 'imputers': 'mean', 'n_estimators': 350, 'learning_rate': 0.0001883208818784647, 'max_depth': 8, 'min_child_weight': 2, 'subsample': 1.0, 'colsample_bytree': 1.0, 'colsample_bylevel': 0.5, 'reg_alpha': 0.2388347049917798, 'reg_lambda': 0.003730541970136591, 'gamma': 3.8395702809984873}. Best is trial 10 with value: -1.6531965450170938.
/bsuhome/alexanderemert/Research/Star-Formation-Research-Project-2026/pipeline/scripts/optuna/final_preds_and_models/optuna_search_mult_quant_reg.py:75: UserWarning: The distribution is specified by [0.1, 5] and step=0.25, but the range is not divisible by `step`. It will be replaced with [0.1, 4.85].
  error_threshold = trial.suggest_float("error_threshold", 0.1, 5, step=0.25)
[I 2026-07-20 14:57:36,568] Trial 42 finished with value: -1.5663827404442907 and parameters: {'error_threshold': 1.6, 'scalers': 'robust', 'ratios': 'norm_ratio', 'imputers': 'mean', 'n_estimators': 350, 'learning_rate': 0.0007347528928294661, 'max_depth': 8, 'min_child_weight': 3, 'subsample': 1.0, 'colsample_bytree': 1.0, 'colsample_bylevel': 0.8, 'reg_alpha': 0.4191816179162551, 'reg_lambda': 0.005374647277502743, 'gamma': 11.636056103528627}. Best is trial 10 with value: -1.6531965450170938.
/bsuhome/alexanderemert/Research/Star-Formation-Research-Project-2026/pipeline/scripts/optuna/final_preds_and_models/optuna_search_mult_quant_reg.py:75: UserWarning: The distribution is specified by [0.1, 5] and step=0.25, but the range is not divisible by `step`. It will be replaced with [0.1, 4.85].
  error_threshold = trial.suggest_float("error_threshold", 0.1, 5, step=0.25)
[I 2026-07-20 14:57:37,153] Trial 43 finished with value: -1.5694590171790033 and parameters: {'error_threshold': 1.35, 'scalers': 'robust', 'ratios': 'norm_ratio', 'imputers': 'mean', 'n_estimators': 300, 'learning_rate': 0.0006280533320109264, 'max_depth': 5, 'min_child_weight': 3, 'subsample': 0.9, 'colsample_bytree': 1.0, 'colsample_bylevel': 0.8, 'reg_alpha': 0.03533569114341967, 'reg_lambda': 0.001129951105850344, 'gamma': 2.9472405810687934}. Best is trial 10 with value: -1.6531965450170938.
/bsuhome/alexanderemert/Research/Star-Formation-Research-Project-2026/pipeline/scripts/optuna/final_preds_and_models/optuna_search_mult_quant_reg.py:75: UserWarning: The distribution is specified by [0.1, 5] and step=0.25, but the range is not divisible by `step`. It will be replaced with [0.1, 4.85].
  error_threshold = trial.suggest_float("error_threshold", 0.1, 5, step=0.25)
[I 2026-07-20 14:57:37,371] Trial 44 finished with value: -1.5786581903115415 and parameters: {'error_threshold': 1.35, 'scalers': 'standard', 'ratios': 'norm_ratio', 'imputers': 'mean', 'n_estimators': 250, 'learning_rate': 0.0008624626210449254, 'max_depth': 5, 'min_child_weight': 3, 'subsample': 0.9, 'colsample_bytree': 1.0, 'colsample_bylevel': 0.8, 'reg_alpha': 0.03659029186329004, 'reg_lambda': 0.0013100870129823534, 'gamma': 10.377144360752842}. Best is trial 10 with value: -1.6531965450170938.
/bsuhome/alexanderemert/Research/Star-Formation-Research-Project-2026/pipeline/scripts/optuna/final_preds_and_models/optuna_search_mult_quant_reg.py:75: UserWarning: The distribution is specified by [0.1, 5] and step=0.25, but the range is not divisible by `step`. It will be replaced with [0.1, 4.85].
  error_threshold = trial.suggest_float("error_threshold", 0.1, 5, step=0.25)
[I 2026-07-20 14:57:41,780] Trial 45 finished with value: -1.5370601961909829 and parameters: {'error_threshold': 1.6, 'scalers': 'standard', 'ratios': 'norm_ratio', 'imputers': 'mean', 'n_estimators': 700, 'learning_rate': 0.0006172461848852027, 'max_depth': 5, 'min_child_weight': 7, 'subsample': 0.5, 'colsample_bytree': 1.0, 'colsample_bylevel': 0.5, 'reg_alpha': 0.04030671440995603, 'reg_lambda': 0.0007866673833386511, 'gamma': 11.347629131702359}. Best is trial 10 with value: -1.6531965450170938.
/bsuhome/alexanderemert/Research/Star-Formation-Research-Project-2026/pipeline/scripts/optuna/final_preds_and_models/optuna_search_mult_quant_reg.py:75: UserWarning: The distribution is specified by [0.1, 5] and step=0.25, but the range is not divisible by `step`. It will be replaced with [0.1, 4.85].
  error_threshold = trial.suggest_float("error_threshold", 0.1, 5, step=0.25)
[I 2026-07-20 14:57:42,099] Trial 46 finished with value: -1.5268684108350208 and parameters: {'error_threshold': 1.35, 'scalers': 'standard', 'ratios': 'norm_ratio', 'imputers': 'mean', 'n_estimators': 650, 'learning_rate': 0.0006352438969608943, 'max_depth': 4, 'min_child_weight': 7, 'subsample': 0.5, 'colsample_bytree': 1.0, 'colsample_bylevel': 0.5, 'reg_alpha': 0.03538393962066158, 'reg_lambda': 1.912011170399577e-05, 'gamma': 5.65897478915664}. Best is trial 10 with value: -1.6531965450170938.
/bsuhome/alexanderemert/Research/Star-Formation-Research-Project-2026/pipeline/scripts/optuna/final_preds_and_models/optuna_search_mult_quant_reg.py:75: UserWarning: The distribution is specified by [0.1, 5] and step=0.25, but the range is not divisible by `step`. It will be replaced with [0.1, 4.85].
  error_threshold = trial.suggest_float("error_threshold", 0.1, 5, step=0.25)
[I 2026-07-20 14:57:44,553] Trial 47 finished with value: -1.5536005420836474 and parameters: {'error_threshold': 1.35, 'scalers': 'standard', 'ratios': 'norm_ratio', 'imputers': 'mean', 'n_estimators': 650, 'learning_rate': 0.0005870969523593376, 'max_depth': 5, 'min_child_weight': 7, 'subsample': 0.5, 'colsample_bytree': 1.0, 'colsample_bylevel': 0.5, 'reg_alpha': 26.116076131774104, 'reg_lambda': 0.6129693002775599, 'gamma': 8.621186299080676}. Best is trial 10 with value: -1.6531965450170938.
/bsuhome/alexanderemert/Research/Star-Formation-Research-Project-2026/pipeline/scripts/optuna/final_preds_and_models/optuna_search_mult_quant_reg.py:75: UserWarning: The distribution is specified by [0.1, 5] and step=0.25, but the range is not divisible by `step`. It will be replaced with [0.1, 4.85].
  error_threshold = trial.suggest_float("error_threshold", 0.1, 5, step=0.25)
