[I 2026-07-21 09:59:23,155] Trial 284 finished with value: -0.5931880391885368 and parameters: {'error_threshold': 1.85, 'scalers': 'none', 'ratios': 'log_ratio', 'imputers': 'median', 'n_estimators': 2600, 'learning_rate': 0.007185447480636717, 'max_depth': 3, 'min_child_weight': 6, 'subsample': 0.6, 'colsample_bytree': 0.6, 'colsample_bylevel': 0.8, 'reg_alpha': 1.2783875846379275e-05, 'reg_lambda': 2.998553513742472e-06, 'gamma': 4.817102729780477e-05}. Best is trial 117 with value: -0.5901931848144322.
/bsuhome/alexanderemert/Research/Star-Formation-Research-Project-2026/pipeline/scripts/optuna/final_preds_and_models/optuna_search_mult_quant_reg.py:161: UserWarning: The distribution is specified by [0.1, 5] and step=0.25, but the range is not divisible by `step`. It will be replaced with [0.1, 4.85].
  error_threshold = trial.suggest_float("error_threshold", 0.1, 5, step=0.25)
[I 2026-07-21 09:59:24,988] Trial 285 finished with value: -0.5929550220161723 and parameters: {'error_threshold': 1.85, 'scalers': 'none', 'ratios': 'log_ratio', 'imputers': 'median', 'n_estimators': 2600, 'learning_rate': 0.007281270019417738, 'max_depth': 3, 'min_child_weight': 6, 'subsample': 0.6, 'colsample_bytree': 0.6, 'colsample_bylevel': 0.8, 'reg_alpha': 1.0496334246222167e-05, 'reg_lambda': 3.341662979210728e-06, 'gamma': 4.5220312526963304e-05}. Best is trial 117 with value: -0.5901931848144322.
/bsuhome/alexanderemert/Research/Star-Formation-Research-Project-2026/pipeline/scripts/optuna/final_preds_and_models/optuna_search_mult_quant_reg.py:161: UserWarning: The distribution is specified by [0.1, 5] and step=0.25, but the range is not divisible by `step`. It will be replaced with [0.1, 4.85].
  error_threshold = trial.suggest_float("error_threshold", 0.1, 5, step=0.25)
[I 2026-07-21 09:59:26,816] Trial 286 finished with value: -0.5940294540920004 and parameters: {'error_threshold': 1.85, 'scalers': 'none', 'ratios': 'log_ratio', 'imputers': 'median', 'n_estimators': 2600, 'learning_rate': 0.005604000039614297, 'max_depth': 3, 'min_child_weight': 6, 'subsample': 0.6, 'colsample_bytree': 0.6, 'colsample_bylevel': 0.8, 'reg_alpha': 1.2388169897198846e-05, 'reg_lambda': 1.271561876544311e-06, 'gamma': 4.1915600898004885e-05}. Best is trial 117 with value: -0.5901931848144322.
/bsuhome/alexanderemert/Research/Star-Formation-Research-Project-2026/pipeline/scripts/optuna/final_preds_and_models/optuna_search_mult_quant_reg.py:161: UserWarning: The distribution is specified by [0.1, 5] and step=0.25, but the range is not divisible by `step`. It will be replaced with [0.1, 4.85].
  error_threshold = trial.suggest_float("error_threshold", 0.1, 5, step=0.25)
[I 2026-07-21 09:59:28,644] Trial 287 finished with value: -0.5928888189158618 and parameters: {'error_threshold': 1.85, 'scalers': 'none', 'ratios': 'log_ratio', 'imputers': 'median', 'n_estimators': 2600, 'learning_rate': 0.0069720670750582645, 'max_depth': 3, 'min_child_weight': 6, 'subsample': 0.6, 'colsample_bytree': 0.6, 'colsample_bylevel': 0.8, 'reg_alpha': 1.0309586865635258e-05, 'reg_lambda': 3.375318274369997e-06, 'gamma': 4.171355816484122e-05}. Best is trial 117 with value: -0.5901931848144322.
/bsuhome/alexanderemert/Research/Star-Formation-Research-Project-2026/pipeline/scripts/optuna/final_preds_and_models/optuna_search_mult_quant_reg.py:161: UserWarning: The distribution is specified by [0.1, 5] and step=0.25, but the range is not divisible by `step`. It will be replaced with [0.1, 4.85].
  error_threshold = trial.suggest_float("error_threshold", 0.1, 5, step=0.25)
[I 2026-07-21 09:59:30,465] Trial 288 finished with value: -0.5929495586874274 and parameters: {'error_threshold': 1.85, 'scalers': 'none', 'ratios': 'log_ratio', 'imputers': 'median', 'n_estimators': 2600, 'learning_rate': 0.007050698487443064, 'max_depth': 3, 'min_child_weight': 6, 'subsample': 0.6, 'colsample_bytree': 0.6, 'colsample_bylevel': 0.8, 'reg_alpha': 1.0461968751862878e-05, 'reg_lambda': 1.169539748855316e-06, 'gamma': 4.217299144642753e-05}. Best is trial 117 with value: -0.5901931848144322.
/bsuhome/alexanderemert/Research/Star-Formation-Research-Project-2026/pipeline/scripts/optuna/final_preds_and_models/optuna_search_mult_quant_reg.py:161: UserWarning: The distribution is specified by [0.1, 5] and step=0.25, but the range is not divisible by `step`. It will be replaced with [0.1, 4.85].
  error_threshold = trial.suggest_float("error_threshold", 0.1, 5, step=0.25)
[I 2026-07-21 09:59:33,137] Trial 289 finished with value: -0.5905424471284374 and parameters: {'error_threshold': 1.85, 'scalers': 'none', 'ratios': 'log_ratio', 'imputers': 'median', 'n_estimators': 2600, 'learning_rate': 0.005468618239019185, 'max_depth': 4, 'min_child_weight': 6, 'subsample': 0.6, 'colsample_bytree': 0.6, 'colsample_bylevel': 0.8, 'reg_alpha': 1.007207651375351e-05, 'reg_lambda': 5.374491357415676e-06, 'gamma': 4.42910724359317e-05}. Best is trial 117 with value: -0.5901931848144322.
/bsuhome/alexanderemert/Research/Star-Formation-Research-Project-2026/pipeline/scripts/optuna/final_preds_and_models/optuna_search_mult_quant_reg.py:161: UserWarning: The distribution is specified by [0.1, 5] and step=0.25, but the range is not divisible by `step`. It will be replaced with [0.1, 4.85].
  error_threshold = trial.suggest_float("error_threshold", 0.1, 5, step=0.25)
[I 2026-07-21 09:59:35,801] Trial 290 finished with value: -0.5910493845659542 and parameters: {'error_threshold': 1.85, 'scalers': 'none', 'ratios': 'log_ratio', 'imputers': 'median', 'n_estimators': 2600, 'learning_rate': 0.00553916700331801, 'max_depth': 4, 'min_child_weight': 6, 'subsample': 0.6, 'colsample_bytree': 0.6, 'colsample_bylevel': 0.8, 'reg_alpha': 1.085013266720854e-05, 'reg_lambda': 5.139939086366244e-06, 'gamma': 1.4040312230333388e-05}. Best is trial 117 with value: -0.5901931848144322.
/bsuhome/alexanderemert/Research/Star-Formation-Research-Project-2026/pipeline/scripts/optuna/final_preds_and_models/optuna_search_mult_quant_reg.py:161: UserWarning: The distribution is specified by [0.1, 5] and step=0.25, but the range is not divisible by `step`. It will be replaced with [0.1, 4.85].
  error_threshold = trial.suggest_float("error_threshold", 0.1, 5, step=0.25)
[I 2026-07-21 09:59:38,416] Trial 291 finished with value: -0.5912706102200361 and parameters: {'error_threshold': 1.85, 'scalers': 'none', 'ratios': 'log_ratio', 'imputers': 'median', 'n_estimators': 2550, 'learning_rate': 0.005773592231496943, 'max_depth': 4, 'min_child_weight': 6, 'subsample': 0.6, 'colsample_bytree': 0.6, 'colsample_bylevel': 0.8, 'reg_alpha': 2.5449093715013265e-05, 'reg_lambda': 1.2775398263442063e-06, 'gamma': 1.5548409451311002e-05}. Best is trial 117 with value: -0.5901931848144322.
/bsuhome/alexanderemert/Research/Star-Formation-Research-Project-2026/pipeline/scripts/optuna/final_preds_and_models/optuna_search_mult_quant_reg.py:161: UserWarning: The distribution is specified by [0.1, 5] and step=0.25, but the range is not divisible by `step`. It will be replaced with [0.1, 4.85].
  error_threshold = trial.suggest_float("error_threshold", 0.1, 5, step=0.25)
[I 2026-07-21 09:59:41,033] Trial 292 finished with value: -0.5908408314687995 and parameters: {'error_threshold': 1.85, 'scalers': 'none', 'ratios': 'log_ratio', 'imputers': 'mean', 'n_estimators': 2550, 'learning_rate': 0.005538429032851412, 'max_depth': 4, 'min_child_weight': 6, 'subsample': 0.6, 'colsample_bytree': 0.6, 'colsample_bylevel': 0.8, 'reg_alpha': 1.0602593582409478e-05, 'reg_lambda': 1.2231171696958963e-06, 'gamma': 1.3863888722488316e-05}. Best is trial 117 with value: -0.5901931848144322.
/bsuhome/alexanderemert/Research/Star-Formation-Research-Project-2026/pipeline/scripts/optuna/final_preds_and_models/optuna_search_mult_quant_reg.py:161: UserWarning: The distribution is specified by [0.1, 5] and step=0.25, but the range is not divisible by `step`. It will be replaced with [0.1, 4.85].
  error_threshold = trial.suggest_float("error_threshold", 0.1, 5, step=0.25)
[I 2026-07-21 09:59:43,652] Trial 293 finished with value: -0.5905200516593935 and parameters: {'error_threshold': 1.85, 'scalers': 'none', 'ratios': 'log_ratio', 'imputers': 'mean', 'n_estimators': 2550, 'learning_rate': 0.0055227699873829795, 'max_depth': 4, 'min_child_weight': 6, 'subsample': 0.6, 'colsample_bytree': 0.6, 'colsample_bylevel': 0.8, 'reg_alpha': 2.675849337681565e-05, 'reg_lambda': 1.3591408064881066e-06, 'gamma': 1.3321130282843477e-05}. Best is trial 117 with value: -0.5901931848144322.
/bsuhome/alexanderemert/Research/Star-Formation-Research-Project-2026/pipeline/scripts/optuna/final_preds_and_models/optuna_search_mult_quant_reg.py:161: UserWarning: The distribution is specified by [0.1, 5] and step=0.25, but the range is not divisible by `step`. It will be replaced with [0.1, 4.85].
  error_threshold = trial.suggest_float("error_threshold", 0.1, 5, step=0.25)
[I 2026-07-21 09:59:46,272] Trial 294 finished with value: -0.591004050803765 and parameters: {'error_threshold': 1.85, 'scalers': 'none', 'ratios': 'log_ratio', 'imputers': 'median', 'n_estimators': 2550, 'learning_rate': 0.005596960378085775, 'max_depth': 4, 'min_child_weight': 6, 'subsample': 0.6, 'colsample_bytree': 0.6, 'colsample_bylevel': 0.8, 'reg_alpha': 2.5213336357231043e-05, 'reg_lambda': 5.5805922150330485e-06, 'gamma': 1.3503699132838578e-05}. Best is trial 117 with value: -0.5901931848144322.
/bsuhome/alexanderemert/Research/Star-Formation-Research-Project-2026/pipeline/scripts/optuna/final_preds_and_models/optuna_search_mult_quant_reg.py:161: UserWarning: The distribution is specified by [0.1, 5] and step=0.25, but the range is not divisible by `step`. It will be replaced with [0.1, 4.85].
  error_threshold = trial.suggest_float("error_threshold", 0.1, 5, step=0.25)
[I 2026-07-21 09:59:48,718] Trial 295 finished with value: -0.5914973862777552 and parameters: {'error_threshold': 1.85, 'scalers': 'none', 'ratios': 'log_ratio', 'imputers': 'median', 'n_estimators': 2350, 'learning_rate': 0.005462684505967826, 'max_depth': 4, 'min_child_weight': 6, 'subsample': 0.6, 'colsample_bytree': 0.6, 'colsample_bylevel': 0.8, 'reg_alpha': 2.565117823166394e-05, 'reg_lambda': 4.715897753674117e-06, 'gamma': 1.4873817682652722e-05}. Best is trial 117 with value: -0.5901931848144322.
/bsuhome/alexanderemert/Research/Star-Formation-Research-Project-2026/pipeline/scripts/optuna/final_preds_and_models/optuna_search_mult_quant_reg.py:161: UserWarning: The distribution is specified by [0.1, 5] and step=0.25, but the range is not divisible by `step`. It will be replaced with [0.1, 4.85].
  error_threshold = trial.suggest_float("error_threshold", 0.1, 5, step=0.25)
[I 2026-07-21 09:59:51,191] Trial 296 finished with value: -0.5912787147041814 and parameters: {'error_threshold': 1.85, 'scalers': 'none', 'ratios': 'log_ratio', 'imputers': 'mean', 'n_estimators': 2350, 'learning_rate': 0.005524129777405836, 'max_depth': 4, 'min_child_weight': 6, 'subsample': 0.6, 'colsample_bytree': 0.6, 'colsample_bylevel': 0.8, 'reg_alpha': 2.4450650176194677e-05, 'reg_lambda': 6.064313735669109e-06, 'gamma': 1.281566556304104e-05}. Best is trial 117 with value: -0.5901931848144322.
/bsuhome/alexanderemert/Research/Star-Formation-Research-Project-2026/pipeline/scripts/optuna/final_preds_and_models/optuna_search_mult_quant_reg.py:161: UserWarning: The distribution is specified by [0.1, 5] and step=0.25, but the range is not divisible by `step`. It will be replaced with [0.1, 4.85].
  error_threshold = trial.suggest_float("error_threshold", 0.1, 5, step=0.25)
[I 2026-07-21 09:59:53,801] Trial 297 finished with value: -0.591060019824777 and parameters: {'error_threshold': 1.85, 'scalers': 'none', 'ratios': 'log_ratio', 'imputers': 'mean', 'n_estimators': 2500, 'learning_rate': 0.00546934795899108, 'max_depth': 4, 'min_child_weight': 6, 'subsample': 0.6, 'colsample_bytree': 0.6, 'colsample_bylevel': 0.8, 'reg_alpha': 2.5971912704374344e-05, 'reg_lambda': 5.537579885225714e-06, 'gamma': 1.2865110199120985e-05}. Best is trial 117 with value: -0.5901931848144322.
/bsuhome/alexanderemert/Research/Star-Formation-Research-Project-2026/pipeline/scripts/optuna/final_preds_and_models/optuna_search_mult_quant_reg.py:161: UserWarning: The distribution is specified by [0.1, 5] and step=0.25, but the range is not divisible by `step`. It will be replaced with [0.1, 4.85].
  error_threshold = trial.suggest_float("error_threshold", 0.1, 5, step=0.25)
[I 2026-07-21 09:59:56,426] Trial 298 finished with value: -0.5908265726014069 and parameters: {'error_threshold': 1.85, 'scalers': 'none', 'ratios': 'log_ratio', 'imputers': 'mean', 'n_estimators': 2550, 'learning_rate': 0.005586702289712534, 'max_depth': 4, 'min_child_weight': 6, 'subsample': 0.6, 'colsample_bytree': 0.6, 'colsample_bylevel': 0.8, 'reg_alpha': 5.214531009332452e-06, 'reg_lambda': 5.624853245657623e-06, 'gamma': 1.3729554224388278e-05}. Best is trial 117 with value: -0.5901931848144322.
/bsuhome/alexanderemert/Research/Star-Formation-Research-Project-2026/pipeline/scripts/optuna/final_preds_and_models/optuna_search_mult_quant_reg.py:161: UserWarning: The distribution is specified by [0.1, 5] and step=0.25, but the range is not divisible by `step`. It will be replaced with [0.1, 4.85].
  error_threshold = trial.suggest_float("error_threshold", 0.1, 5, step=0.25)
[I 2026-07-21 09:59:59,038] Trial 299 finished with value: -0.5910954795412396 and parameters: {'error_threshold': 1.85, 'scalers': 'none', 'ratios': 'log_ratio', 'imputers': 'median', 'n_estimators': 2550, 'learning_rate': 0.005621923271545649, 'max_depth': 4, 'min_child_weight': 6, 'subsample': 0.6, 'colsample_bytree': 0.6, 'colsample_bylevel': 0.8, 'reg_alpha': 5.5582277133435535e-05, 'reg_lambda': 4.903796225391345e-06, 'gamma': 2.4692140312138458e-05}. Best is trial 117 with value: -0.5901931848144322.
/bsuhome/alexanderemert/Research/Star-Formation-Research-Project-2026/pipeline/scripts/optuna/final_preds_and_models/optuna_search_mult_quant_reg.py:161: UserWarning: The distribution is specified by [0.1, 5] and step=0.25, but the range is not divisible by `step`. It will be replaced with [0.1, 4.85].
  error_threshold = trial.suggest_float("error_threshold", 0.1, 5, step=0.25)
[I 2026-07-21 10:00:01,485] Trial 300 finished with value: -0.5915786201332632 and parameters: {'error_threshold': 1.85, 'scalers': 'none', 'ratios': 'log_ratio', 'imputers': 'mean', 'n_estimators': 2350, 'learning_rate': 0.005606901560080073, 'max_depth': 4, 'min_child_weight': 6, 'subsample': 0.6, 'colsample_bytree': 0.6, 'colsample_bylevel': 0.8, 'reg_alpha': 9.859809151268375e-06, 'reg_lambda': 5.59484124379586e-06, 'gamma': 1.4275103452428393e-05}. Best is trial 117 with value: -0.5901931848144322.
/bsuhome/alexanderemert/Research/Star-Formation-Research-Project-2026/pipeline/scripts/optuna/final_preds_and_models/optuna_search_mult_quant_reg.py:161: UserWarning: The distribution is specified by [0.1, 5] and step=0.25, but the range is not divisible by `step`. It will be replaced with [0.1, 4.85].
  error_threshold = trial.suggest_float("error_threshold", 0.1, 5, step=0.25)
[I 2026-07-21 10:00:04,597] Trial 301 finished with value: -1.7194493501933437 and parameters: {'error_threshold': 1.85, 'scalers': 'none', 'ratios': 'log_ratio', 'imputers': 'mean', 'n_estimators': 2350, 'learning_rate': 0.00019978434836587022, 'max_depth': 4, 'min_child_weight': 6, 'subsample': 0.6, 'colsample_bytree': 0.6, 'colsample_bylevel': 0.8, 'reg_alpha': 5.7855659740770296e-05, 'reg_lambda': 5.661354304274237e-06, 'gamma': 1.3296234669868477e-05}. Best is trial 117 with value: -0.5901931848144322.
/bsuhome/alexanderemert/Research/Star-Formation-Research-Project-2026/pipeline/scripts/optuna/final_preds_and_models/optuna_search_mult_quant_reg.py:161: UserWarning: The distribution is specified by [0.1, 5] and step=0.25, but the range is not divisible by `step`. It will be replaced with [0.1, 4.85].
  error_threshold = trial.suggest_float("error_threshold", 0.1, 5, step=0.25)
[I 2026-07-21 10:00:06,981] Trial 302 finished with value: -0.5917531632606451 and parameters: {'error_threshold': 1.85, 'scalers': 'none', 'ratios': 'log_ratio', 'imputers': 'mean', 'n_estimators': 2350, 'learning_rate': 0.009004007123062712, 'max_depth': 4, 'min_child_weight': 6, 'subsample': 0.6, 'colsample_bytree': 0.6, 'colsample_bylevel': 0.8, 'reg_alpha': 6.132196620619676e-05, 'reg_lambda': 6.176817792968581e-06, 'gamma': 1.2411834288753476e-05}. Best is trial 117 with value: -0.5901931848144322.
/bsuhome/alexanderemert/Research/Star-Formation-Research-Project-2026/pipeline/scripts/optuna/final_preds_and_models/optuna_search_mult_quant_reg.py:161: UserWarning: The distribution is specified by [0.1, 5] and step=0.25, but the range is not divisible by `step`. It will be replaced with [0.1, 4.85].
  error_threshold = trial.suggest_float("error_threshold", 0.1, 5, step=0.25)
[I 2026-07-21 10:00:09,699] Trial 303 finished with value: -0.5954072623896155 and parameters: {'error_threshold': 1.85, 'scalers': 'none', 'ratios': 'log_ratio', 'imputers': 'mean', 'n_estimators': 2500, 'learning_rate': 0.003493059233596075, 'max_depth': 4, 'min_child_weight': 6, 'subsample': 0.6, 'colsample_bytree': 0.6, 'colsample_bylevel': 0.8, 'reg_alpha': 6.639999589023952e-05, 'reg_lambda': 5.7203873141738245e-06, 'gamma': 2.6286353319505965e-05}. Best is trial 117 with value: -0.5901931848144322.
/bsuhome/alexanderemert/Research/Star-Formation-Research-Project-2026/pipeline/scripts/optuna/final_preds_and_models/optuna_search_mult_quant_reg.py:161: UserWarning: The distribution is specified by [0.1, 5] and step=0.25, but the range is not divisible by `step`. It will be replaced with [0.1, 4.85].
  error_threshold = trial.suggest_float("error_threshold", 0.1, 5, step=0.25)
[I 2026-07-21 10:00:12,205] Trial 304 finished with value: -0.5919729940021637 and parameters: {'error_threshold': 1.85, 'scalers': 'none', 'ratios': 'log_ratio', 'imputers': 'mean', 'n_estimators': 2500, 'learning_rate': 0.008852521552066128, 'max_depth': 4, 'min_child_weight': 6, 'subsample': 0.6, 'colsample_bytree': 0.6, 'colsample_bylevel': 0.8, 'reg_alpha': 5.2678329903468645e-05, 'reg_lambda': 5.702767679061504e-06, 'gamma': 2.76249100542101e-05}. Best is trial 117 with value: -0.5901931848144322.
/bsuhome/alexanderemert/Research/Star-Formation-Research-Project-2026/pipeline/scripts/optuna/final_preds_and_models/optuna_search_mult_quant_reg.py:161: UserWarning: The distribution is specified by [0.1, 5] and step=0.25, but the range is not divisible by `step`. It will be replaced with [0.1, 4.85].
  error_threshold = trial.suggest_float("error_threshold", 0.1, 5, step=0.25)
[I 2026-07-21 10:00:14,902] Trial 305 finished with value: -0.5951184147165277 and parameters: {'error_threshold': 2.1, 'scalers': 'none', 'ratios': 'log_ratio', 'imputers': 'mean', 'n_estimators': 2500, 'learning_rate': 0.0035994779684810356, 'max_depth': 4, 'min_child_weight': 6, 'subsample': 0.6, 'colsample_bytree': 0.6, 'colsample_bylevel': 0.8, 'reg_alpha': 5.564320526573366e-05, 'reg_lambda': 8.517019518621531e-06, 'gamma': 2.7443242459162903e-05}. Best is trial 117 with value: -0.5901931848144322.
/bsuhome/alexanderemert/Research/Star-Formation-Research-Project-2026/pipeline/scripts/optuna/final_preds_and_models/optuna_search_mult_quant_reg.py:161: UserWarning: The distribution is specified by [0.1, 5] and step=0.25, but the range is not divisible by `step`. It will be replaced with [0.1, 4.85].
  error_threshold = trial.suggest_float("error_threshold", 0.1, 5, step=0.25)
[I 2026-07-21 10:00:17,456] Trial 306 finished with value: -0.5921583218967895 and parameters: {'error_threshold': 2.1, 'scalers': 'none', 'ratios': 'log_ratio', 'imputers': 'mean', 'n_estimators': 2500, 'learning_rate': 0.008984696134626201, 'max_depth': 4, 'min_child_weight': 6, 'subsample': 0.6, 'colsample_bytree': 0.6, 'colsample_bylevel': 0.8, 'reg_alpha': 4.527118529611953e-06, 'reg_lambda': 8.41216911877531e-06, 'gamma': 2.2068700922125333e-05}. Best is trial 117 with value: -0.5901931848144322.
/bsuhome/alexanderemert/Research/Star-Formation-Research-Project-2026/pipeline/scripts/optuna/final_preds_and_models/optuna_search_mult_quant_reg.py:161: UserWarning: The distribution is specified by [0.1, 5] and step=0.25, but the range is not divisible by `step`. It will be replaced with [0.1, 4.85].
  error_threshold = trial.suggest_float("error_threshold", 0.1, 5, step=0.25)
[I 2026-07-21 10:00:19,976] Trial 307 finished with value: -0.5914328966444228 and parameters: {'error_threshold': 2.1, 'scalers': 'none', 'ratios': 'log_ratio', 'imputers': 'mean', 'n_estimators': 2500, 'learning_rate': 0.008728747058249131, 'max_depth': 4, 'min_child_weight': 6, 'subsample': 0.6, 'colsample_bytree': 0.6, 'colsample_bylevel': 0.8, 'reg_alpha': 4.048632122613114e-06, 'reg_lambda': 1.1131448545529982e-06, 'gamma': 1.1991766502641446e-05}. Best is trial 117 with value: -0.5901931848144322.
/bsuhome/alexanderemert/Research/Star-Formation-Research-Project-2026/pipeline/scripts/optuna/final_preds_and_models/optuna_search_mult_quant_reg.py:161: UserWarning: The distribution is specified by [0.1, 5] and step=0.25, but the range is not divisible by `step`. It will be replaced with [0.1, 4.85].
  error_threshold = trial.suggest_float("error_threshold", 0.1, 5, step=0.25)
