[I 2026-07-20 12:31:01,090] Trial 226 finished with value: -0.27471438149040944 and parameters: {'error_threshold': 1.0, 'scalers': 'none', 'ratios': 'norm_ratio', 'imputers': 'mean', 'n_estimators': 500, 'learning_rate': 0.03993040342753914, 'max_depth': 11, 'min_child_weight': 4, 'subsample': 0.7, 'colsample_bytree': 0.8, 'colsample_bylevel': 1.0, 'reg_alpha': 39.4117344614073, 'reg_lambda': 0.3449135842317623, 'gamma': 33.276350129426106}. Best is trial 69 with value: -0.3911874830873789.
[I 2026-07-20 12:31:01,387] Trial 227 finished with value: -0.2740236070471385 and parameters: {'error_threshold': 1.0, 'scalers': 'none', 'ratios': 'norm_ratio', 'imputers': 'mean', 'n_estimators': 500, 'learning_rate': 0.03401447546801419, 'max_depth': 11, 'min_child_weight': 4, 'subsample': 0.7, 'colsample_bytree': 0.8, 'colsample_bylevel': 1.0, 'reg_alpha': 39.41809664751876, 'reg_lambda': 0.9480038161632696, 'gamma': 32.973456991245435}. Best is trial 69 with value: -0.3911874830873789.
[I 2026-07-20 12:31:01,757] Trial 228 finished with value: -0.3911192725745263 and parameters: {'error_threshold': 1.0, 'scalers': 'none', 'ratios': 'norm_ratio', 'imputers': 'mean', 'n_estimators': 500, 'learning_rate': 0.03560453841333694, 'max_depth': 11, 'min_child_weight': 4, 'subsample': 0.7, 'colsample_bytree': 0.8, 'colsample_bylevel': 1.0, 'reg_alpha': 98.40769698067471, 'reg_lambda': 1.1430876501655678, 'gamma': 97.63845002478232}. Best is trial 69 with value: -0.3911874830873789.
[I 2026-07-20 12:31:02,071] Trial 229 finished with value: -0.39111930109615284 and parameters: {'error_threshold': 1.0, 'scalers': 'none', 'ratios': 'norm_ratio', 'imputers': 'mean', 'n_estimators': 500, 'learning_rate': 0.03577655197389072, 'max_depth': 9, 'min_child_weight': 4, 'subsample': 0.7, 'colsample_bytree': 0.8, 'colsample_bylevel': 1.0, 'reg_alpha': 38.192165538836235, 'reg_lambda': 0.009655002386574954, 'gamma': 92.43438491800677}. Best is trial 69 with value: -0.3911874830873789.
[I 2026-07-20 12:31:02,369] Trial 230 finished with value: -0.3911197805030126 and parameters: {'error_threshold': 1.0, 'scalers': 'none', 'ratios': 'norm_ratio', 'imputers': 'mean', 'n_estimators': 500, 'learning_rate': 0.038587889970917534, 'max_depth': 11, 'min_child_weight': 4, 'subsample': 0.7, 'colsample_bytree': 0.8, 'colsample_bylevel': 1.0, 'reg_alpha': 38.20868325376529, 'reg_lambda': 0.06417115350952583, 'gamma': 95.88377073283877}. Best is trial 69 with value: -0.3911874830873789.
[I 2026-07-20 12:31:02,672] Trial 231 finished with value: -0.3911169395585166 and parameters: {'error_threshold': 1.0, 'scalers': 'none', 'ratios': 'norm_ratio', 'imputers': 'mean', 'n_estimators': 500, 'learning_rate': 0.026685020319607695, 'max_depth': 12, 'min_child_weight': 4, 'subsample': 0.7, 'colsample_bytree': 0.8, 'colsample_bylevel': 1.0, 'reg_alpha': 37.29249661384044, 'reg_lambda': 0.7434412120123715, 'gamma': 99.20648174204032}. Best is trial 69 with value: -0.3911874830873789.
[I 2026-07-20 12:31:03,037] Trial 232 finished with value: -0.3911197429069995 and parameters: {'error_threshold': 1.0, 'scalers': 'none', 'ratios': 'norm_ratio', 'imputers': 'mean', 'n_estimators': 500, 'learning_rate': 0.038343576889347517, 'max_depth': 11, 'min_child_weight': 4, 'subsample': 0.7, 'colsample_bytree': 0.8, 'colsample_bylevel': 1.0, 'reg_alpha': 39.46707678009584, 'reg_lambda': 4.087820973290927, 'gamma': 96.41831360359123}. Best is trial 69 with value: -0.3911874830873789.
[I 2026-07-20 12:31:14,334] Trial 233 finished with value: -0.3905392475785572 and parameters: {'error_threshold': 1.0, 'scalers': 'none', 'ratios': 'norm_ratio', 'imputers': 'mean', 'n_estimators': 2700, 'learning_rate': 0.016406220434731618, 'max_depth': 12, 'min_child_weight': 4, 'subsample': 0.7, 'colsample_bytree': 0.8, 'colsample_bylevel': 1.0, 'reg_alpha': 38.496744605480195, 'reg_lambda': 0.011687132840471272, 'gamma': 92.9796097054051}. Best is trial 69 with value: -0.3911874830873789.
[I 2026-07-20 12:31:15,042] Trial 235 finished with value: -0.3908129432637666 and parameters: {'error_threshold': 1.0, 'scalers': 'none', 'ratios': 'norm_ratio', 'imputers': 'mean', 'n_estimators': 550, 'learning_rate': 0.015771080011298046, 'max_depth': 9, 'min_child_weight': 4, 'subsample': 0.7, 'colsample_bytree': 0.8, 'colsample_bylevel': 1.0, 'reg_alpha': 41.12676458721942, 'reg_lambda': 0.008603893272348525, 'gamma': 88.56187939853444}. Best is trial 69 with value: -0.3911874830873789.
[I 2026-07-20 12:31:18,789] Trial 239 finished with value: -0.32946984392525863 and parameters: {'error_threshold': 1.0, 'scalers': 'none', 'ratios': 'norm_ratio', 'imputers': 'mean', 'n_estimators': 550, 'learning_rate': 0.05819693627370217, 'max_depth': 9, 'min_child_weight': 4, 'subsample': 0.7, 'colsample_bytree': 0.8, 'colsample_bylevel': 1.0, 'reg_alpha': 7.890365774318439e-06, 'reg_lambda': 0.01109876936850164, 'gamma': 96.74273895718427}. Best is trial 69 with value: -0.3911874830873789.
[I 2026-07-20 12:31:19,116] Trial 237 finished with value: -0.22040672617901733 and parameters: {'error_threshold': 1.0, 'scalers': 'none', 'ratios': 'norm_ratio', 'imputers': 'mean', 'n_estimators': 550, 'learning_rate': 0.005457927479177247, 'max_depth': 10, 'min_child_weight': 3, 'subsample': 0.7, 'colsample_bytree': 0.8, 'colsample_bylevel': 1.0, 'reg_alpha': 38.884633706029746, 'reg_lambda': 5.240249999000866, 'gamma': 0.380091174779832}. Best is trial 69 with value: -0.3911874830873789.
[I 2026-07-20 12:31:21,513] Trial 240 finished with value: -0.39109750689965234 and parameters: {'error_threshold': 1.0, 'scalers': 'none', 'ratios': 'norm_ratio', 'imputers': 'mean', 'n_estimators': 550, 'learning_rate': 0.059504793501258625, 'max_depth': 9, 'min_child_weight': 4, 'subsample': 0.7, 'colsample_bytree': 0.8, 'colsample_bylevel': 1.0, 'reg_alpha': 38.04086148346954, 'reg_lambda': 0.0605708353874957, 'gamma': 94.2496192988599}. Best is trial 69 with value: -0.3911874830873789.
[I 2026-07-20 12:31:23,455] Trial 234 finished with value: -0.391085821777637 and parameters: {'error_threshold': 1.0, 'scalers': 'none', 'ratios': 'norm_ratio', 'imputers': 'mean', 'n_estimators': 2750, 'learning_rate': 0.006082649968079943, 'max_depth': 9, 'min_child_weight': 4, 'subsample': 0.7, 'colsample_bytree': 0.8, 'colsample_bylevel': 1.0, 'reg_alpha': 41.89269844354475, 'reg_lambda': 0.007618522985094884, 'gamma': 97.53899227511509}. Best is trial 69 with value: -0.3911874830873789.
[I 2026-07-20 12:31:25,677] Trial 236 finished with value: -0.3910857859362839 and parameters: {'error_threshold': 1.5, 'scalers': 'none', 'ratios': 'norm_ratio', 'imputers': 'mean', 'n_estimators': 2750, 'learning_rate': 0.006319156712855703, 'max_depth': 11, 'min_child_weight': 4, 'subsample': 0.7, 'colsample_bytree': 0.8, 'colsample_bylevel': 1.0, 'reg_alpha': 43.3619830504149, 'reg_lambda': 0.5694614085079575, 'gamma': 92.17274734555284}. Best is trial 69 with value: -0.3911874830873789.
[I 2026-07-20 12:31:28,367] Trial 238 finished with value: -0.3910846639477872 and parameters: {'error_threshold': 1.5, 'scalers': 'none', 'ratios': 'norm_ratio', 'imputers': 'mean', 'n_estimators': 2800, 'learning_rate': 0.060111215611712704, 'max_depth': 9, 'min_child_weight': 4, 'subsample': 0.7, 'colsample_bytree': 0.8, 'colsample_bylevel': 1.0, 'reg_alpha': 42.1408396667659, 'reg_lambda': 0.030498761609845337, 'gamma': 92.03160412617127}. Best is trial 69 with value: -0.3911874830873789.
[I 2026-07-20 12:31:30,027] Trial 241 finished with value: -0.3910943384677858 and parameters: {'error_threshold': 1.0, 'scalers': 'none', 'ratios': 'norm_ratio', 'imputers': 'mean', 'n_estimators': 550, 'learning_rate': 0.04487503568899188, 'max_depth': 9, 'min_child_weight': 4, 'subsample': 0.7, 'colsample_bytree': 0.8, 'colsample_bylevel': 1.0, 'reg_alpha': 41.036404654178966, 'reg_lambda': 0.06052889621589337, 'gamma': 97.44844180870524}. Best is trial 69 with value: -0.3911874830873789.
[I 2026-07-20 12:31:30,695] Trial 242 finished with value: -0.39109209675326495 and parameters: {'error_threshold': 1.25, 'scalers': 'none', 'ratios': 'norm_ratio', 'imputers': 'mean', 'n_estimators': 550, 'learning_rate': 0.006442738800404808, 'max_depth': 10, 'min_child_weight': 4, 'subsample': 0.7, 'colsample_bytree': 0.8, 'colsample_bylevel': 1.0, 'reg_alpha': 39.486481371989754, 'reg_lambda': 4.925156997066281, 'gamma': 99.23912958325295}. Best is trial 69 with value: -0.3911874830873789.
[I 2026-07-20 12:31:31,676] Trial 243 finished with value: -0.39112045890786984 and parameters: {'error_threshold': 1.25, 'scalers': 'none', 'ratios': 'norm_ratio', 'imputers': 'mean', 'n_estimators': 500, 'learning_rate': 0.04383929566143932, 'max_depth': 11, 'min_child_weight': 4, 'subsample': 0.7, 'colsample_bytree': 0.8, 'colsample_bylevel': 1.0, 'reg_alpha': 40.87040146831943, 'reg_lambda': 0.17065541730697073, 'gamma': 95.47847691672027}. Best is trial 69 with value: -0.3911874830873789.
[I 2026-07-20 12:31:31,980] Trial 244 finished with value: -0.3911207276280341 and parameters: {'error_threshold': 1.25, 'scalers': 'none', 'ratios': 'norm_ratio', 'imputers': 'mean', 'n_estimators': 500, 'learning_rate': 0.0462510682955609, 'max_depth': 11, 'min_child_weight': 4, 'subsample': 0.7, 'colsample_bytree': 0.8, 'colsample_bylevel': 1.0, 'reg_alpha': 42.387409069835456, 'reg_lambda': 0.07006936789398772, 'gamma': 99.9470462660541}. Best is trial 69 with value: -0.3911874830873789.
[I 2026-07-20 12:31:32,961] Trial 245 finished with value: -0.30136511791205667 and parameters: {'error_threshold': 1.25, 'scalers': 'none', 'ratios': 'norm_ratio', 'imputers': 'mean', 'n_estimators': 500, 'learning_rate': 0.04416833571629319, 'max_depth': 9, 'min_child_weight': 4, 'subsample': 0.7, 'colsample_bytree': 0.8, 'colsample_bylevel': 1.0, 'reg_alpha': 44.736450045104974, 'reg_lambda': 0.06522129871850613, 'gamma': 45.09593495622648}. Best is trial 69 with value: -0.3911874830873789.
[I 2026-07-20 12:31:33,947] Trial 246 finished with value: -0.2630827011922481 and parameters: {'error_threshold': 1.25, 'scalers': 'none', 'ratios': 'norm_ratio', 'imputers': 'mean', 'n_estimators': 500, 'learning_rate': 0.04624631455089494, 'max_depth': 10, 'min_child_weight': 4, 'subsample': 0.7, 'colsample_bytree': 0.8, 'colsample_bylevel': 1.0, 'reg_alpha': 14.21062608279611, 'reg_lambda': 0.05792067417975237, 'gamma': 44.315441282658824}. Best is trial 69 with value: -0.3911874830873789.
[I 2026-07-20 12:31:34,857] Trial 247 finished with value: -0.26336825154052534 and parameters: {'error_threshold': 1.25, 'scalers': 'none', 'ratios': 'norm_ratio', 'imputers': 'mean', 'n_estimators': 500, 'learning_rate': 0.04407959594291994, 'max_depth': 10, 'min_child_weight': 4, 'subsample': 0.7, 'colsample_bytree': 0.8, 'colsample_bylevel': 1.0, 'reg_alpha': 14.9517574099137, 'reg_lambda': 0.06734806989488784, 'gamma': 44.20122881774703}. Best is trial 69 with value: -0.3911874830873789.
[I 2026-07-20 12:31:36,158] Trial 248 finished with value: -0.39112039965403955 and parameters: {'error_threshold': 1.25, 'scalers': 'none', 'ratios': 'norm_ratio', 'imputers': 'mean', 'n_estimators': 500, 'learning_rate': 0.043291630096554644, 'max_depth': 10, 'min_child_weight': 4, 'subsample': 0.7, 'colsample_bytree': 0.8, 'colsample_bylevel': 1.0, 'reg_alpha': 72.66998944606047, 'reg_lambda': 0.07429428530048919, 'gamma': 99.75309669080929}. Best is trial 69 with value: -0.3911874830873789.
[I 2026-07-20 12:31:37,828] Trial 249 finished with value: -0.337852230519949 and parameters: {'error_threshold': 1.25, 'scalers': 'none', 'ratios': 'norm_ratio', 'imputers': 'mean', 'n_estimators': 500, 'learning_rate': 0.04344149995805868, 'max_depth': 9, 'min_child_weight': 4, 'subsample': 0.7, 'colsample_bytree': 0.8, 'colsample_bylevel': 1.0, 'reg_alpha': 67.57186629131623, 'reg_lambda': 0.029530623059004193, 'gamma': 44.78714005579539}. Best is trial 69 with value: -0.3911874830873789.
[I 2026-07-20 12:31:38,462] Trial 250 finished with value: -0.2821098329754373 and parameters: {'error_threshold': 1.25, 'scalers': 'none', 'ratios': 'norm_ratio', 'imputers': 'mean', 'n_estimators': 500, 'learning_rate': 0.04556445157373061, 'max_depth': 10, 'min_child_weight': 4, 'subsample': 0.7, 'colsample_bytree': 0.8, 'colsample_bylevel': 1.0, 'reg_alpha': 25.681021447802134, 'reg_lambda': 0.0744236653022795, 'gamma': 47.11901018814145}. Best is trial 69 with value: -0.3911874830873789.
[I 2026-07-20 12:31:39,422] Trial 251 finished with value: -0.2774917864478181 and parameters: {'error_threshold': 1.25, 'scalers': 'none', 'ratios': 'norm_ratio', 'imputers': 'mean', 'n_estimators': 500, 'learning_rate': 0.04604609197771731, 'max_depth': 9, 'min_child_weight': 4, 'subsample': 0.7, 'colsample_bytree': 0.8, 'colsample_bylevel': 1.0, 'reg_alpha': 24.044983392115327, 'reg_lambda': 0.05696575786179654, 'gamma': 45.35853545516232}. Best is trial 69 with value: -0.3911874830873789.
[I 2026-07-20 12:31:39,727] Trial 252 finished with value: -0.26844663163261034 and parameters: {'error_threshold': 1.25, 'scalers': 'none', 'ratios': 'norm_ratio', 'imputers': 'mean', 'n_estimators': 500, 'learning_rate': 0.04309749608105782, 'max_depth': 11, 'min_child_weight': 4, 'subsample': 0.7, 'colsample_bytree': 0.8, 'colsample_bylevel': 1.0, 'reg_alpha': 17.118307104892594, 'reg_lambda': 0.0705411456110466, 'gamma': 45.34553221363912}. Best is trial 69 with value: -0.3911874830873789.
[I 2026-07-20 12:31:40,681] Trial 253 finished with value: -0.29943320920700894 and parameters: {'error_threshold': 1.25, 'scalers': 'none', 'ratios': 'norm_ratio', 'imputers': 'mean', 'n_estimators': 500, 'learning_rate': 0.04629706105535259, 'max_depth': 11, 'min_child_weight': 4, 'subsample': 0.7, 'colsample_bytree': 0.8, 'colsample_bylevel': 1.0, 'reg_alpha': 14.985858284700479, 'reg_lambda': 0.07937375215390062, 'gamma': 66.62166808267469}. Best is trial 69 with value: -0.3911874830873789.
[I 2026-07-20 12:31:41,607] Trial 254 finished with value: -0.30147300615825995 and parameters: {'error_threshold': 1.0, 'scalers': 'none', 'ratios': 'norm_ratio', 'imputers': 'mean', 'n_estimators': 500, 'learning_rate': 0.06401157269417461, 'max_depth': 11, 'min_child_weight': 4, 'subsample': 0.7, 'colsample_bytree': 0.8, 'colsample_bylevel': 1.0, 'reg_alpha': 23.87628159714143, 'reg_lambda': 0.1432667839661628, 'gamma': 61.512700033771225}. Best is trial 69 with value: -0.3911874830873789.
[I 2026-07-20 12:31:42,460] Trial 255 finished with value: -0.3135470305522308 and parameters: {'error_threshold': 1.0, 'scalers': 'none', 'ratios': 'norm_ratio', 'imputers': 'mean', 'n_estimators': 500, 'learning_rate': 0.08534518328250063, 'max_depth': 11, 'min_child_weight': 4, 'subsample': 0.7, 'colsample_bytree': 0.8, 'colsample_bylevel': 1.0, 'reg_alpha': 26.224682109228098, 'reg_lambda': 0.12257763999366961, 'gamma': 66.87990149538183}. Best is trial 69 with value: -0.3911874830873789.
[I 2026-07-20 12:31:43,773] Trial 256 finished with value: -0.2961960576825669 and parameters: {'error_threshold': 1.25, 'scalers': 'none', 'ratios': 'norm_ratio', 'imputers': 'mean', 'n_estimators': 450, 'learning_rate': 0.08355702604173933, 'max_depth': 9, 'min_child_weight': 4, 'subsample': 0.7, 'colsample_bytree': 0.8, 'colsample_bylevel': 1.0, 'reg_alpha': 22.60249018601135, 'reg_lambda': 0.16874959716300128, 'gamma': 60.823859909742666}. Best is trial 69 with value: -0.3911874830873789.
[I 2026-07-20 12:31:45,357] Trial 257 finished with value: -0.3178122894621314 and parameters: {'error_threshold': 4.25, 'scalers': 'none', 'ratios': 'norm_ratio', 'imputers': 'mean', 'n_estimators': 450, 'learning_rate': 0.08528978290390105, 'max_depth': 11, 'min_child_weight': 3, 'subsample': 0.7, 'colsample_bytree': 0.8, 'colsample_bylevel': 1.0, 'reg_alpha': 27.10672874807875, 'reg_lambda': 0.1289034566040038, 'gamma': 68.79946025305546}. Best is trial 69 with value: -0.3911874830873789.
[I 2026-07-20 12:31:45,642] Trial 258 finished with value: -0.31755646452179787 and parameters: {'error_threshold': 1.5, 'scalers': 'none', 'ratios': 'norm_ratio', 'imputers': 'mean', 'n_estimators': 450, 'learning_rate': 0.07839689994161735, 'max_depth': 11, 'min_child_weight': 3, 'subsample': 0.7, 'colsample_bytree': 0.8, 'colsample_bylevel': 1.0, 'reg_alpha': 27.258870776849697, 'reg_lambda': 0.12182322739342656, 'gamma': 69.01846887597752}. Best is trial 69 with value: -0.3911874830873789.
[I 2026-07-20 12:31:47,021] Trial 259 finished with value: -0.3111754937639683 and parameters: {'error_threshold': 1.0, 'scalers': 'none', 'ratios': 'norm_ratio', 'imputers': 'mean', 'n_estimators': 450, 'learning_rate': 0.06105334988126213, 'max_depth': 11, 'min_child_weight': 3, 'subsample': 0.7, 'colsample_bytree': 0.8, 'colsample_bylevel': 1.0, 'reg_alpha': 24.96464017146863, 'reg_lambda': 0.10467785951789438, 'gamma': 66.19079237568543}. Best is trial 69 with value: -0.3911874830873789.
[I 2026-07-20 12:31:47,491] Trial 260 finished with value: -0.30416902754485237 and parameters: {'error_threshold': 1.0, 'scalers': 'none', 'ratios': 'norm_ratio', 'imputers': 'mean', 'n_estimators': 450, 'learning_rate': 0.06333728809993033, 'max_depth': 11, 'min_child_weight': 3, 'subsample': 0.7, 'colsample_bytree': 0.8, 'colsample_bylevel': 1.0, 'reg_alpha': 28.29353840505983, 'reg_lambda': 0.09197824533543673, 'gamma': 59.269631527556044}. Best is trial 69 with value: -0.3911874830873789.
[I 2026-07-20 12:31:48,902] Trial 261 finished with value: -0.30987375531786415 and parameters: {'error_threshold': 1.0, 'scalers': 'none', 'ratios': 'norm_ratio', 'imputers': 'mean', 'n_estimators': 650, 'learning_rate': 0.08557789123855014, 'max_depth': 12, 'min_child_weight': 3, 'subsample': 0.7, 'colsample_bytree': 0.8, 'colsample_bylevel': 1.0, 'reg_alpha': 26.310975678679117, 'reg_lambda': 0.13790314046003244, 'gamma': 66.34337623751725}. Best is trial 69 with value: -0.3911874830873789.
[I 2026-07-20 12:31:49,181] Trial 262 finished with value: -0.33269089786529166 and parameters: {'error_threshold': 1.0, 'scalers': 'none', 'ratios': 'norm_ratio', 'imputers': 'mean', 'n_estimators': 400, 'learning_rate': 0.07973508427092217, 'max_depth': 12, 'min_child_weight': 3, 'subsample': 0.7, 'colsample_bytree': 0.8, 'colsample_bylevel': 1.0, 'reg_alpha': 33.75120219781941, 'reg_lambda': 0.11506803399458117, 'gamma': 68.8390883227146}. Best is trial 69 with value: -0.3911874830873789.
[I 2026-07-20 12:31:50,666] Trial 263 finished with value: -0.3872424471428572 and parameters: {'error_threshold': 1.0, 'scalers': 'none', 'ratios': 'norm_ratio', 'imputers': 'mean', 'n_estimators': 650, 'learning_rate': 0.0802004090696398, 'max_depth': 12, 'min_child_weight': 3, 'subsample': 0.7, 'colsample_bytree': 0.8, 'colsample_bylevel': 1.0, 'reg_alpha': 62.592234177429525, 'reg_lambda': 0.12725936368783797, 'gamma': 69.74879034414585}. Best is trial 69 with value: -0.3911874830873789.
[I 2026-07-20 12:31:52,811] Trial 264 finished with value: -0.39013250496789437 and parameters: {'error_threshold': 1.0, 'scalers': 'none', 'ratios': 'norm_ratio', 'imputers': 'mean', 'n_estimators': 650, 'learning_rate': 0.05781649883499734, 'max_depth': 12, 'min_child_weight': 3, 'subsample': 0.7, 'colsample_bytree': 0.8, 'colsample_bylevel': 1.0, 'reg_alpha': 60.76207812052628, 'reg_lambda': 0.03967478026249349, 'gamma': 73.3375737813126}. Best is trial 69 with value: -0.3911874830873789.
[I 2026-07-20 12:31:54,437] Trial 265 finished with value: -0.3910947306001183 and parameters: {'error_threshold': 1.0, 'scalers': 'none', 'ratios': 'norm_ratio', 'imputers': 'mean', 'n_estimators': 650, 'learning_rate': 0.0551897143594111, 'max_depth': 12, 'min_child_weight': 3, 'subsample': 0.7, 'colsample_bytree': 0.8, 'colsample_bylevel': 1.0, 'reg_alpha': 64.04454068980924, 'reg_lambda': 0.035239951876723095, 'gamma': 98.983492065806}. Best is trial 69 with value: -0.3911874830873789.
[I 2026-07-20 12:31:54,792] Trial 266 finished with value: -0.3911096540093868 and parameters: {'error_threshold': 1.0, 'scalers': 'none', 'ratios': 'norm_ratio', 'imputers': 'mean', 'n_estimators': 600, 'learning_rate': 0.057440563156543674, 'max_depth': 12, 'min_child_weight': 3, 'subsample': 0.7, 'colsample_bytree': 0.8, 'colsample_bylevel': 1.0, 'reg_alpha': 67.04888929805682, 'reg_lambda': 0.03450594359928585, 'gamma': 70.63254368367375}. Best is trial 69 with value: -0.3911874830873789.
[I 2026-07-20 12:31:56,440] Trial 267 finished with value: -0.39109450079107494 and parameters: {'error_threshold': 0.75, 'scalers': 'none', 'ratios': 'norm_ratio', 'imputers': 'mean', 'n_estimators': 650, 'learning_rate': 0.059325323360802706, 'max_depth': 12, 'min_child_weight': 3, 'subsample': 0.7, 'colsample_bytree': 0.8, 'colsample_bylevel': 1.0, 'reg_alpha': 63.4911337155394, 'reg_lambda': 0.048047201566056824, 'gamma': 97.34074178153809}. Best is trial 69 with value: -0.3911874830873789.
[I 2026-07-20 12:31:57,812] Trial 268 finished with value: -0.39109559300617597 and parameters: {'error_threshold': 0.75, 'scalers': 'none', 'ratios': 'norm_ratio', 'imputers': 'mean', 'n_estimators': 650, 'learning_rate': 0.03591471685573458, 'max_depth': 12, 'min_child_weight': 4, 'subsample': 0.7, 'colsample_bytree': 0.8, 'colsample_bylevel': 1.0, 'reg_alpha': 62.9690179277252, 'reg_lambda': 0.03324096047470136, 'gamma': 98.04194240019369}. Best is trial 69 with value: -0.3911874830873789.
[I 2026-07-20 12:31:58,439] Trial 269 finished with value: -0.3911455976644515 and parameters: {'error_threshold': 0.75, 'scalers': 'none', 'ratios': 'norm_ratio', 'imputers': 'mean', 'n_estimators': 600, 'learning_rate': 0.21573837251890174, 'max_depth': 12, 'min_child_weight': 4, 'subsample': 0.7, 'colsample_bytree': 0.8, 'colsample_bylevel': 1.0, 'reg_alpha': 60.03120684534714, 'reg_lambda': 0.034050000671631296, 'gamma': 97.30909229850509}. Best is trial 69 with value: -0.3911874830873789.
