[I 2026-07-20 13:47:29,259] Trial 639 finished with value: -0.22091247010075252 and parameters: {'error_threshold': 0.5, 'scalers': 'none', 'ratios': 'norm_ratio', 'imputers': 'none', 'n_estimators': 100, 'learning_rate': 0.18656788094587382, 'max_depth': 3, 'min_child_weight': 9, 'subsample': 0.5, 'colsample_bytree': 0.5, 'colsample_bylevel': 0.9, 'reg_alpha': 29.701279100900862, 'reg_lambda': 0.00017836264135957398, 'gamma': 89.77077171761216}. Best is trial 478 with value: -0.2209472207879047.
[I 2026-07-20 13:47:29,269] Using an existing study with name 'final_predictive_mean_study' instead of creating a new one.
[W 2026-07-20 13:47:30,261] Trial 12 failed with parameters: {'error_threshold': 3.5, 'scalers': 'standard', 'ratios': 'log_ratio', 'imputers': 'median', 'n_estimators': 850, 'learning_rate': 0.01307197709819942, 'max_depth': 11, 'min_child_weight': 3, 'subsample': 1.0, 'colsample_bytree': 0.9, 'colsample_bylevel': 0.6, 'reg_alpha': 0.3501453683008233, 'reg_lambda': 0.16770339718985866, 'gamma': 91.87183468714663} because of the following error: InvalidParameterError("The 'scoring' parameter of cross_val_score must be a str among {'adjusted_mutual_info_score', 'jaccard_macro', 'recall_macro', 'balanced_accuracy', 'neg_mean_absolute_percentage_error', 'f1_weighted', 'jaccard_samples', 'neg_mean_squared_error', 'rand_score', 'accuracy', 'precision_macro', 'homogeneity_score', 'neg_log_loss', 'neg_mean_squared_log_error', 'f1_micro', 'neg_mean_absolute_error', 'neg_negative_likelihood_ratio', 'recall_samples', 'neg_brier_score', 'f1_samples', 'normalized_mutual_info_score', 'precision_samples', 'positive_likelihood_ratio', 'adjusted_rand_score', 'neg_root_mean_squared_log_error', 'recall', 'neg_max_error', 'mutual_info_score', 'precision', 'f1_macro', 'jaccard_weighted', 'neg_median_absolute_error', 'roc_auc_ovr', 'completeness_score', 'd2_brier_score', 'neg_root_mean_squared_error', 'jaccard_micro', 'average_precision', 'f1', 'precision_weighted', 'explained_variance', 'neg_mean_gamma_deviance', 'roc_auc_ovo', 'recall_micro', 'd2_absolute_error_score', 'matthews_corrcoef', 'r2', 'v_measure_score', 'roc_auc_ovr_weighted', 'neg_mean_poisson_deviance', 'precision_micro', 'recall_weighted', 'top_k_accuracy', 'jaccard', 'd2_log_loss_score', 'roc_auc', 'roc_auc_ovo_weighted', 'fowlkes_mallows_score'}, a callable or None. Got 'root_mean_squared_error' instead.").
Traceback (most recent call last):
  File "/bsuscratch/alexanderemert/miniforge3/envs/starform-alex/lib/python3.14/site-packages/optuna/study/_optimize.py", line 206, in _run_trial
    value_or_values = func(trial)
  File "/bsuhome/alexanderemert/Research/Star-Formation-Research-Project-2026/pipeline/scripts/optuna/final_preds_and_models/optuna_search_mult_quant_reg.py", line 231, in objective
    scores = cross_val_score(model_pipe, X_train, y_train, scoring='root_mean_squared_error', cv=6, n_jobs=6)
  File "/bsuscratch/alexanderemert/miniforge3/envs/starform-alex/lib/python3.14/site-packages/sklearn/utils/_param_validation.py", line 208, in wrapper
    validate_parameter_constraints(
    ~~~~~~~~~~~~~~~~~~~~~~~~~~~~~~^
        parameter_constraints, params, caller_name=func.__qualname__
        ^^^^^^^^^^^^^^^^^^^^^^^^^^^^^^^^^^^^^^^^^^^^^^^^^^^^^^^^^^^^
    )
    ^
  File "/bsuscratch/alexanderemert/miniforge3/envs/starform-alex/lib/python3.14/site-packages/sklearn/utils/_param_validation.py", line 98, in validate_parameter_constraints
    raise InvalidParameterError(
    ...<2 lines>...
    )
sklearn.utils._param_validation.InvalidParameterError: The 'scoring' parameter of cross_val_score must be a str among {'adjusted_mutual_info_score', 'jaccard_macro', 'recall_macro', 'balanced_accuracy', 'neg_mean_absolute_percentage_error', 'f1_weighted', 'jaccard_samples', 'neg_mean_squared_error', 'rand_score', 'accuracy', 'precision_macro', 'homogeneity_score', 'neg_log_loss', 'neg_mean_squared_log_error', 'f1_micro', 'neg_mean_absolute_error', 'neg_negative_likelihood_ratio', 'recall_samples', 'neg_brier_score', 'f1_samples', 'normalized_mutual_info_score', 'precision_samples', 'positive_likelihood_ratio', 'adjusted_rand_score', 'neg_root_mean_squared_log_error', 'recall', 'neg_max_error', 'mutual_info_score', 'precision', 'f1_macro', 'jaccard_weighted', 'neg_median_absolute_error', 'roc_auc_ovr', 'completeness_score', 'd2_brier_score', 'neg_root_mean_squared_error', 'jaccard_micro', 'average_precision', 'f1', 'precision_weighted', 'explained_variance', 'neg_mean_gamma_deviance', 'roc_auc_ovo', 'recall_micro', 'd2_absolute_error_score', 'matthews_corrcoef', 'r2', 'v_measure_score', 'roc_auc_ovr_weighted', 'neg_mean_poisson_deviance', 'precision_micro', 'recall_weighted', 'top_k_accuracy', 'jaccard', 'd2_log_loss_score', 'roc_auc', 'roc_auc_ovo_weighted', 'fowlkes_mallows_score'}, a callable or None. Got 'root_mean_squared_error' instead.
[W 2026-07-20 13:47:30,268] Trial 12 failed with value None.
[W 2026-07-20 13:47:30,319] Trial 15 failed with parameters: {'error_threshold': 2.5, 'scalers': 'none', 'ratios': 'norm_ratio', 'imputers': 'none', 'n_estimators': 350, 'learning_rate': 0.17184961878926067, 'max_depth': 5, 'min_child_weight': 6, 'subsample': 0.6, 'colsample_bytree': 0.8, 'colsample_bylevel': 0.8, 'reg_alpha': 45.18593649851648, 'reg_lambda': 3.7609186149420313e-06, 'gamma': 0.00011679299506347217} because of the following error: InvalidParameterError("The 'scoring' parameter of cross_val_score must be a str among {'adjusted_mutual_info_score', 'jaccard_macro', 'recall_macro', 'balanced_accuracy', 'neg_mean_absolute_percentage_error', 'f1_weighted', 'jaccard_samples', 'neg_mean_squared_error', 'rand_score', 'accuracy', 'precision_macro', 'homogeneity_score', 'neg_log_loss', 'neg_mean_squared_log_error', 'f1_micro', 'neg_mean_absolute_error', 'neg_negative_likelihood_ratio', 'recall_samples', 'neg_brier_score', 'f1_samples', 'normalized_mutual_info_score', 'precision_samples', 'positive_likelihood_ratio', 'adjusted_rand_score', 'neg_root_mean_squared_log_error', 'recall', 'neg_max_error', 'mutual_info_score', 'precision', 'f1_macro', 'jaccard_weighted', 'neg_median_absolute_error', 'roc_auc_ovr', 'completeness_score', 'd2_brier_score', 'neg_root_mean_squared_error', 'jaccard_micro', 'average_precision', 'f1', 'precision_weighted', 'explained_variance', 'neg_mean_gamma_deviance', 'roc_auc_ovo', 'recall_micro', 'd2_absolute_error_score', 'matthews_corrcoef', 'r2', 'v_measure_score', 'roc_auc_ovr_weighted', 'neg_mean_poisson_deviance', 'precision_micro', 'recall_weighted', 'top_k_accuracy', 'jaccard', 'd2_log_loss_score', 'roc_auc', 'roc_auc_ovo_weighted', 'fowlkes_mallows_score'}, a callable or None. Got 'root_mean_squared_error' instead.").
Traceback (most recent call last):
  File "/bsuscratch/alexanderemert/miniforge3/envs/starform-alex/lib/python3.14/site-packages/optuna/study/_optimize.py", line 206, in _run_trial
    value_or_values = func(trial)
  File "/bsuhome/alexanderemert/Research/Star-Formation-Research-Project-2026/pipeline/scripts/optuna/final_preds_and_models/optuna_search_mult_quant_reg.py", line 231, in objective
    scores = cross_val_score(model_pipe, X_train, y_train, scoring='root_mean_squared_error', cv=6, n_jobs=6)
  File "/bsuscratch/alexanderemert/miniforge3/envs/starform-alex/lib/python3.14/site-packages/sklearn/utils/_param_validation.py", line 208, in wrapper
    validate_parameter_constraints(
    ~~~~~~~~~~~~~~~~~~~~~~~~~~~~~~^
        parameter_constraints, params, caller_name=func.__qualname__
        ^^^^^^^^^^^^^^^^^^^^^^^^^^^^^^^^^^^^^^^^^^^^^^^^^^^^^^^^^^^^
    )
    ^
  File "/bsuscratch/alexanderemert/miniforge3/envs/starform-alex/lib/python3.14/site-packages/sklearn/utils/_param_validation.py", line 98, in validate_parameter_constraints
    raise InvalidParameterError(
    ...<2 lines>...
    )
sklearn.utils._param_validation.InvalidParameterError: The 'scoring' parameter of cross_val_score must be a str among {'adjusted_mutual_info_score', 'jaccard_macro', 'recall_macro', 'balanced_accuracy', 'neg_mean_absolute_percentage_error', 'f1_weighted', 'jaccard_samples', 'neg_mean_squared_error', 'rand_score', 'accuracy', 'precision_macro', 'homogeneity_score', 'neg_log_loss', 'neg_mean_squared_log_error', 'f1_micro', 'neg_mean_absolute_error', 'neg_negative_likelihood_ratio', 'recall_samples', 'neg_brier_score', 'f1_samples', 'normalized_mutual_info_score', 'precision_samples', 'positive_likelihood_ratio', 'adjusted_rand_score', 'neg_root_mean_squared_log_error', 'recall', 'neg_max_error', 'mutual_info_score', 'precision', 'f1_macro', 'jaccard_weighted', 'neg_median_absolute_error', 'roc_auc_ovr', 'completeness_score', 'd2_brier_score', 'neg_root_mean_squared_error', 'jaccard_micro', 'average_precision', 'f1', 'precision_weighted', 'explained_variance', 'neg_mean_gamma_deviance', 'roc_auc_ovo', 'recall_micro', 'd2_absolute_error_score', 'matthews_corrcoef', 'r2', 'v_measure_score', 'roc_auc_ovr_weighted', 'neg_mean_poisson_deviance', 'precision_micro', 'recall_weighted', 'top_k_accuracy', 'jaccard', 'd2_log_loss_score', 'roc_auc', 'roc_auc_ovo_weighted', 'fowlkes_mallows_score'}, a callable or None. Got 'root_mean_squared_error' instead.
[W 2026-07-20 13:47:30,320] Trial 15 failed with value None.
[W 2026-07-20 13:47:30,798] Trial 14 failed with parameters: {'error_threshold': 5.0, 'scalers': 'standard', 'ratios': 'norm_ratio', 'imputers': 'mean', 'n_estimators': 1150, 'learning_rate': 0.0025028273330507398, 'max_depth': 10, 'min_child_weight': 4, 'subsample': 0.6, 'colsample_bytree': 0.5, 'colsample_bylevel': 0.6, 'reg_alpha': 0.007021495166690752, 'reg_lambda': 4.232149938477292e-05, 'gamma': 17.27803072314276} because of the following error: InvalidParameterError("The 'scoring' parameter of cross_val_score must be a str among {'adjusted_mutual_info_score', 'jaccard_macro', 'recall_macro', 'balanced_accuracy', 'neg_mean_absolute_percentage_error', 'f1_weighted', 'jaccard_samples', 'neg_mean_squared_error', 'rand_score', 'accuracy', 'precision_macro', 'homogeneity_score', 'neg_log_loss', 'neg_mean_squared_log_error', 'f1_micro', 'neg_mean_absolute_error', 'neg_negative_likelihood_ratio', 'recall_samples', 'neg_brier_score', 'f1_samples', 'normalized_mutual_info_score', 'precision_samples', 'positive_likelihood_ratio', 'adjusted_rand_score', 'neg_root_mean_squared_log_error', 'recall', 'neg_max_error', 'mutual_info_score', 'precision', 'f1_macro', 'jaccard_weighted', 'neg_median_absolute_error', 'roc_auc_ovr', 'completeness_score', 'd2_brier_score', 'neg_root_mean_squared_error', 'jaccard_micro', 'average_precision', 'f1', 'precision_weighted', 'explained_variance', 'neg_mean_gamma_deviance', 'roc_auc_ovo', 'recall_micro', 'd2_absolute_error_score', 'matthews_corrcoef', 'r2', 'v_measure_score', 'roc_auc_ovr_weighted', 'neg_mean_poisson_deviance', 'precision_micro', 'recall_weighted', 'top_k_accuracy', 'jaccard', 'd2_log_loss_score', 'roc_auc', 'roc_auc_ovo_weighted', 'fowlkes_mallows_score'}, a callable or None. Got 'root_mean_squared_error' instead.").
Traceback (most recent call last):
  File "/bsuscratch/alexanderemert/miniforge3/envs/starform-alex/lib/python3.14/site-packages/optuna/study/_optimize.py", line 206, in _run_trial
    value_or_values = func(trial)
  File "/bsuhome/alexanderemert/Research/Star-Formation-Research-Project-2026/pipeline/scripts/optuna/final_preds_and_models/optuna_search_mult_quant_reg.py", line 231, in objective
    scores = cross_val_score(model_pipe, X_train, y_train, scoring='root_mean_squared_error', cv=6, n_jobs=6)
  File "/bsuscratch/alexanderemert/miniforge3/envs/starform-alex/lib/python3.14/site-packages/sklearn/utils/_param_validation.py", line 208, in wrapper
    validate_parameter_constraints(
    ~~~~~~~~~~~~~~~~~~~~~~~~~~~~~~^
        parameter_constraints, params, caller_name=func.__qualname__
        ^^^^^^^^^^^^^^^^^^^^^^^^^^^^^^^^^^^^^^^^^^^^^^^^^^^^^^^^^^^^
    )
    ^
  File "/bsuscratch/alexanderemert/miniforge3/envs/starform-alex/lib/python3.14/site-packages/sklearn/utils/_param_validation.py", line 98, in validate_parameter_constraints
    raise InvalidParameterError(
    ...<2 lines>...
    )
sklearn.utils._param_validation.InvalidParameterError: The 'scoring' parameter of cross_val_score must be a str among {'adjusted_mutual_info_score', 'jaccard_macro', 'recall_macro', 'balanced_accuracy', 'neg_mean_absolute_percentage_error', 'f1_weighted', 'jaccard_samples', 'neg_mean_squared_error', 'rand_score', 'accuracy', 'precision_macro', 'homogeneity_score', 'neg_log_loss', 'neg_mean_squared_log_error', 'f1_micro', 'neg_mean_absolute_error', 'neg_negative_likelihood_ratio', 'recall_samples', 'neg_brier_score', 'f1_samples', 'normalized_mutual_info_score', 'precision_samples', 'positive_likelihood_ratio', 'adjusted_rand_score', 'neg_root_mean_squared_log_error', 'recall', 'neg_max_error', 'mutual_info_score', 'precision', 'f1_macro', 'jaccard_weighted', 'neg_median_absolute_error', 'roc_auc_ovr', 'completeness_score', 'd2_brier_score', 'neg_root_mean_squared_error', 'jaccard_micro', 'average_precision', 'f1', 'precision_weighted', 'explained_variance', 'neg_mean_gamma_deviance', 'roc_auc_ovo', 'recall_micro', 'd2_absolute_error_score', 'matthews_corrcoef', 'r2', 'v_measure_score', 'roc_auc_ovr_weighted', 'neg_mean_poisson_deviance', 'precision_micro', 'recall_weighted', 'top_k_accuracy', 'jaccard', 'd2_log_loss_score', 'roc_auc', 'roc_auc_ovo_weighted', 'fowlkes_mallows_score'}, a callable or None. Got 'root_mean_squared_error' instead.
[W 2026-07-20 13:47:30,801] Trial 14 failed with value None.
[W 2026-07-20 13:47:31,005] Trial 9 failed with parameters: {'error_threshold': 2.5, 'scalers': 'standard', 'ratios': 'norm_ratio', 'imputers': 'none', 'n_estimators': 1050, 'learning_rate': 0.00013682602598998376, 'max_depth': 3, 'min_child_weight': 3, 'subsample': 0.6, 'colsample_bytree': 0.7, 'colsample_bylevel': 1.0, 'reg_alpha': 1.5251351013664791, 'reg_lambda': 0.00044850766900584715, 'gamma': 2.5193111588721773} because of the following error: InvalidParameterError("The 'scoring' parameter of cross_val_score must be a str among {'adjusted_mutual_info_score', 'jaccard_macro', 'recall_macro', 'balanced_accuracy', 'neg_mean_absolute_percentage_error', 'f1_weighted', 'jaccard_samples', 'neg_mean_squared_error', 'rand_score', 'accuracy', 'precision_macro', 'homogeneity_score', 'neg_log_loss', 'neg_mean_squared_log_error', 'f1_micro', 'neg_mean_absolute_error', 'neg_negative_likelihood_ratio', 'recall_samples', 'neg_brier_score', 'f1_samples', 'normalized_mutual_info_score', 'precision_samples', 'positive_likelihood_ratio', 'adjusted_rand_score', 'neg_root_mean_squared_log_error', 'recall', 'neg_max_error', 'mutual_info_score', 'precision', 'f1_macro', 'jaccard_weighted', 'neg_median_absolute_error', 'roc_auc_ovr', 'completeness_score', 'd2_brier_score', 'neg_root_mean_squared_error', 'jaccard_micro', 'average_precision', 'f1', 'precision_weighted', 'explained_variance', 'neg_mean_gamma_deviance', 'roc_auc_ovo', 'recall_micro', 'd2_absolute_error_score', 'matthews_corrcoef', 'r2', 'v_measure_score', 'roc_auc_ovr_weighted', 'neg_mean_poisson_deviance', 'precision_micro', 'recall_weighted', 'top_k_accuracy', 'jaccard', 'd2_log_loss_score', 'roc_auc', 'roc_auc_ovo_weighted', 'fowlkes_mallows_score'}, a callable or None. Got 'root_mean_squared_error' instead.").
Traceback (most recent call last):
  File "/bsuscratch/alexanderemert/miniforge3/envs/starform-alex/lib/python3.14/site-packages/optuna/study/_optimize.py", line 206, in _run_trial
    value_or_values = func(trial)
  File "/bsuhome/alexanderemert/Research/Star-Formation-Research-Project-2026/pipeline/scripts/optuna/final_preds_and_models/optuna_search_mult_quant_reg.py", line 231, in objective
    scores = cross_val_score(model_pipe, X_train, y_train, scoring='root_mean_squared_error', cv=6, n_jobs=6)
  File "/bsuscratch/alexanderemert/miniforge3/envs/starform-alex/lib/python3.14/site-packages/sklearn/utils/_param_validation.py", line 208, in wrapper
    validate_parameter_constraints(
    ~~~~~~~~~~~~~~~~~~~~~~~~~~~~~~^
        parameter_constraints, params, caller_name=func.__qualname__
        ^^^^^^^^^^^^^^^^^^^^^^^^^^^^^^^^^^^^^^^^^^^^^^^^^^^^^^^^^^^^
    )
    ^
  File "/bsuscratch/alexanderemert/miniforge3/envs/starform-alex/lib/python3.14/site-packages/sklearn/utils/_param_validation.py", line 98, in validate_parameter_constraints
    raise InvalidParameterError(
    ...<2 lines>...
    )
sklearn.utils._param_validation.InvalidParameterError: The 'scoring' parameter of cross_val_score must be a str among {'adjusted_mutual_info_score', 'jaccard_macro', 'recall_macro', 'balanced_accuracy', 'neg_mean_absolute_percentage_error', 'f1_weighted', 'jaccard_samples', 'neg_mean_squared_error', 'rand_score', 'accuracy', 'precision_macro', 'homogeneity_score', 'neg_log_loss', 'neg_mean_squared_log_error', 'f1_micro', 'neg_mean_absolute_error', 'neg_negative_likelihood_ratio', 'recall_samples', 'neg_brier_score', 'f1_samples', 'normalized_mutual_info_score', 'precision_samples', 'positive_likelihood_ratio', 'adjusted_rand_score', 'neg_root_mean_squared_log_error', 'recall', 'neg_max_error', 'mutual_info_score', 'precision', 'f1_macro', 'jaccard_weighted', 'neg_median_absolute_error', 'roc_auc_ovr', 'completeness_score', 'd2_brier_score', 'neg_root_mean_squared_error', 'jaccard_micro', 'average_precision', 'f1', 'precision_weighted', 'explained_variance', 'neg_mean_gamma_deviance', 'roc_auc_ovo', 'recall_micro', 'd2_absolute_error_score', 'matthews_corrcoef', 'r2', 'v_measure_score', 'roc_auc_ovr_weighted', 'neg_mean_poisson_deviance', 'precision_micro', 'recall_weighted', 'top_k_accuracy', 'jaccard', 'd2_log_loss_score', 'roc_auc', 'roc_auc_ovo_weighted', 'fowlkes_mallows_score'}, a callable or None. Got 'root_mean_squared_error' instead.
[W 2026-07-20 13:47:31,006] Trial 9 failed with value None.
[W 2026-07-20 13:47:31,155] Trial 10 failed with parameters: {'error_threshold': 1.75, 'scalers': 'standard', 'ratios': 'norm_ratio', 'imputers': 'median', 'n_estimators': 1800, 'learning_rate': 0.23484185316787526, 'max_depth': 7, 'min_child_weight': 3, 'subsample': 0.9, 'colsample_bytree': 0.5, 'colsample_bylevel': 0.7, 'reg_alpha': 0.00030513083264084275, 'reg_lambda': 0.008234540065424834, 'gamma': 0.0012356068669667466} because of the following error: InvalidParameterError("The 'scoring' parameter of cross_val_score must be a str among {'adjusted_mutual_info_score', 'jaccard_macro', 'recall_macro', 'balanced_accuracy', 'neg_mean_absolute_percentage_error', 'f1_weighted', 'jaccard_samples', 'neg_mean_squared_error', 'rand_score', 'accuracy', 'precision_macro', 'homogeneity_score', 'neg_log_loss', 'neg_mean_squared_log_error', 'f1_micro', 'neg_mean_absolute_error', 'neg_negative_likelihood_ratio', 'recall_samples', 'neg_brier_score', 'f1_samples', 'normalized_mutual_info_score', 'precision_samples', 'positive_likelihood_ratio', 'adjusted_rand_score', 'neg_root_mean_squared_log_error', 'recall', 'neg_max_error', 'mutual_info_score', 'precision', 'f1_macro', 'jaccard_weighted', 'neg_median_absolute_error', 'roc_auc_ovr', 'completeness_score', 'd2_brier_score', 'neg_root_mean_squared_error', 'jaccard_micro', 'average_precision', 'f1', 'precision_weighted', 'explained_variance', 'neg_mean_gamma_deviance', 'roc_auc_ovo', 'recall_micro', 'd2_absolute_error_score', 'matthews_corrcoef', 'r2', 'v_measure_score', 'roc_auc_ovr_weighted', 'neg_mean_poisson_deviance', 'precision_micro', 'recall_weighted', 'top_k_accuracy', 'jaccard', 'd2_log_loss_score', 'roc_auc', 'roc_auc_ovo_weighted', 'fowlkes_mallows_score'}, a callable or None. Got 'root_mean_squared_error' instead.").
Traceback (most recent call last):
  File "/bsuscratch/alexanderemert/miniforge3/envs/starform-alex/lib/python3.14/site-packages/optuna/study/_optimize.py", line 206, in _run_trial
    value_or_values = func(trial)
  File "/bsuhome/alexanderemert/Research/Star-Formation-Research-Project-2026/pipeline/scripts/optuna/final_preds_and_models/optuna_search_mult_quant_reg.py", line 231, in objective
    scores = cross_val_score(model_pipe, X_train, y_train, scoring='root_mean_squared_error', cv=6, n_jobs=6)
  File "/bsuscratch/alexanderemert/miniforge3/envs/starform-alex/lib/python3.14/site-packages/sklearn/utils/_param_validation.py", line 208, in wrapper
    validate_parameter_constraints(
    ~~~~~~~~~~~~~~~~~~~~~~~~~~~~~~^
        parameter_constraints, params, caller_name=func.__qualname__
        ^^^^^^^^^^^^^^^^^^^^^^^^^^^^^^^^^^^^^^^^^^^^^^^^^^^^^^^^^^^^
    )
    ^
  File "/bsuscratch/alexanderemert/miniforge3/envs/starform-alex/lib/python3.14/site-packages/sklearn/utils/_param_validation.py", line 98, in validate_parameter_constraints
    raise InvalidParameterError(
    ...<2 lines>...
    )
sklearn.utils._param_validation.InvalidParameterError: The 'scoring' parameter of cross_val_score must be a str among {'adjusted_mutual_info_score', 'jaccard_macro', 'recall_macro', 'balanced_accuracy', 'neg_mean_absolute_percentage_error', 'f1_weighted', 'jaccard_samples', 'neg_mean_squared_error', 'rand_score', 'accuracy', 'precision_macro', 'homogeneity_score', 'neg_log_loss', 'neg_mean_squared_log_error', 'f1_micro', 'neg_mean_absolute_error', 'neg_negative_likelihood_ratio', 'recall_samples', 'neg_brier_score', 'f1_samples', 'normalized_mutual_info_score', 'precision_samples', 'positive_likelihood_ratio', 'adjusted_rand_score', 'neg_root_mean_squared_log_error', 'recall', 'neg_max_error', 'mutual_info_score', 'precision', 'f1_macro', 'jaccard_weighted', 'neg_median_absolute_error', 'roc_auc_ovr', 'completeness_score', 'd2_brier_score', 'neg_root_mean_squared_error', 'jaccard_micro', 'average_precision', 'f1', 'precision_weighted', 'explained_variance', 'neg_mean_gamma_deviance', 'roc_auc_ovo', 'recall_micro', 'd2_absolute_error_score', 'matthews_corrcoef', 'r2', 'v_measure_score', 'roc_auc_ovr_weighted', 'neg_mean_poisson_deviance', 'p