[I 2026-07-20 14:41:05,146] Trial 423 finished with value: -0.5162887447877526 and parameters: {'error_threshold': 2.25, 'scalers': 'robust', 'ratios': 'norm_ratio', 'imputers': 'mean', 'n_estimators': 2400, 'learning_rate': 0.3807808539193118, 'max_depth': 8, 'min_child_weight': 1, 'subsample': 0.5, 'colsample_bytree': 0.5, 'colsample_bylevel': 0.8, 'reg_alpha': 0.8387215130748921, 'reg_lambda': 5.501199560418709e-06, 'gamma': 0.00032284415430846447}. Best is trial 359 with value: -0.8315037537709427.
[I 2026-07-20 14:41:11,502] Trial 424 finished with value: -0.5105257527638467 and parameters: {'error_threshold': 2.25, 'scalers': 'standard', 'ratios': 'norm_ratio', 'imputers': 'mean', 'n_estimators': 2250, 'learning_rate': 0.37682670541272795, 'max_depth': 8, 'min_child_weight': 1, 'subsample': 0.5, 'colsample_bytree': 0.5, 'colsample_bylevel': 0.8, 'reg_alpha': 0.847785802993795, 'reg_lambda': 2.403632429338964e-06, 'gamma': 0.0001464583446095674}. Best is trial 359 with value: -0.8315037537709427.
[I 2026-07-20 14:41:21,320] Trial 425 finished with value: -0.5118041812994126 and parameters: {'error_threshold': 2.25, 'scalers': 'standard', 'ratios': 'norm_ratio', 'imputers': 'mean', 'n_estimators': 2200, 'learning_rate': 0.3735524028182808, 'max_depth': 8, 'min_child_weight': 1, 'subsample': 0.5, 'colsample_bytree': 0.5, 'colsample_bylevel': 0.8, 'reg_alpha': 0.8618201855742886, 'reg_lambda': 1.6692175348541102e-06, 'gamma': 0.0001461179778748395}. Best is trial 359 with value: -0.8315037537709427.
[I 2026-07-20 14:41:28,188] Trial 426 finished with value: -0.6783605588150627 and parameters: {'error_threshold': 2.25, 'scalers': 'standard', 'ratios': 'norm_ratio', 'imputers': 'mean', 'n_estimators': 2300, 'learning_rate': 0.48960834368313305, 'max_depth': 8, 'min_child_weight': 1, 'subsample': 0.5, 'colsample_bytree': 0.5, 'colsample_bylevel': 0.8, 'reg_alpha': 0.8677443868650606, 'reg_lambda': 7.688555801642247e-06, 'gamma': 4.286320656289245e-06}. Best is trial 359 with value: -0.8315037537709427.
[I 2026-07-20 14:41:41,835] Trial 427 finished with value: -0.6701621313049829 and parameters: {'error_threshold': 2.0, 'scalers': 'standard', 'ratios': 'norm_ratio', 'imputers': 'mean', 'n_estimators': 2300, 'learning_rate': 0.49654765394359884, 'max_depth': 8, 'min_child_weight': 1, 'subsample': 0.5, 'colsample_bytree': 0.5, 'colsample_bylevel': 0.8, 'reg_alpha': 0.8806558453577912, 'reg_lambda': 6.118042855123296e-06, 'gamma': 1.3174577658321455e-05}. Best is trial 359 with value: -0.8315037537709427.
[I 2026-07-20 14:41:48,602] Trial 428 finished with value: -0.6969912023997326 and parameters: {'error_threshold': 2.0, 'scalers': 'robust', 'ratios': 'norm_ratio', 'imputers': 'mean', 'n_estimators': 2300, 'learning_rate': 0.49969623852190476, 'max_depth': 8, 'min_child_weight': 1, 'subsample': 0.5, 'colsample_bytree': 0.5, 'colsample_bylevel': 0.8, 'reg_alpha': 0.8924181397448339, 'reg_lambda': 7.019400217813907e-06, 'gamma': 1.8388859681726083e-05}. Best is trial 359 with value: -0.8315037537709427.
[I 2026-07-20 14:43:06,026] Trial 429 finished with value: -0.5202003889102971 and parameters: {'error_threshold': 2.0, 'scalers': 'robust', 'ratios': 'norm_ratio', 'imputers': 'mean', 'n_estimators': 2300, 'learning_rate': 0.3724462829386739, 'max_depth': 8, 'min_child_weight': 1, 'subsample': 0.5, 'colsample_bytree': 0.5, 'colsample_bylevel': 0.8, 'reg_alpha': 0.9640496368789025, 'reg_lambda': 5.882267957430853e-06, 'gamma': 1.3171327002320532e-05}. Best is trial 359 with value: -0.8315037537709427.
[I 2026-07-20 14:43:35,177] Trial 430 finished with value: -0.688029949636458 and parameters: {'error_threshold': 2.0, 'scalers': 'robust', 'ratios': 'norm_ratio', 'imputers': 'mean', 'n_estimators': 2250, 'learning_rate': 0.4944917314109052, 'max_depth': 8, 'min_child_weight': 1, 'subsample': 0.5, 'colsample_bytree': 0.5, 'colsample_bylevel': 0.9, 'reg_alpha': 0.957909756991914, 'reg_lambda': 8.924524961429805e-06, 'gamma': 6.768388813186284e-06}. Best is trial 359 with value: -0.8315037537709427.
[I 2026-07-20 14:43:49,484] Trial 431 finished with value: -0.7477949818610304 and parameters: {'error_threshold': 2.0, 'scalers': 'standard', 'ratios': 'norm_ratio', 'imputers': 'mean', 'n_estimators': 2300, 'learning_rate': 0.4998541281493509, 'max_depth': 8, 'min_child_weight': 1, 'subsample': 0.5, 'colsample_bytree': 0.5, 'colsample_bylevel': 0.7, 'reg_alpha': 1.132578301325688, 'reg_lambda': 1.5024530115381877e-06, 'gamma': 8.752521487313047e-06}. Best is trial 359 with value: -0.8315037537709427.
[I 2026-07-20 14:43:54,490] Trial 432 finished with value: -0.3094775409423012 and parameters: {'error_threshold': 2.0, 'scalers': 'standard', 'ratios': 'norm_ratio', 'imputers': 'mean', 'n_estimators': 2300, 'learning_rate': 0.3764377197515614, 'max_depth': 8, 'min_child_weight': 1, 'subsample': 0.5, 'colsample_bytree': 0.5, 'colsample_bylevel': 0.9, 'reg_alpha': 5.074828275860192, 'reg_lambda': 4.821595530350138e-06, 'gamma': 1.705859064045838e-05}. Best is trial 359 with value: -0.8315037537709427.
[I 2026-07-20 14:44:00,842] Trial 433 finished with value: -0.6441679644035126 and parameters: {'error_threshold': 2.0, 'scalers': 'standard', 'ratios': 'norm_ratio', 'imputers': 'mean', 'n_estimators': 2300, 'learning_rate': 0.4972828318507325, 'max_depth': 7, 'min_child_weight': 1, 'subsample': 0.5, 'colsample_bytree': 0.5, 'colsample_bylevel': 0.9, 'reg_alpha': 1.7962440874493304, 'reg_lambda': 8.457055842054322e-06, 'gamma': 8.240003371437553e-06}. Best is trial 359 with value: -0.8315037537709427.
[I 2026-07-20 14:44:04,175] Trial 434 finished with value: -0.2993703929485824 and parameters: {'error_threshold': 2.0, 'scalers': 'standard', 'ratios': 'norm_ratio', 'imputers': 'mean', 'n_estimators': 2300, 'learning_rate': 0.32780922181691646, 'max_depth': 7, 'min_child_weight': 1, 'subsample': 0.5, 'colsample_bytree': 0.5, 'colsample_bylevel': 0.7, 'reg_alpha': 0.00941272034420697, 'reg_lambda': 8.666555411086268e-06, 'gamma': 6.669793483329109e-06}. Best is trial 359 with value: -0.8315037537709427.
[I 2026-07-20 14:44:07,411] Trial 435 finished with value: -0.2789919052270771 and parameters: {'error_threshold': 2.0, 'scalers': 'standard', 'ratios': 'norm_ratio', 'imputers': 'mean', 'n_estimators': 2300, 'learning_rate': 0.3306960889046, 'max_depth': 7, 'min_child_weight': 1, 'subsample': 0.5, 'colsample_bytree': 0.5, 'colsample_bylevel': 0.7, 'reg_alpha': 4.33967742709987, 'reg_lambda': 1.0193897800413437e-05, 'gamma': 2.7527937944182076e-06}. Best is trial 359 with value: -0.8315037537709427.
[I 2026-07-20 14:44:17,522] Trial 436 finished with value: -0.45145361563081804 and parameters: {'error_threshold': 2.0, 'scalers': 'standard', 'ratios': 'norm_ratio', 'imputers': 'mean', 'n_estimators': 2300, 'learning_rate': 0.3346962129078037, 'max_depth': 7, 'min_child_weight': 1, 'subsample': 0.5, 'colsample_bytree': 0.5, 'colsample_bylevel': 0.7, 'reg_alpha': 1.6674794368238994, 'reg_lambda': 1.1425310991231481e-06, 'gamma': 1.2783153923929127e-05}. Best is trial 359 with value: -0.8315037537709427.
[I 2026-07-20 14:45:02,762] Trial 437 finished with value: -0.3257563818183202 and parameters: {'error_threshold': 2.0, 'scalers': 'robust', 'ratios': 'norm_ratio', 'imputers': 'mean', 'n_estimators': 2150, 'learning_rate': 0.4999800768511961, 'max_depth': 7, 'min_child_weight': 1, 'subsample': 0.5, 'colsample_bytree': 0.5, 'colsample_bylevel': 0.7, 'reg_alpha': 4.652126931967243, 'reg_lambda': 2.9026450173213237e-06, 'gamma': 0.002476553923435385}. Best is trial 359 with value: -0.8315037537709427.
[I 2026-07-20 14:45:03,608] Trial 439 finished with value: -0.17936699024684288 and parameters: {'error_threshold': 2.0, 'scalers': 'robust', 'ratios': 'norm_ratio', 'imputers': 'mean', 'n_estimators': 2250, 'learning_rate': 0.3139191222937887, 'max_depth': 7, 'min_child_weight': 1, 'subsample': 0.5, 'colsample_bytree': 0.5, 'colsample_bylevel': 0.7, 'reg_alpha': 94.67324620781282, 'reg_lambda': 4.290733785357865e-06, 'gamma': 7.504811189818571e-06}. Best is trial 359 with value: -0.8315037537709427.
[I 2026-07-20 14:45:30,561] Trial 438 finished with value: -0.4130000805992588 and parameters: {'error_threshold': 2.0, 'scalers': 'robust', 'ratios': 'norm_ratio', 'imputers': 'mean', 'n_estimators': 2150, 'learning_rate': 0.3201056929189703, 'max_depth': 7, 'min_child_weight': 1, 'subsample': 0.5, 'colsample_bytree': 0.5, 'colsample_bylevel': 0.9, 'reg_alpha': 1.7697668869030583, 'reg_lambda': 9.514985580861124e-06, 'gamma': 8.19940321314892e-06}. Best is trial 359 with value: -0.8315037537709427.
[I 2026-07-20 14:45:31,461] Trial 442 finished with value: -0.17340522628170066 and parameters: {'error_threshold': 2.0, 'scalers': 'robust', 'ratios': 'norm_ratio', 'imputers': 'mean', 'n_estimators': 2150, 'learning_rate': 0.021401920718607224, 'max_depth': 8, 'min_child_weight': 1, 'subsample': 0.5, 'colsample_bytree': 0.5, 'colsample_bylevel': 0.7, 'reg_alpha': 48.68370994580852, 'reg_lambda': 1.0218956260555702e-06, 'gamma': 2.6880662720463983e-05}. Best is trial 359 with value: -0.8315037537709427.
[I 2026-07-20 14:45:36,243] Trial 440 finished with value: -0.4285269660076556 and parameters: {'error_threshold': 2.0, 'scalers': 'robust', 'ratios': 'norm_ratio', 'imputers': 'mean', 'n_estimators': 2250, 'learning_rate': 0.3242111622858205, 'max_depth': 7, 'min_child_weight': 1, 'subsample': 0.5, 'colsample_bytree': 0.5, 'colsample_bylevel': 0.7, 'reg_alpha': 1.6992673737449266, 'reg_lambda': 1.3547979300233734e-05, 'gamma': 6.164160343332422e-06}. Best is trial 359 with value: -0.8315037537709427.
[I 2026-07-20 14:45:37,265] Trial 444 finished with value: -0.1748447562103744 and parameters: {'error_threshold': 2.25, 'scalers': 'robust', 'ratios': 'norm_ratio', 'imputers': 'mean', 'n_estimators': 2200, 'learning_rate': 0.41257330341507215, 'max_depth': 8, 'min_child_weight': 1, 'subsample': 0.5, 'colsample_bytree': 0.5, 'colsample_bylevel': 0.7, 'reg_alpha': 63.54161679700586, 'reg_lambda': 1.533519967779484e-05, 'gamma': 2.3686539892587542e-05}. Best is trial 359 with value: -0.8315037537709427.
[I 2026-07-20 14:45:51,498] Trial 441 finished with value: -0.4806695173989646 and parameters: {'error_threshold': 2.0, 'scalers': 'robust', 'ratios': 'norm_ratio', 'imputers': 'mean', 'n_estimators': 2150, 'learning_rate': 0.33305744811343085, 'max_depth': 8, 'min_child_weight': 1, 'subsample': 0.5, 'colsample_bytree': 0.5, 'colsample_bylevel': 0.7, 'reg_alpha': 1.750376065902113, 'reg_lambda': 1.3521987143615729e-05, 'gamma': 2.5121345963784526e-05}. Best is trial 359 with value: -0.8315037537709427.
[I 2026-07-20 14:45:57,160] Trial 443 finished with value: -0.6003622447645357 and parameters: {'error_threshold': 2.0, 'scalers': 'robust', 'ratios': 'norm_ratio', 'imputers': 'mean', 'n_estimators': 2200, 'learning_rate': 0.411847910281204, 'max_depth': 8, 'min_child_weight': 1, 'subsample': 0.5, 'colsample_bytree': 0.5, 'colsample_bylevel': 0.7, 'reg_alpha': 1.6731071808855325, 'reg_lambda': 1.5096056397163804e-05, 'gamma': 1.0260864682576978e-05}. Best is trial 359 with value: -0.8315037537709427.
[I 2026-07-20 14:47:28,141] Trial 446 finished with value: -0.443315558310557 and parameters: {'error_threshold': 2.25, 'scalers': 'robust', 'ratios': 'norm_ratio', 'imputers': 'mean', 'n_estimators': 2100, 'learning_rate': 0.3980818700023242, 'max_depth': 8, 'min_child_weight': 1, 'subsample': 0.5, 'colsample_bytree': 0.5, 'colsample_bylevel': 0.7, 'reg_alpha': 3.0209975423999986, 'reg_lambda': 1.08141869541599e-06, 'gamma': 2.687026566720387e-06}. Best is trial 359 with value: -0.8315037537709427.
[I 2026-07-20 14:47:44,019] Trial 445 finished with value: -0.554616066456972 and parameters: {'error_threshold': 2.25, 'scalers': 'robust', 'ratios': 'norm_ratio', 'imputers': 'mean', 'n_estimators': 2150, 'learning_rate': 0.408790937184653, 'max_depth': 8, 'min_child_weight': 1, 'subsample': 0.5, 'colsample_bytree': 0.5, 'colsample_bylevel': 0.7, 'reg_alpha': 1.9456830339520825, 'reg_lambda': 9.461469532758829e-06, 'gamma': 1.7222772127587513e-05}. Best is trial 359 with value: -0.8315037537709427.
[I 2026-07-20 14:47:58,188] Trial 447 finished with value: -0.501132229337111 and parameters: {'error_threshold': 2.25, 'scalers': 'robust', 'ratios': 'norm_ratio', 'imputers': 'mean', 'n_estimators': 2200, 'learning_rate': 0.4142493448052076, 'max_depth': 8, 'min_child_weight': 1, 'subsample': 0.5, 'colsample_bytree': 0.5, 'colsample_bylevel': 0.7, 'reg_alpha': 2.65383850502659, 'reg_lambda': 2.015033133982621e-05, 'gamma': 1.6028363118162254e-05}. Best is trial 359 with value: -0.8315037537709427.
[I 2026-07-20 14:48:02,504] Trial 448 finished with value: -0.48207351854811936 and parameters: {'error_threshold': 2.25, 'scalers': 'robust', 'ratios': 'norm_ratio', 'imputers': 'mean', 'n_estimators': 2250, 'learning_rate': 0.40897186094629384, 'max_depth': 8, 'min_child_weight': 1, 'subsample': 0.5, 'colsample_bytree': 0.5, 'colsample_bylevel': 0.7, 'reg_alpha': 2.753377200578845, 'reg_lambda': 1.7497133567420613e-06, 'gamma': 1.7881096258408007e-05}. Best is trial 359 with value: -0.8315037537709427.
[I 2026-07-20 14:48:06,839] Trial 449 finished with value: -0.5233957087772406 and parameters: {'error_threshold': 2.25, 'scalers': 'robust', 'ratios': 'norm_ratio', 'imputers': 'mean', 'n_estimators': 2100, 'learning_rate': 0.4119749225192837, 'max_depth': 8, 'min_child_weight': 1, 'subsample': 0.5, 'colsample_bytree': 0.5, 'colsample_bylevel': 0.7, 'reg_alpha': 2.475956872434009, 'reg_lambda': 9.755511500188561e-06, 'gamma': 1.9447845536851298e-05}. Best is trial 359 with value: -0.8315037537709427.
[I 2026-07-20 14:48:10,988] Trial 450 finished with value: -0.4772917328163409 and parameters: {'error_threshold': 2.25, 'scalers': 'robust', 'ratios': 'norm_ratio', 'imputers': 'mean', 'n_estimators': 2100, 'learning_rate': 0.4073437195839715, 'max_depth': 8, 'min_child_weight': 1, 'subsample': 0.5, 'colsample_bytree': 0.5, 'colsample_bylevel': 0.7, 'reg_alpha': 2.7010178923671533, 'reg_lambda': 6.73509234034016e-06, 'gamma': 1.605243970765659e-05}. Best is trial 359 with value: -0.8315037537709427.
[I 2026-07-20 14:48:22,474] Trial 451 finished with value: -0.4973967337241201 and parameters: {'error_threshold': 2.25, 'scalers': 'robust', 'ratios': 'norm_ratio', 'imputers': 'mean', 'n_estimators': 2350, 'learning_rate': 0.41581098286780255, 'max_depth': 8, 'min_child_weight': 1, 'subsample': 0.5, 'colsample_bytree': 0.5, 'colsample_bylevel': 0.7, 'reg_alpha': 2.84852425127909, 'reg_lambda': 2.116423944290117e-05, 'gamma': 9.251335851056684e-06}. Best is trial 359 with value: -0.8315037537709427.
[I 2026-07-20 14:48:30,947] Trial 452 finished with value: -0.3974684914556042 and parameters: {'error_threshold': 2.25, 'scalers': 'robust', 'ratios': 'norm_ratio', 'imputers': 'mean', 'n_estimators': 2350, 'learning_rate': 0.4171389940704976, 'max_depth': 8, 'min_child_weight': 2, 'subsample': 0.5, 'colsample_bytree': 0.5, 'colsample_bylevel': 0.7, 'reg_alpha': 2.985897668543198, 'reg_lambda': 6.137742649458475e-06, 'gamma': 1.388848790097573e-05}. Best is trial 359 with value: -0.8315037537709427.
[I 2026-07-20 14:50:34,383] Trial 453 finished with value: -0.5829092313288149 and parameters: {'error_threshold': 2.25, 'scalers': 'robust', 'ratios': 'norm_ratio', 'imputers': 'mean', 'n_estimators': 2350, 'learning_rate': 0.4177973527961884, 'max_depth': 8, 'min_child_weight': 1, 'subsample': 0.5, 'colsample_bytree': 0.5, 'colsample_bylevel': 0.8, 'reg_alpha': 1.2289199504982782, 'reg_lambda': 2.5300678982524622e-05, 'gamma': 1.6370224363448167e-05}. Best is trial 359 with value: -0.8315037537709427.
[I 2026-07-20 14:50:38,719] Trial 454 finished with value: -0.4036079540084241 and parameters: {'error_threshold': 2.5, 'scalers': 'robust', 'ratios': 'norm_ratio', 'imputers': 'mean', 'n_estimators': 2350, 'learning_rate': 0.424572073224304, 'max_depth': 8, 'min_child_weight': 2, 'subsample': 0.5, 'colsample_bytree': 0.5, 'colsample_bylevel': 0.7, 'reg_alpha': 2.9206018762827304, 'reg_lambda': 2.7322318706360108e-05, 'gamma': 3.906204875903568e-06}. Best is trial 359 with value: -0.8315037537709427.
[I 2026-07-20 14:50:56,988] Trial 455 finished with value: -0.4169033106649684 and parameters: {'error_threshold': 2.5, 'scalers': 'robust', 'ratios': 'norm_ratio', 'imputers': 'mean', 'n_estimators': 2250, 'learning_rate': 0.4227583517262111, 'max_depth': 8, 'min_child_weight': 2, 'subsample': 0.5, 'colsample_bytree': 0.5, 'colsample_bylevel': 0.8, 'reg_alpha': 1.1830844337761064, 'reg_lambda': 4.986469620584479e-06, 'gamma': 4.505406340676262e-06}. Best is trial 359 with value: -0.8315037537709427.
[I 2026-07-20 14:51:04,193] Trial 456 finished with value: -0.7445639249737718 and parameters: {'error_threshold': 2.5, 'scalers': 'robust', 'ratios': 'norm_ratio', 'imputers': 'mean', 'n_estimators': 2350, 'learning_rate': 0.49778509592412923, 'max_depth': 8, 'min_child_weight': 1, 'subsample': 0.5, 'colsample_bytree': 0.5, 'colsample_bylevel': 0.8, 'reg_alpha': 1.2284717840914174, 'reg_lambda': 6.343128849508611e-06, 'gamma': 1.5670781457576838e-05}. Best is trial 359 with value: -0.8315037537709427.
[I 2026-07-20 14:51:10,737] Trial 457 finished with value: -0.4806317122936043 and parameters: {'error_threshold': 2.5, 'scalers': 'robust', 'ratios': 'norm_ratio', 'imputers': 'mean', 'n_estimators': 2350, 'learning_rate': 0.49982460354871405, 'max_depth': 8, 'min_child_weight': 2, 'subsample': 0.5, 'colsample_bytree': 0.5, 'colsample_bylevel': 0.8, 'reg_alpha': 1.4357948563246241, 'reg_lambda': 6.220240796339359e-06, 'gamma': 4.62993173370322e-06}. Best is trial 359 with value: -0.8315037537709427.
[I 2026-07-20 14:51:17,304] Trial 458 finished with value: -0.41622065454919804 and parameters: {'error_threshold': 2.5, 'scalers': 'standard', 'ratios': 'norm_ratio', 'imputers': 'mean', 'n_estimators': 2350, 'learning_rate': 0.4306750467061558, 'max_depth': 8, 'min_child_weight': 2, 'subsample': 0.5, 'colsample_bytree': 0.5, 'colsample_bylevel': 0.8, 'reg_alpha': 1.1809056205261508, 'reg_lambda': 8.572626274960982e-05, 'gamma': 8.71914155683037e-06}. Best is trial 359 with value: -0.8315037537709427.
[I 2026-07-20 14:51:23,984] Trial 459 finished with value: -0.45800900010775353 and parameters: {'error_threshold': 2.5, 'scalers': 'standard', 'ratios': 'norm_ratio', 'imputers': 'mean', 'n_estimators': 2350, 'learning_rate': 0.4924003592539252, 'max_depth': 8, 'min_child_weight': 2, 'subsample': 0.5, 'colsample_bytree': 0.5, 'colsample_bylevel': 0.8, 'reg_alpha': 1.1146402041529966, 'reg_lambda': 4.860691239463357e-06, 'gamma': 4.305323874806698e-06}. Best is trial 359 with value: -0.8315037537709427.
[I 2026-07-20 14:51:42,761] Trial 460 finished with value: -0.7507016217480951 and parameters: {'error_threshold': 2.5, 'scalers': 'standard', 'ratios': 'norm_ratio', 'imputers': 'mean', 'n_estimators': 2350, 'learning_rate': 0.49012530032035895, 'max_depth': 8, 'min_child_weight': 1, 'subsample': 0.5, 'colsample_bytree': 0.5, 'colsample_bylevel': 0.8, 'reg_alpha': 1.3037732260310506, 'reg_lambda': 2.8260792741223784e-06, 'gamma': 8.01352848980459e-06}. Best is trial 359 with value: -0.8315037537709427.
[I 2026-07-20 14:53:47,968] Trial 461 finished with value: -0.7190658311458051 and parameters: {'error_threshold': 2.5, 'scalers': 'standard', 'ratios': 'norm_ratio', 'imputers': 'mean', 'n_estimators': 2250, 'learning_rate': 0.49517120093938216, 'max_depth': 8, 'min_child_weight': 1, 'subsample': 0.5, 'colsample_bytree': 0.5, 'colsample_bylevel': 0.8, 'reg_alpha': 1.1489949437823201, 'reg_lambda': 3.700688758866628e-06, 'gamma': 3.2920326250073964e-05}. Best is trial 359 with value: -0.8315037537709427.
[I 2026-07-20 14:53:52,685] Trial 462 finished with value: -0.2734985725884739 and parameters: {'error_threshold': 2.5, 'scalers': 'standard', 'ratios': 'norm_ratio', 'imputers': 'mean', 'n_estimators': 2250, 'learning_rate': 0.49129132215443283, 'max_depth': 8, 'min_child_weight': 10, 'subsample': 0.5, 'colsample_bytree': 0.5, 'colsample_bylevel': 0.8, 'reg_alpha': 1.1372368981390883, 'reg_lambda': 3.9050724486528465e-06, 'gamma': 3.45613454310405e-05}. Best is trial 359 with value: -0.8315037537709427.
[I 2026-07-20 14:53:58,843] Trial 463 finished with value: -0.42785585784080804 and parameters: {'error_threshold': 2.5, 'scalers': 'standard', 'ratios': 'norm_ratio', 'imputers': 'mean', 'n_estimators': 2250, 'learning_rate': 0.2687731432995663, 'max_depth': 8, 'min_child_weight': 1, 'subsample': 0.5, 'colsample_bytree': 0.5, 'colsample_bylevel': 0.7, 'reg_alpha': 1.1291582830401246, 'reg_lambda': 0.0001248090369898716, 'gamma': 1.0640641863779346e-05}. Best is trial 359 with value: -0.8315037537709427.
[I 2026-07-20 14:54:23,001] Trial 464 finished with value: -0.7220920762601867 and parameters: {'error_threshold': 2.5, 'scalers': 'standard', 'ratios': 'norm_ratio', 'imputers': 'mean', 'n_estimators': 2400, 'learning_rate': 0.4924893140407862, 'max_depth': 8, 'min_child_weight': 1, 'subsample': 0.5, 'colsample_bytree': 0.5, 'colsample_bylevel': 0.8, 'reg_alpha': 1.2336498790397274, 'reg_lambda': 1.5837922758321622e-06, 'gamma': 4.359813168482549e-05}. Best is trial 359 with value: -0.8315037537709427.
[I 2026-07-20 14:54:30,338] Trial 465 finished with value: -0.7603098874117741 and parameters: {'error_threshold': 2.5, 'scalers': 'standard', 'ratios': 'norm_ratio', 'imputers': 'mean', 'n_estimators': 2400, 'learning_rate': 0.49451680342313503, 'max_depth': 8, 'min_child_weight': 1, 'subsample': 0.5, 'colsample_bytree': 0.5, 'colsample_bylevel': 0.8, 'reg_alpha': 1.3143627323212357, 'reg_lambda': 3.467561469333635e-06, 'gamma': 1.133101825120478e-05}. Best is trial 359 with value: -0.8315037537709427.
