[I 2026-07-20 18:25:16,225] Trial 140 finished with value: -3.8230765173601013 and parameters: {'error_threshold': 3.1, 'scalers': 'standard', 'ratios': 'norm_ratio', 'imputers': 'mean', 'n_estimators': 500, 'learning_rate': 0.010182013447669237, 'max_depth': 11, 'min_child_weight': 7, 'subsample': 0.9, 'colsample_bytree': 1.0, 'colsample_bylevel': 0.6, 'reg_alpha': 6.252887530096949e-05, 'reg_lambda': 0.0003067180343790868, 'gamma': 41.25027004545914}. Best is trial 50 with value: -3.7835498517890067.
/bsuhome/alexanderemert/Research/Star-Formation-Research-Project-2026/pipeline/scripts/optuna/final_preds_and_models/optuna_search_mult_quant_reg.py:161: UserWarning: The distribution is specified by [0.1, 5] and step=0.25, but the range is not divisible by `step`. It will be replaced with [0.1, 4.85].
  error_threshold = trial.suggest_float("error_threshold", 0.1, 5, step=0.25)
[I 2026-07-20 18:25:16,653] Trial 142 finished with value: -3.799849994921262 and parameters: {'error_threshold': 3.1, 'scalers': 'standard', 'ratios': 'norm_ratio', 'imputers': 'mean', 'n_estimators': 550, 'learning_rate': 0.018590598525098083, 'max_depth': 11, 'min_child_weight': 7, 'subsample': 0.9, 'colsample_bytree': 1.0, 'colsample_bylevel': 0.6, 'reg_alpha': 5.4794640193144384e-05, 'reg_lambda': 0.026836447889142936, 'gamma': 99.95780758837031}. Best is trial 50 with value: -3.7835498517890067.
/bsuhome/alexanderemert/Research/Star-Formation-Research-Project-2026/pipeline/scripts/optuna/final_preds_and_models/optuna_search_mult_quant_reg.py:161: UserWarning: The distribution is specified by [0.1, 5] and step=0.25, but the range is not divisible by `step`. It will be replaced with [0.1, 4.85].
  error_threshold = trial.suggest_float("error_threshold", 0.1, 5, step=0.25)
[I 2026-07-20 18:25:17,109] Trial 143 finished with value: -4.282570057934846 and parameters: {'error_threshold': 3.1, 'scalers': 'standard', 'ratios': 'norm_ratio', 'imputers': 'mean', 'n_estimators': 550, 'learning_rate': 0.2641858112328571, 'max_depth': 3, 'min_child_weight': 7, 'subsample': 0.9, 'colsample_bytree': 1.0, 'colsample_bylevel': 0.7, 'reg_alpha': 0.00012236342232893713, 'reg_lambda': 8.800301177327629e-05, 'gamma': 8.032510784715399e-06}. Best is trial 50 with value: -3.7835498517890067.
/bsuhome/alexanderemert/Research/Star-Formation-Research-Project-2026/pipeline/scripts/optuna/final_preds_and_models/optuna_search_mult_quant_reg.py:161: UserWarning: The distribution is specified by [0.1, 5] and step=0.25, but the range is not divisible by `step`. It will be replaced with [0.1, 4.85].
  error_threshold = trial.suggest_float("error_threshold", 0.1, 5, step=0.25)
[I 2026-07-20 18:25:18,429] Trial 141 finished with value: -3.8170019096559304 and parameters: {'error_threshold': 2.35, 'scalers': 'standard', 'ratios': 'norm_ratio', 'imputers': 'mean', 'n_estimators': 550, 'learning_rate': 0.009239270587983408, 'max_depth': 11, 'min_child_weight': 7, 'subsample': 0.9, 'colsample_bytree': 1.0, 'colsample_bylevel': 0.6, 'reg_alpha': 2.3865343832335202e-05, 'reg_lambda': 0.028951423677698776, 'gamma': 44.65147637452049}. Best is trial 50 with value: -3.7835498517890067.
/bsuhome/alexanderemert/Research/Star-Formation-Research-Project-2026/pipeline/scripts/optuna/final_preds_and_models/optuna_search_mult_quant_reg.py:161: UserWarning: The distribution is specified by [0.1, 5] and step=0.25, but the range is not divisible by `step`. It will be replaced with [0.1, 4.85].
  error_threshold = trial.suggest_float("error_threshold", 0.1, 5, step=0.25)
[I 2026-07-20 18:25:18,951] Trial 144 finished with value: -4.2458571078692176 and parameters: {'error_threshold': 3.1, 'scalers': 'standard', 'ratios': 'norm_ratio', 'imputers': 'mean', 'n_estimators': 650, 'learning_rate': 0.21755505126583424, 'max_depth': 3, 'min_child_weight': 7, 'subsample': 0.9, 'colsample_bytree': 1.0, 'colsample_bylevel': 0.6, 'reg_alpha': 0.00011706377311332205, 'reg_lambda': 0.0002724696457325323, 'gamma': 1.1639684089174047e-05}. Best is trial 50 with value: -3.7835498517890067.
/bsuhome/alexanderemert/Research/Star-Formation-Research-Project-2026/pipeline/scripts/optuna/final_preds_and_models/optuna_search_mult_quant_reg.py:161: UserWarning: The distribution is specified by [0.1, 5] and step=0.25, but the range is not divisible by `step`. It will be replaced with [0.1, 4.85].
  error_threshold = trial.suggest_float("error_threshold", 0.1, 5, step=0.25)
[I 2026-07-20 18:25:19,237] Trial 146 finished with value: -4.061322740080969 and parameters: {'error_threshold': 3.1, 'scalers': 'standard', 'ratios': 'norm_ratio', 'imputers': 'mean', 'n_estimators': 550, 'learning_rate': 0.19311938752991298, 'max_depth': 3, 'min_child_weight': 9, 'subsample': 0.9, 'colsample_bytree': 1.0, 'colsample_bylevel': 0.6, 'reg_alpha': 8.555126901505709e-05, 'reg_lambda': 0.00018967733819383426, 'gamma': 11.75002353143352}. Best is trial 50 with value: -3.7835498517890067.
/bsuhome/alexanderemert/Research/Star-Formation-Research-Project-2026/pipeline/scripts/optuna/final_preds_and_models/optuna_search_mult_quant_reg.py:161: UserWarning: The distribution is specified by [0.1, 5] and step=0.25, but the range is not divisible by `step`. It will be replaced with [0.1, 4.85].
  error_threshold = trial.suggest_float("error_threshold", 0.1, 5, step=0.25)
[I 2026-07-20 18:25:19,663] Trial 145 finished with value: -4.45285223694452 and parameters: {'error_threshold': 3.1, 'scalers': 'standard', 'ratios': 'norm_ratio', 'imputers': 'mean', 'n_estimators': 550, 'learning_rate': 0.36364479128913635, 'max_depth': 3, 'min_child_weight': 7, 'subsample': 0.9, 'colsample_bytree': 1.0, 'colsample_bylevel': 0.6, 'reg_alpha': 5.861844596709972e-05, 'reg_lambda': 6.901692279903791e-05, 'gamma': 1.0734008338338067e-05}. Best is trial 50 with value: -3.7835498517890067.
/bsuhome/alexanderemert/Research/Star-Formation-Research-Project-2026/pipeline/scripts/optuna/final_preds_and_models/optuna_search_mult_quant_reg.py:161: UserWarning: The distribution is specified by [0.1, 5] and step=0.25, but the range is not divisible by `step`. It will be replaced with [0.1, 4.85].
  error_threshold = trial.suggest_float("error_threshold", 0.1, 5, step=0.25)
[I 2026-07-20 18:25:20,020] Trial 147 finished with value: -4.0831925131801 and parameters: {'error_threshold': 2.35, 'scalers': 'standard', 'ratios': 'norm_ratio', 'imputers': 'mean', 'n_estimators': 650, 'learning_rate': 0.2196467872647004, 'max_depth': 3, 'min_child_weight': 7, 'subsample': 0.9, 'colsample_bytree': 1.0, 'colsample_bylevel': 0.7, 'reg_alpha': 4.871528303433478e-05, 'reg_lambda': 0.011190738675344834, 'gamma': 11.697806847393066}. Best is trial 50 with value: -3.7835498517890067.
/bsuhome/alexanderemert/Research/Star-Formation-Research-Project-2026/pipeline/scripts/optuna/final_preds_and_models/optuna_search_mult_quant_reg.py:161: UserWarning: The distribution is specified by [0.1, 5] and step=0.25, but the range is not divisible by `step`. It will be replaced with [0.1, 4.85].
  error_threshold = trial.suggest_float("error_threshold", 0.1, 5, step=0.25)
[I 2026-07-20 18:25:20,260] Trial 148 finished with value: -4.040056616579036 and parameters: {'error_threshold': 2.35, 'scalers': 'standard', 'ratios': 'norm_ratio', 'imputers': 'mean', 'n_estimators': 650, 'learning_rate': 0.3717157304196802, 'max_depth': 3, 'min_child_weight': 7, 'subsample': 0.9, 'colsample_bytree': 1.0, 'colsample_bylevel': 0.7, 'reg_alpha': 5.5255514796716796e-05, 'reg_lambda': 0.0001535751197752036, 'gamma': 21.89687759382681}. Best is trial 50 with value: -3.7835498517890067.
/bsuhome/alexanderemert/Research/Star-Formation-Research-Project-2026/pipeline/scripts/optuna/final_preds_and_models/optuna_search_mult_quant_reg.py:161: UserWarning: The distribution is specified by [0.1, 5] and step=0.25, but the range is not divisible by `step`. It will be replaced with [0.1, 4.85].
  error_threshold = trial.suggest_float("error_threshold", 0.1, 5, step=0.25)
[I 2026-07-20 18:25:20,529] Trial 149 finished with value: -3.941462057665848 and parameters: {'error_threshold': 2.85, 'scalers': 'standard', 'ratios': 'norm_ratio', 'imputers': 'mean', 'n_estimators': 700, 'learning_rate': 0.19978110888811357, 'max_depth': 3, 'min_child_weight': 7, 'subsample': 0.9, 'colsample_bytree': 1.0, 'colsample_bylevel': 0.7, 'reg_alpha': 4.973268473374238e-05, 'reg_lambda': 0.008755841180973946, 'gamma': 23.426612341569882}. Best is trial 50 with value: -3.7835498517890067.
/bsuhome/alexanderemert/Research/Star-Formation-Research-Project-2026/pipeline/scripts/optuna/final_preds_and_models/optuna_search_mult_quant_reg.py:161: UserWarning: The distribution is specified by [0.1, 5] and step=0.25, but the range is not divisible by `step`. It will be replaced with [0.1, 4.85].
  error_threshold = trial.suggest_float("error_threshold", 0.1, 5, step=0.25)
[I 2026-07-20 18:25:20,714] Trial 150 finished with value: -3.7867439456108865 and parameters: {'error_threshold': 2.85, 'scalers': 'standard', 'ratios': 'norm_ratio', 'imputers': 'mean', 'n_estimators': 650, 'learning_rate': 0.18946133262557072, 'max_depth': 3, 'min_child_weight': 7, 'subsample': 0.9, 'colsample_bytree': 1.0, 'colsample_bylevel': 0.6, 'reg_alpha': 5.357204757420213e-05, 'reg_lambda': 0.007670996759579311, 'gamma': 90.37531206028798}. Best is trial 50 with value: -3.7835498517890067.
/bsuhome/alexanderemert/Research/Star-Formation-Research-Project-2026/pipeline/scripts/optuna/final_preds_and_models/optuna_search_mult_quant_reg.py:161: UserWarning: The distribution is specified by [0.1, 5] and step=0.25, but the range is not divisible by `step`. It will be replaced with [0.1, 4.85].
  error_threshold = trial.suggest_float("error_threshold", 0.1, 5, step=0.25)
[I 2026-07-20 18:25:21,049] Trial 151 finished with value: -3.7847648407606322 and parameters: {'error_threshold': 2.6, 'scalers': 'standard', 'ratios': 'norm_ratio', 'imputers': 'mean', 'n_estimators': 600, 'learning_rate': 0.016725063654689367, 'max_depth': 3, 'min_child_weight': 9, 'subsample': 0.9, 'colsample_bytree': 1.0, 'colsample_bylevel': 0.7, 'reg_alpha': 5.355791556917729e-05, 'reg_lambda': 0.009247210122927462, 'gamma': 93.39592961615757}. Best is trial 50 with value: -3.7835498517890067.
/bsuhome/alexanderemert/Research/Star-Formation-Research-Project-2026/pipeline/scripts/optuna/final_preds_and_models/optuna_search_mult_quant_reg.py:161: UserWarning: The distribution is specified by [0.1, 5] and step=0.25, but the range is not divisible by `step`. It will be replaced with [0.1, 4.85].
  error_threshold = trial.suggest_float("error_threshold", 0.1, 5, step=0.25)
[I 2026-07-20 18:25:21,231] Trial 152 finished with value: -3.792973791693029 and parameters: {'error_threshold': 2.85, 'scalers': 'standard', 'ratios': 'norm_ratio', 'imputers': 'mean', 'n_estimators': 700, 'learning_rate': 0.18056028278785535, 'max_depth': 3, 'min_child_weight': 9, 'subsample': 0.9, 'colsample_bytree': 1.0, 'colsample_bylevel': 0.5, 'reg_alpha': 1.9709551678091834e-05, 'reg_lambda': 0.010718430093001146, 'gamma': 98.541292891704}. Best is trial 50 with value: -3.7835498517890067.
/bsuhome/alexanderemert/Research/Star-Formation-Research-Project-2026/pipeline/scripts/optuna/final_preds_and_models/optuna_search_mult_quant_reg.py:161: UserWarning: The distribution is specified by [0.1, 5] and step=0.25, but the range is not divisible by `step`. It will be replaced with [0.1, 4.85].
  error_threshold = trial.suggest_float("error_threshold", 0.1, 5, step=0.25)
[I 2026-07-20 18:25:21,436] Trial 153 finished with value: -4.117089539829634 and parameters: {'error_threshold': 2.6, 'scalers': 'standard', 'ratios': 'norm_ratio', 'imputers': 'mean', 'n_estimators': 700, 'learning_rate': 0.46032188112933015, 'max_depth': 3, 'min_child_weight': 9, 'subsample': 0.9, 'colsample_bytree': 1.0, 'colsample_bylevel': 0.5, 'reg_alpha': 1.5690686429727574e-05, 'reg_lambda': 0.009744491702658778, 'gamma': 21.144229318342283}. Best is trial 50 with value: -3.7835498517890067.
/bsuhome/alexanderemert/Research/Star-Formation-Research-Project-2026/pipeline/scripts/optuna/final_preds_and_models/optuna_search_mult_quant_reg.py:161: UserWarning: The distribution is specified by [0.1, 5] and step=0.25, but the range is not divisible by `step`. It will be replaced with [0.1, 4.85].
  error_threshold = trial.suggest_float("error_threshold", 0.1, 5, step=0.25)
[I 2026-07-20 18:25:21,699] Trial 154 finished with value: -3.787172454722816 and parameters: {'error_threshold': 1.1, 'scalers': 'standard', 'ratios': 'norm_ratio', 'imputers': 'mean', 'n_estimators': 700, 'learning_rate': 0.019316504342472274, 'max_depth': 3, 'min_child_weight': 9, 'subsample': 0.9, 'colsample_bytree': 1.0, 'colsample_bylevel': 0.5, 'reg_alpha': 0.0002292096428645338, 'reg_lambda': 0.008460951078502142, 'gamma': 98.34461053290768}. Best is trial 50 with value: -3.7835498517890067.
/bsuhome/alexanderemert/Research/Star-Formation-Research-Project-2026/pipeline/scripts/optuna/final_preds_and_models/optuna_search_mult_quant_reg.py:161: UserWarning: The distribution is specified by [0.1, 5] and step=0.25, but the range is not divisible by `step`. It will be replaced with [0.1, 4.85].
  error_threshold = trial.suggest_float("error_threshold", 0.1, 5, step=0.25)
[I 2026-07-20 18:25:21,833] Trial 155 finished with value: -3.787684810931614 and parameters: {'error_threshold': 2.85, 'scalers': 'standard', 'ratios': 'norm_ratio', 'imputers': 'mean', 'n_estimators': 250, 'learning_rate': 0.024294119241681348, 'max_depth': 3, 'min_child_weight': 9, 'subsample': 0.9, 'colsample_bytree': 1.0, 'colsample_bylevel': 0.5, 'reg_alpha': 0.0002148983820007072, 'reg_lambda': 0.000605407028029215, 'gamma': 97.85021285150215}. Best is trial 50 with value: -3.7835498517890067.
/bsuhome/alexanderemert/Research/Star-Formation-Research-Project-2026/pipeline/scripts/optuna/final_preds_and_models/optuna_search_mult_quant_reg.py:161: UserWarning: The distribution is specified by [0.1, 5] and step=0.25, but the range is not divisible by `step`. It will be replaced with [0.1, 4.85].
  error_threshold = trial.suggest_float("error_threshold", 0.1, 5, step=0.25)
[I 2026-07-20 18:25:22,258] Trial 156 finished with value: -3.7797925544159785 and parameters: {'error_threshold': 1.6, 'scalers': 'standard', 'ratios': 'norm_ratio', 'imputers': 'mean', 'n_estimators': 700, 'learning_rate': 0.01821438709706754, 'max_depth': 3, 'min_child_weight': 9, 'subsample': 0.9, 'colsample_bytree': 1.0, 'colsample_bylevel': 0.7, 'reg_alpha': 1.583167720771658e-05, 'reg_lambda': 0.0005647914406243218, 'gamma': 51.75174920809095}. Best is trial 156 with value: -3.7797925544159785.
/bsuhome/alexanderemert/Research/Star-Formation-Research-Project-2026/pipeline/scripts/optuna/final_preds_and_models/optuna_search_mult_quant_reg.py:161: UserWarning: The distribution is specified by [0.1, 5] and step=0.25, but the range is not divisible by `step`. It will be replaced with [0.1, 4.85].
  error_threshold = trial.suggest_float("error_threshold", 0.1, 5, step=0.25)
[I 2026-07-20 18:25:22,453] Trial 157 finished with value: -3.7847769592729517 and parameters: {'error_threshold': 1.6, 'scalers': 'standard', 'ratios': 'norm_ratio', 'imputers': 'mean', 'n_estimators': 250, 'learning_rate': 0.019343652163400487, 'max_depth': 4, 'min_child_weight': 9, 'subsample': 0.9, 'colsample_bytree': 1.0, 'colsample_bylevel': 0.5, 'reg_alpha': 1.6175584861552004e-05, 'reg_lambda': 0.000622332556252254, 'gamma': 96.8834008941344}. Best is trial 156 with value: -3.7797925544159785.
/bsuhome/alexanderemert/Research/Star-Formation-Research-Project-2026/pipeline/scripts/optuna/final_preds_and_models/optuna_search_mult_quant_reg.py:161: UserWarning: The distribution is specified by [0.1, 5] and step=0.25, but the range is not divisible by `step`. It will be replaced with [0.1, 4.85].
  error_threshold = trial.suggest_float("error_threshold", 0.1, 5, step=0.25)
[I 2026-07-20 18:25:22,754] Trial 158 finished with value: -3.780079517903021 and parameters: {'error_threshold': 1.6, 'scalers': 'standard', 'ratios': 'norm_ratio', 'imputers': 'mean', 'n_estimators': 850, 'learning_rate': 0.019033788694583886, 'max_depth': 3, 'min_child_weight': 9, 'subsample': 0.9, 'colsample_bytree': 1.0, 'colsample_bylevel': 0.5, 'reg_alpha': 1.8930143751239282e-05, 'reg_lambda': 0.0006825519815191601, 'gamma': 85.96736894079012}. Best is trial 156 with value: -3.7797925544159785.
/bsuhome/alexanderemert/Research/Star-Formation-Research-Project-2026/pipeline/scripts/optuna/final_preds_and_models/optuna_search_mult_quant_reg.py:161: UserWarning: The distribution is specified by [0.1, 5] and step=0.25, but the range is not divisible by `step`. It will be replaced with [0.1, 4.85].
  error_threshold = trial.suggest_float("error_threshold", 0.1, 5, step=0.25)
[I 2026-07-20 18:25:23,042] Trial 159 finished with value: -3.785370084633023 and parameters: {'error_threshold': 2.6, 'scalers': 'standard', 'ratios': 'norm_ratio', 'imputers': 'mean', 'n_estimators': 850, 'learning_rate': 0.018644444051012402, 'max_depth': 3, 'min_child_weight': 9, 'subsample': 0.9, 'colsample_bytree': 1.0, 'colsample_bylevel': 0.5, 'reg_alpha': 0.00024240493072192693, 'reg_lambda': 0.007938934990273637, 'gamma': 98.00695282623023}. Best is trial 156 with value: -3.7797925544159785.
/bsuhome/alexanderemert/Research/Star-Formation-Research-Project-2026/pipeline/scripts/optuna/final_preds_and_models/optuna_search_mult_quant_reg.py:161: UserWarning: The distribution is specified by [0.1, 5] and step=0.25, but the range is not divisible by `step`. It will be replaced with [0.1, 4.85].
  error_threshold = trial.suggest_float("error_threshold", 0.1, 5, step=0.25)
[I 2026-07-20 18:25:23,298] Trial 160 finished with value: -3.789954140878939 and parameters: {'error_threshold': 2.6, 'scalers': 'standard', 'ratios': 'norm_ratio', 'imputers': 'mean', 'n_estimators': 850, 'learning_rate': 0.172802199646729, 'max_depth': 3, 'min_child_weight': 9, 'subsample': 0.9, 'colsample_bytree': 1.0, 'colsample_bylevel': 0.5, 'reg_alpha': 1.672457698535065e-05, 'reg_lambda': 0.007796172539097381, 'gamma': 99.51952721193027}. Best is trial 156 with value: -3.7797925544159785.
/bsuhome/alexanderemert/Research/Star-Formation-Research-Project-2026/pipeline/scripts/optuna/final_preds_and_models/optuna_search_mult_quant_reg.py:161: UserWarning: The distribution is specified by [0.1, 5] and step=0.25, but the range is not divisible by `step`. It will be replaced with [0.1, 4.85].
  error_threshold = trial.suggest_float("error_threshold", 0.1, 5, step=0.25)
[I 2026-07-20 18:25:23,509] Trial 161 finished with value: -3.7944599167746094 and parameters: {'error_threshold': 2.85, 'scalers': 'standard', 'ratios': 'norm_ratio', 'imputers': 'mean', 'n_estimators': 850, 'learning_rate': 0.15145898297119778, 'max_depth': 3, 'min_child_weight': 9, 'subsample': 0.9, 'colsample_bytree': 1.0, 'colsample_bylevel': 0.5, 'reg_alpha': 0.00022083794069595726, 'reg_lambda': 0.0154794358720777, 'gamma': 95.8985295841845}. Best is trial 156 with value: -3.7797925544159785.
/bsuhome/alexanderemert/Research/Star-Formation-Research-Project-2026/pipeline/scripts/optuna/final_preds_and_models/optuna_search_mult_quant_reg.py:161: UserWarning: The distribution is specified by [0.1, 5] and step=0.25, but the range is not divisible by `step`. It will be replaced with [0.1, 4.85].
  error_threshold = trial.suggest_float("error_threshold", 0.1, 5, step=0.25)
[I 2026-07-20 18:25:23,740] Trial 162 finished with value: -3.8123094862619227 and parameters: {'error_threshold': 2.85, 'scalers': 'standard', 'ratios': 'norm_ratio', 'imputers': 'mean', 'n_estimators': 800, 'learning_rate': 0.1681961262625081, 'max_depth': 3, 'min_child_weight': 9, 'subsample': 0.9, 'colsample_bytree': 1.0, 'colsample_bylevel': 0.7, 'reg_alpha': 0.0008707934213095129, 'reg_lambda': 0.0007177549639175102, 'gamma': 53.872288302908366}. Best is trial 156 with value: -3.7797925544159785.
/bsuhome/alexanderemert/Research/Star-Formation-Research-Project-2026/pipeline/scripts/optuna/final_preds_and_models/optuna_search_mult_quant_reg.py:161: UserWarning: The distribution is specified by [0.1, 5] and step=0.25, but the range is not divisible by `step`. It will be replaced with [0.1, 4.85].
  error_threshold = trial.suggest_float("error_threshold", 0.1, 5, step=0.25)
[I 2026-07-20 18:25:23,929] Trial 163 finished with value: -3.780346476092136 and parameters: {'error_threshold': 2.85, 'scalers': 'standard', 'ratios': 'norm_ratio', 'imputers': 'mean', 'n_estimators': 250, 'learning_rate': 0.018599568344555988, 'max_depth': 3, 'min_child_weight': 9, 'subsample': 0.9, 'colsample_bytree': 1.0, 'colsample_bylevel': 0.5, 'reg_alpha': 0.00023070390779302683, 'reg_lambda': 0.006757968673071228, 'gamma': 54.21825141792008}. Best is trial 156 with value: -3.7797925544159785.
/bsuhome/alexanderemert/Research/Star-Formation-Research-Project-2026/pipeline/scripts/optuna/final_preds_and_models/optuna_search_mult_quant_reg.py:161: UserWarning: The distribution is specified by [0.1, 5] and step=0.25, but the range is not divisible by `step`. It will be replaced with [0.1, 4.85].
  error_threshold = trial.suggest_float("error_threshold", 0.1, 5, step=0.25)
