[I 2026-07-20 13:40:47,036] Trial 417 finished with value: -0.13715477077104352 and parameters: {'error_threshold': 0.0, 'scalers': 'robust', 'ratios': 'log_ratio', 'imputers': 'mean', 'n_estimators': 250, 'learning_rate': 0.00011695601689970174, 'max_depth': 3, 'min_child_weight': 1, 'subsample': 0.5, 'colsample_bytree': 0.5, 'colsample_bylevel': 0.6, 'reg_alpha': 4.983039743449402e-05, 'reg_lambda': 2.268611641816125, 'gamma': 69.984469645847}. Best is trial 68 with value: -0.1376473786634981.
/bsuscratch/alexanderemert/miniforge3/envs/starform-alex/lib/python3.14/site-packages/numpy/lib/_nanfunctions_impl.py:1215: RuntimeWarning: All-NaN slice encountered
  return fnb._ureduce(a, func=_nanmedian, keepdims=keepdims,
/bsuscratch/alexanderemert/miniforge3/envs/starform-alex/lib/python3.14/site-packages/numpy/lib/_nanfunctions_impl.py:1396: RuntimeWarning: All-NaN slice encountered
  return _nanquantile_unchecked(
/bsuscratch/alexanderemert/miniforge3/envs/starform-alex/lib/python3.14/site-packages/numpy/lib/_nanfunctions_impl.py:1215: RuntimeWarning: All-NaN slice encountered
  return fnb._ureduce(a, func=_nanmedian, keepdims=keepdims,
/bsuscratch/alexanderemert/miniforge3/envs/starform-alex/lib/python3.14/site-packages/numpy/lib/_nanfunctions_impl.py:1396: RuntimeWarning: All-NaN slice encountered
  return _nanquantile_unchecked(
/bsuscratch/alexanderemert/miniforge3/envs/starform-alex/lib/python3.14/site-packages/numpy/lib/_nanfunctions_impl.py:1215: RuntimeWarning: All-NaN slice encountered
  return fnb._ureduce(a, func=_nanmedian, keepdims=keepdims,
/bsuscratch/alexanderemert/miniforge3/envs/starform-alex/lib/python3.14/site-packages/numpy/lib/_nanfunctions_impl.py:1396: RuntimeWarning: All-NaN slice encountered
  return _nanquantile_unchecked(
/bsuscratch/alexanderemert/miniforge3/envs/starform-alex/lib/python3.14/site-packages/numpy/lib/_nanfunctions_impl.py:1215: RuntimeWarning: All-NaN slice encountered
  return fnb._ureduce(a, func=_nanmedian, keepdims=keepdims,
/bsuscratch/alexanderemert/miniforge3/envs/starform-alex/lib/python3.14/site-packages/numpy/lib/_nanfunctions_impl.py:1396: RuntimeWarning: All-NaN slice encountered
  return _nanquantile_unchecked(
/bsuscratch/alexanderemert/miniforge3/envs/starform-alex/lib/python3.14/site-packages/numpy/lib/_nanfunctions_impl.py:1215: RuntimeWarning: All-NaN slice encountered
  return fnb._ureduce(a, func=_nanmedian, keepdims=keepdims,
/bsuscratch/alexanderemert/miniforge3/envs/starform-alex/lib/python3.14/site-packages/numpy/lib/_nanfunctions_impl.py:1396: RuntimeWarning: All-NaN slice encountered
  return _nanquantile_unchecked(
/bsuscratch/alexanderemert/miniforge3/envs/starform-alex/lib/python3.14/site-packages/numpy/lib/_nanfunctions_impl.py:1215: RuntimeWarning: All-NaN slice encountered
  return fnb._ureduce(a, func=_nanmedian, keepdims=keepdims,
/bsuscratch/alexanderemert/miniforge3/envs/starform-alex/lib/python3.14/site-packages/numpy/lib/_nanfunctions_impl.py:1396: RuntimeWarning: All-NaN slice encountered
  return _nanquantile_unchecked(
/bsuscratch/alexanderemert/miniforge3/envs/starform-alex/lib/python3.14/site-packages/numpy/lib/_nanfunctions_impl.py:1215: RuntimeWarning: All-NaN slice encountered
  return fnb._ureduce(a, func=_nanmedian, keepdims=keepdims,
/bsuscratch/alexanderemert/miniforge3/envs/starform-alex/lib/python3.14/site-packages/numpy/lib/_nanfunctions_impl.py:1396: RuntimeWarning: All-NaN slice encountered
  return _nanquantile_unchecked(
[I 2026-07-20 13:40:47,749] Trial 418 finished with value: -0.13714318470927947 and parameters: {'error_threshold': 1.25, 'scalers': 'robust', 'ratios': 'log_ratio', 'imputers': 'mean', 'n_estimators': 250, 'learning_rate': 0.00011971591133255158, 'max_depth': 3, 'min_child_weight': 1, 'subsample': 0.5, 'colsample_bytree': 0.5, 'colsample_bylevel': 0.6, 'reg_alpha': 8.482722780996549e-05, 'reg_lambda': 2.379801498167579, 'gamma': 69.04755051317011}. Best is trial 68 with value: -0.1376473786634981.
/bsuscratch/alexanderemert/miniforge3/envs/starform-alex/lib/python3.14/site-packages/numpy/lib/_nanfunctions_impl.py:1215: RuntimeWarning: All-NaN slice encountered
  return fnb._ureduce(a, func=_nanmedian, keepdims=keepdims,
/bsuscratch/alexanderemert/miniforge3/envs/starform-alex/lib/python3.14/site-packages/numpy/lib/_nanfunctions_impl.py:1396: RuntimeWarning: All-NaN slice encountered
  return _nanquantile_unchecked(
/bsuscratch/alexanderemert/miniforge3/envs/starform-alex/lib/python3.14/site-packages/numpy/lib/_nanfunctions_impl.py:1215: RuntimeWarning: All-NaN slice encountered
  return fnb._ureduce(a, func=_nanmedian, keepdims=keepdims,
/bsuscratch/alexanderemert/miniforge3/envs/starform-alex/lib/python3.14/site-packages/numpy/lib/_nanfunctions_impl.py:1396: RuntimeWarning: All-NaN slice encountered
  return _nanquantile_unchecked(
/bsuscratch/alexanderemert/miniforge3/envs/starform-alex/lib/python3.14/site-packages/numpy/lib/_nanfunctions_impl.py:1215: RuntimeWarning: All-NaN slice encountered
  return fnb._ureduce(a, func=_nanmedian, keepdims=keepdims,
/bsuscratch/alexanderemert/miniforge3/envs/starform-alex/lib/python3.14/site-packages/numpy/lib/_nanfunctions_impl.py:1396: RuntimeWarning: All-NaN slice encountered
  return _nanquantile_unchecked(
/bsuscratch/alexanderemert/miniforge3/envs/starform-alex/lib/python3.14/site-packages/numpy/lib/_nanfunctions_impl.py:1215: RuntimeWarning: All-NaN slice encountered
  return fnb._ureduce(a, func=_nanmedian, keepdims=keepdims,
/bsuscratch/alexanderemert/miniforge3/envs/starform-alex/lib/python3.14/site-packages/numpy/lib/_nanfunctions_impl.py:1396: RuntimeWarning: All-NaN slice encountered
  return _nanquantile_unchecked(
/bsuscratch/alexanderemert/miniforge3/envs/starform-alex/lib/python3.14/site-packages/numpy/lib/_nanfunctions_impl.py:1215: RuntimeWarning: All-NaN slice encountered
  return fnb._ureduce(a, func=_nanmedian, keepdims=keepdims,
/bsuscratch/alexanderemert/miniforge3/envs/starform-alex/lib/python3.14/site-packages/numpy/lib/_nanfunctions_impl.py:1396: RuntimeWarning: All-NaN slice encountered
  return _nanquantile_unchecked(
/bsuscratch/alexanderemert/miniforge3/envs/starform-alex/lib/python3.14/site-packages/numpy/lib/_nanfunctions_impl.py:1215: RuntimeWarning: All-NaN slice encountered
  return fnb._ureduce(a, func=_nanmedian, keepdims=keepdims,
/bsuscratch/alexanderemert/miniforge3/envs/starform-alex/lib/python3.14/site-packages/numpy/lib/_nanfunctions_impl.py:1396: RuntimeWarning: All-NaN slice encountered
  return _nanquantile_unchecked(
[I 2026-07-20 13:40:48,275] Trial 419 finished with value: -0.1371553149323117 and parameters: {'error_threshold': 0.0, 'scalers': 'robust', 'ratios': 'log_ratio', 'imputers': 'mean', 'n_estimators': 250, 'learning_rate': 0.00011682576691250375, 'max_depth': 3, 'min_child_weight': 1, 'subsample': 0.5, 'colsample_bytree': 0.5, 'colsample_bylevel': 0.6, 'reg_alpha': 8.675969655271537e-05, 'reg_lambda': 2.3509934497854617, 'gamma': 71.09587786310776}. Best is trial 68 with value: -0.1376473786634981.
[I 2026-07-20 13:40:48,420] Trial 420 finished with value: -0.13716456952908737 and parameters: {'error_threshold': 1.5, 'scalers': 'robust', 'ratios': 'log_ratio', 'imputers': 'mean', 'n_estimators': 250, 'learning_rate': 0.00011459947232843136, 'max_depth': 3, 'min_child_weight': 1, 'subsample': 0.5, 'colsample_bytree': 0.5, 'colsample_bylevel': 0.6, 'reg_alpha': 1.282470338874887e-05, 'reg_lambda': 5.495828317582511, 'gamma': 67.53973174732491}. Best is trial 68 with value: -0.1376473786634981.
[I 2026-07-20 13:40:49,306] Trial 421 finished with value: -0.13714421635220936 and parameters: {'error_threshold': 0.25, 'scalers': 'robust', 'ratios': 'log_ratio', 'imputers': 'mean', 'n_estimators': 250, 'learning_rate': 0.00011945271251673085, 'max_depth': 3, 'min_child_weight': 1, 'subsample': 0.5, 'colsample_bytree': 0.5, 'colsample_bylevel': 0.6, 'reg_alpha': 1.2009784861569121e-05, 'reg_lambda': 5.727115337945882, 'gamma': 70.54834192299528}. Best is trial 68 with value: -0.1376473786634981.
[I 2026-07-20 13:40:49,553] Trial 422 finished with value: -0.13714136273255645 and parameters: {'error_threshold': 0.25, 'scalers': 'robust', 'ratios': 'log_ratio', 'imputers': 'mean', 'n_estimators': 250, 'learning_rate': 0.00012013236341118229, 'max_depth': 3, 'min_child_weight': 1, 'subsample': 0.5, 'colsample_bytree': 0.5, 'colsample_bylevel': 0.6, 'reg_alpha': 1.1857684470877661e-05, 'reg_lambda': 5.430647298207806, 'gamma': 99.2364623213204}. Best is trial 68 with value: -0.1376473786634981.
[I 2026-07-20 13:40:49,885] Trial 423 finished with value: -0.1371550787572047 and parameters: {'error_threshold': 1.25, 'scalers': 'robust', 'ratios': 'log_ratio', 'imputers': 'mean', 'n_estimators': 250, 'learning_rate': 0.00011686214568396718, 'max_depth': 3, 'min_child_weight': 1, 'subsample': 0.5, 'colsample_bytree': 0.5, 'colsample_bylevel': 0.6, 'reg_alpha': 1.1750077868493193e-05, 'reg_lambda': 6.748886264222258, 'gamma': 65.15552010898573}. Best is trial 68 with value: -0.1376473786634981.
[I 2026-07-20 13:40:50,202] Trial 424 finished with value: -0.13735349336002786 and parameters: {'error_threshold': 1.25, 'scalers': 'robust', 'ratios': 'log_ratio', 'imputers': 'mean', 'n_estimators': 150, 'learning_rate': 0.00011892672440529263, 'max_depth': 3, 'min_child_weight': 1, 'subsample': 0.5, 'colsample_bytree': 0.5, 'colsample_bylevel': 0.6, 'reg_alpha': 1.2174923304987396e-05, 'reg_lambda': 5.296542057696445, 'gamma': 23.62053022558052}. Best is trial 68 with value: -0.1376473786634981.
[I 2026-07-20 13:40:52,181] Trial 426 finished with value: -0.13672184614828542 and parameters: {'error_threshold': 1.5, 'scalers': 'robust', 'ratios': 'log_ratio', 'imputers': 'mean', 'n_estimators': 150, 'learning_rate': 0.00018437510256370443, 'max_depth': 3, 'min_child_weight': 1, 'subsample': 0.8, 'colsample_bytree': 0.5, 'colsample_bylevel': 0.6, 'reg_alpha': 1.1492455916649258e-05, 'reg_lambda': 5.705343364405373, 'gamma': 0.46087081898997945}. Best is trial 68 with value: -0.1376473786634981.
[I 2026-07-20 13:40:52,470] Trial 427 finished with value: -0.13719336158848286 and parameters: {'error_threshold': 1.5, 'scalers': 'robust', 'ratios': 'log_ratio', 'imputers': 'mean', 'n_estimators': 150, 'learning_rate': 0.00018403541957296246, 'max_depth': 3, 'min_child_weight': 1, 'subsample': 0.5, 'colsample_bytree': 0.5, 'colsample_bylevel': 0.6, 'reg_alpha': 1.0846998571169408e-05, 'reg_lambda': 5.710634206008589, 'gamma': 22.683079041114684}. Best is trial 68 with value: -0.1376473786634981.
[I 2026-07-20 13:40:52,666] Trial 428 finished with value: -0.13718444584997794 and parameters: {'error_threshold': 1.5, 'scalers': 'robust', 'ratios': 'log_ratio', 'imputers': 'mean', 'n_estimators': 150, 'learning_rate': 0.00018782073842845087, 'max_depth': 3, 'min_child_weight': 1, 'subsample': 0.5, 'colsample_bytree': 0.5, 'colsample_bylevel': 0.6, 'reg_alpha': 1.1499436696375592e-05, 'reg_lambda': 4.859255543172922, 'gamma': 24.609623782112585}. Best is trial 68 with value: -0.1376473786634981.
[I 2026-07-20 13:40:52,892] Trial 429 finished with value: -0.13718069377569736 and parameters: {'error_threshold': 1.5, 'scalers': 'robust', 'ratios': 'log_ratio', 'imputers': 'mean', 'n_estimators': 150, 'learning_rate': 0.00018866504621003582, 'max_depth': 3, 'min_child_weight': 1, 'subsample': 0.5, 'colsample_bytree': 0.5, 'colsample_bylevel': 0.6, 'reg_alpha': 5.511201389708206e-06, 'reg_lambda': 4.581027734240734, 'gamma': 96.54665910068678}. Best is trial 68 with value: -0.1376473786634981.
[I 2026-07-20 13:40:53,459] Trial 425 finished with value: -0.1368423237800129 and parameters: {'error_threshold': 0.25, 'scalers': 'robust', 'ratios': 'log_ratio', 'imputers': 'mean', 'n_estimators': 150, 'learning_rate': 0.00011806899625729692, 'max_depth': 11, 'min_child_weight': 1, 'subsample': 0.5, 'colsample_bytree': 0.5, 'colsample_bylevel': 0.6, 'reg_alpha': 1.1979096431268722e-05, 'reg_lambda': 5.145539682939231, 'gamma': 0.005621110554045286}. Best is trial 68 with value: -0.1376473786634981.
[I 2026-07-20 13:40:53,730] Trial 430 finished with value: -0.13719424410053185 and parameters: {'error_threshold': 1.5, 'scalers': 'robust', 'ratios': 'log_ratio', 'imputers': 'mean', 'n_estimators': 150, 'learning_rate': 0.0001835065612693594, 'max_depth': 3, 'min_child_weight': 1, 'subsample': 0.5, 'colsample_bytree': 0.5, 'colsample_bylevel': 0.6, 'reg_alpha': 2.9567027142118028e-05, 'reg_lambda': 3.5568178167836035, 'gamma': 22.443678910980513}. Best is trial 68 with value: -0.1376473786634981.
[I 2026-07-20 13:40:53,841] Trial 431 finished with value: -0.1371841424024835 and parameters: {'error_threshold': 1.5, 'scalers': 'robust', 'ratios': 'log_ratio', 'imputers': 'mean', 'n_estimators': 150, 'learning_rate': 0.0001885050285925834, 'max_depth': 3, 'min_child_weight': 1, 'subsample': 0.5, 'colsample_bytree': 0.5, 'colsample_bylevel': 0.6, 'reg_alpha': 2.7879750286858014e-05, 'reg_lambda': 4.058692085335539, 'gamma': 21.994560571317677}. Best is trial 68 with value: -0.1376473786634981.
[I 2026-07-20 13:40:54,371] Trial 432 finished with value: -0.13658408537481198 and parameters: {'error_threshold': 1.5, 'scalers': 'robust', 'ratios': 'log_ratio', 'imputers': 'mean', 'n_estimators': 150, 'learning_rate': 0.00019555644877447052, 'max_depth': 3, 'min_child_weight': 1, 'subsample': 0.5, 'colsample_bytree': 1.0, 'colsample_bylevel': 0.6, 'reg_alpha': 2.9795188515629476e-05, 'reg_lambda': 3.4093705982368125, 'gamma': 47.65092800283841}. Best is trial 68 with value: -0.1376473786634981.
[I 2026-07-20 13:40:54,745] Trial 433 finished with value: -0.13700700599949067 and parameters: {'error_threshold': 1.5, 'scalers': 'robust', 'ratios': 'log_ratio', 'imputers': 'mean', 'n_estimators': 150, 'learning_rate': 0.0002598131299156299, 'max_depth': 3, 'min_child_weight': 1, 'subsample': 0.5, 'colsample_bytree': 0.5, 'colsample_bylevel': 0.6, 'reg_alpha': 2.948971891887718e-05, 'reg_lambda': 3.3682773232785888, 'gamma': 22.684178955724402}. Best is trial 68 with value: -0.1376473786634981.
[I 2026-07-20 13:40:55,205] Trial 434 finished with value: -0.13715577953605787 and parameters: {'error_threshold': 1.5, 'scalers': 'robust', 'ratios': 'log_ratio', 'imputers': 'mean', 'n_estimators': 100, 'learning_rate': 0.00027141730665927385, 'max_depth': 3, 'min_child_weight': 1, 'subsample': 0.5, 'colsample_bytree': 0.5, 'colsample_bylevel': 0.6, 'reg_alpha': 4.357253134755794e-05, 'reg_lambda': 3.319353127380374, 'gamma': 99.56069745204701}. Best is trial 68 with value: -0.1376473786634981.
[I 2026-07-20 13:40:55,352] Trial 435 finished with value: -0.13735738554473617 and parameters: {'error_threshold': 1.5, 'scalers': 'robust', 'ratios': 'log_ratio', 'imputers': 'mean', 'n_estimators': 100, 'learning_rate': 0.00015976219565357896, 'max_depth': 3, 'min_child_weight': 1, 'subsample': 0.5, 'colsample_bytree': 0.5, 'colsample_bylevel': 0.6, 'reg_alpha': 5.9938620736596365e-06, 'reg_lambda': 3.3915770432198813, 'gamma': 98.05388094989526}. Best is trial 68 with value: -0.1376473786634981.
[I 2026-07-20 13:40:55,826] Trial 437 finished with value: -0.13719497225372076 and parameters: {'error_threshold': 1.75, 'scalers': 'robust', 'ratios': 'log_ratio', 'imputers': 'mean', 'n_estimators': 100, 'learning_rate': 0.00024968239696171484, 'max_depth': 8, 'min_child_weight': 1, 'subsample': 0.5, 'colsample_bytree': 0.5, 'colsample_bylevel': 0.6, 'reg_alpha': 2.9689503812440273e-05, 'reg_lambda': 3.2927165377892873, 'gamma': 50.26862977477435}. Best is trial 68 with value: -0.1376473786634981.
[I 2026-07-20 13:40:55,919] Trial 438 finished with value: -0.13736856717638415 and parameters: {'error_threshold': 1.75, 'scalers': 'robust', 'ratios': 'log_ratio', 'imputers': 'mean', 'n_estimators': 100, 'learning_rate': 0.00015358452432586594, 'max_depth': 3, 'min_child_weight': 1, 'subsample': 0.5, 'colsample_bytree': 0.5, 'colsample_bylevel': 0.6, 'reg_alpha': 3.0130789383321836e-05, 'reg_lambda': 1.259284172390532, 'gamma': 46.39978379887987}. Best is trial 68 with value: -0.1376473786634981.
[I 2026-07-20 13:40:56,109] Trial 436 finished with value: -0.13664251083844436 and parameters: {'error_threshold': 1.75, 'scalers': 'robust', 'ratios': 'log_ratio', 'imputers': 'mean', 'n_estimators': 400, 'learning_rate': 0.000152505425042121, 'max_depth': 3, 'min_child_weight': 1, 'subsample': 0.5, 'colsample_bytree': 0.5, 'colsample_bylevel': 0.6, 'reg_alpha': 3.137750009951535e-05, 'reg_lambda': 3.3348870933349377, 'gamma': 47.9427322907528}. Best is trial 68 with value: -0.1376473786634981.
[I 2026-07-20 13:40:56,266] Trial 439 finished with value: -0.13737953475333273 and parameters: {'error_threshold': 1.75, 'scalers': 'robust', 'ratios': 'log_ratio', 'imputers': 'mean', 'n_estimators': 100, 'learning_rate': 0.0001475209685864499, 'max_depth': 3, 'min_child_weight': 1, 'subsample': 0.5, 'colsample_bytree': 0.5, 'colsample_bylevel': 0.6, 'reg_alpha': 3.846970386988473e-05, 'reg_lambda': 1.149376206274161, 'gamma': 49.85038413471326}. Best is trial 68 with value: -0.1376473786634981.
[I 2026-07-20 13:40:57,900] Trial 441 finished with value: -0.13737485769107186 and parameters: {'error_threshold': 1.75, 'scalers': 'robust', 'ratios': 'log_ratio', 'imputers': 'mean', 'n_estimators': 100, 'learning_rate': 0.00015010667356981587, 'max_depth': 3, 'min_child_weight': 1, 'subsample': 0.5, 'colsample_bytree': 0.5, 'colsample_bylevel': 0.6, 'reg_alpha': 4.536128982676148e-05, 'reg_lambda': 1.9453545033634287, 'gamma': 98.7512544264718}. Best is trial 68 with value: -0.1376473786634981.
[I 2026-07-20 13:40:58,119] Trial 440 finished with value: -0.13585586522896873 and parameters: {'error_threshold': 1.75, 'scalers': 'robust', 'ratios': 'log_ratio', 'imputers': 'mean', 'n_estimators': 400, 'learning_rate': 0.0002746423199096342, 'max_depth': 3, 'min_child_weight': 1, 'subsample': 0.5, 'colsample_bytree': 0.5, 'colsample_bylevel': 0.6, 'reg_alpha': 4.662636285243537e-05, 'reg_lambda': 1.2949348352322256, 'gamma': 49.984849743554655}. Best is trial 68 with value: -0.1376473786634981.
[I 2026-07-20 13:40:58,350] Trial 442 finished with value: -0.13417904298982852 and parameters: {'error_threshold': 1.75, 'scalers': 'robust', 'ratios': 'log_ratio', 'imputers': 'mean', 'n_estimators': 100, 'learning_rate': 0.001988170859904217, 'max_depth': 3, 'min_child_weight': 1, 'subsample': 0.5, 'colsample_bytree': 0.5, 'colsample_bylevel': 0.6, 'reg_alpha': 1.805910313519442e-05, 'reg_lambda': 1.0593021691721087, 'gamma': 48.405533140458225}. Best is trial 68 with value: -0.1376473786634981.
[I 2026-07-20 13:40:59,366] Trial 445 finished with value: -0.13716029374704475 and parameters: {'error_threshold': 0.75, 'scalers': 'robust', 'ratios': 'log_ratio', 'imputers': 'median', 'n_estimators': 200, 'learning_rate': 0.00014163415359161473, 'max_depth': 3, 'min_child_weight': 1, 'subsample': 0.5, 'colsample_bytree': 0.5, 'colsample_bylevel': 0.6, 'reg_alpha': 1.9207692036617126e-05, 'reg_lambda': 1.7258072690205444, 'gamma': 51.67850742631885}. Best is trial 68 with value: -0.1376473786634981.
[I 2026-07-20 13:40:59,929] Trial 446 finished with value: -0.13716938955391914 and parameters: {'error_threshold': 0.75, 'scalers': 'robust', 'ratios': 'log_ratio', 'imputers': 'median', 'n_estimators': 200, 'learning_rate': 0.00013897612372724014, 'max_depth': 3, 'min_child_weight': 1, 'subsample': 0.5, 'colsample_bytree': 0.5, 'colsample_bylevel': 0.6, 'reg_alpha': 1.9178707462430854e-05, 'reg_lambda': 1.7623636778968694, 'gamma': 50.599209349549156}. Best is trial 68 with value: -0.1376473786634981.
[I 2026-07-20 13:41:00,548] Trial 447 finished with value: -0.1371811466600725 and parameters: {'error_threshold': 0.75, 'scalers': 'robust', 'ratios': 'log_ratio', 'imputers': 'mean', 'n_estimators': 200, 'learning_rate': 0.000135545279288726, 'max_depth': 3, 'min_child_weight': 1, 'subsample': 0.5, 'colsample_bytree': 0.5, 'colsample_bylevel': 0.6, 'reg_alpha': 1.8879052141089603e-05, 'reg_lambda': 0.0019316677726671481, 'gamma': 99.46637469564897}. Best is trial 68 with value: -0.1376473786634981.
[I 2026-07-20 13:41:01,061] Trial 443 finished with value: -0.13565513290035097 and parameters: {'error_threshold': 1.75, 'scalers': 'robust', 'ratios': 'log_ratio', 'imputers': 'mean', 'n_estimators': 850, 'learning_rate': 0.00014321572182332946, 'max_depth': 3, 'min_child_weight': 1, 'subsample': 0.5, 'colsample_bytree': 0.5, 'colsample_bylevel': 0.6, 'reg_alpha': 1.9239403842780526e-05, 'reg_lambda': 1.1068293130605553, 'gamma': 49.05729567981677}. Best is trial 68 with value: -0.1376473786634981.
[I 2026-07-20 13:41:01,580] Trial 444 finished with value: -0.1356389284098128 and parameters: {'error_threshold': 1.25, 'scalers': 'robust', 'ratios': 'log_ratio', 'imputers': 'mean', 'n_estimators': 850, 'learning_rate': 0.00014440588210772834, 'max_depth': 3, 'min_child_weight': 1, 'subsample': 0.5, 'colsample_bytree': 0.5, 'colsample_bylevel': 0.6, 'reg_alpha': 1.8933724069661894e-05, 'reg_lambda': 1.1275540549822614, 'gamma': 48.8142587158226}. Best is trial 68 with value: -0.1376473786634981.
[I 2026-07-20 13:41:02,579] Trial 448 finished with value: -0.13718264610885836 and parameters: {'error_threshold': 1.25, 'scalers': 'robust', 'ratios': 'log_ratio', 'imputers': 'median', 'n_estimators': 200, 'learning_rate': 0.0001350877596394062, 'max_depth': 3, 'min_child_weight': 1, 'subsample': 0.5, 'colsample_bytree': 0.5, 'colsample_bylevel': 0.6, 'reg_alpha': 1.9439300260895623e-05, 'reg_lambda': 10.238603001435573, 'gamma': 29.814536758732935}. Best is trial 68 with value: -0.1376473786634981.
