[I 2026-07-20 14:36:40,118] Trial 50 finished with value: -0.13420618218938465 and parameters: {'error_threshold': 0.35, 'scalers': 'none', 'ratios': 'norm_ratio', 'imputers': 'mean', 'n_estimators': 250, 'learning_rate': 0.00015561764721463227, 'max_depth': 12, 'min_child_weight': 1, 'subsample': 0.7, 'colsample_bytree': 0.9, 'colsample_bylevel': 1.0, 'reg_alpha': 0.7199982703347847, 'reg_lambda': 0.4532002809571282, 'gamma': 0.010872338817064613}. Best is trial 23 with value: -0.13705033781746384.
/bsuhome/alexanderemert/Research/Star-Formation-Research-Project-2026/pipeline/scripts/optuna/final_preds_and_models/optuna_search_mult_quant_reg.py:75: UserWarning: The distribution is specified by [0.1, 5] and step=0.25, but the range is not divisible by `step`. It will be replaced with [0.1, 4.85].
  error_threshold = trial.suggest_float("error_threshold", 0.1, 5, step=0.25)
[I 2026-07-20 14:36:44,780] Trial 46 finished with value: -0.07572774741336964 and parameters: {'error_threshold': 0.35, 'scalers': 'none', 'ratios': 'norm_ratio', 'imputers': 'median', 'n_estimators': 700, 'learning_rate': 0.002321024206248343, 'max_depth': 11, 'min_child_weight': 1, 'subsample': 0.7, 'colsample_bytree': 0.9, 'colsample_bylevel': 1.0, 'reg_alpha': 7.374787633324616e-06, 'reg_lambda': 0.012756134794461988, 'gamma': 0.016723555440108794}. Best is trial 23 with value: -0.13705033781746384.
/bsuhome/alexanderemert/Research/Star-Formation-Research-Project-2026/pipeline/scripts/optuna/final_preds_and_models/optuna_search_mult_quant_reg.py:75: UserWarning: The distribution is specified by [0.1, 5] and step=0.25, but the range is not divisible by `step`. It will be replaced with [0.1, 4.85].
  error_threshold = trial.suggest_float("error_threshold", 0.1, 5, step=0.25)
[I 2026-07-20 14:36:51,931] Trial 47 finished with value: -0.07004257479522095 and parameters: {'error_threshold': 0.35, 'scalers': 'none', 'ratios': 'norm_ratio', 'imputers': 'median', 'n_estimators': 700, 'learning_rate': 0.0032103647662518114, 'max_depth': 9, 'min_child_weight': 1, 'subsample': 0.7, 'colsample_bytree': 0.9, 'colsample_bylevel': 1.0, 'reg_alpha': 0.1836432640251136, 'reg_lambda': 0.013441869750285848, 'gamma': 0.012019850949715338}. Best is trial 23 with value: -0.13705033781746384.
/bsuhome/alexanderemert/Research/Star-Formation-Research-Project-2026/pipeline/scripts/optuna/final_preds_and_models/optuna_search_mult_quant_reg.py:75: UserWarning: The distribution is specified by [0.1, 5] and step=0.25, but the range is not divisible by `step`. It will be replaced with [0.1, 4.85].
  error_threshold = trial.suggest_float("error_threshold", 0.1, 5, step=0.25)
[I 2026-07-20 14:36:54,498] Trial 51 finished with value: -0.13559714415121846 and parameters: {'error_threshold': 0.35, 'scalers': 'none', 'ratios': 'norm_ratio', 'imputers': 'mean', 'n_estimators': 250, 'learning_rate': 0.00010127229300823793, 'max_depth': 12, 'min_child_weight': 1, 'subsample': 0.7, 'colsample_bytree': 0.8, 'colsample_bylevel': 1.0, 'reg_alpha': 5.3640821989975965e-05, 'reg_lambda': 0.18530121170369973, 'gamma': 0.00919747287631624}. Best is trial 23 with value: -0.13705033781746384.
/bsuhome/alexanderemert/Research/Star-Formation-Research-Project-2026/pipeline/scripts/optuna/final_preds_and_models/optuna_search_mult_quant_reg.py:75: UserWarning: The distribution is specified by [0.1, 5] and step=0.25, but the range is not divisible by `step`. It will be replaced with [0.1, 4.85].
  error_threshold = trial.suggest_float("error_threshold", 0.1, 5, step=0.25)
[I 2026-07-20 14:37:34,980] Trial 52 finished with value: -0.12845549508402523 and parameters: {'error_threshold': 0.35, 'scalers': 'none', 'ratios': 'log_ratio', 'imputers': 'median', 'n_estimators': 650, 'learning_rate': 0.00017080595622165072, 'max_depth': 9, 'min_child_weight': 1, 'subsample': 0.7, 'colsample_bytree': 0.9, 'colsample_bylevel': 1.0, 'reg_alpha': 3.6267315846769444e-05, 'reg_lambda': 0.019632872368762575, 'gamma': 0.015138971594428579}. Best is trial 23 with value: -0.13705033781746384.
/bsuhome/alexanderemert/Research/Star-Formation-Research-Project-2026/pipeline/scripts/optuna/final_preds_and_models/optuna_search_mult_quant_reg.py:75: UserWarning: The distribution is specified by [0.1, 5] and step=0.25, but the range is not divisible by `step`. It will be replaced with [0.1, 4.85].
  error_threshold = trial.suggest_float("error_threshold", 0.1, 5, step=0.25)
[I 2026-07-20 14:37:36,444] Trial 53 finished with value: -0.13367597691640978 and parameters: {'error_threshold': 0.35, 'scalers': 'none', 'ratios': 'log_ratio', 'imputers': 'median', 'n_estimators': 250, 'learning_rate': 0.00016849930733244702, 'max_depth': 12, 'min_child_weight': 2, 'subsample': 0.7, 'colsample_bytree': 1.0, 'colsample_bylevel': 1.0, 'reg_alpha': 4.689981045773842e-05, 'reg_lambda': 0.17329581499798996, 'gamma': 0.026762485805460555}. Best is trial 23 with value: -0.13705033781746384.
/bsuhome/alexanderemert/Research/Star-Formation-Research-Project-2026/pipeline/scripts/optuna/final_preds_and_models/optuna_search_mult_quant_reg.py:75: UserWarning: The distribution is specified by [0.1, 5] and step=0.25, but the range is not divisible by `step`. It will be replaced with [0.1, 4.85].
  error_threshold = trial.suggest_float("error_threshold", 0.1, 5, step=0.25)
[I 2026-07-20 14:37:37,907] Trial 54 finished with value: -0.13354365695288176 and parameters: {'error_threshold': 0.35, 'scalers': 'none', 'ratios': 'log_ratio', 'imputers': 'median', 'n_estimators': 250, 'learning_rate': 0.00017265289875307324, 'max_depth': 9, 'min_child_weight': 2, 'subsample': 0.7, 'colsample_bytree': 1.0, 'colsample_bylevel': 1.0, 'reg_alpha': 6.414875380861916e-05, 'reg_lambda': 0.13248750880193902, 'gamma': 0.00021715141225884355}. Best is trial 23 with value: -0.13705033781746384.
/bsuhome/alexanderemert/Research/Star-Formation-Research-Project-2026/pipeline/scripts/optuna/final_preds_and_models/optuna_search_mult_quant_reg.py:75: UserWarning: The distribution is specified by [0.1, 5] and step=0.25, but the range is not divisible by `step`. It will be replaced with [0.1, 4.85].
  error_threshold = trial.suggest_float("error_threshold", 0.1, 5, step=0.25)
[I 2026-07-20 14:37:38,293] Trial 58 finished with value: -0.13616573395580425 and parameters: {'error_threshold': 0.1, 'scalers': 'none', 'ratios': 'log_ratio', 'imputers': 'mean', 'n_estimators': 100, 'learning_rate': 0.000173339187251543, 'max_depth': 12, 'min_child_weight': 2, 'subsample': 0.8, 'colsample_bytree': 0.8, 'colsample_bylevel': 1.0, 'reg_alpha': 4.9277522933479345e-05, 'reg_lambda': 1.333465623583017, 'gamma': 0.00032825331486608034}. Best is trial 23 with value: -0.13705033781746384.
/bsuhome/alexanderemert/Research/Star-Formation-Research-Project-2026/pipeline/scripts/optuna/final_preds_and_models/optuna_search_mult_quant_reg.py:75: UserWarning: The distribution is specified by [0.1, 5] and step=0.25, but the range is not divisible by `step`. It will be replaced with [0.1, 4.85].
  error_threshold = trial.suggest_float("error_threshold", 0.1, 5, step=0.25)
[I 2026-07-20 14:37:39,512] Trial 56 finished with value: -0.1123357146745307 and parameters: {'error_threshold': 0.1, 'scalers': 'none', 'ratios': 'log_ratio', 'imputers': 'median', 'n_estimators': 250, 'learning_rate': 0.001266816574459862, 'max_depth': 9, 'min_child_weight': 2, 'subsample': 0.8, 'colsample_bytree': 1.0, 'colsample_bylevel': 0.7, 'reg_alpha': 6.638567418844306e-05, 'reg_lambda': 0.024202147066886785, 'gamma': 0.0001840199287833984}. Best is trial 23 with value: -0.13705033781746384.
/bsuhome/alexanderemert/Research/Star-Formation-Research-Project-2026/pipeline/scripts/optuna/final_preds_and_models/optuna_search_mult_quant_reg.py:75: UserWarning: The distribution is specified by [0.1, 5] and step=0.25, but the range is not divisible by `step`. It will be replaced with [0.1, 4.85].
  error_threshold = trial.suggest_float("error_threshold", 0.1, 5, step=0.25)
[I 2026-07-20 14:37:40,238] Trial 59 finished with value: -0.13602933772714734 and parameters: {'error_threshold': 0.1, 'scalers': 'standard', 'ratios': 'log_ratio', 'imputers': 'mean', 'n_estimators': 100, 'learning_rate': 0.00016690104960510052, 'max_depth': 12, 'min_child_weight': 2, 'subsample': 0.8, 'colsample_bytree': 1.0, 'colsample_bylevel': 1.0, 'reg_alpha': 1.1788792631893825e-06, 'reg_lambda': 3.2395875271984904, 'gamma': 0.005708703230251159}. Best is trial 23 with value: -0.13705033781746384.
/bsuhome/alexanderemert/Research/Star-Formation-Research-Project-2026/pipeline/scripts/optuna/final_preds_and_models/optuna_search_mult_quant_reg.py:75: UserWarning: The distribution is specified by [0.1, 5] and step=0.25, but the range is not divisible by `step`. It will be replaced with [0.1, 4.85].
  error_threshold = trial.suggest_float("error_threshold", 0.1, 5, step=0.25)
[I 2026-07-20 14:37:42,166] Trial 55 finished with value: -0.1329452511327582 and parameters: {'error_threshold': 0.35, 'scalers': 'none', 'ratios': 'log_ratio', 'imputers': 'median', 'n_estimators': 300, 'learning_rate': 0.00016320598374999816, 'max_depth': 9, 'min_child_weight': 2, 'subsample': 0.8, 'colsample_bytree': 1.0, 'colsample_bylevel': 1.0, 'reg_alpha': 4.91312807379607e-05, 'reg_lambda': 0.0050188087272977164, 'gamma': 0.00021619775358330183}. Best is trial 23 with value: -0.13705033781746384.
/bsuhome/alexanderemert/Research/Star-Formation-Research-Project-2026/pipeline/scripts/optuna/final_preds_and_models/optuna_search_mult_quant_reg.py:75: UserWarning: The distribution is specified by [0.1, 5] and step=0.25, but the range is not divisible by `step`. It will be replaced with [0.1, 4.85].
  error_threshold = trial.suggest_float("error_threshold", 0.1, 5, step=0.25)
[I 2026-07-20 14:37:43,672] Trial 57 finished with value: -0.13305058375185017 and parameters: {'error_threshold': 0.85, 'scalers': 'none', 'ratios': 'log_ratio', 'imputers': 'none', 'n_estimators': 300, 'learning_rate': 0.0001621672395702126, 'max_depth': 9, 'min_child_weight': 2, 'subsample': 0.8, 'colsample_bytree': 1.0, 'colsample_bylevel': 0.7, 'reg_alpha': 0.06269280268191431, 'reg_lambda': 4.8190561892404435, 'gamma': 0.000304138041830089}. Best is trial 23 with value: -0.13705033781746384.
/bsuhome/alexanderemert/Research/Star-Formation-Research-Project-2026/pipeline/scripts/optuna/final_preds_and_models/optuna_search_mult_quant_reg.py:75: UserWarning: The distribution is specified by [0.1, 5] and step=0.25, but the range is not divisible by `step`. It will be replaced with [0.1, 4.85].
  error_threshold = trial.suggest_float("error_threshold", 0.1, 5, step=0.25)
[I 2026-07-20 14:37:49,405] Trial 62 finished with value: -0.13081587945826692 and parameters: {'error_threshold': 0.1, 'scalers': 'standard', 'ratios': 'norm_ratio', 'imputers': 'none', 'n_estimators': 100, 'learning_rate': 0.001145563590674193, 'max_depth': 3, 'min_child_weight': 2, 'subsample': 0.8, 'colsample_bytree': 0.8, 'colsample_bylevel': 0.5, 'reg_alpha': 3.5522691864487416e-06, 'reg_lambda': 2.430144723720602, 'gamma': 0.00410837275452597}. Best is trial 23 with value: -0.13705033781746384.
/bsuhome/alexanderemert/Research/Star-Formation-Research-Project-2026/pipeline/scripts/optuna/final_preds_and_models/optuna_search_mult_quant_reg.py:75: UserWarning: The distribution is specified by [0.1, 5] and step=0.25, but the range is not divisible by `step`. It will be replaced with [0.1, 4.85].
  error_threshold = trial.suggest_float("error_threshold", 0.1, 5, step=0.25)
[I 2026-07-20 14:37:51,683] Trial 63 finished with value: -0.1264118541428582 and parameters: {'error_threshold': 0.85, 'scalers': 'standard', 'ratios': 'norm_ratio', 'imputers': 'none', 'n_estimators': 150, 'learning_rate': 0.0012858423056406351, 'max_depth': 3, 'min_child_weight': 2, 'subsample': 0.6, 'colsample_bytree': 0.8, 'colsample_bylevel': 0.5, 'reg_alpha': 3.038646533142915e-06, 'reg_lambda': 5.2509053914354755, 'gamma': 0.003800299486629324}. Best is trial 23 with value: -0.13705033781746384.
/bsuhome/alexanderemert/Research/Star-Formation-Research-Project-2026/pipeline/scripts/optuna/final_preds_and_models/optuna_search_mult_quant_reg.py:75: UserWarning: The distribution is specified by [0.1, 5] and step=0.25, but the range is not divisible by `step`. It will be replaced with [0.1, 4.85].
  error_threshold = trial.suggest_float("error_threshold", 0.1, 5, step=0.25)
[I 2026-07-20 14:37:51,829] Trial 64 finished with value: -0.1365915040032008 and parameters: {'error_threshold': 0.85, 'scalers': 'standard', 'ratios': 'norm_ratio', 'imputers': 'none', 'n_estimators': 100, 'learning_rate': 0.00013241153464123268, 'max_depth': 3, 'min_child_weight': 1, 'subsample': 0.6, 'colsample_bytree': 0.8, 'colsample_bylevel': 0.9, 'reg_alpha': 1.1547199182114812e-06, 'reg_lambda': 5.327642553568693, 'gamma': 0.0044134547688542015}. Best is trial 23 with value: -0.13705033781746384.
/bsuhome/alexanderemert/Research/Star-Formation-Research-Project-2026/pipeline/scripts/optuna/final_preds_and_models/optuna_search_mult_quant_reg.py:75: UserWarning: The distribution is specified by [0.1, 5] and step=0.25, but the range is not divisible by `step`. It will be replaced with [0.1, 4.85].
  error_threshold = trial.suggest_float("error_threshold", 0.1, 5, step=0.25)
[I 2026-07-20 14:37:52,265] Trial 60 finished with value: -0.1360261368653444 and parameters: {'error_threshold': 0.1, 'scalers': 'standard', 'ratios': 'log_ratio', 'imputers': 'mean', 'n_estimators': 100, 'learning_rate': 0.00017554269645970988, 'max_depth': 12, 'min_child_weight': 2, 'subsample': 0.8, 'colsample_bytree': 1.0, 'colsample_bylevel': 0.5, 'reg_alpha': 3.7727402223340104e-06, 'reg_lambda': 3.076276138964056, 'gamma': 0.004703868441453201}. Best is trial 23 with value: -0.13705033781746384.
/bsuhome/alexanderemert/Research/Star-Formation-Research-Project-2026/pipeline/scripts/optuna/final_preds_and_models/optuna_search_mult_quant_reg.py:75: UserWarning: The distribution is specified by [0.1, 5] and step=0.25, but the range is not divisible by `step`. It will be replaced with [0.1, 4.85].
  error_threshold = trial.suggest_float("error_threshold", 0.1, 5, step=0.25)
[I 2026-07-20 14:37:52,612] Trial 65 finished with value: -0.13489405476362892 and parameters: {'error_threshold': 0.85, 'scalers': 'standard', 'ratios': 'norm_ratio', 'imputers': 'none', 'n_estimators': 350, 'learning_rate': 0.0001295002607208655, 'max_depth': 3, 'min_child_weight': 4, 'subsample': 0.6, 'colsample_bytree': 0.8, 'colsample_bylevel': 0.5, 'reg_alpha': 3.495204782544731e-06, 'reg_lambda': 6.216732386314916, 'gamma': 0.003359700407980831}. Best is trial 23 with value: -0.13705033781746384.
/bsuhome/alexanderemert/Research/Star-Formation-Research-Project-2026/pipeline/scripts/optuna/final_preds_and_models/optuna_search_mult_quant_reg.py:75: UserWarning: The distribution is specified by [0.1, 5] and step=0.25, but the range is not divisible by `step`. It will be replaced with [0.1, 4.85].
  error_threshold = trial.suggest_float("error_threshold", 0.1, 5, step=0.25)
[I 2026-07-20 14:37:56,407] Trial 61 finished with value: -0.12783687315249626 and parameters: {'error_threshold': 0.1, 'scalers': 'standard', 'ratios': 'norm_ratio', 'imputers': 'mean', 'n_estimators': 100, 'learning_rate': 0.0013251135309259342, 'max_depth': 12, 'min_child_weight': 2, 'subsample': 0.8, 'colsample_bytree': 0.8, 'colsample_bylevel': 0.7, 'reg_alpha': 3.470500259482752e-06, 'reg_lambda': 4.233862802903273, 'gamma': 0.000265024277006989}. Best is trial 23 with value: -0.13705033781746384.
/bsuhome/alexanderemert/Research/Star-Formation-Research-Project-2026/pipeline/scripts/optuna/final_preds_and_models/optuna_search_mult_quant_reg.py:75: UserWarning: The distribution is specified by [0.1, 5] and step=0.25, but the range is not divisible by `step`. It will be replaced with [0.1, 4.85].
  error_threshold = trial.suggest_float("error_threshold", 0.1, 5, step=0.25)
[I 2026-07-20 14:38:05,925] Trial 66 finished with value: -0.13287676543765922 and parameters: {'error_threshold': 0.85, 'scalers': 'standard', 'ratios': 'norm_ratio', 'imputers': 'none', 'n_estimators': 550, 'learning_rate': 0.00011839552225626957, 'max_depth': 12, 'min_child_weight': 4, 'subsample': 0.6, 'colsample_bytree': 0.8, 'colsample_bylevel': 0.5, 'reg_alpha': 3.6619521353933553e-06, 'reg_lambda': 7.866002613757187, 'gamma': 0.0027323340228817996}. Best is trial 23 with value: -0.13705033781746384.
/bsuhome/alexanderemert/Research/Star-Formation-Research-Project-2026/pipeline/scripts/optuna/final_preds_and_models/optuna_search_mult_quant_reg.py:75: UserWarning: The distribution is specified by [0.1, 5] and step=0.25, but the range is not divisible by `step`. It will be replaced with [0.1, 4.85].
  error_threshold = trial.suggest_float("error_threshold", 0.1, 5, step=0.25)
[I 2026-07-20 14:38:20,893] Trial 71 finished with value: -0.13427794225801484 and parameters: {'error_threshold': 0.6, 'scalers': 'standard', 'ratios': 'norm_ratio', 'imputers': 'none', 'n_estimators': 350, 'learning_rate': 0.00012647113959155944, 'max_depth': 4, 'min_child_weight': 1, 'subsample': 0.6, 'colsample_bytree': 0.8, 'colsample_bylevel': 0.9, 'reg_alpha': 0.02512419249593732, 'reg_lambda': 0.8528974446896116, 'gamma': 0.03344090658015987}. Best is trial 23 with value: -0.13705033781746384.
/bsuhome/alexanderemert/Research/Star-Formation-Research-Project-2026/pipeline/scripts/optuna/final_preds_and_models/optuna_search_mult_quant_reg.py:75: UserWarning: The distribution is specified by [0.1, 5] and step=0.25, but the range is not divisible by `step`. It will be replaced with [0.1, 4.85].
  error_threshold = trial.suggest_float("error_threshold", 0.1, 5, step=0.25)
[I 2026-07-20 14:38:23,040] Trial 67 finished with value: -0.06492060662300246 and parameters: {'error_threshold': 0.85, 'scalers': 'standard', 'ratios': 'norm_ratio', 'imputers': 'mean', 'n_estimators': 550, 'learning_rate': 0.017324246969950555, 'max_depth': 12, 'min_child_weight': 4, 'subsample': 0.6, 'colsample_bytree': 0.8, 'colsample_bylevel': 0.9, 'reg_alpha': 0.018700629414229796, 'reg_lambda': 98.70228808052674, 'gamma': 0.003328406574504038}. Best is trial 23 with value: -0.13705033781746384.
/bsuhome/alexanderemert/Research/Star-Formation-Research-Project-2026/pipeline/scripts/optuna/final_preds_and_models/optuna_search_mult_quant_reg.py:75: UserWarning: The distribution is specified by [0.1, 5] and step=0.25, but the range is not divisible by `step`. It will be replaced with [0.1, 4.85].
  error_threshold = trial.suggest_float("error_threshold", 0.1, 5, step=0.25)
[I 2026-07-20 14:38:26,118] Trial 70 finished with value: -0.13264050598096666 and parameters: {'error_threshold': 0.6, 'scalers': 'standard', 'ratios': 'norm_ratio', 'imputers': 'none', 'n_estimators': 550, 'learning_rate': 0.00012425511111154706, 'max_depth': 4, 'min_child_weight': 1, 'subsample': 0.6, 'colsample_bytree': 0.8, 'colsample_bylevel': 0.9, 'reg_alpha': 0.0018820361358874323, 'reg_lambda': 97.63603756099911, 'gamma': 0.0022941415198336544}. Best is trial 23 with value: -0.13705033781746384.
/bsuhome/alexanderemert/Research/Star-Formation-Research-Project-2026/pipeline/scripts/optuna/final_preds_and_models/optuna_search_mult_quant_reg.py:75: UserWarning: The distribution is specified by [0.1, 5] and step=0.25, but the range is not divisible by `step`. It will be replaced with [0.1, 4.85].
  error_threshold = trial.suggest_float("error_threshold", 0.1, 5, step=0.25)
[I 2026-07-20 14:38:37,060] Trial 68 finished with value: -0.13629624487410616 and parameters: {'error_threshold': 0.1, 'scalers': 'standard', 'ratios': 'norm_ratio', 'imputers': 'mean', 'n_estimators': 150, 'learning_rate': 0.00011779434171826487, 'max_depth': 12, 'min_child_weight': 1, 'subsample': 0.9, 'colsample_bytree': 0.8, 'colsample_bylevel': 0.9, 'reg_alpha': 0.013889811102994627, 'reg_lambda': 1.2927489006964574, 'gamma': 7.418993163475627e-05}. Best is trial 23 with value: -0.13705033781746384.
/bsuhome/alexanderemert/Research/Star-Formation-Research-Project-2026/pipeline/scripts/optuna/final_preds_and_models/optuna_search_mult_quant_reg.py:75: UserWarning: The distribution is specified by [0.1, 5] and step=0.25, but the range is not divisible by `step`. It will be replaced with [0.1, 4.85].
  error_threshold = trial.suggest_float("error_threshold", 0.1, 5, step=0.25)
[I 2026-07-20 14:38:40,257] Trial 72 finished with value: -0.06366294150832812 and parameters: {'error_threshold': 0.6, 'scalers': 'standard', 'ratios': 'norm_ratio', 'imputers': 'none', 'n_estimators': 550, 'learning_rate': 0.026492382255078682, 'max_depth': 6, 'min_child_weight': 1, 'subsample': 0.6, 'colsample_bytree': 0.8, 'colsample_bylevel': 0.9, 'reg_alpha': 0.0017768569083128002, 'reg_lambda': 44.22883439138577, 'gamma': 0.0397290354631026}. Best is trial 23 with value: -0.13705033781746384.
[I 2026-07-20 14:38:40,265] Trial 73 finished with value: -0.13278426387199868 and parameters: {'error_threshold': 0.6, 'scalers': 'standard', 'ratios': 'norm_ratio', 'imputers': 'none', 'n_estimators': 550, 'learning_rate': 0.00012090639728390227, 'max_depth': 4, 'min_child_weight': 1, 'subsample': 0.6, 'colsample_bytree': 0.8, 'colsample_bylevel': 0.9, 'reg_alpha': 0.019059275118296703, 'reg_lambda': 92.53389470633977, 'gamma': 0.038296296757949676}. Best is trial 23 with value: -0.13705033781746384.
/bsuhome/alexanderemert/Research/Star-Formation-Research-Project-2026/pipeline/scripts/optuna/final_preds_and_models/optuna_search_mult_quant_reg.py:75: UserWarning: The distribution is specified by [0.1, 5] and step=0.25, but the range is not divisible by `step`. It will be replaced with [0.1, 4.85].
  error_threshold = trial.suggest_float("error_threshold", 0.1, 5, step=0.25)
