[I 2026-07-17 16:11:51,985] Trial 90 finished with value: -0.705570158319716 and parameters: {'scalers': 'standard', 'ratios': 'norm_ratio', 'imputers': 'mean', 'n_estimators': 2450, 'learning_rate': 0.34458257211532883, 'max_depth': 12, 'min_child_weight': 3, 'subsample': 1.0, 'colsample_bytree': 0.5, 'colsample_bylevel': 0.5, 'reg_alpha': 0.04538019040875171, 'reg_lambda': 1.9443523872694804e-05, 'gamma': 0.0024185686702780265}. Best is trial 89 with value: -0.7111731215390787.
[I 2026-07-17 16:12:06,906] Trial 91 finished with value: -0.7820829345182392 and parameters: {'scalers': 'standard', 'ratios': 'norm_ratio', 'imputers': 'mean', 'n_estimators': 2500, 'learning_rate': 0.4989554652881972, 'max_depth': 12, 'min_child_weight': 3, 'subsample': 1.0, 'colsample_bytree': 0.5, 'colsample_bylevel': 0.5, 'reg_alpha': 0.12269029579240155, 'reg_lambda': 2.175649483432861e-05, 'gamma': 0.003096224774436611}. Best is trial 91 with value: -0.7820829345182392.
[I 2026-07-17 16:12:18,900] Trial 92 finished with value: -0.7729330110954913 and parameters: {'scalers': 'standard', 'ratios': 'norm_ratio', 'imputers': 'mean', 'n_estimators': 2500, 'learning_rate': 0.4478878197589323, 'max_depth': 12, 'min_child_weight': 3, 'subsample': 1.0, 'colsample_bytree': 0.5, 'colsample_bylevel': 0.5, 'reg_alpha': 0.12034171017328911, 'reg_lambda': 2.746692051068603e-05, 'gamma': 0.0035810332862486745}. Best is trial 91 with value: -0.7820829345182392.
[I 2026-07-17 16:12:33,463] Trial 93 finished with value: -0.7442261163608759 and parameters: {'scalers': 'standard', 'ratios': 'norm_ratio', 'imputers': 'mean', 'n_estimators': 2550, 'learning_rate': 0.4639277995409922, 'max_depth': 12, 'min_child_weight': 3, 'subsample': 1.0, 'colsample_bytree': 0.5, 'colsample_bylevel': 0.6, 'reg_alpha': 0.030460725998758372, 'reg_lambda': 3.2606511336927945e-05, 'gamma': 0.002978996248319788}. Best is trial 91 with value: -0.7820829345182392.
[I 2026-07-17 16:12:52,724] Trial 94 finished with value: -1.186542531206147 and parameters: {'scalers': 'standard', 'ratios': 'norm_ratio', 'imputers': 'mean', 'n_estimators': 2500, 'learning_rate': 0.48638192338131053, 'max_depth': 12, 'min_child_weight': 3, 'subsample': 0.6, 'colsample_bytree': 0.5, 'colsample_bylevel': 0.6, 'reg_alpha': 0.03701052880114854, 'reg_lambda': 2.4481628096382378e-05, 'gamma': 0.004199782528784207}. Best is trial 94 with value: -1.186542531206147.
[I 2026-07-17 16:13:15,030] Trial 95 finished with value: -1.1224367139410985 and parameters: {'scalers': 'standard', 'ratios': 'norm_ratio', 'imputers': 'mean', 'n_estimators': 2550, 'learning_rate': 0.4856601061983728, 'max_depth': 11, 'min_child_weight': 3, 'subsample': 0.9, 'colsample_bytree': 0.5, 'colsample_bylevel': 0.6, 'reg_alpha': 0.7414347575306254, 'reg_lambda': 0.02320738473381309, 'gamma': 0.0006075821359442471}. Best is trial 94 with value: -1.186542531206147.
[I 2026-07-17 16:13:33,610] Trial 96 finished with value: -0.9709439724657979 and parameters: {'scalers': 'standard', 'ratios': 'norm_ratio', 'imputers': 'mean', 'n_estimators': 2800, 'learning_rate': 0.4984710833277656, 'max_depth': 11, 'min_child_weight': 3, 'subsample': 0.9, 'colsample_bytree': 0.5, 'colsample_bylevel': 0.6, 'reg_alpha': 0.0316450213592153, 'reg_lambda': 0.022219476899282418, 'gamma': 0.003102671840523809}. Best is trial 94 with value: -1.186542531206147.
[I 2026-07-17 16:13:50,900] Trial 97 finished with value: -1.1470746861962715 and parameters: {'scalers': 'standard', 'ratios': 'norm_ratio', 'imputers': 'mean', 'n_estimators': 2750, 'learning_rate': 0.4964023355045216, 'max_depth': 11, 'min_child_weight': 3, 'subsample': 0.6, 'colsample_bytree': 0.5, 'colsample_bylevel': 0.5, 'reg_alpha': 0.0358290606553714, 'reg_lambda': 0.02097513368805009, 'gamma': 0.002976653974184609}. Best is trial 94 with value: -1.186542531206147.
[I 2026-07-17 16:14:07,217] Trial 98 finished with value: -1.342034702221362 and parameters: {'scalers': 'standard', 'ratios': 'norm_ratio', 'imputers': 'mean', 'n_estimators': 2700, 'learning_rate': 0.4930290871004696, 'max_depth': 11, 'min_child_weight': 3, 'subsample': 0.6, 'colsample_bytree': 0.5, 'colsample_bylevel': 0.5, 'reg_alpha': 1.1755773352751067, 'reg_lambda': 2.6499789574090237e-05, 'gamma': 0.0006512351387656372}. Best is trial 98 with value: -1.342034702221362.
[I 2026-07-17 16:14:15,735] Trial 99 finished with value: -0.6551760465744497 and parameters: {'scalers': 'standard', 'ratios': 'norm_ratio', 'imputers': 'mean', 'n_estimators': 2700, 'learning_rate': 0.19225761676222344, 'max_depth': 11, 'min_child_weight': 3, 'subsample': 1.0, 'colsample_bytree': 0.5, 'colsample_bylevel': 0.5, 'reg_alpha': 1.278186991556301, 'reg_lambda': 2.7239391434509715e-05, 'gamma': 0.0036845560475514553}. Best is trial 98 with value: -1.342034702221362.
[I 2026-07-17 16:14:38,020] Trial 100 finished with value: -1.1409814566157532 and parameters: {'scalers': 'standard', 'ratios': 'norm_ratio', 'imputers': 'mean', 'n_estimators': 2800, 'learning_rate': 0.4842408505142615, 'max_depth': 11, 'min_child_weight': 3, 'subsample': 0.9, 'colsample_bytree': 0.5, 'colsample_bylevel': 0.5, 'reg_alpha': 0.7695331577978808, 'reg_lambda': 1.5992510698468197e-05, 'gamma': 0.0040299910886947895}. Best is trial 98 with value: -1.342034702221362.
[I 2026-07-17 16:14:59,285] Trial 101 finished with value: -1.0863044540829727 and parameters: {'scalers': 'standard', 'ratios': 'norm_ratio', 'imputers': 'mean', 'n_estimators': 2800, 'learning_rate': 0.4958508902298152, 'max_depth': 11, 'min_child_weight': 3, 'subsample': 0.9, 'colsample_bytree': 0.5, 'colsample_bylevel': 0.5, 'reg_alpha': 0.4416867364087753, 'reg_lambda': 2.1569180773504686e-05, 'gamma': 0.015380188917651244}. Best is trial 98 with value: -1.342034702221362.
[I 2026-07-17 16:15:19,718] Trial 102 finished with value: -1.1228073725563705 and parameters: {'scalers': 'standard', 'ratios': 'norm_ratio', 'imputers': 'mean', 'n_estimators': 2750, 'learning_rate': 0.4053675051528759, 'max_depth': 11, 'min_child_weight': 3, 'subsample': 0.7, 'colsample_bytree': 0.5, 'colsample_bylevel': 0.5, 'reg_alpha': 0.7236972892669032, 'reg_lambda': 1.5690556438068816e-05, 'gamma': 0.0034579439279596664}. Best is trial 98 with value: -1.342034702221362.
[I 2026-07-17 16:15:41,219] Trial 103 finished with value: -1.5791478427450083 and parameters: {'scalers': 'standard', 'ratios': 'norm_ratio', 'imputers': 'mean', 'n_estimators': 2800, 'learning_rate': 0.4716505729885841, 'max_depth': 11, 'min_child_weight': 2, 'subsample': 0.6, 'colsample_bytree': 0.5, 'colsample_bylevel': 0.5, 'reg_alpha': 0.8226576289584032, 'reg_lambda': 1.3652373226797899e-05, 'gamma': 0.003672350591256792}. Best is trial 103 with value: -1.5791478427450083.
[I 2026-07-17 16:16:03,804] Trial 104 finished with value: -1.5860085305962053 and parameters: {'scalers': 'standard', 'ratios': 'norm_ratio', 'imputers': 'mean', 'n_estimators': 2850, 'learning_rate': 0.4934725148657865, 'max_depth': 11, 'min_child_weight': 2, 'subsample': 0.6, 'colsample_bytree': 0.5, 'colsample_bylevel': 0.5, 'reg_alpha': 0.7297149413761366, 'reg_lambda': 1.4248138776328653e-05, 'gamma': 0.004226401130796331}. Best is trial 104 with value: -1.5860085305962053.
[I 2026-07-17 16:16:24,216] Trial 105 finished with value: -1.591518071506632 and parameters: {'scalers': 'standard', 'ratios': 'norm_ratio', 'imputers': 'mean', 'n_estimators': 3000, 'learning_rate': 0.47502105212240175, 'max_depth': 11, 'min_child_weight': 2, 'subsample': 0.6, 'colsample_bytree': 0.5, 'colsample_bylevel': 0.5, 'reg_alpha': 0.9142660671663884, 'reg_lambda': 1.3922759190400614e-05, 'gamma': 0.0036027431981063298}. Best is trial 105 with value: -1.591518071506632.
[I 2026-07-17 16:16:42,921] Trial 106 finished with value: -1.6601277710828586 and parameters: {'scalers': 'standard', 'ratios': 'norm_ratio', 'imputers': 'mean', 'n_estimators': 2800, 'learning_rate': 0.4871889771910267, 'max_depth': 11, 'min_child_weight': 2, 'subsample': 0.6, 'colsample_bytree': 0.5, 'colsample_bylevel': 0.5, 'reg_alpha': 1.0022839885227859, 'reg_lambda': 0.16410122331815105, 'gamma': 0.004085139342133045}. Best is trial 106 with value: -1.6601277710828586.
[I 2026-07-17 16:17:03,430] Trial 107 finished with value: -1.5479195787453812 and parameters: {'scalers': 'standard', 'ratios': 'norm_ratio', 'imputers': 'mean', 'n_estimators': 2850, 'learning_rate': 0.47620578091696614, 'max_depth': 11, 'min_child_weight': 2, 'subsample': 0.6, 'colsample_bytree': 0.5, 'colsample_bylevel': 0.5, 'reg_alpha': 0.763214484285334, 'reg_lambda': 9.819060619183244e-06, 'gamma': 0.01322515290121568}. Best is trial 106 with value: -1.6601277710828586.
[I 2026-07-17 16:17:25,962] Trial 108 finished with value: -1.5463605303288004 and parameters: {'scalers': 'standard', 'ratios': 'norm_ratio', 'imputers': 'mean', 'n_estimators': 3000, 'learning_rate': 0.4993026134990865, 'max_depth': 11, 'min_child_weight': 2, 'subsample': 0.6, 'colsample_bytree': 0.5, 'colsample_bylevel': 0.5, 'reg_alpha': 0.46419543734868335, 'reg_lambda': 0.11996434712922589, 'gamma': 0.015999232493409617}. Best is trial 106 with value: -1.6601277710828586.
[I 2026-07-17 16:17:40,330] Trial 109 finished with value: -1.6465092188395312 and parameters: {'scalers': 'standard', 'ratios': 'norm_ratio', 'imputers': 'mean', 'n_estimators': 3000, 'learning_rate': 0.45560311471797477, 'max_depth': 11, 'min_child_weight': 2, 'subsample': 0.5, 'colsample_bytree': 0.5, 'colsample_bylevel': 0.5, 'reg_alpha': 1.0493696774422638, 'reg_lambda': 9.932633905786967e-06, 'gamma': 0.02351960189619048}. Best is trial 106 with value: -1.6601277710828586.
[I 2026-07-17 16:17:59,158] Trial 110 finished with value: -1.5156102772874787 and parameters: {'scalers': 'standard', 'ratios': 'norm_ratio', 'imputers': 'mean', 'n_estimators': 3000, 'learning_rate': 0.4402027094772944, 'max_depth': 11, 'min_child_weight': 2, 'subsample': 0.6, 'colsample_bytree': 0.5, 'colsample_bylevel': 0.5, 'reg_alpha': 0.9069165187108931, 'reg_lambda': 9.862222985095813e-06, 'gamma': 0.012042660256348646}. Best is trial 106 with value: -1.6601277710828586.
[I 2026-07-17 16:18:20,482] Trial 111 finished with value: -1.522185140492439 and parameters: {'scalers': 'standard', 'ratios': 'norm_ratio', 'imputers': 'mean', 'n_estimators': 2850, 'learning_rate': 0.4783913146553666, 'max_depth': 11, 'min_child_weight': 2, 'subsample': 0.6, 'colsample_bytree': 0.5, 'colsample_bylevel': 0.5, 'reg_alpha': 0.6522532046908408, 'reg_lambda': 9.70246557231811e-06, 'gamma': 0.014917386039127477}. Best is trial 106 with value: -1.6601277710828586.
[I 2026-07-17 16:18:38,011] Trial 112 finished with value: -1.564979404967132 and parameters: {'scalers': 'standard', 'ratios': 'norm_ratio', 'imputers': 'mean', 'n_estimators': 3000, 'learning_rate': 0.46613705170370817, 'max_depth': 11, 'min_child_weight': 2, 'subsample': 0.6, 'colsample_bytree': 0.5, 'colsample_bylevel': 0.5, 'reg_alpha': 0.891193492500444, 'reg_lambda': 8.222720160406209e-06, 'gamma': 0.02074828708382419}. Best is trial 106 with value: -1.6601277710828586.
[I 2026-07-17 16:18:59,095] Trial 113 finished with value: -1.5726400378916043 and parameters: {'scalers': 'standard', 'ratios': 'norm_ratio', 'imputers': 'mean', 'n_estimators': 2950, 'learning_rate': 0.4941319873128645, 'max_depth': 11, 'min_child_weight': 2, 'subsample': 0.6, 'colsample_bytree': 0.5, 'colsample_bylevel': 0.5, 'reg_alpha': 0.7372079099951793, 'reg_lambda': 1.0662550037026563e-05, 'gamma': 0.013319131473893225}. Best is trial 106 with value: -1.6601277710828586.
[I 2026-07-17 16:19:13,710] Trial 114 finished with value: -1.0474505784651504 and parameters: {'scalers': 'standard', 'ratios': 'norm_ratio', 'imputers': 'mean', 'n_estimators': 2950, 'learning_rate': 0.2009876026452377, 'max_depth': 11, 'min_child_weight': 2, 'subsample': 0.6, 'colsample_bytree': 0.5, 'colsample_bylevel': 0.5, 'reg_alpha': 0.7407781734287917, 'reg_lambda': 8.552614220042438e-06, 'gamma': 0.02301039706855302}. Best is trial 106 with value: -1.6601277710828586.
[I 2026-07-17 16:19:27,810] Trial 115 finished with value: -1.1125971274175614 and parameters: {'scalers': 'standard', 'ratios': 'norm_ratio', 'imputers': 'mean', 'n_estimators': 2950, 'learning_rate': 0.2162107252311194, 'max_depth': 11, 'min_child_weight': 2, 'subsample': 0.6, 'colsample_bytree': 0.5, 'colsample_bylevel': 0.5, 'reg_alpha': 1.2060421954402074, 'reg_lambda': 1.097934749212064e-05, 'gamma': 0.006225500807832641}. Best is trial 106 with value: -1.6601277710828586.
[I 2026-07-17 16:19:29,013] Trial 116 finished with value: -0.731299811259267 and parameters: {'scalers': 'standard', 'ratios': 'norm_ratio', 'imputers': 'mean', 'n_estimators': 3000, 'learning_rate': 0.1995361367908345, 'max_depth': 10, 'min_child_weight': 2, 'subsample': 0.6, 'colsample_bytree': 0.5, 'colsample_bylevel': 0.5, 'reg_alpha': 2.3920239484735193, 'reg_lambda': 1.0984985482856274e-05, 'gamma': 0.026553173551015122}. Best is trial 106 with value: -1.6601277710828586.
[I 2026-07-17 16:19:33,011] Trial 117 finished with value: -0.44635843318491036 and parameters: {'scalers': 'standard', 'ratios': 'norm_ratio', 'imputers': 'mean', 'n_estimators': 3000, 'learning_rate': 0.2065187922913172, 'max_depth': 10, 'min_child_weight': 2, 'subsample': 0.6, 'colsample_bytree': 0.5, 'colsample_bylevel': 0.5, 'reg_alpha': 3.4403111804202196, 'reg_lambda': 9.954382116182383e-06, 'gamma': 0.036838753074140015}. Best is trial 106 with value: -1.6601277710828586.
[I 2026-07-17 16:19:38,748] Trial 118 finished with value: -0.674314535045196 and parameters: {'scalers': 'standard', 'ratios': 'norm_ratio', 'imputers': 'mean', 'n_estimators': 3000, 'learning_rate': 0.20871460113042173, 'max_depth': 10, 'min_child_weight': 2, 'subsample': 0.6, 'colsample_bytree': 0.5, 'colsample_bylevel': 0.5, 'reg_alpha': 2.5506730827133173, 'reg_lambda': 1.0769672235372895e-05, 'gamma': 0.03201458137451492}. Best is trial 106 with value: -1.6601277710828586.
[I 2026-07-17 16:19:46,123] Trial 119 finished with value: -0.7134778674766807 and parameters: {'scalers': 'standard', 'ratios': 'norm_ratio', 'imputers': 'mean', 'n_estimators': 3000, 'learning_rate': 0.19752830738801097, 'max_depth': 10, 'min_child_weight': 2, 'subsample': 0.6, 'colsample_bytree': 0.5, 'colsample_bylevel': 0.5, 'reg_alpha': 2.876705203723898, 'reg_lambda': 0.10470810702458534, 'gamma': 0.01361748171514217}. Best is trial 106 with value: -1.6601277710828586.
[I 2026-07-17 16:19:53,467] Trial 120 finished with value: -0.85685773293444 and parameters: {'scalers': 'standard', 'ratios': 'norm_ratio', 'imputers': 'mean', 'n_estimators': 3000, 'learning_rate': 0.2329006640328042, 'max_depth': 10, 'min_child_weight': 2, 'subsample': 0.6, 'colsample_bytree': 0.5, 'colsample_bylevel': 0.5, 'reg_alpha': 2.1225723649245647, 'reg_lambda': 9.401477860530599e-06, 'gamma': 0.0273934139708108}. Best is trial 106 with value: -1.6601277710828586.
[I 2026-07-17 16:19:59,132] Trial 121 finished with value: -0.62554801573372 and parameters: {'scalers': 'standard', 'ratios': 'norm_ratio', 'imputers': 'mean', 'n_estimators': 3000, 'learning_rate': 0.20303978533828568, 'max_depth': 10, 'min_child_weight': 2, 'subsample': 0.6, 'colsample_bytree': 0.5, 'colsample_bylevel': 0.5, 'reg_alpha': 3.00833105062238, 'reg_lambda': 1.0536336541575895e-05, 'gamma': 0.026970901192434768}. Best is trial 106 with value: -1.6601277710828586.
[I 2026-07-17 16:20:03,088] Trial 122 finished with value: -0.4850786756289682 and parameters: {'scalers': 'standard', 'ratios': 'norm_ratio', 'imputers': 'mean', 'n_estimators': 3000, 'learning_rate': 0.2222186702926128, 'max_depth': 10, 'min_child_weight': 2, 'subsample': 0.5, 'colsample_bytree': 0.5, 'colsample_bylevel': 0.5, 'reg_alpha': 3.595521413392451, 'reg_lambda': 3.5972211799092246e-06, 'gamma': 0.033435659779761324}. Best is trial 106 with value: -1.6601277710828586.
[I 2026-07-17 16:20:05,191] Trial 123 finished with value: -0.23887517591165103 and parameters: {'scalers': 'standard', 'ratios': 'norm_ratio', 'imputers': 'mean', 'n_estimators': 3000, 'learning_rate': 0.40297388884865243, 'max_depth': 10, 'min_child_weight': 1, 'subsample': 0.5, 'colsample_bytree': 0.5, 'colsample_bylevel': 0.5, 'reg_alpha': 3.989136796272276, 'reg_lambda': 3.154336303791507e-06, 'gamma': 0.16975383999830007}. Best is trial 106 with value: -1.6601277710828586.
[I 2026-07-17 16:20:10,326] Trial 124 finished with value: -0.9220196531020636 and parameters: {'scalers': 'standard', 'ratios': 'norm_ratio', 'imputers': 'mean', 'n_estimators': 2900, 'learning_rate': 0.4135458611848486, 'max_depth': 10, 'min_child_weight': 1, 'subsample': 0.5, 'colsample_bytree': 0.5, 'colsample_bylevel': 0.5, 'reg_alpha': 5.0893542243608785, 'reg_lambda': 0.18763084840139582, 'gamma': 0.010858082609226763}. Best is trial 106 with value: -1.6601277710828586.
[I 2026-07-17 16:20:26,800] Trial 125 finished with value: -2.0950512503867595 and parameters: {'scalers': 'standard', 'ratios': 'norm_ratio', 'imputers': 'mean', 'n_estimators': 2900, 'learning_rate': 0.41072301116671456, 'max_depth': 10, 'min_child_weight': 1, 'subsample': 0.5, 'colsample_bytree': 0.5, 'colsample_bylevel': 0.5, 'reg_alpha': 0.3294821661669705, 'reg_lambda': 3.241136108295942e-06, 'gamma': 0.011168942504299045}. Best is trial 125 with value: -2.0950512503867595.
[I 2026-07-17 16:20:46,270] Trial 126 finished with value: -2.34150980106467 and parameters: {'scalers': 'standard', 'ratios': 'norm_ratio', 'imputers': 'mean', 'n_estimators': 2900, 'learning_rate': 0.4171170486506739, 'max_depth': 11, 'min_child_weight': 1, 'subsample': 0.5, 'colsample_bytree': 0.5, 'colsample_bylevel': 0.5, 'reg_alpha': 0.27733267218935564, 'reg_lambda': 5.253047573895184e-06, 'gamma': 0.009370173972967171}. Best is trial 126 with value: -2.34150980106467.
[I 2026-07-17 16:21:04,698] Trial 127 finished with value: -2.2039208679469136 and parameters: {'scalers': 'standard', 'ratios': 'norm_ratio', 'imputers': 'mean', 'n_estimators': 2900, 'learning_rate': 0.41028615368909205, 'max_depth': 11, 'min_child_weight': 1, 'subsample': 0.5, 'colsample_bytree': 0.5, 'colsample_bylevel': 0.5, 'reg_alpha': 0.24609231218130637, 'reg_lambda': 3.0596570700222135e-06, 'gamma': 0.012742116982310162}. Best is trial 126 with value: -2.34150980106467.
[I 2026-07-17 16:21:08,499] Trial 128 finished with value: -0.6159364265335372 and parameters: {'scalers': 'standard', 'ratios': 'norm_ratio', 'imputers': 'mean', 'n_estimators': 2900, 'learning_rate': 0.41709284501444677, 'max_depth': 11, 'min_child_weight': 1, 'subsample': 0.5, 'colsample_bytree': 0.5, 'colsample_bylevel': 0.5, 'reg_alpha': 7.052150284788169, 'reg_lambda': 4.047067811166222e-06, 'gamma': 0.007154403718289773}. Best is trial 126 with value: -2.34150980106467.
[I 2026-07-17 16:21:14,126] Trial 129 finished with value: -0.25955303595006896 and parameters: {'scalers': 'standard', 'ratios': 'norm_ratio', 'imputers': 'mean', 'n_estimators': 2900, 'learning_rate': 0.006047233958292042, 'max_depth': 11, 'min_child_weight': 1, 'subsample': 0.5, 'colsample_bytree': 0.5, 'colsample_bylevel': 0.5, 'reg_alpha': 0.23968143640169606, 'reg_lambda': 3.353600803679218e-06, 'gamma': 0.15485331797566115}. Best is trial 126 with value: -2.34150980106467.
[I 2026-07-17 16:21:32,551] Trial 130 finished with value: -2.177053611441587 and parameters: {'scalers': 'standard', 'ratios': 'norm_ratio', 'imputers': 'mean', 'n_estimators': 2900, 'learning_rate': 0.41838008090611783, 'max_depth': 11, 'min_child_weight': 1, 'subsample': 0.5, 'colsample_bytree': 0.5, 'colsample_bylevel': 0.5, 'reg_alpha': 0.23144929094994401, 'reg_lambda': 4.800501331585403e-05, 'gamma': 0.00950891583574426}. Best is trial 126 with value: -2.34150980106467.
[I 2026-07-17 16:21:53,465] Trial 131 finished with value: -2.2351347123897414 and parameters: {'scalers': 'standard', 'ratios': 'norm_ratio', 'imputers': 'mean', 'n_estimators': 2900, 'learning_rate': 0.43917996706796725, 'max_depth': 11, 'min_child_weight': 1, 'subsample': 0.6, 'colsample_bytree': 0.5, 'colsample_bylevel': 0.5, 'reg_alpha': 0.23448119861640113, 'reg_lambda': 0.5964886957539427, 'gamma': 0.011119853992659058}. Best is trial 126 with value: -2.34150980106467.
[I 2026-07-17 16:22:11,641] Trial 132 finished with value: -1.99300843073815 and parameters: {'scalers': 'standard', 'ratios': 'norm_ratio', 'imputers': 'mean', 'n_estimators': 2850, 'learning_rate': 0.41826758646730566, 'max_depth': 11, 'min_child_weight': 1, 'subsample': 0.6, 'colsample_bytree': 0.5, 'colsample_bylevel': 0.5, 'reg_alpha': 0.2298656018440885, 'reg_lambda': 5.4282106411196145e-05, 'gamma': 0.00975769417594819}. Best is trial 126 with value: -2.34150980106467.
[I 2026-07-17 16:22:21,070] Trial 133 finished with value: -1.6929958470628843 and parameters: {'scalers': 'standard', 'ratios': 'norm_ratio', 'imputers': 'mean', 'n_estimators': 2850, 'learning_rate': 0.4153925417759499, 'max_depth': 9, 'min_child_weight': 1, 'subsample': 0.5, 'colsample_bytree': 0.5, 'colsample_bylevel': 0.5, 'reg_alpha': 0.2522695569364879, 'reg_lambda': 5.222217774685594e-06, 'gamma': 0.10736145897524942}. Best is trial 126 with value: -2.34150980106467.
[I 2026-07-17 16:22:34,523] Trial 134 finished with value: -1.6402404410737093 and parameters: {'scalers': 'standard', 'ratios': 'norm_ratio', 'imputers': 'median', 'n_estimators': 2850, 'learning_rate': 0.29991493231443617, 'max_depth': 9, 'min_child_weight': 1, 'subsample': 0.5, 'colsample_bytree': 0.5, 'colsample_bylevel': 0.5, 'reg_alpha': 0.2754898963322154, 'reg_lambda': 0.5862078567777563, 'gamma': 0.009700545211414202}. Best is trial 126 with value: -2.34150980106467.
