[I 2026-07-17 11:44:46,551] Trial 315 finished with value: -0.2438379372071744 and parameters: {'scalers': 'robust', 'ratios': 'log_ratio', 'imputers': 'mean', 'n_estimators': 100, 'learning_rate': 0.00010240628524098519, 'max_depth': 5, 'min_child_weight': 10, 'subsample': 0.5, 'colsample_bytree': 0.9, 'colsample_bylevel': 1.0, 'reg_alpha': 6.4707067955542135, 'reg_lambda': 69.10278262609853, 'gamma': 99.52677708318666}. Best is trial 311 with value: -0.24383794814210505.
[I 2026-07-17 11:44:46,775] Trial 316 finished with value: -0.24320434153679224 and parameters: {'scalers': 'robust', 'ratios': 'log_ratio', 'imputers': 'mean', 'n_estimators': 100, 'learning_rate': 0.0001209648982768364, 'max_depth': 3, 'min_child_weight': 10, 'subsample': 0.5, 'colsample_bytree': 0.9, 'colsample_bylevel': 1.0, 'reg_alpha': 5.2131525864942025, 'reg_lambda': 28.473481452838048, 'gamma': 47.16167394394468}. Best is trial 311 with value: -0.24383794814210505.
[I 2026-07-17 11:44:46,955] Trial 317 finished with value: -0.2438377582539037 and parameters: {'scalers': 'robust', 'ratios': 'log_ratio', 'imputers': 'mean', 'n_estimators': 100, 'learning_rate': 0.00012353736035937283, 'max_depth': 3, 'min_child_weight': 10, 'subsample': 0.5, 'colsample_bytree': 0.9, 'colsample_bylevel': 1.0, 'reg_alpha': 5.410558224971664, 'reg_lambda': 0.82517201143416, 'gamma': 98.39743393401572}. Best is trial 311 with value: -0.24383794814210505.
[I 2026-07-17 11:44:47,178] Trial 318 finished with value: -0.2432084062817599 and parameters: {'scalers': 'robust', 'ratios': 'log_ratio', 'imputers': 'mean', 'n_estimators': 100, 'learning_rate': 0.00012019336783922003, 'max_depth': 5, 'min_child_weight': 10, 'subsample': 0.5, 'colsample_bytree': 0.9, 'colsample_bylevel': 1.0, 'reg_alpha': 6.475714196488346, 'reg_lambda': 85.87863241362098, 'gamma': 45.118051590472184}. Best is trial 311 with value: -0.24383794814210505.
[I 2026-07-17 11:44:47,413] Trial 319 finished with value: -0.24383793619776586 and parameters: {'scalers': 'robust', 'ratios': 'log_ratio', 'imputers': 'mean', 'n_estimators': 100, 'learning_rate': 0.00010238069568835852, 'max_depth': 3, 'min_child_weight': 10, 'subsample': 0.5, 'colsample_bytree': 0.9, 'colsample_bylevel': 1.0, 'reg_alpha': 5.314312112965077, 'reg_lambda': 0.4842576222660721, 'gamma': 99.91275719959224}. Best is trial 311 with value: -0.24383794814210505.
