[I 2026-07-17 11:40:56,105] Trial 315 finished with value: -0.33174765920225474 and parameters: {'scalers': 'standard', 'ratios': 'norm_ratio', 'imputers': 'median', 'n_estimators': 150, 'learning_rate': 0.0002364360004763123, 'max_depth': 5, 'min_child_weight': 1, 'subsample': 0.6, 'colsample_bytree': 0.5, 'colsample_bylevel': 0.9, 'reg_alpha': 0.002833762061445715, 'reg_lambda': 0.0003849264679771689, 'gamma': 11.694159073157042}. Best is trial 201 with value: -0.33399157254406253.
[I 2026-07-17 11:40:56,436] Trial 316 finished with value: -0.3319820081044136 and parameters: {'scalers': 'standard', 'ratios': 'norm_ratio', 'imputers': 'median', 'n_estimators': 150, 'learning_rate': 0.00023948981447876317, 'max_depth': 5, 'min_child_weight': 1, 'subsample': 0.6, 'colsample_bytree': 0.5, 'colsample_bylevel': 0.9, 'reg_alpha': 0.0019343929985270209, 'reg_lambda': 0.00030824658465892574, 'gamma': 13.934371741549546}. Best is trial 201 with value: -0.33399157254406253.
[I 2026-07-17 11:40:56,722] Trial 317 finished with value: -0.33167394036257447 and parameters: {'scalers': 'standard', 'ratios': 'norm_ratio', 'imputers': 'median', 'n_estimators': 150, 'learning_rate': 0.00023206124409056036, 'max_depth': 5, 'min_child_weight': 10, 'subsample': 0.6, 'colsample_bytree': 0.5, 'colsample_bylevel': 0.9, 'reg_alpha': 0.0021240837415886027, 'reg_lambda': 0.0004865366585781665, 'gamma': 11.196081568319798}. Best is trial 201 with value: -0.33399157254406253.
[I 2026-07-17 11:40:56,936] Trial 318 finished with value: -0.33312520470178003 and parameters: {'scalers': 'standard', 'ratios': 'norm_ratio', 'imputers': 'median', 'n_estimators': 100, 'learning_rate': 0.00024363478420655788, 'max_depth': 5, 'min_child_weight': 5, 'subsample': 0.6, 'colsample_bytree': 0.5, 'colsample_bylevel': 0.9, 'reg_alpha': 0.003000929089851252, 'reg_lambda': 0.0002532244844298845, 'gamma': 18.210247972613782}. Best is trial 201 with value: -0.33399157254406253.
[I 2026-07-17 11:40:57,152] Trial 319 finished with value: -0.33268472011495165 and parameters: {'scalers': 'standard', 'ratios': 'norm_ratio', 'imputers': 'median', 'n_estimators': 100, 'learning_rate': 0.0002274032441371802, 'max_depth': 5, 'min_child_weight': 1, 'subsample': 0.6, 'colsample_bytree': 0.5, 'colsample_bylevel': 0.9, 'reg_alpha': 0.0020405579445135764, 'reg_lambda': 0.0004377716857767781, 'gamma': 11.318821331211169}. Best is trial 201 with value: -0.33399157254406253.
