[I 2026-07-17 11:42:41,363] Trial 135 finished with value: -0.21941759689706158 and parameters: {'scalers': 'robust', 'ratios': 'log_ratio', 'imputers': 'mean', 'n_estimators': 2350, 'learning_rate': 0.0004020109000985525, 'max_depth': 8, 'min_child_weight': 9, 'subsample': 0.5, 'colsample_bytree': 0.9, 'colsample_bylevel': 0.5, 'reg_alpha': 26.647008300987753, 'reg_lambda': 4.963296269897355e-06, 'gamma': 14.57231304042544}. Best is trial 60 with value: -0.24381957873596422.
[I 2026-07-17 11:42:44,228] Trial 136 finished with value: -0.24369943506732727 and parameters: {'scalers': 'robust', 'ratios': 'log_ratio', 'imputers': 'mean', 'n_estimators': 2050, 'learning_rate': 0.00010587679034503585, 'max_depth': 8, 'min_child_weight': 9, 'subsample': 0.5, 'colsample_bytree': 0.9, 'colsample_bylevel': 0.5, 'reg_alpha': 27.700870344389774, 'reg_lambda': 1.9434257910588857e-06, 'gamma': 64.3369140833718}. Best is trial 60 with value: -0.24381957873596422.
[I 2026-07-17 11:42:47,025] Trial 137 finished with value: -0.23534768725492416 and parameters: {'scalers': 'robust', 'ratios': 'log_ratio', 'imputers': 'mean', 'n_estimators': 2050, 'learning_rate': 0.0003759939785546245, 'max_depth': 8, 'min_child_weight': 6, 'subsample': 0.5, 'colsample_bytree': 0.5, 'colsample_bylevel': 0.5, 'reg_alpha': 0.0003368376121105157, 'reg_lambda': 3.018854727797881e-06, 'gamma': 63.698309232106894}. Best is trial 60 with value: -0.24381957873596422.
[I 2026-07-17 11:42:51,359] Trial 138 finished with value: -0.23850516677446273 and parameters: {'scalers': 'standard', 'ratios': 'log_ratio', 'imputers': 'mean', 'n_estimators': 2650, 'learning_rate': 0.00040530833058052585, 'max_depth': 8, 'min_child_weight': 1, 'subsample': 0.7, 'colsample_bytree': 0.9, 'colsample_bylevel': 0.5, 'reg_alpha': 0.0003365372703770238, 'reg_lambda': 0.006977097875039542, 'gamma': 99.71397715964193}. Best is trial 60 with value: -0.24381957873596422.
[I 2026-07-17 11:42:55,617] Trial 139 finished with value: -0.23432644404274472 and parameters: {'scalers': 'standard', 'ratios': 'log_ratio', 'imputers': 'mean', 'n_estimators': 2600, 'learning_rate': 0.00041378251602797764, 'max_depth': 8, 'min_child_weight': 2, 'subsample': 0.7, 'colsample_bytree': 0.9, 'colsample_bylevel': 0.5, 'reg_alpha': 27.36635028654956, 'reg_lambda': 0.0009656992073408683, 'gamma': 64.57804877821124}. Best is trial 60 with value: -0.24381957873596422.
[I 2026-07-17 11:42:59,983] Trial 140 finished with value: -0.23798580211924608 and parameters: {'scalers': 'standard', 'ratios': 'log_ratio', 'imputers': 'mean', 'n_estimators': 2650, 'learning_rate': 0.00033121252501891506, 'max_depth': 8, 'min_child_weight': 1, 'subsample': 0.7, 'colsample_bytree': 0.9, 'colsample_bylevel': 0.5, 'reg_alpha': 0.03853566212384896, 'reg_lambda': 0.0072461895828988595, 'gamma': 97.00050314568581}. Best is trial 60 with value: -0.24381957873596422.
[I 2026-07-17 11:43:04,280] Trial 141 finished with value: -0.22873755975836685 and parameters: {'scalers': 'standard', 'ratios': 'log_ratio', 'imputers': 'mean', 'n_estimators': 2500, 'learning_rate': 0.00034549339789671877, 'max_depth': 8, 'min_child_weight': 1, 'subsample': 0.7, 'colsample_bytree': 0.6, 'colsample_bylevel': 0.8, 'reg_alpha': 1.1137579147792011e-06, 'reg_lambda': 4.344785597842446e-06, 'gamma': 68.44727295437096}. Best is trial 60 with value: -0.24381957873596422.
[I 2026-07-17 11:43:08,395] Trial 142 finished with value: -0.23752011954704608 and parameters: {'scalers': 'standard', 'ratios': 'log_ratio', 'imputers': 'mean', 'n_estimators': 2500, 'learning_rate': 0.00039413364315220284, 'max_depth': 8, 'min_child_weight': 1, 'subsample': 0.7, 'colsample_bytree': 0.6, 'colsample_bylevel': 0.8, 'reg_alpha': 36.02549170566134, 'reg_lambda': 0.0011379937089835426, 'gamma': 66.33169141521012}. Best is trial 60 with value: -0.24381957873596422.
[I 2026-07-17 11:43:12,715] Trial 143 finished with value: -0.22787774402419517 and parameters: {'scalers': 'standard', 'ratios': 'log_ratio', 'imputers': 'mean', 'n_estimators': 2500, 'learning_rate': 0.00035276972364253837, 'max_depth': 8, 'min_child_weight': 1, 'subsample': 0.7, 'colsample_bytree': 0.6, 'colsample_bylevel': 0.8, 'reg_alpha': 1.2406094391931268e-06, 'reg_lambda': 0.0010138041977654538, 'gamma': 65.57091960871317}. Best is trial 60 with value: -0.24381957873596422.
[I 2026-07-17 11:43:16,517] Trial 144 finished with value: -0.23540860274910935 and parameters: {'scalers': 'robust', 'ratios': 'log_ratio', 'imputers': 'mean', 'n_estimators': 2600, 'learning_rate': 0.0003342308229160508, 'max_depth': 8, 'min_child_weight': 8, 'subsample': 0.5, 'colsample_bytree': 0.9, 'colsample_bylevel': 0.5, 'reg_alpha': 0.03237664758306885, 'reg_lambda': 0.00017634765825743815, 'gamma': 66.71406906514954}. Best is trial 60 with value: -0.24381957873596422.
[I 2026-07-17 11:43:19,231] Trial 145 finished with value: -0.22933419085343001 and parameters: {'scalers': 'robust', 'ratios': 'log_ratio', 'imputers': 'mean', 'n_estimators': 2000, 'learning_rate': 0.036854762857456064, 'max_depth': 8, 'min_child_weight': 8, 'subsample': 0.5, 'colsample_bytree': 0.9, 'colsample_bylevel': 0.5, 'reg_alpha': 1.4669368600554912e-06, 'reg_lambda': 0.0011191691396512733, 'gamma': 63.13052278451293}. Best is trial 60 with value: -0.24381957873596422.
[I 2026-07-17 11:43:23,070] Trial 146 finished with value: -0.2437802150890985 and parameters: {'scalers': 'robust', 'ratios': 'log_ratio', 'imputers': 'mean', 'n_estimators': 2600, 'learning_rate': 0.00032628708379944197, 'max_depth': 6, 'min_child_weight': 8, 'subsample': 0.5, 'colsample_bytree': 0.9, 'colsample_bylevel': 0.8, 'reg_alpha': 33.1524153388055, 'reg_lambda': 0.0004642845247093223, 'gamma': 65.66126867042095}. Best is trial 60 with value: -0.24381957873596422.
[I 2026-07-17 11:43:26,376] Trial 147 finished with value: -0.24380116394967988 and parameters: {'scalers': 'robust', 'ratios': 'log_ratio', 'imputers': 'mean', 'n_estimators': 2250, 'learning_rate': 0.0003109412697068863, 'max_depth': 6, 'min_child_weight': 8, 'subsample': 0.5, 'colsample_bytree': 0.9, 'colsample_bylevel': 0.8, 'reg_alpha': 99.75324307425156, 'reg_lambda': 0.0005079269977730169, 'gamma': 64.58937020134385}. Best is trial 60 with value: -0.24381957873596422.
[I 2026-07-17 11:43:30,027] Trial 148 finished with value: -0.23671290546412777 and parameters: {'scalers': 'standard', 'ratios': 'log_ratio', 'imputers': 'mean', 'n_estimators': 2550, 'learning_rate': 0.00047903539123899064, 'max_depth': 8, 'min_child_weight': 1, 'subsample': 0.5, 'colsample_bytree': 0.9, 'colsample_bylevel': 0.5, 'reg_alpha': 9.172812953314935, 'reg_lambda': 0.0010968337400501895, 'gamma': 62.71079462838026}. Best is trial 60 with value: -0.24381957873596422.
[I 2026-07-17 11:43:31,207] Trial 150 finished with value: -0.24383584133611805 and parameters: {'scalers': 'robust', 'ratios': 'log_ratio', 'imputers': 'mean', 'n_estimators': 150, 'learning_rate': 0.00025981981598285415, 'max_depth': 6, 'min_child_weight': 8, 'subsample': 0.5, 'colsample_bytree': 0.9, 'colsample_bylevel': 0.5, 'reg_alpha': 97.63234225361859, 'reg_lambda': 0.0065063586192001055, 'gamma': 97.2958739614363}. Best is trial 150 with value: -0.24383584133611805.
[I 2026-07-17 11:43:32,807] Trial 149 finished with value: -0.2438017829087805 and parameters: {'scalers': 'standard', 'ratios': 'log_ratio', 'imputers': 'mean', 'n_estimators': 2000, 'learning_rate': 0.0002630220625001701, 'max_depth': 8, 'min_child_weight': 8, 'subsample': 0.5, 'colsample_bytree': 0.9, 'colsample_bylevel': 0.5, 'reg_alpha': 35.97768076875535, 'reg_lambda': 0.0011243990589467202, 'gamma': 62.76339305887677}. Best is trial 150 with value: -0.24383584133611805.
[I 2026-07-17 11:43:34,606] Trial 152 finished with value: -0.2438359325070172 and parameters: {'scalers': 'standard', 'ratios': 'log_ratio', 'imputers': 'mean', 'n_estimators': 150, 'learning_rate': 0.00025108039098892124, 'max_depth': 6, 'min_child_weight': 8, 'subsample': 0.5, 'colsample_bytree': 0.9, 'colsample_bylevel': 0.5, 'reg_alpha': 98.49163162460326, 'reg_lambda': 0.00042919969734514567, 'gamma': 54.57320769037475}. Best is trial 152 with value: -0.2438359325070172.
[I 2026-07-17 11:43:35,642] Trial 151 finished with value: -0.243752530623521 and parameters: {'scalers': 'robust', 'ratios': 'log_ratio', 'imputers': 'mean', 'n_estimators': 2000, 'learning_rate': 0.0004847820775756512, 'max_depth': 6, 'min_child_weight': 8, 'subsample': 0.5, 'colsample_bytree': 0.9, 'colsample_bylevel': 0.5, 'reg_alpha': 0.008317314425936724, 'reg_lambda': 0.002440271996737503, 'gamma': 95.62153597585156}. Best is trial 152 with value: -0.2438359325070172.
[I 2026-07-17 11:43:39,728] Trial 153 finished with value: -0.236033614823798 and parameters: {'scalers': 'standard', 'ratios': 'log_ratio', 'imputers': 'median', 'n_estimators': 2250, 'learning_rate': 0.00012020343669861847, 'max_depth': 6, 'min_child_weight': 7, 'subsample': 0.8, 'colsample_bytree': 0.9, 'colsample_bylevel': 0.5, 'reg_alpha': 0.007221938317407212, 'reg_lambda': 0.028436291633603856, 'gamma': 94.179050829379}. Best is trial 152 with value: -0.2438359325070172.
[I 2026-07-17 11:43:43,056] Trial 154 finished with value: -0.24380569512167427 and parameters: {'scalers': 'robust', 'ratios': 'log_ratio', 'imputers': 'median', 'n_estimators': 2250, 'learning_rate': 0.000258760884770568, 'max_depth': 6, 'min_child_weight': 7, 'subsample': 0.5, 'colsample_bytree': 0.9, 'colsample_bylevel': 0.8, 'reg_alpha': 64.73378381768288, 'reg_lambda': 0.0005061469634294088, 'gamma': 50.503595000318874}. Best is trial 152 with value: -0.2438359325070172.
[I 2026-07-17 11:43:46,362] Trial 155 finished with value: -0.24380508507528736 and parameters: {'scalers': 'robust', 'ratios': 'log_ratio', 'imputers': 'mean', 'n_estimators': 2250, 'learning_rate': 0.0002652302766066134, 'max_depth': 6, 'min_child_weight': 8, 'subsample': 0.5, 'colsample_bytree': 0.9, 'colsample_bylevel': 0.8, 'reg_alpha': 63.326941325700204, 'reg_lambda': 0.000379097802842603, 'gamma': 53.0428321151027}. Best is trial 152 with value: -0.2438359325070172.
[I 2026-07-17 11:43:49,682] Trial 156 finished with value: -0.24380655045281094 and parameters: {'scalers': 'robust', 'ratios': 'log_ratio', 'imputers': 'mean', 'n_estimators': 2250, 'learning_rate': 0.00024963908764975276, 'max_depth': 6, 'min_child_weight': 8, 'subsample': 0.5, 'colsample_bytree': 0.9, 'colsample_bylevel': 0.8, 'reg_alpha': 91.70365677245813, 'reg_lambda': 0.0003536201083930277, 'gamma': 96.07736844435748}. Best is trial 152 with value: -0.2438359325070172.
[I 2026-07-17 11:43:49,914] Trial 157 finished with value: -0.24383028287336952 and parameters: {'scalers': 'robust', 'ratios': 'log_ratio', 'imputers': 'mean', 'n_estimators': 400, 'learning_rate': 0.0002578982300672774, 'max_depth': 6, 'min_child_weight': 8, 'subsample': 0.5, 'colsample_bytree': 0.9, 'colsample_bylevel': 0.8, 'reg_alpha': 91.60840032303024, 'reg_lambda': 0.0003558534017762309, 'gamma': 92.81803604314685}. Best is trial 152 with value: -0.2438359325070172.
[I 2026-07-17 11:43:51,526] Trial 159 finished with value: -0.2438366368280792 and parameters: {'scalers': 'robust', 'ratios': 'log_ratio', 'imputers': 'mean', 'n_estimators': 100, 'learning_rate': 0.00024998951536321624, 'max_depth': 6, 'min_child_weight': 8, 'subsample': 0.5, 'colsample_bytree': 0.9, 'colsample_bylevel': 0.5, 'reg_alpha': 75.61778628340464, 'reg_lambda': 0.00037416344726306247, 'gamma': 49.99293260733925}. Best is trial 159 with value: -0.2438366368280792.
[I 2026-07-17 11:43:51,628] Trial 158 finished with value: -0.2438185510856143 and parameters: {'scalers': 'robust', 'ratios': 'log_ratio', 'imputers': 'mean', 'n_estimators': 1150, 'learning_rate': 0.00026163785454454835, 'max_depth': 6, 'min_child_weight': 8, 'subsample': 0.5, 'colsample_bytree': 0.9, 'colsample_bylevel': 0.8, 'reg_alpha': 93.05753076200064, 'reg_lambda': 0.0003562896362982281, 'gamma': 99.80741761749866}. Best is trial 159 with value: -0.2438366368280792.
[I 2026-07-17 11:43:51,924] Trial 160 finished with value: -0.24383575282422906 and parameters: {'scalers': 'robust', 'ratios': 'log_ratio', 'imputers': 'mean', 'n_estimators': 150, 'learning_rate': 0.0002672477713062313, 'max_depth': 6, 'min_child_weight': 8, 'subsample': 0.5, 'colsample_bytree': 0.9, 'colsample_bylevel': 0.5, 'reg_alpha': 0.007123699097996201, 'reg_lambda': 0.00046169137192453, 'gamma': 99.24365883505563}. Best is trial 159 with value: -0.2438366368280792.
[I 2026-07-17 11:43:52,468] Trial 161 finished with value: -0.23993193461863135 and parameters: {'scalers': 'robust', 'ratios': 'log_ratio', 'imputers': 'mean', 'n_estimators': 350, 'learning_rate': 0.0002593527361517892, 'max_depth': 6, 'min_child_weight': 8, 'subsample': 0.5, 'colsample_bytree': 0.9, 'colsample_bylevel': 0.5, 'reg_alpha': 0.001483161597054659, 'reg_lambda': 0.0003550539818406221, 'gamma': 50.3965123674942}. Best is trial 159 with value: -0.2438366368280792.
[I 2026-07-17 11:43:52,730] Trial 162 finished with value: -0.24383595580642645 and parameters: {'scalers': 'robust', 'ratios': 'log_ratio', 'imputers': 'mean', 'n_estimators': 150, 'learning_rate': 0.0002484680450165824, 'max_depth': 6, 'min_child_weight': 8, 'subsample': 0.5, 'colsample_bytree': 0.9, 'colsample_bylevel': 0.8, 'reg_alpha': 89.05111852152234, 'reg_lambda': 0.00040902392447398906, 'gamma': 51.12293485532844}. Best is trial 159 with value: -0.2438366368280792.
[I 2026-07-17 11:43:53,003] Trial 163 finished with value: -0.24383595412988224 and parameters: {'scalers': 'robust', 'ratios': 'log_ratio', 'imputers': 'mean', 'n_estimators': 150, 'learning_rate': 0.00024859439546220176, 'max_depth': 6, 'min_child_weight': 8, 'subsample': 0.5, 'colsample_bytree': 0.9, 'colsample_bylevel': 0.8, 'reg_alpha': 78.03664219835473, 'reg_lambda': 0.0003289275812076941, 'gamma': 51.02029276076122}. Best is trial 159 with value: -0.2438366368280792.
[I 2026-07-17 11:43:53,346] Trial 164 finished with value: -0.24383467791247868 and parameters: {'scalers': 'robust', 'ratios': 'log_ratio', 'imputers': 'mean', 'n_estimators': 200, 'learning_rate': 0.0002478106748915526, 'max_depth': 6, 'min_child_weight': 8, 'subsample': 0.5, 'colsample_bytree': 0.9, 'colsample_bylevel': 0.8, 'reg_alpha': 97.27437887515516, 'reg_lambda': 0.0003592399220411887, 'gamma': 44.9192643829331}. Best is trial 159 with value: -0.2438366368280792.
[I 2026-07-17 11:43:53,484] Trial 165 finished with value: -0.24383658427419003 and parameters: {'scalers': 'robust', 'ratios': 'log_ratio', 'imputers': 'mean', 'n_estimators': 100, 'learning_rate': 0.00025634714075038853, 'max_depth': 6, 'min_child_weight': 8, 'subsample': 0.5, 'colsample_bytree': 0.9, 'colsample_bylevel': 0.8, 'reg_alpha': 93.43109331191869, 'reg_lambda': 0.0003750354802125004, 'gamma': 49.44015882597571}. Best is trial 159 with value: -0.2438366368280792.
[I 2026-07-17 11:43:54,049] Trial 166 finished with value: -0.24383204634179143 and parameters: {'scalers': 'robust', 'ratios': 'log_ratio', 'imputers': 'mean', 'n_estimators': 300, 'learning_rate': 0.0002730878720248563, 'max_depth': 6, 'min_child_weight': 8, 'subsample': 0.5, 'colsample_bytree': 0.9, 'colsample_bylevel': 0.8, 'reg_alpha': 93.97617509012927, 'reg_lambda': 0.00033404495801264017, 'gamma': 46.682643450984315}. Best is trial 159 with value: -0.2438366368280792.
[I 2026-07-17 11:43:54,278] Trial 167 finished with value: -0.24383659991391443 and parameters: {'scalers': 'robust', 'ratios': 'log_ratio', 'imputers': 'mean', 'n_estimators': 100, 'learning_rate': 0.0002539999664807031, 'max_depth': 6, 'min_child_weight': 8, 'subsample': 0.5, 'colsample_bytree': 0.9, 'colsample_bylevel': 0.8, 'reg_alpha': 97.39658872137082, 'reg_lambda': 0.0003647738698616426, 'gamma': 47.06665073539491}. Best is trial 159 with value: -0.2438366368280792.
[I 2026-07-17 11:43:54,353] Trial 168 finished with value: -0.2438365774420815 and parameters: {'scalers': 'robust', 'ratios': 'log_ratio', 'imputers': 'mean', 'n_estimators': 100, 'learning_rate': 0.00025739472689903487, 'max_depth': 6, 'min_child_weight': 8, 'subsample': 0.5, 'colsample_bytree': 0.9, 'colsample_bylevel': 0.8, 'reg_alpha': 99.18254848733616, 'reg_lambda': 0.0003582784533677576, 'gamma': 46.783243396308684}. Best is trial 159 with value: -0.2438366368280792.
[I 2026-07-17 11:43:54,841] Trial 169 finished with value: -0.24383466070362267 and parameters: {'scalers': 'robust', 'ratios': 'log_ratio', 'imputers': 'mean', 'n_estimators': 200, 'learning_rate': 0.0002484052962695365, 'max_depth': 6, 'min_child_weight': 8, 'subsample': 0.5, 'colsample_bytree': 0.9, 'colsample_bylevel': 0.8, 'reg_alpha': 80.98874605830461, 'reg_lambda': 0.00021935491389859602, 'gamma': 47.52881562659617}. Best is trial 159 with value: -0.2438366368280792.
[I 2026-07-17 11:43:55,012] Trial 170 finished with value: -0.24383562640260228 and parameters: {'scalers': 'robust', 'ratios': 'log_ratio', 'imputers': 'mean', 'n_estimators': 150, 'learning_rate': 0.00027888541216961304, 'max_depth': 6, 'min_child_weight': 8, 'subsample': 0.5, 'colsample_bytree': 0.9, 'colsample_bylevel': 0.8, 'reg_alpha': 99.6848356542455, 'reg_lambda': 0.00019880050229159477, 'gamma': 48.86009933152152}. Best is trial 159 with value: -0.2438366368280792.
[I 2026-07-17 11:43:55,350] Trial 171 finished with value: -0.24383595081352893 and parameters: {'scalers': 'robust', 'ratios': 'log_ratio', 'imputers': 'mean', 'n_estimators': 150, 'learning_rate': 0.0002491730599112902, 'max_depth': 6, 'min_child_weight': 8, 'subsample': 0.5, 'colsample_bytree': 0.9, 'colsample_bylevel': 0.8, 'reg_alpha': 99.6409423718023, 'reg_lambda': 0.00017051133630531488, 'gamma': 45.653100304655176}. Best is trial 159 with value: -0.2438366368280792.
[I 2026-07-17 11:43:55,595] Trial 172 finished with value: -0.24383669557859372 and parameters: {'scalers': 'robust', 'ratios': 'log_ratio', 'imputers': 'mean', 'n_estimators': 100, 'learning_rate': 0.00024390930919324747, 'max_depth': 6, 'min_child_weight': 8, 'subsample': 0.5, 'colsample_bytree': 0.9, 'colsample_bylevel': 0.8, 'reg_alpha': 97.28711421886469, 'reg_lambda': 0.00017514393465428723, 'gamma': 30.639373549665954}. Best is trial 172 with value: -0.24383669557859372.
[I 2026-07-17 11:43:55,784] Trial 173 finished with value: -0.2438370193901794 and parameters: {'scalers': 'robust', 'ratios': 'log_ratio', 'imputers': 'mean', 'n_estimators': 100, 'learning_rate': 0.00020733965567778958, 'max_depth': 6, 'min_child_weight': 8, 'subsample': 0.5, 'colsample_bytree': 0.9, 'colsample_bylevel': 0.8, 'reg_alpha': 96.74438725629969, 'reg_lambda': 0.0002224451665814191, 'gamma': 33.87350438998887}. Best is trial 173 with value: -0.2438370193901794.
[I 2026-07-17 11:43:56,037] Trial 174 finished with value: -0.24383700652940238 and parameters: {'scalers': 'robust', 'ratios': 'log_ratio', 'imputers': 'mean', 'n_estimators': 100, 'learning_rate': 0.00020853331455700748, 'max_depth': 6, 'min_child_weight': 8, 'subsample': 0.5, 'colsample_bytree': 0.9, 'colsample_bylevel': 0.8, 'reg_alpha': 92.0444031928731, 'reg_lambda': 0.00023514634062130144, 'gamma': 33.372157282743935}. Best is trial 173 with value: -0.2438370193901794.
[I 2026-07-17 11:43:56,300] Trial 175 finished with value: -0.2438233282496242 and parameters: {'scalers': 'robust', 'ratios': 'log_ratio', 'imputers': 'mean', 'n_estimators': 150, 'learning_rate': 0.00020100016761114817, 'max_depth': 6, 'min_child_weight': 8, 'subsample': 0.5, 'colsample_bytree': 0.9, 'colsample_bylevel': 0.8, 'reg_alpha': 97.82016802159225, 'reg_lambda': 0.000227370244059471, 'gamma': 18.467149254631263}. Best is trial 173 with value: -0.2438370193901794.
[I 2026-07-17 11:43:56,464] Trial 176 finished with value: -0.2438370720991474 and parameters: {'scalers': 'robust', 'ratios': 'log_ratio', 'imputers': 'mean', 'n_estimators': 100, 'learning_rate': 0.00020143067147740528, 'max_depth': 6, 'min_child_weight': 8, 'subsample': 0.5, 'colsample_bytree': 0.9, 'colsample_bylevel': 0.8, 'reg_alpha': 90.13691790333739, 'reg_lambda': 0.00019881215838214242, 'gamma': 29.514370958408023}. Best is trial 176 with value: -0.2438370720991474.
[I 2026-07-17 11:43:56,889] Trial 177 finished with value: -0.2438371410884055 and parameters: {'scalers': 'robust', 'ratios': 'log_ratio', 'imputers': 'mean', 'n_estimators': 100, 'learning_rate': 0.0001930574938202826, 'max_depth': 6, 'min_child_weight': 8, 'subsample': 0.5, 'colsample_bytree': 0.9, 'colsample_bylevel': 0.8, 'reg_alpha': 90.68323844122989, 'reg_lambda': 0.00019383487745229506, 'gamma': 31.353604888141007}. Best is trial 177 with value: -0.2438371410884055.
[I 2026-07-17 11:43:57,181] Trial 178 finished with value: -0.24383708306467727 and parameters: {'scalers': 'robust', 'ratios': 'log_ratio', 'imputers': 'mean', 'n_estimators': 100, 'learning_rate': 0.00020008089080029423, 'max_depth': 6, 'min_child_weight': 8, 'subsample': 0.5, 'colsample_bytree': 0.9, 'colsample_bylevel': 0.8, 'reg_alpha': 92.25746339434657, 'reg_lambda': 0.00017214804602717446, 'gamma': 30.550599330842253}. Best is trial 177 with value: -0.2438371410884055.
[I 2026-07-17 11:43:57,696] Trial 179 finished with value: -0.2438370308771813 and parameters: {'scalers': 'robust', 'ratios': 'log_ratio', 'imputers': 'mean', 'n_estimators': 100, 'learning_rate': 0.00020608612684581772, 'max_depth': 6, 'min_child_weight': 8, 'subsample': 0.5, 'colsample_bytree': 0.9, 'colsample_bylevel': 0.8, 'reg_alpha': 99.8136828375257, 'reg_lambda': 0.00019754491916812648, 'gamma': 28.26118113226266}. Best is trial 177 with value: -0.2438371410884055.
