[I 2026-07-17 11:45:35,868] Trial 90 finished with value: -0.13693872865301632 and parameters: {'scalers': 'robust', 'ratios': 'log_ratio', 'imputers': 'mean', 'n_estimators': 300, 'learning_rate': 0.00010840747244117399, 'max_depth': 4, 'min_child_weight': 5, 'subsample': 0.5, 'colsample_bytree': 0.7, 'colsample_bylevel': 0.5, 'reg_alpha': 3.133372645731456e-05, 'reg_lambda': 0.08521719496077376, 'gamma': 95.80179816602391}. Best is trial 68 with value: -0.13735675268839762.
[I 2026-07-17 11:45:38,681] Trial 91 finished with value: -0.13524521161032202 and parameters: {'scalers': 'robust', 'ratios': 'log_ratio', 'imputers': 'mean', 'n_estimators': 300, 'learning_rate': 0.00011825268863665756, 'max_depth': 8, 'min_child_weight': 5, 'subsample': 0.5, 'colsample_bytree': 0.7, 'colsample_bylevel': 0.8, 'reg_alpha': 4.0955559309917896e-05, 'reg_lambda': 0.08829330303184027, 'gamma': 4.57336978953935e-05}. Best is trial 68 with value: -0.13735675268839762.
[I 2026-07-17 11:45:39,191] Trial 92 finished with value: -0.1368707531700704 and parameters: {'scalers': 'robust', 'ratios': 'log_ratio', 'imputers': 'mean', 'n_estimators': 300, 'learning_rate': 0.00010045386319983383, 'max_depth': 8, 'min_child_weight': 5, 'subsample': 0.5, 'colsample_bytree': 0.7, 'colsample_bylevel': 0.5, 'reg_alpha': 3.167835193180824e-05, 'reg_lambda': 0.2934325711681427, 'gamma': 17.502356748384777}. Best is trial 68 with value: -0.13735675268839762.
[I 2026-07-17 11:45:39,675] Trial 93 finished with value: -0.13681135325116994 and parameters: {'scalers': 'robust', 'ratios': 'log_ratio', 'imputers': 'mean', 'n_estimators': 300, 'learning_rate': 0.00010152403868062436, 'max_depth': 8, 'min_child_weight': 5, 'subsample': 0.5, 'colsample_bytree': 0.7, 'colsample_bylevel': 0.5, 'reg_alpha': 3.2249059330428426e-06, 'reg_lambda': 0.06463213954181744, 'gamma': 13.881135125712927}. Best is trial 68 with value: -0.13735675268839762.
[I 2026-07-17 11:45:40,168] Trial 94 finished with value: -0.13264169127388334 and parameters: {'scalers': 'robust', 'ratios': 'log_ratio', 'imputers': 'mean', 'n_estimators': 300, 'learning_rate': 0.0005754072291682319, 'max_depth': 6, 'min_child_weight': 5, 'subsample': 0.5, 'colsample_bytree': 0.7, 'colsample_bylevel': 0.6, 'reg_alpha': 2.9389494330253793e-05, 'reg_lambda': 0.08895970233039019, 'gamma': 14.552369428218833}. Best is trial 68 with value: -0.13735675268839762.
[I 2026-07-17 11:45:40,715] Trial 95 finished with value: -0.13659634915523072 and parameters: {'scalers': 'robust', 'ratios': 'log_ratio', 'imputers': 'mean', 'n_estimators': 300, 'learning_rate': 0.00010393088589006874, 'max_depth': 8, 'min_child_weight': 5, 'subsample': 0.5, 'colsample_bytree': 0.7, 'colsample_bylevel': 0.6, 'reg_alpha': 2.7963851580571796e-05, 'reg_lambda': 0.09742069068736624, 'gamma': 13.102751062212112}. Best is trial 68 with value: -0.13735675268839762.
[I 2026-07-17 11:45:42,447] Trial 96 finished with value: -0.1354857610299717 and parameters: {'scalers': 'robust', 'ratios': 'log_ratio', 'imputers': 'mean', 'n_estimators': 300, 'learning_rate': 0.00010743848800230874, 'max_depth': 6, 'min_child_weight': 5, 'subsample': 0.5, 'colsample_bytree': 0.7, 'colsample_bylevel': 0.6, 'reg_alpha': 4.536472842382515e-05, 'reg_lambda': 0.09359141714517859, 'gamma': 6.262449089018416e-06}. Best is trial 68 with value: -0.13735675268839762.
[I 2026-07-17 11:45:42,989] Trial 97 finished with value: -0.13639277363366734 and parameters: {'scalers': 'robust', 'ratios': 'log_ratio', 'imputers': 'mean', 'n_estimators': 300, 'learning_rate': 0.00010041848321055275, 'max_depth': 8, 'min_child_weight': 5, 'subsample': 0.5, 'colsample_bytree': 0.8, 'colsample_bylevel': 0.6, 'reg_alpha': 2.2263933006370876e-06, 'reg_lambda': 0.0881505226700196, 'gamma': 11.594682838591032}. Best is trial 68 with value: -0.13735675268839762.
[I 2026-07-17 11:45:43,492] Trial 98 finished with value: -0.13659027313737454 and parameters: {'scalers': 'robust', 'ratios': 'log_ratio', 'imputers': 'mean', 'n_estimators': 300, 'learning_rate': 0.00010092412270368731, 'max_depth': 8, 'min_child_weight': 5, 'subsample': 0.5, 'colsample_bytree': 0.7, 'colsample_bylevel': 0.6, 'reg_alpha': 0.00011928586615636462, 'reg_lambda': 0.08664539767781787, 'gamma': 11.625726343317835}. Best is trial 68 with value: -0.13735675268839762.
[I 2026-07-17 11:45:43,852] Trial 99 finished with value: -0.13679011901777116 and parameters: {'scalers': 'robust', 'ratios': 'log_ratio', 'imputers': 'mean', 'n_estimators': 250, 'learning_rate': 0.00010039485630418269, 'max_depth': 3, 'min_child_weight': 5, 'subsample': 0.5, 'colsample_bytree': 0.7, 'colsample_bylevel': 0.6, 'reg_alpha': 3.765200845994035e-05, 'reg_lambda': 0.31166270387243183, 'gamma': 13.164440908976479}. Best is trial 68 with value: -0.13735675268839762.
[I 2026-07-17 11:45:44,550] Trial 100 finished with value: -0.13602895634824852 and parameters: {'scalers': 'robust', 'ratios': 'log_ratio', 'imputers': 'mean', 'n_estimators': 400, 'learning_rate': 0.00010026139520472846, 'max_depth': 8, 'min_child_weight': 10, 'subsample': 0.5, 'colsample_bytree': 0.8, 'colsample_bylevel': 0.6, 'reg_alpha': 2.690743289825456e-05, 'reg_lambda': 0.31692576668246997, 'gamma': 13.142202287621272}. Best is trial 68 with value: -0.13735675268839762.
[I 2026-07-17 11:45:45,269] Trial 101 finished with value: -0.13580234412382483 and parameters: {'scalers': 'robust', 'ratios': 'log_ratio', 'imputers': 'mean', 'n_estimators': 400, 'learning_rate': 0.00011459390807109382, 'max_depth': 8, 'min_child_weight': 6, 'subsample': 0.5, 'colsample_bytree': 0.8, 'colsample_bylevel': 0.6, 'reg_alpha': 2.2608269367568924e-06, 'reg_lambda': 0.32574974376807164, 'gamma': 12.754779769993215}. Best is trial 68 with value: -0.13735675268839762.
[I 2026-07-17 11:45:45,943] Trial 102 finished with value: -0.13601919560025144 and parameters: {'scalers': 'robust', 'ratios': 'log_ratio', 'imputers': 'mean', 'n_estimators': 400, 'learning_rate': 0.00010180660512340351, 'max_depth': 8, 'min_child_weight': 10, 'subsample': 0.5, 'colsample_bytree': 0.8, 'colsample_bylevel': 0.6, 'reg_alpha': 2.6317730619149065e-06, 'reg_lambda': 0.3698490359666616, 'gamma': 13.495415283927745}. Best is trial 68 with value: -0.13735675268839762.
[I 2026-07-17 11:45:50,539] Trial 103 finished with value: -0.12970620387889298 and parameters: {'scalers': 'robust', 'ratios': 'log_ratio', 'imputers': 'mean', 'n_estimators': 3000, 'learning_rate': 0.00010062780564854536, 'max_depth': 10, 'min_child_weight': 6, 'subsample': 0.5, 'colsample_bytree': 0.8, 'colsample_bylevel': 0.6, 'reg_alpha': 2.9582352234635704e-06, 'reg_lambda': 0.27773342473649965, 'gamma': 90.54595933729644}. Best is trial 68 with value: -0.13735675268839762.
[I 2026-07-17 11:45:51,262] Trial 104 finished with value: -0.13577643860520056 and parameters: {'scalers': 'robust', 'ratios': 'log_ratio', 'imputers': 'mean', 'n_estimators': 400, 'learning_rate': 0.00017941458626385815, 'max_depth': 10, 'min_child_weight': 6, 'subsample': 0.6, 'colsample_bytree': 0.8, 'colsample_bylevel': 0.5, 'reg_alpha': 1.8329951980326387e-06, 'reg_lambda': 0.2875561999702091, 'gamma': 91.74925317739492}. Best is trial 68 with value: -0.13735675268839762.
[I 2026-07-17 11:45:55,953] Trial 105 finished with value: -0.12983989121234266 and parameters: {'scalers': 'robust', 'ratios': 'log_ratio', 'imputers': 'mean', 'n_estimators': 3000, 'learning_rate': 0.00011977698144652172, 'max_depth': 3, 'min_child_weight': 10, 'subsample': 0.6, 'colsample_bytree': 0.8, 'colsample_bylevel': 0.5, 'reg_alpha': 1.0092696116409147e-06, 'reg_lambda': 0.018763101297968758, 'gamma': 95.3263293591585}. Best is trial 68 with value: -0.13735675268839762.
[I 2026-07-17 11:45:56,660] Trial 106 finished with value: -0.13584604409841508 and parameters: {'scalers': 'robust', 'ratios': 'log_ratio', 'imputers': 'mean', 'n_estimators': 400, 'learning_rate': 0.00017224109588960033, 'max_depth': 10, 'min_child_weight': 6, 'subsample': 0.6, 'colsample_bytree': 0.8, 'colsample_bylevel': 0.5, 'reg_alpha': 2.0766388748660945e-06, 'reg_lambda': 0.31063570635501053, 'gamma': 76.98303161958663}. Best is trial 68 with value: -0.13735675268839762.
[I 2026-07-17 11:45:57,357] Trial 107 finished with value: -0.1354666194154132 and parameters: {'scalers': 'robust', 'ratios': 'log_ratio', 'imputers': 'mean', 'n_estimators': 400, 'learning_rate': 0.00017266364532145007, 'max_depth': 3, 'min_child_weight': 6, 'subsample': 0.6, 'colsample_bytree': 0.8, 'colsample_bylevel': 0.6, 'reg_alpha': 1.065554059272678e-06, 'reg_lambda': 0.2972977832956411, 'gamma': 96.84954391299085}. Best is trial 68 with value: -0.13735675268839762.
[I 2026-07-17 11:45:58,043] Trial 108 finished with value: -0.13625804617500575 and parameters: {'scalers': 'robust', 'ratios': 'log_ratio', 'imputers': 'mean', 'n_estimators': 400, 'learning_rate': 0.00017193739959447328, 'max_depth': 3, 'min_child_weight': 6, 'subsample': 0.6, 'colsample_bytree': 0.7, 'colsample_bylevel': 0.5, 'reg_alpha': 1.6923143002102686e-06, 'reg_lambda': 0.016375401815893496, 'gamma': 92.79618585526585}. Best is trial 68 with value: -0.13735675268839762.
[I 2026-07-17 11:45:58,524] Trial 109 finished with value: -0.13593609611952856 and parameters: {'scalers': 'robust', 'ratios': 'log_ratio', 'imputers': 'mean', 'n_estimators': 250, 'learning_rate': 0.00016823221956709816, 'max_depth': 3, 'min_child_weight': 6, 'subsample': 0.6, 'colsample_bytree': 0.7, 'colsample_bylevel': 0.5, 'reg_alpha': 3.871284374559672e-06, 'reg_lambda': 0.5685609635322654, 'gamma': 3.6137647187106854}. Best is trial 68 with value: -0.13735675268839762.
[I 2026-07-17 11:45:58,925] Trial 110 finished with value: -0.13672088433874727 and parameters: {'scalers': 'robust', 'ratios': 'log_ratio', 'imputers': 'mean', 'n_estimators': 250, 'learning_rate': 0.0001769024520693932, 'max_depth': 3, 'min_child_weight': 6, 'subsample': 0.6, 'colsample_bytree': 0.7, 'colsample_bylevel': 0.5, 'reg_alpha': 3.1654354513775045e-06, 'reg_lambda': 0.018008876535535928, 'gamma': 96.87626507300493}. Best is trial 68 with value: -0.13735675268839762.
[I 2026-07-17 11:45:59,366] Trial 111 finished with value: -0.13610231578913481 and parameters: {'scalers': 'robust', 'ratios': 'log_ratio', 'imputers': 'mean', 'n_estimators': 250, 'learning_rate': 0.00017244763937535734, 'max_depth': 3, 'min_child_weight': 6, 'subsample': 0.6, 'colsample_bytree': 0.7, 'colsample_bylevel': 0.5, 'reg_alpha': 1.3458054422376763e-06, 'reg_lambda': 0.5637454051469906, 'gamma': 4.340696279249865}. Best is trial 68 with value: -0.13735675268839762.
[I 2026-07-17 11:45:59,803] Trial 112 finished with value: -0.13677455070736375 and parameters: {'scalers': 'robust', 'ratios': 'log_ratio', 'imputers': 'mean', 'n_estimators': 250, 'learning_rate': 0.00016544418692454444, 'max_depth': 3, 'min_child_weight': 9, 'subsample': 0.6, 'colsample_bytree': 0.7, 'colsample_bylevel': 0.5, 'reg_alpha': 0.012814911762645783, 'reg_lambda': 0.016002743798990044, 'gamma': 35.645707968275595}. Best is trial 68 with value: -0.13735675268839762.
[I 2026-07-17 11:46:00,227] Trial 113 finished with value: -0.13642424603439163 and parameters: {'scalers': 'robust', 'ratios': 'log_ratio', 'imputers': 'mean', 'n_estimators': 250, 'learning_rate': 0.00017182727653591246, 'max_depth': 3, 'min_child_weight': 9, 'subsample': 0.5, 'colsample_bytree': 0.9, 'colsample_bylevel': 0.5, 'reg_alpha': 0.7863706740024273, 'reg_lambda': 0.004866926575706009, 'gamma': 20.545361642907288}. Best is trial 68 with value: -0.13735675268839762.
[I 2026-07-17 11:46:00,617] Trial 114 finished with value: -0.1369711130019923 and parameters: {'scalers': 'robust', 'ratios': 'log_ratio', 'imputers': 'mean', 'n_estimators': 250, 'learning_rate': 0.0001288156395439491, 'max_depth': 3, 'min_child_weight': 5, 'subsample': 0.5, 'colsample_bytree': 0.6, 'colsample_bylevel': 0.5, 'reg_alpha': 0.7309743336120618, 'reg_lambda': 0.01649182378447606, 'gamma': 34.11242752685978}. Best is trial 68 with value: -0.13735675268839762.
[I 2026-07-17 11:46:00,963] Trial 115 finished with value: -0.13682986782772416 and parameters: {'scalers': 'robust', 'ratios': 'log_ratio', 'imputers': 'mean', 'n_estimators': 200, 'learning_rate': 0.0001248766007103627, 'max_depth': 3, 'min_child_weight': 9, 'subsample': 0.5, 'colsample_bytree': 0.6, 'colsample_bylevel': 0.5, 'reg_alpha': 0.7224639995654616, 'reg_lambda': 0.016088477514991907, 'gamma': 3.6273333553646774}. Best is trial 68 with value: -0.13735675268839762.
[I 2026-07-17 11:46:01,373] Trial 116 finished with value: -0.1365351644512184 and parameters: {'scalers': 'robust', 'ratios': 'log_ratio', 'imputers': 'mean', 'n_estimators': 250, 'learning_rate': 0.00022577261340421328, 'max_depth': 9, 'min_child_weight': 5, 'subsample': 0.5, 'colsample_bytree': 0.6, 'colsample_bylevel': 0.5, 'reg_alpha': 6.813246467595464, 'reg_lambda': 0.004851368694848174, 'gamma': 20.59346511027162}. Best is trial 68 with value: -0.13735675268839762.
[I 2026-07-17 11:46:04,202] Trial 117 finished with value: -0.125911869852664 and parameters: {'scalers': 'robust', 'ratios': 'log_ratio', 'imputers': 'mean', 'n_estimators': 2050, 'learning_rate': 0.00039449704764138395, 'max_depth': 9, 'min_child_weight': 5, 'subsample': 0.5, 'colsample_bytree': 0.6, 'colsample_bylevel': 0.5, 'reg_alpha': 0.010536903209697045, 'reg_lambda': 0.034832934173320146, 'gamma': 37.77613033424151}. Best is trial 68 with value: -0.13735675268839762.
[I 2026-07-17 11:46:04,593] Trial 118 finished with value: -0.13696192722335385 and parameters: {'scalers': 'robust', 'ratios': 'log_ratio', 'imputers': 'mean', 'n_estimators': 250, 'learning_rate': 0.0001219390695857563, 'max_depth': 3, 'min_child_weight': 5, 'subsample': 0.5, 'colsample_bytree': 0.7, 'colsample_bylevel': 0.5, 'reg_alpha': 5.164024856439024, 'reg_lambda': 0.12548571872474648, 'gamma': 19.42651704126842}. Best is trial 68 with value: -0.13735675268839762.
[I 2026-07-17 11:46:04,770] Trial 119 finished with value: -0.13727928637486927 and parameters: {'scalers': 'robust', 'ratios': 'log_ratio', 'imputers': 'mean', 'n_estimators': 150, 'learning_rate': 0.00012501878803408107, 'max_depth': 9, 'min_child_weight': 9, 'subsample': 0.5, 'colsample_bytree': 0.6, 'colsample_bylevel': 0.5, 'reg_alpha': 0.00809403900915378, 'reg_lambda': 0.031614865592971976, 'gamma': 32.81504537575127}. Best is trial 68 with value: -0.13735675268839762.
[I 2026-07-17 11:46:05,067] Trial 120 finished with value: -0.13728276181608162 and parameters: {'scalers': 'robust', 'ratios': 'log_ratio', 'imputers': 'mean', 'n_estimators': 150, 'learning_rate': 0.00012345602985151254, 'max_depth': 9, 'min_child_weight': 5, 'subsample': 0.5, 'colsample_bytree': 0.6, 'colsample_bylevel': 0.5, 'reg_alpha': 0.7988836042653173, 'reg_lambda': 0.004948237409601136, 'gamma': 32.26386564871363}. Best is trial 68 with value: -0.13735675268839762.
[I 2026-07-17 11:46:05,280] Trial 121 finished with value: -0.13727504513552083 and parameters: {'scalers': 'robust', 'ratios': 'log_ratio', 'imputers': 'mean', 'n_estimators': 150, 'learning_rate': 0.0001269230278968639, 'max_depth': 9, 'min_child_weight': 9, 'subsample': 0.5, 'colsample_bytree': 0.6, 'colsample_bylevel': 0.5, 'reg_alpha': 6.3761544059147655, 'reg_lambda': 0.028279888264692948, 'gamma': 35.0293007671042}. Best is trial 68 with value: -0.13735675268839762.
[I 2026-07-17 11:46:05,542] Trial 122 finished with value: -0.13727692833242736 and parameters: {'scalers': 'robust', 'ratios': 'log_ratio', 'imputers': 'mean', 'n_estimators': 150, 'learning_rate': 0.0001260785205938067, 'max_depth': 9, 'min_child_weight': 5, 'subsample': 0.5, 'colsample_bytree': 0.6, 'colsample_bylevel': 0.5, 'reg_alpha': 2.036728178791378, 'reg_lambda': 0.13111810009297659, 'gamma': 36.112950987825926}. Best is trial 68 with value: -0.13735675268839762.
[I 2026-07-17 11:46:09,043] Trial 123 finished with value: -0.13239546172188485 and parameters: {'scalers': 'robust', 'ratios': 'norm_ratio', 'imputers': 'mean', 'n_estimators': 2550, 'learning_rate': 0.00012665961586490947, 'max_depth': 9, 'min_child_weight': 1, 'subsample': 0.5, 'colsample_bytree': 0.6, 'colsample_bylevel': 0.5, 'reg_alpha': 5.436086896928852, 'reg_lambda': 0.027468444865347927, 'gamma': 33.94596406618438}. Best is trial 68 with value: -0.13735675268839762.
[I 2026-07-17 11:46:12,917] Trial 124 finished with value: -0.13120915633774766 and parameters: {'scalers': 'robust', 'ratios': 'norm_ratio', 'imputers': 'none', 'n_estimators': 2650, 'learning_rate': 0.00012127996714537828, 'max_depth': 4, 'min_child_weight': 8, 'subsample': 0.5, 'colsample_bytree': 0.6, 'colsample_bylevel': 0.6, 'reg_alpha': 1.7169784122019922, 'reg_lambda': 0.06298422446261176, 'gamma': 35.49989068341093}. Best is trial 68 with value: -0.13735675268839762.
[I 2026-07-17 11:46:13,249] Trial 125 finished with value: -0.1371107988861555 and parameters: {'scalers': 'robust', 'ratios': 'norm_ratio', 'imputers': 'none', 'n_estimators': 150, 'learning_rate': 0.0001298435812720965, 'max_depth': 4, 'min_child_weight': 1, 'subsample': 0.5, 'colsample_bytree': 0.6, 'colsample_bylevel': 0.6, 'reg_alpha': 1.8831201532416257, 'reg_lambda': 0.06201725320666485, 'gamma': 57.75261266888177}. Best is trial 68 with value: -0.13735675268839762.
[I 2026-07-17 11:46:13,595] Trial 126 finished with value: -0.13727863644809632 and parameters: {'scalers': 'robust', 'ratios': 'norm_ratio', 'imputers': 'none', 'n_estimators': 150, 'learning_rate': 0.0001254965323549907, 'max_depth': 7, 'min_child_weight': 4, 'subsample': 0.8, 'colsample_bytree': 0.6, 'colsample_bylevel': 0.5, 'reg_alpha': 5.103398148741851, 'reg_lambda': 0.1321905581428732, 'gamma': 60.27080989870755}. Best is trial 68 with value: -0.13735675268839762.
[I 2026-07-17 11:46:13,819] Trial 127 finished with value: -0.13727229335319088 and parameters: {'scalers': 'robust', 'ratios': 'norm_ratio', 'imputers': 'none', 'n_estimators': 150, 'learning_rate': 0.00012835389323275593, 'max_depth': 9, 'min_child_weight': 8, 'subsample': 0.8, 'colsample_bytree': 0.6, 'colsample_bylevel': 0.5, 'reg_alpha': 1.7230700020462069, 'reg_lambda': 0.11493206783192828, 'gamma': 64.48567662817716}. Best is trial 68 with value: -0.13735675268839762.
[I 2026-07-17 11:46:14,057] Trial 128 finished with value: -0.13727343731872718 and parameters: {'scalers': 'robust', 'ratios': 'norm_ratio', 'imputers': 'mean', 'n_estimators': 150, 'learning_rate': 0.00012765026135156491, 'max_depth': 9, 'min_child_weight': 1, 'subsample': 0.5, 'colsample_bytree': 0.6, 'colsample_bylevel': 0.5, 'reg_alpha': 1.8165765643781449, 'reg_lambda': 0.13059890289199194, 'gamma': 60.31557856373596}. Best is trial 68 with value: -0.13735675268839762.
[I 2026-07-17 11:46:14,415] Trial 129 finished with value: -0.13727639988719628 and parameters: {'scalers': 'robust', 'ratios': 'norm_ratio', 'imputers': 'none', 'n_estimators': 150, 'learning_rate': 0.00012650450435776494, 'max_depth': 9, 'min_child_weight': 8, 'subsample': 0.8, 'colsample_bytree': 0.6, 'colsample_bylevel': 0.5, 'reg_alpha': 1.9409701134335646, 'reg_lambda': 0.12742992385490617, 'gamma': 60.18299968528841}. Best is trial 68 with value: -0.13735675268839762.
[I 2026-07-17 11:46:14,683] Trial 130 finished with value: -0.13727428319985704 and parameters: {'scalers': 'robust', 'ratios': 'log_ratio', 'imputers': 'none', 'n_estimators': 150, 'learning_rate': 0.00012745703961782238, 'max_depth': 9, 'min_child_weight': 8, 'subsample': 0.8, 'colsample_bytree': 0.6, 'colsample_bylevel': 0.5, 'reg_alpha': 1.7135932272050305, 'reg_lambda': 0.02917941068895406, 'gamma': 60.45388650235061}. Best is trial 68 with value: -0.13735675268839762.
[I 2026-07-17 11:46:15,039] Trial 131 finished with value: -0.13706091500231768 and parameters: {'scalers': 'robust', 'ratios': 'log_ratio', 'imputers': 'none', 'n_estimators': 150, 'learning_rate': 0.00022382468580736613, 'max_depth': 9, 'min_child_weight': 8, 'subsample': 0.8, 'colsample_bytree': 0.6, 'colsample_bylevel': 0.5, 'reg_alpha': 1.9245145828675216, 'reg_lambda': 0.12352149729243772, 'gamma': 54.22553505083738}. Best is trial 68 with value: -0.13735675268839762.
[I 2026-07-17 11:46:15,287] Trial 132 finished with value: -0.1370812006039631 and parameters: {'scalers': 'robust', 'ratios': 'log_ratio', 'imputers': 'mean', 'n_estimators': 150, 'learning_rate': 0.00021462832766185128, 'max_depth': 9, 'min_child_weight': 4, 'subsample': 0.8, 'colsample_bytree': 0.6, 'colsample_bylevel': 0.5, 'reg_alpha': 3.577401908845892, 'reg_lambda': 0.1385543980145685, 'gamma': 64.42653580390194}. Best is trial 68 with value: -0.13735675268839762.
[I 2026-07-17 11:46:15,620] Trial 133 finished with value: -0.13708742198716595 and parameters: {'scalers': 'robust', 'ratios': 'norm_ratio', 'imputers': 'none', 'n_estimators': 150, 'learning_rate': 0.0002118113062960761, 'max_depth': 9, 'min_child_weight': 1, 'subsample': 0.8, 'colsample_bytree': 0.6, 'colsample_bylevel': 0.5, 'reg_alpha': 4.055705487939242, 'reg_lambda': 0.11512480973040541, 'gamma': 59.78499511130074}. Best is trial 68 with value: -0.13735675268839762.
[I 2026-07-17 11:46:15,947] Trial 134 finished with value: -0.1370459420343122 and parameters: {'scalers': 'robust', 'ratios': 'norm_ratio', 'imputers': 'none', 'n_estimators': 150, 'learning_rate': 0.00023062105610009476, 'max_depth': 9, 'min_child_weight': 1, 'subsample': 0.8, 'colsample_bytree': 0.6, 'colsample_bylevel': 0.5, 'reg_alpha': 2.1637349488161086, 'reg_lambda': 0.13536005360982245, 'gamma': 56.05520589254878}. Best is trial 68 with value: -0.13735675268839762.
