[I 2026-07-17 15:54:08,355] Trial 315 finished with value: -0.13482632146353074 and parameters: {'scalers': 'robust', 'ratios': 'log_ratio', 'imputers': 'median', 'n_estimators': 2800, 'learning_rate': 0.4981573862313747, 'max_depth': 10, 'min_child_weight': 1, 'subsample': 1.0, 'colsample_bytree': 0.9, 'colsample_bylevel': 0.9, 'reg_alpha': 1.7478948280562288, 'reg_lambda': 0.008978461042382755, 'gamma': 0.000551349088215675}. Best is trial 290 with value: -0.27178794923865723.
[I 2026-07-17 15:54:41,875] Trial 316 finished with value: -0.22083603800390503 and parameters: {'scalers': 'robust', 'ratios': 'log_ratio', 'imputers': 'median', 'n_estimators': 2800, 'learning_rate': 0.4284180130607702, 'max_depth': 10, 'min_child_weight': 1, 'subsample': 0.6, 'colsample_bytree': 0.9, 'colsample_bylevel': 0.9, 'reg_alpha': 1.7556607634567951, 'reg_lambda': 0.008963474454874856, 'gamma': 0.0005080103807518257}. Best is trial 290 with value: -0.27178794923865723.
[I 2026-07-17 15:55:16,464] Trial 317 finished with value: -0.2682787833086211 and parameters: {'scalers': 'robust', 'ratios': 'log_ratio', 'imputers': 'median', 'n_estimators': 2800, 'learning_rate': 0.49904063943775423, 'max_depth': 10, 'min_child_weight': 1, 'subsample': 0.6, 'colsample_bytree': 0.9, 'colsample_bylevel': 0.9, 'reg_alpha': 1.7645076243749076, 'reg_lambda': 0.009406624995250969, 'gamma': 0.0005565324477321601}. Best is trial 290 with value: -0.27178794923865723.
[I 2026-07-17 15:55:55,982] Trial 318 finished with value: -0.20798513038518202 and parameters: {'scalers': 'standard', 'ratios': 'log_ratio', 'imputers': 'median', 'n_estimators': 2800, 'learning_rate': 0.4353477521257548, 'max_depth': 10, 'min_child_weight': 1, 'subsample': 0.6, 'colsample_bytree': 0.9, 'colsample_bylevel': 0.9, 'reg_alpha': 1.05881850665515, 'reg_lambda': 0.009447926051657372, 'gamma': 0.000789807849167885}. Best is trial 290 with value: -0.27178794923865723.
[I 2026-07-17 15:56:20,386] Trial 319 finished with value: -0.20234710378262744 and parameters: {'scalers': 'robust', 'ratios': 'log_ratio', 'imputers': 'median', 'n_estimators': 2800, 'learning_rate': 0.4319460724649414, 'max_depth': 10, 'min_child_weight': 1, 'subsample': 0.6, 'colsample_bytree': 0.9, 'colsample_bylevel': 0.9, 'reg_alpha': 2.7080526698708023, 'reg_lambda': 0.010349051118779082, 'gamma': 0.0007361319001952851}. Best is trial 290 with value: -0.27178794923865723.
