[I 2026-07-17 14:16:10,780] Trial 90 finished with value: -0.02474870210246169 and parameters: {'scalers': 'none', 'ratios': 'log_ratio', 'imputers': 'median', 'n_estimators': 1500, 'learning_rate': 0.3843465462401137, 'max_depth': 11, 'min_child_weight': 1, 'subsample': 0.7, 'colsample_bytree': 1.0, 'colsample_bylevel': 0.9, 'reg_alpha': 14.416436471451046, 'reg_lambda': 3.6277845609513274e-06, 'gamma': 0.12897582413477934}. Best is trial 71 with value: -0.1578703628875863.
[I 2026-07-17 14:16:12,624] Trial 91 finished with value: -0.025698798907565115 and parameters: {'scalers': 'none', 'ratios': 'log_ratio', 'imputers': 'median', 'n_estimators': 1500, 'learning_rate': 0.15480428621036924, 'max_depth': 11, 'min_child_weight': 1, 'subsample': 0.7, 'colsample_bytree': 1.0, 'colsample_bylevel': 0.9, 'reg_alpha': 21.112950739195686, 'reg_lambda': 7.136325557799217e-05, 'gamma': 0.14322850401393197}. Best is trial 71 with value: -0.1578703628875863.
[I 2026-07-17 14:16:14,484] Trial 92 finished with value: -0.02577295200281373 and parameters: {'scalers': 'none', 'ratios': 'log_ratio', 'imputers': 'median', 'n_estimators': 1500, 'learning_rate': 0.15373178465165105, 'max_depth': 4, 'min_child_weight': 1, 'subsample': 0.7, 'colsample_bytree': 1.0, 'colsample_bylevel': 0.9, 'reg_alpha': 18.94576302815189, 'reg_lambda': 7.244965442315393e-05, 'gamma': 0.3263333974566603}. Best is trial 71 with value: -0.1578703628875863.
[I 2026-07-17 14:16:16,389] Trial 93 finished with value: -0.02632409718012904 and parameters: {'scalers': 'none', 'ratios': 'log_ratio', 'imputers': 'median', 'n_estimators': 1550, 'learning_rate': 0.14785004928839146, 'max_depth': 11, 'min_child_weight': 1, 'subsample': 0.7, 'colsample_bytree': 1.0, 'colsample_bylevel': 0.9, 'reg_alpha': 50.14601190868173, 'reg_lambda': 2.616971752449768e-06, 'gamma': 0.14558997943676785}. Best is trial 71 with value: -0.1578703628875863.
[I 2026-07-17 14:16:18,932] Trial 94 finished with value: -0.02512836036363192 and parameters: {'scalers': 'none', 'ratios': 'log_ratio', 'imputers': 'median', 'n_estimators': 1900, 'learning_rate': 0.15187854493365474, 'max_depth': 11, 'min_child_weight': 1, 'subsample': 0.7, 'colsample_bytree': 1.0, 'colsample_bylevel': 0.9, 'reg_alpha': 0.4946696364592054, 'reg_lambda': 7.38928344490791e-05, 'gamma': 0.22478028203655534}. Best is trial 71 with value: -0.1578703628875863.
[I 2026-07-17 14:16:37,853] Trial 95 finished with value: -0.02610190986708042 and parameters: {'scalers': 'none', 'ratios': 'log_ratio', 'imputers': 'median', 'n_estimators': 1100, 'learning_rate': 0.00010015789306683013, 'max_depth': 11, 'min_child_weight': 1, 'subsample': 0.7, 'colsample_bytree': 1.0, 'colsample_bylevel': 1.0, 'reg_alpha': 0.5270292367650328, 'reg_lambda': 3.3836636624518163e-06, 'gamma': 0.009045717933053992}. Best is trial 71 with value: -0.1578703628875863.
[I 2026-07-17 14:16:59,585] Trial 96 finished with value: -0.025621748032603357 and parameters: {'scalers': 'none', 'ratios': 'log_ratio', 'imputers': 'median', 'n_estimators': 1900, 'learning_rate': 0.00011524133352350362, 'max_depth': 11, 'min_child_weight': 1, 'subsample': 0.7, 'colsample_bytree': 1.0, 'colsample_bylevel': 1.0, 'reg_alpha': 1.6865575964020143, 'reg_lambda': 1.9376028342184328e-05, 'gamma': 0.009456513005136044}. Best is trial 71 with value: -0.1578703628875863.
[I 2026-07-17 14:17:12,824] Trial 97 finished with value: -0.025846158954173 and parameters: {'scalers': 'none', 'ratios': 'log_ratio', 'imputers': 'median', 'n_estimators': 1150, 'learning_rate': 0.00011467734019260895, 'max_depth': 11, 'min_child_weight': 1, 'subsample': 0.7, 'colsample_bytree': 1.0, 'colsample_bylevel': 1.0, 'reg_alpha': 1.781951378363298, 'reg_lambda': 0.0003447336417710375, 'gamma': 0.009749051502228044}. Best is trial 71 with value: -0.1578703628875863.
[I 2026-07-17 14:17:35,095] Trial 98 finished with value: -0.10080738525556665 and parameters: {'scalers': 'none', 'ratios': 'log_ratio', 'imputers': 'median', 'n_estimators': 1900, 'learning_rate': 0.14784712075634043, 'max_depth': 11, 'min_child_weight': 1, 'subsample': 0.6, 'colsample_bytree': 0.8, 'colsample_bylevel': 0.9, 'reg_alpha': 0.46109708187496706, 'reg_lambda': 0.00029106777545310147, 'gamma': 0.009739704419443492}. Best is trial 71 with value: -0.1578703628875863.
[I 2026-07-17 14:18:00,888] Trial 99 finished with value: -0.14153862135097695 and parameters: {'scalers': 'none', 'ratios': 'log_ratio', 'imputers': 'median', 'n_estimators': 1900, 'learning_rate': 0.2824993681234028, 'max_depth': 11, 'min_child_weight': 1, 'subsample': 0.6, 'colsample_bytree': 0.8, 'colsample_bylevel': 0.9, 'reg_alpha': 0.543983850073153, 'reg_lambda': 0.0002965131310443454, 'gamma': 0.008388098883478396}. Best is trial 71 with value: -0.1578703628875863.
[I 2026-07-17 14:18:01,326] Trial 100 finished with value: -0.02573721666930049 and parameters: {'scalers': 'none', 'ratios': 'log_ratio', 'imputers': 'median', 'n_estimators': 1900, 'learning_rate': 0.28617186857627364, 'max_depth': 11, 'min_child_weight': 1, 'subsample': 0.6, 'colsample_bytree': 0.8, 'colsample_bylevel': 0.9, 'reg_alpha': 2.2066500649323193, 'reg_lambda': 0.000255988237917882, 'gamma': 2.6010590801751814}. Best is trial 71 with value: -0.1578703628875863.
[I 2026-07-17 14:18:29,125] Trial 101 finished with value: -0.18742442824914762 and parameters: {'scalers': 'none', 'ratios': 'log_ratio', 'imputers': 'median', 'n_estimators': 1900, 'learning_rate': 0.4822536983329655, 'max_depth': 11, 'min_child_weight': 1, 'subsample': 0.6, 'colsample_bytree': 0.8, 'colsample_bylevel': 1.0, 'reg_alpha': 0.4784097639370367, 'reg_lambda': 0.00030321847249787666, 'gamma': 0.010393737881853}. Best is trial 101 with value: -0.18742442824914762.
[I 2026-07-17 14:18:39,746] Trial 102 finished with value: -0.11537057773558851 and parameters: {'scalers': 'none', 'ratios': 'log_ratio', 'imputers': 'median', 'n_estimators': 1150, 'learning_rate': 0.28093561208463097, 'max_depth': 11, 'min_child_weight': 1, 'subsample': 0.6, 'colsample_bytree': 0.8, 'colsample_bylevel': 1.0, 'reg_alpha': 2.3751090008293874, 'reg_lambda': 0.0003667426371941532, 'gamma': 0.0009431882664521245}. Best is trial 101 with value: -0.18742442824914762.
[I 2026-07-17 14:18:53,434] Trial 103 finished with value: -0.11744457374787216 and parameters: {'scalers': 'none', 'ratios': 'log_ratio', 'imputers': 'median', 'n_estimators': 1700, 'learning_rate': 0.25263910342969687, 'max_depth': 10, 'min_child_weight': 1, 'subsample': 0.6, 'colsample_bytree': 0.8, 'colsample_bylevel': 0.9, 'reg_alpha': 2.349709985961466, 'reg_lambda': 0.00024258722298586914, 'gamma': 0.0008827051984452709}. Best is trial 101 with value: -0.18742442824914762.
[I 2026-07-17 14:19:05,506] Trial 104 finished with value: -0.10416004796277831 and parameters: {'scalers': 'none', 'ratios': 'log_ratio', 'imputers': 'none', 'n_estimators': 1700, 'learning_rate': 0.4927188617488019, 'max_depth': 10, 'min_child_weight': 1, 'subsample': 0.6, 'colsample_bytree': 0.8, 'colsample_bylevel': 0.9, 'reg_alpha': 0.035216467791879286, 'reg_lambda': 0.0003423275775759274, 'gamma': 0.0010117353094571146}. Best is trial 101 with value: -0.18742442824914762.
[I 2026-07-17 14:19:10,370] Trial 105 finished with value: -0.060009806406479925 and parameters: {'scalers': 'none', 'ratios': 'log_ratio', 'imputers': 'none', 'n_estimators': 650, 'learning_rate': 0.2682400056707677, 'max_depth': 10, 'min_child_weight': 1, 'subsample': 0.6, 'colsample_bytree': 0.8, 'colsample_bylevel': 0.9, 'reg_alpha': 0.037132989585216776, 'reg_lambda': 0.00015376216521110703, 'gamma': 0.028144787295075448}. Best is trial 101 with value: -0.18742442824914762.
[I 2026-07-17 14:19:22,326] Trial 106 finished with value: -0.077325376318393 and parameters: {'scalers': 'none', 'ratios': 'log_ratio', 'imputers': 'median', 'n_estimators': 1700, 'learning_rate': 0.28275052691177366, 'max_depth': 10, 'min_child_weight': 1, 'subsample': 0.6, 'colsample_bytree': 0.8, 'colsample_bylevel': 0.9, 'reg_alpha': 0.03536518764860193, 'reg_lambda': 4.094559485566339e-05, 'gamma': 0.0009956187254612017}. Best is trial 101 with value: -0.18742442824914762.
[I 2026-07-17 14:19:30,035] Trial 107 finished with value: -0.07485127724172434 and parameters: {'scalers': 'none', 'ratios': 'log_ratio', 'imputers': 'none', 'n_estimators': 950, 'learning_rate': 0.26466006040615814, 'max_depth': 10, 'min_child_weight': 1, 'subsample': 0.6, 'colsample_bytree': 0.9, 'colsample_bylevel': 0.8, 'reg_alpha': 0.1733803288091094, 'reg_lambda': 4.1070169810386365e-05, 'gamma': 0.0007999521191689745}. Best is trial 101 with value: -0.18742442824914762.
[I 2026-07-17 14:19:43,596] Trial 108 finished with value: -0.12781875895361589 and parameters: {'scalers': 'none', 'ratios': 'log_ratio', 'imputers': 'none', 'n_estimators': 1700, 'learning_rate': 0.49610768806605254, 'max_depth': 10, 'min_child_weight': 1, 'subsample': 0.6, 'colsample_bytree': 0.9, 'colsample_bylevel': 0.9, 'reg_alpha': 0.15214857905393725, 'reg_lambda': 0.00013220599339255367, 'gamma': 0.000847924397085845}. Best is trial 101 with value: -0.18742442824914762.
[I 2026-07-17 14:19:56,568] Trial 109 finished with value: -0.12114376202969253 and parameters: {'scalers': 'none', 'ratios': 'log_ratio', 'imputers': 'none', 'n_estimators': 1750, 'learning_rate': 0.4763888712793577, 'max_depth': 10, 'min_child_weight': 1, 'subsample': 0.6, 'colsample_bytree': 0.9, 'colsample_bylevel': 0.8, 'reg_alpha': 0.13952677648173736, 'reg_lambda': 0.00011502460106608177, 'gamma': 0.001519552243519626}. Best is trial 101 with value: -0.18742442824914762.
[I 2026-07-17 14:20:08,171] Trial 110 finished with value: -0.06724766067618705 and parameters: {'scalers': 'none', 'ratios': 'log_ratio', 'imputers': 'none', 'n_estimators': 1650, 'learning_rate': 0.48684914703498994, 'max_depth': 10, 'min_child_weight': 10, 'subsample': 0.5, 'colsample_bytree': 0.9, 'colsample_bylevel': 0.8, 'reg_alpha': 0.0365468611375766, 'reg_lambda': 0.00012782117044939152, 'gamma': 0.02235430812014633}. Best is trial 101 with value: -0.18742442824914762.
[I 2026-07-17 14:20:20,673] Trial 111 finished with value: -0.11314627727348792 and parameters: {'scalers': 'none', 'ratios': 'log_ratio', 'imputers': 'none', 'n_estimators': 1750, 'learning_rate': 0.49011617232457144, 'max_depth': 10, 'min_child_weight': 1, 'subsample': 0.6, 'colsample_bytree': 0.9, 'colsample_bylevel': 0.8, 'reg_alpha': 0.12452540001959488, 'reg_lambda': 4.625725810234042e-05, 'gamma': 0.029599047010885386}. Best is trial 101 with value: -0.18742442824914762.
[I 2026-07-17 14:20:31,952] Trial 112 finished with value: -0.025096669536986516 and parameters: {'scalers': 'none', 'ratios': 'log_ratio', 'imputers': 'median', 'n_estimators': 1800, 'learning_rate': 0.0002407159507560476, 'max_depth': 12, 'min_child_weight': 7, 'subsample': 0.8, 'colsample_bytree': 0.9, 'colsample_bylevel': 0.8, 'reg_alpha': 0.7755232846744925, 'reg_lambda': 0.00014745801678779516, 'gamma': 0.02734321635985937}. Best is trial 101 with value: -0.18742442824914762.
[I 2026-07-17 14:20:48,245] Trial 113 finished with value: -0.025523876852959794 and parameters: {'scalers': 'robust', 'ratios': 'log_ratio', 'imputers': 'median', 'n_estimators': 1800, 'learning_rate': 0.00020362406006745997, 'max_depth': 12, 'min_child_weight': 1, 'subsample': 0.5, 'colsample_bytree': 0.9, 'colsample_bylevel': 0.8, 'reg_alpha': 1.1840478611441907, 'reg_lambda': 3.169654843853423e-05, 'gamma': 0.00016088789424783536}. Best is trial 101 with value: -0.18742442824914762.
[I 2026-07-17 14:21:09,333] Trial 114 finished with value: -0.10618738188891465 and parameters: {'scalers': 'robust', 'ratios': 'log_ratio', 'imputers': 'median', 'n_estimators': 2200, 'learning_rate': 0.20184412257461828, 'max_depth': 12, 'min_child_weight': 1, 'subsample': 0.5, 'colsample_bytree': 0.9, 'colsample_bylevel': 0.8, 'reg_alpha': 0.17268134089001405, 'reg_lambda': 3.568941836561162e-05, 'gamma': 0.0022345944402214772}. Best is trial 101 with value: -0.18742442824914762.
[I 2026-07-17 14:21:25,167] Trial 115 finished with value: -0.07442337238852906 and parameters: {'scalers': 'robust', 'ratios': 'log_ratio', 'imputers': 'median', 'n_estimators': 1600, 'learning_rate': 0.1975342358245248, 'max_depth': 12, 'min_child_weight': 2, 'subsample': 0.5, 'colsample_bytree': 0.9, 'colsample_bylevel': 0.8, 'reg_alpha': 0.13670261336919964, 'reg_lambda': 0.00013405037489395836, 'gamma': 0.02537480354546323}. Best is trial 101 with value: -0.18742442824914762.
[I 2026-07-17 14:21:40,490] Trial 116 finished with value: -0.05110148086464258 and parameters: {'scalers': 'robust', 'ratios': 'log_ratio', 'imputers': 'none', 'n_estimators': 1800, 'learning_rate': 0.2032316407776366, 'max_depth': 12, 'min_child_weight': 7, 'subsample': 0.8, 'colsample_bytree': 0.9, 'colsample_bylevel': 0.8, 'reg_alpha': 1.200279084854302, 'reg_lambda': 0.00010945671123723547, 'gamma': 0.00018620276805434666}. Best is trial 101 with value: -0.18742442824914762.
[I 2026-07-17 14:21:53,015] Trial 117 finished with value: -0.07979365105996027 and parameters: {'scalers': 'robust', 'ratios': 'log_ratio', 'imputers': 'none', 'n_estimators': 1650, 'learning_rate': 0.20487159329450752, 'max_depth': 12, 'min_child_weight': 2, 'subsample': 0.5, 'colsample_bytree': 0.9, 'colsample_bylevel': 1.0, 'reg_alpha': 1.0762376371440152, 'reg_lambda': 0.00012161598195274689, 'gamma': 0.04139689273170589}. Best is trial 101 with value: -0.18742442824914762.
[I 2026-07-17 14:22:06,618] Trial 118 finished with value: -0.052860096299302675 and parameters: {'scalers': 'robust', 'ratios': 'log_ratio', 'imputers': 'none', 'n_estimators': 1800, 'learning_rate': 0.2019414558930827, 'max_depth': 12, 'min_child_weight': 7, 'subsample': 0.6, 'colsample_bytree': 0.9, 'colsample_bylevel': 0.8, 'reg_alpha': 0.12170505428924766, 'reg_lambda': 0.0005239055225568578, 'gamma': 0.04318011030693781}. Best is trial 101 with value: -0.18742442824914762.
[I 2026-07-17 14:22:25,995] Trial 119 finished with value: -0.09279672915907332 and parameters: {'scalers': 'robust', 'ratios': 'log_ratio', 'imputers': 'none', 'n_estimators': 1800, 'learning_rate': 0.203135742659184, 'max_depth': 12, 'min_child_weight': 2, 'subsample': 0.5, 'colsample_bytree': 0.9, 'colsample_bylevel': 1.0, 'reg_alpha': 1.1903519055137632, 'reg_lambda': 0.00011016091172686175, 'gamma': 0.0019057833932077588}. Best is trial 101 with value: -0.18742442824914762.
[I 2026-07-17 14:22:43,120] Trial 120 finished with value: -0.09370409194236776 and parameters: {'scalers': 'robust', 'ratios': 'log_ratio', 'imputers': 'none', 'n_estimators': 1600, 'learning_rate': 0.22033787795337795, 'max_depth': 12, 'min_child_weight': 2, 'subsample': 0.5, 'colsample_bytree': 0.9, 'colsample_bylevel': 1.0, 'reg_alpha': 1.2597126363068638, 'reg_lambda': 0.0005358487460270505, 'gamma': 0.0020599959521809263}. Best is trial 101 with value: -0.18742442824914762.
[I 2026-07-17 14:23:02,252] Trial 121 finished with value: -0.07407109443062523 and parameters: {'scalers': 'none', 'ratios': 'log_ratio', 'imputers': 'none', 'n_estimators': 1600, 'learning_rate': 0.20497817110777852, 'max_depth': 12, 'min_child_weight': 2, 'subsample': 0.6, 'colsample_bytree': 0.9, 'colsample_bylevel': 1.0, 'reg_alpha': 0.1396324496262324, 'reg_lambda': 0.000567687469631857, 'gamma': 0.0021756573570737418}. Best is trial 101 with value: -0.18742442824914762.
[I 2026-07-17 14:23:20,601] Trial 122 finished with value: -0.08891336420047535 and parameters: {'scalers': 'none', 'ratios': 'log_ratio', 'imputers': 'none', 'n_estimators': 1600, 'learning_rate': 0.4110414585117862, 'max_depth': 12, 'min_child_weight': 2, 'subsample': 0.6, 'colsample_bytree': 0.9, 'colsample_bylevel': 1.0, 'reg_alpha': 0.05725963328325285, 'reg_lambda': 0.0004455505507461053, 'gamma': 0.0034849210392128536}. Best is trial 101 with value: -0.18742442824914762.
[I 2026-07-17 14:23:40,789] Trial 123 finished with value: -0.09940506605958432 and parameters: {'scalers': 'none', 'ratios': 'log_ratio', 'imputers': 'none', 'n_estimators': 1650, 'learning_rate': 0.40991087654496744, 'max_depth': 11, 'min_child_weight': 2, 'subsample': 0.6, 'colsample_bytree': 0.9, 'colsample_bylevel': 1.0, 'reg_alpha': 0.35028642459661097, 'reg_lambda': 0.0004925588758349771, 'gamma': 0.04302722738271568}. Best is trial 101 with value: -0.18742442824914762.
[I 2026-07-17 14:24:05,611] Trial 124 finished with value: -0.1062522122572862 and parameters: {'scalers': 'none', 'ratios': 'log_ratio', 'imputers': 'none', 'n_estimators': 2050, 'learning_rate': 0.4208508408793932, 'max_depth': 11, 'min_child_weight': 2, 'subsample': 0.6, 'colsample_bytree': 0.9, 'colsample_bylevel': 1.0, 'reg_alpha': 0.37409813941231435, 'reg_lambda': 0.0005423243192310735, 'gamma': 0.04656023420748025}. Best is trial 101 with value: -0.18742442824914762.
[I 2026-07-17 14:24:25,305] Trial 125 finished with value: -0.14136861854468455 and parameters: {'scalers': 'none', 'ratios': 'log_ratio', 'imputers': 'none', 'n_estimators': 1600, 'learning_rate': 0.4046895747141663, 'max_depth': 11, 'min_child_weight': 1, 'subsample': 0.6, 'colsample_bytree': 0.9, 'colsample_bylevel': 0.9, 'reg_alpha': 0.33504992628397395, 'reg_lambda': 0.000539767867673588, 'gamma': 0.001760356419860592}. Best is trial 101 with value: -0.18742442824914762.
[I 2026-07-17 14:24:49,350] Trial 126 finished with value: -0.15380493385672972 and parameters: {'scalers': 'none', 'ratios': 'log_ratio', 'imputers': 'none', 'n_estimators': 2050, 'learning_rate': 0.39900937641328665, 'max_depth': 11, 'min_child_weight': 1, 'subsample': 0.6, 'colsample_bytree': 0.9, 'colsample_bylevel': 0.9, 'reg_alpha': 0.3378973132622687, 'reg_lambda': 0.043970880768402214, 'gamma': 0.006909594197251444}. Best is trial 101 with value: -0.18742442824914762.
[I 2026-07-17 14:25:15,334] Trial 127 finished with value: -0.16549369787435833 and parameters: {'scalers': 'none', 'ratios': 'log_ratio', 'imputers': 'none', 'n_estimators': 2050, 'learning_rate': 0.42578454895576856, 'max_depth': 11, 'min_child_weight': 1, 'subsample': 0.6, 'colsample_bytree': 0.9, 'colsample_bylevel': 0.9, 'reg_alpha': 0.4028443716820089, 'reg_lambda': 0.0004721973389894438, 'gamma': 0.016009396366934797}. Best is trial 101 with value: -0.18742442824914762.
[I 2026-07-17 14:25:39,750] Trial 128 finished with value: -0.16528128912467493 and parameters: {'scalers': 'none', 'ratios': 'log_ratio', 'imputers': 'median', 'n_estimators': 2000, 'learning_rate': 0.43063034676418244, 'max_depth': 11, 'min_child_weight': 1, 'subsample': 0.6, 'colsample_bytree': 0.9, 'colsample_bylevel': 0.9, 'reg_alpha': 0.35494155410643363, 'reg_lambda': 2.1901048021043636e-05, 'gamma': 0.0035342042204169186}. Best is trial 101 with value: -0.18742442824914762.
[I 2026-07-17 14:25:58,272] Trial 129 finished with value: -0.17127167831679865 and parameters: {'scalers': 'none', 'ratios': 'log_ratio', 'imputers': 'median', 'n_estimators': 2900, 'learning_rate': 0.4180270230519951, 'max_depth': 11, 'min_child_weight': 1, 'subsample': 0.6, 'colsample_bytree': 0.9, 'colsample_bylevel': 0.9, 'reg_alpha': 3.4118408410548966, 'reg_lambda': 2.4522720546214335e-05, 'gamma': 0.0147172289954782}. Best is trial 101 with value: -0.18742442824914762.
[I 2026-07-17 14:26:19,629] Trial 130 finished with value: -0.15838174543898076 and parameters: {'scalers': 'none', 'ratios': 'log_ratio', 'imputers': 'median', 'n_estimators': 2000, 'learning_rate': 0.38993388796232564, 'max_depth': 11, 'min_child_weight': 1, 'subsample': 0.6, 'colsample_bytree': 0.7, 'colsample_bylevel': 0.9, 'reg_alpha': 0.3437300356184978, 'reg_lambda': 2.1458170899370346e-05, 'gamma': 0.00710702018977189}. Best is trial 101 with value: -0.18742442824914762.
[I 2026-07-17 14:26:29,473] Trial 131 finished with value: -0.11120580293320922 and parameters: {'scalers': 'none', 'ratios': 'log_ratio', 'imputers': 'median', 'n_estimators': 2100, 'learning_rate': 0.3096143421449777, 'max_depth': 11, 'min_child_weight': 1, 'subsample': 0.6, 'colsample_bytree': 0.7, 'colsample_bylevel': 0.9, 'reg_alpha': 3.5149204326029393, 'reg_lambda': 2.0991837623024353e-05, 'gamma': 0.015727798088518027}. Best is trial 101 with value: -0.18742442824914762.
[I 2026-07-17 14:26:58,708] Trial 132 finished with value: -0.10303883798991872 and parameters: {'scalers': 'none', 'ratios': 'log_ratio', 'imputers': 'median', 'n_estimators': 2850, 'learning_rate': 0.10364883722226108, 'max_depth': 11, 'min_child_weight': 1, 'subsample': 0.7, 'colsample_bytree': 0.7, 'colsample_bylevel': 0.9, 'reg_alpha': 0.6641903352403966, 'reg_lambda': 5.306185955065986e-05, 'gamma': 0.007165759270042566}. Best is trial 101 with value: -0.18742442824914762.
[I 2026-07-17 14:27:09,652] Trial 133 finished with value: -0.10129418119004574 and parameters: {'scalers': 'none', 'ratios': 'log_ratio', 'imputers': 'median', 'n_estimators': 2000, 'learning_rate': 0.32052879174754373, 'max_depth': 11, 'min_child_weight': 1, 'subsample': 0.6, 'colsample_bytree': 0.9, 'colsample_bylevel': 0.9, 'reg_alpha': 3.849996745520655, 'reg_lambda': 0.019070585550928443, 'gamma': 0.013317033600033857}. Best is trial 101 with value: -0.18742442824914762.
[I 2026-07-17 14:27:39,504] Trial 134 finished with value: -0.15659643457715366 and parameters: {'scalers': 'none', 'ratios': 'log_ratio', 'imputers': 'median', 'n_estimators': 2000, 'learning_rate': 0.3316971156331795, 'max_depth': 11, 'min_child_weight': 1, 'subsample': 0.6, 'colsample_bytree': 0.9, 'colsample_bylevel': 0.9, 'reg_alpha': 0.6110617255202151, 'reg_lambda': 0.0012203086663518526, 'gamma': 0.006571083438155481}. Best is trial 101 with value: -0.18742442824914762.
