[I 2026-07-17 17:14:26,873] Trial 316 finished with value: -2.235479277231032 and parameters: {'scalers': 'standard', 'ratios': 'norm_ratio', 'imputers': 'none', 'n_estimators': 2850, 'learning_rate': 0.34605677990845546, 'max_depth': 11, 'min_child_weight': 1, 'subsample': 0.6, 'colsample_bytree': 0.8, 'colsample_bylevel': 0.5, 'reg_alpha': 6.869140208976673e-05, 'reg_lambda': 7.094878235291643e-05, 'gamma': 0.00472342178384726}. Best is trial 301 with value: -2.8636727005967506.
[I 2026-07-17 17:14:42,646] Trial 317 finished with value: -2.1252017641381165 and parameters: {'scalers': 'standard', 'ratios': 'norm_ratio', 'imputers': 'none', 'n_estimators': 2850, 'learning_rate': 0.35407625246547175, 'max_depth': 11, 'min_child_weight': 1, 'subsample': 0.6, 'colsample_bytree': 0.8, 'colsample_bylevel': 0.5, 'reg_alpha': 0.0005963930189114095, 'reg_lambda': 3.448170539358879e-05, 'gamma': 0.007502467076989574}. Best is trial 301 with value: -2.8636727005967506.
[I 2026-07-17 17:14:58,420] Trial 318 finished with value: -2.233349172669974 and parameters: {'scalers': 'standard', 'ratios': 'norm_ratio', 'imputers': 'none', 'n_estimators': 2850, 'learning_rate': 0.3583548470950222, 'max_depth': 11, 'min_child_weight': 1, 'subsample': 0.6, 'colsample_bytree': 0.8, 'colsample_bylevel': 0.5, 'reg_alpha': 0.0006193587894024088, 'reg_lambda': 1.0591417351033531e-05, 'gamma': 0.007914055568860462}. Best is trial 301 with value: -2.8636727005967506.
[I 2026-07-17 17:15:14,130] Trial 319 finished with value: -2.478713793414645 and parameters: {'scalers': 'standard', 'ratios': 'norm_ratio', 'imputers': 'none', 'n_estimators': 2850, 'learning_rate': 0.41782349245913863, 'max_depth': 11, 'min_child_weight': 1, 'subsample': 0.6, 'colsample_bytree': 0.8, 'colsample_bylevel': 0.5, 'reg_alpha': 0.00011794835115264014, 'reg_lambda': 1.0702932323240022e-05, 'gamma': 0.00845559618112967}. Best is trial 301 with value: -2.8636727005967506.
