[I 2026-07-17 16:08:51,444] A new study created in RDB with name: residual_study_v2
[I 2026-07-17 16:09:03,680] Trial 1 finished with value: -0.762398256608795 and parameters: {'scalers': 'robust', 'ratios': 'norm_ratio', 'imputers': 'median', 'n_estimators': 1950, 'learning_rate': 0.05766228000543743, 'max_depth': 6, 'min_child_weight': 1, 'subsample': 0.7, 'colsample_bytree': 0.8, 'colsample_bylevel': 0.9, 'reg_alpha': 0.15170097367078586, 'reg_lambda': 4.3317310864244786e-05, 'gamma': 0.0001461621717532146}. Best is trial 1 with value: -0.762398256608795.
[I 2026-07-17 16:09:14,417] Trial 0 finished with value: -1.0947675987400631 and parameters: {'scalers': 'none', 'ratios': 'log_ratio', 'imputers': 'median', 'n_estimators': 1100, 'learning_rate': 0.052610198276800704, 'max_depth': 12, 'min_child_weight': 1, 'subsample': 0.9, 'colsample_bytree': 0.9, 'colsample_bylevel': 0.6, 'reg_alpha': 0.800318672236568, 'reg_lambda': 0.017957711223882063, 'gamma': 6.145149893897404e-05}. Best is trial 0 with value: -1.0947675987400631.
[I 2026-07-17 16:09:17,898] Trial 3 finished with value: -0.4975429172578694 and parameters: {'scalers': 'none', 'ratios': 'log_ratio', 'imputers': 'none', 'n_estimators': 1250, 'learning_rate': 0.006364039503600021, 'max_depth': 5, 'min_child_weight': 4, 'subsample': 0.8, 'colsample_bytree': 0.5, 'colsample_bylevel': 0.8, 'reg_alpha': 0.005696610422477961, 'reg_lambda': 0.00012055803051998755, 'gamma': 5.527827169907956e-06}. Best is trial 0 with value: -1.0947675987400631.
[I 2026-07-17 16:09:20,969] Trial 2 finished with value: -0.8166690572260805 and parameters: {'scalers': 'standard', 'ratios': 'norm_ratio', 'imputers': 'none', 'n_estimators': 650, 'learning_rate': 0.38549917475052986, 'max_depth': 7, 'min_child_weight': 7, 'subsample': 0.9, 'colsample_bytree': 0.8, 'colsample_bylevel': 0.6, 'reg_alpha': 0.00011069102878106624, 'reg_lambda': 0.00012017807951614749, 'gamma': 2.0919227914494966e-05}. Best is trial 0 with value: -1.0947675987400631.
[I 2026-07-17 16:09:28,250] Trial 4 finished with value: -0.732373657498818 and parameters: {'scalers': 'none', 'ratios': 'log_ratio', 'imputers': 'median', 'n_estimators': 1200, 'learning_rate': 0.07103706077424939, 'max_depth': 12, 'min_child_weight': 8, 'subsample': 0.7, 'colsample_bytree': 0.7, 'colsample_bylevel': 0.6, 'reg_alpha': 0.00044899645932879024, 'reg_lambda': 1.5980452885367855e-05, 'gamma': 0.00033620036114558743}. Best is trial 0 with value: -1.0947675987400631.
[I 2026-07-17 16:09:33,224] Trial 5 finished with value: -0.5135107126608957 and parameters: {'scalers': 'none', 'ratios': 'log_ratio', 'imputers': 'none', 'n_estimators': 750, 'learning_rate': 0.0004534258452082679, 'max_depth': 11, 'min_child_weight': 6, 'subsample': 0.9, 'colsample_bytree': 0.5, 'colsample_bylevel': 0.8, 'reg_alpha': 0.000264625990567408, 'reg_lambda': 0.11530365076869051, 'gamma': 0.023075530453461956}. Best is trial 0 with value: -1.0947675987400631.
[I 2026-07-17 16:09:34,138] Trial 6 finished with value: -0.48505529258513613 and parameters: {'scalers': 'standard', 'ratios': 'log_ratio', 'imputers': 'median', 'n_estimators': 750, 'learning_rate': 0.25947102616365886, 'max_depth': 10, 'min_child_weight': 8, 'subsample': 0.6, 'colsample_bytree': 0.9, 'colsample_bylevel': 0.9, 'reg_alpha': 3.034842449893942e-05, 'reg_lambda': 0.0362599486333343, 'gamma': 0.3964647803831777}. Best is trial 0 with value: -1.0947675987400631.
[I 2026-07-17 16:09:35,937] Trial 7 finished with value: -0.5291040904320955 and parameters: {'scalers': 'standard', 'ratios': 'norm_ratio', 'imputers': 'none', 'n_estimators': 1800, 'learning_rate': 0.0012114550990591452, 'max_depth': 10, 'min_child_weight': 5, 'subsample': 0.5, 'colsample_bytree': 0.7, 'colsample_bylevel': 1.0, 'reg_alpha': 6.296408925730391e-06, 'reg_lambda': 0.0011958471822197901, 'gamma': 60.67187852164807}. Best is trial 0 with value: -1.0947675987400631.
[I 2026-07-17 16:09:41,323] Trial 8 finished with value: -0.6480164448880236 and parameters: {'scalers': 'robust', 'ratios': 'log_ratio', 'imputers': 'none', 'n_estimators': 2600, 'learning_rate': 0.06605441470247558, 'max_depth': 4, 'min_child_weight': 5, 'subsample': 0.5, 'colsample_bytree': 0.5, 'colsample_bylevel': 0.9, 'reg_alpha': 0.002736914409684328, 'reg_lambda': 6.601732096592348, 'gamma': 0.04689309121517856}. Best is trial 0 with value: -1.0947675987400631.
[I 2026-07-17 16:10:00,954] Trial 9 finished with value: -0.5276202597061995 and parameters: {'scalers': 'robust', 'ratios': 'norm_ratio', 'imputers': 'mean', 'n_estimators': 1550, 'learning_rate': 0.0016674597988623403, 'max_depth': 12, 'min_child_weight': 6, 'subsample': 0.7, 'colsample_bytree': 1.0, 'colsample_bylevel': 1.0, 'reg_alpha': 0.019501459851752327, 'reg_lambda': 1.6927652561701154, 'gamma': 1.9179797616619336e-05}. Best is trial 0 with value: -1.0947675987400631.
[I 2026-07-17 16:10:02,738] Trial 10 finished with value: -0.5291762576284657 and parameters: {'scalers': 'none', 'ratios': 'norm_ratio', 'imputers': 'none', 'n_estimators': 1450, 'learning_rate': 0.08574482385228122, 'max_depth': 12, 'min_child_weight': 2, 'subsample': 0.8, 'colsample_bytree': 0.8, 'colsample_bylevel': 0.7, 'reg_alpha': 3.314364872699509e-06, 'reg_lambda': 1.2498975851017136, 'gamma': 17.534455825980746}. Best is trial 0 with value: -1.0947675987400631.
[I 2026-07-17 16:10:23,382] Trial 11 finished with value: -1.2716253959070092 and parameters: {'scalers': 'robust', 'ratios': 'norm_ratio', 'imputers': 'mean', 'n_estimators': 2000, 'learning_rate': 0.29678112921535155, 'max_depth': 9, 'min_child_weight': 5, 'subsample': 0.7, 'colsample_bytree': 1.0, 'colsample_bylevel': 0.9, 'reg_alpha': 0.44656090792627007, 'reg_lambda': 0.17207786317233192, 'gamma': 0.0011020513953720777}. Best is trial 11 with value: -1.2716253959070092.
[I 2026-07-17 16:10:38,038] Trial 12 finished with value: -0.5536605172590887 and parameters: {'scalers': 'standard', 'ratios': 'log_ratio', 'imputers': 'none', 'n_estimators': 2400, 'learning_rate': 0.0020083779753900344, 'max_depth': 9, 'min_child_weight': 3, 'subsample': 0.7, 'colsample_bytree': 0.5, 'colsample_bylevel': 0.9, 'reg_alpha': 0.016516822261479543, 'reg_lambda': 9.9952092278966e-05, 'gamma': 2.229940856782921e-05}. Best is trial 11 with value: -1.2716253959070092.
[I 2026-07-17 16:10:39,924] Trial 13 finished with value: -0.5401039872345621 and parameters: {'scalers': 'robust', 'ratios': 'norm_ratio', 'imputers': 'none', 'n_estimators': 850, 'learning_rate': 0.04878792029846632, 'max_depth': 4, 'min_child_weight': 7, 'subsample': 0.6, 'colsample_bytree': 0.6, 'colsample_bylevel': 0.8, 'reg_alpha': 0.27458343003497676, 'reg_lambda': 3.2152241262337063e-06, 'gamma': 2.7706643272107154e-06}. Best is trial 11 with value: -1.2716253959070092.
[I 2026-07-17 16:10:41,005] Trial 15 finished with value: -0.5286648990594136 and parameters: {'scalers': 'none', 'ratios': 'log_ratio', 'imputers': 'median', 'n_estimators': 150, 'learning_rate': 0.00042186548508992824, 'max_depth': 6, 'min_child_weight': 6, 'subsample': 0.7, 'colsample_bytree': 0.5, 'colsample_bylevel': 0.7, 'reg_alpha': 37.07347667875547, 'reg_lambda': 0.00014224840226052555, 'gamma': 0.00014654651261982707}. Best is trial 11 with value: -1.2716253959070092.
[I 2026-07-17 16:10:42,164] Trial 14 finished with value: -0.5034029527030014 and parameters: {'scalers': 'standard', 'ratios': 'norm_ratio', 'imputers': 'median', 'n_estimators': 1750, 'learning_rate': 0.05739105586347004, 'max_depth': 9, 'min_child_weight': 8, 'subsample': 0.9, 'colsample_bytree': 0.7, 'colsample_bylevel': 1.0, 'reg_alpha': 2.6187694325675645e-06, 'reg_lambda': 61.1986518202958, 'gamma': 0.9391020715622099}. Best is trial 11 with value: -1.2716253959070092.
[I 2026-07-17 16:10:57,547] Trial 17 finished with value: -0.5286273449184473 and parameters: {'scalers': 'none', 'ratios': 'log_ratio', 'imputers': 'mean', 'n_estimators': 100, 'learning_rate': 0.00015726492015846736, 'max_depth': 8, 'min_child_weight': 10, 'subsample': 1.0, 'colsample_bytree': 1.0, 'colsample_bylevel': 0.5, 'reg_alpha': 21.86957491820325, 'reg_lambda': 60.97217372259803, 'gamma': 14.473253274299852}. Best is trial 11 with value: -1.2716253959070092.
[I 2026-07-17 16:10:57,921] Trial 18 finished with value: -0.5286273449184473 and parameters: {'scalers': 'standard', 'ratios': 'norm_ratio', 'imputers': 'mean', 'n_estimators': 150, 'learning_rate': 0.3814967729672262, 'max_depth': 8, 'min_child_weight': 10, 'subsample': 1.0, 'colsample_bytree': 1.0, 'colsample_bylevel': 0.5, 'reg_alpha': 56.606047887369655, 'reg_lambda': 1.4230282865373817e-06, 'gamma': 1.2169679769054228e-06}. Best is trial 11 with value: -1.2716253959070092.
[I 2026-07-17 16:10:58,459] Trial 16 finished with value: -0.5987123004741671 and parameters: {'scalers': 'standard', 'ratios': 'norm_ratio', 'imputers': 'median', 'n_estimators': 2700, 'learning_rate': 0.006400497933161495, 'max_depth': 8, 'min_child_weight': 2, 'subsample': 0.8, 'colsample_bytree': 0.8, 'colsample_bylevel': 0.9, 'reg_alpha': 0.00031629179701111565, 'reg_lambda': 4.864040691409133e-06, 'gamma': 0.0014279032863312184}. Best is trial 11 with value: -1.2716253959070092.
[I 2026-07-17 16:11:01,275] Trial 20 finished with value: -0.5285841395694106 and parameters: {'scalers': 'robust', 'ratios': 'norm_ratio', 'imputers': 'mean', 'n_estimators': 100, 'learning_rate': 0.0120161367340791, 'max_depth': 8, 'min_child_weight': 10, 'subsample': 1.0, 'colsample_bytree': 1.0, 'colsample_bylevel': 0.5, 'reg_alpha': 32.48888749811244, 'reg_lambda': 99.32626477402377, 'gamma': 0.0010640199116835184}. Best is trial 11 with value: -1.2716253959070092.
[I 2026-07-17 16:11:01,434] Trial 19 finished with value: -0.5286273449184473 and parameters: {'scalers': 'robust', 'ratios': 'log_ratio', 'imputers': 'mean', 'n_estimators': 2450, 'learning_rate': 0.012476561092461275, 'max_depth': 8, 'min_child_weight': 3, 'subsample': 1.0, 'colsample_bytree': 1.0, 'colsample_bylevel': 0.7, 'reg_alpha': 39.29032921216031, 'reg_lambda': 0.004815267435977782, 'gamma': 0.003360777381153514}. Best is trial 11 with value: -1.2716253959070092.
[I 2026-07-17 16:11:01,539] Trial 21 finished with value: -0.522985894277347 and parameters: {'scalers': 'none', 'ratios': 'log_ratio', 'imputers': 'mean', 'n_estimators': 100, 'learning_rate': 0.017115508619412013, 'max_depth': 8, 'min_child_weight': 10, 'subsample': 1.0, 'colsample_bytree': 1.0, 'colsample_bylevel': 0.5, 'reg_alpha': 30.082391344282446, 'reg_lambda': 0.008466514439410787, 'gamma': 0.0016350500902580275}. Best is trial 11 with value: -1.2716253959070092.
[I 2026-07-17 16:11:04,515] Trial 22 finished with value: -0.4775745904168167 and parameters: {'scalers': 'robust', 'ratios': 'norm_ratio', 'imputers': 'mean', 'n_estimators': 2350, 'learning_rate': 0.012205630000965181, 'max_depth': 8, 'min_child_weight': 10, 'subsample': 1.0, 'colsample_bytree': 1.0, 'colsample_bylevel': 0.5, 'reg_alpha': 12.200346688560824, 'reg_lambda': 0.009549865721881344, 'gamma': 0.0021620520175926273}. Best is trial 11 with value: -1.2716253959070092.
[I 2026-07-17 16:11:08,402] Trial 23 finished with value: -0.476562263848563 and parameters: {'scalers': 'robust', 'ratios': 'norm_ratio', 'imputers': 'mean', 'n_estimators': 2950, 'learning_rate': 0.013515206733667944, 'max_depth': 8, 'min_child_weight': 10, 'subsample': 1.0, 'colsample_bytree': 1.0, 'colsample_bylevel': 0.5, 'reg_alpha': 9.693865560496064, 'reg_lambda': 0.012791927797002842, 'gamma': 0.004127564075263462}. Best is trial 11 with value: -1.2716253959070092.
[I 2026-07-17 16:11:25,421] Trial 24 finished with value: -0.5817073599064652 and parameters: {'scalers': 'robust', 'ratios': 'norm_ratio', 'imputers': 'mean', 'n_estimators': 2950, 'learning_rate': 0.006094809901664808, 'max_depth': 10, 'min_child_weight': 1, 'subsample': 1.0, 'colsample_bytree': 0.9, 'colsample_bylevel': 0.5, 'reg_alpha': 2.4468590510096893, 'reg_lambda': 0.00936656656046232, 'gamma': 0.0024502120011707803}. Best is trial 11 with value: -1.2716253959070092.
[I 2026-07-17 16:11:42,276] Trial 25 finished with value: -0.7150294290629131 and parameters: {'scalers': 'robust', 'ratios': 'log_ratio', 'imputers': 'mean', 'n_estimators': 2950, 'learning_rate': 0.012499996103588153, 'max_depth': 10, 'min_child_weight': 1, 'subsample': 0.8, 'colsample_bytree': 0.9, 'colsample_bylevel': 0.6, 'reg_alpha': 2.354727117927377, 'reg_lambda': 0.007589792442756332, 'gamma': 0.002561559931524678}. Best is trial 11 with value: -1.2716253959070092.
[I 2026-07-17 16:12:02,010] Trial 26 finished with value: -1.0146825808950792 and parameters: {'scalers': 'robust', 'ratios': 'log_ratio', 'imputers': 'mean', 'n_estimators': 2150, 'learning_rate': 0.01627941293887811, 'max_depth': 10, 'min_child_weight': 1, 'subsample': 0.6, 'colsample_bytree': 0.9, 'colsample_bylevel': 0.6, 'reg_alpha': 1.63893010741891, 'reg_lambda': 0.007648535992021479, 'gamma': 0.003754153841460581}. Best is trial 11 with value: -1.2716253959070092.
[I 2026-07-17 16:12:18,284] Trial 27 finished with value: -0.978793855922615 and parameters: {'scalers': 'robust', 'ratios': 'log_ratio', 'imputers': 'mean', 'n_estimators': 2200, 'learning_rate': 0.02122383504447791, 'max_depth': 11, 'min_child_weight': 1, 'subsample': 0.6, 'colsample_bytree': 0.9, 'colsample_bylevel': 0.6, 'reg_alpha': 2.02995910868166, 'reg_lambda': 0.009903004852727264, 'gamma': 0.004756823400290693}. Best is trial 11 with value: -1.2716253959070092.
[I 2026-07-17 16:12:21,475] Trial 28 finished with value: -0.8805787005012871 and parameters: {'scalers': 'standard', 'ratios': 'norm_ratio', 'imputers': 'mean', 'n_estimators': 550, 'learning_rate': 0.1915974605954383, 'max_depth': 6, 'min_child_weight': 1, 'subsample': 0.9, 'colsample_bytree': 0.9, 'colsample_bylevel': 0.6, 'reg_alpha': 1.6927267534209076, 'reg_lambda': 0.08461730068029429, 'gamma': 3.049473643673039e-05}. Best is trial 11 with value: -1.2716253959070092.
[I 2026-07-17 16:12:24,748] Trial 29 finished with value: -0.916074319987492 and parameters: {'scalers': 'standard', 'ratios': 'norm_ratio', 'imputers': 'median', 'n_estimators': 550, 'learning_rate': 0.18764361666601476, 'max_depth': 6, 'min_child_weight': 1, 'subsample': 0.9, 'colsample_bytree': 0.9, 'colsample_bylevel': 0.6, 'reg_alpha': 1.220587046940617, 'reg_lambda': 0.14195409764439398, 'gamma': 3.7164213272361514e-05}. Best is trial 11 with value: -1.2716253959070092.
[I 2026-07-17 16:12:27,426] Trial 30 finished with value: -0.9462237598002904 and parameters: {'scalers': 'standard', 'ratios': 'norm_ratio', 'imputers': 'median', 'n_estimators': 450, 'learning_rate': 0.2570823677995255, 'max_depth': 6, 'min_child_weight': 1, 'subsample': 0.9, 'colsample_bytree': 0.9, 'colsample_bylevel': 0.6, 'reg_alpha': 1.5455074232624042, 'reg_lambda': 0.14735419439070316, 'gamma': 1.7044144264219526e-05}. Best is trial 11 with value: -1.2716253959070092.
[I 2026-07-17 16:12:30,354] Trial 31 finished with value: -0.8818608034580617 and parameters: {'scalers': 'standard', 'ratios': 'norm_ratio', 'imputers': 'median', 'n_estimators': 500, 'learning_rate': 0.1836025850497055, 'max_depth': 6, 'min_child_weight': 1, 'subsample': 0.9, 'colsample_bytree': 0.9, 'colsample_bylevel': 0.6, 'reg_alpha': 1.105085083589248, 'reg_lambda': 0.16069639364291716, 'gamma': 2.3153380064524398e-05}. Best is trial 11 with value: -1.2716253959070092.
[I 2026-07-17 16:12:32,898] Trial 32 finished with value: -0.6974755817821268 and parameters: {'scalers': 'standard', 'ratios': 'norm_ratio', 'imputers': 'median', 'n_estimators': 450, 'learning_rate': 0.2158206981455409, 'max_depth': 6, 'min_child_weight': 7, 'subsample': 0.9, 'colsample_bytree': 0.9, 'colsample_bylevel': 0.7, 'reg_alpha': 1.1537288865639723, 'reg_lambda': 0.0009899532299752242, 'gamma': 4.6234255515702866e-05}. Best is trial 11 with value: -1.2716253959070092.
[I 2026-07-17 16:12:35,148] Trial 33 finished with value: -0.6607276783336011 and parameters: {'scalers': 'standard', 'ratios': 'norm_ratio', 'imputers': 'median', 'n_estimators': 500, 'learning_rate': 0.2054006560554636, 'max_depth': 6, 'min_child_weight': 7, 'subsample': 0.9, 'colsample_bytree': 0.9, 'colsample_bylevel': 0.6, 'reg_alpha': 0.13526062554813223, 'reg_lambda': 0.0011987004993141506, 'gamma': 4.2548476256723586e-05}. Best is trial 11 with value: -1.2716253959070092.
[I 2026-07-17 16:12:51,460] Trial 34 finished with value: -1.6057195737937051 and parameters: {'scalers': 'robust', 'ratios': 'log_ratio', 'imputers': 'median', 'n_estimators': 2050, 'learning_rate': 0.15379597919040303, 'max_depth': 11, 'min_child_weight': 2, 'subsample': 0.6, 'colsample_bytree': 0.9, 'colsample_bylevel': 0.6, 'reg_alpha': 0.41654135030913336, 'reg_lambda': 0.21920528776766662, 'gamma': 0.03265992369960831}. Best is trial 34 with value: -1.6057195737937051.
[I 2026-07-17 16:13:09,406] Trial 35 finished with value: -1.4537378663242384 and parameters: {'scalers': 'none', 'ratios': 'log_ratio', 'imputers': 'median', 'n_estimators': 2100, 'learning_rate': 0.15501257031693125, 'max_depth': 11, 'min_child_weight': 2, 'subsample': 0.6, 'colsample_bytree': 0.9, 'colsample_bylevel': 0.7, 'reg_alpha': 0.2356606097300315, 'reg_lambda': 0.17328528377464478, 'gamma': 0.02609331477045824}. Best is trial 34 with value: -1.6057195737937051.
[I 2026-07-17 16:13:27,934] Trial 36 finished with value: -1.6171808901494555 and parameters: {'scalers': 'robust', 'ratios': 'log_ratio', 'imputers': 'median', 'n_estimators': 2100, 'learning_rate': 0.15869434973900412, 'max_depth': 11, 'min_child_weight': 2, 'subsample': 0.6, 'colsample_bytree': 0.8, 'colsample_bylevel': 0.7, 'reg_alpha': 0.3236562260730303, 'reg_lambda': 0.4188927944036111, 'gamma': 0.02092231909759139}. Best is trial 36 with value: -1.6171808901494555.
[I 2026-07-17 16:13:42,194] Trial 37 finished with value: -0.9139644851757649 and parameters: {'scalers': 'robust', 'ratios': 'log_ratio', 'imputers': 'median', 'n_estimators': 2050, 'learning_rate': 0.03208892202716365, 'max_depth': 11, 'min_child_weight': 3, 'subsample': 0.6, 'colsample_bytree': 0.8, 'colsample_bylevel': 0.7, 'reg_alpha': 0.12667353249752952, 'reg_lambda': 0.4895270831699276, 'gamma': 0.02716628320269419}. Best is trial 36 with value: -1.6171808901494555.
[I 2026-07-17 16:13:57,780] Trial 38 finished with value: -0.8894694435608028 and parameters: {'scalers': 'robust', 'ratios': 'log_ratio', 'imputers': 'mean', 'n_estimators': 2050, 'learning_rate': 0.02172684817256536, 'max_depth': 11, 'min_child_weight': 2, 'subsample': 0.6, 'colsample_bytree': 0.8, 'colsample_bylevel': 0.7, 'reg_alpha': 0.1907284301343189, 'reg_lambda': 0.0009733059841863589, 'gamma': 0.013256013679572564}. Best is trial 36 with value: -1.6171808901494555.
[I 2026-07-17 16:14:12,370] Trial 39 finished with value: -0.9283631117251364 and parameters: {'scalers': 'robust', 'ratios': 'log_ratio', 'imputers': 'mean', 'n_estimators': 2100, 'learning_rate': 0.0309133342136756, 'max_depth': 11, 'min_child_weight': 2, 'subsample': 0.6, 'colsample_bytree': 0.8, 'colsample_bylevel': 0.7, 'reg_alpha': 0.1852511618489978, 'reg_lambda': 0.0010586495020160648, 'gamma': 0.018800611091758037}. Best is trial 36 with value: -1.6171808901494555.
[I 2026-07-17 16:14:26,651] Trial 40 finished with value: -0.8669975694196319 and parameters: {'scalers': 'robust', 'ratios': 'log_ratio', 'imputers': 'mean', 'n_estimators': 2050, 'learning_rate': 0.026255252219331664, 'max_depth': 11, 'min_child_weight': 2, 'subsample': 0.6, 'colsample_bytree': 0.8, 'colsample_bylevel': 0.7, 'reg_alpha': 0.1013583260866974, 'reg_lambda': 0.0011943713956497949, 'gamma': 0.010924328316925792}. Best is trial 36 with value: -1.6171808901494555.
[I 2026-07-17 16:14:42,637] Trial 41 finished with value: -0.9214777124596355 and parameters: {'scalers': 'robust', 'ratios': 'log_ratio', 'imputers': 'mean', 'n_estimators': 2000, 'learning_rate': 0.020117382231449397, 'max_depth': 11, 'min_child_weight': 2, 'subsample': 0.6, 'colsample_bytree': 0.8, 'colsample_bylevel': 0.7, 'reg_alpha': 0.1892423458370765, 'reg_lambda': 0.5641910103236569, 'gamma': 0.011928209393003243}. Best is trial 36 with value: -1.6171808901494555.
[I 2026-07-17 16:14:57,789] Trial 42 finished with value: -0.9034318934561456 and parameters: {'scalers': 'robust', 'ratios': 'log_ratio', 'imputers': 'median', 'n_estimators': 2050, 'learning_rate': 0.023582348740638127, 'max_depth': 11, 'min_child_weight': 2, 'subsample': 0.6, 'colsample_bytree': 0.8, 'colsample_bylevel': 0.7, 'reg_alpha': 0.1573225653672032, 'reg_lambda': 0.42138478091974135, 'gamma': 0.02082035110918776}. Best is trial 36 with value: -1.6171808901494555.
[I 2026-07-17 16:15:13,977] Trial 43 finished with value: -1.2440957048239354 and parameters: {'scalers': 'none', 'ratios': 'log_ratio', 'imputers': 'median', 'n_estimators': 2000, 'learning_rate': 0.11080623146083698, 'max_depth': 11, 'min_child_weight': 3, 'subsample': 0.5, 'colsample_bytree': 0.8, 'colsample_bylevel': 0.8, 'reg_alpha': 0.2288212527071434, 'reg_lambda': 0.7030381002679581, 'gamma': 0.023439591029086673}. Best is trial 36 with value: -1.6171808901494555.
[I 2026-07-17 16:15:29,859] Trial 44 finished with value: -1.1922748005793382 and parameters: {'scalers': 'robust', 'ratios': 'log_ratio', 'imputers': 'median', 'n_estimators': 1950, 'learning_rate': 0.11709337663987453, 'max_depth': 11, 'min_child_weight': 3, 'subsample': 0.6, 'colsample_bytree': 0.8, 'colsample_bylevel': 0.8, 'reg_alpha': 0.21509526788142794, 'reg_lambda': 0.5664619641134363, 'gamma': 0.02858172094053856}. Best is trial 36 with value: -1.6171808901494555.
