[I 2026-07-17 15:33:53,251] Trial 45 finished with value: -0.01929422311024259 and parameters: {'scalers': 'standard', 'ratios': 'norm_ratio', 'imputers': 'median', 'n_estimators': 1300, 'learning_rate': 0.22238379120114699, 'max_depth': 12, 'min_child_weight': 3, 'subsample': 0.8, 'colsample_bytree': 0.9, 'colsample_bylevel': 0.6, 'reg_alpha': 14.448872850145266, 'reg_lambda': 0.003486451001303518, 'gamma': 0.005523084745424723}. Best is trial 30 with value: -0.06456990882033042.
[I 2026-07-17 15:33:54,703] Trial 46 finished with value: -0.019049088417249546 and parameters: {'scalers': 'standard', 'ratios': 'norm_ratio', 'imputers': 'median', 'n_estimators': 1250, 'learning_rate': 0.2137371919604749, 'max_depth': 12, 'min_child_weight': 3, 'subsample': 0.8, 'colsample_bytree': 0.9, 'colsample_bylevel': 0.6, 'reg_alpha': 13.352445439433465, 'reg_lambda': 0.008198792805057985, 'gamma': 15.082677314169414}. Best is trial 30 with value: -0.06456990882033042.
[I 2026-07-17 15:33:56,247] Trial 47 finished with value: -0.019016550727894623 and parameters: {'scalers': 'none', 'ratios': 'norm_ratio', 'imputers': 'median', 'n_estimators': 1250, 'learning_rate': 0.2323433639499804, 'max_depth': 12, 'min_child_weight': 5, 'subsample': 0.8, 'colsample_bytree': 0.9, 'colsample_bylevel': 0.6, 'reg_alpha': 0.19541652507917606, 'reg_lambda': 0.005143656209306269, 'gamma': 0.4945073176719445}. Best is trial 30 with value: -0.06456990882033042.
[I 2026-07-17 15:34:08,316] Trial 48 finished with value: -0.04998090837295937 and parameters: {'scalers': 'none', 'ratios': 'norm_ratio', 'imputers': 'median', 'n_estimators': 1250, 'learning_rate': 0.25383485484850704, 'max_depth': 12, 'min_child_weight': 5, 'subsample': 0.8, 'colsample_bytree': 0.9, 'colsample_bylevel': 0.6, 'reg_alpha': 1.4942180595618912e-05, 'reg_lambda': 0.008288985356224637, 'gamma': 0.006587990411079523}. Best is trial 30 with value: -0.06456990882033042.
[I 2026-07-17 15:34:11,096] Trial 49 finished with value: -0.019029333849720092 and parameters: {'scalers': 'none', 'ratios': 'norm_ratio', 'imputers': 'median', 'n_estimators': 1300, 'learning_rate': 0.07260497506549769, 'max_depth': 9, 'min_child_weight': 5, 'subsample': 0.8, 'colsample_bytree': 0.9, 'colsample_bylevel': 0.5, 'reg_alpha': 0.0013472410580972882, 'reg_lambda': 0.00760941223517154, 'gamma': 0.8534759942601152}. Best is trial 30 with value: -0.06456990882033042.
[I 2026-07-17 15:34:11,627] Trial 50 finished with value: -0.019035110487709384 and parameters: {'scalers': 'none', 'ratios': 'norm_ratio', 'imputers': 'median', 'n_estimators': 1250, 'learning_rate': 0.09658265732031557, 'max_depth': 9, 'min_child_weight': 5, 'subsample': 0.8, 'colsample_bytree': 1.0, 'colsample_bylevel': 0.5, 'reg_alpha': 0.3763706896123441, 'reg_lambda': 1.4566140896000566, 'gamma': 0.592432878293797}. Best is trial 30 with value: -0.06456990882033042.
[I 2026-07-17 15:34:12,859] Trial 51 finished with value: -0.01903308944293465 and parameters: {'scalers': 'none', 'ratios': 'norm_ratio', 'imputers': 'median', 'n_estimators': 1200, 'learning_rate': 0.07527330114727138, 'max_depth': 11, 'min_child_weight': 5, 'subsample': 0.8, 'colsample_bytree': 1.0, 'colsample_bylevel': 0.5, 'reg_alpha': 0.0012883001622807442, 'reg_lambda': 5.65901422903878, 'gamma': 0.37994147148962665}. Best is trial 30 with value: -0.06456990882033042.
[I 2026-07-17 15:34:16,829] Trial 52 finished with value: -0.01905230871691591 and parameters: {'scalers': 'standard', 'ratios': 'norm_ratio', 'imputers': 'median', 'n_estimators': 1250, 'learning_rate': 0.07828372202598148, 'max_depth': 9, 'min_child_weight': 2, 'subsample': 0.8, 'colsample_bytree': 0.9, 'colsample_bylevel': 0.7, 'reg_alpha': 0.5247393266066613, 'reg_lambda': 0.006421930698810025, 'gamma': 0.8615017447335352}. Best is trial 30 with value: -0.06456990882033042.
[I 2026-07-17 15:34:17,564] Trial 54 finished with value: -0.019054664227097732 and parameters: {'scalers': 'robust', 'ratios': 'norm_ratio', 'imputers': 'none', 'n_estimators': 400, 'learning_rate': 0.08466070088679238, 'max_depth': 9, 'min_child_weight': 2, 'subsample': 0.8, 'colsample_bytree': 1.0, 'colsample_bylevel': 0.7, 'reg_alpha': 1.232203324456858, 'reg_lambda': 0.00031377452789982206, 'gamma': 1.1485239940882594}. Best is trial 30 with value: -0.06456990882033042.
[I 2026-07-17 15:34:17,564] Trial 53 finished with value: -0.02481604665709537 and parameters: {'scalers': 'standard', 'ratios': 'norm_ratio', 'imputers': 'median', 'n_estimators': 200, 'learning_rate': 0.07677213830935671, 'max_depth': 9, 'min_child_weight': 2, 'subsample': 0.8, 'colsample_bytree': 1.0, 'colsample_bylevel': 0.7, 'reg_alpha': 0.3148122082188908, 'reg_lambda': 0.00037011167963257315, 'gamma': 0.006676047988702881}. Best is trial 30 with value: -0.06456990882033042.
[I 2026-07-17 15:34:19,290] Trial 55 finished with value: -0.0247493606379032 and parameters: {'scalers': 'robust', 'ratios': 'norm_ratio', 'imputers': 'none', 'n_estimators': 250, 'learning_rate': 0.06760747359284137, 'max_depth': 9, 'min_child_weight': 2, 'subsample': 1.0, 'colsample_bytree': 1.0, 'colsample_bylevel': 0.7, 'reg_alpha': 1.6237221136610416, 'reg_lambda': 0.0003415810398372834, 'gamma': 0.005925617089385555}. Best is trial 30 with value: -0.06456990882033042.
[I 2026-07-17 15:34:23,486] Trial 56 finished with value: -0.030247256675740138 and parameters: {'scalers': 'robust', 'ratios': 'norm_ratio', 'imputers': 'none', 'n_estimators': 400, 'learning_rate': 0.0819496680162377, 'max_depth': 9, 'min_child_weight': 2, 'subsample': 1.0, 'colsample_bytree': 1.0, 'colsample_bylevel': 0.7, 'reg_alpha': 0.9797158587733233, 'reg_lambda': 1.1778583142761232, 'gamma': 0.0005560184883886855}. Best is trial 30 with value: -0.06456990882033042.
[I 2026-07-17 15:34:23,836] Trial 57 finished with value: -0.019014443454178104 and parameters: {'scalers': 'robust', 'ratios': 'norm_ratio', 'imputers': 'none', 'n_estimators': 250, 'learning_rate': 0.07748269567199492, 'max_depth': 11, 'min_child_weight': 2, 'subsample': 0.7, 'colsample_bytree': 1.0, 'colsample_bylevel': 0.7, 'reg_alpha': 2.154977073250053, 'reg_lambda': 0.0002126854382733378, 'gamma': 0.23695359896086413}. Best is trial 30 with value: -0.06456990882033042.
[I 2026-07-17 15:34:28,697] Trial 58 finished with value: -0.0574933573351503 and parameters: {'scalers': 'robust', 'ratios': 'norm_ratio', 'imputers': 'none', 'n_estimators': 550, 'learning_rate': 0.3246228585552349, 'max_depth': 11, 'min_child_weight': 2, 'subsample': 0.7, 'colsample_bytree': 1.0, 'colsample_bylevel': 0.7, 'reg_alpha': 1.7004350054559925, 'reg_lambda': 7.087849889360799, 'gamma': 0.05258635463559742}. Best is trial 30 with value: -0.06456990882033042.
[I 2026-07-17 15:34:28,984] Trial 59 finished with value: -0.019022372053614504 and parameters: {'scalers': 'robust', 'ratios': 'norm_ratio', 'imputers': 'none', 'n_estimators': 1850, 'learning_rate': 0.33296006637288383, 'max_depth': 11, 'min_child_weight': 2, 'subsample': 0.7, 'colsample_bytree': 1.0, 'colsample_bylevel': 0.7, 'reg_alpha': 1.3691770765474558, 'reg_lambda': 0.00025195451813757644, 'gamma': 2.388593192277641}. Best is trial 30 with value: -0.06456990882033042.
[I 2026-07-17 15:34:48,972] Trial 60 finished with value: -0.07558629984395046 and parameters: {'scalers': 'robust', 'ratios': 'norm_ratio', 'imputers': 'none', 'n_estimators': 3000, 'learning_rate': 0.3413043387884607, 'max_depth': 11, 'min_child_weight': 4, 'subsample': 0.7, 'colsample_bytree': 0.6, 'colsample_bylevel': 0.5, 'reg_alpha': 0.07696825650604133, 'reg_lambda': 0.031483124090121654, 'gamma': 0.0006025935332819289}. Best is trial 60 with value: -0.07558629984395046.
[I 2026-07-17 15:35:02,017] Trial 61 finished with value: -0.07624206264540964 and parameters: {'scalers': 'robust', 'ratios': 'norm_ratio', 'imputers': 'none', 'n_estimators': 2600, 'learning_rate': 0.35512193693387256, 'max_depth': 11, 'min_child_weight': 4, 'subsample': 0.7, 'colsample_bytree': 0.6, 'colsample_bylevel': 0.5, 'reg_alpha': 2.3153498953095166, 'reg_lambda': 0.045211007941385994, 'gamma': 0.0005370009899328645}. Best is trial 61 with value: -0.07624206264540964.
[I 2026-07-17 15:35:05,096] Trial 62 finished with value: -0.05450455757359642 and parameters: {'scalers': 'robust', 'ratios': 'norm_ratio', 'imputers': 'none', 'n_estimators': 550, 'learning_rate': 0.35224496690145474, 'max_depth': 11, 'min_child_weight': 4, 'subsample': 0.7, 'colsample_bytree': 0.6, 'colsample_bylevel': 0.5, 'reg_alpha': 0.08157251975590106, 'reg_lambda': 1.068109248538359, 'gamma': 0.000626379939905745}. Best is trial 61 with value: -0.07624206264540964.
[I 2026-07-17 15:35:20,183] Trial 63 finished with value: -0.05417664281479936 and parameters: {'scalers': 'robust', 'ratios': 'norm_ratio', 'imputers': 'median', 'n_estimators': 2650, 'learning_rate': 0.3296694543889195, 'max_depth': 11, 'min_child_weight': 8, 'subsample': 0.7, 'colsample_bytree': 0.6, 'colsample_bylevel': 0.5, 'reg_alpha': 0.09014879641527297, 'reg_lambda': 0.02808212775309328, 'gamma': 0.0006659471007642803}. Best is trial 61 with value: -0.07624206264540964.
[I 2026-07-17 15:35:23,373] Trial 64 finished with value: -0.019993477861895002 and parameters: {'scalers': 'robust', 'ratios': 'norm_ratio', 'imputers': 'median', 'n_estimators': 3000, 'learning_rate': 0.3088261228599867, 'max_depth': 11, 'min_child_weight': 4, 'subsample': 0.7, 'colsample_bytree': 0.6, 'colsample_bylevel': 0.5, 'reg_alpha': 2.623461648439196, 'reg_lambda': 1.2479602408043623e-05, 'gamma': 0.12411324945691732}. Best is trial 61 with value: -0.07624206264540964.
[I 2026-07-17 15:35:38,277] Trial 65 finished with value: -0.052000231178351085 and parameters: {'scalers': 'none', 'ratios': 'log_ratio', 'imputers': 'median', 'n_estimators': 2600, 'learning_rate': 0.35034573153389625, 'max_depth': 11, 'min_child_weight': 8, 'subsample': 0.7, 'colsample_bytree': 0.6, 'colsample_bylevel': 0.5, 'reg_alpha': 0.11820519911933289, 'reg_lambda': 0.023148578200206233, 'gamma': 0.04720905075969646}. Best is trial 61 with value: -0.07624206264540964.
[I 2026-07-17 15:35:39,153] Trial 66 finished with value: -0.05006772663427736 and parameters: {'scalers': 'robust', 'ratios': 'log_ratio', 'imputers': 'none', 'n_estimators': 500, 'learning_rate': 0.16012657887917545, 'max_depth': 11, 'min_child_weight': 1, 'subsample': 0.5, 'colsample_bytree': 0.6, 'colsample_bylevel': 0.5, 'reg_alpha': 0.08834624478418858, 'reg_lambda': 7.758024362558829e-05, 'gamma': 0.0006835142450503746}. Best is trial 61 with value: -0.07624206264540964.
[I 2026-07-17 15:35:42,200] Trial 67 finished with value: -0.05027087742748136 and parameters: {'scalers': 'robust', 'ratios': 'log_ratio', 'imputers': 'none', 'n_estimators': 550, 'learning_rate': 0.1796628444954361, 'max_depth': 11, 'min_child_weight': 1, 'subsample': 0.7, 'colsample_bytree': 0.6, 'colsample_bylevel': 0.5, 'reg_alpha': 0.08366811897391123, 'reg_lambda': 0.034448460947948664, 'gamma': 0.03483837913338955}. Best is trial 61 with value: -0.07624206264540964.
[I 2026-07-17 15:35:45,990] Trial 68 finished with value: -0.0403790550015991 and parameters: {'scalers': 'robust', 'ratios': 'log_ratio', 'imputers': 'none', 'n_estimators': 600, 'learning_rate': 0.16649163471245268, 'max_depth': 11, 'min_child_weight': 4, 'subsample': 0.7, 'colsample_bytree': 0.6, 'colsample_bylevel': 0.5, 'reg_alpha': 0.07701873236651162, 'reg_lambda': 0.038278646538579736, 'gamma': 7.164050387558743e-05}. Best is trial 61 with value: -0.07624206264540964.
[I 2026-07-17 15:36:04,989] Trial 69 finished with value: -0.06055470909974076 and parameters: {'scalers': 'robust', 'ratios': 'norm_ratio', 'imputers': 'none', 'n_estimators': 2900, 'learning_rate': 0.1740976667894331, 'max_depth': 11, 'min_child_weight': 4, 'subsample': 0.7, 'colsample_bytree': 0.6, 'colsample_bylevel': 0.5, 'reg_alpha': 0.08726980090633941, 'reg_lambda': 0.025272921548380338, 'gamma': 9.593376962357284e-05}. Best is trial 61 with value: -0.07624206264540964.
[I 2026-07-17 15:36:13,642] Trial 70 finished with value: -0.06180357146531344 and parameters: {'scalers': 'robust', 'ratios': 'norm_ratio', 'imputers': 'none', 'n_estimators': 3000, 'learning_rate': 0.17866257308742806, 'max_depth': 12, 'min_child_weight': 1, 'subsample': 0.7, 'colsample_bytree': 0.6, 'colsample_bylevel': 0.5, 'reg_alpha': 4.526295208553567, 'reg_lambda': 0.04825226818663853, 'gamma': 0.0009576667066474962}. Best is trial 61 with value: -0.07624206264540964.
[I 2026-07-17 15:36:27,971] Trial 71 finished with value: -0.1108637700809604 and parameters: {'scalers': 'robust', 'ratios': 'norm_ratio', 'imputers': 'none', 'n_estimators': 2950, 'learning_rate': 0.17786081647288632, 'max_depth': 12, 'min_child_weight': 1, 'subsample': 0.6, 'colsample_bytree': 0.7, 'colsample_bylevel': 0.5, 'reg_alpha': 2.1906324247127555, 'reg_lambda': 0.05394312669676993, 'gamma': 8.214961193587703e-05}. Best is trial 71 with value: -0.1108637700809604.
[I 2026-07-17 15:36:39,989] Trial 72 finished with value: -0.08856230597070883 and parameters: {'scalers': 'robust', 'ratios': 'norm_ratio', 'imputers': 'none', 'n_estimators': 2800, 'learning_rate': 0.18067588703423468, 'max_depth': 12, 'min_child_weight': 1, 'subsample': 0.6, 'colsample_bytree': 0.7, 'colsample_bylevel': 0.6, 'reg_alpha': 3.3362957697088955, 'reg_lambda': 0.033553553349717845, 'gamma': 7.979424347186835e-05}. Best is trial 71 with value: -0.1108637700809604.
[I 2026-07-17 15:36:48,807] Trial 73 finished with value: -0.057168190796011015 and parameters: {'scalers': 'robust', 'ratios': 'norm_ratio', 'imputers': 'none', 'n_estimators': 2750, 'learning_rate': 0.1735596066435606, 'max_depth': 12, 'min_child_weight': 1, 'subsample': 0.6, 'colsample_bytree': 0.6, 'colsample_bylevel': 0.6, 'reg_alpha': 5.230215551387886, 'reg_lambda': 13.574592369150803, 'gamma': 0.00011357429121128198}. Best is trial 71 with value: -0.1108637700809604.
[I 2026-07-17 15:36:51,667] Trial 74 finished with value: -0.019047501970734737 and parameters: {'scalers': 'robust', 'ratios': 'norm_ratio', 'imputers': 'none', 'n_estimators': 2900, 'learning_rate': 0.18231623269577657, 'max_depth': 12, 'min_child_weight': 4, 'subsample': 0.6, 'colsample_bytree': 0.7, 'colsample_bylevel': 0.6, 'reg_alpha': 35.285024037656335, 'reg_lambda': 0.056162833671505485, 'gamma': 0.00011325270941836512}. Best is trial 71 with value: -0.1108637700809604.
[I 2026-07-17 15:37:00,247] Trial 75 finished with value: -0.042966975391705034 and parameters: {'scalers': 'robust', 'ratios': 'norm_ratio', 'imputers': 'none', 'n_estimators': 2800, 'learning_rate': 0.17241897739230264, 'max_depth': 12, 'min_child_weight': 4, 'subsample': 0.6, 'colsample_bytree': 0.7, 'colsample_bylevel': 0.6, 'reg_alpha': 5.820083740450961, 'reg_lambda': 0.0572456430199251, 'gamma': 6.601862322237726e-05}. Best is trial 71 with value: -0.1108637700809604.
[I 2026-07-17 15:37:10,489] Trial 76 finished with value: -0.019166757335187634 and parameters: {'scalers': 'robust', 'ratios': 'norm_ratio', 'imputers': 'none', 'n_estimators': 2750, 'learning_rate': 0.0005731770965645058, 'max_depth': 12, 'min_child_weight': 4, 'subsample': 0.6, 'colsample_bytree': 0.7, 'colsample_bylevel': 0.6, 'reg_alpha': 6.221274601365919, 'reg_lambda': 0.05464878417643585, 'gamma': 2.3329439527947058e-05}. Best is trial 71 with value: -0.1108637700809604.
[I 2026-07-17 15:37:11,649] Trial 77 finished with value: -0.01904511529267337 and parameters: {'scalers': 'robust', 'ratios': 'norm_ratio', 'imputers': 'none', 'n_estimators': 2800, 'learning_rate': 0.11602567566827345, 'max_depth': 10, 'min_child_weight': 4, 'subsample': 0.6, 'colsample_bytree': 0.7, 'colsample_bylevel': 0.9, 'reg_alpha': 32.18462980049659, 'reg_lambda': 0.0693837389820944, 'gamma': 1.890348179950063e-05}. Best is trial 71 with value: -0.1108637700809604.
[I 2026-07-17 15:37:15,182] Trial 78 finished with value: -0.019047494989116814 and parameters: {'scalers': 'robust', 'ratios': 'norm_ratio', 'imputers': 'none', 'n_estimators': 2750, 'learning_rate': 0.03947134115008413, 'max_depth': 12, 'min_child_weight': 1, 'subsample': 0.6, 'colsample_bytree': 0.7, 'colsample_bylevel': 0.9, 'reg_alpha': 41.886885924647956, 'reg_lambda': 0.01757603536824319, 'gamma': 2.8682163911027316e-05}. Best is trial 71 with value: -0.1108637700809604.
[I 2026-07-17 15:37:27,245] Trial 79 finished with value: -0.057222773416082055 and parameters: {'scalers': 'robust', 'ratios': 'norm_ratio', 'imputers': 'none', 'n_estimators': 2800, 'learning_rate': 0.11741709374044315, 'max_depth': 12, 'min_child_weight': 1, 'subsample': 0.6, 'colsample_bytree': 0.7, 'colsample_bylevel': 0.9, 'reg_alpha': 4.138122688403896, 'reg_lambda': 0.05796806202834708, 'gamma': 1.4790361769511518e-05}. Best is trial 71 with value: -0.1108637700809604.
[I 2026-07-17 15:37:36,836] Trial 80 finished with value: -0.0286767699847618 and parameters: {'scalers': 'robust', 'ratios': 'norm_ratio', 'imputers': 'none', 'n_estimators': 2800, 'learning_rate': 0.03897763989085323, 'max_depth': 12, 'min_child_weight': 1, 'subsample': 0.6, 'colsample_bytree': 0.7, 'colsample_bylevel': 0.5, 'reg_alpha': 4.666715297341668, 'reg_lambda': 0.06215282000745336, 'gamma': 1.7030912200099705e-05}. Best is trial 71 with value: -0.1108637700809604.
[I 2026-07-17 15:37:40,282] Trial 81 finished with value: -0.0190435352794375 and parameters: {'scalers': 'robust', 'ratios': 'norm_ratio', 'imputers': 'none', 'n_estimators': 2850, 'learning_rate': 0.05288470578568181, 'max_depth': 12, 'min_child_weight': 1, 'subsample': 0.6, 'colsample_bytree': 0.7, 'colsample_bylevel': 0.5, 'reg_alpha': 40.13840682230856, 'reg_lambda': 0.061824959921115495, 'gamma': 1.994575897789835e-05}. Best is trial 71 with value: -0.1108637700809604.
[I 2026-07-17 15:37:47,645] Trial 82 finished with value: -0.04018314534791958 and parameters: {'scalers': 'robust', 'ratios': 'norm_ratio', 'imputers': 'none', 'n_estimators': 2850, 'learning_rate': 0.04735426699217976, 'max_depth': 12, 'min_child_weight': 1, 'subsample': 0.5, 'colsample_bytree': 0.7, 'colsample_bylevel': 0.5, 'reg_alpha': 3.7899483715339572, 'reg_lambda': 0.0650933975630343, 'gamma': 8.522790154587069e-06}. Best is trial 71 with value: -0.1108637700809604.
[I 2026-07-17 15:37:57,548] Trial 83 finished with value: -0.06038154843060629 and parameters: {'scalers': 'robust', 'ratios': 'norm_ratio', 'imputers': 'none', 'n_estimators': 3000, 'learning_rate': 0.11002180046303815, 'max_depth': 10, 'min_child_weight': 1, 'subsample': 0.5, 'colsample_bytree': 0.7, 'colsample_bylevel': 0.5, 'reg_alpha': 3.3281318411391365, 'reg_lambda': 0.0760696786675189, 'gamma': 2.741999059007635e-05}. Best is trial 71 with value: -0.1108637700809604.
[I 2026-07-17 15:38:00,230] Trial 84 finished with value: -0.019043787972631034 and parameters: {'scalers': 'robust', 'ratios': 'norm_ratio', 'imputers': 'none', 'n_estimators': 3000, 'learning_rate': 0.03936281271716559, 'max_depth': 10, 'min_child_weight': 1, 'subsample': 0.6, 'colsample_bytree': 0.7, 'colsample_bylevel': 0.5, 'reg_alpha': 27.23371107981054, 'reg_lambda': 0.012970853165659853, 'gamma': 2.466927627747266e-05}. Best is trial 71 with value: -0.1108637700809604.
[I 2026-07-17 15:38:07,614] Trial 85 finished with value: -0.03537905485636069 and parameters: {'scalers': 'robust', 'ratios': 'norm_ratio', 'imputers': 'none', 'n_estimators': 3000, 'learning_rate': 0.11505965674795013, 'max_depth': 6, 'min_child_weight': 1, 'subsample': 0.5, 'colsample_bytree': 0.6, 'colsample_bylevel': 0.5, 'reg_alpha': 3.417367234366687, 'reg_lambda': 0.012355184470101773, 'gamma': 4.064404604293053e-06}. Best is trial 71 with value: -0.1108637700809604.
[I 2026-07-17 15:38:16,367] Trial 86 finished with value: -0.05704642511654101 and parameters: {'scalers': 'robust', 'ratios': 'norm_ratio', 'imputers': 'none', 'n_estimators': 3000, 'learning_rate': 0.11015517204729343, 'max_depth': 10, 'min_child_weight': 1, 'subsample': 0.5, 'colsample_bytree': 0.6, 'colsample_bylevel': 0.5, 'reg_alpha': 3.41109381053548, 'reg_lambda': 0.6790766274708725, 'gamma': 9.336316938712237e-06}. Best is trial 71 with value: -0.1108637700809604.
[I 2026-07-17 15:38:36,384] Trial 87 finished with value: -0.08697850004722765 and parameters: {'scalers': 'robust', 'ratios': 'norm_ratio', 'imputers': 'none', 'n_estimators': 3000, 'learning_rate': 0.058213874279232324, 'max_depth': 10, 'min_child_weight': 1, 'subsample': 0.5, 'colsample_bytree': 0.6, 'colsample_bylevel': 0.5, 'reg_alpha': 0.807714642300485, 'reg_lambda': 0.013353774900726494, 'gamma': 9.00141836770808e-06}. Best is trial 71 with value: -0.1108637700809604.
[I 2026-07-17 15:38:44,027] Trial 88 finished with value: -0.09638509715626634 and parameters: {'scalers': 'robust', 'ratios': 'norm_ratio', 'imputers': 'none', 'n_estimators': 3000, 'learning_rate': 0.3790746579470872, 'max_depth': 5, 'min_child_weight': 1, 'subsample': 0.5, 'colsample_bytree': 0.6, 'colsample_bylevel': 0.5, 'reg_alpha': 0.568256888861589, 'reg_lambda': 0.012200389809335145, 'gamma': 4.02231760778732e-06}. Best is trial 71 with value: -0.1108637700809604.
[I 2026-07-17 15:38:53,930] Trial 89 finished with value: -0.13316216059322425 and parameters: {'scalers': 'robust', 'ratios': 'norm_ratio', 'imputers': 'none', 'n_estimators': 3000, 'learning_rate': 0.38062961593592654, 'max_depth': 6, 'min_child_weight': 1, 'subsample': 0.5, 'colsample_bytree': 0.6, 'colsample_bylevel': 0.5, 'reg_alpha': 0.7312402851395798, 'reg_lambda': 0.0021265699737873984, 'gamma': 0.00029870572597868723}. Best is trial 89 with value: -0.13316216059322425.
