[I 2026-07-17 12:25:08,581] Trial 135 finished with value: -0.6143111492188964 and parameters: {'scalers': 'none', 'ratios': 'log_ratio', 'imputers': 'median', 'n_estimators': 2900, 'learning_rate': 0.2985681245523903, 'max_depth': 9, 'min_child_weight': 1, 'subsample': 0.5, 'colsample_bytree': 0.5, 'colsample_bylevel': 0.5, 'reg_alpha': 8.852688233723034e-05, 'reg_lambda': 50.64358196340941, 'gamma': 0.0013739341208998648}. Best is trial 135 with value: -0.6143111492188964.
[I 2026-07-17 12:25:19,642] Trial 136 finished with value: -0.1887387567728969 and parameters: {'scalers': 'none', 'ratios': 'log_ratio', 'imputers': 'median', 'n_estimators': 2200, 'learning_rate': 0.05728318232302555, 'max_depth': 9, 'min_child_weight': 1, 'subsample': 0.6, 'colsample_bytree': 0.5, 'colsample_bylevel': 0.5, 'reg_alpha': 3.905244032937319e-05, 'reg_lambda': 42.2991228715983, 'gamma': 0.001425257731527016}. Best is trial 135 with value: -0.6143111492188964.
[I 2026-07-17 12:25:36,996] Trial 137 finished with value: -0.453851096928389 and parameters: {'scalers': 'none', 'ratios': 'log_ratio', 'imputers': 'median', 'n_estimators': 2900, 'learning_rate': 0.29274606779890566, 'max_depth': 9, 'min_child_weight': 1, 'subsample': 0.6, 'colsample_bytree': 0.5, 'colsample_bylevel': 0.5, 'reg_alpha': 0.001193313824583107, 'reg_lambda': 30.694693200939668, 'gamma': 0.001022819070678094}. Best is trial 135 with value: -0.6143111492188964.
[I 2026-07-17 12:25:52,839] Trial 138 finished with value: -0.6290130902636787 and parameters: {'scalers': 'none', 'ratios': 'log_ratio', 'imputers': 'median', 'n_estimators': 2900, 'learning_rate': 0.2930093012784713, 'max_depth': 9, 'min_child_weight': 1, 'subsample': 0.5, 'colsample_bytree': 0.5, 'colsample_bylevel': 0.5, 'reg_alpha': 8.612117748270633e-05, 'reg_lambda': 63.030711082669185, 'gamma': 0.0012585691568415302}. Best is trial 138 with value: -0.6290130902636787.
[I 2026-07-17 12:26:12,137] Trial 139 finished with value: -0.590887399898333 and parameters: {'scalers': 'none', 'ratios': 'log_ratio', 'imputers': 'median', 'n_estimators': 2500, 'learning_rate': 0.3045604971782946, 'max_depth': 9, 'min_child_weight': 1, 'subsample': 0.5, 'colsample_bytree': 0.9, 'colsample_bylevel': 0.5, 'reg_alpha': 0.0009663665321560556, 'reg_lambda': 70.02250445850015, 'gamma': 0.001248724446853298}. Best is trial 138 with value: -0.6290130902636787.
[I 2026-07-17 12:26:28,421] Trial 140 finished with value: -0.8150476651597487 and parameters: {'scalers': 'none', 'ratios': 'log_ratio', 'imputers': 'median', 'n_estimators': 2700, 'learning_rate': 0.3090483052831064, 'max_depth': 10, 'min_child_weight': 1, 'subsample': 0.5, 'colsample_bytree': 0.5, 'colsample_bylevel': 0.5, 'reg_alpha': 0.0010117448991085035, 'reg_lambda': 75.77803283998915, 'gamma': 0.0013252934674016883}. Best is trial 140 with value: -0.8150476651597487.
[I 2026-07-17 12:26:45,106] Trial 141 finished with value: -0.8373464103742554 and parameters: {'scalers': 'none', 'ratios': 'log_ratio', 'imputers': 'median', 'n_estimators': 2700, 'learning_rate': 0.3035220952283317, 'max_depth': 10, 'min_child_weight': 1, 'subsample': 0.5, 'colsample_bytree': 0.5, 'colsample_bylevel': 0.5, 'reg_alpha': 0.0010001977576055354, 'reg_lambda': 68.16153159949242, 'gamma': 0.0008649793689894595}. Best is trial 141 with value: -0.8373464103742554.
[I 2026-07-17 12:27:02,640] Trial 142 finished with value: -0.4746339546072751 and parameters: {'scalers': 'none', 'ratios': 'log_ratio', 'imputers': 'median', 'n_estimators': 2700, 'learning_rate': 0.297026676705443, 'max_depth': 10, 'min_child_weight': 1, 'subsample': 0.5, 'colsample_bytree': 0.5, 'colsample_bylevel': 0.5, 'reg_alpha': 0.0010867585817371558, 'reg_lambda': 6.6734251330356615, 'gamma': 0.001357912263755379}. Best is trial 141 with value: -0.8373464103742554.
[I 2026-07-17 12:27:18,995] Trial 143 finished with value: -0.8068522691214274 and parameters: {'scalers': 'none', 'ratios': 'log_ratio', 'imputers': 'median', 'n_estimators': 2800, 'learning_rate': 0.29480836769190544, 'max_depth': 10, 'min_child_weight': 1, 'subsample': 0.5, 'colsample_bytree': 0.5, 'colsample_bylevel': 0.5, 'reg_alpha': 0.0010821293430927628, 'reg_lambda': 97.83042096067508, 'gamma': 0.0008757063563608191}. Best is trial 141 with value: -0.8373464103742554.
[I 2026-07-17 12:27:38,727] Trial 144 finished with value: -0.24679910211173026 and parameters: {'scalers': 'none', 'ratios': 'log_ratio', 'imputers': 'median', 'n_estimators': 2900, 'learning_rate': 0.16139895345946392, 'max_depth': 10, 'min_child_weight': 1, 'subsample': 1.0, 'colsample_bytree': 0.5, 'colsample_bylevel': 0.5, 'reg_alpha': 0.000920234106195768, 'reg_lambda': 79.8826782621107, 'gamma': 0.0007666020151447597}. Best is trial 141 with value: -0.8373464103742554.
[I 2026-07-17 12:27:57,190] Trial 145 finished with value: -0.6146050213430907 and parameters: {'scalers': 'none', 'ratios': 'log_ratio', 'imputers': 'median', 'n_estimators': 2900, 'learning_rate': 0.3072599328159861, 'max_depth': 10, 'min_child_weight': 1, 'subsample': 0.6, 'colsample_bytree': 0.5, 'colsample_bylevel': 0.5, 'reg_alpha': 0.0011538551313210422, 'reg_lambda': 88.63844351902645, 'gamma': 0.000618078271288539}. Best is trial 141 with value: -0.8373464103742554.
[I 2026-07-17 12:28:14,134] Trial 146 finished with value: -0.5389787808446335 and parameters: {'scalers': 'none', 'ratios': 'log_ratio', 'imputers': 'median', 'n_estimators': 2700, 'learning_rate': 0.29961275952234545, 'max_depth': 10, 'min_child_weight': 1, 'subsample': 0.6, 'colsample_bytree': 0.5, 'colsample_bylevel': 0.5, 'reg_alpha': 0.0009113645331672067, 'reg_lambda': 93.99468468308282, 'gamma': 0.0008652403674402977}. Best is trial 141 with value: -0.8373464103742554.
[I 2026-07-17 12:28:38,757] Trial 147 finished with value: -0.5038463260035126 and parameters: {'scalers': 'none', 'ratios': 'log_ratio', 'imputers': 'median', 'n_estimators': 2800, 'learning_rate': 0.2968002732587749, 'max_depth': 10, 'min_child_weight': 1, 'subsample': 0.6, 'colsample_bytree': 0.9, 'colsample_bylevel': 0.5, 'reg_alpha': 0.0047299451179191885, 'reg_lambda': 74.22855611555758, 'gamma': 0.0008083260976673079}. Best is trial 141 with value: -0.8373464103742554.
[I 2026-07-17 12:29:04,749] Trial 148 finished with value: -0.4956541533521649 and parameters: {'scalers': 'none', 'ratios': 'log_ratio', 'imputers': 'median', 'n_estimators': 2800, 'learning_rate': 0.3010928322469723, 'max_depth': 10, 'min_child_weight': 1, 'subsample': 0.6, 'colsample_bytree': 1.0, 'colsample_bylevel': 0.5, 'reg_alpha': 0.0007023278362322724, 'reg_lambda': 80.46164020379794, 'gamma': 0.0008326113049263789}. Best is trial 141 with value: -0.8373464103742554.
[I 2026-07-17 12:29:30,569] Trial 149 finished with value: -0.9678745631850254 and parameters: {'scalers': 'none', 'ratios': 'log_ratio', 'imputers': 'median', 'n_estimators': 2800, 'learning_rate': 0.4130723448315728, 'max_depth': 10, 'min_child_weight': 1, 'subsample': 0.6, 'colsample_bytree': 0.9, 'colsample_bylevel': 0.5, 'reg_alpha': 0.0010933841240219726, 'reg_lambda': 92.57834961581747, 'gamma': 0.0008743688536278467}. Best is trial 149 with value: -0.9678745631850254.
[I 2026-07-17 12:29:57,143] Trial 150 finished with value: -0.9287418546802395 and parameters: {'scalers': 'none', 'ratios': 'log_ratio', 'imputers': 'median', 'n_estimators': 2900, 'learning_rate': 0.4063907665610951, 'max_depth': 10, 'min_child_weight': 1, 'subsample': 0.6, 'colsample_bytree': 0.9, 'colsample_bylevel': 0.5, 'reg_alpha': 0.0037995888149146154, 'reg_lambda': 98.63684147329575, 'gamma': 0.0010892305189633134}. Best is trial 149 with value: -0.9678745631850254.
[I 2026-07-17 12:30:21,496] Trial 151 finished with value: -0.5074836318358203 and parameters: {'scalers': 'none', 'ratios': 'log_ratio', 'imputers': 'median', 'n_estimators': 2800, 'learning_rate': 0.2955459781621588, 'max_depth': 10, 'min_child_weight': 1, 'subsample': 0.6, 'colsample_bytree': 0.9, 'colsample_bylevel': 0.5, 'reg_alpha': 0.0052151957860127485, 'reg_lambda': 89.42395232266313, 'gamma': 0.0007637120957657631}. Best is trial 149 with value: -0.9678745631850254.
[I 2026-07-17 12:30:45,279] Trial 152 finished with value: -0.5109923479665739 and parameters: {'scalers': 'none', 'ratios': 'log_ratio', 'imputers': 'median', 'n_estimators': 2800, 'learning_rate': 0.301241824960227, 'max_depth': 10, 'min_child_weight': 1, 'subsample': 0.6, 'colsample_bytree': 0.9, 'colsample_bylevel': 0.5, 'reg_alpha': 0.0036873678384801716, 'reg_lambda': 95.40566286255982, 'gamma': 0.0012422196763910455}. Best is trial 149 with value: -0.9678745631850254.
[I 2026-07-17 12:31:09,260] Trial 153 finished with value: -0.5086888089890185 and parameters: {'scalers': 'none', 'ratios': 'log_ratio', 'imputers': 'median', 'n_estimators': 2800, 'learning_rate': 0.2954353212520693, 'max_depth': 10, 'min_child_weight': 1, 'subsample': 0.6, 'colsample_bytree': 0.9, 'colsample_bylevel': 0.5, 'reg_alpha': 0.005057168722094631, 'reg_lambda': 98.10668906723419, 'gamma': 0.0009663835633780686}. Best is trial 149 with value: -0.9678745631850254.
[I 2026-07-17 12:31:33,931] Trial 154 finished with value: -0.40822865084926746 and parameters: {'scalers': 'none', 'ratios': 'log_ratio', 'imputers': 'median', 'n_estimators': 2800, 'learning_rate': 0.24641497105096427, 'max_depth': 10, 'min_child_weight': 1, 'subsample': 0.6, 'colsample_bytree': 1.0, 'colsample_bylevel': 0.5, 'reg_alpha': 0.005383298091219699, 'reg_lambda': 87.4225350357022, 'gamma': 0.0008837854766025677}. Best is trial 149 with value: -0.9678745631850254.
[I 2026-07-17 12:31:57,151] Trial 155 finished with value: -0.4146912347151275 and parameters: {'scalers': 'none', 'ratios': 'log_ratio', 'imputers': 'median', 'n_estimators': 2800, 'learning_rate': 0.23790955634127794, 'max_depth': 10, 'min_child_weight': 1, 'subsample': 0.6, 'colsample_bytree': 0.9, 'colsample_bylevel': 0.5, 'reg_alpha': 0.007525198325953514, 'reg_lambda': 84.91086303275053, 'gamma': 0.0010396374243939678}. Best is trial 149 with value: -0.9678745631850254.
[I 2026-07-17 12:32:20,920] Trial 156 finished with value: -0.40259359008233064 and parameters: {'scalers': 'none', 'ratios': 'log_ratio', 'imputers': 'median', 'n_estimators': 2700, 'learning_rate': 0.2344375106834057, 'max_depth': 10, 'min_child_weight': 1, 'subsample': 0.6, 'colsample_bytree': 1.0, 'colsample_bylevel': 0.5, 'reg_alpha': 0.004157579228722606, 'reg_lambda': 84.4394667360206, 'gamma': 0.0011939626984467553}. Best is trial 149 with value: -0.9678745631850254.
[I 2026-07-17 12:32:46,619] Trial 157 finished with value: -0.7799012393813439 and parameters: {'scalers': 'none', 'ratios': 'log_ratio', 'imputers': 'median', 'n_estimators': 2700, 'learning_rate': 0.4055620630993168, 'max_depth': 10, 'min_child_weight': 1, 'subsample': 0.6, 'colsample_bytree': 0.9, 'colsample_bylevel': 0.5, 'reg_alpha': 0.007529391194385858, 'reg_lambda': 65.59522364043464, 'gamma': 0.001248410183231711}. Best is trial 149 with value: -0.9678745631850254.
[I 2026-07-17 12:33:11,405] Trial 158 finished with value: -0.8429863786940224 and parameters: {'scalers': 'none', 'ratios': 'log_ratio', 'imputers': 'median', 'n_estimators': 2700, 'learning_rate': 0.401539619680769, 'max_depth': 10, 'min_child_weight': 1, 'subsample': 0.6, 'colsample_bytree': 0.9, 'colsample_bylevel': 0.5, 'reg_alpha': 0.005067473368241084, 'reg_lambda': 93.98587084030892, 'gamma': 0.0011626366437134368}. Best is trial 149 with value: -0.9678745631850254.
[I 2026-07-17 12:33:34,609] Trial 159 finished with value: -0.43111338217964973 and parameters: {'scalers': 'none', 'ratios': 'log_ratio', 'imputers': 'median', 'n_estimators': 2700, 'learning_rate': 0.24545636300827417, 'max_depth': 10, 'min_child_weight': 1, 'subsample': 0.6, 'colsample_bytree': 0.9, 'colsample_bylevel': 0.5, 'reg_alpha': 0.005567595886197606, 'reg_lambda': 67.03164607981202, 'gamma': 0.0007060090207730887}. Best is trial 149 with value: -0.9678745631850254.
[I 2026-07-17 12:33:58,389] Trial 160 finished with value: -0.4060525934252379 and parameters: {'scalers': 'none', 'ratios': 'log_ratio', 'imputers': 'median', 'n_estimators': 2800, 'learning_rate': 0.24024263147489502, 'max_depth': 10, 'min_child_weight': 1, 'subsample': 0.6, 'colsample_bytree': 0.9, 'colsample_bylevel': 0.5, 'reg_alpha': 0.0063778813410027245, 'reg_lambda': 56.949406908018005, 'gamma': 0.0014019677313288463}. Best is trial 149 with value: -0.9678745631850254.
[I 2026-07-17 12:34:24,892] Trial 161 finished with value: -0.7793191537007775 and parameters: {'scalers': 'none', 'ratios': 'log_ratio', 'imputers': 'median', 'n_estimators': 2700, 'learning_rate': 0.4011784605380301, 'max_depth': 10, 'min_child_weight': 1, 'subsample': 0.6, 'colsample_bytree': 0.9, 'colsample_bylevel': 0.5, 'reg_alpha': 0.009683053198942004, 'reg_lambda': 54.49950047746761, 'gamma': 0.0011000251932868055}. Best is trial 149 with value: -0.9678745631850254.
[I 2026-07-17 12:34:51,281] Trial 162 finished with value: -0.7756389001030507 and parameters: {'scalers': 'none', 'ratios': 'log_ratio', 'imputers': 'median', 'n_estimators': 2700, 'learning_rate': 0.41207862399520606, 'max_depth': 10, 'min_child_weight': 1, 'subsample': 0.6, 'colsample_bytree': 0.9, 'colsample_bylevel': 0.5, 'reg_alpha': 0.009942963747780992, 'reg_lambda': 57.39294015825779, 'gamma': 0.001587077341411271}. Best is trial 149 with value: -0.9678745631850254.
[I 2026-07-17 12:35:18,250] Trial 163 finished with value: -0.8479615976788084 and parameters: {'scalers': 'none', 'ratios': 'log_ratio', 'imputers': 'median', 'n_estimators': 2700, 'learning_rate': 0.4339982789928366, 'max_depth': 10, 'min_child_weight': 1, 'subsample': 0.6, 'colsample_bytree': 0.9, 'colsample_bylevel': 0.5, 'reg_alpha': 0.0025793285497213462, 'reg_lambda': 51.22209998284318, 'gamma': 0.001750225201962004}. Best is trial 149 with value: -0.9678745631850254.
[I 2026-07-17 12:35:44,378] Trial 164 finished with value: -0.7502727003475966 and parameters: {'scalers': 'none', 'ratios': 'log_ratio', 'imputers': 'median', 'n_estimators': 2700, 'learning_rate': 0.40735818248694694, 'max_depth': 10, 'min_child_weight': 1, 'subsample': 0.6, 'colsample_bytree': 0.9, 'colsample_bylevel': 0.5, 'reg_alpha': 0.0031834318462203776, 'reg_lambda': 53.86416286931603, 'gamma': 0.0016578123839776165}. Best is trial 149 with value: -0.9678745631850254.
[I 2026-07-17 12:35:59,232] Trial 166 finished with value: -0.05835298833526853 and parameters: {'scalers': 'none', 'ratios': 'log_ratio', 'imputers': 'median', 'n_estimators': 2700, 'learning_rate': 0.40501884967177115, 'max_depth': 10, 'min_child_weight': 1, 'subsample': 0.6, 'colsample_bytree': 0.9, 'colsample_bylevel': 0.5, 'reg_alpha': 0.025759013943040032, 'reg_lambda': 56.2361360285228, 'gamma': 3.866210616734788}. Best is trial 149 with value: -0.9678745631850254.
[I 2026-07-17 12:36:10,640] Trial 165 finished with value: -0.7979441983060437 and parameters: {'scalers': 'none', 'ratios': 'log_ratio', 'imputers': 'median', 'n_estimators': 2700, 'learning_rate': 0.41774978997318374, 'max_depth': 10, 'min_child_weight': 1, 'subsample': 0.6, 'colsample_bytree': 0.9, 'colsample_bylevel': 0.5, 'reg_alpha': 0.014335674003408667, 'reg_lambda': 55.231401794997026, 'gamma': 0.0019191854893221008}. Best is trial 149 with value: -0.9678745631850254.
[I 2026-07-17 12:36:34,926] Trial 167 finished with value: -0.6886424639613674 and parameters: {'scalers': 'none', 'ratios': 'log_ratio', 'imputers': 'median', 'n_estimators': 2500, 'learning_rate': 0.39999964993913034, 'max_depth': 10, 'min_child_weight': 1, 'subsample': 0.6, 'colsample_bytree': 0.9, 'colsample_bylevel': 0.5, 'reg_alpha': 0.0023437369174585114, 'reg_lambda': 48.71352355755102, 'gamma': 0.0017825216561659944}. Best is trial 149 with value: -0.9678745631850254.
[I 2026-07-17 12:37:03,032] Trial 168 finished with value: -0.7714577323007392 and parameters: {'scalers': 'none', 'ratios': 'log_ratio', 'imputers': 'median', 'n_estimators': 2900, 'learning_rate': 0.40767842271456106, 'max_depth': 10, 'min_child_weight': 1, 'subsample': 0.6, 'colsample_bytree': 0.9, 'colsample_bylevel': 0.5, 'reg_alpha': 0.0029108139848177854, 'reg_lambda': 52.84504021311762, 'gamma': 0.0017974060002986483}. Best is trial 149 with value: -0.9678745631850254.
[I 2026-07-17 12:37:31,399] Trial 169 finished with value: -0.7641029779944394 and parameters: {'scalers': 'none', 'ratios': 'log_ratio', 'imputers': 'median', 'n_estimators': 2900, 'learning_rate': 0.4077751863840638, 'max_depth': 10, 'min_child_weight': 1, 'subsample': 0.6, 'colsample_bytree': 0.9, 'colsample_bylevel': 0.5, 'reg_alpha': 0.012667843271300633, 'reg_lambda': 49.65746046972229, 'gamma': 0.0017747210757608927}. Best is trial 149 with value: -0.9678745631850254.
[I 2026-07-17 12:37:59,539] Trial 170 finished with value: -0.7211218825968593 and parameters: {'scalers': 'none', 'ratios': 'log_ratio', 'imputers': 'median', 'n_estimators': 2900, 'learning_rate': 0.402967969290011, 'max_depth': 10, 'min_child_weight': 1, 'subsample': 0.6, 'colsample_bytree': 0.9, 'colsample_bylevel': 0.5, 'reg_alpha': 0.01764281987915726, 'reg_lambda': 47.917865605390176, 'gamma': 0.0020171131243760525}. Best is trial 149 with value: -0.9678745631850254.
[I 2026-07-17 12:38:24,165] Trial 171 finished with value: -0.6617738897634639 and parameters: {'scalers': 'none', 'ratios': 'log_ratio', 'imputers': 'median', 'n_estimators': 2500, 'learning_rate': 0.3967169546704486, 'max_depth': 10, 'min_child_weight': 1, 'subsample': 0.6, 'colsample_bytree': 0.9, 'colsample_bylevel': 0.5, 'reg_alpha': 0.029500073057701703, 'reg_lambda': 49.90968032756531, 'gamma': 0.0019038261286392125}. Best is trial 149 with value: -0.9678745631850254.
[I 2026-07-17 12:38:52,592] Trial 172 finished with value: -0.8547393512898711 and parameters: {'scalers': 'none', 'ratios': 'log_ratio', 'imputers': 'median', 'n_estimators': 2900, 'learning_rate': 0.42660523280646445, 'max_depth': 10, 'min_child_weight': 1, 'subsample': 0.6, 'colsample_bytree': 0.9, 'colsample_bylevel': 0.5, 'reg_alpha': 0.012054327689421735, 'reg_lambda': 51.39580390443671, 'gamma': 0.0018526953027737535}. Best is trial 149 with value: -0.9678745631850254.
[I 2026-07-17 12:39:17,888] Trial 173 finished with value: -0.5815006372656373 and parameters: {'scalers': 'none', 'ratios': 'log_ratio', 'imputers': 'median', 'n_estimators': 2500, 'learning_rate': 0.4056328223652881, 'max_depth': 10, 'min_child_weight': 1, 'subsample': 0.6, 'colsample_bytree': 0.9, 'colsample_bylevel': 0.5, 'reg_alpha': 0.014259576234690527, 'reg_lambda': 21.897063758066306, 'gamma': 0.002022958959366743}. Best is trial 149 with value: -0.9678745631850254.
[I 2026-07-17 12:39:45,544] Trial 174 finished with value: -0.7991305617373079 and parameters: {'scalers': 'none', 'ratios': 'log_ratio', 'imputers': 'median', 'n_estimators': 2550, 'learning_rate': 0.4104181951741569, 'max_depth': 11, 'min_child_weight': 1, 'subsample': 0.6, 'colsample_bytree': 0.9, 'colsample_bylevel': 0.5, 'reg_alpha': 0.002503193555204766, 'reg_lambda': 48.60474385508868, 'gamma': 0.0019073456353664471}. Best is trial 149 with value: -0.9678745631850254.
[I 2026-07-17 12:40:13,336] Trial 175 finished with value: -0.821551426436727 and parameters: {'scalers': 'none', 'ratios': 'log_ratio', 'imputers': 'median', 'n_estimators': 2550, 'learning_rate': 0.418418915397564, 'max_depth': 11, 'min_child_weight': 1, 'subsample': 0.6, 'colsample_bytree': 0.9, 'colsample_bylevel': 0.5, 'reg_alpha': 0.012197582581561424, 'reg_lambda': 46.40152523904354, 'gamma': 0.0019715416833385145}. Best is trial 149 with value: -0.9678745631850254.
[I 2026-07-17 12:40:40,897] Trial 176 finished with value: -0.8089043106304066 and parameters: {'scalers': 'none', 'ratios': 'log_ratio', 'imputers': 'median', 'n_estimators': 2550, 'learning_rate': 0.41245176543970935, 'max_depth': 11, 'min_child_weight': 1, 'subsample': 0.6, 'colsample_bytree': 0.9, 'colsample_bylevel': 0.5, 'reg_alpha': 0.014641981211676596, 'reg_lambda': 49.180109343273976, 'gamma': 0.002007465193259446}. Best is trial 149 with value: -0.9678745631850254.
[I 2026-07-17 12:41:08,980] Trial 177 finished with value: -0.7213644589485919 and parameters: {'scalers': 'none', 'ratios': 'log_ratio', 'imputers': 'median', 'n_estimators': 2550, 'learning_rate': 0.4060056574963806, 'max_depth': 11, 'min_child_weight': 1, 'subsample': 0.6, 'colsample_bytree': 0.9, 'colsample_bylevel': 0.5, 'reg_alpha': 0.012114957684869029, 'reg_lambda': 38.8913718633573, 'gamma': 0.0019952574996754844}. Best is trial 149 with value: -0.9678745631850254.
[I 2026-07-17 12:41:33,627] Trial 178 finished with value: -0.7001360835207847 and parameters: {'scalers': 'none', 'ratios': 'log_ratio', 'imputers': 'median', 'n_estimators': 2500, 'learning_rate': 0.4153453742951405, 'max_depth': 10, 'min_child_weight': 1, 'subsample': 0.6, 'colsample_bytree': 0.9, 'colsample_bylevel': 0.5, 'reg_alpha': 0.014393899427640163, 'reg_lambda': 43.511883342519866, 'gamma': 0.0024947597715589166}. Best is trial 149 with value: -0.9678745631850254.
[I 2026-07-17 12:42:01,494] Trial 179 finished with value: -0.7468320396572243 and parameters: {'scalers': 'none', 'ratios': 'log_ratio', 'imputers': 'median', 'n_estimators': 2550, 'learning_rate': 0.4100655618520035, 'max_depth': 11, 'min_child_weight': 1, 'subsample': 0.6, 'colsample_bytree': 0.9, 'colsample_bylevel': 0.5, 'reg_alpha': 0.013493457737171114, 'reg_lambda': 41.28170068850167, 'gamma': 0.00198464718626227}. Best is trial 149 with value: -0.9678745631850254.
