[I 2026-07-17 11:37:51,889] Trial 90 finished with value: -0.3269161971214549 and parameters: {'scalers': 'none', 'ratios': 'log_ratio', 'imputers': 'none', 'n_estimators': 200, 'learning_rate': 0.0003462136189559823, 'max_depth': 7, 'min_child_weight': 10, 'subsample': 0.5, 'colsample_bytree': 0.5, 'colsample_bylevel': 0.6, 'reg_alpha': 0.0026409306567520764, 'reg_lambda': 5.078896074475105e-06, 'gamma': 3.219926241135366e-05}. Best is trial 76 with value: -0.33331364162222676.
[I 2026-07-17 11:37:53,037] Trial 91 finished with value: -0.33135671729747856 and parameters: {'scalers': 'none', 'ratios': 'log_ratio', 'imputers': 'none', 'n_estimators': 200, 'learning_rate': 0.00013671345586939107, 'max_depth': 7, 'min_child_weight': 10, 'subsample': 0.5, 'colsample_bytree': 0.5, 'colsample_bylevel': 0.6, 'reg_alpha': 0.013275073450255926, 'reg_lambda': 0.00012072746061242488, 'gamma': 3.349512781984812e-05}. Best is trial 76 with value: -0.33331364162222676.
[I 2026-07-17 11:37:54,113] Trial 92 finished with value: -0.3275154980138424 and parameters: {'scalers': 'none', 'ratios': 'log_ratio', 'imputers': 'none', 'n_estimators': 200, 'learning_rate': 0.0003207692702598528, 'max_depth': 7, 'min_child_weight': 10, 'subsample': 0.5, 'colsample_bytree': 0.5, 'colsample_bylevel': 0.6, 'reg_alpha': 0.014276943381451196, 'reg_lambda': 0.00012694582707333855, 'gamma': 0.010200560843706142}. Best is trial 76 with value: -0.33331364162222676.
[I 2026-07-17 11:37:55,180] Trial 93 finished with value: -0.33035130360131354 and parameters: {'scalers': 'none', 'ratios': 'log_ratio', 'imputers': 'none', 'n_estimators': 200, 'learning_rate': 0.00019329925242296745, 'max_depth': 7, 'min_child_weight': 10, 'subsample': 0.5, 'colsample_bytree': 0.5, 'colsample_bylevel': 0.6, 'reg_alpha': 0.012439516615960261, 'reg_lambda': 0.00014891864025803883, 'gamma': 0.0509043921926305}. Best is trial 76 with value: -0.33331364162222676.
[I 2026-07-17 11:37:56,636] Trial 94 finished with value: -0.3302250300329998 and parameters: {'scalers': 'none', 'ratios': 'log_ratio', 'imputers': 'median', 'n_estimators': 200, 'learning_rate': 0.00019037955714198824, 'max_depth': 9, 'min_child_weight': 10, 'subsample': 0.5, 'colsample_bytree': 0.5, 'colsample_bylevel': 0.6, 'reg_alpha': 0.012733511550268006, 'reg_lambda': 0.00014297039612879895, 'gamma': 3.8564739969220215e-05}. Best is trial 76 with value: -0.33331364162222676.
[I 2026-07-17 11:37:58,008] Trial 95 finished with value: -0.3271881767123233 and parameters: {'scalers': 'none', 'ratios': 'log_ratio', 'imputers': 'median', 'n_estimators': 200, 'learning_rate': 0.00033764294723900536, 'max_depth': 9, 'min_child_weight': 10, 'subsample': 0.6, 'colsample_bytree': 0.5, 'colsample_bylevel': 0.6, 'reg_alpha': 0.011220365672088301, 'reg_lambda': 0.00013783389968366578, 'gamma': 0.06847074030220646}. Best is trial 76 with value: -0.33331364162222676.
[I 2026-07-17 11:37:59,762] Trial 96 finished with value: -0.32531218704383924 and parameters: {'scalers': 'none', 'ratios': 'log_ratio', 'imputers': 'median', 'n_estimators': 250, 'learning_rate': 0.00033321246395663276, 'max_depth': 9, 'min_child_weight': 9, 'subsample': 0.6, 'colsample_bytree': 0.5, 'colsample_bylevel': 0.6, 'reg_alpha': 0.006554260823458907, 'reg_lambda': 0.00010881297542583116, 'gamma': 0.07402900294941937}. Best is trial 76 with value: -0.33331364162222676.
[I 2026-07-17 11:38:03,658] Trial 97 finished with value: -0.3246549358426054 and parameters: {'scalers': 'none', 'ratios': 'log_ratio', 'imputers': 'median', 'n_estimators': 500, 'learning_rate': 0.00018584750813189553, 'max_depth': 9, 'min_child_weight': 9, 'subsample': 0.6, 'colsample_bytree': 0.5, 'colsample_bylevel': 0.6, 'reg_alpha': 0.01220081188806609, 'reg_lambda': 3.668354088085841e-05, 'gamma': 2.7779288673846193e-05}. Best is trial 76 with value: -0.33331364162222676.
[I 2026-07-17 11:38:06,529] Trial 98 finished with value: -0.3264442086878413 and parameters: {'scalers': 'none', 'ratios': 'log_ratio', 'imputers': 'none', 'n_estimators': 250, 'learning_rate': 0.0001819379105910936, 'max_depth': 9, 'min_child_weight': 9, 'subsample': 0.6, 'colsample_bytree': 0.9, 'colsample_bylevel': 1.0, 'reg_alpha': 0.006530807101735926, 'reg_lambda': 0.0009676339816896374, 'gamma': 0.16044276615972428}. Best is trial 76 with value: -0.33331364162222676.
[I 2026-07-17 11:38:08,848] Trial 99 finished with value: -0.31982341385562363 and parameters: {'scalers': 'none', 'ratios': 'log_ratio', 'imputers': 'median', 'n_estimators': 500, 'learning_rate': 0.00019484374736850356, 'max_depth': 4, 'min_child_weight': 9, 'subsample': 0.6, 'colsample_bytree': 0.8, 'colsample_bylevel': 1.0, 'reg_alpha': 0.007152818150866894, 'reg_lambda': 0.0011314137697640849, 'gamma': 0.26624842455788833}. Best is trial 76 with value: -0.33331364162222676.
[I 2026-07-17 11:38:11,744] Trial 100 finished with value: -0.32585616124709765 and parameters: {'scalers': 'none', 'ratios': 'log_ratio', 'imputers': 'median', 'n_estimators': 250, 'learning_rate': 0.00019601924357739956, 'max_depth': 9, 'min_child_weight': 9, 'subsample': 0.6, 'colsample_bytree': 0.9, 'colsample_bylevel': 1.0, 'reg_alpha': 0.007057504860759575, 'reg_lambda': 3.718148457467036e-05, 'gamma': 0.16832206631883262}. Best is trial 76 with value: -0.33331364162222676.
[I 2026-07-17 11:38:17,536] Trial 101 finished with value: -0.3187618282752101 and parameters: {'scalers': 'none', 'ratios': 'log_ratio', 'imputers': 'median', 'n_estimators': 500, 'learning_rate': 0.0001857774603865153, 'max_depth': 9, 'min_child_weight': 9, 'subsample': 0.6, 'colsample_bytree': 0.9, 'colsample_bylevel': 1.0, 'reg_alpha': 0.006577691291151718, 'reg_lambda': 3.803195566842336e-05, 'gamma': 0.1559160844965141}. Best is trial 76 with value: -0.33331364162222676.
[I 2026-07-17 11:38:22,263] Trial 102 finished with value: -0.3239524227914211 and parameters: {'scalers': 'none', 'ratios': 'log_ratio', 'imputers': 'none', 'n_estimators': 500, 'learning_rate': 0.00013157180747617, 'max_depth': 8, 'min_child_weight': 9, 'subsample': 0.6, 'colsample_bytree': 0.8, 'colsample_bylevel': 1.0, 'reg_alpha': 0.005953520706077644, 'reg_lambda': 3.7674585845260655e-05, 'gamma': 0.1951191774170945}. Best is trial 76 with value: -0.33331364162222676.
[I 2026-07-17 11:38:27,523] Trial 103 finished with value: -0.3232783394058589 and parameters: {'scalers': 'none', 'ratios': 'log_ratio', 'imputers': 'none', 'n_estimators': 500, 'learning_rate': 0.00012967183226580514, 'max_depth': 8, 'min_child_weight': 9, 'subsample': 0.6, 'colsample_bytree': 0.9, 'colsample_bylevel': 1.0, 'reg_alpha': 0.006026333153932521, 'reg_lambda': 4.7660258040634597e-05, 'gamma': 0.1461794580117177}. Best is trial 76 with value: -0.33331364162222676.
[I 2026-07-17 11:38:32,150] Trial 104 finished with value: -0.3231491096316659 and parameters: {'scalers': 'none', 'ratios': 'log_ratio', 'imputers': 'none', 'n_estimators': 500, 'learning_rate': 0.00013104170163586034, 'max_depth': 8, 'min_child_weight': 9, 'subsample': 0.6, 'colsample_bytree': 0.9, 'colsample_bylevel': 1.0, 'reg_alpha': 0.006514612842663437, 'reg_lambda': 2.418095208949336, 'gamma': 0.2289331117275233}. Best is trial 76 with value: -0.33331364162222676.
[I 2026-07-17 11:38:33,629] Trial 105 finished with value: -0.3281029920525176 and parameters: {'scalers': 'none', 'ratios': 'log_ratio', 'imputers': 'none', 'n_estimators': 300, 'learning_rate': 0.00013135721609202207, 'max_depth': 4, 'min_child_weight': 9, 'subsample': 0.6, 'colsample_bytree': 0.8, 'colsample_bylevel': 1.0, 'reg_alpha': 0.0062707929490978705, 'reg_lambda': 0.0010977853950189763, 'gamma': 0.17951891403912262}. Best is trial 76 with value: -0.33331364162222676.
[I 2026-07-17 11:38:34,315] Trial 106 finished with value: -0.3321773104420906 and parameters: {'scalers': 'none', 'ratios': 'log_ratio', 'imputers': 'none', 'n_estimators': 100, 'learning_rate': 0.00012940133420987447, 'max_depth': 8, 'min_child_weight': 9, 'subsample': 0.6, 'colsample_bytree': 0.8, 'colsample_bylevel': 1.0, 'reg_alpha': 0.035026529873202095, 'reg_lambda': 0.003314894600720796, 'gamma': 0.20483100910670632}. Best is trial 76 with value: -0.33331364162222676.
[I 2026-07-17 11:38:35,710] Trial 107 finished with value: -0.3321779905344246 and parameters: {'scalers': 'none', 'ratios': 'log_ratio', 'imputers': 'none', 'n_estimators': 100, 'learning_rate': 0.00013232450155979417, 'max_depth': 8, 'min_child_weight': 3, 'subsample': 0.6, 'colsample_bytree': 0.8, 'colsample_bylevel': 0.8, 'reg_alpha': 0.00082845061858238, 'reg_lambda': 1.760097304054775, 'gamma': 2.1242005885565133e-06}. Best is trial 76 with value: -0.33331364162222676.
[I 2026-07-17 11:38:36,423] Trial 108 finished with value: -0.33284938339400666 and parameters: {'scalers': 'none', 'ratios': 'log_ratio', 'imputers': 'none', 'n_estimators': 100, 'learning_rate': 0.00013104853796699057, 'max_depth': 8, 'min_child_weight': 10, 'subsample': 0.6, 'colsample_bytree': 0.5, 'colsample_bylevel': 0.9, 'reg_alpha': 0.0010027134717585924, 'reg_lambda': 2.2215932346419166e-06, 'gamma': 1.8445765020284093e-06}. Best is trial 76 with value: -0.33331364162222676.
[I 2026-07-17 11:38:36,601] Trial 109 finished with value: -0.3330308060452791 and parameters: {'scalers': 'none', 'ratios': 'log_ratio', 'imputers': 'none', 'n_estimators': 100, 'learning_rate': 0.00013234416459740277, 'max_depth': 8, 'min_child_weight': 10, 'subsample': 0.6, 'colsample_bytree': 0.5, 'colsample_bylevel': 0.9, 'reg_alpha': 0.07752876466070971, 'reg_lambda': 0.0003782768394918038, 'gamma': 1.742726842815447}. Best is trial 76 with value: -0.33331364162222676.
[I 2026-07-17 11:38:37,372] Trial 110 finished with value: -0.3329726730934813 and parameters: {'scalers': 'none', 'ratios': 'log_ratio', 'imputers': 'none', 'n_estimators': 100, 'learning_rate': 0.00012253730893098275, 'max_depth': 8, 'min_child_weight': 10, 'subsample': 0.6, 'colsample_bytree': 0.5, 'colsample_bylevel': 0.9, 'reg_alpha': 0.0038105600180021295, 'reg_lambda': 0.0003695492125769547, 'gamma': 2.2394746265442347e-06}. Best is trial 76 with value: -0.33331364162222676.
[I 2026-07-17 11:38:38,024] Trial 111 finished with value: -0.33278278895260904 and parameters: {'scalers': 'none', 'ratios': 'log_ratio', 'imputers': 'none', 'n_estimators': 100, 'learning_rate': 0.00013213201253654805, 'max_depth': 7, 'min_child_weight': 10, 'subsample': 0.5, 'colsample_bytree': 0.5, 'colsample_bylevel': 0.8, 'reg_alpha': 0.06689927431743997, 'reg_lambda': 0.003071455928110189, 'gamma': 2.1461354033948837e-06}. Best is trial 76 with value: -0.33331364162222676.
[I 2026-07-17 11:38:38,628] Trial 112 finished with value: -0.3325892951158108 and parameters: {'scalers': 'none', 'ratios': 'log_ratio', 'imputers': 'none', 'n_estimators': 100, 'learning_rate': 0.00014961935213596048, 'max_depth': 7, 'min_child_weight': 10, 'subsample': 0.5, 'colsample_bytree': 0.5, 'colsample_bylevel': 0.8, 'reg_alpha': 0.08113965344585763, 'reg_lambda': 4.414657293934437e-06, 'gamma': 1.9553760769735915e-06}. Best is trial 76 with value: -0.33331364162222676.
[I 2026-07-17 11:38:39,645] Trial 113 finished with value: -0.33131582012911087 and parameters: {'scalers': 'none', 'ratios': 'log_ratio', 'imputers': 'none', 'n_estimators': 100, 'learning_rate': 0.00015813961282529004, 'max_depth': 7, 'min_child_weight': 10, 'subsample': 0.5, 'colsample_bytree': 1.0, 'colsample_bylevel': 0.8, 'reg_alpha': 0.08221042158770604, 'reg_lambda': 0.0032463583105352156, 'gamma': 2.051080510509092e-06}. Best is trial 76 with value: -0.33331364162222676.
[I 2026-07-17 11:38:41,223] Trial 114 finished with value: -0.3313027631056261 and parameters: {'scalers': 'none', 'ratios': 'log_ratio', 'imputers': 'none', 'n_estimators': 100, 'learning_rate': 0.00015523942982736014, 'max_depth': 7, 'min_child_weight': 2, 'subsample': 0.7, 'colsample_bytree': 1.0, 'colsample_bylevel': 0.9, 'reg_alpha': 0.07886524248885225, 'reg_lambda': 0.003939476406694602, 'gamma': 2.0822897963787565e-06}. Best is trial 76 with value: -0.33331364162222676.
[I 2026-07-17 11:38:43,145] Trial 115 finished with value: -0.32953516659252446 and parameters: {'scalers': 'none', 'ratios': 'log_ratio', 'imputers': 'mean', 'n_estimators': 150, 'learning_rate': 0.00016565807571578543, 'max_depth': 7, 'min_child_weight': 4, 'subsample': 0.7, 'colsample_bytree': 1.0, 'colsample_bylevel': 0.8, 'reg_alpha': 0.0010277319398287537, 'reg_lambda': 17.585416049266502, 'gamma': 1.8393819859212276e-06}. Best is trial 76 with value: -0.33331364162222676.
[I 2026-07-17 11:38:44,231] Trial 116 finished with value: -0.3317102574117915 and parameters: {'scalers': 'none', 'ratios': 'log_ratio', 'imputers': 'mean', 'n_estimators': 150, 'learning_rate': 0.00015549616088747246, 'max_depth': 7, 'min_child_weight': 10, 'subsample': 0.7, 'colsample_bytree': 0.5, 'colsample_bylevel': 0.9, 'reg_alpha': 0.0010500744675781388, 'reg_lambda': 0.00036561606226003874, 'gamma': 1.9568927183032504e-06}. Best is trial 76 with value: -0.33331364162222676.
[I 2026-07-17 11:38:45,328] Trial 117 finished with value: -0.33168958154018197 and parameters: {'scalers': 'robust', 'ratios': 'log_ratio', 'imputers': 'mean', 'n_estimators': 150, 'learning_rate': 0.00015666551836391148, 'max_depth': 7, 'min_child_weight': 10, 'subsample': 0.7, 'colsample_bytree': 0.5, 'colsample_bylevel': 0.9, 'reg_alpha': 0.03260269801680348, 'reg_lambda': 1.1447034232659659e-06, 'gamma': 2.132986243509938e-06}. Best is trial 76 with value: -0.33331364162222676.
[I 2026-07-17 11:38:46,398] Trial 118 finished with value: -0.33166824438249254 and parameters: {'scalers': 'none', 'ratios': 'log_ratio', 'imputers': 'none', 'n_estimators': 150, 'learning_rate': 0.00015770602544975013, 'max_depth': 7, 'min_child_weight': 10, 'subsample': 0.7, 'colsample_bytree': 0.5, 'colsample_bylevel': 0.9, 'reg_alpha': 0.06562944591418875, 'reg_lambda': 1.4871246818737848e-06, 'gamma': 1.9358299853156913e-06}. Best is trial 76 with value: -0.33331364162222676.
[I 2026-07-17 11:38:47,656] Trial 119 finished with value: -0.33163163656507993 and parameters: {'scalers': 'none', 'ratios': 'log_ratio', 'imputers': 'none', 'n_estimators': 150, 'learning_rate': 0.00016045589984358666, 'max_depth': 8, 'min_child_weight': 10, 'subsample': 0.7, 'colsample_bytree': 0.5, 'colsample_bylevel': 0.9, 'reg_alpha': 0.24064666820396916, 'reg_lambda': 0.00034572670915800617, 'gamma': 2.1173436280485726e-06}. Best is trial 76 with value: -0.33331364162222676.
[I 2026-07-17 11:38:48,639] Trial 120 finished with value: -0.33155359653083655 and parameters: {'scalers': 'none', 'ratios': 'log_ratio', 'imputers': 'none', 'n_estimators': 150, 'learning_rate': 0.0001637346223556444, 'max_depth': 7, 'min_child_weight': 10, 'subsample': 0.5, 'colsample_bytree': 0.5, 'colsample_bylevel': 0.9, 'reg_alpha': 0.03093583622057801, 'reg_lambda': 1.2264475737598672e-06, 'gamma': 1.7619400051018466e-06}. Best is trial 76 with value: -0.33331364162222676.
[I 2026-07-17 11:38:50,946] Trial 121 finished with value: -0.20178322049582273 and parameters: {'scalers': 'none', 'ratios': 'log_ratio', 'imputers': 'mean', 'n_estimators': 300, 'learning_rate': 0.10456742189397593, 'max_depth': 8, 'min_child_weight': 10, 'subsample': 0.7, 'colsample_bytree': 0.5, 'colsample_bylevel': 0.9, 'reg_alpha': 0.2092077435148024, 'reg_lambda': 7.949304589414576e-06, 'gamma': 3.3908660867050846e-06}. Best is trial 76 with value: -0.33331364162222676.
[I 2026-07-17 11:38:51,856] Trial 122 finished with value: -0.3298366377127031 and parameters: {'scalers': 'none', 'ratios': 'log_ratio', 'imputers': 'mean', 'n_estimators': 300, 'learning_rate': 0.00015652908128946282, 'max_depth': 8, 'min_child_weight': 10, 'subsample': 0.5, 'colsample_bytree': 0.5, 'colsample_bylevel': 0.9, 'reg_alpha': 0.0010663454818995977, 'reg_lambda': 1.2020907840368588e-06, 'gamma': 1.746162698159609}. Best is trial 76 with value: -0.33331364162222676.
[I 2026-07-17 11:38:53,908] Trial 123 finished with value: -0.32713420153935263 and parameters: {'scalers': 'none', 'ratios': 'log_ratio', 'imputers': 'none', 'n_estimators': 300, 'learning_rate': 0.00022049842760779592, 'max_depth': 8, 'min_child_weight': 10, 'subsample': 0.5, 'colsample_bytree': 0.5, 'colsample_bylevel': 0.9, 'reg_alpha': 0.2503793708206067, 'reg_lambda': 1.20825599971431e-06, 'gamma': 3.820590516987871e-06}. Best is trial 76 with value: -0.33331364162222676.
[I 2026-07-17 11:38:54,885] Trial 124 finished with value: -0.3277583231572289 and parameters: {'scalers': 'none', 'ratios': 'log_ratio', 'imputers': 'none', 'n_estimators': 300, 'learning_rate': 0.00022274379523560316, 'max_depth': 8, 'min_child_weight': 10, 'subsample': 0.5, 'colsample_bytree': 0.5, 'colsample_bylevel': 0.9, 'reg_alpha': 0.03349563291375994, 'reg_lambda': 1.294886705265193e-06, 'gamma': 1.3481064890993695}. Best is trial 76 with value: -0.33331364162222676.
[I 2026-07-17 11:38:55,592] Trial 125 finished with value: -0.1958438521263813 and parameters: {'scalers': 'none', 'ratios': 'log_ratio', 'imputers': 'none', 'n_estimators': 250, 'learning_rate': 0.03385499387484284, 'max_depth': 8, 'min_child_weight': 10, 'subsample': 0.5, 'colsample_bytree': 0.5, 'colsample_bylevel': 0.9, 'reg_alpha': 0.29531137933176116, 'reg_lambda': 0.00019466671363261277, 'gamma': 1.1453340700971044}. Best is trial 76 with value: -0.33331364162222676.
[I 2026-07-17 11:38:56,572] Trial 126 finished with value: -0.3277638591937767 and parameters: {'scalers': 'none', 'ratios': 'log_ratio', 'imputers': 'none', 'n_estimators': 300, 'learning_rate': 0.00022466391068545874, 'max_depth': 8, 'min_child_weight': 10, 'subsample': 0.5, 'colsample_bytree': 0.5, 'colsample_bylevel': 0.9, 'reg_alpha': 0.23449692112148388, 'reg_lambda': 0.00021397232766190378, 'gamma': 1.3956215949036002}. Best is trial 76 with value: -0.33331364162222676.
[I 2026-07-17 11:38:58,613] Trial 127 finished with value: -0.3272586998901819 and parameters: {'scalers': 'none', 'ratios': 'log_ratio', 'imputers': 'none', 'n_estimators': 300, 'learning_rate': 0.0002197353305434158, 'max_depth': 8, 'min_child_weight': 10, 'subsample': 0.5, 'colsample_bytree': 0.5, 'colsample_bylevel': 0.9, 'reg_alpha': 0.22267113762749835, 'reg_lambda': 1.9343676290567794e-06, 'gamma': 4.4397687933091476e-06}. Best is trial 76 with value: -0.33331364162222676.
[I 2026-07-17 11:39:01,001] Trial 128 finished with value: -0.3303914751800302 and parameters: {'scalers': 'none', 'ratios': 'log_ratio', 'imputers': 'none', 'n_estimators': 300, 'learning_rate': 0.00011866536092800449, 'max_depth': 8, 'min_child_weight': 10, 'subsample': 0.6, 'colsample_bytree': 0.5, 'colsample_bylevel': 0.9, 'reg_alpha': 0.0016219772587873508, 'reg_lambda': 2.6115347891092683e-06, 'gamma': 4.130170703616724e-06}. Best is trial 76 with value: -0.33331364162222676.
[I 2026-07-17 11:39:03,323] Trial 129 finished with value: -0.3304371401838876 and parameters: {'scalers': 'none', 'ratios': 'log_ratio', 'imputers': 'none', 'n_estimators': 300, 'learning_rate': 0.00011806703772929651, 'max_depth': 8, 'min_child_weight': 10, 'subsample': 0.6, 'colsample_bytree': 0.5, 'colsample_bylevel': 0.9, 'reg_alpha': 0.0018650929621497705, 'reg_lambda': 0.00019965709220584274, 'gamma': 3.6260779078104592e-06}. Best is trial 76 with value: -0.33331364162222676.
[I 2026-07-17 11:39:04,534] Trial 130 finished with value: -0.3311111238742963 and parameters: {'scalers': 'none', 'ratios': 'log_ratio', 'imputers': 'none', 'n_estimators': 250, 'learning_rate': 0.00012278098471732102, 'max_depth': 8, 'min_child_weight': 10, 'subsample': 0.6, 'colsample_bytree': 0.5, 'colsample_bylevel': 0.9, 'reg_alpha': 0.0033443603711494014, 'reg_lambda': 2.1703899108089385e-06, 'gamma': 0.616155746506406}. Best is trial 76 with value: -0.33331364162222676.
[I 2026-07-17 11:39:06,077] Trial 131 finished with value: -0.32944230419885906 and parameters: {'scalers': 'none', 'ratios': 'log_ratio', 'imputers': 'none', 'n_estimators': 400, 'learning_rate': 0.00011810752487230993, 'max_depth': 6, 'min_child_weight': 10, 'subsample': 0.6, 'colsample_bytree': 0.5, 'colsample_bylevel': 0.9, 'reg_alpha': 0.0018142489314053264, 'reg_lambda': 3.0038511702252695e-06, 'gamma': 0.5483605089687722}. Best is trial 76 with value: -0.33331364162222676.
[I 2026-07-17 11:39:07,643] Trial 132 finished with value: -0.32946755176933423 and parameters: {'scalers': 'none', 'ratios': 'log_ratio', 'imputers': 'none', 'n_estimators': 400, 'learning_rate': 0.00011757745473061559, 'max_depth': 6, 'min_child_weight': 10, 'subsample': 0.6, 'colsample_bytree': 0.5, 'colsample_bylevel': 0.9, 'reg_alpha': 0.0018791563128526618, 'reg_lambda': 0.00023793485247674127, 'gamma': 0.5685367349935057}. Best is trial 76 with value: -0.33331364162222676.
[I 2026-07-17 11:39:07,999] Trial 133 finished with value: -0.33314134773415216 and parameters: {'scalers': 'none', 'ratios': 'norm_ratio', 'imputers': 'none', 'n_estimators': 100, 'learning_rate': 0.00011686056178259918, 'max_depth': 6, 'min_child_weight': 10, 'subsample': 0.6, 'colsample_bytree': 0.5, 'colsample_bylevel': 0.9, 'reg_alpha': 0.002102798651421335, 'reg_lambda': 2.8922244013444166e-06, 'gamma': 0.6542429403279023}. Best is trial 76 with value: -0.33331364162222676.
[I 2026-07-17 11:39:09,333] Trial 134 finished with value: -0.32948420188060046 and parameters: {'scalers': 'none', 'ratios': 'norm_ratio', 'imputers': 'none', 'n_estimators': 400, 'learning_rate': 0.00011985655079281275, 'max_depth': 6, 'min_child_weight': 10, 'subsample': 0.6, 'colsample_bytree': 0.5, 'colsample_bylevel': 0.8, 'reg_alpha': 0.0015312506291706278, 'reg_lambda': 0.0008128201292891247, 'gamma': 0.5998279069452128}. Best is trial 76 with value: -0.33331364162222676.
