[I 2026-07-17 11:39:10,799] Trial 135 finished with value: -0.32947905909625597 and parameters: {'scalers': 'none', 'ratios': 'norm_ratio', 'imputers': 'none', 'n_estimators': 400, 'learning_rate': 0.00012042009804655196, 'max_depth': 6, 'min_child_weight': 10, 'subsample': 0.6, 'colsample_bytree': 0.5, 'colsample_bylevel': 0.8, 'reg_alpha': 0.0034221978267013065, 'reg_lambda': 2.9973920838946604e-06, 'gamma': 0.5898073611287632}. Best is trial 76 with value: -0.33331364162222676.
[I 2026-07-17 11:39:12,289] Trial 136 finished with value: -0.32956971927686046 and parameters: {'scalers': 'standard', 'ratios': 'norm_ratio', 'imputers': 'none', 'n_estimators': 400, 'learning_rate': 0.00011663575464089803, 'max_depth': 6, 'min_child_weight': 10, 'subsample': 0.6, 'colsample_bytree': 0.5, 'colsample_bylevel': 0.8, 'reg_alpha': 0.003617753848945093, 'reg_lambda': 3.0689358074769066e-06, 'gamma': 0.49245027056531676}. Best is trial 76 with value: -0.33331364162222676.
[I 2026-07-17 11:39:12,700] Trial 137 finished with value: -0.3331824716684331 and parameters: {'scalers': 'standard', 'ratios': 'norm_ratio', 'imputers': 'none', 'n_estimators': 100, 'learning_rate': 0.00011801992812643084, 'max_depth': 6, 'min_child_weight': 10, 'subsample': 0.6, 'colsample_bytree': 0.5, 'colsample_bylevel': 0.8, 'reg_alpha': 0.0035719738858070826, 'reg_lambda': 0.019270628694877546, 'gamma': 0.6396162141448845}. Best is trial 76 with value: -0.33331364162222676.
[I 2026-07-17 11:39:13,493] Trial 138 finished with value: -0.3331230030089386 and parameters: {'scalers': 'robust', 'ratios': 'norm_ratio', 'imputers': 'none', 'n_estimators': 100, 'learning_rate': 0.00010708278943358526, 'max_depth': 7, 'min_child_weight': 10, 'subsample': 1.0, 'colsample_bytree': 0.5, 'colsample_bylevel': 0.9, 'reg_alpha': 0.0042285433106588255, 'reg_lambda': 0.0008312103132747801, 'gamma': 1.0253629467561616e-06}. Best is trial 76 with value: -0.33331364162222676.
[I 2026-07-17 11:39:14,106] Trial 139 finished with value: -0.33323766729079374 and parameters: {'scalers': 'robust', 'ratios': 'log_ratio', 'imputers': 'none', 'n_estimators': 100, 'learning_rate': 0.00010320648023084191, 'max_depth': 7, 'min_child_weight': 10, 'subsample': 1.0, 'colsample_bytree': 0.5, 'colsample_bylevel': 0.8, 'reg_alpha': 0.003913354583442632, 'reg_lambda': 0.0014986708238074224, 'gamma': 0.36860671865956196}. Best is trial 76 with value: -0.33331364162222676.
[I 2026-07-17 11:39:14,869] Trial 140 finished with value: -0.3331716863334391 and parameters: {'scalers': 'robust', 'ratios': 'norm_ratio', 'imputers': 'none', 'n_estimators': 100, 'learning_rate': 0.00010369347759285339, 'max_depth': 7, 'min_child_weight': 9, 'subsample': 1.0, 'colsample_bytree': 0.5, 'colsample_bylevel': 0.8, 'reg_alpha': 0.004149847355427671, 'reg_lambda': 0.0008931210243181453, 'gamma': 1.3177880290009158e-06}. Best is trial 76 with value: -0.33331364162222676.
[I 2026-07-17 11:39:15,498] Trial 141 finished with value: -0.3332738074933961 and parameters: {'scalers': 'standard', 'ratios': 'norm_ratio', 'imputers': 'none', 'n_estimators': 100, 'learning_rate': 0.00010023924726614814, 'max_depth': 7, 'min_child_weight': 10, 'subsample': 0.6, 'colsample_bytree': 0.5, 'colsample_bylevel': 0.8, 'reg_alpha': 0.0004741919509225471, 'reg_lambda': 3.6535680517544182e-06, 'gamma': 0.09154019016921137}. Best is trial 76 with value: -0.33331364162222676.
[I 2026-07-17 11:39:16,087] Trial 142 finished with value: -0.3332086444891901 and parameters: {'scalers': 'none', 'ratios': 'norm_ratio', 'imputers': 'none', 'n_estimators': 100, 'learning_rate': 0.00010440713353687038, 'max_depth': 7, 'min_child_weight': 9, 'subsample': 0.6, 'colsample_bytree': 0.5, 'colsample_bylevel': 0.9, 'reg_alpha': 0.003246108113063695, 'reg_lambda': 0.001796607834378495, 'gamma': 0.10092351906326455}. Best is trial 76 with value: -0.33331364162222676.
[I 2026-07-17 11:39:16,571] Trial 143 finished with value: -0.33323074111487955 and parameters: {'scalers': 'standard', 'ratios': 'norm_ratio', 'imputers': 'none', 'n_estimators': 100, 'learning_rate': 0.00010641141013101663, 'max_depth': 5, 'min_child_weight': 9, 'subsample': 0.6, 'colsample_bytree': 0.5, 'colsample_bylevel': 0.9, 'reg_alpha': 0.004282019980789876, 'reg_lambda': 0.00038517080432521656, 'gamma': 0.10574974698328278}. Best is trial 76 with value: -0.33331364162222676.
[I 2026-07-17 11:39:17,003] Trial 144 finished with value: -0.33126240834935206 and parameters: {'scalers': 'robust', 'ratios': 'norm_ratio', 'imputers': 'none', 'n_estimators': 100, 'learning_rate': 0.00029166069056735163, 'max_depth': 5, 'min_child_weight': 9, 'subsample': 0.6, 'colsample_bytree': 0.5, 'colsample_bylevel': 0.9, 'reg_alpha': 0.017217542828554075, 'reg_lambda': 0.016765891074867856, 'gamma': 0.10087796813853521}. Best is trial 76 with value: -0.33331364162222676.
[I 2026-07-17 11:39:17,360] Trial 145 finished with value: -0.33287363044980656 and parameters: {'scalers': 'standard', 'ratios': 'norm_ratio', 'imputers': 'none', 'n_estimators': 100, 'learning_rate': 0.00014210430368819131, 'max_depth': 5, 'min_child_weight': 10, 'subsample': 0.6, 'colsample_bytree': 0.5, 'colsample_bylevel': 0.8, 'reg_alpha': 4.182847093941327e-06, 'reg_lambda': 0.0270050741492113, 'gamma': 0.31224220147862036}. Best is trial 76 with value: -0.33331364162222676.
[I 2026-07-17 11:39:17,804] Trial 146 finished with value: -0.3332478881258131 and parameters: {'scalers': 'standard', 'ratios': 'norm_ratio', 'imputers': 'none', 'n_estimators': 100, 'learning_rate': 0.00010130984197361807, 'max_depth': 5, 'min_child_weight': 9, 'subsample': 0.6, 'colsample_bytree': 0.5, 'colsample_bylevel': 0.9, 'reg_alpha': 0.00039419981597274036, 'reg_lambda': 0.20570646575958185, 'gamma': 0.09828734808974489}. Best is trial 76 with value: -0.33331364162222676.
[I 2026-07-17 11:39:18,226] Trial 147 finished with value: -0.3332822632279969 and parameters: {'scalers': 'standard', 'ratios': 'norm_ratio', 'imputers': 'none', 'n_estimators': 100, 'learning_rate': 0.00010042840727943074, 'max_depth': 5, 'min_child_weight': 10, 'subsample': 1.0, 'colsample_bytree': 0.5, 'colsample_bylevel': 0.8, 'reg_alpha': 0.0003936780225071343, 'reg_lambda': 0.015590082866375485, 'gamma': 0.35310956365567137}. Best is trial 76 with value: -0.33331364162222676.
[I 2026-07-17 11:39:18,659] Trial 148 finished with value: -0.3332836327346661 and parameters: {'scalers': 'standard', 'ratios': 'norm_ratio', 'imputers': 'none', 'n_estimators': 100, 'learning_rate': 0.00010162414825662939, 'max_depth': 5, 'min_child_weight': 10, 'subsample': 1.0, 'colsample_bytree': 0.5, 'colsample_bylevel': 0.8, 'reg_alpha': 0.00035484870812797266, 'reg_lambda': 0.01687715154038474, 'gamma': 0.3668836419962913}. Best is trial 76 with value: -0.33331364162222676.
[I 2026-07-17 11:39:19,132] Trial 149 finished with value: -0.33285036243375427 and parameters: {'scalers': 'standard', 'ratios': 'norm_ratio', 'imputers': 'none', 'n_estimators': 100, 'learning_rate': 0.00013961556997412988, 'max_depth': 5, 'min_child_weight': 10, 'subsample': 1.0, 'colsample_bytree': 0.5, 'colsample_bylevel': 0.8, 'reg_alpha': 0.0003839315277883657, 'reg_lambda': 0.11591372944363099, 'gamma': 0.37321070959046054}. Best is trial 76 with value: -0.33331364162222676.
[I 2026-07-17 11:39:19,974] Trial 150 finished with value: -0.3322532621920543 and parameters: {'scalers': 'standard', 'ratios': 'norm_ratio', 'imputers': 'none', 'n_estimators': 200, 'learning_rate': 0.00010009989199296043, 'max_depth': 5, 'min_child_weight': 9, 'subsample': 1.0, 'colsample_bytree': 0.5, 'colsample_bylevel': 0.8, 'reg_alpha': 0.00037896025976521137, 'reg_lambda': 0.1869174684910456, 'gamma': 0.31843693912401627}. Best is trial 76 with value: -0.33331364162222676.
[I 2026-07-17 11:39:20,777] Trial 151 finished with value: -0.3320877646779513 and parameters: {'scalers': 'standard', 'ratios': 'norm_ratio', 'imputers': 'none', 'n_estimators': 200, 'learning_rate': 0.00010257517394302417, 'max_depth': 4, 'min_child_weight': 9, 'subsample': 1.0, 'colsample_bytree': 0.5, 'colsample_bylevel': 0.8, 'reg_alpha': 0.002948490962981506, 'reg_lambda': 0.09296910159568443, 'gamma': 0.10129690295482852}. Best is trial 76 with value: -0.33331364162222676.
[I 2026-07-17 11:39:21,617] Trial 152 finished with value: -0.33227198322762597 and parameters: {'scalers': 'standard', 'ratios': 'norm_ratio', 'imputers': 'none', 'n_estimators': 200, 'learning_rate': 0.00010010984478443975, 'max_depth': 5, 'min_child_weight': 9, 'subsample': 1.0, 'colsample_bytree': 0.5, 'colsample_bylevel': 0.8, 'reg_alpha': 0.0004220065977652223, 'reg_lambda': 0.0017424597652950513, 'gamma': 0.3189447742318453}. Best is trial 76 with value: -0.33331364162222676.
[I 2026-07-17 11:39:22,528] Trial 153 finished with value: -0.3322076799944643 and parameters: {'scalers': 'standard', 'ratios': 'norm_ratio', 'imputers': 'none', 'n_estimators': 200, 'learning_rate': 0.00010063325212148413, 'max_depth': 5, 'min_child_weight': 9, 'subsample': 1.0, 'colsample_bytree': 0.5, 'colsample_bylevel': 0.8, 'reg_alpha': 0.0023714085591496153, 'reg_lambda': 0.10243631075412961, 'gamma': 0.3505434393422255}. Best is trial 76 with value: -0.33331364162222676.
[I 2026-07-17 11:39:23,171] Trial 154 finished with value: -0.3321318003088985 and parameters: {'scalers': 'standard', 'ratios': 'norm_ratio', 'imputers': 'none', 'n_estimators': 200, 'learning_rate': 0.00010871890481366876, 'max_depth': 5, 'min_child_weight': 9, 'subsample': 1.0, 'colsample_bytree': 0.5, 'colsample_bylevel': 0.8, 'reg_alpha': 0.0003457566122415169, 'reg_lambda': 0.001775825431884991, 'gamma': 0.8750509451230306}. Best is trial 76 with value: -0.33331364162222676.
[I 2026-07-17 11:39:24,155] Trial 155 finished with value: -0.3320840678627217 and parameters: {'scalers': 'standard', 'ratios': 'norm_ratio', 'imputers': 'none', 'n_estimators': 200, 'learning_rate': 0.00010147852307037582, 'max_depth': 5, 'min_child_weight': 9, 'subsample': 1.0, 'colsample_bytree': 0.5, 'colsample_bylevel': 0.8, 'reg_alpha': 0.00046211804448788876, 'reg_lambda': 0.04053804174224181, 'gamma': 0.09277282020262932}. Best is trial 76 with value: -0.33331364162222676.
[I 2026-07-17 11:39:25,073] Trial 156 finished with value: -0.3319079025314429 and parameters: {'scalers': 'standard', 'ratios': 'norm_ratio', 'imputers': 'none', 'n_estimators': 200, 'learning_rate': 0.00010797107773018503, 'max_depth': 5, 'min_child_weight': 9, 'subsample': 1.0, 'colsample_bytree': 0.5, 'colsample_bylevel': 0.8, 'reg_alpha': 0.00036665154906459247, 'reg_lambda': 0.11359407289964536, 'gamma': 0.1055032757004616}. Best is trial 76 with value: -0.33331364162222676.
[I 2026-07-17 11:39:26,048] Trial 157 finished with value: -0.33195205447882087 and parameters: {'scalers': 'standard', 'ratios': 'norm_ratio', 'imputers': 'none', 'n_estimators': 200, 'learning_rate': 0.00010635924351171592, 'max_depth': 5, 'min_child_weight': 9, 'subsample': 1.0, 'colsample_bytree': 0.5, 'colsample_bylevel': 0.8, 'reg_alpha': 0.0003060999899224698, 'reg_lambda': 0.060685648891003495, 'gamma': 0.0978449003918484}. Best is trial 76 with value: -0.33331364162222676.
[I 2026-07-17 11:39:26,790] Trial 158 finished with value: -0.33212834630930554 and parameters: {'scalers': 'standard', 'ratios': 'norm_ratio', 'imputers': 'none', 'n_estimators': 200, 'learning_rate': 0.00010069257779773165, 'max_depth': 4, 'min_child_weight': 9, 'subsample': 1.0, 'colsample_bytree': 0.5, 'colsample_bylevel': 0.8, 'reg_alpha': 0.00025152308476218227, 'reg_lambda': 0.034617103833093264, 'gamma': 0.09845522155456354}. Best is trial 76 with value: -0.33331364162222676.
[I 2026-07-17 11:39:27,746] Trial 159 finished with value: -0.332044468279609 and parameters: {'scalers': 'standard', 'ratios': 'norm_ratio', 'imputers': 'none', 'n_estimators': 200, 'learning_rate': 0.00010031125722943905, 'max_depth': 5, 'min_child_weight': 9, 'subsample': 1.0, 'colsample_bytree': 0.5, 'colsample_bylevel': 0.8, 'reg_alpha': 0.00023698750945599754, 'reg_lambda': 0.010281751688081146, 'gamma': 0.11301817485159343}. Best is trial 76 with value: -0.33331364162222676.
[I 2026-07-17 11:39:28,896] Trial 160 finished with value: -0.3313598198464015 and parameters: {'scalers': 'standard', 'ratios': 'norm_ratio', 'imputers': 'none', 'n_estimators': 250, 'learning_rate': 0.00010358640750086162, 'max_depth': 5, 'min_child_weight': 9, 'subsample': 1.0, 'colsample_bytree': 0.5, 'colsample_bylevel': 0.8, 'reg_alpha': 7.136702830944104e-05, 'reg_lambda': 0.035605402454955803, 'gamma': 0.11401223814389919}. Best is trial 76 with value: -0.33331364162222676.
[I 2026-07-17 11:39:29,710] Trial 161 finished with value: -0.3308312935704205 and parameters: {'scalers': 'standard', 'ratios': 'norm_ratio', 'imputers': 'none', 'n_estimators': 250, 'learning_rate': 0.000140779998992754, 'max_depth': 4, 'min_child_weight': 9, 'subsample': 1.0, 'colsample_bytree': 0.5, 'colsample_bylevel': 0.8, 'reg_alpha': 7.559665159719748e-05, 'reg_lambda': 0.009589439038017176, 'gamma': 0.825667755559351}. Best is trial 76 with value: -0.33331364162222676.
[I 2026-07-17 11:39:30,158] Trial 162 finished with value: -0.3317216959305084 and parameters: {'scalers': 'standard', 'ratios': 'norm_ratio', 'imputers': 'none', 'n_estimators': 150, 'learning_rate': 0.00017744477005465176, 'max_depth': 4, 'min_child_weight': 9, 'subsample': 1.0, 'colsample_bytree': 0.5, 'colsample_bylevel': 0.8, 'reg_alpha': 0.0005861370183311333, 'reg_lambda': 0.03437620381162903, 'gamma': 0.9201275195185968}. Best is trial 76 with value: -0.33331364162222676.
[I 2026-07-17 11:39:30,747] Trial 163 finished with value: -0.3314277515725176 and parameters: {'scalers': 'standard', 'ratios': 'norm_ratio', 'imputers': 'none', 'n_estimators': 150, 'learning_rate': 0.00017813802156280958, 'max_depth': 4, 'min_child_weight': 9, 'subsample': 1.0, 'colsample_bytree': 0.5, 'colsample_bylevel': 0.8, 'reg_alpha': 0.00027090130693385777, 'reg_lambda': 0.02679694498963416, 'gamma': 0.12263587652394745}. Best is trial 76 with value: -0.33331364162222676.
[I 2026-07-17 11:39:34,667] Trial 164 finished with value: -0.31255195187796386 and parameters: {'scalers': 'standard', 'ratios': 'norm_ratio', 'imputers': 'none', 'n_estimators': 1350, 'learning_rate': 0.0001809632073891734, 'max_depth': 4, 'min_child_weight': 9, 'subsample': 1.0, 'colsample_bytree': 0.5, 'colsample_bylevel': 0.8, 'reg_alpha': 0.0006554916211122279, 'reg_lambda': 0.012182110905383802, 'gamma': 0.8674333578211618}. Best is trial 76 with value: -0.33331364162222676.
[I 2026-07-17 11:39:35,191] Trial 165 finished with value: -0.3316278103007769 and parameters: {'scalers': 'standard', 'ratios': 'norm_ratio', 'imputers': 'none', 'n_estimators': 150, 'learning_rate': 0.00018525785918596988, 'max_depth': 4, 'min_child_weight': 10, 'subsample': 1.0, 'colsample_bytree': 0.5, 'colsample_bylevel': 0.8, 'reg_alpha': 0.0006568179861765845, 'reg_lambda': 0.32675496755415995, 'gamma': 0.8525152148380741}. Best is trial 76 with value: -0.33331364162222676.
[I 2026-07-17 11:39:35,657] Trial 166 finished with value: -0.33172509936649497 and parameters: {'scalers': 'standard', 'ratios': 'norm_ratio', 'imputers': 'none', 'n_estimators': 150, 'learning_rate': 0.00017871540638055193, 'max_depth': 3, 'min_child_weight': 10, 'subsample': 1.0, 'colsample_bytree': 0.5, 'colsample_bylevel': 0.8, 'reg_alpha': 0.0007166732739321988, 'reg_lambda': 0.011265864188918654, 'gamma': 0.05425597167061348}. Best is trial 76 with value: -0.33331364162222676.
[I 2026-07-17 11:39:36,141] Trial 167 finished with value: -0.3316573383319095 and parameters: {'scalers': 'standard', 'ratios': 'norm_ratio', 'imputers': 'none', 'n_estimators': 150, 'learning_rate': 0.0001801111336841795, 'max_depth': 3, 'min_child_weight': 3, 'subsample': 1.0, 'colsample_bytree': 0.5, 'colsample_bylevel': 0.9, 'reg_alpha': 7.825257862771494e-05, 'reg_lambda': 0.012592259004263993, 'gamma': 0.24923746951606288}. Best is trial 76 with value: -0.33331364162222676.
[I 2026-07-17 11:39:36,740] Trial 168 finished with value: -0.3328274427384824 and parameters: {'scalers': 'standard', 'ratios': 'norm_ratio', 'imputers': 'none', 'n_estimators': 100, 'learning_rate': 0.00014164400422029635, 'max_depth': 6, 'min_child_weight': 10, 'subsample': 0.6, 'colsample_bytree': 0.5, 'colsample_bylevel': 0.9, 'reg_alpha': 0.0005977655059519849, 'reg_lambda': 0.023115208873365475, 'gamma': 0.06363754152682341}. Best is trial 76 with value: -0.33331364162222676.
[I 2026-07-17 11:39:37,283] Trial 169 finished with value: -0.3325025024414342 and parameters: {'scalers': 'standard', 'ratios': 'norm_ratio', 'imputers': 'none', 'n_estimators': 100, 'learning_rate': 0.00017650674055898574, 'max_depth': 6, 'min_child_weight': 10, 'subsample': 0.6, 'colsample_bytree': 0.5, 'colsample_bylevel': 0.9, 'reg_alpha': 0.0007652799007945508, 'reg_lambda': 0.0004258267386561971, 'gamma': 0.058243531761198994}. Best is trial 76 with value: -0.33331364162222676.
[I 2026-07-17 11:39:37,482] Trial 170 finished with value: -0.3330659815296772 and parameters: {'scalers': 'standard', 'ratios': 'norm_ratio', 'imputers': 'none', 'n_estimators': 100, 'learning_rate': 0.0001411156240120526, 'max_depth': 6, 'min_child_weight': 10, 'subsample': 0.6, 'colsample_bytree': 0.5, 'colsample_bylevel': 0.9, 'reg_alpha': 0.009647507985391664, 'reg_lambda': 0.3535622119108502, 'gamma': 2.0420805139478073}. Best is trial 76 with value: -0.33331364162222676.
[I 2026-07-17 11:39:38,003] Trial 171 finished with value: -0.33293519640082747 and parameters: {'scalers': 'standard', 'ratios': 'norm_ratio', 'imputers': 'none', 'n_estimators': 100, 'learning_rate': 0.0001379673579157612, 'max_depth': 6, 'min_child_weight': 10, 'subsample': 0.6, 'colsample_bytree': 0.5, 'colsample_bylevel': 0.9, 'reg_alpha': 2.1451549385072484e-05, 'reg_lambda': 0.000799423607324914, 'gamma': 0.044526953414172524}. Best is trial 76 with value: -0.33331364162222676.
[I 2026-07-17 11:39:38,570] Trial 172 finished with value: -0.3328517090037597 and parameters: {'scalers': 'standard', 'ratios': 'norm_ratio', 'imputers': 'none', 'n_estimators': 100, 'learning_rate': 0.0001394220103097519, 'max_depth': 6, 'min_child_weight': 10, 'subsample': 0.6, 'colsample_bytree': 0.5, 'colsample_bylevel': 0.9, 'reg_alpha': 0.004493414299382227, 'reg_lambda': 0.0009232178545352211, 'gamma': 0.06682377683610048}. Best is trial 76 with value: -0.33331364162222676.
[I 2026-07-17 11:39:39,134] Trial 173 finished with value: -0.3328843122050767 and parameters: {'scalers': 'robust', 'ratios': 'norm_ratio', 'imputers': 'none', 'n_estimators': 100, 'learning_rate': 0.00014006755867039658, 'max_depth': 6, 'min_child_weight': 10, 'subsample': 0.6, 'colsample_bytree': 0.5, 'colsample_bylevel': 0.9, 'reg_alpha': 0.005078550353337044, 'reg_lambda': 0.001281674200515864, 'gamma': 0.04829854571101655}. Best is trial 76 with value: -0.33331364162222676.
[I 2026-07-17 11:39:39,567] Trial 174 finished with value: -0.33299064589170346 and parameters: {'scalers': 'robust', 'ratios': 'norm_ratio', 'imputers': 'none', 'n_estimators': 100, 'learning_rate': 0.0001339608863553925, 'max_depth': 6, 'min_child_weight': 10, 'subsample': 0.6, 'colsample_bytree': 0.5, 'colsample_bylevel': 0.9, 'reg_alpha': 0.004753347136962348, 'reg_lambda': 0.0012275213199896761, 'gamma': 0.40648034812669226}. Best is trial 76 with value: -0.33331364162222676.
[I 2026-07-17 11:39:40,121] Trial 175 finished with value: -0.33303144570461374 and parameters: {'scalers': 'robust', 'ratios': 'norm_ratio', 'imputers': 'none', 'n_estimators': 100, 'learning_rate': 0.00012840576432126874, 'max_depth': 6, 'min_child_weight': 10, 'subsample': 0.6, 'colsample_bytree': 0.5, 'colsample_bylevel': 0.9, 'reg_alpha': 0.004876155117800966, 'reg_lambda': 0.001343623030988889, 'gamma': 0.04073128154028148}. Best is trial 76 with value: -0.33331364162222676.
[I 2026-07-17 11:39:40,455] Trial 176 finished with value: -0.33310935965693067 and parameters: {'scalers': 'robust', 'ratios': 'norm_ratio', 'imputers': 'none', 'n_estimators': 100, 'learning_rate': 0.00013192696621518743, 'max_depth': 7, 'min_child_weight': 10, 'subsample': 0.6, 'colsample_bytree': 0.5, 'colsample_bylevel': 0.9, 'reg_alpha': 0.004934790372380433, 'reg_lambda': 0.0004230590848888955, 'gamma': 2.0736497833989844}. Best is trial 76 with value: -0.33331364162222676.
[I 2026-07-17 11:39:40,930] Trial 177 finished with value: -0.3329125198557903 and parameters: {'scalers': 'robust', 'ratios': 'norm_ratio', 'imputers': 'none', 'n_estimators': 100, 'learning_rate': 0.0001369507738674713, 'max_depth': 7, 'min_child_weight': 10, 'subsample': 0.6, 'colsample_bytree': 0.5, 'colsample_bylevel': 0.9, 'reg_alpha': 0.004405667346756109, 'reg_lambda': 0.0013692126497447195, 'gamma': 0.4373628413664911}. Best is trial 76 with value: -0.33331364162222676.
[I 2026-07-17 11:39:41,408] Trial 178 finished with value: -0.3329229523919697 and parameters: {'scalers': 'robust', 'ratios': 'norm_ratio', 'imputers': 'none', 'n_estimators': 100, 'learning_rate': 0.00013514165851058948, 'max_depth': 7, 'min_child_weight': 10, 'subsample': 0.6, 'colsample_bytree': 0.5, 'colsample_bylevel': 0.9, 'reg_alpha': 0.008994999195319686, 'reg_lambda': 0.21207208955174014, 'gamma': 0.46777859202013344}. Best is trial 76 with value: -0.33331364162222676.
[I 2026-07-17 11:39:41,786] Trial 179 finished with value: -0.333069543244613 and parameters: {'scalers': 'robust', 'ratios': 'norm_ratio', 'imputers': 'none', 'n_estimators': 100, 'learning_rate': 0.00012976225359338228, 'max_depth': 7, 'min_child_weight': 10, 'subsample': 0.6, 'colsample_bytree': 0.5, 'colsample_bylevel': 0.9, 'reg_alpha': 0.008972546405572, 'reg_lambda': 0.39502671198351186, 'gamma': 1.6922459399263345}. Best is trial 76 with value: -0.33331364162222676.
