[I 2026-07-17 11:34:15,349] Trial 90 finished with value: -0.38817869782079173 and parameters: {'scalers': 'robust', 'ratios': 'log_ratio', 'imputers': 'median', 'n_estimators': 200, 'learning_rate': 0.00010256228240701539, 'max_depth': 11, 'min_child_weight': 8, 'subsample': 0.5, 'colsample_bytree': 0.6, 'colsample_bylevel': 0.5, 'reg_alpha': 4.450682251486147e-05, 'reg_lambda': 0.004370944380139974, 'gamma': 11.270324588477068}. Best is trial 82 with value: -0.39047198551007795.
[I 2026-07-17 11:34:16,120] Trial 91 finished with value: -0.3712161848542723 and parameters: {'scalers': 'robust', 'ratios': 'log_ratio', 'imputers': 'median', 'n_estimators': 400, 'learning_rate': 0.0003921018773844056, 'max_depth': 11, 'min_child_weight': 10, 'subsample': 0.6, 'colsample_bytree': 0.5, 'colsample_bylevel': 0.5, 'reg_alpha': 3.6156546601352163e-05, 'reg_lambda': 0.0032504408992683823, 'gamma': 11.470946975055393}. Best is trial 82 with value: -0.39047198551007795.
[I 2026-07-17 11:34:16,823] Trial 92 finished with value: -0.3729701697783853 and parameters: {'scalers': 'robust', 'ratios': 'log_ratio', 'imputers': 'median', 'n_estimators': 400, 'learning_rate': 0.0003815826813383395, 'max_depth': 11, 'min_child_weight': 10, 'subsample': 0.5, 'colsample_bytree': 0.5, 'colsample_bylevel': 0.5, 'reg_alpha': 3.856904475540944e-05, 'reg_lambda': 0.0035496257085474896, 'gamma': 11.895478247101646}. Best is trial 82 with value: -0.39047198551007795.
[I 2026-07-17 11:34:30,481] Trial 93 finished with value: -0.2574512507733375 and parameters: {'scalers': 'robust', 'ratios': 'log_ratio', 'imputers': 'median', 'n_estimators': 2550, 'learning_rate': 0.00037901831994993813, 'max_depth': 11, 'min_child_weight': 10, 'subsample': 0.5, 'colsample_bytree': 0.5, 'colsample_bylevel': 0.5, 'reg_alpha': 0.00013299804143318737, 'reg_lambda': 0.003580139545539258, 'gamma': 0.12079837224761866}. Best is trial 82 with value: -0.39047198551007795.
[I 2026-07-17 11:34:31,017] Trial 94 finished with value: -0.39104665461707094 and parameters: {'scalers': 'robust', 'ratios': 'log_ratio', 'imputers': 'median', 'n_estimators': 350, 'learning_rate': 0.00018131724983993903, 'max_depth': 11, 'min_child_weight': 10, 'subsample': 0.5, 'colsample_bytree': 0.5, 'colsample_bylevel': 0.5, 'reg_alpha': 2.381351257430208e-06, 'reg_lambda': 0.0041185667689370865, 'gamma': 95.4460648904446}. Best is trial 94 with value: -0.39104665461707094.
[I 2026-07-17 11:34:36,257] Trial 95 finished with value: -0.29241536528061984 and parameters: {'scalers': 'robust', 'ratios': 'log_ratio', 'imputers': 'median', 'n_estimators': 2450, 'learning_rate': 0.00037081844386075693, 'max_depth': 10, 'min_child_weight': 4, 'subsample': 0.8, 'colsample_bytree': 0.6, 'colsample_bylevel': 0.5, 'reg_alpha': 1.0489167217256534, 'reg_lambda': 0.0030651826739130235, 'gamma': 11.60467187375119}. Best is trial 94 with value: -0.39104665461707094.
[I 2026-07-17 11:34:37,836] Trial 96 finished with value: -0.37734785060243625 and parameters: {'scalers': 'robust', 'ratios': 'log_ratio', 'imputers': 'median', 'n_estimators': 350, 'learning_rate': 0.0001831365476149248, 'max_depth': 10, 'min_child_weight': 10, 'subsample': 0.5, 'colsample_bytree': 0.6, 'colsample_bylevel': 0.5, 'reg_alpha': 0.00020978841516470064, 'reg_lambda': 6.484654672900309e-05, 'gamma': 0.405378434237107}. Best is trial 94 with value: -0.39104665461707094.
[I 2026-07-17 11:34:38,457] Trial 97 finished with value: -0.37858000226218885 and parameters: {'scalers': 'robust', 'ratios': 'log_ratio', 'imputers': 'median', 'n_estimators': 350, 'learning_rate': 0.00036527171097657294, 'max_depth': 11, 'min_child_weight': 10, 'subsample': 0.5, 'colsample_bytree': 0.7, 'colsample_bylevel': 0.5, 'reg_alpha': 6.19337527974223e-06, 'reg_lambda': 0.018527381821165406, 'gamma': 43.05824980007632}. Best is trial 94 with value: -0.39104665461707094.
[I 2026-07-17 11:34:38,952] Trial 98 finished with value: -0.3910778001313542 and parameters: {'scalers': 'robust', 'ratios': 'log_ratio', 'imputers': 'median', 'n_estimators': 350, 'learning_rate': 0.00018267025156701297, 'max_depth': 10, 'min_child_weight': 4, 'subsample': 0.5, 'colsample_bytree': 0.7, 'colsample_bylevel': 0.5, 'reg_alpha': 1.8390103412713328e-06, 'reg_lambda': 0.0011479655967746307, 'gamma': 99.17067067738428}. Best is trial 98 with value: -0.3910778001313542.
[I 2026-07-17 11:34:39,698] Trial 99 finished with value: -0.38600976449941743 and parameters: {'scalers': 'robust', 'ratios': 'log_ratio', 'imputers': 'median', 'n_estimators': 350, 'learning_rate': 0.00017089081748046606, 'max_depth': 10, 'min_child_weight': 10, 'subsample': 0.9, 'colsample_bytree': 0.7, 'colsample_bylevel': 0.6, 'reg_alpha': 5.844638906861075e-06, 'reg_lambda': 0.0011437736204778272, 'gamma': 97.12076731303361}. Best is trial 98 with value: -0.3910778001313542.
[I 2026-07-17 11:34:45,400] Trial 100 finished with value: -0.35146070713582866 and parameters: {'scalers': 'robust', 'ratios': 'log_ratio', 'imputers': 'median', 'n_estimators': 2900, 'learning_rate': 0.00018420759027153982, 'max_depth': 7, 'min_child_weight': 4, 'subsample': 0.9, 'colsample_bytree': 0.7, 'colsample_bylevel': 0.6, 'reg_alpha': 7.069255050656829, 'reg_lambda': 0.0011176023924768025, 'gamma': 86.75323115447554}. Best is trial 98 with value: -0.3910778001313542.
[I 2026-07-17 11:34:45,950] Trial 101 finished with value: -0.389934099484536 and parameters: {'scalers': 'robust', 'ratios': 'log_ratio', 'imputers': 'median', 'n_estimators': 350, 'learning_rate': 0.0001860058484488386, 'max_depth': 10, 'min_child_weight': 4, 'subsample': 0.6, 'colsample_bytree': 0.6, 'colsample_bylevel': 0.6, 'reg_alpha': 5.512982860340875e-06, 'reg_lambda': 6.452364393169469e-05, 'gamma': 99.16388345712063}. Best is trial 98 with value: -0.3910778001313542.
[I 2026-07-17 11:34:46,785] Trial 102 finished with value: -0.3888447495252926 and parameters: {'scalers': 'robust', 'ratios': 'log_ratio', 'imputers': 'median', 'n_estimators': 500, 'learning_rate': 0.0001862198022299031, 'max_depth': 10, 'min_child_weight': 10, 'subsample': 0.6, 'colsample_bytree': 0.7, 'colsample_bylevel': 0.6, 'reg_alpha': 2.9445000574936877e-06, 'reg_lambda': 0.0010891397235203654, 'gamma': 97.63142141420376}. Best is trial 98 with value: -0.3910778001313542.
[I 2026-07-17 11:34:51,986] Trial 103 finished with value: -0.345777651419784 and parameters: {'scalers': 'robust', 'ratios': 'log_ratio', 'imputers': 'median', 'n_estimators': 3000, 'learning_rate': 0.00018023930319102725, 'max_depth': 10, 'min_child_weight': 10, 'subsample': 0.6, 'colsample_bytree': 0.7, 'colsample_bylevel': 0.6, 'reg_alpha': 6.092476880636103e-06, 'reg_lambda': 0.0012167261583398508, 'gamma': 55.92700278034749}. Best is trial 98 with value: -0.3910778001313542.
[I 2026-07-17 11:34:52,839] Trial 104 finished with value: -0.3888032100290701 and parameters: {'scalers': 'robust', 'ratios': 'log_ratio', 'imputers': 'median', 'n_estimators': 500, 'learning_rate': 0.00017485778318214953, 'max_depth': 7, 'min_child_weight': 9, 'subsample': 0.6, 'colsample_bytree': 0.7, 'colsample_bylevel': 0.6, 'reg_alpha': 5.905416558026472e-06, 'reg_lambda': 0.0012945064953184997, 'gamma': 96.92836888028121}. Best is trial 98 with value: -0.3910778001313542.
[I 2026-07-17 11:34:53,397] Trial 105 finished with value: -0.34575324197402 and parameters: {'scalers': 'robust', 'ratios': 'log_ratio', 'imputers': 'median', 'n_estimators': 350, 'learning_rate': 0.00462653335133035, 'max_depth': 12, 'min_child_weight': 9, 'subsample': 0.6, 'colsample_bytree': 0.6, 'colsample_bylevel': 0.6, 'reg_alpha': 2.926874789594236e-06, 'reg_lambda': 0.0011725347950856853, 'gamma': 87.82368903033829}. Best is trial 98 with value: -0.3910778001313542.
[I 2026-07-17 11:34:54,323] Trial 106 finished with value: -0.37913522544340345 and parameters: {'scalers': 'robust', 'ratios': 'log_ratio', 'imputers': 'median', 'n_estimators': 500, 'learning_rate': 0.00028552011559605935, 'max_depth': 10, 'min_child_weight': 4, 'subsample': 0.6, 'colsample_bytree': 0.6, 'colsample_bylevel': 0.6, 'reg_alpha': 3.1851832980425894e-06, 'reg_lambda': 0.001032377495024828, 'gamma': 62.265299429968564}. Best is trial 98 with value: -0.3910778001313542.
[I 2026-07-17 11:34:55,110] Trial 107 finished with value: -0.38129250156838945 and parameters: {'scalers': 'robust', 'ratios': 'log_ratio', 'imputers': 'median', 'n_estimators': 500, 'learning_rate': 0.00027081244920934333, 'max_depth': 7, 'min_child_weight': 4, 'subsample': 0.5, 'colsample_bytree': 0.6, 'colsample_bylevel': 0.6, 'reg_alpha': 3.1160875915785897e-06, 'reg_lambda': 21.37415953624628, 'gamma': 57.45157534762588}. Best is trial 98 with value: -0.3910778001313542.
[I 2026-07-17 11:34:56,022] Trial 108 finished with value: -0.37900953988698494 and parameters: {'scalers': 'robust', 'ratios': 'log_ratio', 'imputers': 'median', 'n_estimators': 500, 'learning_rate': 0.00027698434296840176, 'max_depth': 12, 'min_child_weight': 9, 'subsample': 0.6, 'colsample_bytree': 0.6, 'colsample_bylevel': 0.6, 'reg_alpha': 3.0599896304561952e-06, 'reg_lambda': 0.013602228795133469, 'gamma': 60.0647072353648}. Best is trial 98 with value: -0.3910778001313542.
[I 2026-07-17 11:34:56,978] Trial 109 finished with value: -0.3774960793170369 and parameters: {'scalers': 'robust', 'ratios': 'log_ratio', 'imputers': 'median', 'n_estimators': 550, 'learning_rate': 0.0002724022999707727, 'max_depth': 9, 'min_child_weight': 4, 'subsample': 0.6, 'colsample_bytree': 0.6, 'colsample_bylevel': 0.6, 'reg_alpha': 2.97578154492575e-06, 'reg_lambda': 7.839155546957079e-05, 'gamma': 58.31413706668188}. Best is trial 98 with value: -0.3910778001313542.
[I 2026-07-17 11:34:57,826] Trial 110 finished with value: -0.3811861459982552 and parameters: {'scalers': 'robust', 'ratios': 'log_ratio', 'imputers': 'median', 'n_estimators': 500, 'learning_rate': 0.00026940952243751764, 'max_depth': 9, 'min_child_weight': 4, 'subsample': 0.5, 'colsample_bytree': 0.6, 'colsample_bylevel': 0.6, 'reg_alpha': 1.37159322016526e-05, 'reg_lambda': 0.0002003448172142974, 'gamma': 59.39923543023892}. Best is trial 98 with value: -0.3910778001313542.
[I 2026-07-17 11:35:01,707] Trial 111 finished with value: -0.1527087225231452 and parameters: {'scalers': 'robust', 'ratios': 'log_ratio', 'imputers': 'median', 'n_estimators': 500, 'learning_rate': 0.006548407586140955, 'max_depth': 9, 'min_child_weight': 4, 'subsample': 0.5, 'colsample_bytree': 0.6, 'colsample_bylevel': 0.6, 'reg_alpha': 1.6658338632206844e-06, 'reg_lambda': 31.956750487561898, 'gamma': 3.433180590970588e-06}. Best is trial 98 with value: -0.3910778001313542.
[I 2026-07-17 11:35:05,097] Trial 112 finished with value: -0.3699326871905422 and parameters: {'scalers': 'robust', 'ratios': 'log_ratio', 'imputers': 'median', 'n_estimators': 350, 'learning_rate': 0.00027770854557167783, 'max_depth': 9, 'min_child_weight': 4, 'subsample': 0.5, 'colsample_bytree': 0.6, 'colsample_bylevel': 0.6, 'reg_alpha': 1.4187670813844202e-05, 'reg_lambda': 0.0001992876521565691, 'gamma': 8.641822180545877e-06}. Best is trial 98 with value: -0.3910778001313542.
[I 2026-07-17 11:35:08,935] Trial 113 finished with value: -0.3631501657710965 and parameters: {'scalers': 'robust', 'ratios': 'log_ratio', 'imputers': 'median', 'n_estimators': 500, 'learning_rate': 0.0002632178532318743, 'max_depth': 9, 'min_child_weight': 4, 'subsample': 0.5, 'colsample_bytree': 0.6, 'colsample_bylevel': 0.5, 'reg_alpha': 1.339989061841911e-05, 'reg_lambda': 0.00019854164525341892, 'gamma': 7.541431078979918e-06}. Best is trial 98 with value: -0.3910778001313542.
[I 2026-07-17 11:35:09,235] Trial 114 finished with value: -0.3851394819376807 and parameters: {'scalers': 'robust', 'ratios': 'log_ratio', 'imputers': 'median', 'n_estimators': 250, 'learning_rate': 0.00028018512203840793, 'max_depth': 9, 'min_child_weight': 4, 'subsample': 0.5, 'colsample_bytree': 0.6, 'colsample_bylevel': 0.5, 'reg_alpha': 0.005306069021113817, 'reg_lambda': 0.012273921199033715, 'gamma': 46.508987377412986}. Best is trial 98 with value: -0.3910778001313542.
[I 2026-07-17 11:35:09,664] Trial 115 finished with value: -0.21668851375794326 and parameters: {'scalers': 'robust', 'ratios': 'log_ratio', 'imputers': 'median', 'n_estimators': 250, 'learning_rate': 0.033872145908796183, 'max_depth': 9, 'min_child_weight': 7, 'subsample': 0.7, 'colsample_bytree': 0.6, 'colsample_bylevel': 0.5, 'reg_alpha': 1.4806697173830209e-05, 'reg_lambda': 7.893711745510072e-05, 'gamma': 36.43627681473481}. Best is trial 98 with value: -0.3910778001313542.
[I 2026-07-17 11:35:12,122] Trial 116 finished with value: -0.38406563783228675 and parameters: {'scalers': 'robust', 'ratios': 'log_ratio', 'imputers': 'median', 'n_estimators': 250, 'learning_rate': 0.0001222599850690792, 'max_depth': 9, 'min_child_weight': 4, 'subsample': 0.7, 'colsample_bytree': 0.6, 'colsample_bylevel': 0.5, 'reg_alpha': 1.6749059480340563e-06, 'reg_lambda': 0.0001849457397637024, 'gamma': 3.0958348671612772e-06}. Best is trial 98 with value: -0.3910778001313542.
[I 2026-07-17 11:35:15,058] Trial 117 finished with value: -0.3649224915004502 and parameters: {'scalers': 'robust', 'ratios': 'log_ratio', 'imputers': 'median', 'n_estimators': 1600, 'learning_rate': 0.0001560565861126897, 'max_depth': 9, 'min_child_weight': 7, 'subsample': 0.7, 'colsample_bytree': 0.6, 'colsample_bylevel': 0.5, 'reg_alpha': 1.587022718491475e-06, 'reg_lambda': 0.00018977489296090382, 'gamma': 30.599948214929665}. Best is trial 98 with value: -0.3910778001313542.
[I 2026-07-17 11:35:15,574] Trial 118 finished with value: -0.3877314172171977 and parameters: {'scalers': 'robust', 'ratios': 'log_ratio', 'imputers': 'median', 'n_estimators': 250, 'learning_rate': 0.0001241633766066328, 'max_depth': 10, 'min_child_weight': 7, 'subsample': 0.7, 'colsample_bytree': 0.6, 'colsample_bylevel': 0.5, 'reg_alpha': 1.7126351755830358e-06, 'reg_lambda': 0.0004452717944733294, 'gamma': 36.67285484224927}. Best is trial 98 with value: -0.3910778001313542.
[I 2026-07-17 11:35:16,053] Trial 119 finished with value: -0.38678062009992903 and parameters: {'scalers': 'robust', 'ratios': 'log_ratio', 'imputers': 'median', 'n_estimators': 250, 'learning_rate': 0.0001556095151436466, 'max_depth': 10, 'min_child_weight': 7, 'subsample': 0.7, 'colsample_bytree': 0.6, 'colsample_bylevel': 0.5, 'reg_alpha': 1.6480437182676539e-06, 'reg_lambda': 0.005960743004949383, 'gamma': 34.065521089235766}. Best is trial 98 with value: -0.3910778001313542.
[I 2026-07-17 11:35:16,407] Trial 120 finished with value: -0.38885191090004745 and parameters: {'scalers': 'robust', 'ratios': 'log_ratio', 'imputers': 'median', 'n_estimators': 150, 'learning_rate': 0.0001248584169626795, 'max_depth': 10, 'min_child_weight': 7, 'subsample': 0.7, 'colsample_bytree': 0.7, 'colsample_bylevel': 0.5, 'reg_alpha': 4.23742627306925e-06, 'reg_lambda': 0.0004931621528083503, 'gamma': 32.36979993670635}. Best is trial 98 with value: -0.3910778001313542.
[I 2026-07-17 11:35:16,903] Trial 121 finished with value: -0.3874155122021061 and parameters: {'scalers': 'robust', 'ratios': 'log_ratio', 'imputers': 'median', 'n_estimators': 250, 'learning_rate': 0.00012565132615612908, 'max_depth': 10, 'min_child_weight': 7, 'subsample': 0.7, 'colsample_bytree': 0.7, 'colsample_bylevel': 0.5, 'reg_alpha': 1.5989492309324693e-06, 'reg_lambda': 0.0004538464735072242, 'gamma': 33.67108893552013}. Best is trial 98 with value: -0.3910778001313542.
[I 2026-07-17 11:35:19,663] Trial 122 finished with value: -0.36457146915303834 and parameters: {'scalers': 'robust', 'ratios': 'log_ratio', 'imputers': 'median', 'n_estimators': 1400, 'learning_rate': 0.0001566689364551924, 'max_depth': 10, 'min_child_weight': 7, 'subsample': 0.7, 'colsample_bytree': 0.7, 'colsample_bylevel': 0.7, 'reg_alpha': 1.7295976083187033e-06, 'reg_lambda': 0.006337429299551755, 'gamma': 33.50261137989679}. Best is trial 98 with value: -0.3910778001313542.
[I 2026-07-17 11:35:20,123] Trial 123 finished with value: -0.38857216755907026 and parameters: {'scalers': 'robust', 'ratios': 'log_ratio', 'imputers': 'median', 'n_estimators': 150, 'learning_rate': 0.00012680790673305083, 'max_depth': 10, 'min_child_weight': 3, 'subsample': 0.7, 'colsample_bytree': 0.7, 'colsample_bylevel': 0.7, 'reg_alpha': 1.7316943311193583e-06, 'reg_lambda': 0.005802091727448031, 'gamma': 36.774063005311426}. Best is trial 98 with value: -0.3910778001313542.
[I 2026-07-17 11:35:20,395] Trial 124 finished with value: -0.3886502383925656 and parameters: {'scalers': 'robust', 'ratios': 'log_ratio', 'imputers': 'median', 'n_estimators': 150, 'learning_rate': 0.00012375947536315935, 'max_depth': 10, 'min_child_weight': 3, 'subsample': 0.6, 'colsample_bytree': 0.7, 'colsample_bylevel': 0.7, 'reg_alpha': 4.514904868956819e-06, 'reg_lambda': 0.0005397603522644816, 'gamma': 29.378998132303963}. Best is trial 98 with value: -0.3910778001313542.
[I 2026-07-17 11:35:20,799] Trial 125 finished with value: -0.38898698148735295 and parameters: {'scalers': 'robust', 'ratios': 'log_ratio', 'imputers': 'median', 'n_estimators': 150, 'learning_rate': 0.00012482704752532416, 'max_depth': 10, 'min_child_weight': 3, 'subsample': 0.6, 'colsample_bytree': 0.5, 'colsample_bylevel': 0.7, 'reg_alpha': 2.102002604257923e-05, 'reg_lambda': 5.0118009279052424e-05, 'gamma': 31.451224915500543}. Best is trial 98 with value: -0.3910778001313542.
[I 2026-07-17 11:35:21,034] Trial 126 finished with value: -0.38826408526420775 and parameters: {'scalers': 'robust', 'ratios': 'log_ratio', 'imputers': 'median', 'n_estimators': 150, 'learning_rate': 0.000147425211504858, 'max_depth': 10, 'min_child_weight': 3, 'subsample': 0.6, 'colsample_bytree': 0.5, 'colsample_bylevel': 0.7, 'reg_alpha': 4.670816306484985e-06, 'reg_lambda': 0.0004929516829053627, 'gamma': 17.2944242272845}. Best is trial 98 with value: -0.3910778001313542.
[I 2026-07-17 11:35:21,383] Trial 127 finished with value: -0.38903127263325 and parameters: {'scalers': 'robust', 'ratios': 'log_ratio', 'imputers': 'median', 'n_estimators': 150, 'learning_rate': 0.0001255031054917879, 'max_depth': 11, 'min_child_weight': 3, 'subsample': 0.6, 'colsample_bytree': 0.5, 'colsample_bylevel': 0.6, 'reg_alpha': 4.520468861898551e-06, 'reg_lambda': 0.0004574968858807143, 'gamma': 26.762104102780636}. Best is trial 98 with value: -0.3910778001313542.
[I 2026-07-17 11:35:21,805] Trial 128 finished with value: -0.3886215359048297 and parameters: {'scalers': 'robust', 'ratios': 'log_ratio', 'imputers': 'median', 'n_estimators': 150, 'learning_rate': 0.00012441598156483463, 'max_depth': 10, 'min_child_weight': 3, 'subsample': 0.6, 'colsample_bytree': 0.7, 'colsample_bylevel': 0.6, 'reg_alpha': 3.808410008827562e-06, 'reg_lambda': 0.0004492745870291067, 'gamma': 26.490743783731496}. Best is trial 98 with value: -0.3910778001313542.
[I 2026-07-17 11:35:22,053] Trial 129 finished with value: -0.3867511451622491 and parameters: {'scalers': 'robust', 'ratios': 'log_ratio', 'imputers': 'median', 'n_estimators': 150, 'learning_rate': 0.00020147739080675838, 'max_depth': 11, 'min_child_weight': 3, 'subsample': 0.6, 'colsample_bytree': 0.7, 'colsample_bylevel': 0.7, 'reg_alpha': 2.3445524274905726e-05, 'reg_lambda': 5.0144242778968654e-05, 'gamma': 19.244880864284646}. Best is trial 98 with value: -0.3910778001313542.
[I 2026-07-17 11:35:22,457] Trial 130 finished with value: -0.3867175051277845 and parameters: {'scalers': 'robust', 'ratios': 'log_ratio', 'imputers': 'median', 'n_estimators': 150, 'learning_rate': 0.00020077476407285755, 'max_depth': 11, 'min_child_weight': 3, 'subsample': 0.6, 'colsample_bytree': 0.7, 'colsample_bylevel': 0.6, 'reg_alpha': 2.3507700324420156e-05, 'reg_lambda': 4.617069298035446e-05, 'gamma': 17.25504421886665}. Best is trial 98 with value: -0.3910778001313542.
[I 2026-07-17 11:35:22,865] Trial 131 finished with value: -0.38646391938718516 and parameters: {'scalers': 'robust', 'ratios': 'log_ratio', 'imputers': 'median', 'n_estimators': 150, 'learning_rate': 0.00019641544907157934, 'max_depth': 11, 'min_child_weight': 10, 'subsample': 0.6, 'colsample_bytree': 0.8, 'colsample_bylevel': 0.6, 'reg_alpha': 4.601416615760442e-06, 'reg_lambda': 1.0425856737677859e-05, 'gamma': 18.34478474745828}. Best is trial 98 with value: -0.3910778001313542.
[I 2026-07-17 11:35:23,134] Trial 132 finished with value: -0.3862326701397327 and parameters: {'scalers': 'robust', 'ratios': 'log_ratio', 'imputers': 'median', 'n_estimators': 150, 'learning_rate': 0.0002022585873341821, 'max_depth': 11, 'min_child_weight': 5, 'subsample': 0.6, 'colsample_bytree': 0.8, 'colsample_bylevel': 0.6, 'reg_alpha': 2.4263889096849035e-05, 'reg_lambda': 0.0024421329377090077, 'gamma': 17.217716964486907}. Best is trial 98 with value: -0.3910778001313542.
[I 2026-07-17 11:35:23,387] Trial 133 finished with value: -0.3871008082115629 and parameters: {'scalers': 'robust', 'ratios': 'log_ratio', 'imputers': 'median', 'n_estimators': 150, 'learning_rate': 0.00021098455735866904, 'max_depth': 11, 'min_child_weight': 5, 'subsample': 0.6, 'colsample_bytree': 0.5, 'colsample_bylevel': 0.7, 'reg_alpha': 4.7399519137566705e-06, 'reg_lambda': 1.1183629886309186e-05, 'gamma': 17.37596861694938}. Best is trial 98 with value: -0.3910778001313542.
[I 2026-07-17 11:35:23,725] Trial 134 finished with value: -0.38718302085754763 and parameters: {'scalers': 'robust', 'ratios': 'log_ratio', 'imputers': 'median', 'n_estimators': 150, 'learning_rate': 0.00020445353480954428, 'max_depth': 11, 'min_child_weight': 5, 'subsample': 0.6, 'colsample_bytree': 0.5, 'colsample_bylevel': 0.8, 'reg_alpha': 2.079984356526813e-05, 'reg_lambda': 7.35803657277993e-06, 'gamma': 17.93307422608336}. Best is trial 98 with value: -0.3910778001313542.
