[I 2026-07-17 11:46:16,169] Trial 135 finished with value: -0.13673905024661262 and parameters: {'scalers': 'robust', 'ratios': 'norm_ratio', 'imputers': 'none', 'n_estimators': 150, 'learning_rate': 0.00023202433357702725, 'max_depth': 9, 'min_child_weight': 9, 'subsample': 0.8, 'colsample_bytree': 0.6, 'colsample_bylevel': 0.7, 'reg_alpha': 3.312833742239891, 'reg_lambda': 0.006970599699661231, 'gamma': 58.804628972143654}. Best is trial 68 with value: -0.13735675268839762.
[I 2026-07-17 11:46:16,517] Trial 136 finished with value: -0.13705766936330196 and parameters: {'scalers': 'robust', 'ratios': 'norm_ratio', 'imputers': 'none', 'n_estimators': 150, 'learning_rate': 0.0002252739257370775, 'max_depth': 9, 'min_child_weight': 1, 'subsample': 0.8, 'colsample_bytree': 0.6, 'colsample_bylevel': 0.5, 'reg_alpha': 30.477943219611355, 'reg_lambda': 0.0007053385554988224, 'gamma': 62.106070697749225}. Best is trial 68 with value: -0.13735675268839762.
[I 2026-07-17 11:46:16,819] Trial 137 finished with value: -0.13667252318537707 and parameters: {'scalers': 'robust', 'ratios': 'norm_ratio', 'imputers': 'none', 'n_estimators': 150, 'learning_rate': 0.00023127227810544078, 'max_depth': 9, 'min_child_weight': 1, 'subsample': 0.8, 'colsample_bytree': 0.6, 'colsample_bylevel': 0.8, 'reg_alpha': 28.206055933463244, 'reg_lambda': 0.0004399615151825418, 'gamma': 53.32537926452656}. Best is trial 68 with value: -0.13735675268839762.
[I 2026-07-17 11:46:17,082] Trial 138 finished with value: -0.13707166315835062 and parameters: {'scalers': 'robust', 'ratios': 'norm_ratio', 'imputers': 'none', 'n_estimators': 150, 'learning_rate': 0.00021894473150309632, 'max_depth': 9, 'min_child_weight': 8, 'subsample': 0.8, 'colsample_bytree': 0.6, 'colsample_bylevel': 0.5, 'reg_alpha': 3.0961318508234057, 'reg_lambda': 0.14017720933423466, 'gamma': 60.18166626928331}. Best is trial 68 with value: -0.13735675268839762.
[I 2026-07-17 11:46:17,348] Trial 139 finished with value: -0.13705515676441693 and parameters: {'scalers': 'robust', 'ratios': 'norm_ratio', 'imputers': 'none', 'n_estimators': 150, 'learning_rate': 0.0002264343602437185, 'max_depth': 9, 'min_child_weight': 1, 'subsample': 0.8, 'colsample_bytree': 0.6, 'colsample_bylevel': 0.5, 'reg_alpha': 9.670822267126345, 'reg_lambda': 0.001168758685296247, 'gamma': 51.07045435599042}. Best is trial 68 with value: -0.13735675268839762.
[I 2026-07-17 11:46:17,681] Trial 140 finished with value: -0.13724512742123485 and parameters: {'scalers': 'robust', 'ratios': 'norm_ratio', 'imputers': 'none', 'n_estimators': 150, 'learning_rate': 0.00014057358035385434, 'max_depth': 9, 'min_child_weight': 1, 'subsample': 0.8, 'colsample_bytree': 0.6, 'colsample_bylevel': 0.5, 'reg_alpha': 27.55593845820241, 'reg_lambda': 0.0002647967087646991, 'gamma': 53.62022464123243}. Best is trial 68 with value: -0.13735675268839762.
[I 2026-07-17 11:46:17,933] Trial 141 finished with value: -0.13718531468281345 and parameters: {'scalers': 'robust', 'ratios': 'norm_ratio', 'imputers': 'none', 'n_estimators': 150, 'learning_rate': 0.00014177153829395534, 'max_depth': 9, 'min_child_weight': 8, 'subsample': 0.8, 'colsample_bytree': 0.6, 'colsample_bylevel': 0.5, 'reg_alpha': 9.10200223538238, 'reg_lambda': 0.03468277282333055, 'gamma': 25.7597997349462}. Best is trial 68 with value: -0.13735675268839762.
[I 2026-07-17 11:46:18,287] Trial 142 finished with value: -0.13689538657837658 and parameters: {'scalers': 'robust', 'ratios': 'norm_ratio', 'imputers': 'none', 'n_estimators': 150, 'learning_rate': 0.0001436108597798598, 'max_depth': 9, 'min_child_weight': 8, 'subsample': 0.8, 'colsample_bytree': 0.6, 'colsample_bylevel': 0.7, 'reg_alpha': 0.31892558035949464, 'reg_lambda': 0.03364450879876296, 'gamma': 25.693646656951877}. Best is trial 68 with value: -0.13735675268839762.
[I 2026-07-17 11:46:18,634] Trial 143 finished with value: -0.13702084159756717 and parameters: {'scalers': 'robust', 'ratios': 'norm_ratio', 'imputers': 'none', 'n_estimators': 200, 'learning_rate': 0.0001447773903999125, 'max_depth': 10, 'min_child_weight': 8, 'subsample': 0.8, 'colsample_bytree': 0.6, 'colsample_bylevel': 0.6, 'reg_alpha': 8.825288416952356, 'reg_lambda': 0.03268296261155536, 'gamma': 24.193639412687254}. Best is trial 68 with value: -0.13735675268839762.
[I 2026-07-17 11:46:19,019] Trial 144 finished with value: -0.13702422403595454 and parameters: {'scalers': 'robust', 'ratios': 'norm_ratio', 'imputers': 'none', 'n_estimators': 200, 'learning_rate': 0.00014359755477101122, 'max_depth': 10, 'min_child_weight': 8, 'subsample': 0.8, 'colsample_bytree': 0.6, 'colsample_bylevel': 0.6, 'reg_alpha': 8.631369940202966, 'reg_lambda': 0.03053339554210486, 'gamma': 24.307744563965294}. Best is trial 68 with value: -0.13735675268839762.
[I 2026-07-17 11:46:19,372] Trial 145 finished with value: -0.1369807048650368 and parameters: {'scalers': 'robust', 'ratios': 'norm_ratio', 'imputers': 'none', 'n_estimators': 200, 'learning_rate': 0.00013992960860368482, 'max_depth': 10, 'min_child_weight': 8, 'subsample': 0.7, 'colsample_bytree': 0.6, 'colsample_bylevel': 0.6, 'reg_alpha': 8.564935544048422, 'reg_lambda': 0.05847218421209445, 'gamma': 25.756215625357736}. Best is trial 68 with value: -0.13735675268839762.
[I 2026-07-17 11:46:19,776] Trial 146 finished with value: -0.1368059521967284 and parameters: {'scalers': 'robust', 'ratios': 'norm_ratio', 'imputers': 'none', 'n_estimators': 200, 'learning_rate': 0.00014077366316634586, 'max_depth': 10, 'min_child_weight': 8, 'subsample': 0.7, 'colsample_bytree': 0.6, 'colsample_bylevel': 0.6, 'reg_alpha': 0.4206530645663415, 'reg_lambda': 0.031345162910703744, 'gamma': 22.671476529687126}. Best is trial 68 with value: -0.13735675268839762.
[I 2026-07-17 11:46:20,152] Trial 147 finished with value: -0.13692421538004532 and parameters: {'scalers': 'none', 'ratios': 'norm_ratio', 'imputers': 'none', 'n_estimators': 200, 'learning_rate': 0.00013716203704295182, 'max_depth': 10, 'min_child_weight': 8, 'subsample': 0.8, 'colsample_bytree': 0.6, 'colsample_bylevel': 0.6, 'reg_alpha': 0.29884704064203865, 'reg_lambda': 0.03086690221236309, 'gamma': 27.94153438815112}. Best is trial 68 with value: -0.13735675268839762.
[I 2026-07-17 11:46:20,517] Trial 148 finished with value: -0.13696495064782793 and parameters: {'scalers': 'robust', 'ratios': 'norm_ratio', 'imputers': 'none', 'n_estimators': 200, 'learning_rate': 0.00013872047637542736, 'max_depth': 10, 'min_child_weight': 8, 'subsample': 0.8, 'colsample_bytree': 0.6, 'colsample_bylevel': 0.5, 'reg_alpha': 0.26336245269052255, 'reg_lambda': 0.03016929156251702, 'gamma': 24.24631082374536}. Best is trial 68 with value: -0.13735675268839762.
[I 2026-07-17 11:46:20,887] Trial 149 finished with value: -0.1369799795292209 and parameters: {'scalers': 'robust', 'ratios': 'norm_ratio', 'imputers': 'none', 'n_estimators': 200, 'learning_rate': 0.00014438270770536485, 'max_depth': 10, 'min_child_weight': 8, 'subsample': 0.8, 'colsample_bytree': 0.6, 'colsample_bylevel': 0.5, 'reg_alpha': 0.3487020810833826, 'reg_lambda': 0.00013017751208805781, 'gamma': 25.635802579590816}. Best is trial 68 with value: -0.13735675268839762.
[I 2026-07-17 11:46:21,297] Trial 150 finished with value: -0.13702830809555727 and parameters: {'scalers': 'robust', 'ratios': 'norm_ratio', 'imputers': 'none', 'n_estimators': 200, 'learning_rate': 0.000151393545937172, 'max_depth': 10, 'min_child_weight': 9, 'subsample': 0.8, 'colsample_bytree': 0.6, 'colsample_bylevel': 0.5, 'reg_alpha': 7.5103106192843345, 'reg_lambda': 5.554750553571526e-06, 'gamma': 24.471018928953615}. Best is trial 68 with value: -0.13735675268839762.
[I 2026-07-17 11:46:21,654] Trial 151 finished with value: -0.13705470232675485 and parameters: {'scalers': 'robust', 'ratios': 'norm_ratio', 'imputers': 'none', 'n_estimators': 200, 'learning_rate': 0.0001485250377595899, 'max_depth': 10, 'min_child_weight': 8, 'subsample': 0.7, 'colsample_bytree': 0.6, 'colsample_bylevel': 0.5, 'reg_alpha': 1.0779135425535782, 'reg_lambda': 0.0002805059899022604, 'gamma': 26.33548106636697}. Best is trial 68 with value: -0.13735675268839762.
[I 2026-07-17 11:46:22,009] Trial 152 finished with value: -0.1371438637768615 and parameters: {'scalers': 'none', 'ratios': 'norm_ratio', 'imputers': 'none', 'n_estimators': 200, 'learning_rate': 0.00012750857340433917, 'max_depth': 9, 'min_child_weight': 9, 'subsample': 0.7, 'colsample_bytree': 0.6, 'colsample_bylevel': 0.5, 'reg_alpha': 1.0422903497799372, 'reg_lambda': 0.054323311432003966, 'gamma': 39.57534983783459}. Best is trial 68 with value: -0.13735675268839762.
[I 2026-07-17 11:46:22,651] Trial 153 finished with value: -0.13565220175047407 and parameters: {'scalers': 'none', 'ratios': 'norm_ratio', 'imputers': 'none', 'n_estimators': 350, 'learning_rate': 0.00031999798441607896, 'max_depth': 9, 'min_child_weight': 9, 'subsample': 0.7, 'colsample_bytree': 0.6, 'colsample_bylevel': 0.5, 'reg_alpha': 1.0579904737922166, 'reg_lambda': 9.97685541314896e-05, 'gamma': 36.29968151585903}. Best is trial 68 with value: -0.13735675268839762.
[I 2026-07-17 11:46:23,242] Trial 154 finished with value: -0.1357540316636663 and parameters: {'scalers': 'none', 'ratios': 'norm_ratio', 'imputers': 'none', 'n_estimators': 350, 'learning_rate': 0.00030291116924115944, 'max_depth': 9, 'min_child_weight': 9, 'subsample': 0.8, 'colsample_bytree': 0.6, 'colsample_bylevel': 0.5, 'reg_alpha': 24.50945257253688, 'reg_lambda': 0.0001798297769290957, 'gamma': 38.00410003150052}. Best is trial 68 with value: -0.13735675268839762.
[I 2026-07-17 11:46:23,857] Trial 155 finished with value: -0.13681229215944934 and parameters: {'scalers': 'robust', 'ratios': 'norm_ratio', 'imputers': 'none', 'n_estimators': 350, 'learning_rate': 0.00016385256815168344, 'max_depth': 9, 'min_child_weight': 9, 'subsample': 0.8, 'colsample_bytree': 0.5, 'colsample_bylevel': 0.5, 'reg_alpha': 21.146272641936786, 'reg_lambda': 0.2009802036884416, 'gamma': 37.74414938472411}. Best is trial 68 with value: -0.13735675268839762.
[I 2026-07-17 11:46:24,459] Trial 156 finished with value: -0.13619719948982698 and parameters: {'scalers': 'robust', 'ratios': 'norm_ratio', 'imputers': 'none', 'n_estimators': 350, 'learning_rate': 0.0003018457626199894, 'max_depth': 9, 'min_child_weight': 7, 'subsample': 0.8, 'colsample_bytree': 0.5, 'colsample_bylevel': 0.5, 'reg_alpha': 1.0804587208208885, 'reg_lambda': 0.00018616262261959563, 'gamma': 39.497473979232836}. Best is trial 68 with value: -0.13735675268839762.
[I 2026-07-17 11:46:25,101] Trial 157 finished with value: -0.13641528546811482 and parameters: {'scalers': 'robust', 'ratios': 'norm_ratio', 'imputers': 'none', 'n_estimators': 350, 'learning_rate': 0.00019010397484915225, 'max_depth': 9, 'min_child_weight': 9, 'subsample': 0.8, 'colsample_bytree': 0.6, 'colsample_bylevel': 0.5, 'reg_alpha': 0.9631332239717701, 'reg_lambda': 0.19640135271588954, 'gamma': 41.80164076824425}. Best is trial 68 with value: -0.13735675268839762.
[I 2026-07-17 11:46:25,377] Trial 158 finished with value: -0.1373914361862724 and parameters: {'scalers': 'robust', 'ratios': 'norm_ratio', 'imputers': 'none', 'n_estimators': 100, 'learning_rate': 0.00012063707032647636, 'max_depth': 9, 'min_child_weight': 2, 'subsample': 0.8, 'colsample_bytree': 0.6, 'colsample_bylevel': 0.5, 'reg_alpha': 1.0170858463889823, 'reg_lambda': 0.19957316642154221, 'gamma': 41.24829673208385}. Best is trial 158 with value: -0.1373914361862724.
[I 2026-07-17 11:46:25,544] Trial 159 finished with value: -0.13739133107620805 and parameters: {'scalers': 'robust', 'ratios': 'norm_ratio', 'imputers': 'none', 'n_estimators': 100, 'learning_rate': 0.00012072007947923175, 'max_depth': 9, 'min_child_weight': 7, 'subsample': 0.8, 'colsample_bytree': 0.6, 'colsample_bylevel': 0.5, 'reg_alpha': 1.6547911668968787, 'reg_lambda': 0.056999029983643694, 'gamma': 43.17548790955898}. Best is trial 158 with value: -0.1373914361862724.
[I 2026-07-17 11:46:26,141] Trial 160 finished with value: -0.13611415522103282 and parameters: {'scalers': 'none', 'ratios': 'norm_ratio', 'imputers': 'none', 'n_estimators': 350, 'learning_rate': 0.000320593154398079, 'max_depth': 9, 'min_child_weight': 9, 'subsample': 0.8, 'colsample_bytree': 0.5, 'colsample_bylevel': 0.5, 'reg_alpha': 20.890348100482765, 'reg_lambda': 0.0520725931710271, 'gamma': 39.92327854042923}. Best is trial 158 with value: -0.1373914361862724.
[I 2026-07-17 11:46:26,367] Trial 161 finished with value: -0.1372579760705806 and parameters: {'scalers': 'none', 'ratios': 'norm_ratio', 'imputers': 'none', 'n_estimators': 100, 'learning_rate': 0.00018679057018343952, 'max_depth': 9, 'min_child_weight': 9, 'subsample': 0.8, 'colsample_bytree': 0.5, 'colsample_bylevel': 0.5, 'reg_alpha': 0.15435663164827265, 'reg_lambda': 0.010851613963763775, 'gamma': 8.403512835030895}. Best is trial 158 with value: -0.1373914361862724.
[I 2026-07-17 11:46:26,578] Trial 162 finished with value: -0.13729904130486859 and parameters: {'scalers': 'none', 'ratios': 'norm_ratio', 'imputers': 'none', 'n_estimators': 100, 'learning_rate': 0.00018771885558353059, 'max_depth': 9, 'min_child_weight': 7, 'subsample': 0.8, 'colsample_bytree': 0.6, 'colsample_bylevel': 0.5, 'reg_alpha': 1.5416475499954418, 'reg_lambda': 0.19657619025999626, 'gamma': 40.925393477839165}. Best is trial 158 with value: -0.1373914361862724.
[I 2026-07-17 11:46:26,849] Trial 163 finished with value: -0.13730101050648558 and parameters: {'scalers': 'none', 'ratios': 'norm_ratio', 'imputers': 'none', 'n_estimators': 100, 'learning_rate': 0.0001862829317166585, 'max_depth': 9, 'min_child_weight': 7, 'subsample': 0.8, 'colsample_bytree': 0.6, 'colsample_bylevel': 0.5, 'reg_alpha': 0.5549147758920357, 'reg_lambda': 0.05829724882418967, 'gamma': 44.14651445767248}. Best is trial 158 with value: -0.1373914361862724.
[I 2026-07-17 11:46:27,072] Trial 164 finished with value: -0.13724862792726417 and parameters: {'scalers': 'none', 'ratios': 'norm_ratio', 'imputers': 'none', 'n_estimators': 100, 'learning_rate': 0.00018879110363907603, 'max_depth': 9, 'min_child_weight': 2, 'subsample': 0.8, 'colsample_bytree': 0.6, 'colsample_bylevel': 0.5, 'reg_alpha': 51.590972754296715, 'reg_lambda': 0.011334215548272495, 'gamma': 8.441605719567498}. Best is trial 158 with value: -0.1373914361862724.
[I 2026-07-17 11:46:27,295] Trial 165 finished with value: -0.10517976645997933 and parameters: {'scalers': 'none', 'ratios': 'norm_ratio', 'imputers': 'none', 'n_estimators': 100, 'learning_rate': 0.019720178036227595, 'max_depth': 9, 'min_child_weight': 2, 'subsample': 0.8, 'colsample_bytree': 0.6, 'colsample_bylevel': 0.5, 'reg_alpha': 0.5101049662637538, 'reg_lambda': 0.050579654487359064, 'gamma': 8.792134337876956}. Best is trial 158 with value: -0.1373914361862724.
[I 2026-07-17 11:46:27,490] Trial 166 finished with value: -0.13730183737579363 and parameters: {'scalers': 'robust', 'ratios': 'norm_ratio', 'imputers': 'none', 'n_estimators': 100, 'learning_rate': 0.00011601359425269547, 'max_depth': 9, 'min_child_weight': 2, 'subsample': 0.8, 'colsample_bytree': 0.6, 'colsample_bylevel': 0.5, 'reg_alpha': 0.5056008937425347, 'reg_lambda': 0.011555403680421693, 'gamma': 8.898001425190294}. Best is trial 158 with value: -0.1373914361862724.
[I 2026-07-17 11:46:27,733] Trial 167 finished with value: -0.12027914102990812 and parameters: {'scalers': 'robust', 'ratios': 'norm_ratio', 'imputers': 'median', 'n_estimators': 100, 'learning_rate': 0.016194561376777508, 'max_depth': 8, 'min_child_weight': 2, 'subsample': 0.8, 'colsample_bytree': 0.6, 'colsample_bylevel': 0.5, 'reg_alpha': 0.19639290176005195, 'reg_lambda': 0.06598122215012085, 'gamma': 77.54467303196816}. Best is trial 158 with value: -0.1373914361862724.
[I 2026-07-17 11:46:28,019] Trial 168 finished with value: -0.13739369174418614 and parameters: {'scalers': 'robust', 'ratios': 'norm_ratio', 'imputers': 'none', 'n_estimators': 100, 'learning_rate': 0.00011899742916544546, 'max_depth': 9, 'min_child_weight': 7, 'subsample': 0.8, 'colsample_bytree': 0.6, 'colsample_bylevel': 0.5, 'reg_alpha': 0.5687628237790896, 'reg_lambda': 0.20238449867518934, 'gamma': 68.01659887993763}. Best is trial 168 with value: -0.13739369174418614.
[I 2026-07-17 11:46:28,151] Trial 169 finished with value: -0.13736964565375018 and parameters: {'scalers': 'robust', 'ratios': 'norm_ratio', 'imputers': 'none', 'n_estimators': 100, 'learning_rate': 0.00011696299760397516, 'max_depth': 9, 'min_child_weight': 2, 'subsample': 0.8, 'colsample_bytree': 0.5, 'colsample_bylevel': 0.5, 'reg_alpha': 0.16032917577718367, 'reg_lambda': 0.010549583120666351, 'gamma': 8.509015269190973}. Best is trial 168 with value: -0.13739369174418614.
[I 2026-07-17 11:46:28,376] Trial 170 finished with value: -0.13739201579950946 and parameters: {'scalers': 'none', 'ratios': 'norm_ratio', 'imputers': 'none', 'n_estimators': 100, 'learning_rate': 0.00012019979979297862, 'max_depth': 9, 'min_child_weight': 7, 'subsample': 0.8, 'colsample_bytree': 0.6, 'colsample_bylevel': 0.5, 'reg_alpha': 0.16031749619009555, 'reg_lambda': 0.012685822780754034, 'gamma': 64.74556073513898}. Best is trial 168 with value: -0.13739369174418614.
[I 2026-07-17 11:46:28,591] Trial 171 finished with value: -0.13735995034055898 and parameters: {'scalers': 'none', 'ratios': 'norm_ratio', 'imputers': 'none', 'n_estimators': 100, 'learning_rate': 0.00012176166898131394, 'max_depth': 8, 'min_child_weight': 7, 'subsample': 0.8, 'colsample_bytree': 0.5, 'colsample_bylevel': 0.5, 'reg_alpha': 0.5160234335224922, 'reg_lambda': 0.20440634608269284, 'gamma': 17.414082830925466}. Best is trial 168 with value: -0.13739369174418614.
[I 2026-07-17 11:46:28,810] Trial 172 finished with value: -0.13736921041558997 and parameters: {'scalers': 'none', 'ratios': 'norm_ratio', 'imputers': 'none', 'n_estimators': 100, 'learning_rate': 0.00011595749766171525, 'max_depth': 8, 'min_child_weight': 7, 'subsample': 0.8, 'colsample_bytree': 0.5, 'colsample_bylevel': 0.5, 'reg_alpha': 0.15049519593107905, 'reg_lambda': 0.003202573831903766, 'gamma': 15.735709853888311}. Best is trial 168 with value: -0.13739369174418614.
[I 2026-07-17 11:46:29,100] Trial 173 finished with value: -0.13730850011351142 and parameters: {'scalers': 'none', 'ratios': 'norm_ratio', 'imputers': 'none', 'n_estimators': 100, 'learning_rate': 0.0001150402551504063, 'max_depth': 8, 'min_child_weight': 7, 'subsample': 0.8, 'colsample_bytree': 0.6, 'colsample_bylevel': 0.5, 'reg_alpha': 1.50530783239319, 'reg_lambda': 0.004346597336582572, 'gamma': 17.535298143363406}. Best is trial 168 with value: -0.13739369174418614.
[I 2026-07-17 11:46:29,470] Trial 174 finished with value: -0.13729915503158227 and parameters: {'scalers': 'none', 'ratios': 'norm_ratio', 'imputers': 'none', 'n_estimators': 100, 'learning_rate': 0.00011943045313102717, 'max_depth': 8, 'min_child_weight': 7, 'subsample': 0.8, 'colsample_bytree': 0.6, 'colsample_bylevel': 0.5, 'reg_alpha': 2.3057221384572073, 'reg_lambda': 0.22474829940802526, 'gamma': 15.563082757790257}. Best is trial 168 with value: -0.13739369174418614.
[I 2026-07-17 11:46:29,857] Trial 175 finished with value: -0.13723691673496766 and parameters: {'scalers': 'none', 'ratios': 'norm_ratio', 'imputers': 'none', 'n_estimators': 100, 'learning_rate': 0.0001175196825300592, 'max_depth': 8, 'min_child_weight': 7, 'subsample': 0.8, 'colsample_bytree': 0.6, 'colsample_bylevel': 0.5, 'reg_alpha': 0.08104034776723293, 'reg_lambda': 0.005884017623758825, 'gamma': 5.360634108938605}. Best is trial 168 with value: -0.13739369174418614.
[I 2026-07-17 11:46:30,264] Trial 176 finished with value: -0.13730477124028623 and parameters: {'scalers': 'none', 'ratios': 'norm_ratio', 'imputers': 'none', 'n_estimators': 100, 'learning_rate': 0.00011711825181528565, 'max_depth': 9, 'min_child_weight': 7, 'subsample': 0.8, 'colsample_bytree': 0.6, 'colsample_bylevel': 0.5, 'reg_alpha': 0.05756976968676365, 'reg_lambda': 0.003027490277529391, 'gamma': 17.91404838272874}. Best is trial 168 with value: -0.13739369174418614.
[I 2026-07-17 11:46:30,484] Trial 177 finished with value: -0.1373694812729101 and parameters: {'scalers': 'none', 'ratios': 'norm_ratio', 'imputers': 'none', 'n_estimators': 100, 'learning_rate': 0.00011594308856891213, 'max_depth': 8, 'min_child_weight': 7, 'subsample': 0.8, 'colsample_bytree': 0.5, 'colsample_bylevel': 0.5, 'reg_alpha': 0.06784295938204832, 'reg_lambda': 0.0037455842233157337, 'gamma': 17.00599044620689}. Best is trial 168 with value: -0.13739369174418614.
[I 2026-07-17 11:46:30,746] Trial 178 finished with value: -0.13732821163490502 and parameters: {'scalers': 'none', 'ratios': 'norm_ratio', 'imputers': 'none', 'n_estimators': 100, 'learning_rate': 0.000112676599591651, 'max_depth': 8, 'min_child_weight': 7, 'subsample': 0.8, 'colsample_bytree': 0.5, 'colsample_bylevel': 0.5, 'reg_alpha': 0.06856988244264763, 'reg_lambda': 0.003952647271304582, 'gamma': 5.0237227150866754}. Best is trial 168 with value: -0.13739369174418614.
[I 2026-07-17 11:46:30,997] Trial 179 finished with value: -0.1373451249575326 and parameters: {'scalers': 'none', 'ratios': 'norm_ratio', 'imputers': 'none', 'n_estimators': 100, 'learning_rate': 0.00011494287341530189, 'max_depth': 7, 'min_child_weight': 7, 'subsample': 0.8, 'colsample_bytree': 0.5, 'colsample_bylevel': 0.5, 'reg_alpha': 0.06612409299127216, 'reg_lambda': 0.00257133161589815, 'gamma': 5.184113425955043}. Best is trial 168 with value: -0.13739369174418614.
