[I 2026-07-17 11:47:29,793] Trial 315 finished with value: -0.13704977107667626 and parameters: {'scalers': 'standard', 'ratios': 'norm_ratio', 'imputers': 'none', 'n_estimators': 200, 'learning_rate': 0.00018380557092119662, 'max_depth': 8, 'min_child_weight': 8, 'subsample': 0.8, 'colsample_bytree': 0.5, 'colsample_bylevel': 0.5, 'reg_alpha': 0.018064032368981523, 'reg_lambda': 0.0016242968362614302, 'gamma': 52.76933031882787}. Best is trial 296 with value: -0.13742159861002806.
[I 2026-07-17 11:47:30,176] Trial 316 finished with value: -0.13705284668379702 and parameters: {'scalers': 'standard', 'ratios': 'norm_ratio', 'imputers': 'none', 'n_estimators': 200, 'learning_rate': 0.00018268591234779676, 'max_depth': 8, 'min_child_weight': 7, 'subsample': 0.8, 'colsample_bytree': 0.5, 'colsample_bylevel': 0.5, 'reg_alpha': 0.0026387212229514404, 'reg_lambda': 0.0013133011670602994, 'gamma': 51.02483721397759}. Best is trial 296 with value: -0.13742159861002806.
[I 2026-07-17 11:47:30,560] Trial 317 finished with value: -0.13696456157487116 and parameters: {'scalers': 'standard', 'ratios': 'norm_ratio', 'imputers': 'none', 'n_estimators': 200, 'learning_rate': 0.00010084841596126265, 'max_depth': 8, 'min_child_weight': 8, 'subsample': 0.8, 'colsample_bytree': 1.0, 'colsample_bylevel': 0.5, 'reg_alpha': 0.0044667910739959295, 'reg_lambda': 0.001543073804261159, 'gamma': 53.55933859417137}. Best is trial 296 with value: -0.13742159861002806.
[I 2026-07-17 11:47:30,923] Trial 318 finished with value: -0.0951305964511455 and parameters: {'scalers': 'standard', 'ratios': 'norm_ratio', 'imputers': 'none', 'n_estimators': 200, 'learning_rate': 0.04902649393227627, 'max_depth': 8, 'min_child_weight': 7, 'subsample': 0.8, 'colsample_bytree': 0.5, 'colsample_bylevel': 0.5, 'reg_alpha': 0.00649021749625646, 'reg_lambda': 0.002117904707572278, 'gamma': 59.04932535747967}. Best is trial 296 with value: -0.13742159861002806.
[I 2026-07-17 11:47:31,322] Trial 319 finished with value: -0.1372738566996956 and parameters: {'scalers': 'standard', 'ratios': 'norm_ratio', 'imputers': 'none', 'n_estimators': 200, 'learning_rate': 0.00010249398265486314, 'max_depth': 8, 'min_child_weight': 2, 'subsample': 0.8, 'colsample_bytree': 0.5, 'colsample_bylevel': 0.5, 'reg_alpha': 0.0013540055620678085, 'reg_lambda': 0.00247089200620807, 'gamma': 51.4791497498788}. Best is trial 296 with value: -0.13742159861002806.
