[I 2026-07-17 11:41:05,626] A new study created in RDB with name: mult_quant_study_v2
[I 2026-07-17 11:41:16,541] Trial 2 finished with value: -0.06268251577205185 and parameters: {'scalers': 'robust', 'ratios': 'norm_ratio', 'imputers': 'median', 'n_estimators': 1100, 'learning_rate': 0.08747896751198848, 'max_depth': 11, 'min_child_weight': 10, 'subsample': 0.6, 'colsample_bytree': 0.9, 'colsample_bylevel': 0.7, 'reg_alpha': 4.5385715280250604e-05, 'reg_lambda': 0.002636966139287286, 'gamma': 0.5663794384135002}. Best is trial 2 with value: -0.06268251577205185.
[I 2026-07-17 11:41:17,236] Trial 0 finished with value: -0.0733236186932172 and parameters: {'scalers': 'none', 'ratios': 'norm_ratio', 'imputers': 'mean', 'n_estimators': 300, 'learning_rate': 0.27366421733123547, 'max_depth': 7, 'min_child_weight': 9, 'subsample': 1.0, 'colsample_bytree': 1.0, 'colsample_bylevel': 1.0, 'reg_alpha': 45.20183645347781, 'reg_lambda': 1.7302718765503833, 'gamma': 0.011140723548318314}. Best is trial 0 with value: -0.0733236186932172.
[I 2026-07-17 11:41:24,475] Trial 1 finished with value: -0.06225017826418929 and parameters: {'scalers': 'none', 'ratios': 'log_ratio', 'imputers': 'none', 'n_estimators': 2900, 'learning_rate': 0.04410462002310403, 'max_depth': 4, 'min_child_weight': 2, 'subsample': 0.6, 'colsample_bytree': 0.5, 'colsample_bylevel': 0.5, 'reg_alpha': 7.699267206569191, 'reg_lambda': 0.00032941331737621637, 'gamma': 5.3190867609329694e-05}. Best is trial 0 with value: -0.0733236186932172.
[I 2026-07-17 11:41:35,659] Trial 4 finished with value: -0.06948702986244971 and parameters: {'scalers': 'none', 'ratios': 'log_ratio', 'imputers': 'median', 'n_estimators': 2750, 'learning_rate': 0.04582398624574382, 'max_depth': 6, 'min_child_weight': 3, 'subsample': 0.6, 'colsample_bytree': 0.5, 'colsample_bylevel': 0.5, 'reg_alpha': 0.001132304098727541, 'reg_lambda': 0.0012579166809977423, 'gamma': 0.010382296574884969}. Best is trial 0 with value: -0.0733236186932172.
[I 2026-07-17 11:41:37,920] Trial 3 finished with value: -0.06473101987776972 and parameters: {'scalers': 'standard', 'ratios': 'norm_ratio', 'imputers': 'none', 'n_estimators': 700, 'learning_rate': 0.00845433671781854, 'max_depth': 4, 'min_child_weight': 7, 'subsample': 0.6, 'colsample_bytree': 0.9, 'colsample_bylevel': 0.7, 'reg_alpha': 15.572415603938321, 'reg_lambda': 5.627097336879517e-06, 'gamma': 0.0001658703710116348}. Best is trial 0 with value: -0.0733236186932172.
[I 2026-07-17 11:41:41,181] Trial 5 finished with value: -0.07556833578858928 and parameters: {'scalers': 'standard', 'ratios': 'log_ratio', 'imputers': 'none', 'n_estimators': 2150, 'learning_rate': 0.41744126174950064, 'max_depth': 11, 'min_child_weight': 9, 'subsample': 0.6, 'colsample_bytree': 0.7, 'colsample_bylevel': 0.6, 'reg_alpha': 47.27864861213303, 'reg_lambda': 1.5184750761954156, 'gamma': 1.6564403517003312e-05}. Best is trial 5 with value: -0.07556833578858928.
[I 2026-07-17 11:41:51,502] Trial 6 finished with value: -0.06303403252512849 and parameters: {'scalers': 'none', 'ratios': 'norm_ratio', 'imputers': 'median', 'n_estimators': 2350, 'learning_rate': 0.0714361353355217, 'max_depth': 4, 'min_child_weight': 10, 'subsample': 0.7, 'colsample_bytree': 0.9, 'colsample_bylevel': 0.8, 'reg_alpha': 0.22217717869995196, 'reg_lambda': 4.027888214055112e-05, 'gamma': 0.01858268402287953}. Best is trial 5 with value: -0.07556833578858928.
[I 2026-07-17 11:41:56,017] Trial 7 finished with value: -0.08063145179672344 and parameters: {'scalers': 'none', 'ratios': 'log_ratio', 'imputers': 'mean', 'n_estimators': 2800, 'learning_rate': 0.02987904737226731, 'max_depth': 7, 'min_child_weight': 6, 'subsample': 0.5, 'colsample_bytree': 0.9, 'colsample_bylevel': 0.8, 'reg_alpha': 50.08744843010743, 'reg_lambda': 2.227212379258063e-05, 'gamma': 1.425289994726556e-06}. Best is trial 7 with value: -0.08063145179672344.
[I 2026-07-17 11:42:39,460] Trial 8 finished with value: -0.07416705771965862 and parameters: {'scalers': 'none', 'ratios': 'log_ratio', 'imputers': 'median', 'n_estimators': 2900, 'learning_rate': 0.000999805651000577, 'max_depth': 11, 'min_child_weight': 3, 'subsample': 0.5, 'colsample_bytree': 0.6, 'colsample_bylevel': 1.0, 'reg_alpha': 0.046318658895689604, 'reg_lambda': 10.419390130960156, 'gamma': 0.04166614102375754}. Best is trial 7 with value: -0.08063145179672344.
[I 2026-07-17 11:42:43,122] Trial 9 finished with value: -0.10677890448044004 and parameters: {'scalers': 'standard', 'ratios': 'log_ratio', 'imputers': 'none', 'n_estimators': 2250, 'learning_rate': 0.0007262552307807362, 'max_depth': 10, 'min_child_weight': 8, 'subsample': 0.6, 'colsample_bytree': 0.5, 'colsample_bylevel': 0.7, 'reg_alpha': 5.30050588445078e-05, 'reg_lambda': 5.574188894501452e-05, 'gamma': 9.569801693070069}. Best is trial 9 with value: -0.10677890448044004.
[I 2026-07-17 11:42:46,449] Trial 10 finished with value: -0.10970137408682207 and parameters: {'scalers': 'robust', 'ratios': 'log_ratio', 'imputers': 'mean', 'n_estimators': 800, 'learning_rate': 0.000662255788718728, 'max_depth': 8, 'min_child_weight': 6, 'subsample': 0.5, 'colsample_bytree': 0.8, 'colsample_bylevel': 0.7, 'reg_alpha': 14.694434807462422, 'reg_lambda': 40.097520464848955, 'gamma': 6.5827641787802615e-06}. Best is trial 10 with value: -0.10970137408682207.
[I 2026-07-17 11:43:10,502] Trial 12 finished with value: -0.13552092227934387 and parameters: {'scalers': 'robust', 'ratios': 'log_ratio', 'imputers': 'none', 'n_estimators': 350, 'learning_rate': 0.0001763638998447379, 'max_depth': 4, 'min_child_weight': 8, 'subsample': 0.5, 'colsample_bytree': 0.7, 'colsample_bylevel': 0.6, 'reg_alpha': 0.011805246202269644, 'reg_lambda': 0.00010000400619046708, 'gamma': 9.046358968614243}. Best is trial 12 with value: -0.13552092227934387.
[I 2026-07-17 11:43:11,972] Trial 11 finished with value: -0.06826670167295927 and parameters: {'scalers': 'none', 'ratios': 'log_ratio', 'imputers': 'median', 'n_estimators': 1300, 'learning_rate': 0.027514567249349423, 'max_depth': 11, 'min_child_weight': 5, 'subsample': 1.0, 'colsample_bytree': 0.9, 'colsample_bylevel': 0.7, 'reg_alpha': 5.231918455895233e-06, 'reg_lambda': 55.908130507405225, 'gamma': 7.129541730986779e-06}. Best is trial 12 with value: -0.13552092227934387.
[I 2026-07-17 11:43:23,282] Trial 13 finished with value: -0.06722561730139026 and parameters: {'scalers': 'standard', 'ratios': 'norm_ratio', 'imputers': 'none', 'n_estimators': 2500, 'learning_rate': 0.0477858201988899, 'max_depth': 6, 'min_child_weight': 6, 'subsample': 0.9, 'colsample_bytree': 0.5, 'colsample_bylevel': 0.5, 'reg_alpha': 0.07439102483899304, 'reg_lambda': 0.0038357566934724744, 'gamma': 1.7180562393628468e-06}. Best is trial 12 with value: -0.13552092227934387.
[I 2026-07-17 11:43:24,970] Trial 14 finished with value: -0.07551746891399588 and parameters: {'scalers': 'robust', 'ratios': 'log_ratio', 'imputers': 'none', 'n_estimators': 1100, 'learning_rate': 0.07227397246011526, 'max_depth': 8, 'min_child_weight': 1, 'subsample': 0.7, 'colsample_bytree': 0.8, 'colsample_bylevel': 0.9, 'reg_alpha': 31.88465403491908, 'reg_lambda': 0.00015194278159617387, 'gamma': 0.3486528723253763}. Best is trial 12 with value: -0.13552092227934387.
[I 2026-07-17 11:43:26,338] Trial 15 finished with value: -0.069911763400256 and parameters: {'scalers': 'standard', 'ratios': 'norm_ratio', 'imputers': 'none', 'n_estimators': 200, 'learning_rate': 0.028476026980785878, 'max_depth': 8, 'min_child_weight': 2, 'subsample': 0.6, 'colsample_bytree': 0.5, 'colsample_bylevel': 0.6, 'reg_alpha': 1.880326019437213e-06, 'reg_lambda': 6.211836927822385e-05, 'gamma': 3.2373732606295667e-06}. Best is trial 12 with value: -0.13552092227934387.
[I 2026-07-17 11:43:56,605] Trial 16 finished with value: -0.06541912432277923 and parameters: {'scalers': 'none', 'ratios': 'log_ratio', 'imputers': 'mean', 'n_estimators': 2850, 'learning_rate': 0.0011983962386196269, 'max_depth': 7, 'min_child_weight': 3, 'subsample': 0.7, 'colsample_bytree': 0.9, 'colsample_bylevel': 0.7, 'reg_alpha': 0.5634619450472846, 'reg_lambda': 0.07063882195269136, 'gamma': 0.008606439017679712}. Best is trial 12 with value: -0.13552092227934387.
[I 2026-07-17 11:43:59,751] Trial 17 finished with value: -0.13198499828223925 and parameters: {'scalers': 'standard', 'ratios': 'log_ratio', 'imputers': 'none', 'n_estimators': 1550, 'learning_rate': 0.00010762086533734182, 'max_depth': 8, 'min_child_weight': 5, 'subsample': 0.9, 'colsample_bytree': 0.7, 'colsample_bylevel': 0.9, 'reg_alpha': 1.3819689218297769e-06, 'reg_lambda': 0.020999825847172054, 'gamma': 38.94240042978387}. Best is trial 12 with value: -0.13552092227934387.
[I 2026-07-17 11:44:02,756] Trial 18 finished with value: -0.12338352500206576 and parameters: {'scalers': 'robust', 'ratios': 'log_ratio', 'imputers': 'mean', 'n_estimators': 1450, 'learning_rate': 0.00025512761835688687, 'max_depth': 9, 'min_child_weight': 6, 'subsample': 0.8, 'colsample_bytree': 0.7, 'colsample_bylevel': 0.8, 'reg_alpha': 1.5656853252526292e-06, 'reg_lambda': 0.08673775832358026, 'gamma': 14.822716168512347}. Best is trial 12 with value: -0.13552092227934387.
[I 2026-07-17 11:44:04,225] Trial 20 finished with value: -0.13731824613022622 and parameters: {'scalers': 'robust', 'ratios': 'log_ratio', 'imputers': 'mean', 'n_estimators': 100, 'learning_rate': 0.00011377932981640387, 'max_depth': 9, 'min_child_weight': 5, 'subsample': 0.8, 'colsample_bytree': 0.7, 'colsample_bylevel': 0.6, 'reg_alpha': 0.10692537129161746, 'reg_lambda': 0.04641043245285933, 'gamma': 48.56249297563868}. Best is trial 20 with value: -0.13731824613022622.
[I 2026-07-17 11:44:04,882] Trial 21 finished with value: -0.13733284703106718 and parameters: {'scalers': 'robust', 'ratios': 'log_ratio', 'imputers': 'mean', 'n_estimators': 100, 'learning_rate': 0.00010628284557868546, 'max_depth': 9, 'min_child_weight': 5, 'subsample': 0.5, 'colsample_bytree': 0.7, 'colsample_bylevel': 0.6, 'reg_alpha': 0.9773410171834969, 'reg_lambda': 0.12152774905361946, 'gamma': 52.334397512349334}. Best is trial 21 with value: -0.13733284703106718.
[I 2026-07-17 11:44:05,241] Trial 22 finished with value: -0.13722751576891443 and parameters: {'scalers': 'robust', 'ratios': 'log_ratio', 'imputers': 'mean', 'n_estimators': 150, 'learning_rate': 0.00010108893976650282, 'max_depth': 9, 'min_child_weight': 5, 'subsample': 0.5, 'colsample_bytree': 0.7, 'colsample_bylevel': 0.6, 'reg_alpha': 0.5935021931207266, 'reg_lambda': 0.06014249576520592, 'gamma': 90.31072788441851}. Best is trial 21 with value: -0.13733284703106718.
[I 2026-07-17 11:44:05,350] Trial 19 finished with value: -0.13263996389134347 and parameters: {'scalers': 'robust', 'ratios': 'log_ratio', 'imputers': 'mean', 'n_estimators': 1400, 'learning_rate': 0.0001126361483476848, 'max_depth': 9, 'min_child_weight': 5, 'subsample': 0.8, 'colsample_bytree': 0.7, 'colsample_bylevel': 0.6, 'reg_alpha': 0.16705595649186294, 'reg_lambda': 0.05857224323602632, 'gamma': 16.11995199252173}. Best is trial 21 with value: -0.13733284703106718.
[I 2026-07-17 11:44:09,620] Trial 23 finished with value: -0.12815751144554532 and parameters: {'scalers': 'robust', 'ratios': 'log_ratio', 'imputers': 'mean', 'n_estimators': 1650, 'learning_rate': 0.00010536468186497315, 'max_depth': 3, 'min_child_weight': 5, 'subsample': 0.5, 'colsample_bytree': 0.7, 'colsample_bylevel': 0.6, 'reg_alpha': 0.8233633369330716, 'reg_lambda': 0.04179411158671923, 'gamma': 0.0005851181501886472}. Best is trial 21 with value: -0.13733284703106718.
[I 2026-07-17 11:44:10,643] Trial 24 finished with value: -0.13605677896732682 and parameters: {'scalers': 'robust', 'ratios': 'log_ratio', 'imputers': 'mean', 'n_estimators': 650, 'learning_rate': 0.000103730062438547, 'max_depth': 3, 'min_child_weight': 5, 'subsample': 0.5, 'colsample_bytree': 0.7, 'colsample_bylevel': 0.6, 'reg_alpha': 0.004941461650079349, 'reg_lambda': 1.0524734975674235e-06, 'gamma': 62.46946490532733}. Best is trial 21 with value: -0.13733284703106718.
[I 2026-07-17 11:44:14,388] Trial 25 finished with value: -0.1271529456747116 and parameters: {'scalers': 'robust', 'ratios': 'log_ratio', 'imputers': 'none', 'n_estimators': 1700, 'learning_rate': 0.0001304300891788447, 'max_depth': 3, 'min_child_weight': 5, 'subsample': 0.9, 'colsample_bytree': 0.7, 'colsample_bylevel': 0.9, 'reg_alpha': 0.0036290035884971846, 'reg_lambda': 0.04643588840970923, 'gamma': 18.309767176365945}. Best is trial 21 with value: -0.13733284703106718.
[I 2026-07-17 11:44:17,888] Trial 26 finished with value: -0.13145487734448658 and parameters: {'scalers': 'robust', 'ratios': 'log_ratio', 'imputers': 'none', 'n_estimators': 1750, 'learning_rate': 0.0001082944288148187, 'max_depth': 3, 'min_child_weight': 4, 'subsample': 0.9, 'colsample_bytree': 0.7, 'colsample_bylevel': 0.9, 'reg_alpha': 0.002906766536546909, 'reg_lambda': 0.06419846543612594, 'gamma': 71.42367767199883}. Best is trial 21 with value: -0.13733284703106718.
[I 2026-07-17 11:44:19,047] Trial 27 finished with value: -0.13445982140782076 and parameters: {'scalers': 'robust', 'ratios': 'log_ratio', 'imputers': 'mean', 'n_estimators': 500, 'learning_rate': 0.00013394148314527934, 'max_depth': 3, 'min_child_weight': 8, 'subsample': 0.8, 'colsample_bytree': 0.6, 'colsample_bylevel': 0.6, 'reg_alpha': 0.004748298977073987, 'reg_lambda': 1.1612012454147007e-06, 'gamma': 2.0553090908530933}. Best is trial 21 with value: -0.13733284703106718.
[I 2026-07-17 11:44:20,251] Trial 28 finished with value: -0.13505095131641393 and parameters: {'scalers': 'robust', 'ratios': 'log_ratio', 'imputers': 'mean', 'n_estimators': 500, 'learning_rate': 0.00011246009937151733, 'max_depth': 12, 'min_child_weight': 4, 'subsample': 0.8, 'colsample_bytree': 0.6, 'colsample_bylevel': 0.6, 'reg_alpha': 0.00452842089311438, 'reg_lambda': 0.4603901637043422, 'gamma': 3.244536797176353}. Best is trial 21 with value: -0.13733284703106718.
[I 2026-07-17 11:44:20,609] Trial 29 finished with value: -0.1357743182147366 and parameters: {'scalers': 'robust', 'ratios': 'log_ratio', 'imputers': 'mean', 'n_estimators': 100, 'learning_rate': 0.0003604823669807326, 'max_depth': 10, 'min_child_weight': 4, 'subsample': 0.8, 'colsample_bytree': 0.6, 'colsample_bylevel': 0.6, 'reg_alpha': 1.655094522454547, 'reg_lambda': 0.4512471421480321, 'gamma': 1.4807908319525316}. Best is trial 21 with value: -0.13733284703106718.
[I 2026-07-17 11:44:21,500] Trial 30 finished with value: -0.13407807074323472 and parameters: {'scalers': 'robust', 'ratios': 'log_ratio', 'imputers': 'mean', 'n_estimators': 550, 'learning_rate': 0.000314228237833332, 'max_depth': 10, 'min_child_weight': 4, 'subsample': 0.8, 'colsample_bytree': 0.6, 'colsample_bylevel': 0.6, 'reg_alpha': 2.0214612127041587, 'reg_lambda': 0.6370670175223375, 'gamma': 74.64311428208947}. Best is trial 21 with value: -0.13733284703106718.
[I 2026-07-17 11:44:21,757] Trial 31 finished with value: -0.13705073754311287 and parameters: {'scalers': 'robust', 'ratios': 'log_ratio', 'imputers': 'mean', 'n_estimators': 100, 'learning_rate': 0.0003688169444249985, 'max_depth': 12, 'min_child_weight': 4, 'subsample': 0.8, 'colsample_bytree': 0.6, 'colsample_bylevel': 0.5, 'reg_alpha': 2.4520061109451188, 'reg_lambda': 0.44468684401070835, 'gamma': 73.71500101137966}. Best is trial 21 with value: -0.13733284703106718.
[I 2026-07-17 11:44:21,990] Trial 32 finished with value: -0.13579014941296488 and parameters: {'scalers': 'robust', 'ratios': 'log_ratio', 'imputers': 'mean', 'n_estimators': 100, 'learning_rate': 0.0005007275552955708, 'max_depth': 12, 'min_child_weight': 4, 'subsample': 0.8, 'colsample_bytree': 0.6, 'colsample_bylevel': 0.5, 'reg_alpha': 2.972031049607642, 'reg_lambda': 0.7429394686468022, 'gamma': 2.443603747258798}. Best is trial 21 with value: -0.13733284703106718.
[I 2026-07-17 11:44:22,310] Trial 33 finished with value: -0.13624994779928737 and parameters: {'scalers': 'robust', 'ratios': 'log_ratio', 'imputers': 'mean', 'n_estimators': 100, 'learning_rate': 0.00035431562823009356, 'max_depth': 12, 'min_child_weight': 4, 'subsample': 0.8, 'colsample_bytree': 0.6, 'colsample_bylevel': 0.5, 'reg_alpha': 2.6435008339592776, 'reg_lambda': 0.4071077173566571, 'gamma': 1.8519614155993092}. Best is trial 21 with value: -0.13733284703106718.
[I 2026-07-17 11:44:22,698] Trial 34 finished with value: -0.1356511200874173 and parameters: {'scalers': 'robust', 'ratios': 'log_ratio', 'imputers': 'mean', 'n_estimators': 150, 'learning_rate': 0.0003298973320662574, 'max_depth': 12, 'min_child_weight': 4, 'subsample': 0.8, 'colsample_bytree': 0.6, 'colsample_bylevel': 0.5, 'reg_alpha': 2.4368649835511462, 'reg_lambda': 0.47361611738987724, 'gamma': 2.1433937677921806}. Best is trial 21 with value: -0.13733284703106718.
[I 2026-07-17 11:44:22,984] Trial 35 finished with value: -0.13633531613818953 and parameters: {'scalers': 'robust', 'ratios': 'log_ratio', 'imputers': 'mean', 'n_estimators': 100, 'learning_rate': 0.0003490212772134001, 'max_depth': 12, 'min_child_weight': 4, 'subsample': 0.7, 'colsample_bytree': 0.6, 'colsample_bylevel': 0.5, 'reg_alpha': 2.6828423411098563, 'reg_lambda': 0.8881546826372716, 'gamma': 2.393339844896198}. Best is trial 21 with value: -0.13733284703106718.
[I 2026-07-17 11:44:23,410] Trial 36 finished with value: -0.1344596851504223 and parameters: {'scalers': 'robust', 'ratios': 'norm_ratio', 'imputers': 'mean', 'n_estimators': 150, 'learning_rate': 0.0003377623637417638, 'max_depth': 9, 'min_child_weight': 4, 'subsample': 1.0, 'colsample_bytree': 0.8, 'colsample_bylevel': 0.5, 'reg_alpha': 3.003267431526505, 'reg_lambda': 0.35660504334543147, 'gamma': 1.5548962990698088}. Best is trial 21 with value: -0.13733284703106718.
[I 2026-07-17 11:44:23,898] Trial 37 finished with value: -0.11920038446146765 and parameters: {'scalers': 'robust', 'ratios': 'norm_ratio', 'imputers': 'mean', 'n_estimators': 300, 'learning_rate': 0.003304852614767593, 'max_depth': 9, 'min_child_weight': 7, 'subsample': 0.7, 'colsample_bytree': 0.8, 'colsample_bylevel': 0.5, 'reg_alpha': 5.489630251339909, 'reg_lambda': 0.006964586131776546, 'gamma': 73.25417066169454}. Best is trial 21 with value: -0.13733284703106718.
[I 2026-07-17 11:44:24,492] Trial 38 finished with value: -0.13362408954994 and parameters: {'scalers': 'robust', 'ratios': 'log_ratio', 'imputers': 'mean', 'n_estimators': 350, 'learning_rate': 0.000467590057824693, 'max_depth': 9, 'min_child_weight': 7, 'subsample': 0.5, 'colsample_bytree': 0.8, 'colsample_bylevel': 0.5, 'reg_alpha': 0.02996072564571055, 'reg_lambda': 0.011103943868501031, 'gamma': 86.93515078373409}. Best is trial 21 with value: -0.13733284703106718.
[I 2026-07-17 11:44:25,206] Trial 39 finished with value: -0.13096792547376537 and parameters: {'scalers': 'robust', 'ratios': 'log_ratio', 'imputers': 'mean', 'n_estimators': 300, 'learning_rate': 0.00048232583936641, 'max_depth': 9, 'min_child_weight': 7, 'subsample': 1.0, 'colsample_bytree': 0.8, 'colsample_bylevel': 0.5, 'reg_alpha': 3.683089607401608, 'reg_lambda': 0.009686212189520739, 'gamma': 4.649887203756488}. Best is trial 21 with value: -0.13733284703106718.
[I 2026-07-17 11:44:25,867] Trial 40 finished with value: -0.11914837585476121 and parameters: {'scalers': 'robust', 'ratios': 'norm_ratio', 'imputers': 'mean', 'n_estimators': 350, 'learning_rate': 0.0027773517027034358, 'max_depth': 9, 'min_child_weight': 7, 'subsample': 0.7, 'colsample_bytree': 0.8, 'colsample_bylevel': 0.5, 'reg_alpha': 4.807017754933868, 'reg_lambda': 0.009994057061499107, 'gamma': 93.22309366301388}. Best is trial 21 with value: -0.13733284703106718.
[I 2026-07-17 11:44:29,814] Trial 41 finished with value: -0.09563725509590751 and parameters: {'scalers': 'robust', 'ratios': 'norm_ratio', 'imputers': 'mean', 'n_estimators': 350, 'learning_rate': 0.0026771422490409103, 'max_depth': 9, 'min_child_weight': 2, 'subsample': 1.0, 'colsample_bytree': 0.8, 'colsample_bylevel': 0.5, 'reg_alpha': 0.2491448150828842, 'reg_lambda': 0.0071628769766813125, 'gamma': 0.2848460543341742}. Best is trial 21 with value: -0.13733284703106718.
[I 2026-07-17 11:44:32,347] Trial 42 finished with value: -0.10109486437888507 and parameters: {'scalers': 'robust', 'ratios': 'norm_ratio', 'imputers': 'mean', 'n_estimators': 350, 'learning_rate': 0.002135239229512217, 'max_depth': 9, 'min_child_weight': 7, 'subsample': 0.7, 'colsample_bytree': 0.8, 'colsample_bylevel': 0.5, 'reg_alpha': 0.03346952331357781, 'reg_lambda': 0.011891816678703104, 'gamma': 0.33093305456470384}. Best is trial 21 with value: -0.13733284703106718.
[I 2026-07-17 11:44:35,525] Trial 43 finished with value: -0.10614920440224902 and parameters: {'scalers': 'robust', 'ratios': 'norm_ratio', 'imputers': 'mean', 'n_estimators': 350, 'learning_rate': 0.001669246872686733, 'max_depth': 9, 'min_child_weight': 7, 'subsample': 1.0, 'colsample_bytree': 0.8, 'colsample_bylevel': 0.5, 'reg_alpha': 0.023726313244954184, 'reg_lambda': 0.008471373158266321, 'gamma': 0.2607687634662715}. Best is trial 21 with value: -0.13733284703106718.
[I 2026-07-17 11:44:37,282] Trial 44 finished with value: -0.11072388444399861 and parameters: {'scalers': 'robust', 'ratios': 'norm_ratio', 'imputers': 'mean', 'n_estimators': 350, 'learning_rate': 0.001426971849988646, 'max_depth': 6, 'min_child_weight': 2, 'subsample': 0.7, 'colsample_bytree': 0.8, 'colsample_bylevel': 0.5, 'reg_alpha': 0.04752084193635134, 'reg_lambda': 0.00914216219084518, 'gamma': 0.36759081881851013}. Best is trial 21 with value: -0.13733284703106718.
