[I 2026-07-17 11:35:24,105] Trial 135 finished with value: -0.38618318167014376 and parameters: {'scalers': 'robust', 'ratios': 'log_ratio', 'imputers': 'median', 'n_estimators': 150, 'learning_rate': 0.00020309173253441287, 'max_depth': 11, 'min_child_weight': 2, 'subsample': 0.6, 'colsample_bytree': 0.5, 'colsample_bylevel': 0.8, 'reg_alpha': 2.165102175091361e-05, 'reg_lambda': 8.165695011943346e-06, 'gamma': 7.496850024500766}. Best is trial 98 with value: -0.3910778001313542.
[I 2026-07-17 11:35:24,623] Trial 136 finished with value: -0.386187885561285 and parameters: {'scalers': 'robust', 'ratios': 'log_ratio', 'imputers': 'median', 'n_estimators': 350, 'learning_rate': 0.00019685489486772384, 'max_depth': 11, 'min_child_weight': 2, 'subsample': 0.6, 'colsample_bytree': 0.5, 'colsample_bylevel': 0.8, 'reg_alpha': 6.848774583914313e-06, 'reg_lambda': 0.0025813672271201805, 'gamma': 73.37431450244698}. Best is trial 98 with value: -0.3910778001313542.
[I 2026-07-17 11:35:24,881] Trial 137 finished with value: -0.3886394047710653 and parameters: {'scalers': 'robust', 'ratios': 'log_ratio', 'imputers': 'median', 'n_estimators': 100, 'learning_rate': 0.00015186407651700297, 'max_depth': 11, 'min_child_weight': 2, 'subsample': 0.6, 'colsample_bytree': 0.5, 'colsample_bylevel': 0.8, 'reg_alpha': 6.6208972389320665e-06, 'reg_lambda': 0.0007487466420198613, 'gamma': 7.464600112600555}. Best is trial 98 with value: -0.3910778001313542.
[I 2026-07-17 11:35:25,119] Trial 138 finished with value: -0.3901020315537419 and parameters: {'scalers': 'robust', 'ratios': 'log_ratio', 'imputers': 'median', 'n_estimators': 100, 'learning_rate': 0.00014888964106014402, 'max_depth': 11, 'min_child_weight': 2, 'subsample': 0.6, 'colsample_bytree': 0.5, 'colsample_bylevel': 0.6, 'reg_alpha': 6.5146797004003214e-06, 'reg_lambda': 0.0024188279478212548, 'gamma': 68.62796617634642}. Best is trial 98 with value: -0.3910778001313542.
[I 2026-07-17 11:35:25,780] Trial 139 finished with value: -0.38573836535285005 and parameters: {'scalers': 'robust', 'ratios': 'log_ratio', 'imputers': 'median', 'n_estimators': 350, 'learning_rate': 0.00015054906367392115, 'max_depth': 11, 'min_child_weight': 2, 'subsample': 0.9, 'colsample_bytree': 0.5, 'colsample_bylevel': 0.8, 'reg_alpha': 6.938995557953964e-06, 'reg_lambda': 0.0007174230256409716, 'gamma': 71.92882126249167}. Best is trial 98 with value: -0.3910778001313542.
[I 2026-07-17 11:35:26,791] Trial 140 finished with value: -0.3818929364330218 and parameters: {'scalers': 'robust', 'ratios': 'log_ratio', 'imputers': 'median', 'n_estimators': 350, 'learning_rate': 0.00015021723085910556, 'max_depth': 11, 'min_child_weight': 2, 'subsample': 0.9, 'colsample_bytree': 0.5, 'colsample_bylevel': 0.8, 'reg_alpha': 9.351108033534744e-06, 'reg_lambda': 0.0008076386868210347, 'gamma': 6.771904816941975}. Best is trial 98 with value: -0.3910778001313542.
[I 2026-07-17 11:35:27,525] Trial 141 finished with value: -0.38630615174567684 and parameters: {'scalers': 'none', 'ratios': 'log_ratio', 'imputers': 'median', 'n_estimators': 350, 'learning_rate': 0.00016403373186008846, 'max_depth': 12, 'min_child_weight': 2, 'subsample': 0.9, 'colsample_bytree': 0.5, 'colsample_bylevel': 0.5, 'reg_alpha': 8.747026261718389e-06, 'reg_lambda': 8.408513068736621e-05, 'gamma': 68.9521285035688}. Best is trial 98 with value: -0.3910778001313542.
[I 2026-07-17 11:35:28,217] Trial 142 finished with value: -0.3867111764610459 and parameters: {'scalers': 'none', 'ratios': 'log_ratio', 'imputers': 'median', 'n_estimators': 350, 'learning_rate': 0.00015017453291612444, 'max_depth': 12, 'min_child_weight': 2, 'subsample': 0.9, 'colsample_bytree': 0.5, 'colsample_bylevel': 0.5, 'reg_alpha': 1.0992980719598165e-05, 'reg_lambda': 0.0008394335715436544, 'gamma': 69.28982004436534}. Best is trial 98 with value: -0.3910778001313542.
[I 2026-07-17 11:35:28,939] Trial 143 finished with value: -0.38668504878825927 and parameters: {'scalers': 'none', 'ratios': 'log_ratio', 'imputers': 'median', 'n_estimators': 350, 'learning_rate': 0.00015516281418351786, 'max_depth': 4, 'min_child_weight': 1, 'subsample': 0.9, 'colsample_bytree': 0.5, 'colsample_bylevel': 0.5, 'reg_alpha': 7.429387322104586e-06, 'reg_lambda': 0.0007984915194950725, 'gamma': 71.60605356780236}. Best is trial 98 with value: -0.3910778001313542.
[I 2026-07-17 11:35:29,549] Trial 144 finished with value: -0.38691752813209324 and parameters: {'scalers': 'none', 'ratios': 'norm_ratio', 'imputers': 'median', 'n_estimators': 300, 'learning_rate': 0.00013898285269835824, 'max_depth': 4, 'min_child_weight': 1, 'subsample': 0.9, 'colsample_bytree': 0.5, 'colsample_bylevel': 0.5, 'reg_alpha': 1.031339708661808e-05, 'reg_lambda': 0.0006806019779232703, 'gamma': 48.776632723704935}. Best is trial 98 with value: -0.3910778001313542.
[I 2026-07-17 11:35:30,193] Trial 145 finished with value: -0.38741711699794723 and parameters: {'scalers': 'none', 'ratios': 'norm_ratio', 'imputers': 'median', 'n_estimators': 300, 'learning_rate': 0.00012260478759023346, 'max_depth': 4, 'min_child_weight': 1, 'subsample': 0.9, 'colsample_bytree': 0.5, 'colsample_bylevel': 0.5, 'reg_alpha': 1.0858596948071254e-05, 'reg_lambda': 0.00010708096519825583, 'gamma': 49.2463375639762}. Best is trial 98 with value: -0.3910778001313542.
[I 2026-07-17 11:35:30,792] Trial 146 finished with value: -0.387115630689281 and parameters: {'scalers': 'none', 'ratios': 'norm_ratio', 'imputers': 'median', 'n_estimators': 300, 'learning_rate': 0.00014728389990323549, 'max_depth': 12, 'min_child_weight': 1, 'subsample': 0.9, 'colsample_bytree': 0.5, 'colsample_bylevel': 0.6, 'reg_alpha': 9.9518946693334e-06, 'reg_lambda': 9.848978497156012e-05, 'gamma': 67.23890639827758}. Best is trial 98 with value: -0.3910778001313542.
[I 2026-07-17 11:35:31,357] Trial 147 finished with value: -0.38816376681458886 and parameters: {'scalers': 'robust', 'ratios': 'norm_ratio', 'imputers': 'median', 'n_estimators': 250, 'learning_rate': 0.00011538932574945958, 'max_depth': 12, 'min_child_weight': 1, 'subsample': 0.9, 'colsample_bytree': 0.5, 'colsample_bylevel': 0.6, 'reg_alpha': 1.2159465654314863e-05, 'reg_lambda': 0.00010303053665310086, 'gamma': 52.46187509918739}. Best is trial 98 with value: -0.3910778001313542.
[I 2026-07-17 11:35:31,968] Trial 148 finished with value: -0.3872892097483856 and parameters: {'scalers': 'none', 'ratios': 'norm_ratio', 'imputers': 'median', 'n_estimators': 300, 'learning_rate': 0.00011921614091171156, 'max_depth': 12, 'min_child_weight': 1, 'subsample': 0.9, 'colsample_bytree': 0.5, 'colsample_bylevel': 0.6, 'reg_alpha': 2.483414713803288e-06, 'reg_lambda': 0.00011203102350490658, 'gamma': 46.707455740232334}. Best is trial 98 with value: -0.3910778001313542.
[I 2026-07-17 11:35:32,436] Trial 149 finished with value: -0.38872544569495815 and parameters: {'scalers': 'robust', 'ratios': 'norm_ratio', 'imputers': 'median', 'n_estimators': 250, 'learning_rate': 0.0001155366740597957, 'max_depth': 10, 'min_child_weight': 1, 'subsample': 0.5, 'colsample_bytree': 0.5, 'colsample_bylevel': 0.6, 'reg_alpha': 2.6021279334456923e-06, 'reg_lambda': 0.0001305433823291122, 'gamma': 46.971341257631224}. Best is trial 98 with value: -0.3910778001313542.
[I 2026-07-17 11:35:32,846] Trial 150 finished with value: -0.39108877150040045 and parameters: {'scalers': 'robust', 'ratios': 'norm_ratio', 'imputers': 'median', 'n_estimators': 250, 'learning_rate': 0.00011482886922124216, 'max_depth': 6, 'min_child_weight': 1, 'subsample': 0.5, 'colsample_bytree': 0.5, 'colsample_bylevel': 0.6, 'reg_alpha': 2.4411710969043925e-06, 'reg_lambda': 0.00012015489941059325, 'gamma': 99.78468257049289}. Best is trial 150 with value: -0.39108877150040045.
[I 2026-07-17 11:35:33,422] Trial 151 finished with value: -0.3884347475096871 and parameters: {'scalers': 'robust', 'ratios': 'norm_ratio', 'imputers': 'median', 'n_estimators': 250, 'learning_rate': 0.00012588811640288345, 'max_depth': 10, 'min_child_weight': 1, 'subsample': 0.5, 'colsample_bytree': 0.5, 'colsample_bylevel': 0.6, 'reg_alpha': 2.3699469938500044e-06, 'reg_lambda': 0.00010487801048555986, 'gamma': 45.8422766252455}. Best is trial 150 with value: -0.39108877150040045.
[I 2026-07-17 11:35:33,462] Trial 152 finished with value: -0.39001741491335595 and parameters: {'scalers': 'robust', 'ratios': 'log_ratio', 'imputers': 'median', 'n_estimators': 100, 'learning_rate': 0.00011898032162259762, 'max_depth': 10, 'min_child_weight': 1, 'subsample': 0.5, 'colsample_bytree': 0.5, 'colsample_bylevel': 0.6, 'reg_alpha': 3.1395220919488043e-06, 'reg_lambda': 0.0016354610178147167, 'gamma': 41.30813111925379}. Best is trial 150 with value: -0.39108877150040045.
[I 2026-07-17 11:35:33,669] Trial 153 finished with value: -0.3910890467687862 and parameters: {'scalers': 'robust', 'ratios': 'log_ratio', 'imputers': 'median', 'n_estimators': 100, 'learning_rate': 0.0001175026436129964, 'max_depth': 10, 'min_child_weight': 1, 'subsample': 0.5, 'colsample_bytree': 0.5, 'colsample_bylevel': 0.6, 'reg_alpha': 2.884384990014826e-06, 'reg_lambda': 0.001614821373402985, 'gamma': 99.90645992481384}. Best is trial 153 with value: -0.3910890467687862.
[I 2026-07-17 11:35:33,897] Trial 154 finished with value: -0.39107957291947587 and parameters: {'scalers': 'robust', 'ratios': 'log_ratio', 'imputers': 'median', 'n_estimators': 100, 'learning_rate': 0.00012189531840503625, 'max_depth': 10, 'min_child_weight': 4, 'subsample': 0.5, 'colsample_bytree': 0.6, 'colsample_bylevel': 0.6, 'reg_alpha': 2.1364488770643806e-06, 'reg_lambda': 2.3073242268099754e-05, 'gamma': 95.45322489369336}. Best is trial 153 with value: -0.3910890467687862.
[I 2026-07-17 11:35:34,113] Trial 155 finished with value: -0.38967916501199623 and parameters: {'scalers': 'robust', 'ratios': 'log_ratio', 'imputers': 'median', 'n_estimators': 100, 'learning_rate': 0.00011714752982379747, 'max_depth': 3, 'min_child_weight': 4, 'subsample': 0.5, 'colsample_bytree': 0.6, 'colsample_bylevel': 0.6, 'reg_alpha': 2.4483206010081684e-06, 'reg_lambda': 0.0016435370875520334, 'gamma': 26.451859341535535}. Best is trial 153 with value: -0.3910890467687862.
[I 2026-07-17 11:35:34,337] Trial 156 finished with value: -0.3910890578056639 and parameters: {'scalers': 'robust', 'ratios': 'log_ratio', 'imputers': 'none', 'n_estimators': 100, 'learning_rate': 0.00012091293991212385, 'max_depth': 6, 'min_child_weight': 4, 'subsample': 0.5, 'colsample_bytree': 0.6, 'colsample_bylevel': 0.7, 'reg_alpha': 2.640791768599076e-06, 'reg_lambda': 2.5777603524656558e-05, 'gamma': 98.41018135592874}. Best is trial 156 with value: -0.3910890578056639.
[I 2026-07-17 11:35:34,575] Trial 157 finished with value: -0.3896934068270634 and parameters: {'scalers': 'robust', 'ratios': 'log_ratio', 'imputers': 'median', 'n_estimators': 100, 'learning_rate': 0.00011727083436390855, 'max_depth': 3, 'min_child_weight': 4, 'subsample': 0.5, 'colsample_bytree': 0.6, 'colsample_bylevel': 0.6, 'reg_alpha': 3.7208283939963005e-06, 'reg_lambda': 2.6157228711756718e-05, 'gamma': 27.78753621846202}. Best is trial 156 with value: -0.3910890578056639.
[I 2026-07-17 11:35:34,817] Trial 158 finished with value: -0.3910889491934365 and parameters: {'scalers': 'robust', 'ratios': 'log_ratio', 'imputers': 'median', 'n_estimators': 100, 'learning_rate': 0.00010035510296697349, 'max_depth': 3, 'min_child_weight': 4, 'subsample': 0.5, 'colsample_bytree': 0.6, 'colsample_bylevel': 0.6, 'reg_alpha': 3.878793749941201e-06, 'reg_lambda': 2.5764640382816683e-05, 'gamma': 98.32849369787573}. Best is trial 156 with value: -0.3910890578056639.
[I 2026-07-17 11:35:34,958] Trial 160 finished with value: -0.3910829603071219 and parameters: {'scalers': 'robust', 'ratios': 'log_ratio', 'imputers': 'median', 'n_estimators': 100, 'learning_rate': 0.00010475489182055907, 'max_depth': 6, 'min_child_weight': 1, 'subsample': 0.5, 'colsample_bytree': 0.5, 'colsample_bylevel': 0.6, 'reg_alpha': 3.4730255540470436e-06, 'reg_lambda': 2.9273790896250708e-05, 'gamma': 94.95930586577329}. Best is trial 156 with value: -0.3910890578056639.
[I 2026-07-17 11:35:35,122] Trial 159 finished with value: -0.3910124627072344 and parameters: {'scalers': 'robust', 'ratios': 'log_ratio', 'imputers': 'median', 'n_estimators': 100, 'learning_rate': 0.00010451624765377185, 'max_depth': 3, 'min_child_weight': 1, 'subsample': 0.5, 'colsample_bytree': 0.5, 'colsample_bylevel': 0.6, 'reg_alpha': 3.6253835849457515e-06, 'reg_lambda': 2.5489286411550573e-05, 'gamma': 88.78304670139003}. Best is trial 156 with value: -0.3910890578056639.
[I 2026-07-17 11:35:35,883] Trial 161 finished with value: -0.3910893236187268 and parameters: {'scalers': 'robust', 'ratios': 'log_ratio', 'imputers': 'none', 'n_estimators': 100, 'learning_rate': 0.00017128787806668132, 'max_depth': 10, 'min_child_weight': 4, 'subsample': 0.5, 'colsample_bytree': 0.5, 'colsample_bylevel': 0.6, 'reg_alpha': 1.0013368090911878e-06, 'reg_lambda': 0.0017420627700927363, 'gamma': 97.94954449323416}. Best is trial 161 with value: -0.3910893236187268.
[I 2026-07-17 11:35:36,334] Trial 162 finished with value: -0.3910893284883735 and parameters: {'scalers': 'robust', 'ratios': 'log_ratio', 'imputers': 'none', 'n_estimators': 100, 'learning_rate': 0.00017274090187877457, 'max_depth': 6, 'min_child_weight': 4, 'subsample': 0.5, 'colsample_bytree': 0.6, 'colsample_bylevel': 0.6, 'reg_alpha': 1.1831775845963656e-06, 'reg_lambda': 1.725609335919091e-05, 'gamma': 99.48421123194947}. Best is trial 162 with value: -0.3910893284883735.
[I 2026-07-17 11:35:36,497] Trial 163 finished with value: -0.39107609579474173 and parameters: {'scalers': 'robust', 'ratios': 'log_ratio', 'imputers': 'none', 'n_estimators': 100, 'learning_rate': 0.00016967748796061166, 'max_depth': 6, 'min_child_weight': 4, 'subsample': 0.5, 'colsample_bytree': 0.6, 'colsample_bylevel': 0.6, 'reg_alpha': 3.356496557647124e-06, 'reg_lambda': 2.2282371984706866e-05, 'gamma': 95.96084128186982}. Best is trial 162 with value: -0.3910893284883735.
[I 2026-07-17 11:35:36,846] Trial 164 finished with value: -0.3910591803023237 and parameters: {'scalers': 'robust', 'ratios': 'log_ratio', 'imputers': 'none', 'n_estimators': 100, 'learning_rate': 0.00017434707139620968, 'max_depth': 6, 'min_child_weight': 4, 'subsample': 0.5, 'colsample_bytree': 0.6, 'colsample_bylevel': 0.6, 'reg_alpha': 3.364545958700624e-06, 'reg_lambda': 2.0099991145340723e-05, 'gamma': 94.20350468449011}. Best is trial 162 with value: -0.3910893284883735.
[I 2026-07-17 11:35:37,048] Trial 165 finished with value: -0.3910763580875413 and parameters: {'scalers': 'robust', 'ratios': 'log_ratio', 'imputers': 'median', 'n_estimators': 100, 'learning_rate': 0.0001661550820701186, 'max_depth': 6, 'min_child_weight': 4, 'subsample': 0.5, 'colsample_bytree': 0.6, 'colsample_bylevel': 0.6, 'reg_alpha': 2.7889272540183214e-06, 'reg_lambda': 2.1462506696255837e-05, 'gamma': 95.5309034101302}. Best is trial 162 with value: -0.3910893284883735.
[I 2026-07-17 11:35:37,250] Trial 166 finished with value: -0.3910503969078074 and parameters: {'scalers': 'robust', 'ratios': 'log_ratio', 'imputers': 'none', 'n_estimators': 100, 'learning_rate': 0.00017127010673204058, 'max_depth': 6, 'min_child_weight': 4, 'subsample': 0.5, 'colsample_bytree': 0.6, 'colsample_bylevel': 0.6, 'reg_alpha': 3.3465861826570353e-06, 'reg_lambda': 1.7654101858817487e-05, 'gamma': 93.28547305592373}. Best is trial 162 with value: -0.3910893284883735.
[I 2026-07-17 11:35:37,466] Trial 167 finished with value: -0.39099291702699196 and parameters: {'scalers': 'robust', 'ratios': 'log_ratio', 'imputers': 'median', 'n_estimators': 100, 'learning_rate': 0.00016649694541071185, 'max_depth': 6, 'min_child_weight': 4, 'subsample': 0.5, 'colsample_bytree': 0.6, 'colsample_bylevel': 0.6, 'reg_alpha': 3.1414917157229164e-06, 'reg_lambda': 2.0018582081376314e-05, 'gamma': 90.58146335904333}. Best is trial 162 with value: -0.3910893284883735.
[I 2026-07-17 11:35:37,744] Trial 168 finished with value: -0.39096305262178666 and parameters: {'scalers': 'robust', 'ratios': 'log_ratio', 'imputers': 'none', 'n_estimators': 100, 'learning_rate': 0.00016449221565774142, 'max_depth': 6, 'min_child_weight': 4, 'subsample': 0.5, 'colsample_bytree': 0.6, 'colsample_bylevel': 0.6, 'reg_alpha': 3.317469731378375e-06, 'reg_lambda': 1.9545628770776768e-05, 'gamma': 89.66418061651885}. Best is trial 162 with value: -0.3910893284883735.
[I 2026-07-17 11:35:38,411] Trial 169 finished with value: -0.3909344374165319 and parameters: {'scalers': 'robust', 'ratios': 'log_ratio', 'imputers': 'none', 'n_estimators': 200, 'learning_rate': 0.0002378602902227722, 'max_depth': 6, 'min_child_weight': 4, 'subsample': 0.5, 'colsample_bytree': 0.5, 'colsample_bylevel': 0.6, 'reg_alpha': 1.2408963102050445e-06, 'reg_lambda': 1.732334837470347e-05, 'gamma': 91.02275354463863}. Best is trial 162 with value: -0.3910893284883735.
[I 2026-07-17 11:35:41,045] Trial 170 finished with value: -0.3909154193126821 and parameters: {'scalers': 'robust', 'ratios': 'log_ratio', 'imputers': 'none', 'n_estimators': 2050, 'learning_rate': 0.00024007170712512797, 'max_depth': 6, 'min_child_weight': 4, 'subsample': 0.5, 'colsample_bytree': 0.5, 'colsample_bylevel': 0.6, 'reg_alpha': 3.1972341896539297e-06, 'reg_lambda': 1.5796818530991833e-05, 'gamma': 97.60318275634071}. Best is trial 162 with value: -0.3910893284883735.
[I 2026-07-17 11:35:41,403] Trial 171 finished with value: -0.3910319051521415 and parameters: {'scalers': 'robust', 'ratios': 'log_ratio', 'imputers': 'none', 'n_estimators': 200, 'learning_rate': 0.00017502633660060072, 'max_depth': 6, 'min_child_weight': 4, 'subsample': 0.5, 'colsample_bytree': 0.5, 'colsample_bylevel': 0.6, 'reg_alpha': 1.0209186305684092e-06, 'reg_lambda': 1.7285136191501464e-05, 'gamma': 93.26626462614803}. Best is trial 162 with value: -0.3910893284883735.
[I 2026-07-17 11:35:41,740] Trial 172 finished with value: -0.390306431650252 and parameters: {'scalers': 'robust', 'ratios': 'log_ratio', 'imputers': 'none', 'n_estimators': 200, 'learning_rate': 0.00024205143765651608, 'max_depth': 6, 'min_child_weight': 4, 'subsample': 0.5, 'colsample_bytree': 0.6, 'colsample_bylevel': 0.6, 'reg_alpha': 1.0387353481557952e-06, 'reg_lambda': 1.7546012808723653e-05, 'gamma': 84.25352497139036}. Best is trial 162 with value: -0.3910893284883735.
[I 2026-07-17 11:35:42,066] Trial 173 finished with value: -0.3910478623694946 and parameters: {'scalers': 'robust', 'ratios': 'log_ratio', 'imputers': 'none', 'n_estimators': 200, 'learning_rate': 0.0002406320574342617, 'max_depth': 6, 'min_child_weight': 4, 'subsample': 0.5, 'colsample_bytree': 0.6, 'colsample_bylevel': 0.6, 'reg_alpha': 1.0773387394080868e-06, 'reg_lambda': 1.7677048597910845e-05, 'gamma': 96.09916053475412}. Best is trial 162 with value: -0.3910893284883735.
[I 2026-07-17 11:35:42,479] Trial 174 finished with value: -0.39108537825927164 and parameters: {'scalers': 'standard', 'ratios': 'log_ratio', 'imputers': 'none', 'n_estimators': 250, 'learning_rate': 0.00024087818088184304, 'max_depth': 6, 'min_child_weight': 4, 'subsample': 0.5, 'colsample_bytree': 0.6, 'colsample_bylevel': 0.6, 'reg_alpha': 1.0055382833874776e-06, 'reg_lambda': 1.3529364504863308e-05, 'gamma': 99.585812837448}. Best is trial 162 with value: -0.3910893284883735.
[I 2026-07-17 11:35:42,864] Trial 175 finished with value: -0.3910908408154702 and parameters: {'scalers': 'robust', 'ratios': 'log_ratio', 'imputers': 'none', 'n_estimators': 200, 'learning_rate': 0.00023791970953117734, 'max_depth': 6, 'min_child_weight': 4, 'subsample': 0.5, 'colsample_bytree': 0.6, 'colsample_bylevel': 0.6, 'reg_alpha': 1.0210794692053534e-06, 'reg_lambda': 1.7559742730393782e-05, 'gamma': 98.56435701887824}. Best is trial 175 with value: -0.3910908408154702.
[I 2026-07-17 11:35:43,163] Trial 176 finished with value: -0.3910255882662357 and parameters: {'scalers': 'standard', 'ratios': 'log_ratio', 'imputers': 'none', 'n_estimators': 200, 'learning_rate': 0.00033147439089222517, 'max_depth': 6, 'min_child_weight': 4, 'subsample': 0.5, 'colsample_bytree': 0.6, 'colsample_bylevel': 0.6, 'reg_alpha': 1.100103288052527e-06, 'reg_lambda': 4.9994380927839845e-06, 'gamma': 95.16923169207064}. Best is trial 175 with value: -0.3910908408154702.
[I 2026-07-17 11:35:43,472] Trial 177 finished with value: -0.39109080051526385 and parameters: {'scalers': 'standard', 'ratios': 'log_ratio', 'imputers': 'none', 'n_estimators': 200, 'learning_rate': 0.00023483677439187396, 'max_depth': 6, 'min_child_weight': 4, 'subsample': 0.5, 'colsample_bytree': 0.6, 'colsample_bylevel': 0.6, 'reg_alpha': 1.0841196274711594e-06, 'reg_lambda': 4.68085349468674e-06, 'gamma': 98.77537861114786}. Best is trial 175 with value: -0.3910908408154702.
[I 2026-07-17 11:35:43,818] Trial 178 finished with value: -0.39109086118709274 and parameters: {'scalers': 'robust', 'ratios': 'log_ratio', 'imputers': 'none', 'n_estimators': 200, 'learning_rate': 0.00024015395576181938, 'max_depth': 6, 'min_child_weight': 4, 'subsample': 0.5, 'colsample_bytree': 0.6, 'colsample_bylevel': 0.6, 'reg_alpha': 1.0638822272180662e-06, 'reg_lambda': 4.552152361031775e-06, 'gamma': 99.32989400842938}. Best is trial 178 with value: -0.39109086118709274.
[I 2026-07-17 11:35:44,148] Trial 179 finished with value: -0.39109019943046247 and parameters: {'scalers': 'standard', 'ratios': 'log_ratio', 'imputers': 'none', 'n_estimators': 200, 'learning_rate': 0.00017387544596878128, 'max_depth': 6, 'min_child_weight': 4, 'subsample': 0.5, 'colsample_bytree': 0.6, 'colsample_bylevel': 0.6, 'reg_alpha': 1.0193709094085864e-06, 'reg_lambda': 4.510180936218423e-06, 'gamma': 99.52545740030729}. Best is trial 178 with value: -0.39109086118709274.
