[I 2026-07-17 15:45:51,776] Trial 135 finished with value: -0.17815286922566304 and parameters: {'scalers': 'robust', 'ratios': 'norm_ratio', 'imputers': 'mean', 'n_estimators': 1850, 'learning_rate': 0.4295330847486282, 'max_depth': 8, 'min_child_weight': 1, 'subsample': 0.5, 'colsample_bytree': 0.7, 'colsample_bylevel': 0.5, 'reg_alpha': 1.1371215873851825, 'reg_lambda': 0.009521546201429972, 'gamma': 1.0848042428018611e-05}. Best is trial 132 with value: -0.1905697522941432.
[I 2026-07-17 15:46:03,503] Trial 136 finished with value: -0.1894992751398938 and parameters: {'scalers': 'robust', 'ratios': 'norm_ratio', 'imputers': 'mean', 'n_estimators': 2000, 'learning_rate': 0.4427949641935282, 'max_depth': 8, 'min_child_weight': 1, 'subsample': 0.5, 'colsample_bytree': 0.7, 'colsample_bylevel': 0.5, 'reg_alpha': 1.0310461062474399, 'reg_lambda': 5.0984143705631194e-05, 'gamma': 1.1931495858256846e-05}. Best is trial 132 with value: -0.1905697522941432.
[I 2026-07-17 15:46:15,588] Trial 137 finished with value: -0.17788246702210286 and parameters: {'scalers': 'robust', 'ratios': 'norm_ratio', 'imputers': 'mean', 'n_estimators': 1950, 'learning_rate': 0.48454769684579135, 'max_depth': 8, 'min_child_weight': 1, 'subsample': 0.6, 'colsample_bytree': 0.7, 'colsample_bylevel': 0.5, 'reg_alpha': 1.1868457846339922, 'reg_lambda': 0.009110604579155194, 'gamma': 1.100532603317956e-05}. Best is trial 132 with value: -0.1905697522941432.
[I 2026-07-17 15:46:26,483] Trial 138 finished with value: -0.2072051712552569 and parameters: {'scalers': 'robust', 'ratios': 'norm_ratio', 'imputers': 'mean', 'n_estimators': 2000, 'learning_rate': 0.46040701183468996, 'max_depth': 8, 'min_child_weight': 1, 'subsample': 0.5, 'colsample_bytree': 0.6, 'colsample_bylevel': 0.5, 'reg_alpha': 1.1133945375794738, 'reg_lambda': 7.895659097628406e-05, 'gamma': 7.744106999169826e-05}. Best is trial 138 with value: -0.2072051712552569.
[I 2026-07-17 15:46:38,849] Trial 139 finished with value: -0.18917259714213255 and parameters: {'scalers': 'robust', 'ratios': 'norm_ratio', 'imputers': 'mean', 'n_estimators': 2000, 'learning_rate': 0.49575104675617787, 'max_depth': 8, 'min_child_weight': 1, 'subsample': 0.6, 'colsample_bytree': 0.7, 'colsample_bylevel': 0.5, 'reg_alpha': 1.0214919816102705, 'reg_lambda': 0.009760665928766638, 'gamma': 1.1637181224915315e-05}. Best is trial 138 with value: -0.2072051712552569.
[I 2026-07-17 15:46:50,677] Trial 140 finished with value: -0.18967128870868438 and parameters: {'scalers': 'robust', 'ratios': 'norm_ratio', 'imputers': 'mean', 'n_estimators': 1900, 'learning_rate': 0.4982025459034924, 'max_depth': 8, 'min_child_weight': 1, 'subsample': 0.6, 'colsample_bytree': 0.7, 'colsample_bylevel': 0.5, 'reg_alpha': 1.2223561950916686, 'reg_lambda': 0.1117352194818258, 'gamma': 0.00010465888830481939}. Best is trial 138 with value: -0.2072051712552569.
[I 2026-07-17 15:47:01,897] Trial 141 finished with value: -0.18756445693677734 and parameters: {'scalers': 'robust', 'ratios': 'norm_ratio', 'imputers': 'mean', 'n_estimators': 1950, 'learning_rate': 0.4873646525525014, 'max_depth': 8, 'min_child_weight': 1, 'subsample': 0.6, 'colsample_bytree': 0.6, 'colsample_bylevel': 0.5, 'reg_alpha': 1.1004008708340192, 'reg_lambda': 0.008747577029289424, 'gamma': 0.00011363719266357971}. Best is trial 138 with value: -0.2072051712552569.
[I 2026-07-17 15:47:13,548] Trial 142 finished with value: -0.18946790402752547 and parameters: {'scalers': 'robust', 'ratios': 'norm_ratio', 'imputers': 'mean', 'n_estimators': 2000, 'learning_rate': 0.4834740118612313, 'max_depth': 8, 'min_child_weight': 1, 'subsample': 0.6, 'colsample_bytree': 0.6, 'colsample_bylevel': 0.5, 'reg_alpha': 1.1892910343686476, 'reg_lambda': 6.7119527679143e-05, 'gamma': 8.728502842113294e-05}. Best is trial 138 with value: -0.2072051712552569.
[I 2026-07-17 15:47:25,964] Trial 143 finished with value: -0.19184467618450385 and parameters: {'scalers': 'robust', 'ratios': 'norm_ratio', 'imputers': 'mean', 'n_estimators': 2000, 'learning_rate': 0.49993963075855097, 'max_depth': 8, 'min_child_weight': 1, 'subsample': 0.6, 'colsample_bytree': 0.7, 'colsample_bylevel': 0.5, 'reg_alpha': 1.1861719863582019, 'reg_lambda': 1.7218300966719683e-05, 'gamma': 5.606424966048847e-05}. Best is trial 138 with value: -0.2072051712552569.
[I 2026-07-17 15:47:37,902] Trial 144 finished with value: -0.1834582278388625 and parameters: {'scalers': 'robust', 'ratios': 'norm_ratio', 'imputers': 'mean', 'n_estimators': 1950, 'learning_rate': 0.49747665101340693, 'max_depth': 8, 'min_child_weight': 1, 'subsample': 0.6, 'colsample_bytree': 0.7, 'colsample_bylevel': 0.5, 'reg_alpha': 0.9737046013545864, 'reg_lambda': 4.42050282097761e-05, 'gamma': 1.174197950940678e-05}. Best is trial 138 with value: -0.2072051712552569.
[I 2026-07-17 15:47:49,855] Trial 145 finished with value: -0.15806589240562147 and parameters: {'scalers': 'robust', 'ratios': 'norm_ratio', 'imputers': 'mean', 'n_estimators': 1950, 'learning_rate': 0.4265916693993464, 'max_depth': 8, 'min_child_weight': 1, 'subsample': 0.6, 'colsample_bytree': 0.7, 'colsample_bylevel': 0.5, 'reg_alpha': 1.3204338817772645, 'reg_lambda': 9.327042357162614e-05, 'gamma': 1.283993298978873e-05}. Best is trial 138 with value: -0.2072051712552569.
[I 2026-07-17 15:48:02,329] Trial 146 finished with value: -0.18502820762752772 and parameters: {'scalers': 'robust', 'ratios': 'log_ratio', 'imputers': 'mean', 'n_estimators': 2000, 'learning_rate': 0.4980517652399771, 'max_depth': 8, 'min_child_weight': 1, 'subsample': 0.6, 'colsample_bytree': 0.7, 'colsample_bylevel': 0.5, 'reg_alpha': 1.133555937845758, 'reg_lambda': 0.00012961493778541961, 'gamma': 6.70728506305503e-05}. Best is trial 138 with value: -0.2072051712552569.
[I 2026-07-17 15:48:13,462] Trial 147 finished with value: -0.1713386472097995 and parameters: {'scalers': 'robust', 'ratios': 'log_ratio', 'imputers': 'mean', 'n_estimators': 1800, 'learning_rate': 0.46905050328679804, 'max_depth': 8, 'min_child_weight': 1, 'subsample': 0.6, 'colsample_bytree': 0.7, 'colsample_bylevel': 0.5, 'reg_alpha': 1.2515795186040422, 'reg_lambda': 6.017824526362275e-05, 'gamma': 5.764596991417249e-05}. Best is trial 138 with value: -0.2072051712552569.
[I 2026-07-17 15:48:24,721] Trial 148 finished with value: -0.17985129741499536 and parameters: {'scalers': 'robust', 'ratios': 'norm_ratio', 'imputers': 'mean', 'n_estimators': 1800, 'learning_rate': 0.49010089726425565, 'max_depth': 8, 'min_child_weight': 1, 'subsample': 0.6, 'colsample_bytree': 0.7, 'colsample_bylevel': 0.5, 'reg_alpha': 1.201731379752112, 'reg_lambda': 3.973336746991194e-05, 'gamma': 5.306827390078587e-05}. Best is trial 138 with value: -0.2072051712552569.
[I 2026-07-17 15:48:35,498] Trial 149 finished with value: -0.17321629585747483 and parameters: {'scalers': 'robust', 'ratios': 'norm_ratio', 'imputers': 'mean', 'n_estimators': 1750, 'learning_rate': 0.4891944447970126, 'max_depth': 8, 'min_child_weight': 1, 'subsample': 0.6, 'colsample_bytree': 0.7, 'colsample_bylevel': 0.5, 'reg_alpha': 1.0321233879541682, 'reg_lambda': 5.418197251133384e-05, 'gamma': 6.310101757698162e-05}. Best is trial 138 with value: -0.2072051712552569.
[I 2026-07-17 15:48:46,668] Trial 150 finished with value: -0.17063428098710468 and parameters: {'scalers': 'robust', 'ratios': 'norm_ratio', 'imputers': 'mean', 'n_estimators': 1750, 'learning_rate': 0.4639024243970157, 'max_depth': 8, 'min_child_weight': 1, 'subsample': 0.6, 'colsample_bytree': 0.7, 'colsample_bylevel': 0.5, 'reg_alpha': 1.2639382327147863, 'reg_lambda': 4.631678857092526e-05, 'gamma': 5.8272230721290604e-05}. Best is trial 138 with value: -0.2072051712552569.
[I 2026-07-17 15:48:57,834] Trial 151 finished with value: -0.17670444044909292 and parameters: {'scalers': 'robust', 'ratios': 'log_ratio', 'imputers': 'mean', 'n_estimators': 1800, 'learning_rate': 0.48907775839214135, 'max_depth': 8, 'min_child_weight': 1, 'subsample': 0.6, 'colsample_bytree': 0.7, 'colsample_bylevel': 0.5, 'reg_alpha': 1.0798305309498408, 'reg_lambda': 3.9639518273300386e-05, 'gamma': 6.22601255075992e-05}. Best is trial 138 with value: -0.2072051712552569.
[I 2026-07-17 15:49:09,343] Trial 152 finished with value: -0.1828811496998048 and parameters: {'scalers': 'robust', 'ratios': 'log_ratio', 'imputers': 'mean', 'n_estimators': 1850, 'learning_rate': 0.48800526292320284, 'max_depth': 8, 'min_child_weight': 1, 'subsample': 0.6, 'colsample_bytree': 0.7, 'colsample_bylevel': 0.5, 'reg_alpha': 1.0530819569657932, 'reg_lambda': 1.7786670797731952e-05, 'gamma': 6.058721527515053e-05}. Best is trial 138 with value: -0.2072051712552569.
[I 2026-07-17 15:49:20,325] Trial 153 finished with value: -0.17032725050217165 and parameters: {'scalers': 'robust', 'ratios': 'norm_ratio', 'imputers': 'mean', 'n_estimators': 1800, 'learning_rate': 0.47703570697662045, 'max_depth': 8, 'min_child_weight': 1, 'subsample': 0.6, 'colsample_bytree': 0.7, 'colsample_bylevel': 0.5, 'reg_alpha': 0.9896873421656474, 'reg_lambda': 3.61081005817692e-05, 'gamma': 6.20503333170671e-05}. Best is trial 138 with value: -0.2072051712552569.
[I 2026-07-17 15:49:33,901] Trial 154 finished with value: -0.19276861606898765 and parameters: {'scalers': 'robust', 'ratios': 'log_ratio', 'imputers': 'mean', 'n_estimators': 1800, 'learning_rate': 0.4993475160807077, 'max_depth': 9, 'min_child_weight': 1, 'subsample': 0.6, 'colsample_bytree': 0.7, 'colsample_bylevel': 0.5, 'reg_alpha': 1.0743748075250634, 'reg_lambda': 4.5381308680638516e-05, 'gamma': 6.118624730701786e-05}. Best is trial 138 with value: -0.2072051712552569.
[I 2026-07-17 15:49:47,426] Trial 155 finished with value: -0.20068918542875355 and parameters: {'scalers': 'robust', 'ratios': 'log_ratio', 'imputers': 'mean', 'n_estimators': 1800, 'learning_rate': 0.488425356078412, 'max_depth': 9, 'min_child_weight': 1, 'subsample': 0.6, 'colsample_bytree': 0.7, 'colsample_bylevel': 0.5, 'reg_alpha': 1.2527277734113733, 'reg_lambda': 4.067796076611929e-05, 'gamma': 3.0848723203298103e-05}. Best is trial 138 with value: -0.2072051712552569.
[I 2026-07-17 15:50:00,346] Trial 156 finished with value: -0.1845496502895241 and parameters: {'scalers': 'robust', 'ratios': 'log_ratio', 'imputers': 'mean', 'n_estimators': 1700, 'learning_rate': 0.49040786752250776, 'max_depth': 9, 'min_child_weight': 1, 'subsample': 0.6, 'colsample_bytree': 0.7, 'colsample_bylevel': 0.5, 'reg_alpha': 1.093630407199367, 'reg_lambda': 1.1148694200023035e-05, 'gamma': 3.0483281937386502e-05}. Best is trial 138 with value: -0.2072051712552569.
[I 2026-07-17 15:50:10,418] Trial 157 finished with value: -0.13399504381441205 and parameters: {'scalers': 'robust', 'ratios': 'log_ratio', 'imputers': 'mean', 'n_estimators': 1850, 'learning_rate': 0.46554611648425237, 'max_depth': 9, 'min_child_weight': 1, 'subsample': 0.6, 'colsample_bytree': 0.7, 'colsample_bylevel': 0.5, 'reg_alpha': 0.34028972321463025, 'reg_lambda': 1.762877026873607e-05, 'gamma': 2.8088409093909545e-05}. Best is trial 138 with value: -0.2072051712552569.
[I 2026-07-17 15:50:22,970] Trial 158 finished with value: -0.18839840840206018 and parameters: {'scalers': 'robust', 'ratios': 'log_ratio', 'imputers': 'mean', 'n_estimators': 1650, 'learning_rate': 0.4985646109664443, 'max_depth': 9, 'min_child_weight': 1, 'subsample': 0.6, 'colsample_bytree': 0.7, 'colsample_bylevel': 0.5, 'reg_alpha': 0.9423265385517072, 'reg_lambda': 1.9578255791743324e-05, 'gamma': 3.5275870676314856e-05}. Best is trial 138 with value: -0.2072051712552569.
[I 2026-07-17 15:50:33,533] Trial 159 finished with value: -0.14450384362293325 and parameters: {'scalers': 'robust', 'ratios': 'log_ratio', 'imputers': 'mean', 'n_estimators': 1900, 'learning_rate': 0.4981841519095392, 'max_depth': 9, 'min_child_weight': 1, 'subsample': 0.6, 'colsample_bytree': 0.7, 'colsample_bylevel': 0.5, 'reg_alpha': 0.3306290896440013, 'reg_lambda': 7.953366386497676e-06, 'gamma': 3.2593309352345834e-05}. Best is trial 138 with value: -0.2072051712552569.
[I 2026-07-17 15:50:46,211] Trial 160 finished with value: -0.13673021506279642 and parameters: {'scalers': 'robust', 'ratios': 'log_ratio', 'imputers': 'mean', 'n_estimators': 1900, 'learning_rate': 0.32663175943362927, 'max_depth': 9, 'min_child_weight': 1, 'subsample': 0.6, 'colsample_bytree': 0.7, 'colsample_bylevel': 0.5, 'reg_alpha': 0.7817584132484869, 'reg_lambda': 1.340056712627563e-05, 'gamma': 3.6889078474436515e-05}. Best is trial 138 with value: -0.2072051712552569.
[I 2026-07-17 15:50:56,448] Trial 161 finished with value: -0.1051848108218076 and parameters: {'scalers': 'robust', 'ratios': 'log_ratio', 'imputers': 'mean', 'n_estimators': 1900, 'learning_rate': 0.3326445475869866, 'max_depth': 9, 'min_child_weight': 1, 'subsample': 0.6, 'colsample_bytree': 0.7, 'colsample_bylevel': 0.5, 'reg_alpha': 0.3528312485103281, 'reg_lambda': 1.7389283558094525e-05, 'gamma': 3.1050362231836e-05}. Best is trial 138 with value: -0.2072051712552569.
[I 2026-07-17 15:51:05,431] Trial 162 finished with value: -0.10530083368746739 and parameters: {'scalers': 'robust', 'ratios': 'log_ratio', 'imputers': 'mean', 'n_estimators': 1650, 'learning_rate': 0.331030198642164, 'max_depth': 9, 'min_child_weight': 1, 'subsample': 0.6, 'colsample_bytree': 0.7, 'colsample_bylevel': 0.5, 'reg_alpha': 0.33517111819398143, 'reg_lambda': 1.650714823137254e-05, 'gamma': 3.5971086623157776e-05}. Best is trial 138 with value: -0.2072051712552569.
[I 2026-07-17 15:51:14,116] Trial 163 finished with value: -0.1017977666240123 and parameters: {'scalers': 'robust', 'ratios': 'log_ratio', 'imputers': 'mean', 'n_estimators': 1650, 'learning_rate': 0.3238972752762677, 'max_depth': 9, 'min_child_weight': 1, 'subsample': 0.6, 'colsample_bytree': 0.7, 'colsample_bylevel': 0.5, 'reg_alpha': 0.33313361321039436, 'reg_lambda': 1.5036857011868127e-05, 'gamma': 3.4086643953473964e-05}. Best is trial 138 with value: -0.2072051712552569.
[I 2026-07-17 15:51:21,739] Trial 164 finished with value: -0.09861867774456616 and parameters: {'scalers': 'robust', 'ratios': 'log_ratio', 'imputers': 'mean', 'n_estimators': 1900, 'learning_rate': 0.32506236355852786, 'max_depth': 9, 'min_child_weight': 1, 'subsample': 0.6, 'colsample_bytree': 0.7, 'colsample_bylevel': 0.5, 'reg_alpha': 3.0893429562139576, 'reg_lambda': 1.4545906455161905e-05, 'gamma': 3.391443237230108e-05}. Best is trial 138 with value: -0.2072051712552569.
[I 2026-07-17 15:51:28,531] Trial 165 finished with value: -0.0938009346625213 and parameters: {'scalers': 'robust', 'ratios': 'log_ratio', 'imputers': 'mean', 'n_estimators': 1650, 'learning_rate': 0.3301325653209209, 'max_depth': 9, 'min_child_weight': 1, 'subsample': 0.6, 'colsample_bytree': 0.7, 'colsample_bylevel': 0.5, 'reg_alpha': 3.16655708247442, 'reg_lambda': 5.853362672552883e-06, 'gamma': 3.6363495389418686e-05}. Best is trial 138 with value: -0.2072051712552569.
[I 2026-07-17 15:51:35,481] Trial 166 finished with value: -0.09121872593696187 and parameters: {'scalers': 'robust', 'ratios': 'log_ratio', 'imputers': 'mean', 'n_estimators': 1650, 'learning_rate': 0.3193248769264007, 'max_depth': 9, 'min_child_weight': 1, 'subsample': 0.6, 'colsample_bytree': 0.7, 'colsample_bylevel': 0.5, 'reg_alpha': 3.1425140627965074, 'reg_lambda': 7.312642009835521e-06, 'gamma': 3.632912898939162e-05}. Best is trial 138 with value: -0.2072051712552569.
[I 2026-07-17 15:51:42,029] Trial 167 finished with value: -0.09451281002656213 and parameters: {'scalers': 'robust', 'ratios': 'log_ratio', 'imputers': 'mean', 'n_estimators': 1600, 'learning_rate': 0.3286213594730631, 'max_depth': 9, 'min_child_weight': 1, 'subsample': 0.6, 'colsample_bytree': 0.7, 'colsample_bylevel': 0.5, 'reg_alpha': 3.029342341241103, 'reg_lambda': 2.077081068613856e-05, 'gamma': 3.935828433010388e-05}. Best is trial 138 with value: -0.2072051712552569.
[I 2026-07-17 15:51:48,600] Trial 168 finished with value: -0.09033538300488334 and parameters: {'scalers': 'robust', 'ratios': 'log_ratio', 'imputers': 'mean', 'n_estimators': 1650, 'learning_rate': 0.3280759840320692, 'max_depth': 9, 'min_child_weight': 1, 'subsample': 0.6, 'colsample_bytree': 0.7, 'colsample_bylevel': 0.5, 'reg_alpha': 3.255615968899285, 'reg_lambda': 3.313765902805773e-06, 'gamma': 1.7649943717072797e-05}. Best is trial 138 with value: -0.2072051712552569.
[I 2026-07-17 15:51:55,635] Trial 169 finished with value: -0.094450929162927 and parameters: {'scalers': 'robust', 'ratios': 'log_ratio', 'imputers': 'mean', 'n_estimators': 1700, 'learning_rate': 0.3252895400254598, 'max_depth': 9, 'min_child_weight': 1, 'subsample': 0.6, 'colsample_bytree': 0.7, 'colsample_bylevel': 0.5, 'reg_alpha': 3.0686959360538824, 'reg_lambda': 2.3772259921323253e-05, 'gamma': 1.5082644137779716e-05}. Best is trial 138 with value: -0.2072051712552569.
[I 2026-07-17 15:52:02,586] Trial 170 finished with value: -0.09282537135260573 and parameters: {'scalers': 'robust', 'ratios': 'log_ratio', 'imputers': 'mean', 'n_estimators': 1700, 'learning_rate': 0.3317291635984435, 'max_depth': 9, 'min_child_weight': 1, 'subsample': 0.6, 'colsample_bytree': 0.7, 'colsample_bylevel': 0.5, 'reg_alpha': 3.0989697067041955, 'reg_lambda': 2.9035527369935623e-05, 'gamma': 8.528876412069146e-05}. Best is trial 138 with value: -0.2072051712552569.
[I 2026-07-17 15:52:09,231] Trial 171 finished with value: -0.09965978640806163 and parameters: {'scalers': 'robust', 'ratios': 'log_ratio', 'imputers': 'mean', 'n_estimators': 1550, 'learning_rate': 0.3377791721827739, 'max_depth': 9, 'min_child_weight': 1, 'subsample': 0.6, 'colsample_bytree': 0.7, 'colsample_bylevel': 0.5, 'reg_alpha': 2.998152598874726, 'reg_lambda': 2.6024542394483718e-05, 'gamma': 1.8783078412469754e-05}. Best is trial 138 with value: -0.2072051712552569.
[I 2026-07-17 15:52:23,837] Trial 172 finished with value: -0.20931359507453345 and parameters: {'scalers': 'robust', 'ratios': 'log_ratio', 'imputers': 'mean', 'n_estimators': 2000, 'learning_rate': 0.4898996469629912, 'max_depth': 9, 'min_child_weight': 1, 'subsample': 0.6, 'colsample_bytree': 0.7, 'colsample_bylevel': 0.5, 'reg_alpha': 1.6158550126776408, 'reg_lambda': 3.058669902077393e-05, 'gamma': 1.790850892235246e-05}. Best is trial 172 with value: -0.20931359507453345.
[I 2026-07-17 15:52:34,180] Trial 173 finished with value: -0.16050288774587967 and parameters: {'scalers': 'robust', 'ratios': 'log_ratio', 'imputers': 'mean', 'n_estimators': 2000, 'learning_rate': 0.49484916079016283, 'max_depth': 8, 'min_child_weight': 1, 'subsample': 0.6, 'colsample_bytree': 0.7, 'colsample_bylevel': 0.5, 'reg_alpha': 0.6300056775009285, 'reg_lambda': 3.114881919898896e-05, 'gamma': 1.799531855406958e-05}. Best is trial 172 with value: -0.20931359507453345.
[I 2026-07-17 15:52:44,743] Trial 174 finished with value: -0.15411134506547383 and parameters: {'scalers': 'robust', 'ratios': 'log_ratio', 'imputers': 'mean', 'n_estimators': 2000, 'learning_rate': 0.4910725873309793, 'max_depth': 8, 'min_child_weight': 1, 'subsample': 0.6, 'colsample_bytree': 0.7, 'colsample_bylevel': 0.5, 'reg_alpha': 0.5769384037057473, 'reg_lambda': 2.4551946352324215e-05, 'gamma': 1.8095603178653487e-05}. Best is trial 172 with value: -0.20931359507453345.
[I 2026-07-17 15:52:57,243] Trial 175 finished with value: -0.16261431490965514 and parameters: {'scalers': 'robust', 'ratios': 'log_ratio', 'imputers': 'mean', 'n_estimators': 2000, 'learning_rate': 0.48996496310175724, 'max_depth': 8, 'min_child_weight': 1, 'subsample': 0.6, 'colsample_bytree': 0.8, 'colsample_bylevel': 0.5, 'reg_alpha': 0.7070856691322166, 'reg_lambda': 3.403158275908042e-05, 'gamma': 1.8114327903332555e-05}. Best is trial 172 with value: -0.20931359507453345.
[I 2026-07-17 15:53:09,660] Trial 176 finished with value: -0.09967280162043388 and parameters: {'scalers': 'robust', 'ratios': 'log_ratio', 'imputers': 'mean', 'n_estimators': 2000, 'learning_rate': 0.43526712601378015, 'max_depth': 8, 'min_child_weight': 2, 'subsample': 0.6, 'colsample_bytree': 0.8, 'colsample_bylevel': 0.5, 'reg_alpha': 0.7145603869107149, 'reg_lambda': 2.9187677510637213e-05, 'gamma': 8.65488918325103e-05}. Best is trial 172 with value: -0.20931359507453345.
[I 2026-07-17 15:53:23,388] Trial 177 finished with value: -0.019063519755203026 and parameters: {'scalers': 'robust', 'ratios': 'log_ratio', 'imputers': 'mean', 'n_estimators': 2000, 'learning_rate': 0.00013362047315830817, 'max_depth': 8, 'min_child_weight': 2, 'subsample': 0.6, 'colsample_bytree': 0.8, 'colsample_bylevel': 0.5, 'reg_alpha': 0.6459617051612163, 'reg_lambda': 3.161041766599525e-05, 'gamma': 8.643044903615593e-05}. Best is trial 172 with value: -0.20931359507453345.
[I 2026-07-17 15:53:33,060] Trial 178 finished with value: -0.13454453238065192 and parameters: {'scalers': 'robust', 'ratios': 'log_ratio', 'imputers': 'mean', 'n_estimators': 2000, 'learning_rate': 0.42318480516204005, 'max_depth': 8, 'min_child_weight': 1, 'subsample': 0.6, 'colsample_bytree': 0.7, 'colsample_bylevel': 0.5, 'reg_alpha': 0.604800624772571, 'reg_lambda': 0.00016684797910143027, 'gamma': 7.912096071481544e-05}. Best is trial 172 with value: -0.20931359507453345.
[I 2026-07-17 15:53:43,078] Trial 179 finished with value: -0.13364522737582807 and parameters: {'scalers': 'robust', 'ratios': 'log_ratio', 'imputers': 'mean', 'n_estimators': 2000, 'learning_rate': 0.4239750351399909, 'max_depth': 8, 'min_child_weight': 1, 'subsample': 0.6, 'colsample_bytree': 0.7, 'colsample_bylevel': 0.5, 'reg_alpha': 0.5666147894099023, 'reg_lambda': 8.382103097368744e-05, 'gamma': 9.206819361480488e-05}. Best is trial 172 with value: -0.20931359507453345.
