[I 2026-07-17 13:58:41,678] A new study created in RDB with name: residual_study_v2
[I 2026-07-17 13:58:48,849] Trial 1 finished with value: -0.026322936672237666 and parameters: {'scalers': 'standard', 'ratios': 'log_ratio', 'imputers': 'median', 'n_estimators': 2850, 'learning_rate': 0.00013289856668144827, 'max_depth': 4, 'min_child_weight': 1, 'subsample': 0.9, 'colsample_bytree': 1.0, 'colsample_bylevel': 0.8, 'reg_alpha': 13.226859901833008, 'reg_lambda': 0.0004292109428336026, 'gamma': 0.9998008082350528}. Best is trial 1 with value: -0.026322936672237666.
[I 2026-07-17 13:58:50,774] Trial 0 finished with value: -0.026301832501125166 and parameters: {'scalers': 'none', 'ratios': 'log_ratio', 'imputers': 'mean', 'n_estimators': 1700, 'learning_rate': 0.008926907763464423, 'max_depth': 8, 'min_child_weight': 5, 'subsample': 0.7, 'colsample_bytree': 0.9, 'colsample_bylevel': 0.5, 'reg_alpha': 28.82556586361742, 'reg_lambda': 1.3937106501874594e-06, 'gamma': 0.016526746326499947}. Best is trial 1 with value: -0.026322936672237666.
[I 2026-07-17 13:58:51,273] Trial 3 finished with value: -0.026301517823570417 and parameters: {'scalers': 'none', 'ratios': 'log_ratio', 'imputers': 'mean', 'n_estimators': 400, 'learning_rate': 0.024813709659576494, 'max_depth': 8, 'min_child_weight': 6, 'subsample': 0.5, 'colsample_bytree': 0.7, 'colsample_bylevel': 0.9, 'reg_alpha': 3.1988364180575863e-06, 'reg_lambda': 9.921686936074597e-05, 'gamma': 6.24447956073699}. Best is trial 1 with value: -0.026322936672237666.
[I 2026-07-17 13:58:52,613] Trial 2 finished with value: -0.026325946270888564 and parameters: {'scalers': 'robust', 'ratios': 'norm_ratio', 'imputers': 'median', 'n_estimators': 1250, 'learning_rate': 0.033685703735461134, 'max_depth': 3, 'min_child_weight': 9, 'subsample': 0.6, 'colsample_bytree': 0.9, 'colsample_bylevel': 0.6, 'reg_alpha': 1.247783542618128e-05, 'reg_lambda': 62.03200869395918, 'gamma': 44.43303692568223}. Best is trial 2 with value: -0.026325946270888564.
[I 2026-07-17 13:58:53,610] Trial 4 finished with value: -0.026333722926111126 and parameters: {'scalers': 'none', 'ratios': 'log_ratio', 'imputers': 'median', 'n_estimators': 700, 'learning_rate': 0.002109633155431807, 'max_depth': 4, 'min_child_weight': 8, 'subsample': 1.0, 'colsample_bytree': 0.8, 'colsample_bylevel': 0.5, 'reg_alpha': 0.551265134271361, 'reg_lambda': 8.651463482870496e-05, 'gamma': 45.861763929527044}. Best is trial 4 with value: -0.026333722926111126.
[I 2026-07-17 13:58:54,438] Trial 5 finished with value: -0.02575443080628566 and parameters: {'scalers': 'robust', 'ratios': 'norm_ratio', 'imputers': 'none', 'n_estimators': 750, 'learning_rate': 0.001067386898720977, 'max_depth': 3, 'min_child_weight': 8, 'subsample': 0.6, 'colsample_bytree': 0.8, 'colsample_bylevel': 0.7, 'reg_alpha': 0.4596320157543147, 'reg_lambda': 1.932158315451128e-06, 'gamma': 1.4013672025111563}. Best is trial 4 with value: -0.026333722926111126.
[I 2026-07-17 13:58:57,351] Trial 6 finished with value: -0.02454771787290619 and parameters: {'scalers': 'none', 'ratios': 'log_ratio', 'imputers': 'none', 'n_estimators': 350, 'learning_rate': 0.00290553549697654, 'max_depth': 8, 'min_child_weight': 1, 'subsample': 0.7, 'colsample_bytree': 0.7, 'colsample_bylevel': 0.9, 'reg_alpha': 0.0694317831963228, 'reg_lambda': 6.229307193778362e-06, 'gamma': 0.03231829246538896}. Best is trial 4 with value: -0.026333722926111126.
[I 2026-07-17 13:58:59,955] Trial 7 finished with value: -0.02632359468753277 and parameters: {'scalers': 'none', 'ratios': 'norm_ratio', 'imputers': 'none', 'n_estimators': 2400, 'learning_rate': 0.005721936193734085, 'max_depth': 11, 'min_child_weight': 9, 'subsample': 0.7, 'colsample_bytree': 0.6, 'colsample_bylevel': 0.5, 'reg_alpha': 81.28391509641784, 'reg_lambda': 0.005959497383421354, 'gamma': 0.0006516308773647944}. Best is trial 4 with value: -0.026333722926111126.
[I 2026-07-17 13:59:03,199] Trial 8 finished with value: -0.024929935514161675 and parameters: {'scalers': 'none', 'ratios': 'log_ratio', 'imputers': 'none', 'n_estimators': 2400, 'learning_rate': 0.0006008838358607656, 'max_depth': 8, 'min_child_weight': 8, 'subsample': 0.9, 'colsample_bytree': 0.7, 'colsample_bylevel': 0.5, 'reg_alpha': 7.474273253923345, 'reg_lambda': 3.721562811543421e-05, 'gamma': 0.20819616709990493}. Best is trial 4 with value: -0.026333722926111126.
[I 2026-07-17 13:59:18,460] Trial 9 finished with value: -0.08972691733842333 and parameters: {'scalers': 'none', 'ratios': 'log_ratio', 'imputers': 'mean', 'n_estimators': 2400, 'learning_rate': 0.3431028444658219, 'max_depth': 10, 'min_child_weight': 3, 'subsample': 0.9, 'colsample_bytree': 0.5, 'colsample_bylevel': 0.5, 'reg_alpha': 0.0011297926926014047, 'reg_lambda': 6.444718956249293, 'gamma': 6.943156198600863e-06}. Best is trial 9 with value: -0.08972691733842333.
[I 2026-07-17 13:59:19,615] Trial 10 finished with value: -0.024779965179474017 and parameters: {'scalers': 'robust', 'ratios': 'log_ratio', 'imputers': 'none', 'n_estimators': 850, 'learning_rate': 0.0027947899710899595, 'max_depth': 3, 'min_child_weight': 9, 'subsample': 0.9, 'colsample_bytree': 1.0, 'colsample_bylevel': 0.5, 'reg_alpha': 0.5515325500992391, 'reg_lambda': 5.064239891630663, 'gamma': 0.6053850097319955}. Best is trial 9 with value: -0.08972691733842333.
[I 2026-07-17 13:59:19,935] Trial 11 finished with value: -0.026326388195944066 and parameters: {'scalers': 'standard', 'ratios': 'norm_ratio', 'imputers': 'none', 'n_estimators': 250, 'learning_rate': 0.003074520253765819, 'max_depth': 7, 'min_child_weight': 4, 'subsample': 0.6, 'colsample_bytree': 0.7, 'colsample_bylevel': 0.9, 'reg_alpha': 2.056212870292866e-05, 'reg_lambda': 25.2797387522225, 'gamma': 10.926261712289929}. Best is trial 9 with value: -0.08972691733842333.
[I 2026-07-17 13:59:39,256] Trial 12 finished with value: -0.024981150821764844 and parameters: {'scalers': 'none', 'ratios': 'log_ratio', 'imputers': 'mean', 'n_estimators': 2350, 'learning_rate': 0.0002142013291062411, 'max_depth': 8, 'min_child_weight': 1, 'subsample': 0.6, 'colsample_bytree': 0.9, 'colsample_bylevel': 0.9, 'reg_alpha': 1.4067427075212502, 'reg_lambda': 0.018950594013725692, 'gamma': 0.00028909460962209943}. Best is trial 9 with value: -0.08972691733842333.
[I 2026-07-17 13:59:43,443] Trial 13 finished with value: -0.03126431881541353 and parameters: {'scalers': 'none', 'ratios': 'log_ratio', 'imputers': 'mean', 'n_estimators': 1100, 'learning_rate': 0.09719417289506144, 'max_depth': 6, 'min_child_weight': 6, 'subsample': 0.8, 'colsample_bytree': 1.0, 'colsample_bylevel': 0.5, 'reg_alpha': 1.0210991889625567e-06, 'reg_lambda': 4.19371840409458e-06, 'gamma': 0.0012912981516135377}. Best is trial 9 with value: -0.08972691733842333.
[I 2026-07-17 13:59:44,963] Trial 14 finished with value: -0.02633067643138723 and parameters: {'scalers': 'none', 'ratios': 'log_ratio', 'imputers': 'mean', 'n_estimators': 1250, 'learning_rate': 0.001065210520680127, 'max_depth': 11, 'min_child_weight': 5, 'subsample': 0.8, 'colsample_bytree': 0.9, 'colsample_bylevel': 0.5, 'reg_alpha': 7.785806601987311e-05, 'reg_lambda': 89.39160855915983, 'gamma': 36.226349038221045}. Best is trial 9 with value: -0.08972691733842333.
[I 2026-07-17 13:59:45,426] Trial 15 finished with value: -0.02491170711130671 and parameters: {'scalers': 'robust', 'ratios': 'norm_ratio', 'imputers': 'none', 'n_estimators': 350, 'learning_rate': 0.002508334375434755, 'max_depth': 3, 'min_child_weight': 10, 'subsample': 0.7, 'colsample_bytree': 0.6, 'colsample_bylevel': 0.5, 'reg_alpha': 16.72163054114175, 'reg_lambda': 0.48653952738096096, 'gamma': 1.0202403921575909e-06}. Best is trial 9 with value: -0.08972691733842333.
[I 2026-07-17 13:59:46,547] Trial 16 finished with value: -0.023999215641866377 and parameters: {'scalers': 'standard', 'ratios': 'norm_ratio', 'imputers': 'none', 'n_estimators': 500, 'learning_rate': 0.005359670513077457, 'max_depth': 12, 'min_child_weight': 7, 'subsample': 1.0, 'colsample_bytree': 0.6, 'colsample_bylevel': 0.6, 'reg_alpha': 1.6893888423218198e-06, 'reg_lambda': 59.99267173725065, 'gamma': 0.05699467779372387}. Best is trial 9 with value: -0.08972691733842333.
[I 2026-07-17 14:00:01,846] Trial 17 finished with value: -0.06753116815493994 and parameters: {'scalers': 'standard', 'ratios': 'norm_ratio', 'imputers': 'mean', 'n_estimators': 1750, 'learning_rate': 0.4383610881885042, 'max_depth': 12, 'min_child_weight': 5, 'subsample': 1.0, 'colsample_bytree': 0.5, 'colsample_bylevel': 1.0, 'reg_alpha': 0.0004438145384124856, 'reg_lambda': 25.16623304794481, 'gamma': 0.0001295161240582145}. Best is trial 9 with value: -0.08972691733842333.
[I 2026-07-17 14:00:13,344] Trial 18 finished with value: -0.057531423257718525 and parameters: {'scalers': 'standard', 'ratios': 'log_ratio', 'imputers': 'median', 'n_estimators': 1750, 'learning_rate': 0.28584771234996037, 'max_depth': 12, 'min_child_weight': 4, 'subsample': 1.0, 'colsample_bytree': 0.5, 'colsample_bylevel': 0.6, 'reg_alpha': 0.0013827946293844086, 'reg_lambda': 0.06386684027171176, 'gamma': 1.7166831121196065e-06}. Best is trial 9 with value: -0.08972691733842333.
[I 2026-07-17 14:00:24,256] Trial 19 finished with value: -0.06137784383533229 and parameters: {'scalers': 'none', 'ratios': 'log_ratio', 'imputers': 'median', 'n_estimators': 1700, 'learning_rate': 0.27971831950479226, 'max_depth': 12, 'min_child_weight': 3, 'subsample': 1.0, 'colsample_bytree': 0.5, 'colsample_bylevel': 0.6, 'reg_alpha': 0.001241927233836725, 'reg_lambda': 0.5370442887797642, 'gamma': 1.5261966739042784e-06}. Best is trial 9 with value: -0.08972691733842333.
[I 2026-07-17 14:00:33,124] Trial 20 finished with value: -0.06790670501347386 and parameters: {'scalers': 'none', 'ratios': 'log_ratio', 'imputers': 'median', 'n_estimators': 1450, 'learning_rate': 0.49764452434290957, 'max_depth': 12, 'min_child_weight': 3, 'subsample': 1.0, 'colsample_bytree': 0.5, 'colsample_bylevel': 0.6, 'reg_alpha': 0.0019363039075377014, 'reg_lambda': 0.3382448968065314, 'gamma': 5.452456594669234e-06}. Best is trial 9 with value: -0.08972691733842333.
[I 2026-07-17 14:00:46,590] Trial 21 finished with value: -0.09279946077589037 and parameters: {'scalers': 'none', 'ratios': 'log_ratio', 'imputers': 'mean', 'n_estimators': 1650, 'learning_rate': 0.46874887171530205, 'max_depth': 12, 'min_child_weight': 3, 'subsample': 0.8, 'colsample_bytree': 0.5, 'colsample_bylevel': 0.6, 'reg_alpha': 0.0006649208984320373, 'reg_lambda': 0.6919641741579335, 'gamma': 1.4245025592422827e-06}. Best is trial 21 with value: -0.09279946077589037.
[I 2026-07-17 14:00:57,884] Trial 22 finished with value: -0.07105585623406196 and parameters: {'scalers': 'standard', 'ratios': 'log_ratio', 'imputers': 'mean', 'n_estimators': 1800, 'learning_rate': 0.45904004484246347, 'max_depth': 12, 'min_child_weight': 3, 'subsample': 1.0, 'colsample_bytree': 0.5, 'colsample_bylevel': 0.6, 'reg_alpha': 0.0005386066947920279, 'reg_lambda': 0.8031704278562046, 'gamma': 1.1734442659632632e-06}. Best is trial 21 with value: -0.09279946077589037.
[I 2026-07-17 14:01:08,939] Trial 23 finished with value: -0.06988882370696313 and parameters: {'scalers': 'standard', 'ratios': 'log_ratio', 'imputers': 'mean', 'n_estimators': 1750, 'learning_rate': 0.4066126241349241, 'max_depth': 12, 'min_child_weight': 3, 'subsample': 1.0, 'colsample_bytree': 0.5, 'colsample_bylevel': 0.6, 'reg_alpha': 0.0010893075726766891, 'reg_lambda': 0.13901511103116038, 'gamma': 1.3925555126332323e-06}. Best is trial 21 with value: -0.09279946077589037.
[I 2026-07-17 14:01:14,462] Trial 24 finished with value: -0.0541455659449575 and parameters: {'scalers': 'none', 'ratios': 'log_ratio', 'imputers': 'mean', 'n_estimators': 1950, 'learning_rate': 0.403211023140737, 'max_depth': 6, 'min_child_weight': 3, 'subsample': 0.8, 'colsample_bytree': 0.5, 'colsample_bylevel': 0.6, 'reg_alpha': 0.0008235877021923601, 'reg_lambda': 0.12440008096362712, 'gamma': 3.210469932855333e-06}. Best is trial 21 with value: -0.09279946077589037.
[I 2026-07-17 14:01:26,071] Trial 25 finished with value: -0.06134167477617332 and parameters: {'scalers': 'standard', 'ratios': 'norm_ratio', 'imputers': 'mean', 'n_estimators': 1850, 'learning_rate': 0.48741364620248234, 'max_depth': 10, 'min_child_weight': 3, 'subsample': 1.0, 'colsample_bytree': 0.5, 'colsample_bylevel': 1.0, 'reg_alpha': 0.001138991163937486, 'reg_lambda': 0.8750707122692071, 'gamma': 1.1396283155047138e-05}. Best is trial 21 with value: -0.09279946077589037.
[I 2026-07-17 14:01:39,971] Trial 26 finished with value: -0.07892852043426829 and parameters: {'scalers': 'standard', 'ratios': 'norm_ratio', 'imputers': 'mean', 'n_estimators': 1850, 'learning_rate': 0.42870891546337064, 'max_depth': 10, 'min_child_weight': 3, 'subsample': 0.9, 'colsample_bytree': 0.5, 'colsample_bylevel': 1.0, 'reg_alpha': 0.0008811103606077415, 'reg_lambda': 1.8999917336228447, 'gamma': 1.7919134436228828e-05}. Best is trial 21 with value: -0.09279946077589037.
[I 2026-07-17 14:01:56,038] Trial 27 finished with value: -0.08472067989516702 and parameters: {'scalers': 'standard', 'ratios': 'norm_ratio', 'imputers': 'mean', 'n_estimators': 2000, 'learning_rate': 0.45390357487582816, 'max_depth': 10, 'min_child_weight': 3, 'subsample': 0.9, 'colsample_bytree': 0.5, 'colsample_bylevel': 1.0, 'reg_alpha': 0.004904824428011599, 'reg_lambda': 3.551621532553398, 'gamma': 2.546177206124519e-05}. Best is trial 21 with value: -0.09279946077589037.
[I 2026-07-17 14:02:11,932] Trial 28 finished with value: -0.0840407697296737 and parameters: {'scalers': 'standard', 'ratios': 'norm_ratio', 'imputers': 'mean', 'n_estimators': 2000, 'learning_rate': 0.4789010815024033, 'max_depth': 10, 'min_child_weight': 3, 'subsample': 0.9, 'colsample_bytree': 0.5, 'colsample_bylevel': 1.0, 'reg_alpha': 0.0025859390690531536, 'reg_lambda': 2.9804870360597424, 'gamma': 1.9854860181685493e-05}. Best is trial 21 with value: -0.09279946077589037.
[I 2026-07-17 14:02:23,797] Trial 29 finished with value: -0.05458321757652814 and parameters: {'scalers': 'none', 'ratios': 'log_ratio', 'imputers': 'mean', 'n_estimators': 2050, 'learning_rate': 0.11154274725596039, 'max_depth': 10, 'min_child_weight': 3, 'subsample': 0.8, 'colsample_bytree': 0.5, 'colsample_bylevel': 0.7, 'reg_alpha': 0.02060676086409777, 'reg_lambda': 1.4644634045073701, 'gamma': 1.256183166372365e-05}. Best is trial 21 with value: -0.09279946077589037.
[I 2026-07-17 14:02:37,747] Trial 30 finished with value: -0.06468237877645473 and parameters: {'scalers': 'standard', 'ratios': 'log_ratio', 'imputers': 'mean', 'n_estimators': 2150, 'learning_rate': 0.12283553601067995, 'max_depth': 10, 'min_child_weight': 2, 'subsample': 0.8, 'colsample_bytree': 0.6, 'colsample_bylevel': 0.7, 'reg_alpha': 0.031200504123873974, 'reg_lambda': 3.3192548925226246, 'gamma': 2.586837139123379e-05}. Best is trial 21 with value: -0.09279946077589037.
[I 2026-07-17 14:02:51,759] Trial 31 finished with value: -0.06498546829259733 and parameters: {'scalers': 'standard', 'ratios': 'log_ratio', 'imputers': 'mean', 'n_estimators': 2150, 'learning_rate': 0.12028495771798005, 'max_depth': 10, 'min_child_weight': 2, 'subsample': 0.8, 'colsample_bytree': 0.6, 'colsample_bylevel': 0.7, 'reg_alpha': 0.014405814256895796, 'reg_lambda': 2.8459348582256028, 'gamma': 1.8964491123765703e-05}. Best is trial 21 with value: -0.09279946077589037.
[I 2026-07-17 14:03:06,761] Trial 32 finished with value: -0.0692368172717393 and parameters: {'scalers': 'standard', 'ratios': 'log_ratio', 'imputers': 'mean', 'n_estimators': 2100, 'learning_rate': 0.13597209132443336, 'max_depth': 10, 'min_child_weight': 2, 'subsample': 0.9, 'colsample_bytree': 0.6, 'colsample_bylevel': 0.7, 'reg_alpha': 0.014074308651130064, 'reg_lambda': 4.717155469413814, 'gamma': 1.8881311889770372e-05}. Best is trial 21 with value: -0.09279946077589037.
[I 2026-07-17 14:03:21,846] Trial 33 finished with value: -0.06603690381706137 and parameters: {'scalers': 'standard', 'ratios': 'log_ratio', 'imputers': 'mean', 'n_estimators': 2100, 'learning_rate': 0.12808530104382296, 'max_depth': 10, 'min_child_weight': 2, 'subsample': 0.9, 'colsample_bytree': 0.6, 'colsample_bylevel': 0.7, 'reg_alpha': 0.00896300961296384, 'reg_lambda': 3.740303011477053, 'gamma': 3.5188458473875634e-05}. Best is trial 21 with value: -0.09279946077589037.
[I 2026-07-17 14:03:37,062] Trial 34 finished with value: -0.06353633325813786 and parameters: {'scalers': 'none', 'ratios': 'norm_ratio', 'imputers': 'mean', 'n_estimators': 2200, 'learning_rate': 0.11732638710388561, 'max_depth': 10, 'min_child_weight': 2, 'subsample': 0.9, 'colsample_bytree': 0.6, 'colsample_bylevel': 0.7, 'reg_alpha': 0.012873512761031724, 'reg_lambda': 2.7450547725324053, 'gamma': 3.0220524981374797e-05}. Best is trial 21 with value: -0.09279946077589037.
[I 2026-07-17 14:03:51,342] Trial 35 finished with value: -0.06899360225439867 and parameters: {'scalers': 'robust', 'ratios': 'norm_ratio', 'imputers': 'mean', 'n_estimators': 2150, 'learning_rate': 0.12440101316147267, 'max_depth': 10, 'min_child_weight': 2, 'subsample': 0.8, 'colsample_bytree': 0.6, 'colsample_bylevel': 0.7, 'reg_alpha': 0.010755648412308234, 'reg_lambda': 8.224805789267196, 'gamma': 5.868523350286867e-05}. Best is trial 21 with value: -0.09279946077589037.
[I 2026-07-17 14:04:07,664] Trial 36 finished with value: -0.06715463015049457 and parameters: {'scalers': 'none', 'ratios': 'norm_ratio', 'imputers': 'mean', 'n_estimators': 2750, 'learning_rate': 0.11612098485823472, 'max_depth': 9, 'min_child_weight': 2, 'subsample': 0.8, 'colsample_bytree': 0.6, 'colsample_bylevel': 0.7, 'reg_alpha': 0.019575862428334333, 'reg_lambda': 7.514636521550723, 'gamma': 0.00010249209631254485}. Best is trial 21 with value: -0.09279946077589037.
[I 2026-07-17 14:04:24,334] Trial 37 finished with value: -0.07097007818970519 and parameters: {'scalers': 'robust', 'ratios': 'norm_ratio', 'imputers': 'mean', 'n_estimators': 2800, 'learning_rate': 0.12606485175482943, 'max_depth': 9, 'min_child_weight': 2, 'subsample': 0.8, 'colsample_bytree': 0.6, 'colsample_bylevel': 0.7, 'reg_alpha': 0.012383591756653553, 'reg_lambda': 11.226801611341799, 'gamma': 9.66151418783682e-05}. Best is trial 21 with value: -0.09279946077589037.
[I 2026-07-17 14:04:45,580] Trial 38 finished with value: -0.08520038566368168 and parameters: {'scalers': 'standard', 'ratios': 'norm_ratio', 'imputers': 'mean', 'n_estimators': 2750, 'learning_rate': 0.1878062623773729, 'max_depth': 9, 'min_child_weight': 2, 'subsample': 0.9, 'colsample_bytree': 0.6, 'colsample_bylevel': 0.8, 'reg_alpha': 0.00689854977089603, 'reg_lambda': 21.23109017383487, 'gamma': 7.432366863189102e-05}. Best is trial 21 with value: -0.09279946077589037.
[I 2026-07-17 14:05:05,711] Trial 39 finished with value: -0.06267334934020488 and parameters: {'scalers': 'standard', 'ratios': 'norm_ratio', 'imputers': 'mean', 'n_estimators': 2850, 'learning_rate': 0.1900441434451827, 'max_depth': 9, 'min_child_weight': 4, 'subsample': 0.9, 'colsample_bytree': 0.6, 'colsample_bylevel': 0.8, 'reg_alpha': 0.0001345162097653776, 'reg_lambda': 9.34329656233649, 'gamma': 7.618420755191332e-05}. Best is trial 21 with value: -0.09279946077589037.
[I 2026-07-17 14:05:21,559] Trial 40 finished with value: -0.042681774104394755 and parameters: {'scalers': 'robust', 'ratios': 'norm_ratio', 'imputers': 'mean', 'n_estimators': 2800, 'learning_rate': 0.06124392894771621, 'max_depth': 9, 'min_child_weight': 4, 'subsample': 0.9, 'colsample_bytree': 0.6, 'colsample_bylevel': 0.8, 'reg_alpha': 0.004961259790916288, 'reg_lambda': 11.13125884530871, 'gamma': 7.851761248678317e-05}. Best is trial 21 with value: -0.09279946077589037.
[I 2026-07-17 14:05:34,975] Trial 41 finished with value: -0.04359483036181919 and parameters: {'scalers': 'robust', 'ratios': 'norm_ratio', 'imputers': 'mean', 'n_estimators': 2650, 'learning_rate': 0.063136716880648, 'max_depth': 9, 'min_child_weight': 4, 'subsample': 0.9, 'colsample_bytree': 0.5, 'colsample_bylevel': 0.8, 'reg_alpha': 0.00013768178141041235, 'reg_lambda': 13.04889639616518, 'gamma': 8.810940534358986e-05}. Best is trial 21 with value: -0.09279946077589037.
[I 2026-07-17 14:05:47,831] Trial 42 finished with value: -0.03794904350035338 and parameters: {'scalers': 'robust', 'ratios': 'norm_ratio', 'imputers': 'mean', 'n_estimators': 2700, 'learning_rate': 0.035396850273975766, 'max_depth': 9, 'min_child_weight': 4, 'subsample': 0.9, 'colsample_bytree': 0.5, 'colsample_bylevel': 0.8, 'reg_alpha': 7.226607191101554e-05, 'reg_lambda': 13.65129268342805, 'gamma': 9.577552603316672e-05}. Best is trial 21 with value: -0.09279946077589037.
[I 2026-07-17 14:06:01,437] Trial 43 finished with value: -0.03834839796937652 and parameters: {'scalers': 'standard', 'ratios': 'norm_ratio', 'imputers': 'mean', 'n_estimators': 2700, 'learning_rate': 0.048577048921416684, 'max_depth': 9, 'min_child_weight': 4, 'subsample': 0.9, 'colsample_bytree': 0.5, 'colsample_bylevel': 0.8, 'reg_alpha': 0.00012621578926240413, 'reg_lambda': 0.0031773693894183485, 'gamma': 0.0046466855764501725}. Best is trial 21 with value: -0.09279946077589037.
[I 2026-07-17 14:06:16,293] Trial 44 finished with value: -0.045515181955139226 and parameters: {'scalers': 'robust', 'ratios': 'norm_ratio', 'imputers': 'mean', 'n_estimators': 2700, 'learning_rate': 0.0615325278677848, 'max_depth': 11, 'min_child_weight': 4, 'subsample': 0.9, 'colsample_bytree': 0.5, 'colsample_bylevel': 0.8, 'reg_alpha': 0.00012469881159263171, 'reg_lambda': 16.22592793020359, 'gamma': 0.0018886624584317766}. Best is trial 21 with value: -0.09279946077589037.
