[I 2026-07-17 16:31:33,329] Trial 135 finished with value: -2.4941952902698805 and parameters: {'scalers': 'robust', 'ratios': 'norm_ratio', 'imputers': 'mean', 'n_estimators': 2700, 'learning_rate': 0.3767191099703311, 'max_depth': 12, 'min_child_weight': 1, 'subsample': 0.6, 'colsample_bytree': 0.8, 'colsample_bylevel': 0.5, 'reg_alpha': 2.852516295469998e-06, 'reg_lambda': 5.837646003174965e-05, 'gamma': 0.0010393797962850687}. Best is trial 133 with value: -2.6760445828607833.
[I 2026-07-17 16:31:44,427] Trial 137 finished with value: -2.0383385518812096 and parameters: {'scalers': 'standard', 'ratios': 'norm_ratio', 'imputers': 'mean', 'n_estimators': 2000, 'learning_rate': 0.3850397566410952, 'max_depth': 11, 'min_child_weight': 1, 'subsample': 0.6, 'colsample_bytree': 0.8, 'colsample_bylevel': 0.5, 'reg_alpha': 2.6955910998031444e-06, 'reg_lambda': 5.067261524787671e-05, 'gamma': 0.0011473748877570866}. Best is trial 133 with value: -2.6760445828607833.
[I 2026-07-17 16:31:57,179] Trial 138 finished with value: -2.4337436659773113 and parameters: {'scalers': 'robust', 'ratios': 'norm_ratio', 'imputers': 'mean', 'n_estimators': 2000, 'learning_rate': 0.4092711773278934, 'max_depth': 12, 'min_child_weight': 1, 'subsample': 0.6, 'colsample_bytree': 0.8, 'colsample_bylevel': 0.5, 'reg_alpha': 2.7321550150274018e-06, 'reg_lambda': 4.836923861454038e-05, 'gamma': 0.0011481680276097883}. Best is trial 133 with value: -2.6760445828607833.
[I 2026-07-17 16:32:02,148] Trial 139 finished with value: -1.1910682450024157 and parameters: {'scalers': 'robust', 'ratios': 'norm_ratio', 'imputers': 'mean', 'n_estimators': 2000, 'learning_rate': 0.38671725247862027, 'max_depth': 5, 'min_child_weight': 1, 'subsample': 0.6, 'colsample_bytree': 0.8, 'colsample_bylevel': 0.5, 'reg_alpha': 2.7303396267629945e-06, 'reg_lambda': 5.1906809311633884e-05, 'gamma': 0.0015924879485061253}. Best is trial 133 with value: -2.6760445828607833.
[I 2026-07-17 16:32:14,333] Trial 140 finished with value: -2.277295399020348 and parameters: {'scalers': 'standard', 'ratios': 'norm_ratio', 'imputers': 'mean', 'n_estimators': 1850, 'learning_rate': 0.382293576530731, 'max_depth': 12, 'min_child_weight': 1, 'subsample': 0.6, 'colsample_bytree': 0.8, 'colsample_bylevel': 0.5, 'reg_alpha': 3.606416005790334e-06, 'reg_lambda': 4.7496758008739483e-05, 'gamma': 0.0013631363412912126}. Best is trial 133 with value: -2.6760445828607833.
[I 2026-07-17 16:32:25,571] Trial 141 finished with value: -2.22198960644511 and parameters: {'scalers': 'standard', 'ratios': 'norm_ratio', 'imputers': 'mean', 'n_estimators': 2000, 'learning_rate': 0.39073669109223497, 'max_depth': 11, 'min_child_weight': 1, 'subsample': 0.6, 'colsample_bytree': 0.8, 'colsample_bylevel': 0.5, 'reg_alpha': 2.6227481871912485e-06, 'reg_lambda': 4.9157974253039216e-05, 'gamma': 0.0010557797046365557}. Best is trial 133 with value: -2.6760445828607833.
[I 2026-07-17 16:32:37,372] Trial 142 finished with value: -2.1716147441394864 and parameters: {'scalers': 'standard', 'ratios': 'norm_ratio', 'imputers': 'mean', 'n_estimators': 2050, 'learning_rate': 0.3908863647621578, 'max_depth': 11, 'min_child_weight': 1, 'subsample': 0.6, 'colsample_bytree': 0.8, 'colsample_bylevel': 0.5, 'reg_alpha': 2.534292305323007e-06, 'reg_lambda': 4.1667112333090806e-05, 'gamma': 0.0022232514093965404}. Best is trial 133 with value: -2.6760445828607833.
[I 2026-07-17 16:32:48,306] Trial 143 finished with value: -2.187045149258906 and parameters: {'scalers': 'standard', 'ratios': 'norm_ratio', 'imputers': 'mean', 'n_estimators': 2000, 'learning_rate': 0.38759294359415253, 'max_depth': 11, 'min_child_weight': 1, 'subsample': 0.6, 'colsample_bytree': 0.8, 'colsample_bylevel': 0.5, 'reg_alpha': 2.2784632435550726e-06, 'reg_lambda': 2.0191833565973116e-05, 'gamma': 0.0023399088626259996}. Best is trial 133 with value: -2.6760445828607833.
[I 2026-07-17 16:33:02,801] Trial 144 finished with value: -2.200332013888181 and parameters: {'scalers': 'standard', 'ratios': 'norm_ratio', 'imputers': 'mean', 'n_estimators': 2650, 'learning_rate': 0.38496850145097117, 'max_depth': 11, 'min_child_weight': 1, 'subsample': 0.6, 'colsample_bytree': 0.8, 'colsample_bylevel': 0.5, 'reg_alpha': 3.5867888302145048e-06, 'reg_lambda': 2.139351812597351e-05, 'gamma': 0.004186247863779419}. Best is trial 133 with value: -2.6760445828607833.
[I 2026-07-17 16:33:18,463] Trial 145 finished with value: -2.58241063843415 and parameters: {'scalers': 'standard', 'ratios': 'norm_ratio', 'imputers': 'mean', 'n_estimators': 2750, 'learning_rate': 0.477244176065552, 'max_depth': 11, 'min_child_weight': 1, 'subsample': 0.6, 'colsample_bytree': 0.8, 'colsample_bylevel': 0.5, 'reg_alpha': 3.4741121498047565e-06, 'reg_lambda': 1.9149169946890683e-05, 'gamma': 0.002783958510378207}. Best is trial 133 with value: -2.6760445828607833.
[I 2026-07-17 16:33:34,089] Trial 146 finished with value: -2.4171972796363224 and parameters: {'scalers': 'standard', 'ratios': 'norm_ratio', 'imputers': 'mean', 'n_estimators': 2850, 'learning_rate': 0.410437571282995, 'max_depth': 11, 'min_child_weight': 1, 'subsample': 0.6, 'colsample_bytree': 0.8, 'colsample_bylevel': 0.5, 'reg_alpha': 3.8036285515204334e-06, 'reg_lambda': 2.0261236451834432e-05, 'gamma': 0.002582928204794827}. Best is trial 133 with value: -2.6760445828607833.
[I 2026-07-17 16:33:42,300] Trial 147 finished with value: -2.3294058802843502 and parameters: {'scalers': 'standard', 'ratios': 'norm_ratio', 'imputers': 'mean', 'n_estimators': 1450, 'learning_rate': 0.49800927561567576, 'max_depth': 11, 'min_child_weight': 1, 'subsample': 0.6, 'colsample_bytree': 0.8, 'colsample_bylevel': 0.5, 'reg_alpha': 3.828710805257804e-06, 'reg_lambda': 1.7917567671528624e-05, 'gamma': 0.0030842081209873505}. Best is trial 133 with value: -2.6760445828607833.
[I 2026-07-17 16:33:53,430] Trial 148 finished with value: -2.5829885818731766 and parameters: {'scalers': 'standard', 'ratios': 'norm_ratio', 'imputers': 'mean', 'n_estimators': 1700, 'learning_rate': 0.48989447208470466, 'max_depth': 12, 'min_child_weight': 1, 'subsample': 0.6, 'colsample_bytree': 0.8, 'colsample_bylevel': 0.5, 'reg_alpha': 3.323610831149792e-06, 'reg_lambda': 2.069093034949271e-05, 'gamma': 0.004485439326897601}. Best is trial 133 with value: -2.6760445828607833.
[I 2026-07-17 16:33:53,805] Trial 149 finished with value: -0.529260389508525 and parameters: {'scalers': 'standard', 'ratios': 'norm_ratio', 'imputers': 'mean', 'n_estimators': 2000, 'learning_rate': 0.48796749258422295, 'max_depth': 11, 'min_child_weight': 1, 'subsample': 0.6, 'colsample_bytree': 0.8, 'colsample_bylevel': 0.5, 'reg_alpha': 92.08540930812006, 'reg_lambda': 2.3199933420425726e-05, 'gamma': 0.002957647511943818}. Best is trial 133 with value: -2.6760445828607833.
[I 2026-07-17 16:34:08,926] Trial 150 finished with value: -2.614801891505788 and parameters: {'scalers': 'standard', 'ratios': 'norm_ratio', 'imputers': 'mean', 'n_estimators': 2700, 'learning_rate': 0.47659005316549763, 'max_depth': 11, 'min_child_weight': 1, 'subsample': 0.6, 'colsample_bytree': 0.8, 'colsample_bylevel': 0.5, 'reg_alpha': 4.1197126165885165e-06, 'reg_lambda': 2.393564957881709e-05, 'gamma': 0.0026667830047096045}. Best is trial 133 with value: -2.6760445828607833.
[I 2026-07-17 16:34:25,603] Trial 151 finished with value: -2.625310387925853 and parameters: {'scalers': 'standard', 'ratios': 'norm_ratio', 'imputers': 'mean', 'n_estimators': 2850, 'learning_rate': 0.48067375700373294, 'max_depth': 11, 'min_child_weight': 1, 'subsample': 0.6, 'colsample_bytree': 0.8, 'colsample_bylevel': 0.5, 'reg_alpha': 4.3311321127842605e-06, 'reg_lambda': 1.3339401155156684e-05, 'gamma': 0.003044746608929146}. Best is trial 133 with value: -2.6760445828607833.
[I 2026-07-17 16:34:27,340] Trial 152 finished with value: -0.529241056847173 and parameters: {'scalers': 'standard', 'ratios': 'norm_ratio', 'imputers': 'mean', 'n_estimators': 2750, 'learning_rate': 0.48380920006630557, 'max_depth': 11, 'min_child_weight': 1, 'subsample': 0.6, 'colsample_bytree': 0.8, 'colsample_bylevel': 0.5, 'reg_alpha': 89.35983789888061, 'reg_lambda': 2.2305549615582915e-05, 'gamma': 0.000773549514089276}. Best is trial 133 with value: -2.6760445828607833.
[I 2026-07-17 16:34:42,405] Trial 153 finished with value: -2.5447020208121955 and parameters: {'scalers': 'standard', 'ratios': 'norm_ratio', 'imputers': 'mean', 'n_estimators': 2700, 'learning_rate': 0.4789601267048337, 'max_depth': 11, 'min_child_weight': 1, 'subsample': 0.6, 'colsample_bytree': 0.8, 'colsample_bylevel': 0.5, 'reg_alpha': 8.068061474480025e-06, 'reg_lambda': 8.294949116829123e-06, 'gamma': 0.00030936748238009296}. Best is trial 133 with value: -2.6760445828607833.
[I 2026-07-17 16:34:59,017] Trial 154 finished with value: -2.484338254195075 and parameters: {'scalers': 'standard', 'ratios': 'norm_ratio', 'imputers': 'mean', 'n_estimators': 2900, 'learning_rate': 0.4675515114415321, 'max_depth': 11, 'min_child_weight': 1, 'subsample': 0.6, 'colsample_bytree': 0.8, 'colsample_bylevel': 0.5, 'reg_alpha': 9.062540487325186e-06, 'reg_lambda': 8.52353912539322e-06, 'gamma': 0.0008123884371876752}. Best is trial 133 with value: -2.6760445828607833.
[I 2026-07-17 16:35:15,146] Trial 155 finished with value: -2.666849343697895 and parameters: {'scalers': 'standard', 'ratios': 'norm_ratio', 'imputers': 'mean', 'n_estimators': 2850, 'learning_rate': 0.4914662585744043, 'max_depth': 11, 'min_child_weight': 1, 'subsample': 0.6, 'colsample_bytree': 0.8, 'colsample_bylevel': 0.5, 'reg_alpha': 7.839168109357212e-06, 'reg_lambda': 7.650405871362723e-06, 'gamma': 0.0008534169428832665}. Best is trial 133 with value: -2.6760445828607833.
[I 2026-07-17 16:35:32,323] Trial 156 finished with value: -2.70365257143808 and parameters: {'scalers': 'standard', 'ratios': 'norm_ratio', 'imputers': 'mean', 'n_estimators': 3000, 'learning_rate': 0.49197700742235145, 'max_depth': 11, 'min_child_weight': 1, 'subsample': 0.6, 'colsample_bytree': 0.8, 'colsample_bylevel': 0.5, 'reg_alpha': 5.267860172797838e-06, 'reg_lambda': 8.40443793843148e-06, 'gamma': 0.0008163619016891046}. Best is trial 156 with value: -2.70365257143808.
[I 2026-07-17 16:35:48,686] Trial 157 finished with value: -2.686303483832798 and parameters: {'scalers': 'standard', 'ratios': 'norm_ratio', 'imputers': 'mean', 'n_estimators': 2850, 'learning_rate': 0.48453152129660243, 'max_depth': 11, 'min_child_weight': 1, 'subsample': 0.6, 'colsample_bytree': 0.8, 'colsample_bylevel': 0.5, 'reg_alpha': 9.305205652360804e-06, 'reg_lambda': 8.001656072028319e-06, 'gamma': 0.0009366801062821062}. Best is trial 156 with value: -2.70365257143808.
[I 2026-07-17 16:36:05,268] Trial 158 finished with value: -2.702894903917002 and parameters: {'scalers': 'standard', 'ratios': 'norm_ratio', 'imputers': 'mean', 'n_estimators': 2850, 'learning_rate': 0.49867447561702793, 'max_depth': 11, 'min_child_weight': 1, 'subsample': 0.6, 'colsample_bytree': 0.8, 'colsample_bylevel': 0.5, 'reg_alpha': 8.042054466510515e-06, 'reg_lambda': 9.263993772092179e-06, 'gamma': 0.0008284050447190073}. Best is trial 156 with value: -2.70365257143808.
[I 2026-07-17 16:36:21,245] Trial 159 finished with value: -2.5617902118625144 and parameters: {'scalers': 'standard', 'ratios': 'norm_ratio', 'imputers': 'mean', 'n_estimators': 2850, 'learning_rate': 0.4603622441080171, 'max_depth': 11, 'min_child_weight': 1, 'subsample': 0.6, 'colsample_bytree': 0.8, 'colsample_bylevel': 0.5, 'reg_alpha': 7.815785487236505e-06, 'reg_lambda': 9.998849554151391e-06, 'gamma': 0.0009128469038677526}. Best is trial 156 with value: -2.70365257143808.
[I 2026-07-17 16:36:36,906] Trial 160 finished with value: -2.5452801564609655 and parameters: {'scalers': 'standard', 'ratios': 'norm_ratio', 'imputers': 'mean', 'n_estimators': 2750, 'learning_rate': 0.49229533445893137, 'max_depth': 11, 'min_child_weight': 1, 'subsample': 0.6, 'colsample_bytree': 0.8, 'colsample_bylevel': 0.5, 'reg_alpha': 8.481276597861828e-06, 'reg_lambda': 7.118056870054552e-06, 'gamma': 0.0002677704872606102}. Best is trial 156 with value: -2.70365257143808.
[I 2026-07-17 16:36:53,280] Trial 161 finished with value: -2.0354495256924983 and parameters: {'scalers': 'standard', 'ratios': 'norm_ratio', 'imputers': 'mean', 'n_estimators': 2850, 'learning_rate': 0.30042491676591626, 'max_depth': 11, 'min_child_weight': 1, 'subsample': 0.6, 'colsample_bytree': 0.8, 'colsample_bylevel': 0.5, 'reg_alpha': 8.26833485186327e-06, 'reg_lambda': 8.386416398278758e-06, 'gamma': 0.0008509001616146949}. Best is trial 156 with value: -2.70365257143808.
[I 2026-07-17 16:37:08,989] Trial 162 finished with value: -2.0782460346905927 and parameters: {'scalers': 'standard', 'ratios': 'norm_ratio', 'imputers': 'mean', 'n_estimators': 2850, 'learning_rate': 0.3035814595107245, 'max_depth': 11, 'min_child_weight': 1, 'subsample': 0.6, 'colsample_bytree': 0.8, 'colsample_bylevel': 0.5, 'reg_alpha': 8.44040359108224e-06, 'reg_lambda': 8.981984376600497e-06, 'gamma': 0.0003073868502938278}. Best is trial 156 with value: -2.70365257143808.
[I 2026-07-17 16:37:25,977] Trial 163 finished with value: -2.6558196651608497 and parameters: {'scalers': 'standard', 'ratios': 'norm_ratio', 'imputers': 'mean', 'n_estimators': 2850, 'learning_rate': 0.4942329023816806, 'max_depth': 11, 'min_child_weight': 1, 'subsample': 0.6, 'colsample_bytree': 0.8, 'colsample_bylevel': 0.5, 'reg_alpha': 8.188059424020924e-06, 'reg_lambda': 9.113371401409758e-06, 'gamma': 0.0002736124567036213}. Best is trial 156 with value: -2.70365257143808.
[I 2026-07-17 16:37:41,668] Trial 164 finished with value: -2.612307490269194 and parameters: {'scalers': 'standard', 'ratios': 'norm_ratio', 'imputers': 'mean', 'n_estimators': 2850, 'learning_rate': 0.4868589392631923, 'max_depth': 11, 'min_child_weight': 1, 'subsample': 0.6, 'colsample_bytree': 0.8, 'colsample_bylevel': 0.5, 'reg_alpha': 8.660075384693135e-06, 'reg_lambda': 8.0467946989095e-06, 'gamma': 0.00019724801212767212}. Best is trial 156 with value: -2.70365257143808.
[I 2026-07-17 16:37:57,730] Trial 165 finished with value: -2.763474350086982 and parameters: {'scalers': 'standard', 'ratios': 'norm_ratio', 'imputers': 'mean', 'n_estimators': 2800, 'learning_rate': 0.49841945676047916, 'max_depth': 11, 'min_child_weight': 1, 'subsample': 0.6, 'colsample_bytree': 0.8, 'colsample_bylevel': 0.5, 'reg_alpha': 8.62528064636966e-06, 'reg_lambda': 8.128109426584734e-06, 'gamma': 0.0002633451635850084}. Best is trial 165 with value: -2.763474350086982.
[I 2026-07-17 16:38:13,435] Trial 166 finished with value: -2.031185979091473 and parameters: {'scalers': 'standard', 'ratios': 'norm_ratio', 'imputers': 'mean', 'n_estimators': 2850, 'learning_rate': 0.28968337725816956, 'max_depth': 11, 'min_child_weight': 1, 'subsample': 0.6, 'colsample_bytree': 0.8, 'colsample_bylevel': 0.5, 'reg_alpha': 1.8262046377837933e-05, 'reg_lambda': 7.1570497312075725e-06, 'gamma': 0.0003092684622333471}. Best is trial 165 with value: -2.763474350086982.
[I 2026-07-17 16:38:27,781] Trial 167 finished with value: -2.4933362975242574 and parameters: {'scalers': 'standard', 'ratios': 'norm_ratio', 'imputers': 'mean', 'n_estimators': 2850, 'learning_rate': 0.49153662635144807, 'max_depth': 10, 'min_child_weight': 1, 'subsample': 0.6, 'colsample_bytree': 0.8, 'colsample_bylevel': 0.5, 'reg_alpha': 1.791197052830633e-05, 'reg_lambda': 7.630533299013485e-06, 'gamma': 0.0002645300532048687}. Best is trial 165 with value: -2.763474350086982.
[I 2026-07-17 16:38:43,263] Trial 168 finished with value: -1.9854980733191194 and parameters: {'scalers': 'standard', 'ratios': 'norm_ratio', 'imputers': 'mean', 'n_estimators': 2850, 'learning_rate': 0.2951157115586114, 'max_depth': 11, 'min_child_weight': 1, 'subsample': 0.6, 'colsample_bytree': 0.8, 'colsample_bylevel': 0.5, 'reg_alpha': 8.468054286540596e-06, 'reg_lambda': 8.389179489946042e-06, 'gamma': 0.00021533256037154413}. Best is trial 165 with value: -2.763474350086982.
[I 2026-07-17 16:39:00,027] Trial 169 finished with value: -2.0358991461109266 and parameters: {'scalers': 'standard', 'ratios': 'norm_ratio', 'imputers': 'mean', 'n_estimators': 3000, 'learning_rate': 0.30213630865015667, 'max_depth': 11, 'min_child_weight': 1, 'subsample': 0.6, 'colsample_bytree': 0.8, 'colsample_bylevel': 0.5, 'reg_alpha': 1.2924013020108043e-05, 'reg_lambda': 9.555763360289242e-06, 'gamma': 0.0002555508854144669}. Best is trial 165 with value: -2.763474350086982.
[I 2026-07-17 16:39:14,573] Trial 170 finished with value: -2.3876878661216945 and parameters: {'scalers': 'standard', 'ratios': 'norm_ratio', 'imputers': 'mean', 'n_estimators': 3000, 'learning_rate': 0.45347949665668846, 'max_depth': 10, 'min_child_weight': 1, 'subsample': 0.6, 'colsample_bytree': 0.8, 'colsample_bylevel': 0.5, 'reg_alpha': 1.6155578099790484e-05, 'reg_lambda': 2.654223346274371e-06, 'gamma': 0.0002850386048086349}. Best is trial 165 with value: -2.763474350086982.
[I 2026-07-17 16:39:29,349] Trial 171 finished with value: -2.425973450742771 and parameters: {'scalers': 'standard', 'ratios': 'norm_ratio', 'imputers': 'mean', 'n_estimators': 3000, 'learning_rate': 0.47150603365260974, 'max_depth': 10, 'min_child_weight': 1, 'subsample': 0.6, 'colsample_bytree': 0.8, 'colsample_bylevel': 0.5, 'reg_alpha': 1.6883321788374356e-05, 'reg_lambda': 2.4778590785231593e-06, 'gamma': 0.00022412356824175872}. Best is trial 165 with value: -2.763474350086982.
[I 2026-07-17 16:39:44,087] Trial 172 finished with value: -2.5724816286002348 and parameters: {'scalers': 'standard', 'ratios': 'norm_ratio', 'imputers': 'mean', 'n_estimators': 3000, 'learning_rate': 0.4917802206542297, 'max_depth': 10, 'min_child_weight': 1, 'subsample': 0.6, 'colsample_bytree': 0.8, 'colsample_bylevel': 0.5, 'reg_alpha': 1.9686319049961747e-05, 'reg_lambda': 2.2997495582348456e-06, 'gamma': 0.0001899067324274705}. Best is trial 165 with value: -2.763474350086982.
[I 2026-07-17 16:39:58,180] Trial 173 finished with value: -2.5392346686546574 and parameters: {'scalers': 'standard', 'ratios': 'norm_ratio', 'imputers': 'mean', 'n_estimators': 3000, 'learning_rate': 0.49954888548605514, 'max_depth': 10, 'min_child_weight': 1, 'subsample': 0.6, 'colsample_bytree': 0.8, 'colsample_bylevel': 0.5, 'reg_alpha': 1.5076873895892495e-05, 'reg_lambda': 1.5724934513907834e-06, 'gamma': 0.00019432157638784198}. Best is trial 165 with value: -2.763474350086982.
[I 2026-07-17 16:40:09,933] Trial 174 finished with value: -2.485873494308597 and parameters: {'scalers': 'standard', 'ratios': 'norm_ratio', 'imputers': 'mean', 'n_estimators': 2750, 'learning_rate': 0.4981969566070826, 'max_depth': 10, 'min_child_weight': 1, 'subsample': 0.6, 'colsample_bytree': 0.8, 'colsample_bylevel': 0.5, 'reg_alpha': 1.3523974968199347e-05, 'reg_lambda': 2.5862123170934235e-06, 'gamma': 8.406698523387764e-05}. Best is trial 165 with value: -2.763474350086982.
[I 2026-07-17 16:40:24,289] Trial 175 finished with value: -2.4758867504791784 and parameters: {'scalers': 'standard', 'ratios': 'norm_ratio', 'imputers': 'mean', 'n_estimators': 3000, 'learning_rate': 0.4973141556928266, 'max_depth': 10, 'min_child_weight': 1, 'subsample': 0.6, 'colsample_bytree': 0.8, 'colsample_bylevel': 0.5, 'reg_alpha': 1.5341706026843625e-05, 'reg_lambda': 2.278334933147649e-06, 'gamma': 0.00015801889825455172}. Best is trial 165 with value: -2.763474350086982.
[I 2026-07-17 16:40:37,250] Trial 176 finished with value: -2.435288588139608 and parameters: {'scalers': 'standard', 'ratios': 'norm_ratio', 'imputers': 'mean', 'n_estimators': 2750, 'learning_rate': 0.4894393601622222, 'max_depth': 10, 'min_child_weight': 1, 'subsample': 0.6, 'colsample_bytree': 0.8, 'colsample_bylevel': 0.5, 'reg_alpha': 1.5594426871785603e-05, 'reg_lambda': 2.07091993133996e-06, 'gamma': 0.0002137494075396483}. Best is trial 165 with value: -2.763474350086982.
[I 2026-07-17 16:40:50,234] Trial 177 finished with value: -2.5119222385113567 and parameters: {'scalers': 'standard', 'ratios': 'norm_ratio', 'imputers': 'mean', 'n_estimators': 2750, 'learning_rate': 0.4923254056861899, 'max_depth': 10, 'min_child_weight': 1, 'subsample': 0.6, 'colsample_bytree': 0.8, 'colsample_bylevel': 0.5, 'reg_alpha': 5.507401311936127e-06, 'reg_lambda': 2.2603853682949096e-06, 'gamma': 0.0001523319278185494}. Best is trial 165 with value: -2.763474350086982.
[I 2026-07-17 16:41:04,627] Trial 178 finished with value: -2.3596006862092214 and parameters: {'scalers': 'standard', 'ratios': 'norm_ratio', 'imputers': 'mean', 'n_estimators': 2750, 'learning_rate': 0.4985783939811723, 'max_depth': 10, 'min_child_weight': 1, 'subsample': 0.6, 'colsample_bytree': 0.8, 'colsample_bylevel': 0.5, 'reg_alpha': 2.5686184063119748e-05, 'reg_lambda': 3.6693906726709975e-06, 'gamma': 0.00016483598071991143}. Best is trial 165 with value: -2.763474350086982.
[I 2026-07-17 16:41:17,458] Trial 179 finished with value: -2.464511226107726 and parameters: {'scalers': 'standard', 'ratios': 'norm_ratio', 'imputers': 'mean', 'n_estimators': 2700, 'learning_rate': 0.4971660466818889, 'max_depth': 10, 'min_child_weight': 1, 'subsample': 0.6, 'colsample_bytree': 0.8, 'colsample_bylevel': 0.5, 'reg_alpha': 2.7222908368793925e-05, 'reg_lambda': 4.841260779170454e-06, 'gamma': 7.202806702803146e-05}. Best is trial 165 with value: -2.763474350086982.
[I 2026-07-17 16:41:29,977] Trial 180 finished with value: -2.66000282604812 and parameters: {'scalers': 'standard', 'ratios': 'norm_ratio', 'imputers': 'mean', 'n_estimators': 2750, 'learning_rate': 0.4951158462855208, 'max_depth': 10, 'min_child_weight': 1, 'subsample': 0.6, 'colsample_bytree': 0.8, 'colsample_bylevel': 0.5, 'reg_alpha': 2.5687944805917946e-05, 'reg_lambda': 5.117239148216465e-06, 'gamma': 9.229781288404721e-05}. Best is trial 165 with value: -2.763474350086982.
