[I 2026-07-17 11:39:33,658] Trial 90 finished with value: -0.23364606674374283 and parameters: {'scalers': 'standard', 'ratios': 'log_ratio', 'imputers': 'median', 'n_estimators': 2700, 'learning_rate': 0.013652898740719396, 'max_depth': 5, 'min_child_weight': 7, 'subsample': 0.7, 'colsample_bytree': 0.7, 'colsample_bylevel': 0.8, 'reg_alpha': 31.071514588752134, 'reg_lambda': 0.0006724574429873893, 'gamma': 66.12110088378218}. Best is trial 60 with value: -0.24381957873596422.
[I 2026-07-17 11:39:38,177] Trial 91 finished with value: -0.2389597538824167 and parameters: {'scalers': 'standard', 'ratios': 'norm_ratio', 'imputers': 'median', 'n_estimators': 2700, 'learning_rate': 0.0001662062087047091, 'max_depth': 8, 'min_child_weight': 7, 'subsample': 0.7, 'colsample_bytree': 0.7, 'colsample_bylevel': 0.8, 'reg_alpha': 36.72488586483418, 'reg_lambda': 0.0015356295917511313, 'gamma': 68.44194175351511}. Best is trial 60 with value: -0.24381957873596422.
[I 2026-07-17 11:39:42,592] Trial 92 finished with value: -0.22484323156447344 and parameters: {'scalers': 'standard', 'ratios': 'norm_ratio', 'imputers': 'none', 'n_estimators': 2750, 'learning_rate': 0.016161963671566977, 'max_depth': 5, 'min_child_weight': 7, 'subsample': 0.7, 'colsample_bytree': 0.7, 'colsample_bylevel': 0.6, 'reg_alpha': 1.041460507464876, 'reg_lambda': 0.0007780847630989053, 'gamma': 62.864651026880516}. Best is trial 60 with value: -0.24381957873596422.
[I 2026-07-17 11:39:46,970] Trial 93 finished with value: -0.23171718328985552 and parameters: {'scalers': 'standard', 'ratios': 'norm_ratio', 'imputers': 'median', 'n_estimators': 2750, 'learning_rate': 0.007613816321776139, 'max_depth': 5, 'min_child_weight': 7, 'subsample': 0.7, 'colsample_bytree': 0.7, 'colsample_bylevel': 0.6, 'reg_alpha': 13.22319529646484, 'reg_lambda': 0.0006685644430741814, 'gamma': 73.90635819887342}. Best is trial 60 with value: -0.24381957873596422.
[I 2026-07-17 11:39:51,128] Trial 94 finished with value: -0.23101826520392674 and parameters: {'scalers': 'standard', 'ratios': 'norm_ratio', 'imputers': 'median', 'n_estimators': 2100, 'learning_rate': 0.00017493227611738643, 'max_depth': 9, 'min_child_weight': 7, 'subsample': 1.0, 'colsample_bytree': 0.7, 'colsample_bylevel': 0.6, 'reg_alpha': 11.940360999736658, 'reg_lambda': 0.00919564991785387, 'gamma': 62.197558448646916}. Best is trial 60 with value: -0.24381957873596422.
[I 2026-07-17 11:39:55,946] Trial 95 finished with value: -0.2238950618291913 and parameters: {'scalers': 'standard', 'ratios': 'norm_ratio', 'imputers': 'median', 'n_estimators': 2750, 'learning_rate': 0.011052572177610704, 'max_depth': 9, 'min_child_weight': 4, 'subsample': 0.9, 'colsample_bytree': 0.7, 'colsample_bylevel': 0.6, 'reg_alpha': 11.041730810729943, 'reg_lambda': 8.784132829953497e-05, 'gamma': 61.11896813658511}. Best is trial 60 with value: -0.24381957873596422.
[I 2026-07-17 11:39:59,235] Trial 96 finished with value: -0.23098188106148962 and parameters: {'scalers': 'none', 'ratios': 'norm_ratio', 'imputers': 'median', 'n_estimators': 2050, 'learning_rate': 0.0001740898815942415, 'max_depth': 9, 'min_child_weight': 7, 'subsample': 0.6, 'colsample_bytree': 0.7, 'colsample_bylevel': 0.5, 'reg_alpha': 10.903334668554939, 'reg_lambda': 8.373233136049708e-05, 'gamma': 23.551264696732353}. Best is trial 60 with value: -0.24381957873596422.
[I 2026-07-17 11:40:03,778] Trial 97 finished with value: -0.23192799590881402 and parameters: {'scalers': 'none', 'ratios': 'norm_ratio', 'imputers': 'median', 'n_estimators': 2300, 'learning_rate': 0.00012215637102841508, 'max_depth': 9, 'min_child_weight': 7, 'subsample': 0.9, 'colsample_bytree': 0.7, 'colsample_bylevel': 0.5, 'reg_alpha': 2.219759244948403, 'reg_lambda': 0.009023724468784085, 'gamma': 24.248180597389904}. Best is trial 60 with value: -0.24381957873596422.
[I 2026-07-17 11:40:09,024] Trial 98 finished with value: -0.23047412122293565 and parameters: {'scalers': 'standard', 'ratios': 'log_ratio', 'imputers': 'none', 'n_estimators': 3000, 'learning_rate': 0.0004635049096743227, 'max_depth': 9, 'min_child_weight': 5, 'subsample': 0.9, 'colsample_bytree': 0.7, 'colsample_bylevel': 0.5, 'reg_alpha': 2.0387110324770608, 'reg_lambda': 0.00010345361337197015, 'gamma': 88.78964482486165}. Best is trial 60 with value: -0.24381957873596422.
[I 2026-07-17 11:40:15,547] Trial 99 finished with value: -0.22747200767420975 and parameters: {'scalers': 'standard', 'ratios': 'norm_ratio', 'imputers': 'median', 'n_estimators': 3000, 'learning_rate': 0.00012436218730199516, 'max_depth': 9, 'min_child_weight': 7, 'subsample': 1.0, 'colsample_bytree': 0.7, 'colsample_bylevel': 0.8, 'reg_alpha': 0.9815608984110185, 'reg_lambda': 0.00011965668676574342, 'gamma': 20.215940362877237}. Best is trial 60 with value: -0.24381957873596422.
[I 2026-07-17 11:40:20,801] Trial 100 finished with value: -0.22958761889653168 and parameters: {'scalers': 'standard', 'ratios': 'norm_ratio', 'imputers': 'median', 'n_estimators': 3000, 'learning_rate': 0.00012547856198595413, 'max_depth': 9, 'min_child_weight': 5, 'subsample': 0.6, 'colsample_bytree': 0.7, 'colsample_bylevel': 0.8, 'reg_alpha': 12.847680597296737, 'reg_lambda': 0.008571948369364932, 'gamma': 23.799022333402434}. Best is trial 60 with value: -0.24381957873596422.
[I 2026-07-17 11:40:26,706] Trial 101 finished with value: -0.21161460082277453 and parameters: {'scalers': 'none', 'ratios': 'norm_ratio', 'imputers': 'median', 'n_estimators': 3000, 'learning_rate': 0.000467157285288877, 'max_depth': 9, 'min_child_weight': 5, 'subsample': 0.9, 'colsample_bytree': 0.5, 'colsample_bylevel': 0.8, 'reg_alpha': 1.7244908271767556, 'reg_lambda': 0.010614008857886565, 'gamma': 23.02559902348292}. Best is trial 60 with value: -0.24381957873596422.
[I 2026-07-17 11:40:31,345] Trial 102 finished with value: -0.23136712615916863 and parameters: {'scalers': 'none', 'ratios': 'norm_ratio', 'imputers': 'median', 'n_estimators': 2300, 'learning_rate': 0.00013110424351734162, 'max_depth': 9, 'min_child_weight': 5, 'subsample': 0.9, 'colsample_bytree': 0.5, 'colsample_bylevel': 0.8, 'reg_alpha': 1.8517109868683912, 'reg_lambda': 9.858788231270301e-05, 'gamma': 24.119305509217906}. Best is trial 60 with value: -0.24381957873596422.
[I 2026-07-17 11:40:36,460] Trial 103 finished with value: -0.22971424670194784 and parameters: {'scalers': 'none', 'ratios': 'norm_ratio', 'imputers': 'median', 'n_estimators': 3000, 'learning_rate': 0.0001293564428766669, 'max_depth': 8, 'min_child_weight': 5, 'subsample': 0.6, 'colsample_bytree': 0.5, 'colsample_bylevel': 0.8, 'reg_alpha': 2.7878844389242747, 'reg_lambda': 0.0004462683192310371, 'gamma': 24.710528254925233}. Best is trial 60 with value: -0.24381957873596422.
[I 2026-07-17 11:40:41,493] Trial 104 finished with value: -0.2291945245239577 and parameters: {'scalers': 'none', 'ratios': 'norm_ratio', 'imputers': 'median', 'n_estimators': 2950, 'learning_rate': 0.00013649868849963608, 'max_depth': 8, 'min_child_weight': 5, 'subsample': 0.6, 'colsample_bytree': 0.5, 'colsample_bylevel': 0.8, 'reg_alpha': 2.668646910106565, 'reg_lambda': 1.7773873083572054e-05, 'gamma': 23.239465212444394}. Best is trial 60 with value: -0.24381957873596422.
[I 2026-07-17 11:40:46,353] Trial 105 finished with value: -0.2136634300712282 and parameters: {'scalers': 'standard', 'ratios': 'norm_ratio', 'imputers': 'median', 'n_estimators': 2950, 'learning_rate': 0.0004590510642599308, 'max_depth': 8, 'min_child_weight': 5, 'subsample': 0.6, 'colsample_bytree': 0.5, 'colsample_bylevel': 0.8, 'reg_alpha': 0.6742057427307183, 'reg_lambda': 1.9016467084953508e-05, 'gamma': 22.278279487399782}. Best is trial 60 with value: -0.24381957873596422.
[I 2026-07-17 11:40:51,126] Trial 106 finished with value: -0.22446218818746483 and parameters: {'scalers': 'standard', 'ratios': 'norm_ratio', 'imputers': 'median', 'n_estimators': 2950, 'learning_rate': 0.00022662518030902787, 'max_depth': 8, 'min_child_weight': 5, 'subsample': 0.6, 'colsample_bytree': 0.5, 'colsample_bylevel': 0.8, 'reg_alpha': 23.834954048660567, 'reg_lambda': 0.00044202826554612883, 'gamma': 22.996096419967706}. Best is trial 60 with value: -0.24381957873596422.
[I 2026-07-17 11:40:54,230] Trial 107 finished with value: -0.24378465743199854 and parameters: {'scalers': 'standard', 'ratios': 'log_ratio', 'imputers': 'mean', 'n_estimators': 2300, 'learning_rate': 0.0007056941494611423, 'max_depth': 8, 'min_child_weight': 5, 'subsample': 0.6, 'colsample_bytree': 0.5, 'colsample_bylevel': 0.8, 'reg_alpha': 51.38340383120542, 'reg_lambda': 0.0004353470550544669, 'gamma': 96.79330052815226}. Best is trial 60 with value: -0.24381957873596422.
[I 2026-07-17 11:40:57,982] Trial 108 finished with value: -0.23763424663759092 and parameters: {'scalers': 'standard', 'ratios': 'log_ratio', 'imputers': 'none', 'n_estimators': 2300, 'learning_rate': 0.00023030114465542024, 'max_depth': 8, 'min_child_weight': 6, 'subsample': 0.7, 'colsample_bytree': 0.6, 'colsample_bylevel': 0.7, 'reg_alpha': 4.273555530056024e-05, 'reg_lambda': 0.0015049997344365937, 'gamma': 93.77375800790303}. Best is trial 60 with value: -0.24381957873596422.
[I 2026-07-17 11:41:01,816] Trial 109 finished with value: -0.2369439508691371 and parameters: {'scalers': 'standard', 'ratios': 'log_ratio', 'imputers': 'none', 'n_estimators': 2300, 'learning_rate': 0.00021951640599877098, 'max_depth': 8, 'min_child_weight': 6, 'subsample': 0.7, 'colsample_bytree': 0.6, 'colsample_bylevel': 0.7, 'reg_alpha': 3.677575899039855e-05, 'reg_lambda': 0.0015056031288252921, 'gamma': 91.02030943866686}. Best is trial 60 with value: -0.24381957873596422.
[I 2026-07-17 11:41:05,866] Trial 110 finished with value: -0.23685075821636373 and parameters: {'scalers': 'standard', 'ratios': 'log_ratio', 'imputers': 'none', 'n_estimators': 2450, 'learning_rate': 0.00022432052448025292, 'max_depth': 8, 'min_child_weight': 6, 'subsample': 0.7, 'colsample_bytree': 0.6, 'colsample_bylevel': 0.7, 'reg_alpha': 3.843619696505174e-05, 'reg_lambda': 0.0015492552844296372, 'gamma': 91.0831810697063}. Best is trial 60 with value: -0.24381957873596422.
[I 2026-07-17 11:41:09,910] Trial 111 finished with value: -0.23827262821959153 and parameters: {'scalers': 'standard', 'ratios': 'log_ratio', 'imputers': 'none', 'n_estimators': 2450, 'learning_rate': 0.00023072803761598447, 'max_depth': 8, 'min_child_weight': 1, 'subsample': 0.7, 'colsample_bytree': 0.6, 'colsample_bylevel': 0.7, 'reg_alpha': 5.320497503452863e-05, 'reg_lambda': 0.0017361276207010878, 'gamma': 96.3973025278822}. Best is trial 60 with value: -0.24381957873596422.
[I 2026-07-17 11:41:13,964] Trial 112 finished with value: -0.23499766406663342 and parameters: {'scalers': 'standard', 'ratios': 'log_ratio', 'imputers': 'none', 'n_estimators': 2450, 'learning_rate': 0.0002231822464544224, 'max_depth': 8, 'min_child_weight': 1, 'subsample': 0.7, 'colsample_bytree': 0.6, 'colsample_bylevel': 0.7, 'reg_alpha': 4.222420830142936e-05, 'reg_lambda': 0.0017192747981324076, 'gamma': 85.32902897946693}. Best is trial 60 with value: -0.24381957873596422.
[I 2026-07-17 11:41:18,138] Trial 113 finished with value: -0.23800714163656375 and parameters: {'scalers': 'standard', 'ratios': 'log_ratio', 'imputers': 'none', 'n_estimators': 2600, 'learning_rate': 0.0006952731548969148, 'max_depth': 8, 'min_child_weight': 6, 'subsample': 0.7, 'colsample_bytree': 0.6, 'colsample_bylevel': 0.7, 'reg_alpha': 3.701439770175335e-05, 'reg_lambda': 0.0016885679801435477, 'gamma': 99.07767545160199}. Best is trial 60 with value: -0.24381957873596422.
[I 2026-07-17 11:41:22,277] Trial 114 finished with value: -0.22162563728747062 and parameters: {'scalers': 'standard', 'ratios': 'log_ratio', 'imputers': 'none', 'n_estimators': 2450, 'learning_rate': 0.0006962052101663398, 'max_depth': 8, 'min_child_weight': 6, 'subsample': 0.7, 'colsample_bytree': 0.6, 'colsample_bylevel': 0.7, 'reg_alpha': 4.4740332405792563e-05, 'reg_lambda': 0.0016536815422090775, 'gamma': 49.51955795511859}. Best is trial 60 with value: -0.24381957873596422.
[I 2026-07-17 11:41:25,790] Trial 115 finished with value: -0.24378261827415362 and parameters: {'scalers': 'standard', 'ratios': 'log_ratio', 'imputers': 'mean', 'n_estimators': 2450, 'learning_rate': 0.000734505234251892, 'max_depth': 8, 'min_child_weight': 4, 'subsample': 0.6, 'colsample_bytree': 0.6, 'colsample_bylevel': 0.5, 'reg_alpha': 52.98768444406973, 'reg_lambda': 0.001854350724080636, 'gamma': 92.23367417944836}. Best is trial 60 with value: -0.24381957873596422.
[I 2026-07-17 11:41:28,946] Trial 116 finished with value: -0.23671139461493043 and parameters: {'scalers': 'standard', 'ratios': 'log_ratio', 'imputers': 'mean', 'n_estimators': 2200, 'learning_rate': 0.0006626827050272361, 'max_depth': 7, 'min_child_weight': 4, 'subsample': 0.6, 'colsample_bytree': 0.5, 'colsample_bylevel': 0.5, 'reg_alpha': 43.81865830029595, 'reg_lambda': 0.00465345438306865, 'gamma': 46.83142466699323}. Best is trial 60 with value: -0.24381957873596422.
[I 2026-07-17 11:41:31,573] Trial 117 finished with value: -0.23564904086491908 and parameters: {'scalers': 'standard', 'ratios': 'log_ratio', 'imputers': 'mean', 'n_estimators': 1900, 'learning_rate': 0.0007093973184197676, 'max_depth': 7, 'min_child_weight': 4, 'subsample': 0.6, 'colsample_bytree': 0.5, 'colsample_bylevel': 0.5, 'reg_alpha': 51.369490217004724, 'reg_lambda': 2.1566058625774322e-06, 'gamma': 39.710033160478254}. Best is trial 60 with value: -0.24381957873596422.
[I 2026-07-17 11:41:34,483] Trial 118 finished with value: -0.235737733165536 and parameters: {'scalers': 'standard', 'ratios': 'log_ratio', 'imputers': 'mean', 'n_estimators': 1850, 'learning_rate': 0.0003268610675775796, 'max_depth': 7, 'min_child_weight': 4, 'subsample': 0.7, 'colsample_bytree': 0.5, 'colsample_bylevel': 0.5, 'reg_alpha': 50.45678430327925, 'reg_lambda': 30.334732429229074, 'gamma': 46.390904071451416}. Best is trial 60 with value: -0.24381957873596422.
[I 2026-07-17 11:41:37,793] Trial 119 finished with value: -0.2323295734406688 and parameters: {'scalers': 'standard', 'ratios': 'log_ratio', 'imputers': 'mean', 'n_estimators': 2150, 'learning_rate': 0.0001968104283076475, 'max_depth': 7, 'min_child_weight': 1, 'subsample': 0.6, 'colsample_bytree': 0.5, 'colsample_bylevel': 0.5, 'reg_alpha': 1.0659656128243289e-05, 'reg_lambda': 0.0045676689046953226, 'gamma': 47.38249617789582}. Best is trial 60 with value: -0.24381957873596422.
[I 2026-07-17 11:41:40,922] Trial 120 finished with value: -0.2189532515197116 and parameters: {'scalers': 'standard', 'ratios': 'log_ratio', 'imputers': 'mean', 'n_estimators': 2200, 'learning_rate': 0.20098325749555818, 'max_depth': 7, 'min_child_weight': 1, 'subsample': 0.6, 'colsample_bytree': 0.5, 'colsample_bylevel': 0.5, 'reg_alpha': 7.223936887245824e-06, 'reg_lambda': 0.004092477156441889, 'gamma': 49.21733821676544}. Best is trial 60 with value: -0.24381957873596422.
[I 2026-07-17 11:41:44,075] Trial 121 finished with value: -0.23811137982104702 and parameters: {'scalers': 'standard', 'ratios': 'log_ratio', 'imputers': 'mean', 'n_estimators': 2200, 'learning_rate': 0.0011869765582737237, 'max_depth': 7, 'min_child_weight': 1, 'subsample': 0.6, 'colsample_bytree': 0.5, 'colsample_bylevel': 0.5, 'reg_alpha': 50.15662427807298, 'reg_lambda': 0.004011237567057713, 'gamma': 46.992226602261084}. Best is trial 60 with value: -0.24381957873596422.
[I 2026-07-17 11:41:47,238] Trial 122 finished with value: -0.23982190858883798 and parameters: {'scalers': 'robust', 'ratios': 'log_ratio', 'imputers': 'mean', 'n_estimators': 2200, 'learning_rate': 0.00016278559706492857, 'max_depth': 7, 'min_child_weight': 1, 'subsample': 0.6, 'colsample_bytree': 0.5, 'colsample_bylevel': 0.5, 'reg_alpha': 59.42917976285744, 'reg_lambda': 2.0646830426382127e-06, 'gamma': 38.96943984924206}. Best is trial 60 with value: -0.24381957873596422.
[I 2026-07-17 11:41:50,310] Trial 123 finished with value: -0.23495256731855066 and parameters: {'scalers': 'robust', 'ratios': 'log_ratio', 'imputers': 'mean', 'n_estimators': 2150, 'learning_rate': 0.09047252755275935, 'max_depth': 7, 'min_child_weight': 4, 'subsample': 0.6, 'colsample_bytree': 0.5, 'colsample_bylevel': 0.5, 'reg_alpha': 60.868812887059136, 'reg_lambda': 0.004274597336828864, 'gamma': 42.55039365350213}. Best is trial 60 with value: -0.24381957873596422.
[I 2026-07-17 11:41:52,985] Trial 124 finished with value: -0.21514700881641335 and parameters: {'scalers': 'robust', 'ratios': 'log_ratio', 'imputers': 'mean', 'n_estimators': 1900, 'learning_rate': 0.0761686967136928, 'max_depth': 7, 'min_child_weight': 3, 'subsample': 0.6, 'colsample_bytree': 0.5, 'colsample_bylevel': 0.5, 'reg_alpha': 47.035887541366264, 'reg_lambda': 0.016594358790433694, 'gamma': 13.817820637682498}. Best is trial 60 with value: -0.24381957873596422.
[I 2026-07-17 11:41:56,276] Trial 125 finished with value: -0.23371374479266516 and parameters: {'scalers': 'robust', 'ratios': 'log_ratio', 'imputers': 'mean', 'n_estimators': 2150, 'learning_rate': 0.00016656014832122174, 'max_depth': 12, 'min_child_weight': 4, 'subsample': 0.6, 'colsample_bytree': 0.5, 'colsample_bylevel': 0.5, 'reg_alpha': 18.8045547241194, 'reg_lambda': 14.574245746739859, 'gamma': 35.20266553859155}. Best is trial 60 with value: -0.24381957873596422.
[I 2026-07-17 11:41:59,638] Trial 126 finished with value: -0.23161003951803982 and parameters: {'scalers': 'robust', 'ratios': 'log_ratio', 'imputers': 'mean', 'n_estimators': 2150, 'learning_rate': 0.00018411310836599512, 'max_depth': 12, 'min_child_weight': 9, 'subsample': 0.6, 'colsample_bytree': 0.5, 'colsample_bylevel': 0.5, 'reg_alpha': 0.17963443849920221, 'reg_lambda': 0.003912968316572498, 'gamma': 33.81086528668305}. Best is trial 60 with value: -0.24381957873596422.
[I 2026-07-17 11:42:03,864] Trial 127 finished with value: -0.2316283089746581 and parameters: {'scalers': 'robust', 'ratios': 'log_ratio', 'imputers': 'mean', 'n_estimators': 2800, 'learning_rate': 0.0001606676124069879, 'max_depth': 4, 'min_child_weight': 10, 'subsample': 0.6, 'colsample_bytree': 0.5, 'colsample_bylevel': 0.5, 'reg_alpha': 19.712930076856654, 'reg_lambda': 0.01952269559432954, 'gamma': 33.40461223014046}. Best is trial 60 with value: -0.24381957873596422.
[I 2026-07-17 11:42:07,444] Trial 128 finished with value: -0.21150376550370079 and parameters: {'scalers': 'robust', 'ratios': 'log_ratio', 'imputers': 'mean', 'n_estimators': 2350, 'learning_rate': 0.0011536745563089474, 'max_depth': 12, 'min_child_weight': 1, 'subsample': 0.6, 'colsample_bytree': 0.6, 'colsample_bylevel': 0.5, 'reg_alpha': 19.76122735417183, 'reg_lambda': 0.018218393537352093, 'gamma': 15.090918953567167}. Best is trial 60 with value: -0.24381957873596422.
[I 2026-07-17 11:42:16,083] Trial 129 finished with value: -0.21754158948681257 and parameters: {'scalers': 'robust', 'ratios': 'log_ratio', 'imputers': 'mean', 'n_estimators': 2800, 'learning_rate': 0.00017549979646770393, 'max_depth': 12, 'min_child_weight': 9, 'subsample': 0.8, 'colsample_bytree': 0.6, 'colsample_bylevel': 0.5, 'reg_alpha': 18.62379139165167, 'reg_lambda': 0.0021924839858730527, 'gamma': 0.03784811625675259}. Best is trial 60 with value: -0.24381957873596422.
[I 2026-07-17 11:42:20,374] Trial 130 finished with value: -0.23517357646433168 and parameters: {'scalers': 'robust', 'ratios': 'log_ratio', 'imputers': 'mean', 'n_estimators': 2800, 'learning_rate': 0.00010080047507196747, 'max_depth': 12, 'min_child_weight': 9, 'subsample': 0.6, 'colsample_bytree': 0.5, 'colsample_bylevel': 0.5, 'reg_alpha': 18.819667665434753, 'reg_lambda': 2.1132755264251217e-06, 'gamma': 30.29186862589595}. Best is trial 60 with value: -0.24381957873596422.
[I 2026-07-17 11:42:23,538] Trial 131 finished with value: -0.23397705993547055 and parameters: {'scalers': 'robust', 'ratios': 'log_ratio', 'imputers': 'mean', 'n_estimators': 2050, 'learning_rate': 0.00016497262249583536, 'max_depth': 12, 'min_child_weight': 10, 'subsample': 0.6, 'colsample_bytree': 0.5, 'colsample_bylevel': 0.5, 'reg_alpha': 20.130709901859415, 'reg_lambda': 2.67022896075504e-06, 'gamma': 32.21646611188988}. Best is trial 60 with value: -0.24381957873596422.
[I 2026-07-17 11:42:27,833] Trial 132 finished with value: -0.23543161707735152 and parameters: {'scalers': 'robust', 'ratios': 'log_ratio', 'imputers': 'mean', 'n_estimators': 2800, 'learning_rate': 0.00010056753891093705, 'max_depth': 12, 'min_child_weight': 10, 'subsample': 0.6, 'colsample_bytree': 0.5, 'colsample_bylevel': 0.5, 'reg_alpha': 19.957942123005846, 'reg_lambda': 1.715882381049076e-06, 'gamma': 32.562969104760825}. Best is trial 60 with value: -0.24381957873596422.
[I 2026-07-17 11:42:34,335] Trial 133 finished with value: -0.22385477902694265 and parameters: {'scalers': 'robust', 'ratios': 'log_ratio', 'imputers': 'mean', 'n_estimators': 2650, 'learning_rate': 0.0001565408483527886, 'max_depth': 8, 'min_child_weight': 9, 'subsample': 0.5, 'colsample_bytree': 0.9, 'colsample_bylevel': 0.5, 'reg_alpha': 25.297432419928413, 'reg_lambda': 5.634542673638199e-06, 'gamma': 0.021537510059008048}. Best is trial 60 with value: -0.24381957873596422.
[I 2026-07-17 11:42:37,673] Trial 134 finished with value: -0.23703292676925555 and parameters: {'scalers': 'robust', 'ratios': 'log_ratio', 'imputers': 'mean', 'n_estimators': 2050, 'learning_rate': 0.00010253587553461243, 'max_depth': 8, 'min_child_weight': 9, 'subsample': 0.6, 'colsample_bytree': 0.9, 'colsample_bylevel': 0.5, 'reg_alpha': 95.93239598388541, 'reg_lambda': 4.688142819762084e-06, 'gamma': 13.741998115806007}. Best is trial 60 with value: -0.24381957873596422.
