[I 2026-07-17 13:36:57,863] Trial 316 finished with value: -0.1493055582243615 and parameters: {'scalers': 'none', 'ratios': 'log_ratio', 'imputers': 'median', 'n_estimators': 2200, 'learning_rate': 0.4182575044247875, 'max_depth': 12, 'min_child_weight': 8, 'subsample': 0.9, 'colsample_bytree': 0.7, 'colsample_bylevel': 0.5, 'reg_alpha': 0.05246634154574341, 'reg_lambda': 92.66383584257153, 'gamma': 0.0060046166970337675}. Best is trial 247 with value: -2.187508146456044.
[I 2026-07-17 13:37:11,763] Trial 317 finished with value: -0.2912380292315778 and parameters: {'scalers': 'none', 'ratios': 'log_ratio', 'imputers': 'median', 'n_estimators': 2150, 'learning_rate': 0.2660418140811817, 'max_depth': 12, 'min_child_weight': 1, 'subsample': 0.6, 'colsample_bytree': 0.7, 'colsample_bylevel': 0.5, 'reg_alpha': 0.05678958558164894, 'reg_lambda': 93.49131748448119, 'gamma': 0.006161001211116515}. Best is trial 247 with value: -2.187508146456044.
[I 2026-07-17 13:37:29,963] Trial 318 finished with value: -0.6159954982699886 and parameters: {'scalers': 'none', 'ratios': 'log_ratio', 'imputers': 'median', 'n_estimators': 2400, 'learning_rate': 0.42694091825453545, 'max_depth': 12, 'min_child_weight': 1, 'subsample': 0.6, 'colsample_bytree': 0.7, 'colsample_bylevel': 0.5, 'reg_alpha': 0.05304417081897229, 'reg_lambda': 90.91369117109575, 'gamma': 0.005477392278077395}. Best is trial 247 with value: -2.187508146456044.
[I 2026-07-17 13:37:48,437] Trial 319 finished with value: -0.846115933205744 and parameters: {'scalers': 'none', 'ratios': 'log_ratio', 'imputers': 'median', 'n_estimators': 2400, 'learning_rate': 0.49494472973055703, 'max_depth': 12, 'min_child_weight': 1, 'subsample': 0.6, 'colsample_bytree': 0.7, 'colsample_bylevel': 0.5, 'reg_alpha': 0.05075662600247655, 'reg_lambda': 88.88647785766706, 'gamma': 0.006091329448521256}. Best is trial 247 with value: -2.187508146456044.
