[I 2026-07-17 11:36:38,691] Trial 315 finished with value: -0.3857226349059227 and parameters: {'scalers': 'standard', 'ratios': 'log_ratio', 'imputers': 'none', 'n_estimators': 450, 'learning_rate': 0.0002975629190047515, 'max_depth': 5, 'min_child_weight': 6, 'subsample': 0.5, 'colsample_bytree': 0.6, 'colsample_bylevel': 0.6, 'reg_alpha': 90.61438474663858, 'reg_lambda': 1.561351502617277e-06, 'gamma': 15.77563294352352}. Best is trial 272 with value: -0.39109252170181547.
[I 2026-07-17 11:36:39,394] Trial 316 finished with value: -0.3832947048699811 and parameters: {'scalers': 'standard', 'ratios': 'log_ratio', 'imputers': 'none', 'n_estimators': 450, 'learning_rate': 0.0002685458120869318, 'max_depth': 5, 'min_child_weight': 6, 'subsample': 0.5, 'colsample_bytree': 0.6, 'colsample_bylevel': 0.6, 'reg_alpha': 85.84494354138776, 'reg_lambda': 1.573109814470002e-06, 'gamma': 14.992348979629279}. Best is trial 272 with value: -0.39109252170181547.
[I 2026-07-17 11:36:40,090] Trial 317 finished with value: -0.3910958795651097 and parameters: {'scalers': 'standard', 'ratios': 'log_ratio', 'imputers': 'none', 'n_estimators': 450, 'learning_rate': 0.00027345648976434577, 'max_depth': 5, 'min_child_weight': 6, 'subsample': 0.5, 'colsample_bytree': 0.6, 'colsample_bylevel': 0.6, 'reg_alpha': 97.23307357424235, 'reg_lambda': 1.5910843169482286e-06, 'gamma': 37.99254639170452}. Best is trial 317 with value: -0.3910958795651097.
[I 2026-07-17 11:36:40,703] Trial 318 finished with value: -0.3883114283479634 and parameters: {'scalers': 'standard', 'ratios': 'log_ratio', 'imputers': 'none', 'n_estimators': 450, 'learning_rate': 0.00028597457468809966, 'max_depth': 5, 'min_child_weight': 6, 'subsample': 0.5, 'colsample_bytree': 0.6, 'colsample_bylevel': 0.6, 'reg_alpha': 95.42805786204424, 'reg_lambda': 1.7868922151592177e-06, 'gamma': 15.854525509507395}. Best is trial 317 with value: -0.3910958795651097.
[I 2026-07-17 11:36:41,149] Trial 319 finished with value: -0.39109279157151833 and parameters: {'scalers': 'standard', 'ratios': 'log_ratio', 'imputers': 'none', 'n_estimators': 300, 'learning_rate': 0.00028172474140197997, 'max_depth': 5, 'min_child_weight': 6, 'subsample': 0.5, 'colsample_bytree': 0.6, 'colsample_bylevel': 0.6, 'reg_alpha': 96.97342589138064, 'reg_lambda': 1.8538564849435668e-06, 'gamma': 38.61287875127563}. Best is trial 317 with value: -0.3910958795651097.
