[I 2026-07-17 11:29:43,064] A new study created in RDB with name: mult_quant_study_v2
[I 2026-07-17 11:29:51,962] Trial 1 finished with value: -0.19366827457123584 and parameters: {'scalers': 'none', 'ratios': 'norm_ratio', 'imputers': 'median', 'n_estimators': 2750, 'learning_rate': 0.016283177023822086, 'max_depth': 7, 'min_child_weight': 2, 'subsample': 0.7, 'colsample_bytree': 1.0, 'colsample_bylevel': 0.5, 'reg_alpha': 68.8542609564766, 'reg_lambda': 97.36512841320047, 'gamma': 2.9574799789503833e-06}. Best is trial 1 with value: -0.19366827457123584.
[I 2026-07-17 11:30:06,170] Trial 0 finished with value: -0.1568781797825095 and parameters: {'scalers': 'none', 'ratios': 'log_ratio', 'imputers': 'none', 'n_estimators': 3000, 'learning_rate': 0.0010971371254425383, 'max_depth': 6, 'min_child_weight': 5, 'subsample': 0.6, 'colsample_bytree': 0.5, 'colsample_bylevel': 0.7, 'reg_alpha': 2.278241608104346, 'reg_lambda': 0.20682448113110485, 'gamma': 4.5835985622981164e-05}. Best is trial 1 with value: -0.19366827457123584.
[I 2026-07-17 11:30:10,986] Trial 2 finished with value: -0.17656600296596914 and parameters: {'scalers': 'none', 'ratios': 'log_ratio', 'imputers': 'mean', 'n_estimators': 1000, 'learning_rate': 0.0022149702223102064, 'max_depth': 6, 'min_child_weight': 6, 'subsample': 1.0, 'colsample_bytree': 0.7, 'colsample_bylevel': 0.6, 'reg_alpha': 13.438754213478264, 'reg_lambda': 1.8549172136575347e-05, 'gamma': 1.2738377596292553e-06}. Best is trial 1 with value: -0.19366827457123584.
[I 2026-07-17 11:30:12,843] Trial 3 finished with value: -0.1195187815324021 and parameters: {'scalers': 'standard', 'ratios': 'log_ratio', 'imputers': 'none', 'n_estimators': 750, 'learning_rate': 0.07459804802592607, 'max_depth': 11, 'min_child_weight': 8, 'subsample': 0.7, 'colsample_bytree': 0.7, 'colsample_bylevel': 0.7, 'reg_alpha': 27.329518499266154, 'reg_lambda': 73.58747386831979, 'gamma': 3.290185098985748e-06}. Best is trial 1 with value: -0.19366827457123584.
[I 2026-07-17 11:30:17,313] Trial 4 finished with value: -0.32546430023126066 and parameters: {'scalers': 'none', 'ratios': 'log_ratio', 'imputers': 'mean', 'n_estimators': 650, 'learning_rate': 0.0004986755313300104, 'max_depth': 11, 'min_child_weight': 1, 'subsample': 0.9, 'colsample_bytree': 0.8, 'colsample_bylevel': 0.5, 'reg_alpha': 17.26536587615783, 'reg_lambda': 7.27145813750061e-05, 'gamma': 0.007118444216460201}. Best is trial 4 with value: -0.32546430023126066.
[I 2026-07-17 11:30:19,768] Trial 5 finished with value: -0.12035516088833845 and parameters: {'scalers': 'robust', 'ratios': 'norm_ratio', 'imputers': 'mean', 'n_estimators': 900, 'learning_rate': 0.19984750884773642, 'max_depth': 9, 'min_child_weight': 3, 'subsample': 0.5, 'colsample_bytree': 0.7, 'colsample_bylevel': 0.8, 'reg_alpha': 4.029600254382949, 'reg_lambda': 0.03280880740429156, 'gamma': 0.5839883347564325}. Best is trial 4 with value: -0.32546430023126066.
[I 2026-07-17 11:30:21,467] Trial 6 finished with value: -0.3820873549857242 and parameters: {'scalers': 'robust', 'ratios': 'norm_ratio', 'imputers': 'median', 'n_estimators': 300, 'learning_rate': 0.0001176687848410731, 'max_depth': 4, 'min_child_weight': 5, 'subsample': 0.9, 'colsample_bytree': 0.9, 'colsample_bylevel': 1.0, 'reg_alpha': 6.457544787671253e-05, 'reg_lambda': 9.846456420889748, 'gamma': 0.33062638319482185}. Best is trial 6 with value: -0.3820873549857242.
[I 2026-07-17 11:30:26,116] Trial 7 finished with value: -0.2989451003872662 and parameters: {'scalers': 'standard', 'ratios': 'log_ratio', 'imputers': 'none', 'n_estimators': 1850, 'learning_rate': 0.00043786678368748613, 'max_depth': 7, 'min_child_weight': 6, 'subsample': 0.7, 'colsample_bytree': 0.7, 'colsample_bylevel': 0.6, 'reg_alpha': 76.5553782399263, 'reg_lambda': 4.3352006245195126e-06, 'gamma': 0.0005744021564894364}. Best is trial 6 with value: -0.3820873549857242.
[I 2026-07-17 11:30:28,058] Trial 8 finished with value: -0.20075759091121193 and parameters: {'scalers': 'standard', 'ratios': 'log_ratio', 'imputers': 'median', 'n_estimators': 1200, 'learning_rate': 0.13194506546756024, 'max_depth': 9, 'min_child_weight': 10, 'subsample': 0.7, 'colsample_bytree': 0.5, 'colsample_bylevel': 0.9, 'reg_alpha': 94.39276909327012, 'reg_lambda': 66.55011144964793, 'gamma': 0.0040284571784105164}. Best is trial 6 with value: -0.3820873549857242.
[I 2026-07-17 11:30:40,145] Trial 9 finished with value: -0.2092538003417291 and parameters: {'scalers': 'standard', 'ratios': 'norm_ratio', 'imputers': 'mean', 'n_estimators': 2750, 'learning_rate': 0.0005877462721719706, 'max_depth': 5, 'min_child_weight': 7, 'subsample': 0.7, 'colsample_bytree': 0.5, 'colsample_bylevel': 0.8, 'reg_alpha': 0.025389539725474055, 'reg_lambda': 3.1056182168761395, 'gamma': 0.0008705950739175597}. Best is trial 6 with value: -0.3820873549857242.
[I 2026-07-17 11:30:49,845] Trial 10 finished with value: -0.09880729171154934 and parameters: {'scalers': 'none', 'ratios': 'norm_ratio', 'imputers': 'mean', 'n_estimators': 2700, 'learning_rate': 0.00815067467321611, 'max_depth': 4, 'min_child_weight': 3, 'subsample': 0.5, 'colsample_bytree': 0.8, 'colsample_bylevel': 0.6, 'reg_alpha': 0.051861120995602195, 'reg_lambda': 0.0016576204075800806, 'gamma': 0.00010896006140929764}. Best is trial 6 with value: -0.3820873549857242.
[I 2026-07-17 11:31:15,219] Trial 11 finished with value: -0.30326464644640794 and parameters: {'scalers': 'none', 'ratios': 'norm_ratio', 'imputers': 'none', 'n_estimators': 2250, 'learning_rate': 0.00020377910780058434, 'max_depth': 9, 'min_child_weight': 7, 'subsample': 0.8, 'colsample_bytree': 0.6, 'colsample_bylevel': 0.8, 'reg_alpha': 0.00011722171610251445, 'reg_lambda': 0.04628336264712813, 'gamma': 0.00015099027708363662}. Best is trial 6 with value: -0.3820873549857242.
[I 2026-07-17 11:31:20,769] Trial 12 finished with value: -0.19707180415454584 and parameters: {'scalers': 'standard', 'ratios': 'norm_ratio', 'imputers': 'none', 'n_estimators': 650, 'learning_rate': 0.002155363298395477, 'max_depth': 6, 'min_child_weight': 1, 'subsample': 1.0, 'colsample_bytree': 0.9, 'colsample_bylevel': 0.5, 'reg_alpha': 0.000538863811333919, 'reg_lambda': 3.613374424363246e-06, 'gamma': 8.838739614409638e-06}. Best is trial 6 with value: -0.3820873549857242.
[I 2026-07-17 11:32:14,786] Trial 13 finished with value: -0.13309260993329733 and parameters: {'scalers': 'robust', 'ratios': 'log_ratio', 'imputers': 'none', 'n_estimators': 2000, 'learning_rate': 0.11375054273744614, 'max_depth': 11, 'min_child_weight': 3, 'subsample': 1.0, 'colsample_bytree': 0.9, 'colsample_bylevel': 1.0, 'reg_alpha': 0.16166215615557317, 'reg_lambda': 0.0649224594669126, 'gamma': 0.0005982462475503349}. Best is trial 6 with value: -0.3820873549857242.
[I 2026-07-17 11:32:21,810] Trial 15 finished with value: -0.24698789351643433 and parameters: {'scalers': 'standard', 'ratios': 'norm_ratio', 'imputers': 'mean', 'n_estimators': 450, 'learning_rate': 0.06394793742204666, 'max_depth': 4, 'min_child_weight': 4, 'subsample': 0.6, 'colsample_bytree': 1.0, 'colsample_bylevel': 0.5, 'reg_alpha': 56.27223347699255, 'reg_lambda': 75.39458375405133, 'gamma': 13.560215513649602}. Best is trial 6 with value: -0.3820873549857242.
[I 2026-07-17 11:32:22,109] Trial 14 finished with value: -0.11357091953339188 and parameters: {'scalers': 'standard', 'ratios': 'log_ratio', 'imputers': 'mean', 'n_estimators': 1100, 'learning_rate': 0.015490098566393332, 'max_depth': 7, 'min_child_weight': 4, 'subsample': 1.0, 'colsample_bytree': 0.5, 'colsample_bylevel': 0.5, 'reg_alpha': 0.41360452814820814, 'reg_lambda': 0.14474878975122232, 'gamma': 0.0005846573927792085}. Best is trial 6 with value: -0.3820873549857242.
[I 2026-07-17 11:32:38,321] Trial 16 finished with value: -0.11582896277167473 and parameters: {'scalers': 'none', 'ratios': 'norm_ratio', 'imputers': 'mean', 'n_estimators': 1750, 'learning_rate': 0.15568533429973389, 'max_depth': 7, 'min_child_weight': 10, 'subsample': 1.0, 'colsample_bytree': 0.9, 'colsample_bylevel': 0.9, 'reg_alpha': 0.0001242783718284228, 'reg_lambda': 0.015373502679622236, 'gamma': 2.755441934586139e-05}. Best is trial 6 with value: -0.3820873549857242.
[I 2026-07-17 11:32:38,374] Trial 17 finished with value: -0.3892622019666537 and parameters: {'scalers': 'robust', 'ratios': 'norm_ratio', 'imputers': 'median', 'n_estimators': 100, 'learning_rate': 0.00010437942946450276, 'max_depth': 3, 'min_child_weight': 4, 'subsample': 0.9, 'colsample_bytree': 1.0, 'colsample_bylevel': 1.0, 'reg_alpha': 3.5671691881443466e-06, 'reg_lambda': 0.002341836768487479, 'gamma': 44.981165250064606}. Best is trial 17 with value: -0.3892622019666537.
[I 2026-07-17 11:32:39,040] Trial 18 finished with value: -0.38700686900575076 and parameters: {'scalers': 'robust', 'ratios': 'norm_ratio', 'imputers': 'median', 'n_estimators': 150, 'learning_rate': 0.00011333460298597925, 'max_depth': 3, 'min_child_weight': 1, 'subsample': 0.9, 'colsample_bytree': 0.9, 'colsample_bylevel': 1.0, 'reg_alpha': 1.1976493271481807e-06, 'reg_lambda': 0.00023447153101029906, 'gamma': 0.22796846198146697}. Best is trial 17 with value: -0.3892622019666537.
[I 2026-07-17 11:32:39,525] Trial 19 finished with value: -0.3874235166257764 and parameters: {'scalers': 'robust', 'ratios': 'log_ratio', 'imputers': 'median', 'n_estimators': 150, 'learning_rate': 0.00010172572193870832, 'max_depth': 3, 'min_child_weight': 1, 'subsample': 1.0, 'colsample_bytree': 0.9, 'colsample_bylevel': 1.0, 'reg_alpha': 3.245943362384063e-06, 'reg_lambda': 0.001078601635059038, 'gamma': 0.20395910622016034}. Best is trial 17 with value: -0.3892622019666537.
[I 2026-07-17 11:32:40,201] Trial 20 finished with value: -0.3874037234798202 and parameters: {'scalers': 'robust', 'ratios': 'log_ratio', 'imputers': 'median', 'n_estimators': 150, 'learning_rate': 0.00010218947919316739, 'max_depth': 3, 'min_child_weight': 4, 'subsample': 0.9, 'colsample_bytree': 0.9, 'colsample_bylevel': 1.0, 'reg_alpha': 5.279457055483512e-06, 'reg_lambda': 0.0003578043438245756, 'gamma': 0.18539029614472008}. Best is trial 17 with value: -0.3892622019666537.
[I 2026-07-17 11:32:40,854] Trial 21 finished with value: -0.38499331492216227 and parameters: {'scalers': 'robust', 'ratios': 'log_ratio', 'imputers': 'median', 'n_estimators': 150, 'learning_rate': 0.00017005881994642405, 'max_depth': 3, 'min_child_weight': 1, 'subsample': 0.9, 'colsample_bytree': 0.9, 'colsample_bylevel': 1.0, 'reg_alpha': 1.7576798107331618e-06, 'reg_lambda': 0.0002792809032395993, 'gamma': 0.1661347150340966}. Best is trial 17 with value: -0.3892622019666537.
[I 2026-07-17 11:32:41,187] Trial 22 finished with value: -0.387543282006183 and parameters: {'scalers': 'robust', 'ratios': 'log_ratio', 'imputers': 'median', 'n_estimators': 100, 'learning_rate': 0.00014642192926129426, 'max_depth': 3, 'min_child_weight': 10, 'subsample': 0.9, 'colsample_bytree': 0.9, 'colsample_bylevel': 1.0, 'reg_alpha': 2.2006131117954355e-06, 'reg_lambda': 0.00014660385103963197, 'gamma': 0.061614163760281386}. Best is trial 17 with value: -0.3892622019666537.
[I 2026-07-17 11:32:42,021] Trial 23 finished with value: -0.38771887692523027 and parameters: {'scalers': 'robust', 'ratios': 'norm_ratio', 'imputers': 'median', 'n_estimators': 100, 'learning_rate': 0.00013966501856890704, 'max_depth': 3, 'min_child_weight': 1, 'subsample': 0.9, 'colsample_bytree': 0.9, 'colsample_bylevel': 1.0, 'reg_alpha': 1.232399098397144e-06, 'reg_lambda': 0.0001839270340970825, 'gamma': 0.04187332323438198}. Best is trial 17 with value: -0.3892622019666537.
[I 2026-07-17 11:32:42,062] Trial 24 finished with value: -0.38914463243405645 and parameters: {'scalers': 'robust', 'ratios': 'norm_ratio', 'imputers': 'median', 'n_estimators': 150, 'learning_rate': 0.0001113933993630905, 'max_depth': 3, 'min_child_weight': 5, 'subsample': 0.9, 'colsample_bytree': 1.0, 'colsample_bylevel': 1.0, 'reg_alpha': 1.138422069980986e-06, 'reg_lambda': 0.0009051246088627159, 'gamma': 92.14895048962597}. Best is trial 17 with value: -0.3892622019666537.
[I 2026-07-17 11:32:42,647] Trial 25 finished with value: -0.387945918508048 and parameters: {'scalers': 'robust', 'ratios': 'norm_ratio', 'imputers': 'median', 'n_estimators': 150, 'learning_rate': 0.00012065720084822753, 'max_depth': 3, 'min_child_weight': 5, 'subsample': 0.9, 'colsample_bytree': 1.0, 'colsample_bylevel': 1.0, 'reg_alpha': 1.2720986697701876e-06, 'reg_lambda': 0.0010777545456998785, 'gamma': 57.410149034392205}. Best is trial 17 with value: -0.3892622019666537.
[I 2026-07-17 11:32:43,012] Trial 26 finished with value: -0.3885870982237936 and parameters: {'scalers': 'robust', 'ratios': 'norm_ratio', 'imputers': 'median', 'n_estimators': 150, 'learning_rate': 0.00011757907301499975, 'max_depth': 3, 'min_child_weight': 2, 'subsample': 0.9, 'colsample_bytree': 1.0, 'colsample_bylevel': 1.0, 'reg_alpha': 1.558023551680426e-06, 'reg_lambda': 0.0006204513416281646, 'gamma': 85.11750335346268}. Best is trial 17 with value: -0.3892622019666537.
[I 2026-07-17 11:32:43,189] Trial 27 finished with value: -0.38852907870085374 and parameters: {'scalers': 'robust', 'ratios': 'log_ratio', 'imputers': 'median', 'n_estimators': 100, 'learning_rate': 0.00020619951401402048, 'max_depth': 3, 'min_child_weight': 2, 'subsample': 0.8, 'colsample_bytree': 1.0, 'colsample_bylevel': 0.9, 'reg_alpha': 1.554084879382783e-06, 'reg_lambda': 0.0019628470565330575, 'gamma': 80.25472855022579}. Best is trial 17 with value: -0.3892622019666537.
[I 2026-07-17 11:32:43,608] Trial 28 finished with value: -0.38667911283555434 and parameters: {'scalers': 'robust', 'ratios': 'log_ratio', 'imputers': 'median', 'n_estimators': 100, 'learning_rate': 0.0002503148878197899, 'max_depth': 3, 'min_child_weight': 2, 'subsample': 0.9, 'colsample_bytree': 1.0, 'colsample_bylevel': 0.9, 'reg_alpha': 1.29355467772482e-06, 'reg_lambda': 0.0009809303955217196, 'gamma': 32.07687991738913}. Best is trial 17 with value: -0.3892622019666537.
[I 2026-07-17 11:32:44,708] Trial 29 finished with value: -0.3781515082087412 and parameters: {'scalers': 'robust', 'ratios': 'log_ratio', 'imputers': 'median', 'n_estimators': 450, 'learning_rate': 0.00021241717211186107, 'max_depth': 3, 'min_child_weight': 4, 'subsample': 0.8, 'colsample_bytree': 1.0, 'colsample_bylevel': 0.9, 'reg_alpha': 9.637346398303185e-06, 'reg_lambda': 0.002637853211284603, 'gamma': 74.50352053564472}. Best is trial 17 with value: -0.3892622019666537.
[I 2026-07-17 11:32:45,919] Trial 30 finished with value: -0.370475145704505 and parameters: {'scalers': 'robust', 'ratios': 'log_ratio', 'imputers': 'median', 'n_estimators': 450, 'learning_rate': 0.0003307828438573626, 'max_depth': 4, 'min_child_weight': 9, 'subsample': 0.8, 'colsample_bytree': 1.0, 'colsample_bylevel': 0.9, 'reg_alpha': 1.3831859483068367e-05, 'reg_lambda': 0.003518143020073045, 'gamma': 70.39652473971043}. Best is trial 17 with value: -0.3892622019666537.
[I 2026-07-17 11:32:46,940] Trial 31 finished with value: -0.378856437539415 and parameters: {'scalers': 'robust', 'ratios': 'norm_ratio', 'imputers': 'median', 'n_estimators': 400, 'learning_rate': 0.0002898722856536518, 'max_depth': 5, 'min_child_weight': 5, 'subsample': 0.8, 'colsample_bytree': 1.0, 'colsample_bylevel': 0.9, 'reg_alpha': 1.5010329892251796e-05, 'reg_lambda': 0.0045011112470473786, 'gamma': 89.6933339333761}. Best is trial 17 with value: -0.3892622019666537.
[I 2026-07-17 11:32:48,198] Trial 32 finished with value: -0.3698600746602861 and parameters: {'scalers': 'robust', 'ratios': 'norm_ratio', 'imputers': 'median', 'n_estimators': 450, 'learning_rate': 0.0002922545721539696, 'max_depth': 5, 'min_child_weight': 2, 'subsample': 0.8, 'colsample_bytree': 1.0, 'colsample_bylevel': 0.9, 'reg_alpha': 1.0672809717329857e-05, 'reg_lambda': 0.008325761941241067, 'gamma': 42.52260387955433}. Best is trial 17 with value: -0.3892622019666537.
[I 2026-07-17 11:32:49,306] Trial 33 finished with value: -0.3761830136774878 and parameters: {'scalers': 'robust', 'ratios': 'norm_ratio', 'imputers': 'median', 'n_estimators': 450, 'learning_rate': 0.00031021033124459756, 'max_depth': 5, 'min_child_weight': 5, 'subsample': 0.8, 'colsample_bytree': 1.0, 'colsample_bylevel': 0.9, 'reg_alpha': 2.523100178946261e-05, 'reg_lambda': 0.0051532213847991365, 'gamma': 86.94040729130124}. Best is trial 17 with value: -0.3892622019666537.
[I 2026-07-17 11:32:51,769] Trial 34 finished with value: -0.35830283257457507 and parameters: {'scalers': 'robust', 'ratios': 'norm_ratio', 'imputers': 'median', 'n_estimators': 450, 'learning_rate': 0.00030071053622407034, 'max_depth': 5, 'min_child_weight': 2, 'subsample': 0.8, 'colsample_bytree': 1.0, 'colsample_bylevel': 0.9, 'reg_alpha': 1.7694872867525035e-05, 'reg_lambda': 0.006165680697532836, 'gamma': 3.474217809422052}. Best is trial 17 with value: -0.3892622019666537.
[I 2026-07-17 11:32:54,108] Trial 35 finished with value: -0.3549532684656157 and parameters: {'scalers': 'robust', 'ratios': 'norm_ratio', 'imputers': 'median', 'n_estimators': 450, 'learning_rate': 0.0003404410446384872, 'max_depth': 5, 'min_child_weight': 2, 'subsample': 0.8, 'colsample_bytree': 1.0, 'colsample_bylevel': 0.9, 'reg_alpha': 1.8084239592203236e-05, 'reg_lambda': 0.009226548877093297, 'gamma': 4.669338055545439}. Best is trial 17 with value: -0.3892622019666537.
[I 2026-07-17 11:32:56,269] Trial 36 finished with value: -0.30966926578270615 and parameters: {'scalers': 'robust', 'ratios': 'norm_ratio', 'imputers': 'median', 'n_estimators': 450, 'learning_rate': 0.0008931376779394263, 'max_depth': 5, 'min_child_weight': 6, 'subsample': 0.8, 'colsample_bytree': 1.0, 'colsample_bylevel': 0.9, 'reg_alpha': 1.6130397415254635e-05, 'reg_lambda': 0.010493221465530968, 'gamma': 5.241612007682341}. Best is trial 17 with value: -0.3892622019666537.
[I 2026-07-17 11:32:58,209] Trial 37 finished with value: -0.3025234187321058 and parameters: {'scalers': 'robust', 'ratios': 'norm_ratio', 'imputers': 'median', 'n_estimators': 450, 'learning_rate': 0.0010787457899671417, 'max_depth': 5, 'min_child_weight': 5, 'subsample': 0.8, 'colsample_bytree': 0.8, 'colsample_bylevel': 0.9, 'reg_alpha': 1.885818661698156e-05, 'reg_lambda': 0.008898943042781939, 'gamma': 4.594448579066904}. Best is trial 17 with value: -0.3892622019666537.
[I 2026-07-17 11:33:00,297] Trial 38 finished with value: -0.305330504196416 and parameters: {'scalers': 'robust', 'ratios': 'norm_ratio', 'imputers': 'median', 'n_estimators': 400, 'learning_rate': 0.0010669158038138767, 'max_depth': 5, 'min_child_weight': 2, 'subsample': 0.8, 'colsample_bytree': 1.0, 'colsample_bylevel': 0.9, 'reg_alpha': 1.8849768569488327e-05, 'reg_lambda': 0.007302736102589924, 'gamma': 4.930932403338808}. Best is trial 17 with value: -0.3892622019666537.
[I 2026-07-17 11:33:03,157] Trial 39 finished with value: -0.28280035507287193 and parameters: {'scalers': 'robust', 'ratios': 'norm_ratio', 'imputers': 'median', 'n_estimators': 550, 'learning_rate': 0.001060105453080241, 'max_depth': 5, 'min_child_weight': 2, 'subsample': 0.8, 'colsample_bytree': 1.0, 'colsample_bylevel': 0.9, 'reg_alpha': 2.7353108064915622e-05, 'reg_lambda': 0.0163306725118998, 'gamma': 4.563200378962642}. Best is trial 17 with value: -0.3892622019666537.
[I 2026-07-17 11:33:07,865] Trial 40 finished with value: -0.2268227410849674 and parameters: {'scalers': 'robust', 'ratios': 'norm_ratio', 'imputers': 'median', 'n_estimators': 1350, 'learning_rate': 0.0009797104972294824, 'max_depth': 4, 'min_child_weight': 3, 'subsample': 0.8, 'colsample_bytree': 1.0, 'colsample_bylevel': 0.8, 'reg_alpha': 2.831999487489166e-05, 'reg_lambda': 6.371143351151206e-05, 'gamma': 7.006837848207219}. Best is trial 17 with value: -0.3892622019666537.
[I 2026-07-17 11:33:10,444] Trial 41 finished with value: -0.28540546952352297 and parameters: {'scalers': 'robust', 'ratios': 'norm_ratio', 'imputers': 'median', 'n_estimators': 750, 'learning_rate': 0.0008630114988720697, 'max_depth': 4, 'min_child_weight': 3, 'subsample': 0.8, 'colsample_bytree': 0.8, 'colsample_bylevel': 0.8, 'reg_alpha': 0.0005640173508983911, 'reg_lambda': 4.5922250242896505e-05, 'gamma': 5.419021729787089}. Best is trial 17 with value: -0.3892622019666537.
[I 2026-07-17 11:33:12,829] Trial 42 finished with value: -0.27647131147183984 and parameters: {'scalers': 'robust', 'ratios': 'norm_ratio', 'imputers': 'median', 'n_estimators': 750, 'learning_rate': 0.0010464356641241258, 'max_depth': 4, 'min_child_weight': 3, 'subsample': 0.8, 'colsample_bytree': 0.8, 'colsample_bylevel': 0.8, 'reg_alpha': 0.0005142829056199431, 'reg_lambda': 3.415792146168277e-05, 'gamma': 8.065335184345814}. Best is trial 17 with value: -0.3892622019666537.
[I 2026-07-17 11:33:15,259] Trial 43 finished with value: -0.27484319293258197 and parameters: {'scalers': 'robust', 'ratios': 'norm_ratio', 'imputers': 'median', 'n_estimators': 750, 'learning_rate': 0.0010870357723539838, 'max_depth': 4, 'min_child_weight': 3, 'subsample': 0.9, 'colsample_bytree': 0.8, 'colsample_bylevel': 0.8, 'reg_alpha': 0.001168369742811467, 'reg_lambda': 3.3341658427275706e-05, 'gamma': 9.53272838590434}. Best is trial 17 with value: -0.3892622019666537.
[I 2026-07-17 11:33:18,581] Trial 44 finished with value: -0.2542507441097268 and parameters: {'scalers': 'robust', 'ratios': 'norm_ratio', 'imputers': 'median', 'n_estimators': 850, 'learning_rate': 0.0010272838387885511, 'max_depth': 4, 'min_child_weight': 3, 'subsample': 0.9, 'colsample_bytree': 0.8, 'colsample_bylevel': 0.8, 'reg_alpha': 0.0004084588599625568, 'reg_lambda': 2.2049436795751117e-05, 'gamma': 1.5512296091324846}. Best is trial 17 with value: -0.3892622019666537.
