[I 2026-07-17 12:07:29,063] A new study created in RDB with name: residual_study_v2
[I 2026-07-17 12:07:44,656] Trial 1 finished with value: -0.07923282032572379 and parameters: {'scalers': 'standard', 'ratios': 'norm_ratio', 'imputers': 'mean', 'n_estimators': 1050, 'learning_rate': 0.010816667878218169, 'max_depth': 12, 'min_child_weight': 7, 'subsample': 0.8, 'colsample_bytree': 0.5, 'colsample_bylevel': 1.0, 'reg_alpha': 5.231637415470405e-06, 'reg_lambda': 4.5438919090574746e-05, 'gamma': 0.001597060832737645}. Best is trial 1 with value: -0.07923282032572379.
[I 2026-07-17 12:07:59,441] Trial 0 finished with value: -0.06625205753312444 and parameters: {'scalers': 'standard', 'ratios': 'norm_ratio', 'imputers': 'median', 'n_estimators': 1900, 'learning_rate': 0.0073771577214531234, 'max_depth': 8, 'min_child_weight': 3, 'subsample': 0.8, 'colsample_bytree': 1.0, 'colsample_bylevel': 1.0, 'reg_alpha': 0.008865178464056277, 'reg_lambda': 3.9423038498047434e-05, 'gamma': 1.2390726988254078e-05}. Best is trial 1 with value: -0.07923282032572379.
[I 2026-07-17 12:08:02,067] Trial 2 finished with value: -0.05646387459172938 and parameters: {'scalers': 'robust', 'ratios': 'log_ratio', 'imputers': 'median', 'n_estimators': 1550, 'learning_rate': 0.0050247186719976815, 'max_depth': 6, 'min_child_weight': 8, 'subsample': 1.0, 'colsample_bytree': 0.5, 'colsample_bylevel': 0.6, 'reg_alpha': 0.0003521893367864711, 'reg_lambda': 0.287683136237456, 'gamma': 0.08908457038922504}. Best is trial 1 with value: -0.07923282032572379.
[I 2026-07-17 12:08:04,035] Trial 3 finished with value: -0.05831861572129211 and parameters: {'scalers': 'none', 'ratios': 'norm_ratio', 'imputers': 'median', 'n_estimators': 1600, 'learning_rate': 0.10193919059374641, 'max_depth': 5, 'min_child_weight': 9, 'subsample': 0.9, 'colsample_bytree': 0.5, 'colsample_bylevel': 0.9, 'reg_alpha': 3.0884654441532704, 'reg_lambda': 3.122675160806906e-06, 'gamma': 1.2026054377954938}. Best is trial 1 with value: -0.07923282032572379.
[I 2026-07-17 12:08:10,603] Trial 4 finished with value: -0.058171216645085344 and parameters: {'scalers': 'none', 'ratios': 'log_ratio', 'imputers': 'none', 'n_estimators': 2200, 'learning_rate': 0.004154198705151387, 'max_depth': 12, 'min_child_weight': 9, 'subsample': 0.6, 'colsample_bytree': 0.6, 'colsample_bylevel': 0.9, 'reg_alpha': 7.015497851083318, 'reg_lambda': 5.615838277219463, 'gamma': 1.912608274855372e-06}. Best is trial 1 with value: -0.07923282032572379.
[I 2026-07-17 12:08:11,746] Trial 5 finished with value: -0.05789767181552948 and parameters: {'scalers': 'robust', 'ratios': 'log_ratio', 'imputers': 'median', 'n_estimators': 1250, 'learning_rate': 0.07484971048110749, 'max_depth': 3, 'min_child_weight': 6, 'subsample': 0.6, 'colsample_bytree': 0.9, 'colsample_bylevel': 0.8, 'reg_alpha': 2.3569033194096876, 'reg_lambda': 0.3831140764630355, 'gamma': 0.09818795774967375}. Best is trial 1 with value: -0.07923282032572379.
[I 2026-07-17 12:08:14,607] Trial 6 finished with value: -0.05829821238170167 and parameters: {'scalers': 'none', 'ratios': 'norm_ratio', 'imputers': 'median', 'n_estimators': 2300, 'learning_rate': 0.3229563216590062, 'max_depth': 8, 'min_child_weight': 1, 'subsample': 1.0, 'colsample_bytree': 0.6, 'colsample_bylevel': 0.6, 'reg_alpha': 8.699655845315288e-05, 'reg_lambda': 1.4222389336690151e-05, 'gamma': 0.7000696920124296}. Best is trial 1 with value: -0.07923282032572379.
[I 2026-07-17 12:08:16,058] Trial 7 finished with value: -0.0581166325017676 and parameters: {'scalers': 'none', 'ratios': 'log_ratio', 'imputers': 'none', 'n_estimators': 700, 'learning_rate': 0.00011154332735269867, 'max_depth': 3, 'min_child_weight': 2, 'subsample': 0.7, 'colsample_bytree': 0.8, 'colsample_bylevel': 0.6, 'reg_alpha': 2.422645259976654e-06, 'reg_lambda': 5.2806858920922304e-05, 'gamma': 0.0053263772465238215}. Best is trial 1 with value: -0.07923282032572379.
[I 2026-07-17 12:08:26,555] Trial 8 finished with value: -0.057360922246392006 and parameters: {'scalers': 'robust', 'ratios': 'log_ratio', 'imputers': 'mean', 'n_estimators': 1750, 'learning_rate': 0.0002323138075464849, 'max_depth': 6, 'min_child_weight': 8, 'subsample': 0.7, 'colsample_bytree': 1.0, 'colsample_bylevel': 0.8, 'reg_alpha': 1.8796922251455443, 'reg_lambda': 0.002984660420815568, 'gamma': 1.5822542214274136e-05}. Best is trial 1 with value: -0.07923282032572379.
[I 2026-07-17 12:08:29,040] Trial 9 finished with value: -0.05829868136353422 and parameters: {'scalers': 'standard', 'ratios': 'log_ratio', 'imputers': 'mean', 'n_estimators': 1950, 'learning_rate': 0.07409415695416324, 'max_depth': 10, 'min_child_weight': 9, 'subsample': 0.9, 'colsample_bytree': 1.0, 'colsample_bylevel': 0.7, 'reg_alpha': 0.11510318800668741, 'reg_lambda': 0.004508185074525414, 'gamma': 19.47527003551784}. Best is trial 1 with value: -0.07923282032572379.
[I 2026-07-17 12:08:32,430] Trial 10 finished with value: -0.05829821238170167 and parameters: {'scalers': 'robust', 'ratios': 'norm_ratio', 'imputers': 'median', 'n_estimators': 2800, 'learning_rate': 0.2100480964231614, 'max_depth': 8, 'min_child_weight': 7, 'subsample': 1.0, 'colsample_bytree': 0.5, 'colsample_bylevel': 0.8, 'reg_alpha': 4.866353811876689e-06, 'reg_lambda': 83.98058730390305, 'gamma': 1.1839990142212657}. Best is trial 1 with value: -0.07923282032572379.
[I 2026-07-17 12:08:53,255] Trial 11 finished with value: -0.07015257215022803 and parameters: {'scalers': 'standard', 'ratios': 'log_ratio', 'imputers': 'mean', 'n_estimators': 2250, 'learning_rate': 0.006206973624477308, 'max_depth': 9, 'min_child_weight': 1, 'subsample': 0.9, 'colsample_bytree': 0.7, 'colsample_bylevel': 1.0, 'reg_alpha': 0.0020649751883096024, 'reg_lambda': 4.801421390729269e-06, 'gamma': 0.0009148360882343334}. Best is trial 1 with value: -0.07923282032572379.
[I 2026-07-17 12:09:12,378] Trial 12 finished with value: -0.05854682447437813 and parameters: {'scalers': 'standard', 'ratios': 'log_ratio', 'imputers': 'median', 'n_estimators': 2800, 'learning_rate': 0.0007649866670809517, 'max_depth': 9, 'min_child_weight': 3, 'subsample': 0.8, 'colsample_bytree': 0.5, 'colsample_bylevel': 0.9, 'reg_alpha': 0.024740609003488775, 'reg_lambda': 8.111006801532365e-05, 'gamma': 3.078510165017269e-05}. Best is trial 1 with value: -0.07923282032572379.
[I 2026-07-17 12:09:13,049] Trial 13 finished with value: -0.05830970307177979 and parameters: {'scalers': 'none', 'ratios': 'norm_ratio', 'imputers': 'median', 'n_estimators': 1250, 'learning_rate': 0.05488210987264418, 'max_depth': 5, 'min_child_weight': 10, 'subsample': 0.8, 'colsample_bytree': 0.5, 'colsample_bylevel': 0.9, 'reg_alpha': 0.004192261758838038, 'reg_lambda': 43.247158339230836, 'gamma': 0.8218373100093327}. Best is trial 1 with value: -0.07923282032572379.
[I 2026-07-17 12:09:16,279] Trial 14 finished with value: -0.055869052521256304 and parameters: {'scalers': 'standard', 'ratios': 'log_ratio', 'imputers': 'none', 'n_estimators': 1500, 'learning_rate': 0.003038430144112804, 'max_depth': 3, 'min_child_weight': 1, 'subsample': 1.0, 'colsample_bytree': 1.0, 'colsample_bylevel': 0.5, 'reg_alpha': 1.129133908469894e-05, 'reg_lambda': 0.05118979213265236, 'gamma': 0.002289318788134159}. Best is trial 1 with value: -0.07923282032572379.
[I 2026-07-17 12:09:17,748] Trial 15 finished with value: -0.05810696852302856 and parameters: {'scalers': 'none', 'ratios': 'norm_ratio', 'imputers': 'median', 'n_estimators': 100, 'learning_rate': 0.0006935992384321409, 'max_depth': 10, 'min_child_weight': 6, 'subsample': 0.9, 'colsample_bytree': 1.0, 'colsample_bylevel': 1.0, 'reg_alpha': 0.8682212792722688, 'reg_lambda': 12.01627336892171, 'gamma': 3.814830656468073e-05}. Best is trial 1 with value: -0.07923282032572379.
[I 2026-07-17 12:09:19,465] Trial 16 finished with value: -0.05828714949773298 and parameters: {'scalers': 'none', 'ratios': 'log_ratio', 'imputers': 'none', 'n_estimators': 1650, 'learning_rate': 0.06041316259155202, 'max_depth': 4, 'min_child_weight': 4, 'subsample': 0.6, 'colsample_bytree': 0.6, 'colsample_bylevel': 0.5, 'reg_alpha': 1.8760564372748422e-05, 'reg_lambda': 0.003988497066130881, 'gamma': 0.7520287095186686}. Best is trial 1 with value: -0.07923282032572379.
[I 2026-07-17 12:09:33,451] Trial 17 finished with value: -0.05882792940759724 and parameters: {'scalers': 'standard', 'ratios': 'norm_ratio', 'imputers': 'mean', 'n_estimators': 2850, 'learning_rate': 0.0005122332618559028, 'max_depth': 12, 'min_child_weight': 5, 'subsample': 0.5, 'colsample_bytree': 0.7, 'colsample_bylevel': 0.5, 'reg_alpha': 1.1096010258826765e-06, 'reg_lambda': 24.237562987802285, 'gamma': 0.0005190557712657387}. Best is trial 1 with value: -0.07923282032572379.
[I 2026-07-17 12:09:40,108] Trial 18 finished with value: -0.06450151942991823 and parameters: {'scalers': 'standard', 'ratios': 'norm_ratio', 'imputers': 'mean', 'n_estimators': 450, 'learning_rate': 0.008134539378445873, 'max_depth': 12, 'min_child_weight': 4, 'subsample': 0.8, 'colsample_bytree': 0.8, 'colsample_bylevel': 1.0, 'reg_alpha': 0.010143412289330562, 'reg_lambda': 0.0001817503136715775, 'gamma': 0.0002540918272525286}. Best is trial 1 with value: -0.07923282032572379.
[I 2026-07-17 12:09:42,008] Trial 19 finished with value: -0.061779589843785974 and parameters: {'scalers': 'standard', 'ratios': 'norm_ratio', 'imputers': 'mean', 'n_estimators': 150, 'learning_rate': 0.018653847299163605, 'max_depth': 12, 'min_child_weight': 4, 'subsample': 0.8, 'colsample_bytree': 0.7, 'colsample_bylevel': 1.0, 'reg_alpha': 0.0009702721152947778, 'reg_lambda': 0.0009375033558339861, 'gamma': 0.0007467305168361093}. Best is trial 1 with value: -0.07923282032572379.
[I 2026-07-17 12:09:42,699] Trial 20 finished with value: -0.05939738183570693 and parameters: {'scalers': 'standard', 'ratios': 'norm_ratio', 'imputers': 'mean', 'n_estimators': 100, 'learning_rate': 0.01830949296065577, 'max_depth': 12, 'min_child_weight': 5, 'subsample': 0.8, 'colsample_bytree': 0.7, 'colsample_bylevel': 1.0, 'reg_alpha': 0.0004090886260550697, 'reg_lambda': 0.001382580479326851, 'gamma': 0.0011685027824875464}. Best is trial 1 with value: -0.07923282032572379.
[I 2026-07-17 12:09:46,166] Trial 21 finished with value: -0.07011224692720032 and parameters: {'scalers': 'standard', 'ratios': 'norm_ratio', 'imputers': 'mean', 'n_estimators': 350, 'learning_rate': 0.015668508110386663, 'max_depth': 12, 'min_child_weight': 5, 'subsample': 0.5, 'colsample_bytree': 0.7, 'colsample_bylevel': 1.0, 'reg_alpha': 4.55280920523246e-05, 'reg_lambda': 0.0010151240630215394, 'gamma': 0.0007009449733216138}. Best is trial 1 with value: -0.07923282032572379.
[I 2026-07-17 12:09:47,110] Trial 22 finished with value: -0.059641984348620336 and parameters: {'scalers': 'standard', 'ratios': 'norm_ratio', 'imputers': 'mean', 'n_estimators': 100, 'learning_rate': 0.014514818643084751, 'max_depth': 12, 'min_child_weight': 5, 'subsample': 0.5, 'colsample_bytree': 0.7, 'colsample_bylevel': 1.0, 'reg_alpha': 0.0004167925856089326, 'reg_lambda': 1.133180505739804e-06, 'gamma': 0.0010520745587739276}. Best is trial 1 with value: -0.07923282032572379.
[I 2026-07-17 12:09:47,847] Trial 23 finished with value: -0.05829257780865187 and parameters: {'scalers': 'standard', 'ratios': 'norm_ratio', 'imputers': 'mean', 'n_estimators': 700, 'learning_rate': 0.0248939041219403, 'max_depth': 12, 'min_child_weight': 4, 'subsample': 0.7, 'colsample_bytree': 0.7, 'colsample_bylevel': 1.0, 'reg_alpha': 60.7274978707037, 'reg_lambda': 1.49015472846024e-06, 'gamma': 0.0005913684794767542}. Best is trial 1 with value: -0.07923282032572379.
[I 2026-07-17 12:09:48,766] Trial 24 finished with value: -0.05830534834879093 and parameters: {'scalers': 'standard', 'ratios': 'norm_ratio', 'imputers': 'mean', 'n_estimators': 750, 'learning_rate': 0.015541321312834021, 'max_depth': 12, 'min_child_weight': 5, 'subsample': 0.7, 'colsample_bytree': 0.7, 'colsample_bylevel': 1.0, 'reg_alpha': 92.8080073177254, 'reg_lambda': 1.1445434698188331e-06, 'gamma': 0.0007839549323135678}. Best is trial 1 with value: -0.07923282032572379.
[I 2026-07-17 12:09:58,120] Trial 25 finished with value: -0.08121640044757476 and parameters: {'scalers': 'standard', 'ratios': 'norm_ratio', 'imputers': 'mean', 'n_estimators': 800, 'learning_rate': 0.017084614890673925, 'max_depth': 11, 'min_child_weight': 4, 'subsample': 0.7, 'colsample_bytree': 0.7, 'colsample_bylevel': 1.0, 'reg_alpha': 0.0005124574208596833, 'reg_lambda': 1.5223477514332827e-06, 'gamma': 0.0004339997731723438}. Best is trial 25 with value: -0.08121640044757476.
[I 2026-07-17 12:10:07,762] Trial 26 finished with value: -0.07971305276500346 and parameters: {'scalers': 'standard', 'ratios': 'norm_ratio', 'imputers': 'mean', 'n_estimators': 850, 'learning_rate': 0.01541686854027421, 'max_depth': 11, 'min_child_weight': 5, 'subsample': 0.7, 'colsample_bytree': 0.7, 'colsample_bylevel': 1.0, 'reg_alpha': 0.0006078265077635622, 'reg_lambda': 1.0317167435260416e-06, 'gamma': 0.013703744773441806}. Best is trial 25 with value: -0.08121640044757476.
[I 2026-07-17 12:10:08,555] Trial 27 finished with value: -0.05829912007048178 and parameters: {'scalers': 'standard', 'ratios': 'norm_ratio', 'imputers': 'mean', 'n_estimators': 800, 'learning_rate': 0.022321364274442115, 'max_depth': 10, 'min_child_weight': 6, 'subsample': 0.7, 'colsample_bytree': 0.7, 'colsample_bylevel': 1.0, 'reg_alpha': 41.41022303994765, 'reg_lambda': 1.3640754355665873e-06, 'gamma': 0.00788992499988312}. Best is trial 25 with value: -0.08121640044757476.
[I 2026-07-17 12:10:44,262] Trial 29 finished with value: -0.05829749964942721 and parameters: {'scalers': 'standard', 'ratios': 'norm_ratio', 'imputers': 'mean', 'n_estimators': 750, 'learning_rate': 0.001872966903815013, 'max_depth': 10, 'min_child_weight': 7, 'subsample': 0.5, 'colsample_bytree': 0.8, 'colsample_bylevel': 0.9, 'reg_alpha': 52.63010674438682, 'reg_lambda': 1.0209703945930607e-06, 'gamma': 0.015676105556388892}. Best is trial 25 with value: -0.08121640044757476.
[I 2026-07-17 12:10:45,390] Trial 28 finished with value: -0.06354590621367728 and parameters: {'scalers': 'standard', 'ratios': 'norm_ratio', 'imputers': 'mean', 'n_estimators': 2450, 'learning_rate': 0.0016758500422347188, 'max_depth': 10, 'min_child_weight': 2, 'subsample': 0.9, 'colsample_bytree': 0.9, 'colsample_bylevel': 1.0, 'reg_alpha': 0.14091421728708237, 'reg_lambda': 2.7228932874451833e-06, 'gamma': 0.01310851746830449}. Best is trial 25 with value: -0.08121640044757476.
[I 2026-07-17 12:10:52,556] Trial 30 finished with value: -0.05836371224867918 and parameters: {'scalers': 'standard', 'ratios': 'norm_ratio', 'imputers': 'mean', 'n_estimators': 850, 'learning_rate': 0.00212747924429533, 'max_depth': 10, 'min_child_weight': 7, 'subsample': 0.7, 'colsample_bytree': 0.8, 'colsample_bylevel': 0.9, 'reg_alpha': 8.332595221380609e-05, 'reg_lambda': 9.375764660143741e-06, 'gamma': 0.008787703122320557}. Best is trial 25 with value: -0.08121640044757476.
[I 2026-07-17 12:11:01,485] Trial 31 finished with value: -0.05787287788370315 and parameters: {'scalers': 'standard', 'ratios': 'norm_ratio', 'imputers': 'mean', 'n_estimators': 950, 'learning_rate': 0.0017287614570736663, 'max_depth': 10, 'min_child_weight': 7, 'subsample': 0.9, 'colsample_bytree': 0.8, 'colsample_bylevel': 0.9, 'reg_alpha': 4.5978609943449846e-05, 'reg_lambda': 1.0367145710346515e-05, 'gamma': 0.012774769086386173}. Best is trial 25 with value: -0.08121640044757476.
[I 2026-07-17 12:11:10,746] Trial 32 finished with value: -0.05819670892286026 and parameters: {'scalers': 'standard', 'ratios': 'norm_ratio', 'imputers': 'mean', 'n_estimators': 1050, 'learning_rate': 0.0020146212123192896, 'max_depth': 10, 'min_child_weight': 7, 'subsample': 0.9, 'colsample_bytree': 0.8, 'colsample_bylevel': 0.9, 'reg_alpha': 3.4431077937247404e-05, 'reg_lambda': 0.0003560289145232774, 'gamma': 0.022136126118423825}. Best is trial 25 with value: -0.08121640044757476.
[I 2026-07-17 12:11:23,410] Trial 33 finished with value: -0.06002397591323008 and parameters: {'scalers': 'standard', 'ratios': 'log_ratio', 'imputers': 'mean', 'n_estimators': 1050, 'learning_rate': 0.002721160398571266, 'max_depth': 10, 'min_child_weight': 2, 'subsample': 0.9, 'colsample_bytree': 0.8, 'colsample_bylevel': 0.9, 'reg_alpha': 0.00010776441615023982, 'reg_lambda': 8.002402938997652e-06, 'gamma': 0.012258521663962333}. Best is trial 25 with value: -0.08121640044757476.
[I 2026-07-17 12:11:32,717] Trial 34 finished with value: -0.0600106564446036 and parameters: {'scalers': 'standard', 'ratios': 'norm_ratio', 'imputers': 'mean', 'n_estimators': 1000, 'learning_rate': 0.002565880423539246, 'max_depth': 11, 'min_child_weight': 7, 'subsample': 0.7, 'colsample_bytree': 0.8, 'colsample_bylevel': 0.9, 'reg_alpha': 0.00013912176884126965, 'reg_lambda': 1.2090708142799692e-05, 'gamma': 0.014180063947217774}. Best is trial 25 with value: -0.08121640044757476.
[I 2026-07-17 12:11:41,249] Trial 35 finished with value: -0.05941771502595378 and parameters: {'scalers': 'standard', 'ratios': 'norm_ratio', 'imputers': 'mean', 'n_estimators': 1050, 'learning_rate': 0.0019731112091086658, 'max_depth': 11, 'min_child_weight': 7, 'subsample': 0.6, 'colsample_bytree': 0.8, 'colsample_bylevel': 0.9, 'reg_alpha': 0.07691397541566042, 'reg_lambda': 1.427091628977624e-05, 'gamma': 0.02454385860137109}. Best is trial 25 with value: -0.08121640044757476.
[I 2026-07-17 12:11:53,698] Trial 36 finished with value: -0.06098027817421556 and parameters: {'scalers': 'standard', 'ratios': 'norm_ratio', 'imputers': 'mean', 'n_estimators': 1100, 'learning_rate': 0.001974019460087147, 'max_depth': 11, 'min_child_weight': 3, 'subsample': 0.6, 'colsample_bytree': 0.9, 'colsample_bylevel': 0.9, 'reg_alpha': 8.747747820192045e-05, 'reg_lambda': 1.3926784818870359e-05, 'gamma': 0.00016612016993024624}. Best is trial 25 with value: -0.08121640044757476.
[I 2026-07-17 12:12:02,062] Trial 37 finished with value: -0.0934697926675258 and parameters: {'scalers': 'standard', 'ratios': 'norm_ratio', 'imputers': 'mean', 'n_estimators': 1150, 'learning_rate': 0.036445571723274145, 'max_depth': 11, 'min_child_weight': 3, 'subsample': 0.6, 'colsample_bytree': 0.6, 'colsample_bylevel': 0.9, 'reg_alpha': 7.753331851741462e-05, 'reg_lambda': 2.022996202227256e-05, 'gamma': 9.656728991749e-05}. Best is trial 37 with value: -0.0934697926675258.
[I 2026-07-17 12:12:14,894] Trial 38 finished with value: -0.07192403472840983 and parameters: {'scalers': 'standard', 'ratios': 'norm_ratio', 'imputers': 'mean', 'n_estimators': 1050, 'learning_rate': 0.006837406637060776, 'max_depth': 11, 'min_child_weight': 1, 'subsample': 0.8, 'colsample_bytree': 0.6, 'colsample_bylevel': 0.9, 'reg_alpha': 0.0028032420279646606, 'reg_lambda': 1.1041043899048706e-05, 'gamma': 0.00014461724543301122}. Best is trial 37 with value: -0.0934697926675258.
[I 2026-07-17 12:12:27,289] Trial 39 finished with value: -0.07568556685798424 and parameters: {'scalers': 'standard', 'ratios': 'log_ratio', 'imputers': 'mean', 'n_estimators': 1100, 'learning_rate': 0.008584467065364657, 'max_depth': 11, 'min_child_weight': 3, 'subsample': 0.8, 'colsample_bytree': 0.6, 'colsample_bylevel': 0.9, 'reg_alpha': 0.0026850991396281804, 'reg_lambda': 0.00021603719202137277, 'gamma': 0.00014470919354916424}. Best is trial 37 with value: -0.0934697926675258.
[I 2026-07-17 12:12:41,104] Trial 40 finished with value: -0.07340490337567551 and parameters: {'scalers': 'standard', 'ratios': 'log_ratio', 'imputers': 'mean', 'n_estimators': 1150, 'learning_rate': 0.006707143056733871, 'max_depth': 11, 'min_child_weight': 3, 'subsample': 0.8, 'colsample_bytree': 0.6, 'colsample_bylevel': 1.0, 'reg_alpha': 0.0018987723404975101, 'reg_lambda': 2.311013623065885e-05, 'gamma': 0.00018081323950779233}. Best is trial 37 with value: -0.0934697926675258.
[I 2026-07-17 12:12:44,633] Trial 41 finished with value: -0.06325730555548979 and parameters: {'scalers': 'robust', 'ratios': 'log_ratio', 'imputers': 'mean', 'n_estimators': 400, 'learning_rate': 0.007320739303340191, 'max_depth': 11, 'min_child_weight': 3, 'subsample': 0.6, 'colsample_bytree': 0.6, 'colsample_bylevel': 1.0, 'reg_alpha': 0.0019617373422107574, 'reg_lambda': 2.2678751675630426e-05, 'gamma': 0.00011514182152264052}. Best is trial 37 with value: -0.0934697926675258.
[I 2026-07-17 12:12:49,894] Trial 42 finished with value: -0.06643516927682387 and parameters: {'scalers': 'robust', 'ratios': 'log_ratio', 'imputers': 'mean', 'n_estimators': 500, 'learning_rate': 0.008489217495072454, 'max_depth': 11, 'min_child_weight': 3, 'subsample': 0.6, 'colsample_bytree': 0.6, 'colsample_bylevel': 1.0, 'reg_alpha': 0.0014266656860781551, 'reg_lambda': 3.328678342148514e-05, 'gamma': 7.514672395485047e-05}. Best is trial 37 with value: -0.0934697926675258.
[I 2026-07-17 12:13:05,325] Trial 43 finished with value: -0.07707385430391187 and parameters: {'scalers': 'robust', 'ratios': 'log_ratio', 'imputers': 'none', 'n_estimators': 1300, 'learning_rate': 0.007518130128428232, 'max_depth': 11, 'min_child_weight': 3, 'subsample': 0.8, 'colsample_bytree': 0.6, 'colsample_bylevel': 1.0, 'reg_alpha': 0.001309625932436736, 'reg_lambda': 3.2126955405614937e-05, 'gamma': 0.00015669557740809393}. Best is trial 37 with value: -0.0934697926675258.
[I 2026-07-17 12:13:08,866] Trial 44 finished with value: -0.057028896520759195 and parameters: {'scalers': 'robust', 'ratios': 'log_ratio', 'imputers': 'none', 'n_estimators': 1350, 'learning_rate': 0.006846573562071903, 'max_depth': 9, 'min_child_weight': 1, 'subsample': 0.8, 'colsample_bytree': 0.6, 'colsample_bylevel': 1.0, 'reg_alpha': 0.001824930054805795, 'reg_lambda': 3.8942256464230916e-05, 'gamma': 0.15925639532421032}. Best is trial 37 with value: -0.0934697926675258.
