[I 2026-07-17 15:56:31,847] A new study created in RDB with name: residual_study_v2
[I 2026-07-17 15:56:37,088] Trial 0 finished with value: -0.24369437451371384 and parameters: {'scalers': 'robust', 'ratios': 'log_ratio', 'imputers': 'median', 'n_estimators': 1450, 'learning_rate': 0.08667556654303092, 'max_depth': 7, 'min_child_weight': 4, 'subsample': 0.8, 'colsample_bytree': 1.0, 'colsample_bylevel': 0.8, 'reg_alpha': 8.714109861711534e-05, 'reg_lambda': 0.3755186095825931, 'gamma': 6.045550983807519}. Best is trial 0 with value: -0.24369437451371384.
[I 2026-07-17 15:56:38,450] Trial 1 finished with value: -0.24372271499173523 and parameters: {'scalers': 'robust', 'ratios': 'norm_ratio', 'imputers': 'mean', 'n_estimators': 1400, 'learning_rate': 0.00011053262268250276, 'max_depth': 4, 'min_child_weight': 3, 'subsample': 0.5, 'colsample_bytree': 0.6, 'colsample_bylevel': 0.6, 'reg_alpha': 0.0024502770729790445, 'reg_lambda': 2.252865470240592, 'gamma': 7.948646851327379}. Best is trial 1 with value: -0.24372271499173523.
[I 2026-07-17 15:56:39,455] Trial 2 finished with value: -0.240009693426241 and parameters: {'scalers': 'standard', 'ratios': 'norm_ratio', 'imputers': 'mean', 'n_estimators': 300, 'learning_rate': 0.003846624528420078, 'max_depth': 6, 'min_child_weight': 4, 'subsample': 0.5, 'colsample_bytree': 0.5, 'colsample_bylevel': 0.6, 'reg_alpha': 0.00010458303508097732, 'reg_lambda': 11.865111936431553, 'gamma': 0.01046372407349355}. Best is trial 1 with value: -0.24372271499173523.
[I 2026-07-17 15:56:43,174] Trial 3 finished with value: -0.24043137667155257 and parameters: {'scalers': 'none', 'ratios': 'norm_ratio', 'imputers': 'mean', 'n_estimators': 2950, 'learning_rate': 0.001236085891890777, 'max_depth': 11, 'min_child_weight': 2, 'subsample': 0.9, 'colsample_bytree': 0.7, 'colsample_bylevel': 0.6, 'reg_alpha': 0.464432242063987, 'reg_lambda': 22.099824566350648, 'gamma': 0.6066259838493996}. Best is trial 1 with value: -0.24372271499173523.
[I 2026-07-17 15:57:10,324] Trial 4 finished with value: -0.3641381427724627 and parameters: {'scalers': 'none', 'ratios': 'log_ratio', 'imputers': 'mean', 'n_estimators': 2300, 'learning_rate': 0.008227179819232712, 'max_depth': 12, 'min_child_weight': 5, 'subsample': 0.8, 'colsample_bytree': 0.6, 'colsample_bylevel': 0.9, 'reg_alpha': 1.1707064331728384e-06, 'reg_lambda': 0.029042950830472633, 'gamma': 0.00022372420009057872}. Best is trial 4 with value: -0.3641381427724627.
[I 2026-07-17 15:57:13,074] Trial 5 finished with value: -0.24375331574487125 and parameters: {'scalers': 'standard', 'ratios': 'norm_ratio', 'imputers': 'none', 'n_estimators': 2150, 'learning_rate': 0.07710089279447518, 'max_depth': 5, 'min_child_weight': 4, 'subsample': 1.0, 'colsample_bytree': 0.9, 'colsample_bylevel': 0.7, 'reg_alpha': 0.19198255752086701, 'reg_lambda': 0.35288204252235095, 'gamma': 2.5372194747326913}. Best is trial 4 with value: -0.3641381427724627.
[I 2026-07-17 15:57:15,430] Trial 6 finished with value: -0.2822902111524177 and parameters: {'scalers': 'robust', 'ratios': 'log_ratio', 'imputers': 'mean', 'n_estimators': 600, 'learning_rate': 0.05677892621879448, 'max_depth': 7, 'min_child_weight': 8, 'subsample': 0.9, 'colsample_bytree': 0.5, 'colsample_bylevel': 0.7, 'reg_alpha': 0.006190827234938206, 'reg_lambda': 1.4875938855179197e-06, 'gamma': 4.7284400646998064e-05}. Best is trial 4 with value: -0.3641381427724627.
[I 2026-07-17 15:57:17,169] Trial 7 finished with value: -0.24355756193007833 and parameters: {'scalers': 'robust', 'ratios': 'norm_ratio', 'imputers': 'median', 'n_estimators': 2050, 'learning_rate': 0.001991835132785974, 'max_depth': 12, 'min_child_weight': 6, 'subsample': 0.5, 'colsample_bytree': 1.0, 'colsample_bylevel': 0.6, 'reg_alpha': 0.023331165569783156, 'reg_lambda': 37.86077014446219, 'gamma': 4.0761803172306585}. Best is trial 4 with value: -0.3641381427724627.
[I 2026-07-17 15:57:19,115] Trial 8 finished with value: -0.24368066994622112 and parameters: {'scalers': 'robust', 'ratios': 'norm_ratio', 'imputers': 'mean', 'n_estimators': 1700, 'learning_rate': 0.0027808973887314963, 'max_depth': 10, 'min_child_weight': 3, 'subsample': 0.8, 'colsample_bytree': 0.6, 'colsample_bylevel': 0.6, 'reg_alpha': 0.31030617687469275, 'reg_lambda': 0.007683982716530833, 'gamma': 45.992959182577486}. Best is trial 4 with value: -0.3641381427724627.
[I 2026-07-17 15:57:26,280] Trial 9 finished with value: -0.40792682137443037 and parameters: {'scalers': 'none', 'ratios': 'log_ratio', 'imputers': 'median', 'n_estimators': 2500, 'learning_rate': 0.14008475589816105, 'max_depth': 5, 'min_child_weight': 1, 'subsample': 0.8, 'colsample_bytree': 0.8, 'colsample_bylevel': 0.6, 'reg_alpha': 0.005440179533929067, 'reg_lambda': 0.23726418800644236, 'gamma': 0.0031560319775599892}. Best is trial 9 with value: -0.40792682137443037.
[I 2026-07-17 15:57:33,818] Trial 10 finished with value: -0.2402242240286593 and parameters: {'scalers': 'none', 'ratios': 'norm_ratio', 'imputers': 'mean', 'n_estimators': 2900, 'learning_rate': 0.0008138958803912632, 'max_depth': 9, 'min_child_weight': 3, 'subsample': 0.7, 'colsample_bytree': 0.8, 'colsample_bylevel': 0.6, 'reg_alpha': 0.0025498035237445384, 'reg_lambda': 0.006722941367099014, 'gamma': 0.19871731479407093}. Best is trial 9 with value: -0.40792682137443037.
[I 2026-07-17 15:57:48,853] Trial 12 finished with value: -0.24354730329387442 and parameters: {'scalers': 'standard', 'ratios': 'norm_ratio', 'imputers': 'none', 'n_estimators': 300, 'learning_rate': 0.027726188680413735, 'max_depth': 9, 'min_child_weight': 6, 'subsample': 0.5, 'colsample_bytree': 0.7, 'colsample_bylevel': 0.5, 'reg_alpha': 0.00037005717977294493, 'reg_lambda': 0.0002814564241610013, 'gamma': 79.65457768188014}. Best is trial 9 with value: -0.40792682137443037.
[I 2026-07-17 15:57:49,657] Trial 11 finished with value: -0.47253119439516655 and parameters: {'scalers': 'none', 'ratios': 'norm_ratio', 'imputers': 'mean', 'n_estimators': 2450, 'learning_rate': 0.29259523626020917, 'max_depth': 10, 'min_child_weight': 6, 'subsample': 1.0, 'colsample_bytree': 0.9, 'colsample_bylevel': 0.8, 'reg_alpha': 0.0006541877792971682, 'reg_lambda': 0.00022728248429567955, 'gamma': 1.7039473332196243e-05}. Best is trial 11 with value: -0.47253119439516655.
[I 2026-07-17 15:57:50,097] Trial 13 finished with value: -0.24354105009820123 and parameters: {'scalers': 'none', 'ratios': 'norm_ratio', 'imputers': 'mean', 'n_estimators': 500, 'learning_rate': 0.002139939602548027, 'max_depth': 11, 'min_child_weight': 7, 'subsample': 0.7, 'colsample_bytree': 0.7, 'colsample_bylevel': 0.9, 'reg_alpha': 0.00982495001527301, 'reg_lambda': 71.77457575218807, 'gamma': 1.407231582161417}. Best is trial 11 with value: -0.47253119439516655.
[I 2026-07-17 15:57:59,842] Trial 14 finished with value: -0.2515669404743965 and parameters: {'scalers': 'standard', 'ratios': 'norm_ratio', 'imputers': 'none', 'n_estimators': 1950, 'learning_rate': 0.003911808165774454, 'max_depth': 5, 'min_child_weight': 1, 'subsample': 0.7, 'colsample_bytree': 1.0, 'colsample_bylevel': 0.8, 'reg_alpha': 2.3861915900119982e-05, 'reg_lambda': 40.49768832810251, 'gamma': 0.0008700020646164756}. Best is trial 11 with value: -0.47253119439516655.
[I 2026-07-17 15:58:02,495] Trial 15 finished with value: -0.2435421211149013 and parameters: {'scalers': 'none', 'ratios': 'norm_ratio', 'imputers': 'median', 'n_estimators': 2450, 'learning_rate': 0.017374961582077606, 'max_depth': 6, 'min_child_weight': 1, 'subsample': 0.6, 'colsample_bytree': 0.7, 'colsample_bylevel': 0.8, 'reg_alpha': 83.26705545595993, 'reg_lambda': 0.2857931736752043, 'gamma': 1.928977276850699}. Best is trial 11 with value: -0.47253119439516655.
[I 2026-07-17 15:58:05,136] Trial 16 finished with value: -0.24358797857660552 and parameters: {'scalers': 'none', 'ratios': 'norm_ratio', 'imputers': 'mean', 'n_estimators': 2250, 'learning_rate': 0.0030988790230189536, 'max_depth': 6, 'min_child_weight': 2, 'subsample': 0.6, 'colsample_bytree': 1.0, 'colsample_bylevel': 1.0, 'reg_alpha': 6.02257803637456, 'reg_lambda': 0.0005913403859641811, 'gamma': 9.247933563262006}. Best is trial 11 with value: -0.47253119439516655.
[I 2026-07-17 15:58:06,203] Trial 17 finished with value: -0.24388013176574536 and parameters: {'scalers': 'none', 'ratios': 'log_ratio', 'imputers': 'median', 'n_estimators': 900, 'learning_rate': 0.48116571953564063, 'max_depth': 3, 'min_child_weight': 10, 'subsample': 0.7, 'colsample_bytree': 0.8, 'colsample_bylevel': 1.0, 'reg_alpha': 78.72962662844904, 'reg_lambda': 6.39787149673467e-05, 'gamma': 4.767681896080062e-06}. Best is trial 11 with value: -0.47253119439516655.
[I 2026-07-17 15:58:09,313] Trial 18 finished with value: -0.24384403051045023 and parameters: {'scalers': 'none', 'ratios': 'log_ratio', 'imputers': 'median', 'n_estimators': 2500, 'learning_rate': 0.4671826967305901, 'max_depth': 9, 'min_child_weight': 10, 'subsample': 0.7, 'colsample_bytree': 0.8, 'colsample_bylevel': 1.0, 'reg_alpha': 59.74768330848899, 'reg_lambda': 0.004447172891379808, 'gamma': 0.0002646345651725464}. Best is trial 11 with value: -0.47253119439516655.
[I 2026-07-17 15:58:14,556] Trial 19 finished with value: -0.3863196468574481 and parameters: {'scalers': 'none', 'ratios': 'log_ratio', 'imputers': 'median', 'n_estimators': 2400, 'learning_rate': 0.37507300006629973, 'max_depth': 3, 'min_child_weight': 1, 'subsample': 0.7, 'colsample_bytree': 0.8, 'colsample_bylevel': 1.0, 'reg_alpha': 1.7250450690043505e-06, 'reg_lambda': 0.012033946163805879, 'gamma': 8.101631761521196e-05}. Best is trial 11 with value: -0.47253119439516655.
[I 2026-07-17 15:58:17,909] Trial 20 finished with value: -0.24375331574487125 and parameters: {'scalers': 'none', 'ratios': 'log_ratio', 'imputers': 'median', 'n_estimators': 2500, 'learning_rate': 0.3989562697881923, 'max_depth': 3, 'min_child_weight': 10, 'subsample': 1.0, 'colsample_bytree': 0.9, 'colsample_bylevel': 1.0, 'reg_alpha': 53.097030206826915, 'reg_lambda': 6.501349062844721e-05, 'gamma': 3.3954060078683227e-06}. Best is trial 11 with value: -0.47253119439516655.
[I 2026-07-17 15:58:21,345] Trial 21 finished with value: -0.24375331574487125 and parameters: {'scalers': 'none', 'ratios': 'log_ratio', 'imputers': 'median', 'n_estimators': 2550, 'learning_rate': 0.38933752266578414, 'max_depth': 4, 'min_child_weight': 1, 'subsample': 1.0, 'colsample_bytree': 0.9, 'colsample_bylevel': 1.0, 'reg_alpha': 69.204864141623, 'reg_lambda': 3.838016509904178e-05, 'gamma': 1.542650199922636e-06}. Best is trial 11 with value: -0.47253119439516655.
[I 2026-07-17 15:58:24,859] Trial 22 finished with value: -0.24375331574487125 and parameters: {'scalers': 'none', 'ratios': 'log_ratio', 'imputers': 'median', 'n_estimators': 2600, 'learning_rate': 0.401125908925056, 'max_depth': 3, 'min_child_weight': 10, 'subsample': 1.0, 'colsample_bytree': 0.9, 'colsample_bylevel': 1.0, 'reg_alpha': 94.2093531253953, 'reg_lambda': 3.75664333579231e-05, 'gamma': 2.053400461835393e-06}. Best is trial 11 with value: -0.47253119439516655.
[I 2026-07-17 15:58:31,272] Trial 23 finished with value: -0.32286193311990113 and parameters: {'scalers': 'none', 'ratios': 'log_ratio', 'imputers': 'median', 'n_estimators': 2650, 'learning_rate': 0.4985592736312283, 'max_depth': 3, 'min_child_weight': 10, 'subsample': 1.0, 'colsample_bytree': 0.9, 'colsample_bylevel': 1.0, 'reg_alpha': 4.296883115095498e-06, 'reg_lambda': 6.242331341472834e-05, 'gamma': 1.1297254616461054e-06}. Best is trial 11 with value: -0.47253119439516655.
[I 2026-07-17 15:58:36,440] Trial 24 finished with value: -0.32345157780006034 and parameters: {'scalers': 'none', 'ratios': 'log_ratio', 'imputers': 'median', 'n_estimators': 2650, 'learning_rate': 0.38415647001406156, 'max_depth': 3, 'min_child_weight': 10, 'subsample': 1.0, 'colsample_bytree': 0.9, 'colsample_bylevel': 0.5, 'reg_alpha': 7.072323292663018e-06, 'reg_lambda': 5.821227020974456e-06, 'gamma': 8.190270532563692e-06}. Best is trial 11 with value: -0.47253119439516655.
[I 2026-07-17 15:58:48,519] Trial 25 finished with value: -0.4727175240978664 and parameters: {'scalers': 'none', 'ratios': 'log_ratio', 'imputers': 'median', 'n_estimators': 2600, 'learning_rate': 0.4420483707361969, 'max_depth': 9, 'min_child_weight': 9, 'subsample': 1.0, 'colsample_bytree': 0.9, 'colsample_bylevel': 0.5, 'reg_alpha': 4.781246217255984e-06, 'reg_lambda': 1.1264109318601762e-06, 'gamma': 3.2245061450953805e-06}. Best is trial 25 with value: -0.4727175240978664.
[I 2026-07-17 15:59:00,749] Trial 26 finished with value: -0.4296993559904991 and parameters: {'scalers': 'none', 'ratios': 'log_ratio', 'imputers': 'median', 'n_estimators': 2700, 'learning_rate': 0.2269733101615782, 'max_depth': 8, 'min_child_weight': 8, 'subsample': 1.0, 'colsample_bytree': 0.9, 'colsample_bylevel': 0.5, 'reg_alpha': 3.5760173477899316e-06, 'reg_lambda': 2.7645153393631787e-06, 'gamma': 1.0500423295111607e-06}. Best is trial 25 with value: -0.4727175240978664.
[I 2026-07-17 15:59:13,515] Trial 27 finished with value: -0.41055526714215906 and parameters: {'scalers': 'none', 'ratios': 'log_ratio', 'imputers': 'median', 'n_estimators': 2750, 'learning_rate': 0.17897874769709737, 'max_depth': 8, 'min_child_weight': 8, 'subsample': 1.0, 'colsample_bytree': 0.9, 'colsample_bylevel': 0.5, 'reg_alpha': 0.05268804104519567, 'reg_lambda': 5.839865624014417e-06, 'gamma': 1.2060439066726727e-06}. Best is trial 25 with value: -0.4727175240978664.
[I 2026-07-17 15:59:21,110] Trial 28 finished with value: -0.3363539902172431 and parameters: {'scalers': 'none', 'ratios': 'log_ratio', 'imputers': 'median', 'n_estimators': 2600, 'learning_rate': 0.1462940549981601, 'max_depth': 4, 'min_child_weight': 1, 'subsample': 0.9, 'colsample_bytree': 0.9, 'colsample_bylevel': 0.9, 'reg_alpha': 3.4655606661071236e-06, 'reg_lambda': 0.061515230979610515, 'gamma': 0.008639982937143405}. Best is trial 25 with value: -0.4727175240978664.
[I 2026-07-17 15:59:27,656] Trial 29 finished with value: -0.29975812716380157 and parameters: {'scalers': 'none', 'ratios': 'log_ratio', 'imputers': 'median', 'n_estimators': 2900, 'learning_rate': 0.15790372155385063, 'max_depth': 3, 'min_child_weight': 8, 'subsample': 0.9, 'colsample_bytree': 0.8, 'colsample_bylevel': 0.9, 'reg_alpha': 1.1072418689696893e-06, 'reg_lambda': 0.03246224299071441, 'gamma': 0.0075964934756834026}. Best is trial 25 with value: -0.4727175240978664.
[I 2026-07-17 15:59:45,893] Trial 30 finished with value: -0.41396968762867153 and parameters: {'scalers': 'none', 'ratios': 'log_ratio', 'imputers': 'median', 'n_estimators': 2800, 'learning_rate': 0.14005437985028685, 'max_depth': 8, 'min_child_weight': 8, 'subsample': 0.9, 'colsample_bytree': 0.8, 'colsample_bylevel': 0.9, 'reg_alpha': 2.7324743607497883e-06, 'reg_lambda': 0.05358689237664724, 'gamma': 0.007984397301928785}. Best is trial 25 with value: -0.4727175240978664.
[I 2026-07-17 15:59:56,082] Trial 31 finished with value: -0.4548960425164643 and parameters: {'scalers': 'none', 'ratios': 'log_ratio', 'imputers': 'median', 'n_estimators': 1750, 'learning_rate': 0.16810545655865836, 'max_depth': 8, 'min_child_weight': 2, 'subsample': 0.9, 'colsample_bytree': 0.8, 'colsample_bylevel': 0.9, 'reg_alpha': 0.0006090543830628358, 'reg_lambda': 0.05589774280788721, 'gamma': 0.015733162413686802}. Best is trial 25 with value: -0.4727175240978664.
[I 2026-07-17 16:00:05,567] Trial 32 finished with value: -0.4684074257314146 and parameters: {'scalers': 'none', 'ratios': 'log_ratio', 'imputers': 'none', 'n_estimators': 1900, 'learning_rate': 0.17042014235839376, 'max_depth': 8, 'min_child_weight': 2, 'subsample': 0.9, 'colsample_bytree': 0.8, 'colsample_bylevel': 0.7, 'reg_alpha': 0.000543176636700313, 'reg_lambda': 0.05314461530412844, 'gamma': 0.0052718559393149095}. Best is trial 25 with value: -0.4727175240978664.
[I 2026-07-17 16:00:14,703] Trial 33 finished with value: -0.4110605014610673 and parameters: {'scalers': 'none', 'ratios': 'log_ratio', 'imputers': 'none', 'n_estimators': 1850, 'learning_rate': 0.14844838529147464, 'max_depth': 8, 'min_child_weight': 8, 'subsample': 0.9, 'colsample_bytree': 0.8, 'colsample_bylevel': 0.5, 'reg_alpha': 0.0004622486591008259, 'reg_lambda': 1.0046678007638782e-06, 'gamma': 0.005197871822914095}. Best is trial 25 with value: -0.4727175240978664.
[I 2026-07-17 16:00:24,692] Trial 34 finished with value: -0.41129370489050265 and parameters: {'scalers': 'none', 'ratios': 'log_ratio', 'imputers': 'none', 'n_estimators': 1850, 'learning_rate': 0.17007154657970655, 'max_depth': 8, 'min_child_weight': 8, 'subsample': 0.9, 'colsample_bytree': 1.0, 'colsample_bylevel': 0.5, 'reg_alpha': 0.00037054910059798314, 'reg_lambda': 1.0839845209426232e-06, 'gamma': 1.7582311020508575e-05}. Best is trial 25 with value: -0.4727175240978664.
[I 2026-07-17 16:00:40,723] Trial 35 finished with value: -0.44149609641541504 and parameters: {'scalers': 'standard', 'ratios': 'log_ratio', 'imputers': 'none', 'n_estimators': 1850, 'learning_rate': 0.1574444179501263, 'max_depth': 10, 'min_child_weight': 8, 'subsample': 0.9, 'colsample_bytree': 1.0, 'colsample_bylevel': 0.7, 'reg_alpha': 0.0003812107194265128, 'reg_lambda': 1.7555538720779625e-06, 'gamma': 1.804362827488846e-05}. Best is trial 25 with value: -0.4727175240978664.
[I 2026-07-17 16:00:50,854] Trial 36 finished with value: -0.3084202493807752 and parameters: {'scalers': 'standard', 'ratios': 'log_ratio', 'imputers': 'none', 'n_estimators': 1800, 'learning_rate': 0.04004830945369404, 'max_depth': 8, 'min_child_weight': 8, 'subsample': 0.9, 'colsample_bytree': 1.0, 'colsample_bylevel': 0.7, 'reg_alpha': 0.0004617806934814556, 'reg_lambda': 1.071493004589603e-06, 'gamma': 1.768074517509702e-05}. Best is trial 25 with value: -0.4727175240978664.
[I 2026-07-17 16:01:00,985] Trial 37 finished with value: -0.303446916479832 and parameters: {'scalers': 'standard', 'ratios': 'log_ratio', 'imputers': 'none', 'n_estimators': 1750, 'learning_rate': 0.040237793125029245, 'max_depth': 8, 'min_child_weight': 9, 'subsample': 0.9, 'colsample_bytree': 1.0, 'colsample_bylevel': 0.7, 'reg_alpha': 0.00041454776559668915, 'reg_lambda': 1.2881561490576906e-06, 'gamma': 1.709256507092872e-05}. Best is trial 25 with value: -0.4727175240978664.
[I 2026-07-17 16:01:12,824] Trial 38 finished with value: -0.3090195209657867 and parameters: {'scalers': 'none', 'ratios': 'log_ratio', 'imputers': 'none', 'n_estimators': 1850, 'learning_rate': 0.044837178288064446, 'max_depth': 8, 'min_child_weight': 9, 'subsample': 0.9, 'colsample_bytree': 1.0, 'colsample_bylevel': 0.8, 'reg_alpha': 2.1258933332953958e-05, 'reg_lambda': 5.138361515602076e-06, 'gamma': 1.677518501511253e-05}. Best is trial 25 with value: -0.4727175240978664.
[I 2026-07-17 16:01:21,605] Trial 39 finished with value: -0.3016754818712959 and parameters: {'scalers': 'robust', 'ratios': 'log_ratio', 'imputers': 'none', 'n_estimators': 1350, 'learning_rate': 0.044308287829297556, 'max_depth': 8, 'min_child_weight': 9, 'subsample': 0.9, 'colsample_bytree': 1.0, 'colsample_bylevel': 0.8, 'reg_alpha': 0.0006806400245372466, 'reg_lambda': 3.2257603518291647e-06, 'gamma': 1.7359824802933493e-05}. Best is trial 25 with value: -0.4727175240978664.
[I 2026-07-17 16:01:29,560] Trial 40 finished with value: -0.32238539676054895 and parameters: {'scalers': 'robust', 'ratios': 'log_ratio', 'imputers': 'none', 'n_estimators': 1400, 'learning_rate': 0.05420413343592762, 'max_depth': 10, 'min_child_weight': 5, 'subsample': 0.9, 'colsample_bytree': 1.0, 'colsample_bylevel': 0.7, 'reg_alpha': 0.00040247100222134155, 'reg_lambda': 2.8365283225342495, 'gamma': 0.061659072661649175}. Best is trial 25 with value: -0.4727175240978664.
[I 2026-07-17 16:01:38,378] Trial 41 finished with value: -0.32252055258122425 and parameters: {'scalers': 'robust', 'ratios': 'log_ratio', 'imputers': 'none', 'n_estimators': 1300, 'learning_rate': 0.04844176274611198, 'max_depth': 10, 'min_child_weight': 5, 'subsample': 0.9, 'colsample_bytree': 1.0, 'colsample_bylevel': 0.8, 'reg_alpha': 0.0002399756118628301, 'reg_lambda': 1.7563859366760377, 'gamma': 0.05351601162938821}. Best is trial 25 with value: -0.4727175240978664.
[I 2026-07-17 16:01:46,797] Trial 42 finished with value: -0.3468619484119468 and parameters: {'scalers': 'robust', 'ratios': 'log_ratio', 'imputers': 'none', 'n_estimators': 1300, 'learning_rate': 0.040755698527530575, 'max_depth': 10, 'min_child_weight': 5, 'subsample': 0.8, 'colsample_bytree': 0.7, 'colsample_bylevel': 0.8, 'reg_alpha': 8.076108668981007e-05, 'reg_lambda': 2.030538466334076, 'gamma': 0.0016272798531341175}. Best is trial 25 with value: -0.4727175240978664.
[I 2026-07-17 16:01:53,753] Trial 43 finished with value: -0.3251794226123762 and parameters: {'scalers': 'robust', 'ratios': 'log_ratio', 'imputers': 'none', 'n_estimators': 1450, 'learning_rate': 0.04157893107724028, 'max_depth': 10, 'min_child_weight': 5, 'subsample': 0.8, 'colsample_bytree': 0.7, 'colsample_bylevel': 0.8, 'reg_alpha': 8.004818091846126e-05, 'reg_lambda': 1.683642288957311, 'gamma': 0.05782548473212489}. Best is trial 25 with value: -0.4727175240978664.
[I 2026-07-17 16:02:02,452] Trial 44 finished with value: -0.391252784612157 and parameters: {'scalers': 'robust', 'ratios': 'norm_ratio', 'imputers': 'mean', 'n_estimators': 1400, 'learning_rate': 0.07991954830941418, 'max_depth': 10, 'min_child_weight': 5, 'subsample': 0.8, 'colsample_bytree': 0.7, 'colsample_bylevel': 0.8, 'reg_alpha': 8.026578697008826e-05, 'reg_lambda': 4.398202454870851, 'gamma': 0.020040349667263327}. Best is trial 25 with value: -0.4727175240978664.
