[I 2026-07-17 16:58:36,240] Trial 317 finished with value: -1.7561084928873236 and parameters: {'scalers': 'robust', 'ratios': 'log_ratio', 'imputers': 'none', 'n_estimators': 2800, 'learning_rate': 0.3314374776172936, 'max_depth': 9, 'min_child_weight': 1, 'subsample': 0.5, 'colsample_bytree': 0.5, 'colsample_bylevel': 0.8, 'reg_alpha': 2.509808630794797, 'reg_lambda': 41.32136439973366, 'gamma': 0.0011260872975104735}. Best is trial 307 with value: -20.794665236389918.
[I 2026-07-17 16:58:51,149] Trial 318 finished with value: -2.7370041488597074 and parameters: {'scalers': 'robust', 'ratios': 'log_ratio', 'imputers': 'none', 'n_estimators': 2800, 'learning_rate': 0.340320146228755, 'max_depth': 9, 'min_child_weight': 1, 'subsample': 0.5, 'colsample_bytree': 0.5, 'colsample_bylevel': 0.7, 'reg_alpha': 1.2321537922169543, 'reg_lambda': 44.85474654021463, 'gamma': 0.001172049167128155}. Best is trial 307 with value: -20.794665236389918.
[I 2026-07-17 16:59:03,256] Trial 319 finished with value: -0.24025762213036317 and parameters: {'scalers': 'robust', 'ratios': 'log_ratio', 'imputers': 'none', 'n_estimators': 2800, 'learning_rate': 0.00016001777842362966, 'max_depth': 9, 'min_child_weight': 1, 'subsample': 0.5, 'colsample_bytree': 0.5, 'colsample_bylevel': 1.0, 'reg_alpha': 2.920250157535514, 'reg_lambda': 42.755580324769454, 'gamma': 0.00039366517770725605}. Best is trial 307 with value: -20.794665236389918.
