[I 2026-07-17 11:43:58,237] Trial 180 finished with value: -0.24350261674790724 and parameters: {'scalers': 'robust', 'ratios': 'log_ratio', 'imputers': 'mean', 'n_estimators': 250, 'learning_rate': 0.00020372098087632597, 'max_depth': 6, 'min_child_weight': 8, 'subsample': 0.5, 'colsample_bytree': 0.9, 'colsample_bylevel': 0.8, 'reg_alpha': 74.33771091466848, 'reg_lambda': 0.00018911642878782485, 'gamma': 26.70139981933992}. Best is trial 177 with value: -0.2438371410884055.
[I 2026-07-17 11:43:58,592] Trial 181 finished with value: -0.24383424640885357 and parameters: {'scalers': 'robust', 'ratios': 'log_ratio', 'imputers': 'mean', 'n_estimators': 250, 'learning_rate': 0.00021216059831782682, 'max_depth': 6, 'min_child_weight': 8, 'subsample': 0.5, 'colsample_bytree': 0.9, 'colsample_bylevel': 0.8, 'reg_alpha': 98.7772271653526, 'reg_lambda': 0.00017148441583478304, 'gamma': 28.781167281095414}. Best is trial 177 with value: -0.2438371410884055.
[I 2026-07-17 11:43:58,783] Trial 182 finished with value: -0.24360037758863637 and parameters: {'scalers': 'robust', 'ratios': 'log_ratio', 'imputers': 'mean', 'n_estimators': 100, 'learning_rate': 0.00020241598485016827, 'max_depth': 6, 'min_child_weight': 8, 'subsample': 0.5, 'colsample_bytree': 0.9, 'colsample_bylevel': 0.8, 'reg_alpha': 67.35580564942045, 'reg_lambda': 0.000159983338162619, 'gamma': 28.92128087230897}. Best is trial 177 with value: -0.2438371410884055.
[I 2026-07-17 11:43:58,990] Trial 183 finished with value: -0.2428502766399489 and parameters: {'scalers': 'robust', 'ratios': 'log_ratio', 'imputers': 'mean', 'n_estimators': 100, 'learning_rate': 0.0002025499344692901, 'max_depth': 6, 'min_child_weight': 8, 'subsample': 0.5, 'colsample_bytree': 0.9, 'colsample_bylevel': 0.8, 'reg_alpha': 67.18255065905373, 'reg_lambda': 0.00014989790710579414, 'gamma': 17.781344242285893}. Best is trial 177 with value: -0.2438371410884055.
[I 2026-07-17 11:43:59,243] Trial 184 finished with value: -0.24366077777299683 and parameters: {'scalers': 'robust', 'ratios': 'log_ratio', 'imputers': 'mean', 'n_estimators': 100, 'learning_rate': 0.00020081437064110446, 'max_depth': 6, 'min_child_weight': 8, 'subsample': 0.5, 'colsample_bytree': 0.9, 'colsample_bylevel': 0.8, 'reg_alpha': 68.91644607021071, 'reg_lambda': 0.00016776987389355172, 'gamma': 29.29369513372147}. Best is trial 177 with value: -0.2438371410884055.
[I 2026-07-17 11:43:59,464] Trial 185 finished with value: -0.24279212285656004 and parameters: {'scalers': 'robust', 'ratios': 'log_ratio', 'imputers': 'mean', 'n_estimators': 100, 'learning_rate': 0.00019888294437509562, 'max_depth': 5, 'min_child_weight': 8, 'subsample': 0.5, 'colsample_bytree': 0.9, 'colsample_bylevel': 0.8, 'reg_alpha': 60.737224572210906, 'reg_lambda': 0.0001767000022046709, 'gamma': 6.744195438652008}. Best is trial 177 with value: -0.2438371410884055.
[I 2026-07-17 11:43:59,740] Trial 186 finished with value: -0.24284283644734977 and parameters: {'scalers': 'robust', 'ratios': 'log_ratio', 'imputers': 'mean', 'n_estimators': 100, 'learning_rate': 0.00019953703194078122, 'max_depth': 5, 'min_child_weight': 8, 'subsample': 0.5, 'colsample_bytree': 0.9, 'colsample_bylevel': 0.8, 'reg_alpha': 63.62628147592101, 'reg_lambda': 0.00014276860000085918, 'gamma': 16.348397752874327}. Best is trial 177 with value: -0.2438371410884055.
[I 2026-07-17 11:44:00,013] Trial 187 finished with value: -0.24283596288272719 and parameters: {'scalers': 'robust', 'ratios': 'log_ratio', 'imputers': 'mean', 'n_estimators': 100, 'learning_rate': 0.00020233994602538447, 'max_depth': 5, 'min_child_weight': 8, 'subsample': 0.5, 'colsample_bytree': 0.9, 'colsample_bylevel': 0.8, 'reg_alpha': 61.614483033581095, 'reg_lambda': 0.0001364418808871519, 'gamma': 18.90729935019699}. Best is trial 177 with value: -0.2438371410884055.
[I 2026-07-17 11:44:00,238] Trial 188 finished with value: -0.24287474648977103 and parameters: {'scalers': 'robust', 'ratios': 'log_ratio', 'imputers': 'mean', 'n_estimators': 100, 'learning_rate': 0.0001942813824922536, 'max_depth': 5, 'min_child_weight': 8, 'subsample': 0.5, 'colsample_bytree': 0.9, 'colsample_bylevel': 0.8, 'reg_alpha': 62.16541212236464, 'reg_lambda': 0.0001389494427178039, 'gamma': 18.489153261649616}. Best is trial 177 with value: -0.2438371410884055.
[I 2026-07-17 11:44:00,622] Trial 189 finished with value: -0.242887975452698 and parameters: {'scalers': 'robust', 'ratios': 'log_ratio', 'imputers': 'mean', 'n_estimators': 100, 'learning_rate': 0.00019280499624547856, 'max_depth': 5, 'min_child_weight': 8, 'subsample': 0.5, 'colsample_bytree': 0.9, 'colsample_bylevel': 0.8, 'reg_alpha': 61.59058738167917, 'reg_lambda': 0.0001269300370484592, 'gamma': 19.581638285115094}. Best is trial 177 with value: -0.2438371410884055.
[I 2026-07-17 11:44:01,022] Trial 190 finished with value: -0.24235927849597028 and parameters: {'scalers': 'robust', 'ratios': 'log_ratio', 'imputers': 'mean', 'n_estimators': 150, 'learning_rate': 0.00019725559397035388, 'max_depth': 5, 'min_child_weight': 8, 'subsample': 0.5, 'colsample_bytree': 0.9, 'colsample_bylevel': 0.8, 'reg_alpha': 47.16614309332592, 'reg_lambda': 0.0001213925762787045, 'gamma': 13.114784432045157}. Best is trial 177 with value: -0.2438371410884055.
[I 2026-07-17 11:44:01,518] Trial 191 finished with value: -0.24158795132812805 and parameters: {'scalers': 'robust', 'ratios': 'log_ratio', 'imputers': 'mean', 'n_estimators': 200, 'learning_rate': 0.00022727058603936833, 'max_depth': 5, 'min_child_weight': 8, 'subsample': 0.5, 'colsample_bytree': 0.9, 'colsample_bylevel': 0.8, 'reg_alpha': 48.76202260099421, 'reg_lambda': 6.484005850295729e-05, 'gamma': 13.623898010235491}. Best is trial 177 with value: -0.2438371410884055.
[I 2026-07-17 11:44:01,908] Trial 192 finished with value: -0.2409380517735449 and parameters: {'scalers': 'robust', 'ratios': 'log_ratio', 'imputers': 'mean', 'n_estimators': 200, 'learning_rate': 0.0002957443330849747, 'max_depth': 6, 'min_child_weight': 8, 'subsample': 0.5, 'colsample_bytree': 0.9, 'colsample_bylevel': 0.8, 'reg_alpha': 45.91973148551045, 'reg_lambda': 0.00011314920748283378, 'gamma': 12.787114294362981}. Best is trial 177 with value: -0.2438371410884055.
[I 2026-07-17 11:44:02,272] Trial 193 finished with value: -0.24089453899722707 and parameters: {'scalers': 'robust', 'ratios': 'log_ratio', 'imputers': 'mean', 'n_estimators': 200, 'learning_rate': 0.0002991026721525692, 'max_depth': 6, 'min_child_weight': 8, 'subsample': 0.5, 'colsample_bytree': 0.9, 'colsample_bylevel': 0.8, 'reg_alpha': 41.98745935691199, 'reg_lambda': 8.693176962518659e-05, 'gamma': 12.780343382840337}. Best is trial 177 with value: -0.2438371410884055.
[I 2026-07-17 11:44:02,631] Trial 194 finished with value: -0.2409845984454743 and parameters: {'scalers': 'robust', 'ratios': 'log_ratio', 'imputers': 'mean', 'n_estimators': 200, 'learning_rate': 0.00028986106574655244, 'max_depth': 6, 'min_child_weight': 8, 'subsample': 0.5, 'colsample_bytree': 0.9, 'colsample_bylevel': 0.8, 'reg_alpha': 44.99144166409229, 'reg_lambda': 6.907792522598237e-05, 'gamma': 12.585247811616577}. Best is trial 177 with value: -0.2438371410884055.
[I 2026-07-17 11:44:03,031] Trial 195 finished with value: -0.24080612568009452 and parameters: {'scalers': 'robust', 'ratios': 'log_ratio', 'imputers': 'mean', 'n_estimators': 200, 'learning_rate': 0.00030403218624737476, 'max_depth': 6, 'min_child_weight': 8, 'subsample': 0.5, 'colsample_bytree': 0.9, 'colsample_bylevel': 0.8, 'reg_alpha': 41.947015546636564, 'reg_lambda': 6.627444130142247e-05, 'gamma': 11.477236000163082}. Best is trial 177 with value: -0.2438371410884055.
[I 2026-07-17 11:44:03,307] Trial 196 finished with value: -0.243834802626587 and parameters: {'scalers': 'robust', 'ratios': 'log_ratio', 'imputers': 'mean', 'n_estimators': 200, 'learning_rate': 0.00023970410576354265, 'max_depth': 6, 'min_child_weight': 8, 'subsample': 0.5, 'colsample_bytree': 0.9, 'colsample_bylevel': 0.8, 'reg_alpha': 99.0722724826508, 'reg_lambda': 6.623946069916019e-05, 'gamma': 32.49631496852897}. Best is trial 177 with value: -0.2438371410884055.
[I 2026-07-17 11:44:03,678] Trial 197 finished with value: -0.24383478763016517 and parameters: {'scalers': 'robust', 'ratios': 'log_ratio', 'imputers': 'mean', 'n_estimators': 200, 'learning_rate': 0.00024142785917142585, 'max_depth': 6, 'min_child_weight': 8, 'subsample': 0.5, 'colsample_bytree': 0.9, 'colsample_bylevel': 0.8, 'reg_alpha': 95.0764052345718, 'reg_lambda': 6.58775197626338e-05, 'gamma': 35.842987003786135}. Best is trial 177 with value: -0.2438371410884055.
[I 2026-07-17 11:44:04,063] Trial 198 finished with value: -0.24383479694361432 and parameters: {'scalers': 'robust', 'ratios': 'log_ratio', 'imputers': 'mean', 'n_estimators': 200, 'learning_rate': 0.00024039708231139064, 'max_depth': 6, 'min_child_weight': 8, 'subsample': 0.5, 'colsample_bytree': 0.9, 'colsample_bylevel': 0.8, 'reg_alpha': 97.6422555930761, 'reg_lambda': 0.0002426488830096616, 'gamma': 36.982992797370635}. Best is trial 177 with value: -0.2438371410884055.
[I 2026-07-17 11:44:04,422] Trial 199 finished with value: -0.24383348321303688 and parameters: {'scalers': 'robust', 'ratios': 'log_ratio', 'imputers': 'mean', 'n_estimators': 250, 'learning_rate': 0.00024889585448777324, 'max_depth': 6, 'min_child_weight': 8, 'subsample': 0.5, 'colsample_bytree': 0.9, 'colsample_bylevel': 0.8, 'reg_alpha': 82.74765217266899, 'reg_lambda': 0.00025881806378788975, 'gamma': 33.23179544117489}. Best is trial 177 with value: -0.2438371410884055.
[I 2026-07-17 11:44:04,766] Trial 200 finished with value: -0.24383378939289835 and parameters: {'scalers': 'robust', 'ratios': 'log_ratio', 'imputers': 'mean', 'n_estimators': 250, 'learning_rate': 0.00023401863872858975, 'max_depth': 6, 'min_child_weight': 8, 'subsample': 0.5, 'colsample_bytree': 0.9, 'colsample_bylevel': 0.8, 'reg_alpha': 94.56095014254399, 'reg_lambda': 0.00026343638166176114, 'gamma': 36.259660049981406}. Best is trial 177 with value: -0.2438371410884055.
[I 2026-07-17 11:44:05,244] Trial 201 finished with value: -0.24383295476000244 and parameters: {'scalers': 'robust', 'ratios': 'log_ratio', 'imputers': 'mean', 'n_estimators': 300, 'learning_rate': 0.00023416758312631925, 'max_depth': 6, 'min_child_weight': 8, 'subsample': 0.5, 'colsample_bytree': 0.9, 'colsample_bylevel': 0.8, 'reg_alpha': 92.12160730002883, 'reg_lambda': 0.000257692158194976, 'gamma': 36.56311932061261}. Best is trial 177 with value: -0.2438371410884055.
[I 2026-07-17 11:44:05,678] Trial 202 finished with value: -0.24383303111614202 and parameters: {'scalers': 'robust', 'ratios': 'log_ratio', 'imputers': 'mean', 'n_estimators': 300, 'learning_rate': 0.00023165960805593752, 'max_depth': 6, 'min_child_weight': 8, 'subsample': 0.5, 'colsample_bytree': 0.9, 'colsample_bylevel': 0.8, 'reg_alpha': 98.20720859785791, 'reg_lambda': 0.0002642157484136302, 'gamma': 36.976159711715916}. Best is trial 177 with value: -0.2438371410884055.
[I 2026-07-17 11:44:06,215] Trial 203 finished with value: -0.24383289960879062 and parameters: {'scalers': 'robust', 'ratios': 'log_ratio', 'imputers': 'mean', 'n_estimators': 300, 'learning_rate': 0.000236668933439914, 'max_depth': 6, 'min_child_weight': 8, 'subsample': 0.5, 'colsample_bytree': 0.9, 'colsample_bylevel': 0.8, 'reg_alpha': 97.47469229061828, 'reg_lambda': 0.0002512957448379074, 'gamma': 34.08891213957137}. Best is trial 177 with value: -0.2438371410884055.
[I 2026-07-17 11:44:06,689] Trial 204 finished with value: -0.2438328883378985 and parameters: {'scalers': 'robust', 'ratios': 'log_ratio', 'imputers': 'mean', 'n_estimators': 300, 'learning_rate': 0.00023722537284775515, 'max_depth': 6, 'min_child_weight': 8, 'subsample': 0.5, 'colsample_bytree': 0.9, 'colsample_bylevel': 0.8, 'reg_alpha': 96.9277087865, 'reg_lambda': 3.0984241717148955e-05, 'gamma': 35.07854387255025}. Best is trial 177 with value: -0.2438371410884055.
[I 2026-07-17 11:44:07,159] Trial 205 finished with value: -0.2438329437556789 and parameters: {'scalers': 'robust', 'ratios': 'log_ratio', 'imputers': 'mean', 'n_estimators': 300, 'learning_rate': 0.00023515563865950573, 'max_depth': 6, 'min_child_weight': 8, 'subsample': 0.5, 'colsample_bytree': 0.9, 'colsample_bylevel': 0.8, 'reg_alpha': 98.91137512700077, 'reg_lambda': 0.0002531533082421205, 'gamma': 32.382294458230795}. Best is trial 177 with value: -0.2438371410884055.
[I 2026-07-17 11:44:07,754] Trial 206 finished with value: -0.24383411405959568 and parameters: {'scalers': 'robust', 'ratios': 'log_ratio', 'imputers': 'mean', 'n_estimators': 350, 'learning_rate': 0.00016056658337053304, 'max_depth': 6, 'min_child_weight': 8, 'subsample': 0.5, 'colsample_bytree': 0.9, 'colsample_bylevel': 0.8, 'reg_alpha': 99.68462904010183, 'reg_lambda': 0.0005932249775281902, 'gamma': 30.523277752348527}. Best is trial 177 with value: -0.2438371410884055.
[I 2026-07-17 11:44:08,221] Trial 207 finished with value: -0.2438352026446456 and parameters: {'scalers': 'robust', 'ratios': 'log_ratio', 'imputers': 'mean', 'n_estimators': 300, 'learning_rate': 0.00014140861954979166, 'max_depth': 6, 'min_child_weight': 8, 'subsample': 0.5, 'colsample_bytree': 0.9, 'colsample_bylevel': 0.8, 'reg_alpha': 95.85848789553712, 'reg_lambda': 0.00023966671943084138, 'gamma': 27.952020323911476}. Best is trial 177 with value: -0.2438371410884055.
[I 2026-07-17 11:44:08,748] Trial 208 finished with value: -0.24357379857169423 and parameters: {'scalers': 'robust', 'ratios': 'log_ratio', 'imputers': 'mean', 'n_estimators': 300, 'learning_rate': 0.00014767159822463017, 'max_depth': 6, 'min_child_weight': 8, 'subsample': 0.5, 'colsample_bytree': 0.9, 'colsample_bylevel': 0.8, 'reg_alpha': 72.90477857598806, 'reg_lambda': 2.528059084025768e-05, 'gamma': 27.722529704448625}. Best is trial 177 with value: -0.2438371410884055.
[I 2026-07-17 11:44:09,362] Trial 209 finished with value: -0.24383330958415705 and parameters: {'scalers': 'robust', 'ratios': 'log_ratio', 'imputers': 'mean', 'n_estimators': 400, 'learning_rate': 0.0001626169256555757, 'max_depth': 6, 'min_child_weight': 8, 'subsample': 0.5, 'colsample_bytree': 0.9, 'colsample_bylevel': 0.8, 'reg_alpha': 97.0282964078329, 'reg_lambda': 0.0006488582255078497, 'gamma': 29.091776797408237}. Best is trial 177 with value: -0.2438371410884055.
[I 2026-07-17 11:44:10,119] Trial 210 finished with value: -0.2408932282104707 and parameters: {'scalers': 'robust', 'ratios': 'log_ratio', 'imputers': 'mean', 'n_estimators': 400, 'learning_rate': 0.0001628992465810249, 'max_depth': 6, 'min_child_weight': 8, 'subsample': 0.5, 'colsample_bytree': 0.9, 'colsample_bylevel': 0.8, 'reg_alpha': 57.425967895782975, 'reg_lambda': 0.0005680083790921202, 'gamma': 24.330223670242056}. Best is trial 177 with value: -0.2438371410884055.
[I 2026-07-17 11:44:10,907] Trial 211 finished with value: -0.24105511824986037 and parameters: {'scalers': 'robust', 'ratios': 'log_ratio', 'imputers': 'mean', 'n_estimators': 450, 'learning_rate': 0.000174504862118732, 'max_depth': 6, 'min_child_weight': 8, 'subsample': 0.5, 'colsample_bytree': 0.9, 'colsample_bylevel': 0.8, 'reg_alpha': 64.94494259817074, 'reg_lambda': 3.42144662793468e-05, 'gamma': 23.85105865516214}. Best is trial 177 with value: -0.2438371410884055.
[I 2026-07-17 11:44:11,257] Trial 212 finished with value: -0.24278381380463226 and parameters: {'scalers': 'robust', 'ratios': 'log_ratio', 'imputers': 'mean', 'n_estimators': 150, 'learning_rate': 0.00016425731091817395, 'max_depth': 6, 'min_child_weight': 8, 'subsample': 0.5, 'colsample_bytree': 0.9, 'colsample_bylevel': 0.8, 'reg_alpha': 61.99028566599821, 'reg_lambda': 0.0006120324338647201, 'gamma': 24.75492611290291}. Best is trial 177 with value: -0.2438371410884055.
[I 2026-07-17 11:44:12,511] Trial 213 finished with value: -0.23940346662552664 and parameters: {'scalers': 'robust', 'ratios': 'log_ratio', 'imputers': 'mean', 'n_estimators': 450, 'learning_rate': 0.0001635320253958368, 'max_depth': 6, 'min_child_weight': 8, 'subsample': 0.5, 'colsample_bytree': 0.9, 'colsample_bylevel': 0.8, 'reg_alpha': 60.143123333652376, 'reg_lambda': 0.0005945547408115082, 'gamma': 8.46029888723747e-05}. Best is trial 177 with value: -0.2438371410884055.
[I 2026-07-17 11:44:12,855] Trial 214 finished with value: -0.24150715193975217 and parameters: {'scalers': 'robust', 'ratios': 'log_ratio', 'imputers': 'mean', 'n_estimators': 150, 'learning_rate': 0.0003245885672436516, 'max_depth': 6, 'min_child_weight': 8, 'subsample': 0.5, 'colsample_bytree': 0.9, 'colsample_bylevel': 0.8, 'reg_alpha': 53.66582384703274, 'reg_lambda': 0.0006336611955604067, 'gamma': 24.026616016772696}. Best is trial 177 with value: -0.2438371410884055.
[I 2026-07-17 11:44:13,164] Trial 215 finished with value: -0.24278700530351033 and parameters: {'scalers': 'robust', 'ratios': 'log_ratio', 'imputers': 'mean', 'n_estimators': 150, 'learning_rate': 0.00014470069031705454, 'max_depth': 6, 'min_child_weight': 8, 'subsample': 0.5, 'colsample_bytree': 0.9, 'colsample_bylevel': 0.8, 'reg_alpha': 57.177982799732206, 'reg_lambda': 0.0006491102763683004, 'gamma': 23.955718535001168}. Best is trial 177 with value: -0.2438371410884055.
[I 2026-07-17 11:44:13,474] Trial 216 finished with value: -0.24259817546277537 and parameters: {'scalers': 'robust', 'ratios': 'log_ratio', 'imputers': 'mean', 'n_estimators': 150, 'learning_rate': 0.0001677817369423031, 'max_depth': 6, 'min_child_weight': 9, 'subsample': 0.5, 'colsample_bytree': 0.9, 'colsample_bylevel': 0.9, 'reg_alpha': 55.79494086817855, 'reg_lambda': 0.0005374858078084199, 'gamma': 24.506554968777092}. Best is trial 177 with value: -0.2438371410884055.
[I 2026-07-17 11:44:13,735] Trial 217 finished with value: -0.24133818084018407 and parameters: {'scalers': 'robust', 'ratios': 'log_ratio', 'imputers': 'mean', 'n_estimators': 150, 'learning_rate': 0.00034590479566711934, 'max_depth': 6, 'min_child_weight': 9, 'subsample': 0.5, 'colsample_bytree': 0.9, 'colsample_bylevel': 0.8, 'reg_alpha': 55.856548107866644, 'reg_lambda': 0.0005724485782509772, 'gamma': 22.05637317104638}. Best is trial 177 with value: -0.2438371410884055.
[I 2026-07-17 11:44:14,070] Trial 218 finished with value: -0.24174287690402377 and parameters: {'scalers': 'robust', 'ratios': 'log_ratio', 'imputers': 'mean', 'n_estimators': 150, 'learning_rate': 0.0003130192517996112, 'max_depth': 6, 'min_child_weight': 8, 'subsample': 0.5, 'colsample_bytree': 0.9, 'colsample_bylevel': 0.8, 'reg_alpha': 60.599214470642366, 'reg_lambda': 9.093617408314319e-05, 'gamma': 23.7859270168883}. Best is trial 177 with value: -0.2438371410884055.
[I 2026-07-17 11:44:14,376] Trial 219 finished with value: -0.24254930903415323 and parameters: {'scalers': 'robust', 'ratios': 'log_ratio', 'imputers': 'mean', 'n_estimators': 150, 'learning_rate': 0.0003194237072763307, 'max_depth': 6, 'min_child_weight': 8, 'subsample': 0.5, 'colsample_bytree': 0.9, 'colsample_bylevel': 0.8, 'reg_alpha': 38.41845993123461, 'reg_lambda': 0.00010057613898701425, 'gamma': 43.60743606777511}. Best is trial 177 with value: -0.2438371410884055.
[I 2026-07-17 11:44:14,672] Trial 220 finished with value: -0.24309163619938484 and parameters: {'scalers': 'robust', 'ratios': 'log_ratio', 'imputers': 'mean', 'n_estimators': 150, 'learning_rate': 0.0003195821338002016, 'max_depth': 6, 'min_child_weight': 8, 'subsample': 0.5, 'colsample_bytree': 0.9, 'colsample_bylevel': 0.8, 'reg_alpha': 39.890491559961376, 'reg_lambda': 9.67892992310358e-05, 'gamma': 45.67287645105038}. Best is trial 177 with value: -0.2438371410884055.
[I 2026-07-17 11:44:14,963] Trial 221 finished with value: -0.24201046756736375 and parameters: {'scalers': 'robust', 'ratios': 'log_ratio', 'imputers': 'mean', 'n_estimators': 150, 'learning_rate': 0.0003238859806712668, 'max_depth': 6, 'min_child_weight': 8, 'subsample': 0.5, 'colsample_bytree': 0.9, 'colsample_bylevel': 0.8, 'reg_alpha': 36.61383135724056, 'reg_lambda': 8.541087316506015e-05, 'gamma': 41.53196857719771}. Best is trial 177 with value: -0.2438371410884055.
[I 2026-07-17 11:44:15,254] Trial 222 finished with value: -0.2430323241960813 and parameters: {'scalers': 'robust', 'ratios': 'log_ratio', 'imputers': 'mean', 'n_estimators': 150, 'learning_rate': 0.00032337235194797884, 'max_depth': 6, 'min_child_weight': 8, 'subsample': 0.5, 'colsample_bytree': 0.9, 'colsample_bylevel': 0.8, 'reg_alpha': 36.12719489267036, 'reg_lambda': 8.9274928549774e-05, 'gamma': 48.27643020553299}. Best is trial 177 with value: -0.2438371410884055.
[I 2026-07-17 11:44:15,537] Trial 223 finished with value: -0.24297946854724448 and parameters: {'scalers': 'robust', 'ratios': 'log_ratio', 'imputers': 'mean', 'n_estimators': 150, 'learning_rate': 0.0003248660934694277, 'max_depth': 6, 'min_child_weight': 8, 'subsample': 0.5, 'colsample_bytree': 0.9, 'colsample_bylevel': 0.8, 'reg_alpha': 33.60880380911056, 'reg_lambda': 9.04070192289241e-05, 'gamma': 49.65285831187159}. Best is trial 177 with value: -0.2438371410884055.
[I 2026-07-17 11:44:15,795] Trial 224 finished with value: -0.24151091608269232 and parameters: {'scalers': 'robust', 'ratios': 'log_ratio', 'imputers': 'mean', 'n_estimators': 150, 'learning_rate': 0.0003258574010201475, 'max_depth': 6, 'min_child_weight': 8, 'subsample': 0.5, 'colsample_bytree': 0.9, 'colsample_bylevel': 0.8, 'reg_alpha': 33.932259851720744, 'reg_lambda': 8.367523507872408e-05, 'gamma': 36.07152812101018}. Best is trial 177 with value: -0.2438371410884055.
