[I 2026-07-17 15:53:55,167] Trial 180 finished with value: -0.15921180063477464 and parameters: {'scalers': 'robust', 'ratios': 'log_ratio', 'imputers': 'mean', 'n_estimators': 2000, 'learning_rate': 0.49682787457571526, 'max_depth': 8, 'min_child_weight': 1, 'subsample': 0.6, 'colsample_bytree': 0.8, 'colsample_bylevel': 0.5, 'reg_alpha': 0.6377161032201691, 'reg_lambda': 9.505083028131863e-06, 'gamma': 9.453932099366769e-05}. Best is trial 172 with value: -0.20931359507453345.
[I 2026-07-17 15:54:08,027] Trial 181 finished with value: -0.1236450440943227 and parameters: {'scalers': 'robust', 'ratios': 'log_ratio', 'imputers': 'mean', 'n_estimators': 2050, 'learning_rate': 0.4998446128319378, 'max_depth': 8, 'min_child_weight': 2, 'subsample': 0.6, 'colsample_bytree': 0.8, 'colsample_bylevel': 0.5, 'reg_alpha': 1.7140565959858387, 'reg_lambda': 7.426147413070047e-05, 'gamma': 9.256153146189672e-05}. Best is trial 172 with value: -0.20931359507453345.
[I 2026-07-17 15:54:19,083] Trial 182 finished with value: -0.11001732911344468 and parameters: {'scalers': 'robust', 'ratios': 'log_ratio', 'imputers': 'mean', 'n_estimators': 2000, 'learning_rate': 0.4158333736033458, 'max_depth': 8, 'min_child_weight': 2, 'subsample': 0.6, 'colsample_bytree': 0.7, 'colsample_bylevel': 0.5, 'reg_alpha': 1.5215074746554715, 'reg_lambda': 7.297836236444075e-05, 'gamma': 9.256958241398995e-05}. Best is trial 172 with value: -0.20931359507453345.
[I 2026-07-17 15:54:29,645] Trial 183 finished with value: -0.11144890549933614 and parameters: {'scalers': 'robust', 'ratios': 'log_ratio', 'imputers': 'mean', 'n_estimators': 2050, 'learning_rate': 0.4080432149818343, 'max_depth': 8, 'min_child_weight': 2, 'subsample': 0.6, 'colsample_bytree': 0.7, 'colsample_bylevel': 0.5, 'reg_alpha': 1.7930561127370448, 'reg_lambda': 7.729698245167894e-05, 'gamma': 8.9973172767023e-05}. Best is trial 172 with value: -0.20931359507453345.
[I 2026-07-17 15:54:41,756] Trial 184 finished with value: -0.15739574961897718 and parameters: {'scalers': 'robust', 'ratios': 'log_ratio', 'imputers': 'mean', 'n_estimators': 2050, 'learning_rate': 0.4165060505790654, 'max_depth': 8, 'min_child_weight': 1, 'subsample': 0.6, 'colsample_bytree': 0.7, 'colsample_bylevel': 0.5, 'reg_alpha': 1.5351499901861054, 'reg_lambda': 7.627917127599346e-05, 'gamma': 9.873609846608974e-05}. Best is trial 172 with value: -0.20931359507453345.
[I 2026-07-17 15:54:54,511] Trial 185 finished with value: -0.15462947372476588 and parameters: {'scalers': 'standard', 'ratios': 'log_ratio', 'imputers': 'mean', 'n_estimators': 2100, 'learning_rate': 0.4064334700537131, 'max_depth': 8, 'min_child_weight': 1, 'subsample': 0.6, 'colsample_bytree': 0.7, 'colsample_bylevel': 0.5, 'reg_alpha': 1.6057638348207306, 'reg_lambda': 8.028438759441345e-05, 'gamma': 4.912357720662279e-05}. Best is trial 172 with value: -0.20931359507453345.
[I 2026-07-17 15:55:06,801] Trial 186 finished with value: -0.15608575834294686 and parameters: {'scalers': 'standard', 'ratios': 'log_ratio', 'imputers': 'mean', 'n_estimators': 2100, 'learning_rate': 0.4028715068226624, 'max_depth': 8, 'min_child_weight': 1, 'subsample': 0.6, 'colsample_bytree': 0.7, 'colsample_bylevel': 0.5, 'reg_alpha': 1.6640691334692035, 'reg_lambda': 6.553233985337874e-05, 'gamma': 4.921178233892789e-05}. Best is trial 172 with value: -0.20931359507453345.
[I 2026-07-17 15:55:17,949] Trial 187 finished with value: -0.15102612464787946 and parameters: {'scalers': 'standard', 'ratios': 'log_ratio', 'imputers': 'mean', 'n_estimators': 2100, 'learning_rate': 0.39256430163764205, 'max_depth': 8, 'min_child_weight': 1, 'subsample': 0.6, 'colsample_bytree': 0.7, 'colsample_bylevel': 0.5, 'reg_alpha': 1.764520824452827, 'reg_lambda': 8.809524615391293e-06, 'gamma': 4.560541152204951e-05}. Best is trial 172 with value: -0.20931359507453345.
[I 2026-07-17 15:55:28,426] Trial 188 finished with value: -0.14130994678345243 and parameters: {'scalers': 'robust', 'ratios': 'log_ratio', 'imputers': 'mean', 'n_estimators': 1850, 'learning_rate': 0.38395831709079387, 'max_depth': 8, 'min_child_weight': 1, 'subsample': 0.6, 'colsample_bytree': 0.7, 'colsample_bylevel': 0.5, 'reg_alpha': 1.748623967678637, 'reg_lambda': 3.1351479091991005e-06, 'gamma': 1.0949475747733499e-05}. Best is trial 172 with value: -0.20931359507453345.
[I 2026-07-17 15:55:39,175] Trial 189 finished with value: -0.1530972945509704 and parameters: {'scalers': 'robust', 'ratios': 'log_ratio', 'imputers': 'mean', 'n_estimators': 1850, 'learning_rate': 0.3979631107925884, 'max_depth': 8, 'min_child_weight': 1, 'subsample': 0.6, 'colsample_bytree': 0.7, 'colsample_bylevel': 0.5, 'reg_alpha': 1.5919803781535669, 'reg_lambda': 3.6693441119090046e-06, 'gamma': 1.0264526299120037e-05}. Best is trial 172 with value: -0.20931359507453345.
[I 2026-07-17 15:55:50,496] Trial 190 finished with value: -0.14788160959260158 and parameters: {'scalers': 'standard', 'ratios': 'log_ratio', 'imputers': 'mean', 'n_estimators': 1800, 'learning_rate': 0.3909118416163699, 'max_depth': 8, 'min_child_weight': 1, 'subsample': 0.6, 'colsample_bytree': 0.7, 'colsample_bylevel': 0.5, 'reg_alpha': 0.911164900431767, 'reg_lambda': 5.1357942182459394e-05, 'gamma': 5.382646964159192e-05}. Best is trial 172 with value: -0.20931359507453345.
[I 2026-07-17 15:56:00,644] Trial 191 finished with value: -0.1459994063569609 and parameters: {'scalers': 'standard', 'ratios': 'log_ratio', 'imputers': 'mean', 'n_estimators': 1850, 'learning_rate': 0.3896067162767804, 'max_depth': 8, 'min_child_weight': 1, 'subsample': 0.6, 'colsample_bytree': 0.7, 'colsample_bylevel': 0.5, 'reg_alpha': 1.5869715983293244, 'reg_lambda': 4.757998857861071e-05, 'gamma': 1.1045140968902775e-05}. Best is trial 172 with value: -0.20931359507453345.
[I 2026-07-17 15:56:11,598] Trial 192 finished with value: -0.14027792392919153 and parameters: {'scalers': 'standard', 'ratios': 'log_ratio', 'imputers': 'mean', 'n_estimators': 1850, 'learning_rate': 0.3796350588085745, 'max_depth': 8, 'min_child_weight': 1, 'subsample': 0.6, 'colsample_bytree': 0.7, 'colsample_bylevel': 0.5, 'reg_alpha': 0.8861741641869662, 'reg_lambda': 4.797551362651022e-05, 'gamma': 1.08530860658865e-05}. Best is trial 172 with value: -0.20931359507453345.
[I 2026-07-17 15:56:20,822] Trial 193 finished with value: -0.12995172172486233 and parameters: {'scalers': 'robust', 'ratios': 'log_ratio', 'imputers': 'mean', 'n_estimators': 1850, 'learning_rate': 0.3876512640118516, 'max_depth': 7, 'min_child_weight': 1, 'subsample': 0.6, 'colsample_bytree': 0.7, 'colsample_bylevel': 0.5, 'reg_alpha': 1.0197541568246955, 'reg_lambda': 2.5664679366875384e-06, 'gamma': 1.1221606677637143e-05}. Best is trial 172 with value: -0.20931359507453345.
[I 2026-07-17 15:56:30,097] Trial 194 finished with value: -0.12670964630477935 and parameters: {'scalers': 'robust', 'ratios': 'log_ratio', 'imputers': 'mean', 'n_estimators': 1850, 'learning_rate': 0.37156346831949677, 'max_depth': 7, 'min_child_weight': 1, 'subsample': 0.6, 'colsample_bytree': 0.7, 'colsample_bylevel': 0.5, 'reg_alpha': 1.0076278871190276, 'reg_lambda': 3.531495150860206e-06, 'gamma': 9.618276047710239e-06}. Best is trial 172 with value: -0.20931359507453345.
[I 2026-07-17 15:56:38,725] Trial 195 finished with value: -0.12102183147457066 and parameters: {'scalers': 'robust', 'ratios': 'log_ratio', 'imputers': 'mean', 'n_estimators': 1800, 'learning_rate': 0.3691521354970765, 'max_depth': 7, 'min_child_weight': 1, 'subsample': 0.6, 'colsample_bytree': 0.7, 'colsample_bylevel': 0.5, 'reg_alpha': 0.8855827877166573, 'reg_lambda': 4.930885103861234e-05, 'gamma': 1.0617689865832642e-05}. Best is trial 172 with value: -0.20931359507453345.
[I 2026-07-17 15:56:48,186] Trial 196 finished with value: -0.02109510600579258 and parameters: {'scalers': 'robust', 'ratios': 'log_ratio', 'imputers': 'mean', 'n_estimators': 1850, 'learning_rate': 0.002493250237890698, 'max_depth': 7, 'min_child_weight': 1, 'subsample': 0.6, 'colsample_bytree': 0.7, 'colsample_bylevel': 0.5, 'reg_alpha': 0.9140372526099432, 'reg_lambda': 0.00015948542620987968, 'gamma': 2.3679564778469223e-05}. Best is trial 172 with value: -0.20931359507453345.
[I 2026-07-17 15:56:56,274] Trial 197 finished with value: -0.09914370574967991 and parameters: {'scalers': 'robust', 'ratios': 'log_ratio', 'imputers': 'mean', 'n_estimators': 1750, 'learning_rate': 0.26925873036202763, 'max_depth': 7, 'min_child_weight': 1, 'subsample': 0.6, 'colsample_bytree': 0.7, 'colsample_bylevel': 0.5, 'reg_alpha': 0.9339623260330575, 'reg_lambda': 4.6831716639973986e-05, 'gamma': 2.286475008058135e-05}. Best is trial 172 with value: -0.20931359507453345.
[I 2026-07-17 15:57:05,636] Trial 198 finished with value: -0.14510254693729624 and parameters: {'scalers': 'robust', 'ratios': 'norm_ratio', 'imputers': 'mean', 'n_estimators': 1900, 'learning_rate': 0.4559291858292716, 'max_depth': 7, 'min_child_weight': 1, 'subsample': 0.6, 'colsample_bytree': 0.7, 'colsample_bylevel': 0.5, 'reg_alpha': 1.0197932400767606, 'reg_lambda': 0.00014213761881426857, 'gamma': 6.7220954754443384e-06}. Best is trial 172 with value: -0.20931359507453345.
[I 2026-07-17 15:57:14,422] Trial 199 finished with value: -0.1552621904955655 and parameters: {'scalers': 'robust', 'ratios': 'norm_ratio', 'imputers': 'mean', 'n_estimators': 1750, 'learning_rate': 0.4993404664945332, 'max_depth': 7, 'min_child_weight': 1, 'subsample': 0.6, 'colsample_bytree': 0.7, 'colsample_bylevel': 0.5, 'reg_alpha': 0.9859388782824605, 'reg_lambda': 0.0001489599242247165, 'gamma': 8.042667546241917e-06}. Best is trial 172 with value: -0.20931359507453345.
[I 2026-07-17 15:57:23,144] Trial 200 finished with value: -0.14736360444831814 and parameters: {'scalers': 'robust', 'ratios': 'norm_ratio', 'imputers': 'mean', 'n_estimators': 1750, 'learning_rate': 0.4749843265056884, 'max_depth': 7, 'min_child_weight': 1, 'subsample': 0.6, 'colsample_bytree': 0.7, 'colsample_bylevel': 0.5, 'reg_alpha': 1.128480099174336, 'reg_lambda': 0.00019278799181504997, 'gamma': 2.1822512805855273e-05}. Best is trial 172 with value: -0.20931359507453345.
[I 2026-07-17 15:57:29,671] Trial 201 finished with value: -0.0905177670555801 and parameters: {'scalers': 'robust', 'ratios': 'norm_ratio', 'imputers': 'mean', 'n_estimators': 1750, 'learning_rate': 0.4992319181904683, 'max_depth': 9, 'min_child_weight': 1, 'subsample': 0.6, 'colsample_bytree': 0.7, 'colsample_bylevel': 0.5, 'reg_alpha': 5.438817690714827e-06, 'reg_lambda': 0.00010926474188757018, 'gamma': 6.778921581271894e-06}. Best is trial 172 with value: -0.20931359507453345.
[I 2026-07-17 15:57:44,657] Trial 202 finished with value: -0.1985753451117849 and parameters: {'scalers': 'robust', 'ratios': 'norm_ratio', 'imputers': 'mean', 'n_estimators': 1950, 'learning_rate': 0.4989784310402739, 'max_depth': 9, 'min_child_weight': 1, 'subsample': 0.6, 'colsample_bytree': 0.7, 'colsample_bylevel': 0.5, 'reg_alpha': 1.1094345382708852, 'reg_lambda': 0.0001115337725973618, 'gamma': 2.6949069176925634e-05}. Best is trial 172 with value: -0.20931359507453345.
[I 2026-07-17 15:57:56,395] Trial 203 finished with value: -0.1628471159537322 and parameters: {'scalers': 'robust', 'ratios': 'norm_ratio', 'imputers': 'mean', 'n_estimators': 1950, 'learning_rate': 0.49925843750381227, 'max_depth': 9, 'min_child_weight': 1, 'subsample': 0.6, 'colsample_bytree': 0.7, 'colsample_bylevel': 0.5, 'reg_alpha': 0.44452869797649075, 'reg_lambda': 0.10977840550946281, 'gamma': 2.4928591927891084e-05}. Best is trial 172 with value: -0.20931359507453345.
[I 2026-07-17 15:58:09,339] Trial 204 finished with value: -0.19699417830410232 and parameters: {'scalers': 'robust', 'ratios': 'norm_ratio', 'imputers': 'mean', 'n_estimators': 1750, 'learning_rate': 0.4862826922838329, 'max_depth': 9, 'min_child_weight': 1, 'subsample': 0.6, 'colsample_bytree': 0.7, 'colsample_bylevel': 0.5, 'reg_alpha': 1.2603509026841555, 'reg_lambda': 1.110309317462143e-05, 'gamma': 6.19876205999143e-06}. Best is trial 172 with value: -0.20931359507453345.
[I 2026-07-17 15:58:21,037] Trial 205 finished with value: -0.160384144919688 and parameters: {'scalers': 'robust', 'ratios': 'norm_ratio', 'imputers': 'mean', 'n_estimators': 1950, 'learning_rate': 0.4983350644472735, 'max_depth': 9, 'min_child_weight': 1, 'subsample': 0.6, 'colsample_bytree': 0.7, 'colsample_bylevel': 0.5, 'reg_alpha': 0.44420683693753815, 'reg_lambda': 0.10097100928341735, 'gamma': 5.93106005211043e-06}. Best is trial 172 with value: -0.20931359507453345.
[I 2026-07-17 15:58:32,229] Trial 206 finished with value: -0.1553712210585842 and parameters: {'scalers': 'robust', 'ratios': 'norm_ratio', 'imputers': 'mean', 'n_estimators': 1950, 'learning_rate': 0.49055417616795943, 'max_depth': 9, 'min_child_weight': 1, 'subsample': 0.6, 'colsample_bytree': 0.7, 'colsample_bylevel': 0.5, 'reg_alpha': 0.42976526446189023, 'reg_lambda': 1.1992235626479347e-05, 'gamma': 0.0002166573969735542}. Best is trial 172 with value: -0.20931359507453345.
[I 2026-07-17 15:58:37,688] Trial 207 finished with value: -0.07480647735673043 and parameters: {'scalers': 'robust', 'ratios': 'norm_ratio', 'imputers': 'mean', 'n_estimators': 1950, 'learning_rate': 0.47684109137457936, 'max_depth': 9, 'min_child_weight': 1, 'subsample': 0.6, 'colsample_bytree': 0.7, 'colsample_bylevel': 0.5, 'reg_alpha': 5.404279977592909, 'reg_lambda': 1.1458131840642024e-05, 'gamma': 0.00018714256827700632}. Best is trial 172 with value: -0.20931359507453345.
[I 2026-07-17 15:58:49,638] Trial 208 finished with value: -0.1582802191250891 and parameters: {'scalers': 'robust', 'ratios': 'norm_ratio', 'imputers': 'mean', 'n_estimators': 1950, 'learning_rate': 0.49620327193759667, 'max_depth': 9, 'min_child_weight': 1, 'subsample': 0.6, 'colsample_bytree': 0.7, 'colsample_bylevel': 0.5, 'reg_alpha': 0.47960165100522517, 'reg_lambda': 1.1294634656590782e-05, 'gamma': 0.00020496654174069565}. Best is trial 172 with value: -0.20931359507453345.
[I 2026-07-17 15:58:59,284] Trial 209 finished with value: -0.10089311424394395 and parameters: {'scalers': 'robust', 'ratios': 'norm_ratio', 'imputers': 'mean', 'n_estimators': 1950, 'learning_rate': 0.2814719205362639, 'max_depth': 8, 'min_child_weight': 1, 'subsample': 0.6, 'colsample_bytree': 0.7, 'colsample_bylevel': 0.5, 'reg_alpha': 0.4919424078423108, 'reg_lambda': 1.143063106662343e-05, 'gamma': 5.8338106731962376e-05}. Best is trial 172 with value: -0.20931359507453345.
[I 2026-07-17 15:59:11,061] Trial 210 finished with value: -0.1505974850922494 and parameters: {'scalers': 'robust', 'ratios': 'norm_ratio', 'imputers': 'mean', 'n_estimators': 1950, 'learning_rate': 0.49015496284020893, 'max_depth': 9, 'min_child_weight': 1, 'subsample': 0.6, 'colsample_bytree': 0.7, 'colsample_bylevel': 0.5, 'reg_alpha': 0.4574696661395186, 'reg_lambda': 1.1218252086276824e-05, 'gamma': 1.4116713584523077e-05}. Best is trial 172 with value: -0.20931359507453345.
[I 2026-07-17 15:59:23,685] Trial 211 finished with value: -0.13534876861171527 and parameters: {'scalers': 'robust', 'ratios': 'norm_ratio', 'imputers': 'mean', 'n_estimators': 1950, 'learning_rate': 0.2835991753398017, 'max_depth': 9, 'min_child_weight': 1, 'subsample': 0.6, 'colsample_bytree': 0.7, 'colsample_bylevel': 0.5, 'reg_alpha': 1.3893736385820967, 'reg_lambda': 2.0314720767308687e-05, 'gamma': 0.00022083354267842754}. Best is trial 172 with value: -0.20931359507453345.
[I 2026-07-17 15:59:29,367] Trial 212 finished with value: -0.057391397927357674 and parameters: {'scalers': 'robust', 'ratios': 'norm_ratio', 'imputers': 'mean', 'n_estimators': 1950, 'learning_rate': 0.2843324837513303, 'max_depth': 9, 'min_child_weight': 1, 'subsample': 0.6, 'colsample_bytree': 0.7, 'colsample_bylevel': 0.5, 'reg_alpha': 4.811390249371067, 'reg_lambda': 1.2057611655697322e-05, 'gamma': 0.0002171074662559322}. Best is trial 172 with value: -0.20931359507453345.
[I 2026-07-17 15:59:34,962] Trial 213 finished with value: -0.05104721428512963 and parameters: {'scalers': 'robust', 'ratios': 'norm_ratio', 'imputers': 'mean', 'n_estimators': 1900, 'learning_rate': 0.2888444006858337, 'max_depth': 9, 'min_child_weight': 1, 'subsample': 0.6, 'colsample_bytree': 0.7, 'colsample_bylevel': 0.5, 'reg_alpha': 5.555953290444819, 'reg_lambda': 1.0093855962682737e-05, 'gamma': 5.768402891004572e-05}. Best is trial 172 with value: -0.20931359507453345.
[I 2026-07-17 15:59:44,253] Trial 214 finished with value: -0.11573981412208631 and parameters: {'scalers': 'robust', 'ratios': 'norm_ratio', 'imputers': 'mean', 'n_estimators': 1900, 'learning_rate': 0.2918103092971624, 'max_depth': 9, 'min_child_weight': 1, 'subsample': 0.6, 'colsample_bytree': 0.7, 'colsample_bylevel': 0.5, 'reg_alpha': 2.2948191217637417, 'reg_lambda': 2.1992208610818627e-05, 'gamma': 5.901938013868971e-05}. Best is trial 172 with value: -0.20931359507453345.
[I 2026-07-17 15:59:51,073] Trial 215 finished with value: -0.102996217261786 and parameters: {'scalers': 'robust', 'ratios': 'norm_ratio', 'imputers': 'mean', 'n_estimators': 1400, 'learning_rate': 0.30724160571940473, 'max_depth': 9, 'min_child_weight': 1, 'subsample': 0.6, 'colsample_bytree': 0.7, 'colsample_bylevel': 0.5, 'reg_alpha': 2.4101811651586535, 'reg_lambda': 1.9025640095455374e-05, 'gamma': 5.6713111055362616e-05}. Best is trial 172 with value: -0.20931359507453345.
[I 2026-07-17 16:00:01,127] Trial 216 finished with value: -0.12376807031425388 and parameters: {'scalers': 'none', 'ratios': 'norm_ratio', 'imputers': 'mean', 'n_estimators': 1450, 'learning_rate': 0.2879511796025461, 'max_depth': 9, 'min_child_weight': 1, 'subsample': 0.6, 'colsample_bytree': 0.7, 'colsample_bylevel': 0.5, 'reg_alpha': 1.3655941975826127, 'reg_lambda': 1.7548601103835014e-05, 'gamma': 5.562238125772474e-05}. Best is trial 172 with value: -0.20931359507453345.
[I 2026-07-17 16:00:09,271] Trial 217 finished with value: -0.1216859839028204 and parameters: {'scalers': 'none', 'ratios': 'norm_ratio', 'imputers': 'mean', 'n_estimators': 1450, 'learning_rate': 0.3487139088186784, 'max_depth': 9, 'min_child_weight': 1, 'subsample': 0.6, 'colsample_bytree': 0.7, 'colsample_bylevel': 0.5, 'reg_alpha': 2.094735921914831, 'reg_lambda': 0.2544249228755064, 'gamma': 1.471249793276383e-05}. Best is trial 172 with value: -0.20931359507453345.
[I 2026-07-17 16:00:17,794] Trial 218 finished with value: -0.11325680635999996 and parameters: {'scalers': 'robust', 'ratios': 'norm_ratio', 'imputers': 'mean', 'n_estimators': 1900, 'learning_rate': 0.34857401530170856, 'max_depth': 8, 'min_child_weight': 1, 'subsample': 0.6, 'colsample_bytree': 0.7, 'colsample_bylevel': 0.5, 'reg_alpha': 2.429991550015794, 'reg_lambda': 3.6413640887368876e-05, 'gamma': 2.6998077092531548e-05}. Best is trial 172 with value: -0.20931359507453345.
[I 2026-07-17 16:00:27,542] Trial 219 finished with value: -0.11802701703995326 and parameters: {'scalers': 'robust', 'ratios': 'norm_ratio', 'imputers': 'mean', 'n_estimators': 2200, 'learning_rate': 0.34685766655420386, 'max_depth': 8, 'min_child_weight': 1, 'subsample': 0.6, 'colsample_bytree': 0.7, 'colsample_bylevel': 0.5, 'reg_alpha': 2.4622383595223343, 'reg_lambda': 2.0773143511920015e-05, 'gamma': 2.719407700602442e-05}. Best is trial 172 with value: -0.20931359507453345.
[I 2026-07-17 16:00:36,825] Trial 220 finished with value: -0.11738729280565381 and parameters: {'scalers': 'none', 'ratios': 'norm_ratio', 'imputers': 'mean', 'n_estimators': 1900, 'learning_rate': 0.35580105986146937, 'max_depth': 8, 'min_child_weight': 1, 'subsample': 0.6, 'colsample_bytree': 0.7, 'colsample_bylevel': 0.5, 'reg_alpha': 2.198149948264261, 'reg_lambda': 5.885019453907785e-06, 'gamma': 2.4750785647550094e-05}. Best is trial 172 with value: -0.20931359507453345.
[I 2026-07-17 16:00:44,797] Trial 221 finished with value: -0.10886926020907922 and parameters: {'scalers': 'none', 'ratios': 'norm_ratio', 'imputers': 'mean', 'n_estimators': 1700, 'learning_rate': 0.3505642101363822, 'max_depth': 8, 'min_child_weight': 1, 'subsample': 0.6, 'colsample_bytree': 0.7, 'colsample_bylevel': 0.5, 'reg_alpha': 2.3559209705400206, 'reg_lambda': 0.26880373068984187, 'gamma': 2.628844733346238e-05}. Best is trial 172 with value: -0.20931359507453345.
[I 2026-07-17 16:00:53,327] Trial 222 finished with value: -0.12526614267534614 and parameters: {'scalers': 'none', 'ratios': 'norm_ratio', 'imputers': 'mean', 'n_estimators': 1400, 'learning_rate': 0.35413176256824186, 'max_depth': 8, 'min_child_weight': 1, 'subsample': 0.6, 'colsample_bytree': 0.7, 'colsample_bylevel': 0.5, 'reg_alpha': 1.2303619512613149, 'reg_lambda': 0.2514920760259787, 'gamma': 2.7474013692912125e-05}. Best is trial 172 with value: -0.20931359507453345.
[I 2026-07-17 16:01:04,390] Trial 223 finished with value: -0.16002477320437097 and parameters: {'scalers': 'none', 'ratios': 'norm_ratio', 'imputers': 'mean', 'n_estimators': 1800, 'learning_rate': 0.4203500034894377, 'max_depth': 8, 'min_child_weight': 1, 'subsample': 0.6, 'colsample_bytree': 0.7, 'colsample_bylevel': 0.5, 'reg_alpha': 1.3770557177749534, 'reg_lambda': 6.106213267622913e-06, 'gamma': 2.5896956140940278e-05}. Best is trial 172 with value: -0.20931359507453345.
[I 2026-07-17 16:01:16,954] Trial 224 finished with value: -0.15134976646892948 and parameters: {'scalers': 'robust', 'ratios': 'norm_ratio', 'imputers': 'mean', 'n_estimators': 2200, 'learning_rate': 0.4203018718492916, 'max_depth': 8, 'min_child_weight': 1, 'subsample': 0.6, 'colsample_bytree': 0.7, 'colsample_bylevel': 0.5, 'reg_alpha': 0.7111480246421109, 'reg_lambda': 0.2180065226967475, 'gamma': 2.7053641961383175e-05}. Best is trial 172 with value: -0.20931359507453345.
