[I 2026-07-17 14:27:51,074] Trial 135 finished with value: -0.11334062296767462 and parameters: {'scalers': 'none', 'ratios': 'norm_ratio', 'imputers': 'median', 'n_estimators': 2200, 'learning_rate': 0.33535579048992586, 'max_depth': 11, 'min_child_weight': 1, 'subsample': 0.6, 'colsample_bytree': 0.7, 'colsample_bylevel': 0.9, 'reg_alpha': 3.6514209291823603, 'reg_lambda': 0.02884236159233054, 'gamma': 0.007263970205094103}. Best is trial 101 with value: -0.18742442824914762.
[I 2026-07-17 14:28:20,923] Trial 136 finished with value: -0.15382950408401785 and parameters: {'scalers': 'none', 'ratios': 'log_ratio', 'imputers': 'median', 'n_estimators': 2050, 'learning_rate': 0.3079787576019865, 'max_depth': 11, 'min_child_weight': 1, 'subsample': 0.6, 'colsample_bytree': 0.9, 'colsample_bylevel': 0.9, 'reg_alpha': 0.6281503147100342, 'reg_lambda': 0.0015349907775130277, 'gamma': 0.00651377371674213}. Best is trial 101 with value: -0.18742442824914762.
[I 2026-07-17 14:28:34,528] Trial 137 finished with value: -0.12255468913144667 and parameters: {'scalers': 'none', 'ratios': 'log_ratio', 'imputers': 'median', 'n_estimators': 2000, 'learning_rate': 0.32481048708829996, 'max_depth': 11, 'min_child_weight': 1, 'subsample': 0.6, 'colsample_bytree': 0.9, 'colsample_bylevel': 0.9, 'reg_alpha': 3.3426127254461035, 'reg_lambda': 0.022967156609883813, 'gamma': 0.005505900934893257}. Best is trial 101 with value: -0.18742442824914762.
[I 2026-07-17 14:29:19,950] Trial 138 finished with value: -0.17440876052829304 and parameters: {'scalers': 'none', 'ratios': 'log_ratio', 'imputers': 'median', 'n_estimators': 2900, 'learning_rate': 0.3452199839864397, 'max_depth': 11, 'min_child_weight': 1, 'subsample': 0.6, 'colsample_bytree': 0.9, 'colsample_bylevel': 0.9, 'reg_alpha': 0.7341543242549428, 'reg_lambda': 0.0016734676609439475, 'gamma': 0.007000296556341709}. Best is trial 101 with value: -0.18742442824914762.
[I 2026-07-17 14:29:49,384] Trial 139 finished with value: -0.1613658380488749 and parameters: {'scalers': 'none', 'ratios': 'log_ratio', 'imputers': 'median', 'n_estimators': 2000, 'learning_rate': 0.3700207562876267, 'max_depth': 11, 'min_child_weight': 1, 'subsample': 0.6, 'colsample_bytree': 0.9, 'colsample_bylevel': 0.9, 'reg_alpha': 0.5717287588891636, 'reg_lambda': 0.0018822737725799823, 'gamma': 0.00624693797333551}. Best is trial 101 with value: -0.18742442824914762.
[I 2026-07-17 14:30:19,296] Trial 140 finished with value: -0.15866771714847175 and parameters: {'scalers': 'none', 'ratios': 'log_ratio', 'imputers': 'median', 'n_estimators': 2000, 'learning_rate': 0.34989776771335734, 'max_depth': 11, 'min_child_weight': 1, 'subsample': 0.6, 'colsample_bytree': 0.9, 'colsample_bylevel': 0.9, 'reg_alpha': 0.614666581567712, 'reg_lambda': 0.02870691678331506, 'gamma': 0.005070100175747574}. Best is trial 101 with value: -0.18742442824914762.
[I 2026-07-17 14:30:48,798] Trial 141 finished with value: -0.161423859056657 and parameters: {'scalers': 'none', 'ratios': 'log_ratio', 'imputers': 'median', 'n_estimators': 2200, 'learning_rate': 0.3904134648013678, 'max_depth': 11, 'min_child_weight': 1, 'subsample': 0.6, 'colsample_bytree': 0.9, 'colsample_bylevel': 0.9, 'reg_alpha': 0.4373956271204983, 'reg_lambda': 0.0023451320814619984, 'gamma': 0.00417005573234327}. Best is trial 101 with value: -0.18742442824914762.
[I 2026-07-17 14:31:24,455] Trial 142 finished with value: -0.17016765833928396 and parameters: {'scalers': 'none', 'ratios': 'log_ratio', 'imputers': 'median', 'n_estimators': 2250, 'learning_rate': 0.3574361474763361, 'max_depth': 11, 'min_child_weight': 1, 'subsample': 0.6, 'colsample_bytree': 0.9, 'colsample_bylevel': 0.9, 'reg_alpha': 0.7609688866521063, 'reg_lambda': 1.563009089092788e-05, 'gamma': 0.007466432383336656}. Best is trial 101 with value: -0.18742442824914762.
[I 2026-07-17 14:31:50,781] Trial 143 finished with value: -0.1343150967710898 and parameters: {'scalers': 'none', 'ratios': 'log_ratio', 'imputers': 'median', 'n_estimators': 1950, 'learning_rate': 0.24881313988240836, 'max_depth': 11, 'min_child_weight': 1, 'subsample': 0.6, 'colsample_bytree': 0.9, 'colsample_bylevel': 0.9, 'reg_alpha': 0.5193741054469047, 'reg_lambda': 0.00178980934745137, 'gamma': 0.004396917315359578}. Best is trial 101 with value: -0.18742442824914762.
[I 2026-07-17 14:32:22,588] Trial 144 finished with value: -0.17129064388308782 and parameters: {'scalers': 'none', 'ratios': 'log_ratio', 'imputers': 'median', 'n_estimators': 2000, 'learning_rate': 0.37782668146666404, 'max_depth': 11, 'min_child_weight': 1, 'subsample': 0.6, 'colsample_bytree': 0.9, 'colsample_bylevel': 0.9, 'reg_alpha': 0.7259529695987448, 'reg_lambda': 0.00216946425920985, 'gamma': 0.004665904258141568}. Best is trial 101 with value: -0.18742442824914762.
[I 2026-07-17 14:32:59,243] Trial 145 finished with value: -0.187909142807563 and parameters: {'scalers': 'none', 'ratios': 'log_ratio', 'imputers': 'median', 'n_estimators': 2250, 'learning_rate': 0.4136783383822771, 'max_depth': 11, 'min_child_weight': 1, 'subsample': 0.6, 'colsample_bytree': 0.9, 'colsample_bylevel': 0.9, 'reg_alpha': 0.8281155541600858, 'reg_lambda': 0.0017254288420599693, 'gamma': 0.00453685193810236}. Best is trial 145 with value: -0.187909142807563.
[I 2026-07-17 14:33:45,490] Trial 146 finished with value: -0.18436319322344952 and parameters: {'scalers': 'none', 'ratios': 'log_ratio', 'imputers': 'median', 'n_estimators': 2900, 'learning_rate': 0.38421762360246964, 'max_depth': 11, 'min_child_weight': 1, 'subsample': 0.6, 'colsample_bytree': 0.9, 'colsample_bylevel': 0.9, 'reg_alpha': 0.7216860453497557, 'reg_lambda': 0.0016963729370271386, 'gamma': 0.004393202566699357}. Best is trial 145 with value: -0.187909142807563.
[I 2026-07-17 14:34:02,727] Trial 147 finished with value: -0.060675882615244495 and parameters: {'scalers': 'none', 'ratios': 'log_ratio', 'imputers': 'median', 'n_estimators': 2050, 'learning_rate': 0.4056951924973591, 'max_depth': 11, 'min_child_weight': 9, 'subsample': 0.6, 'colsample_bytree': 0.9, 'colsample_bylevel': 0.9, 'reg_alpha': 0.6865959392612832, 'reg_lambda': 0.0020602658882203527, 'gamma': 0.0033684884241601478}. Best is trial 145 with value: -0.187909142807563.
[I 2026-07-17 14:34:48,660] Trial 148 finished with value: -0.1832593070504376 and parameters: {'scalers': 'none', 'ratios': 'log_ratio', 'imputers': 'median', 'n_estimators': 2900, 'learning_rate': 0.3999096091948832, 'max_depth': 11, 'min_child_weight': 1, 'subsample': 0.6, 'colsample_bytree': 0.9, 'colsample_bylevel': 0.9, 'reg_alpha': 0.685478086918197, 'reg_lambda': 0.0015141228008676312, 'gamma': 0.0036363403456545797}. Best is trial 145 with value: -0.187909142807563.
[I 2026-07-17 14:35:21,557] Trial 149 finished with value: -0.18205280580646144 and parameters: {'scalers': 'none', 'ratios': 'log_ratio', 'imputers': 'median', 'n_estimators': 2050, 'learning_rate': 0.4179466715180462, 'max_depth': 11, 'min_child_weight': 1, 'subsample': 0.6, 'colsample_bytree': 0.9, 'colsample_bylevel': 0.9, 'reg_alpha': 0.7091480627432512, 'reg_lambda': 0.0018317080868795257, 'gamma': 0.0034325166620043446}. Best is trial 145 with value: -0.187909142807563.
[I 2026-07-17 14:35:54,244] Trial 150 finished with value: -0.1404484331757568 and parameters: {'scalers': 'none', 'ratios': 'log_ratio', 'imputers': 'median', 'n_estimators': 2250, 'learning_rate': 0.24295752514550847, 'max_depth': 11, 'min_child_weight': 1, 'subsample': 0.6, 'colsample_bytree': 0.9, 'colsample_bylevel': 0.9, 'reg_alpha': 0.6543076981025285, 'reg_lambda': 0.0017815438756517614, 'gamma': 0.004141330635631552}. Best is trial 145 with value: -0.187909142807563.
[I 2026-07-17 14:36:31,563] Trial 151 finished with value: -0.18693839372503923 and parameters: {'scalers': 'none', 'ratios': 'log_ratio', 'imputers': 'median', 'n_estimators': 2250, 'learning_rate': 0.42474676912634846, 'max_depth': 11, 'min_child_weight': 1, 'subsample': 0.6, 'colsample_bytree': 0.9, 'colsample_bylevel': 0.9, 'reg_alpha': 0.8143139160569495, 'reg_lambda': 0.006188349938564881, 'gamma': 0.003710355554898486}. Best is trial 145 with value: -0.187909142807563.
[I 2026-07-17 14:37:08,214] Trial 152 finished with value: -0.19437414235861394 and parameters: {'scalers': 'none', 'ratios': 'log_ratio', 'imputers': 'median', 'n_estimators': 2250, 'learning_rate': 0.4285810428548933, 'max_depth': 11, 'min_child_weight': 1, 'subsample': 0.6, 'colsample_bytree': 0.9, 'colsample_bylevel': 0.9, 'reg_alpha': 0.8612293464579021, 'reg_lambda': 0.006618038960051942, 'gamma': 0.004188900419572694}. Best is trial 152 with value: -0.19437414235861394.
[I 2026-07-17 14:37:44,667] Trial 153 finished with value: -0.17966232206176527 and parameters: {'scalers': 'none', 'ratios': 'log_ratio', 'imputers': 'median', 'n_estimators': 2250, 'learning_rate': 0.40861723546693585, 'max_depth': 11, 'min_child_weight': 1, 'subsample': 0.6, 'colsample_bytree': 0.9, 'colsample_bylevel': 0.9, 'reg_alpha': 0.7427675357407335, 'reg_lambda': 0.00423095555218267, 'gamma': 0.0027857374488931236}. Best is trial 152 with value: -0.19437414235861394.
[I 2026-07-17 14:38:20,126] Trial 154 finished with value: -0.1883388800876864 and parameters: {'scalers': 'none', 'ratios': 'log_ratio', 'imputers': 'median', 'n_estimators': 2150, 'learning_rate': 0.42474753504996254, 'max_depth': 11, 'min_child_weight': 1, 'subsample': 0.6, 'colsample_bytree': 0.9, 'colsample_bylevel': 0.9, 'reg_alpha': 0.7886120754904323, 'reg_lambda': 0.006293795778167456, 'gamma': 0.002955803251373498}. Best is trial 152 with value: -0.19437414235861394.
[I 2026-07-17 14:38:55,946] Trial 155 finished with value: -0.17416910244049116 and parameters: {'scalers': 'none', 'ratios': 'log_ratio', 'imputers': 'median', 'n_estimators': 2900, 'learning_rate': 0.4258646927720377, 'max_depth': 11, 'min_child_weight': 1, 'subsample': 0.6, 'colsample_bytree': 0.9, 'colsample_bylevel': 0.9, 'reg_alpha': 0.38341062082311905, 'reg_lambda': 0.00589079344912278, 'gamma': 0.0030187318896494034}. Best is trial 152 with value: -0.19437414235861394.
[I 2026-07-17 14:39:33,181] Trial 156 finished with value: -0.1956202131338126 and parameters: {'scalers': 'none', 'ratios': 'log_ratio', 'imputers': 'median', 'n_estimators': 2250, 'learning_rate': 0.42715478892262837, 'max_depth': 11, 'min_child_weight': 1, 'subsample': 0.6, 'colsample_bytree': 0.9, 'colsample_bylevel': 0.9, 'reg_alpha': 0.8340418098477239, 'reg_lambda': 0.008697284306693977, 'gamma': 0.0029546664486112405}. Best is trial 156 with value: -0.1956202131338126.
[I 2026-07-17 14:40:20,374] Trial 157 finished with value: -0.20733920147902754 and parameters: {'scalers': 'none', 'ratios': 'log_ratio', 'imputers': 'median', 'n_estimators': 2850, 'learning_rate': 0.4388902580488924, 'max_depth': 11, 'min_child_weight': 1, 'subsample': 0.6, 'colsample_bytree': 0.9, 'colsample_bylevel': 0.9, 'reg_alpha': 0.8450770542546442, 'reg_lambda': 0.008464265461745129, 'gamma': 0.0029641380805188818}. Best is trial 157 with value: -0.20733920147902754.
[I 2026-07-17 14:41:07,030] Trial 158 finished with value: -0.20067534156989075 and parameters: {'scalers': 'none', 'ratios': 'log_ratio', 'imputers': 'median', 'n_estimators': 2850, 'learning_rate': 0.43289969734709033, 'max_depth': 11, 'min_child_weight': 1, 'subsample': 0.6, 'colsample_bytree': 0.9, 'colsample_bylevel': 0.9, 'reg_alpha': 0.875831328862367, 'reg_lambda': 0.008345326074217434, 'gamma': 0.0028418120476051897}. Best is trial 157 with value: -0.20733920147902754.
[I 2026-07-17 14:41:45,856] Trial 159 finished with value: -0.1866974266999633 and parameters: {'scalers': 'none', 'ratios': 'log_ratio', 'imputers': 'median', 'n_estimators': 2900, 'learning_rate': 0.4416951118113392, 'max_depth': 11, 'min_child_weight': 1, 'subsample': 0.6, 'colsample_bytree': 0.9, 'colsample_bylevel': 0.9, 'reg_alpha': 0.4199740393628595, 'reg_lambda': 0.011225822359039317, 'gamma': 0.0029363582788245086}. Best is trial 157 with value: -0.20733920147902754.
[I 2026-07-17 14:42:31,700] Trial 160 finished with value: -0.23723569172581233 and parameters: {'scalers': 'none', 'ratios': 'log_ratio', 'imputers': 'median', 'n_estimators': 2900, 'learning_rate': 0.4943671839225469, 'max_depth': 11, 'min_child_weight': 1, 'subsample': 0.6, 'colsample_bytree': 0.9, 'colsample_bylevel': 0.9, 'reg_alpha': 0.991321409822289, 'reg_lambda': 0.008007287353834365, 'gamma': 0.002979146229800972}. Best is trial 160 with value: -0.23723569172581233.
[I 2026-07-17 14:43:20,042] Trial 161 finished with value: -0.1998862447750107 and parameters: {'scalers': 'none', 'ratios': 'log_ratio', 'imputers': 'median', 'n_estimators': 2900, 'learning_rate': 0.4300904930500816, 'max_depth': 11, 'min_child_weight': 1, 'subsample': 0.6, 'colsample_bytree': 0.9, 'colsample_bylevel': 0.9, 'reg_alpha': 0.8677998792389744, 'reg_lambda': 0.006550671098996116, 'gamma': 0.002616388865038128}. Best is trial 160 with value: -0.23723569172581233.
[I 2026-07-17 14:43:56,309] Trial 162 finished with value: -0.21734097329500288 and parameters: {'scalers': 'none', 'ratios': 'log_ratio', 'imputers': 'median', 'n_estimators': 2150, 'learning_rate': 0.4936956260495515, 'max_depth': 11, 'min_child_weight': 1, 'subsample': 0.6, 'colsample_bytree': 0.9, 'colsample_bylevel': 0.9, 'reg_alpha': 0.8835580172658736, 'reg_lambda': 0.008129396255846036, 'gamma': 0.002661443161944398}. Best is trial 160 with value: -0.23723569172581233.
[I 2026-07-17 14:44:46,754] Trial 163 finished with value: -0.2249955135933485 and parameters: {'scalers': 'none', 'ratios': 'log_ratio', 'imputers': 'median', 'n_estimators': 2950, 'learning_rate': 0.49765328242774653, 'max_depth': 11, 'min_child_weight': 1, 'subsample': 0.6, 'colsample_bytree': 0.9, 'colsample_bylevel': 0.9, 'reg_alpha': 0.8448851794613587, 'reg_lambda': 0.009193060675067642, 'gamma': 0.002674014006264287}. Best is trial 160 with value: -0.23723569172581233.
[I 2026-07-17 14:45:35,499] Trial 164 finished with value: -0.20879639288122367 and parameters: {'scalers': 'none', 'ratios': 'log_ratio', 'imputers': 'median', 'n_estimators': 2900, 'learning_rate': 0.4547019687106367, 'max_depth': 11, 'min_child_weight': 1, 'subsample': 0.6, 'colsample_bytree': 0.9, 'colsample_bylevel': 0.9, 'reg_alpha': 0.8678140115684092, 'reg_lambda': 0.005982519038986791, 'gamma': 0.002765482925856611}. Best is trial 160 with value: -0.23723569172581233.
[I 2026-07-17 14:46:24,759] Trial 165 finished with value: -0.2130670144137589 and parameters: {'scalers': 'none', 'ratios': 'log_ratio', 'imputers': 'median', 'n_estimators': 2900, 'learning_rate': 0.4741726701014337, 'max_depth': 11, 'min_child_weight': 1, 'subsample': 0.6, 'colsample_bytree': 0.9, 'colsample_bylevel': 0.9, 'reg_alpha': 0.8194470436270975, 'reg_lambda': 0.006450035339609502, 'gamma': 0.0026410256701700184}. Best is trial 160 with value: -0.23723569172581233.
[I 2026-07-17 14:47:06,924] Trial 166 finished with value: -0.2267398274250894 and parameters: {'scalers': 'none', 'ratios': 'log_ratio', 'imputers': 'median', 'n_estimators': 2900, 'learning_rate': 0.4750673471501508, 'max_depth': 10, 'min_child_weight': 1, 'subsample': 0.6, 'colsample_bytree': 0.9, 'colsample_bylevel': 0.9, 'reg_alpha': 0.9334069177307637, 'reg_lambda': 0.009608837104048846, 'gamma': 0.0026337673333603176}. Best is trial 160 with value: -0.23723569172581233.
[I 2026-07-17 14:47:49,751] Trial 167 finished with value: -0.2164649906921513 and parameters: {'scalers': 'none', 'ratios': 'log_ratio', 'imputers': 'median', 'n_estimators': 2900, 'learning_rate': 0.46614106734489413, 'max_depth': 10, 'min_child_weight': 1, 'subsample': 0.6, 'colsample_bytree': 0.9, 'colsample_bylevel': 0.9, 'reg_alpha': 0.9185180685212252, 'reg_lambda': 0.008280110957146616, 'gamma': 0.002592946414781346}. Best is trial 160 with value: -0.23723569172581233.
[I 2026-07-17 14:48:35,837] Trial 168 finished with value: -0.21859626095344045 and parameters: {'scalers': 'none', 'ratios': 'log_ratio', 'imputers': 'median', 'n_estimators': 2900, 'learning_rate': 0.4768305659631445, 'max_depth': 11, 'min_child_weight': 1, 'subsample': 0.6, 'colsample_bytree': 0.9, 'colsample_bylevel': 0.9, 'reg_alpha': 0.9259060762150343, 'reg_lambda': 0.009238990776710383, 'gamma': 0.002762477855550265}. Best is trial 160 with value: -0.23723569172581233.
[I 2026-07-17 14:49:25,300] Trial 169 finished with value: -0.23222227408299267 and parameters: {'scalers': 'none', 'ratios': 'log_ratio', 'imputers': 'median', 'n_estimators': 2900, 'learning_rate': 0.4954053441260917, 'max_depth': 11, 'min_child_weight': 1, 'subsample': 0.6, 'colsample_bytree': 0.9, 'colsample_bylevel': 0.9, 'reg_alpha': 0.8697450396948018, 'reg_lambda': 0.00861940879461522, 'gamma': 0.0026540068611578117}. Best is trial 160 with value: -0.23723569172581233.
[I 2026-07-17 14:50:14,839] Trial 170 finished with value: -0.23017887292637995 and parameters: {'scalers': 'none', 'ratios': 'log_ratio', 'imputers': 'median', 'n_estimators': 2900, 'learning_rate': 0.49922161944300736, 'max_depth': 11, 'min_child_weight': 1, 'subsample': 0.6, 'colsample_bytree': 0.9, 'colsample_bylevel': 0.9, 'reg_alpha': 0.9186017069455035, 'reg_lambda': 0.010615764831125734, 'gamma': 0.0013361106592593866}. Best is trial 160 with value: -0.23723569172581233.
[I 2026-07-17 14:50:55,779] Trial 171 finished with value: -0.23249139140078495 and parameters: {'scalers': 'none', 'ratios': 'log_ratio', 'imputers': 'median', 'n_estimators': 2800, 'learning_rate': 0.4899191435219573, 'max_depth': 10, 'min_child_weight': 1, 'subsample': 0.6, 'colsample_bytree': 0.9, 'colsample_bylevel': 0.9, 'reg_alpha': 0.9913874972126564, 'reg_lambda': 0.01071086902515656, 'gamma': 0.00127016439996889}. Best is trial 160 with value: -0.23723569172581233.
[I 2026-07-17 14:51:36,643] Trial 172 finished with value: -0.24122648393305635 and parameters: {'scalers': 'none', 'ratios': 'log_ratio', 'imputers': 'median', 'n_estimators': 2800, 'learning_rate': 0.49818329885136237, 'max_depth': 10, 'min_child_weight': 1, 'subsample': 0.6, 'colsample_bytree': 0.9, 'colsample_bylevel': 0.9, 'reg_alpha': 1.0578225088819773, 'reg_lambda': 0.011987102419112047, 'gamma': 0.0015553950235494508}. Best is trial 172 with value: -0.24122648393305635.
[I 2026-07-17 14:52:17,446] Trial 173 finished with value: -0.22607217890282727 and parameters: {'scalers': 'none', 'ratios': 'log_ratio', 'imputers': 'median', 'n_estimators': 2800, 'learning_rate': 0.48553476421641073, 'max_depth': 10, 'min_child_weight': 1, 'subsample': 0.6, 'colsample_bytree': 0.9, 'colsample_bylevel': 0.9, 'reg_alpha': 1.1039390954988217, 'reg_lambda': 0.00940845275007356, 'gamma': 0.001325057766047462}. Best is trial 172 with value: -0.24122648393305635.
[I 2026-07-17 14:52:59,425] Trial 174 finished with value: -0.2323569859818906 and parameters: {'scalers': 'none', 'ratios': 'log_ratio', 'imputers': 'median', 'n_estimators': 2800, 'learning_rate': 0.4979309654264737, 'max_depth': 10, 'min_child_weight': 1, 'subsample': 0.6, 'colsample_bytree': 0.9, 'colsample_bylevel': 0.9, 'reg_alpha': 0.9290253915519605, 'reg_lambda': 0.012067487360075596, 'gamma': 0.0014168290990139746}. Best is trial 172 with value: -0.24122648393305635.
[I 2026-07-17 14:53:39,853] Trial 175 finished with value: -0.23197478372697083 and parameters: {'scalers': 'none', 'ratios': 'log_ratio', 'imputers': 'median', 'n_estimators': 2800, 'learning_rate': 0.48885925944363684, 'max_depth': 10, 'min_child_weight': 1, 'subsample': 0.6, 'colsample_bytree': 0.9, 'colsample_bylevel': 0.9, 'reg_alpha': 1.048873925310218, 'reg_lambda': 0.011793602500500251, 'gamma': 0.001356397558293674}. Best is trial 172 with value: -0.24122648393305635.
[I 2026-07-17 14:53:50,186] Trial 176 finished with value: -0.11484075267332998 and parameters: {'scalers': 'none', 'ratios': 'log_ratio', 'imputers': 'median', 'n_estimators': 2800, 'learning_rate': 0.4983869808260533, 'max_depth': 10, 'min_child_weight': 1, 'subsample': 0.6, 'colsample_bytree': 0.9, 'colsample_bylevel': 0.9, 'reg_alpha': 5.353862561968607e-06, 'reg_lambda': 0.01051886089360899, 'gamma': 0.0005782998980000823}. Best is trial 172 with value: -0.24122648393305635.
[I 2026-07-17 14:54:24,808] Trial 177 finished with value: -0.2655131866632439 and parameters: {'scalers': 'none', 'ratios': 'log_ratio', 'imputers': 'median', 'n_estimators': 2750, 'learning_rate': 0.491053206659401, 'max_depth': 10, 'min_child_weight': 1, 'subsample': 0.6, 'colsample_bytree': 0.9, 'colsample_bylevel': 0.9, 'reg_alpha': 1.6940896709641995, 'reg_lambda': 0.01190843310898783, 'gamma': 0.0013639267724238988}. Best is trial 177 with value: -0.2655131866632439.
[I 2026-07-17 14:55:05,239] Trial 178 finished with value: -0.24100314092507827 and parameters: {'scalers': 'none', 'ratios': 'log_ratio', 'imputers': 'median', 'n_estimators': 2800, 'learning_rate': 0.49786834337707364, 'max_depth': 10, 'min_child_weight': 1, 'subsample': 0.6, 'colsample_bytree': 0.9, 'colsample_bylevel': 0.9, 'reg_alpha': 1.0752806312668384, 'reg_lambda': 0.010020543050933996, 'gamma': 0.0012353896074032173}. Best is trial 177 with value: -0.2655131866632439.
[I 2026-07-17 14:55:45,382] Trial 179 finished with value: -0.22723882902142306 and parameters: {'scalers': 'none', 'ratios': 'log_ratio', 'imputers': 'median', 'n_estimators': 2800, 'learning_rate': 0.4712533935117228, 'max_depth': 10, 'min_child_weight': 1, 'subsample': 0.6, 'colsample_bytree': 0.9, 'colsample_bylevel': 0.9, 'reg_alpha': 1.0538875358152486, 'reg_lambda': 0.010819868685521475, 'gamma': 0.001407933612504284}. Best is trial 177 with value: -0.2655131866632439.
