[I 2026-07-17 12:17:26,711] Trial 90 finished with value: -0.13247715435456747 and parameters: {'scalers': 'none', 'ratios': 'norm_ratio', 'imputers': 'median', 'n_estimators': 2400, 'learning_rate': 0.2711304338779228, 'max_depth': 5, 'min_child_weight': 1, 'subsample': 0.5, 'colsample_bytree': 0.5, 'colsample_bylevel': 0.5, 'reg_alpha': 1.519193735713255e-05, 'reg_lambda': 0.05029343885074006, 'gamma': 4.6625099352819606e-05}. Best is trial 83 with value: -0.2933186115445813.
[I 2026-07-17 12:17:34,176] Trial 91 finished with value: -0.2048619063487835 and parameters: {'scalers': 'none', 'ratios': 'norm_ratio', 'imputers': 'median', 'n_estimators': 2400, 'learning_rate': 0.2604513849413298, 'max_depth': 8, 'min_child_weight': 1, 'subsample': 0.5, 'colsample_bytree': 0.5, 'colsample_bylevel': 0.5, 'reg_alpha': 2.7002157177654928e-05, 'reg_lambda': 0.1279522793088197, 'gamma': 5.541756794359287e-05}. Best is trial 83 with value: -0.2933186115445813.
[I 2026-07-17 12:17:41,249] Trial 92 finished with value: -0.2082074246139143 and parameters: {'scalers': 'none', 'ratios': 'norm_ratio', 'imputers': 'median', 'n_estimators': 2300, 'learning_rate': 0.3034079276649837, 'max_depth': 8, 'min_child_weight': 1, 'subsample': 0.5, 'colsample_bytree': 0.5, 'colsample_bylevel': 0.5, 'reg_alpha': 3.3620769653098456e-05, 'reg_lambda': 0.0022938306870621014, 'gamma': 1.4530783267373028e-05}. Best is trial 83 with value: -0.2933186115445813.
[I 2026-07-17 12:17:52,598] Trial 93 finished with value: -0.28978923103232546 and parameters: {'scalers': 'none', 'ratios': 'norm_ratio', 'imputers': 'median', 'n_estimators': 2250, 'learning_rate': 0.32166108611599725, 'max_depth': 8, 'min_child_weight': 1, 'subsample': 0.5, 'colsample_bytree': 0.5, 'colsample_bylevel': 0.5, 'reg_alpha': 1.2896389464648232e-05, 'reg_lambda': 1.38771278422454, 'gamma': 1.5083627901422776e-05}. Best is trial 83 with value: -0.2933186115445813.
[I 2026-07-17 12:17:57,215] Trial 94 finished with value: -0.24180263777916502 and parameters: {'scalers': 'none', 'ratios': 'norm_ratio', 'imputers': 'median', 'n_estimators': 2600, 'learning_rate': 0.35921203599407103, 'max_depth': 8, 'min_child_weight': 1, 'subsample': 0.5, 'colsample_bytree': 0.5, 'colsample_bylevel': 0.5, 'reg_alpha': 0.0001793171266922849, 'reg_lambda': 0.001987930404195587, 'gamma': 0.00026939496911978117}. Best is trial 83 with value: -0.2933186115445813.
[I 2026-07-17 12:18:04,630] Trial 95 finished with value: -0.21973387216993134 and parameters: {'scalers': 'none', 'ratios': 'norm_ratio', 'imputers': 'median', 'n_estimators': 2300, 'learning_rate': 0.3539247311448952, 'max_depth': 8, 'min_child_weight': 1, 'subsample': 0.5, 'colsample_bytree': 0.5, 'colsample_bylevel': 0.6, 'reg_alpha': 1.2082919366575363e-05, 'reg_lambda': 0.0024015161951988634, 'gamma': 1.3295267086415717e-05}. Best is trial 83 with value: -0.2933186115445813.
[I 2026-07-17 12:18:05,361] Trial 96 finished with value: -0.05831556810851086 and parameters: {'scalers': 'none', 'ratios': 'norm_ratio', 'imputers': 'median', 'n_estimators': 2600, 'learning_rate': 0.34956637216417563, 'max_depth': 8, 'min_child_weight': 1, 'subsample': 0.5, 'colsample_bytree': 0.5, 'colsample_bylevel': 0.6, 'reg_alpha': 0.00022307975461646068, 'reg_lambda': 0.001760436908697925, 'gamma': 25.85541069443614}. Best is trial 83 with value: -0.2933186115445813.
[I 2026-07-17 12:18:12,287] Trial 97 finished with value: -0.2245033111301426 and parameters: {'scalers': 'none', 'ratios': 'norm_ratio', 'imputers': 'median', 'n_estimators': 2250, 'learning_rate': 0.3565884005504837, 'max_depth': 8, 'min_child_weight': 1, 'subsample': 0.5, 'colsample_bytree': 0.5, 'colsample_bylevel': 0.5, 'reg_alpha': 3.907834717025918e-06, 'reg_lambda': 0.002181347431485908, 'gamma': 0.00030084729593138733}. Best is trial 83 with value: -0.2933186115445813.
[I 2026-07-17 12:18:20,278] Trial 98 finished with value: -0.23531867874451357 and parameters: {'scalers': 'none', 'ratios': 'norm_ratio', 'imputers': 'median', 'n_estimators': 2600, 'learning_rate': 0.3500232706721527, 'max_depth': 8, 'min_child_weight': 1, 'subsample': 0.5, 'colsample_bytree': 0.5, 'colsample_bylevel': 0.5, 'reg_alpha': 3.879913242274724e-06, 'reg_lambda': 0.0017850737994486794, 'gamma': 1.2754818331943892e-05}. Best is trial 83 with value: -0.2933186115445813.
[I 2026-07-17 12:18:28,144] Trial 99 finished with value: -0.23544351231032593 and parameters: {'scalers': 'none', 'ratios': 'norm_ratio', 'imputers': 'median', 'n_estimators': 2550, 'learning_rate': 0.3511984492986905, 'max_depth': 8, 'min_child_weight': 1, 'subsample': 0.5, 'colsample_bytree': 0.5, 'colsample_bylevel': 0.5, 'reg_alpha': 0.0001758705212988386, 'reg_lambda': 0.0025582119993852116, 'gamma': 1.5643687214834676e-05}. Best is trial 83 with value: -0.2933186115445813.
[I 2026-07-17 12:18:36,210] Trial 100 finished with value: -0.23470689358458308 and parameters: {'scalers': 'none', 'ratios': 'norm_ratio', 'imputers': 'median', 'n_estimators': 2600, 'learning_rate': 0.3459113707692969, 'max_depth': 8, 'min_child_weight': 1, 'subsample': 0.5, 'colsample_bytree': 0.5, 'colsample_bylevel': 0.5, 'reg_alpha': 0.000268418064326639, 'reg_lambda': 0.0021265733528347043, 'gamma': 0.00025920945814105894}. Best is trial 83 with value: -0.2933186115445813.
[I 2026-07-17 12:18:45,616] Trial 101 finished with value: -0.14860090276566154 and parameters: {'scalers': 'none', 'ratios': 'norm_ratio', 'imputers': 'median', 'n_estimators': 2600, 'learning_rate': 0.36271307492496907, 'max_depth': 8, 'min_child_weight': 10, 'subsample': 0.5, 'colsample_bytree': 0.5, 'colsample_bylevel': 0.5, 'reg_alpha': 0.00019102870977519748, 'reg_lambda': 1.831534606946264, 'gamma': 1.5729865224550864e-05}. Best is trial 83 with value: -0.2933186115445813.
[I 2026-07-17 12:18:54,915] Trial 102 finished with value: -0.24558495247825804 and parameters: {'scalers': 'none', 'ratios': 'norm_ratio', 'imputers': 'median', 'n_estimators': 2650, 'learning_rate': 0.20003311862651713, 'max_depth': 8, 'min_child_weight': 1, 'subsample': 0.5, 'colsample_bytree': 0.5, 'colsample_bylevel': 0.5, 'reg_alpha': 0.0002243450217554748, 'reg_lambda': 1.6010056260600651, 'gamma': 0.00028732227936227096}. Best is trial 83 with value: -0.2933186115445813.
[I 2026-07-17 12:19:04,266] Trial 103 finished with value: -0.14130376832416872 and parameters: {'scalers': 'none', 'ratios': 'norm_ratio', 'imputers': 'median', 'n_estimators': 2600, 'learning_rate': 0.3422911932268285, 'max_depth': 8, 'min_child_weight': 10, 'subsample': 0.5, 'colsample_bytree': 0.5, 'colsample_bylevel': 0.5, 'reg_alpha': 4.411664566865167e-05, 'reg_lambda': 0.0022545546241257612, 'gamma': 0.0003312451208129628}. Best is trial 83 with value: -0.2933186115445813.
[I 2026-07-17 12:19:13,439] Trial 104 finished with value: -0.23264654516301828 and parameters: {'scalers': 'none', 'ratios': 'norm_ratio', 'imputers': 'median', 'n_estimators': 2650, 'learning_rate': 0.19335948137270045, 'max_depth': 8, 'min_child_weight': 1, 'subsample': 0.5, 'colsample_bytree': 0.5, 'colsample_bylevel': 0.5, 'reg_alpha': 0.00020120624003556355, 'reg_lambda': 1.2800683818620255, 'gamma': 0.00030699605650807505}. Best is trial 83 with value: -0.2933186115445813.
[I 2026-07-17 12:19:21,605] Trial 105 finished with value: -0.23905257811957978 and parameters: {'scalers': 'none', 'ratios': 'norm_ratio', 'imputers': 'median', 'n_estimators': 2250, 'learning_rate': 0.19846032268312774, 'max_depth': 8, 'min_child_weight': 1, 'subsample': 0.5, 'colsample_bytree': 0.5, 'colsample_bylevel': 0.5, 'reg_alpha': 4.2496694027957155e-05, 'reg_lambda': 1.8680021521865258, 'gamma': 0.0022854420375727014}. Best is trial 83 with value: -0.2933186115445813.
[I 2026-07-17 12:19:30,245] Trial 106 finished with value: -0.1461204184928564 and parameters: {'scalers': 'none', 'ratios': 'norm_ratio', 'imputers': 'median', 'n_estimators': 2550, 'learning_rate': 0.08952448771262726, 'max_depth': 8, 'min_child_weight': 1, 'subsample': 0.5, 'colsample_bytree': 0.6, 'colsample_bylevel': 0.5, 'reg_alpha': 0.0001870794387028451, 'reg_lambda': 0.8993639530399975, 'gamma': 0.0014906198737855414}. Best is trial 83 with value: -0.2933186115445813.
[I 2026-07-17 12:19:40,231] Trial 107 finished with value: -0.12072526046326468 and parameters: {'scalers': 'none', 'ratios': 'norm_ratio', 'imputers': 'median', 'n_estimators': 2650, 'learning_rate': 0.18414222550623377, 'max_depth': 8, 'min_child_weight': 10, 'subsample': 0.5, 'colsample_bytree': 0.6, 'colsample_bylevel': 0.5, 'reg_alpha': 0.00021937128511348834, 'reg_lambda': 3.4650785911232216, 'gamma': 0.00031144679516566026}. Best is trial 83 with value: -0.2933186115445813.
[I 2026-07-17 12:19:48,533] Trial 108 finished with value: -0.22465534553367425 and parameters: {'scalers': 'none', 'ratios': 'norm_ratio', 'imputers': 'median', 'n_estimators': 2650, 'learning_rate': 0.326021203999104, 'max_depth': 8, 'min_child_weight': 1, 'subsample': 0.5, 'colsample_bytree': 0.5, 'colsample_bylevel': 0.5, 'reg_alpha': 0.0002531952709042013, 'reg_lambda': 0.006083135561966725, 'gamma': 0.00026176540841910535}. Best is trial 83 with value: -0.2933186115445813.
[I 2026-07-17 12:19:56,804] Trial 109 finished with value: -0.1864759839217588 and parameters: {'scalers': 'none', 'ratios': 'norm_ratio', 'imputers': 'median', 'n_estimators': 2650, 'learning_rate': 0.21829113939731737, 'max_depth': 8, 'min_child_weight': 1, 'subsample': 0.5, 'colsample_bytree': 0.5, 'colsample_bylevel': 0.5, 'reg_alpha': 5.9795724088272996e-05, 'reg_lambda': 0.005507339249793595, 'gamma': 0.0025663632333770385}. Best is trial 83 with value: -0.2933186115445813.
[I 2026-07-17 12:20:06,241] Trial 110 finished with value: -0.16743522191096882 and parameters: {'scalers': 'none', 'ratios': 'norm_ratio', 'imputers': 'median', 'n_estimators': 3000, 'learning_rate': 0.20199169414418683, 'max_depth': 8, 'min_child_weight': 2, 'subsample': 0.5, 'colsample_bytree': 0.5, 'colsample_bylevel': 0.5, 'reg_alpha': 0.0002982753659182589, 'reg_lambda': 0.006427724202659217, 'gamma': 0.0002363523410539633}. Best is trial 83 with value: -0.2933186115445813.
[I 2026-07-17 12:20:15,723] Trial 111 finished with value: -0.16761540098095826 and parameters: {'scalers': 'none', 'ratios': 'norm_ratio', 'imputers': 'median', 'n_estimators': 3000, 'learning_rate': 0.21249397553001778, 'max_depth': 8, 'min_child_weight': 2, 'subsample': 0.5, 'colsample_bytree': 0.5, 'colsample_bylevel': 0.5, 'reg_alpha': 0.00024262224470423453, 'reg_lambda': 0.005484669137756222, 'gamma': 0.0030392409203264434}. Best is trial 83 with value: -0.2933186115445813.
[I 2026-07-17 12:20:25,565] Trial 112 finished with value: -0.1613468280436661 and parameters: {'scalers': 'none', 'ratios': 'norm_ratio', 'imputers': 'median', 'n_estimators': 3000, 'learning_rate': 0.2028785752666584, 'max_depth': 8, 'min_child_weight': 2, 'subsample': 0.5, 'colsample_bytree': 0.6, 'colsample_bylevel': 0.5, 'reg_alpha': 0.0007180384674370147, 'reg_lambda': 0.00527395723644705, 'gamma': 0.0020083537549653698}. Best is trial 83 with value: -0.2933186115445813.
[I 2026-07-17 12:20:37,460] Trial 113 finished with value: -0.2088773741090638 and parameters: {'scalers': 'none', 'ratios': 'norm_ratio', 'imputers': 'median', 'n_estimators': 2950, 'learning_rate': 0.19748783984482055, 'max_depth': 8, 'min_child_weight': 2, 'subsample': 0.5, 'colsample_bytree': 0.6, 'colsample_bylevel': 0.5, 'reg_alpha': 6.0409443047750536e-05, 'reg_lambda': 3.236190401222548, 'gamma': 0.0019219815538191706}. Best is trial 83 with value: -0.2933186115445813.
[I 2026-07-17 12:20:49,119] Trial 114 finished with value: -0.2176571677971534 and parameters: {'scalers': 'none', 'ratios': 'norm_ratio', 'imputers': 'median', 'n_estimators': 3000, 'learning_rate': 0.19328752869847016, 'max_depth': 8, 'min_child_weight': 2, 'subsample': 0.5, 'colsample_bytree': 0.5, 'colsample_bylevel': 0.5, 'reg_alpha': 6.325660695829587e-05, 'reg_lambda': 4.141132275261036, 'gamma': 0.002629966378176846}. Best is trial 83 with value: -0.2933186115445813.
[I 2026-07-17 12:20:58,709] Trial 115 finished with value: -0.17304369641338246 and parameters: {'scalers': 'none', 'ratios': 'norm_ratio', 'imputers': 'median', 'n_estimators': 3000, 'learning_rate': 0.21678329947393762, 'max_depth': 8, 'min_child_weight': 2, 'subsample': 0.5, 'colsample_bytree': 0.5, 'colsample_bylevel': 0.5, 'reg_alpha': 6.242640021757046e-05, 'reg_lambda': 0.004386116375563091, 'gamma': 8.885836841344112e-05}. Best is trial 83 with value: -0.2933186115445813.
[I 2026-07-17 12:21:11,235] Trial 116 finished with value: -0.23401816928577443 and parameters: {'scalers': 'none', 'ratios': 'norm_ratio', 'imputers': 'median', 'n_estimators': 3000, 'learning_rate': 0.20508134991958324, 'max_depth': 8, 'min_child_weight': 2, 'subsample': 0.5, 'colsample_bytree': 0.5, 'colsample_bylevel': 0.5, 'reg_alpha': 6.576877362509202e-05, 'reg_lambda': 8.945363873790855, 'gamma': 0.004993813038862691}. Best is trial 83 with value: -0.2933186115445813.
[I 2026-07-17 12:21:23,456] Trial 117 finished with value: -0.23984969709839693 and parameters: {'scalers': 'none', 'ratios': 'norm_ratio', 'imputers': 'median', 'n_estimators': 2950, 'learning_rate': 0.21868087458505367, 'max_depth': 8, 'min_child_weight': 2, 'subsample': 0.5, 'colsample_bytree': 0.5, 'colsample_bylevel': 0.5, 'reg_alpha': 0.00032381074936387266, 'reg_lambda': 7.699915306056524, 'gamma': 0.003124239507538908}. Best is trial 83 with value: -0.2933186115445813.
[I 2026-07-17 12:21:31,978] Trial 118 finished with value: -0.1605337562196804 and parameters: {'scalers': 'none', 'ratios': 'norm_ratio', 'imputers': 'median', 'n_estimators': 2750, 'learning_rate': 0.19351294154610005, 'max_depth': 8, 'min_child_weight': 2, 'subsample': 0.5, 'colsample_bytree': 0.5, 'colsample_bylevel': 0.5, 'reg_alpha': 0.00012892984161058917, 'reg_lambda': 0.0009801291315139357, 'gamma': 0.003766260334111222}. Best is trial 83 with value: -0.2933186115445813.
[I 2026-07-17 12:21:40,522] Trial 119 finished with value: -0.1519647780551109 and parameters: {'scalers': 'none', 'ratios': 'norm_ratio', 'imputers': 'median', 'n_estimators': 2750, 'learning_rate': 0.17727125736529775, 'max_depth': 8, 'min_child_weight': 2, 'subsample': 0.5, 'colsample_bytree': 0.5, 'colsample_bylevel': 0.5, 'reg_alpha': 0.0006736119954144017, 'reg_lambda': 0.0010463229426237208, 'gamma': 0.000560430665500305}. Best is trial 83 with value: -0.2933186115445813.
[I 2026-07-17 12:21:51,881] Trial 120 finished with value: -0.23186513558053667 and parameters: {'scalers': 'none', 'ratios': 'norm_ratio', 'imputers': 'median', 'n_estimators': 2750, 'learning_rate': 0.09635902889529355, 'max_depth': 8, 'min_child_weight': 1, 'subsample': 0.5, 'colsample_bytree': 0.5, 'colsample_bylevel': 0.5, 'reg_alpha': 0.00012214764686329898, 'reg_lambda': 9.56781143986421, 'gamma': 0.0005036237584739422}. Best is trial 83 with value: -0.2933186115445813.
[I 2026-07-17 12:22:08,153] Trial 121 finished with value: -0.522241174443704 and parameters: {'scalers': 'none', 'ratios': 'norm_ratio', 'imputers': 'median', 'n_estimators': 2800, 'learning_rate': 0.3209098845133436, 'max_depth': 9, 'min_child_weight': 1, 'subsample': 0.5, 'colsample_bytree': 0.5, 'colsample_bylevel': 0.5, 'reg_alpha': 0.00012174003781258313, 'reg_lambda': 12.729643125002584, 'gamma': 0.0006506562948314419}. Best is trial 121 with value: -0.522241174443704.
[I 2026-07-17 12:22:18,013] Trial 122 finished with value: -0.10446011682608286 and parameters: {'scalers': 'none', 'ratios': 'norm_ratio', 'imputers': 'median', 'n_estimators': 2750, 'learning_rate': 0.09096370942475074, 'max_depth': 9, 'min_child_weight': 9, 'subsample': 0.5, 'colsample_bytree': 0.5, 'colsample_bylevel': 0.5, 'reg_alpha': 0.00011792072976909014, 'reg_lambda': 0.0009399160712329037, 'gamma': 0.000467844893217026}. Best is trial 121 with value: -0.522241174443704.
[I 2026-07-17 12:22:31,977] Trial 123 finished with value: -0.27140560643819417 and parameters: {'scalers': 'none', 'ratios': 'log_ratio', 'imputers': 'median', 'n_estimators': 2850, 'learning_rate': 0.10402335932694626, 'max_depth': 9, 'min_child_weight': 1, 'subsample': 0.5, 'colsample_bytree': 0.5, 'colsample_bylevel': 0.5, 'reg_alpha': 0.0001269405037612404, 'reg_lambda': 9.158807761848196, 'gamma': 0.0003933622002556848}. Best is trial 121 with value: -0.522241174443704.
[I 2026-07-17 12:22:41,707] Trial 124 finished with value: -0.24295865764614005 and parameters: {'scalers': 'none', 'ratios': 'log_ratio', 'imputers': 'median', 'n_estimators': 2750, 'learning_rate': 0.2998638613782993, 'max_depth': 9, 'min_child_weight': 1, 'subsample': 0.5, 'colsample_bytree': 0.5, 'colsample_bylevel': 0.5, 'reg_alpha': 0.00011381294984043488, 'reg_lambda': 0.0011148679659597034, 'gamma': 0.0004971781575259549}. Best is trial 121 with value: -0.522241174443704.
[I 2026-07-17 12:22:53,108] Trial 125 finished with value: -0.1859655903824526 and parameters: {'scalers': 'none', 'ratios': 'log_ratio', 'imputers': 'median', 'n_estimators': 2500, 'learning_rate': 0.09066794076480862, 'max_depth': 9, 'min_child_weight': 2, 'subsample': 0.5, 'colsample_bytree': 0.5, 'colsample_bylevel': 0.5, 'reg_alpha': 0.00011740905716002804, 'reg_lambda': 16.850275334638688, 'gamma': 0.0005332985540455234}. Best is trial 121 with value: -0.522241174443704.
[I 2026-07-17 12:23:03,001] Trial 126 finished with value: -0.10833661038039583 and parameters: {'scalers': 'none', 'ratios': 'log_ratio', 'imputers': 'median', 'n_estimators': 2850, 'learning_rate': 0.09328468598339412, 'max_depth': 9, 'min_child_weight': 9, 'subsample': 0.5, 'colsample_bytree': 0.5, 'colsample_bylevel': 0.5, 'reg_alpha': 0.00043954574255952933, 'reg_lambda': 13.038939952143043, 'gamma': 0.006694461891074097}. Best is trial 121 with value: -0.522241174443704.
[I 2026-07-17 12:23:14,405] Trial 127 finished with value: -0.15210984240417152 and parameters: {'scalers': 'none', 'ratios': 'log_ratio', 'imputers': 'median', 'n_estimators': 2850, 'learning_rate': 0.30943501694199044, 'max_depth': 9, 'min_child_weight': 9, 'subsample': 0.5, 'colsample_bytree': 0.5, 'colsample_bylevel': 0.5, 'reg_alpha': 0.0003758101817567478, 'reg_lambda': 11.174618897289433, 'gamma': 0.004381791822015081}. Best is trial 121 with value: -0.522241174443704.
[I 2026-07-17 12:23:24,407] Trial 128 finished with value: -0.10902005166536219 and parameters: {'scalers': 'none', 'ratios': 'log_ratio', 'imputers': 'median', 'n_estimators': 2850, 'learning_rate': 0.10332883384208823, 'max_depth': 9, 'min_child_weight': 9, 'subsample': 0.5, 'colsample_bytree': 0.5, 'colsample_bylevel': 0.5, 'reg_alpha': 0.00036279852370548274, 'reg_lambda': 12.326209407678537, 'gamma': 0.005914286150408324}. Best is trial 121 with value: -0.522241174443704.
[I 2026-07-17 12:23:41,673] Trial 129 finished with value: -0.5757307880310627 and parameters: {'scalers': 'none', 'ratios': 'log_ratio', 'imputers': 'median', 'n_estimators': 2900, 'learning_rate': 0.30801667829087165, 'max_depth': 9, 'min_child_weight': 1, 'subsample': 0.5, 'colsample_bytree': 0.5, 'colsample_bylevel': 0.5, 'reg_alpha': 0.0003326127272747074, 'reg_lambda': 21.79586612623037, 'gamma': 0.0011857350215224904}. Best is trial 129 with value: -0.5757307880310627.
[I 2026-07-17 12:23:57,358] Trial 130 finished with value: -0.05792639028292327 and parameters: {'scalers': 'none', 'ratios': 'log_ratio', 'imputers': 'median', 'n_estimators': 2850, 'learning_rate': 0.0001170026570849201, 'max_depth': 9, 'min_child_weight': 1, 'subsample': 0.5, 'colsample_bytree': 0.5, 'colsample_bylevel': 0.5, 'reg_alpha': 0.00041690597549574247, 'reg_lambda': 35.34898460024056, 'gamma': 0.0010328705676916807}. Best is trial 129 with value: -0.5757307880310627.
[I 2026-07-17 12:24:11,728] Trial 131 finished with value: -0.21488128247714436 and parameters: {'scalers': 'none', 'ratios': 'log_ratio', 'imputers': 'median', 'n_estimators': 2900, 'learning_rate': 0.06141914961753987, 'max_depth': 9, 'min_child_weight': 1, 'subsample': 0.5, 'colsample_bytree': 0.5, 'colsample_bylevel': 0.5, 'reg_alpha': 0.00043044888320394666, 'reg_lambda': 24.676717501774366, 'gamma': 0.008318591457011793}. Best is trial 129 with value: -0.5757307880310627.
[I 2026-07-17 12:24:28,496] Trial 132 finished with value: -0.6079546728696329 and parameters: {'scalers': 'none', 'ratios': 'log_ratio', 'imputers': 'median', 'n_estimators': 2850, 'learning_rate': 0.3095019960241686, 'max_depth': 9, 'min_child_weight': 1, 'subsample': 0.5, 'colsample_bytree': 0.5, 'colsample_bylevel': 0.5, 'reg_alpha': 0.00040615017821151226, 'reg_lambda': 29.670845542851296, 'gamma': 0.0009554546812180185}. Best is trial 132 with value: -0.6079546728696329.
[I 2026-07-17 12:24:39,662] Trial 133 finished with value: -0.17409473272328035 and parameters: {'scalers': 'none', 'ratios': 'log_ratio', 'imputers': 'median', 'n_estimators': 2850, 'learning_rate': 0.06125984672626076, 'max_depth': 9, 'min_child_weight': 1, 'subsample': 0.5, 'colsample_bytree': 0.5, 'colsample_bylevel': 0.5, 'reg_alpha': 4.190349470575777e-05, 'reg_lambda': 2.1530928687377737, 'gamma': 0.0001129894769264429}. Best is trial 132 with value: -0.6079546728696329.
[I 2026-07-17 12:24:52,201] Trial 134 finished with value: -0.3860967605920578 and parameters: {'scalers': 'none', 'ratios': 'log_ratio', 'imputers': 'median', 'n_estimators': 2850, 'learning_rate': 0.303331198832339, 'max_depth': 9, 'min_child_weight': 1, 'subsample': 0.5, 'colsample_bytree': 0.5, 'colsample_bylevel': 0.5, 'reg_alpha': 0.0003163498736890492, 'reg_lambda': 2.2105291107880998, 'gamma': 0.0009259271544048309}. Best is trial 132 with value: -0.6079546728696329.
