[I 2026-07-17 16:19:31,780] Trial 315 finished with value: -0.21308650487951042 and parameters: {'scalers': 'robust', 'ratios': 'norm_ratio', 'imputers': 'median', 'n_estimators': 1950, 'learning_rate': 0.4961461082084257, 'max_depth': 9, 'min_child_weight': 1, 'subsample': 0.6, 'colsample_bytree': 0.6, 'colsample_bylevel': 0.5, 'reg_alpha': 1.4984667037426986, 'reg_lambda': 7.558819720298225e-06, 'gamma': 2.0718350632596577e-05}. Best is trial 287 with value: -0.21811802017155413.
[I 2026-07-17 16:19:43,355] Trial 316 finished with value: -0.1271689769706147 and parameters: {'scalers': 'robust', 'ratios': 'norm_ratio', 'imputers': 'median', 'n_estimators': 1950, 'learning_rate': 0.2580216601658693, 'max_depth': 9, 'min_child_weight': 1, 'subsample': 0.6, 'colsample_bytree': 0.6, 'colsample_bylevel': 0.5, 'reg_alpha': 1.4420093408231458, 'reg_lambda': 0.13757507405921335, 'gamma': 4.512011439429139e-06}. Best is trial 287 with value: -0.21811802017155413.
[I 2026-07-17 16:19:55,910] Trial 317 finished with value: -0.1343891010942636 and parameters: {'scalers': 'robust', 'ratios': 'norm_ratio', 'imputers': 'median', 'n_estimators': 2150, 'learning_rate': 0.25512505744125547, 'max_depth': 9, 'min_child_weight': 1, 'subsample': 0.6, 'colsample_bytree': 0.6, 'colsample_bylevel': 0.5, 'reg_alpha': 1.4312437300590777, 'reg_lambda': 0.38605613460094707, 'gamma': 7.0309580716030605e-06}. Best is trial 287 with value: -0.21811802017155413.
[I 2026-07-17 16:20:10,312] Trial 318 finished with value: -0.19424030497855277 and parameters: {'scalers': 'robust', 'ratios': 'norm_ratio', 'imputers': 'median', 'n_estimators': 2150, 'learning_rate': 0.4981029593367951, 'max_depth': 9, 'min_child_weight': 1, 'subsample': 0.6, 'colsample_bytree': 0.6, 'colsample_bylevel': 0.5, 'reg_alpha': 0.7242803093603605, 'reg_lambda': 4.718386402594504e-06, 'gamma': 4.706028804547482e-06}. Best is trial 287 with value: -0.21811802017155413.
[I 2026-07-17 16:20:22,600] Trial 319 finished with value: -0.12692776590556723 and parameters: {'scalers': 'robust', 'ratios': 'norm_ratio', 'imputers': 'median', 'n_estimators': 2150, 'learning_rate': 0.23936384572190994, 'max_depth': 9, 'min_child_weight': 1, 'subsample': 0.6, 'colsample_bytree': 0.6, 'colsample_bylevel': 0.5, 'reg_alpha': 1.3870416060064756, 'reg_lambda': 9.01207606548056e-06, 'gamma': 2.1105838987480262e-06}. Best is trial 287 with value: -0.21811802017155413.
