[I 2026-07-17 16:22:46,957] Trial 135 finished with value: -1.488003759161086 and parameters: {'scalers': 'standard', 'ratios': 'norm_ratio', 'imputers': 'median', 'n_estimators': 2850, 'learning_rate': 0.2901213925853772, 'max_depth': 9, 'min_child_weight': 1, 'subsample': 0.5, 'colsample_bytree': 0.5, 'colsample_bylevel': 0.5, 'reg_alpha': 0.27257508983416795, 'reg_lambda': 1.728707182188954e-06, 'gamma': 0.007959267148406076}. Best is trial 126 with value: -2.34150980106467.
[I 2026-07-17 16:22:54,477] Trial 136 finished with value: -1.255828092476204 and parameters: {'scalers': 'robust', 'ratios': 'norm_ratio', 'imputers': 'median', 'n_estimators': 2850, 'learning_rate': 0.2906707287109863, 'max_depth': 9, 'min_child_weight': 1, 'subsample': 0.5, 'colsample_bytree': 0.5, 'colsample_bylevel': 0.5, 'reg_alpha': 0.35131424132594563, 'reg_lambda': 2.2532750389782582e-06, 'gamma': 0.11726794345565528}. Best is trial 126 with value: -2.34150980106467.
[I 2026-07-17 16:23:03,062] Trial 137 finished with value: -1.6315140848617578 and parameters: {'scalers': 'robust', 'ratios': 'norm_ratio', 'imputers': 'median', 'n_estimators': 2850, 'learning_rate': 0.29875422863044326, 'max_depth': 11, 'min_child_weight': 1, 'subsample': 0.5, 'colsample_bytree': 0.5, 'colsample_bylevel': 0.5, 'reg_alpha': 0.46108688824992444, 'reg_lambda': 2.3353760904831794e-06, 'gamma': 0.10459146990660673}. Best is trial 126 with value: -2.34150980106467.
[I 2026-07-17 16:23:16,539] Trial 138 finished with value: -1.575541981864596 and parameters: {'scalers': 'standard', 'ratios': 'norm_ratio', 'imputers': 'mean', 'n_estimators': 2850, 'learning_rate': 0.2989339894665484, 'max_depth': 9, 'min_child_weight': 1, 'subsample': 0.5, 'colsample_bytree': 0.5, 'colsample_bylevel': 0.5, 'reg_alpha': 0.3799947446560151, 'reg_lambda': 2.0535521688973355e-06, 'gamma': 0.00913168712386832}. Best is trial 126 with value: -2.34150980106467.
[I 2026-07-17 16:23:26,652] Trial 139 finished with value: -1.6225015782362937 and parameters: {'scalers': 'standard', 'ratios': 'norm_ratio', 'imputers': 'median', 'n_estimators': 2850, 'learning_rate': 0.2952164657107703, 'max_depth': 11, 'min_child_weight': 1, 'subsample': 0.5, 'colsample_bytree': 0.5, 'colsample_bylevel': 0.5, 'reg_alpha': 0.36958641249833046, 'reg_lambda': 0.6665724371714375, 'gamma': 0.09805008167480145}. Best is trial 126 with value: -2.34150980106467.
[I 2026-07-17 16:23:39,610] Trial 140 finished with value: -1.5267109357403543 and parameters: {'scalers': 'robust', 'ratios': 'norm_ratio', 'imputers': 'mean', 'n_estimators': 2850, 'learning_rate': 0.29554013059318995, 'max_depth': 9, 'min_child_weight': 1, 'subsample': 0.5, 'colsample_bytree': 0.5, 'colsample_bylevel': 0.5, 'reg_alpha': 0.3178723139065339, 'reg_lambda': 1.7462740038902648e-06, 'gamma': 0.007524648474140789}. Best is trial 126 with value: -2.34150980106467.
[I 2026-07-17 16:23:52,221] Trial 141 finished with value: -1.4499052658748945 and parameters: {'scalers': 'robust', 'ratios': 'norm_ratio', 'imputers': 'median', 'n_estimators': 2850, 'learning_rate': 0.2895933831790843, 'max_depth': 9, 'min_child_weight': 1, 'subsample': 0.5, 'colsample_bytree': 0.5, 'colsample_bylevel': 0.5, 'reg_alpha': 0.30780711419991935, 'reg_lambda': 4.3397906470811015e-05, 'gamma': 0.008268253121564546}. Best is trial 126 with value: -2.34150980106467.
[I 2026-07-17 16:24:01,504] Trial 142 finished with value: -1.4776354911354725 and parameters: {'scalers': 'robust', 'ratios': 'norm_ratio', 'imputers': 'median', 'n_estimators': 2850, 'learning_rate': 0.29453410079848763, 'max_depth': 9, 'min_child_weight': 1, 'subsample': 0.5, 'colsample_bytree': 0.5, 'colsample_bylevel': 0.5, 'reg_alpha': 0.32893515433428416, 'reg_lambda': 0.788912311660091, 'gamma': 0.09877836410321136}. Best is trial 126 with value: -2.34150980106467.
[I 2026-07-17 16:24:14,861] Trial 143 finished with value: -1.6270370790430606 and parameters: {'scalers': 'robust', 'ratios': 'norm_ratio', 'imputers': 'median', 'n_estimators': 2650, 'learning_rate': 0.29631560850051974, 'max_depth': 9, 'min_child_weight': 1, 'subsample': 0.5, 'colsample_bytree': 0.5, 'colsample_bylevel': 0.5, 'reg_alpha': 0.3541844591045705, 'reg_lambda': 0.6356480989450836, 'gamma': 0.005809377747200574}. Best is trial 126 with value: -2.34150980106467.
[I 2026-07-17 16:24:26,366] Trial 144 finished with value: -1.4338663442399806 and parameters: {'scalers': 'standard', 'ratios': 'norm_ratio', 'imputers': 'median', 'n_estimators': 2650, 'learning_rate': 0.29879906242919124, 'max_depth': 9, 'min_child_weight': 1, 'subsample': 0.5, 'colsample_bytree': 0.5, 'colsample_bylevel': 0.5, 'reg_alpha': 0.1686686145070719, 'reg_lambda': 0.54401084310933, 'gamma': 0.005517793168185669}. Best is trial 126 with value: -2.34150980106467.
[I 2026-07-17 16:24:27,394] Trial 145 finished with value: -0.36787813643813005 and parameters: {'scalers': 'robust', 'ratios': 'norm_ratio', 'imputers': 'median', 'n_estimators': 2650, 'learning_rate': 0.287316725832825, 'max_depth': 9, 'min_child_weight': 1, 'subsample': 0.5, 'colsample_bytree': 0.5, 'colsample_bylevel': 0.5, 'reg_alpha': 0.16457890243377035, 'reg_lambda': 5.36438299526261e-05, 'gamma': 0.2367982360510173}. Best is trial 126 with value: -2.34150980106467.
[I 2026-07-17 16:24:29,818] Trial 146 finished with value: -0.23989135043058743 and parameters: {'scalers': 'robust', 'ratios': 'norm_ratio', 'imputers': 'median', 'n_estimators': 2650, 'learning_rate': 0.15698519668672803, 'max_depth': 9, 'min_child_weight': 1, 'subsample': 0.5, 'colsample_bytree': 0.5, 'colsample_bylevel': 0.5, 'reg_alpha': 0.1841851534630669, 'reg_lambda': 0.9427094388632264, 'gamma': 0.2960473362849754}. Best is trial 126 with value: -2.34150980106467.
[I 2026-07-17 16:24:32,208] Trial 147 finished with value: -0.2372586876810247 and parameters: {'scalers': 'robust', 'ratios': 'norm_ratio', 'imputers': 'median', 'n_estimators': 2650, 'learning_rate': 0.15450903175314845, 'max_depth': 9, 'min_child_weight': 1, 'subsample': 0.5, 'colsample_bytree': 0.5, 'colsample_bylevel': 0.5, 'reg_alpha': 0.20175448871690022, 'reg_lambda': 0.535699731438376, 'gamma': 0.5265985591570356}. Best is trial 126 with value: -2.34150980106467.
[I 2026-07-17 16:24:34,605] Trial 148 finished with value: -0.24494615514871204 and parameters: {'scalers': 'robust', 'ratios': 'norm_ratio', 'imputers': 'median', 'n_estimators': 2650, 'learning_rate': 0.3993935106258921, 'max_depth': 9, 'min_child_weight': 1, 'subsample': 0.5, 'colsample_bytree': 0.5, 'colsample_bylevel': 0.5, 'reg_alpha': 0.1862735405683501, 'reg_lambda': 1.2997211895597491, 'gamma': 0.35198657269339023}. Best is trial 126 with value: -2.34150980106467.
[I 2026-07-17 16:24:37,064] Trial 149 finished with value: -0.2386219527290562 and parameters: {'scalers': 'robust', 'ratios': 'norm_ratio', 'imputers': 'median', 'n_estimators': 2650, 'learning_rate': 0.017363120958137905, 'max_depth': 11, 'min_child_weight': 1, 'subsample': 0.5, 'colsample_bytree': 0.5, 'colsample_bylevel': 0.5, 'reg_alpha': 0.2105171098232271, 'reg_lambda': 0.7383487776552647, 'gamma': 0.3751173988523291}. Best is trial 126 with value: -2.34150980106467.
[I 2026-07-17 16:24:53,095] Trial 150 finished with value: -0.585447783942269 and parameters: {'scalers': 'robust', 'ratios': 'norm_ratio', 'imputers': 'median', 'n_estimators': 2650, 'learning_rate': 0.018675524758498728, 'max_depth': 11, 'min_child_weight': 1, 'subsample': 0.5, 'colsample_bytree': 0.5, 'colsample_bylevel': 0.5, 'reg_alpha': 0.19614723580187202, 'reg_lambda': 0.4547737419618026, 'gamma': 0.0049223790898497285}. Best is trial 126 with value: -2.34150980106467.
[I 2026-07-17 16:24:55,543] Trial 151 finished with value: -0.2477942858165431 and parameters: {'scalers': 'robust', 'ratios': 'norm_ratio', 'imputers': 'median', 'n_estimators': 2650, 'learning_rate': 0.14228266502968162, 'max_depth': 7, 'min_child_weight': 1, 'subsample': 0.5, 'colsample_bytree': 0.5, 'colsample_bylevel': 0.5, 'reg_alpha': 0.16339794704192995, 'reg_lambda': 0.5292682579225656, 'gamma': 0.3180555712671089}. Best is trial 126 with value: -2.34150980106467.
[I 2026-07-17 16:25:04,261] Trial 152 finished with value: -1.6201487076979235 and parameters: {'scalers': 'robust', 'ratios': 'norm_ratio', 'imputers': 'median', 'n_estimators': 2750, 'learning_rate': 0.40019045200354947, 'max_depth': 7, 'min_child_weight': 1, 'subsample': 0.5, 'colsample_bytree': 0.5, 'colsample_bylevel': 0.5, 'reg_alpha': 0.232522889206489, 'reg_lambda': 1.1422990318508675, 'gamma': 0.04490866186490784}. Best is trial 126 with value: -2.34150980106467.
[I 2026-07-17 16:25:06,728] Trial 153 finished with value: -0.2384901825764176 and parameters: {'scalers': 'robust', 'ratios': 'norm_ratio', 'imputers': 'median', 'n_estimators': 2750, 'learning_rate': 0.16145675335104365, 'max_depth': 11, 'min_child_weight': 1, 'subsample': 0.5, 'colsample_bytree': 0.5, 'colsample_bylevel': 0.5, 'reg_alpha': 0.10482615462761169, 'reg_lambda': 0.6374489358338601, 'gamma': 0.5242489626690573}. Best is trial 126 with value: -2.34150980106467.
[I 2026-07-17 16:25:16,592] Trial 154 finished with value: -0.24640098830402213 and parameters: {'scalers': 'robust', 'ratios': 'norm_ratio', 'imputers': 'median', 'n_estimators': 2750, 'learning_rate': 0.0013635497497409249, 'max_depth': 11, 'min_child_weight': 1, 'subsample': 0.5, 'colsample_bytree': 0.5, 'colsample_bylevel': 0.5, 'reg_alpha': 1.6478108306970538, 'reg_lambda': 5.89247787857124e-06, 'gamma': 0.0053071862930780984}. Best is trial 126 with value: -2.34150980106467.
[I 2026-07-17 16:25:25,450] Trial 155 finished with value: -1.7253627835834418 and parameters: {'scalers': 'robust', 'ratios': 'norm_ratio', 'imputers': 'median', 'n_estimators': 2750, 'learning_rate': 0.40542322980050577, 'max_depth': 7, 'min_child_weight': 1, 'subsample': 0.5, 'colsample_bytree': 0.5, 'colsample_bylevel': 0.5, 'reg_alpha': 0.5082363106092582, 'reg_lambda': 5.98810556735945e-06, 'gamma': 0.045717312781553936}. Best is trial 126 with value: -2.34150980106467.
[I 2026-07-17 16:25:40,542] Trial 156 finished with value: -1.7740624046078195 and parameters: {'scalers': 'standard', 'ratios': 'norm_ratio', 'imputers': 'median', 'n_estimators': 2750, 'learning_rate': 0.3945788693882936, 'max_depth': 11, 'min_child_weight': 1, 'subsample': 0.5, 'colsample_bytree': 0.5, 'colsample_bylevel': 0.5, 'reg_alpha': 0.10305501121007443, 'reg_lambda': 5.404164090733778e-06, 'gamma': 0.005129455685967598}. Best is trial 126 with value: -2.34150980106467.
[I 2026-07-17 16:25:47,411] Trial 157 finished with value: -0.6924381219177557 and parameters: {'scalers': 'robust', 'ratios': 'norm_ratio', 'imputers': 'median', 'n_estimators': 2750, 'learning_rate': 0.2415400999199008, 'max_depth': 5, 'min_child_weight': 1, 'subsample': 0.5, 'colsample_bytree': 0.5, 'colsample_bylevel': 0.5, 'reg_alpha': 1.7684994327717343, 'reg_lambda': 5.007481907055248e-06, 'gamma': 0.0058882812529997145}. Best is trial 126 with value: -2.34150980106467.
[I 2026-07-17 16:26:04,950] Trial 158 finished with value: -2.4398207865163997 and parameters: {'scalers': 'standard', 'ratios': 'norm_ratio', 'imputers': 'median', 'n_estimators': 2750, 'learning_rate': 0.412385129293585, 'max_depth': 11, 'min_child_weight': 1, 'subsample': 0.5, 'colsample_bytree': 0.5, 'colsample_bylevel': 0.5, 'reg_alpha': 0.5622784917045371, 'reg_lambda': 0.3310346290396513, 'gamma': 0.04318252962071297}. Best is trial 158 with value: -2.4398207865163997.
[I 2026-07-17 16:26:17,985] Trial 159 finished with value: -3.054615200567047 and parameters: {'scalers': 'standard', 'ratios': 'norm_ratio', 'imputers': 'median', 'n_estimators': 2750, 'learning_rate': 0.3892978939377136, 'max_depth': 11, 'min_child_weight': 1, 'subsample': 0.5, 'colsample_bytree': 0.5, 'colsample_bylevel': 0.5, 'reg_alpha': 1.7147087392932336, 'reg_lambda': 6.189310824996183, 'gamma': 0.005429489371573717}. Best is trial 159 with value: -3.054615200567047.
[I 2026-07-17 16:26:25,914] Trial 160 finished with value: -1.1871005162564774 and parameters: {'scalers': 'robust', 'ratios': 'norm_ratio', 'imputers': 'median', 'n_estimators': 2900, 'learning_rate': 0.3964795406346545, 'max_depth': 7, 'min_child_weight': 1, 'subsample': 0.5, 'colsample_bytree': 0.5, 'colsample_bylevel': 0.5, 'reg_alpha': 0.10766352412563629, 'reg_lambda': 4.305694858944558e-06, 'gamma': 0.057019758841379956}. Best is trial 159 with value: -3.054615200567047.
[I 2026-07-17 16:26:33,608] Trial 161 finished with value: -1.5111935478564527 and parameters: {'scalers': 'robust', 'ratios': 'norm_ratio', 'imputers': 'median', 'n_estimators': 2750, 'learning_rate': 0.3975206417429625, 'max_depth': 6, 'min_child_weight': 1, 'subsample': 0.5, 'colsample_bytree': 0.5, 'colsample_bylevel': 0.5, 'reg_alpha': 0.5213005722063229, 'reg_lambda': 0.31260074989377407, 'gamma': 0.03983748089340139}. Best is trial 159 with value: -3.054615200567047.
[I 2026-07-17 16:26:43,057] Trial 162 finished with value: -1.8139257918857088 and parameters: {'scalers': 'robust', 'ratios': 'norm_ratio', 'imputers': 'median', 'n_estimators': 2750, 'learning_rate': 0.3993719593689562, 'max_depth': 7, 'min_child_weight': 1, 'subsample': 0.5, 'colsample_bytree': 0.5, 'colsample_bylevel': 0.5, 'reg_alpha': 0.5234636523822882, 'reg_lambda': 8.635629811723469, 'gamma': 0.03953187783122204}. Best is trial 159 with value: -3.054615200567047.
[I 2026-07-17 16:26:52,269] Trial 163 finished with value: -1.6954191535856329 and parameters: {'scalers': 'robust', 'ratios': 'norm_ratio', 'imputers': 'median', 'n_estimators': 2900, 'learning_rate': 0.3954168318164601, 'max_depth': 7, 'min_child_weight': 1, 'subsample': 0.5, 'colsample_bytree': 0.5, 'colsample_bylevel': 0.5, 'reg_alpha': 0.4484658014300953, 'reg_lambda': 0.32256524216974847, 'gamma': 0.055499438010800844}. Best is trial 159 with value: -3.054615200567047.
[I 2026-07-17 16:27:01,142] Trial 164 finished with value: -1.253224233736504 and parameters: {'scalers': 'robust', 'ratios': 'norm_ratio', 'imputers': 'median', 'n_estimators': 2750, 'learning_rate': 0.2435341023028229, 'max_depth': 7, 'min_child_weight': 1, 'subsample': 0.5, 'colsample_bytree': 0.5, 'colsample_bylevel': 0.5, 'reg_alpha': 0.49719058375615915, 'reg_lambda': 0.24302768218310694, 'gamma': 0.043808419952335725}. Best is trial 159 with value: -3.054615200567047.
[I 2026-07-17 16:27:10,540] Trial 165 finished with value: -1.7041766319129472 and parameters: {'scalers': 'robust', 'ratios': 'norm_ratio', 'imputers': 'median', 'n_estimators': 2900, 'learning_rate': 0.38538570152141016, 'max_depth': 7, 'min_child_weight': 1, 'subsample': 0.5, 'colsample_bytree': 0.5, 'colsample_bylevel': 0.5, 'reg_alpha': 0.4780344447120789, 'reg_lambda': 5.750164226276365e-06, 'gamma': 0.04390423292044893}. Best is trial 159 with value: -3.054615200567047.
[I 2026-07-17 16:27:20,423] Trial 166 finished with value: -1.9284083848446807 and parameters: {'scalers': 'standard', 'ratios': 'norm_ratio', 'imputers': 'median', 'n_estimators': 2900, 'learning_rate': 0.39348252561831454, 'max_depth': 8, 'min_child_weight': 1, 'subsample': 0.5, 'colsample_bytree': 0.5, 'colsample_bylevel': 0.5, 'reg_alpha': 0.5759583290435943, 'reg_lambda': 0.3113294144954823, 'gamma': 0.06772980866797894}. Best is trial 159 with value: -3.054615200567047.
[I 2026-07-17 16:27:29,862] Trial 167 finished with value: -1.5890214683948998 and parameters: {'scalers': 'standard', 'ratios': 'norm_ratio', 'imputers': 'median', 'n_estimators': 2900, 'learning_rate': 0.38528060211589044, 'max_depth': 7, 'min_child_weight': 1, 'subsample': 0.5, 'colsample_bytree': 0.5, 'colsample_bylevel': 0.5, 'reg_alpha': 0.5473430086918962, 'reg_lambda': 10.993405674737277, 'gamma': 0.041732726389534215}. Best is trial 159 with value: -3.054615200567047.
[I 2026-07-17 16:27:34,039] Trial 168 finished with value: -0.6235128160231308 and parameters: {'scalers': 'standard', 'ratios': 'norm_ratio', 'imputers': 'median', 'n_estimators': 2900, 'learning_rate': 0.3310281299697143, 'max_depth': 5, 'min_child_weight': 1, 'subsample': 0.5, 'colsample_bytree': 0.5, 'colsample_bylevel': 0.5, 'reg_alpha': 0.5046493529574846, 'reg_lambda': 10.427248022054632, 'gamma': 0.09089301075425812}. Best is trial 159 with value: -3.054615200567047.
[I 2026-07-17 16:27:38,035] Trial 169 finished with value: -0.39373209903875933 and parameters: {'scalers': 'standard', 'ratios': 'norm_ratio', 'imputers': 'median', 'n_estimators': 2900, 'learning_rate': 0.2455421399278138, 'max_depth': 11, 'min_child_weight': 1, 'subsample': 0.5, 'colsample_bytree': 0.5, 'colsample_bylevel': 0.5, 'reg_alpha': 0.4816071911137319, 'reg_lambda': 44.0750202058673, 'gamma': 0.082698824535992}. Best is trial 159 with value: -3.054615200567047.
[I 2026-07-17 16:27:48,854] Trial 170 finished with value: -1.7638337401667412 and parameters: {'scalers': 'robust', 'ratios': 'norm_ratio', 'imputers': 'median', 'n_estimators': 2900, 'learning_rate': 0.3334823582483757, 'max_depth': 7, 'min_child_weight': 1, 'subsample': 0.5, 'colsample_bytree': 0.5, 'colsample_bylevel': 0.5, 'reg_alpha': 0.5214667656440521, 'reg_lambda': 3.8204089018337934, 'gamma': 0.019142048197692458}. Best is trial 159 with value: -3.054615200567047.
[I 2026-07-17 16:27:59,782] Trial 171 finished with value: -1.7525646026022872 and parameters: {'scalers': 'robust', 'ratios': 'norm_ratio', 'imputers': 'median', 'n_estimators': 2900, 'learning_rate': 0.3450503246520374, 'max_depth': 7, 'min_child_weight': 1, 'subsample': 0.5, 'colsample_bytree': 0.5, 'colsample_bylevel': 0.5, 'reg_alpha': 0.49350435517135566, 'reg_lambda': 12.668500972282564, 'gamma': 0.019644459412656756}. Best is trial 159 with value: -3.054615200567047.
[I 2026-07-17 16:28:07,041] Trial 172 finished with value: -0.6597070094632606 and parameters: {'scalers': 'standard', 'ratios': 'norm_ratio', 'imputers': 'median', 'n_estimators': 2900, 'learning_rate': 0.3625878837806376, 'max_depth': 7, 'min_child_weight': 1, 'subsample': 0.5, 'colsample_bytree': 0.5, 'colsample_bylevel': 0.5, 'reg_alpha': 1.246035401524127, 'reg_lambda': 98.91268474405341, 'gamma': 0.019691716329141486}. Best is trial 159 with value: -3.054615200567047.
[I 2026-07-17 16:28:09,222] Trial 174 finished with value: -0.35314565656631564 and parameters: {'scalers': 'standard', 'ratios': 'norm_ratio', 'imputers': 'median', 'n_estimators': 150, 'learning_rate': 0.36584246748179955, 'max_depth': 7, 'min_child_weight': 1, 'subsample': 0.5, 'colsample_bytree': 0.5, 'colsample_bylevel': 0.5, 'reg_alpha': 1.109300350277679, 'reg_lambda': 8.890562976018805, 'gamma': 0.06689998479114535}. Best is trial 159 with value: -3.054615200567047.
[I 2026-07-17 16:28:11,566] Trial 173 finished with value: -0.5349906014959134 and parameters: {'scalers': 'standard', 'ratios': 'norm_ratio', 'imputers': 'median', 'n_estimators': 2900, 'learning_rate': 0.3519479439179357, 'max_depth': 7, 'min_child_weight': 1, 'subsample': 0.5, 'colsample_bytree': 0.5, 'colsample_bylevel': 0.5, 'reg_alpha': 1.346334139601437, 'reg_lambda': 29.56818332582198, 'gamma': 0.06241731523985394}. Best is trial 159 with value: -3.054615200567047.
[I 2026-07-17 16:28:13,867] Trial 175 finished with value: -0.9060849708925509 and parameters: {'scalers': 'none', 'ratios': 'norm_ratio', 'imputers': 'median', 'n_estimators': 700, 'learning_rate': 0.35211980961031725, 'max_depth': 7, 'min_child_weight': 1, 'subsample': 0.5, 'colsample_bytree': 0.5, 'colsample_bylevel': 0.5, 'reg_alpha': 1.1235223581150338, 'reg_lambda': 8.49520693140227, 'gamma': 0.023306264923148023}. Best is trial 159 with value: -3.054615200567047.
[I 2026-07-17 16:28:24,732] Trial 176 finished with value: -1.5089330718847314 and parameters: {'scalers': 'none', 'ratios': 'norm_ratio', 'imputers': 'median', 'n_estimators': 2800, 'learning_rate': 0.39441089089178116, 'max_depth': 7, 'min_child_weight': 1, 'subsample': 0.5, 'colsample_bytree': 0.5, 'colsample_bylevel': 0.5, 'reg_alpha': 0.09312476229490384, 'reg_lambda': 28.4852407473008, 'gamma': 0.02153307915310697}. Best is trial 159 with value: -3.054615200567047.
[I 2026-07-17 16:28:32,800] Trial 177 finished with value: -1.1057316173754512 and parameters: {'scalers': 'none', 'ratios': 'norm_ratio', 'imputers': 'median', 'n_estimators': 2800, 'learning_rate': 0.38732028637671395, 'max_depth': 7, 'min_child_weight': 1, 'subsample': 0.5, 'colsample_bytree': 0.5, 'colsample_bylevel': 0.5, 'reg_alpha': 1.4277138823584972, 'reg_lambda': 24.698404838533946, 'gamma': 0.021115784049902865}. Best is trial 159 with value: -3.054615200567047.
[I 2026-07-17 16:28:51,642] Trial 178 finished with value: -1.1984867376963102 and parameters: {'scalers': 'robust', 'ratios': 'norm_ratio', 'imputers': 'median', 'n_estimators': 2950, 'learning_rate': 0.38365763499775457, 'max_depth': 7, 'min_child_weight': 1, 'subsample': 0.5, 'colsample_bytree': 0.5, 'colsample_bylevel': 0.5, 'reg_alpha': 1.4540462747255167, 'reg_lambda': 20.18429437399807, 'gamma': 0.023616331322233588}. Best is trial 159 with value: -3.054615200567047.
[I 2026-07-17 16:28:51,680] Trial 179 finished with value: -1.7767500924301498 and parameters: {'scalers': 'robust', 'ratios': 'norm_ratio', 'imputers': 'median', 'n_estimators': 2800, 'learning_rate': 0.35649012255972695, 'max_depth': 7, 'min_child_weight': 1, 'subsample': 0.5, 'colsample_bytree': 0.5, 'colsample_bylevel': 0.5, 'reg_alpha': 0.09314144089053272, 'reg_lambda': 6.711284160194481, 'gamma': 0.017146331830492842}. Best is trial 159 with value: -3.054615200567047.
