[I 2026-07-17 16:21:20,866] Trial 91 finished with value: -1.2354368070113755 and parameters: {'scalers': 'none', 'ratios': 'log_ratio', 'imputers': 'median', 'n_estimators': 1650, 'learning_rate': 0.23965795542391957, 'max_depth': 12, 'min_child_weight': 5, 'subsample': 0.6, 'colsample_bytree': 0.8, 'colsample_bylevel': 0.8, 'reg_alpha': 0.018634013532344087, 'reg_lambda': 0.002151035322311507, 'gamma': 0.04462960993929325}. Best is trial 88 with value: -1.7347915743884443.
[I 2026-07-17 16:21:35,394] Trial 92 finished with value: -1.4201470752151455 and parameters: {'scalers': 'none', 'ratios': 'norm_ratio', 'imputers': 'median', 'n_estimators': 1900, 'learning_rate': 0.33040269867532224, 'max_depth': 12, 'min_child_weight': 5, 'subsample': 0.6, 'colsample_bytree': 0.8, 'colsample_bylevel': 0.6, 'reg_alpha': 0.01611312712776342, 'reg_lambda': 0.004131789062435653, 'gamma': 0.0473459070973231}. Best is trial 88 with value: -1.7347915743884443.
[I 2026-07-17 16:21:51,435] Trial 93 finished with value: -1.6189489978597784 and parameters: {'scalers': 'none', 'ratios': 'norm_ratio', 'imputers': 'median', 'n_estimators': 1950, 'learning_rate': 0.23700656049218624, 'max_depth': 12, 'min_child_weight': 3, 'subsample': 0.6, 'colsample_bytree': 0.8, 'colsample_bylevel': 0.6, 'reg_alpha': 0.0028931453783748616, 'reg_lambda': 2.98927553141795, 'gamma': 0.038062626632912155}. Best is trial 88 with value: -1.7347915743884443.
[I 2026-07-17 16:22:11,621] Trial 94 finished with value: -1.4979315010948744 and parameters: {'scalers': 'robust', 'ratios': 'norm_ratio', 'imputers': 'median', 'n_estimators': 1900, 'learning_rate': 0.21607276097609893, 'max_depth': 12, 'min_child_weight': 3, 'subsample': 0.6, 'colsample_bytree': 0.8, 'colsample_bylevel': 0.9, 'reg_alpha': 0.2657789275683096, 'reg_lambda': 0.0023392890926392487, 'gamma': 0.038272821896412665}. Best is trial 88 with value: -1.7347915743884443.
[I 2026-07-17 16:22:31,860] Trial 95 finished with value: -1.5425609226870984 and parameters: {'scalers': 'robust', 'ratios': 'norm_ratio', 'imputers': 'mean', 'n_estimators': 1950, 'learning_rate': 0.24039600303572903, 'max_depth': 12, 'min_child_weight': 3, 'subsample': 0.6, 'colsample_bytree': 0.8, 'colsample_bylevel': 0.9, 'reg_alpha': 0.271516442756305, 'reg_lambda': 0.005007340976452516, 'gamma': 0.047804523891499286}. Best is trial 88 with value: -1.7347915743884443.
[I 2026-07-17 16:22:50,445] Trial 96 finished with value: -1.8407256624509314 and parameters: {'scalers': 'robust', 'ratios': 'norm_ratio', 'imputers': 'mean', 'n_estimators': 1950, 'learning_rate': 0.2289515852428736, 'max_depth': 12, 'min_child_weight': 2, 'subsample': 0.6, 'colsample_bytree': 0.8, 'colsample_bylevel': 0.6, 'reg_alpha': 0.24315731068556803, 'reg_lambda': 0.0035255243410082363, 'gamma': 0.001174544641191164}. Best is trial 96 with value: -1.8407256624509314.
[I 2026-07-17 16:23:03,889] Trial 97 finished with value: -1.5576215642968638 and parameters: {'scalers': 'robust', 'ratios': 'norm_ratio', 'imputers': 'mean', 'n_estimators': 1900, 'learning_rate': 0.25487606592889434, 'max_depth': 12, 'min_child_weight': 2, 'subsample': 0.6, 'colsample_bytree': 0.8, 'colsample_bylevel': 0.6, 'reg_alpha': 1.6353998913196012e-06, 'reg_lambda': 0.0034048796591547663, 'gamma': 0.05683591478227418}. Best is trial 96 with value: -1.8407256624509314.
[I 2026-07-17 16:23:18,179] Trial 98 finished with value: -1.487418052314983 and parameters: {'scalers': 'robust', 'ratios': 'norm_ratio', 'imputers': 'median', 'n_estimators': 1900, 'learning_rate': 0.23237453230437405, 'max_depth': 12, 'min_child_weight': 2, 'subsample': 0.6, 'colsample_bytree': 0.8, 'colsample_bylevel': 0.7, 'reg_alpha': 7.874757835582771e-06, 'reg_lambda': 0.005104717786034657, 'gamma': 0.055273390440758095}. Best is trial 96 with value: -1.8407256624509314.
[I 2026-07-17 16:23:34,007] Trial 99 finished with value: -1.5204712411846293 and parameters: {'scalers': 'robust', 'ratios': 'norm_ratio', 'imputers': 'mean', 'n_estimators': 2150, 'learning_rate': 0.22640659878012248, 'max_depth': 12, 'min_child_weight': 2, 'subsample': 0.6, 'colsample_bytree': 0.8, 'colsample_bylevel': 0.7, 'reg_alpha': 6.091381912966673e-06, 'reg_lambda': 0.0020839442571124, 'gamma': 0.07123846080855942}. Best is trial 96 with value: -1.8407256624509314.
[I 2026-07-17 16:23:47,103] Trial 100 finished with value: -1.5164715445937291 and parameters: {'scalers': 'robust', 'ratios': 'norm_ratio', 'imputers': 'median', 'n_estimators': 1900, 'learning_rate': 0.22942907167102858, 'max_depth': 12, 'min_child_weight': 2, 'subsample': 0.6, 'colsample_bytree': 0.8, 'colsample_bylevel': 0.6, 'reg_alpha': 1.1098075546880878e-05, 'reg_lambda': 0.004289968384138738, 'gamma': 0.06590192959860536}. Best is trial 96 with value: -1.8407256624509314.
[I 2026-07-17 16:24:00,294] Trial 101 finished with value: -1.5152335292262178 and parameters: {'scalers': 'robust', 'ratios': 'norm_ratio', 'imputers': 'median', 'n_estimators': 1900, 'learning_rate': 0.229071404587907, 'max_depth': 12, 'min_child_weight': 2, 'subsample': 0.6, 'colsample_bytree': 0.8, 'colsample_bylevel': 0.6, 'reg_alpha': 1.0405796327952247e-05, 'reg_lambda': 0.0034983416555497636, 'gamma': 0.06678176377899432}. Best is trial 96 with value: -1.8407256624509314.
[I 2026-07-17 16:24:15,135] Trial 102 finished with value: -1.537373865103691 and parameters: {'scalers': 'robust', 'ratios': 'norm_ratio', 'imputers': 'median', 'n_estimators': 2150, 'learning_rate': 0.24222278465310018, 'max_depth': 12, 'min_child_weight': 2, 'subsample': 0.6, 'colsample_bytree': 0.8, 'colsample_bylevel': 0.6, 'reg_alpha': 5.251348861734013e-06, 'reg_lambda': 0.00044553627293541023, 'gamma': 0.07399297788345946}. Best is trial 96 with value: -1.8407256624509314.
[I 2026-07-17 16:24:30,417] Trial 103 finished with value: -1.6873580696985904 and parameters: {'scalers': 'robust', 'ratios': 'norm_ratio', 'imputers': 'mean', 'n_estimators': 2150, 'learning_rate': 0.22957369347782397, 'max_depth': 12, 'min_child_weight': 2, 'subsample': 0.6, 'colsample_bytree': 0.8, 'colsample_bylevel': 0.6, 'reg_alpha': 0.1333545279572276, 'reg_lambda': 0.0006547730731351627, 'gamma': 0.07711351074637807}. Best is trial 96 with value: -1.8407256624509314.
[I 2026-07-17 16:24:45,466] Trial 104 finished with value: -1.7566760855045487 and parameters: {'scalers': 'robust', 'ratios': 'norm_ratio', 'imputers': 'mean', 'n_estimators': 2150, 'learning_rate': 0.23123221836051297, 'max_depth': 12, 'min_child_weight': 2, 'subsample': 0.6, 'colsample_bytree': 0.8, 'colsample_bylevel': 0.6, 'reg_alpha': 0.30823974326291187, 'reg_lambda': 0.00314195690006194, 'gamma': 0.07735310953794534}. Best is trial 96 with value: -1.8407256624509314.
[I 2026-07-17 16:24:59,931] Trial 105 finished with value: -1.5216842581366796 and parameters: {'scalers': 'robust', 'ratios': 'norm_ratio', 'imputers': 'mean', 'n_estimators': 2150, 'learning_rate': 0.21160020472554558, 'max_depth': 12, 'min_child_weight': 2, 'subsample': 0.6, 'colsample_bytree': 0.8, 'colsample_bylevel': 0.6, 'reg_alpha': 1.3355356247016797e-05, 'reg_lambda': 0.0006335426214564687, 'gamma': 0.07384887563954627}. Best is trial 96 with value: -1.8407256624509314.
[I 2026-07-17 16:25:12,854] Trial 106 finished with value: -1.7228143670076215 and parameters: {'scalers': 'robust', 'ratios': 'norm_ratio', 'imputers': 'mean', 'n_estimators': 1800, 'learning_rate': 0.19073077215179984, 'max_depth': 12, 'min_child_weight': 1, 'subsample': 0.6, 'colsample_bytree': 0.8, 'colsample_bylevel': 0.6, 'reg_alpha': 5.3598497694981624e-06, 'reg_lambda': 0.0005015099839238335, 'gamma': 0.016197053455509734}. Best is trial 96 with value: -1.8407256624509314.
[I 2026-07-17 16:25:25,731] Trial 107 finished with value: -1.8210406838711435 and parameters: {'scalers': 'robust', 'ratios': 'norm_ratio', 'imputers': 'mean', 'n_estimators': 1800, 'learning_rate': 0.2534632004261058, 'max_depth': 12, 'min_child_weight': 1, 'subsample': 0.6, 'colsample_bytree': 0.8, 'colsample_bylevel': 0.6, 'reg_alpha': 1.0855007496784671e-06, 'reg_lambda': 0.0003724901880118183, 'gamma': 0.012585923533902858}. Best is trial 96 with value: -1.8407256624509314.
[I 2026-07-17 16:25:38,662] Trial 108 finished with value: -1.6813043991757266 and parameters: {'scalers': 'robust', 'ratios': 'norm_ratio', 'imputers': 'mean', 'n_estimators': 1800, 'learning_rate': 0.19277049302987975, 'max_depth': 12, 'min_child_weight': 1, 'subsample': 0.6, 'colsample_bytree': 0.8, 'colsample_bylevel': 0.6, 'reg_alpha': 1.5680979400526077e-06, 'reg_lambda': 0.0006332574168433601, 'gamma': 0.01534904780791568}. Best is trial 96 with value: -1.8407256624509314.
[I 2026-07-17 16:25:52,163] Trial 109 finished with value: -1.6278283461182965 and parameters: {'scalers': 'robust', 'ratios': 'norm_ratio', 'imputers': 'mean', 'n_estimators': 2100, 'learning_rate': 0.19295832037156213, 'max_depth': 12, 'min_child_weight': 1, 'subsample': 0.6, 'colsample_bytree': 0.8, 'colsample_bylevel': 0.6, 'reg_alpha': 1.022654224520744e-06, 'reg_lambda': 0.0003890947472080341, 'gamma': 0.08927546701301671}. Best is trial 96 with value: -1.8407256624509314.
[I 2026-07-17 16:26:07,212] Trial 110 finished with value: -1.755896382326511 and parameters: {'scalers': 'robust', 'ratios': 'norm_ratio', 'imputers': 'mean', 'n_estimators': 2100, 'learning_rate': 0.19023487024901392, 'max_depth': 12, 'min_child_weight': 1, 'subsample': 0.6, 'colsample_bytree': 0.8, 'colsample_bylevel': 0.6, 'reg_alpha': 1.4325852049611174e-06, 'reg_lambda': 0.0004873504013485996, 'gamma': 0.013085404796181595}. Best is trial 96 with value: -1.8407256624509314.
[I 2026-07-17 16:26:25,225] Trial 111 finished with value: -2.2643534268459433 and parameters: {'scalers': 'robust', 'ratios': 'norm_ratio', 'imputers': 'mean', 'n_estimators': 1800, 'learning_rate': 0.18888110902047514, 'max_depth': 12, 'min_child_weight': 1, 'subsample': 0.6, 'colsample_bytree': 0.8, 'colsample_bylevel': 0.6, 'reg_alpha': 0.3306785854489561, 'reg_lambda': 0.0002802448786849461, 'gamma': 0.01722900680344367}. Best is trial 111 with value: -2.2643534268459433.
[I 2026-07-17 16:26:42,460] Trial 112 finished with value: -1.543977900738627 and parameters: {'scalers': 'robust', 'ratios': 'norm_ratio', 'imputers': 'mean', 'n_estimators': 2350, 'learning_rate': 0.12836293088974748, 'max_depth': 12, 'min_child_weight': 1, 'subsample': 0.6, 'colsample_bytree': 0.8, 'colsample_bylevel': 0.6, 'reg_alpha': 2.337554920103952e-05, 'reg_lambda': 0.0006184598069898044, 'gamma': 0.01705477003195952}. Best is trial 111 with value: -2.2643534268459433.
[I 2026-07-17 16:26:55,921] Trial 113 finished with value: -1.6400604941559584 and parameters: {'scalers': 'robust', 'ratios': 'norm_ratio', 'imputers': 'mean', 'n_estimators': 1800, 'learning_rate': 0.18445112069070443, 'max_depth': 12, 'min_child_weight': 1, 'subsample': 0.6, 'colsample_bytree': 0.8, 'colsample_bylevel': 0.6, 'reg_alpha': 2.104872593727448e-05, 'reg_lambda': 0.0002761414746825332, 'gamma': 0.014976722870309604}. Best is trial 111 with value: -2.2643534268459433.
[I 2026-07-17 16:27:12,747] Trial 114 finished with value: -1.7941386831817197 and parameters: {'scalers': 'robust', 'ratios': 'norm_ratio', 'imputers': 'mean', 'n_estimators': 2350, 'learning_rate': 0.18504028725939348, 'max_depth': 12, 'min_child_weight': 1, 'subsample': 0.6, 'colsample_bytree': 0.8, 'colsample_bylevel': 0.6, 'reg_alpha': 1.6175287884559976e-06, 'reg_lambda': 0.0002960960896353595, 'gamma': 0.016596772134584187}. Best is trial 111 with value: -2.2643534268459433.
[I 2026-07-17 16:27:25,745] Trial 115 finished with value: -2.129037325915327 and parameters: {'scalers': 'robust', 'ratios': 'norm_ratio', 'imputers': 'mean', 'n_estimators': 1800, 'learning_rate': 0.37692417075854673, 'max_depth': 12, 'min_child_weight': 1, 'subsample': 0.6, 'colsample_bytree': 0.8, 'colsample_bylevel': 0.6, 'reg_alpha': 1.1200143821275807e-06, 'reg_lambda': 0.00020893069877280773, 'gamma': 0.01481496052880319}. Best is trial 111 with value: -2.2643534268459433.
[I 2026-07-17 16:27:41,332] Trial 116 finished with value: -1.6247728047686611 and parameters: {'scalers': 'robust', 'ratios': 'norm_ratio', 'imputers': 'mean', 'n_estimators': 1800, 'learning_rate': 0.18210682736020284, 'max_depth': 12, 'min_child_weight': 1, 'subsample': 0.6, 'colsample_bytree': 0.8, 'colsample_bylevel': 0.6, 'reg_alpha': 2.0659172652615407e-06, 'reg_lambda': 0.00014704888302961646, 'gamma': 0.016716229131793166}. Best is trial 111 with value: -2.2643534268459433.
[I 2026-07-17 16:27:51,552] Trial 117 finished with value: -1.664428249744313 and parameters: {'scalers': 'robust', 'ratios': 'norm_ratio', 'imputers': 'mean', 'n_estimators': 1750, 'learning_rate': 0.18878945294175015, 'max_depth': 12, 'min_child_weight': 1, 'subsample': 0.6, 'colsample_bytree': 0.8, 'colsample_bylevel': 0.6, 'reg_alpha': 4.399642364898928e-06, 'reg_lambda': 0.0001987627803177648, 'gamma': 0.012019051055749018}. Best is trial 111 with value: -2.2643534268459433.
[I 2026-07-17 16:28:04,192] Trial 118 finished with value: -1.4391826056801482 and parameters: {'scalers': 'robust', 'ratios': 'norm_ratio', 'imputers': 'mean', 'n_estimators': 1750, 'learning_rate': 0.12524929943869478, 'max_depth': 12, 'min_child_weight': 1, 'subsample': 0.6, 'colsample_bytree': 0.8, 'colsample_bylevel': 0.6, 'reg_alpha': 1.059558749416866e-06, 'reg_lambda': 0.00023035633561824392, 'gamma': 0.015437064098078566}. Best is trial 111 with value: -2.2643534268459433.
[I 2026-07-17 16:28:16,669] Trial 119 finished with value: -1.661585969358575 and parameters: {'scalers': 'robust', 'ratios': 'norm_ratio', 'imputers': 'mean', 'n_estimators': 1750, 'learning_rate': 0.1893064853588561, 'max_depth': 12, 'min_child_weight': 1, 'subsample': 0.6, 'colsample_bytree': 0.8, 'colsample_bylevel': 0.6, 'reg_alpha': 1.0868993062444765e-06, 'reg_lambda': 0.0002509739743014585, 'gamma': 0.014895205875069234}. Best is trial 111 with value: -2.2643534268459433.
[I 2026-07-17 16:28:27,984] Trial 120 finished with value: -1.6799741278666185 and parameters: {'scalers': 'robust', 'ratios': 'norm_ratio', 'imputers': 'mean', 'n_estimators': 1800, 'learning_rate': 0.19517435846195488, 'max_depth': 12, 'min_child_weight': 1, 'subsample': 0.6, 'colsample_bytree': 0.8, 'colsample_bylevel': 0.5, 'reg_alpha': 1.0993024330034462e-06, 'reg_lambda': 0.000175600576725567, 'gamma': 0.00332019452172398}. Best is trial 111 with value: -2.2643534268459433.
[I 2026-07-17 16:28:39,397] Trial 121 finished with value: -1.6813249803669614 and parameters: {'scalers': 'robust', 'ratios': 'norm_ratio', 'imputers': 'mean', 'n_estimators': 1750, 'learning_rate': 0.18155936537651607, 'max_depth': 12, 'min_child_weight': 1, 'subsample': 0.6, 'colsample_bytree': 0.8, 'colsample_bylevel': 0.5, 'reg_alpha': 1.007279657399814e-06, 'reg_lambda': 0.00019828556730919688, 'gamma': 0.01610016202251404}. Best is trial 111 with value: -2.2643534268459433.
[I 2026-07-17 16:28:51,224] Trial 122 finished with value: -1.667741063760304 and parameters: {'scalers': 'robust', 'ratios': 'norm_ratio', 'imputers': 'mean', 'n_estimators': 1800, 'learning_rate': 0.18922853458611777, 'max_depth': 12, 'min_child_weight': 1, 'subsample': 0.6, 'colsample_bytree': 0.8, 'colsample_bylevel': 0.5, 'reg_alpha': 3.5672593093384543e-06, 'reg_lambda': 0.00019361823100259414, 'gamma': 0.01562907288179453}. Best is trial 111 with value: -2.2643534268459433.
[I 2026-07-17 16:29:02,426] Trial 123 finished with value: -2.306272548443517 and parameters: {'scalers': 'robust', 'ratios': 'norm_ratio', 'imputers': 'mean', 'n_estimators': 1800, 'learning_rate': 0.3893387342146294, 'max_depth': 12, 'min_child_weight': 1, 'subsample': 0.6, 'colsample_bytree': 0.8, 'colsample_bylevel': 0.5, 'reg_alpha': 3.138670027983232e-06, 'reg_lambda': 6.450723813172282e-05, 'gamma': 0.009742540758033554}. Best is trial 123 with value: -2.306272548443517.
[I 2026-07-17 16:29:13,621] Trial 124 finished with value: -2.1810450649201596 and parameters: {'scalers': 'robust', 'ratios': 'norm_ratio', 'imputers': 'mean', 'n_estimators': 1700, 'learning_rate': 0.3730442930019439, 'max_depth': 12, 'min_child_weight': 1, 'subsample': 0.6, 'colsample_bytree': 0.8, 'colsample_bylevel': 0.5, 'reg_alpha': 3.4838038484036485e-06, 'reg_lambda': 4.466572740343964e-05, 'gamma': 0.009928896330958333}. Best is trial 123 with value: -2.306272548443517.
[I 2026-07-17 16:29:24,717] Trial 125 finished with value: -2.1673784017495943 and parameters: {'scalers': 'robust', 'ratios': 'norm_ratio', 'imputers': 'mean', 'n_estimators': 1700, 'learning_rate': 0.37364593661572476, 'max_depth': 12, 'min_child_weight': 1, 'subsample': 0.6, 'colsample_bytree': 0.8, 'colsample_bylevel': 0.5, 'reg_alpha': 1.1405299332966949e-06, 'reg_lambda': 7.379339878580492e-05, 'gamma': 0.004359407772382882}. Best is trial 123 with value: -2.306272548443517.
[I 2026-07-17 16:29:37,793] Trial 126 finished with value: -2.266115550386947 and parameters: {'scalers': 'robust', 'ratios': 'norm_ratio', 'imputers': 'mean', 'n_estimators': 2000, 'learning_rate': 0.3631220709564469, 'max_depth': 12, 'min_child_weight': 1, 'subsample': 0.6, 'colsample_bytree': 0.8, 'colsample_bylevel': 0.5, 'reg_alpha': 3.3185612442501186e-06, 'reg_lambda': 3.365289416196202e-05, 'gamma': 0.0032383807930660303}. Best is trial 123 with value: -2.306272548443517.
[I 2026-07-17 16:29:50,691] Trial 127 finished with value: -2.4751597016532147 and parameters: {'scalers': 'robust', 'ratios': 'norm_ratio', 'imputers': 'mean', 'n_estimators': 2000, 'learning_rate': 0.3973809526743641, 'max_depth': 12, 'min_child_weight': 1, 'subsample': 0.6, 'colsample_bytree': 0.8, 'colsample_bylevel': 0.5, 'reg_alpha': 3.0364342260084044e-06, 'reg_lambda': 2.0361877709706002e-05, 'gamma': 0.0034358083019499887}. Best is trial 127 with value: -2.4751597016532147.
[I 2026-07-17 16:30:03,470] Trial 128 finished with value: -2.336082562971625 and parameters: {'scalers': 'robust', 'ratios': 'norm_ratio', 'imputers': 'mean', 'n_estimators': 2000, 'learning_rate': 0.39661271095463657, 'max_depth': 12, 'min_child_weight': 1, 'subsample': 0.6, 'colsample_bytree': 0.8, 'colsample_bylevel': 0.5, 'reg_alpha': 3.4810024686167555e-06, 'reg_lambda': 5.97706641997284e-05, 'gamma': 0.001737703791130157}. Best is trial 127 with value: -2.4751597016532147.
[I 2026-07-17 16:30:14,556] Trial 129 finished with value: -2.2183098490742266 and parameters: {'scalers': 'robust', 'ratios': 'norm_ratio', 'imputers': 'mean', 'n_estimators': 1700, 'learning_rate': 0.38869943244937133, 'max_depth': 12, 'min_child_weight': 1, 'subsample': 0.6, 'colsample_bytree': 0.8, 'colsample_bylevel': 0.5, 'reg_alpha': 3.2416556906352923e-06, 'reg_lambda': 7.714033295413221e-05, 'gamma': 0.0017610789640001236}. Best is trial 127 with value: -2.4751597016532147.
[I 2026-07-17 16:30:27,154] Trial 130 finished with value: -2.3284130972387094 and parameters: {'scalers': 'robust', 'ratios': 'norm_ratio', 'imputers': 'mean', 'n_estimators': 2000, 'learning_rate': 0.37844088187491565, 'max_depth': 12, 'min_child_weight': 1, 'subsample': 0.6, 'colsample_bytree': 0.8, 'colsample_bylevel': 0.5, 'reg_alpha': 2.496919955059576e-06, 'reg_lambda': 5.123923687534703e-05, 'gamma': 0.009220423532265829}. Best is trial 127 with value: -2.4751597016532147.
[I 2026-07-17 16:30:38,001] Trial 131 finished with value: -2.238837947712283 and parameters: {'scalers': 'robust', 'ratios': 'norm_ratio', 'imputers': 'mean', 'n_estimators': 1700, 'learning_rate': 0.38874932116309324, 'max_depth': 12, 'min_child_weight': 1, 'subsample': 0.6, 'colsample_bytree': 0.8, 'colsample_bylevel': 0.5, 'reg_alpha': 2.7967993206292363e-06, 'reg_lambda': 5.7569013301763354e-05, 'gamma': 0.008425798539320994}. Best is trial 127 with value: -2.4751597016532147.
[I 2026-07-17 16:30:51,103] Trial 132 finished with value: -2.3103450570578605 and parameters: {'scalers': 'robust', 'ratios': 'norm_ratio', 'imputers': 'mean', 'n_estimators': 2000, 'learning_rate': 0.38720836028957106, 'max_depth': 12, 'min_child_weight': 1, 'subsample': 0.6, 'colsample_bytree': 0.8, 'colsample_bylevel': 0.5, 'reg_alpha': 2.6795959044752716e-06, 'reg_lambda': 5.3472040928533585e-05, 'gamma': 0.0009822171095412462}. Best is trial 127 with value: -2.4751597016532147.
[I 2026-07-17 16:31:04,151] Trial 133 finished with value: -2.6760445828607833 and parameters: {'scalers': 'standard', 'ratios': 'norm_ratio', 'imputers': 'mean', 'n_estimators': 2000, 'learning_rate': 0.4873804382133476, 'max_depth': 12, 'min_child_weight': 1, 'subsample': 0.6, 'colsample_bytree': 0.8, 'colsample_bylevel': 0.5, 'reg_alpha': 2.507745781699811e-06, 'reg_lambda': 5.184590024707291e-05, 'gamma': 0.002358337312225638}. Best is trial 133 with value: -2.6760445828607833.
[I 2026-07-17 16:31:16,065] Trial 134 finished with value: -1.942037017378957 and parameters: {'scalers': 'robust', 'ratios': 'norm_ratio', 'imputers': 'mean', 'n_estimators': 1850, 'learning_rate': 0.2840242902904222, 'max_depth': 12, 'min_child_weight': 1, 'subsample': 0.6, 'colsample_bytree': 0.8, 'colsample_bylevel': 0.5, 'reg_alpha': 2.6479912805722678e-06, 'reg_lambda': 6.551284172874461e-05, 'gamma': 0.001770904882034474}. Best is trial 133 with value: -2.6760445828607833.
[I 2026-07-17 16:31:32,866] Trial 136 finished with value: -1.1659448464208793 and parameters: {'scalers': 'standard', 'ratios': 'norm_ratio', 'imputers': 'mean', 'n_estimators': 2050, 'learning_rate': 0.3792398898254753, 'max_depth': 5, 'min_child_weight': 1, 'subsample': 0.6, 'colsample_bytree': 0.8, 'colsample_bylevel': 0.5, 'reg_alpha': 2.8975601839431933e-06, 'reg_lambda': 6.807566447967297e-05, 'gamma': 0.0016527538681727573}. Best is trial 133 with value: -2.6760445828607833.
