[I 2026-07-17 15:39:13,587] Trial 90 finished with value: -0.07497150951050313 and parameters: {'scalers': 'robust', 'ratios': 'norm_ratio', 'imputers': 'none', 'n_estimators': 3000, 'learning_rate': 0.3863732355669942, 'max_depth': 10, 'min_child_weight': 5, 'subsample': 0.7, 'colsample_bytree': 0.6, 'colsample_bylevel': 0.5, 'reg_alpha': 0.7294887924888741, 'reg_lambda': 0.012526329537312246, 'gamma': 0.0001784552336809096}. Best is trial 89 with value: -0.13316216059322425.
[I 2026-07-17 15:39:29,621] Trial 91 finished with value: -0.05345663046281509 and parameters: {'scalers': 'robust', 'ratios': 'norm_ratio', 'imputers': 'none', 'n_estimators': 2950, 'learning_rate': 0.1416905331051929, 'max_depth': 10, 'min_child_weight': 5, 'subsample': 0.7, 'colsample_bytree': 0.6, 'colsample_bylevel': 0.5, 'reg_alpha': 0.7063175223867296, 'reg_lambda': 0.014245670123512248, 'gamma': 0.0002913813255864375}. Best is trial 89 with value: -0.13316216059322425.
[I 2026-07-17 15:39:43,954] Trial 92 finished with value: -0.08179903164864227 and parameters: {'scalers': 'robust', 'ratios': 'norm_ratio', 'imputers': 'none', 'n_estimators': 2500, 'learning_rate': 0.3954960982324241, 'max_depth': 10, 'min_child_weight': 5, 'subsample': 0.5, 'colsample_bytree': 0.6, 'colsample_bylevel': 0.5, 'reg_alpha': 0.7519184597780745, 'reg_lambda': 0.6116630625431405, 'gamma': 0.00027833460016448694}. Best is trial 89 with value: -0.13316216059322425.
[I 2026-07-17 15:39:58,936] Trial 93 finished with value: -0.05602091656723734 and parameters: {'scalers': 'robust', 'ratios': 'norm_ratio', 'imputers': 'none', 'n_estimators': 2950, 'learning_rate': 0.14023625066150228, 'max_depth': 10, 'min_child_weight': 5, 'subsample': 0.5, 'colsample_bytree': 0.6, 'colsample_bylevel': 0.5, 'reg_alpha': 0.49467251145381474, 'reg_lambda': 0.6958747396380641, 'gamma': 0.00021348600159744406}. Best is trial 89 with value: -0.13316216059322425.
[I 2026-07-17 15:40:15,223] Trial 94 finished with value: -0.0994197348831764 and parameters: {'scalers': 'robust', 'ratios': 'norm_ratio', 'imputers': 'none', 'n_estimators': 2450, 'learning_rate': 0.388451590238848, 'max_depth': 10, 'min_child_weight': 3, 'subsample': 0.5, 'colsample_bytree': 0.6, 'colsample_bylevel': 0.5, 'reg_alpha': 0.6656279935900983, 'reg_lambda': 0.0016268685551130378, 'gamma': 0.00027850642542163534}. Best is trial 89 with value: -0.13316216059322425.
[I 2026-07-17 15:40:29,448] Trial 95 finished with value: -0.05500857234347693 and parameters: {'scalers': 'robust', 'ratios': 'norm_ratio', 'imputers': 'none', 'n_estimators': 2500, 'learning_rate': 0.3726575569960772, 'max_depth': 11, 'min_child_weight': 9, 'subsample': 0.7, 'colsample_bytree': 0.6, 'colsample_bylevel': 0.5, 'reg_alpha': 0.6272986743343694, 'reg_lambda': 0.0014845094478695478, 'gamma': 0.00019616270581801175}. Best is trial 89 with value: -0.13316216059322425.
[I 2026-07-17 15:40:32,728] Trial 96 finished with value: -0.033665177412198134 and parameters: {'scalers': 'robust', 'ratios': 'norm_ratio', 'imputers': 'none', 'n_estimators': 2500, 'learning_rate': 0.3948598553235805, 'max_depth': 3, 'min_child_weight': 9, 'subsample': 0.5, 'colsample_bytree': 0.5, 'colsample_bylevel': 0.5, 'reg_alpha': 0.482319398129683, 'reg_lambda': 0.0026656155909937818, 'gamma': 1.1218171966649381e-06}. Best is trial 89 with value: -0.13316216059322425.
[I 2026-07-17 15:40:38,817] Trial 97 finished with value: -0.028034514602033822 and parameters: {'scalers': 'robust', 'ratios': 'norm_ratio', 'imputers': 'none', 'n_estimators': 2650, 'learning_rate': 0.021646772857633927, 'max_depth': 5, 'min_child_weight': 1, 'subsample': 0.5, 'colsample_bytree': 0.6, 'colsample_bylevel': 0.5, 'reg_alpha': 0.5020885842251896, 'reg_lambda': 0.000608012756936924, 'gamma': 1.113251322962735e-06}. Best is trial 89 with value: -0.13316216059322425.
[I 2026-07-17 15:40:45,669] Trial 98 finished with value: -0.03242728533938881 and parameters: {'scalers': 'robust', 'ratios': 'norm_ratio', 'imputers': 'none', 'n_estimators': 2450, 'learning_rate': 0.0237779145313892, 'max_depth': 6, 'min_child_weight': 1, 'subsample': 0.5, 'colsample_bytree': 0.6, 'colsample_bylevel': 0.5, 'reg_alpha': 0.5589167648184746, 'reg_lambda': 0.15378593242029318, 'gamma': 1.0318972760824128e-06}. Best is trial 89 with value: -0.13316216059322425.
[I 2026-07-17 15:40:51,686] Trial 99 finished with value: -0.06991167600631684 and parameters: {'scalers': 'robust', 'ratios': 'norm_ratio', 'imputers': 'none', 'n_estimators': 2500, 'learning_rate': 0.26916717601205936, 'max_depth': 5, 'min_child_weight': 1, 'subsample': 0.5, 'colsample_bytree': 0.6, 'colsample_bylevel': 0.5, 'reg_alpha': 0.477648492459181, 'reg_lambda': 0.00106027012130887, 'gamma': 0.00016889777644391678}. Best is trial 89 with value: -0.13316216059322425.
[I 2026-07-17 15:40:57,733] Trial 100 finished with value: -0.022656853479550203 and parameters: {'scalers': 'robust', 'ratios': 'norm_ratio', 'imputers': 'none', 'n_estimators': 2650, 'learning_rate': 0.00955503048507534, 'max_depth': 5, 'min_child_weight': 5, 'subsample': 0.5, 'colsample_bytree': 0.5, 'colsample_bylevel': 0.5, 'reg_alpha': 0.45632178979251625, 'reg_lambda': 0.0022153961326458103, 'gamma': 1.2567215415609322e-06}. Best is trial 89 with value: -0.13316216059322425.
[I 2026-07-17 15:41:03,927] Trial 101 finished with value: -0.05401745375832814 and parameters: {'scalers': 'robust', 'ratios': 'norm_ratio', 'imputers': 'none', 'n_estimators': 2500, 'learning_rate': 0.39407151296903886, 'max_depth': 5, 'min_child_weight': 6, 'subsample': 0.5, 'colsample_bytree': 0.5, 'colsample_bylevel': 0.5, 'reg_alpha': 0.8635780879639162, 'reg_lambda': 0.0022784006251719666, 'gamma': 1.4007585240667914e-06}. Best is trial 89 with value: -0.13316216059322425.
[I 2026-07-17 15:41:11,414] Trial 102 finished with value: -0.025073066492188573 and parameters: {'scalers': 'robust', 'ratios': 'norm_ratio', 'imputers': 'none', 'n_estimators': 2500, 'learning_rate': 0.010379804700926145, 'max_depth': 6, 'min_child_weight': 2, 'subsample': 0.5, 'colsample_bytree': 0.6, 'colsample_bylevel': 0.5, 'reg_alpha': 0.4514668968406908, 'reg_lambda': 0.0020560270032724003, 'gamma': 1.6258532726745045e-06}. Best is trial 89 with value: -0.13316216059322425.
[I 2026-07-17 15:41:16,591] Trial 103 finished with value: -0.025725368249408933 and parameters: {'scalers': 'robust', 'ratios': 'norm_ratio', 'imputers': 'none', 'n_estimators': 2650, 'learning_rate': 0.01851963003495221, 'max_depth': 5, 'min_child_weight': 2, 'subsample': 0.5, 'colsample_bytree': 0.5, 'colsample_bylevel': 0.5, 'reg_alpha': 0.3902943789940565, 'reg_lambda': 0.0032917895943750056, 'gamma': 0.00034714218231381323}. Best is trial 89 with value: -0.13316216059322425.
[I 2026-07-17 15:41:22,038] Trial 104 finished with value: -0.025164999822668302 and parameters: {'scalers': 'robust', 'ratios': 'norm_ratio', 'imputers': 'none', 'n_estimators': 2650, 'learning_rate': 0.02244622959998245, 'max_depth': 5, 'min_child_weight': 2, 'subsample': 0.5, 'colsample_bytree': 0.6, 'colsample_bylevel': 0.5, 'reg_alpha': 0.1510490843423579, 'reg_lambda': 0.0007382802618568722, 'gamma': 0.0004010686855189156}. Best is trial 89 with value: -0.13316216059322425.
[I 2026-07-17 15:41:24,391] Trial 105 finished with value: -0.019092036192777346 and parameters: {'scalers': 'robust', 'ratios': 'norm_ratio', 'imputers': 'none', 'n_estimators': 2700, 'learning_rate': 0.28120029989867723, 'max_depth': 6, 'min_child_weight': 2, 'subsample': 0.5, 'colsample_bytree': 0.6, 'colsample_bylevel': 0.5, 'reg_alpha': 89.08192806923569, 'reg_lambda': 0.0028579277590056744, 'gamma': 0.00035626373874477537}. Best is trial 89 with value: -0.13316216059322425.
[I 2026-07-17 15:41:35,148] Trial 106 finished with value: -0.029266972812893588 and parameters: {'scalers': 'robust', 'ratios': 'norm_ratio', 'imputers': 'none', 'n_estimators': 2650, 'learning_rate': 0.009338921289468468, 'max_depth': 8, 'min_child_weight': 2, 'subsample': 0.5, 'colsample_bytree': 0.5, 'colsample_bylevel': 0.5, 'reg_alpha': 0.3255572178292462, 'reg_lambda': 0.0020827229863891977, 'gamma': 4.2915410476562854e-05}. Best is trial 89 with value: -0.13316216059322425.
[I 2026-07-17 15:41:39,916] Trial 107 finished with value: -0.05559516758336269 and parameters: {'scalers': 'robust', 'ratios': 'norm_ratio', 'imputers': 'none', 'n_estimators': 2650, 'learning_rate': 0.3988937671521767, 'max_depth': 4, 'min_child_weight': 2, 'subsample': 0.5, 'colsample_bytree': 0.5, 'colsample_bylevel': 0.5, 'reg_alpha': 0.22306030428141702, 'reg_lambda': 0.003176381311343976, 'gamma': 0.0003661456634181591}. Best is trial 89 with value: -0.13316216059322425.
[I 2026-07-17 15:41:46,234] Trial 108 finished with value: -0.06209548925646984 and parameters: {'scalers': 'robust', 'ratios': 'norm_ratio', 'imputers': 'none', 'n_estimators': 2300, 'learning_rate': 0.2730424910197556, 'max_depth': 6, 'min_child_weight': 2, 'subsample': 0.5, 'colsample_bytree': 0.6, 'colsample_bylevel': 0.5, 'reg_alpha': 0.25570308020046345, 'reg_lambda': 0.001064973770210503, 'gamma': 0.0003891714445264091}. Best is trial 89 with value: -0.13316216059322425.
[I 2026-07-17 15:41:52,139] Trial 109 finished with value: -0.05790061361736099 and parameters: {'scalers': 'robust', 'ratios': 'norm_ratio', 'imputers': 'none', 'n_estimators': 2250, 'learning_rate': 0.27147895217800505, 'max_depth': 6, 'min_child_weight': 2, 'subsample': 0.5, 'colsample_bytree': 0.6, 'colsample_bylevel': 0.5, 'reg_alpha': 0.16494746329285825, 'reg_lambda': 0.0011519842107046722, 'gamma': 0.0003641962924863151}. Best is trial 89 with value: -0.13316216059322425.
[I 2026-07-17 15:41:56,419] Trial 110 finished with value: -0.042742187095654346 and parameters: {'scalers': 'robust', 'ratios': 'norm_ratio', 'imputers': 'none', 'n_estimators': 2300, 'learning_rate': 0.290044849474148, 'max_depth': 4, 'min_child_weight': 2, 'subsample': 0.5, 'colsample_bytree': 0.6, 'colsample_bylevel': 0.5, 'reg_alpha': 0.15266653905797933, 'reg_lambda': 0.000676891529920857, 'gamma': 0.00032587987338282526}. Best is trial 89 with value: -0.13316216059322425.
[I 2026-07-17 15:42:05,830] Trial 111 finished with value: -0.09441066386070421 and parameters: {'scalers': 'robust', 'ratios': 'norm_ratio', 'imputers': 'none', 'n_estimators': 2350, 'learning_rate': 0.2764527122002704, 'max_depth': 8, 'min_child_weight': 2, 'subsample': 0.5, 'colsample_bytree': 0.6, 'colsample_bylevel': 0.5, 'reg_alpha': 1.9762162477748864, 'reg_lambda': 0.0007367516351544112, 'gamma': 3.5019527591720645e-06}. Best is trial 89 with value: -0.13316216059322425.
[I 2026-07-17 15:42:11,193] Trial 112 finished with value: -0.05072851538088689 and parameters: {'scalers': 'robust', 'ratios': 'norm_ratio', 'imputers': 'none', 'n_estimators': 2900, 'learning_rate': 0.29378984965699373, 'max_depth': 4, 'min_child_weight': 1, 'subsample': 0.5, 'colsample_bytree': 0.6, 'colsample_bylevel': 0.5, 'reg_alpha': 0.23771303922595483, 'reg_lambda': 0.0009804236387700208, 'gamma': 4.3253048101751715e-05}. Best is trial 89 with value: -0.13316216059322425.
[I 2026-07-17 15:42:22,188] Trial 113 finished with value: -0.10151349626224333 and parameters: {'scalers': 'robust', 'ratios': 'norm_ratio', 'imputers': 'none', 'n_estimators': 2900, 'learning_rate': 0.28632447759114893, 'max_depth': 8, 'min_child_weight': 1, 'subsample': 0.5, 'colsample_bytree': 0.6, 'colsample_bylevel': 0.5, 'reg_alpha': 0.24823447299289028, 'reg_lambda': 0.004593837822302715, 'gamma': 0.0001588639770861306}. Best is trial 89 with value: -0.13316216059322425.
[I 2026-07-17 15:42:30,050] Trial 114 finished with value: -0.07858087713730627 and parameters: {'scalers': 'robust', 'ratios': 'norm_ratio', 'imputers': 'none', 'n_estimators': 2300, 'learning_rate': 0.21339312421851456, 'max_depth': 7, 'min_child_weight': 1, 'subsample': 0.5, 'colsample_bytree': 0.6, 'colsample_bylevel': 0.5, 'reg_alpha': 2.3180861206034002, 'reg_lambda': 0.017683133077797286, 'gamma': 4.347607310947391e-05}. Best is trial 89 with value: -0.13316216059322425.
[I 2026-07-17 15:42:35,112] Trial 115 finished with value: -0.03858548138775075 and parameters: {'scalers': 'robust', 'ratios': 'norm_ratio', 'imputers': 'none', 'n_estimators': 2350, 'learning_rate': 0.28201439453587945, 'max_depth': 4, 'min_child_weight': 3, 'subsample': 0.5, 'colsample_bytree': 0.6, 'colsample_bylevel': 0.5, 'reg_alpha': 2.078478669999888, 'reg_lambda': 0.0010913899099028296, 'gamma': 2.5792479171149562e-06}. Best is trial 89 with value: -0.13316216059322425.
[I 2026-07-17 15:42:41,799] Trial 116 finished with value: -0.033776269552526994 and parameters: {'scalers': 'robust', 'ratios': 'norm_ratio', 'imputers': 'none', 'n_estimators': 2900, 'learning_rate': 0.20072029260362198, 'max_depth': 4, 'min_child_weight': 3, 'subsample': 0.5, 'colsample_bytree': 0.6, 'colsample_bylevel': 0.6, 'reg_alpha': 2.4125774675605327, 'reg_lambda': 0.006064940145589687, 'gamma': 0.0010019512550603657}. Best is trial 89 with value: -0.13316216059322425.
[I 2026-07-17 15:42:48,855] Trial 117 finished with value: -0.036431485051763794 and parameters: {'scalers': 'robust', 'ratios': 'norm_ratio', 'imputers': 'none', 'n_estimators': 2900, 'learning_rate': 0.21117249724364492, 'max_depth': 4, 'min_child_weight': 1, 'subsample': 0.5, 'colsample_bytree': 0.6, 'colsample_bylevel': 0.6, 'reg_alpha': 2.2464634078277825, 'reg_lambda': 0.01859720194120178, 'gamma': 2.91613241091457e-06}. Best is trial 89 with value: -0.13316216059322425.
[I 2026-07-17 15:42:58,780] Trial 118 finished with value: -0.06951751842227358 and parameters: {'scalers': 'robust', 'ratios': 'norm_ratio', 'imputers': 'none', 'n_estimators': 2850, 'learning_rate': 0.21199433599329956, 'max_depth': 7, 'min_child_weight': 3, 'subsample': 0.5, 'colsample_bytree': 0.6, 'colsample_bylevel': 0.5, 'reg_alpha': 1.8187137052930082, 'reg_lambda': 0.019354416485893675, 'gamma': 4.749160466814949e-06}. Best is trial 89 with value: -0.13316216059322425.
[I 2026-07-17 15:43:07,372] Trial 119 finished with value: -0.06589838213631269 and parameters: {'scalers': 'robust', 'ratios': 'norm_ratio', 'imputers': 'none', 'n_estimators': 2400, 'learning_rate': 0.2107712312243826, 'max_depth': 7, 'min_child_weight': 3, 'subsample': 0.5, 'colsample_bytree': 0.6, 'colsample_bylevel': 0.5, 'reg_alpha': 1.7758808828301602, 'reg_lambda': 0.005047027817320316, 'gamma': 3.46503176462919e-06}. Best is trial 89 with value: -0.13316216059322425.
[I 2026-07-17 15:43:16,190] Trial 120 finished with value: -0.06954174656837289 and parameters: {'scalers': 'robust', 'ratios': 'norm_ratio', 'imputers': 'none', 'n_estimators': 2550, 'learning_rate': 0.21444097317236693, 'max_depth': 8, 'min_child_weight': 3, 'subsample': 0.5, 'colsample_bytree': 0.6, 'colsample_bylevel': 0.5, 'reg_alpha': 2.3354926456319, 'reg_lambda': 0.00012649585837383608, 'gamma': 2.9223269241480857e-06}. Best is trial 89 with value: -0.13316216059322425.
[I 2026-07-17 15:43:27,929] Trial 121 finished with value: -0.0705017307425947 and parameters: {'scalers': 'robust', 'ratios': 'norm_ratio', 'imputers': 'none', 'n_estimators': 2900, 'learning_rate': 0.21085502024292435, 'max_depth': 7, 'min_child_weight': 3, 'subsample': 0.5, 'colsample_bytree': 0.6, 'colsample_bylevel': 0.6, 'reg_alpha': 1.7754817723791094, 'reg_lambda': 0.005436514937622312, 'gamma': 5.2037057442639095e-06}. Best is trial 89 with value: -0.13316216059322425.
[I 2026-07-17 15:43:36,638] Trial 122 finished with value: -0.0647154405027444 and parameters: {'scalers': 'robust', 'ratios': 'norm_ratio', 'imputers': 'none', 'n_estimators': 2150, 'learning_rate': 0.20458154970546719, 'max_depth': 8, 'min_child_weight': 3, 'subsample': 0.5, 'colsample_bytree': 0.6, 'colsample_bylevel': 0.6, 'reg_alpha': 2.0597457971207516, 'reg_lambda': 0.00496623713109145, 'gamma': 4.160583118192566e-06}. Best is trial 89 with value: -0.13316216059322425.
[I 2026-07-17 15:43:38,403] Trial 123 finished with value: -0.02677475017510266 and parameters: {'scalers': 'robust', 'ratios': 'norm_ratio', 'imputers': 'mean', 'n_estimators': 2100, 'learning_rate': 0.22779394014455048, 'max_depth': 7, 'min_child_weight': 1, 'subsample': 0.5, 'colsample_bytree': 0.6, 'colsample_bylevel': 0.6, 'reg_alpha': 9.091750410852228, 'reg_lambda': 0.021246235319494357, 'gamma': 7.823832699301586e-06}. Best is trial 89 with value: -0.13316216059322425.
[I 2026-07-17 15:43:41,425] Trial 124 finished with value: -0.02756573569347507 and parameters: {'scalers': 'robust', 'ratios': 'norm_ratio', 'imputers': 'mean', 'n_estimators': 2150, 'learning_rate': 0.23296867746718225, 'max_depth': 7, 'min_child_weight': 1, 'subsample': 0.5, 'colsample_bytree': 0.6, 'colsample_bylevel': 0.5, 'reg_alpha': 8.59017617493816, 'reg_lambda': 0.01953502645260671, 'gamma': 6.0433857379847705e-06}. Best is trial 89 with value: -0.13316216059322425.
[I 2026-07-17 15:43:50,106] Trial 125 finished with value: -0.1034070621553723 and parameters: {'scalers': 'robust', 'ratios': 'norm_ratio', 'imputers': 'mean', 'n_estimators': 2050, 'learning_rate': 0.22593211461926987, 'max_depth': 7, 'min_child_weight': 1, 'subsample': 0.5, 'colsample_bytree': 0.6, 'colsample_bylevel': 0.5, 'reg_alpha': 1.3049795530966077, 'reg_lambda': 0.009333591593496941, 'gamma': 1.1250018969704834e-05}. Best is trial 89 with value: -0.13316216059322425.
[I 2026-07-17 15:44:00,321] Trial 126 finished with value: -0.11847062247411702 and parameters: {'scalers': 'robust', 'ratios': 'norm_ratio', 'imputers': 'mean', 'n_estimators': 2050, 'learning_rate': 0.2264939458965122, 'max_depth': 8, 'min_child_weight': 1, 'subsample': 0.5, 'colsample_bytree': 0.6, 'colsample_bylevel': 0.5, 'reg_alpha': 1.2547067607123021, 'reg_lambda': 0.00012268171624546992, 'gamma': 6.807861276336991e-06}. Best is trial 89 with value: -0.13316216059322425.
[I 2026-07-17 15:44:11,490] Trial 127 finished with value: -0.17845265394174029 and parameters: {'scalers': 'robust', 'ratios': 'norm_ratio', 'imputers': 'none', 'n_estimators': 2050, 'learning_rate': 0.415795684154342, 'max_depth': 8, 'min_child_weight': 1, 'subsample': 0.5, 'colsample_bytree': 0.6, 'colsample_bylevel': 0.5, 'reg_alpha': 1.0010922026752296, 'reg_lambda': 0.0343553436116641, 'gamma': 7.291848720689571e-06}. Best is trial 127 with value: -0.17845265394174029.
[I 2026-07-17 15:44:22,867] Trial 128 finished with value: -0.16615270075444089 and parameters: {'scalers': 'robust', 'ratios': 'norm_ratio', 'imputers': 'mean', 'n_estimators': 2150, 'learning_rate': 0.3853715200548988, 'max_depth': 8, 'min_child_weight': 1, 'subsample': 0.5, 'colsample_bytree': 0.6, 'colsample_bylevel': 0.5, 'reg_alpha': 1.011354632834404, 'reg_lambda': 0.03151446216658753, 'gamma': 0.00013939088154056925}. Best is trial 127 with value: -0.17845265394174029.
[I 2026-07-17 15:44:34,411] Trial 129 finished with value: -0.17730918209277569 and parameters: {'scalers': 'robust', 'ratios': 'norm_ratio', 'imputers': 'mean', 'n_estimators': 2150, 'learning_rate': 0.4015057945373383, 'max_depth': 8, 'min_child_weight': 1, 'subsample': 0.5, 'colsample_bytree': 0.6, 'colsample_bylevel': 0.5, 'reg_alpha': 1.0344339050323468, 'reg_lambda': 0.010054563369418302, 'gamma': 0.00013032114110365383}. Best is trial 127 with value: -0.17845265394174029.
[I 2026-07-17 15:44:38,862] Trial 130 finished with value: -0.03293046900740262 and parameters: {'scalers': 'robust', 'ratios': 'norm_ratio', 'imputers': 'mean', 'n_estimators': 2950, 'learning_rate': 0.3969984086481904, 'max_depth': 8, 'min_child_weight': 1, 'subsample': 0.6, 'colsample_bytree': 0.6, 'colsample_bylevel': 0.5, 'reg_alpha': 8.966688074004274, 'reg_lambda': 0.009633687737762261, 'gamma': 0.0001415826624466702}. Best is trial 127 with value: -0.17845265394174029.
[I 2026-07-17 15:44:55,368] Trial 131 finished with value: -0.16679638742517938 and parameters: {'scalers': 'robust', 'ratios': 'norm_ratio', 'imputers': 'none', 'n_estimators': 2950, 'learning_rate': 0.38883623950509394, 'max_depth': 8, 'min_child_weight': 1, 'subsample': 0.6, 'colsample_bytree': 0.6, 'colsample_bylevel': 0.5, 'reg_alpha': 0.9873093269708584, 'reg_lambda': 0.011726895510703337, 'gamma': 0.00013443418239167667}. Best is trial 127 with value: -0.17845265394174029.
[I 2026-07-17 15:45:18,956] Trial 132 finished with value: -0.1905697522941432 and parameters: {'scalers': 'robust', 'ratios': 'norm_ratio', 'imputers': 'none', 'n_estimators': 2950, 'learning_rate': 0.4129445716297744, 'max_depth': 10, 'min_child_weight': 1, 'subsample': 0.6, 'colsample_bytree': 0.6, 'colsample_bylevel': 0.5, 'reg_alpha': 0.9643706164988689, 'reg_lambda': 0.03673890089811439, 'gamma': 0.00013863754629425573}. Best is trial 132 with value: -0.1905697522941432.
[I 2026-07-17 15:45:30,887] Trial 133 finished with value: -0.16554766547530173 and parameters: {'scalers': 'robust', 'ratios': 'norm_ratio', 'imputers': 'mean', 'n_estimators': 2000, 'learning_rate': 0.42762561539983274, 'max_depth': 8, 'min_child_weight': 1, 'subsample': 0.6, 'colsample_bytree': 0.7, 'colsample_bylevel': 0.5, 'reg_alpha': 1.4155604485324393, 'reg_lambda': 0.011019924824126974, 'gamma': 0.00012240360592803758}. Best is trial 132 with value: -0.1905697522941432.
[I 2026-07-17 15:45:40,871] Trial 134 finished with value: -0.08892153419407962 and parameters: {'scalers': 'robust', 'ratios': 'norm_ratio', 'imputers': 'mean', 'n_estimators': 1950, 'learning_rate': 0.1399401586360223, 'max_depth': 8, 'min_child_weight': 1, 'subsample': 0.5, 'colsample_bytree': 0.7, 'colsample_bylevel': 0.5, 'reg_alpha': 1.060313181249494, 'reg_lambda': 0.009279336995088214, 'gamma': 0.00013040522438765296}. Best is trial 132 with value: -0.1905697522941432.
