[I 2026-07-17 16:29:01,459] Trial 180 finished with value: -1.9265930076739792 and parameters: {'scalers': 'robust', 'ratios': 'norm_ratio', 'imputers': 'median', 'n_estimators': 2800, 'learning_rate': 0.3955730291708114, 'max_depth': 7, 'min_child_weight': 1, 'subsample': 0.5, 'colsample_bytree': 0.5, 'colsample_bylevel': 0.5, 'reg_alpha': 0.09213454744245989, 'reg_lambda': 5.42802687982788, 'gamma': 0.019605149908279964}. Best is trial 159 with value: -3.054615200567047.
[I 2026-07-17 16:29:09,819] Trial 181 finished with value: -1.5974262264963777 and parameters: {'scalers': 'robust', 'ratios': 'norm_ratio', 'imputers': 'median', 'n_estimators': 2800, 'learning_rate': 0.4044099980402558, 'max_depth': 6, 'min_child_weight': 1, 'subsample': 0.5, 'colsample_bytree': 0.5, 'colsample_bylevel': 0.5, 'reg_alpha': 0.085194345328429, 'reg_lambda': 6.428989102952069, 'gamma': 0.02304704697594763}. Best is trial 159 with value: -3.054615200567047.
[I 2026-07-17 16:29:22,605] Trial 182 finished with value: -2.306032387005969 and parameters: {'scalers': 'robust', 'ratios': 'norm_ratio', 'imputers': 'median', 'n_estimators': 2800, 'learning_rate': 0.4039914939075378, 'max_depth': 8, 'min_child_weight': 1, 'subsample': 0.5, 'colsample_bytree': 0.5, 'colsample_bylevel': 0.5, 'reg_alpha': 0.09570432628382725, 'reg_lambda': 7.107650039115958, 'gamma': 0.021600197087680472}. Best is trial 159 with value: -3.054615200567047.
[I 2026-07-17 16:29:31,603] Trial 183 finished with value: -1.6582997702681697 and parameters: {'scalers': 'robust', 'ratios': 'norm_ratio', 'imputers': 'median', 'n_estimators': 2800, 'learning_rate': 0.4069792054630602, 'max_depth': 6, 'min_child_weight': 1, 'subsample': 0.5, 'colsample_bytree': 0.5, 'colsample_bylevel': 0.5, 'reg_alpha': 0.08795831463360246, 'reg_lambda': 17.483744796863398, 'gamma': 0.01643583499944653}. Best is trial 159 with value: -3.054615200567047.
[I 2026-07-17 16:29:39,996] Trial 184 finished with value: -1.6349660240800457 and parameters: {'scalers': 'robust', 'ratios': 'norm_ratio', 'imputers': 'median', 'n_estimators': 2800, 'learning_rate': 0.40075223716226477, 'max_depth': 6, 'min_child_weight': 1, 'subsample': 0.5, 'colsample_bytree': 0.5, 'colsample_bylevel': 0.5, 'reg_alpha': 0.26605099500070173, 'reg_lambda': 4.138975368674305, 'gamma': 0.011187909567598641}. Best is trial 159 with value: -3.054615200567047.
[I 2026-07-17 16:29:47,924] Trial 185 finished with value: -1.7220647693006907 and parameters: {'scalers': 'robust', 'ratios': 'norm_ratio', 'imputers': 'median', 'n_estimators': 2700, 'learning_rate': 0.41336115114640837, 'max_depth': 6, 'min_child_weight': 1, 'subsample': 0.5, 'colsample_bytree': 0.5, 'colsample_bylevel': 0.5, 'reg_alpha': 0.1384881180772457, 'reg_lambda': 4.943789300333843, 'gamma': 0.010258300991288827}. Best is trial 159 with value: -3.054615200567047.
[I 2026-07-17 16:29:50,442] Trial 186 finished with value: -0.26568194577495763 and parameters: {'scalers': 'robust', 'ratios': 'norm_ratio', 'imputers': 'median', 'n_estimators': 2700, 'learning_rate': 0.25098525714145625, 'max_depth': 6, 'min_child_weight': 1, 'subsample': 0.5, 'colsample_bytree': 0.5, 'colsample_bylevel': 0.5, 'reg_alpha': 9.191597640019456, 'reg_lambda': 5.155660540599002, 'gamma': 0.010161330876729336}. Best is trial 159 with value: -3.054615200567047.
[I 2026-07-17 16:29:58,232] Trial 187 finished with value: -1.1387955930409268 and parameters: {'scalers': 'robust', 'ratios': 'norm_ratio', 'imputers': 'median', 'n_estimators': 2700, 'learning_rate': 0.25372974060743464, 'max_depth': 6, 'min_child_weight': 1, 'subsample': 0.5, 'colsample_bytree': 0.5, 'colsample_bylevel': 0.5, 'reg_alpha': 0.12434057079502123, 'reg_lambda': 5.187436331604576, 'gamma': 0.010509465647956904}. Best is trial 159 with value: -3.054615200567047.
[I 2026-07-17 16:30:06,519] Trial 188 finished with value: -1.3643487844411284 and parameters: {'scalers': 'robust', 'ratios': 'norm_ratio', 'imputers': 'median', 'n_estimators': 2800, 'learning_rate': 0.32563633875868425, 'max_depth': 6, 'min_child_weight': 1, 'subsample': 0.5, 'colsample_bytree': 0.5, 'colsample_bylevel': 0.5, 'reg_alpha': 0.125536802585236, 'reg_lambda': 5.528220472986963, 'gamma': 0.012047844649665346}. Best is trial 159 with value: -3.054615200567047.
[I 2026-07-17 16:30:18,484] Trial 189 finished with value: -1.819421580819895 and parameters: {'scalers': 'robust', 'ratios': 'norm_ratio', 'imputers': 'median', 'n_estimators': 2700, 'learning_rate': 0.3247228350622463, 'max_depth': 8, 'min_child_weight': 1, 'subsample': 0.5, 'colsample_bytree': 0.5, 'colsample_bylevel': 0.5, 'reg_alpha': 0.243941626790134, 'reg_lambda': 3.8062977909696385, 'gamma': 0.013993487332891668}. Best is trial 159 with value: -3.054615200567047.
[I 2026-07-17 16:30:20,945] Trial 190 finished with value: -0.26760525591090034 and parameters: {'scalers': 'robust', 'ratios': 'norm_ratio', 'imputers': 'median', 'n_estimators': 2700, 'learning_rate': 0.32939528572231414, 'max_depth': 8, 'min_child_weight': 1, 'subsample': 0.5, 'colsample_bytree': 0.5, 'colsample_bylevel': 0.5, 'reg_alpha': 10.112652019327767, 'reg_lambda': 5.480560060950462, 'gamma': 0.010971654813921273}. Best is trial 159 with value: -3.054615200567047.
[I 2026-07-17 16:30:32,897] Trial 191 finished with value: -1.5214097039917307 and parameters: {'scalers': 'robust', 'ratios': 'norm_ratio', 'imputers': 'median', 'n_estimators': 2700, 'learning_rate': 0.23828287723053557, 'max_depth': 8, 'min_child_weight': 1, 'subsample': 0.5, 'colsample_bytree': 0.5, 'colsample_bylevel': 0.5, 'reg_alpha': 0.2962505984356888, 'reg_lambda': 3.8880327877704928, 'gamma': 0.010569913353614315}. Best is trial 159 with value: -3.054615200567047.
[I 2026-07-17 16:30:44,797] Trial 192 finished with value: -1.5396768090732973 and parameters: {'scalers': 'robust', 'ratios': 'norm_ratio', 'imputers': 'median', 'n_estimators': 2700, 'learning_rate': 0.251937449908346, 'max_depth': 8, 'min_child_weight': 1, 'subsample': 0.5, 'colsample_bytree': 0.5, 'colsample_bylevel': 0.5, 'reg_alpha': 0.15001438561130134, 'reg_lambda': 5.910921077648379, 'gamma': 0.01104459603091401}. Best is trial 159 with value: -3.054615200567047.
[I 2026-07-17 16:30:57,025] Trial 193 finished with value: -1.8691200855772239 and parameters: {'scalers': 'robust', 'ratios': 'norm_ratio', 'imputers': 'median', 'n_estimators': 2700, 'learning_rate': 0.3276554340197564, 'max_depth': 8, 'min_child_weight': 1, 'subsample': 0.5, 'colsample_bytree': 0.5, 'colsample_bylevel': 0.5, 'reg_alpha': 0.1259785131247625, 'reg_lambda': 5.6543781876294155, 'gamma': 0.013463117529161798}. Best is trial 159 with value: -3.054615200567047.
[I 2026-07-17 16:31:08,369] Trial 194 finished with value: -1.7281815302485837 and parameters: {'scalers': 'robust', 'ratios': 'norm_ratio', 'imputers': 'median', 'n_estimators': 2700, 'learning_rate': 0.3267711697789362, 'max_depth': 8, 'min_child_weight': 1, 'subsample': 0.5, 'colsample_bytree': 0.5, 'colsample_bylevel': 0.5, 'reg_alpha': 0.13655477663476578, 'reg_lambda': 3.1703711142404423, 'gamma': 0.013137555294096165}. Best is trial 159 with value: -3.054615200567047.
[I 2026-07-17 16:31:17,401] Trial 195 finished with value: -1.4657026115824057 and parameters: {'scalers': 'robust', 'ratios': 'norm_ratio', 'imputers': 'median', 'n_estimators': 2700, 'learning_rate': 0.31770930729413527, 'max_depth': 7, 'min_child_weight': 1, 'subsample': 0.5, 'colsample_bytree': 0.5, 'colsample_bylevel': 0.5, 'reg_alpha': 0.062264120725639756, 'reg_lambda': 3.2719566856359106, 'gamma': 0.015495304357621175}. Best is trial 159 with value: -3.054615200567047.
[I 2026-07-17 16:31:28,909] Trial 196 finished with value: -1.5651264201444282 and parameters: {'scalers': 'robust', 'ratios': 'norm_ratio', 'imputers': 'median', 'n_estimators': 2700, 'learning_rate': 0.339932966747102, 'max_depth': 8, 'min_child_weight': 1, 'subsample': 0.5, 'colsample_bytree': 0.5, 'colsample_bylevel': 0.5, 'reg_alpha': 0.13455989220341202, 'reg_lambda': 15.998378440621073, 'gamma': 0.03571319706152641}. Best is trial 159 with value: -3.054615200567047.
[I 2026-07-17 16:31:39,490] Trial 197 finished with value: -1.641553177627827 and parameters: {'scalers': 'robust', 'ratios': 'norm_ratio', 'imputers': 'median', 'n_estimators': 2700, 'learning_rate': 0.3317823876695183, 'max_depth': 8, 'min_child_weight': 1, 'subsample': 0.5, 'colsample_bytree': 0.5, 'colsample_bylevel': 0.5, 'reg_alpha': 0.06446083253719205, 'reg_lambda': 2.5057579432461607, 'gamma': 0.015579177085780629}. Best is trial 159 with value: -3.054615200567047.
[I 2026-07-17 16:31:51,515] Trial 198 finished with value: -1.6053638589371955 and parameters: {'scalers': 'robust', 'ratios': 'norm_ratio', 'imputers': 'median', 'n_estimators': 2750, 'learning_rate': 0.32260517834785835, 'max_depth': 8, 'min_child_weight': 1, 'subsample': 0.5, 'colsample_bytree': 0.5, 'colsample_bylevel': 0.5, 'reg_alpha': 0.13383593668267543, 'reg_lambda': 14.728153778179859, 'gamma': 0.03129453635822888}. Best is trial 159 with value: -3.054615200567047.
[I 2026-07-17 16:32:01,410] Trial 199 finished with value: -1.6213783281802951 and parameters: {'scalers': 'robust', 'ratios': 'norm_ratio', 'imputers': 'median', 'n_estimators': 2550, 'learning_rate': 0.3323586719216825, 'max_depth': 8, 'min_child_weight': 1, 'subsample': 0.5, 'colsample_bytree': 0.5, 'colsample_bylevel': 0.5, 'reg_alpha': 0.13133887202081573, 'reg_lambda': 2.2667612761394436, 'gamma': 0.0315999627573609}. Best is trial 159 with value: -3.054615200567047.
[I 2026-07-17 16:32:11,599] Trial 200 finished with value: -1.6300783763116962 and parameters: {'scalers': 'robust', 'ratios': 'norm_ratio', 'imputers': 'median', 'n_estimators': 2600, 'learning_rate': 0.33274650540029793, 'max_depth': 8, 'min_child_weight': 1, 'subsample': 0.5, 'colsample_bytree': 0.5, 'colsample_bylevel': 0.5, 'reg_alpha': 0.0730794909414089, 'reg_lambda': 2.7622258070242367, 'gamma': 0.03400369883040909}. Best is trial 159 with value: -3.054615200567047.
[I 2026-07-17 16:32:22,113] Trial 201 finished with value: -1.6238468275580022 and parameters: {'scalers': 'robust', 'ratios': 'norm_ratio', 'imputers': 'median', 'n_estimators': 2600, 'learning_rate': 0.32153480236789767, 'max_depth': 8, 'min_child_weight': 1, 'subsample': 0.5, 'colsample_bytree': 0.5, 'colsample_bylevel': 0.5, 'reg_alpha': 0.1328019590861295, 'reg_lambda': 2.489379883511333, 'gamma': 0.01576196855021393}. Best is trial 159 with value: -3.054615200567047.
[I 2026-07-17 16:32:35,091] Trial 202 finished with value: -1.9530918614166324 and parameters: {'scalers': 'robust', 'ratios': 'norm_ratio', 'imputers': 'median', 'n_estimators': 2750, 'learning_rate': 0.3296209488944811, 'max_depth': 8, 'min_child_weight': 1, 'subsample': 0.5, 'colsample_bytree': 0.5, 'colsample_bylevel': 0.5, 'reg_alpha': 0.06951652941308908, 'reg_lambda': 12.347030377097724, 'gamma': 0.017418271873489252}. Best is trial 159 with value: -3.054615200567047.
[I 2026-07-17 16:32:44,988] Trial 203 finished with value: -1.5584790508085633 and parameters: {'scalers': 'robust', 'ratios': 'norm_ratio', 'imputers': 'median', 'n_estimators': 2600, 'learning_rate': 0.3277289072291769, 'max_depth': 8, 'min_child_weight': 1, 'subsample': 0.5, 'colsample_bytree': 0.5, 'colsample_bylevel': 0.5, 'reg_alpha': 0.06442284630555892, 'reg_lambda': 2.2468145080341495, 'gamma': 0.03184317994420727}. Best is trial 159 with value: -3.054615200567047.
[I 2026-07-17 16:32:54,872] Trial 204 finished with value: -1.4869607161948242 and parameters: {'scalers': 'robust', 'ratios': 'norm_ratio', 'imputers': 'median', 'n_estimators': 2600, 'learning_rate': 0.31668590128316104, 'max_depth': 8, 'min_child_weight': 1, 'subsample': 0.5, 'colsample_bytree': 0.5, 'colsample_bylevel': 0.5, 'reg_alpha': 0.08373240135770046, 'reg_lambda': 1.8392348724830456, 'gamma': 0.01729458443734083}. Best is trial 159 with value: -3.054615200567047.
[I 2026-07-17 16:33:05,184] Trial 205 finished with value: -1.565537880817065 and parameters: {'scalers': 'robust', 'ratios': 'norm_ratio', 'imputers': 'median', 'n_estimators': 2600, 'learning_rate': 0.3174188103022045, 'max_depth': 8, 'min_child_weight': 1, 'subsample': 0.5, 'colsample_bytree': 0.5, 'colsample_bylevel': 0.5, 'reg_alpha': 0.20847522193620027, 'reg_lambda': 1.7327190251432731, 'gamma': 0.029618840249563044}. Best is trial 159 with value: -3.054615200567047.
[I 2026-07-17 16:33:16,055] Trial 206 finished with value: -1.4805176302976635 and parameters: {'scalers': 'robust', 'ratios': 'norm_ratio', 'imputers': 'median', 'n_estimators': 2600, 'learning_rate': 0.27322737417487025, 'max_depth': 8, 'min_child_weight': 1, 'subsample': 0.5, 'colsample_bytree': 0.5, 'colsample_bylevel': 0.5, 'reg_alpha': 0.24766220512421636, 'reg_lambda': 1.7967133451254769, 'gamma': 0.006975094406045445}. Best is trial 159 with value: -3.054615200567047.
[I 2026-07-17 16:33:28,256] Trial 207 finished with value: -1.7073538941422912 and parameters: {'scalers': 'robust', 'ratios': 'norm_ratio', 'imputers': 'none', 'n_estimators': 2600, 'learning_rate': 0.27931675752700236, 'max_depth': 8, 'min_child_weight': 1, 'subsample': 0.5, 'colsample_bytree': 0.5, 'colsample_bylevel': 0.5, 'reg_alpha': 0.24262076484416387, 'reg_lambda': 9.096407052198717, 'gamma': 0.007632086858131848}. Best is trial 159 with value: -3.054615200567047.
[I 2026-07-17 16:33:41,194] Trial 208 finished with value: -3.148219565312613 and parameters: {'scalers': 'robust', 'ratios': 'norm_ratio', 'imputers': 'median', 'n_estimators': 2600, 'learning_rate': 0.45527769521895556, 'max_depth': 8, 'min_child_weight': 1, 'subsample': 0.5, 'colsample_bytree': 0.5, 'colsample_bylevel': 0.5, 'reg_alpha': 0.213072510125171, 'reg_lambda': 8.360112369309112, 'gamma': 0.007731480067584058}. Best is trial 208 with value: -3.148219565312613.
[I 2026-07-17 16:33:55,926] Trial 209 finished with value: -2.970248445278215 and parameters: {'scalers': 'robust', 'ratios': 'norm_ratio', 'imputers': 'median', 'n_estimators': 2950, 'learning_rate': 0.424380149447514, 'max_depth': 8, 'min_child_weight': 1, 'subsample': 0.5, 'colsample_bytree': 0.5, 'colsample_bylevel': 0.5, 'reg_alpha': 0.23885466747290057, 'reg_lambda': 8.883662359234451, 'gamma': 0.008077193772013769}. Best is trial 208 with value: -3.148219565312613.
[I 2026-07-17 16:34:10,461] Trial 210 finished with value: -3.1397706248244894 and parameters: {'scalers': 'robust', 'ratios': 'norm_ratio', 'imputers': 'median', 'n_estimators': 2950, 'learning_rate': 0.4367377940467185, 'max_depth': 8, 'min_child_weight': 1, 'subsample': 0.5, 'colsample_bytree': 0.5, 'colsample_bylevel': 0.5, 'reg_alpha': 0.2272199801360923, 'reg_lambda': 10.181301400608195, 'gamma': 0.007634038440605155}. Best is trial 208 with value: -3.148219565312613.
[I 2026-07-17 16:34:23,471] Trial 211 finished with value: -0.2459805345540258 and parameters: {'scalers': 'robust', 'ratios': 'norm_ratio', 'imputers': 'none', 'n_estimators': 2950, 'learning_rate': 0.0005779899304889913, 'max_depth': 8, 'min_child_weight': 1, 'subsample': 0.5, 'colsample_bytree': 0.5, 'colsample_bylevel': 0.5, 'reg_alpha': 0.23832654351022456, 'reg_lambda': 8.255669325590716, 'gamma': 0.018041637026061083}. Best is trial 208 with value: -3.148219565312613.
[I 2026-07-17 16:34:37,932] Trial 212 finished with value: -2.956785661029335 and parameters: {'scalers': 'robust', 'ratios': 'norm_ratio', 'imputers': 'none', 'n_estimators': 2950, 'learning_rate': 0.42755273667679866, 'max_depth': 8, 'min_child_weight': 1, 'subsample': 0.5, 'colsample_bytree': 0.5, 'colsample_bylevel': 0.5, 'reg_alpha': 0.21891967541551918, 'reg_lambda': 8.734670666888189, 'gamma': 0.00759459278015069}. Best is trial 208 with value: -3.148219565312613.
[I 2026-07-17 16:34:49,792] Trial 213 finished with value: -2.596058366842002 and parameters: {'scalers': 'robust', 'ratios': 'norm_ratio', 'imputers': 'none', 'n_estimators': 2950, 'learning_rate': 0.43255794083089016, 'max_depth': 7, 'min_child_weight': 1, 'subsample': 0.5, 'colsample_bytree': 0.5, 'colsample_bylevel': 0.5, 'reg_alpha': 0.2647831162705913, 'reg_lambda': 8.337464881183138, 'gamma': 0.006756395834394375}. Best is trial 208 with value: -3.148219565312613.
[I 2026-07-17 16:35:01,668] Trial 214 finished with value: -2.5327247781471245 and parameters: {'scalers': 'robust', 'ratios': 'log_ratio', 'imputers': 'none', 'n_estimators': 2950, 'learning_rate': 0.42757075501533975, 'max_depth': 7, 'min_child_weight': 1, 'subsample': 0.5, 'colsample_bytree': 0.5, 'colsample_bylevel': 0.5, 'reg_alpha': 0.3341291034180541, 'reg_lambda': 9.288830023248773, 'gamma': 0.007722878108236188}. Best is trial 208 with value: -3.148219565312613.
[I 2026-07-17 16:35:13,554] Trial 215 finished with value: -2.4804542288010674 and parameters: {'scalers': 'robust', 'ratios': 'log_ratio', 'imputers': 'median', 'n_estimators': 2950, 'learning_rate': 0.4356143520306664, 'max_depth': 7, 'min_child_weight': 1, 'subsample': 0.5, 'colsample_bytree': 0.5, 'colsample_bylevel': 0.5, 'reg_alpha': 0.40938088527237104, 'reg_lambda': 7.470073997679301, 'gamma': 0.007644119613090179}. Best is trial 208 with value: -3.148219565312613.
[I 2026-07-17 16:35:28,394] Trial 216 finished with value: -3.2441776962886513 and parameters: {'scalers': 'robust', 'ratios': 'norm_ratio', 'imputers': 'median', 'n_estimators': 2950, 'learning_rate': 0.43600105981839604, 'max_depth': 8, 'min_child_weight': 1, 'subsample': 0.5, 'colsample_bytree': 0.5, 'colsample_bylevel': 0.5, 'reg_alpha': 0.37477760319834263, 'reg_lambda': 7.875904480407681, 'gamma': 0.006582878434694656}. Best is trial 216 with value: -3.2441776962886513.
[I 2026-07-17 16:35:29,345] Trial 217 finished with value: -0.24447041542086723 and parameters: {'scalers': 'robust', 'ratios': 'log_ratio', 'imputers': 'median', 'n_estimators': 2950, 'learning_rate': 0.495477072934434, 'max_depth': 8, 'min_child_weight': 1, 'subsample': 0.5, 'colsample_bytree': 0.5, 'colsample_bylevel': 0.5, 'reg_alpha': 0.3396025996999098, 'reg_lambda': 13.228842702378886, 'gamma': 13.254387348761268}. Best is trial 216 with value: -3.2441776962886513.
[I 2026-07-17 16:35:44,072] Trial 218 finished with value: -3.1346710414983066 and parameters: {'scalers': 'robust', 'ratios': 'norm_ratio', 'imputers': 'median', 'n_estimators': 2950, 'learning_rate': 0.43761355244904404, 'max_depth': 8, 'min_child_weight': 1, 'subsample': 0.5, 'colsample_bytree': 0.5, 'colsample_bylevel': 0.5, 'reg_alpha': 0.3582096797791762, 'reg_lambda': 7.663780637032761, 'gamma': 0.006727231232893029}. Best is trial 216 with value: -3.2441776962886513.
[I 2026-07-17 16:35:58,844] Trial 219 finished with value: -3.321160946427452 and parameters: {'scalers': 'robust', 'ratios': 'norm_ratio', 'imputers': 'median', 'n_estimators': 2950, 'learning_rate': 0.43387327799218134, 'max_depth': 8, 'min_child_weight': 1, 'subsample': 0.5, 'colsample_bytree': 0.5, 'colsample_bylevel': 0.5, 'reg_alpha': 0.3217931887032267, 'reg_lambda': 12.291989696624633, 'gamma': 0.006194403529686413}. Best is trial 219 with value: -3.321160946427452.
[I 2026-07-17 16:36:13,337] Trial 220 finished with value: -3.13641188130368 and parameters: {'scalers': 'robust', 'ratios': 'log_ratio', 'imputers': 'none', 'n_estimators': 2950, 'learning_rate': 0.443479550789069, 'max_depth': 8, 'min_child_weight': 1, 'subsample': 0.5, 'colsample_bytree': 0.5, 'colsample_bylevel': 0.5, 'reg_alpha': 0.33450683370706086, 'reg_lambda': 6.958425224018817, 'gamma': 0.00596381311842236}. Best is trial 219 with value: -3.321160946427452.
[I 2026-07-17 16:36:27,926] Trial 221 finished with value: -3.187193621851689 and parameters: {'scalers': 'robust', 'ratios': 'log_ratio', 'imputers': 'none', 'n_estimators': 2950, 'learning_rate': 0.44334890780777547, 'max_depth': 8, 'min_child_weight': 1, 'subsample': 0.5, 'colsample_bytree': 0.5, 'colsample_bylevel': 0.5, 'reg_alpha': 0.35221671726193987, 'reg_lambda': 7.118437513401687, 'gamma': 0.00637304989009359}. Best is trial 219 with value: -3.321160946427452.
[I 2026-07-17 16:36:42,555] Trial 222 finished with value: -3.5459848144268102 and parameters: {'scalers': 'robust', 'ratios': 'log_ratio', 'imputers': 'none', 'n_estimators': 2950, 'learning_rate': 0.4631514234329185, 'max_depth': 8, 'min_child_weight': 1, 'subsample': 0.5, 'colsample_bytree': 0.5, 'colsample_bylevel': 0.5, 'reg_alpha': 0.32192094969502033, 'reg_lambda': 7.0265660236544045, 'gamma': 0.006583954965628107}. Best is trial 222 with value: -3.5459848144268102.
[I 2026-07-17 16:36:57,976] Trial 223 finished with value: -2.099346407926053 and parameters: {'scalers': 'robust', 'ratios': 'norm_ratio', 'imputers': 'none', 'n_estimators': 2950, 'learning_rate': 0.45104068840046035, 'max_depth': 8, 'min_child_weight': 1, 'subsample': 0.7, 'colsample_bytree': 0.5, 'colsample_bylevel': 0.5, 'reg_alpha': 0.3188736121193375, 'reg_lambda': 12.125986762506658, 'gamma': 0.006891290869732018}. Best is trial 222 with value: -3.5459848144268102.
[I 2026-07-17 16:37:12,854] Trial 224 finished with value: -3.9906008398004587 and parameters: {'scalers': 'robust', 'ratios': 'log_ratio', 'imputers': 'none', 'n_estimators': 2950, 'learning_rate': 0.4611678392550088, 'max_depth': 8, 'min_child_weight': 1, 'subsample': 0.5, 'colsample_bytree': 0.5, 'colsample_bylevel': 0.5, 'reg_alpha': 0.2609061295366579, 'reg_lambda': 13.886227256572546, 'gamma': 0.0070469317009738235}. Best is trial 224 with value: -3.9906008398004587.
